headline,mainEntityOfPage,image,datePublished,dateModified,author,media_en,media_jp,str_count,body,images,external_links
漫画家・つげ義春が88歳で逝去（美術手帖）,https://news.yahoo.co.jp/articles/5712e74c694bfbbb4958f4ffad1a5ebc5c78fb83,https://newsatcl-pctr.c.yimg.jp/t/amd-img/20260327-00000007-btecho-000-1-view.jpg?exp=10800,2026-03-27T18:49:09+09:00,2026-03-27T18:49:09+09:00,美術手帖,btecho,美術手帖,438,漫画家のつげ義春氏が逝去した。つげ氏は昨年9月ごろより体調を崩しており、3月3日、東京都内の病院にて誤嚥性肺炎のため88歳で亡くなった。 つげ氏は1937年東京・葛飾区生まれ。子供のころからいくつものアルバイトを経験し、小学校卒業とともにメッキ工場に勤める。その後職を変わりながら、職業としてマンガ家をめざし、1955年に単行本『白面夜叉』で本格デビュー、貸本マンガや子供向け雑誌で活躍した。1965年から『ガロ』に作品を発表し注目を集める。独特な作風で知られ、作品集が刊行され続けている。 代表作に「ねじ式」「無能の人」「ゲンセンカン主人」「李さん一家」など。またエッセイ集として『つげ義春の温泉』（カタログハウス、2003／筑摩書房、2012）、『貧困旅行記』（晶文社、1991）、対談集として『つげ義春が語る 旅と隠遁』（筑摩書房、2024）などる。2020年に第47回アングレーム国際漫画祭特別栄誉賞受賞。2022年に日本芸術院会員に選出。2024年に旭日中綬章受章。,[],[]
「スープはいのち」（21_21 DESIGN SIGHT）開幕レポート。スープという「最小の食」から、生の根源を問い直す（美術手帖）,https://news.yahoo.co.jp/articles/84b6100892a2c046a0280986852feb8c16a17556,https://newsatcl-pctr.c.yimg.jp/t/amd-img/20260327-00000006-btecho-000-1-view.jpg?exp=10800,2026-03-27T17:01:49+09:00,2026-03-27T17:01:49+09:00,美術手帖,btecho,美術手帖,772,展示空間を横断する大屋根 スープという「最小の食」から、生の根源を問い直す 東京・六本木の21_21 DESIGN SIGHT で、企画展「スープはいのち」が開幕した。会期は8月9日まで。本展ディレクターを務めるのは、デザイナーの遠山夏未。 「スープ」と聞いて、私たちは何を思い浮かべるだろう。世界中で親しまれるこの料理は、土地によって様々な素材が用いられるが、共通点を挙げるならば、口にすることで誰もが「ホッと一息つける」ことではないだろうか。 遠山は、2003年にロシアや東欧を旅した際、唯一の温かな食事であった「スープ」に心身を支えられたという。さらにその旅路で、ルーマニアの農民たちがスープを口に運ぶ写真と出会い、生きることを分かち合うためのスープの存在を目の当たりにする。 以来、長年にわたりスープについて思考を巡らせてきた遠山は、それを料理としてのみならず、衣服や住まいといった「身体の外側の環境」と、食という「内側の環境」を、地続きの「身体を包む行為」として捉えるようになった。本展は、実体験から立ち上がったそのユニークな着眼点のもと、現代社会における衣食住を支える、原初的な感覚へと立ち返る試みとなっている。 参加作家は、和泉侃、ISSEY MIYAKE、veig、岡篤郎、岡本憲昭、加藤奈摘、 佐藤政人、志鎌康平、関口涼子、高橋孝治、田中義久、津田直、常山未央＋能作文徳、遠山夏未、長尾智子、NOTA&design（加藤駿介、加藤佳世子）、野村友里、林響太朗、UMA/design farm（原田祐馬、津田祐果）、山フーズ（小桧山聡子）。レシピ出展は、遠山夏未、長尾智子、野村友里、船越雅代、細川亜衣、山フーズ。テキスト出展は、有元利彦、今道友信、LTshop（松田沙織）、小池一子、早川茉莉ほか。 文・撮影＝三澤麦（編集部）,[],[]
揺らぐ世界のなかで開幕した「アート・バーゼル香港2026」。アジアに向かう視線と香港市場の現在地（美術手帖）,https://news.yahoo.co.jp/articles/f8e80113e7824039784b7a85886f8e6cff0ab091,https://newsatcl-pctr.c.yimg.jp/t/amd-img/20260327-00000005-btecho-000-1-view.jpg?exp=10800,2026-03-27T10:50:54+09:00,2026-03-27T10:50:54+09:00,美術手帖,btecho,美術手帖,1098,会場風景より、TARO NASUのブース 今年2月、カタールで初開催された「アート・バーゼル・カタール」 の熱気が冷めやらぬなか、アメリカとイスラエルによるイランへの攻撃を契機に中東情勢は急速に緊迫化し、世界は再び不安定な局面へと突入した。原油価格の高騰や輸送コストの上昇といった影響が広がるなか、アジア最大級のアートフェアである「アート・バーゼル香港」の2026年版が開幕した。 本年のアート・バーゼル香港には、41の国・地域から240のギャラリーが参加。開幕に先立ち、香港のローズウッド・ホテルで開催されたウェルカム・レセプションにおいて、アート・バーゼル チーフ・アーティスティック・オフィサー／グローバル・ディレクターであるヴィンチェンツォ・デ・ベリスは、「アート・バーゼル香港は、世界中のアート・バーゼルのなかでも独自の位置を占めている。アジアへのゲートウェイであると同時に、この地域の持つ深みや複雑さ、そしてダイナミズムを映し出す存在であり、国際的なネットワークを接続する重要な役割を担っている」と述べた。そのうえで今年のテーマとして、ローカルとグローバルの実践を横断的に結びつける「コネクティビティ」を掲げ、文化的・商業的エコシステムの接続を強調した。 再評価されるアジアのマーケット 今年3月に発表された「Art Basel and UBS Global Art Market Report 2026」 によれば、2025年の中国のアートマーケットは、不動産市場の低迷や消費者心理の悪化といった経済的要因を背景に、前年比1％増の約85億ドルとほぼ横ばいにとどまった。また、より国際志向の強い香港市場は、グローバルな不確実性の影響を受けやすい構造にあることも指摘されている。 こうした状況にもかかわらず、今年の香港のマーケットムードは総じて楽観的だ。その背景には、トランプ政権下のアメリカにおける政策や市場の不透明性が増すなかで、中国および香港の政治・経済環境が相対的に安定し、予測可能性を備えていると受け止められている点があるだろう。 この点について、アート・バーゼル香港ディレクターのアンジェル・シヤン＝ルー は「美術手帖」の取材に対し、「中東経由で渡航予定だった来場者がフライトの変更を余儀なくされるなどの影響はあった」としながらも、「多くのコレクターが最終的には来場した」と振り返る。そのうえで、「現在のアジアは比較的安定した状態にあり、このタイミングでアジアを訪れたり、投資や鑑賞の対象として注目する動きが強まっている」と指摘する。 文・撮影（＊を除く）＝王崇橋（編集部）,[],[]
「MoN Takanawa: The Museum of Narratives」 が開館へ。こけら落としとなる「ぐるぐる展—進化しつづける人類の物語」も開幕（美術手帖）,https://news.yahoo.co.jp/articles/791f791b61e47ad53e85c5eefb22b1192281614d,https://newsatcl-pctr.c.yimg.jp/t/amd-img/20260327-00000004-btecho-000-1-view.jpg?exp=10800,2026-03-27T09:55:35+09:00,2026-03-27T09:55:35+09:00,美術手帖,btecho,美術手帖,675,東京・港区のJR高輪ゲートウェイ駅と直結している「TAKANAWA GATEWAY CITY」。昨年オープンした本施設内に、地上6階地下3階の複合型ミュージアム「MoN Takanawa: The Museum of Narratives（以下、MoN Takanawa）」が新たに開館する。開館日が3月28日。 TAKANAWA GATEWAY CITYは、すでに開業している「リンクピラー1 NORTH／SOUTH」と、今回開業する「リンクピラー2」「MoN Takanawa」、そして住居棟の「TAKANAWA GATEWAY CITY RESIDENCE」で構成されており、このなかで「MoN Takanawa」は文化創造の拠点として「100年先へ文化をつなぐ」という目標を掲げている。館名の「MoN（モン）」には、「門」と「問」という2つの意味が重ねられ、多様な「物語」に触れることで生まれる「問」を起点に、未知の世界や自身の新しい可能性を開く「門」を来館者に提供することが目指すとされている。 総合プロデューサーを放送作家／脚本家の小山薫堂が、アーティスティック・ディレクターを内田まほろが務める。MoN Takanawaでは、年に2回、全館共通の「シーズンテーマ（＝問い）」を掲げ、国内外のパートナーと伝統、アート、テクノロジー、⾃然科学、エンターテインメントなど分野横断型のプログラムを展開する。9月まで掲げられるオープニングのシーズンテーマは「Life as Culture ― ⽣きるは、ブンカだ」。 文・撮影＝安原真広（編集部）,[],[]
「マリー・アントワネット・スタイル」が横浜美術館で8月より開催。国内唯一の開催となる世界巡回展（美術手帖）,https://news.yahoo.co.jp/articles/979acb7bbe0890d4e3e9bfe316bbdd9abdbfc69f,https://newsatcl-pctr.c.yimg.jp/t/amd-img/20260327-00000003-btecho-000-1-view.jpg?exp=10800,2026-03-27T09:55:32+09:00,2026-03-27T09:55:32+09:00,美術手帖,btecho,美術手帖,550,ヴィクトリア＆アルバート博物館（ロンドン）の展示風景 神奈川・横浜の横浜美術館 で、マリー・アントワネット（1755〜93）の革新性と人物像にせまる展覧会「マリー・アントワネット・スタイル」が開催される。会期は8月1日～11月23日。 オーストリア皇女マリー・アントワネットは、1770年に王太子妃としてフランスに嫁いだ。ルイ16世下のフランスにおいて、ファッションや織物産業の発展に多大な影響を与え、衣裳、インテリア、音楽、ライフスタイルに至るまで、シンプルで洗練された独自の趣向を国内外で流行させたことでも知られている。いっぽうで、その斬新なスタイルは贅沢の象徴とみなされ、フランス革命のなかで37歳にして処刑。波瀾万丈な人生を歩んだ。 本展は、ロンドンのヴィクトリア＆アルバート博物館（V&A）が企画した世界巡回展であり、国内では横浜美術館が唯一の開催場所となる。18世紀から現代まで人々を魅了し続けるアントワネットの「スタイル」を、ドレス、宝飾、家具、絵画、写真など約200点の作品を通して紐解く内容となる。また、V&Aの展示内容に国内所蔵の優品約20点を加えた、日本オリジナルの再編成が行われるという。V&Aの会場レポートは こちら（作品保護の観点から、出品内容はロンドンと異なる）。,[],[]
伊藤若冲、ゴーギャン、草間彌生が出展。静岡県立美術館で開館40周年記念展が開催（美術手帖）,https://news.yahoo.co.jp/articles/3e696e56acf77271db67d97d4e7539a654b2784b,https://newsatcl-pctr.c.yimg.jp/t/amd-img/20260327-00000001-btecho-000-1-view.jpg?exp=10800,2026-03-27T07:10:53+09:00,2026-03-27T07:10:53+09:00,美術手帖,btecho,美術手帖,731,静岡県立美術館で「開館40周年記念展 静岡県立美術館をひらく 7つの扉」が開催される。会期は4月25日～6月21日。 同館は、県議会100年事業の一環として1986年に設立。「風景の美術館」をうたい、日本・西洋の風景画を中心に2900点を超えるコレクションを築き、多彩な展覧会を開催してきた。開館40周年を記念する本展では、 狩野探幽、伊藤若冲、ポール・ゴーギャン、川村清雄、草間彌生をはじめ、コレクションから厳選した作品を手がかりに、美術の世界の広がりを探求する内容となる。 本展は7つの展示室が会場。同館館長の木下直之と学芸員5名よる共同キュレーションで構成される。 第1室「美術館とは何だろう」では、中世・江戸・明治の絵馬を中心に、神仏画なども紹介され、美術館とはそもそもどのような存在なのかについて考えさせる内容となる。また名古屋城下の様々な行事を記録した尾張藩士・猿猴庵（えんこうあん、本名：高力種信［こうりきたねのぶ］）による作品なども、「猿猴庵が案内する美術館以前の世界」コーナーで紹介される予定だ。 第2室「絵画のかたち、油絵の居場所」では、油絵の「かたち」に着目する。油絵は額縁におさめるもの、という考えは、明治以降に築かれた。本展示室では、「油絵には額縁」という近代絵画においては当然とされている考えについて再考するきっかけをつくり出す。 第3室「風景をあつめる」では、ポール・ゴーギャンなどの作品が紹介され、「風景画」について紐解く内容となる。風景画は、人が眺めた世界のすがたを、持ち運べる板やキャンバスに描くことで誕生し、住居や公共空間に飾られてきた。風景画を収集し研究してきたこれまでの歴史で、同館はどのような成果を蓄積したのだろうか。,[],[]
