headline,mainEntityOfPage,image,datePublished,dateModified,author,media_en,media_jp,str_count,body,images,external_links
連行される動画が拡散...米ラッパー、グラミー賞「大喜びスピーチ」直後の逮捕にネット同情（ニューズウィーク日本版）,https://news.yahoo.co.jp/articles/6266361e2ffb5cc6ced2e2d3a827e6b4fb7a108e,https://newsatcl-pctr.c.yimg.jp/t/amd-img/20240207-00010007-newsweek-000-2-view.jpg?exp=10800,2024-02-07T22:11:45+09:00,2024-02-07T23:30:41+09:00,ニューズウィーク日本版,newsweek,ニューズウィーク日本版,1245,\n＜グラミー賞でラップ部門の栄冠を手にしたキラー・マイクが、授賞式会場で手錠をかけられ連行される映像が公開された。2年前のアカデミー賞授賞式でビンタ事件を起こしながら逮捕されなかったウィル・スミスを引き合いに出すネットユーザーも＞\nキラー・マイク（2017年2月、米オークランド） Sterling Munksgard-Shutterstock\n4日に米ロサンゼルスのクリプト・ドットコム・アリーナで開催された音楽の祭典グラミー賞授賞式で、3冠を達成したラッパーのキラー・マイクが、受賞後に手錠をかけられ、会場から連行される姿がネットで拡散され、衝撃が広がっている。【千歳香奈子】\n【動画】「後ろ手に手錠」で大勢の警官に連行されるキラー・マイク 栄冠からの急転直下にネット衝撃\nグラミー賞授賞式のテレビ中継前に発表されるプレミア・セレモニーで、ラップ部門のアルバム賞や楽曲賞など3部門を受賞したキラーが、複数の警察官に囲まれ後ろ手に手錠をかけられて会場内を歩く動画をハリウッド・レポーター誌のクリス・ガードナー記者がX（旧ツイッター）に投稿。\n\n1万回以上リポストされるなど話題を呼び、2年前のアカデミー賞授賞式でビンタ事件を起こしながら逮捕されることなく主演男優賞を受賞して物議を醸したウィル・スミスに再び脚光が集まるなど逮捕の是非を巡る論議が巻き起こっている。\n\nロサンゼルス市警察は、口論による暴行に関連してキラーの身柄を拘束したことを認め、軽罪で逮捕・起訴したと発表。口論や暴行に関する詳細は明らかにしていないが、会場入りする際に進路を遮った警備員を殴り倒した容疑が持たれていると一部メディアは伝えている。\n\n＜喜び爆発からのすぐさま逮捕に同情の声も＞\n\nトラヴィス・スコットやドレイクら大物のライバルを制し、2003年以来21年ぶりとなるグラミー賞を受賞したキラーは、「年を取りすぎた、もう遅い、夢は叶わないとは言わせない」とスピーチして喜びを爆発させていた。その直後に急転直下で逮捕されたことに、ネットでは「狙ったようなタイミング」「そのタイミングで逮捕しなくてもいいのに」「最悪だ」と同情の声が寄せられている。\n\nまた、一部ユーザーからは「犯行の瞬間の映像がないキラーは逮捕されたのに、なぜ生放送中に暴力を振るったウィル・スミスは逮捕されなかったのだろう」と疑問の声も上がり、妻の容姿をジョークのネタにされたことに激高したウィルが、ステージに乱入してプレゼンテーターを務めたクリス・ロックを平手打ちした後も会場にとどまり、主演男優賞を受賞してスピーチした事件が蒸し返されている。\n\nキラーは翌5日、心配するファンや関係者に謝罪する声明を発表。「どこから中に入ればいいのか混乱があり、熱心すぎる警備員と遭遇した」と説明。一方で、報道されているような暴力行為はなかったと否定し、「身の潔白が証明されることをチームと私は確信している」と述べている。,['https://newsatcl-pctr.c.yimg.jp/t/amd-img/20240207-00010007-newsweek-000-2-view.jpg?pri=l&w=640&h=426&exp=10800'],"['https://news.yahoo.co.jp/articles/6266361e2ffb5cc6ced2e2d3a827e6b4fb7a108e/images/000', 'https://www.newsweekjapan.jp/stories/culture/2024/02/post-103651_1.php']"
米経済は堅調ー2％の「インフレ目標」達成も近く、FRBの「利下げ」でバイデン再選に追い風か（ニューズウィーク日本版）,https://news.yahoo.co.jp/articles/1e59cd9aa61fffbd351ce15caf30ae81fa0fe823,https://newsatcl-pctr.c.yimg.jp/t/amd-img/20240207-00010002-newsweek-000-1-view.jpg?exp=10800,2024-02-07T12:11:07+09:00,2024-02-07T12:11:07+09:00,ニューズウィーク日本版,newsweek,ニューズウィーク日本版,571,\n米大統領選挙に大きな影響を与えるといわれる米国の景気動向。それを左右する要因の一つがFRBの利下げのタイミングだ\n会見するパウエルFRB議長 GRAEME SLOANーSIPA USAーREUTERS\nFRBは1月31日、金利を現在の5.25～5.5％で据え置くことを決定した。これは、利上げサイクルが落ち着き、今年中に利下げが行われる可能性を示唆している。【オマール・モハメド】\n【写真】荒廃したデトロイトに残る住民のリアル\n利下げで借り入れコストが低下し、景気浮揚につながれば、再選を目指すバイデン米大統領の助けになるかもしれない。\n\nFRBは声明で、「経済成長は堅調で、雇用は依然として強く失業率も低い状態を保っている」\n\nとし、2％のインフレ目標達成に近づいていることも示唆。\n\nパウエル議長は会見で、\n\n「現在の引き締めサイクルがピークに達している可能性が高い」と述べた。\n\nFRBはインフレを慎重に見極めるとし、利下げ開始時期は言及しなかったものの、市場では5月に利下げが行われるとの観測が強まっている。\n\n今後数カ月で利下げが実施されれば、好調な米経済の勢いに拍車をかける可能性がある。\n\nそれは、経済運営能力に厳しい評価が付きまとうバイデンにとって、再選に向けた有利な材料となるだろう。,['https://newsatcl-pctr.c.yimg.jp/t/amd-img/20240207-00010002-newsweek-000-1-view.jpg?pri=l&w=640&h=426&exp=10800'],"['https://news.yahoo.co.jp/articles/1e59cd9aa61fffbd351ce15caf30ae81fa0fe823/images/000', 'https://www.newsweekjapan.jp/stories/world/2016/05/post-4980_2.php']"
年代物にもほどがある！ロシア軍の骨董さながらの装備写真に愛国者が激怒（ニューズウィーク日本版）,https://news.yahoo.co.jp/articles/370fbef3195ca4a05915a2bf3f99ebf487c3a0c0,https://newsatcl-pctr.c.yimg.jp/t/amd-img/20240207-00010006-newsweek-000-1-view.jpg?exp=10800,2024-02-07T20:11:56+09:00,2024-02-07T20:11:56+09:00,ニューズウィーク日本版,newsweek,ニューズウィーク日本版,1694,\n＜19世紀の機関銃や第一次大戦時のライフルなど、ロシア軍は骨董並みに古い武器を博物館から引っ張り出してウクライナの戦闘に使い始めた＞\nバンパイア攻撃ドローンを飛ばそうとするウクライナ兵。武器や弾薬ではウクライナもまた不足に苦しんでいる（2月2日、ザポリージャ） (Photo by Dmytro Smolienko/Ukrinform/Sipa USA)\nウクライナ侵攻開始からほぼ2年、ロシア軍とウクライナ軍の攻防は兵器の消耗戦と化すなか、ロシア軍は骨董品並みの古い兵器を投入している、とロシアの有力な軍事評論家は言う。【エリー・クック】\n【動画】遂に帝政ロシアまでタイムスリップしたロシア軍の惨めな装備品\nウクライナが西側同盟国に武器や弾薬の追加供与を求め続ける一方、戦争を積極的に支援するロシア人たちは、ロシア軍にもウクライナと同レベルの武器や弾薬を調達すべきだと呼びかけており、その声は日毎に大きくなっている。\n\n帝政ロシア時代の重機関銃や「第一次世界大戦当時のライフル銃」の画像は、ウクライナ侵攻を支持するロシア人の間に反発を引き起こした。その多くは親プーチン派で、来たる大統領選挙でもプーチン支持層の中核を形成している。\n\nクリミア侵攻当時から10年ウクライナで戦ってきたと主張する親ロシア派の兵士や軍事ブロガーのテレグラム・チャンネルによると、「ロシア軍は支給するものがなくなると、時代遅れの武器を使わせる」のが常。交換部品を入手できなくなる危機が迫っている、と述べた。\n\n■第一次大戦の兵器\n\n親プーチン派の著名な軍事アナリスト、ロスチスラフ・モクレンコは最近、ロシア軍は、第二次世界大戦の開始時点で「絶望的に時代遅れ」だった第一次世界大戦時のデグチャレフ機関銃や、1884年に発明されたマキシム機関銃を使った前例を指摘する。\n\n「ウクライナ軍と戦うロシア軍の兵士たちから、これらの古い武器を渡されたという話を聞いている」と、ロシアの愛国軍事ブロガー、「トパーズ」はテレグラムに書いた。「冗談じゃない。ウクライナ東部ドンパスでロシアが優勢だった2014年の戦いでは、1940年代のPTRD対戦車ライフルや1890年代のモシン・ナガン・ライフル、SKSセルフローディングカービンなどが盛んに使われた。だが、今は時代が違うし、機関銃の不足は早急に何とかしなければならない」\n\nウクライナ全土で繰り広げられた2年近い今回の戦争は、多大な人命の損失ももたらしたが、同時に小火器を含む大量の武器も犠牲となった。\n\nロシア、ウクライナともに旧式の武器を使用しているが、古いからといって必ずしもそれだけで有効性が低下するわけではない。\n\n「ある種の兵器は、非常に長い間使用されることがある。殺傷能力が変わらずに残るからだ」と、アメリカのシンクタンク、米海軍分析センターのサミュエル・ベンデットは指摘する。戦争の根本的な原理や戦術が変わらなければ、何十年も前の兵器が今も通用することはあるという。\n■年代物の武器の目撃増える\n「AK-47自動小銃は70年近く前のもので、ほとんど変わっていない。ブローニングM2重機関銃のようなシンプルなサブマシンガンや機関銃はいまだに使われている」。第二次世界大戦直後に開発されたT-55主力戦車がいまだに実戦で使われているのもそのためだ、と彼は言う。\n\n今年にはいってウクライナ軍は、兵士の1人がブローニングM2重機関銃でロシアの巡航ミサイルを迎撃することに成功したと発表した。ウクライナはまた、ロシアが頻繁に発射するイランのシャヘド神風ドローンを撃ち落とすのに、大口径の機関銃を広範囲に使用してきた。\n\nウクライナで使用するために、ロシアが旧ソ連時代に開発されたT-55を含む主戦闘戦車を博物館や保管庫から引っ張り出している、という報告は数多い。\n\nまた、ロシアがドネツク州アウディーイウカへの攻撃に第二次世界大戦前に製造されたトラックを使用しているとする公開情報もある。\nエリー・クック,['https://newsatcl-pctr.c.yimg.jp/t/amd-img/20240207-00010006-newsweek-000-1-view.jpg?pri=l&w=640&h=425&exp=10800'],"['https://news.yahoo.co.jp/articles/370fbef3195ca4a05915a2bf3f99ebf487c3a0c0/images/000', 'https://www.newsweekjapan.jp/stories/world/2024/02/post-103650.php']"
日本を衰退に追いやる「中抜き」経済を考える（ニューズウィーク日本版）,https://news.yahoo.co.jp/articles/b4048b3fdc48ce1d34773f8eec4e9b2386f7c1a8,https://newsatcl-pctr.c.yimg.jp/t/amd-img/20240207-00010003-newsweek-000-1-view.jpg?exp=10800,2024-02-07T15:32:30+09:00,2024-02-07T15:32:30+09:00,ニューズウィーク日本版,newsweek,ニューズウィーク日本版,2612,\n＜「事務部門の維持費」を効率化できれば、現場の収入も上げられ、人手不足の解消にも繋がる＞\n中間業者が入ればその分だけ事務部門の経費かさんでくる nampix/Shutterstock\n近年「中抜き」という言葉をよく耳にするようになりました。例えば、能登半島地震で避難をしている人に配られる弁当が、貧相な内容なので「中抜き」されているのではないか、という議論がありました。弁当といえば、コロナ禍の時期にビジネスホテルに強制隔離された入国者に配られる弁当も貧相だと問題になったことがあります。この時はハッキリと国が払う1日2700円の予算の中から、ホテル側が経費として700円を差し引いていたということが明るみに出ていました。\n【動画】上半身があらわになる女性も...ウォルマートで買い物客7人が大乱闘を繰り広げる\nコロナ禍の期間中は、例えば入国時の検疫に大量の人員が動員されたり、高額なPCR検査が大規模に実施されたりしましたが、これも非正規雇用者や医療従事者には国から直接報酬は払われませんでした。国はあくまで契約した派遣業者や場合によっては旅行代理店などに、まとまった支払いをするだけで、こうした法人が得る利益のことも「中抜き」だと非難されていました。\n\nより構造的なのは、今回2024年問題としてクローズアップされている、運送業や建設現場の問題です。トラック輸送の仕事は、ドライバーが直接荷主から報酬を受け取るのではなく、間に多くの中間業者が介在しており、ドライバーの報酬は低く抑えられています。建設現場での職人への報酬にも似た構造があります。\n\nまさに、日本経済は「中抜き」経済と言っても良さそうです。では、本来は生産者やサービス提供者に払われるべき報酬を減らし「中抜き」された利益はどこへ行くのかというと、中間業者の経営者やオーナーなどが「山分け」して豪華な生活をしているのではありません。\n\n■「事務部門の維持費」という固定費\n中間業者、例えばホテルのマネジメント会社、人材派遣業者、運送業者、ゼネコンや一次下請、問屋、商社などは、それぞれ企業としての体裁を維持しています。ですから、固定費として、毎月一定の費用を負担しています。その中でも、総務、経理、人事、営業管理、顧客管理、契約書管理などの事務部門は、一定の業務量があり、そうした部門を維持する費用は、景気の善し悪しにかかわらず負担しなくてはならない固定費となっています。\n\nこの構造、経済のあらゆる段階に「事務部門の維持費」という固定費がかかるために、現場の報酬が上がらない、これが「中抜き経済」の大きな問題点です。「中抜き」のカネが流れる先の事務部門も、決して豊かでないし、何よりも間接部門の事務作業だからといって定型的で楽な仕事ではありません。様式やハンコを伴う複雑な規則に縛られストレス満載の業務であることが多いと思います。制度の全体としては、人々を決して幸福にしてはいません。\n\n更にこれに加えて、近年では現場の人材不足という問題が出てきています。トラックドライバー、バスドライバー、建築現場の職人などの現場仕事では、極端な人手不足が指摘されており、このままでは社会が崩壊する瀬戸際に立たされています。このような現場における人手不足はやがて全産業に及ぶでしょう。\n\nということは、社会として改革の方向性はほぼ絞り込まれると思います。\n＜中間業者を限りなくゼロにすれば……＞\n本当の意味での付加価値を産まず、GDPへの貢献も薄い事務仕事はDXによって大幅に効率化すべきです。その上で多くの人材を現場へ回すとともに、中抜き経済を止めることで現場では大幅な賃金アップと労働時間削減を達成する、そのような方向です。\n\n効率化はDXにとどまりません。どの会社にもある会計、給与計算、在庫管理などは、業界や企業ごとに「自己流の事務スタイル」が確立していますが、これを標準化して自動化や外注化を進めるのです。DXと合わせて大幅な効率アップが期待できます。グレーゾーンを、個々の企業や業界が勝手に解釈してコストや納税額を削減し、そのことを隠すためにコソコソ紙で計算したり、社員がサービス残業したりというムダも追放できます。\n\nそのようにして、100人いた事務部門を10人に減らすことで、「中抜き」つまり中間業者を限りなくゼロにして、その分を上乗せして現場に支払うのです。同時に、そこで出てきた90人の人材を現場仕事に回して人手不足に対応することができます。\n\n現場仕事というのは、工場の生産ラインやドライバー、建築現場、観光のサービス現場などに加えて、高い付加価値を生み出すイノベーション関連の技術者、付加価値を伴う情報のマネジメント、工芸家、シェフ、一流のソムリエやコンシェルジュ、更には高付加価値農業や環境ビジネスなども含みます。これに伴って、ドライバーや職人の社会的・経済的地位を、工芸家やテック技術者と同等に上げてゆくことも必要だし、可能になってくると思います。\n\n■社会をどうやって誘導するか\n問題は、そのような方向へと社会をどのように誘導するかです。全体の設計としては、高い価値を生み出す現場仕事に見合う、専門職を育成する社会へとシフトする方向になると思います。教育が良い意味での職業教育になり、手に職をつけた若者を社会に送り出し、社会は専門職としてそのスキルを評価するような社会、つまり公平で流動的な労働市場が開かれた社会にするのです。\n\n成功の鍵は、現在、日本語による原本、様式、ハンコに囲まれた事務仕事に縛り付けられている人材を、やり甲斐と高収入を伴った専門職として価値を生む現場へとどうやって移すかです。解雇規制を緩和して痛み先行で進めるのは得策ではありませんし、何よりも社会を暗くします。そうではなくて、どんどん成功事例を作って、多くの人が安心して追随できるようなトレンドを生み出す作戦が必要と思います。最低でも収入倍増になるような政策が必要です。\n\nこのまま膨大な事務部門を維持しつつ、そのコストをまかなうために「中抜き」を続けて現場を疲弊させていては、日本の国内経済は衰退が加速するばかりです。今こそ、トレンドを転換するタイミングだと思われます。\n冷泉彰彦（在米作家）,['https://newsatcl-pctr.c.yimg.jp/t/amd-img/20240207-00010003-newsweek-000-1-view.jpg?pri=l&w=640&h=415&exp=10800'],"['https://news.yahoo.co.jp/articles/b4048b3fdc48ce1d34773f8eec4e9b2386f7c1a8/images/000', 'https://www.newsweekjapan.jp/stories/world/2024/02/7-107.php']"
