headline,mainEntityOfPage,image,datePublished,dateModified,author,media_en,media_jp,str_count,body,images,external_links
ブルーグラデーションが美しいG-SHOCK・BABY-Gの「イルクジ」コラボモデル（BCN）,https://news.yahoo.co.jp/articles/f1d09311a7e50e44d00342450cd260fbf4d26a66,https://newsatcl-pctr.c.yimg.jp/t/amd-img/20260615-00635438-bcn-000-5-view.jpg?exp=10800,2026-06-15T18:00:00+09:00,2026-06-15T18:00:59+09:00,BCN,bcn,BCN,954,コラボモデル「イルクジ」新作 カシオ計算機は、耐衝撃ウオッチ「G-SHOCK」と「BABY-G」の新製品として、イルカ・クジラと自然の素晴らしさを伝える活動に取り組む「ICERC Japan（アイサーチ・ジャパン）」とのコラボレーションモデル「GW-8202K」「GA-B2100KB」と「BGD-5650K」を6月12日に発売した。 【写真ギャラリー】 ●コラボモデル「イルクジ」新作 「G-SHOCK」2モデル・「BABY-G」1モデル 「Love The Sea And The Earth」というテーマのもと、これまで発売したアイサーチ・ジャパンとのコラボモデルは、「イルカ・クジラモデル」「イルクジ」の愛称で親しまれてきた。 新製品は、ICERC Japanの設立35周年を記念したスペシャルモデル。美しく広大な海を想起させるスケルトンのブルーグラデーションカラーと、深く澄んだ海の色合いをまとったデザインにより、手元を見るたびに豊かな自然への思いを呼び起こす。 G-SHOCKのベースモデルには、本格ダイバーズウオッチの「GW-8202」に加え、八角形フォルムとシンプルなデザインで人気の「GA-B2100」を採用。対してBABY-Gのベースモデルには、コンパクトなサイズ感で人気の電波ソーラーモデル「BGD-5650」を採用した。各モデルには、海を象徴する遊び心あるギミックを施しており、「GW-8202K」はLEDバックライト点灯時に液晶にクジラのシルエットが、「BGD-5650K」は元気に泳ぐイルカのシルエットが浮かび上がる。また、「GA-B2100KB」には、9時側の小針をクジラの形にデザインした。 共通の特徴として、バンドには「ICERC Japan」のロゴをプリントし、裏蓋には「Love The Sea And The Earth」のシンボルマークを刻印した。また、環境への配慮として、ベゼルやバンドの主な樹脂パーツにバイオマスプラスチックを使用し、パッケージもリサイクル素材を使用するなど、プロダクト全体を通して環境への思いやりを形にした。 価格は、GW-8202Kが8万5800円、GA-B2100KBが2万9150円、「BABY-G」のBGD-5650Kが2万4200円。,[],[]
7月1日から申請受付開始！ 町田市が高齢者向けスマホ購入助成（BCN）,https://news.yahoo.co.jp/articles/0fb6c3da81d50e2ea9d8cfaa4b7f44fa45dae059,https://newsatcl-pctr.c.yimg.jp/t/amd-img/20260615-00635430-bcn-000-3-view.jpg?exp=10800,2026-06-15T18:00:00+09:00,2026-06-15T18:00:59+09:00,BCN,bcn,BCN,1183,高齢者のスマートフォン購入助成（東京都町田市） 【家電コンサルのお得な話・301】 行政サービスのデジタル化が進む中、高齢者のスマートフォン（スマホ）利用を支援する取り組みが各地で進められている。総務省によると、スマホの保有率は全世帯では9割に上る一方、65歳以上では7割強にとどまるという。東京都は、スマホを持たない人にはデジタルサービスを十分に提供できず、行政サービスに差が生じる可能性があるとの考えを示している。こうした状況を踏まえ、東京都では2025年度から高齢者向けの購入支援を実施している。 【写真ギャラリー】 ●東京都独自施策 65歳以上の高齢者のスマホ購入を支援 さらに26年度には「高齢者のデジタルデバイド解消に向けたスマートフォン活用支援事業」として制度を拡充し、初めてスマホを購入する65歳以上の高齢者を対象に、区市町村を通じて上限3万円を補助する方針を示した。 この東京都の施策を踏まえ、町田市でも高齢者向けの購入助成を実施する。市ホームページによると、申請期間は7月1日から2027年1月31日までで、予算の上限に達した場合は終了となる。 対象となるのは、申請時点で町田市に住民票があり、申請期限の27年3月31日時点で満65歳以上の人。今回の制度の特徴は、購入費の助成だけでなく、活用支援も組み合わせている点だ。利用者は、7月1日以降に市が指定する店舗（町田市内にあるソフトバンク・ドコモ・au・楽天モバイルの各ショップ）でマイナンバーカードを読み取るNFC認証機能を搭載するスマホを初めて購入し、指定店舗が実施するスマホ教室を受講しなければならない。また、東京都公式アプリへの新規登録に加え、「東京都LINE公式アカウント」と「町田市LINE公式アカウント」の登録も条件となっている。 制度の目的として、高齢者のスマホ活用を支援し、イベントや自治体からのお知らせなどの情報収集やコミュニケーションの充実を図ることで、生活の質の向上に貢献するとしている。 町田市では、スマホは災害時の情報収集や行政情報の受信など、さまざまな場面で活用されている。町田市の取り組みは、高齢者がそうした情報環境を利用しやすくするための支援策の一つだといえる。 このような施策は、自治体によって制度の有無や対象条件、申請方法が異なる。本人はもちろん、条件を満たす高齢の家族がいる人も、自分の住む自治体で同様の制度が実施されているか、自治体のウェブサイトなどで確認しておきたい。（堀田経営コンサルタント事務所・堀田泰希） ■Profile 堀田泰希 1962年生まれ。大手家電量販企業に幹部職として勤務。2007年11月、堀田経営コンサルティング事務所を個人創業。大手家電メーカー、専門メーカー、家電量販企業で実施している社内研修はその実践的内容から評価が高い。,[],[]
「ニコンダイレクト」限定オリジナルグッズ　Tシャツ・トートバッグなど（BCN）,https://news.yahoo.co.jp/articles/54ae189708882f8f35615bc75d5e0073c2ce8bc7,https://newsatcl-pctr.c.yimg.jp/t/amd-img/20260615-00635443-bcn-000-3-view.jpg?exp=10800,2026-06-15T17:30:00+09:00,2026-06-15T17:30:59+09:00,BCN,bcn,BCN,670,新たに発売するニコン公式グッズ（ニコンダイレクト限定） ニコン子会社のニコンイメージングジャパンは、公式オンラインショップ「ニコンダイレクト」限定でTシャツ・トートバッグなどのオリジナルグッズを発売する。 【写真ギャラリー】 ●「ニコンらしさ」を感じられるオリジナルグッズ 異なるデザインテーマで展開 「撮影以外の場面でもニコンの世界観を感じて楽しんで欲しい」という想いから、「ベーシック」「ヘリテージ」「クラフトマンシップ」の三つのテーマで企画・製作した。 「Since 1917 Nikon」のロゴが入った「ベーシック」では、日常に寄り添うブランドでありたいという想いを込め、「FM2 ＆ Zf」のイラストをあしらった「ヘリテージ」では、ニコンの歴史を象徴するモチーフを採用することでブランドの伝統を表現した。また、「NIKKOR Z 70-200mm f／2.8 VR S IIレンズ構成図」をデザインした「クラフトマンシップ」では、ニコンが培ってきた光学技術やプロダクトの魅力に焦点を当て、ものづくりへのこだわりを表現している。 第一弾アイテムは、Tシャツ、トートバッグ、タオルハンカチ、ステッカーの4種類。いずれも6月19日から3週にわたり、順次発売予定。7月以降も新たなアイテムの追加を予定している。 価格は、「ベーシック／ヘリテージ／クラフトマンシップ」のTシャツ（M／L／LL）が各3800円、トートバックが各2200円、タオルハンカチが各1500円、「ベーシック」の「ニコンステッカー6種セット 2026A」が1200円。,[],[]
電気代58％カットと圧倒的な明るさ、20畳を照らす最強LED照明（BCN）,https://news.yahoo.co.jp/articles/a25efa763c08bb0e6d9d799529b86b83e0f0bc1c,https://newsatcl-pctr.c.yimg.jp/t/amd-img/20260615-00635436-bcn-000-3-view.jpg?exp=10800,2026-06-15T16:30:00+09:00,2026-06-15T16:30:59+09:00,BCN,bcn,BCN,768,ドウシシャ、蛍光灯と比較して電気代を58％削減可能な明るさ1万4000lmの20畳用LEDシーリングライトを発売 ドウシシャは5月中旬に、照明ブランド「Luminasave（ルミナセーブ）」から、省エネLEDシーリングライト「ルミナセーブ20畳調光・調色モデル」（LSV-B20DS、LSR-B20DS、LSA-B20DS、LST-B20DS）を発売した。公式オンラインショップ「ドウシシャマルシェ」での価格は2万2880円。 【写真ギャラリー】 ●部屋の隅まで明るい“ムラのない光”を実現 「ルミナセーブ20畳調光・調色モデル」は、ドウシシャ史上最高の明るさとなる、全光束1万4000lmの明るさを実現したLEDシーリングライト。光が空間全体に広がるため、20畳の広いリビングでも明るさのムラが抑えられ、すみずみまでしっかり照らしてくれる。 一般的な20畳用の蛍光灯と比較して、電気代を58％節約可能で、蛍光灯なら188Wで1年間に1万1656円かかっていた電気代が、「ルミナセーブ20畳調光・調色モデル」なら6839円の節約となる4817円まで抑えられる。 本体には、調光・調色機能だけでなく、常夜灯、おやすみタイマー、留守番タイマーといった便利な機能を備えており、付属の液晶画面搭載リモコンから動作状態がひと目でわかる。 さらに、取り付け部分を見やすくすることによって、位置合わせがしやすく、天井へスムーズに取り付けられるようになった。 なお、「ルミナセーブ20畳調光・調色モデル」は、日本マーケティングリサーチ機構がドウシシャを含む主要11社を対象に5月20日～29日の期間に実施した「2026年5月_LEDシーリングライト（20畳用）における市場調査」における、一般家庭用LEDシーリングライトの明るさで第1位を獲得している。,[],[]
マイクロストラテジー・ジャパン、カントリーマネージャーに古賀剛氏が就任（BCN）,https://news.yahoo.co.jp/articles/7b384c66ee6ba2301a81529f6c56a4c4862c3a8b,https://newsatcl-pctr.c.yimg.jp/t/amd-img/20260615-00215856-bcn-000-1-view.jpg?exp=10800,2026-06-15T16:23:00+09:00,2026-06-15T16:23:00+09:00,BCN,bcn,BCN,211,古賀 剛・カントリーマネージャー マイクロストラテジー・ジャパンは6月15日、古賀剛氏がカントリーマネージャーに就任したと発表した。 古賀氏は、ASCジャパンの副社長や社長を歴任したほか、2018年1月からは、ベリントシステムズジャパンの代表取締役社長兼APACヴァイスプレジデントを務めた。 またマイクロストラテジー・ジャパンは7月1日に、本社オフィスを東京都港区の「赤坂グリーンクロス」へと移転することを明らかにした。,[],[]
TIS、米AWSと生成AIに関する戦略的協業契約を締結  安全な生成AI活用と業務変革を支援（BCN）,https://news.yahoo.co.jp/articles/c53458590ad647deaa316fd2f06c2c1dde1311f8,https://newsatcl-pctr.c.yimg.jp/t/amd-img/default.jpg?exp=10800,2026-06-15T16:19:00+09:00,2026-06-15T16:19:00+09:00,BCN,bcn,BCN,708,TISは6月15日、米Amazon Web Services（アマゾン・ウェブ・サービス、AWS）と2年間の生成AIに関する戦略的協業契約を締結したと発表した。TISは、生成AIの包括的支援を通じて、企業の安全な生成AI活用と実効性の業務変革に寄与する。 協業を通じて、TISがAI活用を戦略立案から実装・効果創出まで一貫して支援する「IntegriA」のAIサービス群と、AWSの「Amazon Bedrock AgentCore」をはじめとするAI基盤を組み合わせて提供する。顧客は、TISによる生成AI戦略策定から業務実装後の効果創出までの包括的支援を受けながら、生成AI基盤を安全かつ柔軟に選択できる。 導入後の運用定着まで伴走するため、ツール導入にとどまらず、業務プロセス改革や意思決定の高度化を実現するための基盤として生成AIを活用できるとした。 AWSのクラウド基盤上で、ミッションクリティカル領域に対応するセキュアな生成AI環境を構築する。機密情報を安全に扱うためのRAG技術やガードレール機能を組み込むほか、ガバナンスや監査対応も含めてサポートする。 ユーザー企業へのAI人材育成強化プログラムの提供も行う。AWSが認定する公式トレーニングプログラム「AWS Skill Builder」を社内に導入し、従業員の体系的な知識習得を促す。基礎レベルから応用レベルまで幅広いコースを提供し、従業員各自のキャリアプランとスキルレベルに合わせて教育を実施する。 加えて、TISのノウハウに基づく技術勉強会や、生成AIなどの先端技術を活用した開発体験ができるハンズオンセッションを年10回以上開催するとした。,[],[]
歩いた軌跡まで記録する、GPS×高度・気圧も見えるスマートウォッチ「FOSMET T20」（BCN）,https://news.yahoo.co.jp/articles/710c5e9d31a1f7d007c4aec3d208604a97c5254b,https://newsatcl-pctr.c.yimg.jp/t/amd-img/20260615-00635423-bcn-000-3-view.jpg?exp=10800,2026-06-15T16:00:00+09:00,2026-06-15T16:00:59+09:00,BCN,bcn,BCN,675,FOSMET T20 スマートウォッチの進化が加速する中、アウトドアや日常の移動を正確に記録する高機能モデル「FOSMET T20」が発売となった。GNSS測位モジュールを搭載し、山間部やビル街でも現在地を素早く把握。歩いたルートを記録し、ワンタップでスタート地点へ戻ることもできる、実用性の高いGPSウォッチだ。価格は9980円。 【写真ギャラリー】 ●登山でも安心、高度・気圧・方位をリアルタイム表示 FOSMET T20は、気圧計と地磁気センサーを内蔵し、標高・気圧・方角をリアルタイムで確認できるため、登山やトレッキングでも現在の状況を直感的に把握できる。気圧の急な低下を検知すると、悪天候の可能性を通知。天候が急変しやすい山の中でも、安全な判断をサポートする。 アウトドアだけでなく、日常の健康管理機能も搭載。ランニングや水泳、ヨガなど、100種類以上のスポーツモードに対応し、幅広いアクティビティをカバーする。心拍数や血中酸素、HRVのモニタリングを24時間行い、ストレス状態や睡眠の質を可視化。日々のコンディション管理にも役立つ。 長時間駆動も見逃せないポイントだ。GPS使用時で最大24時間、待機状態で最大45日というスタミナ性能によって、長時間の登山や旅行でもバッテリー切れの心配が少ない。 なお、発売記念として7月12日までの期間限定で2000円オフに加え、先着100人に10％オフクーポンも用意されている。アウトドア好きはもちろん、日常的にウォーキングを楽しむユーザーにも適しており、父の日のプレゼントとしても注目を集めそうだ。,[],[]
アクティファイ、バックアップデータを安全に遠隔複製できる新ツール（BCN）,https://news.yahoo.co.jp/articles/be90b0264b1f2287ef6c911ee4113a4a0b17022d,https://newsatcl-pctr.c.yimg.jp/t/amd-img/default.jpg?exp=10800,2026-06-15T15:27:00+09:00,2026-06-15T15:33:27+09:00,BCN,bcn,BCN,1356,アクティファイは6月15日、ActiveImage Protector専用のバックアップデータのレプリケーションツール「Actiphy ImageRelicator」をリリースすると発表した。 現在、ActiveImage Protectorのレプリケーションとしては、ポストバックアップ処理によるレプリケーション「Actiphy ImageCenter」を使ったバックアップファイルの処理（結合、レプリケーション、検証、起動確認）として実行できるが、「簡単な操作でわかりやすい、レプリケーションに特化したツールが欲しい」というユーザーの要望に応え、新たにActiphy ImageRelicatorをリリースした。 ランサムウェア攻撃の手口は日々多様化、巧妙化しており、昨今注目されている新型のAIを悪用されると、システムの脆弱性やセキュリティーホールを容易に見抜かれてしまう。どれほど高度なセキュリティー対策を講じても、攻撃を完全に防ぐことは困難となる。万が一、ランサムウェア感染が発生した場合、事業継続を支える「最後の砦」となるのがバックアップデータ。ActiveImage Protector用に開発されたActiphy ImageReplicatorを使うことで、ActiveImage Protectorのバックアップデータをリモートに複製し、安全・効率的に一元管理することができる。 主な特徴は、レプリケーション候補、レプリケーション済、タイムスタンプなどファイルの状態を操作画面から一目で確認できるほか、メンテナンス機能として個別のファイル削除や、ソース／保存先間でのファイルのコピーが可能。 レプリケーション先は、ローカルストレージ、NAS、ネットワーク共有に加え、各種クラウドストレージにも対応している。既存インフラを生かしながら、コスト・可用性・セキュリティー要件に応じた最適なデータ保護構成を柔軟に実現する。 レプリケーションタスクはフォルダーごとに設定できる。設定ダイアログで、ソースフォルダー、レプリケーション先を措定、即時実行に加え、週次・月次・曜日指定、レプリケーション対象設定などを柔軟に設定が可能。作成したジョブはジョブリストから編集、実行などを簡単に行える。 また、「最新世代のみ」「増分のみ」「常時同期」など、用途に応じたレプリケーション方式を選択できる。必要最小限のデータ転送によって、ネットワーク負荷を抑えつつ、高速かつ効率的な運用を実現する。 さらに、レプリケーション先のオブジェクトストレージサービス（AWS S3、Wasabi、Microsoft Azure）向けにオブジェクトロック機能に対応。バックアップイメージセットの一定期間の書き換えや削除を禁止できる。データの改ざんや消失を防止することで、バックアップデータを安全に保護する。 複数ユーザーアカウントの作成・管理によって組織単位での運用に対応。また、パスワード認証に加え二要素認証（2FA）を採用し、情報漏えい時の不正アクセスを防止し、高いセキュリティーを実現する。 なお、Actiphy ImageReplicatorは、ActiveImage Protectorユーザーには追加費用なしで提供する。,[],[]
指一本でログイン完了、指紋認証×NFC対応の最先端セキュリティーキーでパスワード不要時代へ（BCN）,https://news.yahoo.co.jp/articles/d01fc9df8eac3f1666d55bda513464a7ad894036,https://newsatcl-pctr.c.yimg.jp/t/amd-img/20260615-00635427-bcn-000-3-view.jpg?exp=10800,2026-06-15T15:00:00+09:00,2026-06-15T15:00:59+09:00,BCN,bcn,BCN,791,ACS PocketKey＋Bio 巧妙化するフィッシング詐欺やパスワード流出問題が深刻化する中、パスワードに頼らない認証ニーズが高まっている。こうした背景を受けて、指紋認証とNFCを搭載した最新セキュリティーキー「ACS PocketKey＋Bio」が登場した。宏福商事は、この次世代FIDO認証デバイスの販売をAmazonなどで開始。物理デバイスによる本人確認を手軽に実現し、オンラインセキュリティーの強化に新たな選択肢を提示する。 【写真ギャラリー】 ●指紋だけでログイン完了、パスワードレス認証を実現 ACS PocketKey＋Bioは、指紋センサーによる個人認証が特徴。最大10件の指紋登録に対応し、指をかざすだけで安全にログインが可能になる。さらに、FIDO2（CTAP2.1）やFIDO U2Fに対応しており、GoogleアカウントやApple IDといった主要サービスでも活用できる。パスワード入力やSMS認証コードに依存しない、快適で強固なセキュリティー環境を実現する。 USB Type-C接続に対応しているほか、NFCも搭載。PCはもちろん、スマートフォンなど、さまざまなデバイスで利用できる。対応OSはWindows、macOS、Linux、Android、iOSと幅広く、ブラウザーもChrome、Safari、Edge、Firefoxなどの主要環境を網羅。ビジネスから個人利用まで、幅広いシーンで活躍する。 企業向けの認証用途をはじめ、金融機関や行政、医療・保険といった高いセキュリティーが求められる分野での利用も想定。サイバー攻撃の高度化が進む中、物理的な認証キーの重要性は今後さらに高まるとみられている。ACS PocketKey＋Bioは、セキュリティーと利便性を両立した次世代デバイスとして、日常のログイン体験を大きく変える可能性を秘めている。,[],[]
PCA、企業向けビジネスイベント「PCAフェス2026」を東京・大阪で開催（BCN）,https://news.yahoo.co.jp/articles/3415352f06d6b18e2e72e79017287dc30e68f3cc,https://newsatcl-pctr.c.yimg.jp/t/amd-img/default.jpg?exp=10800,2026-06-15T14:10:00+09:00,2026-06-15T14:10:00+09:00,BCN,bcn,BCN,632,ピー・シー・エー（PCA）は、総務・人事・経理部門をはじめとした企業向けのビジネスイベント「PCAフェス2026」を、大阪で8月4日、東京で8月7日に開催する。 「PCAフェス」は、PCAが毎年開催しているビジネスイベント。今年は、「『働く』を、みんなの『幸せ』に。」をテーマに、東京・大阪の2都市で開催する。同社は、「『はたらく』に新しい価値を創出し、すべての人に豊かな時間と可能性を提供する」ことをパーパスに掲げ、働く人や企業が本業に集中できる環境づくりを支援してきた。 今年のイベントでは、バックオフィスの現場で進むAI活用や業務改善の具体例に加え、基幹業務クラウドサービス「PCA Arch」を中心に、財務経理・人事労務・販売管理をワンストップで支える最新の取り組みを紹介する。PCAと出展パートナー各社の知見とソリューションを通じて、「業務ノウハウの共有」「人的リソースの最適化」「業務のデジタル化」といった課題に対する実践的なヒントを届ける。 スペシャルゲストとして、東京・大阪両会場に高橋尚子氏（シドニー五輪女子マラソン金メダリスト）、東京会場には安野貴博氏（参議院議員・AIエンジニア）、堀埜 一成氏（ホリノMIコーポレーション 代表取締役社長、サイゼリヤ 元社長）、大阪会場には泉房穂氏（参議院議員・弁護士・前明石市長）が登壇する。 会場は、東京がザ・プリンス パークタワー東京、大阪がコングレコンベンションセンター。参加費は無料（事前登録制）。,[],[]
