headline,mainEntityOfPage,image,datePublished,dateModified,author,media_en,media_jp,str_count,body,images,external_links
＜プロフライフィッシャー＞杉坂研治が山岳渓流でセレクティブなイワナを攻略（釣りビジョン マガジン）,https://news.yahoo.co.jp/articles/483c906c836166a7c329f936352e24fe3b3d21b2,https://newsatcl-pctr.c.yimg.jp/t/amd-img/20250801-00010000-fvision-000-1-view.jpg?exp=10800,2025-08-01T18:03:23+09:00,2025-08-01T18:03:23+09:00,釣りビジョン マガジン,fvision,釣りビジョン マガジン,674,"ドライフライでイワナを狙っていく。が、ぱったり魚の反応が止まってしまう。果たして！？
新潟、富山、長野、岐阜と4県に跨る飛騨山脈を源とする山深き清流でフライフィッシング。数年ぶりに訪れたと言うのは、様々なフィールドを釣り歩く旅人、プロフライフィッシャーの杉坂研治。入渓後、100mほど釣り上がる間に5匹のイワナをキャッチし、順調かと思われたが、上流に入ると様子が一変。魚の反応が乏しい困難な状況を打破できるのか！？さあ！どうなる？波乱の山岳渓流！
【動画】山岳渓流を楽しむ杉坂ファミリー
めちゃくちゃ難しい！人スレのポイントでセレクティブなイワナをどう攻略する？
上流の「ここで釣れなきゃおかしい！」という絶好のポイントで魚の反応が得られない。見えるイワナは小型ばかり。浮いた小さなイワナはカゲロウで出てこない。予想もしていなかったセレクティブな状況に頭を悩ませる杉坂。上流は虫が遅いのか？はたまた多くの釣り人が入りスレているのか？

そんな中、フライのサイズを落とし小さなフライで粘ること10分！粘り勝ちで貴重な1匹をモノにする。そして捕食物を確認し、フライチェンジしていく。渋い状況が「何故なのか？」そして「どうすれば魚を引き出せるのか？」を読み取り、ラストのポイントでは怒涛の連続HIT！

杉坂の厳しい中での魚との駆け引きだけではなく、フライを操る技術、自然を観察する力、すべてを余すことなく見ていただきたい！
SHOHEY：3～4月は渓流釣り、5～10月の休みは全て鮎釣りに捧げ、全国各地を駆け巡る。アウトドアの団体を主催しイベントも開催",[],[]
