headline,mainEntityOfPage,image,datePublished,dateModified,author,media_en,media_jp,str_count,body,images,external_links
【漫画】突然、眠れない日々が続く→不調を知らせるサイン？…まさかのラストに「笑った」 作者に聞く（よろず～ニュース）,https://news.yahoo.co.jp/articles/26ad14b71a5365fa6eba5fca466c1cf13ee114de,https://newsatcl-pctr.c.yimg.jp/t/amd-img/20250101-11603430-yorozuns-000-1-view.jpg?exp=10800,2025-01-01T15:30:12+09:00,2025-01-01T15:30:12+09:00,よろず～ニュース,yorozuns,よろず～ニュース,877,寝つきが悪くなったことで「体の不調のサイン」と不安になるきくまきさん（きくまきさん提供） 充実した人生を過ごすためには良質な睡眠を取ることも欠かせない。しかし精神が安定しなかったり、生活環境が変わったりなどすることで、眠れなくなってしまうこともあるだろう。 【漫画】寝つきを良くするため色々やってみたが…話題作『ぐっすり寝る方法』～本編 主にコミックエッセイを手がけるきくまきさんの一作『ぐっすり寝る方法』は、作者のきくまきさんが突如として眠れなくなってしまう様子が描かれている。以前X（旧Twitter）にポストされると、2000件を超える「いいね」を獲得。意外な結末に頬を緩ませた読者が多かったようだ。 眠れなくなったきくまきさんは現状を改善するため、「朝起きたら太陽を浴びる」「コーヒーをカフェインレスにする」「湯船にしっかり浸かる」「寝る前にストレッチをする」「GABAチョコを食べる」をおこなったものの、それでも寝つきが良くならない。しかし、ある日、布団を冬仕様に変えたところ、今までの寝つきの悪さが嘘かのように、ぐっすりと眠りにつくのだった…。 同作を読んだ人からは、「取り越し苦労で良かった」「ラストの『寒かっただけ』が勢いがよくて笑った」などの声が。そこで、あっさりと眠れるようになったきくまきさんに、同作を手がけたきっかについて話を伺った。 ―同作を描いたきっかけを教えてください。 同じような理由で「寝つきが悪くなった人に届け！」という気持ちで描きました。 ―今回の寝つきが悪かった理由は「寒かっただけ」でしたが、普段から眠りに対して意識して行っていることはありますか？ 枕は良いものを買いました！ ―読者に向けてメッセージをお願いいたします。 漫画を楽しんでいただければ嬉しいです！ ◇ ◇ 寝つきの悪さはきくまきさんのように、些細なことを変えるだけで改善される場合もあるようだ。眠れない日々が続いた時は、試しに新しい寝具、もしくは良い枕を購入してみてはいかがだろうか。 (よろず～ニュース特約・カキMONO.1） よろず～ニュース,[],[]
ビヨンセ、13分パフォーマンスでギャラ31億円！娘と共演、NFLクリスマスのハーフタイム（よろず～ニュース）,https://news.yahoo.co.jp/articles/26fc1de86d27f646a345ee2adda65d4364bbe52c,https://newsatcl-pctr.c.yimg.jp/t/amd-img/20250101-11603425-yorozuns-000-1-view.jpg?exp=10800,2025-01-01T15:10:41+09:00,2025-01-01T15:10:41+09:00,よろず～ニュース,yorozuns,よろず～ニュース,527,ビヨンセ ビヨンセが、ネットフリックスの「NFLクリスマスゲームデー」でのハーフタイム・パフォーマンスで2000万ドル（約31億円）を稼いだと言われている。地元ヒューストンにあるNRGスタジアムで開催されたボルチモア・レイブンズ対ヒューストン・テキサンズ戦のハーフタイムで、ビヨンセはシャブージー、ポスト・マローン、そして娘ブルー・アイビー（12）とともに13分間パフォーマンスを行っていた。 【写真】まだ12歳!?共演した娘はほぼ同じ身長に！ デイリー・メール紙によると、ビヨンセはこの出演で1分あたり1000万ドル（約1億6000万円）以上を稼いだ計算となり、また、出演料として受け取ったと思われる推定2000万ドルという金額は、ソーシャルメディア契約なども含まれているという。「複数の人物」によると、この巨額はビヨンセとNetflix間でのより大きな契約の一環だという。 ビヨンセは、2019年にNetflixと3作品契約を結び、現在3分の2が完了、第1弾は、2019年のコーチェラ・フェスティバル出演を追ったドキュメンタリー作品で、ビヨンセは同パフォーマンスでも2000万ドルを稼いだと言われている。 （よろず～ニュース編集部） よろず～ニュース,[],[]
そこ無臭!? ついつい嗅いじゃうペットの匂い…柴犬の体部分別匂い分布図！肉球はポップコーン、耳はヤクルト（よろず～ニュース）,https://news.yahoo.co.jp/articles/b6efa60834cb6b79bf48bb9b513ece90c29c3138,https://newsatcl-pctr.c.yimg.jp/t/amd-img/20250101-11603422-yorozuns-000-1-view.jpg?exp=10800,2025-01-01T15:00:18+09:00,2025-01-01T15:00:18+09:00,よろず～ニュース,yorozuns,よろず～ニュース,796,うさぎと一緒に暮らす茶々丸 飼い犬の、部分別匂いをまとめた図がＸで話題になっている。 犬や猫、小鳥など、動物を飼った経験のある人は、ついペットの匂いを嗅いだ経験のある人も多いのでは。中でも猫は「猫吸い」と呼び、好んで香りを楽しむ人も多い。 【写真】そうだったのか!? 柴犬の匂い分布図 今回10万いいねを集めた投稿は「今年も残りわずかなので2024年一番想定外だったことを発表する」というハッシュタグとともに投稿された柴犬の茶々丸の体の部分別の匂いを解説した図。 臭いだろうと覚悟して嗅いだお尻が、なんと無臭だったという何とも平和なポストだ。他にも、耳はヤクルト、肉球分はポップコーンなど意外な香りであることが発覚。対して胸元は雑巾、股間はチーズなど、たとえ愛犬でも臭い部分は存在するらしい。飼い主であるペコ丸さんに話を聞いてみた。 ◇ ◇ ――部位別の感想は。 ペコ丸：一番好きなのは、ポップコーンの匂いがする肉球。以外にも顎がドブ臭くて笑いました。嗅がれてる時は、普段からクンカクンカしているので、大人しく寝こっろがっていました 嫌がる部分は特になさそうです。 お尻の穴は、臭そうだと思い勇気を持って嗅いだのですが、無臭で少し安心したと同時に、何故か期待はずれ感が湧きました。 ――ペットを飼う人は、なぜ嗅いでしまうんでしょうか。 ペコ丸：たまに茶々丸を嗅いでいたらそのまま枕替わりにして寝てしまってる時があるので、リラックス出来るのかもですね。 ◇ ◇ 投稿には「うちは肉球は枝豆」「うちの犬も耳はヤクルト」「うちは天下一品のこってり」「うちのチワワの口はおでん臭」など、思いがけず美味しそうな匂いが集まった。だがドブや雑巾の匂いへの共感と「どこの匂いも愛おしい」との反響も多く、愛犬は匂いを含めて可愛い、飼い犬への愛の深さが伺えた。 （よろず～ニュース特約・ゆきほ） よろず～ニュース,[],[]
故ダイアナ妃の元執事　ヘンリー王子に「工場の現場にいる方がいい」“手を汚したがらない”姿勢に疑問（よろず～ニュース）,https://news.yahoo.co.jp/articles/23ca89bd59b5c559986f96f82ea65f0e181cfa31,https://newsatcl-pctr.c.yimg.jp/t/amd-img/20250101-11603411-yorozuns-000-30245826-view.jpg?exp=10800,2025-01-01T14:20:46+09:00,2025-01-01T14:29:03+09:00,よろず～ニュース,yorozuns,よろず～ニュース,621,ヘンリー王子 故ダイアナ妃の元執事が、「工場の現場に戻ってほしい」とヘンリー王子に呼びかけている。ポール・バレル氏は、5年近く前に妻のメーガン妃と共に英王室を離脱し、現在はカリフォルニアでアーチー王子（5）とリリベット王女（3）と暮らしているヘンリー王子に、母であるダイアナ妃のように海外で慈善活動を続けて欲しいと願っているという。 【写真】アーチー王子、リリベット王女も皇室行事に出てほしい… スピン・ジーニーから同夫妻について尋ねられたバレル氏はこう答えている。「ヘンリー王子はかつて最も人気のある王族でしたが、今は違います。彼らはイギリス国民からの善意を使い果たしてしまいました。自分たちの力で生き残らなければなりません」「私は、彼らが持っているプラットフォームを使って、まだきれいな水がない国や、西側諸国では撲滅された病気に苦しむ国々に恩返しをするのを見たいですね。彼らが望むなら、大規模なプロジェクトがあるはずです」「なぜ彼らが自分の手を汚したがらないのか理解できない。彼らは自分たちの手を汚したくないように見えます」「ヘンリー王子、お母様が教えてくれたことを思い出してください。役員室にいるより、工場の現場にいるほうがいいのです。工場の現場に戻って、あなたとメーガン妃のプロフィールを使い何かしてください」「それが彼らの前進になるはずです」 （BANG Media International／よろず～ニュース） よろず～ニュース,[],[]
LINE世代はメールが苦手なのか!? 件名や本文がなく添付ファイルだけ…キャリコンに聞いた最近の学生事情（よろず～ニュース）,https://news.yahoo.co.jp/articles/1897ed45d1eba3bf596cd98349801fffbfc58b76,https://newsatcl-pctr.c.yimg.jp/t/amd-img/20250101-11603406-yorozuns-000-1-view.jpg?exp=10800,2025-01-01T14:00:05+09:00,2025-01-01T14:00:05+09:00,よろず～ニュース,yorozuns,よろず～ニュース,1629,会社の人事やキャリアカウンセラーが悩むビジネスマナーを知らない学生からのメール… ※画像はイメージです（YUTO@PHOTOGRAPHER/photoAC） 近年、就職活動をおこなう学生たちの間で、ビジネスコミュニケーションに関する新たな課題が浮上している。LINEやSNSを主なコミュニケーションツールとして育ってきた若者たちが、従来のビジネスマナーに戸惑う場面が増えているのだ。実際に学生の就活支援を行うキャリアコンサルタントのAさんに話を聞き、最近の若者事情を探ってみた。 【写真】SNSで怪しいなぁ→詐欺アカウント確認する方法「鶴見線の海芝浦駅に住んでいる」 Aさんによると、メールの基本的なマナーを理解していない学生が増加しているという。たとえば、件名を入れずに本文だけのメールを送信したり、添付ファイルだけを送ってくるケースが目立っているとのこと。さらに驚くべきことに、メールの文面で自己紹介や挨拶を省略し、いきなり本題に入る学生も少なくないそうだ。 ある事例では、Aさんが知らないメールアドレスから「履歴書」という名前のファイルだけが送られてきたという。メールアドレスを見る限り、どこかの会社から送られてきた内容だが、スパムメールの可能性もあるためAさんは添付ファイルは開けずに調査した。 すると、ある大学の学生が、自身の親戚の会社から送信したメールということが判明した。よく見るとCcに学生が大学で使用しているメールアドレスが書かれていたが、学籍番号の桁数が間違っており、すぐには本人だと分からなかったのだ。この学生は複数の会社に同様の履歴書メールを送信しており、学生課は大慌てで謝罪対応に追われたそうだ。 電話でのコミュニケーションにも課題が見られる。電話を受けた際に名乗らず、友人との会話のように話し始める学生が増えているという。「もしもし」の一言で始まり、「あ、この前の履歴書の話なんですけど…」といった具合に、相手が誰かも分からないまま本題に入ってしまうのだ。 さらに深刻なのは、電話を避ける傾向が強まっていることだ。Aさんが学生に電話をしても、素直に出てくれる学生はとても少ないらしい。しかも留守番電話サービスへの転送もされず、就職についての重要な連絡ができないまま就職機会を逃す学生もいるという。 企業とのやり取りにおいて、学生のレスポンスの遅さが問題になっているケースも多い。面接日程の調整などで、企業から候補日の提示があってもすぐに返信をしてくれる学生は少ないとのこと。そのため面接日程がスムーズに決められないのだ。 これらの問題についてAさんは、「LINEのスタンプでのやり取りに慣れているため、メールで文章を書いて返信することに抵抗がある学生が多い」と指摘する。この傾向は、ビジネスの場面で求められる迅速かつ明確なコミュニケーションとは相容れないものだ。 この状況の背景には、若者のコミュニケーション手段の変化がある。LINEやInstagramのDMが主流となり、メールや電話の使用頻度が激減しているのだ。調査によると、大学生の7割以上がメールよりもLINEを好んで使用しているという。 さらにスマートフォンの普及により、パソコンを持たない若者も増加している。その結果、メールアドレスを持っていても、自分のアドレスを覚えていない学生も少なくないという状況だ。 この傾向は今後さらに強まることが予想される。新人教育に関わる企業にとっては頭の痛い問題となるだろう。しかし、若者のコミュニケーション習慣を一方的に否定するのではなく、世代間のギャップを埋める努力が必要ではないだろうか。 企業側も、LINEなどのツールを活用したコミュニケーション方法を検討する必要があるかもしれない。一方で学生に対しては、ビジネスマナーの重要性を早い段階から教育することが求められる。 （よろず～ニュース特約ライター・夢書房） よろず～ニュース,[],[]
寿司じゃねえぞ！ソースやワサビ、紅生姜が添えられた「米国のおにぎり」が話題 現地で高まる人気（よろず～ニュース）,https://news.yahoo.co.jp/articles/5c21fa50a74cbdd400ccf675abdd6f0953d6bdb7,https://newsatcl-pctr.c.yimg.jp/t/amd-img/20250101-11603395-yorozuns-000-1-view.jpg?exp=10800,2025-01-01T13:00:19+09:00,2025-01-01T13:00:19+09:00,よろず～ニュース,yorozuns,よろず～ニュース,1065,画像はイメージです（akira_photo／stock.adobe.com） 日本の国民食として愛されるおにぎり。近年はアニメ『鬼滅の刃』の影響で海外でも「ONIGIRI」として認知が広がっているようだが、はたしてどのように受け止められているのだろうか。 【写真】おにぎりにソース？ワサビ？ガリ？ 今SNS上で話題になっているのは企業の研究者としてアメリカ滞在中のあひるさん（@5ducks5)が 「US人同僚から送られてきた画像とメッセージ。 『ちょっと前にうちの子にお前が作ってくれたオニギリが絵文字と同じ形でみんなで大笑いしたけど、今レストランで注文したらまた同じ形が出てきて大笑いしてる。メリークリスマス！』 なんだそのソースとワサビと紅生姜は。寿司じゃねぇぞオニギリは。」 と紹介した一枚の写真。 🇺🇸人同僚から送られてきた画像とメッセージ。 「ちょっと前にうちの子にお前が作ってくれたオニギリが絵文字と同じ形でみんなで大笑いしたけど、今レストランで注文したらまた同じ形が出てきて大笑いしてる。メリークリスマス！」 和食店で使われがちな黒い石皿に乗せられた三角おにぎり。その形は案外フツーなのだが、カラフルなソースがかかっていたりワサビとガリが添えられていたりと、日本人の感覚とは少し異なる扱いをされていることがうかがえる。 この投稿に対し、SNSユーザー達から 「なんだかオシャレな料理になっていますね。具は選べるのでしょうか？」 「この何でもかんでもソース付いてくる(またはかかっている)の、やめて～っていつも思います😅」 「🍙をオシャレな皿に乗せて一個10ドルぐらいで売るレストランを開店したら儲かりますかね」 など数々の驚きの声が。 また 「私も初🇺🇸時のSF居酒屋さんで 隣の白人マダムが🍙を頼んで出てきた後に スタッフに何か話してるなと思ったていたら まるで盛り塩並の大量のワサビをスタッフが持って来てマダムが満面の笑みで受け取って美味しそうに🍙に付けて食べてて(⊙⊙)!!」 「EU圏で販売されてるおにぎりは酢飯の場合が多数ありましてね....」 「わたしが働いてた和食レストランは、 おにぎりのテイクアウトにお醤油付けてた」といった情報提供も多数寄せられた。 アメリカでのおにぎり人気はコロナ渦後、急速に高まっており、ニューヨークではすでにおにぎり専門のフードトラックも登場しているようだ。おにぎりが今後世界でどのように広まってゆくのか楽しみだ。 （よろず～ニュース特約・中将タカノリ） よろず～ニュース,[],[]
占いを利用する内容「恋愛・結婚」を抑えた１位とは…種類で人気は「タロットカード」（よろず～ニュース）,https://news.yahoo.co.jp/articles/8405b5b99559a176797cdb59b084d3f7ce873974,https://newsatcl-pctr.c.yimg.jp/t/amd-img/20250101-11603388-yorozuns-000-1-view.jpg?exp=10800,2025-01-01T12:10:11+09:00,2025-01-01T12:10:11+09:00,よろず～ニュース,yorozuns,よろず～ニュース,583,画像はイメージです（ alexkich／stock.adobe.com） 恋愛や仕事、人生の選択…。古くから多くの人に親しまれ、日常生活のヒントや心の支えとして活用されている占い。スマートフォンアプリの占いアカデミアはこのほど、普段占いを受けている全国の20～60代男女101人を対象に行った「占い」に関する調査結果を公表した。 【調査結果】占ってほしい内容とは 「初めて占いに興味を持ったのはいつですか？」と質問したところ、「高校生時代」と答えた人が30.7％、次いで「中学生時代」が24.8％と続き、学生時代に占いに興味を持つ人が多いことがわかった。 「占いに興味を持ったきっかけは何ですか？（複数回答可）」では最も多かったのが「テレビ・雑誌などのメディアを見て」で51人、「友人・知人からの紹介」が42人、「家族の影響（親や祖父母など）」で24人となった。 「普段、主にどのような種類の占いを受けていますか？（複数回答可）」で最も多かった回答が「タロットカード」で53人。次いで「西洋占星術（12星座占いなど）」が32人、「手相」が28人と続いた。 「どのような内容について占いを利用しますか？（複数回答可）」に関して、トップは「仕事」で59人。次が「恋愛・結婚」で49人で、３番目は「金運・財運」で34人だった。 （よろず～ニュース調査班） よろず～ニュース,[],[]
移動速度アップや敵との遭遇率を変えられる！PCで遊べる「ドラクエ3」リメイク版で使用されるMODって何？（よろず～ニュース）,https://news.yahoo.co.jp/articles/3126654f39fbebb046a77e49674c2439bf64395e,https://newsatcl-pctr.c.yimg.jp/t/amd-img/20250101-11603384-yorozuns-000-1-view.jpg?exp=10800,2025-01-01T11:50:04+09:00,2025-01-01T11:50:04+09:00,よろず～ニュース,yorozuns,よろず～ニュース,1047,画像はイメージです 2024年11月15日、PCゲーミングプラットフォームSteamにて「ドラゴンクエストIII そして伝説へ…」（以下、ドラクエ3）のHD-2Dリメイク版が発売された。懐かしさと新しさが融合したこの作品は、多くのプレイヤーを魅了している。しかし発売からわずか数日で、ゲームシステムに変更を加える非公式MODが登場し、プレイヤーの間で賛否両論の声が上がっている。 【写真】現在に改めて話題を集めるドラゴンクエストIII そもそもMODとは「Modification」の略で、ゲームの開発元以外の第三者がゲームのデータやプログラムを改造したものを指す。PCゲームで使用されることが多く、グラフィックの向上やゲームプレイの改善、新しいコンテンツの追加などの目的で作成される。導入や利用、トラブル解決は自己責任で行う必要があり、ゲーム本体のアップデートによって使用不可能になる場合もある。 Steam版「ドラクエ3」の発売直後から、さまざまな非公式MODが登場している。例えば「Faster Overworld Traversal」は船の速度や移動手段の速度を上昇させるMODだ。また「Rebalanced Encounter Rate」を導入すると、敵に遭遇するエンカウント率が変更される。女性キャラ専用のアイテムを、男性キャラでも装備できるようにするMOD「No Equipment Restrictions」もある。 プレイヤーが感じた不便さや不満を解消するために作成されている一方で、いくつも導入するとプレイそのものが出来なくなる可能性もあるため、使用には慎重さが求められる。 非公式MODに対してプレイヤーの意見はさまざまだ。MOD擁護派は、プレイヤーが自由にゲーム体験をカスタマイズできることを重視しているようだ。Steam版「ドラクエ3」の場合は、1人プレイのオフラインゲームなので「誰にも迷惑をかけていない」といった意見も見られた。 一方、MOD批判派はゲームは開発者の意図に変更を加えるべきでないと考えているようだ。ゲームバランスを崩され、本来の魅力を損われることを危惧している。 Steam版「ドラクエ3」における非公式MODの登場は、プレイヤーの間で議論を巻き起こしている。もしMODに興味があったとしても、いきなりMODを使用するのではなく、まずはオリジナルの姿を味わってから検討するのが良いだろう。 （よろず～ニュース特約ライター・夢書房） よろず～ニュース,[],[]
