headline,mainEntityOfPage,image,datePublished,dateModified,author,media_en,media_jp,str_count,body,images,external_links
米海兵隊の男を傷害容疑で逮捕　中の町の飲食店で客の男性殴る　沖縄署（琉球新報）,https://news.yahoo.co.jp/articles/226e7327bfe53ed8c2eab043d6ed35df1b787244,https://newsatcl-pctr.c.yimg.jp/t/amd-img/20250101-00000009-ryu-000-1-view.jpg?exp=10800,2025-01-01T20:21:22+09:00,2025-01-01T20:21:22+09:00,琉球新報,ryu,琉球新報,344,"イメージ 沖縄署は1日、沖縄市上地（通称・中の町）の飲食店で、面識のない客の会社員男性（37）の左頬を拳で殴ってけがを負わせたとして、傷害容疑で米軍普天間基地所属の海兵隊伍長の男（23）を逮捕した。「記憶にない」と容疑を否認している。 【関連】沖縄県内の事件・事故 逮捕容疑は1日午前8時ごろ、男性の左頬を拳で1回殴り、加療日数不詳の打撲を負わせた疑い。 署によると、伍長が店の客らに絡んでいたため男性が注意したところ、伍長は男性に暴行を加えたという。伍長はその後、店を離れたが、付近路上で座り込んでいるところを、通報を受けて駆け付けた警察官に現行犯逮捕された。 伍長からは酒気帯び運転の基準値の約4倍のアルコールが検知されたという。 The Ryukyu Shimpo Co., Ltd",[],[]
年賀状配達式「一通一通、真心を込めて」　那覇中央郵便局　県民1人平均1.3通（琉球新報）,https://news.yahoo.co.jp/articles/9534904427fdfddd91cb0955df25931ec48ef28f,https://newsatcl-pctr.c.yimg.jp/t/amd-img/20250101-00000008-ryu-000-1-view.jpg?exp=10800,2025-01-01T19:11:22+09:00,2025-01-01T19:11:22+09:00,琉球新報,ryu,琉球新報,269,"那覇中央郵便局の年賀状出発式 日本郵便沖縄支社は1日午前、那覇市壺川の那覇中央郵便局で年賀状の元旦配達出発式を開催した。2025年元日に県内で配達される年賀郵便物は193万通で県民1人あたり約1.3通。昨年から109万通減少している。 配達員を代表し、那覇中央郵便局第二集配営業部の高良正司さんは「大切な年賀状を笑顔で一通一通丁寧に真心を込めて届けたい」とあいさつした。号令に合わせ配達員が出発した。県内で最も配達数が多い那覇中央郵便局管内では30万4000通を配達した。（玉城凪姫） The Ryukyu Shimpo Co., Ltd",[],[]
北部大闘牛、新年がっつり打撃戦　地元の錦大龍煌絆が本部富士破る　沖縄・今帰仁（琉球新報）,https://news.yahoo.co.jp/articles/4955660ef1bc2ea1adacb633a260f4cb057ea301,https://newsatcl-pctr.c.yimg.jp/t/amd-img/20250101-00000007-ryu-000-1-view.jpg?exp=10800,2025-01-01T18:50:51+09:00,2025-01-01T18:50:51+09:00,琉球新報,ryu,琉球新報,463,"シーの一番で両者一歩も引かずにつばぜり合う錦大龍煌絆（右）と本部富士＝１日、今帰仁村営闘牛場 【今帰仁】２０２５年の沖縄闘牛界の幕開けとなる「お正月だよ！！新春北部大闘牛大会」（北部闘牛組合主催、琉球新報社共催）が１日、今帰仁（なきじん）村営闘牛場で開かれた。初晴れの空の中、大勢の闘牛ファンが駆け付け声援を送った。 シーの一番では、２０２４年に３連勝を治めている地元今帰仁村の錦大龍煌絆（にしきだいりゅうこうな）と、実力牛との実戦経験がある本部富士（もとぶふじ）がにらみ合った。角を突き合わせて、互いに譲らない打撃戦が続いたが、錦大龍煌絆が１２分１２秒で本部富士を押しのけて勝利した。 読谷村から訪れ、自身も闘牛の世話をしているという伊波興也さん（４８）は「互いにやってやり返しての攻防戦が面白かった。力強い試合に新年の活力をもらった」と笑顔を見せた。闘牛が大好きだという息子の興太郎さん（８）は「今年の目標は世話をしている闘牛がチャンピオンになることだ」と力を込めた。 The Ryukyu Shimpo Co., Ltd",[],[]
沖縄戦の牛島司令官「辞世の句」再び掲載強行　陸自15旅団サイト（琉球新報）,https://news.yahoo.co.jp/articles/14fb5e071ec7944e8c473400ce60752de7ae21f9,https://newsatcl-pctr.c.yimg.jp/t/amd-img/20250101-00010002-ryu-000-2-view.jpg?exp=10800,2025-01-01T18:26:12+09:00,2025-01-01T18:49:18+09:00,琉球新報,ryu,琉球新報,1011,第15旅団のホームページ 陸上自衛隊第15旅団（那覇市）は1日、沖縄戦を率いた日本軍第32軍の牛島満司令官の辞世の句の掲載が問題になっていたホームページ（HP）を更新した。県民の批判を受け、辞世の句を大きな文字で目立たせていた画像を昨年10月末にいったん取り下げていたが、部隊史の画像をそのまま載せる形で異論の強い辞世の句を再掲載した。 【写真】HPに掲載された辞世の句 15旅団総務課は1日、見直しの理由について、「（辞世の句掲載に）さまざまな意見があった。2027年度までに（旅団から）師団になるにあたって県民の理解が不可欠だ。歴史的背景も知ってもらうため、当時の資料をそのまま示すことにした」と取材に説明した。 「日本軍と一体性はない」 また、日本軍と15旅団の連続性については、「あくまで自衛隊は日本軍とは別物で、一体性はない」と否定した。 問題になった辞世の句は、沖縄戦で住民を巻き込む「南部撤退」の命令を決定した牛島司令官が1945年6月18日、「決別電」と合わせて陸軍首脳に向けて発したもの。「秋待たで 枯れ行く島の 青草は 皇国の春に 甦らなむ」は戦場となった島が「皇国」の下でよみがえることを願う内容だ。 体験者ら批判、いったん取り下げ 15旅団は沿革を紹介するページに、前身の臨時第1混成群の桑江良逢郡長の1972年5月の訓示と共に「牛島軍司令官辞世」と書かれた画像を紹介していた。2024年6月の琉球新報の報道で表面化した後、沖縄戦の体験者や研究者を中心に批判が相次ぎ、同年10月末に「HPリニューアル」を理由にいったん取り下げていた。 今回のHP更新で、新たに掲載したのは、1972年度の「臨時第1混成群史」の桑江郡長の訓示部分。訓示の後に「秋待たで 枯れゆく島の青草は 御国の春に よみがえらなん」と書かれている。 15旅団総務課はHP更新にあたり、実際の訓示の際に辞世の句が詠まれたのかを確認したが、「はっきりしなかった」という。また、部隊史には「御国の春」と書かれていたのが、「皇国の春」と掲載していたのは、外部からの指摘を受けて、15旅団のHP担当者が2019年7月に変更していていたという。 15旅団の歴史認識を巡っては、牛島司令官の軍服などを飾ってきた那覇駐屯地内の広報資料館の展示内容も問題になっている。資料館はリニューアル中で、再開時期はまだ決まっていないという。（南彰） 琉球新報,[],[]
首里城・新春の宴が華やかに　「国王夫妻」登場、御座楽も　3日まで（琉球新報）,https://news.yahoo.co.jp/articles/88eceefa4f82b40f35693ed18209cf447d8b5acd,https://newsatcl-pctr.c.yimg.jp/t/amd-img/20250101-00000006-ryu-000-2-view.jpg?exp=10800,2025-01-01T17:50:52+09:00,2025-01-01T17:54:19+09:00,琉球新報,ryu,琉球新報,374,"琉球王朝時代の正月儀式を再現した「朝拝御規式」の一部＝１日午前、那覇市の首里城公園 新年の幕開けを華やかに彩る「新春の宴」が１日、那覇市の首里城公園で始まった。新春の宴は３日まで、琉球王国時代の国王や王妃のおでまし、出御（しゅつぎょ）の再現や、宮廷音楽の御座楽（うざがく）の演奏なども行う。 下之御庭ではこの日、琉球王国時代の正月儀式「朝拝御規式（ちょうはいおきしき）」の一部が再現された。国王役が祭壇に向かって焼香し、平和と豊穣を祈願。晴れ間が広がる中、家族連れや観光客が見守った。 県立芸術大学院１年の國場海里さん（２３）は「琉球芸能の宴」に出演し、「繁盛節」と「谷茶前」を踊った。「宮廷芸能ができた場所で踊れて貴重な体験だった。いずれは正殿が復活した時にはそこでも踊ってみたい」と話した。 The Ryukyu Shimpo Co., Ltd",[],[]
浦添の国道58号でバイクの男性死亡　元日未明、後方の車と衝突（琉球新報）,https://news.yahoo.co.jp/articles/b337dff93538583e63dc6babce61bbc73b7c7561,https://newsatcl-pctr.c.yimg.jp/t/amd-img/20250101-00000005-ryu-000-1-view.jpg?exp=10800,2025-01-01T16:30:52+09:00,2025-01-01T16:30:52+09:00,琉球新報,ryu,琉球新報,244,"パトカー（資料写真） １日午前５時２０分ごろ、浦添市城間の国道５８号で那覇市方面から宜野湾市向けに走行していた原付きバイクが、車線変更した際に後方から直進してきた普通乗用車と衝突した。バイクを運転していた浦添市の男性（５６）が衝突時にはね飛ばされ、同６時１６分に搬送先の本島南部の病院で死亡が確認された。 普通乗用車を運転していた米海兵隊員の男性（２２）にけがはない。浦添署が詳しい事故原因を調べている。 【関連】沖縄県内の事件・事故 The Ryukyu Shimpo Co., Ltd",[],[]
【初日の出 2025】戦後80年、沖縄の祈り　平和祈念公園　糸満　【どローカルリポート】　（琉球新報）,https://news.yahoo.co.jp/articles/19b2825b3a526d6cd99107c220642eaed8b7e2f6,https://newsatcl-pctr.c.yimg.jp/t/amd-img/20250101-00000004-ryu-000-2-view.jpg?exp=10800,2025-01-01T16:21:51+09:00,2025-01-02T11:47:14+09:00,琉球新報,ryu,琉球新報,521,"（写真：The Ryukyu Shimpo Co., Ltd） 戦争の犠牲者24万人余の名前が刻まれた「平和の礎」がある糸満市摩文仁の平和祈念公園で1日、初日の出を見ようと多くの人が集まった。日の出時刻の午前7時16分ごろには、水平線に厚い雲がかかっていたが、同40分ごろになると、水平線を覆う雲の上から太陽光が差し込み、歓声や拍手が上がった。温かな日差しに向かい、手を合わせ平和を祈る人の姿もあった。 【動画 初日の出2025】戦後80年、沖縄の祈り 平和祈念公園 糸満 【どローカルリポート】 豊見城市から訪れた女性は「親類の名が礎に刻まれていて、いつも初日の出を見た後に家族で見て帰る。平和を考える機会にもなっている」と話す。エイサーの奉納演武を終えた男性は「今年は健康第一でいきたい。戦後80年、沖縄戦の継承の意義などを考えていきたい」と話した。 1945年の沖縄戦は2025年のことし、80年の節目を迎えた。 沖縄戦の犠牲者の名が刻まれた平和の礎の設置から30年。恒久平和を願い24万人におよぶ刻銘者の生きた証を刻む平和の礎は、新春を告げる穏やかな日の光りに包まれる朝となった。 The Ryukyu Shimpo Co., Ltd",[],[]
260人、潮風と走り初め　沖縄・与那原新春マラソン大会　（琉球新報）,https://news.yahoo.co.jp/articles/8e89167ca0f3f19a6bbf7567719b934f4179728b,https://newsatcl-pctr.c.yimg.jp/t/amd-img/20250101-00000003-ryu-000-1-view.jpg?exp=10800,2025-01-01T15:30:55+09:00,2025-01-01T15:30:55+09:00,琉球新報,ryu,琉球新報,328,"与那原町新春マラソンで号砲と共に一斉に駆け出す参加者ら＝１日午前９時半、与那原町東浜の与那原パークゴルフ場前 第４３回与那原町新春マラソン大会（町教育委員会、町体育協会主催）が１日、町東浜の与那原パークゴルフ場前を発着点に開催された。穏やかな陽気に恵まれ、小学生から大人まで２６０人が参加した。３キロと５キロのコースに分かれ、海沿いの道を潮風に吹かれながら走り抜けた。 小学生最後の大会として参加した平良勇人さん（１２）は「昨日の夜あまり眠れなかったからコンディションは７０％くらい」とスタート直前には自信なさげに話したものの、１０分強の好タイムでゴールすると「来年も参加したい」と笑顔をはじけさせた。 The Ryukyu Shimpo Co., Ltd",[],[]
にぎわう初詣、糸満ハーレーの拝所「白銀堂」も行列　御神酒に地元から泡盛提供　沖縄（琉球新報）,https://news.yahoo.co.jp/articles/b3cb7a00c1fff2693c23106f1b1e1ecfc0c7915a,https://newsatcl-pctr.c.yimg.jp/t/amd-img/20250101-00000002-ryu-000-1-view.jpg?exp=10800,2025-01-01T13:21:22+09:00,2025-01-01T13:21:22+09:00,琉球新報,ryu,琉球新報,386,"熊手や絵馬を購入する初詣客ら＝１日、糸満市の白銀堂 2025年の新年、沖縄県糸満市の白銀堂は大晦日深夜から多くの初詣客で賑わい、元日の午後までほとんど行列が途切れなかった。 白銀堂は糸満ハーレーや大綱引など年中祭祀の中心となっている拝所。御神酒（おみき）として市内の酒造所が泡盛を提供するなど、地域住民や事業者が連携して毎年の初詣を盛り上げている。 運営を担う市商工会青年部白銀堂委員会の德嶺勝也委員長によると、今年は天気にも恵まれ、例年と比べても特に多くの初詣客が訪れているという。年々需要が高まっていることから、今年は熊手や絵馬などの数と種類も大幅に増やした。 德嶺委員長は「遠方からもきやすいように来年以降も工夫していきたい。白銀堂が持つ物語や黄金言葉（くがにことば）を次世代に伝えるきっかけになれば」と話した。 The Ryukyu Shimpo Co., Ltd",[],[]
黒柳徹子さん、戦争「絶対に防がねば」　辺野古新基地「残念」　独占インタビュー＜戦わない覚悟＞（琉球新報）,https://news.yahoo.co.jp/articles/c5c2d847c4e0c596a94ca90ce5f037f611702691,https://newsatcl-pctr.c.yimg.jp/t/amd-img/20250101-00010001-ryu-000-1-view.jpg?exp=10800,2025-01-01T12:36:41+09:00,2025-01-01T12:36:41+09:00,琉球新報,ryu,琉球新報,567,琉球新報のインタビューに応じた黒柳徹子さん（下村一喜氏撮影） 女優でユニセフ（国連児童基金）親善大使を務める黒柳徹子さんがこのほど、戦後80年を迎えるにあたり、琉球新報のインタビューに応じた。戦争体験が風化し、政治家から「戦う覚悟」など好戦的な発言が出ている状況に「みんなで絶対に防がないといけない」と危機感を示した。 【写真と詳報】「ああ、戦争のことを知らないんだ」 三波春夫さんからも「反戦」 先の大戦について、「沖縄は住民が地上戦に巻き込まれ、本当に気の毒でした」と振り返った。名護市の辺野古や大浦湾を埋め立て、強行される米軍新基地建設についても「沖縄の人たちにとってとても大切な海に基地をつくるのはとても残念だ」と語った。 「台湾有事」を念頭に「戦う覚悟」が求められていると政治家が発言していることについては、「みんなで絶対に防がないといけない」と強調した。そうした発言が出る背景として、戦争体験を語る人が減っていることを指摘し、「平和な状態が当たり前だと思っている人が多い。とても危険だ」と述べた。 「子どもたちがあんな目に遭う戦争は本当にやめた方がいい」と訴えた。大人の責務として、「戦争体験者の話を子どもたちに聞かせること、戦争の悲惨さを描いた映画などを見せることが必要だ」と戦争体験を継承する大切さを説いた。 琉球新報,[],[]
晴れやか初日の出　沖縄戦80年の朝、平和祈念公園で拍手と祈り（琉球新報）,https://news.yahoo.co.jp/articles/ce82b0e734c4682c85b3799dd30f4cd954121a17,https://newsatcl-pctr.c.yimg.jp/t/amd-img/20250101-00000001-ryu-000-3-view.jpg?exp=10800,2025-01-01T11:21:22+09:00,2025-01-01T15:27:56+09:00,琉球新報,ryu,琉球新報,374,"（写真：The Ryukyu Shimpo Co., Ltd） 那覇市から毎年訪れているという玉城圭介さん（40）は「無事に初日の出が見られた。家族の健康と景気が良くなってほしい」と話し、友人４人と訪れ、初めて沖縄で日の出を迎えた大阪出身の坂本大地さん（29）は「空が広く、太陽がよく見えてよかった」と晴れやかな表情を見せた。豊見城市から訪れた女性は「親類の名が礎に刻まれていて、いつも初日の出を見た後に家族で見て帰る。平和を考える機会にもなっている」と話す。 2025年のことし、1945年の沖縄戦から80年の節目を迎えた。沖縄戦の犠牲者の名が刻まれた平和の礎の設置からは30年。恒久平和を願い24万人におよぶ刻銘者の生きた証を刻む平和の礎は、新春を告げる穏やかな日の光に包まれる朝となった。 The Ryukyu Shimpo Co., Ltd",[],[]
「仮面ライダーガヴ」知念英和、夢は沖縄のヒーロー　主人公ショウマと共に成長（琉球新報）,https://news.yahoo.co.jp/articles/1e721ead5db33b0f1cf3fbdfc5d4cc333156e99a,https://newsatcl-pctr.c.yimg.jp/t/amd-img/20250101-00010000-ryu-000-1-view.jpg?exp=10800,2025-01-01T09:58:03+09:00,2025-01-01T09:58:03+09:00,琉球新報,ryu,琉球新報,387,新年の抱負を語る知念英和（喜瀨守昭撮影） テレビ朝日系で放送中の「仮面ライダーガヴ」で、主役の仮面ライダーガヴ／ショウマ役を演じる那覇市出身の俳優・知念英和（19）。オーディションでは観衆を前に「仮面ライダーになりたい」と宣言した。高校卒業後に上京、憧れの仮面ライダーに抜てきされた。 【写真と詳報】お菓子で変身、知念英和さん 特撮では、厳しい指導を受けることもある。「ショウマと一緒に成長している」「この1年はガヴを全力で演じきる」と知念。人気俳優の登竜門とも呼べる仮面ライダーシリーズからの躍進に燃える。 ちねん・ひでかず 2005年3月19日、那覇市出身。身長178センチ、22年から事務所に所属し、スターダストプロモーションのアーティスト集団「EBiDAN NEXT」で活動。23年から俳優として活動し、テレビ朝日「マルス―ゼロの革命―」での出演歴がある。 琉球新報,[],[]
