headline,mainEntityOfPage,image,datePublished,dateModified,author,media_en,media_jp,str_count,body,images,external_links
アルツハイマー型認知症 新薬の治療効果に期待 根本原因にアプローチ、現在は軽症患者が対象　医師語る（よろず～ニュース）,https://news.yahoo.co.jp/articles/c1a29dfd9d3643f39edff0c9a0928ec7611afb75,https://newsatcl-pctr.c.yimg.jp/t/amd-img/20250101-11603481-yorozuns-000-1-view.jpg?exp=10800,2025-01-01T22:00:06+09:00,2025-01-01T22:00:06+09:00,よろず～ニュース,yorozuns,よろず～ニュース,953,画像はイメージです（takasu／stock.adobe.com） 若いころと比較すると記憶力の低下を認めるのは誰でも仕方がないことですが、日常、社会生活に支障を来たす場合を認知症と言います。 【写真】ブルース・ウィリスの娘 認知症と闘う父との2ショ公開 認知症には、変性性認知症と脳血管性認知症があります。脳血管認知症とは、脳梗塞、脳出血などで、脳に器質的変化を伴う認知症です。変性性認知症とは、脳実質の変性によって起こる認知症です。変性性認知症には、アルツハイマー型認知症、レビー小体型認知症などがあります。 アルツハイマー型認知症は、認知症全体の7割弱を占めています。これに対する薬は、最近までは、神経伝達物質を出来るだけ壊れないようにする薬しかありませんでしたが、新薬が出現し治療効果が期待されています。 アルツハイマー型認知症は、脳にアミロイドという蛋白が蓄積してくることが原因の一つとされています。そのアミロイドを融解し、除去すると言われているのが新薬なのです。 多くの病院で治療が開始されたばかりで、効果に関してはこれからの報告になります。以前に使用されていた薬は症状の緩和、認知症の進行の予防程度に考えられていましたが、今回の薬は根本原因にアプローチをしますので大きな期待が寄せられています。 ただ、すべてのアルツハイマー型認知症の患者さんが治療の対象にあるとは限りません。軽症の患者さんだけが適応になります。患者さんの重症度の見極めるために、認知症がどのくらい進んでいるかのテストを受けます。 また、脳にアミロイドβが沈着していることも治療の条件の一つになります。PET検査で脳にアミロイドが沈着していることを調べたり、脳脊髄液検査を施行して脳にアミロイドが沈着していることを診断します。治療の適応であれば、2週間に一度、病院で1時間程度の点滴による治療を行います。 重篤な副作用の出現を防ぐために、定期的なMRIが必要です。現状では、治療のためのベッドの確保、そしてマンパワーが必要となるので病院によっては、治療待ちの患者さんがいる状態なのです。 ◆谷光利昭 兵庫県伊丹市・たにみつ内科院長。外科医時代を経て、０６年に同医院開院。診察は内科、外科、胃腸科、肛門科など。 よろず～ニュース,[],[]
年明け1分！声優・広瀬裕也が結婚発表【報告全文】お相手は「一般の方」（よろず～ニュース）,https://news.yahoo.co.jp/articles/b7dd7fc789bf97014460114ab2b73a39d3fc9b12,https://newsatcl-pctr.c.yimg.jp/t/amd-img/20250101-11603480-yorozuns-000-1-view.jpg?exp=10800,2025-01-01T21:54:48+09:00,2025-01-01T21:54:48+09:00,よろず～ニュース,yorozuns,よろず～ニュース,474,※画像はイメージです(fuyuko／stock.adobe.com) アニメ「SSSS.GRIDMAN」の響裕太役などで知られる声優・広瀬裕也が結婚したことが1日、分かった。広瀬が自身のX（旧ツイッター）に文書を掲載して報告した。 【写真】2024年最後の投稿は匂わせもなく笑顔だった 広瀬は年が明けたのとほぼ同時、1日の午前0時1分にXを更新。「皆様に大切なご報告があります。」とコメントして結婚報告の文書を掲載。全文は以下の通り。 ◇ ◇ 皆様へ この度、私事ではございますが、結婚いたしましたことをご報告させていただきます。 お相手は一般の方です。 これからも全力でお芝居に歌にバラエティーになんでも取り組んでいきたいと思います。 まだまだ未熟な私ですが、皆様への感謝の気持ちを忘れずに役者として日々精進して参ります。 今後とも、何卒よろしくお願い申し上げます。 2025年1月1日 広瀬裕也 ◇ ◇ フォロワーからは「おめでとう」コメントが殺到。「新年からいい話」とおめでたい話題を喜んでいた。 （よろず～ニュース編集部） よろず～ニュース,[],[]
大胆コスプレイヤー水那しおね　本領発揮の高出力新作「あなたから元気を奪い取ります」（よろず～ニュース）,https://news.yahoo.co.jp/articles/b6553e1465eca22343fde2c4a30ff813d0b5465f,https://newsatcl-pctr.c.yimg.jp/t/amd-img/20250101-11603478-yorozuns-000-1-view.jpg?exp=10800,2025-01-01T21:00:25+09:00,2025-01-01T21:00:25+09:00,よろず～ニュース,yorozuns,よろず～ニュース,510,水那しおねＤＶＤ「いっぱい愛して」（スパイスビジュアル）より コスプレイヤー、グラビアアイドルの水那しおね。このほど、都内で新作DVD「いっぱい愛して」（ラインコミュニケーションズ）の発売記念イベントを行った。 【写真】大胆衣装でイベントに登場した水那しおね セクシー過ぎるコスプレイヤーが高出力な演技を披露。「あなたから元気を奪い取ります」のキャッチコピー通りの内容に仕上がった。昨年8月に都内で撮影が行われ「彼氏と、彼女の友達を相手に私から誘惑しています。見てほしいシーンは制服で自撮りをしている場面は自分らしさが出ていると思います」と語った。 ベッドシーンでは制服から下着姿に着替えるシーン、ブルマ姿でのバランスボールなどを披露した。「パジャマのシーンでアイスを食べているシーンがありますが、何の形になっているか、ぜひ見て確認していください」と呼びかけた。 2024年はポーカーに精力的に取り組み、賞金を得るまでの活躍を果たした。最高順位は2位だったという。昨年末コミケでも大胆衣装でファンを沸かせた水那。今年の目標を問われ「温泉に入りたいですね」と笑顔で語っていた。 （よろず～ニュース編集部） よろず～ニュース,[],[]
元AKB48 中西智代梨　決意の大胆写真集にドキッ「最初で最後！是非ご堪能ください！」（よろず～ニュース）,https://news.yahoo.co.jp/articles/bcfcf7a958c2a08d3f08a5123ade902f362f826d,https://newsatcl-pctr.c.yimg.jp/t/amd-img/20250101-11603467-yorozuns-000-30246342-view.jpg?exp=10800,2025-01-01T20:30:11+09:00,2025-01-01T20:35:53+09:00,よろず～ニュース,yorozuns,よろず～ニュース,785,中西智代梨 1st写真集（タイトル未定）先行カット ©LUCKMAN／双葉社 元HKT48、AKB48で現在はタレントとしてマルチに活躍する中西智代梨が4月16日にファースト写真集（タイトル未定、双葉社）を発売する。 【写真】中西智代梨の大胆カットにドキッ！ 30歳の誕生日を目前に発売する写真集。撮影は東京・秋葉原と地元・福岡で行われ、屈託のない素の表情から、アイドル然としたかわいらしい王道グラビアショット、そして一糸まとわぬ大胆セクシーショットまで、20代最後の中西智代梨を余すところなく収めた。これまでのグラビア経験はほぼゼロという中、アイドルらしいビキニ姿でのビーチシーンから、一糸まとわぬバスルームシーンまで、20代の集大成として挑んだ意欲作。「かわいいちより」と「セクシーなちより」。すべてが詰まった最初で最後のコンプリートフォトブックに仕上がった。 中西は「今回、『写真集を出す！』という以前からの夢を叶える事ができて、本当に嬉しい気持ちでいっぱいです。アイドル時代の私はバラエティのイメージが強かったと思いますが、まだ皆様にお見せしたことのない、大人になった姿をこの一冊に存分に込めました。そんな今までの集大成を手にとって頂けたら嬉しいです。最初で最後の写真集！是非ご堪能ください！」とコメントを寄せた。 ◆中西智代梨（なかにし・ちより）1995年5月12日生まれ、福岡県出身。2011年にアイドルグループHKT48の1期生としてデビュー。2014 年の AKB グループ大組閣祭りにてAKB48 に移籍。劇場公演でのアイドル活動以外にも、そのキャラクターを生かしてバラエティ番組などでも活躍し、人気を博した。2023年にAKB48を卒業。以降はバラエティをはじめ、女優、YouTubeなどマルチに活躍中。 （よろず～ニュース編集部） よろず～ニュース,[],[]
パニック障害公表のアイドルが復帰へ！愛犬が支え　2月の新曲に参加「お待たせしました」ファン感涙（よろず～ニュース）,https://news.yahoo.co.jp/articles/e02d281f4623fdae1e29d4ee6a7d032d88bddb34,https://newsatcl-pctr.c.yimg.jp/t/amd-img/20250101-11603463-yorozuns-000-30246343-view.jpg?exp=10800,2025-01-01T20:25:03+09:00,2025-01-01T20:40:53+09:00,よろず～ニュース,yorozuns,よろず～ニュース,1002,写真集発売イベントを行った入江里咲＝東京・書泉ブックタワー ハロー！プロジェクトの10人組アイドル・Juice=Juice（ジュース・ジュース）が1日、公式SNSを更新し、2月26日に両A面シングル「初恋の亡霊／今夜はHearty Party」を発売することを発表した。 【写真】脚長っ！休養中にも写真集のオフショ投稿で存在感アピール 発表は動画で行われたが、昨年7月1日に「パニック障害」を公表し、休養していたメンバーの入江里咲（19）も参加していた。リーダー・段原瑠々（23）が「なんと言っても、りさち（入江の愛称）が帰ってきました～」と伝えると、メンバーからも「お帰りー」の声と拍手が贈られた。 入江は「お待たせしました。みなさん、待っていてくださって、メンバーもすごく温かく待っていてくださって、うれしかったです」と感謝。「この通り、めちゃくちゃ元気になったんですけど、まだ体調と相談しながら、少しずつ活動再開させていただこうと思いますので、元気なりさちを見に来れる人は、いっぱい見に来てくださーい」とファンに呼びかけた。最後は頰に指を当てて「がんばりさー」と定番フレーズでアピールした。 入江は休養中もSNSを更新して、写真集のオフショットを掲載するなどして、復帰への強い意欲を見せていた。メンバーからは頻繁に連絡があり、段原やグループOGの歌手・宮本佳林（26）は入江の実家を訪れて激励するなどしていた。 周囲の温かいサポートに加えて、休養中に飼い始めた愛犬・ココちゃん（シーズー犬）が心の支えになったことで症状が改善。昨年12月27日に仕事復帰すること発表した。 徐々に体を慣らしていくため、1月のハロプロ全体でのコンサートは欠席するが、2月2日のファンクラブイベントについては段原が「10人で行う予定です！」と入江の参加を予告していた。 新曲の「今夜はHearty Party」は竹内まりやの楽曲のカバーで、すでにミュージックビデオ（MV）も公開されているが、こちらは入江は参加していない。この日の発表動画ではメンバーは「初恋の亡霊」用とみられる新衣装で、入江も同曲のレコーディングなどには参加したとみられる。 ファンからは「りさちお帰り」コメントが殺到。「りさちいる！！年明け早々嬉しすぎる」「元日から泣かさないでください」と感激していた。 （よろず～ニュース編集部） よろず～ニュース,[],[]
圧巻美ボディの魅力がさらに全開！大胆新作に三田悠貴「どのシーンを見てもドキッとさせちゃう」（よろず～ニュース）,https://news.yahoo.co.jp/articles/bbf10a2cca46ff22bca2ae6dfd95682b400fcc7c,https://newsatcl-pctr.c.yimg.jp/t/amd-img/20250101-11603461-yorozuns-000-30246338-view.jpg?exp=10800,2025-01-01T20:00:21+09:00,2025-01-01T20:30:38+09:00,よろず～ニュース,yorozuns,よろず～ニュース,795,三田悠貴 DVD「You Kiss」（リバプール）より グラビアアイドルの三田悠貴が2月28日に通算2作目のイメージDVD「You Kiss」（リバプール）を発売する。 【写真】三田悠貴の大胆カットにドキッ！ 大迫力ボディの魅力がパワーアップし、圧巻のGカップバストがますます間近に感じられる作品に仕上がった。無邪気で少しおっちょこちょい。だけどオトナで艶やかな、色っぽい一面も。ギャップ満点の三田悠貴と旅行を楽しむような、ドキドキの連続とあどけない生声が収められた。 三田は「1stDVDに続きこの度2ndDVD『You kiss』の発売が決定いたしました！2ndDVD『You kiss』はファーストの初々しさでは味わえなかった大人セクシーを兼ね揃えた作品になっております。きっとどのシーンを見てもドキッとさせちゃうシチュエーションが味わえるはずです！！特に注目していただきたいところは夜のヴィラで撮影した黒の水着を着てプールに寝そべっているシーンですね。光の加減を上手く使ってセクシーさをより引き立たせています！！いつも応援してくれるファンの皆様のおかげでリリースできている事に感謝でいっぱいです。1stに続き2ndDVDも沢山の方々に届けられますように。リリースまで楽しみにお待ちください！」とコメントを寄せた。 ◆三田悠貴（みた・ゆうき）1998年5月7日生まれ、岐阜県出身。身長156cm（B96・W59・H88）。ヤングジャンプより衝撃のグラビアデビューを果たし、程なく公式ファンクラブ「三田部」を開設。数々の雑誌に登場し、MBSラジオ「オレたちゴチャ・まぜっ!～集まれヤンヤン～」のレギュラーを経てCBCテレビ『道との遭遇』では「軽トラ女子愛知一周下道旅」「軽トラ女子三重縦断下道旅」の企画を担当し「軽トラ女子」としても話題に。 （よろず～ニュース編集部） よろず～ニュース,[],[]
OKAMOTO’Sオカモトレイジが年上女優と離婚「交際0日婚」で話題に（よろず～ニュース）,https://news.yahoo.co.jp/articles/56f56211af180888ee466c5c83ad44e6b240dd55,https://newsatcl-pctr.c.yimg.jp/t/amd-img/20250101-11603457-yorozuns-000-30246282-view.jpg?exp=10800,2025-01-01T19:05:48+09:00,2025-01-01T19:17:13+09:00,よろず～ニュース,yorozuns,よろず～ニュース,552,OKAMOTO’Sのオカモトレイジ 女優・臼田あさ美（40）と4人組バンド「OKAMOTO’S」のドラマー、オカモトレイジ（33）が離婚したことが分かった。2024年12月30日、2人がSNSに文書を掲載して公表した。 【写真】離婚した女優・臼田あさ美 2人はそれぞれのインスタグラムに「ご報告」と題して、連名で文書を掲載。全文は以下の通り。 ◆ ◆ 私事で大変恐縮ですが、この度、オカモトレイジと臼田あさ美は話し合いを重ねた結果、離婚いたしましたことをご報告させて頂きます。 共に過ごした時間に、感謝しかありません。 これからもお互いを尊敬尊重していくため、たどり着いた答えです。 子育てにおきましては、親として、家族としてこれまで通り協力し合い、助け合っていきたいと思っております。 今後とも変わらぬご支援のほど宜しくお願い致します。 2024年12月30日 オカモトレイジ 臼田あさ美 ◆ ◆ 2人は2017年1月に熱愛が報じられ、同月に結婚を報告した。臼田はかつて音楽番組のMCを務めていたことから、ミュージシャンとも親交があり、オカモトとも一定期間は友人友人関係だった。結婚時には「交際0日婚」として話題となった。18年6月に第1子が誕生していた。 （よろず～ニュース編集部） よろず～ニュース,[],[]
アカデミー賞俳優「オッペンハイマー」のおかげで小規模企画が実現　受賞の実感なしも効果は実感（よろず～ニュース）,https://news.yahoo.co.jp/articles/792ce53b1bac53dbaac71719e2ddd4b6e33ba63e,https://newsatcl-pctr.c.yimg.jp/t/amd-img/20250101-11603454-yorozuns-000-1-view.jpg?exp=10800,2025-01-01T18:30:05+09:00,2025-01-01T18:30:05+09:00,よろず～ニュース,yorozuns,よろず～ニュース,718,キリアン・マーフィー 俳優のキリアン・マーフィーは、アカデミー賞を受賞したことが「いまだに信じられない」という。「オッペンハイマー」でアカデミー主演男優賞をはじめとする数々の賞に輝いたキリアンは、まだその影響は感じていないものの、自身が有名になったことで、情熱を傾ける小規模な映画が作りやすくなったことには喜んでいるそうだ。 【写真】作品にリアリティーを持たせた キリアン・マーフィーが演じるオッペンハイマー博士 英「ハロー！」誌から、受賞の実感はあるかと尋ねられ、キリアンは「全然だよ。もちろん、光栄なことだ。でも、それ以来、何度も考えたことではない」と答えている。「仕事にすぐ戻ったから、ずっと忙しかった。今でも変な気分だよ。像を見てもまだ信じられない」と実感はないという。「何か変わったかというと、分からない」としながらも「でも、（『スモール・シングス・ライク・ディーズ』のような）映画を作るのには助けになった」と“効果”を実感することはあるようだ。 「スモール・シングス・ライク・ディーズ」は「オッペンハイマー」のような超大作と比べるとスケールがはるかに小さいが、仕事を選ぶときに規模の大きさは「僕にとって違いはない」と気にしていない。「ストーリーとキャラクターに興味が湧けばやりたいと思う。スケールや予算に関わらずね。でもこの映画は『オッペンハイマー』なしでは実現しなかったかもしれない。それでマット・デイモンに脚本を見せることができて、そこから彼とベン・アフレックが製作をしてくれることになったからね」と企画実現までの経過を明かした。 （BANG Media International／よろず～ニュース） よろず～ニュース,[],[]
「インディ・ジョーンズ」最終作の監督、不評にガッカリ「80代の男性の映画」に観客がソッポ（よろず～ニュース）,https://news.yahoo.co.jp/articles/f51278af3b0c4288e7e3299298f41443373ab4d7,https://newsatcl-pctr.c.yimg.jp/t/amd-img/20250101-11603448-yorozuns-000-30246115-view.jpg?exp=10800,2025-01-01T17:34:46+09:00,2025-01-01T17:42:34+09:00,よろず～ニュース,yorozuns,よろず～ニュース,592,ジェームズ・マンゴールド ジェームズ・マンゴールド監督は、「インディ・ジョーンズと運命のダイヤル」が不評だったことに「傷ついた」という。ハリソン・フォード（82）がタイトルロールを演じる同シリーズ最終作となった2023年の同アクションアドベンチャー作は、観客と批評家共に評判は今一つで、興行成績も2億9470万ドル（約452億円）の予算に対して3億8400万ドル（約590億円）という結果となっていた。 【写真】ハリソン82歳、そりゃ皺がちにもなるって それについてマンゴールド監督は、インディのお別れ作に値する愛情を得られなかったと落胆の意を表している。マンゴールド監督は「デッドライン」に「僕はハリソンが大好きだから、ありのままの彼を観客にも愛してほしかった。物事には終わりがある、それが人生というものだという、この映画の言わんとすることの一部であることを受け入れてほしかった」と語っている。 そして、84歳のハリソンがインディを演じることに、観客が良い反応を見せなかったことから、別の人を配役してほしかったということなのかとさえ感じたとして、「80代の素晴らしい最高の俳優がいる。だから、僕は80代の男性の映画を作った。でも観客はその年齢の自分たちに向き合いたくなかったようだ」と続けた。 （BANG Media International／よろず～ニュース） よろず～ニュース,[],[]
アリアナ・グランデ、映画「ウィキッド」で歌い方を変えた「他の全てを中断して」オーデ挑戦（よろず～ニュース）,https://news.yahoo.co.jp/articles/50956c2807d6a65c02cbdfe3e6543af32a017463,https://newsatcl-pctr.c.yimg.jp/t/amd-img/20250101-11603441-yorozuns-000-1-view.jpg?exp=10800,2025-01-01T16:57:46+09:00,2025-01-01T16:57:46+09:00,よろず～ニュース,yorozuns,よろず～ニュース,554,アリアナ・グランデ 歌手のアリアナ・グランデは、映画「ウィキッド ふたりの魔女」（3月7日公開）のオーディションに向けて猛特訓を受けていたという。人気ミュージカル「ウィキッド」の2部構成映画化作品で“善い魔女”グリンダ役を演じているアリアナが、実力で役を勝ち取るため自らを限界まで追い込んでいたことを明かした。 【写真】“相棒”シンシア・エリヴォとパリ五輪に出現 アリアナは英版「ハロー！」誌に「この役をやりたい理由はたくさんあったけれど、私はこの役を自らの手で勝ち取りたかったの」と告白。「ヴォーカルは私の普段の歌い方ととても違っていたから、ヴォーカルコーチと演技コーチと毎日トレーニングをし始めたの。何を指示されてもこなせて、グリンダになりきりたかったのよ。自分の全てを捧げて、他の全てを中断した。本当に欲しかったの」と並々ならぬ意気込みだったという。「もし出演していなかったら、精神病院行きになっていたかもしれない。他のこととはまったく違う経験だったのは確かね」と振り返った。 そんなアリアナは、同作で“悪い魔女”エルファバ役を演じるシンシア・エリヴォと初めて会った際、「すぐに安全を感じた」ことも明かしている。 （BANG Media International／よろず～ニュース） よろず～ニュース,[],[]
