headline,mainEntityOfPage,image,datePublished,dateModified,author,media_en,media_jp,str_count,body,images,external_links
望月記者のX投稿めぐる訴訟で立花孝志氏敗訴、立花氏の言動による元県議の「社会的評価低下」も認定…東京地裁（弁護士ドットコムニュース）,https://news.yahoo.co.jp/articles/ae171a6cd531cacc5b962e8719dba86305eb5ada,https://newsatcl-pctr.c.yimg.jp/t/amd-img/20251216-00019760-bengocom-000-1-view.jpg?exp=10800,2025-12-16T18:50:37+09:00,2025-12-16T18:50:37+09:00,弁護士ドットコムニュース,bengocom,弁護士ドットコムニュース,1179,"望月衣塑子記者（右）と代理人の石森雄一郎弁護士（2025年12月16日／東京・霞が関の司法記者クラブ／弁護士ドットコム撮影）
東京新聞の望月衣塑子記者によるX（旧ツイッター）の投稿で名誉を傷つけられたとして、「NHKから国民を守る党」党首の立花孝志氏が、160万円の損害賠償を求めていた訴訟で、東京地裁は12月16日、請求を棄却する判決を言い渡した。
【動画】立花氏の「思惑」とは
判決はあわせて、立花氏が、すでに亡くなっている竹内英明元兵庫県議に対して社会的評価を低下させるような発言を繰り返していたことを指摘した。

判決後の記者会見で、望月記者の代理人をつとめる石森雄一郎弁護士は、このような裁判所の踏み込んだ認定は「初めてではないか」と述べた。
●問題とされた望月記者の投稿
判決文によると、望月記者は、兵庫県議会の百条委員会の委員だった竹内元県議が亡くなっているのが見つかった翌日の今年1月19日、自身のXに次のように投稿した。

「立花孝志氏の言動がまたひとつの悲劇を生んだ。元兵庫県議・竹内英明氏が自ら命を絶ったと見らるている。背景に、立花氏が『犬笛』を吹き続けた結果、SNS上での誹謗中傷がエスカレートしたとの指摘がある」（原文ママ）

この投稿は、およそ10分後に一部が修正された。

立花氏は、この投稿について、自身の支持者に竹内氏への誹謗中傷を呼びかけ、自らを「竹内氏を自死に追いやるような行為に及ぶ危険な人物」と印象づけ、社会的評価を低下させるものだと主張していた。
●真実相当性が認められた
判決で、東京地裁の加本牧子裁判長は、投稿は立花氏の社会的評価を低下させたと認めた。一方で、望月記者が、立花氏の言動の影響のもとに竹内氏への誹謗中傷が過熱したことなどが真実であると信じたことに相当の理由があったと認め、名誉毀損は成立しないと結論づけた。

また判決は、立花氏について、兵庫県議選の選挙期間中の2024年11月ごろから、「自身の発言が広く拡散されるような手段を用いて、竹内元県議の政治家としての社会的評価を著しく低下させるような発言を繰り返していた上、その居場所の特定を促すような呼びかけまでして、聴衆を煽るような言動をしていたことが認められ」ると踏み込んだ。

望月記者の代理人をつとめる石森弁護士は、判決後の会見で「竹内元県議に関する立花氏の言動が、（裁判所に）認定されたのはおそらく初めてではないかと思う」と語った。

立花氏は、亡くなった元県議を中傷したとして、名誉毀損罪で起訴されている。現在まで保釈は認められていない。なお、石森弁護士は、告訴人である元県議の妻の代理人もつとめている。

判決を受けて、望月記者は、訴訟の弁護士費用などについて支援を受けたことに感謝の言葉などを述べた。
弁護士ドットコムニュース編集部",[],[]
小学校女子トイレで盗撮の元教員に有罪、執行猶予4年判決…児童本人は被害知らぬまま「学校現場に与えた影響大きい」（弁護士ドットコムニュース）,https://news.yahoo.co.jp/articles/79ed3755860fc2cd563021d9a6080e411974401d,https://newsatcl-pctr.c.yimg.jp/t/amd-img/20251216-00019759-bengocom-000-1-view.jpg?exp=10800,2025-12-16T16:05:00+09:00,2025-12-16T16:05:00+09:00,弁護士ドットコムニュース,bengocom,弁護士ドットコムニュース,1251,"横浜地裁相模原支部（2025年12月16日／神奈川県相模原市／弁護士ドットコム）
勤務先の小学校の女子トイレで、女子児童3人を盗撮したなどとして、性的姿態等撮影と児童ポルノ禁止法違反の罪に問われた相模原市立小学校元教員の20代男性に対し、横浜地裁相模原支部は12月16日、懲役2年、執行猶予4年の判決を言い渡した。
【写真】更衣室に盗撮カメラを見つけた女性
保護者の意向もあり、被害に遭った児童本人は盗撮された事実を知らされていない。弁護人によると、被害児童のうち2人の保護者との間で示談が成立しており、被告側は控訴しない方針だ。

裁判所は、被害児童や保護者だけでなく、学校現場に与えた影響も大きいと指摘した。
●保護者は健全な成長を願い、娘に事実を伝えず
判決要旨などによると、被告人は今年5月18日ごろと6月4日ごろ、勤務校の小学校の女子トイレ個室に小型カメラを設置し、当時11〜12歳の女子児童3人の性器などを撮影し、映像を記録して保存したとされる。

横浜地裁相模原支部の和久登貴子裁判官は、判決理由で「小学校教員でありながら、自らの性的欲求等を満たすため、勤務先小学校内の女子トイレの個室内に小型カメラを設置して、女子児童らの尊厳を害する本件各犯行に及んだ」と認定した。

量刑の考慮では、犯行の悪質性や被害の深刻さに加えて、周囲への影響にも言及があった。

「娘が盗撮されたことを知った保護者の受けた衝撃は大きく、被告人の厳罰を求める保護者がいるのも当然である。いずれの保護者も、娘に精神的苦痛等を与えないため盗撮被害に遭った事実を伝えることなく、配慮し健全に成長するよう見守ろうとしている。学校現場に与えた影響も大きい」

一方で、被害児童のうち2人については、それぞれ50万円と70万円を支払う内容で示談が成立していることや、被告人が犯行後に診断された「性嗜好障害」の治療に取り組んでいることなどを踏まえて、執行猶予付きの判決とした。

今年6月の刑法改正で拘禁刑が導入されたが、今回のケースでは起訴された2つの事件が施行日前後にまたがっていることから、検察側は拘禁刑ではなく、従来の懲役刑を求刑していた。
●法廷で謝罪した元教員、「収集」が目的化
被告人は起訴内容をすべて認め、論告求刑公判では、被害児童や保護者、学校関係者に対して「信頼を裏切り、心に深い傷を負わせてしまった」と述べ、謝罪した。

弁護側は、犯行に及んだ動機について、当初は性的目的だったが、次第に「収集」手段が目的化し、精神状態が正常とは言えないものだったなどと主張した。

判決後、弁護人は、こうした主張も量刑判断に考慮されたのではないかとの認識を示した。

相模原市は、被告人を逮捕後に懲戒免職とし、教員免許は失効している。また、この事件を受けて、市は10月31日、盗撮カメラ探知機を用いた不定期の巡回点検などの実施を公表した。

（弁護士ドットコムニュース編集部・塚田賢慎）
弁護士ドットコムニュース編集部",[],[]
体重40キロ台、車椅子生活でも「強制送還」…収容11年のパキスタン男性に非情な通告（弁護士ドットコムニュース）,https://news.yahoo.co.jp/articles/74d9c7460270adb5216513d3c175650b6f2574cb,https://newsatcl-pctr.c.yimg.jp/t/amd-img/20251216-00019758-bengocom-000-4-view.jpg?exp=10800,2025-12-16T10:49:00+09:00,2025-12-16T10:54:16+09:00,弁護士ドットコムニュース,bengocom,弁護士ドットコムニュース,2023,"法務省（キャプテンフック / PIXTA）
東日本入国管理センター（茨城県牛久市）に収容されて11年目となるパキスタン・カシミール地方出身の男性に対し、12月10日、代理人を通じて「12月17日に強制送還する」との通達があった。
【写真】「国に帰れない」ベトナム妊婦の悲しみ
収容当時は80キロ以上あった体重は、現在40キロ台前半まで落ちている。定期的に受けている血液検査では重度の貧血が確認されており、支援者との面会にも車椅子で現れる状態だ。

期限まで残された時間はわずか。強制送還に耐えられない健康状態にある男性が今、「人道」に反して、非情にも送還されようとしている。（取材・文／塚田恭子）
●カシミール独立運動への関与と来日
男性は1980年代、カシミール独立運動に関わり、当局から繰り返し身体拘束や拷問を受けたとうったえている。

迫害から逃れて、1987年に来日したが、2003年に在留資格（配偶者ビザ）を失った。日本で生活基盤を築いてきたものの、在留資格の変更は認められなかった。

2015年6月、2度目の収容となった際には、治療のためオーダーメイドで作った膝のコルセットを取り上げられたという。

また、収容施設で手首を骨折した際にも、病院で適切な治療を受けられず、後遺症が残った。

こうした差別的な取り扱いに抗議し、男性は食事を拒否するようになった。その結果、体重は半分近くまで減少し、現在も重度の貧血が続いている。支援者との面会には、常に車椅子で現れる。

この3年ほど、わたしも支援者とともに定期的に男性と面会してきた。検査結果を見せながら、男性は次のように語る。

「月に一度、診察を受ける入管の医師は『軽い力が加わっただけでも、骨折しかねない身体状況の人を強制送還しても大丈夫だとは書けません』と、私の前で入管職員に説明しています」

「今年3月、別の入管施設の医師が10人近い職員と一緒に部屋に来ました。私を診て『（強制送還は）問題ない』と言いました。牛久入管の医師が『強制送還できる』という診断書を書かないから、代わりに別の医師を連れてきたんです」
●骨密度は若年層比47％、MRI結果は非開示のまま
11月上旬、男性は外部の大学病院でCTとMRIの検査を受けた。CT検査の結果によると、大腿骨の骨密度は約0.4g/㎠で、若年層との比較で47％、同年代との比較でも55％という数値が示されていた。

一方、同時に受けたMRI検査の結果は、1カ月以上経った今も、男性の手元に渡っていない。

「これまで病院で検査を受ければ、その結果はすべてもらいました。今回は『もし見たければ、情報開示請求すればよい』と職員に言われました。でも、どうして入管が私の検査結果を管理して、本人が自由に見ることができないのでしょうか」

検査結果を渡さないのは、入管にとって都合が悪い、つまり強制送還できない健康状態を示す数値が出ているからではないか──。10年以上にわたり、入管の対応を見てきた男性はそう疑う。

「もし情報開示請求をしても、都合の悪いところは黒塗りにされるでしょう」
●通知ルールを無視した送還強行
入管問題に取り組む弁護士らの尽力により、これまで代理人がついている人については、退去強制令書が出されても、通知希望申出書を提出していれば、入管が原則として執行の2カ月前に送還時期を通知する運用がされてきた。

しかし現在、入管はこうしたルールを事実上無視し、送還に耐えられない健康状態の男性を強制送還しようとしている。

自身が難民であることをうったえながら、男性は入管の不当な処遇に対し、徒手空拳で闘ってきた。かつてカシミール独立の闘士だった彼は、今、気力だけで生きている。
●「送還停止効例外」の急増が示すもの
出入国在留管理庁の公表資料によると、今年の護送管付き国費送還者における「送還停止効例外」の適用件数は、1～5月（5カ月間）で84人中6人だったのに対し、6～8月（3カ月間）は119人中36人に上っている。

法務省が今年5月、「国民の安全・安心を守るための不法滞在者ゼロプラン」を公表して以降、国は「送還停止効例外」を適用した強制送還を前のめりで進めている。

こうした姿勢は、日本には「送還すべき人が多くいる」という印象を与える。しかし実際には、退去強制令書が出た人の約9割は自費で出国している。

送還に応じない人たちの多くは「帰らない」のではなく、「帰れない」事情を抱えている。

制度のはざまで在留資格を失いながら、20〜30年以上にわたり日本社会に定着してきた人たちが、すでに生活基盤のない母国へ、リスクを伴う帰国を強いられているのだ。

難民認定率が2.2％（2024年）にとどまる日本において、仮放免者や収容者は、かつてないほど厳しい状況に置かれている。
弁護士ドットコムニュース編集部",[],[]
"「出所後の住所を教えて」加害者の""お礼参り""に怯える被害者、第5次基本計画の改善うったえ（弁護士ドットコムニュース）",https://news.yahoo.co.jp/articles/ef5410854e91a85ed3d435cae3e21d461368cf48,https://newsatcl-pctr.c.yimg.jp/t/amd-img/20251216-00019757-bengocom-000-1-view.jpg?exp=10800,2025-12-16T10:27:00+09:00,2025-12-16T10:27:00+09:00,弁護士ドットコムニュース,bengocom,弁護士ドットコムニュース,1523,"記者会見を開く高橋正人弁護士（左）と伊藤さん（2025年12月15日／東京・霞が関の司法記者クラブ／弁護士ドットコム撮影）
お礼参り（仕返し）の恐怖を考えると心配は絶えません──。

来年4月から適用される「第5次犯罪被害者等基本計画」をめぐって、2016年にファンの男性に刃物を刺されて重傷を負った冨田真由さんの母親らが12月15日、東京都内で記者会見を開いた。
【実物】「私は今とても幸福です」無期懲役囚からの手紙
加害者が出所した後に住むエリアを、被害者側が把握できる仕組みを導入するよううったえた。（弁護士ドットコムニュース・一宮俊介）
●第5次基本計画は来年4月からの5年間
音楽活動をしていた冨田さんは、当時20歳だった2016年5月、東京都小金井市でファンの男性に刃物で刺され、重傷を負った。

加害者は殺人未遂罪で懲役14年6カ月の実刑判決が確定し、刑務所に服役しているとみられる。

この日、「犯罪被害者支援弁護士フォーラム」の事務局長をつとめる高橋正人弁護士らが東京・霞が関の司法記者クラブで記者会見を開いた。

出所後の仕返しを恐れている被害者が少なくないとして、加害者の帰住先情報を被害者側に提供する仕組みの必要性をうったえた。

2005年に「犯罪被害者等基本法」が施行されたことに伴い、国は犯罪被害者を支援する基本方針をまとめた「犯罪被害者等基本計画」を同年12月に策定した。

基本計画は5年に1度のペースで見直されており、「第5次犯罪被害者等基本計画」は2026年4月から2031年3月までの5年間に適用される。
●進展ない「加害者の帰住先情報の提供」
高橋弁護士によると、加害者の服役中の態度や出所時期を被害者側が知ることができるようになったが、出所後の住まいの情報提供については今も仕組みがなく、第1次の基本計画からほとんど変わっていないという。

高橋弁護士はこうした状況に懸念を示す。

「犯罪被害者として、加害者の詳しい住所を教えてほしいというわけではない。たとえば、『千代田区』といったエリアだけでもわかれば、被害者はそこから逃げることができる。そうした身を守るための情報を最低限提供してほしい」
●アメリカやカナダでは「加害者情報にアクセスできるシステム」
記者会見に同席した元上智大学教授の伊藤冨士江さんは、アメリカ・ペンシルベニア州やカナダでは、犯罪被害者が登録すれば、加害者の情報に容易にアクセスできる制度があることを紹介した。

「第5次犯罪被害者等基本計画は非常に大事です。被害者にとって、便利で加害者の情報にアクセスしやすいシステムを作っていくというような文言が計画の中に入ることで、次の5年間で検討できるようになる。こういったシステムが日本に導入されると、被害者の権利を守るものになるので、ぜひ検討していただきたい」と話した。
●冨田さん母「被害者が安心して生活できる法律や制度を」
オンラインで記者会見に出席した冨田さんの母親は、こううったえた。

「私たち家族は今も、加害者に怯えながら日々を過ごしています。刑務所にいると理解はしていても、特に外出するときは不安で周りを気にしながらの生活です。

加害者が出所するということは、今より怯える毎日を過ごさなければならないということです。裁判が終わり、やっと一息つくことができました。しかし、加害者が出所してからのお礼参りの恐怖を考えると、まだまだ心配は絶えません。

私たちは一生不安や恐怖を抱えながら過ごさなければならないのか。被害者が少しでも安心して生活できる法律や制度が増えることを強く望みます」
弁護士ドットコムニュース編集部",[],[]
刑務所を出たのに選挙権がないのは「違憲だ」、仮釈放中の男性が提訴　高松市選管の決定取り消し求める（弁護士ドットコムニュース）,https://news.yahoo.co.jp/articles/6022dc8d8d02567b72b960dbac9b19d13adf0b40,https://newsatcl-pctr.c.yimg.jp/t/amd-img/20251216-00019755-bengocom-000-3-view.jpg?exp=10800,2025-12-16T10:06:00+09:00,2025-12-16T10:52:34+09:00,弁護士ドットコムニュース,bengocom,弁護士ドットコムニュース,1513,"高松地裁（KAKU / PIXTA）
仮釈放され、社会で生活しているにもかかわらず選挙権が認められないのは憲法に違反するとして、高松市の八木橋健太郎さん（39）が、選挙人名簿に登録されなかったことへの異議申出を棄却した決定の取り消しを求める訴訟を高松地裁に起こした。
【八木橋さん】弁護士をつけずに国に勝訴した驚きの方法
八木橋さんは、刑務所に収容されていた当時にも、受刑者の選挙権が制限されていることの違法性をうったえて提訴している。（弁護士ドットコムニュース・一宮俊介）
●公選法により「選挙人名簿」に登録されず
八木橋さんの代理人によると、訴状は12月11日付で高松地裁に発送したという。

八木橋さんは、約2億円相当の仮想通貨「ビットコイン」をだまし取ったとして警視庁に逮捕され、2019年9月に懲役7年の実刑判決が確定した。2025年7月末、兵庫県の加古川刑務所から仮釈放されている。

訴状によると、八木橋さんは仮出所後、高松市内で生活を始めた。転入から3カ月が経った後の、最初の選挙人名簿登録日である12月1日、高松市選挙管理委員会は八木橋さんを名簿に登録しなかった。

八木橋さんは翌12月2日、名簿に登録するよう求めて市選管に異議を申し出たが、市選管は12月4日付で棄却する決定をした。

棄却の理由として示されたのが、公職選挙法11条1項2号だ。同条は、選挙権を有しない者として「拘禁刑以上の刑に処せられその執行を終わるまでの者」を定めている。
●仮釈放は「国家が認めて許可される」
これを受けて、八木橋さんは異議申出を棄却した市選管の決定の取り消しを求めて提訴した。

訴状では、最高裁が2005年の在外選挙権訴訟で示した「やむを得ない事由」がない限り選挙権を制限することは許されないとする判例を引用。「受刑者の選挙権を一律かつ自動的に制限すべき『やむを得ない事由は存在しない』」として、公職選挙法11条1項2号は憲法に違反すると主張している。

また、仮釈放は「社会で暮らすことが適当であると国家が認めて許可される」ものであり、「引き続き選挙権を制限するべき理由はない」と指摘した。
●選挙権制限は「社会参加を阻害」、仮釈放制度と深刻な矛盾
八木橋健太郎さん（2025年8月／弁護士ドットコムニュース撮影）
さらに訴状では、仮釈放制度が受刑者の社会復帰を推進する目的を持つことを踏まえ、次のように強調している。

「仮釈放許可を得た人に対する選挙権制限は、彼らの社会参加を阻害するものであり、仮釈放の制度趣旨と深刻な矛盾を生じる」

「社会で暮らすことを認めておきながら、その社会参加の出発点である選挙権を奪うことは正当化されえない」
●執行猶予者との区別「合理的な理由ない」
高松市役所（PIXSTAR / PIXTA）
今回の提訴では、公職選挙法違反などを除いた一般の事件で執行猶予中の人は原則として選挙権が認められている点にも言及している。

八木橋さんは、仮釈放中の受刑者と、裁判で執行猶予付きの有罪判決を受けた人を比較し、「この社会で暮らすことが認められている両者のうち、仮釈放中の受刑者だけを選挙から排除するべき合理的な理由はない」と主張している。

このほか、八木橋さん自身が過去に選挙に関する事件を起こしたことがないことや、仮釈放者に投票を認めても、刑務所内の秩序維持や投票時の事務的な支障を考慮する必要がないことを挙げ、選挙権の制限に正当な理由はないとうったえている。



高松市選管の担当者は「訴状が届いていないのでコメントできません」としている。
弁護士ドットコムニュース編集部",[],[]
