headline,mainEntityOfPage,image,datePublished,dateModified,author,media_en,media_jp,str_count,body,images,external_links
貯めたい妻と使いたい夫。金銭感覚にズレがある夫婦に専門家がマネープランをアドバイス！（＠BAILA）,https://news.yahoo.co.jp/articles/d53320817ad3fe5c67f7b6dd67fc0367da5be5e3,https://newsatcl-pctr.c.yimg.jp/t/amd-img/20260520-00010005-baila-000-1-view.jpg?exp=10800,2026-05-20T21:50:36+09:00,2026-05-20T21:50:36+09:00,＠BAILA,baila,＠BAILA,974,パートナーとの暮らしは楽しいけれど、お金にまつわる価値観が違うと地味にストレスがたまるもの。そこで今回は、不安・不満があるカップルのマネープランを深掘り。マネーライフから浮かび上がる“足りないもの”を専門家が分析＆アドバイス！ 夫婦の金銭感覚のズレを調節する方法とは？ 【給与明細を拝見】働く女性はいくら貰っていくら貯めてる？（画像） ・ファイナンシャルプランナー 風呂内亜矢さん 身近なお金の話をわかりやすく発信。『9割が知らずに損してる! スマホ決済「超」入門』（青春出版社）など著書多数。 ・金融教育コンサルタント 上原千華子さん 金融教育家。心理学・脳科学を活用した独自メソッドを提供。著書に『ファイナンシャル・セラピー』（JMAM）がある。 金銭感覚についてのずれがある @BAILA ■夫・Hさん 37歳（金融系） 妻・Gさん 30歳（事務系） 結婚／5年目 預金／合わせて約600万程度 投資／約300万（Gさん）、約400万（Hさん） 「収入の多い夫が家賃・光熱費・外食費を負担。自炊と日用品は私が負担し、それ以外は各自で管理。貯蓄はお互いのボーナスからまとまった額を共有口座に入れています。700万円たまったら、ボーナスを投資に回す予定。私はどちらかというと将来に向けてためたいタイプで、夫は“今の楽しみ”にもお金を使いたいタイプなので、外食の頻度などに温度差を感じることも。私としては家族が増える前に家計を一緒にしたいと考えています」（Gさん） 【お悩み1】パートナーと金銭感覚のチューニングをしたい 彼は外食多めで、年数回の野球試合のために高額な道具をそろえようとしたことも。私は「それ必要？」とストレートに言ってしまうので、上手な伝え方も知りたいです。 【Advice】自由に使える「お楽しみ枠」を設定することでストレスを削減 「将来的に家計を一緒にしたいという希望があるなら、『彼とはお金ぐせのタイプが違う』と認めた上で運用ルールを決めるのもひとつの手。たとえば、各自が自由に使える『お楽しみ枠』を決めると衝突も回避できるはず。もし相手の出費が気になったら『それはお楽しみ枠で買うの？』と自然に聞けますし、何か大きな出費がある場合は『来月分に回さない？』と相談すれば会話のキャッチボールが生まれやすくなります」（上原さん）,[],[]
【働く私たちのお悩み解決リップ3選】オフィス服に似合う洒落色は？ 保湿力の高いケアリップって？ ツヤも色づきも満足のグロスは？（＠BAILA）,https://news.yahoo.co.jp/articles/f4b698696d3b2d972a081ef6165828983c41bb36,https://newsatcl-pctr.c.yimg.jp/t/amd-img/20260520-00010004-baila-000-1-view.jpg?exp=10800,2026-05-20T20:50:52+09:00,2026-05-20T20:50:52+09:00,＠BAILA,baila,＠BAILA,1046,オフィスでだって好きな色や質感をまといたい！ そんな願望をかなえるハイスペリップと塗り方のコツをヘア＆メイクアップアーティスト吉﨑沙世子さん（「吉」は正しくは「つちよし」のよし）がレクチャー。 （写真）2026年最新！働く女性のおすすめリップをまとめてチェック ●教えてくれたのは Hair&makeup artist 吉﨑沙世子さん トレンドを敏感にキャッチし、ファッションにマッチするメイクを提案。その人の持つ可愛さを引き出すプロ。 《お悩み》いつものオフィス服に、洒落色リップが似合いません… @BAILA A.ダーティカラーも“透け感×ラメ”で、どんな服にもなじむ！ 「今季取り入れるべき洒落色はダークプラム。深い色を塗るときは、ラメやツヤ感のあるアイテムを選べばなじみやすく」（吉﨑さん・以下同）。 シャツ￥10890／ワールド プレスインフォメーション（ギャレスト） ピアス￥28600／ココシュニック（ココシュニック オンキッチュ） @BAILA （右から） 微細なラメを含んだベリーカラー。ルージュ ココ フラッシュ 203 ￥6490／シャネル（5月8日限定発売） 【モデル使用色】多色パールが透明感をプラス。テクノサテン ジェル リップスティック LE05 ￥4400／SHIS EIDO（5月1日限定発売） シアーに発色。アフターグロー センシュアルシャイン リップスティック 229 ￥4730／ナーズ ジャパン 《お悩み》とにかく保湿力ファーストでリップを選びたい！ @BAILA A.発色のいいバームリップで唇もケアを 「保湿重視なら、美容成分をたっぷり配合できるバームタイプを。色づきがシアーだから、鏡を見ずに塗れるのも◎」。 （右から） B.A共通のスキンケア成分を贅沢に配合。色ムラや縦ジワをカバー。B.A カラーリップゾーンクリーム 04 ￥5830／ポーラ 濃密なツヤと潤いでデリケートな唇を守り抜く。クリスタルグラム バーム 13 ￥1980／クリオ 《お悩み》グロスでツヤを足したいけど、オフィスで二本使いしている時間はありません @BAILA A.しっかり色づくグロスなら一本でツヤも血色感も欲張れる！ 「素の唇の色と相まって、しっかり発色するグロスが続々登場中。唇中央にのせたら、あえてリップラインは取らずにじんわりなじませるのがコツ」。 ブラウス￥22000／エレンディーク ピアス￥11000・ネックレス￥22000／フーブス（ル ボンボン）,[],[]
佐藤栞里「今までの頑張りが背中を押してくれる」30代になって挑戦したこととは？（＠BAILA）,https://news.yahoo.co.jp/articles/1819c161831368ea322ef24169daef61085ed823,https://newsatcl-pctr.c.yimg.jp/t/amd-img/20260520-00010003-baila-000-1-view.jpg?exp=10800,2026-05-20T19:51:04+09:00,2026-05-20T19:51:04+09:00,＠BAILA,baila,＠BAILA,1538,@BAILA 同世代であるBAILAモデルズが、等身大で語る30代ならではの楽しさとは。彼女たちが紡ぐポジティブな言葉が、私たちの背中をそっと押してくれるはず。BAILAと同じデビュー25周年の佐藤栞里さんは、経験を積んだ30代だからこその環境の変化をポジティブに語ってくれました。 佐藤栞里、グルメを求めてぶらり街歩き（写真） 佐藤栞里 ーSHIORI SATOー @BAILA ■信頼できる人が周りに少しずつ増えて30代はより、私らしくいられるように 今年はバイラだけでなく、私にとってもデビュー25周年という記念すべき年なんです。20代ではモデル業に加え、テレビのお仕事もスタート。レギュラー番組も決まり、とにかく目の前のことを乗り越えるのに毎日、精一杯でした。今も変わっていませんが、私は“準備の人”なので、お仕事の前に入念に下調べをするのがルーティン。当時は初めての現場も多く、毎度、1から100までイメトレをして汗だくになりながら必死で本番に挑んでいました。でも想定と違うことが起きると臨機応変に対応できず、落ち込むこともしばしば。そんな風に慌ただしく20代を駆け抜けたので、なりたいイメージや理想がないまま30代に突入したような気がします。30代半ばになった今、正直、根本的な部分は何も変わっていません。毎日がむしゃらだし、常にいっぱいいっぱい。ただ経験を積むごとに信頼できる人たちが周りに少しずつ増えてきて、「全部一人で背負わなくちゃ」という気負いがなくなってきました。仕事の下準備も自分を追い込みすぎない程度にコントロールできるように。4時間半という生放送番組のMCも10年目ですが、今も伸び伸びと楽しく続けていられるのは、“誰かに頼る勇気”をもてるようになったおかげかもしれません。 ポッドキャスト番組のお仕事は30代になって挑戦したことのひとつ。普段、部屋の片隅で友達とするような“こそこそ話”が、わずかな人たちに面白く伝わればいいなと始めたのですが、想像以上に大勢の方が聴いてくださるようになり、去年はリスナーさんも参加して公開収録という大きなイベントも開催できました。ポッドキャストは私が素でいられて、ファンの方とダイレクトにつながれる唯一の場所。できるだけ近い感覚で交流したかったので、恋愛相談のお便りが来たときは本当に嬉しかった（笑）。気になっている物や日々の生活で感じたこと、そんなたわいもない私の話が誰かの生活を少しでも豊かにしているなら、この上ない幸せです。回数を重ねるにつれてリスナーさんとの距離も縮まり、私にとってますます愛おしく大切な存在になりました。そんな宝物みたいな場所に出会えたのも、今までの経験がお守りになって、何事も肩の力を抜いて楽しめるようになったから。もし30代になることにちょっぴり不安を感じている人がいたら「大丈夫！」と言ってあげたい。今まで頑張ってきたことが、必ず未来の自分の背中を押してくれるはずです。 ジャケット￥72600／にしのや（ヘリル） Tシャツ￥7700／ドレステリア 渋谷スクランブルスクエア店（ドレステリア/ジェイジェイマーサー） 佐藤栞里 さとう しおり●モデル業のほか、「王様のブランチ」（TBS系）、「1億人の大質問⁉笑ってコラえて！」（日本テレビ系）、「有吉の壁」（日本テレビ系）などにレギュラー出演中。オールナイトニッポンPODCAST「さとしおあちぇとぺぺ -餃子オンザライス-」も大好評！ 撮影／藤原 宏〈Pygmy Company〉 ヘア＆メイク／川添カユミ〈ilumini.〉 スタイリスト／石上美津江 モデル／佐藤栞里 取材・原文／野崎久実子 ※BAILA2026年6月号掲載,[],[]
メッシュで涼しい「コロンビア」の軽量スニーカーは夏のアクティブシーンに最適（＠BAILA）,https://news.yahoo.co.jp/articles/a16f3c0584f090b96d67556922ec1b5bf07293b9,https://newsatcl-pctr.c.yimg.jp/t/amd-img/20260520-00010002-baila-000-1-view.jpg?exp=10800,2026-05-20T18:50:09+09:00,2026-05-20T18:50:09+09:00,＠BAILA,baila,＠BAILA,1270,働く大人目線で厳選した、きれいめ派のための通勤バッグを紹介する連載。今回は、「Columbia（コロンビア）」の軽量スニーカーをピックアップ。 大人におすすめの軽量スニーカーをまとめてチェック 「コロンビア」の軽量スニーカー ￥14850 @BAILA スライブ リバイブ マックス ブリーズ ￥14850／コロンビアスポーツウェアジャパン（コロンビア） ■商品詳細 素材：ポリエステルメッシュ、TPU、ポリエステルエラスタントリコット、シンセティックレザー カラー：Black Charcoal、Grey Green Black、Black Super Sonic サイズ：22.5cm〜26.0cm（WOMENS：全8サイズ） 重さ（片足）：245g（サンプルサイズ 24.0cm） メッシュ素材をベースにしたアッパーに、凹凸のある立体的なソールを組み合わせた存在感のある一足。スポーティなルックスながらオールブラックのシックなデザインで、きれいめなスタイリングにもすっとなじみます。 @BAILA 軽量性や耐久性を備えた、最高峰のクッショニングを誇るミッドソールと、濡れた地面でも高いグリップ力を発揮するアウトソールを採用するなど、機能面も充実。デイリー使いはもちろん、山や海、フェスなどの夏のアクティブシーンにも活躍します。 「コロンビア」の軽量スニーカーの魅力を深掘り！ @BAILA ■ラクな着脱がかなう、結ばないシューレース シューレースは、ゴム紐をストッパーで留める仕様。紐を結ぶ手間なくさっと履けるので、脱ぎ履きがスムーズです。忙しい朝や移動の多い日にもストレスなく使えます。 @BAILA ■水場でも安心のメッシュ素材を採用 アッパーには、水を含みにくいメッシュ素材を採用しているため、川や海などのレジャーシーンでも安心。さらに、半透明のTPUパーツを組み合わせることで足もとのブレを抑え、安定感のある履き心地を実現しています。 ライターが履いて検証！ 「コロンビア」の軽量スニーカーを着用レビュー @BAILA きれいめ派&スニーカー初心者である、ライター伊佐治が試着。実際のリアルな履き心地をレビューします！ 軽くて涼しく、歩きやすい、夏のお出かけにぴったりな一足。グリップ力のあるアウトソールはやや硬めのつくりながら、インソールに十分なクッション性を備えているので、快適な履き心地です。メッシュ素材は想像以上にやわらかく、圧迫感のない軽やかな足あたりも魅力。足もとがほんのり透けるので、ソックス合わせでニュアンスを変えたり、レジャーシーンでは素足で履いたりと、シーンに合わせたアレンジも楽しめます。 スタイリッシュなルックスに、機能性と軽やかな履き心地を兼ね備えた「コロンビア」の軽量スニーカー。きれいめ服に似合う黒スニーカーをお探しの方に、おすすめの一足です。 お問合せ先／コロンビアスポーツウェアジャパン ☎︎0120-193-803 撮影／山田真由美、伊佐治里保 スタイリスト／鷹取美咲 取材・文／伊佐治里保,[],[]
【2026新作日傘】猛暑でも快適？アウトドアブランド「ロゴス」の日傘を徹底レビュー（＠BAILA）,https://news.yahoo.co.jp/articles/8c3fac9667bd7cd81380d05965182d1031063fb7,https://newsatcl-pctr.c.yimg.jp/t/amd-img/20260520-00010001-baila-000-1-view.jpg?exp=10800,2026-05-20T17:50:08+09:00,2026-05-20T17:50:08+09:00,＠BAILA,baila,＠BAILA,1006,男女ともに日傘が必須となってきた猛暑に備え、シンプルデザインで高機能な日傘を紹介します。ロゴスの「ソーラーブロック日傘・レギュラー」は、遮熱性能と耐久性を兼ね備えた一本として注目されています。今回はそんなアウトドアブランドならではの実用性を備えた日傘を取り上げ、日常使いの視点でその魅力をくわしくレビューします。 【2026最新】今年買うべき日傘を写真でチェック！ ロゴス「ソーラーブロック日傘・レギュラー」を実際に使ってみた感想 @BAILA ソーラーブロック日傘・レギュラー￥4980／ロゴス ロゴスは、アウトドアブランドならではの実用性と機能性に定評のあるブランド。今回の日傘も例外ではなく、遮熱性能や風に強い設計、ワンプッシュで開ける操作性など、日常でも使いやすい工夫がしっかりとそろっているのが魅力です。ここからは、その具体的なポイントを見ていきます。 @BAILA ■UVカット率も遮光率も99％以上！強い日差しからしっかり守る安心感 このモデルの生地は、ソーラーブロックの特殊加工がされており、UVカット率99.9％以上・遮光率99.99％以上と、日傘として重要な機能をしっかりと備えているのが特徴。直射日光の下でも、傘の内側に入ると光の強さが大きく和らぎ、顔まわりや腕に当たる日差しをしっかりカットしてくれます。 紫外線対策としての安心感はもちろん、遮光性能が高いことで“まぶしさ”や“体感的な暑さ”の軽減にもつながるのがポイント。日差しが強い日ほど、こうした性能の違いを実感しやすく、外出時のストレスを減らしてくれる印象です。 また、UVカットと遮光の両方に優れていることで、日焼け対策と快適さを同時にかなえられるのも魅力。通勤や外出、レジャーなど幅広いシーンで取り入れやすく、日常使いしやすい一本に仕上がっています。 @BAILA ■ワンプッシュOPENでスムーズに使える。日常での扱いやすさが魅力 片手で簡単に開けるワンプッシュOPEN機能を搭載しているのも、この日傘の特徴です。荷物を持っているときや、急に日差しが強くなったときでも、ボタン一つでサッと開けるため、外出時のストレスを軽減してくれます。 日傘は使用頻度が高いアイテムだからこそ、こうした操作性のよさは重要なポイント。ワンタッチで開閉できることで、通勤や移動中でも扱いやすく、「気づいたときにすぐ使える」快適さにつながります。,[],[]
【大人の今日のコーデ】肌見せTシャツとシックなスカートで大人の余裕感を（＠BAILA）,https://news.yahoo.co.jp/articles/5d111d15f4423c3640f8294bba812b20f68ca93d,https://newsatcl-pctr.c.yimg.jp/t/amd-img/20260520-00010000-baila-000-1-view.jpg?exp=10800,2026-05-20T08:03:48+09:00,2026-05-20T08:03:48+09:00,＠BAILA,baila,＠BAILA,470,今日のコーデは？「ワンツーなのにこなれて見える上、スタイルアップもかなう最愛バランス」 @BAILA 暑くてワンツーコーデが増える季節、“とりあえず”のTシャツはカジュアル見え＆マンネリ化しがち。そんなときはフレアスカートの出番！ ほんの少し攻めた背中あきTシャツに、ドラマチックに揺れるボリュームスカートを合わせれば、おしゃれなムードを漂わせた着こなしが即完成。 BAILA今日のコーデ フォトギャラリー Tシャツ￥9900／トゥモローランド（マカフィ） スカート￥55000／オブリオ バッグ￥234300／ショールーム ロイト（ザンケッティ） バッグに巻いたスカーフ￥16500／マニプリ イヤリング￥66000／プラウ ネックレス￥4840／サンポークリエイト（アネモネ） 靴￥119900／セルジオ ロッシ ジャパン カスタマーサービス（セルジオ ロッシ） 撮影／金谷章平 ヘア＆メイク／イワタユイナ スタイリスト／川瀬英里奈 モデル／土屋巴瑞季 撮影協力／1955 東京ベイ by 星野リゾート ※BAILA2026年6月号掲載,[],[]
