headline,mainEntityOfPage,image,datePublished,dateModified,author,media_en,media_jp,str_count,body,images,external_links
京成、2026年度の鉄道事業設備投資計画を発表　成田スカイアクセス線「複々線化」検討など、総額566億円（鉄道コム）,https://news.yahoo.co.jp/articles/5fb5565162c0c73b7608d934420ca102e5ec72fa,https://newsatcl-pctr.c.yimg.jp/t/amd-img/20260520-10004076-tetsucom-000-1-view.jpg?exp=10800,2026-05-20T17:55:00+09:00,2026-05-20T17:55:00+09:00,鉄道コム,tetsucom,鉄道コム,669,京成電鉄の3200形 京成電鉄は5月20日、2026年度の鉄道事業設備投資計画を発表しました。総額566億円を計上しています。 【画像】「スカイライナー」専用線路を新設！ どの区間が「複々線」になる？ 「安全・安心」の項目では、駅ホーム改修や耐震補強工事、法面補強工事、連続立体交差事業、京成本線荒川橋梁架替工事、鉄道施設の更新・改良を推進。ホーム改修については、2026年度は宗吾参道駅で工事を完了するほか、京成成田駅、京成関屋駅の改修工事に着手する予定です。 「日々の暮らし」の項目では、駅のバリアフリー化、駅施設のリニューアル工事、AI顔認証乗車サービス「Skyliner e-ticket Face Check in Go」の販路拡大に向けたシステム改修、磁気乗車券のQRコード乗車券化に向けた駅務機器更新、駅照明のLED化工事を推進。駅リニューアル工事は、松戸駅の工事が2026年度に完了する予定で、京成稲毛、みどり台、京成佐倉の各駅でも工事が進められます。 また、新型車両3200形の導入も継続。2026年度は7本42両の導入が計画されています。 「空港輸送」の項目では、成田空港のさらなる機能強化へ対応するため、宗吾車両基地拡充工事計画における新工場建設工事を推進。また、2028年度の運行開始に向け、押上駅と成田空港を結ぶ新型有料特急の車両製作を推進します。 このほか、成田スカイアクセス線新鎌ヶ谷～印旛日本医大間の複々線化、成田湯川～成田空港間の単線区間の複線化、空港駅機能の改善に向けた計画の検討も進めるとしています。,[],[]
JR東海ら、中津川駅の待合室・店舗をリニューアル　2026年秋ごろオープン予定（鉄道コム）,https://news.yahoo.co.jp/articles/1cfd5e144c9091c0329061c4d38cf1480217b3c2,https://newsatcl-pctr.c.yimg.jp/t/amd-img/20260520-10004075-tetsucom-000-1-view.jpg?exp=10800,2026-05-20T16:28:00+09:00,2026-05-20T16:28:00+09:00,鉄道コム,tetsucom,鉄道コム,442,待合室イメージ JR東海、JR東海リテイリング・プラスは5月20日、中津川駅の待合室および店舗をリニューアルすると発表しました。 【イメージ画像】以前より約2.5倍の面積となるリニューアル後の店舗 中津川駅は、特急「しなの」が停車する、東美濃エリアの玄関口です。両社は、2025年5月の駅構内店舗の閉店をきっかけに、地域の関係者との協議を重ね、新たな「まちの顔」にふさわしい上質な駅空間を創出することとしたとしています。 本リニューアルでは、待合室と店舗を一体的に再整備。待合室は明るく開放的な空間とし、ホームに面した箇所にはガラス窓を備えるつくりとします。店舗は、旧ベルマークキヨスクの約2.5倍となる店舗面積を確保し、「PLUSTA 中津川」としてオープン。通勤・通学のデイリーユースから観光利用まで、幅広いニーズに対応します。 リニューアルした待合室・店舗のオープンは、2026年秋ごろを予定。JR東海は工事のため、5月25日始発列車より、仮待合室の利用を開始するとしています。,[],[]
阪神、2026年度の鉄道事業設備投資計画を発表　「新型車両」導入や野田駅改良工事などを計画（鉄道コム）,https://news.yahoo.co.jp/articles/b6a9cef1fa30687d8b2785792f7ac9d99b053599,https://newsatcl-pctr.c.yimg.jp/t/amd-img/20260520-10004074-tetsucom-000-1-view.jpg?exp=10800,2026-05-20T14:43:00+09:00,2026-05-20T14:43:00+09:00,鉄道コム,tetsucom,鉄道コム,523,2027年春営業運転予定の新型車両「3000系」 阪神電気鉄道は5月20日、2026年度の鉄道事業設備投資計画を発表しました。総額172億円を計上しています。 【イメージ画像】2027年度しゅん工予定、改良工事後の野田駅の様子は？ 「揺るぎない安全基盤の確立」の観点では、ホーム柵の整備を推進。2026年度は、福島、淀川、姫島の各駅と、西宮駅1・4番線で供用開始する計画です。また、阪神なんば線淀川橋りょうの改築事業、軌道改良、高架橋などの耐震補強工事、PTC（列車運行管理）システムの更新やPTCセンター建物の耐震化も実施します。 「サービス水準の更なる向上」の観点では、新型急行用車両「3000系」を導入する予定。同形式は2027年春の営業運転開始を予定しており、6両編成中1両では座席指定サービスを提供する計画です。 また、野田駅の改良工事を2026年度に着手。2027年度しゅん工予定で、可動式ホーム柵の整備、エスカレーター・エレベーターの更新、ホーム床面の美装化などを計画しています。 このほか、「デジタル化による利便性の向上」の観点で「阪神アプリ」の機能強化、「環境・社会への貢献」の観点で脱炭素に向けた取組みの推進を計画しています。,[],[]
阪急、2026年度の鉄道事業設備投資計画を発表　2000系の増備や9300系リニューアル推進など（鉄道コム）,https://news.yahoo.co.jp/articles/f37feb509c9f50aec5526748c01b2fa988840cd7,https://newsatcl-pctr.c.yimg.jp/t/amd-img/20260520-10004073-tetsucom-000-727-view.jpg?exp=10800,2026-05-20T14:31:00+09:00,2026-05-20T14:31:00+09:00,鉄道コム,tetsucom,鉄道コム,717,阪急電鉄の車両 阪急電鉄は5月20日、2026年度の鉄道事業設備投資計画を発表しました。総額420億円を見込んでいます。 【画像】阪急が実現を目指す新線「なにわ筋連絡線」「新大阪連絡線」とは 「安全な鉄道サービスの提供」の観点では、ホーム柵の整備、連続立体交差事業の推進、軌道改良、法面補強や耐震補強、避難看板の設置を実施。ホーム柵は、可動式のものを雲雀丘花屋敷駅や桂駅1・C号線など7駅16番線、固定式ホーム柵を嵐山駅1・2号線など3駅6番線に設置します。 「利便性の更なる向上と安心・快適な鉄道サービスの提供」のうち、施設関連では、十三駅とJR線大阪駅を結ぶ「なにわ筋連絡線」、十三駅と新大阪駅を結ぶ「新大阪連絡線」について、整備計画の具体化に向けて注力します。また、神戸線武庫之荘～西宮北口間に設置する「武庫川新駅」の整備も推進。2026年度は工事に着手する予定です。 このほか、大阪梅田駅の駅改良工事も推進。まずは3階コンコース・ホームからリニューアルに着手するとしています。 車両関連では、新型車両の新造、車両リニューアルを推進。2026年度は、2000系5本の導入のほか、9300系3本のリニューアル工事を予定しています。また、車内防犯カメラの設置を推進。2027年度末の全車両導入を実現すべく、2026年度末には約80パーセントの車両への導入を目指す計画です。このほか、前方カメラの設置、阪急沿線アプリの機能向上も実施します。 「持続的な事業運営の推進」の観点では、脱炭素の取組の推進によるモーダルシフト、働きやすい職場環境の整備を推進。さらなる利用促進や、安定的な事業運営を支える人的基盤の強化に取り組むとしています。,[],[]
列車内で「5G」がさらにつながりやすく　JR東・KDDI、山手線車両内を5G「ミリ波」エリア化する実証に成功（鉄道コム）,https://news.yahoo.co.jp/articles/3fda8c0488798ef29b3381a91f2fac1be1d73278,https://newsatcl-pctr.c.yimg.jp/t/amd-img/20260520-10004072-tetsucom-000-1-view.jpg?exp=10800,2026-05-20T14:16:00+09:00,2026-05-20T14:16:00+09:00,鉄道コム,tetsucom,鉄道コム,604,山手線の車両 KDDIとJR東日本は5月20日、山手線の車両内を5G（ミリ波）エリア化する実証に成功したと発表しました。 【イメージ画像】「5G」どれだけつながりやすくなった？ 実証機器導入前後の比較 5Gのミリ波は、高速・大容量通信を実現する一方で、電波の直進性が強く遮蔽物の影響を受けやすいため、エリア展開が課題となっています。KDDIは、ミリ波の通信エリアを自律的に最適化して構成する無線中継器し、ビル街などの遮蔽物の多い屋外を中心に、通信エリアを拡大してきました。 ただし、鉄道車両の内部は、金属で覆われた空間のため、ミリ波が遮蔽されてしまい、既設のミリ波基地局や中継器の活用だけではエリア化が困難だったといいます。 そこで両社は、東京総合車両センターに留置中の山手線車両を用い、実証を実施。基地局から受信したミリ波の電波を再放射する構成品を設置し、車両内の必要な箇所を効率的にエリア化しました。 本実証では、ガラスアンテナを設置して車外からのミリ波電波を捉え、漏洩アンテナやロッドアンテナにより車内へミリ波電波を再放射しました。これにより、通信速度1Gbpsを達成可能な通信エリアは、車両全体の約40パーセントから約97パーセントに改善したといいます。 両社は今後、本実証で得られた知見に基づき、あらゆる屋内環境へミリ波の活用を広げ、さらなる通信品質の向上と利用者の利便性向上を目指すとしています。,[],[]
