headline,mainEntityOfPage,image,datePublished,dateModified,author,media_en,media_jp,str_count,body,images,external_links
老朽化で工場の安全確保が困難に　パナソニックコネクト福島工場2025年5月に閉鎖へ（福島中央テレビ）,https://news.yahoo.co.jp/articles/62a734ad893acd297c7ce9e670a416e8b70d8e85,https://newsatcl-pctr.c.yimg.jp/t/amd-img/20240118-01832498-fct-000-3-thumb.jpg?exp=10800,2024-01-18T18:01:00+09:00,2024-01-18T20:12:18+09:00,福島中央テレビ,fct,福島中央テレビ,496,\nFCT福島中央テレビ\nパナソニックホールディングス傘下でシステム開発を手がけるパナソニックコネクトは、福島市にある福島工場を2025年5月末に閉鎖すると発表しました。\n\n■パナソニックコネクト執行役員 新家伸浩 最高人事責任者\n「パナソニックコネクトの管轄である福島工場を閉鎖することを決定しました。」\n\n福島市太平寺にあるパナソニックコネクト福島工場は、1970年に操業し、オーディオ関連製品やデジタルカメラなどの製造をしていましたが、国際的な競争により海外に生産拠点を移すなど工場の規模は縮小傾向にありました。\n\n■新家伸浩 最高人事責任者\n「時代の流れの中で、どうしてもこの工場を維持・運営するだけの事業を確保することが大変困難になってきてしまいまして、今回苦渋の決断で工場を閉鎖することを決定しました。」\n\n閉鎖の理由は経年劣化による老朽化で工場の安全性の確保が難しいことをあげています。\n閉鎖の時期は2025年5月末を予定しています。\n福島工場では現在、製造を請け負う人材会社に所属する450人ほどが働いています。\n跡地の利用はまだ決まっていません。,[],[]
使い方を誤ると火事を引き起こす原因に…冬に欠かせぬ暖房器具の気をつけたい使い方（福島中央テレビ）,https://news.yahoo.co.jp/articles/7ea5d5cc8f3782f6e0b71b7078e78729c1edd608,https://newsatcl-pctr.c.yimg.jp/t/amd-img/20240118-05135713-fct-000-2-thumb.jpg?exp=10800,2024-01-18T14:33:00+09:00,2024-01-18T19:03:15+09:00,福島中央テレビ,fct,福島中央テレビ,594,\nFCT福島中央テレビ\n寒さも本格化し、暖房器具を使うことが多い今。改めて火事への注意が必要です。生活に潜むリスクをまとめました。\n\n冬になると増えるとされる火事。2023年の大みそかには、会津若松市で80代の女性が亡くなるなど、福島県内でも被害が相次いでいます。\n一般的に冬は、暖房器具を使う機会が多くなるため、火事が増えるとされています。\nその便利さもあり冬には欠かせない暖房器具ですが、やはりちょっとした不注意で思わぬ火事を引き起こすことがあるんです。\n\n例えば、こんなケース。\n石油ストーブの近くに洗濯物を干す。\n寒い冬は洗濯物が乾きづらく、ついついやってしまうことが想定されますが…これも火事の原因！製品評価技術基盤機構NITEの実験では石油ストーブの火が洗濯物に燃え移りました。\n\nそして絶対にやってはいけないケースが…灯油と間違えてガソリンを給油してしまうこと。\n異常燃焼でファンヒーターが…爆発することもあり注意が必要です。\n\nそして最後は、殺虫剤などのスプレー缶をファンヒーターの前に置く…ファンヒーターの熱でスプレー缶の内部の圧力が高まり破裂しました。\nスプレー缶から吹き出した可燃性ガスに引火し、その後燃え広がりました。\n\nまだまだ、寒い日が続きます。ちょっとした不注意で火事を引き起こさないために、暖房器具は正しく使いましょう。,[],[]
「例年に比べ収穫は5分の1ぐらいか…」冬の名物雪下キャベツがダブルパンチ（福島中央テレビ）,https://news.yahoo.co.jp/articles/4d8f95bb3c2af7817718cfa990d6615805c7e7c7,https://newsatcl-pctr.c.yimg.jp/t/amd-img/20240118-09467495-fct-000-2-thumb.jpg?exp=10800,2024-01-18T16:32:00+09:00,2024-01-18T19:07:15+09:00,福島中央テレビ,fct,福島中央テレビ,775,\nFCT福島中央テレビ\n積雪の多い地域で作られる雪下キャベツ。猪苗代町で収穫が行われました。ただ暖冬傾向と夏の猛暑の影響で、生産者はかつてない冬を迎えています。\n\n■案内する 深谷知広さん\n「普通これ、もう半分ぐらいまで埋まっているんですよ、でも全然…です。」\n\n「雪下キャベツ」を生産する猪苗代町の深谷知広さんの畑です。畑には雪が積もっているものの、ほとんどのキャベツが顔を出していました。\n\n■猪苗代キャベツ研究会 深谷 知広さん\n「今週初めの雪でやっと、ここまで、その前日までは雪は全然なかったです。」\n「雪下キャベツ」は雪の中で熟成されることで実がしまり、甘さが際立つようになります。\n例年なら雪にすっぽりと覆われ、スコップで雪をかきわけてキャベツを掘り出しますが…\n\n■深谷さん\n「今年はスコップがいらないですね」\n18日正午の時点で、猪苗代の積雪は4センチ。例年の8パーセントしか雪がありません。\n\n■深谷 知広さん\n「まだ雪もかぶっていないというのもあって、熟成が進まないというのもありまして、ちょっと例年に比べてちょっと固めというイメージはあります」\nさらに…\n\n■深谷さん\n「寒くて腐ってきているんですけど」\n\n雪の中にあるキャベツは保温され凍ることはないそうですが、暖冬の影響もあって昼と夜の寒暖差が大きく腐ってしまうものもあります。\nまた2023年夏の猛暑で、キャベツ自体の量が少なく「雪下キャベツ」の生産量も限られます。この状況に深谷さんも頭を悩ませています。\n\n■深谷 知広さん\n「例年に比べて5分の1ぐらいしか、収穫できないかなと…（影響が）ダブルできています。初めてなのでこんな年は、正直どうしていいのか分からないんですけど。とりあえず雪が積もってほしいです。」,[],[]
大熊町が国が先行して除染する「特定帰還居住区域」を追加へ　議会全員協議会に示す（福島中央テレビ）,https://news.yahoo.co.jp/articles/147ae057ad0eb0339825befab1dbe89a4d056256,https://newsatcl-pctr.c.yimg.jp/t/amd-img/20240118-08666629-fct-000-4-thumb.jpg?exp=10800,2024-01-18T16:13:00+09:00,2024-01-18T18:53:16+09:00,福島中央テレビ,fct,福島中央テレビ,350,\nFCT福島中央テレビ\n原発事故の帰還困難区域で国が先行して除染する「特定帰還居住区域」について大熊町が区域を追加する考えを示しました。\n\n帰還困難区域に設ける 「特定帰還居住区域」では、国が先行して除染し住民の帰還を進めます。\n大熊町では下野上1区の一部、約60ヘクタールですでに除染が始まっています。\n\n町民への調査で197世帯が帰還の意向を示していて、大熊町は野上1、2区、熊1、2、3区、熊川、町、夫沢2区、3区の9つの行政区の一部、約380ヘクタールを「特定帰還居住区域」に追加する考えを議会全員協議会で示しました。\n\n■大熊町 吉田淳町長\n「除染作業はもちろん解除についてもできる限り早く対応して頂くように要望したい。」\n\n今後、国が認めれば先行除染が行われます。,[],[]
福島県で極上の冬旅を！3000円お得な『福島県「来て。」割』の予約受け付け始まる（福島中央テレビ）,https://news.yahoo.co.jp/articles/8ee0d4955f38c376fa01f9a9a6e23bef393235a5,https://newsatcl-pctr.c.yimg.jp/t/amd-img/20240118-09383456-fct-000-3-thumb.jpg?exp=10800,2024-01-18T17:08:00+09:00,2024-01-18T19:12:17+09:00,福島中央テレビ,fct,福島中央テレビ,729,\nFCT福島中央テレビ\n年末年始はにぎわいがもどり温泉旅館などで年末年始を過ごしたという人も多かったそうです。この好調な流れを福島県内の観光地に呼び込む、福島県の旅行支援策『福島県「来て。」割』の予約受け付けが1月18日から始まりました。\n\nコロナ禍が明け、この年末年始は各地で人の賑わいが戻ってきました。\nその傾向は東北新幹線にも表れていて、JR東日本によりますと先月28日から今月4日までの8日間で那須塩原から郡山間を利用した人は92.4万人と前の年と比べると111％と大きく増えました。\n\nこのにぎわいを福島県内に呼び込むことにつながる福島県の旅行支援策の予約受け付けが18日から始まりました。それが！\n\n■電話での予約受付\n「あっ、「来て。割」ですよね」\n旅行者が減る冬の閑散期のキャンペーン『福島県「来て。」割』です。\n福島市の高湯温泉にある安達屋旅館でも、さっそく予約の電話が鳴っていました。\n\n『福島県「来て。」割』は旅行者が福島県内のホテルや旅館を利用した際に1泊8千円以上の宿泊について3千円を割り引くもので、福島県が2月を対象に実施します。\n\n宿泊客はもともと8割以上が福島県外からだというこちらの旅館。\n「来て。」割を使って、さらに多くの人に来てもらいたいと期待を寄せます。\n\n■安達屋旅館 菅野信幸 専務取締役\n「冬の期間ということで、少しお客様の足も遠のくこともあるので、そこでさらにプラスで、せっかくだから行ってみたいなと思うような企画になってくれればいい」\n\n福島県によりますと、「来て。」割は福島県内700以上のホテルや旅館で実施され、30万泊分の利用を見込んでいるということです。,[],[]
福島市が氷見市と金沢市へのふるさと納税寄付を代理受け付け　被災自治体の業務軽減へ（福島中央テレビ）,https://news.yahoo.co.jp/articles/4e6c9d93e0cd18586c81da5ea0c1d82e85abb380,https://newsatcl-pctr.c.yimg.jp/t/amd-img/20240118-05348224-fct-000-5-thumb.jpg?exp=10800,2024-01-18T14:08:00+09:00,2024-01-18T18:53:16+09:00,福島中央テレビ,fct,福島中央テレビ,352,\nFCT福島中央テレビ\n福島市は能登半島地震で被災した自治体に対するふるさと納税の寄付を代理で受け付ける支援を始めました。\n\n福島市の木幡市長は、富山県氷見市と石川県金沢市のふるさと納税の寄付を代理で受け付けると発表しました。木幡浩市長「様々な面で被災地の自治体の皆さんは手一杯の状況になっています。そうしたなかでふるさと納税をしていただくのは良いのですが、その事務ができなできないという現状があります。」\n\n被災した自治体の業務負担を軽くしようという狙いがあります。寄付額は2000円以上で、インターネットの「ふるさとチョイス」のサイトで募集します。災害支援のため返礼品はありませんが、ふるさと納税の税金の控除が受けられます。氷見市への寄付受付は始まり、金沢市も1月21日までに始まります。,[],[]
燃料デブリの試験的な取り出しに向け　圧力をかけた水で堆積物を洗い流す作業続ける【福島県】（福島中央テレビ）,https://news.yahoo.co.jp/articles/d4919aa816a9b5a43085df64e80035a15884b01d,https://newsatcl-pctr.c.yimg.jp/t/amd-img/20240118-05435561-fct-000-1-thumb.jpg?exp=10800,2024-01-18T12:05:00+09:00,2024-01-18T12:05:00+09:00,福島中央テレビ,fct,福島中央テレビ,292,\nFCT福島中央テレビ\n福島第一原発2号機の試験的な燃料デブリの取り出しに向けて、東京電力は水圧で堆積物を除去する作業を続けています。\n\n東京電力は溶け落ちた核燃料「燃料デブリ」の取り出しに向け、今年度中に2号機で試験的な取り出しを始める計画です。\n\nしかし、原子炉格納容器のロボットアームの挿入口が堆積物で覆われているため、1月17日から圧力をかけた水で堆積物を洗い流す作業を進めています。\n東京電力によりますと、17日はおよそ3時間半に渡って堆積物に水を噴射したということです。\n\n東京電力は18日も水の噴射を続け、堆積物の状況が分かり次第公表するとしています。,[],[]
JR東北新幹線の利用者　新型コロナの5類移行後初の年末年始で前年比110％に【福島県】（福島中央テレビ）,https://news.yahoo.co.jp/articles/f90871f035de632e6d65dcaac4d758eb3267e361,https://newsatcl-pctr.c.yimg.jp/t/amd-img/20240118-09885982-fct-000-2-thumb.jpg?exp=10800,2024-01-18T12:00:00+09:00,2024-01-18T12:08:15+09:00,福島中央テレビ,fct,福島中央テレビ,297,\nFCT福島中央テレビ\n年末年始に東北新幹線を利用した人は、前年の約110％と増加しました。\n\nJR東日本によりますと、12月28日から1月4日の8日間に、東北新幹線の那須塩原駅から郡山駅間を利用した人は、92.4万人でした。\n前年の111％に増えましたが、2018年と比べると約93パーセントで、コロナ禍前の水準には戻っていません。\n\nまた、山形新幹線の福島駅と米沢駅間を利用した人は10.5万人で、前年のおよそ110％でした。\n\nJR東日本は「新型コロナの5類移行後、初めての年末年始で乗客が増えたものの、生活様式が変わってコロナ禍前の水準には至らなかった」とみています。,[],[]
6人がけが　郡山市のショッピングセンター近くの市道で乗用車など6台が衝突【福島県】（福島中央テレビ）,https://news.yahoo.co.jp/articles/6042eac1bd3a0a42dc6590c9e947858b42529a5f,https://newsatcl-pctr.c.yimg.jp/t/amd-img/20240118-02676242-fct-000-1-thumb.jpg?exp=10800,2024-01-18T12:06:00+09:00,2024-01-18T12:06:00+09:00,福島中央テレビ,fct,福島中央テレビ,287,\nFCT福島中央テレビ\n1月17日夕方、郡山市の市道で乗用車など6台が衝突する事故があり、男女6人がけがをしました。\n\n事故があったのは郡山市西ノ内の市道です。\n17日午後5時40分ごろ、郡山市の70代の男性が運転する乗用車が咲田方面に走行中、対向してきた乗用車や、その後の乗用車など3台に衝突し、そのうち2台が玉突き事故を起こしました。\n\nこの6台がからむ事故で、運転していた人や同乗者など男女6人が軽いけがをしました。\n\n市道は車線のない単線道路で、近くに総合病院やショッピングセンターがあり、夕方は混雑します。\n警察などが事故の原因を調べています。,[],[]
