headline,mainEntityOfPage,image,datePublished,dateModified,author,media_en,media_jp,str_count,body,images,external_links
須賀川市長選挙　新人の元市議が立候補を表明　現職は今期で引退　ほかにも立候補の動き＜福島県＞（福島テレビ）,https://news.yahoo.co.jp/articles/213da44b769d5048c35d146f163edb931e810622,https://newsatcl-pctr.c.yimg.jp/t/amd-img/20240524-90023946-ftv-000-1-thumb.jpg?exp=10800,2024-05-24T19:35:02+09:00,2024-05-24T19:35:02+09:00,福島テレビ,ftv,福島テレビ,245,\n福島テレビ\n任期満了に伴う福島県須賀川市長選挙に元市議会議員の安藤聡さんが立候補を表明した。\n\n「幸せと豊かさを実感し続けられる街をめざしてこの度の須賀川市長選に立候補することを表明します」\n安藤聡さんは2023年まで3期12年にわたり須賀川市議として活動を続け、副議長も務めた。\n\n現職の橋本克也市長が今期限りでの引退を表明していて、市長選をめぐっては安藤さんの他にも立候補に向けた動きがある。\n須賀川市長選は7月14日告示、21日投開票の日程で行われる。\n福島テレビ,[],[]
容疑者の59歳男を送検　福島・西郷村の盛り土事件　容疑を一部否認　供述の信ぴょう性を慎重に捜査（福島テレビ）,https://news.yahoo.co.jp/articles/7bb66982b570c3e5aa7bedaa790478849357ddfc,https://newsatcl-pctr.c.yimg.jp/t/amd-img/20240524-90023944-ftv-000-1-thumb.jpg?exp=10800,2024-05-24T19:31:02+09:00,2024-05-24T19:31:02+09:00,福島テレビ,ftv,福島テレビ,393,\n福島テレビ\n福島県西郷村の盛り土問題を受け、5月23日逮捕された茨城県の男。警察は容疑を一部否認する供述の信ぴょう性を慎重に調べる方針だ。\n\n森林法違反の疑いで24日送検された茨城県の土砂処分業長嶺嗣義容疑者（59）。\n西郷村に所有する土地で約1.5ヘクタールの盛り土を勝手に造成し、福島県の中止命令に従わなかった疑いが持たれている。\n\n「県の命令に従い、盛り土の規模を縮小しようと思っていた」そのように供述し、容疑を一部否認していることが捜査関係者への取材で新たに分かった。\nしかし、警察は長嶺容疑者の供述の信ぴょう性を慎重に調べることにしている。他県でも出されていた行政処分に従わず、制限を超えた盛り土を放置し続けていたことなどがその理由だ。\n\n西郷村の今回の現場以外にも県内で複数カ所確認されている盛り土。警察は余罪についても捜査を進める方針。\n福島テレビ,[],[]
住民がいない故郷で続けるのか…大堀相馬焼　まるで「ひとごと」原発事故に翻弄された窯元たち【福島発】　（福島テレビ）,https://news.yahoo.co.jp/articles/208ddecacb608f412281a7d8dde55de9aee45b5c,https://newsatcl-pctr.c.yimg.jp/t/amd-img/20240524-90023945-ftv-000-1-thumb.jpg?exp=10800,2024-05-24T21:00:02+09:00,2024-05-24T21:00:02+09:00,福島テレビ,ftv,福島テレビ,1313,\n福島テレビ\n10年以上続いた避難、そして限定的な解除。東日本大震災と原発事故に翻弄された福島県浪江町・大堀相馬焼の窯元たち。「産地を離れた伝統は大堀相馬焼と呼べるのか」自問自答しながらも伝統を守り続ける窯元たちの今を追った。\n\n＜13年ぶりにふるさとへ＞\n「13年ぶりに大堀に戻ってきました。これからまた100年200年と、この大堀の地で大堀相馬焼が継承されるのかなと思っています」\n300年以上続く大堀相馬焼の窯元の一人、陶吉郎窯・近藤学さん。2024年3月15日、ふるさと・福島県浪江町大堀地区に念願の工房と店舗が完成した。\n\n＜産地を離れた伝統＞\n東京電力・福島第一原発から約10キロの距離にある「大堀相馬焼の里」。原発事故後、帰還困難区域となり約20の窯元は故郷を追われた。\n「産地を離れた伝統は大堀相馬焼と呼べるのか」・・・近藤さんは、避難先の福島県いわき市で考え続けていた。当時、近藤さんは「やっぱり大堀に戻って、本来の姿の大堀相馬焼を継承しないと、伝統が途絶えてしまうなという思いが自分にあった。どうしても大堀には帰りたい」と話していた。\n\n＜伝統は大堀にある＞\n2023年に一部で避難指示が解除された浪江町大堀地区。解除のエリアは、伝統的工芸品の産地として文化的な価値を守るため窯元の敷地だけとなる“点”の解除だった。\n休閑窯の半谷秀辰さんは「はっきり言って国のやり方は頭にきている。大堀の住民、窯元ではない住民がいるわけだ。これを別れさせるような感じだ、二分して。ありがた迷惑だ」と話す。\n\n＜生業としてやっていけるのか＞\n福島県白河市に避難した錨屋窯・山田慎一さんは「帰りたい部分もあるので、大堀の再開というのも考えの中にはある」としつつも「どうやってあそこで生業として生計を立てていくのか、ビジョンが全くみえない状況」と話す。そして…「”いかりや”という屋号は、この地をいかなることがあっても、とどまれるようにと船の錨の屋号をもらった。けれども、そうはいかなかったですね、今回はね」とつぶやいた。\n\n＜まるで ひとごと＞\n2020年代までに「希望する」すべての住民の帰還を目指す政府。「希望しない」住民の自宅や森林などは、今後も帰還困難区域として残る。\n陶吉郎窯の近藤学さんは「国で希望者は除染やるけど、希望してない人はやらないなんていうこと自体が、全然この状況にあってない。どこでそういうこと発想してんだって。第三者が他人事のように、ただその物語を決めている」という。\n\n＜原点回帰＞\n2024年4月、福島県いわき市に構えた登り窯に薪を入れる陶吉郎窯の近藤さん。「自然の薪でもって、その炎の力で焼き物を焼いていく原点だよね」と話す。\n焼き物の「登り窯」は伝統の礎を築いたシンボル、そして大堀相馬焼の原点だ。近藤さんは「どうしても大堀で登り窯やりたいなという気持ちが、どんどん強くなってくる」と話した。この春、近藤さんは13年ぶりに故郷に戻り、伝統の復活を目指す。\nただ…ほかに戻る窯元はいない大堀地区。原発事故から14年目の現在地だ。\n福島テレビ,[],[]
ヨーカドー撤退の郡山市に新たな動き　女子バレーチームが本拠地移転　プロスポーツの経済効果に期待（福島テレビ）,https://news.yahoo.co.jp/articles/e3df375c16fcf86e0c8b0502d717627cb6acd2c6,https://newsatcl-pctr.c.yimg.jp/t/amd-img/20240524-90023943-ftv-000-1-thumb.jpg?exp=10800,2024-05-24T19:25:02+09:00,2024-05-24T19:25:02+09:00,福島テレビ,ftv,福島テレビ,1362,\n福島テレビ\nイトーヨーカドーの撤退で福島県内経済への悪影響も心配されるが、一方で経済が明るくなる動きもある。福島県が「フクシマ5スターズ」と呼ぶ、県内を拠点とする5つのプロスポーツチームだ。\n今回は、2024年4月に郡山市をホームタウンにすることを発表したデンソー女子バレーボール部の動きと、地域経済への影響を取材した。\n\n＜プロスポーツ本拠地移転＞\nデンソー・山崎康彦副社長：「長期的なバレーボールの発展のためにもＳ－Ｖ．ＬＥＡＧＵＥに参戦し、メインホームタウンを福島県郡山市にさせていただいたと」\n\n郡山市にホームタウンを移すのがデンソーの女子バレーボールチーム、「デンソーエアリービーズ」Ｖリーグ１部で前のシーズン5位、日本代表選手も輩出する強豪チームだ。ホームは愛知県だったが、2024年10月から新たに始まる「Ｓ－Ｖ．ＬＥＡＧＵＥ」の開幕に合わせ、拠点を移す。\n中元南キャプテンは「（郡山に）拠点をおいて試合ができるのを嬉しく思います。選手として結果を出すことで、ホームの方々、ファンの方々に恩返しできると思っているので」と話した。\n\n7年前に県や市と協定を結んで、「第2の本拠地」として活動してきたエアリービーズ。移転後はホームゲームの8割が福島県内で開催される計画だ。市民からは期待の声も・・「やっぱ、スポーツのまちですからね。音楽とスポーツと、けっこう盛り上がるんじゃないですか。そうなってほしいですけどね」「お互いバレーボールが好きな人たち同士で、良い刺激を分け合ったりできるんじゃないかなと思います」と好意的だ。\n\n＜ホーム移転に動き＞\nホーム移転に向けて動きも出ている。チームは5月、練習用の体育館を建設する土地を借りようと郡山市に要望書を提出した。\n\n福島テレビ・宮下真結子記者：「デンソーエアリービーズの練習用体育館は、ショッピングモールのすぐ横、街中にできる予定です」\n開成山公園に隣接する市有地。体育館にはチームの事務所も入り、市民との交流や防災拠点としても活用される予定だ。\n\n＜専門家は経済効果期待＞\n専門家は経済効果が期待できると話す。東京商工リサーチの村越喜人さんは「観光客数の増加によっていろんな店舗の売り上げが増えることが期待されますし、広告収入も増加するのではないかな」と話す。このほか、雇用の創出や関係者の転入による税収アップなどさまざまなメリットが。\n一方で、受け入れる側の体制づくりも欠かせないと指摘する。「その地域の自治体だったり、住民を巻き込んで、企業側だけじゃなくて地元側も考えていければ、相乗効果がもっと得られるのではないかなと思っております」と東京商工リサーチの村越さんは話した。\n\n街全体で盛りあげていくことが大きな経済効果を生むと言えそうだ。\n郡山市では要望書の提出を受けて早速動きがあった。\n24日開かれた定例の市長会見で品川市長は体育館の建設に向け、5月30日にチームを運営するデンソーと協定を結ぶことを明らかにした。市長は、チームにとっても市民にとっても望ましい提案だと前向きな姿勢を示していた。\n体育館は早ければ3年後に完成する予定で、プロスポーツの力で郡山経済の活性化が期待される。\n福島テレビ,[],[]
市税を納期内に収めたのに督促状…７１５件誤って送るミスが発覚＜福島・いわき市＞（福島テレビ）,https://news.yahoo.co.jp/articles/b2ef125230b0a84605311581e3bdf7750b175402,https://newsatcl-pctr.c.yimg.jp/t/amd-img/20240524-90023949-ftv-000-2-view.jpg?exp=10800,2024-05-24T20:23:02+09:00,2024-05-24T20:26:01+09:00,福島テレビ,ftv,福島テレビ,282,\n福島テレビ\n福島県いわき市が、市税を納期内に納付していたにもかかわらず、誤って督促状を送るミスをしていたことが分かった。\n\n市によると、誤って送った督促状は、令和６年度の固定資産税と都市計画税の第１期。ＱＲコードを利用して納付をした７１５件分のデータが反映されていなかったのが原因という。\n\n５月２３日に市民からの報告があり発覚し、「二重に納付してしまった」という連絡も１件確認されている。いわき市は誤って督促状を送付した市民に、お詫びと説明の文書を送っていて、二重に納付しないように呼びかけている。また委託業者には、再発防止を求めた。\n福島テレビ,['https://newsatcl-pctr.c.yimg.jp/t/amd-img/20240524-90023949-ftv-000-2-view.jpg?exp=10800'],['https://news.yahoo.co.jp/articles/b2ef125230b0a84605311581e3bdf7750b175402/images/000']
福島・南相馬市のバラ園で見ごろに　各地で晴れの天気　伊達市梁川で30℃予想　熱中症に注意　（福島テレビ）,https://news.yahoo.co.jp/articles/2efcc2d404d5e4677f321fd32ae6db9d546b2ac8,https://newsatcl-pctr.c.yimg.jp/t/amd-img/20240524-90023939-ftv-000-1-thumb.jpg?exp=10800,2024-05-24T11:55:02+09:00,2024-05-24T11:55:02+09:00,福島テレビ,ftv,福島テレビ,346,\n福島テレビ\n福島県内は高気圧に覆われ全域で晴れるなか、南相馬市のバラ園ではバラの花が見頃を迎えている。\n\n福島テレビ・熊谷七海アナウンサー：「朝から快晴の南相馬市です。手元の気温計も29.1度となっています。そんな中、こちらのバラ園では週末にかけて満開となるということです」\n\n南相馬市小高区の「横田のバラ園」で見頃を迎えているのは、約150種類3000本のバラの花。農家だった横田芳朝さんが「原発事故で被災した故郷の交流人口を増やしたい」と2019年から整備を始めた。\n\n5月24日の福島県内は高気圧に覆われ全域で晴れていて、各地で気温が上昇。予想最高気温は伊達市梁川で30℃、福島市で29℃、郡山市と会津若松市で26℃となっていて、熱中症への注意が必要だ。\n福島テレビ,[],[]
ものづくりの課題解決へ　福島県とトヨタ自動車が連携し県内企業を支援　課題を聞き取りアドバイス（福島テレビ）,https://news.yahoo.co.jp/articles/64a4d79386d4472c938866cfa5cb4fa38dac1680,https://newsatcl-pctr.c.yimg.jp/t/amd-img/20240524-90023941-ftv-000-1-thumb.jpg?exp=10800,2024-05-24T12:00:02+09:00,2024-05-24T12:00:02+09:00,福島テレビ,ftv,福島テレビ,272,\n福島テレビ\n福島県内の関係人口拡大とものづくり企業の課題解決を目指す活動が行われている。\n\nこの貢献活動は福島県とトヨタ自動車が連携して進めているもので、県内の関係人口を拡大するねらいがある。\n5月23日からトヨタの社員３人が須賀川市の糸井火工を訪れ、会社の抱える課題を聞き取るなど意見交換が進められている。この会社では生産効率の向上を課題と捉えていて、大手企業でモノづくりに携わる視点でアドバイスを受け、解決の糸口をみつけていく。\n今後はインターネット上で会議を行うなどして、約4ヵ月間にわたって活動が続けられる。\n福島テレビ,[],[]
容疑を一部否認　逮捕の茨城県の59歳男　福島・西郷村の盛り土無許可開発　余罪も追及へ（福島テレビ）,https://news.yahoo.co.jp/articles/384398d1288e02fef5a849b0dc96bb0a4c583d7a,https://newsatcl-pctr.c.yimg.jp/t/amd-img/20240524-90023940-ftv-000-1-thumb.jpg?exp=10800,2024-05-24T11:57:01+09:00,2024-05-24T11:57:01+09:00,福島テレビ,ftv,福島テレビ,401,\n福島テレビ\n福島県西郷村の盛り土問題をめぐり、23日逮捕された男は「規模を縮小しようと思っていた」などと供述し、容疑を一部否認していることが分かった。\n\n森林法違反の疑いで23日逮捕された茨城県の土砂処分業、長嶺嗣義容疑者（59）は、西郷村の私有地で１ヘクタールを超える盛り土をするなど勝手に開発し、福島県の中止命令に従わなかった疑いが持たれている。\n\n捜査関係者によると、長嶺容疑者は警察の調べに対して「県の命令に従い、盛り土の規模を縮小しようと思っていた」などと供述し、容疑を一部否認しているということだ。しかし、警察は長嶺容疑者が他県でも出されていた行政処分に従わず、制限を超えた盛り土を放置し続けていたことなどから、供述の信ぴょう性を慎重に調べることにしている。\n\nまた、福島県内の他の盛り土にも関わっていた可能性もあることから、余罪についても捜査を進める方針。\n福島テレビ,[],[]
元なでしこ・鮫島彩選手が現役引退　2011年ワールドカップ優勝に貢献　25日のリーグ最終節を最後に（福島テレビ）,https://news.yahoo.co.jp/articles/dc878343345465603c9452834bf632737f1c7754,https://newsatcl-pctr.c.yimg.jp/t/amd-img/20240524-90023948-ftv-000-2-thumb.jpg?exp=10800,2024-05-24T16:00:01+09:00,2024-05-24T19:29:01+09:00,福島テレビ,ftv,福島テレビ,306,\n福島テレビ\n東京電力マリーゼなどで活躍したサッカー元日本女子代表の鮫島彩選手が、今シーズン限りで現役を引退することになった。\n\n鮫島選手の現役引退は、所属する大宮アルディージャＶＥＮＴＵＳが発表した。\n鮫島選手は、なでしこジャパンのメンバーとして2011年のサッカーワールドカップドイツ大会の優勝に貢献。所属していた東京電力マリーゼが、東日本大震災の影響で活動停止となった後はアメリカに渡り、フランスでもプレーした。\n\nクラブを通じて「想像していたよりもはるかに学びの多い素晴らしいサッカー人生を送ることができた」とコメントした鮫島選手。5月25日のリーグ最終節が最後の試合となる。\n福島テレビ,[],[]
イトーヨーカドー郡山店が5月26日閉店　影響を心配する近くのラーメン店　後継のヨークベニマルに期待（福島テレビ）,https://news.yahoo.co.jp/articles/06c9ba0f6ee9e1b9ebe5cb5c13a2b9ae890407de,https://newsatcl-pctr.c.yimg.jp/t/amd-img/20240524-90023942-ftv-000-1-thumb.jpg?exp=10800,2024-05-24T19:20:02+09:00,2024-05-24T19:20:02+09:00,福島テレビ,ftv,福島テレビ,771,\n福島テレビ\n福島県郡山市のイトーヨーカドー郡山店が5月26日閉店する。近くで店を営む男性は別れを惜しみながらも後継店に期待をかけている。\n\n福島テレビ・浅野晋平記者：「郡山市の中心部にあるイトーヨーカドー郡山店には、閉売りつくしのポスターが貼られています。平日の正午から、多くの車が駐車場に停まっています」\n\nイトーヨーカドー郡山店は、店舗削減の方針を受けて、26日閉店し、35年の歴史に幕を下ろす。\nイトーヨーカドーの隣りでラーメン店を営む桑原尚人さんも子どもの頃からなじみの場所だ。自家製麺じゃじゃ・オーナー桑原尚人さんは「ずっと通っていたし、商売でもこの近くでやらせていただいていたので、余計に寂しいって思いはありますね」と話す。店から近いこともあり、行き来する常連客も多くいる。\n「（店で）食べてから（イトーヨーカドーに）行くのが多いですね。本当にウチの台所って感じだったので、無くなるというのは寂しいですね」と常連客は話す。\n店のオープンから10年。集客力があるスーパーの閉店で、客足への影響も心配する。店のオーナーの桑原さんは「色んな意味でイトーヨーカドーさんの力が大きかったというのは、僕自身感じている部分があるので、今回は結構ダメージが大きいのかなっていう気持ちはありますね」という。\n\n郡山店の閉店により福島県内から完全撤退となるイトーヨーカドー。後継店が決まらず閉店した福島店とは異なり、郡山店にはヨークベニマルの出店が決まっている。桑原さんは「新しいお客さんとか、既存のお客さんとかも利用されて、ウチ（じゃじゃ。）にも来やすくなってくれればと期待は込めてます」と話す。\nイトーヨーカドー郡山店の後継店は、ヨークベニマルを代表する店舗として2025年2月のオープンが計画されている。\n福島テレビ,[],[]
