headline,mainEntityOfPage,image,datePublished,dateModified,author,media_en,media_jp,str_count,body,images,external_links
ファミリーマートが男鹿市・潟上市・秋田市と包括連携協定　特産品開発や観光振興・防災など多方面で連携　人的・物的資源を活用し地域活性化を目指す　秋田　（ABS秋田放送）,https://news.yahoo.co.jp/articles/56d27f749bb22dbff3bad38df1cc689886df3008,https://newsatcl-pctr.c.yimg.jp/t/amd-img/20260604-05451326-absakita-000-3-thumb.jpg?exp=10800,2026-06-04T11:30:03+09:00,2026-06-04T11:49:33+09:00,ABS秋田放送,absakita,ABS秋田放送,569,ABS秋田放送 大手コンビニエンスストアのファミリーマートが、男鹿市・潟上市・秋田市と地域活性化を目指す包括連携協定を結びました。 3日、ファミリーマートの北日本エリアの代表者と3人の市長が出席して協定の締結式が行われました。 協定では、それぞれの人的、物的資源を有効活用して住民サービスの向上や地域の活性化を目指します。 連携する分野は特産品の開発や観光振興、防災・減災など多岐にわたります。 先行して協定を結んでいた潟上市ではこの春、市内の若者と醸造会社が共同でおにぎりを開発し、北東北3県のファミリーマート、約500店舗で期間限定で販売しました。 大手コンビニチェーンが持つ商品開発のノウハウと販売網を生かした取り組みに、男鹿市の菅原広二市長も大きな期待を寄せています。 男鹿市 菅原広二市長 「水産業が非常に停滞しています。それでサーモンの養殖、タマカイの養殖をしていますし、そういうことを発信していけるブランドをつけていく、そういう意味合いだけでも非常に大きい」「加工品含めて振興になっていく、そういうことを期待しています。頼るだけじゃなくって一緒にやっていく」 協定の締結は3つの市の沖合で進む洋上風力発電事業の地域共生策の一環です。 事業に参加する伊藤忠商事がグループ企業のファミリーマートに協力を呼びかけたということです。,[],[]
投資に関するウェブサイトがきっかけ　サイトには”著名なジャーナリスト”　80代女性が現金219万円をだまし取られる　秋田（ABS秋田放送）,https://news.yahoo.co.jp/articles/20356715bc4ea4078523da0146b9ffc4e0deb2f4,https://newsatcl-pctr.c.yimg.jp/t/amd-img/20260604-07522697-absakita-000-4-thumb.jpg?exp=10800,2026-06-04T11:29:01+09:00,2026-06-04T12:02:29+09:00,ABS秋田放送,absakita,ABS秋田放送,328,ABS秋田放送 投資に関するウェブサイトをきっかけに、秋田市の80代の女性が現金219万円をだまし取られました。 秋田中央警察署の調べによりますと、秋田市の80代の女性は今年3月、著名なジャーナリストが掲載されている投資関連のウェブサイトを閲覧し、サイト内のフォームに個人情報を入力しました。 その後、日本人を名乗る男から電話があり、女性は暗号資産の取り引きをするため相手の指示に従って、指定された口座に合わせて100万円を振り込みました。 サイト上では利益が出たように表示されたため先月11日に引き出そうとしたところ、「利益が580万円あるが現金で引き出すためには20％の手数料が必要」などと言われ、女性はさらに119万円を振り込み、だまし取られました。,[],[]
大館市片山町3丁目の民家敷地内にクマ　周辺には大館桂桜高校や商業施設　警察が注意を呼びかけ　4日　秋田（ABS秋田放送）,https://news.yahoo.co.jp/articles/5018bcb221b6276949839ffcac62cf0c1a2dd1ad,https://newsatcl-pctr.c.yimg.jp/t/amd-img/20260604-02674976-absakita-000-2-view.jpg?exp=10800,2026-06-04T11:28:01+09:00,2026-06-04T11:39:31+09:00,ABS秋田放送,absakita,ABS秋田放送,277,ABS秋田放送 4日朝、大館市片山町3丁目の民家敷地内でクマが目撃されました。 周辺には大館桂桜高校や商業施設などがあり、警察が注意を呼びかけています。 大館警察署の調べによりますと4日午前6時半ごろ大館市片山町3丁目の民家敷地内にクマ1頭がいるのを、散歩をしていた大館市の40代の女性が目撃しました。 クマの体長は約70センチです。 周辺は住宅地で、大館桂桜高校がある地域です。 隣接した地域には大型商業施設やスーパーなどがあります。 警察が注意を呼びかけています。 県内にはツキノワグマ出没警報が出されていて、屋外での活動の際は十分な警戒が必要です。,[],[]
由利本荘市でクマの目撃が相次ぐ　男性が襲われた場所から北の地域　警察が注意を呼びかけ　3日　秋田（ABS秋田放送）,https://news.yahoo.co.jp/articles/6a4dd9b51fbee4282b8a0126cc0ceac6facfe383,https://newsatcl-pctr.c.yimg.jp/t/amd-img/20260604-01642526-absakita-000-2-view.jpg?exp=10800,2026-06-04T11:27:00+09:00,2026-06-04T11:47:27+09:00,ABS秋田放送,absakita,ABS秋田放送,420,ABS秋田放送 3日夕方、由利本荘市でクマの目撃が相次ぎました。 由利本荘市では3日昼前に畑仕事をしていた男性がクマに襲われけがをしています。 警察が注意を呼びかけています。 由利本荘警察署の調べによりますと3日午後5時50分ごろ、由利本荘市芦川字下モ山の市道をクマ1頭が歩いているのを、車で走っていた秋田市の40代の男性が目撃しました。 クマの体長は約1メートルです。 昼前に男性がクマに襲われてけがをした場所からは北に約4キロの地域です。 一方、3日午後7時半ごろには、由利本荘市神沢字浜辺で道路わきののり面を歩くクマ1頭を、家にいた50代の女性が目撃しました。 クマの体長は約1メートルです。 昼前に男性がクマに襲われた場所からは約5キロ、午後5時50分ごろに目撃された由利本荘市芦川からは北に1キロほどの地域です。 警察が注意を呼びかけています。 県内にはツキノワグマ出没警報が出されていて、屋外での活動の際は十分な警戒が必要です。,[],[]
大仙市大曲金谷町の市道にクマ　近くに大曲農業高校や大仙市役所　警察が注意を呼びかけ　3日　秋田（ABS秋田放送）,https://news.yahoo.co.jp/articles/9affd89a989af774147f4c3b816368175459f5fb,https://newsatcl-pctr.c.yimg.jp/t/amd-img/20260604-06332155-absakita-000-2-view.jpg?exp=10800,2026-06-04T11:22:01+09:00,2026-06-04T12:01:30+09:00,ABS秋田放送,absakita,ABS秋田放送,257,ABS秋田放送 3日夕方、大仙市大曲金谷町の市道でクマが目撃されました。 警察が注意を呼びかけています。 大仙警察署の調べによりますと3日午後6時ごろ大仙市大曲金谷町の市道にクマ1頭がいるのを、自転車で走っていた大仙市の10代の男性が目撃しました。 クマの体長は約40センチです。 最も近い民家までは約50メートルで、大曲農業高校のある地域です。 また、付近には大仙市役所や大曲小学校があります。 警察が注意を呼びかけています。 県内にはツキノワグマ出没警報が出されていて、屋外での活動の際は十分な警戒が必要です。,[],[]
秋田市河辺北野田高屋の草地にクマ　付近には河辺中学校　2日に女性がクマに襲われたとみられる場所から約1.5キロ　警察が注意を呼びかけ　3日　秋田（ABS秋田放送）,https://news.yahoo.co.jp/articles/d87d0ce1d54493ccdfd1bebbbcb670606074a71c,https://newsatcl-pctr.c.yimg.jp/t/amd-img/20260604-06624874-absakita-000-2-view.jpg?exp=10800,2026-06-04T10:21:01+09:00,2026-06-04T10:41:30+09:00,ABS秋田放送,absakita,ABS秋田放送,308,ABS秋田放送 3日夕方、秋田市河辺北野田高屋の草地でクマが目撃されました。警察が注意を呼びかけています。 秋田東警察署の調べによりますと3日午後5時20分ごろ、秋田市河辺北野田高屋字小高の草地にクマ1頭がいるのを、70代の男性が自宅の中から目撃しました。 クマの体長は約1メートルです。 最も近い民家までは約50メートルで、付近には河辺中学校や北野田公園アリーナなどがあります。 2日にクマに襲われて死亡したとみられる女性が発見された場所から、西に1.5キロほどの地域です。 2日に女性を襲ったとみられるクマは駆除されています。 県内にはツキノワグマ出没警報が出されていて、屋外での活動の際は十分な警戒が必要です。,[],[]
横手市杉沢の田んぼにクマ　付近には横手高校や保育園　警察が注意を呼びかけ　3日　秋田（ABS秋田放送）,https://news.yahoo.co.jp/articles/0dc3baa96537c92ba843dec9c38d1740e52404fe,https://newsatcl-pctr.c.yimg.jp/t/amd-img/20260604-04451832-absakita-000-2-view.jpg?exp=10800,2026-06-04T10:10:01+09:00,2026-06-04T10:18:27+09:00,ABS秋田放送,absakita,ABS秋田放送,228,ABS秋田放送 3日夕方、横手市杉沢の田んぼでクマが目撃されました。 警察が注意を呼びかけています。 横手警察署の調べによりますと3日午後5時10分ごろ、横手市杉沢字吉沢の田んぼにクマ1頭がいるのを、散歩をしていた70代の女性が目撃しました。 最も近い民家までは約50メートルで、付近には横手高校や児童公園、みいりの保育園などがあります。 警察が注意を呼びかけています。 県内にはツキノワグマ出没警報が出されていて、屋外での活動の際は十分な警戒が必要です。,[],[]
北秋田市阿仁水無の林にクマ　阿仁学園まで約70メートル　警察が注意を呼びかけ　3日　秋田（ABS秋田放送）,https://news.yahoo.co.jp/articles/93d3a1a707e663c807b0218fe87b45e336e79b53,https://newsatcl-pctr.c.yimg.jp/t/amd-img/20260604-01986223-absakita-000-2-view.jpg?exp=10800,2026-06-04T10:07:01+09:00,2026-06-04T10:13:27+09:00,ABS秋田放送,absakita,ABS秋田放送,236,ABS秋田放送 3日午後、北秋田市阿仁水無の林でクマ1頭が目撃されました。 警察が注意を呼びかけています。 北秋田警察署の調べによりますと3日午後3時15分ごろ、北秋田市阿仁水無字新町の林にクマ1頭がいるのを、走行中のパトカーから警察官が目撃しました。 クマの体長は約80センチです。 阿仁学園まで約70メートルの場所で、付近には阿仁河川公園もあります。 警察が注意を呼びかけています。 県内にはツキノワグマ出没警報が出されていて、屋外での活動の際は十分な警戒が必要です。,[],[]
小坂町大地の町道にクマ　体長は約60センチ　警察が注意を呼びかけ　3日　秋田（ABS秋田放送）,https://news.yahoo.co.jp/articles/d2691a1a1309461e9ff7e169fff89c4776744088,https://newsatcl-pctr.c.yimg.jp/t/amd-img/20260604-07566933-absakita-000-3-view.jpg?exp=10800,2026-06-04T10:03:00+09:00,2026-06-04T10:28:27+09:00,ABS秋田放送,absakita,ABS秋田放送,223,ABS秋田放送 3日夕方、小坂町大地の町道でクマが目撃されました。 警察が注意を呼びかけています。 鹿角警察署の調べによりますと3日午後4時15分ごろ、小坂町大地字上羽ノ木田の町道にクマ1頭がいるのを、車で走っていた小坂町の30代の女性が目撃しました。 クマの体長は約60センチです。 最も近い建物までは10メートルほどの場所で、警察が注意を呼びかけています。 県内にはツキノワグマ出没警報が出されていて、屋外での活動の際は十分な警戒が必要です。,[],[]
