headline,mainEntityOfPage,image,datePublished,dateModified,author,media_en,media_jp,str_count,body,images,external_links
GAOでペンギンのヒナの観察会　6月毎週土曜日に実施　間近でヒナを見られる貴重な機会　秋田・男鹿市（ABS秋田放送）,https://news.yahoo.co.jp/articles/4652aaddaccab9286a9187f50f006769606b6be4,https://newsatcl-pctr.c.yimg.jp/t/amd-img/20260604-03497495-absakita-000-2-thumb.jpg?exp=10800,2026-06-04T20:05:00+09:00,2026-06-04T20:27:32+09:00,ABS秋田放送,absakita,ABS秋田放送,608,"ABS秋田放送 男鹿市の男鹿水族館GAOで、ペンギンのヒナ観察会が開催されます。 間近でヒナを観察できる貴重な機会となります。 男鹿水族館提供 GAOでは、先月24日と今月4日にキタイワトビペンギンのヒナが孵化しました。 映像は先月24日に生まれたヒナが餌をもらっている様子です。 5月6日に撮影されました。 2羽は順調に成長していて、来月、毎週土曜日にペンギンの展示場に入ってヒナを観察できる観察会が開催されます。 国際自然保護連合IUCNのレッドリストで絶滅危惧ⅠB 類に指定されているキタイワトビペンギン。 そのペンギンのヒナを間近で見られる貴重な機会となります。 男鹿水族館提供 去年8月の観察会の様子 ◇ ◇ ◇ ◇ヒナ観察会◇ 【開催日程】 6 月 6 日(土)、13 日(土)、20 日(土)、27 日(土) 各日ともに 13：15～（約 40 分程度） 【定員・対象】 各回 5 名・小学生以上対象 ※小学生が参加する場合は保護者の参加も必須。 【参加料金】 1人 2,000 円(入館料別途必要) ※小学生が参加する場合、保護者の参加料金は 1人まで1,000 円。 【参加方法】 当日受付カウンターにて申し込み。（各日定員に達し次第受付終了） 【その他】 動きやすい服装でのご参加をお願いします。 国内における鳥インフルエンザの状況により、急きょ中止となる場合があります。あらかじめご了承ください",[],[]
戦争遺跡の保全や活用に向けて調査実施へ　県の調査委員会が初会合　県内5つの戦争痕跡からスタート　秋田（ABS秋田放送）,https://news.yahoo.co.jp/articles/736e142f805836d10f49b13cef4a1539281859ad,https://newsatcl-pctr.c.yimg.jp/t/amd-img/20260604-04562883-absakita-000-3-thumb.jpg?exp=10800,2026-06-04T18:01:01+09:00,2026-06-04T18:28:27+09:00,ABS秋田放送,absakita,ABS秋田放送,932,ABS秋田放送 戦争遺跡の保全や活用について話し合う、県が設置した調査委員会の会議が初めて開かれました。 戦争の惨禍や教訓を伝える戦争遺跡。 まずは秋田市の土崎空襲や、大館市の花岡事件など、県内5つの戦争の痕跡を詳しく調べることが決まりました。 県教育庁が設置した戦争遺跡の調査委員会は、県の文化財保護審議会の委員や大学教授など5人で構成されています。 藤澤昌委員長 「戦争の遺構もだいぶ古くなっていると思います。ですからこの調査委員会で戦争遺跡の現状をしっかりと把握して、そしてその保存と活用方法を検討してまいりたい」 県内の各市町村からは、これまでに戦争遺跡に関する情報が900件余り寄せられていて、このうち、まずは5つの戦争遺跡の候補を手分けして調べることが4日の委員会で決まりました。 調査するのは、終戦前夜からの爆撃で250人以上が犠牲になったとされる秋田市の土崎空襲。 太平洋戦争末期に強制連行されていた、400人余りの中国人労働者が命を落とした花岡事件にまつわる大館市の花岡川。 1906年から終戦まで使われていた、歩兵部隊の訓練地、大仙市の「旧強首陸軍演習場」。 天皇・皇后両陛下の肖像写真、御真影をまつる建物で、かつては学校の入り口に設けられていた、男鹿市船越の奉安殿。 そして、にかほ市金浦地区で行われた、上空からの銃撃の痕が残る門柱です。 戦争遺跡の調査は、詳しい史実の解明や平和学習などにもつながると期待されています。 外池智副委員長 「これから秋田県がどういう街であり続けたいか。それはやっぱりこういった歴史的な史実と一緒に、それを街の形として残していくような地域づくり街づくりの一環として私は意義があると思うんですね」 戦後80年余り、県内では1件も文化財登録がされてこなかった戦争遺跡の調査がようやく動き出しました。 藤澤昌委員長 「今、秋田県にこういうものが残っていて、やはり戦争の悲惨さとか平和へのその願いとかそういうのが伝えられればいいのかなと思いますね」 委員会は最初の5件を含む20件ほどを、来年度にかけて詳しく調査して結果をまとめることにしています。 ※6月4日午後6時15分のABS news every.でお伝えします,[],[]
公務員宿舎の共益費を着服しオンラインカジノに　初公判で裁判官の男は起訴内容を認める　検察は懲役3年を求刑　秋田地方裁判所（ABS秋田放送）,https://news.yahoo.co.jp/articles/9f1fa13225e542d66d959885b0cf5de6b1c66944,https://newsatcl-pctr.c.yimg.jp/t/amd-img/20260604-05836235-absakita-000-3-thumb.jpg?exp=10800,2026-06-04T18:00:04+09:00,2026-06-04T18:27:27+09:00,ABS秋田放送,absakita,ABS秋田放送,633,ABS秋田放送 公務員宿舎の共益費を着服し、オンラインカジノに使った罪などに問われている裁判官の男の初公判が開かれ、男は起訴内容を認めました。 裁判は即日結審し、検察は懲役3年を求刑しました。 在宅起訴されているのは湯沢簡易裁判所と横手簡易裁判所で裁判官を務めていた森本暁史被告52歳です。 起訴状などによりますと森本被告は2023年4月から去年5月までの間、公務員宿舎の共益費、合わせて278万円余りを着服。 その金の一部をオンラインカジノの賭博にあてた罪などに問われています。 初公判で森本被告は「間違いありません」と述べ、起訴内容を認めました。 被告人質問で森本被告は「単身赴任や住宅ローンで借金がかさみFX投資の利益で返済しようと考えたが損失を出しオンラインカジノに手を出した。」と説明。 ギャンブル依存症の診断を受け、現在は月2回のペースで通院していることを明かしました。 検察は「裁判官という立場で違法性を十分認識しながら横領や賭博を行ったことは悪質で法律を守る意識が欠如している」として懲役3年を求刑しました。 弁護側は、横領した金を全額返済し深く反省しているとして執行猶予付きの判決を求めました。 法廷で森本被告は「私のしたことで司法の信頼を損ねた。秋田のみなさまにご迷惑をおかけし申し訳ございません。」と涙ながらに話し、裁判は結審しました。 判決は来月23日に言い渡されます。 ※6月4日午後6時15分のABS news every.でお伝えします,[],[]
赤ちゃんとスキンシップ！心と体の成長につながるベビーマッサージ教室　親が育児に自信も　秋田（ABS秋田放送）,https://news.yahoo.co.jp/articles/a57f233420eaaa99e35a003140640125c403ea62,https://newsatcl-pctr.c.yimg.jp/t/amd-img/20260604-03674159-absakita-000-3-thumb.jpg?exp=10800,2026-06-04T17:59:01+09:00,2026-06-04T18:31:27+09:00,ABS秋田放送,absakita,ABS秋田放送,545,ABS秋田放送 赤ちゃんとのスキンシップを深める、ベビーマッサージ教室が秋田市で開かれました。 ママとコミュニケーションをとりながらのマッサージに赤ちゃんたちもご機嫌です。 秋田県総合公社が開催しているベビーマッサージ教室。 ベビーサロンを運営する中川典子さんが講師をつとめ、生後4か月から8か月までの赤ちゃんが参加しました。 中川さんによりますと、親子でのスキンシップは赤ちゃんの運動機能や内臓機能のほか、自己肯定感も高め、心と体の成長につながるということです。 また、子どもの反応を知ることで、親にとっても育児に自信を持つことにつながるといいます。 抱っこしながらでもできるベビーマッサージ。 参加者は子どもの機嫌や体調を見ながら言葉をかけることの大切さを教わりました。 参加者 「おうちでも保湿するときとかいろんなタイミングを見てふれあいの時間にしていければなと思ってます。ね？」 廣田裕司アナウンサー 「楽しかった？」 赤ちゃん 「はーい（ニコニコ）」「ばぶばぶ」 ベビーマッサージ教室は来月まで合わせて5回行われます。 赤ちゃんが手を動かすことで気持ちや要求を伝えるベビーサインについても学ぶことができます。 ※6月4日午後6時15分のABS news every.でお伝えします,[],[]
6月4日は「虫歯予防デー」　歯科衛生士を目指す学生が子どもたちへ　歯の大切さや正しいブラッシング方法を指導　秋田（ABS秋田放送）,https://news.yahoo.co.jp/articles/95f7e89ec5c8695a7ad3993ee78abc964733b914,https://newsatcl-pctr.c.yimg.jp/t/amd-img/20260604-04499616-absakita-000-3-thumb.jpg?exp=10800,2026-06-04T17:58:01+09:00,2026-06-04T18:39:35+09:00,ABS秋田放送,absakita,ABS秋田放送,509,ABS秋田放送 6月4日は「虫歯予防デー」です。 秋田市の認定こども園では歯みがき教室が開かれ、歯科衛生士を目指す学生たちが歯の大切さや正しいブラッシングの方法を伝えました。 歯磨き教室が開かれたのは、秋田市大町のサン・パティオこども園です。 4日は4歳から6歳の園児32人が参加しました。 講師を務めたのは秋田県歯科医療専門学校の3年生9人です。 園児にもわかりやすく歯の大切さや正しい歯みがきの方法を伝えたいと、準備を進めてきました。 大人になっても健康な歯を保つためには乳歯の時期から歯を磨く習慣や正しいブラッシングを身に付けることが必要です。 伊藤優菜さん 「力強く磨いてしまうと、やっぱり歯茎を傷めてしまったりするのでしっかり優しい力で小さく動かすことを意識してほしいなと思いました」 工藤陽菜さん 「歯を磨く順番を決めてもらったので、磨き残しがないようにしてきれいな歯を保ってほしいと思います」 実際に園児に指導をする機会はとても貴重と話す学生たち。 来年から歯科衛生士として県民の健康を支えることを目指し、知識と経験を積み重ねます。 ※6月4日午後6時15分のABS news every.でお伝えします,[],[]
新たな特産品を発掘！あきた食のチャンピオンシップ　各社自慢の個性豊かな商品並ぶ　秋田（ABS秋田放送）,https://news.yahoo.co.jp/articles/9ac28767720fa16ba57658be3ebc5b0fd2eba506,https://newsatcl-pctr.c.yimg.jp/t/amd-img/20260604-02724519-absakita-000-3-thumb.jpg?exp=10800,2026-06-04T17:57:01+09:00,2026-06-04T18:40:29+09:00,ABS秋田放送,absakita,ABS秋田放送,850,ABS秋田放送 毎年恒例となっている、秋田の新たな特産品を発掘する審査会が秋田市で開かれました。 今年も各社自慢の個性豊かな商品が並びました。 県産の果物と米粉をふんだんに使った宝石のようなクッキー。 ごはんのお供にぴったりのいぶりがっこと梅が入った、食べるごま油。 個性豊かな商品が並んだのは、新たな特産品を発掘する審査会、あきた食のチャンピオンシップの会場です。 秋田の新たな特産品を発掘しようと県が1979年から開いていて、今年は加工品部門に22点菓子・飲料部門に31点が出品されました。 カップに入った北秋田市特産のバター餅。 お湯を注ぐだけで出来立てを味わうことができます。 深瀬博史記者 「バターもちのコクと甘さがすごく表現されていて、これがお湯をかけるだけで食べられるとはすごいですね」 ピンクのシンプルなパッケージに入っているのはあきたこまちの米粉に甘酒を加えて焼き上げたカヌレ。 みそを使ったクリームをトッピングした新感覚のスイーツです。 深瀬記者 「米粉のモチモチした食感とみそのクリームが非常にいいアクセントになっています。そしてこのパッケージもすごくシンプルでおしゃれで手に取りやすいなーという感じがします」 審査員は県の内外の百貨店やスーパー、道の駅のバイヤーなどが務めます。 味はもちろん、パッケージのデザインや開発の背景など10項目で審査します。 審査員 「地域の特産品をうまく使われていて、かつ新しい味ですとか加工に挑戦されているなというのが伺えます」 審査員 「今まで見たことない商品もありますし、地域の商材をうまく生かした形でやっていただけものもありますし、魚関係も調味料もそうですし、果物関係だったりとかそれをいかに消費者に伝えられるかというのをいろいろ工夫されているなと感じます」 各社自慢の逸品が並んだあきた食のチャンピオンシップ。 審査結果は今月8日に県のホームページで発表されます。 ※6月4日午後6時15分のABS news every.でお伝えします,[],[]
多くの人でにぎわう「シューイチ全国うまいもの博」　全国選りすぐりの”逸品”がずらり　人気商品やおすすめの味は？　秋田（ABS秋田放送）,https://news.yahoo.co.jp/articles/b33114578ddd4d11df3b5ed649b5a688c6af81ba,https://newsatcl-pctr.c.yimg.jp/t/amd-img/20260604-03533457-absakita-000-4-thumb.jpg?exp=10800,2026-06-04T17:56:01+09:00,2026-06-04T18:47:30+09:00,ABS秋田放送,absakita,ABS秋田放送,1616,ABS秋田放送 秋田市の西武秋田店で開かれている「シューイチ全国うまいもの博」、開幕から3日までの6日間で去年より1割ほど多い約5万人が訪れるなど、3回目となる今年も大いににぎわっています。 開幕から5日で1週間、人気商品や、おすすめの味を取材しました。 先週金曜に開幕した「シューイチ全国うまいもの博」。 全国27店舗の人気商品が西武秋田店に集結しています。 開幕から3日までの6日間の来場者数は約5万人。 県民の胃袋をつかんでいる人気店を紹介します。 売り上げ第3位は香川県からやってきた「松風庵かねすえ」。 香川特産の和三盆糖を使ったわらび餅は今年も大人気。 優しい甘さと、もちプル食感が癖になる一品です。 売り上げ第2位は、高知県の「四万十生産」です。 高知を代表するグルメカツオのたたきなどを販売しています。 藁焼きで旨味を閉じ込めた初ガツオはリピーター続出！ ことし初めて登場したカンパチもおすすめです。 そして売り上げ第1位は、愛知県からやってきた「世界の山ちゃん」。 名古屋のソウルフード、手羽先は、1981年の創業当時から変わらない秘伝のたれと特製こしょうで味付け。 お酒の”あて”にもぴったりです。 このほか、今年は10店舗が西武秋田店初登場。 中でも、ぜひ味わってほしい3つの店を紹介します！ まずは、広島県の「ピザ プティギャルソン」。 13種類の冷凍ピザ専門店です。 瀬戸内海で捕れるシラスを使ったものや瀬戸内レモンのピザなど、地元食材を使った商品が多く並びます。 イチオシは、生クリームで煮込んだ広島のカキを使ったピザです。 三雲紫恩アナウンサー 「あーもうすでにチーズのいい香りがします！すごい伸びますね～いただきます。大粒のカキですよ～。カキがクリーミーでチーズと合います。耳の部分までカリもちでおいしいです」 続いては大阪の「いかやきやまげん 京橋本店」。 ご当地グルメの一つ、いか焼きは、だしの入った生地に細かく切ったイカと卵を混ぜて鉄板で焼き上げます。 チーズや焼きそば、ガリの入ったイカ焼きなど、12種類の味を楽しむことができます。 一番人気は「ねぎ醤油」です。 三雲アナ 「わー！ほっかほかですよ！皆さん湯気見えますか？おいしそう、いただきます。生地がもちもちです、んー！」「ねぎのシャキシャキ感とイカがすごく合います、すごいこりっこりのイカですね」「冷めてもおいしそうですね」 いかやきやまげん 京橋本店 髙橋太基さん 「冷めてもうちのはおいしいんでぜひ召し上がっていただけたら」 三雲アナ 「学校帰りの方とかも買いに来る？」 髙橋さん 「そうですね、大阪ではおやつ感覚で召し上がっていただけています」 最後は東京から「抹茶専門店 千休」。 社長の久保田夏美さんは抹茶好きが高じて、社会人1年目、23歳のときに店を立ち上げました。 久保田さん自らが店頭で立てた宇治抹茶を使った商品もあります。 テイクアウトで楽しめる抹茶ラテです。 三雲アナ 「んー！ミルクも抹茶も濃厚です」「混ぜることで2つの味が立ってすごく和の気持ちになりますね」「立てたての抹茶の深い苦みだったりあとはちょっとこれ、ふたを開けてみると…すごく濃厚な抹茶の香りがして抹茶好きにはたまらないドリンクだと思います」 抹茶専門店 千休 久保田夏美さん 「ご注文をいただいてから作ることでお客様にもこの抹茶の良さっていうのを感じていただきたいと思って作りました」「会場限定のソフトクリームとかラテは自分用のご褒美で皆さんに楽しんでいただきたいけども、ぜひ手土産に焼き菓子とかも買っていただいて抹茶のおいしさが広まるように皆さんに配っていただけたらうれしいです」 「シューイチ全国うまいもの博」は次の日曜日までです。 全国の選りすぐりの逸品を食べ逃しなく！ ※6月4日午後6時15分のABS news every.でお伝えします,[],[]
【グップラ】循環型農業にも貢献！原油価格高止まり…コメやソバの副産物を燃料に　住民の憩いの場を守り続ける温泉施設　秋田・羽後町（ABS秋田放送）,https://news.yahoo.co.jp/articles/bd48f9b8a56c0f4dde7a396185a5a279004613cb,https://newsatcl-pctr.c.yimg.jp/t/amd-img/20260604-02861765-absakita-000-4-thumb.jpg?exp=10800,2026-06-04T17:55:01+09:00,2026-06-04T18:53:31+09:00,ABS秋田放送,absakita,ABS秋田放送,1637,"ABS秋田放送 日本テレビ系列は次の日曜日まで地球のためにいいことを考える「グッド・フォー・ザ・プラネット・ウィーク」 グップラとしてキャンペーンを展開しています。 今年のテーマは「明日にちょっといいチョイス」。 4日は、農業が盛んな秋田で大量に出る、廃棄物を活用した取り組みについてです。 燃料価格の高騰を受け、県内では料金を値上げしたり、営業時間を短縮したりする温泉施設が相次いでいます。 こうした中、羽後町の温泉宿泊施設がもみ殻やそば殻を燃料として活用し始めました。 住民の憩いの場を守り、循環型の農業にも貢献します。 ABS秋田放送 羽後町で唯一の温泉宿泊施設、としとらんどです。 横手盆地の田園風景を眺めることができる浴室が人気で、地元の人を中心に憩いの場となっています。 その営業を支えているのがお湯を温めるボイラーです。 中東情勢の悪化で原油価格の高止まりが続く中、燃料の灯油代が経営を圧迫しています。 五輪坂ハイツ 佐藤康雄社長 「金額にしますと12カ月で1,000万円超えます」「どんどんどんどん上がってるので、非常に経営に多大な影響を与えているというのが現状です。もう死活問題です」 対策として、この春新たに導入したのが木くずなどを燃やすバイオマスボイラーです。 本格稼働を前に関係者が集まり竣工式が行われました。 五輪坂ハイツ 佐藤康雄社長 「イラン情勢などさまざまありますけれども、燃料価格とか高騰しておりまして、ずいぶん苦慮して参りました」「これを契機に少しでも燃料費の節約等ができることと確信しております」 バイオマスボイラーの整備費は総額約1億2,000万円。 半分近くを、環境に配慮した事業に交付される国の補助金で賄いました。 ボイラーに使う燃料は… コメを収穫した後大量に出るもみ殻です。 手間とコストをかけて処分しなければならない産業廃棄物で、毎年頭を悩ませる農家も少なくありません。 既存のボイラーとバイオマスボイラーを併用することで、年間1,000万円以上かかっている灯油代を約20パーセント削減する計画です。 もみ殻を350度以上の高温で加熱し炭にするこのボイラー。 温室効果ガスの削減にもつながると期待されています。 西馬音内そばで知られる羽後町。 もみ殻が少なくなる6月以降は… ソバ粉をつくる過程で出るそば殻も燃料に活用します。 約300ヘクタールでソバを栽培する地元の農業生産法人「そば研」では年間30トンから40トンのそば殻が出ます。 油分を多く含むため、もみ殻よりも燃えやすいということです。 そば研 藤原洋介社長 「処分に困ってやっかい者として取り扱われたものがボイラーの燃料として使われるっていうのは非常にうれしく思う」 さらに燃やした後に出る「くん炭」は… 町内の養鶏場から出る鶏のフンと混ぜて肥料として販売します。 燃焼後に出るくん炭を農作物の栽培に活用することで、循環型の農業にもつながります。 地域資源を余すところなく活用できるバイオマスボイラーに関係者は期待を寄せています。 五輪坂ハイツ 佐藤康雄社長 「島国ですので資源もない国ですから、技術的なところで工夫して続けていくということが目標ですので」「この施設を活用しながら福祉・観光面でも役立っていますので、役割が果たせればいいのかなと思っています。頑張っていきたいと思います」 ありとあらゆる経費が掛かり増しとなる中、捨てられていた地域資源に活路を見出した温泉宿泊施設。 施設ではもみ殻とそば殻を年間450トン燃やし、経費の削減を図りながら約100トンのくん炭をつくる計画です。 循環型の農業を進めながら、住民の憩いの場をこれからも守ります。 ♢♢♢♢♢♢♢♢♢♢ 4日にお伝えしたものを含むグップラの特集は、TVerでもご覧になれます。 5日は、ごみの減量についてお伝えします。 ※6月4日午後6時15分のABS news every.でお伝えします",[],[]
"男鹿市船越で雑草などを焼く原野火災　焼失面積は約1,800平方メートル　けが人はなし　4日　秋田（ABS秋田放送）",https://news.yahoo.co.jp/articles/662e14bf95a0b19f3c77bd46899853340d91a96c,https://newsatcl-pctr.c.yimg.jp/t/amd-img/20260604-07186527-absakita-000-2-view.jpg?exp=10800,2026-06-04T15:34:00+09:00,2026-06-04T15:53:32+09:00,ABS秋田放送,absakita,ABS秋田放送,243,"ABS秋田放送 4日朝、男鹿市船越で雑草などを焼く火災がありました。 けがをした人はいませんでした。 男鹿警察署の調べによりますと、4日午前8時半ごろ、男鹿市船越の海岸沿いの草地から煙が上がっているのを勤務中だった消防署員が見つけました。 署員が現場に行くと、草地から火が上がり、雑草などに燃え広がっていたということです。 火は約3時間後に消し止められましたが、草地の雑草など約1,800平方メートルが焼けました。 けがをした人はいませんでした。 警察と消防が火事の原因を調べています。",[],[]
