headline,mainEntityOfPage,image,datePublished,dateModified,author,media_en,media_jp,str_count,body,images,external_links
【サンパウロ】強風でコンゴーニャス空港、87便の離陸と80便の着陸をキャンセル（MEGABRASIL）,https://news.yahoo.co.jp/articles/9906236e185504a46e631d157be82fb4e19ec3f8,https://newsatcl-pctr.c.yimg.jp/t/amd-img/20251211-00010002-mbrasiln-000-1-view.jpg?exp=10800,2025-12-11T08:46:23+09:00,2025-12-11T08:46:23+09:00,MEGABRASIL,mbrasiln,MEGABRASIL,498,"突風の速度、時速90キロを超える
強風のためコンゴーニャス空港では87便の離陸と80便の着陸がキャンセル
ブラジル、サンパウロ市を12月10日（水）に襲った強風により、コンゴーニャス空港では87便の離陸と80便の着陸が中止された。空港を運営するコンセッション企業アエナによると、現地は時速90キロを超える突風に見舞われた。

アズウ航空の5037便（午前にクリチーバを出発し、目的地はコンゴーニャス空港）は強風のため着陸できず、着陸をやり直した後、カンピーナスのヴィラコポス国際空港へ迂回し、午後1時06分に着陸した。

アエナは、コンゴーニャス空港は営業を続けているものの、乗客に対し航空会社へ連絡し便の状況を確認するよう呼びかけている。

グアルーリョス国際空港

グアルーリョス国際空港を運営するGRUエアポートによれば、同空港も時速90キロを超える強風の影響を受けた。安全手順に従い、到着予定だった31機が他の空港へ迂回した。午後4時20分には天候が改善し、到着便の運航は正常化し始めた。出発便は通常通り運航されているという。

（記事提供／Agencia Brasil、構成／麻生雅人）",[],[]
サンパウロ市内で強風による514件の倒木の通報（MEGABRASIL）,https://news.yahoo.co.jp/articles/5b09eddb009b698b6ea0d63ce8dc0e4172571089,https://newsatcl-pctr.c.yimg.jp/t/amd-img/20251211-00010001-mbrasiln-000-1-view.jpg?exp=10800,2025-12-11T08:27:29+09:00,2025-12-11T08:27:29+09:00,MEGABRASIL,mbrasiln,MEGABRASIL,911,"停電の影響で水道供給にも支障
12月10日、サンパウロ市ヴィラ・マリアーナ地区パウラ・ネイ通り。倒木が自動車の上に落下した
ブラジル、サンパウロ州民防当局によると、12月10日（水）午後7時までに州都サンパウロ市で倒木に関する通報が514件寄せられ、4人が軽傷を負った。

北部カショエリーニャ地区のイナジャール・ジ・ソウザ大通りでは、木がバイクを直撃し、19歳の男性が軽傷を負い消防隊に救助された。

同日、市内は非常に強い突風に見舞われた。北部サンターナ地区の市立学校では、校内で枝に当たり40歳の女性職員が軽傷を負った。西部ラパ地区では車両が倒木に直撃し、乗員2人のうち1人が頭痛を訴え救急搬送され、もう1人は治療を拒否した。中心部ヘプブリカ地区では高齢女性が倒木で脚部を負傷し、消防隊に救助された。

民防当局による、州内で最も強い風はサンパウロ市ラパ地区で観測され、時速98キロに達した。次いでベルチオガで91.1キロ、サントスで87キロが記録された。

サンパウロ州上下水道公社（SABESP）によると、停電の影響で市内および大都市圏の一部地域で断水が発生した。電力が途絶すると家庭への送水ができなくなるためだという。

市内ではアメリカノーポリス、モルンビー、パレリェイロス、パルキ・ド・カルモ、サコマン、トゥクルヴィ、ヴィラ・クラーラ、ヴィラ・フォルモーザ、ヴィラ・マリアーナ、ヴィラ・ロマーナの各地区が影響を受けた。

大サンパウロ圏では、エンブー・ダス・アルチス、イタペセリカ・ダ・セーハ、マウアー、サントアンドレー、サンタ・イザベウ、タボアン・ダ・セーハの各市が全面的に断水した。さらにコチア（アタライア地区）、オザスコ（ムチンガ地区とヴィラ・イラセマ地区）、サンベルナルド・ド・カンポ（バエタ・ネーヴェス地区）でも影響が出た。

サンパウロ州上下水道公社（SABESP）は声明で「一部地域では電力が復旧したが、水道供給は段階的に回復している。送水が再開されると水は管を通じて各家庭や建物の貯水槽に届くため、復旧は徐々に進む」と説明した。

（記事提供／Agencia Brasil、構成／麻生雅人）",[],[]
サンパウロ市内で時速100キロ近い強風、観測される（MEGABRASIL）,https://news.yahoo.co.jp/articles/4d38e20f215373c383fa7f15c9e875f83392d362,https://newsatcl-pctr.c.yimg.jp/t/amd-img/20251211-00010000-mbrasiln-000-1-view.jpg?exp=10800,2025-12-11T07:54:57+09:00,2025-12-11T07:54:57+09:00,MEGABRASIL,mbrasiln,MEGABRASIL,487,"最大風速はラパ地区で時速98.1キロに
12月10日、サンパウロ市ヴィラ・マリアーナ地区パウラ・ネイ通り。倒木が自動車の上に落下した
ブラジル、サンパウロ市で水曜日（12月10日）、非常に強い突風が吹き荒れた。最大風速は正午過ぎの12時40分、西部ラパ地区で観測され、時速98.1キロに達したと民防当局が発表した。

強風は市内の各地でも記録された。南部のコンゴーニャス空港では正午に時速96.3キロ、北部サンターナ地区では時速81.2キロに達した。

州内の他都市も同様に被害を受けた。沿岸部ではベルチオガで時速91.1キロ、サントスで83.3キロの突風が観測された。大サンパウロ圏のグアルーリョスでは時速77.8キロ、内陸部カンピーナスでは最大時速77.7キロに達した。

この一連の強風により、倒木に関する通報が514件以上寄せられ、サンパウロ都市圏では200万人以上が停電に見舞われたと電力会社エネルが伝えた。

サンパウロ市当局は市内のすべての公園を閉鎖した。州内ではこれまでのところ死者の報告はない。

（記事提供／Agencia Brasil、構成／麻生雅人）",[],[]
