headline,mainEntityOfPage,image,datePublished,dateModified,author,media_en,media_jp,str_count,body,images,external_links
はしごから約3メートル下の地面に落下　郡山市で54歳の男性会社員が腰椎破裂骨折（福島中央テレビ）,https://news.yahoo.co.jp/articles/22e1d332d48ad153ef94bf00433bfcb229cd6106,https://newsatcl-pctr.c.yimg.jp/t/amd-img/20241221-09211561-fct-000-2-view.jpg?exp=10800,2024-12-21T18:37:00+09:00,2024-12-21T18:56:18+09:00,福島中央テレビ,fct,福島中央テレビ,241,FCT福島中央テレビ 郡山市で梯子から転落した男性が腰椎を骨折する大けがをしました。 郡山北警察署によりますと労災事故が発生したのは郡山市熱海町のシンザワ工業の資材置き場です。 郡山市の民家の塀に軽自動車が衝突 運転していた80代男性が死亡・福島県 12月21日の午前8時半頃、郡山市に住む54歳の男性会社員が資材の片付作業中、棚にかけたはしごが滑り落ち、約3メートル下の地面に落下し負傷しました この事故で男性は腰椎破裂骨折の重傷を負いました。 警察が事故の原因を捜査しています。,[],[]
空気が乾燥する時期だけに注意　いわき市の鮫川左岸で下草火災　（福島中央テレビ）,https://news.yahoo.co.jp/articles/7d56f7213da832c93edbf40abecae1670188ad78,https://newsatcl-pctr.c.yimg.jp/t/amd-img/20241221-08153591-fct-000-2-view.jpg?exp=10800,2024-12-21T18:31:00+09:00,2024-12-21T18:57:15+09:00,福島中央テレビ,fct,福島中央テレビ,159,FCT福島中央テレビ いわき市の鮫川の河岸で下草火災が発生しました。 下草が燃えたのは、いわき市佐糠町竹ノ花地内の鮫川左岸です。 12月21日の午後2時40分ごろに消防署が覚知し、20分余りで鎮火しました。 焼失面積は約25平方メートルで、けが人はありませんでした。 警察と消防が火事の原因や損害について調べています。,[],[]
12月22日からの大雪で只見線「会津川口駅ー新潟県・大白川駅」に遅れや運休の恐れ（福島中央テレビ）,https://news.yahoo.co.jp/articles/dd4ef48f966931f5634a2aab14c49b652713c33e,https://newsatcl-pctr.c.yimg.jp/t/amd-img/20241221-01879637-fct-000-2-view.jpg?exp=10800,2024-12-21T18:21:00+09:00,2024-12-21T18:37:22+09:00,福島中央テレビ,fct,福島中央テレビ,213,FCT福島中央テレビ JR東日本は大雪になる可能性がある12月22日と23日の運転見通しについて、只見線で遅れや運休が発生する可能性があると発表しました。 21日現在、そのほかの在来線や新幹線などに影響はないとしています。 影響を見込むのは只見線の会津川口駅から新潟県の大白川駅間で、22日は午後6時ごろから最終列車まで遅れや運休の可能性があります。 また23日は始発列車から正午ごろまで遅れや運休が可能性があるとみています。,[],[]
いわき市で親子が一足早く楽しむ「ふくまるクリスマス会」・福島県（福島中央テレビ）,https://news.yahoo.co.jp/articles/e85e75ae193b859aefeb10d4c69168ae637a721b,https://newsatcl-pctr.c.yimg.jp/t/amd-img/20241221-01674328-fct-000-1-thumb.jpg?exp=10800,2024-12-21T17:09:00+09:00,2024-12-21T17:09:00+09:00,福島中央テレビ,fct,福島中央テレビ,259,FCT福島中央テレビ 子供たちに楽しい時間を過ごしてもらおうと、いわき市で子どもたちのクリスマス会が開かれました。 冬に観光客を呼び込め 鶴ヶ城でキャッスルマーケット・福島県会津若松市 いわき市の屋内遊び場「チャイルドハウスふくまる」のクリスマス会には100人以上の親子連れが集まりました。 会場では「中テレクリスマスドリーム」の協賛金の一部を寄付金として施設に贈呈し、酪王協同乳業のヨーグルトやお菓子を子どもたちにプレゼントしました。 施設のスタッフによるハンドベルの演奏会も行われ親子でクリスマス会を楽しみました。,[],[]
郡山市の民家の塀に軽自動車が衝突　運転していた80代男性が死亡・福島県（福島中央テレビ）,https://news.yahoo.co.jp/articles/1f496da03d825bc64a04e54012388ba4d97f6fcf,https://newsatcl-pctr.c.yimg.jp/t/amd-img/20241221-06333997-fct-000-3-thumb.jpg?exp=10800,2024-12-21T17:01:00+09:00,2024-12-21T17:58:20+09:00,福島中央テレビ,fct,福島中央テレビ,196,FCT福島中央テレビ 郡山市で軽自動車が民家の壁に衝突する単独事故があり、80代の男性が亡くなりました。 事故があったのは郡山市逢瀬町の県道です。 警察などによりますと午前11時過ぎ湖南町方面に向かって走っていたとみられる軽自動車が民家の壁に衝突し横転しました。 この事故で運転していた80代の男性が心肺停止の状態で救急搬送され、病院で死亡が確認されました。 警察が事故の原因を調べています。,[],[]
停電で信号機が停止　磐越西線（喜多方ー野沢駅）間が一時運転見合わせに・福島県（福島中央テレビ）,https://news.yahoo.co.jp/articles/e9c0c23a6c59f2385b1a358bb9c32a89245d208e,https://newsatcl-pctr.c.yimg.jp/t/amd-img/20241221-07377719-fct-000-2-view.jpg?exp=10800,2024-12-21T16:12:00+09:00,2024-12-21T16:19:15+09:00,福島中央テレビ,fct,福島中央テレビ,272,福島中央テレビ 12月21日の午後2時過ぎJR東日本の磐越西線の（喜多方ー野沢駅）間が停電のため信号が使えず1時間あまり運転を見合わせました。 午後2時18分ごろ、磐越西線の野沢行きの列車の乗務員が、山都駅近くで信号機が止まっているのに気付き停車しました。 この影響で喜多方ー野沢間の上下線で運転を見合わせ、午後3時27分に運転を再開しました。 停車した列車の乗客13人はタクシーで目的駅まで運んだということですが、この影響で2本の列車が遅れ、約80人に影響がでました。 信号機は喜多方地方で発生した停電のため止まったとみられるということです。,[],[]
喜多方市山都町などで約1200軒が2時間余り停電　午後4時過ぎに復旧・福島県（福島中央テレビ）,https://news.yahoo.co.jp/articles/0578ccfb8ef606ef93a020c528d4fe7f55dc3ada,https://newsatcl-pctr.c.yimg.jp/t/amd-img/20241221-05859972-fct-000-6-thumb.jpg?exp=10800,2024-12-21T16:02:00+09:00,2024-12-21T17:45:19+09:00,福島中央テレビ,fct,福島中央テレビ,211,FCT福島中央テレビ 12月21日の午後2時ごろから喜多方市の一部で約1200軒の停電が発生しましたが、午後4時過ぎには全て復旧しました。 東北電力によりますと、午後2時過ぎから停電が発生したのは喜多方市山都町などの約1200軒です。 午後４時過ぎには全て復旧しましたが、停電の原因はわかっていないということです。 この停電で磐越西線の（喜多方ー野沢間）は信号機が停止し、一時運転を見合わせました。 （記事更新：午後5時）,[],[]
軽トラックを運転し対向車線にはみ出す　会津坂下町で酒気帯び運転の疑いで男を逮捕（福島中央テレビ）,https://news.yahoo.co.jp/articles/f8ab59b2b67782ed7e5c754edc885b99f55e06a1,https://newsatcl-pctr.c.yimg.jp/t/amd-img/20241221-09353276-fct-000-2-view.jpg?exp=10800,2024-12-21T14:19:00+09:00,2024-12-21T14:48:19+09:00,福島中央テレビ,fct,福島中央テレビ,384,FCT福島中央テレビ 会津坂下町の国道で酒気を帯びた状態で軽トラックを運転した疑いで25歳の男が現行犯逮捕されました。 道路交通法違反（酒気帯び運転）の疑いで逮捕されたのは、会津若松市に住む（自称）大工の25歳の男です。 逮捕された男は12月21日の午前8時ごろ、会津坂下町塔寺の国道49号で酒気帯びた疑いで軽トラックを運転していた疑いがもたれています。 警察によりますと男は西会津方面に向けて軽トラックを運転し、対向車線にはみ出して軽トラックと衝突事故を起こしたことから、駆けつけた警察官が調べた結果、酒気帯び運転の容疑で現行犯逮捕されました。 この事故で対向車線を走行していた軽トラックを運転していた男性が軽いけがをしました。 会津坂下警察署によりますと逮捕された男は事故を起こしたことは認めていて、警察は男がいつ、どれくらい飲んだのかなど調べることにしています。,[],[]
香りほのかに…飯坂温泉の鯖湖湯（さばこゆ）で冬至のゆず湯を楽しむ・福島県福島市（福島中央テレビ）,https://news.yahoo.co.jp/articles/531f949d7f3505450d5e0d9a10ea766db65317d7,https://newsatcl-pctr.c.yimg.jp/t/amd-img/20241221-05248142-fct-000-2-thumb.jpg?exp=10800,2024-12-21T11:07:00+09:00,2024-12-21T17:52:15+09:00,福島中央テレビ,fct,福島中央テレビ,306,FCT福島中央テレビ 12月21日は二十四節気のひとつ冬至です。福島市の共同浴場では訪れた人がゆず湯を楽しんでいます。 福島市飯坂温泉にある共同浴場の鯖湖湯です。 一年で昼の長さが最も短い冬至の日にはゆず湯が提供され、訪れる人を楽しませています。 ゆず湯は寒さ厳しい冬に、健康で過ごせるようにと古くから伝わるもので、朝から訪れた人が湯船に浸かり、ゆずを手に取って身体を温めていました。 ■訪れた人は 「いいね。香りがいいから身体にはいいよ」 ■訪れた人は 「きょうは静岡から。知らなかったが季節を感じられて雰囲気は感じられた」 飯坂温泉のゆず湯は、共同浴場「鯖湖湯」のほか「波来湯」でも午後10時まで楽しめます。,[],[]
冬に観光客を呼び込め　鶴ヶ城でキャッスルマーケット・福島県会津若松市（福島中央テレビ）,https://news.yahoo.co.jp/articles/2e32c92bc9b3306fac1dc684936d8a63cd36d9a4,https://newsatcl-pctr.c.yimg.jp/t/amd-img/20241221-09362899-fct-000-2-thumb.jpg?exp=10800,2024-12-21T10:19:00+09:00,2024-12-21T12:08:16+09:00,福島中央テレビ,fct,福島中央テレビ,371,FCT福島中央テレビ 会津若松市の鶴ヶ城に冬でも観光客を呼び込もうと土日の新たなイベントが始まりました。 冬に食べたい“うま辛グルメ” 体の内側からホットに！！・福島 「キャッスルマーケット」は、観光客が減ってしまう冬の時期に鶴ヶ城の新たな魅力を知ってもらい、観光客を呼び込もうと会津若松観光ビューローなどが企画しました。 城の前には屋台が並び、会津名物の馬肉を使ったメンチカツやおでん、それに日本酒などが昭和レトロな雰囲気の中で味わえます。 射的や輪投げを楽しめるコーナーもあり、会津の味噌などお土産品も並びます。 ■会津若松観光ビューロー佐野 静也さん 「ぜひこのイベントでインバウンドも含めて会津若松の鶴ヶ城に訪問していただこうと思いまして実施した」 「キャッスルマーケット」は、2月8日（土）を除き2月16日まで毎週土日に開催します。,[],[]
2024年もあとわずか！自分へのご褒美にもぴったりな行列必至店の牛かつの味を堪能！（福島中央テレビ）,https://news.yahoo.co.jp/articles/efcda0cf2ade720e5da52723a4b4df81020051c2,https://newsatcl-pctr.c.yimg.jp/t/amd-img/20241221-00010000-fct-000-1-view.jpg?exp=10800,2024-12-21T10:03:48+09:00,2024-12-21T10:03:48+09:00,福島中央テレビ,fct,福島中央テレビ,962,お店こだわりの綺麗な赤身肉 R福島駅から歩いて7分ほどの場所にある「牛かつ牛若丸 福島駅前店」では、絶品の牛かつが楽しめる。福島市の信夫山のふもとにある本店は行列必至の人気店だ。 【福島のモーニング特集】大人気ヨーグルト専門店のモーニングメニューで一日をスタート！ こちらの「特製牛かつ定食 小」は小サイズとは思えないほどのボリュームでとても美味しそう！お店のお肉は、じっくりと時間をかけて育てた赤身熟成一枚肉が使われている。お肉にしっかり旨味が乗っているのが特徴で、赤身のまま食べられるほど新鮮だ。 最後に自分の席で仕上げ！ 牛かつは50秒ほど厨房で揚げられた状態で席まで運ばれてくる。そして、セットで付いてくる鉄板で自分好みの焼き加減に調節できるのだ。 店主の黒澤健太さんのおすすめの焼き時間は7秒ほど！レア感を残したい人は焼き時間を短めにすることもできる。 タレは全て手作りだそう タレも山椒塩、にんにく味噌、昆布醤油と3種類あるのが嬉しい。まずは山椒塩で一口食べると…モチモチとしたお肉の食感にふわ～っと山椒の香りが広がって、お肉の旨味がダイレクトに感じられる！ ツヤツヤの新米も自分へのご褒美に お米は福島県会津産一等コシヒカリ米を使用。今年の新米を提供している。にんにく味噌をつけてお肉とご飯を一緒に食べると…にんにくのがツンとした香りが甘みのある新米とよく合う！どんどんご飯が進んでしまう。なんと無料で大盛りにもできるというから嬉しい。 牛かつ定食には「小サイズ」の他にも、「中・大・特大」とお肉の量を選ぶことができる。 右側が「和牛かつイチボ」、左側が「ウチモモ」だ お次は贅沢な一品をご紹介！福島駅前店限定の「和牛かつイチボとウチモモセット」だ。お肉はどちらも最高ランクの黒毛和牛。「ウチモモ」はA4～A5ランクの福島ブランドの「福島牛」を使っていて、赤身とサシのバランスが良いのが特徴だ。 10秒ほど焼いて昆布醤油につけて食べると…溶けるように柔らかい！脂から出る旨みととあっさりとした昆布醤油が良く合う。 焼く時のパチパチとした音も食欲をそそる 「イチボ」は牛一頭の中で3キロほどしかない希少部位だそう。圧倒的な柔らかさが特徴の「イチボ」を頬張ると…モチモチで柔らかい！噛めば噛むほど旨みが溢れてくる。,[],[]
伊達市で電柱への衝突事故を起こし発覚　酒酔い運転容疑で52歳の男逮捕・福島県（福島中央テレビ）,https://news.yahoo.co.jp/articles/8eacccdc3f8bf645f0c71bd08e8ebdf99addbbf7,https://newsatcl-pctr.c.yimg.jp/t/amd-img/20241221-05744842-fct-000-2-view.jpg?exp=10800,2024-12-21T09:24:00+09:00,2024-12-21T09:37:20+09:00,福島中央テレビ,fct,福島中央テレビ,257,FCT福島中央テレビ 伊達市の道路を酒に酔った状態で軽自動車を運転した疑いで、川俣町の52歳の男が現行犯逮捕されました。 道路交通法違反（酒酔い運転）の疑いで現行犯逮捕されたのは川俣町の（自称）農業の52歳の男です。 逮捕された男は12月21日の午前0時過ぎ、伊達市保原町の道路を酒に酔った状態で軽自動車を運転していた疑いです。 伊達警察署によりますと男は車を電柱にぶつける単独事故を起こし、通りがかった人の通報で現場に駆けつけた警察官が検査を行い、現行犯逮捕されました。 なお事故によるけがはないということです。,[],[]
福島市で酒気帯び運転の疑い　岩手県の60歳の会社員の男を逮捕・福島市（福島中央テレビ）,https://news.yahoo.co.jp/articles/259a962e9b28fe873b816bb7fb12e32fa7f4b0bb,https://newsatcl-pctr.c.yimg.jp/t/amd-img/20241221-07555867-fct-000-4-view.jpg?exp=10800,2024-12-21T09:16:00+09:00,2024-12-21T09:32:15+09:00,福島中央テレビ,fct,福島中央テレビ,247,FCT福島中央テレビ 福島市の国道で軽自動車を運転していた60歳の男が酒気帯び運転の疑いで現行犯逮捕されました。 「お酒を飲んだら運転しない」飲酒運転に厳しい対処…週間アクセスランキング 道路交通法違反（酒気帯び運転）の容疑で逮捕されたのは岩手県盛岡市に住む60歳の会社員の男です。 逮捕された男は、12月20日の午後9時半ごろ、酒気帯びた状態で福島市鳥谷野の国道4号下り線で自家用の軽自動車を運転した疑いです。 夜間の交通取締中の福島警察署員がアルコール検査などを行い、現行犯逮捕されました。,[],[]
