headline,mainEntityOfPage,image,datePublished,dateModified,author,media_en,media_jp,str_count,body,images,external_links
米、対スイス関税15％に引き下げ　2000億ドルの対米投資確約（ロイター）,https://news.yahoo.co.jp/articles/6be1c6852c65fea52ba0c9f8c43c56531d0f554d,https://newsatcl-pctr.c.yimg.jp/t/amd-img/20251114-00000148-reut-000-3-view.jpg?exp=10800,2025-11-14T23:40:43+09:00,2025-11-15T02:24:53+09:00,ロイター,reut,ロイター,809,"米国とスイスが実施していた通商協議について、グリア米通商代表部（ＵＳＴＲ）代表は１４日、実質的な合意に達したと明らかにした。スイス政府も合意に達したと明らかにし、米国がスイスに課した関税率は１５％に引き下げられると発表した。写真はスイスのベルンで３月１２日撮影（２０２５年　ロイター／Denis Balibouse）
Susan Heavey　David Lawder　John Revill　Dave Graham　Emma Farge

［ワシントン／チューリヒ　１４日　ロイター］ - スイス政府は１４日、米国との通商協議の結果、米国がスイスに課した３９％の関税率を１５％に引き下げることで合意が得られたと発表した。これにより、米国のスイスに対する関税率は欧州連合（ＥＵ）に適用される関税率と同水準になる。

スイス政府によると、今回の合意の下でスイスは２０２８年末までに米国に２０００億ドルの投資を実施すると確約。スイスのパルムラン経済相は記者会見で、今回の関税率の引き下げでスイスの総輸出の約４０％が恩恵を受けるとの見方を示した。

スイス政府が発表した声明によると、スイスは米国産の工業製品や海産物のほか、スイスが「センシティブでない」と見なす農産品に対する輸入関税を引き下げる。また、米国産の牛肉５００トン、バイソン肉１０００トン、家禽肉１５００トンに対する無関税の割当（クオータ）を設定する。

これに先立ち、グリア米通商代表部（ＵＳＴＲ）代表もスイスとの通商協議で実質的な合意に達したと明らかにしていた。グリア氏はＣＮＢＣのインタビューに対し、合意の下でスイスは製造拠点の米国への移転を進めるほか、対米貿易黒字の縮小に取り組むと説明。合意には医薬品や鉄道関連機器などに関する取り決めも含まれると述べていた。

グリア氏によると、米政府は合意事項の詳細を１４日中にホワイトハウスの公式サイトに掲載する。",[],[]
米、対スイス関税15％に引き下げ　2000億ドルの対米投資確約（ロイター）,https://news.yahoo.co.jp/articles/701847441a88dd7aa28d246b114ad59dcae67f63,https://newsatcl-pctr.c.yimg.jp/t/amd-img/20251114-00000147-reut-000-3-view.jpg?exp=10800,2025-11-14T23:40:43+09:00,2025-11-15T02:24:05+09:00,ロイター,reut,ロイター,809,"米国とスイスが実施していた通商協議について、グリア米通商代表部（ＵＳＴＲ）代表は１４日、実質的な合意に達したと明らかにした。スイス政府も合意に達したと明らかにし、米国がスイスに課した関税率は１５％に引き下げられると発表した。写真はスイスのベルンで３月１２日撮影（２０２５年　ロイター／Denis Balibouse）
Susan Heavey　David Lawder　John Revill　Dave Graham　Emma Farge

［ワシントン／チューリヒ　１４日　ロイター］ - スイス政府は１４日、米国との通商協議の結果、米国がスイスに課した３９％の関税率を１５％に引き下げることで合意が得られたと発表した。これにより、米国のスイスに対する関税率は欧州連合（ＥＵ）に適用される関税率と同水準になる。

スイス政府によると、今回の合意の下でスイスは２０２８年末までに米国に２０００億ドルの投資を実施すると確約。スイスのパルムラン経済相は記者会見で、今回の関税率の引き下げでスイスの総輸出の約４０％が恩恵を受けるとの見方を示した。

スイス政府が発表した声明によると、スイスは米国産の工業製品や海産物のほか、スイスが「センシティブでない」と見なす農産品に対する輸入関税を引き下げる。また、米国産の牛肉５００トン、バイソン肉１０００トン、家禽肉１５００トンに対する無関税の割当（クオータ）を設定する。

これに先立ち、グリア米通商代表部（ＵＳＴＲ）代表もスイスとの通商協議で実質的な合意に達したと明らかにしていた。グリア氏はＣＮＢＣのインタビューに対し、合意の下でスイスは製造拠点の米国への移転を進めるほか、対米貿易黒字の縮小に取り組むと説明。合意には医薬品や鉄道関連機器などに関する取り決めも含まれると述べていた。

グリア氏によると、米政府は合意事項の詳細を１４日中にホワイトハウスの公式サイトに掲載する。",[],[]
米軍麻薬作戦、容疑者殺害に支持29％・反対51％　ロイター／イプソス調査（ロイター）,https://news.yahoo.co.jp/articles/ad7f6d0550810e60448e104b8b8f832eee2d8ccd,https://newsatcl-pctr.c.yimg.jp/t/amd-img/20251114-00000146-reut-000-1-view.jpg?exp=10800,2025-11-14T22:45:33+09:00,2025-11-14T22:45:33+09:00,ロイター,reut,ロイター,896,"カリブ海に派遣された空母ジェラルド・R・フォード、2016年6月11日撮影の提供写真　REUTERS/File Photo
Jason Lange　Matt Spetalnick

［ワシントン　１４日　ロイター］ - トランプ米政権がカリブ海や中南米の太平洋沿岸で展開している麻薬撲滅作戦で、米軍が司法の介入なしに麻薬密売容疑者を殺害することについて、最新のロイター／イプソス調査で、支持すると回答した割合が２９％にとどまり、反対が５１％を占めた。

調査は米国内で１２日まで６日間実施し、成人１２００人から回答を得た。誤差は３パーセントポイント。

共和党支持者では反対が２７％、支持が５８％、残りは分からないと回答。民主党支持者では４分の３が反対で、支持は１割程度だった。

トランプ政権が数カ月前から実施している作戦で、少なくとも２０回の軍事攻撃が行われ、７９人以上が死亡した。

アムネスティ・インターナショナルなどの人権団体は、民間人に対する超法規的殺害と非難し、米国の同盟国の間では、国際法違反の可能性があるとの懸念が出ている。

ホワイトハウスは、米国は麻薬カルテルと戦争状態にあり、その闘争において裁判所は必要ないと主張。またベネズエラ政府が麻薬密売人と結託していると指摘しており、同国の麻薬カルテルを標的とした軍事攻撃の可能性が懸念されている。

調査では、違法薬物が米国内に流入するのを防ぐために、ベネズエラ政府の許可なく同国で米軍が武力行使することについて、支持すると答えたのは３５％にとどまった。

トランプ政権がベネズエラのマドゥロ大統領を武力で排除することを支持すると回答した割合は２１％、非軍事的手段での排除を支持すると答えたのは３１％だった。

トランプ政権当局者は、マドゥロ氏の将軍らが彼に反旗を翻すことを期待していることを隠していない。８月、米国はマドゥロ氏の逮捕につながる情報提供に対する報奨金を５０００万ドルに倍増した。

ロイター／イプソスがオンラインで実施した世論調査では、全米の成人１２００人から回答が集まり、誤差は３パーセントポイントだった。",[],[]
英財務相、26日に所得税率引き上げ示さず　財政見通し改善＝関係筋（ロイター）,https://news.yahoo.co.jp/articles/25f59ff405cee579dc545a353651908a38df048e,https://newsatcl-pctr.c.yimg.jp/t/amd-img/20251114-00000145-reut-000-1-view.jpg?exp=10800,2025-11-14T22:08:08+09:00,2025-11-14T22:08:08+09:00,ロイター,reut,ロイター,376,"リーブス財務相とスターマー首相。2024年10月28日の代表撮影　REUTERS/Hollie Adams
Andrew MacAskill　Alistair Smout　Kate Holton

[ロンドン １３日 ロイター] - 英国のリーブス財務相は、財政見通しが改善したため、今月の予算案発表で所得税率引き上げ方針は示さない。関係筋が明らかにした。

これに先立ち、税率引き上げ断念との報道を受け、市場では金利が上昇、トリプル安となっていた。 

財務相は財政目標達成に向け、２６日の予算案発表で、選挙公約を破り所得税率を引き上げ方針を示すと見られていた。

しかし２人の関係筋によると、予算責任局が発表した最新の予測では、財政見通しの改善が見込まれているという。うち１人は、最新の見通しを考慮して政府に所得税引き上げ計画はないことを確認した。",[],[]
ユーロ圏、第3四半期ＧＤＰ改定は速報と変わらず　9月貿易黒字急増（ロイター）,https://news.yahoo.co.jp/articles/7d232e1208a9e3dc8022a66373db2e25b576eab8,https://newsatcl-pctr.c.yimg.jp/t/amd-img/20251114-00000144-reut-000-1-view.jpg?exp=10800,2025-11-14T21:45:41+09:00,2025-11-14T21:45:41+09:00,ロイター,reut,ロイター,572,"ドイツ・ブレーマーハーフェン港のターミナル（2025年8月13日撮影）。REUTERS/Leon Kuegeler/File Photo
[フランクフルト １４日 ロイター] -  欧州連合（ＥＵ）統計局が１４日発表した第３・四半期のユーロ圏域内総生産（ＧＤＰ）改定値は、前期比０．２％増で速報値と一致した。

低迷するドイツをフランスとスペインが補っ た。

前年比は１．４％増となり 、ロイター調査によるエコノミスト予想の１．３％ 増を小幅上回った。スペインが引き続き好調だった。

別の発表された９月の貿易統計によると、ユーロ圏の貿易黒字は１９４億ユーロ（２２６億２０００万ドル）となり、前月の１９億ユーロから急増した。関税で需要が押し下げられていた米国への輸出が輸入以上に伸びた。黒字幅は、関税発動前に米企業の駆け込み需要があった３月以来の高水準となった。

ＥＵ全体の対米黒字は２２２億ユーロで、８月の６５億ユーロ、前年同月の１８５億ユーロを上回った。

全体的な黒字を牽引したのは、医薬品を含む化学製品と機械販売。だが一過性の伸びである可能性がある。アイルランドには税制上の理由から世界的な製薬会社が多くあり、医薬品は振れが大きいためだ。

エコノミストは、月次の数字は一過性の要因が影響するため、深読みには注意を要するとしている。",[],[]
中国人宇宙飛行士、地球に無事帰還　宇宙ごみ衝突で遅延（ロイター）,https://news.yahoo.co.jp/articles/d2c0aaddf7ccdce4d960071f6fb6f736e156be99,https://newsatcl-pctr.c.yimg.jp/t/amd-img/20251114-00000143-reut-000-1-view.jpg?exp=10800,2025-11-14T21:07:36+09:00,2025-11-14T21:07:36+09:00,ロイター,reut,ロイター,553,"2025年4月24日、神舟20号の打ち上げ。提供写真
[北京／ワシントン １４日 ロイター] - 宇宙船に衝突した宇宙ごみにより地球への帰還が遅れていた中国人宇宙飛行士３人が１４日午後、中国に到着したと国営中央テレビ（ＣＣＴＶ）が伝えた。

中国有人宇宙プロジェクト弁公室（ＣＭＳＡ）は同日、宇宙船「神舟２０号」の帰還カプセルの小窓に「微細な亀裂」が見つかったと発表し、損傷の詳細を初めて明らかにした。

宇宙飛行士らは中国の有人宇宙ステーション「天宮」での６カ月のミッションの終了に伴い、５日に地球へ帰還する予定だった。

ＣＭＳＡによると、乗組員は別の宇宙船「神舟２１号」に乗り換えて天宮を出発し、午後４時４０分（日本時間午後５時４０分）に内モンゴル自治区の着陸場に着陸した。

神舟２１号で天宮に到着した乗組員３人は代替機が到着するまで宇宙にとどまる。ＣＭＳＡは「神舟22号」を「適切な時期に」打ち上げる予定だとしている。

今回の宇宙船の損傷は、宇宙探査における「宇宙ごみ」という増大する課題を浮き彫りにした。モスクワのロシア宇宙飛行士アカデミーのイゴール・マリニン氏はロイターに対し、「軌道上のごみの急増により、各国の宇宙船や宇宙ステーションが損傷を受けるリスクが大幅に高まっている」と指摘した。",[],[]
英金融市場がトリプル安、所得税率引き上げ断念との報道で（ロイター）,https://news.yahoo.co.jp/articles/05012201e0cf4e795b25128b54f815a6692807e9,https://newsatcl-pctr.c.yimg.jp/t/amd-img/20251114-00000142-reut-000-1-view.jpg?exp=10800,2025-11-14T20:19:47+09:00,2025-11-14T20:19:47+09:00,ロイター,reut,ロイター,802,"米ドル、ユーロ、ポンド紙幣（2025年5月4日撮影）。REUTERS/Dado Ruvic
Alun John　Dhara Ranasinghe

[ロンドン １４日 ロイター] - リーブス英財務相が今月の予算案で予定していた所得税率の引き上げを断念したと英紙フィナンシャル・タイムズ（ＦＴ）が報じたことを受けて、１４日の金融市場で通貨ポンド、国債、株式が急落した。

債券利回りは一時１０ベーシスポイント（ｂｐ）超上昇し、ポンドは対ドルで０.５％近く下落した。

ロンドン市場の取引が始まると値動きはやや落ち着いたものの、不安を反映し全体としては軟調な地合いとなっている。

英１０年物国債利回りは直近で７ｂｐ上昇の４．５０％。１日の上げ幅としては９月以来の大きさとなっており、米１０年債と独１０年債をアンダーパフォームしている。

ポンドは直近で約０．２５％安の１ポンド＝１．３１６ドル付近と、取引時間中の安値からは持ち直している。ユーロは対ポンド で、一時２０２３年４月以来の高水準となる１ユーロ＝０．８８６４ポンドまで上昇した。

優良株で構成するＦＴＳＥ１００種指数は１％超下落し、バークレイズ、ロイズ、ナットウエストなどの銀行株はそれぞれ２．５％超下落した。

トレーダーはリーブズ氏が所得税を引き上げない場合、財政の穴を埋めるために銀行への課税を強化する必要が生じる可能性があるとの見方を示している。

ＣＩＢＣマーケッツのG１０為替戦略部門責任者ジェレミー・ストレッチ氏は「政府が財政不足に対処するための措置を講じることを市場は明らかに期待していた。それは所得税の引き上げを意味する」と述べた。

「もしＦＴの報道が正しければ、政府が財政状況を改善しようとしていることへの信頼が揺らぐことになる。つまりわれわれが目にしているのは、市場、とりわけ債券市場からの信頼感の欠如だ」と指摘した。",[],[]
ウクライナ、国産長距離ミサイルでロシア領内攻撃　成功とゼレンスキー氏（ロイター）,https://news.yahoo.co.jp/articles/1045fcf6ff6a325f2384628fe755465fcc1a87ec,https://newsatcl-pctr.c.yimg.jp/t/amd-img/20251114-00000141-reut-000-1-view.jpg?exp=10800,2025-11-14T19:40:54+09:00,2025-11-14T19:40:54+09:00,ロイター,reut,ロイター,490,"ザポリージャ州の前線基地を訪問したウクライナのゼレンスキー大統領（2025年11月13日撮影）。Ukrainian Presidential Press Service提供写真
[キエフ １４日 ロイター] - ウクライナのゼレンスキー大統領は１４日、夜間に国産長距離巡航ミサイル「ロング・ネプチューン」でロシア領内の目標を攻撃したと明らかにし、ロング・ネプチューンの攻撃成功率が高まっていると述べた。

「わが国の兵士たちは夜間に、ロシア領内の指定された標的に対し『ロング・ネプチューン』を使用し成功を収めた。これはロシアの継続的なテロに対する、完全に正当な対応だ」とＸに投稿。「ウクライナのミサイルは、事実上毎月、ますます意義のある、正確な成果をもたらしている」と述べた。

標的は明らかにしなかった。

ロング・ネプチューンは、ゼレンスキー氏が３月にの実戦での発射に成功したと明らかにした。射程は１０００キロメートルとされる。

ウクライナ軍参謀本部は今週、ネプチューン型ミサイルを含む国産長距離兵器の有効利用を増やしており「敵にかなりの困難をもたらしている」と述べている。",[],[]
香港ＧＤＰ、第3四半期改定＋3.8％を確認　25年成長見通し上方修正（ロイター）,https://news.yahoo.co.jp/articles/203bee97335d838763fba668b00b30d3ed7af099,https://newsatcl-pctr.c.yimg.jp/t/amd-img/20251114-00000140-reut-000-1-view.jpg?exp=10800,2025-11-14T19:34:48+09:00,2025-11-14T19:34:48+09:00,ロイター,reut,ロイター,656,"2021年6月7日、香港のコンテナターミナルで撮影。REUTERS/Aleksander Solum
[香港 １４日 ロイター] - 香港政府が１４日発表した第３・四半期の域内総生産（ＧＤＰ）改定値は、輸出増加と内需の持続的成長に支えられ前年比３．８％増となった。

１０月３１日に発表した速報値に沿っており、１１四半期連続の拡大となった。

第２・四半期の経済成長率は３．１％、第１・四半期は３．０％だった。

政府はまた、２５年の成長率見通しを８月の見直し時の２─３％から３．２％に上方修正した。

季節調整済み成長率は前期比０．７％。第２・四半期改定値は０．４％、第１・四半期は１．８％だった。

政府エコノミスト代行のセシリア・ラム氏は声明で、「香港経済は年内、さらに堅調に成長するだろう」とし、インバウンド観光客の持続的な増加と活発な金融市場がサービス輸出に弾みをつけると指摘。

「世界経済は当面緩やかな成長を維持し、最近の米中貿易摩擦の緩和や電子関連製品に対する根強い需要も相まって、香港の財輸出を下支えする」と述べた。

政府は２５年の基調および総合消費者物価の上昇率見通しを１．２％・１．５％とし、、８月時点の１．５％・１．８％から下方修正した。

「国内のコスト圧力は引き続き抑制され、外部からの物価圧力も落ち着いているため、全体的なインフレ率は当面小幅にとどまるだろう」との見方を示した。

機械、設備、知的財産製品への支出の増加で投資支出は一段と拡大、民間部門の支出も力強い伸びを示した。",[],[]
サムスン、メモリー価格最大60％値上げ　ＡＩ需要追い風（ロイター）,https://news.yahoo.co.jp/articles/3e4cfa99a3a908cb334457bff831432c4222eebc,https://newsatcl-pctr.c.yimg.jp/t/amd-img/20251114-00000139-reut-000-1-view.jpg?exp=10800,2025-11-14T19:28:19+09:00,2025-11-14T19:28:19+09:00,ロイター,reut,ロイター,826,"サムスン電子のロゴ（2025年8月25日撮影）。REUTERS/Dado Ruvic
Hyunjoo Jin　Fanny Potkin

［ソウル／シンガポール　１４日　ロイター］ - 韓国サムスン電子が今月、世界的な人工知能（ＡＩ）データセンター建設ラッシュで不足している半導体メモリーの価格を９月に比べて６０％も引き上げたことが関係者の話で分かった。

サムスンは通常、毎月メモリー価格を発表するが、１０月に価格の発表を延期した。

価格が引き上げられたのは、「ＤＤＲ５」という最新規格のＤＲＡＭ。サーバーなど大量のデータを処理するのに欠かせないメモリーだ。

電子部品卸売りの米フュージョン・ワールドワイドのトビー・ゴナーマン社長はロイターに、サムスンの３２ギガバイト（ＧＢ）ＤＤＲ５メモリチップモジュールの１１月の契約価格が２３９ドルと、９月の１４９ドルから６０％高くなったと述べた。１６ＧＢと１２８ＧＢは約５０％引き上げ、それぞれ１３５ドルと１１９４ドルとした。６４ＧＢと９６ＧＢの価格も３０％以上上がったという。

サムスンの説明を聞いたという別の関係者も値上げを確認した。サムスンはコメントを控えた。

業界幹部やアナリストは、メモリーチップ不足は深刻で、一部顧客のパニック買いに拍車をかけていると指摘する。

中国の半導体受託製造最大手、中芯国際集成電路製造（ＳＭＩＣ）は１４日、メモリーチップ不足のため、顧客は自社製品に使う他の種類のチップの注文を控えていると述べた。

ＡＩ半導体で出遅れたサムスンにとって、現下のＤＲＡＭ不足は追い風だ。

ＫＢ証券のジェフ・キム調査部長は、メモリー部門ではサムスンはＳＫハイニックスやマイクロンよりも価格決定力があると指摘。

トレンドフォースのアナリスト、エリー・ワン氏は、サムスンが１０─１２月期の四半期契約価格を４０─５０％引き上げる公算で、業界全体で予想される平均３０％を上回ると述べた。",[],[]
