headline,mainEntityOfPage,image,datePublished,dateModified,author,media_en,media_jp,str_count,body,images,external_links
ナイジェリアで続く魔女狩り　子ども3万人が親から虐待、悪魔祓いの金づるにも（ロイター）,https://news.yahoo.co.jp/articles/b6c27b452f0db41882d15599f0e8c728944741c8,https://newsatcl-pctr.c.yimg.jp/t/amd-img/20251114-00010006-reutv-000-2-thumb.jpg?exp=10800,2025-11-14T15:27:11+09:00,2025-11-14T15:44:11+09:00,ロイター,reut,ロイター,991,"アフリカ西南部のナイジェリアでは過去20年にわたり、数万人の子どもらが「魔女」の疑いをかけられ、捨てられたり残虐な暴力を受けている。このような児童虐待を防ぐ法律はあるが、依然として広く犯罪行為が横行。背景には、災厄の原因を悪霊の仕業とみなす土着信仰が根強く残っていることに加え、悪魔祓いを名目に金を取る一部の自称牧師やまじない師が恐怖をあおり、虐待を助長している面もある。こうした中で、支援団体は安全な住まいと教育の機会を提供し、子どもらが未来を取り戻すための拠りどころとなっている。

この少年は9歳の時、母親から「なた」で襲われ、放置された。
少年は、ナイジェリアの教会の牧師から「魔女」の疑いをかけられていた。
「母はナイフで私に切りつけた。私を地面に押さえつけ、肩と首と背中を切った」
差別や偏見を避けるため、少年の身元は明かされていない。
「藪の中に3日間いた。
傷口からうじ虫が這い出した」
少年は道路脇まで這い、通りがかりの人に助けられ、命を救われた。
13歳になった彼は、支援団体「子供の権利とリハビリテーションネットワーク」の施設から通学している。
イマ・イタウマ氏はこの支援団体、CRARNのプログラムマネージャーだ。
「魔術を使ったと疑われた子どもは、殴られ、捨てられ、路上をさまようことになる」
ナイジェリア政府は魔術に絡む児童虐待を防ぐ法律を制定しているが、人権活動家らは依然として広く行われているとみている。CRARNは、過去20年で3万人以上の子どもらが魔女の疑いをかけられてきたと推計している。
この問題はアクワ・イボム州とクロスリバー州の南部沿岸地域で最も深刻だ。
これらの地域の大半はキリスト教徒だが、不幸な出来事の原因は邪悪な霊だという、土着信仰も広く存在している。「悪魔憑き」の子どもを、金でお祓いするという自称・牧師やまじない師が、儲けるためにこういった考えを広めている面もある。
支援団体は、虐待された子どもの未来のためには教育が鍵だとしている。
フェイスさんは13歳のとき、叔母から家族の不運はお前の魔術のせいだと責められた。現在19歳で、シェルターに逃れているフェイスさんは科学検査技術を学び、医師の訓練を受けたいと望んでいる。
母親になたで襲われた少年も、勉強に励んでいる。大人になったら母親を訴えるために、弁護士になりたいという。",[],[]
滋賀銀が株式5分割、3年以上の長期保有者に新たな株主優待（ロイター）,https://news.yahoo.co.jp/articles/ea88d5dfeb6622859571f502fc7a0c96164b5ee0,https://newsatcl-pctr.c.yimg.jp/t/amd-img/default.jpg?exp=10800,2025-11-14T15:16:54+09:00,2025-11-14T15:16:54+09:00,ロイター,reut,ロイター,151,"[東京 １４日 ロイター] -     滋賀銀行は１４日、２０２６年３月３１日を基準日に１対５の株式分株を実施すると発表した。効力発生日は４月１日。

株式を継続して３年以上持つ長期保有者に、６０００円相当のカタログギフトなどを贈る新たな株主優待も発表した。１年以上の継続保有者の優待内容は変わらない。",[],[]
ドイツ予算委が26年予算案承認、経済再生へ高水準の投資盛り込む（ロイター）,https://news.yahoo.co.jp/articles/4f965dd67830a08385e96f24e7c3cfdad1fab9e8,https://newsatcl-pctr.c.yimg.jp/t/amd-img/20251114-00000100-reut-000-1-view.jpg?exp=10800,2025-11-14T15:11:04+09:00,2025-11-14T15:11:04+09:00,ロイター,reut,ロイター,418,"１１月１４日、ドイツの予算委員会は２０２６年予算案をまとめた。写真はドイツ連邦議会議事堂の外に掲げられたドイツ国旗。ベルリンで９月撮影（２０２５年　ロイター/Lisi Niesner）
Maria Martinez

[ベルリン １４日 ロイター] -     ドイツの予算委員会は２０２６年予算案をまとめた。複数の関係筋が１４日に明らかにした。経済再生に向けた高水準の投資と、国防費への強いコミットメントが盛り込まれているという。

予算委は１３日午後に始まり、最終的な歳出・歳入計画を承認。数週間の協議を終えた。

予算案は２８日に議会本会議で採決される。

ロイターが確認した文書によると、歳出総額５２４５億ユーロ（６１１６億７０００万ドル）の中心予算には５８３億ユーロの投資が含まれており、７月末に閣議決定された草案から若干の増額となっている。

中心予算は９７９億ユーロの借入を想定しており、草案の８９８億ユーロから増加した。",[],[]
エスプール、白川・損保ジャパン前社長が社長に　ＢＭ問題で辞任（ロイター）,https://news.yahoo.co.jp/articles/c2f58a0cee702493531dd345a9f55d248ce86dad,https://newsatcl-pctr.c.yimg.jp/t/amd-img/default.jpg?exp=10800,2025-11-14T15:00:25+09:00,2025-11-14T15:00:25+09:00,ロイター,reut,ロイター,250,"［東京　１４日　ロイター］ -     障害者雇用支援などを手掛けるエスプールは１４日、損害保険ジャパンの前社長、白川儀一氏が１２月１日付で社長に就任する人事を発表した。２６年２月２６日の株主総会を経て代表取締役に就く。

白川氏は旧ビッグモーターによる保険金の不正請求問題を受けて損保ジャパン社長を２４年１月に辞任した。２５年４月からシニアエグゼクティブとしてエスプールの事業開発に携わり、グループの方向性や課題への認識を共有しており、「長期的視点から確実な成長を実現できる最適な人物」と判断した。",[],[]
サファイアテラ、伊藤忠商事による伊藤忠食品の完全子会社化を提案（ロイター）,https://news.yahoo.co.jp/articles/ed6116e706358ec425bcbf608ce0d7a704f3044b,https://newsatcl-pctr.c.yimg.jp/t/amd-img/20251114-00000097-reut-000-1-view.jpg?exp=10800,2025-11-14T14:57:08+09:00,2025-11-14T14:57:08+09:00,ロイター,reut,ロイター,587,"１１月１４日、米アクティビストファンドのサファイアテラ・キャピタルは、伊藤忠商事による伊藤忠食品の完全子会社化を伊藤忠食品の取締役会に提案していると明らかにした。写真は伊藤忠商事のロゴで、２００９年７月に都内で撮影（２０２５年　ロイター）
Kentaro Okasaka

［東京　１４日　ロイター］ -     米アクティビストファンドのサファイアテラ・キャピタルは１４日、伊藤忠商事による伊藤忠食品の完全子会社化を伊藤忠食品の取締役会に提案していると明らかにした。伊藤忠商事が株式公開買い付け（ＴＯＢ）を実施し、親子上場を解消することが資本関係を整理する上で最も合理的だとしている。

サファイアテラは、伊藤忠商事の上場子会社である伊藤忠食品が親会社の影響を一定程度受けることで、少数株主との利益相反につながる可能性があると指摘。それが伊藤忠食品の企業価値が十分評価されない原因であり、現在の株価は同社の企業価値を適切に反映していないとしている。伊藤忠商事がＴＯＢする場合の対価は１株１万４０００円程度が適切としている。

仮に上場維持を選択する場合は、企業価値向上のための施策を実施すべきとし、１株当たり計７０００円（総額８８７億円）の特別配当の実施による株主還元と資本効率改善を求めている。

伊藤忠商事は今年９月末現在、伊藤忠食品の株式を５２．４６％保有している。",[],[]
メモリーチップ不足懸念、他の半導体注文に影響＝中国ＳＭＩＣ（ロイター）,https://news.yahoo.co.jp/articles/1679aa27f239796d9d42ebe28f6224a0e37b663b,https://newsatcl-pctr.c.yimg.jp/t/amd-img/20251114-00000096-reut-000-1-view.jpg?exp=10800,2025-11-14T14:51:15+09:00,2025-11-14T14:51:15+09:00,ロイター,reut,ロイター,681,"１１月１４日、中国の半導体受託製造最大手、中芯国際集成電路製造（ＳＭＩＣ）は、メモリーチップ不足への懸念が高まり、顧客が他の種類の半導体の注文を控えていると明らかにした。写真はＳＭＩＣのロゴ。２０２０年１０月、中国の上海で撮影（２０２５年　ロイター/Aly Song）
Che  Pan　Brenda Goh

[北京 １４日 ロイター] -     中国の半導体受託製造最大手、中芯国際集成電路製造（ＳＭＩＣ）は１４日、メモリーチップ不足への懸念が高まり、顧客が他の種類の半導体の注文を控えていると明らかにした。

趙海軍・共同最高経営責任者（ＣＥＯ）は決算説明会で「来年第１・四半期の注文はあまり多くない。というのも、実際にどれだけのメモリー（チップ）が手に入るのか、つまりどれだけの携帯電話や自動車、その他の製品をサポートできるのか、誰にも分からないからだ」と述べた。

メモリーを使用する自動車やスマートフォンのメーカーは来年、価格圧力と供給の不確実性に直面すると指摘。現時点で確固とした供給コミットメントを提示しているところはないと付け加えた。

趙氏は「現在のメモリー市場は供給不足で、価格は大幅に上昇している」と語った。

ＳＭＩＣの第３・四半期売上高は、堅調な内需を受けて前年同期比９．７％増の２３億８０００万ドル、利益は２８．９％増の１億９１７５万ドルだった。いずれもアナリスト予想を上回った。

中国が引き続きＳＭＩＣにとって最大市場。第３・四半期売上高の８６％を占め、第２・四半期から小幅に上昇した。米国は１１％を占め、１３％から低下した。",[],[]
マクロスコープ：高市氏、賃上げ「丸投げしない」　前政権とのパラダイムシフト鮮明に（ロイター）,https://news.yahoo.co.jp/articles/3f6b83c44af094e419365f8119adca282214ecb6,https://newsatcl-pctr.c.yimg.jp/t/amd-img/20251114-00000098-reut-000-1-view.jpg?exp=10800,2025-11-14T14:44:36+09:00,2025-11-14T14:44:36+09:00,ロイター,reut,ロイター,2250,"１０月、国会で所信表明演説を行う高市早苗首相。REUTERS/Kim Kyung-Hoon
Tamiyuki  Kihara

[東京 １４日 ロイター] - 高市早苗首相が政府の賃上げ政策の方向性を前政権から転換している。最低賃金の目標値を明示しないなど企業側の立場を重視していると見る野党側から疑問の声が上がる一方、高市氏は「賃上げができる環境の整備」を優先する考えを強調し続けている。岸田文雄、石破茂両政権からのパラダイムシフトの大きなポイントは、経済成長を目指す「起点」が異なることだ。

＜「１５００円目標の撤回だ」＞

「時給をいまの段階で明確に目標を示すのは非常に難しい。ちょっとでも上がっていくように。いま明示的に何円までと示す政府として統一したものはない」。高市氏は１４日の参院予算委員会で、これまで政府が目標としてきた最低賃金を２０２０年代に全国平均時給１５００円とする考え方を踏襲するか問われ、こう答弁した。

質問した立憲民主党の古賀之士氏は「目標値に向かって進まないと政策の検証ができない。具体的な数字を示してほしい」と詰め寄ったが、高市氏は「物価高を超える賃上げを目指している。結果的にはこれまでの目標より高くなっていく可能性もあるし、外的要因でショックが起きてそれが難しい場合もある」と説明。「賃上げができる環境を示していく。金額を申し上げると地方を含めたたくさんの中小・小規模事業者に丸投げしてしまうことになる。それはとても無責任なことだ」と述べた。古賀氏は「事実上の時給１５００円目標の撤回だ」と批判した。

＜「賃上げを起点」とした前政権＞

政府が初めて最低賃金（時給）目標を「全国加重平均１５００円」としたのは２３年８月のことだ。岸田文雄首相（当時）が「新しい資本主義実現会議」で「３０年代半ばまでの実現を目指す」と表明した。それまでの政府目標だった１０００円の達成見通しを受けたものだ。次の石破茂政権では岸田氏の目標達成時期を「２０年代」へと前倒しした経緯がある。

岸田政権の後期、目標額の上乗せに加えてもう一つ大きな政府方針の変更があった。２４年６月に閣議決定した「経済財政運営と改革の基本方針（骨太の方針）」に「賃上げを起点とした所得と生産性の向上」を盛り込んだことだ。

それまでの政府方針で一般的だった「経済成長の土台の上」に「構造的な賃上げ」を実現するとの考え方から、賃上げを先行させることで消費や投資の拡大を図り、その結果として企業収益が押し上げられ、家計が潤ってさらに消費の増加につながる「好循環」を目指す考え方にシフトしたものだ。

石破政権でも方針は継承され、今年５月に公表した「中小企業・小規模事業者の賃金向上推進５か年計画」では、２９年度までの５年間で「持続的・安定的な物価上昇の下で、物価上昇を１％程度上回る賃金上昇を賃上げのノルム（社会通念）として我が国に定着させる」と明記。「賃上げと投資がけん引する成長型経済の実現」とも盛り込み、賃上げを先行させた経済成長モデルを目指す考えを改めて強調した。

実際、連合が今年７月に発表した２５年春闘の最終集計では、ベースアップ（ベア）と定期昇給を合わせた平均賃上げ率が５．２５％となり、１９９１年（５．６６％）以来３４年ぶりの高水準となった。中小の賃上げ率（４．６％）とは開きがあるものの、政府関係者は「最低賃金に当てはめれば１５００円も達成できる数字だ」と評価した。

一方、財務省の法人企業統計調査によると、金融保険業を除く全産業の利益剰余金は２４年度に約６３７．５兆円と前年度から約３６．５兆円増加し過去最高を更新した。５年間で約１６２兆円以上増えた計算になる。「賃上げの原資はまだまだ十分にある」（財務省幹部）というのがこれまでの政府の基本スタンスだ。

＜高市氏「株主配当行き過ぎ」とも＞

これに対し高市氏は首相就任後、既存の「新しい資本主義実現会議」に替えて「日本成長戦略会議」を新設。年内の策定を目指す総合経済対策の案文では、まず「大胆かつ戦略的な『危機管理投資』と『成長投資』」を推進し、「雇用と所得を増やし、潜在成長率を引き上げ、『強い経済』を実現する」と強調した。

賃上げについては「物価上昇を上回る賃上げは必要だが、それを事業者に丸投げしてしまっては事業者の経営が苦しくなるだけ」との立場を繰り返し表明しており、あくまで「積極財政」による企業側への対応が先決だとの姿勢を崩していない。

１４日の参院予算委では、国民民主党の川合孝典氏が利益剰余金や株主配当が増加する一方、人件費が伸びていない現状を提示。「（企業は賃上げの）支払い余力がないというが、内部留保され続けている。数字を見る限り支払い余力は高まっている」と指摘した。

これには高市氏も「企業が過度に預貯金をため込むというのではなく、賃上げを含む人への投資に効果的に活用してほしい」と企業側に注文。「株主に目を向ける、行き過ぎた傾向があったのではと思っている」とした上で、「コーポレートガバナンスコードを改定し、株主のみならず働いている方にも適切に（利益を）配分することを促していく」と語った。

経済成長の「起点」を「賃上げ」から「積極財政」へと転換した高市氏。経済成長を実現しつつ、前政権を上回る賃上げを達成できるのか。財政規律の観点からも、厳しい目が向けられている。

（鬼原民幸　編集：橋本浩）",[],[]
米アリゾナ州でオーロラ観測、セドナの名勝「ベルロック」上空が赤く染まる（ロイター）,https://news.yahoo.co.jp/articles/ca7fca48a4d1d01ddee02804a3b4f3b3ae998484,https://newsatcl-pctr.c.yimg.jp/t/amd-img/20251114-00010005-reutv-000-1-thumb.jpg?exp=10800,2025-11-14T14:43:51+09:00,2025-11-14T14:43:51+09:00,ロイター,reut,ロイター,259,"11日、米アリゾナ州セドナを代表する岩山「ベルロック」の上空でオーロラが夜空を照らした。タイムラプス映像には、赤やピンクの揺らめく光の波と、その間を横切る流れ星のような光跡が捉えられた。

タイムラプス映像には、赤やピンクの揺らめく光の波と、その間を横切る流れ星のような光跡が捉えられた。ここ数日、米各地の広範囲でオーロラが観測され、南はテキサス、フロリダ、アラバマにまで達したと報告されている。

オーロラは、特に強力な太陽嵐が地球の地磁気と相互作用することで発生する。

ロイターは映像の撮影場所を独自に確認した。",[],[]
マレーシアＧＤＰ、第3四半期は前年比＋5.2％　1年ぶり高い伸び（ロイター）,https://news.yahoo.co.jp/articles/34d5cc1a5eabea87b8c74956ba5350dfdb2a2e44,https://newsatcl-pctr.c.yimg.jp/t/amd-img/20251114-00000095-reut-000-2-view.jpg?exp=10800,2025-11-14T14:41:23+09:00,2025-11-14T15:57:17+09:00,ロイター,reut,ロイター,1043,"１１月１４日、マレーシア中央銀行と統計局のデータによると、第３・四半期の国内総生産（ＧＤＰ）は前年比５．２％増加し、１年ぶりの高い伸びとなった。写真はクアラルンプール。７月撮影（２０２５年　ロイター/Hasnoor Hussain）
Rozanna Latiff

［クアラルンプール　１４日　ロイター］ - マレーシア中央銀行と統計局のデータによると、第３・四半期の国内総生産（ＧＤＰ）は前年比５．２％増加し、１年ぶりの高い伸びとなった。中銀は今年の成長率が予想の上限に達するとの見通しを示した。

第３・四半期の成長率はロイターがまとめたエコノミスト予想と一致した。第１・四半期と第２・四半期の成長率は４．４％だった。

第３・四半期ＧＤＰは季節調整済み前期比では２．４％増加し、第２・四半期の２．２％増からやや加速した。

中銀のアブドゥル・ラシード・ガフォール総裁は記者会見で、１─９月の成長率は４．７％で、中銀による今年の成長率予想レンジ（４─４．８％）内にあると指摘。「このペースで推移すれば、予想上限に近い成長率を記録する可能性がある」と述べた。

米関税で貿易が混乱したにもかかわらず、第３・四半期の純輸出は前年比１７．７％増となり、持続的な内需と輸出の急回復が成長の原動力となった。

総裁は米国の関税措置による混乱により、経済成長には上振れリスクも下振れリスクもあるとした。ただ、観光業の回復や電気・電子機器の需要増加によって経済が恩恵を受けるとの見方を示した。

中銀は先週、主要政策金利を予想通り２．７５％に据え置いた。７月の会合では、世界貿易を巡る不確実性の高まりを背景に、５年ぶりの利下げを決定していた。

アブドゥル・ラシード総裁は、内需と持続的な投資にけん引され、来年の経済成長率は４─４．５％になると予測した。

追加利下げの可能性について問われたのに対し、現行金融政策の水準は適切で、経済を下支えしているとしつつ、成長とインフレの見通しを踏まえると「措置を講じる余地が依然としてある」と述べた。

バンク・ムアーマラート・マレーシアのチーフエコノミスト、モハド・アフザニザム・アブドゥル・ラシッド氏は、今回のデータは第４・四半期成長率が「５％程度」になる可能性を示していると指摘。「さらに、拡張的な財政政策のほか、現金給付や補助金といった政府支援はより的を絞ったものとなっており、対外的な不確実性に対するちょうどいいクッションになるだろう」と述べた。",[],[]
ＩＭＦ、2026年のタイ成長率は1.6％に減速と予想（ロイター）,https://news.yahoo.co.jp/articles/a5bb2ed3ae3b79199ff91672d3b6fc47eec0f5f2,https://newsatcl-pctr.c.yimg.jp/t/amd-img/20251114-00000094-reut-000-1-view.jpg?exp=10800,2025-11-14T14:36:02+09:00,2025-11-14T14:36:02+09:00,ロイター,reut,ロイター,446,"１１月１４日、国際通貨基金（ＩＭＦ）は、タイの経済成長率について、今年は２.１％で２０２６年には１.６％に減速するとの見通しを示した。写真は、バンコクの中華街で屋台料理を購入する観光客。５月撮影（２０２５年　ロイター/Athit Perawongmetha）
[バンコク １４日 ロイター] -     国際通貨基金（ＩＭＦ）は、タイの経済成長率について、今年は２.１％で２０２６年には１.６％に減速するとの見通しを示した。

現地訪問後１３日付の声明で「経済状況はさらなる金融緩和の余地があることを示唆している」と指摘。

さらに「政策余地が限られる中で経済には課題が山積しており、政策効果を最大化するために政策の組み合わせを慎重に調整する必要がある」と分析している。

タイ中央銀行は１０月、予想に反して主要金利の翌日物レポ金利を１．５０％に据え置いた。

中銀行は２０２４年１０月以降、計１００ベーシスポイント（ｂｐ）の利下げを４回行っている。

次回の政策金利決定会合は１２月１７日。",[],[]
中国の10月発電量、統計開始以来最高　前年比7.9％増（ロイター）,https://news.yahoo.co.jp/articles/814bf7428f9e31e8a0f8d611342b4dd947dfbcba,https://newsatcl-pctr.c.yimg.jp/t/amd-img/20251114-00000093-reut-000-1-view.jpg?exp=10800,2025-11-14T14:31:15+09:00,2025-11-14T14:31:15+09:00,ロイター,reut,ロイター,363,"１１月１４日、中国国家統計局が発表したデータによると、１０月の国内発電量は前年比７．９％増の８００２億キロワット時（ｋｗｈ）で、統計が開始された１９９８年以降で最高となった。写真は北京で２０２１年１２月撮影（２０２５年　ロイター／Tingshu Wang）
[北京 １４日 ロイター] -     中国国家統計局が１４日発表したデータによると、１０月の国内発電量は前年比７．９％増の８００２億キロワット時（ｋｗｈ）で、統計が開始された１９９８年以降で最高となった。

需要急増により化石燃料による火力発電が５１３８億ｋｗｈとなり、７．３％増加した。ただ、前月の５１７５億ｋｗｈからは減少し、１─１０月も前年比０．４％減少した。

１０月の水力発電量は２８．２％の大幅増だった。

詳細なデータは月末に国家能源局から発表される。",[],[]
