headline,mainEntityOfPage,image,datePublished,dateModified,author,media_en,media_jp,str_count,body,images,external_links
原油先物は2％超高、ロシア南部の石油備蓄基地にドローン攻撃（ロイター）,https://news.yahoo.co.jp/articles/bf191eb9f152c2e252d3b83360d26a2758899eb4,https://newsatcl-pctr.c.yimg.jp/t/amd-img/20251114-00000074-reut-000-1-view.jpg?exp=10800,2025-11-14T12:13:03+09:00,2025-11-14T12:13:03+09:00,ロイター,reut,ロイター,441,"１４日のアジア時間序盤の原油先物価格は２％超上昇している。写真は昨年９月にカナダ・サスカチュワン州キンダースリー近郊にある石油ポンプジャック・タンクをドローンで空撮(２０２５年　ロイター/Todd Korol)
Sam Li　Lewis Jackson

[１４日 ロイター] -     １４日のアジア時間序盤の原油先物価格は２％超上昇している。ロシア南部ノボロシースク港の石油備蓄基地で、ウクライナによる無人機（ドローン）攻撃の被害が出たことを受けた。

０２２７ＧＭＴ（日本時間午前１１時２７分）時点で、北海ブレント先物は１．３４ドル（２．１３％）高の１バレル＝６４．３５ドル。米ＷＴＩ先物は１．４０ドル（２．３９％）高の６０．０９ドル。

ロシア当局によると、ドローンの破片がアパート３棟と油槽所、黒海沿岸の建物に命中したという。

米国はウクライナ和平交渉にロシアを引き込むために、石油大手ルクオイルとロスネフチに制裁を課した。２１日以降、ロシア企業との取引が禁止される。",[],[]
午前の日経平均は反落、800円超安　米株急落の流れ引き継ぐ（ロイター）,https://news.yahoo.co.jp/articles/802737e95d3636116038cb10f937ed5e50522ac3,https://newsatcl-pctr.c.yimg.jp/t/amd-img/20251114-00000073-reut-000-1-view.jpg?exp=10800,2025-11-14T12:07:21+09:00,2025-11-14T12:07:21+09:00,ロイター,reut,ロイター,858,"2024年6月4日、アドバンテストのロゴ。REUTERS/Sam Nussey
［東京　１４日　ロイター］ - 前場の東京株式市場で日経平均は反落し、前営業日比８４７円２９銭安の５万０４３４円５４銭で取引を終えた。米連邦準備理事会（ＦＲＢ）による１２月の追加利下げ観測が後退し、米国株式市場が急落した流れを引き継いだ。東京市場ではＡＩ（人工知能）や半導体関連株が大幅安となった。物色は好決算銘柄や割安のバリュー株に向かった。

マリン・ストラテジーズの香川睦シニアマーケットアナリストは「ＡＩや半導体関連株に割高感がみられる中、グロース株からバリュー株へ資金をシフトさせる動きが出ている」と分析する。一方、米政府機関再開や決算の一巡で市場に出尽くし感がある中、投資家の目線は来週１９日の米エヌビディアの決算に向いているといい「内容次第では持ち直す可能性がある」とみている。

市場では日経平均の５万円割れが警戒されていたが、下値では押し目が入り、持ちこたえた。日経平均は５１４円安で寄り付き、程なく１０３５円安の５万０２４６円６０銭まで下落したが、その後下げ幅を縮小した。

主力株では、ソフトバンクグループ、アドバンテスト、東京エレクトロン、フジクラが４─５％超下落し、４銘柄で日経平均を７０８円程度押し下げた。

ＴＯＰＩＸは０．８２％安の３３５４．１３ポイントで午前の取引を終了した。東証プライム市場の売買代金は３兆４６９４億５６００万円だった。東証３３業種では、値下がりは非鉄金属、機械、電気機器、情報・通信など２１業種、値上がりは鉱業、不動産など１２業種となった。

決算銘柄ではキオクシアホールディングスがストップ安売り気配となったほか、荏原製作所が１５％超安、楽天グループは８％超下落した。ＴＯＰＰＡＮホールディングスは１０％近く上昇し、東京建物も９％高でしっかりだった。

東証プライム市場の騰落数は、値上がりが６０５銘柄（３７％）、値下がりは９３４銘柄（５７％）、変わらずは７４銘柄（４％）だった。",[],[]
日産、欧州統括会社で87の全職位を見直し　組織を効率化＝社内文書（ロイター）,https://news.yahoo.co.jp/articles/d411f665e1f8f18edc822f4587ad0d3b838dd3cc,https://newsatcl-pctr.c.yimg.jp/t/amd-img/20251114-00000072-reut-000-1-view.jpg?exp=10800,2025-11-14T11:44:07+09:00,2025-11-14T11:44:07+09:00,ロイター,reut,ロイター,927,"写真は日産のロゴ。ジャパン・モビリティショー2025の会場で10月撮影。REUTERS/Issei Kato
Daniel Leussink

［東京　１４日　ロイター］ -     日産自動車が、フランスにある欧州統括会社の欧州日産で８７ある職位を見直し、組織を効率化することが分かった。社内の文書やメールをロイターが確認した。同社が進めている再建計画の一環。

欧州日産は欧州、アフリカ、中東、インド、オセアニア地域の販売や生産を管理。職位は８７あり、１０月に労働組合と見直しで合意した時点で６４に社員が配置されていた。見直しの大半はマーケティングと販売部門となる見込み。併せて、３４の職位を新たに設ける予定で、ポストが削減された社員の異動先になり得る。

今月１２日の社内ミーティングに出席した関係者によると、地域責任者のマッシミリアーノ・メッシーナ氏は「単に無駄を削減するだけではない」と述べ、筋肉質になる必要性を訴えたという。

社内文書によると、見直しは段階的に実施する。まず希望退職者を募り、希望退職者の数が目標に達しない場合、来年２月上旬から削減が始まる見通し。

社内異動を選んだ社員には５０００ユーロ（日本円換算で約９０万円）の一時金を支給する。転職を選択した場合は、再就職や研修などの支援、年齢に応じて最長２年間の再雇用休暇を付与する。

日産広報は、ロイターの取材に対し、欧州の経営陣と従業員代表が合意に達し、組織の変更を社内で発表したことを認め、「この決定はきょうのビジネス環境の現実を反映し、日産の特定の課題に対処する必要性によって推進されている」とコメント。この変更には役割の簡素化と一部の管理層の削除が含まれ、組織全体の効率が向上したという。

日産は２０２５年３月期の連結純損益が６７０８億円の赤字（前の期は４２６６億円の黒字）と４期ぶりの最終赤字へ転落。世界で従業員２万人の削減や車両工場を１７から１０に減らす再建計画を進めている。２６年３月期は再建計画に伴う費用を算定中であることを理由に純損益予想は非開示のまま。米関税政策の影響が重くのしかかり、営業損益は２７５０億円の赤字（前年は６９７億円の黒字）となる見通し。",[],[]
中国、日本への渡航自粛呼びかけ　高市首相の台湾巡る発言が波紋（ロイター）,https://news.yahoo.co.jp/articles/4c53b47dc8465326a5981c4ef72fb7872b80b33a,https://newsatcl-pctr.c.yimg.jp/t/amd-img/20251114-00000071-reut-000-4-view.jpg?exp=10800,2025-11-14T11:39:31+09:00,2025-11-15T01:40:31+09:00,ロイター,reut,ロイター,1080,"写真は１日、韓国・慶州で記者会見する高市早苗首相。REUTERS/Kim Hong-ji
［北京　１４日　ロイター］ - 中国政府は１４日、国民に対し日本への渡航を控えるよう呼びかけた。両国関係の悪化と、中国国民が日本に渡航する際に直面する「重大なリスク」を理由とした。さらに、日本が台湾問題に武力介入すれば「壊滅的な」軍事的敗北を招くとも警告した。

高市早苗首相の台湾有事を巡る国会答弁が波紋を広げている。

駐日中国大使の呉江浩氏は１４日、高市早苗首相の台湾に関する発言に対し「強く抗議」した。中国大使館が発表した声明で明らかになった。声明によると、同大使は日本の外務省高官と会談し、高市氏の発言は「中国の内政に著しく干渉し、中国の越えてはならない一線を越えた」と述べた。

高市首相は７日の国会答弁で、台湾有事が日本の集団的自衛権の行使が可能となる「存立危機事態」になり得ると述べた。

この発言を巡っては、中国共産党機関紙「人民日報」も１４日、日本は戦時中の軍国主義を復活させ、歴史の過ちを繰り返そうとしているとする論評を掲載した。

人民日報は論評で、高市氏の発言は決して「単発の政治的暴言」ではないとし、日本の右派は第２次世界大戦後の憲法の制約から抜け出し、軍事大国の地位を追求しようとしてきたと主張。「日本は近年、軍備増強の道を突き進んでいる」と記した。

また「靖国神社への頻繁な参拝から南京大虐殺の否定、『中国脅威論』の積極的な宣伝まで、高市氏のあらゆる行動は侵略の歴史を覆い隠し、軍国主義を復活させようとする歴史的罪の古い足跡をたどっている」とした。

さらに、日本の軍国主義は歴史的に、いわゆる「存立危機」を侵略の口実として利用してきたと指摘。「現在、同様のレトリックが復活しているが、日本は歴史の過ちを繰り返すつもりなのか」と記した。

中国は台湾を自国領の一部と主張しており、統一に向けて武力行使も排除していない。台湾と日本との最短距離は約１１０キロで、台湾周辺の海域は日本にとっても重要な海路となっている。

日本のメディアは１４日、反中感情の高まりを受けて、東京の中国大使館が職員に外出を控えるよう指示したと伝えた。

また、中国国務院台湾事務弁公室は同日、ベルリンを今週訪問した台湾与党・民進党の沈伯洋議員を批判。沈議員は、中国が海外滞在中に逮捕を企てると脅迫しているが恐れていないと反発している。

前日にも中国警察当局が台湾のインフルエンサー２人を「分離主義」として指名手配し、懸賞金３万５０００ドルを提供すると発表した。",[],[]
良品計画、顧客情報流出の可能性　アスクルのランサム感染で（ロイター）,https://news.yahoo.co.jp/articles/f90426972ac52137c365a12ad124a3820f84a777,https://newsatcl-pctr.c.yimg.jp/t/amd-img/default.jpg?exp=10800,2025-11-14T11:35:04+09:00,2025-11-14T11:35:04+09:00,ロイター,reut,ロイター,238,"Ritsuko Shimizu

［東京　１４日　ロイター］ -     良品計画は１４日、アスクルのランサムウエア感染により、顧客情報が外部に流出した可能性があると発表した。

外部流出の可能性がある情報は、ネットストアで買い物をした顧客の住所や氏名、電話番号、注文商品情報で、クレジット情報は含まれていない。現時点で対象期間は特定されていないという。

現時点で情報を悪用した被害発生は確認されていないが、良品計画では、フィッシングメールなどに注意するよう呼び掛けている。",[],[]
雪印メグ、四谷本社ビル売却へ　来期に特別利益175億円見込み（ロイター）,https://news.yahoo.co.jp/articles/44371bd2e78a05262c92e03725f1bde48533e6f8,https://newsatcl-pctr.c.yimg.jp/t/amd-img/default.jpg?exp=10800,2025-11-14T11:32:40+09:00,2025-11-14T11:32:40+09:00,ロイター,reut,ロイター,162,"［東京　１４日　ロイター］ -     雪印メグミルクは１４日、資産効率改善のため、四谷本社ビル（東京都新宿区）を売却すると発表した。土地・建物の引き渡しは２０２６年５月の予定で、２７年３月期第１・四半期で固定資産売却益として約１７５億円の特別利益を見込んでいる。

譲渡先は国内事業法人で、特に資本・人的・取引関係はない。",[],[]
世界の石油需要、2040年まで増加続く見通し＝ゴールドマン（ロイター）,https://news.yahoo.co.jp/articles/f66ab19d0868c2650837caf77cff13617f86edf5,https://newsatcl-pctr.c.yimg.jp/t/amd-img/20251114-00000068-reut-000-1-view.jpg?exp=10800,2025-11-14T11:30:15+09:00,2025-11-14T11:30:15+09:00,ロイター,reut,ロイター,577,"ゴールドマン・サックスは１３日、世界の石油需要が昨年の日量１億０３５０万バレルから２０４０年には同１億１３００万バレルに増加する流れが続くとの見通しを示した。同社のロゴが写った資料写真。ニューヨーク証券取引所で２０２１年１１月撮影(２０２５年　ロイター/Andrew Kelly)
[１３日 ロイター] -     ゴールドマン・サックスは１３日、世界の石油需要が昨年の日量１億０３５０万バレルから２０４０年には同１億１３００万バレルに増加する流れが続くとの見通しを示した。エネルギー需要拡大に加え、低炭素関連の技術とインフラがなお課題を抱えているためだ。

ゴールドマンはノートに「２０２５－３０年は年間平均で日量９０万バレルのしっかりした需要の伸びが想定され、その後４０年までに伸びは同１０万バレルへ鈍化する」と記した。

需要見通しがコンセンサスより高い理由として、技術的な制約からジェット燃料と石油化学製品の代替が限られる点や、３０年以降に車両用燃料需要がピークを過ぎた後でも、エネルギー需要の伸びが脱石油化の進展を上回ることを挙げた。

また人工知能（ＡＩ）主導による４０年までの成長拡大が、間接的な日量３００万バレルの需要押し上げ要因になるとみている。

一方で低炭素技術のより急速な発達と景気後退の可能性を需要の下振れリスクとして指摘した。",[],[]
モルガンＳに書簡、紫金黄金国際の香港ＩＰＯ巡り米下院委が疑念（ロイター）,https://news.yahoo.co.jp/articles/38393af98083104c7e746474db34e533ec5dd38c,https://newsatcl-pctr.c.yimg.jp/t/amd-img/20251114-00000067-reut-000-1-view.jpg?exp=10800,2025-11-14T11:22:54+09:00,2025-11-14T11:22:54+09:00,ロイター,reut,ロイター,785,"米下院の中国に関する特別委員会は１３日、米銀モルガン・スタンレーが紫金黄金国際による香港の新規株式公開（ＩＰＯ）を引き受けたことにより、同行とその米国投資家は規制、財務、風評被害のリスクにさらされていると指摘した。同行のロゴが写った資料写真。ニューヨーク証券取引所で２０２１年８月撮影(２０２５年　ロイター/Andrew Kelly)
Karen Freifeld　Kanishka Singh

[ニューヨーク １３日 ロイター] -     米下院の中国に関する特別委員会は１３日、米銀モルガン・スタンレーが紫金黄金国際による香港の新規株式公開（ＩＰＯ）を引き受けたことにより、同行とその米国投資家は規制、財務、風評被害のリスクにさらされていると指摘した。

紫金黄金国際は中国の紫金鉱業傘下で、国外にあるグループの金鉱山を運営している。

同委員会によると、モルガンＳは９月、紫金黄金国際のＩＰＯを支援し、親会社が中国以外の金鉱山資産を売却してそれらを香港証券取引所に上場することで資金調達を後押し。紫金鉱業による米国の禁止事項回避を手助けしたのではないかという疑念が生じているという。

モルガンＳはコメントを控えた。紫金黄金国際と紫金鉱業からは今のところコメントを得られていない。

同委員会のジョン・モーレナール委員長はモルガンＳのテッド・ピック最高経営責任者（ＣＥＯ）に宛てた書簡で「米国の金融機関がウイグルの強制労働に関連する中国企業と関わることは、世界的な強制労働の抑止という米国政府の目標を台無しにするものだ」と述べた。

紫金鉱業は１月、「ウイグル強制労働防止法」のエンティティーリストに追加された。

モーレナール氏は書簡の中で、紫金鉱業と中国政府などとの関係を巡ってＩＰＯでモルガンＳが果たした役割に関する情報を２７日までに提供するよう求めた。",[],[]
中国不動産投資、1─10月は前年比14.7％減（ロイター）,https://news.yahoo.co.jp/articles/c585fba2b8ff6abbb1167a2b8944d02e9ed97421,https://newsatcl-pctr.c.yimg.jp/t/amd-img/default.jpg?exp=10800,2025-11-14T11:19:19+09:00,2025-11-14T11:19:19+09:00,ロイター,reut,ロイター,197,"[北京 １４日 ロイター] -     中国国家統計局が１４日発表した１─１０月の不動産投資は前年同期比１４．７％減少した。１─９月は１３．９％減だった。

不動産販売（床面積ベース）は前年比６．８％減。１─９月は５．５％減だった。

新規着工（床面積ベース）は前年比１９．８％減。１─９月は１８．９％減だった。

不動産デベロッパーが調達した資金は９．７％減少。１─９月はは８．４％減だった。",[],[]
カナダ、インドとの貿易交渉再開へ　関係強化進める＝国際貿易相（ロイター）,https://news.yahoo.co.jp/articles/f660ffaa23a50d3b9e8865d4c62b12fa63d51427,https://newsatcl-pctr.c.yimg.jp/t/amd-img/20251114-00000065-reut-000-1-view.jpg?exp=10800,2025-11-14T11:18:02+09:00,2025-11-14T11:18:02+09:00,ロイター,reut,ロイター,805,"インド訪問中のカナダのシドゥ国際貿易相（写真）は１３日、カナダは「新たなプロセス」の下で貿易交渉再開を切望していると述べた。ニューデリーで撮影(２０２５年　ロイター/Anushree Fadnavis)
Sarita Chaganti Singh　Manoj Kumar

[ニューデリー １３日 ロイター] -     インド訪問中のカナダのシドゥ国際貿易相は１３日、カナダは「新たなプロセス」の下で貿易交渉再開を切望していると述べた。２年にわたって関係が冷え込んでいた両国が協力強化に向けた取り組みを進めていると強調した。

シドゥ氏はインドのゴヤル商工相との会談に言及し、非常に生産的な対話だったとして「われわれ（の会談）は航空宇宙や人工知能（ＡＩ）、重要鉱物、エネルギー、農業といった分野の機会と、そこで力を合わせるためにもっと何ができるかに重点が置かれた」と説明。

カナダとインドは、インド北部パンジャブ州独立運動に従事していたシーク教徒がカナダ国内で殺害された事件を巡り関係が悪化し、２０２３年にカナダが貿易交渉を停止していた。

ただ今、年６月の主要７カ国（Ｇ７）首脳会議でカナダのカーニー首相とインドのモディ首相が会談した後、雪解けムードが広がり始めた。

こうした中でシドゥ氏は、トランプ米大統領の関税措置がカナダ、インド両国に与える影響を含めた国際経済情勢の変化を背景に、両国が貿易交渉再開のための「初期段階の協議」を進めていると明かした。

シドゥ氏は、カーニー氏がエネルギーや重要鉱物における投資を呼び込むためにインドとの協力強化に積極的になっていると指摘。カナダは重要鉱物採掘やインフラ事業に対するインドからの投資を歓迎すると訴えた。

インドとカナダの昨年の貿易額は約３１０億ドル。また、インドはカナダで最大の移民出身国となっており、カナダのインド系住民は１８０万人を超えている。",[],[]
中国新築住宅価格、10月は－0.5％　1年ぶり大幅下落（ロイター）,https://news.yahoo.co.jp/articles/42a6d0143e9928c7c34338fc17ca492a160bfe9b,https://newsatcl-pctr.c.yimg.jp/t/amd-img/20251114-00000064-reut-000-3-view.jpg?exp=10800,2025-11-14T11:02:48+09:00,2025-11-14T13:46:26+09:00,ロイター,reut,ロイター,760,"２０２４年９月、上海で撮影（２０２５年　ロイター/ティンシュ・ワン）
Liangping Gao

[北京 １４日 ロイター] - 中国の１０月の新築住宅価格は前月比０．５％下落し、昨年１０月以来１年ぶりの大幅な落ち込みとなった。国家統計局が１４日発表したデータを基にロイターが算出した。危機に見舞われた不動産セクターの需要が依然として低迷していることが浮き彫りになり、さらなる政策支援の必要性が示された。

９月は０．４％下落していた。

１０月は前年比では２．２％下落。下落率は前月と同じだった。

９月と１０月は伝統的に住宅販売のピークだが、価格の下落継続は住宅セクターの足場を固めようとしている政府にとって課題が改めて浮き彫りになった形だ。

不動産仲介を手掛ける中原地産（センタライン）のアナリスト、張大偉氏は、第３級都市の人口減少、中古住宅市場における大量の物件供給、買い手心理の持続的な弱さなど、市場は複数の課題に直面していると述べ、センチメントを安定させるために住宅ローン政策のさらなる緩和を訴えた。

当局は今年上半期に一部購入者の住宅ローンコストを引き下げた後は主に市場を安定化させる方針を繰り返した。

中国指数研究院が２６０都市を対象にした調査では、特に中小都市で住宅購入に対する信頼感が前月比２．９％低下した。

公式データでは特に中古住宅市場が依然として低迷しており、調査対象となった７０都市で前年同月比、前月比ともに価格が下落している。

エコノミスト・インテリジェンス・ユニットのシニアエコノミスト、シュー・ティエンチェン氏は「中古住宅価格の前月比下落は危機的な水準に近づいている」と指摘。「この下落が続けば、２０２４年の迅速な政策対応に続き、政府介入の可能性が非常に高くなる」と語った。",[],[]
マスク氏企業による訴訟、アップルとオープンＡＩの却下要請認められず（ロイター）,https://news.yahoo.co.jp/articles/1827a0a3268f5b614965146a647aa00e04491398,https://newsatcl-pctr.c.yimg.jp/t/amd-img/20251114-00000063-reut-000-2-view.jpg?exp=10800,2025-11-14T11:00:27+09:00,2025-11-14T11:04:34+09:00,ロイター,reut,ロイター,476,"２０１６年３月、ベルギーのブリュッセルで撮影（２０２５年　ロイター/Yves Herman）
Mike Scarcella

[１３日 ロイター] - 米連邦地方裁判所は１３日、実業家イーロン・マスク氏のソーシャルメディア企業Ｘと人工知能（ＡＩ）新興企業ｘＡＩが起こした訴訟の却下を求めたアップルと生成ＡＩ「チャットＧＰＴ」開発会社オープンＡＩの要請を退けた。

ＸとｘＡＩは８月、アップルとオープンＡＩがスマートフォンと生成ＡＩチャットボットの市場を独占するため共謀しているとして、テキサス州の連邦地裁に提訴した。

マスク氏の企業は当面、訴訟を進めることが可能となるが、同州のマーク・ピットマン地裁判事は今回の決定について、原告側の主張の是非を判断するものと見なすべきではないとし、事実関係を巡る争点については訴訟で今後検討するとした。

オープンＡＩは１３日の声明で、今回の訴訟について「マスク氏の継続的な嫌がらせのパターンと一致しており、法廷でこれを証明することを楽しみにしている」と述べた。

アップルとＸはコメント要請にすぐに応じなかった。",[],[]
