headline,mainEntityOfPage,image,datePublished,dateModified,author,media_en,media_jp,str_count,body,images,external_links
黄ばみ問題とサヨナラ！ 数十回着ても“新品のような白さ”が続くタンジェネットの「チャンプTシャツ」（fashion tech news）,https://news.yahoo.co.jp/articles/26da2a573d28344b2ee92409157402d63b134c8b,https://newsatcl-pctr.c.yimg.jp/t/amd-img/20250711-00010001-fashiontn-000-1-view.jpg?exp=10800,2025-07-11T16:10:03+09:00,2025-07-11T16:10:03+09:00,fashion tech news,fashiontn,FASHION TECH NEWS,3297,"画像提供：タンジェネット
気に入った白の無地Tシャツを着続けていたら、色が変わってしまった。そんな経験を持つ人は少なくないだろう。

やはりTシャツは消耗品なのだろうか？ 「tangenet（タンジェネット）」に限っていえば、答えは「ノー」だ。

同ブランドが作り上げた「チャンプ Tシャツ（CHAMP T-SHIRTS）」には、特殊な生地と加工によって、汚れが落ちやすく、かつ黄ばみにくいという特性が付与されている。

新品のような白が持続する魔法のようなTシャツは、どのようにして生まれたのか。生みの親である同ブランドデザイナーが誕生秘話を語る。
ブランドコンセプトは、洋と和の融合
画像提供：タンジェネット
タンジェネットは2021年にデザイナーの吉屋 充さんが設立したブランドだ。

「ブランド名の由来は『tangent（接点）』、『gene（遺伝子）』、『network（繋がり）』を組み合わせた造語から。人と人とが接点を持ち、繋がることで実現するモノづくりを通して、日本素材の技術や遺伝子を届けることを理念としています」

ブランドを立ち上げる前、吉屋さんは大手アパレル会社に勤務し、メンズブランドのデザイナーとして活動していた。

「在職中は、毎シーズン日本全国の生地の産地を巡って、いろいろなものづくりに携わりました。そうした経験を通じて、日本産のテキスタイルのクオリティは世界でもトップクラスであることを確信しました。洋服を通して、和のものづくりの力を知ってもらうことがブランドのミッションのひとつです」
型崩れしにくい高密度のジャージー素材
ブランド設立年に発売された「チャンプ Tシャツ」は、tangenetの存在を世に知らしめた看板商品だ。そもそもなぜ、白の無地Tシャツに注目したのだろうか？
「チャンプ Tシャツ」 13,200円（税込）
「昔から、白い無地Tシャツというプロダクトが無性に好きなんです。永遠の定番であり、老若男女誰が着ても格好よく見えますから。

ただ、どんなに気に入っているものでも、1、2シーズン経つと黄ばみや汚れが気になって、結局捨てることになる。

数ある洋服の中で、もっとも廃棄サイクルが短いであろう白い無地Tシャツを長く着用できるようにしたい。そんな思いから生まれたアイテムです」

「チャンプ Tシャツ」は、まさに日本の技術力の結晶だ。
広撚は、生地の企画・製造・販売を行うテキスタイルメーカーだ
「ボディには広撚（ひろねん）株式会社という福井県のテキスタイルメーカーに作ってもらった生地を使っています。
画像提供：タンジェネット
一般的なTシャツには天竺編みというシングル編みの生地が使われますが、このTシャツにはモックロディというダブル編みのジャージーを使っています。

ハイゲージのダブル編みを得意とする同社が手がける高密度のジャージーは、丈夫で型崩れがしにくく、ジャケットやパンツにも使われるものです」
丈夫な理由は特殊なポリエステル糸にもあるという。

「生地の強度と収縮安定性を高めるために、コットンにポリエステルをブレンドしています。

『T400』という東レの伸縮性に優れたポリエステル糸を使っており、この糸が仕上げ時の熱セット（熱風や蒸気を加える工程）によってギュッと凝縮するんです。すると、形態安定性が高まって、洗濯によるねじれやヨレが発生しにくくなります」
「はじく」と「吸う」という相反する加工技術を融合
画像提供：タンジェネット
では、核心ともいうべき「持続する白」はどのようにして実現したのか？

吉屋さんは愛知県に本社がある東海染工株式会社に協力を依頼した。

「東海染工さんは、染色技術加工において国内有数の技術力を持つ会社です。同社の技術者の方々と試行錯誤しながら、約1年半かけて特殊な加工を施した生地を開発しました」

白が持続する秘密は、画期的なハイブリッド加工にあるという。

「撥水加工と吸水加工という、相反する2種類の加工を組み合わせているんです。撥水加工は水だけでなく、皮脂や食べ物の汚れが繊維の中にしみ込むのを防ぐことができます」

開発段階では、吉屋さん自身が醬油やラー油、ソースなどを垂らして洗濯するという実験を繰り返しながら、加工の精度を高めていったという。
一方、黄ばみには吸水加工がものをいう。

「汗や皮脂が生地の奥までしみ込むと、洗濯しても落ちにくくなり、時間が経つと黄ばみの原因になります。でも、この生地は撥水加工で汗や皮脂が繊維の中に入り込むのを防ぐとともに、吸水加工でしっかり水を吸収することで、洗濯時に水と一緒にきれいに落ちるようになっています」

黄ばみにくさにはエビデンスもある。

「生地物性を調べる第三者機関で、黄変の度合いなどを検査しました。

生地に光を照射して強制的に黄ばませるイエローイング法という試験では、ハイテク素材が使われたスポーツウエアと同等の黄ばみにくさがあると判定されています」

ハイブリッド加工は着心地の面にもメリットをもたらす。

「撥水加工だけだと、汗まではじいてしまい、生地が汗を吸い取らなくなります。すると、汗が肌に残ってベタついたり、蒸れて不快になってしまうんです。

その点、この生地は汗を吸う吸水加工もしてあるので、さらっとした着心地が続きます」
着物をヒントにした水平肩線設計
画像提供：タンジェネット
チャンプ Tシャツは、あくまで“ファッションアイテム”である。

「デザインに関しては、シルエットからディテールまで、私の理想をかたちにしました」

着想を得たのは、1950年代に生産されたチャンピオンのTシャツだという。

「この時代のチャンピオンのTシャツは、総じて腕ぐりが大きく、肩のラインが水平で、傾斜がないのが特徴です。

腕の運動量を高めるための工夫ですが、こうした設計は私の好きな着物に通じるところがあり、シンパシーを感じました」
画像提供：タンジェネット
着物のエッセンスは随所にちりばめられている。

「着物のような羽織る感覚を大切にしたかったので、アーム幅、身幅ともにワイドにし、加えて肩線や袖、身頃も着物にならって直線に設計しました」
肩線を水平にすると、肩の生地の分量が増える。着用時にはその生地が身頃に落ちてくることで、着物のような独特のドレープが生み出される。そのため、白の無地Tシャツとは思えないくらい、独特の存在感を放つのだ。
画像提供：タンジェネット
「一枚で着ても絵になるTシャツを目指しました。個人的には裾をパンツにタックインして、少しブラウジングさせる着こなしが好きですね」
発売以来、着実に売れ行きは伸び、年によっては夏前に完売してしまうことも。

ファッション業界での評価も高く、多くのスタイリストやバイヤー、エディターたちに愛用されている。
今季発売された派生モデルの「ジョッキー ポケットTシャツ」 13,200円（税込）
「生地づくりは福井県で、縫製は徳島県、加工は岐阜県で行っています。加えて生地自体も希少なため、大量生産はできないのですが、これまで1,000枚以上ご購入いただきました。リピート率も高く、自社のオンラインショップでは、5回もオーダーしていただいたお客様もいらっしゃいます」
「チャンプ Tシャツ」は長く着用できるのもうれしい。

「着用と洗濯を繰り返す実験を約2ヶ月にわたって70回行いましたが、目立った変化は見られませんでした。

週1回の着用なら、単純に70週以上はもつ計算になります。もし、1年のうち約5ヶ月間、週1回着用すると、約20週間となるので、3年強はもつはずです。着用シーンや汗の量など条件は異なるので、あくまでも参考数値にはなりますが、実際に試して実感いただければと思います」

目先のトレンドに流されることなく、気に入った服を大切に着続けたい。「チャンプ Tシャツ」は、そんなスタイルを持つ大人の理想を叶えるTシャツなのだ。",[],[]
純国産の琉球パナマ帽「Ryukyu Panama by MAISON Birth」で伝統を復活させ、新しい価値をつくりだす（fashion tech news）,https://news.yahoo.co.jp/articles/5e54e6f62ae7e31f4fd19ffdadca428b3133a6a4,https://newsatcl-pctr.c.yimg.jp/t/amd-img/20250711-00010000-fashiontn-000-1-view.jpg?exp=10800,2025-07-11T08:10:02+09:00,2025-07-11T08:10:02+09:00,fashion tech news,fashiontn,FASHION TECH NEWS,3553,"画像提供：株式会社PERIODOS
“受け継がれる帽子”をコンセプトにハイクオリティな日本製の帽子づくりで知られる「MAISON Birth（メゾン バース）」。良質な製品を手がけるなか、ブランドとして長い年月をかけて取り組んでいるのが「琉球パナマ帽」だ。今回はこの、「Ryukyu Panama by MAISON Birth（琉球パナマ バイ メゾン バース）」に注目したい。

MAISON Birthデザイナーにして、株式会社PERIODOS代表の清原 世太さんにお話を伺っていこう。
ブランドコンセプトは受け継がれる帽子
MAISON Birthのロゴ
琉球パナマ帽のお話の前に、MAISON Birthというブランドについて伺っておこう。同ブランドは、有名百貨店や「銀座トラヤ帽子店」などの老舗帽子店でも取り扱われており、国内帽子ブランドとしてすでに広く知られた存在だ。ここで、あらためてその概要を確認しておこう。
MAISON Birthヴィジュアル
「2010年に始動し、2011年の春夏からブランドを本格的にスタートしました。“受け継がれる帽子”というブランドコンセプトがあり、素材選び、縫製方法、パターンなどをさまざまに組み合わせることで、洗えたり、型崩れしにくかったりと、長く使える帽子を作っています。

コンセプトの中には、“シェアし合って使う”という考え方も含まれているため、メンズ・レディースといったカテゴリーを設けず、ユニセックスで展開しています」
きっかけは沖縄に古くから自生するアダン葉
清原氏が琉球パナマ帽に着想を得て「Ryukyu Panama by MAISON Birth」をはじめるきっかけとなる出来事について、お話を伺っていこう。
「ボウシクマー」と呼ばれる帽子を編む職人
「2010年ごろのことだったと思いますが、MAISON Birthをはじめる前も帽子に関わる仕事をしており、帽子に関する古い文献を読んでいたとき、“アダン葉”という素材が目に留まりました。気になって調べてみたところ、それが沖縄に自生している植物だと分かり、興味が湧いて『これを製品として使ってみたい』と思いました。
戦前、琉球パナマ帽が大きな産業だったことが分かる写真
そこで沖縄の知り合いなどに聞いてみたのですが、詳しい人がいなかったので、自ら沖縄へ行き、資料館や琉球大学などを訪れて調べ歩いたんです。そこで分かったのは、アダンという植物の葉で編んだ“琉球パナマ帽”という帽子が存在していたこと。
そして、この琉球パナマ帽の産業は1904年にはじまり、サトウキビや泡盛に次ぐ、沖縄で3番目を誇る規模だったこと。また、高級品として海外へも輸出されていたそうですが、第2次世界大戦などの歴史的背景から、やがて衰退してしまったということでした」
消えた伝統を探し続ける日々
伝統が途切れてしまっていることが分かり、それでも時間を見つけては年に何度か沖縄に足を運び、琉球パナマ帽のことを少しずつ調べ続けたという。清原氏がアダン葉を製品として使いたいと思ったときから、数年が経っていた。
画像提供：株式会社PERIODOS
「調べを進めていくなかで、かつて琉球パナマ帽の生産が盛んだった地域がいくつか分かってきました。そこで、その地域を中心に訪ねさまざまな人に声をかけていったところ、『昔、編み方を教わったことがある』という方にたどり着くことができ、実際に会いに行ったんです。
アダン葉で実際に帽子を編んでいる様子
そもそも、琉球パナマ帽がどのようなものかも見たことがなかったので、実際に編んでもらったり、資料を見せてもらったりして、また一歩、前に進むことができました」
100年以上前の伝統的な技術を現代に復活
資料が見つかり、編める人にも出会い、あとはアダン葉がどのような特性を持つ素材なのかが分かれば、製品化までたどり着ける、そんな段階まで来ていた。清原氏が琉球パナマ帽の調査をはじめてから、すでに2〜3年が経過していたが、製品として安定したクオリティに達するまでには、そこからさらに6〜7年の歳月を要した。

そしてついに、第2次世界大戦後に姿を消していた琉球パナマ帽は、2019年、「Ryukyu Panama by MAISON Birth」として再び世の中に送り出された。
現在自生しているアダン
「アダン葉は、沖縄の都市化が進んだこともあって、昔ほど多くは生えていません。それでも、沖縄本島の北部や南部、そして近隣の島々では今も採取することができます。アダンの葉は、収穫した後に茹でて、乾燥させ、鞣（なめ）して、裂くという工程を経て素材として仕上げていきます。中には、“茹でる工程でシークワーサーを加える”と書かれた資料もありました。

その後、帽子の形を作る前段階である『帽体（ぼうたい）』を製作し、それを木型に入れて成型していくのですが、その際、どのくらいの加減で行うのが適切かは、トライアンドエラーを重ねながら、アダン葉の特性を見極めていくしかありませんでした。
Ryukyu Panama by MAISON Birthのロゴ
沖縄では、帽子を編む職人のことを『ボウシクマー』と呼ぶのですが、その技術を他の人たちにも伝え、製品として通用するレベルにまで引き上げていく必要がありました。これは時間を要する取り組みであり、ボウシクマーの方々にも、原材料の収穫から協力してもらい、一緒に進めています。

こうして「Ryukyu Panama by MAISON Birth」として形にすることができ、琉球パナマ帽を復活させることができました。私がアダン葉に興味を持ったのは、MAISON Birthをはじめる前のことだったので、実現までに10年ほどかかったことになります」
Ryukyu Panama by MAISON Birthのアイテム
ここからは、実際にRyukyu Panama by MAISON Birthのアイテムを見せていただこう。
琉球パナマ帽のさまざまな編み方
編み方の種類は実に多様で、
画像提供：株式会社PERIODOS
「琉球編み」と呼ばれる昔ながらのスタンダードな編み方をはじめ、
Ryukyu Panama by MAISON Birthでもっともスタンダードなモデル　88,000円（税込）
さまざまな技法を組み合わせて柄を形成し、個性を表現しているという。
画像提供：株式会社PERIODOS
アイテムは基本的にオーダー制で、ボウシクマーが一つひとつ手作業で丁寧に編み上げていく。
Ryukyu Panama by MAISON Birth　花透かし　220,000円（税込） この製品は一般財団法人伝統的工芸品産業振興協会が主催する、2024年全国伝統的工芸品公募展で入選している。
1つの帽子を完成させるまでに、2〜3ヶ月の製作期間を要する。
復活した歴史、伝統、技術を広めるために
清原氏がアダン葉に興味を持ち、琉球パナマ帽の調査をはじめたころ、ボウシクマーはわずか2〜3人ほどしかいなかったという。「編める人を増やしたい」と話し、技術の伝承を依頼したことで、現在では編める人の数はかなり増えたという。しかしそのなかでも、ボウシクマーと呼べるだけの技術を持つ職人は、まだ一握りにとどまっている。

Ryukyu Panama by MAISON Birthには、“親から子へ、子から孫へと受け継がれる帽子”というテーマがある。アダン葉の耐久性は、他の天然草素材を凌ぐほどで、非常に長い年月使い続けることが可能だ。しかし、その素材の力を引き出すためには、ボウシクマーによる確かな技術が欠かせない。そうした背景から、さらなる技術向上を目指して、清原氏はこの6月、「琉球パナマスクール」を開校する。
琉球パナマスクールの案内
「歴史や伝統、技術を絶やしてはいけないという思いから、ひとりでも多くのボウシクマーを育成したいと考え、このスクールをはじめることにしました。琉球パナマスクールで技術を広め、琉球パナマ帽の需要を増やし、ひいては産業全体の規模を大きくしていくことが必要だと感じています」
清原氏の長年にわたる取り組みが、Ryukyu Panama by MAISON Birthというブランドを生み出し、さらに琉球パナマ帽への強い思いが、ブランドの枠を超えて、失われつつあった産業そのものの復活を目指している。歴史と伝統、技術が詰まった逸品、Ryukyu Panama by MAISON Birthの存在を、ぜひ心に留めておきたい。",[],[]
