headline,mainEntityOfPage,image,datePublished,dateModified,author,media_en,media_jp,str_count,body,images,external_links
取り出したのは重さ３グラム以下でも大きな一歩か　燃料デブリの試験的な取り出し完了（福島中央テレビ）,https://news.yahoo.co.jp/articles/5bf5b07dc16c58c930e99aaad52987ac5061ea87,https://newsatcl-pctr.c.yimg.jp/t/amd-img/20241107-02664221-fct-000-4-thumb.jpg?exp=10800,2024-11-07T19:34:00+09:00,2024-11-07T19:42:22+09:00,福島中央テレビ,fct,福島中央テレビ,1173,\nFCT福島中央テレビ\n福島第一原発で、１１月７日原発事故の後はじめて燃料デブリの取り出しが完了しました。\n東京電力は、９月から福島第一原発２号機に釣りざおのような装置を投入し、デブリの試験的な取り出しに着手しました。\n１０月には数グラムのデブリを採取し東京電力は、７日午前１１時４０分に一連の作業を完了しました。\n２０１１年の原発事故から１３年以上が経過していますが原子炉からデブリを取り出すのは初めてです。\nデブリは今後、茨城県の施設で成分や構造などの分析が進められます。\n今回、取り出したデブリは大きさが５ミリ程度で、重さは３グラム以下とみられています。\n“燃料デブリ”の試験的な取り出し作業７日に完了へ・福島\n13年以上の時間をかけて取り出せた燃料デブリの量はわずか数グラムですが、その成果と教訓について国の担当者を取材しました。\n廃炉の最難関とも言われる「燃料デブリ」の取り出し。\nデブリは福島第一原発の1号機から3号機に約8百80トンあると推定されています。\n今回の取り出しについて原発事故直後から廃炉を担当してきた国の担当者は…\n\n■経済産業省 木野 正登参事官\n「まだまだ先は長いですけども、ようやく最初の1歩が踏み出せたかなという感じ」\n今回、採取できたデブリは耳かき1杯程とわずか数グラムですが廃炉に向けては、大きな一歩に。\n■経済産業省 木野 正登参事官\n「どうやってこのデブリができたかを推定できる」\n\n溶け落ちた核燃料が周囲の構造物と混ざり冷えて固まったデブリ。\n採取したものを分析することでその性質や、どこを経由して溶け落ちたかなどわかるといいます。\nその上で…\n■記者\n「周りの岩みたいなものは？」\n■ 木野 正登参事官\n「これもおそらくはデブリだと思います。言わば溶岩が固まったようなイメージだと思っていただければ」\n\n880トンあるデブリを本格的に取り出すためには今後、工法の検討やさらなるロボットの開発が必要になると木野さんは話します。\n■ 木野 正登参事官\n「どこかに大きな穴を開けたり、原子炉を突き抜けて穴を開けていく。そういった工事方法の検討が大事になります」\nまた、今回の取り出しで見えてきた課題もあります。作業現場は放射線量が高く手順に誤りがあったり、装置のカメラが故障したりするなどのトラブルが相次ぎました。\n\n■木野 正登参事官\n「様々な教訓、勉強をした取り出しだった。東京電力自らも知見を高めていく、しっかり自らが関与していく。これをやっていかないと今後、数十年にわたるデブリの取り出しをうまく進めていくのは難しい」\n\n廃炉を安全に、そして着実に進めていくためにも得られた成果や教訓を今後に生かしていくことが求められます。,[],['https://news.ntv.co.jp/category/society/fccc1822c3745844fc87316941b9c87b7c/image?p=1']
「盗撮目的で後ろから近づいた」と供述　逮捕された福島県職員の25歳の男を送検（福島中央テレビ）,https://news.yahoo.co.jp/articles/6bdd78ecd4678799b72495d65f81a097be05264f,https://newsatcl-pctr.c.yimg.jp/t/amd-img/20241107-03155327-fct-000-2-thumb.jpg?exp=10800,2024-11-07T19:35:01+09:00,2024-11-07T19:48:17+09:00,福島中央テレビ,fct,福島中央テレビ,265,\nFCT福島中央テレビ\n女性のスカートにスマートフォンを差し入れた疑いで逮捕された福島県職員の男は、「盗撮目的で近づいた」と供述していることがわかりました。\n\n福島県の迷惑行為等防止条例違反で逮捕・送検された県の職員（山口土木事務所）服部隆行容疑者（25）は、7月に会津若松市の商業施設で10代女性のスカートにスマホを差し入れた疑いが持たれています。\n\nその後の調べで服部容疑者は「盗撮目的で後ろから近づいた」と供述しているということです。\n\n警察は押収したスマホなど電子機器の解析を進め余罪がないか調べています。,[],[]
葛尾村の山林で倒れて来た木の下敷きになり64歳の男性会社員が死亡・福島県（福島中央テレビ）,https://news.yahoo.co.jp/articles/148b63d27d69129ea20a4eb991fa67790d4fc416,https://newsatcl-pctr.c.yimg.jp/t/amd-img/20241107-07926798-fct-000-2-view.jpg?exp=10800,2024-11-07T20:04:00+09:00,2024-11-07T20:15:16+09:00,福島中央テレビ,fct,福島中央テレビ,172,\nFCT福島中央テレビ\n11月7日の朝、葛尾村の山林で伐採作業をしていた男性が、木の下敷きとなり死亡したものです。\n\n死亡労災事故があったのは葛尾村大字葛尾の山林です。\n11月7日の午前9時前、葛尾村の64歳の男性会社員が、木の伐採作業中に伐採して倒れてきた木の下敷きとなり死亡したものです。\n\n警察は労災事故として調べています。,['https://newsatcl-pctr.c.yimg.jp/t/amd-img/20241107-07926798-fct-000-2-view.jpg?exp=10800'],['https://news.yahoo.co.jp/articles/148b63d27d69129ea20a4eb991fa67790d4fc416/images/000']
アメリカ投資ファンド　スパリゾートハワイアンズ1回目のTOBが成立・福島県（福島中央テレビ）,https://news.yahoo.co.jp/articles/037d5a9a68c5fe5c5652e88294d223427396f4c6,https://newsatcl-pctr.c.yimg.jp/t/amd-img/20241107-08378747-fct-000-3-thumb.jpg?exp=10800,2024-11-07T19:37:00+09:00,2024-11-07T19:42:25+09:00,福島中央テレビ,fct,福島中央テレビ,351,\nFCT福島中央テレビ\nいわき市のスパリゾートハワイアンズを運営する常磐興産を対象とした1回目のTOB、株式公開買い付けが成立しました。\nアメリカ大統領選挙 為替は円安ドル高で反応する中、福島県内への影響は？\nスパリゾートハワイアンズを運営する常磐興産についてアメリカの投資ファンド・フォートレス・インベストメント・グループは買収を計画しています。\n9月から行われていた1回目のTOBでフォートレスの関連会社は常磐興産の約7割の株を取得することになったとしています。\nフォートレスは11月13日から始まる2回目のTOBで残りの株の取得を進め常磐興産を完全子会社化する方針です。\n\n子会社化した後もブランドの変更は予定しておらず、従業員の雇用条件も同等以上で維持する見通しということです。,[],['https://news.ntv.co.jp/n/fct/category/international/fc9dea3fec9f0349d0ab215c4d474a1f19/image?p=1']
「今後の事はまだ正式に考えてはいません」バドミントン桃田賢斗選手が引退報道を否定（福島中央テレビ）,https://news.yahoo.co.jp/articles/8285d2a3885f0141fd74e1104e910aabfa085cb2,https://newsatcl-pctr.c.yimg.jp/t/amd-img/20241107-02321974-fct-000-1-thumb.jpg?exp=10800,2024-11-07T19:39:00+09:00,2024-11-07T19:39:00+09:00,福島中央テレビ,fct,福島中央テレビ,331,\nFCT福島中央テレビ\nバドミントン男子シングルス元世界王者で、富岡高校出身の桃田賢斗選手が現役引退についての報道を否定しました。\n恩返しを…桃田賢斗選手が富岡町でバドミントンイベント 福島\n4月に日本代表を引退した桃田選手ですが、11月6日に自身のSNSを更新し、現役引退の報道について言及しました。\n\n「一部報道で引退の記事がでていますが、今後の事はまだ正式に考えてはいませんし、決まっていません。自分としては、今までどうり目の前の事を全力で頑張っていきます」とし、現役引退についての報道を否定しました。\n\n続けて「SJリーグ優勝できるように頑張りますので、今後も応援よろしくお願いします」と現在、行われている大会への意気込みを記しています。,[],['https://news.ntv.co.jp/n/fct/category/sports/fce7dd30c4e3ec4eb0aaac446e4845dd8e/image?p=1']
JR福島駅周辺に賑わいを！西口から東口へ駅構内を無料で通過できる社会実験・福島県（福島中央テレビ）,https://news.yahoo.co.jp/articles/82afe8fc84d2d3822012b5dbdf3f222afcaff338,https://newsatcl-pctr.c.yimg.jp/t/amd-img/20241107-02543475-fct-000-2-thumb.jpg?exp=10800,2024-11-07T18:04:00+09:00,2024-11-07T19:45:18+09:00,福島中央テレビ,fct,福島中央テレビ,783,\nFCT福島中央テレビ\n再開発の遅れなどでにぎわいをどう生み出すかが課題のJR福島駅で、新たな社会実験が始まりました。\n\n東口の再開発事業の遅れに…西口ではイトーヨーカドー福島店が閉店。福島市のJR福島駅周辺では、今、駅前のにぎわいをどう生み出すかが課題となっています。\nそうしたなか、福島駅で新たな社会実験が始まりました。こちらは西口にある改札口です。\n普段は、お金を払わないと通ることはできませんが…きょうから1か月間は、無料で通ることができます。\n\nいつもであれば福島駅の西口から東口に移動する場合は地下道を通りますが、11月7日からは専用のウェブサイトで取得した二次元コードをかざすことで駅のなかを通って、西口から東口に移動することができます。\n社会実験は福島市とJR東日本が連携して行っています。\n\n■街の人は（80代）\n「地下だと暗いイメージあるが、上の方が遥かに環境がいいですね」\n社会実験は12月6日までで通行は午前9時から午後9時までできます。\n福島市は「利用者からのアンケートをもとに今後のまちづくりに役立てたい」としています。\n\n一方、イトーヨーカドー福島店の跡地のついて話し合う検討会がきのう開かれ、有識者や近隣住民らが参加しました。\n参加者からは「スピード感が求められる」「ショッピングセンターは必要」などの意見が出されました。\n福島市は検討会での議論を重ね、2024年度内にもまちづくりに関する要望書をまとめ、不動産の所有者に渡したいとしています。\n\n福島駅前について木幡市長は…。\n■木幡浩 福島市長\n「願望はいくらでもできますけど、実現性と言ったらどこまでできるのかというのは制約もありますから、市民の皆さんにも、どこまで本当に市として出来るかとか理解をいただきながらこの話を進めないと…」,[],[]
太陽光発電などを導入しZEB仕様の店舗に　防災関連グッズを手がける福島ミドリ安全（福島中央テレビ）,https://news.yahoo.co.jp/articles/9f2683a1280946e4e085e5545e34e4867d47a4c0,https://newsatcl-pctr.c.yimg.jp/t/amd-img/20241107-06483835-fct-000-2-thumb.jpg?exp=10800,2024-11-07T17:49:00+09:00,2024-11-07T19:48:17+09:00,福島中央テレビ,fct,福島中央テレビ,266,\nFCT福島中央テレビ\n防災関連グッズなどを手がける福島ミドリ安全の支店がリニューアルし、11月6日オープンセレモニーが開かれました。\n\n建物は太陽光発電などを導入することで、エネルギー消費を限りなくゼロに近づけるZEB仕様に改修されています。\n\n■福島ミドリ安全 白石昇央 代表取締役社長\n「3.11の教訓をどう皆さんと連携して地域力と防災力と環境力を高めてそれを日本の安全、そして民間としては産業にするか」\n\nリニューアルされた店舗はZEBの取り組みなどを紹介するショールームとしても活用されるということです。,[],[]
暦通り寒さ増す立冬…お地蔵さんも冬の格好になり、熱々のたい焼きが人気に（福島中央テレビ）,https://news.yahoo.co.jp/articles/38387e332e6687cad1e944d8d59b2c948823c426,https://newsatcl-pctr.c.yimg.jp/t/amd-img/20241107-03612152-fct-000-5-thumb.jpg?exp=10800,2024-11-07T19:32:01+09:00,2024-11-07T19:42:22+09:00,福島中央テレビ,fct,福島中央テレビ,881,\nFCT福島中央テレビ\n11月7日は、立冬。福島県内の高い山にはうっすらと雪が積もりました。\n\n西高東低の冬型の気圧配置で上空には強い寒気が流れ込み、日中の最高気温は福島市で12.1度、郡山市で9.8度と日中は今季一番の冷え込みになりました。\n冬が少しずつ近づく中、福島市の陽林寺では…。\n解熱後もせきが続くのが特徴 マイコプラズマ肺炎感染者が4週連続で増加・福島県\n■王国屹記者\n「福島市は冷たい風が吹いていて、上着を着ていても少し寒く感じます。ただこちらでは紅葉とお寺のコラボレーションが楽しめます」\n\n紅葉は例年より10日ほど遅く先週から色づきはじめ、ここ数日の冷え込みで一気に色が深まったといいます。\nお地蔵さんはニット帽に、マフラーと冬の格好に…\n\n■訪れた人\n「アジサイも良かったけど、紅葉もいい。きれい」\n\n■陽林寺 渡部真之 住職\n「朝晩寒くなってきたけど、風のない天気のいい日に来てもらえれば、静かな山の中の紅葉が見られると思う」\n紅葉は10月いっぱいまで楽しめるということです。\n\n一方、寒い日に食べたくなるのが…\n■子どもたち\n「クリーム！」\n熱々のたい焼きです。定番のあんこのほかに…ウインナーが入ったユニークなものも！\n9月にオープンしたばかりですが、寒くなるに連れて客足が増えているといいます。\n\n■「米とたいと」吉田冬美さん\n「寒いからあったかいたい焼きを食べたいというお客さんが多いですね」\n寒い日に熱々のたい焼き食べたくなりますね。\n寒さで冷えた身体を癒そうと多くのお客さんが訪れていました。\n\nQ寒いと食べたくなる？\n■親子\n「めっちゃ食べたくなっちゃいます。クリーム大好きなので毎回買っています」\n\n■吉田冬美さん\n「出来立てはパリパリ、冷めても美味しいもっちりとした感じで、色々と食べ方も豊富なので楽しんでいただければと思います」\n\n11月8日朝にかけて放射冷却や寒気の影響で冷え込む予想で、通勤通学の時間帯は冬物コートを羽織るのが良さそうです。,[],['https://news.ntv.co.jp/n/fct/category/life/fc4d41fc5ad1464a6fb7ed2264d74e8f51/image?p=1']
会津の伝統工芸品が「べこぷら」に生まれ変わる！注文が殺到する魅力は？・福島県（福島中央テレビ）,https://news.yahoo.co.jp/articles/d50139cc9f67f844b283a4a4a8c256b59199d6dc,https://newsatcl-pctr.c.yimg.jp/t/amd-img/20241107-02264415-fct-000-2-thumb.jpg?exp=10800,2024-11-07T14:16:00+09:00,2024-11-07T19:47:16+09:00,福島中央テレビ,fct,福島中央テレビ,727,\nFCT福島中央テレビ\n福島を代表する伝統工芸品「赤べこ」が新たな形で商品化され、話題を呼んでいます。\n\n取材に向かったのは、磐梯町。\n■平瀬史敦記者\n「道の駅ばんだいでは、福島県で根強い人気を誇る赤べこの色々な商品が販売されていますが、その中でも新たに登場したのが、こちら。赤べこのプラモデルです。」\n\n会津地方の伝統工芸品赤べこがプラモデルに…その名も「べこぷら」です。\n会津の伝統やものづくりの楽しさを多くの人に知ってほしいと会津若松市のプラスチック加工会社が手がけました。\n9月に販売を始めてからというもの観光客などの間で話題になり、福島県外からの注文や問い合わせも殺到しているそうです。\n\n■喜多方市から来たお客さん\n「知人に聞いたんですよ。出かけるついでに寄ってみようと思って、面白そうなので暇なときに作ってみようかなと」\n\n■道の駅ばんだい 冨岡正敬店長\n「多い時で（一日）50個とか、そのくらい売れるので、売れ行きは好調。想像以上ですね。」\n\nパーツは上下2つに分かれていて簡単に作れるため子どもから大人まで幅広い世代が楽しめます。\n組み立てた赤べこは自分の好きなように色付けやデザインをすることもできます。\n完成したのは…唯一無二のオリジナル赤べこです。\n\n■道の駅ばんだい 冨岡正敬店長\n「自分のオリジナルのべこぷらですね、いろんなカラーリングができるというのが魅力かなと思います。小さいお子さんから幅広い年代の方が楽しめるものだと思うので、ぜひ購入して、作っていただきたいと思います。」\n\n「べこぷら」は道の駅ばんだいや福島空港で販売され、今後はオンラインでも販売を予定しています。,[],[]
覚醒剤使用の疑いでいわき市の暴力団幹部の男（54）を再逮捕　2日に傷害容疑で逮捕（福島中央テレビ）,https://news.yahoo.co.jp/articles/f45c766a344da72e9ff15a188cbfba9510fcc170,https://newsatcl-pctr.c.yimg.jp/t/amd-img/20241107-09226832-fct-000-2-view.jpg?exp=10800,2024-11-07T13:17:00+09:00,2024-11-07T13:28:20+09:00,福島中央テレビ,fct,福島中央テレビ,237,\nFCT福島中央テレビ\nいわき市の54歳の暴力団幹部の男が覚醒剤を使用した疑いで再逮捕されました。\n\n覚醒剤取締法違反（使用）の疑いで逮捕されのは、いわき市に住む54歳の吉会系暴力団幹部の男です。\n\n逮捕された男は、福島県内やその周辺で、10月下旬から11月2日までの間に覚醒剤を使用した疑いが持たれています。\n\n男は11月2日に、いわき市の自宅で女性にけがを負わせた疑いで傷害の現行犯で逮捕されていて、捜査の結果、覚醒剤使用の事実が判明し再逮捕されました。,['https://newsatcl-pctr.c.yimg.jp/t/amd-img/20241107-09226832-fct-000-2-view.jpg?exp=10800'],['https://news.yahoo.co.jp/articles/f45c766a344da72e9ff15a188cbfba9510fcc170/images/000']
福島市の倉庫からチェーンソー1台を盗んだ疑いで警備員の男を逮捕・福島県（福島中央テレビ）,https://news.yahoo.co.jp/articles/a54570e1fe670efb00daebe09265571e6c862fec,https://newsatcl-pctr.c.yimg.jp/t/amd-img/20241107-02188998-fct-000-2-view.jpg?exp=10800,2024-11-07T11:40:00+09:00,2024-11-07T12:09:15+09:00,福島中央テレビ,fct,福島中央テレビ,240,\nFCT福島中央テレビ\n警備員の男が福島市の倉庫からチェーンソーを盗んだ疑いで逮捕されました。\n\n窃盗の容疑で逮捕されたのは福島市の59歳の警備員の男です。\n逮捕された男は、5月26日午前5時40分頃、福島市内の会社の倉庫から約15万円相当のチェーンソー1台を盗んだ疑いがもたれています。\n\n被害者からの届出を受けて捜査を行った結果、男の犯行が明らかとなり逮捕されました。\n盗みに入った倉庫は、警備員の仕事とは関係のない場所で、男は容疑を認めているということです。,['https://newsatcl-pctr.c.yimg.jp/t/amd-img/20241107-02188998-fct-000-2-view.jpg?exp=10800'],['https://news.yahoo.co.jp/articles/a54570e1fe670efb00daebe09265571e6c862fec/images/000']
“燃料デブリ”の試験的な取り出し作業７日に完了へ・福島（福島中央テレビ）,https://news.yahoo.co.jp/articles/5900c770bd3c9d9df46a3832f7e444492fc0d785,https://newsatcl-pctr.c.yimg.jp/t/amd-img/20241107-03734993-fct-000-1-thumb.jpg?exp=10800,2024-11-07T11:59:00+09:00,2024-11-07T11:59:00+09:00,福島中央テレビ,fct,福島中央テレビ,364,\nFCT福島中央テレビ\n福島第一原発で進む燃料デブリを試験的に取り出す作業は、11月7日にも一連の作業が完了します。\n【燃料デブリ情報】放射線量は毎時０．２ミリシーベルトと判明 福島第一原発２号機\n東京電力は、2024年9月から第一原発2号機に釣りざおのような装置を投入し、燃料デブリの取り出しに着手しました。\n\n10月には数グラムの燃料デブリを採取し、東京電力は7日にも一連の取り出し作業を完了させます。\n\n2011年の原発事故から13年以上が経過していますが、原子炉から燃料デブリを取り出すのは初めてです。\n\n燃料デブリは運搬用の箱に入れられ、茨城県の施設で成分や構造などの分析が進められます。\n\n燃料デブリの取り出しは当初の計画から数度延期され、作業の着手後もカメラが故障するトラブルがありました。,[],['https://news.ntv.co.jp/category/society/fc23f2bc32157b4eb4a961e3f2a757683c/image?p=1']
【速報】原発事故後初　福島第一原発で燃料デブリの試験的取り出しが完了・福島県（福島中央テレビ）,https://news.yahoo.co.jp/articles/6875b99b6dbf26333c30ae032ece915360e050da,https://newsatcl-pctr.c.yimg.jp/t/amd-img/20241107-08526673-fct-000-2-view.jpg?exp=10800,2024-11-07T12:22:00+09:00,2024-11-07T12:29:15+09:00,福島中央テレビ,fct,福島中央テレビ,461,\n福島中央テレビ\n福島第一原発で事故後、初となる燃料デブリの取り出しが完了しました。\n\n東京電力は、9月から第一原発2号機に釣りざおのような装置を投入し、燃料デブリの取り出しに着手しました。\n10月には数グラムの燃料デブリを採取し、東京電力は、11月7日午前11時40分に一連の取り出し作業が完了したと発表しました。\n2011年の原発事故から13年以上が経過していますが原子炉から燃料デブリを取り出すのは初めてです。\n今後、茨城県の施設に移し成分や構造など分析を進めます。\n\n燃料デブリの取り出しについて東京電力は当初、2021年までに始める計画でしたが、装置の開発の遅れなどで数度、延期されてきました。\nまた、今回の取り出しでも作業手順に誤りがあったり装置のカメラが故障するなどトラブルもありました。\n\n今回、取り出した燃料デブリは「数グラム」ですが、第一原発には1号機から3号機に約880トンの燃料デブリがあると推定されていて、今後どのように本格的な取り出しを進めていくかが課題となっています。,['https://newsatcl-pctr.c.yimg.jp/t/amd-img/20241107-08526673-fct-000-2-view.jpg?exp=10800'],['https://news.yahoo.co.jp/articles/6875b99b6dbf26333c30ae032ece915360e050da/images/000']
吾妻連峰などで雪…冬型の気圧配置の立冬で福島県も日中今季一番の寒さか（福島中央テレビ）,https://news.yahoo.co.jp/articles/1f00cc9e7a41475dc6d5e73d9bb38682d04c6c57,https://newsatcl-pctr.c.yimg.jp/t/amd-img/20241107-05368875-fct-000-3-view.jpg?exp=10800,2024-11-07T11:14:00+09:00,2024-11-07T11:49:23+09:00,福島中央テレビ,fct,福島中央テレビ,238,\nFCT福島中央テレビ\n立冬の11月7日は西高東低の冬型の気圧配置となり、上空には強い寒気が流れ込んでいます。\n\n会津の山沿いを中心に雨や雪が降っている所があり、吾妻連峰や、安達太良山、磐梯山など福島県の高い山はうっすらと雪が積もりました。\n冷たい北西の風が強まりますので、洗濯物を外に干す際は注意が必要です。\n\n最高気温は郡山9度、会津若松10度、福島11度、いわき14度と予想され、今季一番の寒さになり、冷たい風も加わってまさに冬を感じる一日となりそうです。,['https://newsatcl-pctr.c.yimg.jp/t/amd-img/20241107-05368875-fct-000-3-view.jpg?exp=10800'],['https://news.yahoo.co.jp/articles/1f00cc9e7a41475dc6d5e73d9bb38682d04c6c57/images/000']
