headline,mainEntityOfPage,image,datePublished,dateModified,author,media_en,media_jp,str_count,body,images,external_links
黒麹を使った泡盛　その歴史をたどる　「伝統的酒造り」ユネスコ無形文化遺産登録へ（沖縄テレビOTV）,https://news.yahoo.co.jp/articles/902e6df093ca00e71226a1067661e49d9095feac,https://newsatcl-pctr.c.yimg.jp/t/amd-img/20241204-90012216-otv-000-1-thumb.jpg?exp=10800,2024-12-04T18:56:01+09:00,2024-12-04T18:56:01+09:00,沖縄テレビOTV,otv,沖縄テレビOTV,2142,沖縄テレビ 日本酒や焼酎、そして沖縄の泡盛といった「伝統的酒造り」が日本時間の5日、ユネスコの無形文化遺産に正式決定される見通しです。ＯＴＶでは4日から３日間、沖縄が誇る泡盛文化を特集します。初日は高温多湿の沖縄で先人たちが築き上げた黒麹による酒造りの手法や泡盛文化の継承に情熱を注いだ酒造所を取材しました。 祭りや伝統芸能などの保護を目的とするユネスコの無形文化遺産。県内ではこれまでに「組踊」や「宮古島のパーントゥ」が登録されていて、伝統的酒造りが正式決定されれば国内で２３件目となります。 伝統的酒造りはカビの一種である麹菌を用いて日本酒や焼酎、泡盛などを造る技術で、米や麦を蒸す、こうじを作る、発酵させるといった過程が特徴です。杜氏や蔵人などが日本各地の気候風土に合わせて、経験に基づき築き上げてきました。 読谷村長浜に本社を構える比嘉酒造です。１９４８年、アメリカ民政府から酒造免許を取得し、第１号となる泡盛「まるたか」を世に送り出しました。 女性や泡盛が苦手な人にも美味しく飲める泡盛を造りたいという思いから試行錯誤を重ね現在の主力商品である「残波」が誕生しました。 今回特別に許可を得て、世界に認められた泡盛造りの工程を撮影させてもらいました。 泡盛の特徴の一つが原料となるタイ米です。ジャポニカ米と比べ、固くサラサラしていることから、麹が育ちやすく、泡盛の香りや味わいを引き出すのに適しています。 洗った米を蒸した後、泡盛造りには欠かせない「黒麹」の種麹を米にまんべんなくまぶし、米麹を造っていきます。温度管理をしながら、回転ドラムや円盤製麹機で４０時間をかけて黒麹を育てます。 この段階で泡盛の発酵に必要な米のでんぷんが糖に変わり、泡盛の味や香りに関わる酵素が造られていきます。 永田裕介記者「出来上がった米麹は水と酵母が入ったこちらの発酵タンクに移されます、表面にブクブクと泡が立っていて発酵しているのがわかります。」 発酵タンクでは、アルコール発酵によりもろみが造られ、毎日攪拌作業を行いながら２週間程度、熟成させます。 比嘉酒造 宮里雄大さん「黒麹菌は他の麹菌よりもクエン酸がとても豊富ということで、高温多湿な沖縄でも雑菌の繁殖をすごく抑えてくれる効果があるので、沖縄の泡盛作りにとってはとても欠かせない良い麹だなと思っています。」 熟成したもろみを蒸留して誕生した風味豊かな泡盛は、その後、甕や貯蔵タンクでさらに熟成し、年月を重ねるほどに味わいはより芳醇なものとなっていきます。 比嘉酒造 泡盛シニアマイスター中村真紀さん「沖縄の方々や日本、世界の方々に泡盛の魅力を伝えて、本当に価値ある泡盛というのをこれを機に人類共通の宝にしていただいたので、それを世界に広めていきたいなというふうに思っています。」 ６００年以上の歴史を誇る泡盛。琉球王国時代、泡盛造りを許されていたのは「首里三箇」と呼ばれる崎山・赤田・鳥堀の３町に限られていました。 首里城のお膝元で王府が管轄しやすかったことに加えこの地域では泡盛造りに欠かせない水が豊富に湧き出ていました。 瑞泉酒造 佐久本武取締役「発祥の地で今も酒を造れるというのは大変誇りですよね。」 首里三箇の一つ、崎山町に蔵を構える瑞泉酒造です。首里城・瑞泉門の側にある湧き水の名にあやかり１３７年前の１８８７年に創業しました。 泡盛の無形文化遺産への登録について、佐久本武取締役は長い歴史の中で培ってきた高い技術が世に認められることを誇らしく感じています。 佐久本武取締役「黒麹菌の活用が高く評価されたのではないかと。蒸留して貯蔵して飲む酒の文化は、西のスコッチか東の泡盛かと言われているくらいですから、大変特異なものがある。」 ７９年前の沖縄戦では多くの酒造所が破壊され、泡盛造りの要・黒麹菌もそのほとんどが消滅したと見られていました。しかし、戦後５０年以上経った１９９８年、戦前に瑞泉酒造と咲元酒造から採取されていた黒麹菌２株が東京大学に保存されていることが判明。 佐久本取締役も職人の一人として伝統の泡盛を復活させることに尽力し、翌１９９９年に戦前の黒麹菌による蒸留に成功しました。戦火をまぬがれた黒麹と現代の技術が掛け合わされ、幻の泡盛が誕生した瞬間でした。 佐久本武取締役「いろんな酒の種類が増えてきている。いい意味では切磋琢磨、狭い沖縄で牌を奪い合うのではなくて、県外・海外の比重が増えれば。少しキザですけど、『泡盛美味くして沖縄栄える』ような図式になればいいと思います。」 泡盛づくりの意思を受け継ぐ６代目の佐久本学社長。長い歳月をかけて味をつないでいける泡盛の魅力は世界にも受け入れられると確信しています。 佐久本学社長「泡盛には丸々寝かしながらというよりも、仕次ぎしながら、特に戦前は１００年古酒や２００年古酒があったと言われています。引き継いでいけるというのが一番の魅力ですので、そういうことが知ってもらえると泡盛が世界的にも続いていくのではないかなと思っています。」 琉球王国時代に生まれた泡盛造りの高い技術と深い味わい。戦火をくぐり抜け沖縄に根付いてきた伝統の泡盛の名が世界に轟きます。 沖縄テレビ,[],[]
「闇バイトに応募した」詐欺未遂で送検　県内のきょうの詐欺被害（沖縄テレビOTV）,https://news.yahoo.co.jp/articles/062430f74fa5b6b97ba8473b273fe2db1716c26c,https://newsatcl-pctr.c.yimg.jp/t/amd-img/20241204-90012215-otv-000-1-thumb.jpg?exp=10800,2024-12-04T18:41:01+09:00,2024-12-04T18:41:01+09:00,沖縄テレビOTV,otv,沖縄テレビOTV,467,沖縄テレビ 「県内のきょうの詐欺被害」です。警察の捜査を装う手口で１０００万円をだまし取られました。 3日那覇市で４０代の男性に警察官を騙る人物から「１億数千万円分が資金洗浄されていて兵庫県で事件になっている」と電話がありました。 その上で事実確認のため現金を振り込むよう指示があり、男性は指定された口座に１０００万円を振り込みましたが、不審に思い警察に通報したことで事件が発覚しました。 警察が電話などで金銭を要求することは絶対にないとして、那覇署は必ず詐欺を疑うよう呼びかけています。 ところで、4日詐欺未遂の疑いで送検されたのは浦添市宮城の無職棚原力斗容疑者（２４）です。 2日金融機関の職員を装って北谷町の８０代の女性宅にキャッシュカードを回収しに現れたところを現行犯逮捕されました。 調べに対し「インターネットで闇バイトの募集に応じて実行役になった」と供述しています。 警察は内容を明かさずに高額報酬をうたうもの、匿名性の高い通信アプリに誘導するものは闇バイトの手口であり、絶対に加担しないよう呼びかけています。 沖縄テレビ,[],[]
歳末助け合い運動　学生たちがクリスマスケーキ作る（沖縄テレビOTV）,https://news.yahoo.co.jp/articles/29ea12f2ab7dde8fc7f297586b706b8975c368d7,https://newsatcl-pctr.c.yimg.jp/t/amd-img/20241204-90012214-otv-000-1-thumb.jpg?exp=10800,2024-12-04T18:41:01+09:00,2024-12-04T18:41:01+09:00,沖縄テレビOTV,otv,沖縄テレビOTV,339,沖縄テレビ 子どもたちが笑顔で過ごせるよう今年もクリスマスを前に洋菓子作りを学ぶ学生たちが福祉施設に贈るケーキを製作しました。 大城良太キャスター「パティシエの卵たちはきょうはサンタとなって子ども達へのプレゼントを作っています。」 歳末助け合い運動の一環でクリスマスケーキを作ったのは専門学校大育の学生２０人です。プロの指導を受けながら学生たちは１００個のチョコレートケーキを仕上げました。 城間美姫さん「家族や友達とかみんなで囲んで楽しく食べてほしいという気持ちを込めて作りました。」 大城諒也さん「クリスマスケーキはみんなにとって特別なのでおいしくいただいて欲しいです。」 真心こめて作ったクリスマスケーキは県社会福祉協議会を通じて県内の福祉施設に届けられます。 沖縄テレビ,[],[]
女子児童へのわいせつ行為で学童支援員の32歳男を逮捕　余罪の有無も含めて警察が捜査（沖縄テレビOTV）,https://news.yahoo.co.jp/articles/23f8b74540dbc666936c12c02793d518416c7fc7,https://newsatcl-pctr.c.yimg.jp/t/amd-img/20241204-90012213-otv-000-2-view.jpg?exp=10800,2024-12-04T13:17:01+09:00,2024-12-04T16:51:01+09:00,沖縄テレビOTV,otv,沖縄テレビOTV,468,沖縄テレビ 放課後児童クラブに通う女子児童にわいせつな行為をしたとして、学童支援員の男が逮捕されました。 不同意わいせつの疑いで逮捕されたのは、浦添市に住む学童支援員の男（32）です。 学童支援員の男は、11月２日から4日の間に、勤務先の放課後児童クラブとは別の本島中部の建物内で、女子児童の下腹部を触るなどのわいせつな行為をした疑いが持たれています。 児童の親族から相談を受けた小学校の教頭が警察に通報したことで事件が発覚しました。 警察は捜査に支障があるとして男の認否を明らかにしていませんが、余罪があるかも含めて捜査を進める方針です。 県内では2024年10月にも放課後等デイサービスで男子児童にわいせつな行為をしたとして、当時、学習支援員だった男が逮捕されています。 県は、2024年10月、各市町村に再発防止を求める通知を出し、11月には関係者が集まる場でも「職務倫理を自覚して不適切行為が無いように職務にあたる」ことを求めていました。 県の子育て支援課は、「誠に遺憾で対応策を検討していく」とコメントしています。 沖縄テレビ,[],[]
「資金洗浄され事件になっている」警察官かたる特殊詐欺で40代男性が1000万円騙し取られる（沖縄テレビOTV）,https://news.yahoo.co.jp/articles/99bc36d20b21508b1dee8d7a676fd538ad8fc4b8,https://newsatcl-pctr.c.yimg.jp/t/amd-img/20241204-90012212-otv-000-1-thumb.jpg?exp=10800,2024-12-04T13:06:01+09:00,2024-12-04T13:06:01+09:00,沖縄テレビOTV,otv,沖縄テレビOTV,378,沖縄テレビ 仕事で沖縄を訪れていた東京都の40代の男性が、警察官を騙る人物から1000万円をだまし取られる詐欺被害に遭いました。 3日、仕事で沖縄を訪れていた40代の男性のスマートフォンに、県外の警察官を騙る人物から「１億数千万円分が資金洗浄されていて兵庫県で事件になっている」「あなたの身柄を拘束しないように検事と相談する」資金洗浄の事実確認のために、指定された口座に現金を振り込むよう指示がありました。 男性は、インターネットバンキングで指定された口座に1000万円を振り込んだということです。 その後、不審に思った男性が警察に通報したことで事件が発覚しました。 県内では、警察官を騙る特殊詐欺が相次いでいて、警察は電話で金を要求することは絶対にないとして、不審な点があれば１人で判断せず家族や友人、警察に相談してほしいと呼びかけています。 沖縄テレビ,[],[]
国頭村で住宅火災　住民の74歳の男性が意識不明の重体（沖縄テレビOTV）,https://news.yahoo.co.jp/articles/15bfd5d0c68b548372ef7353b995fd66e5c64cd3,https://newsatcl-pctr.c.yimg.jp/t/amd-img/20241204-90012211-otv-000-1-thumb.jpg?exp=10800,2024-12-04T12:55:01+09:00,2024-12-04T12:55:01+09:00,沖縄テレビOTV,otv,沖縄テレビOTV,267,沖縄テレビ 4日、国頭村で住宅火災があり、この家に住む74歳の男性が意識不明の重体です。 火事があったのは、国頭村浜にある住宅で4日午後4時15分頃、「建物の中に煙が充満して中に人がいる」と近くに住む人から通報がありました。 火は約2時間半後に消し止められましたが、この家に住む74歳の男性が病院に運ばれていて意識不明の重体です。 この火事で鉄筋コンクリート造りの平屋の一部と敷地内にある車庫が全焼し、消防や警察が駆けつけた際には、部屋の中には煙が充満していたということです。 警察や消防が出火の原因を詳しく調べています。 沖縄テレビ,[],[]
