headline,mainEntityOfPage,image,datePublished,dateModified,author,media_en,media_jp,str_count,body,images,external_links
温湯処理でカキの生産量や品質↑　漁師たちが長年経験的に作業（khb東日本放送）,https://news.yahoo.co.jp/articles/92b9a3e7764595b04dbbdb2285e639097de898be,https://newsatcl-pctr.c.yimg.jp/t/amd-img/20241023-11583693-khbv-000-1-thumb.jpg?exp=10800,2024-10-23T18:44:34+09:00,2024-10-23T18:44:34+09:00,khb東日本放送,khbv,khb東日本放送,932,\nkhb東日本放送\n間もなく水揚げが本格化するカキについて、漁師たちが経験的に行ってきたある作業が生産量増加や品質向上につながることが最新の研究で明らかになりました。\nカキの養殖が盛んな宮城県気仙沼市の宿舞根漁港で、カキ漁師の畠山政則さんと息子の政也さんはカキの水揚げを前に、準備に追われています。\n\n この日行っていたのは、温湯処理と呼ばれる作業です。カキをクレーンで吊り上げ、７０℃ほどのお湯に１０秒ほど浸し再び海の中へ戻します。\n\n 畠山政也さん「付着物が死滅して剥がれ落ちて、カキにだけ栄養がいくようになる。カキに身入りがすごく良くなるし、クリーミーさが増す」\n\n 身入りが良くなると長年、漁師たちが経験的に行ってきた温湯処理は、最新の研究で更なる効果が明らかになりました。\n\n 東北大学環境生態工学研究室坂巻隆史准教授「カキの成長が良くなる部分に加えて、品質が良くなる。海底に色々なものが養殖場から落ちる量を防ぐことで、海の環境を守ると」\n\n 東北大学の坂巻隆史准教授の研究グループは、南三陸町志津川湾の３カ所で約５カ月間、温湯処理の有無によるカキの違いを比較する実験を行いました。\n\n その結果、温湯処理したカキは餌となる植物プランクトンの摂取率が高まることで、身の重量が２割から３割程度増加しました。\n\n カキに含まれるＤＨＡやＥＰＡの濃度が１３％から１５％高いことも判明し、更に養殖場から海底に沈んだ有機物の量が最大５７％減少しました。\n\n 質も良し、味も良し、環境にも良しと一石三鳥の効果が明らかとなりました。\n\n 東北大学環境生態工学研究室坂巻隆史准教授「漁師が編み出した経験的な方法がたくさんの効果を同時に生んでいて、非常に面白いなと思いましたし、海の物質循環をうまく利用して、生産効率を高めることができる例が示せたのでは」\n\n 海水温上昇に強いカキの養殖技術の確立につながる可能性もあり、坂巻准教授は今後も検証を続けるということです。\n\n 東北大学環境生態工学研究室坂巻隆史准教授「消費者が海の物質の循環や漁業者の苦労、取り組みに思いを向けてカキを食べてもらえたらなと」\nkhb東日本放送,[],[]
三陸沖で不漁が続くサバ　来遊量少ない見込み（khb東日本放送）,https://news.yahoo.co.jp/articles/99d1f52e76bd6804e98fe67e687d4aa0b6f5fb70,https://newsatcl-pctr.c.yimg.jp/t/amd-img/20241023-11583688-khbv-000-1-thumb.jpg?exp=10800,2024-10-23T18:41:51+09:00,2024-10-23T18:41:51+09:00,khb東日本放送,khbv,khb東日本放送,402,\nkhb東日本放送\n近年不漁が続くサバの資源状況が発表され、来遊量が少ない見込みであることが分かりました。\n国の研究機関などが三陸沖などで取れるサバの来遊量について、前年と同じか下回る見込みであると発表しました。\n\n 石巻魚市場でのサバの漁獲量は、前年は２万７０００トンと過去５年で最低となるなど、全国的な不漁は続く見通しとなりました。\n\n サバの資源量は２０１３年ごろから増加していますが、黒潮の潮流の変化や海水温が上昇などから近海に移動するサバが減ってきているということです。\n\n 水産資源研究所由上龍嗣グループ長「三陸沖では異常ともいえる高水温が続いていて、それが秋冬も続くので三陸沖にサバは来ない、サバは不漁になると予測しています」\n\n 一方で、タチウオやアカムツなど南の海に生息する魚の漁獲量は増える見込みで、水産業者は活用方法を検討するとしています。\nkhb東日本放送,[],[]
赤く染まった紅葉のコキアが見頃　宮城・みちのく杜の湖畔公園（khb東日本放送）,https://news.yahoo.co.jp/articles/233ecd4c76d4b0d3b48cc680fd708cd1750b79db,https://newsatcl-pctr.c.yimg.jp/t/amd-img/20241023-11583645-khbv-000-1-thumb.jpg?exp=10800,2024-10-23T16:55:27+09:00,2024-10-23T16:55:27+09:00,khb東日本放送,khbv,khb東日本放送,517,\nkhb東日本放送\n宮城県川崎町の国営みちのく杜の湖畔公園では、赤く染まったコキアが見頃を迎えています。\n井口亜美アナウンサー「もふもふとした見た目で可愛らしいコキアが紅葉し、赤いじゅうたんのように一面に広がっています」\n\n 国営みちのく杜の湖畔公園の南地区にあるだんだん畑には６２００本のコキアが植えられていて、紅葉が見頃を迎えています。\n\n 残暑による影響も心配されましたが、１０月上旬に気温の低い日が続いたため、例年通り順調に紅葉が進んだということです。夏の気温が高く雨量が少なかったため、前年よりひと回り大きい高さ約１メートルまで育ちました。\n\n 訪れた人は、コキアを眺めながら散策したり写真を撮ったりして秋の景色を楽しんでいました。\n\n 「ふわふわで色鮮やかできれいでした」「コキアそのもののボリューム、それが集団となってこれがすごいわね」\n\n みちのく公園管理センター企画運営課和光拓課長「コキアは色の変化が魅力ですので、季節の移ろいとともに変化していくコキアの色、１日として同じ色が無いので季節を楽しんでほしいなと思います」\n\n コキアの見頃は今週末まで続く見込みです。\nkhb東日本放送,[],[]
日本一のハンバーガーが世界大会に　宮城・松島町の店が世界大会に出場（khb東日本放送）,https://news.yahoo.co.jp/articles/e2ca258186b62cf9251aa70a6d08066e763dd1d1,https://newsatcl-pctr.c.yimg.jp/t/amd-img/20241023-11583715-khbv-000-1-thumb.jpg?exp=10800,2024-10-23T19:10:03+09:00,2024-10-23T19:10:03+09:00,khb東日本放送,khbv,khb東日本放送,515,\nkhb東日本放送\n日本一に輝いた宮城県松島町のハンバーガー店が、日本代表として世界大会に出場します。大会を前に店のオーナーが宮城県庁を訪れ、意気込みを語りました。\n伊藤副知事を訪れたのは、１１月８日に開幕する世界大会ワールド・フード・チャンピオンシップスに出場する佐藤賢将さんです。 松島町でハンバーガーショップ、ハリーズジャンクションを営む佐藤さんは６月、ハンバーガー日本一を決める大会で見事に優勝しました。\n\n 仙台牛など宮城県産食材を使ったハンバーガーを持参し、世界大会での活躍を誓いました。\n\n 伊藤副知事「おいしいですね。東北、日本の代表として頑張っていただきたいと思っているので、是非よろしくお願いします」\n\n 世界大会には約３０チームが出場し、アメリカ産食材の指定など制約があるなか、予選を勝ち上がった７チームで決勝を戦います。 佐藤賢将さん「シンプルに一口目食べておいしいとみんなが笑顔になってもらえれば一番いいかなと思うので、世界一になれればなと思っています」\n\n 佐藤さんは、決勝に進んだら日本一に輝いたカキの風味を生かしたソースを使って勝負したいと話していました。\nkhb東日本放送,[],[]
衆議院選挙　宮城３区　候補者の訴え（khb東日本放送）,https://news.yahoo.co.jp/articles/31b10954e85e2359fa330e63974f2adc6f73e145,https://newsatcl-pctr.c.yimg.jp/t/amd-img/20241023-11583708-khbv-000-29926949-thumb.jpg?exp=10800,2024-10-23T19:00:35+09:00,2024-10-23T20:46:17+09:00,khb東日本放送,khbv,khb東日本放送,2199,\nkhb東日本放送\n２７日に投開票される衆議院選挙、宮城３区の候補者の訴えや争点に対する考え方です。\n立候補しているのは、届け出順に自民党の前職、西村明宏候補（６４）、立憲民主党の新人、柳沢剛候補（６１）です。\n\n 宮城県で唯一、自民党と立憲民主党との一騎打ちとなった宮城３区は、政治とカネの問題を中心に各陣営が激しく火花を散らしています。\n 宮城３区は今回から仙台市太白区の秋保地区が外れましたが、それでも宮城県で最も多い１３の市と町が入ります。\n 仙台市のベッドタウンとしての機能も果たす名取市や岩沼市などを抱える一方、農業の盛んな郡部もある多様な地域です。\n\n 西村明宏候補「ありがとう。売れてます？」\n 自民党の前職西村候補は、大蔵大臣などを務めた故三塚博さんの元秘書で、地盤を引き継ぎ２００３年に衆院議員に初当選し、これまで６期務めてきました。\n\n 「政治がすべきは国民の命と暮らしを守ること」と訴え、環境大臣などの経験やインフラ整備の業績を強調し、自治体のトップや議員の支援を受けて戦います。\n 西村明宏候補「今から二十数年前、私が立候補する前の頃、国道４号線、いつも渋滞していませんでした？ あれをずっと、順番に順番に拡幅して、いま全然、渋滞がほぼ無くなっています」\n\n しかし、そのベテランにも政治とカネの逆風が吹きつけます。旧安倍派だった西村候補は、政治資金報告書に５５４万円の不記載があったとして、党の戒告処分を受けました。陣営は巻き返しを急ぎます。\n 小渕優子組織運動本部長「本当に気の毒なことだと思いますけど、今回のこの問題に巻き込まれてしまったと。相手候補、この宮城３区をどうしていきたいのか、何が課題で皆さん何に困っているのか。そんなことを１つも聞いたことがありません」\n\n 比例重複は認められず、背水の陣で挑む選挙戦。企業や団体をまわり、組織票を固めていきます。\n 西村明宏候補「私が初当選以来、お金にきれいにしてきたというのは昔から知っている先生方、ここに来ていただける皆様方、みんな知っております。検察から私出て来て、説明しろということは１回も無いんです。皆さんの一声一声が日本の将来、県南の将来にかかっているという思いで私も全力を尽くします。是非皆さん、一緒に戦ってください」\n\n 柳沢剛候補「おはようございます。どうも。いつもありがとうございます。１５００円のブドウ高いわ。庶民の私には１５００円のブドウは高いわ。名取の大根を秋田に持ってって、いぶりがっこにしてまた名取に戻って来てんのこれ」\n 立憲民主党の新人、柳沢剛候補は仙台放送のアナウンサーを約３０年務めたほか、宮城県名取市に長く住み、地元の少年野球チームの監督としても活動してきました。\n\n 政治家を志したことはありませんでしたが、立憲民主党の要請を受けて出馬を決断しました。農業政策に力を入れたいとする一方、選挙区を歩く中で手応えを感じているのは、政治とカネの追及です。\n 柳沢剛候補「長期政権は腐る。やはり政権交代が当たり前に行われる世の中こそ、正しい民主主義だと私は信じています」\n\n 宮城県で唯一、自民党と立憲民主党の一騎打ちとなり、党の幹部が次々に支援に入ります。\n 小川淳也幹事長「石破さん、これ単なる不記載だって言ってますがね、不記載なら記載してください。記載できる人が一体どこにいるんだ。裏金以外の何ものでもない。一体どの面下げて立候補するんですか。本当に有権者を、国民をなめるのもいい加減にしろと」\n\n アナウンサーとして活躍した高い知名度を生かし、無党派層への浸透を図ります。\n 柳沢剛候補「相手は裏金議員。そしてこちらは政治のことは何も知らないと言われる柳沢剛、新人です。裏金議員対新人の一騎打ち。３７年間、放送の世界で放送させていただきましたが、今度は皆さんの声を直接、政界にぶつけさせていただきます」\n\n ２人の候補者が争う宮城３区は、人口減少が深刻です。有識者でつくる人口戦略会議は、宮城県３５市町村のうち１９市町が「消滅する可能性がある」と分析します。\n 宮城３区は７つの市町が該当し、中でも川崎町は宮城県でただ１つ最も厳しい区分に分類されました。\n それぞれの候補者は人口減少や少子化の対策をどう考えるのでしょうか。\n\n 西村候補は、政権を担う与党としての実績を強調し、更に支援を手厚くするといいます。\n 西村明宏候補「子ども政策の司令塔として、こども家庭庁を創設しました。２０２３年１２月、３．６兆円という前例のない規模で子ども・子育て支援の抜本的な強化策をまとめた加速化プラン、これに基づいて児童手当の抜本的な拡充、高等教育費の負担軽減、こうしたことに取り組んで参ります」\n\n 柳沢候補は、現場をくまなく歩き、「安心して子どもを産み育てられる地域に」と訴えます。\n 柳沢剛候補「３区を歩いていて、３区の皆さん、山の中とか地方の皆さん、子どもを産む時どこ来ると思います？ 自分の町で産んでいると思います？ 名取、岩沼に来ている。だって自分の町に分娩できる所無いって、そしたら安心して住んでられないじゃないですか。そういったところからやっぱり少子化対策、考えないと」\nkhb東日本放送,[],[]
宮城県が学生に地元企業就職を促進　お笑い芸人も登場しイベント（khb東日本放送）,https://news.yahoo.co.jp/articles/d57d93af9c6bfed3e9b7eb6ec672fb294b7a0ed2,https://newsatcl-pctr.c.yimg.jp/t/amd-img/20241023-11583696-khbv-000-1-thumb.jpg?exp=10800,2024-10-23T18:47:24+09:00,2024-10-23T18:47:24+09:00,khb東日本放送,khbv,khb東日本放送,932,\nkhb東日本放送\n学生の就職活動は空前の売り手市場で、学生の獲得競争が過熱するなか宮城県が工夫を凝らした交流イベントを開催しています。\n宮城県への学生の就職を促そうと県が主催した就活イベントには、宮城県に本社や支社を置く企業１５社と宮城県の大学や専門学校に通う学生約５０人が参加しました。\n\n ゲストは、宮城県出身でお笑い芸人の尾形貴弘さんと宮城県住みます芸人のお野菜太郎さんです。\n\n 尾形貴弘さん「宮城県はね、ものすごく良い会社がいっぱいありますから宮城県をお願いしますよ。俺もいずれ帰って来たいから」 お野菜太郎さん「本当にお願いします」\n\n 尾形貴弘さん「宮城の学生さんお願いしますよ」\n\n 質問コーナーでは、企業に直接聞きづらいことを２人が学生に代わって投げ掛けました。\n\n 尾形貴弘さん「それぞれの企業で活躍している人はどんな人ですか。スキルや資格などに特徴があれば教えてください」\n\n 製造業担当者「スキルに関しては基本的には最初は必要は無いです。コミュニケーションが取れる人が活躍しているなっていう印象があります」\n\n 宮城県が学生の就活に力を入れる理由は、宮城県の学生の首都圏への流出です。\n\n 宮城労働局の調査では、２０２４年春に宮城県の大学などを卒業した学生の宮城県就職率は３９．２％と過去最低となりました。\n\n イベントでは食事も用意され、参加した学生たちは食事をしながら企業の担当者に質問していました。\n\n 大学生「大事にしていることだったり、やりがいだったりをより詳しく知れたので良かったです」「地域に密着した企業が集まった説明会がなかなか無いので、会社のことを知れて良かったです」\n\n ＩＴ企業担当者「人口が減っている実情がありながら、採用するのは非常に厳しくなっています。地元企業としては、東北発展のために少しでも役に立てるようなことを自治体と民間と学生と一緒に作っていきたいと思っています」\n\n 宮城県産業人材対策課高橋美幸主任主査「是非自分がどんなふうに働くかイメージが湧かないなという方ですとか、社会人と話してみたいなと考えている方に来てほしいです」\nkhb東日本放送,[],[]
ごみの不法投棄を防ぐ　仙台市の産廃処理委業者が清掃活動（khb東日本放送）,https://news.yahoo.co.jp/articles/b2103d8b32a3c25fd12b39dbfe327a87e7468b75,https://newsatcl-pctr.c.yimg.jp/t/amd-img/20241023-11583642-khbv-000-29925636-thumb.jpg?exp=10800,2024-10-23T16:53:12+09:00,2024-10-23T17:11:45+09:00,khb東日本放送,khbv,khb東日本放送,392,\nkhb東日本放送\n不法投棄されたごみを無くそうと、仙台市若林区で産業廃棄物処理業者などが清掃活動を行いました。\n不法投棄の防止を啓発しようと仙台市の産業廃棄物処理業者でつくる団体が１９９６年から毎年行っていて、約１２０人が参加しました。\n\n 参加者は若林区のせんだい農業園芸センター周辺を回り、空き缶や食品トレーといったごみを拾いました。\n\n ２時間ほどの活動で約２６０キロのごみが集まったということです。\n\n 参加者「やはり空き缶類が多いですね。あとビニール袋。珍しいところだとサクションパイプの一部とかそういった物ですね」「毎年参加してますけれども、少しずつごみの量は減っていると思います」\n\n 仙台市環境局によりますと、不法投棄の処理量は減少傾向にあるものの、２０２３年度の処理件数は１１００件を超え約３４トンに上ったということです。\nkhb東日本放送,[],[]
ＪＲ仙台駅周辺に相次いでホテルが開業「インバウンド需要の高まり」専門家（khb東日本放送）,https://news.yahoo.co.jp/articles/64bdbd497201e496647345be44d39793a11db305,https://newsatcl-pctr.c.yimg.jp/t/amd-img/20241023-11583681-khbv-000-1-thumb.jpg?exp=10800,2024-10-23T18:23:22+09:00,2024-10-23T18:23:22+09:00,khb東日本放送,khbv,khb東日本放送,1000,\nkhb東日本放送\nＪＲ仙台駅西口に誕生する新しいホテルの地鎮祭が行われました。仙台駅周辺ではホテルの開業が相次いでいて、専門家はインバウンド需要の高まりと分析しています。\n地鎮祭にはホテルを運営する仙台ターミナルビルの関係者らが出席し、工事の安全を祈願しました。\n\n 東北への観光客やビジネス利用客に拠点として利用してほしいと、新しいホテルの名称はホテルメトロポリタンベース仙台と発表されました。\n\n 地上９階建てで延べ床面積は約２８６０平方メートル、客室数は５６室で１階にはレストランが入る予定です。\n\n 新しいホテルでは、仙台ターミナルビルが運営するホテルでは初めて、ベッドを４台設置した広い客室も用意されます。\n\n 仙台ターミナルビル松崎哲士郎社長「インバウンドの方は土日休日限らず常時入って来ている。インバウンドの方に積極的に宣伝して使っていただきたい」\n\n ホテルは２０２６年の１月ごろから宿泊の予約受付を開始し、春の開業を予定しています。\n\n 仙台駅周辺では、ホテルの開業が相次いでいます。\n\n 七十七リサーチ＆コンサルティングの田口庸友首席エコノミストは「コロナ禍が明け、インバウンド需要が回復したため」と分析します。\n\n 七十七リサーチ＆コンサルティング田口庸友首席「直行便が復活したことに加えて、アジアでも海外旅行ができる中間所得層が増えてきたことと、円安基調で旅行のコストが下がっていることが要因」\n\n 仙台市によりますと、２０２３年の宿泊者数は約６００万人とコロナ禍前の水準に戻りました。\n\n 外国人の宿泊者数はコロナ禍で大きく落ち込みましたが、２０２３年は３３万８５５９人と過去最多になりました。\n\n １２月以降、航空会社３社が仙台と香港を結ぶ定期便を相次いで就航することから、インバウンド需要は更に高まることが見込まれています。\n\n 一方で、田口首席エコノミストは増加する宿泊者数に対して施設の対応が追い付いていない状況もあると指摘します。\n\n 七十七リサーチ＆コンサルティング田口庸友首席「客室は空いていても働く人がいないので（客室を）埋められないことがある。稼働率を上げられない背景には、人出不足の問題が重くのしかかっていて、賃金を上げる対策を講じているが増加する需要に対応しきれていない」\nkhb東日本放送,[],[]
道路舗装工事中にローラー車にひかれ作業員死亡　宮城・大和町（khb東日本放送）,https://news.yahoo.co.jp/articles/f5615f773dfed86e69b0abe9fb524f6d502ab61e,https://newsatcl-pctr.c.yimg.jp/t/amd-img/20241023-11583638-khbv-000-29925650-thumb.jpg?exp=10800,2024-10-23T16:40:28+09:00,2024-10-23T17:14:31+09:00,khb東日本放送,khbv,khb東日本放送,306,\nkhb東日本放送\n２３日未明、宮城県大和町で道路の舗装工事をしていた６６歳男性がローラー車にひかれて死亡しました。\n２３日午前３時４０分ごろ、大和町吉岡の交差点で道路の舗装工事をしていた男性がローラー車に下半身をひかれました。\n\n この事故で大崎市古川沢田の会社員、佐々木浩さん（６６）が病院に搬送されましたが、間もなく死亡が確認されました。死因は、出血性ショックでした。\n\n 事故当時、現場では佐々木さんを含め複数人で作業していて、ローラー車は他の作業員が運転していたということです。\n\n 警察は、他の作業員から当時の状況を聞き、安全管理に問題が無かったか調べています。\nkhb東日本放送,[],[]
宮城県各地で気温上昇　大崎市鹿島台で夏日（khb東日本放送）,https://news.yahoo.co.jp/articles/6995f84a177c003e0dc18ddad24445d7c5d66aad,https://newsatcl-pctr.c.yimg.jp/t/amd-img/20241023-11583573-khbv-000-1-thumb.jpg?exp=10800,2024-10-23T11:50:43+09:00,2024-10-23T11:50:43+09:00,khb東日本放送,khbv,khb東日本放送,207,\nkhb東日本放送\n２３日の宮城県は各地で気温が上がり、鹿島台で夏日となっています。\n日本海にある低気圧に向かって南から温かい空気が流れ込んでいる影響で、宮城県は各地で朝から気温が上がっています。\n\n 午前１１時２０分までの気温は鹿島台で２５．０℃、女川で２４．７℃、仙台で２３．３℃など９月中旬並みの気温となっています。\n\n 仙台で夏日となれば、過去５番目に遅い記録となります。\nkhb東日本放送,[],[]
