headline,mainEntityOfPage,image,datePublished,dateModified,author,media_en,media_jp,str_count,body,images,external_links
【山形】社会福祉に取り組む2団体に助成金（YTS山形テレビ）,https://news.yahoo.co.jp/articles/f17ae13938050f490b3b8ea2c203ba970ee8108b,https://newsatcl-pctr.c.yimg.jp/t/amd-img/20251009-00000012-yts-000-1-thumb.jpg?exp=10800,2025-10-09T19:57:05+09:00,2025-10-09T19:57:05+09:00,YTS山形テレビ,yts,YTS山形テレビ,374,"YTS山形テレビ
県内で社会福祉の推進に取り組む2団体に、公益財団法人から助成金が贈られました。

助成金を贈ったのは、社会課題の解決に貢献する活動や研究を支援している公益財団法人大同生命厚生事業団です。

過去最多となる334件の応募がある中、県内からは2団体が選ばれました。

引きこもりの子を持つ親を支援する「かたばみの会」では、有識者を招いた講演会や学習会を開く費用として助成金を活用していくということです。

また音が聞こえる聞こえないにとらわれない世界を作っていこうと高校や大学などと協力して様々な活動を行っている手話サークル「手話っち」。

こちらではイベントで使うパソコンやプロジェクターの費用に助成金を充てるということです。

大同生命厚生事業団では、これまでに合わせて4975件、およそ17億9000万円の助成金を贈っています。",[],[]
【山形】無人トラックに衝突 軽ワゴン車の男性が死亡（YTS山形テレビ）,https://news.yahoo.co.jp/articles/cbc43a1989f1dffb6bf50e932b3a562a99122527,https://newsatcl-pctr.c.yimg.jp/t/amd-img/20251009-00000011-yts-000-1-thumb.jpg?exp=10800,2025-10-09T19:54:05+09:00,2025-10-09T19:54:05+09:00,YTS山形テレビ,yts,YTS山形テレビ,332,"YTS山形テレビ
10月9日朝、遊佐町の日本海沿岸東北自動車道で交通規制のために止まっていたトラックに軽ワゴン車が衝突する事故があり、軽ワゴン車の男性が死亡しました。

午前7時前、日本海沿岸東北自動車道上りの遊佐比子インターチェンジ付近で、荷台に通行止めの標識を載せたトラックに軽ワゴン車が衝突しました。

軽ワゴン車を運転していた遊佐町当山の水道工事業 高橋恒平さん（42）が意識不明の重体で病院に搬送されましたが、その後死亡が確認されました。

トラックに人は乗っていませんでした。

現場の日本海沿岸東北自動車は10月8日道路の盛土が崩れているのが見つかり、遊佐比子インターチェンジから酒田みなとインターチェンジの間が上下線で全面通行止めとなっていました。",[],[]
【山形】スキージャンプ 内藤選手に助成金（YTS山形テレビ）,https://news.yahoo.co.jp/articles/c13c7ef6715f5816775dfebde8e0e6021aad2c17,https://newsatcl-pctr.c.yimg.jp/t/amd-img/20251009-00000010-yts-000-1-thumb.jpg?exp=10800,2025-10-09T19:48:05+09:00,2025-10-09T19:48:05+09:00,YTS山形テレビ,yts,YTS山形テレビ,449,"YTS山形テレビ
山形市役所の職員でスキージャンパーとしても活躍する内藤智文選手に公益財団法人が助成金50万円を贈りました。

助成金を贈ったのは、県内外で石油の販売を手掛ける遠藤商事などで構成する公益財団法人エンドー学事振興会です。

青少年のスポーツ振興などを目的に1995年に設立されて以降、毎年、スポーツや部活動に関わる団体などに助成金を贈っています。

きょうは、8月に行われた「サマースキージャンプ蔵王大会」で準優勝を果たした山形市役所の内藤智文選手に助成金50万円が手渡されました。

助成金は、遠征費の一部として活用されるということです。

内藤選手は、ワールドカップ出場をかけたドイツで行われる「コンチネンタルカップ」を来週末に控えていて、さらなる活躍が期待されます。

「身に染みてありがたい限りです。本当にスキー人生をかけて臨むような1週間、2週間になってくると思うので、おのずと身は引き締まるので、リラックスして上手くバランスをとりながら取り組んでいければと思っています。」",[],[]
【山形】酒田舞娘の壁画 完成（YTS山形テレビ）,https://news.yahoo.co.jp/articles/47e01c7faf88a1967cc42d98eb1f8f8c9958f810,https://newsatcl-pctr.c.yimg.jp/t/amd-img/20251009-00000009-yts-000-1-thumb.jpg?exp=10800,2025-10-09T19:45:04+09:00,2025-10-09T19:45:04+09:00,YTS山形テレビ,yts,YTS山形テレビ,756,"YTS山形テレビ
酒田市に新たなシンボルが誕生しました。

世界的アーティストが描く酒田舞娘の壁画が、10月9日完成しました。

メジャーリーグロサンゼルス・ドジャース、大谷翔平選手の巨大な壁画を描いたアーティスト、ロバート・バルガスさん。

酒田舞娘の壁画制作のため10月1日から庄内に滞在しています。

酒田舞娘の伝統美を、酒田港にある交流拠点「サカタント」の大きな壁に表現します。

ロバートさんは2024年、酒田舞娘がロサンゼルスで披露した舞いに感銘を受け、その美しさをぜひ描きたいと、今回のプロジェクトが実現しました。

「大枠を捉えていて、そこがプロフェッショナルな感覚だと思う。その感覚を表現できるという。」

「（楽しみですね。）凄く楽しみ！」

10月2日に始まった酒田舞娘の壁画制作。

下描きは一切行わず直接描くのが、ロバートさんの作風です。

制作開始から5日目の10月9日、いよいよ完成のときを迎えました。

かんざしや着物を繊細なタッチで描き仕上げていきます。

壁画のタイトルは「伝統」。

酒田舞娘の伝統を守り続けている芸妓 小鈴さんの信念を貫く姿勢、思いを表現したということです。

「伝統は、1回途切れてしまうと、やはり立て直しが大変だと思っている。つないでいくことに、ものすごい重圧と無力感を感じていて、ロバートさんの壁画に勇気をもらった。」

「正直少しほろ苦い気持ちです。壁画を完成させたということは、アメリカに帰らなくてはいけない。できればもう少しだけ、酒田を楽しみたかった。」

世界的な壁画アーティスト ロバート・バルガスさんによって、酒田市に新たなシンボルが誕生しました。

この壁画を通して、酒田から全国、そして世界へ。

酒田舞娘の伝統美を発信していきます。",[],[]
【山形】鶴岡東、日大山形が初戦突破（YTS山形テレビ）,https://news.yahoo.co.jp/articles/f413b3231d84c63d722471798da324c3eca8c4a5,https://newsatcl-pctr.c.yimg.jp/t/amd-img/20251009-00000008-yts-000-1-thumb.jpg?exp=10800,2025-10-09T19:24:05+09:00,2025-10-09T19:24:05+09:00,YTS山形テレビ,yts,YTS山形テレビ,389,"YTS山形テレビ
来年の春のセンバツに繋がる秋の高校野球東北大会の初戦に山形代表の3校が臨みました。

山形第3代表の鶴岡東は宮城第3代表の名取北と対戦。

1回に相手の暴投と6番・野中のタイムリーヒットで2点を先制します。

エースナンバーを背負う1年生井上は名取北打線に連打を許さず最少失点に抑え完投。

3対1で鶴岡東が初戦突破です。

第2代表の東海大山形は秋田第2代表の金足農業と対戦。

1回に相手の上位打線の連打を浴び先制されると、2回と8回にはエラーにより追加点を許し、5対0で完封負けを喫しました。

第1代表の日大山形は福島第3代表の学法石川との初陣。

1回に先制されますが2回の攻撃には下位打線からの3連打で逆転。

両チーム二桁安打の乱打戦を制し、日大山形が準々決勝進出です。

鶴岡東は岩手第1代表の花巻東と日大山形は宮城第2代表の東北と対戦します。",[],[]
【山形】山形国際ドキュメンタリー映画祭 開幕（YTS山形テレビ）,https://news.yahoo.co.jp/articles/8c9de8e060a0afa904d4b3aa6aa59ea7f92188f1,https://newsatcl-pctr.c.yimg.jp/t/amd-img/20251009-00000007-yts-000-1-thumb.jpg?exp=10800,2025-10-09T19:21:04+09:00,2025-10-09T19:21:04+09:00,YTS山形テレビ,yts,YTS山形テレビ,427,"YTS山形テレビ
2年に一度開催される山形国際ドキュメンタリー映画祭が開幕しました。

1989年にアジア初のドキュメンタリー映画祭として始まり、今年で19回目を迎えた山形国際ドキュメンタリー映画祭。

山形市内の会場には、映画祭に参加する世界各国の監督らが続々と集まりました。

「あこがれる映画の作り手が普通に歩いているのでワクワクと緊張といろいろな感情楽しみにしています。」

「プログラムが豊富で楽しみにしている。」

今年は2つの部門に過去最多となるおよそ2700本の応募があり、130本ほどが上映される予定です。

映画祭はきょうから10月16日までで、市民会館など市内5カ所がメイン会場となります。

「社会の分断と排他的な言説が世界的に広がりつつあり、日本も例外ではありません。そんな時代だからこそ、この映画祭は続けられなければならない。」

10月10日からは、山形テレビなど県内の放送局が制作したテレビドキュメンタリーも上映されます。",[],[]
【山形】クマ対策含む補正予算案 可決（YTS山形テレビ）,https://news.yahoo.co.jp/articles/d4763143ae06da7c65110cc724d87b0bdf1f53b2,https://newsatcl-pctr.c.yimg.jp/t/amd-img/20251009-00000006-yts-000-1-thumb.jpg?exp=10800,2025-10-09T19:00:05+09:00,2025-10-09T19:00:05+09:00,YTS山形テレビ,yts,YTS山形テレビ,423,"YTS山形テレビ
県議会9月定例会はクマの出没対策などを盛り込んだ68億円余りの一般会計補正予算案を可決し、閉会しました。

可決されたのは、68億2300万円の一般会計補正予算案など合わせて33件です。

今回は、相次ぐクマの出没への対策強化を重点政策として、およそ6400万円を計上。

クマの通り道となっている河川のやぶの刈り取りを行うほか、2025年6月にクマが山形空港内に入り込んだを受け、侵入防止に向けた有刺鉄線の更新や監視カメラの設置を進めます。

また、市街地に出たクマに対し市町村長が発砲を許可する「緊急銃猟」を行うために必要な資材の購入や訓練の実施を支援します。

このほか山形新幹線の長期運休で影響を受けた観光業への支援に1億1000万円を計上。

県内の宿泊施設を対象に1人一泊あたり3000円を割引きする観光キャンペーンを12月まで行います。

今回の補正により、今年度の累計予算額は6848億9700万円となりました。",[],[]
【山形】山形市 二口橋付近にクマ出没（YTS山形テレビ）,https://news.yahoo.co.jp/articles/ab0f51526db1a321240ded257a5900bc7b421f66,https://newsatcl-pctr.c.yimg.jp/t/amd-img/20251009-00000005-yts-000-1-thumb.jpg?exp=10800,2025-10-09T18:54:05+09:00,2025-10-09T18:54:05+09:00,YTS山形テレビ,yts,YTS山形テレビ,688,"YTS山形テレビ
続いては目撃件数が過去最多を更新し続けているクマについてです。

10月8日から10月9日朝にかけ、山形市や鶴岡市の市街地で目撃情報が相次ぎ、警察や市が注意を呼びかけています。

10月9日午前7時15分ごろ、山形市銅町の二口橋付近の路上でクマ一頭が目撃されました。

「よく芋煮会が行われるこちらの二口橋では、ごらんのように藪が生い茂っています。クマも身をひそめやすいように感じます。」

橋の下から見ると川の水が見えないほどやぶが生い茂っていることがわかります。

市街地へのクマの出没に近くの人は不安を口にしていました。

「夜とかも駐車場が歩いたところにあり結構気を付けなければならないなと思うので、警戒心を持っていなければならない。」

中にはクマスプレーを持参して散歩する人の姿も。

「（この場所から）一つ越えると市の中心街になるところにクマが出ているので、他人ごとではないのかなと、山の中の話では無く人の生活圏の中に来ているので何とか対応してほしい。」

一方、鶴岡市の中心部でもクマの目撃が相次ぎました。

10月8日夜8時45分ごろ、鶴岡市馬場町にある「鶴岡公園」で散歩していた人がクマと遭遇。

1時間後には、パトロール中の警察官が公園近くを走るクマを目撃していますが、その後の行方は分かっていません。

鶴岡市では10月8日未明からクマの目撃情報が多数寄せられていて、市は、同じクマの可能性もあるとみて注意を呼びかけています。

県によりますと2025年のクマの目撃件数は、10月5日時点で1364件に上り、去年の3倍を超えています。",[],[]
【山形】紅葉スポット「ドッコ沼」色づく（YTS山形テレビ）,https://news.yahoo.co.jp/articles/987661918fc886e9bf7e00811a2b0fa37ca5eb48,https://newsatcl-pctr.c.yimg.jp/t/amd-img/20251009-00000004-yts-000-1-thumb.jpg?exp=10800,2025-10-09T18:48:04+09:00,2025-10-09T18:48:04+09:00,YTS山形テレビ,yts,YTS山形テレビ,580,"YTS山形テレビ
蔵王も秋の深まりを見せています。

人気の紅葉狩りスポット「ドッコ沼」の木々も色づきはじめました。

「時折冷たい風が吹いて少し肌寒く感じるドッコ沼ですが、周りの木々は赤や黄色に色づき始めています。秋を感じますね。」

標高およそ1300メートルに位置するドッコ沼は、一足早く紅葉を楽しめる人気のスポットです。

2025年は9月に入ってからも気温の高い日が続いた影響で、紅葉は例年より1週間ほど遅れていましたが、先月下旬からの冷え込みで一気に色づき始めました。

「紅葉もきれいだが、エメラルドグリーンの水面に反射する色づき始めた木々もきれい。」

訪れた人たちは、写真や動画を撮るなどして深まる秋の景色を楽しんでいました。

「嬉しくなっちゃって、拾っちゃいました。写真で見たが、実際の目で見た方がきれいで自然に普段触れていないのですごく感動した。」

「本当にきれいですねここの眺望。とても心が洗われるようです素敵な景色で。」

こちらの二人は合唱組曲「蔵王」からドッコ沼を知ったそうです。

「（合唱で聞いていたドッコ沼、実際に見てみてどう？）素敵です。彼女は帰ってからこのドッコ沼を皆さんに指導する。水に紅葉が映って、素敵だと伝えたい。」

ドッコ沼での見ごろは来週末までで、10月下旬にかけて紅葉は温泉街まで降りてくる見込みです。",[],[]
【山形】山形市 薬物の乱用防止を呼びかけるキャンペーン（YTS山形テレビ）,https://news.yahoo.co.jp/articles/9c76f6c031397c161e8052ab972db567332047cf,https://newsatcl-pctr.c.yimg.jp/t/amd-img/20251009-00000003-yts-000-1-thumb.jpg?exp=10800,2025-10-09T11:54:02+09:00,2025-10-09T11:54:02+09:00,YTS山形テレビ,yts,YTS山形テレビ,365,"YTS山形テレビ
山形市で通勤・通学の時間帯に薬物の乱用防止を呼びかけるキャンペーンが行われました。

「薬物防止キャンペーンでお配りしています。」

このキャンペーンは、パチンコ店で組織する「県遊技業協同組合」や「県遊技業防犯協力会」が実施しています。

JR山形駅では午前7時半から組合員と山形警察署員が、通勤・通学中の人たちに薬物乱用防止のメッセージが入った蛍光ペンや、チラシを配りました。

県警によりますと今年に入ってから8月までに、県内で薬物の使用や所持で検挙されたのは17人で、そのうち12人が大麻関連だということです。

また大麻関連12人のうち、半数の6人が30歳未満の若年層となっています。

「SNSなどを利用して手軽に薬物が手に入ってしまうことがあるようなので興味本位で手を出すことないようにしてほしい。」",[],[]
【山形】鶴岡公園でクマの目撃情報（YTS山形テレビ）,https://news.yahoo.co.jp/articles/a366112ce67ae7ac27c2efb34bb68be86f6c4e76,https://newsatcl-pctr.c.yimg.jp/t/amd-img/20251009-00000002-yts-000-1-thumb.jpg?exp=10800,2025-10-09T11:51:01+09:00,2025-10-09T11:51:01+09:00,YTS山形テレビ,yts,YTS山形テレビ,403,"YTS山形テレビ
10月8日夜、山形県鶴岡市の中心部にある「鶴岡公園」でクマが目撃されました。

市では10月8日未明から目撃が相次いでいたクマの可能性もあるとみて、注意を呼びかけています。

10月8日夜8時45分ごろ、鶴岡市馬場町にある「鶴岡公園」を散歩していた人が体長およそ1メートルのクマ1頭に遭遇しました。

クマは人を見ると公園内の藪の中に逃げていったということです。

また、およそ1時間後には公園の近くをパトロール中の警察官が北の方に走っていくクマを目撃しています。

現時点で、人や物への被害は確認されていません。

鶴岡市では、10月8日未明からクマの目撃が相次いでいて、市では、同じクマの可能性もあるとみて注意を呼びかけています。

また、午前7時15分ごろ山形市銅町の二口橋付近の路上でもクマ一頭が目撃されています。

警察や市は周囲をパトロールするなどして注意を呼びかけています。",[],[]
【山形】山形市・二口橋付近でクマ目撃（YTS山形テレビ）,https://news.yahoo.co.jp/articles/d72d5b0d59801904a0ba3518d996a5f261782684,https://newsatcl-pctr.c.yimg.jp/t/amd-img/20251009-00000001-yts-000-1-view.png?fmt=jpeg&q=85&exp=10800,2025-10-09T10:21:02+09:00,2025-10-09T10:21:02+09:00,YTS山形テレビ,yts,YTS山形テレビ,84,"YTS山形テレビ
山形市によりますと、９日午前７時１５分ごろ山形市の二口橋付近の銅町２丁目の路上でクマ一頭が目撃されたということです。市や警察が注意を呼び掛けています。",[],[]
