headline,mainEntityOfPage,image,datePublished,dateModified,author,media_en,media_jp,str_count,body,images,external_links
潤うほどにキレイになれる12月【青木良文のエレメント別占い～美容と人生の幸福なカンケイ～】（美的.com）,https://news.yahoo.co.jp/articles/3d0936121c14603bd089eda6773377e1d1756fbd,https://newsatcl-pctr.c.yimg.jp/t/amd-img/20241207-00010007-biteki-000-1-view.jpg?exp=10800,2024-12-07T08:40:04+09:00,2024-12-07T08:40:04+09:00,美的.com,biteki,美的.com,1248,"12月は、肌・体・心を潤わせて。【青木良文のエレメント別占い～美容と人生の幸福なカンケイ～】 豊かな人生を送るのに役立つ、エイジングケアの裏技 12月からは、2月までの3か月間続く“水”の気がめぐるシーズンがスタート。女性は“水”の気でできていると考えられているので、肌・体・心を“潤せる”程にキレイになれるんだそう。スキンケアで保湿に重きを置いて水分チャージするのはもちろん、髪と唇も重点的に潤わせると、即効的に美人見え度がアップします！ ちょっと贅沢なバスソルトや入浴剤を使った優雅なバスタイムでボディの保湿も欠かさずに。さらに、乾燥する季節なのでインナーケアで体内の保湿にもチャレンジ。体の内側や粘膜の乾きは体の表面である肌の乾燥につながってしまうので、上質な水をたくさん飲み、潤いを蓄えるサプリを摂るなどすると良いでしょう。また、心の充足も大切な“潤い”です。美味しいものを味わう、スイーツを食べる、好きなものを愛でる、推し活をするなど自分を楽しませること、そして夜の時間を充実させることも“水”の気を貯めることにつながります。今年を締めくくる12月、好きなジャンルのイベントに出かける、忘年会をする、憧れのミシュランのレストランに行くなど夜の時間を華やかに過ごすと良いでしょう。その外出時に、艶や煌めきを身につけることがラッキービューティアクション。ラメやパール入りのアイテムでメイクをしてフェスティヴシーズンに明るく輝いてください。 【写真6枚】この記事で紹介した、エレメント別今月のラッキーアイテムはこちらからチェック！ 【土のエレメント】来年やりたいことを先取りして今、スタート！ 土のエレメント “土”のエレメントの人の12月はスタートのタイミング。強い運気が流れている2024年の最終月なので、アクティブに過ごすのがおすすめです。この1か月が、来年の流れを作るようなイメージで、来年やりたいことは何か、どんな自分になりたいのか、考えてみましょう。そしてそれを、来年に先取りしてやり始めてしまうくらいでちょうど良いくらい、勢いのあるときです。ラッキービューティアイテムは、肌を煌めかせるアイテム。ラメ入りのリキッドやフェースパウダーを肌に広くのばして、フレッシュな華やかさをまとって。 今月のラッキービューティアイテムは、肌をジュエリーのように映えさせる「ディオール」のリキッドハイライター シルキーなベースに、多角的かつ多次元的に輝くパールピグメントがふんだんに入ったリキッドハイライター。ざくざくラメが入っているのに、まるで宝石を微細に砕いたような本物の輝き感なので、大人がまとうのにぴったり。ファンデーションに混ぜたり、メイクの仕上げに頰に広めに乗せると、一気に特別感のある肌に。明るい場所ではもちろん、暗めのレストランやバーなどムードのある照明の下で特に“映え”ます！ ディオール ディオールスキン フォーエヴァー グロウ マキシマイザー 012 パーリー ￥5,940",[],[]
【田中みな実×MEGUMI 】スペシャル対談｜美容法からメンタル、ホームケアまでを熱くトーク♡（美的.com）,https://news.yahoo.co.jp/articles/fc356b6547203be356be635ad87f757bd4c76b73,https://newsatcl-pctr.c.yimg.jp/t/amd-img/20241207-00010006-biteki-000-1-view.jpg?exp=10800,2024-12-07T08:30:53+09:00,2024-12-07T08:30:53+09:00,美的.com,biteki,美的.com,1165,継続は美なり！ 自分なりの「仕組み」を作ることが続けられるコツ 田中みな実さん×MEGUMIさん 田中さん（以下、田中）：MEGUMIさんとは仕事でご一緒したり、プライベートでも仲良くしてもらっていますが、雑誌で対談をするのは初めてですよね。今日は来ていただき、ありがとうございます～♡ さっそくですが、今回の対談のテーマは「2024年のベストビューティ」ですって。ベストって難しいけれど…MEGUMIさんが美容においていちばん大事にしていることって？ 【写真10枚】この記事で紹介した、田中みな実さんとMEGUMIさんのアナザーショットや愛用コスメ、本はこちらからチェック MEGUMIさん（以下、M）：そうねー…やっぱり、“継続”だと思います。なかなか結果が出ない時期はあるけれど、そこを耐え抜いて淡々と続けていくと、急に変わってくるんですよ。 田中：うんうん。「これひとつだけやっておくといいよ」って言えたらいいんですけれど、スキンケアやメイク、インナーケア、エクササイズ、全部必要なんですよね。だから自分に合うものをバランス良く継続していけたらいいのかな、と思います。MEGUMIさんが現在継続していることってなんですか？ M：運動だね！ 朝起きた瞬間からYouTubeを見ながらストレッチをして、その後さらに30分くらい筋トレも。ジムに行く日もあるけれど、行けないときにこそどうするか？ を今年すごく考えたの。で、ストレッチからの筋トレ、そして散歩。この「仕組み」がめっちゃ最高なんですよ！ 1日の巡りが良くなって、マインドもイイ感じになるから、朝イチで運動をするという習慣は、一生続けたいですね。 田中：「仕組み」を作る なるほど、これが継続の秘訣ですね。○○さんにオススメされたこれをやってみたいけれど、あれもやってみたい、どうしようかな～ってフラフラしていると、結局、「今日はいっか…」って先延ばしにしてしまう気がするからルーティンを作ってしまえたらいいですね。MEGUMIさんレベルのストイックな「仕組み」は急にはハードルが高いかもしれないけれど、やると決めたら言い訳をしないで、パッと「仕組み」を作ってみるのはいいかも。 M：私たちって、すごいストイックだからね（笑）。 田中：私は宅トレができなくて、ジムに行って先生に褒められないとエクササイズを頑張れない（笑）。週に1～2回はトレーニングをしているけれど、作品中など、どうしても行けない時期には「体が重いな…」って感じるんです。そんなときのための「仕組み」を作っておけたらいいんですよね。 M：10分でも3分でもいいんですよ。ちょっとだけでいいから継続することで、結果が出るから。特に30歳をすぎるとね、やるのとやらないのとでは、ものすごーく差が出るから！,[],[]
肌悩みに合わせたものをチョイス！ 美容賢者が選ぶ【洗顔】ランキング｜『美的』2024年下半期ベストコスメ（美的.com）,https://news.yahoo.co.jp/articles/dfdb7b3cef2c54a7f71e2f4f43236eaf37f803ee,https://newsatcl-pctr.c.yimg.jp/t/amd-img/20241207-00010005-biteki-000-1-view.jpg?exp=10800,2024-12-07T08:30:03+09:00,2024-12-07T08:30:03+09:00,美的.com,biteki,美的.com,898,"【3位】MEM ソフト フェイシャル ゴマージュ（6票） MEM ソフト フェイシャル ゴマージュ ツルツル シミ・くすみケア 1回当たり￥238 ジェル 弾力スクラブで洗い上がりなめらか。 「ゼリー状のテクスチャーで摩擦感や刺激感がないのに、ザラつきがスッキリ落ちる！ 突っぱり感のない洗い上がりも良く、洗面所に常備しておきたいアイテムです。」（美容エディター 村花杏子さん） 【写真3枚】この記事で紹介した、『美的』2024年下半期ベストコスメ【洗顔】ランキング2位と1位はこちらからチェック！ 価格：￥5,940 容量：80g 発売日：2024-07-11 【2位】ゲラン アベイユ ロイヤル クレンジング ケア イン ムース（16票） しっとり シミ・くすみケア ジェル バリア機能を守りながら汚れをオフ 「柔らかな泡とアベイユの香りに包まれるだけでも癒し。スッキリとした洗い上がりが心地よく、肌が明るく引き立つような、なめらかな潤い感にハマります。」（ヘア＆メイクアップアーティスト NADEAさん） 価格：￥8,360 容量：175ml 発売日：2024-08-01 【1位】ドクターケイ ABC-G ピールウォッシュ（40票） しっとり 毛穴ケア 1回当たり￥74 フォーム つるんとクリアな肌に洗い上げる角質ケア泡洗顔 グリコール酸が角栓詰まりや古い角質を柔らかくし、アミノ酸由来の洗浄成分が過剰な皮脂や汚れを優しくオフ。レチノールやナイアシンアミド、グルタチオンなど、話題の成分もふんだんに配合した、美容クリニックならではの処方に美容のプロも大満足。 「1本使い切る頃、あごのザラつきが軽減！ 優しくも確実な効果を実感。」（エディター 大塚真里さん） 「1分程肌上におくパック洗顔のように使うのがお気に入りです。よりツルツル＆しっとりとした後肌を実感することができます。」（美容エディター 黒木由梨さん） 「後肌のしっとり感が最高。ストレスフリーで洗えます。」（ヘア＆メイクアップアーティスト 石川ユウキさん） 価格：￥4,400 容量：200ml 発売日：2024-07-30",[],[]
八木勇征さん（FANTASTICS）「俳優の仕事が今、本当に楽しい」｜映画『矢野くんの普通の日々』スペシャルインタビュー（美的.com）,https://news.yahoo.co.jp/articles/4edde65a87d6ffe9a8b027af5b170e87ca777074,https://newsatcl-pctr.c.yimg.jp/t/amd-img/20241207-00010004-biteki-000-1-view.jpg?exp=10800,2024-12-07T08:20:02+09:00,2024-12-07T08:20:02+09:00,美的.com,biteki,美的.com,2606,YUSEI YAGI SPECIAL INTERVIEW 当たり前の日常に感謝することで、心が豊かになる気がする 八木さんの朝は、リビングでお香を焚くことから始まる。 「寝室ではアロマスプレー、リビングではお香と決めているんです。最近、（メンバーの中島）颯太が教えてくれた京都の木蓮のお香がすごく好きで。お香を焚くと時間がゆっくり流れてエモーショナルにもなるし、清められている感じがあります。元々、畳とかおばあちゃんちとかの香りが好きなのですが、和の香りっていいですね！」 【写真3枚】この記事で紹介した、八木勇征さん（FANTASTICS）のアナザーショットはこちらから 時には嫌なことから逃げる。気負いすぎず頑張りたい 心地いい朝を積み重ねて、今年はFANTASTICSとしても、俳優としても飛躍の年に。新曲『Yellow Yellow』が主題歌となり、単独初主演作となった公開中の映画『矢野くんの普通の日々』では、なぜか不運に巻き込まれてしまう矢野くんを好演。すぐにつまずいたりするような矢野くんを運動神経のいい八木さんが演じるのは難しかったのでは…？ 「日常は矢野くんにとってはトラップだらけなので、動きを自然に見せることは本当に難しかったです。転ぶときって、つまずいた瞬間に転げる、動揺するといった心身の動きが一気に来ることに気づき、その中でどこの動きを見せ場にするかなど、より深く考えてお芝居ができた気がします。矢野くんは不運だらけですが、何ひとつ嫌味なところがないんですよ。うそも駆け引きもない。だからこそ、恋を知ったときにその思いに正直になれるんですよね。矢野くんが恋をするのはしっかり者の吉田さん。僕はしっかりしている女性がちょっと抜けている瞬間を見ちゃったりするとぐっと来ます」 不運体質だからこそ普通の日常を欲しているピュアな矢野くんを演じて、八木さんの中でも大切にしたいことへの気づきが。 「日常を当たり前のように過ごしていますが、今日みたいに撮影して、お話を聞いてくれる皆さんがいるから記事にしてもらえますし、こういう瞬間も当たり前ではないのだと改めて感じます。日々の出来事に感謝していかなくてはと思いますし、そうすると自分の心も豊かになれるような気がします。この映画でそんな気持ちになってくれたらうれしいですし、そういう人が増えたら、この世から争いもなくなるのかなと本気で思うんです。ちなみに、僕は普段、嫌なことはすぐ忘れるタイプです。覚えていてもいいことはないと思うから。何かをなそうと頑張る中で大事なことさえわかっていたら、時にはあえて逃げてもいいと思うんです。…と思っていたのですが、最近、『今日ドジったな』という記憶が残っていることがあるんですよ。僕の中の矢野くんを早くクランクアップさせないとライブで転びそうです（笑）」 「いつか挑戦できたら」と思っていた俳優の仕事が今、「本当に楽しい」という八木さん。座長を務めることも増え、俳優としても少しずつ手応えを感じている。 「これまでは現場で先輩方の背中を見ながら勉強させていただく日々で、そこで学んだひとつひとつのピースがはまっていく感覚が今年はありました。僕自身が座長となる現場でもあまり気負わずに、『あの現場、すごく楽しかったね』と思ってもらえるような雰囲気を作れたらと思って臨んでいます。俳優活動もまだ浅い中で多くの濃い体験をさせてもらっていることは本当にありがたいですし、気負いすぎず頑張りたいです」 睡眠の大切さを実感。 “めか活”もしてます 仕事では「軽くベースメイクをする程度」という肌はナチュラルな輝きを放ち、その美しさに魅せられる。スキンケアはクリームや美容液を使わず、「とろっとしたテクスチャーの化粧水をたっぷり」つけてケアをしているそう。そんな八木さんも、多忙な日々で睡眠がたりていない時期は肌や体に不調を感じ、初めてしんどいと思ったことが。 「気づくと疲れてぼーっとしてしまうことがあって、頼れる兄貴分の山田涼介くんに珍しく弱音を吐いたりしていました。それが、ある日を境にぱたっと元気になって。よく考えたら、その時期から睡眠をしっかりとれていたんですよ。やっぱりちゃんと寝て、体を整えるって大事ですね。今は朝と夜、マルチビタミンなどのサプリを飲んでいます。あと、僕は海藻類がめちゃくちゃ大好きで、めかぶやもずくが定食についてくると、それだけで気持ちが潤うんですよ。最近、ついにめかぶをもち歩き始めました（笑）。いつもカバンに入っています。コンビニで売っている3個パックのものがシンプルで好き。元々地毛は強い方ですが、仕事でブリーチしてもわりと傷みにくいのは“めか活”のおかげかな。コツコツ積み重ねるって本当に大事ですね」 「八木勇征になりたい」という女性からの声が多いことも、「性別を超えたものを感じて、めちゃくちゃうれしい！」。そんな八木さんが美しさを感じるのは「シルエット」。 「その人らしい雰囲気や佇いが表れる部分である気がして。猫背とか、腰が軽く曲がっていてもカッコよかったりもするんですよね。美しさはその人らしさっていうのはそういうことなのかなって。また、人もモノも、情熱を感じられると美しいなと思います。’25年はアリーナツアーもしたいし、その先にはドームツアーも目標。俳優としては、皆さんの心に残るような存在になれるよう、情熱的に頑張りたいです！」 PROFILE やぎ・ゆうせい／1997年東京都生まれ。ダンス&ボーカルグループ・FANTASTICSのボーカル。’21年のドラマ『美しい彼』で注目を集め、ドラマ『南くんが恋人!?』など話題作に多く出演。主演映画『僕らは人生で一回だけ魔法が使える』が’25年2月21日に公開予定。FANTASTICSのシングル『Got Boost ?』が『仮面ライダーガヴ』（テレビ朝日系、毎週日曜9時～）の主題歌として1年間起用されることも話題に。 INFORMATION 映画『矢野くんの普通の日々』 矢野くんは毎朝ケガだらけで登校してくる。実は超不運体質で普通の高校生活を送れていないことを知ったクラス委員長の吉田さんは、彼を全力でサポートし始める…。田村結衣の同名コミックを映画化。 監督：新城毅彦 出演：八木勇征、池端杏慈、中村海人ほか 公開中,[],[]
佐久間由衣さん「できることはすべて出し切りたい」｜舞台『ヴェニスの商人』スペシャルインタビュー（美的.com）,https://news.yahoo.co.jp/articles/de3e4e9f7f1246792bd88324e116bb55e0150182,https://newsatcl-pctr.c.yimg.jp/t/amd-img/20241207-00010003-biteki-000-1-view.jpg?exp=10800,2024-12-07T08:10:28+09:00,2024-12-07T08:10:28+09:00,美的.com,biteki,美的.com,963,佐久間由衣さん｜時々“ちゃんとグレる”とモヤモヤが成仏して自然と元気になれるんです 佐久間由衣さん 舞台『ヴェニスの商人』への出演オファーが来たのは、「役者としての未熟さを痛感していた」頃だった。 【写真2枚】この記事で紹介した、佐久間由衣さん出演の『ヴェニスの商人』の写真はこちらからチェック！ 「初舞台は、自分のお芝居に手応えを感じることができないまま終わってしまいました。当時は“できないと思われてはいけない”という思いから誰にも相談できず、自分を追い込んでいた感じがありました。その後、わからないことも恥ずかしがらず、素直に伝えられるようになると、前向きに取り組むことができるようになった気がします。今作でも皆さんに教えを請いながら作品を作り上げていけることが楽しみです」 有名な「肉1ポンド」の契約を描くシェイクスピアの痛快喜劇で演じるのは、聡明な女性、ポーシャ。彼女が“慈悲”について語るシーンは、物語後半の見せ場のひとつ。 「ポーシャの正しいと思うことをまっすぐに信じる勇気、エネルギッシュで自立した女性の強さが伝わるように演じられたら。シェイクスピア作品は敷居が高い印象でしたが、今作はエンタメ性が高く、その中に込められた時代背景や押さえつけられている人々の思いをしっかり理解した上で演じたいです。長台ぜりふ詞も多くて緊張しますが、うっとりするような美しい台詞が多く、登場人物の感情や考えに共感できる部分も多いので、できることはすべて出し切りたいです」 内面の美しさは表情にも表れる。ナチュラルな美肌、スラリとしたスタイルも素敵な佐久間さん。落ち込んだり、嫌なことがあると「自分を甘やかす時間をもつ」そう。 「しっかりヤケ食いして、ちゃんと“グレる”とモヤモヤが成仏して気持ちが切り替わり、また頑張ろうと思えるんです。私はパフェなどのスイーツを食べることが多いです（笑）」 家にいる時間が長かった時期、夕日の美しさに癒されたことが。 「オレンジ色の光景がとても美しく、日が昇って沈むという繰り返す営みを感じると救われる部分がありました。そういう日常をしっかり感じながら、適度に好奇心を刺激しながら生活をして、元気に過ごせるための筋力をつけていきたいです。心も体も、お芝居も。筋肉は裏切らない気がしますから（笑）,[],[]
リピ買い必至！美容賢者が厳選した【プチプラクレンジング】TOP3｜『美的』2024年下半期ベストコスメ（美的.com）,https://news.yahoo.co.jp/articles/9a6abdb9c84361051c77228ca0fbf75d4371d2cd,https://newsatcl-pctr.c.yimg.jp/t/amd-img/20241207-00010002-biteki-000-1-view.jpg?exp=10800,2024-12-07T08:10:15+09:00,2024-12-07T08:10:15+09:00,美的.com,biteki,美的.com,755,"【3位】常盤薬品工業 ワセリズム オイルジェルクレンズ（11票） 常盤薬品工業 ワセリズム オイルジェルクレンズ しっとり 乾燥ケア ジェル ゆらぎ肌にも安心の柔らかジェル 「とろっと厚みのある質感がクッションになり、摩擦レスに優しくメイクオフができる使用感が最高！」（ビューティエディター 高木美伽さん） 【写真3枚】この記事で紹介した、『美的』2024年下半期ベストコスメ【プチプラクレンジング】2位と1位はこちらからチェック 価格：￥1,320 容量：130g 発売日：2024-09-03 【2位】コーセー ファシオ 速攻落ち マスカラ リムーバー（18票） まつ毛専用 ウォータープルーフも速攻落ち！ 「マスカラにさっと絡ませるだけで、驚く程簡単にオフできる。まつげを労（いた）わるケア発想もうれしい♪」（ヘア＆メイクアップアーティスト 長井 かおりさん） 価格：￥924（編集部調べ） 容量：6.5ml 発売日：2024-07-16 【1位】花王 ビオレ ザ クレンズ オイルメイク落とし モイスト（19票） しっとり 乾燥ケア 1回当たり￥14 オイル つけた瞬間からメイクを浮かせてするん落ち！ メイク落としをより心地よい習慣にするため開発された、肌当たり柔らかなとろみオイルを採用。くるくるなじませなくてもすすぎと共にメイクが落ち、しっとり洗い上げる。 「とろりとした質感のオイルで摩擦ゼロ。スルスルと落ちる驚異のクレンジング力＆洗い上がりのモイスト感が心地よく、リピ買いしました！」（美容エディター 小内 衣子さん） 「早落ちなのに大切なバリア機能は守る優秀さ」（ヘア＆メイクアップアーティスト 加勢翼さん） 価格：￥1,298（編集部調べ） 容量：190ml 発売日：2024-09-07",[],[]
