headline,mainEntityOfPage,image,datePublished,dateModified,author,media_en,media_jp,str_count,body,images,external_links
劇団はみだしぼっちが正義の味方軸にした社会風刺劇「魔法少女マジョリティ」（ステージナタリー）,https://news.yahoo.co.jp/articles/b463ede3563791b8dcf918c5b626067ae240447b,https://newsatcl-pctr.c.yimg.jp/t/amd-img/20260329-00000095-natalies-000-1-view.jpg?exp=10800,2026-03-29T18:48:10+09:00,2026-03-29T18:48:10+09:00,ステージナタリー,natalies,ステージナタリー,462,劇団はみだしぼっち第12回公演「魔法少女マジョリティ」チラシ表 劇団はみだしぼっち第12回公演「魔法少女マジョリティ」が4月23日から25日まで東京・阿佐ヶ谷シアターシャインにて上演される。 【画像】劇団はみだしぼっち第12回公演「魔法少女マジョリティ」チラシ裏（他1件） 劇団はみだしぼっちは、2012年に大阪芸術大学の学生を中心として旗揚げされた劇団。今回は多様性ブームが去った20XX年の日本を舞台に、正義の味方・魔法少女マジョリティを軸にした社会風刺劇が展開する。 脚本・演出を渡部佑美が担当。出演者にはみあ朝子、千葉ほのか、寺田明子、おりおん。が名を連ね、高森麗妃が声の出演をする。 ■ 劇団はみだしぼっち第12回公演「魔法少女マジョリティ」 □ 開催日程・会場 2026年4月23日（木）～25日（土） 東京都 阿佐ヶ谷シアターシャイン □ スタッフ 脚本・演出：渡部佑美 □ 出演 みあ朝子 / 千葉ほのか / 寺田明子 / おりおん。 / 高森麗妃（声の出演） ※U-30チケット、学生割引、障害者割引あり。,[],[]
なかがわ・なかがわのSF短編企画「MOVE」4月は「チャルの砂時計」「ソラノマド」「ステンドグラスと嘘」（ステージナタリー）,https://news.yahoo.co.jp/articles/ace0a2560674acdaf308f54b866c5a5d4e4cb381,https://newsatcl-pctr.c.yimg.jp/t/amd-img/20260329-00000088-natalies-000-1-view.jpg?exp=10800,2026-03-29T18:00:11+09:00,2026-03-29T18:00:11+09:00,ステージナタリー,natalies,ステージナタリー,574,朗読×音楽なかがわ・なかがわ「MOVE vol.2」チラシ表 朗読×音楽なかがわ・なかがわ「MOVE vol.2」が4月17日から19日まで東京・アルネ543にて上演される。 【画像】朗読×音楽なかがわ・なかがわ「MOVE vol.2」チラシ裏（他1件） なかがわ・なかがわは、同姓同名の2人の中川えりかによるユニット。「MOVE」は海に侵食されたアジアから逃げるように宇宙船に乗った人たちを描く、SF短編作品を上演する新企画で、vol.2では「チャルの砂時計」「ソラノマド」「ステンドグラスと嘘」を披露する。作劇を葛山陽平、演出を奥田悟史、中川が構成、音楽を葛山と日向ぼっこが担当する。 出演者には中川、葛山、塚本千代、岩下政之、大力、小島ことり、有馬綾香、川本実依、多田祥太朗、牛島杏、土井飛雄馬、羽瀬水月が名を連ねた。 ■ 朗読×音楽なかがわ・なかがわ「MOVE vol.2」 □ 開催日程・会場 2026年4月17日（金）～19日（日） 東京都 アルネ543 □ スタッフ 作・音楽：葛山陽平 演出：奥田悟史 構成：中川えりか 音楽：日向ぼっこ □ 出演 中川えりか / 葛山陽平 / 塚本千代 / 岩下政之 / 大力 / 小島ことり / 有馬綾香 / 川本実依 / 多田祥太朗 / 牛島杏 / 土井飛雄馬 / 羽瀬水月 ※一部Wキャスト。,[],[]
宮尾俊太郎が演出・再振付、熊川哲也 K-BALLET TOKYO「パリの炎」（ステージナタリー）,https://news.yahoo.co.jp/articles/58a145516b233cbc2f59ee0fd74d4211c965eb95,https://newsatcl-pctr.c.yimg.jp/t/amd-img/20260329-00000068-natalies-000-1-view.jpg?exp=10800,2026-03-29T15:45:10+09:00,2026-03-29T15:45:10+09:00,ステージナタリー,natalies,ステージナタリー,915,Daiwa House PRESENTS 熊川哲也 K-BALLET TOKYO Spring Tour 2026「パリの炎」ビジュアル ©︎Yumiko Inoue Daiwa House PRESENTS 熊川哲也 K-BALLET TOKYO Spring Tour 2026「パリの炎」が5月から6月にかけて東京・大阪で上演される。 これは、昨年K-BALLET TOKYOの芸術監督に就任した宮尾俊太郎が演出・再振付を手掛ける初の全幕バレエプロダクション。18世紀フランス革命の希望と絶望、狂気を描いた本作は、1932年、旧ソ連で初演された。本プロダクションでは、ロシア版にはないストーリーラインを加えることで、物語に新たな起伏を持たせている。ジャンヌ役をボストン・バレエ プリンシパルの菅井円加、岩井優花、日高世菜、長尾美音、フィリップ役をボリショイ・バレエ プリンシパルのドミトリー・スミレフスキー、山本雅也、山田博貴が務める。 公演は5月23・24日、30・31日、6月5日から7日、13・14日に東京・Bunkamuraオーチャードホール、5月26・27日に大阪フェスティバルホールで行われる。 ■ Daiwa House PRESENTS 熊川哲也 K-BALLET TOKYO Spring Tour 2026「パリの炎」 □ 開催日程・会場 2026年5月23日（土）・24日（日） 東京都 Bunkamuraオーチャードホール 2026年5月26日（火）・27日（水） 大阪府 フェスティバルホール 2026年5月30日（土）～6月14日（日） 東京都 Bunkamuraオーチャードホール □ スタッフ 演出・再振付：宮尾俊太郎 原振付：ワシリー・ワイノーネン □ 出演 ジャンヌ：菅井円加 / 岩井優花 / 日高世菜 / 長尾美音 フィリップ：ドミトリー・スミレフスキー / 山本雅也 / 山田博貴 ナポレオン：栗原柊 / 高橋真之 / 山田博貴 ジェローム：石橋奨也 / 武井隼人 / 田中大智 アデリーヌ：長尾美音 / 島村彩 / 原美咲 ボルガル侯爵：堀内將平 / ニコライ・ヴィユウジャーニン,[],[]
ミュージカル「ヘタリア」10周年記念展が東京・大阪で開催、愛知・福岡でポップアップショップも（ステージナタリー）,https://news.yahoo.co.jp/articles/aa695bacf30bf63b063aae8b260987906a4bea7b,https://newsatcl-pctr.c.yimg.jp/t/amd-img/20260329-00000055-natalies-000-1-view.jpg?exp=10800,2026-03-29T14:30:11+09:00,2026-03-29T14:30:11+09:00,ステージナタリー,natalies,ステージナタリー,1174,「ミュージカル『ヘタリア』10th Anniversary Museum」ビジュアル ミュージカル「ヘタリア」のシリーズ10周年を記念した企画展「ミュージカル『ヘタリア』10th Anniversary Museum」が、5月23日から6月14日まで東京・hmv museum 渋谷5、20日から7月5日まで大阪・hmv museum なんばにて開催される。 【画像】「ミュージカル『ヘタリア』10th Anniversary Museum」先着入場特典（他2件） 本展では、キャストの着用衣裳や舞台写真の展示、会場限定のコメント動画の上映などが実施される。先着入場特典として撮り下ろしカットを使用した全18種のピクチャーチケットが用意されており、来場者はイタリアやドイツらのAグループかスペインやロマーノらのBグループのいずれかを選択し、そのグループからランダムで1枚受け取ることができる。 会場内では本展の開催を記念したオリジナルグッズの販売も行われ、ブロマイドやアクリルスタンド、アクリルバナーカード、カプセルトイ、ネームステッカーマシンなどがラインナップされた。なお、一部グッズ・日程では購入制限が設けられているため特設サイトで確認しよう。企画展の入場チケットは現在、日時指定券が販売されているほか、当日券も用意される予定だ。 さらに本展の終了後には、入場無料のポップアップショップが愛知・福岡を巡回。こちらではグッズ販売などが行われる予定だ。ポップアップショップは7月11日から20日まで愛知・HMV 栄、8月1日から9日まで福岡・HMV&BOOKS HAKATAにて開催される。 なお、シリーズ10周年記念ライブツアー「10th Anniversaryミュージカル『ヘタリア～The World Concert～』アリーナLIVE」が4月18・19日に東京・京王アリーナ TOKYO、29日に兵庫・GLION ARENA KOBEにて開催される。 ■ 「ミュージカル『ヘタリア』10th Anniversary Museum」 □ 開催日時・場所 2026年5月23日（土）～6月14日（日） 東京都 hmv museum 渋谷5（HMV&BOOKS SHIBUYA 5F） 2026年6月20日（土）～7月5日（日） 大阪府 hmv museum なんば（HMV&BOOKS NAMBA 店内） ■ 「ミュージカル『ヘタリア』10th Anniversary Museum」POP UP SHOP □ 開催日時・場所 2026年7月11日（土）～20日（月・祝） 愛知県 HMV 栄 福岡会場 2026年8月1日（土）～9日（日） 福岡県 HMV&BOOKS HAKATA ©日丸屋秀和／集英社・ミュージカル「ヘタリアWC」製作委員会,[],[]
かまどキッチン3年ぶりの劇場公演は“カードゲーム演劇”「不安の街、横切る。」（ステージナタリー）,https://news.yahoo.co.jp/articles/bb0e99b29da4bfab8ae721c53dd08adb9ea8a987,https://newsatcl-pctr.c.yimg.jp/t/amd-img/20260329-00000048-natalies-000-1-view.jpg?exp=10800,2026-03-29T14:00:10+09:00,2026-03-29T14:00:10+09:00,ステージナタリー,natalies,ステージナタリー,585,かまどキッチン 雑遊における公演「不安の街、横切る。」ビジュアル かまどキッチン 雑遊における公演「不安の街、横切る。」が5月1日から5日に東京・雑遊にて上演される。 これは、かまどキッチンの3年ぶりとなる劇場公演。秋葉原駅前店だが末広町駅前にあるカードショップ カードジョイン秋葉原駅前店を舞台に、“カードゲーム演劇”が繰り広げられる。 作・演出を手がける児玉健吾は、上演に向けて、「大好きなトレーディングカードゲーム。かれこれ演劇よりも⻑い付き合いでして、最近は専門家として声がかかることもあるぐらいなんですが、ありがたいことに演劇作品として立ち上げる機会をいただきました。三年振りの劇場公演です。多くの方の力をお借りしながらえいやと立ち上がり、歩みを進めております。楽しくもヒリつくカードゲームの魔力を詰め込んだので、劇場で体験していただけますと幸いです」とコメントした。 出演者には立蔵葉子、⻑井健一、中村亮太、波多野伶奈、藤家矢麻刀、丙次、宝保里実、山田遥野が名を連ねた。 ■ かまどキッチン 雑遊における公演「不安の街、横切る。」 □ 開催日程・会場 2026年5月1日（金）～5日（火・祝） 東京都 雑遊 □ スタッフ 作・演出：児玉健吾 □ 出演 立蔵葉子 / 長井健一 / 中村亮太 / 波多野伶奈 / 藤家矢麻刀 / 丙次 / 宝保里実 / 山田遥野,[],[]
GOODEARTH presents 兎座番外公演「脳天ハイマー」が名古屋へ（ステージナタリー）,https://news.yahoo.co.jp/articles/dca7845f00724d1f6bf1625b8d01347357ec2ec8,https://newsatcl-pctr.c.yimg.jp/t/amd-img/20260329-00000033-natalies-000-1-view.jpg?exp=10800,2026-03-29T12:42:10+09:00,2026-03-29T12:42:10+09:00,ステージナタリー,natalies,ステージナタリー,522,GOODEARTH presents 兎座番外公演「脳天ハイマー」チラシ表 GOODEARTH presents 兎座番外公演「脳天ハイマー」が4月16日から19日まで愛知・愛知県芸術劇場 小ホールにて上演される。 【画像】GOODEARTH presents 兎座番外公演「脳天ハイマー」チラシ裏（他1件） 兎座の藤原珠恵が脚本・演出を手がけた「脳天ハイマー」は、小さな介護施設を舞台に、さまざまな生き方を描く作品。2023年に東京にて兎座で初演され、その後、GOODEARTHが主催に参加し上演を重ねている。今回は小林愛里、藤原珠恵、古川奈苗、テジュ、江間直子、ジョニー高山、松本みゆき、林新太、佐藤正和、小林美江、にゃん原律多、外波山文明が名を連ねた。 ■ GOODEARTH presents 兎座番外公演「脳天ハイマー」 □ 開催日程・会場 2026年4月16日（木）～19日（日） 愛知県 愛知県芸術劇場 小ホール □ スタッフ 脚本・演出：藤原珠恵 □ 出演 小林愛里 / 藤原珠恵 / 古川奈苗 / テジュ / 江間直子 / ジョニー高山 / 松本みゆき / 林新太 / 佐藤正和 / 小林美江 / にゃん原律多 / 外波山文明,[],[]
内藤ゆきの“自分自身の話”「春が来る」演出にウンゲツィーファ・本橋龍（ステージナタリー）,https://news.yahoo.co.jp/articles/6f4c296178960517bee91bf422a38a5541aa5d09,https://newsatcl-pctr.c.yimg.jp/t/amd-img/20260329-00000021-natalies-000-1-view.jpg?exp=10800,2026-03-29T11:31:10+09:00,2026-03-29T11:31:10+09:00,ステージナタリー,natalies,ステージナタリー,594,内藤ゆき企画 第2回公演「春が来る」チラシ表 内藤ゆき企画 第2回公演「春が来る」が5月28日から31日まで東京・SCOOLにて上演される。 【画像】内藤ゆき企画 第2回公演「春が来る」出演者（他2件） これは、俳優の内藤ゆきが2024年に発足させた個人企画。第1作から約1年半ぶりの公演となる今回は、脚本を内藤、脚本協力・演出をウンゲツィーファの本橋龍が手がける。 上演に向けて内藤は「こんにちは。内藤ゆきです。この度、第二回公演をやれることになりました。私にとっては人生で二度目の本を書くことになったのです。が、すでに苦しくてうっすら後悔すらしています。文字通り頭を抱えています。だけど演劇は楽しいものだと、遊びだと忘れないでクヨクヨしたいと思います。何より、素敵な方たちが参加してくださることになったので楽しみが勝っていることは確かです。また第一回目公演・炊飯器でお米を炊いて炊けたら終わる演劇『夏の毛になる』同様、自分自身の話しになるかと思います。よろしければ観にいらしてください」とコメントした。出演者は内藤のほか、西山真来、日和下駄が名を連ねている。 ■ 内藤ゆき企画 第2回公演「春が来る」 □ 開催日程・会場 2026年5月28日（木）～31日（日） 東京都 SCOOL □ スタッフ 脚本：内藤ゆき 脚本協力・演出：本橋龍 □ 出演 内藤ゆき / 西山真来 / 日和下駄,[],[]
