headline,mainEntityOfPage,image,datePublished,dateModified,author,media_en,media_jp,str_count,body,images,external_links
立ち寄りたくなる新店。発酵バター香る、サクッともっちりクロワッサン（東京・小伝馬町）（食べログマガジン）,https://news.yahoo.co.jp/articles/0ae6d5e04f7d55205b3ae59c3a0bee533fbdfb2d,https://newsatcl-pctr.c.yimg.jp/t/amd-img/20260414-00010006-tabelog-000-1-view.jpg?exp=10800,2026-04-14T06:34:02+09:00,2026-04-14T06:34:02+09:00,食べログマガジン,tabelog,食べログマガジン,1020,〈New Open News〉 毎日、たくさんの新しいお店が登録されている「食べログ」。そんな「食べログ」のデータベースの中でも、オープン早々、高い評価の口コミがあったり、多くの「保存」をされたりしている『注目のお店』を食いしん坊ライターが紹介します。早くもお店に訪問した食べログレビュアーのコメントも掲載！ CROISSANT hifumi（東京・小伝馬町） クロワッサン ド カンパーニュ 出典：中目のやっこさんさん 2026年2月、小伝馬町駅から徒歩3分ほどの場所に、クロワッサンとデニッシュの専門店「CROISSANT hifumi」がオープンしました。同じく小伝馬町で人気を集めるベーグル専門店「123BAGEL（ヒフミベーグル）」の姉妹店として誕生した一軒です。同店が目指しているのは、日常の中でふと立ち寄りたくなるようなパン屋。焼き立ての香りに包まれながら、忙しい日常の合間にほっと一息つける、そんな場所です。 赤い壁が目を引きます 出典：ahuihouさん 赤い壁が印象的な外観は、通りを歩いていても自然と目を引く存在。店内はコンパクトながら温かみのある空間で、イートイン可能なカウンター席も用意されています。店内にはアラジンのトースターが設置されており、購入したパンをリベイクして楽しめるのも魅力の一つ。短時間で外はカリッと、中はもっちりとした理想的な焼き上がりを味わえます。 外はサクサク、中はモッチリ食感のクロワッサン 写真：お店から 同店のクロワッサン生地には、北海道産小麦とフランス産発酵バターを贅沢に使用。さらに、契約農家「岩田農園」が手掛ける島根県奥出雲産ブランド米「仁多米コシヒカリ」の米粉を合わせることで、香ばしさの中にもっちりとした食感と自然な甘みを引き出しています。 クロワッサンドカンパーニュ 出典：中目のやっこさんさん 定番メニューの「クロワッサンドカンパーニュ（田舎風クロワッサン）」380円は、その魅力をシンプルに味わえる一品。表面は軽やかにサクッと香ばしく、一口頬張ると発酵バターの豊かな香りが広がります。 あんホイップクリームサンドイッチ 写真：お店から スイーツ系では「あんホイップクリームサンドイッチ」480円も人気。北海道産小豆のこしあんを使用し、やさしい甘さのあんこと軽やかなホイップクリームが絶妙に調和します。クロワッサン生地の香ばしさと合わさり、デザート感覚で楽しめる一品です。,[],[]
祇園のママに聞く！ 京都で喫茶店の「朝食」食べるならこのお店（食べログマガジン）,https://news.yahoo.co.jp/articles/7852da637c270e1d4acd51d2897ff935ab183737,https://newsatcl-pctr.c.yimg.jp/t/amd-img/20260414-00010005-tabelog-000-1-view.jpg?exp=10800,2026-04-14T06:33:47+09:00,2026-04-14T06:33:47+09:00,食べログマガジン,tabelog,食べログマガジン,1121,"〈教えて！ 祇園の宏美ママ〉 生粋の京都人に普段使いのお店を教えてもらいたい！ そんな企画を叶えるべく、ナビゲーターをお願いしたのは、なんと祇園のお茶屋が母方の実家だったという宏美ママ。幼少期から京都のど真ん中で呼吸してきたホンモノの京都通に、とっておきのお店をおすすめしてもらいましょう。 喫茶店の「朝食」食べるなら？ 京都はおいしい朝食の宝庫。ホテルの朝食も良いけれど、街に出て個性豊かな朝食を楽しむ人も増えています。 今回はとっておきの喫茶店の「朝食」を宏美ママに教えてもらいました。 コーヒーハウス マキ（出町柳） モーニングセット880円 写真：お店から 1軒目は出町柳にある「コーヒーハウス マキ」。朝食の「モーニングセット」は880円、「モーニングトースト」は720円で各ブレンドコーヒー付き。 宏美ママ 「地元民の定番喫茶店の一軒かと。ユニークな盛り付けで、バタートーストにたっぷりの野菜サラダ、ポテトサラダ、ゆで卵、ハム。お箸がついてるのも好きなポイントどす！」 外観 出典：カフェモカ男さん 宏美ママ 「自家焙煎のオリジナルブレンドコーヒーも心地よく。モーニングは12時まで、数量限定、なくなり次第終了」 コーヒーハウス マキ 住所： 京都府京都市上京区河原町今出川上ル青龍町211 TEL： 075-222-2460 MARTIN（神宮丸太町） 内観 出典：ジョバンニ梁川さん 2軒目は神宮丸太町の「MARTIN」。おしゃれな店内でいただくカフェメニューは旅行者からも人気。 宏美ママ 「こちらは海外のカフェのようなお店。ブレックファースト to ブランチは9時から14時までと長時間なのがうれしおす。メニューも5種あり」 アボカドトーストプレート1,700円 出典：ぶーめいさん 宏美ママ 「アボカドトーストプレートは、トーストにクリームチーズとアボカド、その上にスパイス、野菜料理、ベーコン、卵の下にマッシュポテトも！ セットドリンクはバナナジュースやレモネードなどもあります。お支払いは現金のみ」 MARTIN 住所： 京都府京都市上京区荒神口通河原町東入亀屋町128 教えてくれた人 古川宏美（宏美ママ） 1969年京都生まれ。平安女学院高校、追手門学院大学卒業。会社員3年の後、母方の家業、祇園甲部のお茶屋を継ぐ（4代目の現在は紹介制のお座敷バー）。子供の頃から食いしん坊話が親族内にいくつもあり。お酒も大好き。店の周年に来てもらうほど、ポンキッキ時代からガチャピン偏愛。趣味は長唄三味線、華道、観劇（歌舞伎、古典芸能、歌劇、ミュージカル、新喜劇等々）。 ※価格は全て税込 文：古川宏美・食べログマガジン編集部",[],[]
あの「渡辺料理店」で腕を磨いたシェフの遊び心ある料理に惚れる！（食べログマガジン）,https://news.yahoo.co.jp/articles/a55984750df6e3144fb9a24c866601d0b3012271,https://newsatcl-pctr.c.yimg.jp/t/amd-img/20260414-00010004-tabelog-000-1-view.jpg?exp=10800,2026-04-14T06:33:18+09:00,2026-04-14T06:33:18+09:00,食べログマガジン,tabelog,食べログマガジン,1181,"【噂の新店】Bistrot tercera ビストロが人形町にオープン フランス料理好きなら「銀座レカン」「渡辺料理店」出身と聞けば、その店に行かずにはいられない！ そこで出会うのはどちらとも違うが、一口で惚れてしまう料理。いつでも気軽に立ち寄ってもらいたいと予約で満席にしない、うれしい配慮のあるビストロが人形町にオープンしました。 人形町のオアシス的存在となるビストロが誕生！ スペイン語で3番目という意味の店名 昨年秋、東京の食のメッカ、人形町に「銀座レカン」「渡辺料理店」出身のシェフの店がオープンするらしいと食業界やフーディーたちの話題が集中、オープンするやいなや予約困難店となった「Bistrot tercera」。一人で1階と2階の料理を作るのはさぞかし大変なことなのでは？と聞くと「働いた2つの店がすごすぎたので、全然余裕です」と当の田島優己シェフはどこ吹く風。 メニューは壁掛け こちらは好きなものを好きなだけのアラカルトスタイル。季節感を第一に考え、産地直送の食材を使った料理は、どれもワインと合わせたくなります。「まずは『シャリュキュトリ盛り合わせ』とワインで、何を食べようかゆっくり考えていただけたら」と田島さん。 田島優己シェフ 学生時代にアルバイトで入った「銀座レカン」にそのまま就職した田島さん。3年経った頃にコロナ禍でレストランの在り方を考えさせられ、フリーランスで出張料理人となりました。さまざまなシチュエーションで料理をするという経験を積み1年ほど経った頃、「銀座レカン」のシェフだった渡邉幸司氏と再会。「渡辺料理店」の立ち上げからスーシェフとして活躍し、2025年9月「Bistrot tercera」のシェフに就きました。 2階フロアー できるだけ自分の力でと自ら塗装した壁やカウンターは、年月が経ったような落ち着いた色調。やわらかで温かみのある照明にも癒やされます。人形町の街並みにしっくりくる、ほんわかした雰囲気の心和む空間です。 奇を衒わずにじんわりとおいしさが後を引く料理 「シャリュキュトリ盛り合わせ」（4,400円）※単品は各1,300円 田島さんのおすすめに従って「シャリュキュトリ盛り合わせ」とワインでスタート。島根県で出会い脂の甘みと力強い肉質に惚れ込んだという「石見ポーク」。「石見ポークリエット（写真右上）」は、脂が溶けてねっとりとしながらも肉の繊維が感じられ、「石見ポークハム（写真右下）」は舌の上で溶ける脂の甘さがたまりません。時間が経つごとに甘みが増す「石見ポークパテ（写真左上）」はワインとともに味の変化を楽しみたい。出色は「鶏レバーテリーヌ（写真左下）」。このきめの細かさとなめらかさは唯一無二です。「ミキサーで回さずひたすら裏漉ししています」と田島さん。かけた時間と手間は嘘をつきません。",[],[]
隠れた人気メニューがまさかのランチに！ 八重洲の人気鉄板焼き店で味わう、山形牛のハンバーグランチ（食べログマガジン）,https://news.yahoo.co.jp/articles/c091a6de6ec05d420dea27fd0227d04d3c9f2f68,https://newsatcl-pctr.c.yimg.jp/t/amd-img/20260414-00010003-tabelog-000-1-view.jpg?exp=10800,2026-04-14T06:32:27+09:00,2026-04-14T06:32:27+09:00,食べログマガジン,tabelog,食べログマガジン,1043,"〈ニュースなランチ〉 山形牛のハンバーグランチ 毎日食べる「ランチ」にどれだけ情熱を注げるか。それが人生の幸福度を左右すると信じて疑わない、編集部員や食いしん坊ライターによるランチ連載。話題の新店から老舗の新メニューまで、おすすめのランチ情報をお届け！ 加藤牛肉店 小川のうに 「東京ミッドタウン八重洲」3階にある「加藤牛肉店 小川のうに」 厳選した山形牛のうまさで知られる神奈川・横浜の精肉屋「加藤牛肉店」。96年続く同店の3代目店主・加藤敦さんが自ら目利きし捌いた牛肉を味わえる一軒が、2023年、八重洲にオープンした「加藤牛肉店 小川のうに」だ。銀座「加藤牛肉店」、西麻布「焼肉ステーキ あつし」に続く同店では、先の2店と違いランチも営業。より手軽にとびきりの牛肉を楽しめるようになった。 メインのカウンター席 中でも特筆すべきは、昨年夏からオンメニューした「ハンバーグ」だ。実はこのハンバーグ、元々は銀座店限定の“知る人ぞ知る”隠れた人気メニューで、同店の常連でもあった、あの中華の巨匠・譚彦彬シェフも愛した逸品なのだ。それを八重洲店でもいただけるようになったというのだから見逃せない。それというのも、長らく銀座店の料理長を務めていたベテランシェフの阿部川勝さんが八重洲店に転属となったから。 シェフの阿部川勝さん 夜のコースにももちろん登場するが、ハンバーグ単品でというわけにはいかないゆえ、昼時にハンバーグだけのセットが誕生したのはありがたい限り。しかも、夜と同様、鉄板で焼き上げてくれる。カウンターに陣取れば、目の前で焼けていく臨場感と香りも楽しめるという寸法だ。ビジネス仕様のランチ接待に使われるというのも頷けよう。 「山形牛ハンバーグセット」 さて、その「山形牛ハンバーグセット」は、1個90gのまん丸ハンバーグが2個にサラダとご飯、味噌汁がついて3,000円。ハンバーグは銀座店と全く同じレシピで作っているそうだが、フライパンとオーブンで焼いていた銀座店と違い、ここでは鉄板を使用。 ハンバーグは鉄板で焼き上げることで、うまみたっぷりのふっくら食感を実現している 「熱伝導率の良い鉄板は、肉に均一に火が入ります。高温で焼き上げることで肉汁を閉じ込め、うまみを逃すことなくふっくら焼き上がるわけです」と阿部川シェフ。保温力の高さも鉄板の強み。表面に軽い焦げ目をつけ、メイラード反応を起こした時点でステーキカバーを被せて蒸し焼きにすることで、よりふっくら仕上がるわけだ。",[],[]
中目黒にある人気ステーキ店の新業態！ 有田牛の100日間カビ熟成Tボーンステーキとフレッシュなフィレの食べ比べが楽しめる（食べログマガジン）,https://news.yahoo.co.jp/articles/c5d69a7b6d132cb210577213cbbac6c339d492f0,https://newsatcl-pctr.c.yimg.jp/t/amd-img/20260414-00010002-tabelog-000-1-view.jpg?exp=10800,2026-04-14T06:32:13+09:00,2026-04-14T06:32:13+09:00,食べログマガジン,tabelog,食べログマガジン,992,"〈New Open News〉 人気ステーキ店の新業態 毎日、たくさんの新しいお店が登録されている「食べログ」。そんな「食べログ」のデータベースの中でも、オープン早々、高い評価の口コミがあったり、多くの「保存」をされたりしている『注目のお店』を食いしん坊ライターが紹介します。 J（東京・六本木） 内観 写真：お店から 2026年4月1日、六本木駅の1C出口から徒歩約1分の場所にオープンした「J」は、炭火の火入れで日本の食材の魅力を引き出すイノベーティブ・レストランです。中目黒で「T」を営むオーナーの中村純平氏が、ロケーションと景色の美しさに引かれ、この地で新たな挑戦をスタートさせました。 シェフの山家洋翼氏 写真：お店から 腕を振るうのは、世界の名店で経験を積んだ、シェフの山家洋翼氏。生粋の焼き師として、素材のポテンシャルを最大限に引き出します。サービスを担うのは、国内外の名店で研鑽を積み、三つ星クラスの現場での経験も持つキャリア40年以上のソムリエ、金丸浩之氏。料理とワインを一体で捉えるペアリングを提案してくれます。 ソムリエの金丸浩之氏 写真：お店から 料理は、18時からの一斉スタートによるコースのみ。生産者から直接仕入れたこだわりの食材を使用しています。 イチオシは、有田牛のフィレと、100日間カビ熟成Tボーンステーキの食べ比べ。2025年の国際品評会で金賞を受賞した有田牛をあえて100日間カビ熟成させ、旨みが凝縮された熟成肉と、フレッシュなフィレの両方を食べ比べできるという贅沢さ。客それぞれが本当に求めている味を発見することができます。 コース 23,000円〜 写真：お店から THE HIDEAWAYの森下直哉氏が手掛けた内装も魅力的です。映画館のようなエントランスから始まる没入感のある空間で、目の前で一皿が仕上がる11席のカウンターで記憶に残る特別な時間を過ごすことができます。 煌びやかなレセプション 写真：お店から 生産者の思いを受け継いだ、食材の数々。季節ごとにメニューも大きく変わるそうなので、訪れるたびに新しい発見と感動に出合える注目の一軒です。 ※価格は税込です。 ※記事制作時に一部AIを使用しています J 住所： 東京都港区西麻布3-1-20 Dear西麻布 8F TEL： 050-5868-5813 文：食べログマガジン編集部",[],[]
グルメな人も必ず喜ぶ！ わざわざ買いに行く価値のある「甘い系」の手土産9選（食べログマガジン）,https://news.yahoo.co.jp/articles/bcb1cb880eb44a4c42dba615a47c4efd84c8d019,https://newsatcl-pctr.c.yimg.jp/t/amd-img/20260414-00010001-tabelog-000-1-view.jpg?exp=10800,2026-04-14T06:31:57+09:00,2026-04-14T06:31:57+09:00,食べログマガジン,tabelog,食べログマガジン,1286,"ワンランク上の「甘い系」のお取り寄せ 会食やホームパーティーなどの手土産に必ず喜ばれる、ワンランク上の「甘い系」のお取り寄せをフードライターの小寺慶子さんに教えていただきました。 1. Patisserie Basique（仙川） 焼き菓子 焼き菓子 写真：お店から 小寺さん 「ここ最近のヘビロテ店。エコール辻 東京で講師をされていた店主の卓越した技が光る焼き菓子の中でもフィナンシェ生地にたっぷりのチョコレートチップを練りこんだティグレは秀作。焼き立ての菓子は日持ちはしませんが、こちらのシュークリームも口にすれば夢見心地に」 Patisserie Basique 住所： 東京都調布市仙川町1-25-4 シティハウス仙川 1F TEL： 03-5314-9904 2. LESS（恵比寿） パネットーネ GR PANETTONE（ミルクチョコレート/オレンジ/ヘーゼルナッツ）約350g 4〜5名様用 5,400円 写真：お店から 小寺さん 「イタリアでクリスマス時期に欠かせないパネットーネを一年中販売。しっとりとした生地感でひと口ごとに幸福感が高まります。シェフのオリジナルレシピはミルクチョコレートとオレンジ砂糖煮とヘーゼルナッツを用意。ボックスも可愛らしく、食べることが好きな方にお贈りすれば必ず喜んでいただけます」 LESS by Gabriele Riva & Kanako Sakakura 住所： 東京都目黒区三田1-12-24 MT3ビル 1F TEL： 03-6303-2688 3. 御菓司 紅谷（都電雑司ケ谷） 豆大福 豆大福 220円 出典：wandamanpukuさん 小寺さん 「大正13年に創業された老舗和菓子店。昨年、栗が丸ごと1粒入ったどら焼きをお土産でいただき、あまりのおいしさに仰天したのですが、午後には売り切れてしまう餡の甘さがひかえめな豆大福もおすすめ。夏のあんみつなど季節ごとに通う楽しみが」 御菓子司 紅谷 住所： 東京都豊島区南池袋2-11-4 TEL： 03-3971-3623 4. 富士見堂（青砥ほか） あんこ天米 「あんこ天米（プレーン）」6袋入 1,350円 写真：お店から 小寺さん 「最寄りの駅から少し離れた路地に佇む和菓子店。あんこ天米は夕方には売り切れてしまう人気商品で、香ばしい煎餅となめらかな舌ざわりのコンビネーションがたまりません。都心では伊勢丹新宿でも販売されていますが、こちらでも即完＆購入制限があるので入手ハードルはかなり高めです」 富士見堂 青砥本店 住所： 東京都葛飾区青戸3-25-7 TEL： 03-3604-5648 5. SOLIMONE（麻布十番） LIMONCELLO 「LIMONCELLO」7,480円 写真：お店から 小寺さん 「昼限定で営業している麻布十番のパスタ店「SOLIMONE」の自家製リモンチェッロ。これを知ってしまうと、ほかのリモンチェッロには戻れません。明るい太陽を思い起こさせるクリアな味とキレのよい甘み。キンキンに冷やして飲むのがおすすめです」",[],[]
女性シェフとして世界最多の星を持つアンヌ=ソフィー・ピックが手掛けるディオールのカフェレストランが誕生（東京・代官山）（食べログマガジン）,https://news.yahoo.co.jp/articles/ef1a89ced791d8670ffc7cf4f7c9ec728ecccb48,https://newsatcl-pctr.c.yimg.jp/t/amd-img/20260414-00010000-tabelog-000-1-view.jpg?exp=10800,2026-04-14T06:31:45+09:00,2026-04-14T06:31:45+09:00,食べログマガジン,tabelog,食べログマガジン,1329,"〈New Open News〉 ディオールのカフェレストラン 毎日、たくさんの新しいお店が登録されている「食べログ」。そんな「食べログ」のデータベースの中でも、オープン早々、高い評価の口コミがあったり、多くの「保存」をされたりしている『注目のお店』を食いしん坊ライターが紹介します。 カフェ ディオール by アンヌ＝ソフィー・ピック バンブー パビリオン（東京・代官山） 代官山に誕生した「ディオール バンブー パビリオン」 ©Daichi Ano 2026年2月12日、東京・代官山に「カフェ ディオール by アンヌ＝ソフィー・ピック バンブー パビリオン」がオープンしました。「ディオール バンブー パビリオン」内に併設された同店では、女性シェフとして世界で最も多くの星を保持するアンヌ=ソフィー・ピック氏による料理やスイーツが味わえます。 アンヌ=ソフィー・ピック氏 ©Yoko Kusano 「ディオール バンブー パビリオン」限定のサンドウィッチ「Le Pain Cousu-Main / ルパンクジュマン」5,000円は、ムッシュ ディオールが休暇を過ごしたフランス・プロヴァンス地方の「パン・バニャ」を再解釈した逸品です。 「Le Pain Cousu-Main / ルパンクジュマン」 写真：カフェ ディオール by アンヌ＝ソフィー・ピック バンブー パビリオン そば粉を加えて風味豊かに仕上げたやわらかなパンに、マリネしたマグロ、旬の野菜、バジルペーストを美しい層状にサンド。シェフの世界観が存分に反映された、奥深い味わいです。 「Le Trèfle / ルトレフル」 写真：カフェ ディオール by アンヌ＝ソフィー・ピック バンブー パビリオン 中でも特に人気なのが「ディオール バンブー パビリオン」限定のスイーツ2種類。クローバー型のケーキ「Le Trèfle / ルトレフル」5,000円は、新しくクリエイティブディレクターに就任したジョナサン・アンダーソンへの敬意を示したスイーツです。ピスタチオ風味のタルト生地を土台に、抹茶、玄米茶、エストラゴンを合わせたビスケットとムース、そして中には爽やかな柚子のコンフィが隠れています。トップには可愛らしいチョコレートのてんとう虫と、朝露のような雫が表現されており、ほろ苦さと柑橘の爽やかさが見事なハーモニーを奏でます。 「Le Cannage Sucré / ルカナージュ シュクレ」 写真：カフェ ディオール by アンヌ＝ソフィー・ピック バンブー パビリオン ディオールの象徴的な「カナージュ」柄が側面にあしらわれた「Le Cannage Sucré / ルカナージュ シュクレ」5,000円は、日本酒とみりんを使用したライスプディングがベースです。日本酒のムースの中には、イチゴと柚子のコンフィに加え、日本酒、みりん、酒粕を合わせたジュレが忍ばせてあり、甘酒のような発酵感のあるやわらかな甘さが特徴です。お米のシュトロイゼルや塩味の利いたビスケット、そしてトッピングされたカリカリの砂糖菓子とクリーミーなパンナコッタのお花が、多様な食感のコントラストを生み出しています。",[],[]
