headline,mainEntityOfPage,image,datePublished,dateModified,author,media_en,media_jp,str_count,body,images,external_links
青森県が出先機関見直し　県民局を廃止、圏域ごとに8事務所配置　2025年4月から（Web東奥）,https://news.yahoo.co.jp/articles/4dec0eabda6b1846c6782dfd8592c57ab95187cd,https://newsatcl-pctr.c.yimg.jp/t/amd-img/20241226-00000015-webtoo-000-2-view.jpg?exp=10800,2024-12-26T22:53:00+09:00,2024-12-27T14:37:03+09:00,Web東奥,webtoo,Web東奥,796,（写真：東奥日報社） 青森県は26日、現在6圏域に設置している「地域県民局」の枠組みを廃止し、来年4月から圏域ごとに「地域連携事務所」「農林水産事務所」「県土整備事務所」など八つの事務所を配置すると発表した。出先機関の体制を見直して本庁との結びつきを強め、より専門性を発揮できるようにする。宮下宗一郎知事は同日の年末記者会見で「県の政策テーマと連動した取り組みを、スピード感を持って強力に実施できるようにしたい」と述べた。 三村申吾前知事が県の出先機関を集約して創設した地域県民局は、設置から18年で姿を消すことになる。 組織の見直しに合わせ、新たに県交通・地域社会部の出先機関として地域連携事務所を6圏域に新設。地域づくり、地域交通に加え、産業や観光振興など幅広い業務を担当する。担当エリアで災害が発生した場合は、災害対策本部地方支部の機能も担う。 このほか県民局地域農林水産部は農林水産事務所に、県民局地域整備部は県土整備事務所に衣替えする。県民局県税部は県税事務所に変更し、保健所、福祉事務所、児童相談所も県内6カ所に配置する。県民局環境管理部は環境管理事務所とし、青森、弘前、八戸、むつの4市に置く。 地域県民局は、三村前知事が2006年4月に中南（弘前市）、三八（八戸市）、下北（むつ市）の3カ所に開設。翌07年4月に東青（青森市）、西北（五所川原市）、上北（十和田市）を追加し、6局体制となった。 出先機関を束ねて総合的な調整機能を持たせ、市町村とともに地域づくりに取り組むことを目的としていたが、宮下知事は就任以降、情報や判断を県民局でとどめることなく、本庁も共有する必要性を指摘していた。新たな体制では、各事務所が本庁の担当部局と密接に連携するとした。 県民局制度を廃止する条例案は来年2月の定例県議会に提出し、可決されれば各地の出先機関が4月から新たな名称でスタートを切る。,[],[]
飼育の土佐犬逃走、見つからず　青森・東北町（Web東奥）,https://news.yahoo.co.jp/articles/e446392280cbef7255c66e8946c91dda202d9372,https://newsatcl-pctr.c.yimg.jp/t/amd-img/default.jpg?exp=10800,2024-12-26T21:21:00+09:00,2024-12-27T11:55:47+09:00,Web東奥,webtoo,Web東奥,320,26日午前7時ごろ、青森県東北町大浦の大浦集会所付近の住民から「土佐犬が自宅敷地内に入ってきた」と通報があった。七戸署員と、東北町や県動物愛護センターの職員らが捜索したが午後5時現在、見つかっていない。けが人の情報はない。 同署などによると、土佐犬は10歳の雄で体長約130センチ、体重約40キロ。毛は赤茶色で黒い首輪をしている。近くに住む住民が飼育していたが、土佐犬が逃げたとみられる時間には外出していたという。 同町は防災無線で住民に注意を呼びかけたほか、近くの保育園や上北地区の小中学校にも連絡した。同町の担当者は「見かけても近寄らず、町や警察に連絡してほしい」と話した。 同日の捜索は午後5時で打ち切り、27日午前9時から再開する。,[],[]
暖気で雪解け　青森市内、道路ガタガタ　27日は一転真冬日に（Web東奥）,https://news.yahoo.co.jp/articles/ad41d579012e7915371c36ae9376b73f85a07593,https://newsatcl-pctr.c.yimg.jp/t/amd-img/20241226-00000013-webtoo-000-3-view.jpg?exp=10800,2024-12-26T21:03:00+09:00,2024-12-27T11:49:12+09:00,Web東奥,webtoo,Web東奥,465,雨の影響で、雪の多い道路はわだちに段差ができた＝26日午前、青森市青葉2丁目 青森県内は27日にかけて冬型の気圧配置となるため、26日の暖気とは一転、再び厳しい寒さが予想される。最高気温が0度を下回る真冬日が見込まれ、青森地方気象台は、降雪や吹雪による交通障害などに注意を促している。 26日の県内は、寒冷前線の通過や暖かい空気の流入で一時的に気温が上がり、津軽地方を中心に雨の所があった。積雪の多い青森市では道路の雪が解け、氷やシャーベット状になりでこぼこの箇所も。狭い生活道路では対向車同士がゆっくりすれ違い、歩行者は氷状態になった歩道を慎重に歩いていた。 同気象台によると、26日の各地の最高気温は、深浦7.0度、青森6.2度、むつ5.6度、八戸5.3度、弘前4.5度など。一方、27日の主な地点の予想最高気温は青森、弘前、むつが氷点下1度、深浦と八戸が0度と下がる見込み。 同日午後6時までの24時間予想降雪量は、山沿いを含む多い所で、津軽と三八上北30～50センチ、下北20～30センチ。冬型は29日ごろまで続く見通し。,[],[]
青森県　LPガス値引き、生活困窮者向け灯油購入費助成に12億円　補正予算を専決処分（Web東奥）,https://news.yahoo.co.jp/articles/e68479552e3ac26051acf0241a36593b15213410,https://newsatcl-pctr.c.yimg.jp/t/amd-img/20241226-00000012-webtoo-000-3-view.jpg?exp=10800,2024-12-26T20:31:00+09:00,2024-12-27T14:38:33+09:00,Web東奥,webtoo,Web東奥,404,（写真：東奥日報社） 青森県は26日、LPガス料金の値引きや、生活困窮世帯への灯油購入費助成として、総額12億1615万円の2024年度一般会計補正予算を専決処分した。LPガス料金は使用世帯ごとに2千円分、灯油購入費は1世帯当たり上限7千円（県負担分最大3500円）を支援する。 LPガス料金の値引き分として8億6015万円を計上。県エルピーガス協会に交付する。LPガスを使用する県内約40万世帯に対し、販売事業者が2月料金の請求時に値引きする。 灯油購入費助成には3億5600万円を計上。交付を受ける市町村が1月以降に予算化して助成する。生活困窮世帯を対象に1世帯当たり7千円を上限に支援し、県と市町村が2分の1ずつ負担する。具体的な助成額は各市町村が決める。 政府の総合経済対策に関する国補正予算の成立を受けて予算措置を決めた。補正後の一般会計予算総額は前年度同期比10.7％減の7112億3207万円。,[],[]
日航サイバー攻撃、利用客困惑　青森県内にも影響、三沢空港で最大1時間半遅れ（Web東奥）,https://news.yahoo.co.jp/articles/2cf08854e667d5b393c4451fdde3ada1a0e2cfb7,https://newsatcl-pctr.c.yimg.jp/t/amd-img/20241226-00000011-webtoo-000-3-view.jpg?exp=10800,2024-12-26T20:23:00+09:00,2024-12-27T11:50:30+09:00,Web東奥,webtoo,Web東奥,629,サイバー攻撃により不具合が発生し、混雑する日本航空のカウンター＝26日午前11時過ぎ、青森空港 日本航空（JAL）がサイバー攻撃を受け、システム障害で国内線・国際線とも遅れや航空券の販売停止などの影響が出た26日、青森県内でも青森空港や三沢空港で最大約1時間半の遅れが生じ、旅行や帰省などの足が乱れた利用客たちが困惑した。同日午後5時現在、青森県出発便は青森空港で7便、三沢空港で6便が遅れた。 JAL青森支店の担当者によると、青森空港では午前9時半ごろから搭乗手続きや航空券の販売を停止。不具合は同11時56分に解消されたが、最大34分の遅れが出た。 北海道に家族旅行に行く青森市の自営業男性（32）は「遅れが出ていることをテレビで知ったので早めに来た。限られた時間で予定を立てていたので遅延は困る」と心配そうな表情を浮かべた。 最大1時間26分の遅れが発生した三沢空港内では、昼ごろ、乗客が保安検査を受けるための列をつくった。 韓国に帰国する大学生チャン・ウー・ソンさん（24）は、空港内のアナウンスで遅延を知った。理由の説明はなかったといい「なぜ遅延しているか分からなければ不安になる。乗り換え便に間に合うだろうか」と話した。仕事で青森県を訪れ、東京に戻るという会社員男性（66）は「向こう（羽田空港）も混乱しているのだろうか。サイバー攻撃を受けての対応ということで、ある程度の遅延は仕方がない。安全な運航には支障がないようにしてもらいたい」と語った。,[],[]
青森道青森－青森東、26日夜間通行止め（Web東奥）,https://news.yahoo.co.jp/articles/4778adb67e9717f012b8c83e9b885e8ef6682210,https://newsatcl-pctr.c.yimg.jp/t/amd-img/20241226-00000010-webtoo-000-1-view.jpg?exp=10800,2024-12-26T16:40:00+09:00,2024-12-26T16:40:00+09:00,Web東奥,webtoo,Web東奥,118,（写真：東奥日報社） 東日本高速道路（ネクスコ東日本）青森管理事務所は26日午後8時から、青森自動車道の青森ジャンクション（JCT）－青森東インターチェンジ（IC）間を通行止めにすると発表した。解除予定は27日午前6時。排雪作業のため。,[],[]
【単独インタビュー】池江璃花子選手、ロス五輪「集大成に」　青森で合宿（Web東奥）,https://news.yahoo.co.jp/articles/217a6fccd7a8f525512538b7db1ab6e11c8f2944,https://newsatcl-pctr.c.yimg.jp/t/amd-img/20241226-00000009-webtoo-000-3-view.jpg?exp=10800,2024-12-26T16:00:00+09:00,2024-12-27T14:37:42+09:00,Web東奥,webtoo,Web東奥,1034,合宿に訪れたマエダアリーナ50メートルプールサイドで今後の目標などを語る池江選手＝青森市 リオデジャネイロ、東京、パリの夏季五輪に連続出場した競泳の池江璃花子選手（24）＝横浜ゴム＝がこのほど、スイミングクラブ・ルネサンスの一員として新県総合運動公園（青森市宮田）で行われた合宿に参加した。26日までの東奥日報の単独取材に対し、4年後のロサンゼルス五輪が「自分の集大成」と語った。来年の目標には、世界選手権（シンガポール）に出場し、パリ五輪で決勝進出ならなかった100メートル種目で結果を出すことを掲げた。 拠点とする豪州での大会出場を終えての青森入り。30度以上の寒暖差に「寒いな」と、青森県の第一印象を笑顔で語った。 今年4月にオープンした「マエダアリーナ50メートルプール」を初めて泳ぎ、「めちゃくちゃ泳ぎやすい。レーンをたくさん貸し切らせていただいている。水深もしっかりあり、スタート台もちゃんとあり、プールサイドも広い。全国どこにでもあるわけではない環境」と高く評価した。 「現在の課題」に話題が移ると表情が締まった。「課題しかない。5年では戻せない部分もたくさんあった」 今年9月に完全寛解を公表したが、5年前に白血病を発症。「ベッドから一歩も動けずという生活を10カ月過ごし」「筋肉もなにもない状態で一からスタート」した経緯がある。 「『自分がいた世界』にどこまで追いつけるか、未知数だが、追いつきたい。その半面、無理なんじゃないか、でもできるところまでやりたいという、いろんな感情」と打ち明ける。ただ「病気を言い訳にせず自分の力だけを信じてやるしかない。そういう気持ち」と力を込めた。 青森市出身の相馬あい選手（27）とは同じ種目でしのぎを削る仲だ。「東京五輪の選考会あたりからお互いを意識する関係」になったという。ロス五輪から50メートル種目が採用される可能性があり「お互い、しっかり50メートル種目で活躍できる選手になれれば」と語る。 県内で水泳に打ち込む子どもたちへのメッセージも。「きつい練習を続けられるのは、やっぱり水泳が好きとか、楽しいとか、そう思っている子が多いと思う。その気持ちを忘れないで」と呼びかけた。 個人種目11、リレー種目6の計17種目の日本記録を保持する日本競泳界の顔であることに変わりはない。ロス五輪まで4年。「あっという間の4年だと思う。自分が強くなれる場所、環境、トレーニングを常に追い求めていきたい」と決意を語った。,[],[]
東北町で土佐犬の目撃情報、注意呼びかけ（Web東奥）,https://news.yahoo.co.jp/articles/49c11e12ad6693423c6864b9d8a99cf876b71a69,https://newsatcl-pctr.c.yimg.jp/t/amd-img/20241226-00000008-webtoo-000-1-view.jpg?exp=10800,2024-12-26T14:51:00+09:00,2024-12-26T14:51:00+09:00,Web東奥,webtoo,Web東奥,69,（写真：東奥日報社） 東北町によると、26日午前7時半ごろ、同町大浦地区で土佐犬の目撃情報があった。町は付近の住民に注意を呼びかけている。,[],[]
青森県内のインフル患者、前週から倍増　注意報も4地域に拡大（Web東奥）,https://news.yahoo.co.jp/articles/125533f1781659836e66dd50ad97af9ea50fa43c,https://newsatcl-pctr.c.yimg.jp/t/amd-img/20241226-00000016-webtoo-000-1-view.jpg?exp=10800,2024-12-26T13:31:00+09:00,2024-12-26T13:31:00+09:00,Web東奥,webtoo,Web東奥,408,（写真：東奥日報社） 青森県は26日、青森市・東地方、弘前、八戸市・三戸地方の3保健所管内に、季節性インフルエンザ注意報を新たに発表した。継続中の上十三を含め、県内6地域中4地域で注意報レベルに到達。直近1週間（16～22日）で県内58の定点医療機関が報告した患者数は913人、1定点当たり15.74人で、前週（442人、1定点当たり7.62人）から倍増した。 新たに注意報が発表された3地域の1定点当たり患者数は、青森市・東地方が28.58人（前週比19.66人増）で、警報発令基準の30人に迫った。弘前は11.50人（同4.00人増）、八戸市・三戸地方14.92人（同6.25人増）で、いずれも注意報の基準となる10人を超えた。既に注意報が出ている上十三は20.33人（同7.66人増）と感染が拡大した。 ほかは五所川原4.71人（同3.28人増）、むつ6.17人（同3.34人増）で注意報レベルを下回っている。,[],[]
三沢空港でも出発便遅れ（Web東奥）,https://news.yahoo.co.jp/articles/d0fad7e34a38062f3c596eecf483e86edbadec2c,https://newsatcl-pctr.c.yimg.jp/t/amd-img/20241226-00000007-webtoo-000-2-view.jpg?exp=10800,2024-12-26T12:20:00+09:00,2024-12-26T12:20:40+09:00,Web東奥,webtoo,Web東奥,107,出発の遅延を伝える出発ロビーの掲示板＝26日正午すぎ、三沢空港 日航へのサイバー攻撃の影響で26日正午現在、青森県三沢市の三沢空港発の旅客機にも出発の遅れが出ている。35分ほどの予定。乗客の間で混乱は生じていない。,[],[]
サイバー攻撃で青森空港発の便にも遅れ（Web東奥）,https://news.yahoo.co.jp/articles/85a72be91833a35db9adbe6d545142c8b41d3708,https://newsatcl-pctr.c.yimg.jp/t/amd-img/20241226-00000002-webtoo-000-1-view.jpg?exp=10800,2024-12-26T11:45:00+09:00,2024-12-26T11:45:00+09:00,Web東奥,webtoo,Web東奥,115,26日午前11時すぎの青森空港内 日航は26日、同午前7時25分ごろから社内外をつなぐネットワーク機器にサイバー攻撃があり、システムの不具合が起きていると明らかにした。午前11時半現在、青森空港発の旅客機にも出発の遅れが出ている。,[],[]
青森空港も出発便に15～30分の遅れ（Web東奥）,https://news.yahoo.co.jp/articles/1254d761d4a287e17361b5df005c314cfebf3e44,https://newsatcl-pctr.c.yimg.jp/t/amd-img/20241226-00000001-webtoo-000-1-view.jpg?exp=10800,2024-12-26T11:37:00+09:00,2024-12-26T11:37:00+09:00,Web東奥,webtoo,Web東奥,59,（写真：東奥日報社） 日航のシステム不具合により午前11時半現在、青森空港発の旅客機にも15～30分の遅れが出ている。,[],[]
「ピッチに立てなくても思いは一緒」 高校サッカー日本一の夢、仲間に託す　負傷の青森山田2選手（Web東奥）,https://news.yahoo.co.jp/articles/80192bb9e4e2317686c33b6fbb46dc05a5c60d04,https://newsatcl-pctr.c.yimg.jp/t/amd-img/20241226-00000004-webtoo-000-1-view.jpg?exp=10800,2024-12-26T10:00:00+09:00,2024-12-26T10:00:00+09:00,Web東奥,webtoo,Web東奥,1356,負傷で大会出場を断念した青森山田サッカー部の大沢（左）と山口。「日本一の夢は仲間に託す」と声を合わせる＝19日、青森市 28日開幕の全国高校サッカー選手権で連覇が懸かる青森県代表の青森山田は31日、高川学園（山口）との初戦を迎える。主力を担ってきたMF大沢悠真選手（3年、青森市出身）、DF山口元幹選手（同、大阪府出身）は膝に大けがを負い、出場はかなわなかった。「ピッチに立てなくても思いは一緒」。日本一の夢を仲間に託す。 11月下旬の練習。ジョギングを終え、ボールを蹴ろうとした瞬間、大沢の左膝が悲鳴を上げた。前日の試合で半月板を痛めたとみられ、症状の緩和を目的とする保存療法を医師が選択肢に入れないほどの重傷。「手術しないと治らない」と告げられた。それは子どもの頃からの目標だった選手権出場の道が絶たれたことを意味した。「この時期にけがをするなんて」。涙があふれた。 夏の悔しさを晴らす舞台にするはずだった。7月の全国高校総体。PK戦にもつれた準々決勝で5人目のキッカーを務めたが失敗、試合に敗れた。「冬こそ日本一になろうと練習、試合に死ぬ気で取り組んできた」。左サイドMFとして先発出場を続け、攻守で体を張り、体力が尽きるまで走り切った。コーチ陣からは「ハードワークする青森山田の象徴」と言われるまでの存在となっていた。 手術後、足は完全に固定され、松葉づえが手放せない。失意の中、チームメートからの言葉が支えになった。「悠真の分も戦う」と数え切れないほどの連絡が来た。「足が動かなくても仲間のために何かできないか」。思いついたのは千羽鶴。入院生活の2週間で両親と1150羽を折った。退院した今月18日、正木昌宣監督に手渡した。今大会では青森山田ベンチに飾られる。 10月に右膝にメスを入れ、全治8カ月の診断を受けた山口はリハビリと並行してチームのサポート役を務める。「高校サッカーに未練を残したくない。できることをやり抜く」と自ら名乗り出た。練習の準備や片付けに加え、対戦相手の分析を行う。試合動画に目を通し、得点と失点の傾向、シュート数などのデータをパソコンを使って資料4枚にまとめ、チームメートに配っている。 成績が伴わず、練習の雰囲気が悪くなった11月下旬には、30人以上の選手から個別で思いを聞き取った。そこで多くの選手が口にした課題は得点力不足だった。軸となるサイド攻撃に着目し、クロスボールを合わせるシュート練習でゴールが決まった回数を数えると成功率は33％。「抽象的な言葉よりも数値を示した方がやる気が出る」と選手目線に立ち「成功率40％」と自ら購入したホワイトボードに書き出して全員で共有、選手を奮い立たせた。 チームからの信頼は厚い。正木監督は「コーチよりも山口の言葉が選手に響いているかもしれない」と存在の大きさを語る。小学時代からプレーをともにするMF川口遼己（3年、大阪府出身）は「支えてくれて感謝しかない。自分たちが日本一の景色を見せたい」と闘志を燃やす。 2人が試合で着るはずだった13番と6番のユニホームは川口らが自身のユニホームの下に着込んでプレーする。「最高の仲間に恵まれた」と大沢。山口は「あとはあいつらがやってくれる」。ピッチ外から声を張り上げ、大舞台をともに戦う。,[],[]
人間椅子・和嶋慎治（青森県弘前市出身）が自選詩集　108編掲載、各時代回想のエッセーも（Web東奥）,https://news.yahoo.co.jp/articles/6fd64d01910a1b436b4b933c21f927ef7db6efbb,https://newsatcl-pctr.c.yimg.jp/t/amd-img/20241226-00000003-webtoo-000-2-view.jpg?exp=10800,2024-12-26T09:57:00+09:00,2024-12-26T14:18:10+09:00,Web東奥,webtoo,Web東奥,782,トークイベントの冒頭であいさつする和嶋（左）、志村 ロックバンド「人間椅子」の和嶋慎治（59）＝青森県弘前市出身＝が、新刊「無情のスキャット 人間椅子・和嶋慎治自選詩集」（百年舎）を出版した。5日、東京都世田谷区の「本屋B＆B」で記念のトークイベントが開かれ、和嶋は日本語へのこだわりや創作の原点などを1時間半にわたりたっぷりと語った。 和嶋は多くの楽曲の作詞を担当。デビュー前から2023年までを8章に分け、全部で108編の詩を選んで掲載した。それぞれの時代を回想するエッセーも盛り込み、これまでの軌跡をたどる内容にもなっている。 「僕の作詞作法－バンド生活三十五年によせて」と題したイベントでは、文筆家・音楽ライター志村つくねが聞き手を務めた。和嶋は本のタイトルについて、当初は高校時代に創作した「鉄格子黙示録」と仮で付けていたものの、「出版社から『そのタイトルだと売れない』と言われた。（違う案が）すぐに思いつかず時間がかかった」と明かし、会場の笑いを誘った。 日本語は英語のように歌詞を縮めにくく、「日本語の古い言い回しや慣用句が良いのでは、と思い無意識にやり出した」と和嶋。それが他のバンドとの差別化につながっていった。今では海外のファンも増え「詩の核は内容がしっかりしていれば伝わる」と持論を述べた。 参加者からは多くの質問が寄せられた。一番歌詞が好きな作品を尋ねられ、和嶋がいくつか挙げた中に、友人の死に直面して書いた「星空の導き」があった。悲しみに暮れる中、「ただ悲しんでいてはダメだ、残された人を慰めたい」と素直な思いで書けた歌詞だったという。 イベントでは、高校時代にカセットテープに録音したラジオドラマ風の音源や、作品を書き連ねた古いノートも特別に披露。会場やオンラインで参加したファンらが喜びに浸った。 「無情のスキャット」は税抜き3千円。,[],[]
2025年は青森リンゴ植栽150周年　県がタイアップ企画募集（Web東奥）,https://news.yahoo.co.jp/articles/2d799235153f08b1c05adb6547c163a1973b6091,https://newsatcl-pctr.c.yimg.jp/t/amd-img/20241226-00000006-webtoo-000-1-view.jpg?exp=10800,2024-12-26T09:06:00+09:00,2024-12-26T09:06:00+09:00,Web東奥,webtoo,Web東奥,405,植栽150周年のロゴマーク（青森県提供） 2025年の青森リンゴ植栽150周年を盛り上げようと青森県は、タイアップ企画を募集している。期間は、24年12月から26年3月まで。企画が採用されれば、県りんご植栽150周年記念事業実行委員会の交流サイト（SNS）や県の広報などでPRする。 タイアップ企画は、県産リンゴをPRすることが条件で、植栽150周年を記念したイベントや、県産リンゴを使った食品や加工品などの商品、特集記事をはじめとするサービスなどが対象となっている。希望者は、県のホームページから登録申請書をダウンロードし、メールで提出する必要がある。 県農林水産部の栗林豊次長は「ぜひ応募していただき、150周年の節目を県民と一緒に盛り上げていきたい」と述べた。 このほか、県は来年1月25日に、青森市の県観光物産館アスパムで植栽150周年を記念したキックオフイベントを、同9月ごろには記念式典を開く予定。,[],[]
