headline,mainEntityOfPage,image,datePublished,dateModified,author,media_en,media_jp,str_count,body,images,external_links
JR只見線にオリジナル観光列車を導入へ　福島県と沿線自治体が検討会　列車はJRと会津鉄道で運用（福島テレビ）,https://news.yahoo.co.jp/articles/4f178ef2f93e0c2c66a10f0ac829616962802f28,https://newsatcl-pctr.c.yimg.jp/t/amd-img/20240716-90024586-ftv-000-1-thumb.jpg?exp=10800,2024-07-16T19:15:02+09:00,2024-07-16T19:15:02+09:00,福島テレビ,ftv,福島テレビ,451,\n福島テレビ\nＪＲ只見線で観光列車の導入へ。日本一の地方創生路線を目指して検討会が開かれた。\n\n福島県が中心となり会津地方の自治体の担当者などが参加した会議。目的は会津鉄道、そしてＪＲ只見線で観光列車の導入に向けた検討だ。\n\n豪雨被害を乗り越え、2022年10月に全線で運転が再開したＪＲ只見線。\n2023年9月までに会津川口駅から只見駅までの沿線には、27万人を超える観光客が訪れ、再開通前と比べ、車で訪れた人も含めると２割程度増えてるということだ。\n只見線の人気をさらに高め、利活用を進める上で、観光列車の導入は目標の一つとなっていた。\n\n会議では検討部会を設置。観光列車について、会津鉄道が車両を管理し、会津鉄道と只見線で運用していく方針が示された。\n福島県生活交通課の松田香樹主幹は「地元の人や沿線の人も含めて、自慢できるような特別感のあるものが走ることができればいいなと思っております」と話した。\n今後は観光列車の外装や内装などの検討を進めていく予定だ。\n福島テレビ,[],[]
福島の朝採れモモを東北新幹線でお届け！　新たな販路拡大へ　2024年問題や二酸化炭素排出低減にも一役（福島テレビ）,https://news.yahoo.co.jp/articles/df40fed345f3e752122ca6f1f938067afcb5f9be,https://newsatcl-pctr.c.yimg.jp/t/amd-img/20240716-90024582-ftv-000-1-thumb.jpg?exp=10800,2024-07-16T19:20:02+09:00,2024-07-16T19:20:02+09:00,福島テレビ,ftv,福島テレビ,934,\n福島テレビ\n福島県内で生産されるモモの約半分を占める主力品種「あかつき」。福島県が誇るモモの代表格の収穫が、県内で例年より早く始まった。その旬のモモを、おいしいうちに届ける実証実験も始まった。\n\n＜高い糖度が特徴＞\n福島県国見町のNakanofarmでは、7月16日から今シーズンはじめてとなる「あかつき」の収穫が始まった。Nakanofarm仲野周久さは「どんどん収獲の時期が早くなっている印象がある。今までで収獲した中でも、今年は一番早いかな」と話すように、5月から6月にかけて気温が高かった影響で、2024年は例年よりも10日ほど早いという。\n今年の「あかつき」は色づきも良く、雨が少なかったことから甘みもしっかり乗っているそう。\nJAによると、2024年の福島県産「あかつき」は、出荷のピークが来週ごろで市場に出回るのは7月いっぱいになりそうとのこと。\n\n＜新幹線で東京へお届け＞\n福島が誇るモモを、県外にもお届けしたい！と、7月16日からJRや日本郵政グループなどが協力して「新幹線で関東圏にモモを運ぶ」実証実験がスタートした。\n午後4時すぎにJR福島駅から「やまびこ」に乗って、東京駅に向かった第一便。東京駅に到着したあと、それぞれの申し込み先へと配達される。\n輸送手段の一部を新幹線にすることによって、「2024年問題」によるドライバー不足の問題を軽減。さらに、輸送にかかるCO2を減らしつつ、福島のモモの販路を拡大していこうという取り組みだ。\n福島東郵便局の集配営業部・平原功樹部長は「発送したモモは、今日の朝採れたものです。そういったものを少しでも早く首都圏の皆様へお届けして、新鮮な福島のモモを食べていただきたい」と話した。\n\n＜2024年は旬が早まる＞\nJA全農福島によると、福島県のモモのシーズンは「あかつき」の出荷は7月いっぱい。その後は、「まどか」が7月下旬から、「川中島白桃」が8月中旬から。収穫時期は早まっているが、収量は例年通りとのこと。\n他にも、ナシが8月中旬、ブドウは9月上旬などとなっていて、モモも含めたほとんどの果物が、気温の高さの影響もあり例年より早く旬を迎えそうだという。\n福島テレビ,[],[]
＜速報＞２歳の女の子が家族が運転する車にひかれる事故　心肺停止の状態で病院に【福島・大玉村】（福島テレビ）,https://news.yahoo.co.jp/articles/800fd259416619f07b89567d8bec2693c0c88bbe,https://newsatcl-pctr.c.yimg.jp/t/amd-img/20240716-90024593-ftv-000-1-view.jpg?exp=10800,2024-07-16T19:33:02+09:00,2024-07-16T19:33:02+09:00,福島テレビ,ftv,福島テレビ,101,\n福島テレビ\n福島県大玉村で午後５時前、２歳の女の子が家族が運転する車にひかれる事故があった。女の子は心肺停止の状態でドクターヘリで病院に運ばれた。警察が事故の詳しい状況を調べている。\n福島テレビ,['https://newsatcl-pctr.c.yimg.jp/t/amd-img/20240716-90024593-ftv-000-1-view.jpg?exp=10800'],['https://news.yahoo.co.jp/articles/800fd259416619f07b89567d8bec2693c0c88bbe/images/000']
「福島を選ぼう」TOKIOが出演する「ふくしまプライド。」の新CM　消費者のこだわりに注目（福島テレビ）,https://news.yahoo.co.jp/articles/7005acf3fe58e1cc83e44f6b7e47af42a9a55b2a,https://newsatcl-pctr.c.yimg.jp/t/amd-img/20240716-90024592-ftv-000-1-view.jpg?exp=10800,2024-07-16T19:24:02+09:00,2024-07-16T19:24:02+09:00,福島テレビ,ftv,福島テレビ,509,\n福島テレビ\n福島の食をPRする「ふくしまプライド」。その新しいコマーシャルの発表会が行われ、出演するTOKIOの城島茂さんや福島県の内堀雅雄知事などが出席した。\n\n新たなコマーシャルに込めたメッセージは「福島を選ぼう」\n福島の食材を選ぶ「消費者」のこだわりに注目して、魅力を紹介している。\nコマーシャルは福島県のクリエイティブディレクター・箭内道彦さんが監督を務め、「桃篇」の他に「夏野菜篇」「水産物篇」の合わせて3本が制作された。\n\n城島さんは「毎回このCMで初物だったりを頂くので、実際に届きたての、穫れたてのものを頂くのが個人的に楽しみなんですよね。一口めが、今年どうかなって。うわっ、想像を超えたなみたいな」と話した。\n\n2024年から商品に貼られる金色のロゴマークも紹介され、福島県産食材の消費拡大を進めていく。\n福島県の内堀知事は「選ぶ側のプライドが乗っかっていくことで、ますます福島県産の農産物良いね、選ぼうと、その笑顔の輪が広がっていくと思う」と話した。\n\n「ふくしまプライド。」の新しいコマーシャルは、7月17日から福島県内や関東・関西地方などで放送される。\n福島テレビ,['https://newsatcl-pctr.c.yimg.jp/t/amd-img/20240716-90024592-ftv-000-1-view.jpg?exp=10800'],['https://news.yahoo.co.jp/articles/7005acf3fe58e1cc83e44f6b7e47af42a9a55b2a/images/000']
【地震】福島県内で震度1 茨城県南部を震源とする最大震度3の地震が発生 津波の心配なし（福島テレビ）,https://news.yahoo.co.jp/articles/bc895e41058cca41a95f364499b592f09d46b61f,https://newsatcl-pctr.c.yimg.jp/t/amd-img/20240716-90024594-ftv-000-1-view.jpg?exp=10800,2024-07-16T22:25:01+09:00,2024-07-16T22:25:01+09:00,福島テレビ,ftv,福島テレビ,265,\n福島テレビ\n2024年07月16日午後10時19分ごろ、茨城県南部を震源とする最大震度3の地震が発生しました。\n福島県内では震度1の揺れが観測されています。\n最大震度3を観測したのは茨城県、栃木県です。\nこの地震による津波の心配はありません。\n震源の深さは70km。地震の規模を示すマグニチュード（M）はＭ４．２と推定されます。\n\n福島県\n【震度1】\n 郡山市 白河市 須賀川市 田村市 西郷村 棚倉町 矢祭町 玉川村 浅川町 いわき市 川内村 檜枝岐村 南会津町\n\n提供：ウェザーニューズ\n福島テレビ,['https://newsatcl-pctr.c.yimg.jp/t/amd-img/20240716-90024594-ftv-000-1-view.jpg?exp=10800'],['https://news.yahoo.co.jp/articles/bc895e41058cca41a95f364499b592f09d46b61f/images/000']
魚を食べよう！親子でアユの丸焼き体験　地域で食育　魚の消費量が調査開始以来最低に＜福島・いわき市＞（福島テレビ）,https://news.yahoo.co.jp/articles/f6cb1699b7eab6cada8e852fd7ed0dac651fe149,https://newsatcl-pctr.c.yimg.jp/t/amd-img/20240716-90024584-ftv-000-1-thumb.jpg?exp=10800,2024-07-16T19:11:01+09:00,2024-07-16T19:11:01+09:00,福島テレビ,ftv,福島テレビ,644,\n福島テレビ\n炭火でじっくり焼かれているのは、今が旬のアユ。おいしそうだが、いま進んでいるのが“魚離れ”。１人当たりの“魚”の年間消費量は、2001年度をピークに減り続けている。直近の2022年度には、ピーク時の約半分の22キロと調査開始以来、過去最低となった。\n一方、増加傾向にあるのが“肉”。2011年度には“魚”を逆転するなか、子どもたちに魚を好きになってもらおうと、福島県いわき市で体験会が開かれた。\n\nいわき市川部町のあざみ野こども園。\n子どもたちが自らの手で焼いていたのは、近くを流れる四時川の天然のアユだ。\n「食育」の一環として、子どもたちにアユの美味しさなどを知ってもらおうと体験会が企画された。子どもたちは「（魚食べてどうですか？）美味しい！優しい味」「ちょっと苦かった」「美味しかったよ。（魚は好きですか？）はい！」と話す。\n\nその一方、食卓で進む“魚離れ”。\n母親は「（魚料理）苦手でなかなか出てこないです。焼き魚とか煮魚とかは、おばあちゃん家とか行った時に食べるぐらいで」と話し、父親は「週に１度くらいですかね。お肉の方が多くなっちゃいますね」という。そのため、このこども園では、給食で週に２～３回程、魚を提供している。\n\nあざみ野こども園の阿邉みどり園長は「『お魚美味しい』っていうふうに言いながら、残食はほとんどなくて、お魚を美味しくいただいているので嬉しいです」と話す。\n地域と連携しながらこれからも食育が続いていく。\n福島テレビ,[],[]
若隆景は遠藤を押し出し2連勝　兄・若元春は横綱に黒星　十両・白熊も2勝目《大相撲七月場所・三日目》（福島テレビ）,https://news.yahoo.co.jp/articles/40041579d695c5bd86ebb249c8899e4606b8a6fc,https://newsatcl-pctr.c.yimg.jp/t/amd-img/20240716-90024589-ftv-000-1-view.jpg?exp=10800,2024-07-16T18:20:01+09:00,2024-07-16T18:20:01+09:00,福島テレビ,ftv,福島テレビ,220,\n福島テレビ\n大相撲七月場所は３日目。\n幕内に復帰し、15日に初白星をあげた福島市出身の若隆景は遠藤との取組。\n頭で当たった若隆景は、遠藤をそのまま押し出して、土俵の外へ。\nこれで２勝１敗の若隆景、17日は武将山と対戦する。\n\n兄・若元春は横綱・照ノ富士との結びの一番。横綱に寄り切られ黒星となり２勝１敗。\n17日は大関・琴櫻と対戦する。\n\n須賀川市出身の十両・白熊は、紫雷を寄り切り、２勝１敗としている。\n福島テレビ,['https://newsatcl-pctr.c.yimg.jp/t/amd-img/20240716-90024589-ftv-000-1-view.jpg?exp=10800'],['https://news.yahoo.co.jp/articles/40041579d695c5bd86ebb249c8899e4606b8a6fc/images/000']
イギリスへの輸出が大幅に拡大へ　福島県オリジナルブランド米「天のつぶ」　日本食店から希望多く（福島テレビ）,https://news.yahoo.co.jp/articles/672f1dd9063dd81cc2e37b09178c8f9dc7ffc449,https://newsatcl-pctr.c.yimg.jp/t/amd-img/20240716-90024588-ftv-000-2-thumb.jpg?exp=10800,2024-07-16T17:40:02+09:00,2024-07-16T19:28:02+09:00,福島テレビ,ftv,福島テレビ,290,\n福島テレビ\n福島県の内堀雅雄知事は、7月16日の会見で13日までのヨーロッパ訪問の成果を報告し、イギリスで日本食品の輸入や販売などを行う業者から、今後3年間「天のつぶ」の取り扱いを現在の2倍引き上げたいとの話を受けたとした。\n\n福島県のオリジナルブランド米「天のつぶ」は、粒の大きさとはっきりとした歯ごたえが特徴で、ロンドンの日本食レストランなどから輸入の希望が多いという。\n\n2023年度の福島県産米の輸出量は383.5トンと、前の年度の1.5倍に増えていて、福島県は「様々なプロモーションを通して、県産米のさらなる輸出拡大を目指したい」としている。\n福島テレビ,[],[]
連合福島が最低賃金について労働局に要請　福島県の最低賃金の更なる引き上げ　全国平均を104円下回る　（福島テレビ）,https://news.yahoo.co.jp/articles/a8a1b7bbf54ec200653eaa0911e4428e6d413142,https://newsatcl-pctr.c.yimg.jp/t/amd-img/20240716-90024583-ftv-000-2-thumb.jpg?exp=10800,2024-07-16T17:35:02+09:00,2024-07-16T19:28:02+09:00,福島テレビ,ftv,福島テレビ,374,\n福島テレビ\n引き上げに向けた議論が進められている最低賃金について、連合福島が要請書を手渡した。\n\n福島県内の最低賃金をめぐり、「連合福島」が7月16日福島労働局に提出したのは、引き上げを求める要請書と11万4400人分の署名。\n\n福島県内の最低賃金は、2023年に大幅に引き上げられ時給900円になったが、全国平均と比べると104円下回っている。そのため連合福島は、この賃金の格差により、都市部への労働力の流出につながっているとして、さらなる引き上げを強く求めた。\n連合福島・諸橋誠敏事務局長は「春闘の結果もそうですけど、最低賃金もこれからも継続した引き上げが必要だという風に考えます」と話した。\n\n最低賃金は物価高などを踏まえ、2024年も大幅な引き上げが予想されていて、県内でも10月を目途に改定される予定だ。\n福島テレビ,[],[]
20代の男性幹部自衛官を停職16日の懲戒処分　訓練で部下の装備品盗む…紛失知られたくなかった【福島】（福島テレビ）,https://news.yahoo.co.jp/articles/0b5f160e515a625f12de7bf3fc392e07c5581d83,https://newsatcl-pctr.c.yimg.jp/t/amd-img/20240716-90024591-ftv-000-1-view.jpg?exp=10800,2024-07-16T17:30:02+09:00,2024-07-16T17:30:02+09:00,福島テレビ,ftv,福島テレビ,249,\n福島テレビ\n陸上自衛隊郡山駐屯地は、部下の装備品を盗んだ男性自衛官を停職16日の懲戒処分とした。\n\n懲戒処分を受けたのは、陸上自衛隊郡山駐屯地に所属する東北方面特科連隊の20代の男性幹部自衛官。\n郡山駐屯地によると、この幹部自衛官は2023年10月、訓練に参加した時に部下の装備品を盗んだということだ。\n\n聞き取りに対し、この幹部自衛官は「自分の装備品を紛失した事を知られたくなかった」などと話していて、陸上自衛隊郡山駐屯地は7月16日付で停職16日の懲戒処分とした。\n福島テレビ,['https://newsatcl-pctr.c.yimg.jp/t/amd-img/20240716-90024591-ftv-000-1-view.jpg?exp=10800'],['https://news.yahoo.co.jp/articles/0b5f160e515a625f12de7bf3fc392e07c5581d83/images/000']
熱さ怖さをリアルに体験　本物の炎を使った消火訓練　福島市の工場で初期消火を体験（福島テレビ）,https://news.yahoo.co.jp/articles/bb299ca9422eb17782d5026240b6290fd1abd619,https://newsatcl-pctr.c.yimg.jp/t/amd-img/20240716-90024548-ftv-000-1-thumb.jpg?exp=10800,2024-07-16T12:00:02+09:00,2024-07-16T12:00:02+09:00,福島テレビ,ftv,福島テレビ,383,\n福島テレビ\n福島市の工場で初期消火などを体験する訓練が行われた。\n\nこの訓練は、ガソリンなど危険物を扱う事業者の協会と防火管理連絡協議会が連携し、行われた。\n訓練は7月12日、消火器などを製造する福島市の工場で行われ、安全を確保しながら実験用の燃料を燃やし参加者が実際の炎を消火した。\n\n福島市消防本部の渡辺祐一予防課長は「早く知らせて、早く消火して、早く避難の３原則が最も重要です。ぜひとも各事業所の皆様には、普段からの火災予防と有事の際の適切な行動をお願いしたいと思います」と話した。\n\n参加者は「実際の火事で、ああいった場面に出くわした時、冷静な行動が出来るのか、初期消火が出来るのかという事において、非常に貴重な経験になりました」と話していた。\n参加者は訓練を通して、消火器の使い方などを確認し火災予防の意識を高めていた。\n福島テレビ,[],[]
大型トレーラーが炎上　東北自動車道の一部区間が約７時間通行止め（福島県）（福島テレビ）,https://news.yahoo.co.jp/articles/daadf764377d72897116ceedae35e403c86a01c8,https://newsatcl-pctr.c.yimg.jp/t/amd-img/20240716-90024590-ftv-000-1-view.jpg?exp=10800,2024-07-16T12:15:02+09:00,2024-07-16T12:15:02+09:00,福島テレビ,ftv,福島テレビ,333,\n福島テレビ\n東北自動車道の須賀川インターチェンジ付近で大型トレーラーが炎上する火事があり７時間に渡り一部通行止めとなりました。\n\n福島県警察本部によると１６日午前２時過ぎ、東北自動車下り線の須賀川インターチェンジ付近を走行していた大型トレーラーの運転手から「トレーラーが延焼している」などと消防に通報があった。火は約５時間３０分後に消し止められ、運転手にけがはなかった。\n\nトレーラーの右後輪付近から出火したとみられ、荷台には宅配便の荷物などが積まれていたということ。\n\nこの影響で東北道下り線の矢吹インターチェンジから須賀川インターチェンジの区間は約７時間に渡り通行止めとなった。\n\n警察と消防が出火の原因など調べを進めている。\n福島テレビ,['https://newsatcl-pctr.c.yimg.jp/t/amd-img/20240716-90024590-ftv-000-1-view.jpg?exp=10800'],['https://news.yahoo.co.jp/articles/daadf764377d72897116ceedae35e403c86a01c8/images/000']
処理水の海洋放出　今年度3回目が完了　2023年の開始から累計で5万5千トン放出《福島第一原発》（福島テレビ）,https://news.yahoo.co.jp/articles/12629c6f856b3e1cc9d100480dceaf6e73f195a5,https://newsatcl-pctr.c.yimg.jp/t/amd-img/20240716-90024581-ftv-000-2-thumb.jpg?exp=10800,2024-07-16T12:32:01+09:00,2024-07-16T19:33:02+09:00,福島テレビ,ftv,福島テレビ,307,\n福島テレビ\n福島第一原子力発電所で、今年度３回目となる処理水の海洋放出が7月16日午前11時59分に完了した。\n\n福島第一原子力発電所では、6月28日から全体としては７回目、今年度３回目の、処理水の海洋放出が行われ、7月16日昼前に完了した。\n放出が開始された2023年8月からの累計では、タンク55基分、約5万5千トンの処理水が海水で薄められて海に放出された。\n次の放出は7月から8月にかけて予定されている。\n\nまた、福島第一原発の2号機では、燃料デブリの「試験的取り出し」が早ければ8月にも着手される計画で、東京電力は一連の廃炉作業について「安全を最優先に取り組む」としている。\n福島テレビ,[],[]
大虐殺から30年　アフリカ・ルワンダでの支援活動報告会　平和と教育の大切さ訴え＜福島市＞（福島テレビ）,https://news.yahoo.co.jp/articles/87a9a7601db7de1c9ffe5055b19419cd1d95f688,https://newsatcl-pctr.c.yimg.jp/t/amd-img/20240716-90024572-ftv-000-2-thumb.jpg?exp=10800,2024-07-16T11:58:02+09:00,2024-07-16T12:39:01+09:00,福島テレビ,ftv,福島テレビ,317,\n福島テレビ\nアフリカのルワンダで起きた大虐殺から30年、現地での活動の報告会が開かれた。\n\n7月15日、福島市で開かれたのは、ルワンダで行われている子どもたちへの支援活動の報告会「ルワンダフルサマー」。\nルワンダでは1994年、内戦をきっかけに大虐殺がはじまり、わずか3ヵ月ほどで80万人から100万人にものぼる人が命を落としたといわれる。\n\nこの催しを企画した１人、永遠瑠マリールイズさんは、大虐殺を経験したあと、桜の聖母短期大学の聴講生として福島にやってきたことが縁で、この学校での報告活動を続けている。\n主催した団体は、現地で教育施設の建設などを行っていて、平和と教育の大切さを改めて訴えていた。\n福島テレビ,[],[]
福島のモモ　主力の「あかつき」収穫はじまる　例年より10日早く　出荷は7月いっぱい続く　（福島テレビ）,https://news.yahoo.co.jp/articles/45c2aa601f08c15cda2b5aa0b2592f007ba9d3a5,https://newsatcl-pctr.c.yimg.jp/t/amd-img/20240716-90024580-ftv-000-1-thumb.jpg?exp=10800,2024-07-16T11:56:01+09:00,2024-07-16T11:56:01+09:00,福島テレビ,ftv,福島テレビ,388,\n福島テレビ\n福島県産のモモの主力品種「あかつき」の収獲が7月16日始まった。\n\n福島県国見町のモモ農家Ｎａｋａｎｏｆａｒｍでは、今シーズンはじめてとなる「あかつき」の収穫が16日始まった。\n「あかつき」は福島県内で生産されるモモの約半分を占める主力品種で、適度な実の固さがあり、糖度が高いのが特徴。\n\n5月から6月にかけての高温の影響で、モモの実の生育が進んだことから、この農家では、例年より10日ほど早い収穫となった。\nＮａｋａｎｏｆａｒｍの仲野周久さんは「昨年もかなり早いということだったんですけれども、今年はさらに早くて、今までで収獲した中でも今年は一番早いかなと思っております」と話す。\n\nＪＡによると、2024年の福島県産の「あかつき」は、出荷のピークが22日からの週ごろで、市場に出回るのは7月いっぱいになりそうだということだ。\n福島テレビ,[],[]
