headline,mainEntityOfPage,image,datePublished,dateModified,author,media_en,media_jp,str_count,body,images,external_links
じいちゃんの秋田犬【大家族編】#20　昼寝から目覚めた子どもたち／秋田（CNA秋田ケーブルテレビ）,https://news.yahoo.co.jp/articles/e0688ebe0c84c77a51800b3547251366773f98ef,https://newsatcl-pctr.c.yimg.jp/t/amd-img/20260105-00010000-cnaakitav-000-1-thumb.jpg?exp=10800,2026-01-05T19:00:43+09:00,2026-01-05T19:00:43+09:00,CNA秋田ケーブルテレビ,cnaakita,CNA秋田ケーブルテレビ,201,"CNA秋田ケーブルテレビ
秋田犬の魅力を発信！
雪国秋田で秋田犬と楽しく暮らすじいちゃん。
今は一人で暮らすじいちゃんの家が、賑やかになりました。
昼寝から目覚めた子どもたちは、ママの周りをウロウロと動きます。
あらゆる物に興味津々。
子供たちはスクスク成長しているものの、まだまだ両手に乗るほどの小さな体。
この後の成長が楽しみです。

秋田犬と暮らす日々は、癒やしの日々。
秋田犬はやっぱり良いな。",[],[]
