headline,mainEntityOfPage,image,datePublished,dateModified,author,media_en,media_jp,str_count,body,images,external_links
「服装が不適切」として報酬を減額...15歳ベビーシッターの投稿に怒りの声広がる（海外）（ニューズウィーク日本版）,https://news.yahoo.co.jp/articles/d2088080270b4f75f72284292c0a3c55eedca279,https://newsatcl-pctr.c.yimg.jp/t/amd-img/20250716-00010010-newsweek-000-1-view.jpg?exp=10800,2025-07-16T21:30:29+09:00,2025-07-16T21:30:29+09:00,ニューズウィーク日本版,newsweek,ニューズウィーク日本版,920,"＜「服装が不適切だった」という理由で報酬の一部を支払われなかった15歳の少女が、Redditに投稿した体験談が大きな反響を呼んでいる。「働いた分は支払うべき」といった声や、未成年への視線に疑問を投げかける意見が相次いでいる＞
服装理由に報酬カット...15歳ベビーシッターの投稿に「搾取だ」と批判殺到（写真はイメージです）　Jason Sung-Unsplash
Redditに投稿された15歳の少女の悩みが、ネット上で大きな反響を呼んでいる。

この少女は、ある宗教的で保守的な家庭のもとで1年以上ベビーシッターとして働いてきたという。普段は子どもたちとも良好な関係を築いており、仕事にもやりがいを感じていた。ところが先日、いつも通りに6時間以上のシッター業務を終えたあと、保護者から「服装が不適切だった」として、通常の報酬が支払われなかったという。
【画像】報酬未払いの理由は「タンクトップ」？ 15歳の訴えが示した社会の偏見
彼女はこの出来事について、Redditの相談掲示板に投稿。

「当日はタンクトップの上にスウェットを着ていて、途中で子どもたちと遊ぶ際に上着を脱ぎました」と説明した。

通常、彼女は2人の子どもを預かるため、1時間20ドル（基本15ドル＋1人あたり5ドル）で働いている。今回も午後4時から夜10時半まで勤務したが、後日支払いを確認したところ、「服装がふさわしくなかった」という理由で報酬が一部差し引かれていたという。

これに対してネット上では、「服装がどうであれ、働いた分は払うべき」「性的に見ている側の問題。未成年にそれを押し付けるのはおかしい」「嫌ならその時点で帰らせるべきだった。働かせておいて後から減額するのは不誠実」といった批判が相次いでいる。

また、「親など信頼できる大人に相談して」といった助言も多く寄せられており、一部では「未成年を性の視点で裁くのはやめるべき」という声まで上がっている。

「今回は金額の問題だけではない」「働いた時間を後から服装で無効にするのは搾取と同じ」といった意見も見られ、報酬の公平性や、未成年への視線のあり方にまで議論が広がっている。
ウィル・アームストロング",[],[]
川辺で女性が突然ワニに襲われ死亡...住民が捉えた「衝撃の瞬間」（海外）（ニューズウィーク日本版）,https://news.yahoo.co.jp/articles/7a52a37b5875ef8800d385e11f4411594428a542,https://newsatcl-pctr.c.yimg.jp/t/amd-img/20250716-00010009-newsweek-000-1-view.jpg?exp=10800,2025-07-16T18:31:04+09:00,2025-07-16T18:31:04+09:00,ニューズウィーク日本版,newsweek,ニューズウィーク日本版,580,"＜インド中部の村で、川岸に座っていた40歳の女性が突然ワニに襲われ死亡した。現場の様子は住民が撮影しており、映像はSNS上で広まり注意喚起が強まっている＞
インドで40歳女性がワニに襲われ死亡...現場映像に「助けられなかった」の声（写真はイメージです）　David Clode-Unsplash
インド中部マディヤ・プラデーシュ州の村で、川岸に座っていた40歳の女性がワニに襲われ死亡するという痛ましい事故が発生した。Hindustan Timesなど現地メディアが報じている。
【動画】川岸にいた女性をワニが襲撃...一部始終が撮影されネット拡散
被害に遭ったのは、同州ダモー地区のカニヤガット・パティ村に住むマールティ・バーイさん。報道によれば、彼女は川辺にいたところ突然ワニに襲われ、水中へと引きずり込まれたという。

その一部始終を撮影した動画が地元住民により拡散され、当局が早期に動くきっかけとなった。住民たちは懸命にバーイさんを救出しようとしたが、力及ばなかった。

その後、捜査当局によりバーイさんの遺体は発見され、ワニから引き離された。遺体は家族のもとへ戻される見込み。

今回の事故を受けて、地元の森林局は「近年、川に生息するワニの数が増加している」とし、住民に対し川辺には極力近づかないよう注意を呼びかけている。
ウィル・アームストロング",[],[]
セックスは「衝動」ではなかった...空腹とは異なる、快楽の仕組み「インセンティブ・モチベーション」とは何か？（ニューズウィーク日本版）,https://news.yahoo.co.jp/articles/847862437218ec3e385a6c6be71458ec638fa705,https://newsatcl-pctr.c.yimg.jp/t/amd-img/20250716-00010008-newsweek-000-1-view.jpg?exp=10800,2025-07-16T18:24:25+09:00,2025-07-16T18:24:25+09:00,ニューズウィーク日本版,newsweek,ニューズウィーク日本版,1564,"＜空腹や睡眠といった生存本能と同列に扱われがちなセックスの欲求。しかし最新の心理学研究によると、それは「前進」だった...＞【エミリー・ナゴスキー（性教育者）】
Orawan Pattarawimonchai-shutterstock
世界中の女性たちが夢中になって読んだ──「女性の体・性・快楽のメカニズム」を最新科学をもとにやさしく紐解いた話題書『私たちのセクシュアル・ウェルネス』（日経ナショナル ジオグラフィック）の第7章「性欲」より一部編集・抜粋。
【画像】深圳のロボット風俗店の内部
◇　◇　◇

私たちの中には、性欲を空腹のような「衝動」として考える人が多くいます。衝動とは、問題を解決するためにあなたを駆り立てる、不愉快な内的体験のことをいいます。

では、もし問題を解決できなければ、どうなるのでしょう？　

間違いなく、あなたは死にます。空腹は衝動です。喉の渇きも、体温調節も、睡眠もそう──実際、人は睡眠不足で死ぬこともあるのです。

何世紀もの間、科学者たちはセックスを衝動だと考えていました。おそらくあなたもそう思っているのではないですか？　私も長い間、そうでした。でも、違ったのです。

セックスが衝動ではないことを証明するのは簡単です。動物行動学者フランク・ビーチが1956年に述べたように、「セックスレスが原因で組織障害を被った人はいない」のです。

もっと直接的な言い方をすれば、セックスができなくて死んだ人はいません。死にたくなったかもしれませんが、それは欲求不満であり、人は欲求不満で死ぬことはないのです。

では、衝動でなければ、なんなのでしょう？　答えは、「インセンティブ・モチベーション・システム」です。

「インセンティブ」という言葉から、賞品や努力する価値のあるものというイメージを連想する人も多いでしょう。生物学的な意味も似ています。

衝動が体内の不快な感覚に後押しされるものであるのに対し、インセンティブ・モチベーション・システムは、魅力的な外側からの刺激に引っ張られるもの。

好奇心はインセンティブ・モチベーション・システムの典型的な例で、空腹と同じくらい自然に生じますが、実際に死に追いやられるような脅威はありません。

「衝動」と聞いたら、「生存（サバイブ）」を連想しましょう。「インセンティブ・モチベーション」と聞いたら、「前進（スライブ）」を連想してください。それが重要なのには、少なくとも2つの理由があります。

まず、もしセックスが空腹のような衝動だとしたら、自発的な性欲をほとんど、あるいはまったく経験しない人はどうなるでしょう？　

そう、何日も、何週間も、何カ月も食べていないのに、自発的な空腹を経験しない人と同じで、間違いなく病気です。そして、自分が病気だと思い込むと、ストレス反応が働きます。ストレスが性的な快楽や欲求にとってどれほど大きく影響するかは、もうご存じですよね？

セックスは衝動であるという神話は、人々の性生活にとって有害です。セックスが空腹ではなく好奇心のようなものであることには、より重要な理由があります。

もし誰かがあまりの空腹からパンを盗んだとしても、その行動を同情と慈悲の心を持って見ることができるかもしれません。盗みは悪いことですが、人は生きるために必要なことをするとわかっているからです。

でも、単に他人のパンの味に興味があるからという理由でパンを盗んだら、私たちは同じように同情し、慈悲の心を持つことができるでしょうか？

できませんよね。セックスは衝動でも、生物学上「必要」なものでもないのですから、どんな状況においても、それを誰かから奪ってもいいということは絶対にありません。
エミリー・ナゴスキー（性教育者）",[],[]
「世界一、仲の悪い兄弟」の喧嘩がついに終結か？...オアシス復活でファン歓喜（ニューズウィーク日本版）,https://news.yahoo.co.jp/articles/a3ce7b2ee96701618ebc5904ff09e2d5eaaed472,https://newsatcl-pctr.c.yimg.jp/t/amd-img/20250716-00010007-newsweek-000-1-view.jpg?exp=10800,2025-07-16T18:15:47+09:00,2025-07-16T18:15:47+09:00,ニューズウィーク日本版,newsweek,ニューズウィーク日本版,301,"＜伝説は、再び...その舞台裏には、音楽と家族の絆が交錯するドラマがあった＞
兄ノエル・ギャラガー（右）と弟リアム・ギャラガー（左）　AP/AFLO
英ロックバンド、オアシスの16年ぶりの再結成ツアーが7月4日、英ウェールズ最大の都市カーディフで開幕した。
【動画】兄弟仲は？...英ウェールズ・カーディフでのコンサート（フルバージョン）　を見る
オアシスは兄のノエル・ギャラガー（右）と弟リアム・ギャラガー（左）の兄弟げんかが理由の1つで実質的に解散状態にあった。

この日は兄弟の仲直りとバンド復活に、待ち望んでいたファンだけでなく、各界から多くの著名人が駆け付けた。
ニューズウィーク日本版編集部",[],[]
正しさを「証明する」のではなく「疑いたい」...新聞記者の仕事が「科学的」だと言える理由（ニューズウィーク日本版）,https://news.yahoo.co.jp/articles/c33a1d150f4654d2fd842f7934989212719bf787,https://newsatcl-pctr.c.yimg.jp/t/amd-img/20250716-00010006-newsweek-000-1-view.jpg?exp=10800,2025-07-16T17:50:47+09:00,2025-07-16T17:50:47+09:00,ニューズウィーク日本版,newsweek,ニューズウィーク日本版,3518,"ジャーナリズムは自然科学や社会科学と同じ「ひとつの科学」。それは記者が行う「裏付け」作業にもあらわれている
Pexels-Pixabay
新聞記者である私にとって、アカデミックの世界に属する人たちは、社会事象についての知見を聞いたりする取材対象だった。
【動画】「二度とやるな！」イタリア旅行中の米女性の「パスタの食べ方」に批判殺到、SNSで動画が大炎上
必ずしも強く意識していたわけではなく、強いて言えばということだが、それでもジャーナリズムとアカデミズムの間には線が引かれており、数少ない例外を除けば、関係は固定化されているように思えた。

『アステイオン』102号の特集は、アカデミック・ジャーナリズムを体系的に理解しようという試みだ。アカデミック・ジャーナリズムの最も端的な定義を、人文ライターの斎藤哲也さんが本特集の論考で記している。

それは本特集の企画者である武田徹さんが監修を務めた『現代ジャーナリズム事典』からの引用で、「人類学や社会学などで蓄積されてきた科学的な調査方法を駆使し、学術研究（アカデミズム）の世界でも十分に通用するクオリティを持ったジャーナリズム」と説明される。

ジャーナリストで、アカデミシャンでもある武田さんが今回の特集の冒頭で書いているように、ジャーナリズムが学術研究の世界で通用するわけは、ジャーナリズムが自然科学や社会科学と同じく、「形式」を持った「ひとつの科学」だからで、それら諸科学とジャーナリズムとの違いは、「生身の人間や日々流転する社会を相手取り、そのつど臨機応変に対応している」ことにある。

武田さんは自身の論考「SNS時代のジャーナリズム」でも、「ジャーナリズムが依って立つ『思想』と事実へ的確にアプローチする方法を吟味する『科学』を明らかにすること」を目指すと書いている。

では、アカデミック・ジャーナリズムという言葉はいつ頃生まれたものだろうか。

国立国会図書館が運営するデジタルコレクションを使って調べてみた。デジタルコレクションは、著作権の切れた古い資料を中心にデジタル化しており、その全てではないが、自宅のパソコンからでも読むことができる。2022年5月から開始されたこの機能は、調べものをする上では著しく便利だ。

このデジタルコレクションでの検索によって、ジャーナリストの扇谷正造が「岩波ジャーナリズム」は、「日本にアカデミック・ジャーナリズムを確立した。しかし、それは高踏的で大衆をかえりみなかった。その結果、知識は一部知識人や学生のモノとなり、そのため、せっかくの知識も戦争中は現実の反戦主義には無力であった」と書いているエッセイが見つかった（扇谷正造『夜郎自大』1982年、ティビーエス・ブリタニカ）。

これに続く講談社ジャーナリズムと対比する分析は興味深いが、ここでは岩波ジャーナリズムがアカデミック・ジャーナルを確立したという理解にとどめる。
新聞記者の仕事「裏付け」
さらに、遡ると、1936年に哲学者の戸坂潤が、最も優れたアカデミック・ジャーナリズムが「帰着」するのが、「漱石文化」であり、「漱石文化に立つ岩波ジャーナリズムは、それ自身アカデミックなものだ」と述べていた（『戸坂潤全集第五巻』1967年、勁草書房）。

漱石文化と言うと話が飛躍してそうだが、どうも、アカデミシャンがジャーナリスト的（岩波を舞台に）行動をすることが、戦前、戦後の一定期間、アカデミック・ジャーナリズムと見られていたようだ。

かつての意味からすると、現在のアカデミック・ジャーナリズムの定義は随分幅広に事象を包摂し、「科学」的な分析を経て、明確になり、「思想」的でもある。

次に、新聞記者としての私の仕事の中で、アカデミック・ジャーナリズムと呼べるような仕事は何かあるだろうかと考えてみると、「裏付け」という作業がそれにあたるのでは思った。

裏付けとは何か。例えば、ある事実を書くために、関係者の証言や回想を用いることがある。その際、その証言や回想は裏付けが取れない限り、事実とは言えない。だから、裏付けのための作業は出来うる限り、徹底的にする。

映画監督の岡本喜八は太平洋戦争末期、愛知県豊橋市の豊橋陸軍予備士官学校で米軍機から爆撃を受け、そこで大勢の仲間を失ったとドキュメンタリー番組や自著、雑誌に掲載されたエッセイで証言していた。それが後年、喜八が戦争をテーマにした作品を撮るようになった動機だと、映画史などでは解釈されている。

だが、『おかしゅうて、やがてかなしき 映画監督・岡本喜八と戦中派の肖像』を書くために調べているうちに、喜八が語る死者数は30人近いものから10人くらいまでと幅が大きく、そもそも喜八の証言以外でこの体験が確かめられていないことが分かった。喜八が全39作品のうち半数近くで戦争を描いた動機がこの体験ならば、調べねばならないだろうと裏付けを行った。

豊橋に行き、郷土史家が当時付けていた日記を読み、消防記録にあたり、その場に居合わせた仲間や上官を探し、その手記などを用いて、数の特定を試みた。

それらの調査の結果、まず爆撃自体は事実だと分かった。その上で、数については生存者の数を死者数として書いているのではないかと結論付けた。

しかし、私の最終的な目的は、喜八の証言が事実かどうかを裏付けることにあるのではない。事実でないことを事実のように書いた心象、つまりこの場合、なぜ生存者数と死者数を入れ替えたのかということに関心は傾斜する。
薬学部の「たにし踊り」の謎
それを知るためには、たとえば「戦争体験としては、まことにチャチだ。しかし、青春体験としては、私なりにまことに痛烈だった」という喜八の言葉が表象するものをたどっていく必要がある。

正しさを証明したいのではなく、むしろ正しさを疑いたい。武田さんが論考の中で、「現実のジャーナリズムは訂正が得意ではない」と指摘しているが、それはもしかしたら、自らが常に正義の側に立っていると考える""病""が原因となっているようにも思う。

ちなみに、本号で私がもっとも共感したのは、音楽社会史を専門にする渡辺裕さんのエッセイ「《たにし踊り》の旅」だ。渡辺さんはテレビ番組『探偵！ナイトスクープ』で、「たにし踊り」という薬学部で昔から踊られていたという踊りを知った。

同番組のHPを見ると、この回は1992年10月2日に放送されているので、渡辺さんは30年以上たっても忘れがたいほど印象的だったのだろう。渡辺さんはここから、例の国立国会図書館のデジタルコレクションを使って、この踊りについて調べ出す。

検索を繰り返し、薬学系の雑誌などをもとに、各地の薬学部で戦前から踊られていたことを確かめ、この踊りが戦争をきっかけに薬学部から医学部、さらに旧制高校などへと広がっていたことを突き止めた。満洲や南方などの戦線に召集された薬学出身者が、宴会などの座興で、この踊り踊ったことがきっかけのようだ。

これでも、まだエッセイの半分ほどしか紹介できていない（むしろ本題は後半だろう）。このエッセイの何にひかれるかと言えば、面白いテレビ番組を見たというところから、起源、伝播、形態へと話が広がり、ついに「全文検索」という機能と「人文学のあり方」の可能性を論じるところまで行き着くところだ。

結局のところ、私もそうなのだ。より大きな「思想」（などというほどのことではないが）は、好奇心を原動力に、日常の些事から着想し、そこから歴史をたどり、たどりついたところから現代を見てみたいということだ。

そのために、文献があれば読み、人がいれば、会って話を聞きたい。それらによって得られた情報を「人文的」、「科学的」に有機的に結びつけ、分析する。その過程に事実の裏付けも含まれる。しかし、それはアカデミック・ジャーナリズムとは呼べないのだろうか。
前田啓介（Keisuke Maeda）
1981年生まれ。上智大学大学院修了。2008年、読売新聞東京本社入社。長野支局、社会部などを経て、現職。近現代史や論壇を担当。満蒙開拓や、ペリリュー・アンガウルの戦い、沖縄戦、特攻、シベリア抑留など戦争に関する取材に関わってきた。著作に『辻政信の真実: 失踪60年――伝説の作戦参謀の謎を追う』（小学館新書）、『昭和の参謀』（講談社現代新書）がある。


　『アステイオン102』
　 公益財団法人サントリー文化財団・アステイオン編集委員会［編］
　 CEメディアハウス［刊］
前田啓介（読売新聞記者）",[],[]
日本は「内需経済」で今後は成長できる...トランプ関税が示唆する日本の針路（ニューズウィーク日本版）,https://news.yahoo.co.jp/articles/a8986773bd687f54a04e2d239e62434129ea3428,https://newsatcl-pctr.c.yimg.jp/t/amd-img/20250716-00010005-newsweek-000-2-view.jpg?exp=10800,2025-07-16T17:40:41+09:00,2025-07-16T17:49:38+09:00,ニューズウィーク日本版,newsweek,ニューズウィーク日本版,767,"＜日米関税交渉の行方は、そして「トランプ関税」の日本経済への影響は？経済評論家の加谷珪一氏が本誌・長岡義博編集長と日本が採るべき長期「デカップリング」戦略について動画で語った＞
日本の赤沢経済産業相と話すトランプ大統領（4月16日）　Molly Riley/White House/ZUMA Press Wire via Reuters
加谷氏は関税交渉の結果、仮にトランプ政権が日本の輸入品に高関税を課せば工場の海外移転が促され、自動車産業を中心に国内産業が空洞化する中長期的なリスクが高いと指摘する。
【動画で見る】トランプ関税を機に日本は「内需経済」に舵を切れ...日米関税交渉が示唆する日本の針路
不透明性を増すアメリカから日本は「デカップリング（切り離し）」すべきか？　こう問う長岡編集長に対し、加谷氏は「アメリカに貿易も安全保障も全て依存するのはリスクが高い」と同調。そして日本が内需経済で成長できるポテンシャルはある、と主張する。

日本の人口減少トレンドは足かせにならないのか、との長岡の疑問に、加谷氏は経済学の「成長会計」理論を参照しつつ解説。経済成長の要因は労働力人口より、資本投下や技術革新による生産性向上の寄与度が大きく「人口減はあまり気にする必要はない」と強調する。

そして、生産性を高める社会・経済構造への転換こそが急務で、アメリカからの経済的自立を本気で考え始める時期だと説く。

動画では日本が内需に舵を切るべき理由をさらに深掘りするほか、トランプ主義こそ米政治思想の本流であるという歴史的背景や、米中関税交渉が中国に好都合であり、世界の勢力圏の再編を促す可能性についても議論されている。

※これは動画の抜粋記事です。詳しくは下記リンクから動画本編をご覧ください
ニューズウィーク日本版ウェブ編集部",[],[]
