headline,mainEntityOfPage,image,datePublished,dateModified,author,media_en,media_jp,str_count,body,images,external_links
【詳報】新観光列車はなあかり　10月運行開始、敦賀～城崎温泉を結ぶ　高級感あふれる車内　伝統工芸品が飾られ、まるで美術館（FBC 福井放送）,https://news.yahoo.co.jp/articles/72788b7c59ec35b8c7aef18e54ed92ac0368fbc8,https://newsatcl-pctr.c.yimg.jp/t/amd-img/20240903-04846328-fbc-000-2-thumb.jpg?exp=10800,2024-09-03T19:26:01+09:00,2024-09-03T19:32:06+09:00,FBC 福井放送,fbc,FBC 福井放送,1183,\nFBC福井放送\n北陸3県への誘客を図るJRグループによる大型観光キャンペーンが10月からスタートします。目玉のひとつが、新たな観光列車「はなあかり」。高級感あふれる車内を一足早く取材してきました。\nFBC福井放送\n■リポート 坂本優太キャスター\n「10月デビューの観光列車はなあかり。北陸の福井の観光に希望をともす高級感漂う光です」\n\n先月29日、京都市内で落成式が行われ、報道陣にお披露目されたJR西日本の新たな観光列車「はなあかり」。\n\n北陸デスティネーションキャンペーンに合わせて、10月5日から12月22日まで土日限定で、敦賀駅を起点に京都・天橋立などを経由して、兵庫県の城崎温泉までをゆっくり5時間かけて結びます。\nFBC福井放送\n■リポート 坂本優太キャスター\n「どんな世界が広がっているんですかね。まずはグリーン車、失礼します。広い！ホテルのような高級感。足元もじゅうたんですよ。これは良い旅できそう」\n\n列車は「グリーン車」2両と、さらにグレードの高い「スーペリアグリーン車」1両の、合わせて3両で運行され、定員はわずか54人。「スーペリアグリーン車」は籠をイメージした半個室となっています。\nFBC福井放送\n■リポート 坂本優太キャスター\n「ひとつの座席が広い。大人1～2人座れるくらいの広さがあります」\n\nまた、高級感あふれる車内には、沿線各地の伝統工芸品が飾られ、まるで美術館のようです。\nFBC福井放送\n■リポート 坂本優太キャスター\n「車内にはいたる所に花のモチーフが散りばめられています。そしてアレンジメントですが、越前和紙が使われています。観光列車はなあかり、その象徴として越前和紙が使われています」\n\n「はなあかり」のコンセプトは「地域の華を列車に集めて、乗客と地域の縁を結ぶ」。「小鯛のささ漬け」や「若狭かれい」など、若狭の食材を集めた豪華な弁当を販売する他、停車時間が長い美浜駅では、駅前の道の駅で沿線の特産品もアピールします。\nFBC福井放送\nまた、沿線の観光協会も列車の運行に合わせてさまざまなキャンペーンを展開。おおい町では、若狭本郷駅の停車時に、駅に隣接する「情報交差点ぽーたる」へ立ち寄った人に、硬券を模した日付け入りの記念証をプレゼントします。\n\n■おおい町観光協会の担当者\n「おおい町は敦賀まで電車だと1時間半かかってしまうので、少しでも認知度を上げて、お越しいただけるようになってほしい。たくさんのお客さんに来てもらえること、楽しみにしている」\nFBC福井放送\n「はなあかり」は、城崎温泉へ向かう下りが土曜日に、敦賀へ戻る上りは日曜日に、それぞれ1本ずつ運行されることになっていて、きっぷは9月5日から全国の駅のみどりの窓口などで販売開始となります。,"['https://newsatcl-pctr.c.yimg.jp/t/amd-img/20240903-04846328-fbc-001-2-view.jpg?exp=10800', 'https://newsatcl-pctr.c.yimg.jp/t/amd-img/20240903-04846328-fbc-002-2-view.jpg?exp=10800', 'https://newsatcl-pctr.c.yimg.jp/t/amd-img/20240903-04846328-fbc-003-2-view.jpg?exp=10800', 'https://newsatcl-pctr.c.yimg.jp/t/amd-img/20240903-04846328-fbc-004-2-view.jpg?exp=10800', 'https://newsatcl-pctr.c.yimg.jp/t/amd-img/20240903-04846328-fbc-005-2-view.jpg?exp=10800', 'https://newsatcl-pctr.c.yimg.jp/t/amd-img/20240903-04846328-fbc-006-2-view.jpg?exp=10800']","['https://news.yahoo.co.jp/articles/72788b7c59ec35b8c7aef18e54ed92ac0368fbc8/images/000', 'https://news.yahoo.co.jp/articles/72788b7c59ec35b8c7aef18e54ed92ac0368fbc8/images/001', 'https://news.yahoo.co.jp/articles/72788b7c59ec35b8c7aef18e54ed92ac0368fbc8/images/002', 'https://news.yahoo.co.jp/articles/72788b7c59ec35b8c7aef18e54ed92ac0368fbc8/images/003', 'https://news.yahoo.co.jp/articles/72788b7c59ec35b8c7aef18e54ed92ac0368fbc8/images/004', 'https://news.yahoo.co.jp/articles/72788b7c59ec35b8c7aef18e54ed92ac0368fbc8/images/005']"
越前市の死亡ひき逃げ事件　遺体は市内在住の30歳女性　複数の車にはねられたか　大型トラックなど4人の運転手から事情聴取　先月末、国道8号で発生（FBC 福井放送）,https://news.yahoo.co.jp/articles/028b26a5bd4d3ceb0f97c2acfebb146f773e13b3,https://newsatcl-pctr.c.yimg.jp/t/amd-img/20240903-09589544-fbc-000-4-thumb.jpg?exp=10800,2024-09-03T18:48:00+09:00,2024-09-03T19:16:06+09:00,FBC 福井放送,fbc,FBC 福井放送,539,\nFBC福井放送\n越前市の国道で女性が死亡しているのが見つかったひき逃げ事件で、警察は大型トラックの運転手など、4人の運転手から詳しく話を聞いています。\n\n8月29日午前1時40分ごろ、越前市横市町の国道8号の交差点内で、女性が倒れているのが見つかったもので、女性はその場で死亡が確認されました。複数の車にはねられていて、遺体の損傷が激しく、身元の特定に時間がかかっていましたが、警察によりますと、亡くなったのは越前市押田2丁目の会社員廣瀬有紗さん(30)だと確認されたということです。\n\n事故当時、現場には軽自動車と大型トラックの運転手がいて「事故を起こした」という趣旨の話をしていた他、別の大型トラックを運転していた越前市五分市町の会社員玉村正徳さん(45)も現場に戻ってきて、同じような話をしていたということです。警察によりますと、玉村さん運転の大型トラックが最初に廣瀬さんをはねたとみられています。\n\nその後の捜査で、防犯カメラの映像から、越前市の男性が運転する普通乗用車も廣瀬さんをはね、現場を離れていたことが分かったということで、警察ではひき逃げ事件とみて、関係する4人の運転手から話を聞くなどして、廣瀬さんが死に至った状況などを詳しく調べています。,[],[]
県産ブランド米をアピール　ローソンで全国販売「いちほまれの塩にぎり」　全国1万4000店舗で取り扱い　去年に続き「日本おこめぐり」シリーズ採用（FBC 福井放送）,https://news.yahoo.co.jp/articles/96faa89e473181ce6e5c60cb93845b929e3e3e0f,https://newsatcl-pctr.c.yimg.jp/t/amd-img/20240903-08745477-fbc-000-3-thumb.jpg?exp=10800,2024-09-03T18:41:01+09:00,2024-09-03T19:19:06+09:00,FBC 福井放送,fbc,FBC 福井放送,773,\nFBC福井放送\n大手コンビニエンスストアのローソンは、今年も福井県産のブランド米「いちほまれ」を使ったおにぎりを全国販売し、若い世代にそのおいしさをアピールします。\n\n全国のブランド米のおいしさを知ってもらおうと、ローソンは各地の希少な米を使ったおにぎりを「日本おこめぐり」シリーズと題して販売していて、福井県産の「いちほまれ」は、去年5月に続いて2回目の採用となりました。\n\n「いちほまれ」は白くて艶があり、優しい甘みがあるのが特徴で、具無しでのりを巻かない「塩にぎり」で販売します。ローソンの担当者は3日、県庁を訪れ、鷲頭副知事に試食してもらいながら、今回のおにぎりの特徴を紹介していました。\n\n■ローソン 中部カンパニー北陸・三岐営業部 小畑紀之営業部長\n「特に30代から50代の客層に好調だった。今回第2弾として発売する」\n\nコメ本来の甘さを引き立てた「福井県産米いちほまれ使用 塩にぎり」は、全国1万4000店のローソンで3日から販売され、およそ800万個の販売を見込んでいます。また「とろろ昆布のおにぎりセット」も北陸3県限定で販売されます。\n\n＜日本おこめぐり＞シリーズ一覧\n第1弾(2022年7月) 北海道「ふっくりんこ」\n第2弾(2022年9月) 山形「雪若丸」\n第3弾(2022年11月) 石川「ひゃくまん穀」\n第4弾(2023年3月) 富山「富富富」\n第5弾(2023年5月) 福井「いちほまれ」\n第6弾(2023年7月) 北海道「ゆめぴりか」\n第7弾(2023年9月) 富山「富富富」\n第8弾(2023年11月) 新潟「新之助」\n第9弾(2024年3月) 秋田「サキホコレ」\n第10弾(2024年5月) 石川「ひゃくまん穀」\n第11弾(2024年7月) 青森「青天の霹靂」,[],[]
シーズン開幕まで1か月　福井ブローウィンズ、B1昇格へ健闘誓う　知事「優勝を勝ち取って」　来月プレシーズンマッチ開催、敦賀市総合運動公園体育館（FBC 福井放送）,https://news.yahoo.co.jp/articles/1c5434765ce32bfc27e7e4ce2cecab8a3f2d21bb,https://newsatcl-pctr.c.yimg.jp/t/amd-img/20240903-02521979-fbc-000-3-view.jpg?exp=10800,2024-09-03T18:38:00+09:00,2024-09-03T18:48:10+09:00,FBC 福井放送,fbc,FBC 福井放送,391,\n健闘を誓う福井ブローウィンズの選手たち＝3日午後3時半、県庁\nリーグ開幕を前に、プロバスケットボールB2・福井ブローウィンズの選手たちが3日、杉本知事を表敬訪問し、地域の盛り上げとB1昇格に向けた健闘を誓いました。杉本知事は「チームプレーで最後まで戦って、優勝を勝ち取ってほしい」と激励しました。\n\nチームは今シーズン、元NBA選手のライアン・ケリー選手など3人が新たな戦力として加わり、攻守の切り替えと攻めの速度を上げるアップテンポな試合運びを掲げていて、9月7日と8日には敦賀市総合運動公園体育館で、神戸ストークスとのプレシーズンマッチが予定されています。\n\n■福井ブローウィンズ 満田丈太郎キャプテン\n「もちろんB2優勝、B1昇格が絶対の目標」\n\n開幕戦は10月5日、福井市のセーレン・ドリームアリーナ(県営体育館)で信州ブレイブウォリアーズと対戦します。,['https://newsatcl-pctr.c.yimg.jp/t/amd-img/20240903-02521979-fbc-000-3-view.jpg?exp=10800'],['https://news.yahoo.co.jp/articles/1c5434765ce32bfc27e7e4ce2cecab8a3f2d21bb/images/000']
“看護補助者”の仕事体験　看護の質向上へ、人材確保目指す　医療現場の働き方改革も　ベッドメイクなど担当　県看護協会（FBC 福井放送）,https://news.yahoo.co.jp/articles/4d8d18ea465caee499e5780ada215e15943bc9fc,https://newsatcl-pctr.c.yimg.jp/t/amd-img/20240903-04323513-fbc-000-3-thumb.jpg?exp=10800,2024-09-03T19:00:00+09:00,2024-09-03T19:27:06+09:00,FBC 福井放送,fbc,FBC 福井放送,617,\nFBC福井放送\n患者の身の回りの世話などを通して、看護師の業務をサポートする「看護補助者」の職業体験会が3日、福井市内で開かれ、働き方改革が進む医療現場の人材確保を目指します。\n\n■車いす演習の場面\n「片足上げてください。乗せてください」\n\n「看護補助者」は、ベッドメイキングや車いすを使った患者の搬送など、看護師の補助をする職員のことで、特別な資格や医療現場の経験がなくても働くことができます。\n\n■県看護協会 看護教育課 井上恭久子さん\n「医師の働き方改革を進める中で、看護師が専門的な業務を行うことがこれまで以上に重要性を増してきている。物品の整理とかを(看護師が)担っていたけれど、看護補助者に任せることで、これまで以上に質の高い看護に専念できる」\n\n看護補助者を募集する病院・クリニックは県内でおよそ40施設あり、県看護協会では体験会を通じて、人材の確保につなげたいとしています。\n\n■参加者\n「医療介護系で仕事を探している。人手が足りないようなので、自分にできることがあれば良いなと(思う)」\n\n福井市内の病院で働く看護補助者も仕事のやりがいを語りました。\n\n■つくし野病院 看護補助者 岡山敦生さん\n「患者からの感謝の言葉や笑顔を直接受け取ることができる。患者の回復を手助けできる喜びは大きなやりがい」\n\n体験会は福井市と敦賀市の2会場で、今月中にあと3回予定されています。,[],[]
山口茜選手や“シダマツ”ペアが講師に　勝山市でバドミントンクリニック、9月29日開催　市体育館ジオアリーナ　市政施行70周年記念事業（FBC 福井放送）,https://news.yahoo.co.jp/articles/f2393bc0af8c6b32012d61329e265b47b8a7aa95,https://newsatcl-pctr.c.yimg.jp/t/amd-img/20240903-02955398-fbc-000-2-view.jpg?exp=10800,2024-09-03T15:29:01+09:00,2024-09-03T15:33:10+09:00,FBC 福井放送,fbc,FBC 福井放送,508,\n山口茜選手\n山口茜選手をはじめ、“シダマツ”ペアなどパリオリンピックに出場した国内の一流選手が参加するバドミントンクリニックが、29日に勝山市のジオアリーナで開かれることになりました。市政施行70周年記念事業のひとつとして、勝山市バドミントン協会が開くもので、参加対象は幼児から高校生までとなっています。\n\n講師には、くまもと再春館製薬所バドミントンチームから、パリオリンピックに出場した勝山市出身の山口茜選手をはじめ、女子ダブルスで銅メダルを獲得した“シダマツ”ペアこと、志田千陽選手と松山奈未選手が招かれています。また、トナミ運輸バドミントン部からも、パリオリンピック男子ダブルスに出場した保木卓朗選手と小林優吾選手、それに女子シングルスの大堀彩選手、勝山市出身で日本B代表の大林拓真選手など、国内トップ選手が講師として参加予定です。\n\n当日は2階の観覧席を無料で開放し、自由に見学できるようにするということで、チームや選手のグッズ販売も予定されています。クリニックでは、子どもたちの指導に加え、エキシビションマッチも予定されていて、世界で活躍するトップアスリートの技を間近で楽しむことができます。,['https://newsatcl-pctr.c.yimg.jp/t/amd-img/20240903-02955398-fbc-000-2-view.jpg?exp=10800'],['https://news.yahoo.co.jp/articles/f2393bc0af8c6b32012d61329e265b47b8a7aa95/images/000']
高速道路での事故対応訓練　逆走車を想定した通行規制も　北陸三県の県警が合同で実施　ネクスコ中日本とも連携強化（FBC 福井放送）,https://news.yahoo.co.jp/articles/dbe88baf6cf43820054576b976959ec855589021,https://newsatcl-pctr.c.yimg.jp/t/amd-img/20240903-08665466-fbc-000-3-thumb.jpg?exp=10800,2024-09-03T18:17:00+09:00,2024-09-03T19:29:05+09:00,FBC 福井放送,fbc,FBC 福井放送,396,\nFBC福井放送\n高速道路でのさまざまな事故を想定して、北陸自動車道・福井インターチェンジ付近で3日、北陸三県の県警が合同で訓練に臨み、道路規制に関してはネクスコ中日本との連携も確認しました。\n\n全国の高速道路で逆走した車による事故が相次いでいることを受けて、県警高速隊の隊員らは逆走車を路肩に停止させ、通行止めにする際の対応などを確認しました。ネクスコ中日本も訓練に参加し、無線を使った連絡などで警察との連携を確認しました。\n\n■福井県警高速道路交通警察隊 田邉将敬副隊長\n「現場臨場する管理隊や警察官については、命がけで現場に臨場している。互いの連携を高めながら、日頃から(訓練を)やっている」\n\n県警によりますと、県内の高速道路で去年起きた人身事故は32件、物損事故は639件と、北陸三県で最も多くなっていて、このうち単独事故が全体の過半数を占めているということです。,[],[]
敦賀まつり開催中　古式ゆかしく「御鳳輦巡幸」　甲冑姿で市内練り歩く　あす(4日)山車巡行、祭りは最高潮に（FBC 福井放送）,https://news.yahoo.co.jp/articles/c972ac2a76325621db0f72c3da42788fd1f2a645,https://newsatcl-pctr.c.yimg.jp/t/amd-img/20240903-09842854-fbc-000-3-thumb.jpg?exp=10800,2024-09-03T16:08:01+09:00,2024-09-03T19:17:06+09:00,FBC 福井放送,fbc,FBC 福井放送,372,\nFBC福井放送\n敦賀に秋の訪れを告げる「敦賀まつり」は3日、御鳳輦巡幸(ごほうれんじゅんこう)が行われ、古式ゆかしい装束を身に着けた人たちの行列が市内を練り歩き、観光客を魅了しました。\n\n御鳳輦(ごほうれん)は、気比神宮のご神体を祭ったみこしで、雅楽が奏でられる中、菊の紋章入りの錦旗を先頭に、甲冑(かっちゅう)姿の武士や馬に乗った神職ら、古式ゆかしい装束をまとった大勢の市民が市内を練り歩きました。\n\n■見物客\n「立派というか、港町の心意気ですね。やっぱりすごい。よかったです。あしたも来たい」\n\nまた、2日は前夜祭にあたる「宵山巡行」も行われ、山車(やま)の上の舞台で子どもたちがかわいらしい踊りを披露し、祭りを盛り上げました。\n\n祭りは4日が最終日で、勇壮で豪華絢爛な6基の山車が市内を練り歩き、最高潮を迎えます。,[],[]
スマホにメッセージ表示させ、10代女性を車に…　「誘拐するつもりはなかった」無罪主張　元団体職員の男の初公判　未成年者誘拐未遂の罪（FBC 福井放送）,https://news.yahoo.co.jp/articles/81d5349a8c46089fdf258619b568007574332cb4,https://newsatcl-pctr.c.yimg.jp/t/amd-img/20240903-03256467-fbc-000-2-view.jpg?exp=10800,2024-09-03T16:35:01+09:00,2024-09-03T16:41:05+09:00,FBC 福井放送,fbc,FBC 福井放送,442,\nFBC福井放送\n福井市内の路上で10代の女性を車に乗るよう誘ったとして、未成年者誘拐未遂の罪に問われている福井市宝永の元団体職員武藤顕紀被告(30)の初公判が3日、福井地裁であり、被告は「誘拐するつもりはありませんでした」と無罪を主張しました。\n\n起訴状などによりますと、武藤被告は今年7月10日、福井市内の路上でランニング中だった10代女性に対し「お金を渡すので後ろに乗ってくれませんか？話したいです」とスマートフォンにメッセージを表示し、車に誘い込んで誘拐しようとした疑いです。女性がその場から逃げたため、未遂に終わりました。\n\n被告の弁護側は「実行の着手に故意は無かった」として、無罪を主張しました。一方、検察側は、ドライブレコーダーに被告が被害者を車で追いかけ、5000円札を車内から見せる様子が映っていたと指摘しました。同じ日に、別の女児に対しても、運転席から合図を送り、車に乗るよう促していたということです。\n\n次の裁判は10月15日に開かれる予定です。,['https://newsatcl-pctr.c.yimg.jp/t/amd-img/20240903-03256467-fbc-000-2-view.jpg?exp=10800'],['https://news.yahoo.co.jp/articles/81d5349a8c46089fdf258619b568007574332cb4/images/000']
若者の間に“違法薬物”広がる　ネット上にあふれる誤った情報　検挙者数が過去最多に　大麻や覚醒剤など所持・使用　今年上半期で43人検挙（FBC 福井放送）,https://news.yahoo.co.jp/articles/b739d719fe04537970ec3d00b510a4ea16188f09,https://newsatcl-pctr.c.yimg.jp/t/amd-img/20240903-03852745-fbc-000-3-view.jpg?exp=10800,2024-09-03T14:33:01+09:00,2024-09-03T14:45:05+09:00,FBC 福井放送,fbc,FBC 福井放送,410,\nFBC福井放送\n県警が今年上半期に大麻や覚醒剤など違法薬物の所持で検挙した人数は43人で、2001年以降で最も多かった去年の上半期を7人上回り、過去最多となりました。\n\nこのうち覚醒剤が25人で、大麻が17人、危険ドラックやその他の薬物が1人となっています。覚醒剤は40代から60代が全体の7割を占めているのに対し、大麻は20代が全体の7割を占めていて、若年層の間で特に広がっているとみられています。\n\nSNSの普及で違法薬物を入手しやすくなったことが、若者の検挙数が増えている背景にあると考えられていて、県警は「大麻は有害ではない」といった誤った情報がインターネット上で流れ、それを信じてしまう若年層が多いことも、大麻がまん延する要因となっていると指摘しています。\n\n県警では、違法薬物専門の電話相談窓口を設け、24時間体制で相談を受け付けています。電話番号は0776-21-4618となっています。,['https://newsatcl-pctr.c.yimg.jp/t/amd-img/20240903-03852745-fbc-000-3-view.jpg?exp=10800'],['https://news.yahoo.co.jp/articles/b739d719fe04537970ec3d00b510a4ea16188f09/images/000']
