headline,mainEntityOfPage,image,datePublished,dateModified,author,media_en,media_jp,str_count,body,images,external_links
腹話術で子どもや高齢者向けの講習を披露　Fuku-1グランプリ　県民の交通意識を高めるきっかけに　鳥取県鳥取市（日本海テレビ）,https://news.yahoo.co.jp/articles/eaa175a7665918f17c579dd59c5526920fa75073,https://newsatcl-pctr.c.yimg.jp/t/amd-img/20251209-01344758-nkt-000-2-thumb.jpg?exp=10800,2025-12-09T19:04:00+09:00,2025-12-09T19:38:31+09:00,日本海テレビ,nkt,日本海テレビ,416,"日本海テレビ
交通安全講習などで警察官が行う腹話術の技術などを競う大会が初めて観客を入れて開催されました。

鳥取市で行われたのは交通安全に関する講習を腹話術で行い、その技術や内容を競うFuku-1グランプリです。鳥取県内から9組11人の警察官が出場し、子どもや高齢者向けの講習を披露しました。

今回は初めて、観客を入れて大会を開催。地元の園児や一般市民など約70人を前に、出場者は横断歩道の渡り方や夜道での反射材の着用など工夫を凝らした内容と腹話術で伝えました。

観客
「あんまり見たことがないのですごく新鮮な感じです。こどもは多分こっちの方が集中して聞けるかなと思います」

高速隊　岡野真介 巡査部長
「実は小さいころに私の腹話術を見ましたという警察官もいて、やっていてよかったな、効果があったんだなというところがありました」

鳥取県警では引き続きこうした取り組みを行い、県民の交通への意識を高めていきたいとしています。",[],[]
実弾を発射する機能がある おもちゃの拳銃を回収　クレーンゲーム等の景品として流通　回収期間は12月末まで　その後は状況に応じて銃刀法違反で摘発される可能性も　島根県（日本海テレビ）,https://news.yahoo.co.jp/articles/ffc3f90de8616401b636ff2b405b5174125c9f9f,https://newsatcl-pctr.c.yimg.jp/t/amd-img/20251209-09996816-nkt-000-2-thumb.jpg?exp=10800,2025-12-09T19:01:00+09:00,2025-12-09T19:33:36+09:00,日本海テレビ,nkt,日本海テレビ,532,"日本海テレビ
クレーンゲームの景品として流通していたおもちゃの拳銃が実弾を発射する機能があることがわかり、全国で警察が回収にあたっています。

カラフルで一見、子ども向けのおもちゃのように見えるおもちゃの拳銃。しかしー。

「まず銃身と弾倉が貫通している。2つ目は弾倉を出して球を装填することが出来る」

去年12月末ごろから島根県内で約140丁流通しているとみられる中国製の「リアルギミックミニリボルバー」。

全長12センチ、重さ55グラムのプラスチック製のおもちゃの拳銃ですが、銃口がふさがっておらず、本物と同じように弾を込め、発射することができることから、“真正拳銃”として島根県警はこれまでに34丁を回収しています。

県内ではクレーンゲームの景品として販売されていたということで、依然として100丁以上が出回ったままとなっています。

島根県警組織犯罪対策課　藤田浩二 次長 
「子どもさんがクレーンゲーム等の景品として持っている方がいると思いますので、家族で確認していただいてあれば最寄りの警察署までお持ちいただきたい」

島根県警は12月末までを回収期間と定め、これを過ぎて所持すると、状況に応じて銃刀法違反で摘発される可能性があるということです。",[],[]
車輪の脱落事故の防止を目的に街頭検査　タイヤ交換時の作業不備や「増し締め」を行わないなどの保守管理不備が原因か　島根県松江市（日本海テレビ）,https://news.yahoo.co.jp/articles/f570479634adcf4c4404abd0810e133b8b2acffa,https://newsatcl-pctr.c.yimg.jp/t/amd-img/20251209-02722195-nkt-000-2-thumb.jpg?exp=10800,2025-12-09T19:00:00+09:00,2025-12-09T19:04:37+09:00,日本海テレビ,nkt,日本海テレビ,515,"日本海テレビ
12月9日に島根県松江市の国道で大型車の車輪の脱落事故の防止を目的とした街頭検査が行われました。

この街頭検査は、冬用タイヤの交換時期に車輪脱落事故が急増する傾向があることから、国土交通省中国運輸局島根運輸支局が行ったものです。

国交省によりますと、事故は12月から2月の冬用タイヤ交換後、1か月以内に多く発生。主な要因は、タイヤ交換時の作業不備や、交換して50キロから100キロ走行後に再びナットを締める「増し締め」を行わないなど、保守管理不備と推定されています。

9日は国交省の職員らがハンマーでホイールナットを叩き音や手の感触などで、タイヤがしっかり装着されているか確認しました。

国土交通省中国運輸局島根運輸支局　橋本眞美 さん
「まずは確実に作業を実施していただくということ、それから一定期間経過後に必要な時期に増し締めを行っていただく、それから何より大切なのが日常の点検整備、こちらを確実に行っていただきたいと思います」

昨年度、全国で120件発生した大型車の車輪脱輪事故。国交省ではネクスコや県警と協力し、パーキングエリアのサイネージや電光掲示板などでも注意を呼びかけていきたいとしています。",[],[]
災害時の最前線を担う　消防署のウラガワへ潜入　地域の命と暮らしを守る人たちの姿に迫る　鳥取県（日本海テレビ）,https://news.yahoo.co.jp/articles/f68154bd8200b075a84ab5ee0ca2ab190a83514c,https://newsatcl-pctr.c.yimg.jp/t/amd-img/20251209-08758517-nkt-000-2-thumb.jpg?exp=10800,2025-12-09T18:58:00+09:00,2025-12-09T19:02:34+09:00,日本海テレビ,nkt,日本海テレビ,2074,"日本海テレビ
地震や火事など、災害時の最前線を担う消防署。そんな消防署のウラガワに迫ります。

11月7日に鳥取県南部町の養豚場で発生した火災。8棟ある豚舎のうち6棟が全焼し、焼け跡から2人の遺体を発見。発生から鎮火までに、約15時間を要しました。

今まさに、火事が発生しやすい季節を迎えています。

鳥取消防署予防課　山根敬大 さん
「気温も寒くなってきまして、空気も乾燥してきますので、暖房器具による火災というのが、多くなってきます。洗濯物など衣類を暖房器具の周囲に置かないようにしていただきたいこと。また、給油の際にはしっかりと火を止めて、給油をしていただくこと。また、古い灯油を使わないようにお願いしたいと思います」

こちらは、鳥取市の鳥取消防署。鳥取県東部広域行政管理組合消防局に所属、組織全体で鳥取県東部エリア約20万人の命を守っています。

こちらでは、43人の隊員が2交代制で、火災や救急などに24時間体制で対応。はしご車や救助工作車など9台の消防車、2台の救急車が配備されています。

Q.消防車たくさんありますけど、シャッターがついてたりするんですけど、これは？

鳥取消防署　竹内雄紀 さん
「はい、シャッターを開けると、資機材が収納されています。以前は資機材が露出してたんですけど、資機材を多く積載したりだとか、保護するという観点から、シャッター式が採用されています」

以前のものに比べ、ホースなどの資機材が落ちないなどのメリットもあるそうで、配備されているほとんどの消防車が全面シャッター仕様です。

鳥取消防署　竹内雄紀 さん
「このホースの下の方には、投光器が積載されています。昼間に火災があったとしても、火災の建物自体は真っ暗ですので、基本的にはライトを持って、消防隊員は入ります」

出動する災害に合わせ、様々な装備を持つ消防車が待機。それらは希望すれば見学することもできるそうです。

とはいえ、一般の方が消防署内へ入る機会はほとんどないはず。それでは、鳥取消防署のウラガワへ潜入。するとー。

Q.たくさんの服が並んでますね？

鳥取消防署　竹内雄紀 さん
「はい。廊下の方には、災害現場に出動する際の防火服を各隊員が準備しております」

この防火服のズボンにはこんな仕掛けが。

鳥取消防署　竹内雄紀 さん
「これ見ていいただいて分かるように、ズボンと長ぐつが一緒になった状態でセッティングしてあります。一分でも一秒でも早く出動するために各隊員が工夫していることになります」

他にも水難事故の際のウェットスーツや化学防護服など、災害に合わせた服装が準備されています。

こちらは、火災現場などで欠かすことのできない装備「空気呼吸器」。

鳥取消防署　竹内雄紀 さん
「中の方には空気が入っておりまして、だいたいこのボンベ1本で、10分から15分程度もつようなかたちとなっております。火災現場自体はやはり煙がすごいですし、熱気というのもありますので、隊員がその熱気や煙を吸わないために、呼吸保護のためとしてこういった装備を配備しています」

これらの装備が、災害現場で隊員たちの活動を支えているのです。

Q.みなさん、何をされてるのですか？

鳥取消防署　竹内雄紀 さん
「今は、昨日火災が発生してまして、それのホースを洗う作業をしています」

取材の前日、鳥取市内で火災が発生。出動時に現場で使ったホースには、すすやドロ、油などの汚れが付着。汚れたままでは、破れや穴あきを見つけることもできません。次の出動に備え、毎回洗浄しています。

保有するホースは、約400本。その管理も、消防隊員の大事な仕事です。

関係者以外の立ち入りが厳しく制限されている場所があります。それが「消防指令センター」。鳥取県東部エリアの119番通報は、この消防指令センターにつながります。ここから、災害・救急の通報状況により出動指令が出されます。

訓練の様子を見せていただきました。

指令を受け、着替え、災害現場の情報を確認。出動するまでの時間は1分から2分。時間との闘いです。

鳥取消防署　竹内雄紀 さん
「近年、自家用車の防音性能が向上してると思います。ですので、緊急車両の音が聞こえづらいことが発生しているかと思います。しかし、消防車両が緊急走行していると気が付いた際には、安全に緊急車両が通れるように、道を譲っていただけたらと思います」

消防の最前線では、迅速かつ安全に対応することが、常に求められているのです。

鳥取消防署係長消防指令　平野達哉 さん
「この建物には鳥取消防局と、鳥取消防署が入っており、各係が協力し、昼夜を問わず表側、裏側から消防業務に尽力しております。これから寒い季節を迎え、空気も乾燥し、火災リスクの高まる季節となります。住民のみなさまには、火災予防にご協力いただきますよう、よろしくお願いします」

「鳥取消防署」のウラガワには、地域の命と暮らしを守る人たちの姿がありました。",[],[]
ビーガン料理取り扱い店舗数日本一を目指して　ビーガン協議会が設立　環境保護や健康維持が期待　鳥取県（日本海テレビ）,https://news.yahoo.co.jp/articles/f17ec56efc0160ee6781f8c6f0f218da6a8f5eb8,https://newsatcl-pctr.c.yimg.jp/t/amd-img/20251209-05747482-nkt-000-2-thumb.jpg?exp=10800,2025-12-09T18:42:00+09:00,2025-12-09T18:56:36+09:00,日本海テレビ,nkt,日本海テレビ,1098,"日本海テレビ
動物性食品を使用しないことで環境保護や健康維持が期待される「ビーガン」の普及を図ることで、鳥取県がビーガンの取り扱い店舗数日本一を目指そうと、12月8日に協議会を設立しました。

完全菜食主義として肉や魚など動物由の材料を使わない「ビーガン」。「ベジタリアン」と違い卵やチーズ、はちみつなどの食材も使用しません。

畜産のための森林破壊防止に貢献する「環境保護」や、脂肪分の少ない食事による「健康維持」につながると考えられています。

現在、鳥取県でこうしたビーガンのメニューを取り扱う飲食店は全国で最も少ない4店舗。

ビーガンメニュー開発プロデューサー　福井勇吉 代表
「インバウンドのお客さまに対してビーガンの店舗を増やしたい」

観光庁によると去年1年間の訪日外国人旅行者は過去最高の約3700万人。さらにビーガン・ベジタリアンの世界人口も増加傾向にあるのです。

そこで、鳥取県でのビーガンの認知度を上げ飲食店などでの取り扱いに力をいれようと、8日に県や飲食店が賛同した協議会が設立されました。

家族の病気をきっかけに自身もビーガンでありビーガン料理店を営む代表の福井さんです。

ビーガンメニュー開発プロデューサー　福井勇吉 代表
「新しく県外・世界からたくさんのお客さんを誘致しながら、地場ではおいしいお野菜をたくさん食べて、生産してそれをまた提供する店舗が増えてくるということでの活性化を図る」

目標は鳥取県でビーガンを取り扱う店舗を日本一にすること。県内の飲食店やホテルで、いまあるメニューを基本にビーガンメニューを追加してもらえるよう鳥取県産の野菜を使ったレシピを発信したり、飲食店や農家をつないで県内の経済発展にも貢献していくということです。

参加者
「どういうふうに認識してもらい食事してもらうか。なおかつ皆さんの健康を重点に置きましてメニューを提供したい」

「ビーガンの料理を食べたいという声はなかったんですけど、なかった理由が鳥取でビーガンの料理が食べられないということに気づいたので、もっとパワーアップして営業できたら」

ビーガンメニュー開発プロデューサー　福井勇吉 代表
「東中西部で60店舗の飲食店がビーガンメニューを取り扱っていただくと、人口密度の割合では東京都を抜いて鳥取県が日本一になるビーガンってどんな食べ物なんだろう？とここが1つのきっかけとなり興味が沸くところ、そしてぜひ食べに行ってみたいとなる」

食の多様性として浸透が期待されるビーガン料理。協議会では飲食店だけでなく学校給食や料理教室でも普及に努めたいということです。",[],[]
奥大山スキー場雪崩事故から15年　慰霊献花式　犠牲となった4人の冥福を祈る　当時の事故を教訓に一層の対策を　鳥取県江府町（日本海テレビ）,https://news.yahoo.co.jp/articles/acc39239df30f8427737adf8682c776d9566ce10,https://newsatcl-pctr.c.yimg.jp/t/amd-img/20251209-08138681-nkt-000-2-thumb.jpg?exp=10800,2025-12-09T18:35:00+09:00,2025-12-09T19:16:35+09:00,日本海テレビ,nkt,日本海テレビ,693,"日本海テレビ
鳥取県江府町の奥大山スキー場で雪崩が発生し4人が亡くなった事故から15年。12月9日に慰霊献花式が行われました。

2010年12月31日の午後1時過ぎ、鳥取県江府町の奥大山スキー場でスキー場のパトロール隊員4人が雪崩に巻き込まれ亡くなりました。当時鳥取県西部は、昼前から大雪警報が出され1メートル以上の雪が積もっていた中での事故でした。

江府町　白石祐治 町長
「4人もの方がここでお亡くなりになったということをやっぱり私達は忘れてはならない」

事故発生から15年。9日は、江府町の奥大山スキー場の慰霊碑前で慰霊献花式が行われました。

白石祐治町長や町議会の関係者ら15人が参列。参列者全員が慰霊碑の前で黙とうをささげた後、一人一人が花を供えて犠牲となった4人の冥福を祈っていました。

奥大山スキー場は、雪不足やスキー人口減少などを理由に運営が厳しくなり、事故発生から9年後の2019年以降休業しています。

しかし、凄惨な事故の記憶を決して風化させないよう江府町はスキー場休業後も毎年欠かさずこの時期に慰霊献花式を行っています。

江府町　白石祐治 町長
「今、スキー場はやっていませんですけども、我々がいるかぎり、この献花式は続けていきたい。奥大山スキー場(事故)に限ったことではありませんが、絶えず”安全・安心”に気を配って行政を進めていきたい」

雪崩が発生した15年前の事故当時とは違い、9日は日差しに包まれる中での慰霊献花式となりました。

これからまもなく各地のスキー場でスキーシーズンを迎えますが、今回の事故を教訓に一層の安全対策が求められます。",[],[]
インバウンド客など外国人への対応を　警察学校で外国語対応授業　声かけや道案内のフレーズなどを教わる　島根県松江市（日本海テレビ）,https://news.yahoo.co.jp/articles/f9db02d7d09ef77b1dc137a618aebb8a21bff832,https://newsatcl-pctr.c.yimg.jp/t/amd-img/20251209-06937932-nkt-000-2-thumb.jpg?exp=10800,2025-12-09T18:32:00+09:00,2025-12-09T18:36:33+09:00,日本海テレビ,nkt,日本海テレビ,551,"日本海テレビ
島根県内でインバウンド客など外国人への対応が求められる中、警察学校で外国語を使った対応の授業が行われました。

島根県松江市の島根県警察学校で12月9日に行われた授業には、今年4月に採用された初任科生33人が参加しました。

講師は香港生まれでイギリス育ちの島根県国際交流員ビアンカ・チャンさんが務め、道に迷っている外国人観光客への声かけや、道案内をする際のフレーズなどを学生たちに教えました。

また、外国人が紛失しそうなものを英語で書いていくゲームが行われ、携帯電話でもphone(フォン)やmobile(モバイル)、cellphone(セルフォン)など複数の言い方があることなどを伝えていました。

初任科生　長谷川心乃 さん
「島根県にも結構、外国人の方がおられて松江はバスが多くてバスの乗り方が難しいと言っておられたので、そういうところは重点的に勉強していけたらと思いました」

ビアンカ・チャン さん
「日本の方はインプットはすごく上手だけど、アウトプットはまだまだだなと思って。きょうはいろんなアクティビティを通じてもっと話す自信が持てるようなことができたらいいなと思いました」

島根県警察学校では今後、英語に限らず、その他の外国語対応にも取り組んでいきたいとしています。",[],[]
【読み解く】就寝時間帯に地震発生　身を守るために気を付けるポイントとは　避難のときに身の回りにあると安心なものは？　（日本海テレビ）,https://news.yahoo.co.jp/articles/92f08a42bfaa6301b7a047c161aba13cf4f70820,https://newsatcl-pctr.c.yimg.jp/t/amd-img/20251209-07254753-nkt-000-3-thumb.jpg?exp=10800,2025-12-09T18:30:01+09:00,2025-12-09T20:13:31+09:00,日本海テレビ,nkt,日本海テレビ,846,"日本海テレビ
12月8日に青森県で震度6強を観測した地震は午後11時過ぎに発生しました。夜遅くの地震から身を守るためには、どのようなことが重要なのでしょうか。

1日のうち3分の1から4分の1を無防備な状態で過ごす寝室。防災対策はとても重要です。

地震は、まず「揺れた瞬間」を生き延びることが大切ですがそのために心がけたいポイントです。

まず、ベッドや布団は家具や窓から離して置くこと。家具は固定するのが望ましいのですが、それでも倒れてきてしまった場合、倒れる方向に布団があると下敷きになってしまいます。棚が倒れなくても中身が飛び出す場合もあります。重いもの・割れやすいものは下に置くようにしましょう。

さらに、窓が割れた時に備える飛散防止シート。厚手のカーテンをしっかり閉めることでもガラスの飛散は防げます。

そして今後の避難に備えドア付近にはモノを置かないこと。

他にもそれぞれの部屋のレイアウトによって危険なポイントは変わってきます。「もしこの状態で揺れたら何が危険かな？」と具体的にイメージして対策をすることが重要です。

地震の瞬間を生き延びたら次に考えたいのが避難。そのために枕元にあると良い物がこちらです。

・防災リュック

防災リュックは懐中電灯や水、食料など災害時に必要なアイテムをまとめたもの。市販の防災リュックにはホイッスルが入っていることも多いですが、これは家屋が倒壊した時に人の存在を知らせるもの。枕元などすぐ手の届くところにあるのが安心です。

・頭を守るヘルメット

ヘルメットはかさばりますが、今は折り畳み式もあります。

・スリッパ

スリッパは床に物が散乱してもすぐ避難できるようにするため。

・携帯電話やスマートフォン

これらは枕元で充電しながら寝ている方も多いと思います。それでOK。連絡や情報収集に欠かせません。

防災はひとりひとりが具体的にイメージして備えることが一番有効です。今回の地震を機に自分の身の回りを見直してみましょう。",[],[]
青森県震度6強の地震を受けて　「北海道・三陸沖後発地震注意情報」を発表　山陰両県に被害報告はなし　鳥取県・島根県（日本海テレビ）,https://news.yahoo.co.jp/articles/73b1cbf53063e30e8e2024e0939478327141f92e,https://newsatcl-pctr.c.yimg.jp/t/amd-img/20251209-01545892-nkt-000-2-thumb.jpg?exp=10800,2025-12-09T18:26:01+09:00,2025-12-09T18:36:33+09:00,日本海テレビ,nkt,日本海テレビ,710,"日本海テレビ
12月8日夜11時15分頃に青森県東方沖を震源とするマグニチュード7.5、最大震度6強の地震が発生しました。

この地震により、気象庁は、太平洋沿岸に一時津波警報や津波注意報を出していましたが、現在はすべて解除されています。

今回の地震で気象庁は初めて「北海道・三陸沖後発地震注意情報」を発表しました。

鳥取地方気象台　松本清文 地震津波防災官
「モーメントマグニチュード7.0以上の地震発生後、7日以内にマグニチュード8クラス以上の大規模な地震が発生する可能性が高まっているときに出す情報です」

3年前に運用が始まった「北海道・三陸沖後発地震注意情報」の対象エリアは北海道から東北、関東の沿岸。

地震発生時に発表されるマグニチュードとは異なり、地震によりずれた岩盤の規模をもとにして計算した「モーメントマグニチュード」という単位が7.0以上だった場合、今後も巨大地震が発生する恐れが高まっていることを知らせます。

今回の地震ではモーメントマグニチュード7.4。運用開始前に発生した東日本大震災では3月9日に7.3、3月11日には9.0でした。

また、「北海道三陸沖後発地震注意情報」に似ているものに「南海トラフ地震臨時情報」がありますが、どちらも地震発生から2～3時間ほどで情報がでることになっています。

山陰両県によりますと、県内に被害の報告はなく、県内関係者の漁船など被害の情報はないということです。

鳥取地方気象台　松本清文 地震津波防災官
「入口の浅い地震でも被害は起こります。どういう避難行動が自分では取れるか家族で相談して、普段から地震についても備えていただきたいと思います」",[],[]
