headline,mainEntityOfPage,image,datePublished,dateModified,author,media_en,media_jp,str_count,body,images,external_links
青森県で震度6強を観測する地震　鳥取県・島根県の漁船などに被害の情報なし（日本海テレビ）,https://news.yahoo.co.jp/articles/dabc3dbce52362e67fa4ce7987bb37c6be244b6d,https://newsatcl-pctr.c.yimg.jp/t/amd-img/20251209-06516499-nkt-000-1-thumb.jpg?exp=10800,2025-12-09T13:45:00+09:00,2025-12-09T13:45:00+09:00,日本海テレビ,nkt,日本海テレビ,236,"日本海テレビ
12月9日夜11時15分頃に青森県で震度6強を観測する地震が発生しました。
今のところ、山陰両県に被害に関連する情報は入っていません。

この地震により、気象庁は太平洋沿岸に一時、津波警報や津波注意報を出していましたが、現在はすべて解除されています。

鳥取県危機管理政策課によりますと、鳥取県内に被害の報告はなく、県内関係者の漁船なども被害の情報はないということです。

また、島根県防災危機管理課によりますと、島根県関係も被害の情報はないということです。",[],[]
町営のスクールバスで児童を約10分間置き去りに　バスで寝ている児童を保護者が発見　島根県川本町（日本海テレビ）,https://news.yahoo.co.jp/articles/7b955729e9f7434270ae8eee343702d057e1e169,https://newsatcl-pctr.c.yimg.jp/t/amd-img/20251209-04583717-nkt-000-1-thumb.jpg?exp=10800,2025-12-09T13:41:00+09:00,2025-12-09T13:41:00+09:00,日本海テレビ,nkt,日本海テレビ,380,"日本海テレビ
島根県川本町は町営のスクールバスで12月3日に児童をおよそ10分間置き去りにする事案があったと発表しました。

島根県川本町によりますと3日午後6時頃、川本小学校2年生の児童1人が町営のスクールバスの中におよそ10分間置き去りになる事案があったということです。

児童が帰宅しないため車庫に停めてあったバスを保護者が見に行ったところ寝ている児童を発見。
町教育委員会に連絡しました。

スクールバスは運行後、清掃と同時に車内を確認することになっていましたが、運転手が車内確認を怠りバスの外から車内を確認したのみで寝ている児童に気付かなかったということです。

川本町では今後、車内確認の徹底と運行マニュアルの整備などを行い再発防止に努めるとしています。

また、町教育委員会は運転手に対し文書訓告、担当課長と担当職員に対して口頭注意を行いました。",[],[]
鳥取市の飛鳥建設　破産手続き開始決定　2024年2月頃までに事業を停止　本店不動産が差押えを受ける　鳥取市（日本海テレビ）,https://news.yahoo.co.jp/articles/9b2eb9149ee47b0a9f822244d240eed277e1e046,https://newsatcl-pctr.c.yimg.jp/t/amd-img/20251209-04329995-nkt-000-2-view.jpg?exp=10800,2025-12-09T06:03:00+09:00,2025-12-09T06:15:35+09:00,日本海テレビ,nkt,日本海テレビ,331,"日本海テレビ
帝国データバンク鳥取支店によりますと鳥取市の飛鳥建設は11月27日に大阪地裁より破産手続き開始決定を受けました。

飛鳥建設は1985年8月に設立された土木工事業者です。
官公庁案件の河川改修、圃場整備工事などの土木工事を主体に宅地造成や基礎工事などの民間工事を手がけ2001年6月には年売上高約7900万円を計上していました。

近年は官公庁工事が減少するなか人材不足などもあって2019年6月期の売上高は約3000万円にまでダウンし収益性も厳しく財務内容は債務超過に陥っていました。

その後も業況は改善に至らず2024年2月頃までに事業を停止し同年5月には本店不動産が差押えを受けていました。

負債は約5000万円の見込みだということです。",[],[]
2025年11月　鳥取県内の企業倒産件数は2件・負債総額は1億6700万円（日本海テレビ）,https://news.yahoo.co.jp/articles/b21393365284c5ff5e2b2620d9fd5ba3c1871e2e,https://newsatcl-pctr.c.yimg.jp/t/amd-img/20251209-04267569-nkt-000-2-view.jpg?exp=10800,2025-12-09T05:45:00+09:00,2025-12-09T06:01:46+09:00,日本海テレビ,nkt,日本海テレビ,440,"日本海テレビ
東京商工リサーチ米子支店によりますと、今年11月の鳥取県内の企業倒産件数は2件で負債総額は1億6700万円だったことが分かりました。

前年同月と比べると件数は1件減、負債総額は9億8300万円減と今年11月は大型倒産はなく負債額は大幅に減少しました。

産業別では製造業が1件、サービス業他が1件で地区別では鳥取市が1件、米子市が1件となりました。
倒産原因は2件とも販売不振で全て不況型倒産となりました。

鳥取県内では今年度に入りコロナ融資の返済が本格化しているとともに物価高や人件費、金利負担の上昇などで経営環境には厳しさがうかがわれ、売上確保に苦戦している企業も多く、資金繰りへの影響が懸念されます。

鳥取県における倒産件数に大幅な増加はみられない状況が続いているものの、全国的には増加傾向となっています。

鳥取県の企業倒産も人手不足や物価高などの影響に加え、資金需要が高まる年末に向けて倒産件数及び負債額ともに増加する可能性を含んでいるとしています。",[],[]
