headline,mainEntityOfPage,image,datePublished,dateModified,author,media_en,media_jp,str_count,body,images,external_links
松本人志の代役、千鳥・大悟　マネジャーからの連絡に「怖っ！このタイミングでわしも？」と焦る（デイリースポーツ）,https://news.yahoo.co.jp/articles/2bc8f6b278b4e0a262aa970303c3ac7194f25cc7,https://newsatcl-pctr.c.yimg.jp/t/amd-img/20240209-00000124-dal-000-5-view.jpg?exp=10800,2024-02-09T23:41:15+09:00,2024-02-10T00:26:49+09:00,デイリースポーツ,dal,デイリースポーツ,656,\n千鳥・大悟\nダウンタウン・松本人志（６０）の芸能活動休止に伴い、「人志松本の酒のツマミになる話」（フジテレビ）からリニューアルされた「酒のツマミになる話」が９日、放送された。収録は、松本が活動休止を発表した翌日の１月９日だった。松本の定位置だった真ん中の席には千鳥・大悟が座り、肖像画も飾られた。\n\n 冒頭、相方のノブが「え～、ちょっと松本さんがお休みということで。いろいろ説明しますと…」と切り出すと、大悟も「いろいろ説明してくれ」と苦笑。ノブは「お休み、というのを発表したのが昨日なんですよ。翌日急きょこの収録ということで」と説明した。\n\n 大悟は「おるやろ？いろんな芸人。わしより先輩、松本さんよりちょい下」と顔を赤くすると、ノブが「吉本で、ボケで坊主、で探したら、大悟か、くまだまさし、しかいなかったんよ」と笑わせた。\n\n さらに大悟は「わしも昨日の７時ぐらいか、（マネジャーから）電話あって」と告白。「まずこんな時期にマネジャーから、『今お話よろしいでしょうか』というメールが。怖っ！このタイミングでワシも？」と焦ったことを打ち明けた。\n\n マネジャーに電話すると、松本の代役の話で、「どうしよ、どうしよ」と悩み、ディレクターに「まずは金髪にせんとアカン。『金髪にしてってええか？』」と冗談含みで聞いたところ、この日の収録で楽屋に金のカラースプレーが３本置いてあったことを明かし、笑わせた。最後はノブが「今日は飲もうっ！」と声をかけ、オープニングのトークを笑いで締めくくっていた。,['https://newsatcl-pctr.c.yimg.jp/t/amd-img/20240209-00000124-dal-000-5-view.jpg?exp=10800'],['https://news.yahoo.co.jp/articles/2bc8f6b278b4e0a262aa970303c3ac7194f25cc7/images/000']
『不適切にも』に「週刊文寸」でネットｗ「タコパとかＵＮＯとか」釈明も設定もリアルで笑【一部ネタバレ】（デイリースポーツ）,https://news.yahoo.co.jp/articles/242861e972fe32bad65a3ff256dcdd0b2f472ec9,https://newsatcl-pctr.c.yimg.jp/t/amd-img/20240209-00000121-dal-000-6-view.jpg?exp=10800,2024-02-09T22:58:39+09:00,2024-02-10T00:06:22+09:00,デイリースポーツ,dal,デイリースポーツ,454,\n阿部サダヲ\n阿部サダヲ主演、脚本・宮藤官九郎のＴＢＳドラマ「不適切にもほどがある！」が９日、第３話が放送された。\n【写真】ついにこの人が歌って踊った！\n令和では、渚（仲里依紗）が先輩プロデューサー・栗田（山本耕史）の担当番組「プレミアムサタデー」のＭＣ、ツツミンこと堤ケンゴの大スキャンダルに巻き込まれる。\n\n “プレサタＭＣ アシスタントと４股交際？！”などと週刊誌に報じられた堤を局の駐車場で待機させ、栗田が「週明け月曜発売の『週刊文寸』の記事です。それに先立ち、電子版がきょうの１６時にアップされます」「どうなの、ツツミン、やってなければ『軽率でした』で乗り切れないことはない。『タコパとかＵＮＯしてました』って。やってなければ」と必死に話しかけると、「やっ…てますね」というやりとりが繰り広げられた。\n\n 妙にリアルなスキャンダル対策とネーミングセンスに「週刊文寸←東北弁だわね」「『週刊文寸』ｗｗｗ」「ワロたｗｗ」「週刊文寸！\n＃不適切にもほどがある\n」とネットも沸いている。,['https://newsatcl-pctr.c.yimg.jp/t/amd-img/20240209-00000121-dal-000-6-view.jpg?pri=l&w=640&h=461&exp=10800'],"['https://news.yahoo.co.jp/articles/242861e972fe32bad65a3ff256dcdd0b2f472ec9/images/000', 'https://www.daily.co.jp/gossip/2024/02/09/0017315278.shtml?pp=2', 'https://news.yahoo.co.jp/search?p=%EF%BC%83%E4%B8%8D%E9%81%A9%E5%88%87%E3%81%AB%E3%82%82%E3%81%BB%E3%81%A9%E3%81%8C%E3%81%82%E3%82%8B&source=article-body']"
落合博満氏が３人の新監督に覚悟を求める「優勝すると言ってできなかったら笑われればいいだけ」（デイリースポーツ）,https://news.yahoo.co.jp/articles/3e25e33e9bce5113b4ebd2fa8a878ddc765ab38e,https://newsatcl-pctr.c.yimg.jp/t/amd-img/20240209-00000119-dal-000-5-view.jpg?exp=10800,2024-02-09T22:53:11+09:00,2024-02-09T23:31:42+09:00,デイリースポーツ,dal,デイリースポーツ,870,\n（左から）巨人・阿部監督、ソフトバンク・小久保監督、楽天・今江監督\n元中日監督の落合博満氏が９日、自身のＹｏｕＴｕｂｅチャンネル「落合博満のオレ流チャンネル」を更新。今季から巨人・阿部慎之助監督、ソフトバンク・小久保裕紀監督、楽天・今江敏晃監督の３人の新監督が誕生したが、選手への「第一声が一番、重要」と話した。\n\n それは就任時の昨秋にすでに終わっているとした上で「自分がどういう野球をやって勝つのか。チームの方針。どこに重きを置いてチームを作り上げて、シーズンでどういう戦いをするか。優勝するためにこう練習して、こういう戦い方をしてシーズンを終わるかを明確に伝えられるか」と説明した。\n\n 自身が中日監督就任時は、選手に対して「１０％の底上げと、これ以上の戦力外通告はしない、トレードはしない。その代わりこの練習をやったら絶対優勝するから、練習で泣いて、ゲームを終わって最後に笑いましょうと。それを伝えた」と振り返った。特に重要なのは「『優勝するため』にこれをやるんだ」という点だといい、「そこは一切ブレなかった。半信半疑だったろうと思うけど、選手はその言葉に乗せられて２００４年は優勝した。その後は、練習すれば勝てると選手の意識に芽生えたのでやりやすかった」という。\n\n だからこそ「オレはことあるごとに『優勝する』『優勝する』と言ってたから」と回顧。「この監督は大風呂敷をひきやがって、負けたらどうするんだと言われて。最下位を予想した評論家もたくさんいたけど、優勝したらみんな手のひらを返した。言って優勝できなかったら笑われればいいだけのこと。そこは監督として腹をくくってやらないと」と新監督には強い覚悟を求めた。\n\n 「１２球団全部のチームに優勝の可能性がある。戦力がないから３位までに入ればいい、とか言うのなら監督をやる資格はない。最終的な目標は優勝が第一だから」とし、「キャンプ、オープン戦、シーズンなんてあっという間。あれをやればよかったという悔いのない戦い方を日々重ねていけばいい」とエールを送った。,['https://newsatcl-pctr.c.yimg.jp/t/amd-img/20240209-00000119-dal-000-5-view.jpg?pri=l&w=640&h=480&exp=10800'],['https://news.yahoo.co.jp/articles/3e25e33e9bce5113b4ebd2fa8a878ddc765ab38e/images/000']
たけしときよしが揃った！ツービート浅草・東洋館に立つ「２人で並ぶと緊張する」たけしの冠お笑いコンテスト　最後に松本人志への愛あるギャグ（デイリースポーツ）,https://news.yahoo.co.jp/articles/2a304f6c9b4659416da94767b5aaad66c52b8439,https://newsatcl-pctr.c.yimg.jp/t/amd-img/20240209-00000123-dalv-000-3-thumb.jpg?exp=10800,2024-02-09T23:23:58+09:00,2024-02-10T00:02:58+09:00,デイリースポーツ,dal,デイリースポーツ,678,\n(C)デイリースポーツ\n漫才ブームの中心で、伝説の漫才コンビ・ツービートのビートたけし、ビートきよしの２人が９日、浅草・東洋館の舞台で揃い踏みした。\n\n たけしは「江戸まちたいとう芸楽祭」の名誉顧問を務め、自身の名を冠したお笑いコンテスト「たけしが認めた若手芸人 ビートたけし杯『お笑い日本一』」の審査員をしている。開会に際して、オープニングでたけしが呼び込まれたのだが、姿を見せたのはきよしだった。\n\n 会場が混乱する中、続けてたけしが登場。サプライズでのツービート揃い踏みに東洋館が沸いた。「久々に会って２人で並ぶと緊張するんだよな。なんであがっちゃうんだろう。ここでやってたんだけど、久々に立つとあがるな」。照れ隠しのようにも見えたが、たけしの口から「あがる」という意外な言葉が聞かれた。\n\n きよしが「顔だけは見にこようと思って、見に来たんだよ」と語りかけると、たけしもすかさず「最後の挨拶か？」と切り返し、爆笑をさらった。\n\n きよしの登場で場が温まった中で開催されたコンテストでは、２０２３年のM-1グランプリで準優勝だったヤーレンズが優勝。高田文夫、ナイツ（塙宣之、土屋伸之）を含めた審査員の満場一致だったという。\n\n たけしといえば定番の表彰式ネタ。賞状を読み上げ、芸人にとって真正面からためになるアドバイスを送り、今回は控えめなのかと思わせておいて繰り出したのが、「江戸まちたいとう芸楽祭 名誉顧問 松本人志」。大爆笑が起きる中、「こうやって松本をギャグに使えば少しは復帰が早くなるだろ」とエールをおくっていた。,[],[]
五輪公式アカウントも小澤征爾氏を追悼　１９９８年冬季長野大会で音楽アドバイザー（デイリースポーツ）,https://news.yahoo.co.jp/articles/5b53544cbcbf2750df68c9b8dd7b6baa98392af4,https://newsatcl-pctr.c.yimg.jp/t/amd-img/20240209-00000120-dal-000-5-view.jpg?exp=10800,2024-02-09T22:57:18+09:00,2024-02-09T23:20:15+09:00,デイリースポーツ,dal,デイリースポーツ,239,\n小澤征爾さん©Ｍｉｃｈｉｈａｒｕ Ｏｋｕｂｏ\n国際オリンピック委員会（ＩＯＣ）による、オリンピックの日本語公式アカウントが９日、Ｘ（旧ツイッター）で６日に亡くなった世界的な指揮者の小澤征爾氏を追悼した。\n【動画】在りし日の小澤征爾さん 歓喜の歌の演奏を指揮する\n「長野１９９８オリンピックでは音楽アドバイザーを務めた小澤征爾さん 開会式では世界を中継で結んで行われた歓喜の歌の演奏を指揮しました。今まで素晴らしい音楽の数々を、本当にありがとうございました。」と悼んだ。,['https://newsatcl-pctr.c.yimg.jp/t/amd-img/20240209-00000120-dal-000-5-view.jpg?pri=l&w=640&h=426&exp=10800'],"['https://news.yahoo.co.jp/articles/5b53544cbcbf2750df68c9b8dd7b6baa98392af4/images/000', 'https://www.daily.co.jp/general/2024/02/09/0017315283.shtml?pp=2']"
柔道・鈴木桂治監督、優勝ウルフ・アロンを評価も「勘違いしないで」パリ五輪決定的も危機感「復活したという思い全くない」（デイリースポーツ）,https://news.yahoo.co.jp/articles/f341a98e29bbe384c16a10fbbd7792c0750fb6dd,https://newsatcl-pctr.c.yimg.jp/t/amd-img/20240209-00000118-dal-000-3-view.jpg?exp=10800,2024-02-09T22:47:10+09:00,2024-02-09T22:58:10+09:00,デイリースポーツ,dal,デイリースポーツ,830,\nフランス遠征から帰国した柔道日本男子の鈴木桂治監督\n柔道男子日本代表の鈴木桂治監督（４３）が９日、フランス遠征から帰国し、羽田空港で取材に応じた。グランドスラム・パリ大会の男子１００キロ級で、東京五輪金メダルのウルフ・アロン（２７）＝パーク２４＝が東京五輪以来となる国際大会での優勝を果たしたことを受け、「試合内容もいい形。これ以上ない成績で、金メダルは非常に大きいと考えている」と評価。全階級で唯一決まってなかったパリ五輪代表内定が決定的となり、１４日の強化委員会で審議するが、「選考の理由として（今回の優勝は）納得できる形なのかなと思う」とうなずいた。\n\n ライバルだった新井道大（東海大）が３回戦で敗退した一方、ウルフは粘り強く戦いながら持ち味の足技や内股を駆使し、国際舞台では２年半ぶりとなる頂点に輝いた。鈴木監督は「体のキレと心は（連動して）一つだと思うんですよ。精神的な強さとか、土壇場での強さってものが、本来の技術を出させたんだと思う」と講評。同級担当の小野卓志コーチも「試合中の集中力、目の力がすごかった」と話していたといい、指揮官は「窮地に追い込まれたときの強さは（新井より）ウルフの方が上だった」と五輪王者の底力をたたえた。\n\n ただ、ウルフを筆頭に低迷していた同階級では、これでようやく五輪出場圏内に届く状況になったに過ぎない。今後、五輪に向けて数大会派遣する考えを示した。\n\n 鈴木監督は「代表が決まったとしても、まだそれ（スタートライン）だけなので。我々は満足してない。（強化委員会で選考に）答えが出たとしたら、ここからがウルフ・アロンの五輪なので、本当に勘違いしないで。今回たまたま良かった試合内容が五輪で出せるか（が問題）。もう大丈夫だって思いは全くないです」とくぎを刺し、「ウルフ復活したわ、という思いは僕らは全くないです。まだまだ、これ（成績の波）が激しすぎるので非常に怖いです」と厳しい表情を崩さなかった。,['https://newsatcl-pctr.c.yimg.jp/t/amd-img/20240209-00000118-dal-000-3-view.jpg?pri=l&w=601&h=640&exp=10800'],['https://news.yahoo.co.jp/articles/f341a98e29bbe384c16a10fbbd7792c0750fb6dd/images/000']
【2月10日のブギウギ】第19週「東京ブギウギ」スズ子は娘を育てるため歌手復帰、ブギの女王に（デイリースポーツ）,https://news.yahoo.co.jp/articles/159fd049f188fb40df4a00a2521d84c0349dbef3,https://newsatcl-pctr.c.yimg.jp/t/amd-img/20240209-00000115-dal-000-3-view.jpg?exp=10800,2024-02-09T22:08:13+09:00,2024-02-09T22:09:58+09:00,デイリースポーツ,dal,デイリースポーツ,546,\n日帝劇場の舞台で「東京ブギウギ」をお披露目するスズ子（趣里・中央）\n趣里主演のＮＨＫ連続テレビ小説「ブギウギ」（月曜～土曜８時・土曜は一週間振り返り放送）。２月１０日の土曜日は、今週放送された第８７～９１話の見どころをまとめてどうぞ！\n\n 【今週のあらすじ】\n\n 愛子が生まれて３か月、スズ子（趣里）は子育てに忙しい日々を過ごしていた。そんな折、トミ（小雪）がスズ子の家を訪ねてくる。愛子を引き取らせてほしいというのだ…。そんな中、スズ子は、愛子を育てていくために歌手に復帰しようと考え、羽鳥（草彅剛）に新曲を作ってほしいとお願いをする。人々を楽しませ、励まし、生きる活力を与え、日本中をズキズキ・ワクワクさせた名曲「東京ブギウギ」がついに生まれる！\n\n ◆ ◆\n\n 大正から昭和にかけての激動の時代に、明るい笑顔とまっすぐな心で歌手の道を突き進む福来スズ子。“ブギの女王”と呼ばれ、大スター歌手への階段を駆け上っていくスズ子のエネルギーあふれる人生を、数々の名曲と共に描いていく。主題歌「ハッピー☆ブギ」は、「東京ブギウギ」作曲者の服部良一の孫・服部隆之が手掛け、ヒロインを演じる趣里と、中納良恵、さかいゆうの３人が歌う。語りはＮＨＫ大阪アナウンサーの高瀬耕造が担当。,['https://newsatcl-pctr.c.yimg.jp/t/amd-img/20240209-00000115-dal-000-3-view.jpg?pri=l&w=640&h=426&exp=10800'],['https://news.yahoo.co.jp/articles/159fd049f188fb40df4a00a2521d84c0349dbef3/images/000']
大仁田厚　テリー・ファンクさんをしのぶ「本当に兄貴。憧れを超越して神様以上」（デイリースポーツ）,https://news.yahoo.co.jp/articles/e5c12968c2399dab3b51539be2e663f44171c037,https://newsatcl-pctr.c.yimg.jp/t/amd-img/20240209-00000117-dal-000-5-view.jpg?exp=10800,2024-02-09T22:12:50+09:00,2024-02-09T22:43:36+09:00,デイリースポーツ,dal,デイリースポーツ,545,\n故テリー・ファンク氏の１０カウントゴングセレモニーで遺影を持つ大仁田厚（左）と渕正信\n「プロレス・プロレス中継７０年史 ＴＨＥ日テレプロレス」（９日、後楽園ホール）\n\n 日テレ中継が生んだスーパーアイドルで昨年８月に死去したテリー・ファンクさんを、大仁田厚と渕正信、福澤朗アナウンサーがトークショーでしのんだ。\n【写真】開幕宣言をしたのはこの２人\n大仁田と渕は修業時代、テリーさん宅に１カ月半居候したこともあり、大仁田は「本当に兄貴ですね。憧れとか超越して、僕らにとっては神様以上」、渕は「ヒーローはいつまでも生きてていてくれるものだと思っていた。ヒーローでも死んじゃうんだなと。寂しさを通り越したものがある」と恩師への思いを吐露。\n\n 大仁田は「すごいと思うのは、オーソドックスなプロレスもうまく、デスマッチもできて、オールマイティなレスラー」と、テリーさんのプロレスラーとしての高い力量も指摘。オープンタッグでのファンクス－アブドーラ・ザ・ブッチャー、ザ・シーク組を「僕はこれこそプロレスだと思いました。本当にテキサス魂というか」と、思い出の一戦に挙げていた。\n\n イベントでは生前のテリーさんの勇姿が流され、トークの最後には追悼の１０カウントゴングが鳴らされた。,['https://newsatcl-pctr.c.yimg.jp/t/amd-img/20240209-00000117-dal-000-5-view.jpg?pri=l&w=640&h=602&exp=10800'],"['https://news.yahoo.co.jp/articles/e5c12968c2399dab3b51539be2e663f44171c037/images/000', 'https://www.daily.co.jp/ring/2024/02/09/0017315049.shtml?pp=2']"
徳光、倉持、福澤の各アナが集結　徳光アナ「全国３０００万のプロレスファンの皆さん…」（デイリースポーツ）,https://news.yahoo.co.jp/articles/695f9d08b26fbfcc25220bc1712931d5cb205554,https://newsatcl-pctr.c.yimg.jp/t/amd-img/20240209-00000116-dal-000-6-view.jpg?exp=10800,2024-02-09T22:10:26+09:00,2024-02-09T22:24:39+09:00,デイリースポーツ,dal,デイリースポーツ,478,\n福澤朗アナウンサー（左）と徳光和夫アナウンサー（右）\n「プロレス・プロレス中継７０年史 ＴＨＥ日テレプロレス」（９日、後楽園ホール）\n\n １９５４年に日本テレビのプロレス中継が始まってから今年で７０周年になるのを記念したイベントが開催され、立会人を務めた武藤敬司氏、小橋建太氏、テレビ生中継の解説を務めた川田利明、田上明氏、力道山の遺児・百田光雄ら日テレ中継ゆかりの選手や関係者が集結した。\n【写真】名調子を響かせた徳光アナ\nオープニングでは歴代の実況アナウンサーである徳光和夫、倉持隆夫、福澤朗の各氏が紹介された。徳光アナは「全国３０００万のプロレスファンの皆さん、こんばんは」と名調子を、福澤アナは名ゼリフ「重低音ストンピング攻撃」を聞かせ、倉持アナは「なんとかまた放送を作ってください」と、日テレ地上波中継の復活を願った。\n\n 休憩明けには、日本プロレス時代を再現して、ノアの西永秀一レフェリーが三菱電機の掃除機（風神ではない）でリング上を清掃。実況席の徳光アナが「パワーはブルーノ・サンマルチノのよう」などと名調子を聞かせていた。,['https://newsatcl-pctr.c.yimg.jp/t/amd-img/20240209-00000116-dal-000-6-view.jpg?pri=l&w=640&h=516&exp=10800'],"['https://news.yahoo.co.jp/articles/695f9d08b26fbfcc25220bc1712931d5cb205554/images/000', 'https://www.daily.co.jp/ring/2024/02/09/0017315042.shtml?pp=2']"
ノアの清宮と全日本の安齊が激闘　小橋建太氏が称賛「これからのプロレス担う２人の熱い試合」（デイリースポーツ）,https://news.yahoo.co.jp/articles/bb7ec40945d05e412904e2f05c52e2f460095a08,https://newsatcl-pctr.c.yimg.jp/t/amd-img/20240209-00000114-dal-000-6-view.jpg?exp=10800,2024-02-09T22:06:19+09:00,2024-02-09T22:24:33+09:00,デイリースポーツ,dal,デイリースポーツ,845,\n安齊勇馬（左）を攻める清宮海斗\n「プロレス・プロレス中継７０年史 ＴＨＥ日テレプロレス」（９日、後楽園ホール）\n\n メインイベントではノアの元ＧＨＣヘビー級王者・清宮海斗（２７）と、デビュー１年５カ月ながらトップに手を掛けつつある全日本の安齊勇馬（２４）が一騎打ちを行った。\n【写真】スープレックスを決める清宮\nプロレス界の未来を担う両雄はスタートから激しい攻防を展開し、１５分過ぎのジャンピングニーパット相打ちから安齊が攻勢に出てジャンピングニーを３連打。清宮は４発目をフランケンシュタイナーでカウンターすると、シャイニングウィザードからタイガースープレックス、変形のタイガードライバーで追い込み、１８分３４秒、シャイニングウィザードからの片エビ固めで３カウントを奪った。\n\n 勝利者賞として三菱の掃除機を受け取った清宮は「プロレス界の未来だと間違いなく思いますよ」と安齊をたたえ、「自分もノアでやらなきゃならないことがありますし、安齊選手も全日本でやらなきゃいけないことがある。お互いその位置（トップ）まで行った時、いつか混じり合う時が来るんじゃないかと思っています」と、再戦の条件を挙げた。\n\n 安齊は「試合中はすげえ楽しかったけど、負けるとクソ悔しいっすね」と振り返り「もっともっと大きい舞台でまたシングルやりたいですね。その時は必ず僕が勝ちます」ときっぱり。「今までの７０年のプロレスに負けないくらい、これからのプロレスの未来は明るいんじゃないかって証明できたんじゃないかと思っています」と、胸を張った。\n\n 試合を実況席で解説した小橋建太氏は「これからのプロレスを担っていく２人の熱い試合が見られたので、次があったら非常に楽しみ」と２人を称賛。武藤敬司氏は「プロレスって点から線になるからさ、日テレも次あるんじゃない？東京ドームでやったらいいんじゃないの、来年の７１周年」と日本テレビに要求。小橋氏も「来年も日テレプロレス、行くぞー！」と同調していた。,['https://newsatcl-pctr.c.yimg.jp/t/amd-img/20240209-00000114-dal-000-6-view.jpg?pri=l&w=640&h=528&exp=10800'],"['https://news.yahoo.co.jp/articles/bb7ec40945d05e412904e2f05c52e2f460095a08/images/000', 'https://www.daily.co.jp/ring/2024/02/09/0017315024.shtml?pp=2']"
