headline,mainEntityOfPage,image,datePublished,dateModified,author,media_en,media_jp,str_count,body,images,external_links
「失敗が許されるのが学校」　表現ツールとしてのICTを積極活用　　教育の力　北鎌倉女子学園（産経新聞）,https://news.yahoo.co.jp/articles/3d0095ddf861ed521367821d186dda7e51572376,https://newsatcl-pctr.c.yimg.jp/t/amd-img/20250922-00000052-san-000-1-view.jpg?exp=10800,2025-09-22T09:16:15+09:00,2025-09-22T09:16:15+09:00,産経新聞,san,産経新聞,1484,"田邊則彦理事長補佐（中央）が進める情報通信技術（ICT）教育は北鎌倉女子学園中学校高等学校の特徴のひとつだ＝今年7月、鎌倉市
7月、北鎌倉女子学園中学校高等学校（鎌倉市）の情報通信技術（ICT）の教室で、東京・八丈島（八丈町）の中学生が作成した地元の方言を探る10分ほどの動画が流された。終了後には全国各地の方言のスライドが示され、生徒たちに意味が問われていった。

教壇に立っていたのは、同校でICT教育の総責任者を務める田邊則彦理事長補佐。授業は、今年採用された若い英語教員と田邊氏が共同で作成した言語学を切り口にした新しい教材をもとに進められた。

■情報機器は「文房具」

取り扱う言語は外国語にもおよび、別の日の英語をテーマにした授業では中国、シンガポールなど国・地域でそれぞれ特徴があることを説明。さらに、映画やミュージカルで知られる「マイ・フェア・レディ」を題材に、主人公の下町なまり「コックニー」をシーンごとに説明していた。

生徒は、一人に1台、配布されているタブレット端末を活用し、そうした言語のありようを、さまざまな角度から調べた。英語教員の指導のもと、そのまま調べるのではなく、自ら考えながら、自分なりの答えを導きだしていく。

田邊氏は「情報機器を上手に使って学んでいくというのは、単に機器の使い方を学ぶということではない。機器を文房具の一つのように使っていくためには、誰かにレールを敷いてもらうのではなく、自分でゴールを決めて、どのルートでそこにたどり着くかを描くことが大切」と語る。

田邊氏は、「日本のインターネットの父」とも呼ばれる慶応大の村井純氏と協議をしながら情報通信教育のプログラムをつくり、約30年にわたってICT教育の在り方に携わり、牽引（けんいん）してきた教育者だ。理事長補佐には藤崎一郎理事長の要請を受けて就任した。

■リポートにAIを積極活用

田邊氏は中学、高校で週2～3回の授業を受け持ち、データを読み解く力の育成やデータサイエンス、プログラミングなどを通して、社会に求められている力を育成していく。県の統計グラフコンクールなど、ICTを活用したコンクールへの参加も勧める。

人工知能（AI）の積極的な活用にも取り組むのも授業の特徴。「生徒には、リポートを書くときもAIに聞いていいと言っている。ただし、AIが示すことが本当かどうかを確かめるのは、あなた自身だと。AIに聞いたことと自身が考えたことをごちゃまぜにしない。そういう約束事をしている」
田邊氏は、柳沢幸雄学園長と協力し、科学（Science）や情報（Information）、数学（Mathematics）を実践的に学ぶSIMクラブを立ち上げた。理系の教科に関し、自由に学ぶ場を設ける試みで、授業終了後の午後3時半から約2時間、生徒それぞれが課題を持ち寄り、自由に教諭に問う。
決められた授業時間で学ぶのではなく、自ら主体的に学ぶ時間だといい、田邊氏は「失敗が許されるのが学校。学校だから、生徒はいろいろなことに挑戦できる」と話している。
◇
■情報通信技術（ICT）の活用　「Information and Communication Technology」の略。情報処理および通信技術の総称。北鎌倉女子学園中学校では、1年生でタイピングや画像処理などの基本を学び、2年生でプログラミング、編集ソフトの利用を学習。3年生では、こうしたスキルをもとに、インターネットを活用しデータ分析などを通し、社会での問題解決にICTを利用する方法を学んでいる。",[],[]
トランプ米大統領とマスク氏が握手、非難合戦から関係修復か　カーク氏追悼式典会場で（産経新聞）,https://news.yahoo.co.jp/articles/becb3db004b161f8bf4a9d0f79372ab6cbbcb5e0,https://newsatcl-pctr.c.yimg.jp/t/amd-img/default.jpg?exp=10800,2025-09-22T08:28:51+09:00,2025-09-22T08:28:51+09:00,産経新聞,san,産経新聞,471,"【ワシントン＝坂本一之】トランプ米大統領は21日、西部アリゾナ州で開かれた米保守系活動家チャーリー・カーク氏の追悼式典に参加し、5月末に政権を離脱し財政支出を巡って非難合戦に発展した実業家のイーロン・マスク氏と会話し、握手する一幕があった。関係修復を図ったとみられる。

トランプ氏は追悼式典の会場に到着すると、場内を見渡せる特別室で待機。そこにマスク氏が現れ、トランプ氏の横に座った。両氏は会話を交わし、マスク氏が席を離れる前にトランプ氏が手を差し出し、握手した。

マスク氏は昨年の大統領選でトランプ氏に2億9000万ドル（約430億円）近くを献金し、勝利に貢献。1月に発足した第2次トランプ政権で支出削減を図る「政府効率化省（DOGE）」の事実上のトップを務めるなど、トランプ氏と蜜月関係を築いた。

しかし、トランプ氏との関係に亀裂が入り5月末に政権を離脱した。さらに減税や不法移民対策の強化といったトランプ氏の目玉政策を盛り込んだ法案を巡り対立。財政支出の拡大を問題視するマスク氏とトランプ氏がSNS上で非難し合う事態となっていた。",[],[]
パレスチナ国家承認の英首相、自治政府のアッバス議長に「自決権支持、外交関係構築」表明（産経新聞）,https://news.yahoo.co.jp/articles/c392aa95eb53b46f50c1577f9bc1e3e214ac9175,https://newsatcl-pctr.c.yimg.jp/t/amd-img/default.jpg?exp=10800,2025-09-22T08:28:25+09:00,2025-09-22T08:28:25+09:00,産経新聞,san,産経新聞,511,"【ロンドン＝黒瀬悦成】スターマー英首相は21日、パレスチナを同日付で国家承認したのを受けてパレスチナ自治政府のアッバス議長に書簡を送り、「英国は国家樹立を含めたパレスチナの自決権を支持する」と言明した。互いの外相を通じて自治政府との「完全な外交関係の構築に向けた手続きを進める」とも表明した。

書簡は、英国が1917年に後のイスラエル建国の根拠となる、パレスチナでのユダヤ人の民族的郷土の建設を支持する「バルフォア宣言」を表明した経緯に触れ、「英国は中東で果たしてきた歴史的役割を認識している」と説明した。

その上で、バルフォア宣言では非ユダヤ人の市民権の侵害を禁じていたとし、今回の承認で宣言を踏まえて「パレスチナ人のためのパレスチナ国家への関与」と、「イスラエルとパレスチナが平和共存する2国家解決への恒久的支持」を再確認すると強調した。

カナダとオーストラリア、ポルトガルも同日、パレスチナを国家承認。カナダのカーニー首相は声明で「パレスチナとイスラエルが平和な未来を築くために協力したい」と述べた。

アルバニージー豪首相は、パレスチナ国家の樹立は「パレスチナの人々が長年抱いてきた正当な願望だ」と指摘した。",[],[]
福岡・大宰府市長がコンビ「市長課長」でM－1参戦　2回戦進出、自虐ネタで市民反応上々（産経新聞）,https://news.yahoo.co.jp/articles/02de6c34ef9732176cc60d4a9d399a641123438e,https://newsatcl-pctr.c.yimg.jp/t/amd-img/20250922-00000045-san-000-1-view.jpg?exp=10800,2025-09-22T08:11:49+09:00,2025-09-22T08:11:49+09:00,産経新聞,san,産経新聞,1827,"「M―1グランプリ」への思いを語る福岡県太宰府市の楠田大蔵市長＝福岡県太宰府市（一居真由子撮影）
コンビ名は「市長課長」－。漫才日本一を決める「M―1グランプリ」への出場を決めた現役市長が話題を集めている。誰もが知る人気番組「M―1」で市をPRするプロモーション活動の一環で、1戦でも多く勝ち進むことで市の知名度アップを狙う。市民から賛否両論出そうだが、真面目な市長が渾身（こんしん）のボケに挑む姿に反応は意外にも良いようだ。

■掛け合いテンポよく

「太宰府市長と高田課長で『市長課長』です。お願いしまーす」。今月6日、福岡市内で行われた「M－1」の1回戦。手をたたきながら舞台に登場したのは福岡県太宰府市の楠田大蔵市長（50）とタレントの高田課長のコンビだ。

「有権者のみなさま！」と突然大声を出す楠田市長に「選挙じゃないんだから」と高田課長が突っ込む。楠田市長はその後も「髪の毛が猛暑で抜けた」など自虐ネタで会場を沸かせ、「市長と結婚していいことあるの？」と問われると「朝昼晩『梅ヶ枝餅』」と得意顔。「胃もたれしそうだな」と返す高田課長とテンポよく掛け合いながら市の特産や名所をアピールした。結果はプロでも落ちるといわれる1回戦を通過。2回戦は10月中旬ごろに予定されている。

■不出馬決意で挑戦へ

楠田市長は東大卒で、衆院議員を経て平成30年に市長に就任した。もともと大のお笑い好きで、好きな芸人は「爆笑問題」や「ナイツ」。就任当初から部長らとコンビを組んだ活動を思案していたが、お笑いには批判も想定され、思いを胸に秘めていた。

そんな中、市の応援大使に就任した地元育ちの高田課長と意気投合。現在2期目だが、任期満了に伴う12月の市長選に出馬しないと決めた今がラストチャンスと、「M－1」挑戦に踏み切った。

市民の反応は想定していたより悪くなく、自分をさらけ出して挑む姿に「勇気をもらった」と声をかけられ、中高生から激励も受けたという。

「M－1」には公務として出場しており、「市長として真面目さが足りない」などの声も上がるものの、楠田市長は「思った以上に挑戦への反響が大きくびっくりしている。とにかく一戦一戦、いけるところまで本気で頑張る」と意気込む。

稽古では高田課長から「恥ずかしさを捨てて」とダメ出しを受け、芸人の難しさを痛感。市民に許されるぎりぎりのラインを探る苦労もあり、「やってみると本当に大変で、出場者はなかなかの個性派。お笑いは好きだが、この世界には踏み込みすぎないほうがいい気がする」と笑う。
■ライバルは百田氏？
今回の「M－1」には日本保守党代表で参院議員の百田尚樹氏（69）も「代表と秘書」のコンビ名で出場し、1回戦を通過。ネット上では「太宰府市長に負けるな」と盛り上がりをみせる。
現役首長では令和4年に大阪府柏原市の冨宅正浩市長（49）や、福井県若狭町の渡辺英朗町長（45）が出場。今年は三重県四日市市の森智広市長（47）もお笑い芸人のザブングル加藤さんと組んで出場すると発表していたが、12日の記録的な大雨で浸水などの被害が発生し、対応に専念するため出場を辞退した。市によると、有志が「応援しよう会」を結成するなど活気付いたといい、市の担当者は「出場を発表した時点で記事がネットニュースにあがり、市のアピールになった」と話す。
■出場だけで宣伝効果
「M－1」は朝日放送テレビと吉本興業が主催し、平成13年にスタートした。結成15年以内のコンビであれば出場が可能で、審査基準は「とにかくおもしろい漫才」。挑戦者は年々増え、昨年のエントリー数は1万330組に上った。8月から予選が始まり、5回勝ち抜けると生放送される12月の決勝に進出する。
お笑い評論家でもある江戸川大の西条昇教授によると、コンビを組んだばかりでも参加できる間口の広さや、プロ・アマ問わず持ちネタで勝負する審査基準、優勝すると人生が一変するドラマ性などが人気番組につながったという。SNSが普及する時期にも重なり、年末になるとSNSでは優勝者の予想や漫才の評論で盛り上がるとして、「賞レースで『M―1』ほど注目される番組はなく、国民的イベントといえる」と西条教授。アイドルなど芸人以外の挑戦が話題になるケースも多く、西条教授は「市長とお笑いというギャップも注目される要素で、出場するだけで宣伝効果がある」と話している。（一居真由子）",[],[]
300軒から十数軒へ…消えゆくストリップ劇場　裸よりも芸術性重視で増える「スト女」（産経新聞）,https://news.yahoo.co.jp/articles/a915a4d516a922d23d44043a199267676925ff74,https://newsatcl-pctr.c.yimg.jp/t/amd-img/20250922-00000044-san-000-1-view.jpg?exp=10800,2025-09-22T08:11:02+09:00,2025-09-22T08:11:02+09:00,産経新聞,san,産経新聞,913,"ストリップ劇場は警察による摘発が相次いでいる。摘発され、営業停止が命じられた「天満東洋ショー劇場」＝6月26日、大阪市北区
音楽に合わせ、女性ダンサーが服を脱いでいくショーを披露するストリップ劇場。多くの文化人を輩出し、昭和40年代には全国に300軒以上あったとされるが、相次ぐ摘発や風俗産業の多様化を受け、現在は全国で十数軒となっている。デジタル空間に性的コンテンツがあふれる現代にあって、強い逆風にさらされているが、生き残り策を模索。近年は「スト女」と呼ばれる女性など、新たな客層も取り込んでいる。

「舞台に置いてある額縁の中で上半身裸の女性が名画のポーズを取る。これが戦後間もない日本で人気を博しました」

大衆芸能史を研究する江戸川大の西条昇教授は、昭和22年に東京・新宿の劇場で始まった「額縁ショー」が日本のストリップの起源だったと説明する。

その後、音楽に合わせ、じらすようにして衣服を脱ぐストリップへと発展していったが、西条さんによると、時を同じくして警察の摘発も始まったという。

ストリップは東京・浅草を中心に栄え、合間にコメディアンも登場する総合的なエンタメに成長。「浅草フランス座」は渥美清やコント55号、ビートたけしを輩出したことでも有名だ。昭和40年代以降は、過激な演出を売りとする「関西ストリップ」が人気を集める一方、性風俗としての色彩が濃いストリップも増加し、摘発も相次いだ。

昭和の時代は、テレビや雑誌といったマス媒体もストリップを頻繁に扱っていたが、インターネットなどを通じて性的なコンテンツに触れられる現代では、存在感は徐々に小さくなっている。性的な目的で訪れる客は少なくなる一方、ショーの様子も変わり、新たなファンが生まれてきている。

「実は、近年は『スト女』と呼ばれる女性客が増えている。今は過激なショーというよりは、芸術性を重視した額縁ショーの時代の精神に回帰しているのかもしれない」と西条さんはみる。かつてのように、テレビなどでストリップが紹介される時代ではない。ストリップの存在自体を知らない若い世代も多い中、新規客をどう呼び込むかが、生き残りへの課題という。（木津悠介）",[],[]
日本の朝食変えたウインナー革命　日本ハム「シャウエッセン」40年、不文律破る挑戦継続（産経新聞）,https://news.yahoo.co.jp/articles/d4b7680db641cb849e3311a08a6ce5ae5f3c2c6d,https://newsatcl-pctr.c.yimg.jp/t/amd-img/20250922-00000040-san-000-1-view.jpg?exp=10800,2025-09-22T07:37:02+09:00,2025-09-22T07:37:02+09:00,産経新聞,san,産経新聞,1174,"日本ハムのシャウエッセン
昭和時代のウインナーといえば、子供向け弁当の定番だった「赤ウインナー」が主流だった。そんな家庭の食卓を変えたのが、日本ハムの主力「シャウエッセン」だ。本場ドイツを彷彿（ほうふつ）とさせる本格ウインナーは1980年代はもっぱらレストランで楽しむ高級品だったが、所得水準の向上や同社のCM戦略が当たり初年度から大ヒット。発売から40年を迎えたいまも長く愛されるブランドになっている。
【ひと目でわかる】「シャウエッセン」40年の歴史
シャウエッセンが発売されたのは、国民の所得水準が順調に伸びていた1985年2月。その年の9月にドル高是正に向けた「プラザ合意」がなされ、円高ドル安によって日本からの海外旅行者数も86年に初めて500万人を超えた。

そんな中、ドイツの本格ウインナーを意識して開発されたシャウエッセンの出足は鈍かった。「当時は赤いウインナーが主流。シャウエッセンはそれと比べて価格も高かった」のが理由。一番のウリであるウインナーの皮にも違和感を覚える人が少なくなかった。

そこで、こだわりの味を知ってもらおうと、これまでカットして出していたスーパーの試食販売を1本丸ごと提供に変更。パリッとした食感がウリだが、「美味なるものには音がある！」と流したCMも当たった。ウインナーは60億円の売り上げでヒットとされた当時、初年度に100億円を超え、翌86年度には260億円の大ヒットとなった。

右肩上がりだった売り上げが伸び悩んだ時期もあった。発売当時に30代だった主要な購入層が発売から35年目の2019年には50～60代が約6割と高齢化したからだ。

このため焼かずに3分間ゆでて調理、切ってはならず、味を変えてはならないといった社内の不文律を見直し、それまで控えるよう包装に記していた電子レンジ調理を解禁。初のフレーバー商品としてホットチリ味なども同年に投入した。「シャウエッセンは、手のひらを返します。」と公式サイトに載せてSNSなどでも大きな話題を呼び、19年度は売り上げも過去最高の720億円に達した。

発売から40年を経て、24年度は800億円を達成。20年からはシンガポール向けに海外輸出を始め、30年度には国内外で1千億円の目標を掲げる。
ただ、少子高齢化で国内市場は先細りが見え、目標の達成には課題も多い。シャウエッセンが食べられるのはもっぱら朝食で、夜の食卓に登場するのは2割ほど。「食シーンを広げるのが次の課題」とする。
昨年はスパイシーなテイストで酒のつまみ需要などを狙った「夜味」を発売。ハウス食品のカレーや日清食品の焼きそばと合わせたメニューも提案した。日本のウインナーの概念を変えたシャウエッセンだが、次は「夕食といえばウインナー」の新常識で日本の食卓改革を目指す。（田村慶子）",[],[]
韓国新鋭、キム・ソンシク「これは運命」　日韓ミュージカルイベントに10月出演（産経新聞）,https://news.yahoo.co.jp/articles/26fe4b0e11f20d2b55b69c8a08b6078b939d8f25,https://newsatcl-pctr.c.yimg.jp/t/amd-img/default.jpg?exp=10800,2025-09-22T07:13:38+09:00,2025-09-22T07:13:38+09:00,産経新聞,san,産経新聞,681,"韓国ミュージカル界の新鋭、キム・ソンシクが10月10、11両日、東京都千代田区の大手町三井ホールで開催される日韓ミュージカルイベント「The Echoes」に出演する。

日韓国交正常化60周年を記念したイベントで、加藤和樹、浦井健治、彩風咲奈、濱田めぐみら日本ミュージカルを代表する俳優陣と共演を果たす。「日本の最高のキャリアを持つ俳優のみなさんと同じステージに立てるなんて。僕はまだ新人。プレッシャーも感じるけど、素晴らしいチャンスです」

映像芸術分野の名門・東国大学校で演劇を学んだ。長身で端正なたたずまいに加え、ミュージカル曲はもちろん、ポップスからクラシックまでを歌いこなす歌唱力の持ち主だ。2023年に「レ・ミゼラブル」のアンジョルラス役に抜擢され、以降「マタ・ハリ」「ベンジャミン・バトン」など人気作に立て続けに出演している。

日本のファンから注目を集めたのは、昨年上演された韓国オリジナルミュージカル「ベルサイユのばら」でのアンドレ役だ。主人公に献身的な愛をささげる姿を熱演し、共感をもって迎えられた。「この重要な役を演じることができ、人生の大きな転機になった」と振り返る。

昨年11月には、同じく若手俳優のイ・ヘジュンとともに初めての来日コンサートを成功させた。「海を越えた日本に僕のファンがいてくださるなんて。まだ慣れないけれど、とてもうれしい」とはにかむ。

今回のイベントでは「マタ・ハリ」で同じ役を演じた加藤をはじめ、作品が重なる俳優陣とのトークや歌唱も予定。「これはきっと運命。いい化学反応を起こしたい」と意気込んだ。（塩塚夢）",[],[]
＜独自＞自民・高市氏陣営「チーム・サナエ」のキャプテン小野田氏、選対本部長に中曽根氏（産経新聞）,https://news.yahoo.co.jp/articles/bc9c2eaa6571d2e27e0c44640e3d7a108a3331b0,https://newsatcl-pctr.c.yimg.jp/t/amd-img/20250922-00000028-san-000-5-view.jpg?exp=10800,2025-09-22T07:00:00+09:00,2025-09-22T12:04:54+09:00,産経新聞,san,産経新聞,511,"高市早苗前経済安全保障担当相の決起集会に臨む小野田紀美参院議員（中央）＝21日午後、東京都千代田区（奥原慎平撮影）
自民党総裁選（22日告示、10月4日投開票）に出馬する高市早苗前経済安全保障担当相の陣営は21日、東京都内で選対会合を開き、女性議員や若手・中堅が前面に立った「チーム・サナエ」を組織し、キャプテンを小野田紀美参院議員が務める方針を決めた。
【写真】世良公則氏のベースに合わせ、ドラムを叩く高市早苗氏
チーム・サナエは、「日本初女性総理誕生」をアピールするチーム（リーダー・松島みどり元法相）など複数の実働部隊で構成する。

選対本部長は昨年9月の総裁選に続き、中曽根弘文元外相を充て、推薦人代表は古屋圭司憲法改正実現本部長が務める。22日に提出する推薦人20人には派閥パーティー収入不記載事件に関与した議員は名前を連ねないという。

高市氏陣営はこれまで、総裁選に出馬する5陣営のうち唯一、選対トップが明らかになっていなかった。

陣営幹部は「チーム・サナエを前面に出す。選対本部長などの人事は党本部に求められており、ある意味形だけ。総裁選の従来の手法とは全く異なるやり方で戦っていく」と語る。（奥原慎平）",[],[]
