headline,mainEntityOfPage,image,datePublished,dateModified,author,media_en,media_jp,str_count,body,images,external_links
主要7大学トップが万博の大屋根リング「可能な限り保存を」訴え　文化的損失と緊急意見書（産経新聞）,https://news.yahoo.co.jp/articles/8bf190350b18ac3fd115c2d460fa7fa6da382f0c,https://newsatcl-pctr.c.yimg.jp/t/amd-img/20250922-00000110-san-000-3-view.jpg?exp=10800,2025-09-22T17:09:57+09:00,2025-09-22T17:35:11+09:00,産経新聞,san,産経新聞,609,"万博会場の大屋根リング＝大阪市此花区
大阪・関西万博のシンボル「大屋根リング」の保存活用を巡り、関西の7つの大学・学校法人のトップらが、可能な限り多くの部分を現地で保存するよう求める「緊急意見書」をまとめ、大阪府市や経済団体、万博を運営する日本国際博覧会協会に提出したことが22日、分かった。意見書ではリングを「極めて重要な文化的・歴史的レガシー（遺産）としての価値を有する建造物」とし、さらなる規模の保存を検討する場を設けるよう求めている。
【写真】大屋根リングの「全残し」を訴える、高校3年の朱詠瞳さん
意見書は大阪大、大阪公立大、近畿大のほか、学校法人の関西大、関西学院、同志社、立命館の総長や学長、理事長らが連名で作成した。

意見書は、リングが「大阪・関西の新たなランドマーク」として観光資源や文化拠点としての役割を果たし得るにもかかわらず、大部分は解体されるため「文化的損失として後世に大きな禍根を残す」と主張。「議論が尽くされているとは言い難い」として「保存・活用に向けた具体的方策の検討」や「持続可能な運営体制の構築」が必要と訴え、「広く衆知を結集するための場」を設けるよう要望した。

リングについては協会や府市、関西経済連合会などの経済団体が今月に開催した検討会議で、北東約200メートル部分を現状と同様に上れる状態で保存し、市が周辺を「公園・緑地等」として整備する方針が提案され、合意されている。",[],[]
大手進学塾「浜学園」が万博で描く2050年の教育　求められるのは「非認知能力」（産経新聞）,https://news.yahoo.co.jp/articles/fa3d75f6e00548291e061e5492222511959f3ffd,https://newsatcl-pctr.c.yimg.jp/t/amd-img/20250922-00000109-san-000-1-view.jpg?exp=10800,2025-09-22T17:04:28+09:00,2025-09-22T17:04:28+09:00,産経新聞,san,産経新聞,1265,"思考が脳の活動に与える影響について説明したトークショウ「教育の未来地図」＝大阪・関西万博
大手進学塾の浜学園グループ（本部・兵庫県西宮市）は9月21日、大阪・関西万博会場内のフェスティバル・ステーションで、「2050年　未来の教育　学びの地図は君が描く」と題したイベントを開催し、約300人の親子が参加した。脳科学や非認知教育、さらには「腸活」といった多彩な切り口から、未来を担う子供たちの学びのあり方を展望した。

イベントは、子供たちが主体性を持つことの大切さと、近未来の教育環境を提案することが目的で3部構成になっている。

1部では、浜学園出身の落語家、桂福丸さんが「2050年　主役は君だ」と題して落語を披露。会場の子供を舞台にあげて食べる模写をしてもらい、何を食べているか会場の子供たちが当てるパフォーマンスを実施するなど、会場は子供たちの笑い声に包まれた。

2部では、「教育の未来地図」をテーマにしたトークショーを実施し、各界の専門家が未来の教育について議論をした。

最初に浜学園が思い描く2050年の教育をシミュレーションした映像を披露。AIが進化した世界では、知識や計算能力、言語化能力など測定・数値化できる「認知能力」とともに、予測不能な事態に対応したり、複雑な人間関係を円滑にしたりする「非認知能力」がより重要になっていくことを指摘している。

続いて、京都大学医学研究科附属脳機能総合研究センターの花川隆センター長が「脳機能の理解から未来を拓く」をテーマに講演。思い描く感情によって、脳が実際に活性化する部分などを説明。「大きな目標を達成するためには、実現可能な小さな目標を積み重ねていくことが、実現するためのコツ」と指摘した。

また、ボーイング・ジャパンの小野敏雄さんが、「究極の学習空間とは」と題し、LED照明に関して説明。ブルーライトが強く出るいま普及しているLED照明に対して「太陽などの自然光に近いLED照明に変えることで、子供の学習効果が高まることが実証されている」と説明。浜学園では、今後、同種のLED照明を導入していくことが紹介された。

3部では、子供たちが科学の面白さに触れるユニークな企画として、藤田医科大学の栃尾巧教授による子供腸活教室「人工うんちを作ろう！」も開かれた。子供たちがステージ上で、食事をした後の状況を再現し、食物繊維を入れた場合と入れていない場合で、便がどうなるのかを検証した。実験に参加した子供は「食物繊維をしっかりとった方が、きちんとした便になるので、今後気を付けたい」と感想を述べた。栃尾教授は「腸活をすることで、子供たちの学習効果も高まる」と説明した。
浜学園の竹森勝俊社長は「認知能力と非認知能力は一方だけが秀でていても意味がなく、相関関係が大切だ」と指摘。そのうえで「子供にとってはさまざまな経験を積むということが重要で、これは塾だけではなしえない。保護者と連携しながら、心と体の健康や、生活環境の改善などについても発信していきたい」と話していた。",[],[]
パレスチナ駐日大使「被害者とともに立って」　国家承認求め、日本政府と国民に訴え（産経新聞）,https://news.yahoo.co.jp/articles/701b37ee63585bf09a0749156c740c3d5f30ab7a,https://newsatcl-pctr.c.yimg.jp/t/amd-img/20250922-00000108-san-000-1-view.jpg?exp=10800,2025-09-22T17:02:57+09:00,2025-09-22T17:02:57+09:00,産経新聞,san,産経新聞,562,"22日、都内で記者会見を開くワリード・シアム駐日パレスチナ大使（岡田美月撮影）
米ニューヨークで開かれるパレスチナに関する首脳級会合に合わせ、ワリード・シアム駐日パレスチナ大使が22日、都内で記者会見し、「日本政府と日本国民に対し、被害者（パレスチナ）とともに立ってパレスチナを今すぐ国家承認するよう訴える」と述べた。

ガザ情勢が深刻化する中、英国やカナダ、オーストラリアなど4カ国が21日に相次いでパレスチナを国家承認したが、日本は承認見送りを表明している。

シアム氏は「近いうちに日本がパレスチナを国家承認すると信じている」と強調。「なぜなら日本は（イスラエルと共存する）『2国家解決』を支持し、この地域に平和がもたらされるべきだと考えてきたからだ」と述べた。また、「パレスチナ自治区はイスラエルに軍事占領されている。国家承認はパレスチナの国境や人々を守ることになる」と主張した。

イスラエルのネタニヤフ政権はガザ北部でイスラム原理主義組織ハマスを標的とする地上作戦を進める一方、ガザ南部に「人道都市」を建設し、全てのガザ住民を収容する計画も検討中だ。シアム氏は「なぜパレスチナ人全員を南に追いやるのか」とイスラエルを糾弾。同国の交戦相手は「ハマスではなく、パレスチナの人々だと断言できる」と非難した。（岡田美月）",[],[]
パナソニックHD、新会社「パナソニックデジタル」設立へ　ソリューション領域を担う（産経新聞）,https://news.yahoo.co.jp/articles/9b4c46a4d5de09988a65279b020476387cd0a893,https://newsatcl-pctr.c.yimg.jp/t/amd-img/20250922-00000102-san-000-1-view.jpg?exp=10800,2025-09-22T16:39:07+09:00,2025-09-22T16:39:07+09:00,産経新聞,san,産経新聞,294,"パナソニックHD本社＝大阪府門真市
パナソニックホールディングス（HD）は22日、3社の子会社を統合して2026年4月1日付で「パナソニックデジタル」を新設すると発表した。グループが注力する領域として掲げるソリューションの事業強化を目指す。

パナソニックデジタルは社員数約2千人で、企業間取引（BtoB）を中心にグループ内で培った製造DX（デジタルトランスフォーメーション）などを活用したソリューション事業の拡大を担う。

パナソニックHDは、経営改革の方針としてソリューション領域への注力を掲げており、パナソニックデジタルの新設はその一環となる。12月ごろに事業内容の説明を行う予定。",[],[]
「大きな枠組みへの提案は真摯に」維新・藤田文武共同代表、連立枠組み拡大に含み（産経新聞）,https://news.yahoo.co.jp/articles/deb9006dd3037a5fb7e790a999869ef465f1de20,https://newsatcl-pctr.c.yimg.jp/t/amd-img/20250922-00000101-san-000-1-view.jpg?exp=10800,2025-09-22T16:30:21+09:00,2025-09-22T16:30:21+09:00,産経新聞,san,産経新聞,364,"日本維新の会の藤田文武共同代表（酒巻俊介撮影）
日本維新の会の藤田文武共同代表は22日、与党との連立の枠組み拡大について重ねて含みを持たせた。自民側からの正式な接触はないと断りつつ、「われわれの一挙手一投足が非常に重要だとの自覚を持ち、政策ベースでの対話や大きな枠組みへのご提案には真摯（しんし）に耳を傾ける。その上で、何がベストな選択かを国家国民のために考えることが本筋だ」と述べた。国会内で記者団の質問に答えた。

衆参両院で与党過半数割れとなる中、維新は連立拡大の最有力候補とされる。藤田氏は自民党総裁選（10月4日投開票）について、維新が掲げた社会保険料改革や「副首都構想」、憲法改正などに対する各候補の姿勢を見極めると表明した。「国家にとって重要な議題を投げかけており、各候補のスタンス、姿勢を注視したい」と強調した。",[],[]
川崎市長選、4選目指す現職の福田紀彦氏が公約発表　「最幸のまち」掲げ「しっかり投資」（産経新聞）,https://news.yahoo.co.jp/articles/493c48558935c45e659346715a2c7a78f3b80090,https://newsatcl-pctr.c.yimg.jp/t/amd-img/20250922-00000098-san-000-1-view.jpg?exp=10800,2025-09-22T16:24:07+09:00,2025-09-22T16:24:07+09:00,産経新聞,san,産経新聞,457,"川崎市長選に向け選挙公約を発表する現職の福田紀彦氏＝22日、同市中原区（山沢義徳撮影）
任期満了に伴う川崎市長選（10月12日告示、26日投開票）に4選を目指し出馬する現職の福田紀彦氏（53）が22日、選挙公約を発表した。「『最幸のまち』かわさきへ」をキャッチフレーズに、30項目の政策を盛り込んでいる。

政策は、市民の健康づくりや産業、資源など7分野の「循環」を打ち出す。高齢者や障害者の賃貸住宅入居を支援する公的保証の制度作り、高いものづくり技術やデジタル能力を習得する高等専門学校の設立、等々力緑地が〝市民の誇り〟となるような再編整備などに取り組むとしている。

公約の狙いについて福田氏は「市に元気があるうちに都市基盤や人づくりへしっかり投資し、次の50年、100年に向け持続可能なまちを作る」と説明した。

福田氏のほかに立候補を表明しているのはいずれも無所属新人で、会社員の國谷涼太氏（25）▽政治団体役員の野末明美氏（60）▽出版社代表の宮部龍彦氏（46）▽元川崎市議の山田瑛理氏（42）－の4氏。",[],[]
「世界の平和と繁栄に台湾の力を」　台湾の林佳竜外交部長が産経新聞に寄稿（産経新聞）,https://news.yahoo.co.jp/articles/0b0970851209695536da9019b53995f08a07c9cc,https://newsatcl-pctr.c.yimg.jp/t/amd-img/20250922-00000096-san-000-1-view.jpg?exp=10800,2025-09-22T16:06:47+09:00,2025-09-22T16:06:47+09:00,産経新聞,san,産経新聞,1290,"台湾の林佳竜外交部長（台湾・外交部提供）
台湾の林佳竜外交部長（外相に相当）は米ニューヨークで開催中の国連総会に合わせて産経新聞に寄稿し、台湾の自由民主主義体制や半導体生産能力が現在揺らぎつつある国際秩序の安定に貢献できると強調。国連や関連機関への台湾の参加を支持するよう呼び掛けた。寄稿は以下の通り。

◇

国際社会は今、不確実性と脅威に直面している。次々と起きる軍事衝突や経済的威圧、偽情報の拡散や権威主義政権によるグレーゾーン手段の強化によってルールに基づく国際秩序は脅かされており、決して平和を当然視することはできない。唯一、民主主義国家が一致団結してこそ、われわれの生活様式と価値観を守ることができる。

台湾はインド太平洋で第1列島線の最前線に位置し、民主主義と自由を守ることで、権威主義の拡張を食い止めている。健全な経済力と半導体産業で、世界の安定と繁栄に貢献している。台湾は世界第21位の経済体として、人工知能（AI）と半導体分野で世界をリードしている。世界の6割を超える半導体チップと9割の先端チップを生産し、世界の発展のカギを握るパートナーとなっている。

台湾はそもそも中国との衝突を望んでおらず、こちらから挑発することもない。北京に対して、平等と尊厳を基礎として対話を再開するよう呼びかけている。台湾は権威主義の脅威に直面していても、民主主義制度が力強く成長できる証である。台湾は「非レッドサプライチェーン（中国に依存しない供給網）」を経済・貿易戦略とし、重要産業が権威主義体制にコントロールされることを防いでいる。

残念なのは、台湾が世界に多大な貢献をしても、国際社会からあるべき承認が得られず、国連システムにも参加できないことだ。この不公平の根源は、国連総会第2758号決議（アルバニア決議）を中国が悪意をもって捻じ曲げたことにある。中国は決議を「一つの中国」原則と不当に結び付け、決議を武器に台湾の国際参加を妨害している。

実際には、決議は国連における中国代表権問題を解決しただけで、台湾が中華人民共和国の一部だとは言及せず、中華人民共和国に国連で台湾を代表する権利を与えてもいない。にもかかわらず、国連は中国の政治的圧力に屈し、台湾を国際社会から排除している。
台湾はこうした不公平に抵抗し、国際的な支持が得られるよう取り組んでいる。現在、先進7カ国首脳会議（G7サミット）などの多国間枠組みや2国間の場で、台湾海峡の平和と安定を強調する国が増えている。また、多くの国の行政・立法部門が、アルバニア決議は台湾の地位を決めたものでなく国連システムを含む国際組織から台湾を排除していないと公に表明している。
今年は国連創設80周年の節目であり、国連「持続可能な開発目標（SDGs）」の年限まであと5年である。まさに台湾を迎え入れる絶好のタイミングだ。それにより「誰も取り残さない」「手を取り合い未来に進む」という国連の理念を実践できる。台湾は世界が台湾の貢献できる能力と価値を受け入れ、手を携えてインド太平洋と世界の未来を作り出すよう呼び掛ける。",[],[]
自民党総裁選「つまらない」と立民・安住淳幹事長　早期の臨時国会召集を改めて求める（産経新聞）,https://news.yahoo.co.jp/articles/0a7f450899adc4b5975a7509e4c271879c313d43,https://newsatcl-pctr.c.yimg.jp/t/amd-img/20250922-00000094-san-000-1-view.jpg?exp=10800,2025-09-22T15:56:40+09:00,2025-09-22T15:56:40+09:00,産経新聞,san,産経新聞,197,"立憲民主党の安住淳幹事長（春名中撮影）
立憲民主党の安住淳幹事長は22日、自民党総裁選（10月4日投開票）について「みんな同じような主張をしている感じで、ちょっとつまらない。国の将来を語ってほしい」と論評した。参院選後、政治空白が続いている点については「比較第一党として大きな責任がある。3カ月も国会を放置した」とも語り、早期に臨時国会を召集するよう改めて求めた。国会内で記者団の質問に答えた。",[],[]
新宿・歌舞伎町で立ちんぼ女性を脅しわいせつ行為　「大久保の刃物男」に懲役25年判決（産経新聞）,https://news.yahoo.co.jp/articles/5c613e76e461c60a61a13c9771fe066065b368c9,https://newsatcl-pctr.c.yimg.jp/t/amd-img/20250922-00000093-san-000-2-view.jpg?exp=10800,2025-09-22T15:54:48+09:00,2025-09-22T16:09:13+09:00,産経新聞,san,産経新聞,506,"東京地裁が入る庁舎＝東京・霞が関
新宿・歌舞伎町の大久保公園付近で街頭に立ち、売春の客待ちをする「立ちんぼ」の女性4人を脅し、金品を奪ったりわいせつな行為をしたりしたとして、不同意性交や強盗の罪に問われた東京都三鷹市の理容師、難波正秀被告（62）の裁判員裁判で、東京地裁（新井紅亜礼（くあら）裁判長）は22日、懲役25年（求刑懲役25年）の判決を言い渡した。
【写真】女性が並ぶ「立ちんぼ公園」と呼ばれる大久保公園前。全体的に若く、ルックスもいい
公判で被告は「全て違います」と、4人に対する起訴内容を全て否認。「現金は奪っていない」「（性行為には）同意があった」などと、真っ向から反論し、被害者の供述の信用性が主な争点となっていた。

検察側は、被害者4人は互いに面識がないにもかかわらず、同じ人物から似た手口で被害に遭ったという点が一致しており「互いに補完しあい、それぞれの証言の信用性を高めている」とした。

弁護側は被害者の供述に疑問が残るとして無罪を訴えていた。

起訴状によると、難波被告は令和5年7月～6年5月、当時15～22歳の女性4人に対し、わいせつな行為をしたり現金を奪ったりしたとしている。",[],[]
自民総裁選は「再出発を期す重要な選挙」　経団連・筒井義信会長がコメント発表（産経新聞）,https://news.yahoo.co.jp/articles/63d22ea0b0d204e0dd03423af53ce07351e7cb18,https://newsatcl-pctr.c.yimg.jp/t/amd-img/20250922-00000090-san-000-1-view.jpg?exp=10800,2025-09-22T15:35:47+09:00,2025-09-22T15:35:47+09:00,産経新聞,san,産経新聞,367,"経団連の筒井義信会長（酒井真大撮影）
石破茂首相の退陣表明に伴う自民党総裁選が22日告示されたのを受け、経団連の筒井義信会長はコメントを発表した。筒井氏は衆参両院で少数与党となっているのを念頭に「国民からの信頼回復、安定した政治の態勢の確立に向け、再出発を期す自民党としての第一歩にあたる重要な選挙だ」と位置付けた。

5人の候補者については「経験豊富で実力のある方々」と評価。その上で、選挙戦を通じて議論すべき重要政策課題として「『成長と分配の好循環』の着実な実現、税と社会保障の一体改革、エネルギー・食料の安定供給の確保、自由で開かれた国際経済秩序の維持・強化」などを挙げた。

加えて、「再生自民党の姿や国家ビジョン」について議論が交わされることにも期待を示した。

選挙期間は12日間で、10月4日に投開票される。（佐藤克史）",[],[]
市民団体妨害による沖縄・宮古島の訓練中止「自衛隊を支援していくべきだ」　日本維新の会（産経新聞）,https://news.yahoo.co.jp/articles/e11320663d0b3cd86181623251d77ba030527dfe,https://newsatcl-pctr.c.yimg.jp/t/amd-img/20250922-00000089-san-000-1-view.jpg?exp=10800,2025-09-22T15:19:35+09:00,2025-09-22T15:19:35+09:00,産経新聞,san,産経新聞,325,"日本維新の会の和田有一朗衆院議員
日米共同の大規模実動演習「レゾリュート・ドラゴン」の一環で宮古島（沖縄県宮古島市）で予定されていた物資輸送訓練が一部市民団体の妨害で中止に追い込まれた問題を巡り、日本維新の会安全保障部会（和田有一朗部会長）は22日、国会内で防衛省からヒアリングした。

8月に防災訓練中の陸自新入隊員に左派団体が拡声器で心ない言葉を浴びせ、憤慨した隊長とトラブルになった事案についても合わせて聴取した。

出席議員からは「外国勢力が妨害活動をさせていたらどうするのか」といった質問が出たほか、隊長がその後、旅団長から指導を受けたことを踏まえ「自衛隊が萎縮せずに職務を遂行できる環境づくりを支援していくべきだ」といった意見が相次いだ。",[],[]
小泉進次郎氏、トランプ関税も念頭に自由貿易の重要性を強調　自民総裁選演説会（産経新聞）,https://news.yahoo.co.jp/articles/a6c49b9a1dbc74de6ab4a3cbdd0909c5a9e2f27c,https://newsatcl-pctr.c.yimg.jp/t/amd-img/20250922-00000087-san-000-2-view.jpg?exp=10800,2025-09-22T15:18:39+09:00,2025-09-22T16:35:40+09:00,産経新聞,san,産経新聞,312,"自民党総裁選挙の所見発表演説を行う小泉進次郎農水相＝22日午後、党本部（春名中撮影）
小泉進次郎農林水産相は22日に開かれた自民党総裁選（10月4日投開票）の所見発表演説会で、トランプ米政権の関税政策も念頭に、自由貿易や経済連携の重要性を強調した。「自由で開かれたインド太平洋」を実現すると表明し「通商立国として発展してきたわが国として自由や法の支配など普遍的価値の重要性を主張していく」と語った。

小泉氏は同時に「トランプ米大統領と信頼関係を築き、日米同盟を新たな高みに引き上げる」と述べた。その上で、日米豪印の協力枠組みの「クアッド」や先進7カ国（G7）などの枠組みを活用して「多様な同志国連携を拡大する」と強調した。",[],[]
高市早苗氏、太陽光など「おかしいと思いませんか」…補助金制度「大掃除」　総裁選演説会（産経新聞）,https://news.yahoo.co.jp/articles/ec3f14c36a0fc8e07c1258ba2966864f64fd643b,https://newsatcl-pctr.c.yimg.jp/t/amd-img/20250922-00000088-san-000-3-view.jpg?exp=10800,2025-09-22T15:18:06+09:00,2025-09-22T15:33:53+09:00,産経新聞,san,産経新聞,443,"出陣式であいさつする高市早苗前経済安保相＝22日午前、国会内（鴨志田拓海撮影）
自民党総裁選（10月4日投開票）の各候補による22日の立会演説会で、高市早苗前経済安全保障担当相は太陽光発電などを例に挙げ、「補助金制度の大掃除をして本当に役に立つものに絞り込む」と見直しに着手する考えを示した。
【写真】釧路湿原周辺のメガソーラー建設現場
高市氏は、北海道の釧路湿原国立公園周辺で大規模太陽光発電所（メガソーラー）建設を巡り地元が反発していることに触れ、「だいたいおかしいと思いませんか。釧路湿原に太陽光パネルを敷き詰めるようなやり方は」と整備事業への疑問を指摘。その上で「ゆがんだ補助金（制度）による結果だ」と訴えた。

さまざまな補助金制度がある中で「間違ったシグナルや行き過ぎたアクセルになってしまい、おかしな結果を生んでいるものがいっぱいある」と述べ、有効な補助金制度のみに絞り込むための「大掃除をする」と語った。太陽光発電を巡っても「太陽光パネルからの大転換につながる」とした。",[],[]
