headline,mainEntityOfPage,image,datePublished,dateModified,author,media_en,media_jp,str_count,body,images,external_links
プーチン氏「新START期限後も規定を1年順守」　米に同調要求、軍拡負担避ける狙いか（産経新聞）,https://news.yahoo.co.jp/articles/b0e1d2c6f7363456aae4ce9394b3b0537993e591,https://newsatcl-pctr.c.yimg.jp/t/amd-img/default.jpg?exp=10800,2025-09-22T23:05:25+09:00,2025-09-22T23:05:25+09:00,産経新聞,san,産経新聞,650,"ロシアのプーチン大統領は22日、来年2月に期限を迎える米露間の新戦略兵器削減条約（新START）について、仮に失効した場合でもロシアが1年間、条約に定められた戦略核弾頭の配備数や運搬手段の保有数といった「数量規定を順守する用意がある」と表明した。一方、ロシアがこうした措置を取るのは米国が同様の措置を講じる場合のみだとも指摘した。

プーチン氏は同日、政権高官でつくる露国家安全保障会議を開催。会議での発言を露大統領府が公表した。プーチン氏は事実上、条約の延長をトランプ米政権に提案した形だ。ウクライナ侵略や対露制裁によりロシアの国力が低下する中で、条約が失効して軍拡競争が激化し、ロシアの負担となる事態を避けたい考えだとみられる。

会議でプーチン氏は、新STARTの「完全な破棄は誤った近視眼的な措置である上、核拡散防止条約（NPT）の目的にも悪影響を及ぼす」と指摘。核兵器分野の軍拡競争を避けるためにも「現状維持が正しい」とし、今後、米国と協議を進めたい考えを示した。

米露間では2019年8月、中距離核戦力（INF）全廃条約が失効。新STARTが残る唯一の軍備管理条約となっていた。米露は21年2月、同条約の5年間の延長を発表したが、プーチン氏は23年2月、米国が条約の義務を履行していないと主張し、ロシアが条約の義務履行を一時停止すると定める法律を発効させていた。

トランプ米大統領は今年7月、新STARTの「失効を望んでいない」とし、延長などを模索する考えを示していた。（小野田雄一）",[],[]
PAを何カ所も探し… 深夜の高速道路で休む場所がないトラック運転手の苦悩と異様な光景（産経新聞）,https://news.yahoo.co.jp/articles/8e9757830fb0c1fcb438abed8302f3a534786994,https://newsatcl-pctr.c.yimg.jp/t/amd-img/20250922-00000188-san-000-1-view.jpg?exp=10800,2025-09-22T22:00:00+09:00,2025-09-22T22:00:00+09:00,産経新聞,san,産経新聞,2054,"大型トラックで埋め尽くされた東名高速上りの中井パーキングエリア＝神奈川県中井町（相川直輝撮影）
平日夜の高速道路を中心に、トラック運転手の休憩場所が不足していることが問題となっている。サービスエリア（SA）やパーキングエリア（PA）は夕方から駐車枠が埋まり、明け方まで慢性的な混雑が続く。特に関東から関西にかけては混雑が激しく、駐車枠の外に止まる車も珍しくない。輸送の効率化などにより高速道路を利用する車が増加する一方、労働時間の厳守などが重なり、負担はドライバーにのしかかる。
【写真】東名高速上りPA混雑状況を示す掲示板は、どのPAも大型枠が混んでいると表示されていた
■どこも混雑「休憩とることが苦痛」

午後11時過ぎ、神奈川県中井町の東名高速中井PAは大型トラックで埋め尽くされ、エンジン音が響いていた。駐車枠が空いておらず通路に止めるトラック、止める場所が見つからずそのまま本線へ合流していくトラック―。人々が眠りにつく時間に異様な光景が広がっていた。

運送会社フジトランスポート松山支店の長距離運転手、中越一樹さん（39）は「（現在の混雑状況だと）休憩をとることが苦痛になっている。PAやSAを何カ所も探してやっと止められるかなというところ。走行する車線のぎりぎりに路駐している人もいて、そこを通過するとトラックのミラーが当たりそうで本当に怖い」と話す。

■休憩場所の拡充は「職場環境の問題」

トラック運転手は国の定める「改善基準告示」によって、連続運転時間は原則4時間以内で、休息は最低でも継続9時間とることなどが細かく定められている。もし休まずに走行して事故を起こせば、重大な責任を問われることになる。ドライバーにとって、休める場所を探すことは切実な問題なのだ。

高速道路網の発達や労働時間の制限、輸送の効率化を受けて、近年、大型車の高速道路利用は増加している。ネクスコ東日本など高速3社によると、車種別の平均通行台数は、平成25（2013）年度は中型車、大型車、特大車合計で1日平均約136万台に対し、令和6（2024）年度は約169万台にまで増えた。

各高速道路会社は、駐車枠の増設や短時間限定駐車マスの導入などを進め、運転手の休憩場所の拡充を図っている。全日本トラック協会の担当者は「（運転手にとって）高速道路は職場。職場環境の問題を改善していかないと若い人が入ってこない。ドライバーがいつでも自由な時間に休憩が取れるよう国に休憩施設の拡充を要望している」と話すが、抜本的な改善には至っていない。

■午前０時、深夜割引を待つ“群れ”
休憩場所の不足と同じく問題となっているのは、深夜割引の適用をめぐる時間調整だ。
午前0時前。東名高速道路上り線の東京料金所（川崎市宮前区）には、大型トラックがずらりと列をなしていた。日付が変わると、号砲が鳴ったかのように一斉に動きだし、5分ほどで列は消えた。
高速道路料金は、午前0時から午前4時の間に少しでも走行すれば全区間の利用額が3割引きとなる。このため、運転手は手前のサービスエリア（SA）やパーキングエリア（PA）で時間を調整して高速道路を降りる。
ネクスコ3社はこうした状況を踏まえ深夜割引制度の見直しを予定している。割引適用時間を午後10時から翌午前5時までに拡大し、時間内に走った分のみ3割引きにする。また400キロを超える走行については長距離割引の適用を拡大する。
見直しは当初、今年3月末に予定され、その後に7月頃へと延期されたが、システム開発の遅れやシステム障害対策のためさらに延期されている。具体的な運用開始時期は今後改めて告知されるという。
新たな制度が始まれば「午前0時待ち」は解消される見込みだが、割引適用時間帯に走行した距離の分だけが割引対象となるため、夜に高速道路内のSAやPAで休息をとる運行ではほとんど適用されず、実質的な値上げとなる。また午後10時の割引適用時間前まで時間調整を行う車がSAやPAにあふれる可能性もある。
■荷主と運送会社の力関係
高速道路での休憩場所や深夜割引の問題はなぜ起こるのか。原因の一つに、荷主の立場が強く、運送会社は従わざるを得ない力関係があるという。物流ジャーナリストの坂田良平氏は「運送会社は自分たちでビジネスデザインを決めることができない。荷物を出す側と、受け取る側の荷主間で決まる。高速道路料金を負担してくれない荷主もいる」と話す。
関東から関西への輸送歴10年で、現在は事務方の業務を行う30歳の運送会社社員は「荷主がどうしても早く荷物を欲しいという場合は、こちらも荷主に運賃（の割り増し）を交渉していかなければならない」と考えているという。
今日頼んだものが、明日届く便利な世の中になった。こうした物流を支えているのが、全国を巡る長距離トラックだ。街が眠りにつく深夜の高速道路で作り出される不思議な光景はこの先、どこへ向かうのだろうか。（文・写真　相川直輝）",[],[]
「火葬料金の適正化を」東京都議会立憲民主党会派が小池知事に要望　都は主体的関与へ（産経新聞）,https://news.yahoo.co.jp/articles/3039b286b8c492d94fd1b526daa9647c3e6ec403,https://newsatcl-pctr.c.yimg.jp/t/amd-img/20250922-00000187-san-000-2-view.jpg?exp=10800,2025-09-22T21:52:56+09:00,2025-09-22T22:05:48+09:00,産経新聞,san,産経新聞,530,"火葬料金を巡る要望書を東京都の担当者に手渡した都議会立憲民主党会派のメンバーら＝22日午後、都議会（原川貴郎撮影）
高騰する東京23区内の民間火葬場の火葬料金を巡って議論してきた都議会会派「立憲民主党・ミライ会議・生活者ネットワーク・無所属の会」は22日、料金の透明化や適正化に向け、特別区長会と連携して国に法改正を求めるよう小池百合子知事に要望した。火葬場の新設を含め、火葬能力の強化に都が積極的に取り組むことも求めた。
【ひと目でわかる】東京23区の火葬場
同会派の竹井庸子幹事長が小池氏宛ての要望書を都担当者に手渡した。

23区内の民間火葬場の火葬料金問題に対し都は従来、墓地埋葬法（墓埋法）で「区が指導監督を行うことになっている」と一歩引いた立場をとってきた。

しかし、小池氏は19日の記者会見で「墓埋法に対しての対応を国にも求める必要がある」と同法改正の必要性に言及。「将来にわたって、安定した火葬体制を確保するのは重要」だとして「火葬場の適正な経営管理が確保できるように区市町村と連携しながら適切に対応していく」とも述べ、都として主体的に関与していく考えを示した。小池氏は24日開会の都議会第3回定例会でも、こうした都の姿勢転換を示す見通しだ。",[],[]
正代が1敗で豊昇龍を追走　優勝争いは「意識したくない」　大相撲秋場所9日目（産経新聞）,https://news.yahoo.co.jp/articles/c6a3b7f30bc91f84e446b3ef91b0cc53db329e54,https://newsatcl-pctr.c.yimg.jp/t/amd-img/20250922-00000176-san-000-1-view.jpg?exp=10800,2025-09-22T20:58:18+09:00,2025-09-22T20:58:18+09:00,産経新聞,san,産経新聞,546,"正代（奥）は翔猿を押し出し、9日目で勝ち越しを決めた＝両国国技館（尾崎修二撮影）
○正代（押し出し）●翔猿（大相撲秋場所9日目＝22日）

東西の両横綱によって、久々に引き締まった優勝争いが展開されている。全勝の豊昇龍を追う1敗の大の里。ここに東前頭11枚目の正代が1敗で食い込んでいる。

33歳の元大関の体は、この日もよく動いていた。〝くせ者〟翔猿の右腕を両腕で抱えて捕まえた後、すぐに右をのぞかせて前へ。相手に体勢を立て直す余裕を与えず一気に押し出した。

「今日は、ばたついた。とりあえず勝ち越して安心したかったので、それで硬くなったのかな」。率直に反省を口にしつつも、令和2年7月場所以来、約5年ぶりに9日目で勝ち越しを決める好調ぶりだ。

大関時代（2年11月場所から13場所）とは重圧が違うという。「当時は根本的に充実していなかった。勝ったらただほっとして、負けたら、どうしよう明日も負けるんじゃないかと。なかなかしんどかったですね」。今は勝てばうれしいし、負けても切り替えやすい。のびのび相撲を取れている。

報道陣から優勝争いの話題を向けられると、「意識できてないし、意識したくない。自分らしさが出なくなる」。上位と対戦が組まれるところまで白星を重ねていけるか。（宝田将志）",[],[]
「困った人を助ける警察官」に一歩　大阪府警警察学校で卒業式　短期過程205人が巣立つ（産経新聞）,https://news.yahoo.co.jp/articles/3af87a32230c794525b4ecffb2409a192a551a87,https://newsatcl-pctr.c.yimg.jp/t/amd-img/20250922-00000171-san-000-1-view.jpg?exp=10800,2025-09-22T20:44:32+09:00,2025-09-22T20:44:32+09:00,産経新聞,san,産経新聞,297,"卒業式に臨む初任科第256期の卒業生ら＝大阪府田尻町の府警察学校 （土屋宏剛撮影）
大阪府警察学校で19日、初任科第256期生（短期課程）の卒業式が行われた。法律や逮捕術などを学んだ205人が警察官として新たな一歩を踏み出した。

式典で岩下剛本部長は「警察官を志した際の正義感を忘れず、警察官人生に大きく期待してほしい」と訓示。卒業生は、4月1日からの約6カ月間指導を受けた教官から直接、辞令を手渡され、府内各署などに配属された。

卒業生の杉原夢依さん（23）は「警察学校で教官から学んだことを胸に、幼少期からの夢である『困っている人を助けられる警察官』になるべく頑張りたい」と意気込んだ。",[],[]
桃太郎の敵は交通違反？　「紙芝居屋のガンチャン」が一日交通課長で新作披露　大阪・西成（産経新聞）,https://news.yahoo.co.jp/articles/f548255349f4d1a477d7533eca1d69bdef59a491,https://newsatcl-pctr.c.yimg.jp/t/amd-img/20250922-00000170-san-000-1-view.jpg?exp=10800,2025-09-22T20:44:02+09:00,2025-09-22T20:44:02+09:00,産経新聞,san,産経新聞,551,"高齢者らを前に交通安全紙芝居を披露する「紙芝居屋のガンチャン」こと岩橋範季さん＝大阪市西成区（木下倫太朗撮影）
秋の全国交通安全運動（30日まで）に合わせ、大阪府警西成署は「紙芝居屋のガンチャン」こと岩橋範季さん（45）を一日交通課長に任命した。岩橋さんは、高齢者の事故防止をテーマに新作の紙芝居を披露し、交通安全を笑いを交えて訴えた。

西成区出身で15年以上紙芝居屋として活動する岩橋さん。府内では8月末時点で高齢者の事故件数が4987件と、前年同期比で54件増加しており、紙芝居を通じて高齢者らに交通安全への意識を高めてもらおうと、西成署が依頼した。

19日には、西成区民センターに集まった約180人を前に、新作の交通安全紙芝居「もともとももたろう」を披露。昔話の「桃太郎」が60年後に再び鬼退治に行くというストーリーだが、年を重ねた桃太郎が道中、道路を斜めに横断しようとして事故に遭いそうになる場面もあり、「横断歩道があるところをしっかり渡りましょう」と呼びかけた。

このほか、交通安全教室にも参加し、外出時の反射材着用や自転車利用時のヘルメット着用を訴えた。

岩橋さんは「紙芝居なのでイメージしやすく、心に残ったのではないかと思う。交通安全意識の高さを誇れる街にしていきたい」と話した。",[],[]
小泉進次郎氏「党の再生こそ私の原点」　前回のライバル合流で挙党態勢演出　自民総裁選（産経新聞）,https://news.yahoo.co.jp/articles/e219efe609db78256a82c3dbc983107a3045b561,https://newsatcl-pctr.c.yimg.jp/t/amd-img/20250922-00000169-san-000-3-view.jpg?exp=10800,2025-09-22T20:43:31+09:00,2025-09-22T21:56:05+09:00,産経新聞,san,産経新聞,920,"出陣式で気勢を上げる小泉進次郎農水相（中央）ら＝22日午後、国会内（酒井真大撮影）
昨年の前回自民党総裁選で3位だった小泉進次郎農林水産相は22日正午過ぎ、国会内で開いた出陣式で「一致団結の総裁選になるよう全身全霊を込めて戦い抜く」と意気込んだ。秘書らによる代理出席も含めると党所属国会議員の3分の1近い92人が駆け付け、5陣営の中で最もにぎわった。
【写真】父親まねた？髪形チェンジしていた頃の進次郎氏
■「安全運転」を意識

締めくくりのエイエイオーコールでは、前回争った加藤勝信財務相と河野太郎前デジタル相が小泉氏の両脇に並び、挙党態勢を演出した。

出陣式で議員や秘書に振る舞われたのはカツサンド。「カツカレーの方が腹持ちがいいのにな」とぼやく議員もいたが、小泉氏自身はその場で食べる間もなく所見発表演説会へ。

演説会では物価高対策や社会保障などについて、野党に幅広く協議を呼びかけ、合意を模索すると語った。「新たな政策を華々しく打ち上げる前に国民が求めていることを着実に実行するのが信頼回復の唯一の道だ」と述べ、踏み込んだ政策発信を控える「安全運転」を意識した。

力を込めたのは、野党時代の自民総裁を務めた谷垣禎一氏とのつながりだ。「初当選したばかりの私も谷垣総裁の方針に従い、地方を回って国民から厳しい声を聞きながら、党の立て直しを考え続けた。党の再生の取り組みこそ私の政治家としての原点だ」

■谷垣氏の路線を継承

小泉氏は19日夜、谷垣氏の自宅を訪れ、党内の結束を高める方法について相談した。総裁選の公約には、谷垣総裁時代に実施した全国で国民の声を聴く「なまごえプロジェクト」の再開を盛り込み、21日には早速、さいたま市で党員との車座対話に臨んだ。

衆参両院で与党過半数割れに陥った現状を、自民が下野した平成21年と重ね合わせる。政権復帰の原動力となった谷垣氏の路線を継承する姿勢をアピールし、支持拡大を図る。

陣営によると党員票獲得に動く地方議員のグループは200人を超え、「立ち上がりは好調」。ただ、前回総裁選では論戦での答弁の不安定さが指摘され失速した。失点をいかに減らすかが勝敗のカギを握る。（竹之内秀介）",[],[]
高市早苗氏「外国人との付き合い方をゼロベースで」　唯一の女性候補アピール　自民総裁選（産経新聞）,https://news.yahoo.co.jp/articles/287fe23dd44552d619cb6a18389a47e6cc7ade10,https://newsatcl-pctr.c.yimg.jp/t/amd-img/20250922-00000168-san-000-2-view.jpg?exp=10800,2025-09-22T20:42:52+09:00,2025-09-22T21:48:54+09:00,産経新聞,san,産経新聞,911,"出陣式で気勢を上げる、高市早苗前経済安保相（中央）ら＝22日午前、国会内（鴨志田拓海撮影）
高市早苗前経済安全保障担当相は22日午前10時半、東京・永田町の日枝神社での必勝祈願から自民党総裁選告示日の活動をスタートさせた。参拝後「本当に心静かに、そして幸せな、燃えるような思いだ。精いっぱい頑張っていく」と胸中を明かした。
【写真】世良公則氏のベースに合わせ、ドラムを叩く高市早苗氏
昨年の総裁選では、1回目の投票で党員・党友票、国会議員票ともに石破茂首相を上回りながら、決選投票で敗れただけに、捲土重来への思いは強い。今回、メークの指導を受けるなどして、柔らかい面を打ち出すように準備を進めてきた。

■女性議員からの支援

参拝後の記念撮影では、高市氏の両脇を山谷えり子元国家公安委員長や片山さつき参院決算委員長ら女性議員が固めた。唯一の女性候補として女性議員からの支援は前回を上回る。ある議員は「今回高市氏が首相にならなければ、日本で女性首相が誕生する機会は数十年訪れない」と語る。

続く出陣式では若手・中堅議員が前面に立って組織した「チーム・サナエ」のキャプテンに就任した小野田紀美参院議員が「思いを結集し、日本列島を、強く豊かに。明るく美しい国に」と訴えた。

■外国人問題に多くの時間

高市氏は出陣式後、事務所に戻り、直前まで入念に準備して所見発表演説会に臨んだ。地元・奈良県の奈良公園のシカに対する観光客の暴力行為を引き合いに、外国人問題対策に多くの時間を割いた。「外国人とお互いに思いやりを持てる付き合い方をゼロベースで考える」と述べ、入国警備官の処遇改善や増員などを主張した。

また、「自民総裁、首相となった暁には、自衛隊最高指揮官旗を自分の誇りとして、毎朝毎晩決意を新たにする心持ちだ」と述べ、憲法に自衛隊を明記すると述べた。

19日の出馬表明の記者会見では経済対策を前面に打ち出し、首相就任後に靖国神社参拝を続けるかについても明言を避けた。前回高市氏を支持した岩盤保守と呼ばれる党員・党友票の離反を懸念する声があっただけに、22日の演説会では保守層へアピールしたい思いがにじんだ。（長橋和之）",[],[]
林芳正氏「実こそあれば今月今宵…」　郷里の英雄、高杉晋作に重ね狙う逆転劇　自民総裁選（産経新聞）,https://news.yahoo.co.jp/articles/0d57ef89c44f6fd80712b0c201d594934f0daaee,https://newsatcl-pctr.c.yimg.jp/t/amd-img/20250922-00000167-san-000-1-view.jpg?exp=10800,2025-09-22T20:42:15+09:00,2025-09-22T20:42:15+09:00,産経新聞,san,産経新聞,924,"自民党総裁選の出陣式で気勢を上げる林芳正官房長官（中央）＝22日午後、東京・永田町の党本部（鴨川一也撮影）
自民党総裁選が告示された22日、林芳正官房長官は午前9時過ぎに、自らのイメージカラーとして平成7年の参院初当選時から愛用している緑をあしらったネクタイを着け、東京・赤坂の衆院議員宿舎を出た。

「『実こそあれば今月今宵、一夜明ければみんな来る』。こういう心境でしっかりと政策を訴え、戦い抜きたい」。郷里の山口県ゆかりの幕末の志士、高杉晋作の言葉を引用し、記者団にこう語った。

■「2強」に次ぐ3位が定位置

昨年の前回総裁選では4位。最近の報道各社の調査では、小泉進次郎農林水産相と高市早苗前経済安全保障担当相の「2強」に次ぐ3位が林氏の定位置だ。圧倒的に不利な状況で挙兵し、勢力を拡大しながら長州藩内の幕府に従おうとする勢力を破って起死回生の逆転劇を果たした高杉にあやかりたい－。そんな思いがにじんだ。

所見発表演説会では、経済成長のため規制緩和を推進すると表明。脱炭素化を目指すグリーントランスフォーメーション（GX）を最優先事項に据えた。

■政界のピンチヒッター

正午過ぎに党本部で開いた出陣式では「馬の背でスキーをしているような厳しい状況の党や国のかじ取りをできるのは林芳正しかいない」と実務型の政治家としての自負をのぞかせた。「政界のピンチヒッター」と呼ばれ、閣僚の不祥事の際の緊急登板が多かったが、若手の山本啓介参院議員は「いつまでも緊急登板じゃない」と激励した。

もっとも、自身が所属していた旧岸田派の枠を超えて国会議員の支持を広げるという前回以来の課題は克服できていない。出陣式には旧安倍派や旧二階派の議員らの姿もあったが、大半を旧岸田派議員が占めた。

官房長官として支えた石破茂首相に近い議員らの支持拡大に期待を寄せるが、18日のインターネット番組で、首相肝いりの参院選公約だった現金2万円給付を「私だったらやらなかったかもしれない」と発言し、その後撤回したことは痛恨事となった。演説会では「地方創生、農林水産、防災。いずれも大事な分野だ」と首相が取り組んできた重要政策を列挙し、配慮をにじませた。（永原慎吾）",[],[]
