headline,mainEntityOfPage,image,datePublished,dateModified,author,media_en,media_jp,str_count,body,images,external_links
「言葉で潰されかけた」元祖甲子園アイドル太田幸司さん　野球解説者として貫いてきた矜持（産経新聞）,https://news.yahoo.co.jp/articles/a8fbd06db78cfb8cfa5cddce0cd3ea7bdeb0929f,https://newsatcl-pctr.c.yimg.jp/t/amd-img/20250922-00000150-san-000-1-view.jpg?exp=10800,2025-09-22T19:17:21+09:00,2025-09-22T19:17:21+09:00,産経新聞,san,産経新聞,2150,"「言葉で潰されかけた」というプロ野球選手時代の経験から、「聞くこと」と「伝えること」の大切さを語る野球解説者の太田幸司さん＝兵庫県宝塚市（山田耕一撮影）
昭和44年夏の全国高校野球選手権大会で、青森・三沢高のエースとして、史上初の決勝引き分け再試合を1人で投げ抜き、「コーちゃんフィーバー」の社会現象を巻き起こした元プロ野球投手の太田幸司さん（73）。現在は野球解説者として活動する傍ら、中学生の野球指導や女子野球の普及・振興に尽力する。寡黙だったプロ野球選手時代から一転、言葉と文字で伝えることの重要性を感じながら、「聞くことの大切さ」を重視している。

■称賛とバッシング

青森県出身の少年が最初に大きな注目を集めたのは初めて甲子園大会に出場した43年の夏だった。2年生ながら快投し、太田さんは「無名の公立高校の投手。甲子園で見ていた人はびっくりしたんじゃないかな」と懐かしむ。元祖甲子園アイドルの誕生だった。

翌44年の夏は、愛媛・松山商高との決勝戦で激闘を繰り広げる。史上初の延長十八回引き分け再試合。準々決勝から4連投で投げ抜き、社会現象を起こした。

この年のプロ野球ドラフト会議で、近鉄から1位指名された。しかし、1年目は1勝、2年目は未勝利。オールスター戦に選出されて物議も醸した。

自身の思いとは異なる記事も増えた。「人気先行」などの活字が新聞をにぎわす。「頼むから、そっとしておいて、というのが正直な気持ち。だんだん無口になっていきました。最も取材しにくい選手だったんじゃないかな」と苦笑する。

その後は実績を挙げ、人気者からプロで勝てる投手になっていく。49、50、52年は2桁勝利をマーク。54年には7勝を挙げ、球団創設以来初のリーグ優勝に貢献した。58年に巨人へ移籍。59年には交換トレードで阪神に移籍し、この年に現役を引退した。

■女子野球の土台作り

引退後は野球解説者として活動し、言葉や文字と向き合う日々を送る。プロ野球全12球団の個人成績を中心に自筆で毎日ノートにつけている。選手の特徴や成績の推移はもちろん、各試合での選手の対応の変化など、記録は解説をする上で重要だからだ。

今はパソコンに取り込む人も多いが、どんなに大変な作業でも自筆で記録を書き込むのは「やっぱり自分の頭の中に入るから。これはずっと続けています」とやり方を変える気はない。
平成22年に始まった女子プロ野球リーグには、創設時から「スーパーバイザー」（現場の統括および育成や指導者的な役割）として携わり、無期限の活動休止が発表される令和3年12月まで、広報の中心的な役割を果たしてきた。
「彼女たちのプレーから野球が好き、というひたむきな思いがひしひし伝わってきた。高校時代の自分をオーバーラップさせるというか、野球をすることの原点を忘れていた、と気づかされました」
生活基盤を整え、セカンドキャリアも重視。選手が飛び込んできやすい環境整備に注力した。だが、活動休止前には規模の縮小や大勢の選手の退団もあり、批判の声が相次いだ。
太田さんは率先して情報や魅力を発信し続けた。プロ野球選手時代の経験と重なったからだ。入団後、思いとは異なる活字が躍った新聞記事。一方で見守ってくれるファンがいて、話し下手だった自身から何とか言葉を引き出して応援してくれた記者もいた。
その後、日本野球機構（NPB）の球団では阪神や巨人、西武が女子チームを創設。確立されつつある女子野球は、約10年にわたり、太田さんらが礎を築いてきたことが大きい。今も学校などから女子硬式野球部を作りたいという相談を受けると、現地まで足を運び、アドバイスを続けている。
■敬意を持って取材
現在は、中学生の硬式野球チーム「宝塚リトルシニア」（兵庫県宝塚市）で指導を行っている。子供たちと接するときに気を付けているのは「目を合わせて、しっかり話を聞くこと」。「投手が急に崩れたとする。叱るのではなく、なぜそうなったのか、どんなことを考えていたかを最初に聞き、どうやったらその状況で頑張れるのかをアドバイスします」
解説者としても「話を聞くこと」を大事にする。取材相手から聞いた話を何でもかんでも面白おかしく発信すればいい、ということではない。プロ野球選手時代に言葉で潰されかけた自身の経験からのポリシーで、良くも悪くも「言葉の力」の怖さを感じながら、話すべきことをしっかりと整理し、分かりやすく伝えていきたいと考えている。
そして、取材相手に敬意を持って臨むこと。「自分を信頼し、心を開いて話してもらうため。僕自身が相手の本当の気持ちを理解するためでもある」。まずはしっかりと相手の思いを聞き、自分の言葉として発信する。それが、真実を伝える一歩となる。（嶋田知加子）
■おおた・こうじ　昭和27年、青森県生まれ。青森・三沢高で甲子園大会に3度出場。「コーちゃん」ブームを巻き起こす。45年、ドラフト1位で近鉄入団。50年に自己最多の12勝を挙げるなど2桁勝利を3度マーク。58年に巨人、59年に阪神へ移籍し現役引退。通算58勝85敗4セーブ。右投げ右打ち。引退後、日本女子プロ野球機構スーパーバイザーも務めた。野球解説者。",[],[]
巨大な「ふとん」に驚き　堺市の百舌鳥八幡宮秋祭り控え子供たちが「ふとん太鼓」堪能（産経新聞）,https://news.yahoo.co.jp/articles/420423ce0c3d364680d2018f3158727a06cae94e,https://newsatcl-pctr.c.yimg.jp/t/amd-img/20250922-00000149-san-000-2-view.jpg?exp=10800,2025-09-22T19:15:45+09:00,2025-09-22T20:38:07+09:00,産経新聞,san,産経新聞,300,"堺市の百舌鳥八幡宮秋祭りの試験担（か）ぎで、ふとん太鼓に触れる子供たち＝堺市北区
10月4日から堺市北区で行われる「百舌鳥八幡宮秋祭り」を前に、地域の子供たちがふとん太鼓に触れ合うイベントが21日、堺市北区の赤畑町会館で行われた。

イベントは、座布団を重ねたような姿が特徴的な堺名物「ふとん太鼓」の試験担ぎに合わせ、この日初めて実施された。子供たちはふとん太鼓の近くで写真を撮ったり担ぎ棒に触ったりして楽しんだ。

町内でふとん太鼓の催事に関わる神家会の北中覚さんは「ふとん太鼓に触れたことが子供たちの記憶に残れば」と話した。

28日は、ふとん太鼓の組み立ての見学、太鼓たたきの体験会も行われる。",[],[]
猛暑で蚊も「夏バテ」？　10月にかけ発生数ピークに　専門家「不要な水場つぶして」（産経新聞）,https://news.yahoo.co.jp/articles/89d9e6bea5b374768a3073378d6893b11996d452,https://newsatcl-pctr.c.yimg.jp/t/amd-img/20250922-00000145-san-000-1-view.jpg?exp=10800,2025-09-22T19:00:00+09:00,2025-09-22T19:00:00+09:00,産経新聞,san,産経新聞,1035,"蚊の発生のイメージと主な発生源
刺されると腫れとかゆみを引き起こす蚊。だが、今年の夏は蚊を見かけなかったという人も多いのではないか。専門家は、猛暑の影響で蚊が「夏バテ」して発生が抑えられた一方、気温の下がる10月以降に活動のピークを迎えると指摘。人々の悩みの種になってきた蚊が、夏の季語から外れる日もそう遠くないかもしれない。
【写真】ジカ熱やデング熱などを媒介するヒトスジシマカ
■かゆみ止め、虫除けスプレー使わず

「毎年子供が刺されないように注意しているが、今年は家族全員まだ刺されていない」

千葉県浦安市にある若潮公園で3歳の子供を遊ばせていた近所に住む主婦（35）は、夏の異変に首をかしげる。「子供はかゆいと赤くなるまでかいてしまうので、毎年、家にかゆみ止めのぬり薬は常備している。虫が多そうな場所では虫よけスプレーも欠かさない」と話すが、今年の夏は使用する機会がほとんどなく、対策は空振りに終わった。

また、SNS上でも、「今年は蚊が少ない気がする」「蚊も夏バテしてるのか」など、夏場の〝厄介者〟の減少を指摘する声が相次いでいる。

蚊の不在の原因とされているのが、この夏の猛暑だ。蚊取り線香などを製造し、「KINCHO（キンチョウ）」のブランドで知られる「大日本除虫菊」（大阪市）によると、蚊は気温27度前後が生息に最適な環境だが、この夏は30度以上の日が続いたため、蚊の動きや生育が鈍っていた。

■11月半ばまで生息期間延びる

9月下旬から10月にかけて暑さが落ち着くと、蚊の活動が活発化すると予想される。大日本除虫菊広報室の加原朋子さんは「気温15度を下回らないと蚊の発生は落ち着かない。残暑が厳しい分、11月半ばごろまで蚊の生息期間が延びるのではないか」と話す。

殺虫剤の売れ行きにも影響を及ぼしている。同社の蚊取り線香や殺虫剤は、夏が終わると売り上げが落ちていたが、この3年ほどは9月下旬ごろまで売れ行きが好調。10月にかけて在庫の問い合わせも多いという。

蚊の発生を抑えるためには「蚊の出やすい環境である不要な水場をつぶす」（加原さん）ことが重要だ。蚊は卵から成虫になるまでを水中で過ごすため、水辺を好んで産卵する。身近な環境では、ブルーシートの水たまりや植木鉢の受け皿、空き缶にたまった水分などが発生源になる。加原さんは「ペットボトルキャップ一杯分の水からでも十分卵は孵化（ふか）し得る」として注意を呼びかけた。（宮崎秀太、濵佳音）",[],[]
火災保険元エース調査員の放火　再調査の損保各社「過去案件は問題なし」に浮かぶ疑問（産経新聞）,https://news.yahoo.co.jp/articles/39c0c0348607335d2e4dfc68e0d324bc8f7f4e05,https://newsatcl-pctr.c.yimg.jp/t/amd-img/20250922-00000144-san-000-1-view.jpg?exp=10800,2025-09-22T19:00:00+09:00,2025-09-22T19:00:00+09:00,産経新聞,san,産経新聞,2289,"保険会社を巡る不祥事が後を絶たない。先日も日本生命保険（日生）の社員が出向先の三菱UFJ銀行から内部情報を不正に持ち出していたことが発覚。中古車大手の旧ビッグモーター（BM）による保険金不正請求問題では、保険代理店を兼ねていたBMと大手損保のなれ合いの構図が露呈した。警察が今年摘発した元火災保険調査員による放火事件では、業務委託していた各損保の対応が問われたが、当事者意識はどこか希薄だ。
【ひと目でわかる】岡山で起きた保険金目的の放火事件の構図
元火災保険調査員による放火事件は今年4月以降、岡山、青森、岐阜の各県警が順次摘発したことで明るみに出た。保険調査会社の最大手「損害保険リサーチ」に令和5年まで在籍していた深町優将（まさのぶ）被告（54）らが保険金目的で各地の古民家に放火したとされる。深町被告はかつてエースと呼ばれるほど火災保険の申請に精通。その知識を悪用した一連の事件は業界に衝撃を与えた。

深町被告は損保リサーチ在籍時や独立後の会社で、いずれも東京に本社を置く東京海上日動火災保険▽あいおいニッセイ同和損害保険▽三井住友海上火災保険▽損害保険ジャパン－など大手からの調査業務も数多く担当。だが報道を受けてからも各社の対応は鈍く、深町被告が関連する過去の調査業務を再調査すると表明したのは、最も早い東京海上で最初の逮捕から約2カ月後の6月下旬だった。

現在までにあいおいを除く3社が再調査を終え、同社も間もなく完了する見込み。対象件数は東京海上と三井住友海上だけで計約580件に上った。損保ジャパンは件数を非公表とした。

再調査を終えた3社いずれも、結論として「過去の案件に問題はなかった」としているが、判断の根拠など詳細は「業務に支障が出る」と明らかにしていない。

ある大手損保の担当者は「あくまで調査員だった一個人の不正。損保リサーチの組織的な問題ではない」とし、業界全体の信頼にかかわる問題とはみていない。

確かに岡山、青森両県での犯行は損保リサーチ退職後だったため、同社も業務委託契約をしている全国の調査員に「事件は退職後に発生した」とするメールを送信し、水面下で火消しを図った。しかし、岐阜県警が今月11日に発表した深町被告の逮捕容疑は損保リサーチ在籍時のものだった。

もともと損保リサーチは各保険会社の共同出資で半世紀前に設立され、社長は東京海上、三井住友海上、損保ジャパン出身者らの持ち回りだ。
損保リサーチの元調査員は「調査時に保険契約者から『どうせ保険会社の意向に沿ったリポートを書くだけだろう』と中立性を信じてもらえないことが何度かあった」とこぼす。
損保会社と取引先との関係は、BMの不祥事でも大きな問題になった。BMは損保会社を通じて持ち込まれた自動車の修理にあたり、故意に車体を傷つけるなど保険金を過大請求していた。
当時業績を急拡大していたBMは各損保の代理店業務を兼ね、車の購入者（所有者）が加入を義務付けられる自賠責保険の配分や新規店舗における担当損保会社（テリトリー）の決定権を背景として、自動車修理業務をBM工場に優先的に回すよう各損保に要求。対BMの取引で損保中最大のシェアを有していた損保ジャパンは40人を超える従業員をBMに出向させるなど、もたれ合いの構図が問題視された。
■市場寡占化で「顧客軽視」
損害保険会社の不祥事で浮き彫りになった「なれ合いの構図」は、損保と保険代理店の間だけでなく、損保大手同士でも見られた。
令和５年以降、企業向け保険料の事前調整や保険代理店を通じた他社の顧客情報の不正取得を指弾され、大手４社が相次ぎ行政処分を受けた。不正の背景として指摘されたのは、４社による市場の寡占化が進み、健全な競争を避けるようになっていた可能性だ。
人口減による主力事業の自動車保険の国内での縮小傾向や、災害の激甚化による保険金支払い増加で収益環境が厳しく、シェア維持に必死だったのではとの見方もある。
不祥事に共通するのは「顧客重視」の視点が抜け落ちていた点だ。
各社は改革に乗り出しており、ＭＳ＆ＡＤホールディングス傘下である三井住友海上火災保険とあいおいニッセイ同和損害保険は９年４月に合併する計画。だが、安定した経営基盤を顧客本位の商品開発に振り向けられるか、厳しい目にさらされることになる。
また、サイバー攻撃、気候変動など対応しなければならないリスクが増える中、「ただでさえ仕組みがわかりづらい」（業界関係者）損保の商品はさらに多様化・複雑化する可能性がある。
信頼できる損保会社を見極めつつ、各社の保険料や保障内容を見比べ、真に必要な保険を選び出す〝自衛〟の知恵も消費者は求められそうだ。
■不祥事相次ぐ損保業界に厳しい目
平澤敦・中央大教授
損保リサーチに在籍していた元火災保険調査員による放火事件を受けた再調査で、大手損保は過去の案件について「問題なし」と結論づけたというが、何が問題なしなのか分からない。
保険業界は不祥事が相次ぎ、厳しい目が向けられている。本件でも、保険金の支払いプロセスを公表できない何らかの理由があるのであれば、保険会社や事故調査の信頼性を著しく損なうことになるだろう。
損保リサーチの対応にも疑問を覚える。今回の一連の事件は損害保険を詐欺的に利用した看過してはならないもの。それなのにリサーチは、これまで自発的になんら本件について触れることをしていない。せめて（元社員が起こした事件として）自社のホームページで周知すべきではないか。
（倉持亮、山口暢彦）",[],[]
フードロス削減で「循環経済」を　滝川クリステルさんら大阪万博会場で体験施設をアピール（産経新聞）,https://news.yahoo.co.jp/articles/a1146b3b600c796d46cb5c4dd53c099007116a35,https://newsatcl-pctr.c.yimg.jp/t/amd-img/20250922-00000142-san-000-1-view.jpg?exp=10800,2025-09-22T18:58:35+09:00,2025-09-22T18:58:35+09:00,産経新聞,san,産経新聞,614,"大阪・万博会場で始まる「サーキュラーエコノミー研究所」の記者発表会に出演した滝川クリステルさん（中央）と滝沢秀一さん（右）ら＝大阪市此花区
資源を再利用して有効活用する循環経済（サーキュラーエコノミー）を体感するイベントが23～29日に、大阪・関西万博で開かれる。買い物など日常の場面でサーキュラーエコノミーを学べ、年齢層を問わず楽しめる内容になっているという。

「サーキュラーエコノミー研究所」と名付けて開催。会場では、人気漫画「科学漫画サバイバルシリーズ」のキャラクターたちが「買う」「使う」「分ける」「まわす」の4つの場面で実践されているサーキュラーエコノミーを紹介する。リサイクル素材を使った商品を選ぶ、古着をアップサイクルして活用するなどの例とともに、取り組んでいる企業や団体などを紹介している。計88の企業や団体が出展する。

22日の記者発表会では、フリーアナウンサーの滝川クリステルさんとお笑いコンビ「マシンガンズ」の滝沢秀一さんがゲスト出演。滝川さんが「フードロスを減らすなどごみを減らすことを心がけている」と話すと、ごみ収集会社で働く経験を持つ滝沢さんは「ごみと資源を分別するのが最も大切」などと資源の活用法について語っていた。

今月12日には大阪市内で国や自治体、企業の関係者らが集まり「第1回資源循環自治体フォーラム」を開催。サーキュラーエコノミーの実現に向けてそれぞれの果たす役割などを話し合った。",[],[]
イスラエル首相はトランプ氏と対応協議　英などのパレスチナ国家承認、現地では評価割れる（産経新聞）,https://news.yahoo.co.jp/articles/7d38d963358f8ef988edb91e011165470e1b03bb,https://newsatcl-pctr.c.yimg.jp/t/amd-img/default.jpg?exp=10800,2025-09-22T18:57:19+09:00,2025-09-22T18:57:19+09:00,産経新聞,san,産経新聞,931,"【エルサレム＝佐藤貴生】英国など先進7カ国（G7）を含む国々が相次いでパレスチナ国家を承認したのを受け、イスラエルのネタニヤフ首相は21日に発表した声明で、「パレスチナ国家は将来も存在しない」と強く反発する一方、今月下旬の訪米終了後に対抗策を講じると述べた。後ろ盾であるトランプ米大統領と会談し、方針を決める意向とみられる。

英などの国家承認を巡り、ユダヤ人とパレスチナ人の評価は割れた。エルサレム市街の広場で会ったユダヤ人の男性（43）は21日、「とてもひどい判断だ。イスラエルに対する（イスラム原理主義組織）ハマスの2年前の残酷な攻撃を忘れてしまったのか」とまくしたてた。

一方、ハマスを標的にイスラエル軍が攻撃を続けるパレスチナ自治区ガザの男性（46）は産経新聞のSNSを通じた取材に、「（英国などによる国家承認の）決定がなんらかの形で攻撃停止につながるよう願っている。周囲では『承認の判断は遅かったが、しないよりはましだ』という意見が多い」と述べた。

ただ、パレスチナ側の反応は一様ではない。21日にヨルダン川西岸地区のパレスチナ自治区ラマラで会った運転手の男性（42）は、「国家承認は喜ばしいが、イスラエルの報復が怖い。怒って西岸の併合を宣言するかもしれない」と危機感を隠さなかった。

イスラエル有力紙ハーレツ（電子版）によると、ネタニヤフ連立政権に加わる極右政党のベングビール国家治安相やスモトリッチ財務相は早速、西岸の併合を主張。スモトリッチ氏はイスラエル建国前の英国によるパレスチナ委任統治に触れ、「英国などが私たちの未来を決める日々は終わった」と述べ、対抗する姿勢をあらわにした。

ニュースサイト「タイムズ・オブ・イスラエル」によると、ネタニヤフ氏は国連総会で一般討論演説を行うために訪米し、29日にもトランプ氏と首脳会談を行う。

トランプ政権はパレスチナ国家承認について、実効性がないと否定的な考えを示しているが、西岸併合の是非などは明確に表明していないもようで、ネタニヤフ氏は米側の意思を確認して方向性を決めるとみられる。ネタニヤフ氏としては拙速な決定を避け、トランプ政権との間に太いパイプがあることを誇示する狙いもあるようだ。",[],[]
