headline,mainEntityOfPage,image,datePublished,dateModified,author,media_en,media_jp,str_count,body,images,external_links
北海道北斗市の道南ラルズ「ほたて松前漬けにぎり飯」、お弁当・お総菜大賞で優秀賞（函館新聞デジタル）,https://news.yahoo.co.jp/articles/9b7733968e0c620a3c3ba51bf8bb71090aedb6d4,https://newsatcl-pctr.c.yimg.jp/t/amd-img/20250115-00000002-hakoshin-000-1-view.jpg?exp=10800,2025-01-15T10:08:32+09:00,2025-01-15T10:08:32+09:00,函館新聞デジタル,hakoshin,函館新聞デジタル,752,"お弁当・お総菜大賞で入賞した３商品
食品スーパーの道南ラルズ（北斗市追分3、今野伸社長）が販売するほたて松前漬けにぎり飯（税込み268円）が、今年度の「お弁当・お総菜大賞」（全国スーパーマーケット協会主催）のおにぎり部門で優秀賞に輝いた。
同大賞は一定期間内に販売した実績がある商品に限りエントリーが可能で、今回は2023年10月1日から24年9月20日までが対象。「スーパーマーケット」と「専門店・CVS（コンビニエンスストア）他」の業態別に分かれ、弁当や総菜、サラダ、パン、スイーツなど11部門について、一次（書類）審査や最終（実食）審査を行い、おいしさやテーマ、見た目やオリジナリティ―などを審査した。

 　同協会によると、今年は約1万5000点のエントリーがあり、その中から最優秀賞（11部門・2業態ごとに1商品）、優秀賞（同3商品）、特別賞、入選を決定。道南ラルズは今回、おにぎり部門での優秀賞1品に加え、総菜部門で「3種昆布だし玉子焼＆もろみ醤チキン」（同430円）、パン部門で「お赤パン」（同171円）の2品が入選に選ばれた。

 　ほたて松前漬けにぎり飯は、人気商品の一つである生珍味のホタテ入り松前漬けを使用。ホタテやスルメイカ、マコンブ、ガゴメコンブ、カズノコといった海産物をぜいたくに使った一品で、さらにホタテを1個トッピングし、味だけでなく手軽さや見た目にもこだわった。

 　同社商品部水産バイヤーの林翔太さんは「受賞はとても喜ばしく、また今後に向け励みになる。おいしいを大前提に、新たな商品開発を目指していきたい」とし、さらなる新商品の開発に向け「地元食材を使った商品を拡大したいと考えており、ぜひ意見やアドバイスなど、お声がけいただきたい」と話している。
函館新聞デジタル",[],[]
エバー航空が約5年ぶり運航　函館に春節に合わせチャーター便（函館新聞デジタル）,https://news.yahoo.co.jp/articles/4af6c4ee7f409a029279bdc129ae2cd31184076e,https://newsatcl-pctr.c.yimg.jp/t/amd-img/20250115-00000001-hakoshin-000-1-view.jpg?exp=10800,2025-01-15T10:04:44+09:00,2025-01-15T10:04:44+09:00,函館新聞デジタル,hakoshin,函館新聞デジタル,925,"約５年ぶりに函館空港に到着したエバー航空の航空機（１４日午後１時４５分ごろ、山崎純一撮影）
台湾の航空会社・エバー航空は14日、函館―台北（桃園）でのチャーター便の運航を開始した。新型コロナウイルスの影響を受け2020年3月から定期便を運休していたが、台湾の旧正月（春節）に合わせ約5年ぶりに実現。函館空港国際線到着ロビーでは、市職員や観光関係者ら約20人が歓迎横断幕を手に乗客を出迎えた。
箱館会メンバーらの出迎えを受けた乗客（１４日午後２時半ごろ、山崎純一撮影）
チャーター便の運航スケジュールは18、22、26、30日、2月3日の合計6往復で、所要時間は約3時間半～4時間半。市は路線再開のため、23年度に大泉潤市長によるトップセールスを行ったほか、今年度も同社日本支店との調整を継続していた。
続々と降りてきた乗客で混雑した函館空港国際線到着口（１４日午後２時３５分ごろ、山崎純一撮影）
午後1時40分ごろ、台北発174人が搭乗したエアバス社のA321―200（184席）が到着すると、関係者は到着ロビーで乗客を歓迎。法被を身にまとった市職員は手ぬぐいや温泉のもと、パンフレットなどのセットを手渡し地域の魅力をアピールした。市港湾空港振興課は「函館のインバウンドの主力である台湾人観光客数は、まだピーク時には戻っていない。多くの人に地域の冬観光を楽しんでもらうとともに、定期便の再開を目指したい」としている。
また、道南の観光関連事業者でつくる「箱館会」のメンバーは、中国語で「函館へようこそ」とメッセージを伝える横断幕を用意。函館観光イメージキャラクターの「エキゾーくん」も駆け付け、記念撮影に応じていた。同会はクルーズ船が函館港に入港した際なども利用客をもてなす活動を続けており、渡部十月哉幹事長は「観光客の満足度を高め、リピーターにつながれば」と期待を込めた。

 　乗客の多くは大型のスーツケースを手に大型バスに乗り込み、市内や札幌方面に向かった。家族4人で訪れた製造業の陳重銘（ベン・チェン）さん（42）は「函館に来るのは2度目。金森赤レンガ倉庫や朝市、五稜郭を観光する予定で、札幌や小樽にも行く」と笑顔を見せた。
函館新聞デジタル",[],[]
