headline,mainEntityOfPage,image,datePublished,dateModified,author,media_en,media_jp,str_count,body,images,external_links
名古屋・大須の老舗が語る60s＆70sの世界 — 古着店「the other（ジ・アザー）」31年の軌跡（fashion tech news）,https://news.yahoo.co.jp/articles/77916ae1688cb589096e746902c60064cc50e0aa,https://newsatcl-pctr.c.yimg.jp/t/amd-img/20250507-00010001-fashiontn-000-1-view.jpg?exp=10800,2025-05-07T16:10:03+09:00,2025-05-07T16:10:03+09:00,fashion tech news,fashiontn,FASHION TECH NEWS,2844,"画像提供：the other
全国各地の古着エリアのなかでも、名古屋・大須は個性豊かな古着屋が集う。そのなかでも、大須に詳しい人ならば、「the other（ジ・アザー）」のお店を知っている人は多いだろう。

ジ・アザーは、「60s＆70sファッション、音楽、サブカルチャーのトータルショップ」のテーマを掲げて大須にオープンし、古着屋という枠を超え、音楽レーベルまで立ち上げた異色な経歴を持つお店だ。

SNSでも人気のジ・アザーは、大須の街でどのような歴史を刻んできたのだろうか？ 今回は同店の店長である鈴木さんにお話を伺った。
1994年にオープンした、60s＆70sファッションの専門店
画像提供：the other
ジ・アザーは、レコードショップの2階からスタートし、大須商店街で2号店・3号店を経て、現在に至る。どのような経緯で、ジ・アザーのお店をオープンすることになったのだろうか。

「当時は、60年代、70年代をコンセプトにしたお店はまだなかったんです。自分も若い頃は、60年代のモッズファッションのシーンにいたので、専門的なお店を作りたいと思ってお店を始めました。

最初から、お店をやるのなら絶対に大須でやりたいと思っていましたね」

その後、さまざまな理由で移転しつつ、それでも大須の場所にこだわるのには、この街にしかない雰囲気と「昭和」の香りが残っているからだという。
画像提供：the other
「自分が60年代ファッションに興味を持ったときに、昔の商店街にあったような紳士服屋や婦人服屋などに服を探しに行っていました。

今では観光地化されていますが、90年代の大須はまだ昭和の香りが残っている雰囲気でしたね。おじいちゃんやおばあちゃんしかいないような、寂れた商店街でしたが、その分、デッドストックの掘り出し物もいっぱいありました。

90年代の大須は栄とは違う雰囲気で、古着好きが集まる個性的な人が多い街でした」

オープン当初から、名古屋初の60s＆70sファッションの専門店として話題になり、かつての2号店では、古着以外にも超貴重なレコード盤や書籍も扱っていたため、コレクターやDJの間でも話題になった。

全国各地の60s＆70sのファッション好きやコレクターが集うこともあり、一見すると敷居が高い印象があるが、ジ・アザーを訪れる年齢層は非常に幅広い。
「今年の3月でオープン31周年になりました。

オープンから来ていただいているお客様もいますし、子育てなどで一時的に古着を離れていた方や若い世代も遊びに来てくれるので、お店の購入層は、ぐちゃぐちゃな感じですね（笑）。10代の若者からおばあちゃんまで遊びに来てくれます」

オーナー鈴木さんが培ってきたカルチャーと経験が詰まった店内ジ・アザーはコンセプト通り「60s＆70sファッション、音楽、サブカルチャーのトータルショップ」として、ファッションだけでなくカルチャーも提供してきた。

特に「音楽」はジ・アザーにとって欠かせない要素のひとつだ。オープン当初から数多くのライブ＆DJイベントを主催し、常に名古屋の60s＆70sシーンを牽引するショップとして活動を続けてきた。

「お店をやる前からバンドやDJをやっていたので、お店ができてからは企画イベントを始め、さらに人が増えていきましたね。一時期は『ジ・アザーレコード』というレーベルまで立ち上げました。

60s＆70sバンドも全国から呼んで規模が大きくなっていきましたが、ジ・アザー11周年記念の『アングラポップ』というイベントを最後に落ち着きました。現在は古着に特化していますが、今でもイベントに呼ばれるとたまにDJもしています」
DJイベント時の鈴木さん。60s＆70sカルチャーに精通している鈴木さんは、オーナー以外にも様々な顔を持つ
また、鈴木さんが個人で運営しているXアカウント『昭和元禄アングラポップ』も人気だ。昭和レトロのファッションを鈴木さんのシンプルな言葉で紹介し、フォロワーから熱い支持を得ている。

鈴木さんのXでジ・アザーを知り、60s＆70sファッションに興味を持った人も多いだろうが、Xでの大きな反響に対しては意外な言葉が返ってきた。

「Xに投稿している写真は、すべて私物の雑誌からです。最近はインスタグラムがメインで、ストーリーに好きな音楽を流したりして楽しんでいます」

ジ・アザーが提供する60s＆70sのヴィンテージは海外のものだけでなく、日本の昭和レトロも取り扱っている。一見、互いに雰囲気が異なるように思えるが、ジ・アザーでは、それぞれが見事に調和しているのが不思議だ。

昭和レトロを取り扱うにも、鈴木さんのこだわりがあるという。
画像提供：the other
「最初はブリティッシュばかりを掘っていましたが、日本の60年代、70年代も実はとてもクールだったんですよね。そのシーンをよく見ると、宇野亞喜良や岡本忠成、寺山修司、山本寛斎、コシノジュンコがいます。

ファッションだけでなく、そのような文学的な背景も知るようになってから、日本の昭和レトロも見直して掘り下げるようになりました」
60s＆70sのカルチャーを肌で感じるお店として
画像提供：the other
現在のジ・アザーの店舗は、赤と黒のコントラストが印象的な店内が特徴だ。60s＆70sのモッズスタイルをはじめ、サイケデリック、ヒッピーなどディテールに凝ったデザインの服が揃い、オリジナルワンピースも販売している。
画像提供：the other
「60s＆70sファッションもトレンドとして度々注目されますが、今後も変わらずジ・アザーならではのヴィンテージ・ファッションを提供していきたいと思います。

日常のライフスタイルに取り入れて、60s＆70sファッションを楽しんでいただけたらうれしいです」
1994年にスタートし、今年で31周年を迎えたジ・アザー。オープン当初からさまざまな活動を経て、これからも年代を問わず多様なお客さんと楽しみながらお店を続けていきたいという。

「今のお店はサロンのように、ゆっくりとお客さんと話せる雰囲気が楽しいですね。常連のお客さんはもちろん、新しいお客さんも気軽に遊びに来てほしいです」

長年、大須で60s＆70sファッションシーンとカルチャーを牽引してきたジ・アザーには、全国各地からお客さんが訪れる。それは、ファッションだけでなく、鈴木さんの人柄や、その時代のカルチャーを肌で感じられるからだろう。

ファッションと音楽、60s＆70sの豊かなカルチャーが融合したジ・アザーは、31年の歴史を超えて、今なお色褪せない時代の魅力を発信し続けている。大須の街に根付いたこの老舗は、単なる古着店ではなく、カルチャーの継承者として、これからも新たな世代に時代を超えた刺激を届け続けるだろう。",[],[]
YKKとの開発で実現した画期的な止水ファスナー：ファイントラックが辿り着いたレインウエアの最高到達点（fashion tech news）,https://news.yahoo.co.jp/articles/358b050b9dbfac35f644eab0d109d3788d8ff9a5,https://newsatcl-pctr.c.yimg.jp/t/amd-img/20250507-00010000-fashiontn-000-1-view.jpg?exp=10800,2025-05-07T08:10:03+09:00,2025-05-07T08:10:03+09:00,fashion tech news,fashiontn,FASHION TECH NEWS,3545,"画像提供：株式会社finetrack
「finetrack（ファイントラック）」は、2004年に大手アウトドアメーカーで企画開発を手がけた金山洋太郎氏が設立したアウトドアブランドだ。

「流行にとらわれず、命を守る機能性を優先するギア」をモットーに掲げ、ジャパンメイドにこだわったモノ作りを続けている本ブランドは、本物志向のアウトドアマンたちから高い支持を獲得している。

そんなファイントラックの実力を世に知らしめたレインウエアの名作「EVERBREATH PHOTON（エバーブレスフォトン）」が8年ぶりにリニューアルされた。

誕生から今回の改良までこのアイテムを知り尽くした商品企画担当者が、生まれ変わったエバーブレスフォトンを語り尽くす。
独自の防水透湿素材・エバーブレスを使ったレインウエア
「エバーブレスフォトン」 38,500円（税込）
ーエバーブレスフォトンが誕生した経緯を教えてください。
2012年にこのモデルの初代となる「エバーブレスフォトンスーツ」をリリースしました。

その頃はまだストレッチ生地を使ったアウトドア用のレインウエアはほとんどなく、動きにくかったり、シルエットが太かったりするものばかりで、「雨をしのぐために我慢して着る服」でした。

そこで私たちは、ストレッチ生地を使って、動きやすくて着心地がよく、かつシルエットも美しいレインウエアを作ることにしたのです。
画像提供：株式会社finetrack
ストレッチ性のほかに「機能の耐久性」にも力を入れています。これは、耐水圧が保たれるだけでなく、雨のなか長時間着用し続けても透湿性が保たれることを意味します。

この「優れたストレッチ性」と「機能の耐久性」は当初からのエバーブレスフォトンの設計思想で、新モデルにも引き継がれています。

ーメインの素材は何ですか？

「EVERBREATH（エバーブレス）」という独自に開発した防水透湿素材です。優れたストレッチ性が特徴で、現行品だとタテ向きに約107％、ヨコ向きに約117％伸縮する生地を採用しています。

とはいえ、ただ生地が伸び縮みするだけでは完璧な快適性は実現できません。特に雨の降るフィールドで快適さを感じるためには耐水性とぬれても持続する透湿性が不可欠です。
画像提供：株式会社finetrack
ーたしかに雨を防げても、汗で体がぬれてしまったら意味がありません。

雨が降る登山時、動作によって起こる瞬間的な圧力に対応するには、10,000mm以上の耐水圧が必要とされています。

そこで20,000mm以上の耐水圧と透湿性能を長期にわたって維持できる生地を設計しました。
画像提供：株式会社finetrack
ーどうやって高い機能の耐久性を実現しているんですか？

表側のストレッチ生地と裏側のニット生地の両面に耐久はっ水加工を施しています。

防水性や透湿性の優秀さだけでなく、機能が長続きすることにこだわることで、初めて過酷なフィールドでも長時間快適に過ごせるレインウエアになるんです。
耐水圧保持率が高いことが特徴
ー耐水性はどれくらい持続するんですか？

具体的な持続時間に関しては、環境や使用方法によっても異なるため、検証はしていません。

ですが、今回リニューアルしたエバーブレスフォトンでは、耐水圧保持率測定試験によって、約2万回のストレッチ試験、約3万回の摩耗試験の後も防水性が持続することが証明されています。

また、生地の素材に加水分解しにくいポリカーボネート系ポリウレタンを使っている点もハードユースに役立ちます。
画像提供：株式会社finetrack
ー細部も作り込まれていますね。

フードはヘルメット着用時も、未着用時も頭にフィットする形状になっており、後方からの音が聞こえやすい音抜き穴も装備しています。
画像提供：株式会社finetrack
リンクベントと呼ばれる両サイドの大型ベンチレーションは、ミッドレイヤーなどと共通の位置に設けることで、効率的な換気が可能です。これらはファーストモデルからの共通のディテールです。
YKKと開発した新しい止水ファスナーの実力は？
画像提供：株式会社finetrack
ー8年ぶり4度目のリニューアルとのこと。新型はどこが進化したんですか？

一番大きな変更点はファスナーです。ファイントラックは、世界的なファスナーのリーディングカンパニーであるYKKの「AquaGuard® Tightened（アクアガード タイトゥンド）」という新しいファスナーの開発に協力しました。
ー従来の止水ファスナーとどこが違うんですか？

止水ファスナーとは、ファスナーテープの表面がポリウレタンフィルムでラミネートされたもの。ファスナーを閉めるとテープが密着して、細かい隙間から水が浸入しにくくなるようになっています。

軽くコンパクトな構造ですが、フラップなしで降雨に耐える耐水性は実はありません。
画像提供：株式会社finetrack
ー従来の止水ファスナーの欠点を克服したんですね。

AquaGuard® Tightenedの場合は、左右のファスナーテープが密着し、押し合うことでM字のふくらみが生まれます。この構造によって、雨水の浸入を大幅に軽減することができます。
止水ファスナーは左右のファスナーテープが“線”で密着するのに対し、AquaGuard® Tightenedは“面”で密着するため、従来の止水ファスナーよりも格段に耐水性が高まります。

また、ファスナー単体での耐水圧が高いため、浸水をカバーするフラップという当て布も省略できました。その結果、ファスナーがフラップを噛むというトラブルがなくなり、また、ファスナー周りの簡素化によって、すっきりとしたシルエットを実現できました。
冷蔵庫のパッキンがヒントになった画期的な構造
ーどのようにして開発がスタートしたんですか？

2018年頃からYKKにリクエストをしていて、本格的に開発が始動したのは2020年です。それまでにも防水性の高いファスナーは存在していましたが、形状が大きく、一般的なアパレルには使用することが難しいものしかありませんでした。
画像提供：株式会社finetrack
私たちが求めていたのは、サイズや重量は従来の止水ファスナーくらいで、フラップなしでも高い耐水性を発揮するファスナーでした。

この左右のテープが密着するという構造はYKKの開発担当者が試行錯誤を重ね、冷蔵庫のパッキンをヒントに思いついたものです。
ー完成までにかなりの時間がかかっていますね。

2022年に初代プロトタイプが完成し、その後、フィールド試験やフィードバックに協力しながら、ようやく今年、製品化にこぎつけました。

もっとも苦心したのは、ファスナーの摺動性（しゅうどうせい）でした。これは素材の摩擦の少なさや滑りやすさを表すもので、頻繁に開閉を行うファスナーにとっては重要な性能です。
今季は5種類のカラーを展開
耐水性を上げると摺動性が下がり、反対に摺動性を重視すると耐水性が犠牲になってしまう。そのバランスを調整するために、YKKの開発担当者は試作を、私たちはフィールドでのテストを何度も繰り返しました。
画像提供：株式会社finetrack
ー他に改良した点はありますか？

生地自体の設計も見直し、新しい技術を盛り込みました。
まず、ハードに使っても耐水圧を持続できるよう糸使いや組織、裏地のニット生地を変更しました。

こうすることで、ストレッチの持続性や生地の耐摩擦性、汗や皮脂汚れによる防水透湿膜へのダメージに対する耐久性が向上しました。

質感もこれまでとはひと味違うマットな仕上がりに。落ち着いた発色を生かしたカラー展開も可能になりました。
ーリニューアルによって、レインウエアとしての完成度がいっそう高まりましたね。

「レインウエアの使命とは何か？」をファイントラックは考え続けてきました。

雨をしのぐだけでは、十分ではありません。自然の中で安全に行動し、無事に帰ってくることをサポートする。そのうえでユーザーに快適さをもたらすこと。これがエバーブレスフォトンの使命です。

YKKと開発したAquaGuard® Tightenedが持つ意味も大きく、この新型ファスナーの登場によって、今後、レインウエアはよりシンプルかつ軽量な構造になり、デザインの幅も広がっていくでしょう。


生まれ変わったエバーブレスフォトンは、レインウエアの新しいセオリーとなるポテンシャルを秘めている。",[],[]
