headline,mainEntityOfPage,image,datePublished,dateModified,author,media_en,media_jp,str_count,body,images,external_links
資産3億の敏腕投資家「パチンコで稼いだ1000万円を全て東電株に」昇進話を蹴って専業投資家の道へ（みんかぶマガジン）,https://news.yahoo.co.jp/articles/857f5c9df5844e6f5d2bc038e23f7ee6562ebcad,https://newsatcl-pctr.c.yimg.jp/t/amd-img/20241208-00010004-minkabu-000-1-view.jpg?exp=10800,2024-12-08T17:10:10+09:00,2024-12-08T17:10:10+09:00,みんかぶマガジン,minkabu,みんかぶマガジン,1447,"(c) Adobe Stock 1,000万円の軍資金を元手に、資産を約3億円まで増やした某哲也さん（X：@19830128to）。勝ち続けるためのルールはとてもシンプルに定めているという。全3回にわたって送るインタビューの第1回では、いかにして成功を収めたのか。失敗から学んだ勝ち筋、そして現在の「投資マイルール」について話を聞いた。 【動画】元三菱サラリーマンが7000万円でFIREするために守った投資のルール…2024年末・2025年始の注目投資セクター・銘柄も大暴露 東日本大震災がきっかけで東京電力の株価に興味 ーーまずは投資家になる前はどんな仕事をされていたのか教えてください。 新卒で製造業の会社に就職し、経理課に配属されました。サラリーマンとして8年働いた後、専業投資家に転身。それから約12年が経ちました。 ーー投資に出会ったきっかけというのは？ 2011年の東日本大震災で東京電力の株価が10分の1に落ちたニュースを見たのがきっかけです。大変なことが起きているとはいえ、「電力会社は潰れない」と考えていたので、「今買えば将来株価が10倍になるかもしれない」と思いました。単純に「1,000万円を入れたら1億になる」と、当時の私は計算していたのです。 そして、東京電力について調べてみると、業績が安定している上、配当が2～3％あることが分かりました。普通のサラリーマンが退職金を受け取って買うような筆頭銘柄として挙がっていたほど優良と言われていたのです。当時の暴落はその人たちにとっても悲劇だったのではないかと思います……。 ーー東電との出会いが投資家人生の始まりだったというわけですね。その前は投資に興味はなかったのですか？ 学生時代にマクドナルドでバイトをしていたので、優待で食事をする人を見ていました。そのため、「株式優待」には馴染みがありました。当時それを羨ましく思っていたのを覚えています。とはいえ、学生時代に投資をやってみようという気にはならず、東電との出会いが私を突き動かしました。 パチンコで稼いだ1,000万円をもとに投資 ーー軍資金はいくらぐらい用意されましたか？ 1,000万円です。実は、働きながらパチンコを仕事として打っていました。本業の給料とは別に、パチンコだけで3年間で1,000万円ほど稼いでいたので、最悪その1,000万円がなくなったとしても生きていける状況でした。 ーー株で成功した人でプロとしてパチンコを打っていたという人は意外と多いですよね。 そうなんです。会社員としての顔で出会う人のなかにパチンコをプロでやっている人は一切いなかったのですが、いざ投資の世界に飛び込んでみると私は珍しい存在ではありませんでした。 1,000万円全てを東電に投資…その結果は ーーところで、まさか1,000万円すべてを東電に投資していませんよね……？ そのまさかです。東電に出会ったばかりの頃は、右も左も分からない超初心者。1,000万円を東電に突っ込み、毎日の株価変動が気になって仕方がなくなりました。 2011年の東電はデイトレーダーが売買する銘柄に選ばれるなど、ボラティリティがとても激しい銘柄。自分の損益画面の更新ボタンを押すたびに何万円～何十万円というお金が増減しました。その光景を見続けると心が持たないと思ったので、初めての投資は数週間で撤退。幸い大きな損は出さなかったのですが、投資の基本というものをちゃんと学ぼうと思いました。 某哲也",[],[]
2025年、1ドル170円時代に！日経平均は…配当650万投資家が断言「日米金融政策はこれを絶対チェックしなさい」（みんかぶマガジン）,https://news.yahoo.co.jp/articles/33564ca68b20c97cb089aaa6dc0a2f5f710a6725,https://newsatcl-pctr.c.yimg.jp/t/amd-img/20241208-00010003-minkabu-000-1-view.jpg?exp=10800,2024-12-08T12:10:02+09:00,2024-12-08T12:10:02+09:00,みんかぶマガジン,minkabu,みんかぶマガジン,1100,(c) Adobe Stock 米大統領選が終わり、トランプ前大統領がふたたび就任したことでNYダウやビットコインは市場最高値を更新し、さらに勢いが増している。 一方で、日本では米国との関係に対する不安の声が上がっており、日本株の弱含みな動きにも影響を与えていると言える。では、これから取るべき投資戦略とは？ 高配当株と株主優待株運用のエキスパート・ペリカン氏（X：@Pelican_Blog）に、日米の金融政策で注目すべきトピックについて話を伺った。短期連載全2回の第2回。 米国経済のリセッションはそれほど気にするな ーーちなみに、米国では2025年から2026年にかけてリセッションが発生すると言われていますが、その影響は日本株にも大きな影響を与えるのではないでしょうか。 個人的には、米国経済のリセッションは予想されているほど深刻にはならないのではないかと考えています。昔の米国経済は製造業が中心でしたが、前述のとおり、現在はインターネットを含むサービス業が牽引しています。たしかにインフレによって影響を受ける業種もありますが、昔のように単純なリセッションに陥る経済構造ではないと見ています。 例えば、かつてはフォード・モーター（F）やゼネラルモーターズ（GM）などの企業業績が悪化するとリセッションに突入する状況でしたが、現在はGAFAM（アルファベット、アマゾン、メタ、アップル、マイクロソフト）といった大手企業が市場をリードしています。米国経済のリセッションに関連する点では、現在の中国経済がその役割を果たしているかもしれません。 一方で、トランプ新大統領が就任後、中国への規制を強化する可能性があります。これにより安価な商品が米国に入らなくなり、インフレが進行して金利が高止まりするリスクがあります。その結果、資金が株式市場から債券市場に移動したり、住宅購入が難しくなる事態が予想されます。 外部要因を無視して、業績のよい銘柄をガチホ ーーそんなトランプ氏は経済活動を活発にしようとしながらも、FRBに利下げを求めるという矛盾した行動を取っていますが、ドル円市場はどのように推移するとお考えですか？ この点については理屈では割り切れません。今後も為替以外で矛盾が発生するでしょうから、投資家は短期的な変動に一喜一憂せず、長期的視点を持つべきでしょう。短期的な動きに乗ってしまうと、予想外の損失を被る可能性がありますから。 基本的なことですが、業績が良好な銘柄を安価に購入するという株式投資の基本を守ることが大切かと。外部要因をあまり考慮せずに、正しい投資判断をするよう心掛けましょう。,[],[]
なぜ？24年は日経紙面に「ROE」が頻出！同紙編集委員「企業の資本コストに注目高まった」今年よりも更に多かった年は…（みんかぶマガジン）,https://news.yahoo.co.jp/articles/fa0b685ac2202bd8b2026e660380498976c701c2,https://newsatcl-pctr.c.yimg.jp/t/amd-img/20241208-00010002-minkabu-000-1-view.jpg?exp=10800,2024-12-08T09:10:18+09:00,2024-12-08T09:10:18+09:00,みんかぶマガジン,minkabu,みんかぶマガジン,1108,(c) Adobe Stock 「今さら聞けない」というくらい重要な指標となった「ROE（自己資本利益率）」。ROEが高いほど、自己資本を活用して利益を生み出せているということになるため、経営効率が良く、投資価値が高いと考えられる。いまやビジネスパーソンにとって必須の知識とも言っていいだろう。そんなROEについて、日経新聞の編集委員である小平龍四郎氏がくわしく解説。年々経済紙面からROEの登場回数が減っていることについては、「日本の資本コストへの意識が低下していることと同義」と語るーー。 ROEを高めるためには分子（利益）を大きくするか、分母（資本）を小さくするかの2通りある 株式市場の日本企業は本当に進歩がない。同じ課題を抱えて、1カ所をぐるぐる回っている。そんな思いを禁じえない事例がある。ROE、Return on Equity。日本語では「自己資本利益率」とか「株主資本利益率」と訳されることが多い。分子が利益、分母が資本。つまり、株主が企業に払い込んだお金をどの程度有効に活用して利益をあげているかという指標だ。 ROEが高いほど株主のためにリターンを上げていることになり、株式市場の評価が高まり、株価が上昇しやすい。もちろん、逆も真なり。どうして日本の株価は米国のように力強く上がらないのかという理由の定説として指摘されるのもROEだ。 ROE低下は株価の低迷に直結する ざっくりいって、日本企業は10％弱、米国は約20％。およそ2倍の開きがあるのだから、株価も格差がついて当然といえば当然だ。ROEを上げようという声が日本になかったわけではない。むしろ逆。ROEの重要性は長年にわたってくり返し指摘されるところだった。 例えば、日本の株式市場の歴史を学ぶための基本図書ともいえる「日本証券史3」（内田茂男著、日経文庫、1995年）では、しめくくりの「市場再生のキーワード」として、ROEをまっさきに挙げている。 「企業の経営指標としてアメリカでもっとも一般的なこの指標は、80年代までは（日本で）ほとんど注目されなかった。最大の理由は、総資産に占める株主資本の比重が低かったことであろう。しかも、株式投資の採算を企業の収益力で図る習慣もなかった。右肩上がりで株価が上昇していのだから当然ともいえよう」 内田はこう指摘したうえで、80年代後半に企業が積極的に実施したエクイティファイナンスにより株主資本の比重が上がる一方、事業投資の収益率は下がり、ROEの急低下を招いたと総括する。バブル期に日本市場に注目した外国人投資家は米国と同じ物差しで企業を評価したため、ROE低下は株価の低迷に直結した。,[],[]
J2降格決定の札幌…本拠地・札幌ドームは更なる収益悪化の窮地！イベントの誘致に大苦戦、プロ野球もOP戦ゼロ、SNS上には無責任「解体論」（みんかぶマガジン）,https://news.yahoo.co.jp/articles/30524d03e217f1f54d8deb73c3cff90d06c72c05,https://newsatcl-pctr.c.yimg.jp/t/amd-img/20241208-00010001-minkabu-000-1-view.jpg?exp=10800,2024-12-08T09:10:10+09:00,2024-12-08T09:10:10+09:00,みんかぶマガジン,minkabu,みんかぶマガジン,948,(c) Adobe Stock 北海道日本ハムファイターズの元本拠地・大和ハウスプレミストドーム（旧札幌ドーム）がイベント誘致に苦戦しているという。さらに、北海道コンサドーレ札幌のJ2降格が決まり、暗雲が立ち込めているプレミストドームの今後はどうなるのか。SNS上には無責任にも解体を主張する声もあがっているが……。ライターの小林英介氏がレポートするーー。 コンサドーレ札幌の降格が決定 悲しい結末だった。明治安田生命J1リーグ第37節の柏レイソル対ヴィッセル神戸戦が11月30日、三協フロンテア柏スタジアムで開かれ、結果は1対1のドローだった。この瞬間、J1の19位にいる北海道コンサドーレ札幌は降格圏となる18位以下が確定。2016年以来のJ2降格が決まった。札幌は翌日の12月1日にアウェーで広島戦（エディオンピースウイング広島）を戦う予定だったが、試合を戦わずして降格が決まってしまった。 「北海道コンサドーレ札幌を応援してくださるすべての皆様へ」。11月30日、札幌の公式ホームページが更新され、「本日の試合結果を以て、来季はJ2リーグでの戦いとなることが決定いたしました。（一部略）今年味わった悔しさを糧に、これからの険しい道のりの中で、今まで以上の大きな力をつけて国内最高峰リーグに戻って来ます」などと声明を発表した。その主は、代表取締役GMを務める三上大勝氏だった。 ミシャ監督は監督業からの退任を示唆 その翌日、降格が決まった後の試合。試合前、札幌の荒野拓馬主将はマスコミ各社の取材に答え、「勝ちきれず、苦しい今季だった。最後、（降格という）このような状況になったのは悔しい」などと悔しさをにじませた。一方、札幌のサポーターたちは、声を枯らして応援を続けた。しかし、試合は5対1と大敗した。12月1日の広島戦後、札幌の監督を務めるミハイロ・ペトロヴィッチ監督が会見で監督としての仕事を引退する可能性も示唆した。 「監督としてのキャリアを終えるかもしれない。95％（の確率）だ」 2006年の途中から来日し、1日に戦った相手でもある広島の監督を務めた「ミシャ」。2012年からは浦和レッズの監督に就任し、5年後には途中で解任されたが2018年からは札幌の監督として手腕を振るった。,[],[]
生成AI拡大で電力需要「爆増」…追い風が吹く電力会社銘柄5選を大公開！どうなる柏崎刈羽原発（みんかぶマガジン）,https://news.yahoo.co.jp/articles/41535e5a996fabd4e1b1529d85337ace5736c5fc,https://newsatcl-pctr.c.yimg.jp/t/amd-img/20241208-00010000-minkabu-000-1-view.jpg?exp=10800,2024-12-08T09:10:03+09:00,2024-12-08T09:10:03+09:00,みんかぶマガジン,minkabu,みんかぶマガジン,1803,(c) Adobe Stock 2025年は国内の原子力発電所が大きな転機を迎える年だ。福島第一原発の事故以来、稼働していなかったBWR型原発の本格的な営業稼働が始まる。AIの拡大とともに電力需要の拡大が進む中、電力会社そして原子力発電所が注目される機会も増えるのではないだろうか。2025年に注目が予想されるエネルギー銘柄として電力銘柄を取り上げる。みんかぶマガジン特集「2025年最強銘柄84」第9回「電力」ーー。 国内電力状況の転換点を迎える2025年 2025年は国内の電力状況が大きな転換点を迎えます。2011年3月の東日本大震災による福島第一原発の事故以来、国内の原子力発電所は低稼働の状態が続きました。 特に福島第一原発と同じモデルのBWR型原発は稼働が進まず、福島第一原発とは異なるPWR型の関西電力と九州電力の原発が一足先に可動が進みました。 しかし2024年11月にBWR型の東北電力の女川原発2号機、12月に中国電力の島根原発が再稼働を始めます。これにより、2025年は年初からPWR型原発に加えBWR型原発も稼働するため、電力の供給体制としては新たな1ページが始まります。 世界最大級の柏崎刈羽原発も再稼働に向けた動き 東京電力が新潟県に持つ柏崎刈羽原発は世界最大級の原子力発電所です。こちらも福島第一原発の事故以来停止中ですが、再稼働に向けた動きは徐々に始まっています。 ただし柏崎刈羽原発には、立地する新潟県の再稼働同意というハードルがあります。新潟県は東北電力の管内であり、柏崎刈羽原発が稼働せずとも不利益はほとんどないという点がネックで、地元の動意による再稼働の時期は見通せない状態です。 原発に関わる電力会社銘柄5選 2025年は国内の原発再稼働が新しい段階に入る年です。それに関わる電力会社としては以下があります。 ・関西電力（9503） ・九州電力（9508） ・東北電力（9506） ・中国電力（9504） ・東京電力ホールディングス（9501） それぞれ解説します。 関西電力（9503） 福島第一原発の事故前から原子力発電に強い関西電力は、東京電力が実質的な国有化状態にある現在、原発を持つ国内最大の民間電力会社です。高浜第1原発が初の50年超の運転が認められるなど、原発の稼働維持に向け着実に布石を打っています。原発が株式市場で注目を浴びる際に、関西電力は欠かすことのできない銘柄と言えるでしょう。 九州電力（9508） 関西電力と同様に、原発が既に稼働している電力会社です。TSMCの熊本第1工場が2024年末までに本格稼働予定であり、また他にも九州には次々と半導体工場が立ち上がっており、半導体工場による電力需要の拡大とともに収益拡大の可能性もあります。 東北電力（9506） 2024年11月にBWR型の女川原発2号機が再稼働を始めており、2025年から同原発の営業稼働が本格化。またそれとともに同社の収益改善が予想されます。BWR型原発の再稼働銘柄として最初に注目を集める可能性があります。 中国電力（9506） 2024年12月にBWR型の島根原発が再稼働を予定しています。東北電力と同様に、2025年度からの原発稼働による収益改善が予想され、注目を集める可能性があります。 東京電力ホールディングス（9501） 実質的な国有企業ながら、世界最大級の原子力発電所である柏崎刈羽原発を保有しており、原発銘柄としては真打ち的存在です。福島第一原発の事故以後、経営再建の切り札として柏崎刈羽原発の再稼働が想定されていました。同原発の再稼働は経営再建という観点のみならず、AIの普及による電力需要拡大への対応の切り札としても期待されています。新潟県の再稼働容認へのハードルは依然として高いものの、2025年に再稼働に向けた動きがあれば、改めて注目を集めるのではないでしょうか。 2025年は原発関連企業に注目 資源を持たない日本にとって、原子力発電所は核廃棄物問題があるものの、エネルギー戦略上欠かすことのできない存在です。福島第一原発と同じモデルのBWR型原発の再稼働が本格化する2025年は、国内のエネルギー状況について、福島第一原発の事故以来の大きな変化が生じる年です。2025年は特に原発を有する電力会社の業績及び株価の行方が注目されます。 石井僚一,[],[]
