headline,mainEntityOfPage,image,datePublished,dateModified,author,media_en,media_jp,str_count,body,images,external_links
明日29日は荒天のち黄砂飛来　週末は気温が急上昇　土日は関東で夏日も（tenki.jp）,https://news.yahoo.co.jp/articles/d69c6ccc1ad7cee1d12c966e7cf61dce96889ebc,https://newsatcl-pctr.c.yimg.jp/t/amd-img/20240328-00024419-tenki-000-1-view.jpg?exp=10800,2024-03-28T16:48:37+09:00,2024-03-28T16:48:37+09:00,tenki.jp,tenki,tenki.jp,1231,\n画像：tenki.jp\n明日29日にかけて全国的に「春の嵐」。暴風や大雨に警戒が必要です。天気は西から急速に回復に向かうでしょう。天気回復とともに、広範囲に黄砂が飛来する見込み。気温も急上昇し、今日28日は見送りとなった東京の桜開花発表がありそう。土日はお花見日和も急な暑さに注意を。\n明日29日にかけて「春の嵐」 暴風・大雨警戒\n画像：tenki.jp\n九州から東海まで雨のエリアが広がってきています。明日29日にかけては全国的に春の嵐に警戒してください。今夜は関東や北陸、東北も広く雨が降りだす見込みです。\n\n雨や風のピークは、九州から近畿は明日29日未明頃まで、東海や北陸、関東は今夜から明日29日朝にかけて、東北は明日29日未明から昼前にかけてとなるでしょう。北海道も明日29日日中は局地的に雨が強まりそうです。\n各地で短時間にザっと雨が強まり、東海を中心に雨量が増え、「警報級の大雨」となる恐れがあります。\nまた、雨だけでなく風も強まり、沿岸は横殴りの雨となるでしょう。朝の通勤時間帯は関東や東北で荒れた天気になる所もありそうです。\n\nまた、明日29日にかけて、東北の太平洋側では沿岸海上を中心に「警報級の暴風」の恐れがあります。荒天に十分な注意、警戒をしてください。\nなお、前線通過後は天気が急速に回復し、晴れて気温が上がる所が多い見込みです。\n天気は西から急速に回復 29日～31日は広く黄砂が飛来\n画像：tenki.jp\n明日29日は、次第に晴れるとともに、広い範囲に黄砂が飛来する見込みです。31日にかけて、北日本から西日本の広い範囲で黄砂が予想され、視程が10キロメートル未満となる所があるでしょう。所によっては視程が5キロメートル未満となり、濃度が濃くなる可能性があります。\n\n視程が5キロメートル未満となった場合には、交通に影響が出る恐れもあります。洗濯物はに色が付いたり、車が汚れたりする可能性もあります。黄砂に加えて、雨上がりで花粉の飛散量も増える見込みです。アレルギー症状のある方は十分ご注意ください。\n\n※視程とは、水平方向で見通しの効く距離です。\n土日は気温が急上昇 東京で25℃以上の夏日か\n画像：tenki.jp\n週末は南から暖かな空気が流れ込んで、全国的に季節先取りの暖かさとなるでしょう。\n九州から関東は広く20℃を超えて、特に関東で気温が上がります。東京都心は土日ともに25℃以上の予想で、初夏の陽気となる見込みです。\n東京などで見送りとなっている桜開花の便りは、明日29日にも続々と届きそうです。この先の暖かさで来週は桜が一気に見頃に近づくでしょう。\n\n来週にかけて桜の開花や満開ラッシュとなり、お花見日和が続きますが、急な暑さには注意をしてください。昼間は薄着で過ごせる服装が良さそうですが、朝晩は上着が欠かせないでしょう。\n日本気象協会 本社 石榑 亜紀子,"['https://newsatcl-pctr.c.yimg.jp/t/amd-img/20240328-00024419-tenki-000-1-view.jpg?pri=l&w=640&h=480&exp=10800', 'https://newsatcl-pctr.c.yimg.jp/t/amd-img/20240328-00024419-tenki-001-1-view.jpg?pri=l&w=640&h=480&exp=10800', 'https://newsatcl-pctr.c.yimg.jp/t/amd-img/20240328-00024419-tenki-002-1-view.jpg?pri=l&w=640&h=480&exp=10800', 'https://newsatcl-pctr.c.yimg.jp/t/amd-img/20240328-00024419-tenki-003-1-view.jpg?pri=l&w=640&h=480&exp=10800']","['https://news.yahoo.co.jp/articles/d69c6ccc1ad7cee1d12c966e7cf61dce96889ebc/images/000', 'https://news.yahoo.co.jp/articles/d69c6ccc1ad7cee1d12c966e7cf61dce96889ebc/images/001', 'https://news.yahoo.co.jp/articles/d69c6ccc1ad7cee1d12c966e7cf61dce96889ebc/images/002', 'https://news.yahoo.co.jp/articles/d69c6ccc1ad7cee1d12c966e7cf61dce96889ebc/images/003']"
北海道の1か月予報　空気カラカラに　週末は黄砂に注意　気温が高く桜の開花を後押し（tenki.jp）,https://news.yahoo.co.jp/articles/e4a8105eabb7f63041d08980508cc6b09385dd00,https://newsatcl-pctr.c.yimg.jp/t/amd-img/20240328-00024417-tenki-000-3-view.jpg?exp=10800,2024-03-28T15:59:14+09:00,2024-03-28T16:18:02+09:00,tenki.jp,tenki,tenki.jp,991,\n画像：tenki.jp\n向こう1か月の北海道は、広い範囲で降水量が平年より少なく、日ざしが多くなるため、空気の乾燥しやすくなる時期があるでしょう。また、今週末は道内にも黄砂が飛来してくる見込みです。気温は平年より高く経過し、桜の開花を後押しするような陽気となる日も増えていきそうです。\n1週目(3月30日～4月5日) 雨の後は黄砂に注意\n画像：tenki.jp\n今日(28日)、札幌管区気象台から向こう1か月の見通しが発表されました。各地とも数日の周期で天気が変わり、太平洋側は晴れの日が多くなるでしょう。気温は平年より高く経過する見込みです。明日(29日)は全道的に雨で、道南方面や道東では山沿いを中心にまとまった雨の量となり、雪どけが急速に進むでしょう。河川の増水や土砂災害に注意が必要です。雨のやんだ後は、明後日(30日)にかけて黄砂が飛来する見込みです。黄砂が飛来している時は、マスク(不織布マスク等)を着用することで、ある程度、体内に取り込むのを防ぐことが期待できます。マスクを着用する場合には顔の大きさに合ったものを選び、空気が漏れないようにしましょう。\n2週目(4月6日～4月12日) 晴れて空気カラカラに\n画像：tenki.jp\nこの期間の道内は、天気は数日の周期で変わり、太平洋側は平年と同様に晴れの日が多く、高気圧に覆われやすいため、日本海側やオホーツク海側は平年よりも晴れる日が多くなるでしょう。晴れる日が多くなることで、例年と比べると、空気が乾燥しやすくなる可能性があります。まだまだ、朝晩は暖房を使う時季ですが、新生活が始まり、設置したばかりの暖房器具を使う方もいらっしゃることでしょう。火の取り扱いにはくれぐれもご注意ください。\n3～4週目(4月13日～4月26日) 高めの気温 桜の開花を後押し\nこの期間の道内は、天気は数日の周期で変わり、太平洋側は平年と同様に晴れの日が多くなるでしょう。気温は平年より高く経過し、桜の開花を後押しするような陽気となる日も多くなりそうです。この期間中に北海道にも桜前線が上陸し、道南の松前では4月22日、函館では4月24日、札幌は4月26日に桜が開花する予想です。記録的な早さとなった昨年よりは10日前後遅いですが、平年よりは4日ほど早い開花となりそうです。\n日本気象協会 北海道支社 森 和也,"['https://newsatcl-pctr.c.yimg.jp/t/amd-img/20240328-00024417-tenki-000-3-view.jpg?pri=l&w=640&h=480&exp=10800', 'https://newsatcl-pctr.c.yimg.jp/t/amd-img/20240328-00024417-tenki-001-3-view.jpg?pri=l&w=640&h=480&exp=10800', 'https://newsatcl-pctr.c.yimg.jp/t/amd-img/20240328-00024417-tenki-002-3-view.jpg?pri=l&w=640&h=480&exp=10800']","['https://news.yahoo.co.jp/articles/e4a8105eabb7f63041d08980508cc6b09385dd00/images/000', 'https://news.yahoo.co.jp/articles/e4a8105eabb7f63041d08980508cc6b09385dd00/images/001', 'https://news.yahoo.co.jp/articles/e4a8105eabb7f63041d08980508cc6b09385dd00/images/002']"
明日29日にかけて荒天警戒　東海で大雨の恐れ　通勤時間帯は関東・東北で横殴りの雨（tenki.jp）,https://news.yahoo.co.jp/articles/951173b631d854343ce70c9421ca772c18db619d,https://newsatcl-pctr.c.yimg.jp/t/amd-img/20240328-00024420-tenki-000-1-view.jpg?exp=10800,2024-03-28T18:19:46+09:00,2024-03-28T18:19:46+09:00,tenki.jp,tenki,tenki.jp,1222,\n画像：tenki.jp\n明日29日にかけて、発達する低気圧や前線の影響で、西から雨風強まり「春の嵐」に。東海を中心に大雨となり、関東や東北では、通勤時間帯に非常に強い風が吹き、傘を差しても濡れてしまうような横殴りの雨。交通の影響にも注意。嵐の後、天気は急速に回復、気温が急上昇。\n明日29日にかけて大荒れ 大雨や暴風警戒\n画像：tenki.jp\n明日29日にかけて、発達する低気圧や前線の影響で、荒れた天気に警戒が必要です。\n明日29日は、九州や未明まで、中国、四国や近畿は明け方まで雨や雷雨となり、風も強まる見込みです。四国では、局地的に滝のような雨の降る所もあるでしょう。東海や北陸は明日朝まで広く雨で、どしゃ降りの雨になりそうです。\n特に静岡県では昼前にかけて非常に激しい雨の降る所があり、「警報級の大雨」となる恐れがあります。土砂災害、低い土地の浸水、河川の増水に注意、警戒をしてください。\n関東や東北は明日29日午前を中心に雨だけでなく、風も強まり「春の嵐」となるでしょう。沿岸は風が吹き荒れ、暴風が吹く恐れもあります。\n特に通勤時間帯は、関東や東北で大荒れとなることが考えられます。交通の影響などにも十分注意し、時間に余裕を持ってお出かけください。\n\n<大雨>\n28日18時から29日18時までに予想される24時間降水量(いずれも多い所)\n東海地方 200ミリ\n甲信地方 180ミリ\n関東地方南部 120ミリ\n予想される風・波\n画像：tenki.jp\n<暴風・高波>\n29日は、北日本や東日本では非常に強い風が吹き、北日本では大しけとなる所があるでしょう。\n29日に予想される最大風速(最大瞬間風速)\n北海道地方、東北地方、関東地方 23メートル(35メートル)\n\n29日に予想される波の高さ\n北海道地方(太平洋側) 6メートル\n東北地方、関東地方 5メートル の見込みです。\n\n何かにつかまっていないと立っていられないような非常に強い風が吹き、車は通常の速さで運転するのが困難になります。屋根瓦や看板が落下したり、飛散したりする恐れもあります。沿岸海上を中心に、暴風や高波に警戒してください。\n天気は急速に回復 日中は4月～5月並みの暖かさ\n画像：tenki.jp\n明日29日は、前線通過後は、天気は急速に回復に向かうでしょう。最低気温は全国的に平年を5℃以上上回り、朝から気温が高くなりそうです。\n日中は日が差すとともに、急上昇します。予想最高気温は全国的に4月から5月並みで、九州から関東まで23℃前後まで上がるでしょう。\n\n遅れていた桜の開花が一気に進み、明日29日は関東など続々と桜開花の便りが届きそうです。来週にかけてこのまま高温傾向が続き、そろそろ冬物は衣替えを進めても良いでしょう。急な暑さに十分ご注意ください。\n日本気象協会 本社 石榑 亜紀子,"['https://newsatcl-pctr.c.yimg.jp/t/amd-img/20240328-00024420-tenki-000-1-view.jpg?pri=l&w=640&h=480&exp=10800', 'https://newsatcl-pctr.c.yimg.jp/t/amd-img/20240328-00024420-tenki-001-1-view.jpg?pri=l&w=640&h=480&exp=10800', 'https://newsatcl-pctr.c.yimg.jp/t/amd-img/20240328-00024420-tenki-002-1-view.jpg?pri=l&w=640&h=480&exp=10800', 'https://newsatcl-pctr.c.yimg.jp/t/amd-img/20240328-00024420-tenki-003-1-view.jpg?pri=l&w=640&h=480&exp=10800']","['https://news.yahoo.co.jp/articles/951173b631d854343ce70c9421ca772c18db619d/images/000', 'https://news.yahoo.co.jp/articles/951173b631d854343ce70c9421ca772c18db619d/images/001', 'https://news.yahoo.co.jp/articles/951173b631d854343ce70c9421ca772c18db619d/images/002', 'https://news.yahoo.co.jp/articles/951173b631d854343ce70c9421ca772c18db619d/images/003']"
1か月　季節が急加速　寒の戻りから一転高温へ　お花見は急な暑さ注意　西ほど雨多い（tenki.jp）,https://news.yahoo.co.jp/articles/c652966da5104ed759e223d14288aa9c2501d728,https://newsatcl-pctr.c.yimg.jp/t/amd-img/20240328-00024416-tenki-000-1-view.jpg?exp=10800,2024-03-28T15:41:12+09:00,2024-03-28T15:41:12+09:00,tenki.jp,tenki,tenki.jp,1361,\n画像：tenki.jp\n今日28日、気象庁からこの先の1か月予報が発表。この3月は全国的に気温が平年並みか低い傾向にありましたが、この先1か月の気温は、全国的に平年より高い見込み。昨年よりも大幅に開花が遅れている桜は続々と開花・満開ラッシュへ。西日本ほど雨量が多い見込み。\n3月の平均気温 全国的に平年より低い所が多かった\n画像：tenki.jp\nこの3月は、日本付近は前線や低気圧の通り道となり、西日本から東日本を中心に平年に比べて降水量が多くなりました。また、周期的に寒気の影響を受け、気温は低めとなりました。\n\n上の図は、ここ30日間(2月27日～3月27日まで)の平均気温の平年差です。九州など平年より高い所もありますが、その他は、平年並みか低い所が多くなりました。特に東海や関東甲信、北海道では、平年に比べて低い所が多くなりました。\n\n東京・靖国神社にある桜の標本木は、今日28日午後2時に4輪咲いたことが確認できましたが、開花の基準(5、6輪以上)に達すことなく、今日28日の東京の開花発表は見送りとなりました。この3月は雨が多く、気温も低めだったことなどの理由で、桜の開花は昨年に比べて大幅に遅れている所が多くなっています。\n寒の戻りから一転高温へ 季節が急加速\n画像：tenki.jp\n最新の1か月予報では、寒気の影響を受けにくく、暖かい空気に覆われやすいため、気温は全国的に気温は平年より高い見込みです。特に期間の前半は、全国的に気温がかなり高めとなるでしょう。\n\n天気は春らしく数日の周期で変わり、沖縄・奄美や西日本ほど低気圧や前線の影響を受けて、平年に比べて曇りや雨の日が多く、雨量が多くなる見込みです。度々まとまった雨や大雨となる日があるため、雨が予想される日には、雨の強まる時間帯や雨量など、情報にご注意ください。\n\n北日本の日本海側は、平年に比べて晴れる日が多くなりそうです。4月は春のお出かけに良い日が増えてくるでしょう。\n全国を対象に「高温に関する早期天候情報」が発表\n画像：tenki.jp\n気象庁は今日28日、全国を対象に「高温に関する早期天候情報」を発表しました。\nこれは、この時期としては10年に1度程度しか起きないような著しい高温となる可能性が、いつもより高まっているときに発表される情報です。\n\n4月上旬は、気温が全国的に平年に比べて「かなり高くなる」可能性があります。温度の変化や高めの気温に弱い農作物の管理などに注意が必要です。また、雪崩や落雪など雪の事故が発生しやすくなるため、十分ご注意ください。\n\n今週末から一気に気温が上昇しやすく、来週にかけては桜開花、満開ラッシュとなるでしょう。週末から週明けはお花見日和は続きますが、日中は関東以西では25℃近くまで上がる所もあり、急な暑さに注意が必要です。気温の上がりやすい時間帯はこまめに水分を補給したり、車の中では短時間で気温が上がりやすくなるため、気を付けてください。\n【北日本】北海道・東北地方\n【東日本】関東甲信・北陸・東海地方\n【西日本】近畿・中国・四国・九州北部地方・九州南部\n【沖縄・奄美】鹿児島県奄美地方・沖縄地方\n日本気象協会 本社 石榑 亜紀子,"['https://newsatcl-pctr.c.yimg.jp/t/amd-img/20240328-00024416-tenki-000-1-view.jpg?pri=l&w=640&h=480&exp=10800', 'https://newsatcl-pctr.c.yimg.jp/t/amd-img/20240328-00024416-tenki-001-1-view.jpg?pri=l&w=640&h=480&exp=10800', 'https://newsatcl-pctr.c.yimg.jp/t/amd-img/20240328-00024416-tenki-002-1-view.jpg?pri=l&w=640&h=480&exp=10800', 'https://newsatcl-pctr.c.yimg.jp/t/amd-img/20240328-00024416-tenki-003-1-view.jpg?pri=l&w=640&h=480&exp=10800']","['https://news.yahoo.co.jp/articles/c652966da5104ed759e223d14288aa9c2501d728/images/000', 'https://news.yahoo.co.jp/articles/c652966da5104ed759e223d14288aa9c2501d728/images/001', 'https://news.yahoo.co.jp/articles/c652966da5104ed759e223d14288aa9c2501d728/images/002', 'https://news.yahoo.co.jp/articles/c652966da5104ed759e223d14288aa9c2501d728/images/003']"
関東　明日朝は局地的に「激しい雨」　週末は都心26℃予想で桜の開花ラッシュか（tenki.jp）,https://news.yahoo.co.jp/articles/9b70dc89ccf9f6e1b8f0184b2eadac4bf6a4e598,https://newsatcl-pctr.c.yimg.jp/t/amd-img/20240328-00024418-tenki-000-2-view.jpg?exp=10800,2024-03-28T16:21:50+09:00,2024-03-28T16:33:36+09:00,tenki.jp,tenki,tenki.jp,1638,\n画像：tenki.jp\n関東では明日29日午前中は雨や風が強まり、通勤の時間帯にピークを迎えそうです。強風や高波、土砂災害などに注意・警戒してください。週末は晴れて気温が上がり、関東でも続々と桜の開花を迎えそうです。\n29日(金) 雨・風強まる 通勤の時間帯がピークに\n関東は、今夜(28日)から雨が降りだし、明日昼ごろにかけて雨が続く見通しです。関東南部ほど活発な雨雲がかかりやすく、局地的に激しい雨が降りそうです。これは、低気圧が明日(29日)、急速に発達しながら日本海を進み、低気圧からからのびる前線が本州を通過するためです。\n\n雨のピークは朝から昼前にかけてと予想され、通勤の時間帯は、所によっては傘をさしていても濡れてしまうくらいの降り方となるでしょう。明日朝は時間に余裕を持って移動すると良さそうです。\nまた、沿岸部を中心に非常に強い風が吹くでしょう。最大瞬間風速は30メートルを超える所がありそうです。非常に強い風が吹くと、看板が飛んだり、ビニールハウスのフィルムが破れたりします。車を運転する際、ハンドルを取られることもありますので注意してください。\n関東は、明日は土砂災害や低い土地の浸水、川の増水や強風に十分注意してください。\nまた、海上ではしけとなるため、高波に警戒・注意が必要です。\n\n雨は昼ごろまでにやむ所が多く、午後は急速に天気が回復するでしょう。千葉県や茨城県では天気の回復が遅いですが、夕方までにはやむ見込みです。\n午後は気温がグッと上がり、最高気温は各地で20度以上の予想です。午前中は雨をはじくような素材の服装で、午後は上着の脱ぎ着で調節すると良さそうです。\n「激しい雨」とは\n画像：tenki.jp\n激しい雨は、1時間雨量が30ミリ以上～50ミリ未満の雨を表しています。これは、バケツをひっくり返したように降るイメージです。また、傘をさしていてもぬれるレベルで、木造住宅の屋内では、寝ている人の半数くらいが雨に気づくほどです。外では道路が川のようになり、高速道路を走る車は、タイヤと路面の間に水の膜ができて、ブレーキがきかなくなる「ハイドロプレーニング現象」が起こるおそれがあります。\n週末は都心で26℃予想 春本番の陽気に 黄砂に注意\n画像：tenki.jp\n明後日土曜日(30日)以降、来週半ばにかけて、高気圧に覆われて晴れる日が続く見込みです。\n土曜日の最高気温は、東京都心で26℃、横浜、さいたま、水戸で25℃と、各地で今年初の夏日となる予想です。\n日曜日(31日)も東京都心やさいたまで25℃の予想です。\n各地で平年より5℃以上高くなり、日差しの下では上着なしで過ごすことができるでしょう。お出かけや屋外でのレジャーに良い陽気となりますが、明日夜から日曜日にかけては大陸から黄砂が飛来する予想です。気になる方は、洗濯物は部屋干しにすると良さそうです。\n\n月曜日(4月1日)以降も最高気温は20℃前後の予想で、気温は平年より高く推移しそうです。\n関東で桜の開花ラッシュ\n画像：tenki.jp\n週末からの高温で、関東では各地で桜(ソメイヨシノ)の開花を迎えそうです。\n今日(28日)は、東京の桜の標本木では4輪のつぼみが開いていましたが、開花の基準となる5～6輪には達しず、開花の発表とはなりませんでした。東京は開花秒読みとなっていて、日本気象協会の予想では明日3月29日に開花するとみられます。\nそのほか、横浜は3月30日、熊谷、前橋は3月31日、水戸、宇都宮は4月1日、銚子は4月2日に開花する予想です。桜は開花から1週間程度で満開を迎え、来週は桜が見ごろを迎えそうです。\n\n夜はライトアップされた桜を楽しめる所も多いですが、朝晩と日中の気温差が大きい時期ですので、夜は上着を忘れずに持って、体調を崩さないようお気をつけください。\n日本気象協会 本社 田中 正史,"['https://newsatcl-pctr.c.yimg.jp/t/amd-img/20240328-00024418-tenki-000-2-view.jpg?pri=l&w=640&h=480&exp=10800', 'https://newsatcl-pctr.c.yimg.jp/t/amd-img/20240328-00024418-tenki-001-2-view.jpg?pri=l&w=640&h=480&exp=10800', 'https://newsatcl-pctr.c.yimg.jp/t/amd-img/20240328-00024418-tenki-002-2-view.jpg?pri=l&w=640&h=483&exp=10800', 'https://newsatcl-pctr.c.yimg.jp/t/amd-img/20240328-00024418-tenki-003-2-view.jpg?pri=l&w=640&h=480&exp=10800']","['https://news.yahoo.co.jp/articles/9b70dc89ccf9f6e1b8f0184b2eadac4bf6a4e598/images/000', 'https://news.yahoo.co.jp/articles/9b70dc89ccf9f6e1b8f0184b2eadac4bf6a4e598/images/001', 'https://news.yahoo.co.jp/articles/9b70dc89ccf9f6e1b8f0184b2eadac4bf6a4e598/images/002', 'https://news.yahoo.co.jp/articles/9b70dc89ccf9f6e1b8f0184b2eadac4bf6a4e598/images/003']"
