headline,mainEntityOfPage,image,datePublished,dateModified,author,media_en,media_jp,str_count,body,images,external_links
明日29日にかけて春の嵐　今夜から広く雨風強まる　関東は通勤通学時間帯にピークか（tenki.jp）,https://news.yahoo.co.jp/articles/6b18788e78b2789ae79b74a7a5aed4735923fd43,https://newsatcl-pctr.c.yimg.jp/t/amd-img/20240328-00024415-tenki-000-2-view.jpg?exp=10800,2024-03-28T13:00:52+09:00,2024-03-28T13:04:44+09:00,tenki.jp,tenki,tenki.jp,1000,\n画像：tenki.jp\n西から雨雲が接近中。夕方には九州～東海まで雨雲が広がり、関東も今夜から広く雨。明日29日にかけて広い範囲で雨や風が強まり、関東など朝の通勤通学時間帯は春の嵐に。東海を中心に「警報級の大雨」や、北日本太平洋側で「警報級の暴風」の恐れも。荒天に十分な警戒を。\n西から天気下り坂\n画像：tenki.jp\n西から天気が下り坂です。\n今夜は東シナ海にのびる前線が九州にかかる見込みです。また、朝鮮半島付近にある低気圧が前線を伴いながら、明日29日(金)にかけて急速に発達しながら日本海北部を東へ進むでしょう。\n\n南から暖かく湿った空気が流れ込んで、九州など西日本を中心に、すでに雨が降りだしている所があります。\n今夜は雨風ピーク 関東など通勤通学時間帯に荒天の恐れ\n画像：tenki.jp\n午前中は弱い雨が中心でしたが、午後は九州から次第に本降りとなるでしょう。\n夕方には九州から東海の広い範囲で雨が降り、今夜は雷雨や激しい雨の降る所もありそうです。\n関東も夜から広く雨でしょう。次第に本降りの雨となり、沿岸は風も強く、横殴りの雨になりそうです。\n\n明日29日(金)に日付が変わると、北陸や東北、北海道も雨になりそうです。雪の多い所では、雪解けが急速に進むため、低い土地の浸水や河川の増水、土砂災害、なだれにご注意ください。\n\n雨風のピークは、九州や中国、四国は明日29日未明ごろまで、近畿や東海、北陸は明日朝にかけて、関東は明日午前中、東北は明日未明～昼過ぎにかけて、北海道は明日日中となりそうです。\n\n静岡県では今日28日(木)の午後6時以降、明日にかけて「大雨警報」が発表される可能性が「高い」という情報が出ていて、東海を中心に大雨となる恐れがあります。土砂災害や低い土地の浸水、河川の増水に注意・警戒をしてください。\nまた、明日29日(金)は、福島県、宮城県、岩手県では、沿岸海上を中心に南寄りの風が強まり、「暴風警報」が発表される可能性が「高い」見込みです。\n\n強まる雨風によって、交通にも影響が出る恐れがあります。やむを得ず、雨や風のピーク時間帯に外出をする際は、時間に余裕を持って、十分お気をつけください。また、関東から北海道にかけての海上は、波も高くなるため、船舶は注意、警戒が必要です。\n日本気象協会 本社 石榑 亜紀子,"['https://newsatcl-pctr.c.yimg.jp/t/amd-img/20240328-00024415-tenki-000-2-view.jpg?pri=l&w=640&h=480&exp=10800', 'https://newsatcl-pctr.c.yimg.jp/t/amd-img/20240328-00024415-tenki-001-2-view.jpg?pri=l&w=640&h=480&exp=10800', 'https://newsatcl-pctr.c.yimg.jp/t/amd-img/20240328-00024415-tenki-002-2-view.jpg?pri=l&w=640&h=480&exp=10800']","['https://news.yahoo.co.jp/articles/6b18788e78b2789ae79b74a7a5aed4735923fd43/images/000', 'https://news.yahoo.co.jp/articles/6b18788e78b2789ae79b74a7a5aed4735923fd43/images/001', 'https://news.yahoo.co.jp/articles/6b18788e78b2789ae79b74a7a5aed4735923fd43/images/002']"
名古屋・松江で桜開花　東京も開花まで秒読み　午後も開花ラッシュ（tenki.jp）,https://news.yahoo.co.jp/articles/8b66c57ae025b0d7b19b397fb1ea3ac3640869e9,https://newsatcl-pctr.c.yimg.jp/t/amd-img/20240328-00024412-tenki-000-1-view.jpg?exp=10800,2024-03-28T10:26:24+09:00,2024-03-28T10:26:24+09:00,tenki.jp,tenki,tenki.jp,876,\n画像：tenki.jp\n今日28日、名古屋と松江で桜(ソメイヨシノ)が開花しました。平年に比べて、名古屋は4日遅く、松江は1日早くなりました。また、開花が早かった昨年と比べて、名古屋は11日遅く、松江は8日遅くなりました。東京の桜開花も秒読み段階。明日から桜が一気に咲き進む暖かさへ。\n名古屋と松江で桜開花\n今日28日(木)、名古屋と松江で桜(ソメイヨシノ)が開花しました。\n平年に比べて、名古屋は4日遅く、松江は1日早くなりました。また、開花が早かった昨年と比べて、名古屋は11日遅く、松江は8日遅くなりました。\n\n今年は今月23日(土)に、全国の気象台のトップを切って高知で桜(ソメイヨシノ)が開花しました。25日(月)には広島や宮崎で、26日(火)には長崎や熊本でも開花の発表がありました。昨日27日(水)は、福岡、松山、岐阜の3地点から桜開花の便りが届きました。今年開花した地点では、いずれも昨年に比べて遅く、4日～11日遅くなっています。\n\n東京の桜開花も秒読み段階となりました。明日29日(金)以降は、桜が一気に咲き進むような暖かさが続く見込みです。今年は桜の開花が昨年より大幅に遅れていますが、今後の気温の上昇で、開花から1週間たたずに満開になる所が多いかもしれません。\n桜の開花日とは\n画像：tenki.jp\n桜の開花日とは、標本木で5～6輪以上の花が咲いた状態となった最初の日です。なお、胴咲き(枝ではなく幹や根から咲く)による開花は、通常の開花とは異なるプロセスによると考えられることから、5～6輪に含まれません。\n\n観測の対象は多くの地域でソメイヨシノです。ただ、ソメイヨシノが生育できない地域である沖縄県から名瀬にかけてはヒカンザクラ、北海道地方の一部ではエゾヤマザクラが観測されています。\n\n一般的に、桜は咲き始めてから1週間程度で満開を迎えます。ただし、寒冷な地方ほど開花から満開までの期間は短く、東北北部では開花から満開までは4から5日程度と短くなります。\n日本気象協会 本社 日直主任,"['https://newsatcl-pctr.c.yimg.jp/t/amd-img/20240328-00024412-tenki-000-1-view.jpg?pri=l&w=640&h=480&exp=10800', 'https://newsatcl-pctr.c.yimg.jp/t/amd-img/20240328-00024412-tenki-001-1-view.jpg?pri=l&w=640&h=480&exp=10800']","['https://news.yahoo.co.jp/articles/8b66c57ae025b0d7b19b397fb1ea3ac3640869e9/images/000', 'https://news.yahoo.co.jp/articles/8b66c57ae025b0d7b19b397fb1ea3ac3640869e9/images/001']"
花粉の季節は終盤へ　4月上旬はヒノキ花粉がピーク　5月上旬まで敏感な方は対策を（tenki.jp）,https://news.yahoo.co.jp/articles/639a1d25dac8d1e8f289b6b84ec79a999db44105,https://newsatcl-pctr.c.yimg.jp/t/amd-img/20240328-00024414-tenki-000-1-view.jpg?exp=10800,2024-03-28T12:01:07+09:00,2024-03-28T12:01:07+09:00,tenki.jp,tenki,tenki.jp,1528,\n画像：tenki.jp\n今日28日、日本気象協会は、春の花粉飛散予測(第5報)を発表。スギ花粉はすでに飛散のピークを過ぎている所が多く、花粉の季節もあともう少し。4月上旬は広い範囲でヒノキ花粉のピークとなるでしょう。5月上旬にかけて僅かな花粉は飛散するため、敏感な方は油断せずに対策を。\n2024年 東京都千代田区のスギ、ヒノキ花粉の飛散状況\n東京都千代田区(日本気象協会観測)では、今年のスギ花粉の飛散は例年並みの2月13日に開始し、飛散のピークは2月下旬から3月下旬にかけて続いています。とくに風の強い日や最高気温が20℃を超えるような暖かい日などには大量の花粉が観測されています。\n\nまた、ヒノキ花粉は3月15日に飛散開始となりました。日本気象協会の予測では、東京の今年のスギ、ヒノキ花粉の総飛散量は1平方センチメートルあたり5500個と例年並みの見込みで、3月25日までに観測された花粉量の合計は3746個と予測のおよそ7割に達しています。\n\nこの先、今週末(3月30～31日)は気温が上昇し、ヒノキ花粉飛散が急激に増えるでしょう。4月にかけてヒノキ花粉を中心に、花粉の飛散が続く見込みです。\nスギ・ヒノキ花粉のピーク時期(九州～東北)\n画像：tenki.jp\nスギ花粉はすでに飛散のピークを過ぎている所が多くなっています。東京や仙台もまもなくピークを終えるでしょう。ピークの期間は、およそ10日から1か月ほど続いた所が多くなりましたが、広島と高松は、今年の飛散量は例年より少なく推移し、ピークの期間は例年に比べて短く、はっきりしたピークは現れませんでした。\n\nヒノキ花粉は、九州や、近畿、東海から関東と東北南部の一部で飛散開始しています。中国、四国も3月末にかけて飛散開始が確認される所が多くなるでしょう。この先、4月上旬にかけては暖かい日が多く、ヒノキ花粉の飛散が急増する見込みです。4月上旬は広い範囲でヒノキ花粉のピークとなるでしょう。ピークの期間は、およそ1週間から2週間ほどの見込みです。晴れる日や風が強い日は飛散量が増えるので万全な花粉対策を心がけて下さい。仙台はヒノキ花粉の飛散量は少なく、はっきりしたピークは現れない見込みです。\nスギ・ヒノキ花粉の飛散はいつまで?\n画像：tenki.jp\nヒノキ花粉がピークを過ぎるとまもなく、九州から東北では花粉の本格的な飛散は終了するでしょう。1平方センチメートルあたり10個以上のやや多い花粉を観測するような本格的な飛散は、九州では4月上旬まで、中国・四国から東北の多くの地域では4月中旬まででしょう。東海地方の一部は4月下旬までの見込みです。\n\nただ、本格的な飛散が終了しても5月上旬頃までは、各地で花粉がわずかに飛ぶ日があるでしょう。花粉に敏感な方は、引き続き対策を行いましょう。\nシラカバ花粉の飛散開始時期(北海道)\n北海道のシラカバ花粉は4月下旬に飛散開始となる見込みです。北海道のシラカバ花粉が飛び始める時期は、春(3～5月)の気温が高いと早まる傾向があります。今年は3月の気温が平年より低く推移しているものの、4～5月の気温は平年並みか高くなる見込みです。このためシラカバ花粉の飛散開始は、例年並みか早いでしょう。\n日本気象協会の花粉飛散予測とは\n日本気象協会は1990年からスギ花粉の飛散予測を発表しています。日本気象協会の花粉飛散予測は前シーズンの花粉飛散結果や今後の気温予測などの気象データをもとに、全国各地の花粉研究会や協力機関からの情報、花芽の現地調査の結果などをふまえて予測しています。\n日本気象協会 本社 石榑 亜紀子,"['https://newsatcl-pctr.c.yimg.jp/t/amd-img/20240328-00024414-tenki-000-1-view.jpg?pri=l&w=640&h=480&exp=10800', 'https://newsatcl-pctr.c.yimg.jp/t/amd-img/20240328-00024414-tenki-001-1-view.jpg?pri=l&w=640&h=480&exp=10800', 'https://newsatcl-pctr.c.yimg.jp/t/amd-img/20240328-00024414-tenki-002-1-view.jpg?pri=l&w=640&h=480&exp=10800']","['https://news.yahoo.co.jp/articles/639a1d25dac8d1e8f289b6b84ec79a999db44105/images/000', 'https://news.yahoo.co.jp/articles/639a1d25dac8d1e8f289b6b84ec79a999db44105/images/001', 'https://news.yahoo.co.jp/articles/639a1d25dac8d1e8f289b6b84ec79a999db44105/images/002']"
29日～30日「黄砂」飛来　九州から北海道の広い範囲に影響か　視程5キロ未満も（tenki.jp）,https://news.yahoo.co.jp/articles/46b9e50beab7540175f179946a5bae92bf3d0d4a,https://newsatcl-pctr.c.yimg.jp/t/amd-img/20240328-00024411-tenki-000-1-view.jpg?exp=10800,2024-03-28T10:05:43+09:00,2024-03-28T10:05:43+09:00,tenki.jp,tenki,tenki.jp,853,\n画像：tenki.jp\n明日29日(金)から30日(土)は、西日本から北日本の広い範囲で黄砂が飛来する予想。視程が5キロ未満になる所もあり、交通機関への影響が出るおそれも。\n29日～30日 広範囲で黄砂飛来\n画像：tenki.jp\n今日28日(木)9時30分現在の衛星画像を見ると、中国大陸に広がる茶色の帯状「黄砂」が確認できます。この黄砂が上空の風に流されて日本付近に飛んでくるのは、29日(金)から30日(土)にかけて。九州から北海道の広範囲に影響が及ぶでしょう。\n\n黄砂は、中国大陸奥地のタクラマカン砂漠やゴビ砂漠などで舞い上がった砂ぼこりが飛んでくる現象で、黄砂が最も多く観測されるのは、春(3～5月)です。黄砂の量が少ないと、遠くの景色がぼんやりかすむ程度ですが、黄砂の量が増えるにつれて、車や洗濯物などが汚れてしまうことがあります。\n\n明日29日(金)から30日(土)は、視程が5キロ未満になる所もあるでしょう。小型航空機の運航など、交通への影響がでるおそれがあるため、注意が必要です。\n黄砂の健康への影響を予防するには\n画像：tenki.jp\n黄砂の健康への影響を予防するには以下の3つのポイントがあります。\n\n①日頃から最新の情報をチェックし、黄砂の飛来予測を把握しましょう。\n\n②黄砂が飛来している時は、不要不急の外出を控えることで黄砂を吸い込んでしまう量を減らすことが期待できます。特に、高濃度の黄砂が飛来しているときには、屋外での長時間の激しい運動は避けるとよいでしょう。 呼吸器や循環器に疾患のある方、小児、高齢者の方などは、体調に応じて、より慎重に行動することが大切です。洗濯物や布団は、できるだけ室内に干しましょう。\n\n③黄砂が飛来している時は、マスク(不織布マスク等)を着用することで、ある程度の予防効果が期待できます。マスクを着用する場合には顔の大きさに合ったものを選び、空気が漏れないようにしましょう。\n日本気象協会 本社 日直主任,"['https://newsatcl-pctr.c.yimg.jp/t/amd-img/20240328-00024411-tenki-000-1-view.jpg?pri=l&w=640&h=480&exp=10800', 'https://newsatcl-pctr.c.yimg.jp/t/amd-img/20240328-00024411-tenki-001-1-view.jpg?pri=l&w=640&h=480&exp=10800', 'https://newsatcl-pctr.c.yimg.jp/t/amd-img/20240328-00024411-tenki-002-1-view.jpg?pri=l&w=640&h=480&exp=10800']","['https://news.yahoo.co.jp/articles/46b9e50beab7540175f179946a5bae92bf3d0d4a/images/000', 'https://news.yahoo.co.jp/articles/46b9e50beab7540175f179946a5bae92bf3d0d4a/images/001', 'https://news.yahoo.co.jp/articles/46b9e50beab7540175f179946a5bae92bf3d0d4a/images/002']"
明日29日は荒天　のち黄砂飛来　今週末はお花見日和　2週間天気（tenki.jp）,https://news.yahoo.co.jp/articles/6fdbf78b07b81607663dcdbb1461c541ffe3f8f4,https://newsatcl-pctr.c.yimg.jp/t/amd-img/20240328-00024413-tenki-000-1-view.jpg?exp=10800,2024-03-28T11:55:53+09:00,2024-03-28T11:55:53+09:00,tenki.jp,tenki,tenki.jp,928,\n画像：tenki.jp\n明日29日(金)は昼頃にかけて大雨になる所があり、荒れた天気に。今週末はお花見日和ですが、黄砂に注意。気温は平年より高い日が多く、雪解けが進みそう。\n29日(金)～4月4日(木) 荒天のあとは黄砂 週末は初夏の陽気も\n画像：tenki.jp\n明日29日(金)は、低気圧が急速に発達しながら日本海を北上し、前線が本州付近を通過するでしょう。大雨や暴風に警戒が必要です。発達した雨雲がかかる九州から関東では、局地的に激しい雨。四国や東海は滝のような「非常に激しい雨」が降る所もあるでしょう。また、気温が上がるため、東北や北海道も雨になり、雪が多く残る地域では雪解けによる災害に注意が必要です。\n\n雨がやんだあとは、急速に天気が回復するでしょう。ただ、31日(日)にかけて、西日本から北日本の広い範囲で黄砂が予想されています。視程(水平方向で見通しの効く距離)が10キロメートル未満となり、車や洗濯物に黄砂が付着するなどの影響が出るでしょう。視程が5キロメートル未満となる所もあり、交通への影響が発生するおそれがあります。\n\n4月2日(火)頃までは広い範囲で晴れて、お花見が楽しめるでしょう。週末を中心に気温がグンと上がり、30日(土)の東京都心の最高気温は25℃と、今年初めての夏日になるかもしれません。3日(水)以降は西日本を中心に雲が広がりやすく、4日(木)は雨の範囲が広がりそうです。\n4月5日(金)～10日(水) 週末は雨 季節先取りの暖かさ\n画像：tenki.jp\n4月5日(金)以降も、九州から関東、北陸はすっきりしない天気。6日(土)から7日(日)は広い範囲で雨が降り、花散らしの雨になる所もありそうです。北海道は晴れ間があっても、急な雨にご注意ください。8日(月)になると次第に日差しが戻り、10日(水)は各地で晴れるでしょう。\n\n最高気温は平年より高い日が多く、九州から関東では20℃前後の日がほとんどです。札幌は15℃前後まで上がるなど、季節が進むでしょう。雪が多く残る所では急に雪解けが進むため、全層なだれや屋根からの落雪などに十分ご注意ください。\n日本気象協会 本社 青山 亜紀子,"['https://newsatcl-pctr.c.yimg.jp/t/amd-img/20240328-00024413-tenki-000-1-view.jpg?pri=l&w=640&h=480&exp=10800', 'https://newsatcl-pctr.c.yimg.jp/t/amd-img/20240328-00024413-tenki-001-1-view.jpg?pri=l&w=640&h=359&exp=10800', 'https://newsatcl-pctr.c.yimg.jp/t/amd-img/20240328-00024413-tenki-002-1-view.jpg?pri=l&w=640&h=480&exp=10800']","['https://news.yahoo.co.jp/articles/6fdbf78b07b81607663dcdbb1461c541ffe3f8f4/images/000', 'https://news.yahoo.co.jp/articles/6fdbf78b07b81607663dcdbb1461c541ffe3f8f4/images/001', 'https://news.yahoo.co.jp/articles/6fdbf78b07b81607663dcdbb1461c541ffe3f8f4/images/002']"
花粉情報　飛散のピーク続く　明日29日から30日は広範囲で黄砂　万全の対策を（tenki.jp）,https://news.yahoo.co.jp/articles/c7400c5d11d73be4d09ba20fe181808387d75e74,https://newsatcl-pctr.c.yimg.jp/t/amd-img/20240328-00024410-tenki-000-1-view.jpg?exp=10800,2024-03-28T08:58:26+09:00,2024-03-28T08:58:26+09:00,tenki.jp,tenki,tenki.jp,954,\n画像：tenki.jp\nこの先も連日のように、花粉が大量飛散。今日28日(木)は雨で花粉の飛散が抑えられる所も要注意。明日29日(金)から30日(土)は西日本から北日本の広い範囲で黄砂が予想されています。万全の対策を。\n連日のように大量飛散\n画像：tenki.jp\n今日28日(木)は、西から雨の範囲が広がり、九州から近畿では花粉の飛散が抑えられそうです。ただ、東海や関東、東北は雨の降りだしが夕方以降の予想で、雨が降る前は花粉が飛びやすいでしょう。\n\n明日29日(金)は雨上がりの花粉の飛散に注意が必要です。30日(土)以降は晴れる日が多く、気温も上がるため、大量飛散となりそうです。花粉飛散量は、仙台や東京、名古屋で連日「非常に多い」ランク、福岡も31日(日)からは「非常に多い」予想です。\n\n九州から関東ではヒノキ花粉の飛散が増えていて、万全の対策が必要でしょう。スギ花粉の飛散はピークを越えた所が多いですが、まだ九州から東北の広い範囲で飛びそうです。\n黄砂や花粉を防いで快適な生活を\n画像：tenki.jp\n明日29日(金)から30日(土)にかけては、西日本から北日本の広い範囲で黄砂が予想されています。春は、黄砂や花粉が飛びやすいシーズンです。黄砂や花粉をなるべく防ぐには、以下のような対策がおすすめです。\n\n①外から帰った時には、玄関を入る前に洋服や髪の毛についた花粉をしっかりと払い落としましょう。花粉症でない方も、普段からこの習慣を心がけていただきたいものです。\n\n②換気をする際、窓を大きく開けると、その分、花粉も室内に入りやすくなってしまいます。窓を10センチ程度開けてレースのカーテンをするだけでも、部屋の中に入ってくる花粉の数を、窓を全開にした時と比べておよそ4分の1に減らすことができるという実験結果もあります。窓を開ける幅は少しでも構いませんので、なるべく換気しながら花粉を防ぎましょう。\n\n③洗濯物や布団は、できるだけ室内に干しましょう。花粉対策だけでなく、黄砂対策にも効果的です。その際、空気清浄機がある方は、ぜひ一緒に使ってください。綺麗な空気の中で洗濯物や布団を乾かせば、より快適に過ごせそうです。\n日本気象協会 本社 青山 亜紀子,"['https://newsatcl-pctr.c.yimg.jp/t/amd-img/20240328-00024410-tenki-000-1-view.jpg?pri=l&w=640&h=480&exp=10800', 'https://newsatcl-pctr.c.yimg.jp/t/amd-img/20240328-00024410-tenki-001-1-view.jpg?pri=l&w=640&h=480&exp=10800', 'https://newsatcl-pctr.c.yimg.jp/t/amd-img/20240328-00024410-tenki-002-1-view.jpg?pri=l&w=640&h=480&exp=10800']","['https://news.yahoo.co.jp/articles/c7400c5d11d73be4d09ba20fe181808387d75e74/images/000', 'https://news.yahoo.co.jp/articles/c7400c5d11d73be4d09ba20fe181808387d75e74/images/001', 'https://news.yahoo.co.jp/articles/c7400c5d11d73be4d09ba20fe181808387d75e74/images/002']"
