headline,mainEntityOfPage,image,datePublished,dateModified,author,media_en,media_jp,str_count,body,images,external_links
"生肉ドレス、長すぎネイル、別人メイクなど...レディー・ガガが披露した""奇抜すぎる""歴代ファッション3連発（Harper’s BAZAAR（ハーパーズ バザー））",https://news.yahoo.co.jp/articles/85a189665e1cefafb94f92023a118e69a20862df,https://newsatcl-pctr.c.yimg.jp/t/amd-img/20240328-00010003-bazaar-000-1-view.jpg?exp=10800,2024-03-28T22:20:10+09:00,2024-03-28T22:20:10+09:00,Harper’s BAZAAR（ハーパーズ バザー）,bazaar,Harper’s BAZAAR（ハーパーズ バザー）,547,"\n2008年、デビューした当時のレディー・ガガ\n3月28日は、世界的歌姫レディー・ガガの誕生日！ファッションアイコンとして常に私たちを圧倒するそのスタイルは、時に奇抜で予想外なものばかり。\n【写真】髪の毛ドレスは、かなり斬新⁈ レディー・ガガの刺激的ファッション38連発\n38歳の誕生日を祝して、記憶に濃く残った歴代衝撃ルック3選をプレイバック。\n2010年\nレディー・ガガ\nMTV ビデオ・ミュージック・アワードに登場したガガは、フランク・フェルナンデス＆ニコラ・フォルミケッティによるなんとも衝撃的な""生肉ドレス""を披露。\n2011年\nレディー・ガガ\n良くも悪くも記憶に刻まれた生肉ドレスの翌年は、さすがにそれを超える衝撃は訪れないと誰もが予想した。でも、この年のMTV ビデオ・ミュージック・アワードに、ガガはなんと男装で登場！別人級のヘアメイク＆ファッションでファンを驚かせた。\n2019年\nレディー・ガガ\n「HAUS」ローンチイベントに訪れたガガは、クリスチャン コーワンの真っ赤なミニドレスで登場！プリーザーの超高ヒールブーツは当時も大きな注目を集めたが、それと同じくらい超ロングなネイルにも注目せずにはいられない。\nHarper's BAZAAR JP","['https://newsatcl-pctr.c.yimg.jp/t/amd-img/20240328-00010003-bazaar-000-1-view.jpg?pri=l&w=426&h=640&exp=10800', 'https://newsatcl-pctr.c.yimg.jp/t/amd-img/20240328-00010003-bazaar-001-1-view.jpg?pri=l&w=420&h=640&exp=10800', 'https://newsatcl-pctr.c.yimg.jp/t/amd-img/20240328-00010003-bazaar-002-1-view.jpg?pri=l&w=440&h=640&exp=10800', 'https://newsatcl-pctr.c.yimg.jp/t/amd-img/20240328-00010003-bazaar-003-1-view.jpg?pri=l&w=444&h=640&exp=10800']","['https://news.yahoo.co.jp/articles/85a189665e1cefafb94f92023a118e69a20862df/images/000', 'https://www.harpersbazaar.com/jp/fashion/celeb-fashion/g31972443/ladygaga-dress-200417-hns/?utm_source=yahoonews&utm_medium=distribution&utm_campaign=240328_yahoo', 'https://news.yahoo.co.jp/articles/85a189665e1cefafb94f92023a118e69a20862df/images/001', 'https://news.yahoo.co.jp/articles/85a189665e1cefafb94f92023a118e69a20862df/images/002', 'https://news.yahoo.co.jp/articles/85a189665e1cefafb94f92023a118e69a20862df/images/003']"
主要メンバー不在で「大幅に」スケールダウンの見通し...？英王室は“春の恒例行事”をどう実施するのか（Harper’s BAZAAR（ハーパーズ バザー））,https://news.yahoo.co.jp/articles/a1069f55bb23f92074673fb4083748feba7978f2,https://newsatcl-pctr.c.yimg.jp/t/amd-img/20240328-00010000-bazaar-000-2-view.jpg?exp=10800,2024-03-28T19:20:06+09:00,2024-03-28T21:24:09+09:00,Harper’s BAZAAR（ハーパーズ バザー）,bazaar,Harper’s BAZAAR（ハーパーズ バザー）,840,\nキャサリン皇太子妃／チャールズ国王\nイギリスのロイヤルメンバーは毎年、ウィンザーの聖ジョージ礼拝堂で行われるイースター（復活祭）の礼拝に、そろって出席するのが恒例。2024年のイースター・サンデーの礼拝は、3月31日に行われる予定となっている。\n【写真】キャサリン妃、「化学療法」で激やせ…？パパラッチがとらえた「食料品店」に向かう姿\nただ、今年はがんの治療中であるチャールズ国王が公務の大半を取りやめ、キャサリン皇太子妃も療養中であることから、例年とは異なる対応が取られることになるもよう。バッキンガム宮殿の関係者は、出席するロイヤルの人数が減ることから、通常より「規模を縮小して」礼拝を行うことを明らかにしている。\n\nチャールズ国王はカミラ王妃とともに出席の予定であるものの、ウィリアム皇太子とキャサリン妃は、欠席するとみられている。\n去年のイースターの礼拝に出席した皇太子一家、2023年4月9日撮影\nケンジントン宮殿は1月に発表したキャサリン妃の腹部の手術に関する声明で、「公務の再開はイースターより後になる見通し」だと説明していた。だが、その後にがんと診断されたことを受け、休養の期間は当初の予定より長くなると見込まれている。\n\n宮殿の関係者のひとりはキャサリン妃について、「担当の医療チームが許可すれば、公務を再開することになるでしょう」「皇太子妃は前向きであり、完全に回復することに集中しています」と述べている。\n\nまた、ウィリアム皇太子は「年明けからそうしてきたように、今後も妻と家族を支えることと、公務のバランスを取っていくことになります」とのこと。\n\nキャサリン妃は3月22日（現地時間）に公開したビデオメッセージで、腹部の手術後にがんと診断され、「予防的な化学療法」を受けていることを公表。チャールズ国王は2月初旬、がんと診断され、外来での治療を開始したことを明らかにしている。\nfrom Harper's BAZAAR US,"['https://newsatcl-pctr.c.yimg.jp/t/amd-img/20240328-00010000-bazaar-000-2-view.jpg?pri=l&w=640&h=640&exp=10800', 'https://newsatcl-pctr.c.yimg.jp/t/amd-img/20240328-00010000-bazaar-001-2-view.jpg?pri=l&w=640&h=464&exp=10800']","['https://news.yahoo.co.jp/articles/a1069f55bb23f92074673fb4083748feba7978f2/images/000', 'https://www.harpersbazaar.com/jp/celebrity/celebrity-news/g60252303/witnesses-saw-kate-middleton-prince-william-shopping-240320-lift1-embed/?utm_source=yahoonews&utm_medium=distribution&utm_campaign=240328_yahoo', 'https://news.yahoo.co.jp/articles/a1069f55bb23f92074673fb4083748feba7978f2/images/001']"
さすが…！英グラミー賞歌手、エルメスの「バーキン」に荷物を詰め込みまくって外出（Harper’s BAZAAR（ハーパーズ バザー））,https://news.yahoo.co.jp/articles/9aaa3ea66845cfed034508fc5373e725f47b1f2c,https://newsatcl-pctr.c.yimg.jp/t/amd-img/20240328-00010002-bazaar-000-2-view.jpg?exp=10800,2024-03-28T21:20:27+09:00,2024-03-28T21:49:41+09:00,Harper’s BAZAAR（ハーパーズ バザー）,bazaar,Harper’s BAZAAR（ハーパーズ バザー）,721,\nデュア・リパ\n1984年に発売されて以来、エルメスの「バーキン」は富とラグジュアリーの象徴として、その柔らかなレザーと特別感が崇拝されてきた。しかし、「バーキン」を持つ人のほとんどは新品ピカピカの状態を保ちたいと思う一方で、バッグの名前の由来となった人物であり永遠のファッションアイコン、ジェーン・バーキンは、そんなことには目もくれず実用的にバッグを使って、あふれんばかりに物を詰め込んでいたことで有名だった。そして今、その跡を継いでいるのがデュア・リパだ。\n【写真】「バーキン」がパンパン？ デュア・リパが新恋人と外出する様子\n2013年、バーキンのバッグを誇らしげに見せるジェーン。\n先日デュアは、恋人であり『ファンタスティック・ビースト』シリーズで、主役ニュートの兄テセウス・スキャマンダーを演じた英国俳優カラム・ターナーと外出。一緒にパリの街を歩くところをキャッチされた。デュアの左手には、様々な物を詰め込んだエルメスの「バーキン」が。バッグのハンドルにはスカーフを巻き付け、もう片側にもキーチェーンをつけるなどして、自分流にアレンジしていた。また、バッグの中に分厚い書類が見えているのも、ジェーンがノートやバインダーなど、日常の細々したものを詰め込んでいたことを思い出させる。\n\nデュアは滑らかな黒いレザーのロングコート、黒のトップス、黒いストールに、バギーなブルージーンズ、スニーカー、オーバル型のサングラスをスタイリング。一方、恋人のカラムは黒のセーターにダークブラウンの襟付きジャケット、黒のテーパードパンツに黒のブーツで、シルバーのスーツケースを運んでいた。\nfrom Harper's BAZAAR US,"['https://newsatcl-pctr.c.yimg.jp/t/amd-img/20240328-00010002-bazaar-000-2-view.jpg?pri=l&w=426&h=640&exp=10800', 'https://newsatcl-pctr.c.yimg.jp/t/amd-img/20240328-00010002-bazaar-001-2-view.jpg?pri=l&w=425&h=640&exp=10800']","['https://news.yahoo.co.jp/articles/9aaa3ea66845cfed034508fc5373e725f47b1f2c/images/000', 'https://www.harpersbazaar.com/jp/fashion/celeb-fashion/a60325400/dua-lipa-hermes-birkin-bag-callum-turner-240327-lift1-embed/?utm_source=yahoonews&utm_medium=distribution&utm_campaign=240328_yahoo', 'https://news.yahoo.co.jp/articles/9aaa3ea66845cfed034508fc5373e725f47b1f2c/images/001']"
業界に激震走る…！グッチを率いた“伝説的”デザイナーがヴァレンティノの新クリエイティブ・ディレクターに電撃就任（Harper’s BAZAAR（ハーパーズ バザー））,https://news.yahoo.co.jp/articles/75382b67fe7e94621063f8f0f812d30e3805e335,https://newsatcl-pctr.c.yimg.jp/t/amd-img/20240328-00010004-bazaar-000-1-view.jpg?exp=10800,2024-03-28T23:46:51+09:00,2024-03-28T23:46:51+09:00,Harper’s BAZAAR（ハーパーズ バザー）,bazaar,Harper’s BAZAAR（ハーパーズ バザー）,972,\nアレッサンドロ・ミケーレ\n3月28日（現地時間）、アレッサンドロ・ミケーレがヴァレンティノの新クリエイティブ・ディレクターに就任することが発表された。ファーストコレクションは今年9月、2025年春夏パリ・ファッションウィークで披露される予定だ。\n【写真】今後どうなる？ヴァレンティノのピエールパオロ・ピッチョーリが退任…、感動を巻き起こしたアイコニックな瞬間をプレイバック\nアレッサンドロ・ミケーレは1994年、ローマの名門ファッションスクール「Accademia di Costume e di Moda」を卒業後、イタリア発のニットブランド「Les Copains」にてキャリアをスタート。その後、フェンディにてシルヴィア・ヴェントゥリーニ・フェンディとカール・ラガーフェルドのもと、シニア・アクセサリー・デザイナーに就任し、レザー小物のデザインを担当した。\n2015年～2022年までグッチを率いたアレッサンドロ・ミケーレ\n2002年にトム・フォード率いるグッチに移籍し、2015年1月にクリエイティブ・ディレクターに就任した。柄や色、素材をふんだんに使用したマキシマリストな世界観を展開し、ミケーレはそれまでのメゾンのイメージを大胆に一新。グッチ初のファインジュエリーラインやビューティーライン、そしてリストランテなどもローンチし、メゾンに大革命を起こした。さらに、日本発のドラえもんとのコラボや、バレンシアガとの衝撃的なクロスオーバーなどを発表し、ファッション業界のコラボレーションブームを牽引した。\n\nそんなミケーレは2022年11月、グッチのクリエイティブ・ディレクターを辞任。その約1年半後、2024年4月2日付で彼はヴァレンティノの新クリエイティブ・ディレクターに就任する。2008年から16年間メゾンを率いたピエールパオロ・ピッチョーリからバトンを受け継ぐ彼は、ヴァレンティノにて初のオートクチュールコレクションも手掛けることになる。\n\nミケーレは声明で次のように述べた。\n\n「信じられないほど光栄なことです。独特のエレガンスと洗練、そして究極の優雅さから構築されたメゾンの物語、そして『美』という言葉が刻まれたメゾン・ド・クチュールの一員となることに、計り知れない喜びと大きな責任を感じています」,"['https://newsatcl-pctr.c.yimg.jp/t/amd-img/20240328-00010004-bazaar-000-1-view.jpg?pri=l&w=424&h=640&exp=10800', 'https://newsatcl-pctr.c.yimg.jp/t/amd-img/20240328-00010004-bazaar-001-1-view.jpg?pri=l&w=426&h=640&exp=10800']","['https://news.yahoo.co.jp/articles/75382b67fe7e94621063f8f0f812d30e3805e335/images/000', 'https://www.harpersbazaar.com/jp/fashion/fashion-news/g60279171/pierpaolo-piccioli-valentino-best-moments-240323-hb/?utm_source=yahoonews&utm_medium=distribution&utm_campaign=240328_yahoo', 'https://news.yahoo.co.jp/articles/75382b67fe7e94621063f8f0f812d30e3805e335/images/001']"
良かれと思って摂取した、栄養サプリ、オートミール、プロテインetc...。実は「不調の原因」になっている3つの健康習慣（Harper’s BAZAAR（ハーパーズ バザー））,https://news.yahoo.co.jp/articles/da13a55bb01a57de532f9570c25a3c8514df5228,https://newsatcl-pctr.c.yimg.jp/t/amd-img/20240328-00010001-bazaar-000-4-view.jpg?exp=10800,2024-03-28T20:20:30+09:00,2024-03-28T23:09:47+09:00,Harper’s BAZAAR（ハーパーズ バザー）,bazaar,Harper’s BAZAAR（ハーパーズ バザー）,1894,"\n間違いだらけの「健康法」をいますぐ見直して！\nSNSなどでよく目にするオススメ健康法。その食品自体はよいものなのに、食べ方が間違っていたら効果は激減、それどころか病気になってしまうリスクも！ 管理栄養士の篠原絵里佳さんが、不調の原因となる間違った健康法を正します。\n【写真】チョコやブルーベリーも！栄養士が解説する、コレステロールを「下げる」効果がある食品40\nプロテインを飲んでいるので食事は食べなくてもOK、は危険！\nあなたのプロテインの飲み方、あってる？\n【間違った思い込み】たんぱく質は重要な栄養素。プロテインを食事の代わりに摂取している。\n\n【驚きの事実】プロテイン剤は、たんぱく質のサプリメント。すべての栄養素が網羅されているわけではないから、食事の代わりにはならない。プロテインだけではカロリー不足になり、この状態でプロテインをとっても、プロテインはカロリー源として使われてしまうため、本来の体作りという役割は果たせなくなる。また、手軽にとれるプロテイン剤は摂り過ぎてしまうこともあり、摂り過ぎれば、体脂肪が増加したり、肝機能・腎機能が低下しやすくなる。\n\n【そもそも】たんぱく質は重要な栄養素ではあるが、たとえ話として、たんぱく質が体を作るための材料＝家を建てるときの木材であり、木材だけ集めてきても家は建たない。大工さんが必要になるが、大工さんの役割をしているのが糖質である。たんぱく質は糖質があることで働くことができる。また、たんぱく質の代謝にはビタミンCや亜鉛などのビタミンやミネラルも必要、プロテインで筋肉量を増やしたいときには鉄も必要になるが、これらの栄養素はプロテイン剤に含まれていないことが多い。\n\n【正しい摂取法】食事を食べたうえで、不足している分をプロテイン剤で補うようにする。\n\n【正しく摂ると】筋肉が付き、メリハリのあるボディや、太りにくい身体が作られたり、髪や肌もキレイになったりと、健康的に美しくなれる。\n「サプリを飲んでいるから私は健康！」はリスク大\n何種類ものサプリを""とりあえず""飲んでるという人も少なくないはず。\n【間違った思い込み】忙しい私にサプリは万能！食事での栄養面が多少おろそかでも、サプリさえあれば不調にならない。\n\n【驚きの事実】\nサプリを飲むだけでは、その効果はほとんどない。\n\nサプリメントは国が制度化、定義しているものはない。表示されている栄養素の量がきちんと含有されていなかったり、粒によって含有量も異なることが多い。また、サプリはどのくらい吸収されるか、どの程度効果があるのかは、まだよくわかっていないのが現状。どのような物からその栄養素を抽出しているかが不明なことも多い。\n\n添加物が多いため、飲みすぎると肝機能の低下につながることもある。\n\n【そもそも】ビタミンやミネラルのサプリを摂るケースが多いが、ビタミン・ミネラルは、三大栄養素（糖質・脂質・たんぱく質）を体内で利用するために働く栄養素であるため、三大栄養素を摂っていない状況でサプリをとり入れても無駄。\n\n【正しい摂取法】サプリをとり入れる場合は、食事を3食しっかり食べている状態で利用すると効果を発揮する。\n\n【正しく摂ると】サプリの効果は得られやすい。\n朝夕2食はオートミールは、栄養不足に…\n何事も、それ1食に偏っては健康的とはいえない。\n【間違った思い込み】オートミールを食べると痩せられるし、健康的にキレイになれる。\n\n【驚きの事実】オートミールには不溶性の食物繊維が豊富に含まれているため、かえって便秘を悪化させることもある。また、不溶性食物繊維を摂り過ぎることで、鉄や亜鉛など美と健康に欠かせない栄養素の吸収を悪くさせることもある。食物繊維は水溶性と不溶性のバランスが大切で、どちらか一方だけを摂り過ぎるのは、便秘や下痢を招く。\n\n【そもそも】食物繊維が豊富なため、満腹感が得られやすく、食べ過ぎの予防になるが、女性は食事を食べ過ぎていないことが多く、食事量が減ることで、かえって栄養不足を招いてしまう。\n\n【正しい摂取法】1日1食程度に留めるようにする。また、オートミールの位置づけは主食であるため、主菜（肉・魚・卵・大豆製品）や副菜（野菜・海藻・きのこ・芋・豆）も一緒に食べるようにする。\n\n【正しく摂ると】オートミールにはさまざまな栄養素が含まれているため、食べ過ぎなければ、健康にも美容にも良い影響を及ぼす。\nHarper's BAZAAR JP","['https://newsatcl-pctr.c.yimg.jp/t/amd-img/20240328-00010001-bazaar-000-4-view.jpg?pri=l&w=640&h=426&exp=10800', 'https://newsatcl-pctr.c.yimg.jp/t/amd-img/20240328-00010001-bazaar-001-4-view.jpg?pri=l&w=640&h=359&exp=10800', 'https://newsatcl-pctr.c.yimg.jp/t/amd-img/20240328-00010001-bazaar-002-4-view.jpg?pri=l&w=640&h=380&exp=10800', 'https://newsatcl-pctr.c.yimg.jp/t/amd-img/20240328-00010001-bazaar-003-4-view.jpg?pri=l&w=640&h=427&exp=10800']","['https://news.yahoo.co.jp/articles/da13a55bb01a57de532f9570c25a3c8514df5228/images/000', 'https://www.harpersbazaar.com/jp/beauty/health-food/g34278925/lower-cholesterol-ghk-201006-hns/?utm_source=yahoonews&utm_medium=distribution&utm_campaign=240328_yahoo', 'https://news.yahoo.co.jp/articles/da13a55bb01a57de532f9570c25a3c8514df5228/images/001', 'https://news.yahoo.co.jp/articles/da13a55bb01a57de532f9570c25a3c8514df5228/images/002', 'https://news.yahoo.co.jp/articles/da13a55bb01a57de532f9570c25a3c8514df5228/images/003']"
