headline,mainEntityOfPage,image,datePublished,dateModified,author,media_en,media_jp,str_count,body,images,external_links
仏パラ選手が試合後にゲイであることを公表。レインボーを手に「この瞬間を待ち望んでいた」（ハフポスト日本版）,https://news.yahoo.co.jp/articles/23c987fe08728c1edcf3cbd1cc3a1df33350d86e,https://newsatcl-pctr.c.yimg.jp/t/amd-img/20240909-00010009-huffpost-000-1-view.jpg?exp=10800,2024-09-09T17:40:45+09:00,2024-09-09T17:40:45+09:00,ハフポスト日本版,huffpost,ハフポスト日本版,1278,\nパリパラリンピックの男子走り幅跳び（T64）決勝に出場したフランスのディミトリー・パヴァデ選手（2024年9月4日）\nパリ・パラリンピック男子走り幅跳びで4位に入賞したフランスのディミトリ・パヴァデ選手が、ゲイであることをカミングアウトした。\n【画像】レインボーカラーで彩られた性別記号を持って、ゲイであることを公表したディミトリー・パヴァデ選手\nパヴァデ選手は、3年前の東京大会で銀メダルを獲得している。9月4日に行われたパリ大会男子走り幅跳び（T64）決勝では、わずか0.06メートル差で表彰台に届かなかったものの、4位になった。\n\nパヴァデ選手は決勝後の7日、レインボーカラーで彩られた男性を表す性別記号を手にして微笑む写真をインスタグラムに投稿し、ゲイであることを伝えた。\n\nキャプションには「新たな闘いが待っています。この瞬間を待ち望んでいました。周りに何を言われようとどう思われようと関係ありません。私はもう一度立ち向かい、克服し、前進する準備ができています」とつづっている。\n\n「私は小柄で、メティス（先住民族とフランス系住民のあいだに生まれた子ども）で、足は一本です。そして、ゲイなのです！！！」\n\n「私や同じような立場の人たちは、自ら選択したわけではありません。だから、惨めなスピーチや根拠のない批判はやめてほしい。それで世界を変えることはできません」\n\n男子走り幅跳び（T64）で跳躍するフランスのディミトリー・パヴァデ選手（2024年9月4日）\n\nオリンピック公式サイトによると、パヴァデ選手はマダガスカル島の約680キロ東にあるフランス領レユニオン島で生まれ育った。\n\n2007年のクリスマス・イブに、職場だったレユニオン島の港でフォークリフトにはねられて負傷し、右足の脛骨（けいこつ）を切断したという。\n\n事故後、パヴァデ選手は再び自力で歩くことを決意し、リハビリを懸命に行った。その決意が現実となった後に出会ったのが、パラ陸上競技だった。\n\nブレード（板バネ）を使って、走ったり跳躍したりすることを学んだパヴァデ選手は、走り幅跳びのフランス代表になり、パラリンピックのほか欧州選手権や世界選手権に出場している。\n\nパヴァデ選手は、これまで障害者を代表する人になりたいという夢を持っていたが、LGBTQIA+コミュニティのために闘いたいという願いも加わったとインスタグラムで伝えている。\n\nまた、ありのままに生きるのが難しいと感じているアスリートや、自分のアイデンティティを公表できない人々に「強さと勇気」を与える存在でありたいともつづっている。\n\n「障害は隠したり恥じたりするものではありません。性的指向も同じです」\n\n「だから自分自身を受け入れて、孤独ではないことを忘れないでほしい。人生はとてもに短く、たくさんの美しいものがあるのですから」\n\nアウトスポーツによると、パヴァデ選手を含めて5人のゲイをカミングアウトした選手がパリパラリンピックに出場している。,['https://newsatcl-pctr.c.yimg.jp/t/amd-img/20240909-00010009-huffpost-000-1-view.jpg?pri=l&w=640&h=410&exp=10800'],"['https://news.yahoo.co.jp/articles/23c987fe08728c1edcf3cbd1cc3a1df33350d86e/images/000', 'https://www.huffingtonpost.jp/entry/story_jp_66de6544e4b01b464f3de26b?utm_hp_ref=yahoo']"
三谷幸喜さん、「一緒に仕事をしたい俳優」を明かす。あらゆる仕事に通じる、本質を突いた回答に共感広がる（ハフポスト日本版）,https://news.yahoo.co.jp/articles/3c1a84ad33f8eea331601a6e1e2cfdfca200ec49,https://newsatcl-pctr.c.yimg.jp/t/amd-img/20240909-00010008-huffpost-000-4-view.jpg?exp=10800,2024-09-09T17:04:20+09:00,2024-09-09T17:17:12+09:00,ハフポスト日本版,huffpost,ハフポスト日本版,528,\n三谷幸喜さん\n脚本家の三谷幸喜さんが9月8日放送のフジテレビ系列「だれか to なかい」に出演。番組で明かした「一緒に仕事をしたい俳優」に関する発言が反響を呼んでいます。\n\nこの番組は、俳優の中居正広さんとムロツヨシさんがMCを務め、ゲストを2人招いて、MCを含めた4人でトークを繰り広げる番組。8日には、三谷さんと俳優の西島秀俊さんがゲストで登場しました。\n\n三谷さんは、西島さんが出演する映画「スオミの話をしよう」で脚本・監督を務めました。\n\nスタジオがさまざまな話題で盛り上がる中、話題は三谷さんが「一緒に仕事をしたい俳優」に。\n\n三谷さんによると、「共通言語があるかないか」が重要だといいます。\n\n「どんな俳優さんであっても、長年の経験から、時間をかければ（こちらの）意図は伝わる。それが10分、20分かかる人よりも、一瞬で伝わる人の方がそれだけ別のことに時間が使える」と三谷さん。\n\nその上で、「そう意味で僕にとって西島さんは、共通言語がある」と続けました。\n\nこのやり取りにSNSでは「凄く分かるなー」「どの仕事にも通じるよなって」「首もげるくらい頷いた」などのコメントが寄せられています。\nハフポスト日本版,['https://newsatcl-pctr.c.yimg.jp/t/amd-img/20240909-00010008-huffpost-000-4-view.jpg?pri=l&w=464&h=640&exp=10800'],['https://news.yahoo.co.jp/articles/3c1a84ad33f8eea331601a6e1e2cfdfca200ec49/images/000']
「ガヤさん好きだよね？」内田有紀さん、中居正広さんとその“後輩”との共演へ。「デビューの頃から好き」20年前とのビフォアフも話題（ハフポスト日本版）,https://news.yahoo.co.jp/articles/9aea4412a5dbec9b187e3236326534f68afa563d,https://newsatcl-pctr.c.yimg.jp/t/amd-img/20240909-00010006-huffpost-000-1-view.jpg?exp=10800,2024-09-09T15:48:29+09:00,2024-09-09T15:48:29+09:00,ハフポスト日本版,huffpost,ハフポスト日本版,543,\n内田有紀さん\n俳優の内田有紀さんが、9月22日に放送されるフジテレビ系列の「だれか to なかい」に出演することが明らかになりました。番組では意外な人物と共演することが分かり、話題を呼んでいます。\n【ビフォーアフター画像】内田有紀さん、2000年に撮影された貴重な写真と現在の姿がこれだ\nこの番組は、俳優の中居正広さんとムロツヨシさんがMCを務め、ゲストを2人招いて、MCを含めた4人でトークを繰り広げる番組。22日には内田さんとKis-My-Ft2の藤ヶ谷大輔さんがゲストで登場します。\n\n予告動画では、藤ヶ谷さんが中居さんに物申す姿や内田さんが中居さんにツッコミを入れる姿が紹介されています。\n\n中居さんと藤ヶ谷さんは、元々同じ事務所の先輩と後輩の関係。内田さんと藤ヶ谷さんはドラマ「華麗なる一族」（2021年 WOWOW）で共演経験があります。\n\nSNSでは、「好きな人同士の共演は嬉しすぎる」「ここにきてガヤさんと中居くん」「ガヤさんも内田さんのこと好きだよね？」「内田有紀デビューの頃からずっと好き」「昔も今も好きすぎる」「中居さん×内田さんは絶対見たい」「中居くんと藤ヶ谷さんはエモいな」「楽しみ」などのコメントが寄せられています。\nハフポスト日本版,['https://newsatcl-pctr.c.yimg.jp/t/amd-img/20240909-00010006-huffpost-000-1-view.jpg?pri=l&w=426&h=640&exp=10800'],"['https://news.yahoo.co.jp/articles/9aea4412a5dbec9b187e3236326534f68afa563d/images/000', 'https://www.huffingtonpost.jp/entry/story_jp_66de7b96e4b05e7aac7c2a6a?utm_hp_ref=yahoo']"
【光る君へ】『おじゃる丸』バージョンの朗読に「可愛すぎ」と話題沸騰　『源氏物語・空蝉』の一節（ハフポスト日本版）,https://news.yahoo.co.jp/articles/abf2dbf99d690244b62f12d34ec9518ef4b8d8da,https://newsatcl-pctr.c.yimg.jp/t/amd-img/20240909-00010007-huffpost-000-1-view.jpg?exp=10800,2024-09-09T16:56:01+09:00,2024-09-09T16:56:01+09:00,ハフポスト日本版,huffpost,ハフポスト日本版,363,\n西村ちなみさん\n現在放送中のNHK大河ドラマ、『光る君へ』の公式Xに9月8日、NHKのEテレで放送中のアニメ『おじゃる丸』の声優が源氏物語の『空蝉』一節を朗読する動画がアップロードされて話題になっています。\n【動画】「でおじゃる～」と独特の喋り方で源氏物語を朗読する西村さん\n『おじゃる丸』は、妖精貴族のミヤビなお子さま・「坂ノ上おじゃる丸」が主人公の人気アニメ作品。\n\nその声を担当する西村ちなみさんが、『光る君へ』の「目覚め」（第34回）で、筑前の命婦（ちくぜんのみょうぶ）役で俳優として出演したことからコラボが実現したようです。\n\nおじゃる丸の個性的な声による朗読に対し、ファンからは「おじゃる丸バージョン可愛すぎる」「じわじわときて笑った」といった反応が寄せられました。\n田中祥子／ハフポスト日本版,['https://newsatcl-pctr.c.yimg.jp/t/amd-img/20240909-00010007-huffpost-000-1-view.jpg?pri=l&w=640&h=329&exp=10800'],"['https://news.yahoo.co.jp/articles/abf2dbf99d690244b62f12d34ec9518ef4b8d8da/images/000', 'https://www.huffingtonpost.jp/entry/story_jp_66de7552e4b05e7aac7c28db?kqj?utm_hp_ref=yahoo']"
速水もこみちさん、豪華なキャンプ料理に「寿司」も⇒完成度に「おいしそう」「すごい」の声（ハフポスト日本版）,https://news.yahoo.co.jp/articles/fcb69b46daa499a8ba2419ee719dcacb62afc2d7,https://newsatcl-pctr.c.yimg.jp/t/amd-img/20240909-00010005-huffpost-000-1-view.jpg?exp=10800,2024-09-09T14:45:56+09:00,2024-09-09T14:45:56+09:00,ハフポスト日本版,huffpost,ハフポスト日本版,360,\n速水もこみちさん\n俳優の速水もこみちさんが9月、自身のインスタグラムを更新。豪華なキャンプ料理を公開し話題となっています。\n【動画】キャンプで料理！速水もこみちさんの豪華すぎるキャンプ飯\n速水さんは「DAY CAMP」とつづり、キャンプ場で作った料理を公開。ラム肉を使った寿司やカツ、ステーキ、イタリア料理のカプレーゼとパスタなど、一流料理店のような、豪華なキャンプ料理がアップされています。\n\nまた、速水さんが真剣な表情でラム肉を切る動画や、焚き火グリルでご飯や貝を調理する写真も公開しています。\n\n公開された写真には「三つ星レストランより三つ星」「おしゃれなキャンプ飯ですね」「豪華すぎるキャンプ飯、すごいです」「一緒にキャンプに行きたい」「本当においしそうです」などのコメントが寄せられています。,['https://newsatcl-pctr.c.yimg.jp/t/amd-img/20240909-00010005-huffpost-000-1-view.jpg?pri=l&w=640&h=341&exp=10800'],"['https://news.yahoo.co.jp/articles/fcb69b46daa499a8ba2419ee719dcacb62afc2d7/images/000', 'https://www.huffingtonpost.jp/entry/story_jp_66de71a6e4b0850940b53185?utm_hp_ref=yahoo']"
プロ野球マスコット「スターマン」と「ジャビット」が日向坂46の「踊ってみた」動画を披露⇒「かわいすぎる」と反響（ハフポスト日本版）,https://news.yahoo.co.jp/articles/30bd089155edfd6f7987365f6edc8c981140df44,https://newsatcl-pctr.c.yimg.jp/t/amd-img/20240909-00010004-huffpost-000-1-view.jpg?exp=10800,2024-09-09T14:38:14+09:00,2024-09-09T14:38:14+09:00,ハフポスト日本版,huffpost,ハフポスト日本版,523,\nジャビット公式インスタより\n読売ジャイアンツのマスコット・ジャビットの公式インスタグラムが9月8日、横浜DeNAベイスターズのマスコット・スターマンと日向坂46の楽曲『君しか勝たん』を踊る動画を公開しました。\n【動画】日向坂46の『君しか勝たん』を踊るスターマンとジャビット\n9月7日と8日に東京ドームで行われた読売ジャイアンツ戦に来場したスターマン。ジャビット一家とともに、球場を盛り上げました。\n\nジャビットはインスタグラムに「スターマンありがとう」とつづり、スターマンとジャビットくんの妹ビッキーが踊る動画をアップ。日向坂46の楽曲『君しか勝たん』に合わせて、ダンスを踊っています。\n\n日向坂46は、9月7日と8日に読売ジャイアンツのキャンプ地である宮崎県のサンマリンスタジアム宮崎で「ひなたフェス2024」を開催しました。このことを意識したダンスだったのかもしれません。ジャビットは投稿に「\n＃日向坂46\n」「\n＃踊ってみた\n」のハッシュタグをつけました。\n\nこの動画にファンからは「スターマンのダンスかわいい」「ひなたフェスやってるからタイムリーですね」「みんなかわいい」などのコメントが寄せられています。,['https://newsatcl-pctr.c.yimg.jp/t/amd-img/20240909-00010004-huffpost-000-1-view.jpg?pri=l&w=640&h=363&exp=10800'],"['https://news.yahoo.co.jp/articles/30bd089155edfd6f7987365f6edc8c981140df44/images/000', 'https://www.huffingtonpost.jp/entry/story_jp_66de6f2de4b05e7aac7c280a?utm_hp_ref=yahoo', 'https://news.yahoo.co.jp/search?p=%EF%BC%83%E6%97%A5%E5%90%91%E5%9D%8246&source=article-body', 'https://news.yahoo.co.jp/search?p=%EF%BC%83%E8%B8%8A%E3%81%A3%E3%81%A6%E3%81%BF%E3%81%9F&source=article-body']"
「ウォーターボーイズ2が懐かしい」鈴木えみさんが13年ぶりにテレビ出演へ。最新の“近影”が異例の先行公開、その姿に反響（ハフポスト日本版）,https://news.yahoo.co.jp/articles/1d84c815d41184e719c69e7e182ea28fb7d14bd1,https://newsatcl-pctr.c.yimg.jp/t/amd-img/20240909-00010002-huffpost-000-1-view.jpg?exp=10800,2024-09-09T12:20:44+09:00,2024-09-09T12:20:44+09:00,ハフポスト日本版,huffpost,ハフポスト日本版,605,\nStephane Cardinale - Corbis via Getty Images\nモデルの鈴木えみさんが、13年ぶりにテレビ出演をすることが明らかになり、話題になっている。\n【ビフォーアフター画像】14歳⇨38歳に。貴重なモデルデビュー当時の姿と今の鈴木えみさんがこれだ\n鈴木さんは、9月15日放送の日本テレビ系のトーク番組「おしゃれクリップ」に出演する。\n\n鈴木さんは、ファッション雑誌「SEVENTEEN」でモデルデビュー。「えみちぃ」の愛称で親しまれ、俳優として「ウォーターボーイズ2」（2004年）などにも出演した。\n\n近年はテレビへは出演していなかったが、現在もモデルとして活躍し、SNSなどでも私生活の様子を投稿している。\n\n今回の番組出演にあたり、「おしゃれクリップ」の公式Xでは鈴木さんのクリップ写真が先行公開された。同番組では通常、ゲストのクリップ写真は放送終了後に公開されるが、異例の対応となった。\n\n鈴木さんの近影写真には、「またテレビで見れる日が来るなんて」「セブンティーンの時から大好き」「ウォーターボーイズ2観てた。懐かしい」などのコメントが寄せられている。\n\n番組では、鈴木さんの過去の苦悩が明かされるほか、友人の山田孝之さんや榮倉奈々さんからのメッセージ、夫・娘とのエピソードなども紹介され、鈴木さんの素顔に迫るという。\nハフポスト日本版,['https://newsatcl-pctr.c.yimg.jp/t/amd-img/20240909-00010002-huffpost-000-1-view.jpg?pri=l&w=435&h=640&exp=10800'],"['https://news.yahoo.co.jp/articles/1d84c815d41184e719c69e7e182ea28fb7d14bd1/images/000', 'https://www.huffingtonpost.jp/entry/story_jp_66de49ace4b01b464f3dddc8?utm_hp_ref=yahoo']"
西山茉希さん、斬新な「お好みトッピング冷麺」のレシピ公開　具材を小皿に入れて…（ハフポスト日本版）,https://news.yahoo.co.jp/articles/98dd3c0a760ae73b58dddcb4c40f7751e84e52fa,https://newsatcl-pctr.c.yimg.jp/t/amd-img/20240909-00010003-huffpost-000-1-view.jpg?exp=10800,2024-09-09T14:36:06+09:00,2024-09-09T14:36:06+09:00,ハフポスト日本版,huffpost,ハフポスト日本版,405,\n西山茉希さん\nモデルでタレントの西山茉希さんが9月9日、自身のインスタグラムを更新。一風変わった冷麺を公開し、話題となっています。\n【画像】斬新！な西山茉希さんの冷麺スタイル\n西山さんは「お好みトッピング冷麺」とつづり、素の冷麺とトマト、きゅうり、牛肉玉ねぎオイスターソース、納豆、ナスとしめじのコチュジャン、トマトとナスの白だし酢漬けを小皿に入れ、並べた写真をアップしました。\n\n並べられた食材をお好みで冷麺に入れて食べるスタイルのようで、西山さんは冷麺の小皿にきゅうり、トマト、牛肉玉ねぎオイスターソースを入れる写真も公開しました。\n\n西山さんは料理を得意とする芸能人の1人で、インスタグラムに「\n＃西山食堂\n」のハッシュタグとともに、料理の写真を定期的に公開。「お好みトッピング冷麺」のような工夫を凝らした料理が人気となっています。今回の投稿にも多数の「いいね」が寄せられています。,['https://newsatcl-pctr.c.yimg.jp/t/amd-img/20240909-00010003-huffpost-000-1-view.jpg?pri=l&w=640&h=376&exp=10800'],"['https://news.yahoo.co.jp/articles/98dd3c0a760ae73b58dddcb4c40f7751e84e52fa/images/000', 'https://www.huffingtonpost.jp/entry/story_jp_66de6d09e4b05e7aac7c27e6?utm_hp_ref=yahoo', 'https://news.yahoo.co.jp/search?p=%EF%BC%83%E8%A5%BF%E5%B1%B1%E9%A3%9F%E5%A0%82&source=article-body']"
「家族に囲まれずひとりで亡くなりました」娘から母への辛辣すぎる「追悼記事」が話題【アメリカ】（ハフポスト日本版）,https://news.yahoo.co.jp/articles/f67f204c3d403657431edc16bc3f2f6962ac4511,https://newsatcl-pctr.c.yimg.jp/t/amd-img/20240909-00010001-huffpost-000-1-view.jpg?exp=10800,2024-09-09T12:16:24+09:00,2024-09-09T12:16:24+09:00,ハフポスト日本版,huffpost,ハフポスト日本版,805,\nイメージ画像\nアメリカの新聞に掲載された娘から母への追悼記事が「辛辣すぎる」と話題になっている。\n\nアメリカ・メイン州の新聞「ケネベック・ジャーナル」に8月30日、クリスティーナ・ノヴァックさんが書いた母親フローレンス・「フロー」・ハレルソンさんへの追悼文が掲載された。\n\n追悼文はとても短く、65歳のハレルソンさんには「家族関係の破壊でこれまで絶縁状態にあり、家族に囲まれずひとりで亡くなりました」との言葉が贈られた。\n\nそして「フローレンスは追悼記事を嫌がり、家族を含め誰にも死を知られたくありませんでした。それは死んでもなお、自分が恐怖のどん底に突き落とした人たちが怯えながら生きることを望んだからです。そのため、これは追悼記事というより、公共広告のようなものです」と締め括った。\n\nこの追悼記事はあまりにも辛辣な内容で話題になったが、ノヴァックさんはこれは真面目に書いたものだと語っている。\n\n「これは公共広告で、冗談ではありません。皮肉と安堵の意味を込めて書いたものですが、現実です」と米People誌に述べた。\n\n記事を簡潔にしたのは、追悼記事は1文字単位で料金がかかるため「あの人のために1ドルたりとも余計に使いたくなかった」からだという。\n\nノヴァックさんは、母親は「クリスマスや家族の誕生日を台無しにすることに喜びを感じていた」と言い、小さい頃には母親とそのパートナーに橋に連れて行かれ、足を掴まれ水に投げ込むようなふりをされたと主張している。その経験により、今でもパニック発作を起こすことがあるという。\n\nノヴァックさんは、新聞社に追悼記事を提出する前に、母親の双子の姉妹の承諾を得たという。しかしこの記事が地元のコミュニティを超えて注目されることは予想外だったという。\n\nハフポストUS版の記事を翻訳・編集しました。\nHilary Hanson,['https://newsatcl-pctr.c.yimg.jp/t/amd-img/20240909-00010001-huffpost-000-1-view.jpg?pri=l&w=640&h=575&exp=10800'],['https://news.yahoo.co.jp/articles/f67f204c3d403657431edc16bc3f2f6962ac4511/images/000']
身近にあるもので“セルフ足裏マッサージ”ができる⇨「簡単そう」と話題。警視庁が発信、エコノミー症候群の予防にも（ハフポスト日本版）,https://news.yahoo.co.jp/articles/e91b9f60bc83f75525a6d0f5996e6e2958ed6529,https://newsatcl-pctr.c.yimg.jp/t/amd-img/20240909-00010000-huffpost-000-1-view.jpg?exp=10800,2024-09-09T10:25:09+09:00,2024-09-09T10:25:09+09:00,ハフポスト日本版,huffpost,ハフポスト日本版,364,\nイメージ（mapo via Getty Images）\n警視庁災害対策課の公式X（@MPD_bousai）が9月9日、身近なアイテムでできる“セルフ足裏マッサージ”の方法を発信し、話題になっています。\n【画像で確認】コレをこう動かすと「セルフ足裏マッサージ」ができる\n足裏マッサージの方法とは\n警視庁の投稿によると、自分で足裏マッサージをする時に役立つアイテムは、ゴルフボールや栄養ドリンクの瓶。\n\nゴルフボールは円を描くように、栄養ドリンクの瓶は前後に動かすことで足裏をマッサージできるそうです。\n\nまた、災害時に車中泊した際などに行うと、エコノミー症候群の予防にもつながるとしていました。\n\nこの投稿には、「簡単そう」「新幹線で足先の屈伸運動をやって足の疲れを取ってる」といった声が寄せられています。,['https://newsatcl-pctr.c.yimg.jp/t/amd-img/20240909-00010000-huffpost-000-1-view.jpg?pri=l&w=640&h=426&exp=10800'],"['https://news.yahoo.co.jp/articles/e91b9f60bc83f75525a6d0f5996e6e2958ed6529/images/000', 'https://www.huffingtonpost.jp/entry/story_jp_66de36ebe4b0850940b528da?d99?utm_hp_ref=yahoo']"
