headline,mainEntityOfPage,image,datePublished,dateModified,author,media_en,media_jp,str_count,body,images,external_links
梁が単独首位に 山下2位浮上、渋野5位タイ 全米女子プロ（ＡＦＰ＝時事）,https://news.yahoo.co.jp/articles/25c236d2feeeb08039f2f9b19a9e20c6bf67a07f,https://newsatcl-pctr.c.yimg.jp/t/amd-img/20240623-00000006-jij_afp-000-2-view.jpg?exp=10800,2024-06-23T11:52:23+09:00,2024-06-23T11:55:01+09:00,ＡＦＰ＝時事,jij_afp,ＡＦＰ＝時事,769,\n女子ゴルフ米国ツアーメジャー第3戦、全米女子プロゴルフ選手権3日目。2番でパーを取った梁熙英（2024年6月22日撮影）。【翻訳編集】 AFPBB News\n【AFP＝時事】女子ゴルフ米国ツアーのメジャー第3戦、全米女子プロゴルフ選手権（KPMG Women's PGA Championship 2024）は22日、米ワシントン州サマミッシュ（Sammamish）のサハリーCC（Sahalee Country Club、パー72）で3日目が行われ、メジャー初優勝を狙う梁熙英（Amy Yang、エミー・ヤン、韓国）が「71」で通算7アンダーとし、後続と2打差の首位で最終日を迎えることになった。\n【写真14枚】3日目に臨む山下や渋野\n22歳の山下美夢有（Miyu Yamashita）が「70」で通算5アンダーに伸ばし、ローレン・ハートレッジ（Lauren Hartlage、米国）と並んで2位タイに浮上した。世界272位のハートレッジもノーボギーの「69」を記録した。\n\n ヤンと共に首位から出たサラ・シュメルツェル（Sarah Schmelzel、米国）は「74」をたたき、通算4アンダーの4位に後退。3位タイから出た渋野日向子（Hinako Shibuno）は「73」でスコアを一つ落とし、通算3アンダーの5位タイとなった。\n\n その他の日本勢は岩井明愛（Akie Iwai）が通算1オーバーの18位タイ、勝みなみ（Minami Katsu）と西郷真央（Mao Saigo）が通算3オーバーの31位タイ、竹田麗央（Rio Takeda）と古江彩佳（Ayaka Furue）が通算4オーバーの38位タイ、笹生優花（Yuka Saso）が通算10オーバーの67位タイとなっている。【翻訳編集】 AFPBB News,['https://newsatcl-pctr.c.yimg.jp/t/amd-img/20240623-00000006-jij_afp-000-2-view.jpg?pri=l&w=640&h=426&exp=10800'],"['https://news.yahoo.co.jp/articles/25c236d2feeeb08039f2f9b19a9e20c6bf67a07f/images/000', 'https://www.afpbb.com/articles/-/3525562?pid=26985719&tmpl_skin=gallery&utm_source=yahoo&utm_medium=news&cx_from=yahoo&cx_position=p1&cx_rss=afp&cx_id=3525562']"
ガザ空爆で新たに24人死亡 保健当局（ＡＦＰ＝時事）,https://news.yahoo.co.jp/articles/1c2e5e69d7ae5c2d5f5ab978864be412b9acf99b,https://newsatcl-pctr.c.yimg.jp/t/amd-img/20240623-00000003-jij_afp-000-2-view.jpg?exp=10800,2024-06-23T10:31:23+09:00,2024-06-23T10:34:01+09:00,ＡＦＰ＝時事,jij_afp,ＡＦＰ＝時事,661,\nパレスチナ自治区ガザのアルトゥファ地区で、イスラエル軍の空爆で親族を殺された人（2024年6月22日撮影）。【翻訳編集】 AFPBB News\n【AFP＝時事】パレスチナ自治区ガザ（Gaza）市で22日、イスラエル軍の空爆で少なくとも24人が死亡した。ガザ（Gaza Strip）の保健当局が発表した。\n【写真9枚】空爆の犠牲者の遺体を運ぶ人や、空爆を受けた難民キャンプの様子\nこれに先立ち、保健当局は同日、過去48時間で少なくとも120人が空爆で死亡したとしていた。\n\n ガザの民間防衛当局の広報担当者はAFPに対し、アルトゥファ（Al-Tuffah）地区で家屋が空爆を受け、少なくとも20人が死亡、アルシャティ（Al-Shati）難民キャンプでも4人が亡くなったと語った。\n\n アルシャティ難民キャンプで空爆を目撃した人は、人々はいつも通りの生活を送っていたが、突然、空爆により「一帯が壊滅した」と話した。\n\n アルトゥファ地区ではがれきの中、男性たちがロバにひかせた荷車で遺体を運び出していた。\n\n イスラエル軍は、ガザ市にある「ハマス（Hamas）の軍事インフラ施設2か所」を戦闘機で攻撃中としていた。\n\n 前日には赤十字国際委員会（ICRC）が、ガザの事務所が砲撃を受けて損壊し、22人が死亡したと発表。これを受けて欧州連合（EU）のジョセップ・ボレル（Josep Borrell）外交安全保障上級代表（外相）は22日、「独立調査」の実施を求めた。【翻訳編集】 AFPBB News,['https://newsatcl-pctr.c.yimg.jp/t/amd-img/20240623-00000003-jij_afp-000-2-view.jpg?pri=l&w=640&h=426&exp=10800'],"['https://news.yahoo.co.jp/articles/1c2e5e69d7ae5c2d5f5ab978864be412b9acf99b/images/000', 'https://www.afpbb.com/articles/-/3525554?pid=26983575&tmpl_skin=gallery&utm_source=yahoo&utm_medium=news&cx_from=yahoo&cx_position=p1&cx_rss=afp&cx_id=3525554']"
ピッチ侵入でロナウドと自撮り、ポルトガル監督は選手のリスク懸念（ＡＦＰ＝時事）,https://news.yahoo.co.jp/articles/04137edabf4e1335e855f4871bc25ea4e78328cb,https://newsatcl-pctr.c.yimg.jp/t/amd-img/20240623-00000004-jij_afp-000-1-view.jpg?exp=10800,2024-06-23T11:25:17+09:00,2024-06-23T11:25:17+09:00,ＡＦＰ＝時事,jij_afp,ＡＦＰ＝時事,1000,\nサッカー欧州選手権、グループF、トルコ対ポルトガル。ピッチに侵入し、ポルトガルのクリスティアーノ・ロナウド（右）と写真を撮る観客（中央、2024年6月22日撮影）。【翻訳編集】 AFPBB News\n【AFP＝時事】サッカーポルトガル代表を率いるロベルト・マルティネス（Roberto Martinez）監督が22日、欧州選手権（UEFA Euro 2024）のトルコ戦で数人の観客がピッチに侵入し、スター選手のクリスティアーノ・ロナウド（Cristiano Ronaldo）と自撮りをしたことについて、侵入者の中に悪意を持った人物がいなくて幸運だったと話した。\n【写真】ピッチに侵入してきた少年に優しく対応するロナウド（その他全10枚）\nポルトガルが3-0で勝利したグループF第2節のトルコ戦では、警備の手を逃れてピッチに侵入した観客がロナウドと写真を撮り、後半に数度にわたって試合が中断した。\n\n 1人目の侵入者は赤い服を着た少年で、ベンチ裏の観客席からピッチに入り、ロナウドに駆け寄って写真を撮った後、警備員に捕まって拍手の中で連れ出された。ところがその後、試合中や試合後に同じことをしようと少なくとも5人がピッチに侵入。少年が侵入してきた時は笑顔だったロナウドも次第にいら立ちを募らせていった。\n\n チームがグループリーグ突破を決めた後の会見で、マルティネス監督は「心配だ。きょうは幸運にも善意のファンばかりだった」と話すと、「国の象徴であるビッグスターを認めているファンのことは、みんなが愛していると思う」とした上で「彼らが悪意を持っていたら、非常にまずいことになるのは誰でも分かる」と続けた。\n\n「そうなれば選手は無防備だし、気をつけなくてはならない。多数の警備と対策があるから、そういうことにはならないと思うが、ファンにはいいやり方ではないというメッセージを伝えるべきだ」\n\n 一方、ロナウドのチームメートのベルナルド・シウバ（Bernardo Silva）は、注目が集まるのは有名人ゆえの代償だと認め、「自分はあまり心配していない。ファンがピッチに入って試合がよく止まる点は少し不満だが、それを別にすれば、サッカー界で認められていることの代償だと思う。身の危険を感じるかという点では、少なくとも個人的には感じない」と話した。【翻訳編集】 AFPBB News,['https://newsatcl-pctr.c.yimg.jp/t/amd-img/20240623-00000004-jij_afp-000-1-view.jpg?pri=l&w=640&h=426&exp=10800'],"['https://news.yahoo.co.jp/articles/04137edabf4e1335e855f4871bc25ea4e78328cb/images/000', 'https://www.afpbb.com/articles/-/3525553?pid=26984755&tmpl_skin=gallery&utm_source=yahoo&utm_medium=news&cx_from=yahoo&cx_position=p1&cx_rss=afp&cx_id=3525553']"
ノリス「生涯最高のラップ」でPP獲得 スペインGP（ＡＦＰ＝時事）,https://news.yahoo.co.jp/articles/daec7e87c335ba718566bab5be4bde6d2a261b2a,https://newsatcl-pctr.c.yimg.jp/t/amd-img/20240623-00000002-jij_afp-000-1-view.jpg?exp=10800,2024-06-23T10:19:14+09:00,2024-06-23T10:19:14+09:00,ＡＦＰ＝時事,jij_afp,ＡＦＰ＝時事,1154,\n24F1第10戦スペインGP予選。（左から）2番手に入ったレッドブルのマックス・フェルスタッペン、ポールポジションを獲得したマクラーレンのランド・ノリス、3番手に入ったメルセデスAMGのルイス・ハミルトン（2024年6月22日撮影）。【翻訳編集】 AFPBB News\n【AFP＝時事】24F1第10戦スペインGP（Spanish Grand Prix 2024）は22日、予選が行われ、「生涯最高のラップ」を出したマクラーレン（McLaren）のランド・ノリス（Lando Norris）がポールポジションを獲得した。\n【写真】予選に臨むノリス（その他全10枚）\nノリスは1分11秒383の最速タイムをマークし、2021年のロシアGP（Russian Grand Prix 2021）以来2回目となるポールポジションを獲得。レース後には「絶対に自分のベストラップだ。完璧にこなさないとならないのは分かっていたが、おそらく生涯最高のラップが出せた」と話した。\n\n マクラーレンではこの日のフリー走行3回目の前、チームのモーターホームで火事が起こる騒ぎがあり、ノリスもストレスがあったことを認めた。一方でザック・ブラウン（Zak Brown）チーム代表は、スタッフ1人が病院へ運ばれたが、すでに退院し、全員が無事であることを報告している。\n\n レッドブル（Red Bull）の王者マックス・フェルスタッペン（Max Verstappen）はポールポジション獲得が確実かに見えたが、僅差で2番手となった。2016年のこの大会でGP初優勝を飾ったフェルスタッペンは、大会3連覇を目指している。\n\n メルセデスAMG（Mercedes AMG）のルイス・ハミルトン（Lewis Hamilton）が3番手、ジョージ・ラッセル（George Russell）が4番手に入った。フェラーリ（Ferrari）のシャルル・ルクレール（Charles Leclerc）が5番手、同僚のカルロス・サインツ・ジュニア（Carlos Sainz Jr.）が6番手となった。\n\n アルピーヌ（Alpine F1）のピエール・ガスリー（Pierre Gasly）が7番手に食い込んだ。以下はレッドブルのセルヒオ・ペレス（Sergio Perez）、アルピーヌのエステバン・オコン（Esteban Ocon）、マクラーレンのオスカー・ピアストリ（Oscar Piastri）の順となった。ペレスはカナダGP（Canadian Grand Prix 2024）でのペナルティーにより決勝は3グリッド降格となる。\n\n RBの角田裕毅（Yuki Tsunoda）は17番手だった。【翻訳編集】 AFPBB News,['https://newsatcl-pctr.c.yimg.jp/t/amd-img/20240623-00000002-jij_afp-000-1-view.jpg?pri=l&w=640&h=427&exp=10800'],"['https://news.yahoo.co.jp/articles/daec7e87c335ba718566bab5be4bde6d2a261b2a/images/000', 'https://www.afpbb.com/articles/-/3525549?pid=26983433&tmpl_skin=gallery&utm_source=yahoo&utm_medium=news&cx_from=yahoo&cx_position=p1&cx_rss=afp&cx_id=3525549']"
両陛下、英国に到着 国賓として公式行事出席へ（ＡＦＰ＝時事）,https://news.yahoo.co.jp/articles/d324c10565e0e62cab7487e8f7d756f326e3c493,https://newsatcl-pctr.c.yimg.jp/t/amd-img/20240623-00000005-jij_afp-000-2-view.jpg?exp=10800,2024-06-23T11:37:27+09:00,2024-06-23T11:55:25+09:00,ＡＦＰ＝時事,jij_afp,ＡＦＰ＝時事,621,"\n英ロンドン北東部のスタンステッド空港に到着された天皇、皇后両陛下（2024年6月22日撮影）。【翻訳編集】 AFPBB News\n【AFP＝時事】天皇、皇后両陛下は22日夕、政府専用機で英ロンドンのスタンステッド空港（London Stansted Airport）に到着された。\n【写真12枚】ロンドンのスタンステッド空港に到着された天皇、皇后両陛下\n今回の訪問はチャールズ国王（King Charles III）の招待を受けたもので、25日から3日間にわたり、国賓として公式行事に臨む。\n\n バッキンガム宮殿（Buckingham Palace）で開かれる晩さん会にも出席。ここ数か月間、がん治療のためほとんど姿を見せていないキャサリン皇太子妃（Catherine, Princess of Wales）も出席するかに関心が集まっている。\n\n 天皇陛下はロンドン西郊のウィンザー城（Windsor Castle）も訪れ、エリザベス女王（Queen Elizabeth II）の墓に花を供える予定だ。\n\n 英国は来月の総選挙を前に選挙戦の真っただ中にあることから、リシ・スナク（Rishi Sunak）首相との会談が予定に組まれるかは不明。\n\n 陛下の国際親善訪問は2023年6月のインドネシア訪問以来で、即位後2度目。チャールズ国王にとっては、即位後3度目の国賓受け入れとなる。【翻訳編集】 AFPBB News",['https://newsatcl-pctr.c.yimg.jp/t/amd-img/20240623-00000005-jij_afp-000-2-view.jpg?pri=l&w=640&h=426&exp=10800'],"['https://news.yahoo.co.jp/articles/d324c10565e0e62cab7487e8f7d756f326e3c493/images/000', 'https://www.afpbb.com/articles/-/3525558?pno=1&pid=26984523&tmpl_skin=gallery&utm_source=yahoo&utm_medium=news&cx_from=yahoo&cx_position=p1&cx_rss=afp&cx_id=3525558']"
シナーが芝で初決勝 ホルカシュと対戦へ テラ・ウォルトマンOP（ＡＦＰ＝時事）,https://news.yahoo.co.jp/articles/f10c4ff9122e565ed592e7fd315526bbb4493447,https://newsatcl-pctr.c.yimg.jp/t/amd-img/20240623-00000001-jij_afp-000-2-view.jpg?exp=10800,2024-06-23T09:40:23+09:00,2024-06-23T09:42:55+09:00,ＡＦＰ＝時事,jij_afp,ＡＦＰ＝時事,627,\n男子テニス、テラ・ウォルトマン・オープンに臨むヤニック・シナー。写真はシングルス準々決勝（2024年6月21日撮影）。【翻訳編集】 AFPBB News\n【AFP＝時事】男子テニス、テラ・ウォルトマン・オープン（2024 Terra Wortmann Open）は22日、シングルス準決勝が行われ、世界ランキング1位で大会第1シードのヤニック・シナー（Jannik Sinner、イタリア）は張之臻（Zhang Zhizhen、ジャン・ジジェン、中国）を6-4、7-6（7-3）で退け、グラス（芝）コート大会でキャリア初の決勝進出を決めた。\n【写真】同大会で優勝10回を記録したフェデラー\nシナーは「ここまで非常に厳しい4試合だったし、大きな意味がある」と喜び、「きょうも良い試合ができた」と語った。\n\n 決勝では第2シードのアレクサンダー・ズベレフ（Alexander Zverev、ドイツ）を7-6（7-2）、6-4で破った第5シードのホベルト・ホルカシュ（Hubert Hurkacz、ポーランド）と対戦する。\n\n 2022年大会覇者のホルカシュは、第1セットだけで13本のエースを記録するなど試合を通して計17本のエースを放ち、4本のブレークピンチをすべてしのいだ。ズベレフ戦は4試合目にして初勝利。「今、サーブにはかなり自信がある」と語り、芝は「自分のテニスに合っている」と手応えを口にした。【翻訳編集】 AFPBB News,['https://newsatcl-pctr.c.yimg.jp/t/amd-img/20240623-00000001-jij_afp-000-2-view.jpg?pri=l&w=640&h=426&exp=10800'],"['https://news.yahoo.co.jp/articles/f10c4ff9122e565ed592e7fd315526bbb4493447/images/000', 'https://www.afpbb.com/articles/-/3231457?tmpl_skin=gallery&utm_source=yahoo&utm_medium=news&cx_from=yahoo&cx_position=p1&cx_rss=afp&cx_id=3525552']"
ポルトガル快勝でEURO16強 ベルギーも立て直しの一勝（ＡＦＰ＝時事）,https://news.yahoo.co.jp/articles/061124914a184ad12e935bd335ea11b252a5cd2d,https://newsatcl-pctr.c.yimg.jp/t/amd-img/20240623-00000000-jij_afp-000-2-view.jpg?exp=10800,2024-06-23T09:16:34+09:00,2024-06-23T09:19:03+09:00,ＡＦＰ＝時事,jij_afp,ＡＦＰ＝時事,1031,\nサッカー欧州選手権、グループF、トルコ対ポルトガル。ベルナルド・シウバ（右から3人目）が決めた先制点を喜び合うポルトガルの選手（2024年6月22日撮影）。【翻訳編集】 AFPBB News\n【AFP＝時事】サッカー欧州選手権（UEFA Euro 2024）は22日、グループリーグの試合が行われ、グループFのポルトガルは3-0でトルコに快勝し、16強入りを決めた。\n【写真】ピッチに侵入してきた子どもと自撮りに応じるロナウド（その他全15枚）\n2016年大会覇者で、今大会の優勝候補にも挙げられているポルトガルは、21分にベルナルド・シウバ（Bernardo Silva）のゴールで先制すると、28分にオウンゴールで追加点。56分にはゴール前でGKと1対1になったクリスティアーノ・ロナウド（Cristiano Ronaldo）がパスを選択するチームプレーを見せ、これを受けたブルーノ・ミゲル・フェルナンデス（Bruno Miguel Fernandes）が落ち着いて流し込んだ。\n\n 内容的にも完勝を収めたポルトガルは、これでチェコとの初戦から2連勝とし、組首位通過が確定した。26日のグループ最終戦ではジョージアと対戦する。\n\n ジョージアは同日、チェコと1-1で引き分け、主要国際大会で初の勝ち点を獲得した。\n\n 試合はジョージアがゲオルゲス・ミカウターゼ（Georges Mikautadze）のPKで前半に先制したが、チェコも後半にパトリック・シック（Patrik Schick）のゴールで追いつき、勝ち点1を分け合った。\n\n グループFはポルトガルが勝ち点6で首位に立ち、トルコが同3で2位、チェコとジョージアが同1で並んでいる。\n\n グループEのベルギーは2-0でルーマニアに勝利。初戦スロバキア戦の黒星から立て直し、勝ち上がりへ望みをつないだ。\n\n ベルギーは開始2分にロメルー・ルカク（Romelu Lukaku）の落としからユーリ・ティーレマンス（Youri Tielemans）が先制のゴールネットを揺らすと、80分に主将ケビン・デ・ブルイネ（Kevin De Bruyne）が勝負を決める2点目を入れた。\n\n 同組はこれで全4チームが勝ち点3で並ぶ混戦となっている。最終節はベルギーがウクライナと、ルーマニアがスロバキアと決勝トーナメント進出を懸けて顔を合わせる。【翻訳編集】 AFPBB News,['https://newsatcl-pctr.c.yimg.jp/t/amd-img/20240623-00000000-jij_afp-000-2-view.jpg?pri=l&w=640&h=426&exp=10800'],"['https://news.yahoo.co.jp/articles/061124914a184ad12e935bd335ea11b252a5cd2d/images/000', 'https://www.afpbb.com/articles/-/3525550?pid=26986295&tmpl_skin=gallery&utm_source=yahoo&utm_medium=news&cx_from=yahoo&cx_position=p1&cx_rss=afp&cx_id=3525550']"
