headline,mainEntityOfPage,image,datePublished,dateModified,author,media_en,media_jp,str_count,body,images,external_links
ブルーズがスーパーラグビー制覇 チーフスに大勝（ＡＦＰ＝時事）,https://news.yahoo.co.jp/articles/c9d236ba4687500b2913c499bc1f4e8b30464ec7,https://newsatcl-pctr.c.yimg.jp/t/amd-img/20240623-00000015-jij_afp-000-2-view.jpg?exp=10800,2024-06-23T16:25:15+09:00,2024-06-23T16:27:51+09:00,ＡＦＰ＝時事,jij_afp,ＡＦＰ＝時事,628,\nスーパーラグビー・パシフィック、プレーオフ決勝、ブルーズ対チーフス。優勝を喜ぶブルーズの選手（2024年6月22日撮影）。【翻訳編集】 AFPBB News\n【AFP＝時事】スーパーラグビー・パシフィック（2024 Super Rugby Pacific）は23日、ニュージーランド・オークランド（Auckland）のイーデン・パーク（Eden Park）でプレーオフ決勝が行われ、ブルーズ（Blues、ニュージーランド）が41-10でチーフス（Gallagher Chiefs、ニュージーランド）を下し、完全な形のスーパーラグビーとしては2003年以来となる優勝を飾った。\n【写真】優勝を喜ぶブルーズのクラーク（その他全7枚）\n雨のイーデン・パークでパワーの差を容赦なく見せつけたブルーズは、ケイレブ・クラーク（Caleb Clarke）がハットトリックを達成するなど5トライを奪取。チーフスは3-20とビハインドを背負って前半を終えると、ダミアン・マッケンジー（Damian McKenzie）を無力化されて完封に近い負け方を喫した。\n\n 大会は7連覇中だったクルセイダーズ（Crusaders、ニュージーランド）がプレーオフに勝ち進めずに敗退。ブルーズが新型コロナウイルスのパンデミック（世界的な大流行）によって縮小されて行われた2021年のスーパーラグビー・トランスタスマン大会以来の優勝を果たした。【翻訳編集】 AFPBB News,['https://newsatcl-pctr.c.yimg.jp/t/amd-img/20240623-00000015-jij_afp-000-2-view.jpg?pri=l&w=640&h=426&exp=10800'],"['https://news.yahoo.co.jp/articles/c9d236ba4687500b2913c499bc1f4e8b30464ec7/images/000', 'https://www.afpbb.com/articles/-/3525575?pid=26982354&tmpl_skin=gallery&utm_source=yahoo&utm_medium=news&cx_from=yahoo&cx_position=p1&cx_rss=afp&cx_id=3525575']"
コパカバーナ海岸で日の出ヨガ ブラジル（ＡＦＰ＝時事）,https://news.yahoo.co.jp/articles/3ad85f73729a7be45943e932fca7a9a6503d8dc5,https://newsatcl-pctr.c.yimg.jp/t/amd-img/20240623-00000013-jij_afp-000-2-view.jpg?exp=10800,2024-06-23T15:04:16+09:00,2024-06-23T15:06:56+09:00,ＡＦＰ＝時事,jij_afp,ＡＦＰ＝時事,259,\nブラジル・リオデジャネイロのコパカバーナビーチで、日の出に合わせてヨガをするイベントに参加する人々（2024年6月22日撮影）。【翻訳編集】 AFPBB News\n【AFP＝時事】ブラジル南東部リオデジャネイロ（Rio de Janeiro）の、大西洋に面したコパカバーナビーチ（Copacabana Beach）で22日、日の出に合わせてヨガを行うイベントが開かれた。\n\n 夜明け前からビーチに集まった多数の参加者は、ヨガマットを砂浜に敷き、一斉に同じポーズを取っていた。【翻訳編集】 AFPBB News,['https://newsatcl-pctr.c.yimg.jp/t/amd-img/20240623-00000013-jij_afp-000-2-view.jpg?pri=l&w=640&h=480&exp=10800'],['https://news.yahoo.co.jp/articles/3ad85f73729a7be45943e932fca7a9a6503d8dc5/images/000']
米リチャードソンが100mでパリ切符 東京五輪は直前で出場禁止（ＡＦＰ＝時事）,https://news.yahoo.co.jp/articles/94344c96a0588a28457726d4ad27a728e1150f4c,https://newsatcl-pctr.c.yimg.jp/t/amd-img/20240623-00000017-jij_afp-000-2-view.jpg?exp=10800,2024-06-23T17:28:31+09:00,2024-06-23T17:31:30+09:00,ＡＦＰ＝時事,jij_afp,ＡＦＰ＝時事,623,\n陸上のパリ五輪米国代表選考会。女子100メートル決勝で優勝し喜ぶシャカリ・リチャードソン（2024年6月22日撮影）。【翻訳編集】 AFPBB News\n【AFP＝時事】陸上のパリ五輪米国代表選考会が22日、米オレゴン州ユージーン（Eugene）で行われ、女子100メートルではシャカリ・リチャードソン（Sha'Carri Richardson）が優勝し、代表入りを決めた。\n【写真】金メダルを手にするリチャードソンの手の爪（その他全4枚）\nリチャードソンは中盤で先頭に立つと、追い風0.8メートルの中で今季世界最高となる10秒71をマーク。メリッサ・ジェファーソン（Melissa Jefferson）が10秒80で2位、トワニシャ・テリー（Twanisha Terry）が10秒89で3位に入った。\n\n リチャードソンは「光栄に思う。これまでの人生の一つ一つが、この瞬間のためにデザインされ、用意されたものだったように感じる」と喜び、「パリで国を代表するのが待ちきれない」とコメントした。\n\n 2021年の東京五輪では、リチャードソンは予選会を制して本大会出場が確実になっていたが、薬物検査で大麻の陽性反応が出て1か月の出場禁止を科され、五輪出場を逃していた。パリでは米国勢として1996年アトランタ五輪のゲイル・ディバース（Gail Devers）以来となる同種目の金メダル獲得を目指す。【翻訳編集】 AFPBB News,['https://newsatcl-pctr.c.yimg.jp/t/amd-img/20240623-00000017-jij_afp-000-2-view.jpg?pri=l&w=640&h=426&exp=10800'],"['https://news.yahoo.co.jp/articles/94344c96a0588a28457726d4ad27a728e1150f4c/images/000', 'https://www.afpbb.com/articles/-/3525581?pid=26986612&tmpl_skin=gallery&utm_source=yahoo&utm_medium=news&cx_from=yahoo&cx_position=p1&cx_rss=afp&cx_id=3525581']"
マルコス大統領、比は「畏縮せず」 中国念頭に（ＡＦＰ＝時事）,https://news.yahoo.co.jp/articles/7b55d944cfe2a5d2692e6531ce422ffee0c662f1,https://newsatcl-pctr.c.yimg.jp/t/amd-img/20240623-00000016-jij_afp-000-2-view.jpg?exp=10800,2024-06-23T17:13:26+09:00,2024-06-23T17:16:29+09:00,ＡＦＰ＝時事,jij_afp,ＡＦＰ＝時事,725,\n南シナ海のアユンギン礁付近で、フィリピン船（中央）に近付く中国海警局の船上で刃物をかざす乗組員（中央右）。比軍撮影の動画より（2024年6月17日撮影、19日公開）。【翻訳編集】 AFPBB News\n【AFP＝時事】フィリピンのフェルディナンド・マルコス（Ferdinand Marcos）大統領は23日、南シナ海（South China Sea）で同国海軍と中国海警局の船舶が衝突したことをめぐり、フィリピンは「畏縮しない」と強調した。\n【写真5枚】フィリピンの硬式ゴムボートにナイフを突き刺す中国海警局の隊員\n南シナ海のアユンギン礁（セカンド・トーマス礁、Second Thomas Shoal）付近で17日、フィリピン側が意図的に座礁させた軍艦に駐在する部隊に海上補給を試みたところ、中国側の妨害を受けた。\n\n フィリピン側の船舶に中国海警局の隊員が乗り込んできた際、乗組員1人が親指を切断する重傷を負った。政府は、中国の隊員がナイフや棒、おのを振り回し、銃やゴムボートなどの装備を盗んだり破壊したりしたと非難した。\n\n 中国とフィリピンの海上での対立はここ数か月間で激化しているが、今回の衝突はその中でも深刻なものとなった。\n\n マルコス大統領はアユンギン礁に最も近い主要な陸地であるパラワン（Palawan）島を訪れ、軍の南シナ海部隊本部を視察。「われわれは誰かに畏縮することも、圧迫されることも決してない」と語った。\n\n マルコス氏は17日の補給任務に参加した水兵80人にメダルを授与し、「危険」な情勢になっているとしながらも、「国を守る義務を果たし続けるように」と激励した。【翻訳編集】 AFPBB News,['https://newsatcl-pctr.c.yimg.jp/t/amd-img/20240623-00000016-jij_afp-000-2-view.jpg?pri=l&w=640&h=426&exp=10800'],"['https://news.yahoo.co.jp/articles/7b55d944cfe2a5d2692e6531ce422ffee0c662f1/images/000', 'https://www.afpbb.com/articles/-/3525585?pid=26986780&tmpl_skin=gallery&utm_source=yahoo&utm_medium=news&cx_from=yahoo&cx_position=p1&cx_rss=afp&cx_id=3525585']"
ベネズエラがサブの活躍で逆転勝利、メキシコも白星 コパ・アメリカ（ＡＦＰ＝時事）,https://news.yahoo.co.jp/articles/f5edac9c0888f8e44742e431cede1ae442d4e05b,https://newsatcl-pctr.c.yimg.jp/t/amd-img/20240623-00000014-jij_afp-000-2-view.jpg?exp=10800,2024-06-23T15:52:28+09:00,2024-06-23T15:54:50+09:00,ＡＦＰ＝時事,jij_afp,ＡＦＰ＝時事,970,\nサッカーコパ・アメリカ、グループB、ベネズエラ対エクアドル。チームメートのジョルダン・オソリオ（右）と2点目のゴールを喜び合うベネズエラのエドゥアルド・ベッロ（2024年6月22日撮影）。【翻訳編集】 AFPBB News\n【AFP＝時事】サッカーのコパ・アメリカ（2024 Copa America）は22日、各地でグループBの試合が行われ、ベネズエラは2-1で10人のエクアドルに勝利。メキシコも1-0でジャマイカを下して白星スタートを切った。\n【写真】決勝ゴールを挙げたメキシコのアルテガ（その他全8枚）\n序盤から試合を支配したエクアドルは、22分にエネル・バレンシア（Enner Valencia）が危険なプレーで退場になった後もうまく立て直し、40分にFKのこぼれ球をジェレミー・サルミエント（Jeremy Sarmiento）が押し込んで先制した。\n\n しかしベネズエラは後半開始からジョンデル・カディス（Jhonder Cadiz）とエドゥアルド・ベッロ（Eduard Bello）を投入すると、この二人がインパクトを残した。まずはカディスが味方の落としに合わせてインサイドキックの低いシュートを放つと、これが相手DFにわずかに当たってコースが変わりゴールイン。74分には、右からのクロスに合わせたサロモン・ロンドン（Salomon Rondon）のヘディングシュートは相手GKに阻まれたが、こぼれ球に反応したベッロが逆転ゴールを決めた。\n\n メキシコはジャマイカに長く苦しめられたが、69分にヘラルド・アルテガ（Gerardo Arteaga）が見事な決勝点を挙げた。\n\n 29分に主将のエドソン・アルバレス（Edson Alvarez）がボールのないところで倒れて負傷交代を強いられ、前半は好機をつくり出せずに苦しむと、50分にはマイケル・アントニオ（Michail Antonio）に先制のダイビングヘッドを許したかに思われたが、ビデオ・アシスタント・レフェリー（VAR）によってオフサイドが確認され、ゴールは取り消された。\n\n これで目を覚ましたメキシコは前への圧力を強めると、69分にアルテガがペナルティーエリア端から完璧なハーフボレーのシュートを決めた。【翻訳編集】 AFPBB News,['https://newsatcl-pctr.c.yimg.jp/t/amd-img/20240623-00000014-jij_afp-000-2-view.jpg?pri=l&w=640&h=426&exp=10800'],"['https://news.yahoo.co.jp/articles/f5edac9c0888f8e44742e431cede1ae442d4e05b/images/000', 'https://www.afpbb.com/articles/-/3525570?pid=26986645&tmpl_skin=gallery&utm_source=yahoo&utm_medium=news&cx_from=yahoo&cx_position=p1&cx_rss=afp&cx_id=3525570']"
スイスで大規模洪水、3人不明（ＡＦＰ＝時事）,https://news.yahoo.co.jp/articles/885c7192005d5e57037f8abedb11382b42e15635,https://newsatcl-pctr.c.yimg.jp/t/amd-img/20240623-00000012-jij_afp-000-2-view.jpg?exp=10800,2024-06-23T14:10:24+09:00,2024-06-23T14:12:57+09:00,ＡＦＰ＝時事,jij_afp,ＡＦＰ＝時事,444,\n濁流に覆われたスイス・ロベレドのモエサ川を見る救急隊員（2024年6月22日撮影）。【翻訳編集】 AFPBB News\n【AFP＝時事】スイス南東部グラウビュンデン（Grisons）州で21日、大規模な洪水が発生し、3人が行方不明となった。地元当局は22日、行方不明者3人を捜索中だと明らかにした。\n【写真9枚】濁流が押し寄せたスイス・ツェルマット近郊の川\n雷を伴った激しい雨により、メゾルチーナ（Mesolcina）渓谷で土砂災害と洪水が発生。住民数十人が一時避難を余儀なくされた。警察によると、洪水で流されたとみられていた女性1人の生存が確認された。\n\n 警察は「現在も行方不明となっている3人について集中的な捜索が行われている」とし、住宅３軒と車両３台が流された際に３人は自宅にいた可能性が高いと説明した。\n\n 地元メディアの報道によると、行方不明となっているのは高齢の女性1人と夫婦。豪雨の後には複数の村で停電と断水が発生した。【翻訳編集】 AFPBB News,['https://newsatcl-pctr.c.yimg.jp/t/amd-img/20240623-00000012-jij_afp-000-2-view.jpg?pri=l&w=640&h=425&exp=10800'],"['https://news.yahoo.co.jp/articles/885c7192005d5e57037f8abedb11382b42e15635/images/000', 'https://www.afpbb.com/articles/-/3525569?pid=26982466&tmpl_skin=gallery&utm_source=yahoo&utm_medium=news&cx_from=yahoo&cx_position=p1&cx_rss=afp&cx_id=3525569']"
南アがウェールズ下す W杯後初戦で大勝 ラグビー（ＡＦＰ＝時事）,https://news.yahoo.co.jp/articles/5f45314a017982b6cb7f73b1766f1de30357d20e,https://newsatcl-pctr.c.yimg.jp/t/amd-img/20240623-00000010-jij_afp-000-2-view.jpg?exp=10800,2024-06-23T13:37:27+09:00,2024-06-23T13:40:13+09:00,ＡＦＰ＝時事,jij_afp,ＡＦＰ＝時事,662,\nラグビーテストマッチ、南アフリカ対ウェールズ。勝利を喜ぶ南アフリカの選手（2024年6月22日撮影）。【翻訳編集】 AFPBB News\n【AFP＝時事】ラグビーテストマッチは22日、英ロンドンで行われ、W杯フランス大会（Rugby World Cup 2023）王者の南アフリカが41-13でウェールズに大勝し、W杯後初のテストマッチを白星で飾った。\n【写真】トライを喜ぶ南アのファンデルメルバ（その他全8枚）\n前半は14-13の1点差だったが、後半は27-0で南アフリカが「勝利」。マカゾレ・マピンピ（Makazole Mapimpi）が後半開始早々にトライを決めてチームに落ち着きをもたらすと、さらに交代出場のボンギ・ムボナンビ（Bongi Mbonambi）、代表デビュー戦のエドウィル・ファンデルメルバ（Edwill van der Merwe）がトライを決めて突き放した。\n\n 両チームともに負傷者や海外チームに所属する選手を欠く布陣だったが、南アフリカは大勢の母国ファンが詰めかけたトゥイッケナム・スタジアム（Twickenham Stadium）で快勝。この後は、昨年のW杯で唯一敗れたチームであるアイルランドとのホーム2連戦に臨む。\n\n 対するウェールズは、これで全敗したシックスネーションズ（Six Nations Rugby 2024）を含めて7連敗となった。それでもこの試合の気持ちの入ったプレーを糧に、次はオーストラリアとのアウェー2連戦に臨む。【翻訳編集】 AFPBB News,['https://newsatcl-pctr.c.yimg.jp/t/amd-img/20240623-00000010-jij_afp-000-2-view.jpg?pri=l&w=640&h=426&exp=10800'],"['https://news.yahoo.co.jp/articles/5f45314a017982b6cb7f73b1766f1de30357d20e/images/000', 'https://www.afpbb.com/articles/-/3525566?pid=26983616&tmpl_skin=gallery&utm_source=yahoo&utm_medium=news&cx_from=yahoo&cx_position=p1&cx_rss=afp&cx_id=3525566']"
ドレッセル、個人2種目でパリ切符 五輪連覇挑戦へ（ＡＦＰ＝時事）,https://news.yahoo.co.jp/articles/21e5456166948e4457715d27213a9419a5b0b4fb,https://newsatcl-pctr.c.yimg.jp/t/amd-img/20240623-00000011-jij_afp-000-4-view.jpg?exp=10800,2024-06-23T14:10:23+09:00,2024-06-23T15:25:28+09:00,ＡＦＰ＝時事,jij_afp,ＡＦＰ＝時事,495,\n競泳のパリ五輪米国代表選考会、男子100メートルバタフライ決勝。優勝を喜ぶケーレブ・ドレッセル（2024年6月22日撮影）。【翻訳編集】 AFPBB News\n【AFP＝時事】競泳のパリ五輪米国代表選考会は22日、インディアナ州インディアナポリス（Indianapolis）で行われ、東京五輪5冠のケーレブ・ドレッセル（Caeleb Dressel）が男子100メートルバタフライで優勝し、パリ五輪出場権を獲得した。\n【写真】優勝を喜ぶドレッセル（全4枚）\nドレッセルは持ち前の爆発的なスタートで主導権を握ると、そのまま50秒19でゴールした。100メートル自由形では3位に終わったが、前日には50メートル自由形でも優勝しており、パリでは個人2種目で連覇を目指すことになった。\n\n 東京五輪後の2022年から長期の休養を取り、そこから再び戻ってきたドレッセルは、各種目上位2選手だけが五輪切符を手にできる米選考会について「ここが一番の難関」と話し、プレッシャーのかかる9日間の戦いの中で「感じうるすべての感情を経験した気がする」と振り返った。【翻訳編集】 AFPBB News,['https://newsatcl-pctr.c.yimg.jp/t/amd-img/20240623-00000011-jij_afp-000-4-view.jpg?pri=l&w=640&h=426&exp=10800'],"['https://news.yahoo.co.jp/articles/21e5456166948e4457715d27213a9419a5b0b4fb/images/000', 'https://www.afpbb.com/articles/-/3525571?pid=26986337&tmpl_skin=gallery&utm_source=yahoo&utm_medium=news&cx_from=yahoo&cx_position=p1&cx_rss=afp&cx_id=3525571']"
【今日の1枚】アートフェアでかくれんぼ？ スイス（ＡＦＰ＝時事）,https://news.yahoo.co.jp/articles/adc715a4e9b05e162cdaf566f3391a20c939e255,https://newsatcl-pctr.c.yimg.jp/t/amd-img/20240623-00000008-jij_afp-000-2-view.jpg?exp=10800,2024-06-23T12:16:37+09:00,2024-06-23T12:18:51+09:00,ＡＦＰ＝時事,jij_afp,ＡＦＰ＝時事,292,\nスイス北部バーゼルで開かれた現代美術展「アート・バーゼル」に展示された、英国のアーティスト、ライアン・ガンダー氏の作品「スクール・オブ・ランゲージ」（2024年6月11日撮影）。【翻訳編集】 AFPBB News\n【AFP＝時事】スイス北部バーゼルで開かれた現代美術展「アート・バーゼル（Art Basel）」に展示された、英国のアーティスト、ライアン・ガンダー（Ryan Gander）氏の作品「スクール・オブ・ランゲージ（School of Languages）」。【翻訳編集】 AFPBB News\n【動画】「総とっかえ」にビビりながら… 村上隆氏、AIを語る 仏で個展,['https://newsatcl-pctr.c.yimg.jp/t/amd-img/20240623-00000008-jij_afp-000-2-view.jpg?pri=l&w=640&h=426&exp=10800'],"['https://news.yahoo.co.jp/articles/adc715a4e9b05e162cdaf566f3391a20c939e255/images/000', 'https://www.afpbb.com/articles/-/3468184?tmpl_skin=gallery&utm_source=yahoo&utm_medium=news&cx_from=yahoo&cx_position=p1&cx_rss=afp&cx_id=3524863']"
エディーHC「正しい方向へ進んでいる」 イングランドに大敗も前向き（ＡＦＰ＝時事）,https://news.yahoo.co.jp/articles/43ced406462558f9792137b9ee06b89c5268f53c,https://newsatcl-pctr.c.yimg.jp/t/amd-img/20240623-00000009-jij_afp-000-2-view.jpg?exp=10800,2024-06-23T13:04:16+09:00,2024-06-23T13:07:03+09:00,ＡＦＰ＝時事,jij_afp,ＡＦＰ＝時事,751,\nラグビーテストマッチ、日本対イングランド。試合後にイングランドの選手やスタッフにあいさつするエディー・ジョーンズHC（2024年6月22日撮影）。【翻訳編集】 AFPBB News\n【AFP＝時事】ラグビー日本代表を率いるエディー・ジョーンズ（Eddie Jones）ヘッドコーチ（HC）が22日、2度目の就任後初の試合となったイングランド戦で大敗したものの、チームは「正しい方向へ進んでいる」と自信を見せた。\n【写真】マーラーと言葉を交わすエディーHC（その他全6枚）\nイングランド戦の日本は、先発4人、交代出場の4人が代表初キャップという経験の浅い布陣で臨んだが、相手に8トライを許して17-52で敗れた。\n\n それでもジョーンズHCは、ハイテンポのプレースタイルを新チームに植え付けようとしている中で、期待できる部分もあったと話し、「攻撃では十分なものを示せたし、正しい方向へ進んでいるのが分かったが、チャンスを生かせなかった」と振り返ると、「きょうは初キャップの選手が8人いて、全員が素晴らしい学びを得た。何かをつかむには、まず教訓を得なければならないときがある。彼らはきょうそれを手に入れた」と手応えを口にした。\n\n 日本はペナルティーゴール（PG）で先制した後も、開始10分は相手を敵陣ゴールラインにくぎ付けにしたが、攻勢をしのがれるとイングランドに前半だけで4トライを許した。\n\n ジョーンズHCは80分をフルに戦い抜くには「フィジカルとメンタル両方の能力を高める」必要があったと話し、「最初の15分はイングランドを押し込み、主導権を握った」とコメント。「とにかく練習。ハードな練習だ。そうすれば目指す場所へたどり着ける」と語った。【翻訳編集】 AFPBB News,['https://newsatcl-pctr.c.yimg.jp/t/amd-img/20240623-00000009-jij_afp-000-2-view.jpg?pri=l&w=640&h=426&exp=10800'],"['https://news.yahoo.co.jp/articles/43ced406462558f9792137b9ee06b89c5268f53c/images/000', 'https://www.afpbb.com/articles/-/3525557?pid=26982201&tmpl_skin=gallery&utm_source=yahoo&utm_medium=news&cx_from=yahoo&cx_position=p1&cx_rss=afp&cx_id=3525557']"
米原子力空母が韓国入港 日韓との共同訓練へ（ＡＦＰ＝時事）,https://news.yahoo.co.jp/articles/4e7591a4a68b2f4774a40b298863e0dea935620b,https://newsatcl-pctr.c.yimg.jp/t/amd-img/20240623-00000007-jij_afp-000-2-view.jpg?exp=10800,2024-06-23T12:07:23+09:00,2024-06-23T12:10:08+09:00,ＡＦＰ＝時事,jij_afp,ＡＦＰ＝時事,302,\n韓国・釜山に入港した米海軍の原子力空母「セオドア・ルーズベルト」（2024年6月22日撮影）。【翻訳編集】 AFPBB News\n【AFP＝時事】米海軍の原子力空母「セオドア・ルーズベルト（USS Theodore Roosevelt）」が22日、韓国南部の釜山（Busan）に入港した。日米韓が今月末に実施する共同訓練に参加する予定だ。\n【写真4枚】釜山に入港した米海軍の原子力空母「セオドア・ルーズベルト」\n韓国海軍は米空母の寄港について、「韓米同盟の強固な共同防衛態勢と、北朝鮮からの高まる脅威に対処するという両国の断固たる決意を示すものだ」と説明した。【翻訳編集】 AFPBB News,['https://newsatcl-pctr.c.yimg.jp/t/amd-img/20240623-00000007-jij_afp-000-2-view.jpg?pri=l&w=640&h=405&exp=10800'],"['https://news.yahoo.co.jp/articles/4e7591a4a68b2f4774a40b298863e0dea935620b/images/000', 'https://www.afpbb.com/articles/-/3525563?pid=26981607&tmpl_skin=gallery&utm_source=yahoo&utm_medium=news&cx_from=yahoo&cx_position=p1&cx_rss=afp&cx_id=3525563']"
