headline,mainEntityOfPage,image,datePublished,dateModified,author,media_en,media_jp,str_count,body,images,external_links
新紙幣デザインのタオル発売　長崎県官報販売所　肌ざわりもこだわり…梅雨のお供に（長崎新聞）,https://news.yahoo.co.jp/articles/15a0c8e56da4af8214ebb490e34580fb7f61735a,https://newsatcl-pctr.c.yimg.jp/t/amd-img/20240626-00000007-nagasaki-000-1-view.jpg?exp=10800,2024-06-26T12:40:22+09:00,2024-06-26T12:40:22+09:00,長崎新聞,nagasaki,長崎新聞,317,\n新紙幣デザインのタオルとタオルハンカチ\n約２０年ぶりに新紙幣が発行される７月３日まで、あと７日。長崎市出島町の長崎県官報販売所で２６日から、新紙幣デザインのタオルとタオルハンカチ各３種類が店頭に並ぶ。\n 同販売所は紙幣を製造する国立印刷局の委託を受け、政府刊行物や実務書を取り扱う。新紙幣への対応に伴う自動販売機の改修など、マイナス面の話題が多い中、共にこの機会を楽しく盛り上げようとラインアップに加えた。\n 柄を忠実に再現し、タオル（８００円）は牛乳由来の繊維を使ったシルクのような手触り。綿１００％のタオルハンカチ（６００円）は二つ折りで使うと、まるでお札で拭いているかのよう。汗ばむ梅雨時期、ポケットに忍ばせてみては。,['https://newsatcl-pctr.c.yimg.jp/t/amd-img/20240626-00000007-nagasaki-000-1-view.jpg?pri=l&w=640&h=437&exp=10800'],['https://news.yahoo.co.jp/articles/15a0c8e56da4af8214ebb490e34580fb7f61735a/images/000']
福山さんライブを無料生中継！　長崎スタジアムシティのこけら落とし　申し込み２０万件突破（長崎新聞）,https://news.yahoo.co.jp/articles/c7a3743e1d452c8bec657f27d9597aa7182f5dce,https://newsatcl-pctr.c.yimg.jp/t/amd-img/20240626-00000003-nagasaki-000-2-view.jpg?exp=10800,2024-06-26T11:00:21+09:00,2024-06-26T13:16:18+09:00,長崎新聞,nagasaki,長崎新聞,462,\n福山さんによる長崎スタジアムシティこけら落としライブのポスタービジュアル\n今秋開業する長崎スタジアムシティ（長崎市幸町）のこけら落としとして開かれる同市出身のシンガー・ソングライター、福山雅治さんの無料ライブの申し込みが２０万件を突破し、ジャパネットグループのリージョナルクリエーション長崎（同市）は、全ての希望者が視聴できるよう、公式アプリで無料生中継することを決めた。\n ライブは開業前日の１０月１３日午後５時開演（開場同２時半）、同施設内のサッカースタジアムに約２万５千人を招待して開く。公式アプリで７月７日まで申し込みを受け付け中。\n 福山さんは同社を通じて「多くの皆さんが抱いているであろう『倍率が高くて参加できないかも…』という不安を勝手ながら想像してしまいました。その気持ちをワクワクへと、期待感へと変えてもらうことはできないか。そこから発想が始まり、このフリーライブへの参加を希望する全ての方が、無料で生中継を視聴するというのはどうかというご提案をさせていただきました」などとするコメントを出した。,['https://newsatcl-pctr.c.yimg.jp/t/amd-img/20240626-00000003-nagasaki-000-2-view.jpg?pri=l&w=452&h=640&exp=10800'],['https://news.yahoo.co.jp/articles/c7a3743e1d452c8bec657f27d9597aa7182f5dce/images/000']
「リアル桜木花道」が長崎ヴェルカに！　バスケ日本代表・川真田紘也が加入（長崎新聞）,https://news.yahoo.co.jp/articles/5295cb764ae7ec4b0d2a7704ac4b95c53ff1d57d,https://newsatcl-pctr.c.yimg.jp/t/amd-img/default.jpg?exp=10800,2024-06-26T11:15:23+09:00,2024-06-26T12:54:00+09:00,長崎新聞,nagasaki,長崎新聞,565,\nＢリーグ１部（Ｂ１）の長崎ヴェルカは２５日、Ｂ１昇格を決めた滋賀から日本代表のセンター川真田紘也（２６）が加入すると発表した。\n 徳島県出身で身長２０４センチ、体重１１０キロ。２０２０～２１年シーズンに当時Ｂ２の佐賀に特別指定選手として加入した後、２１～２２年シーズンから当時Ｂ１の滋賀に所属。Ｂ２に降格していた昨季は４２試合に出場して、１試合平均５・８点を挙げ、クラブのＢ２優勝に貢献した。\n 代表歴はＵ２２、２３日本代表候補を経て、昨夏のワールドカップ（Ｗ杯）で日本代表入り。外国人選手に劣らない体格、当たり負けしないプレーが評価されて４試合に出場した。パリ五輪へ向けた２３日のオーストラリアとの国際強化試合もメンバー入り。豪快なダンクシュートを決めるなど存在感を示した。\n 泥くさい、体を張ったプレーが持ち味で、持ち前の明るい性格から日本代表でもムードメーカー的な役割を担う。Ｗ杯では髪を赤く染めてコートに立ち、その姿が人気漫画「スラムダンク」の主人公に似ていたことから「リアル桜木花道」と呼ばれてファンに親しまれている。\n ヴェルカ待望の日本人ビッグマンは、クラブを通じて「ブースターのみなさまに勝利を届けられるよう全力を尽くすことはもちろん、新しい環境で自分が成長するためにも頑張りたい」と意欲を見せている。,[],[]
斜面地の生家どうすれば…母亡くした男性、救った長崎の新たな「賃貸住宅」＜しまい方のかたち・４＞（長崎新聞）,https://news.yahoo.co.jp/articles/f2d01a5abaaecebf6f78e95b612a53c702eed7f4,https://newsatcl-pctr.c.yimg.jp/t/amd-img/20240626-00000005-nagasaki-000-1-view.jpg?exp=10800,2024-06-26T12:00:21+09:00,2024-06-26T12:00:21+09:00,長崎新聞,nagasaki,長崎新聞,1075,\n不動産会社が引き取って利活用されることになった「元実家」で、ほっとした表情を浮かべる吉田さん＝５月、長崎市中小島２丁目\n壁に飾られたカレンダーは２０２２年４月のまま。１人暮らしの母親が亡くなって２年がたつが、時間が止まったかのようだった。\n 今年５月、長崎市中小島２丁目の斜面地に立つ木造２階建て。「私が生まれた時から今の造りでした」。元実家を訪れた大村市の吉田広文さん（５２）は電化製品やベッドなどがそのまま残った部屋を眺めて目を細めた。一周忌までは毎月の墓参りに合わせ、庭の草むしりや部屋の風通しを続けてきた。\n 戦前に曽祖父の代に建てられた家。両親が結婚して同居を始めた際に建て増した。車道から階段を上り、さらに奥まった場所にある。敷地が道路に接していないため、戦後に施行された建築基準法の接道義務を満たしておらず、建て替えることができない。\n 借地のため、売るのも難しく、重機が入らず解体や家財道具を処分するのにも費用が割高になる。隣の空き家も長らく買い取り手が見つかっていないようだった。どうしたものかと困り果てていたところ、知人から長崎市の不動産会社、明生興産を紹介された。\n 同社は自社で工事ができる強みを生かし、買い取った空き家をリノベーションし、低額での賃貸や再販事業を展開。２２年からは、月３万円ほどの家賃で貸し出し、１０年後に借り手が希望すれば土地建物をそのまま贈与する「贈与型賃貸住宅」の事業を手がける。\n 尾上雅彦社長（５５）は「昭和の高度経済成長期に建てられた空き家が増えているが、昭和レトロが見直され、共感して住む若い世代が増えれば、持続可能な循環型建築社会の市場創造につながる」と意義を語る。\n 収益性やデザイン性に応じて４段階で独自に評価しており、吉田さんから相談を受け、条件が合わず一度は断った。だが、それでも「引き取ってほしい」という要望に、解体するなら発生していた費用の一部を預かり、それをリノベ工事費用の一部に充てる「寄付贈与型賃貸住宅」として取り組むことを決めた。\n 吉田さんは土地の所有者に掛け合い、無償で土地を譲渡してもらい、現状のまま引き渡すことで昨年１０月に契約が成立。今年６月からリノベ工事に着手しており、秋ごろに完了予定だ。\n 「負動産」とも呼ばれる資産価値に乏しい土地や建物を巡っては、放置された空き家の倒壊やごみの不法投棄などの問題が全国的に起きている。\n 吉田さんは「朽ち果てるよりは、きれいになって使ってもらえるなら、かえってよかった」とほっとした表情で語った。,['https://newsatcl-pctr.c.yimg.jp/t/amd-img/20240626-00000005-nagasaki-000-1-view.jpg?pri=l&w=640&h=426&exp=10800'],['https://news.yahoo.co.jp/articles/f2d01a5abaaecebf6f78e95b612a53c702eed7f4/images/000']
詐欺でだまされるのはなぜ？　特徴や判断誤る仕組み…社会心理学の専門家に聞いてみた（長崎新聞）,https://news.yahoo.co.jp/articles/ea9a713b0a3bd98599f73f6f508456c00dbab4ea,https://newsatcl-pctr.c.yimg.jp/t/amd-img/20240626-00000006-nagasaki-000-1-view.jpg?exp=10800,2024-06-26T12:20:30+09:00,2024-06-26T12:20:30+09:00,長崎新聞,nagasaki,長崎新聞,1241,\nだまされやすさを測る心理傾向チェック！\n被害が後を絶たない「ニセ電話詐欺」と「交流サイト（ＳＮＳ）型投資・ロマンス詐欺」。高齢者のみならず、幅広い年代で被害が確認されている。なぜ、だまされてしまうのか。立正大心理学部（東京）の西田公昭教授（社会心理学）に、被害に遭う人の心理や詐欺への対策について聞いた。\n\n－だまされやすい人の特徴は。\n 詐欺といえば、高齢者が被害に遭うと思っている人が多いが、それは大違い。年齢を問わず「自分だけは絶対にだまされない。大丈夫」という人が案外だまされる。\n\n －長崎県警が５月末までに認知したニセ電話詐欺被害のうち、最も多い手口が「架空料金請求」の５２件。パソコンやスマートフォンのウイルス除去を名目に金をだまし取る「サポート詐欺」が頻発している。被害者は、どのような心理の下でだまされるのか。\n まず、画面に表示される「ウイルスに感染しています」といったうその警告により、不安や恐怖に陥る。パニックになり、きちんとした判断ができない中で、提案されるのがウイルス除去ソフトなどの解決法。「溺れる者は藁（わら）をもつかむ」ということわざがあるように、被害者は慌てて、それしかないと思い込み、ウイルス除去費用として金銭をだまし取られてしまう。\n\n －ＳＮＳ型投資・ロマンス詐欺は、ＳＮＳ上で何度もやりとりを重ね、信頼関係を構築した上で、だましている。被害者はなぜ、途中で気づかないのか。\n 初めは半信半疑でも、やりとりを重ねるうちに入金し、「投資して少しはもうかったから信じられる」「これは本物なんだ。夢がかなうかも」という思考になる。自分のとった行動を正当化し、後悔を避けようとする人間心理だ。こうして思い込みが強くなると、おかしな点には気づきにくくなり、自分にとって都合のいい情報だけを収集してしまう。この現象を「確証バイアス」といい、なかなか自分では気づけないし、後戻りできなくなる。\n\n －家族やコンビニの店員など周りの人が詐欺に気づいて未然に防いでいるケースもある。だまされている人にどのような声かけをすればよいのか。\n 「だまされるなんてバカじゃない？」など、高圧的に責めてはいけない。詐欺にあったことを恥ずかしいと思い、相談しなくなったり、反抗したりするからだ。誰にも言えずに泣き寝入りすることもあり、表面化している被害は氷山の一角に過ぎない。「もしかしたら詐欺かもしれないから、もう一度、一緒に考えよう」や「大丈夫だと思えても誰だってミスはあるから」などと寄り添って確認することが大切。\n\n －詐欺への対策とは。\n 「注意して」「気をつけて」といった旧態依然とした精神論の対策では追いつかない。最近は、実業家など有名人のフェイク広告動画や音声を使った詐欺もある。それを見抜く方法や詐欺の巧妙な手口を知って、事前に対応策を練習しておくなどの個人でできる対策のほか、警察と消費者センターとの連携も必要だ。,['https://newsatcl-pctr.c.yimg.jp/t/amd-img/20240626-00000006-nagasaki-000-1-view.jpg?pri=l&w=542&h=640&exp=10800'],['https://news.yahoo.co.jp/articles/ea9a713b0a3bd98599f73f6f508456c00dbab4ea/images/000']
大村市職員が名札を紛失　徴税吏員かたる訪問に注意　長崎（長崎新聞）,https://news.yahoo.co.jp/articles/0e567f6501456b14dc576ac8ec97a3d0024a3024,https://newsatcl-pctr.c.yimg.jp/t/amd-img/default.jpg?exp=10800,2024-06-26T10:15:22+09:00,2024-06-26T10:15:22+09:00,長崎新聞,nagasaki,長崎新聞,472,\n長崎県大村市は２５日、徴税を担当する部署の職員が名札や徴税吏員証などを紛失したと明らかにした。市職員をかたる２人組が税の徴収に来たとの通報もあり、市は注意を呼びかけるとともに「市民の方にご心配をおかけし申し訳ない」としている。\n 市収納課によると、今月３日、休職から復帰した同課職員の名札が見当たらないことが分かった。名札ケースには市税の徴収に関して質問や取り締まりを行う身分を証明する「徴税吏員証」「市税犯則事件調査吏員証」が入っていた。本人や同僚が探したが、現時点で見つかっていない。\n １９日、市人事課に「市内在住の親族の元に２人組が税の徴収に来た」という匿名の通報があった。このうち１人は紛失した職員と同姓の名札を付けていたという。市は公式ＬＩＮＥ（ライン）や防災ラジオで注意喚起を行い、大村署に報告した。被害情報は入っていない。\n 収納課によると、職員が自宅を訪ねて税金を徴収することはない。不審な訪問があれば同課へ連絡するよう呼びかけている。また、職員の休職時には徴税吏員証を所属長が預かるなど再発防止に努めるとしている。,[],[]
長崎駅とスタジアムシティ結ぶ県道　ほこみち指定を検討、にぎわい創出へ改修も（長崎新聞）,https://news.yahoo.co.jp/articles/1e0ff528c4a64eeef6b9dae41a6788f86aabaf85,https://newsatcl-pctr.c.yimg.jp/t/amd-img/default.jpg?exp=10800,2024-06-26T10:30:22+09:00,2024-06-26T10:30:22+09:00,長崎新聞,nagasaki,長崎新聞,515,\n長崎県は２５日、ＪＲ長崎駅や１０月に開業する長崎スタジアムシティの西側を通る浦上川沿いの県道について、歩道の占用許可の条件を緩和する歩行者利便増進道路（通称・ほこみち）への指定を検討する考えを明らかにした。民間の飲食・休憩施設などの設置を促し、にぎわい創出を図る。\n 定例県議会一般質問で中尾吉宏土木部長が大倉聡議員（もったいないよ長崎）に答えた。\n ほこみちは、道路管理者が歩道内に特例区域を定め、占用許可基準を柔軟にする。ベンチやテーブルを設置し、飲食スペースをつくるなどの活用例がある。\n 県道について、大倉議員は稲佐山や女神大橋などを望む景観がある一方、中央分離帯や植栽ゾーンは雑草が生い茂る時期もあり、歩道は劣化して砂利が散らばり歩きにくいと指摘した。\n 中尾部長は、市と県で整備を進める東側の道路と同様に「駅と長崎スタジアムシティを結ぶ主要なアクセスルートになる」とし「劣化しにくい歩道舗装への改修を進め、雑草の繁茂を抑制する方法を検討し、良好な道路環境の維持に努める」と答弁。ほこみちの指定で「にぎわいの創出を図っていきたい」とした。\n 県道路維持課によると、整備の内容や区間、時期などは今後検討する。,[],[]
