headline,mainEntityOfPage,image,datePublished,dateModified,author,media_en,media_jp,str_count,body,images,external_links
県内の郵便局の8割でバイク運転手の「不適切な点呼」を確認 日本郵便は局の管理者を処分する方針（FBC 福井放送）,https://news.yahoo.co.jp/articles/d183f25b1fc3c348d0379d61f4da46096b409372,https://newsatcl-pctr.c.yimg.jp/t/amd-img/20250829-08539563-fbc-000-3-view.jpg?exp=10800,2025-08-29T19:52:01+09:00,2025-08-29T19:57:10+09:00,FBC 福井放送,fbc,FBC 福井放送,404,"県内の郵便局の8割でバイク運転手の「不適切な点呼」を確認
日本郵便のバイク配達をめぐり、運転手の不適切な点呼が確認された問題で、県内では35の郵便局のうち28の郵便局で不備があったことがわかりました。

日本郵便は、トラックなどの運転手の飲酒の有無を確認する点呼が不適切と指摘された問題を受け、今年1月下旬から3月上旬にかけて、全国の郵便局を対象に、職員のアルコールチェックの実施状況を調査しました。

その結果、バイク運転手に関して全国3188局中1834局、北陸3県では98局のうち73局で不適切な点呼が確認されました。

さらに、県内では35局中28局と、全体の8割の郵便局で不適切な点呼が行われていたことがわかりました。

この問題を受け、日本郵便では今後、不適切な点呼を行った局の管理者と点呼責任者を処分する方針ということです。

なお配達業務を停止することは今のところ考えていないということです。",[],[]
もんじゅ敷地内で建設予定の試験研究炉の調査費に25億円 文部科学省が来年度予算の概算要求まとめる 建設場所は見通し立たず（FBC 福井放送）,https://news.yahoo.co.jp/articles/8bcff4de575d461fa0d4bf1560ee84cbbb6202ee,https://newsatcl-pctr.c.yimg.jp/t/amd-img/20250829-08649974-fbc-000-2-view.jpg?exp=10800,2025-08-29T19:40:01+09:00,2025-08-29T19:50:10+09:00,FBC 福井放送,fbc,FBC 福井放送,434,"来年度予算の概算要求でもんじゅ敷地内の試験研究炉の調査費に25億円盛り込む
敦賀市の高速増殖炉もんじゅの敷地内で建設が予定されている試験研究炉について、文部科学省は、地質調査費などを増やし、来年度予算の概算要求に25億円を盛り込むとしています。

文部科学省の担当者は29日、敦賀市の米澤市長に来年度予算の概算要求について説明しました。

それによりますと、もんじゅの敷地内で建設が計画されている試験研究炉について、地質調査費を多く見積もり、今年度よりも9億円多い25億円を計上するとしています。

このほか、もんじゅの廃炉や維持管理費用に今年度よりも18億円多い197億円を、新型転換炉ふげんの廃炉や維持管理、使用済み燃料搬出に向けた経費に今年度より14億円少ない82億円を要求するとしています。

なお試験研究炉については、2024年10月に、国土地理院がもんじゅ敷地内に地震を起こす恐れのある「推定活断層」があると指摘していて、建設場所の見通しは立っていません。",[],[]
「素晴らしい発見 もっとエレガントにアレンジできる」フランス料理の巨匠アラン・デュカス氏が県内の伝統食材の調理にイメージ膨らます（FBC 福井放送）,https://news.yahoo.co.jp/articles/8d5775bfd04fb43d2ca3c9707046cecf4e10fdba,https://newsatcl-pctr.c.yimg.jp/t/amd-img/20250829-09929141-fbc-000-3-thumb.jpg?exp=10800,2025-08-29T17:38:01+09:00,2025-08-29T19:25:07+09:00,FBC 福井放送,fbc,FBC 福井放送,475,"FBC福井放送
9月から全国で始まるフランス料理のイベントを前に29日、巨匠アラン・デュカス氏が県内の伝統食材などを見て回り、新しい調理の仕方に思いを巡らせていました。

アラン・デュカス氏は美浜町のへしこ蔵を訪れ、「樽上げ」と呼ばれる作業などを体験しました。

9月から全国各地のレストランで始まる、フランス料理のイベントとパートナーシップ契約を結ぶ県が招いたもので、焼いたへしこなどを試食し、新しい調理の仕方にイメージを膨らませていました。

■アラン・デュカス氏 
「素晴らしい発見だった フランス料理に使えると思う こういう素朴なものを、もっとエレガントにアレンジすることは可能だと思う」

アラン氏はこの後、敦賀市の昆布蔵も訪れ、福井が誇る伝統的な食材の可能性を感じていました。

フランス料理を手頃な価格で味わえるイベントは、9月20日から1か月間、県内15店舗を含む全国500以上のレストランで開かれます。

イベント名は『ダイナースクラブフランスレストランウィーク2025』で、3000円、6000円、1万円の特別コースが楽しめます。",[],[]
原発の使用済み核燃料「2035年末までに県外へ搬出」乾式貯蔵施設の設置に向け関西電力が方針示す（FBC 福井放送）,https://news.yahoo.co.jp/articles/eaef4d3e3a953bfe5ca5ca2710bd2bfff18fe7db,https://newsatcl-pctr.c.yimg.jp/t/amd-img/20250829-04255127-fbc-000-4-thumb.jpg?exp=10800,2025-08-29T17:28:00+09:00,2025-08-29T19:25:11+09:00,FBC 福井放送,fbc,FBC 福井放送,602,"FBC福井放送
原発の敷地内で、使用済み核燃料を一時的に保管する「乾式貯蔵施設」の設置に向けて、関西電力は29日「遅くとも2035年末までに県外に燃料を搬出する」との方針を示しました。

関西電力の水田原子力事業本部長は、原発の敷地内で使用済み核燃料を一時保管する乾式貯蔵施設の設置をめぐって、中村副知事と面談しました。

この中で燃料の具体的な搬出時期について「遅くとも2035年末までに県外の中間貯蔵施設へ搬出する」と明言しました。

■関西電力 水田仁原子力事業本部長
「2035年末までに搬出を開始できない場合は、乾式貯蔵施設に貯蔵している使用済み燃料は、使用済み燃料プールに戻す 確実に搬出ができるように、しっかりと取り組むという確固たる意志を示すもの」

このほか、青森県で建設が進む再処理工場の安全審査の状況など、搬出計画の進み具合も説明し、施設の設置に理解を求めました。

関西電力はまた県議会でも方針を説明し、議員からは搬出期限の信頼性について疑問の声が相次ぎました。

■民主・みらい 渡辺大輔議員
「期限だけを提示されて、中間貯蔵施設の場所の提示がなければ、今回も絵に描いた餅として県民も受け止めるのでないか」

この中間貯蔵施設について関西電力は明言をしませんでした。

県は、県議会や立地自治体の意見を踏まえて、乾式貯蔵施設の設置を了解するかどうか総合的に判断するとしています。",[],[]
使用済み核燃料の中間貯蔵施設「立地は可能」　山口県上関町、中国電力が報告書提出　関西電力との共同での建設に向け立地可能性を調査（FBC 福井放送）,https://news.yahoo.co.jp/articles/26b0e6c6eabc622b68855ba3ccdd528a2d33804a,https://newsatcl-pctr.c.yimg.jp/t/amd-img/20250829-01192473-fbc-000-4-thumb.jpg?exp=10800,2025-08-29T17:25:01+09:00,2025-08-29T22:52:10+09:00,FBC 福井放送,fbc,FBC 福井放送,407,"FBC福井放送
関西電力と共同で中国電力が進めていた、山口県上関町での使用済み核燃料の中間貯蔵施設の立地可能性調査について、中国電力は27日、「立地は可能」とする報告書を町に提出しました。

中国電力は、関西電力と共同での使用済み核燃料の中間貯蔵施設の建設に向けて、2023年8月から、上関町・長島の社有地で、立地の可能性について調査を進めてきました。

その調査結果を報告するため、中国電力の大瀬戸聡常務が上関町役場を訪れ、「立地は可能」とする報告書を西哲夫町長に手渡しました。

■中国電力 大瀬戸聡常務
「立地の支障となる技術的に対応できない問題はないとの評価に至った」

町長は報告を受けて、今後、議会や住民の声を踏まえ、次の段階に進めるかどうか判断する姿勢を示しました。

一方、関西電力は、県内の原発から出る使用済み核燃料の県外搬出先をめぐって、上関町が候補地となるかどうかについては明言を避けました。",[],[]
解説 乾式貯蔵施設とは 敷地内に別の建物を建てて空気で冷やす 「県外にスムーズに運び出すための施設」（FBC 福井放送）,https://news.yahoo.co.jp/articles/e8d885be315d91589a3e68b4c8278acac5bda406,https://newsatcl-pctr.c.yimg.jp/t/amd-img/20250829-09531712-fbc-000-2-view.jpg?exp=10800,2025-08-29T17:14:00+09:00,2025-08-29T17:36:06+09:00,FBC 福井放送,fbc,FBC 福井放送,685,"乾式貯蔵施設は敷地内に別の建物を建てて空気で冷やしながら保管する施設(イメージ)
乾式貯蔵施設の問題。県と県議会は、以前から使用済み核燃料の搬出時期を明らかにするよう求めています。

まず乾式貯蔵施設とはどのような施設なのでしょうか。

使用済み核燃料は、原発内の燃料プールで冷却しながら保管するのが一般的ですが、敷地内に別の建物を建てて、空気で冷やしながら保管するのが乾式貯蔵施設です。

関西電力は、キャスクと呼ばれる金属製の容器に燃料を入れて、鉄筋コンクリートで囲った状態で屋外に並べて保管する計画です。

乾式貯蔵施設は、原発内に溜まり続ける使用済み核燃料の貯蔵容量を増やすため、茨城県や愛媛県の原発で導入されていますが、関西電力は「県外にスムーズに運び出すための施設」と説明しています。

プールに入っている状態よりも、専用容器に入れておく方が速やかに搬出出来るという理屈ですが、搬出先が確保出来なければ、燃料の長期保管につながるのではないかと懸念されていて、このため、県と県議会は「搬出時期を明らかにするように」と念押ししていたのです。

関西電力は27日、乾式貯蔵施設を設置した場合、「遅くとも2035年末までに」使用済み核燃料を搬出する方針を示し、「搬出できなければ燃料プールに戻す」。つまり 長期保管はしない。全体の使用済み核燃料の量は「これ以上増やさない」と地元と「約束」した形です。

乾式貯蔵施設は原子力規制委員会の審査が完了しており、地元の了解が得られれば工事に入ることができます。

この問題は9月3日に開会する県議会で議論がスタートします。",[],[]
猛暑と雨不足でハナエチゼンにひび割れ 未熟米など高温障害 越前市白山地区では一等米比率が低下見込み（FBC 福井放送）,https://news.yahoo.co.jp/articles/30eed4612b84890a309e54e04b5669536b18f212,https://newsatcl-pctr.c.yimg.jp/t/amd-img/20250829-03274928-fbc-000-6-thumb.jpg?exp=10800,2025-08-29T15:44:00+09:00,2025-08-29T19:33:06+09:00,FBC 福井放送,fbc,FBC 福井放送,650,"FBC福井放送
猛暑と雨不足にあえぐ越前市の白山地区では、早生のハナエチゼンの一部にひび割れなどの高温障害が見られ、一等米の比率は去年よりやや下がる見通しです。

選別機から出てくるのははじかれた規格外のコメです。

越前市白山地区にある農業生産法人では、ハナエチゼンの出荷作業がピークを迎えていて、夏の猛暑と雨不足の影響で、一部にひび割れや未熟米など高温障害がみられます。

■金華山ファーム山腰守夫さん
「水不足で生育が若干遅い 収量は1割から1.5割減るのでないか」

雨不足による川の水位の低下を受けて、ポンプで水をくみ上げて水田に送るなど、渇水対策のコストも増加しました。

JA越前たけふによりますと、ハナエチゼンの1等米の比率は、これまでのところ89.3パーセントで、去年と比べ6ポイント低くなっています。

また、主力品種のコシヒカリの収穫が本格化するのを前に、日野川流域の農業用水の取水制限は9月も継続することが決まり、生産者は影響を懸念しています。

JA越前たけふ指導部の大久保昌尚部長は、「コシヒカリについては高温に強くない品種で、1等米の比率は60～70パーセント台という結果が見え隠れしている」と話しています。

JA越前たけふでは高温に耐久性のある品種の試験栽培を行っていて、3年後をめどにハナエチゼンから新品種に順次切り替えていくとしています。

なお農林水産省によりますと、8月15日現在の主食用米の10アール当たり収量は494キログラムで、前年なみとなっています。",[],[]
1万円で1万2000円分の買い物ができる 福井駅前130店舗で使えるお得な買い物券を発売 利用は9月末まで（FBC 福井放送）,https://news.yahoo.co.jp/articles/886fb1d6ef45b302dc0c661878c990ea1180baab,https://newsatcl-pctr.c.yimg.jp/t/amd-img/20250829-03791113-fbc-000-4-thumb.jpg?exp=10800,2025-08-29T14:20:01+09:00,2025-08-29T19:57:07+09:00,FBC 福井放送,fbc,FBC 福井放送,412,"FBC福井放送
1万円で1万2000円分の買い物を。福井駅周辺の活性化に向けて、駅前の商店街130店以上で使えるプレミアム商品券の販売が29日から始まりました。9月いっぱい利用できます。

西武福井店の前にできた長蛇の列。お目当ては、福井駅前商店街振興組合が数量限定で販売を始めたプレミアム商品券です。

■60代女性
「いいね 1万2000円はちょっと大きいので頑張った」

1セット1万円で、1万2000円分の買い物券として利用でき、対象となる店舗は、福井駅周辺の飲食店や小売店、それに西武福井店やハピリンなど大型の商業施設を含めて130店舗以上あります。

■60代女性
「駅前に来ることが少ないので、地下の食品売り場とかそういうところで使おうと思っている」

プレミアム商品券「ふくトクお買物券」は7500セット限定で、9月1日まで連日販売され、福井駅周辺のにぎわいづくりにつなげます。利用期限は9月30日までです。",[],[]
嶺南の若手シェフや農家らがこだわり抜いたコース料理提供 御食国若狭の食の魅力をアピールへ（FBC 福井放送）,https://news.yahoo.co.jp/articles/23db177558625582389050c5ec67ab72c8bbb916,https://newsatcl-pctr.c.yimg.jp/t/amd-img/20250829-03356962-fbc-000-3-thumb.jpg?exp=10800,2025-08-29T13:55:01+09:00,2025-08-29T19:24:12+09:00,FBC 福井放送,fbc,FBC 福井放送,712,"FBC福井放送
嶺南を拠点に活動する若手の料理人や農家らが、細部までこだわり抜いたコース料理でもてなします。使われている食材はすべて地元産にこだわり、御食国若狭の食の魅力を県の内外に広く発信します。

鱧と昆布でだしを取ったキュウリのフランに、メインのシカのロースト。

デザートのイチジクのパフェまで、すべて若狭産の食材にこだわったコース料理です。

御食国若狭の食の魅力を再発見してもらおうと、有名店で経験を積んで地元に戻ってきたフランス料理のシェフをはじめ、嶺南を拠点に活動する若手の農家などが協力して準備してきました。

■美浜町の農家鳥羽宏昇さん
「福井のいいところを、外からも中からも知っている4人だからこそ 福井はおいしい食材、食に関わるストーリーがたくさん埋もれているということを、僕たちが伝道師となって伝えていきたいというのが一番の思い」

28日は試食会が開かれ、観光にたずさわる関係者が、細部までこだわり抜かれた自慢の料理を堪能しました。

■県観光連盟於保孝志さん
「ひとつひとつの料理が丁寧に考えられ調理されていて、コース全体の流れを通して素晴らしいなと感じた」

■フランス料理のシェフ吉岡翔太さん
「若狭に行ってみたいなと思うきっかけになるような料理を作って、さらに訪れてもらって、料理を通して若狭の魅力をたくさん感じてほしい」

準備したコース料理は、9月20日から3日間、完全予約制で振る舞われ、メンバーたちは、その後も季節ごとのイベント開催を目指して、御食国・若狭が誇る食の魅力発信を続けます。
＊コース料理に宿泊などセットで1人税込み3万3000円（コース＋ペアリング＋宿泊＊朝食付き）",[],[]
猛暑日日数の記録更新するか 県内に熱中症警戒アラート エアコンの適正な使用など予防を（FBC 福井放送）,https://news.yahoo.co.jp/articles/33f627df5e7d5191d61de2ee0c7f59e9b3a69942,https://newsatcl-pctr.c.yimg.jp/t/amd-img/20250829-09918448-fbc-000-3-thumb.jpg?exp=10800,2025-08-29T12:14:00+09:00,2025-08-29T19:23:10+09:00,FBC 福井放送,fbc,FBC 福井放送,332,"FBC福井放送
29日の県内は熱中症警戒アラートが発表され猛暑日の予想となっていて、気象台ではエアコンの適正な使用など熱中症予防を呼びかけています。

県内は高気圧の影響で気温が上がり、午前11時までの最高気温は美浜で34.8度、福井で33.2度など、朝から厳しい暑さとなっています。

■散歩に来た夫婦 
「けっこう暑い 日なたに出ると特に暑い 家ではクーラーが入っていて、外に出ると温度差がすごいからけっこう体がきつい」

日中の予想最高気温は福井で35度、敦賀で34度と、猛暑日となる見込みで、年間の猛暑日日数の記録を更新する勢いです。

環境省と気象庁では熱中症警戒アラートを発表して、エアコンの適正な使用や水分補給など熱中症予防の行動を呼びかけています。",[],[]
【地震情報】越前市などで震度1　震源は福井県嶺北　津波の心配なし　震源の深さは10キロ　M3.6と推定（FBC 福井放送）,https://news.yahoo.co.jp/articles/db3aef0b7031556a37d934929ff98f0ec3326547,https://newsatcl-pctr.c.yimg.jp/t/amd-img/20250829-04757128-fbc-000-3-view.jpg?exp=10800,2025-08-29T00:28:00+09:00,2025-08-29T06:01:11+09:00,FBC 福井放送,fbc,FBC 福井放送,216,"震源・震度情報＝気象庁ホームページより引用
気象庁によると、28日(木)午後11時35分ごろ、福井県嶺北を震源とする地震がありました。震源の深さは10キロ。地震の規模を示すマグニチュードは3.6と推定されます。なお、この地震による津波の心配はありません。

なお、福井県嶺北を震源とする地震は、25日(月)未明にも観測されています。

【各地の震度】
震度2　岐阜県揖斐川町
震度1　鯖江市、越前市、池田町、南越前町、越前町、敦賀市",[],[]
