headline,mainEntityOfPage,image,datePublished,dateModified,author,media_en,media_jp,str_count,body,images,external_links
初期近代イングランドに学ぶ、教養が深まる娯楽旅の作法（Meiji.net）,https://news.yahoo.co.jp/articles/bf2e4c67dba64db185c88df3c251a73df02710e9,https://newsatcl-pctr.c.yimg.jp/t/amd-img/20251023-00010000-meijinet-000-1-view.jpg?exp=10800,2025-10-23T13:42:35+09:00,2025-10-23T13:42:35+09:00,Meiji.net,meijinet,Meiji.net,3192,"初期近代イングランドに学ぶ、教養が深まる娯楽旅の作法
髙橋 三和子（明治大学 商学部 専任講師）

16世紀から17世紀にかけて、イングランドの旅行家たちは、ヨーロッパなどの地中海地域へ旅に出るようになりました。さらに18世紀になると、若者たちによる教育的な旅行も行われるようになります。近年、外国への興味の薄れから生じる、日本の若者たちの文化的な素養、教養の低下が懸念されていますが、初期近代イングランドの海外旅行には、これらを増強させるヒントがあるかもしれません。
◇巡礼や貿易が目的ではなく、娯楽のための個人旅行が始まった16世紀

イングランドにおける中世までの旅は、宗教的な巡礼や貿易などの商業活動を目的としたものが主流でした。それが初期近代の16世紀後半になると、その地域の文化や風習などへの興味から旅するようになります。これらは現代にまでつながる、娯楽のための個人旅行の始まりともいえるでしょう。

初期近代は、古代ギリシアや古代ローマの作家たちが書いた古典作品に対する興味が高まった頃です。地中海エリアは、そういった書物や神話、聖書の舞台となった地域でもあります。ヨーロッパ大陸と地続きではないイングランドの人々にとって、かつてローマ帝国があった地中海地域は憧れの対象でした。

またイングランドにおいて個人旅行があらわれはじめた16世紀後半から17世紀前半は、イングランドの哲学者、フランシス・ベーコンが体験重視の学問を提唱した時代とも重なります。彼は「旅は一つの教育である」と唱え、ほかのヒューマニストたちも異国を見聞することの重要性を強調しました。航海技術が進み、ヨーロッパ大陸へ渡りやすくなったこともあり、現地へ旅に出る人が増えていったのです。

16世紀はオスマン帝国が最も強かった時代です。当時の旅行先には、ヨーロッパの国々に加え、コンスタンティノープル（現イスタンブール）やエルサレムなど近東の都市も含まれていました。

プロテスタントのイングランド人が、ヨーロッパにあるカトリックの国々や、イスラム教圏であるオスマン帝国の領域に足を運ぶのは、リスクを伴います。異教徒と接する難しさもあれば、海賊に遭遇してしまうおそれもある。そのため、訪れる地域の文化や交通手段などを事前に調べるために活用されたのが旅行記です。

中世までの旅行記は写本を中心としたため、限られた人の手にしかわたりませんでした。しかし15世紀に活版印刷が発明されてからは、次第に印刷物が出回るようになります。16世紀から17世紀にかけてロンドンでは、さまざまな種類の印刷物を手に入れられるようになっていたようです。出回りはじめた当初の旅行記や巡礼記は、必ずしも実際に現地を訪れて著された書物ばかりではありませんでしたが、徐々にイングランド人による体験記も増えていきました。
◇18世紀には、若者の教育のための欧州旅行「グランドツアー」が確立

これら初期近代の旅行記には、その国の従うべき文化や、イングランド人と見破られないようにするための注意点なども記されていました。たとえばオスマン帝国を訪れる際にはオスマン風の衣装に着替えたり、コンスタンティノープルのモスクに入るときは靴を脱いだり。身の安全を保つためでもありますが、旅行者たちは異教徒を理解し、柔軟な態度で受け入れ、「郷に入れば郷に従え」を心がけていたようです。

また、語学が堪能であればその国の言葉をしゃべるようにしたり、いざというときはイングランド大使と連絡を取り合って助けてもらえるようにしたりと、さまざまな対策もとられていたようです。

現地の馬車や宿泊費、交通費の値段などが書かれている、ガイドブック的な旅行記もありました。さらには、事前に調べておくべきこと、異国に行って見るべきものなどが書かれた、マニュアル本的な書物も出てきます。

ベーコンの経験主義的な観点からも、若者たちへの教育のため海外旅行の推進が始まり、18世紀になると、イングランドの若者たちが教育のためにヨーロッパを巡る、「グランドツアー」と総称される旅が確立されます。諸外国の文化、政治、経済などを学ぶ機会を重視する考えが、定着していったわけです。とはいえ実際に行けたのはイングランド貴族の子どもたちで、家庭教師や従者たちと一緒に娯楽も含めた遊学の旅に出ていました。

社会に出る前に行く、教育の総仕上げという意味では、現代の修学旅行に近いかもしれません。しかし当時はヨーロッパ大陸に渡るだけでも大変だったため、いったん行くと各都市を数カ月単位で周遊する場合もあったようです。

グランドツアーを経験し、その文化や風習を知ることは、社会的なステータスにもなっていました。若者たちは教養を深めることを目的に、ヨーロッパの国々にある議事堂や裁判所、教会や大学などを見学。そこで裁判や教育がどう行われているかを知るなど、異国を調査しに行く感覚が強かったと考えられます。

とくに古代やルネサンスでも中心となり、文化的にも最先端だとされていたイタリアはイングランドにとって憧れの地であり、グランドツアーでも中心地とされていました。なかでもヴェネツィアは魅力的だと伝えられています。海洋の中心でもあり、文化芸術面でも非常に栄えた都市である一方、治安はあまり良くなかったようです。旅行記では、美しく面白いものも多いがゆえに、誘惑も多く危険もある街だと紹介されていました。
◇歴史書や古典作品などで知識を得てから旅するほうが、理解も深まり面白い

17世紀初めにロンドンで出版された旅行記には、ギリシア神話やローマ神話の世界を巡ることに特化したものや、聖書の物語に合わせて書かれたものもありました。読者層はある程度、上流階級の人たちが想定されており、古代ギリシア、古代ローマの古典作品を知っている前提で書かれていました。

そもそも当時、旅をする際には、古典作品などを通して文化的背景を学んでから行くことが当たり前でした。書物を通して外国の文化、歴史などの知識を得て、それらを体験することで確認していたのです。ヨーロッパ大陸の国々でも異国を巡る文化がありましたが、イングランドは海を隔てています。そこを往復するのには、また違う感覚があったのだろうと察せられます。

旅行記には、イングランドではこういうところがイタリアではこうだといった文化の違いも多く記されていました。イングランドでは使っていない傘やフォークをイタリアでは使っているなど、自分の生まれ育った地域と比較し、自国を客観的に知る機会としたのは現代に通じるものがあります。

一方で今の旅行では、現在の情報は仕入れても、古典について調べてから行くことはあまりないように思います。しかし当時のイングランド人を見本にするなら、訪れる地域の過去についても学んでみるべきです。ミュージカルなどの舞台や美術館の絵画などを見ても、舞台となった時代や創作された当時の文化や社会状況を知っていると伝わり方も変わります。たとえば、ギリシヤ・ローマ神話の知識があれば、演劇や絵画の背景となる多くの物語を理解でき、わかるものも増えていきます。

16～17世紀はもちろんのこと18世紀のイングランドと比べても、現代の私たちが旅行するハードルは低く、とても気軽です。情報もインターネットから容易に得られます。当時のイングランド人に思いを馳せると、この状況がいかに便利なのかを実感できるはずです。ぜひこの環境を活かし、現代の若者も積極的に知識を蓄え、海外への興味を増幅させてほしい。また若者に限らず、実際に旅をして体験を得る機会を増やすことの大切さを実感してもらえればうれしいです。
髙橋 三和子（明治大学 商学部 専任講師）",[],[]
