headline,mainEntityOfPage,image,datePublished,dateModified,author,media_en,media_jp,str_count,body,images,external_links
鹿児島市議会議員選挙　投票率は４０．７０パーセント　過去最低だった前回を３．３８ポイント上回る（ＫＹＴ鹿児島読売テレビ）,https://news.yahoo.co.jp/articles/593c7ad6de197500d12c9df382186b416e5dd518,https://newsatcl-pctr.c.yimg.jp/t/amd-img/20240414-09482637-kytnews-000-2-view.jpg?exp=10800,2024-04-14T23:25:00+09:00,2024-04-15T06:03:21+09:00,ＫＹＴ鹿児島読売テレビ,kytnews,ＫＹＴ鹿児島読売テレビ,79,\n鹿児島読売テレビ\n鹿児島市議会議員選挙の投票が14日、行われ、投票率は40.70パーセントでした。過去最低だった前回と比べ3.38ポイント上がりました。,['https://newsatcl-pctr.c.yimg.jp/t/amd-img/20240414-09482637-kytnews-000-2-view.jpg?exp=10800'],['https://news.yahoo.co.jp/articles/593c7ad6de197500d12c9df382186b416e5dd518/images/000']
鹿屋市で火事　住宅2棟全焼　ケガ人なし（ＫＹＴ鹿児島読売テレビ）,https://news.yahoo.co.jp/articles/cbbcafb7c140d634c96c0cf57eba8dedcc51841e,https://newsatcl-pctr.c.yimg.jp/t/amd-img/20240414-07716795-kytnews-000-2-view.jpg?exp=10800,2024-04-14T19:41:00+09:00,2024-04-14T20:14:38+09:00,ＫＹＴ鹿児島読売テレビ,kytnews,ＫＹＴ鹿児島読売テレビ,249,\n鹿児島読売テレビ\n鹿屋市で14日午後、住宅2棟を全焼する火事がありました。ケガ人はいませんでした。\n\n 火事があったのは鹿屋市笠之原町の住宅です。14日午後2時40分ごろ、近くの住民から「煙が出ている」と消防に通報がありました。火は約1時間に消し止められましたが、波江野 富雄さん（74）の木造平屋建ての住宅2棟が全焼したほか、敷地内の倉庫と隣の家の倉庫も燃えました。\n\n 波江野さんは1人暮らしで、出火当時は庭にいたためケガはありませんでした。警察と消防が火事の原因を調べています。,['https://newsatcl-pctr.c.yimg.jp/t/amd-img/20240414-07716795-kytnews-000-2-view.jpg?exp=10800'],['https://news.yahoo.co.jp/articles/cbbcafb7c140d634c96c0cf57eba8dedcc51841e/images/000']
定数45に対し61人が立候補 鹿児島市議会議員選挙　投票始まる（ＫＹＴ鹿児島読売テレビ）,https://news.yahoo.co.jp/articles/0ab492693733da4e5efb518b93e79b090ea246ca,https://newsatcl-pctr.c.yimg.jp/t/amd-img/20240414-09135893-kytnews-000-2-thumb.jpg?exp=10800,2024-04-14T11:53:01+09:00,2024-04-14T11:56:34+09:00,ＫＹＴ鹿児島読売テレビ,kytnews,ＫＹＴ鹿児島読売テレビ,339,\n鹿児島読売テレビ\n任期満了に伴う鹿児島市議会議員選挙は14日、投票が行われています。\n\n 鹿児島市議会議員選挙には定数45に対し61人が立候補しています。投票は14日午前7時から市内156か所で行われています。\n\n 投票所の1つ、天保山中学校でも有権者が訪れ、意中の候補者に1票を投じていました。午前11時までの投票率は10.63パーセントで前回と比べ0.36ポイント上回っています。\n\n 鹿児島市選挙管理委員会によりますと、13日までに期日前投票に行った人は5万5783人で前回よりも2908人多かったということです。\n\n 投票は一部の地域を除き14日午後8時までとなっています。開票は午後9時半から行われ、15日未明にはすべての議席が決まる見通しです。,[],[]
4歳女児が道路を横断中に普通乗用車にはねられ死亡　鹿児島県奄美市の県道（ＫＹＴ鹿児島読売テレビ）,https://news.yahoo.co.jp/articles/988d844ce3a0938ad09db9ace666dc076bb6f715,https://newsatcl-pctr.c.yimg.jp/t/amd-img/20240414-07762555-kytnews-000-7-thumb.jpg?exp=10800,2024-04-14T19:59:00+09:00,2024-04-14T23:12:39+09:00,ＫＹＴ鹿児島読売テレビ,kytnews,ＫＹＴ鹿児島読売テレビ,316,\n鹿児島読売テレビ\n14日夕方、奄美市の県道で4歳の女の子が普通乗用車にはねられ死亡しました。\n\n 事故があったのは奄美市笠利町用安の県道です。警察によりますと14日午後5時ごろ、道路を歩いて横断していた奄美市笠利町節田の丸田 紗千ちゃん(4)が奄美市街地方向から走って来た普通乗用車にはねられました。紗千ちゃんは約30分後に死亡が確認されました。\n\n 紗千ちゃんは当時、兄と一緒にいて、兄は事故に遭っていないということです。\n 現場は片側１車線の直線道路で近くに信号機や横断歩道はないということです。\n\n 警察は普通乗用車を運転していた公立小学校教諭の女性(43)から話を聞くなどして、事故の原因を調べています。,[],[]
鹿児島市議会議員選挙　間もなく投票締め切り（ＫＹＴ鹿児島読売テレビ）,https://news.yahoo.co.jp/articles/63b87043d7d0ffd4f726f6e814207e5209c8edb8,https://newsatcl-pctr.c.yimg.jp/t/amd-img/20240414-05472756-kytnews-000-2-thumb.jpg?exp=10800,2024-04-14T19:19:00+09:00,2024-04-14T19:22:35+09:00,ＫＹＴ鹿児島読売テレビ,kytnews,ＫＹＴ鹿児島読売テレビ,352,\n鹿児島読売テレビ\n任期満了に伴う鹿児島市議会議員選挙は一部の地域を除いて14日午後8時で投票が締め切られます。\n\n 鹿児島市議会議員選挙には定数45に対し61人が立候補しています。投票は14日午前7時から市内156か所で行われています。\n 投票所の1つ、天保山中学校でも有権者が訪れ、意中の候補者に1票を投じていました。\n\n 鹿児島市選挙管理委員会によりますと、午後5時までの投票率は23.48パーセントで前回と比べ0.61ポイント上回っています。\n また、13日までに期日前投票に行った人は5万5783人で前回より2908人多かったということです。\n\n 投票は一部の地域を除きこの後、午後8時で締め切られます。開票は午後9時半から行われあす未明にはすべての議席が決まる見通しです。,[],[]
