headline,mainEntityOfPage,image,datePublished,dateModified,author,media_en,media_jp,str_count,body,images,external_links
【激戦】射水市議選　定数２０に３０人立候補　女性2人当選の背景（北日本放送）,https://news.yahoo.co.jp/articles/c92fe6cfd857bf0db893206491793031dc59e657,https://newsatcl-pctr.c.yimg.jp/t/amd-img/20251117-04681942-knb-000-3-thumb.jpg?exp=10800,2025-11-17T19:35:00+09:00,2025-11-17T22:12:00+09:00,北日本放送,knb,北日本放送,1966,"KNB北日本放送
定数を大幅に上回る立候補者による激戦となった射水市議会議員選挙。自民党は公認・推薦だけで定数を上回り、新人女性2人も当選しました。選挙戦の様子を振り返ります。梅本記者のリポートです。

今回の射水市議会議員選挙は、定数20に対し、30人が立候補しました。前回より定数が2議席減り、立候補者が定数を大幅に上回る、激戦となりました。

有権者　80代男性
「多くの人が立候補されることはいいことやと思いますよ。いろんな見方からそれぞれ有権者に訴えるから」

射水市議会は富山県内で唯一、女性議員がいませんでした。

そんななか、今回の選挙には無所属の新人女性4人が自民党の推薦を受けて立候補し、2人が初当選しました。

初当選した岩口久梨果さん
「じゃあ、始めますよ、いい？、じゃあ、音楽スタート、はい」
初当選したうちの一人、27歳の岩口久梨果さんは、射水市を若い世代にとって暮らしやすい場所にしたいとの思いから立候補しました。

選挙戦に向けては、女性の政治参画に力を入れている種部恭子県議の後押しもありました。

陣営の中心メンバーは、同級生や交流を深めてきた市内の20代や30代の人たちです。

自身の取り組みを進めるには、若い世代が選挙や政治に関心を持つことが欠かせないと考え、SNSで率直な思いも発信しました。

岩口久梨果さん
「いい大人がガンバローとか言うて、はちまきまいてやっとるがも、中学生が見てドン引きしとったもんね」

種部恭子県議
「外から来る人、こう残したい、入れていくような地域を残したい、という思いで、地域のために役立って、いいじゃないですか。頑張ってもらいましょうよ。好きなことさしてください」

岩口久梨果さん
「あたたかい街を残していくために、私はそもそもこの街を残していきたい、そのために、若者に選ばれる街にならないといけないと考えていまして、その若者と、行政をつなぐパイプ役になりたい」

種部県議は、悩みや怒りの背景に政治の課題があるのではないかと考える女性たちが集まり、女性の政治参画について意見を交わす場を設けています。

種部恭子県議
「別に女でも男でも仕事できればいいと思ってるんですよ。女性が入ってくると、厚みが出るんですよ、政策に。そのために絶対必要なんで」

意見交換の場は、今年4月の富山市議選や、先月の入善町議選での女性議員の誕生にもつながっています。

種部恭子県議
「議員になったらどのくらい生活に制約があるのかとか。女性ならではの心配をしているんですよね。男の人とはちょっとまた違う悩みがある。それを一歩超えるということが必要なので。私は背中を押す役割」

今回の射水市議選は、定数20に対し、自民党が22人を公認・推薦し、自民系だけで定数を上回る異例の事態となりました。

前回、12年ぶりに待望の市議会議員が誕生した射水市東部の海老江地区では、2期目を目指す自民党の現職と、無所属で自民党の推薦を受けた新人女性が立候補し、現職陣営は、複雑な思いを抱えながら選挙戦を戦っていました。

杉浦実さん
「全然（情勢が）読めません。絶対に負けるわけにはいきません。自分の思いは、誰が、地元のために働いてくれるか。誰が、射水市のために働いてくれるか。市民の方からは、自民党は何を考えてるんだ、（定数）20名に対して22名の推薦公認ちゃ、ちょっとおかしくないのと。そういう意見は多くききました。それは今後、自民党の、支部のほうには訴えていきたいと思います」

自民党射水市連の永森直人支部長は、市議会議員は地区の代表という時代ではなくなっているとしたうえで、公認や推薦が定数を上回ったことについては「立候補にあたって自民党を選んでもらったことを尊重した」としています。

今回の選挙では、自民党は公認の7人全員が当選しました。また、推薦した15人のうち9人が当選しました。

射水市議と県議を務めた、共産党の津本二三男さんがトップ当選。

立憲民主党は、元職の澤村理さんが当選して議席を獲得しました。

公明党は新人が初当選。一方、維新は新人が及ばず議席を獲得できず、県内の選挙で初挑戦となった日本保守党も議席獲得には至りませんでした。

射水市は誕生して20年。公共施設の再編や、能登半島地震の液状化被害への対応などの課題があります。

有権者　20代男性
「南北で格差が出始めてる部分があるんで。もうちょっと、住みやすい街づくりってものを考えていただければと思っています」

有権者　30代男性
「私が子育て世代なんですけども、子どもの政策とかそういったことを重視してますね」

市議会には、多様な議論を重ね、市民のニーズに応えていくことが求められます。",[],[]
田畑議員　次期衆院選立候補に意欲　企業後援会は活動休止継続（北日本放送）,https://news.yahoo.co.jp/articles/49d1856f69abc9c1a3e0c4dbc541cbe23c936296,https://newsatcl-pctr.c.yimg.jp/t/amd-img/20251117-04684557-knb-000-2-thumb.jpg?exp=10800,2025-11-17T19:17:00+09:00,2025-11-17T19:20:55+09:00,北日本放送,knb,北日本放送,1592,"KNB北日本放送
自民党の田畑裕明衆議院議員の無断・架空の党員登録問題などを受けて活動を休止中の田畑議員の企業後援会がきのう会合を開きました。会合では会長を交代した上で活動休止を継続することを決めました。また、田畑議員は後援会幹部に対し次期衆院選への立候補に意欲を示したということです。神林記者のリポートです。

田畑議員の企業後援会「響裕会」はきのう、地元・富山市の呉羽地区で臨時総会を開きました。

響裕会は、去年発覚した田畑議員の無断、架空の党員登録問題を受けて活動を休止していました。

会合は一部を除いて非公開で行われ、高田順一会長が退任し、別の後援会の会長を務めている、元県医師会会長の馬瀬大助さんが、会長を兼任することになりました。

報道陣に公開された場面で、田畑議員は高田前会長への感謝を述べた上で、自身の問題について次のように話しました。

田畑裕明衆議院議員
「ご心配のご迷惑をおかけしたことには、重ね重ねおわびを申し上げる次第でありますが、この説明責任を、役員の方からももっときちんと果たせ、ということもいただいているわけでありまして。もちろん、前向きに私の背中を押していただけるものというふうに、きょうも拝察をしているところでございます」

こう話しましたが、響裕会としては引き続き活動を休止することが決まりました。

関係者によりますと臨時総会の前に開かれた役員会で、田畑議員が活動再開を提案しましたが「説明責任を果たしていない」などの理由で、役員から反対意見が出たということです。今後については役員で協議するとしています。

会合後、新たに就任した馬瀬会長は。

響裕会　馬瀬大助新会長
「われわれは、田畑さんの仕事のやり方とか実績を踏まえて、今後も応援していきたい。たとえ最後の1人になっても、応援する覚悟でお引き受けしました」

また、田畑議員が次の衆院選に立候補する意向を示していると明らかにしました。

響裕会　馬瀬大助新会長
「出たいとおっしゃるから 今後も後援会としては応援すると。田畑さんがやると、やりたいとおっしゃっているんであれば、後援会としては応援するしかないと考えております」

一方、自民党富山市連は、次の衆院選では田畑議員とは別の候補者を立てることを党本部からも承認を得たとして、選考を進めています。

自身を除外して選考が進められていることについて、田畑議員は「初めて聞いた」と述べました。

田畑裕明衆議院議員
「いま、初めて聞きましたのでちょっとわかりませんが、現職としてまさに経済対策、皆さんの物価高にお困りの声いただいていますから、しっかり政策としてきょうも小林政調会長 来ていただきましたが、富山の皆さんにしっかり仕事として お返しをしながら、結果を出していきたいと思いますので。また自民党県連市連の皆さんにも、私はしっかり一緒に仕事をしたいってことも申し入れをさせていただいておりますから、これからしっかり話をしていきたいと思います」

記者
「次の衆院選はどうするのか？」

田畑裕明衆議院議員
「とにかくいま、応援されているたくさんの声をいただいていますから、しっかり仕事していきたいと思います。ありがとうございました」

お伝えした通り、衆院選・富山1区をめぐっては現職の自民党・田畑議員のほか、自民党富山市連が独自に候補を擁立する方針で選考委員会を設けています。

田畑議員が立候補すれば、保守分裂となる可能性が高まってきます。

また、比例で復活当選した立憲民主党の山 登志浩議員も立候補する見通しです。

また、日本維新の会と共産党も候補者の擁立に向け検討中です。

参政党は斉藤匠さんを擁立すると発表しました。

さらに去年の衆院選に無所属で出馬した吉田豊史さんも「出馬を検討している」としています。",[],[]
富山地鉄一部区間廃止めぐり　「時間をかけて議論を」指摘相次ぐ（北日本放送）,https://news.yahoo.co.jp/articles/577e30141592176b14384d7221c65d6f875e4dea,https://newsatcl-pctr.c.yimg.jp/t/amd-img/20251117-06397666-knb-000-2-thumb.jpg?exp=10800,2025-11-17T19:12:01+09:00,2025-11-17T19:18:54+09:00,北日本放送,knb,北日本放送,671,"KNB北日本放送
富山県の今後の地域交通戦略を話し合う会議できょう、鉄道についての部会が開かれました。富山地方鉄道は一部区間について、自治体からの支援がなければ廃線とする方針を示していて、出席者からは「時間をかけてしっかりと議論すべき」といった意見が相次ぎました。

県地域交通戦略会議の鉄軌道サービス部会には、県の担当部署や鉄道会社の関係者、それに有識者が出席しました。

富山地方鉄道は、本線の「滑川ー宇奈月温泉間」と、立山線の「岩峅寺ー立山間」について、今年12月末までに沿線自治体から運営支援の意思表示がなければ、廃止を届け出る方針を示しています。

きょうの会合で富山地鉄の新庄一洋専務は、コロナ禍以降、乗客数が回復していないことや、燃料費の高騰などの要因が重なり、鉄道線は「事業として成り立たない状況」と改めて説明しました。

これに対し、富山大学の本田豊教授は「交通ネットワークの維持の観点から、十分な議論の時間をかける必要がある」と意見を述べました。

また、部会長の関西大学・宇都宮浄人教授は「公共サービスとしての鉄道を公的資金の投入も含めて、しっかり支え、十分に議論する時間が必要だ」と指摘しました。

会合の終了後、新庄専務は。
富山地鉄　新庄一洋専務
「公共（サービス）としてここは必要だから、財源を確保する。しっかり役割分担、責任分担を示していただけると、事業も公共としての立場、民間としての立場、両方で努力しながらできるんでないかなと考えています」

このように述べ、今後の検討会で協議を進めたい考えを示しました。",[],[]
４年ぶり女性議員誕生　射水市議選　新人女性２人が当選（北日本放送）,https://news.yahoo.co.jp/articles/fa2d3d1b92968c767f992c71f5cb4a2e09c19983,https://newsatcl-pctr.c.yimg.jp/t/amd-img/20251117-04116513-knb-000-2-thumb.jpg?exp=10800,2025-11-17T19:10:00+09:00,2025-11-17T19:15:54+09:00,北日本放送,knb,北日本放送,567,"KNB北日本放送
きのう投開票が行われた、射水市議会議員選挙の当選者にきょう、当選証書が手渡されました。今回の選挙では新人の女性2人が当選し、射水市議会では4年ぶりに女性議員が誕生しました。

当選証書付与式はきょう、射水市役所で行われました。

射水市議会議員選挙は、定数が2議席減り20議席となった中、30人が立候補し激戦となりました。

選挙の結果、現職13人、元職2人、新人5人が当選しました。

トップ当選は、2244票を獲得した共産党の元職で前県議会議員の津本二三男さんでした。

日本共産党 津本二三男さん
「期待に応えれるように、ひとりではなかなか難しいこともあるので、多くの人とみんなで、市民の皆さんと力も合わせて頑張っていきたいなと思ってます」

また、新人女性2人が当選し、射水市議会では4年ぶりに女性議員が誕生しました。

無所属・自民推薦　井相田礼子さん
「時代の流れとともに、多様化が進んでおりますので、男性目線、女性目線、またシニアの目線であるとか、若者の目線であるとか、いろいろな視点からのアプローチを市民の皆さんからいただいて、市政に反映することが重要と考えております」

投票率は、前回を0.63ポイント上回る55.21パーセントでした。

射水市議会議員の新しい任期は、今月27日から4年間です。",[],[]
クマ出没　住宅の敷地内に痕跡　富山市八尾町（北日本放送）,https://news.yahoo.co.jp/articles/6f8c364706182364f00d8f7a14b6c50f18b4226f,https://newsatcl-pctr.c.yimg.jp/t/amd-img/20251117-04316612-knb-000-2-thumb.jpg?exp=10800,2025-11-17T19:07:01+09:00,2025-11-17T19:13:56+09:00,北日本放送,knb,北日本放送,361,"KNB北日本放送
富山市八尾町では、きょうも住宅の敷地内でクマの痕跡が確認されました。県内では南砺市や立山町でもクマの目撃や痕跡が見つかっていて、警察などが注意を呼び掛けています。

富山市によりますと、きょう午前7時ごろ富山市八尾町西葛坂の住宅の裏で、クマのふんとカキの木に残る爪痕をこの家に住む人が見つけ通報しました。

カキの木には、クマに食べられたとみられるカキの実も残されていました。

住人
「二日ほど前にも、いっぺんきてっとるわ。そこへ。この近所へは、よくクマが来るがだけど、私のところに来たのは初めて」

この他、県内では富山市の山田湯や八尾町三田、立山町の上末、南砺市の大島や閑乗寺などでも、クマの姿や痕跡が確認されています。

クマの動きが活発になる夜や朝方は外出を控えるなど引き続き注意してください。",[],[]
あす気温急低下　あす夜から初雪の可能性（北日本放送）,https://news.yahoo.co.jp/articles/684759a21716e491b9464ec730acf38d22cc2002,https://newsatcl-pctr.c.yimg.jp/t/amd-img/20251117-02752671-knb-000-2-thumb.jpg?exp=10800,2025-11-17T19:06:00+09:00,2025-11-17T19:10:56+09:00,北日本放送,knb,北日本放送,445,"KNB北日本放送
スタジオには気象予報士の平島さんです。今シーズン一番の強い寒気が流れ込む見込みですね。

こちらは、あす午前9時の予想天気図です。

等圧線が縦に並ぶ「西高東低の冬型の気圧配置」となります。

北西から冷たい空気が吹き込み、気温が急激に下がります。

あすの富山市の最低気温は7度、最高気温は9度の予想です。

きょうの最高気温が22.7度でしたから、14度近くも下がりますね。
はい。急に寒くなるので体調管理には注意が必要ですね。

初雪は降りそうですか。
平野部で雪が降る目安となるのは、上空1500メートル付近のマイナス6℃以下の寒気です。

県内のあすは、マイナス3度以下の寒気ですが、あさっての朝方にかけて、マイナス6度以下の寒気が流れ込む予想となっています。

雪が降るのかどうか微妙な感じもしますが。

あさって朝の最低気温が4度の予想なので、初雪が観測されるとすれば、あすの夜からあさっての朝にかけて可能性があると思います。

気象予報士の平島さんでした。",[],[]
冬の使者オオハクチョウ飛来　今季一番の寒気流入　平野部でも初雪か（北日本放送）,https://news.yahoo.co.jp/articles/28b2853ea8a85feda275bdad9b6b3b3910b718c9,https://newsatcl-pctr.c.yimg.jp/t/amd-img/20251117-01946338-knb-000-2-thumb.jpg?exp=10800,2025-11-17T19:05:00+09:00,2025-11-17T19:13:56+09:00,北日本放送,knb,北日本放送,415,"KNB北日本放送
冬の使者とも呼ばれるオオハクチョウが、きょう富山市に飛来しているのが確認されました。県内はけさの穏やかな陽気から一転、あさってにかけて真冬並みの強い寒気が流れ込む見込みです。平野部でも初雪となる可能性があります。

けさの県内は広い範囲で晴れ、立山町では、穏やかな日差しのもと、青空をバックに雪をいただいた立山連峰が映えていました。

富山市婦中町小長沢の田んぼには、冬の訪れを告げるオオハクチョウの群れが飛来していました。

きょう日中の最高気温は、富山空港で23.4度、富山市八尾町で22.8度など、10月上旬並みの陽気となり、県内10の観測地点すべてで20度を超えました。

一方、午後は寒冷前線が通過し、県内にはあさってにかけて今シーズン一番の強い寒気が流れ込む見込みで、平野部でも初雪となる可能性があります。

また、山間部では、積雪の恐れもあります。冬タイヤへの交換など早めの対策を心がけてください。",[],[]
ＹＫＫ　パナＨＤ住宅設備子会社の株式取得　リフォーム需要獲得へ（北日本放送）,https://news.yahoo.co.jp/articles/1c363e8e37699cccfb9ddb1f5263c6c8bf849b9f,https://newsatcl-pctr.c.yimg.jp/t/amd-img/20251117-09327632-knb-000-2-thumb.jpg?exp=10800,2025-11-17T19:03:01+09:00,2025-11-17T19:09:00+09:00,北日本放送,knb,北日本放送,437,"KNB北日本放送
富山県内に生産拠点を置くYKKはきょう、パナソニックホールディングスの子会社で、住宅設備を手がけるパナソニックハウジングソリューションズの株式80パーセントを取得すると発表しました。

きょう午後、都内でYKKの堀会長とパナソニックハウジングソリューションズの山田社長が会見し、説明しました。

YKKは、パナソニックハウジング社の株式80パーセントを、中間持ち株会社を設立したうえで取得します。

買収額は非公表ですが、会見でハウジング社の企業価値は2276億円と説明しました。

建材事業を担うYKKAPが去年11月、ハウジング社側から戦略的検討を持ち掛けられ、契約締結に至ったということです。

YKKとしては両社の強みを生かした相乗効果で、大規模修繕から住宅リフォームまで多岐にわたるリフォーム需要の獲得につなげたい考えです。

海外展開を加速させ、2035年度には両社合わせた売上高を今の1兆円余りから1兆5000億円まで増やしたいとしています。",[],[]
富山県勢　初戦の対戦相手は？　ＳｏｆｔＢａｎｋ　ウインターカップ　２０２５　（北日本放送）,https://news.yahoo.co.jp/articles/9ee19745612a8ef490082c085e811dc2df6e61d7,https://newsatcl-pctr.c.yimg.jp/t/amd-img/20251117-05413519-knb-000-2-view.jpg?exp=10800,2025-11-17T19:02:01+09:00,2025-11-17T19:09:55+09:00,北日本放送,knb,北日本放送,256,"KNB北日本放送
全国の男女120チームが、高校バスケットボールの頂点を目指す「ウインターカップ」についてです。男子は高岡第一高校、女子は龍谷富山高校が富山県代表として出場します。きょう組み合わせ抽選が行われ、県勢の初戦の相手が決まりました。

男子の高岡第一高校は、2年ぶり7回目の出場です。初戦は2年ぶり19回目の出場となる広島県代表、広島皆実高校と対戦します。

女子の龍谷富山高校は、5年連続32回目の出場です。初戦は初出場の長崎県代表の瓊浦高校との対戦です。ウインターカップは、来月23日に開幕します。",[],[]
高校サッカー選手権　富山第一は佐賀県代表と大みそかに対戦（北日本放送）,https://news.yahoo.co.jp/articles/51a77b7e441fe6a5c649e288d5657a0b15145021,https://newsatcl-pctr.c.yimg.jp/t/amd-img/20251117-02782315-knb-000-2-view.jpg?exp=10800,2025-11-17T19:02:01+09:00,2025-11-17T19:06:57+09:00,北日本放送,knb,北日本放送,702,"KNB北日本放送
来月28日に開幕する、全国高校サッカー選手権大会の組み合わせ抽選会が、きょう東京で行われました。

富山県代表の富山第一高校の初戦は大みそかの2回戦で、佐賀県代表の佐賀東高校と対戦することが決まりました。

東京の日本テレビで行われた組み合わせ抽選会には、全国の代表校の監督やキャプテンが集まりました。

2大会ぶり35回目の出場となる富山第一は木下空キャプテンが、出場48校中44番目にくじを引きました。

「富山第一高校・トーナメント番号37番です」
「富山第一高校の初戦は佐賀東高校に決まりました」
「2回戦からの登場・富山第一高校2度目の日本一に向けて35回目の全国に挑みます」

富山第一は、大みそかの2回戦で佐賀県代表の佐賀東高校と対戦することが決まりました。

佐賀東高校は、県大会4試合を戦い31得点・無失点で3大会連続15回目の出場を決めました。

両校は、2大会前の全国選手権3回戦でも対戦していて、その時は富山第一が1対5の大差で敗れています。

記者
「（相手は）優勝経験のある富山第一ですが？」
佐賀東高校　中村友キャプテン
「伝統のある富山第一とやれることをとても楽しみにしています。全国ベスト4を目指して、1戦1戦たたかっていきたい」

記者
「2大会ぶりの全国の舞台抽選も終えました今の心境は？」
富山第一高校　木下空キャプテン
「去年、県予選で負けてしまって、そこのリベンジをして全国大会に戻ってくることができてとてもうれしい。1戦1戦大事に戦って、チームとして2回目の優勝を果たしたい」

試合の模様は大みそか、KNBテレビで実況生中継で放送します。",[],[]
