headline,mainEntityOfPage,image,datePublished,dateModified,author,media_en,media_jp,str_count,body,images,external_links
「かけっこ教室」で児童が速く走るコツを教わる　富山銀行「夢作文」学校賞（北日本放送）,https://news.yahoo.co.jp/articles/16e97a9c7cd2bcb011693155881d90439d0c16ad,https://newsatcl-pctr.c.yimg.jp/t/amd-img/20251117-07218265-knb-000-2-thumb.jpg?exp=10800,2025-11-17T17:46:01+09:00,2025-11-17T17:51:55+09:00,北日本放送,knb,北日本放送,319,"KNB北日本放送
富山市の小学校で「かけっこ教室」が開かれ、児童が陸上選手から速く走る方法を教わりました。

この教室は、富山銀行が毎年小学生を対象に行っている作文コンクール「夢作文」で、学校賞を受賞した富山市楡原の神通碧小学校で開かれました。

富山銀行所属で、100メートル走などの県記録を持つ福島聖選手が講師となり、全校児童およそ40人に対して、ヒザを前に出すなどの速く走るコツを指導しました。

児童
「一歩一歩がめっちゃ大きくて、びっくりしました」
「やっぱ、めっちゃ速かった。福島選手みたいに、富山一になりたい」

福島選手は、「楽しいと思えることに熱中することが、夢に近づく一歩です」と、子どもたちにエールを送っていました。",[],[]
富山県の実質経済成長率　0.8％から0.3％へ下方修正　今年度推計（北日本放送）,https://news.yahoo.co.jp/articles/46fb4e00717b3671c80dbff26f2c3a3fc15c10c6,https://newsatcl-pctr.c.yimg.jp/t/amd-img/20251117-08874449-knb-000-4-thumb.jpg?exp=10800,2025-11-17T12:23:00+09:00,2025-11-17T19:09:56+09:00,北日本放送,knb,北日本放送,366,"KNB北日本放送
中部広域9県の景気動向などを研究する中部圏社会経済研究所は、今年度の富山県の実質経済成長率を0.8パーセントのプラスから0.3パーセントのプラスに下方修正しました。

中部圏社会経済研究所は、今年度の県の実質経済成長率が0.3パーセントのプラスと見込んでいると発表しました。

能登半島地震の復興関連需要や民間設備投資が堅調に伸びている一方、トランプ関税の影響で部品メーカーなどが連鎖的に影響を受けました。

さらに、食品価格の高騰で実質賃金が伸びずに民間消費支出も下がっていて、去年12月に公表した0.8パーセントのプラスから下方修正しました。

また来年度は、復興需要が石川県から富山県へ波及すれば、県や市町村が発注する公需が伸びる可能性があるとしていて、0.4パーセントのプラスと見込んでいるということです。",[],[]
