headline,mainEntityOfPage,image,datePublished,dateModified,author,media_en,media_jp,str_count,body,images,external_links
前事務局長の横領問題　自民県連　検察審査会に申し立て（BBCびわ湖放送）,https://news.yahoo.co.jp/articles/87bb4cc0d3eaac22014d78a8e2f18e1f908db187,https://newsatcl-pctr.c.yimg.jp/t/amd-img/20240517-00010002-bbcbiwakov-000-1-thumb.jpg?exp=10800,2024-05-17T19:36:36+09:00,2024-05-17T19:36:36+09:00,BBCびわ湖放送,bbcbiwakov,BBCびわ湖放送,476,\nBBCびわ湖放送\n業務上横領の疑いで書類送検され、不起訴処分となった自民党滋賀県連の前の事務局長について、県連は、不起訴を不服として、17日までに、大津検察審査会に審査を申し立てました。\n\nこの問題は、自民党滋賀県連の前の事務局長が、県連や県議会の自民党会派の口座から、現金を横領していたことがわかり、県連と県議会の会派が、2022年に刑事告訴していたものです。\n\n今年2月に前の事務局長は、県警に業務上横領の疑いで書類送検されましたが、3月、大津地検は、「起訴するに足りる十分な証拠が得られなかった」として不起訴処分としました。不起訴処分について、自民党滋賀県連は、今月10日、これを不服とし、大津検察審査会に審査を申し立てたということです。\n\n不起訴処分を受けて開いた先月の会見で、県連の大岡敏孝会長は「4000万円を超える金が横領されて不起訴という結果では、とても党員にも県民にも説明ができない」\n\nまた県連は、横領された約4490万円についても返還を求め、先月30日に、大津地裁に民事訴訟を起こしたことも明らかにしました。,[],[]
自動車の納税通知書を誤送付（BBCびわ湖放送）,https://news.yahoo.co.jp/articles/430062e14343d9d01d302ad17922e8cfd5819cb3,https://newsatcl-pctr.c.yimg.jp/t/amd-img/20240517-00010005-bbcbiwakov-000-1-view.jpg?exp=10800,2024-05-17T19:55:54+09:00,2024-05-17T19:55:54+09:00,BBCびわ湖放送,bbcbiwakov,BBCびわ湖放送,455,\nBBCびわ湖放送\n自動車の納税通知書が誤って別の人に発送される誤送付があったと県自動車税事務所が発表しました。\n\n県自動車税事務所によりますと、今月7日、およそ38万通の自動車税納税通知書を発送しましたが、所有する車とは異なる納税通知書が自宅に届くという誤送付が10件確認されたという事です。また、以前住んでいた住所に通知書が届く誤送付も684件あったということです。\nBBCびわ湖放送\n誤送付の原因について県自動車税事務所では、今年度の納税通知書から、課税情報の登録作業が手入力から、一部自動化したことも影響している可能性があるとしたうえで、県自動車税事務所・中田勇一所長は「事務の最終チェックができていれば未然に防げたと思う。その徹底を図ることは必須」と話しました。\n誤送付のうち、1件はすでに納税されていて県自動車税事務所では一度返金したのち正しい納税通知書を発送することにしています。また、旧住所に送られた通知書については、納税状況を確認後、今月21日に変更後の住所に発送する予定です。,"['https://newsatcl-pctr.c.yimg.jp/t/amd-img/20240517-00010005-bbcbiwakov-000-1-view.jpg?pri=l&w=640&h=360&exp=10800', 'https://newsatcl-pctr.c.yimg.jp/t/amd-img/20240517-00010005-bbcbiwakov-001-1-view.jpg?pri=l&w=640&h=360&exp=10800']","['https://news.yahoo.co.jp/articles/430062e14343d9d01d302ad17922e8cfd5819cb3/images/000', 'https://news.yahoo.co.jp/articles/430062e14343d9d01d302ad17922e8cfd5819cb3/images/001']"
国スポ・障スポ機運盛り上げ　大津駅前でサプライズイベント（BBCびわ湖放送）,https://news.yahoo.co.jp/articles/1de4c860daabe19583c84098d263ae44bf4ea3e4,https://newsatcl-pctr.c.yimg.jp/t/amd-img/20240517-00010001-bbcbiwakov-000-1-thumb.jpg?exp=10800,2024-05-17T19:33:57+09:00,2024-05-17T19:33:57+09:00,BBCびわ湖放送,bbcbiwakov,BBCびわ湖放送,270,\nBBCびわ湖放送\n来年、滋賀で開催される国スポ・障スポの開幕まで500日となった16日、大津駅前では大会の機運を盛り上げるサプライズイベントが開かれました。\n\nイベントは、16日夕方駅利用者らが行き交うJR大津駅前で行われました。突然の歌い出しに駅利用者らが目を奪われていると次は、華やかなドレス姿のソプラノ歌手が登場。4人のオペラ歌手による美しい合唱が始まりました。\n\n「開催まで あと500日」と記された横断幕が掲げられる中国スポ・障スポのイメージソング「シャイン！！」の歌も響き駅の利用者らが大きな拍手を送っていました。,[],[]
湖西浄化センター　バラ園の一般公開（BBCびわ湖放送）,https://news.yahoo.co.jp/articles/b78e09f075a49740705f97d299f313a58cd0702a,https://newsatcl-pctr.c.yimg.jp/dk/yvpub-bucket001-west/contents/yvpub-content-244c43969a1bb68ad01d9ba7d65def79/14359328-507956d7a59b6498d81717164fec964e/img/1715942906/thumbnail.jpg?exp=10800,2024-05-17T19:48:16+09:00,2024-05-17T19:48:16+09:00,BBCびわ湖放送,bbcbiwakov,BBCびわ湖放送,308,\nBBCびわ湖放送\n大津市にある滋賀県湖西浄化センターでは、17日からバラ園が一般開放され春に咲く色とりどりのバラの花が、訪れた人の目を楽しませています。\nBBCびわ湖放送\n滋賀県湖西浄化センターでは庭園に植えられている90種、およそ700株のバラが見ごろを迎えています。\nBBCびわ湖放送\n毎年、春と秋に行われるバラの一般公開は湖西浄化センターのイメージアップを図ろうと始まったもので、下水を綺麗にする過程で発生した汚泥をたい肥として使い、水やりにも処理水を使っています。\n今年は春先から雨が多く降ったことで例年より少し早く見ごろになったという事です。バラの一般公開は、今月28日までとなっています。,"['https://newsatcl-pctr.c.yimg.jp/t/amd-img/20240517-00010003-bbcbiwakov-001-1-view.jpg?pri=l&w=640&h=360&exp=10800', 'https://newsatcl-pctr.c.yimg.jp/t/amd-img/20240517-00010003-bbcbiwakov-002-1-view.jpg?pri=l&w=640&h=360&exp=10800']","['https://news.yahoo.co.jp/articles/b78e09f075a49740705f97d299f313a58cd0702a/images/000', 'https://news.yahoo.co.jp/articles/b78e09f075a49740705f97d299f313a58cd0702a/images/001']"
SNS型投資詐欺　約5200万円だまし取られる（BBCびわ湖放送）,https://news.yahoo.co.jp/articles/7963482030ec0f36f60d5260f1363f633477b41c,https://newsatcl-pctr.c.yimg.jp/t/amd-img/20240517-00010004-bbcbiwakov-000-1-thumb.jpg?exp=10800,2024-05-17T19:50:25+09:00,2024-05-17T19:50:25+09:00,BBCびわ湖放送,bbcbiwakov,BBCびわ湖放送,416,\nBBCびわ湖放送\n近江八幡市の男性がSNSで知り合った人物から投資話を持ちかけられ5200万円余りをだまし取られました。警察では、詐欺事件として捜査しています。\n\n詐欺被害にあったのは、近江八幡市に住む60歳の男性です。警察によりますと、男性はかねてから投資を行っていたところ、メッセージアプリの投資グループに招待され、グループ内で先生と呼ばれる人物などから「資金を増やせば利益が出る」「グループ参加者の方にもっと稼いでもらいたい」などと投資話を持ちかけられました。\n\n実際に、アプリ内では利益が出ていたことから、男性は、これを信じ複数のグループに対して、合計20回にわたって入金を続け、結果、去年8月から今年1月にかけて、あわせておよそ5200万円をだまし取られたという事です。\n\n警察では、SNSなどで、投資による儲け話を持ちかけ、入金を指示するものは詐欺とみて、必ず警察に相談するよう注意を呼びかけています。,[],[]
水害に備えて　草津市で水防パトロール（BBCびわ湖放送）,https://news.yahoo.co.jp/articles/bd55aca3a2e4aa073da4b0c986226af4213a57ea,https://newsatcl-pctr.c.yimg.jp/t/amd-img/20240517-00010000-bbcbiwakov-000-1-thumb.jpg?exp=10800,2024-05-17T19:26:47+09:00,2024-05-17T19:26:47+09:00,BBCびわ湖放送,bbcbiwakov,BBCびわ湖放送,417,\nBBCびわ湖放送\n草津市では17日、台風や集中豪雨など大雨による水害に備えて、水防パトロールが行われました。\nこの活動は、梅雨など雨の多くなる季節を前に、草津市が、水害が予想される市内の河川などの危険箇所の現状を視察し、対策を協議していこうと毎年行っているものです。\nBBCびわ湖放送\n17日のパトロールには、草津市の橋川渉市長をはじめ、市の職員のほか、県や消防、警察の関係者など合わせて15人が参加し、市内を流れる3つの一級河川の状況を点検しました。このうち、草津川では、川の流れにより川底が削れて、下流に土砂が堆積するのを防ぐため、川底にブロックを敷き詰める工事が進められています。\nBBCびわ湖放送\n橋川市長は、県の担当職員の話を聞きながら危険箇所の確認や点検をしていきました。草津市では、17日のパトロールの結果を踏まえ、改修などが必要な箇所については、関係機関と連携しながら防災措置を講じることにしています。,"['https://newsatcl-pctr.c.yimg.jp/t/amd-img/20240517-00010000-bbcbiwakov-001-1-view.jpg?pri=l&w=640&h=360&exp=10800', 'https://newsatcl-pctr.c.yimg.jp/t/amd-img/20240517-00010000-bbcbiwakov-002-1-view.jpg?pri=l&w=640&h=360&exp=10800']","['https://news.yahoo.co.jp/articles/bd55aca3a2e4aa073da4b0c986226af4213a57ea/images/000', 'https://news.yahoo.co.jp/articles/bd55aca3a2e4aa073da4b0c986226af4213a57ea/images/001']"
