headline,mainEntityOfPage,image,datePublished,dateModified,author,media_en,media_jp,str_count,body,images,external_links
ファントムが1週間で13％の上昇、TVLも一時2億ドルを超える（CoinDesk JAPAN）,https://news.yahoo.co.jp/articles/4a60521836c1fc71b602cf4d842de9a182847c45,https://newsatcl-pctr.c.yimg.jp/t/amd-img/20240517-00252725-coindesk-000-1-view.png?fmt=jpeg&q=85&exp=10800,2024-05-17T19:30:07+09:00,2024-05-17T19:30:07+09:00,CoinDesk JAPAN,coindesk,CoinDesk JAPAN,901,\nファントムが1週間で13％の上昇、TVLも一時2億ドルを超える\nファントム（Fantom）ブロックチェーンのFTMは、ソニック・アップグレードの展開とプロトコル上の預かり資産（TVL）の増加を市場が好意的に見ているため、過去1週間で最もパフォーマンスの良い非ミームトークンの1つになった。\n\n\nCoinDeskのデータによると、FTMは過去7日間で13％上昇し、約81セントとなったが、より広範な暗号資産（仮想通貨）の指標であるCoinDesk 20（CD20）はわずか1.5％の上昇にとどまっている。\n\n\nここ数週間、ファントム財団はコードネーム「ソニック（Sonic）」と呼ばれる最新アップグレードを推し進めている。ダッシュボードによると、現在60ノードのうち25ノードがアップグレードを完了しており、新しいソフトウェアが3分の2のノードに到達した時点で、チェーンは正式にアップグレードされる。\n\n\nソニックは取引速度を1.1秒のファイナリティで毎秒2000トランザクション（2000TPS）まで高めると予想されている。オンチェーンのデータによれば、過去1カ月間は2.5TPS強だった。\n\n\n投資家は、最近このチェーンのTVLが増加したことにも興味があるかもしれない。\n\n\nDeFiLlamaによると、ファントムのTVLは5月16日に2億300万ドル（約315億円、1ドル=155円換算）に達し、2日前の1億1100万ドル（約172億円）から増加した。これは、さまざまな分散型取引所（DEX）、融資アプリ、イールド・アグリゲーター、その他の分散型アプリ（DApps）でTVLが大幅に増加したためだという。\n\n\nファントム・チェーンをサポートする多くのDAppsでは、先週TVLが10％～20％上昇した。\n\n\n｜翻訳：CoinDesk JAPAN｜編集：井上俊彦｜画像：DefiLlama｜原文：Fantom Outperforms CoinDesk 20 Over Past Week as TVL Jumps\nCoinDesk Japan 編集部,['https://newsatcl-pctr.c.yimg.jp/t/amd-img/20240517-00252725-coindesk-000-1-view.png?pri=l&w=640&h=500&fmt=jpeg&q=85&exp=10800'],['https://news.yahoo.co.jp/articles/4a60521836c1fc71b602cf4d842de9a182847c45/images/000']
ETH/BTCレシオ、2021年4月以来の低水準に（CoinDesk JAPAN）,https://news.yahoo.co.jp/articles/5ad225615924a2764fe1f887d5684fcc6946ff49,https://newsatcl-pctr.c.yimg.jp/t/amd-img/20240517-00252632-coindesk-000-1-view.png?fmt=jpeg&q=85&exp=10800,2024-05-17T07:00:25+09:00,2024-05-17T07:00:25+09:00,CoinDesk JAPAN,coindesk,CoinDesk JAPAN,2441,"\nETH/BTCレシオ、2021年4月以来の低水準に\nイーサリアム（ETH）とビットコイン（BTC）のドル建て価格の比率は下落を続けており、1カ月前の弱気なデスクロスが示唆するように、年初からの低下が拡大している。\n\n\nTradingViewによると、ETH/BTCレシオは5月16日、暗号資産取引所バイナンス（Binance）で0.04563まで下落し、2021年4月以来の安値に達した。今年、この比率は16％近く低下しており、ビットコイン、つまりや時価総額でトップの暗号資産（仮想通貨）に偏っていることを示している。\n\n\n3年ぶりの安値への下落は、イーサリアムに連動する上場商品（ETP）への需要減退を受けたものでもある。\n\n\nETCグループが週次レポートで引用したブルームバーグのデータによると、世界のイーサリアムETPは先週、約6350万ドル（約98億4000万円、1ドル=155円換算）の純流出を記録し、香港上場の上場投資信託（ETF）が最も損失を被った。一方、ビットコインETPは先週9250万ドル（約143億4000万円）の資金を集めた。\n\n\n競合する他のレイヤー1やアメリカでのスポットETF承認に関する長引く不確実性など、いくつかの要因が投資家の支持を失った原因だと考えられる。\n\n\nコインベース・インスティチューショナル（Coinbase Institutional）のリサーチアナリスト、デビッド・ハン（David Han）氏は5月15日のメモで「アメリカにおけるビットコインスポットETFの承認は、ビットコインのストアオブバリューのストーリーとマクロ資産としての地位を強化した。一方、暗号資産セクターにおけるETHの基本的な位置付けには、未解決の疑問が残る。ソラナ（Solana）のような競合するレイヤー1は、分散型アプリ（dApp）展開のための『頼りになる』ネットワークとしてのイーサリアムのポジショニングを損なう」と述べている。\n\n\n分散型取引所（DEX）の総取引量に占めるソラナのシェアは1年で2％から21％へと10倍に拡大し、イーサリアムの市場シェアを食っている。\n\n\nアメリカ証券取引委員会（SEC）は1月、12本近いBTCスポットETFを承認した。それ以来、ファーサイド・インベスターズ（Farside Investors）によると、これらのファンドはおよそ120億ドル（約1兆8600億円）の純流入を引き寄せている。\n\n\nSECがいつ承認するかは不明だが、イーサリアムに関連するスポットETFが承認されれば、イーサリアムのネイティブトークンに同様の資金プールが開かれることになる。\n\n\n分散型予想市場のポリマーケット（Polymarket）の参加者は、SECが5月31日以前にイーサリアムのスポットETFを承認する可能性はわずか10％と見ている。SECは5月23日までにヴァンエク（VanEck）によるイーサリアムスポットETFの上場申請を承認するか否かを決定する。ブラックロック（BlackRock）の期限は6月23日だ。\n\n\n財務専門弁護士のスコット・ジョンソン（Scott Johnsson）氏によると、SECはブラックロックなどによるETF申請が、商品ベースの信託株式としては不適切に申請されており、有価証券として保有している場合は適格ではない、などといった却下する理由を探しているという。\n\nI'm aware this is widely considered a possibility, but this is your official notice that the SEC is considering the security question for ETH in this upcoming spot ETF order. Note that this question was never (afaict) asked regarding a spot/futures BTC ETF product. pic.twitter.com/TwhqmTnJfC\n\n\n— Scott Johnsson (@SGJohnsson) May 14, 2024\n\nマレックス・ソリューションズ（Marex Solutions）のデジタル資産部門共同責任者であるイラン・ソロット（Ilan Solot）氏は、イーサリアムは暗号資産ネイティブや外部のプレーヤーからのネガティブな感情の「避雷針」であり、いくつかの弱点があると述べた。\n\n\n「資本は細分化される。多くのレイヤー2トークン（OP、ARBなど）やネイティブ・プロトコル・トークンを通じてエコシステムに触れる方法は比例して多くなる。すると、資本は細分化される」とソロット氏は電子メールで述べた。\n\n\nソロット氏は、（ライバルである）ソラナのコミュニティやビットコイン支持者からの強い反ETH感情が、否定的なイーサリアム・ナラティブを推進しており、高ベータの暗号資産は、シカゴ・マーカンタイル取引所（CME）などの伝統的な取引所で取引されていることから、外部のプレーヤーが弱気な見方を表明するための「完璧な媒体」だと付け加えた。\n\n\n最後に、イーサリアムは最近インフレに転じ、2022年9月にプルーフ・オブ・ステーク・コンセンサスに移行して以来、一貫して見られた強気のデフレ供給トレンドを反転させている。\n\n\n｜翻訳：CoinDesk JAPAN｜編集：井上俊彦｜画像：Shutterstock｜原文：Ether-Bitcoin Ratio Slides to Lowest Since April 2021. Here's Why\nCoinDesk Japan 編集部",['https://newsatcl-pctr.c.yimg.jp/t/amd-img/20240517-00252632-coindesk-000-1-view.png?pri=l&w=640&h=286&fmt=jpeg&q=85&exp=10800'],['https://news.yahoo.co.jp/articles/5ad225615924a2764fe1f887d5684fcc6946ff49/images/000']
コインベース株が9％下落──CMEが現物ビットコインの上場を検討との報道で（CoinDesk JAPAN）,https://news.yahoo.co.jp/articles/55b5b2b1ff841e5fb2ff7833d48b8f096a341e62,https://newsatcl-pctr.c.yimg.jp/t/amd-img/20240517-00252698-coindesk-000-2-view.jpg?exp=10800,2024-05-17T09:32:38+09:00,2024-05-17T09:32:40+09:00,CoinDesk JAPAN,coindesk,CoinDesk JAPAN,1222,\nコインベース株が9％下落──CMEが現物ビットコインの上場を検討との報道で\nシカゴ・マーカンタイル取引所（CME）が、顧客の強い関心を背景に間もなく現物ビットコイン取引を提供する可能性があるとのフィナンシャル・タイムズ紙の報道を受けて、コインベース（Coinbase）の株価は16日のアメリカ時間午前中に8％近く下落して202.49ドル（約3万1000円、1ドル155円換算）となった。\n\n\nこの日、暗号資産（仮想通貨）市場は上昇した。取引高上位の暗号資産のパフォーマンスを示すCoinDesk 20 Index（CD20）は、過去24時間で0.91%上昇した。ビットコイン（BTC）は、予想よりもリスク資産に有利だった15日発表のインフレ指標を材料とした上昇を継続したため、0.5％上昇した。年初から暗号資産市場が上昇していたため、コインベース株も年初から29%上昇している。\nCMEは世界最大の先物取引所\nシカゴに拠点を置くCMEは1世紀以上の歴史を持ち、世界最大の先物取引所であり金融大手だ。最近まで、コインベースはアメリカで最も信頼できる暗号資産取引所とされていることから大きな利益を上げてきたが、CMEが参入すればその優位性は変わる可能性がある。\n\n\nCMEは米規制当局から「システム上重要な金融市場事業体」に指定されている。これに指定されると、より厳格な監督の対象となる。また、多くの投資家は、この指定は財政的苦境に陥った場合でも政府がCMEを決して破綻させないことを意味すると考えている。\n\n\nCMEはすでに建玉ベースでアメリカ最大のビットコイン先物取引所となっている。\n\n\n関係者がフィナンシャル・タイムズに話したところによると、CMEは規制された市場でビットコインを取引することを望むトレーダーらと会合を行っていると述べたという。\n暗号資産取引所への信頼欠如が問題に\nトレーダーがデジタル資産に触れたがらない理由として一般的なものは、暗号資産取引所に対する信頼が欠如していることだ。かつては非常に人気のあった暗号資産取引所FTXなど、近年複数の悪質なプレーヤーが排除されたことを受けて特にこの傾向が強まっている。\n\n\n最近始まったビットコイン現物ETF（上場投資信託）は、トレーダーにビットコインに投資するより安全な方法を提供した。立ち上げからわずか3か月で500以上の機関がこれを利用し、ファンドだけで100億ドル（約1兆5500億円）以上の資金を割り当てた。残りの400億ドル以上は個人トレーダーからの資金だった。\n\n\n｜翻訳・編集：林理南｜画像：Alpha Photo/Flickr｜原文：Coinbase Shares Sink 9% on Report CME to Consider Listing Spot Bitcoin\nCoinDesk Japan 編集部,['https://newsatcl-pctr.c.yimg.jp/t/amd-img/20240517-00252698-coindesk-000-2-view.jpg?pri=l&w=640&h=360&exp=10800'],['https://news.yahoo.co.jp/articles/55b5b2b1ff841e5fb2ff7833d48b8f096a341e62/images/000']
イーサリアムの弱気派、上昇トレンドラインにぶつかり失速：テクニカル分析（CoinDesk JAPAN）,https://news.yahoo.co.jp/articles/8ccfd9f1d54bfa68b3d49ef4a8fff4bb72b4ba2b,https://newsatcl-pctr.c.yimg.jp/t/amd-img/20240517-00252756-coindesk-000-1-view.jpg?exp=10800,2024-05-17T20:45:06+09:00,2024-05-17T20:45:06+09:00,CoinDesk JAPAN,coindesk,CoinDesk JAPAN,849,\nイーサリアムの弱気派、上昇トレンドラインにぶつかり失速：テクニカル分析\nTradingViewによると、イーサリアム（ETH）の売りは停滞しており、弱気勢は10月と1月の安値から引かれた上向きのトレンドラインによって特徴付けられるレンガの壁にぶつかっている。\n\n\n5月13日以降、弱気勢はこの強気のトレンドラインを突き破ることができず、最近の下落を再び拡大しようとする前に、少し後退して価格の反発を許容する必要があるかもしれないことを示唆している。CoinDeskのデータによると、このイーサリアム・ブロックチェーンのネイティブトークンは、2カ月前の4100ドル付近の高値から15％以上下落し、約3000ドルになった。より広範な暗号資産（仮想通貨）市場の指標であるCoinDesk20指数（CD20）は同じ期間に17％下落した。\n\n\nイーサリアム価格の反発を支持するのは、日足MACDヒストグラムで、このヒストグラムはプラスに反転し、再び強気の勢いを示している。MACD（マックディー：移動平均収束拡散）はトレンドの強さと変化を測るために広く使用されている。\n\n\n日中のモメンタムは着実に改善しており、広く追跡されている50時間単純移動平均（SMA）は再び上昇トレンドにあり、安心感を与えている。\n\n\n当面の上値抵抗線は3180ドル付近の50日SMAにあり、その後には直近の調整を示す下降トレンドラインが現在3225ドルに位置している。\n\n\nもし価格が強気トレンドラインを下回れば、より広範な期間の上昇トレンドが終了したことを意味し、より顕著な売りへの扉を開くことになる。\n\n\n｜翻訳：CoinDesk JAPAN｜編集：井上俊彦｜画像：Shutterstock｜原文：Ether Bears Hit a Brick Wall as Price Collides With Bull-Market Trendline\nCoinDesk Japan 編集部,['https://newsatcl-pctr.c.yimg.jp/t/amd-img/20240517-00252756-coindesk-000-1-view.jpg?pri=l&w=640&h=420&exp=10800'],['https://news.yahoo.co.jp/articles/8ccfd9f1d54bfa68b3d49ef4a8fff4bb72b4ba2b/images/000']
CMEがビットコインのスポット取引の提供を計画：報道（CoinDesk JAPAN）,https://news.yahoo.co.jp/articles/4c02daf2e9db4d5ad285ad8e00b6c9da64c29147,https://newsatcl-pctr.c.yimg.jp/t/amd-img/20240517-00252603-coindesk-000-1-view.jpg?exp=10800,2024-05-17T06:00:09+09:00,2024-05-17T06:00:09+09:00,CoinDesk JAPAN,coindesk,CoinDesk JAPAN,1025,"\nCMEがビットコインのスポット取引の提供を計画：報道\n先物大手のシカゴ・マーカンタイル取引所（CME）が、市場参加者の間で需要が高まっているビットコインのスポット取引を顧客に提供する計画だとフィナンシャル・タイムズ（FT）が5月16日に報じた。\n\n\nCMEはすでに建玉数でトップのビットコイン先物取引所だが、オフショアで規制されていないバイナンス（Binance）がスポット市場を支配している。\n\n\nCMEは、規制された市場でのビットコインの取引を希望するトレーダーと協議を行ったと、FTは、その内容を直接知る人物の話を引用して報じている。\n\n\nCMEのスポット取引は、スイスにあるEBSの通貨取引所を通じて行われる可能性がある。\n\n\nCMEはこの記事についてのコメントを控えた。\n\n\nスポット市場は、機関投資家の活動の代理と広く考えられているCMEの既存の標準先物契約とマイクロ先物契約を補完し、CMEが暗号資産（仮想通貨）市場でより支配的になるのに役立つだろう。CMEはすでに建玉数でトップのビットコイン先物取引所だが、オフショアで規制されていないバイナンスがスポット市場を支配している。アメリカで唯一上場している暗号資産取引所のコインベース（Coinbase）は、1日の取引高で第3位だ。\n\n\nスポット市場が利用できるということは、トレーダーがスポット市場と先物市場を含む複雑なマルチレッグ戦略を規制された場所で設定できることを意味する。 キャリートレーダーは、他の取引所やスポットETFの現物のロングポジションに対してCME先物をショートすることで知られている。\n\n\n「現在の強気相場は、規制された手段での取引を好む機関投資家によって動かされているため、世界的なデリバティブ大手のCMEにビットコインスポット市場が開設されれば、暗号資産取引所は一部のビジネスを失う可能性がある」と10x Researchの創設者、マーカス・ティーレン（Markus Thielen）氏は述べている。\n\n\n｜翻訳：CoinDesk JAPAN｜編集：井上俊彦｜画像：Shutterstock｜原文：CME Looks to Take On Binance and Coinbase, Could Launch Spot Bitcoin Trading: Report\nCoinDesk Japan 編集部",['https://newsatcl-pctr.c.yimg.jp/t/amd-img/20240517-00252603-coindesk-000-1-view.jpg?pri=l&w=640&h=435&exp=10800'],['https://news.yahoo.co.jp/articles/4c02daf2e9db4d5ad285ad8e00b6c9da64c29147/images/000']
マトリックス法によるテクニカル分析（2024/5/17）ビットコイン、土俵際から逆転勝利？【楽天ウォレット】（CoinDesk JAPAN）,https://news.yahoo.co.jp/articles/4d132650a11714d47b7aa9c74e58de794d03307f,https://newsatcl-pctr.c.yimg.jp/t/amd-img/20240517-00252719-coindesk-000-2-view.jpg?exp=10800,2024-05-17T17:11:03+09:00,2024-05-17T17:11:04+09:00,CoinDesk JAPAN,coindesk,CoinDesk JAPAN,1289,\nマトリックス法によるテクニカル分析（2024/5/17）ビットコイン、土俵際から逆転勝利？【楽天ウォレット】\n本稿ではビットコイン相場を①パターン分析 ②移動平均線（9MA・25MA） ③一目均衡表 ④ボリンジャーバンド ⑤MACD ⑥RSIの代表的な6種類のテクニカル分析で5段階（5→1：強→弱）評価し、その平均で相場の強弱を評価する。テクニカル分析において定点観測と客観性が重要と考える。代表的な分析手法を複数組み合わせることで、恣意性を排除し、精度を高める狙い。\nサマリー\n総合評点は4.0。前回、調整局面入りを首の皮一枚で回避したが、まだ本当に回避できたかは勝負がついておらず、一目の雲の上下どちらに出るかではっきりする5月16日が正念場と申し上げた。すると、それまで一目の雲の下限に張り付いていたローソク足が、同日急反発し雲の上に抜けた。\n\n\nこれで、前回跳ね返された半値戻しをクリア、全値戻しに向け視界良好と言いたいところだが、その前に4月22日の戻り高値1040万円が最後の関門として残る。ここを抜ければ勝負ありと言えそうだ。\n\n\nなお、こちらでは楽天ウォレットの証拠金取引所のBTCJPYのチャートを使用しております。BTCUSDのチャートはこちらご参照ください（リンク先はTradingView社のサイトです）。\nパターン分析\n1100万円から880万円の半値戻し990万円をクリア、ネックラインが斜めになっているが一応ヘッドアンドショルダーを形成。ただ4月22日の戻り高値1040万円が最後の関門で、ここをクリアすれば、晴れて1100万円の史上最高値が見渡せるようになる。\n\n\n評点：4\n移動平均線\nようやくゴールデンクロス。\n\n\n評点：5\n一目均衡表\n雲の下限で何とかサポートされ、いつ下抜けても不思議がない格好だったが、雲の上下どちらかに抜ける正念場と指摘した5月16日に見事に反発、雲の上に出た。しかし、一時、出現した3役好転は消滅、まだ雲も薄いので安心は禁物か。\n\n\n評点：4\nボリンジャーバンド\n上向きのバンドウォークが始まったようにも見えるが、前々回に勇み足だったことを勘案、今回はまだ方向感出ていないと評価する。\n\n\n評点：3\nMACD\n前回出現したゴールデンクロスはダマしではなかった。\n\n\n評点：5\nRSI\n50近辺で方向感なし。\n\n\n評点：3\n評点\n※この記事は「楽天ウォレット」のテクニカルレポートを転載したものです。※この記事では、投資判断の参考のための情報提供を行っておりますが、銘柄推奨や投資活動の勧誘を目的としておりません。また、楽天ウォレットとしても投資勧誘や断定的な予測をおこなうものではありません。※発信された情報に将来の予想が含まれることがありますが、発信者個人の見解であり、またその正確性、信頼性を保証するものではありません。投資の最終判断は、ご自身で行っていただきますようお願い致します。\nCoinDesk Japan 編集部,['https://newsatcl-pctr.c.yimg.jp/t/amd-img/20240517-00252719-coindesk-000-2-view.jpg?pri=l&w=640&h=336&exp=10800'],['https://news.yahoo.co.jp/articles/4d132650a11714d47b7aa9c74e58de794d03307f/images/000']
