headline,mainEntityOfPage,image,datePublished,dateModified,author,media_en,media_jp,str_count,body,images,external_links
【MLB】レンジャーズがピーダーソンと合意　今季OPS.908のスラッガー　対右腕用のDHとして起用へ（MLB.jp）,https://news.yahoo.co.jp/articles/a39fb11a2f49f1d48c96283aef1a87dbbca84033,https://newsatcl-pctr.c.yimg.jp/t/amd-img/20241223-00010007-mlb-000-1-view.jpg?exp=10800,2024-12-23T22:22:48+09:00,2024-12-23T22:22:48+09:00,MLB.jp,mlb,MLB.jp,951,レンジャーズとの契約合意が報じられているジョク・ピーダーソン（MLB Advanced Media） ナサニエル・ロウをトレードでナショナルズへ放出したレンジャーズが左の強打者の獲得に動いた。日本時間12月23日、米メディア「ジ・アスレチック」のケン・ローゼンタール記者が報じたところによると、レンジャーズはダイヤモンドバックスからFAとなっていたジョク・ピーダーソンと契約合意。ロウを放出してジェイク・バーガーを一塁に回すことでDHが空いたため、対右腕用のDHとして起用できるピーダーソンの獲得に動いた形となった。 2024年オフシーズンの移籍情報まとめ 現在32歳のピーダーソンは2014年にドジャースでメジャーデビューして以来、11年間のキャリアで6度のシーズン20本塁打を含む通算209本塁打を放っているスラッガー。今季はダイヤモンドバックスで1度も守備に就かず、対右腕用のDHとして132試合に出場し、打率.275、23本塁打、64打点、7盗塁、出塁率.393、OPS.908の好成績を残した。左腕を打てないため、11年間で規定打席をクリアしたシーズンは2度しかないが、対右腕の通算OPSは.844に達し、右腕相手には一流のバッティングを期待できる選手だ。 これまでのキャリアでは、ドジャース時代の2015年とジャイアンツ時代の2022年にオールスター・ゲーム選出。ホームラン・ダービーにも2度（2015年と2019年）出場している。また、ドジャース時代の2020年とブレーブス時代の2021年には2年連続でワールドシリーズ制覇を経験。ポストシーズンでは通算79試合で12本塁打を放ち、OPS.814をマークしている。 なお、米スポーツ専門チャンネル「ESPN」のバスター・オルニー記者によると、契約条件は2年3700万ドルで、1年目のシーズン終了後にオプトアウトできる権利が盛り込まれているという。レンジャーズ打線はマーカス・セミエン、ワイアット・ラングフォード、アドリス・ガルシア、ジョシュ・ヤング、バーガーと右打者が多く、左の強打者はコリー・シーガーくらいしか見当たらない。打線のバランスを向上させるという点においても、ピーダーソンはレンジャーズに極めてフィットする存在と言えるだろう。,[],[]
【MLB】メッツがマナイアと再契約へ　3年7500万ドルで合意　今季12勝を挙げたサウスポー　米報道（MLB.jp）,https://news.yahoo.co.jp/articles/df7931c64f0828fa3d16ae65263c02a32c97506a,https://newsatcl-pctr.c.yimg.jp/t/amd-img/20241223-00010006-mlb-000-1-view.jpg?exp=10800,2024-12-23T16:07:57+09:00,2024-12-23T16:07:57+09:00,MLB.jp,mlb,MLB.jp,886,メッツと再契約で合意したことが報じられているショーン・マナイア（MLB Advanced Media） 日本時間12月23日、米スポーツ専門チャンネル「ESPN」のジェフ・パッサン記者が報じたところによると、メッツは自軍からFAとなっていた左腕ショーン・マナイアと3年7500万ドルで再契約を結ぶことで合意に至ったようだ。マナイアはオプトアウトの権利を行使してFAとなったあと、メッツから提示されたクオリファイング・オファーを拒否していた。今季はクリス・セール（ブレーブス）の投球フォームを参考にしてブレイク。来季も先発ローテーションの軸として、活躍が期待される。 2024年オフシーズンの移籍情報まとめ 現在32歳のマナイアは昨季終了後にジャイアンツからFAとなり、2年2800万ドルでメッツと契約。今季は32試合に先発して181回2/3を投げ、12勝6敗、防御率3.47、184奪三振とキャリアハイのシーズンを過ごした。特にブレーブスのセールを参考にしてフォームを改造してから一気に調子を上げ、日本時間7月31日から9月22日にかけての11先発では6勝1敗、防御率2.63と安定感抜群のピッチングを披露。自身4度目の出場となったポストシーズンでも2勝を挙げた。 今オフのメッツはマナイア、ルイス・セベリーノ、ホセ・キンタナと3人の先発投手がFAとなり、ローテーションの立て直しが急務に。ここまで、フランキー・モンタス、クレイ・ホームズ、グリフィン・キャニングと比較的小粒な補強が目立っていたが、今季チームで最も安定したパフォーマンスを見せた先発投手であるマナイアの引き留めに成功した。 これで来季のメッツは、マナイア、千賀滉大、モンタス、ホームズ、デービッド・ピーターソンの5人が先発ローテーションを形成することになる。6番手以降にもポール・ブラックバーン、キャニング、タイラー・メギルらが控えており、層の厚さも十分だ。まだ佐々木朗希を獲得する可能性は残っているが、コービン・バーンズの争奪戦には加わっておらず、先発投手の補強はひとまず打ち止めということになりそうだ。,[],[]
【MLB】カージナルスのヘルズリー、フェディ、マッツに他球団が興味を示す　最優先はアレナド放出か（MLB.jp）,https://news.yahoo.co.jp/articles/1a4312df98fba88cec6436e87f47a9455b175af8,https://newsatcl-pctr.c.yimg.jp/t/amd-img/20241223-00010005-mlb-000-1-view.jpg?exp=10800,2024-12-23T11:29:48+09:00,2024-12-23T11:29:48+09:00,MLB.jp,mlb,MLB.jp,1276,球団新記録の49セーブをマークしたカージナルスのライアン・ヘルズリー（MLB Advanced Media） 米公式サイト「MLB.com」が関係者から得た情報によると、ブルージェイズとダイヤモンドバックスがカージナルスの守護神ライアン・ヘルズリーをトレードで獲得することに興味を示しているようだ。また、先発投手のエリック・フェディとスティーブン・マッツをトレードで獲得することについて、タイガースとガーディアンズが興味を示しているという。ただし、現時点ではカージナルスに守護神放出の意思はないとみられており、ジョン・モゼラック編成本部長は名三塁手ノーラン・アレナドの放出を最優先に考えているようだ。 2024年オフシーズンの移籍情報まとめ カージナルスは2025年シーズンに向けて、ロースターの「リセット」を画策している。これはペイロールの整理をすると同時に、若手選手により多くの出場機会を与えることを目的としたものだ。ヤンキースと合意したポール・ゴールドシュミットのほか、マット・カーペンター、カイル・ギブソン、ランス・リンといったベテラン選手がFAとなったが、彼らの引き留めはせず、現有戦力の若手選手に出場機会を与える方針である。 現在30歳のヘルズリーは今季、球団新記録となる49セーブをマーク。2年ぶり2度目のオールスター・ゲーム選出を果たし、トレバー・ホフマン賞（ナ・リーグ最優秀救援投手）を初受賞した。来季終了後にFAとなるため、今オフ中にトレードされる可能性が取り沙汰されているが、カージナルスは今オフ中のトレードはしない方針。文句なしの対価を提示されない限りは、ヘルズリーを守護神に据えたまま来季の開幕を迎えることになるだろう。 現在31歳のフェディは今夏のトレード・デッドラインでカージナルスがホワイトソックスから獲得した右腕。2023年シーズンは韓国球界でプレーし、メジャー復帰を果たした今季は31先発で177回1/3を投げ、9勝9敗、防御率3.30、154奪三振とキャリアハイの成績を残した。来季の年俸は750万ドルとそれほど高価ではなく、カージナルスが放出に踏み切れば、FA市場の先発投手の価格が高騰するなかで人気物件となるのは間違いない。 現在33歳のマッツは4年4400万ドルの契約を結んでいる左腕。カージナルス移籍後の3年間でわずか10勝、防御率4.47と期待を裏切り続けている。来季が契約最終年となり、カージナルスは放出を望んでいるとみられるが、年俸1250万ドルの大部分を負担しない限り、トレードは難しいだろう。来季の復活に賭け、来夏のトレード・デッドラインまで放出を待つのも1つの選択肢だ。 トレード拒否権を持つ主力選手のうち、ウィルソン・コントレラス、ソニー・グレイ、マイルズ・マイコラスは残留を望んでいるため、ロースターの「リセット」はモゼラック編成本部長の思惑通りに進んでいないのが現状。まずは何としてでもアレナドのトレードを成立させ、それからフェディやマッツのトレードを検討していくような流れとなりそうだ。,[],[]
【MLB】2013年ア・リーグ新人王のマイヤーズが現役引退　昨年6月にレッズを解雇　今季はプレーせず（MLB.jp）,https://news.yahoo.co.jp/articles/1cf45d9405867ccf818ea070494d754ece51e1e2,https://newsatcl-pctr.c.yimg.jp/t/amd-img/20241223-00010004-mlb-000-1-view.jpg?exp=10800,2024-12-23T10:18:51+09:00,2024-12-23T10:18:51+09:00,MLB.jp,mlb,MLB.jp,1182,昨年6月にレッズを解雇されたウィル・マイヤーズ（MLB Advanced Media） 米公式サイト「MLB.com」でパドレスを担当するAJ・カッサベル記者によると、2013年ア・リーグ新人王のウィル・マイヤーズは現役引退を決断したようだ。厳密に言えば、マイヤーズは正式には引退しておらず、「これからも正式に引退するつもりはない」と語っているが、「人生の次のチャプターへ進むときがきた」と第一線から退くことを決断。「素晴らしいキャリアを過ごすことができた。満足しているし、たくさんの素晴らしい友人と出会うことができた。全く後悔はない」と自身のキャリアを振り返った。 2024年オフシーズンの移籍情報まとめ 現在34歳のマイヤーズは2009年ドラフト3巡目指名でロイヤルズに入団。2012年オフにジェームス・シールズとウェイド・デービスを含む大型トレードでレイズへ移籍した。翌2013年にメジャーデビューし、88試合に出場して打率.293、13本塁打、53打点、OPS.832の活躍で新人王を受賞。しかし、2014年は成績を落とし、同年オフにトレイ・ターナーを含む超大型の三角トレードでパドレスへ放出された。 パドレス移籍後は2016年に自己最多の94打点、翌2017年にも自己最多の30本塁打をマークするなど、主力打者に成長。2017年シーズンの開幕前には6年8300万ドルで契約を延長し、これは当時、パドレスの球団史上最高額の契約だった。しかし、2018年以降はなかなか期待に応えられず、年俸に見合う働きができたと言えるのは短縮シーズンの2020年だけ（55試合で打率.288、15本塁打、40打点、OPS.959）。2022年シーズン終了後、年俸2000万ドルの球団オプションが行使されず、FAとなった。 2023年は1年750万ドルの契約でレッズに加入。しかし、37試合で打率.189、3本塁打、12打点、OPS.540と結果を残せず、6月に解雇された。その後はどのチームとも契約せず、今季は無所属のまま1年を過ごした。「いずれは野球の仕事に戻りたい」と語るマイヤーズだが、現時点では何をするかまだ決めていないという。 「まだ上司がいる仕事には興味がないんだ」とマイヤーズ。「朝起きて、午前中はゴルフに行き、午後は家に戻って父親として過ごす。今はいいスケジュールで過ごすことができているよ」と充実した生活を送っているようだ。 マイヤーズはメジャー11年間で通算1100試合に出場し、965安打、打率.252、156本塁打、533打点、107盗塁、OPS.763を記録。2013年ア・リーグ新人王、2016年オールスター・ゲーム選出のほか、2020年はMVP投票で16位にランクインし、2013年・2020年・2022年と3度のポストシーズン進出を経験した。,[],[]
【MLB】WソックスがRソックスとのトレードでブーサーを獲得　今季デビューした32歳のリリーフ左腕（MLB.jp）,https://news.yahoo.co.jp/articles/b637fe8dbfd606b18e585b23d75c0ffd5913daa7,https://newsatcl-pctr.c.yimg.jp/t/amd-img/20241223-00010003-mlb-000-1-view.jpg?exp=10800,2024-12-23T09:34:17+09:00,2024-12-23T09:34:17+09:00,MLB.jp,mlb,MLB.jp,877,ホワイトソックスへのトレードが決まったキャム・ブーサー（MLB Advanced Media） 日本時間12月22日、ホワイトソックスはレッドソックスとの1対1のトレードを成立させ、今季デビューした32歳の救援左腕キャム・ブーサーを獲得した。ホワイトソックスはブーサー獲得の対価として、マイナー右腕のジョイカー・ファハードをレッドソックスへ放出。また、ブーサー加入に伴い、ロースターの40人枠を空けるために外野手のコリー・ジョークスがDFAとなった。ホワイトソックスは今季39試合に登板したジャレッド・シュスターを先発に回すプランがあり、ブーサーはシュスターに代わる救援左腕として起用されることになりそうだ。 2024年オフシーズンの移籍情報まとめ ブーサーは2013年にドラフト外でツインズと契約。トミー・ジョン手術など相次ぐ故障に悩まされ、一時は引退して大工として働いていたが、2021年に独立リーグで現役復帰を果たし、31歳351日でメジャーの舞台に立った苦労人である。デビューイヤーとなった今季はレッドソックスで43試合に登板して42回2/3を投げ、2勝3敗1セーブ、6ホールド、防御率3.38、43奪三振を記録。今季のホワイトソックスには40試合以上に登板して防御率3点台の投手は1人もおらず、ブルペンの一角として貴重な戦力になることは間違いないだろう。 レッドソックスへ移籍したファハードはベネズエラ出身の18歳の右腕。今年2月にホワイトソックスと契約したばかりであり、今季はドミニカ共和国のサマーリーグで13試合に先発して50回2/3を投げ、1勝4敗、防御率3.91、64奪三振を記録した。 ホワイトソックスからDFAとなったジョークスは28歳の外野手。2023年にアストロズでメジャーデビューし、93試合に出場して打率.245、6本塁打、33打点、15盗塁、OPS.649をマークしたが、今年5月にDFAとなってホワイトソックスへトレードされ、今季は66試合で打率.214、3本塁打、14打点、5盗塁、OPS.581と成績を落としていた。,[],[]
【MLB】メッツがブレグマンに興味を示す　ブレグマン獲得とアロンソ再契約を両立させる可能性も　米報道（MLB.jp）,https://news.yahoo.co.jp/articles/e8e6975de5616e9e3d38d445e6f173d5a31296af,https://newsatcl-pctr.c.yimg.jp/t/amd-img/20241223-00010002-mlb-000-1-view.jpg?exp=10800,2024-12-23T09:14:39+09:00,2024-12-23T09:14:39+09:00,MLB.jp,mlb,MLB.jp,1053,メッツからの関心が報じられているアレックス・ブレグマン（MLB Advanced Media） 今オフ最大の目玉であるフアン・ソトの獲得に成功したメッツだが、まだ補強を終える気配はない。メッツ専門メディア「Metsmerized Online」のマイク・メイヤー編集長によると、メッツはアストロズからFAとなっているアレックス・ブレグマンに興味を示しており、関係者のあいだでは「正当な移籍先の1つ」と目されているようだ。メッツは今季、マーク・ビエントスが台頭して三塁のレギュラーに定着したが、そのビエントスを一塁に回すことで、ブレグマンのポジションを空けることができる。 2024年オフシーズンの移籍情報まとめ 現在30歳のブレグマンは2015年ドラフト全体2位指名でアストロズに入団し、2016年7月にメジャーデビュー。それ以来、正三塁手としてアストロズの黄金期を牽引してきた。しかし、今季限りで5年1億ドルの契約が終了。アストロズはブレグマンとの再契約を目指していたが、6年契約のオファーをブレグマンが拒否したことが報じられている。結局、アストロズはカイル・タッカーをカブスへ放出してイサーク・パレイデスを獲得し、FAのクリスチャン・ウォーカーとも3年契約。これで一塁ウォーカー、三塁パレイデスと内野の両コーナーが固まったため、ブレグマンと再契約を結ぶ可能性は事実上消滅した。 ブレグマンに興味を示しているメッツだが、米公式サイト「MLB.com」のマーク・フェインサンド記者によると、メッツ以外にもヤンキース、レッドソックス、タイガース、ブルージェイズなどがブレグマン争奪戦に加わっているという。メッツはブレグマン獲得に成功した場合、ビエントスを一塁へコンバートすることが有力。この場合、メッツがピート・アロンソと再契約する可能性は消滅するのだろうか。メイヤー編集長は「私の認識では、答えは『ノー』だ」と記している。 要するに、メッツはブレグマンを獲得し、なおかつアロンソと再契約を結ぶ可能性もあるということだ。大富豪のスティーブ・コーエン・オーナーの資金力があれば、「ダブル獲得」を実現することは可能であり、一塁アロンソ、三塁ブレグマン、DHビエントスで3選手を同時に起用することもできる。他球団が続々と一塁手補強を完了するなか、アロンソはメッツ残留以外の選択肢がほとんどなくなっており、フランシスコ・リンドーア、ソト、ビエントス、アロンソ、ブレグマンが並ぶ豪華ラインナップが完成するかもしれない。,[],[]
【MLB】ナショナルズがレンジャーズからロウを獲得　一塁手の補強に成功　2022年シルバースラッガー賞（MLB.jp）,https://news.yahoo.co.jp/articles/687e969d8d9aee9365b925ef23640cbd225f75f7,https://newsatcl-pctr.c.yimg.jp/t/amd-img/20241223-00010001-mlb-000-1-view.jpg?exp=10800,2024-12-23T08:55:22+09:00,2024-12-23T08:55:22+09:00,MLB.jp,mlb,MLB.jp,938,ナショナルズへのトレードが決まったナサニエル・ロウ（MLB Advanced Media） ここ数日間、一塁手の市場が大きく動いているが、その流れのなかでナショナルズも正一塁手を確保した。日本時間12月23日、ナショナルズはレンジャーズとの1対1のトレードが成立したことを発表。左腕ロバート・ガルシアを放出し、2022年にシルバースラッガー賞、翌2023年にはゴールドグラブ賞を受賞したナサニエル・ロウの獲得に成功した。ロウはレンジャーズがジェイク・バーガーを獲得したことで余剰戦力となっており、一塁手補強を狙っていたナショナルズが獲得に動いた形となる。 2024年オフシーズンの移籍情報まとめ 現在29歳のロウは2021年のレンジャーズ移籍を機にメジャー定着を果たし、移籍2年目の2022年には打率.302、27本塁打、76打点、OPS.850とキャリアハイの成績をマーク。この年はシルバースラッガー賞に輝いた。翌2023年は打率.262、17本塁打、82打点、OPS.774とやや数字を落としたが、安定した守備力を発揮してゴールドグラブ賞を受賞し、球団史上初のワールドシリーズ制覇に貢献。メジャー6年目の今季は140試合に出場し、打率.265、16本塁打、69打点、OPS.762を記録した。 レンジャーズは今オフ、マーリンズとのトレードで長距離砲バーガーを獲得。一塁と三塁の2ポジションにロウ（一塁手）、バーガー（一塁手／三塁手）、ジョシュ・ヤング（三塁手）とレギュラークラスの選手を3人抱えていたため、ロウはトレード候補に挙げられていた。FAまでの保有期間は残り2年。ポール・ゴールドシュミットに興味を示すなど、一塁手補強を狙っていたナショナルズにとって、待望の正一塁手獲得となる。 レンジャーズが獲得したガルシアは28歳の左腕。もともとは2017年ドラフト15巡目指名でロイヤルズに入団した選手であり、2023年7月にマーリンズでメジャーデビューした。直後にウエーバーでナショナルズへ移籍し、メジャー2年目の今季は72試合に登板。59回2/3を投げ、3勝6敗、13ホールド、防御率4.22、75奪三振を記録した。レンジャーズでもブルペンの一角を担うことになりそうだ。,[],[]
【MLB】フィリーズがマーリンズから左腕ルザードを獲得　2対2のトレード　強力な先発ローテーションが完成（MLB.jp）,https://news.yahoo.co.jp/articles/52001053be2c93838fdf2531b4ef8cd477f9c6c5,https://newsatcl-pctr.c.yimg.jp/t/amd-img/20241223-00010000-mlb-000-1-view.jpg?exp=10800,2024-12-23T08:40:30+09:00,2024-12-23T08:40:30+09:00,MLB.jp,mlb,MLB.jp,1015,フィリーズへのトレードが決まったヘスス・ルザード（MLB Advanced Media） 日本時間12月23日、フィリーズはマーリンズとの2対2のトレードを成立させた。球団4位の有望株であるスターリン・カバと同23位のエマーリオン・ボイドを放出し、左腕ヘスス・ルザードとマイナー捕手のポール・マッキントッシュを獲得。ルザード加入の枠を空けるために、左腕タイラー・ギルバートがDFAとなった。これでフィリーズは球界屈指の先発ローテーションがさらに強化され、ザック・ウィーラー、アーロン・ノラ、クリストファー・サンチェス、レンジャー・スアレス、そしてルザードと豪華な布陣になっている。 2024年オフシーズンの移籍情報まとめ 現在27歳のルザードはメジャー5年目の2023年にブレイクし、32先発で178回2/3を投げて10勝10敗、防御率3.58、208奪三振をマーク。今季は故障もあって12先発で3勝6敗、防御率5.00に終わったが、今オフのトレード市場で注目を集める存在となっていた。FAまでの保有期間は残り2年。フィリーズは来季終了後にスアレスがFAとなるものの、有望株アンドリュー・ペインターが控えているため、2026年もウィーラー、ノラ、サンチェス、ルザード、ペインターという強力な先発ローテーションを形成することが可能だ。 ルザードとともにフィリーズが獲得したマッキントッシュは27歳の捕手。もともとは2018年のドラフトでエンゼルスから34巡目指名を受けた選手であり、今季はマイナーAA級で117試合に出場して打率.246、12本塁打、55打点、8盗塁、OPS.725を記録した。打力優先の捕手であり、DHや左翼での出場機会も多くなっている。 フィリーズが放出したカバは「MLBパイプライン」のプロスペクト・ランキングで球団4位にランクインしていた19歳の遊撃手。今季はマイナーのルーキー級とA級の合計で78試合に出場し、打率.228、2本塁打、26打点、50盗塁、OPS.669を記録した。将来的にはフランシスコ・リンドーア（メッツ）のような走攻守を兼ね備えたスター遊撃手へ成長することを期待されている。 カバとともにマーリンズへ移籍するボイドは21歳の外野手。2022年ドラフト11巡目指名でプロ入りし、今季はマイナーA＋級で96試合に出場して打率.239、3本塁打、40打点、27盗塁、OPS.646を記録した。,[],[]
