headline,mainEntityOfPage,image,datePublished,dateModified,author,media_en,media_jp,str_count,body,images,external_links
工事入札巡り100万円の賄賂を受領したなどの罪　池田町の前町長を起訴（メ〜テレ（名古屋テレビ））,https://news.yahoo.co.jp/articles/30d4ca40740540709a453df65399cd9140f6a661,https://newsatcl-pctr.c.yimg.jp/t/amd-img/20240722-90025467-nbnv-000-1-thumb.jpg?exp=10800,2024-07-22T23:23:01+09:00,2024-07-22T23:23:01+09:00,メ〜テレ（名古屋テレビ）,nbn,メ?テレ（名古屋テレビ）,404,\nメ～テレ（名古屋テレビ）\n岐阜県池田町が発注する工事の入札をめぐって、便宜を図る見返りに業者から賄賂を受け取ったなどとして、前の町長が起訴されました。\n\n\n 加重収賄などの罪で起訴されたのは池田町の前町長、岡崎和夫被告（76）です。\n\n また、大垣市の電気工事会社「久富電設」の社長、久富幸司被告（62）が、贈賄などの罪で起訴されました。\n\n 起訴状によりますと、岡崎被告は町長を務めていた2022年2月、町の発注する工事の入札で久富電設が有利になるよう取り計らう見返りに現金100万円を久富被告から自宅で受け取り、当時の副町長らを通じて入札に参加できる指名業者として久富電設を選ばせたほか、2022年7月に行われた保育園の空調工事をめぐる入札では、久富被告に、他の指名業者の名前を電話で漏らすなどしたとされています。\n\n 岐阜地検は、岡崎被告と久富被告の認否を明らかにしていません。,[],[]
名鉄三河線の踏切にビニール袋に入った石　列車往来危険の疑いで捜査（メ〜テレ（名古屋テレビ））,https://news.yahoo.co.jp/articles/790fc0e95e54854ee5f00b7025fefbdaab76bc0e,https://newsatcl-pctr.c.yimg.jp/t/amd-img/20240722-90025465-nbnv-000-1-view.jpg?exp=10800,2024-07-22T20:27:01+09:00,2024-07-22T20:27:01+09:00,メ〜テレ（名古屋テレビ）,nbn,メ?テレ（名古屋テレビ）,294,\n愛知県警本部\n22日午後、愛知県高浜市の名鉄三河線の踏切で、列車がビニール袋に入れられた石をひき、警察が列車妨害の疑いで捜査しています。\n\n\n 警察によりますと、22日午後3時半ごろ、高浜市八幡町の名鉄三河線の踏切で、知立発碧南行きの4両編成の普通電車が、半透明のビニール袋に入れられた石をひきました。\n 列車には、乗員・乗客約60人が乗っていましたが、けがはありませんでした。\n 列車は約10分間停止しましたが、安全が確認されたため、その後、運行を再開したということです。\n 警察は、何者かが踏切に石を置いた可能性があるとして、列車往来危険の疑いも視野に調べています。,['https://newsatcl-pctr.c.yimg.jp/t/amd-img/20240722-90025465-nbnv-000-1-view.jpg?exp=10800'],['https://news.yahoo.co.jp/articles/790fc0e95e54854ee5f00b7025fefbdaab76bc0e/images/000']
オンライン診療で処方された糖尿病治療薬を転売か　女性2人を書類送検（メ〜テレ（名古屋テレビ））,https://news.yahoo.co.jp/articles/100b0a612561d7391d4542f2d938ef243f7ca635,https://newsatcl-pctr.c.yimg.jp/t/amd-img/20240722-90025468-nbnv-000-1-thumb.jpg?exp=10800,2024-07-22T23:30:01+09:00,2024-07-22T23:30:01+09:00,メ〜テレ（名古屋テレビ）,nbn,メ?テレ（名古屋テレビ）,362,\nメ～テレ（名古屋テレビ）\nダイエットの目的で糖尿病の治療薬を違法に転売したとして、20代の女性2人が書類送検されました。\n\n\n 愛知県警によりますと、書類送検された大阪府と群馬県に住むいずれも20代の女性2人は、2023年秋ごろ、厚生労働大臣の許可を受けずに、糖尿病の治療薬を販売した薬機法違反の疑いが持たれています。\n\n 2人は容疑を認めています。\n\n 2人が販売したのは「ＧＬＰ‐1受容体作動薬」で食欲を抑える作用があるため、ダイエット目的で使用されているケースがあるということです。\n\n 2人はいずれもダイエット目的でオンライン診療でこの薬を処方されましたが、体調を崩すなどして飲まなくなったため、複数人に転売したということです。\n\n 購入した人も吐き気や下痢の症状を訴えたということです。,[],[]
JR東海「ブレーキ操作したが減速できず」　あすは始発から運転再開目指す　保守用車両が衝突し脱線（メ〜テレ（名古屋テレビ））,https://news.yahoo.co.jp/articles/b5957c95a7d1cb3979f854dc6b29b84337f063d5,https://newsatcl-pctr.c.yimg.jp/t/amd-img/20240722-90025466-nbnv-000-3-thumb.jpg?exp=10800,2024-07-22T21:20:01+09:00,2024-07-22T23:23:01+09:00,メ〜テレ（名古屋テレビ）,nbn,メ?テレ（名古屋テレビ）,532,\nメ～テレ（名古屋テレビ）\n東海道新幹線の線路で保守用の車両同士が衝突し脱線した事故について、ＪＲ東海は「ブレーキを操作したが減速できなかった」として原因を調査していることを明らかにしました。\n\n\n 22日午前3時37分に、東海道新幹線の豊橋駅と三河安城駅の間の上り線で保守用の車両同士が衝突し、脱線する事故が発生しました。\n\n 車両の撤去など復旧作業は午後9時ごろまで続き、東海道新幹線は始発から、名古屋駅と浜松駅の間の上下線で運転を見合わせました。\n\n ＪＲ東海によると事故現場は下り坂で保守用車両は時速40キロほどで衝突したということです。\n\n事故の原因について、ＪＲ東海は会見で「ブレーキ操作は行われていましたが、何らかの原因により減速できなかったと思われます。詳細については現在調査中です」などと説明しました。\n\nこの他、車両同士が接近すると自動でブレーキをかける安全システムも作動していましたが、実際には、ブレーキが作動しなかったとみて詳しく調査を行うとしています。\n\nこの事故で追突した車両を運転していた作業員が首の骨を折って入院したということです。\n\n23日については始発から全線での運転再開を目指すとしています。,[],[]
車いすテニス・小田凱人選手「金メダルの自信はもちろんある」　名古屋市内で練習を公開　（メ〜テレ（名古屋テレビ））,https://news.yahoo.co.jp/articles/1c8d9a585bcb184b0449a34c3bb2137d047a86c7,https://newsatcl-pctr.c.yimg.jp/t/amd-img/20240722-90025463-nbnv-000-1-thumb.jpg?exp=10800,2024-07-22T19:27:01+09:00,2024-07-22T19:27:01+09:00,メ〜テレ（名古屋テレビ）,nbn,メ?テレ（名古屋テレビ）,324,\nメ～テレ（名古屋テレビ）\n車いすテニス・小田凱人選手が名古屋市内で練習を公開。パリパラリンピックへの思いを語りました。\n\n\n 22日午前中に行われたプロ車いすテニスプレーヤー、小田凱人選手の公開練習。\n\n 22社、52人のメディアが詰めかけ、高い注目度を誇る18歳のプレーを見守りました。\n\n 海外遠征から先週帰国し、初めての練習。\n\n 時折声を上げながらショットを打つなど、強度の高い練習を行いました。\n\n 「金メダルの自信はもちろんありますし、楽しみという感じが強い。楽しんでいる時の自分が一番強いと思うので、いつもよりもっと楽しんでテニスをしたい」（小田選手）\n\n パリパラリンピックは8月28日に開幕します。,[],[]
78歳の女性が熱中症の疑いで死亡　多くの地点で35℃以上の猛暑日　東海3県（メ〜テレ（名古屋テレビ））,https://news.yahoo.co.jp/articles/0ba66e9544ccc5a1b8b775d9383146e760c428eb,https://newsatcl-pctr.c.yimg.jp/t/amd-img/20240722-90025462-nbnv-000-1-thumb.jpg?exp=10800,2024-07-22T19:22:01+09:00,2024-07-22T19:22:01+09:00,メ〜テレ（名古屋テレビ）,nbn,メ?テレ（名古屋テレビ）,303,\nメ～テレ（名古屋テレビ）\n東海3県は、22日多くの地点で35℃以上の猛暑日となり、三重県四日市市では、78歳の女性が熱中症の疑いで死亡しました。\n\n\n 各県の消防本部によりますと、22日は熱中症の疑いで、愛知県で73人、岐阜県で19人、三重県で28人が病院に搬送されました。\n\n このうち、三重県四日市市では、78歳の女性が畑で倒れているのが見つかり、意識がない状態で、病院に搬送されました。女性は病院で死亡が確認され熱中症の疑いで死亡したと診断されました。\n\n 東海3県には、23日も熱中症警戒アラートが発表されていて、涼しい環境で過ごすとともにこまめな水分補給などの対策が必要です。,[],[]
走行中の車から女性が道路に転落、意識不明の重体　運転手の男を酒気帯び運転の疑いで逮捕（メ〜テレ（名古屋テレビ））,https://news.yahoo.co.jp/articles/eef48f2eb5429a87f77b10b7bd94041869b75d03,https://newsatcl-pctr.c.yimg.jp/t/amd-img/20240722-90025464-nbnv-000-1-view.jpg?exp=10800,2024-07-22T19:11:01+09:00,2024-07-22T19:11:01+09:00,メ〜テレ（名古屋テレビ）,nbn,メ?テレ（名古屋テレビ）,405,\n愛知県警\n21日夜、愛知県武豊町の「南知多道路」で、走行中の車から女性が道路に転落し、意識不明の重体です。\n\n\n 警察によりますと、21日午後7時半ごろ、武豊町内の自動車専用道路「南知多道路」上り線で、「車道で車を押している人がいた」、「女性が道で寝ていた」などの110番通報が目撃者から複数ありました。\n\n その後、半田市内の路上で「負傷者がいる」との119番通報を受けて、警察と消防が駆け付けたところ、41歳の運転手の男と23歳の女性を発見。\n\n 女性は当初、警察の聞き取りに応じていましたが、22日朝になって容体が急変し、意識不明の重体となっています。\n\n 警察は、男の呼気から基準値を超えるアルコールを検出したため、男を酒気帯び運転の疑いで逮捕しました。\n\n 男は「飲酒で同乗者が車から落ちた」と話しているということで、警察は、女性が車から転落した原因を詳しく調べています。,['https://newsatcl-pctr.c.yimg.jp/t/amd-img/20240722-90025464-nbnv-000-1-view.jpg?pri=l&w=640&h=360&exp=10800'],['https://news.yahoo.co.jp/articles/eef48f2eb5429a87f77b10b7bd94041869b75d03/images/000']
JR東海「運転できる場合は、大幅に列車の本数を減らし臨時運転することを検討」　東海道新幹線　（メ〜テレ（名古屋テレビ））,https://news.yahoo.co.jp/articles/ebbd1a0f24ac934154c8d4f75dc4ce0d6d077971,https://newsatcl-pctr.c.yimg.jp/t/amd-img/20240722-90025461-nbnv-000-1-view.jpg?exp=10800,2024-07-22T18:18:02+09:00,2024-07-22T18:18:02+09:00,メ〜テレ（名古屋テレビ）,nbn,メ?テレ（名古屋テレビ）,311,\n東海道新幹線運行状況\n22日未明、東海道新幹線の保守用の車両同士が衝突して脱線しました。JR東海によりますと、全線の運転再開については現状、めどが立っていないということです。\n\n\n JR東海によりますと、復旧作業は午後7時ごろまで続く見込みですが、全線の運転再開については現状、めどが立っていないということです。\n\n JR東海は、午後6時時点で今後の運転計画について情報を更新しました。\n\n「今後、22日中に運転ができる場合は、大幅に列車の本数を減らして臨時に運転することを検討している」としています。\n\n 今後の運転計画については、JR東海のホームページやＸなどで随時更新していくということです。,['https://newsatcl-pctr.c.yimg.jp/t/amd-img/20240722-90025461-nbnv-000-1-view.jpg?pri=l&w=640&h=480&exp=10800'],['https://news.yahoo.co.jp/articles/ebbd1a0f24ac934154c8d4f75dc4ce0d6d077971/images/000']
東京・自由が丘で人気の「究極」をうたうガトーショコラ店　名古屋に凱旋オープン（メ〜テレ（名古屋テレビ））,https://news.yahoo.co.jp/articles/915deeb697f5ef7b53518f81f1ebf756553f209e,https://newsatcl-pctr.c.yimg.jp/t/amd-img/20240722-90025458-nbnv-000-1-thumb.jpg?exp=10800,2024-07-22T17:28:01+09:00,2024-07-22T17:28:01+09:00,メ〜テレ（名古屋テレビ）,nbn,メ?テレ（名古屋テレビ）,570,\nメ～テレ（名古屋テレビ）\nユニークな店舗が軒を連ねる名古屋市北区の名鉄瀬戸線の高架下の一角に、東京・自由が丘で人気だったという名古屋発祥の「ガトーショコラ店」が凱旋オープンします。\n\n\n 23日、名古屋市北区のSAKUMACHI商店街にオープンする「THE LAB NAGOYA」。\n\n 看板商品は「究極」をうたうガトーショコラ「THE chocola」です。\n\n 口どけの秘密は、超微粒子状のメレンゲ。素材は、3種類のカカオ豆を独自のバランスで配合しました。\n\n ここ3年間は、より多くの人に食べてもらおうとスイーツの激戦区、東京・自由が丘に移転していましたが、発祥の地・名古屋市に店を構えることになりました。\n\n 「地元が名古屋なので、より地元の方に恩返しできるように、東京で経験を積んでこちら（名古屋）へ戻ってきて、名古屋の名物を目指すために、ここで始めることにしました。何かサプライズを考えている人に使ってもらったり、相手を驚かせたいという形で一緒に店内に来たりして、楽しんでもらえたらなと思っています」（THE LAB NAGOYA オーナーシェフ 澤田明男さん）\n\n 「THE LAB NAGOYA」は、午前11時から午後5時まで営業しています。\n\n イートインは午後1時からの1時間制です。,[],[]
愛知・岐阜・三重に23日、熱中症警戒アラート　名古屋市と岐阜市で37度と猛暑日になる見込み（メ〜テレ（名古屋テレビ））,https://news.yahoo.co.jp/articles/7d2d8c9a4d967e2eb4c7856ae984bc0d2e5645dc,https://newsatcl-pctr.c.yimg.jp/t/amd-img/20240722-90025460-nbnv-000-1-view.jpg?exp=10800,2024-07-22T17:05:01+09:00,2024-07-22T17:05:01+09:00,メ〜テレ（名古屋テレビ）,nbn,メ?テレ（名古屋テレビ）,213,\n東海地方に熱中症警戒アラート\n23日の東海地方に、熱中症警戒アラートが発表されました。 \n\n\n 環境省と気象庁は、23日の東海地方で熱中症の危険性がきわめて高くなると予想されることから、愛知県と岐阜県、三重県に熱中症警戒アラートを発表しました。\n\n 23日の予想最高気温は、名古屋市と岐阜市で37度と猛暑日になる見込みです。\n\n 日中は外出を控え、エアコンを使用するなど熱中症を予防する行動をとりましょう。,['https://newsatcl-pctr.c.yimg.jp/t/amd-img/20240722-90025460-nbnv-000-1-view.jpg?pri=l&w=640&h=640&exp=10800'],['https://news.yahoo.co.jp/articles/7d2d8c9a4d967e2eb4c7856ae984bc0d2e5645dc/images/000']
小1女児死亡事件　内縁の夫がしつけの目的で暴行したという内容の説明　愛知（メ〜テレ（名古屋テレビ））,https://news.yahoo.co.jp/articles/531b43f0eff977fca27724ceaad25e9849b9581e,https://newsatcl-pctr.c.yimg.jp/t/amd-img/20240722-90025459-nbnv-000-1-thumb.jpg?exp=10800,2024-07-22T17:20:01+09:00,2024-07-22T17:20:01+09:00,メ〜テレ（名古屋テレビ）,nbn,メ?テレ（名古屋テレビ）,365,\nメ～テレ（名古屋テレビ）\n愛知県犬山市で小学1年生の女の子が死亡し母親と内縁の夫が逮捕された事件で、内縁の夫が母親に、しつけの目的で暴行したという内容の説明をしていたことがわかりました。\n\n\n 犬山市の小学1年・島崎奈桜さん（7）は、5月、腹部のけがによる敗血症性ショックで死亡し、母親の内縁の夫・倉田凱容疑者（32）が傷害致死の疑いで母親の島崎みなみ容疑者（33）が保護責任者遺棄致死の疑いで逮捕・送検されました。\n\n 捜査関係者への取材で、倉田容疑者が島崎容疑者にSNSで、しつけの目的で暴行したという内容のメッセージを送っていたことがわかりました。\n\n また、島崎容疑者のスマートフォンには奈桜さんがけがをした時の写真が保存されていたということで警察は倉田容疑者が日常的に暴行していたとみて調べています。,[],[]
夏休みシーズン到来、東海地方の観光地でにぎわい　週末の内海海水浴場は1万人が訪れる（メ〜テレ（名古屋テレビ））,https://news.yahoo.co.jp/articles/289ca943e8de675dc7e0c75f4898810cb0d7a88f,https://newsatcl-pctr.c.yimg.jp/t/amd-img/20240722-90025455-nbnv-000-1-thumb.jpg?exp=10800,2024-07-22T16:49:01+09:00,2024-07-22T16:49:01+09:00,メ〜テレ（名古屋テレビ）,nbn,メ?テレ（名古屋テレビ）,1210,\nメ～テレ（名古屋テレビ）\nいよいよ始まった夏休みシーズン。広い範囲で晴れとなった22日の東海地方も観光地を中心ににぎわいを見せています。\n\n\n 先週「梅雨明け」となった東海地方。\n\n 愛知県・南知多町にある東海地区最大級の広さを誇る内海海水浴場も、週末は多くの人が。\n\n 内海観光協会によりますと、この土日で約1万人が足を運んだといいます。\n\n 週明けの22日のお昼ごろ。空から海水浴場をのぞいて見ると、休日に比べて人は多くはありませんが、ビーチで砂遊びをする人や、浮き具で楽しむ人たちがちらほら。\n\n 観光協会は、ゆったり遊べる平日の海水浴をおすすめしています。\nナガシマは子どもたちで大にぎわい\n波の出るプールは大人気\n一方、22日も多くの人が訪れていたスポットは、ナガシマスパーランドにあるジャンボ海水プール。\n\n たくさんの人が水の上を漂っており、水面が見えないほどになっています。\n\n 波の出るプールは大人気で、大勢の子どもたちが楽しむ様子が上空からみられました。\n\n そして、今年から登場した”世界最大級”というスライダー「メガアビス」には長い列が。\n\n 傾斜48度の斜面を急降下したあとは、左右に振られながら巨大なラッパ型のスライダーの先の”穴”へ吸い込まれていきます。\n\n 暑さの中、「涼」を求める人たちでにぎわっていました。\n\n 続いて向かった先。夏休みシーズンににぎわう場所といえば――\n\n 伊勢湾岸道のパーキングエリアに直結、長距離ドライブの休憩中に遊園地や温泉なども楽しめる「刈谷ハイウェイオアシス」です。\n\n 目立った混雑は見られませんでしたが、水遊びができる場所には、子どもたちが集まっていました。\n三重・伊勢神宮エリア「食べ歩きグルメ」暑さで売れ筋に変化\n三重・伊勢市 おはらい町\n全国から多くの人が参拝に訪れる三重県の伊勢神宮エリア。\n\n 伊勢神宮のおはらい町は天候にも恵まれ、午前中からすでにたくさんの観光客でにぎわっていました。\n\n みかんをまるごと使ったジュースや、かき氷など涼しげな食べものを食べる子どもたちの姿や、日傘をさして歩く人の姿も目立ちます。\n\n「暑すぎますね。週末はお客さんはかなり少ない気がする。去年の土日に比べたらめちゃくちゃ（客の入りが）悪かった。これからです」（岩戸屋 牧戸福詞 会長）\n\n 食べ歩きグルメとして、カキフライなどを販売する「伊勢角屋麦酒」。売れ筋に例年と違いがあるといいます。\n\n「カキフライとなるとすこし敬遠されるのかなという印象」（伊勢角屋麦酒 内宮前店 内田隆太さん）\n\n\n この暑さで「揚げ物」を避ける人が多いそうで、比較的さっぱりと食べられる「蒸しカキ」の提供を始めたといいます。「フライより涼しいイメージが沸きやすい」ということです。,"['https://newsatcl-pctr.c.yimg.jp/t/amd-img/20240722-90025455-nbnv-001-1-view.jpg?pri=l&w=640&h=355&exp=10800', 'https://newsatcl-pctr.c.yimg.jp/t/amd-img/20240722-90025455-nbnv-002-1-view.jpg?pri=l&w=640&h=355&exp=10800']","['https://news.yahoo.co.jp/articles/289ca943e8de675dc7e0c75f4898810cb0d7a88f/images/000', 'https://news.yahoo.co.jp/articles/289ca943e8de675dc7e0c75f4898810cb0d7a88f/images/001']"
