headline,mainEntityOfPage,image,datePublished,dateModified,author,media_en,media_jp,str_count,body,images,external_links
「すっげえメンツ...」「タケいたよ!」久保建英が“世界の9人”として北中米W杯大会公式ソングMVに出演!「このメンツに入ってこれるタケをもっと崇めた方がいい」（サッカー批評Web）,https://news.yahoo.co.jp/articles/6d44987746354007b932e0793cd4567e2f6a2099,https://newsatcl-pctr.c.yimg.jp/t/amd-img/20260526-00110805-soccerh-000-1-view.jpg?exp=10800,2026-05-26T11:27:17+09:00,2026-05-26T11:27:17+09:00,サッカー批評Web,soccerh,サッカー批評Web,1118,サッカー日本代表のMF久保建英。 撮影／中地拓也 6月11日に開幕する北中米ワールドカップの大会公式ソング『DaiDai』のミュージックビデオ（MV）が公開された。各国代表のスーパースターたちと肩を並べ、サッカー日本代表MF久保建英（レアル・ソシエダ）も出演している。 ■【動画】「すっげえメンツ...」「タケいたよ!」久保建英が“世界の9人”として出演している北中米W杯大会公式ソング『Dai Dai』のミュージックビデオ■ 世界的アーティストのシャキーラとバーナ・ボーイが歌う公式ソング『DaiDai』。そのMVはブラジル・リオデジャネイロの世界最大規模のサッカー・スタジアムのマラカナン・スタジアムで撮影された。その冒頭、曲が始まる前に現役選手たちが登場する。 最初はフランス代表のキリアン・エムバペ（レアル・マドリード）。続いてイングランド代表のハリー・ケイン（バイエルン）から、コロンビア代表ルイス・ディアス（バイエルン）、ブラジル代表ヴィニシウス（レアル・マドリード）、カナダ代表アルフォンソ・デイヴィス（バイエルン）、アメリカ代表クリスチャン・プリシッチ（ACミラン）と続き、7番目に日本代表の久保が登場。他の面々に続いて、「We Are Ready!（もう準備はできているよ!）」と両手の拳を握っている。 久保の後には、ドイツ代表ジャマル・ムシアラ（バイエルン）、メキシコ代表サンティアゴ・ヒメネス（ACミラン）、スペイン代表ロドリ（マンチェスター・シティ）、ノルウェー代表アーリング・ハーランド（マンチェスター・シティ）、そしてアルゼンチン代表リオネル・メッシ（インテル・マイアミ）という錚々たる面々が出演している。 ■「これにいる久保建英えぐいな」 開催国（アメリカ、カナダ、メキシコ）の選手を除けば、「世界の9人」の中に久保が日本を代表して選ばれた形。この大会公式ソングのMVが公開されると、SNS上には次のようなコメントが寄せられた。 「見てきた!ホントにタケいたよ!WE ARE READY!」 「すっげえメンツ...」 「これにいる久保建英えぐいな」 「世界のタケなんだよねえ すごいことだ」 「このメンツに入ってこれるタケをもっと崇めた方がいい」 MVの後半部分には、歌詞に合わせてペレやマラドーナ、ロマーリオ、クリスティアーノ・ロナウド、バルデラマ、ベッカム、イニエスタなどのプレー映像が使用され、その流れの中で久保は再び登場している。 シャキーラがワールドカップ公式ソングを手掛けるのは、2010年南アフリカ大会の『WakaWaka』以来。MVに出演した面々の活躍が期待されている。 サッカー批評編集部,[],[]
「ピンクのスパイク多すぎ笑」日本代表・森保ジャパンの国内合宿初日13人中12人が“足元”ド派手カラー!「足元ピンクピンクしてんな」「ピンクスパイク可愛い」と話題に（サッカー批評Web）,https://news.yahoo.co.jp/articles/e5bcc50c2c57ea5107a6c4e0ec40d4adc9aa0da2,https://newsatcl-pctr.c.yimg.jp/t/amd-img/20260526-00110803-soccerh-000-1-view.jpg?exp=10800,2026-05-26T11:15:30+09:00,2026-05-26T11:15:30+09:00,サッカー批評Web,soccerh,サッカー批評Web,1118,サッカー日本代表が国内合宿をスタートさせた。撮影／中地拓也 北中米ワールドカップ（6月11日開幕）に臨むサッカー日本代表が5月25日、千葉市内で壮行試合のアイスランド戦（5月31日、MUFG国立）へ向けた国内合宿をスタートさせた。13人が参加した中、足元のド派手なスパイクが注目を集めた。 ■【動画】「ピンクのスパイク多すぎ笑」「足元ピンクピンクしてんな」日本代表・森保ジャパンの国内合宿初日13人中12人が“足元”ド派手カラーの円陣■ いよいよ始まる日本にとって8度目、森保ジャパンにとって2度目のワールドカップ。国内合宿初日の練習には、早川友基、大迫敬介、長友佑都の国内組3人と、渡辺剛、瀬古歩夢、菅原由勢、堂安律、中村敬斗、佐野海舟、鈴木唯人、小川航基、上田綺世の海外組、そして所属クラブの日程上、アイスランド戦を不参加となった鎌田大地に代わって電撃招集された吉田麻也（ロサンゼルス・ギャラクシー）の計13選手が参加した。 練習は森保一監督の掛け声でスタート。選手たちは円陣を組んだ後、ストレッチなどで軽く体を動かし、ミニゲームなどで汗を流した。その様子が日本代表公式SNSで公開されると、ファンからは「わくわくする」「ついに始まるんだなW杯」などの声に加えて、“足元”に注目した次のようなコメントが寄せられた。 「ピンクスパイク可愛い」 「ピンクのスパイク多すぎ笑笑」 「足元ピンクピンクしてんな」 「やっぱりW杯カラーのスパイク出たか〜!よりによって欲しかったピンク…」 「にしても、ナイキもアディダスもプーマもピンク〜赤っぽいカラーがワールドカップカラーになりそう。ここまで色が一緒だと、足元全部一緒に見えてきます…笑」 ■三笘薫の1ミリでは… 各ブランドはW杯に合わせて新作スパイクを発売。契約選手たちにはいち早く支給され、上田、小川、瀬古、中村らはナイキのピンク色のスパイクを履き、大迫、菅原などはアディダスのオレンジ系で、佐野は赤っぽいカラーリング。早川、渡辺、長友はプーマで、いずれもピンクカラー。ミズノ製を履いている吉田もサイド部分がピンク色。唯一、堂安のみが真っ白のスパイクを履いており、それ以外の12人は全員がド派手な足元になっていた。 前回のカタールワールドカップでは、「三笘薫の1ミリ」の瞬間を捉えた検証映像が世界中で、特に日本では何度も放送された。そこにはラインギリギリのボールに触るプーマ製のオレンジ色のスパイクが映っており、100億円以上の宣伝効果があったとされる。今回の北中米ワールドカップでは、どのスパイクが注目を集めるのか。今のところ、テーマカラーは「ピンク」になりそうだ。 サッカー批評編集部,[],[]
「めっちゃカッコいいやんけ」夏限定の八戸三社大祭ユニフォームが“三国志モチーフ”で新登場! 「マジで嬉しい」馬モチーフの2ndも好評で「どっちも欲しいなぁ!」（サッカー批評Web）,https://news.yahoo.co.jp/articles/e66b17650bbf46bec7946c254fb1f6390ce17e7b,https://newsatcl-pctr.c.yimg.jp/t/amd-img/20260526-00110801-soccerh-000-1-view.jpg?exp=10800,2026-05-26T11:06:18+09:00,2026-05-26T11:06:18+09:00,サッカー批評Web,soccerh,サッカー批評Web,1049,ヴァンラーレ八戸のJ2初挑戦のユニフォームが発表された。撮影／中地拓也 ヴァンラーレ八戸が2026ー27シーズンで着用する新ユニフォームを発表した。クラブと地域文化を強く結びつけたデザインに、サポーターから早くも大きな反響が広がっている。 ■【画像】「おおっカッコイイ」「マジで嬉しい」三国志モチーフの“八戸三社大祭ユニフォーム”と馬モチーフの2ndユニフォーム■ 昨季J3で2位となり、クラブ史上初のJ2昇格を果たした八戸。新ユニフォームのサプライヤーは引き続き、「hummel」。そして毎年夏限定で着用されてきた「八戸三社大祭山車ユニフォーム」が、ついに1stユニフォームへ昇格した。 八戸三社大祭は約300年の歴史を誇る八戸地方最大の祭りで、国の重要無形民俗文化財にも指定されている。クラブは「地域を共に盛り上げ、もっと八戸を全国へ伝えたい」という思いを込め、6シーズン目となる“祭りユニ”をクラブの象徴として1stに採用した。 1stユニフォームは、山車の題材にもなった「三国志」をモチーフにした。劉備、関羽、張飛が義兄弟の契りを交わし、諸葛亮孔明を迎えて蜀を築き上げる物語を背景に、赤壁の戦いで蜀と呉が同盟を結び魏を打ち破る激戦の場面をデザインへ落とし込んだ。迫力ある山車絵の描かれた一着は、まさに“八戸の魂”を背負うユニフォームとなっている。 2ndユニフォームは、南部地方に根付く「馬文化」をテーマに採用。古くから軍馬や農耕馬の産地として知られ、「人の数より馬が多い」と言われた歴史を持つ地域性を表現した。青森県南地方に春を呼ぶ伝統芸能「八戸えんぶり」の烏帽子と、馬の象徴である「たてがみ」が風になびく様子をモチーフに、ホームタウンへの敬意を込めたデザインとなっている。 ■「おおっカッコイイ」 八戸の新ユニフォームに対して、SNS上には次のようなコメントが寄せられた。 「おおっカッコイイ」 「本チャンのユニめっちゃカッコいいやんけ 夏限定の三社大祭ユニがスタンダードになるのマジで嬉しい」 「来季はいつものサマーユニをホーム絵柄に持ってきたのか!セカンドの馬モチーフも捨てがたい…。 どっちも欲しいなぁ!」 「アウェイユニ好きすぎる。買います」 「実物見たいよね〜」 J2・J3百年構想リーグではEAST-Aの18試合で勝点20、10チーム中9位と苦しんだ八戸だが、経済効果も含めてJ2昇格に地元は盛り上がっている。新たな戦いに相応しいユニフォームが完成した。 サッカー批評編集部,[],[]
「渉、天才」「エグすぎやー」山形25歳の技巧派レフティーによる約50mスーパーロング弾に味方もファンも驚愕!「月間ベストゴール確定」「パーフェクトな弾道」（サッカー批評Web）,https://news.yahoo.co.jp/articles/40d48fdda4e54220f27884447ffc7b5ae52b9b20,https://newsatcl-pctr.c.yimg.jp/t/amd-img/20260526-00110802-soccerh-000-1-view.jpg?exp=10800,2026-05-26T06:06:20+09:00,2026-05-26T06:06:20+09:00,サッカー批評Web,soccerh,サッカー批評Web,955,モンテディオ山形のサポーター。 撮影／中地拓也 5月25日、J2・J3百年構想リーグ地域リーグラウンド最終節（第18節）が行われ、モンテディオ山形が3−1で湘南ベルマーレを下した。チームを勢いに乗せた先制点はMF田中渉の度肝を抜くスーパーロング弾だった。 ■【動画】「渉、天才」「エグすぎやー」「月間ベストゴール確定」山形25歳の技巧派レフティー田中渉の約50mスーパーロング弾■ NDソフトスタジアム山形で開催された試合の前半10分だった。山形のセンターバック西村慧祐のクリアボールを回収しようとする相手に対し、FW高橋潤哉がアプローチ。ルーズボールの奪い合いとなり、センターサークル内にいた背番号21、田中の前にボールがこぼれた。 トップ下でスタメン出場していた25歳の技巧派レフティーは、相手GK真田幸太のポジションを一瞬で確認。ボールをコントロールすることなく、思い切りよく左足を振り抜いた。ほぼハーフウェーライン上の位置から放たれたシュートは、低弾道のまま伸びて前に出ていた真田の頭上を越えた。ゴール中央のゴール内に飛び込むと、ワンバウンドしてゴールネットを揺らした。 距離にして約50mのスーパーロング弾。ゴールを決めた田中は、チームメイトからもみくちゃにされながらピッチに押し倒された。味方も驚く、圧巻のゴールだった。 ■「打つ気だ、と思ったらホントに打って」 田中の約50mスーパーロング弾に対してファンも大興奮。SNS上には次のようなコメントが寄せられた。 「渉、天才」 「渉さんエグすぎやー」 「月間ベストゴール確定です」 「これ、現地で見てた方がはっきり分かったんだけどちゃんとゴール確認してるんだよね。あ、打つ気だ、と思ったらホントに打って、しかも決めちゃうんだもんなぁ。上手いや、マジで」 「これは見事。瞬間の判断力、この距離をきっちりと決める技術、素晴らしい」 「一瞬の隙を突く判断力と、パーフェクトな弾道。まさにゴールへのロングパス」 桐生第一高校出身の田中は、北海道コンサドーレ札幌所属の田中宏武を実兄に持ち、これまでベガルタ仙台、レノファ山口FC、鹿児島ユナイテッドFCでもプレー。スーパーロング弾で豊かな才能を改めて示した25歳レフティーの今後に期待だ。 サッカー批評編集部,[],[]
「か、可愛い」「このシーン大好き!」柏の主将のダイビングヘッド弾からのご褒美“頭ポンポン”シーンが話題!「いちゃこらしてる太陽と真大が可愛い」（サッカー批評Web）,https://news.yahoo.co.jp/articles/37334b55a037057b9792292aa4266573f62a3a12,https://newsatcl-pctr.c.yimg.jp/t/amd-img/20260526-00110800-soccerh-000-1-view.jpg?exp=10800,2026-05-26T05:36:19+09:00,2026-05-26T05:36:19+09:00,サッカー批評Web,soccerh,サッカー批評Web,956,柏レイソルの古賀太陽。 撮影／中地拓也 柏レイソルのキャプテンによるダイビングヘッド弾からの“頭ポンポン”シーンが話題を集めた。 ■【動画】「か、可愛い」「このシーン大好き!」「悶絶たまらん」柏の主将DF古賀太陽のダイビングヘッド弾からのご褒美“頭ポンポン”シーン■ 5月23日に行われたJ1百年構想リーグ地域リーグラウンド最終節（第18節）で、柏は本拠地三協フロンテア柏スタジアムでジェフユナイテッド千葉との“千葉ダービー”に臨んだ。 試合を優勢に進めたのは柏だった。前半に垣田裕暉と小泉佳穂、さらに後半30分に細谷真大のゴールで3−1とリード。後半40分に千葉の橋壱晟にゴールを奪われて1点差とされたが、後半44分に古賀太陽が試合を決定づける4点目奪った。 4点目の起点はフリーキック。左サイドのボックス外でフリーキックを獲得すると、キッカーを務めた杉岡大暉の左足シュートがクロスバーを直撃する。跳ね返りにキャプテンの古賀が反応し、ゴールエリア内でのダイビングヘッドでゴールネットを揺らした。 ダイビング後に27歳の古賀がピッチに寝そべっていると、24歳の細谷が背中に乗っかって右手で“頭ポンポン”。後輩からの祝福を受けたキャプテンは、2024年3月9日以来のゴールに満面の笑みを浮かべた。 ■「リピートしてニヤニヤしちゃうんですけど」 マオからの“頭ポンポン”に笑顔を浮かべるタイヨウのシーンをクラブ公式SNSは3台のカメラを駆使した映像で紹介。SNS上には次のようなコメントが寄せられた。 「か、可愛い。。。」 「このシーン大好き!」 「いちゃこらしてる太陽と真大が可愛い」 「悶絶たまらん 運営さんほんとありがとうございます」 「やばい電車の中でリピートしてニヤニヤしちゃうんですけど」 「楽しい試合の締めくくりに贅沢すぎるデザートみたいなゴールでした。できすぎ。おめでとうキャプテン」 2025年シーズンのJリーグベストイレブンにも選ばれた“柏の太陽”である古賀は、敵地で敗れた前回の千葉ダービーのリベンジに成功して「ホッとしています」と安堵の笑み。苦しんだ百年構想リーグだったが、最後は3連勝締めでプレーオフへ。チームもサポーターも、笑顔を完全に取り戻せた千葉ダービーとなった。 サッカー批評編集部,[],[]
アルゼンチン代表でおなじみ「キルメス」のルーツとは?【1冊の古書と1978年W杯での奇跡の出会い】（1）（サッカー批評Web）,https://news.yahoo.co.jp/articles/91c7eb3184c8132f6de738bf1bd3488df0176cd2,https://newsatcl-pctr.c.yimg.jp/t/amd-img/20260526-00110778-soccerh-000-1-view.jpg?exp=10800,2026-05-26T05:30:33+09:00,2026-05-26T05:30:33+09:00,サッカー批評Web,soccerh,サッカー批評Web,1492,１９７８年アルゼンチン・ワールドカップ決勝の入場券。提供／後藤健生 蹴球放浪家・後藤健生は、世界中でさまざまな街を歩き、人々と出会ってきた。時には、それらが不思議な縁でつながることがある。家にある1冊の本が、その媒体となることもあるのだ。 ■【動画】「ハリルこんなところにいたのか!」元日本代表監督が暴徒化したファンに立ち向かう姿に反響!「74歳でこの覇気は本物の“漢”すぎるだろ」「お元気そうで何より」 ■古い本が出土 先日、本棚で資料を漁っていたら『はるかな国 とおい昔』という本が出てきました。整理が悪い本棚からは、時々、思いもよらない本が“出土”することがあるのです。 2011年の東日本大震災で本棚が崩れた時には、皮肉にも「福島第一原子力発電所の原子炉がいかに安全なものなのか」を紹介した『原子炉』という本が出てきました。福島第一が建設された遠時のものです。 さて、今回“出土”したのはウィリャム・ヘンリ・ハドソンという英国の博物学者が書いた本で、原著が出版されたのは1918年という古い本。寿岳しづという女性が訳した岩波文庫版で、岩波文庫版の初版は1937年。 実は、僕の父親がどういうわけかこの本がお気に入りで、そのせいで僕は子どもの頃に読んだ記憶があります。しかし、今回“出土”したのは1975年の改訳版なので、これは僕自身が大人になってから買ったものに違いありません（自分ではまったく記憶にないのですが……）。 翻訳の日本語は大正時代のもので、アルゼンチンのカタカナ表記はアル「ジェ」ンチンとなっていますし、原著者の名前も現代風ならウィリアム・ヘンリー・ハドソンとなるはずです。 ■19世紀のアルゼンチンを知る ハドソンの両親は北アメリカのニュー・イングランド地方（マサチューセッツ州などがある地方）の人でしたが、父親が病気で気候の良い南米アルゼンチンのパンパスに移住し、ハドソン自身はそこで1841年に生まれたそうです。 そして、ハドソンは1874年に英国に渡り、そこで文筆活動を営み、1922年に81歳で亡くなるのですが、70歳を過ぎて病気になった時にアルゼンチンのパンパスで過ごした子ども時代の記憶を鮮明に思い出し、それを書き綴ったのが『はるかな国 とおい昔』（Far Away and Long Ago）という本でした（「訳者のあとがき」による）。 ハドソンは博物学者で鳥類が専門だったので、子どもの頃にパンパスで見たさまざまな動物や鳥、植物の描写が中心ですが、同時に当時パンパスに住んでいた荒くれ者のガウチョ（牛飼い）たちやスペイン系の没落した大地主、あるいは英語を話す英国系の隣人たちのことも克明に描かれています（アルゼンチン共和国はスペインとの独立戦争を経て1816年に独立しましたが、その後、経済的には英国に支配されていました）。 また、独立直後にはブラジルとの戦争や独裁政権の腐敗があったりと、不安定な現地事情についても描かれています。 今回“出土”した本の奥付を見ると、1979年発行の第22刷となっています。 1978年にワールドカップを観戦するために僕は南米大陸に渡り、アルゼンチンで約1か月を過ごしました。で、アルゼンチンのことがすっかり気に入った僕が、「そういえば、父親の愛読書にアルゼンチンのことを書いた本があったなぁ」と思い出して、それでこの本を買ってきたのに違いありません。 もう、48年も昔のこと、僕にとってもアルゼンチンは「とおい昔」の記憶の中にある国なのです（もっとも、その後、2011年までに7回も訪れているのですが……）。,[],[]
