headline,mainEntityOfPage,image,datePublished,dateModified,author,media_en,media_jp,str_count,body,images,external_links
ブリクストン「クロスファイア125XS」【1分で読める 原付二種解説 2025年現行モデル】（webオートバイ）,https://news.yahoo.co.jp/articles/eb9cd22634004a3c74ef51d87362e660eea73a18,https://newsatcl-pctr.c.yimg.jp/t/amd-img/20250617-00010001-autoby-000-1-view.jpg?exp=10800,2025-06-17T19:10:03+09:00,2025-06-17T19:10:03+09:00,webオートバイ,autoby,webオートバイ,769,"BRIXTON「Crossfire 125XS」 税込価格：42万円
BRIXTON Crossfire 125XS
オーストリアに本拠地を置くKSRグループの「ブリクストン」。2018年にEICMA（ミラノショー）でデビューした新興ブランドで、日本では2023年からモータリストが輸入販売を行なっている。
【写真はこちら】「クロスファイア125XS」の全体・各部・走行シーン
同ブランドでは、「クロスファイア」「クロムウェル」「フェルスベルク」「サンレイ」「レイバーン」という5シリーズをさまざまな排気量で展開している。

このクロスファイア125XSは、名前こそクロスファイアシリーズの一員ではあるが、XSは他のモデルとは一線を画した、ユニークなキャラクターが魅力のモデル。

前後12インチホイールを採用したミニスクランブラー風のスタイルはグロムやKSRに近いものの、凝縮感のある、非常に個性的なデザインとなっている。

サスペンションは倒立フォークにモノショックの組み合わせ、前後にCBS付きのディスクブレーキを備える。エンジンはシリーズ唯一となる空冷ユニットを搭載。最高出力は約11.2PSを発揮し、コンパクトな車体を活かしたクイックな走りで、ストリートを自在に楽しめる一台だ。

カラーバリエーションは「クロックワーク・オレンジ」「カーゴ・グリーン」「バックステージ・ブラック」の全3色。

エンジン形式：空冷4ストロークSOHC単気筒
総排気量：125cc
最高出力：8.2kW/8500rpm
最大トルク：9.6N・m/6500rpm
燃料タンク容量：11L
変速機形式：5速リターン
ブレーキ前・後：Φ220mmディスク・Φ190mmディスク
タイヤサイズ前・後：120/70-12・130/70-12
オートバイ編集部",[],[]
【バイク・インプレ】ホンダ「レブル250 Sエディション Eクラッチ」｜ライダーにより優しくなった新型レブル250シリーズ（webオートバイ）,https://news.yahoo.co.jp/articles/86a27950d72fccf831cf570003a323c2e6ee018f,https://newsatcl-pctr.c.yimg.jp/t/amd-img/20250617-00010000-autoby-000-1-view.jpg?exp=10800,2025-06-17T13:10:02+09:00,2025-06-17T13:10:02+09:00,webオートバイ,autoby,webオートバイ,1273,"気負わず乗れるレブル250とEクラッチは相性抜群
Honda Rebel 250 S Edition E-Clutch
既存のクルーザーやネイキッドとはまるで異なったコンセプトとデザインで2017年に登場したレブル250。その後、同車はオートバイの操作に不慣れなエントリーユーザーや、スポーツ性よりも気軽さを求めるライダーなど、幅広い層のユーザーから支持され、現在に至るまで人気の衰えを知らない。
【写真はこちら】「レブル250 Sエディション Eクラッチ」の全体
それだけにクラッチ操作がいらない「ホンダEクラッチ」の採用を待っていたライダーも多いのではないだろうか。

クラッチレバーが付いているため、ニュートラルから1速に入れるときはついレバーを握りそうになるが、握れば一時的にマニュアルクラッチになるだけなので不都合はない。オーナーならすぐに慣れるはずだ。発進／加速はスロットルを開くだけという操作はスーパーカブ系の自動遠心クラッチと同じ。しかしEクラッチはクラッチの繋がり始めから完全に繋がるまでの制御が素晴らしい。

Eクラッチシステムのユニット自体は先に採用したCB650R／CBR650Rと基本的に同じものだが、「レブルのエンジン特性に合わせて入念にチューニングした」というだけあって、ユルユルとした動き出しから強力なダッシュまで、ベテランライダー顔負けの巧みさを見せつける。

続くシフトのアップ／ダウンはシフトペダルの操作だけだ。ペダルの動きをセンサーが監視しているから、アップ時はシフターが作動してスロットルを開けたままでもスパッと、ダウン時は半クラッチ制御が入ってスムーズにギアが切り替わる。

誤解して欲しくないのは、オートマチック変速ではなく「クラッチ制御の自動化」だということ。ホンダのDCTやヤマハのY-AMTのように速度に応じてギアが切り替わるわけではない。

例えば6速で走行していて減速／停止してもギアは6速のまま。再加速／発進時にはペダルを踏み込むシフトダウン操作が必要になるので、ギア段数に対してエンジン回転が低すぎるときはメーター内のギアポジションインジケーター横に「ギアを下げろ」を意味する矢印が表示される。

クラッチレバーを一切操作しないで済むのは肉体的にも精神的にも楽で、発進／停止を繰り返す市街地走行では特にありがたい。スタンダードにはMTモデルも設定され、Eクラッチの有無による価格差は5万5000円だが、ストリートユース頻度が高いユーザーには迷わずEクラッチ仕様をすすめる。

2025年モデルはハンドル形状が変わり、グリップ位置がライダー側に6.5mm近く、5mm高くなった。数値的には小さな差だが、肘の曲がりに余裕が出て、小柄なライダーにも扱いやすくなった。併せてシートのクッション材質、リアサスペンションのバンプラバーも変更され、長時間走行の快適性が上がっている。

なお、Sエディションはライトカウルを装備しているが、風防効果はほとんどないので、好みで選べばいいだろう。
太田安治",[],[]
