headline,mainEntityOfPage,image,datePublished,dateModified,author,media_en,media_jp,str_count,body,images,external_links
保育園から炎　「無我夢中」雷と豪雨の中消火、園児救出　茨城・坂東消防署、坂本さんに感謝状（茨城新聞クロスアイ）,https://news.yahoo.co.jp/articles/a351c3cd3715e16c28c90f5ed23c90538e669fac,https://newsatcl-pctr.c.yimg.jp/t/amd-img/20231225-00000008-ibaraki-000-1-view.jpg?exp=10800,2023-12-25T13:35:00+09:00,2023-12-25T13:35:00+09:00,茨城新聞クロスアイ,ibaraki,茨城新聞クロスアイ,447,\n菊地幸男署長(左)から感謝状を贈られた坂本貴志さん=坂東市辺田\n近所の保育園の火事を消し止め、園児や保育士ら4人を救ったとして、茨城西南地方広域消防本部の坂東消防署(茨城県坂東市、菊地幸男署長)は13日、坂東市辺田の会社員、坂本貴志さん(39)に感謝状を贈った。\n\n同署などによると、10月28日午前8時40分ごろ、坂本さんが近所の地域型保育「夢遊児園」の外壁から炎が出ているのを発見。市内は当時、激しい雷と豪雨に見舞われていたが、坂本さんが駆け付けて火災発生を知らせた。さらに備え付けの消火器で火を消し止め、被害は壁の一部と電力メーターを焼いただけでとどまった。\n\n感謝状を手渡された坂本さんは「出かけようと玄関を開けると炎が上がっているのが見えた。無我夢中で駆け付けた。自分も小さい子どもがいるため、園児を助けられて安心した」と語った。\n\n菊地署長は「延焼を防ぐには発生から3分間が重要。荒天の中、自らの危険を顧みず消火に当たり、敬意を表したい」とたたえた。\n茨城新聞社,['https://newsatcl-pctr.c.yimg.jp/t/amd-img/20231225-00000008-ibaraki-000-1-view.jpg?pri=l&w=640&h=426&exp=10800'],['https://news.yahoo.co.jp/articles/a351c3cd3715e16c28c90f5ed23c90538e669fac/images/000']
百回忌、中村彝しのぶ　有志ら10人命日法要　茨城・水戸（茨城新聞クロスアイ）,https://news.yahoo.co.jp/articles/5d89e130061031cddc0d06e35ac70f1ce67346df,https://newsatcl-pctr.c.yimg.jp/t/amd-img/20231225-00000006-ibaraki-000-2-view.jpg?exp=10800,2023-12-25T10:00:00+09:00,2023-12-25T10:10:01+09:00,茨城新聞クロスアイ,ibaraki,茨城新聞クロスアイ,504,\n中村彝をしのび、墓前で手を合わせる有志ら=水戸市八幡町\n茨城県水戸市出身の洋画家、中村彝(つね)(1887～1924年)の百回忌命日法要が24日、墓所がある同市八幡町の祇園寺で営まれた。彝を慕う有志ら10人が集い、早世した天才画家をしのんだ。\n\n彝は旧水戸藩士の家に生まれ、陸軍幼年学校に入学するが、肺結核の宣告を受けて軍人を断念。その後、絵の道に転じ、白馬会や太平洋画会の研究所で頭角を現す。第8回文展(14年)で3等を受賞し、第2回帝展(20年)には盲目の詩人「エロシェンコ氏の像」を出品するなど傑作を次々と発表。活躍は20年にも満たないが、レンブラントやセザンヌ、ルノワールなどの影響を受けながら、独自の画風を確立した。\n\n命日法要は、画業顕彰などを行う「中村彝会」が中心となって毎年行われてきた。2007年に解散となるが、同会元事務局長の阿王桂(あおうかつら)さん(69)=埼玉県=が彝を慕う有志に呼びかけ、墓参を続けている。\n\n阿王さんは「来年は彝没後100年の節目。今後は、彝が生前育んだ素晴らしい人間関係にまで思いを巡らせながら、墓参りが続いてほしい」と話した。\n茨城新聞社,['https://newsatcl-pctr.c.yimg.jp/t/amd-img/20231225-00000006-ibaraki-000-2-view.jpg?pri=l&w=640&h=426&exp=10800'],['https://news.yahoo.co.jp/articles/5d89e130061031cddc0d06e35ac70f1ce67346df/images/000']
駿府城警備の様子解説　本堂家家臣の日常紹介　茨城・かすみがうら市博物館（茨城新聞クロスアイ）,https://news.yahoo.co.jp/articles/3e75a830f9ef897c05dccafe8496a440bf4e969a,https://newsatcl-pctr.c.yimg.jp/t/amd-img/20231225-00000007-ibaraki-000-2-view.jpg?exp=10800,2023-12-25T11:00:00+09:00,2023-12-25T11:11:01+09:00,茨城新聞クロスアイ,ibaraki,茨城新聞クロスアイ,827,\n志筑藩を治めた本堂親道が担った「駿府加番」を解説する企画展=かすみがうら市坂の市歴史博物館\n常陸国志筑(現茨城県かすみがうら市)を治めた本堂家が江戸時代に担った駿府城(静岡県静岡市)の警備役「駿府加番」を解説する企画展「交代寄合 本堂親道の駿府加番」が、かすみがうら市坂の市歴史博物館で開かれている。徳川家康ゆかりの城を守る任務や、現地での家臣の日常を知ることができる。3月10日まで。\n\n参勤交代を許された「交代寄合」の旗本として、大名に準じた家格だった本堂家は、9代親道が弘化4(1847)年～嘉永元(48)年の1年間、駿府加番に任じられた。駿府城は大坂城や京都二条城と並ぶ江戸幕府直轄の城で、城代が置かれ、加番は城外の警備に当たった。\n\n親道は3家が務めた加番のうち「駿府二加番」を担当。9月の赴任前には、3家合同であいさつ回りや打ち合わせに奔走するなど準備に追われた。\n\n今回、本堂家家臣の横手亘義質が残した資料が子孫宅から発見され、準備や任務の様子が初めて判明。横手は、家老・横手家の分家として親道に従い、駿河地域の歴史や加番の記録、城下町絵図などを書写していた。勤務の傍ら、石川五右衛門などを描いた当時の歴史小説も写した。横手は明治時代に吉川重松と改名し、校長や村長など地元の名士として活躍した。\n\n千葉隆司館長は「1度しか回ってこない誉れとなる務めだった」と解説。他家との交流を経験したことで、外国勢力への備えなどで幕末に向けて軍備を増強していく契機になった可能性もあると推測する。\n\nNHK大河ドラマ「どうする家康」で描かれた幕府の開祖・家康ゆかりの城に関する職務だっただけに、千葉館長は「静岡と本市の関係に興味を持ってもらい、観光交流にもつながれば」と期待する。\n\n月曜日と12月28日～1月2日休館。入館料は一般220円、小中学生110円。2月4日には、千葉館長の記念講演会を予定している。\n茨城新聞社,['https://newsatcl-pctr.c.yimg.jp/t/amd-img/20231225-00000007-ibaraki-000-2-view.jpg?pri=l&w=640&h=427&exp=10800'],['https://news.yahoo.co.jp/articles/3e75a830f9ef897c05dccafe8496a440bf4e969a/images/000']
「野球しようぜ」　大谷選手寄贈グラブ、茨城県内に到着　メッセージ同封　笠間市、庁舎ロビーに展示（茨城新聞クロスアイ）,https://news.yahoo.co.jp/articles/c746e2867e98fd3f69e6182b14e5f0cb10f824c8,https://newsatcl-pctr.c.yimg.jp/t/amd-img/20231225-00000009-ibaraki-000-1-view.jpg?exp=10800,2023-12-25T20:21:00+09:00,2023-12-25T20:21:00+09:00,茨城新聞クロスアイ,ibaraki,茨城新聞クロスアイ,564,\n1\n/\n2\n県教委に届いた大谷翔平選手寄贈の野球グラブとメッセージ=県庁\n笠間市役所ロビーに展示された大谷翔平選手寄贈の野球グラブ=同市中央\n米大リーグ・ドジャースに移籍した大谷翔平選手(29)が日本の全小学校への寄贈を表明した子ども用グラブが25日、茨城県内の教育委員会に届き始めた。小学校に届けられるのは冬休み明けのため、県内自治体の一部では同日、庁舎ロビーでの展示も始まった。\n\n県教委に届いたのは県立特別支援学校小学部設置校の22校分。同日は水戸市など11市町教委にも届いたという。\n\n同日午後3時半ごろ、グラブが入った段ボール4箱が県教委に到着。箱には真新しいグラブが並び、小指部分には大谷選手のサインが印字されていた。大谷選手からのメッセージも同封され、「このグローブが、私たちの次の世代に夢を与え、勇気づけるためのシンボルとなることを望んでいます。野球しようぜ」などとつづられていた。\n\n市内11校分33個が届いた笠間市では同日、まず市民にお披露目しようと、同市中央の市庁舎ロビーに展示。ショーケースの上には「大谷翔平選手ありがとう!」の横断幕が掲げられた。学校事務の小林駿太さん(22)は「子どもたちが初めて使うグラブになるとしたら、ずっと心に残るだろう」と笑顔を見せた。\n茨城新聞社,"['https://newsatcl-pctr.c.yimg.jp/t/amd-img/20231225-00000009-ibaraki-000-1-view.jpg?pri=l&w=640&h=433&exp=10800', 'https://newsatcl-pctr.c.yimg.jp/t/amd-img/20231225-00000009-ibaraki-001-1-view.jpg?pri=l&w=435&h=640&exp=10800']","['https://news.yahoo.co.jp/articles/c746e2867e98fd3f69e6182b14e5f0cb10f824c8/images/000', 'https://news.yahoo.co.jp/articles/c746e2867e98fd3f69e6182b14e5f0cb10f824c8/images/001']"
水戸市立中の校長停職処分　調査書の評定誤記　茨城県教委（茨城新聞クロスアイ）,https://news.yahoo.co.jp/articles/86d85fc7052b7fc7fc017ca9e9f31732659b67bc,https://newsatcl-pctr.c.yimg.jp/t/amd-img/20231225-00000010-ibaraki-000-1-view.jpg?exp=10800,2023-12-25T21:33:00+09:00,2023-12-25T21:33:00+09:00,茨城新聞クロスアイ,ibaraki,茨城新聞クロスアイ,443,\n茨城県庁=水戸市笠原町\n茨城県水戸市の市立中学校で、今春卒業した生徒の評定に誤りがある調査書が志願先の高校に提出された問題で、県教育委員会は25日、同校の校長(56)を停職1カ月の懲戒処分にしたと発表した。処分理由について「結果的には隠蔽(いんぺい)に当たる。生徒の将来を左右しかねない重大な事案」としている。処分は同日付。\n\n県教委によると、評定の誤りは、別の生徒の成績証明書で誤記が判明したのをきっかけに、水戸市教委が7月、昨年度の同校卒業生全員の評定を調べて発覚した。志願先に提出された調査書に誤記があったのは、同校生徒1人の1教科分。\n\nこの生徒は3月、通知表を受け取った際、評定の誤りに気付き、学校側は通知表を訂正。だが、志願先へ送付した調査書については、校長が誤記の可能性を認識しながら「合格発表の数日前で訂正は難しい」と判断し、市教委への報告も怠ったという。\n\n県教委は、誤記を知りながら報告を怠ったとして、複数の職員を厳重注意処分にした。\n茨城新聞社,['https://newsatcl-pctr.c.yimg.jp/t/amd-img/20231225-00000010-ibaraki-000-1-view.jpg?exp=10800'],['https://news.yahoo.co.jp/articles/86d85fc7052b7fc7fc017ca9e9f31732659b67bc/images/000']
平和願い　だるま名入れ　雨引観音　茨城・桜川（茨城新聞クロスアイ）,https://news.yahoo.co.jp/articles/9f9c338912adc45ac372b791baccf404b12e6466,https://newsatcl-pctr.c.yimg.jp/t/amd-img/20231225-00000005-ibaraki-000-2-view.jpg?exp=10800,2023-12-25T09:00:00+09:00,2023-12-25T09:09:02+09:00,茨城新聞クロスアイ,ibaraki,茨城新聞クロスアイ,390,\nだるまの背に「雨引観音」と書き入れる僧侶=桜川市本木\n茨城県桜川市本木の雨引山楽法寺(雨引観音)で、年末恒例のだるまの名入れが大詰めを迎えている。新年の福を願い、僧侶がだるまの背に「雨引観音」と筆で書き込んでいる。だるまは商売繁盛や家内安全を願う初詣客に縁起物として販売される。\n\nだるまの名入れは毎年12月初旬から年末にかけて行われる。今年は高さ12～75センチのだるま約1000個を産地の群馬県高崎市から仕入れた。僧侶の高嶋晄精さん(45)らが境内の絵馬堂で一筆一筆丁寧に白い文字で記す。高嶋さんは「世界情勢が不安定な年だったので、平和への願いを込めている。新年は皆さまにとって心豊かな1年になってほしい」と話した。\n\nほかにも本堂のすす払いやお札の用意など、新年を迎える準備を進める。元旦は午前0時からごま祈禱(きとう)を行い、初詣客らを迎える。\n茨城新聞社,['https://newsatcl-pctr.c.yimg.jp/t/amd-img/20231225-00000005-ibaraki-000-2-view.jpg?pri=l&w=640&h=426&exp=10800'],['https://news.yahoo.co.jp/articles/9f9c338912adc45ac372b791baccf404b12e6466/images/000']
車内置き去り防げ　通学バスに乗降記録機　茨城・かすみがうら市、行方市（茨城新聞クロスアイ）,https://news.yahoo.co.jp/articles/9cc9d42d5529d48f11b80d61627157484d313c0b,https://newsatcl-pctr.c.yimg.jp/t/amd-img/20231225-00000003-ibaraki-000-2-view.jpg?exp=10800,2023-12-25T07:00:00+09:00,2023-12-25T07:07:02+09:00,茨城新聞クロスアイ,ibaraki,茨城新聞クロスアイ,1306,\n読み取り機にICカードをかざしてスクールバスに乗車する児童=かすみがうら市上佐谷の市立千代田義務教育学校\n少子化による学校の統廃合で送迎バスの利用が広がる中、児童生徒の車内置き去りを防止する安全装置の導入が茨城県内で始まっている。かすみがうら市は11月、バス乗降時にICカードをカードリーダーにかざして乗降を記録する装置の運用を開始。行方市も9月からQRコードを使った同様のシステムを取り入れている。2022年に静岡県で起きた園児死亡事故を受け、学校関係者は「紙のリストや点呼も行い、二重三重の対策に当たっている」と神経を使っている。\n\n▽違う場所で降車\n\nかすみがうら市教委は11月、「スクールバス乗降管理システム」を使い始めた。同市では22年7月に小学1年の男子児童がバス内で寝過ごした後、本来降りるはずのバス停ではない場所で降車し、一時不明になる事案が発生した。市はこれを受け、2023年度の装置導入を図った。\n\n市内では近年、学校統廃合を加速した結果、4校が送迎バスを導入し、小中学生の4分の1を超す計745人が使う(12月1日現在)。通学距離が小学生は2キロ以上、中学生は6キロ以上だと無料で利用できる。\n\n市立千代田義務教育学校(同市上佐谷)は前期課程(小学1～6年生)の児童がバスを利用する。12月中旬の放課後、駐車場には計8台のバスが並び、児童が慣れた様子で装置にICカードをかざし、次々と乗り込んでいった。\n\n▽学校PCで確認\n\n乗降の記録はバスに付けたタブレット端末に表示され、教職員が学校のパソコンでも確認できる。指定場所以外で乗降しようとするとエラーが表示され、車内置き去りがあると運行が完了しない仕組みになっている。\n\n約800万円で装置を導入した市教委は「乗り過ごしや車内置き去りを防ぎ、さらなる安全安心を目指す」(学校教育課)としている。\n\nタブレット端末は取り外し可能で、バス側に特別な工事は必要ない。システム構築を委託された情報通信機器会社「ナカヨ」(東京都)の担当者は「かすみがうら市が初の導入例。学校統廃合で全国的にニーズがあると思われ、装置の使い勝手を良くしていきたい」と語る。\n\n▽QRコード活用\n\n静岡の死亡事故を受け、国は幼稚園や保育園の送迎バスで23年度、置き去り防止の安全装置設置を義務化した。小学校以上は義務化の対象ではないものの、県内では導入する自治体が他にも出始めた。\n\n行方市は9月、QRコードを使った乗降管理システム「QRだれドコ」の運用を小中学校で始めた。\n\nシステムは、ソフトの企画などを手がけるフルティフル(静岡県浜松市)が開発。読み取り機にQRコードをかざすことで乗降を記録し、学校や市教委、運行事業者が確認できる。希望する保護者にメール配信も可能だ。23年度の予算は約200万円。\n\n小中5校でバス利用者は約1100人。市教委学校教育課は、通信の不具合などを改善しながら装置の完成度を高めており、「行方に合った利用しやすいモデルを構築していきたい」(担当者)としている。\n茨城新聞社,['https://newsatcl-pctr.c.yimg.jp/t/amd-img/20231225-00000003-ibaraki-000-2-view.jpg?pri=l&w=640&h=427&exp=10800'],['https://news.yahoo.co.jp/articles/9cc9d42d5529d48f11b80d61627157484d313c0b/images/000']
全国高校バスケット　土浦日大、延長制す　下妻一、作新破る　茨城県勢女子2校16強（茨城新聞クロスアイ）,https://news.yahoo.co.jp/articles/b2ce015c2745b44ce0e3b57e7593c8c4763cc0d5,https://newsatcl-pctr.c.yimg.jp/t/amd-img/20231225-00000001-ibaraki-000-2-view.jpg?exp=10800,2023-12-25T05:00:00+09:00,2023-12-25T05:05:02+09:00,茨城新聞クロスアイ,ibaraki,茨城新聞クロスアイ,421,\n〈女子2回戦〉大阪桐蔭-土浦日大 第3クオーター、シュートを決める土浦日大の檜山(左)=東京体育館\nバスケットボールの第76回全国高校選手権大会第2日は24日、東京体育館で男子の1回戦残り8試合と女子の2回戦が行われ、茨城県勢女子は土浦日大が大阪桐蔭(大阪)を延長戦の末に84-78で下し、下妻一は作新学院(栃木)を64-49で退け、共にベスト16入りを決めた。\n\n第3日は25日、男子の2回戦と女子の3回戦が行われ、男子の土浦日大は鳥取城北(鳥取)と対戦し、女子は下妻一が前年覇者の京都精華学園(京都)と、土浦日大は千葉経大付(千葉)とそれぞれ顔を合わせる。\n\n【女子】 \n▽2回戦 \n下妻一 64-49 作新学院(栃木) \n24-9 \n15-12 \n20-11 \n5-17\n\n土浦日大 84-78 大阪桐蔭 \n11-22 \n16-14 \n21-20 \n24-16 \n延長 \n12-6\n茨城新聞社,['https://newsatcl-pctr.c.yimg.jp/t/amd-img/20231225-00000001-ibaraki-000-2-view.jpg?pri=l&w=417&h=640&exp=10800'],['https://news.yahoo.co.jp/articles/b2ce015c2745b44ce0e3b57e7593c8c4763cc0d5/images/000']
「戦争反対」強く訴え　平和運動団体や政党　茨城・水戸（茨城新聞クロスアイ）,https://news.yahoo.co.jp/articles/9d60f4e6115dc221e94ff484b557f7fa26e772fe,https://newsatcl-pctr.c.yimg.jp/t/amd-img/20231225-00000004-ibaraki-000-2-view.jpg?exp=10800,2023-12-25T08:00:00+09:00,2023-12-25T08:08:01+09:00,茨城新聞クロスアイ,ibaraki,茨城新聞クロスアイ,416,\n戦争反対を掲げ平和を呼びかける県内の平和運動団体と政党関係者ら=水戸市宮町\n茨城県内の平和運動団体や政党の地方組織が24日、同県水戸市宮町のJR水戸駅南口のペデストリアンデッキで、戦争や改憲の反対などを呼びかける「12・24平和を求める総がかり行動」を実施した。参加した関係者約120人がチラシを配るとともに、各団体の代表者約10人がリレートークを行い、戦争のない平和の大切さなどを通行人に訴えた。\n\n参加したのは、茨城平和擁護県民会議や県平和委員会など県内の平和運動7団体と、立民、社民、共産、新社会の4党の地方組織。イスラエル軍によるパレスチナ自治区ガザへの攻撃など、国際情勢の悪化を受けて開いた。\n\nリレートークで各団体の代表者らは、ガザ地区の被害者の多くは女性や子どもが占める状況などに触れながら、「一日でも早くこの戦争を終わらせなければいけない」「世界中に殺していい命はない」などと力を込めた。\n茨城新聞社,['https://newsatcl-pctr.c.yimg.jp/t/amd-img/20231225-00000004-ibaraki-000-2-view.jpg?pri=l&w=640&h=387&exp=10800'],['https://news.yahoo.co.jp/articles/9d60f4e6115dc221e94ff484b557f7fa26e772fe/images/000']
バスケットボールB1　茨城ロボッツまた苦杯　秋田に72-88（茨城新聞クロスアイ）,https://news.yahoo.co.jp/articles/b3bd20cfa17e8c8e1dd1b2c69c1b4cc1d5d2724f,https://newsatcl-pctr.c.yimg.jp/t/amd-img/20231225-00000002-ibaraki-000-2-view.jpg?exp=10800,2023-12-25T06:00:00+09:00,2023-12-25T06:06:01+09:00,茨城新聞クロスアイ,ibaraki,茨城新聞クロスアイ,415,\n1\n/\n2\nロボッツ-秋田 第3クオーター、ドリブルで攻め込むロボッツの平尾(左)=アダストリアみとアリーナ\nロボッツ-秋田 第1クオーター、シュートを決めるロボッツのタプスコット(右)=アダストリアみとアリーナ\nバスケットボール男子のBリーグ1部(B1)は24日、アダストリアみとアリーナなどで12試合が行われ、茨城ロボッツは秋田に72-88で競り負け、13連敗となった。ロボッツの今季通算成績は1勝23敗で東地区最下位のまま。\n\nロボッツは開始から5連続失点と出遅れながらも、山口やタプスコットらの連続得点で盛り返した。10点ビハインドで迎えた最終クオーターは大庭の3点シュートなどで2点差まで詰め寄るも、反撃はここまでだった。\n\n(アダストリアみとアリーナ、3963人) \n秋田 12勝12敗 88-72 茨城 1勝23敗 \n28-23 \n20-20 \n17-12 \n23-17\n茨城新聞社,"['https://newsatcl-pctr.c.yimg.jp/t/amd-img/20231225-00000002-ibaraki-000-2-view.jpg?pri=l&w=462&h=640&exp=10800', 'https://newsatcl-pctr.c.yimg.jp/t/amd-img/20231225-00000002-ibaraki-001-2-view.jpg?pri=l&w=434&h=640&exp=10800']","['https://news.yahoo.co.jp/articles/b3bd20cfa17e8c8e1dd1b2c69c1b4cc1d5d2724f/images/000', 'https://news.yahoo.co.jp/articles/b3bd20cfa17e8c8e1dd1b2c69c1b4cc1d5d2724f/images/001']"
