headline,mainEntityOfPage,image,datePublished,dateModified,author,media_en,media_jp,str_count,body,images,external_links
「トランプ大統領の母校」軍事学校、財政難で中国人事業家の手に（中央日報日本語版）,https://news.yahoo.co.jp/articles/a3a6ac4f7a1a70d7d710f6dc86fe347fb8d0e40b,https://newsatcl-pctr.c.yimg.jp/t/amd-img/20250606-00000026-cnippou-000-1-view.jpg?exp=10800,2025-06-06T14:27:20+09:00,2025-06-06T14:27:20+09:00,中央日報日本語版,cnippou,中央日報日本語版,811,"［ニューヨーク軍事学校ホームページ　キャプチャー］
財政難に苦しむトランプ米大統領の母校ニューヨーク軍事学校が中国人事業家に買収され、新たな全盛期を模索している。

ウォールストリートジャーナル（ＷＳＪ）は４日（現地時間）、「経営難と負債に苦しむニューヨーク軍事学校の所有者が最近、中国人事業家アラン・ルー氏に変わった」とし「学校を立て直せるかどうかが注目される」と報じた。

学校を買収したルー氏は中国復旦大で金融学博士学位を取得し、上海に本社を置くクァンファ教育グループを設立した人物だ。中国に１０校以上の私立学校を所有している。

ルー氏は２月、コーンウォール市議会で自身が学校の所有主となり、新しい指導部が学生数を１５００人まで増やすと抱負を明らかにした。

ただ、ＷＳＪは「中国から流れてきた資金で学校を買収したため所有構造が非常に複雑で透明でない」と指摘した。

トランプ大統領は「荒っぽく反抗的な」行動を正そうとする親の意で１３歳（１９５９年）から１８歳（１９６４年）までニューヨーク軍事学校に通ったと明らかにした。

トランプ大統領は先月２５日、ウェストポイント（米陸軍士官学校）の卒業式に出席して演説した際、ニューヨーク軍事学校にも言及した。学校はウェストポイントから１０キロの距離にある。トランプ大統領は「ここから遠くないところの高校に通った。良いところ」と表現し、愛情を表した。

ニューヨーク軍事学校は１９６０年代には５００人以上の生徒が在学するほど人気だったが、軍隊式の教育の人気が落ちて困難に直面した。

２０１５年には破産申請をして閉鎖されたが、中国人事業家のビンセント・モ氏が学校を１５８０万ドル（約２２億円）で買収した。モ氏はニューヨーク軍事学校を「スーパー学校に復活させる」で公言したが、むしろ現在７８０万ドルを負債を抱える状態だ。現在学校は運営されているが、在学生は５０人しかいない。",[],[]
歌手Ｇ－ＤＲＡＧＯＮ、女優イ・ジュヨンとまた熱愛説…「事実ではない」釘刺す（中央日報日本語版）,https://news.yahoo.co.jp/articles/67f1d8b2bd29f13b0b4b23e35226016942ee836f,https://newsatcl-pctr.c.yimg.jp/t/amd-img/20250606-00000025-cnippou-000-1-view.jpg?exp=10800,2025-06-06T14:03:07+09:00,2025-06-06T14:03:07+09:00,中央日報日本語版,cnippou,中央日報日本語版,681,"ＢＩＧＢＡＮＧ（ビッグバン）のＧ－ＤＲＡＧＯＮ（ジードラゴン）（左）と女優のイ・ジュヨン。［写真　ニュース１］
ＢＩＧＢＡＮＧ（ビッグバン）のＧ－ＤＲＡＧＯＮ（ジードラゴン、本名クォン・ジヨン）とガールズグループ「ＡＦＴＥＲＳＣＨＯＯＬ（アフタースクール）」出身の女優イ・ジュヨンとの間に熱愛説が持ち上がると所属事務所側が公式に否定した。

Ｇ－ＤＲＡＧＯＮ所属事務所ギャラクシーコーポレーションは６日、「最近相次いで疑惑が提起されているＧ－ＤＲＡＧＯＮとイ・ジュヨンの熱愛説は事実ではない」と短くコメントを出した。

４月２７日、イ・ジュヨンは自身のソーシャルメディア（ＳＮＳ）に写真を掲載した。この写真でイ・ジュヨンは黒のソファに座って猫を抱いていた。

その後、該当の写真を見た人々はイ・ジュヨンがいる場所がＧ－ＤＲＡＧＯＮの家ではないかと推測した。これに先立って公開されたＧ－ＤＲＡＧＯＮの自宅のインテリアとそっくりだという主張だ。これを受けてインターネット上を中心に２人の熱愛説が広がった。

２人の熱愛説は今回が初めてではない。２人は２０１７年二度熱愛説が出たことに続き、２０１８年、２０１９年、２０２０年にそれぞれ熱愛説が持ち上がったがそのたびにはっきりとはコメントしなかった。コメントを出すにしても「私生活なので立場を明らかにするのは難しい」という言葉をを繰り返してきた。

一方、Ｇ－ＤＲＡＧＯＮは今年４月、ガールズグループＴＷＩＣＥ（トゥワイス）のサナとも「ラブスタグラム」をしたとして熱愛疑惑が浮上していたが、６月２日にこれを否定していた。",[],[]
＜サッカー＞北中米Ｗ杯出場を決めた韓国の洪明甫監督「今後は本大会に焦点合わせる」（中央日報日本語版）,https://news.yahoo.co.jp/articles/c68d61d511aa97cf094101feadf50f97f55189ba,https://newsatcl-pctr.c.yimg.jp/t/amd-img/20250606-00000024-cnippou-000-1-view.jpg?exp=10800,2025-06-06T13:58:08+09:00,2025-06-06T13:58:08+09:00,中央日報日本語版,cnippou,中央日報日本語版,989,"韓国代表を１１回連続となるＷ杯本大会進出に導いた洪明甫（ホン・ミョンボ）監督　［写真　大韓サッカー協会］
「これからはすべてのことをワールドカップに焦点を合わせて準備する」。

サッカー韓国代表の１１回連続ワールドカップ（Ｗ杯）本大会進出が決まった中、洪明甫（ホン・ミョンボ）監督はこのように語った。洪監督が率いる韓国代表は６日（日本時間）、イラクのバスラ国際競技場で行われた２０２６北中米Ｗ杯アジア３次予選Ｂ組第９戦でイラク代表に２－０で勝利した。勝ち点を１９に伸ばしたＢ組１位の韓国は３位イラク（勝ち点１２）との差を７に広げ、組２位以上が確定した。

１０日にソウルＷ杯競技場で行われるクウェート代表との最終第１０戦の結果とは関係なく、組２位まで与えられる本大会直行チケットを確保した。これで韓国サッカーは１９８６年のメキシコＷ杯から１年後に迫った北中米Ｗ杯まで１１回連続でＷ杯本大会に出場するという大記録を達成した。洪監督は「選手たちを祝う。うれしい」と所感を語った。

相手の強いプレスに苦戦していた韓国は前半２６分、イラクの選手の退場で数的優位となった。そして後半に投入された金鎮圭（キム・ジンギュ、全北現代）、呉賢揆（オ・ヒョンギュ、ヘンク）、全晋旴（チョン・ジンウ、全北）らがゴールを合作して勝利をつかんだ。金鎮圭（後半１８分）と呉賢揆（後半３７分）が得点した。特に呉賢揆は洪明甫監督の韓国代表で「特急ジョーカー」に浮上した。生涯初めて太極マークを付けた全晋旴は国家対抗戦（Ａマッチ）デビュー戦で貴重なアシストをマークし、洪監督の信頼に応えた。攻撃ポイントはなかったが、後半に交代で投入された文宣民（ムン・ソンミン）、崔俊（チェ・ジュン、共にＦＣソウル）も活躍し、洪監督の視線を引いた。

洪監督は「厳しい試合になると予想し、試合が始まってからも容易でないと感じたが、相手選手１人が退場したことで我々が試合を統制することができた」と分析した。

昨年７月に２度目の代表監督に就任した洪監督は３次予選で交代カードを活用して何度か成功していた。交代選手の活躍は韓国代表の主な戦略として定着した。韓国は３次予選９試合で計１６得点したが、うち６得点は交代選手のゴールだ。洪監督は「いろいろなことがあるが、一つずつしっかりと準備して本大会に備えなければいけない」と強調した。",[],[]
グーグルの「インアプリ決済」に耐えられない韓国ゲーム業界…１０兆ウォン提訴（中央日報日本語版）,https://news.yahoo.co.jp/articles/071c57b0e815f09e8f7bfb3bce0f78b783228836,https://newsatcl-pctr.c.yimg.jp/t/amd-img/20250606-00000023-cnippou-000-1-view.jpg?exp=10800,2025-06-06T13:51:51+09:00,2025-06-06T13:51:51+09:00,中央日報日本語版,cnippou,中央日報日本語版,1552,"ソウル江南区（カンナムグ）にあるグーグル（Ｇｏｏｇｌｅ）スタートアップキャンパス。［写真　ニュース１］
韓国ゲーム流通会社と大韓出版文化協会協会・韓国電子出版協会が米国でグーグル（Ｇｏｏｇｌｅ）に対して集団訴訟を起こした。グーグルが自社のインアプリ決済（アプリ内部決済）システムを事実上強制し、最大３０％に達する手数料を賦課して損害を負わせたという趣旨だ。韓国ゲーム会社がインアプリ決済手数料問題に関連してグーグルを直接提訴したのは今回が初めてだ。

◇何が起きたのか

業界によると、Ａゲーム流通会社などは今月３日（現地時間）、米国カリフォルニア州連邦裁判所にグーグル米国本社などを相手取って損害賠償および反トラスト行為禁止命令を請求する集団訴訟を起こした。アンドロイドアプリ流通市場を事実上独占しているグーグルがインアプリ決済手数料を強制して米国反トラスト法や韓国公正取引法などに違反したというのがゲーム会社の主張だ。Ａ社らはこれに先立ち、先月アップル（Ａｐｐｌｅ）にも同様の内容で集団訴訟を起こした。

Ａ社らは米国法を基準として２０２１～２０２４年の間、会社が受けた被害に対して３倍の懲罰的賠償を要求した。また、韓国法に基づいて２０１５年から６年間発生した被害に対する損害賠償も請求した。原告を代理している法律事務所「爲ＴｈｅＰｅｏｐｌｅ」側は「年間韓国内ゲームアプリ消費額が約８兆３０００億ウォン（約８７８７億円）に達することを勘案すれば、賠償額は最大１０兆ウォンと推定する」と主張した。

◇バックグラウンド

業界では「アプリストアプラットホーム企業が過度なインアプリ決済手数料を強制している」という指摘が繰り返し提起されてきた。Ａ社関係者は「過去１０年間、モバイルゲーム事業の売上が約５００億ウォンだったのに対し、グーグルとアップルに支払った手数料は１４０億ウォン」としながら「売上の約２８．５％を手数料に使った」と話した。アプリストア手数料はこれに先立って米国でも議論になった。『フォートナイト』開発会社のＥｐｉｃ　Ｇａｍｅｓは２０２０年自社決済システムを導入したという理由でグーグル・アップルのアプリストアから同ゲームが削除され、２社を相手取って反トラスト法違反の訴訟を起こしている。

裁判所は２０２３年１２月、グーグルが中国を除く全世界で反トラスト法を違反したと判決し、続く昨年１０月にはアプリストアを開放してインアプリ決済以外の他の決済手段も許容するように命じた。爲ＴｈｅＰｅｏｐｌｅのイ・ヨンギ弁護士は「Ｅｐｉｃ　Ｇａｍｅｓの訴訟結果は禁反言原則（先に取った意志表示や行為と矛盾する言動ができないようにする法の原則）により、今回の集団訴訟にもそのまま適用されることが明らかだ。そのため集団調停も同時に進めてゲーム会社がこれまで受けた被害を迅速に回復することができるようにするだろう」と説明した。

◇これも知っておかなくてはならない

事実、韓国はグーグル・アップルのインアプリ決済強制行為に初めて法的にブレーキをかけた国だ。２０２１年すでに「インアプリ決済強制禁止法」（電気通信事業法一部改正案）を制定した。これに対して２社は第三者決済を許容したが、これに対する手数料率を従来より３～４％低く策定した。２６～２７％手数料に決済代理店（ＰＧ）手数料を加えるとインアプリ決済とはほぼ同じ水準になる。そのため実効性論争が続いていた。業界のある関係者は「グーグルとアップルを意識して訴訟に参加もできず、不満も提起できないところが多い」とし「すでに国内法もあり、米国でも手数料を取りすぎだという判決が繰り返し出ているので政府が積極的に制裁すれば事実訴訟を悩む必要もない状況」と話した。",[],[]
＜大リーグ＞李政厚、飛距離１２３メートルの二塁打含む「３出塁」（中央日報日本語版）,https://news.yahoo.co.jp/articles/076b731e90aacfbe1f7cb14356e2d66032e3562f,https://newsatcl-pctr.c.yimg.jp/t/amd-img/20250606-00000022-cnippou-000-1-view.jpg?exp=10800,2025-06-06T13:18:49+09:00,2025-06-06T13:18:49+09:00,中央日報日本語版,cnippou,中央日報日本語版,726,"５日（現地時間）のサンディエゴ戦で二塁打を放ったサンフランシスコの李政厚（イ・ジョンフ）　［ＡＰ＝聯合ニュース］
米プロ野球メジャーリーグ（ＭＬＢ）サンフランシスコ・ジャイアンツの李政厚（イ・ジョンフ、２６）が３回の出塁でチームの勝利に貢献した。

サンフランシスコは６日（日本時間）、米カリフォルニア州サンフランシスコのオラクルパークでサンディエゴ・パドレスに３－２で勝利した。３番・中堅手で先発出場した李政厚は２打数１安打２四球１得点と活躍した。

前日の試合で２本の二塁打をマークした李政厚はこの日、１回一死一塁から先発ディラン・シースの２球目、１４５キロのスライダーを右中間に運んだ。球速１６３キロ、飛距離１２３メートルの打球はワンバウンドしてフェンスを越えた。李政厚の今季１７本目の二塁打となった。一死二、三塁のチャンスは後続打者の三振で得点には結びつかなかった。

李政厚は３回一死一塁の打席では四球で出塁し、ドミニク・スミスの二塁打で生還した。５回の打席で右翼フライに倒れた李政厚は７回の打席で四球を選び、この日３度目の出塁となった。

李政厚が１試合で３回出塁したのは先月２４日のワシントン・ナショナルズ戦（３打数２安打１四球）以来１３日ぶり。今季の打率は前日の２割７分４厘から２割７分６厘（２３９打数６６安打）に上がった。

３－２とリードしたサンフランシスコは９回表、抑え投手カミロ・ドバルが二死二、三塁の危機で最後の打者を三振に仕留めた。サンフランシスコは３５勝２８敗でナショナルリーグ西部地区３位。２位のサンディエゴ（３５勝２６敗）とは１ゲーム差に縮まった。サンフランシスコは７日からアトランタ・ブレーブスとホーム３連戦に入る。",[],[]
「李大統領の親中懸念」質問に、米国務省「話せるのは当選を祝うことだけ」（中央日報日本語版）,https://news.yahoo.co.jp/articles/f93acaebd26d8d7b7a0def64fda4f13ce2149626,https://newsatcl-pctr.c.yimg.jp/t/amd-img/20250606-00000021-cnippou-000-1-view.jpg?exp=10800,2025-06-06T11:53:01+09:00,2025-06-06T11:53:01+09:00,中央日報日本語版,cnippou,中央日報日本語版,888,"５日（現地時間）、ワシントンの米国務省で取材陣の質問に答えるピゴット首席副報道官　［米国務省ユーチューブチャンネル　キャプチャー］
米ホワイトハウスが李在明（イ・ジェミョン）大統領当選に関する取材陣の質問に異例にも「中国の影響力懸念」を表明したことに関連し、米国務省は５日（現地時間）、明確な論評の代わりに「我々は李大統領の当選を祝う」とだけ話した。

米国務省のピゴット首席副報道官はこの日の記者会見で、「李大統領の当選に関連したホワイトハウスの反応は、韓国の新大統領が親米より親中性向であり得るという現実的な懸念を反映したものか」という質問に対し、「私が話せるのは『米国は李大統領が韓国の大統領に当選したことを祝う』ということ」と答えた。そして「より詳細なことは質問を持ち帰って答えられるかをみる」と話した。

ホワイトハウスは３日、李大統領の当選に対する立場を尋ねる取材陣の質問に対し「韓国は自由で公正な選挙を行ったが、米国は全世界の民主主義に対する中国の干渉と影響力を依然として懸念し、反対する」と明らかにした。匿名の当局者名義の短い答弁だったが、ホワイトハウスが新しく発足する韓国政府に対して「中国の影響力懸念」に言及したのは異例と受け止められた。中国外務省は直ちに「米国は中韓関係の離間をやめるべき」と強く抗議した。

ホワイトハウスのレビット報道官は３日の記者会見で、「韓国の大統領選挙結果に対する立場はあるか」という取材陣の質問にまともに答えられない場面があった。レビット報道官は「もちろんある」と話したが、書類をしばらく見てから「今はない。探して伝える」と訂正して次の質問に移った。

一方、ピゴット副報道官は北朝鮮の金正恩（キム・ジョンウン）国務委員長が４日、ロシアのショイグ安全保障会議書記にウクライナ戦争後にも北朝鮮の軍隊をロシアに置くと述べたことに関し「我々は北朝鮮の直接的な戦争介入を引き続き懸念している」と述べた。続いて「ロシアに対する北朝鮮の軍事派兵と、その見返りとしてロシアが北朝鮮に提供するすべての支援は中断されなければならない」と伝えた。",[],[]
北朝鮮「倒れた駆逐艦が直立…細密復旧作業へ」（中央日報日本語版）,https://news.yahoo.co.jp/articles/dc348c9ecf7e1566dd2a1785335cdcba02020f2a,https://newsatcl-pctr.c.yimg.jp/t/amd-img/20250606-00000019-cnippou-000-1-view.jpg?exp=10800,2025-06-06T11:14:32+09:00,2025-06-06T11:14:32+09:00,中央日報日本語版,cnippou,中央日報日本語版,760,"北朝鮮が先月２１日、金正恩（キム・ジョンウン）国務委員長が見守る中、新しく建造した５０００トン級駆逐艦の進水式を開いたが、まともに進水できず、艦艇が倒れて破損する事故が発生した。写真は同月１５日に撮影された、清津造船所で建造を終えて進水を準備する駆逐艦。　［写真　韓国統一部］
北朝鮮が先月２１日の進水式で横倒れになった新型５０００トン級駆逐艦を直立状態に戻すのに成功したと明らかにした。
【写真】咸北清津造船所で捕捉された駆逐艦
朝鮮中央通信は６日、駆逐艦復旧推進組が党中央軍事委員会に報告した内容として、「６月初めに艦艇の均衡性を復元したのに続き、５日午後には艦艇を安全に埠頭に係留させた」と報道した。

続いて「駆逐艦の船体全般の状態に対する専門家集団の再検査をした後、次の段階の復旧作業に入る」とし「次の段階の細密復旧作業は羅津（ラジン）船修理工場の乾ドックで進行され、作業期間は７－１０日間と予想している」と説明した。

さらに「現地復旧推進組の事業を指導している党中央委員会書記の趙春龍（チョ・チュンリョン）同志は艦の完全な復旧は必ず党中央委員会第８期第１２回全員会議の招集前に終えると強調した」と伝えた。

北朝鮮は事故発生の翌日の先月２２日、国営メディアを通じて、倒れた艦の海水の排水に２、３日、側面を復旧するのに１０日余りがかかると明らかにした。

この船が進水式で倒れる場面を目撃した北朝鮮の金正恩（キム・ジョンウン）国務委員長は関係者に対する問責を予告し、６月中の船体復元を指示した。

韓国軍の合同参謀本部は前日、「清津（チョンジン）港で傾いていた北の艦艇が直立状態になったのを今週初めに確認した」とし「追加の作業が進行中と把握している。艦艇が浸水したのでおそらく排水作業があるだろう」と伝えた。",[],[]
李大統領の胸につけられた「破れた太極旗」バッジ、どんな意味が込められているのか（中央日報日本語版）,https://news.yahoo.co.jp/articles/5f15642713fd1aed4558ff6c0d9158b1772816b9,https://newsatcl-pctr.c.yimg.jp/t/amd-img/20250606-00000017-cnippou-000-1-view.jpg?exp=10800,2025-06-06T10:52:16+09:00,2025-06-06T10:52:16+09:00,中央日報日本語版,cnippou,中央日報日本語版,834,"津寛寺（チングァンサ）の太極旗。クォン・ヒョクジェ記者
韓国の李在明（イ・ジェミョン）大統領は５日、竜山（ヨンサン）大統領室で主宰した最初の国務会議に太極旗を模したバッジを左胸につけて出席した。就任初日から２日連続で李氏がつけているこのバッジは禹元植（ウ・ウォンシク）国会議長が贈ったものだ。
【写真】太極旗を模したバッジをつけた李在明大統領
禹議長は前日、ソウル汝矣島（ヨイド）国会サランチェで李大統領と与野党代表が同席する昼食会を用意した。この席で禹議長は国のアイデンティティを正しく立て直すことが重要な時という意味で李大統領に「津寛寺（チングァンサ）太極旗」バッジをつけた。

禹議長は同日、フェイスブックを通じて「就任記念の院内政党代表昼食会後、李大統領に津寛寺太極旗をつけて差し上げた」とし「三・一運動の時に使われ、津寛寺に保管されている太極旗のバッジ」と説明した。これに対して李大統領が「『本当に意味のある太極旗ですね！』と言って歓迎してくださった」と禹議長は伝えた。

禹議長が贈って李大統領が２日間つけたバッジは津寛寺太極旗を模したものだ。三・一運動（独立運動）が起きた１９１９年に製作されたと推定される津寛寺太極旗は日章旗の上から墨で太極と四掛を描き足して太極旗にした唯一かつ最古の事例として知られている。

津寛寺太極旗は２００９年５月２６日、ソウル恩平区（ウンピョング）の北漢山（プッカンサン）津寛寺の

付属建物である七星閣（チルソンカク）を解体する工事中に内部の仏壇と柱の間から見つかった。

当時作業員が内側の壁に風呂敷のように固く封じられた包みを見つけた。封を開けてみると横８９センチ、縦７０センチの大きさの太極旗と計１９点の新聞が入っていた。

津寛寺太極旗は２０１０年登録文化財（現在の国家登録文化遺産）に登録されて２０２１年国家宝物に指定された。津寛寺側は今年の三一節（独立運動記念日）を控えて津寛寺太極旗の実物を特別公開していた。",[],[]
