headline,mainEntityOfPage,image,datePublished,dateModified,author,media_en,media_jp,str_count,body,images,external_links
＜サッカー＞「１４億人の念願Ｗ杯、また水の泡」　中国、出場４８カ国拡大もまた「光脱」（中央日報日本語版）,https://news.yahoo.co.jp/articles/aa08d24815ca1a09c3cdf7872cf79998b2957cb4,https://newsatcl-pctr.c.yimg.jp/t/amd-img/20250606-00000016-cnippou-000-1-view.jpg?exp=10800,2025-06-06T10:40:28+09:00,2025-06-06T10:40:28+09:00,中央日報日本語版,cnippou,中央日報日本語版,2167,"サッカー中国代表が５日、インドネシア代表に敗れ、Ｗ杯本大会進出にまた失敗した。　［ＥＰＡ＝聯合ニュース］
１４億人の中国人の念願であるワールドカップ（Ｗ杯）の夢はまた叶わなかった。Ｗ杯出場国が４８カ国に増えたが、中国サッカーは「光脱（光速脱落）」した。６回連続で本大会進出に失敗した。

中国代表（ＦＩＦＡランキング９４位）は５日（日本時間）、インドネシアのジャカルタで行われた２０２６北中米Ｗ杯アジア３次予選Ｃ組第９戦でインドネシア代表（１２３位）に０－１で敗れた。

ブランコ・イバンコビッチ監督（クロアチア）が率いる中国は新鋭のＦＷ選手を先発投入した。パトリック・クライファート監督（オランダ）が率いるインドネシアは帰化選手を７人起用した。

中国はＰＫ１本で敗れた。前半の終了間際、ペナルティーエリア内で中国選手がインドネシア選手を後ろから蹴った。主審はビデオ判定（ＶＡＲ）の末、ＰＫを宣言した。これをキッカーのオレ・ロメニーがゴール右隈に落ち着いて決めた。

中国はこの日の試合で有効シュートがわずか１本だった。試合終盤の中国選手の絶妙なタックルがなければ、さらに１失点するところだった。結局、中国は１９８７年以来３８年ぶりにインドネシアに敗れることになった。

勝利が必要だった中国は４連敗となり、２勝７敗（勝ち点６）でＣ組最下位。アジア３次予選では各組１・２位が本大会に直行し、３・４位はプレーオフに進む。

中国は３次予選最終第１０戦に勝利しても４位に届かない。同組の日本（勝ち点２０点）、オーストラリア（勝ち点１６）、インドネシア（３勝３敗３分け、勝ち点１２）、そしてサウジアラビアを上回ることができない。中国は３次予選９試合で６得点２０失点と、得失点が－１４だ。国際サッカー連盟（ＦＩＦＡ）が北中米Ｗ杯出場国を従来の３２カ国から４８カ国に増やしたが、中国は２００２年韓日Ｗ杯に出場して以降６回連続で本大会進出に失敗した。

中国は昨年９月、日本に０－７で惨敗した。３月のサウジアラビア戦では選手が「クンフーキック」で退場し、試合に敗れた。

中国はこの日、ブラジル・イタリアの二重国籍から帰化したセルジーニョを投入したが、効果はなかった。中国は２０１９年から巨額を投入して５人の選手を帰化させたが、ブラジルに戻って代表チームの招集に応じない選手もいる。「リオネル・メッシ（アルゼンチン）が帰化しても中国は弱い」という皮肉の声も出ている。

２０２４パリオリンピック（五輪）で金メダル４０個を獲得した中国もサッカーでは結果を出せていない。２０１１年に習近平国家主席が「サッカー崛起」を叫ぶと、中国大手企業が母体のプロサッカーチームは巨額の年俸を提示して外国のスター選手を次々と迎え入れた。しかし新型コロナ流行後に広州恒大などの中国プロサッカーチームが次々と倒産し、元中国代表監督の李鉄らがサッカー界の八百長や賄賂で捕まった。体系的な選手育成のために設立されたサッカー学校は高い学費のため富裕層の子どもが通う「貴族学校」変わった。ビッグリーグに行く実力でないのに自国リーグで高額年俸を受けた選手たちも非難を浴びている。

英ＢＢＣは３月、サッカー強国になるという中国の夢が崩れた理由を分析した。ＢＢＣは「サッカーは中国共産党の手中では発展しないようだ。ＦＩＦＡはサッカーに政治の介入を禁止するが、中国サッカーには政界の人たちが多く、現在の中国サッカー協会の宋凱会長は共産党幹部」と伝えた。あらゆることを上部に報告しなければならない中国で、サッカーに関する決定もサッカーと関係がない人たちが下すが、こうした意思決定方式が競争的なチームスポーツのサッカーをつぶしていると指摘した。

英国に登録されたサッカー選手は１３０万人にのぼる半面、中国は１０万人未満にすぎない。中国サッカーは首都の北京で始まって１９９０年代にプロリーグがスタートし、下部リーグには関心が向けられなかった。中国でプレーする欧州サッカー選手は「中国の選手は技術的には優れているが、重要な瞬間に『サッカーＩＱ』が不足する。幼い頃に本能的に学ぶ創意性と意思決定がここ（中国）では見られない」と指摘した。

２０１２年の執権当時「３つの願いはＷ杯本大会進出、開催、優勝」と明らかにした習近平主席も１０年が経過して中国サッカーをあきらめる雰囲気だ。２０２３年、中国代表がタイ代表に勝利したことを祝うタイ首相に「運が良かっただけだ。彼ら（中国代表チーム）のレベルは確信できない。起伏がある」と答えた。

こうした中、ＦＩＦＡは２０３０年Ｗ杯本大会出場国を従来の４８カ国から６４カ国まで拡大する案を構想中だ。この場合、アジア枠は従来の８．５枚から１０－１２．５枚まで増えると予想される。これをめぐり、ＦＩＦＡがグローバルサッカーマーケティングで影響力が大きい中国をＷ杯に参加させるため敷居をさらに低めようとしているのではという疑惑が強まっている。２０２２年のカタールＷ杯当時、中国企業の後援金は１兆９７８０億ウォン（約２０００億円）にのぼった。出場国を拡大するという話にも中国国内では「北京大や清華大が入学定員を増やしても劣等生には関係ない」という反応が出ている。",[],[]
象５０頭の屠殺に乗り出したジンバブエ…「肉は住民に提供」（中央日報日本語版）,https://news.yahoo.co.jp/articles/c1dc504ede4c367c9a3028c4cd7eaf2a202d278c,https://newsatcl-pctr.c.yimg.jp/t/amd-img/20250606-00000015-cnippou-000-1-view.jpg?exp=10800,2025-06-06T10:23:48+09:00,2025-06-06T10:23:48+09:00,中央日報日本語版,cnippou,中央日報日本語版,456,"象の資料写真。［写真　ｐｉｘａｂａｙ］
南アフリカのジンバブエ当局が急増した象の個体数を調節するために数十頭を屠殺してその肉を住民たちに分配する計画を明らかにした。

４日（現地時間）、ＡＦＰ通信などによると、ジンバブエ公園・野生生物管理局は声明を通じてセーブ・バレー保護区域で象５０頭を対象に殺処分を実施すると明らかにした。

当局は昨年航空調査の結果、同区域の象の個体数が２５５０頭だったとし、これは生態的受容能力である８００頭を大きく超えた水準だと説明した。

当局は象の個体数を減らすために最近５年間で２００頭を南アフリカ以外の地域に移すなど努力を重ねたが、個体数が増加し続けたため、結局一部屠殺を選択することになった。

今回屠殺される象から取り出された肉は住民たちに提供される予定で、象牙は国家所有として別途保管する方針だ。国際法上、象牙は取引が禁止されているため象牙備蓄分の販売はできない。

ジンバブエは隣国であるボツワナに続いて世界で２番目に象が多い国で、これを主な観光資源として活用している。",[],[]
サムスン・ＳＫがターゲット？　米商務長官「手厚すぎる半導体補助金、４％が適当」（中央日報日本語版）,https://news.yahoo.co.jp/articles/094511bce44bda6a38e46911a2db14399dbc5a4a,https://newsatcl-pctr.c.yimg.jp/t/amd-img/20250606-00000014-cnippou-000-1-view.jpg?exp=10800,2025-06-06T10:08:50+09:00,2025-06-06T10:08:50+09:00,中央日報日本語版,cnippou,中央日報日本語版,1182,"米国のハワード・ラトニック商務長官が４日（現地時間）、ワシントンＤＣで開かれた上院歳出委員会公聴会で答弁している。［写真　ＡＦＰ＝聯合ニュース］
米国トランプ政府が「半導体補助金」支給規模を縮小する意志をまたちらつかせた。補助金支援を前提に合計４０８億７０００万ドル（約５兆８７００億円）を投資して米国に半導体工場を建設したサムスン電子とＳＫハイニックスは神経を尖らせている。

４日（現地時間）、ハワード・ラトニック商務長官は上院歳出委員会に出席して半導体補助金について「手厚すぎるようにも思える（ｊｕｓｔ　ｓｅｅｍｅｄ　ｏｖｅｒｌｙ　ｇｅｎｅｒｏｕｓ）」とし「補助金支給対象企業と再協議中」と話した。１月の人事公聴会で「（バイデン政府が約束した）半導体補助金を再検討する」と明らかにしたことに続き、再協議が進行中だと公開した。前任バイデン政府は米国内の先端半導体生産力を高めるために計５２０億ドル規模の補助金を作り、米国投資計画を明らかにしたグローバル半導体企業と支給契約を締結した。

この日、ラトニック氏は補助金の金額を削減しなくても投資規模を増やして補助金比率を低くしたＴＳＭＣ事例に言及して「（投資額比補助金比率は）１０％よりも４％が適切だ」と述べた。

ＴＳＭＣは６５０億ドルだった投資規模をトランプ政府に入って１６５０億ドルに増やして補助金比率を従来の１０．３％から４％に低めた。ラトニック氏は「合意に至らない場合は初めからやってはいけない取引」と付け加えた。

米国政府が補助金支給比率をＴＳＭＣ水準の４％台に調整する場合、国内企業が被害を受けることが予想される。サムスン電子は３７０億ドルを投資して４７億４５００万ドル（１２．８％）を、ＳＫハイニックスは３８億７０００万ドルを投資して４億５８００万ドル（１１．８％）の補助金を受けることで契約した。これは米国インテル（８．７％）よりも高い水準だ。それでもＴＳＭＣのように対米投資を拡大するのは簡単ではない。サムスン電子とＳＫハイニックスは米国の高い人件費にもかかわらず、補助金で費用を一部相殺する戦略だったが支障が生じた。ＴＳＭＣの場合、米国内の生産原価が台湾に比べて約３０％高いと推定されるが、最近魏哲家会長は株主総会で価格上昇も考慮しなければならないとの趣旨の発言をした。

逆に、補助金再協議で国内企業が不利なばかりではないとの分析もある。半導体業界関係者は「半導体補助金政策は米国に半導体生産施設を誘致しようとする米国政府の意志によって導入されたもの」としながら「補助金削減の余波を確認しているだろう」と話した。韓国産業研究院のキム・ヤンパン専門研究員は「米国政府から追加投資の要求や補助金削減圧迫を受けるなら、むしろ米国投資を減らすという切り口で交渉力を発揮する必要がある」と話した。",[],[]
婚外性交渉が発覚したインドネシア男女…住民たちの前で「鞭打ち１００回」（中央日報日本語版）,https://news.yahoo.co.jp/articles/57cfbd1e361506b10c509256b8c671fa0f67d126,https://newsatcl-pctr.c.yimg.jp/t/amd-img/20250606-00000012-cnippou-000-1-view.jpg?exp=10800,2025-06-06T09:42:00+09:00,2025-06-06T09:42:00+09:00,中央日報日本語版,cnippou,中央日報日本語版,869,"インドネシアの国旗
インドネシア唯一のイスラム律法（シャリーア）が守られている地域、アチェ特別自治州で婚外性交渉によって摘発された男女が公開笞刑（ちけい、鞭打ちの刑）を受けた。
【写真】インドネシア・アチェ特別自治州で笞刑を受ける男性
４日（現地時間）、ＡＦＰ通信によると、インドネシア・スマトラ島西部のアチェ州裁判所は婚外性交渉を持った嫌疑で有罪を宣告された男女に笞刑を執行した。笞刑はアチェ州の首都バンダ・アチェにある公園で他の住民たちが見守る中で執行された。

茶色の服で全身を覆い、ずきんで顔まで隠した男女執行官は木鞭で男女被告人の背中を一度に１０回ずつ、合計１００回の鞭打ちを行った。

アチェ州は２０１９年から女性被告人は女性執行官から笞刑を受けるようにしている。笞刑が執行される間、公園には万が一の事態に備えて医者が待機した。

同日、賭博や飲酒疑惑で起訴されて笞刑を言い渡された他の被告人３人も合計４９回の鞭打ちの罰を受けた。

バンダ・アチェの市長は「我々は婚外性交渉、飲酒、オンライン賭博を犯した者に笞刑を執行した」とし「これは地域社会全体に道徳的教訓となり、被告人には改心する機会になるだろう」と話した。

イスラム原理主義志向の強いアチェ州では長年独立運動が起き、２００１年中央政府から特別自治州に認められた。２００３年からインドネシアでは唯一のシャリーアを法として採択しており、２０１５年からはイスラム信者ではない人々にもシャリーアを適用している。

このため婚外性交渉・同性愛・賭博・飲酒はもちろん、女性がボディーラインが露わになる服を着たり、男性が金曜日の祈祷会に参加しない場合にも笞刑を受ける。今年２月にもアチェ州政府は同性で性関係を結んだという理由で男性２人に公開笞刑を執行した。

人権団体は公開笞刑を中断するように求めているが、アチェ州の住民たちは笞刑を積極的に支持している。

インドネシア議会は２０２２年１２月婚外性交渉や婚前同棲などを処罰する刑法改正案を通過させ、来年から全国で施行する予定だ。",[],[]
中国主席「米国、否定的な措置廃止し、台湾問題は慎重に処理すべき」（中央日報日本語版）,https://news.yahoo.co.jp/articles/9708b683d6337f66018589137da2a9d2a78b2fdd,https://newsatcl-pctr.c.yimg.jp/t/amd-img/20250606-00000011-cnippou-000-1-view.jpg?exp=10800,2025-06-06T09:36:57+09:00,2025-06-06T09:36:57+09:00,中央日報日本語版,cnippou,中央日報日本語版,934,"トランプ大統領と習近平主席　［ＡＰ＝聯合ニュース］
中国の習近平国家主席が５日、トランプ大統領と電話会談で否定的な措置の廃止を促した。先月のジュネーブでの合意以降、米国の留学生ビザ取り消しなどに対する是正を強く表示したと解釈される。また習主席は台湾問題を慎重に処理するべきだとし、台湾問題が両国を衝突と対決の危険な状況に向かわせるおそれがあるとも警告した。

国営新華通信はこの日の電話会談が終わった後、「中国は常に言葉通り行動し、行動した通りに結果を出す。米国は中国に施行した否定的な措置を廃止しなければいけない」という習主席の発言を伝えた。

習主席は電話で「中米関係という大きな船の方向を正そうとすれば我々はうまく舵取りをして方向を定めなければならず、特に各種の妨害と破壊を排除することが極めて重要だと指摘した」とし、首脳間の対話を強調した。ジュネーブでの両国の合意に関しては「双方はすでに建設した経済貿易交渉メカニズムを通じて平等な態度を堅持し、互いに懸念を尊重し、ウィンウィンの結果を得るべき」とし「中国は誠意と原則を持っている」と明らかにした。続いて「両国は外交・経済貿易・軍隊・法執行など各領域の交流を増進してコンセンサスを増やし、誤解を減らして協力を強化するべき」とし、今後の各分野別対話メカニズムの開始を予告したりした。

台湾問題に関して習主席は「ごく少数の『台湾独立』分子が中米両国を衝突と対決の危険な状況に向かわせるのを避けなければいけない」と強調した。米国が台湾を中国との交渉カードに使用しないよう警告したと解釈される。

中国はトランプ大統領の発言のうち台湾問題と留学生問題を強調して伝えた。トランプ大統領が「米国は引き続き一つの中国政策を固守する」とし「中国の留学生が米国に来て学習することを歓迎する」と明らかにしたと強調した。

トランプ大統領の中国訪問にも言及された。「習主席はトランプ大統領の中国再訪問を歓迎し、トランプ大統領は心より感謝すると伝えた」と明らかにした。習主席の米国訪問よりトランプ大統領の訪中を前面に出して機先を制圧する意図と考えられる。

この日の中国側の発表文にはレアアース（希土類）輸出統制への言及はなかった。",[],[]
イスラエル、救護品を載せた船舶のガザ地区接近を不許可…気候運動家グレタ・トゥーンベリさん乗船（中央日報日本語版）,https://news.yahoo.co.jp/articles/0caab6d222cd795541fe6780586fc009c44896d3,https://newsatcl-pctr.c.yimg.jp/t/amd-img/20250606-00000009-cnippou-000-1-view.png?fmt=jpeg&q=85&exp=10800,2025-06-06T09:15:14+09:00,2025-06-06T09:15:14+09:00,中央日報日本語版,cnippou,中央日報日本語版,732,"イスラエルの国旗
イスラエルが気候活動家グレタ・トゥーンベリさんを含む１０人余りが乗った船がガザ地区に接近できないように阻止する予定だ。
【写真】グレタ・トゥーンベリさんを乗せたマドリーン号
５日（現地時間）、日刊エルサレムポスト、公営放送Ｋａｎなどの報道によると、イスラエル当局はトゥーンベリさんらを乗せた「フリーダム船団連合（ＦＦＣ、Ｆｒｅｅｄｏｍ　Ｆｌｏｔｉｌｌａ　Ｃｏａｌｉｔｉｏｎ）」の帆船「マドリーン号」のガザ地区接近を許可しないことにした。

マドリーン号は今月１日、イタリア南部カターニアから粉ミルク、おむつ、小麦粉、米、浄水フィルター、衛生用品、医療装備など人道主義的救護品を載せてガザ地区に向かって出発した。

イスラエル当局は当初マドリーン号が安保脅威ではないとみて停泊を許可するかどうかを検討した。だが、ガザ地区に対する陸上・海上封鎖を弱化させる先例を残してはいけないという判断によってこのような判断に至った。

イスラエルは２０２３年１０月７日パレスチナ武装組織ハマスの奇襲攻撃以降、１年８カ月間ガザ地区で戦争を行っていて、ハマスが救護品を横取りするのを防ぐという名分でガザ地区を封鎖してきた。

トゥーンベリさんは出港記者会見で「今回のことがどんなに難しくても、生中継された大量虐殺の前で全世界が沈黙することほど危険なことはない」と話した。

この船にはトゥーンベリさん以外にも米国ドラマシリーズ『ゲーム・オブ・スローンズ』に出演した俳優リアム・カニンガムさん、パレスチナ系フランス人で欧州議会議員のリマ・ハッサンさんも乗船している。ハッサンさんはイスラエルのガザ地区攻撃に積極的に反対しているという理由でイスラエルの入国が禁止された。",[],[]
