headline,mainEntityOfPage,image,datePublished,dateModified,author,media_en,media_jp,str_count,body,images,external_links
李大統領、削減された光復会予算を「原状復旧措置」要請（中央日報日本語版）,https://news.yahoo.co.jp/articles/4af5cdb1f0b70f72d34568733a48c73a309a1b12,https://newsatcl-pctr.c.yimg.jp/t/amd-img/20250606-00000034-cnippou-000-1-view.jpg?exp=10800,2025-06-06T16:02:15+09:00,2025-06-06T16:02:15+09:00,中央日報日本語版,cnippou,中央日報日本語版,774,"韓国の李在明（イ・ジェミョン）大統領が６日、ソウル銅雀区（トンジャクク）国立ソウル顕忠院で開かれた第７０回顕忠日（殉国者・戦没者を追悼する記念日）で追悼の辞を述べている。［写真　中央フォト］
韓国の李在明（イ・ジェミョン）大統領は６日、過去尹錫悦（ユン・ソクヨル）政権で削減された光復会予算に対して早期原状復旧措置を要請した。

大統領室の姜由楨（カン・ユジョン）報道官はこの日、竜山（ヨンサン）大統領室の記者会見で「（顕忠院追悼式典の）退場過程で出席者が李大統領に削減された光復会予算の遺憾を吐露したことを受けて、早期の原状復旧措置を指示した」と話した。

光復会は今年の予算の中で光復学術研究項目６億ウォン（約６３７０万円）などを昨年の政府予算案編成過程で削減された。これに関連して李鍾賛（イ・ジョンチャン）光復会長は光復会が金亨錫（キム・ヒョンソク）独立記念館長の任命を批判するとニューライト関係者が尹錫悦政府当時の金竜顕（キム・ヨンヒョン）警護処長を通じて国家安保室に圧力を加えて予算削減に介入させたと主張していた。

この他に姜氏はこの日の追悼式に先月海軍海上哨戒機事故で殉職した故パク・ジヌ中領、故ユン・ドンギュ上士、故カン・シンウォン上士の遺族と２０２３年１２月西帰浦（ソギポ）ミカン倉庫火災消火活動中に殉職した消防長の遺族が特別に招かれた点に言及して「当初報勲部の推薦名簿にはなかったが李大統領の特別指示でお迎えすることになった」と説明した。

続いて「多忙な中、参加してくださった遺族に李大統領は丁重に哀悼の心を伝えた」とし「特に故パク・ジヌ中領の幼い子どもと配偶者のもとに長く留まって見舞いの気持ちを伝え、一緒に出席したキム・ヘギョン夫人は明るくおもちゃを持って遊ぶパク中領の３歳の息子の明るさに涙を流して残念がった」と伝えた。",[],[]
【コラム】「科学技術大統領・李在明」の条件（中央日報日本語版）,https://news.yahoo.co.jp/articles/44a42ee93800fc1aef95d2add5eac27da5446121,https://newsatcl-pctr.c.yimg.jp/t/amd-img/20250606-00000033-cnippou-000-1-view.jpg?exp=10800,2025-06-06T15:58:50+09:00,2025-06-06T15:58:50+09:00,中央日報日本語版,cnippou,中央日報日本語版,1149,"イラスト＝キム・ジユン
革命の直後、朴正熙（パク・ジョンヒ）将軍は国庫が空っぽになったことを知った。クーデターを後悔したという伝言もある。政策で朴正熙・金大中（キム・デジュン）を問わない「李在明（イ・ジェミョン）式黒猫白猫実用主義」を展開する新大統領にも似た懐疑感が押し寄せるかもしれない。科学技術競争力が深刻な危機を迎えている。

先端戦略産業と関連実用科学技術が前政権の無能と失策で「焦土化」したという評価がある。「超格差」を誇っていたいくつかの先端戦略産業分野が最近「逆超格差」で後れをとり始めた。ディスプレーはまだ中国より先を進むが、半導体は中国ＹＭＴＣのハイブリッドボンディング技術特許を国内企業がライセンシングする状況だ。「超格差」を誇った二次電池もすでに中国に逆超格差をつけられているという声が聞こえる。グローバル市場シェアは２０％を下回った。半固体リチウムイオン二次電池は国内有力セル企業が中国の学者から助言を受けているのが実情だ。先端電動化ヒューマノイド、先端モビリティーも超格差で後れている。

先端戦略産業の科学技術競争力に我々の生存と繁栄、前進と後退がかかっている。朴正熙大統領は産業技術基盤と研究開発（Ｒ＆Ｄ）インフラを国家主導で形成した。金大中大統領はデジタル経済に移行する基盤を用意し、民間中心の技術革新環境を形成した。李在明大統領が科学技術分野で「第２の朴正熙」「第２の金大中」になるにはどうするべきなのか。

一般人はよく知らない構造的問題を解決しなければいけない。非効率と腐敗は脱権威主義時代にも進化しながら生き残った。新政権に次の措置を期待してみる。

まずはカルテルの清算だ。先端戦略産業と実用科学政策の危機は政治家の親戚および元・現官僚が主軸となったカルテルの影響が大きい。これを早期に正そうとするなら、果敢かつきめ細かな人事を強行し、我々の前に近づいた先端戦略産業危機に迅速に備えなければいけない。

２つ目、深刻なポピュリズムの清算だ。不必要な予算浪費は原点から見直す必要がある。規模がある政府レベルの政策的投資は予備妥当性調査を廃止したり簡素化するのではなく、むしろこれを強化しなければいけない。

３つ目、権力内部の深くにある腐敗を清算することだ。左派と右派の過去の政権はその核心部が複雑多端な利権と相場操縦の誘惑を払拭できなかった。一部の権力核心は腐敗を「権限」と錯覚した。

フランスの劇作家ピエール・コルネイユ（１６０６－８４）は「危険を冒さずになした征服は栄光のない勝利」といった。科学技術分野の苦難克服で新大統領が「第２の朴正熙・金大中」という光栄な後世史家の評価を受けることを期待する。

パク・チョルワン／瑞靖大スマート自動車学科教授",[],[]
倒れた穿孔機にマンション住民１５０人余り待避…解体作業着手＝韓国（中央日報日本語版）,https://news.yahoo.co.jp/articles/4873e5db62d3515cd8e5986c73d7381c8a93db54,https://newsatcl-pctr.c.yimg.jp/t/amd-img/20250606-00000031-cnippou-000-1-view.jpg?exp=10800,2025-06-06T15:44:14+09:00,2025-06-06T15:44:14+09:00,中央日報日本語版,cnippou,中央日報日本語版,1116,"６日午前、京畿道竜仁市器興区書川洞（ヨンインシ・キフング・ソチョンドン）の仁徳院（インドグォン）～東灘（ドンタン）複線電鉄第１０工区の路盤新設其他工事現場で穿孔機（地盤に穴を開ける建設機械）がマンション側に倒れかかっている。［写真　ニュース１］
京畿道竜仁（キョンギド・ヨンイン）のあるマンション建物で穿孔機（地盤に穴を開ける建設機械）が倒れて住民１５０人余りが避難した。関係当局はクレーンを動員して倒れた穿孔機を解体する作業に着手した。
【写真】マンション建物側に倒れかかった穿孔機
６日、京畿消防災難本部などによると、５日午後１０時１３分ごろ竜仁市器興区書川洞（ヨンインシ・キフング・ソチョンドン）の仁徳院（インドグォン）～東灘（ドンタン）複線電鉄工事の現場で、重装備である穿孔機が付近にあった１５階建てのマンションに倒れかかった。

このマンションは地上１５階～地下１階規模で計６０世帯が居住している。穿孔機が倒れたことにより最上層である１５階の壁面の一部とベランダの窓などが破損したことが確認された。工事現場の作業が終わった時間だったので大きな人命被害はなかったが、マンションの住民２人が事故の騒音に驚いて病院に運ばれて治療を受けた。

マンションの住民１５６人は全員親戚の家や臨時住居などに避難した状態だ。

倒れた穿孔機は長さ４４メートル、重さ７０．８トンで、５月３１日の作業以降、待機中だったという。現在マンション８階付近から１５階までの建物壁面に寄りかかった様子で倒れている状態だ。

消防や国土交通部、国家鉄道公団、京畿道、竜仁市など関係当局は夜中の事故現場で安全点検および収拾作業に着手した。この日午前から１００・１７０・５００・７００トン級の大型クレーン４台を動員して倒れた穿孔機を解体している。穿孔機を固定して２次事故を防止し、ドローンを動員して現場全体の現況も把握している。穿孔機の解体作業は５～７時間ほどかかるものと予想される。

解体作業が終わればマンションに対する精密診断を行った後、住民の入居について決める計画だ。

この日午前、事故現場を訪れた金東兗（キム・ドンヨン）京畿道知事は「最大限迅速に精密安全点検を行い、住民の皆さんが安全に日常に復帰することができるように最善を尽くす」とし「事故を起こした施工者側にも住民の要求事項と苦情に対して対処方案を作成するように求めた」と話した。

一方、事故が発生したのは仁徳院～東灘複線電鉄第１０工区路盤新設其他工事現場だ。施工者はＤＬ建設であり、発注処は国家鉄道公団だ。工事期間は２０２３年１２月から２０２８年１１月までで、現在工事進捗率は４．９７％だ。",[],[]
マスク氏「弾劾」　トランプ氏「気が狂った」…泥沼化する「世紀のブロマンス」（中央日報日本語版）,https://news.yahoo.co.jp/articles/a89e4c8e871cba644261a1b03088f459e037b1e0,https://newsatcl-pctr.c.yimg.jp/t/amd-img/20250606-00000030-cnippou-000-1-view.jpg?exp=10800,2025-06-06T15:23:16+09:00,2025-06-06T15:23:16+09:00,中央日報日本語版,cnippou,中央日報日本語版,1953,"トランプ米大統領とテスラのイーロン・マスク最高経営責任者（ＣＥＯ）　［ＡＦＰ＝聯合ニュース］
最近まで「ブロマンス」を誇示していたトランプ米大統領とテスラのイーロン・マスク最高経営責任者（ＣＥＯ）が互いに最も強力な政敵になった。マスク氏の「減税政策」で始まった舌戦が過激な誹謗につながっている。

発端はトランプ氏の発言だった。トランプ氏は５日（現地時間）、ドイツのメルツ首相とホワイトハウスの執務室で会った席で、マスク氏について「非常に失望している」と話した。マスク氏がトランプ氏の減税法案について「不快で忌まわしい」と公開的に反対したことに不満を表したのだ。

マスク氏はＸ（旧ツイッター）で直ちに反撃した。マスク氏はトランプ氏の記者会見が行われる中、「電気自動車・太陽光補助金を減らしながら石油ガス補助金はそのままだ。これはあまりにも不公正だ」と繰り返し主張した。続いて「私がいなければトランプ氏は選挙で負けていたはずだ。民主党は下院を掌握し、共和党は上院で５１対４９になったいた」と主張した。トランプ氏に向けては「恩を仇で返す」と怒りを表した。さらに「米国で中道層８０％を代表する新しい政党が必要ではないだろうか」とし、第３政党の結成を示唆する設問を載せた。

トランプ氏も黙っていなかった。トランプ氏もトゥルース・ソーシャルで「私が彼に離れるよう要請し、誰も望まない電気自動車の義務制をなくした」とし「すると彼は完全に気が狂った」と主張した。続いて「我々の予算で数十億ドルを惜しむ最も容易な方法はイーロンの政府補助金と契約を切ること」とし、マスク氏所有の事業体と連邦政府が結んだ契約を破棄すると脅した。

マスク氏は「大統領の政府事業取り消し発表に基づき、スペースＸはドラゴン宇宙船の撤収を直ちに始める」と対抗した。また「トランプ氏は弾劾されるべき」という掲示文にも「そうだ」と返答した。

先月３０日、トランプ氏がホワイトハウスでマスク氏に「金の鍵」を贈りながら「この世で最も偉大な革新家」と絶賛したが、１週間で２人の不和が公開的に深まったのだ。これに先立ちトランプ氏再選のために約２億７０００万ドル（約３９０億円）以上を寄付したマスク氏はトランプ氏の当選後、最側近に浮上した。トランプ氏もマスク氏を政府効率化省（ＤＯＧＥ）のトップに任命して連邦政府の構造調整業務を任せるなどブロマンスを誇示した。

ニューヨークタイムズ（ＮＹＴ）は「当初から最も異例の同盟だった」とし「２人の『政略結婚』は数カ月で破綻に至った」と論評した。

トランプ氏が世界最強国の指導者であり、マスク氏が世界最高の富豪という点で、２人の葛藤が敵対的に向かう場合、互いに莫大な政治的・経済的損失を及ぼす可能性も排除できないという見方も出ている。マスク氏は２０２６年の中間選挙を控え、トランプ氏側に１億ドルの追加後援を約束したが、この資金は伝えられず、現在としては支援されるかどうかも不透明な状態だ。ＮＹＴは「トランプ氏はもう同志から敵に変わったマスク氏の怒りと正面から向き合わなければいけない」とし「マスク氏は共和党内部でトランプ氏の位置づけを弱化させようとする意志を明確に表している」と伝えた。

逆にトランプ氏が公言したように米政府がマスク氏所有の企業との契約を撤回する場合、マスク氏としても財政的な損失が大きい。ＮＹＴによると、昨年マスク氏所有企業は１７の政府省庁と約３０億ドル規模に達する９０件ほどの契約を結んだという。

２人のブロマンスが破局へ向かう様相を見せると、５日のニューヨーク株式市場でテスラの株価は前日比１４．２６％下落した２８４．７ドルで取引を終えた。終値基準で先月９日（２９８．２６ドル）以来１カ月ぶりに３００ドルを割った。時価総額も一日で１５２０億ドル（約２０６兆ウォン）が蒸発した。

暗号資産を代表するビットコインも１０万ドル割れの危機を迎えた。米暗号資産取引所コインベースによると、５日、ビットコインの価格は一時１０万９４９ドルで取引された。暗号資産賛成論者のトランプ氏とマスク氏の正面衝突が市場にマイナスの影響を及ぼすという懸念が作用したという分析が出ている。

ただ、マスク氏はこの日、一歩後退する姿を見せた。米ヘッジファンド界の大物ビル・エックマン氏がＸに「マスク氏とトランプ氏は国家のために和解しなければいけない。２人が一緒にすればはるかに強力だ」と投稿すると、「あなたの言葉は間違っていない」と答えた。またスペースＸのドラゴン宇宙船撤収の意思も覆した。ある利用者がＸに「２人とも落ち着いて数日間は退いて考えるべき」と遺憾を表すと、「良い助言だ。ドラゴンは撤収しない」と返答した。",[],[]
トランプ氏「ハーバード新規留学生遮断」に米裁判所がすぐにブレーキ（中央日報日本語版）,https://news.yahoo.co.jp/articles/b36e53aca7ab3502aa75911278cff4a4216a9333,https://newsatcl-pctr.c.yimg.jp/t/amd-img/20250606-00000029-cnippou-000-1-view.jpg?exp=10800,2025-06-06T15:17:56+09:00,2025-06-06T15:17:56+09:00,中央日報日本語版,cnippou,中央日報日本語版,1444,"先月２８日、米国マサチューセッツ州ケンブリッジで開かれたハーバード大学第３７４回卒業式で、１人の卒業生が記念写真を撮影している。［写真　ロイター＝聯合ニュース］
米国連邦裁判所は５日（現地時間）、ドナルド・トランプ大統領がハーバード大学新規外国人留学生に対するビザ発行を少なくとも６カ月間中断する内容の布告文の効力を一時停止させた。

ＣＮＮによると、マサチューセッツ州連邦地方裁判所のアリソン・バロウズ判事はこの日、ハーバード大学が提起した緊急申請を受け入れてトランプ氏が前日署名した外国人留学生ビザ中断布告文の施行を一時中断する命令を下した。ハーバード大学全体の学生のうち外国人留学生は全体の４分の１に達する。

バロウズ氏は命令文で「（自身が直ちに介入しなければ）すべての当事者の意見を聞く前に学校が即座に取り返しのつかない被害を受けることになる」と明示した。バロウズ氏は「該当命令の効力は裁判所の追加命令があるまで有効だ」と明らかにした。

バロウズ氏は今回の事件の審問期日を今月１６日に決めた。

トランプ氏が今月４日に発表した布告文によると、Ｆ（留学・語学研修）・Ｍ（職業訓練）・Ｊ（教育・芸術・科学分野の交換研究者・学生）ビザなど非移民ビザを通じてハーバード大学の学業過程を履修しようとするすべての外国人のビザ発行が中断される。トランプ氏は「Ｆ・Ｍ・Ｊビザを通じてハーバード大学で学業または交換プログラムの参加を目的に入国しようとするすべての外国人の入国を中断および制限する」とし「この措置は発表日（４日）から６カ月後に自動終了し、延長することができる」と明らかにした。

トランプ氏は合わせてＦ・Ｍ・Ｊビザを通じて在留中のハーバード大学留学生の場合も国務長官がその裁量により既に発行されたビザの取り消しについて検討できるようにした。

ホワイトハウスは「ハーバードが外国人留学生３人に対する情報を提出せず、懲戒記録の要求にも応じず、国家安保に威嚇になる」と主張した。

これに対してハーバード大学はトランプ政府の措置を「表現の自由に対する不法報復」としながら強力に反発した。

ハーバード大学はこの日、布告文に対して「修正憲法第１条の権利（表現の自由）を侵害するもう一つの不法な報復措置」とし「ハーバードは外国人学生をこれからも保護していく」と明らかにした。

ハーバード大学は既に提起した訴訟を修正し、この日マサチューセッツ州連邦裁判所に行政命令を無効にするよう求める修正訴状を提出し、トランプ氏の措置は「裁判所の判決を迂回しようとする不法政治報復」と指摘した。ハーバード大学は「今回の措置は特定大学を狙って表現の自由を侵害し、留学生を政治的道具とすること」としながら強力に反発した。

これに先立ち、トランプ氏はハーバード大学に補助金削減を圧迫して学内の反ユダヤ主義の根絶と多様性・公平性・包容性（ＤＥＩ）プログラムの中断などを要求した。だが、ハーバード大学が学問の自由を理由にこれを拒否し、米国土安全保障省が先月ハーバード大学のＳＥＶＰ認証権限を剥奪するなど圧迫程度を高めた。ところがその翌日に連邦裁判所が下した決定でブレーキがかかり、新規留学生ビザ発行中断という措置も動員した。

先月２９日、「ハーバード大学が留学生とビザ所持者を今後も受け入れられるように現状態を維持しなければならない」とし、ハーバード大学側が出した仮処分申請を受け入れたのもバロウズ氏だった。",[],[]
日本の民間月面着陸船、２回目の挑戦も失敗…「減速できず衝突」（中央日報日本語版）,https://news.yahoo.co.jp/articles/3c5df6e0d47ce1f2267c313cffb7def95a9c4ec0,https://newsatcl-pctr.c.yimg.jp/t/amd-img/20250606-00000027-cnippou-000-1-view.jpg?exp=10800,2025-06-06T14:55:07+09:00,2025-06-06T14:55:07+09:00,中央日報日本語版,cnippou,中央日報日本語版,1206,"１月１５日（現地時間）、米国フロリダのケネディ宇宙センター第３９Ａ発射台で日本宇宙企業「ｉｓｐａｃｅ（アイスペース）」の月面着陸船「レジリエンス」を搭載したスペースＸ（ＳｐａｃｅＸ）のロケット「ファルコン９（Ｆａｌｃｏｎ　９）」が打ち上げられる様子。［写真　ＡＦＰ＝聯合ニュース］
月の砂を採取して販売する「月面商取引」を推進している日本の民間宇宙企業「ｉｓｐａｃｅ（アイスペース）」の月面着陸への挑戦が６日、再び失敗に終わった。
【写真】沈痛な表情を浮かべているｉｓｐａｃｅの袴田武史ＣＥＯ
ＮＨＫや日本経済新聞などによると、ｉｓｐａｃｅは月面着陸船「レジリエンス（Ｒｅｓｉｌｉｅｎｃｅ）」が着陸直前に減速できずに月の表面に衝突したとみられると明らかにした。

レジリエンスは高度１９２メートル上空を最後にランダー（着陸船）との通信が途絶え、高度測定装置のエラーの可能性が提起された。

ｉｓｐａｃｅの袴田武史・最高経営者（ＣＥＯ）はこの日午前の記者会見で「通信の回復が見込まれず、月面着陸の達成は困難だと判断した」として失敗を認めた。続いて「２回目も着陸ができていない事実を非常に残念に思うし、支援してもらった方には申し訳ない気持ちがある」と話した。袴田氏は具体的な失敗の原因については明言を避けた。

レジリエンスはこの日午前３時１５分ごろ、高度約１００キロメートルから徐々に減速しながら月面着陸を試みた。

本来なら午前４時１７分ごろに月の北半球「氷の海」に着陸予定だったが、着陸予定時間の１分３０秒前ごろランダーの高度と速度表示が消えた。これに対しｉｓｐａｃｅは午前４時３０分ごろ「通信を確立できない」と発表した。

当時、東京都千代田区に用意された公開中継現場には約５００人が集まって着陸の過程を見守ったが、通信途絶の事実が知らされた後、多くの人々が失望した表情を隠すことができなかったと朝日新聞は伝えた。

このランダーは１月米国で打ち上げられて先月には月周回軌道に到着した。ランダーの高さは約２．３メートルで、幅は約２．６メートルだ。内部には小型ローバー（探査車）や実験装置などが搭載されていた。

ｉｓｐａｃｅの最初の月面着陸の挑戦は２０２３年４月に行われ、当時も高度センサーの誤作動で燃料不足事態が発生してランダーが月の表面に衝突したことがある。今回はこれを補完するために飛行制御ソフトウェアを改善してより平坦な着陸地点を選んだが、再度失敗を免れなかった。

ｉｓｐａｃｅは月面着陸に成功した場合、月から採取した砂を米国航空宇宙局（ＮＡＳＡ）に販売するという計画も立てていたが、この構想も水泡に帰した。

これに先立ち、日本は昨年１月探査船「スリム（ＳＬＩＭ）」を着陸させて世界で５番目に月面着陸に成功した国になった。

ｉｓｐａｃｅは２０２７年に３回目の月面着陸ミッションに挑戦する予定だ。",[],[]
