headline,mainEntityOfPage,image,datePublished,dateModified,author,media_en,media_jp,str_count,body,images,external_links
トランプ大統領「貿易協議で前向きな結論…習近平主席と会う」（中央日報日本語版）,https://news.yahoo.co.jp/articles/6ba3a26cc580bd5ee0cf9790499e0b56c6498626,https://newsatcl-pctr.c.yimg.jp/t/amd-img/20250606-00000008-cnippou-000-1-view.jpg?exp=10800,2025-06-06T09:04:39+09:00,2025-06-06T09:04:39+09:00,中央日報日本語版,cnippou,中央日報日本語版,1383,"トランプ米大統領（右）と中国の習近平国家主席。［写真　ＡＦＰ＝聯合ニュース］
米国のトランプ大統領と中国の習近平国家主席が５日（現地時間）、９０分間の電話会談を行い、両国間の貿易懸案について集中的に協議した。両首脳間の電話はトランプ大統領就任直前の１月１７日以来１４０日ぶり。２月にいわゆる「トランプ発関税戦争」が始まって以降初めてだ。中国国営新華社通信は今回の電話会談がトランプ大統領の要請で行われたことを意味する「応約」という言葉で表現した。

トランプ大統領は５日午前１１時５０分ごろ、ソーシャルメディアを通じて「先ほど中国の習近平国家主席と非常によい電話協議をした」とし「最近合意した（両国）貿易交渉の複雑な問題について議論した」と明らかにした。続いて「電話協議は１時間半ほど続き、両国に前向きな結論を導き出した。レアアース（希土類）製品の複雑性についてはこれ以上問題の余地はない」とし「両国の各交渉チームは近いうちに決まる場所で会う予定」と伝えた。両国の交渉が再開すれば、米国側からベッセント財務長官、ラトニック商務長官、グリア米通商代表部（ＵＳＴＲ）代表が出席する予定という。

トランプ大統領は習主席から中国訪問の招請を受けたことも公開した。トランプ大統領は「通話中、習主席が私と妻の中国訪問を招請し、私もこれに応えた」とし「偉大な両国の首脳として我々はともにこの訪問を期待している」と明らかにした。続いて「今回の対話はほぼ全面的に貿易に集中し、ロシア－ウクライナ（戦争）、イランに関する議論は全くなかった」と伝えた。

新華社通信は両首脳の電話会談を報道し、「習主席は、中米関係という大きな船の方向を正そうとするなら両首脳がうまく操舵して方向を決めなければならず、特に各種の妨害と破壊を排除することが極めて重要だと指摘した」と伝えた。続いて「米国は実事求是の態度で進展を眺め、中国に施行した否定的な措置を廃止するべき」とし「両国は外交、経済貿易、軍隊、法執行など各領域の交流を増進して合意を広め、誤解を減らして協力を強化しなければいけない」とした。

新華社通信によると、習主席は特に「台湾問題に対する慎重な処理」に言及しながら「ごく少数の台湾独立分子が中米両国を衝突と対決の危険な状況に向かわせるのを避けるべき」と強調した。これに先立ちトランプ大統領は先月３０日、中国が米中貿易合意を違反したとし、習主席との電話でこの問題を議論すると話していた。両国は先月１０、１１日にスイス・ジュネーブで高官級協議を行い、両国に対する関税を１１５％ポイントずつ引き下げ、一部の輸出統制措置を猶予または取り消すことで合意した。しかしその後、米国は中国が当時の合意とは違い核心の鉱物とレアアースの輸出制限を解除していないと批判してきた。中国のレアアース輸出規制でグローバル自動車業界が生産中断危機を迎えた中、この日の米中首脳の電話会談で突破口が開かれるかが注目される。

一方、トランプ政権が観光ビザなど非移民ビザの発給を受けるための面接順序を操り上げる一種の「急行料」の新設を検討していると、ロイター通信が４日報じた。ロイターが入手した米国務省の文書によると、ビザ面接急行料は早ければ１２月から試験的事業形態で導入される。急行料は１０００ドル（約１４万円）という。",[],[]
裁判官暗殺など１００件余りの殺人…伊マフィアのボス、自由の身に（中央日報日本語版）,https://news.yahoo.co.jp/articles/16c75e8cf277a21cf4fa1be6c6199a16dd42c8d3,https://newsatcl-pctr.c.yimg.jp/t/amd-img/20250606-00000006-cnippou-000-1-view.png?fmt=jpeg&q=85&exp=10800,2025-06-06T08:48:22+09:00,2025-06-06T08:48:22+09:00,中央日報日本語版,cnippou,中央日報日本語版,690,"イタリアの国旗
１００件余りの殺人事件を起こしたシチリアマフィアのボスが自由の身になった。

イタリア日刊紙ラ・レプッブリカは５日（現地時間）、シチリアマフィアのボス、ジョバンニ・ブルスカ（６８）が２０２１年仮釈放で出所した後、４年間の保護観察を終えてすべての法的制限を解かれたと報じた。
【写真】逮捕当時のジョバンニ・ブルスカの様子
ブルスカは現在シチリアから遠く離れた非公開地域に居住して身分を隠して仮名を使用しているという。保護観察が終了して夜間外出制限（午後８時～午前８時）と週３回の警察署出席義務もすべて解除された。

ブルスカは１９９２年５月２３日シチリア島パレルモ空港近郊のカパーチ高速道路でジョバンニ・ファルコーネ裁判官と夫人、そして彼らを警護していた警察官３人を暗殺した。

ブルスカは道路の下の排水管に設置した爆弾を遠隔操作で爆発させて「カパーチの屠殺者」という悪名を得た。

この事件で死亡したファルコーネ氏はイタリア屈指の反マフィア裁判官だった。

ファルコーネ氏は１９８６年２月１０日から１９９２年１月３０日までシチリアマフィア４６５人を対象に約６年間開かれた世界史上最大のマフィア裁判である「マキシ裁判」を主導した人物だ。

ブルスカはまた、組織を裏切って警察に協力した組織員の１１歳の息子を拉致して殺害した後、死体を酸性溶液に投げて証拠を消すという残酷な犯行もしている。

１９９６年に逮捕されたブルスカは終身刑を宣告されたが、２０００年から検察に協力して数多くのマフィア組織員と主要犯罪情報を自白して２５年刑に減刑され、２０２１年仮釈放で出所した。",[],[]
＜サッカー＞孫興慜が抜けた韓国、イラクに２－０勝利…１１回連続Ｗ杯本大会進出（中央日報日本語版）,https://news.yahoo.co.jp/articles/ef2d15f007c21c03261956c276fe66ed578bf78a,https://newsatcl-pctr.c.yimg.jp/t/amd-img/20250606-00000004-cnippou-000-1-view.jpg?exp=10800,2025-06-06T08:34:15+09:00,2025-06-06T08:34:15+09:00,中央日報日本語版,cnippou,中央日報日本語版,2147,"イラク戦で先制ゴールを決めた金鎮圭（キム・ジンギュ、左）とアシストした李康仁（イ・ガンイン、右）　［ＡＰ＝聯合ニュース］
韓国サッカーが李康仁（イ・ガンイン、２４、パリ・サンジェルマン）を軸にして「１１回連続ワールドカップ本大会進出」を決めた。

洪明甫（ホン・ミョンボ）監督（５６）が率いる韓国代表（ＦＩＦＡランキング２３位）は６日（日本時間）、イラクのバスラ国際競技場で行われた２０２６北中米ワールドカップ（Ｗ杯）アジア３次予選Ｂ組第９戦でイラク代表（５９位）に２－０で勝利した。

前半、イラク選手の退場による数的優位の中、李在成（イ・ジェソン、マインツ）と李康仁のシュートがゴールに弾かれた。しかし後半１８分、李康仁のアシストを受けた金鎮圭（キム・ジンギュ、全北）が決勝ゴールを決めた。さらに後半３７分、全晋旴（チョン・ジンウ、全北）のアシストで呉賢揆（オ・ヒョンギュ、ヘンク）が得点した。孫興慜（ソン・フンミン、トッテナム）がけがで抜けた中、李康仁がチームを引っ張った。

Ｂ組１位を守った韓国（５勝４分け、勝ち点１９、得失点＋９）は３位のイラク（３勝３敗３分け、勝ち点１２）と勝ち点差を７に広げた。韓国は１０日、ソウルＷ杯競技場で行われるクウェートとの最終第１０戦の勝敗とは関係なく組２位以上が確定し、Ｗ杯本大会直行チケットを獲得した。アジア３次予選では各組１・２位が本大会に直行し、３・４位はプレーオフに進む。同じ日、オマーンに３－０で完勝した２位のヨルダン（４勝１敗４分け、勝ち点１６、得失点＋９）が韓国と共に本大会行きを決めた。

韓国サッカーは１９８６年メキシコ大会から１１回連続の本大会出場であり、初めて出場した１９５４年スイス大会を含めると通算１２回目のＷ杯本大会となる。韓国はイラクとの対戦成績を１１勝２敗１２分けとした。

３５年ぶりに行われたイラクとのアウェー試合は現地時間午後９時１５分に始まったが、気温は３１度だった。これに先立ち「孫興慜に無理をさせない」と話していた洪監督はこの日、孫興慜をメンバーから外した。先月の欧州サッカー連盟（ＵＥＦＡ）ヨーロッパリーグ決勝戦で交代出場した孫興慜はまだ足のけがが完治していない。

李康仁と黄喜燦（ファン・ヒチャン、ウルバーハンプトン）が先発出場し、主将の腕章は李在成（イ・ジェソン）が付けた。韓国は試合の序盤、イラクの強いプレスに苦戦した。李康仁にボールが渡ると相手選手２、３人がマークし、ＦＷ呉世勲（オ・セフン）へのロングボール戦略に依存した。

ところが前半２４分、試合の流れが完全に変わるきっかけが生じた。イングランドのイプスウィッチタウン所属アリ・アルハマディがボールに向けて足を高く上げたところ、曺侑珉（チョ・ユミン、シャールジャ）の顔に当たった。ボールを頭で処理しようとした曺侑珉（チョ・ユミン）の額から出血した。最初はイエローカードを出した主審がビデオ判定（ＶＡＲ）の結果、レッドカードを取り出した。

数的劣勢となったイラクは５－４－０に近いフォーメーションで「２列守備」を始めた。序盤にイラクの強いプレスに苦戦した韓国は試合の主導権を握って激しく攻撃した。

前半３０分、ＣＫから約束されたセットピースを見せた。黄仁範（ファン・インボム、フェイエノールト）が李在成とパスプレーをした後、ゴール反対側に絶妙のクロスを入れた。ここに走り込んできた黄喜燦のシュートは惜しくもゴール右に外れた。

前半３５分、黄喜燦が反則で得たＦＫを李康仁がＧＫと守備の間に鋭く入れ、李在成が頭で合わせたが、クロスバーを強打した。前半ロスタイムには李康仁がペナルティーエリア外やや右側から放った対角線ミドルシュートはゴール左隅のバーに当たった。

洪監督は後半開始と同時に前半にイエローカードを受けていた朴鎔宇（パク・ヨンウ、アル・アイン）の代わりに攻撃的ＭＦ金鎮圭（キム・ジンギュ、全北）を投入した。後半１５分には呉世勲と黄喜燦に代えて運動量が多い呉賢揆（オ・ヒョンギュ、ヘンク）とスピードがある文宣民（ムン・ソンミン、ソウル）を投入した。

後半１８分、文宣民が左サイドからクロスを上げた。ペナルティーエリア内右側でこれを受けた薛永佑（ソル・ヨンウ、ズベズダ）が後ろにパスを出し、これを李康仁が中央の金鎮圭にパスをつなぐと、金鎮圭はワントラップからゴール右隅にシュートを決めた。

韓国の守備が崩れて失点の危機もあったが、幸い、イラク選手のシュートは枠外に飛んだ。後半２９分、Ｋリーグ１で得点トップ（１１得点）の全晋旴が交代で入った。

後半３７分、ＭＦ黄仁範が絶妙のターンでイラク選手２人をかわし、スルーパスを入れると、全晋旴は右側からワンタッチでクロスを入れ、走り込んでいた呉賢揆が右足でゴールを決めた。過去に水原サムスンでチームメートだった全晋旴と呉賢揆が得点を合作した。洪監督が交代で投入した金鎮圭と呉賢揆が得点した。

イラク戦を終えた韓国代表は直ちにバスラ空港に移動し、チャーター機に乗って７日午後に仁川（インチョン）空港に到着する。韓国代表は１０日、ソウルＷ杯競技場でクウェート代表と最終第１０戦を行う。",[],[]
日韓議員連盟の菅義偉会長「李在明大統領に祝賀メッセージ…日韓協力重要」（中央日報日本語版）,https://news.yahoo.co.jp/articles/17ae489dd9a19dfecd50949fa6f48116a8c3f5c6,https://newsatcl-pctr.c.yimg.jp/t/amd-img/20250606-00000005-cnippou-000-1-view.jpg?exp=10800,2025-06-06T08:24:22+09:00,2025-06-06T08:24:22+09:00,中央日報日本語版,cnippou,中央日報日本語版,456,"日韓議員連盟会長の菅義偉氏。［写真　聯合ニュース］
日韓議員連盟の菅義偉会長が「李在明（イ・ジェミョン）大統領に就任を祝うメッセージを送った」と話した。

５日、ＮＨＫによると、菅氏はこの日、国会で開かれた議員連盟会議で「日本と韓国は互いに国際社会の様々な課題にパートナーとして協力すべき重要な隣国」と伝えた。

韓日および韓米日重要性を強調した菅氏は「隣国であるがゆえに、難しい問題も存在する」としつつ「国交正常化６０周年を迎えようとする本年、日韓関係が安定して前に進むよう、様々なレベルで意思疎通を図っていくことが大事だ」と述べた。

この日の会議では、韓国側の議員連盟幹部と意思疎通が行われ、菅氏ができるだけ早期に韓国を訪問して李大統領の会談を開催する方向で推進することにした。これに関連し、早ければ日本側の議員連盟が８月に韓国を訪問する日程を検討していると、連盟幹事長である長島昭久首相補佐官が会議後、取材陣に明らかにした。

菅氏は昨年１２月中旬、韓国を訪問しようとしたが非常戒厳余波で取り消していた。",[],[]
トランプ氏、連日「苦言」のマスク氏に「非常に失望…関係維持は未知数」（中央日報日本語版）,https://news.yahoo.co.jp/articles/687cdab0a46f98e65ae582dc96ec848495520366,https://newsatcl-pctr.c.yimg.jp/t/amd-img/20250606-00000003-cnippou-000-1-view.jpg?exp=10800,2025-06-06T08:01:21+09:00,2025-06-06T08:01:21+09:00,中央日報日本語版,cnippou,中央日報日本語版,759,"米国のドナルド・トランプ大統領（左）、テスラ（Ｔｅｓｌａ）のイーロン・マスクＣＥＯ。［写真　ＡＰ＝聯合ニュース］
米国のドナルド・トランプ大統領は５日（現地時間）、テスラ（Ｔｅｓｌａ）のイーロン・マスク最高経営責任者（ＣＥＯ）が減税など自身の国政アジェンダを反映した法案に公開的に反対したことについて「非常に失望した」と明らかにした。

トランプ氏はこの日、ワシントンＤＣホワイトハウス執務室でドイツのフリードリヒ・メルツ首相と会った席で、記者の質問にこのように答えた後、「イーロンと私は良好な関係だったが、我々がこれ以上どうなるかは分からない」として「私は驚いた」と話した。

マスク氏は最近さまざまな減税政策をまとめたトランプ氏のいわゆる「大きく美しい単一法案」（Ｏｎｅ　Ｂｉｇ　Ｂｅａｕｔｉｆｕｌ　Ｂｉｌｌ　Ａｃｔ）に対して「不快で醜悪なもの」とし、法案否決を促した。マスク氏は法案を支持する共和党議員を必ず落選させるべきだとまで主張して、議員に法案処理に反対するように圧迫を加えている。

トランプ氏が「大きく美しい単一法案」と名付けたこの法案は、５月２２日に米下院を通過して現在上院で審議されている。この法案は個人所得税率の引き下げ、法人税の最高税率引き下げなど２０１７年減税法により施行されてきたが、今年末で終了予定の主要条項を延長する内容とあわせてチップと超過勤務手当に対する非課税などトランプ氏の選挙公約を反映している。

昨年の大統領選挙でトランプ氏のために少なくとも１億３２００万ドル（約１８９億円）を使って当選の一等功労者になったマスク氏は、その後政府効率化省（ＤＯＧＥ）　のトップに任命されてトランプ氏の最側近に君臨したが、最近ＤＯＧＥから退いた後、ホワイトハウスに対する苦言を隠さないでいる。",[],[]
米国、韓国含む９カ国「為替監視対象国」指定…韓国、１年ぶりに再指定へ（中央日報日本語版）,https://news.yahoo.co.jp/articles/3bd055ee77f3542449ddda31bb030e68ac968129,https://newsatcl-pctr.c.yimg.jp/t/amd-img/20250606-00000002-cnippou-000-1-view.jpg?exp=10800,2025-06-06T07:39:06+09:00,2025-06-06T07:39:06+09:00,中央日報日本語版,cnippou,中央日報日本語版,1290,"米国のスコット・ベッセント財務長官が３日（現地時間）、ワシントンＤＣのホワイトハウスを歩いている。［写真　ＡＰ＝聯合ニュース］
米国財務省が韓国を「為替監視対象国」に再指定した事実が５日（現地時間）、公開された。強度の高い関税政策を展開しているドナルド・トランプ政府が貿易交渉で為替問題を重点的に扱うとした状況なので米国の潜在的圧迫水位が高まる可能性があるとの分析が出ている。

米国財務相はこの日、議会に報告した「主要交易対象国のマクロ経済および為替政策」半期報告書で、韓国を含む中国、日本、シンガポール、台湾、ベトナム、ドイツ、アイルランド、スイスなど９カ国を為替監視対象国に指定した。

韓国は２０１６年４月以降７年半ぶりの２０２３年１１月に監視対象国から外れたが、トランプ政府スタート前の昨年１１月に再び監視対象国に含まれたことが分かった。９カ国のうちアイルランドとスイスは今回新たに追加された国で、残りの７カ国は昨年１１月に指定されたケースだ。

米国は２０１５年に制定した貿易促進法に基づいて自国との交易規模が大きな上位２０カ国のマクロ経済と為替政策を評価して一定の基準に該当する場合、為替操作国ないし監視対象国に指定している。

米財務省は▶年間１５０億ドル（約２兆１５００億円）以上の対米貿易黒字▶国内総生産（ＧＤＰ）の３％以上に該当する経常収支黒字▶１２カ月中８カ月間以上ドルを純購入し、その規模がＧＤＰの２％超過する場合－－など３つの基準のうち２つを満たすと監視対象国に指定している。制裁や不利益にすぐにつながるわけではなく、米財務省が該当国家の為替政策を引き続き詳しく観察するという「警告性措置」に近い。

韓国は貿易黒字と経常収支黒字の２つの基準に該当して対象国に入った。３つの基準をすべて充足すると「為替操作国（深層分析対象国）」に分類されて、米財務省は自国企業の該当国への投資制限など直接的な制裁を加えることができる。

４月に開かれた「韓米２＋２（財務・商務長官）通商協議」当時、米国側の要求で為替問題が交渉主要案件の一つに含まれていた。このため米国が対米貿易黒字規模が大きな韓国に対して通貨価値切上げ圧迫を本格化するのではないかという懸念が出てきた。

財務省は今回の報告書で「深刻な為替不均衡を招く部分を注意深くモニタリングしていく」としながら「『米国優先貿易政策』を支援するために、今後の報告書では貿易国の為替政策と慣行に対する分析を強化する」と明らかにした。財務省はその例として貿易国の中央銀行が自国通貨が平価切上げ圧力を受ける状況で表面的に無秩序な市場条件や過度な変動性を緩和するために介入する状況をより一層集中的に観察していくとしている。特に不公正な為替慣行が確認された国家に関税賦課を勧告する場合があると警告した。

スコット・ベッセント財務長官は「我々は引き続き為替慣行分析を強化し、操作国指定により支払うべき費用を増やす」とし「財務省は不公正な為替慣行に対して強力な対応策を施行するために使用可能なすべての道具を使っていく」とした。",[],[]
