headline,mainEntityOfPage,image,datePublished,dateModified,author,media_en,media_jp,str_count,body,images,external_links
「トヨタの手柄は、俺のものだ」 勝者に“ただ乗り”するネット民の正体――「借り物の自尊心」と0.23%が生む称賛・攻撃の構造とは（Merkmal）,https://news.yahoo.co.jp/articles/7a07b774f9ec67b4851efbc8fa6384405194c9f1,https://newsatcl-pctr.c.yimg.jp/t/amd-img/20260405-10113044-merkmal-000-3-view.jpg?exp=10800,2026-04-05T20:51:00+09:00,2026-04-06T01:29:14+09:00,Merkmal,merkmal,Merkmal,863,]大きな主語に依存する個人 トヨタのロゴマーク（画像：AFP＝時事） ネットのニュースやSNSを覗けば、そこには奇妙な熱狂と冷徹な憎悪が同居している。 【画像】ヤンキーが「高級車」に乗れる理由 売上高50兆円という途方もない数字を出し、3兆5700億円もの純利益を上げるトヨタを称える声。その裏で、2年続けて6500億円の赤字となった日産や、電気自動車（EV）戦略の綻びから6900億円の赤字に転んだホンダへ投げつけられる、人格否定に近い言葉の刃。企業の成否が、なぜここまで個人の心を激しくかき乱すのか。ただの好き嫌いではない、もっと根深い「自尊心のゆがみ」がそこには見え隠れする。 こうした振る舞いを読み解く手がかりになるのが、ポーランド出身の社会心理学者・ヘンリー・タジフェル氏（1919～1982年）らが説いた「社会的アイデンティティ理論」だ。人は自分という存在の価値を、属している集団の価値と重ね合わせてしまう。 「日本人である」 「トヨタを支持している」 といった集団の属性を、自分の一部として取り込んでしまうのだ。 この心の動きは、段階を追って進んでいく。まず人は、複雑な世のなかを整理するために、周囲を「味方のグループ」と「敵、あるいは無関係なグループ」に分ける。次に、自分が選んだ集団に心を深く沈め込み、その勝ち負けを自分の誇りや恥に直結させる。そして仕上げに、他のグループと比較して自分たちの正しさを確かめようとする。自らのグループを持ち上げるだけでなく、他方を貶めることで、相対的な位置を引き上げようとする。ネットで見かける執拗なバッシングの正体は、いわばこの「安価なプライド」の守り方に他ならない。 かつて個人を支えた会社や地域、家族といった居場所が揺らぎ、多くの人が底知れない無力感に立ち尽くしている。その空虚さを埋めるために、世界に通用する巨大な存在と自分を重ね合わせているのではないか。自らの足で立つ代わりに、強い集団が手にした成功を自分の手柄のように振る舞い、手っ取り早く自尊心を補っているのだ。,[],[]
「こんなに速くする必要ある？」 時速511kmに到達した船、丸木舟から積み重ねた進化はどこへ向かうのか？（Merkmal）,https://news.yahoo.co.jp/articles/41ef22a99497cc6c19d52fb907e7494f3177f9fe,https://newsatcl-pctr.c.yimg.jp/t/amd-img/20260405-10108619-merkmal-000-2-view.jpg?exp=10800,2026-04-05T17:51:00+09:00,2026-04-05T21:29:14+09:00,Merkmal,merkmal,Merkmal,1068,水面へ踏み出した人類と、速度という問いの始まり 船（画像：Pexels） 古くから、動植物は流木などの浮遊物に乗り、水上を移動しながら広がってきたとされる。人類もまた、その流れの延長線上で水と向き合ってきた。筏や丸木舟を作り、道具として使いこなすことで、水面は生活圏の外縁から活動の場へと変わっていった。推進や舵取りに使われた木の棒は、やがてオールへと姿を変える。そこには一足飛びの進歩はなく、試行錯誤が積み重なった時間がある。その過程で、船はどれほど速くなったのか。素朴な疑問だが、船の歴史をたどる入口としては悪くない。 【画像】「なんとぉぉぉぉ！」 これが大手海運の「平均年収」です！ グラフで見る（10枚） 筏や丸木舟は先史時代から存在すると考えられており、約8000年前の丸木舟がアフリカで発見されている。日本列島でも、縄文時代には丸木舟を使った交易が広範囲に行われていた可能性が高い。鉄器がない時代、木を切り出し、形を整える作業は石器に頼らざるを得ず、相当な労力を要した。水上に出る以前に、舟をつくる段階で人はすでに大きな負荷を背負っていた。 こうした筏や丸木舟の速さは、水の流れや風向きに大きく左右されるが、おおむね2.7～5.4kt、時速にして5～10kmほどとされる。人が歩く、あるいは小走りする速度と大差はない。水面を進むこと自体が画期的だった時代において、速さはまだ副次的な要素にとどまっていた。船の性能を語るうえで、速度が前面に出てくるのは、もう少し後の話になる。 人力に支えられた古代船──機動力と限界 エーゲ海（画像：Pexels） エーゲ海沿岸に都市国家が点在していた古代ギリシャでは、輸送や戦闘の主力としてガレー船、いわゆる三段櫂船が使われていた。動力の中心は巨大なオールで、それを動かすために大量の人員が必要とされた。漕ぎ手には自由民だけでなく奴隷も含まれ、船は人の力そのものに依存していた。人員が増えるほど船内の余裕は失われ、積める物資は限られる。そのため、補給のためにこまめな寄港が欠かせず、外洋を長く進む用途には向かなかった。 船体は細長く、喫水も浅い。風や波が比較的穏やかな地中海では、この形状が機動力を生んだ。一方で、海況が悪化すると途端に走りは鈍る。速度は4～7kt、時速にすれば7～13kmほどに達したとされるが、人力に頼る以上、その速さを保ち続けるのは難しかった。疲労が積み重なれば、性能は目に見えて落ちる。こうした制約を補うかのように、後には原始的な帆を備えたガレー船も姿を現していく。,[],[]
「お前の代わりはいくらでもいる」の終焉――バス運転手を年収450万円で担い続けるのか？ パイロット級の重責に見合わない対価という現実（Merkmal）,https://news.yahoo.co.jp/articles/da5fd29f99cefce9e467154260a9561394544a6d,https://newsatcl-pctr.c.yimg.jp/t/amd-img/20260405-10112728-merkmal-000-9-view.jpg?exp=10800,2026-04-05T10:21:00+09:00,2026-04-05T22:49:13+09:00,Merkmal,merkmal,Merkmal,1437,労働と運行維持の限界 路線バスのイメージ（画像：写真AC） 先日、筆者（業平橋渉、フリーライター）は日本の路線バスが制度、市場、労働の三つの面から同時に強い負担を受けている実態を記事「「お前の代わりはいくらでもいる」――年収450万円でバスドライバーを担う限界！ 関東バス“スト回避”が映す専門職軽視の社会構造」（2026年3月27日付け）で指摘した。 【画像】ヤンキーが「高級車」に乗れる理由 全事業者の99.6%が赤字という事実は、これまでの運行のやり方がすでに通用しなくなっていることを示している。ドライバーの平均年齢は53歳から55歳に達し、年収450万円から470万円という水準は、次の世代の働き手を確保する条件としては不十分である。 これは、これまで積み上げてきた人材に過度に依存し、その負担の上に運行を維持してきた組織の限界を表している。読者からは、身内の葬儀のために休みを求めた際に 「代わりはいくらでもいる」 として拒まれたという怒りの声も寄せられた。こうした人の働きを消耗品のように扱う姿勢が、日本バス協会が見込む2030年の3万6000人という深刻な人手不足につながっている。 また、1985（昭和60）年以降、利用者数は全国で減少を続けている。福島県では1996（平成8）年の4614万人から2020年には1343万人まで落ち込み、収入の土台そのものが弱くなっている。新型コロナの影響で定期券収入が減り、前払いで確保していた資金が失われたことも重なり、経営環境はさらに厳しさを増した。 今回の状況は、働く側の負担に頼って維持してきた仕組みが限界を迎えていることを示しており、どの負担を誰が引き受けるのかという課題を社会に突きつけている。 賃金と労働実態のずれ 路線バスのイメージ（画像：写真AC） 前稿に寄せられた声は、この問題の本質をよりはっきりと示している。最も強く語られているのは、 「賃金と働き方の釣り合いの崩れ」 である。前稿で示した水準についても、高い方と受け止められており、地方では300万円台にとどまる例もある。 一方で、コンビニ向けの配送を担うトラックドライバーからは「年収470万円ならまだよい」という声があるのに対し、バスドライバーからは 「この収入では子育ては難しい」 という声が上がった。この受け止めの差は、働きの値付けが大きくずれていることを示している。 読者のなかには、公営バスの給与はかつて年収700万円を超えていたが、 「公務員への批判」 を背景に450万円前後まで下がり、その結果として担い手不足が進んだと見る意見もある。さらに深刻なのは、ドライバーの働きに対する見方が軽いまま放置されてきた点である。「代わりはいくらでもいる」という言葉に象徴されるように、安全運行を支える技術が正しく評価されてこなかった。 かつては、家族の葬儀を理由に休みを求めた社員に対しても同じような姿勢が取られていたが、今では状況が変わり、経営側が「出てほしい」と頭を下げる場面も増えているという。利用者が安い運賃を当然とし、事業者も値上げを避けてきたことで、必要な費用と収入が合わない状態が固定化した。 前述のとおり、福島県では利用者が四半世紀で大きく減り、約3割の水準に落ち込んでいるが、その間も安全運行に必要な費用を十分に確保できず、やりくりで対応してきた。こうした状況は、専門的な働きへの評価が低いまま続いてきた実態を示している。,[],[]
「技術の魂を取り戻せ」 ホンダ、最大2.5兆円損失からの復活劇？ 過剰なEV戦略を乗り越え「三現主義」の再生なるか（Merkmal）,https://news.yahoo.co.jp/articles/d99bdc76b3eea953955799de26461c5af5ba99e5,https://newsatcl-pctr.c.yimg.jp/t/amd-img/20260405-10112990-merkmal-000-7-view.jpg?exp=10800,2026-04-05T07:21:00+09:00,2026-04-05T18:49:17+09:00,Merkmal,merkmal,Merkmal,1580,EV方針の遅れと巨額損失の発生 ホンダのロゴマーク（画像：AFP＝時事） 本田技研工業が、1957（昭和32）年の上場以来で最大となる、6900億円もの連結最終赤字に直面しようとしている。前期には8358億円の黒字を叩き出していたことを考えれば、まさに暗転だ。従来の見通しから1兆円近くも下振れするこの急激な悪化は、世界的に吹き荒れる電気自動車（EV）への逆風と、それに対する経営の立ち遅れを浮き彫りにしている。 【画像】「えぇぇぇ！」 これが本田技研工業の「平均年収」です！（9枚） 北米市場での立て直しを狙っていた主力モデル「ゼロシリーズ」の多目的スポーツ車とセダン、さらに「アキュラRSX」の開発は、あえなく中止となった。これにともなう設備や資産の評価損、取引先への補償といった損失は、2027年3月期までの累計で最大2兆5000億円にまで膨らむ見込みだ。そのうち、実際に手元から消えていく現金は1兆7000億円にものぼるという。 これほどの巨額赤字を招いた背景には、2040年までに全ての販売車をEVと燃料電池車にするという、あの野心的な目標がある。環境への配慮を掲げた高いハードルが、いつしか社内のリソース配分を歪め、肝心の技術を形にする現場の動きを鈍らせてしまった。投資家を意識した「見栄えの良い目標」が、ものづくりの現場での真っ当な判断を、かえって妨げていたのではないか。 もっとも、足元の財務基盤がすぐに揺らぐわけではない。2025年12月末時点での自己資本比率は38%、手元資金も4兆円を上回る水準を保っている。来期も営業キャッシュフローは維持できる見通しで、年70円の配当予想も変えていない。今回の2兆5000億円という損失処理は、これまでの無理な経営が積み上げた澱（おり）を洗い流し、事業の主導権を再び現場の手に取り戻すための苦肉の策とも受け取れる。 北米依存の販売構造 2026年3月26日発表。主要12か国と北欧3か国の合計販売台数と電動車（xEV）販売台数及びシェアの推移（画像：マークラインズ） この苦境の理由を、EV市場の伸び悩みといった外部環境の変化に求める声は多い。だが、実情はもっと内側にあったのではないか。北米市場への過度な依存、そして現場の知見を軽んじた組織運営のゆがみが、影を落としている。 ホンダの四輪世界販売台数は、2019年の518万台から2025年には352万台へと32%も減り、特定の地域に収益を頼る危うさを露呈した。足元の国内市場も厳しい。販売の4割から5割が、利幅の薄い軽自動車や小型車に偏っているのだ。2025年度の新車販売ではスズキに追い抜かれ、記録が残る1993（平成5）年度以降で初めて3位へ転落した。商品力が目に見えて衰え、稼げるモデルを世に送り出し続けられない組織の弱さが、数字に表れている。 組織のあり方も裏目に出た。2020年に本田技術研究所の開発機能を本社へと統合した判断は、結果として 「ホンダらしさ」 を削ぎ落とすことになった。効率を追い求めたこの仕組みは、かつて同社を支えた多様な視点を奪い、現場の技術的な事実よりも、組織の都合がまかり通る空気を生んでしまった。 その綻びは、アジア市場にも色濃い。インドでのシェアはわずか1.5%、年間販売台数は6.6万台にとどまる。一方でスズキは約40%のシェア、年間170万台規模を維持し続けている。現地の求めに応える車種を、適切な時期に届けられなかったツケは大きい。北米でのEVシフトに目を奪われるあまり、アジアという成長著しい市場の現実に、目を背けていた面は否めない。 開発機能を再び研究所へと戻すという今回の決断。それは、効率を優先するあまり現場の力を弱めてきたこれまでの歩みが、行き詰まりを見せたことを自ら認める対応といえるだろう。,[],[]
トヨタの隠し玉は「猫」だった！？ 高齢者事故死者64人が示す、監視に代わる「愛着」という希望（Merkmal）,https://news.yahoo.co.jp/articles/1b977ebcda78674e59efbda0fab0adf9ab07ea5e,https://newsatcl-pctr.c.yimg.jp/t/amd-img/20260405-10112910-merkmal-000-3-view.jpg?exp=10800,2026-04-05T05:51:00+09:00,2026-04-05T12:09:27+09:00,Merkmal,merkmal,Merkmal,1379,高齢事故の継続と社会の記憶 トヨタのロゴマーク（画像：AFP＝時事） 高齢ドライバーによる痛ましい事故のニュースは、いまも途切れることがない。2021年に葛巻清吾氏が発表した論文「高齢ドライバーによる交通事故と予防システム」でも指摘されているとおり、この問題は現代社会が抱える根深い棘となっている。とりわけ2019年の池袋での事故は、多くの人々の記憶に深く刻み込まれた。 【画像】「えぇぇぇ！」 これがトヨタ自動車の「平均年収」です！（7枚） これを受け、国も手をこまねいていたわけではない。2016（平成28）年からは免許更新の際に認知機能検査を組み込むなど、道路交通法を段階的に改めてきた。同時に、自動車メーカー側も衝突被害軽減ブレーキといった支援機能を標準的に備え、ハードウェアの面から「事故を起こさせない」ための取り組みを続けてきた。 だが、こうした技術による解決は、いまひとつの踊り場に差し掛かっているように見える。車の性能がどれほど向上したとしても、それを扱う人間の側が機能に甘え、注意を怠ってしまえば、安全の土台はもろくも崩れ去るからだ。 結局のところ、機械が介入して人を守ろうとする手法は、人間の 「危険に対する感覚」 を鈍らせるという皮肉な壁に直面している。これまでの延長線上にある技術の積み上げだけでは、事故を減らし続ける歩みはどこかで止まってしまうだろう。いま本当に必要なのは、単なる機能の底上げではない。人の意識や日々の振る舞いそのものにまで踏み込んだ、より踏み込んだ向き合い方ではないだろうか。 事故件数の高止まりと死者増加 「高齢者の交通人身事故発生状況（令和7年中）」（画像：警視庁） 警視庁が発表した最新の統計は、私たちが目を背けてはならない現実を突きつけている。2026年1月に公表された「高齢者の交通人身事故発生状況（令和7年中）」をひも解くと、そこには一筋縄ではいかない数字が並ぶ。 事故件数は、2020年に一時8851件まで落ち込んだ。しかし、その翌年には再び1万件を上回り、2025年に至るまで1万件台を横ばいで推移している。いわば「足踏み」の状態だ。なかでも深刻なのは、命が失われる現場が増えていることだろう。減少傾向にあった死者数は、2024年に57人、2025年には64人と跳ね上がり、過去10年で最悪の数字を記録した。これまでの対策だけでは、もはや守りきれない領域があることを物語っている。 車の性能を高め、安全を守る機能を広範に普及させてきた努力は、けっして無駄ではなかったはずだ。それでも死者数が増えているという事実は、きわめて重い意味を持つ。支援機能が手厚くなるほど、皮肉にも「車がなんとかしてくれる」という過信が生まれ、かえって注意が削がれてしまう。ハードウェアの進化だけでは限界があるのだ。 安全の最後の拠り所である「人の意識」を、どうすれば保てるのか。この難題に対し、トヨタ・モビリティ基金は興味深い試みを始めている。あえて「不完全さ」を残した猫型ロボット 「ドラにゃむ」 だ。quantum（クオンタム、東京都港区）と共同開発されたこのロボットは、鳴き声を通じて、ドライバーの自然な注意を喚起するという。このささやかな仕組みが、高齢者の運転にどのような風を吹き込むのか。その行方を追ってみたい。,[],[]
