headline,mainEntityOfPage,image,datePublished,dateModified,author,media_en,media_jp,str_count,body,images,external_links
高知市・北見市の姉妹都市40周年記念　北海道へひとっ飛び!相互チャーター便が出発（テレビ高知）,https://news.yahoo.co.jp/articles/eabf38c41e76e7867dc013bce0cfc83ff971559f,https://newsatcl-pctr.c.yimg.jp/t/amd-img/20260309-22518889-kutvv-000-1-thumb.jpg?exp=10800,2026-03-09T19:12:18+09:00,2026-03-09T19:12:18+09:00,テレビ高知,kutv,テレビ高知,806,テレビ高知 高知から、北海道へひとっ飛び!高知市と北見市の姉妹都市提携が40周年を迎えるのを記念して、高知と北海道を結ぶ相互チャーター便が出発しました。9日午前、高知龍馬空港のロビーには、北海道を楽しみにしている人たちの姿が。 【写真を見る】高知市・北見市の姉妹都市40周年記念 北海道へひとっ飛び!相互チャーター便が出発 ▼乗客 「もう何十年ぶりで行ってきます。94歳になります。（Q.今の気持ちは）“冥土の土産”」 「北海道は何回か行ったことがあるけど、流氷は初めてなので、すごく楽しみ」 「カニ（が楽しみ）やね」 「北見は焼肉がおいしそうなので、ぜひとも食べたい」 高知市と北見市が、姉妹都市の提携を結んだのは1986年4月。4月、節目の40周年を迎えるのを記念して、JALグループなどが、高知と女満別（めまんべつ）を結ぶ相互チャーター便を企画しました。 用意された56の座席は、販売開始後、瞬く間に完売。人気の理由は、なんといってもその「近さ」です。 通常、高知から北海道へは乗り継ぎが必要で、半日がかりの移動となりますが、今回は直行便。移動時間は半分以下のおよそ2時間半です。 今回のツアーは「相互」チャーター便。高知からの客が北見で流氷や焼き肉を楽しむ一方、北海道からの客は、高知で牧野植物園や仁淀川の自然を満喫する、3日間のプランとなっています。 この直行便を実現させるため、舞台裏では奔走が続いていました。 ▼日本航空 高知支店 川真田純也支店長 「機材（の準備が）なかなか難しかったんですけど、今回のために特別に準備させていただいたので、お客様に喜んでいただいてよかった。流氷も企画に入っているので、現地で楽しんでいただければ」 JALによりますと「高知と北海道の直行便を常設してほしい」という声が、県民から多く寄せられているということで、JALは今後、実現化を目指したい考えです。 テレビ高知,[],[]
高知の天気　10日　未明から朝にかけて山間部では降雪のおそれ　山岸拓気象予報士が解説（テレビ高知）,https://news.yahoo.co.jp/articles/25ba974dad1f8dc6b5e7652895ba58ec6e884d11,https://newsatcl-pctr.c.yimg.jp/t/amd-img/20260309-22518807-kutvv-000-1-thumb.jpg?exp=10800,2026-03-09T19:10:24+09:00,2026-03-09T19:10:24+09:00,テレビ高知,kutv,テレビ高知,280,テレビ高知 10日は、未明から朝にかけて山間部を中心に雪の降るところがありそうです。降り始めからの予想降雪量は、中部から西部の多い所で5センチとなっています。朝は路面の凍結に注意をしてください。日中は高気圧に覆われて広い範囲で晴れるでしょう。 【写真を見る】高知の天気 10日 未明から朝にかけて山間部では降雪のおそれ 山岸拓気象予報士が解説 向こう1週間は、晴れる日が多くなるでしょう。12日の木曜日は、低気圧の影響で雲が広がりやすく雨の降るところがありそうです。気温は平年並みの日が多く、日中でも肌寒い日が続くでしょう。 （気象予報士 山岸拓） テレビ高知,[],[]
「数年に1度の当たり年!」ハウス栽培の『小夏』出荷ピーク（テレビ高知）,https://news.yahoo.co.jp/articles/920bddf93739dbf076c83c0d69e6600d40de10ea,https://newsatcl-pctr.c.yimg.jp/t/amd-img/20260309-22518833-kutvv-000-2-view.jpg?exp=10800,2026-03-09T18:39:17+09:00,2026-03-09T18:43:13+09:00,テレビ高知,kutv,テレビ高知,711,テレビ高知 高知県香南市ではハウスで育てられた「温室小夏」が出荷の時期を迎えています。2026年は、データに基づいた丁寧な栽培管理により、例年以上に甘みが強く仕上がっているということです。 【写真を見る】「数年に1度の当たり年!」ハウス栽培の『小夏』出荷ピーク 香南市香我美町（かがみちょう）では、10人の生産者がハウスで小夏を育てていて3月下旬から収穫が始まりました。品種は、県内で生まれたタネが少ない「宿毛小夏」。ツヤツヤとした美しい見た目となめらかな口当たりが特徴です。中内健祐さんのハウスでは9日も午前8時から作業をはじめ、小夏を手際よく収穫していました。この時期は毎日およそ3トン出荷しています。 ▼収穫を手伝う人は 「色もツヤも大きさもいい」 Q.天候がよかったから? 「どうでしょうねぇ、作り手がえいがやき（笑）（良いからね）」 研修会などで、温度や水の管理を緻密に分析。その結果、2026年は甘みが強く、数年に一度の当たり年とも言える出来になりました。 ▼岡本采子アナウンサー 「いただきます。やさしい甘さと程よい酸味とっても美味しいです」 小夏の美味しさを引き立てるのが、この「白い甘皮」。実と一緒に食べることで、独特の酸味と甘みが倍にも膨らむといいます。 ▼JA高知県香美地区 果樹部温室小夏研究会 中内健祐さん 「今年は去年と比べて糖度が高く、ここ数年の中でもおいしくできあがっています。生で食べてもらいたいですし、最近自分ではウイスキーに漬け込んだり、漬け込みウイスキーとして飲んだりしています」 出荷は4月下旬まで続く予定で、その多くが県内で販売されるほか、東京などにも出荷されます。 テレビ高知,[],[]
自衛官の23歳男、懲戒免職⋯マッチングアプリの女性から10万円詐取で逮捕、複数人から約43万円詐取も判明「生活費や遊ぶ金に⋯」【高知】（テレビ高知）,https://news.yahoo.co.jp/articles/831213d5c2cb6764ef18c1eed6d0cddee61374eb,https://newsatcl-pctr.c.yimg.jp/t/amd-img/20260309-22518875-kutvv-000-1-view.jpg?exp=10800,2026-03-09T18:38:12+09:00,2026-03-09T18:38:12+09:00,テレビ高知,kutv,テレビ高知,560,テレビ高知 マッチングアプリで知り合った女性から現金をだまし取ったとして逮捕・起訴されていた自衛官の男について、所属先の高知駐屯地は「内部調査でさらに別の被害も発覚した」として、3月9日付けで「懲戒免職処分」としました。 【写真を見る】自衛官の23歳男、懲戒免職⋯マッチングアプリの女性から10万円詐取で逮捕、複数人から約43万円詐取も判明「生活費や遊ぶ金に⋯」【高知】 懲戒免職処分となったのは、陸上自衛隊・高知駐屯地の23歳の陸士長の男です。 警察によりますと、陸士長の男は2025年7月にマッチングアプリで知り合った香川県の女性に対し「交際しませんか、お金を預けてくれたら運用して増やせる」などと嘘の話を持ちかけ、現金10万円をだまし取った疑いで逮捕され、その後、起訴されています。 また、逮捕後の自衛隊の調査では、陸士長の男が複数人からおよそ43万円をだましとっていたこともわかったということです。 このため高知駐屯地は、陸士長の男を3月9日付けで懲戒免職処分としました。 陸士長の男は「深く反省している。生活費や遊ぶ金に充てたかった」と話しているということです。 第50普通科連隊の水関謙作連隊長は、「自衛官が犯罪行為を行うことはあってはならない。服務指導をより一層徹底する」とコメントしています。 テレビ高知,[],[]
特急・南風の切りつけ男を起訴　ナイフを乗客の左頬に押し当て脅した事実も判明⋯直前に車掌と口論→「ナイフ持ってるんやぞ」と車内うろつく【高知】（テレビ高知）,https://news.yahoo.co.jp/articles/ab9735f5b4cc8aa6a9347f2d362dba8edff0d85d,https://newsatcl-pctr.c.yimg.jp/t/amd-img/20260309-22518773-kutvv-000-2-thumb.jpg?exp=10800,2026-03-09T18:13:13+09:00,2026-03-09T18:35:22+09:00,テレビ高知,kutv,テレビ高知,1146,テレビ高知 1月25日夜、JR土讃線を走行中の特急「南風」の列車内で、男が乗客をナイフで脅し車掌を切りつけた事件で、逮捕されていた63歳の男を、高知地方検察庁は3月9日、傷害など3つの罪で起訴しました。 【写真】男が持っていたのは刃体8cmのナイフと判明⋯事件があった特急「南風」の車両 起訴されたのは、大阪府枚方市の無職・山内基正（やまうち・もとまさ）被告（63）です。 起訴内容によりますと、山内被告は1月25日、大豊町内を走行中のJR四国の特急列車「南風」の車内で以下の行為に及んだとして、3つの罪に問われています。 (1)暴力行為等処罰に関する法律違反 乗客に対して刃体およそ8.2cmのナイフを示しながら「俺はナイフを持ってるんやぞ」などと言ったうえ、ナイフを乗客の左頬に押し当てるなどして脅迫した。 (2)傷害 ナイフを取り上げようとした車掌に左手でナイフの刃を掴ませるなどして、全治およそ2週間のけがをさせた。 (3)銃刀法違反 正当な理由がないのにナイフ1本を所持した。 この事件は1月25日夜、走行中の下り特急列車「南風25号」（3両編成）の列車内で、山内被告がサバイバルナイフで60代の車掌を切りつけたとして、傷害の疑いで逮捕されていたものです。切りつけられた車掌は、左手の人差し指と小指に切り傷を負って救急搬送されましたが、命に別状はありませんでした。 その後、高知東警察署は、山内容疑者が乗客の50代女性に対してナイフを見せて「俺はナイフを持っているんやぞ」と脅したとして、暴力行為等処罰に関する法律違反と銃刀法違反で、2月16日に山内容疑者を再逮捕していました。 山内被告の身柄はそれぞれの逮捕後に高知地方検察庁に送られていましたが、高知地方検察庁は3月9日、山内容疑者を起訴しました。 山内被告の認否について高知地検は、「コメントを差し控える」としています。 これまでの警察への取材では、事件前、山内被告が列車内でトラブルを起こしていたことがわかっています。 山内被告は事件前の午後10時ごろ、列車のトイレ内にある「SOSボタン=非常停止ボタン」を押し車掌と口論になっていたということです。 その後、山内容疑者はナイフを出して車内をうろつき始め、席に座っていた女性客を脅迫するなどした後、ナイフを見た車掌が山内容疑者を制止しようと向かっていったということです。 ナイフを持って女性客を脅迫した際、山内被告は「こんな状況でまだ寝るんか?」などとも発言していたということです。 今回起訴された事実では、山内被告が「乗客の左頬にナイフの刃体を押し当てて脅迫していた」ことが新たにわかりました。 今後は、山内被告の裁判が開かれ司法判断が下されることになります。 テレビ高知,[],[]
動物園のコウモリ400匹、一斉に捕獲し健康診断　飼育員「毎年の大仕事」と苦労も「実はクリクリな目でかわいい、魅力を知ってほしい」【高知】　（テレビ高知）,https://news.yahoo.co.jp/articles/3aecb716fd2352a2ad5f02c54f1bc6b958c7a594,https://newsatcl-pctr.c.yimg.jp/t/amd-img/20260309-22518708-kutvv-000-2-thumb.jpg?exp=10800,2026-03-09T17:40:24+09:00,2026-03-09T18:33:15+09:00,テレビ高知,kutv,テレビ高知,769,テレビ高知 高知県の動物園で9日、飼育されているおよそ400匹のコウモリを一斉に捕獲し、健康診断が行われました。 ※コウモリはよく見るとかわいらしい顔をしていますが、苦手な方はご注意ください。 【写真】目がクリクリで実はかわいい!「お手柔らかに、お願いしますよ」と聞こえてきそうなコウモリ400匹の健康診断の様子 高知県香南市の「のいち動物公園」では、毎年この時期に、飼育している全ての「エジプトルーセットオオコウモリ」を捕獲して、個体数を数えています。 飼育員によりますと、翼に付けた印の場所で「生まれた年」がわかるといいます。 ▼飼育員 「コウモリの両肘のところに、うっすら印があります。この子は2020年生まれなので、6歳です」 印が無いコウモリは「今年度、新たに繁殖した個体」と判断され、新しく印がつけられます。 園では400匹近くの「エジプトルーセットオオコウモリ」を飼育していて、その数は日本一だということです。 全ての個体を捕獲するのは大変な作業ですが、ケガがないか、衰弱していないか⋯など、健康状態を確認できる大切な機会となっています。 ▼コウモリ担当 長谷川蒼良 飼育員 「毎年の大仕事、一大イベントです。きのうは緊張して寝られなかったです⋯。ふだん1頭1頭と向き合う機会が無く、年に一度、1頭1頭と向き合える機会なので、これを大事にしていきたい」 マイナスなイメージを持たれがちなコウモリですが、担当する長谷川飼育員は、その“かわいさ”を知ってほしいと話します。 ▼コウモリ担当 長谷川蒼良 飼育員 「くりくりな目でかわいい顔をしていて『空飛ぶキツネ』という異名もあります。怖いとは思いますが、ぜひ、まじまじとコウモリを見てほしい」 ちなみに、今回捕獲されたコウモリの数は「367頭」だったということです。 テレビ高知,[],[]
臨時情報、後発地震注意情報⋯とは?発表時はどうればいい?「言葉が似た情報がたくさんあるので⋯」有識者が解説　南海トラフ地震臨時情報　北海道・三陸沖後発地震注意情報【防災アップデート】（テレビ高知）,https://news.yahoo.co.jp/articles/9f2d079a98922b37cb4f4117aa2769d96715066d,https://newsatcl-pctr.c.yimg.jp/t/amd-img/20260309-22517959-kutvv-000-1-thumb.jpg?exp=10800,2026-03-09T17:05:25+09:00,2026-03-09T17:05:25+09:00,テレビ高知,kutv,テレビ高知,953,テレビ高知 東日本大震災の発生からまもなく15年です。15年の年月が流れる中、未曾有の大震災を教訓に「南海トラフ地震」の対策・取り組みもアップデートされてきました。そうした対策・取り組みの“現在地”を、シリーズ「防災アップデート」としてお伝えします。 【写真】この情報が発表された時、あなたはどう対処しますか?「南海トラフ地震臨時情報」と「北海道・三陸沖後発地震注意情報」について、画像で確認する 今回は「大きな地震が発生する可能性が高まった時」に発表される2つの情報、「北海道・三陸沖後発地震注意情報」や「南海トラフ地震臨時情報」について、高知大学の原忠教授の解説とともにお伝えします。 ◆高知大学 原忠 教授◆（はら・ただし） 高知大学 教育研究部 自然科学系 理工学部門 教授。防災推進センター副センター長。愛媛大学大学院 連合農学研究科 教授（兼任）。専門は地盤工学で、防災にも精通。わかりやすい話し方に定評があり、高知県内を中心とするメディアにも出演し、災害・防災に関する知見を発信している。 2025年7月30日、ロシアのカムチャツカ半島沖を震源とするM8.7の地震が発生し、東日本〜西日本の太平洋側を中心に「津波注意報」が発表され、高知県内でも最大で60cmの津波を観測しました。 また12月には、青森県東方沖でM7.5の地震が発生し、八戸市で最大震度6強を観測。そして年が明けた2026年1月には、島根県東部を震源とするM6.4の地震が発生し、鳥取、島根の両県で「最大震度5強」を観測しました。 このように、直近1年ほどを見ても規模の大きな地震が全国各地で発生していて、地震・津波への備えが重要であることを改めて思い知らされています。 ■「重機を避難」させる新たな取り組み これまで何度も地震・津波災害の被災地へ足を運び、現地で調査を行ってきた高知大学の原忠教授は、2025年12月に発生し震度6強を観測した青森県東方沖地震の被災地でも調査を行いました。 ▼高知大学 原忠 教授 「この地震は、地震としてはそんなに大きくはなかったんですけど、マグニチュードが『7』を超えていますので、震度6強を観測するなど、やっぱり被害がありまっした。具体的に見てますと、港湾地域の液状化の被害ですとか⋯」,[],[]
ほぼ全県で震度7、約10万人が負傷⋯“最大クラス”南海トラフ地震で想定される被害は?“高知県版”の想定、今月中にも公表へ【防災アップデート】（テレビ高知）,https://news.yahoo.co.jp/articles/71054ee8a77a2bd5e315950cb4bc3a25bcced2f0,https://newsatcl-pctr.c.yimg.jp/t/amd-img/20260309-22515895-kutvv-000-5-thumb.jpg?exp=10800,2026-03-09T15:00:34+09:00,2026-03-09T15:12:13+09:00,テレビ高知,kutv,テレビ高知,938,テレビ高知 東日本大震災の発生からまもなく15年です。15年の年月が流れる中、未曾有の大震災を教訓に「南海トラフ地震」の対策・取り組みもアップデートされてきました。そうした対策・取り組みの“現在地”を、シリーズ「防災アップデート」としてお伝えします。 【写真】想定される「2タイプの地震」や「被害の予測」を画像で確認する 今回は、国の「新たな被害想定」が発表されたことを受けて3月中に公表される予定の「高知県版の新たな被害想定」について、検討委員会の副委員長としてこの被害想定の策定を進める、高知大学の原忠教授の解説とともにお伝えします。 ◆高知大学 原忠 教授◆（はら・ただし） 高知大学 教育研究部 自然科学系 理工学部門 教授。防災推進センター副センター長。愛媛大学大学院 連合農学研究科 教授（兼任）。専門は地盤工学で、防災にも精通。わかりやすい話し方に定評があり、高知県内を中心とするメディアにも出演し、災害・防災に関する知見を発信している。 2011年3月の東日本大震災の発生を受けて、国は2012年に南海トラフ地震の揺れ・津波による死者などの「被害想定」を公表し、高知県も独自に「高知県版の被害想定」を策定して対策にあたってきました。 その後「国の被害想定」が2025年3月に全面的に見直されたことを受け、高知県でも2025年10月に県内の地震震度・津波予測を公表し、これを踏まえた「高知県版の新しい被害想定」が、2025年度中=2026年3月中に公表される予定です。 この「高知県版の新しい被害想定」について、高知県は「規模の異なる2つの地震」を想定しています。「レベル1（L1）」と「レベル2（L2）」の地震です。 「レベル1」は「発生頻度の高い、一定程度の間隔で起こる地震」です。地震の規模を示すマグニチュードは「8クラス」で、100年から150年の周期で発生し大きな被害をもたらすものです。 「レベル2」は「最新の科学的知見に基づく、発生しうる最大クラスの地震」です。地震の規模を示すマグニチュードは「東北地方太平洋沖地震」と同じ「9クラス」で、発生の時期を予測することはできませんが「発生する頻度は極めて低く、1000年に1度くらい」と言われています。,[],[]
乗り継ぎなしで北海道へ直行　姉妹都市提携40周年を記念して高知市と北見市の相互チャーター便出発（テレビ高知）,https://news.yahoo.co.jp/articles/b6c0bdec8dfd4b5dcdd7f24e3efe391c1b364e54,https://newsatcl-pctr.c.yimg.jp/t/amd-img/20260309-22517315-kutvv-000-1-thumb.jpg?exp=10800,2026-03-09T12:12:18+09:00,2026-03-09T12:12:18+09:00,テレビ高知,kutv,テレビ高知,322,テレビ高知 高知市と北見市の姉妹都市提携が40周年を迎えるのを記念して、高知と北海道を結ぶ相互チャーター便が出発しました。 【写真を見る】乗り継ぎなしで北海道へ直行 姉妹都市提携40周年を記念して高知市と北見市の相互チャーター便出発 高知市と北見市は、1986年4月に姉妹都市の提携を締結。4月に40周年の節目を迎えることを記念して、JALグループなどが、高知と女満別（めまんべつ）を結ぶ相互チャーター便を企画しました。通常、高知から北海道へ行くには乗り継ぎが必要ですが、今回は直行便のため、移動時間は半分ほどのおよそ2時間半。 今回の相互チャーター便の利用者は、それぞれ高知と北見に3日間滞在し、観光や交流を楽しむということです。 テレビ高知,[],[]
【動画】西武ドラ6ルーキー川田、地元オープン戦で2戦1安打2盗塁と躍動　ヤクルト長岡は豪快弾⋯高知で14年ぶりプロ野球オープン戦、大盛況（テレビ高知）,https://news.yahoo.co.jp/articles/bc69393bc7c825f285c27c6804de001e54418c2f,https://newsatcl-pctr.c.yimg.jp/t/amd-img/20260309-22517324-kutvv-000-1-thumb.jpg?exp=10800,2026-03-09T12:09:16+09:00,2026-03-09T12:09:16+09:00,テレビ高知,kutv,テレビ高知,774,テレビ高知 プロ野球、埼玉西武ライオンズと東京ヤクルトスワローズのオープン戦が高知市で14年ぶりに行われ、会場には大勢の観客が詰めかけました。 【写真】ヤクルト長岡は豪快3ラン、西武・川田は快足飛ばして2盗⋯試合を画像で見る 3月7日（土）と8日（日）、高知市の春野球場で、プロ野球オープン戦、西武vsヤクルトの2試合が行われました。プロ野球のオープン戦が高知県内で行われたのは14年ぶりでした。 8日（日）は青空が広がる中、球場には県内外から3005人の観客が詰めかけました。 8日の2戦目は7回まで1-1で進む投手戦となりましたが、8回表、ヤクルトが1アウト1塁・2塁から2番・長岡秀樹が内角低めに落ちる変化球を巧みにすくい上げ、ライトスタンドへと運ぶスリーランホームランを放ち、4-1とリードします。 そして8回ウラには、西武のドラフト6巡目ルーキー、宿毛市出身・元四国銀行行員の川田悠慎選手が代走で出場。2塁への盗塁を決めた後、後続のヒットで俊足を生かして一気に2塁からホームへ返り、西武が1点を返します。 ただ、西武の反撃も及ばず、試合は4-2でヤクルトが勝利しました。 ▼愛媛から訪れた西武ファン 「せっかく西武が高知に来たので『絶対に来よう』と思ってここまで来たので、うれしいです。ピッチャーとかすごく近くで見ることができたので良かったです。来年も来てくれたらうれしいなと思っています」 ▼高知のヤクルトファン 「長岡選手のホームランがよかったです!高知で見ることができて、うれしかったです」 なお、川田選手は前日・7日（土）の1戦目でも5回の守備から途中出場し、1安打1盗塁をマークして、地元で開幕1軍入りに向けて猛アピールしました。 プロ野球のオープン戦は今月22日まで行われる予定で、公式戦は今月27日に開幕します。 テレビ高知,[],[]
