headline,mainEntityOfPage,image,datePublished,dateModified,author,media_en,media_jp,str_count,body,images,external_links
１４０年余の歴史に幕を下ろす「目視観測」　広島地方気象台にワケを聞いてみた（広島テレビ　ニュース）,https://news.yahoo.co.jp/articles/40895798616d1f6e399fe1a2ff672d51339bf1ae,https://newsatcl-pctr.c.yimg.jp/t/amd-img/20240321-01161441-htv-000-1-thumb.jpg?exp=10800,2024-03-21T19:23:01+09:00,2024-03-21T19:23:01+09:00,広島テレビ　ニュース,htv,広島テレビ　ニュース,1578,\n広島テレビ放送\nここからは、気象予報士の塚原さんが気象観測での新たな動きを伝えます。\n\n気象台はさまざまな観測機器を使って天候を観測していますが、その内のひとつで間もなくなくなるのが「目視観測」です。\n\n「目視観測」とは、担当者が実際に屋外に出て肉眼で観測して判断すること。明治時代から続けてきましたが、間もなく終了します。「目視観測」の廃止で何が記録されなくなるかと言うと…。\n\nあられやひょう・黄砂・虹、音だけの雷・光だけの雷、快晴・薄曇など…。終了のワケを探りました。\n\n\n広島市中区にある広島地方気象台を訪ねました。\n\n■広島地方気象台 坂原幹敏 技術専門官\n「先ほど１１時は２割ほど雲がありましたけど、今は１割を切っています。もう文句なしに誰が見ても快晴という雲です」\n\nこれが、気象台の職員が実際に目で見て天気を判断する「目視観測」です。\n観測員が、毎日３時間ごとに庁舎の屋上に上がり、天気のほか、ビルや山の霞み具合などから見通しのきく距離などを観測しています。\n\n明治時代から１４０年以上にわたり続いてきましたが、３月２５日で終了します。その背景を聞きました。\n\n■広島地方気象台 實重博司 主任技術専門官\n「気象衛星や気象レーダーの高性能化ということで、いろいろな情報が細かく分かるようになってきた。目視観測の重要性がそれほど高くなくなってきたということです」\n\n機械化の波は日進月歩です。全国の気象台では「目視観測」を既に廃止した所も多くあり、４月以降に続けるのは東京と大阪のみとなります。\n\n機械化に伴い、今や天気の判別は気象衛星や計測器などによるものが大半…\n見通しのきく距離は、気象台付近の水滴やちりの量などを元に計算しています。\n\n■広島地方気象台 實重博司 主任技術専門官\n「目視観測で観測しているもののなかで、例えばひょうとか防災上重要なものもあるんですが、そういったものは例えばレーダーとかでとらえることが今できるようになってきています」\n\n一方で「目視観測」には機械では補えない熟練の技術が受け継がれています。\n\n■広島地方気象台 坂原幹敏 技術専門官\n「きょうなんかは下層の雲っていうんですが、大体見ると１０００メーター\nから１５００メーターくらいの間の雲ですね」\n\nこれまで、観測員は雲の種類や高度なども判断し記録してきました。更に、空に浮かぶ雲の量から、その日の天気が「快晴」か「晴れ」かを判別してきましたが、それらは機械の手には負えません。\n\nそのため、特に災害の危険が迫るような時には、記録しなくても職員による「目視観測」を続けるとしています。\n\n■広島地方気象台 坂原幹敏 技術専門官\n「（雲の）形だけではなくてそういう高度とかでも判別できないと、要は災害に結びつくような顕著な雨とか判定するのはもう目で見ないとということなんですよね」\n\n機械にもある限界…。だからこそ「目視観測」が残るものもあります。\n\n■實重さんと塚原気象予報士\n「水の入った容器、ここに氷がはるかどうかの観測と、あと霜の方は、こういった炭とかタイヤを用意して、霜が出たかどうかをちょっと分かりやすいようにしています」\n「黒い物だったら・・・」\n「目立つので、ということで」\n\n冬の訪れを告げる初霜・初氷・初冠雪の観測です。\n\n■広島地方気象台 實重博司 主任技術専門官\n「季節の変わり目のシグナルとして結構ニュースにも取り上げていただいていますので、そういったニーズも考えて継続となっています」\n\n観測機器の進化は続きますが、気象台は「目視観測の技術は継承し、守りたい」としています。\n\n（２０２４年３月２１日放送）,[],[]
原爆資料館の音声ガイドをウクライナ語に翻訳した学生３人が広島を訪問　自らが担当したガイドを聞きながら資料館を見学（広島テレビ　ニュース）,https://news.yahoo.co.jp/articles/39945031de47056a47663b7db49ee782c150d642,https://newsatcl-pctr.c.yimg.jp/t/amd-img/20240321-07975243-htv-000-1-thumb.jpg?exp=10800,2024-03-21T19:26:00+09:00,2024-03-21T19:26:00+09:00,広島テレビ　ニュース,htv,広島テレビ　ニュース,527,\n広島テレビ放送\n広島市の原爆資料館でウクライナ語の音声ガイドを翻訳したウクライナ出身の学生らが広島を訪れ、自らが担当したガイドを聞きながら資料館を見学しました。\n\n原爆資料館を訪れたのは、福岡県の大学に通うウクライナ出身の学生３人です。３人は、ロシアによる侵攻が始まったあと来日。２０２３年のＧ７広島サミットでゼレンスキー大統領の訪問をきっかけに駐日ウクライナ大使館から依頼を受け、資料館の展示を紹介する音声ガイドのウクライナ語への翻訳をサポートしました。\n\n音声ガイドは、学生１２人と教員１人が約３週間かけて翻訳し、２月１６日から貸し出しが始まっています。３人は自ら翻訳したガイドに耳を傾けながら、被爆の惨状などを２時間ほどかけて見学しました。\n\n■カテリナ・マニコフスカヤさん\n「ガイドを聞きながらずっと自分の家族の事を考えていて、心が痛くてたまらなかった」\n■マリヤ・コルネヴァさん\n「広島資料館は世界の歴史にも未来にもとても大事なところ」\n■スヴィトラナ・レヂコさん\n「日本の文化や歴史を学ぶことが重要」\n\n３人は慰霊碑や原爆ドームも訪れ、遠い祖国の平和を願い祈りを捧げました。\n\n（２０２４年３月２１日放送）,[],[]
広島のおいしいものが勢ぞろい　「おいしい！広島」期間限定販売会はじまる（広島テレビ　ニュース）,https://news.yahoo.co.jp/articles/55571160aeac4f349c71331fbfad7bba130da65e,https://newsatcl-pctr.c.yimg.jp/t/amd-img/20240321-05595491-htv-000-2-thumb.jpg?exp=10800,2024-03-21T19:29:01+09:00,2024-03-21T19:32:47+09:00,広島テレビ　ニュース,htv,広島テレビ　ニュース,314,\n広島テレビ放送\n広島県産のおいしいものが勢ぞろいした販売会が、広島市内のデパートで始まりました。\n\n福屋広島駅前店では、県の食の魅力を発信するプロジェクトと連携した試食販売会が２１日から始まりました。広島牛や今が旬のイチゴといった食材をはじめ、プリンなどのスイーツも並びます。\n\nその中で目を引くのは、県産にこだわった食材でつくるギョーザです。ホームページで募った客と地元の食品会社が、約１年半かけて開発しました。米粉と玄米で作った真っ白な皮が特長です。\n\n■試食したお客\n「鶏の胸肉がよかった。鶏の胸肉はやわらかいから食べやすい」\n\n試食販売会は３月２７日までです。\n\n（２０２４年３月２１日放送）,[],[]
新たな名称は「サンフレッチェビレッジ広島第一球技場」　サンフレッチェ広島が広島広域公園第一球技場の命名権を取得（広島テレビ　ニュース）,https://news.yahoo.co.jp/articles/8fbd06f17374242ccccf1b277adb597623ec83f5,https://newsatcl-pctr.c.yimg.jp/t/amd-img/20240321-05393567-htv-000-1-thumb.jpg?exp=10800,2024-03-21T19:32:00+09:00,2024-03-21T19:32:00+09:00,広島テレビ　ニュース,htv,広島テレビ　ニュース,160,\n広島テレビ放送\n広島市は安佐南区にある広島広域公園第一球技場について、サッカーＪ１・サンフレッチェ広島が命名権を取得したと発表しました。\n\n新たな名称は「サンフレッチェビレッジ広島第一球技場」で、命名権料は税込みで年間２４２万円。契約期間は２０２４年６月１日から５年間です。\n\n（２０２４年３月２１日放送）,[],[]
サンフレッチェ広島が緊急補強　アルビレックス新潟の主力ＤＦ・新井直人選手を獲得　（広島テレビ　ニュース）,https://news.yahoo.co.jp/articles/104f4e840b9c9ab3f7b860c21ee82ddf3e2a094f,https://newsatcl-pctr.c.yimg.jp/t/amd-img/20240321-03763248-htv-000-1-thumb.jpg?exp=10800,2024-03-21T19:39:00+09:00,2024-03-21T19:39:00+09:00,広島テレビ　ニュース,htv,広島テレビ　ニュース,256,\n広島テレビ放送\nサンフレッチェは開幕４戦負けなしスタートですが、早くも補強をしました。\n\n２１日、獲得を発表したのはＪ１新潟のディフェンダー新井直人選手。背番号１３となります。\n\n東京都出身の２７歳。今シーズンの新潟でも主力として、開幕戦ではゴールも奪うなど攻守でチームに貢献してきました。\n\n新井選手は「覚悟を持って移籍してきました。タイトル獲得に向けて自分の持てる力をすべて注いでいきたい」とコメントしています。あす（２２日）サンフレッチェに合流します。\n\n（２０２４年３月２１日放送）,[],[]
創業７０年を超えるお好み焼きの老舗店が原爆ドームそばのおりづるタワーに旗艦店（広島テレビ　ニュース）,https://news.yahoo.co.jp/articles/46d638edcea1cde637d53a7b1dd2d1d349ce3e37,https://newsatcl-pctr.c.yimg.jp/t/amd-img/20240321-08127618-htv-000-1-thumb.jpg?exp=10800,2024-03-21T18:32:00+09:00,2024-03-21T18:32:00+09:00,広島テレビ　ニュース,htv,広島テレビ　ニュース,350,\n広島テレビ放送\n創業７０年を超えるお好み焼きの老舗店が、原爆ドームそばのおりづるタワーに旗艦店をオープンします。\n\n広島市中区に建つ、おりづるタワー。その１階にオープンするのは、お好み焼きの「みっちゃん」です。\n\n屋台風の暖簾や看板など「みっちゃん」が創業した昭和時代の雰囲気に、おりづるを装飾するなど広島らしさが演出されています。料理には、県産食材を満喫できる限定メニューが用意されました。\n\n■お好み焼みっちゃん総本店 上川学 社長\n「立地上、観光需要が多いと思うので、一人でも多くのお客様に広島のお好み焼きを食べてほしい」\n\nＧ７サミットでも注目されたお好み焼き。国内外からの集客を期待し、あさって（３月２３日）にオープンを迎えます。\n\n（２０２４年３月２１日放送）,[],[]
【センバツ】エース高尾が１１奪三振で１失点完投　広陵が初戦を突破（広島テレビ　ニュース）,https://news.yahoo.co.jp/articles/04c3652000aaaf65223e207c4e8d9985fe0c3c2b,https://newsatcl-pctr.c.yimg.jp/t/amd-img/20240321-03521764-htv-000-2-view.jpg?exp=10800,2024-03-21T17:56:00+09:00,2024-03-21T17:58:44+09:00,広島テレビ　ニュース,htv,広島テレビ　ニュース,327,\n広島テレビ放送\nセンバツ高校野球は今大会最多・２７回目の出場となる広島の広陵高校が初戦を突破しました。\n\n「春の広陵」が好発進です。\nセンバツ大会４日目の２１日、高知との名門対決に臨んだ１回戦。試合は初回から動きます。広陵は１番濱本のツーベースでチャンスをつくると、続く送りバントが相手の悪送球となる間にランナーが生還。１点を先制します。\n\n３回には１アウト３塁のチャンスに４番只石。\n\nワンバウンドでスタンドに入るエンタイトルツーベースとなり、さらに１点を追加します。\n\nエース高尾は８回に１点こそ失いますが、１１７球で１１個の三振を奪う力投。広陵は３対１で競り勝ち、３年連続の初戦突破です。\n\n（２０２４年３月２１日放送）,['https://newsatcl-pctr.c.yimg.jp/t/amd-img/20240321-03521764-htv-000-2-view.jpg?exp=10800'],['https://news.yahoo.co.jp/articles/04c3652000aaaf65223e207c4e8d9985fe0c3c2b/images/000']
広島県内は真冬並みの寒さ　桜の開花も「しばらくかかりそう」（広島テレビ　ニュース）,https://news.yahoo.co.jp/articles/f3b50ea185c1c7876240cc3aa3dcb46a27cf9af8,https://newsatcl-pctr.c.yimg.jp/t/amd-img/20240321-09767366-htv-000-2-thumb.jpg?exp=10800,2024-03-21T19:18:00+09:00,2024-03-21T19:20:42+09:00,広島テレビ　ニュース,htv,広島テレビ　ニュース,550,\n広島テレビ放送\n県内は２１日も真冬並みの寒さとなり、県北では午前中、強く雪が降りました。そのため、桜の開花について気象台は「しばらくかかりそう」と話しています。\n\n２１日午後、広島市中区の縮景園にあるソメイヨシノの標本木では気象台の職員がつぼみを入念に確認していました。\n\nしかし、ピンク色に色づいたものや白い花びらが見えるものはあったものの\n「開花」しているつぼみは確認されませんでした。日本気象協会の”当初の”\n広島の開花予想はきょう（３月２１日）でした。\n\n■広島地方気象台の職員\n「おととい（１９日）から変化がそれほど見られないので、きのう冷え込んだのが影響した。まだ開花がきょうあすあさってみたいなことはない。まだしばらくかかりそう」\n\n２０日から続いた寒気の影響。庄原市高野町では、２１日朝も一面、雪景色でした。\n\n■牛を飼育している人\n「（きのうは）日中ずっと降ってましたのでこの状態です。ずっと雪かきに追われていた感じ」\n\n２１日の最高気温は庄原市高野町で１.６度、広島市中区で７.７度と、２０日に引き続き真冬並みの寒さでした。２３日から平年を上回る気温となる見込みで、気象台は桜のつぼみが膨らむとみています。\n\n（２０２４年３月２１日放送）,[],[]
広島駅周辺を一体となって盛り上げ　ＪＲ西日本とデパートが新たなポイントキャンペーン実施へ（広島テレビ　ニュース）,https://news.yahoo.co.jp/articles/6b1b60ec7895fd57284694e97c67d8b63c2ce5f5,https://newsatcl-pctr.c.yimg.jp/t/amd-img/20240321-03635691-htv-000-1-thumb.jpg?exp=10800,2024-03-21T18:30:01+09:00,2024-03-21T18:30:01+09:00,広島テレビ　ニュース,htv,広島テレビ　ニュース,372,\n広島テレビ放送\n約１年後に控えた新たな広島駅ビルの開業を見据え、駅周辺を一体となって盛り上げようと、ＪＲ西日本とデパートが新たなポイントキャンペーンを始めます。\n\n工事が進む新しい広島駅ビル。２０２５年春の開業まで約１年となりました。駅ビルに広島電鉄の路面電車が乗り入れるための高架が徐々に形を現しています。\n\n■福屋駅前店 鈩前浩二 店長\n「駅ビルさんは大きなライバルなんですけど、共に盛り上げていかないと」\n\nＪＲ西日本と福屋広島駅前店は、３月２８日から新たなキャンペーンを始めます。福屋広島駅前店で交通系ＩＣカード・ＩＣＯＣＡを使って決済すると、ＪＲ西日本のＷＥＳＴＥＲポイントが通常の１０倍たまります。\n\n今後、ほかの店舗や交通機関とも連携し、一帯を盛り上げたいとしています。\n\n（２０２４年３月２１日放送）,[],[]
広島東洋カープが「Ｐ３ HIROSHIMA 春の招待事業」実施を発表（広島テレビ　ニュース）,https://news.yahoo.co.jp/articles/21cb5694f4a69254bbab59f4a1a2482955a2a451,https://newsatcl-pctr.c.yimg.jp/t/amd-img/20240321-06845565-htv-000-1-view.jpg?exp=10800,2024-03-21T17:02:01+09:00,2024-03-21T17:02:01+09:00,広島テレビ　ニュース,htv,広島テレビ　ニュース,634,\n広島テレビ放送\n広島東洋カープは２１日、広島県内在住の家族５組をＰ３ HIROSHIMA（広島三大プロ／広島交響楽団・サンフレッチェ広島・広島東洋カープ）の演奏会および試合に招待すると発表した。\n\n日程と募集要項は以下の通り。\n\n＜日 程＞\n １．広島東洋カープ 『対 読売ジャイアンツ戦』マツダスタジアム\n\n 2024年4月21日（日） 13：30試合開始／11：00開門\n\n２．サンフレッチェ広島 『対 鹿島アントラーズ戦』エディオンピースウイング広島\n\n 2024年5月15日（水） 19：00試合開始／15：30開門\n\n３．広島交響楽団 『音楽の花束～広響名曲コンサート・春』広島国際会議場フェニックスホール\n\n 2024年5月18日（土） 15：00演奏会開始／13：00頃集合予定\n\n＜募集要項＞\n １．応募資格 \n・広島県内にお住まいの家族\n・上記すべての日程に必ず参加できる家族\n・家族全員が小学生以上\n\n２．募集人数 \n ５組（１家族６名まで）\n\n３．応募方法 \n 以下の応募フォームから応募\n\n ［応募フォーム］https://carp-fan.jp/event/input/2024p3-h\n\n４．応募期間 \n ２０２４年４月３日（水）２３：５９まで\n\n※応募者多数の場合は厳正なる抽選を行い、当選者のみ４月９日ごろに電話またはメールで連絡\n\n（２０２４年３月２１日）,['https://newsatcl-pctr.c.yimg.jp/t/amd-img/20240321-06845565-htv-000-1-view.jpg?exp=10800'],['https://news.yahoo.co.jp/articles/21cb5694f4a69254bbab59f4a1a2482955a2a451/images/000']
サンフレッチェ広島がアルビレックス新潟の新井直人選手を完全移籍で獲得（広島テレビ　ニュース）,https://news.yahoo.co.jp/articles/3fbc396974adeac8180e85a7d3eef97009b6e87f,https://newsatcl-pctr.c.yimg.jp/t/amd-img/20240321-07119252-htv-000-2-view.jpg?exp=10800,2024-03-21T13:58:00+09:00,2024-03-21T16:15:49+09:00,広島テレビ　ニュース,htv,広島テレビ　ニュース,483,\n広島テレビ放送\nサンフレッチェ広島は２１日、アルビレックス新潟所属の新井直人選手がサンフレッチェ広島に完全移籍で加入すると発表した。新井選手は３月２２日（金）のトレーニングからチームに合流予定。\n\n\n＜新井直人（あらい・なおと）選手プロフィール＞\n■生年月日\n１９９６年１０月７日（２７歳）\n■出身地\n東京都\n■身長／体重\n１７３ｃｍ／７３ｋｇ\n■血液型\nＡ型\n■ポジション\nＤＦ\n■背番号\n１３\n■サッカー歴\n実践学園高校－新潟経営大学－アルビレックス新潟－セレッソ大阪－徳島ヴォルティス（期限付き移籍）－アルビレックス新潟\n\n＜新井直人選手コメント＞\nサンフレッチェ広島に関わるすべての皆さま。\nアルビレックス新潟から移籍してきました新井直人です。\nこのタイミングでチームに加入するにあたり、本当に覚悟を持って移籍してきました。１日でも早く皆さんの前でプレーがしたいですし、タイトル獲得に向けて自分の持てる力をすべて注いでいきたいと思います。皆さんに会えるのを楽しみにしています。\n\n（２０２４年３月２１日）,['https://newsatcl-pctr.c.yimg.jp/t/amd-img/20240321-07119252-htv-000-2-view.jpg?exp=10800'],['https://news.yahoo.co.jp/articles/3fbc396974adeac8180e85a7d3eef97009b6e87f/images/000']
広島市　コンビニで客を刺した男を送検　（広島テレビ　ニュース）,https://news.yahoo.co.jp/articles/eb3fb111dd57b22d03df328cf520c6fbb35228a3,https://newsatcl-pctr.c.yimg.jp/t/amd-img/20240321-04769624-htv-000-3-view.jpg?exp=10800,2024-03-21T13:25:00+09:00,2024-03-21T16:39:47+09:00,広島テレビ　ニュース,htv,広島テレビ　ニュース,335,\n広島テレビ放送\n19日、広島市内のコンビニエンスストアで刃物を振り回した男は、最初に客を刺したあと店員に向かっていったということです。\n\n広島市安佐南区の無職の男（76歳）は21日、「殺人未遂」の疑いで身柄を広島地検に送られました。\n\n警察によると男は19日、広島市安佐南区のコンビニエンスストアで殺意を持って女性2人を切り付け、ケガをさせた疑いです。59歳の客を刺したあと、カウンターにいた25歳の店員の方に向かっていったということです。客は太ももに大ケガをし、店員は手を切られ軽傷です。調べに対し「殺そうと思って力いっぱい刺した」と容疑を認めています。\n\n警察は20日に自宅を家宅捜索し、動機などを調べています。\n\n（2024年3月21日放送）,['https://newsatcl-pctr.c.yimg.jp/t/amd-img/20240321-04769624-htv-000-3-view.jpg?exp=10800'],['https://news.yahoo.co.jp/articles/eb3fb111dd57b22d03df328cf520c6fbb35228a3/images/000']
寒気の影響で広島県内も各地で氷点下の冷え込み　県北では雪（広島テレビ　ニュース）,https://news.yahoo.co.jp/articles/0411521946e8b174ca7bd58384155b89379387c7,https://newsatcl-pctr.c.yimg.jp/t/amd-img/20240321-05332537-htv-000-1-thumb.jpg?exp=10800,2024-03-21T13:38:00+09:00,2024-03-21T13:38:00+09:00,広島テレビ　ニュース,htv,広島テレビ　ニュース,294,\n広島テレビ放送\n県内は寒気の影響で各地で最低気温が氷点下まで下がり、北部では雪が降っています。\n\n一面、雪景色となった２１日朝の庄原市高野町では、時折強く雪が降りました。２０日から降った雪で７センチの積雪となっており、住民は車や道路に積もった雪を取り除く作業に追われていました。\n\n■牛を飼育している人\n「（きのうは）日中ずっと降ってましたのでこの状態です。ずっと雪かきに追われていた感じ」\n\n県内の最低気温は１０の観測地点で氷点下となりました。気象台によると寒気は徐々に抜けつつあり、２３日からは平年を上回る気温になる見込みです。\n\n（２０２４年３月２１日放送）,[],[]
労災事故で男性整備士が死亡　広島県福山市（広島テレビ　ニュース）,https://news.yahoo.co.jp/articles/34cfe890a53868a308d67837ce23ea2b2702b7f4,https://newsatcl-pctr.c.yimg.jp/t/amd-img/20240321-01921978-htv-000-4-view.jpg?exp=10800,2024-03-21T00:10:00+09:00,2024-03-21T06:02:13+09:00,広島テレビ　ニュース,htv,広島テレビ　ニュース,282,\n広島テレビ放送\n20日午後、福山市内でトラックの整備作業中に事故が発生し、男性整備士(58)が死亡しました。\n\n警察によると20日午後3時10分頃、福山市坪生町の運送会社の専用駐車場で、大型トラックの整備作業をしていた男性整備士(58)が、タイヤとタイヤハウスの間に挟まれました。\n\n男性は、意識がない状態で福山市内の病院に搬送され、約1時間40分後に死亡が確認されました。\n\n事故当時、男性は2人で大型トラックのサスペンションを整備していたということです。\n\n警察が事故の詳しい状況を調べています。\n【2024年3月21日午前0時10分】,['https://newsatcl-pctr.c.yimg.jp/t/amd-img/20240321-01921978-htv-000-4-view.jpg?exp=10800'],['https://news.yahoo.co.jp/articles/34cfe890a53868a308d67837ce23ea2b2702b7f4/images/000']
