headline,mainEntityOfPage,image,datePublished,dateModified,author,media_en,media_jp,str_count,body,images,external_links
【マイラーズC・厩舎直送】べラジオボンドは約2年ぶりの重賞挑戦「心身ともに充実してきました」（東スポ競馬）,https://news.yahoo.co.jp/articles/ead08afed0a9448d69573e38c46afcb33dbe4577,https://newsatcl-pctr.c.yimg.jp/t/amd-img/20260420-00122018-tspkeiba-000-2-view.jpg?exp=10800,2026-04-20T19:25:00+09:00,2026-04-20T23:09:30+09:00,東スポ競馬,tspkeiba,東スポ競馬,590,ベラジオボンド ［GⅡマイラーズカップ＝2026年4月26日（日曜）京都競馬場、4歳上、芝外1600m］ マイルの準オープン、リステッドを連勝中のベラジオボンド（牡5・上村）が重賞の舞台に帰ってきた。グレードレースへの出走は2024年5月の京都新聞杯（14着）以来、約2年ぶり。「このメンバーでどれだけやれるか…ですが、心身ともに充実してきましたし、楽しみですね」と、担当の黒野助手は期待を口にする。 1勝→2勝クラスと連勝を果たしながら、準オープン卒業には5戦を要した。その要因は集中力にあったが、ここにきて上昇気運。再度のブリンカーを着用に加えて「まじめに走らない馬で、しっかり指示を待ってこたえられるように常歩（なみあし）、普通キャンターから調整してきました」と、普段から調整を工夫してきたことが実を結びつつある。 今回は2走前に勝利した北村友とのコンビが復活。1週前追いで手綱を取り、栗東ウッド3頭併せで好時計をマークした（6ハロン81・8―36・8―11・1秒）。「（北村）友一も〝すごく良くなっている〟と言ってくれていますし、いい状態ですね。千八ももつと思いますが、気持ちが抜けてしまう面があります。その点、前走の時計（1分32秒0）も良かったですし、今はマイルが合っているのかなと思います」と同助手。崩れ知らずの距離で、3連勝での重賞初Vへと虎視眈々だ。 和田 慎司,[],[]
【マイラーズC・厩舎直送】立て直して復調気配のアドマイヤズーム「GⅠを勝った馬だけのことはある」（東スポ競馬）,https://news.yahoo.co.jp/articles/b761f610c2ff5babc67c3b12abba9cc2e560b82a,https://newsatcl-pctr.c.yimg.jp/t/amd-img/20260420-00122023-tspkeiba-000-1-view.jpg?exp=10800,2026-04-20T18:05:00+09:00,2026-04-20T18:05:00+09:00,東スポ競馬,tspkeiba,東スポ競馬,569,アドマイヤズーム ［GⅡマイラーズカップ＝2026年4月26日（日曜）京都競馬場、4歳上、芝外1600m］ 安田記念を見据えるメンバーが集う中にあって、ひときわ注目されるのがアドマイヤズーム（牡4・友道）だ。昨秋はマイルCSを目指しながら、態勢が整わず回避。今回、スワンS（6着）以来6か月半ぶりの実戦復帰を迎える。 1週前には新たにコンビを組む武豊を背に、栗東ウッドでブラックオリンピア（青葉賞出走）を相手にせず追走先着（7ハロン95・6―11・0秒）。「ツメの影響があり歩様の硬さが出ていた馬で、以前は遠慮していた面もあったのかなと思います。それが取れて思い切り動けるようになり、いい動きを見せていました。改めて〝GⅠを勝った馬だけあるな〟と能力の高さを感じましたし、ジョッキーもいい感触をつかんでくれましたので」と大江助手は再始動戦への手応えを口にする。 舞台は朝日杯FSで2歳マイル王者に輝いた、淀のマイル戦（※阪神競馬場工事のため京都で開催）。それ以来、勝ち星からは遠ざかっているものの「もともとずっといい体ですが、馬体に伸びやかさが出てきたかなという感じがします。久々が気になるタイプではありませんし、この馬は〝こんなもんじゃない〟と思っています」とキッパリ。レジェンドを背に、思い出の地で完全復活を果たす算段だ。 和田 慎司,[],[]
【マイラーズC展望】武豊と新コンビ・アドマイヤズームが復活Vに虎視眈々　オフトレイルは得意の京都で一変なるか（東スポ競馬）,https://news.yahoo.co.jp/articles/50e4d88e97175b92bdc76c434b02f984df59041a,https://newsatcl-pctr.c.yimg.jp/t/amd-img/20260420-00122028-tspkeiba-000-1-view.jpg?exp=10800,2026-04-20T17:55:00+09:00,2026-04-20T17:55:00+09:00,東スポ競馬,tspkeiba,東スポ競馬,1311,左上から時計回りにウォーターリヒト、アドマイヤズーム、オフトレイル、ベラジオボンド ［GⅡマイラーズカップ＝2026年4月26日（日曜）京都競馬場、4歳上、芝外1600m］ JRAの関西圏開催は今週から6週間にわたって京都が舞台となる。開幕週のメインは、優勝馬に安田記念（6月7日＝東京芝1600m）の優先出走権が与えられるマイラーズC。2頭のGⅠ馬を含む重賞ウイナー10頭が登録しており、激戦が予想される。 近3年は、中団以降から差し脚を伸ばした馬が1、2着を独占。外回りのマイル戦で前々から押し切ることは容易ではない。また、10年前に3連単28万円超の波乱があった以外は、ほぼ平穏な決着となっている。無理な穴狙いは禁物という傾向だ。 アドマイヤズーム（牡4・友道）が注目の始動戦を迎える。一昨年の朝日杯FS勝ち馬だが、昨年はNHKマイルCで14着と大敗し、捲土重来を期したスワンSも6着に終わった。そこで陣営は目標のマイルCSを諦め、立て直しを決断。約6か月半の休養を経て、新たに武豊を配してリスタートに臨む。1週前追い切りでは僚馬ブラックオリンピア（青葉賞出走予定）に大きく先着。仕上がりは上々で、復活Vが期待される。 東京新聞杯で10着と完敗を喫したオフトレイル（牡5・吉村）だが、京都は〈3・3・1・1〉と抜群の好成績。唯一の着外も昨秋のマイルCS4着なら、まさしくこの舞台が〝庭〟といえる。主戦・菅原明が負傷により休養中のため、岩田望との新コンビを結成。ドル箱コースに替わって前走からの一変をもくろむ。 その東京新聞杯で3着だったのがウォーターリヒト（牡5・石橋）。4コーナーでオフトレイルが外側に斜行（菅原明に過怠金1万円の制裁）したことによる不利を受けながら、0秒1差まで巻き返した。京都コースでは勝ち星こそないものの、昨秋のマイルCS3着が示すように全く問題ない。3年目の高杉にとっては、待望の重賞勝ちを成し遂げる大きなチャンスだ。 今年に入って新春S（3勝クラス）、六甲S（リステッド）とマイル戦で連勝しているベラジオボンド（牡5・上村）も侮れない。デビュー当初はクラシックも意識したローテーションだったが、3歳夏に初めてのマイル戦を快勝。この距離では〈3・0・1・0〉と底を見せていない。GⅠを見据える上で、ここは賞金加算が不可欠だ。 なかなかリズムを取り戻せないものの、昨秋のマイルCSでは差のない5着だったエルトンバローズ（牡6・杉山晴）、大阪城Sを好タイムで制したドラゴンブースト（牡4・藤野）、京都金杯2着、ダービー卿CT3着とあと一歩で重賞タイトルに手が届きそうなファーヴェント（牡5・藤原）、実績ある京都に戻って見直したいランスオブカオス（牡4・奥村豊）、ハンデ重賞ながら連続3着と軌道に乗ってきたショウナンアデイブ（牡7・高野）、転厩初戦で久々の芝に挑むシックスペンス（牡5・田中博）、昨年の覇者ロングラン（セン8・和田勇）など全く差を感じないメンバーがエントリーしている。上半期のマイル王を目指す馬たちの前哨戦は、GⅠシリーズの谷間ながら見応えたっぷりといえそうだ。 東スポ競馬編集部,[],[]
エリオネ・シャベスが地方通算23戦目で初勝利「なるべく多く勝ち続けることが次の目標です」【浦和5R】（東スポ競馬）,https://news.yahoo.co.jp/articles/d0555ffafbbc12491f166a77fa879300340415f1,https://newsatcl-pctr.c.yimg.jp/t/amd-img/20260420-00122048-tspkeiba-000-1-view.jpg?exp=10800,2026-04-20T17:49:02+09:00,2026-04-20T17:49:02+09:00,東スポ競馬,tspkeiba,東スポ競馬,274,地方競馬初勝利を挙げたエリオネ・シャベス(中) 9日に短期免許を取得したブラジル出身でスウェーデン国籍のエリオネ・シャベス（42＝大井・藤田輝）が20日、浦和5Rを5番人気ヨルデモアーサーで制し、地方競馬通算23戦目でうれしい初勝利を飾った。 中団待機から4角までに内めを進出すると、直線で逃げ馬を捕らえ、1馬身半差でゴール。シャベスは「うれしいです。最初の大井開催ではたくさん乗ったのですが勝てなかったので、浦和で勝てて良かったです。スウェーデンに戻るまでに、なるべく多く勝ち続けることが次の目標です」と日本での初勝利を喜んだ。 東スポ競馬編集部,[],[]
20日の水沢競馬は地震の影響で10R以降とりやめ　ライブ映像には揺れの衝撃が克明に（東スポ競馬）,https://news.yahoo.co.jp/articles/726414f7e9670777d2142b59bbabb1c864d29408,https://newsatcl-pctr.c.yimg.jp/t/amd-img/20260420-00122043-tspkeiba-000-3-view.jpg?exp=10800,2026-04-20T17:24:25+09:00,2026-04-20T17:52:05+09:00,東スポ競馬,tspkeiba,東スポ競馬,287,水沢競馬場 20日午後、北日本を襲った地震の影響で、水沢競馬は10R以降が開催とりやめとなった。 地震が発生したのは10Rの発走直前。各馬がゲート裏で輪乗りをしている最中に激しい揺れが起きた。公式中継映像では、10Rの発売終了を告知した直後、ゲート付近を映す画面が激しく揺れ始め、ついにはカメラの焦点が合わず天井を映すようなシーンも。その後、改めてゲート方向を映し出したが、しばらくは揺れが続いた。 すぐさま地震の影響により発走見合わせとなり、ほどなく津波警報発令のため開催を取りやめることがアナウンスされると、各馬はゲート裏から厩舎へと引き揚げていった。 東スポ競馬編集部,[],[]
【青葉賞・厩舎直送】ヨカオウの前走は敗因が明らか「1回使って調子が上がり、今回は全然違う」（東スポ競馬）,https://news.yahoo.co.jp/articles/18b016dd94fc404c3ef5ead6f11c7dbf06533cd7,https://newsatcl-pctr.c.yimg.jp/t/amd-img/20260420-00122033-tspkeiba-000-1-view.jpg?exp=10800,2026-04-20T17:15:00+09:00,2026-04-20T17:15:00+09:00,東スポ競馬,tspkeiba,東スポ競馬,498,ヨカオウ ［GⅡ青葉賞（ダービートライアル）＝2026年4月25日（土曜）東京競馬場、3歳、芝2400m］ 熊本県産馬として初めてJRA重賞（2021年・北九州記念）を制したヨカヨカの初子ヨカオウ（牡・谷）が、ダービー出走権獲得へ静かに闘志を燃やす。 4か月のブランクがあった前走の山吹賞では、初Vを挙げたときと同じ逃げの手を打てず7着。「ゲートのやり直しがあって馬も〝泡を食った〟のかなと思いますし、馬場の悪い内を通り、外からこられるとやめる面もありました」と、川端助手は振り返る。 中2週となる今回、1週前追い切りは栗東坂路で4ハロン51・7秒の自己ベストをマークした。「それだけ動けるようになってきたのだと思いますし、気持ちも入ってきましたのでそれがいい方に出れば。1回使って調子が上がり、今回は全然違うと思います」と、納得の仕上がりをたどっている。 母も育てた谷潔調教師は来春、定年引退予定。厩舎にはファンレターも寄せられるという。母にも、そして子にも最も近くで寄り添う同助手は「ラストチャンスをつかみたいですね」とポツリ。抽選突破、そしてその先に待つ夢舞台へと思いを込める。 和田 慎司,[],[]
【青葉賞・厩舎直送】上昇カーブ著しいテルヒコウ「コントレイル産駒の初重賞をこの馬で取りたい」（東スポ競馬）,https://news.yahoo.co.jp/articles/baefeea171612786d972acc67a7d0bc7d5e1ce31,https://newsatcl-pctr.c.yimg.jp/t/amd-img/20260420-00122013-tspkeiba-000-1-view.jpg?exp=10800,2026-04-20T16:25:00+09:00,2026-04-20T16:25:00+09:00,東スポ競馬,tspkeiba,東スポ競馬,685,テルヒコウ ［GⅡ青葉賞（ダービートライアル）＝2026年4月25日（土曜）東京競馬場、3歳、芝2400m］ 昨年から春の東京開催オープニングへと、1週前倒しされた青葉賞。2枚のダービー切符争奪戦で展開のカギを握りそうなのがテルヒコウ（牡・矢作）である。 今春は弥生賞から1週スライドしてスプリングS（14着）で始動し、中1週で大寒桜賞を逃げ切り。その後は在厩調整でダービートライアルに向かうプランだ。「使うごとにカイバ食いが良くなって、どんどん調子は上がってきています」と担当・藤田厩務員は、3走目での上昇カーブを感じ取っている。 現時点ではプラス10キロほどで「輸送もありますし、競馬が近いことを分かっている感じはしますが、プラスでは出せるのではと思います。前走後もしっかり調教を積めて、長めから乗ってもガタッとこず、いい状態ですね」と愛馬を頼もしく見つめた。 デビュー戦ではエムズビギン（のちにきさらぎ賞2着、京都新聞杯出走予定）を下し、続く東京スポーツ杯2歳Sでも、先週の皐月賞に出走した3頭に次ぐ4着。「まだトモが緩いなかでも、ポテンシャルが高い馬。2400mはもつと思っていますし、開幕週でマイペースで行ければですが、そこはジョッキーも信頼できますので」と坂井に託す構えだ。 ロックバンドGLAYのボーカルTERUが名付け親（馬主は小田吉男氏）というファン多き若駒には、このレースで果たしたいことがある。「コントレイル産駒の初重賞をこの馬で取りたいですし、多くの方に応援してもらっているので、ここでいい競馬をしてダービーに出走したいですね」 東スポ競馬編集部,[],[]
地方競馬ジョッキーズチャンピオンシップを6月2日に船橋で開催　14人の名手がWASJの出場権を争う（東スポ競馬）,https://news.yahoo.co.jp/articles/15ab33c15410cb86830235b9dcc1dd2e099bd7e6,https://newsatcl-pctr.c.yimg.jp/t/amd-img/20260420-00122038-tspkeiba-000-1-view.jpg?exp=10800,2026-04-20T16:12:42+09:00,2026-04-20T16:12:42+09:00,東スポ競馬,tspkeiba,東スポ競馬,486,昨年優勝した本田正重は札幌で活躍。2年連続の出場を狙う NAR（地方競馬全国協会）は20日、「2026地方競馬ジョッキーズチャンピオンシップ」の開催概要および出場予定騎手を発表した。 開催は6月2日、船橋競馬場で3競走を実施。出場騎手は、昨年4月1日から今年3月31日までの地方競馬における勝利数順位で各所属場1位となった騎手12人と、選定委員会が認めた2人を加えた計14人で構成される。 このイベントは、8月22、23日にJRA札幌競馬場で行われる「ワールドオールスタージョッキーズ（WASJ）」に推薦する地方競馬代表騎手の選定競走として実施。3戦の合計得点で順位を決定するもので、優勝騎手が地方競馬代表、準優勝騎手が補欠としてWASJへ推薦される。出場騎手は次の通り。 石川倭（北海道） 山本聡哉（岩手） 中山遥人（浦和） 本田正重（船橋） 笹川翼（大井） ※矢野貴之（大井） 野畑凌（川崎） 中島龍也（金沢） 渡辺竜也（笠松） 望月洵輝（愛知） 吉村智洋（兵庫） ※小牧太（兵庫） 永森大智（高知） 飛田愛斗（佐賀） ※は選定委員会が特に認めた騎手 東スポ競馬編集部,[],[]
【青葉賞展望】〝底力〟を見せるのは？注目の的はブラックオリンピア　安定感あるノーブルサヴェージは無傷のV3へ（東スポ競馬）,https://news.yahoo.co.jp/articles/a7c44dce14ecf61e1bf254da066fdc11e3a6f09a,https://newsatcl-pctr.c.yimg.jp/t/amd-img/20260420-00122003-tspkeiba-000-1-view.jpg?exp=10800,2026-04-20T16:05:00+09:00,2026-04-20T16:05:00+09:00,東スポ競馬,tspkeiba,東スポ競馬,1475,左上から時計回りにテルヒコウ、ブラックオリンピア、ノーブルサヴェージ、ラストスマイル ［GⅡ青葉賞（ダービートライアル）＝2026年4月25日（土曜）東京競馬場、3歳、芝2400m］ 8週間の中山開催が終わり、新緑が目にまぶしい春の東京開催が幕を開ける。開幕週は、土日ともに3歳馬のGⅡがメイン。土曜は1、2着にダービー（5月31日＝東京芝2400m）の優先出走権が与えられるトライアル・青葉賞が行われる。 ダービーと同じ舞台で施行されるトライアルという位置付けながら、重賞昇格から32年、指定オープンとして施行されていたそれ以前も含めて、いまだ本番の勝ち馬は出ていない。ただ、昨年の勝ち馬エネルジコは秋に菊花賞馬に輝いており、歴史に名を連ねるシンボリクリスエスやゼンノロブロイ、フェノーメノなどと同様、底力のある馬が勝つレースということを証明した。 今年も、夢の大舞台を目指して25頭の若駒がエントリー。確実に出走できる馬はそのうち10頭いて、登録時点では賞金400万円の1勝馬が8頭分の出走枠をめぐって15頭で抽選という図式になっている。1勝馬にとっては、レースの前にまず出走枠に入ることから戦いが始まっている状況だ。 2勝馬の中でも、未勝利（京都芝外2200m）とアザレア賞（阪神芝外2400m）を連勝中のブラックオリンピア（牡・友道）が注目の的。いかにも距離が延びて良さが出るタイプで、デビューから川田が乗り続けている点にも期待の大きさがうかがえる。東京コースはデビュー戦（芝2000m＝ハナ差2着）で経験済み。ここをきっちりと勝てるようなら、皐月賞馬ロブチェンに堂々と挑戦できるだけの下地が整う。 ノーブルサヴェージ（牡・森一）は新馬戦（東京芝2000m）と水仙賞（中山芝外2200m）で無傷のV2。かなりの大型馬で本格化はまだ先という印象だが、レースぶりは大人びたもので安定感がある。新たにレーンを鞍上に迎えて臨む一戦。3連勝でのダービー挑戦を目指す。 青葉賞と相性がいいことで知られる中京・大寒桜賞を制したのはテルヒコウ（牡・矢作）。マイペースに持ち込み、まんまと逃げ切った。ハナを切ったときは大崩れがなく、前走でスタミナの豊富さも示している。ここも自分の競馬ができるようなら、コントレイルの初年度産駒としていち早くダービー切符をつかむシーンがありそうだ。 ロブチェンで皐月賞を制した杉山晴厩舎は、シャドウマスター（牡）を送り込む。前走は阪神芝外2400mのゆきやなぎ賞で、しぶとい伸びを見せて差し切った。初コースで左回りも未経験だが、距離適性は十分。手の内に入れている北村友とのコンビで、権利獲得を狙う。 経験豊富で決め手のあるノチェセラーダ（牡・杉山佳）、ジュニアC5着、弥生賞6着と大きく負けていない川崎のコスモギガンティア（牡・河津裕）、東京で2勝を挙げているラストスマイル（牡・本間）なども十分に上位争いが見込める素材だ。 出走の可否にやきもきするとはいえ、侮れない1勝馬も多数いる。京都2歳S3着の実績があり、新たに武豊とコンビを組むゴーイントゥスカイ（牡・上原佑）、ゆりかもめ賞で惜敗したもののスケールは大きいアローメタル（牡・木村）、ホープフルS（6着）で目を引く伸びを見せたオルフセン（牡・斎藤誠）、京成杯、弥生賞でともに0秒3差4着と健闘が続くタイダルロック（牡・武井）、新馬1戦のみのキャリアながら勝ち方が鮮烈だったヴィサージュ（牡・大久保）なども、出走枠に入ってきた場合は高い評価が必要となる。 東スポ競馬編集部,[],[]
