headline,mainEntityOfPage,image,datePublished,dateModified,author,media_en,media_jp,str_count,body,images,external_links
【フローラS展望】決め手非凡ラフターラインズか、唯一の芝2勝馬ファムクラジューズか？　大一番へ向けた熱戦！（東スポ競馬）,https://news.yahoo.co.jp/articles/bfacf1812d379aebd0cc69cb6ab13611f6a37c83,https://newsatcl-pctr.c.yimg.jp/t/amd-img/20260420-00121998-tspkeiba-000-1-view.jpg?exp=10800,2026-04-20T15:30:00+09:00,2026-04-20T15:30:00+09:00,東スポ競馬,tspkeiba,東スポ競馬,1574,左上から時計回りにラフターラインズ、ラベルセーヌ、エンネ、ファムクラジューズ ［GⅡフローラステークス（オークストライアル）＝2026年4月26日（日曜）東京競馬場、3歳牝、芝2000m］ 桜花賞はスターアニスが貫禄V。すでに2冠目のオークスへ向かうことが発表されており、牝馬クラシック路線は現状、1強ムードが色濃く映る。昨年はフローラSを制したカムニャックがオークスを制覇。フローラS勝ち馬による15年ぶりの優勝で、今年はより一層注目度が高まる。新たな主役に名乗り出る馬が現れるのか。登録馬は16頭にとどまり、全馬が出走枠の懸念を抱くことなくトライアルに臨める。大一番の権利奪取へ、新緑の府中で展開される熱い戦いが見ものだ。 特に牝馬の活躍馬が目立つ名門牝系〝バラ一族〟のラフターラインズ（小笠）は、きさらぎ賞で牡馬相手に鋭い決め手を発揮。タイム差なしの3着と好走した。ゲートや折り合いなどの課題を残すものの、ここまで4戦すべてメンバー最速の上がりをマークするなど決め手は非凡。ひと息入れたことで精神面の成長があれば、ここは頭一つ抜け出た存在になり得る。未勝利戦完勝の実績がある東京コースで、1ハロンの距離延長もプラスに働きそうだ。鞍上には、母の全妹スタニングローズをオークス2着（10番人気）に導いたレーンがスタンバイしている。 未勝利－フリージア賞と目下2連勝のファムクラジューズ（黒岩）は、今回のメンバーでただ一頭、芝で2勝を挙げている実績の持ち主。4戦続けての東京芝2000m戦となる。小柄ながらもパワフルな走りが特徴的。近2走は2～3番手から積極的な競馬を見せており、先行策が板についてきた。3馬身半差の完勝だった未勝利戦以来となる横山武とのコンビで、オークスの切符を目指す。 スタニングレディ（高木）はファムクラジューズと同じベンバトル×ディープインパクトの配合で、同じくサラブレッドクラブ・ラフィアンの所有馬。距離延長の前走で牡馬相手に3着と奮闘した。トビが大きく、広い東京コースは強みを生かせる舞台といえる。デビュー2戦目でGⅠへ駒を進めた（阪神JF11着）ように、期待の大きな素材。左回りの2戦で1、3着と良績が集まる点も見逃せない。牝馬同士でこの条件なら、上位進出も十分可能だろう。鞍上は三浦を予定している。 ラベルセーヌ（鹿戸）は経験馬相手のデビュー戦だった前走が秀逸。後方10～11番手で脚をためると、直線は大外からメンバー最速の上がりで差し切り、5馬身差の圧勝劇を披露した。勝ちタイムは前日に行われたGⅢ中山牝馬Sよりも0秒1速いもの。中山芝1800mの未勝利戦においては、歴代最速という優秀さだった。経験値は低いものの、秘めた能力は計り知れない。前走に続き、荻野極とのコンビで3歳牝馬路線の勢力図を塗り替えにかかる。 キズナ産駒で、半兄にディスペランツァやファントムシーフといった重賞勝ち馬がいるエンネ（吉岡）。こちらもラベルセーヌ同様、経験馬相手に豪脚を披露して初陣Vを決めた。阪神芝1800mの未勝利戦としては歴代7位タイのタイムながら、デビュー戦の記録に限定すれば歴代2位。歴代最速のウエストナウは続くGⅡ京都新聞杯で2着と好走している。前走時が524キロという馬格を誇り、大物感を漂わせるスケールの持ち主。ディーとの初コンビも興味深い。 他にも、未勝利戦でのちのスプリングS勝ち馬アウダーシアを差し切ったゴバド（加藤征）、成長著しいサムシングスイート（伊藤大）、ダート戦とはいえ連勝中で本格化ムード漂うペンダント（池江）、前走の好タイムVが光り、松山とのコンビが魅力のリアライズルミナス（橋口）、先週のレースで出走取り消しとなったものの潜在能力が高いロングトールサリー（福永）なども侮れない。 東スポ競馬編集部,[],[]
【クイーンエリザベス2世C】マスカレードボール〝過去イチ〟仕上げで海外攻略へ　手塚貴久調教師「力強さ出てきた」（東スポ競馬）,https://news.yahoo.co.jp/articles/2b9d71582ac243b7ebc8a9816bda5956625f5b71,https://newsatcl-pctr.c.yimg.jp/t/amd-img/20260420-00121983-tspkeiba-000-1-view.jpg?exp=10800,2026-04-20T11:55:00+09:00,2026-04-20T11:55:00+09:00,東スポ競馬,tspkeiba,東スポ競馬,1700,［GⅠクイーンエリザベス2世カップ＝2026年4月26日（日曜）シャティン競馬場、3歳上、芝2000m］ 今週末の中央競馬は春のGⅠシリーズの中休み。それでも海の向こうの香港では香港チャンピオンズデー（26日、シャティン競馬場）が開催され、日本馬の参戦、そして海外馬券発売と目が離せない日曜日となりそうだ。中でも注目はクイーンエリザベス2世C（芝2000m）に出走する天皇賞馬マスカレードボール（牡4・手塚久）。昨年のジャパンカップで世界最強馬カランダガンに肉薄した力を海外でも遺憾なく発揮できるのか？ ゼッケン番号「1」の意味 カランダガンとの名勝負は昨年、世界トップのレーティングが付いた 言うまでもなく強く、そして速いマスカレードボールが2026年の始動戦を海外の地でスタートさせる。昨シーズンは共同通信杯で重賞初制覇を飾ると、皐月賞3着→日本ダービー2着。春は世代の最前線を突っ走り、迎えた古馬初対決の天皇賞（秋）でGⅠ初制覇を決めた。 続くジャパンカップはスーパーレコード決着でアタマ差の2着に好走。“世界最強馬”カランダガンとの大接戦は記憶に新しいが、そのカランダガンはドバイシーマクラシックを快勝。さらに同じ4歳世代のダービー馬クロワデュノールが大阪杯を勝利したことで現4歳世代の強さが再証明された。 ライバルのハイパフォーマンスによって、走らずとも自身の評価が上がる、という状況で迎える今季初戦。昨年のジャパンカップでの走りが評価され、ロンジンワールドベストレースホースランキングではレーティング128を獲得した。クイーンエリザベス2世Cのゼッケン番号は「1」を背負うこととなっており、これが意味するものはメンバー中、レーティングナンバーワンということ。香港国内を合わせてGⅠ13勝を挙げる香港最強馬ロマンチックウォリアーが中心となるメンバーとはいえ、数字上は“最強馬”として初の海外GⅠに臨む。 「今回は胸を借りる立場」 調教パートナーの嶋田騎手に指示を伝える手塚貴久調教師 もちろん、さまざまな不測の事態も起こりうる海外遠征だけに、管理する手塚久調教師は慎重な姿勢を崩さない。「海外遠征も初めてですし、手探りで行かないといけない部分はあります。こちらではしっかりとやりましたが、馬がどういう反応するのかは読めないです。レーティングはその時のたまたまで、絶対能力にはならないと思います。強い馬がたくさんいるので、今回は胸を借りる立場だと思います」 国内での調整はすこぶる順調だ。中東情勢を鑑みてドバイ遠征を自重したことは誤算と言えば誤算だろうが、「（遠征中止は）仕方ないことですからね。今回は3週続けてウッドでやってきましたし、いい感じに仕上がっています」（同師）とその影響は皆無。しかも、「ぬるい仕上げではだめだから、トレセンに来てからは一番中身のある調教をやってきました」とタフな戦いになることを踏まえて“過去イチ”の仕上げで臨むことを明かした。実際、国内最終追いで併せ馬を楽々と先着した脚色からは体調の良さがうかがえる。 香港はこの時期、雨期が始まるタイミングでパワーがより必要となる馬場となる可能性も。そこに関しても「しなやかさより力強さが出てきました」というのなら問題あるまい。3歳時は精神面での課題も多かったマスカレードだが、「検疫厩舎に入っても雰囲気は変わらずきています」と古馬となって心身ともにスケールアップしている。 舞台はコーナー4つの右回り2000m。初めての海外の環境だけでなく、東京中心に左回りの広いコースで実績を残してきたマスカレードにとってコースへの対応もカギになろう。そのうえで前出ロマンチックウォリアーやソジー（昨年の凱旋門賞3着）らを相手にどんな走りができるか？ 今後の“世界戦略”のいいモノサシとなる一戦だろう。海外遠征も、ツーターンの右回りも、香港最強馬や凱旋門賞3着馬も、すべてまとめて乗り越えての海外GⅠVとなれば…。クロワデュノールやミュージアムマイルとともに“強い4歳世代”が日本だけでなく世界も席巻することになりそうだ。 山下 優佑,[],[]
【皐月賞・レース回顧】桜花賞と違って2冠目につながる一戦　別路線組で楽しみが持てる一頭とは（東スポ競馬）,https://news.yahoo.co.jp/articles/04240cf8e5fe32389630b65cd725c8f0dad9c4b0,https://newsatcl-pctr.c.yimg.jp/t/amd-img/20260420-00121993-tspkeiba-000-1-view.jpg?exp=10800,2026-04-20T11:30:03+09:00,2026-04-20T11:30:03+09:00,東スポ競馬,tspkeiba,東スポ競馬,1690,松山弘平の好騎乗が光ったロブチェン ［GⅠ皐月賞＝2026年4月19日（日曜）中山競馬場、3歳牡牝、芝内2000m］ 【松浪大樹＆山河浩 私たちはこう見た】 山河 ロブチェンの逃げには驚きましたけど、この日の馬場傾向を思えば…好騎乗ですよね、明らかに。 松浪 好スタートを切った前走でも控えたわけだし、今回も似たような形なのかなと思ったけど…。引き出しがあるね、馬も騎手も。 山河 いや、本当に。二枚腰を使った直線の攻防に注目は集まるでしょうけど、それができる位置で運んだこと、その場所にいたこと。これが大きいですよね。 松浪 うん、それが勝因だと思う。前走で逃げていた馬がいないし、外枠でもあったのでリアライズシリウスが積極的に行くのかな…と思っていたんだけど、譲らなかったね。 山河 パドックでの雰囲気も良かったですし、さすがはGⅠ馬という貫禄もありましたけど、この時計で走れるかどうかは未知数でした。 松浪 俺もそこが気になって、▲にしちゃったんだよな。ホープフルSの時計は大したことがないし、長距離GⅠ馬のワールドプレミア産駒だし。 山河 でも、冷静に考えれば、ワールドプレミアはマイラーズCをレコード勝ちしているワールドエースの全弟。 松浪 そう。バックボーンはあったよな。 山河 共同通信杯は3着でしたけど、速い時計で走っています。ここも見ておくべきでした。 松浪 この勝利で中山巧者のイメージがさらにつきそうだけど、東京に行ってマイナスになることはないと思うよ。あとはリアライズシリウスにどれだけ上げ幅があるかじゃないかな。あっちは東京でしょ？ 山河 いい感じで走ってはいましたけど、やっぱり広いコースでこそですか。 松浪 そう思うね。ロブチェンと体重はそこまで変わらないけど、こちらのほうがフットワークが大きいし、東京のほうが伸び伸びと走れる。左回りは3戦3勝でもあるし。 山河 父はポエティックフレア。僕は距離がどうかなと思ってもいるんですけど、手塚久調教師はそこの心配をしていないみたいなんですよ。皐月賞を走る前から「ダービーに向けて、どんな走りをしてくれるか？」。そんなことを言っていましたから。 松浪 俺も全く心配していない。いつも言うようにダービーは2000mの馬のレースと思っているから。ロブチェンもそうだけど、この馬もダービーに向けて悪く言う部分がないし、普通に上位争い。 山河 距離がマイルの桜花賞は上位陣の顔触れも短距離色が強かった。オークスにつながるかどうかは微妙とのジャッジにしましたけど、今回は違います。3着だったライヒスアドラーもいいですし、上位はそれなりに走ってきそう。 松浪 馬群をさばいてきた5着フォルテアンジェロはダービーで面白そうな気がする。逆に4着アスクエジンバラは競馬が上手で成長度も著しいけど、勝つまでのインパクトはないかな。 山河 朝日杯FSから直行してきたカヴァレリッツォは？ やっぱり距離ですか？ 松浪 そう思うね。 山河 アドマイヤクワッズも。 松浪 これは反省しなくちゃいけないことなんだけど、速い時計の決着になれば、コース形態を問わず、短い距離の適性を持つ馬のほうがいいと思っていたんだ。特に最近の芝の傾向を考えた場合は。 山河 でも、阪神のマイルと中山2000mでは全く違った。 松浪 速い流れになるとスピード能力が求められる阪神外回りコースと、逆にスタミナが求められる中山コース。ギアを上げていく場所の違いか、求められているトップスピードの長さの違いか。いずれにしろ、それを理解したという意味で価値の高い一戦だった。個人的にはね。 山河 ちなみに別路線組からのダービーは？ 松浪 この結果で一気に注目を浴びるのは共同通信杯の2着馬（ベレシート）じゃないの？ この2頭の間にいても不思議がない…ということになるからさ。 山河 なるほどね。では、その馬の復帰戦を楽しみに。 松浪 来週の青葉賞もそろそろ感があるから、一応は注目しておきたい。でも、この2頭の牙城を崩すのは厳しそうな気がするよ。 東スポ競馬編集部,[],[]
ロブチェンは皐月賞Vから一夜明けて馬房でのんびり「松山をダービージョッキーにしてあげたい」（東スポ競馬）,https://news.yahoo.co.jp/articles/38d1fadee8797ee508e9ab6be59ab300554f60d8,https://newsatcl-pctr.c.yimg.jp/t/amd-img/20260420-00121988-tspkeiba-000-2-view.jpg?exp=10800,2026-04-20T11:20:33+09:00,2026-04-20T16:45:52+09:00,東スポ競馬,tspkeiba,東スポ競馬,733,激闘から一夜明けたロブチェンは馬房で元気な姿を見せた ［GⅠ皐月賞＝2026年4月19日（日曜）中山競馬場、3歳牡牝、芝内2000m］ 19日のGⅠ・皐月賞を制したロブチェン（牡3・杉山晴）はレース翌朝、栗東トレセンの自厩舎で静養に努めた。日付が変わった20日の午前1時ごろ、厩舎に帰厩。「普段からよく寝る子」と担当の房野助手が評するように、居並ぶ報道陣にも動じず、馬房内でくつろぐ姿を見せた。 房野助手はレース当日、ゲートに付き添ったため、検量室まで戻りながらビジョンでレースの様子を確認。「戦法は分かりませんでしたが、前回（共同通信杯3着）よりいいと思ってレースに出せました。リアライズ（シリウス）が来てどうかと思いましたが、差し返してくれましたからね。（ゴール前は）出せるだけの声を出しました」と笑みを浮かべる。 ジョッキーカメラは着用なし 鞍上の松山は前週の桜花賞＝スターアニスに続きクラシック連勝。前週はジョッキーカメラを着用し、〝アニたん〟と呼んだことが話題になったが、この日のカメラ着用はなかった。戻ってきた鞍上をグータッチで出迎えたが「あとで〝ついてないんかい〟となりました（笑い）」と感動的なシーンの舞台裏を明かす。 愛馬はホープフルSに続く2つ目のGⅠ制覇で、押しも押されもせぬ世代のトップとしてダービーへ挑む見込み。「完成度が高いと思われるかもしれませんが、この馬はまだネジが締まってくるでしょうし、現状でも60点くらい。2400mを走れる体力をつけていけるようにしつつ、体調を整えてあげたいです。主導権を取れる馬でもありますし、隙がない。松山をダービージョッキーにしてあげたいですね」と、次なる最高峰の舞台への熱い決意を口にした。 和田 慎司,[],[]
【天皇賞・春登録馬】ここはクロワデュノールが主役！　武豊と相性抜群アドマイヤテラは念願のGⅠ制覇へ（東スポ競馬）,https://news.yahoo.co.jp/articles/f1080f4ba9fc35c594fd72567a5c1d2ab049cdfc,https://newsatcl-pctr.c.yimg.jp/t/amd-img/20260420-00121978-tspkeiba-000-1-view.jpg?exp=10800,2026-04-20T11:05:00+09:00,2026-04-20T11:05:00+09:00,東スポ競馬,tspkeiba,東スポ競馬,666,主役は前走・大阪杯を制したクロワデュノール ［GⅠ天皇賞・春＝2026年5月3日（日曜）京都競馬場、4歳上、芝外3200m］ 京都競馬場で行われるGⅠ天皇賞・春（5月3日＝芝外3200m）の登録馬が19日、発表された。 【表】天皇賞春・登録馬 主役は前走の大阪杯を制し、日本ダービー以来のGⅠ制覇を果たしたクロワデュノール。現役屈指の能力は誰もが認めるところで、今回の課題は相手関係よりも初めて挑む3200mの距離になる。もっとも、血統的な側面から距離不安を取り沙汰されながら、菊花賞、天皇賞・春と2つの長距離GⅠを勝ったキタサンブラックの産駒。クリアしても何ら不思議はあるまい。 相手筆頭には阪神大賞典をレコード勝ちしたアドマイヤテラを挙げたい。ステイヤーとしての資質の高さもさることながら、今回も手綱を取る武豊との相性が抜群。鞍上が「庭」と言い切る淀の舞台で、念願のGⅠ制覇を目指す。 折り合いに難しい面を見せながら、ダイヤモンドSを勝ってしまったスティンガーグラスのスタミナも相当なもの。今回もポイントは折り合い。新しくコンビを組むレーンの手腕に託す部分も小さくなさそうだ。 連覇を狙うヘデントールも能力的には互角以上だが、長期の休み明けだった前走の京都記念が見せ場のない競馬。トップコンディションに戻せるかどうかで、好走確率も大きく変わってくるはず。また、阪神大賞典2着アクアヴァーナル、海外遠征帰りのヴェルミセル、ステイヤーズS覇者ホーエリートの牝馬3頭は1953年レダ以来、史上2頭目の牝馬Vを目指す。 東スポ競馬編集部,[],[]
【皐月賞】3頭出しの上原佑紀厩舎は3、5、7着　ダービーでの巻き返しへそれぞれの課題は？（東スポ競馬）,https://news.yahoo.co.jp/articles/ef8a3b5d8217db17f85a3ee894538d0255c9cd06,https://newsatcl-pctr.c.yimg.jp/t/amd-img/20260420-00121973-tspkeiba-000-1-view.jpg?exp=10800,2026-04-20T07:15:00+09:00,2026-04-20T07:15:00+09:00,東スポ競馬,tspkeiba,東スポ競馬,597,厩舎最先着となったライヒスアドラー ［GⅠ皐月賞＝2026年4月19日（日曜）中山競馬場、3歳牡牝、芝内2000m］ 3頭出しの布陣で挑んだ上原佑厩舎で、最先着となったのは3着ライヒスアドラー（牡）。道中は中団馬群で追走し、直線で外に持ち出されると力強い伸び脚で3着を確保した。スローペースの〝行った行った〟決着となった中、一頭だけ奮闘が目立った形だ。 9番人気での好走となったが、騎乗した佐々木は「前走後は普通キャンターからコンタクトを取って臨みました。しかし課題の折り合い面がこの頭数、そしてGⅠで顕著に出てしまいました…。その課題をダービーまでにクリアしていきたいです」と唇をかんだ。 一方、管理する上原佑調教師は「道中は接触もあって（ハミを）かんでしまい、抜けるのに時間がかかりました。それでも最後はよく伸びていましたし、勝てる力はあると思います。折り合えば2400mでも…と思いますし、次はダービー（5月31日＝東京芝2400m）に行きたいと思います」と、2冠目での巻き返しに期待を寄せた。 僚馬で5着のフォルテアンジェロについては「出遅れがすべて。距離は延びた方がいい」、2番人気で7着グリーンエナジーは「ダービーを見据えた競馬で、結果的に展開が向きませんでした」との弁。ライヒスアドラーとフォルテアンジェロは優先出走権を獲得し、3頭はいずれもダービーに向かう見込みだ。 藤井 真俊,[],[]
【皐月賞】「距離は大丈夫」2着惜敗リアライズシリウス陣営はダービーでの巻き返しに自信！（東スポ競馬）,https://news.yahoo.co.jp/articles/05137c2000d0d652c68b3be0b62336547345ba0f,https://newsatcl-pctr.c.yimg.jp/t/amd-img/20260420-00121968-tspkeiba-000-1-view.jpg?exp=10800,2026-04-20T07:05:00+09:00,2026-04-20T07:05:00+09:00,東スポ競馬,tspkeiba,東スポ競馬,436,2着リアライズシリウス ［GⅠ皐月賞＝2026年4月19日（日曜）中山競馬場、3歳牡牝、芝内2000m］ 2番手追走から、直線では一旦先頭に立つ見せ場をつくったリアライズシリウス（牡・手塚久）が2着。騎乗した津村は開口一番「悔しい～。勝ったと思ったんだけど」と無念の表情を浮かべた。 「ロブチェンが逃げたのは予想外だったけど、強い馬を見ながらうまくいったと思いました。4角では負かしにいって、直線では一度（前に）出たと思ったんですが…。さすがGⅠホースですね」と勝ち馬の勝負根性に舌を巻く。 とはいえ、正攻法で臨んでの堂々たる2着。次走へ向けての視界は明るい。管理する手塚久調教師は「折り合いがついたし、この内容なら2400mのダービーも大丈夫でしょう。次は最後にもうひと踏ん張りできるような仕上げを」と日本ダービー（5月31日＝東京芝2400m）参戦を明言。一方の津村も「距離は大丈夫ですね。また次、頑張りたいです」と大一番でのリベンジに闘志を燃やしていた。 藤井 真俊,[],[]
【皐月賞】「いいポジションを取れました。ただ…」カヴァレリッツォ13着大敗にレーンが語った2つの敗因（東スポ競馬）,https://news.yahoo.co.jp/articles/4caf2bd541519aab2f07c7a8701378710b444299,https://newsatcl-pctr.c.yimg.jp/t/amd-img/20260420-00121963-tspkeiba-000-1-view.jpg?exp=10800,2026-04-20T06:35:00+09:00,2026-04-20T06:35:00+09:00,東スポ競馬,tspkeiba,東スポ競馬,335,まさかの結果に終わったカヴァレリッツォ ［GⅠ皐月賞＝2026年4月19日（日曜）中山競馬場、3歳牡牝、芝内2000m］ 3番人気に推された2歳王者・カヴァレリッツォ（牡・吉岡）は、好位のインからレースを運んだものの直線では伸び切れず、1秒1差の13着と案外な結果に終わった。 騎乗したレーンは「ポジションのキープに脚を使いましたが、いいスタートを決めて、いいポジションを取れました。ただ折り合いは完全にはつかず、その分、最後の直線で伸び切れませんでした。2000mは少し長い感じもします」と敗因を折り合いと距離に求めた。 デビューから3戦すべてマイルを使われて、今回が初めての2000m戦。最優秀2歳牡馬がどこで巻き返しを図るのか、今後の動向が注目される。 藤井 真俊,[],[]
