headline,mainEntityOfPage,image,datePublished,dateModified,author,media_en,media_jp,str_count,body,images,external_links
子どもの貧困問題取り組む団体に支援金　沖縄セルラー子ども基金（沖縄テレビOTV）,https://news.yahoo.co.jp/articles/77e008349f67d99a60cd6651648c01e642e3d3ca,https://newsatcl-pctr.c.yimg.jp/t/amd-img/20260417-90015742-otv-000-1-thumb.jpg?exp=10800,2026-04-17T18:42:02+09:00,2026-04-17T18:42:02+09:00,沖縄テレビOTV,otv,沖縄テレビOTV,331,沖縄テレビ 子どもの貧困問題の解消に取り組む団体に、沖縄県内の企業から支援金が贈られました。 沖縄セルラー子ども基金は県内で子どもの支援に取り組む団体に贈られるもので、沖縄セルラーグループの収益の一部を財源に2016年に設立されました。 10年目となる今年は、母子家庭や若年妊産婦の支援などに取り組む5つの団体に計150万円が贈られました。 県母子寡婦福祉連合会の生田加代子会長は「一人でも多くの生徒が希望する学校に進学し、沖縄の未来を担える人材になってもらえるよう役立てていきます」と感謝しました。 沖縄セルラー子ども基金では、これまで延べ131団体に計4020万円を贈っていて、今後も子ども達のための様々な活動をサポートしていきたいとしています。 沖縄テレビ,[],[]
沖縄自動車道の対面通行規制を全て解除　NEXCO西日本がリニューアル工事（沖縄テレビOTV）,https://news.yahoo.co.jp/articles/629e972c5c5174520ae8f983b7940ca8518df46b,https://newsatcl-pctr.c.yimg.jp/t/amd-img/20260417-90015741-otv-000-1-thumb.jpg?exp=10800,2026-04-17T18:42:02+09:00,2026-04-17T18:42:02+09:00,沖縄テレビOTV,otv,沖縄テレビOTV,380,沖縄テレビ NEXCO西日本は、沖縄自動車道のリニューアル工事が完了し、1月から実施していた対面通行の規制を全て解除したと発表しました。 沖縄自動車道では1月から、石川インターチェンジと許田インターチェンジの区間で老朽化した道路の取り換え工事が行われていました。 金武インターチェンジ～許田インターチェンジまでの交通規制は8日に解除され、16日に残りの石川インターチェンジ～金武インターチェンジの3.4キロ区間の規制が解除されました。 今回のリニューアル工事を巡っては、工事の区間が終日対面通行となったことから朝や夕方に激しい渋滞が起き、NEXCO西日本は作業時間を増やすなどの措置をとって今月下旬を予定していた工事の完了時期を前倒ししました。 NEXCO西日本は、工事に伴う交通規制については渋滞の発生状況を踏まえながら計画していくとしています。 沖縄テレビ,[],[]
うるま市に新消防指令センター完成　機能強化で県内9割の地域をカバー（沖縄テレビOTV）,https://news.yahoo.co.jp/articles/3b736df83c5c1676ce18211336d8accd7488f8c5,https://newsatcl-pctr.c.yimg.jp/t/amd-img/20260417-90015740-otv-000-1-thumb.jpg?exp=10800,2026-04-17T18:42:02+09:00,2026-04-17T18:42:02+09:00,沖縄テレビOTV,otv,沖縄テレビOTV,470,沖縄テレビ うるま市で整備が進められていた沖縄県消防指令センターが完成し、17日に落成式が執り行われました。 県消防指令センターは県内38の市町村からの119番通報を受け付け、出動指令を一元化するものです。 16の消防本部と約300台の消防車や救急車がセンターの指揮下にあり、県内の9割の地域をカバーします。 これまでは嘉手納町にあるセンターで36市町村の119番通報に対応していましたが、設備が老朽化していたことから、うるま市に約80億円をかけて新たに整備。 沖縄市や浦添市も管轄に加わり、機能強化も図られました。 指令室のモニターが10台に増設されたほか、通報内容をリアルタイムで文字化する機能などが導入されました。 県消防通信指令施設運営協議会 福地常勝会長： 最新の通信技術と高度な指令機を備え、県内消防体制の中核としてより一層職務に精励して参る所存でございます 消防指令センターは1日から既に運用を始めており、うるま市の中村正人市長は「関係機関との連携を一層密にし県民の安心安全の確保に引き続き取り組む」と述べました。 沖縄テレビ,[],[]
サンゴ保全で包括連携協定　恩納村とサンシャインシティ（沖縄テレビOTV）,https://news.yahoo.co.jp/articles/4544cf6d9724d7c4cf59f79bc5bedc0b4f54b03c,https://newsatcl-pctr.c.yimg.jp/t/amd-img/20260417-90015739-otv-000-1-thumb.jpg?exp=10800,2026-04-17T18:42:02+09:00,2026-04-17T18:42:02+09:00,沖縄テレビOTV,otv,沖縄テレビOTV,491,沖縄テレビ 沖縄の豊かな海を守り、サンゴ礁の保全に向けた連携を図るため、恩納村と県外の企業が協定を結びました。 恩納村と連携協定を結んだのは、年間3千万人が訪れる東京都池袋の大型複合施設のサンシャインシティです。 水族館などを運営するサンシャインシティは2006年から恩納村とサンゴの保全活動に取り組んでいて、採取したサンゴを水族館で展示しながら育て、増やした苗を再び恩納村の海に返す活動を続けています。 連携協定では、引き続きサンゴの保全に取り組むとともに、恩納村の観光振興と地域資源の魅力の発信にも取り組みます。 株式会社サンシャインシティ 脇英美代表取締役社長執行役員： サンゴプロジェクト20周年となる今年は「実践する」をテーマに掲げ、水族館にお越しになる大勢のお客様とともに東京から恩納村のサンゴを守るために何ができるかを考え、一歩踏み出すきっかけ作りとなる企画を実施して参ります 長浜村長は、海洋環境への思いを共有しながら信頼関係を築いてきたと強調し、今回の協定締結を機に恩納村の海の魅力をより多くの人に伝えられるように情報発信していくと意気込んでいました。 沖縄テレビ,[],[]
救護されたリュウキュウヤマガメが森へ　5カ月間の治療を受けて回復（沖縄テレビOTV）,https://news.yahoo.co.jp/articles/46d2b1fb30a791ce08338fb094a0b00d05f64a75,https://newsatcl-pctr.c.yimg.jp/t/amd-img/20260417-90015738-otv-000-2-thumb.jpg?exp=10800,2026-04-17T12:04:01+09:00,2026-04-17T18:39:01+09:00,沖縄テレビOTV,otv,沖縄テレビOTV,358,沖縄テレビ 2025年11月に大宜味村でけがをして保護されていた国の天然記念物「リュウキュウヤマガメ」が治療を終え、16日にやんばるの森へと帰されました。 このリュウキュウヤマガメは大宜味村喜如嘉の国道58号線の道路わきで見つかり、ひっくり返り甲羅が割れ、頭部から出血し左眼が開かない状態で救護されました。 名護市の動物病院で5か月間治療を受けて回復したリュウキュウヤマガメは、自然へと帰され、ゆっくりと森の中を進んでいきました。 発見者： 車がよく通る時間帯ではあったので、その時に轢かれちゃったのかなって。本当に元気になって良かった やんばるではリュウキュウヤマガメなどの希少生物が住宅地の周辺でも見られることから、環境省は、道路で遭遇した際に避けられるよう注意して運転して欲しいと呼びかけています。 沖縄テレビ,[],[]
那覇の空にひと足早いこいのぼり　市役所で掲揚式（沖縄テレビOTV）,https://news.yahoo.co.jp/articles/09625e852b25e12cdb6dd659046531171c9ce76a,https://newsatcl-pctr.c.yimg.jp/t/amd-img/20260417-90015737-otv-000-1-thumb.jpg?exp=10800,2026-04-17T12:03:02+09:00,2026-04-17T12:03:02+09:00,沖縄テレビOTV,otv,沖縄テレビOTV,362,沖縄テレビ 子どもたちの健やかな成長を願って那覇市では17日、こいのぼりの掲揚式が行われました。 那覇市役所のこいのぼり掲揚式には、市役所の職員や30人の保育園児が参加し、知念那覇市長は「滝に向かって進む龍のように大きく成長して欲しい」と願いを込めました。 子どもたちは「こいのぼり」の歌にあわせて、力いっぱいロープを引き、色とりどりのこいのぼりは元気よく空へ舞いあがりました。 子どもたちは・・・ （Q：どのこいのぼりが好き？） 赤！ （Q：大きくなったら何になりたい？） エルサ！魔法が使えるから 人を守る警察官 （Q：帽子のどこが気に入っている？） 虹色のところ （Q：空のこいのぼり見てどう？） こいのぼりが、こいのぼりダンスしているみたいだった 空を泳ぐこいのぼりの下で、子どもたちの笑顔が弾けました。 沖縄テレビ,[],[]
