headline,mainEntityOfPage,image,datePublished,dateModified,author,media_en,media_jp,str_count,body,images,external_links
獅子頭役が橋から逆さにつるされる神事は必見　千曲市で雨宮の御神事　9年ぶりの通常開催　獅子頭を前後に激しく振り、災いや厄を水に流す【長野】（テレビ信州）,https://news.yahoo.co.jp/articles/3049f6620702b0a16814bd4404bcb46732866de6,https://newsatcl-pctr.c.yimg.jp/t/amd-img/20260429-07858279-tsb-000-2-thumb.jpg?exp=10800,2026-04-29T21:00:00+09:00,2026-04-29T21:07:52+09:00,テレビ信州,tsb,テレビ信州,648,テレビ信州 国の重要無形民俗文化財に指定されている、千曲市の「雨宮の御神事」が、9年ぶりに通常開催されました。最大の見せ場は獅子頭役の男性を橋から逆さにつるす神事は必見です。 9年ぶりに響くお囃子。天狗の面をつけた「御行司」を先頭に、行列が町内を練り歩きます。国の重要無形民俗文化財に指定されている、千曲市の「雨宮の御神事」です。 千曲市内から 「昔、自分も歩いたことがあって、それを思い出しました」 千曲市内から 「懐かしいのと思い出。こういう伝統文化があるのは誇りに思っています」 「雨宮坐日吉神社」の例大祭として3年に一度開かれますが、新型コロナウイルスの影響で2020年は中止。2023年は規模を縮小しての開催でした。 9年ぶりの通常開催となった今回。 境内では、怨霊を振り払い鎮めるための伝統的な踊りが披露されました。 雨宮坐日吉神社・片岡一仁宮司 「時間の隔たりや長さは、感じないですね 。よくみんなこれだけ練習し、その表現をきちんと伝えようとしている姿が、本当に感動しております」 そして、祭りは場所を移し、クライマックスへ…。 先ほど始まった「橋懸り」です。橋の欄干から逆さにつるされた獅子頭役の男性4人。川面で体を反らし、獅子頭を前後に激しく振り続けます。こうすることで、災いや厄を水に流すとの言い伝えがあります。 頭に付いている和紙がはがれ、千曲川を下ってお隣・新潟県に流れ着くころ、雨宮地域の田植えが始まるとされています。祭りはこのあと午後7時半ごろまで続くということです。,[],[]
大町市のそば店が営業再開　18日の最大震度5強の地震で被害　完全復旧していないが…「わざわざ来てくださる人たちを、来て良かったって帰ってもらいたい」【長野】（テレビ信州）,https://news.yahoo.co.jp/articles/397000d68a9acd686c72becdc4a9211c5b3883b7,https://newsatcl-pctr.c.yimg.jp/t/amd-img/20260429-05532112-tsb-000-2-thumb.jpg?exp=10800,2026-04-29T20:24:00+09:00,2026-04-29T20:39:52+09:00,テレビ信州,tsb,テレビ信州,678,テレビ信州 4月18日、県北部を震源とする地震の影響で休業していた大町市のそば店が営業を再開しました。まだ不安が残る中、客の思いに応えたいと前を向いています。 手打ちそば美郷 種山千恵子さん 「片付ける（修理）費用がどのくらいの請求が来るか。考えないことにしている。つらくて」 大町市美麻でそば店を営む種山千恵子さん。店は4月18日に発生した最大震度5強の地震により、食器などが落ちて割れたほか、壁やタイルなどに亀裂が入りました。 あれから11日。店内は片付けましたが、完全に復旧はしていません。 手打ちそば美郷 種山千恵子さん 「大丈夫ということは、とても言えないという状態」 相次ぐ揺れへの不安もあり、休業を続けていましたが…。 手打ちそば美郷 種山千恵子さん 「わざわざ曲がりくねった道を来てくださる人たちを、来て良かったって帰ってもらいたい。初めての人でも今までの人も」 連休中に足を運んでくれる客を迎えたいと、29日は試運転として営業を再開することに。 「いらっしゃいませー」 長野市から 「菜の花の天ぷらおいしいよ、ほくほくで」 大町市内から 「心配していたので、思ったよりも早く復帰してくれていたので、良かったなと思って。おいしいし、しみじみ食べています」 大町市内から 「29日からやるって電話くれたから（来た）。ここのそばは味が全然違う」 昼時は、県内外から続々と客が訪れました。 手打ちそば美郷 種山千恵子さん 「今もやっていますか？っていう電話が来ているから、やれる範囲でやろうと思います。やるしかないなって」 テレビ信州 ◇ ◇ ◇,[],[]
善光寺平を一望　茶臼山恐竜公園に大型ブランコ「CHAUSKY(チャウスカイ)」設置　「長野の風を感じてとても気持ちのいいブランコ」【長野】（テレビ信州）,https://news.yahoo.co.jp/articles/cd54f915af09ee0981848d542e0f1dc15bbbcd55,https://newsatcl-pctr.c.yimg.jp/t/amd-img/20260429-04496872-tsb-000-2-thumb.jpg?exp=10800,2026-04-29T19:45:00+09:00,2026-04-29T19:56:48+09:00,テレビ信州,tsb,テレビ信州,481,テレビ信州 善光寺平を見渡す長野市の茶臼山恐竜公園に現れた大型ブランコ。 公園の新たな目玉にしようと、指定管理者である長野市開発公社の設立60周年を記念して設置されました。一人乗りで地面からの高さは7メートル。小学生以上が乗ることができます。 藤田華穂記者 「いま目の前に長野市の景色が広がっていて、とてもドキドキします。では、行ってきます」 「3・2・1…わーーーーすごい」 「長野市の(まちの)中に飛び込んでいくような体験でした」 スタートから勢いよく飛び出すことができる機械巻き上げ式で、愛称は「CHAUSKY(チャウスカイ)」。県内外から寄せられた168件のアイデアから選ばれました。29日は愛称を考案した女性も乗りました。 大型ブランコの愛称を考案した石井さおりさん 「すごく長野の風を感じて、とても気持ちのいいブランコでした。みんなに乗っていただけたらと思います」 絶景を独り占めできる特別な体験が売りの大型ブランコ。1人1回につき3分間。料金は600円で、茶臼山マレットゴルフ場が開業している11月まで楽しむことができます。 テレビ信州 ◇ ◇ ◇,[],[]
伊那のご当地グルメ“ローメン”楽しむ　高校生以下には無料で振る舞い　「70年食べて続けてきたから、これがないと生きていけません」【長野】（テレビ信州）,https://news.yahoo.co.jp/articles/be9b59abc857e390bbf4cd7c5fe0258a4c370c7d,https://newsatcl-pctr.c.yimg.jp/t/amd-img/20260429-03527958-tsb-000-3-thumb.jpg?exp=10800,2026-04-29T19:21:00+09:00,2026-04-29T19:47:48+09:00,テレビ信州,tsb,テレビ信州,335,テレビ信州 4月29日は語呂合わせで「羊肉の日」。伊那市では、羊肉（マトン）を使ったご当地グルメのローメンを楽しめる春祭りが開かれました。 伊那ローメンズクラブに加盟する25の店などが、地域貢献や消費拡大を目的に開いたもので、今回で14回目。イベント用に特別に味付けされた焼きそば風のローメンが1パック700円で提供され、長い列ができていました。また、高校生以下には無料で振る舞われました。 昭和30年＝1955年ごろに誕生したローメンについて伊那市民は…。 「自分の家で作るので結構子どもも好きなので、割と食べますね」 「私にとっては体がローメンでできていますね。 小さいときから70年間食べ続けてきましたから、これがなくては生きていけません」 テレビ信州 ◇ ◇ ◇,[],[]
安曇野に春告げる早春賦まつり　開催は今年が最後　「地元を歌った感じがすごくして、安曇野の景色と重なるところがあって、ぜひとも復活してほしい」【長野】（テレビ信州）,https://news.yahoo.co.jp/articles/8ba96cb05c166097f1d4087d3d72eec00bcb163b,https://newsatcl-pctr.c.yimg.jp/t/amd-img/20260429-03152932-tsb-000-3-thumb.jpg?exp=10800,2026-04-29T19:09:00+09:00,2026-04-29T19:37:50+09:00,テレビ信州,tsb,テレビ信州,546,テレビ信州 恒例のこちらの行事は今年をもって休止となります。安曇野に春の訪れを告げる早春賦まつりが行われました。 安曇野市ふるさと観光大使 上松美香さん 「いつまでも私にとって、早春賦まつりは心のふるさとだなと感じています」 安曇野市穂高にある歌碑の前で開催された早春賦まつり。唱歌「早春賦」を歌い継ぎたいと1981年に始まり、今年で43回を数えます。これまで地元の有志や小学校の合唱団が歌声を披露していましたが、課外活動の見直しなどから去年、児童の参加が途絶えました。 早春賦まつり実行委員会 中田光男委員長 「（早春賦は）郷土の宝のような思いは、皆さんしているんじゃないかと思います。 みんなで心を合わせて楽しんだり歌ったりして、一区切りにしてもらえればと思っています」 まつりは今年の開催を持って、休止することになっています。 安曇野市の高校1年生 「地元を歌った感じがすごくして、安曇野の景色と重なるところがあって（早春賦まつりが）ぜひとも復活してほしい」 鳥取から 9回目の参加となる 80歳 「(まつりが)最後なんで来てしまいました。とにかく信州が好きでね。安曇野のこの自然にほれたっていうのかな」 歌碑を前に集まった人たちは、再開を願いながら歌いました。 テレビ信州 ◇ ◇ ◇,[],[]
上田市の無言館で成人式　社会学者の古市憲寿さんから新成人に直筆の手紙　「迷って迷って最終的に満足できる人生を送りたい」【長野】（テレビ信州）,https://news.yahoo.co.jp/articles/be38a2c071761a65fe90e369a3b3e7dd6a46c4d6,https://newsatcl-pctr.c.yimg.jp/t/amd-img/20260429-03237779-tsb-000-3-thumb.jpg?exp=10800,2026-04-29T18:59:00+09:00,2026-04-29T19:32:53+09:00,テレビ信州,tsb,テレビ信州,647,テレビ信州 上田市の美術館「無言館」で今年も成人式が行われ、県内外からの19人が出席しました。戦没画学生の絵を29年間守り続ける館主が、新成人に伝えたこととは？ 新緑の中で行われた上田市の美術館「無言館」の成人式。第二次大戦で亡くなった画学生の作品を収蔵・展示する無言館では、2003年から成人式を企画していて、 24回目の今年は県内外から19人の新成人が出席しました。 ゲストは、戦争と若者に関する著書がある社会学者の古市憲寿さん。新成人一人ずつに直筆の手紙を手渡しました。 開館から29年、画学生の絵を守りながら館主を務める窪島誠一郎さん。今、新成人に伝えたかったのは…。 窪島誠一郎さん 「84歳のおじいさんになっても迷っています。AIやSNSでは答えは探すのは簡単ですけれど、問い掛けを探すのは大変です。皆さん、自分を問うてください。そして、84のジジイが言います。永遠に答えは出ません。迷うのが人生です。頑張って迷いましょう」 丸山珠礼さん(20) 「問い続けることが大切だよっていうお話があったと思うんですけど、今自分自身すごく迷い続けているんですけど、それに安心して生きていっていいんだなと思いました」 河西俊太朗さん(20) 「頑張って迷ってほしい。でも、答えは出ないというふうにおっしゃっていて、もがきながらでも迷って迷って最終的に満足できたら、そんな人生を送りたいなって」 迷うことは、自分を問うこと。戦没画学生の絵と向き合う新成人たちは、迷いながらの一歩を踏み出しました。,[],[]
小諸市で軽トラックと軽乗用車が出合い頭に衝突　軽トラック運転の78歳男性が重体　軽乗用車運転の67歳女性が大けが　信号や標識のない交差点【長野】（テレビ信州）,https://news.yahoo.co.jp/articles/08fa3f1c3ff670876f54f44b19d0fdea3958c277,https://newsatcl-pctr.c.yimg.jp/t/amd-img/20260429-07113376-tsb-000-4-view.jpg?exp=10800,2026-04-29T16:15:00+09:00,2026-04-29T19:37:50+09:00,テレビ信州,tsb,テレビ信州,185,テレビ信州 29日正午すぎ小諸市耳取の市道交差点で、軽トラックと軽乗用車が出合い頭に衝突しました。 この事故で、軽トラックを運転していた小諸市市に住む無職の男性(78)が意識不明の状態で、佐久市内の病院に搬送されました。軽乗用車を運転していた佐久市跡部に住む無職の女性(67)が首の骨を折る大けがです。 現場は、信号や標識のない交差点で、警察が事故の原因を調べています。,[],[]
「長野の風を感じてとても気持ちいい」　大型ブランコ「CHAUSKY（チャウスカイ）」登場　長野市の茶臼山恐竜公園の新たな目玉に【長野】（テレビ信州）,https://news.yahoo.co.jp/articles/5d27c386235795e7be29f4efc5a4bd448e1be258,https://newsatcl-pctr.c.yimg.jp/t/amd-img/20260429-04546196-tsb-000-3-thumb.jpg?exp=10800,2026-04-29T12:02:00+09:00,2026-04-29T12:19:52+09:00,テレビ信州,tsb,テレビ信州,409,テレビ信州 長野市の茶臼山恐竜公園に大型ブランコ「CHAUSKY（チャウスカイ）」が設置され29日、オープニングセレモニーが開かれました。 善光寺平を見渡す長野市の茶臼山恐竜公園内に設置された大型ブランコ。公園の新たな目玉にしようと、指定管理者の長野市開発公社が設立60周年を記念して企画しました。 大型ブランコは一人乗りで、地面から梁（はり）までの高さは7メートルあり、小学生以上が利用できます。 大型ブランコの愛称は、全国から寄せられた168件の中から「CHAUSKY」に決まりました。さっそく、愛称を考案した女性が大型ブランコに初乗りしました。 大型ブランコの愛称を考案 石井さおりさん（長野市） 「すごく長野の風を感じてとても気持ちのいいブランコでした。みんなに乗っていただけたらと思います」 大型ブランコの料金は1人1回につき3分間600円で、29日午後0時半から整理券が配られます。 テレビ信州 ◇ ◇ ◇,[],[]
地域貢献や消費拡大へ　伊那地域の名物ローメン楽しむイベント　家族連れなどでにぎわう【長野】（テレビ信州）,https://news.yahoo.co.jp/articles/dc9f4066c590175d9f34304be2b108263439b47d,https://newsatcl-pctr.c.yimg.jp/t/amd-img/20260429-02157679-tsb-000-4-view.jpg?exp=10800,2026-04-29T11:47:00+09:00,2026-04-29T12:21:48+09:00,テレビ信州,tsb,テレビ信州,324,テレビ信州 伊那市では、ご当地グルメのローメンを楽しめる「春まつり」が開かれ、大勢の家族連れなどでにぎわいを見せています。 ローメンを食べる親子 「おいしい？」「うん」 アツアツの鉄板で調理されているのは伊那地域の名物グルメ、ローメンです。 伊那市では伊那ローメンズクラブに加盟する25の店などが、地域貢献や消費拡大を目的に「伊那ローメン春まつり」を開いています。 今回のイベント用に特別に味付けされた焼きそば風のローメンが、1パック700円で提供され、長い行列ができていました。また、子ども食堂も開かれ、高校生以下にはローメンが無料で振る舞われています。 イベントは伊那市役所の駐車場で、29日午後3時まで開かれています。 テレビ信州 ◇ ◇ ◇,[],[]
女子バレーボールVリーグ2連覇　信州ブリリアントアリーズ　上田市長から表彰【長野】（テレビ信州）,https://news.yahoo.co.jp/articles/1f04beeda307b758719d2b63b3c5989fe45021fb,https://newsatcl-pctr.c.yimg.jp/t/amd-img/20260429-09339819-tsb-000-2-view.jpg?exp=10800,2026-04-29T10:08:00+09:00,2026-04-29T10:49:52+09:00,テレビ信州,tsb,テレビ信州,358,テレビ信州 女子バレーボールのVリーグを2連覇したルートインホテルズ信州ブリリアントアリーズが28日、拠点を置く上田市で市長表彰を受けました。 上田市役所を訪れたのは、Vリーグ・信州ブリリアントアリーズの選手や監督など約30人です。チームは3月、レギュラーシーズン1位でプレーオフに進出し、目標としていた2連覇を果たしました。この功績がたたえられ、去年に続き市長表彰を受けました。 高野夏輝キャプテン 「スポーツそしてバレーボールの魅力をもっともっと届けていけるよう頑張ってまいります」 齊藤達也市長は「今後も市民にバレーボールを通じて勇気と感動、そして活力をもたらしてほしい」と激励しました。 来季参入するSVリーグ・グロースでも優勝を目標に掲げるブリリアントアリーズ。5月17日に市内でファン感謝祭が開かれます。,[],[]
