headline,mainEntityOfPage,image,datePublished,dateModified,author,media_en,media_jp,str_count,body,images,external_links
「地味色なのにおしゃれ」キャサリン妃最新コーデがすごい理由（webマガジン mi-mollet）,https://news.yahoo.co.jp/articles/6160399731d18f3bdf075876caa12262e2dd0f6a,https://newsatcl-pctr.c.yimg.jp/t/amd-img/20260413-00059231-mimollet-000-1-view.jpg?exp=10800,2026-04-13T20:03:16+09:00,2026-04-13T20:03:16+09:00,webマガジン mi-mollet,mimollet,webマガジン mi-mollet,1201,1 / 2 「地味色なのにおしゃれ」キャサリン妃最新コーデがすごい理由 写真：代表撮影/ロイター/アフロ 4月5日日曜日はイースター! 春の訪れとともに、イエス・キリストの復活を祝う『復活祭』。この日、英国王室では恒例のイースター礼拝が行われ、ウィンザー城内にある聖ジョージ礼拝堂に王族方がお揃いになりました。 【写真で解説】キャサリン妃より目立っていた?イースター礼拝初登場の新メンバーとは? とはいえ、出席されるメンバーの顔ぶれが昨年とは大きく異なっていたところに、昨今の英国王室をめぐる騒動を物語ってもいたり……。しかし一方では、国王ご夫妻や皇太子ご一家を中心に、アン王女のご一家が更に存在感を増すとともに、新メンバーの初出席などもあり、話題が尽きない英国王室の逞しさも実感しました。 そんなイースター礼拝で、私が注目したお洒落王族方と、ロイヤルスタイルを徹底解説します! まずは、やっぱりこのご一家から。今年初めて、ご一家での登場となった、ウィリアム皇太子ご一家のお姿です。 思えば、3人のお子様たちのお姿を拝見するのは、昨年のクリスマス以来。皇太子ご夫妻が高身長なので分かりにくいですが、ジョージ王子は身長191cmの父の肩をはるかに超えているからビックリ! ちなみに現在12歳です。10cmヒールを履かれていなければ、もしや175cmのキャサリン妃とも並びそうな勢いです。 今月8歳のお誕生日をむかえるルイ王子も、シャーロット王女との身長差が縮まったようで、一気に少年に成長されました。 と、身長の話はここまでにして、ここからはファッション編です! ベージュ×キャメル。ベーシックカラーにセンスが光るキャサリン妃 ワンピース／セルフ・ポートレート 帽子／ジュリエット・ボッテリル イヤリング／王室所有のもの バッグ／デメリエー・ロンドン 靴／ラルフ ローレン コレクション 写真：PA Images/アフロ 国王ご夫妻をはじめ、王族方とご一緒ということで、この日も控えめ＆シックな装いだったキャサリン妃。ジャケットにフレアースカートがドッキングしたワンピースは、セルフ・ポートレートのもの。2022年のアン王女との初合同公務時にデビューし、この日が2度目の着回しに。 公務ではシンプルにワンピースだけでしたが、礼拝ということで同系色のお帽子を新たに購入され、華やかに、フォーマルに印象を変えられました。ファシネーター型ながら、高さのあるデザインなので、幅広いシーンで使えるタイプですね。 ワンハンドルのミニバッグ（デメリエー・ロンドン）と、最近出番が多いハイヒール（ラルフ ローレン コレクション）はともにキャメルと、ベージュ×キャメルのリアルクローズなカラーコーデがナチュラルなのにエレガント。私たちにも参考になりますね。 続いて、やはりこの日もママと仲良しコーデだったシャーロット王女!,[],[]
"【イガリシノブさん広尾中学＆松濤中学""メ育""授業レポート】「大切なのは自分で選ぶこと」メイクが育む「自分らしさ」（webマガジン mi-mollet）",https://news.yahoo.co.jp/articles/da2acb1e94d49a90e16a7744c60c612de890bc4a,https://newsatcl-pctr.c.yimg.jp/t/amd-img/20260413-00059208-mimollet-000-1-view.jpg?exp=10800,2026-04-13T19:33:16+09:00,2026-04-13T19:33:16+09:00,webマガジン mi-mollet,mimollet,webマガジン mi-mollet,1279,普段は校則でメイクが禁止されている中学生たちが、メイクアップアーティストのイガリシノブさんから直接メイクを教わる——そんな特別な一日が、東京・渋谷区立広尾中学校と松濤中学校の授業で実現しました。 【写真】渋谷区立広尾中、松濤中の授業で男女隔てなく、メイクを楽しむ子どもたちの様子 渋谷区の全区立小・中学校で実践されている独自の教育プログラム「シブヤ未来科」の一環として行われた今回の授業。2025年は広尾中学校の3年生のみの開催でしたが、好評につき2026年は広尾中学校の2年生と3年生合わせて約60名、松濤中学校の3年生約95名を対象に授業を開催しました。 「メ育（めいく）」って、なんだろう? 初めて体験するメ育の授業に生徒たちも期待と緊張溢れる様子。（写真は3月13日松濤中の様子） 今回の授業のテーマは「メ育（めいく）」。「メイク」と「育てる」を組み合わせたイガリさん発の造語です。 イガリさんが主宰するチームゴネンゴが小中学生を対象に展開しているこのプログラム。その名前には「5年後に19〜20歳になる子たちが、自分のことを少しでも好きでいられるように」という願いが込められています。 「流行を追いかけるだけじゃなくて、自分の基準を育ててほしい。メイクに正解はない。大切なのは、自分で選ぶこと」 そう話すイガリさんの言葉を真剣に聞く生徒たち。自己肯定感、コミュニケーション能力、主体性——メイクを入り口に、それらを育てることがこの授業の目指すところです。 メイクの歴史をたどってみよう 「昭和レトロ」ブームの影響か、昭和のアイドルに詳しい生徒さんも。（写真は3月3日広尾中の様子） 授業はまず、メイクの歴史を振り返るレクチャーからスタート。スライドを使いながら時代ごとのトレンドを解説するイガリさんに、生徒たちは興味津々の様子でした。それぞれの時代のメイクを使った穴埋めクイズでは、「ワンレンソバージュ」「ガングロ」「アムラー」などの言葉が飛び交いました。「平成の細眉は何mmくらいだったと思う?」→「つまようじ1本分くらい」、「ヤマンバメイクの白い線は何で描いてたと思う?」→「正解はマッキー」などのやりとりに先生も生徒も思わず笑顔に。 令和の流行り「ワンホンメイク」や「Y2Kメイク」「ミュートメイク」などの用語も解説。さらにはこうした、それぞれの時代の基準は何が作っていた? という話も。昭和はテレビの影響、平成は音楽の影響、令和はSNSの影響が強いのではと分析しているイガリさん。 ここで、メイクと男性の歴史についてもちょっとした豆知識も。「最近になって男性もメイクするようになったのかなと思いきや、もともとファンデーションは、映画の照明に負けないように男性俳優のために開発されたもの」というエピソードには、思わず驚きの声が漏れました。現代ではK-POPアイドルの影響でメイクをする男性が急増し、小学生男子からも「やってみたい」という声が届いているといいます。メイクは誰のものでもある——そのメッセージが、教室全体にやわらかく広がりました。,[],[]
同じシャツ×パンツなのに、なぜ違って見える？「どう着るか」で楽しむ3つのコーデ（webマガジン mi-mollet）,https://news.yahoo.co.jp/articles/f9e4563e487019a9e68beca4f285c5a7f98e3a85,https://newsatcl-pctr.c.yimg.jp/t/amd-img/20260413-00059232-mimollet-000-1-view.jpg?exp=10800,2026-04-13T19:03:16+09:00,2026-04-13T19:03:16+09:00,webマガジン mi-mollet,mimollet,webマガジン mi-mollet,1328,こんにちは。エディターの堂坂です。 先週ミモレストアの撮影があり、スタイリストの水野利香さんやエディターの発田美穂さんと入れ替わり立ち替わり、同じアイテムをそれぞれセルフスタイリングで着てカメラマンさんに撮影いただきました。 【着回し写真】「同じシャツとパンツ」を使った残り2パターンの着こなしを見る また別の日には、エディター仲間の昼田祥子さんと出原杏子さんと一緒にスタジオを借りて撮影会をしました。 どちらの日も、各々鏡の前でボタンを開けたり閉じたり、袖をまくったり裾をちょっとだけ出したり。皆さんが服の着方を微調整する光景をぼんやりと眺めながら、やっぱり服は最後の仕上げにその人の個性が出るんだなぁと改めて感じました。 何を着るかという「アイテム選び」ももちろん大事ですが、それと同じくらい、もしくはそれ以上に「どう着るか」がおしゃれの醍醐味だなと思った出来事でした。 特にシャツは「どう着るか」の自由度が高いアイテムだと思うので、今回は同じシャツとパンツで3パターンの着方を試してみました。 (1)第一ボタン開ける、袖を少しまくる、裾はイン mi-mollet（ミモレ） 裾をインしてウエストマークするときちんと感が出るので、そのぶん首元と手首まわりは少し肌を見せてみました。そうすることでストイックな印象になりすぎずに、ややラフに見える気がします。 (2)第一ボタン閉じる、袖のボタンを閉じてブラウジングする、裾はアウト こちらは裾を出して足元はスニーカーなので、1コーデ目に比べてカジュアルに。とはいえ砕けて見えすぎないように、あえて第一ボタンを閉じて首元にスカーフを巻くことで少し華やかに仕上げました。同じ理由でバッグも小さめのエレガントなものを合わせています。 また、袖は袖口のボタンを閉じた上でギュッとブラウジングしてみました。そうすることで少しボリューム袖っぽく見えるので、1の袖まくりとはまた違った印象になるのも面白いですよね。 最後は白Tとのレイヤードスタイル。シャツを無造作にバサッと羽織った雰囲気にしたかったので、袖口のボタンはあえて開けました。PVCバッグやヒョウ柄のバッグを合わせて、3コーデの中では一番リラックス感のある着こなしになりました。 靴＆バッグを変えているから違って見えるんじゃないの? と思われる方もいらっしゃるかもしれませんが、小物が同じだとしても、ボタンを何個開けるか、裾や袖をどうするかなど、ちょっとした着こなしの工夫で結構印象が変わる気がしています。 同じ服でも、着方を少し変えるだけで、なんだか違う一日になる。私が服を着る上でいちばん面白いなと思うのはそんなところです。 かつて『LEON』という男性誌に“必要なのはお金じゃなくてセンスです”というキャッチコピーが付いていて、当時の私は「そうは言っても、『LEON』に載ってるものを買うには結構な額のお金が必要じゃん」と思っていましたが（笑）、確かにおしゃれはセンスというか、着こなしの工夫次第でどうにでも楽しめるものですよね。 今週も最後までお読みいただきありがとうございました。皆さま素敵な週末をお過ごしください! 写真・文/堂坂由香 堂坂 由香,[],[]
意外と辛口に見える！甘くない「ボウタイブラウス」大人の着こなし実例【海外スナップ】（webマガジン mi-mollet）,https://news.yahoo.co.jp/articles/19e0ecc0dafcd6d514ad5d322f4241be58c853cf,https://newsatcl-pctr.c.yimg.jp/t/amd-img/20260413-00059221-mimollet-000-1-view.jpg?exp=10800,2026-04-13T08:03:22+09:00,2026-04-13T08:03:22+09:00,webマガジン mi-mollet,mimollet,webマガジン mi-mollet,386,顔まわりを華やかに見せてくれるボウタイブラウスは、大人のワードローブに頼れる一枚。華やかだけどかわいらしい感じに見えそう……という方に、選び方と着こなし次第でぐっとシャープに、大人っぽく着こなすコツを、今日もピンタレストなどで見つけた海外スナップからご紹介します。 【写真】海外ファッショニスタがお手本!春の「ボウタイブラウス」スタイルを見る 写真：Launchmetrics/spotlight/アフロ フェミニンなイメージのあるボウタイブラウスも、ブラウンのストライプ柄を選ぶとぐっとハンサムな印象に。でも華やかさはキープされていて、着映えるワンツーコーデになっています。 結び方やボトムの合わせを少し変えるだけで、印象が変わるボウタイブラウス。意外と辛口好きの人にもおすすめのアイテムです、ぜひ春の着こなしに取り入れてみてくださいね。 構成・文/出原杏子 出原 杏子,[],[]
実は最強。ピンク×ボートネックの「スローン」のリブニットが大人にちょうどいい【エディター・堂坂由香さん】（webマガジン mi-mollet）,https://news.yahoo.co.jp/articles/d0686a357ae6057e736a9becb19a698a0e5c10fd,https://newsatcl-pctr.c.yimg.jp/t/amd-img/20260413-00059230-mimollet-000-1-view.jpg?exp=10800,2026-04-13T07:03:22+09:00,2026-04-13T07:03:22+09:00,webマガジン mi-mollet,mimollet,webマガジン mi-mollet,1185,【ミモレ別注】スローン ボートネック半袖リブトップス¥28600（サイズ：FREE ）／mi-mollet STORE パンツ／ブティック310 バッグ／サンローラン 靴／アディダス オリジナルス チョーカー／ル ボンボン 大人世代から支持を集めるブランド、「スローン」。ここれまでミモレストアにも度々登場し、その上質さと着心地の良さでファンを増やしてきました。この春、大人のネックラインを美しく見せてくれる半袖リブニットが登場。ベーシックで頼れるブラックと、着こなしにさりげない華やぎを添えるピンクの2色展開です。 今回は、ミモレでも着こなしに定評のあるファッションエディター堂坂由香さんが“大人のピンク”に挑戦してみました。 【画像を見る】大人でも“ピンク”を無理なく着るには?「スローン」のリブニットがおすすめな理由 ピンク×ボートネックは、大人にこそ似合う“最強バランス” 「ピンクにボートネック、そして絶妙なシルエット。自分には少しフェミニンすぎるかも……?と思っていたのですが、実際に着てみると「意外と似合うかも!」という発見がありました（笑）。 ボートネックでデコルテがほどよく見えることで、肌見せに抜け感が生まれ、ピンクもぐっとヘルシーな印象に。ピンクのトップスって首元は開きすぎても詰まりすぎても着こなしが難しいと感じていたのですが、このバランスなら大人でも無理なく取り入れられると思いました。ピンク×ボートネックの組み合わせは、想像以上に相性がよく、着やすい一枚です」 この商品を購入する 大人がピンクを無理なく着るなら“メンズライク”に整えて。 「ふんわりと柔らかなピンクなので、スタイリングは少し引き締めるのがポイント。 黒のチョーカーで首元をきりっとまとめつつ、ボトムはゆるっとしたパンツを合わせて甘さを少しだけセーブ。足元もスニーカーでカジュアルに振ることで、全体をメンズライクに整え、大人でもピンクをバランスよく着こなせるよう意識しました。実際に着てみて、その着やすさとバランスのよさにすっかり気に入ってしまい、実はリアルバイしてしまいました!」 堂坂さんの“大人のピンク”の着こなし、いかがでしたか? コーディネート次第でピンクの甘さを程よく抑えることができ、大人でも気負わず取り入れられるのが魅力です。さらに、計算されたネックラインがデコルテを美しく引き立て、シンプルながらも女性らしさをさりげなく演出してくれる一枚。 春の装いを軽やかにアップデートしてくれるアイテムとして、ぜひ手に取っていただきたい一着です。期間・数量ともに限定販売となりますので、気になる方はお早めにチェックしてみてください。 撮影/土岡虎太郎 ヘアメイク/小林未波（PEACE MONKEY） 出演/堂坂由香 構成・文/大平麻耶子 mi-mollet STORE,[],[]
