headline,mainEntityOfPage,image,datePublished,dateModified,author,media_en,media_jp,str_count,body,images,external_links
《乱高下相場の戦い方》地政学リスクの高まりで追い風を受ける「防衛」「内需」銘柄　億り人・坂本慎太郎さんは石川製作所と豊和工業、シゲルさんは東海ソフトに注目（マネーポストWEB）,https://news.yahoo.co.jp/articles/9cf8140fe618eafbb8eeb6e9742ee2bc1238d7c5,https://newsatcl-pctr.c.yimg.jp/t/amd-img/20260326-00000005-moneypost-000-1-view.jpg?exp=10800,2026-03-26T16:15:00+09:00,2026-03-26T16:15:00+09:00,マネーポストWEB,moneypost,マネーポストWEB,1233,資産1.5億円超の「Bコミ」こと坂本慎太郎さん 中東情勢の緊迫化による先行き不安で、日経平均株価は急落。その後も激しい値動きが続く乱高下相場となっているが、株価が上がり続けることも、下がり続けることもないと考えれば、激しい乱高下相場のなかでも狙い目となる銘柄を探したほうがいいという考え方もできる。 【表画像】億り人・シゲルさんが選んだ「乱高下相場で仕込みたい銘柄2」 そこで歴戦の“億り人”たちが今、仕込みたいと注目する銘柄を聞いた。数多の暴落相場を乗り越えて資産を増やしてきた達人ならではの視点が見て取れるだろう。 「内需」関連銘柄は外的要因を受けにくい特徴も 地政学リスクの高まりに加え、防衛費増額を掲げる高市政権の政策も追い風となる「防衛」関連については、資産1.5億円超の「Bコミ」こと坂本慎太郎さんは機雷や地雷など防衛機器を製造する石川製作所と自動小銃や迫撃砲を手掛ける豊和工業を挙げる。 「防衛関連銘柄はすでに高値圏にあるように思えますが、今後も防衛費は増え続ける見込みなので、株価は長期的に上昇する可能性がある」（坂本さん） さらに、外的要因を受けにくい「内需」関連も有力候補だという。 「パルグループホールディングスなどアパレル3銘柄はEC比率を高めるなど高収益体質になっていて、株価もまだ割安と言えます」（同前） 資産20億円超で間もなく90歳を迎える現役トレーダー「シゲルさん」こと藤本茂さんも、「内需」関連で独立系のソフト開発会社である東海ソフトをピックアップする。 「私は短期売買でも中長期的な目線で『増収・増益・増配』が見込める銘柄を安いところで買うようにしているから、東海ソフトはその一つ。配当利回りが5％以上の金融持ち株会社である岩井コスモホールディングスも増収増益増配が見込める優良銘柄やと思います」 暴落相場で株を買う際の注意点 億り人たちが注目する理由は様々だが、暴落相場では留意点があると、元消防士の億り人・かんちさんは言う。 「『ここまで下げたらこれくらい買おう』と最初から入れる資金を機械的に決めておくこと。生活資金を確保したうえで、下落が長引いてもそのまま放置して不安にならないくらいの投資金額にすることが重要です」 坂本さんも注意を促す。 「値動きが激しくて先が読めない以上、“全力買い”はすべきではない。買いたい銘柄があったら“ちょっとだけ買う”を意識してほしい」 慎重さを失わずに好機を見定めたい。 ＊ ＊ ＊ 関連記事《【億り人4人が「いま仕込み時」と注目の22銘柄を大公開】シゲルさん、かんちさん、DAIBOUCHOUさん、坂本慎太郎さんが実践解説 日本株「乱高下相場」の戦い方》では、「シゲルさん」こと藤本茂さん、かんちさん、DAIBOUCHOUさん、「Bコミ」こと坂本慎太郎さんがいま注目している銘柄の一覧とともに、自らが実践している「乱高下相場」の戦い方を解説している。 ※週刊ポスト2026年4月3日号,[],[]
「ファンデが汗と一緒にドロドロと…」サウナの女性客が見たマナー違反　「濃いメイクを落とさないままサウナと湯船に入る」「サウナ室でずっとおしゃべり」に困惑の声（マネーポストWEB）,https://news.yahoo.co.jp/articles/5bf01085a39b52f971755436a51f6fbb7d991ad4,https://newsatcl-pctr.c.yimg.jp/t/amd-img/20260326-00000004-moneypost-000-1-view.jpg?exp=10800,2026-03-26T16:15:00+09:00,2026-03-26T16:15:00+09:00,マネーポストWEB,moneypost,マネーポストWEB,941,女湯ならではのマナー違反もあるという（写真：イメージマート） 銭湯・サウナブームが続いている。SNSでは「ととのった」という報告が溢れるほか、「昭和レトロでエモい」と若い女性たちにも銭湯サウナが人気だ。しかし、現場では戸惑いの声も聞こえてくる。ブームの拡大とともに、マナーを守らず利用するユーザーが目立つようになったというのだ。女性たちが見たサウナ利用客の実態とは──。 サウナ室の中でずっとおしゃべり 「サウナ室でぺちゃくちゃとおしゃべりする利用者に迷惑しています」──。そう語るのは、都内で美容師をしている女性・Aさん（32歳）。仕事終わりに週3回ほど、地元のリノベ系銭湯サウナに足を運ぶのが日課だ。 「私が利用している店舗はSNSでも人気で、企業とのコラボも積極的にやっているので、若い女性客が以前よりも増えた印象です。ただ、迷惑なのは大声でしゃべるグループ客です。銭湯内には『黙浴』と書かれているにもかかわらず、サウナ室のなかでも、外気浴スペースでも、ずっと会話しているんです……。 スタッフさんが注意しても、いなくなるとまたおしゃべりスタート。リラックスしにきているのに、これではまったく癒されません。他の利用客もいるわけだから、最低限のマナーを守ってほしいです」（Aさん） メイクを落とさないままサウナ室や湯船に 女湯ならではのマナー違反もあると語るのは、都内在住の会社員女性・Bさん（36歳）だ。彼女は趣味で全国のサウナを巡る「サウナー」だが、普段は近所の銭湯サウナを利用している。 「私が気になるのは、メイクをしたまま湯船やサウナ室に入る女性たちです。当たり前ですが、湯船やサウナに入る前には、まず洗い場でメイクを落とし、全身を洗いますよね。でも、そのマナーを守らないで、掛け湯だけしてお風呂やサウナ室に入る女性はいるんです。 濃いメイクそのまま、ファンデーションがドロドロと汗と一緒に湯船に垂れ流される……。信じられないかもしれませんが、いつ足を運んでもそういった女性客に遭遇します。とくに若い女性に多い印象ですね。昔から、タオルは湯船に入れない、髪の毛は結ぶ、などの基本ルールはありますが、『髪の毛も洗わず、メイクしたまま』の女性客も本当に迷惑ですよ」（Bさん）,[],[]
「急にまとまった資金が必要に…」投資信託の取り崩しはどの順番でやるのが正解？　まず優先すべきは旧NISA口座や運用コストが高い投信、新NISA口座には極力手をつけない（マネーポストWEB）,https://news.yahoo.co.jp/articles/a13400958a3c928b5275957f2c9aa81329aeec03,https://newsatcl-pctr.c.yimg.jp/t/amd-img/20260326-00000003-moneypost-000-1-view.jpg?exp=10800,2026-03-26T15:15:00+09:00,2026-03-26T15:15:00+09:00,マネーポストWEB,moneypost,マネーポストWEB,892,資産を解約するときの注意点は？ ライフイベントなどでまとまった資金が必要になったとき、投資資金から一部を取り出すこともあるだろう。現在保有している資産から投資信託の一部を解約するとしたら、どれから手をつけるべきか。『世界一楽しい！会社四季報の読み方』などの著書がある個人投資家で株式投資講師・藤川里絵さんが解説するシリーズ「さあ、投資を始めよう！」。第181回は、「投資信託の取り崩し」について。 個人投資家で株式投資講師・藤川里絵さん ＊ ＊ ＊ 投資を長く続けていると、ライフイベントなどでまとまった資金が必要になるタイミングが必ず訪れます。私自身、現在保有している投資信託の一部を解約するとしたら、どれから手をつけるべきか、改めて自分のポートフォリオを見直してみました。 資産を増やす「入り口」の戦略も大切ですが、実は「出口戦略」にも最適解となるセオリーがあります。今回はわたしの実例をもとに、投資信託の賢い取り崩し順序について解説します。 結論から言うと、売却の優先順位は以下の通りです。 ・第1位：旧NISA口座の銘柄 ・第2位：特定口座の銘柄 ・第3位：新NISA口座の銘柄 まず、真っ先に検討すべきは「旧一般NISA」の銘柄です。旧NISAは非課税期間が5年と決まっており、期間終了後は特定口座へ払い出されます。すでに十分な利益が出ているのであれば、非課税の恩恵をフルに受けて利益を確定させてしまうのが最も効率的です。 次に「特定口座」です。特定口座での売却益には約20％の税金がかかるため、なるべく利益率の低い銘柄から売却し、税負担を軽くするのが鉄則です。また、長く投資を続けていると、現在の超低コストファンドが登場する前に買った、信託報酬が少し高めの銘柄が残っていることがあります。これらを優先して売却して現金化することは、ポートフォリオ全体の運用コスト削減という大きなメリットを生みます。 一方、絶対に死守したいのが「新NISA」の枠です。生涯にわたって非課税で複利運用できる最強の口座ですから、他の口座に引き出せる資産があるうちは、極力手をつけないのが基本です。,[],[]
年齢を重ねるほど節税効果が出やすい「医療費」　補聴器購入が控除対象になる条件とは？　控除できる額が「医療費10万円以上」の勘違いにも要注意（マネーポストWEB）,https://news.yahoo.co.jp/articles/57994684c0204ac6f7554d0c86bcdd89f52c4bab,https://newsatcl-pctr.c.yimg.jp/t/amd-img/20260326-00000002-moneypost-000-1-view.jpg?exp=10800,2026-03-26T15:15:00+09:00,2026-03-26T15:15:00+09:00,マネーポストWEB,moneypost,マネーポストWEB,1226,医療費控除の対象は意外と広範囲（写真：イメージマート） これまで「節税」といえば現役世代向けの方法ばかり紹介されてきたが、実は夫婦の老後生活でも無理なく税金を減らせるポイントがたくさんある。年齢を重ねるほど節税効果が出やすいのは「医療費」だ。 【表】夫婦で税金を減らす施策48（その1） 年間に払った医療費が一定額（10万円または所得200万円未満は5％）を超えると所得から差し引き所得税と住民税が軽減される「医療費控除」は忘れずに行ないたい。税理士の相原仲一郎氏が言う。 「自分で払った医療費は自分だけで申告するものと思い込んでいる人が多いですが、医療費は世帯で合算できる。夫婦でまとめて申告することで控除される可能性が高くなる」（相原氏） 申告できる医療費に含まれるのは診察代や薬代などに限らない。元国税専門官で『絶対トクする！節税の全ワザ』（きずな出版）などの著書がある、節税に詳しいジャーナリストの小林義崇氏が解説する。 「通院のための電車やバス代、必要ならタクシーや新幹線代といった交通費も医療費に含まれます。本人ひとりでは通院が難しい場合、付き添い人の交通費も医療費控除の対象になることがあります」 補聴器購入が医療費控除対象になる条件 インプラントや高額の入れ歯といった歯科の案件は治療目的であれば医療費控除の対象になる。介護用のおむつや補聴器、コンタクトレンズの購入も同様だ。 「補聴器は医師への相談なしに家電量販店で購入しても医療費控除対象になりませんが、耳鼻咽喉科の医師から診療情報提供書をもらい、認定補聴器技能者を介して購入すれば控除対象になります」（同前） 医療費控除できる額が「医療費10万円以上」と勘違いしている人が多いことにも注意だ。相原氏が語る。 「一般に医療費控除は“医療費10万円を超えたら使える制度”だと思われがちですが、年間の総所得が200万円未満の人は基準額が総所得の5％になります。例えば総所得が160万円だと医療費が8万円を超えたら控除対象です」 市販薬代が高い場合も節税できる。OTC医薬品など特定の医薬品を年間1万2000円以上購入していると「セルフメディケーション税制」で所得控除を受けられる。同じ人が医療費控除とセルフメディケーション税制を同時に利用できないが、夫婦で分担できる。 「夫婦の医療費と薬代をまとめて、どちらかが医療費控除、もう一方がセルフメディケーション税制と別々に申告すれば、家計全体として控除の取りこぼしを減らせます」（小林氏） ＊ ＊ ＊ 関連記事【《節税のプロが指南》税金10万円減らすテクニック「調味料を変えて消費税減」「効果が出やすい医療費控除」「免許返納で地方税還元」「働くことで所得税減額」…老後に無理せず実践できる方法】では、旅先で税金を減らす方法や免許返納の節税効果などを解説。無理なく税金を減らす48のテクニックを紹介している。 ※週刊ポスト2026年4月3日号,[],[]
対日圧力を強める中国に高市政権はどう対応すべきか？　「軍事力だけでなく、AIでも自動車でも家電でもすべて中国の後塵を拝している」日本に求められる“戦略的思考”（マネーポストWEB）,https://news.yahoo.co.jp/articles/14a4e57a9cd8a69eab0c6cfdcaefec3de7fa3aab,https://newsatcl-pctr.c.yimg.jp/t/amd-img/20260326-00000001-moneypost-000-1-view.jpg?exp=10800,2026-03-26T07:15:00+09:00,2026-03-26T07:15:00+09:00,マネーポストWEB,moneypost,マネーポストWEB,1032,激しさを増す中国の「対日圧力」（イラスト／井川泰年） 緊張が続く日中関係。訪日旅行の自粛要請やレアアースの輸出規制など、中国からの対日圧力は激しくなっている。そんな中国に高市政権はどう向き合っていけばよいのか？ 経営コンサルタントの大前研一氏が分析する。 ＊ ＊ ＊ 中国が高市早苗政権への圧力を強めている。 たとえば、中国商務省は2月24日、防衛分野に関わる三菱重工業、川崎重工業、IHI、富士通の関連会社など20の防衛関連企業・団体に対し、軍民両用（デュアルユース）品の輸出を禁止したと発表した。日本の「再軍事化」と「核開発の野望」を抑制することが目的としている。 また、中国外務省は翌25日、自民党が護衛艦や防空ミサイルなど殺傷能力のある武器の輸出を原則的に認める政府への提言案をまとめたことについて、毛寧報道局長が「日本の“新型軍国主義”による妄動を断固として阻止しなければならない」と批判した。 昨年11月以降、中国は高市首相の台湾有事をめぐる国会答弁をきっかけに、自国民に訪日旅行の自粛を呼びかけたり、日本産水産物の輸入を停止したりする報復措置に出たが、それをいっそう加速しているのだ。 しかし、そういう目論見はことごとく裏目に出ている。2月の衆議院議員選挙では高市首相率いる自民党が結党以来最多の316議席を獲得して圧勝したが、その“陰の立役者”は中国だ。 本連載で書いたように、中国は昨年10月、“親中”の公明党に26年間続いた自民党との連立離脱を要請して高市首相誕生を阻止しようとした可能性があり、それが不発に終わったから衆院選で立憲民主党との中道改革連合を結成させたのではないかと私は推測している。 さらに、アメリカのオープンAIは2月末、中国当局に関係する人物が同社の生成AI（人工知能）「チャットGPT」に助言を求め、高市首相を標的にした影響工作を試みたとする報告書を発表した。この人物は「高市氏に関する批判的なコメントを投稿し、増幅させる」「高市氏には極右傾向があると非難する」など、高市氏の信用を落とすための計画に助言を求めた（チャットGPTは拒否）という。 だが、こうした企てはすべて失敗した。中国が対日圧力をかければかけるほど日本の国民は反発し、高市首相の支持率が上昇したのである。中国はそのロジックがわかっていないから、高市首相に対する批判を続け、それが逆効果になっているにもかかわらず「高市降ろし」をエスカレートさせているのだ。,[],[]
