headline,mainEntityOfPage,image,datePublished,dateModified,author,media_en,media_jp,str_count,body,images,external_links
横浜・みなとみらい線２０周年　車両留置場の整備が着々　今夏にもトンネル工事着工（カナロコ by 神奈川新聞）,https://news.yahoo.co.jp/articles/c00896a866804b241b54aaeb267c66892f2c8a43,https://newsatcl-pctr.c.yimg.jp/t/amd-img/20240131-01053557-kana-000-2-view.jpg?exp=10800,2024-01-31T20:21:02+09:00,2024-02-01T00:42:02+09:00,カナロコ by 神奈川新聞,kana,カナロコ by 神奈川新聞,473,\n港の見える丘公園の崖下部分に建設された「防音ハウス」（横浜高速鉄道提供）\n横浜高速鉄道（横浜市中区）が運行するみなとみらい線（ＭＭ線）は２月１日、開業から２０周年を迎える。同社が２０３０年度完成を目標に整備を進めているのが、車両留置場だ。工事現場では換気坑が掘り進められ、この夏にも車両留置場用のトンネル工事が始まる。\n【地図と写真】２０３０年度完成を目標に整備が進む車両留置場\n同線の終点である元町・中華街駅から１５分ほど歩くと、港の見える丘公園（同）の崖下部分に、工事拠点の巨大な白い建造物「防音ハウス」が見えてくる。高さ約１４メートル、幅約９・４メートルで、「壁や天井は防音材が入ったパネルを使用して構築したため、騒音や振動が外に漏れない」（同社）という。\n\n 工事は現在、横坑と呼ばれる全長３０６メートルのトンネルを、半分ほど掘り進めている。掘削は同場所から始まっており、トンネルは完成後、換気坑として使用される。車両留置場のトンネル工事は、横坑を所定の深さまで掘り進めた後に開始。今夏前には着工するという。\n神奈川新聞社,['https://newsatcl-pctr.c.yimg.jp/t/amd-img/20240131-01053557-kana-000-2-view.jpg?pri=l&w=640&h=360&exp=10800'],"['https://news.yahoo.co.jp/articles/c00896a866804b241b54aaeb267c66892f2c8a43/images/000', 'https://www.kanaloco.jp/news/economy/article-1053557.html/gallery']"
【Ｂリーグ】Ｂ１川崎、後半に反撃も及ばず　横浜ＢＣは最終盤に逆転（カナロコ by 神奈川新聞）,https://news.yahoo.co.jp/articles/6b816fe04e4ac02047008ec721326f8c7b608d72,https://newsatcl-pctr.c.yimg.jp/t/amd-img/20240131-01053553-kana-000-1-view.jpg?exp=10800,2024-01-31T22:31:02+09:00,2024-01-31T22:31:02+09:00,カナロコ by 神奈川新聞,kana,カナロコ by 神奈川新聞,330,\n【川崎－ＦＥ名古屋】第１クオーター、相手に攻め込まれる川崎＝川崎市とどろきアリーナ（（Ｃ）Ｂ．ＬＥＡＧＵＥ）\nバスケットボール男子Ｂリーグ１部（Ｂ１）は３１日、川崎市とどろきアリーナなどで１２試合が行われた。中地区３位の川崎はＦＥ名古屋に７３―７９で敗れ、同６位の横浜ＢＣは三河に７５―７４で競り勝った。\n【写真で見る】【横浜ＢＣ－三河】第２クオーター、シュートを打つ横浜ＢＣ・河村\n川崎は４点ビハインドの後半に反撃、第４クオーターに３点差まで詰めたが、最終盤の連続失点で振り切られた。アレンはチーム最多の２０得点。\n\n 横浜ＢＣは５点を追う第４クオーターにユトフが３点シュート２本を沈めるなど勝負強さを発揮し逆転、接戦を制した。\n神奈川新聞社,['https://newsatcl-pctr.c.yimg.jp/t/amd-img/20240131-01053553-kana-000-1-view.jpg?pri=l&w=640&h=512&exp=10800'],"['https://news.yahoo.co.jp/articles/6b816fe04e4ac02047008ec721326f8c7b608d72/images/000', 'https://www.kanaloco.jp/sports/basketball/bravethunders/article-1053553.html/gallery']"
茅ケ崎の住宅で中２女子のジャージー盗んだ疑い　男逮捕　周辺で同様の被害数件（カナロコ by 神奈川新聞）,https://news.yahoo.co.jp/articles/62c376954ad4e497f5a2a8a28b0ae997cb1df21c,https://newsatcl-pctr.c.yimg.jp/t/amd-img/20240131-01053576-kana-000-1-view.jpg?exp=10800,2024-01-31T20:11:02+09:00,2024-01-31T20:11:02+09:00,カナロコ by 神奈川新聞,kana,カナロコ by 神奈川新聞,209,\n茅ケ崎警察署（資料写真）\n茅ケ崎署は３１日、窃盗の疑いで、相模原市南区相模大野７丁目、自称派遣社員の男（４１）を逮捕した。\n\n 逮捕容疑は、２０２３年１０月２５日正午ごろ、茅ケ崎市の住宅で、１階の軒先に干してあった中学２年の女子生徒（１４）のジャージーの上着などを盗んだ、としている。調べに対し、容疑を認めている。周辺では同様の被害が数件発生しており、署は余罪の可能性があるとみて調べている。\n神奈川新聞社,['https://newsatcl-pctr.c.yimg.jp/t/amd-img/20240131-01053576-kana-000-1-view.jpg?pri=l&w=640&h=480&exp=10800'],['https://news.yahoo.co.jp/articles/62c376954ad4e497f5a2a8a28b0ae997cb1df21c/images/000']
小田原市職員の男逮捕、水増し請求で公金４４０万円詐取疑い（カナロコ by 神奈川新聞）,https://news.yahoo.co.jp/articles/635eeb1a14b84f617735f0b8a5b698f95d02e768,https://newsatcl-pctr.c.yimg.jp/t/amd-img/20240131-01053655-kana-000-3-view.jpg?exp=10800,2024-01-31T22:41:02+09:00,2024-01-31T23:31:02+09:00,カナロコ by 神奈川新聞,kana,カナロコ by 神奈川新聞,482,\n家宅捜索を終え、押収物を運び出す県警捜査員ら＝３１日午後９時２５分ごろ、小田原市環境事業センター\n小田原市のごみ焼却施設で使う薬剤の請求額を納品会社に水増しさせ、同市から約４４０万円をだまし取ったとして、県警捜査２課と海老名署などは３１日、詐欺の疑いで、同市環境事業センター主査の男（４９）＝中井町＝を逮捕した。県警によると、詐取した公金は商品券や家電製品の購入など私的用途に充てていたとみられる。\n【写真で見る】神奈川県警が小田原市環境事業センターを家宅捜索\n逮捕容疑は、薬剤の販売会社に勤務する４０代の男性社員と共謀し、２０１９年２月～２０年３月、同センター内で使う薬剤の代金を同社に水増し請求させ、同市から公金約４４０万円をだまし取った、としている。「間違いありません」と供述、容疑を認めている。\n\n 同課によると、薬剤は施設内のフィルターを保護するものなど数種類あり、発注は主に男が担当。実際の納入量よりも多く納入したとして請求書を出させ、市も振り込んでいた。水増し請求は３１回に上り、水増し額は１回当たり１０万円前後だった。\n神奈川新聞社,['https://newsatcl-pctr.c.yimg.jp/t/amd-img/20240131-01053655-kana-000-3-view.jpg?pri=l&w=640&h=463&exp=10800'],"['https://news.yahoo.co.jp/articles/635eeb1a14b84f617735f0b8a5b698f95d02e768/images/000', 'https://www.kanaloco.jp/news/social/case/article-1053655.html/gallery']"
「安倍派の倒閣の乱だ」最悪のタイミングで２政務官辞任、国会内に動揺広がる（カナロコ by 神奈川新聞）,https://news.yahoo.co.jp/articles/19d68011ecad21f8cb3c27f5dfd0527e1fb1d538,https://newsatcl-pctr.c.yimg.jp/t/amd-img/20240131-01053575-kana-000-1-view.jpg?exp=10800,2024-01-31T19:51:06+09:00,2024-01-31T19:51:06+09:00,カナロコ by 神奈川新聞,kana,カナロコ by 神奈川新聞,702,\n国会議事堂（資料写真）\n自民党安倍派（清和政策研究会）の裏金事件を巡り３１日、同派所属の政務官２人が事実上更迭された。政治資金収支報告書への不記載を理由に２人が辞意を示したとされる。岸田文雄首相の施政方針演説の翌日かつ衆院代表質問の初日という「最悪のタイミング」（自民幹部）。国会内には「派閥の一斉訂正日まで不記載の事実を総理にも官邸にも伏せていたのは悪質。安倍派の倒閣の乱だ」（同）との見方が広がった。\n\n 更迭された小森卓郎総務政務官は能登半島地震対策における総務省のリーダー役、加藤竜祥国土交通政務官は復興政務官を兼ねていた。内閣府の防災関係者は「能登半島地震の政府復興チームの一角が崩れた。収拾が大変だ」と嘆いた。\n\n 代表質問のトップバッターに立った立憲民主党の泉健太代表は「異次元の裏金と異次元の不祥事」と批判し、「関与した議員を処分しないのか」と対応を迫った。政務官交代を巡っては「ここまでチェックをやらずに危機管理もできなかったことは深刻で総理の責任は重大だ」と指摘。「昨年末の閣僚交代からはなぜ漏れたのか」とただした。\n\n 岸田首相は「しかるべき手順を踏んだ上で対応する」と処分について明言を避けた。閣僚交代を巡っても「さまざま報道に接する中で本人の考えなども踏まえ進めた」とマスコミからの情報など外的な要因を強調し自身の責任を転嫁した。\n\n 首相は前日３０日の演説で事件の解明や再発防止などを巡り「私自身が先頭に立って実行していく」と宣言したばかり。今回の２政務官交代は自身が任命権を持つ政務三役へのチェックすら不十分だったことが露呈した格好だ。\n神奈川新聞社,['https://newsatcl-pctr.c.yimg.jp/t/amd-img/20240131-01053575-kana-000-1-view.jpg?pri=l&w=640&h=426&exp=10800'],['https://news.yahoo.co.jp/articles/19d68011ecad21f8cb3c27f5dfd0527e1fb1d538/images/000']
横浜・鶴見の国道で無免許運転　男性をはね、重傷負わせて逃走疑い　２１歳男逮捕　男性は現在も意識不明（カナロコ by 神奈川新聞）,https://news.yahoo.co.jp/articles/3ef9052b3372ed2e676d619934863d34c6add0b7,https://newsatcl-pctr.c.yimg.jp/t/amd-img/20240131-01053603-kana-000-1-view.jpg?exp=10800,2024-01-31T20:51:02+09:00,2024-01-31T20:51:02+09:00,カナロコ by 神奈川新聞,kana,カナロコ by 神奈川新聞,240,\n鶴見警察署（資料写真）\n県警交通捜査課と鶴見署は３１日、自動車運転処罰法違反（無免許過失傷害）と道交法違反（ひき逃げ）の疑いで、横浜市旭区上川井町、職業不詳の男（２１）を逮捕した。\n\n 逮捕容疑は、１３日午後４時２０分ごろ、横浜市鶴見区生麦３丁目の国道で乗用車を無免許で運転し、国家公務員の男性（４９）＝同区在住＝をはねて脳挫傷などの重傷を負わせたまま逃走した、としている。男性は現在も意識不明。同容疑者は容疑事実の認否について供述を保留しているという。\n神奈川新聞社,['https://newsatcl-pctr.c.yimg.jp/t/amd-img/20240131-01053603-kana-000-1-view.jpg?pri=l&w=640&h=450&exp=10800'],['https://news.yahoo.co.jp/articles/3ef9052b3372ed2e676d619934863d34c6add0b7/images/000']
【春季キャンプ】ＤｅＮＡ１、２軍現地入り　三浦監督「まず自分と戦って」（カナロコ by 神奈川新聞）,https://news.yahoo.co.jp/articles/17829ae2c0ae78189918cf86ce15ddb36c87ad14,https://newsatcl-pctr.c.yimg.jp/t/amd-img/20240131-01053552-kana-000-2-view.jpg?exp=10800,2024-01-31T19:51:02+09:00,2024-01-31T21:17:02+09:00,カナロコ by 神奈川新聞,kana,カナロコ by 神奈川新聞,343,\n沖縄入りし、チームの全体ミーティングに臨む三浦監督＝沖縄県宜野湾市のホテル\n横浜ＤｅＮＡは３１日、春季キャンプに備え、１軍主体のＡ班の選手、スタッフらが沖縄県宜野湾市に入った。同市内のホテルでの歓迎セレモニー後には全体ミーティングが行われ、就任４年目の三浦大輔監督（５０）は「シーズンは相手と戦うが、キャンプはまず自分と戦って、自分に負けないように過ごしてほしい」とナインに求めた。\n\n 沖縄でのキャンプは３８年連続。ユニオンですからスタジアム宜野湾（休日は２月５、９、１４、２０日）で、２月２５日まで行われる。\n\n Ｂ班（２軍）キャンプは鹿児島県奄美市の名瀬運動公園市民球場（休日は同５、９、１３、１７日）で実施。Ｂ班メンバーも１月３１日、現地入りした。\n神奈川新聞社,['https://newsatcl-pctr.c.yimg.jp/t/amd-img/20240131-01053552-kana-000-2-view.jpg?pri=l&w=640&h=640&exp=10800'],['https://news.yahoo.co.jp/articles/17829ae2c0ae78189918cf86ce15ddb36c87ad14/images/000']
松屋フーズ、創業初のパスタ業態「麦のトリコ」　川崎市に１号店オープン（カナロコ by 神奈川新聞）,https://news.yahoo.co.jp/articles/6ae5e402df6df145ab465d2e782d710d9fcabb5f,https://newsatcl-pctr.c.yimg.jp/t/amd-img/20240131-01053381-kana-000-1-view.jpg?exp=10800,2024-01-31T05:31:01+09:00,2024-01-31T05:31:01+09:00,カナロコ by 神奈川新聞,kana,カナロコ by 神奈川新聞,329,\n「麦のトリコ 元住吉店」外観イメージ\n松屋フーズ（東京都）は３１日、創業以来初となるパスタ業態「麦のトリコ」の１号店として「麦のトリコ 元住吉店」（川崎市中原区）を開業する。\n【写真】「虜（トリコ）になる一口。」メニューイメージ\n製法にこだわったというもちっと食感の麺を使用。パスタソースは、ミートソース、たらこ、ペペロンチーノ、カルボナーラ、トマトソースの５種。価格を９６８円、１１８８円、１４０８円と、３段階に設定。ベーシックからぜいたくな素材を使ったメニューまで３ラインを用意した。\n\n 「毎日の食事に、パスタを気軽に」をコンセプトとし、顧客に米以外の楽しみ方を提案。日常的に利用できる自家製生パスタ専門店を目指すという。\n神奈川新聞社,['https://newsatcl-pctr.c.yimg.jp/t/amd-img/20240131-01053381-kana-000-1-view.jpg?pri=l&w=640&h=426&exp=10800'],"['https://news.yahoo.co.jp/articles/6ae5e402df6df145ab465d2e782d710d9fcabb5f/images/000', 'https://www.kanaloco.jp/news/economy/article-1053381.html/gallery']"
