headline,mainEntityOfPage,image,datePublished,dateModified,author,media_en,media_jp,str_count,body,images,external_links
雷伴い激しく降る恐れ「１１日にかけ大雨警戒を」気象台呼びかけ（９日午後６時現在）（ＯＡＢ大分朝日放送）,https://news.yahoo.co.jp/articles/77b0041ddf61734aabbecc069ee9bb92a01752d9,https://newsatcl-pctr.c.yimg.jp/t/amd-img/20250609-00006235-oabv-000-1-thumb.jpg?exp=10800,2025-06-09T19:30:59+09:00,2025-06-09T19:30:59+09:00,ＯＡＢ大分朝日放送,oabv,ＯＡＢ大分朝日放送,244,"大分朝日放送
梅雨前線が接近・停滞する影響で、県内では１１日にかけて大雨に警戒が必要です。

九州の南にある梅雨前線に向かって、暖かく湿った空気が流れ込んでくる影響で、県内は大気の状態が不安定になります。

１０日夕方までの２４時間降水量は、西部で１８０ｍｍ、北部で１５０ｍｍ、中部で１２０ｍｍなどと予想されていて、局地的に雷を伴い非常に激しく降るおそれがあります。

大分地方気象台は、今夜からあさってにかけて、土砂災害や低い土地の浸水、河川の増水や氾濫に警戒するよう呼びかけています。",[],[]
“友情の蛍”７３回目の交流　竹田市の小学校と大分市の福祉施設（ＯＡＢ大分朝日放送）,https://news.yahoo.co.jp/articles/9ea1b6846e6e6e73bacbd97fd123ce0aba501235,https://newsatcl-pctr.c.yimg.jp/t/amd-img/20250609-00006234-oabv-000-1-thumb.jpg?exp=10800,2025-06-09T19:30:59+09:00,2025-06-09T19:30:59+09:00,ＯＡＢ大分朝日放送,oabv,ＯＡＢ大分朝日放送,481,"大分朝日放送
大分県竹田市の小学生が、福祉施設の子どもたちにホタルを贈りました。７３年にわたって続く交流行事です。

カゴに入れられた小さなホタルたち。竹田小学校の全校児童が３日かけて２２２匹集めました。

竹田小学校６年　工藤凛音さん：
「ホタル贈りは笑顔と優しさを届ける行事として（前身の）明治小学校からどんな状況でもずっと受け継がれてきた」

１９５３年、大分市の福祉施設清明あけぼの学園の初代園長が、「子どもたちにホタルを見せてあげたい」と、かつての教え子に依頼したのをきっかけに交流が始まりました。

子どもたち：
「これホタル？」
「これじゃん」

イベントは２０２５年で７３回目。子どもたちは一緒にホタルを観察するなど交流を深めていました。

竹田小の児童：
「最初は緊張したけど、最後には楽しく過ごせたので良かった」
「夜に行かないと（ホタルが）取れない、危なくて大変だった」
「今まで繋いできた竹田小学校の伝統を自分たちで繋げたことがうれしい」

贈られたホタルは１カ月ほど世話をし、生まれてきた幼虫を、竹田小学校の近くの川に放流する予定です。",[],[]
水難事故から子どもたちを守れ　教員が“着衣泳”学ぶ　日赤県支部が講習会開催（ＯＡＢ大分朝日放送）,https://news.yahoo.co.jp/articles/c182f84456f192f9533b1c560c06837b2212bc2e,https://newsatcl-pctr.c.yimg.jp/t/amd-img/20250609-00006232-oabv-000-1-thumb.jpg?exp=10800,2025-06-09T19:30:59+09:00,2025-06-09T19:30:59+09:00,ＯＡＢ大分朝日放送,oabv,ＯＡＢ大分朝日放送,323,"大分朝日放送
子どもたちの水難事故を防ぐため、教職員を対象に服を着たまま泳ぐ“着衣泳”の講習会が開かれました。

日本赤十字社県支部が、水難事故が増える時期を前に初めて実施しました。小中学校の先生６人が参加しました。

川や海に落ちて溺れている人の体の力を抜くコツや、ペットボトルやランドセルなど身近にあるものを使って浮く方法を学びました。

【日本赤十字社県支部・北島純子さん】
「助けに行った人が溺れてしまう事故も多いので助ける時は陸上から助けることが基本になる。浮くための物を使って陸上から助ける方法を知っていただくことが大切」

警察によりますと、２０２４年７月と８月の２か月間に、県内では９件の水難事故が発生し、５人が亡くなっています。",[],[]
いよいよ参院選へ　１８市町村の選管職員を対象に説明会　これまでに４人が立候補表明（ＯＡＢ大分朝日放送）,https://news.yahoo.co.jp/articles/ac1a1c4d86f6a48770c9d83c860cbed088f9140f,https://newsatcl-pctr.c.yimg.jp/t/amd-img/20250609-00006231-oabv-000-1-thumb.jpg?exp=10800,2025-06-09T19:30:59+09:00,2025-06-09T19:30:59+09:00,ＯＡＢ大分朝日放送,oabv,ＯＡＢ大分朝日放送,309,"大分朝日放送
参議院議員選挙が７月に迫っています。大分県内の市町村を対象にした説明会がありました。

県庁で開かれた事前説明会には、県内１８市町村の選挙管理委員会職員が参加し、県の選管から、投票用紙の配布日といった今後の日程と、執行上の注意点などの説明がありました。

今回は、７月２８日に任期満了を迎えることから、いまのところ、７月３日公示、２０日投開票の公算が大きくなっています。

ひとつの議席を争う大分選挙区には、これまでに、自民党、現職の白坂亜紀さん（５８）、立憲民主党、元職の吉田忠智さん（６９）、参政党、新人の野中しんすけさん（３８）、ＮＨＫ党、新人の二宮大造さん（５４）の４人が立候補を表明しています。",[],[]
“ツーロック”で自転車盗難をゼロに　駅に次いでマンションの駐輪場で被害多く（ＯＡＢ大分朝日放送）,https://news.yahoo.co.jp/articles/e31f98714ae3a8f2362e51a82998db58e3d9f41b,https://newsatcl-pctr.c.yimg.jp/t/amd-img/20250609-00006230-oabv-000-1-thumb.jpg?exp=10800,2025-06-09T19:30:59+09:00,2025-06-09T19:30:59+09:00,ＯＡＢ大分朝日放送,oabv,ＯＡＢ大分朝日放送,373,"大分朝日放送
６月９日はその語呂合わせから「ロックの日」です。警察などが自転車盗難を防ぐため施錠を呼びかけました。

９日の朝、ＪＲ大分駅前で、警察や大分東明高校の生徒などおよそ２０人が、チラシとワイヤー錠を配って呼びかけました。

江藤アナウンサー：
「今年、県内で起きた自転車盗難のうち、７８％が無施錠でした。警察によると、施錠はもちろんですが、“ツーロック”で被害に遭う可能性はほとんど無くなるといいます」

大分中央警察署　中央交番　奥永幸光所長：
「鍵かけは誰にでもできる防犯でなによりも効果的。鍵かけの徹底を」

県内では今年、先月末までに、２８３件の自転車盗難が起きていて、去年の同じ期間に比べて４４件増えています。

大分中央警察署管内では駅の被害が４割と最も注意が必要ですが、次に多いのはマンションなどの駐輪場だということです。",[],[]
都町強盗致傷事件　傷害の疑いで１５歳の少年と１６歳の少女を書類送検（ＯＡＢ大分朝日放送）,https://news.yahoo.co.jp/articles/e082a402a04ae0586b543c035b04ce4e262c8202,https://newsatcl-pctr.c.yimg.jp/t/amd-img/20250609-00006229-oabv-000-1-thumb.jpg?exp=10800,2025-06-09T19:30:59+09:00,2025-06-09T19:30:59+09:00,ＯＡＢ大分朝日放送,oabv,ＯＡＢ大分朝日放送,337,"大分朝日放送
２０２５年４月、大分市の繁華街で、男性が数人のグループから暴行を受け、現金を盗まれた事件で、１０代の男女２人が傷害の疑いで書類送検されました。

この事件は２０２５年４月、大分市都町で、４５歳の男性看護師が男女のグループから暴行を受け、現金４８万円が入ったバッグを盗まれました。

男性は暴行を受けた際、左足の骨を折るなどの重傷を負っています。

警察は男性にけがをさせた疑いで、市内に住む無職の１５歳の少年と１６歳の少女を、９日、傷害容疑で書類送検しました。

取り調べに対し、２人とも容疑を認めており、被害者と面識はないということです。

この事件では現金が入ったバッグを盗んだ疑いで、大分市の飲食店従業員、井餘田龍明被告（２３）が逮捕・起訴されています。",[],[]
“入札妨害事件”足立市長が市議会で陳謝　内部調査を実施の意向示す（ＯＡＢ大分朝日放送）,https://news.yahoo.co.jp/articles/fe6d1cdebb8cae82daa36a4e4c747948968cb3b2,https://newsatcl-pctr.c.yimg.jp/t/amd-img/20250609-00006228-oabv-000-1-thumb.jpg?exp=10800,2025-06-09T19:30:59+09:00,2025-06-09T19:30:59+09:00,ＯＡＢ大分朝日放送,oabv,ＯＡＢ大分朝日放送,266,"大分朝日放送
大分市の元市議会議員が逮捕された入札妨害事件について、足立市長は内部調査をする意向を示しました。

足立信也大分市長「公平性が求められる入札・契約業務に関して、市民の皆さまに多大なるご迷惑とご心配をおかけしたことについて、深くお詫び申し上げます」

９日開会した大分市議会で、市長はこのように陳謝。職員の関与などについて、内部調査をする方針を示しました。

また、２月に起きたごみ収集業務をめぐる官製談合事件については、業者との契約が解除され、新しい委託業者を決めるために６３００万円が補正予算案に盛り込まれています。",[],[]
【フカボリ】今年の梅雨の傾向　５月までに台風の発生がないのは９年ぶり　この先どうなる？（ＯＡＢ大分朝日放送）,https://news.yahoo.co.jp/articles/f5e4495799e383491fe32639015d7791608edded,https://newsatcl-pctr.c.yimg.jp/t/amd-img/20250609-00006236-oabv-000-1-thumb.jpg?exp=10800,2025-06-09T19:30:59+09:00,2025-06-09T19:30:59+09:00,ＯＡＢ大分朝日放送,oabv,ＯＡＢ大分朝日放送,1009,"大分朝日放送
大分を含む九州北部は、８日に梅雨入りが発表されました。平年よりも４日遅い梅雨入りです。

ウェザーニューズの週間予報によりますと、県内はこの先２週間のうち１２日間で雨マーク。すっきりしない天気が続きます。

一方、梅雨の天候とともに気になるのが台風です。２０２５年はまだ台風が発生していません。１９５１年に統計を取り始めてから６番目の遅さです。

今年の梅雨と台風の傾向を、気象予報士の上岡さんが、最新情報を解説します。

県内は８日に梅雨入り。２０２５年の梅雨の傾向をみていきます。

最新の１カ月予報によると、６月の雨量は、平年よりも少なくなる確率が３０％、平年並みが３０％、多くなる確率がやや高くて４０％となっています。

その理由をみていきます。今年は、太平洋高気圧が平年よりも北に位置し、日本列島に近づきます。

この太平洋高気圧の縁の部分をなぞるように、南から暖かく湿った空気が九州北部に向かって流れ込みやすい状況になります。

このため梅雨前線が刺激され、活動が活発になる時期がありそうです。

９日も、梅雨入りしてさっそく、まとまった雨となっていますが、この先も注意が必要です。

９日は九州南部で線状降水帯発生予測が出されましたが、暖かく湿った空気の流れ込みが続いたり、梅雨前線が同じ場所で停滞し続けると、線状降水帯が発生するおそれがあります。

短い時間に同じ場所で雨が降り続くと、災害の危険性が高まるので、警戒が必要です。

梅雨入りして大雨が心配ですが、そろそろ台風も気になります。２０２５年はまだ台風が発生しておらず、記録的に遅くなっています。

２０２４年は台風１号が５月２５日に発生しましたが、２０２５年は５月までに台風の発生はなく、これは９年ぶりのことです。

ウェザーニューズによると、２０２５年の予想発生数は２３個程度で、平年が２５個なのでやや少なくなりそうです。日本へ接近する台風は１１個程度で、平年と同じくらいと予想されています。

また、２０２５年は台風が発生する位置に特徴があります。２０２５年は平年より、赤色で示した西側と日本により近い北側で発生する可能性が高くなっています。

このため、台風が発生してから日本に到達するまでの時間が短くなったり、台風が発達した状態で日本に接近する可能性があります。
これから先、大雨や台風への備えを早めにおこないましょう。",[],[]
“鉄道からの風景”美しく　ＪＲ九州大分支社が清掃活動　田ノ浦周辺で（ＯＡＢ大分朝日放送）,https://news.yahoo.co.jp/articles/f9077428ba5ded34d222d9197a0bde4e664b42d7,https://newsatcl-pctr.c.yimg.jp/t/amd-img/20250609-00006227-oabv-000-1-thumb.jpg?exp=10800,2025-06-09T12:18:03+09:00,2025-06-09T12:18:03+09:00,ＯＡＢ大分朝日放送,oabv,ＯＡＢ大分朝日放送,295,"大分朝日放送
大分を訪れる観光客を「おもてなし」するため、道の駅たのうららの周りで清掃活動がありました。

この取り組みは、鉄道からの美しい風景を守るため、ＪＲ九州大分支社が大分河川国道事務所などと協力して実施しました。

７日はおよそ５０人が参加し、国道１０号沿いの歩道のごみ拾いや鉄道路線の周りの木を伐採するなど、清掃活動に励みました。

ＪＲ九州大分支社　宮崎龍一さん：
「大分を訪れる多くのお客様、地域の皆さまに気持ちよく快適に利用してもらえるように環境美化をして維持し続けていきたい」

ＪＲ九州大分支社は、今年の秋にも観光施設が点在する国道１０号沿いで清掃活動を予定しています。",[],[]
県内“梅雨入り”　梅雨前線北上し１１日にかけ大雨に注意（ＯＡＢ大分朝日放送）,https://news.yahoo.co.jp/articles/b75ca6a98f2862d3abd180cbf9d3bba38683081a,https://newsatcl-pctr.c.yimg.jp/t/amd-img/20250609-00006226-oabv-000-1-thumb.jpg?exp=10800,2025-06-09T12:18:03+09:00,2025-06-09T12:18:03+09:00,ＯＡＢ大分朝日放送,oabv,ＯＡＢ大分朝日放送,303,"大分朝日放送
大分県内は９日の午後から１１日にかけて、大雨に注意が必要です。

気象庁は８日、大分を含む九州北部が梅雨入りしたとみられると発表しました。平年より４日遅い梅雨入りです。

九州の南にある梅雨前線が今後北上して停滞するため、県内は９日の午後から１１日にかけて大気の状態が不安定になり、大雨に注意が必要です。

１０日朝までの２４時間降水量は、西部で１２０ｍｍ、北部で１００ｍｍ、中部と南部でも８０ｍｍと予想されていて、前線の活動が活発になった場合は警報級の大雨となる可能性もあります。

大分地方気象台は、９日の午後から土砂災害や低い土地の浸水、河川の増水・氾濫に注意するよう呼びかけています。",[],[]
