headline,mainEntityOfPage,image,datePublished,dateModified,author,media_en,media_jp,str_count,body,images,external_links
インフルエンザ、小学校と中学校計5校で学年閉鎖など休業措置　今シーズン23件目　岩手県（岩手めんこいテレビ）,https://news.yahoo.co.jp/articles/e05412ae284023e2b5a746f4e6fcaf67bd725129,https://newsatcl-pctr.c.yimg.jp/t/amd-img/20251028-90024573-nmit-000-1-view.jpg?exp=10800,2025-10-28T21:47:01+09:00,2025-10-28T21:47:01+09:00,岩手めんこいテレビ,nmit,岩手めんこいテレビ,632,"岩手県庁
岩手県と盛岡市は10月28日、インフルエンザにより小学校4校・中学校1校で休業措置が取られたと発表しました。

八幡平市の寺田小学校では全校児童43人のうち11人がり患し、10月27日から10月29日に5年生が学年閉鎖となりました。

北上市の黒沢尻北小学校では全校児童696人のうち11人がり患し、10月28日から10月30日に5年生の1クラスが学級閉鎖となりました。

一関市の花泉小学校では全校児童464人のうち24人がり患し、10月28日から10月30日に3年生の1クラスが学級閉鎖となりました。

滝沢市の月が丘小学校では全校児童196人のうち5人がり患し、10月28日から10月30日に4年生が学年閉鎖となりました。

盛岡市の大宮中学校では全校生徒512人のうち17人がり患し、10月27日から10月29日に1年生の1クラスが学級閉鎖となりました。

県内での今シーズン（2025年9月以降）のインフルエンザによる学校等の休業措置は、これで23件となりました。（昨シーズンの同時期は1件）

また、県は15日に「インフルエンザ流行シーズンに入った」と発表しています。2024年に比べ約1カ月早い流行入りです。

県や盛岡市ではインフルエンザの予防として、マスクの着用や外出後や食事前などこまめな手洗い、乾燥しやすい室内では加湿器を使用し、睡眠・バランスの良い食事を心がけるよう呼びかけています。

（岩手めんこいテレビ）
岩手めんこいテレビ",[],[]
ソフトバンク城島CBOが花巻東訪問　佐々木麟太郎選手を1位指名　岩手県（岩手めんこいテレビ）,https://news.yahoo.co.jp/articles/8509b30dacf36c8c3846699fa7ffad23b3bbdab6,https://newsatcl-pctr.c.yimg.jp/t/amd-img/20251028-90024574-nmit-000-1-view.jpg?exp=10800,2025-10-28T21:30:01+09:00,2025-10-28T21:30:01+09:00,岩手めんこいテレビ,nmit,岩手めんこいテレビ,542,"ソフトバンク　城島健司CBO
プロ野球ドラフト会議でスタンフォード大学の佐々木麟太郎選手を1位指名したソフトバンクの城島健司CBO（＝チーフベースボールオフィサー）が、花巻東高校（岩手県花巻市）を訪ね、「球団のリーダーになれる選手」と高い評価を示しました。

佐々木麟太郎選手の母校・花巻東高校を訪れたのは、ソフトバンクの城島健司CBOです。

ソフトバンクは10月23日のプロ野球ドラフト会議で、花巻東高校出身でスタンフォード大学の佐々木麟太郎選手を1位で指名し、DeNAとの競合の末、交渉権を獲得しました。

城島CBOは10月28日、佐々木選手の父で花巻東高校野球部の佐々木洋監督に、指名のあいさつをしました。

その後、報道陣の取材に対し佐々木選手の印象を次のように話しました。

ソフトバンク　城島健司CBO
「麟太郎選手の打撃が、うちの戦力、売りになってくれるんだと。球団のリーダーになってくれる、核になる選手じゃないかと評価している」

そのうえで城島CBOは「今後の進路については、本人の判断を尊重したい」との意向を示しました。

また城島CBOは11月上旬にアメリカに渡り、佐々木選手本人に指名のあいさつをする予定です。

（岩手めんこいテレビ）
岩手めんこいテレビ",[],[]
岩手大学の敷地内にクマ出没　中心市街地の銀行の地下駐車場ではクマ居座り、その後捕獲　岩手県（岩手めんこいテレビ）,https://news.yahoo.co.jp/articles/48bc23915518ddde1a4e32f986e36bae566aa5d8,https://newsatcl-pctr.c.yimg.jp/t/amd-img/20251028-90024572-nmit-000-1-thumb.jpg?exp=10800,2025-10-28T21:20:01+09:00,2025-10-28T21:20:01+09:00,岩手めんこいテレビ,nmit,岩手めんこいテレビ,937,"岩手めんこいテレビ
10月28日朝、岩手県盛岡市の銀行の地下駐車場でクマが約3時間に渡って居座り、市と警察により捕獲されました。
午後には岩手大学の敷地にも別のクマが現れて行方をくらましたため、警戒が続いています。

28日午前6時半ごろ、視聴者のドライブレコーダーが捉えた映像には、1頭のクマが歩道の脇にある壁をよじ登り、建物の敷地へ侵入して行く様子が確認できます。

内記和人記者
「岩手県庁からほど近い盛岡市の中心市街地です。こちらの銀行の地下駐車場にクマが逃げ込んだということです」

28日午前6時半過ぎ、盛岡市中央通にある岩手銀行本店の地下駐車場に侵入したのは体長1ｍほどのクマでした。

人や物への被害は確認されていませんが、通勤や通学で往来が多い時間帯でのクマの出没に盛岡市の中心市街地は騒然としました。

Ｑ：今クマが逃げ込んだようだが…
観光客
「うそ？本当？こんな街中で？」

通勤中の会社員
「え？地下の駐車場に？そうですか。（クマが）いつ来ても対処できるよう、心構えをしている」

市によりますと、クマは駐車場の地下2階にとどまっていましたが、約3時間後、麻酔の吹き矢で眠らせ捕獲したということです。

この付近では27日夜から親子連れとみられるクマ2頭が相次いで目撃されていて、今回捕獲された子どもとみられるクマは銀行に逃げ込む直前まで、盛岡市本町通の駐車場の立ち木にとどまっていました。

一方、盛岡市上田の岩手大学でも正午前、敷地内の西側にある国際交流センター付近で1頭のクマが目撃されました。
午前に捕獲されたクマと27日昨夜から行動を共にしていた親グマとみられています。

敷地内では木の下にとどまるクマの姿が学生によって捉えられていました。

岩手大学の学生
「テレビでしか見ていなかったから、本当にいるとなると実感が湧かない」
「講義が終わる直前に出たので、もしかしたら遭遇したかもと話していた。怖いです」

この影響で岩手大学では29日までの講義を全て休講にする措置が取られました。

警察によりますと、これまでに構内で人や物への被害は確認されていませんが、クマの姿が見えなくなったため警察が警戒を続けています。
岩手めんこいテレビ",[],[]
大谷翔平 2ＨＲ含む4安打！ 佐々木朗希 ＷＳ初登板で力投！岩手出身コンビの活躍でドジャース勝利　試合時間6時間39分・延長18回死闘を制す（岩手めんこいテレビ）,https://news.yahoo.co.jp/articles/91a0d0de7cbda216b7021e1a7fd0181d45973ae3,https://newsatcl-pctr.c.yimg.jp/t/amd-img/20251028-90024571-nmit-000-1-view.jpg?exp=10800,2025-10-28T21:18:01+09:00,2025-10-28T21:18:01+09:00,岩手めんこいテレビ,nmit,岩手めんこいテレビ,673,"日本時間10月28日、1勝1敗で迎えたドジャース対ブルージェイズのワールドシリーズ第3戦はドジャースタジアムで開催されました。

大歓声に包まれる中、大谷翔平選手は第1打席、カーブを捉えた打球はワンバウンドしてそのまま客席に入るツーベースヒットで、ポストシーズン6試合連続安打を記録します。

第2打席は1点リードで迎えた3回、内角高めのストレートを振り抜くと、打球はライトスタンドへ飛び込むワールドシリーズ2本目のホームランでリードを広げます。

その後、逆転を許すと5回の第3打席は、詰まったかに見えましたが、左中間を深々と破るタイムリーツーベースヒットで、ベンチに向かって叫び、士気を高めるとチームはこの回、同点に追いつきます。

7回、再び1点を追う展開で4打席目は、157km/hのストレートを左中間スタンドへ弾き返しました。

28日、2本目のホームランで試合を5対5の振り出しに戻します。

この緊迫した展開の中、8回、ドジャースは1アウト1塁2塁のピンチを迎えた場面で佐々木朗希投手がワールドシリーズに初登板します。

内野ゴロ2つに抑えピンチを切り抜けると、次の9回も無失点に抑えました。

大谷選手は、その後、4打席連続の申告敬遠を含む、5つのフォアボールで徹底的に勝負を避けられました。

試合は延長18回の末、4番・フリーマン選手のサヨナラホームランで劇的なサヨナラ勝ちで、チームは2勝目を挙げています。
6時間39分の大激戦でした。

試合：ドジャース6×ー5ブルージェイズ

（岩手めんこいテレビ）
岩手めんこいテレビ",[],[]
森林の被害額は59億3900万円　2月の大船渡市山林火災　市が調査結果公表　岩手県（岩手めんこいテレビ）,https://news.yahoo.co.jp/articles/cb2105861820eec97a41b46aa8d20b6cbcca82bd,https://newsatcl-pctr.c.yimg.jp/t/amd-img/20251028-90024576-nmit-000-1-view.jpg?exp=10800,2025-10-28T20:57:01+09:00,2025-10-28T20:57:01+09:00,岩手めんこいテレビ,nmit,岩手めんこいテレビ,430,"大船渡市　渕上清市長
2025年2月に発生した大船渡市の山林火災について、岩手県と大船渡市が実施した森林被害の調査結果が10月28日に公表され、被害額が59億3900万円にのぼることが明らかになりました。

2025年2月19日と26日に大船渡市で発生した山林火災について、県や市などは、5月から約5カ月間にわたり森林の焼失面積や被害額について調査してきました。

その結果、森林の焼失面積については、衛星画像データの解析や現地調査を行い、合わせて3370haと確定しました。

また、森林の被害額については「森林保険法」に基づく保険金額を基準に算定した結果、合計で59億3900万円に上ることが明らかになりました。

森林の焼失面積と被害額が確定したことを受け、渕上清市長は「改めて今回の火災が地域にもたらした影響の深刻さを痛感している。被災した森林の再生に向けた取り組みを着実に進めていく」とコメントしました。

（岩手めんこいテレビ）
岩手めんこいテレビ",[],[]
“列に並ばずに切符を購入”　盛岡駅「みどりの窓口」に新システム　県内初導入　岩手県盛岡市（岩手めんこいテレビ）,https://news.yahoo.co.jp/articles/309f6438ceb9a23536ef45edff7578ac5f9fdd7d,https://newsatcl-pctr.c.yimg.jp/t/amd-img/20251028-90024569-nmit-000-1-thumb.jpg?exp=10800,2025-10-28T20:37:01+09:00,2025-10-28T20:37:01+09:00,岩手めんこいテレビ,nmit,岩手めんこいテレビ,549,"岩手めんこいテレビ
11月1日からＪＲ盛岡駅（岩手県盛岡市）のみどりの窓口に整理券システムが導入されます。
岩手県内での導入は初めてで、列に並ばずに切符を購入できるようになります。

整理券システム「ｍａｔｏｃａ」（まとか）が導入されるのは、盛岡駅2階の南側にある「南みどりの窓口」です。

10月28日は、報道向けにシステムのデモンストレーションが行われました。

はじめに、発券機のボタンを押すと整理券が発券され、モニターに順番待ちの番号が表示されます。

また、整理券のＱＲコードを読み取ると無料通信アプリ「ＬＩＮＥ」と連携され、別の場所にいても順番待ちの通知を受け取ることができるため、列に並ばずに切符を購入できるようになります。

ＪＲによりますと、盛岡駅のみどりの窓口は、お盆や年末年始などの時期を中心に多い時で30組ほどの行列ができるため、今回の導入に至ったということです。

ＪＲ盛岡統括センター　太田凡子副長
「ＬＩＮＥでの呼び出し機能を活用することで、待ち時間に駅での買い物を楽しみながらお待ちいただける新しいサービスとなっているので、ぜひご利用いただければ」

整理券システム「ｍａｔｏｃａ」の導入は県内では初めてで、稼働開始は11月1日を予定しています。
岩手めんこいテレビ",[],[]
最低賃金引き上げを周知　岩谷凜アナウンサーが一日労働局長に　岩手県（岩手めんこいテレビ）,https://news.yahoo.co.jp/articles/95bb2790fc40e1a46ce64e515cdb536ae0206259,https://newsatcl-pctr.c.yimg.jp/t/amd-img/20251028-90024568-nmit-000-1-thumb.jpg?exp=10800,2025-10-28T20:30:01+09:00,2025-10-28T20:30:01+09:00,岩手めんこいテレビ,nmit,岩手めんこいテレビ,585,"岩手めんこいテレビ
岩手県内の最低賃金が、12月から時給1031円に引き上げられます。
これを広く知らせるため、岩手めんこいテレビの岩谷凜アナウンサーが、一日労働局長に委嘱され啓発活動をしました。

10月28日は岩手労働局の白石好春局長から、岩手めんこいテレビの岩谷凜アナウンサーなど4人に一日労働局長の辞令が交付されました。

県内の10月28日時点の最低賃金は952円ですが、12月1日からは1031円になります。
79円の上げ幅は過去最大です。

委嘱された4人は、盛岡駅前でチラシの入ったティッシュを配りながら、最低賃金の引き上げを呼びかけました。

岩谷凜アナウンサー
「最低賃金が上がったことを知らなかったという声があった。これをきっかけに、最低賃金について今一度考えていただけたらうれしい」

岩手労働局によりますと、2024年度、県内で最低賃金法違反があった事業場のうち「法律の適用を知らなかった」と回答した事業場が9.5％、「最低賃金額を知らなかった」と答えた事業場が26.2％だったということです。

岩手労働局　白石好春局長
「賃金額に不安とか、疑義があれば、まずは労働局に一報いただきたい」

岩手労働局では、今後も高校や大学での広報活動などを通して、これから社会人になる若い世代に向けて、重点的に周知することにしています。
岩手めんこいテレビ",[],[]
自衛官がバス・トラックの運転を体験　退職後の再就職先に　岩手県滝沢市（岩手めんこいテレビ）,https://news.yahoo.co.jp/articles/9ff518d4d5873fd3a54b22e43b907dcfea435bad,https://newsatcl-pctr.c.yimg.jp/t/amd-img/20251028-90024551-nmit-000-1-view.jpg?exp=10800,2025-10-28T18:56:02+09:00,2025-10-28T18:56:02+09:00,岩手めんこいテレビ,nmit,岩手めんこいテレビ,537,"岩手めんこいテレビ
バスやトラックの運転手不足が深刻化するなか、退職を控える自衛官に運転手としての再就職を検討してもらおうと、岩手県滝沢市の岩手駐屯地で10月27日、バスとトラックの試乗会が開かれました。

定年退職などを控える自衛官を対象としたバスなどの体験試乗会は、2024年に続いて2回目の開催となります。

トラックの試乗会は今回が初めてで、自衛官たちは運送会社の担当者から操作方法を教わりながら、一人ずつ駐屯地内のコースを運転しました。

27日に自衛官たちが運転したトラックは、車体の長さが12mで、普段業務で使用しているトラックの2倍にあたるということです。

勝手は異なるものの、自衛官たちはコースを数回まわると操作に慣れ、スムーズにトラックやバスを運転していました。

参加した自衛官からは「すぐに慣れたので、後半は問題なく運転できた。運転が好きなので、将来も運転に携われる仕事に就きたいと思っていて参考になった」との声が聞かれました。

岩手県北自動車　大下篤志専務
「今回をきっかけに、より多くの自衛官に第二の職場として選んでほしい」

自衛隊によりますと、2024年は参加者のうち3人がバスの運転手として再就職したということです。
岩手めんこいテレビ",[],[]
インフルエンザ、中学校で学校閉鎖など計7施設で休業措置　今シーズン18件に　岩手県（岩手めんこいテレビ）,https://news.yahoo.co.jp/articles/2f11ecd6071f71d14f744a370c3b3fc0882c8a59,https://newsatcl-pctr.c.yimg.jp/t/amd-img/20251028-90024565-nmit-000-1-view.jpg?exp=10800,2025-10-28T18:08:02+09:00,2025-10-28T18:08:02+09:00,岩手めんこいテレビ,nmit,岩手めんこいテレビ,809,"岩手県庁
岩手県と盛岡市は10月27日、インフルエンザにより県内の7施設で休業措置が取られたと発表しました。

北上市の南小学校では全校児童421人のうち15人がり患し、10月27日から10月29日に6年生の1クラスが学級閉鎖となりました。

北上市の鬼柳小学校では全校児童297人のうち15人がり患し、10月27日から10月29日に5年生の1クラスが学級閉鎖となりました。

一関市の一関小学校では全校児童575人のうち18人がり患し、10月28日から10月30日に3年生の１クラスが学級閉鎖となりました。

奥州市の江刺第一中学校では全校生徒581人のうち87人がり患し、10月28日から学校閉鎖となりました。

北上市の専修大学北上高等学校では全校生徒863人のうち18人がり患し、10月27日から10月29日に2年生の1クラスが学級閉鎖となりました。

大船渡市の大船渡保育園では、在籍する園児109人のうち35人がり患し、10月26日から10月28日に0歳児クラスと1歳児クラスが、10月27日から10月29日に2歳児クラスと5歳児クラスが休業措置となりました。

盛岡市の認定こども園ふじみ幼稚園では、在籍する園児124人のうち16人がり患し、10月28日から10月30日に5歳児の1クラスが休業措置となりました。

県内での今シーズン（2025年9月以降）のインフルエンザによる学校等の休業措置は、これで18件となりました。（昨シーズンの同時期は1件）

また、県は15日に「インフルエンザ流行シーズンに入った」と発表しています。2024年に比べ約1カ月早い流行入りです。

県や盛岡市ではインフルエンザの予防として、マスクの着用や外出後や食事前などこまめな手洗い、乾燥しやすい室内では加湿器を使用し、睡眠・バランスの良い食事を心がけるよう呼びかけています。

（岩手めんこいテレビ）
岩手めんこいテレビ",[],[]
クマが銀行の地下駐車場に逃げ込む、盛岡市の中心市街地　「こんな街中で？」観光客も驚き　約3時間後麻酔の吹き矢で捕獲　岩手県（岩手めんこいテレビ）,https://news.yahoo.co.jp/articles/6392b279653f210a92f8d277b04bf68dac0ab512,https://newsatcl-pctr.c.yimg.jp/t/amd-img/20251028-90024563-nmit-000-1-thumb.jpg?exp=10800,2025-10-28T13:49:02+09:00,2025-10-28T13:49:02+09:00,岩手めんこいテレビ,nmit,岩手めんこいテレビ,599,"岩手めんこいテレビ
10月28日朝、岩手県盛岡市の銀行の敷地に1頭のクマが出没し、その後、銀行の地下駐車場に逃げ込みました。
クマは、約3時間、駐車場にとどまりましたが捕獲されました。

内記和人記者
「岩手県庁からほど近い盛岡市の中心市街地です。こちらの銀行の地下駐車場にクマが逃げ込んだということです」

28日午前6時半ごろ、盛岡市中央通の岩手銀行本店の敷地に、体長1ｍほどのクマ1頭が出没し、銀行の地下駐車場に逃げ込みました。

警察
「地下の駐車場にクマが入りました」

午前7時前、クマの居場所を確認するため警察車両が地下駐車場へ入っていきました。

これまでに人や物への被害は確認されていませんが、通勤や通学で往来が多い時間帯でのクマの出没に、盛岡市の中心市街地は騒然としました。

観光客
「本当？こんな街中で？」

通勤中の会社員
「え？地下の駐車場に？そうですか。（クマが）いつ来ても対処できるよう、心構えをしている」

警察や銀行の関係者によりますと、クマは駐車場の地下2階にとどまっていましたが、約3時間後、市が麻酔の吹き矢で眠らせ捕獲したということです。

現場は県庁からわずか100ｍの場所でした。

銀行は現在、通常通り営業を行っています。

また、盛岡市上田では、このクマの親とみられる別のクマ1頭が目撃されているため、警察が警戒を強めています。
岩手めんこいテレビ",[],[]
【速報】岩手大学構内でクマ目撃　構内にとどまる　岩手県盛岡市（岩手めんこいテレビ）,https://news.yahoo.co.jp/articles/bca6d29eeec5dbd3d30cb1f3254478790bfc44a5,https://newsatcl-pctr.c.yimg.jp/t/amd-img/20251028-90024564-nmit-000-3-view.jpg?exp=10800,2025-10-28T12:50:02+09:00,2025-10-28T13:21:02+09:00,岩手めんこいテレビ,nmit,岩手めんこいテレビ,140,"岩手めんこいテレビ
10月28日午前11時50分ごろ、岩手県盛岡市上田の岩手大学構内にある「国際交流会館」付近で学生が成獣とみられるクマ1頭を目撃しました。

クマは現在も大学の構内にとどまっているということです。

これまでにけが人などは確認されていません。
岩手めんこいテレビ",[],[]
中小企業の支援拡充へ　最低賃金引き上げ前に労働局が要請　岩手県（岩手めんこいテレビ）,https://news.yahoo.co.jp/articles/fe28ac4e919314d58a58413fe9c36e19c0a97f85,https://newsatcl-pctr.c.yimg.jp/t/amd-img/20251028-90024562-nmit-000-1-thumb.jpg?exp=10800,2025-10-28T12:44:02+09:00,2025-10-28T12:44:02+09:00,岩手めんこいテレビ,nmit,岩手めんこいテレビ,404,"岩手めんこいテレビ
岩手県内の最低賃金が2025年12月から1031円に引き上げられるのを前に、岩手労働局が県に対し、中小企業などへの支援拡充を求める要請を行いました。

10月27日は、岩手労働局の白石好春局長が、県商工労働観光部の箱石知義部長に要請書を手渡しました。

岩手の最低賃金を巡っては、2025年8月の審議会の結果、最低賃金を現在の「時給952円」から79円引き上げ、時給1031円とする答申案が示され、2025年12月から適用されます。

要請書には、中小企業などの助成金申請に要する経費の支援や地域の実情を踏まえた支援策の拡充などが盛り込まれています。

県商工労働観光部　箱石知義部長
「経済成長に向けて、県も国と一緒に企業の経営、賃上げをしっかりと支援していきたい」

県では、今後「国の施策を見極めた上で、県内企業を支える独自の支援策を検討していく」としています。
岩手めんこいテレビ",[],[]
【速報】盛岡市中心部　岩手銀行本店の駐車場にクマ居座る　現場付近では目撃情報相次ぐ　岩手県（岩手めんこいテレビ）,https://news.yahoo.co.jp/articles/f5b595724fd93b0c67da525bbff0089238c7b8a0,https://newsatcl-pctr.c.yimg.jp/t/amd-img/20251028-90024561-nmit-000-2-view.jpg?exp=10800,2025-10-28T10:00:02+09:00,2025-10-28T12:06:01+09:00,岩手めんこいテレビ,nmit,岩手めんこいテレビ,241,"岩手めんこいテレビ
警察によりますと午前7時過ぎ岩手県盛岡市中央通の岩手銀行本店の地下駐車場に、子グマ1頭が居座っているということです。

1階の正面玄関横にある駐車場はシャッターで封鎖されていて、午前9時時点でもクマは駐車場内に居座っています。

現場は岩手県庁や盛岡市役所が近くにある市内の中心部で、銀行関係者と市などが捕獲に向けて対応を協議しています

現場付近では27日の午後10時以降、親子とみられるクマの目撃が相次いでいて警察が注意を呼び掛けています
岩手めんこいテレビ",[],[]
