headline,mainEntityOfPage,image,datePublished,dateModified,author,media_en,media_jp,str_count,body,images,external_links
20歳以下最終戦Next Gen ATPファイナルズ 出場4選手決定＜男子テニス＞（tennis365.net）,https://news.yahoo.co.jp/articles/e9a79334f1bb0191355f922e7c1c7db61941ab5e,https://newsatcl-pctr.c.yimg.jp/t/amd-img/20241125-00010009-tennisnet-000-3-view.jpg?exp=10800,2024-11-25T21:41:51+09:00,2024-11-25T22:31:27+09:00,tennis365.net,tennisnet,tennis365.net,1224,20歳以下最終戦Next Gen ATPファイナルズ 20歳以下最終戦 ［画像提供： ゲッティイメージズ］ 男子プロテニス協会のATPは25日に公式サイトを更新し、12月18日に開幕する20歳以下最終戦Next Gen ATPファイナルズ（サウジアラビア/ジッダ、ハード）に出場の決まった4選手を発表した。 【西岡 良仁、坂本 怜ら 四日市チャレンジャー組合せ】 同大会は20歳以下の選手で年間の獲得ポイント上位7選手と、ワイルドカード（主催者推薦）が与えられた選手の8名が出場する大会。4名ずつに分かれ予選ラウンドロビンを戦い、各グループの上位2名が準決勝に駒を進める。試合形式は4ゲーム制の5セットマッチで、2017年から新型コロナウイルスの影響を受けた2020年を除き過去6度開催されている。 初代チャンピオンはチョン・ヒョン（韓国）で、以降はS・チチパス（ギリシャ）、J・シナー（イタリア）、C・アルカラス（スペイン）、B・ナカシマ（アメリカ）、H・メジェドビッチ（セルビア）。 今回、大会は公式サイトで出場の決まった4選手を発表した。 A・フィス（フランス） フィスは昨年同大会で決勝に進出し、今年もツアーで目覚ましいシーズンを送っている。その中でもハンブルグ・ヨーロピアン・オープン（ドイツ/ハンブルグ、レッドクレー、ATP500）と木下グループ ジャパンオープンテニス チャンピオンシップス2024（日本/東京、ハード、ATP500）のタイトル獲得が際立っている。今シーズンの戦績は37勝26敗となっている。 A・ミケルセン（アメリカ） ミケルセンは、昨年同大会デビューを果たし今年も出場を決めた。今年8月にトップ50入りを果たし、現在世界ランク42位につけている。ミケルセンは今季、インフォシス・ホール・オブ・フェーム・オープン（アメリカ/ニューポート、芝、ATP250）とウィンストン・セーラム・オープン（アメリカ/ウィンストン・セーラム、ハード、ATP250）でツアーレベルの決勝に進出し、全豪オープン（オーストラリア/メルボルン、ハード、グランドスラム）では自身初のグランドスラム3回戦進出を果たした。 J・メンシク（チェコ） メンシクは、2月のカタール・エクソンモービル・オープン（カタール/ドーハ、 ハード、ATP250）で自身初となるATPツアー決勝に進出した。10月にはA・ルブレフやG・ディミトロフ（ブルガリア）といったトップ10選手を破りロレックス・上海マスターズ（中国/上海、ハード、ATP1000）で8強入りした。19歳のメンシクは、年初は世界ランク167位だったが、現在は世界ランク48位となっている。 シャン・ジュンチェン（中国） 強力なショットを武器にするこ19歳のシャンは、9月の成都オープン（中国/成都、ハード、ATP250）で優勝し、ATPツアーでタイトルを獲得した史上2人目の中国人選手となった。,[],[]
錦織圭は2つ下げ107位に 11月25日付日本勢世界ランキング＜男子テニス＞（tennis365.net）,https://news.yahoo.co.jp/articles/0f613938f923afffd3fa583b8adfc2b16d640c1c,https://newsatcl-pctr.c.yimg.jp/t/amd-img/20241125-00010008-tennisnet-000-1-view.jpg?exp=10800,2024-11-25T19:45:02+09:00,2024-11-25T19:45:02+09:00,tennis365.net,tennisnet,tennis365.net,856,11月25日付ATP世界ランキング 錦織圭［画像提供：ゲッティイメージズ］ 男子テニスの11月25日付ATP世界ランキングが更新され、錦織圭は順位を2つ下げ107位とし、日本勢3番手を維持した。 【錦織圭 選手詳細情報】 34歳で元世界ランク4位の錦織は先月のスロバキア・オープン 2024（スロバキア/ブラチスラバ、室内ハード、ATPチャレンジャー）で4強入り。 さらに、今月のHPPオープン（フィンランド/ヘルシンキ、室内ハード、ATPチャレンジャー）では公式戦で約1年5ヵ月ぶりの優勝を飾った。 錦織は同大会を最後に今シーズンを終了したため前週の大会には出場せず、今週のポイント加算はなかったが、他選手のランキングが変動したことで前週から2つ順位を下げた。 その他では前週の横浜慶應チャレンジャー国際テニストーナメント 2024 supported by 三田興産（日本/横浜、ハード、ATPチャレンジャー）で優勝を飾った清水悠太が順位を18上げ、自己最高位となる199位となった。 11月25日付ATP世界ランキングの日本勢上位10選手は以下の通り。 ※[]内は前回のランキングからの変動数、()内は前回のポイント ■70位[ - ]…西岡良仁 776ポイント（776ポイント） ■83位[ - ]…ダニエル太郎 674ポイント（674ポイント） ■107位[ ↓2 ]…錦織圭 578ポイント（578ポイント） ■146位[ ↓5 ]…内山靖崇 398ポイント（432ポイント） ■182位[ - ]…トゥロター・ジェームズ 323ポイント（323ポイント） ■195位[ ↓2 ]…島袋将 297ポイント（297ポイント） ■199位[ ↑18 ]…清水悠太 287ポイント (262ポイント) ■248位[ ↑4 ]…望月慎太郎 219ポイント（213ポイント） ■302位[ ↓1 ]…野口莉央 174ポイント（174ポイント） ■346位[ ↑5 ]…今村昌倫 146ポイント（141ポイント）,[],[]
中川直樹 四日市チャレンジャー初の初戦突破、次戦は坂本怜と対戦の可能性＜男子テニス＞（tennis365.net）,https://news.yahoo.co.jp/articles/7f2c18ce48bcd458f638bdbd1ecd0307fe2fa16d,https://newsatcl-pctr.c.yimg.jp/t/amd-img/20241125-00010007-tennisnet-000-2-view.jpg?exp=10800,2024-11-25T18:34:13+09:00,2024-11-25T18:42:41+09:00,tennis365.net,tennisnet,tennis365.net,624,"四日市チャレンジャー 中川直樹（画像は横浜慶應CH）[画像提供：tennis365.net] 男子テニスの四日市チャレンジャー（日本/四日市、ハード、ATPチャレンジャー）は25日、シングルス1回戦が行われ、世界ランク384位の中川直樹が同345位のD・スウィーニー（オーストラリア）を7-6 (12-10), 6-2のストレートで破り、同大会初の初戦突破を果たした。 【西岡 良仁、坂本 怜ら 四日市チャレンジャー組合せ】 同大会3年連続3度目の出場となった28歳の中川。 1回戦の第1セット、第7ゲームで相手に先にブレークを許した中川だったが、続く第8ゲームでブレークバックに成功した。その後、タイブレークに突入し、両者が5度ずつミニブレークを奪い合う展開となった。タイブレークで先にセットポイントを握ったのは相手だったが、中川がこれを死守。中川は5本目のセットポイントを取り切り、先行した。 第2セットでは、2度のブレークを果たした中川が相手に1度もブレークを許さずに試合を優勢に進め、1時間45分で勝利し同大会で初の初戦突破を果たした 勝利した中川は、2回戦でワイルドカード（主催者推薦）で出場している世界ランク682位の坂本怜と予選勝者で同392位のP・ヘニング（南アフリカ）の勝者と対戦する。 また、同日に行われた1回戦では世界ランク366位内田海智がワイルドカードで出場した同454位磯村志を6-0, 6-1で破り初戦突破を果たした。",[],[]
日本勢3名が予選突破し本戦入り、守屋宏紀は1回戦で第1シードの西岡良仁と激突＜男子テニス＞（tennis365.net）,https://news.yahoo.co.jp/articles/d0699a978fb8bb358b1d4592d4a6a7c848d4bbb0,https://newsatcl-pctr.c.yimg.jp/t/amd-img/20241125-00010006-tennisnet-000-1-view.jpg?exp=10800,2024-11-25T16:15:49+09:00,2024-11-25T16:15:49+09:00,tennis365.net,tennisnet,tennis365.net,518,"四日市チャレンジャー 守屋宏紀（画像は2023年のNSWオープン）[画像/ゲッティイメージズ] 男子テニスの四日市チャレンジャー（日本/四日市、ハード、ATPチャレンジャー）は25日、シングルスの予選決勝が行われ、世界ランク379位の守屋宏紀が同480位のA・アエニ（アメリカ）を7-6 (7-5), 6-1のストレートで破り、本戦入りを決めた。 【西岡 良仁、坂本 怜ら 四日市チャレンジャー組合せ】 同大会4度目3年連続の出場となった34歳の守屋は、予選決勝で25歳のアエニと対戦した。 本戦出場がかかった予選決勝戦の第1セット、両者1度ずつブレークに成功する展開でタイブレークに突入。これを守屋が制し第1セットを先行する。 そして第2セットで守屋は2度のブレークに成功するとそのままリードを守り切り勝利を収め、2年連続となる本戦進出を決めた。 勝利した守屋は本戦1回戦で第1シードの西岡良仁と対戦する。 また、同日に行われた予選決勝では高橋悠介がP・バー・ビリュコフを6-4, 6-3で、田口涼太郎が白石光を6-3, 6-0でそれぞれ勝利を収め、本戦に駒を進めた。 なお熊坂拓哉、松田龍樹は予選決勝で敗れ本戦進出とはならなかった。",[],[]
伊藤あおい 最新WTA世界ランクで日本勢3番手に浮上、内島萌夏、大坂なおみに次ぐ順位へ＜女子テニス＞（tennis365.net）,https://news.yahoo.co.jp/articles/98cf4caca458e6546b6c67f7dd7afa8360c67641,https://newsatcl-pctr.c.yimg.jp/t/amd-img/20241125-00010005-tennisnet-000-2-view.jpg?exp=10800,2024-11-25T15:26:57+09:00,2024-11-25T15:52:22+09:00,tennis365.net,tennisnet,tennis365.net,669,"WTA世界ランキング 伊藤あおい(画像は全日本選手権)[画像/tennis365.net] 女子テニスの11月25日付WTA世界ランキングが更新され、前週の高崎国際オープン（日本/群馬、ハード、ITF）で今季3度目のITFツアー制覇を達成した伊藤あおいが21上げ、自己最高となる129位に浮上した。 【伊藤あおい 選手詳細情報】 スライスやドロップショット、ロブなどを駆使するテクニカルで独特なプレースタイルで躍進を続ける20歳の伊藤は、前週に記録していた150位がキャリアハイだったが、今週それをさらに更新。同57位の内島萌夏、同60位の大坂なおみに次ぐ日本勢3番手となった。 そのほかではITF W50カラウンドラ（オーストラリア/カラウンドラ、ハード、ITF）で準優勝した坂詰姫野が23上げて247位に浮上した。 25日付WTA世界ランキングの日本勢上位10選手は以下の通り。 ※[]内は前回のランキングからの変動数 ■57位[ ↓1 ]…内島萌夏 1,040ポイント ■60位[ ↓1 ]…大坂なおみ 1,014ポイント ■129位[ ↑21 ]…伊藤あおい 582ポイント ■140位[ ↓7 ]…柴原瑛菜 547ポイント ■150位[ ↑2 ]…日比野菜緒 496ポイント ■155位[ ↓8 ]…本玉真唯 473ポイント ■157位[ ↑4 ]…齋藤咲良 452ポイント ■201位[ ↓1 ]…石井さやか 354ポイント ■235位[ ↑8 ]…岡村恭香 300ポイント ■247位[ ↑23 ]…坂詰姫野 279ポイント",[],[]
デ杯連覇のイタリア 強さの秘訣について語る「僕たちは常にコートに心を込めている」＜男子テニス＞（tennis365.net）,https://news.yahoo.co.jp/articles/ed6a6479012fd71a7859a916c8ccd2ce6b856464,https://newsatcl-pctr.c.yimg.jp/t/amd-img/20241125-00010004-tennisnet-000-1-view.jpg?exp=10800,2024-11-25T14:08:51+09:00,2024-11-25T14:08:51+09:00,tennis365.net,tennisnet,tennis365.net,1041,"デビスカップファイナルズ ファイナル8 抱き合うヤニック・シナーとマッテオ・ベレッティーニ[画像/ゲッティイメージズ] 男子テニスの国別対抗戦 デビスカップファイナルズ ファイナル8（スペイン/マラガ、室内ハード）は24日に大会最終日を迎え、イタリアがオランダを2勝0敗で破り、2連覇を達成した。試合後、男子プロテニス協会のATPは公式サイトに、勝利に大きく貢献したJ・シナー（イタリア）とM・ベレッティーニ（イタリア）のコメントを掲載した。 【動画】イタリア デビスカップ連覇の瞬間 同大会は8ヵ国（イタリア、オランダ、スペイン、オーストラリア、アメリカ、ドイツ、カナダ、アルゼンチン）が世界一の座をトーナメント形式で争う。試合はシングルス2試合とダブルス1試合で争われ、先に2勝した方が勝利となる。 世界ランク1位のシナーを筆頭にベレッティーニやL・ムセッティ（イタリア）などシングルス上位ランカーを揃え連覇を狙うイタリアは、準々決勝でアルゼンチン、準決勝でオーストラリアを破って決勝に駒を進めた。一方のオランダは準々決勝でスペインに、準決勝ではドイツに勝利しての勝ち上がり。 決勝戦、シングルスの第1試合では世界ランク35位のベレッティーニが圧巻のサービスゲームを披露して、同80位のB・ファン・デ・ザンスフルプ（オランダ）を6-4, 6-2のストレートで破り、イタリアの連覇に王手をかける。 そしてシングルス第2試合ではエースのシナーが同40位のT・フリークスポール（オランダ）を7-6 (7-2), 6-2のストレートで下し、大会2連覇を決めた。 男子プロテニス協会のATPは公式サイトにシナーとベレッティーニのコメントを掲載している。 シナー 「素晴らしい一年だった。チーム全体をとても誇りに思っている。その裏には多くの努力があり、再びこのトロフィーを手にすることができてとても嬉しい。今日はとても難しい一日だった。何が起こるか分からないからね」 ベレッティーニ 「とても嬉しい。昨年はもちろんチームをサポートするためにここに来たし、今年はポイントをもたらした。でも、誰がプレーしているかなんて関係ない。僕たちは常にコートに心を込めている。全員がベストを尽くしている。それがチームの秘訣なんだ。F・コボッリ（イタリア）やM・アルナルディ（イタリア）といった故郷にいる選手たちも、前のステージで重要な試合に勝っている。本当に大きなチームだし、トロフィーはとてもうれしいよ」",[],[]
37歳フォニーニ 母国デ杯Vの裏でチャレンジャー大会制覇 今季初のトロフィー獲得＜男子テニス＞（tennis365.net）,https://news.yahoo.co.jp/articles/a3e5b952daabe42b21a7ce9985a216793def4197,https://newsatcl-pctr.c.yimg.jp/t/amd-img/20241125-00010003-tennisnet-000-1-view.jpg?exp=10800,2024-11-25T12:26:21+09:00,2024-11-25T12:26:21+09:00,tennis365.net,tennisnet,tennis365.net,871,"モンテマル・チャレンジャー 優勝を飾ったファビオ・フォニーニ(画像はチャイナOP)[画像/ゲッティイメージズ] 男子テニスのモンテマル・チャレンジャー（スペイン/モンテマル、クレー、ATPチャレンジャー）は24日、シングルス決勝が行われ、ワイルドカード（主催者推薦）で出場した第1シードのF・フォニーニ（イタリア）が世界ランク259位のL・ノイマイヤー（オーストリア）を6-3, 2-6, 6-3のフルセットで破り、通算8度目のチャレンジャー大会優勝を飾った。 【動画】37歳のベテラン フォニーニ、チャレンジャー大会8勝目の瞬間 37歳のフォニーニは2019年ロレックス・モンテカルロ・マスターズ（モナコ/モンテカルロ、レッドクレー、ATP1000）でキャリア最大のタイトルを獲得し、自己最高の世界ランク9位を記録。しかしその後は両足の手術を行うなど順位を下げ、2023年11月には147位にまでランクを落としてしまっていたが、今季はチャレンジャー大会を中心に好成績を残し、現在は84位にまで上昇させている。 今大会は国別対抗戦 デビスカップファイナルズ ファイナル8（スペイン/マラガ、室内ハード）において、J・シナー（イタリア）やM・ベレッティーニ（イタリア）、L・ムセッティ（イタリア）らが勝ち上がりを決めているなか、同じスペインで行われていた。 フォニーニは1回戦で世界ランク246位のD・リンコン（スペイン）、2回戦で同514位のS・グリン、準々決勝で同212位のD・イェフセイェフ（カザフスタン）、準決勝で同709位のI・M・デ・ラ・トーレ（スペイン）を下し決勝に駒を進めた。 決勝戦、フォニーニは計7本のダブルフォルトを犯すなどサービスが不安定だったがフルセットの熱戦の末に2時間18分で勝利。今季、ツアーやチャレンジャー大会を通じて初のトロフィーを獲得した。 また、同日行われたデビスカップファイナルズ ファイナル8ではイタリアがオランダを決勝で破り2連覇を達成。フォニーニにとっても、イタリアにとっても明るい1日となった。",[],[]
シナー&パオリーニ中心に活躍 イタリア勢が国別対抗戦2冠、今季テニス界を席巻＜テニス＞（tennis365.net）,https://news.yahoo.co.jp/articles/61f70710a0c2575858d0a5106fcd857ca97fce15,https://newsatcl-pctr.c.yimg.jp/t/amd-img/20241125-00010002-tennisnet-000-2-view.jpg?exp=10800,2024-11-25T11:07:07+09:00,2024-11-25T11:26:30+09:00,tennis365.net,tennisnet,tennis365.net,1168,イタリア勢が席巻する1年に (左から)ヤニック・シナーとジャスミン・パオリーニ[画像/ゲッティイメージズ] 男子テニスの国別対抗戦 デビスカップファイナルズ ファイナル8（スペイン/マラガ、室内ハード）は24日に大会最終日を迎え、イタリアがオランダを2勝0敗で破り、2連覇を達成した。イタリアは前週の女子国別対抗戦 ビリー・ジーン・キング・カップ by ゲインブリッジ・ファイナルズ（スペイン/マラガ、室内ハード）でも優勝を飾っており、男女ともに2024年の国別対抗戦でタイトルを獲得することとなった。 【動画】イタリア デビスカップ連覇の瞬間 男子国別対抗戦のデビスカップファイナルズ ファイナル8では、世界ランク1位のJ・シナー（イタリア）をエースに据え、準々決勝のアルゼンチン、準決勝のオーストラリア、決勝でオランダを撃破。大会2連覇を成し遂げた。 さらに同週には、チャレンジャー大会でもイタリア勢が結果を残しており、チッタ・ディ・ロベレト（イタリア/ロベレト、室内ハード、ATPチャレンジャー）ではL・ナルディ（イタリア）が、モンテマル・チャレンジャー（スペイン/モンテマル、クレー、ATPチャレンジャー）では37歳のF・フォニーニ（イタリア）が優勝を飾った。 また、前週の女子国別対抗戦のビリー・ジーン・キング・カップでは、世界ランク4位のJ・パオリーニ（イタリア）、そしてパオリーニとダブルスでペアを組みパリオリンピック（フランス/パリ、レッドクレー）などを制したS・エラーニ（イタリア）の鉄板コンビの活躍で、日本、ポーランド、イタリアを破り、11年ぶりとなるタイトルを母国にもたらした。 今シーズンはシナーとパオリーニを中心にイタリア勢はツアーでも活躍をおさめ、シナーは全豪オープン（オーストラリア、メルボルン、ハード、グランドスラム）と全米オープン（アメリカ/ニューヨーク、ハード、グランドスラム）、そしてNitto ATPファイナルズ（イタリア/トリノ、室内ハード）などを制覇。年末時点での世界ランク1位の称号である年間1位を初めて獲得した。 また、パオリーニは今季が躍進の1年に。28歳と遅咲きのパオリーニは、全豪オープンで16強入りすると、全仏オープン（フランス/パリ、レッドクレー、グランドスラム）で準優勝。続くウィンブルドン（イギリス/ロンドン、芝、グランドスラム）でも準優勝を果たし、全米オープンで16強入り。エラーニと組んだダブルスでは前述したパリオリンピックで金メダルを獲得したほか、「WTA1000」の大会で2度優勝。シングルスで世界ランク4位、ダブルスで10位に位置している。 今季は1月からシーズン終了までテニス界で活躍し続けたイタリア勢。来年はどの国のどのような選手が印象的な結果を残すだろうか。,[],[]
内山靖崇 大胸筋肉離れで今季終了「来シーズンこそはトップ100復帰」今季はCH2勝&ツアー8強＜男子テニス＞（tennis365.net）,https://news.yahoo.co.jp/articles/6be9e3122d1b78538e8a68be2b5ffbaa3658ad82,https://newsatcl-pctr.c.yimg.jp/t/amd-img/20241125-00010001-tennisnet-000-1-view.jpg?exp=10800,2024-11-25T09:26:30+09:00,2024-11-25T09:26:30+09:00,tennis365.net,tennisnet,tennis365.net,728,SNSで報告 横浜慶應チャレンジャーでの内山靖崇[画像/tennis365.net] 男子テニスで世界ランク140位の内山靖崇が24日にSNSを更新し、今季の終了を報告するとともに来季への目標を綴った。 【西岡良仁、坂本怜ら 四日市チャレンジャー組合せ】 32歳の内山は今季、4月のVitro釜山・オープン（韓国/釜山、ハード、ATPチャレンジャー）と9月の張家港 国際 チャレンジャー（中国/張家港、ハード、ATPチャレンジャー）の2度チャレンジャー大会を制覇。ツアー大会では9月の杭州オープン（中国/杭州、ハード、ATP250）で第1シードのH・ルーネ（デンマーク）を下すなどベスト8進出を果たした。 前週の横浜慶應チャレンジャー国際テニストーナメント 2024 supported by 三田興産（日本/横浜、ハード、ATPチャレンジャー）では負傷の影響もあり1回戦で敗退。試合後に大胸筋の肉離れと診断されたことを明かし、今週の四日市チャレンジャー（日本/四日市、ハード、ATPチャレンジャー）は欠場して今季終了となった。 内山のコメントは以下の通り。 「今週の慶應チャレンジャーの会場入りをしてから大胸筋に痛みがあり、大会後に検査をしたところ、肉離れをしており、四日市チャレンジャーは出場せずにシーズンを終えることになりました」 「昨年に引き続き怪我でシーズンを終える形となりましたが、今シーズンはチャレンジャー2大会優勝、ATP250でベスト8とコロナ禍以降で1番良いシーズンでした。 まだフィジカルコンディションが整えば力を出せると思いますし、来シーズンこそはトップ100復帰を目指して頑張っていきます。今シーズンも応援ありがとうございました」,[],[]
