headline,mainEntityOfPage,image,datePublished,dateModified,author,media_en,media_jp,str_count,body,images,external_links
世界最高額は誰だ！ 市場価値ランキング1位。まだ20歳！？ 移籍後すぐに大活躍。底知れぬ才能（フットボールチャンネル）,https://news.yahoo.co.jp/articles/543f016f572e866efeb960b64715c253fae98861,https://newsatcl-pctr.c.yimg.jp/t/amd-img/20240218-00010005-footballc-000-1-view.jpg?exp=10800,2024-02-18T12:12:33+09:00,2024-02-18T12:12:33+09:00,フットボールチャンネル,footballc,フットボールチャンネル,1031,\n【写真：Getty Images】\n2023/24シーズンも後半戦に差し掛かり、欧州サッカーは一段と盛り上がりをみせている。そんなサッカー界で、優れたプレイヤーの指標の1つとも言えるのが市場価値であり、その額は年齢や活躍によって算出される。ここでは、サッカー選手の市場価値をランキング形式で紹介する。（成績、市場価値は『transfermarkt』を参照。データは2024年2月15日現在）\n【写真：Getty Images】\n1位：ジュード・ベリンガム（レアル・マドリード／イングランド代表）\n生年月日：2003年6月29日\n市場価値：1億8000万ユーロ（約252億円）\n2023/24リーグ戦成績：21試合16得点3アシスト\n\n 数々のスター選手を差し置いて、レアル・マドリードでプレーするイングランド代表MFジュード・ベリンガムが現在の市場価値ランキングでトップに立った\n\n 2019/20シーズンに当時16歳でバーミンガム・シティのトップチームに昇格した同選手は、いきなり主力に定着。20年夏にドルトムントへと引き抜かれると、同年11月にイングランド代表に初招集され、シーズン終了後に行われたユーロ2020（欧州選手権）にも出場した。瞬く間にスター選手の1人となったベリンガムは今季からプレーするレアル・マドリードで、さらに評価を高めている。\n\n 20歳の若武者はこの年齢にしてフィジカルと技術、そして攻守両面のどちらの能力もハイレベルに兼ね備えている。局面ごとにあらゆる能力が求められる現代フットボールの中で理想的な「最強の万能型MF」と言えるかもしれない。彼がレアル・マドリードに即フィットできたのは、すでに「勝者のメンタリティ」を持っていたからだろう。何事に対しても物怖じすることなく立ち向かい、飽くなき勝利への執念を持ち合わせているのはクラブカラーと合致する。\n\n 今季は開幕から4試合連続ゴールを記録し、自身初のエル・クラシコで2つのゴラッソを叩き込んだベリンガムの市場価値は高騰を続けている。すでに加入時と比較をすると6000万ユーロ（約84億円）アップの1億8000万ユーロ（約252億円）にまで上昇しており、全フットボーラーでトップに立った。底知れぬポテンシャルの持ち主である彼が今後どのようなサッカー選手へと成長するのか。そのスケールの大きさに世界中が注目していることだろう。\nフットボールチャンネル,"['https://newsatcl-pctr.c.yimg.jp/t/amd-img/20240218-00010005-footballc-000-1-view.jpg?exp=10800', 'https://newsatcl-pctr.c.yimg.jp/t/amd-img/20240218-00010005-footballc-001-1-view.jpg?exp=10800']","['https://news.yahoo.co.jp/articles/543f016f572e866efeb960b64715c253fae98861/images/000', 'https://news.yahoo.co.jp/articles/543f016f572e866efeb960b64715c253fae98861/images/001']"
美しいゴール！古橋亨梧がお手本のような一撃！相手を完全に崩して奪ったセルティックの先制弾（フットボールチャンネル）,https://news.yahoo.co.jp/articles/bced1109373badce1ca3e1d2f829178ebfb34bbc,https://newsatcl-pctr.c.yimg.jp/t/amd-img/20240218-00531901-footballc-000-1-view.jpg?exp=10800,2024-02-18T10:16:49+09:00,2024-02-18T10:16:49+09:00,フットボールチャンネル,footballc,フットボールチャンネル,679,\n【写真：Getty Images】\nスコティッシュ・プレミアシップ第26節、セルティック対キルマーノックが現地時間17日に行われ、1-1のドローに終わった。セルティックは後半アディショナルタイム（AT）の失点で惜しくも勝利を逃してしまうも、スタメン出場を果たしたFW古橋亨梧が先制ゴールを決めている。\n【動画】古橋亨梧のヘディング弾がこれだ！\n古橋のゴールが生まれたのは32分。ルイス・パルマがペナルティエリア手前の左でボールを受けると、そのままドリブルで中へ切り込んで縦パスを送る。このボールを受けた前田大然がダイレクトでマット・オライリーに落とす。さらにオライリーはアンソニー・ラルストンにパスを出し、ラルストンがクロスを供給。これにファーサイドで待ち構えていた古橋が頭で合わせて先制ゴールをもたらした。\n\n\n 相手を完全に崩して奪ったゴールだ。ドリブルと細かいパスで相手DF陣を翻弄。リズム良くパスを回していたため、相手DFはボールウォッチャーに。パスを回している時に古橋は、マークについているDFの背後を取る。そして、完璧なクロスボールが入ると、お手本のようなヘディングシュート。見事なパス回し、完璧なクロスボール、古橋の綺麗なヘディングシュートと、なんとも美しいゴールだった。\n\n 古橋のゴールで先制したセルティックだったが、デイビット・ワトソンにヘディングでゴールを許し、土壇場で同点。結局、試合は1-1のドローに終わった。\n【動画】古橋亨梧のヘディング弾がこれだ！\n参照元：YouTube\nフットボールチャンネル編集部,['https://newsatcl-pctr.c.yimg.jp/t/amd-img/20240218-00531901-footballc-000-1-view.jpg?exp=10800'],"['https://news.yahoo.co.jp/articles/bced1109373badce1ca3e1d2f829178ebfb34bbc/images/000', 'https://www.footballchannel.jp/2024/02/18/post531901/2/']"
横浜F・マリノス注目の新加入（2）バトンタッチ。主力DFの穴埋めを託されたのは同級生！？（フットボールチャンネル）,https://news.yahoo.co.jp/articles/fe9810a07497bab1c1ef31526ca53ea530ed5360,https://newsatcl-pctr.c.yimg.jp/t/amd-img/20240218-00010004-footballc-000-1-view.jpg?exp=10800,2024-02-18T11:50:42+09:00,2024-02-18T11:50:42+09:00,フットボールチャンネル,footballc,フットボールチャンネル,675,\n【写真：Getty Images】\n明治安田J1リーグの2024シーズンは2月23日に開幕を迎える。昨季は2位で連覇を逃した横浜F・マリノスは、今冬に期限付き移籍からの復帰も含めて8人の新戦力を迎えた。フットボールチャンネルでは、彼らの中から新天地での活躍が期待される選手を紹介する。\n【写真：Getty Images】\nDF：渡邊泰基（背番号39）\n生年月日：1999年4月22日（24歳）\n前所属クラブ：アルビレックス新潟\n2023リーグ戦成績：21試合2得点1アシスト\n\n この冬に角田涼太朗が横浜F・マリノスからヨーロッパへ移籍した。守備陣の主力が抜けた穴を埋める活躍が期待されているのが、渡邊泰基だ。\n\n 渡邊と角田はともに前橋育英高校出身の同学年。当時の渡邊は左サイドバックで、抜群のスピードを活かした積極的なオーバーラップを武器としていた。\n\n 高校卒業後の2018年にアルビレックス新潟でプロキャリアを始めた渡邊は、2023シーズンに自身初のJ1を経験。シーズン途中にセンターバックにコンバートされて定位置を獲得し、リーグ戦21試合に出場している。\n\n 渡邊は、サイドバックとして培った攻撃性能に加え、対人の守備の強さも持ちあわせている。身長は180cmでセンターバックとしては小柄だが、空中戦でも強さを発揮する。\n\n 2023シーズンの横浜F・マリノスは、最終ラインの負傷者続出に苦しんだ。複数ポジションをこなせるという点でも、渡邊の加入は大きな意味を持つかもしれない。\nフットボールチャンネル,"['https://newsatcl-pctr.c.yimg.jp/t/amd-img/20240218-00010004-footballc-000-1-view.jpg?exp=10800', 'https://newsatcl-pctr.c.yimg.jp/t/amd-img/20240218-00010004-footballc-001-1-view.jpg?exp=10800']","['https://news.yahoo.co.jp/articles/fe9810a07497bab1c1ef31526ca53ea530ed5360/images/000', 'https://news.yahoo.co.jp/articles/fe9810a07497bab1c1ef31526ca53ea530ed5360/images/001']"
とんでもない才能！ 欧州で大活躍する10代の逸材（9）ペップ・シティが誇るタレント！DFらしからぬテクニック&戦術理解力！？（フットボールチャンネル）,https://news.yahoo.co.jp/articles/dd6c41b38e6a02fecf427607aed391e97ff14e2a,https://newsatcl-pctr.c.yimg.jp/t/amd-img/20240218-00010002-footballc-000-1-view.jpg?exp=10800,2024-02-18T08:50:03+09:00,2024-02-18T08:50:03+09:00,フットボールチャンネル,footballc,フットボールチャンネル,1072,\n【写真：Getty Images】\n優秀な若い才能は早いうちにビッグクラブのスカウトの目に留まり、10代で一流クラブでデビューする選手も多くいる。そして、トップチームでもその才能を発揮して価値を高める選手も少なくない。今回は、いま欧州で大活躍している10代の逸材をピックアップして紹介する。※成績は15日時点の『transfermarkt』を参照。各種スタッツはデータサイト『Sofa Score』を参照\n【写真：Getty Images】\nDF： リコ・ルイス（イングランド代表）\n生年月日：2004年11月21日\n所属クラブ：マンチェスター・シティ（イングランド）\n23/24リーグ戦成績：10試合1ゴール0アシスト\n市場価値：3800万ユーロ（約53億円）\n \n 文字通り「ワールドクラス」が揃うマンチェスター・シティで、リコ・ルイスは大きな期待を持たれている10代の選手だ。\n \n 2004年11月21日にマンチェスターで生まれたルイスは、8歳のときにシティの下部組織へ入ると徐々に頭角を現していく。U-18のチームではキャプテンを務め、U-18プレミアリーグ優勝に貢献。昨季のリーグ第2節ボーンマス戦でカイル・ウォーカーに代わって後半終盤に投入され、トップチーム初出場を果たした。\n\n 右サイドバックが本職の19歳は、高い戦術理解力と足元の技術という2つの魅力を持ち合わせている。ペップ・グアルディオラ監督の下で様々なポジションで起用されてきた同選手は、今季は中盤での起用がメインに。初期位置を右SBからスタートさせて攻撃時に中盤でビルドアップに関与する「偽サイドバック」としての役割をこなすことは勿論のこと、ボランチの選手として味方とのパスワークで前進してゴール前でチャンスを作り出すことができる。右SBだけでなく左SBやボランチ、攻撃的なMFとしてもプレー可能という高い「ポリバレント性」は、彼がディフェンダーらしからぬテクニックとずば抜けた戦術理解力を持っている証だろう。\n\n 先日行われたUEFAチャンピオンズ・リーグ（CL）コペンハーゲン戦（ベスト16ファーストレグ）ではベンチを温めたが、今季のCLではこれまでに6試合に出場して3ゴールと波に乗っており、前線の様々なエリアに顔を出して攻撃にリズムと厚みをもたらしている。昨季プレミアリーグ、FAカップ、CLの”三冠”を達成し今季はリーグ4連覇の期待がかかるシティで、将来有望なルイスはどんな爪痕を残せるだろうか。\nフットボールチャンネル,"['https://newsatcl-pctr.c.yimg.jp/t/amd-img/20240218-00010002-footballc-000-1-view.jpg?exp=10800', 'https://newsatcl-pctr.c.yimg.jp/t/amd-img/20240218-00010002-footballc-001-1-view.jpg?exp=10800']","['https://news.yahoo.co.jp/articles/dd6c41b38e6a02fecf427607aed391e97ff14e2a/images/000', 'https://news.yahoo.co.jp/articles/dd6c41b38e6a02fecf427607aed391e97ff14e2a/images/001']"
世界最高額は誰だ！ 市場価値ランキング2位。恐ろしい…。デカくて速くて強い。1試合1ゴールは当たり前？（フットボールチャンネル）,https://news.yahoo.co.jp/articles/a37c1297ca94140928262eb869a46f50e1d36c11,https://newsatcl-pctr.c.yimg.jp/t/amd-img/20240218-00010000-footballc-000-1-view.jpg?exp=10800,2024-02-18T07:30:30+09:00,2024-02-18T07:30:30+09:00,フットボールチャンネル,footballc,フットボールチャンネル,1062,\n【写真：Getty Images】\n2023/24シーズンも後半戦に差し掛かり、欧州サッカーは一段と盛り上がりをみせている。そんなサッカー界で、優れたプレイヤーの指標の1つとも言えるのが市場価値であり、その額は年齢や活躍によって算出される。ここでは、サッカー選手の市場価値をランキング形式で紹介する。（成績、市場価値は『transfermarkt』を参照。データは2024年2月15日現在）\n【写真：Getty Images】\n2位：アーリング・ハーランド（マンチェスター・シティ／ノルウェー代表）\n生年月日：2000年7月12日\n市場価値：1億8000万ユーロ（約252億円）\n2023/24リーグ戦成績：17試合16得点5アシスト\n\n 2位には、昨季プレミアリーグ新記録を樹立して得点王に輝いたアーリング・ハーランドがランクインした。\n\n この怪物FWが最初に有名となったのは2019年夏に行われたU-20ワールドカップだろう。グループリーグ第3節ホンジュラス戦で1試合9ゴールを記録して大会得点王に輝いた。続く2019/20シーズンにザルツブルクで得点を量産。UEFAチャンピオンズリーグ（CL）デビューから史上初となる3試合6ゴールを記録したことで一躍時の人となり、20年冬にドルトムントへ移籍した。そして2022/23シーズンからは現在も所属するマンチェスター・シティでプレーしている。\n\n ハーランドの最大の魅力は異次元の得点力だ。ザルツブルクでは27試合29ゴール、ドルトムントでは89試合86ゴール、マンチェスター・シティでは79試合73ゴールを記録。これは途中出場からの試合も含まれているため、いずれのクラブでも1試合1ゴールを上回るペースで得点を重ねている。屈強な相手DFを片腕で弾き飛ばしてしまうフィジカルや破壊力抜群のシュートに加えて、オフザボールの動きが秀逸なのもハーランドの特徴だ。相手の最終ラインを見ての動き出しやボックス内でフリーになるための駆け引きにも長けており、理想のストライカー像を具現化している。\n\n これだけの成績を残せば市場価値が高騰するのも必然的で、現在は自己最高額となる1億8000万ユーロ（約252億円）を叩き出している。現在23歳ながら、すでにクラブレベルでは200ゴール以上を決めるなど彼の成長は止まらない。そのフットボールへの真面目な性格を考えれば、さらにアンタッチャブルな選手へ成長してもおかしくないだろう。\nフットボールチャンネル,"['https://newsatcl-pctr.c.yimg.jp/t/amd-img/20240218-00010000-footballc-000-1-view.jpg?exp=10800', 'https://newsatcl-pctr.c.yimg.jp/t/amd-img/20240218-00010000-footballc-001-1-view.jpg?exp=10800']","['https://news.yahoo.co.jp/articles/a37c1297ca94140928262eb869a46f50e1d36c11/images/000', 'https://news.yahoo.co.jp/articles/a37c1297ca94140928262eb869a46f50e1d36c11/images/001']"
