headline,mainEntityOfPage,image,datePublished,dateModified,author,media_en,media_jp,str_count,body,images,external_links
レアル・ソシエダ、マジョルカ戦の予想スタメン。古巣との一戦で久保建英の先発は？公式戦連敗中のチームを救えるか（フットボールチャンネル）,https://news.yahoo.co.jp/articles/a212f6753eafb7e7f8c1127699d0a5e5e90a79c6,https://newsatcl-pctr.c.yimg.jp/t/amd-img/20240218-00010012-footballc-000-1-view.jpg?exp=10800,2024-02-18T21:50:32+09:00,2024-02-18T21:50:32+09:00,フットボールチャンネル,footballc,フットボールチャンネル,814,\n【写真：Getty Images】\nラ・リーガ第25節、マジョルカ対レアル・ソシエダが現地時間18日（日本時間19日 2:30KO）にエスタディ・デ・ソン・モイシュで行われる。この試合に、両チームはどのようなメンバーで臨むのだろうか。アウェイのソシエダのスタメンを予想する。\n【画像】レアル・ソシエダ、マジョルカ戦の予想フォーメーション\nソシエダは2月15日に行われたUEFAチャンピオンズリーグ（CL）ラウンド16・1stレグのパリ・サンジェルマン（PSG）戦で0-2の敗北を喫し、公式戦2連敗中である。1月24日のコパ・デル・レイ（スペイン国王杯）準々決勝のセルタ戦以降、勝利から遠ざかっている。2023年10月21日のリーグ戦ではマジョルカに1-0で勝利したが、コパ・・デル・レイ準決勝1stレグではスコアレスドロー。リーグ戦で勝って、ホームでの2ndレグに向けて復調と行きたいところだ。\n\n マジョルカ戦では、カルロス・フェルナンデス、アイヘン・ムニョス、マルティン・メルケランス、キーラン・ティアニー、アルバロ・オドリオソラ、シェラルド・ベッカー、アリツ・エルストンドが負傷のため欠場となる。また、ミケル・オヤルサバルもまだ復帰できず、招集外となっている。\n\n スタメンは以下を予想する。\n\n GKはアレックス・レミロ。4バックは右からアマリ・トラオレ、イゴール・スベルディア、ロビン・ル・ノルマン、ハビ・ガランだ。アンカーにはマルティン・スビメンディ、インサイドハーフにはミケル・メリーノとブライス・メンデスだろう。\n\n 右ウィングには久保建英だ。PSG戦ではフル出場も不発に終わった。アジアカップから復帰した背番号14は、古巣との試合で勝利に導く活躍をすることができるだろうか。センターフォワードにはウマル・サディク、左ウィングはアンデル・バレネチェアが濃厚だ。\nフットボールチャンネル,['https://newsatcl-pctr.c.yimg.jp/t/amd-img/20240218-00010012-footballc-000-1-view.jpg?exp=10800'],"['https://news.yahoo.co.jp/articles/a212f6753eafb7e7f8c1127699d0a5e5e90a79c6/images/000', 'https://www.footballchannel.jp/2024/02/18/post531929/4/']"
マジョルカ、レアル・ソシエダ戦の予想スタメン。狙うは連勝！今季3度目の対戦の行方は？（フットボールチャンネル）,https://news.yahoo.co.jp/articles/9d7081cf3a55b30b6d2b19697f3616d125073492,https://newsatcl-pctr.c.yimg.jp/t/amd-img/20240218-00010010-footballc-000-1-view.jpg?exp=10800,2024-02-18T20:20:25+09:00,2024-02-18T20:20:25+09:00,フットボールチャンネル,footballc,フットボールチャンネル,619,\n【写真：Getty Images】\nラ・リーガ第25節、マジョルカ対レアル・ソシエダが現地時間18日（日本時間19日 2:30KO）にエスタディ・デ・ソン・モイシュで行われる。この試合に、両チームはどのようなメンバーで臨むのだろうか。ホームのマジョルカのスタメンを予想する。\n【画像】マジョルカ、レアル・ソシエダ戦の予想フォーメーション\nマジョルカは1月3日に行われた第19節のレアル・マドリード戦で0-1の敗北を喫して以降、5試合勝利なし。しかし、前節のラージョ戦で2-1の勝利を収めて連敗を2で止めた。7日にホームで行われたコパ・デル・レイ（スペイン国王杯）準決勝1stレグのソシエダ戦では0-0のドロー。今季3度目の対戦で勝利し、コパ・デル・レイ制覇に向けても弾みをつけたいところだ。\n\n ソシエダ戦ではマルティン・ヴァルイェントとパブロ・マフェオが負傷により欠場する。累積警告により、前節のラージョ戦で出場停止だったサイル・ラリンがソシエダ戦から出場可能だ。\n\n スタメンは以下を予想する。\n\n GKはプレドラグ・ライコビッチ。DFはナチョ・ビダル、ジョバンニ・ゴンサレス、アントニオ・ライージョ、マティヤ・ナスタシッチ、ハウメ・コスタだ。\n\n 中盤はアントニオ・サンチェス、サムエル・コスタ、オマール・マスカレル、ダニ・ロドリゲスを予想。ワントップにはサイル・ラリンが濃厚だ。\nフットボールチャンネル,['https://newsatcl-pctr.c.yimg.jp/t/amd-img/20240218-00010010-footballc-000-1-view.jpg?exp=10800'],"['https://news.yahoo.co.jp/articles/9d7081cf3a55b30b6d2b19697f3616d125073492/images/000', 'https://www.footballchannel.jp/2024/02/18/post531929/2/']"
横浜F・マリノス注目の新加入（4）期待と不安…。信頼された前任者の穴は埋まるのか（フットボールチャンネル）,https://news.yahoo.co.jp/articles/ea26379c3bb988214b95da47e9a2cb9bcdc7b467,https://newsatcl-pctr.c.yimg.jp/t/amd-img/20240218-00010013-footballc-000-1-view.jpg?exp=10800,2024-02-18T21:50:36+09:00,2024-02-18T21:50:36+09:00,フットボールチャンネル,footballc,フットボールチャンネル,680,\n【写真：Getty Images】\n明治安田J1リーグの2024シーズンは2月23日に開幕を迎える。昨季は2位で連覇を逃した横浜F・マリノスは、今冬に期限付き移籍からの復帰も含めて8人の新戦力を迎えた。フットボールチャンネルでは、彼らの中から新天地での活躍が期待される選手を紹介する。\n【写真：Getty Images】\nGK：ポープ・ウィリアム（背番号1）\n生年月日：1994年10月21日（29歳）\n前所属クラブ：FC町田ゼルビア\n2023リーグ戦成績：31試合29失点\n\n 横浜F・マリノスは、2023シーズンに幾度もピンチを救い、攻撃の起点にもなったGK一森純が期限付き移籍終了でガンバ大阪に復帰した。その後釜としてやってきたポープ・ウィリアムには、否が応でも注目が集まる。\n\n 東京ヴェルディの下部組織で育ったポープは、なかなかレギュラーの座をつかめないプロキャリアだったが、2020シーズンに在籍したファジアーノ岡山で定位置を獲得して、J2で40試合に出場した。その後、大分トリニータでプレーしたあと、2022シーズンからFC町田ゼルビアでプレーし、2023シーズンのJ2優勝に貢献している。\n\n 192cmの長身で、抜群のセーブ力を誇るポープは、足元の技術にも定評がある。町田では最前線から中間ポジションに下りてきた選手への正確なミドルパスも武器になっていた。\n\n J1での経験が2021シーズンの14試合のみというところは気がかりではあるとしても、一森の後釜として期待されているGKだ。\nフットボールチャンネル,"['https://newsatcl-pctr.c.yimg.jp/t/amd-img/20240218-00010013-footballc-000-1-view.jpg?exp=10800', 'https://newsatcl-pctr.c.yimg.jp/t/amd-img/20240218-00010013-footballc-001-1-view.jpg?exp=10800']","['https://news.yahoo.co.jp/articles/ea26379c3bb988214b95da47e9a2cb9bcdc7b467/images/000', 'https://news.yahoo.co.jp/articles/ea26379c3bb988214b95da47e9a2cb9bcdc7b467/images/001']"
ブライトン、シェフィールド戦の予想スタメン。三笘薫、2試合連続の先発は？欧州カップ戦出場権獲得へ…避けたい連敗（フットボールチャンネル）,https://news.yahoo.co.jp/articles/756d401053ccf36528d248d0644b31c53f7335cf,https://newsatcl-pctr.c.yimg.jp/t/amd-img/20240218-00010009-footballc-000-1-view.jpg?exp=10800,2024-02-18T19:20:23+09:00,2024-02-18T19:20:23+09:00,フットボールチャンネル,footballc,フットボールチャンネル,621,\n【写真：Getty Images】\nプレミアリーグ第25節、シェフィールド対ブライトンが現地時間18日（日本時間18日 23:00KO）にシェフィールドの本拠地ブラモール・レーンで行われる。この試合に、両チームはどのようなメンバーで臨むのだろうか。アウェイのブライトンのスタメンを予想する。\n【画像】ブライトン、シェフィールド戦の予想フォーメーション\nブライトンは前節のトッテナム戦で1-2の敗戦となり、連勝することができなかった。現在9位に位置しており、欧州カップ戦出場権獲得を狙う同チームは連敗を避けたいところ。サッカー日本代表から戻ってきた三笘薫はトッテナム戦で不発に終わるも、フル出場で好プレーを見せていた。アンス・ファティなど怪我人も徐々に復帰しており、ブライトンの復調を期待できそうだ。\n\n シェフィールド戦では、ジョアン・ペドロ、ソリー・マーチ、ジェームズ・ミルナー、フリオ・エンシソが負傷のため欠場となる。\n\n スタメンは以下を予想する。\n\n GKはジェイソン・スティール。4バックはタリック・ランプティ、ヤン・ポール・ファン・ヘッケ、ルイス・ダンク、ペルビス・エストゥピニャンだ。\n\n ダブルボランチはパスカル・グロスとビリー・ギルモア。右サイドにファクンド・ブオナノッテ、トップ下にアンス・ファティ、左サイドに三笘薫を予想。ワントップはダニー・ウェルベックが濃厚である。\nフットボールチャンネル,['https://newsatcl-pctr.c.yimg.jp/t/amd-img/20240218-00010009-footballc-000-1-view.jpg?exp=10800'],"['https://news.yahoo.co.jp/articles/756d401053ccf36528d248d0644b31c53f7335cf/images/000', 'https://www.footballchannel.jp/2024/02/18/post531908/4/']"
古橋亨梧、現地メディアの評価は？「冷静なヘディング」で先制ゴールも…セルティックは痛恨のドロー（フットボールチャンネル）,https://news.yahoo.co.jp/articles/8cfbf1ea321587de960f3661bac736cd0a81a854,https://newsatcl-pctr.c.yimg.jp/t/amd-img/20240218-00531940-footballc-000-1-view.jpg?exp=10800,2024-02-18T17:03:21+09:00,2024-02-18T17:03:21+09:00,フットボールチャンネル,footballc,フットボールチャンネル,622,\n【写真：Getty Images】\nスコティッシュ・プレミアシップ第26節、セルティック対キルマーノックが現地時間17日に行われ、1-1のドローに終わった。この試合でスタメン出場を果たしたFW古橋亨梧が先制ゴールを決めている。ゴールを決めた古橋のスコットランドメディアからの評価とは。\n\n 先制したのはセルティックだった。32分、ルイス・パルマからのボールを受けた前田大然がダイレクトでマット・オライリーに落とす。オライリーはアンソニー・ラルストンにパスを出すと、ラルストンがクロスを供給。ファーサイドにいた古橋がヘディングで合わせて先制点を奪った。\n\n\n 試合はしばらく1-0の状態が続き、このまま試合終了かと思われた後半アディショナルタイムにセルティックが失点。土壇場で勝ち点3を逃す形となった。\n\n スコットランド『グラスゴー・ワールド』がこの試合の採点を掲載。前田は「6.4」とまずまずの評価。ゴールを奪った古橋はラルストン、ジョー・ハートに次ぐチーム3位となる「7.1」と高評価を受けている。また、「ラルストンが信じられないボールを送り、亨梧がセルティックのリードとなる冷静なヘディングシュートを決めた」と言及した。\n\n 現地時間18日にセント・ジョンストンと戦う2位レンジャーズは、勝てばセルティックを抜いて首位浮上となる。セルティックにとっては痛恨のドローとなってしまった。\nフットボールチャンネル編集部,['https://newsatcl-pctr.c.yimg.jp/t/amd-img/20240218-00531940-footballc-000-1-view.jpg?exp=10800'],['https://news.yahoo.co.jp/articles/8cfbf1ea321587de960f3661bac736cd0a81a854/images/000']
シェフィールド、ブライトン戦の予想スタメン。前節勝利で連敗ストップ！連勝で最下位脱出なるか？（フットボールチャンネル）,https://news.yahoo.co.jp/articles/c740d95e8bb8b806b7ba54115d76300e357b7098,https://newsatcl-pctr.c.yimg.jp/t/amd-img/20240218-00010007-footballc-000-1-view.jpg?exp=10800,2024-02-18T16:50:25+09:00,2024-02-18T16:50:25+09:00,フットボールチャンネル,footballc,フットボールチャンネル,668,\n【写真：Getty Images】\nプレミアリーグ第25節、シェフィールド対ブライトンが現地時間18日（日本時間18日 23:00KO）にシェフィールドの本拠地ブラモール・レーンで行われる。この試合に、両チームはどのようなメンバーで臨むのだろうか。ホームのシェフィールドのスタメンを予想する。\n【画像】シェフィールド、ブライトン戦の予想フォーメーション\nシェフィールドは前節のルートン・タウン戦で8試合ぶりの勝利を収め、連敗を2でストップ。残留争いをしている同クラブにとって、前節の勝ち点3は非常に大きい。現在勝ち点13の最下位だが、19位バーンリーが今節アーセナルに負けたため、ブライトン戦で勝利すれば最下位脱出となる。\n\n 前節のルートン戦で左サイドバックのリース・ノリントン=デイビスが試合開始5分で負傷交代となり戦線離脱。また、クリス・バシャム、ジョン・イーガン、オリヴァー・マクバーニー、ジョージ・バルドックが負傷離脱中。さらにダニエル・ジェビソンが健康上の問題で欠場する。\n\n スタメンは以下を予想する。\n\n GKはウェス・フォデリンガム。DFはジェイデン・ボーグル、メイソン・ホルゲート、アネル・アフメドジッチ、ジャック・ロビンソン、マックス・ロウだ。この5バックが三笘薫を擁するブライトンの攻撃陣を抑えられるか注目だ。\n\n 中盤はジェームズ・マカティー、ヴィニシウス・ソウザ、グスタボ・ハメル、ベン・オズボーンを予想。ワントップにはキャメロン・アーチャーが入るだろう。\nフットボールチャンネル,['https://newsatcl-pctr.c.yimg.jp/t/amd-img/20240218-00010007-footballc-000-1-view.jpg?exp=10800'],"['https://news.yahoo.co.jp/articles/c740d95e8bb8b806b7ba54115d76300e357b7098/images/000', 'https://www.footballchannel.jp/2024/02/18/post531908/2/']"
横浜F・マリノス注目の新加入（3）爆発力あり！ サイドで輝く新たな切り札（フットボールチャンネル）,https://news.yahoo.co.jp/articles/a28a3d4468d34f99dd430ba33cec90ed7b1df2a9,https://newsatcl-pctr.c.yimg.jp/t/amd-img/20240218-00010008-footballc-000-1-view.jpg?exp=10800,2024-02-18T18:50:27+09:00,2024-02-18T18:50:27+09:00,フットボールチャンネル,footballc,フットボールチャンネル,713,\n【写真：Getty Images】\n明治安田J1リーグの2024シーズンは2月23日に開幕を迎える。昨季は2位で連覇を逃した横浜F・マリノスは、今冬に期限付き移籍からの復帰も含めて8人の新戦力を迎えた。フットボールチャンネルでは、彼らの中から新天地での活躍が期待される選手を紹介する。\n【写真：Getty Images】\nDF：加藤蓮（背番号16）\n生年月日：1999年12月28日（24歳）\n前所属クラブ：東京ヴェルディ\n2023リーグ戦成績：39試合2得点1アシスト\n\n 加藤蓮は、横浜F・マリノスのサイドに厚みをもたらすことが期待される新戦力だ。\n\n 北海道出身の加藤は、北海道コンサドーレ札幌の下部組織で育ち、明治大学に進学した。大学での活躍が評価されて、2022年に東京ヴェルディと契約してプロ入りすると、1年目から左サイドバックのレギュラーに定着し、J2で30試合に出場している。2年目の2023シーズンは39試合に出場し、クラブのJ1昇格に貢献した。\n\n 加藤は前述のとおり左サイドバックがベースだが、サイドであればどこでもこなせるところも大きな魅力。ときにはピッチの中央に入ることもあり、GK以外ならどこでもこなせてしまいそうなユーティリティー性の持ち主だ。\n\n 2023シーズンのヴェルディでは、途中出場が19回と多かった。スピードがある加藤は、途中出場で試合を変える爆発力があり、その点も城福浩監督に評価されていたようだ。\n\n 先発でも途中出場でもポジションを問わず戦える加藤を、ハリー・キューウェル監督がどのように起用するのかにも注目したい。\nフットボールチャンネル,"['https://newsatcl-pctr.c.yimg.jp/t/amd-img/20240218-00010008-footballc-000-1-view.jpg?exp=10800', 'https://newsatcl-pctr.c.yimg.jp/t/amd-img/20240218-00010008-footballc-001-1-view.jpg?exp=10800']","['https://news.yahoo.co.jp/articles/a28a3d4468d34f99dd430ba33cec90ed7b1df2a9/images/000', 'https://news.yahoo.co.jp/articles/a28a3d4468d34f99dd430ba33cec90ed7b1df2a9/images/001']"
遠藤航の現地メディアの評価は？「リバプールの支配が始まる要因」フル出場で2点目に関与（フットボールチャンネル）,https://news.yahoo.co.jp/articles/d3eba94ae99993b28d9f27787ea3868f2b7c43aa,https://newsatcl-pctr.c.yimg.jp/t/amd-img/20240218-00531937-footballc-000-1-view.jpg?exp=10800,2024-02-18T16:23:28+09:00,2024-02-18T16:23:28+09:00,フットボールチャンネル,footballc,フットボールチャンネル,740,\n【写真：Getty Images】\nプレミアリーグ第25節、ブレントフォード対リバプールが現地時間17日に行われた。試合はアウェイのリバプールが4-1の勝利を収めている。この試合では、リバプールに所属するサッカー日本代表MF遠藤航がフル出場を果たし、チームの勝利に大きく貢献した。\n【動画】何度でも見たい！ 遠藤航のゴールが衝撃的！\nリバプールは35分にカウンターからダルウィン・ヌニェスのゴールで先制に成功する。前半は1-0で折り返すと、55分に追加点が生まれる。遠藤がヘディングでボールを跳ね返すと、ライアン・グラフェンベルフに繋がる。グラフェンベルフはボールキープからモハメド・サラーにパス。ボールを受けたサラーはアレクシス・マック・アリスターにラストパスを供給する。最後はマック・アリスターが抜群のコントロールからゴールを決めた。\n\n\n さらにリバプールは68分にサラーが追加点を奪う。75分に失点を許すも、終盤にコーディ・ガクポがダメ押しゴール。試合はそのまま終了し、リバプールはリーグ戦2連勝となった。\n\n 英メディア『リバプール・エコー』がこの試合の採点を公開。遠藤にはサラー、ルイス・ディアス、ガクポ、フィルジル・ファン・ダイクと並んでチーム最高となる「8」がつけられた。\n\n また、同メディアは遠藤について「前半、攻撃のセットプレーでハンドをしてしまったが、セカンドボールを拾い、非常に多くの仕事をやってのけ、リバプールの支配が始まる要因となった」と評価している。\n\n リバプールは現地時間21日にルートン・タウンと対戦する。遠藤はこの試合にも先発し、またもチームの勝利に貢献することができるだろうか。\nフットボールチャンネル編集部,['https://newsatcl-pctr.c.yimg.jp/t/amd-img/20240218-00531937-footballc-000-1-view.jpg?exp=10800'],"['https://news.yahoo.co.jp/articles/d3eba94ae99993b28d9f27787ea3868f2b7c43aa/images/000', 'https://www.footballchannel.jp/2023/12/04/post522851/2/']"
とんでもない才能！ 欧州で大活躍する10代の逸材（10）パリ五輪世代最強！？ 18歳とは思えない守備職人（フットボールチャンネル）,https://news.yahoo.co.jp/articles/1c0433312633656189e4593216e0f4301ed3c0d1,https://newsatcl-pctr.c.yimg.jp/t/amd-img/20240218-00010006-footballc-000-1-view.jpg?exp=10800,2024-02-18T12:50:07+09:00,2024-02-18T12:50:07+09:00,フットボールチャンネル,footballc,フットボールチャンネル,949,\n【写真：Getty Images】\n優秀な若い才能は早いうちにビッグクラブのスカウトの目に留まり、10代で一流クラブでデビューする選手も多くいる。そして、トップチームでもその才能を発揮して価値を高める選手も少なくない。今回は、いま欧州で大活躍している10代の逸材をピックアップして紹介する。※成績は15日時点の『transfermarkt』を参照。各種スタッツはデータサイト『Sofa Score』を参照\n【写真：Getty Images】\nDF： レニー・ヨロ（フランス）\n生年月日：2005年11月13日\n所属クラブ：リール（フランス）\n23/24リーグ戦成績：20試合2ゴール0アシスト\n市場価値：2500万ユーロ（約35億円）\n \n 名だたるビッグクラブが注目する守備職人がリールに所属するレニー・ヨロだ。\n \n リールの下部組織で育ったヨロは21/22シーズン終盤の第37節ニース戦で、弱冠16歳でトップチームデビューを飾った。そこから徐々に出場時間を伸ばしていき、プロ3年目となる今季はリーグ戦20試合（先発出場19試合）に出場して2ゴールをマークしている。また、ティエリ・アンリ監督率いるU-21フランス代表にもコンスタントに招集されるようになり、まもなく母国フランスで開催されるパリ・オリンピックのフランス代表メンバー入りも夢ではない状況だ。\n \n 現在18歳の同選手は、良い意味でその若さを感じさせない「読み」を活かしたディフェンスが持ち味だ。身長190cmの恵まれたフィジカルと長いリーチを活かして、ボールホルダーとボールが離れた一瞬の隙を狙ってボール奪取ができる。やみくもに飛び出すことはせず、しっかりと体勢を構えて相手の出方を伺い、確実に仕事を遂行するベテランのようなプレーを見せる。また、地上戦だけでなく空中戦も安定して強い。今季は1試合当たりの空中戦勝率が69%（データサイト『Sofa Score』参照）を記録した。\n \n 抜群の身体能力をもった逸材は今冬のステップアップが注目されていたが、結局実現せず。そのため今夏の移籍マーケットでは争奪戦が行われるかもしれない。ヨロが来季プレーするクラブは果たして…。\nフットボールチャンネル,"['https://newsatcl-pctr.c.yimg.jp/t/amd-img/20240218-00010006-footballc-000-1-view.jpg?exp=10800', 'https://newsatcl-pctr.c.yimg.jp/t/amd-img/20240218-00010006-footballc-001-1-view.jpg?exp=10800']","['https://news.yahoo.co.jp/articles/1c0433312633656189e4593216e0f4301ed3c0d1/images/000', 'https://news.yahoo.co.jp/articles/1c0433312633656189e4593216e0f4301ed3c0d1/images/001']"
