headline,mainEntityOfPage,image,datePublished,dateModified,author,media_en,media_jp,str_count,body,images,external_links
13年ぶりVの“ビリケンさん”は5メーカー混在　当週投入センターシャフトPTはコーチの助言【勝者のギア】（ゴルフ総合サイト ALBA Net）,https://news.yahoo.co.jp/articles/482f32272f3972db2b31101d3d471996f575290c,https://newsatcl-pctr.c.yimg.jp/t/amd-img/20260518-00000025-alba-000-1-view.jpg?exp=10800,2026-05-18T14:58:52+09:00,2026-05-18T14:59:11+09:00,ゴルフ総合サイト ALBA Net,alba,ゴルフ総合サイト ALBA Net,1997,藤本佳則の優勝ギア（写真：鈴木祥、ALBA） ＜関西オープン 最終日◇17日◇茨木カンツリー倶楽部 東コース（大阪府）◇6734ヤード・パー70＞ 【写真】投入して即優勝 センターシャフトを選手目線で見る 1打差の4位から出た“ビリケンさん”こと藤本佳則が最終日に6バーディ・1ボギーの「65」で回り、12年216日ぶりの3勝目。長谷川勝治（13年82日）、横田真一（13年19日）に次ぐ、ツアー3番目のブランク優勝を果たした36歳の使用クラブを取材した。 101年前に開場した名門・茨木CC東コース。距離は短いがフェアウェイは狭く、ラフが深い。小さい砲台グリーンは硬く仕上がった。「フェアウェイキープが一つのポイント」と攻略の糸口はまずティショットだった。大学時代から師事する阿河徹コーチと、精度の高いフェードボールを打つスイングに磨きをかけている。 「ウィニングショット」と胸を張ったのは、2打リードで迎えた18番パー4のティショット。フェアウェイに左に池が広がり、風が左から吹いている。「フェードヒッターには打ちにくい」ロケーションだが、自分を信じて振り抜いてフェアウェイをとらえた。その手に握られていたのはタイトリスト『GT3』。グラファイトデザイン『ツアーAD GC』の70g台のTXシャフトを挿している。 クラブ契約フリーの藤本は、「自分の振った感触でイメージ通りの球筋が出るクラブがいい。1回決まるとあまり替えません」としっかり手になじんだモノを選ぶ。ドライバーについては「『GT3』は打感もいいし、顔も良くて構えやすい。飛距離性能、安定性、すべてのバランスがいいです」と、約2年前から愛用している。 また、ドッグレッグのホールが多く、ティショットはアイアンも多用した。3番アイアンはタイトリストの中空モデルで、ユーティリティアイアンの『U505』。4番アイアンはヨネックスの『EZON CB702』と中空モデルよりもすっきりしたやさしいモデルを入れている。 「ロングアイアンは難しいクラブなので、やさしさ重視です。3番も4番も上がりやすい。アイアン型を選んでいるのは、低く抑えるショットが打ちやすいからです」。クラブの性能で高い球が打て、技術で低い球が打てる信頼の2本である。ドライバーも含めて4日間のフェアウェイキープ率は64.286％。全体2位の数字を誇った。 フェアウェイウッドはともにテーラーメイドで3番は『Qi10』、5番は2019年発売の『M5』。アイアンはキャロウェイの『Xフォージド STAR』。50度を2度寝かせた52度のウェッジはミズノ『T22』、0.5度寝かせた58.5度は『ボーケイ SM11』。使い込んだ複数メーカーのモデルが並ぶ。 「今週はパターだけ新しくしました」。関西オープンに合わせるように、オデッセイのストロークラボブラックシリーズの『タトル』のセンターシャフトを投入した。前戦までは同タイプのヘッドのダブルベントネックを使用していたが、「阿河コーチがセンターシャフトを勧めてくれたので、オデッセイさんにお願いして作ってもらいました」とコーチの進言により変更した。 阿河コーチに進言した理由を聞くと、打ち方とのつながりがあるという。「藤本プロはアプローチの延長のようにハンドダウン目に構えてパターを打ちます。そしてオフセットのパターを使用することが多いのですが、フェースがシャフトの後方にあるので、実際の動きとインパクトに少しのラグが生まれます。そのラグからヘッドが出ていくことで絶妙なタッチを出しています。しかし、『前澤杯』の時にヘッドが出ていないストロークになっていました。ラグのないセンターシャフトにすることで、ヘッドがしっかり出せるストロークになると思い、実戦で使ってもらうようにしました」。コーチの進言が見事にはまり、クラッチパットを何度も決めた。 15年以上も阿河コーチに師事し、スイング、ギアの両面で全幅の信頼を置く。硬い絆で結ばれた阿河コーチとの二人三脚で13年ぶりの優勝をつかんだ。 【藤本佳則の使用ギア】 1W：タイトリスト GT3（9.0度/ツアーAD GC-7 TX） 3W：テーラーメイド Qi10（15度/ディアマナRF 80X） 5W：テーラーメイド M5（19度/ツアーAD DI-9 X） 3I：タイトリスト U505（DGツアーイシュー） 4I：ヨネックス EZONE CB702（DGツアーイシュー） 5I～PW・キャロウェイ Xフォージド STAR（DGツアーイシュー） 52度：ミズノ T22（DGツアーイシュー） 58.5度：タイトリスト ボーケイSM11（DGツアーイシュー） PT：オデッセイ ストローク ラボ TUTTLE（タトル） CS BALL：スリクソン ZスターXV ロイヤルグリーン,[],[]
腰痛、尿のキレもまとめてスッキリ！ 劇的にスイングが変わる「骨盤フリフリ」ストレッチ（ゴルフ総合サイト ALBA Net）,https://news.yahoo.co.jp/articles/7d34cd0f52af10370fdc7192785f611b497dcfe4,https://newsatcl-pctr.c.yimg.jp/t/amd-img/20260518-00000024-alba-000-1-view.jpg?exp=10800,2026-05-18T14:15:05+09:00,2026-05-18T14:15:28+09:00,ゴルフ総合サイト ALBA Net,alba,ゴルフ総合サイト ALBA Net,760,真っすぐに立った姿勢からヒザを軽く曲げる 飛距離が落ちたし、ミスショットも連発……。これらの不調の原因は、骨盤がガチガチに固まった「フリーズ骨盤」のせいかもしれない。このままでは、ゴルフだけでなく、腰痛や尿のキレも悪くなったりと、体に不調が出る可能性も。そこで、改善のためのエクササイズを紹介。眠っていた骨盤の動きをスムーズにさせ、芯食いショットを連発しよう！ 【画像】3個以上当てはまったらフリーズ骨盤の可能性大！ カチコチ骨盤チェック表 準備：骨盤底筋群をほぐす 骨盤の動きが悪い人は、骨盤の底にある「骨盤底筋群」が硬い。ここをほぐすと骨盤が動きやすくなるので、準備運動に取り入れよう。骨盤底筋群をほぐすだけでも、トイレ後のチョロ漏れやぽっこりお腹改善が期待できる。 【やり方】 折りたたんだバスタオルを、股に当てて座る。男性の場合は、肛門と陰嚢の間（会陰）に当てる。体重を前にかけて体を左右に10秒揺らしたら、体重を後ろにかけて左右に10秒揺らす。 ■骨盤の前傾・後傾をしやすくする 1. 骨盤フリフリ 骨盤を前に倒す（前傾）、後ろに倒す（後傾）動きを交互に行い、骨盤が前後に倒れるゆがみが固着するのを防ぐ。腰に当てた手で骨盤を前後にコロがすイメージでトライ！ 【やり方】 真っすぐに立った姿勢からヒザを軽く曲げる。恥骨（骨盤の前下部にある硬い骨）をみぞおちに近づけるように腰を丸めたら、今度はお腹をタテに伸ばしながら腰を反る。交互に30回行おう。 ■骨盤マニア KAOさん こつばんまにあ・かお／一般社団法人日本骨盤協会代表。ヨガ指導者としての活動を経て、骨盤に着目した体作りのメソッドを確立。生徒の中には、骨盤ケアでスコアが伸びたゴルファーも。著書に『結局、骨盤がすべて解決してくれる』（Gakken）がある。,[],[]
桑木志帆が滑り込み“確定”　渋野日向子に菅楓華…「全米女子オープン」の有資格者は？（ゴルフ総合サイト ALBA Net）,https://news.yahoo.co.jp/articles/a1ec1d2dc590a717d42014e8047030944f9c78c7,https://newsatcl-pctr.c.yimg.jp/t/amd-img/20260518-00000023-alba-000-1-view.jpg?exp=10800,2026-05-18T14:01:04+09:00,2026-05-18T14:01:25+09:00,ゴルフ総合サイト ALBA Net,alba,ゴルフ総合サイト ALBA Net,945,渋野日向子は全米切符を1年前にゲット 6月4日に開幕する海外メジャー「全米女子オープン」（カリフォルニア州リビエラCC）の出場有資格者が続々と決まっている。 【写真】おめでとう！ 吉田優利が全米切符獲得でこの笑顔 2021年、24年大会を制した笹生優花をはじめ、古江彩佳、西郷真央、山下美夢有といったメジャー覇者が名を連ねる。昨年大会トップ10では竹田麗央、渋野日向子が出場権を手にしている。 昨季の米ポイントランキングトップ30では、畑岡奈紗、岩井明愛、岩井千怜、勝みなみが出場する。 これまでに世界各地で予選会が開催された。4月20日に千葉県・房総カントリークラブで行われた日本予選会では、後藤未有、高橋彩華が通過。尾関彩美悠は補欠1番手だった、2週前に繰り上がりの連絡が届き、すでにエントリーを済ませている。 5月11日にマサチューセッツ州マールボロCCで開催された予選会では、吉田優利が1枠をつかみ切り、出場権を獲得した。 3月23日付の世界ランキング75位以内の資格で、佐久間朱莉、菅楓華、小祝さくら、河本結らが出場。また、5月25日付の世界ランキング75位以内にも出場枠が設けられており、先週の国内女子ツアー「Sky RKBレディスクラシック」を制した桑木志帆が滑り込む見込みとなっている。 さらに、全米前週の米ツアー「ショップライトLPGA」を制した選手にも、出場権が付与される。まだ出場資格を持たない米ツアーメンバーは、ここでの一発逆転を目指すことになる。 【全米女子オープンの主な出場資格】 1.過去10年間の全米女子オープン覇者 笹生優花 2.昨年の全米女子オープントップ10 竹田麗央、西郷真央、渋野日向子 8.過去5年間のアムンディ・エビアン選手権覇者 古江彩佳 9.過去5年間のAIG女子オープン（全英）覇者 山下美夢有 10.昨年のCMEグローブ・ポイントランキングトップ30 畑岡奈紗、岩井明愛、岩井千怜、勝みなみ 17.3月23日付の世界ランキング上位75人 佐久間朱莉、菅楓華、河本結、荒木優奈、神谷そら、鈴木愛、小祝さくら 18.出場資格を持たない、5月25日付の世界ランキング上位75人 20.予選会通過者など 後藤未有、高橋彩華、尾関彩美悠、吉田優利,[],[]
久常涼が土俵際で「全米オープン」出場権獲得　松山英樹は19位後退【男子世界ランキング】（ゴルフ総合サイト ALBA Net）,https://news.yahoo.co.jp/articles/7250f8313d2680ff2440da34866419eb580bd79f,https://newsatcl-pctr.c.yimg.jp/t/amd-img/20260518-00000022-alba-000-1-view.jpg?exp=10800,2026-05-18T12:30:00+09:00,2026-05-18T12:30:17+09:00,ゴルフ総合サイト ALBA Net,alba,ゴルフ総合サイト ALBA Net,376,久常涼は世界60位で全米出場権を獲得 5月17日付けの男子世界ランキングが発表された。 海外メジャー「全米プロ」を制したアーロン・ライ（イングランド）は44位から自己ベストの15位にジャンプアップした。 【動画】うなる右こぶし 松山英樹が奪った“マーベラス”なイーグルの瞬間 今大会を35位で終えた久常涼は、1ランクダウンの60位。今回の世界ランキングで上位60人に与えられる「全米オープン」（6月18～21日、シネコック・ヒルズGC）の出場権を土俵際でつかみ取った。 松山英樹は2ランクダウンの19位。日本勢2番手以下は中島啓太（130位）、金谷拓実（139位）、比嘉一貴（153位）、金子駆大（192位）、平田憲聖（243位）と続いている。 国内男子ツアー「関西オープン」で13年ぶりVを果たした藤本佳則は、335人抜きとなる405位に急浮上した。,[],[]
全米プロVのアーロン・ライが5.8億円獲得　マキロイは今季メジャーだけで8億超え（ゴルフ総合サイト ALBA Net）,https://news.yahoo.co.jp/articles/4448cc11f5997189328a889057d4301ef5737cee,https://newsatcl-pctr.c.yimg.jp/t/amd-img/20260518-00000021-alba-000-1-view.jpg?exp=10800,2026-05-18T12:18:35+09:00,2026-05-18T12:18:53+09:00,ゴルフ総合サイト ALBA Net,alba,ゴルフ総合サイト ALBA Net,779,メジャー初優勝を挙げたアーロン・ライは、約5億8640万円を手にした ＜全米プロ 最終日◇17日◇アロニミンクGC（ペンシルベニア州）◇7394ヤード・パー70＞ 【動画】複雑なラインを読み切り 松山英樹が奪った“マーベラス”なイーグルの瞬間 賞金総額は2050万ドル、日本円にして約32億4800万円に設定された今年の「全米プロ」。前年の1900万ドルから150万ドル増額され、大会史上最高額を更新した今年、選手たちはどれほどの報酬を手にしたのか。 今大会でメジャー初優勝を挙げたアーロン・ライ（イングランド）は、369万ドル（約5億8640万円）を獲得した。 2位タイに入ったジョン・ラーム（スペイン）、アレックス・スモーリー（米国）は、それぞれ180万4000ドル（約2億8670万円）を獲得。4位タイのジャスティン・トーマス（米国）、ルドビグ・オーバーグ（スウェーデン）、マティアス・シュミッド（ドイツ）は、それぞれ84万3867ドル（約1億3410万円）を手にした。 4月「マスターズ」で連覇を達成したローリー・マキロイ（北アイルランド）は、7位タイで63万7050ドル（約1億1220万円）を獲得。なお、「マスターズ」では450万ドル（約7億1500万円）を手にしており、今季メジャー2試合だけで約8億円以上を稼いだことになる。 日本勢は、26位で大会を終えた松山英樹が12万5523ドル（約1995万円）を獲得。35位の久常涼が7万8806ドル（約1252万円）、70位だった比嘉一貴が2万5070ドル（約398万円）をそれぞれ手にした。 また、今大会は予選落ちした選手にも一律4300ドル（約68万円）が支払われる。6月に行われる「全米オープン」の賞金総額は昨年実績で2150万ドル、7月の「全英オープン」は同じく1700万ドルとなっている。,[],[]
今季初Vの宮本勝昌が使用するアイアンはブリヂストンの新モデル？　飛距離の不安を解消「プラスなだけに」【勝者のギア】（ゴルフ総合サイト ALBA Net）,https://news.yahoo.co.jp/articles/c63fb56a5341e05159af3daa53fdb3c479f3d457,https://newsatcl-pctr.c.yimg.jp/t/amd-img/20260518-00000020-alba-000-1-view.jpg?exp=10800,2026-05-18T12:15:05+09:00,2026-05-18T12:15:32+09:00,ゴルフ総合サイト ALBA Net,alba,ゴルフ総合サイト ALBA Net,1379,"今季初優勝の宮本勝昌はブリヂストンの新モデルアイアンを使用していた ＜リョーマゴルフ 日高村オープン 最終日◇16日◇グリーンフィールゴルフ倶楽部（高知県）◇シニアの部6807ヤード・パー72、女子の部6234ヤード・パー72＞ 【写真】今季初優勝の支えになったアイアンはブリヂストンの未発表モデルだった！ 国内シニアツアーの新規大会は、3季連続賞金王に輝いている宮本勝昌が、今季初優勝でツアー通算11勝目を飾った。トータル11アンダーで初代王者となった宮本のキャディバッグをのぞくと、契約するブリヂストンの新モデルとみられるアイアンが投入されていた。 アイアンのホーゼルには『200CB+』の刻印。従来使用していた『242CB+』の後継モデルとみられる。これまでは4～6番に飛び系の『242CB+』、7番からPWまでは『242CB』というコンボセッティングだったが、現在は4番からPWまでをすべて飛び系アイアンに変更している。 「シニアになると、どんどん落ちていくので」と、年齢とともに直面する飛距離低下への対策としてのスイッチだった。「アイアンのキャリーが出る現役時代に戻ったという感覚がある。力を入れずに打てるので、非常にいい武器を手に入れたなって思っています」と強い味方になっている。 新モデルは前週から投入し、さっそく結果につなげた。「手応えは非常にあります。自分のイメージ通りのキャリーが出る」と思ったような弾道と結果を得ている。「シニアになってくるとどうしても2～3ヤード飛ばないとか、必ず起こり得るので、その分がしっかりいくので、そこはプラス材料かなと思っています」と好感触だ。さらに200CB+にかけて、「プラスなだけに」とニヤリ。報道陣の笑いを誘った。 そのほかでは、昨年夏頃にブリヂストンのドライバー『B2 HT』から、『BX2 HT』（シャフト・ツアーAD VF-6S）に変更した。パターは基本的にスコッティ・キャメロンの『ファントム11』シリーズを使用しているが、同メーカーの中で複数本を使い分けており、「同じような形で少しインサートが違うとか、形が微妙に違うのがあります。2～3本いつもあって、どれも入ります。今回はこれにしました」と『ファントムブラック11』を選び、2日間使用した。 新アイアンの投入により飛距離の不安を解消し、今季初優勝へとつなげた。4季連続の賞金王戴冠へ向け、信頼するクラブとともに戦いを続けていく。（文・高木彩音） 【宮本勝昌の優勝クラブセッティング】 1W：ブリヂストンBX2 HT（9.5度/Tour AD VF-6S） 3W：テーラーメイド ステルスプラス（15度/Tour AD CQ-7S） 5W：テーラーメイド ステルスプラス（19度/Tour AD CQ-7S） 3U：HONMA TW-UT（19度/N.S.PRO MODUS3 ）HYBRID TOUR S.370） 4I～PW：ブリヂストン200CB+（N.S.PRO MODUS3 TOUR125 S） 52,58度：ブリヂストン B-Limited BITING SPINフルミルド（N.S.PRO MODUS3 TOUR125 X） PT：スコッティ・キャメロン ファントムブラック11 プロトタイプ BALL：TOUR B XS",[],[]
森田理香子が師匠の岡本綾子、先輩たちと久しぶりの4ショットを投稿 「可愛い!!」「表情が末っ子満開」とファンも大喜び（ゴルフ総合サイト ALBA Net）,https://news.yahoo.co.jp/articles/a4ae4da6a7d384f2ec2a24c6063a799b801ef2e2,https://newsatcl-pctr.c.yimg.jp/t/amd-img/20260518-00000019-alba-000-1-view.jpg?exp=10800,2026-05-18T12:04:11+09:00,2026-05-18T12:06:28+09:00,ゴルフ総合サイト ALBA Net,alba,ゴルフ総合サイト ALBA Net,546,ファンはもっと多くのツアー参戦を期待している森田理香子（撮影：佐々木啓） 森田理香子が自身のインスタグラムを更新。師匠の岡本綾子、門下生の表純子、青山加織と4人で撮った写真を投稿した。 【写真】チーム岡本、笑顔の4ショット 「師匠と先輩と久しぶりに会えて嬉しい」と再会を喜ぶ森田。「なんかやっぱり落ち着く」「ありがとうございました」と嬉しそうに綴っていた。 4人が集まったのは岡本が所属するダイワボウホールディングスのグループ企業、DIS（ダイワボウ情報システム）が主催した「感謝の集い プロアマ大会」だった。岡本をはじめ門下生たちも参加する恒例のイベントだ。 岡本の隣でニコニコ笑顔を浮かべる森田を見たファンは「可愛い!!」「師匠と嬉しそうやね」「親分の前だと表情が末っ子満開のプロ」など、楽しそうにコメントを寄せていた。 2013年には賞金女王に輝いた森田だったが、その後、不振に陥り、18年のシーズン終了後に休養宣言をしてツアーからは離れていた。しかし24年の開幕戦「ダイキンオーキッドレディス」で6年ぶりに復帰すると、いきなり予選を通過して大きな話題となった。 昨年はレギュラーツアー1試合、ステップ・アップ・ツアー2試合に参戦、今年も「ヤマハレディースオープン葛城」に参戦している。,[],[]
