headline,mainEntityOfPage,image,datePublished,dateModified,author,media_en,media_jp,str_count,body,images,external_links
話題の新作『GTS』ドライバーをHS45m/sの記者が打ち比べ　『TSi3』ユーザーなのにハマったのは『3』じゃなく『4』だった!?【やってみた】（ゴルフ総合サイト ALBA Net）,https://news.yahoo.co.jp/articles/b13234eb7611228ab233b0d5369271d8ec135b7a,https://newsatcl-pctr.c.yimg.jp/t/amd-img/20260518-00000031-alba-000-1-view.jpg?exp=10800,2026-05-18T20:20:02+09:00,2026-05-18T20:20:21+09:00,ゴルフ総合サイト ALBA Net,alba,ゴルフ総合サイト ALBA Net,1310,"『TSi3』ユーザーが『GTS4』がハマる理由とは？ 国内外の選手が多数バッグインして話題のタイトリスト『GTS』シリーズ。名称に加わった『S』はSpeed（初速）とStability（安定性）の2つの意味があるとのことです。ドライバーにおいて、初速を求めれば安定性が落ち、安定性を求めれば初速が落ちるのが定説ですが、相反する2つを高めるという今作。メディア向け試打会にて打ってきたのでレポートしたいと思います。 【写真】HS45m/sで『GTS』シリーズを打った数値公開 『4』は『TSi3』ユーザーになじみ深い顔 ちなみに、筆者は『TSi3』に『ディアマナ DF 60X』を使っています。今回は純正シャフトである『テンセイ 1K ホワイト RIP 65X』を各ヘッドに挿して、重心が深い順番（『2』→『3』→『4』）の順に試打しました。 まず『GTS2』から打ちましたが、安定感はピカイチでした。最近スピンが入りきらず、ドロップしたり、チーピンしたりするのですが、常に2,300回転くらいで安定してくれて、飛距離のブレも、左右のブレもほとんどありません。前作までは『2』のヘッドが後方部分に向けて長いなと感じてやや苦手でした。ただ、今作は3モデルの中では比較的シャローな形状ではあるものの、かなりスッキリしていて違和感なく使えました。 普段『TSi3』を使っているので、本命は『GTS3』と思っていましたが、結果は『2』よりやや飛距離が出ず……。顔は小ぶりな感じで好みでしたが、スピン量が少なくなっていました。そこで、今作から前後に搭載されたウェイトを調整し、後ろ側を重くすると一気にスピン量が安定し、振りやすくもなりました。自分の好きな顔のまま、振り心地やスピン量を調整できるというのはありがたい限りです。最終的には、『2』よりわずかに飛距離が伸びました。 やはり今作も『3』かなと思っていましたが、『GTS4』を構えると、なんだか馴染みのある感覚が……。打ってみても、それまでは『3』のトータル257.3ヤードが最長だったものの、『4』ではキャリーでその記録を楽々超え、キャリー262.0ヤード、トータル278.2ヤードをマーク。製品担当の方いわく「プロからの意見もあり、『4』は人気モデルである『TSi3』の形状に近いものになりました」とのことで、どうりで構えやすいし、振りやすいのだと納得しました。『4』は小ぶりで難しいという印象がありましたが、今作から460ccとなり、飛距離も出て、スピンも安定して、『4』が一番お気に入りです。 今回3つ共通していて驚いたのが、そんなに振っていないのにヘッドスピードが45m/sを超えること。自分のクラブだと頑張って出る数字が楽に出るんです。『2』と『3』については今までのモデルよりもソール後方が高くなっていて、空気抵抗を減らせているのだとか。また、全モデルで前後のウェイトを入れ替えられるのも、より自分に合ったヘッドにカスタマイズできるので魅力的です。そろそろ『TSi3』も変えたいな…と考えているところだったので、『GTS』シリーズを前向きに検討したいと思います。",[],[]
ロボット試打で一番“飛んだ”ドライバーは？　2位は誰もが知る“国産ブランド”、1位は男女問わずツアーで人気の“外ブラ”【禁断のロボット試打】（ゴルフ総合サイト ALBA Net）,https://news.yahoo.co.jp/articles/cf78578512648aef1f37a52c21dc4342aade3d18,https://newsatcl-pctr.c.yimg.jp/t/amd-img/20260518-00000030-alba-000-1-view.jpg?exp=10800,2026-05-18T17:03:59+09:00,2026-05-18T17:04:20+09:00,ゴルフ総合サイト ALBA Net,alba,ゴルフ総合サイト ALBA Net,2111,写真: ALBA Net 毎年新作が出るドライバー。同じメーカーからも複数のドライバーが発売され、どれを選べばいいのか？ と悩むゴルファーも多いはず。そこでALBA Netでは、昨年好評だった“ロボット試打企画”を今年も実施。今回はゴルフロボットを開発する株式会社ミヤマエが提供するロボットのレンタルサービスを利用して実施。より人間に近いスイングを再現できる最新ロボット『ロボ-10』を使用し、ミヤマエの担当者が我々の要望に合わせてロボットを調整しながら計測した。今回はランキング2位、1位を発表する。 【数値も全部公開！】1～10位をまとめて発表 2位は『ゼクシオ14』、1位は男女プロが愛用する『◆◆◆』 ◇ ◇ ◇ ドライバーの性能で気になるのはやはり「どれだけ飛ぶか」だろう。飛距離を出すためには、「初速」「スピン量」「打ち出し角」のいわゆる“飛ばしの3要素”が大切になる。例えばボール初速が突出していても、スピン量の数値にエラーが出れば「思ったよりも飛ばない」という結果になってしまうのだ。そこで、昨年9月以降に発売されたドライバーでロボット試打を実施。総合的に一番“飛ぶ”ドライバーがどれかを検証した。 第2位 ダンロップ『ゼクシオ14（ゼクシオ MP1400 S）』 242.8ヤード 第2位となった『ゼクシオ14』は、昨年から「初速が出る」と評判の高いクラブ。初速が出る秘訣は、フェースに採用した新素材「VR-チタン」だ。シリコンを加えた新配合となっており、フェースの薄肉化に成功し、大きなたわみを使って飛ばせるモデルとなっている。 第1位 キャロウェイ『クアンタム ◆◆◆（ATHLEMAX 50 S）』 245.3ヤード 今回のロボット試打で首位となったのは、キャロウェイ『クアンタム ◆◆◆』だ。チタンとカーボンを組み合わせた三層フェースが話題の『クアンタム』シリーズの中でも、450ccと小ぶりなので操作性が高く、ロースピンで飛ばせるモデル。国内女子では、飛ばし屋の神谷そら、「Sky RKBレディスクラシック」で優勝争いを演じた政田夢乃などが使用。男子では、石川遼や河本力なども愛用しており、ヘッドスピードにかかわらず、幅広い選手から支持を受けている。 ◇ ◇ ◇ 計測条件は下記の通り。 ▼試打条件 ①クラブはロフト10度 or 10.5度（可変式スリーブにて調整したモデルもあり）で、シャフトフレックスを「S」で統一。クラブ長、重量はメーカー任意。 ②ヘッドスピードは、今回のランキングで使用しないクラブを駆使して、①の条件で42m/sとなる出力で固定。重量や長さによってヘッドスピードが変わるようにした。 ③完全なストレート軌道＆スクエアヒット＆フェーススコアラインの真ん中打点。 ④入射角はアッパー2.0度。 ⑤数値はスピン量エラーを除いた3球の平均。 ⑥ボールはタイトリスト『PRO V1』を使用。 計測機器は、高性能なハイスピードカメラが搭載された『GCクワッド』を使用。人間のスイングは千差万別ですべての条件下でテストを実施するのは難しいため、オーソドックスな条件を設定した。今回の測定結果はあくまでもこの条件下での結果というのが前提になる。 今回計測したクラブは以下の通り。 ▼試打クラブ ・キャロウェイ 『クアンタム MAX（ATHLEMAX 50 S）』 『クアンタム MAX D（ATHLEMAX 50 S）』 『クアンタム MAX FAST（SPDSTAR 40 S）』 『クアンタム ◆◆◆（ATHLEMAX 50 S）』 『クアンタム ◆◆◆ MAX（ATHLEMAX 50 S）』 ・コブラ 『OPTM MAX K（LIN-Q for cobra S）』 『OPTM LS（LIN-Q for cobra S）』 ・ダンロップ 『ゼクシオ14（ゼクシオ MP1400 S）』 『ゼクシオ14+（スピーダーNX for ゼクシオ S）』 ・テーラーメイド 『Qi4D（REAX MR 50 S）』 『Qi4D MAX（REAX HR 50 S）』 『Qi4D LS（REAX LR 60 S）』 『Qi4D MAX LITE（REAX MR 40 S）』 ・ピン 『G440 K（PING TOUR BLACK 65 S）』 ・フォーティーン 『DX-001（FT6dM）』 『DX-002（FT6dM）』 『DX-003（FT6dG）』 『DX-004（FT6dG）』 ・ブリヂストン 『BX1 ST（ベンタス BS6Ⅱ S）』 『BX2 HT（ディアマナ BS50Ⅱ S）』 ・本間ゴルフ 『TW777（VIZARD BLUE 5S）』 『TW777 MAX（VIZARD for TW777 S）』 ・ミズノ 『JPX ONE（テンセイレッド MM S）』 『JPX ONE SELECT（テンセイブルー MM S）』 ◇ ◇ ◇ ヘッドが決まったらシャフト選びも大切！ 関連記事「40本のドライバーシャフトを徹底調査 「スライスを消せる」10本は？」をチェック,[],[]
7年以上前のテーラーメイド製ドライバーで、契約フリーのアーロン・ライが初メジャー制覇【WITB】（ゴルフ総合サイト ALBA Net）,https://news.yahoo.co.jp/articles/5e817ba28892d092761631f64d1319697fb75b98,https://newsatcl-pctr.c.yimg.jp/t/amd-img/20260518-00000029-alba-000-2-view.jpg?exp=10800,2026-05-18T16:33:04+09:00,2026-05-18T17:43:25+09:00,ゴルフ総合サイト ALBA Net,alba,ゴルフ総合サイト ALBA Net,1405,"両手グローブで古い『M6』ドライバーを操り、メジャー制覇したアーロン・ライ ＜全米プロ 最終日◇17日◇アロニミンクGC（ペンシルベニア州）◇7394ヤード・パー70＞ 【画像】ライが使う『M6』他、1年周期で出ていた頃のテーラーメイド歴代人気ドライバーをチェック 今年のプロゴルファー世界一を決める今季メジャー第２戦。2打差の2位からスタートしたイングランドの31歳アーロン・ライが、9番のイーグルや、後半の4バーディなど「65」をマーク。トータル9アンダーまで伸ばし、逆転でメジャー初優勝を挙げた。 黒い両手グローブやアイアンヘッドカバーなど、ユニークなスタイルで知られるライは、クラブ契約フリーで古いドライバーを使うことでも有名。先週末はテーラーメイドが「1年周期から2年周期のドライバー販売へ移行する」と衝撃の発表をし、ライが使うのは2019年モデルのやさしい方の『M6』だ。 今年始めには2021年モデル『SIM2 MAX』に一時期替えたが、結局慣れて直ドラもできる『M6』へと元通り。使用シャフトはアルディラ製で、直近まで続いていたフジクラのメジャー連勝を「5」で止める形となった。契約フリーだが下記のように1W・FW・UT・アイアン・パターと多くのテーラーメイド製ギアを使用する。 また、ゴルフボールに関してはタイトリストと契約を結んでおり、長年一貫して『Pro V1』を使用。最も重視するボール選びに対して、タイトリスト製に対する信頼を、以下のように話している。 「私は長い間タイトリストの『Pro V1』を使っていますが、私にとってこのボールは狙ったショットを打つためのウィンドウを作り出し、無理にショットを打とうとせず、とても自然に打てるのが最大の魅力。グリーン周りのフィーリングも素晴らしく、ソフトでスピンコントロールも抜群です。『Pro V1』を使い続けているので、良いショットを打った時の音にはある種の期待を抱いています。 その音にすっかり慣れ親しんで、感覚も合っています。ボールの反応も非常に似通っているのですが、これもまたフィーリングと深く関わっています。良いショットを打った時、感触が良いと感じたら、ボールが特定の動きをしてリリースされ、スピンがかかることを期待します。同じボールを使い、同じ連続性、同じ感触、同じ音を持つことで、スコアを下げるチャンスが広がると思います」 なお、PGAツアー今季20戦でテーラーメイドの『スパイダー』パターが8勝目となった。内訳は『Spider Tour X』が6勝（ゴッタラップ2、シェフラー、モリカワ、マキロイ、スネデカー）、『Spider Tour』（ブリッジマン）、『Spider Tour V』（ライ）となっている。 【アーロン・ライの使用ギア】 1W：テーラーメイドM6（9° SYNERGY Blue70TX） 3,5W：テーラーメイドQi10（15,18° Ventus Blue 8TX） UT：タイトリストGT2（24°） 5I～9I：テーラーメイドP7TW（DG Tour Issue S400） P,GW：タイトリスト ボーケイSM9（46.10F,48.10F 〃 ） S,LW： 〃 SM11（54.12D,WW60.04L 〃 ） PT：テーラーメイドSpider Tour V BALL：タイトリストPro V1",[],[]
1年半ぶりVの桑木志帆　「振り切ることがでた」“飛んで曲がらない”LSの系譜【勝者のギア】（ゴルフ総合サイト ALBA Net）,https://news.yahoo.co.jp/articles/1aa29652a6582cbed8c9ee9b9a0395e37c5a2869,https://newsatcl-pctr.c.yimg.jp/t/amd-img/20260518-00000027-alba-000-1-view.jpg?exp=10800,2026-05-18T15:33:33+09:00,2026-05-18T15:33:51+09:00,ゴルフ総合サイト ALBA Net,alba,ゴルフ総合サイト ALBA Net,1422,"桑木志帆の優勝を支えた優勝セッティングに迫る（写真：佐々木啓、ALBA） ＜Sky RKBレディスクラシック 最終日◇17日◇福岡雷山ゴルフ倶楽部（福岡県）◇6490ヤード・パー72＞ ≪写真≫その“プロトタイプ”ウェッジは何ですか？ 2024年の最終戦「JLPGAツアー選手権 リコーカップ」以来となるツアー通算4勝目を挙げた桑木志帆。約1年半ぶりの勝利を支えた14本に迫る。 24年の最終戦で挙げた勝利時から、セッティングの構成に大きな変化は見られない。“飛んで曲がらない”を示す指標であるトータルドライビングで昨年1位、今季もここまで2位につける。「ドライバーは得意クラブなので、思い切って振ることができました」と話し、今大会でもフェアウェイキープ率90.5％（38/42）を記録した。 そのドライバーは『BX1LS』を採用。以前は『BリミテッドB1 LS』を使用していたが、かつて「スピンがすごく入るタイプ。スピン量を減らしてすごく飛ぶようになった」と話しており、ロースピンモデルの系譜は変わっていない。 シャフトは三菱ケミカルの『ディアマナBB 53S』を使用。中元調子で“素直”な挙動をするモデルだが、こちらも以前「先が走らないので、右に行くミスがない」と語っており、この部分にも変化は見られなかった。 3番ウッドは前作『B1ST』を継続使用。こちらも低スピン系のモデルで、一貫してスピン量を抑えたい意図がうかがえる。 3、4番ユーティリティの番手構成も変わらず、ヘッドは現行モデルを採用。24年の「リコーカップ」では、アマチュア時代から愛用していた2016年モデルのアイアン『ツアー B X-CB』を使用していたが、今回は現行モデル『241CB』で4勝目を手にした。 ウェッジは48、52、58度の構成。ただ、上の2本を見ると『BITING SPIN2』と刻印された未発表とみられるプロトタイプウェッジを投入している。「NTTドコモビジネスレディス」で取材した際には「抜けがすごく良くてスピンもけっこう利きます」と話していたが、その好感触からスタメン入りしている。58度は現行モデルの『BITING SPIN』を使用している。 そして、今週活躍したクラブを問われると、「パターです」と即答。 ピレッティの『ポテンザLN GSS』を使用しているが、「初優勝したときはピンタイプでした。ジュニアの頃からずっとマレットタイプを使っていましたが、ピンタイプに替えてからショットっぽくラインを出していけるようになりました」と話す。 1年半ぶりの勝利に加え、海外メジャー「全米女子オープン」（6月4日開幕、リビエラCC／カリフォルニア州）出場も決めた。信頼する14本を携え、次は世界の舞台に再び挑む。 【桑木志帆の優勝セッティング】 1W：ブリヂストン BX1LS（9度/ディアマナBB53S） 3W：ブリヂストン B1ST（15度/ディアマナWB53S） 3,４U：ブリヂストン BX2HT（19,22度/TENSEI 1K HY70S） 5I～PW：ブリヂストン 241CB（N.S.プロGH850） 48,52度：ブリヂストン BITING SPINプロト（N.S.プロGH950） 58 °：ブリヂストン BITING SPIN（N.S.プロGH950） PT：ピレッティ ポテンザLN GSS BALL：ブリヂストン ツアーB XS",[],[]
山下美夢有の弟と妹がタッグを組んで国内男子ツアーに参戦！ 12位タイでフィニッシュし「成長」を実感（ゴルフ総合サイト ALBA Net）,https://news.yahoo.co.jp/articles/d47c5b8518967d0c444125add7518dd5cfef41ef,https://newsatcl-pctr.c.yimg.jp/t/amd-img/20260518-00000028-alba-000-1-view.jpg?exp=10800,2026-05-18T15:32:22+09:00,2026-05-18T15:35:28+09:00,ゴルフ総合サイト ALBA Net,alba,ゴルフ総合サイト ALBA Net,666,慎重に使用クラブを選ぶ山下勝将&蘭（撮影：鈴木祥） 山下美夢有の妹、山下蘭が自身のインスタグラムを更新。国内男子ツアー「関西オープン」で兄・勝将（まさゆき）のキャディを務めたことを投稿した。 【写真】大きなキャディバッグを担いで歩く山下蘭 蘭がツアーで兄のキャディを務めるのは昨年の「バンテリン東海クラシック」以来、2回目となる。前回は残念ながら予選を通過することは出来なかった。しかし今回は初日に首位と1打差の2位タイと好スタート。2日目以降にスコアを伸ばすことは出来なかったが、トータル3アンダー・12位タイでのフィニッシュとなった。 蘭は「前回キャディし終えた時の感想は、『爆笑』やったけど 今回の試合を表すなら『成長』です！」と大会を振り返った。「特に最終日は4連続バーディーで大歓声があり、凄く楽しませてもらいました」と、4日間のトーナメントを大いに満喫したようだ。 最後に「暑い中兄の応援に来てくださった皆さん ありがとうございました!!」と感謝の言葉で投稿を締めくくった。 投稿では目標を見つめクラブ選びをする2人の姿や、大きく重そうなキャディバッグを担いで兄と並んで歩く姿、そしてタオルを手に声援を送ってくれた人たちとの記念写真などを公開した。 投稿を見たファンは「ナイスキャディ」「とてもいい試合だったと思うよ」「兄妹タッグ、ナイスコンビネーションでしたね」と労いの言葉をかけていた。 ちなみに蘭は姉・美夢有のキャディも3回務めた経験がある。そして今年、高校を卒業した本人もプロゴルファーを目指し練習に励んでいる。,[],[]
変顔、後ろから抱き着き、視線そらし……金田久美子が未公開写真を大放出　小祝さくら、神谷そらとの3ショットも！（ゴルフ総合サイト ALBA Net）,https://news.yahoo.co.jp/articles/1c80e4a05f839a2d6183808953f5bd503c90e5be,https://newsatcl-pctr.c.yimg.jp/t/amd-img/20260518-00000026-alba-000-1-view.jpg?exp=10800,2026-05-18T15:09:54+09:00,2026-05-18T15:14:24+09:00,ゴルフ総合サイト ALBA Net,alba,ゴルフ総合サイト ALBA Net,663,車のシートでのんびりメガネ女子の金田久美子【写真：金田久美子のInstagram（@kinkumiringo93）より】 金田久美子が自身のインスタグラムを更新。「楽しかった写真がフォルダにたくさん」「載せきれなかった写真もたくさん」と記し、スマホにはこれまでの投稿で紹介しきれなかった写真が何枚もたまっていることを明かすと、今回はその中から20枚を一挙に公開した。 【実際の投稿】BGMを聞き逃すな！ 森山直太朗の名曲？ 公開された写真の中にはゴルフ場で小祝さくらと仲良くジェラートを楽しむ写真も。2人の後ろでは神谷そらが満面の笑顔を浮かべており、トーナメントの合間のリラックスタイムを捉えていた。 また友人と頬を寄せながらウィンクをしたり、変顔をしたりする2ショットや、わざと視線をそらした2ショット、道端で友人に背中から抱き着いて楽しそうに笑う動画。さらにゴルフの練習風景や、タオルで全身を包み温活で汗を流すレアな写真もあった。 また目の前の鉄板で肉が焼かれている様子や、イカの姿づくり、ラーメンなど美味しそうな料理の写真、小さな子と一緒に撮った写真など、ジャンルは多岐に及んでいた。 最後に「 #私の今週のパターの様子を音楽に乗せてみました 」と記すと、投稿のBGMとして森山直太朗の「うんこ」という大胆な選曲をしていた。 投稿を見たファンも「オフショット嬉しい！」「めちゃくちゃ楽しそう」「どのくみちゃんもかわいい」と秘蔵写真の一挙公開を大喜び。そして「凄い歌だなww」「BGMの破壊力ww」と選曲に大笑いしていた。,[],[]
