headline,mainEntityOfPage,image,datePublished,dateModified,author,media_en,media_jp,str_count,body,images,external_links
一関市でクマによる物的被害相次ぐ　コメやハチの巣荒らされる　岩手県（岩手めんこいテレビ）,https://news.yahoo.co.jp/articles/8fd5f05bda4798f3b1b594e8d61a52f31f196642,https://newsatcl-pctr.c.yimg.jp/t/amd-img/20250921-90024102-nmit-000-1-view.jpg?exp=10800,2025-09-21T19:05:01+09:00,2025-09-21T19:05:01+09:00,岩手めんこいテレビ,nmit,岩手めんこいテレビ,642,"岩手県一関市でクマによる被害が相次いでいます。
9月20日から21日にかけて、住宅の敷地内で納屋に保管していたコメが食べられたり、設置していた養蜂の巣箱にあったハチの巣が食べられたりする被害が確認されました。

21日午前4時ごろ、一関市花泉町の住宅の住人が外に出ると、地面に玄米が散乱しているのを発見しました。

住人が納屋を確認したところ、中に保管していた玄米が入った30kgのコメ袋と15kgのコメ袋2つがなくなっていることに気が付きました。

警察によると、コメ袋は見つかっていませんが、納屋の北側にある山林に向けてコメ袋を引きずったように玄米が散乱していたということです。

納屋の入り口の扉にあった爪痕や地面に残っていた足跡から、クマによる被害だと確認されました。

また、その納屋から約350m離れた養蜂場でもクマによる被害が確認されています。

住宅の西側に15箱ほど設置している養蜂の巣箱のうち、1箱が1mほど離れた場所に放置されており、住宅の北側の雑木林内でハチの巣が発見されました。

この養蜂場に設置されている防犯カメラには、20日午後8時半ごろから午後9時ごろまでの間に、クマが養蜂の巣箱をむさぼる姿が映っているのが確認されました。

現場は住宅が点在している山あいの地域で、いずれもけが人はいなかったということです。

クマによる被害が相次いでいることから警察は付近の警戒を強め、住民に注意を呼びかけています。

（岩手めんこいテレビ）
岩手めんこいテレビ",[],[]
横断中の78歳男性　軽乗用車にはねられ死亡　一関市の市道　岩手県（岩手めんこいテレビ）,https://news.yahoo.co.jp/articles/e49ae955d15ac4fcc44421eadde826733c18cf37,https://newsatcl-pctr.c.yimg.jp/t/amd-img/20250921-90024101-nmit-000-1-view.jpg?exp=10800,2025-09-21T19:00:01+09:00,2025-09-21T19:00:01+09:00,岩手めんこいテレビ,nmit,岩手めんこいテレビ,282,"岩手めんこいテレビ
9月21日の午前、岩手県一関市の市道で道路を歩いて横断していた78歳の男性が、軽乗用車にはねられ死亡しました。

21日の午前10時半過ぎ、一関市赤荻の市道で、近くに住む農業の78歳男性が道路を歩いて横断していたところ、右から来た軽乗用車にはねられました。

男性は頭などを強く打ち、意識不明の状態で病院に運ばれましたが、約4時間半後に死亡が確認されました。

現場は片側1車線の直線道路で、付近に横断歩道はなく、警察は軽乗用車を運転していた69歳の女性に話を聞き、事故の詳しい原因を調べています。

（岩手めんこいテレビ）
岩手めんこいテレビ",[],[]
装備品の試着やARで災害の疑似体験も　一関市で消防イベント開催　岩手県（岩手めんこいテレビ）,https://news.yahoo.co.jp/articles/27422048dd28708ac3f43dbbc91e97fc7963216d,https://newsatcl-pctr.c.yimg.jp/t/amd-img/20250921-90024097-nmit-000-2-view.jpg?exp=10800,2025-09-21T18:50:01+09:00,2025-09-21T19:00:01+09:00,岩手めんこいテレビ,nmit,岩手めんこいテレビ,343,"消防士の装備品
地震や火災などの災害を疑似体験できる消防イベントが9月20日に岩手県一関市で開かれました。

このイベントは大雨や地震による災害に備え、いざという時に役立ててもらおうと一関市の北消防署が開催しました。

会場には消防車の展示の他、防護服や酸素ボンベなど消防士の装備品を試着できるコーナーもあり、訪れた人たちが装備の重さなどを実感していました。

またAR（拡張現実）の技術を活用して、浸水の様子をバーチャル体験できるNTT東日本のブースでは、浸水すると床や障害物が見えない中で避難しなければならない難しさを体感していました。

一関北消防署では、日頃からハザードマップをよく見て、災害が発生した時に備えてほしいとしています。

（岩手めんこいテレビ）
岩手めんこいテレビ",[],[]
八幡平市長選挙　無所属で現職の佐々木孝弘氏が無投票で再選　岩手県（岩手めんこいテレビ）,https://news.yahoo.co.jp/articles/46edf6c47ea263ed6cd490fffb6aeca3a86cb9eb,https://newsatcl-pctr.c.yimg.jp/t/amd-img/20250921-90024099-nmit-000-1-thumb.jpg?exp=10800,2025-09-21T18:45:01+09:00,2025-09-21T18:45:01+09:00,岩手めんこいテレビ,nmit,岩手めんこいテレビ,301,"岩手めんこいテレビ
任期満了に伴う岩手・八幡平市長選挙が9月21日に告示され、現職の佐々木孝弘氏の無投票での再選が決まりました。

八幡平市長選挙の立候補の届け出は午後5時で締め切られ、無所属で現職の佐々木孝弘氏以外に立候補はなく、佐々木氏の無投票での再選が決まりました。

佐々木氏は八幡平市出身の63歳で、前回（2021年）の選挙で初当選しました。

公約には、新たな工業団地の造成や若者を中心とする定住団地の整備、観光振興と1次産業の連携強化などを掲げています。

八幡平市長選挙で無投票となったのは2013年以来12年ぶりで、当選証書の付与式は9月29日（月）に行われます。
岩手めんこいテレビ",[],[]
一関市長選挙　無所属で現職の佐藤善仁氏が無投票で再選　岩手県（岩手めんこいテレビ）,https://news.yahoo.co.jp/articles/91c3469ceda30d1d137b7e09ff781ab1ffdb45e7,https://newsatcl-pctr.c.yimg.jp/t/amd-img/20250921-90024098-nmit-000-1-thumb.jpg?exp=10800,2025-09-21T18:45:01+09:00,2025-09-21T18:45:01+09:00,岩手めんこいテレビ,nmit,岩手めんこいテレビ,281,"岩手めんこいテレビ
任期満了に伴う岩手・一関市長選挙が9月21日に告示され、現職の佐藤善仁氏の無投票での再選が決まりました。

一関市長選挙の立候補の届け出は午後5時で締め切られ、無所属で現職の佐藤善仁氏以外に立候補はなく、佐藤氏の無投票での再選が決まりました。

佐藤氏は一関市出身の67歳で、2017年から副市長を務め、前回（2021年）の選挙で初当選しました。

公約には、人口減少に打ち勝つ「力強い一関」の実現や、若者の定住対策、生涯を通じた自己実現の環境づくりなどを掲げています。

当選証書の付与式は9月30日（火）に行われます。
岩手めんこいテレビ",[],[]
【地震】岩手県内で震度2 岩手県沖を震源とする最大震度2の地震が発生 津波の心配なし（岩手めんこいテレビ）,https://news.yahoo.co.jp/articles/c21ca0c7bd401882b8afd6dbf1f0760293733845,https://newsatcl-pctr.c.yimg.jp/t/amd-img/20250921-90024096-nmit-000-1-view.jpg?exp=10800,2025-09-21T06:52:01+09:00,2025-09-21T06:52:01+09:00,岩手めんこいテレビ,nmit,岩手めんこいテレビ,218,"岩手めんこいテレビ
2025年09月21日午前06時47分ごろ、岩手県沖を震源とする最大震度2の地震が発生しました。
岩手県内では最大震度2の揺れが観測されています。

この地震による津波の心配はありません。
震源の深さは20km。地震の規模を示すマグニチュード（M）はＭ４．０と推定されます。

岩手県
【震度2】
 久慈市 普代村 軽米町
【震度1】
 宮古市 田野畑村 野田村 盛岡市

提供：ウェザーニューズ
岩手めんこいテレビ",[],[]
