headline,mainEntityOfPage,image,datePublished,dateModified,author,media_en,media_jp,str_count,body,images,external_links
松山・宝厳寺で講演会　子規に学ぶ在宅緩和ケア（愛媛）（愛媛新聞ONLINE）,https://news.yahoo.co.jp/articles/44f045af0a40779f180f8bdc8e5bee4fd1cd5493,https://newsatcl-pctr.c.yimg.jp/t/amd-img/20260516-16017601-ehime-000-1-view.jpg?exp=10800,2026-05-16T20:51:00+09:00,2026-05-16T20:51:00+09:00,愛媛新聞ONLINE,ehime,愛媛新聞ONLINE,249,「病床六尺は、現代人が学ぶべき在宅緩和ケアの実践の記録だ」と語る中橋恒さん 正岡子規が最晩年につづった随筆「病床六尺」を、松山ベテル病院院長の中橋恒さん（74）が在宅緩和ケアの題材とし解説する講演会が16日、松山市道後湯月町の宝厳寺であった。講演の流れに沿って、琴の伴奏とともに病床六尺が朗読され、約50人の参加者が静かに耳を傾けた。 中橋さんや在宅ケアに携わる専門職らによるシンポジウムもあり、人生の最終段階でどのような医療や介護を受けたいか、家族と話しておく大切さなどを語り合った。 愛媛新聞社,[],[]
愛媛MP、継投が実らず香川に競り負け　四国ⅠL・5月16日（愛媛新聞ONLINE）,https://news.yahoo.co.jp/articles/f22e12f023942602f9be69ad1d1edbefcce25542,https://newsatcl-pctr.c.yimg.jp/t/amd-img/20260516-16017401-ehime-000-3-view.jpg?exp=10800,2026-05-16T20:19:00+09:00,2026-05-16T22:10:02+09:00,愛媛新聞ONLINE,ehime,愛媛新聞ONLINE,162,【愛媛MP―香川】2回裏愛媛MP無死2塁、長田が右翼に2点本塁打を放ち2―1と逆転する＝いきなスポレク公園野球場 四国アイランドリーグplusは16日、いきなスポレク公園野球場などで2試合を行い、3位愛媛マンダリンパイレーツ（MP）は4位香川に4―6で敗れた。 愛媛MPは次戦の17日、大洲球場で高知と対戦する。 愛媛新聞社,[],[]
愛媛MP、4－6で香川に敗れる　16日・四国IL（愛媛新聞ONLINE）,https://news.yahoo.co.jp/articles/b8afb391b3c21a5c4e1f0873b9f168de8bdf545a,https://newsatcl-pctr.c.yimg.jp/t/amd-img/default.jpg?exp=10800,2026-05-16T15:51:00+09:00,2026-05-16T15:51:00+09:00,愛媛新聞ONLINE,ehime,愛媛新聞ONLINE,54,愛媛マンダリンパイレーツ16日、上島町のいきなスポレク公園野球場で香川と対戦し、4－6で敗れた。 愛媛新聞社,[],[]
JR四国、2代目「伊予灘ものがたり」10万人突破　平均乗車率85％（愛媛）（愛媛新聞ONLINE）,https://news.yahoo.co.jp/articles/a4738948a68926060492d0d60ab243a075d161a9,https://newsatcl-pctr.c.yimg.jp/t/amd-img/20260516-16015401-ehime-000-1-view.jpg?exp=10800,2026-05-16T15:50:00+09:00,2026-05-16T15:50:00+09:00,愛媛新聞ONLINE,ehime,愛媛新聞ONLINE,237,2代目車両の乗客10万人達成を記念し、横断幕を掲げて出発を見送る利用客ら＝16日午後、松山市南江戸1丁目 JR四国の観光列車「伊予灘ものがたり」の2代目車両が16日、乗客10万人を達成した。JR松山駅（松山市南江戸1丁目）など県内五つの駅では、駅員らが横断幕を掲げて利用客に感謝、記念の缶バッジのプレゼントもあった。 伊予灘ものがたりは、土日祝日を中心に松山―伊予大洲・八幡浜間で1日4便運行。2代目車両は2022年4月にリニューアルし平均乗車率は85％に上る。 愛媛新聞社,[],[]
今治タオルのドレスで演奏　仏在住ピアニスト佐伯さん、故郷でイベント出演（愛媛）（愛媛新聞ONLINE）,https://news.yahoo.co.jp/articles/5a87ccef0d3d76d43af6d49e34b6daa340f56dd4,https://newsatcl-pctr.c.yimg.jp/t/amd-img/20260516-16014801-ehime-000-3-view.jpg?exp=10800,2026-05-16T14:38:00+09:00,2026-05-16T16:00:06+09:00,愛媛新聞ONLINE,ehime,愛媛新聞ONLINE,294,今治タオルの生地で作ったドレスを着た佐伯さん（左）。ボートンさんと多彩なメロディーを奏で、観客を魅了した パリを拠点に活躍する今治市出身のピアニスト佐伯牧里南さん（30）が、地元で2度目の舞台に立った。今治タオルの生地で作ったドレスをコンサートで初めてまとい、世界で磨いた演奏をフランスの新進アコーディオン奏者と披露。「日本、今治とフランスの架け橋になりたい」と思いを語った。 佐伯さんは常盤小学校、日吉中学校を経てパリ国立高等音楽院に進学。プロとして欧米を中心に活動の幅を広げ、3月には音楽家にとって最高峰の舞台の一つとされる米ニューヨークのカーネギーホールでデビューした。 愛媛新聞社,[],[]
松山総合公園で北米原産「カルミア」見頃　傘に似た花の形楽しんで（愛媛）（愛媛新聞ONLINE）,https://news.yahoo.co.jp/articles/b71a51cdf6dad937f49164f5998daed26317291a,https://newsatcl-pctr.c.yimg.jp/t/amd-img/20260516-16014701-ehime-000-3-view.jpg?exp=10800,2026-05-16T14:26:00+09:00,2026-05-16T16:50:01+09:00,愛媛新聞ONLINE,ehime,愛媛新聞ONLINE,234,カルミアの花とつぼみ 松山市朝日ケ丘1丁目の松山総合公園でツツジ科の常緑低木「カルミア」が見頃を迎えている。花笠や日傘に例えられる小さな花が無数につき、初夏の訪れを感じさせている。6月上旬まで楽しめそう。 カルミアは北米原産で、コンペイトーのような形をしたつぼみをしている。花は直径2センチ程のおわん形で、虫が来ると花びらの底に張り付いた雄しべが跳ね上がり、先端の「葯（やく）」が破れて中の花粉が拡散する。15日は青空が広がり、花に虫が次々と集まっていた。 愛媛新聞社,[],[]
天皇、皇后両陛下がご来県　沿道など2万6040人が歓迎　17日に60年ぶり全国植樹祭（愛媛）（愛媛新聞ONLINE）,https://news.yahoo.co.jp/articles/0398e4ccd0f6f5ea1c36b529c15526aa5c136a79,https://newsatcl-pctr.c.yimg.jp/t/amd-img/20260516-16014401-ehime-000-3-view.jpg?exp=10800,2026-05-16T13:48:00+09:00,2026-05-16T22:40:01+09:00,愛媛新聞ONLINE,ehime,愛媛新聞ONLINE,195,全国植樹祭の式典出席などのため、松山空港に到着された天皇、皇后両陛下＝16日午前（代表撮影） 天皇、皇后両陛下が16日、松山市で17日開催の全国植樹祭に合わせ、来県された。大洲市で長浜高校水族館部の研究成果を聞き、西日本豪雨の被災者らと懇談。姿を一目見ようと集まった県民に向け、穏やかな表情で手を振っていた。県警のまとめによると、視察先や沿道などには2万6040人が足を運んだ。 愛媛新聞社,[],[]
西条市長選あす17日投開票　最終盤、激戦続く（愛媛新聞ONLINE）,https://news.yahoo.co.jp/articles/35778d8e29f966a2ef511820f99a1daa3b4442c6,https://newsatcl-pctr.c.yimg.jp/t/amd-img/20260516-16000701-ehime-000-1-view.jpg?exp=10800,2026-05-16T05:00:00+09:00,2026-05-16T05:00:00+09:00,愛媛新聞ONLINE,ehime,愛媛新聞ONLINE,302,"西条市長選あす17日投開票 最終盤、激戦続く 市長の失職に伴う西条市長選は17日、投開票される。市議会の不信任決議を受けた前職の高橋敏明氏（67）＝無所属、同市神拝＝と、新人で前副市長の越智三義氏（61）＝同、同市飯岡＝が激戦を繰り広げている。市政トップの在り方が問われている選挙戦は最終盤に入り、両陣営が支持を訴える。 ◇ 愛媛新聞社は17日投開票の西条市長選の開票結果などを<a href=""https://www.ehime-np.co.jp/online/election/saijo_mayor2026/"" target=""_blank"">愛媛新聞ONLINE</a>で速報します。 愛媛新聞社",[],[]
両陛下、きょう16日来県　松山で全国植樹祭に出席へ（愛媛）（愛媛新聞ONLINE）,https://news.yahoo.co.jp/articles/8d3e3c17786cfb2059a8e87c7150625306bc09cf,https://newsatcl-pctr.c.yimg.jp/t/amd-img/20260516-16000501-ehime-000-1-view.jpg?exp=10800,2026-05-16T05:00:00+09:00,2026-05-16T05:00:00+09:00,愛媛新聞ONLINE,ehime,愛媛新聞ONLINE,161,両陛下、きょう16日来県 松山で全国植樹祭に出席へ（愛媛） 17日に松山市で開催の第76回全国植樹祭に出席するため、天皇、皇后両陛下が16日、来県される。天皇陛下の愛媛訪問は皇太子時代の2017年に全国障害者スポーツ大会に出席以来9年ぶり。ご夫妻での訪問は1999年の瀬戸内しまなみ海道開通式典以来27年ぶり。 愛媛新聞社,[],[]
