headline,mainEntityOfPage,image,datePublished,dateModified,author,media_en,media_jp,str_count,body,images,external_links
【山口】小学校新入生に防犯ブザーとクマ鈴贈呈（yab山口朝日放送）,https://news.yahoo.co.jp/articles/de762ef167c337ed504ccf50d594d1bf5a714418,https://newsatcl-pctr.c.yimg.jp/t/amd-img/20250305-00004510-yabv-000-1-thumb.jpg?exp=10800,2025-03-05T19:56:24+09:00,2025-03-05T19:56:24+09:00,yab山口朝日放送,yabv,yab山口朝日放送,403,"山口朝日放送
岩国市郊外の小学校に地元の団体が防犯ブザーとクマよけの鈴をおくりました。
地元の企業経営者らで作る新岩国会は
毎年、御庄小学校に相談しながら学校で必要な備品を送っています。
今回は、市内でクマの目撃が相次いでいることからクマよけの鈴５０個と
児童全員分の防犯ブザーをおくりました。
御庄小学校の近く山ではクマによるケガ人が出ていて児童の中には、
実際に野生のクマに遭遇した子どももいました。
＝クマを見た児童＝
「外でボールの壁当て遊びをしていたら、少し遠くの草むらでクマが何かしていて怖かった」＝児童＝「もっと周囲に気を付けて登下校しようという気持ちが増えた」
＝新岩国会・垣内太会長＝
「もしものために、何か役立つものが今の時代クマ鈴に限らず大事。
何かあった時には遅いので予防のために使ってもらえれば」
クマよけの鈴と防犯ブザーは子どもたちがランドセルにつけて登下校するということです。",[],[]
【山口】デジタル商品券を〝不正入手〟仲間に指示して時計３４６万円分を詐取ベトナム国籍の男を逮捕（yab山口朝日放送）,https://news.yahoo.co.jp/articles/b56b0169e5db492a8641ed2e4e8fafa1d581b1a0,https://newsatcl-pctr.c.yimg.jp/t/amd-img/20250305-00004509-yabv-000-1-thumb.jpg?exp=10800,2025-03-05T19:56:24+09:00,2025-03-05T19:56:24+09:00,yab山口朝日放送,yabv,yab山口朝日放送,385,"山口朝日放送
不正に入手したプレミアム付きデジタル商品券を使って
仲間に山口市で時計４本あわせて３４６万円分を買わせた疑いで
ベトナム国籍の男が逮捕されました。
闇バイトの指示役とみられています。
詐欺の疑いで逮捕されたのは埼玉県に住む会社役員で
ベトナム国籍のファム・タン・ロン容疑者です。
警察によりますとロン容疑者はおととし１２月５０人以上のクレジットカードを利用して
プレミアム付きデジタル商品券を不正に入手したということです。
そして仲間に山口市の時計販売店で商品券を使うよう指示を出し
腕時計４本額にして３４６万円分をだまし取った疑いが持たれています。
一部の腕時計は転売されていたということです。
調べに対しロン容疑者は「そのような事実はありません」と容疑を否認しています。
警察はロン容疑者がＳＮＳを使った闇バイトの指示役とみて余罪などを捜査しています。",[],[]
山口大学で面接入試ミス「山口県で先生に」（yab山口朝日放送）,https://news.yahoo.co.jp/articles/cd3fffe4a493484a3fd8e92b26ecb73630762dc0,https://newsatcl-pctr.c.yimg.jp/t/amd-img/20250305-00004508-yabv-000-1-thumb.jpg?exp=10800,2025-03-05T19:56:24+09:00,2025-03-05T19:56:24+09:00,yab山口朝日放送,yabv,yab山口朝日放送,428,"山口朝日放送
山口大学は先月行われた教育学部の面接試験で出題ミスがあったと発表しました。
県外の受験生に対しても山口県で教員になることを前提とした質問をしたということです。
山口大学は先月２６日に行われた
前期日程試験の教育学部小学校教育コースの一部で出題ミスがあったと発表しました。
面接試験の中で「山口県の小学校教員を志望する理由を教えて下さい」
と山口県で教員になることを前提とした質問をしたということです。
面接は２８人が受けていて県外から来た受験生もいました。
受験生の回答内容を聴いていた面接官が「質問がおかしいのでは」と
試験の途中でミスに気付いたということです。
山口大学教育学部は山口県で教員になることを出願条件とする
「推薦枠」を別に設けています。
そのため今回の質問は一般入試としては出題ミスだったして
受験者全員の面接の得点を満点にしたということです。
山口大学は面接の質問内容のチェック体制を見直し再発防止につとめるとしています。",[],[]
【山口】公立高校入試　実質倍率０．９７倍（yab山口朝日放送）,https://news.yahoo.co.jp/articles/5dbe0cc47a0cb5e26e44792106b26db569d23382,https://newsatcl-pctr.c.yimg.jp/t/amd-img/20250305-00004507-yabv-000-1-thumb.jpg?exp=10800,2025-03-05T19:56:24+09:00,2025-03-05T19:56:24+09:00,yab山口朝日放送,yabv,yab山口朝日放送,353,"山口朝日放送
県内の公立高校で入学試験が行われ約５６００人が臨みました。
実質倍率は０・９７倍と初めて１倍を下回りました。
公立高校の入学試験は午前９時から各高校で始まり
午前は国語、数学、英語、午後は社会、理科の試験が行われました。
県教育委員会によりますと今年度は、総合的に学力をみるために
「基礎的な問題と応用的な問題のバランスを図って出題した」ということです。
そのうえで「知識や技能を活用して課題を解決するために必要な
思考力、判断力、表現力を測る内容を重視した」としています。
推薦入試の内定者を除く全日制の募集定員５５３３人に対し、
辞退や欠席を除いた受験者数は５３８１人で実質の倍率は０．９７倍でした。
実質倍率が１倍を下回ったのは初めてということです。
合格発表は今月１３日に行われます。",[],[]
【山口】公立高校入試　始まる（yab山口朝日放送）,https://news.yahoo.co.jp/articles/f2180055796074d0e7711e1a57cce7b15a5eaba7,https://newsatcl-pctr.c.yimg.jp/t/amd-img/20250305-00004506-yabv-000-1-thumb.jpg?exp=10800,2025-03-05T12:13:38+09:00,2025-03-05T12:13:38+09:00,yab山口朝日放送,yabv,yab山口朝日放送,257,"山口朝日放送
山口県内の公立高校では、５日の朝から入学試験が行われていて約５６００人が試験に臨んでいます。
公立高校の入学試験は、午前９時から各高校で始まりました。
午前は国語、数学、英語、午後は社会、理科の試験が行われます。
県教育委員会によりますと、推薦入試の内定者を除く全日制の募集定員５５３３人に対し、志願者数は５６１２人。
志願倍率は、1.01倍で記録が残っている１９８９年以降最低となっています。
合格発表は３月１３日に行われます。
ｙａｂでは５日、午後４時５０分から「高校入試解答速報」を放送します。",[],[]
