headline,mainEntityOfPage,image,datePublished,dateModified,author,media_en,media_jp,str_count,body,images,external_links
習志野・老舗写真館の萩原さんが勤続30年　今年で80歳「生涯現役」（みんなの経済新聞ネットワーク）,https://news.yahoo.co.jp/articles/8f8280ecf8cc33fc35cfef6c2dd084fc50531183,https://newsatcl-pctr.c.yimg.jp/t/amd-img/20240227-00000022-minkei-000-2-view.jpg?exp=10800,2024-02-27T12:00:00+09:00,2024-02-27T12:35:44+09:00,みんなの経済新聞ネットワーク,minkei,みんなの経済新聞ネットワーク,898,\n高山写真館の萩原和子さん（左）と館長の本宮忠雄さん\n習志野市の高山写真館（習志野市津田沼1）の萩原和子さんが、3月で勤続30年を迎える。（習志野経済新聞）\n【写真】髙山写真館 外観\n同店は1987（昭和62）年2月17日に設立され、今年で37年目を迎えた老舗写真館。写真の現像や証明写真作成など写真館の通常業務以外に、店頭で写真を展示できるギャラリーも運営している。\n\n 萩原さんは37歳のとき、子どもが独立したのをきっかけに会計を学び始め、40歳で習志野の会計事務所へ就職。10年勤務し、50歳で同店の会計として入社した。会計以外にも朝の開店準備や清掃、受付を担当している。\n\n 3月で勤続30年、8月で80歳を迎える萩原さんは地域では「写真館の名物受付」として知られ、業務の傍ら、顔を見に来たり、時には差し入れを持ってくる常連と話すなどして日々過ごしている。\n\n 館長の本宮忠雄さんは「高山写真館が続いているのは間違いなく萩原さんのおかげ。私が高山写真館で働き始めたとき、1年先輩だったのが萩原さん。2022年に館長になってからも技術者の私が仕事に集中できるよう、いろいろ助けてくれて感謝している。80歳で正社員として働いていることはそれだけで同世代に勇気を与えることだと思うので、体に気を付けて、ぜひ生涯現役で頑張ってほしい」とエールを送る。\n\n 萩原さんは「私がここで働き始めた時は、店の売り上げが好調で忙しく、会計に手が回っていない状況だったので、先代館長と相談し、時には、けんかしながらも整理して経理を整えた。館長は写真館としての腕は一流だが、頑固なところがあって、店の宣伝や自分の実力をひけらかすようなことはしない人だった。私が代わりに宣伝しないといけないと思い、いろいろ話していたら、悩み相談にも乗るようになって気が付いたら30年たっていた。当時40歳近い私に仕事を教えてくれた事務所の人たち、先代館長に現館長、そして何より店に来てくれる人に感謝している。体のバランスを取りながら、これからもここで働いていければ」と話す。\nみんなの経済新聞ネットワーク,['https://newsatcl-pctr.c.yimg.jp/t/amd-img/20240227-00000022-minkei-000-2-view.jpg?exp=10800'],"['https://news.yahoo.co.jp/articles/8f8280ecf8cc33fc35cfef6c2dd084fc50531183/images/000', 'https://narashino.keizai.biz/photoflash/743/']"
春を呼ぶ「八戸えんぶり」が4年ぶりに通常開催　市民から喜びの声（みんなの経済新聞ネットワーク）,https://news.yahoo.co.jp/articles/46551846c3a97558a981e5432778f0c226cdd311,https://newsatcl-pctr.c.yimg.jp/t/amd-img/20240227-00000020-minkei-000-1-view.jpg?exp=10800,2024-02-27T12:00:00+09:00,2024-02-27T12:00:00+09:00,みんなの経済新聞ネットワーク,minkei,みんなの経済新聞ネットワーク,1074,\n2月17日に行われた「一斉摺り」\n青森県を代表する祭り「八戸えんぶり」が2月17日～20日、4年ぶりに通常の規模で開催された。（八戸経済新聞）\n\n 「八戸地方に春を呼ぶ」とされる祭りは2021年・2022年、新型コロナウイルス感染拡大の影響で中止。2023年は一部の行事の規模を縮小し開催した。今年は4年ぶりに長者山新羅神社（八戸市長者1）で奉納を行う順番を決める「札取り」を行ったほか、八戸市中心街で行うメイン行事「一斉摺（ず）り」を例年の規模で行うなどし、通常開催された。\n\n 札取りで「一番札」を獲得した「東十日市えんぶり組」の小町秀一さんは「コロナで全く活動できなかった年もあった。去年から少しずつ再開し、ようやく今年は制限なく開催されたことが一番良かった」と話す。同えんぶり組は2月12日、長者山新羅神社の境内に入り、5日間を境内で過ごした。「恵比寿舞」を担当する小町幸秀さんは「4年ぶりのフル開催で一番札と一緒に一斉摺りに参加でき、とても気持ちよく、その勢いで4日間の祭りを乗り切れた」と話す。\n\n 南部町高瀬地区で活動する「高瀬町内会えんぶり組」は、1984（昭和59）年の活動再開後初めて八戸えんぶりに参加。2月17日、「高瀬町内会」の文字が入ったのぼり旗を掲げ、長者山新羅神社での奉納や、えんぶり行列、一斉摺りなどに臨んだ。親方の東憲志さんは「みんなの思いが実った。奉納では緊張したが、周りの人に支えられてなんとか終えられた。青空の下で参加でき、本当にうれしかった。子どもたちに『大きな声で踊るんだよ』と言うと大きな声の返事があった」と笑顔を見せる。\n\n 南郷地区の「荒谷えんぶり組」に参加するアーティストの山本耕一郎さんは「寒い時期にみんなで懸命に踊る姿には感動する。今年は48人の大所帯でにぎやかだった」と話す。山本さんは2012（平成24）年、県外から同地区に移住し、2022年から子どもと一緒に同えんぶり組に参加。「3歳だった子どもがもう5歳になった。地域色が凝縮された小さなコミュニティーがある。1カ月以上練習してきた子どもたちが、ここぞと成果を見せてくれた」と目を細める。\n\n 祭りを主催する「八戸地方えんぶり保存振興会」の塚原隆市会長は「4年ぶりのフル開催で、皆さんの笑顔が印象的だった。初日が土曜だったこともあり、とてもにぎわっていたと思う」と話す。「東北では冬の祭りが減ってきている。八戸えんぶりをひとつの切り口に、八戸全体の観光振興につなげたい」とも。\nみんなの経済新聞ネットワーク,['https://newsatcl-pctr.c.yimg.jp/t/amd-img/20240227-00000020-minkei-000-1-view.jpg?pri=l&w=640&h=426&exp=10800'],['https://news.yahoo.co.jp/articles/46551846c3a97558a981e5432778f0c226cdd311/images/000']
熊本市内を巡る「熊本城マラソン」　1万4600人が駆け抜ける（みんなの経済新聞ネットワーク）,https://news.yahoo.co.jp/articles/d989b1d193e7d812500bac88435d8a83610a7f88,https://newsatcl-pctr.c.yimg.jp/t/amd-img/20240227-00000021-minkei-000-1-view.jpg?exp=10800,2024-02-27T12:00:00+09:00,2024-02-27T12:00:00+09:00,みんなの経済新聞ネットワーク,minkei,みんなの経済新聞ネットワーク,674,\nランナーで埋めつくすスタート地点\n今年で11回目を迎えた「熊本城マラソン2024」が2月18日に開催され、約1万4600人のランナーが熊本市内を駆け抜けた。主催は、熊本市、熊本陸上競技協会、熊本日日新聞社から成る実行委員会。（熊本経済新聞）\n【写真】当日の様子\n大会は3部門に分かれ、熊本市中心部を発着とし66回目となる「金栗記念熊日30キロロードレース」に53人、熊本市内を走る「歴史めぐりフルマラソン」に1万3112人、中心市街地を走る「城下町ファンラン（3.5キロ）」には1464人が、それぞれ参加した。\n\n 個人での参加、会社の同僚と一緒に走る人、日頃から一緒に走っているサークル仲間のほか、干支（えと）にちなんだかぶり物や赤鬼、アニメのキャラクターなどに扮（ふん）したランナーが、沿道の応援に応えながら走っていた。\n\n 沿道にはたくさんの応援者が集まり、各地点では給水・給食を準備したほか、地域の特色を生かした踊りや演奏なども披露。日中の気温が20度を超えたため、給水所ではランナーがのどを潤したり、頭・首を冷やしたりと、例年よりも消費が多かったという。走り終えたランナーはみそ汁や足湯、マッサージなどで疲れを癒やしていた。\n\n ボランティアとして参加した市内の高校に通う2年の桑野さんは「給水所で、ドリンクをランナーに配ったが、暑いこともあり、次から次に来て一日大変だった。でも、一生懸命ゴールを目指して走る姿に元気をもらえたので、ボランティアとして参加できて良かった」と振り返る。\nみんなの経済新聞ネットワーク,['https://newsatcl-pctr.c.yimg.jp/t/amd-img/20240227-00000021-minkei-000-1-view.jpg?pri=l&w=640&h=480&exp=10800'],"['https://news.yahoo.co.jp/articles/d989b1d193e7d812500bac88435d8a83610a7f88/images/000', 'https://kumamoto.keizai.biz/photoflash/2745/']"
センター北・都筑民家園で「ひな祭りウィーク」　貴重なひな人形も（みんなの経済新聞ネットワーク）,https://news.yahoo.co.jp/articles/30ad1ad579c740597c636a4199aeae8b7ccd7c8d,https://newsatcl-pctr.c.yimg.jp/t/amd-img/20240227-00000018-minkei-000-1-view.jpg?exp=10800,2024-02-27T11:30:00+09:00,2024-02-27T11:30:00+09:00,みんなの経済新聞ネットワーク,minkei,みんなの経済新聞ネットワーク,415,\n展示の様子\n明治から平成までのひな人形とつるし飾りの展示が2月23日、大塚・歳勝土遺跡公園（横浜市都筑区大棚西2）内の「都筑民家園」で始まった。（港北経済新聞）\n\n 江戸時代の民家「旧長沢家」（横浜市指定文化財）を移築して公開している同園。季節ごとの伝統行事にちなんだ展示も展開している。\n\n 今回は3月3日の桃の節句に合わせて、有志が所有している明治～平成のひな人形を飾る企画「ひな祭りウィーク」を開催。飾るひな人形の中には、明治期に作られた京びなの老舗丸平大木人形など貴重な展示もある。\n\n 「つるし飾り」は江戸時代頃から始まったとされる天井から縁起物をつるす飾り。縁起物は子どもの健やかな成長を願い、端切れを使って手作りする。同園では桃やハマグリ、フクロウなど30種類以上の縁起物を毎年有志が作りためてきた。\n\n 開催時間は10時～16時。入場無料。展示は3月3日まで。\nみんなの経済新聞ネットワーク,['https://newsatcl-pctr.c.yimg.jp/t/amd-img/20240227-00000018-minkei-000-1-view.jpg?pri=l&w=640&h=480&exp=10800'],['https://news.yahoo.co.jp/articles/30ad1ad579c740597c636a4199aeae8b7ccd7c8d/images/000']
長崎・かもめ広場で巨大レッドドラゴン特別演舞　アミュ大規模リニューアルで（みんなの経済新聞ネットワーク）,https://news.yahoo.co.jp/articles/e96763b5c2b67049c4d2774e20828b97b353e22a,https://newsatcl-pctr.c.yimg.jp/t/amd-img/20240227-00000016-minkei-000-2-view.jpg?exp=10800,2024-02-27T11:24:17+09:00,2024-02-27T11:25:08+09:00,みんなの経済新聞ネットワーク,minkei,みんなの経済新聞ネットワーク,475,\n特別演舞を披露する巨大レッドドラゴン\n巨大レッドドラゴンの特別演舞が3月2日・3日、アミュプラザ長崎（長崎市尾上町）かもめ広場で行われる。（長崎経済新聞）\n\n 全長50メートルの巨大レッドドラゴンは昨年11月に新館がオープンして初めての初売りを迎えた今年の正月、祭りのようなイベントと位置付けて「RED AMU」をテーマに赤で統一した「クリエーティブな世界観」を提案し、辰（たつ）年に合わせて制作していた。\n\n 同施設で過去最大の36店舗のリニューアルを記念して行われる同イベント。巨大レッドドラゴンは1月1日に発生した能登半島地震を受け、1月2日と3日に展示のみの公開となっていたことから、演舞は初めての披露となる。\n\n 同施設を運営するJR長崎シティの後藤孝康さんによると、「レッドドラゴンはとぐろを巻いた状態でもかもめ広場に何とか収まるほどの迫力ある大きさ。巨大なレッドドラゴンを巧みに操り、踊る姿を楽しんでもらえれば」と来場を呼びかける。\n\n 演舞は両日とも11時～と15時～。観覧無料。\nみんなの経済新聞ネットワーク,['https://newsatcl-pctr.c.yimg.jp/t/amd-img/20240227-00000016-minkei-000-2-view.jpg?pri=l&w=640&h=480&exp=10800'],['https://news.yahoo.co.jp/articles/e96763b5c2b67049c4d2774e20828b97b353e22a/images/000']
調布・春休みに電通大でラボ体験　女子中高生の理工系進路支援「匠ガール」（みんなの経済新聞ネットワーク）,https://news.yahoo.co.jp/articles/dc77b8663db6b815d38c3c968b1bd429d4140569,https://newsatcl-pctr.c.yimg.jp/t/amd-img/20240227-00000017-minkei-000-1-view.jpg?exp=10800,2024-02-27T11:30:00+09:00,2024-02-27T11:30:00+09:00,みんなの経済新聞ネットワーク,minkei,みんなの経済新聞ネットワーク,702,\n今回もラボ体験できる小池研究室の「様々な聴力検査の原理と活用法」（前回の様子）\n電気通信大学（調布市調布ケ丘1）は女子中高生の理工系進路選択支援プログラムとして3月26日、「匠（たくみ）ガールプロジェクト『春休みは電通大でラボ体験2024』」を開催する。（調布経済新聞）\n【写真】前回の様子。児玉研究室「モーションセンサーで作るインタラクティヴ・アート」\n同プロジェクトは同大男女共同参画・ダイバーシティ戦略推進室が中心となり2017（平成29）年から定期的に開催し、延べ600人以上の女子中高生が参加してきた。これまで企業の研究所見学や先輩匠ガールのインタビューを行い、近年は同大研究室で最先端の技術を学ぶラボ体験を重ねている。\n\n 今回のプログラムは、脳波や感覚細胞による他覚的聴力検査について学ぶ「さまざまな聴力検査の原理と活用法」、化学反応で発光させる「技術で作るホタルの光」、世界初の診断技術につながる「未知の発光酵素を生成してみよう」、アクリル樹脂の熱硬化で重合反応を見る「体験 きれいな塊づくり～ジェルネイルの高分子化学～」。\n\n 過去の参加者事後アンケートでは、「科学技術や理科・数学に対する興味・関心が高まった」という声や「自分の将来を具体的に考えることができた」という感想が寄せられたという。担当者は「普段なかなか入ることのできない大学研究室で、先生や先輩たちと一緒に研究の楽しさを体験してほしい」と話す。\n\n 参加無料。定員はプログラムにより異なる（応募多数の場合は抽選）。参加希望者は3月8日正午までに専用フォームで申し込む。\nみんなの経済新聞ネットワーク,['https://newsatcl-pctr.c.yimg.jp/t/amd-img/20240227-00000017-minkei-000-1-view.jpg?pri=l&w=640&h=480&exp=10800'],"['https://news.yahoo.co.jp/articles/dc77b8663db6b815d38c3c968b1bd429d4140569/images/000', 'https://chofu.keizai.biz/photoflash/4734/']"
鳥取に県内初の生ドーナツ専門店　「トリュフ生ドーナツ」を目玉に（みんなの経済新聞ネットワーク）,https://news.yahoo.co.jp/articles/4e29736b560fa22d4a1f71661ccdd613baf59a87,https://newsatcl-pctr.c.yimg.jp/t/amd-img/20240227-00000014-minkei-000-1-view.jpg?exp=10800,2024-02-27T11:04:28+09:00,2024-02-27T11:04:28+09:00,みんなの経済新聞ネットワーク,minkei,みんなの経済新聞ネットワーク,629,\n3月2日にオープンするTRUFFLE DONUT（トリュフドーナツ）店内\n鳥取初の生ドーナツ専門店「TRUFFLE DONUT（トリュフドーナツ）」が3月2日、丸由百貨店（鳥取市今町2）5階にオープンする。（鳥取経済新聞）\n\n メニュー監修は、横浜の生ドーナツ専門店「UNI DONUTS（ユニドーナツ）」が務める。同店は、ふわふわのドーナツ生地にクリームをたっぷり入れた生ドーナツが人気で、連日1時間ほどで完売するという。\n\n 同店では、大山小麦や白バラ牛乳、鳥取県産イチゴ「とっておき」など県内産の食材を使い、「鳥取ならでは」の生ドーナツを開発。経営するトリクミ（八頭町）の古田琢也社長は「地元農業の盛り上げと地域活性化に貢献したい」と話す。\n\n ドーナツは、プレーン（250円）、カスタード、ホイップ（以上300円）、抹茶（400円）、いちご（420円）、チョコ（450円）と、店名にもなっているトリュフ（380円）の7種類を用意。ドリンクも提供する。\n\n 目玉商品として「トリュフ生ドーナツ」を用意。八谷早織店長は「イタリア産のトリュフ塩、トリュフオイル、トリュフペーストを練り込んだクリームをたっぷりと注入し、さらに表面にオイルをかけている。スイーツとは少し違う、トリュフの豊潤な香りと少し塩気のあるクリームとのバランスを楽しんでほしい」と呼びかける。\n\n 営業時間は10時～18時30分。\nみんなの経済新聞ネットワーク,['https://newsatcl-pctr.c.yimg.jp/t/amd-img/20240227-00000014-minkei-000-1-view.jpg?pri=l&w=640&h=480&exp=10800'],['https://news.yahoo.co.jp/articles/4e29736b560fa22d4a1f71661ccdd613baf59a87/images/000']
川越市場内の生鮮漁港川越でひな祭りイベント　マグロの解体ショーも（みんなの経済新聞ネットワーク）,https://news.yahoo.co.jp/articles/7c0113f0ead9cacb91896da947b16676cbab9eff,https://newsatcl-pctr.c.yimg.jp/t/amd-img/20240227-00000019-minkei-000-1-view.png?fmt=jpeg&q=85&exp=10800,2024-02-27T11:53:53+09:00,2024-02-27T11:53:53+09:00,みんなの経済新聞ネットワーク,minkei,みんなの経済新聞ネットワーク,453,\n過去のマグロの解体ショーの様子\n埼玉川越総合地方卸売市場の生鮮漁港川越（川越市大袋）で3月3日、ひな祭りイベントが開催される。（川越経済新聞）\n\n 日本の伝統的な祭りと魚食文化を広げたいという思いで企画された同イベント。売り場では、ひな祭りの飾り付けも行う。生本マグロの解体ショーでは、おろしたマグロをその場で、柵で販売する。今回はより多くの人に食べてもらいたいという思いからにぎりずしも提供。自宅ですし体験ができる「ちらしずしキット」「にぎりずしキット」「手巻きセット」や、より手頃に味わえる「カップずし」「いなりずし」「チラシずし」も用意。鮮魚対面コーナーではハマグリも販売する。\n\n 企画した古賀商店の大畑孝雄さんは「ひな祭りといえば、ちらしずしやはまぐりの吸い物を食べる風習があるが、このイベントでより魚介類をおいしいと感じてもらうきっかけにしていただき、少しでも魚食文化に広がりを持たせられたら」と話す。\n\n マグロの解体ショーは11時開始予定。\nみんなの経済新聞ネットワーク,['https://newsatcl-pctr.c.yimg.jp/t/amd-img/20240227-00000019-minkei-000-1-view.png?pri=l&w=640&h=375&fmt=jpeg&q=85&exp=10800'],['https://news.yahoo.co.jp/articles/7c0113f0ead9cacb91896da947b16676cbab9eff/images/000']
「IC-98」の短編映画「Impivaara」　アテネウム美術館で上映（みんなの経済新聞ネットワーク）,https://news.yahoo.co.jp/articles/afa8ccec774963650bf4cb17552373fdf4dc2cf3,https://newsatcl-pctr.c.yimg.jp/t/amd-img/20240227-00000013-minkei-000-1-view.jpg?exp=10800,2024-02-27T10:30:00+09:00,2024-02-27T10:30:00+09:00,みんなの経済新聞ネットワーク,minkei,みんなの経済新聞ネットワーク,478,"\n「IC-98」の短編映画「Impivaara（A New World）」 （C） IC-98／Ateneum Art Museum\nアーティストデュオ「IC-98」の短編映画「Impivaara（A New World）」が現在、アテネウム美術館（Kaivokatu 2, Helsinki）のフォーカス・ギャラリーで上映されている。（ヘルシンキ経済新聞）\n\n パトリック・ソダールンドさんとビサ・スオンパーさんによる同作は、フィンランド人小説家のアレクシス・キビの古典小説「七人兄弟」を元に、自然の支配者としての人類について考察し、人類の文化のエネルギー的基盤や種の共存、環境危機から生まれる別の未来という視点から同小説を検証する。\n\n 同ギャラリーでは同作の上映に加え、フィンランド人アーティストのアクセリ・ガレン＝カッレラさんが同小説のために描いたスケッチ作品を展示する。\n\n 開館時間は10時～20時（土曜・日曜は17時まで）。月曜休館。入館料は、一般＝20ユーロ、18歳未満無料。4月28日まで。\nみんなの経済新聞ネットワーク",['https://newsatcl-pctr.c.yimg.jp/t/amd-img/20240227-00000013-minkei-000-1-view.jpg?pri=l&w=640&h=301&exp=10800'],['https://news.yahoo.co.jp/articles/afa8ccec774963650bf4cb17552373fdf4dc2cf3/images/000']
東大宮に寒天専門店「かんてんぱぱショップ」　埼玉県内初の直営店（みんなの経済新聞ネットワーク）,https://news.yahoo.co.jp/articles/ed1299d81d7c4bab335b96415f4b5a14f36c0fc0,https://newsatcl-pctr.c.yimg.jp/t/amd-img/20240227-00000011-minkei-000-4-view.jpg?exp=10800,2024-02-27T10:27:50+09:00,2024-02-27T10:29:38+09:00,みんなの経済新聞ネットワーク,minkei,みんなの経済新聞ネットワーク,790,\n「かんてんぱぱ東大宮店」がオープン\n伊那食品工業（長野県伊那市）が2月15日、寒天ブランド「かんてんぱぱ」の直営店「かんてんぱぱショップ東大宮店」（さいたま市見沼区東大宮5）をオープンした。出店は埼玉県内初。（大宮経済新聞）\n【写真】「かんてんぱぱ」の寒天ゼリー\n2月1日に開設した同社東京支店さいたま営業所に併設する形でオープンした同店。家庭用「かんてんぱぱ」やオリジナル商品を販売するほか、南信州中川村のグループ企業「米澤酒造」の日本酒も扱う。グループ企業「ぱぱな農園」の野菜も用意していく。スタッフは長野県から異動した社員も多く、来店客に商品紹介や寒天についての説明を行っている。営業職の社員が全国を回る中で知り得た、自社以外のお薦め商品も扱っているのが特徴だという。\n\n 建物は木造で屋根に特徴があり、中央アルプスの山々をイメージして作ったという。天井を高くした店内は、自然素材のしっくいと木製の什器で明るく開放的な空間に仕上げた。敷地内はさいたま市内で栽培された植栽を施し、「緑と調和する店」にした。\n\n 営業所長の原基樹さんは「東大宮に新たに営業所を開設し同時に広い販売所を設けるという、これまでにはない店となった。働く人を大切にしながら一歩ずつ着実に成長していく社風のため、長野と大宮、そして北関東をつなぐ拠点となれるよう、少しずつ認知してもらえたら。地元に根付いていけるよう、今後はコラボ商品やイベントなども考えていきたい」と話す。\n\n 唐澤繁樹店長は「長野県は寒天の国内出荷額が1位。県内では知名度の高い『かんてんぱぱ』だが、全国的にはまだまだ知ってもらえる余地があると感じる。まずは気軽に来店し、見て知ってもらえたら」と呼びかける。\n\n 営業時間は9時～17時（土曜・日曜は10時～18時）。火曜定休。\nみんなの経済新聞ネットワーク,['https://newsatcl-pctr.c.yimg.jp/t/amd-img/20240227-00000011-minkei-000-4-view.jpg?pri=l&w=640&h=426&exp=10800'],"['https://news.yahoo.co.jp/articles/ed1299d81d7c4bab335b96415f4b5a14f36c0fc0/images/000', 'https://omiya.keizai.biz/photoflash/5861/']"
