headline,mainEntityOfPage,image,datePublished,dateModified,author,media_en,media_jp,str_count,body,images,external_links
「ベースボールフェスタ＆東大阪くいだおれ祭り」開催へ　飲食など54ブース（みんなの経済新聞ネットワーク）,https://news.yahoo.co.jp/articles/b562e244e9275ee55a4be8abeb2c3107be600c9d,https://newsatcl-pctr.c.yimg.jp/t/amd-img/20240227-00000070-minkei-000-2-view.jpg?exp=10800,2024-02-27T23:13:23+09:00,2024-02-28T01:17:38+09:00,みんなの経済新聞ネットワーク,minkei,みんなの経済新聞ネットワーク,1235,\n「NEXUS」「モンキー×モンキーズ」代表の垣内皆人さん（写真右）\nイベント「ベースボールフェスタ＆東大阪くいだおれ祭り」が3月3日、石切市民広場（東大阪市中石切町5）で開かれる。主催はHOS（下小阪2）。（東大阪経済新聞）\n\n 同イベントを企画・運営するのは、野球用オーダーメードグラブなどを手がける「NEXUS」（元町2）と居酒屋「モンキー×モンキーズ」（日下町6）。両者代表の垣内皆人さんは「野球用品、飲食共にイベントに出店する機会が増えてきて、出店することにより、気になっていたが店に行く機会がなかったというお客さまとつながることができた。イベントはお客さまと店をつなぐいいツールだと感じた」という。周りにはコロナ禍が明け、どのようにかじを取ればいいか悩んでいる人もおり、自身が経営するスポーツとグルメジャンルのブースを集めて、地元東大阪の店の認知を高めることができればと、同イベントを企画した。\n\n 垣内さんは小学生の頃、地元の少年野球チーム「石切ジュニアモンキーズ」に所属し、現在も軟式野球チームで野球を続けている。「大谷選手がグローブを贈ったことで野球に興味を持った子もいると思うが、キャッチボール禁止の公園も多く、どこで野球をしていいのかわからない人も多いと思う。体験せずに少年野球チームに入るのはハードルが高いので、まずは体験をしてもらって、野球チームに入る子どもが増えれば」との思いも同イベントに込めた。\n\n ベースボールフェスタでは、野球体験会と野球教室を開催。野球体験会では、野球未経験の小学生以下を対象に、石切ジュニアモンキーズの児童と一緒に、キャッチボールや遠投、バッティングなどを楽しめる。野球教室では、関西独立リーグ「大阪ゼロロクブルズ」の選手たちが講師となり、小学生以上の経験者を対象に指導する。野球体験会は10時～17時（受け付けは16時まで）、野球教室は、1部＝10時～13時（同12時まで）、2部＝14時～17時（同16時まで）。参加無料。\n\n 会場には、キッチンカーや屋台が店を出す「フードフェスエリア」に31ブースが、子ども向けを中心とするワークショップや縁日を展開する「お楽しみエリア」に23ブースが、それぞれ出店。出店者は東大阪市内の店や東大阪に縁のある人が多く、お楽しみエリアには、シルクスクリーン印刷体験や宮大工体験、子ブタとの触れ合いなど、幅広いジャンルをそろえた。\n\n 垣内さんは「地域の子どもから大人まで楽しめるイベント。お祭りに行ったら野球体験ができ、やってみたら野球を好きになったというようなイベントになれば。東大阪では食イベントが少ないので、東大阪はおいしいものが多い街というイメージも創出したい。今後も音楽やスポーツとグルメを掛け合わせたイベントをやっていきたい」と意欲を見せる。\n\n 開催時間は10時～17時。入場無料。雨天決行、荒天中止。\nみんなの経済新聞ネットワーク,['https://newsatcl-pctr.c.yimg.jp/t/amd-img/20240227-00000070-minkei-000-2-view.jpg?pri=l&w=640&h=480&exp=10800'],['https://news.yahoo.co.jp/articles/b562e244e9275ee55a4be8abeb2c3107be600c9d/images/000']
青森でローカルフードイベント「第3回棒パンサミット」　100人分の焼き台も（みんなの経済新聞ネットワーク）,https://news.yahoo.co.jp/articles/e969b41d2aa99d75ea524471fcffee496e1c8a38,https://newsatcl-pctr.c.yimg.jp/t/amd-img/20240227-00000067-minkei-000-1-view.jpg?exp=10800,2024-02-27T22:33:33+09:00,2024-02-27T22:33:33+09:00,みんなの経済新聞ネットワーク,minkei,みんなの経済新聞ネットワーク,913,\n新作グッズを身に着ける山口志麻さん\n「第3回棒パンサミット」が3月2日・3日、青森県観光物産館アスパム（青森市安方1）で開催される。（青森経済新聞）\n【写真】昨年の棒パンサミットの様子\n竹の棒にパン生地を巻いて炭火で焼く青森市のローカルフード「棒パン」が主役の同イベント。2022年から年1回のペースで開き、今年で3回目になる。セルフで棒パンを焼ける体験コーナーを設けるほか、棒パンモチーフのアイテムやオリジナルグッズ、棒パンにちなんだ飲食メニューなどを販売する。\n\n 主催は雑貨店「三ノ月舎（みのつきしゃ）」（柳町）の店主・山口志麻さん。山口さんが大好きだという棒パンを大人も子どももおなかいっぱい食べてほしいと企画した。\n\n 昨年は約2500人が棒パンを焼いた体験コーナーには今年、ドラム缶焼き台4台を増やし、一度に100人が焼けるよう工夫。山口さんは「待ち時間が多く発生してしまった昨年の反省を生かし、焼き台を増設。前回と同じく設置する15メートルの特設焼き台は、火力が弱まらない改良を加えた」と説明する。\n\n 体験コーナーでは、受け付けで希望のパン生地を巻いた棒を受け取ってから、焼き台で10～15分ほどかけて棒パンを焼いてもらう。料金は、シングル（1個）＝300円、ダブル（2個）＝600円、トリプル（3個）＝800円。パン生地は「プレーン」「チョコチップ」「よもぎ」の3種類から選んで自由に組み合わせてもらう。焼き加減はスタッフが確認し、火が通っていれば棒から外してカップに入れ、体験者に渡す。\n\n 山口さんは「今年は専用の棒を作ったり、青森在住のバンド『うきぐも』にオリジナルソングを作ってもらったりなど、浮かぶアイデアをどんどん形にした。長く愛される棒パンの良さは残しつつ、印象に残るような楽しい仕掛けを用意しているので、ぜひおいしい棒パンを味わってもらえたら」と呼びかける。\n\n 開催時間は10時～16時。入場無料。両日は、アスパム館内で「三ノ月舎」が主催する5つのイベントが集まる「MUSUBI」も同時開催。同サミットと合わせ60店が出店する。\nみんなの経済新聞ネットワーク,['https://newsatcl-pctr.c.yimg.jp/t/amd-img/20240227-00000067-minkei-000-1-view.jpg?pri=l&w=640&h=480&exp=10800'],"['https://news.yahoo.co.jp/articles/e969b41d2aa99d75ea524471fcffee496e1c8a38/images/000', 'https://aomori.keizai.biz/photoflash/1350/']"
千葉ポートアリーナで「車いすバスケットボール」大会　淑徳大生が企画・運営（みんなの経済新聞ネットワーク）,https://news.yahoo.co.jp/articles/08114b5e40ef1502abe7c7500d12989838fe17cc,https://newsatcl-pctr.c.yimg.jp/t/amd-img/20240227-00000071-minkei-000-6-view.jpg?exp=10800,2024-02-27T23:59:35+09:00,2024-02-28T00:20:09+09:00,みんなの経済新聞ネットワーク,minkei,みんなの経済新聞ネットワーク,464,\n昨年の大会運営を行った学生たち（写真提供＝淑徳大学）\n「第13回長谷川良信記念・千葉市長杯争奪車椅子バスケットボール全国選抜大会」が3月2日・3日、千葉ポートアリーナ（千葉市中央区問屋町）で行われる。主催は、千葉市、淑徳大学、千葉市スポーツ財団。（千葉経済新聞）\n【写真】会場となる千葉ポートアリーナ\n2012年から毎年市内で開催される車いすバスケットボールの全国大会。淑徳大学の学生が企画や後援依頼、当日の大会運営などを行っている。\n\n 参加チームは全国から選抜された6チーム。同大会で昨年優勝した「神奈川VANGUARDS（パラ神奈川SCから名称変更）」、準優勝の「NO EXCUSE」（東京都）のほか、「埼玉ライオンズ」や「ワールドBBC」（愛知県）、「宮城MAX」、地元千葉からは「千葉ホークス」が参戦する。\n\n 一部の試合と3位決定戦、決勝戦は「ユーチューブ千葉市公式チャンネル」がライブ配信する。\n\n 試合開始時間は、2日＝11時35分、5日＝10時。入場無料。\nみんなの経済新聞ネットワーク,['https://newsatcl-pctr.c.yimg.jp/t/amd-img/20240227-00000071-minkei-000-6-view.jpg?pri=l&w=640&h=480&exp=10800'],"['https://news.yahoo.co.jp/articles/08114b5e40ef1502abe7c7500d12989838fe17cc/images/000', 'https://chiba.keizai.biz/photoflash/1746/']"
和歌山産南高梅使った2商品発売　「三ツ矢」「ウィルキンソンタンサン」（みんなの経済新聞ネットワーク）,https://news.yahoo.co.jp/articles/6ed2329a65307f27f0a206effd54a4f782e120e6,https://newsatcl-pctr.c.yimg.jp/t/amd-img/20240227-00000069-minkei-000-1-view.jpg?exp=10800,2024-02-27T23:00:00+09:00,2024-02-27T23:00:00+09:00,みんなの経済新聞ネットワーク,minkei,みんなの経済新聞ネットワーク,641,\n南高梅を使った「三ツ矢 芳醇（ほうじゅん）南高梅」\n和歌山県産南高梅を使った炭酸飲料「三ツ矢 芳醇（ほうじゅん）南高梅」と「ウィルキンソンタンサン ウメ」の販売が2月20日、全国の量販店やコンビニエンスストアなどで始まった。製造・販売は「アサヒ飲料」（東京都墨田区）。（和歌山経済新聞）\n【写真】南高梅エキスを配合した「ウィルキンソン タンサン ウメ」\n同社は2013（平成25）年の「三ツ矢梅」発売以降、和歌山県協力商品として14品を発売している。和歌山県はタイアップによる商品作りを通じて、広く県産食材をPRし、イメージアップとファン獲得に取り組む。\n\n 「三ツ矢 芳醇南高梅」（500ミリリットル、希望小売価格＝160円）は、南高梅果汁とピューレ、エキスを配合。パッケージには、「三ツ矢」の矢羽根ロゴの上に100年以上、地域で栽培され続ける梅を現す「百梅」の文字と南高梅のイラストをあしらう。「ウィルキンソン タンサン ウメ」（同、110円）は、南高梅のエキスを配合。パッケージは金色の背景に南高梅のイラストを添える。\n\n 和歌山県食品流通課の木村夏純さんは「三ツ矢梅は、南高梅の深みある味と豊潤な香りをしっかり感じる。ウィルキンソンタンサンは無糖で炭酸の刺激を感じ、スッキリしている。飲み比べて違いを楽しんでほしい」と話す。\n\n 販売期間は、「三ツ矢 芳醇南高梅」は通年、「ウィルキンソン タンサン ウメ」は5月末まで。\nみんなの経済新聞ネットワーク,['https://newsatcl-pctr.c.yimg.jp/t/amd-img/20240227-00000069-minkei-000-1-view.jpg?pri=l&w=640&h=480&exp=10800'],"['https://news.yahoo.co.jp/articles/6ed2329a65307f27f0a206effd54a4f782e120e6/images/000', 'https://wakayama.keizai.biz/photoflash/5834/']"
SAGAアクアでアーティスティックスイミング日本代表がエキシビション（みんなの経済新聞ネットワーク）,https://news.yahoo.co.jp/articles/4edc90837933485d3b6b7878dc6ec46a811775f8,https://newsatcl-pctr.c.yimg.jp/t/amd-img/20240227-00000066-minkei-000-1-view.jpg?exp=10800,2024-02-27T21:56:18+09:00,2024-02-27T21:56:18+09:00,みんなの経済新聞ネットワーク,minkei,みんなの経済新聞ネットワーク,727,\nSAGAアクアでエキシビションを行うアーティスティックスイミング日本代表（提供＝佐賀県スポーツ課）\nアーティスティックスイミング日本代表のエキシビションが3月2日、水泳場「SAGAアクア」（佐賀市日の出2）で行われる。（佐賀経済新聞）\n【写真】SAGAアクアの屋内50メートルコースプール\nSAGAアクアは、国際基準プールに適合し、総観客席数1800席の屋内50メートルコースプール、国内基準に適合し、1メートルと3メートルの飛板を2基ずつ、5メートル、7.5メートル、10メートルの飛込台を1基ずつ備える屋外飛込プール、25メートルのサブプールがある県内最大の水泳場。今年、佐賀県内で開催される「国民スポーツ大会・全国障害者スポーツ大会」に合わせて整備した「SAGAサンライズパーク」内の施設として2021年10月にオープンした。これまで、オープンウオータースイミングや水球男子が強化合宿を行ったほか、昨年7月に福岡市内で開催された「世界水泳選手権」では、アーティスティックスイミング日本代表やオーストラリア水泳代表チームが事前合宿を行った。\n\n 今回のエキシビションは、2月26日～3月5日と11日～17日に同所で実施する、アーティスティックスイミング日本代表のパリオリンピック出場に向けた事前合宿期間中に一般観覧可能な演技会を行うもので、佐賀県初開催となる。参加メンバーは、安永真白選手、比嘉もえ選手、吉田萌選手、木島萌香選手、佐藤友花選手、柳澤明希選手、和田彩未選手、藤井萌夏選手、島田綾乃選手、小林唄選手の10人を予定する。\n\n 開催時間は15時～16時（14時30分から受け付け）。入場無料。\nみんなの経済新聞ネットワーク,['https://newsatcl-pctr.c.yimg.jp/t/amd-img/20240227-00000066-minkei-000-1-view.jpg?pri=l&w=640&h=480&exp=10800'],"['https://news.yahoo.co.jp/articles/4edc90837933485d3b6b7878dc6ec46a811775f8/images/000', 'https://saga.keizai.biz/photoflash/3918/']"
渋谷でフィンランド発・アートプロジェクト「バディドッグ」展　彫刻作品など（みんなの経済新聞ネットワーク）,https://news.yahoo.co.jp/articles/9b18efce5a43677882eabee17c9bc7df301879ff,https://newsatcl-pctr.c.yimg.jp/t/amd-img/20240227-00000068-minkei-000-1-view.jpg?exp=10800,2024-02-27T21:18:32+09:00,2024-02-27T21:18:32+09:00,みんなの経済新聞ネットワーク,minkei,みんなの経済新聞ネットワーク,781,"\nパリッロさんの瞑想中のバディドッグを表現した高さ1.5メートルの彫像\nアーティスト・ファッションデザイナーのダニエル・パリッロさんとデジタルアーティストのルーカス・ザノットさんによる「WHAT IS BUDDY DOG THINKING?」展が2月29日から、渋谷・八幡通りのギャラリースペース「（PLACE） by method」（渋谷区東1）で開催される。（シブヤ経済新聞）\n【写真】ザノットさんのループ動画作品より\n展覧会のテーマにもなっている「BUDDY DOG（バディドッグ）」は、デジタル化により現実と仮想が「曖昧になった」現代社会で、「悟りを開いたミステリアスな犬」のキャラクターを軸としたフィンランド発アートプロジェクト。パリッロさんはバディドッグのキャラクターをデザインしたアーティストでもあり、ザノットさんは現代美術家KAWSさんと協力して米大統領選挙への参加を促すARアートを手がけたことでも知られる。プロジェクトでは、「人の心に問いを投げかける物語」を、アートを通して表現する。\n\n プロジェクトの皮切りとなる同展では、パリッロさんによる瞑想中のバディドッグを表現した高さ1.5メートルの彫像をはじめとするパディドッグ像や着せ替え服、ザノットさんによるループ動画作品5点などを展示。彫像の周辺には座布団などを置き、来場者が座ることができるようにする。\n\n 展示作品でもあるパリッロさんがデザインしたミニフィギュア（高さ25センチ、6万3,000円）や、ワッペン（700円）、ステッカー（400円）などを販売する。\n\n 開催時間は11時～18時（29日は18時～21時）。3月2日まで。インスタグラムアカウントをフォローした来場者にはパディドッグのNFTアートを先着100人に進呈する。\nみんなの経済新聞ネットワーク",['https://newsatcl-pctr.c.yimg.jp/t/amd-img/20240227-00000068-minkei-000-1-view.jpg?pri=l&w=426&h=640&exp=10800'],"['https://news.yahoo.co.jp/articles/9b18efce5a43677882eabee17c9bc7df301879ff/images/000', 'https://www.shibukei.com/photoflash/17155/']"
水戸で「アソビサイエンス」　茨城高専生が運営、小中学生が楽しく学ぶ（みんなの経済新聞ネットワーク）,https://news.yahoo.co.jp/articles/328ab77a0737b7cd86292c106198f1a33174d3b9,https://newsatcl-pctr.c.yimg.jp/t/amd-img/20240227-00000065-minkei-000-2-view.jpg?exp=10800,2024-02-27T21:30:00+09:00,2024-02-27T21:36:11+09:00,みんなの経済新聞ネットワーク,minkei,みんなの経済新聞ネットワーク,1245,\nロボット部「いばらきりん」のパフォーマンスの様子\n茨城工業高等専門学校（ひたちなか市中根、以下「茨城高専」）の生徒が運営するイベント「茨城高専アソビサイエンスinミトウチ」が2月17日・18日、「イオンモール水戸内原」（水戸市内原2）で開催された。初日の開場時間には、整理券を求める家族連れの行列ができた。（水戸経済新聞）\n【写真】お絵かき水族館を楽しむ参加者\n茨城高専は県内唯一の国立高等専門学校で、理系を専門的に学ぶ学校。同イベントでは、会場運営から来場者対応まで生徒が主体となって行い、CG・VRコンテンツや音楽、映像、ゲームなど、日頃の授業や実験・実習、研究活動等を通して学んでいることの成果を発表した。会場には音と光、デジタルを融合した多数の体験型コンテンツを用意し、小中学生に理科や科学の楽しさを体験してもらうワークショップなども開催。2日間で延べ151人の高専生が来場者を迎えた。\n\n 「デジタルバーチャルライブ」では、CGと音源制作を本科4年生が1人で担当した作品を発表した。「ドローン体験」では、生徒が制作したシミュレーションゲームをPCで行った上で、ドローンの実機を操作。生徒によるとドローンを研究しているメンバーが、VR操作後に実機でどれぐらい操作性が上がるかを検証することなども考えたという。「お絵かき水族館」では、参加者が描いた海の生物をPCに取り込み、モニター上で泳がせた。子どもたちは自分の描いた絵が動く様子を見て喜んだ。\n\n ロボット部によるキリン型ロボット「いばらきりん」のパフォーマンスでは、多くの家族連れがホール内に集まり見学。チームで息の合った操作を行いながらロボットの仕組みなどを解説すると、質問コーナーでは子どもから大人までひっきりなしに手が上がり、盛り上がりを見せた。\n\n ワークショップのテーマは「デジタル」「工作」「環境」。カードを使った簡単な「プログラミング体験」や「紙コップ相撲ロボット製作体験」では、生徒が参加した子どもたちをサポートした。園芸・環境部による「SDGsアクセサリー」のワークショップでは、生徒が阿字ヶ浦の海岸で拾い集めた海洋プラスチックを消毒し、はさみで小さくカットするなど事前に準備。アクセサリーを作るだけでなく、環境問題を身近に感じてもらえるように「環境クイズ」も併せて行った。\n\n 同校広報室副室長の金澤秀映さんは「生徒が主体的にイベントを運営することで、社会性やコミュニケーション力、協働する能力を学んでほしい。挑戦する姿勢や失敗にくじけない心を養うための経験を積んでほしい」と期待を込める。「3年ほど前から茨城高専を知っていただく機会としてイベントを重ねてきたが、アソビサイエンスの名で小中学生向けのイベントとして定着してきた。今後も理科や科学の面白さを伝えていきたい」とも。\n\n 次回は3月21日・22日、イーアスつくばでの開催を予定している。\nみんなの経済新聞ネットワーク,['https://newsatcl-pctr.c.yimg.jp/t/amd-img/20240227-00000065-minkei-000-2-view.jpg?pri=l&w=640&h=479&exp=10800'],"['https://news.yahoo.co.jp/articles/328ab77a0737b7cd86292c106198f1a33174d3b9/images/000', 'https://mito.keizai.biz/photoflash/2535/']"
多摩中央公園で「パークライフショー」開催へ　20以上の企画を用意（みんなの経済新聞ネットワーク）,https://news.yahoo.co.jp/articles/b615b6743c9048a5a14dc40196c8f78a99b13f2f,https://newsatcl-pctr.c.yimg.jp/t/amd-img/20240227-00000062-minkei-000-1-view.jpg?exp=10800,2024-02-27T21:03:49+09:00,2024-02-27T21:03:49+09:00,みんなの経済新聞ネットワーク,minkei,みんなの経済新聞ネットワーク,873,\n広場や水辺などがある多摩中央公園\n「多摩中央公園・多摩センター パークライフショー」が3月2日、多摩中央公園（多摩市落合）とその周辺を会場に行われる。（八王子経済新聞）\n【写真】イベントのチラシ\n「多摩中央公園・多摩センター連携協議会」が主催し、2018（平成30）年から開催している同イベント。今回で4回目。2025年の完全供用開始に向け改修工事が進む同公園の「改修基本方針」の下、公園の使い方や過ごし方などのアイデアを試す「プレースメーキング社会実験」に位置付ける。\n\n 当日は同公園のほか、京王相模原線・小田急多摩線「多摩センター駅」前のパルテノン大通りなどを会場に、20を超える企画を用意する。公園内の「自由広場」では、「プレーパーク in 多摩中央公園」や「エコベルを作ろう、エコベルで遊ぼう」などを開催。パルテノン大通りでは、制限時間内に公園内のスポットを巡るイベントで「明治大学おくやまぜみ」による「みんなの公園ミニ・ロゲイニング」などが行われる。\n\n 多摩市の複合文化施設・パルテノン多摩（落合）の大階段下では、中学1年生のウクレレプレーヤー「yuzuki」さんによるパフォーマンスの披露や、多摩市のご当地アイドル「des ailes 26（ディゼル）」によるミニライブなどを開催。公園内の「大池前テラス」では、「本の物々交換」「大池カヌー体験」、同公園の改修工事の様子を視察する「パークライフ・ウォーキング」などの企画を行う。\n\n 「Noと言わない公園を目指して」をコンセプトにする同イベント。今回は「全ての壁を取り払ってごちゃまぜで楽しむ！（＝インクルーシブ）」をテーマにした。同会の事務局がある「TAMAセントラルパークJV」（落合）の広報担当者は「障がいの有無や年代の差も関係なく、どんな人でも楽しめるイベントを目指して、さまざまな企画の実施を予定している」と説明する。\n\n 開催時間は10時～17時。一部の催しには参加費がかかる。雨天の場合は3月3日に開催する。\nみんなの経済新聞ネットワーク,['https://newsatcl-pctr.c.yimg.jp/t/amd-img/20240227-00000062-minkei-000-1-view.jpg?pri=l&w=640&h=480&exp=10800'],"['https://news.yahoo.co.jp/articles/b615b6743c9048a5a14dc40196c8f78a99b13f2f/images/000', 'https://hachioji.keizai.biz/photoflash/4263/']"
