headline,mainEntityOfPage,image,datePublished,dateModified,author,media_en,media_jp,str_count,body,images,external_links
J1鹿島　タイトル奪還へ一丸　鬼木監督、新体制を発表【更新】（茨城新聞クロスアイ）,https://news.yahoo.co.jp/articles/a382e78acae93a8ad5411f484147e5f2f7bd71bf,https://newsatcl-pctr.c.yimg.jp/t/amd-img/20250112-00000009-ibaraki-000-2-view.jpg?exp=10800,2025-01-12T19:23:00+09:00,2025-01-12T22:10:04+09:00,茨城新聞クロスアイ,ibaraki,茨城新聞クロスアイ,780,"1
/
4
J1鹿島の新体制発表に登壇した鬼木達新監督(中央)と今季新加入の選手たち=鹿嶋市宮中
今季の意気込みを語る鬼木新監督=鹿嶋市宮中
鹿島の新体制
加入退団選手の動向
サッカー・J1鹿島アントラーズの新体制発表会が12日、茨城県鹿嶋市宮中の高正U&Iセンターホールで開かれ、加入選手らが決意を示した。スローガンは「Football　Dream(フットボールドリーム)ONE(ワン)」。川崎を強豪クラブに押し上げた鬼木達(とおる)新監督(50)の下、チーム一丸となって2016年度以来の国内タイトル奪還を目指す。

新スローガンには「勝利に向け鹿島ファミリー全員が一つとなり、全ての大会でナンバーワンを目指す」という意味が込められている。

小泉文明社長は今季の目標として「リーグタイトル奪還」と断言。「クラブが一貫性ある強化方針を示すとともに、勝つためのフットボールスタイル構築を図る」と力を込めた。

鬼木新監督は「クラブに関わる人全員でリーグ優勝という目標に向かっていけば、必ずたどり着くと思っている。鹿島らしさを前面に出して戦い、相手を圧倒するサッカーをしていきたい」と力強く意気込みを示した。

川崎で一時代を築いた新たな指揮官の下、「全員守備・全員攻撃」という意識を軸とした攻撃的なスタイルで覇権奪還を目指す。強化すべきポイントについて、鬼木監督は「どういう戦術かということよりも、全員でハードワークをして、攻めだけでなく守備でも攻撃的に戦うことを落とし込んでいきたい」と強調した。

新戦力は期限付き移籍からの復帰と、期限付き移籍から完全移籍への移行を含めて10人。C大阪からレオセアラ(29)が加わり、横浜Mからは小池龍太(29)が加入した。

リーグ初戦は2月15日、敵地で湘南と対戦。ホーム初戦は同22日に東京Vを迎える。
茨城新聞社",[],[]
留置施設で勾留中のタイ人女性死亡　就寝中に急変　茨城県警行方署（茨城新聞クロスアイ）,https://news.yahoo.co.jp/articles/a956fa9248cb508a0a566b4f25a79863a10ba6f3,https://newsatcl-pctr.c.yimg.jp/t/amd-img/20250112-00000008-ibaraki-000-2-view.jpg?exp=10800,2025-01-12T18:00:00+09:00,2025-01-12T18:06:01+09:00,茨城新聞クロスアイ,ibaraki,茨城新聞クロスアイ,198,"行方署=行方市麻生
茨城県警行方署は12日、入管難民法違反(不法残留)容疑で同署内の留置施設に勾留中だったタイ国籍の女性(46)が死亡したと発表した。

同署によると、同日午前5時15分ごろ、就寝中だった女性の呼吸が荒いことに気付いた看守勤務員が119番通報。救急車で病院に搬送されたが、同7時5分に死亡が確認された。司法解剖し死因を調べる。同署は「対応に問題はなかった」としている。
茨城新聞社",[],[]
梅花ほころぶ　水戸・偕楽園　茨城（茨城新聞クロスアイ）,https://news.yahoo.co.jp/articles/ed7b8e2b6d6ec3f39f3bbf27f80968ca34520818,https://newsatcl-pctr.c.yimg.jp/t/amd-img/20250112-00000007-ibaraki-000-2-view.jpg?exp=10800,2025-01-12T11:00:00+09:00,2025-01-12T11:11:02+09:00,茨城新聞クロスアイ,ibaraki,茨城新聞クロスアイ,304,"咲き始めた偕楽園の梅=11日午前、水戸市常磐町
日本三名園の一つ「偕楽園」(茨城県水戸市常磐町)で梅の花が咲き始めた。澄んだ青空の下、白くかれんな花がほころび、一足早く春の息吹を伝えている。

園内に約100種3000本の梅が並ぶ。偕楽園公園センターによると、現在咲いているのは早咲き種の虎の尾、チャボ冬至、中咲き種の月宮殿。例年よりやや遅めの開花状況だという。2月上旬から順次見頃を迎える見通しで、同11日から「水戸の梅まつり」が開幕する。

家族6人で訪れた同市新原、小学6年、山口柚香さん(12)は「咲いている梅を見つけて歩くのが楽しかった。寒い中に頑張って咲いている梅はすごい」と話した。
茨城新聞社",[],[]
鹿島沖転覆　大津漁協、自主捜索を継続　不明3人、情報なく　茨城（茨城新聞クロスアイ）,https://news.yahoo.co.jp/articles/68acc6da04ed8272077ed0397e0b4e9de5705b25,https://newsatcl-pctr.c.yimg.jp/t/amd-img/default.jpg?exp=10800,2025-01-12T10:00:00+09:00,2025-01-12T10:10:01+09:00,茨城新聞クロスアイ,ibaraki,茨城新聞クロスアイ,724,"茨城県の鹿島港沖合でイワシ漁をしていた大津漁協(同県北茨城市)の漁船「第八大浜丸」が転覆し、2人が死亡、3人が行方不明となった事故を巡り、同漁協の幹部は11日、茨城海保の集中捜索が終了した後も漁業者と協力し、自主的な捜索を継続していく考えを示した。11日午後4時現在、行方不明者の発見には至っていない。

鹿島海上保安署は巡視船などを出動させた集中的な捜索を終了し、11日から通常パトロールに切り替え、事故現場付近の巡回、捜索を行った。付近を航行する船からの情報提供はなかった。

捜索作業中に不具合が生じた巡視船「いず」の遠隔操作型無人潜水機(ROV)について、修理や再使用のめどは立っていない。現場付近の海底で確認された沈没船とみられる影の特定についても、船の引き上げも含め未定という。

一方、民間船は荒天のため、捜索を中止した。同漁協の坂本善則専務理事によると、他の船団は順次漁を再開するとともに、夜間操業を終えた後、捜索に当たるという。坂本専務理事は「仲間を思う気持ちはありがたい。(行方不明者が)早く戻ってきてほしい」と捜索継続の考えを示しつつ、「二次被害は防ぎたい」と述べ、天候などを考慮した上で対応していく姿勢を示した。

今後の遺族や行方不明者の家族への対応については、「会社が中心」としながらも、「相談があれば、乗っていく。漁協として、できることは全面的に協力していく」と強調した。船を所有する会社が説明会や集会を開催する際には漁協の会議室などを提供する。

第八大浜丸と船団を組んでいた探索船と運搬船は12日午前8時ごろ、千葉県の銚子港を出港し、大津港に帰る予定。大浜丸が転覆した海域を捜索しながら帰港するという。
茨城新聞社",[],[]
《広角レンズ》水道水全国調査　PFAS検査、茨城県4割　「簡易」未実施目立つ（茨城新聞クロスアイ）,https://news.yahoo.co.jp/articles/f8e929173a7ae51373081812f11d0ca9696a92ae,https://newsatcl-pctr.c.yimg.jp/t/amd-img/20250112-00000005-ibaraki-000-2-view.jpg?exp=10800,2025-01-12T09:00:00+09:00,2025-01-12T09:09:01+09:00,茨城新聞クロスアイ,ibaraki,茨城新聞クロスアイ,1286,"道角水道組合のＰＦＯＳ・ＰＦＯＡ水質検査結果書＝つくば市上郷(画像の一部を加工しています)
発がん性が指摘される有機フッ素化合物(PFAS)を巡り、政府が実施した水道水の全国調査で、茨城県内377水道事業のうち、検査を実施していたのは約4割に当たる151事業にとどまった。上水道は全て実施していた一方、給水人口が5000人以下の簡易水道などで未検査が目立つ。環境省は2026年4月からPFASを水道法上の「水質基準」の対象として定期検査を義務付ける方針で、県内でも対応を迫られそうだ。

つくば市上郷の簡易水道組合「道角水道組合」は昨年7月ごろ、PFASの代表物質「PFOS」と「PFOA」の水質検査を初めて実施した。結果は、測定できる値より低い定量下限値未満。「検査して良かった」。広瀬忠夫組合長(69)は胸をなで下ろす。

同組合は約60戸が加入する。保健所から全国調査(同5月下旬～9月下旬)の案内があり、不安を払拭(ふっしょく)するためにも検査を受けることにしたという。検査費用は原則事業者の負担。市の補助金を活用し、費用の一部に充てたという。広瀬組合長は「汚染されていたらと心配したが、安心した」と話す。

全国調査の対象となったのは、給水人口が5千人超の「上水道」をはじめ、水道事業者に浄水を供給する「水道用水供給」、社宅や療養所など特定の居住者・利用者らに給水する「専用水道」、101～5000人の「簡易水道」。2020～24年度の検査結果や検査状況を調べた。

国は暫定目標値として1リットル当たり50ナノグラム(ナノは10億分の1)とする。県内では筑西市内とつくば市内の専用水道の2事業で目標値を上回った。いずれも原因は不明で、健康被害は確認されていない。

検査状況については全ての上水道(42事業)と水道用水供給(3事業)、公営の簡易水道(8事業)で実施されていた一方、102事業ある非公営の簡易水道は2事業のみ、222事業ある専用水道は101事業にとどまった。

県水政課によると、非公営の簡易水道は住民自治組織が大半。主な未検査の理由に「検査費用が負担になる」(76事業)「水道法上の測定義務がない」(16事業)などが挙がった。

環境省は昨年12月、PFASを法的な義務付けがない暫定目標値から定期的な水質基準に格上げする方針を固めた。現在は、国の定めた基準値を超えても水質改善は努力義務にとどまるが、26年4月からは義務化される見通し。水道事業者は今後、対応を迫られる。

環境省などによると、検査は原則事業者の自己負担となる。水道法上の「水質基準」の対象に引き上げとなれば、簡易水道で原則3カ月に1回の検査が義務付けられる見通し。検査結果からその後検出される可能性が低い場合は、回数を減らすなどの負担軽減策も盛り込まれる見込みだ。

県の統計資料によると、22年度の給水人口269万6000人のうち、非公営簡易水道は1万8000人、専用水道は5000人。同課担当者は未検査の水道事業者らに対し「検査を呼びかけていく」としている。
茨城新聞社",[],[]
筑波山地域ジオパーク改善　課題見直し、再認定へ審査　茨城（茨城新聞クロスアイ）,https://news.yahoo.co.jp/articles/3ab30c19a10b050af753cd3608a8ee804eeea2cb,https://newsatcl-pctr.c.yimg.jp/t/amd-img/20250112-00000004-ibaraki-000-2-view.jpg?exp=10800,2025-01-12T08:00:00+09:00,2025-01-12T08:08:01+09:00,茨城新聞クロスアイ,ibaraki,茨城新聞クロスアイ,1696,"再認定審査のため筑波山地域ジオパークを現地調査する日本ジオパーク委員会の調査員2人(中央)=昨年11月28日、つくば市平沢
地質遺産の保全、活用に取り組む「ジオパーク」に認定されている、茨城県の「筑波山地域ジオパーク」再認定審査が27日に行われる。活動継続のために必要な手続きで、認定組織の日本ジオパーク委員会(JGC)が4年に1度審査する。関連6市でつくる推進協議会は再認定へ向けてこの4年間、課題の改善や活動の充実に努めてきた。

▽基準

同日は国内10地域の再認定審査が行われる。審査をクリアすれば再認定となり、4年前の認定時に指摘された課題の解決に対応していないと、2年間の条件付き再認定とされる。

筑波山ジオは同県内のつくば、石岡、笠間、桜川、土浦、かすみがうらの6市にまたがるエリアで構成。2016年9月に日本ジオパークに認定され、4年前の再認定の時、運営体制の在り方や部会員間の相互連携など課題8項目を指摘された。

この中で早急な対策を求められたのが、ジオサイト(地質資源場所)の見直しだった。これまでは「筑波山山頂」など地域ごとに26カ所を設定していたが、ユネスコ(国連教育科学文化機関)世界ジオパークの審査基準との整合性を考慮した見直しが必要となり、推進協で再検討に着手。

その結果、ジオサイトは名称を地質サイトと改めて22カ所を再選定。同時に、自然遺産8件、有形文化遺産32件、無形文化遺産8件、ビューポイント12カ所を選び、24年8月の総会で設定した。

事務局を担うつくば市ジオパーク室の伊藤祐二室長は「これまでのジオサイトは具体的な位置が不明瞭だったが、再選定では『筑波山山頂の斑れい岩』というように地点を明示し、保全対象を分かりやすくした」と解説する。

▽天然石

24年11月下旬にはJGCによる現地調査があり、調査員2人がつくば市や桜川市の見どころを視察し、サイトの見直し状況についてもヒアリングした。

事務局側も再認定へ向け、筑波山ジオが学べる「つくばジオミュージアム」の開設など、この4年間の成果を報告。筑波山塊の花崗(かこう)岩が24年7月、国際地質科学連合からヘリテージストーン(天然石材遺産)に認定されたことも大きな実績として紹介した。

ヘリテージストーンは国際的価値が高く、人類との関わりが古い天然石を認定する世界的なプログラム。筑波山塊の花崗岩は産地にちなんで真壁石(桜川市)、稲田石(笠間市)と呼ばれ、石材は国宝の迎賓館赤坂離宮や日本橋などの重要文化財などに使われている。東アジア地域からヘリテージストーンに認定されるのは初めてのことだ。

認定の申請を担当した事務局の杉原薫専門員は「良質な石材が国際的に認められ、価値を高めることができた。今後はジオパークの理念である持続可能という観点から、資源の利用について関係者と話し合っていきたい」と新たな連携強化に期待感を示す。

▽連携

8項目のうち、概ね2年以内に解決すべき課題の一つとして示された「学校教育との連携」も進んだ。

推進協で専門員を1人雇用し、教育プログラムを21年度から開発。構成自治体の教育委員会と連携し、小中高校での出前授業や現地学習会を開いてきた。実施件数は21年度13件、22年度38件、23年度40件と年々増え、ジオパークの普及啓発につなげている。

推進協ではその他の課題である「ジオツアーの定期開催」など、積み残しについても今後、着実に前進させていく方針だ。伊藤室長は「サイトの見直しに伴い、案内板のリニューアルやパンフレットの更新などにも早急に取り組む。審査結果を踏まえ、引き続き、筑波山地域ジオパークをより良いものにしていきたい」と話した。

★ジオパーク

学術的に貴重な地形・地質を備えた自然を登録し、地域の暮らしや文化、歴史の保全を図るエリア。国内版の「日本ジオパーク」は有識者でつくる日本ジオパーク委員会が認定し、2024年10月時点で47地域ある。そのうち10地域は特に貴重としてユネスコの世界ジオパークに認定されている。
茨城新聞社",[],[]
坂東の交流拠点　着々　農産物販売や自転車休憩　4月開業　茨城（茨城新聞クロスアイ）,https://news.yahoo.co.jp/articles/273c7c65fe7c272497173cdf4b8e36f8debc554a,https://newsatcl-pctr.c.yimg.jp/t/amd-img/20250112-00000003-ibaraki-000-2-view.jpg?exp=10800,2025-01-12T07:00:00+09:00,2025-01-12T07:07:01+09:00,茨城新聞クロスアイ,ibaraki,茨城新聞クロスアイ,766,"4月オープンに向け整備が進む産業経済交流施設=坂東市長須
茨城県坂東市の新たな交流拠点「市産業経済交流施設」(愛称・坂東将門の里、同市長須)の整備が、4月のオープンに向け順調に進んでいる。下総利根大橋近くの料金所跡地を利用し、農産物の販売をメインにサイクリストの休憩施設などが造られる。利根川を挟んで千葉県と接する県境の〝玄関口〟ともいえる立地を生かし、全国に誇る市の農産物や魅力を発信していく。

施設は①農産物販売所②観光情報ブース③シャワー室を備えたサイクルステーション④マルシェ広場⑤駐車場⑥芝生広場-からなる。敷地面積約4540平方メートル。愛称は、平将門ゆかりの同市を表し「坂東将門の里」とした。

同大橋の料金所管理事務所が2019年末に閉鎖されたのを受け、22年5月に市が県から購入。地域の意向を受け、農業が盛んな同市の農産物を販売する施設を整備することになった。

橋の付近は茨城県の坂東、古河両市をつなぐ利根渡良瀬サイクリングコース、千葉県野田市を周遊する利根川・江戸川・利根運河サイクリングロードの一部となっていることから、サイクリストが休憩できる場所としても活用できるようにした。

施設の運営は、市内の農家や事業者などで構成する管理組合が担う。須賀正雄組合長は「行政の力を借りながら、人が集まる施設を目指したい。組合員が一致団結し、愛される施設にしていきたい」と話す。

市農政課によると、工事は現在、農産物直売所の建屋が建設され、内装や外構などの工事が進んでいる。同課は「坂東市が誇る農産物を販売するほか、サイクリストなどが気軽に利用できる。県内外の多くの人に利用していただきたい」としている。木村敏文市長は「組合、利用者、そして地域にとって、できてよかったと思える施設になれば」と期待した。
茨城新聞社",[],[]
県立中13校で入試　2365人受験　トラブル報告なし　水海道一高付4.45倍　茨城（茨城新聞クロスアイ）,https://news.yahoo.co.jp/articles/8c3c8065dbb7abb187ecd4b38b960b3b96928dd4,https://newsatcl-pctr.c.yimg.jp/t/amd-img/20250112-00000002-ibaraki-000-2-view.jpg?exp=10800,2025-01-12T06:00:00+09:00,2025-01-12T06:06:01+09:00,茨城新聞クロスアイ,ibaraki,茨城新聞クロスアイ,609,"問題用紙の配布を待つ受験生ら=水戸市三の丸の県立水戸一高付属中(画像の一部を加工しています)
茨城県の県立高付属中と県立中等教育学校計13校の入学者選抜検査が11日、各校で実施され、計2365人が受験した。倍率が最も高かったのは県立水海道一高付属中(定員40人)で4.45倍。県教育委員会によると、午後6時現在、各校からトラブルや出題ミスの報告はないという。

各校はこの日、2種類の適性検査と面接を実施した。県立水戸一高付属中(同県水戸市三の丸)では、朝からコートなどを着込んだ受験生が試験会場入り。同校では290人が受験し、午前9時25分ごろから問題用紙が配られ、緊張した様子で開始の合図を待った。

倍率はこのほか、高い順に、竜ケ崎一付(40人)4.35倍▽水戸一付(80人)3.63倍▽並木中等(160人)3.23倍▽日立一付(80人)2.81倍▽土浦一付(同)2.71倍▽下妻一付(40人)2.48倍▽鉾田一付(同)1.88倍▽鹿島付(同)、下館一付(同)1.78倍▽勝田中等(120人)1.74倍▽古河中等(同)1.58倍▽太田一付(40人)1.25倍-だった。

13校の事前辞退は計37人、当日欠席は計13人だった。また、体調不良などを訴えた計31人が別室で選抜検査を受けた。追検査など救済措置の実施はない。

合格発表は23日午前9時から。校内掲示は行わず、インターネット上で確認できる。
茨城新聞社",[],[]
バスケットボールB1　茨城ロボッツ8連敗　佐賀に54-82（茨城新聞クロスアイ）,https://news.yahoo.co.jp/articles/63e7b4f9b48dc33e6b7411bb89753ce6c81a736e,https://newsatcl-pctr.c.yimg.jp/t/amd-img/20250112-00000001-ibaraki-000-2-view.jpg?exp=10800,2025-01-12T05:00:00+09:00,2025-01-12T05:05:01+09:00,茨城新聞クロスアイ,ibaraki,茨城新聞クロスアイ,397,"1
/
2
ロボッツ-佐賀　第1クオーター、シュートを放つロボッツの平尾(右)=アダストリアみとアリーナ
ロボッツ-佐賀　第3クオーター、シュートを放つロボッツの中村(右)=アダストリアみとアリーナ
バスケットボールのりそなBリーグ1部(B1)は11日、アダストリアみとアリーナなどで12試合が行われ、東地区の茨城ロボッツは西地区の佐賀に54-82で敗れ8連敗となった。今季通算成績は7勝22敗、順位は東地区7位。

ロボッツは序盤、中村の得点などでリードを得たが、以降相手の攻守に苦しみ19点差をつけられ折り返した。第3クオーターは10得点と伸び悩んだ。最終クオーターはフランクス、中村を中心に得点したが突き放された。

(アダストリアみとアリーナ、4672人)  
佐賀　10勝19敗　82-54　茨城　7勝22敗  
25-12  
24-18  
13-10  
20-14
茨城新聞社",[],[]
