headline,mainEntityOfPage,image,datePublished,dateModified,author,media_en,media_jp,str_count,body,images,external_links
ラガルド総裁より他の理事、市場が重視するＥＣＢ当局者発言－調査（Bloomberg）,https://news.yahoo.co.jp/articles/2d1b80a963913b92c8c728f7231218396ea4e1a6,https://newsatcl-pctr.c.yimg.jp/t/amd-img/20240715-49642982-bloom_st-000-1-view.jpg?exp=10800,2024-07-15T22:20:42+09:00,2024-07-15T22:20:42+09:00,Bloomberg,bloom_st,Bloomberg,2319,"\n<p>ラガルドＥＣＢ総裁</p>\n（ブルームバーグ）： 欧州中央銀行（ＥＣＢ）政策委員会メンバーの発言から金利動向についてエコノミストが手がかりを探ろうとするとき、最も注目するのはラガルド総裁ではない。\nブルームバーグはエコノミスト25人を対象に、６人から成るＥＣＢ理事会のうち発言を最も参考にするメンバー２人を挙げてもらう調査を実施。ラガルド総裁との回答は40％に過ぎず、市場担当理事のシュナーベル氏、チーフエコノミストのレーン氏の方が注目されていることが明らかになった。\nユーロ圏20カ国の中央銀行総裁の中で、エコノミストが最も耳を傾けるのはフランス中銀のビルロワドガロー総裁、オランダ中銀のクノット総裁だ。クノット氏はラガルド総裁の後を継ぐ次期ＥＣＢ総裁候補との声もある。この２人に、ドイツ連銀のナーゲル総裁が３位で続く。\nＥＣＢ政策委員会メンバーは26人で構成される。見解の幅は広く、それぞれの発言機会も多い。そのような中でＥＣＢの中核に一番近いのは誰なのか把握することは極めて重要で、政策転換期にある現在のような状況では、いっそうその重要性は増す。ＥＣＢはインフレ対策で実施した連続利上げの巻き戻しを開始したばかりで、今後の動向についてほとんど手がかりを与えていない。\n調査結果は、ラガルド総裁の役割が前任者とは異なっていることも浮き彫りにする。\nラガルド氏はフランスの閣僚、国際通貨基金（ＩＭＦ）専務理事を経てＥＣＢ総裁に就任したが、中銀での経験はなかった。自分は政策委員会の報道官だと主張したトリシェ元総裁、政策行動を一方的に決めることも少なくなかったドラギ前総裁と比べ、ラガルド氏は合意を取り持つ議長として振る舞うことが多い。\nダンスケ銀行のチーフストラテジスト、ピエト・クリスティアンセン氏は「ラガルド氏の発言は非常に重要だが、シグナルの変化のような、転換点の示唆はない」と指摘。「ラガルド総裁下では、シュナーベル氏とレーン氏がＥＣＢの金融政策姿勢に強力な分析的論拠を付与する役割を担っている」と述べた。\nラガルド氏のアプローチは、６月の利下げ決定後の記者会見でも表れた。将来の行動時期について詳述することを拒み、「私の優秀な同僚の一部がそれぞれの見解を明らかにするだろうと確信している」と語った。\nこの会見以来、ベルギー中銀のウンシュ総裁、アイルランド中銀のマクルーフ総裁、スロバキア中銀のカジミール総裁が年内のＥＣＢ追加利下げは１回で、それ以上の行動はインフレ率が２％に向けて低下するかにかかっているとの認識を示した。一方でギリシャ中銀のストゥルナラス総裁は２回の追加利下げを望むと表明し、ポルトガル中銀のセンテノ総裁は「数回」と述べた。\nエコノミストが支持するクノット氏とナーゲル氏は、詳細にあまり踏み込んでいない。クノット氏は、年内に１－２回の追加利下げを見込む市場の期待は妥当だと述べるにとどめ、ナーゲル氏はＥＣＢの利下げは自動操縦ではないと強調した。\nデカバンクのエコノミスト、クリスティアン・テートマン氏は「加盟国中銀総裁のうち、自分が真っ先に選ぶのはクノット氏だ」と説明。「クノット氏は明らかにタカ派のグループに属しているが、同氏の見解には十分な合理性があり、議論にオープンだ。数回の追加利下げ後も金融政策はなお景気抑制的だという同氏の評価は、この好例だ」と語った。\nテートマン氏はドイツ連銀の重要性に鑑み、２番目に重視する中銀総裁としてナーゲル氏を挙げ、フランスのビルロワドガロー氏をその次とした。\n中間派に位置づけられるビルロワドガロー氏だが、2015年の就任以来、政策姿勢を慎重に微修正してきている。最近では７月の追加利下げを排除すべきでないと主張、いつにないハト派的な見解で一部のＥＣＢ観測筋を驚かせた。エコノミストや市場ではＥＣＢの７月利下げを見込む声は完全に消えている。\nＥＣＢ理事らは各国中銀総裁に比べ、個人的な姿勢をあまり明かさない傾向がある。レーン氏、シュナーベル氏とも年後半の金利動向を具体的に述べたことはないが、それでも両氏の発言は詳しい分析の対象になる。\nレーン氏は公の場での発言機会を、ユーロ圏経済の健全性に関する説明に当てることが多い。議論の理解が難しくなるような学者的な言い回しを使うことも少なくない。\nレーン氏はインフレが一時的だとの主張を長く続け、批判を浴びた。同氏が監督するＥＣＢの経済予測でも、インフレの規模を過小評価した。\nシュナーベル氏は今後の課題を議論のテーマに選ぶことが多い。ＥＣＢのバランスシートについて考えられる選択肢や新常態（ニューノーマル）での金利管理、気候変動やグリーン化がインフレに及ぼす影響などを徹底的に議論したのはシュナーベル氏が最初だった。\nただ、シュナーベル氏も経済を読み誤ったことがある。政策委員会内で利上げが行き過ぎた可能性があるとの声が浮上し、アナリストや市場が利下げ開始時期を模索し始める中で、シュナーベル氏は昨年12月の利上げを選択肢として残すことにこだわった。\nテートマン氏にとって、レーン氏とシュナーベル氏は「正反対」だ。「従って、２人の見解を照らし合わせることで有意な手がかりが得られる」という。\n原題：Lagarde Is ECB Boss But Schnabel and Lane Are Key for Economists（抜粋）\n(c)2024 Bloomberg L.P.\nMark Schroers, Jana Randow, Harumi Ichikura",['https://newsatcl-pctr.c.yimg.jp/t/amd-img/20240715-49642982-bloom_st-000-1-view.jpg?exp=10800'],['https://news.yahoo.co.jp/articles/2d1b80a963913b92c8c728f7231218396ea4e1a6/images/000']
中国の住宅価格、６月も下落－最近の不動産支援策は改善に寄与せず（Bloomberg）,https://news.yahoo.co.jp/articles/d621c47899b1889013cfcef5d2db9cccc0d90bd2,https://newsatcl-pctr.c.yimg.jp/t/amd-img/default.jpg?exp=10800,2024-07-15T11:24:00+09:00,2024-07-15T11:24:00+09:00,Bloomberg,bloom_st,Bloomberg,600,\n（ブルームバーグ）： 中国の住宅価格は６月も下落し、デベロッパーや経済に打撃を与えている不動産不況を食い止めることが政策担当者にとっての課題であることが浮き彫りになった。\n国家統計局が15日発表したデータによると、70都市の新築住宅価格（政府支援住宅を除く）は、６月に前月比0.67％下落。５月は0.71％下げ、2014年10月以来の大幅な落ち込みとなっていた。６月の中古住宅価格は前月比0.85％下落。前月は１％下落していた。\nこうした数字は、５月に発表された当局の救済策が不動産市場のセンチメント改善にほとんど寄与していないことを示す新たな証拠だ。しかし、15日開幕する中国共産党の重要会議、第20期中央委員会第３回総会（３中総会）で、より積極的な対策が打ち出されるとはほとんど予想されていない。デベロッパーや住宅所有者が住宅を売却するために大幅な値引きに頼る中、価格圧力は続く公算が大きい。\nブルームバーグ・インテリジェンスのアナリスト、クリスティ・フン氏とモニカ・シー氏は最近のリポートで、「新築・中古住宅の過剰在庫が、さらなる価格下落への圧力となっている」と分析した。\n原題：China Home Prices Fall Sharply Despite Latest Rescue Plan（抜粋）\n(c)2024 Bloomberg L.P.\nBloomberg News,[],[]
中国の４～６月ＧＤＰ、予想下回る4.7％増－５四半期ぶり低成長（Bloomberg）,https://news.yahoo.co.jp/articles/89017e93d1f014389a7bd9f3a05bddfda2e0ba21,https://newsatcl-pctr.c.yimg.jp/t/amd-img/20240715-09738638-bloom_st-000-3-view.jpg?exp=10800,2024-07-15T11:15:38+09:00,2024-07-15T12:22:12+09:00,Bloomberg,bloom_st,Bloomberg,906,\nBloomberg\n（ブルームバーグ）： 中国の４－６月（第２四半期）経済成長率が予想を下回った。小売売上高が鈍化し、５四半期ぶりの低成長となった。中国共産党は15日から第20期中央委員会第３回総会（３中総会）を開催する。\n国家統計局がこの日発表した４－６月の国内総生産（ＧＤＰ）は前年同期比4.7％増。ブルームバーグが実施したエコノミスト調査での予想中央値は5.1％増だった。１－６月（上期）の成長率は５％と、政府の年間目標である５％前後に沿った水準となった。\n新型コロナウイルスのパンデミック（世界的大流行）期によるゆがみのない四半期指標となった今回、データに反映された減速が成長刺激の取り組みを強化するよう中国政府に求める声を強める可能性がある。18日まで４日間開催される３中総会では今後数年間の主要な経済・政治方針が決められる。\n国家統計局は声明で、中国は「発展における困難や課題、不確実性を十分に見極め」、同時に今後の経済への信頼性を高め、健全な成長を促進するためにマクロ経済政策を適切に実施する必要があると表明した。\n小売売上高の伸びは2022年以来最も鈍いペースとなり、自家用車や家電製品の買い替えを助成・奨励する政府のプログラムにもかかわらず、消費者が支出に消極的であることが浮き彫りとなった。\nオーストラリア・ニュージーランド銀行（ＡＮＺ）の大中華圏担当チーフエコノミスト、楊宇霆氏は「きょう発表された全ての月次統計で、注目すべきは小売売上高だ」と述べ、「家計消費が依然として非常に弱い。買い替えブログラムは支出を押し上げることができなかった。雇用主が給与を削減し、若者の失業率が高く、家計は今後も慎重を期すだろう」と予想した。\n原題：China’s Growth Slows to 4.7% as Weak Retail Sales Drag Economy、China Jan.-June Property Development Investment Falls 10.1% Y/y（抜粋）\n(c)2024 Bloomberg L.P.\nBloomberg News,['https://newsatcl-pctr.c.yimg.jp/t/amd-img/20240715-09738638-bloom_st-000-3-view.jpg?exp=10800'],['https://news.yahoo.co.jp/articles/89017e93d1f014389a7bd9f3a05bddfda2e0ba21/images/000']
中国人民銀、ＭＬＦ通じ資金引き揚げ－１年物金利は2.5％に据え置き（Bloomberg）,https://news.yahoo.co.jp/articles/7d00070fbde531780c5d2ce59399ba8656b5f4e4,https://newsatcl-pctr.c.yimg.jp/t/amd-img/20240715-07792951-bloom_st-000-1-view.jpg?exp=10800,2024-07-15T10:43:12+09:00,2024-07-15T10:43:12+09:00,Bloomberg,bloom_st,Bloomberg,394,\nBloomberg\n（ブルームバーグ）： 中国人民銀行（中央銀行）は15日、中期貸出制度（ＭＬＦ）通じ差し引き30億元（約653億円）を引き揚げた。１年物のＭＬＦ金利は2.5％に据え置いた。\n人民元の値下がり圧力が強まるとともに、金融緩和への警戒感が高まる中で、中国は５カ月連続で銀行システムから資金を吸収した。\nブルームバーグが調査したアナリスト９人全員が、金利据え置きを予想していた。１年物ＭＬＦ金利について、エコノミストらは段階的に廃止されるとおおむね想定している。\n原題：China Withdraws Cash From Banking System Amid Pressure on Yuan （抜粋）\n--取材協力：Lucille Liu、Neha D'Silva、Yujing Liu.\n(c)2024 Bloomberg L.P.\nTania Chen,['https://newsatcl-pctr.c.yimg.jp/t/amd-img/20240715-07792951-bloom_st-000-1-view.jpg?exp=10800'],['https://news.yahoo.co.jp/articles/7d00070fbde531780c5d2ce59399ba8656b5f4e4/images/000']
ドル上昇、米長期債は値下がり－「トランプ2.0」意識した取引（Bloomberg）,https://news.yahoo.co.jp/articles/8e638ce4171c60d8b24bba6cbea98c68175ab69b,https://newsatcl-pctr.c.yimg.jp/t/amd-img/20240715-17982616-bloom_st-000-2-view.jpg?exp=10800,2024-07-15T13:33:02+09:00,2024-07-15T17:53:16+09:00,Bloomberg,bloom_st,Bloomberg,1305,\nBloomberg\n（ブルームバーグ）： 15日の取引でドルと米国株先物が上昇。米長期債は値下がりしている。選挙集会で銃撃を受けたトランプ前米大統領が11月の大統領選に勝利するとの見方をトレーダーは強めている。\nドルはＧ10通貨全てに対し上昇。メキシコ・ペソが売られ、暗号資産（仮想通貨）ビットコインは約２週間ぶりの高値を付けた。こうした動きは、新たなトランプ政権が拡張的な財政政策や関税引き上げを実施するとの見通しを反映している。\n米国債は長期債利回りの上昇が大きく、２年債と10年債のスプレッドは１月以来の大きさに拡大。30年債利回りは１月31日以降で初めて２年債を上回った。\nアジア株は下落。香港に上場している中国本土企業から成るハンセン中国企業株（Ｈ株）指数は下げ幅を拡大した。中国が15日発表した４－６月（第２四半期）の国内総生産（ＧＤＰ）統計は経済成長の鈍化を示した。\n中国の４～６月ＧＤＰ、予想下回る4.7％増－５四半期ぶり低成長\nＳ＆Ｐ500種株価指数先物とナスダック100先物は、米国株が値上がりして始まることを示唆している。\nサクソ・キャピタル・マーケッツのマーケットストラテジスト、チャルー・チャナナ氏は「トランプ2.0の可能性が高まったことを市場は織り込み、ドルに追い風が吹く一方、メキシコ・ペソと中国人民元は下落する可能性がある。『トランプトレード』が再び注目されるかもしれない」と述べた。\nまた、トールバッケン・キャピタル・アドバイザーズのマイケル・パーブス最高経営責任者（ＣＥＯ）は「トランプ氏の大統領選勝利の見通しがいっそう強まるなら、米国債の利回り曲線はベアスティープ化するだろう」と語った。「株式に関しては、全体的な方向性に変化があるとは思わないが、法人税減税や規制緩和で恩恵を受ける銘柄もあるだろう」と指摘した。\n再度のトランプ政権がいわゆるトランプトレードに連動するエネルギー企業株などの資産をどのように押し上げるか、投資家は見極めている。\n三菱ＵＦＪ銀行シンガポールのストラテジスト、ロイド・チャン氏は「一般的にリスクオフ環境からドルが恩恵を受けると想定される」と指摘し、神経質な相場展開でドルが１日を通じ上昇を続ける可能性があると予想した。投資家は引き続き円買い介入リスクに神経をとがらせている。\n世界の金融市場でトランプトレード強まる可能性、暗殺未遂事件受け\n原題：Dollar Gains and Treasuries Slump on Trump Bets: Markets Wrap、US 30-Year Yield Rises Above Two-Year for First Time Since Jan.、Dollar Outperforms Peers on US Political Risk: Inside G-10（抜粋）\n--取材協力：Ruth Carson、David Finnerty、John Cheng、Lin Zhu.\n(c)2024 Bloomberg L.P.\nCatherine Bosley,['https://newsatcl-pctr.c.yimg.jp/t/amd-img/20240715-17982616-bloom_st-000-2-view.jpg?exp=10800'],['https://news.yahoo.co.jp/articles/8e638ce4171c60d8b24bba6cbea98c68175ab69b/images/000']
ブラックロック、トランプ氏銃撃事件の容疑者を過去の広告で起用（Bloomberg）,https://news.yahoo.co.jp/articles/04fa6dd81c9c0c580822dcee3c4ed6030c0d935f,https://newsatcl-pctr.c.yimg.jp/t/amd-img/20240715-06067111-bloom_st-000-1-view.jpg?exp=10800,2024-07-15T10:14:27+09:00,2024-07-15T10:14:27+09:00,Bloomberg,bloom_st,Bloomberg,553,\nPhotographer: Anna Moneymaker/Getty Images North America\n（ブルームバーグ）： 米ペンシルベニア州での選挙集会でトランプ前大統領を銃撃し負傷させたトーマス・マシュー・クルックス容疑者（20）が、世界最大の資産運用会社ブラックロックの広告に短期間掲載されていた。同社が14日発表した。\n発表資料によれば、クルックス容疑者は2022年の同社広告の背景に登場した生徒らの一人で、無給で参加した。この広告は、同容疑者が22年に卒業したベテルパーク高校で撮影され、教師が主役だったという。\nブラックロックは広告の内容については触れなかったが、映像は当局に提供され、放送から削除されると説明。また、集会参加者１人が死亡、２人が重傷を負った13日の銃撃事件を非難した。\nブラックロックの一部インデックスファンドが銃器メーカーの株を保有していることから、同社は過去に米国での銃乱射事件を受けて批判を浴びたことがある。\n関連記事\n原題：BlackRock Says Gunman From Trump Rally Appeared in Firm’s Ad（抜粋）\n(c)2024 Bloomberg L.P.\nVictoria Cavaliere,['https://newsatcl-pctr.c.yimg.jp/t/amd-img/20240715-06067111-bloom_st-000-1-view.jpg?exp=10800'],['https://news.yahoo.co.jp/articles/04fa6dd81c9c0c580822dcee3c4ed6030c0d935f/images/000']
原油じり高、トランプ氏襲撃で地政学的リスク注視－ビットコイン上昇（Bloomberg）,https://news.yahoo.co.jp/articles/d59b95b1da89bbc93fc7cb769e4f7c3c38b84e05,https://newsatcl-pctr.c.yimg.jp/t/amd-img/20240715-00859518-bloom_st-000-1-view.jpg?exp=10800,2024-07-15T08:47:39+09:00,2024-07-15T08:47:39+09:00,Bloomberg,bloom_st,Bloomberg,481,\nBloomberg\n（ブルームバーグ）： 原油価格はじり高。トランプ前米大統領が選挙集会で撃たれたことで地政学的リスクが再び注目されている。15日には中国共産党の第20期中央委員会第３回総会（３中総会）も開幕する。\n北海ブレントは１バレル＝85ドルを超え、ニューヨーク商業取引所（ＮＹＭＥＸ）のウェスト・テキサス・インターミディエート（ＷＴＩ）は82ドル付近。トランプ氏が襲撃されたことで、米大統領選に新たな不透明要因が加わった。ドルは小幅に上昇。\n暗号資産（仮想通貨）ビットコインは６万1000ドルを突破した。15日の取引で一時2.2％高となり、シンガポール時間午前７時３分時点で６万850ドル。\n原題：Oil Edges Higher as Trump Shooting Brings Geopolitics Into Focus、Bitcoin Climbs to More Than One-Week High After Attack on Trump（抜粋）\n(c)2024 Bloomberg L.P.\nYongchang Chin,['https://newsatcl-pctr.c.yimg.jp/t/amd-img/20240715-00859518-bloom_st-000-1-view.jpg?exp=10800'],['https://news.yahoo.co.jp/articles/d59b95b1da89bbc93fc7cb769e4f7c3c38b84e05/images/000']
ドル、主要通貨の大半に対し小幅高－トランプ氏銃撃後のシドニー市場（Bloomberg）,https://news.yahoo.co.jp/articles/5a08ae63bdf737bc23c165024ead342c75510979,https://newsatcl-pctr.c.yimg.jp/t/amd-img/20240715-86826132-bloom_st-000-1-view.jpg?exp=10800,2024-07-15T04:53:46+09:00,2024-07-15T04:53:46+09:00,Bloomberg,bloom_st,Bloomberg,355,\nBloomberg\n（ブルームバーグ）： シドニー時間15日早朝の外国為替市場で、ドルは主要10通貨の大半に対して小幅に上昇。週末13日にトランプ前米大統領に対する銃撃事件が発生。今週は米共和党全国大会のほか、欧州中央銀行（ＥＣＢ）金融政策や英消費者物価指数（ＣＰＩ）の発表などが予定されている。\nドルは円に対しては0.1％高の１ドル＝157円94銭。一時157円99銭まで買われた。\nユーロは対ドルで0.2％安。ポンドとオーストラリア・ドルも対ドルで0.2％下落している。\n原題：Dollar Edges Higher vs. Most Peers in Trump Shooting Aftermath（抜粋）\n(c)2024 Bloomberg L.P.\nMichael G Wilson,['https://newsatcl-pctr.c.yimg.jp/t/amd-img/20240715-86826132-bloom_st-000-1-view.jpg?exp=10800'],['https://news.yahoo.co.jp/articles/5a08ae63bdf737bc23c165024ead342c75510979/images/000']
グーグル親会社、サイバー防御のＷｉｚを3.6兆円で買収協議－関係者（Bloomberg）,https://news.yahoo.co.jp/articles/cf2ea5465a2c86f5ba8ba0777e7c97ae2625e69a,https://newsatcl-pctr.c.yimg.jp/t/amd-img/20240715-77861848-bloom_st-000-2-view.jpg?exp=10800,2024-07-15T02:24:21+09:00,2024-07-15T07:19:47+09:00,Bloomberg,bloom_st,Bloomberg,492,\nBloomberg\n（ブルームバーグ）： 米グーグルの親会社アルファベットは、サイバーセキュリティーの新興企業Ｗｉｚの買収に向けて交渉を進めていると、事情に詳しい関係者１人が明らかにした。\n非公開情報だとして関係者が匿名で語ったところでは、買収額は総額230億ドル（約３兆6300億円）となる可能性がある。実現すれば、アルファベットにとって過去最大規模の買収となる。\n合意には至っておらず、交渉がまとまらない可能性もなおあると関係者は語った。\nアルファベットの担当者にコメントを求めたが、すぐには返答がなかった。Ｗｉｚの広報担当はコメントを控えた。両社の協議については、米紙ウォールストリート・ジャーナル（ＷＳＪ）が先に報じていた。\n原題：Alphabet Is Said in Talks to Buy Wiz in $23 Billion Cyber Deal、Google Nears $23 Billion Deal for Cybersecurity Firm Wiz: WSJ（抜粋）\n(c)2024 Bloomberg L.P.\nShiyin Chen,['https://newsatcl-pctr.c.yimg.jp/t/amd-img/20240715-77861848-bloom_st-000-2-view.jpg?exp=10800'],['https://news.yahoo.co.jp/articles/cf2ea5465a2c86f5ba8ba0777e7c97ae2625e69a/images/000']
ＦＢＩ、トランプ氏銃撃の容疑者は単独犯の可能性－現在は脅威ない（Bloomberg）,https://news.yahoo.co.jp/articles/7189cc5e500d7ca45e0631c2c58de06f6a364e4e,https://newsatcl-pctr.c.yimg.jp/t/amd-img/default.jpg?exp=10800,2024-07-15T06:06:12+09:00,2024-07-15T06:06:12+09:00,Bloomberg,bloom_st,Bloomberg,642,\n（ブルームバーグ）： 週末の選挙集会でトランプ前米大統領を銃撃した容疑者は単独犯のもようで、公共の安全に対する脅威は現在ないと、米連邦捜査局（ＦＢＩ）当局者が述べた。\nＦＢＩのレイ長官は14日午後に記者団に対し、捜査に全力を挙げていると述べた。当局者らは、捜査に引き続き鋭意取り組むと発言。ウィスコンシン州ミルウォーキーで今週開催される共和党全国大会について、大会に関連した潜在的脅威を回避することに集中すると話した。\n捜査を指揮するＦＢＩピッツバーグ事務所のケビン・ロジェク氏は、容疑者と特定したトーマス・マシュー・クルックス容疑者（20）が「AR－556」というライフル銃を犯行に使ったようだと説明。銃は同容疑者の父親が合法的に購入したものとみられると述べた。クルックス容疑者がその銃をどのようにして自らが使用できる状態に置いたかは、まだ明らかではないとした。\nロジェク氏はまた、ＦＢＩが容疑者の電話を入手したが、内部に蓄えられた情報へのアクセスはまだできていないと説明。犯行の動機解明のため、このアクセスが最優先事項だと話した。\nＦＢＩ幹部のロバート・ウェルズ氏によると、ＦＢＩは暗殺未遂としてだけでなく、国内でのテロ事件の可能性も含めて今回の件を捜査している。\n原題：FBI Says Trump Rally Shooter Appears to Have Acted Alone（抜粋）\n(c)2024 Bloomberg L.P.\nZoe Tillman,[],[]
