headline,mainEntityOfPage,image,datePublished,dateModified,author,media_en,media_jp,str_count,body,images,external_links
トランプ・メディア株急伸、暗殺未遂事件受けトランプトレードに勢い（Bloomberg）,https://news.yahoo.co.jp/articles/54c4f8cfe4bc19f6457bacf84a85a80977c6689c,https://newsatcl-pctr.c.yimg.jp/t/amd-img/20240715-53456043-bloom_st-000-1-view.jpg?exp=10800,2024-07-15T23:24:16+09:00,2024-07-15T23:24:16+09:00,Bloomberg,bloom_st,Bloomberg,1002,"\nTrump Media owns a majority stake in the operator of the social media platform Truth Social.\n（ブルームバーグ）： 15日午前の米株式市場で、トランプ前米大統領のメディア企業の株価が急伸。13日に起きたトランプ氏の暗殺未遂事件を受けて、いわゆるトランプトレードの勢いが市場全体で強まっている。\nトランプ・メディア・アンド・テクノロジー・グループは、取引開始直後に一時50％上昇し、６月10日以来の高値を付けた。このほか民間刑務所の運営会社や暗号資産（仮想通貨）の採掘会社など、共和党の勝利により恩恵を受ける銘柄も上昇している。\nタトル・キャピタル・マネジメントのマシュー・タトル最高経営責任者（ＣＥＯ）は「今はトランプトレードということに尽きる」と指摘。投資家はトランプ・メディア株を「直接的なトランプトレード」として利用する傾向があるため、同銘柄が反応するのは予想されることだと付け加えた。\nプレディクトイットのデータによれば、暗殺未遂事件を受けトランプ氏が大統領選で勝利する確率が上昇した。\n保守系の動画プラットフォームを運営するランブルは一時15％高となった。\n市場では、トランプ氏勝利の可能性が高まったとの見方から、同氏の返り咲きにより恩恵を受けるとみられるセクターに買いが集まっている。銃器メーカーのスミス＆ウェッソン・ブランズは13％高、スターム・ルガーは10％近く上昇。民間刑務所の運営を手掛けるＧＥＯグループとコアシビックも高い。\nまたビットコインの上昇を手掛かりに、コインベース・グローバルやマラソン・デジタル・ホールディングスといった仮想通貨関連銘柄も値上がり。Ｓ＆Ｐ500種株価指数ではテスラが高い。イーロン・マスク最高経営責任者（ＣＥＯ）は、銃撃事件後にトランプ氏への支持を表明した。\n原題：Trump Media Shares Soar as Attack Boosts Reelection Bid (2)（抜粋）\n--取材協力：Joel Leon、Esha Dey、Bailey Lipschultz、Vrishti Beniwal、Angel Adegbesan.\n(c)2024 Bloomberg L.P.\nBre Bradham, Ivy Chok",['https://newsatcl-pctr.c.yimg.jp/t/amd-img/20240715-53456043-bloom_st-000-1-view.jpg?exp=10800'],['https://news.yahoo.co.jp/articles/54c4f8cfe4bc19f6457bacf84a85a80977c6689c/images/000']
米メーシーズ株急落、投資会社による買収交渉打ち切り－自力再建へ（Bloomberg）,https://news.yahoo.co.jp/articles/70c3a1137b95d83196fce3aa49af3f564a736234,https://newsatcl-pctr.c.yimg.jp/t/amd-img/default.jpg?exp=10800,2024-07-15T23:57:52+09:00,2024-07-15T23:57:52+09:00,Bloomberg,bloom_st,Bloomberg,488,"\n（ブルームバーグ）： 米百貨店チェーン運営メーシーズの株価が15日に急落。同社は投資会社２社との間で進めていた身売り交渉を打ち切り、自力での再建計画を実行すると発表した。\n同社は発表文で、アークハウス・マネジメントとブリゲード・キャピタル・マネジメントからの買収提案は資金調達面で「実行可能な提案」ではなかったと説明。メーシーズ株は一時約16％下落した。\nアークハウスとブリゲードは買収提示額を３月に１株当たり24ドルに、６月には24.80ドルに引き上げていた。\n２月にメイシーズの最高経営責任者（ＣＥＯ）に就任したトニー・スプリング氏は、自らの手で再建計画を実行する意向を明らかにした。同社はインフレ疲れした消費者の実店舗離れに直面している。\nアークハウスの担当者にコメントを求めたが返答は得られていない。\n原題：Macy’s Sinks Most in Four Years After Ending Buyout Talks (2)（抜粋）\n(c)2024 Bloomberg L.P.\nMax Zimmerman, Jeannette Neumann",[],[]
マヨルカス米国土安全保障長官、警備「失敗」認める－トランプ氏銃撃（Bloomberg）,https://news.yahoo.co.jp/articles/820bed30d8ff5da790539a676e1c6dd6d1ba92f7,https://newsatcl-pctr.c.yimg.jp/t/amd-img/20240715-50866153-bloom_st-000-1-view.jpg?exp=10800,2024-07-15T22:41:06+09:00,2024-07-15T22:41:06+09:00,Bloomberg,bloom_st,Bloomberg,396,\nBloomberg\n（ブルームバーグ）： マヨルカス米国土安全保障長官は15日、トランプ前大統領の暗殺未遂といった事件は起こり得ない事象だとニュース専門局ＣＮＮで発言。「起こり得ない事件が起きたということは、失敗を意味する」と述べた。\n同長官は選挙運動のイベントについて、大統領警護隊（シークレットサービス）は地元の協力機関と共に警備にあたっていると付け加えた。\nシークレットサービスの指導力には全幅の信頼を寄せているとマヨルカス長官。「事件がなぜ、どのように起きたのかを独立した調査を通して分析し、二度と起きないようにするための勧告と調査結果を出すつもりだ」と述べた。\n原題：Mayorkas Acknowledges Trump Shooting Marked Security Failure（抜粋）\n(c)2024 Bloomberg L.P.\nMagan Crane,['https://newsatcl-pctr.c.yimg.jp/t/amd-img/20240715-50866153-bloom_st-000-1-view.jpg?exp=10800'],['https://news.yahoo.co.jp/articles/820bed30d8ff5da790539a676e1c6dd6d1ba92f7/images/000']
ＥＣＢ、レバレッジドファイナンス調査の結果通知を先送りへ－関係者（Bloomberg）,https://news.yahoo.co.jp/articles/79683decff1a91ac3ecacfcaf3dafd058eca83a6,https://newsatcl-pctr.c.yimg.jp/t/amd-img/default.jpg?exp=10800,2024-07-15T22:35:01+09:00,2024-07-15T22:35:01+09:00,Bloomberg,bloom_st,Bloomberg,743,"\n（ブルームバーグ）： 欧州中央銀行（ＥＣＢ）は高リスク融資に対する大規模な調査の結果通知を遅らせる見通しだ。調査について複数の銀行が示した不満を認めた格好になる。\nＥＣＢの規制監督で銀行の不満再燃、レバレッジド融資の調査が引き金\n事情に詳しい関係者によると、ＥＣＢはレバレッジドファイナンス検証の最終結果通知を少なくとも９月まで延期する公算が大きい。当初は今月あたりの通知を予定していた。\n調査対象となった複数の銀行から検証作業の実施方法について異例の大きな批判を受け、ＥＣＢは批判への直接的な対応として延期を決定したと、非公表の情報だとして匿名を要請した関係者は述べた。\nＥＣＢはまた、銀行に求める貸倒引当金の積み増しを今年に入り銀行側に暫定的に伝えていた規模よりも縮小する可能性が高い。ＥＣＢは調査で生じた不満への解決策について、対象の銀行と連絡を続けていると、関係者の２人は語った。\nＥＣＢ報道官はコメントを控えた。\n関係者によると、調査はサンタンデール銀行、ＢＮＰパリバ、ドイツ銀行、インテーザ・サンパウロ、ソシエテ・ジェネラル、ウニクレディトを含む欧州銀のほか、バンク・オブ・アメリカ（ＢｏｆＡ）、ＨＳＢＣホールディングス、ＪＰモルガンの欧州部門など合計10数行が対象になった。\nＨＳＢＣからはコメントの要請に対する応答がなかった。その他の銀行はコメントを控えた。\n原題：ECB Set to Delay Risky Loans Probe Findings on Bank Backlash (1)（抜粋）\n(c)2024 Bloomberg L.P.\nSonia Sirletti, Nicholas Comfort, Esteban Duarte",[],[]
トランプ氏の機密文書裁判、起訴取り下げ－連邦地裁判事が指示（Bloomberg）,https://news.yahoo.co.jp/articles/d220904fea72c9a00a0094cc2e4f8a6ada207137,https://newsatcl-pctr.c.yimg.jp/t/amd-img/20240715-52717518-bloom_st-000-2-view.jpg?exp=10800,2024-07-15T23:11:57+09:00,2024-07-15T23:49:56+09:00,Bloomberg,bloom_st,Bloomberg,757,\nDonald Trump during his criminal trial at Manhattan Criminal Court on April 16. Photographer: Justin Lane/Getty Images\n（ブルームバーグ）： トランプ前大統領が機密文書を不適切に所持・管理していたとされる裁判で、フロリダ州の連邦地裁判事は15日、捜査を率いたスミス特別検察官の任命を違憲だと判断し、起訴取り下げを指示した。\nアイリーン・キャノン判事が下した今回の判断でトランプ氏の刑事裁判４件のうち一つが消滅し、ホワイトハウス返り咲きを目指す同氏の運動に弾みが付く。米司法省はこの判断を不服として控訴することができる。\nスミス特別検察官およびトランプ氏陣営、バイデン氏陣営それぞれの報道担当者にコメントを求めたが返答はない。ホワイトハウスはコメントを控え、司法省に質問するようにと促した。\nスミス特別検察官はこの件とは別に、トランプ氏が2020年の選挙結果を覆そうと不法に共謀したとする起訴案件で、ワシントンの連邦裁判所での裁判を進めている。このケースを担当する判事に、今回キャノン判事が下した判断は拘束力を持たない。公判はトランプ氏の免責範囲を巡る双方の主張が折り合わず、開始のめどがついていない。ニューヨーク州では口止め料の不正処理を巡る裁判で有罪評決が出たが、量刑の言い渡しが延期されている。トランプ氏はジョージア州でも選挙結果を覆そうとした罪で起訴されている。\n原題：Trump Classified Documents Case Dismissed by Florida Judge (2)（抜粋）\n(c)2024 Bloomberg L.P.\nZoe Tillman,['https://newsatcl-pctr.c.yimg.jp/t/amd-img/20240715-52717518-bloom_st-000-2-view.jpg?exp=10800'],['https://news.yahoo.co.jp/articles/d220904fea72c9a00a0094cc2e4f8a6ada207137/images/000']
バーバリーがＣＥＯを更迭、業績不振で配当停止－株価一時12％安（Bloomberg）,https://news.yahoo.co.jp/articles/efb3fdb463648f046690be76009b02e1472ced54,https://newsatcl-pctr.c.yimg.jp/t/amd-img/20240715-30552737-bloom_st-000-1-view.jpg?exp=10800,2024-07-15T17:02:32+09:00,2024-07-15T17:02:32+09:00,Bloomberg,bloom_st,Bloomberg,566,"\nJonathan Akeroyd,\n（ブルームバーグ）： 英高級品メーカー、バーバリー・グループはジョナサン・アクロイド最高経営責任者（ＣＥＯ）を交代させ、配当を停止した。高級品市場の低迷で、同社はシャネルやルイ・ヴィトンなどの高級ブランドに対抗する取り組みに苦戦している。\nマイケル・コース、コーチ、ジミー・チュウのＣＥＯを務めたジョシュア・シュルマン氏が後任となる。アクロイド氏のＣＥＯ在任期間は２年半足らずだった。\n７月に入っても高級品の販売は低迷しており、こうした状況が続けば、４－９月（上期）は赤字となり、通期の利益は予想を下回ると同社はみている。\n６月29日まで13週間の売上高は22％減の４億5800万ポンド（約938億円）。既存店売上高は21％減少した。\nバーバリーの株価は一時12％下落し、14年ぶりの安値を付けた。\n原題：Burberry Replaces CEO as Luxury Slowdown Hits High-End Push (2)、Burberry Slumps After Profit Warning, CEO Exit: Street Wrap（抜粋）\n(c)2024 Bloomberg L.P.\nJennifer Creery, Angelina Rascouet",['https://newsatcl-pctr.c.yimg.jp/t/amd-img/20240715-30552737-bloom_st-000-1-view.jpg?exp=10800'],['https://news.yahoo.co.jp/articles/efb3fdb463648f046690be76009b02e1472ced54/images/000']
ビットコイン、２カ月ぶり大幅高－トランプ氏返り咲きの観測強まる（Bloomberg）,https://news.yahoo.co.jp/articles/3e3b91e8675e1b5c62898d3a1afdee5d622a7e10,https://newsatcl-pctr.c.yimg.jp/t/amd-img/20240715-40083892-bloom_st-000-1-view.jpg?exp=10800,2024-07-15T19:41:23+09:00,2024-07-15T19:41:23+09:00,Bloomberg,bloom_st,Bloomberg,521,"\nBloomberg\n（ブルームバーグ）： 15日の暗号資産（仮想通貨）ビットコインは上昇、一時約２カ月ぶりの大幅高を付けた。トランプ前大統領が暗殺未遂事件に対して断固とした対応を示し、仮想通貨に前向きな同氏が大統領に返り咲くとの見方が強まった。\nトランプ氏は耳を撃たれるも無事－ＦＢＩは暗殺未遂で容疑者特定\nビットコインは一時５％上昇し、６万3000ドルを上回った。１日としては５月20日以来の大幅高となった。\nトランプ氏は浮動票を取り込もうと、仮想通貨を支持する姿勢を示している。事件直後の賭け市場では11月の米大統領選でトランプ氏が勝利する確率が上昇した。\nＩＧオーストラリアの市場アナリスト、トニー・シカモア氏は事件後にトランプ氏返り咲きの見方が強まると、ビットコインの「モメンタムは強まった」と述べた。\n原題：Bitcoin Rallies as Trump Optimism Powers Crypto After Shooting\n（抜粋）\n--取材協力：Ishika Mookerjee.\n(c)2024 Bloomberg L.P.\nRichard Henderson, Suvashree Ghosh",['https://newsatcl-pctr.c.yimg.jp/t/amd-img/20240715-40083892-bloom_st-000-1-view.jpg?exp=10800'],['https://news.yahoo.co.jp/articles/3e3b91e8675e1b5c62898d3a1afdee5d622a7e10/images/000']
ゴールドマン、４－６月期利益は2.5倍増－トレーディングが好調（Bloomberg）,https://news.yahoo.co.jp/articles/97b8877cd0666bc9ffeb7e84c4ab3b13fb129a61,https://newsatcl-pctr.c.yimg.jp/t/amd-img/20240715-44399171-bloom_st-000-2-view.jpg?exp=10800,2024-07-15T20:53:19+09:00,2024-07-15T23:46:56+09:00,Bloomberg,bloom_st,Bloomberg,820,\nBloomberg\n（ブルームバーグ）： 米ゴールドマン・サックス・グループが15日発表した４－６月（第２四半期）決算は、トレーディング部門をけん引役に大幅な増益となった。債券および株式トレーディング収入はいずれもアナリスト予想を上回った。\nその一方で、Ｍ＆Ａ（企業の合併・買収）助言手数料収入は米ＪＰモルガン・チェースを下回った。この事業でトップクラスのゴールドマンがライバル行に後れを取るのは異例と言える。\n多くの企業がＭ＆Ａの機会を求めているが、米国では大統領選挙が近づきつつあり、取引のペース回復はさらに遅れる可能性がある。コンシューマーバンキングへの進出拡大を諦めたゴールドマンにとって、Ｍ＆Ａは投資銀行業務での強みや資産運用事業の成長をアピールする上で重要だ。\n４－６月期の純利益は30億4000万ドル（約4800億円）、収入は127億ドルだった。利益は前年同期の2.5倍に拡大。前年同期は業界全体でディールメーキングが低迷していたほか、不動産投資やコンシューマーバンキング事業の損失によって利益が大幅に減少していた。\n債券トレーディング収入は31億8000万ドル。金利・通貨が寄与した。株式トレーディング収入は31億7000万ドルだった。\n投資銀行収入は17億3000万ドルと、アナリスト予想平均の18億ドルを下回った。Ｍ＆Ａ助言業務の手数料収入は６億8800万ドル。ＪＰモルガンが先週発表した４ー６月期決算によれば、同手数料収入は７億8500万ドルだった。\n資産運用・ウェルスマネジメント事業の収入は38億8000万ドルと、前年同期から27％増。管理手数料収入は８％増となった。\n原題：Goldman Sachs Profit Surges as Traders Top Analysts’ Estimates（抜粋）\n(c)2024 Bloomberg L.P.\nSridhar Natarajan,['https://newsatcl-pctr.c.yimg.jp/t/amd-img/20240715-44399171-bloom_st-000-2-view.jpg?exp=10800'],['https://news.yahoo.co.jp/articles/97b8877cd0666bc9ffeb7e84c4ab3b13fb129a61/images/000']
ドル上昇、米長期債は値下がり－「トランプ2.0」意識した取引（Bloomberg）,https://news.yahoo.co.jp/articles/cfc843bfabd5c64ffa25e05eeaf12a1b87e6f089,https://newsatcl-pctr.c.yimg.jp/t/amd-img/default.jpg?exp=10800,2024-07-15T17:53:16+09:00,2024-07-15T17:53:16+09:00,Bloomberg,bloom_st,Bloomberg,1294,\n（ブルームバーグ）： 15日の取引でドルと米国株先物が上昇。米長期債は値下がりしている。選挙集会で銃撃を受けたトランプ前米大統領が11月の大統領選に勝利するとの見方をトレーダーは強めている。\nドルはＧ10通貨全てに対し上昇。メキシコ・ペソが売られ、暗号資産（仮想通貨）ビットコインは約２週間ぶりの高値を付けた。こうした動きは、新たなトランプ政権が拡張的な財政政策や関税引き上げを実施するとの見通しを反映している。\n米国債は長期債利回りの上昇が大きく、２年債と10年債のスプレッドは１月以来の大きさに拡大。30年債利回りは１月31日以降で初めて２年債を上回った。\nアジア株は下落。香港に上場している中国本土企業から成るハンセン中国企業株（Ｈ株）指数は下げ幅を拡大した。中国が15日発表した４－６月（第２四半期）の国内総生産（ＧＤＰ）統計は経済成長の鈍化を示した。\n中国の４～６月ＧＤＰ、予想下回る4.7％増－５四半期ぶり低成長\nＳ＆Ｐ500種株価指数先物とナスダック100先物は、米国株が値上がりして始まることを示唆している。\nサクソ・キャピタル・マーケッツのマーケットストラテジスト、チャルー・チャナナ氏は「トランプ2.0の可能性が高まったことを市場は織り込み、ドルに追い風が吹く一方、メキシコ・ペソと中国人民元は下落する可能性がある。『トランプトレード』が再び注目されるかもしれない」と述べた。\nまた、トールバッケン・キャピタル・アドバイザーズのマイケル・パーブス最高経営責任者（ＣＥＯ）は「トランプ氏の大統領選勝利の見通しがいっそう強まるなら、米国債の利回り曲線はベアスティープ化するだろう」と語った。「株式に関しては、全体的な方向性に変化があるとは思わないが、法人税減税や規制緩和で恩恵を受ける銘柄もあるだろう」と指摘した。\n再度のトランプ政権がいわゆるトランプトレードに連動するエネルギー企業株などの資産をどのように押し上げるか、投資家は見極めている。\n三菱ＵＦＪ銀行シンガポールのストラテジスト、ロイド・チャン氏は「一般的にリスクオフ環境からドルが恩恵を受けると想定される」と指摘し、神経質な相場展開でドルが１日を通じ上昇を続ける可能性があると予想した。投資家は引き続き円買い介入リスクに神経をとがらせている。\n世界の金融市場でトランプトレード強まる可能性、暗殺未遂事件受け\n原題：Dollar Gains and Treasuries Slump on Trump Bets: Markets Wrap、US 30-Year Yield Rises Above Two-Year for First Time Since Jan.、Dollar Outperforms Peers on US Political Risk: Inside G-10（抜粋）\n--取材協力：Ruth Carson、David Finnerty、John Cheng、Lin Zhu.\n(c)2024 Bloomberg L.P.\nCatherine Bosley,[],[]
シンガポールの住宅販売、１－６月期は少なくとも20年ぶりの低水準（Bloomberg）,https://news.yahoo.co.jp/articles/7980acfc56366827f9e1e50a84909e75632a3728,https://newsatcl-pctr.c.yimg.jp/t/amd-img/20240715-22651730-bloom_st-000-1-view.jpg?exp=10800,2024-07-15T14:50:51+09:00,2024-07-15T14:50:51+09:00,Bloomberg,bloom_st,Bloomberg,416,"\nBloomberg\n（ブルームバーグ）： シンガポールの６月の新築住宅販売戸数はわずかな伸びにとどまり、2024年１－６月（上期）は少なくとも20年ぶりの低水準となった。かつて活況を呈した住宅市場でセンチメントが低迷している。\n都市再開発庁（ＵＲＡ）が15日発表したデータによると、デベロッパーが６月に販売した民間住宅は228戸。５月は221戸だった。ブルームバーグの暫定集計によると、１－６月期の販売戸数は2000戸に満たず、04年までさかのぼるデータで最も少ない。\nシンガポールの不動産市場はかつて活況を呈していたが、高金利と市場沈静化に向けた政府の措置で鈍化している。\n原題：Singapore Home Sales Reach Lowest in 20 Years in First Half (1)（抜粋）\n(c)2024 Bloomberg L.P.\nBernadette Toh, Low De Wei",['https://newsatcl-pctr.c.yimg.jp/t/amd-img/20240715-22651730-bloom_st-000-1-view.jpg?exp=10800'],['https://news.yahoo.co.jp/articles/7980acfc56366827f9e1e50a84909e75632a3728/images/000']
