headline,mainEntityOfPage,image,datePublished,dateModified,author,media_en,media_jp,str_count,body,images,external_links
【山形】サクランボなど栽培開始から150年の節目に企画展（YTS山形テレビ）,https://news.yahoo.co.jp/articles/ccaeba1894271d10dae2a20a3eddfd6a62f68599,https://newsatcl-pctr.c.yimg.jp/t/amd-img/20250702-00000009-yts-000-1-thumb.jpg?exp=10800,2025-07-02T19:06:07+09:00,2025-07-02T19:06:07+09:00,YTS山形テレビ,yts,YTS山形テレビ,641,"YTS山形テレビ
2025年は山形県内でサクランボなどの果樹栽培が始まってから150年の節目の年です。

山形市ではサクランボ栽培の歴史などを紹介する企画展が開かれています。

県立博物館で開かれている企画展「さくらんぼ 山形県民、挑戦の結実」

この企画展は、県の名産品であるサクランボを切り口に山形を知ってもらおうと、果樹栽培150年に合わせて開かれました。

サクランボを栽培する時に使う道具や、山形が「サクランボ県」になるまでの経緯について紹介されているなど、ここでしか見られない資料が多く展示されています。

「こちらではサクランボの模型を使ったミニゲームをすることができる。楽しみながらサクランボの大きさについて学べたり、農家さんのお仕事の体験をすることができたりと、楽しみながら色々学ぶことができる。」

7月2日は地元の小学生や観光客などが訪れ、サクランボの歴史などを学んでいました。

「ハクビシンにかじられたサクランボの実が印象に残った。昔から今の状態まで展示されていたが大変な思いをして美味しい物をみなさんに届けているんだなということがよく分かった。」

「道具の移り変わりや他では見られない古い資料をたくさん取り揃えることができたので、注目していただければと思う。県外からの観光でいらっしゃる方ももちろん、山形に住んでいる方やサクランボ農家さんたちにも改めてサクランボのことを捉え直していただくことができればなと思う。」

企画展は8月末まで開かれています。",[],[]
【山形】山形労働局長が建設現場に出向き安全パトロール（YTS山形テレビ）,https://news.yahoo.co.jp/articles/ec71735137ec2d761235a4fd106a21e69a210f1d,https://newsatcl-pctr.c.yimg.jp/t/amd-img/20250702-00000008-yts-000-1-thumb.jpg?exp=10800,2025-07-02T19:00:07+09:00,2025-07-02T19:00:07+09:00,YTS山形テレビ,yts,YTS山形テレビ,726,"YTS山形テレビ
山形労働局長が建設現場に出向き事故防止を呼び掛ける安全パトロールが山形市で行われました。

7月1日からの「全国安全週間」に合わせ山形市七日町の山形銀行本店を含む新たなビルの建設現場で行われた安全パトロール。

2024年、県内で発生した労災事故のうち4分の1以上を占める転落や転倒事故の防止を呼びかけるため島田博和山形労働局長が、足場など高い所の転落防止策や、段差や資材につまづかないような対策がとられているかなどを点検しました。

またこの時期の建設現場ならではの光景も・・・。

「きょうも県内は31度を超える暑さが予想されています。現場付近には『危険』と書かれたのぼり旗が設置されている。作業をする方に視覚的に暑さ対策を訴えかけます。」

こちらの現場では作業着にファンがついた「空調服」を着たり、体温が上がったことを音で知らせる時計型の端末を身に着けたりして作業にあたっています。

そして、こちらの現場で2024年から取り入れたのが、「AVA」と呼ばれる熱中症対策。

氷水に手を入れて冷えた血液を体内に循環させ熱中症の要因の一つ「深部体温」の上昇を防ぎます。

「結構冷たいですよ、体温が上がってきた体にはこの冷たさが効く。長時間暑い中で作業される方にとってはオアシス。」

このほかビニールハウスの中をクーラーで冷やした休憩スペースなども設置されています。

山形労働局ではこれらの対策以外にも作業員個人に対する「心配り」も重要だそうです。

「体調の良し悪しとか、色々焦りもあるかもしれないが、メンタルの状態が悪いと労働災害につながり得る。そういうところもケアしてもらいながら作業してもらえたら安全対策につながる。」",[],[]
【山形】米沢市 自治体と民間業者が持ち主いない空き家解体（YTS山形テレビ）,https://news.yahoo.co.jp/articles/7a0b7b4197addc9e1f6fa532dbd7d4a4e0252a4d,https://newsatcl-pctr.c.yimg.jp/t/amd-img/20250702-00000007-yts-000-1-thumb.jpg?exp=10800,2025-07-02T18:57:07+09:00,2025-07-02T18:57:07+09:00,YTS山形テレビ,yts,YTS山形テレビ,447,"YTS山形テレビ
空き家の増加が課題となる中、山形県米沢市では自治体と民間の業者が協力して持ち主のいない空き家を解体する取り組みが始まりました。

水を吸った畳や傷んだ基礎の木材がむき出しになった建物を、大型の重機が取り壊していきます。

解体作業が行われたのは持ち主がいない状態で、およそ10年間放置されていた米沢市内の空き家です。

この取り組みは、倒壊の恐れがある危険な空き家を減らそうと、米沢市をはじめ、市内のリサイクルや解体、清掃の業者など5つの団体が連携して初めて行いました。

それぞれの業者が解体や廃棄物処理を無償で担当し、市は費用の減免などを支援します。

「米沢市だけではなく、日本全国でこのような取り組みが広がれば。」

「市の安心で安全なまちづくりにつなげていきたい。」

市内には現在70軒程度、所有者不在の空き家があり、市では今後も1年に1軒のペースで空き家の解体を行う方針です。

そして解体後の更地の利活用について、地域住民と一緒に検討していきたいとしています。",[],[]
【山形】山形選挙区に立候補表明の現職と新人4人の顔ぶれ（YTS山形テレビ）,https://news.yahoo.co.jp/articles/9215d70232d57292128cda343b22b84ac83d9848,https://newsatcl-pctr.c.yimg.jp/t/amd-img/20250702-00000006-yts-000-1-thumb.jpg?exp=10800,2025-07-02T18:54:15+09:00,2025-07-02T18:54:15+09:00,YTS山形テレビ,yts,YTS山形テレビ,655,"YTS山形テレビ
それでは山形選挙区に立候補を表明している現職と新人4人の顔ぶれを見ていきます。

参議院選挙山形選挙区に出馬を予定しているのは、無所属・現職の芳賀道也さん、自民党・新人の大内理加さん、共産党・新人の三井寺修さん、参政党・新人の佐藤友昭さん、NHK党・新人の大貫学さんの5人です。

再選を目指す芳賀さんは、立憲・国民の両県連と連合山形による「2党1団体」から推薦を受けています。

1期目の実績をアピールするとともに、ガソリン価格の引き下げや手取りを増やす経済政策などを訴えています。

元県議で2度目の国政挑戦となる自民党の大内さん。

公明党や県農政連、24の市町村長などから推薦を受けています。

人口減少対策を最重要課題に挙げ、地方分散型の国づくりなどを訴えています。

共産党の三井寺さんは、2024年の衆院選に続き2度目の国政挑戦です。

遊説を軸に活動を展開し、現在の自公政権を批判するとともに、消費税の減税や、最低賃金の引き上げなどを訴えています。

選挙への出馬は初めてとなる参政党の佐藤さんは、各地で街頭演説を重ね、消費税の段階的廃止や農家への戸別補償などを訴えています。

また、ワークショップを開催するなど、党の政策の浸透を図っています。

NHK党の大貫さんは、6月30日、党が擁立を発表し、7月2日出馬を表明しました。

大貫さんは平和憲法を守ることや、今の政治の状況を正すことなどを訴えています。

参議院選挙は7月3日公示され、7月20日に投開票が行われます。",[],[]
【山形】山形選挙区 NHK党の新人 大貫学さん立候補表明（YTS山形テレビ）,https://news.yahoo.co.jp/articles/4c80d965b1c070a3f87116da8bea1f99c9d4ac2e,https://newsatcl-pctr.c.yimg.jp/t/amd-img/20250702-00000005-yts-000-1-thumb.jpg?exp=10800,2025-07-02T18:54:07+09:00,2025-07-02T18:54:07+09:00,YTS山形テレビ,yts,YTS山形テレビ,254,"YTS山形テレビ
参議院選挙山形選挙区に政治団体「NHK党」の新人 大貫学さんが立候補すると表明しました。

大貫学さんは67歳。

栃木県在住で農家を営んでいます。

出馬の理由として「平和憲法を守る意志を伝えるため」などとしています。

会見では悲惨な戦争を繰り返してはいけないことを訴えていきたいと話しました。

「しっかりと反戦。絶対に憲法を変えちゃいけない。日本が核兵器を持っては絶対いけないんですよ。広島の原爆資料館とか何十回も行ってきました。悲惨で悲惨であんなことをやってはいけない、日本が。」",[],[]
【山形】参院選の公示迫る 県庁で立候補受け付けリハーサル（YTS山形テレビ）,https://news.yahoo.co.jp/articles/8604bd1b9b93960bd7d9bbfe6c535ebd77a1d3dd,https://newsatcl-pctr.c.yimg.jp/t/amd-img/20250702-00000004-yts-000-1-thumb.jpg?exp=10800,2025-07-02T18:48:23+09:00,2025-07-02T18:48:23+09:00,YTS山形テレビ,yts,YTS山形テレビ,284,"YTS山形テレビ
参議院選挙の公示が7月3日に迫り、県庁では立候補届け出の受け付けリハーサルが行われました。

リハーサルには、県選挙管理委員会の担当者20人が参加。

届け出の受け付け順を決めるくじ引きをした後、立候補者役の職員が書類を提出します。

担当者は書類に不備がないか確認していました。

そして、街頭演説に使用される旗や、選挙事務所の表札などいわゆる「七つ道具」を手渡し一つ一つ手順を確認していました。

「今日リハーサルで手続きの手順について確認したので、あす各立候補者がスムーズに選挙運動を始められるようにしっかりと正確に受付事務を進めていきたい。」",[],[]
【山形】上山で猛烈な雨 「記録的短時間大雨情報」発表（YTS山形テレビ）,https://news.yahoo.co.jp/articles/d4cbc164c868d443426c7ed500d6816355baa685,https://newsatcl-pctr.c.yimg.jp/t/amd-img/20250702-00000003-yts-000-1-thumb.jpg?exp=10800,2025-07-02T18:48:07+09:00,2025-07-02T18:48:07+09:00,YTS山形テレビ,yts,YTS山形テレビ,347,"YTS山形テレビ
7月2日午後、山形県上山市で猛烈な雨が降り、気象庁は「記録的短時間大雨情報」を発表しました。

村山では7月2日夜はじめ頃にかけて土砂災害などに注意・警戒が必要です。

こちらは7月2日午後2時45分頃の上山市の映像です。

雨が強く降り、木が横に激しく揺れるほど風が吹いています。

上山市付近では1時間におよそ100ミリの猛烈な雨が降り、午後3時半頃に「記録的短時間大雨情報」が発表されました。

「JRによりますと、大雨の影響で線路が冠水し、山形新幹線は『福島ー新庄』間の上下線で、奥羽線は『赤湯ーかみのやま温泉』間の上下線で（一時、運転を見合わせました）。」

村山では、7月2日夜はじめ頃にかけて大雨による土砂災害や低い土地の浸水、河川の増水に注意・警戒が必要です。",[],[]
【山形】山形市本沢地区でデラウェアの出荷開始、安全祈願祭も（YTS山形テレビ）,https://news.yahoo.co.jp/articles/04f73765a0de149fe4e81ce525c86a9710bc7969,https://newsatcl-pctr.c.yimg.jp/t/amd-img/20250702-00000002-yts-000-1-thumb.jpg?exp=10800,2025-07-02T12:00:16+09:00,2025-07-02T12:00:16+09:00,YTS山形テレビ,yts,YTS山形テレビ,416,"YTS山形テレビ
山形県内有数のブドウの産地、山形市本沢地区でデラウェアの出荷が始まり、安全祈願祭が行われました。

安全祈願祭には生産者らおよそ40人が出席し、収穫・出荷作業の無事を祈願しました。
種のないブドウとして人気があるデラウェアは、朝晩の寒暖差がある環境が適していますが、山形市では先月の気温が観測史上最も高くなった影響などで着色が進まず、昨年より4日遅い初出荷となりました。

それでも糖度は出荷基準の18度を超えるなど味については問題なく、JAやまがたでは今年度、他の品種を含めて合わせて841トン、販売額7億6850万円の出荷を目標にしています。

【JAやまがた 広域ぶどう部会 佐藤吉之 部会長】
「種のないブドウで安心して食べられるので、デラウェアの消費をお願いしたい」

7月2日出荷されたデラウェアおよそ1トンは、主に関東の市場に向かいます。出荷は9月末まで続き、今月下旬に最盛期を迎えるということです。",[],[]
【山形】高畠町の贈収賄事件で係長が失職（YTS山形テレビ）,https://news.yahoo.co.jp/articles/22f8447ea26abcdbc7c8fa42e1cb2ec74089f34f,https://newsatcl-pctr.c.yimg.jp/t/amd-img/20250702-00000001-yts-000-2-thumb.jpg?exp=10800,2025-07-02T12:00:05+09:00,2025-07-02T12:48:05+09:00,YTS山形テレビ,yts,YTS山形テレビ,345,"YTS山形テレビ
山形県高畠町が発注した橋の補修設計に関する贈収賄事件で、有罪判決が確定した町の係長が、地方公務員法の規定に基づき失職しました。

この事件は、高畠町建設課の元係長（49）が、町発注の橋の補修設計に関する指名競争入札で、業者側に秘密事項の事業価格を教えた見返りに現金およそ100万円を受け取ったとして、加重収賄などの罪に問われたものです。
山形地裁は先月13日、元係長に懲役2年6か月、執行猶予4年、追徴金およそ100万円の有罪判決を言い渡しました。元係長は控訴せず、有罪判決が確定したことを受けて地方公務員法の規定に基づき失職しました。
また町では、元係長を管理監督する立場だった建設課長を減給10分の1（1か月）の懲戒処分に、当時の建設課・課長補佐を訓告処分としました。",[],[]
