headline,mainEntityOfPage,image,datePublished,dateModified,author,media_en,media_jp,str_count,body,images,external_links
プロが推奨する、“美顔器やエステより効果が出やすい美容法”とは?（PHPオンライン）,https://news.yahoo.co.jp/articles/280d0c0e626c05a9ace0c9fd93e4fccda539628b,https://newsatcl-pctr.c.yimg.jp/t/amd-img/20250702-00010001-php_s-000-1-view.jpg?exp=10800,2025-07-02T11:51:24+09:00,2025-07-02T11:51:24+09:00,PHPオンライン,php_s,PHPオンライン衆知,3190,"ヘアメイクアップアーティストのYUTA.さんがすぐにできて効果的な美容法を紹介する。
「話題のコスメや美容法を試しても効果が実感できない」「年齢を重ねるごとに美容の悩みが増えていく」...一方で、なぜモデルや女優はいつでも美しさをキープできるのでしょうか。ヘアメイクアップアーティストのYUTA.さんは、そうした職業にいる人は健康こそが一番の美容だと心得ているからだと指摘します。
【図】顔のたるみも軽減！正しい舌の位置
YUTA.さんの著書『今の自分に合うメイクの正解』では、""メイクや美容をする以前""に知ってほしいことを自身の経験を踏まえて綴っています。本稿では、同書よりお金をかけずに手軽にできる美容法を紹介します。

※本稿は、YUTA.著『今の自分に合うメイクの正解』（日本実業出版社）より内容を一部抜粋・編集したものです
コスメを買うよりも、今すぐ効果が出る美容
コスメを買うより、高い美顔器を買うより、エステに行くより、今すぐ効果が出るのは、日々の習慣となっている行動を変えることです。

「行動を変える」と聞くと、何か大きなことをしなければいけないと考える方もいるかもしれませんが、ほんの少し意識を向けるだけで、見違えるほど外見も変わってきます。

たった今からできること。たとえば、舌の位置を正しい場所に収めておくこともそうです。

舌の根もとあたりから上あごにベターとくっつけてみてください。このとき、舌を上に持ち上げようとすると縦に細長くなってしまう方がいますが、平たくベターとくっつけるのがポイントです。

くっつけたままツバをゴックン。飲み込むことができましたか？

何回か繰り返すと、最初は頬や舌が少し痛く感じるかもしれませんが、このちょっとした動作を日々繰り返すだけで、頬は引き上がり、口角がきゅっと上がります。気づけば、たるみも軽減され、フェイスラインや二重あごもスッキリします。
美顔器の前に、まずマッサージを
人気の美顔器を買ったけれど、結局は置き物状態に。

こうした経験があるのは、おそらく、使いはじめてすぐに思ったような効果を実感できなかったからかもしれません。

自分の手でマッサージをするのが習慣になると、その流れから美顔器も自然と続くようになっていきます。結果、顔は引き上がり、血色感が増し、くすみが軽減されてきます。

そうやってマッサージを続けて、整形級に印象が変わった人を私はたくさん見てきました。

ひと回り小顔になった方や、目の下のくすみやたるみが軽減され、明るい印象になった方も多いです。

大切なのは、簡単に覚えられる単純なマッサージをコツコツ継続すること。だから、「ちょっとやってみた」だけでは、その効果を実感するのが難しいのです。

やめずに続ける。たとえ、できない日があってもまた再開する。わずかな空き時間にこまめにやる。これに尽きます。

たとえば、両肘をテーブルにつき、軽く手を握り、親指の先と人差し指の第二関節であごを挟む。親指の先を顎の内側にぐっと押し込むようにすると、痛気持ちいい刺激を感じます。

さらに、同じ手の状態で耳を挟み、親指でグッグッと押しながらもみほぐしていくとじんわり血流が上がるのを感じとても心地いいです。コリが取れ、血流が上がることで顔のむくみが軽減されます。

そして、マッサージで意識してほしいのは、やる前とやったあとの違いを自分で感じること。

自分の手のひらで肌を触りながら感覚を研ぎ澄ませていくと、ちょっとした変化に気がつくようになります。

ところが残念なことに、多くの人がマッサージの効果を実感する前に、1、2回やって、その後は何もせず終わり、というパターンに。

そのまま放置すると、むくみやエイジングは確実に、しかも加速して進んでいきます。それもかなりのスピードでです。

なぜ、これほどまでに「マッサージの大切さ」をお伝えするかというと、むくみや血流をよくすることで見た目の印象が変わるだけではなく、心も同時にケアができるからです。

とくに手を使って顔をマッサージしていると、目の疲れが取れて、頭もスッキリします。じんわりと体温を感じリラックス状態に入ります。呼吸も整い、自然と気持ちが落ち着いていくのを感じます。心のケアにもつながり、心身ともに癒やされ、表情もやわらかくなるのです。
老けて見える「マイナスのシワ」と幸せな「プラスのシワ」
メイクをしても、どうやっても隠せないものがあります。それはシワなどの凹凸のあるものです。

だからこそ、シワに関して、メイク以上に大切なことがあります。それは「表情のクセ」です。

アイメイク中、眉やおでこに無意識にシワが入る方は多いです。とくに小さな鏡を見ているときは目もとに集中しすぎて、おでこのシワに気づかないまま。毎日続ければ、おでこにシワが刻まれるのは自然な結果です。

これを防ぐには、鏡を目線より少し下に置いてアイメイクをすると、自然とおでこがリラックスし、シワが入りにくくなります。

また、ふと時計を見上げるときなどにも無意識の表情ジワが生まれていることに注意が必要です。これらは、余計なシワを自分でつくっているともいえます。

目のまわりにある丸い筋肉（眼輪筋）を大きく外側に広げるイメージを持ちながら目を大きく開き、頬骨の下にある4本の筋肉（小頬骨筋・大頬骨筋・頬筋・笑筋）をキュッと引き上げ、微笑むように笑うと、頬のたるみが引き上がり、ほうれい線が深く刻まれにくくなります。

そして、イライラしたときや考えごとをしたときにできる眉間の縦ジワ。これは「マイナスのシワ」と呼ばれていて、キツく神経質な印象に見えます。

無意識にできてしまうのがこの縦ジワです。とくに寝ているときに深く刻まれてしまい、この眉間の縦ジワを防ぐには、心身ともにリラックスする以外に方法がありません。

縦ジワは、就寝前のすごし方で劇的に解消されます。

寝る3時間前までには食事を済ませ、2時間前までにお風呂に入り、できるだけスマホは使わないようにしましょう。

もしスマホが気になるなら、アロマの香りを焚きながら、リラックスできる音声アプリやポッドキャストを流すのもおすすめです。どうしてもスマホを見たいときはタイマーを5分かけ、この時間だけと決める。

たっぷり身体をストレッチし、香りのよいスキンケアで顔と身体をマッサージすると、癒やしの香りでリラックスでき、深く質のよい睡眠をとることができます。

モデルや女優が、なぜあんなに美しく健康的なのか？

それは健康こそがいちばんの美しさだと心得ているからです。美容の習慣を自分の生活の一部として取り入れて継続しているから、自然な美しさがあるのです。

どんなに高価な美容液よりも優先すべきは、生活習慣の見直しです。取り入れると、体調がすこぶるよくなるのを実感します。

顔のたるみが取れ、びっくりするくらい顔色もよくなります。朝から頭もスッキリしていて、とても気持ちのよい1日がスタートします。

生活習慣を変えるだけなら、お金もかからずいいことづくめ。こんな素晴らしいことを取り入れない手はないですよね！　しかも、今日からすぐにはじめられることばかり。

まずは、3日間続けてみてください。寝る時間を決めて、そこから逆算していく。時間が決まったら、それを行動に移すのみです。気づけば顔色がよくなり、自分の顔が変わっていくのを感じたとき、思わず笑顔がこぼれるはずです。

そんな「にっこり笑顔」の自然な表情による目もとに入る横ジワ。こうした自然にできたシワは「プラスのシワ＝幸せジワ」といわれていて、とても魅力的です。
YUTA.（ヘアメイクアップアーティスト）",[],[]
奥の細道、お遍路...なぜ人は歩き続けるのか? 経験者が語る「ロングトレイル」の深い魅力（PHPオンライン）,https://news.yahoo.co.jp/articles/0bfd584625eac6182982b3f443096bb0d0714ad0,https://newsatcl-pctr.c.yimg.jp/t/amd-img/20250702-00010000-php_s-000-1-view.jpg?exp=10800,2025-07-02T07:31:00+09:00,2025-07-02T07:31:00+09:00,PHPオンライン,php_s,PHPオンライン衆知,3359,"6月27日の東京アウトドアショーにて、ロングトレイルをテーマに土屋智哉さんと中村純貴さんのトークイベントが開かれた。その様子をお届けする。
6月27日、「東京アウトドアショー」のトークイベントに、アウトドアに深く関わり、その魅力を発信し続けている二人が登壇した。三鷹のハイキング専門店「ハイカーズデポ」店主・土屋智哉さんと、アウトドアブランド「山と道」に所属する""JK""こと中村純貴さんだ。
【調査結果】ウォーキングをすると海馬が2％増加
テーマは、ロングトレイル――自然の中を何日もかけて歩く長距離トレイルの魅力、そして「歩く」という行為そのものが持つ根源的な意味について。さらに、軽量装備の哲学「ウルトラライト」にも話題が及び、持ち物の選び方や食料計画といった実践的な知見も語られた。

経験豊富な二人が語る「歩く旅」の本質とは？そのトークの模様をレポートする。
ロングトレイルとは何か？
北米で発祥し、100年以上の歴史をもつロングトレイル。東海岸のバーモント州で生まれたバーモント・ロングトレイルや、アパラチアントレイルといった数千km単位の道が存在し、多くのハイカーたちを魅了してきた。

ロングトレイルが生まれた背景には、都市化や経済成長へのカウンターアクションとして「自然に回帰しよう」という人々の思想があるそう。

「パシフィッククレストトレイルでは、メキシコ国境からカナダ国境を目指して4,000kmを歩きます」と語るのは中村さん。その道のりには自然との対話だけでなく、日々の出会いや偶然の積み重ねも含まれている。

ロングトレイルには距離や時間などの縛りはなく、「1週間歩くこと」をロングトレイルと言う人もいれば「1000キロ以上歩くこと」をそう定義する人もいるといいます。

「ロングトレイルを歩く人は、基本的にひとり。でも、歩くリズムが合う人と自然と一緒になるんです」と中村さんは話す。くっついたり離れたりを繰り返しながら、誰かと歩調を合わせていくうちに、自然と親しい関係性になっていくという。
登山とロングトレイルの違い
「登山とロングトレイルの違いは？」という問いに、土屋さんは「補給の存在」と答えた。

登山が「山に登って歩き切る」行為であるのに対し、ロングトレイルは「山脈から山脈へ歩き、町で食料などを補給しながら、歩き続ける旅」だという。ただ、必ずしも山に入る必要はなく、例えばビーチなど、自然の中を歩き続けることもそれにあたるらしい。

テーマを持って歩くことも面白いと話す。国内でいえば松尾芭蕉の奥の細道を辿ってみたり、アメリカであれば西部開拓の歴史とリンクさせながら歩いてみたり、自由な発想で歩くことを楽しめるのだ。

一方、中村さんはロングトレイルにおいてハイカー同士の出逢いに重きを置いているという。

「最初に歩いたのが、パシフィック・クレスト・トレイルなんですけど、ドイツ人の21歳ぐらいの子と、僕は当時26歳で、ちょっとした挨拶から始まり、一緒に2ヶ月半ぐらい歩くことになりました」

""トレイルファミリー""という造語もあるように、長期間ともに歩いているうちに家族のような関係性になっていくことも、誰かと歩くロングトレイルの醍醐味かもしれない。
「ウルトラライトハイキング」とは何か
食料はどれくらい持ち歩くのか。トレイル中は仕事ができず資金面で厳しいため、基本的には袋麺などの簡単な食事で済ませるという。

「水分を含まない、できるだけ軽量なものを選びます。日本の山小屋に行っても、カップヌードルが販売されていることが多いですよね」と中村さん。

また、現地のスーパーにも立ち寄るため、パンやベーグルなど、安価で軽く、どこでも手に入りやすいものが食料の中心になるという。

「日本を歩くと本当に楽です。コンビニとかやっぱあのフリーズドライ系の食料がものすごい充実しているから」と中村さんは語る。

アメリカでは、日本と比べて山小屋の数が圧倒的に少なく、食料の調達が難しい場面も少なくないという。

ロングトレイルに出るにあたり、仕事はどうしているのか。

「コロナ禍以降はリモートワークも定着し、働き方も変わってきたので、自分が最初に行った約20年前に比べると、休職するとか、社会的にもいろんな体験には価値があると思ってもらえるようになってきていると思う」と土屋さんは話す。

また、リュックの大きさも人によってさまざまだ。中村さんは50リットルのリュックを使用しているが、土屋さんは、最後に歩いたアメリカのトレイルをわずか36リットルのリュックで歩き通した。着替えは一切持たず、着ている服だけで過ごすことで荷物を最小限に抑えているのだという。

必要な容量は、歩く期間やスピードによっても変わってくる。

そうした背景もあり、ハイカーたちの間では荷物の軽量化を追求する「ウルトラライトハイキング」という思想が広がっている。水や食料を除いた装備の重量を4.5kg以内に抑えるのが基本とされるが、その実践者である土屋さんはこう語る。

「持っていくべきものを持っていかないんじゃなくて、長く歩くことにフォーカスを当てているから、その必需品だけに絞る感じだと思います。例えば、キャンプを楽しむためだったら、キャンプ場で楽しむためのものをたくさん持っていくのが、正しいと思うんですね。

一方で長く歩くためには、基本的にテント、寝袋、マット、それから炊事道具と雨具・防寒着、ファーストエイド、ヘッドライト、モバイルバッテリーみたいな感じになると思うんですけど。それから着替えをワンセット持つか持たないかですね。でも『ああ、これで生活できるんだ』って感覚になっていくんです」
過酷に見えるロングトレイルは「楽しむこと」が最優先
『森の生活』の著者、ヘンリー・デイヴィッド・ソローが暮らした家を、土屋さんが訪れた時の写真。ソローはアウトドアの源流の一つともいわれる
一見すると修行のようにも思えるロングトレイルだが、中村さんは過酷な環境の中で得た気づきをこう話す。

「僕は毎日ラーメンを食べてたんですけど、日常でいうとそんなにおいしいものではないですよね。でも毎日4,50kmぐらい歩いてたりすると、それがとにかく美味しい。たまに贅沢する日なんかは、バターひとかけら入れたり。それだけですごい幸せなんですよね。

普段はいろんなものに囲まれていますけど、実は自分自身が幸せになるのに、たくさんのものいらないんだな、みたいなことに気づきました」

お二人によれば、ロングトレイルの根底にあるのは「楽しむこと」。歩いて国境を越えるという非日常の体験や、圧倒的な自然の美しさを全身で感じられること、そして人との出会いが何よりの魅力だという。体力的に不安があれば、無理せず途中で引き返しても構わない。旅として心から満足できるなら、それで十分なのだ。

最後に、お二人それぞれが初心者におすすめのトレイルコースを教えてくれた。

土屋さんが挙げたのは、長野県飯山市を中心に広がる「信越トレイル」だ。

「もし日本で長く歩いて、山里の景色も見たいっていうなら飯山にある信越トレイルを歩いてみるのがいいんじゃないのかなと。

山道もしっかりと歩けるし、秋山郷っていう、いわゆる日本らしい風景を見ることができるので。距離も120kmくらいなので、（ロングトレイルの）とっかかりとしてはいいんじゃないかなと思います」

一方、中村さんは王道をすすめる。

「初心者の人であれば、""THE""なところだと、やっぱり北アルプスに行くのが一番手っ取り早いんじゃないかなと思います。その登山口行くまではヒッチハイクでいってみるとか、そういうところで旅の要素を入れるっていうのも面白いかなと思います」

ロングトレイルとひと口に言っても、歩く理由や魅力の感じ方は人それぞれだ。美しい景色や人との出会い、そして日常では味わえない""歩く旅""の喜び。ロングトレイルは、そんな体験を通じて、自分自身と深く向き合うきっかけになる旅だ。
土屋智哉（Hiker'sDepot店主）、中村純貴（ハイカー、Yotuber）",[],[]
