headline,mainEntityOfPage,image,datePublished,dateModified,author,media_en,media_jp,str_count,body,images,external_links
ドゥカティ スクランブラー・アイコン試乗「初めての大型車にもアリ!? 軽い車体に元気なエンジン、日常的な速度域が楽しい」（モーサイ）,https://news.yahoo.co.jp/articles/1947e233e0106208f7a9b5a4b24a53f1975cbf2a,https://newsatcl-pctr.c.yimg.jp/t/amd-img/20241121-00010004-mcyclist-000-2-view.jpg?exp=10800,2024-11-21T17:21:46+09:00,2024-11-21T17:59:18+09:00,モーサイ,mcyclist,モーサイ,982,レトロ系デザインのドゥカティという独特な存在感「スクランブラーシリーズ」 試乗車の車体色は「62イエロー」で価格は133万3000円 ドゥカティ……バイク乗りならきっと一度はその響きに憧れたことがあるはず。 言わずもがな、歴史あるイタリアのバイクメーカーで、MotoGPやスーパーバイク世界選手権などレースの世界で大活躍。市販車にしてもそれを裏付けるようにスポーティなモデルが多いのですが、反面、「ハードルが高そうで自分には縁がないかも」と感じる人も少なくないのではないでしょうか。 【画像9点】今やドゥカティ唯一の空冷！「スクランブラー」の特徴を写真で解説 ですが、ドゥカティには「スクランブラーシリーズ」という大穴があります。日常的に乗れるフレンドリーさがありながら、ドゥカティらしい個性も楽しめるモデルで、価格も129万900円～とフレンドリー。嬉しい。 そもそも、このスクランブラーはドゥカティの中でもちょっと独特な存在と言えるかもしれません。モチーフとなっているのは、ドゥカティが1960～70年代に販売したスクランブラーで、昨今でいうところのネオレトロ系に当たるでしょうか。つまり、カジュアル路線なのです。 今回はシリーズ中で最もベーシックな「スクランブラー・アイコン」に触れてみましたが、何というかTシャツ＆スニーカーみたいな気軽さがありました。 「400ccみたいな感覚」スクランブラー・アイコンの軽さに驚く まず、またがって引き起こす……で驚きます。とにかく軽くて、800ccのバイクとは思えないほど。 それにL型2気筒エンジンの恩恵もあって、車体が細身＝足つきも悪くない。なんせ車体が軽いので、多少傾いても大丈夫な安心感もあって、まるで400ccクラスのような感覚。 この軽さ、スクランブラーシリーズの特徴としてドゥカティ自身かなりこだわっているポイントと思われます。 というのも、現在販売されているスクランブラーシリーズは2023年にフルモデルチェンジを行い第2世代となったのですが、エンジン、フレーム、スイングアームを軽量化。トータルで従来型より4kg軽くなり、アイコンの車重は176kg（燃料抜き）。ガソリンを満タンにしたとしても185kgくらいでしょうから、数字で見ても800cc前後のバイクの中では群を抜いて軽いのは間違いありません。,[],[]
【KTM 990RC R発表】RC8シリーズ以来の大排気量スーパースポーツRC・公道へ再降臨！デビューは2025年春以降（モーサイ）,https://news.yahoo.co.jp/articles/b0c18c2837cbc24b35894eabfdf9a8e180d2faf7,https://newsatcl-pctr.c.yimg.jp/t/amd-img/20241121-00010003-mcyclist-000-1-view.jpg?exp=10800,2024-11-21T17:01:06+09:00,2024-11-21T17:01:06+09:00,モーサイ,mcyclist,モーサイ,1266,「RC」の名とともに復活するKTMの大排気量スーパースポーツ KTM 990RC R:トラック仕様のプロトタイプ。公道モデルのデビューは2025年春以降となる模様 KTMのスーパースポーツが大排気量クラスで復活する。車名の頭にRCと入るKTMの同カテゴリーのモデルは、2008年登場の1190RC8からスタートしている。ワールドスーパーバイク参戦を視野に入れて開発されたRC8シリーズは、その後排気量を1148ccから1194ccとしてパワーアップしたRC8Rへと進化。しかし2016年に生産を終了。その間RCシリーズは小排気量の単気筒シリーズで125、250、390といったモデルがラインアップされて現在に至るが、大排気量Vツインスポーツの座はしばらく空席のままだった。 【画像14点】待望のKTMスーパースポーツ、990RC Rプロトタイプをチェック！ だが、2025年からこの座がよりスポーツ性を研ぎ澄ましたモデルで埋まることになりそうだ。その名は990RC R。2025年の第二四半期にデビュー予定とアナウンスされる同車は、公道走行も可能なピュアスーパースポーツを謳う。 MotoGPレースのほぼすべてのクラスで得た経験をフィードバックして造り込まれた990RC Rは、公道でのスポーツライディングの楽しさを高度に提供するのはもちろん、サーキットで遊べるトラックエディションに簡単に変身できることもアピールする。 コンパクトな947cc並列2気筒LC8cエンジン搭載のロードゴーイングレーサー 990RC Rに搭載されるパワーユニットは、車名の数字でも分かるように、現行990系と基本を共用する947cc並列2気筒LC8cエンジンで、公道モデルとしてEURO5+に準拠する環境性能を確保。その上で130psの最高出力と7000rpmで103Nmという高トルクを発揮。 コンパクトな並列ツインを抱えるフレームはスチール製で、スーパースポーツモデルとしてフロント荷重重視で最適化した設計。キャスター角は25度に設定し、ステアリングの正確な応答性をねらってフォークをオフセットさせている。高い剛性を確保した車体で、アルミ製サブフレームと合わせて低速時の機敏さを損なわず、ストリートでの荒れた路面からレーストラックまで、加速時の最適な感触と安定性を実現しているという。 またRC Rのもう一つの主要な特徴は、人間工学に基づくライディングポジションの追究。足元、ヒザ、腕の左右6点の接触点の最適化している。タンクの造形をはじめ、タンクのニーパッド、タンク前側に設置された腕をホールドするパッド、調整機構付きのステップなどで、ライダーのベストな接触点を増やしている。また、フルアジャスタブルのWP製APEXオープンカートリッジフォークフォークやWP製フルアジャスタッブルリヤショックも、軽量なアルミキャストホイールとミシュラン製タイヤの組み合わせも、ライダーとマシン、そしてあらゆる路面での最適なコンタクトに貢献しているとアピールする。,[],[]
アドベンチャーツアラー「V-STROM 250SX」が色変更！新設定「ソノマレッドメタリック」の鮮やかな赤が眩しい！（モーサイ）,https://news.yahoo.co.jp/articles/9c0d7560cf37700a7bdab3d7f4276ada5617209c,https://newsatcl-pctr.c.yimg.jp/t/amd-img/20241121-00010002-mcyclist-000-1-view.jpg?exp=10800,2024-11-21T15:53:50+09:00,2024-11-21T15:53:50+09:00,モーサイ,mcyclist,モーサイ,844,"オレンジが、赤に！ ほかの色はそのまま ■「V-STROM 250SX」「ソノマレッドメタリック」（QSB） スズキ株式会社は「V-STROM（ブイストローム）250SX」のカラーリングを変更して2024年11月21日に発表、11月28日より発売する。 変更色の赤「ソノマレッドメタリック」（QSB）、継続色の黄「チャンピオンイエローNo.2」（YU1）、同じく継続色の黒「グラススパークルブラック」（YVB）の、3色での展開となる。これまであったオレンジの車両が赤に替えられたのが大きな変更点だ。 また、メーカー希望小売価格がこれまでの569,800円から22,000円増の、591,800円に変更された。 【 画像ギャラリー 6枚】アドベンチャーツアラー「V-STROM 250SX」が色変更！新設定「ソノマレッドメタリック」の鮮やかな赤が眩しい！……の写真を見る！ 「V-STROM 250SX」は、ツーリングでの快適性や未舗装路での走破性、日常での扱いやすさを兼ね備えたスポーツアドベンチャーツアラー。同ジャンル同排気量クラスで先行発売されていた水冷並列2気筒の「V-STROM 250」に対し、2023年8月に油冷単気筒バージョンとして「V-STROM 250SX」の名で発売された。 その搭載する軽量でコンパクトな油冷249cm3単気筒SEP（SUZUKI ECOPERFORMANCE）エンジンは、低速からの力強い加速性能を実現、扱いやすい特性とされている。ボディーは、V-STROMシリーズ共通の特長的な口ばしデザインや視認性が高く印象的なLED ヘッドランプを採用し、タフさと無骨さを表現。また、軽量でシャープなシャシーとコンパクトな車体レイアウトにより、良好なハンドリングと軽快な走りを得ている。未舗装路での走破性に貢献する19インチのフロントホイールと専用設計のセミブロック調パターンのタイヤも採用されている。製造国はインド。 レポート●モーサイ編集部 写真●スズキ",[],[]
軽快スポーツフルフェイス「Z-8」シリーズに新グラフィック「YAGYO」が追加！パーツ怪異イラストがかわいい！（モーサイ）,https://news.yahoo.co.jp/articles/2e24e413a78180ccd920e6dd913ceb6933f67e3c,https://newsatcl-pctr.c.yimg.jp/t/amd-img/20241121-00010001-mcyclist-000-1-view.jpg?exp=10800,2024-11-21T07:05:36+09:00,2024-11-21T07:05:36+09:00,モーサイ,mcyclist,モーサイ,896,"ポップな怪異の体にはバイクのパーツが！ ■「Z-8 YAGYO」 TC-2（BLUE／ORANGE） ヘルメット製造大手の株式会社SHOEIは軽快フォルムで快適なスポーツライディングを得られるフルフェイスヘルメット「Z-8（ゼット-エイト」シリーズに、 新たなグラフィックモデル「YAGYO（ヤギョウ）」を追加し、発売する。 SHOEIからの発表はないが、「YAGYO」は「百鬼夜行」の「夜行」のことか？ よく見るとイラストの怪異は、マフラー、スプロケット、ブレーキローターなど、バイクパーツとの組み合わせで体が作られていて、恐ろしいというよりむしろポップでかわいい。すでに廃盤となっている「Z-8 MURAL」（白地バックにライトな怪異のアートが描かれている）の後継イラストと思える雰囲気を放っている。 ベースとなる「Z-8」は視界や操作性を向上させた新たなシールドシステムや、効果的な走行風の導入・排気による高効率ベンチレーションシステムなど、より一層の「快適性能」を追求したモデル。コンパクトさと軽さ、そして快適性能を誇る。 【 画像ギャラリー 4枚】軽快スポーツフルフェイス「Z-8」シリーズに新グラフィック「YAGYO」が追加！パーツ怪異イラストがかわいい！……の写真を見る！ ○「Z-8 YAGYO」製品概要 ・規格：JIS規格 ・サイズ：XS（53cm）、S（55cm）、M（57cm）、L（59cm）、XL（61cm）、XXL（63cm） ・カラー：TC-2（BLUE／ORANGE） ・構造：AIM＋（Advanced Integrated Matrix Plus Multi-Fiber） 強靱なガラス繊維と3次元形状とした有機繊維の複合積層構造を基に、高い弾性性能を持つ高性能有機繊維をプラス、軽量でありながらも剛性弾性に優れる高性能なシェル構造。 ・付属品：布袋、ブレスガード、チンカーテン、シリコンオイル、防曇シート、スペア防曇シート用ピンセット、SHOEIロゴステッカー ・価格：74,800円（2025年2月発売予定） レポート●モーサイ編集部 写真●SHOEI",[],[]
【SHOEI】システムヘルメット「NEOTEC 3」に新グラフィックモデルの「ANTHEM（アンセム）」が設定された！（モーサイ）,https://news.yahoo.co.jp/articles/afe239143c6711d150c4d6626cbcbfdb79a22437,https://newsatcl-pctr.c.yimg.jp/t/amd-img/20241121-00010000-mcyclist-000-1-view.jpg?exp=10800,2024-11-21T07:05:22+09:00,2024-11-21T07:05:22+09:00,モーサイ,mcyclist,モーサイ,769,"フルフェイスに見えてしまう秀逸なデザイン ■「NEOTEC3 ANTHEM」 TC-3（YELLOW／BLUE） ヘルメット製造大手の株式会社SHOEIは、システムヘルメット「NEOTEC 3」に新グラフィックモデルの「ANTHEM（アンセム）」をラインナップに加えた。 「ANTHEM」は聖歌を意味する言葉だが、ヘルメットデザインのテーマとなっている。 「NEOTEC 3」は機能性と快適性、安全性がひとつになったシステムヘルメット。密閉性を追求したデザインは、フェイスカバーやパーツがシェルとシームレスにつながり、一体感のある形状となっている。 【 画像ギャラリー 6枚】【SHOEI】システムヘルメット「NEOTEC 3」に新グラフィックモデルの「ANTHEM（アンセム）」が設定された！……の写真を見る！ ○「NEOTEC3 ANTHEM」製品概要 ・規格：JIS規格 ・サイズ：S（55cm）、M（57cm）、L（59cm）、XL（61cm）、XXL（63cm）、XXXL（65cm） ・カラー：TC-3（YELLOW／BLUE）、TC-5（BLACK／SILVER）、TC-8（ORANGE／BLACK）、TC-10（BLUE／RED） ・構造：AIM＋（Advanced Integrated Matrix Plus Multi-Fiber） 強靱なガラス繊維と3次元形状とした有機繊維の複合積層構造を基に、高い弾性性能を持つ高性能有機繊維をプラス、軽量でありながらも剛性弾性に優れる高性能なシェル構造。 ・付属品：布袋、ブレスガードK、シリコンオイル、防曇シート、サービスツール、SHOEIロゴステッカー、スペア防曇シート用ピン ・価格：91,300円（2025年2月発売予定） レポート●モーサイ編集部 写真●SHOEI",[],[]
