headline,mainEntityOfPage,image,datePublished,dateModified,author,media_en,media_jp,str_count,body,images,external_links
金沢で道路の一部が崩落　大雨の峠越えるも土砂崩れには引き続き注意（テレビ金沢）,https://news.yahoo.co.jp/articles/dbfbd8829ec84c2d2c715e5d49743acf5e64066c,https://newsatcl-pctr.c.yimg.jp/t/amd-img/20240624-04723863-ktk-000-2-thumb.jpg?exp=10800,2024-06-24T18:30:01+09:00,2024-06-24T18:34:20+09:00,テレビ金沢,ktk,テレビ金沢,521,\nテレビ金沢NEWS\n23日の県内は大雨となり、金沢市内の道路で路肩が崩れるなど被害が出ました。\n大雨の峠は越えましたが、地震で地盤が緩んでいる所があり、25日以降も土砂崩れに注意が必要です。\nテレビ金沢NEWS\n活発な梅雨前線の影響で、23日の県内は大雨となり、降り始めから24日午後1時までの降水量は、白山市白峰で184.5ミリ、金沢市で127ミリとなっています。\n山下実々 記者：\n「金沢市大桑町です。23日の雨の影響で道路の一部分が崩れ落ち、片側通行となっています」\n\n道路を管理する石川県央土木総合事務所によりますと、能登半島地震で亀裂が入り、そこに雨水が入って浸食されたことが崩れた原因の一つだということです。\nまた、内灘町の西荒屋地区では、住宅兼倉庫で1カ所、そのそばの倉庫1カ所で浸水被害が確認されました。\nいます。\nテレビ金沢NEWS\n内灘町消防本部によりますと、地震による液状化で地割れしたところから水が入ったとみられています。\n気象台によりますと、25日は加賀・能登ともに明け方から昼前まで雨が降る所がある見込みです。\n\n地震で地盤の緩んでいる所があり、土砂崩れに注意を呼びかけています。,"['https://newsatcl-pctr.c.yimg.jp/t/amd-img/20240624-04723863-ktk-001-2-view.jpg?exp=10800', 'https://newsatcl-pctr.c.yimg.jp/t/amd-img/20240624-04723863-ktk-002-2-view.jpg?exp=10800']","['https://news.yahoo.co.jp/articles/dbfbd8829ec84c2d2c715e5d49743acf5e64066c/images/000', 'https://news.yahoo.co.jp/articles/dbfbd8829ec84c2d2c715e5d49743acf5e64066c/images/001']"
和倉温泉の復興へ向け　地域住民も参加するまちづくり協議会が発足（テレビ金沢）,https://news.yahoo.co.jp/articles/5e26b2560807fa7ec2be0ecf79d484cf65ca831c,https://newsatcl-pctr.c.yimg.jp/t/amd-img/20240624-06597429-ktk-000-2-thumb.jpg?exp=10800,2024-06-24T19:06:00+09:00,2024-06-24T19:20:23+09:00,テレビ金沢,ktk,テレビ金沢,461,\nテレビ金沢NEWS\n元日の能登半島地震で大きな被害を受けた七尾市の和倉温泉の復興に向けて旅館や商店、関係団体などによる協議会が発足しました。\n\nこの協議会は、外部の専門家の意見や地域住民の参画も促しながら持続可能な温泉地を目指すもので、23日の初会合には旅館や商店の経営者をはじめ行政や金融機関、大学などおよそ60人が出席しました。\nことし2月に若手経営者を中心とした会議で策定した「復興ビジョン」をもとにその具体化を図ります。\nまた、来月から月1回、地元住民と意見交換をする「和倉トーク」を開き、来年2月頃に復興プランの発表を目指すという事です。\nテレビ金沢NEWS\n和倉温泉創造的復興まちづくり推進協議会・多田健太郎 代表：\n「お客さんだけでなくて住民も楽しく暮らせる若い小学校中学校の子どもたちがこの街に住んで自分たちはこういう街にするんだと未来を描けるようなそんな温泉地にしていきたい」\n\nまた、住民参加によるワークショップも開かれ、復興に向けて、それぞれのアイディアを出し合っていました。,['https://newsatcl-pctr.c.yimg.jp/t/amd-img/20240624-06597429-ktk-001-2-view.jpg?exp=10800'],['https://news.yahoo.co.jp/articles/5e26b2560807fa7ec2be0ecf79d484cf65ca831c/images/000']
約100日ぶりに行方不明者の捜索再開　輪島市の大規模土砂崩れ現場（テレビ金沢）,https://news.yahoo.co.jp/articles/7d8311f0801b1ae58bee564e86437745643f21bd,https://newsatcl-pctr.c.yimg.jp/t/amd-img/20240624-02359352-ktk-000-2-thumb.jpg?exp=10800,2024-06-24T18:24:01+09:00,2024-06-24T18:28:18+09:00,テレビ金沢,ktk,テレビ金沢,597,\nテレビ金沢NEWS\n元日の能登半島地震で大規模な土砂崩れが発生した輪島市の市ノ瀬町で、警察による行方不明の男性1人の捜索が24日、再開されました。\n元日の地震で大規模な土砂崩れが発生した、輪島市市ノ瀬町。\nテレビ金沢NEWS\n市川栞キャスター：\n「およそ1キロにわたって土砂が崩れ落ちた輪島市市ノ瀬町の現場です。こちらでは今朝から重機が土砂を運び出す作業を行っています」\n\n24日、県警や工事関係者などおよそ50人態勢で行方不明者の捜索活動が再開されました。\n行方が分かっていないのは、住民の垣地英次さん56歳。\nテレビ金沢NEWS\n県警では、震災当初から捜索活動を続けていましたが、現場の安全を確保するため3月上旬に活動を中断していました。\nその後、市ノ瀬町では、土砂崩れにより発生した土砂ダムに仮設水路が整備されたことなどから、安全が確保されたとして、24日、捜索活動を再開しました。\n\nその様子を、垣地さんの兄・弘明さんが見守っていました。\nテレビ金沢NEWS\n垣地 弘明さん：\n「また再開することで弟が見つかる、少しでも光が見えたなと思ってます」\n\n捜索は、今後、日曜日を除いて毎日行われる予定です。\n輪島市内では、垣地さんを含めて3人の行方がいまも分かっておらず、警察は、ほかの場所についても安全が確保され次第捜索活動を再開するとしています。,"['https://newsatcl-pctr.c.yimg.jp/t/amd-img/20240624-02359352-ktk-001-2-view.jpg?exp=10800', 'https://newsatcl-pctr.c.yimg.jp/t/amd-img/20240624-02359352-ktk-002-2-view.jpg?exp=10800', 'https://newsatcl-pctr.c.yimg.jp/t/amd-img/20240624-02359352-ktk-003-2-view.jpg?exp=10800']","['https://news.yahoo.co.jp/articles/7d8311f0801b1ae58bee564e86437745643f21bd/images/000', 'https://news.yahoo.co.jp/articles/7d8311f0801b1ae58bee564e86437745643f21bd/images/001', 'https://news.yahoo.co.jp/articles/7d8311f0801b1ae58bee564e86437745643f21bd/images/002']"
地震が及ぼす認知症への影響は？　金沢大学などが対面調査（テレビ金沢）,https://news.yahoo.co.jp/articles/f6583c271b47341d5491277fb29dd4aa0645d6dc,https://newsatcl-pctr.c.yimg.jp/t/amd-img/20240624-08623466-ktk-000-1-thumb.jpg?exp=10800,2024-06-24T19:04:00+09:00,2024-06-24T19:04:00+09:00,テレビ金沢,ktk,テレビ金沢,464,\nテレビ金沢NEWS\n能登半島地震により、認知症の高齢者への影響が懸念されるなか、金沢大学などでは、実際にどのような影響があったのか調査を進めています。\n\n調査を行っているのは、金沢大学 脳神経内科学の小野賢二郎教授や東北大学などです。\n地震が高齢者の認知機能に及ぼした影響を調べるためことし4月から七尾市中島町に住む65歳以上のおよそ2400人にアンケート調査を実施。\n24日からは対面での調査を始め、初日は、およそ90人に対し、問診や認知機能、運動機能などの検査を行いました。\nテレビ金沢NEWS\n金沢大学では、この地域で、2006年から認知症に関する調査を進めていて地震後の結果と比較することで認知機能を低下させる原因を明らかにするとしています。\n\n金沢大学 脳神経内科学・小野賢二郎 教授：\n「今回こういった地震によって健康状態、あるいは我々の専門とする認知機能そういったところにどういった影響を及ぼしているかを今回調査したいと思って始めました」\n\nこの調査は3年間にわたって行われる予定です。,['https://newsatcl-pctr.c.yimg.jp/t/amd-img/20240624-08623466-ktk-001-1-view.jpg?exp=10800'],['https://news.yahoo.co.jp/articles/f6583c271b47341d5491277fb29dd4aa0645d6dc/images/000']
パリで戦う戦士たち　②サッカー女子・北川ひかる～夢舞台への挑戦（テレビ金沢）,https://news.yahoo.co.jp/articles/64bc15206ca4c9befa0343c42359f233c7f5aa6b,https://newsatcl-pctr.c.yimg.jp/t/amd-img/20240624-09847322-ktk-000-2-thumb.jpg?exp=10800,2024-06-24T19:42:01+09:00,2024-06-24T19:48:20+09:00,テレビ金沢,ktk,テレビ金沢,221,\nテレビ金沢NEWS\n東京オリンピックから3年、次の舞台は芸術の都パリ。ここテレ金ミュージアムでは…パリでの躍進を誓う地元出身の名手をご紹介いたします。\n今回ご紹介するのは…サッカー女子金沢市出身の北川ひかる選手です。\n今シーズンは神戸でプレーした北川選手、小学生の頃から夢見たオリンピック。あきらめずに挑み続け、ようやくその舞台にたどり着きました。\n\n※詳しくは動画をご覧ください\n（6月24日放送『となりのテレ金ちゃん』より,[],[]
【のとだより】和倉温泉での小さな応援　七福神に手を合わせ…（テレビ金沢）,https://news.yahoo.co.jp/articles/07305596a293621361b27af185bcb02cfbc739ee,https://newsatcl-pctr.c.yimg.jp/t/amd-img/20240624-07695656-ktk-000-2-thumb.jpg?exp=10800,2024-06-24T16:53:00+09:00,2024-06-24T16:59:19+09:00,テレビ金沢,ktk,テレビ金沢,290,\nテレビ金沢NEWS\n「能登はやさしや土までも」…能登に暮らす人々の心を表現した言葉です。\nどんなに苦しい状況に置かれても、他人のことを思いやり、助け合いを続ける能登の人々。\n被災地となってしまったふるさと。「今の胸の内」「伝えたいこと」…カメラに語っていただきました。\n\n3月に再開した和倉温泉の総湯。地震で大きく変化した町…。そんな町並みの中に地震前と変わらずある「七福神」の石像。穏やかな笑みを浮かべる弁財天に静かに手を合わせる人がいました。願うのはただこの町の復興でした。\n\n※詳しくは動画をご覧ください。\n（6月24日放送『となりのテレ金ちゃん』より）,[],[]
もうすぐ海開き！白山市の海水浴場でゴミ拾いボランティア（テレビ金沢）,https://news.yahoo.co.jp/articles/5e39eb0130ef34ac6f80338ad41beafdf4c80b85,https://newsatcl-pctr.c.yimg.jp/t/amd-img/20240624-09645228-ktk-000-2-thumb.jpg?exp=10800,2024-06-24T16:03:00+09:00,2024-06-24T16:07:19+09:00,テレビ金沢,ktk,テレビ金沢,325,\nテレビ金沢NEWS\n海開きを前に白山市の海水浴場でアミューズメント事業を展開する企業が清掃活動が行いました。\n\nこれは福井や石川などでアミューズメント事業を展開する大西商事が行ったボランティア活動で毎年、海開きを前にしたこの時期に実施しています。\n白山市の小舞子海水浴場には24日朝、青いTシャツ姿の社員ら10人が集まり砂浜に落ちていたプラスチックごみや瓶など拾い集めていました。\nテレビ金沢NEWS\n大西商事・村上幹正 主任：\n「ゴミはちゃんと持ち帰っていただいて次の方楽しまれる方につなげていただければと思います」\n「ここでまた色んな思い出作っていただけたらなと思います」\n\n小舞子海水浴場は7月13日に海開きの予定です。,['https://newsatcl-pctr.c.yimg.jp/t/amd-img/20240624-09645228-ktk-001-2-view.jpg?exp=10800'],['https://news.yahoo.co.jp/articles/5e39eb0130ef34ac6f80338ad41beafdf4c80b85/images/000']
中継　輪島市の土砂崩れ現場　行方不明者の捜索活動再開（テレビ金沢）,https://news.yahoo.co.jp/articles/91993b2fc32ce4eb18583f952c4d5e1249cdfee2,https://newsatcl-pctr.c.yimg.jp/t/amd-img/20240624-01295139-ktk-000-2-thumb.jpg?exp=10800,2024-06-24T11:41:01+09:00,2024-06-24T11:46:20+09:00,テレビ金沢,ktk,テレビ金沢,414,\nテレビ金沢NEWS\n元日の能登半島地震で大規模な土砂崩れが発生した石川県・輪島市の市ノ瀬町で24日、行方不明者の捜索が再開されました。\n現場から中継です。\nテレビ金沢NEWS\n輪島市市ノ瀬町では、元日の地震でおよそ1キロにわたり土砂崩れが発生し、複数の住宅が飲み込まれ、今も、住民の垣地英次さんの行方がわかっていません。\n石川県警は、現場の安全を確保するため一時、捜索活動を中断していましたが、安全が確保されたことから24日、活動を再開しました。\nその様子を、垣地さんの兄・弘明さんが見守っていました。\nテレビ金沢NEWS\n垣地弘明さん：\n「早く出て来いとぐらいですねまだ見つかっておりませんので」\n「弟が見つかる少しの光がみえたなと」\nテレビ金沢NEWS\n輪島市内の山間では、垣地さんを含む3人の行方が今もわかっておらず、警察はほかの場所についても安全が確保され次第捜索活動を再開するとしています。,"['https://newsatcl-pctr.c.yimg.jp/t/amd-img/20240624-01295139-ktk-001-2-thumb.jpg?exp=10800', 'https://newsatcl-pctr.c.yimg.jp/t/amd-img/20240624-01295139-ktk-002-2-view.jpg?exp=10800', 'https://newsatcl-pctr.c.yimg.jp/t/amd-img/20240624-01295139-ktk-003-2-view.jpg?exp=10800']","['https://news.yahoo.co.jp/articles/91993b2fc32ce4eb18583f952c4d5e1249cdfee2/images/000', 'https://news.yahoo.co.jp/articles/91993b2fc32ce4eb18583f952c4d5e1249cdfee2/images/001']"
金沢市出身・大能 寛飛 選手が初のオリンピック出場　新種目「ブレイキン」（テレビ金沢）,https://news.yahoo.co.jp/articles/d0911c94ee2483d3962f461e9b0f60e6cf0ec0d2,https://newsatcl-pctr.c.yimg.jp/t/amd-img/20240624-01761584-ktk-000-2-thumb.jpg?exp=10800,2024-06-24T11:59:01+09:00,2024-06-24T12:03:20+09:00,テレビ金沢,ktk,テレビ金沢,345,\nテレビ金沢NEWS\nパリオリンピック出場をかけ、新種目「ブレイキン」の予選が日本時間未明にハンガリーで行われ、金沢市出身のHiro10こと大能 寛飛 選手が初のオリンピック出場を決めました。\n\n2試合の合計得点で決まるパリオリンピックの出場権。\n金沢市出身の大能 寛飛選手は第1戦で3位に入っていて、残り一枠となった男子代表の座をかけ、最終戦に挑みました。\n大能選手は準々決勝で敗退、6位に終わりましたが、第1戦との合計得点の結果、パリオリンピックの出場権をつかみました。\nテレビ金沢NEWS\n大能選手は金沢市出身の19歳。\n8歳でダンスに出会い、10歳からブレイクダンスを本格的に始めました。\n\nパリオリンピックでのブレイキンは8月9日、10日に行われる予定です。,['https://newsatcl-pctr.c.yimg.jp/t/amd-img/20240624-01761584-ktk-001-2-view.jpg?exp=10800'],['https://news.yahoo.co.jp/articles/d0911c94ee2483d3962f461e9b0f60e6cf0ec0d2/images/000']
