headline,mainEntityOfPage,image,datePublished,dateModified,author,media_en,media_jp,str_count,body,images,external_links
どこまでも、自分らしく！ 現代の若者向け自転車ブランド「COOSA」からCOOSA COMFORTが登場（バイクのニュース）,https://news.yahoo.co.jp/articles/6e424e57590787f60ad9bb053f8c77ec7a5793ad,https://newsatcl-pctr.c.yimg.jp/t/amd-img/20241213-10399817-bikeno-000-1-view.jpg?exp=10800,2024-12-13T17:10:00+09:00,2024-12-13T17:10:00+09:00,バイクのニュース,bikeno,バイクのニュース,1064,現代の若者に向けたブランド ユーザーに快適な自転車ライフを提供するあさひは、2024年11月下旬に「どこまでも、自分らしく」をコンセプトに、若者のニーズを満たし、現代のライフスタイルにマッチした新しい自転車ブランド「COOSA」の新型モデル、「COOSA COMFORT」の販売を開始しました。 【画像】新しい自転車ブランド「COOSA」から新たに登場したコンフォートクロスバイク「COOSA COMFORT」を画像で見る(10枚) 新しい自転車ブランド「COOSA」から新たに登場したコンフォートクロスバイク「COOSA COMFORT」 COOSAブランド最新モデルとなるCOOSA COMFORTは、クッション性の高いパーツを採用し、小さな段差の多い街中をリラックスして走行できるコンフォートクロスバイクです。 昨今、若年層のライフスタイルや価値観が多様化する中、自転車に対するニーズも変化していますが、通学や通勤、休日のアクティビティなど、さまざまなシーンで活躍できる自転車が求められる中、どこまでも「自分らしく」いられるような自転車を提供することで、若者たちのより豊かな日常をサポートしたいという想いから、立ち上げられたのがCOOSAブランドです。 若者は、多様な考え方を持ち、新しいモノや流行に敏感です。自己表現を重視する彼らは、SNSを通じて新しい情報を手に入れ、自分のスタイルを共有し、共感を求めています。 COOSAは、そんな若者たちを体現するブランドで、人と人が交わるように、人と自転車が交わる瞬間を提供し、自己表現を大切にする若者に、コミュニケーションがさらに楽しくなる自転車を届けたいという想いが込められています。 新しい自転車ブランド「COOSA」から新たに登場したコンフォートクロスバイク「COOSA COMFORT」 COOSAをスタートするにあたり、普段は店舗で自転車の販売や修理をしている20代の社内スタッフが中心となったプロジェクトチームを発足。コンセプトから商品開発、販促方法の検討まで、約1年間にわたって意見を交わしました。 人と自転車が交わるだけでなく、人と人が交わることもCOOSAのコンセプトのひとつで、今後も社内の若いスタッフたちの熱い想いが同年代のユーザーに伝わるようなアイテムが発表される予定です。 そCOOSA COMFORTのカラーはブラック、ブラウン、グリーンの3色で、フレームはスチール製、価格(消費税10%込)は4万6200円となっています。 バイクのニュース編集部,[],[]
さらに安全性を向上！ ダイハツが「トール」の新型モデルを発売（バイクのニュース）,https://news.yahoo.co.jp/articles/7b5552a45584b0d9b50cad6bbb66a7679d35cf65,https://newsatcl-pctr.c.yimg.jp/t/amd-img/20241213-10399780-bikeno-000-2-view.jpg?exp=10800,2024-12-13T15:10:00+09:00,2024-12-13T17:15:17+09:00,バイクのニュース,bikeno,バイクのニュース,265,バックが苦手な人も安心！ 2024年12月9日にダイハツが「トール」の安全性能向上など、一部仕様変更した新型モデルを発売しました。 【画像】ダイハツが発売した「トール」の新型モデルを画像で見る(6枚) ダイハツから登場する新型「トール」レーザーブルークリスタルシャイン 新型モデルでは、全車で9インチディスプレイオーディオとバックモニターを標準装備。後退時の安全性能が向上されています。 また、原材料価格の高騰などにより価格の改定。価格(消費税込)は174万2400円から229万4600円となっています。 バイクのニュース編集部,[],[]
父も惚れ込むKAWASAKIの魅力！『Ninja 400 KRT EDITION』にマルチで活躍する北向珠タが、乗ってみました！（バイクのニュース）,https://news.yahoo.co.jp/articles/81dcf82b0d303d7fc8cdda97ffaae00fd761e10b,https://newsatcl-pctr.c.yimg.jp/t/amd-img/20241213-10399359-bikeno-000-2-view.jpg?exp=10800,2024-12-13T12:10:00+09:00,2024-12-13T21:55:15+09:00,バイクのニュース,bikeno,バイクのニュース,966,スポーツモデルに憧れ始めた私が乗る初のカワサキ車 こんにちは！北向珠夕です。 めっきり寒くなってきましたが、皆さんバイクライフは捗っていますか？ 【画像】カワサキのスポーツモデル『Ninja 400 KRT EDITION』を画像で見る（15枚） 私は正直、あまり乗れない日々が続いています（汗） ただ、今年は何だかバイク友達がちょこちょこ増えたので、年末にでもツーリングに誘ってみようかなと思っています。ということで今回も試乗レポートを書かせていただきます！ なんと、今回は初めて試乗するメーカー「KAWASAKI」です。なかなかご縁がなかったカワサキのバイクですが、父がカワサキファンでいつも実家に帰ると「やっぱりカワサキだよなぁ」と言っているのでいつか乗って見たいとずっと思っていました。 ちなみに父はカワサキの大型バイク「ゼファー1100」に乗っています。何度か後ろに乗せてもらったことがありますが、とにかくパワフルだった記憶があります。 カワサキのスポーツモデル「Ninja 400 KRT EDITION」に試乗します そして今回試乗させていただくのは「Ninja 400 KRT EDITION」。街中で一番見かけると言っても過言ではないくらいに人気のバイクですよね。 私の中ではカワサキ＝Ninjaというイメージだったので、いつか乗ってみたいと思っていたバイクの一つでした。しかも、スポーツタイプのバイクに憧れ始めている私にとっては非常にありがたい機会です。 まず見た目は「あ～もうこれこれ！」と言わざるを得ない緑と黒が印象的なNinjaカラー。これはKRT（カワサキ・レーシング・チーム）カラーと言うそうです。 今まではバイクのかっこいい色は黒一択だと思っていたのですが、Ninjaには緑色がもう一つのトレードマークになっていて、この色だからこそ、惹かれるものがありますよね。 ライムグリーンのKRTカラーも印象的！ しかも、このNinjaと言えばのトレードマークのロゴ、習字で書いたような字体になっているののは秘密があるそうで。昔、FAXで送信した時に字がずれてしまった結果、こっちの方がいいんじゃね？となり、今の字体になったそうです（笑） 有名な映画でも使われているこのバイク、色々な歴史があって面白いですね。,[],[]
バイクの電脳「ECU」は、やることがテンコ盛り!?（バイクのニュース）,https://news.yahoo.co.jp/articles/3aebddfe05a30bb4c7fd0ea1854878fa071b985f,https://newsatcl-pctr.c.yimg.jp/t/amd-img/20241213-10399559-bikeno-000-2-view.jpg?exp=10800,2024-12-13T11:10:00+09:00,2024-12-13T13:15:26+09:00,バイクのニュース,bikeno,バイクのニュース,1114,点火制御から始まった、エンジン専用のコンピューター 現行バイクなら原付スクーターからスーパースポーツまで、搭載されているのが当たり前の「ECU」は、「Engine Control Unit（エンジンコントロールユニット）」の略称で、ザックリ言えば、エンジンを制御するための専用コンピューターです。 【画像】「ECU」の画像をもっと見る（9枚） エンジンを制御する「ECU」。メーカーによって「ECM」など呼び名が異なる場合もある ECUという名称が一般化したのは、多くのバイクでエンジンへの燃料供給がキャブレターから電子制御式燃料噴射（FI）に移行した1990年代後半～2000年代前半頃と思われます。しかし、ECUの前身はもう少し早く登場しており、最初はエンジンの“点火タイミング”を制御するパーツでした。 バイクのエンジン（内燃機関）は「吸気→圧縮→爆発（燃焼）→排気」の行程を繰り返して回転します。ガソリンと空気をキャブレターによって「混合ガス」を作り（かつてはキャブレター、現在はFI）、その混合ガスをエンジンが吸い込んで圧縮したタイミングで点火プラグに火花を飛ばして着火・爆発（燃焼）させていました。 ここで問題になるのが“点火のタイミング”です。たとえばエンジンを高回転でスムーズかつパワフルに回すには、シリンダーの中で混合ガスが燃え広がるスピードを考慮して、アイドリングのような低回転の時よりも、点火のタイミングを早める必要があります。 1970年代頃までは機械的に制御していましたが、1980年代頃には電気・電子的に点火タイミングを制御するようになりました……が、まだアナログの範疇でした。 そこで点火タイミングをエンジンの回転数とスロットルの開度や開ける速度に応じて緻密にコントロールするための「点火マップ」をプログラムして、デジタル制御したのが最初のECU的な装置です。 ホンダが1995年に発売した「CB400 SUPER FOUR」の「PGM-IG」の点火マップ ちなみにホンダは「PGM-IG」（電子制御点火装置）という名称でしたが、他メーカーでは“マイコン方式”という懐かしい名称で呼ぶこともありました。 そして前述したように、2000年頃に燃料供給がキャブレターからFIに置き換わったことで、ECUは必須の装備になりました。 キャブレターは単体で物理現象によって混合ガスを作っていましたが、FIはスロットルの開度やエンジン回転数を元に作った「燃調マップ」のプラグラムに応じて、インジェクターがガソリンを噴射するからです。この時点でECUは、点火の制御と燃料噴射の制御の両方を行なうようになりました。,[],[]
初心者ライダー必見！ バイクの足つきとは、いったい何を指すのか？（バイクのニュース）,https://news.yahoo.co.jp/articles/57de96540fb3c088d3b81c23eac40686f0f6b889,https://newsatcl-pctr.c.yimg.jp/t/amd-img/20241213-10399585-bikeno-000-3-view.jpg?exp=10800,2024-12-13T09:10:00+09:00,2024-12-13T11:15:19+09:00,バイクのニュース,bikeno,バイクのニュース,1109,バイク選びで重要となる「足つき」とは バイクを購入する際に不安を抱える点として、バイクをしっかり扱うことができるかという点が挙げられます。またがっても足が全くつかなければ乗りこなすことは困難であるため、またがった際に足がどれくらい地面につくかというのは、バイク選びをする際に最重要項目であるといっても過言ではありません。 【画像】タイプ別シート高を画像で見る（10枚） こうしたバイク選びをしている中で、必ずついて回る「足つき」という言葉がありますが、足つきとは一体どのような意味を持つのでしょうか。 バイクの足つきとは、バイクにまたがった状態で地面に足がしっかりと着けられるかどうかを指した言葉 バイクの足つきとは、バイクにまたがった状態で地面に足がしっかりと着けられるかどうかを指した言葉です。しっかりと足がつくことができるバイクは「足つき性のよいバイク」などと表現されます。 足つき性の良し悪しはバイクの構造により異なり、主に「シート高」と呼ばれる座席の高さが関係しています。足つきがよいかどうかはバイクにまたがり、シートの高さを確認することで良し悪しの判断をすることができますが、カタログに表記された「シート高」を参考にすることでも、足つきがよいバイクかどうかを判断することができます。 なおカタログに表記された数値を参考にする場合、身長が160cmの人でも足がつくと言われているシート高は800mm以下であるとされています。そのため、身長160cm以下の人は800mmより低いシート高のバイクを選択しておくと安心です。 シート高が800mmより低く設計されているバイクといえば、アメリカンやネイキッドといった、ゆったりとした自然な姿勢で乗れるバイクが挙げられます。 シート高が低く設計されているアメリカンタイプのバイク アメリカンといえば、もっとも代表的なものに「ハーレーダビッドソン」を思い浮かべる人は多いでしょう。しかし国内メーカーにもヤマハの「ドラッグスター」や、ホンダの「シャドウ」や「マグナ」、「レブル」といったように、アメリカンタイプのバイクは多く存在します。 どの車種も複数の排気量が設定されていますが、排気量が大きいものを選択したとしても、シート高が低く足つき性のよいバイクが多く見受けられます。 また、ネイキッドの場合も足つき性がよく設計されているものが多くあります。たとえば教習所などでよく使用されているホンダの「CB」シリーズには1300ccもラインナップされていますが、400ccなどの排気量の小さなバイクは車体が小さく設計されているため、シート高も低く設計されている傾向にあります。,[],[]
カワサキ「Z2」走行僅かでも「排気バルブガイド」にはガタが発生!! ～日本の至宝「空冷4発」を未来へ継承～Vol.26（バイクのニュース）,https://news.yahoo.co.jp/articles/1ae2eefacce297476f5af4633af44bf0126ded57,https://newsatcl-pctr.c.yimg.jp/t/amd-img/20241213-10399845-bikeno-000-4-view.jpg?exp=10800,2024-12-13T08:10:00+09:00,2024-12-13T20:35:10+09:00,バイクのニュース,bikeno,バイクのニュース,1101,ガンコートペイント前に施しておいた内燃機加工 筆者の所有するカワサキ「Z2」に搭載されたエンジンは、Z1E仕様＋αのパワーアップを目論見、完全分解しました。 【画像】カワサキ「Z2」内燃機加工前の段取りを画像で見る（10枚） 実は、バラバラに分解したもうひとつの理由は「薄汚いエンジンのリペイント」でした。ブラックペイントが剥がれ、場所によっては腐食でパリパリ割れて、白い粉が発生……。特に、エンジンナンバーの打刻周辺は腐食が酷く、肉眼で「Z2E－」以降の打刻数字が読みとりにくい状況となっていました。 時系列的には組み立て後の画像になりますが、ほぼ完成したコンプリートエンジンになります。分解前の薄汚かったエンジンと比べて、相当に美しい仕上がりを得ることができました。車体に搭載して、走れる日が楽しみです そこで、完全分解したエンジン部品にはDIYでサンドブラスト処理を施し、ペイント前の下地作りを実施してから、内燃機加工を依頼しました。このブラスト処理に関しては、地肌が汚れずに済むので、内燃機加工後に実施した方が良いケースもあります。 しかし、アルミ地肌を輝かせるガラスビーズ仕上げの時でも、ペイント仕上げの時でも、いずれの場合でも、アルミナメディアによるサンドブラスト処理＝下処理を施した後に、内燃機加工を依頼するようにしています。ある程度まで下仕上げしておくことで、後々の本仕上げが、圧倒的に楽になるのがその理由になります。 様々なご意見があるとは思いますが、内燃機加工依頼前に、アルミナメディアによるサンドブラスト「下処理」（仕上げの前段階）を行いました。ガンコートによるブラック仕上げを想定したアルミナ仕上げになりますが、この段階まで下処理した後に内燃機加工依頼しました また、ペイント剥がれや汚れを落とすことで、汚れていたときには気が付かなかったような、何らかのトラブル要素を見つけることもできます。 特に、燃焼室などは、カーボンやオイルスラッジが付着した状態では、クラックなどなど、細部のトラブルを発見しにくいことが多いです。ひとそれぞれで考え方は異なると思いますが、ぼくの場合は、仕上げ前の段取り状況まで進めてから、内燃機加工を依頼します。そして、加工終了後に表面仕上げ(ペイントなりガラスビーズショットなり)を行うようにしています。 内燃機加工の世界も日進月歩 内燃機加工はiB井上ボーリングさんへ依頼しました。シリンダーヘッドは、吸排気バルブガイドの入れ換えとシートカットになります。吸排気バルブは再利用しますので、バルブシートと当たるバルブフェースの研磨加工をお願いしました。,[],[]
世界限定750台の特別仕様車 トライアンフ「BONNEVILLE BOBBER TFC」発表（バイクのニュース）,https://news.yahoo.co.jp/articles/a1ffa9fd492ca1740a7e03e533713fc86d69b289,https://newsatcl-pctr.c.yimg.jp/t/amd-img/20241213-10399792-bikeno-000-1-view.jpg?exp=10800,2024-12-13T07:10:00+09:00,2024-12-13T07:10:00+09:00,バイクのニュース,bikeno,バイクのニュース,1028,外観のみならず足回りもアップデート トライアンフモーターサイクルズジャパンは、トライアンフ ファクトリー・カスタム（TFC）による特別仕様の限定モデル「BONNEVILLE BOBBER TFC（ボンネビル・ボバー・ティーエフシー）」を発表しました。 【画像】世界限定750台のトライアンフ「BONNEVILLE BOBBER TFC」を画像で見る（12枚） 同モデルは世界限定750台で、2024年12⽉より正規販売店にて販売開始予定です。 世界限定750台のトライアンフ「BONNEVILLE BOBBER TFC」 2017年に登場したBonneville Bobberは、最高出力78 PS ／6100 rpm、最大トルク106Nm／4000romを発揮する排気量1200cccのバーチカルツインエンジンを搭載するネオクラシックネイキッドモデルです。 世界限定750台のトライアンフ「BONNEVILLE BOBBER TFC」 クラシカルでありながら、秀逸なエンジニアリング、クラストップのテクノロジーと機能性を持つモデルとして、新たなファンを開拓してきたBonneville BobberをベースにしたTFCでは、ハンドペイントのマーブルゴールドテクスチャーのアクセントをあしらった、ユニークなツートンペイント仕上げのガソリンタンクやカーボンファイバー製のエンドキャップを備えるマットブラックのスラッシュカットされたアクラポビッチ製サイレンサーを採用。 フロントとリアにオーリンズ製のハイスペックサスペンション、ブレンボ製ラジアルモノブロックブレーキとブレンボ製MCSマスターシリンダーを搭載することで、標準モデルから大幅な軽量化を実現しています。 また、光沢仕上げのリアルカーボンファイバー製サイドパネルとマッドガードステーを装備するTFCではビレット加工のエンジンカバーバッジとゴールドカラーのチェーン、トライアンフのトライアングルロゴがエンボス加工されたブラックのプレミアムレザーシート、シリアルナンバー入りのバッジが付いたトップブリッジも採用されています。 世界限定750台のトライアンフ「BONNEVILLE BOBBER TFC」 そのほか、スポーツ、ロード、レインの3種類のライディングモードも搭載されたBONNEVILLE BOBBER TFCの価格（消費税10%込）は249万9000円となっています。 バイクのニュース編集部,[],[]
