headline,mainEntityOfPage,image,datePublished,dateModified,author,media_en,media_jp,str_count,body,images,external_links
「オーイ! とんぼ」はサブキャラクターやサイドストーリーが魅力!? ラグビー界のレジェンドがハマった「島編」とは?【TVアニメスタート記念インタビュー⑤大畑大介】（みんなのゴルフダイジェスト）,https://news.yahoo.co.jp/articles/0dfce6e37af49f2893c10836f40936c824943bca,https://newsatcl-pctr.c.yimg.jp/t/amd-img/20240404-00010003-minnagolf-000-1-view.jpg?exp=10800,2024-04-04T11:32:16+09:00,2024-04-04T11:32:16+09:00,みんなのゴルフダイジェスト,minnagolf,みんなのゴルフダイジェスト,2500,"\nサブキャラクターやサイドストーリーを""愛する""ラグビー界のレジェンド・大畑大介\n週刊ゴルフダイジェストの人気ゴルフ漫画「オーイ! とんぼ」のテレビアニメが4月6日（土）朝10時にテレビ東京系列でスタートする。放送に先駆け「とんぼ」を愛読し、""とんぼ愛""を語りたい著名人にインタビューを敢行。初回放送まで、毎日7回に分けて紹介していく。5回目は、ラグビー元日本代表で同誌上で連載を持っていた大畑大介さんをお届けする。\nGD 「オーイ! とんぼ」は「週刊ゴルフダイジェスト」で読んでくださっていたんですよね。\n\n大畑 そうそう。その後、単行本も読んで。これだけしっかり漫画を読んだのは『北斗の拳』以来かも（笑）。\n\nGD 自分に近いと思うキャラクターはいましたか?\n\n大畑 そりゃ、とんぼでしょ。競技は違うけど、俺もクラブ3本でゴルフをするタイプです（笑）。\n\nGD とんぼは3鉄1本でプレーしていました。大畑さんの現役時代もプレースタイルは自由奔放というか……。\n\n大畑 「曲がるんだったら、もっと曲げたれ」みたいなプレーです。スキルをチャート表にしたら明らかにいびつな形になる選手でした。走力が飛び出ていて、ディフェンス力が低い。ボールを持って走るだけしか能がないような選手だったんです。さすがに徐々にいびつさは解消されていきましたが。\n\nGD 出る杭だったでしょうねえ。\n\n大畑 だいぶ出ていたかも（笑）。\n\nGD でも、出すぎた杭は打たれませんからねえ。ちなみに、とんぼ以外に気になるキャラクターを挙げるとしたら?\n\n大畑 多いからなあ。例えば、島に残った（肥後）亘くんが今どうしているか気になる。だって、とんぼねーちゃんにあんなにストレートな告白したんですよ。\n\nGD 「結婚したいぐらい好き」だと言いましたからねえ。\n\n大畑 あれ以来、ほとんど登場してないけど、あんなこと言ったんだから島で頑張ってて、そのうち島からやって来るんちゃう? \n\nGD すごいイケメンに成長したりして（笑）。\n\n大畑 亘だけじゃなく、ともかくキャラクターたちの人間模様がいいのよ。「トカラ編」「熊本・日本女子アマ編」「トヨタジュニア編」……と、どんどん魅力的なキャラクターが出て来るでしょ。\n\nGD 誰かに感情移入したりしますか? やっぱりとんぼ?\n\n大畑 それが、いつも「この人」っていうんじゃなく、自分の精神状態によって“ハマる人”が違うんですよ。僕はアスリートとしてずっとやってきて、精神的に参っているとき、ケガをしているときなど、いろんな状況の経験があります。その経験にハマる人がいるんですよ。「俺もこんなときがあったわー」みたいな。例えば、俺は両方のアキレス腱を切った経験がありますが、それこそワニに噛まれた（栗須）エマみたいな。将来はコース設計家になりたいと言っていた子（築山嬉々）もいたけど、自分も現役を引退してセカンドキャリアを考えている頃のことを思い出したり。年齢的には、とんぼたちは娘世代だから、自然と親目線になることもある。だからイガイガの気持ちがわかったり。\n\nGD とんぼだけじゃない、サブキャラクターがみんなイキイキしていますよね。\n\n大畑 それぞれのサイドストーリーがいいのよ。それだけでお話になるんじゃないかという。\n\nGD スピンオフ! やれそうですね。このキャラのスピンオフが見たいというのはありますか?\n\n大畑 そりゃあ、亘くんでしょ。\n\nGD 好きですねえ、亘くん。\n\n大畑 でも、とんぼは、料理人志望のあの子（瀬名一馬）と、ちょっといい感じになったりもしたでしょ。そのあたりは、親目線で気になります（笑）。\n\nGD ふふふ。イガイガ目線ですね。\n\n大畑 でも、基本、俺はとんぼやから。\n\nGD 大畑さんがラグビーを始めたのは小学生のとき?\n\n大畑 小3でラグビースクールに入りました。\n\nGD 小さいころから足が速く、学校でも人気者だったでしょう?\n\n大畑 それが、俺、小学校の頃、友達いなかったんですよ。\n\nGD えー、クラスで一番の人気者だったのでは?\n\n大畑 それは後々の話（笑）。俺は大阪の生まれ育ちですけど、野球少年ではなくてタイガースファンじゃない。そんな子に居場所はなかったんですよ、当時は。みんなと一緒のことがどうしてもできなくて……。でも、みんなに自分のことを知ってほしい、興味を持ってほしいというのはあったんです。\n\nGD それでラグビーを?\n\n大畑 親父が学生時代ラグビーをしていたこともあり、野球以外の身近なスポーツといえばラグビー。それで、親父が知り合いに頼んでラグビースクールを探してくれたんです。実家から電車とバスで1時間ぐらいかかるんで、大冒険ですよ。ほんと、とんぼが島から出るような、それくらいの感覚でした。最初は「こんにちは」もうまく言えなくて……。でも、最初の練習でグラウンドの端から端まで走るっていうのがあって。そしたら自分が一番速かった。そこからみんなが話しかけてくれるようになって。やっとできたんですよ、自分の居場所が。だから、まさに、とんぼの「島編」みたいな感じやったんですよ。外の世界を見てみたい、でも勇気がない、みたいな。だから、さっきは「イガイガ目線になる」って言ってたけど、島編を読んでいるときは完全にとんぼ目線。\n\nGD とんぼも最初は島から出たくないと言っていましたが、島を出たことによって世界が大きく広がりました。\n\n大畑 俺もまったく同じ。競技がゴルフかラグビーかっていう違い。あと、外に連れ出してくれたのがイガイガか親父か、っていう。俺にとってのイガイガは、ラグビースクールに送り出してくれた親父だったんです。\n\nGD なんていい話。後編に続きます……。\n\n※週刊ゴルフダイジェスト2024年4月2日号「私たち”とんぼ推し”です」より\n週刊ゴルフダイジェスト",['https://newsatcl-pctr.c.yimg.jp/t/amd-img/20240404-00010003-minnagolf-000-1-view.jpg?pri=l&w=640&h=426&exp=10800'],['https://news.yahoo.co.jp/articles/0dfce6e37af49f2893c10836f40936c824943bca/images/000']
上体の捻転不足やフライングエルボーを防ぐには「オンプレーンに沿って振る」意識を持ってみよう！ プロがイラストを交えて解説（みんなのゴルフダイジェスト）,https://news.yahoo.co.jp/articles/2858fa58e86b1c43ec4394211f5d24312568198b,https://newsatcl-pctr.c.yimg.jp/t/amd-img/20240404-00010002-minnagolf-000-1-view.jpg?exp=10800,2024-04-04T07:31:30+09:00,2024-04-04T07:31:30+09:00,みんなのゴルフダイジェスト,minnagolf,みんなのゴルフダイジェスト,1497,\n右肘が浮くフライングエルボーが起こると、上体が回らず手でクラブを下ろすことになってしまう\nゴルフスウィングでは「胸を回す」ことが大事とよく言われる。上体を捻転させるために覚えておきたい「体の使い方」を、プロゴルファー・大谷奈千代にイラストを交えて詳しく解説してもらおう。\nトップで右の肘が浮いた形をフライングエルボーと呼び、多くの場合スウィングエラーと評価されています。その理由はバックスウィングの途中で右の肘が浮いてしまうと右肩が前に出てしまうことで、体は回りたくても回れない体勢になってしまうからです。\n\nバックウィングで体が回らないと上体の捻転不足になってしまいます。バックスウィングでの捻転にはパワーをため込む役割があるので、捻転不足は飛距離ロスの原因になってしまいます。\n\n体の捻転がない状態でトップを迎えてしまうと、どんなに体を使いたくてもインパクトに向かって手でクラブを下ろすしか出来ません。\n\nインパクトに向かって、上半身と下半身の捻転差が出来なくなってしまうとクラブを通すスペースを確保することができないので気持ちよくスウィングすることができなくなってしまいます。\n\n上記の理由から、バックスウィングでの捻転不足はスウィング全体に大きな影響があるので注意が必要です！\n飛球線後方に向かって手をまっすぐ動かして打つのはNG。体の回転に手が逆らう形となり、フライングエルボーになってしまう\nしかし、ボールを目の前にすると、どうしてもターゲットの方向に対して直線的に手を動かして打ちたくなりがちです。飛球線後方に向かって手をまっすぐに動かしてしまうと、右の肘が浮き、手が体の回転に逆らった状態になってしまうのでバックスウィングでの捻転不足の原因となってしまいます。こうなってしまうと、インパクトに向かってカット軌道になるのでさまざまなミスショットを引き起こしてしまいます。\n\nゴルフは軸回転運動ですが、前傾姿勢があるので正しいスウィング軌道は3Dを描きます。イラストBのように、斜めに前傾されたフラフープのイメージがゴルフスウィングにおけるまっすぐの軌道です。\nオンプレーンに振ることができれば、手元・クラブの軌道は自分を中心とした楕円形のフラフープのような形となる\nこのスウィング軌道が作る平面にクラブを通すことをオンプレーンと呼んでいます。多くの方にオンプレーン軌道を実際にご体験いただくと、肩まで手が上がってきた際、クラブが開いて動いているように感じるので『右に飛んでいってしまいそう』な感覚があるようですが、それこそがゴルフスウィングにおけるまっすぐの軌道なので、ボールはまっすぐに飛んでいきます。\n\n私自身も昔、『ゴルフは自分が思ったことと反対のことをしたほうがうまくいく』と教わったことがあったのですが、そこにはこういった理由があってっこその助言だったのです。\nオンプレーン軌道に沿って手が動けば、胸も回っていく\nオンプレーンに沿って手が動くことができれば、正しいスウィング動作によって胸が回ってきます。この胸が回ることはとても重要でスウィングの捻転を作り出すことに必要不可欠です！ 胸周りは日頃あまり動かさないので、動けるようにしっかり体操を行なっておきましょう！\n\nまっすぐに対する誤解がある方はたくさんいらっしゃいます。お心当たりがある方は是非ゴルフスウィングのまっすぐ軌道であるオンプレーンをご確認されてみて下さい。ご自身の伸び代ポイントを発見することができる可能性がありますよ！ 是非お試し下さい！\n大谷奈千代,"['https://newsatcl-pctr.c.yimg.jp/t/amd-img/20240404-00010002-minnagolf-000-1-view.jpg?pri=l&w=640&h=480&exp=10800', 'https://newsatcl-pctr.c.yimg.jp/t/amd-img/20240404-00010002-minnagolf-001-1-view.jpg?pri=l&w=640&h=480&exp=10800', 'https://newsatcl-pctr.c.yimg.jp/t/amd-img/20240404-00010002-minnagolf-002-1-view.jpg?pri=l&w=640&h=480&exp=10800', 'https://newsatcl-pctr.c.yimg.jp/t/amd-img/20240404-00010002-minnagolf-003-1-view.jpg?pri=l&w=640&h=480&exp=10800']","['https://news.yahoo.co.jp/articles/2858fa58e86b1c43ec4394211f5d24312568198b/images/000', 'https://news.yahoo.co.jp/articles/2858fa58e86b1c43ec4394211f5d24312568198b/images/001', 'https://news.yahoo.co.jp/articles/2858fa58e86b1c43ec4394211f5d24312568198b/images/002', 'https://news.yahoo.co.jp/articles/2858fa58e86b1c43ec4394211f5d24312568198b/images/003']"
【ゴルフばか日誌 #7】何事も油断は禁物? 豪快な景色に見惚れていると往復ビンタを頂くことに（汗）（みんなのゴルフダイジェスト）,https://news.yahoo.co.jp/articles/6f7061d2833ec5efd071b7289378ce4b5ef2ded3,https://newsatcl-pctr.c.yimg.jp/t/amd-img/20240404-00010007-minnagolf-000-1-view.jpg?exp=10800,2024-04-04T19:00:33+09:00,2024-04-04T19:00:33+09:00,みんなのゴルフダイジェスト,minnagolf,みんなのゴルフダイジェスト,2810,"\n向かって左から本人、小林正明さん、萩原透さん、斉藤六輔さん\n""下道＆車中泊""で2100を超える全国のゴルフ場完全制覇に挑戦中の62歳の現役サラリーマン・木村公一さん。自身を漢字から「はむいち」と自己紹介する。漫画『釣りバカ日誌』のハマちゃんこと浜崎伝助が「釣りバカ」なら、はむちゃんは「ゴルフばか」。そんな「はむちゃん」の痛快(!?)ゴルフ人生を綴った「ゴルフばか日誌」の第7話目です!\nトーナメント会場近くのルートを選んで西下\n3月30日（土）16時に清州城を出発。いつも同じ道ばかりでは飽きるので、大回りは覚悟の上で甚目寺観音→美和町→津島→東海大橋を渡って四日市へ。ちょうどこの時間、車内には東建ホームメイトカップの試合模様がテレビ音声で流れていて、だからなのか、クルマが勝手に会場の東建多度カントリークラブの近くを走ろうと考えたのでした。多分（笑）。音声では、アマチュアで早稲田大の中野麟太朗が2番アイアンで270ヤード飛ばしてトップタイ、と報じていました。\n東海大橋を渡って国道258号を四日市へ抜けるルート。いつも使うルートより40分遠回りしたものの、初めての道、初めての景色に触れてけっこう満足。国道23号から1号線に入り、名阪国道一宮伊賀を右折、木津川へ。\n\n19時40分、伊賀のファミマで夕食のおむすびセット338円、豆乳113円、カップみそ汁110円を買い、車中でいただく。21時半に寝屋川を通過し、道の駅「神戸フルーツ・フラワーパーク大沢」に23時半到着。出発から7時間下道ですぐ爆睡。駐車場にはすでに50台が。\n\n3月31日（日）6時起床、三木市→加古川バイパス→岡山へ入り、長船CCまで120キロを一気に走る。朝食は途中のローソンで1番安いカップ味噌ラーメンと1番安いおにぎり。運転しながら食べて、コースには9時到着、10時34分アウトスタート。\nしぶこがジュニア時代に切磋琢磨したコース\nプラチナ会員の欄にしぶこプロの名前が\n長船CCはご存じ、あの渋野日向子がジュニア時代に毎日練習に励んだコース。クラブハウス内のメンバーボードにもプラチナ会員の欄に名前が掲示してありました。岡山三大河川の1つ、吉井川の河川敷にあるコースは風が強く、超アゲインストのあとは超フォローが連続するレイアウトで風に慣れていたから海外で活躍できたのかも。\nグリーンは高麗で小さめ。速くなく、遅くなく、常連の同伴者・萩原透さん曰く「よい高麗グリーン」の表現がぴったり。カップ周りで急に方向転換するのでしっかり打たないと入らない「プチ全英」とも。言い得て妙。萩原さん、冬場しかラウンドしないそうなのにめっちゃ上手い。36・43の79。\n9番580ヤードパー5に「しぶこの木」があった。ティーイングエリアから240ヤード地点。この木をオーバードライブしないと2打目が打ちにくいのは見た目にも想像がつく。私は購入したばかりのローズゴルフMOE86、300ccのミニドライバーを一閃、フォローの風も味方して木越えの260ヤードは超嬉しかった。\n9番ホール240ヤード先にあるしぶこの木\n年末に週刊ゴルフダイジェストで紹介していたミニドライバー、大枚12万円を投じた価値は十分あり。とてもシンプルな打感で、振りやすいし、曲がらない。ただし2打目をOBしてこのホール、トリ。でスコアは44・47の91。パット数は36。ほかに10年ぶりにゴルフを再開した斉藤六輔さん48.48の96、三重県鈴鹿市出身の腰の低い小林正明さん49・50の99。楽しい1日でした。\n30年ぶりに懐かしい学友と再会‼お米を送ってくれた思い出も\n井上くんからお土産をいただきました\nと思ったらサプライズが。\nハーフ終了後、クラブハウスに戻る際に、堤防の上から激しく手を振る人がいて目を凝らすと大学時代の友人・井上勝博くんではないか! なんと30年ぶりの再会。\n「みんなのゴルフダイジェスト」を見て、自宅近くの長船CCでプレーするとわかり、わざわざ激励に駆け付けたのだと。井上くんは日本中がコメ不足パニックに陥った1994年、わざわざ東京の学生寮に岡山のお米をたくさん送ってくれたのです。まずいタイ米やカリフォルニア米しか手に入らなかった当時、岡山のお米は旨かったなあ。\n\n17時に長船CCを出発、国道2号線をひたすら大阪へ。23時、道の駅「しらとりの郷・羽曳野」に到着。とにかく眠かったのですぐ爆睡。\n大阪ゴルフクラブで食べたランチ、松坂牛のすき煮膳1980円\n4月1日（月）朝6時に出て堺市中百舌鳥へ同伴の友人を迎えに。友人は仮に与謝野晶子さん（堺市出身）としましょう。\n\nこの日は、私の日本のゴルフ場1千コース制覇記念として名門大阪GCを予約、大阪の知人4人で回る予定だったのですが、1千カ所制覇は奥さまの急病などもあって2カ所減のこの日998カ所目。また同伴者は当初予定した3人中2人がキャンセルして、結局、与謝野女史とツーサムでのラウンドになり、そのお迎えにあがったという次第。\n大阪ゴルフクラブ7番 Par4 奥は大阪湾\n大阪GCに着いたのは8時半。スタートは9時20分。ご存じ、「東の井上誠一、西の上田治」と謳われた名匠・上田治の設計だけにその雄大で粗削りなレイアウト、海の見える景観に圧倒され、感動しっ放しでした。\n\n東京勤務時代のいまは亡き上司でゴルフの達人・荒巻均氏がよく話していました「コースを造成するとき、ブルドーザーを使わず、地形の特長を最大限に残しているゴルフ場は素晴らしい」と。大阪GCはまさにそれ。天気もよく、プレーヤーも少なく、豪快な景色をゆっくり味わい、写真を撮りまくりながら1日を堪能しました。よくぞゴルファーにうまれけり！\n\n10番から15番までパー、こりゃ今日はイケるかなとその気になったら、16番パー3で超難しい砲台グリーンを往復ビンタで7を叩いて45・45の90。ラウンドは4カ月ぶりという与謝野女史は150センチの小柄な体で210ヤード飛ばし、スコアも44・45の89で、最後の最後に逆転負け。とにかく、久しぶりにうっとりと感動したコースでした。\n\n16時にコースをあとにし、与謝野女史を堺市に送って帰路に。天理に出て名阪で亀山→1号線→23号線→庄内川を北上し、帰還したのは21時でした。\n\n●日本のゴルフ場：998カ所目\n●今回の走行距離：825キロ\n●今回の経費：長船CC9420円、大阪GC2万3450円、ガソリン代1万4025円、飲食費9820円、合計5万6715円\n\n今週末は母の法事でゴルフ場攻略はお休み。なので、来週はこれまで攻略した900カ所から想いでのコースを選んで紹介します!\nはむちゃんのゴルフばか日誌","['https://newsatcl-pctr.c.yimg.jp/t/amd-img/20240404-00010007-minnagolf-000-1-view.jpg?pri=l&w=640&h=481&exp=10800', 'https://newsatcl-pctr.c.yimg.jp/t/amd-img/20240404-00010007-minnagolf-001-1-view.jpg?pri=l&w=640&h=310&exp=10800', 'https://newsatcl-pctr.c.yimg.jp/t/amd-img/20240404-00010007-minnagolf-002-1-view.jpg?pri=l&w=597&h=640&exp=10800', 'https://newsatcl-pctr.c.yimg.jp/t/amd-img/20240404-00010007-minnagolf-003-1-view.jpg?pri=l&w=478&h=640&exp=10800', 'https://newsatcl-pctr.c.yimg.jp/t/amd-img/20240404-00010007-minnagolf-004-1-view.jpg?pri=l&w=640&h=481&exp=10800', 'https://newsatcl-pctr.c.yimg.jp/t/amd-img/20240404-00010007-minnagolf-005-1-view.jpg?pri=l&w=640&h=482&exp=10800']","['https://news.yahoo.co.jp/articles/6f7061d2833ec5efd071b7289378ce4b5ef2ded3/images/000', 'https://news.yahoo.co.jp/articles/6f7061d2833ec5efd071b7289378ce4b5ef2ded3/images/001', 'https://news.yahoo.co.jp/articles/6f7061d2833ec5efd071b7289378ce4b5ef2ded3/images/002', 'https://news.yahoo.co.jp/articles/6f7061d2833ec5efd071b7289378ce4b5ef2ded3/images/003', 'https://news.yahoo.co.jp/articles/6f7061d2833ec5efd071b7289378ce4b5ef2ded3/images/004', 'https://news.yahoo.co.jp/articles/6f7061d2833ec5efd071b7289378ce4b5ef2ded3/images/005']"
