headline,mainEntityOfPage,image,datePublished,dateModified,author,media_en,media_jp,str_count,body,images,external_links
「パートナーとしあわせに生きたかっただけ」会社員→弁護士に…同性愛者を隠し続けた日々（弁護士ドットコムニュース）,https://news.yahoo.co.jp/articles/f861cf49030c4a6a5e9b780e8f5acbebbc510b12,https://newsatcl-pctr.c.yimg.jp/t/amd-img/20240404-00017409-bengocom-000-1-view.jpg?exp=10800,2024-04-04T10:36:00+09:00,2024-04-04T10:36:00+09:00,弁護士ドットコムニュース,bengocom,弁護士ドットコムニュース,3196,\n南和行氏（2月19日、大阪市内、弁護士ドットコム撮影）\n2023年10月25日、最高裁大法廷で、戸籍上の性別を変更する際に生殖機能をなくす手術が必要とされる「性同一性障害特例法」の規定を違憲とする決定が出た。\n\n申立人の代理人を務めたのは、南和行氏（47）とそのパートナーの吉田昌史氏（46）だ。ふたりは2013年に「夫夫」で法律事務所を立ち上げ、同性カップルの弁護士として注目されてきた。\n\n「立派な弁護士になりたかったわけではありません。ただ、パートナーと共にしあわせに生きていきたかっただけです」\n\nこう語る南氏は、もともと法律家になるつもりはなく、建材メーカーに勤務する会社員だった。同性愛者であることや恋人の存在を隠しながら生きていた。\n\n ●「異性愛者」を演じた会社員時代\n\n南氏は京都大学農学部を卒業後、同大学院の修士課程に進んだ。同じ大学に通うゲイの学生たちの交流を目的としたインターネット掲示板の管理人もしていた。同性愛者であることを隠す人が少なくない中、匿名性のあるネットは同じ属性の人と出会うことができる空間だった。\n\n修士2年次の夏に掲示板のオフ会を開催し、法学研究科で民法を専攻する修士1年の吉田氏に出会い、その人柄に惹かれた。同年12月から恋人としての交際がスタートした。\n\n修士課程を修了後、大阪の建材メーカーで商品開発と技術研究職に就いた。職場では吉田氏のことは隠し、異性愛者を演じた。社員が同性愛に忌避的な素振りを見せたわけではない。隠す選択をしたのは、自分自身だった。\n\n「同性愛者であることに抵抗を強く感じていましたし、マイナス要素だと思っていました。社会の中で安全に生きていくためには、隠していかなければならない。それが当たり前だと思っていたので、異性愛者と同じように扱ってほしいとは思いませんでした」\n\n吉田氏というパートナーがいるのに、社会生活を送るうえでは「存在しない」扱いになる。それでも、知られたくない気持ちが勝っていた。会社の居心地のよさは「異性愛者の男性を演じているからこそ得られる現実」だと思っていた。\n\n同じころ、吉田氏は体調を崩し、大学院に思うように通えなくなっていた。「どうしたら、彼を見守ることができるのだろう」。\n\n考えて行き着いた答えは、2人で弁護士になることだった。\n\n ●2人でしあわせになるために\n\nきっかけは、吉田氏が「司法試験を受けて弁護士になるとかだったら、できるのかな…」と言い出したことだ。南氏が会社員になって約1年後のことだった。\n\n「僕も弁護士になれば、パートナーがしんどくなったときに見守ることができる。自由な自営業だからこそ、仕事でも生活でも共にいられる。『世の中を変えてやる』との意気込みはなく、2人でしあわせになることだけを考えていました。法学の勉強をしたことはありませんでしたが、身近で憧れの職業でもありました」\n\n南氏の父親は弁護士だった。小学生のころに『バラエティー生活笑百科』に出てくる「ご近所トラブル」などを素材に「これは何が問題だろうか」と問いを投げかけられたことがあった。\n\n「子どもなりに考えて答えたときに『きみは筋がいい。弁護士に向いている』と言われたことがあります。嬉しかったです。ただ、大学ではたくさん遊んで、就職したいと思っていたので、弁護士を目指すことはありませんでした」\n\n父親は「司法試験は法学部でなくても誰でも受験できる」とも話していた。吉田氏とともに挑む覚悟を決め、2002年に会社を退職した。その後はアルバイトをしながら大手受験指導校として知られる伊藤塾に通い、受験勉強に励んだ。\n\nこのころ、司法制度改革によって2004年に法科大学院（ロースクール）が開設。大阪市立大学法科大学院の既修者コースに1期生として入学した。\n\n●「恋人」「婚約者」と名乗れず…\n\n2006年3月にローを修了後、初めての司法試験に挑んだ。結果は不合格だった。一方、吉田氏は8位で合格して先に司法修習生となった。しかし体調は改善せず、修習に行けない日があったり、弁護士登録後も、しばらくすると休みがちになった。\n\n「病院に同行しようにも、裁判所に代わりに電話しようにも、自分の身分をどのように名乗ればよいのかわかりませんでした。異性愛者のように『恋人』や『婚約者』と言うこともできず、何も手出しできませんでした」\n\n当時の司法試験は受験制限があり、ロー修了後5年以内に3回までしか受けられなかった。しかし、2回目の試験も不合格だった。焦りが募ったが、2008年に挑んだ3回目の試験で無事に合格を果たした。\n\n修習では「異性愛者であることが当然」との風潮があった。男性の修習生に「もっと男らしく話せ」と注意する男性弁護士や、懇親会の席で隣に女性を座らせる男性検察官などを見るたびに「同性愛者であることを打ち明けることはできない」と思った。\n\n体調不良で事務所を退所し、休業していた吉田氏は、2009年に南氏が弁護士になると、新たな事務所で仕事を再開した。2人は弁護士として、ようやく新たな道を歩み始めた。\n\n●弁護士夫夫を公に、事務所を開設\n\nしばらくして、ローの同期会があった。同期生のほとんどは2人が恋人同士だと知っていたが、教授や実務家教員は知らなかった。ひとりずつ近況を報告する中で、吉田氏が「僕たちは交際しています」とカミングアウトした。\n\nこの出来事を機に、2人の間で結婚式をする話があがった。そのためには、同性愛者であることを打ち明けなければならない。不安しかなかった。「周囲がどのように思っているのかわからなかった」ためだ。\n\n2011年にイタリアンレストランで挙げた式には、友人や家族、ローの同期や教員、事務所の弁護士などが集まった。挙式後、南氏が退職した会社の上司らに結婚の挨拶状を送ると、同じ部署で働いていた約30人が集まってパーティーを開き、2人を祝福してくれた。\n\n「もしかしたら、会社員をしていたころにカミングアウトしても、受け入れてくれたのかもしれません。でも、当時はどうしても打ち明けられませんでした。本当に人のあたたかさがいっぱいある会社でした。1年しか働いていないにもかかわらず、弁護士になったことを喜んでくれて、当時の上司、先輩、同期とは今も付き合いがあります」\n\n2013年に大阪市内で2人の事務所を開設した。ホームページには「同性カップルの弁護士夫夫の法律事務所です」と書かれている。同性を好きになる人、出生時の性と自認が異なるトランスジェンダーの人などが相談に訪れるようになった。\n\nパートナーの存在を隠す日々は幕を閉じた。しかし、現状を手にしたのは「たまたま」だと南氏は語る。誰もが同じ道を歩み、社会的に承認を得られるわけではない。当事者の裁判に関わり、同性婚が認められていない今を生きる中で、同性愛者であることへの葛藤はあるという。\n\n【取材協力弁護士】\n南 和行（みなみ・かずゆき）弁護士\n1976年生まれ。京都大学農学部・同大学院修士課程修了。建材メーカー勤務を経て、2006年に大阪市立大学法科大学院修了（1期生）。2009年弁護士登録。2013年にパートナーの吉田昌史氏とともになんもり法律事務所を開設。松竹芸能にタレント弁護士として所属し、テレビ番組のコメンテーターなどを務める。著書に『同性婚 私たち弁護士夫夫（ふうふ）です』（2015年、祥伝社）などがある。\n事務所名：なんもり法律事務所\n事務所URL：http://nanmori-law.jp/\n弁護士ドットコムニュース編集部,['https://newsatcl-pctr.c.yimg.jp/t/amd-img/20240404-00017409-bengocom-000-1-view.jpg?exp=10800'],['https://news.yahoo.co.jp/articles/f861cf49030c4a6a5e9b780e8f5acbebbc510b12/images/000']
罷免判決の岡口基一氏、伊藤塾の講師に　「要件事実」を指導（弁護士ドットコムニュース）,https://news.yahoo.co.jp/articles/c72ba2e27b81bd936cc45d228696526b054235ef,https://newsatcl-pctr.c.yimg.jp/t/amd-img/20240404-00017424-bengocom-000-1-view.jpg?exp=10800,2024-04-04T10:01:00+09:00,2024-04-04T10:01:00+09:00,弁護士ドットコムニュース,bengocom,弁護士ドットコムニュース,332,\n岡口基一氏\n弾劾裁判の罷免判決により、4月3日に裁判官をやめさせられた岡口基一元判事は、司法試験予備校「伊藤塾」で専任講師をつとめる。同塾のSNSアカウントで同4日に発表された。\n\n岡口氏は、多くの法律家が実務で活用する『要件事実マニュアル』など、法律書のベストセラー作家でもあり、裁判官でなくなったあとのキャリアが注目されていた。\n\n伊藤塾では「民事実務、要件事実等の講義や書籍執筆」をするという。\n\n発表の投稿には、「30年の実務経験と豊富な知識を受験生、修習生、実務家の教育に活かしてもらえることを嬉しく思います。事実を受けとめそれに自分で意味を与えれば新たな道が拓かれます」とのコメントが添えられている。\n弁護士ドットコムニュース編集部,['https://newsatcl-pctr.c.yimg.jp/t/amd-img/20240404-00017424-bengocom-000-1-view.jpg?exp=10800'],['https://news.yahoo.co.jp/articles/c72ba2e27b81bd936cc45d228696526b054235ef/images/000']
岡口判事の弾劾裁判、目立った裁判員の欠席　判決当日も2人休み　船田裁判長「反省すべきところある」（弁護士ドットコムニュース）,https://news.yahoo.co.jp/articles/7eda72b72f0a80d640b322a67038f5926deadcfd,https://newsatcl-pctr.c.yimg.jp/t/amd-img/20240404-00017426-bengocom-000-1-view.jpg?exp=10800,2024-04-04T18:07:00+09:00,2024-04-04T18:07:00+09:00,弁護士ドットコムニュース,bengocom,弁護士ドットコムニュース,2067,\n船田裁判長（2024年4月3日）\n岡口基一裁判官に対し、史上8例目の罷免判決を言い渡した裁判官弾劾裁判所。しかし、4月3日の判決当日も国会議員14人が座っているはずの裁判員席には空席が1つ。実際には裁判員2人が欠席し、予備員1人が代わりに出席した形だ。肝心の判決に関与したのも12人で、2人が欠席している。\n\n裁判員の交代や欠席が目立った点について、弾劾裁判所の船田元裁判長（衆・自民）は判決後の記者会見で「判決に大きな支障はなかった」としつつ、「交代がちょっと多かった」「残念」などと語った。\n\n＜関連記事：岡口判事の弾劾裁判にみる「制度の欠陥」 裁判員の国会議員、欠席や交代だらけ 出欠状況を総まとめ＞\n\n●判決には「出席2回」の裁判員も\n\n弾劾裁判の裁判員は、衆参7人ずつの国会議員計14人が務める。欠席時に備え、衆参4人ずつ計8人の予備員もいる。\n\n弁護士ドットコムニュースの集計では、今回の弾劾裁判にかかわった裁判員は全部で23人（予備員除く）。交代が多かったのは、裁判期間763日、公判数16回がいずれも過去最長という異例の裁判で、途中で参院選なども挟まったためだ。\n\nこの結果、判決を含め全16回の公判を「皆勤」したのは船田裁判長らわずか3人。途中交代だから本人に責任はないが、判決にかかわった裁判員の中には、審理の出席回数が2回、4回、6回の議員もいる。\n\n「長期にわたったので、内閣の改造や各政党の人事もあった。国会の場においてはある程度やむをえないと思っているが、裁判長としてはなるべく裁判員の交代がないことが望ましい」（船田裁判長）\n\n一方で、「交代して新しく入った裁判員には、事務方からそれまでの経緯を詳細にレクチャーしてもらった」といい、支障は少なかったと強調した。\n\nこの点については、岡口元裁判官側も異論はないようだ。弁護団が判決後の記者会見で、「事実認定がずさんなら出席回数の少ない人の認識が問われるが、事実認定には満足している」「（今回の判決内容は）出席しているかどうかよりもスタンスの問題」などと話しており、影響は少なかったと考えられる。\n\n●裁判員の欠席「許してもらいたいところもある」\n\nでは、欠席はどうなのか。全16回の公判中、裁判員席がすべて埋まったのは4回だけ。正規の裁判員14人が全員揃ったのは、そのうち2回だけだ。会見では記者団から裁判員の欠席についても質問が飛んだ。予備員で補充しないのはなぜなのか。\n\n船田裁判長の答えは次のとおり。\n\n「突発的に病気になったり、日程が合わなかったりということがある。事前にわかっていれば予備員を呼ぶが、突発事態ではそれができない」\n\n「『裁判員裁判では裁判員全員出席が原則。それに比べて弾劾裁判はどうなのか』と言われたら、反省すべきところがある。できる限り、欠席者がないように日にちを選んでやっていく必要がある。ただ、日にちを選んでも国会の日程があって、ダメになることはある。許してもらいたいところもある」\n\nもちろん、すべての期日に出ないと判断が下せないということはない。多忙な中、また今回は今年4月12日で任期満了というタイムリミットがある中、全16回もの公判期日で14人すべてを集めるのが困難だったことも想像に難くない。ただ、全員が揃ったほうが望ましいということは言えるはずだ。\n\n●出席数の少ない裁判員の「良心」\n\n裁判官の権利は、権力からの介入を防ぐため厚く保障されている。判決では、その裁判官をやめさせる根拠の1つとして、公務員の選定罷免権は国民にあること（憲法15条1項）をあげ、裁判員である国会議員が「国民の代表」であることを強調する。\n\nそして判決では、弁護側から出た「（岡口元裁判官が）司法に対する国民の信頼を害した」事実が立証されていないという主張について、次のように退けている。\n\n「『司法に対する国民の信頼』を害したかどうかの認定は、その時々の弾劾裁判所を構成する裁判員の良識に依存する」\n\n「時の弾劾裁判所の裁量に属する項目であって、通常の要証事実のような立証責任は問題にならない」\n\nしかし、裁判に出席しない裁判員は、果たして国民の信託に応えていると言えるのだろうか。評議の中身が公表されない中、その「良識」「裁量」「判断」を国民はどう評価したら良いのか。\n\n判決は、憲法が裁判官の身分を厚く保障することを理由に、裁判官には高い品性と厳格な倫理規範が求められるとしている。翻って、好き好んで欠席しているわけではないにしても、その判決を下した国会議員でもある裁判員の姿勢は国民からどう見えるか。\n\n弾劾裁判は1947年の制度創設以来、10回しか開かれていない。船田裁判長は、「経験を生かしてもらえるように、しかるべきところに話して、制度の改善などで今後に生かせるようにしたい」と話した。\n弁護士ドットコムニュース編集部,['https://newsatcl-pctr.c.yimg.jp/t/amd-img/20240404-00017426-bengocom-000-1-view.jpg?exp=10800'],['https://news.yahoo.co.jp/articles/7eda72b72f0a80d640b322a67038f5926deadcfd/images/000']
"子どものころは「お年玉」、大人になっても毎月5万円""搾取""…金にうるさい毒親と「絶縁」した女性の今（弁護士ドットコムニュース）",https://news.yahoo.co.jp/articles/9287c63af56765177ce979a13165e329be796813,https://newsatcl-pctr.c.yimg.jp/t/amd-img/20240404-00017420-bengocom-000-1-view.jpg?exp=10800,2024-04-04T10:03:00+09:00,2024-04-04T10:03:00+09:00,弁護士ドットコムニュース,bengocom,弁護士ドットコムニュース,965,"\n写真はイメージです（Ushico / PIXTA）\n春は別れの季節でもあります。弁護士ドットコムニュースがLINEで別れをテーマに募集したところ、たくさんのエピソードが集まりました。その一つが、ある女性から寄せられた「毒親との絶縁」です。子どものころからお金を両親に""搾取""され続けていたという女性は、10年前に両親と絶縁したといいます。女性に今の気持ちを聞きました。\n【写真】縁切り神社のヤバすぎる絵馬\n●「養育費の返済」という理由で搾取\n\n「親戚からいただいたお年玉をすべて両親に搾取されていました」\n\nそう語るのは、首都圏在住の女性（30代）です。女性によると、6歳から20代まで、親戚からもらった総額10万円のお年玉を両親にとられていたといいます。子どもにとって何よりも楽しみなお年玉。両親からもらえることはありませんでした。\n\n""搾取""は、女性が成人して働くようになってから、さらにひどくなりました。\n\n「お給料から毎月5万円くらいは搾取されていました。養育費の返済とか、老後の資金だとか言われました。実家で暮らしていた時は、毎日、お金の話ばかりで本当に嫌でした」\n\nそう振り返る女性。当時付き合っていた男性と一緒に暮らすことになり、それを機に思い切って両親と絶縁したそうです。\n\n●完全に絶縁できない「不安」\n\nその後、結婚した女性。絶縁から10年が経ち、どんなことを思っているのでしょうか。\n\n「完全に絶縁できているわけではないから、不安はあります」\n\n現在の民法や制度では、親子の縁を完全に切ることはできません。親であれば、子どもの住民票や戸籍の附票から、現在の子どもの住所を知ることができます。\n\nただし、いくつかの方法で親から遠ざかることはできます。女性はどのように絶縁したのでしょうか。\n\n「役所や警察の方々の協力で、住民票の閲覧制限を受けさせていただいてます。閲覧制限の申請は手間がかかるけど、仕方ないですよね。日本では完全に親子や親族との絶縁ができないから。『法律を作ってほしいなぁ』と思ってます」\n\nなかなか切れない親子の縁。なぜ子どもに絶縁されてしまったのか、両親が自分たちを省みることができればいいですね。\n弁護士ドットコムニュース編集部",['https://newsatcl-pctr.c.yimg.jp/t/amd-img/20240404-00017420-bengocom-000-1-view.jpg?exp=10800'],"['https://news.yahoo.co.jp/articles/9287c63af56765177ce979a13165e329be796813/images/000', 'https://www.bengo4.com/c_23/n_6090/images/']"
