headline,mainEntityOfPage,image,datePublished,dateModified,author,media_en,media_jp,str_count,body,images,external_links
ヤクルト・北村拓己「石川雅規さんと青木宣親さんがすごく優しく接してくれて、お二人の人柄がチームカラーにも表れているんだなと感じました」／ヤクルト（週刊ベースボールONLINE）,https://news.yahoo.co.jp/articles/581ad85aa0b30a9875c74a0f2c60a120e5a470a1,https://newsatcl-pctr.c.yimg.jp/t/amd-img/20240311-00000004-baseballo-000-2-view.jpg?exp=10800,2024-03-11T12:00:00+09:00,2024-03-11T12:10:59+09:00,週刊ベースボールONLINE,baseballo,週刊ベースボールONLINE,393,\nヤクルト・北村拓己\nヤクルトは、ジャイアンツ時代からアットホームな感じはありましたが、実際にそういう印象でした。石川(石川雅規)さんと青木(青木宣親)さんが、僕らみたいな移籍してきた選手に対してすごく優しく接してくれて、「慣れたか？」と話し掛けてくれたり、ちょっとしたことで気にかけてくれたりします。だから、なじみやすかったですし、お二人の人柄がチームカラーにも表れているんだなと感じました。\n【選手データ】北村拓己 プロフィール・通算成績・試合速報\nジャイアンツ時代は育成選手も含めて人数が多かったですし、野球を楽しむ中でも自分の立ち位置とかに目が行きがちになってしまっていました。新天地で気持ちも新たに臨んで、また純粋に野球を楽しんでいるなと思います。\n\n『週刊ベースボール』2024年3月18日号(2024年3月6日発売)より\n\n写真=BBM\n週刊ベースボール,['https://newsatcl-pctr.c.yimg.jp/t/amd-img/20240311-00000004-baseballo-000-2-view.jpg?pri=l&w=551&h=640&exp=10800'],"['https://news.yahoo.co.jp/articles/581ad85aa0b30a9875c74a0f2c60a120e5a470a1/images/000', 'http://sp.baseball.findfriends.jp/player/19950074/?from=ynews']"
巨人・山瀬慎之助「BeReal(ビリール)がすごく面白いです。チーム内だと菊田拡和、萩尾匡也さんとかとよくやっています」／流行（週刊ベースボールONLINE）,https://news.yahoo.co.jp/articles/f28bcba25dab5910789cb8449da7ec6819e2591f,https://newsatcl-pctr.c.yimg.jp/t/amd-img/20240311-00000005-baseballo-000-2-view.jpg?exp=10800,2024-03-11T12:00:00+09:00,2024-03-11T12:12:25+09:00,週刊ベースボールONLINE,baseballo,週刊ベースボールONLINE,390,\n巨人・山瀬慎之助\nBeReal(ビリール)というSNSが若い人たちの間で人気ですね。流行には乗り遅れたくないというのがどこかにあって始めたら、すごく面白いです。\n【選手データ】山瀬慎之助 プロフィール・通算成績・試合速報\n1日1回、ランダムな時間に「2分以内に投稿しないと友達の投稿が見れません」と通知が来たら、すぐ写真を撮って投稿します。外カメラと内カメラで同時に撮影されるので、画面には2枚の写真が映されます。友達と、何をしているかを共有できるのが楽しいです。チーム内だとキク(菊田拡和)、萩さん(萩尾匡也)とかとよくやっています。昨年のファンフェスタで外野の芝にいるときに撮ったのは、世界中のビリールの中でトップクラスの出来栄えでしたね(笑)。\n\n『週刊ベースボール』2024年3月18日号(2024年3月6日発売)より\n\n写真=BBM\n週刊ベースボール,['https://newsatcl-pctr.c.yimg.jp/t/amd-img/20240311-00000005-baseballo-000-2-view.jpg?pri=l&w=621&h=640&exp=10800'],"['https://news.yahoo.co.jp/articles/f28bcba25dab5910789cb8449da7ec6819e2591f/images/000', 'http://sp.baseball.findfriends.jp/player/20010050/?from=ynews']"
【ロッテ】今年も千葉県内の各地でイースタン公式戦開催（週刊ベースボールONLINE）,https://news.yahoo.co.jp/articles/7ce0f034570c1641db0ce3fafb18ab65ce838f25,https://newsatcl-pctr.c.yimg.jp/t/amd-img/20240311-00000008-baseballo-000-3-view.jpg?exp=10800,2024-03-11T13:48:00+09:00,2024-03-11T13:58:10+09:00,週刊ベースボールONLINE,baseballo,週刊ベースボールONLINE,469,\n県内イースタン開催\n千葉ロッテマリーンズは昨年に続き、2024年イースタン・リーグ公式戦のホームゲーム全70試合のうち8試合を、地域振興活動の一環として千葉県内各地で開催すると発表した。詳細は以下の通り。\n\n\n5月2日(木)：日本ハム戦(千葉市・ZOZOマリンスタジアム、18:00試合開始)\n6月2日(日)：ヤクルト戦(袖ケ浦市・袖ケ浦市営球場、13:00試合開始)\n6月9日(日)：楽天戦(成田市・ナスパスタジアム、12:30試合開始)\n6月29日(土)：オイシックス戦(柏市・柏の葉公園野球場、13:00試合開始)\n7月4日(木)：巨人戦(千葉市・ZOZOマリンスタジアム、18:00試合開始)\n7月18日(木)：DeNA戦(千葉市・ZOZOマリンスタジアム、18:00試合開始)\n9月21日(土)：オイシックス戦(浦安市・浦安市運動公園野球場、13:00試合開始)\n9月23日(月・祝)：巨人戦(佐倉市・長嶋茂雄記念岩名球場、13:00試合開始)\n\n画像提供=千葉ロッテマリーンズ\n週刊ベースボール,['https://newsatcl-pctr.c.yimg.jp/t/amd-img/20240311-00000008-baseballo-000-3-view.jpg?pri=l&w=640&h=533&exp=10800'],['https://news.yahoo.co.jp/articles/7ce0f034570c1641db0ce3fafb18ab65ce838f25/images/000']
ヤクルト・小川泰弘　4年連続の大役へ／いざ、開幕投手へ（週刊ベースボールONLINE）,https://news.yahoo.co.jp/articles/116e441387c7da00f652c82da38885b3cc7f478f,https://newsatcl-pctr.c.yimg.jp/t/amd-img/20240311-00000007-baseballo-000-2-view.jpg?exp=10800,2024-03-11T12:02:00+09:00,2024-03-11T12:15:38+09:00,週刊ベースボールONLINE,baseballo,週刊ベースボールONLINE,683,\n小川泰弘\nチームの顔であり、投手陣の柱でもある。開幕投手は、そういう存在の投手に任される。ヤクルトは、沖縄・浦添キャンプ終了時点では発表されなかった。ただ、筆頭候補はやはり小川泰弘だろう。昨年まで3年連続で通算7度経験。その座に一番近い男だ。\n【選手データ】小川泰弘 プロフィール・通算成績・試合速報\n「責任のある立場だと思います。光栄なことですし、やるからには任せてもらえるように、力をつけていきたいなと思います」\n\n エース右腕は、開幕投手への思いを明かした。今季プロ12年目で、5月には34歳を迎えるが、勝利をつかむためにさまざまなことに取り組んでいる。毎年、オフになると投球フォームを見つめ直すが、今回は相手打者を惑わせるように改良。左足を上げてから着地するまでの体重移動の時間を少し長くすることによって、間を作り、タイミングを外すことを目的としている。\n\n 昨季は、チームでただ一人、規定投球回(144回)と2ケタ勝利(10勝)をマーク。今季もかかる期待は大きい。高津臣吾監督は開幕投手を選ぶ条件として「3月29日(対中日、神宮)は非常に大事な日だと思いますが、それ以降も非常に大事な日が続いていくので、トータル、総合的に考えて判断したい」と明かした。故障もなく、タフに先発ローテーションを守る小川ならまさしく適任。高橋奎二やサイスニードら、ライバルとの争いに注目だ。\n\n「結果は欲しい。やってきたことを出しながら、しっかり結果を求めてやっていきたい」。4年連続の大役へ、勝負の1カ月が始まる。\n\n写真=BBM\n週刊ベースボール,['https://newsatcl-pctr.c.yimg.jp/t/amd-img/20240311-00000007-baseballo-000-2-view.jpg?pri=l&w=640&h=640&exp=10800'],"['https://news.yahoo.co.jp/articles/116e441387c7da00f652c82da38885b3cc7f478f/images/000', 'http://sp.baseball.findfriends.jp/player/19900028/?from=ynews']"
楽天・早川隆久　4年目は一味違う／いざ、開幕投手へ（週刊ベースボールONLINE）,https://news.yahoo.co.jp/articles/1a67165bd0180ec198040e20df414a9655121a87,https://newsatcl-pctr.c.yimg.jp/t/amd-img/20240311-00000006-baseballo-000-1-view.jpg?exp=10800,2024-03-11T12:01:00+09:00,2024-03-11T12:01:00+09:00,週刊ベースボールONLINE,baseballo,週刊ベースボールONLINE,689,\n開幕へ向け調整は順調だ\n今江敏晃新監督の大事な初陣。3月29日、西武との開幕戦(楽天モバイル)で開幕投手に指名されたのは4年目の早川隆久だった。昨季は17試合に登板し6勝7敗、防御率3.44。新人だった2021年には9勝を挙げた左腕が、自身初の大役を任された。\n【選手データ】早川隆久 プロフィール・通算成績・試合速報\nキャンプでは順調な仕上がりを見せていた。自身、今季の実戦初登板となった2月17日の阪神との練習試合(宜野座)では2回を投げ無安打無失点。2度目の実戦登板となった23日のロッテとの練習試合(糸満)では先発し3回を投げ3安打無失点だった。\n\n 同ロッテ戦では3本の二塁打を浴びながら、きっちり要所を締めた。丁寧に低めを突いて、後続を断った。ピンチを背負いながらも得点を許さなかった左腕は「自分の思う真っすぐは投げられなかったが、カットボールなど曲がり球は問題ない」と手応えもにじませた。\n\n 実戦2試合を終えた時点で5回無失点と順調な仕上がりを見せた左腕を、今江監督も「今年はちょっと一味違うなという感じで見ています」と一定の評価を与えていた。\n\n 指揮官は昨秋に就任した時点で、開幕投手を早川に任せることを決めていたという。だがキャンプ中、その事実を口にすることはなかった。今春のキャンプのテーマの一つが競争。あえて大役を任せる事実を口にせず、左腕にさらなる成長を促した。\n\n キャンプ中には新たなフォークの握りにも挑戦するなど、研さんを続けた早川。初の大役を見事に務め、指揮官の期待に応える。\n\n写真=BBM\n週刊ベースボール,['https://newsatcl-pctr.c.yimg.jp/t/amd-img/20240311-00000006-baseballo-000-1-view.jpg?pri=l&w=640&h=640&exp=10800'],"['https://news.yahoo.co.jp/articles/1a67165bd0180ec198040e20df414a9655121a87/images/000', 'http://sp.baseball.findfriends.jp/player/19980014/?from=ynews']"
【ロッテ】ZOZOマリンの「シーガル・ボックス」拡張と「アネックス・スイート」新設で収容人数変更（週刊ベースボールONLINE）,https://news.yahoo.co.jp/articles/ea6f2dc0d15edf6a47d4518afd6b24943b1d10b9,https://newsatcl-pctr.c.yimg.jp/t/amd-img/20240311-00000003-baseballo-000-4-view.jpg?exp=10800,2024-03-11T11:58:00+09:00,2024-03-11T12:03:38+09:00,週刊ベースボールONLINE,baseballo,週刊ベースボールONLINE,372,\nZOZOマリンスタジアム\n千葉ロッテマリーンズは、2024シーズンから「シーガル・ボックス」の拡張と「アネックス・スイート」の誕生により、ZOZOマリンスタジアムの収容人数が2万9635人(2023年は2万9916人)になったと発表した。\n\n 2024シーズンよりフロア4の通常席459席を改修し、「シーガル・ボックス」を38ボックス(座席数174席)増設。\n\n また、フロア3のお座敷ボールパーク、ビーチハウステラスの計6部屋(50席)を改修し、法人向け年間契約VIPルーム「アネックス・スイート」の全6部屋(54席)を新設したため。\n\n なお、シーガル・ボックスの2名席、4名席は一般販売も行っているので、購入方法は球団公式サイトのチケットページをご参照ください。\n\n画像提供=千葉ロッテマリーンズ\n週刊ベースボール,['https://newsatcl-pctr.c.yimg.jp/t/amd-img/20240311-00000003-baseballo-000-4-view.jpg?pri=l&w=640&h=409&exp=10800'],['https://news.yahoo.co.jp/articles/ea6f2dc0d15edf6a47d4518afd6b24943b1d10b9/images/000']
仁村薫、巨人で苦しんだ六大学の二刀流スターが、移籍先で星野中日のV1に貢献できた理由【逆転プロ野球人生】（週刊ベースボールONLINE）,https://news.yahoo.co.jp/articles/9ee8c75fff88f2636959fe4600992c9fb86faf59,https://newsatcl-pctr.c.yimg.jp/t/amd-img/20240311-00000002-baseballo-000-6-view.jpg?exp=10800,2024-03-11T11:01:00+09:00,2024-03-11T13:49:06+09:00,週刊ベースボールONLINE,baseballo,週刊ベースボールONLINE,4283,\n誰もが順風満帆な野球人生を歩んでいくわけではない。目に見えない壁に阻まれながら、表舞台に出ることなく消えていく。しかし、一瞬のチャンスを逃さずにスポットライトを浴びる選手もいる。華麗なる逆転野球人生。運命が劇的に変わった男たちを中溝康隆氏がつづっていく。\n【選手データ】仁村薫 プロフィール・通算成績\n素質を高く評価された若手時代\n巨人時代の仁村\n「将来の打撃の核、年間50本も可能だ」\n\n 80年代前半の巨人で打撃の神様・川上哲治から、そう絶賛されたルーキーがいた。仁村薫である。早稲田大学で投手として通算17勝をあげる一方で、日米大学野球では代打決勝3ランを放つ打撃の評価も高く、いわば六大学の“二刀流”のスターだった。\n\n 3年春の立大戦で3安打12奪三振の初登板初完封。さらには決勝打を自ら放つ衝撃デビューを飾り、「弟の七光りなんていわれたくなかったんです」とコメントを残したが、二男・徹、三男・健司はともに上尾高のエースとして甲子園を沸かせていた。川越商高で通算30ホーマーを放った長男の薫は甲子園には届かず、「早慶戦こそオレの甲子園」と進学したのだ。登板過多から秋には右ヒジを痛めてしまうが、阪神入りした2学年上の岡田彰布に代わる早大の顔と注目を集めた。\n\n しかし、皮肉にも、その高い知名度が81年のドラフト時に足枷となる。ヒジの怪我もあり、「今はプロでやっていく自信がない」と社会人野球の新日鉄室蘭の内定をもらっていたが、巨人がまさかの6位で指名。当時は有望選手が社会人行きや進学を表明していようが、どの球団もわずかな可能性に懸けて下位指名で抑えておくという手法が当たり前だった。なお、同年の西武ドラフト6位は社会人の熊谷組入社を表明していた工藤公康である。\n81年のドラフトで巨人に6位指名され入団した[前列右が仁村]\n当然、仁村サイドは巨人の6位指名に混乱する。早大の宮崎康之監督は「(仁村は)秋、ひじをこわして投げられなかった、という計算かもしれませんが、かりにも神宮のスターですよ。ぼくは指名の話も聞いていなかったし、六位なんかで指名してくれるんだったら、されない方が、本人もすっきりしてよかったんだが……」(週刊サンケイ81年12月17日号)と困惑。父親は、「とんでもない話。ロクにあいさつにも来ないで、勝手に指名するとは失礼きわまりない」と突然の指名に激怒した。だが、弟たちからの兄のプロ入りへのあと押しもあり、仁村も最後は「親子の縁を切ってでも」と巨人入団を決めた。\n\n 同期には槙原寛己、吉村禎章、村田真一ら高校生が多く、6位とはいえ六大学のスター選手だった仁村への注目度は、当時の巨人人気もあり他球団の1位選手を上回るほどだった。自ら打者専念を決め、春季キャンプでは多摩川に残り、柴田勲二軍打撃コーチとマン・ツーマンでスイッチヒッターに挑戦する。OBの青田昇は「ホームラン40本打つ素質があるのは彼をおいてない」とその素質を高く評価した。\n自己最多の98試合出場も戦力外\nルーキーイヤーの82年はイースタン・リーグの6月20日ヤクルト戦で実戦初の左打席に立ち、左翼ライナー。しかし、これは右打席で打撃不振に陥ったことによる応急処置で、両打ち挑戦はあくまで球団主導でのことだった。1年目は二軍で打率.219、4本塁打という成績に終わり、週べ83年1月24日号で仁村はこんな本音を語っている。\n\n「たまたま、右打席でスランプになったため、左で打っただけ。そしたら、まわりが勝手にそんな雰囲気になってきた。それでもイースタンの試合で14、15打席ほど左で打って、ヒットは2本ぐらいかな……。早大の先輩でもある松本さんからも“スイッチは大変”と教えられ、もともとボクもその気はなし。で、今は右一本に絞ってます」\n\n さらに打撃の評価を高めた、日米大学野球で放った劇的なホームランについても、「二度とあんないい当たりを打てる自信がなくて悩んだ」という。要は巨人入り後の仁村は、首脳陣の意向と自分の目指す選手像にズレがあり、周囲のやたらと高い評価にも戸惑っていたわけだ。\n\n 仁村自身は、「3年だけ待つ」と巨人入りを容認した養豚業を営む父親との約束に、「まず1年目は外野手らしい守備力をつける。2年目はプロの球についていけるバッティングを身につける。そして、3年目にデビュー」という3カ年計画を掲げていた。そして、3年目の夏に一軍でプロ初アーチを放ってみせるのだ。\n\n 寮を出て目黒区のマンションを借り、禁煙を掲げて臨んだ4年目には、原辰徳の故障欠場で巡ってきた5月27日広島戦でのスタメン起用に2打席連続アーチで応える。「もう原さんの戻るポジションはありません」と血気盛んな仁村は、85年に自己最多の72試合に出て3本塁打を放った。\n\n『週刊平凡』85年9月6日号では、早大野球部の1学年後輩で俳優の川野太郎と夜の銀座を歩くグラビアが掲載されている。NHK朝のテレビ小説『澪つくし』でブレイクした川野は、この年のオフに高輪プリンスホテルで行われた仁村の結婚式でも挨拶に立った。明るい性格で華やかな交友関係を持つ背番号38は、趣味の音楽鑑賞はクラシックからシャンソンの金子由香利まで幅広く聴き、定期購読雑誌は『財界』。「ボクは野球を天職だとは思ってないんですよ」なんてうそぶき、本棚には経済学や経営学の専門書が並ぶ異色のプロ野球選手でもあった。\n\n 当時の巨人外野は主軸のクロマティや吉村、さらにはベテランの松本匡史や若手の駒田徳広らがひしめき合う激戦区だったが、披露宴で王監督が仁村に「代打に終わらぬよう、もっと焦れ」と檄を飛ばし、自宅では新妻がスポンジボールを投げティー打撃に付き合ってくれた。87年には主に代打と守備固めで自己最多の98試合に出場。8月には待望の子宝にも恵まれ、9月7日の大洋戦ではシーズン第1号を放った。だが、男の運命なんて一寸先はどうなるか分からない――。\n兄を救ったのは中日でプレーする弟\n中日では弟・徹とチームメートになった\nこの87年オフに、仁村は巨人から戦力外通告を受けるのである。プロ6年目の打撃成績は、打率.212、1本塁打、8打点。レギュラーだけでなく、控え選手にも組織の新陳代謝のための世代交代は必要だ。98試合は、いわば28歳の仁村に与えられたラストチャンスでもあったのだ。そんな失意の仁村を救ったのは、中日でプレーする弟の徹だった。星野仙一監督は当初、仁村に対して外野の守備固めで獲得に興味は示したものの、兄が同チームにいたら弟の徹がやりにくくなることを危惧していたという。徹は87年に二塁レギュラーを獲得。11本塁打を放った若手のホープである。だが、徹は野球を諦めて家業を継ごうとしていた兄を自ら説得して入団を後押し、名古屋での住まい探しまで付き合った。お互いすぐ行き来できるよう車で10分の距離のマンションである。そうして87年12月15日、中日に「ニムラブラザーズ」が誕生する。\n\n 巨人時代の仁村は、理論家の一方でウマの合わないコーチにはいっさい近寄ろうとしない頑固な一面があった。それを早大出身のエリートの驕りと見る向きもあったが、中日では一切のプライドを捨て、「ボクは星野監督に拾われた身。打たなくてはいけない義務があるんだ」と闘将好みのガッツマンへと変貌したのだ。誰よりも早く球場入りして、黙々と走り、特打ちに汗を流す。オープン戦では気持ちが空回りしてまったく打てなかったものの、二軍から這い上がり、石井昭男打撃コーチ補佐と二人三脚で打撃フォームを固め、少ない出場機会で結果を残して代打の切り札へと成り上がっていった。\n\n 88年の星野中日は初Vに向けて首位争いを繰り広げていたが、徹が左ヒザの故障から復帰した6月以降、兄が打てば弟も打つニムラブラザーズの活躍がにわかに注目を集める。ツーショットで週べの巻頭カラーグラビアを飾り、『週刊文春』88年9月29日号では、「ドラゴンズ影のMVP・仁村兄弟物語 薫と徹「オレたちの闘い」」という特集記事まで掲載されている。崖っぷちの兄は移籍してすぐ、前所属チームをクビになったにもかかわらず、年俸を前年より100万円上げてくれた星野監督の心遣いを意気に感じて、中日の全員野球に乗り遅れまいとガムシャラにプレーした。\n\n「巨人は毎日投手が変わるだけで、いつも同じ八人で野球をやっていた。そりゃ巨人にいるときも勝つとうれしかった。でもね、ロッカーに帰ってきてタバコを一服すうと、なぜか虚しくなったよ。いったい、オレ、きょうは何をやったんだろ。ただベンチにいただけじゃなかったか、とね。巨人では、ベンチから離れると叱られた。でもね、中日はベンチにいたら使ってくれない。さあ出番だ、とベンチ裏で素振りをやり、気合を高めていかないと使ってくれないんだ」(週刊文春88年9月29日号)\n\n 巨人時代は、ほとんど左投手専門で、右投手が投げると素振りよりも、ベンチに残って声を出せと命じられた。オレは声出しをするためにプロになったわけじゃないぞ――。それが、いまや首位チームで、ときにスタメンでお呼びがかかる。プロ入り以来最高のシーズンを過ごした88年は、76試合で打率.287、7本塁打、24打点というキャリアハイの成績を残し星野中日の初Vに貢献してみせた。他の選手の前では弟の徹とはあえて距離を置き、遠征先でも別行動をとるようにしたが、グラウンド上の乱闘となると真っ先に弟の助けにかけつける兄の姿があった。\n\n この2年後、31歳の仁村は早すぎると惜しまれながら、90年限りで現役引退を決意。本拠地最終戦の巨人戦の試合後、背番号31はナインから惜別の胴上げで送り出され、名古屋東急ホテルで開催された「送る会」には星野監督を筆頭に500人もの関係者が集結した。プロ通算15本塁打だが、記録より、記憶に残る明るいキャラクターは地元ファンにも愛され、引退後も名古屋テレビの情報番組でコメンテーター役を務めるほどだった。\n\n 巨人で選手生命が終わりかけるも、名古屋で生き返った29歳での逆転野球人生。88年夏、新天地でのV争いの渦中に仁村はこんな言葉を残している。\n\n 中日に来て、オレ、生きてるなって思うよ――。\n\n文=中溝康隆 写真=BBM\n週刊ベースボール,"['https://newsatcl-pctr.c.yimg.jp/t/amd-img/20240311-00000002-baseballo-000-6-view.jpg?pri=l&w=631&h=640&exp=10800', 'https://newsatcl-pctr.c.yimg.jp/t/amd-img/20240311-00000002-baseballo-001-6-view.jpg?pri=l&w=640&h=392&exp=10800', 'https://newsatcl-pctr.c.yimg.jp/t/amd-img/20240311-00000002-baseballo-002-6-view.jpg?pri=l&w=634&h=640&exp=10800']","['http://sp.baseball.findfriends.jp/player/19590047/?from=ynews', 'https://news.yahoo.co.jp/articles/9ee8c75fff88f2636959fe4600992c9fb86faf59/images/000', 'https://news.yahoo.co.jp/articles/9ee8c75fff88f2636959fe4600992c9fb86faf59/images/001', 'https://news.yahoo.co.jp/articles/9ee8c75fff88f2636959fe4600992c9fb86faf59/images/002']"
