headline,mainEntityOfPage,image,datePublished,dateModified,author,media_en,media_jp,str_count,body,images,external_links
東日本大震災での「行政丸ごと支援」…名古屋市は今でも陸前高田市に職員を派遣（テレビ愛知）,https://news.yahoo.co.jp/articles/111716fdaef073afe14878e09dd03258e3dc5731,https://newsatcl-pctr.c.yimg.jp/t/amd-img/20240311-90004396-tvaichi-000-1-thumb.jpg?exp=10800,2024-03-11T19:09:02+09:00,2024-03-11T19:09:02+09:00,テレビ愛知,tvaichi,テレビ愛知,392,\nテレビ愛知\n東日本大震災から13年経ちましたが、その間、名古屋市は地震で壊滅的な被害を受けた岩手県陸前高田市の支援を続けてきました。\n\n2011年度には、のべ144人の職員を送り、「ライフラインの復旧」「健康相談に応じる」「被災した書類の再生」「防災関係業務」など、市役所のありとあらゆる業務を支援したため、「行政丸ごと支援」と呼ばれました。\n\nこのように、被災した自治体1つに対し、支援を担当する自治体を決めるやり方は「カウンターパート方式」とも呼ばれていて、東日本大震災での名古屋市の支援が全国の先駆けともいわれています。2024年1月の能登半島地震でも名古屋市は石川県七尾市を重点的に支援しています。\n\n東日本大震災の発生から13年が経ち、派遣される職員の数は徐々に減ってはいますが、2023年度も陸前高田市で名古屋市の職員が活躍しています。\n愛知のニュース,[],[]
東日本大震災から13年…愛知でも追悼式　被災者「あっという間だった。亡くなった方が安らかに」（テレビ愛知）,https://news.yahoo.co.jp/articles/d1f8946b8ef588f3745d3e4930d7b3ed180a49c5,https://newsatcl-pctr.c.yimg.jp/t/amd-img/20240311-90004395-tvaichi-000-1-thumb.jpg?exp=10800,2024-03-11T19:06:01+09:00,2024-03-11T19:06:01+09:00,テレビ愛知,tvaichi,テレビ愛知,436,\nテレビ愛知\n死者1万5900人、行方不明者2500人以上の被害を出した東日本大震災から11日で13年が経ちました。名古屋市内でも追悼式が行われ、犠牲者へ祈りが捧げられました。\n\n昭和区の鶴舞公園で行われた追悼式には約250人が参列。設置された献花台に花がたむけられたほか、地震が起きた午後2時46分から1分間黙とうが捧げられました。\n\n岩手県釜石市で被災し、自宅や愛犬を失った女性。愛知県に避難してから約13年が経ちました。\n\n愛知に避難してきた女性：\n「あっという間の13年間だった。普通に生きていて13年前を覚えているわけないのに、つぶさに一つ一つ思い返せる経験をした意味は何だろうと思うときはあります。亡くなったすべての人が安らかであってください、ありがとうということを必ず祈ります」\n\n主催した実行委員会の事務局長：\n「忘れてほしくない、忘れないということ。追悼式を通じて、災害を考えてもらうことが必要だし、望んでいる」\n愛知のニュース,[],[]
名鉄百貨店が「車いす補助器具」の製造販売　前輪を浮かせ段差や砂利道に対応…月間200台の販売目指す（テレビ愛知）,https://news.yahoo.co.jp/articles/c38295ec67cba84fa13fd3a2d7f7391fa0247f55,https://newsatcl-pctr.c.yimg.jp/t/amd-img/20240311-90004398-tvaichi-000-1-thumb.jpg?exp=10800,2024-03-11T19:12:01+09:00,2024-03-11T19:12:01+09:00,テレビ愛知,tvaichi,テレビ愛知,350,\nテレビ愛知\n地震をはじめ、全国で自然災害が起きるなか、体に障害のある人や高齢者が災害時に車いすで避難しやすくする補助器具の製造販売を名鉄百貨店が始めます。\n\n段差のある道でも、不安定な砂利道でも…車いすの前に取り付けることで前輪を浮かせ、車いすに乗った人を素早く安全に運ぶ、補助器具「ジンリキ」です。\n\n「ジンリキ」は東日本大震災で障害者が逃げ遅れる例が多かったことから、10年前に長野県の会社が開発。名鉄百貨店では顧客のニーズと合致するとして、「ジンリキ」の販売だけでなく、製造にも乗り出すことを決めました。\n\n名鉄百貨店 担当者：\n「車いすを利用している消費者のニーズに対応すると考えてもらえれば」\n\n名鉄百貨店では月間200台を目標に販売を強化します。\n愛知のニュース,[],[]
ラグビー選手に向けたスタミナ丼を専門学校生がプロデュース　元選手「マグロとウナギ両方乗って最高」（テレビ愛知）,https://news.yahoo.co.jp/articles/14aaa0f0bd6a2fcdf24d85ee1d9481662b40abfd,https://newsatcl-pctr.c.yimg.jp/t/amd-img/20240311-90004401-tvaichi-000-1-thumb.jpg?exp=10800,2024-03-11T19:03:01+09:00,2024-03-11T19:03:01+09:00,テレビ愛知,tvaichi,テレビ愛知,314,\nテレビ愛知\nマグロやウナギ、トロロなど、エネルギー補給や疲労回復に効果のある食材を盛りつけた、その名も「スタミナチャージ！まぐろとうなぎの山かけ丼」。\n\nラグビーチーム「トヨタヴェルブリッツ」のクラブハウスで11日、スポーツ栄養学を学ぶ専門学校の学生がプロデュースした海鮮丼の試食会が開かれました。\n\n運動量の多いラグビー選手を想定し、学生が考えたスタミナメニュー。試食した感想は…\n\nトヨタヴェルブリッツのOB 谷口智昭さん：\n「うまいし、マグロ丼とうな重が両方食べられるので最高。選手も喜ぶ」\n\nこのメニューは1杯1700円で、「出前館」のデリバリー限定で3月20日まで販売します。\n愛知のニュース,[],[]
陸前高田市に派遣の名古屋市職員「地域防災をこちらで学び、名古屋市に還元したい」（テレビ愛知）,https://news.yahoo.co.jp/articles/7c1bd01f540272fbe173778b2450dd66faed3b5e,https://newsatcl-pctr.c.yimg.jp/t/amd-img/20240311-90004397-tvaichi-000-1-thumb.jpg?exp=10800,2024-03-11T19:12:01+09:00,2024-03-11T19:12:01+09:00,テレビ愛知,tvaichi,テレビ愛知,913,\nテレビ愛知\n東日本大震災の被災地に派遣された名古屋市職員に話を聞きました。話を聞いたのは、2023年4月に派遣された五十川涼一主事です。陸前高田市防災局で主に防災啓発を担当しています。被災地の復興の現状を聞くと…\n\n名古屋市から陸前高田市に派遣 五十川涼一主事：\n「令和4年11月に博物館がオープン。それをもってハードの復興は完成した。私自身こちらで暮らして1年くらいになるが、皆さん休日はショッピングセンターでショッピングを楽しんだり公園で遊んだりと、日常というか、復興を実感している。」\n\n市のシンボル的な存在である市立博物館の再建も終了し、街は日常を取り戻しつつあるということです。ただ、五十川さん驚いたことがあるといいます。\n\n名古屋市から陸前高田市に派遣 五十川涼一主事：\n「地域の人と関わることも多いが、やはり、やり取りする中で皆さん非常に防災に関する意欲が強い。東日本大震災を契機に防災に関する重要性を理解して自ら勉強を進める人がかなり多い。防災に関する意欲・知識の高さに非常に感銘を受けた」\n\n災害の悲惨さを忘れず、防災の意識を高く保つため、陸前高田市はある制度を導入しています。\n\n名古屋市から陸前高田市に派遣 五十川涼一主事：\n「『陸前高田市防災マイスター養成講座』という防災講座がある。受講生に防災に関する意識や技術を身につけてもらい、それを持ち帰って地域での活動に生かしてもらう」\n\n「防災マイスター」は、防災力の向上を目指して陸前高田市が養成を進めていて、講座を受講することでハザードマップの正しい見方や適切な避難行動の知識などを身につけることができます。\n\n名古屋市から陸前高田市に派遣 五十川涼一主事：\n「どうしても災害時に職員ができることは限られる。そのため平時から地域の防災リーダーを育てていて、非常時の対応にあたってもらう。やはり地域防災力の向上は、どこの自治体でも非常に重要。どういう風に地域防災を盛り上げていくかは私自身こちらで学んで、それを名古屋市に還元することは名古屋市の防災を一歩二歩進める上でも重要になってくると思う」\n愛知のニュース,[],[]
新幹線内で警備員が女性客の体を触る　23年夏ごろから20回程度繰り返したと説明　7日付けで諭旨解雇に（テレビ愛知）,https://news.yahoo.co.jp/articles/952e3d68cd7e805bd7159567f50dd4f92f2cff74,https://newsatcl-pctr.c.yimg.jp/t/amd-img/20240311-90004402-tvaichi-000-1-thumb.jpg?exp=10800,2024-03-11T19:00:01+09:00,2024-03-11T19:00:01+09:00,テレビ愛知,tvaichi,テレビ愛知,315,\nテレビ愛知\nJR東海は11日、新幹線の車内警備を委託している全日警の警備員が乗客の女性の体を故意に触る不適切な行為をしていたと発表しました。\n\nJR東海などによりますと、25歳の男性警備員は2月下旬、座席で寝ている乗客の女性の上半身を通過時に手で触ったということです。\n\n男性警備員は「わいせつ目的で、周りに人がいなければ大丈夫だと思った」と話していて、23年夏ごろから同様の行為を20回程度、繰り返していたと説明しています。\n\n今回の件は乗客の女性から駅員に「車内で乗務員に体を触られたような気がする」と申告があり、発覚しました。\n\nこの警備員は3月7日付けで諭旨解雇処分となっています。\n愛知のニュース,[],[]
日経平均株価は急落　外国為替相場の円高ドル安進行などを背景に大幅値下がり　終値3万8820円（テレビ愛知）,https://news.yahoo.co.jp/articles/a3ce42b4c2ca5d17cd56ede3ac6df158ab9afc89,https://newsatcl-pctr.c.yimg.jp/t/amd-img/20240311-90004403-tvaichi-000-1-thumb.jpg?exp=10800,2024-03-11T16:01:02+09:00,2024-03-11T16:01:02+09:00,テレビ愛知,tvaichi,テレビ愛知,102,\nテレビ愛知\n11日の日経平均株価は急落。\n\n外国為替相場の円高ドル安の進行などを背景に大幅な値下がりとなりました。\n\n終値は8日に比べて868円安い、3万8820円でした。\n愛知のニュース,[],[]
「引っ越しトラブル」に巻き込まれないための注意点は　大切なのは「相見積もり」と「荷造り」（テレビ愛知）,https://news.yahoo.co.jp/articles/afea38e1983ad6af4cae28521e0318745ea46332,https://newsatcl-pctr.c.yimg.jp/t/amd-img/20240311-90004404-tvaichi-000-1-view.jpg?exp=10800,2024-03-11T16:05:02+09:00,2024-03-11T16:05:02+09:00,テレビ愛知,tvaichi,テレビ愛知,1265,\n引っ越しの注意点\nもうすぐ新年度。新たな生活拠点へ引っ越しをされる人も多いのではないでしょうか。引っ越し業者への依頼について国土交通省は、3月16日から4月7日にかけて集中すると予想しています。2024年度2月末時点で国民生活センターに寄せられた相談件数は1729件でした。「家具が壊されたが十分な補償がなかった」「見積もりよりも多い金額を支払った」といった相談が多くなっています。\n\nそこで宅地建物取引士で住宅・不動産ライターの椎名前太さんに、引っ越しの注意点について話を聞きました。「見積もり」「荷造り」「引っ越し後」のそれぞれで見ていきます。\n最低3社以上の業者で見積もりを行う\n住宅・不動産ライター\n●見積もりのポイント\n・「相見積もり」と「訪問見積もり」を組み合わせ、最低3社以上で見積もりをする\n\n相見積もりでは複数の業者の料金やサービス内容を比較できるので、自分のニーズに合った業者を選ぶことができ、値下げ交渉もしやすくなります。また訪問見積もりでは、業者に荷物の量や家具の大きさを実際に確認してもらうことで、インターネットや電話より正確な見積もりが出ます。事前に契約内容をしっかり確認できるので、見積もりよりも支払いが多いといった業者とのミスマッチを防ぐことができます。\n荷造りは必ず前日までに終わらせる\n荷造りは前日までに行う\n●荷造りのポイント\n・必ず前日までに終わらせること\n・荷物の分類を段ボールに記入すること\n\n引っ越し業者が決まったら次は荷造りです。荷造りは前日までに余裕を持って終わらせないと、引っ越し直前に自分が焦るという精神的な負担だけではなく、金銭的な負担につながってしまう可能性があります。\n\n引っ越しのときに詰め終わっていない荷物は、業者が作業を手伝うことになりますが、これには追加料金がかかってしまいます。さらに繁忙期は引っ越し業者の1日のスケジュールが詰まっていることが多いので、業者や次の人に迷惑をかけないためにも、荷造りは計画的に行いましょう。\n\nそして荷物の分類について。割れ物の有無や荷物の内容、使う場所などを段ボールに書いておきます。自分が荷物の中身を把握できるだけでなく、業者も段ボールをトラックに積み込む順番や新居での置き場所が分かりやすくなり、作業の効率化につながります。\n家具家電の破損チェックを徹底\n相見積もり×訪問見積もり\n●引っ越し後のポイント\n・家具家電の破損チェック\n・3カ月以内に報告を\n\nもし破損があった場合は、作業日から3カ月以内に申告しないと事業者の責任が消滅します。引っ越し後に確認するのはもちろん、引っ越し当日も自分の目で確認しておくと安心です。万が一、引っ越しに関するトラブルがあった場合は、なるべく早く引っ越し業者やお住まいの地域の消費生活センターへ相談するようにしてください。\n\n引っ越し前後は忙しくなると思いますが、トラブルが発生しやすいので注意しましょう。\n愛知のニュース,"['https://newsatcl-pctr.c.yimg.jp/t/amd-img/20240311-90004404-tvaichi-000-1-view.jpg?exp=10800', 'https://newsatcl-pctr.c.yimg.jp/t/amd-img/20240311-90004404-tvaichi-001-1-view.jpg?exp=10800', 'https://newsatcl-pctr.c.yimg.jp/t/amd-img/20240311-90004404-tvaichi-002-1-view.jpg?exp=10800', 'https://newsatcl-pctr.c.yimg.jp/t/amd-img/20240311-90004404-tvaichi-003-1-view.jpg?exp=10800']","['https://news.yahoo.co.jp/articles/afea38e1983ad6af4cae28521e0318745ea46332/images/000', 'https://news.yahoo.co.jp/articles/afea38e1983ad6af4cae28521e0318745ea46332/images/001', 'https://news.yahoo.co.jp/articles/afea38e1983ad6af4cae28521e0318745ea46332/images/002', 'https://news.yahoo.co.jp/articles/afea38e1983ad6af4cae28521e0318745ea46332/images/003']"
企画展「昭和レトロ食器図鑑」で昭和の世界にタイムスリップ　懐かしの食器が勢ぞろい（テレビ愛知）,https://news.yahoo.co.jp/articles/2dc4515536aad8c5fcd6f5eec19c39ccda789869,https://newsatcl-pctr.c.yimg.jp/t/amd-img/20240311-90004382-tvaichi-000-1-thumb.jpg?exp=10800,2024-03-11T13:40:01+09:00,2024-03-11T13:40:01+09:00,テレビ愛知,tvaichi,テレビ愛知,746,\nテレビ愛知\n愛知県北名古屋市にある「北名古屋市歴史民俗資料館・昭和日常博物館」では3月8日から、企画展「昭和レトロ食器図鑑」が開催されています。カレーライスの皿やクリームソーダのグラスなど、レトロな食器が勢ぞろい。会場に駆け付けた長江麻美アナウンサーも、その懐かしさに感動した様子です。\n昭和日常博物館\n北名古屋市歴史民俗資料館・昭和日常博物館には、昭和時代に使われていた懐かしい品々が1万点ほど常設展示されています。\n\n長江アナウンサー：\n「銀の縁のテーブルですが、祖父母の家にはあったなと思い出しました！ 懐かしい気持ちに、感極まっています」\nグラス\n長江アナウンサー：\n「昭和時代に使われていたグラス。私は、平成生まれですが子どもの頃は使っていたなという懐かしさと同時に、すでに“レトロ”になってしまうということに驚きの気持ちでいっぱいです。会場内には昭和の食器が1000点以上も展示されていて、懐かしさのほかに、新しさも感じます」\n\nそんな北名古屋市歴史民俗資料館について、専門幹の市橋芳則さんに話を聞きました。\n\n――なぜ昭和の食器を展示しようと思いましたか。\n\n北名古屋市歴史民俗資料館 市橋芳則さん：\n「『昭和レトロ』と呼ばれるジャンルのアイテムを、皆さんに共有したいと思い、この企画を考えました。ここでは30年～40年ほど前のものを展示しています。今見てもかっこいいと感じたり、かわいいと感じたりしますね」\nカレー\n長江アナウンサー：\n「さらに隣の建物に『いなカフェ』というカフェがあり、実際に昭和の食器でカレーを食べることができます。昭和のカレーと令和のカレーのあいがけになっているので、ぜひ楽しんでみてください」\n愛知のニュース,"['https://newsatcl-pctr.c.yimg.jp/t/amd-img/20240311-90004382-tvaichi-001-1-view.jpg?exp=10800', 'https://newsatcl-pctr.c.yimg.jp/t/amd-img/20240311-90004382-tvaichi-002-1-view.jpg?exp=10800', 'https://newsatcl-pctr.c.yimg.jp/t/amd-img/20240311-90004382-tvaichi-003-1-view.jpg?exp=10800']","['https://news.yahoo.co.jp/articles/2dc4515536aad8c5fcd6f5eec19c39ccda789869/images/000', 'https://news.yahoo.co.jp/articles/2dc4515536aad8c5fcd6f5eec19c39ccda789869/images/001', 'https://news.yahoo.co.jp/articles/2dc4515536aad8c5fcd6f5eec19c39ccda789869/images/002']"
