headline,mainEntityOfPage,image,datePublished,dateModified,author,media_en,media_jp,str_count,body,images,external_links
人口減少による労働力不足を自動化で補うZOZOの物流戦略、約50％の省人化をめざす新物流拠点「ZOZOBASE習志野3」を開設（ネットショップ担当者フォーラム）,https://news.yahoo.co.jp/articles/1a47f3fec6bad19e6d030dcc644d67f15c34d711,https://newsatcl-pctr.c.yimg.jp/t/amd-img/20260507-00000005-netshop-000-1-view.jpg?exp=10800,2026-05-07T10:01:20+09:00,2026-05-07T10:01:20+09:00,ネットショップ担当者フォーラム,netshop,ネットショップ担当者フォーラム,800,「ZOZOBASE習志野3」の外観イメージ ZOZOは4月30日、千葉県習志野市に新たな物流拠点「ZOZOBASE習志野3」を開設すると発表した。2027年8月に一部機能の稼働を開始し、2028年10月の本格稼働を予定する。ファッションECサイト「ZOZOTOWN」の成長を見据え、自動化を一段と進めることで、約50％の省人化をめざす。 新拠点は、稼働から約13年が経過した「ZOZOBASE習志野1」の機能を移管・刷新し、再構築する。人口減少に伴う労働力不足を背景に、設備投資や新たなオペレーションの導入を進め、物流業務の高度化を進める。 ZOZOはすでに、自動化設備を導入した「ZOZOBASEつくば3」で約30％の省人化を達成している。「ZOZOBASE習志野3」ではその実績を踏まえ、さらなる効率化を進めることで、省人化率約50％を目標に掲げる。 拠点再編として、「ZOZOBASE習志野1」の機能は「ZOZOBASE習志野3」へ移行する。一方、「ZOZOBASE習志野1」には「ZOZOBASE習志野2」の機能を移管する計画。これに伴い、「ZOZOBASE習志野2」は2028年3月末の契約満了をもって閉鎖する予定だ。再編後も物流拠点数に大きな変動はないとしている。 また、「ZOZOBASE習志野3」で使用する電力は、他拠点と同様に100％実質再生可能エネルギーを採用する予定。省人化・自動化に加え、環境配慮の観点からも物流拠点の高度化を進める。 □ 施設概要 ・物件名：習志野LCII ・所在地：千葉県習志野市茜浜3丁目34番 ・敷地面積：5万7080平方メートル ・延床面積：13万3623平方メートル ・階数：地上5階建 ・竣工：2027年2月（予定） ・一部稼働開始：2027年8月（予定） ・本格稼働：2028年10月（予定） ・使用電力：100％実質再生可能エネルギー（予定）,[],[]
ZOZOの取扱高6660億円で8.4%増。売上高は2283億円で7.2%増、広告売上は118億円に拡大（ネットショップ担当者フォーラム）,https://news.yahoo.co.jp/articles/7652a03f25aaae9369d18a99cd0ea15f11036d45,https://newsatcl-pctr.c.yimg.jp/t/amd-img/20260507-00000004-netshop-000-1-view.jpg?exp=10800,2026-05-07T09:01:25+09:00,2026-05-07T09:01:25+09:00,ネットショップ担当者フォーラム,netshop,ネットショップ担当者フォーラム,921,ZOZOの2026年3月期連結業績における商品取扱高は、前期比8.4％増の6660億3500万円だった。 事業別の内訳は、「ZOZOTOWN事業」が同5.0％増の5166億1000万円。このうち、受託販売は同5.2％増の4927億4300万円、買取・製造販売は同24.3％減の27億9500万円、USED販売は同7.3％増の210億7400万円だった。 営業利益は前期比7.1％増の693億6600万円（画像はIR資料から編集部がキャプチャ） 「ZOZOTOWN事業」以外では、「Yahoo!ショッピング」「Yahoo!オークション」で構成する「LINEヤフーコマース」が同13.4％増の789億2600万円、2026年3月期から連結対象となった欧米を中心に展開するファッションショッピングプラットフォーム「LYST」が422億4500万円、「BtoB事業」が同36.1％減の83億7700万円、「その他」が198億7200万円となった。また、広告事業の売上高は同6.0％増の118億8400万円だった。 ZOZOTOWN事業は、1月の好調な集客や豊富なセール在庫、プロモーション強化を背景に、冬の本セールが伸長。LINEヤフーコマースも、「本気のZOZO祭」の開催日数増加などにより堅調に推移した。一方で、LYSTはラグジュアリー業界の不調や米関税制度の変更などを背景に計画を下回り、全体では計画未達となった。 商品単価は前期比で1.6%減（画像はIR資料から編集部がキャプチャ） 平均商品単価は同1.6%減の3974円。新品商品の上代の引き上げは一服し、価格水準は前年同等となった一方で、前期比でセール販売比率が増加したことにより平均商品単価は減少した。 出荷単価は前年同期比1.3%減（画像はIR資料から編集部がキャプチャ） 平均出荷単価は同1.3％減の8864円。セール販売比率の上昇により1注文あたりの購入点数は増加したものの、平均商品単価の下落が上回り、結果として平均出荷単価は低下した。なお、1万2000円以上で送料無料とする施策は、前年同期より投下量を抑えつつ効果的に展開できたため、購入点数へのマイナス影響はなかったという。,[],[]
AI経由の流入は「高CVR・低返品率」。滞在・回遊・収益性のすべてで「逆転」が起きたAIトラフィックの衝撃（ネットショップ担当者フォーラム）,https://news.yahoo.co.jp/articles/310a2ad6f48d02f8e42dccc55ffae34b8e74f5ae,https://newsatcl-pctr.c.yimg.jp/t/amd-img/20260507-00000003-netshop-000-2-view.jpg?exp=10800,2026-05-07T08:01:24+09:00,2026-05-07T08:16:22+09:00,ネットショップ担当者フォーラム,netshop,ネットショップ担当者フォーラム,965,AIからの流入トラフィックが増え、ECサイトには好影響が出ています。Adobeの分析によると、小売ECサイトに訪問するユーザーのコンバージョン率が向上。エンゲージメント、サイト滞在時間など複数の観点から見ても、AI経由の流入が増えていることが良い影響を与えていることがわかっています。 AI経由で流入したユーザーのコンバージョン率が向上 2025年は、エージェント型コマースが小売ECサイトへの「新たな集客源」として、急速に台頭した1年でした。AI経由のトラフィック数は前年比で4ケタ増で成長。その一方で、AIを活用した商品の発見が今後も継続してトラフィック増の成長を維持できるのか、そしてECサイトのコンバージョンを向上させられるのかについては、疑問が残っていました。 Adobe Digital Insightsが2026年4月中旬に発表したデータ分析は、少なくとも2026年1～3月の期間においては、これらの疑問に答えるものでした。AI経由のトラフィックに起因するECサイトのコンバージョンは改善傾向にあり、Adobeのアナリストによると、AI経由の訪問者と非AI経由のトラフィックの関係性は、従前と比べて「逆転」。AI経由の訪問者の方がコンバージョン率に貢献しているのです。 AdobeはECプラットフォームの運営支援、サイト構築・開発支援、Web分析などさまざまなサービスを提供しています。北米のEC売上高トップ2000社のうち、130社以上が同社のECプラットフォームを利用。100社以上がサイト構築に、200社以上がWeb分析にAdobeのサービスを導入しています。 ■ 非AI経由の流入を42%上回る AI経由の流入（緑色の折れ線グラフ）と非AI経由の流入（グレーの折れ線グラフ）の推移（画像はAdobeの調査レポートから編集部がキャプチャして追加） Adobeの分析結果によると、2026年3月の時点で、小売事業者が運営するECサイトへのAI経由の流入トラフィックは、非AIソースからのトラフィックに比べて42%高いコンバージョン率を記録しました。Adobeによると、これは1年前とは正反対の結果です。1年前の時点では、AIソースからの訪問者のコンバージョン率は、非AIトラフィックの約半分にとどまっていました。,[],[]
「楽天トラベル」、宿泊施設を提案するAIエージェントに予約機能を追加。提案から予約まで一貫サポート（ネットショップ担当者フォーラム）,https://news.yahoo.co.jp/articles/e8d2011a34eb98d8b569427733fbf8da3ad5bbee,https://newsatcl-pctr.c.yimg.jp/t/amd-img/20260507-00000002-netshop-000-2-view.jpg?exp=10800,2026-05-07T07:31:22+09:00,2026-05-07T08:31:24+09:00,ネットショップ担当者フォーラム,netshop,ネットショップ担当者フォーラム,817,楽天グループは4月30日、ユーザーに最適な宿泊施設を提案する「楽天トラベル」のAIエージェントに予約機能を追加した。これにより、宿泊施設の提案から予約までをAIが一貫してサポートする。今後は、閲覧履歴、予約履歴に基づき、好みや利用構成に合わせた提案など、さらなるパーソナライズ化を予定している。 ユーザーの宿泊日、設備、重視したい点などの希望条件から、AIが複数の候補の中から宿泊施設やプランを提示する。ユーザーは予約ボタンから予約を完了できる。楽天IDでログインするユーザーには、獲得予定ポイントや割引条件を反映する。 「Rakuten AI」の利用イメージ ユーザーの予約履歴を基に、過去に利用した宿泊施設から予約可能なプランの提案も可能としている。 ■ AIエージェント「Rakuten AI」とは AIエージェントの名称は「Rakuten AI」。楽天グループが2025年9月に提供を開始したAIエージェント「楽天トラベルAIホテル探索」の最新版となる。今回、名称を「Rakuten AI」に改称した。 「楽天トラベルAIホテル探索」の画面サンプル 「Rakuten AI」は、「楽天トラベル」の宿泊施設に寄せられたクチコミ、各宿泊施設が提供する宿泊プラン、ユーザーの予約トレンドなどの分析データを基に、旅行者のニーズに合わせて宿選びをサポートする。自然言語を理解して要望を的確に捉える処理能力、「楽天トラベル」上の分析データに加えてWebの検索結果も提案に反映できる情報の網羅性、複数の宿を一覧で比較したり地図上に表示したりできる見やすさが特長となっている。 ■ 予約機能追加の背景 「楽天トラベル」では、「Rakuten AI」を利用したユーザーの予約数が継続的に増加しているという。こうした傾向をふまえて予約機能を追加した。「Rakuten AI」の名称変更に合わせて、今後はチャット画面やアイコンのデザインを刷新する。,[],[]
カクヤス、自社配達網をリユース拠点とする実証実験開始。ジモティーと連携するサステナビリティ検証とは？（ネットショップ担当者フォーラム）,https://news.yahoo.co.jp/articles/b73c48960346546602dd3dadd72eedf0225debdd,https://newsatcl-pctr.c.yimg.jp/t/amd-img/20260507-00000001-netshop-000-1-view.jpg?exp=10800,2026-05-07T07:01:31+09:00,2026-05-07T07:01:31+09:00,ネットショップ担当者フォーラム,netshop,ネットショップ担当者フォーラム,1038,ひとまいるの子会社であるカクヤスは4月28日、リユースプラットフォーム「ジモティー」を運営するジモティーと連携し、カクヤスの自社配達網をリユース拠点として開放する実証実験を開始した。カクヤスが展開する店舗のうち2店舗（神奈川県横浜市内）に、消費者が家庭の不要品を無償で持ち込める回収スポット「ジモティースポットミニ」を設置している。実施期間は7月31日まで。 カクヤスは首都圏を中心に200以上の店舗「なんでも酒やカクヤス」を展開。配達エリア内であればビール1本から即日無料配達に対応する物流網を構築している。商品の配送だけでなく、再使用されるリターナブル容器の回収なども行う「2way型」のサービスも手がける。 今回、実証実験の対象店舗としている2店舗に持ち込まれた不要品は、各店舗で受付後、既存の酒類配送の戻り便を活用して「ジモティースポット」へ移送し、リユース品として販売する。酒の配送で培った独自の「2way」物流（配送と回収）の仕組みを活用し、効率的な回収の有効性を検証する。今回の実証実験を通じて、今後は対象店舗、エリア、連携先の拡大を図る。 リユース回収品の物流スキーム 持ち込みの対象とする不用品は、小型家電、衣類、レジャー用品、服飾品、おもちゃ、生活雑貨、食器など。リユースできる状態かつ、組み立て時の3辺合計の長さが180cm以内のモノを対象とする。 旧カクヤスグループは、2025年7月に社名を「株式会社ひとまいる」に変更した。ひとまいるは、サステナビリティの重点課題として、「サーキュラーエコノミー（資源循環）の推進」を掲げている。この一環として、2024年6月からは飲食店向けの廃食用油回収サービスを手がけている。回収した廃食用油はレボインターナショナルを通じて持続可能な航空燃料などへ再資源化している。 今回の実証実験では、自社の店舗・配送網と「ジモティー」の仕組みを掛け合わせ、リユースの社会インフラとしての有効性を検証する。 □ サービス概要 ・ サービス名：ジモティースポットミニ ・ 実施期間：2026年4月28日～7月31日 ・ 対象店舗：神奈川県横浜市内の2店舗（「なんでも酒やカクヤス 東神奈川店」「なんでも酒やカクヤス 保土ヶ谷店」） ・ 受付時間：東神奈川店：10:00～21:00／保土ヶ谷店：10:00～22:00 ・ 持ち込み対象品：小型家電、衣類、レジャー用品、服飾品、おもちゃ、生活雑貨、食器など ・ 持ち込み料金：無料,[],[]
