headline,mainEntityOfPage,image,datePublished,dateModified,author,media_en,media_jp,str_count,body,images,external_links
22年ぶりのプレミア制覇、クラブ史上初のCL制覇近づくアーセナル　今夏アルテタ監督と新契約の交渉を開始か（theWORLD（ザ・ワールドWeb））,https://news.yahoo.co.jp/articles/d36a0b2c51d3645cd06091241d75c8d9408ca74f,https://newsatcl-pctr.c.yimg.jp/t/amd-img/20260507-00010007-theworldw-000-1-view.jpg?exp=10800,2026-05-07T15:01:37+09:00,2026-05-07T15:01:37+09:00,theWORLD（ザ・ワールドWeb）,theworldw,theWORLD（ザ・ワールドWeb）,747,今季はタイトル獲得なるか タイトルへの期待高まるアルテタ photo/Getty Images アーセナルは今夏、指揮官のミケル・アルテタと新契約の交渉を本格化させる予定だという。英『TalkSPORT』が報じている。 崩壊寸前の4月が嘘のよう ムード一変のアーセナル、サポーターにアルテタも感銘「こんな雰囲気は初めて」 2019年よりアーセナルの指揮官に就任したアルテタは積極的な補強を繰り返し、タイトルを争うチームを作り上げたが、現状アルテタ政権で獲得した主要タイトルは2019-20シーズンのFAカップのみ。着実にチームを成長させていったが、肝心なタイトルまであと一歩届かないシーズンが続いていた。 今シーズンもアーセナルは序盤から圧巻の強さを見せていたものの、カラバオカップ決勝でマンチェスター・シティに敗戦し、続くFAカップ準々決勝でサウサンプトンに敗戦した時にはアルテタ解任を求める声も挙がった。しかし、そこからアーセナルは立ち上がり、22年ぶりのプレミア制覇が間近に迫っている。またCLでも20年ぶりの決勝進出を決め、クラブ史上初の欧州王者へ王手をかけた。 アーセナルにとって歴史的なシーズンになる可能性があるなか、クラブは現行契約では2027年6月までとなっているアルテタの任期を延長したいと考えている模様。すでに予備的な話し合いは行われているようで、アルテタ自身もアーセナルに長く留まることを希望しているようだ。 厳しい視線を受け、プレミアでは3年連続2位と悔しい思いをしてきたアルテタ・アーセナル。今シーズンは歴史的な二冠達成が間近に迫っているが、2つのトロフィーを掲げ、アルテタはアーセナルでさらなる黄金期を築くための新契約を締結するのか注目だ。 構成／ザ・ワールド編集部,[],[]
三笘同僚オランダ代表DFは今夏争奪戦に？　リヴァプール、チェルシー、トッテナムがファン・ヘッケ獲得へ（theWORLD（ザ・ワールドWeb））,https://news.yahoo.co.jp/articles/aa2fdce408315fe06fd2d081aacb7cdfad74d137,https://newsatcl-pctr.c.yimg.jp/t/amd-img/20260507-00010006-theworldw-000-1-view.jpg?exp=10800,2026-05-07T14:10:10+09:00,2026-05-07T14:10:10+09:00,theWORLD（ザ・ワールドWeb）,theworldw,theWORLD（ザ・ワールドWeb）,654,今季は公式戦37試合に出場 ブライトンのファン・ヘッケ photo/Getty Images 日本代表の三笘薫が所属するブライトンでプレイするオランダ代表DFヤン・ポール・ファン・ヘッケは今夏の移籍市場で争奪戦になるようだ。 5500万ポンドの「期待外れFW」が今季ワースト補強に選出 リヴァプールの“失敗作”らを上回り評価低迷、売却価格は半額以下に下落 現在25歳のファン・ヘッケは2020年9月にオランダのNACブレダからブライトンに加入。ヘーレンフェーン、ブラックバーンへのレンタル移籍を経て、2022年夏復帰した。初年度こそ出場は限定的だったが、その後は定位置を確保し、今シーズンはここまで公式戦37試合に出場するなどチームの守備の要として君臨している。 そんなファン・ヘッケの現行契約は2027年までで、今夏残り1年を迎える。選手自身はステップアップを計画していると考えられているなか、英『TEAMTALK』によると、リヴァプール、チェルシー、トッテナムが熱視線を送っているようだ。 しかし、現段階でファン・ヘッケ獲得レースで大きなアドバンテージを持っているのがロベルト・デ・ゼルビがいるトッテナムだという。ブライトン時代にオランダ代表DFを指導したデ・ゼルビはファン・ヘッケとの再会を希望しており、また同選手自身も恩師の下でプレイすることに前向きな姿勢だと同メディアは主張している。 プレミアでの経験も豊富なファン・ヘッケは即戦力として期待できるが、今夏の去就はいかに。 構成／ザ・ワールド編集部,[],[]
インテルのスクデットに繋がった若き2人のストライカー　エスポジト&ボニーに賭けたのは大正解だった「リスクがあるように見えたかもしれないが……」（theWORLD（ザ・ワールドWeb））,https://news.yahoo.co.jp/articles/2e9822767d04f9d2e4f510cc98a7cda7c8e6b3c3,https://newsatcl-pctr.c.yimg.jp/t/amd-img/20260507-00010005-theworldw-000-1-view.jpg?exp=10800,2026-05-07T13:30:02+09:00,2026-05-07T13:30:02+09:00,theWORLD（ザ・ワールドWeb）,theworldw,theWORLD（ザ・ワールドWeb）,680,ラウタロ、テュラムをカバーした2人 インテルでブレイクしたエスポジト photo/Getty Images 先日行われたセリエA第35節でパルマを撃破し、スクデットを手にしたインテル。前線で大きなプラスとなったのは、2トップのラウタロ・マルティネス&マルクス・テュラムをサポートした若いフランチェスコ・ピオ・エスポジト（20）、アンジェ・ヨアン・ボニー（22）の存在だ。 ［動画］インテルはパルマに勝利してスクデットを獲得 クラブのピエロ・アウリジオSDは、昨季から攻撃陣に新しい要素を取り入れる必要があったと振り返っている。開幕前の時点でエスポジトとボニーには疑問もあったが、インテルの判断は大正解だった。 「攻撃陣に何か新鮮なもの、新しい要素を取り入れる必要があることは分かっていた。レギュラー組の控えでプレイできる選手だ。時間が経つにつれて確信が生まれ、全員が貢献してくれた。当初ピオとボニーはリスクがあるように見えたかもしれないが、彼らの実力は分かっていた」 「近年の我々は若手イタリア人選手の育成に力を入れてきた。常にクオリティの高い選手を探し続けることが大事なのだ。今後は経験豊富な選手に加え、若手も獲得してバランスの取れたチーム作りをしていきたい。この方向性を継続していくつもりだ」（『Sky Sport』より）。 エスポジトは2030W杯へ向けた新生イタリア代表のエース候補となっており、インテルの育成が見事に機能している。インテルの成功はアズーリ復活に欠かせないものであり、来季へのさらなる補強と育成に期待が高まる。 構成／ザ・ワールド編集部,[],[]
現場への不介入に複数年契約　モウリーニョがペレス会長に突きつけたレアル復帰の条件が判明（theWORLD（ザ・ワールドWeb））,https://news.yahoo.co.jp/articles/7cd282e87d0e41440f1635d734f27b900036c158,https://newsatcl-pctr.c.yimg.jp/t/amd-img/20260507-00010004-theworldw-000-1-view.jpg?exp=10800,2026-05-07T12:20:20+09:00,2026-05-07T12:20:20+09:00,theWORLD（ザ・ワールドWeb）,theworldw,theWORLD（ザ・ワールドWeb）,691,新監督の有力候補 ベンフィカのモウリーニョ監督 photo/Getty Images 今シーズンの無冠がほぼ確定的な状況となったレアル・マドリードでは、今年1月から指揮を執るアルバロ・アルベロア監督の退任は確実と見られている。 デンベレがカウンターから先制弾！PSGが2年連続CLファイナル進出！ そのため現地メディアの注目点は後任人事へと移っていて、なかでもベンフィカのジョゼ・モウリーニョ監督の名前が有力候補として取り沙汰されている。 スペインメディア『ESdiario』によれば、レアルはモウリーニョ監督の招聘に向けた動きを本格化させているようだ。今週5日にはフロレンティーノ・ペレス会長がモウリーニョ監督と代理人のジョルジュ・メンデス氏とオンラインでの面談を行い、監督就任を打診したとも同メディアは伝えている。 この『ESdiario』の報道は、レアル内部の情報に詳しいスペイン人ジャーナリストのラモン・アルバレス氏も事実であると認めている。また、アルバレス氏はこの面談の際にモウリーニョ監督から幾つかの条件が提示されたと明かしている。 同氏によれば、選手起用やチーム編成といった現場での決定にペレス会長をはじめとしたクラブ上層部が介入しないことをモウリーニョ監督はまず要求。また、2年間の複数年契約、最大7人の余剰戦力の放出、メディカル部門の改革も監督就任の条件として出されたという。 モウリーニョ監督は、2010年5月から約3年にわたってレアルで指揮を執ったことがあるが、これらの条件が全て受け入れられない限り就任要請には応じない方針のようだ。 構成／ザ・ワールド編集部,[],[]
PSGとの大一番で輝けなかったムシアラ　現地メディアもチーム最低評価の厳しい採点（theWORLD（ザ・ワールドWeb））,https://news.yahoo.co.jp/articles/5ab98b6d9d1f8bbd8de2ab3245bb5fa55ae8ab4f,https://newsatcl-pctr.c.yimg.jp/t/amd-img/20260507-00010003-theworldw-000-1-view.jpg?exp=10800,2026-05-07T12:03:27+09:00,2026-05-07T12:03:27+09:00,theWORLD（ザ・ワールドWeb）,theworldw,theWORLD（ザ・ワールドWeb）,765,低調なパフォーマンスに終始 バイエルンのムシアラ(中) photo/Getty Images 6日(現地時間)、バイエルン・ミュンヘンはパリ・サンジェルマン(PSG)とのUEFAチャンピオンズリーグ(CL)準決勝2ndレグに臨み、1-1で引き分けた。この結果、2戦合計6-5でPSGが2大会連続の決勝進出を果たした。 デンベレがカウンターから先制弾！PSGが2年連続CLファイナル進出！ 1stレグを4-5で落とし、さらに2ndレグでも開始早々に先制点を奪われる苦しい展開となったバイエルンは、その後攻勢を強めてゴールに迫ったが、自陣ペナルティエリア付近まで引いて守備を固めたPSGを前に決定機を作り出すことができない。 終了間際にハリー・ケインがゴールを決めたものの時すでに遅く、無念の準決勝敗退となった。 バイエルンにとって痛手だったのは、ジャマル・ムシアラのコンディションが万全ではなかったことだろう。昨年夏のクラブワールドカップでの左足腓骨骨折と左足首脱臼の影響で長期離脱を強いられ、復帰後も負傷箇所の痛みが再発するなど怪我に苦しめられてきた同選手は、先発したものの攻撃の牽引役という本来の役割を果たすことができなかった。 このため、ムシアラに対しては現地メディアからも厳しい視線が向けられている。ドイツ紙『Bild』は、6段階評価の採点(1が最高、6が最低)でムシアラに対してチーム最低となる評価点5.0を下し、さらに以下のような寸評を加えている。 「昨年6月の大怪我の後の長いリハビリと負傷箇所に再び痛みが出た影響によって、このようなビッグマッチでは十分な働きができなかった。良いパスは少なく、ゴールに迫る危険なアクションもなかった。前半終了間際に放ったミドルシュートは枠を大きく外れていた」 構成／ザ・ワールド編集部,[],[]
微妙な判定の連続だったバイエルン対PSG戦　ドイツ国内からは誤審の指摘止まらず（theWORLD（ザ・ワールドWeb））,https://news.yahoo.co.jp/articles/963d080781777a013ad57e6fc280fba6d3461d68,https://newsatcl-pctr.c.yimg.jp/t/amd-img/20260507-00010002-theworldw-000-1-view.jpg?exp=10800,2026-05-07T11:41:51+09:00,2026-05-07T11:41:51+09:00,theWORLD（ザ・ワールドWeb）,theworldw,theWORLD（ザ・ワールドWeb）,886,試合結果に大きな影響 バイエルンのキミッヒ(右)とピニェイロ氏(左) photo/Getty Images 6日(現地時間)に行われたバイエルン・ミュンヘンとパリ・サンジェルマン(PSG)によるUEFAチャンピオンズリーグ(CL)準決勝2ndレグでの主審の判定が話題となっている。特にドイツメディアは2つの誤審があったと大きく報じている。 デンベレがカウンターから先制弾！PSGが2年連続CLファイナル進出！ 最初の問題の場面は、29分。それまでにイエローカードを一枚受けていたPSGのヌーノ・メンデスがドリブルで前進しようとしていたコンラッド・ライマーを止めようとした際、メンデスの伸ばした腕にボールが当たった。 これに対してバイエルンの選手とスタッフは、メンデスに対して二枚目のイエローカードを要求。しかし、主審のジョアン・ピニェイロ氏は近くでその場面を見ていた第4審助言を聞き入れてメンデスにイエローカードを出さず、さらにメンデスの腕に当たった後にライマーの腕にボールが触れていたとしてPSGにフリーキックを与えるという判定を下していた。 この場面について、元ドイツ代表のミヒャエル・バラック氏は誤審であると明言している。 「あれは試合を決定づける場面だった。第4審があのように一つのシーンに介入するのは初めてだろう。彼らはイエローカードを出したくなかったのだと思う。それが観客としての私の感想だ。主審を非難するつもりはないが、この場面はあのような判定を下すべき場面ではなかった」(ドイツ紙『Bild』より) また、その直後の31分のシーンも問題になっている。PSGのヴィティーニャの蹴ったボールがペナルティエリア内にいたジョアン・ネヴェスの伸ばした腕に当たったが、ピニェイロ氏はファウルを取らず、さらにVARの介入もなかった。 これについては、元審判員のマヌエル・グレフェ氏が「意図的に動かした腕にボールが当たっているため、ペナルティキックが与えられなければならなかった」と『Bild』の取材に対してコメントし、誤審であると指摘している。 構成／ザ・ワールド編集部,[],[]
FIFAが日本代表GK鈴木彩艶の成長に注目「欧州挑戦と怪我からの復帰を経て進化した」（theWORLD（ザ・ワールドWeb））,https://news.yahoo.co.jp/articles/0f85a0289863232de82ca10286ab7fe1fc551b50,https://newsatcl-pctr.c.yimg.jp/t/amd-img/20260507-00010001-theworldw-000-1-view.jpg?exp=10800,2026-05-07T09:50:09+09:00,2026-05-07T09:50:09+09:00,theWORLD（ザ・ワールドWeb）,theworldw,theWORLD（ザ・ワールドWeb）,1200,セリエAで大きく成長した鈴木 日本代表守護神として成長を続けてきた鈴木 Photo/Getty Images 日本代表は、今夏の北中米W杯の出場国のなかでも注目度が高いチームと言っていいだろう。アジア予選を圧倒的な戦績で突破し、ホスト国以外では世界最速で本大会出場を決めた。これまでの大会でドイツ、スペインを倒し、親善試合とはいえブラジルやイングランドといった優勝経験国を破ってきた日本は、今や何を起こすかわからないダークホースではなく、誰もが警戒する強豪として認識されるに至ったと言っても過言ではない。 ［動画］セリエAでも存在感絶大！ 日本の守護神・鈴木彩艶のビッグセーブ集 日本の躍進の一因として、GK鈴木彩艶の存在がある。長年弱点とされてきたポジションに、ついに現れた世界で戦えるGK。しかし、代表デビュー当初は不安定さも露呈し、批判も浴びていた。FIFA公式サイトは鈴木にインタビューを行い、アジアカップでの厳しい評価や欧州での経験について鈴木は語っている。 「最初は、ミスが重なって、日本代表の守護神として未熟な部分がありました」 鈴木はそう語っている。鈴木のデビューは2024年1月のアジアカップ・ベトナム代表戦。この試合で先発してから、鈴木は日本代表のほとんどの試合でゴールマウスを守るようになった。しかしクロス対応などで課題を露呈。準々決勝でイラン代表に敗れたこともあって、鈴木への評価は決して高いものではなかった。 インタビューでは、鈴木はそれ以降、プレイの選択の質を高めてきており、それが彼の成長の軸となったと綴られている。そして、それを磨いてきたのはセリエAのパルマでの経験だったと語られる。鈴木は以下のように発言している。 「クロスが出るか出ないかの判断、シュートをどこに弾くか、ビルドアップでどこに蹴るか、どうつなぐか。そのすべての判断の安定感が大事だと思います」 「（イタリアでは）判断力という部分が一番成長したと思います。すべてのプレイをどう選択するか、その判断力が磨かれていると感じています」 イタリアでは負傷も経験しながら、ひたすら自己を高めてきた鈴木。パルマでの活躍で、鈴木の市場価値は急騰を続けた。シント・トロイデンからパルマへ移籍した当時は750万ユーロほどだったが、『transfermarkt』によれば、現在は2000万ユーロの価値であるとされている。ユヴェントスやマンチェスター・ユナイテッドなど、ビッグクラブからの興味も囁かれるようになった。 「欧州挑戦と怪我からの復帰を経て進化した」「世界の舞台で真価を問われるGKとして、次のステージへ歩みを進めている」とインタビューは締められている。W杯でのプレイが目に止まり、ビッグクラブへと歩みを進めるというケースは珍しくない。今夏の活躍は、鈴木の価値をさらに高める可能性がある。 構成／ザ・ワールド編集部,[],[]
PSGが大会連覇へ王手！バイエルンの猛追を振り切り2大会連続ファイナル進出！（theWORLD（ザ・ワールドWeb））,https://news.yahoo.co.jp/articles/9c5185bce4dc9ad7cfc85c74ad10f697c27ba671,https://newsatcl-pctr.c.yimg.jp/t/amd-img/20260507-00010000-theworldw-000-1-view.jpg?exp=10800,2026-05-07T06:16:00+09:00,2026-05-07T06:16:00+09:00,theWORLD（ザ・ワールドWeb）,theworldw,theWORLD（ザ・ワールドWeb）,738,1stレグから一転して拮抗した展開に パリ・サンジェルマンの選手達 photo/Getty Images 6日(現地時間)、UEFAチャンピオンズリーグ(CL)準決勝2ndレグでバイエルン・ミュンヘンとパリ・サンジェルマン(PSG)が対戦し、1-1で引き分けた。 サカが値千金の決勝弾！アーセナルがCL決勝進出！ ファイナル進出をかけた大一番は、PSGの鮮やかな先制弾で幕を開けた。 3分、フビチャ・クヴァラツヘリアが左サイドからバイエルン守備陣の背後に抜け出し、敵陣深くまで侵入してからゴール前にグラウンダーのパスを供給。これをファーサイドにいたウスマン・デンベレが左足インサイドでゴールに押し込み、PSGが序盤でリードを奪う。 リードを許したバイエルンは、その後攻勢に転じ、PSGを押し込む展開となる。しかし守護神マトヴェイ・サフォノフを中心としたPSG守備陣が得点を許さず、PSGが1点をリードして前半を終えた。 後半に入ってもバイエルン優位の試合展開は変わらないが、決定機を作り出すことができず、終盤まで無得点の状態が続く。 そうした中、後半アディショナルタイム4分にアルフォンソ・デイヴィスのパスをゴール前で受けたハリー・ケインが左足を振りぬいてシュートを決め、バイエルンが同点に追いつく。 しかし、試合はその直後にタイムアップ。2ndレグは1-1の引き分けに終わったが、2戦合計スコアは6-5でPSGが1点上回り、2大会連続の決勝進出を決めた。 ［スコア］ バイエルン・ミュンヘン1-1(2戦合計5-6) パリ・サンジェルマン ［得点者］ バイエルン・ミュンヘン ハリー・ケイン(90+4) パリ・サンジェルマン ウスマン・デンベレ(3) 構成／ザ・ワールド編集部,[],[]
