headline,mainEntityOfPage,image,datePublished,dateModified,author,media_en,media_jp,str_count,body,images,external_links
日本代表選手が所属するシティがチェルシーのリーグ7連覇を阻止　英紙採点では長谷川唯が高評価「卓越した技術を持つ選手」（theWORLD（ザ・ワールドWeb））,https://news.yahoo.co.jp/articles/2a273b7e477d9deeb244f4703d6b7ea6d3b4eab4,https://newsatcl-pctr.c.yimg.jp/t/amd-img/20260507-00010015-theworldw-000-1-view.jpg?exp=10800,2026-05-07T22:50:34+09:00,2026-05-07T22:50:34+09:00,theWORLD（ザ・ワールドWeb）,theworldw,theWORLD（ザ・ワールドWeb）,802,来季は連覇を目指したい マンチェスター・シティの長谷川唯 photo/Getty Images 25-26シーズンのウィメンズ・スーパーリーグはマンチェスター・シティの優勝となった。 イングランド代表FW、大胆すぎる“鎖かたびらシースルードレス”姿を披露 長谷川唯も「いいね！」 スーパーリーグは近年チェルシーが存在感を示しており、19-20シーズンから昨季の24-25シーズンまで6連覇している。 今季も好成績を残して上位にいたが、シティに追いつけず。シティは2016年以来、10年ぶりのリーグタイトル獲得となった。 近年、イングランドのウィメンズ・スーパーリーグでプレイする日本人選手は増えており、シティには長谷川唯、山下杏也加らが所属している。 『TheGuardian』では見事リーグ優勝を成し遂げたシティの選手たちを、10点満点での採点で評価している。 トップは文句なしの10点満点となったFWカディジャ・ショーだ。ジャマイカ代表のFWで、スーパーリーグでは21試合で19ゴール。同メディアは彼女を「ペナルティエリア内でマークするのは不可能」だとオフザボールの質を評価している。 2番目の好成績を獲得したのは、日本代表でも活躍する長谷川。10点中9点の高評価、リーグ戦では19試合で2ゴール2アシストを記録した。 「卓越した技術を持つ選手で、瞬時に方向転換ができ、ボール保持時の落ち着きも抜群。今季はやや高い位置でプレイしており、絶妙なタイミングでのランニングは、シティの攻撃に新たな幅を生み出した」 リーグ戦での得点数は少し寂しいものの、それ以外の多くの場面でチームに貢献している。ピッチ上の多くの場面に顔を出してビルドアップをサポートする重要な選手であり、さらなる飛躍に期待が集まる。 他の選手でいえば、前線の藤野あおばは7.5点、GKの山下は7点の評価となった。 構成/ザ・ワールド編集部,[],[]
「まともな守備陣なしで勝てるスポーツはない」　セードルフ、ジェラードはアーセナルのCL優勝に期待（theWORLD（ザ・ワールドWeb））,https://news.yahoo.co.jp/articles/2e820b50eeb6a632904f21d53f55d103e1d9261c,https://newsatcl-pctr.c.yimg.jp/t/amd-img/20260507-00010014-theworldw-000-1-view.jpg?exp=10800,2026-05-07T22:30:35+09:00,2026-05-07T22:30:35+09:00,theWORLD（ザ・ワールドWeb）,theworldw,theWORLD（ザ・ワールドWeb）,826,PSGと激突 ギェケレシュとインカピエ photo/Getty Images 今季のCLファイナルのカードが決まった。アーセナルと、昨季の王者であるパリ・サンジェルマンだ。 アーセナル、アトレティコを破り20シーズンぶりのCL決勝へ！ サカの一発でホームに歓喜もたらしビッグイヤーに王手 アーセナルはレヴァークーゼン、スポルティングCP、アトレティコ・マドリードを、PSGはチェルシー、リヴァプール、バイエルンを下してファイナルにコマを進めた。 両チームは対照的な特長を持っている。アーセナルは堅守で、決勝トーナメントでは6試合を戦って、わずか2失点。ロースコアのゲームを制してきた。 一方のPSGは6試合で18ゴール。クオリティの高い攻撃陣を中心に相手の守備を破ってきた。 『BBC』ではPSG対アーセナルのファイナルに注目しており、レアル・マドリードやミランでのプレイ経験があるクラレンス・セードルフ氏は、堅守のアーセナルに期待を寄せている。 「アーセナルが今季多くのクリーンシートを達成し、最後まで勝ち進んで、大きな違いを生み出しているのを見てきた」 「優勝できるチームを1つ挙げるとすれば、それはアーセナルだ。まともな守備陣なしで勝てるスポーツを挙げてみてほしい。そんなスポーツは存在しない」 さらに元リヴァプールのスティーヴン・ジェラード氏も、アーセナルの勝利を予想するコメントを残している。 「この決勝戦では劣勢のチームが勝つ可能性があることを誰よりも知っている。我々がミランに勝った時も実力差は大きかった」 「アーセナルは質の高いチーム、一流の監督と対戦することになる。選手全員が最高のパフォーマンスを発揮しなければならない。フィジカルと体格を生かし、相手が望まない領域に引きずり込む必要がある。アーセナルにもチャンスは十分にあると思う」 今季の決勝は5月31日、ハンガリーのプシュカーシュ・アレーナで行われる。 構成/ザ・ワールド編集部,[],[]
アーセナルはCL決勝進出で259億円の賞金獲得も……　今夏の放出はマスト。昨夏の売却益はわずか21億円（theWORLD（ザ・ワールドWeb））,https://news.yahoo.co.jp/articles/4d0448e84eb93e8b434625558477f674a3b7eb2a,https://newsatcl-pctr.c.yimg.jp/t/amd-img/20260507-00010013-theworldw-000-1-view.jpg?exp=10800,2026-05-07T22:10:33+09:00,2026-05-07T22:10:33+09:00,theWORLD（ザ・ワールドWeb）,theworldw,theWORLD（ザ・ワールドWeb）,574,夏の動きに注目 アーセナルのアルテタ監督 photo/Getty Images CL準決勝でアトレティコ・マドリードを下したアーセナル。第1レグは1-1のドロー、第2レグはブカヨ・サカが得点を挙げ、計2-1でファイナル進出を決めた。 【動画】アーセナルがアトレティコを下してCL決勝へ ファイナルの相手は準決勝でバイエルンを破ったパリ・サンジェルマン。昨季の王者が順当に上がってきた。 『Sky Sports』によると、アーセナルはアトレティコを下して決勝にコマを進めたことで現時点での獲得賞金額が1億2200万ポンド（約259億円）となったようだ。ファイナルでPSGを下せば、ここに1000万ポンドが追加される。 アーセナルとしては財政を支える大きな収入となるが、それでも昨夏に行ったような大型補強を続けるには放出が必要となるようだ。 昨季は計8選手を獲得して総支出が2億6700万ポンド、一方で売却益はわずか1000万ポンド。現在のレートにして約21億円だ 放出候補はベン・ホワイトやレアンドロ・トロサール、ガブリエル・マルティネッリで、アカデミー出身のイーサン・ヌワネリ、マイルズ・ルイス・スケリーもここに含まれる。 ただ、スケリーは中盤で存在感を示し始めており、アーセナルを離れる可能性は低くなったのかもしれない。 構成/ザ・ワールド編集部,[],[]
日本代表もいずれ参戦？W杯でも親善試合とも違うFIFAの新大会「FIFAシリーズ」とは（theWORLD（ザ・ワールドWeb））,https://news.yahoo.co.jp/articles/e1002400fc6f16474379c7df2c33c54f83315c71,https://newsatcl-pctr.c.yimg.jp/t/amd-img/20260507-00010012-theworldw-000-1-view.jpg?exp=10800,2026-05-07T21:02:16+09:00,2026-05-07T21:02:16+09:00,theWORLD（ザ・ワールドWeb）,theworldw,theWORLD（ザ・ワールドWeb）,1526,2024年から始まった新たなFIFA主催の試合 2024年のFIFAシリーズ・エジプト大会にはクロアチア代表も参戦し優勝した Photo/Getty Images 近年、国際サッカー連盟（FIFA）が新たに発足した大会「FIFAシリーズ」というものをご存知だろうか。 「まさにホームラン級の傑作」日本のW杯ユニフォームが世界で2位にランクイン 1位に輝いたのは…… この大会はFIFAが2024年から始めた異なる大陸連盟に所属する代表チーム同士の対戦を促進する新たなプロジェクトで、普段ほとんど対戦しない大陸同士の代表戦を、FIFA主導でまとめて開催するというこれまでにない新しい形式のプラットフォームだ。この大会は偶数年の3月の代表ウィーク期間に開催され、4チームずつが1つの開催国に集結し、ミニトーナメント形式、あるいは2〜3試合程度の国際親善試合を行う。 最初の2024年大会は試験運用に近い位置づけとして開催され、サウジアラビア、エジプト、アルジェリア、スリランカ、アゼルバイジャンの5カ国で開催。全24チームが参加し、中にはクロアチアやボリビアといった実力国も参加。普段あまり見られないマッチメイクが大量に組まれ、大会は各地で大いに盛り上がった。今年3月に開催された第2回大会から本格的に導入され、開催国は9カ国に増加、参加国も34チームと増え、オーストラリアやチリ、ニュージーランドなどが参加した。 なぜFIFAはこの新たな大会を設けたのか、その背景には主に2つの理由がある。 まず1つ目に「異なる大陸連盟に所属する代表チーム同士の対戦を促進する」という点だ。2018年に欧州ネーションズリーグが開幕し、CONCACAF（北中米）でもネーションズリーグが開幕。2028年からはアフリカでも開催されることが決まり、近年の国際Aマッチは同じ地域の対戦カードが増加。その結果、近年の国際試合は同一地域内での対戦が急増し、大陸を跨いだマッチメイクが極めて困難な状況にある。FIFAはこの状況を打開すべく、自分たちが主導してその舞台を整えることで、世界全体のレベルの底上げに繋げる狙いがあるという。 そして2つ目の理由がランキング下位の国の国際試合の機会を増やすことだ。FIFAランキング上位の国であれば比較的マッチメイクを組みやすい一方で、ランキング下位国は財政難や、相手の都合もあり相手探しに苦しむケースが多い。こうした問題も解決すべく、この「FIFAシリーズ」ではFIFAがこれらの渡航費や滞在費などを全面的にバックアップし、対戦国も主催者側が調整することで、各国が安定して国際試合を行える環境を構築しているのだ。 そして気になるのが、この大会に日本代表が今後参戦する可能性だ。現時点で正式な発表はないものの、今後も大会が拡大されることが予想されており。出場国が増えるとなればいずれ参加する可能性は高い。特にネーションズリーグなどで強豪国とのマッチメイクが難しくなり、ワールドカップ以外で真剣勝負を繰り広げる機会が激減している日本にとってはメリットになることは間違いないだろう。 この大会はアフリカやアジア、オセアニアの中小国からは評価されているが、欧州ではむしろその逆だ。『The Guardian』はかつてこの「FIFAシリーズ」を「サッカー界の無作為な親善試合生成機」と呼ぶなど批判的な発言が多く、すでに飽和状態にある国際大会カレンダーに新たな試合を組み込むことに対し、選手の健康面や移動距離の増大を懸念する声が上がっているようだ。 様々な意見があるこの大会だが、今後どのようにして発展していくのか注目が集まる。 構成／ザ・ワールド編集部,[],[]
リーズへの移籍噂されるMF守田英正は争奪戦に？　アストン・ヴィラとブライトンらも注意深く監視中（theWORLD（ザ・ワールドWeb））,https://news.yahoo.co.jp/articles/d9cca939bd09b81c24ebbb851c19d959deec4ab2,https://newsatcl-pctr.c.yimg.jp/t/amd-img/20260507-00010011-theworldw-000-1-view.jpg?exp=10800,2026-05-07T19:00:27+09:00,2026-05-07T19:00:27+09:00,theWORLD（ザ・ワールドWeb）,theworldw,theWORLD（ザ・ワールドWeb）,645,ポルトも注目 去就が注目される守田 photo/Getty Images スポルティングCPに所属するMF守田英正（30）は今夏の移籍市場での動きが注目を集めている。 上田綺世はプレミアで通用するのか リヴァプール地元紙が分析「見逃せないのは……」 2021年1月に川崎フロンターレからポルトガルのサンタ・クララへ移籍すると、2022年夏にはスポルティングへステップアップした守田。スポルティングでは公式戦163試合に出場し11ゴール16アシストをマークするなどポルトガルでも高い評価を受けている。 そんな守田の現行契約は今シーズン限りとなっていて、契約延長の話はなく、フリーでの移籍が既定路線だと考えられている。川崎でチームメイトだった田中碧が所属するリーズへの移籍が噂されるなか、英『TEAMTALK』によると、多くのクラブが守田を監視しているという。 同じプレミアリーグではアストン・ヴィラ、そして川崎時代の同僚三笘薫が所属するブライトンも守田を注視深く追っていて、獲得に興味を示している模様。さらにポルトも関心を寄せているようだ。 移籍を検討するなかで、守田はフランス、ドイツ、イタリアのクラブからも問い合わせがきたというが、依然としてリーズが獲得レースで先頭を走っているとのこと。リーズは最初の交渉で、2028年までの契約と1年間の延長オプションを提案したという。 プレミアへの挑戦を守田は希望していると考えられているが、リーズがこの争奪戦を制するのか。 構成／ザ・ワールド編集部,[],[]
残留さえできれば、来季はCL出場権を狙える!?　トッテナムOBが信頼寄せるデ・ゼルビの手腕　「この監督は本当に一流だ。彼は必ず成功させる」（theWORLD（ザ・ワールドWeb））,https://news.yahoo.co.jp/articles/bf62a98a2dd14c137e1f39d66f03986dab1d3133,https://newsatcl-pctr.c.yimg.jp/t/amd-img/20260507-00010010-theworldw-000-1-view.jpg?exp=10800,2026-05-07T18:01:09+09:00,2026-05-07T18:01:09+09:00,theWORLD（ザ・ワールドWeb）,theworldw,theWORLD（ザ・ワールドWeb）,951,残り3試合で現在17位のトッテナム トッテナムの指揮官デ・ゼルビ photo/Getty Images トッテナムのOBであるジェイミー・オハラ氏は新監督であるロベルト・デ・ゼルビの手腕を信じているようだ。 22年ぶりのプレミア制覇、クラブ史上初のCL制覇近づくアーセナル 今夏アルテタ監督と新契約の交渉を開始か 前節のアストン・ヴィラ戦で勝利したトッテナムは現在2連勝中であり、順位も降格圏の18位から脱出。17位に順位を上げたが、18位ウェストハムとは1ポイントしか離れていないため、まだまだ気が抜けない残留争いが続く。 リーズ、チェルシー、エヴァートンとの3試合をトッテナムは残しているなか、オハラ氏は今シーズン残留さえできれば、来シーズンはCL出場権を獲得できるとコメント。そしてその理由にデ・ゼルビの存在を挙げている。 「デ・ゼルビには脱帽だ。就任して間もないが、すぐに自分の考えを浸透させた。まずはこのシーズンを無事に終え、来シーズンに向けて準備を進めてほしい。残留できれば、彼はチームに大きな貢献をしてくれるだろう」 「アーセナルがウェストハムに勝てばリーグ優勝が決まるので、トッテナムにとっては有利だ。彼らにとってこれが最後の試練だ。バーンリーには圧勝するだろうし、クリスタル・パレスはカンファレンスリーグの決勝に向けた準備に追われることになるからね」 「それはトッテナムにとって追い風になるし、認めざるを得ない。今の我々は彼らとは違う段階にいる。ただ、今はしっかりした監督がいる。もし残留できれば来季は危険な存在になるし、チャンピオンズリーグ出場も狙える」 「今は本物の監督が指揮を執っている。チャンピオンズリーグに行ける可能性もある。欧州カップ戦を戦う必要もないし、この監督は本当に一流だ。彼は必ず成功させるだろう。ここまで見れば、スパーズは5位でフィニッシュできると言えるね」（英『Sky Sports』より） オハラ氏はデ・ゼルビの手腕を絶賛しており、今シーズンを乗り越えることができれば、再び上位に食い込んでいけると確信しているようだ。 まずは残り3試合でなんとしてもプレミアに残留することが求められるが、デ・ゼルビはトッテナムを救うことができるか。 構成／ザ・ワールド編集部,[],[]
レンタル移籍中のカンセロは残留できるのか　バルセロナが提示した“獲得条件”とは（theWORLD（ザ・ワールドWeb））,https://news.yahoo.co.jp/articles/6d297715aab294fc41b20d4cd8e3f47bfafc793d,https://newsatcl-pctr.c.yimg.jp/t/amd-img/20260507-00010009-theworldw-000-1-view.jpg?exp=10800,2026-05-07T17:00:29+09:00,2026-05-07T17:00:29+09:00,theWORLD（ザ・ワールドWeb）,theworldw,theWORLD（ザ・ワールドWeb）,929,アル・ヒラルは18億円以上を要求 バルセロナへレンタル中のカンセロ photo/Getty Images 現在アル・ヒラルからバルセロナへレンタル移籍をしているポルトガル代表DFジョアン・カンセロの今夏の去就は注目を集めている。 レアル・マドリードのエース退団を求める署名が14万人突破 公式戦41得点も「身勝手な振る舞い」に批判噴出 2023年夏にマンチェスター・シティから1年間のレンタル移籍にてバルセロナに加わったカンセロ。シーズン終了後にはサウジアラビアのアル・ヒラルへ完全移籍を果たしたが、今冬再びバルセロナへレンタル移籍を果たし、ここまでは公式戦19試合で2ゴール6アシストを残している。 レンタル移籍は今シーズン限りとなっているなか、スペイン『SPORT』によると、カンセロは来シーズン以降もバルセロナに残る可能性が高いという。クラブはここまでのカンセロのパフォーマンスを高く評価しており、ハンジ・フリック監督も獲得へゴーサインを出しているようだ。 しかし、この移籍には条件もある模様。それはカンセロがアル・ヒラルとの契約を解除してフリーになること、もしくは移籍金が格安であることだという。すでにバルセロナは同選手の代理人であるジョルジュ・メンデス氏にはこの条件を提示しているとも同メディアは伝えている。 カンセロとアル・ヒラルの現行契約は残り1年となっており、シモーネ・インザーギ監督率いるチームの構想にポルトガル代表DFは入っていない。しかし、同メディアは双方合意の下で契約解除に至ることは簡単ではないとみており、カンセロが年俸約1600万ユーロを受け取っていることと、アル・ヒラルが最低でも1000万ユーロ（約18億円）の移籍金を要求していることを理由として挙げている。 バルセロナはこの要求額を払うつもりはなく、同メディアは双方が妥協点を見つける必要があるとしながらも、最終的には「バルサにとって負担の少ない金額で合意する可能性が高い」と伝えている。 カンセロはバルセロナに残ることを熱望しており、クラブも1年間の延長オプションがついた2年契約を準備するつもりのようだが、アル・ヒラルとの交渉はうまくいくのか。 構成／ザ・ワールド編集部,[],[]
ユヴェントスは売却を断固拒否？　リヴァプール、マンU、アストン・ヴィラが25歳フランス代表DF獲得へ（theWORLD（ザ・ワールドWeb））,https://news.yahoo.co.jp/articles/25979f0ff2efc2b6535158eab380d84267cfa0d2,https://newsatcl-pctr.c.yimg.jp/t/amd-img/20260507-00010008-theworldw-000-1-view.jpg?exp=10800,2026-05-07T16:01:01+09:00,2026-05-07T16:01:01+09:00,theWORLD（ザ・ワールドWeb）,theworldw,theWORLD（ザ・ワールドWeb）,738,今季公式戦46試合に出場 ユヴェントスのカルル photo/Getty Images ユヴェントスに所属するフランス代表DFピエール・カルルにはプレミアリーグから熱視線が届いているようだ。 レアル・マドリードのエース退団を求める署名が14万人突破 公式戦41得点も「身勝手な振る舞い」に批判噴出 現在25歳のカルルは2024年夏にACミランから買取オプション付きのレンタル移籍にてユヴェントスに加入。1年目から公式戦43試合に出場すると、シーズン終了後にクラブが買取オプションを行使し、完全移籍へ移行する運びとなった。 ユヴェントスの守備を支える一人となったカルルは今シーズンも公式戦46試合に出場し2ゴール7アシストを記録するなど主力として躍動しているが、英『CAUGHTOFFSIDE』によると、リヴァプール、マンチェスター・ユナイテッド、アストン・ヴィラが同選手の獲得を検討しているという。 しかし、ユヴェントスはカルルの売却を断固拒否する姿勢を崩していないようで、同選手を長期的なプロジェクトの中心人物の一人だと考えている模様。さらに2030年までの新契約を準備し、年俸やボーナスを上げるつもりだという。 ユヴェントスはカルル流出阻止へ動こうとしているが、代理人業界の間では適切なオファーが届けば、フランス代表DFを売却する可能性があるという見方が強まっており、移籍金は4000万ユーロ（約73億円）前後になると見られている模様。特にカルルがユヴェントスの新契約に同意しない場合、移籍の動きが加速することもあるようだ。 上述したクラブが、ユヴェントスの覚悟を示すようなオファーを出すことが予想されているようだが、カルルは今夏移籍を果たすのか。 構成／ザ・ワールド編集部,[],[]
