headline,mainEntityOfPage,image,datePublished,dateModified,author,media_en,media_jp,str_count,body,images,external_links
食欲・収穫の秋　由利本荘市で豊作祝う祭り　秋田（秋田テレビ）,https://news.yahoo.co.jp/articles/fc5aeb0b80da52646e0ba028a98419909045db56,https://newsatcl-pctr.c.yimg.jp/t/amd-img/20251013-90015939-akt-000-1-thumb.jpg?exp=10800,2025-10-13T19:21:01+09:00,2025-10-13T19:21:01+09:00,秋田テレビ,akt,秋田テレビ,308,"秋田テレビ
秋はスポーツの季節だけではありません。秋田県由利本荘市では、地域の豊作を祝う収穫祭が行われ、訪れた人たちが秋の味覚を楽しみました。

朝から多くの人でにぎわった由利本荘市の収穫祭。

イベントの目玉の一つである野菜詰め放題のコーナーでは、親子連れなどがサツマイモやクリなど秋の味覚を袋いっぱいに詰め込んでいました。

親子連れの子ども：
「サツマイモを狙って取って2つ取れたので十分。サツマイモポテトにしたい。」

会場ではとろろ飯の大食い大会も行われ、参加した「胃袋自慢」の30人が口いっぱいにほおばっていました。出場した人たちは優勝を目指して食べ進めながら、独特の食感を楽しんでいました。
秋田テレビ",[],[]
災害ボランティア活動に“感謝”の気持ちを料理に込めて　秋田・仙北市（秋田テレビ）,https://news.yahoo.co.jp/articles/d339508626e25ba24d631b70c1988371c9f7fc79,https://newsatcl-pctr.c.yimg.jp/t/amd-img/20251013-90015941-akt-000-2-thumb.jpg?exp=10800,2025-10-13T19:15:01+09:00,2025-10-13T19:17:01+09:00,秋田テレビ,akt,秋田テレビ,439,"秋田テレビ
2025年8月に秋田県内を襲った大雨からまもなく2カ月が経ちます。

地区を流れる桧木内川が氾濫した仙北市西木町では連休中もボランティアが復旧活動を行いました。

8月の大雨で浸水の被害に見舞われた仙北市西木町の上桧木内地区では連休中もボランティアが復旧活動を行いました。

市が運営する災害ボランティアセンターは15日で閉所することになっています。

13日は支援を受けて復旧が進んだ地区の旅館がこれまでの「感謝」の気持ちを込めてボランティアにカレーや味噌汁を振る舞いました。

山形から参加したボランティアは「最終日にごほうびをもらえると思わなかった。おいしかった。（地区が）元気になってもらいたい。」とお手製料理に喜んでいました。

なか志ま旅館・中島勝子さんは「みんな喜んで食べてくれるのでうれしい。みんなに助けられてここまで来た。泣くぐらいうれしかった。」とうれし涙をこぼしました。

なか志ま旅館は11月初旬の食堂の営業再開を目指しています。
秋田テレビ",[],[]
秋田県警が詐欺被害防止を呼びかけ　全国地域安全運動に合わせて　セキュリティ性が高い玄関の鍵も紹介（秋田テレビ）,https://news.yahoo.co.jp/articles/d3dbe83dac35fb396bbdb24e2f11c72a8f07ab0c,https://newsatcl-pctr.c.yimg.jp/t/amd-img/20251013-90015942-akt-000-1-thumb.jpg?exp=10800,2025-10-13T19:13:01+09:00,2025-10-13T19:13:01+09:00,秋田テレビ,akt,秋田テレビ,550,"秋田テレビ
秋田県内では詐欺被害が後を絶ちません。これを受け、秋田市で詐欺被害防止などを呼びかけるイベントが行われました。

このイベントは、11日から始まった全国地域安全運動に合わせて県警と県が企画しました。

県内では、2025年9月末までに詐欺被害が125件発生していて、被害額は7億2000万円以上に上ります。

最近の詐欺事件の手口として、番号がプラスから始まる国際電話からの連絡が増えていることから、イベントでは国際電話の利用を休止する手続きができるブースが設けられました。

また、会場ではセキュリティ性が高い玄関の鍵などが紹介され、訪れた人たちは楽しみながら防犯への意識を高めていました。

訪れた人は、「知らない番号から電話がかかってくることが最近多い。あやふやな情報には惑わされないように気を付けたい」「お年寄りが家族に多いので、注意を促したい」と詐欺被害防止への意識を高めていました。

県警察本部生活安全企画課次長・樫尾正樹さん：
「県民一人一人が被害防止の意識を高めて、詐欺被害防止に努めてほしい。特殊詐欺被害防止のほか、女性や子供の犯罪被害防止や住宅対象窃盗被害防止について地域の安全・安心に努めていきたい」

全国地域安全運動は10月20日まで展開されます。
秋田テレビ",[],[]
「素晴らしい青空と紅葉」秋深まり八幡平で多くの観光客が紅葉狩り楽しむ　秋田・鹿角市（秋田テレビ）,https://news.yahoo.co.jp/articles/579702512c823d7c0fefb965985a1dffddfd914b,https://newsatcl-pctr.c.yimg.jp/t/amd-img/20251013-90015940-akt-000-1-thumb.jpg?exp=10800,2025-10-13T18:29:01+09:00,2025-10-13T18:29:01+09:00,秋田テレビ,akt,秋田テレビ,425,"秋田テレビ
秋田県鹿角市の八幡平では紅葉が見頃を迎えていて、県の内外から訪れた観光客が紅葉狩りを楽しんでいます。

赤や黄色に色づく美しい景色。
県内有数の紅葉の名所、鹿角市八幡平の大沼周辺の13日の様子です。

2025年は残暑の影響で、見ごろが例年より3日ほど遅れたものの、ここ数日の気温の低下で色づきが進み、紅葉は見頃を迎えています。

栃木から訪れた人：
「素晴らしい青空と紅葉が、すごくきれいで見とれている」

神奈川から訪れた人：
「八幡平へは5・6回来ている。2025年も最高です。本当にきれい」

また、大沼から100メートルほど高い所にある温泉施設は、紅葉を眺めることができる露天風呂が人気で、訪れた人たちが秋の深まりを楽しんでいました。

ふけの湯女将・阿部恭子さん：
「ゆったりと露天風呂に入って、360度周りを眺めてリラックスすれば、冬に向けて健康に過ごせる」

八幡平の紅葉はあと1週間ほど楽しむことができます。
秋田テレビ",[],[]
潟上市×中央大学が連携協定　地域の活性化と大学教育の充実図る　秋田・潟上市（秋田テレビ）,https://news.yahoo.co.jp/articles/fba149201140694f698d6f6072b72f1f57cba7a6,https://newsatcl-pctr.c.yimg.jp/t/amd-img/20251013-90015937-akt-000-2-thumb.jpg?exp=10800,2025-10-13T15:15:01+09:00,2025-10-13T19:19:01+09:00,秋田テレビ,akt,秋田テレビ,474,"秋田テレビ
地域の課題の解決や、大学の教育・研究活動の充実につなげていこうと、8日、秋田県潟上市と中央大学が連携協定を結びました。

潟上市役所で開かれた締結式には、潟上市の鈴木雄大市長と中央大学の佐藤信行副学長が出席し協定書に署名を交わしました。

この協定は潟上市と中央大学が連携することにより地域の課題解決や地域活性化それに大学の教育・研究活動の充実を図ることを目指します。

中央大学では2027年4月に最先端のテクノロジーを活用して農業を学ぶ「情報農学部」の開設を目指しています。開設が実現すれば潟上市は学生が農業現場で実習するプログラムの受け入れを行い学生は市の地域課題の解決に向けた実践的な地域活性化の取り組みを行う予定です。

実は中央大学の卒業生の鈴木市長。今回母校との協定に思い入れも強いようです。
鈴木雄大市長：
「学生が地域の課題に向き合い実体験を積み重ねながら成長しその過程で地域にも新しい風を吹き込んでもらうことを大いに期待している」

潟上市は今後、学生の受け入れに向けた態勢を整えていくことにしています。
秋田テレビ",[],[]
秋田県内は7日連続のクマによる人身被害　美郷町で40歳の男性がクマに襲われ腕などをけが（秋田テレビ）,https://news.yahoo.co.jp/articles/123424ac0f4a7495df5d43b015dfe90ff52eeb45,https://newsatcl-pctr.c.yimg.jp/t/amd-img/20251013-90015936-akt-000-1-thumb.jpg?exp=10800,2025-10-13T14:47:01+09:00,2025-10-13T14:47:01+09:00,秋田テレビ,akt,秋田テレビ,428,"秋田テレビ
10月12日の夕方、秋田県美郷町で農作業をしていた40歳の男性がクマに襲われ、けがをしました。県内のクマによる人身被害の発生は7日連続です。

警察によりますと10月12日午後5時30分ごろ、美郷町浪花田ノ沢の農作業小屋で40歳の男性がコメの乾燥作業をしていて、外に出たところ2頭のクマと遭遇しました。

1頭は立ち去ったものの、もう1頭のクマが襲いかかり、男性は頭や腕などを噛まれ、けがをしました。

男性は自力で自宅まで戻り、大仙市内の病院に搬送されましたが、意識はあり会話もできる状態だということです。

現場は「美郷町ラベンダー園」から南東に700メートルほど離れた、田んぼや畑が広がる地域で付近には住宅が点在しています。

クマが去った方向は分かっておらず、周辺では警察がパトロールを続けています。

県内のクマによる人身被害の発生は7日連続でこれまでに1人が死亡、31人がケガをしています。（10月13日午前11時時点）
秋田テレビ",[],[]
