headline,mainEntityOfPage,image,datePublished,dateModified,author,media_en,media_jp,str_count,body,images,external_links
「きゃーかわいい！」→ほんの2秒後…まさかの表情に　ねこ飼い“あるある”に反響　「ツンデレでもかわいい～」（Hint-Pot）,https://news.yahoo.co.jp/articles/2b6cc815d231e639d1e17d2719325601b5e978ea,https://newsatcl-pctr.c.yimg.jp/t/amd-img/20260428-00010012-hintpot-000-1-view.jpg?exp=10800,2026-04-28T21:31:07+09:00,2026-04-28T21:31:07+09:00,Hint-Pot,hintpot,Hint-Pot,1394,とてもかわいい表情をしているビフォー写真【写真提供：たぬ@雪の日にやって来た迷い猫（@tanu_tyan）さん】 愛猫の愛くるしい姿を写真に収めようとカメラをかまえた瞬間、予想外の反応をされてしまうのは、ねこ飼い“あるある”かもしれません。X（ツイッター）では、ねこが撮影中に見せた激しすぎる表情の変化が話題を呼んでいます。わずか2秒で繰り出された、あまりにも対照的な表情について、飼い主さんに詳しいお話を伺いました。 【写真】「『きゃーかわいー』って油断してると、2秒後にはこんな顔してくるからねこ写真は難しいです」 実際の投稿 ◇ ◇ ◇ 2秒で何があった？ 表情の差がすさまじいねこ 「『きゃーかわいー』って油断してると、2秒後にはこんな顔してくるからねこ写真は難しいです」 そんなコメントとともに投稿されたのは、表情が激変したねこの比較写真です。左側の写真では、長毛のキジトラねこが大きな瞳をキラキラと輝かせ、愛らしい姿を見せています。 ところが、そのわずか2秒後に撮影されたという右側の写真では、目を細めて、どこか冷めたような表情に。まるで「また撮ってるの……？」と、あきれ返っているかのような温度差を感じさせます。 投稿には、1.1万件もの“いいね”が集まりました。リプライ（返信）には「はぁ!? って聞こえた」「ツンデレでもかわいい～」「どっちかっていうと後者が好みです」といった声が寄せられました。 内弁慶なたぬくんの愛すべき素顔 2秒後とは思えない表情差を見せるたぬくん【写真提供：たぬ@雪の日にやって来た迷い猫（@tanu_tyan）さん】 注目を集めたのは、推定8歳の元保護ねこ「たぬ」くん。雪の日に保護された、飼い主さんにとって大切な家族の一員です。 表情の違いを見せた理由について、飼い主さんは「カメラがあまり好きではないので『また撮ってるの……？』という、うんざりした顔かなと思います」と振り返ります。最高にかわいいと思った瞬間に、まったく別の表情が撮れてしまったときは「自分のシャッターを切るスピードの遅さを呪いたくなります」と、撮影の難しさを痛感しているようです。 そんなたぬくんは、実はかなりの人見知り。郵便局の配達員さんが鳴らすチャイムの音だけで、ダッシュで逃げ出し、来客には必死で抵抗するほど。しかし、家族の前では態度が一転するといいます。 「家族にはゆったり甘えてくれるので、飼い主としては“デレ”をいただいているようでうれしいです」と、そのツンデレぶりに心を射抜かれている様子です。 家族の前でまったりくつろぐたぬくん【写真提供：たぬ@雪の日にやって来た迷い猫（@tanu_tyan）さん】 写真フォルダ内に、たぬくんの写真や動画がどれくらいあるのか気になるところですが「『お前は今まで食ったパンの枚数を覚えているのか？』という、ジョジョのセリフを思い出します」とユーモアたっぷりに話してくれました。数え切れないほどの愛情が、スマートフォンの中にあふれているようです。 たとえシャッターチャンスを逃しても、それもまた愛おしい思い出のひとつ。次はどんな驚きの表情を見せてくれるのか、たぬくんと飼い主さんの愉快な“攻防戦”はこれからも続いていきそうです。 ○取材協力：たぬ@雪の日にやって来た迷い猫（@tanu_tyan）さん Hint-Pot編集部,[],[]
「日本はカジュアル」　オーストラリア人が驚愕　母国との“圧倒的なギャップ”を感じた場所とは（Hint-Pot）,https://news.yahoo.co.jp/articles/a60f030a7df0df057012b26e31b6848f71e5d068,https://newsatcl-pctr.c.yimg.jp/t/amd-img/20260428-00010011-hintpot-000-1-view.jpg?exp=10800,2026-04-28T19:30:56+09:00,2026-04-28T19:30:56+09:00,Hint-Pot,hintpot,Hint-Pot,930,オーストラリアから来た（左から）ウィルさんとアレックスさん【写真：Hint-Pot編集部】 日本のなにげない日常は、訪日外国人にとって驚きの連続です。母国では手が届きにくい体験が手軽に叶う環境は、強い衝撃を与えています。オーストラリアから訪れたふたりも、自国との差に大きなショックを受けた様子。その違いに圧倒された場所とは、いったいどこなのでしょうか。 【写真】オーストラリア人が「日本はカジュアル」と驚いた場所の写真 ◇ ◇ ◇ 2回目の日本旅行で主要都市をめぐる オーストラリアのメルボルンから来たアレックスさんとウィルさん。2回目の日本旅行となる今回は2週間滞在し、金沢や大阪、京都をめぐり、東京を満喫しています。 「日本はオーストラリアの文化とすごく違うというのが、今回来た一番の理由かな。それに、そんなに遠くないというのも大きいよ」 異文化体験を求めてやってきたふたりは、日本の清潔さや人々の親切さに感動。さらに、自然の美しさや食事のレベルの高さにも、すっかり心を奪われています。 オーストラリア人が母国との“圧倒的なギャップ”に驚いた場所とは ふたりは日本食を満喫する一方、母国との大きなギャップに驚いています。ウィルさんにとって、お酒と多彩な料理を気軽に楽しめる大衆的な飲食店は、非常に新鮮な体験になったそうです。 「メルボルンにも日本食レストランはあるけれど、ハイエンドなレストランばかりなんだ」 アレックスさんによると、オーストラリアで日本食といえば鉄板焼きなどを中心としたフォーマルな業態が主流だといいます。 「オーストラリアには、日本居酒屋のような店はないわ。どこもきちんとしたフォーマルなレストランなの」 「日本はカジュアルなスタイルのお店が本当にたくさんあって、どこに入ってもおいしいから驚きだよ」とウィルさん。海外では高級料理のイメージを持たれることも多い日本食ですが、日本では安くて質の高い料理が手軽に味わえます。こうした日本の食文化も、ふたりにとっては大きな魅力として映ったようです。 残りの滞在期間でも、ぜひさまざまなカジュアルな飲食店を訪れ、日本ならではのおいしい思い出をたくさん作ってほしいですね。 Hint-Pot編集部,[],[]
「まさかの事態」を防ぐために　消防庁が注意喚起　林野火災を引き起こさないためのポイントとは（Hint-Pot）,https://news.yahoo.co.jp/articles/76ead5ae003f33fb04c5e168bc716d1b55c2457d,https://newsatcl-pctr.c.yimg.jp/t/amd-img/20260428-00010010-hintpot-000-2-view.jpg?exp=10800,2026-04-28T16:19:43+09:00,2026-04-28T16:39:29+09:00,Hint-Pot,hintpot,Hint-Pot,808,各地で林野火災が相次いでいる（写真はイメージ）【写真：PIXTA】 春は空気が乾燥しやすく、強風が吹くことも多い季節です。消防庁は公式X（ツイッター）アカウント（@FDMA_JAPAN）で、林野火災に関する警鐘を鳴らしました。一人ひとりが火災の発生源を作り出さないために、注意すべきポイントを紹介し、反響を呼んでいます。 【写真】「一人ひとりの心がけが大切」 林野火災を引き起こさないために気をつけたい4つのポイント 実際の投稿 ◇ ◇ ◇ 注意すべき4つのポイントを紹介 現在、東北をはじめとする乾燥地域で、大規模な林野火災が発生しています。投稿では「林野火災に注意」との書き出しで、「まさかの事態」を引き起こさないよう、具体的に注意すべき4つのポイントを紹介しています。 ・乾燥・強風時は外で火を使わない ・火気から目を離さない ・消火用の水を準備する ・使用後は完全に消火する これからの季節は、屋外でバーベキューなどを楽しむ機会もあるでしょう。火を使用する際は、万が一に備えて消火用の水を用意することが大切です。「使用後は完全に消火する」ことも重要で、火が消えたように見えても、くすぶりが残っていれば風によって再燃することがあります。一つひとつの確認が、取り返しのつかない事態を防ぐことにつながるのです。 また、乾燥・強風時に屋外で火を使うことは、それ自体がすでに大きなリスクです。天気予報や気象情報をこまめに確認し、条件が悪い日は火の使用を控える判断も、大切な心がけのひとつといえるでしょう。 こうした呼びかけに対し、コメント欄には「本当、一人ひとりの心がけが大切ですね」「おけがのないように活動してください」などの声が上がっています。 ちょっとした気のゆるみや「これくらいなら大丈夫」という思い込みが、思わぬ火災へと発展することもあります。一人ひとりが意識を高めていきたいですね。 Hint-Pot編集部,[],[]
「身体のことを考えて…」　滝沢眞規子さんがお弁当作りを再開　夫への思いと旬の食材を使った一品に「本当に尊敬」「おいしそう」（Hint-Pot）,https://news.yahoo.co.jp/articles/6d72be6b613a6de98a089a77b51559fc30883265,https://newsatcl-pctr.c.yimg.jp/t/amd-img/20260428-00010009-hintpot-000-3-view.jpg?exp=10800,2026-04-28T14:57:23+09:00,2026-04-28T15:32:22+09:00,Hint-Pot,hintpot,Hint-Pot,712,モデルの滝沢眞規子さん【写真：産経新聞社】 忙しい日々のなかでも、家族の健康には気を配りたいと考える人は多いでしょう。人気モデルの滝沢眞規子さんは、自身のインスタグラム（makikotakizawa）でお弁当作りを再開したことを明かしました。家族への深い愛情が詰まった、季節の移ろいを感じさせるお弁当に称賛の声が集まっています。 【写真】「身体のことを考えて…」 滝沢眞規子さんが夫に作ったお弁当 実際の投稿 ◇ ◇ ◇ 「折をみてまた作ろうと思います」 料理上手として知られ、日々の暮らしを楽しむ姿が支持を集める滝沢さん。28日の投稿では、「久しぶりのお弁当です」と、多忙だった期間を経て、再びお弁当作りを始めたことを報告しました。 添えられた写真には、ネイビーのランチクロスの上に、シンプルな四角いお弁当箱が置かれています。中には、ふっくらと炊き上げられたタケノコご飯が詰められ、その横には旨味たっぷりの塩麹唐揚げや、贅沢なカニ入りの卵焼きが並びます。 さらに、鮮やかなオレンジ色が目を引くニンジンのラペ、菜の花のナムルなど春を感じさせる食材がバランス良く配されており、フタを開けた瞬間に笑顔がこぼれるような美しさです。 滝沢さんは、「お互いに出張でお弁当生活ではなかったので、なんとなく身体のことを考えて折りをみてまた作ろうと思います」と綴りました。多忙なスケジュールのなかでも、外食続きになりがちな夫の体調をそっと慮る姿に、愛情を感じます。 投稿のコメント欄には、「おいしそう」「春らしいお弁当ですね」「お忙しいのに本当に尊敬です。愛情ですね」「本当に素敵です」といった声が寄せられています。 Hint-Pot編集部,[],[]
動物病院の待合室で「全員これ」　飼い主たちの“あるある”に16万“いいね”　愛犬・愛猫の居心地を優先して無意識に取ってしまう姿勢とは（Hint-Pot）,https://news.yahoo.co.jp/articles/6102003f9c61a2df2014c3721e8e9c9b0a330c85,https://newsatcl-pctr.c.yimg.jp/t/amd-img/20260428-00010008-hintpot-000-8-view.jpg?exp=10800,2026-04-28T13:40:23+09:00,2026-04-28T17:34:00+09:00,Hint-Pot,hintpot,Hint-Pot,1314,動物病院の待合室の様子。まさかの共通点が【画像提供：橘紫夕@でかポメ&ちびポメ（@tachibana_shiu）さん】 動物病院の待合室で、膝の上に愛犬や愛猫を乗せて待つ飼い主たち。よく見ると、多くの人がある共通の姿勢を取っていることに気づきます。そんな“あるある”を描いたイラストが、X（ツイッター）で大きな反響を呼んでいます。16万件もの“いいね”を集めた投稿について、橘紫夕@でかポメ&ちびポメ（@tachibana_shiu）さんに詳しいお話を伺いました。 【画像】「動物病院にワクチン打ちに来たら全員これ」 16万“いいね”と共感の声が殺到した実際の投稿 ◇ ◇ ◇ 動物病院の待合室で見られた“あるある”な光景 「動物病院にワクチン打ちに来たら全員これ」 そんなシンプルなメッセージとともに公開されたのは、動物病院の待合室の光景を描いたイラストです。椅子に座った飼い主たちが、膝の上に愛犬や愛猫を乗せて待っている様子が描かれています。 よく見ると、飼い主たち全員がつま先立ちをして、膝を平らに保っているのです。大切な“我が子”がずり落ちないように――。自分の楽な姿勢よりも、“我が子”の快適さを優先する飼い主たちの愛情が、1枚のイラストから伝わってきます。 投稿には16万件もの“いいね”が集まりました。リプライ（返信）には、「自分の楽さより“我が子”の快適さを……！」「わかりみが深い わんとかにゃんとかの居心地優先して自分筋トレをしているよね」「同志がここにも!! すっごくわかりますw」「言われてみたら確かにやっているわww」など、共感の声が殺到しています。 2022年に描いたイラストを再掲 “我が子”がずり落ちないように膝の上を平らに保っている飼い主さんたち【画像提供：橘紫夕@でかポメ&ちびポメ（@tachibana_shiu）さん】 橘さんに、イラストを描いたきっかけや反響について詳しく話を伺いました。 Q. 今回のイラストを描こうと思ったきっかけは？ 「常々、つま先がつらいなーと思っていたので、病院でほかの人を見て、やっぱりみんなそうなるんだなぁと。“あるある”ネタとして描きました。実はこの絵は2022年に描いたもの。そのときは『犬がずり落ちないように膝の上を平らにしている状態』と言う説明をつけて、200リツイートくらいでした。先日、動物病院に行ったときにまた同じ状態だったので再投稿しました」 Q. 自然とこの姿勢を取り始めたのでしょうか？ 「自然と、です。ほかの人のコメントでも、今気づいたけれど私もやっていた！ と言う方がいたので、無意識でやっている人も多いようです」 Q. 橘さんの愛犬「宗次郎Jr」くんは、病院が得意ですか？ 「もちろん苦手ですが、頑張って良い子にしています。拒否することなく病院に入って大人しく待っていますし、注射を打たれても『キュー！』と鳴くだけで耐えています」 Q. 印象に残ったリプライは？ 「圧倒的な数の『わかる!!』というリプライでした。説明を省いたので伝わるかな？ と心配でしたが、思っていたより断然“あるある”だったようです」 Hint-Pot編集部,[],[]
生後2か月の愛犬→1歳になって「同じ場所に来たので抱っこしてみたら…」　驚きの成長ぶりに8.5万“いいね”　「抱っこしてもらう側になりそうですね」（Hint-Pot）,https://news.yahoo.co.jp/articles/c6b4f552f12ea2c0b831361a84ef15635fb7dd2c,https://newsatcl-pctr.c.yimg.jp/t/amd-img/20260428-00010007-hintpot-000-7-view.jpg?exp=10800,2026-04-28T12:42:46+09:00,2026-04-28T14:43:43+09:00,Hint-Pot,hintpot,Hint-Pot,1005,子いぬ時代のPOWくん【写真提供：SKI&POW（@snowski1008）さん】 いぬの成長は、人間が思うよりもずっと早いもの。ついこの間まで軽々抱っこできていたはずが、気づけば抱えるのが大変なほど大きく成長しているなんてこともあるようです。X（ツイッター）では、お迎え当時の場所で同じように抱っこされた大型犬の比較写真が話題に。10か月間での“劇的変化”について、飼い主さんに詳しいお話を伺いました。 【写真】「←2か月 →1歳 同じ場所に来たので抱っこしてみたら…」 4倍にまで成長した愛犬 実際の投稿 ◇ ◇ ◇ お迎えしてから10か月で立派に成長 「←2か月 →1歳 同じ場所に来たので抱っこしてみたら…」 そんなコメントとともに投稿された2枚の写真。1枚目には、黒いパーカーを着た飼い主さんの背中から、ひょっこりと顔を出している愛らしい子いぬが写っています。まだあどけなく、顔の大きさも飼い主さんの頭より小さいのがわかります。 ところが2枚目では、その姿は大きく変化しています。前足を飼い主さんの肩に乗せ、ふかふかの大きな体で飼い主さんをすっぽり覆い隠してしまいそうです。顔も、飼い主さんの頭よりも一回り以上大きくなっています。 投稿には、8.5万件の“いいね”が集まりました。リプライ（返信）には「変な声出てまう!! かわいすぎて」「子いぬと自認しているのが伝わって来る……」「飼い主さんが抱っこしてもらう側になりそうですね」といった声が数多く寄せられています。 中身はまだ子いぬ!? 変わらない甘えん坊ぶり 生後2か月当時と1歳になった現在の比較【写真提供：SKI&POW（@snowski1008）さん】 話題を集めたのは、サモエドとハスキーのミックスで1歳になったばかりの男の子「POW（パウ）」くんです。先住犬のサモエドで9歳の男の子「SKI（スキー）」くんと、楽しく毎日を過ごしています。 お迎え当時は6キロだった体重も、今では約25キロにまで成長。どんな大きさのいぬとも仲良くできる優しい性格で、ドッグランでも元気に駆け回っています。しかし、体は大きくなっても、心はまだまだ甘えん坊なのだそう。 飼い主さんは「初めて会う自分より大きい子がいると怖がって、『抱っこして』と飛んできます。自分のことをまだ小さいと思っているのかもしれません」とPOWくんの愛らしい一面を明かしてくれました。,[],[]
「空港や観光地の価格には何年経っても慣れない」　スイス暮らしの日本人ママが驚愕　まさかの1本「1000円以上」だったものとは（Hint-Pot）,https://news.yahoo.co.jp/articles/fcb95e931f7b36542ebced5221050c6be89ec3a4,https://newsatcl-pctr.c.yimg.jp/t/amd-img/20260428-00010006-hintpot-000-4-view.jpg?exp=10800,2026-04-28T11:40:04+09:00,2026-04-28T12:26:00+09:00,Hint-Pot,hintpot,Hint-Pot,1080,笑顔がこぼれる（左から）ソノくんとリノくん【出典：YouTube「Ami’s Life」よりスクリーンショット】 世界的な物価高騰が続くなか、とりわけ物価が高いことで知られるスイスも決して例外ではありません。むしろ、その上昇ぶりは現地で暮らす人々ですら目を疑うほどの水準に達しているようです。スイスで3人の男の子を育てる日本人YouTuberのAmiさん。自身のYouTubeチャンネル「Ami’s Life」では、日本へ一時帰国する際に訪れたスイスの空港で、ある“必需品”の価格に衝撃を受けました。いったい、どんなものだったのでしょうか。 【写真】スイス暮らしの日本人ママが空港で「1000円以上する」と衝撃を受けたものの写真 ◇ ◇ ◇ 母子3人でスイスを出発 寄った売店で驚き スイス人の夫・ファビオさんと、長男のミオくん、次男のリノくん、三男のソノくんとともにスイスで生活しているAmiさん。3月下旬、日本へ一時帰国することになったAmiさんは、リノくんとソノくんの2人を連れていくことになりました。 あとから合流する予定のファビオさんとミオくんに見送られ、3人はゲート内へ。搭乗までの待ち時間、子どもたちは空港内の遊び場で元気いっぱいに過ごし、その後はAmiさん手作りのおにぎりやブロッコリーのゴマ和えで腹ごしらえをしました。 その後、子どもたちのために飲み物を調達しようと空港内の売店に向かったAmiさん。そこで驚きの光景を目の当たりにします。 陳列棚に置かれていた750mlのボトルの価格はなんと5.70スイスフラン。日本円に換算すると約1160円という、まさに“衝撃価格”だったのです。 「1000円以上するな、これ……」と、思わず手が止まるAmiさん。陳列棚に並ぶほかの飲料も軒並み高騰しており、テロップでは「空港や観光地の価格には何年経っても慣れない」と切実な本音を漏らしています。 スイスの物価高は有名ですが、空港という特殊な環境下ではその影響はさらに色濃く出ているようです。そんななか、別の棚を探したAmiさんは、1本1.5スイスフラン（約256円）という、この場所では比較的安価な水を発見。リノくんとソノくんにそれぞれ1本ずつ購入しました。 動画のコメント欄には、「今度は2人といえど、まだまだ動きざかりだから目が離せなくて大変でしたね」「リノくんがお兄ちゃんでソノくんの面倒をよくみてくれて、すごく力強いです」「三兄弟、すごくしっかりしてきましたね。子どもの成長は本当に早い！」といった声が寄せられています。 Hint-Pot編集部,[],[]
