headline,mainEntityOfPage,image,datePublished,dateModified,author,media_en,media_jp,str_count,body,images,external_links
「何歳に見えますか？」　若見えがコンプレックス…6歳娘と兄妹に間違われる31歳パパがヘアカットで大変身　ビフォーアフターに「別の人が現れたかのよう」「すごいです」（Hint-Pot）,https://news.yahoo.co.jp/articles/ba76f5d7f96078be917d15397b192487ab4238bb,https://newsatcl-pctr.c.yimg.jp/t/amd-img/20260428-00010005-hintpot-000-12-view.jpg?exp=10800,2026-04-28T11:14:29+09:00,2026-04-28T15:30:57+09:00,Hint-Pot,hintpot,Hint-Pot,1040,若見えする容姿に悩む男性【出典：インスタグラム（lalaroomo_horikoshi）よりスクリーンショット】 髪型を変えるだけで、雰囲気だけでなく、相手に与える「年齢印象」まで大きく左右されることがあります。自分が見られたい理想のイメージに合わせてスタイルを決めることは、自信にもつながるでしょう。美容師・堀越太輔さんのインスタグラムアカウント（lalaroomo_horikoshi）で注目を集めているのは、そんな「若見え」に悩み、大人の男への脱却を願うひとりの男性の変身劇です。 【写真】6歳娘と兄妹に間違われる31歳男性 若見えパパのお悩み解消ビフォーアフター ◇ ◇ ◇ 年相応に見られたい31歳男性 「僕、何歳に見えますか？」 そんな男性の問いかけから動画は始まります。さわやかな大学生のようにも見えますが、なんと31歳で6歳の娘を持つパパなのだそうです。 娘と外出すると兄に間違われ、保育園の参観日では妻との関係を怪しまれることも。年齢確認をされて気まずい思いをすることも少なくありません。 若見えがコンプレックスとなっている男性。スーツの似合う、年相応の大人の男性に見られるようになりたいと堀越さんの元を訪れました。 目元で切りそろえられた重めの前髪が、10代後半から20代前半のような、どこか幼い印象を与えています。優しく親しみやすい雰囲気はあるものの、31歳で一児の父という彼の実年齢を完全に覆い隠してしまっていました。 さわやかイケメンパパに大変身！ 前髪を上げて大人男性の雰囲気に【出典：インスタグラム（lalaroomo_horikoshi）よりスクリーンショット】 堀越さんのできあがりイメージは「大人かっこよく」。最大の変化は、額を潔く出し、眉をはっきりと見せた「アップバング」スタイルです。 サイドをタイトに抑え、前髪を根元から立ち上げて立体的な動きをつけたことで、顔のパーツがシャープに際立ち、凛々しさが劇的にアップしました。もみあげや襟足をスッキリ整えたことで、清潔感と品格が宿り、まさに「スーツが似合うビジネスマン」のオーラをまとっています。 また、ヘアカットだけでなく鼻の脇にシェーディングを入れて、鼻筋が高く見えるようメイクも施されました。 コメント欄には、「ビフォーもアフターも素敵」「別の人が現れたかのように大変身」「髪型ひとつで凛々しい大人の男性になるとはすごいです」など、驚きの声が多く寄せられています。 Hint-Pot編集部,[],[]
「日本人はわざと自分に自由を与えない」　ジョージア大使が見た日本人の美学　秩序と引き換えに選んだ“窮屈さ”の価値（Hint-Pot）,https://news.yahoo.co.jp/articles/8becff5a8bcdffbcb9115577e97cab2ce83f1901,https://newsatcl-pctr.c.yimg.jp/t/amd-img/20260428-00010004-hintpot-000-3-view.jpg?exp=10800,2026-04-28T10:28:55+09:00,2026-04-28T15:19:03+09:00,Hint-Pot,hintpot,Hint-Pot,1291,日本での生活を語ったティムラズ・レジャバ駐日ジョージア大使【写真：黒澤崇】 日本の街を歩けば、ゴミひとつ落ちていない清潔な通り、時間通りに正確にやってくる電車――。世界中から称賛される整然とした美しさを、日本人は当たり前だと思って過ごしています。しかし、その内側に身を置き続けてきたジョージア特命全権大使のティムラズ・レジャバさんは、完璧な秩序の裏側にある、日本人特有の感覚を感じ取っていました。境界線に立つ“観察者”としての知性が見抜いた、日本社会の真の姿とは。 【写真】「トランプ大統領の車列が話題ですが…」 ジョージア大使が“自由”を表現 実際の投稿 ◇ ◇ ◇ 「100％なじみきることは不可能」という潔い悟り ティムラズさんが初めて日本の地を踏んだのは1992年、まだ4歳のときでした。それから現在に至るまで、日本の公立校、大学寮、そして長い歴史を持つ日本企業・キッコーマンでの勤務という、稀有な経験を積み重ねてきました。 日本語を完璧に操り、日本社会を深く理解しているティムラズさん。しかし、そんな大使であっても「自分は決して日本人にはなれない」という、冷静な自己認識を持っています。 「経験すればするほど、自分は日本に100％なじみきることはできないな、日本の社会の一部になるのは不可能だなと感じてきました。たとえば、電車の中でも自分は頭ひとつ出ている。どれだけ日本語を話し、友人が多くても、見た目が日本人じゃないように、内面もまた変わらないところがあるんじゃないかなと思います」 その言葉は、無理に同化しようとするのではなく、違いを認めたうえで「どう共存するか」を模索してきたティムラズさんの誠実さの表れでもあります。 自分は日本のことをよく知っているからこそ、より一層、日本のルールやマナーには気をつけなければならない――。大使は人一倍強い適応への意識を持ち続けてきました。 「窮屈さ」が生み出す、世界に類を見ない美しさ ティムラズ・レジャバ駐日ジョージア大使にとってSNS投稿はもはや日課【写真：黒澤崇】 ジョージアから来客があると、誰もが「静かできれいで、なんて便利な国なんだ」と最初の印象を持つといいます。しかし、長く暮らすティムラズさんの胸中には、それとは別の感情も同居していました。 「言葉では言い表せない窮屈感というか、社会の中からくる圧力のようなもの。それはそれで、あるんだなといつも感じます。そこで私がひとつ好きな言葉なのが、『自由のなさが自由』という言葉です。日本人はわざと自分に自由を与えない、みんなちょっと苦労して、それが美化されている部分があるなと」 ティムラズさんは、日本人が「他人に迷惑をかけない」「プレッシャーや責任感を持つ」という姿勢を自らに課し、あえて不自由さを受け入れている姿に、日本特有のあり方を感じているといいます。 「ほかの国では、多少ルールがあいまいでも、その場の判断で柔軟に対応できることがあります。日本人は自由の使い方が上手じゃないですよね。表面から見る日本と、中から見る日本とは、さまざまな違いがあるなと感じます」,[],[]
「アメリカ人的にはありえない！」　日本との価値観の違いに衝撃　ハワイ出身の夫が疑問に思った意外なこととは（Hint-Pot）,https://news.yahoo.co.jp/articles/51d6b1edae73f82fa402434d845c06141b37868a,https://newsatcl-pctr.c.yimg.jp/t/amd-img/20260428-00010003-hintpot-000-6-view.jpg?exp=10800,2026-04-28T09:30:13+09:00,2026-04-28T10:32:33+09:00,Hint-Pot,hintpot,Hint-Pot,1329,日本人はなんでも辛めの評価？（写真はイメージ）【写真：PIXTA】 丁寧なサービスや高い品質で知られる日本。私たちにとって当たり前の基準も、海外の人の目には意外に映ることがあります。ハワイで生活するなかで、日米の価値観の違いにハッとすることがあるという主婦ライターのi-know（いのう）さん。今回はECサイトやレストランの星評価に関して、アメリカ人の夫に「どうして日本人は星5つを付けないの？」と指摘され、カルチャーギャップを感じたといいます。第107回は「日米・星評価の違いとは」です。 【写真】アメリカ人が「当たり前じゃない国もある」と感動した日本人の行動の写真 ◇ ◇ ◇ 「星4.7が当たり前」 アメリカで感じた評価の基準の違い 約十数年前、私はハワイに移住するまでは東京で暮らしていました。インターネットで商品を注文すれば、次の日に届くことが当たり前の環境です。 しかし、ここハワイは事情が異なります。アメリカ本土から遠く離れた島国なので、移住したばかりの頃はネット注文をしても荷物が届くのが1週間後、またはそれ以上かかります。また、輸送中に荷物を紛失されることもあり、自然と店舗で商品を購入することがほとんどでした。 最近になって、ようやくアメリカの大手ECサイトの倉庫がハワイにできたので、商品によっては注文した翌日には届くようになりました。ようやくその利便性を享受できるようになった一方で、日々ネット注文をするなか、ふとあることに気づきました。 ECサイトが便利になり、ハワイでの生活がより便利に【写真：i-know】 それは、購入者の満足度を表す“星評価”の高さです。あくまで個人の感覚ですが、アメリカでは5段階評価中、星が4.7や4.8は当たり前。4.1以下だと「少し低い」と感じ、3.9以下は「買わない」と判断することが多いです。 一方、日本のECサイトでは、5.0に近い高評価がアメリカに比べて少ないと感じます。 「おいしいのに3点台？」 日本の評価に驚いた夫のひと言 この発見を、日本に住んだこともあるアメリカ人の夫に聞いてみました。すると、「日本は飲食店にしても、評価が低すぎる。アメリカ人の感覚で星が3点台というのはとても低い評価だけど、食べてみるととてもおいしい。日本に住んでいるとき、どんなにおいしいお店でも評価が低いから驚いたよ」とのことでした。 そして、こんな質問を投げかけてきました。「日本人は、おいしい！ と思ったお店に、星5つ付けないの？」。日本人代表として答えるのは恐縮ですが、その質問への私の答えは「すごくおいしくても、5は付けない人が多いと思う」でした。おそらく、この意見に共感する日本人は多いのではないかと思います。 たとえば、食べログによる「点数・ランキング」の解説によると、「満足できる確率の“とても高い”お店」の基準である4.00点以上は、全体の約0.07％と非常に低いです。さらに、「満足できる確率の高いお店」の基準である3.50～4.00点未満ですら、全体の約3％となっています。この客観的事実を夫に話すと、「おいしいのに評価が3点台というのは、アメリカ人的にはありえない！」と驚いていました。,[],[]
スペイン人「気になりました」　日本の丁寧さに違和感…買い物の最中に「多い」と感じたものとは（Hint-Pot）,https://news.yahoo.co.jp/articles/2ddebde48d56a291a21f08f8ae69b9d06eb80611,https://newsatcl-pctr.c.yimg.jp/t/amd-img/20260428-00010002-hintpot-000-6-view.jpg?exp=10800,2026-04-28T08:10:40+09:00,2026-04-28T10:31:44+09:00,Hint-Pot,hintpot,Hint-Pot,875,スペインから来たマルタさん【写真：Hint-Pot編集部】 日本人の他者を思いやる細やかな気配りや丁寧なおもてなし精神は、世界中から高く評価されています。しかし、その丁寧さを外国人観光客が疑問に感じることも。2度目の日本を満喫しているスペイン人は清潔さや人の良さに惹かれる一方で、ある光景に首を傾げたといいます。気になったこととはいったいなんなのでしょうか。 【写真】スペイン人が「気になりました」と語ったものの写真 ◇ ◇ ◇ 日本の清潔さや文化に惹かれて2度目の来日 日本へ来るのは2度目という、スペイン人のマルタさんとカルロスさん。今回は3週間の休暇を取り、広島や兵庫、大阪、京都、奈良、金沢、岐阜、そして東京と、各地をめぐる計画を立てました。 「2年も経たないうちに再訪を決めたのは、清潔さや人のよさ、あと文化が好きだからです」 ふたりにとって、日本特有の美意識や、親切な人々との触れ合いは、何度でも体験したくなるほど魅力になっているようです。 スペイン人が気になったもの しかし、マルタさんには、日本のサービスに対し、少し疑問を抱いた点があったようです。 「日本はプラスチックの使用が多いと感じました。とくにコンビニなど、買い物をした際の包装に、プラスチックが多く使われているという印象を受けました」 また、身近なものを例に挙げ、環境への向き合い方の違いにも目を向けていました。 「ペットボトルのキャップは、海洋に流出しやすいため、ヨーロッパではボトルと一体型になっているものが主流です。環境への配慮が重視されているのか、日本の状況が気になりました」 日本では、高温多湿な気候を背景に、食品分野を中心として衛生面に配慮した包装が多く使われる傾向があります。一方で、分別回収や焼却による処理が進んでおり、欧州とは評価の前提が異なります。こうした違いが、資源の使い方に対する印象の差につながっているようです。 ふたりが今回の長期旅行を通じて、さらに深く日本の多様な一面を発見し、充実した時間を過ごせることを願っています。 Hint-Pot編集部,[],[]
ドアの隙間から見えた“笑撃的”な光景に1.7万“いいね”　愛犬をシャンプーしようとしたら…「表情がガチすぎ」の声（Hint-Pot）,https://news.yahoo.co.jp/articles/0b62db1ace8c0a35826b9aecfb055785321dfbe4,https://newsatcl-pctr.c.yimg.jp/t/amd-img/20260428-00010001-hintpot-000-3-view.jpg?exp=10800,2026-04-28T05:30:21+09:00,2026-04-28T07:58:20+09:00,Hint-Pot,hintpot,Hint-Pot,1129,お風呂で待ち構えていたら“笑撃的”な光景が【写真提供：プクマル（@pukumarukun）さん】 お風呂やシャンプーが苦手ないぬは多いものです。気配を察知した瞬間、必死で抵抗する姿に笑ってしまうことも。X（ツイッター）では、シャンプーのために連行され、お風呂場のドアの隙間から全力で抗議する小型犬が話題になっています。1.7万件の“いいね”を集めた“ガチすぎる表情”について、飼い主さんに詳しいお話を伺いました。 【写真】「今日シャンプーするなんて聞いてないんだけどー!!」 ドアの隙間から見えた光景 実際の投稿 ◇ ◇ ◇ お風呂場で見せた必死の抗議 「今日シャンプーするなんて聞いてないんだけどーーー!!」 そんなコメントとともに投稿された写真。そこには、お風呂場のドアの隙間から顔を覗かせるいぬが写っています。 お風呂で待ちかまえる飼い主さんの元へ、抱っこで連れてこられているようですが、注目すべきはその表情。目を見開き、口を大きく開けて何かを必死に訴えている様子です。その形相からは、シャンプーに対する強い拒絶が伝わってきます。 投稿には、1.7万件もの“いいね”が集まりました。リプライ（返信）には「全力で抗議している（笑）」「ご立腹でいらっしゃる」「表情がガチすぎて耐えられませんでしたw」といった声が寄せられています。 甘えん坊のプクくんが見せた意外な表情 シャンプーを察知したプクくん【写真提供：プクマル（@pukumarukun）さん】 話題を集めたのは、マルチーズとトイプードルのミックスで11歳の男の子「プク」くんです。マルチーズで10歳の男の子「マル」くんと一緒に暮らしています。 赤ちゃんの頃からプクプクとしていたことが名前の由来で、現在体重9キロのムチムチボディがチャームポイントです。ぬいぐるみが大好きで、とても甘えん坊なのだとか。 そんなプクくんですが、実はお風呂が大の苦手。「シャンプーするとわかると、いつも逃げ回ってしまいます。今回も、なんとか捕まえてお風呂場に連れてきてもらいました」と飼い主さん。 必死の抵抗を見せたプクくんの表情をとらえようと、飼い主さんがカメラをかまえていると、ドアの隙間から顔を出したそうです。「いつも嫌がりながらお風呂に入ります。この日もアウアウ鳴いて嫌がっており、笑いを必死にこらえながら撮影しました」と振り返ります。 シャンプーをめぐる熱い攻防は、飼い主さんとの信頼関係があってこそ。全力の抗議を見せたあとは、きっといつもの甘えん坊なプクくんに戻ったはずです。これからも、豊かな表情から目が離せそうにありません。 ○取材協力：プクマル（@pukumarukun）さん Hint-Pot編集部,[],[]
1個600円以上でも食感は「カッチカチ」　フランス在住母娘が「これじゃ日本じゃ売れないね」と違いに困惑した日本食とは（Hint-Pot）,https://news.yahoo.co.jp/articles/36f43b2848fb9b51d860c934acc88396fc000c53,https://newsatcl-pctr.c.yimg.jp/t/amd-img/20260428-00010000-hintpot-000-7-view.jpg?exp=10800,2026-04-28T04:30:02+09:00,2026-04-28T09:34:47+09:00,Hint-Pot,hintpot,Hint-Pot,1269,南フランスに住むマカロンちゃん【出典：YouTube「Macaron Chan 南フランス田舎娘」よりスクリーンショット】 洗練された食文化を持つフランス。近年、その美食の国でも、日本の伝統的な食スタイルが広がりを見せています。YouTubeチャンネル「Macaron Chan 南フランス田舎娘」を運営するMamiさんは、南フランスの片田舎で見つけたある日本食のクオリティを確かめるべく、愛娘のマカロンちゃんと実食しました。しかし、ふたりが想像していたものとは少し違う、驚きの結果が。いったい、どんな食べ物だったのでしょうか。 【写真】フランス在住女性が「これじゃ日本じゃ売れないね」と困惑した日本食の写真 ◇ ◇ ◇ 「片田舎のスーパーに異変」 並んでいたのは… 南フランスに住むMamiさん一家。関西弁を話すフランス人の夫・「お父ちゃん」と、9歳の娘・マカロンちゃんと暮らしています。 Mamiさんが「ここ数か月ほど、片田舎のスーパーに異変が起きています」と動画内で紹介したのは、現地のスーパーマーケットの陳列棚。そこには、なんと日本でおなじみの「おにぎり」が並んでいました。Mamiさんによると、これまでおにぎりは「アジアンスーパーか都会にしかなかった」そうで、驚きを隠せません。 味は3種類で、「照り焼き」はすでに売り切れていましたが、ほかにも「わさびツナマヨ」や「焼き鳥」といったラインナップが用意されていました。価格は1個3.25ユーロ。日本円にして約600円というかなりの高級品です。 「めっちゃ硬い」 具材にも違和感 自宅でさっそくマカロンちゃんと一緒に実食したMamiさん。ところが、封を開けて海苔を巻いた瞬間、口から漏れた言葉は「わっ！ やっぱりごはんが硬い」という率直な感想でした。 焼き鳥のおにぎりを頬張ったマカロンちゃんも、開口一番「おいしいけど、ごはんが硬い」と同意。Mamiさんが指で押さえてみると、感触は「カッチカチ」。実際に食べてみても「めっちゃ硬い！」と苦笑いが止まりません。思わず「これじゃ日本じゃ売れないね」と、厳しい評価を下しました。 さらに、Mamiさんは「これ全然焼き鳥じゃないし」と具材についても鋭く指摘。マカロンちゃんも「海苔、ちょっと違うな」と違和感を抱いた様子です。そして、フランス人で寿司が嫌いな人は、「日本のおいしいおにぎりとかお寿司とか食べたことないから」と分析しました。 それでも、身近なスーパーにおにぎりが並び始めたという事実に、ふたりは「ビックリしたな」と時代の変化を実感。とはいえ、本物の味を知っているからこそ、最後には声をそろえて「日本のおにぎりが食べた～い！」と恋しがっていました。 コメント欄には「海苔の違いがわかるマカロンちゃん、さすがです！」「おにぎりの値段が高いのにびっくり。日本で生活できることに感謝したいですね」「形や概要は知っていても、お米の炊き方や最適な硬さを知らないで作っているのでしょうね」といった声が寄せられています。 Hint-Pot編集部,[],[]
