headline,mainEntityOfPage,image,datePublished,dateModified,author,media_en,media_jp,str_count,body,images,external_links
日本人出国者数、2025年は1473万人、2019年比で27％減（トラベルボイス）,https://news.yahoo.co.jp/articles/08aab05e6dd624bbdd1faa452747a408c7a4a91a,https://newsatcl-pctr.c.yimg.jp/t/amd-img/20260121-00010005-travelv-000-1-view.jpg?exp=10800,2026-01-21T18:33:41+09:00,2026-01-21T18:33:41+09:00,トラベルボイス,travelv,トラベルボイス,268,"※本グラフはコピー＆ペーストで自由に転載可
日本政府観光局（JNTO）によると、2025年の年間の日本人出国者数（推計値）は1473万1500人となった。2024年（1300万7282人）比では、約173万人増加（13.3％増）。ただし、2019年比（2008万669人）では26.6％減で、緩やかな回復傾向にあるものの、コロナ前の7割台での推移が続いている。

2025年12月単月では、2024年（118万7210人）比9.6％増の130万700人。2019年（171万2300人）比では24.0％減となった。
トラベルボイス編集部",[],[]
訪日外国人数、年間4000万人超えも伸び率は15.8％増、コロナ前からは1000万人超増加、12月は同月過去最多も3.7％増に留まる（トラベルボイス）,https://news.yahoo.co.jp/articles/c9a8a0e4f1ecb1daa5b085a19b5912418c12c43d,https://newsatcl-pctr.c.yimg.jp/t/amd-img/20260121-00010004-travelv-000-1-view.jpg?exp=10800,2026-01-21T18:05:05+09:00,2026-01-21T18:05:05+09:00,トラベルボイス,travelv,トラベルボイス,1204,"※本グラフはコピー＆ペーストで自由に転載可
日本政府観光局（JNTO）が発表した2025年1年間の訪日外国人旅行者数（推計値）は、4268万3600人で、過去最多だった前年の2024年（3687万148人）から15.8％増（約580万人増）となった。2023年（2506万6350人）からの2年間で、約1700万人（70.3％増）以上増加。コロナ前の最多だった2019年（3188万2049人）と比べると、この6年で1000万人以上、上回った。

国・地域別でも、23市場のうち20市場で年間累計が過去最多を記録。豪州は年間累計で105万8300人（2024年比15.0％増）となり、国・地域別で7番目の100万人市場となった。年間累計の多い順に、韓国が945万9600人（同7.3％増）、中国が909万6300人（同30.3％増）、台湾が676万3400人（同11.9％増）、米国が330万6800人（同21.4％増）、香港が251万7300人（同6.2％減）。香港は唯一、年間の累計で前年を下回った。

2025年12月単月では2024年（348万9888人）比3.7％増の361万7700人で、12月の過去最多を記録。2025年で、4番目に多い月となった。ただし、伸び率は最も小さく、市場別で前年比45％減となった中国市場の動向による影響がうかがえる。

12月単月を国・地域別でみると、多い順に韓国が97万4200人（2024年比12.3％増）、台湾が58万8400人（同19.8％増）、中国が33万400人（同45.3％減）、香港が29万1100人（同1.9％増）、米国が27万700人（同13.5％増）。JNTOによると、多くの市場でスクールホリデーやクリスマス、年末年始の旅行需要の高まりがみられた。

韓国やタイ（同18.6％増の17万4000人）など7市場が単月の過去最多に、台湾や米国、カナダ（同18.5％増の5万7200人）など14市場が12月の過去最多を更新した。中国は前年から半減近く落ち込んだものの、3番目に多い市場となっている。
消費額も過去最高
2025年年間の訪日外国人旅行消費額は、前年比16.4％増の9兆4559億円となり、年間で過去最高を更新した。

国籍・地域別の年間消費額では、中国が2兆26億円（構成比21.2％）で首位。次いで台湾が9638億円（同10.2％）、米国が9139億円（同9.7％）、韓国が8767億円（同9.3％）、香港が5716億円（同6.0％）となった。上位5カ国・地域で全体の約6割を占めており、特に中国は前年比で大幅な伸びを見せ、市場全体の牽引役となった。

1人当たりの旅行支出は22.9万円だった。国籍・地域別では、ドイツが最も高く（39.4万円）、次いで英国（39万円）、オーストラリア（39万円）の順だった。
トラベルボイス編集部",[],[]
国際標準パスポートだけで宿泊チェックインの実証へ、大日本印刷（DNP）とUSEN-ALMEX、新サービス創出に向けて（トラベルボイス）,https://news.yahoo.co.jp/articles/c718e2b2d405ae079c0a3cb92a90871ae278550a,https://newsatcl-pctr.c.yimg.jp/t/amd-img/20260121-00010003-travelv-000-1-view.jpg?exp=10800,2026-01-21T13:30:22+09:00,2026-01-21T13:30:22+09:00,トラベルボイス,travelv,トラベルボイス,861,"次世代チェックインの実証実験
大日本印刷（DNP）とUSEN-ALMEXは、デジタルパスポートと連動した次世代チェックインの実証実験をおこなう。デジタルパスポートは、国際民間航空機関（ICAO）が国際標準化を進めており、各国で実証や限定的な導入が始まるなど、段階的な社会実装に向けた動きが進んでいる。

今回の実証は、主な対象を韓国とし、チェックインKIOSK端末と連動したデジタルパスポートを用いた本人確認をおこなうことで、パスポート提示・目視確認を含む従来の確認工程の一部を効率化するもの。高度なセキュリティ技術や認証基盤、国際標準に準拠した暗号技術を持つDNPの強みと、ホテル向け自動精算機・KIOSK端末で国内トップシェアのUSEN-ALMEXの強みを掛け合わせて、ホテルチェックインの効率化と、旅行者の体験価値を向上させる新たなサービスの創出を目指す。また、今後、対象市場を台湾や香港など東アジアに拡大していく考えだ。

具体的には、国際標準に準拠した高いセキュリティのデータ管理機能と暗号鍵技術を備えたDNPの認証基盤「DNP分散型ID管理プラットフォーム CATRINA（カトリーナ）」による宿泊者認証をおこなう。USEN-ALMEXが展開するホテル向けKIOSK・オンライン事前チェックインサービス「PreCheck-in」とDNPの認証基盤の連動によって、宿泊者名簿作成や本人確認の自動化を実施する。

フェーズ1では、2026年1月20日から「ロワジールホテル 品川シーサイド」でプロトタイプKIOSKを用いた「対面」でのチェックイン技術実証や実際の宿泊者・ホテルスタッフによる体験評価をおこなう。

フェーズ2では、2026年3月1日～6月30日にかけて、USEN-ALMEXの「PreCheck-in」導入済みホテルで「PreCheck-in」とデジタルパスポートの情報を用いた「非対面」でのチェックイン実証、照合速度や運用性、ユーザー体験の確認、省力化効果の評価をおこなう。
トラベルボイス編集部",[],[]
ジャングリア沖縄、新アトラクション「グラビティ ドロップ」登場、20メートル落下のスリル体験（トラベルボイス）,https://news.yahoo.co.jp/articles/00e5a4eb944f0765bc64e436c5045fa7599a90fa,https://newsatcl-pctr.c.yimg.jp/t/amd-img/20260121-00010002-travelv-000-1-view.jpg?exp=10800,2026-01-21T13:20:23+09:00,2026-01-21T13:20:23+09:00,トラベルボイス,travelv,トラベルボイス,349,"新アトラクション登場
ジャパンエンターテイメント社が運営するJUNGLIA OKINAWA（ジャングリア沖縄）は、2026年1月24日、新アトラクション「グラビティ ドロップ（GRAVITY DROP）」をオープンする。

約20メートルの高さに宙づりにされている状態から、突然フックが外され、背中から急落する体験。落下時には視界全体に空が広がり、ネットに包み込まれて着地する演出だ。着地時の最大時速は57キロ。体験利用の条件は、体重30キロ以上100キロ未満、身長132センチ以上、10才未満の場合は18才以上の同伴が必要など。

また、ゴールデンウイーク（GW）前後には、新しいライドアトラクション「YAMBARU TORNADO（やんばるトルネード）」も登場する予定だ。
トラベルボイス編集部",[],[]
米国の国立公園、外国人向け料金を改定、1人あたり100ドル追加、グランドキャニオンやイエローストーンなど（トラベルボイス）,https://news.yahoo.co.jp/articles/84848b8b7f788c5a235e3e1763da0b1ae2efaef6,https://newsatcl-pctr.c.yimg.jp/t/amd-img/20260121-00010001-travelv-000-1-view.jpg?exp=10800,2026-01-21T13:10:36+09:00,2026-01-21T13:10:36+09:00,トラベルボイス,travelv,トラベルボイス,891,"外国人向け料金を改定
米国の国立公園を管轄する米国内務省は、訪問者数の多い国立公園11カ所で外国人向け料金を改定した。2026年から、対象の国立公園を訪れる外国人観光客は、これまでの入園料に加えて、16歳以上の外国人来園者1人あたり100ドル（約1万5800円）の追加料金が徴収される。追加料金は、国立公園の維持管理、施設の改修、サービス向上に充当される。

対象となるのは、アーカディア国立公園、ブライスキャニオン国立公園、エバーグレーズ国立公園、グレイシャー国立公園、グランドキャニオン国立公園、グランドティトン国立公園、ロッキーマウンテン国立公園、セコイア・キングスキャニオン国立公園、イエローストーン国立公園、ヨセミテ国立公園、ザイオン国立公園。

同時に、1年間有効の年間入園パス「アメリカ・ザ・ビューティフル・パス」の外国人向け料金も250ドル（約3万9500円）へと変更された。このパスは、国立公園局が管理する63の国立公園を含む約430の国立公園関連施設をはじめ、野生生物保護区や国有林などを含む数千ヶ所の連邦管理の保護区域で利用できるもの。

車両単位で入場料が設定されている国立公園では、一枚のパスで同乗者全員が入場可能。1人あたりの入園料が設定されている国立公園では、パス1枚につき保持者本人を含め最大大人4名（本人＋同伴者3名）まで入場することができる。

国立公園局では、国立公園の訪問を予定している旅行者に対して、オーバーツーリズムを防ぐ観点から繁忙期を避けた訪問を推奨するとともに、出発前に国立公園局の公式サイトおよび各州立公園の公式サイトで、休園情報や季節による制限などの最新情報を事前に確認するよう呼びかけている。

また、米国の観光マーケティング機関「ブランドUSA」は一般消費者向けデジタルプラットフォーム「AmericaTheBeautiful.com」上で、入園料改定の対象となる11の国立公園の詳細情報、周辺の注目すべき国定公園や州立公園の概要を公開した。

※ドル円換算は1ドル158円でトラベルボイス編集部が算出
トラベルボイス編集部",[],[]
2026年にホテルは何を再設計すべきか？　旅の起点が「場所」から「理由」に回帰する時代を考察【コラム】（トラベルボイス）,https://news.yahoo.co.jp/articles/7872735b273e998770dfed1eb4f51a0459c070ff,https://newsatcl-pctr.c.yimg.jp/t/amd-img/20260121-00010000-travelv-000-1-view.jpg?exp=10800,2026-01-21T13:01:03+09:00,2026-01-21T13:01:03+09:00,トラベルボイス,travelv,トラベルボイス,3901,"ヒルトンのトレンドレポート
2026年、今年のホテル・旅行のトレンドはどうなるのでしょうか。今回のコラムでは、ヒルトンの最新トレンドレポートを手がかりに「旅の目的が変わる時代に、ホテルは何を再設計すべきか」を読み解きます。

コロナ禍以降、世界の旅行需要は「量」から「質」へと軸を移し、旅行者が求めるのは単なる宿泊体験ではなく、「どのように」「なぜ」旅をするのかという“目的”そのものになってきました。

世界の大手ホテルチェーンが発表する最新のトレンドレポートを眺めると、共通するキーワードとして「ウェルビーイング」「多世代」「つながり」「静けさ」「自己回復」といった概念が浮かび上がります。

こうした流れを象徴するのが、ヒルトンが2025年秋に発表した「Hilton 2026年トレンドレポート：The Whycation（ワイケーション）」です。このレポートは、世界14カ国・1万4000人の旅行者調査をもとに、来るべき「意図ある旅（intentional travel）」の時代を予見しています。

タイトルにある“Whycation”とは、「どこへ行くか」ではなく「なぜ行くのか」から始まる旅。つまり、旅の起点が“場所”から“理由”へと変わるという発想です。
「なぜ旅をするのか」から始まる新しい体験
ヒルトンによれば、2026年の旅行者は「休息したい」「再びつながりたい」「意味ある体験を得たい」という感情的なモチベーションに基づいて旅を選ぶようになるといいます。特徴的なのは、静寂を求める「ホッシュピタリティ（Hoshhhpitality）」の潮流。都市の喧騒を離れ、音の少ない環境で心を整える旅が注目されているのです。

また、レポートでは「家の快適さを持ち運ぶ」傾向も指摘されました。旅行者は日常のリズムを維持しながら滞在することを好み、ペットや植物など“家の一部”を旅に取り込もうとしています。ヒルトンはこれを「Home Comforts are the New Carry-On（家の快適さが新しい手荷物）」と表現していますが、これは長期滞在型ホテルやレジデンスタイプ施設の需要増加にもつながる視点です。自炊可能なキッチン付き客室、パーソナル空間を確保できるワークエリアなどが、今後の標準装備となる可能性があります。

さらに、家族旅行の形の変化にも注目しています。特に顕著なのが、祖父母と孫が一緒に旅をする「スキップ・ジェネレーション（Skip-Gen）」旅行の拡大です。世界全体では30％前後の家族がこの形態の旅行を経験しており、ヒルトンは「旅は、もはや世代をまたぐ“文化の継承”の場となっている」と分析します。旅行を通じて家族の物語を紡ぎ、伝統や価値観を共有する、「Inheritourism（旅の継承）」の時代といえるでしょう。

日本においても、祖父母・親・子どもがそろう3世代旅行は広く定着しています。ただし、Skip-Gen旅行は親世代を介さず、祖父母と孫が直接時間を共有する点で、日本型の3世代旅行とは性格を異にします。ヒルトンが示す「Inheritourism（旅の継承）」は、こうした世代間の直接的な関係性を通じて、価値観や物語を次世代へ伝える旅のあり方を指していると考えられます。
世界の旅行市場の構造変化とホテル戦略
旅行市場全体も、新しい段階に入ります。UNツーリズム（国連世界観光機関）の見通しでは、2026年に国際旅行者数は2025年比で3〜5％増加し、2019年の水準を完全に回復すると予測されています。

また、こうした旅行需要の回復を背景に、観光産業の側にも構造的な変化が生じています。世界旅行ツーリズム協議会（WTTC）は、「観光産業の雇用は史上最高水準に達しつつある」と報告しており、旅行の“平常化”とともに、サービスの質や人材の専門性がこれまで以上に問われる局面に入ったと指摘しています（WTTC 2025年度報告書による）。

ホテル業界では、世界大手各社が「ロイヤリティプログラム」「サブスクリプション」「デジタル統合」を軸にした競争を強化しています。たとえば、アコーが発表した新プログラム「ALL Accor+」は、4種類のサブスクリプションで会員ニーズに対応し、世界30ブランド以上、4500軒を横断的に利用できる仕組みです。

こうした戦略は、短期の値引きではなく、「滞在の質」と「顧客ロイヤリティ」を長期的に高める方向を示しています。この動きは、ヒルトンやマリオットなど他のグローバルチェーンにも共通するもので、“宿泊＝会員体験の一部”という発想が、今後さらに定着していくでしょう。
2026年の旅とは？
ヒルトンのトレンドレポートで最も印象的なのは、旅が「目的地」から「目的」へと回帰しているという点です。

人々はかつての“観光”から、“意味ある移動”へとシフトしようとしています。報告書のなかでCEOのクリス・ナセッタ氏は、「いま最も重要なのは、旅の“感情的価値”である」と述べています。74％の旅行者が「信頼できるブランドで予約することが重要」と回答しており、安心感・一貫性・共感が旅行選択の中心になっているのです。

この文脈で注目すべきは、旅行の“癒し”や“静けさ”を求めるニーズが高まっていることです。かつて旅は非日常を求めるものでしたが、いまや“心身の回復”という非常に日常的な目的が主軸になりつつあります。

ウェルネス滞在やリトリート、スパリゾートの需要は世界的に拡大しており、ヒルトンはその象徴として「静寂をデザインするホテル」の重要性を挙げています。これは単なる“高級志向”ではなく、「自分のペースを取り戻す場所」としてのホテルの価値が再定義されているということです。

こうした変化は、決して世界だけの話ではありません。日本の宿泊市場でもその傾向はみられ始めています。
日本でも「祖父母との旅」が広がる
また、ヒルトンは「旅の再定義は世代間にも及ぶ」として、家族旅行におけるスキップ・ジェネレーション現象を詳しく分析しました。特に日本では、この動きが静かに広がり始めているといいます。祖父母と孫がともに旅をし、親世代は仕事などで同行しないケースが増えているのです。

ヒルトンの日本市場向け調査では、37％の日本人旅行者が「すでにスキップ・ジェン旅行をした、または予定がある」と回答し、71％が“家族旅行は高齢者の健康や幸福感を高める”と答えました。

動機のトップは「祖父母と孫の特別な思い出をつくること」（43％）。家族の絆を再確認する旅は、単なる観光ではなく“心のリハビリテーション”としての意味を帯びています。

ヒルトンは、日本を「多世代旅行の可能性が最も高い成熟市場の一つ」と位置づけています。家族の中での世代交流が文化的に重視される一方で、少子高齢化が進む日本では、祖父母と孫が直接ふれあう場としての旅行の意義が増しています。

ホテル経営者にとって、これは新たな顧客層の拡張を意味します。スキップ・ジェン旅行では、予約の決定権を持つのが祖父母である場合が多く、シニア世代にとって利用しやすいバリアフリー設備、やわらかい食事メニュー、静かな休息スペースなどの整備が差別化要因になります。

また、孫世代にとっての魅力を補完するために、キッズプログラムや地域体験型アクティビティの導入も効果的です。これらを「共創体験」として統合すれば、日本の温泉地やリゾートホテルにも新しいポジショニングが見えてくるでしょう。

さらに、ヒルトンの調査が示すように、「質の高い時間（Quality Time）」は「リラックス（Downtime）」を上回る最重要テーマになっています。

日本の宿泊施設も、単に“休む場所”ではなく、“家族が時間を共有する場所”へと進化することが求められます。ファミリースイート、コネクティングルーム、キッズ向けの食体験イベントなど、「家族単位での滞在価値」を設計することが不可欠です。もちろん、すでにこうした取り組みは日本のホテル業界で広く行われているはずです。
旅の「再定義」は、ホテルの「再設計」へ
2026年のホテル市場を展望すると、「旅の再定義」は「ホテルの再設計」へとつながっていくことがわかります。ヒルトンが掲げる“Whycation”という概念は、旅行を“消費”から“共創”へと変える思想です。旅行者は「どこに行くか」ではなく、「誰と、どんな気持ちで旅をしたか」を重視し、ホテルはその物語の舞台装置としての役割を担うようになります。

静寂をデザインするリゾート、心地よい日常を再現する長期滞在型ホテル、そして世代を超えて思い出を共有できるファミリーステイ。それらはすべて、“なぜ旅をするのか”という問いへのホテル側の回答でもあります。

2026年以降、ホテル産業は単なるインフラではなく、「感情を支える空間」としての進化を迫られる時代に入るでしょう。

▼筆者プロフィール
山川清弘（やまかわ　きよひろ）

東洋経済新報社編集委員。早稲田大学政治経済学部卒業。東洋経済で記者としてエンタテインメント、放送、銀行、旅行・ホテルなどを担当。「会社四季報」副編集長などを経て、現在は「会社四季報オンライン」編集部。著書に「1泊10万円でも泊まりたい　ラグジュアリーホテル　至高の非日常」（東洋経済）、「ホテル御三家」（幻冬舎新書）など。
トラベルボイス編集部",[],[]
