headline,mainEntityOfPage,image,datePublished,dateModified,author,media_en,media_jp,str_count,body,images,external_links
自称ラッパーの19歳男を詐欺容疑で再逮捕　神戸の高齢女性宅訪れ、キャッシュカード3枚だまし取る（神戸新聞NEXT）,https://news.yahoo.co.jp/articles/77332785de53d33d3c44c5f9536d1a03cfae01df,https://newsatcl-pctr.c.yimg.jp/t/amd-img/20240922-00000010-kobenext-000-3-view.jpg?exp=10800,2024-09-22T18:47:12+09:00,2024-09-22T18:48:46+09:00,神戸新聞NEXT,kobenext,神戸新聞NEXT,412,\n兵庫県警察本部＝神戸市中央区\n高齢女性からキャッシュカードをだまし取ったとして、兵庫県警特殊詐欺特別捜査隊と灘署は２２日、詐欺の疑いで、大阪府東大阪市の自称ラッパーの男（１９）を再逮捕した。容疑を認めているという。\n【写真】元阪神の糸井さん、AIからの「詐欺電話」に思わず…\n逮捕容疑は何者かと共謀し、８月９日に神戸市須磨区の女性（８４）宅に警察官をかたって「あなた名義のキャッシュカードからお金が下ろされている」などと電話をかけて、女性宅を訪れキャッシュカード３枚をだまし取った疑い。\n\n 同署によると、女性と家族の口座から現金計１８１万円が引き出されていた。\n\n 男は特殊詐欺の「受け子」役とみられ、８月に灘区の高齢女性からキャッシュカードや現金をだまし取ったとして、詐欺容疑で同署などに逮捕された。９月１１日にも同様の手口で兵庫区の高齢男性からキャッシュカードをだまし取ったとして、再逮捕されていた。,['https://newsatcl-pctr.c.yimg.jp/t/amd-img/20240922-00000010-kobenext-000-3-view.jpg?pri=l&w=640&h=423&exp=10800'],"['https://news.yahoo.co.jp/articles/77332785de53d33d3c44c5f9536d1a03cfae01df/images/000', 'https://www.kobe-np.co.jp/news/hanshin/202408/0018040402.shtml?p=0']"
ヴィッセル神戸、新潟に逆転勝ちで4連勝　後半追加タイム、途中出場のDF菊池が頭で決める（神戸新聞NEXT）,https://news.yahoo.co.jp/articles/9f2e4174b6f1756d00752f1ea07df97fddaa3a3a,https://newsatcl-pctr.c.yimg.jp/t/amd-img/20240922-00000014-kobenext-000-6-view.jpg?exp=10800,2024-09-22T20:21:27+09:00,2024-09-22T20:28:22+09:00,神戸新聞NEXT,kobenext,神戸新聞NEXT,641,\n新潟－神戸 前半１５分、神戸・酒井のクロスがそのままネットに吸い込まれて先制。１－０とする＝新潟市、デンカビッグスワンスタジアム\n明治安田Ｊ１リーグ第３１節最終日の２２日、ヴィッセル神戸は新潟市のデンカビッグスワンスタジアムで、アルビレックス新潟と対戦し、後半追加タイムに菊池が頭で決めて３－２で逆転勝ちし、今季２度目の４連勝を飾った。１７勝７分け７敗で勝ち点５８とした。\n【写真】前半、神戸の武藤が放ったシュートはポストに当たり、絶好機を逃す\n先制すれば前節まで１３勝２分けだった神戸。１－２で折り返した後半も新潟ペースで進んでいた窮地を、神戸の武藤が一変させた。\n\n ２８分、大迫のスルーパスに、オフサイドラインぎりぎりで抜け出すと、体を後ろに倒しながら左足で合わせた。「自分の価値を高める」と繰り返し語っていた背番号１１が、昨季に並ぶ今季１０ゴール目で証明した。\n\n 最後に劇的な展開が待っていた。後半追加タイム、井手口の左ＣＫに、後半途中出場のＤＦ菊池が頭で合わせて勝ち越し。そのまま勝利のホイッスルが鳴り響いた。\n\n １７日のアジア・チャンピオンズリーグ・エリート（ＡＣＬＥ）初戦のタイ遠征には、大迫を除いてほぼベストメンバーが出場。この影響は否めず、球際の厳しさなどの強度は影を潜めた。\n\n だが、終盤戦の鍵は「メンタル。疲れを言っても仕方がない」と吉田監督。勝てば首位と勝ち点１差に迫る戦いで、苦しい試合を最後の最後でものにした。（井川朋宏）,['https://newsatcl-pctr.c.yimg.jp/t/amd-img/20240922-00000014-kobenext-000-6-view.jpg?pri=l&w=640&h=445&exp=10800'],"['https://news.yahoo.co.jp/articles/9f2e4174b6f1756d00752f1ea07df97fddaa3a3a/images/000', 'https://www.kobe-np.co.jp/news/sports/202409/0018149859.shtml?p=1']"
JR加古川線　粟生-西脇市間で一時運転見合わせ　架線にビニール（神戸新聞NEXT）,https://news.yahoo.co.jp/articles/62f33f7b4bbf238f345f346b5a3308c7a36a4716,https://newsatcl-pctr.c.yimg.jp/t/amd-img/20240922-00000011-kobenext-000-5-view.jpg?exp=10800,2024-09-22T19:07:39+09:00,2024-09-22T20:00:33+09:00,神戸新聞NEXT,kobenext,神戸新聞NEXT,128,\n神戸新聞ＮＥＸＴ\nＪＲ西日本によると、２２日午後４時３５分ごろ、ＪＲ加古川線滝野（加東市上滝野）－滝（同）間で架線にビニールが付いたため、粟生（小野市粟生町）－西脇市（西脇市野村町）間の上下で一時運転を見合わせた。約２時間半後の午後７時前に再開した。,['https://newsatcl-pctr.c.yimg.jp/t/amd-img/20240922-00000011-kobenext-000-5-view.jpg?pri=l&w=640&h=510&exp=10800'],['https://news.yahoo.co.jp/articles/62f33f7b4bbf238f345f346b5a3308c7a36a4716/images/000']
SNSアプリで「決められた金額振り込むと報酬」　45歳女性、14万3千円詐欺被害　兵庫・豊岡（神戸新聞NEXT）,https://news.yahoo.co.jp/articles/40f624dc0c4118ace5bbeee8cea9d3c55e5de225,https://newsatcl-pctr.c.yimg.jp/t/amd-img/20240922-00000013-kobenext-000-3-view.jpg?exp=10800,2024-09-22T19:49:51+09:00,2024-09-22T19:51:46+09:00,神戸新聞NEXT,kobenext,神戸新聞NEXT,352,\n兵庫県警豊岡署＝豊岡市昭和町\n２２日、兵庫県豊岡市の会社員女性（４５）が「副業を進められ計１４万３千円をだまし取られた」と県警豊岡署に届け出た。\n【写真】だまされた自分を責める日々…キャッシュカード盗まれた女性が語る「詐欺盗」の手口\n同署によると、女性はスマートフォンで副業について調べている際に行き着いたＳＮＳアプリで「簡単な仕事がある」と進められた。指定の時間や口座に、決められた金額を振り込む「タスク（作業）」をこなすと報酬が得られる仕組みと説明を受けという。\n\n 最初の３千円の振り込みでは３００円の利益があった。ところが、３回目で誤った指示をされた上、「失敗したので、違約金１０万円が必要だが、返ってくる」などと言われ、１０万円を入金。しかし、引き出せず、詐欺だと気付いたという。,['https://newsatcl-pctr.c.yimg.jp/t/amd-img/20240922-00000013-kobenext-000-3-view.jpg?pri=l&w=640&h=448&exp=10800'],"['https://news.yahoo.co.jp/articles/40f624dc0c4118ace5bbeee8cea9d3c55e5de225/images/000', 'https://www.kobe-np.co.jp/news/kobe/202408/0018036842.shtml?p=0']"
アユ釣り中の39歳男性、流され死亡　上流で激しい雨　兵庫・佐用の千種川（神戸新聞NEXT）,https://news.yahoo.co.jp/articles/9ffbfa2aae0eda7a6e2732f8ec6fd6a3dbe13208,https://newsatcl-pctr.c.yimg.jp/t/amd-img/20240922-00000012-kobenext-000-3-view.jpg?exp=10800,2024-09-22T19:16:37+09:00,2024-09-22T19:20:09+09:00,神戸新聞NEXT,kobenext,神戸新聞NEXT,392,\n兵庫県警たつの署＝たつの市龍野町富永\n２２日午後１時ごろ、兵庫県佐用町西下野の千種川で、アユ釣りに来ていたアルバイトの男性（３９）＝神戸市須磨区＝がうつぶせで浮かんでいるのを、釣りをしていた男性（４９）が見つけて１１９番した。男性は搬送先の病院で死亡が確認された。\n【写真】ウインドサーフィン中に強風で漂流 海保が出動、30分後に救助\nたつの署によると、男性は同日午前９時半ごろから、約１・２キロ上流の佐用町中三河で、親族の６０代男性と川に入りアユ釣りをしていた。同日正午ごろ、水位が増したため男性は陸に上がったが、男性は誤って足を滑らせて流されたという。\n\n 神戸地方気象台によると、上流の宍粟市北部では同日午前９時ごろまでの１時間に約３０ミリの激しい雨が降ったとみられる。西はりま消防組合によると、付近の水位は通常より１０～２０センチほど高く、流れも速かったという。,['https://newsatcl-pctr.c.yimg.jp/t/amd-img/20240922-00000012-kobenext-000-3-view.jpg?pri=l&w=640&h=469&exp=10800'],"['https://news.yahoo.co.jp/articles/9ffbfa2aae0eda7a6e2732f8ec6fd6a3dbe13208/images/000', 'https://www.kobe-np.co.jp/news/backnumber2/202403/0017455441.shtml?p=0']"
新鮮「香住ガニ」おいしくきれいに　漁港で食べ方選手権　祝解禁のまつり、観光客ら舌鼓　（神戸新聞NEXT）,https://news.yahoo.co.jp/articles/b98a0ed3ffb0ba7ddb7378a9c426674508df7d90,https://newsatcl-pctr.c.yimg.jp/t/amd-img/20240922-00000009-kobenext-000-3-view.jpg?exp=10800,2024-09-22T18:30:19+09:00,2024-09-22T18:47:06+09:00,神戸新聞NEXT,kobenext,神戸新聞NEXT,520,\nゆでガニ１匹の食べ方を競った「香住ガニ食べ方上手選手権」＝香住漁港西港\nベニズワイガニ漁の解禁を祝う「香住ガニまつり」が２１日、兵庫県香美町香住区若松の香住漁港西港であった。焼きガニやゆでガニを求める多くの観光客でにぎわい、秋の味覚を堪能した。\n【別カット】ゆでガニ１匹の食べ方を競った「香住ガニ食べ方上手選手権」\n漁期は９月１日～翌年５月３１日。関西では同港だけで水揚げされ、地元では「香住ガニ」とブランド化した。\n\n 会場では、但馬漁協の脚折れなど「訳あり」のボイル大２匹（１万円、２４０箱）と、小３匹（６千円、４００箱）は早々に完売。半身のボイルや焼きガニ、カニ汁の販売コーナーには１００メートル以上の行列ができていた。\n\n 「香住ガニ食べ方上手選手権」では、１６人が２組に分かれて出場し、制限時間内にゆでガニ１匹をどれだけきれいに食べられるかを競った。出場者は見守る家族や来場者から声援を受けながら、殻を机に打ち付けたり、はさみで切ったりして取り出したカニ身を食べ進めた。\n\n １組目で優勝した京都市の男性（４７）は「ツヤツヤで、今まで食べた中で一番おいしかった」と喜び、景品の香住ガニを獲得した。（丸山桃奈）,['https://newsatcl-pctr.c.yimg.jp/t/amd-img/20240922-00000009-kobenext-000-3-view.jpg?pri=l&w=640&h=426&exp=10800'],"['https://news.yahoo.co.jp/articles/b98a0ed3ffb0ba7ddb7378a9c426674508df7d90/images/000', 'https://www.kobe-np.co.jp/news/tajima/202409/0018149226.shtml?p=1']"
三田市議選告示、定数22に33人立候補　29日投開票　まちの魅力創出や病院問題が争点に（神戸新聞NEXT）,https://news.yahoo.co.jp/articles/fc0ced36e676d62411410b2d95ac6dd308c84295,https://newsatcl-pctr.c.yimg.jp/t/amd-img/20240922-00000008-kobenext-000-4-view.jpg?exp=10800,2024-09-22T17:26:35+09:00,2024-09-22T17:30:59+09:00,神戸新聞NEXT,kobenext,神戸新聞NEXT,1162,\n雨の中、候補者の第一声に耳を傾ける支援者ら＝三田市内\n任期満了に伴う三田市議選（定数２２）が２２日告示された。立候補したのは現職１６人、元職２人、新人１５人の計３３人。３７人が立った２０２０年の前回からは４人減ったものの、過去４番目に多く、競争率１・５倍と今回も激しい選挙戦になっている。時折雨が激しく降る中、各候補者は街頭で支持を呼びかけた。投開票は２９日。（橋本 薫、黒田耕司、尾仲由莉）\n【特設ページ】三田市議選 全候補者の自己PRやアンケート回答を紹介\n党派別の内訳は、自民３人▽立民２人▽維新４人▽公明３人▽共産３人▽参政１人、無所属１７人（自民推薦の１人を含む）。男性は２８人、女性は前回と同じ５人だった。年代別（投票日現在）は３０代２人▽４０代１０人▽５０代９人▽６０代１１人▽８０代１人－で、平均年齢は５４・８歳と前回より０・６歳低くなった。\n\n この日は午前７時２０分ごろから市役所の立候補届け出会場に各陣営が続々と集まり、届け出順を決めるくじを引いた。手続きを終え、腕章やのぼりなどの「七つ道具」を受け取ると、それぞれの選挙事務所や街頭に急いだ。\n\n ニュータウン開発でかつて人口増加率が１０年連続で日本一だった同市では、急激な人口減と少子高齢化が進む。市議選では、円熟期のまちのあり方や新たな魅力の創出、子育て支援、市民病院問題などが争点となりそうだ。\n\n また、斎藤元彦知事のパワハラ疑惑などを巡り、兵庫県議会で斎藤知事への不信任決議案が全会一致で可決されるなど、県政に激震が走る中での選挙戦となった。\n\n ある政党の現職候補は「県政の混乱は余計だった。始まってみないと読めないところがある」と市議選への影響を気に懸けつつ、「市の基幹産業である農業を守らなければ、市民の命も守れない」などと第一声を上げた。\n\n 別の政党の出陣式には現職、新人の候補に加え、党幹部の国会議員らも駆けつけた。陣営は「有権者からは厳しい視線が注がれている」と認める一方、「守りに入らず誠実に改革を訴える」と強気の姿勢を示す。\n\n ある新人候補は厳しい市の財政状況に触れ、「稼ぐ力やブランディングも重要だ。１０年後を見据えれば、今変わらないといけない」と声を張り上げた。\n\n ２１日現在の選挙人名簿登録者数は８万９６８０人（男性４万２８６５人、女性４万６８１５人）。\n\n 期日前投票所は２３～２８日、市役所（午前８時半～午後８時）とイオン三田ウッディタウン店（午前９時～午後８時）に開設。今回から移動式の期日前投票所も、藍市民センター▽有馬富士共生センター▽ふれあいと創造の里▽高平ふるさと交流センター－の４カ所に設置し、２３日から順に１日ずつ実施する。いずれも午前９時～午後３時。,['https://newsatcl-pctr.c.yimg.jp/t/amd-img/20240922-00000008-kobenext-000-4-view.jpg?pri=l&w=640&h=472&exp=10800'],"['https://news.yahoo.co.jp/articles/fc0ced36e676d62411410b2d95ac6dd308c84295/images/000', 'https://www.kobe-np.co.jp/news/sandashigisen_kouhosya/']"
お化けが多くて…密集44体に悲鳴　姫路セントラルパークに期間限定の屋敷登場「日本で唯一の光景を見て」（神戸新聞NEXT）,https://news.yahoo.co.jp/articles/63dd08f9325c7a8f8539a6ce03ab1d858db8b882,https://newsatcl-pctr.c.yimg.jp/t/amd-img/20240922-00000007-kobenext-000-5-view.jpg?exp=10800,2024-09-22T11:30:23+09:00,2024-09-22T12:07:55+09:00,神戸新聞NEXT,kobenext,神戸新聞NEXT,608,\n４４体のお化けが密集する新スポット「密 ＭＩＴＳＵ」＝姫路セントラルパーク\n残暑が続く中、客に納涼気分を味わってもらおうと、姫路セントラルパーク（兵庫県姫路市豊富町神谷）に期間限定のお化け屋敷が登場した。「密（みつ） ＭＩＴＳＵ」と題し、お化け４４体がホール内に密集する。ひしめき合うお化けに、来場客は背筋を凍らせたり、悲鳴を上げたりしている。１０月６日までの毎週日曜に開催。（辰巳直之）\n【ランキング】思い出のテーマパーク アンケート２位はポートピアランド、１位は\nお化け屋敷をプロデュースする企業「怖がらせ隊」社長の岩名謙太さん（３０）が演出。偽の霊能者が開いた降霊会に本物のお化けが現れる－という設定で、パーク内の３Ｄシアター「バスターボム」でプロの俳優らが寸劇を披露する。クライマックスでは、広さ約８５平方メートルのホール内に、白装束に長髪のお化け４４体が乱入する。\n\n 活動する１０年間で全国約３００件に携わった岩名さんは、「これだけの数のお化けは初めて。日本で唯一の光景を見てほしい」とアピールする。実際に体験した神戸市の会社員男性（４４）は「お化けが多くて逆に面白かった」と喜んでいた。\n\n 受け付けは正午～午後７時半（最終日は同４時で受け付け終了）。定員４８人で、所要時間は約１５分。１人８００円（別途入園料が必要）。未就学児は付き添いが必要。同パークＴＥＬ０７９・２６４・１６１１,['https://newsatcl-pctr.c.yimg.jp/t/amd-img/20240922-00000007-kobenext-000-5-view.jpg?pri=l&w=640&h=432&exp=10800'],"['https://news.yahoo.co.jp/articles/63dd08f9325c7a8f8539a6ce03ab1d858db8b882/images/000', 'https://www.kobe-np.co.jp/news/richa/lifedesign/202407/0017880216.shtml']"
無人の飲食店、ダクトから煙　調理場の壁など焼く　尼崎（神戸新聞NEXT）,https://news.yahoo.co.jp/articles/906efc6b3980865aa7dd706b458fda40cda59121,https://newsatcl-pctr.c.yimg.jp/t/amd-img/20240922-00000006-kobenext-000-3-view.jpg?exp=10800,2024-09-22T09:29:48+09:00,2024-09-22T09:36:47+09:00,神戸新聞NEXT,kobenext,神戸新聞NEXT,195,\n尼崎南署庁舎＝尼崎市昭和通２\n２２日午前４時ごろ、兵庫県尼崎市昭和南通６の飲食店で、ダクトから煙が出ているのを近くの住民が見つけ１１９番した。調理場の壁などが焦げたが、けが人はいなかった。\n【写真】六甲アイランドの15階建てマンションで火災 住民に避難指示\n県警尼崎南署によると、当時、閉店して無人だった。おでんの調理器具が空だき状態になっており、その周辺や壁などが焦げたという。,['https://newsatcl-pctr.c.yimg.jp/t/amd-img/20240922-00000006-kobenext-000-3-view.jpg?pri=l&w=640&h=424&exp=10800'],"['https://news.yahoo.co.jp/articles/906efc6b3980865aa7dd706b458fda40cda59121/images/000', 'https://www.kobe-np.co.jp/news/backnumber2/202405/0017678866.shtml?p=0']"
年金機構職員名乗り「過払い金還付」ニセ電話　67歳女性が97万円詐欺被害　川西（神戸新聞NEXT）,https://news.yahoo.co.jp/articles/0bf64860e51475f2cb3808ac9c232b569eccc61b,https://newsatcl-pctr.c.yimg.jp/t/amd-img/20240922-00000005-kobenext-000-3-view.jpg?exp=10800,2024-09-22T09:29:48+09:00,2024-09-22T09:43:33+09:00,神戸新聞NEXT,kobenext,神戸新聞NEXT,313,\n兵庫県警川西署＝川西市丸の内町\n２１日午後、兵庫県川西市の無職女性（６７）が「日本年金機構職員を名乗る男らから電話を受け、現金約９７万円をだまし取られた」と県警川西署に届け出た。同署が詐欺容疑で調べている。\n【写真】チャットGPTなら素人でも裁判書類を作成可能 AI、司法にも\n同署によると、２０日正午ごろ、女性宅に日本年金機構職員を名乗る男から電話があり、「日本年金機構から過払いを還付する」などと告げられ、女性は携帯電話の番号を教えた。\n\n ２１日夕には銀行のサポートセンター職員を名乗る男から携帯に電話があり、女性は指示されるままに金融機関のＡＴＭを操作。相手方が管理する口座に約９７万円を送金したという。,['https://newsatcl-pctr.c.yimg.jp/t/amd-img/20240922-00000005-kobenext-000-3-view.jpg?pri=l&w=640&h=456&exp=10800'],"['https://news.yahoo.co.jp/articles/0bf64860e51475f2cb3808ac9c232b569eccc61b/images/000', 'https://www.kobe-np.co.jp/news/sougou/202305/p1_0016312597.shtml']"
横尾山「馬の背」で姫路の57歳男性滑落、骨折の重傷　ヘリで救助　神戸・須磨（神戸新聞NEXT）,https://news.yahoo.co.jp/articles/4e9c3cd801e0a396f5116dbfad08bd52e925ebed,https://newsatcl-pctr.c.yimg.jp/t/amd-img/20240922-00000004-kobenext-000-7-view.jpg?exp=10800,2024-09-22T09:09:18+09:00,2024-09-22T09:51:02+09:00,神戸新聞NEXT,kobenext,神戸新聞NEXT,236,\n兵庫県警須磨署＝神戸市須磨区大池町５\n２１日午後０時過ぎ、神戸市須磨区横尾４の横尾山で、登山客の女性から、けが人がいるとの１１９番があった。別の登山客の男性（５７）＝姫路市＝がヘリコプターで救助されたが、左腕骨折の重傷という。\n【写真】登山者迎え１００年、月見茶屋が閉店 切り盛りの夫婦、高齢で決意 神戸・高取山\n兵庫県警須磨署によると、男性は切り立った岩場が連なる尾根「馬の背」付近で約５メートル滑落したとみられる。自力で尾根に戻り、女性に助けを求めたという。,['https://newsatcl-pctr.c.yimg.jp/t/amd-img/20240922-00000004-kobenext-000-7-view.jpg?pri=l&w=489&h=640&exp=10800'],"['https://news.yahoo.co.jp/articles/4e9c3cd801e0a396f5116dbfad08bd52e925ebed/images/000', 'https://www.kobe-np.co.jp/news/kobe/202311/0017008248.shtml?p=0']"
自転車で横断歩道通行中の7歳男児、車にひき逃げ被害　姫路の国道2号交差点（神戸新聞NEXT）,https://news.yahoo.co.jp/articles/66834a41e94110b3f3530e62d71d388ee377d7da,https://newsatcl-pctr.c.yimg.jp/t/amd-img/20240922-00000002-kobenext-000-3-view.jpg?exp=10800,2024-09-22T09:08:44+09:00,2024-09-22T09:22:49+09:00,神戸新聞NEXT,kobenext,神戸新聞NEXT,186,\n兵庫県警姫路署＝姫路市市之郷\n２１日午後９時半ごろ、姫路市坂田町の国道２号交差点で、自転車に乗っていた男児（７）が車とぶつかり、軽傷を負った。車はそのまま走り去り、兵庫県警姫路署はひき逃げ容疑で調べている。\n【写真】3分間で6件、次々と追突 尼崎の死亡ひき逃げ\n同署によると、男児は父親とともに自転車で横断歩道を渡っていたところ、左折してきた車と衝突したという。,['https://newsatcl-pctr.c.yimg.jp/t/amd-img/20240922-00000002-kobenext-000-3-view.jpg?pri=l&w=640&h=426&exp=10800'],"['https://news.yahoo.co.jp/articles/66834a41e94110b3f3530e62d71d388ee377d7da/images/000', 'https://www.kobe-np.co.jp/news/backnumber2/202309/0016852972.shtml?p=0']"
SNSで知り合った男が勧誘、3300万円「投資」　西宮の63歳女性、ロマンス詐欺被害（神戸新聞NEXT）,https://news.yahoo.co.jp/articles/ea78eda529192b0039bece33eee837811ad974c6,https://newsatcl-pctr.c.yimg.jp/t/amd-img/20240922-00000003-kobenext-000-3-view.jpg?exp=10800,2024-09-22T09:08:44+09:00,2024-09-22T09:25:52+09:00,神戸新聞NEXT,kobenext,神戸新聞NEXT,455,\n兵庫県警西宮署＝西宮市津田町\n２１日午後７時ごろ、西宮市の自営業の女性（６３）が「詐欺に遭った」と兵庫県警西宮署に届け出た。女性は交流サイト（ＳＮＳ）で知り合い、好意を持った男に勧められ、投資名目で計３３２０万円を振り込んだといい、同署は恋愛感情を利用して金をだまし取るロマンス詐欺の手口とみて調べている。\n【写真】ＢＴＳメンバー名乗り「日本に行くよ」\n同署によると、女性は６月下旬、インスタグラムで男と知り合い、ＬＩＮＥ（ライン）でやりとりするようになった。男から「将来は一緒になろう」とメッセージを受け、好意を抱くようになった。同時に投資も勧められ、男の紹介で投資用アプリをダウンロードしたという。\n\n 女性は７月４日～８月２８日にかけて計７回、インターネットバンキングで計３３２０万円を入金。アプリ上では約４０００万円の運用益が出ていると表示されていたという。女性が９月上旬、運用益を出金しようとしたところ、投資アプリ側から「追加料金が必要」と連絡があり、不審に思い、被害に気付いたという。,['https://newsatcl-pctr.c.yimg.jp/t/amd-img/20240922-00000003-kobenext-000-3-view.jpg?pri=l&w=640&h=419&exp=10800'],"['https://news.yahoo.co.jp/articles/ea78eda529192b0039bece33eee837811ad974c6/images/000', 'https://www.kobe-np.co.jp/news/backnumber2/202212/p1_0015868995.shtml']"
