headline,mainEntityOfPage,image,datePublished,dateModified,author,media_en,media_jp,str_count,body,images,external_links
長岡市長選挙は現職と新人の一騎打ち！10月6日投票　新潟県（選挙ドットコム）,https://news.yahoo.co.jp/articles/a5153330407fdd692dbdf669bfd1fbecd1c9aa7a,https://newsatcl-pctr.c.yimg.jp/t/amd-img/20241003-00010005-senkyocom-000-1-view.jpg?exp=10800,2024-10-03T12:51:31+09:00,2024-10-03T12:51:31+09:00,選挙ドットコム,senkyocom,選挙ドットコム,489,\n長岡市長選挙は現職と新人の一騎打ち！10月6日投票 新潟県\n9月29日に告示された長岡市長選挙には、現職の磯田達伸（いそだ・たつのぶ）氏（73）、新人の高橋宏幸（たかはし・ひろゆき）氏（55）の無所属2名が立候補しました。投開票は10月6日に行われます。\n\n今回は磯田市政の是非、人口減少対策、地域経済の活性化策などが争点と考えられます。\n長岡の明るい未来への礎を全力でつくります 磯田氏\n長岡市長選挙 選挙公報\n磯田氏は長岡市出身、明治大学政治経済学部経済学科卒業。長岡市に入庁し、企画部長、都市整備部長、財務部長を歴任しました。長岡市地域政策監、長岡市副市長を務め、2016年の長岡市長選挙で初当選。今回は3期連続当選を目指しての立候補となります。\n所得1.3倍計画！経済のプロが長岡を変えます 高橋氏\n長岡市長選挙 選挙公報\n高橋氏は長岡市生まれ、一橋大学経済学部卒業。財務省、海外の国際会計事務所勤務を経て、税理士法人を設立しました。2020年に長岡市に移住し高橋宏幸税理士事務所を設立、現在は株式会社高橋財務情報サービス代表取締役を務めています。,"['https://newsatcl-pctr.c.yimg.jp/t/amd-img/20241003-00010005-senkyocom-000-1-view.jpg?pri=l&w=640&h=426&exp=10800', 'https://newsatcl-pctr.c.yimg.jp/t/amd-img/20241003-00010005-senkyocom-001-1-view.jpg?pri=l&w=640&h=324&exp=10800', 'https://newsatcl-pctr.c.yimg.jp/t/amd-img/20241003-00010005-senkyocom-002-1-view.jpg?pri=l&w=640&h=323&exp=10800']","['https://news.yahoo.co.jp/articles/a5153330407fdd692dbdf669bfd1fbecd1c9aa7a/images/000', 'https://news.yahoo.co.jp/articles/a5153330407fdd692dbdf669bfd1fbecd1c9aa7a/images/001', 'https://news.yahoo.co.jp/articles/a5153330407fdd692dbdf669bfd1fbecd1c9aa7a/images/002']"
昭島市長選挙は現職と新人の一騎打ち！10月6日投票　東京都（選挙ドットコム）,https://news.yahoo.co.jp/articles/d5b88e260a130a1564f435cb851b7975e86150b0,https://newsatcl-pctr.c.yimg.jp/t/amd-img/20241003-00010003-senkyocom-000-1-view.jpg?exp=10800,2024-10-03T10:24:04+09:00,2024-10-03T10:24:04+09:00,選挙ドットコム,senkyocom,選挙ドットコム,513,\n昭島市長選挙は現職と新人の一騎打ち！10月6日投票 東京都\n9月29日に告示された昭島市長選挙には自民党・公明党・地域政党「都民ファーストの会」が推薦する現職の臼井伸介（うすい・しんすけ）氏（69）、新人の田所良平（たどころ・りょうへい）氏（44）の無所属2名が立候補しました。投開票は10月6日に行われます。\n\n今回は臼井市政の是非、ゴルフ場の跡地に建設が予定されている物流センターの計画、老朽化が進む清掃センター等の公共施設への対応などが争点と考えられます。\n市民や関係者と手を携えながら、心ひとつにまちづくりに取り組みたい 臼井氏\n昭島市長選挙 選挙公報\n臼井氏は昭島市生まれ、成蹊大学経済学部卒業。昭島市職員を経て、昭島市議会議員を6期21年務めました。2016年の昭島市長選挙で初当選、今回は3期目を目指しての立候補となります。\n要望や意見が反映される、市民が主体のまちづくりを 田所氏\n昭島市長選挙 選挙公報\n田所氏は埼玉県生まれ、早稲田大学政治経済学部経済学科卒業。司法試験に合格し、東京都立川市の三多摩法律事務所に弁護士として採用。2023年に昭島市内にたいらか法律事務所を開設しました。,"['https://newsatcl-pctr.c.yimg.jp/t/amd-img/20241003-00010003-senkyocom-000-1-view.jpg?pri=l&w=640&h=426&exp=10800', 'https://newsatcl-pctr.c.yimg.jp/t/amd-img/20241003-00010003-senkyocom-001-1-view.jpg?pri=l&w=640&h=274&exp=10800', 'https://newsatcl-pctr.c.yimg.jp/t/amd-img/20241003-00010003-senkyocom-002-1-view.jpg?pri=l&w=640&h=277&exp=10800']","['https://news.yahoo.co.jp/articles/d5b88e260a130a1564f435cb851b7975e86150b0/images/000', 'https://news.yahoo.co.jp/articles/d5b88e260a130a1564f435cb851b7975e86150b0/images/001', 'https://news.yahoo.co.jp/articles/d5b88e260a130a1564f435cb851b7975e86150b0/images/002']"
多賀城市長選挙は新人と現職の一騎打ち！10月6日投票　宮城県（選挙ドットコム）,https://news.yahoo.co.jp/articles/22fa46e372b069e0e67d6f89d6b28176f78f4937,https://newsatcl-pctr.c.yimg.jp/t/amd-img/20241003-00010006-senkyocom-000-1-view.jpg?exp=10800,2024-10-03T13:21:12+09:00,2024-10-03T13:21:12+09:00,選挙ドットコム,senkyocom,選挙ドットコム,522,\n多賀城市長選挙は新人と現職の一騎打ち！10月6日投票 宮城県\n9月29日に告示された多賀城市長選挙には、共産党が推薦する新人の遠藤秋雄（えんどう・あきお）氏（70）、自民党と公明党が推薦する現職の深谷晃祐（ふかや・こうすけ）氏（44）の無所属2名が立候補しました。投開票は10月6日に行われます。\n\n今回は深谷市政の是非、子育て支援策のあり方、スマートフォンをもつ高齢者に市民バスの運賃を無料にする支援策の是非などが争点と考えられます。\nもっと生かす声がある！市の積立金を市民の暮らしに役立てます 遠藤氏\n多賀城市長選挙 選挙公報\n遠藤氏は宮城県仙台第一高等学校通信制卒業。製鉄所勤務、全国労働組合総連合（東京）専従役員などを経て、2019年から多賀城市議会議員を1期務めました。\n他に真似できない、沢山の宝がある多賀城をさらに磨き輝かせたい 深谷氏\n多賀城市長選挙 選挙公報\n深谷氏は多賀城市出身、専門学校東京ミュージックアンドメディアアーツ尚美卒業。2007年から多賀城市議会議員を2期、2015年から宮城県議会議員を2期務めました。2020年の多賀城市長選挙で初当選、今回は2期連続当選を目指しての立候補となります。,"['https://newsatcl-pctr.c.yimg.jp/t/amd-img/20241003-00010006-senkyocom-000-1-view.jpg?pri=l&w=640&h=426&exp=10800', 'https://newsatcl-pctr.c.yimg.jp/t/amd-img/20241003-00010006-senkyocom-001-1-view.jpg?pri=l&w=640&h=393&exp=10800', 'https://newsatcl-pctr.c.yimg.jp/t/amd-img/20241003-00010006-senkyocom-002-1-view.jpg?pri=l&w=640&h=391&exp=10800']","['https://news.yahoo.co.jp/articles/22fa46e372b069e0e67d6f89d6b28176f78f4937/images/000', 'https://news.yahoo.co.jp/articles/22fa46e372b069e0e67d6f89d6b28176f78f4937/images/001', 'https://news.yahoo.co.jp/articles/22fa46e372b069e0e67d6f89d6b28176f78f4937/images/002']"
岡崎市長選挙は現職・元職・新人2名の争い！10月6日投票　愛知県（選挙ドットコム）,https://news.yahoo.co.jp/articles/d477dd471dc2418292f13b45ea74ae1f5d3b0f4d,https://newsatcl-pctr.c.yimg.jp/t/amd-img/20241003-00010001-senkyocom-000-1-view.jpg?exp=10800,2024-10-03T09:42:31+09:00,2024-10-03T09:42:31+09:00,選挙ドットコム,senkyocom,選挙ドットコム,861,\n岡崎市長選挙は現職・元職・新人2名の争い！10月6日投票 愛知県\n9月29日に告示された岡崎市長選挙には、現職の中根康浩（なかね・やすひろ）氏（62）、自民党と公明党が推薦する元職の内田康宏（うちだ・やすひろ）氏（71）、新人の昼田浩一郎（ひるた・こういちろう）氏（36）、新人のアーニー（本名：冨田靖成＝とみた・やすなり）氏（51）の無所属4名が立候補しました。投開票は10月6日に行われます。\n\n今回は中根市政の是非、子育て支援の充実、中心市街地の活性化などが争点と考えられます。\n市民派市長と市民参加で、どんどん好循環 中根氏\n岡崎市長選挙 選挙公報\n中根氏は愛知県出身、早稲田大学商学部卒業。衆議院議員・戸塚進也氏秘書を経て、1988年から岡崎市議会議員を務めました。行政書士、学校法人ときわ学園理事長を経て、2003年から衆議院議員を通算4期務め、2020年の岡崎市長選挙で初当選、今回は2期連続当選を目指しての立候補となります。\n岡崎再生！止まった時計を動かそう！ 内田氏\n岡崎市長選挙 選挙公報\n内田氏は愛知県岡崎市出身、日本大学法学部政治経済学科卒業。アメリカ留学、衆議院議員・安倍晋太郎氏秘書を経て、1987年から2012年まで愛知県議会議員を7期連続で務めました。2012年の岡崎市長選挙で初当選、2016年に再選。今回は返り咲きの3期目を目指しての立候補となります。\n日本全国のモデルになるまち、岡崎市を 昼田氏\n岡崎市長選挙 選挙公報\n昼田氏は三重県志摩市出身、青山学院大学卒業。3D CADエンジニア、岡崎市役所勤務を経て、現在は株式会社官民連携事業研究所の執行役員CCOを務めています。\n政治じゃ、岡崎変えられない アーニー氏\n岡崎市長選挙 選挙公報\nアーニー氏は岡崎市生まれ、田中千代服飾専門学校卒業。株式会社ミリオネアを創設し代表取締役に就任、さらにミリオネアDJスクールを開校。現在は名古屋市と岡崎市で音楽スクールの社長とクラブDJとして活動しています。,"['https://newsatcl-pctr.c.yimg.jp/t/amd-img/20241003-00010001-senkyocom-000-1-view.jpg?pri=l&w=640&h=426&exp=10800', 'https://newsatcl-pctr.c.yimg.jp/t/amd-img/20241003-00010001-senkyocom-001-1-view.jpg?pri=l&w=640&h=402&exp=10800', 'https://newsatcl-pctr.c.yimg.jp/t/amd-img/20241003-00010001-senkyocom-002-1-view.jpg?pri=l&w=640&h=403&exp=10800', 'https://newsatcl-pctr.c.yimg.jp/t/amd-img/20241003-00010001-senkyocom-003-1-view.jpg?pri=l&w=640&h=403&exp=10800', 'https://newsatcl-pctr.c.yimg.jp/t/amd-img/20241003-00010001-senkyocom-004-1-view.jpg?pri=l&w=640&h=402&exp=10800']","['https://news.yahoo.co.jp/articles/d477dd471dc2418292f13b45ea74ae1f5d3b0f4d/images/000', 'https://news.yahoo.co.jp/articles/d477dd471dc2418292f13b45ea74ae1f5d3b0f4d/images/001', 'https://news.yahoo.co.jp/articles/d477dd471dc2418292f13b45ea74ae1f5d3b0f4d/images/002', 'https://news.yahoo.co.jp/articles/d477dd471dc2418292f13b45ea74ae1f5d3b0f4d/images/003', 'https://news.yahoo.co.jp/articles/d477dd471dc2418292f13b45ea74ae1f5d3b0f4d/images/004']"
羽咋市長選挙は新人と現職の一騎打ち！10月6日投票　石川県（選挙ドットコム）,https://news.yahoo.co.jp/articles/17ff1f646c71b2271b7a80f3ebfb20c6af8ecc41,https://newsatcl-pctr.c.yimg.jp/t/amd-img/20241003-00010000-senkyocom-000-1-view.jpg?exp=10800,2024-10-03T09:10:40+09:00,2024-10-03T09:10:40+09:00,選挙ドットコム,senkyocom,選挙ドットコム,481,\n羽咋市長選挙は新人と現職の一騎打ち！10月6日投票 石川県\n9月29日に告示された羽咋市長選挙には、新人の本吉典子（もとよし・のりこ）氏（42）、現職の岸博一（きし・ひろいち）氏（69）の無所属2名が立候補しました。投開票は10月6日に行われます。\n\n今回は岸市政の是非、地震の被害からの復旧・復興、少子高齢化・人口減少対策などが争点と考えられます。\n目指すは市民が真ん中の政治で、子や孫世代と幸せに暮らせるまち 本吉氏\n羽咋市長選挙 選挙公報\n本吉氏は大阪市住之江区生まれ、石川県立羽咋高等学校卒業。海上自衛隊勤務、会社勤務を経て、2021年の羽咋市議会議員選挙で初当選しました。\n復興と未来づくりで、輝くはくい2.0 岸氏\n羽咋市長選挙 選挙公報\n岸氏は羽咋市生まれ、明治大学法学部卒業。羽咋市に入庁し、羽咋市企画財政課長、羽咋市教育次長、羽咋郡市広域圏事務組合事務局長、羽咋郡市建設資材協同組合事務局長を歴任しました。2017年から羽咋市議会議員を1期務め、2020年の羽咋市長選挙で初当選、今回は2期目を目指しての立候補となります。,"['https://newsatcl-pctr.c.yimg.jp/t/amd-img/20241003-00010000-senkyocom-000-1-view.jpg?pri=l&w=640&h=426&exp=10800', 'https://newsatcl-pctr.c.yimg.jp/t/amd-img/20241003-00010000-senkyocom-001-1-view.jpg?pri=l&w=640&h=446&exp=10800', 'https://newsatcl-pctr.c.yimg.jp/t/amd-img/20241003-00010000-senkyocom-002-1-view.jpg?pri=l&w=640&h=446&exp=10800']","['https://news.yahoo.co.jp/articles/17ff1f646c71b2271b7a80f3ebfb20c6af8ecc41/images/000', 'https://news.yahoo.co.jp/articles/17ff1f646c71b2271b7a80f3ebfb20c6af8ecc41/images/001', 'https://news.yahoo.co.jp/articles/17ff1f646c71b2271b7a80f3ebfb20c6af8ecc41/images/002']"
【記者解説】石破人事の思惑とは？（「借金」返済人事！？）（選挙ドットコム）,https://news.yahoo.co.jp/articles/d1087fef39f162fd9e383cf101908adc8c00f655,https://newsatcl-pctr.c.yimg.jp/t/amd-img/20241003-00010004-senkyocom-000-1-view.jpg?exp=10800,2024-10-03T11:17:09+09:00,2024-10-03T11:17:09+09:00,選挙ドットコム,senkyocom,選挙ドットコム,3371,\n【記者解説】石破人事の思惑とは？（「借金」返済人事！？）\nYouTube「選挙ドットコムちゃんねる」では、毎週選挙や政治に関連する情報を発信中です。\n\n2024年10月2日に公開された動画のテーマは「自民党総裁選総括 記者の目に映ったものとは」\n\n9月27日に投開票が行われた自民党総裁選の結果の振り返りや人事の動向について、現役政治記者である産経新聞デジタル報道部政治担当デスクの水内茂幸氏と朝日新聞・前政治部長の林尚行氏のお二方に伺いました。\n\n歴代最多の9人が争った総裁選。石破新総理の人事の裏側にあるドラマをお楽しみください！\n\n【このトピックのポイント】\n・高市氏の優勢から石破氏の逆転勝利、その裏側の力学とは？\n・派閥はなくとも「借金返済の人事」\n・「疑似政権交代」で国民の支持を集められるか\n総裁選のドラマを作ったのはあの2人\n総裁選のドラマを作ったのはあの2人\n今回の自民党総裁選では、1回目の投票で過半数を取る候補者がいませんでした。石破茂氏と高市早苗氏による決選投票の末、石破茂氏が第28代総裁に選出されました。\n\n水内茂幸氏は、初回の国会議員投票で72票を集めた高市氏に注目します。\n\nもともと、高市氏の票は40票程度とみられていました。投票日の前日に高市氏支持の動きを見せた麻生太郎氏の票が乗ったと思われます。\n\n\n水内茂幸氏「明らかに想像より違うという姿を見せ、高市さんになるぞという、決選投票に向けての締め付け的意味もあったと思いますが、それがふたを開けてみると違う感じになるのが面白いですよね」\n投票日ギリギリまで続いたキングメーカー同士の攻防\n決選投票での主役は、前総理大臣の岸田文雄氏。\n\n水内氏「岸田さんは、『Anything But 高市』だったわけですよ。高市さんだけはダメだと。（麻生氏から高市氏に乗ることにしたと）電話をもらって、岸田さんも火が付いたんじゃないかと思うんですよね」\n\n高市氏は岸田内閣の閣僚でしたが、防衛増税の時に異論を述べるなど、政権運営で折り合いが悪かったと水内氏は分析します。かねてからの関係性に加え、麻生氏が推したこともあり、岸田氏の気が引き締まったのではないかと推察します。\n\n本命候補とされていた小泉進次郎氏は、決選投票に残れませんでした。\n\n林氏は、終盤失速した小泉陣営が、議員票を上積みすることで逆転し、「2位までに入れば総裁だ」という戦略を立てたと説明します。\n\n林尚行氏「でも、党員票の勢いが予想以上に強く、無理だと判断した小泉陣営が『高市じゃない、石破に乗れ』と。進次郎さんで固めた票を、いかにこぼれない形にして2回目に石破氏に投票するかというシナリオがうまくいったのだろう」\n\nまた、「麻生さんの30票は今回の総裁選の大きなドラマでした」と語る林氏は、「麻生さんはずっと悩んでいたんですよね。石破と小泉の決選投票だけは嫌だというところから始まっていた」と解説します。\n「麻生氏の誤算」とは？\nここで、「麻生氏には誤算があった」と林氏は説明します。\n\n1回目の投票は「計算通り、会心の出来だった」とみえる麻生氏の、決選投票での誤算とは。\n\nひとつは岸田派の温度感。麻生氏が、岸田派との三頭政治を復活させ、高市氏を祭り上げようとした戦略が、岸田氏に振られた形になりました。\n\n林氏「これには伏線があって。麻生さんは『岸田は俺と一緒にやってくれる』という思いがありましたが、岸田さんの麻生さんを見る目が冷たくなっていたところを見誤った」\n\nもうひとつは参議院議員の高市氏支持が伸びなかったことです。ここには、高市氏の靖国問題があります。\n\n首相になった場合も靖国神社への参拝を続ける意向を示した高市氏ですが、岸田政権では日韓関係を改善し、そのことをアメリカも歓迎するムードが高まっていました。\n\n林氏「俺が作ってきた日韓関係を壊すのかという思いが、高市離れを起こした」\n\n加えて、外交をしっかりやらなければという思いが自民党内にもあり、決選投票で麻生氏の思惑が外れたのではないかと推測します。\n\n高市陣営の取材によると、靖国神社の話は選挙戦の途中からトーンを落としていたようですが、とくに来年選挙を控える参議院議員の不安を招いたという可能性も指摘されます。\n「借金返済の人事」の一方、麻生・高市外しの断絶も\n「借金返済の人事」の一方、麻生・高市外しの断絶も\n10月1日には、石破内閣の顔ぶれが発表されました（収録日の9月30日時点で内定）。\n\nこの中で林氏が最も注目するのが、村上誠一郎総務大臣です。\n\n村上氏は今まで反安倍のスタンスを鮮明に示し続けてきました。同時に、言葉が強いところがあり、物議を醸してきた。安倍チルドレンから見ると許しがたい敵である村上氏を総務大臣に起用するという話で、永田町には「村上ショック」という衝撃が流れたのだそうです。\n\nとはいえ、全体を見ると「石破氏の政権基盤の弱さ、いろんな人に借りを返す人事になっている、借金返済の人事」と林氏は指摘します。\n\n林氏「刷新感を出すなら若手や女性が基軸になるべきところ、予想される顔ぶれ（※編集部注：収録日時点）の裏側には、今回石破氏を押し上げた人たちの影がよく見える形になってしまった」\n\n水内氏は、総裁選で敗れた高市氏系が入らなかったことに着目しながら、\n\n「（麻生派など）旧派閥の意向は飲んだのかな」とコメントします。\n\nとはいえ、一人ひとりを見ていくと、石破氏の強い思いが垣間見えるところもあります。\n\n林氏「外務・防衛に防衛系の2人を置きましたよね。すぐじゃないですけれど、日米地位協定の見直しに向けた第一歩を進めるのはあるのかな」\n\n水内氏「防衛族の中で石破氏に近い2人を据えることで、多少摩擦が起きてもガンガンやっていきたいという体制を敷いたのかな」\n\n水内氏は、平将明氏（デジタル大臣）にも「自民党の中でも逸材と言われていて、デジタル分野に精通しているし、理にかなったことをやる」と期待を寄せます。\n自民党のお家芸、「美しい」疑似政権交代で国民の評価を\n主流派と非主流派の分断が色濃く表れた人事が、今後の政権運営に与える影響は？\n全体的に、主流派と非主流派の分断が非常に色濃く表れた人事。今後の政権運営で、党内にどんなリスクとして残るのか注目されます。\n\n林氏は、1回目は石破氏を上回り、決選投票でも石破氏と肩を並べるほどの議員票を集めた高市氏陣営を敵に回すような政権運営ができるのか、と疑問を投げかけます。\n自民党のお家芸、「美しい」疑似政権交代で国民の評価を\n林氏「そうはいっても、プラス面でいうと、これほどまでに『美しい』疑似政権交代は久しぶり」\n\n55年体制以降、党内で疑似政権交代をすることで、雰囲気をガラッと変え、国民に与党であり続けられることを訴えかけてきた自民党の「お家芸」だとゲストの両名は頷きます。\n\n象徴的なのが副総裁人事。麻生太郎氏から菅義偉氏に変わったことを「主流派中の主流派から非主流派中の非主流派に、同じポストが変わる」と示します。\n\nまた、水内氏は2012年の総裁選の際、逆転負けした石破氏に幹事長のポストが与えられた経緯を引き合いに、今回、高市氏が幹事長でなく総務会長を提示されたことで、高市氏周辺に反発があったと指摘します。\n\nとはいえ、支持率が2割くらいに落ちた自民党にとっては、ガラッと変わった印象を与えるのは、自民党に信頼を集める点で「国民の気持ちにコミットするような政権ができたのではないか」と評価します。\n\n水内氏「選挙向けではガラッと変わったイメージで、次につながるかもしれない」\n\n最後に、総裁候補の処遇は。\n\n林氏は「今回、ポスト岸田の総裁候補は多過ぎでした」とあっさりと総括します。\n\n林氏「いろいろな貸し借りの借りを返さなければならないのに、（自分以外の）8人全員を入れるのはそもそも無理な話だったんだと思うんですよね」,"['https://newsatcl-pctr.c.yimg.jp/t/amd-img/20241003-00010004-senkyocom-000-1-view.jpg?pri=l&w=640&h=360&exp=10800', 'https://newsatcl-pctr.c.yimg.jp/t/amd-img/20241003-00010004-senkyocom-001-1-view.jpg?pri=l&w=640&h=360&exp=10800', 'https://newsatcl-pctr.c.yimg.jp/t/amd-img/20241003-00010004-senkyocom-002-1-view.jpg?pri=l&w=640&h=360&exp=10800', 'https://newsatcl-pctr.c.yimg.jp/t/amd-img/20241003-00010004-senkyocom-003-1-view.jpg?pri=l&w=640&h=360&exp=10800', 'https://newsatcl-pctr.c.yimg.jp/t/amd-img/20241003-00010004-senkyocom-004-1-view.jpg?pri=l&w=640&h=360&exp=10800', 'https://newsatcl-pctr.c.yimg.jp/t/amd-img/20241003-00010004-senkyocom-005-1-view.jpg?pri=l&w=640&h=360&exp=10800', 'https://newsatcl-pctr.c.yimg.jp/t/amd-img/20241003-00010004-senkyocom-006-1-view.jpg?pri=l&w=640&h=360&exp=10800']","['https://news.yahoo.co.jp/articles/d1087fef39f162fd9e383cf101908adc8c00f655/images/000', 'https://news.yahoo.co.jp/articles/d1087fef39f162fd9e383cf101908adc8c00f655/images/001', 'https://news.yahoo.co.jp/articles/d1087fef39f162fd9e383cf101908adc8c00f655/images/002', 'https://news.yahoo.co.jp/articles/d1087fef39f162fd9e383cf101908adc8c00f655/images/003', 'https://news.yahoo.co.jp/articles/d1087fef39f162fd9e383cf101908adc8c00f655/images/004', 'https://news.yahoo.co.jp/articles/d1087fef39f162fd9e383cf101908adc8c00f655/images/005', 'https://news.yahoo.co.jp/articles/d1087fef39f162fd9e383cf101908adc8c00f655/images/006']"
