headline,mainEntityOfPage,image,datePublished,dateModified,author,media_en,media_jp,str_count,body,images,external_links
より良い番組作りで意見交換（福島）（KFB福島放送）,https://news.yahoo.co.jp/articles/af905bf338cb4f7996361a1dc7e12cc462e63b6b,https://newsatcl-pctr.c.yimg.jp/t/amd-img/20250423-00002449-kfb-000-1-thumb.jpg?exp=10800,2025-04-23T19:28:56+09:00,2025-04-23T19:28:56+09:00,KFB福島放送,kfb,KFB福島放送,248,"福島放送
福島放送の番組審議会が開かれ、課題番組の「シェア！」について意見が交わされました。
今回の課題番組は、４月１１日に放送された「シェア！」で、委員からは「知らない桜スポットを中継で紹介してくれたのは良かった」や「新しい気象予報士の雰囲気が良い」などの意見がありました。
一方、「黄色と白のテロップだと見えにくい」や「県民のアンケートをもっと増やしてほしい」、「屋外からの天気予報は暗くて分かりにくい」などの指摘もありました。
福島放送は、こうした意見を今後の番組づくりに生かしていきます。",[],[]
県内企業の若手社員が交流会（福島）（KFB福島放送）,https://news.yahoo.co.jp/articles/7503e58d613b6c5e4fa0de1b89eb85e805f5c792,https://newsatcl-pctr.c.yimg.jp/t/amd-img/20250423-00002448-kfb-000-1-thumb.jpg?exp=10800,2025-04-23T19:28:56+09:00,2025-04-23T19:28:56+09:00,KFB福島放送,kfb,KFB福島放送,254,"福島放送
福島市にある企業の若手社員たちに、業種を超えた交流で視野を広げてもらい、互いの強みをかけ合わせて市の活性化につなげようという交流会が開かれました。
２３日は主催するＮＴＴ東日本や、東邦銀行など８社から２７人が参加し、「県の人口減少対策」をテーマに議論しました。
参加者は「地域活性化を考える上で、非常に貴重な場だなと思っています。」「若者がもっと福島市に集まりたいと思えるような街づくりをしていきたいと思っています。」などと話していました。
異業種交流会は、今後も３カ月に１回のペースで開かれます。",[],[]
ロマンス詐欺事件に関与の女に実刑判決（福島）（KFB福島放送）,https://news.yahoo.co.jp/articles/a0e896332d1ad0062af65263cbe90eeb7905c945,https://newsatcl-pctr.c.yimg.jp/t/amd-img/20250423-00002447-kfb-000-1-thumb.jpg?exp=10800,2025-04-23T19:28:56+09:00,2025-04-23T19:28:56+09:00,KFB福島放送,kfb,KFB福島放送,245,"福島放送
ロマンス詐欺事件に関わったとされる女に、懲役２年２カ月の実刑と罰金の判決が言い渡されました。
判決によりますと、クロセ・アーリンダ・ベルガラ被告（６８）は、入金された金が詐欺事件などで得られたものと知りながら、他人の口座に現金を振り込み、一部を報酬として受け取った罪などに問われています。
福島地裁は判決で「組織的で巧妙かつ悪質、被告は必要不可欠な実行行為をしている。刑事責任は重く、反省の態度も認められない」などとして、クロセ被告に懲役２年２カ月、罰金６０万円を言い渡しました。",[],[]
「はじめまして」の人たちと地域をつなぐ（福島）（KFB福島放送）,https://news.yahoo.co.jp/articles/057c2db39a0066dcf9fdedd4b31bb1f93ba960cd,https://newsatcl-pctr.c.yimg.jp/t/amd-img/20250423-00002446-kfb-000-1-thumb.jpg?exp=10800,2025-04-23T19:28:56+09:00,2025-04-23T19:28:56+09:00,KFB福島放送,kfb,KFB福島放送,153,"福島放送
４月から新生活を始めたという方も少なくないかと思います。
二本松市で開かれている「はじめまして」の人たちと地域をつなぐ取り組みを取材しました。
二本松市で定期的に開かれている、「にほんまつハジメテ会」。
市の移住・定住促進事業の一環として、３年前に始まりました。

※詳しくは動画をご覧ください。",[],[]
リカちゃんキャッスルのいちご農園が開園（福島）（KFB福島放送）,https://news.yahoo.co.jp/articles/4e5c8b025c355612122ba552184b160ee9dd04de,https://newsatcl-pctr.c.yimg.jp/t/amd-img/20250423-00002445-kfb-000-1-thumb.jpg?exp=10800,2025-04-23T19:05:13+09:00,2025-04-23T19:05:13+09:00,KFB福島放送,kfb,KFB福島放送,99,"福島放送
このゴールデンウィークに合わせて、新たな施設がオープンするのが、小野町にあるリカちゃんキャッスル。
田村市の農園と連携して手掛けるのは、イチゴの栽培です。

※詳しくは動画をご覧ください。",[],[]
間もなくＧＷ　過ごし方や予算は？（福島）（KFB福島放送）,https://news.yahoo.co.jp/articles/e1000cb7cfea67ef65f4f3ec1d9642bbe1770b4e,https://newsatcl-pctr.c.yimg.jp/t/amd-img/20250423-00002444-kfb-000-1-thumb.jpg?exp=10800,2025-04-23T19:05:13+09:00,2025-04-23T19:05:13+09:00,KFB福島放送,kfb,KFB福島放送,61,"福島放送
今年のゴールデンウィーク、どんな過ごし方をするのか。
街の人に聞いてみました。

※詳しくは動画をご覧ください。",[],[]
ガソリン価格　１・６円値下がり（福島）（KFB福島放送）,https://news.yahoo.co.jp/articles/1243fadb06dad949c3dd6234e74fbe75416be277,https://newsatcl-pctr.c.yimg.jp/t/amd-img/20250423-00002443-kfb-000-1-thumb.jpg?exp=10800,2025-04-23T19:05:13+09:00,2025-04-23T19:05:13+09:00,KFB福島放送,kfb,KFB福島放送,330,"福島放送
今週の県内のレギュラーガソリンの平均価格は、過去３番目の高値だった先週から１・６円値下がりしました。
石油情報センターによりますと、今週の県内のレギュラーガソリンの平均価格は、１?当たり１８５・８円でした。
現在の方法で発表を始めた２００４年以降では、３番目に高かった先週から１・６円下がっていて、アメリカの追加関税発動などの影響で、原油価格が急落したことなどが要因と見られています。
それでも２０２５年に入ってからは、一度も１８０円を下回っておらず、高止まりが続いています。
石油情報センターは「まだ値下がりする余地はある」としたうえで、ゴールデンウィークの間は例年価格が変動しづらく、今後しばらくは１８５円前後で推移するとの見通しを示しています。",[],[]
県職員が飲酒運転で事故（福島）（KFB福島放送）,https://news.yahoo.co.jp/articles/a3ed7fa9b742628e32459ef6597e0289dbc778f1,https://newsatcl-pctr.c.yimg.jp/t/amd-img/20250423-00002442-kfb-000-1-thumb.jpg?exp=10800,2025-04-23T19:05:13+09:00,2025-04-23T19:05:13+09:00,KFB福島放送,kfb,KFB福島放送,566,"福島放送
またしても起きた県職員の不祥事。
それも今、県を挙げて撲滅しようと取り組んでいるはずの飲酒運転。
いわき農林事務所の２０代の女性職員が、記憶にないほどの酒を飲み、事故を起こしていました。
県によりますと、いわき農林事務所の２６歳の女性主事は、４月４日の午後７時半ごろから翌５日の午前４時ごろまで、いわき市小名浜の飲食店で酒を飲んだ後、自家用車を運転し、店のすぐそばで電柱にぶつかる事故を起こしました。
女性主事は、タクシーで一度帰宅して休んだ後、再びタクシーで店に戻り、自分の車が壊れているのを発見して、当て逃げされたと勘違いし、自ら警察に通報。
警察官は現場の状況から自分で運転したとみて、呼気を検査したものの、時間が経っておりアルコールは検出されず、任意で捜査が続けられていました。
県は６日になって女性主事から報告を受けて事故を把握しましたが、本人の記憶が曖昧だったため、県が店や本人への聞き取りなどを重ねて、飲酒運転で物損事故を起こしたと判断したということです。
県の聞き取りに対し、女性主事は一人で飲みに行き、他の客などと意気投合して、テキーラやハイボールなど、合わせて２０杯以上を飲んだと話しているということです。
県は２４日、農林水産部の出先機関の会議を開き、不祥事の再発防止などを指示することにしています。",[],[]
山形新幹線は午後８時前に運転再開（福島）（KFB福島放送）,https://news.yahoo.co.jp/articles/e0a5ca7924e07b649ce6b2ea230d262b1e958d86,https://newsatcl-pctr.c.yimg.jp/t/amd-img/20250423-00002441-kfb-000-3-view.jpg?exp=10800,2025-04-23T18:24:37+09:00,2025-04-23T20:55:35+09:00,KFB福島放送,kfb,KFB福島放送,84,"（写真：KFB）
運転を見合わせていた山形新幹線は、午後７時５５分に運転を再開しました。

ＪＲ東日本によりますと、福島～山形間では、上下合わせて１４本が運休しました。",[],[]
ゴム工場で水素の生成装置をお披露目（福島）（KFB福島放送）,https://news.yahoo.co.jp/articles/0bbaf8c14708a5dc490556860d62f94e0d77bb8e,https://newsatcl-pctr.c.yimg.jp/t/amd-img/20250423-00002440-kfb-000-1-thumb.jpg?exp=10800,2025-04-23T16:38:03+09:00,2025-04-23T16:38:03+09:00,KFB福島放送,kfb,KFB福島放送,115,"福島放送
県内のＳＤＧｓに関する話題をお伝えします。
１７の目標のうち、１３番の「気候変動に具体的な対策を」に関して、燃料となる水素を自前で作り始めた白河市のタイヤ製造工場の取り組みを紹介します。

※詳しくは動画をご覧ください。",[],[]
同居する女の子にケガさせた疑い　男を逮捕（福島）（KFB福島放送）,https://news.yahoo.co.jp/articles/942b5fe5cdd2aa84689cf2b3f52081ae024437c8,https://newsatcl-pctr.c.yimg.jp/t/amd-img/20250423-00002439-kfb-000-1-thumb.jpg?exp=10800,2025-04-23T16:38:03+09:00,2025-04-23T16:38:03+09:00,KFB福島放送,kfb,KFB福島放送,281,"福島放送
同居する女の子に暴行して、けがをさせた疑いで、郡山市の男が逮捕されました。
郡山市の派遣社員・川名綾真容疑者（３２）は、４月上旬から２２日にかけ、同居する６歳未満の女の子に自宅で叩くなどの暴行を加え、全治２週間以上のけがをさせた疑いがもたれています。
警察によりますと、２２日夕方、児童相談所から「虐待児童を保護している」と通報がありました。
警察の調べに対し、川名容疑者は「素手や風呂おけで叩いた」などと話し、容疑を認めているということです。
女の子は顔や両足などに複数のあざがあり、警察は日常的に暴力を振るわれていた可能性も視野に捜査する方針です。",[],[]
２回目のデブリ試験的取り出しが完了（福島）（KFB福島放送）,https://news.yahoo.co.jp/articles/254e350bf314b31ab18284e4bacb1770e90c1440,https://newsatcl-pctr.c.yimg.jp/t/amd-img/20250423-00002438-kfb-000-1-thumb.jpg?exp=10800,2025-04-23T16:38:03+09:00,2025-04-23T16:38:03+09:00,KFB福島放送,kfb,KFB福島放送,289,"福島放送
福島第一原発の２号機で２回目となる、燃料デブリの試験的取り出しが完了しました。
２回目の取り出しは、４月１５日に始まり、前回よりも格納容器の中心部に近い場所で、７㎜以下とみられる大きさの燃料デブリが採取されました。
東京電力は２３日、デブリが入った箱を外に運ぶための専用のコンテナに入れ、午前１０時１５分ごろ、９日間にわたった取り出し作業が完了したと発表しました。
デブリは、今後発生する水素の量などを確認したうえで、茨城の研究施設に運ばれる予定です。
今回のデブリと前回取り出されたデブリの性質の違いなどの分析結果は、本格的な取り出し方法の検討などに役立てられます。",[],[]
【午後４時１５分現在】山形新幹線 運転見合わせ（福島）（KFB福島放送）,https://news.yahoo.co.jp/articles/ce749c7311ef30e5989b77993b3e86716b11aa03,https://newsatcl-pctr.c.yimg.jp/t/amd-img/20250423-00002437-kfb-000-2-view.jpg?exp=10800,2025-04-23T15:53:05+09:00,2025-04-23T16:51:35+09:00,KFB福島放送,kfb,KFB福島放送,129,"（写真：KFB）
ＪＲ東日本によりますと、山形新幹線は福島駅で、電気を取り込むパンタグラフに異常が発生し、上下線で運転を見合わせています。
これにより東北新幹線にも遅れが出ています。

新たに点検箇所が発見されたため、運転再開の見込みは未定だということです。",[],[]
山形新幹線がパンタグラフに異常で上下線とも運転見合わせ（KFB福島放送）,https://news.yahoo.co.jp/articles/2609a1a128be6c19ab11dee07b64e3979abd4982,https://newsatcl-pctr.c.yimg.jp/t/amd-img/20250423-00002436-kfb-000-1-view.jpg?exp=10800,2025-04-23T15:19:09+09:00,2025-04-23T15:19:09+09:00,KFB福島放送,kfb,KFB福島放送,82,"（写真：KFB）
JR東日本によりますと、福島駅で、山形新幹線のパンタグラフに異常が見つかり、現在、山形新幹線の上下線とも運転を見合わせています。（午後３時１７分）",[],[]
県内の公立小・中学校　ふくしま学力調査始まる（福島）（KFB福島放送）,https://news.yahoo.co.jp/articles/eba8774e498aa3a3ba983724b3ca31a23a6f29af,https://newsatcl-pctr.c.yimg.jp/t/amd-img/20250423-00002435-kfb-000-1-thumb.jpg?exp=10800,2025-04-23T12:45:43+09:00,2025-04-23T12:45:43+09:00,KFB福島放送,kfb,KFB福島放送,248,"福島放送
県内の小・中学生の学力の伸びや生活習慣を、県が独自に調べる「ふくしま学力調査」が始まりました。
この調査は、県内全ての公立校に通う、小学４年から中学２年の合わせて約７万人を対象として、学力の伸びや生活習慣を調べるもので、学校ごとに２３日から５月９日までの間で行われます。
福島市の杉妻小学校では約３００人の児童が国語と算数のテストに加え、学習意欲などを問うアンケートに臨みました。
ふくしま学力調査の結果は、２０２５年１０月に公表される予定で、授業内容や指導方法の改善に役立てられます。",[],[]
飲酒運転死亡事件３か月　黙とう捧げ検問（福島）（KFB福島放送）,https://news.yahoo.co.jp/articles/d6fcb0bf75a53bea4005183b99c00666d5450a0a,https://newsatcl-pctr.c.yimg.jp/t/amd-img/20250423-00002434-kfb-000-1-thumb.jpg?exp=10800,2025-04-23T12:45:43+09:00,2025-04-23T12:45:43+09:00,KFB福島放送,kfb,KFB福島放送,317,"福島放送
２２日は、飲酒運転の根絶に向けた取り組みの強化日に当たり、県内各地で大規模な検問が行われました。
受験生の女性が飲酒運転の車にはねられて死亡した事件から３カ月となった２２日。
郡山駅前では、警察官が黙とうを捧げた後、繁華街周辺で検問を行い運転手の呼気検査などをして飲酒運転をしないよう呼び掛けました。
郡山警察署の米山大吾地域交通官「絶対に飲酒したら運転しないようにしていただきたいと思います。」と述べました。
警察は毎月２２日を飲酒運転の根絶に向けた取り組みの強化日としていて、２２日は福島市などでも大規模な検問が行われました。
県警察本部によりますと、県内では今年、３月末までに飲酒運転による事故で４人が死亡しています。",[],[]
大型トラックが軽乗用車に追突　1人死亡（福島）（KFB福島放送）,https://news.yahoo.co.jp/articles/f57e2770f040d75004c3d322985ada5ceea1f9f2,https://newsatcl-pctr.c.yimg.jp/t/amd-img/20250423-00002433-kfb-000-1-thumb.jpg?exp=10800,2025-04-23T12:45:43+09:00,2025-04-23T12:45:43+09:00,KFB福島放送,kfb,KFB福島放送,276,"福島放送
２３日未明、東北道で大型トラックが軽乗用車に追突する事故があり、一部区間が約４時間にわたり通行止めになりました。
警察によりますと、２３日午前２時半すぎ、東北道下りの郡山ジャンクション付近で、大型トラックが軽乗用車に追突しました。
軽乗用車を運転していた７５歳の男性は、心肺停止の状態で病院に運ばれその後、死亡が確認されていて、警察が病死の可能性も視野に詳しい死因を調べています。
一方、大型トラックの男性運転手にけがはありませんでした。
この事故で東北道下りは、郡山インターと郡山ジャンクションの間で、約４時間にわたり通行止めとなりました。",[],[]
【速報】福島第一原発２号機からの燃料デブリの試験的取り出し２回目が完了（KFB福島放送）,https://news.yahoo.co.jp/articles/f549e47dce691659499f6e5b67cf4e564234f662,https://newsatcl-pctr.c.yimg.jp/t/amd-img/20250423-00002432-kfb-000-2-view.jpg?exp=10800,2025-04-23T11:32:10+09:00,2025-04-23T11:38:02+09:00,KFB福島放送,kfb,KFB福島放送,165,"（写真：KFB）
東京電力は先ほど、福島第一原発２号機からの２回目のデブリ取り出しが、２３日午前１０時１５分に完了したと発表しました。

デブリを入れた運搬用の容器が専用コンテナに収納され、２回目の取り出し作業は完了しました。

デブリは今後、茨城県内の日本原子力研究開発機構（JAEA）の研究所に運ばれ、詳しい分析が行われます。",[],[]
