headline,mainEntityOfPage,image,datePublished,dateModified,author,media_en,media_jp,str_count,body,images,external_links
ＦＩＦＡワールドカップ２０２６　日本代表応援セール　仙台・若林区のスーパー（khb東日本放送）,https://news.yahoo.co.jp/articles/d25b4ac6d12499557626586a455e56cc7f9207ee,https://newsatcl-pctr.c.yimg.jp/t/amd-img/20260623-11753941-khbv-000-1-thumb.jpg?exp=10800,2026-06-23T19:04:57+09:00,2026-06-23T19:04:57+09:00,khb東日本放送,khbv,khb東日本放送,377,khb東日本放送 ＦＩＦＡワールドカップ２０２６で勢いに乗る日本代表を応援しようと、仙台市若林区のスーパーでは特別セールが行われています。 塩月菜々瀬記者「野菜を中心に多くの商品を値下げしている日本代表の応援セールでは、店長いちおしの上田綺世選手の背番号にちなみ新ジャガイモは１００グラム１８円の安さです」 生鮮館むらぬしではこのほか、日本代表ナンバーワンへの期待を込め普段１９８円のダイコンが１並びの１１１円で販売されています。 買い物客「トマトとかも高くてあんまり手を出さなかったんですけど、本当に安くてうれしいです」 大のサッカーファンという村主店長は、セールを通して日本代表の活躍に期待を寄せます。 生鮮館むらぬし村主芳治店長「昔では考えられないような強さなので、本当に最高の景色を見られるかもしれない、見たくて応援してますね」 khb東日本放送,[],[]
寿命を迎える太陽光パネルのガラスを資源に　宮城県で進むプロジェクト（khb東日本放送）,https://news.yahoo.co.jp/articles/f39b6a5842ce606b3006fbbaee51b9b30440a0df,https://newsatcl-pctr.c.yimg.jp/t/amd-img/20260623-11753940-khbv-000-1-thumb.jpg?exp=10800,2026-06-23T19:02:46+09:00,2026-06-23T19:02:46+09:00,khb東日本放送,khbv,khb東日本放送,2082,khb東日本放送 東京電力福島第一原発の事故の後に普及した太陽光発電のパネルが２０３０年以降、寿命を迎えることから大量廃棄の問題が懸念されています。課題を解決する糸口にしようと、使用済みパネルのガラスを再び資源にすることで、新たな価値を生み出すプロジェクトが始まっています。 １２００℃を越える窯の中から溶かしたガラスを取り出し手際よく形を整える。仙台市太白区秋保町の工房でガラス作品を制作する村山耕二さんはこれまで、仙台市を流れる広瀬川や山形県の月山の砂を使った器など、自然の素材を生かしたユニークな作品を生み出してきました。 太陽光パネルが大量に廃棄されるいわゆる２０３０年問題について、村山さんは４０年以上にわたりガラス作品を作り続けてきたからこそ強い関心がありました。 海馬ガラス工房村山耕二代表「ずっとガラスに携わって素材の開発もずっとしてきましたので、ガラスが社会の問題になっていくということは看過できない、何か寂しいなこれをどうにかできないかという思いはずっとありました」 国が原発事故の後、太陽光などで発電した電気を電力会社が一定価格で買い取る制度を導入した結果、太陽光発電はエネルギー全体の約１０％にまで急増しました。しかし、太陽光パネルの寿命は２０年から３０年で、震災後に設置されたものは２０３０年以降役割を終えて大量に廃棄されます。 政府は、廃棄量を最大で年間８０万トンと試算していて、特にパネルの約６割を構成するガラスは処理コストが高く、リサイクルが難しいということです。課題の解決に向け、地域のブランディングを手掛ける企業が核となり３月に太陽光パネルアップサイクルプロジェクトが始まりました。 村山さんのほか、太陽光パネルを設置するハウスメーカーやリサイクル業者など、宮城県の企業が業種を越えてプロジェクトに参加していて、第１弾がＤａｙ ｌｉｇｈｔ Ｇｌａｓｓ プロジェクトです。廃パネルのガラスを太陽光で光る照明器具に生まれ変わらせ、新たな価値を生み出そうという試みです。 この日、村山さんたちはデザイナーを交えて製品のコンセプトや完成イメージについて話し合いました。リーダーの早坂さんは、プロジェクトを通じて廃パネル問題の現実を知ってもらう一方で、その未来を前向きに捉えてほしいと考えています。 プロジェクトリーダー早坂正年さん「電気を生み出した後、どう生まれ変わるのか。それをできる限り美しく、最後は多分泥臭く幅広く。最初はその太陽光パネルが美しくアップサイクルされるイメージを消費者に持っていただきたい」 プロジェクトに参加する仙台市青葉区の宮城衛生環境公社は、４０年以上にわたり廃棄物処理に取り組んできました。強い風圧で直径１ミリほどの小さな鉄球をパネルに当てて、ガラスとシートを分離しています。こうした技術の活用などリサイクルへの取り組みが評価され、２０２４年に国から北日本エリアで初の環境先進企業として認定されました。 宮城衛生環境公社渡邊博康専務「原材料として見えていない太陽光パネルが製品化されると、見ることも触れることもできるという点に魅力を感じて参画をさせてもらいました」 宮城県川崎町の丹野林業建設もプロジェクトに参加しています。２０２４年から処理設備を導入し、廃パネルをリサイクルしています。 工程は、パネルに付いた汚れを拭き取った後、アルミ製のフレームを専用の機械で外します。パネルを砕いてガラスと発電シートを分離し異物をふるいに掛けて、ガラスを純度別に分けていきます。 長年太陽光パネルを設置するための伐採を請け負ってきたからこそ、廃パネルの資源化に貢献したいと考えています。 丹野林業建設丹野浩三さん「２０年近くになると必ず廃棄される。廃棄後はどう処理されるかとなった時にリサイクル機械があるということで、これならいい状態で処理できるとなり機械を導入して今に至っている」 こうして処理したガラスを照明器具として生まれ変わらせるＤａｙ ｌｉｇｈｔ Ｇｌａｓｓ プロジェクトの製品が照明ということは、被災地宮城県ならではの理由がありました。 プロジェクトリーダー早坂正年さん「宮城県からもう１回、太陽光パネルのその後の行き先を考えていこうという時に、キーワードとして防災というのはありました。ＬＥＤで太陽光で光りますから、電気が来ない時でも一時的にしのぐ道具になるということで、防災にも活用できるプロダクトというのは今考えています」 村山さんはガラス作家として、今回の試みをきっかけに廃パネルのガラスが持つ素材としての可能性を多くの人に知ってもらいたいと考えています。 海馬ガラス工房村山耕二代表「ガラスを作るために有効な物がだんだん少なくなっていった場合に、廃パネルのガラスは貴重になってくる。今あるガラスのストックを、原料として再利用できる時が来るのではないか。今から体制を構築していけば貯金のようなものですけども、それができたら何か１つのガラスに対して貢献ができたのかなと考えています」 khb東日本放送,[],[]
楽天イーグルス　劇的サヨナラ勝ちで連敗ストップ　吉井監督が就任初勝利　２２日（khb東日本放送）,https://news.yahoo.co.jp/articles/b9f6c5ec134de621a769cd65a4ff9173417fcbf2,https://newsatcl-pctr.c.yimg.jp/t/amd-img/20260623-11753925-khbv-000-41642148-thumb.jpg?exp=10800,2026-06-23T18:43:16+09:00,2026-06-23T18:43:57+09:00,khb東日本放送,khbv,khb東日本放送,546,khb東日本放送 楽天イーグルスは２２日、延長１２回４時間半を超える試合を制しました。連敗は５でストップし、吉井監督が楽天での初勝利です。 年に１回の東京ドームでの主催試合は１−４と３点ビハインドで迎えた７回裏、佐藤直樹とマッカスカーのタイムリーで同点に追いつき、なおも２アウト１塁２塁のチャンスで渡辺佳明が勝ち越しのタイムリーを放ち、初めてリードを奪います。 ところが８回表、先発早川の後を継いだ九谷が長谷川に２ランホームランを浴びて再びリードを奪われます。 それでも９回裏、１アウト３塁で浅村のセカンドゴロの間に３塁ランナーが返って同点とし、延長戦に突入します。 １１回表、楽天５番手の藤原がノーアウト１塁２塁で小島をショートゴロに打ち取り２塁フォースアウト、セカンド黒川の１塁への送球がそれる間に２塁ランナーが一気にホームイン。西武に三たびリードを奪われます。 しかし１１回裏、浅村がバックスクリーンにソロホームランを放ち同点に追いつくと、１２回裏には２アウト２塁で黒川が前進守備のレフトの頭上を超えるサヨナラタイムリーでシーソーゲームを締めくくりました。 連敗を５で止めた楽天、吉井監督が就任初勝利を挙げました。 【２２日】楽天８×ー７西武（延長１２回）＠東京ドーム khb東日本放送,[],[]
人だけではなく犬も熱中症に　注意点を獣医に聞く（khb東日本放送）,https://news.yahoo.co.jp/articles/76d78f80f1e2753619ccd367b8ad0f68a632e13b,https://newsatcl-pctr.c.yimg.jp/t/amd-img/20260623-11753923-khbv-000-1-thumb.jpg?exp=10800,2026-06-23T18:39:22+09:00,2026-06-23T18:39:22+09:00,khb東日本放送,khbv,khb東日本放送,888,khb東日本放送 梅雨の季節ですが、夏本番になると熱中症に注意が必要です。熱中症は人間だけではなく犬も気を付けなければなりません。 愛犬の熱中症を経験したことがあるという飼い主は、４人に１人というデータがあります。 犬には肉球以外に汗腺が無く基本的に口呼吸でしか体温の調整ができないため、人間よりも熱中症に注意が必要です。 長町南動物病院相澤睦獣医「ワンちゃんにも熱中症があって、人と同じように体が熱くなって高体温の状態が続くと色々な臓器にダメージが出る。人と違って暑いと言ってくれないので、気付いた時には重症になっていることも多い」 相澤獣医によりますと、犬は熱中症が重症化すると舌の色が紫色になって下痢や血便などの症状が現れ最悪、死に至るケースもあるということです。 熱中症のサインは、呼吸です。通常、犬は「ハアハア」と呼吸しますが「ゼエゼエ」と息苦しそうな呼吸は要注意です。 長町南動物病院相澤睦獣医「基本的には陽が出ている日中は、かなり気温が上がってしまうことと、地面も温度が上がっていますので外出を控えた方が良いです」 犬は気温が２５℃以上になると熱中症のリスクが高まり、２８℃を超えると危険な状況となります。 散歩は暑くなる前の朝の時間帯と、日が沈み気温が落ち着く夜の時間帯が良いということです。 どうしても日中に外に出たい場合は、地面に手を当ててどれくらい熱いか確認し、必要に応じてアスファルトなどの上ではなく、土や草の上を歩かせるようにしましょう。 部屋の中では温度だけではなく、湿度の管理が重要です。 室内ではエアコンを使って温度を２５℃前後、湿度を５０％前後に保つと良いということです。 長町南動物病院相澤睦獣医「水を使ってあげることが良くて、氷とか保冷剤を使うよりは水を直接体に掛けたり水に濡らしたタオルを体に巻いてあげたりして、そこから風を送ってあげて気化熱で少しずつ温度を下げる」 そして冷やす際には屋内などの涼しい場所に移動させ血管の多いおなかや首、脇の下や内股などを冷やして自然に体温が下がるのを待つことが大切だということです。 khb東日本放送,[],[]
地方の優れた名店で最高賞　宮城・気仙沼市のフカヒレ料理レストラン（khb東日本放送）,https://news.yahoo.co.jp/articles/627aa7d5a7df8c7953b0650c0f8a9f0ff6dadff7,https://newsatcl-pctr.c.yimg.jp/t/amd-img/20260623-11753920-khbv-000-41641959-thumb.jpg?exp=10800,2026-06-23T18:33:54+09:00,2026-06-23T18:33:58+09:00,khb東日本放送,khbv,khb東日本放送,1066,khb東日本放送 宮城県気仙沼市のレストランが、英字新聞ジャパンタイムズが選ぶ地方の優れた名店で最高賞を受賞しました。腕を振るうのは、気仙沼市のフカヒレに魅せられた料理人です。 気仙沼市弁天町のフカヒレ料理専門店ＫＵＲＯＭＯＲＩは６月、ジャパンタイムズが選ぶ旅してでも訪れたい地方の名店で、最高賞であるレストラン・オブ・ザ・イヤーに選ばれました。 最高賞の受賞は、宮城県のレストランでは初の快挙です。腕を振るうのは気仙沼市のフカヒレに魅せられた料理人、黒森洋司さんです。 ＫＵＲＯＭＯＲＩ黒森洋司シェフ「ここでしか食べられない料理、ここでしか食べられない体験ができるお店だと思うので、そこが賞をいただいた理由かなと」 黒森シェフは東京都や横浜市の名店で腕を磨き、世界的美食ガイドのゴ・エ・ミヨや農林水産省の料理マスターズなどで数々の賞を受賞するなど、国の内外で高い評価を受けています。 東日本大震災後、食材を求めて宮城県に通う中でフカヒレやアワビなどの食材に魅了された黒森シェフは仙台市に店を構えましたが、日本一の産地で最高のフカヒレ料理を提供したいと２０２５年９月、気仙沼市に店を移転しました。 提供される料理は朝、昼、晩で内容が変わりディナーではフカヒレづくしのフルコースを楽しむことができます。 ランチメニューは、フカヒレの煮込みに季節の野菜や白石温麺が添えられています。 ＫＵＲＯＭＯＲＩ黒森洋司シェフ「右の方がモウカザメの胸ビレ。左がヨシキリザメの胸ビレです。全然見た目も違うし食べると違いが分かると思います」 客「こんなにフカヒレの味を感じられたことがなかったので、感激してます」 この日、黒森シェフはランチ営業の後に気仙沼市役所を訪れ受賞を菅原市長に報告しました。 菅原茂気仙沼市長「随分、飛び抜けた形で強い磁力が気仙沼市にできたなと思ってます。ここに来れば今まで感じたことがない味、テクスチャを感じることができる驚きの世界を求めに来てほしいと、アピールできるのかなと思っています」 全国の地方レストランの頂点に選ばれたＫＵＲＯＭＯＲＩの黒森シェフは、フカヒレをきっかけに気仙沼市を知ってほしいと、料理を通じて地元の魅力を全国、世界に発信します。 ＫＵＲＯＭＯＲＩ黒森洋司シェフ「本当のフカヒレを気仙沼市の人に食べてもらいたい。そこから皆さんが自信を持って気仙沼市にはこんなに良い物があるんだと発信してもらって、最終的には世界中からゲストを呼んで気仙沼市の何かのきっかけになれば良いかなと思ってます」 khb東日本放送,[],[]
教諭がパワハラを苦に自殺　裁判で宮城県側は請求棄却を求める　両親「真実を明らかに」（khb東日本放送）,https://news.yahoo.co.jp/articles/06e6802941e02a9a9e042eb11d5d30c2d2233c36,https://newsatcl-pctr.c.yimg.jp/t/amd-img/20260623-11753912-khbv-000-41641940-thumb.jpg?exp=10800,2026-06-23T18:25:00+09:00,2026-06-23T18:33:21+09:00,khb東日本放送,khbv,khb東日本放送,1419,khb東日本放送 宮城県の県立高校女性教諭が上司からパワハラを受けて自殺したとして、両親が宮城県に約１億円の賠償を求めた裁判が仙台地裁で始まりました。宮城県側は、請求の棄却を求めました。 石巻西高校に勤務していた３０代女性教諭は２０２０年、同じ学校の主任だった男性教諭から心理的に追い詰められるような内容が書かれたメモを受け取るなど、パワハラを苦に自殺しました。 女性教諭の両親は、上司の言動により女性が精神的な苦痛を受けたなどとして宮城県に約１億円の損害賠償を求めています。 ２３日の第一回口頭弁論で両親は「事故後に宮城県県教育委員会がまとめた事故調査報告書の事実認定が不十分」男性教諭のパワハラ行為の更なる全貌の解明と、管理職の責任を追及したいと訴えました。 一夫で宮城県側は「報告書の認定事実を超える原告らの主張は、根拠を確認できない。校長や教頭は加害教諭への指導や、女性教諭の体調への配慮を行っていた」などとして、請求の棄却を求めました。 次回の裁判は、９月８日に開かれます。 娘に何が起きたのか、なぜ防ぐことができなかったのか。両親は、裁判で真実を明らかにしたいと訴えます。 父親「写真見てはね。思い出すよね。悔しい。ひどいなと言うしかないですよね」 高校教諭だった娘は、３０代という若さで自ら命を絶ちました。 宮城県の石巻西高校で社会科の教員として勤務していた女性は、進路の相談や不登校の生徒の支援など生徒に寄り添う先生で、両親にも学校での出来事をよく話していたということです。 父親「天職のように思ってましたもんね。子どもたちの役に立てているのが、本当にうれしいんだなと思いましたよね」 女性教諭に異変が起きたのは、初めて３学年の担任を任された２０２０年でした。 母親「泣いて帰ってきたからね。何か分からない人からの手紙があったんだよねって」 宮城県教育委員会の調査報告書によると２０２０年３月、女性教諭は業務をめぐる行き違いで上司の男性教諭と関係が悪化します。 その後６月の職員会議で、男性教諭が女性教諭に対して業務報告の不備を執拗に指摘し、女性は涙を流して退席しました。 周囲の教員からは「つるし上げしているようだった」という声も上がりました。 女性教諭の手帳には、男性教諭から受け取ったメモが残されていました。このメモによって女性教諭は、更に精神的に追い詰められます。 「先生の仕事の後始末をするのはもうたくさんです」「不愉快ですので教務部会にも出ないでください」 母親「学校の先生なのにそんなことやるの、と私は言った時がありましたね。お母さんは性善説だからと」 教頭ら管理職にパワハラについて報告したものの、改善されませんでした。 手帳には、１０月２３日までの授業のスケジュールも記されていましたが、女性教諭は命を絶ちました。 宮城県教育委員会は、２０２４年に出した報告書で男性教諭の行為がパワハラと認定し、校長や教頭についても「指導や情報共有を怠り重大な過失があった」と結論付けました。 両親は調査や事実認定に不十分な点があると指摘していて、娘に何が起きたのか、なぜ防ぐことができなかったのか裁判で真実を明らかにしたいと訴えます。 父親「原因がどこにあって二度としないということが明らかにならなければ、娘の尊厳は回復したとは思ってないので、尊厳を回復したい。真実を本当のことを明らかにしてくれと」 khb東日本放送,[],[]
東京都の小学校の火災受け　仙台市教育委員会が全校に安全管理の徹底を通知（khb東日本放送）,https://news.yahoo.co.jp/articles/37539c3363ee11043d0880f344f5d776318ba20e,https://newsatcl-pctr.c.yimg.jp/t/amd-img/20260623-11753901-khbv-000-41641671-view.jpg?exp=10800,2026-06-23T18:05:21+09:00,2026-06-23T18:18:05+09:00,khb東日本放送,khbv,khb東日本放送,381,仙台市 ６月１９日に、東京都北区で発生した小学校火災を受け、仙台市教育委員会は安全点検を徹底する通知を市内すべての学校に出しました。 １９日、東京都北区の小学校で火災が発生し、４階の音楽準備室など２００平方メートルが焼け、児童ら２人が腕の骨を折るなど１１人がけがをしました。 この火災を受け、仙台市教育委員会は、２３日付で市内の市立学校すべてに安全点検を徹底することなどを明記した通知を出したということです。 東京の小学校の火災の原因は、現在のところ分かっていませんが、コンセント付近の焼け方が激しかったことから、使用していない暖房器具などの電化製品のコンセントを抜くことの徹底などを求めたということです。 また、上層階での火災に備え、避難経路の再確認、避難はしごや救助袋の設置場所の確認や使用方法についても確認するよう通知したということです。 khb東日本放送,[],[]
アジサイ寺の境内でアジサイが見頃　仙台・資福寺（khb東日本放送）,https://news.yahoo.co.jp/articles/2cda4681c138b56cc8c2b350013e122c827e12a4,https://newsatcl-pctr.c.yimg.jp/t/amd-img/20260623-11753884-khbv-000-1-thumb.jpg?exp=10800,2026-06-23T17:38:52+09:00,2026-06-23T17:38:52+09:00,khb東日本放送,khbv,khb東日本放送,452,khb東日本放送 アジサイ寺として知られる仙台市青葉区の資福寺では、梅雨空に映える色とりどりのアジサイが訪れた人たちを楽しませています。 長井ゆめのアナウンサー「可愛らしいアジサイを見ると、気持ちも明るくなりますね」 青葉区北山にある資福寺の境内には約１０００株のアジサイが植えられていて、アジサイ寺としても知られています。 まりのようにこんもりと丸い形が特徴のセイヨウアジサイと、小さなつぼみを縁取るように周りに装飾花を付けるガクアジサイが楽しめます。 極端な暑さや寒さがなかったことに加え雨も適度に降ったことから、色づきが良くボリュームがあるアジサイが育っているということです。 「雨が降っていて、とてもしっとりとしていい」「アジサイが好きで毎年１回はここに見に来ている。青色が好きなのでメインで写真を撮ろうかな」 資福寺澁谷芳円住職「日常の喧騒を離れてお花を見て鳥の声を聞いて心癒やされて、また普段の生活に戻っていけるといいと思う」 資福寺のアジサイの見頃は７月上旬まで続きます。 khb東日本放送,[],[]
