headline,mainEntityOfPage,image,datePublished,dateModified,author,media_en,media_jp,str_count,body,images,external_links
宮城・岩沼市の鬼澤聡市長が初登庁　人口５万人を目指してかじ取り（khb東日本放送）,https://news.yahoo.co.jp/articles/ae7e6fc9d7cb888e97a99ac7f68181a1794d66de,https://newsatcl-pctr.c.yimg.jp/t/amd-img/20260623-11753868-khbv-000-1-thumb.jpg?exp=10800,2026-06-23T16:51:33+09:00,2026-06-23T16:51:33+09:00,khb東日本放送,khbv,khb東日本放送,337,khb東日本放送 ７日に投開票された宮城県の岩沼市長選挙で初当選した鬼澤聡市長が初登庁し、人口５万人を目指してかじ取りする意欲を見せました。 鬼澤市長は、７日の市長選挙で現職に約２０００票の差をつけて初当選しました。 ２３日午前９時に岩沼市役所に到着した鬼澤聡市長は、職員から拍手で出迎えられ、約７０人の幹部職員を前に訓示を述べました。 鬼澤聡岩沼市長「提言だけではなく、是非異論もぶつけていただきたい。知恵と工夫で最小限のコストで最大限の効果、岩沼市民の幸せが最大化するように」 鬼澤市長は人口減少対策に取り組み、４万２０００人余りの人口を５万人にすることを目標に掲げ、市政のかじ取りをする意欲を見せました。 鬼澤市長の任期は、６月２３日から４年間です。 khb東日本放送,[],[]
東日本大震災の行方不明者の手掛かりを探す相談所　１日限定で設置（khb東日本放送）,https://news.yahoo.co.jp/articles/cced31320f9f0d76171ed6bd549259031ea82544,https://newsatcl-pctr.c.yimg.jp/t/amd-img/20260623-11753865-khbv-000-1-thumb.jpg?exp=10800,2026-06-23T16:49:14+09:00,2026-06-23T16:49:14+09:00,khb東日本放送,khbv,khb東日本放送,435,khb東日本放送 東日本大震災による行方不明者の手掛かりを捜す相談所が、１日限定で宮城県石巻市に開設されました。 震災で行方不明になっている人の手掛かりをつかもうと宮城県警が設置した相談所では、警察官が身元が分からない遺体の発見場所などを記したちらしを配布した他、家族が行方不明になっている人などが警察官に相談できるブースが設けられました。 石巻市雄勝町に住む７０代女性が相談に訪れ、当時８０代で現在も行方不明の親戚の特徴を警察官に伝えました。 「親戚のおばちゃんが、まだ行方不明なんです。それで１５年も経ちますけど、まずこういう催し物があるっていうことので、一応聞いてみたんですけど」 宮城県では５月末現在、震災で行方不明になっている人が１２１３人います。遺体で発見された犠牲者６人の身元が分かっていません。 宮城県警捜査一課阿部聡検視官「ささいな情報でも結構ですので、１つでも行方不明者の情報につながればと思っています。情報提供をお願いいたします」 khb東日本放送,[],[]
住宅街近くでクマ目撃　近くでは１８日と１９日にも目撃　仙台・青葉区（khb東日本放送）,https://news.yahoo.co.jp/articles/f09fce7c4233e2984ccb0a059632b20b07824a2d,https://newsatcl-pctr.c.yimg.jp/t/amd-img/20260623-11753863-khbv-000-1-thumb.jpg?exp=10800,2026-06-23T16:41:56+09:00,2026-06-23T16:41:56+09:00,khb東日本放送,khbv,khb東日本放送,454,khb東日本放送 ２２日午後、仙台市青葉区国見の住宅街近くでクマが目撃されました。近くでは１８日と１９日にも目撃されていて、警察などが警戒を強めています。 南湖子記者「小学校からほど近い山林でクマが目撃されました。近くでは相次いで目撃されています」 警察によりますと２２日午後６時５０分ごろ、青葉区国見４丁目で「山林でクマを目撃した」と近くの人から通報がありました。 クマは、西側の山林へ去っていったということです。けがをした人はいません。 目撃場所は、国見小学校から１５０メートルほど離れた住宅街近くの山林で、近くでは１８日と１９日にも目撃されています。 宮城県ではクマの目撃が相次いでいて、４月１日から６月２２日まで目撃が６７０件と、前年同時期と比べて３８２件増えています。 この影響で、夏の風物詩ホタルの鑑賞会の中止が相次いでいます。 仙台市青葉区の台原森林公園では、２０日から開催予定だったホタルの鑑賞会や、２８日に予定していた伊達武将隊と巡るホタル鑑賞ツアーが中止となっています。 khb東日本放送,[],[]
食料品消費税１％で…宮城県では１年間で約１５３億円の減収見込み　村井知事「しっかりと代替措置を取って影響が出ないようにしてほしい」（khb東日本放送）,https://news.yahoo.co.jp/articles/aa6042a1fcf4cae25551e0eded9bc09f10d147fe,https://newsatcl-pctr.c.yimg.jp/t/amd-img/20260623-11753855-khbv-000-41640527-view.jpg?exp=10800,2026-06-23T16:19:05+09:00,2026-06-23T16:33:16+09:00,khb東日本放送,khbv,khb東日本放送,407,村井宮城県知事 政府が検討を進めている食料品の消費税減税について、１％に引き下げられた場合、宮城県では１年間で約１５３億円の減収になると明らかにしました。 物価高対策の柱となる食料品の消費税減税をめぐっては、与野党でつくる「国民会議」の実務者会議で 、自民党が提示した来年４月から２年間に限り現在の８％から１％に引き下げる案で議論が交わされています。 宮城県の村井知事は、２３日の定例会見で、食料品の消費税が１％に引き下げられた場合、１年間で地方消費税の約９３．５億円と地方交付税の約５９億円の計約１５３億円の減収になると明らかにしました。 村井知事は、大幅な減収は社会保障やインフラなど全般的な施策に影響が出るとして、「しっかりと代替措置を取って影響が出ないような形にしてほしい」と述べました。 宮城県では、減収の影響は全国的に懸念されるものだとして、国への要望などを検討していくとしています。 khb東日本放送,[],[]
仙台８９ＥＲＳ　エルダーウィッチ選手が契約更新　片岡大晴選手が復帰を報告（khb東日本放送）,https://news.yahoo.co.jp/articles/3bdc9bcddabae60b15434c70a84a851373a97107,https://newsatcl-pctr.c.yimg.jp/t/amd-img/20260623-11753811-khbv-000-1-view.png?fmt=jpeg&q=85&exp=10800,2026-06-23T13:51:54+09:00,2026-06-23T13:51:54+09:00,khb東日本放送,khbv,khb東日本放送,704,仙台89ERS 仙台８９ＥＲＳは今季抜群の存在感を示したレバノンリーグの元ＭＶＰ、セルジオ・エルダーウィッチ選手と来季の契約を結んだことを発表しました。 エルダーウィッチ選手はレバノン出身の２９歳、１９４センチ９３キロで得点力はもちろんリバウンドや卓越したボールコントロールにパスセンスとオールラウンダーです。 ２０２１年から４シーズンプレーしたレバノンリーグでリーグのＭＶＰに選ばれたほか、レバノン代表の中核選手としても活躍しています。 Ｂリーグ初挑戦の今シーズンは、仙台８９ＥＲＳで平均１２．０得点、４．９リバウンド。アシストは５．６でリーグ４位、１．６スティールはリーグ８位とオールラウンダーとしての卓越した能力を発揮し、試合を支配する活躍を見せました。 エルダーウィッチ選手は「素晴らしいファンの皆さんの前で再びプレーできる日を楽しみにしています」とコメントしています。 ２０日には、２シーズンぶりに復帰する仙台市出身の片岡大晴選手が、ファンの前で復帰への思いや意気込みを語りました。 片岡大晴選手「ナイナーズが日本一を取って歴史に名を刻むことが一番の目標ではあるので、それを皆さんと一緒に追いかけてつかみたいと思っています」 通算８シーズン在籍した片岡選手は、前シーズンの初めにプレータイムを求めてモンゴルリーグ挑戦し、２０２５年１１月からはＢ３さいたまブロンコスに移籍し主力として活躍しました。 片岡大晴選手「感謝の気持ちを込めてプレーするだけ。自分にできることがあれば全て注ぎたい。その気持ちを込めて日本一を取りに行きます」 仙台８９ＥＲＳのシーズン開幕戦は、９月２６日です。 khb東日本放送,[],[]
東北自動車道下り線　大和ＩＣ－古川ＩＣ　通行止め解除（khb東日本放送）,https://news.yahoo.co.jp/articles/e22cdfa5cb9521665f8302542a694b6da5a0173a,https://newsatcl-pctr.c.yimg.jp/t/amd-img/20260623-11753794-khbv-000-1-view.jpg?exp=10800,2026-06-23T12:57:39+09:00,2026-06-23T12:57:39+09:00,khb東日本放送,khbv,khb東日本放送,87,交通情報 ２３日午前９時半ごろに車６台が衝突したため通行止めになっていた、東北自動車道大和ＩＣ－古川ＩＣは、２３日午後０時３５分に通行止めが解除されました。 khb東日本放送,[],[]
上司のハラスメントでＰＴＳＤ　宮城県の自衛隊員が公務災害に認定（khb東日本放送）,https://news.yahoo.co.jp/articles/649d435dce6a07e678aa8991b3f428ff4e83ba98,https://newsatcl-pctr.c.yimg.jp/t/amd-img/20260623-11753743-khbv-000-1-thumb.jpg?exp=10800,2026-06-23T11:55:39+09:00,2026-06-23T11:55:39+09:00,khb東日本放送,khbv,khb東日本放送,301,khb東日本放送 宮城県の陸上自衛隊に勤務する男性隊員が、上司から日常的にセクハラなどの行為を受け精神疾患を発症したとして公務災害に認定されました。 宮城県の陸上自衛隊に勤務する３０代男性隊員は２００６年の入隊以降、上司２人から下半身を無理やり触られたり、クレーンでつり下げられたりするなどの行為を繰り返し受けました。 男性はその後、ＰＴＳＤ＝心的外傷後ストレス障害と診断され一時休職し、２０２５年２月に民間企業の労働災害に当たる公務災害を申請していました。防衛省はＰＴＳＤの発症とハラスメントとの因果関係を認め、公務災害と認定したということです。 今後、療養補償などが支払われます。 khb東日本放送,[],[]
東北自動車道で車６台が衝突　５人が軽傷　宮城・大崎市（khb東日本放送）,https://news.yahoo.co.jp/articles/fb9dba198da7e07a438029456f8b2d3f5d6bf357,https://newsatcl-pctr.c.yimg.jp/t/amd-img/20260623-11753741-khbv-000-1-thumb.jpg?exp=10800,2026-06-23T11:53:30+09:00,2026-06-23T11:53:30+09:00,khb東日本放送,khbv,khb東日本放送,320,khb東日本放送 ２３日午前、宮城県大崎市の東北自動車道下り線三本木パーキングエリア近くで、車６台が衝突し男性５人が軽いけがをしました。 警察などによりますと２３日午前９時半ごろ、大崎市の東北自動車道下り線三本木パーキングエリア近くで、車６台が衝突しました。 この事故で２０代から６０代の男性５人がけがをしましたが、いずれも軽傷だということです。 現場の約１キロ先では工事のため２車線のうち１車線が規制されていて、渋滞となっていた列に車が追突したとみられるということです。 事故の影響で、東北自動車道下り線の大和インターチェンジから古川インターチェンジの間で通行止めとなっています。 警察が事故の詳しい原因を調べています。 khb東日本放送,[],[]
【速報】宮城県の東北自動車道下りで車６台が絡む事故　５人けが　大和IC～古川IC間が通行止め（khb東日本放送）,https://news.yahoo.co.jp/articles/c0781f251a4986f9238932d67f70a354a1ea51be,https://newsatcl-pctr.c.yimg.jp/t/amd-img/20260623-11753679-khbv-000-41636798-view.jpg?exp=10800,2026-06-23T10:17:00+09:00,2026-06-23T11:02:14+09:00,khb東日本放送,khbv,khb東日本放送,154,事故現場 消防などによりますと、２３日午前９時半ごろ、宮城県大崎市の東北自動車道下り、三本木パーキングエリア付近で車６台が絡む事故がありました。 ５人がけがをしていますが、いずれも軽傷だということです。 事故の影響で、大和インターチェンジと古川インターチェンジの間で通行止めとなっています。 khb東日本放送,[],[]
