headline,mainEntityOfPage,image,datePublished,dateModified,author,media_en,media_jp,str_count,body,images,external_links
ハイスクールダンスフェスティバル　高校生が迫力あるパフォーマンス（テレビ静岡NEWS）,https://news.yahoo.co.jp/articles/5fd4eda28f719b034805d632ee7b30d56eb50e76,https://newsatcl-pctr.c.yimg.jp/t/amd-img/20260214-90035925-sut-000-1-thumb.jpg?exp=10800,2026-02-14T21:50:01+09:00,2026-02-14T21:50:01+09:00,テレビ静岡NEWS,sut,テレビ静岡NEWS,306,"テレビ静岡
テレビ静岡が主催するダンスコンテストで優秀賞に輝いたチームによるステージイベントが三島市で開かれました。

三島市で開かれたイベントには、テレビ静岡が主催するダンスコンテストで優秀賞に輝いた4つの高校が参加しました。

生徒たちは静岡出身の音楽プロデューサー・ヤマモトショウさんが作詞作曲した「しずおか35市町おぼえてる？」に合わせて、それぞれが考えたパフォーマンスを披露します。

来場者：
感動したすごく良かった

来場者：
すごく迫力があって、みんなを楽しませるダンスをしていた

また、2月14日は静岡発のアイドルグループ・fishbowlもステージに立ち、会場を盛り上げました。
テレビ静岡",[],[]
現役のレーシングドライバーが講演　夢に向かって努力することの大切さを伝える（テレビ静岡NEWS）,https://news.yahoo.co.jp/articles/73b6f2ac27b0b1ec1c7f8b7206ae301fdac26528,https://newsatcl-pctr.c.yimg.jp/t/amd-img/20260214-90035924-sut-000-1-thumb.jpg?exp=10800,2026-02-14T19:11:01+09:00,2026-02-14T19:11:01+09:00,テレビ静岡NEWS,sut,テレビ静岡NEWS,220,"テレビ静岡
高校生に将来の進路や仕事について考えてもらおうと、沼津市で現役のレーシングドライバーによる講演会が開かれました。

この講演会は沼津工業高校の近くに本社を置く木村鋳造所の協力によって実現し、講師には現役のレーシングドライバーとして活躍する平手晃平さんが招かれました。

この中で、平手さんは17歳の時に単身でイタリアに渡り、F1レーサーを目指した自身の経験をもとに、夢に向かって努力することの大切さを伝えていました。
テレビ静岡",[],[]
海底からレアアース泥の回収に成功！地球深部探査船「ちきゅう」が帰港　「生産技術の加速化を進めていきたい」（テレビ静岡NEWS）,https://news.yahoo.co.jp/articles/bfc51d1fd61a3cfa41ca9b839667770ecc364eed,https://newsatcl-pctr.c.yimg.jp/t/amd-img/20260214-90035923-sut-000-1-thumb.jpg?exp=10800,2026-02-14T19:06:01+09:00,2026-02-14T19:06:01+09:00,テレビ静岡NEWS,sut,テレビ静岡NEWS,359,"テレビ静岡
世界で初めて海底5600メートルからレアアースを含む泥の回収に成功した地球深部探査船が清水港に戻ってきました。

2月14日午後、清水港へと戻ってきた地球深部探査船「ちきゅう」は、同月1日、南鳥島の近海で世界で初めて海底5600メートルからレアアースを含む泥の回収に成功しました。

レアアースは自動車や電子機器などに欠かせない資源で、今回の成果は将来的な国産化に向けた大きな一歩となります。

内閣府 戦略的イノベーション創造プログラム
石井正一プログラムディレクター：
昨年の11月に出た日本の経済成長戦略、高市内閣のもとでの成長戦略の中の17番目の海洋としての南鳥島レアアース泥の生産技術の加速化を進めて参りたい

ちきゅうは2027年からレアアースの本格的な採掘試験に着手する予定です。
テレビ静岡",[],[]
田久保前市長宅の家宅捜索は実に7時間　代理人「こちらから証拠を渡しても何も良いことはない」　いずれの事件についても犯罪の成立を否認（テレビ静岡NEWS）,https://news.yahoo.co.jp/articles/b45f744959d37c883c3fd499fdc218ac6178da04,https://newsatcl-pctr.c.yimg.jp/t/amd-img/20260214-90035922-sut-000-1-thumb.jpg?exp=10800,2026-02-14T18:59:02+09:00,2026-02-14T18:59:02+09:00,テレビ静岡NEWS,sut,テレビ静岡NEWS,461,"テレビ静岡
静岡県警は2月14日朝、偽造私文書等行使など複数の容疑で刑事告発されている伊東市の田久保眞紀 前市長の自宅へ家宅捜索に入りました。

村田彬 記者：
田久保前市長の自宅前です。複数の捜査員が自宅を出入りしている様子が確認できます

田久保前市長をめぐっては、偽造された卒業証書を関係者に開示した偽造私文書等行使など6つの容疑・8つの事件について警察が刑事告発を受理しています。

田久保前市長は1月、警察による任意聴取を受けましたが、卒業証書については提出を拒否する回答書を2月12日に手渡しました。

こうした中、警察は14日、7時間にわたって田久保前市長の自宅を家宅捜索しました。

田久保前市長の代理人・
福島正洋 弁護士：
今の時点で例えば捜査側にいろいろ話をして供述調書を作られても、あるいはこちらから証拠を渡しても何も良いことはないですので、もしこちらから何か出すとすればそれは公判段階

福島弁護士によると、田久保前市長はいずれの事件についても犯罪の成立を否認しているということです。
テレビ静岡",[],[]
田久保前市長に対し“強制捜査”　代理人「身柄拘束はないと考えたい」も疑惑の卒業証書を保管する弁護士事務所への家宅捜索は「不当だと思っているので当然拒否権を行使する」（テレビ静岡NEWS）,https://news.yahoo.co.jp/articles/bd713bc02dd7ced46ad3f13cb348c01bbba3771e,https://newsatcl-pctr.c.yimg.jp/t/amd-img/20260214-90035921-sut-000-1-view.jpg?exp=10800,2026-02-14T16:16:02+09:00,2026-02-14T16:16:02+09:00,テレビ静岡NEWS,sut,テレビ静岡NEWS,1557,"伊東市・田久保眞紀 前市長
伊東市の田久保眞紀 前市長に関わる学歴詐称問題をめぐり、静岡県警は2月14日、同氏の自宅へ家宅捜索に入った。田久保前市長はすでに警察から要請された卒業証書の提出を拒否する回答書を提出しているが、代理人も改めて「こちらから証拠を渡しても何も良いことはない」と述べている。
田久保前市長の“懐刀”福島弁護士が激白　「全国の弁護士が立ち上がってくれる」　押収拒絶権の行使に自信　権利の濫用との批判に“反論”　「法律家同士フェアにやりましょう」
伊東市の田久保前市長をめぐっては、2025年5月の市長選に際して報道機関に虚偽の経歴を伝え掲載させた公職選挙法違反、当選後に市の広報誌に虚偽の経歴を記載した虚偽公文書作成、虚偽の学歴が記載された市の広報誌を発行した偽造公文書行使等、卒業証書を偽造した有印私文書偽造、偽造された卒業証書を関係者に開示した偽造私文書等行使、正当な理由なく百条委員会への出頭を拒んだ地方自治法違反、正当な理由なく百条委員会で証言を拒否したほか虚偽の証言をした地方自治法違反、百条委員会から求められていた記録を正当な理由なく提出しなかった地方自治法違反の6つの容疑・8つの事件について警察が刑事告発を受理して捜査を進めている。

田久保前市長は警察からの出頭要請を受け、1月29日に任意で事情聴取を受けたが、提出を検討するよう求められた疑惑の”卒業証書”については要請を拒否。
こうした中、警察は2月14日、伊東市にある田久保前市長の自宅を家宅捜索した。

捜索は約7時間に及び、警察は押収した資料を手に現地を後にしている。

今回の家宅捜索を受け、田久保前市長の代理人を務める阿部・吉田・三瓶法律会計事務所の福島正洋 弁護士が取材に応じ、「（卒業証書の）提出拒否をすれば、こういうことが起きるかなと予想していた」と述べた。

家宅捜索の実施について、福島弁護士は同日朝、警察から電話があったことで知ったという。

これまでとは捜査のフェーズが変わったことについては「身柄拘束はないと考えたい。逃亡のおそれと証拠隠滅というのがキーになると思うが、有名人なので逃亡できないし、今回の強制捜査で証拠を全部持っていかれれば、これ以上、隠す証拠もないので、理論上は身柄拘束の要件はないと思っている」と強調。
ただ、疑念を深めた疑惑の卒業証書については改めて刑事訴訟法 第105条に規定された押収拒絶権を理由に提出しない考えを示し、「いまの時点で捜査側にいろいろ話をして供述調書を作られても、こちらから証拠を渡しても何もいいことはないので、もしこちらから何かを出すとすれば公判段階、裁判になった時に選択的に出していくということになる」との見解を明らかにした。

その上で「まさに人質司法。こちらが言うことを聞かなかったら捕まえますよというのはおかしい話なので、そこは異議を述べていきたい」と警察を牽制している。

一方で、卒業証書は現在も弁護士事務所の金庫で保管していることから、今後、事務所にも家宅捜索が入る可能性については「絶対ないとは言い切れない」としつつ、「その場合、そうした捜査は不当だと思っているので、当然（押収）拒絶権を行使するということになる。（警察が）来れば拒否する」と話した。

福島弁護士は卒業証書の提出を拒否する回答書の中で、「重要な証拠となる可能性が高い卒業証書及び卒業アルバムについて、万が一にも紛失、盗難、改ざん等があってはならないという観点から、当職の責任において、厳重に保管することとした」と記し、「捜査段階では提出しないが、もし公判請求された場合、弁護側立証のために必要な範囲で裁判所に提出する可能性は依然として残る」と主張している。
テレビ静岡",[],[]
住宅に複数人が押し入る強盗事件　住人が棒状のもので殴られ軽いケガ　現状で被害金品は確認されず（テレビ静岡NEWS）,https://news.yahoo.co.jp/articles/fc036a5242ec689655b7c04afa5d194672e1cb47,https://newsatcl-pctr.c.yimg.jp/t/amd-img/20260214-90035920-sut-000-2-thumb.jpg?exp=10800,2026-02-14T12:33:02+09:00,2026-02-14T12:47:01+09:00,テレビ静岡NEWS,sut,テレビ静岡NEWS,220,"テレビ静岡
2月14日未明、磐田市の住宅に複数の人物が押し入る強盗事件があり、警察が逃げた犯人の行方を追っています。

2月14日午前3時頃、磐田市福田中島の住宅に複数の人物が押し入る強盗事件があり、この家に住む男性が棒状のもので殴られ、上半身に軽いケガをしました。

警察によると犯人は現在も逃走中で、少なくとも1人は上下黒色で目出し帽をかぶっていたということです。

これまでに金品が盗まれるなどの被害は確認されていません。
テレビ静岡",[],[]
"田久保前市長の学歴詐称問題は""強制捜査""に発展　警察が自宅を家宅捜索　偽造私文書等行使など6つの容疑・8つの事件で刑事告発を受理（テレビ静岡NEWS）",https://news.yahoo.co.jp/articles/8d9a785e16696cc4cfcf2e922af126046c202b3e,https://newsatcl-pctr.c.yimg.jp/t/amd-img/20260214-90035919-sut-000-1-thumb.jpg?exp=10800,2026-02-14T12:24:01+09:00,2026-02-14T12:24:01+09:00,テレビ静岡NEWS,sut,テレビ静岡NEWS,298,"テレビ静岡
静岡県警は2月14日朝、偽造私文書等行使など複数の容疑で刑事告発されている伊東市の田久保眞紀 前市長の自宅へ家宅捜索に入りました。

田久保前市長をめぐっては、偽造された卒業証書を関係者に開示した偽造私文書等行使など6つの容疑、8つの事件について警察が刑事告発を受理しています。

田久保前市長は1月、警察による任意聴取を受けましたが、卒業証書については提出を拒否する回答書を2月12日に手渡しました。

こうした中、警察は2月14日朝から田久保前市長の自宅へ家宅捜索に入り関係資料などを押収しています。

田久保前市長はいずれの事件についても犯罪の成立を否認しています。
テレビ静岡",[],[]
尾木ママが娘に「学校をサボる日」!? 不登校の子供の親が気を付ける3つのポイント【テレビ寺子屋】（テレビ静岡NEWS）,https://news.yahoo.co.jp/articles/3357cac1bdf29f8a60103cbd08d05ce2c3ba366e,https://newsatcl-pctr.c.yimg.jp/t/amd-img/20260214-90035916-sut-000-1-view.jpg?exp=10800,2026-02-14T11:45:01+09:00,2026-02-14T11:45:01+09:00,テレビ静岡NEWS,sut,テレビ静岡NEWS,1626,"教育評論家・尾木直樹さん：
不登校の小中学生は2024年度には約35万人と過去最多となっています。尾木ママこと教育評論家の尾木直樹さんが、学校を休む権利や親が気を付けるべき3つのポイントについて解説しました。
【テレビ寺子屋】尾木ママ「すっかり時代は変わっています」親の古い価値観は更新! 子供中心の発想へ
テレビ静岡で2026年2月8日に放送されたテレビ寺子屋では、教育評論家の尾木直樹さんが、不登校への向き合い方について語りました。
不登校は特別なことではない時代
イメージ
教育評論家・尾木直樹さん：
子供たちを取り巻く環境は時代と共に変化していて、そのひとつに不登校の問題があります。2024年度には不登校の小中学生は約35万人と、過去最多となりました。高校生まで入れると42万人を超え、今や不登校は特別なことではなくなってきています。

教育に関する法律に「教育機会確保法」というものがあります。より良い学校づくりを目指すだけでなく、ひとつの権利として「学校を休んでもいい」ということが明確にされました。

そして、学校に行けなくても学びの機会を確保できるようさまざまな支援が行われています。政府や自治体によって不登校への対策が進められるなか、家庭ではどう子供たちと向き合っていけばよいのでしょうか。
娘を救った「学校をサボる日」
テレビ静岡で放送されたテレビ寺子屋
私も、娘が小学4年生のころに「このままいったら不登校になるな」と感じたことがありました。そんな時、家庭で子供のストレスを解消しようとやってみたのが、リフレッシュ休暇です。

日にちを決めてカレンダーに花まる印をつけます。その日は「学校をサボる日」。親子で一緒に出かけてリフレッシュして、また学校に行ければいいなと考えたんです。

そうすると、娘は花まる印のついた日をすごく楽しみにして、毎日元気に学校へ行くようになりました。
家庭で親が気を付ける3つのポイント
イメージ
家庭で親が気を付けるポイントが3つあると私は思っています。

1つ目は「押し付けない」。義務教育の「義務」は、実は子供の義務ではなくて、親の義務なんです。

だから学校へ行くことを押し付けず、家庭や図書館など、学校以外であっても学びからは遠ざからないように、別の居場所を作ってあげることが大切です。

2つ目は「親が一人で抱え込まない」。子供が学校へ行かないと、親も思いつめてしまいがちです。

今は「不登校の親の会」というものが各地にあります。同じ経験をしている先輩からアドバイスをもらえて安心できます。「自分一人で抱え込んで孤立しない」ということが大切です。

3つ目は「しっかり話を聴く」。「聞く」ではなく、しっかりと「心」を受け止めて「聴く」ということが大切です。

子供の悩みや苦しみを、親である自分が解決はできないにしても、気持ちに共感してしっかりと受け止める。「自分はあなたの味方だよ」という気持ちを積極的に態度にも示してほしいと思います。
「生きづらさ」を抱える世代に寄り添う
イメージ
今の10代、20代を象徴するキーワードは「生きづらさ」だと言われています。コロナの影響で人と距離を置くことを余儀なくされ、ネット社会で誰かにいつも見られているような環境の中で育ってきました。

心が弱いわけではなく、敏感で繊細なんです。

子供も親も無理してがんばりすぎず、休んだり立ち止まったりする時間があってもいいと思います。いろんな選択肢を探りながら、親子で歩んでほしいと思います
教育評論家・尾木直樹さん
尾木直樹：1947年滋賀県生まれ。早稲田大学卒業後、教師として22年間子供主役の教育を実践。その後大学教員に転身し22年教壇に。現在は法政大学名誉教授、臨床教育研究所「虹」所長。

※この記事は2026年2月8日にテレビ静岡で放送された「テレビ寺子屋」をもとにしています。
テレビ静岡",[],[]
【速報】田久保前市長の自宅に家宅捜索　前々日には”卒業証書”の任意提出を拒否（テレビ静岡NEWS）,https://news.yahoo.co.jp/articles/718f7fe218cdde240fd95cc2147e2aa345a2f15c,https://newsatcl-pctr.c.yimg.jp/t/amd-img/20260214-90035918-sut-000-2-view.jpg?exp=10800,2026-02-14T09:02:01+09:00,2026-02-14T09:24:02+09:00,テレビ静岡NEWS,sut,テレビ静岡NEWS,674,"伊東市・田久保眞紀 前市長
虚偽の学歴を報道機関に公表させた公職選挙法違反など複数の容疑で刑事告発・受理されている伊東市・田久保眞紀 前市長の自宅に2月14日、静岡県警が家宅捜索に入りました。田久保前市長をめぐっては同月12日、県警に対して”卒業証書”の提出を拒否する回答書を手渡していました。
田久保前市長の“懐刀”福島弁護士が激白　「全国の弁護士が立ち上がってくれる」　押収拒絶権の行使に自信　権利の濫用との批判に“反論”　「法律家同士フェアにやりましょう」
伊東市の田久保眞紀 前市長をめぐっては、2025年5月の市長選に際して虚偽の学歴を報道機関に公表させた公職選挙法違反や偽造された卒業証書を関係者に開示した偽造私文書等行使など6つの容疑・8つの事件について警察が刑事告発を受理しています。

このため、警察はこれまで市議会の関係者などへの聴取をするとともに1月29日には田久保前市長自身への任意聴取を行いました。

ただ、代理人弁護士によると田久保前市長はいずれの事件についても犯罪の成立を否認していて、警察から関係者に開示した卒業証書を任意で提出するよう求められましたが、2月12日に要請を拒否する回答書を手渡しています。

こうした中、静岡県警は2月14日朝、伊東市にある田久保前市長の自宅へ家宅捜索に入りました。

田久保氏側は卒業証書の提出を拒んだことについて、刑事訴訟法 第105条に規定された押収拒絶権を主張し、代理人弁護士は「証拠隠滅の意図はなく、事務所で保管しているので捜査段階では渡せない」と話しています。
テレビ静岡",[],[]
