headline,mainEntityOfPage,image,datePublished,dateModified,author,media_en,media_jp,str_count,body,images,external_links
【サッカー｜J1アルビ】ホームで横浜に1-0で勝利　ダニーロ・ゴメスの先制ゴール守り切る【新潟】（UX新潟テレビ21）,https://news.yahoo.co.jp/articles/6534a4df53d8a5a476bc11b2cf27461f95e1ee76,https://newsatcl-pctr.c.yimg.jp/t/amd-img/20250615-00000004-niigatatvv-000-1-view.jpg?exp=10800,2025-06-15T20:00:13+09:00,2025-06-15T20:00:13+09:00,UX新潟テレビ21,niigatatvv,UX新潟テレビ21,215,"ホームで横浜に1-0で勝利
明治安田サッカーJ1、アルビレックス新潟は15日、ホームで横浜F・マリノスと対戦しました。ダニーロ・ゴメスのゴールで1-0で勝利しました。

負ければリーグ最下位に転落する大事な試合。アルビは前半から積極的に攻めますがスコアレスで折り返します。

ゴールが生まれたのは後半２８分、右サイドでパスを受けたダニーロ・ゴメスのミドルシュートで先制。そのまま１点を守り切りリーグ後半戦の初戦を白星で飾りました。",[],[]
新潟水俣病 公式確認から60年  被害者の会 総会で全員救済に向け決意新た【新潟】（UX新潟テレビ21）,https://news.yahoo.co.jp/articles/4c3ded9f411414812c7b997091b6d4ec86daf19d,https://newsatcl-pctr.c.yimg.jp/t/amd-img/20250615-00000003-niigatatvv-000-1-view.jpg?exp=10800,2025-06-15T19:17:12+09:00,2025-06-15T19:17:12+09:00,UX新潟テレビ21,niigatatvv,UX新潟テレビ21,304,"小武節子会長が知事と新潟市長を前に訴え　15日
新潟水俣病被害者の会と支援団体の新潟水俣病共闘会議が今年度の総会を開き、今後の方針を確認しました。

新潟市北区の新潟水俣病資料館で開かれた総会。裁判が長期化していることについて、被害者の会の小武節子会長は「このままでは原告ら被害者が亡くなるのを待って水俣病を終わらせることになる。花角知事、中原新潟市長は被害者の声をこれまで以上に政府に届けてください。」と訴えました。

新潟水俣病第５次訴訟の皆川栄一原告団長は５月末、公式確認から60年のタイミングに合わせて来県した浅尾慶一郎環境大臣について「環境大臣は事務方の原稿の丸読みに終始していた」と批判しました。",[],[]
村上新聞社が自己破産を申請 購読者数の減少で採算も確保できず【新潟】（UX新潟テレビ21）,https://news.yahoo.co.jp/articles/f9a99ae09e06ca945a271ab0e3fd3c2260bcd6cf,https://newsatcl-pctr.c.yimg.jp/t/amd-img/20250615-00000002-niigatatvv-000-1-view.jpg?exp=10800,2025-06-15T16:00:03+09:00,2025-06-15T16:00:03+09:00,UX新潟テレビ21,niigatatvv,UX新潟テレビ21,299,"株式会社村上新聞社が自己破産申請
地域の情報を掲載する村上市の「株式会社村上新聞社」が、新潟地裁新発田支部より破産手続き開始決定を受けたことがわかりました。

民間の信用調査会社「帝国データバンク」によりますと、村上市の「株式会社村上新聞社」は、1981年に設立された村上市岩船郡の政治経済やスポーツ・街角の話題まで、日刊紙では伝えきれない地域の情報を重点的に掲載していました。

しかし、近年は購読者数の減少に伴い売り上げが減少し、採算も確保できず債務超過に陥り6月3日付で事業を停止。新潟地裁新発田支部へ自己破産を申請しています。
負債は、債権者約270人に対し約3300万円だということです。",[],[]
【新潟スイーツ】老舗料亭がプロデュース！夏限定の「極上ふわふわかき氷」【加茂市】（UX新潟テレビ21）,https://news.yahoo.co.jp/articles/ea6646a7ddbcd40b5c8534079053c2e20f71b06e,https://newsatcl-pctr.c.yimg.jp/t/amd-img/20250615-00000001-niigatatvv-000-1-view.jpg?exp=10800,2025-06-15T11:45:00+09:00,2025-06-15T11:45:00+09:00,UX新潟テレビ21,niigatatvv,UX新潟テレビ21,865,"夏限定の一番人気かき氷「宇治金時練乳」
「北越の小京都」と呼ばれる加茂市にある江戸末期創業の老舗料亭『清雲亭 山重(やまじゅう)』。世界に誇る日本料理提供している名店です。
【動画】【新潟スイーツ】老舗料亭がプロデュース！夏限定の「極上ふわふわかき氷」【加茂市】
その名店が「日本料理をもっと気軽に楽しんでほしい」とプロデュースした『町家カフェ YamaCafe』。
山重から歩いて１分、大正時代に建てられた築100年の歴史的建造物で、国の登録有形文化財に指定されています。

おすすめのランチは、旬の味覚を詰め込んだ「和カゴ弁当(2,500円・税込)」。
仕入れの素材によってメニューが変わりますが、職人の技が感じられる丁寧な料理の数々がカゴの中にぎゅっと詰まっています。

さらにこれからの季節に注目したいのが、夏限定の一番人気のかき氷「宇治金時練乳(1,500円・税込)」。
シロップには京都の老舗・小山園の小倉山という高級抹茶を使った特製で、自家製練乳・あずきがのり、セットの白玉と一緒にいただく贅沢仕様。かき氷とシロップは3段重ねになっていて、本格抹茶のほろ苦さと練乳の甘さが絶妙な組み合わせです。ふわふわにきめ細かく削られた氷は、優しい冷たさで頭が痛くならないと評判です。

隠れ人気のかき氷は、リピート続出の「ココア練乳(1,200円・税込)」。
たっぷりのココアパウダーに爽やかな甘さの自家製練乳が合わさり、まるでティラミスのような味わい。シーズンになると毎日食べにくる常連客もいるそうです。

どの味も、料亭クオリティに仕上がった繊細・丁寧な“かき氷”たち。
老舗料亭の伝統と、カフェでの気軽な楽しみ。その両方が叶う加茂の名店で、〝和のおもてなし〟を体験してみてはいかがでしょうか。

●YamaCafe
新潟県加茂市仲町2-6(山重より徒歩1分)
0256-52-0104
営業時間｜11:30～17:00
ランチL.O. 14:00／ドリンクL.O. 16:30
定休日｜月曜・火曜(ほか臨時休業の場合あり)",[],[]
