headline,mainEntityOfPage,image,datePublished,dateModified,author,media_en,media_jp,str_count,body,images,external_links
大船渡市の保育園でサクラ開花「いっぱい咲くといい」園児たちの笑顔とともに　岩手県（岩手めんこいテレビ）,https://news.yahoo.co.jp/articles/53fb7a1ddcd56b7f6345cded204cf386d056de3d,https://newsatcl-pctr.c.yimg.jp/t/amd-img/20250307-90021856-nmit-000-1-view.jpg?exp=10800,2025-03-07T21:40:02+09:00,2025-03-07T21:40:02+09:00,岩手めんこいテレビ,nmit,岩手めんこいテレビ,287,"岩手めんこいテレビ
岩手県大船渡市内の保育園で園内の桜が花を開かせました。

桜が咲いたのは大船渡町にある大船渡保育園の裏庭です。

地元では早咲きの桜として親しまれていて、2025年は寒い日が続いたことから例年より数日遅くなりましたが、先週数輪の花が開いているのが確認されました。

子どもたちは元気いっぱいに指をさしながら桜の花を見つけていました。

園児たちは、「ピンクの桜だった。つぼみが咲いてくれるとうれしい」「かわいかった。いっぱい咲くといい」と話していました。

この桜は保育園の卒園式が行われる3月27日ごろに満開を迎えるということです。
岩手めんこいテレビ",[],[]
大谷翔平選手がオープン戦で初のマルチヒット　４試合連続ヒット（岩手めんこいテレビ）,https://news.yahoo.co.jp/articles/c895b531e2f3fef44f9aafbe3f6a34397dab7bda,https://newsatcl-pctr.c.yimg.jp/t/amd-img/20250307-90021852-nmit-000-1-view.jpg?exp=10800,2025-03-07T21:28:01+09:00,2025-03-07T21:28:01+09:00,岩手めんこいテレビ,nmit,岩手めんこいテレビ,241,"岩手めんこいテレビ
ドジャースの大谷翔平選手（岩手・奥州市出身）は、日本時間3月7日、レンジャーズとのオープン戦に出場し、4試合連続となるヒットを放ちました。

１番・指名打者で出場した大谷選手は、第1打席で3塁線を破るツーベースヒットで4試合連続ヒットとなりました。

第4打席にはうまく逆方向に運んでオープン戦初のマルチヒット。

そして7日は１塁コーチともいつもの儀式をしっかり決めた大谷選手、順調な調整が続いています。

（ドジャース8－4レンジャーズ）
岩手めんこいテレビ",[],[]
花巻東（岩手）は米子松蔭（鳥取）と初戦　センバツ甲子園　花巻東主将「山火事で被災した方々に勇気と希望と元気を」　岩手県（岩手めんこいテレビ）,https://news.yahoo.co.jp/articles/88abd396b42d144493f3a2be304e1c45f3c8f824,https://newsatcl-pctr.c.yimg.jp/t/amd-img/20250307-90021851-nmit-000-1-view.jpg?exp=10800,2025-03-07T21:13:01+09:00,2025-03-07T21:13:01+09:00,岩手めんこいテレビ,nmit,岩手めんこいテレビ,402,"岩手めんこいテレビ
3月18日に開幕するセンバツ甲子園の組み合わせ抽選会が7日に開かれました。
3年ぶり5回目の出場となる花巻東高校（岩手・花巻市）は、大会初日の第2試合で鳥取の米子松蔭高校と対戦します。

大阪市で開かれた組み合わせ抽選会には出場32校のキャプテンが参加しました。

花巻東高校のキャプテンは中村耕太朗選手。抽選の結果、花巻東は大会初日の第２試合で鳥取の米子松蔭と対戦することになりました。

対戦相手の米子松蔭は前身の米子商業時代を含め33年ぶり2回目のセンバツ出場。ピッチャーを中心とした堅い守りが特徴で、2024年秋の中国大会では準優勝しました。

花巻東　中村耕太朗主将
「大船渡の火災の災害があったので、被災した方々のために勇気と希望と元気を与えられるようプレーをしていかないといけない」

大会は3月18日に開幕し休養日も含め13日間の日程で行われます。
岩手めんこいテレビ",[],[]
死亡したのは90歳の男性と特定「大船渡の山火事」赤崎町6地区で避難指示を解除　帰宅後真っ先に電気や水道の確認した人も　岩手県（岩手めんこいテレビ）,https://news.yahoo.co.jp/articles/de9cd5f3be07a6108898faee9507fe2fe0fc6470,https://newsatcl-pctr.c.yimg.jp/t/amd-img/20250307-90021860-nmit-000-1-thumb.jpg?exp=10800,2025-03-07T21:02:01+09:00,2025-03-07T21:02:01+09:00,岩手めんこいテレビ,nmit,岩手めんこいテレビ,1165,"岩手めんこいテレビ
岩手県大船渡市の大規模な山林火災は発生から10日目となります。
市は3月7日、火の勢いが収まったとして赤崎町の6つの地区の避難指示を解除しました。
また、県は山林火災で死亡したのは90歳の男性と特定されたと発表しました。

大規模な山林火災の発生から10日目。
大船渡市は7日午前10時、赤崎町の一部地域で避難指示を解除しました。

大船渡市　渕上清市長
「本日は一部の地域において避難解除となった。それぞれは火災予防には十分注意して生活を再開してほしい」

対象となったのは宿、後ノ入、森っこ、大洞、生形、山口の6地区の415世帯・957人です。
市によりますと、7日午前6時時点で焼失した範囲は約2900ヘクタールとなっています。

市はこれまで、17の地域に対して避難指示を出していましたが、7日午前10時、6つの地域で避難指示を解除しました。
市は解除の理由について、延焼が広がる恐れがなくなったことや、この地域が地上の消火活動に支障をきたさない地域であることを挙げています。

ＦＮＮ取材団　高橋朋弘記者
「避難指示の解除を受けて住民の方たちが続々と入ってきています」

避難指示が解除されて、久々に我が家に帰った住民からは安堵の声が聞かれました。

息子の家に避難した人
「安心した。避難の解除を聞いて、良かったと思った」

自宅に着いてすぐに電気や水道が使えるかを確認する住民もいました。
「（電気も）ついた。（水道も）出ます。ほっとしています」と安堵していました。

また、ペットを連れて避難をしていた人も多くみられた今回の山林火災。ペットも久しぶりの我が家に安心している様子です。

ペットと一緒に避難していた人
「（避難生活は）１日でも大変だった。ある程度（避難の）準備したが、いざとなると、避難生活は厳しい」

赤崎町森っこ地区に住む千葉さんは、東日本大震災の津波で家を流され、高台に再建しました。

東日本大震災で被災　千葉武二さん
「避難解除になるのを待っていた。東日本大震災はかなりショックだった。家を建てても流された。ここに建てて安心していたときにこういうことがあった」

今回の解除によって避難指示の対象は1481世帯・3639人となりました。（7日午後4時時点）

また、県は2月27日に三陸町綾里地区で見つかった遺体の身元について、この地区に住む柴田吉郎さん・90歳と特定されたことを発表しました。

消火活動が進み避難規模が縮小した一方、7日も鎮圧には至りませんでした。

消火活動は県外からの緊急消防援助隊など約2000人態勢で昼夜を問わず行われています。

市によりますと、防災ヘリで6カ所の熱源が確認されていて、予断を許さない状況が続いています。
岩手めんこいテレビ",[],[]
10万羽に“エサ与えられず”…養鶏場で火の手は免れたが1800羽死ぬ　避難指示の一部解除受け確認　岩手県大船渡市の山火事（岩手めんこいテレビ）,https://news.yahoo.co.jp/articles/4426f0e88d18c3f9db6fd05f59412c8bd7879ad0,https://newsatcl-pctr.c.yimg.jp/t/amd-img/20250307-90021859-nmit-000-2-thumb.jpg?exp=10800,2025-03-07T19:21:02+09:00,2025-03-07T19:47:02+09:00,岩手めんこいテレビ,nmit,岩手めんこいテレビ,456,"岩手めんこいテレビ
大規模な山林火災発生から10日目となった3月7日、岩手県大船渡市は、火の勢いが収まったとして、午前10時に赤崎町の6つの地区の避難指示を解除しました。

避難指示が解除されて15分ほど経ち、サラダチキンなどを製造販売する大船渡市のアマタケの役員などが、すぐに赤崎町後ノ入にある養鶏場の様子を確認しようと、車で向かっていました。

この養鶏場では10万羽の鶏を飼育していて、仮に焼失すると損失は2億円に上るところでしたが、火の手は及んでいませんでした。

しかし、避難指示が出た後5日ほどは水やエサを与えられない状態が続いています。

アマタケ　吉田亨取締役
「状況の把握をしている。鶏がどういう状態にいるのか、1鶏舎1鶏舎それぞれ確認中。エサを与えられなかった時期があるので、どういう影響を及ぼしているのか心配」

感染対策のため鶏舎にカメラは入れませんでしたが、内部では1800羽が死んでいるのが確認され、他の鶏については出荷に向けてエサを食べさせていくということです。
岩手めんこいテレビ",[],[]
「住宅の窓に明かり」避難指示解除の地区から中継　安堵の声の一方でさらなる被害拡大へ不安の声も　岩手県大船渡市の山火事発生から10日（岩手めんこいテレビ）,https://news.yahoo.co.jp/articles/6bf1cbecc695d0ab843ec171403627ec0c85bb55,https://newsatcl-pctr.c.yimg.jp/t/amd-img/20250307-90021858-nmit-000-1-thumb.jpg?exp=10800,2025-03-07T19:16:01+09:00,2025-03-07T19:16:01+09:00,岩手めんこいテレビ,nmit,岩手めんこいテレビ,451,"岩手めんこいテレビ
岩手県大船渡市の大規模な山林火災は発生から3月7日で10日目です。
火の勢いが一部で抑えられたことから、市は一部地域の避難指示を解除しました。

＜避難指示が解除された地域から中継　午後6時15分頃＞

ＦＮＮ取材団　樋口諒記者：
大船渡市赤崎町の山口地区からお伝えします。
後ろに住宅が立ち並んでいますが、住宅の窓に明かりが灯っています。今日から住民に方々が返ってきたんだなと、感じるような光景となっています。

こちらの山口地区は、2月28日から避難指示の対象となっていましたが、7日午前10時に解除されました。

防災無線で避難指示の解除が発表されると、避難所や親戚の家に避難していた人たちが続々と自宅に帰ってきました。

約1週間の避難生活を終えた方々に話を伺うと、「心待ちにしていた」「安心した」と安堵の声が聞かれる一方で、さらなる被害拡大への不安の声も聞かれました。

現在も消火活動は続いていて、いまだ全域での避難指示解除の見通しは立っていません。
岩手めんこいテレビ",[],[]
「悔やんでも悔やみきれない」山火事で犠牲になった男性の遺族が悲痛な胸の内　自宅から県道への上り坂で倒れた状態で発見　岩手県大船渡市（岩手めんこいテレビ）,https://news.yahoo.co.jp/articles/69642456882eecfe5c15db24de418447a42d6afb,https://newsatcl-pctr.c.yimg.jp/t/amd-img/20250307-90021855-nmit-000-2-thumb.jpg?exp=10800,2025-03-07T18:35:01+09:00,2025-03-07T19:08:01+09:00,岩手めんこいテレビ,nmit,岩手めんこいテレビ,655,"岩手めんこいテレビ
岩手県大船渡市の山林火災が発生した翌日の2月27日、市内で男性の遺体が発見されました。
この男性の長男が3月7日、ＦＮＮの取材に応じ「悔やんでも悔やみきれない」と悲痛な胸の内を明かしました。

「ＤＮＡ（鑑定）は父親で断定されて…。悔やんでも悔やんでも悔やみきれないですよね」
こう話すのは大船渡市三陸町綾里の柴田修幸さん・63歳。現在は自宅近くにある避難所に身を寄せています。

同居する90歳の父・吉郎さんは、山林火災が発生した翌日の2月27日、自宅がある小路地区で遺体で発見されました。この山林火災で亡くなりました。

山林火災で父を亡くした柴田修幸さん
「うちの父は足が悪いので歩くのも遅いし、心臓も若干弱い人だった」

柴田さんによりますと、父・吉郎さんは、自宅から県道につながる上り坂で倒れた状態で発見されたということです。警察から伝えられた死因は焼死でした。

山林火災で父を亡くした柴田修幸さん
「（坂を）一生懸命上ろうとしたんだろうけれど、煙か炎に巻き込まれたという感じではないか。自分しか責められない、もうちょっと早く助けに行けたのに…」

最愛の父を亡くした柴田さん。
最後に今回の山林火災に対する行き場のない気持ちを口にしました。

山林火災で父を亡くした柴田修幸さん
「本当にこういうことがあってはならないし、起こしてはならない。（現段階で）犠牲者はうちの父１人なので」

突然失われることになった尊い命。遺族の悲しみが癒えることはありません。
岩手めんこいテレビ",[],[]
「大船渡の山火事」957人対象に避難指示を解除　市が一部解除の理由説明　依然3600人超が避難　岩手県（岩手めんこいテレビ）,https://news.yahoo.co.jp/articles/3e4b69a114b2959cdfa7ef3d5ea8670d07db94ff,https://newsatcl-pctr.c.yimg.jp/t/amd-img/20250307-90021853-nmit-000-1-thumb.jpg?exp=10800,2025-03-07T12:58:01+09:00,2025-03-07T12:58:01+09:00,岩手めんこいテレビ,nmit,岩手めんこいテレビ,597,"岩手めんこいテレビ
岩手県大船渡市の大規模な山林火災は発生から10日目となります。
市は3月7日、火の勢いが収まったとして赤崎町の6つの地区の避難指示を解除しました。

大規模な山林火災の発生から10日目。大船渡市は7日午前10時、赤崎町の一部地域で避難指示を解除しました。

対象となるのは宿、後ノ入、森っこ、大洞、生形、山口の6地区の957人です。
解除を受けて住民からは安堵の声が聞かれました。

避難している住民から
「久しぶりにわが家に帰って、のんびりしたい」
「やっぱり家が心配だからね。泥棒入ってないかとか、風とかで何か飛んでないか」

市は6日、赤崎町と甫嶺地区の一部で避難指示の解除を検討していることを明らかにしていました。

市は7日午前11時の会見で、赤崎町の一部地域で解除した理由について説明しました。

大船渡市　松川伸一防災管理室長
「新たな延焼拡大、今後の延焼の恐れがなくなった」

このほか、これらの対象地域が地上の消火活動に支障をきたさないことも理由として挙げました。

今回の解除によって避難指示の対象は1481世帯3639人となりました。

市によりますと、7日午前6時時点で焼失面積は約2900ヘクタールで延焼の拡大は確認されていません。

消火活動は県外からの緊急消防援助隊など約2000人態勢で引き続き昼夜を問わず行われています。
岩手めんこいテレビ",[],[]
避難指示解除の地区から中継　住民「心待ちにしていた」岩手県大船渡市の山火事（岩手めんこいテレビ）,https://news.yahoo.co.jp/articles/272808b5d4732c4b2f3d0df7d532ad2df143d5e8,https://newsatcl-pctr.c.yimg.jp/t/amd-img/20250307-90021854-nmit-000-2-thumb.jpg?exp=10800,2025-03-07T12:26:02+09:00,2025-03-07T12:35:01+09:00,岩手めんこいテレビ,nmit,岩手めんこいテレビ,414,"岩手めんこいテレビ
岩手県大船渡市の大規模な山林火災は発生から10日目となります。
市は3月7日、火の勢いが収まったとして赤崎町の6つの地区の避難指示を解除しました。

＜避難指示が解除された地域から中継　午前11時40分頃＞

ＦＮＮ取材団　高橋朋弘記者
大船渡市赤崎町の山口地区からお伝えいたします。
こちらは晴れていますが、時折強い風が吹いたり吹雪になったりと、非常に天気が変わりやすくなっています。

こちらの山口地区は2月28日から避難指示の対象となっていましたが、7日午前10時に解除されました。

先ほど、こちらでは防災無線で避難指示の解除が放送されました。

解除を受けて、続々と住民が戻ってきています。
地区の住民からは「心待ちにしていた」「安心した」といった声が聞かれました。

一方で、延焼は抑えられているものの消火活動は続いていて、いまだ全域での避難指示解除の見通しは立っていません。
岩手めんこいテレビ",[],[]
強盗殺人など8つの罪に問われた男の控訴を棄却　仙台高裁　77歳男に二審も無期懲役　岩手県（岩手めんこいテレビ）,https://news.yahoo.co.jp/articles/48884116ae1ac7006b14c02a77040bd08de30613,https://newsatcl-pctr.c.yimg.jp/t/amd-img/20250307-90021847-nmit-000-2-view.jpg?exp=10800,2025-03-07T10:55:01+09:00,2025-03-07T16:29:01+09:00,岩手めんこいテレビ,nmit,岩手めんこいテレビ,423,"岩手めんこいテレビ
2023年、知人の男性を殺害して通帳を奪った強盗殺人などの罪に問われている77歳の男の控訴審で、仙台高等裁判所は3月6日、無期懲役とした一審判決を支持し、控訴を退けました。

判決を受けたのは本籍・盛岡市前九年で無職の佐藤廣明被告（77）です。

佐藤被告は2023年8月、知り合いで無職の佐藤猛さん（当時72）が住む滝沢市のアパートで、猛さんの首を絞めて殺害し、年金を目当てに通帳やはんこを奪った強盗殺人など8つの罪に問われました。

一審で佐藤被告が「気絶させるつもりで殺すつもりはなかった」などと主張したのに対し、盛岡地方裁判所は佐藤被告の殺意を認定、無期懲役の判決を言い渡しましたが、被告側が事実誤認を理由に控訴していました。

6日の控訴審判決で仙台高裁の加藤亮裁判長は「一審の判断に不合理な点はなく正当なものと認められる」などとして、無期懲役とした一審の判決を支持し佐藤被告の控訴を退けました。
岩手めんこいテレビ",[],[]
【速報】花巻東（岩手）は初戦で米子松蔭（鳥取）と対戦　センバツ高校野球（岩手めんこいテレビ）,https://news.yahoo.co.jp/articles/66e2ffcbd62ccd7b2cffd77780b28e4e1ce0217c,https://newsatcl-pctr.c.yimg.jp/t/amd-img/20250307-90021846-nmit-000-3-view.jpg?exp=10800,2025-03-07T10:29:01+09:00,2025-03-07T11:08:02+09:00,岩手めんこいテレビ,nmit,岩手めんこいテレビ,131,"岩手めんこいテレビ
3月18日に開幕する第97回選抜高校野球大会の組み合わせ抽選会が3月7日に行われ、東北地区代表の花巻東高校は、大会1日目の第2試合で、米子松蔭高校（鳥取）と対戦することが決まった。
花巻東のセンバツ出場は、3年ぶり5回目。
岩手めんこいテレビ",[],[]
【速報】大船渡・山火事による赤崎町の一部の避難指示を解除　岩手県大船渡市が発表（岩手めんこいテレビ）,https://news.yahoo.co.jp/articles/8d18a65dd044fe00357f22884124da994dba1c17,https://newsatcl-pctr.c.yimg.jp/t/amd-img/20250307-90021833-nmit-000-1-view.jpg?exp=10800,2025-03-07T10:05:01+09:00,2025-03-07T10:05:01+09:00,岩手めんこいテレビ,nmit,岩手めんこいテレビ,326,"岩手めんこいテレビ
岩手県大船渡市は、3月7日午前10時に山林火災により避難指示が出ていた赤崎町の一部の避難指示を解除した。
避難指示が解除された地域は、宿・後ノ入・森っこ・大洞・生形・山口地域のあわせて957人。

2月26日に発生した今回の山林火災では、綾里地区全域、合足地域、赤崎町の大立・永浜・清水・蛸ノ浦・長崎・外口・宿・後ノ入・森っこ・大洞・生形・山口地域、三陸町越喜来の甫嶺東・甫嶺西・上甫嶺地域のあわせて1896世帯・4596人に避難指示が出されていた。

3月7日午前6時までに確認された焼失面積は約2900ヘクタールに上り、平成以降としては国内最大の山林火災となっている。
また、男性1人の死亡が確認されている。
岩手めんこいテレビ",[],[]
東北新幹線、連結外れの影響続く　下り列車に一部遅れも　秋田新幹線は盛岡～秋田間での折り返し運転に　（岩手めんこいテレビ）,https://news.yahoo.co.jp/articles/3a9b07960fd7cbc5a132b0086e7093ec53e38791,https://newsatcl-pctr.c.yimg.jp/t/amd-img/20250307-90021845-nmit-000-1-view.jpg?exp=10800,2025-03-07T09:42:01+09:00,2025-03-07T09:42:01+09:00,岩手めんこいテレビ,nmit,岩手めんこいテレビ,244,"岩手めんこいテレビ
3月6日午前11時半ごろ、東北新幹線はやぶさ・こまち21号が上野～大宮間で車両の連結が外れるトラブルがあった。

JR東日本によると、この影響で7日以降、原因が判明するまで連結運転が取りやめられ、こまち号は盛岡駅と秋田駅間での折り返し運転となっている。利用者は盛岡駅での乗り換えが必要になる。

また、7日の東北新幹線は、車両手配の影響で、郡山～新青森駅間の下り線の一部列車に遅れが出ていて、JR東日本では臨時列車を出すなどして対応にあたっている。
岩手めんこいテレビ",[],[]
