headline,mainEntityOfPage,image,datePublished,dateModified,author,media_en,media_jp,str_count,body,images,external_links
千曲市が舞台オリジナルアニメ「ターキー」のラッピングバス【長野・千曲市】（テレビ信州）,https://news.yahoo.co.jp/articles/d76b841d3265f878909afa25f0d963ba022a1f5b,https://newsatcl-pctr.c.yimg.jp/t/amd-img/20250308-04519336-tsb-000-3-thumb.jpg?exp=10800,2025-03-08T18:20:00+09:00,2025-03-08T19:31:55+09:00,テレビ信州,tsb,テレビ信州,180,"テレビ信州
千曲市が舞台となっているオリジナルアニメ「ターキー」のキャラクターが描かれたラッピングバスがお披露目されました。

アニメはボウリング部に所属する5人の女子高校生のストーリーで8日のセレモニーには主人公を担当する声優の菱川花菜さんなどが出席しました。

ラッピングバスは市内の循環バスとして月曜日から土曜日の1日6便から7便の運行を予定しています。",[],[]
【速報：３回目の逮捕】長野駅前３人殺傷事件で４６歳の男を殺人容疑で再逮捕　依然黙秘を続ける容疑者【長野】（テレビ信州）,https://news.yahoo.co.jp/articles/90ceb625af4ba4db803d73fa08631e7dc83685d2,https://newsatcl-pctr.c.yimg.jp/t/amd-img/20250308-04932247-tsb-000-3-thumb.jpg?exp=10800,2025-03-08T15:01:00+09:00,2025-03-08T18:22:54+09:00,テレビ信州,tsb,テレビ信州,319,"テレビ信州
今年1月、JR長野駅前で男女3人が殺傷された事件で、すでに2人の殺人未遂の疑いで逮捕されている男について長野県警は8日、亡くなった男性に対する殺人の疑いで再逮捕しました。

殺人の疑いで再逮捕されたのは長野市西尾張部の無職、矢口雄資容疑者46歳です。

矢口容疑者は今年1月22日午後8時ごろ、JR長野駅前で長野市に住む丸山浩由さん当時49歳を刃物で刺し殺害した疑いが持たれています。

この事件で矢口容疑者は重軽傷を負った男女2人に対する殺人未遂の疑いですでに2度、逮捕・送検されていて今回で3回目の逮捕になります。

最初の逮捕から1か月余りが経ちますが、今も矢口容疑者は警察の調べに対して黙秘を続けているということです。",[],[]
八ヶ岳連峰赤岳で男性登山者が滑落して死亡【長野】（テレビ信州）,https://news.yahoo.co.jp/articles/90dff7e44719ee0be7d2de193d2e91c4880c7497,https://newsatcl-pctr.c.yimg.jp/t/amd-img/20250308-09832333-tsb-000-2-thumb.jpg?exp=10800,2025-03-08T12:37:00+09:00,2025-03-08T12:57:52+09:00,テレビ信州,tsb,テレビ信州,180,"テレビ信州
八ヶ岳連峰で７日、登山者が滑落し、その後、死亡が確認されました。

7日正午ごろ、八ケ岳連峰の赤岳で、男性が斜面を滑落したのを目撃したと登山者から警察に通報がありました。

県警のヘリが出動して、標高2500メートル付近の斜面で男性を発見し、その後諏訪市内の病院に搬送しましたが、死亡が確認されました。

男性は単独で入山していたとみられています。",[],[]
水道官更新…DXで作業効率化【長野・松本市】（テレビ信州）,https://news.yahoo.co.jp/articles/8a3d1344ea2e8964c308b42eabe74e1baf727545,https://newsatcl-pctr.c.yimg.jp/t/amd-img/20250308-08451312-tsb-000-2-thumb.jpg?exp=10800,2025-03-08T12:29:00+09:00,2025-03-08T15:18:48+09:00,テレビ信州,tsb,テレビ信州,263,"テレビ信州
全国で水道管の老朽化が問題となっていますが、松本市ではデジタル技術を活用してメンテナンス作業の効率化を図る取り組みが始まりました。

松本市は７日、東京のシステム開発会社NSDとDX＝デジタル技術を活用した変革を推進する協定を結びました。

市の上下水道局に人材を派遣してDXを進めることで、メンテナンス作業の効率化を目指します。

【松本市 臥雲義尚市長】
「老朽化が進む管路の更新や施設の耐震化といったこれから非常に経費のかさむ課題を抱えています相互に協力をして、持続可能な質の高いサービスを提供していきたい」",[],[]
【速報】降雪予報で8日午後から「あずさ」や「かいじ」など中央東線の特急列車を計画的な運休【長野】（テレビ信州）,https://news.yahoo.co.jp/articles/07a25f4d77c502e36be78587a9573d2cc659ec12,https://newsatcl-pctr.c.yimg.jp/t/amd-img/20250308-06764175-tsb-000-5-thumb.jpg?exp=10800,2025-03-08T11:48:00+09:00,2025-03-08T18:23:50+09:00,テレビ信州,tsb,テレビ信州,136,"テレビ信州
JR東日本は、関東・甲信地方での降雪予報に伴い、8日午後から、中央東線の特急列車の計画的な運休を決めました。上りは、午後3時すぎに松本を出発する特急あずさから終日運休。下りは、午後4時以降に新宿や東京を出発する特急あずさやかいじを終日運休にするということです。",[],[]
