headline,mainEntityOfPage,image,datePublished,dateModified,author,media_en,media_jp,str_count,body,images,external_links
大谷翔平選手から贈られたグローブも披露　福島県内の小学校で3学期の始業式　（福島中央テレビ）,https://news.yahoo.co.jp/articles/d12b507861c0a44ed5304851e3dc409d7ca2630c,https://newsatcl-pctr.c.yimg.jp/t/amd-img/20240109-06319725-fct-000-3-thumb.jpg?exp=10800,2024-01-09T16:18:00+09:00,2024-01-09T19:07:16+09:00,福島中央テレビ,fct,福島中央テレビ,700,\nFCT福島中央テレビ\nこの日を待ちに待っていた子どもたちも少なくないかもしれません。\n福島県内のほとんどの小中学校で新学期が始まり、始業式ではメジャーリーグ・ドジャースの大谷翔平選手からのあのプレゼントが披露されました。\n\n須賀川市立第二小学校の始業式です。\n新学期が始まり児童が冬休みに頑張ったことや3学期の抱負を発表しました。\n■児童代表 3年の國玉 櫂斗くん\n「僕は2重跳びが苦手なので跳べるように何回も練習をしました。手を早く回すのが難しくて、冬休み中に跳ぶことができませんでした。これからも練習を続けて3学期には跳べるようにしたいです。」\n\n式を終えると、もう一つとても大きなイベントが待っていました。\n校長先生から子どもたちにお披露目されたのが…\n\n■松山祐介校長\n「ここに並んでいる3つのグローブが大谷選手から贈られてきたグローブ」\n\nメジャーリーグ・ドジャースの大谷選手が日本国内の小学校、約2万校に3個ずつ贈ったグローブです。\n\n■校長\n「大事に使ってください」\n■児童\n「ありがとうございます。大切に使います」\n\n早速、代表の6年生2人がキャッチボールをして楽しみました。\n\n■キャッチボールをした児童\n「うれしいし、将来の夢への気持ちがどんどん変わっていって次はメジャーリーガーになりたいと思った」\n\n■グローブを手にした児童\n「サイン書いてあってかっこいい。みんなで仲良く楽しんで使いたい」\n\n大谷選手から子どもたちへの大きなプレゼント。\nグローブは休み時間や体育の授業などにみんなで使っていくということです。,[],[]
今度は人気チーズタルトをドリンクに　「酪王檸檬オレ」発表会（福島中央テレビ）,https://news.yahoo.co.jp/articles/e87d886993c30efb0418b2678b0b5e825f987395,https://newsatcl-pctr.c.yimg.jp/t/amd-img/20240109-03947651-fct-000-2-thumb.jpg?exp=10800,2024-01-09T17:12:00+09:00,2024-01-09T19:19:15+09:00,福島中央テレビ,fct,福島中央テレビ,299,\nFCT福島中央テレビ\n福島のソウルドリンク「酪王カフェオレ」シリーズの第10弾です。酪王協同乳業と老舗の柏屋が手を組み「酪王檸檬オレ」を発表しました。\n\n柏屋の人気商品チーズタルトの「檸檬」の味をドリンクで表現したものです。\n\n檸檬と同じ、フランス産のクリームチーズ「キリ」を使い、濃厚かつ、爽やかなレモン風味が味わえます。\n\n■柏屋 本名 創社長\n「タルト感が鼻から抜けてくるのをドリンクで再現できるのは非常に驚きで、美味しいと思うので、本物の檸檬と比べながら味わって欲しい」\n\nあすから一部の柏屋で先行販売され、1月15日から福島県内のスーパーやコンビニで販売されます。,[],[]
「どこでも起こりうる事故」郡山市の4人死亡事故から1年　必要な事故防止対策は（福島中央テレビ）,https://news.yahoo.co.jp/articles/3cbeae5a6977b31f838a31431add444d039890d6,https://newsatcl-pctr.c.yimg.jp/t/amd-img/20240109-05259824-fct-000-4-thumb.jpg?exp=10800,2024-01-09T16:33:00+09:00,2024-01-09T19:03:18+09:00,福島中央テレビ,fct,福島中央テレビ,1504,\nFCT福島中央テレビ\n郡山市の交差点で車同士が衝突し、一家4人が亡くなった事故から1年が経ちました。事故を受けて対策の動きも広がるなか、二度と悲惨な事故が起きないために改めて考えます。\n\n■川上耕平記者\n「郊外交差点で車同士が衝突し、一家4人が亡くなる事故から1年です。事故発生から1年となるこの日、現場には多くの花が手向けられています」\n\n突然の悲劇に辺りは悲しみに包まれました。\n2023年の1月2日、郡山市の交差点で優先道路を走る軽乗用車に普通乗用車が衝突。軽乗用車が横転し炎上しました。\n\n橋本 貢さん（享年41）妻の美和さん（享年39）長男の啓吾さん（享年20）長女の華奈さん（享年16）、突然4人の尊い命が奪われました。\n\n毎年、家族4人でキャンプに行くなど仲の良い家族でした。\n何もなければことしも…\n\n一方、乗用車を運転していた20代の男には、過失運転致死の罪で禁錮3年の実刑判決が言い渡されました。\n\n人生を大きく狂わせる交通事故。\n時間がたっても遺族は癒えることのない痛みを抱えたままです。\n\n■遺族\n「去年の正月に家族4人で遊びに来てくれて、大きな声でバイバイと手を振ってくれた最後の姿がいまも頭から離れません」\n■遺族\n「毎朝、4人の遺影を見るたび、いなくなってしまったと思い続けた1年で、いまも苦しいです。これからの人生だったのに、可哀相すぎる4人が」\n\nなぜ事故は起きてしまったのか…？\n現場は、白線が消えかかり「交差点を見落としやすい」状況だったことがわかりました。\n\n交通心理や自動車の安全などを研究する九州大学大学院の志堂寺教授に伺うと…\n■交通問題に詳しい九州大学大学院 志堂寺和則教授\n「ある意味では日本どこでも起こりうる事故。日本の特に地方なんかでは舗装が古くなっていて路面のペイントなんかも薄くなっているところも多い」\n\n事故の再発防止へ求められるのがハード面の整備です。\n郡山市では現場には白線が引き直され一時停止の規制が設けられました。\nまた市内の200か所近い交差点にカーブミラーを設けるなど対策工事を終えています。\n\nこうした動きは別の自治体でも…\n\n■川上耕平記者\n「郡山市の4人死亡事故を受けて、隣の本宮市でも交差点前の消えかかった路面標示を塗り直すなど対策を進めているということです」\n「同じような事故は本宮市内でも起こりうる」と独自で対策を進めています。\n\n■本宮市役所建設課・渡辺忠一課長\n「大変痛ましい事故を受けまして2月中旬に市が管理する市道の中で見通しが悪く、事故の発生が懸念される交差点などの区画線や一時停止線などの点検を実施した」\n\n福島県警の調査も進められ、福島県内の交差点2030か所で事故が発生する恐れがあることがわかりました。今年度中に約350か所で交通規制などの対策をとる方針です。\n\n一方で事故を防ぐためには、ハード面の整備だけでは十分ではないと専門家は話します。\n\n■志堂寺和則教授\n「いくらハードを良くしても利用するドライバーの方が意識を高めていかないと全く何の役にも立たない。『ここ交差点だな』と意識しやすくなったので、それに合わせて少しスピードを落とすなど運転行動も改善していくのが大事です。」\n\n悲惨な事故から1年。\n愛する人との突然の別れに見舞われた遺族が、訴えかけます。\n\n■遺族\n「ほんのちょっとの偶然で交通事故は誰でも起こし、巻き込まれるものと感じます。少しでもなくなればいいと思っています。」,[],[]
わが街のとっておき　福島県のおすすめは冬にピッタリな常磐ひらめの天丼とあんこう鍋（福島中央テレビ）,https://news.yahoo.co.jp/articles/3e95e065d9d303b9cb657d1c9058ca61fca251af,https://newsatcl-pctr.c.yimg.jp/t/amd-img/20240109-06777422-fct-000-1-thumb.jpg?exp=10800,2024-01-09T17:06:00+09:00,2024-01-09T17:06:00+09:00,福島中央テレビ,fct,福島中央テレビ,1849,\nFCT福島中央テレビ\n北海道・東北・新潟の日本テレビ系列各局が取材した「この冬おすすめ！わが街のとっておき」をお届けします。福島県からは、この時期にピッタリな常磐ものです。\n\n■今野花織アナウンサー\n「福島県いわき市からご紹介するのは今まさに旬を迎えた常磐ものの冬の味覚です。」\n\n「常磐もの」と呼ばれる福島県沖の魚介類。\n福島の海は暖流の黒潮と寒流の親潮がぶつかる「潮目」となっていて、魚のエサとなるプランクトンが多く発生する豊かな漁場です。\n2023年福島第一原発で処理水の海洋放出が始まりましたが、海水や魚介類から問題のある値は出ておらず、「常磐もの」への応援やその魅力を伝える動きが広がっています。\n\nまずは、JRいわき駅直結「S-PALいわき」にある「前濱食堂ヤマコ」へ。\n創業100年以上の老舗鮮魚店が2023年にオープンさせた鮮度抜群の「常磐もの」が味わえるお店です。いまの一押しは…\n■店員\n「お待たせいたしました、常磐ひらめ天丼です。」\nこれでもか、といわんばかりに「常磐もの」のヒラメの天ぷらなどが乗った豪快な天丼！「まるごと常磐ひらめの天丼」は税込3000円です。\n\n■今野アナウンサー\n「この後ろの蓋で大きなひらめの天ぷらを支えています。」\n気になる味は…\n■今野アナウンサー\n「ふわっふわです。こんなに大きくて重量感あるのに意外とさっぱり食べられます。」\n■大川魚店 前濱食堂ヤマコ 大川 勝正 代表取締役社長\n「この辺で獲れるひらめは結構身がしっかりしていて、お刺身にしてもいいし、天ぷらとかにすると今度はふわっとするんです。」\n\nこう話す鮮魚店の社長の大川さんが飲食店を開いたワケは…。\n■大川 勝正社長\n「処理水が放出されるってところで、福島の魚のイメージが悪くなるかなと思ったので、直接お客様に食べてもらって福島の魚は美味しいんだってアピールしたいなって。」\n\n福島の「常磐もの」の味をたくさんの人に伝えたい…という思いがありました。\n■大川 勝正社長\n「福島を応援しなきゃいけないと思って京都からのお客さまとか、あと岡山とかから来てくださったお客さまとか…」\n\n福島県内外からの支援に応え、これからも「常磐もの」の魅力を広めていきます。\n■大川 勝正社長\n「ひらめとか、かれいとか、あんこうとか、目光とかホッキ貝とかあるんですけど、皆さんおいしい魚を販売しているので ぜひ実際食べていただきたい。」\n\n\n続いては大川さんもすすめる魚料理を求め、いわき市小名浜の日本料理店「いわき七浜」へ。こちらで味わえるのが…\n■いわき七浜 佐藤 譲店主\n「最近あんこう鍋の予約すんごいんですよ。きょうも2組入ってる。」\n\n11月ごろから、連日予約でいっぱいという今が旬のあんこう鍋です！\n■今野アナウンサー\n「ありがとうございます。いっぱいのってますね。」\nあんこうは、捨てる部位がほとんど無く、鍋はその魅力を存分に楽しめます。味は…。\n\n■今野アナウンサー\n「いただきます、本当にクリーミーでまろやかなスープです。」\n味付けは、特製のみそにあん肝とゴマペーストを合わせて、濃厚なうま味をぐっと凝縮。もちろん、あんこうの身も…\n■今野アナウンサー\n「ほろほろで淡白で上品な美味しい身です。」\nさらに、あん肝は…。\n■今野アナウンサー\n「もう口に入れた瞬間とろけていきますね。」\n\nまさに、あんこうの魅力を余すことなく、味わえます。\n\n■ 佐藤 譲店主\n「まずこの時期になると、肝にすごい脂がのってくるんで、やっぱりこの味噌との相性で寒い時に温まるっていうのが特徴です。」\n\n店主の佐藤さん、処理水の海洋放出に不安があったそうですが、県外のお客さんからこんな嬉しい言葉が…。\n\n■佐藤 譲店主\n「こんなに美味しいものをなんでみんな食べないんだ、僕もっと地元に帰って広めますよ…なんて方もいらっしゃって、ほんとありがたいですね。」\n\n福島の「常磐もの」に誇りと自信をもって、これからも魅力を伝え続けます。\n■佐藤 譲店主\n「本当に美味しいんですけど、まだまだ知らないお客さんとか、知らない方多いんで、もっともっと召し上がってもらいたいなと思いますね。」\n\n福島県いわき市からお伝えした、この冬おすすめの常磐もの、是非味わってみてください。,[],[]
福島県家畜市場で子牛の初競り　繁殖農家は高値に取引に期待（福島中央テレビ）,https://news.yahoo.co.jp/articles/c038cf976e57d93084dcf099c2686a39dd74a299,https://newsatcl-pctr.c.yimg.jp/t/amd-img/20240109-07167914-fct-000-1-thumb.jpg?exp=10800,2024-01-09T15:23:00+09:00,2024-01-09T15:23:00+09:00,福島中央テレビ,fct,福島中央テレビ,325,\nFCT福島中央テレビ\n本宮市にある福島県家畜市場で和牛の子牛の初セリが行われました。\n\n本宮市の家畜市場でJA全農福島の子牛の競りが始まりました。\n\n繁殖農家が育てた生後10ヶ月ほどの和牛、約400頭が競りに掛けられ、落札した肥育農家が2年ほど育て食肉用に出荷します。\n\n2023年は飼料などが高騰する中、物価高で、消費者が牛肉を買い控えたこともあって取引価格が落ち込みましたが、初競りでは高値の取引もありました。\n\n■家畜セリ市場 小松良雄場長\n「和牛肉、普通の量販店で並べてもらって皆んなが食べられるという、そうすると相場も戻ってきますし、おいしい和牛しっかりみんなで食べて頂きたい。」\n\n子牛のセリは毎月開かれます。,[],[]
「県民と共に新たな治安の形を作り上げていく」福島県警察本部が仕事始め式（福島中央テレビ）,https://news.yahoo.co.jp/articles/5abb7a6ceeb062ca3198b52d4f9ff32ca0801df8,https://newsatcl-pctr.c.yimg.jp/t/amd-img/20240109-06136259-fct-000-2-thumb.jpg?exp=10800,2024-01-09T12:08:00+09:00,2024-01-09T12:32:18+09:00,福島中央テレビ,fct,福島中央テレビ,281,\nFCT福島中央テレビ\n福島県警察本部が仕事始め式を行いました。\n\n福島市の県警察本部で行われた「仕事始めの式」には、幹部職員53人が参加しました。\n若田英本部長が能登半島地震の犠牲者に哀悼の意を表したあと、職員に訓示しました。\n\n■県警察本部・若田英本部長\n「県民の皆様と共に力を合わせて新たな治安の形を作り上げていくことを意識し、福島を支える力強い警察という基本姿勢に沿った業務を推進願いたいと思う」\n\n福島県警は、石川県輪島市に災害救助の専門部隊・広域緊急援助隊30人を派遣していて、引き続き被災者の救助や捜索支援にあたるとしています。,[],[]
富山県氷見市に福島県職員約20人派遣　広域避難受け入れに向け復興公営住宅の準備も（福島中央テレビ）,https://news.yahoo.co.jp/articles/343e7e366f001e7fe20dab9f450cd2b6912bf3c2,https://newsatcl-pctr.c.yimg.jp/t/amd-img/20240109-06772414-fct-000-1-thumb.jpg?exp=10800,2024-01-09T12:09:00+09:00,2024-01-09T12:09:00+09:00,福島中央テレビ,fct,福島中央テレビ,278,\nFCT福島中央テレビ\n能登半島地震を受け、福島県は富山県氷見市に職員を派遣し、家屋被害の調査などを支援します。\n\n県は能登半島地震の被災地に対し、1月9日時点で58人の医師や看護師らを派遣し医療支援に当たっています。\n\n1月12日からは富山県氷見市に県職員20人程度を派遣し、罹災証明書の受付や家屋被害調査などを支援します。\n\n■内堀知事\n「被災された皆さんが1日も早く安心して生活できるよう、福島県をあげて支援していく」\n\nまた広域避難の受け入れに向け、避難を希望する人が県営住宅や復興公営住宅へ入居できるよう準備を進めています。,[],[]
被告の兄に懲役1年執行猶予3年の有罪判決　相馬市の家に弟の遺体を遺棄【福島県】（福島中央テレビ）,https://news.yahoo.co.jp/articles/14f1a6bc471766c2a2b294471cb22d2dcc4ad938,https://newsatcl-pctr.c.yimg.jp/t/amd-img/20240109-03754537-fct-000-1-thumb.jpg?exp=10800,2024-01-09T12:07:00+09:00,2024-01-09T12:07:00+09:00,福島中央テレビ,fct,福島中央テレビ,277,\nFCT福島中央テレビ\n相馬市で弟の遺体を遺棄した男に、福島地方裁判所は執行猶予付きの有罪判決を言い渡しました。\n\n死体遺棄の罪で判決を受けたのは仙台市の無職・岩崎祐二被告(54)です。\n判決によりますと岩崎被告は2021年10月から2022年の1月ごろまでの間に、相馬市で同居していた弟の安伸さんが死亡していたのを知りながら放置し、引っ越しました。\n\n検察が懲役1年を求刑するなか、三浦隆昭裁判官は「生活に困窮していたとしても身勝手な動機」としたうえで「反省の態度を示している」と、岩崎被告に懲役1年、執行猶予3年の判決を言い渡しました。,[],[]
