headline,mainEntityOfPage,image,datePublished,dateModified,author,media_en,media_jp,str_count,body,images,external_links
静岡県内の医療現場、働き方改革に実感　看護師らへタスクシフト【医師の残業規制5カ月】（静岡新聞DIGITAL）,https://news.yahoo.co.jp/articles/b1a4dcc84d49f8023037b9611cb3b1150a6cb790,https://newsatcl-pctr.c.yimg.jp/t/amd-img/20240913-00000004-at_s-000-1-view.jpg?exp=10800,2024-09-13T08:09:00+09:00,2024-09-13T08:09:00+09:00,静岡新聞DIGITAL,at_s,あなたの静岡新聞,1312,\n御室総一郎医師（左）に患者の管理について話す特定看護師の福井千佳さん。医師の働き方改革を進める上で特定看護師への期待は大きい＝7月、浜松市中央区の浜松医科大付属病院（写真の一部を加工しています）\n勤務医の残業時間の上限を規制する「医師の働き方改革」が4月から始まり、静岡県内の医療機関では医師業務の一部を他職種に任せる「タスクシフト」「タスクシェア」が加速する。医療者からは、チーム医療によって医療の質や安全性の高まりを実感する声が出ている。一方で、業務が拡大する職種の人手不足や新たなリスクへの対応など課題も多く、医療現場で模索が続く。\n\n 「必要な場面で呼んでもらえるので当直で休息が取れるようになった。より大事な業務にも注力できる」。浜松医科大付属病院集中治療部長の御室総一郎医師は、一部の医療行為が可能な「特定看護師」の活躍で働き方の変化を実感する。\n\n 同病院では、特定看護師が医師の手順書に沿って体外式ペースメーカーのリード抜去や人工呼吸器の設定条件変更などの「特定行為」を進めている。特定看護師が入院患者の急変前に介入する体制も構築。39人が当番制で1日2回全病棟を見回り、患者が急変する前兆を発見して集中治療室へ送っている。特定看護師の福井千佳さんは「医師が取り込んでいる際は、特定行為によって患者に苦痛を与える時間が短くなる」とも話す。\n\n 昨年12月からは、事務職員が担っていた夜間や休日の救急外来電話にも対応し、患者を適切な診療科につなげている。御室医師は「（特定看護師から）必要な情報が届くようになり、医療行為の相談もできるため診療の質や安全性につながっている」と考える。\n\n 一方で、院内全体として医師の長時間労働を是正するためにも、特定看護師の数や特定行為の数は一層増やす必要があるという。同病院看護キャリア開発センターの延沢由衣副看護師長は「部署によって特定行為の理解に差がある。特定看護師の部署内での主体性も重要になる」と課題を挙げる。\n\n 県立総合病院（静岡市葵区）でも、薬剤師ががん患者から診察前に副作用などを聞き取って医師に処方提案をしたり、診療放射線技師が心臓カテーテルの検査・治療で医師の補助に入ったりと多職種連携が進む。だが、医師以外の職種も余力はなく、人員補充の必要性が高まっている。さらに放射線技師室の中村元哉技師長は「侵襲的な業務も認められるようになり、新たなリスクへの継続的な教育と院内、患者からの信頼獲得も重要になる」と強調する。\n\n ＜メモ＞医師の働き方改革は医師の残業時間の上限を年960時間とし、地域医療の確保や医療技能の向上が必要な場合は、医療機関が都道府県の指定を受けて例外として年1860時間の上限が適用される。医療機関に適用される水準によっては、年1860時間の上限は2035年度末で終了する予定。国は医師の長時間労働の是正に向けた取り組みの一つとして、医師から他の医療職へのタスクシフトやタスクシェアを推進している。各職種でタスクシフトやタスクシェアが可能な業務例を示し、法改正によって可能になった業務もある。\n静岡新聞社,['https://newsatcl-pctr.c.yimg.jp/t/amd-img/20240913-00000004-at_s-000-1-view.jpg?pri=l&w=640&h=426&exp=10800'],['https://news.yahoo.co.jp/articles/b1a4dcc84d49f8023037b9611cb3b1150a6cb790/images/000']
【速報】強制不妊、県内2訴訟の和解成立（静岡新聞DIGITAL）,https://news.yahoo.co.jp/articles/413f3739946b13ab7bffc81061c568fab5e10915,https://newsatcl-pctr.c.yimg.jp/t/amd-img/20240913-00000005-at_s-000-2-view.jpg?exp=10800,2024-09-13T15:51:00+09:00,2024-09-13T16:32:47+09:00,静岡新聞DIGITAL,at_s,あなたの静岡新聞,139,\n東京高裁に向かう浜松訴訟原告の武藤千恵子さん（中央右）と弁護団＝13日午後、東京・霞が関\n旧優生保護法下で不妊手術を強制されたのは憲法違反として、県内の女性2人がそれぞれ国に損害賠償を求めた訴訟は13日、いずれも東京高裁で和解が成立した。国が和解金を支払う。\n静岡新聞社,['https://newsatcl-pctr.c.yimg.jp/t/amd-img/20240913-00000005-at_s-000-2-view.jpg?pri=l&w=640&h=407&exp=10800'],['https://news.yahoo.co.jp/articles/413f3739946b13ab7bffc81061c568fab5e10915/images/000']
深海からエビどっさり　聖地沼津・戸田でトロール漁解禁（静岡新聞DIGITAL）,https://news.yahoo.co.jp/articles/2901381c4ada9b84f1155351931c0d948f6f7267,https://newsatcl-pctr.c.yimg.jp/t/amd-img/20240913-00000003-at_s-000-2-view.jpg?exp=10800,2024-09-13T07:45:00+09:00,2024-09-13T08:50:54+09:00,静岡新聞DIGITAL,at_s,あなたの静岡新聞,439,\n水揚げされたエビを仕分けする関係者ら＝沼津市戸田\n“深海魚の聖地”と呼ばれる沼津市戸田で12日、今季のトロール（底引き網）漁が始まり、深海に生息するエビや魚が水揚げされた。今後、特産のタカアシガニも狙う。\n\n 同日午前3時ごろ、底引き網船6隻が戸田漁港を出発。午後2時ごろから続々と帰港した。漁港から1時間ほどの田子沖で、深さ300メートル地点にいるエビを狙って漁をした日の出丸は、本エビ300キロ、カサゴとメギス40キロ、アカザエビとタコ10キロをそれぞれ取った。日の出丸に乗り込んだ大村真史さん（47）は「禁漁期間を経て、エビが育っていてほっとした」と安堵（あんど）の表情を浮かべ、「今年はタカアシガニの大きさの記録を更新したい」と意気込んだ。\n\n トロール漁は、片側1400～1600メートルのロープの先に袋状の網を付け、海底を引くようにして魚介類を捕獲する漁法。水揚げされた深海魚は地元の飲食店や沼津魚市場に出荷する。漁期は来年5月中旬まで。\n静岡新聞社,['https://newsatcl-pctr.c.yimg.jp/t/amd-img/20240913-00000003-at_s-000-2-view.jpg?pri=l&w=640&h=488&exp=10800'],['https://news.yahoo.co.jp/articles/2901381c4ada9b84f1155351931c0d948f6f7267/images/000']
富士山夏山シーズンの遭難死、静岡県側は6人　過去5年で最多　前年比4人増（静岡新聞DIGITAL）,https://news.yahoo.co.jp/articles/866be25901f17d1454d46afb9974067ac07cf744,https://newsatcl-pctr.c.yimg.jp/t/amd-img/20240913-00010002-at_s-000-1-view.jpg?exp=10800,2024-09-13T08:01:31+09:00,2024-09-13T08:01:31+09:00,静岡新聞DIGITAL,at_s,あなたの静岡新聞,990,\n夏山シーズンの遭難死は過去5年で最多\n富士山の開山期（7月10～9月10日）、静岡県側の遭難による死者数は前年比4人増の6人に上ったことが、12日までの県警のまとめで分かった。負傷者も9人増の27人で、いずれも過去5年で最も多かった。\n 悪天候に見舞われた開山初日から2日目までに、死者が3人に上った。気温が低い状況下で、無理に入山する登山者が多かったことが影響したとみられる。\n 静岡県警地域課によると、負傷なし（31人）を含めた遭難者数は計64人（前年同期比6人減）で、遭難件数は53件（同10件減）。いずれも3分の1以上を外国人が占めた。遭難者のうち最も多い理由は転倒で27人。うち26人が下山中だった。高山病や持病などの病気が18人、道迷い8人と続いた。\n 今年は開山直前の6月下旬、閉山期に入山した3人の遺体が火口内で見つかった。うち2人は厳冬期に登って滑落したとみられ、雪の影響で長期の間、発見が困難になっていた。\n山岳遭難、水難事故は前年比減\n山岳遭難、水難事故は前年比減\n​ 県警地域課によると、山岳遭難者数は73人（前年同期比12人減）で、富士山の57人（同7人減）に続き南アルプスが11人（同4人増）。7～8月の期間は5人だった富士山を除いた死者数は2人で、いずれも南アルプスで8月中旬、登山道から外れた崖の下と、そこから数百メートル離れた場所で倒れているのをそれぞれ発見された。\n 態様別では、転倒の27人に次いで病気18人、道迷い11人が多かった。県外と国外の遭難者が全体の約9割を占めた。富士山の遭難者に特化すると、外国籍は19人で、全体（57人）の3割超を占めて過去最多となった。軽装も例年並みに目立ったが、外国人に限った傾向ではなかったという。\n 水難事故発生の内訳は海が8件減の12件で、河川と「湖・沼・池など」がいずれも2件増の3件ずつ。事故者（18人）の割合は県内と県外で半数。死者は1人増の7人で、海が3人、河川と「湖・沼・池など」が各2人だった。いずれもライフジャケットを着用していなかったとされる。\n 秋の行楽期も南アルプスなどで遭難の発生が予想される。鈴木光弘地域部長は「日没が早くなり、道迷いにも注意が必要。体力に合わせた無理のない計画や万全な装備などを徹底し、天候不良時は勇気ある下山の決断を」と求めている。,"['https://newsatcl-pctr.c.yimg.jp/t/amd-img/20240913-00010002-at_s-000-1-view.jpg?exp=10800', 'https://newsatcl-pctr.c.yimg.jp/t/amd-img/20240913-00010002-at_s-001-1-view.jpg?pri=l&w=387&h=640&exp=10800']","['https://news.yahoo.co.jp/articles/866be25901f17d1454d46afb9974067ac07cf744/images/000', 'https://news.yahoo.co.jp/articles/866be25901f17d1454d46afb9974067ac07cf744/images/001']"
浜松茶活用メニュー、グランプリは「茶ル茶ルチキン南蛮丼」　常葉大浜松で審査　10月から販売へ（静岡新聞DIGITAL）,https://news.yahoo.co.jp/articles/d8d0e41f8176536478162858c26f8df05d0c9a6a,https://newsatcl-pctr.c.yimg.jp/t/amd-img/20240913-00010001-at_s-000-1-view.jpg?exp=10800,2024-09-13T07:44:53+09:00,2024-09-13T07:44:53+09:00,静岡新聞DIGITAL,at_s,あなたの静岡新聞,460,\n浜松産の茶を使った料理を作る学生＝浜松市浜名区の常葉大浜松キャンパス\n浜松市で11月に開催される「全国お茶まつり静岡大会」のPRの一環で10日、浜松産の茶を活用したメニューコンテストが常葉大浜松キャンパス（浜名区）で開かれた。同大2年の堀川耀生さんと赤堀光さんの「茶ル茶ルソースのチキン南蛮丼」がグランプリを獲得。10月中旬から浜名湖サービスエリア（SA）で販売されることになった。\nグランプリを獲得した「茶ル茶ルソースのチキン南蛮丼」\n同大健康プロデュース学部健康栄養学科の学生が対象で、個人・団体28組の応募の中から書類審査を通過した6組のメニューを審査した。グランプリは、粉末茶を使ったタルタルソースをたっぷりかけたチキン南蛮丼。このほか、肉やご飯などに煎茶や茶葉を混ぜるなどしたハンバーグやタコライス、かき揚げ丼などが登場した。\n 茶葉を活用したしょうが焼きを手がけた3年の古田莉羅さん（21）は「長距離運転手の方のためにボリュームのある料理を作ろうと思った。初めての経験ですごく緊張した」と語った。,"['https://newsatcl-pctr.c.yimg.jp/t/amd-img/20240913-00010001-at_s-000-1-view.jpg?pri=l&w=640&h=426&exp=10800', 'https://newsatcl-pctr.c.yimg.jp/t/amd-img/20240913-00010001-at_s-001-1-view.jpg?pri=l&w=640&h=491&exp=10800']","['https://news.yahoo.co.jp/articles/d8d0e41f8176536478162858c26f8df05d0c9a6a/images/000', 'https://news.yahoo.co.jp/articles/d8d0e41f8176536478162858c26f8df05d0c9a6a/images/001']"
富士宮やきそばに〝進化形〟　その名も「パエリやきそば」　商店主ら組合が新味開発（静岡新聞DIGITAL）,https://news.yahoo.co.jp/articles/47d0e311d28f2b08ee5d0510ed6a6d8fabccc385,https://newsatcl-pctr.c.yimg.jp/t/amd-img/20240913-00010000-at_s-000-2-view.jpg?exp=10800,2024-09-13T07:15:39+09:00,2024-09-13T09:12:57+09:00,静岡新聞DIGITAL,at_s,あなたの静岡新聞,908,\nパエリやきそばを食べながら展開を話し合う増田恭子さん（左）と峰亜由美さん＝9月上旬、富士宮市大宮町\n長らくB級グルメ界の中心にいる「富士宮やきそば」に〝進化形〟誕生の兆しが出ている。その名も「パエリやきそば」。スペイン料理の代表格パエリアのように魚介のうまみを押し出す一皿を、富士宮市の商店街の店主らでつくる企業組合「食のひらめき会」が開発した。増田恭子代表（75）は「慣れ親しんだソース味に変化をつける新提案」と、富士宮の新名物へと名乗りを上げる。\nパエリやきそばの一例\nパエリやきそばは、富士宮やきそばの定義でもある市内4社製造の硬い蒸し麺を使用する。麺を炒める過程で、イカやエビなどの魚介とトマトでとったスープ、サフランを加え蒸し焼きにし、レモンをさっと搾って仕上げる。魚介の深い味わいが強く主張し、ほどよい酸味とスパイスの香りが食欲をかき立てる。\n 開発のきっかけは、同市が東京五輪で空手スペイン代表チームのホストタウンを務めたことだった。増田さんは同国カタルーニャ地方のパスタ・パエリア「フィデウア」から着想を得たという。富士宮と同国の友好の証しとなる商品開発に向け、ひらめき会は昨秋から焼きそばとの親和性について研究を重ねてきた。\n9月中に飲食店での提供が始まる。同市大宮町の「ジャズと喫茶フィガロ」がレギュラーメニューに加える。同店の峰亜由美さん（51）は「独特の硬い蒸し麺はふやけにくく、スープを吸わせるパエリアに向いている」と手応えを語り、「吸わせ具合や具材選びで各店の個性が出るだろう」と、波及の可能性をみる。\n 富士宮やきそばは観光客に圧倒的な人気を誇り、市内各店の昼時は行列ができる。一方、市民は「自分の好みで焼いた方がおいしい」と言うほどにやきそば文化が成熟している。パエリやきそばは市販のパエリアのもととシーフードミックスでも代用できる。峰さんは「米のパエリアより手軽。家庭の昼食にも適している」という。\n 富士宮の食文化をけん引してきた焼きそばは、盤石が故に新名物誕生の壁となってきた。増田さんは「王道は王道で末永く。一方で工夫を楽しむ時代が来ても良いのでは」と話す。,"['https://newsatcl-pctr.c.yimg.jp/t/amd-img/20240913-00010000-at_s-000-2-view.jpg?pri=l&w=640&h=426&exp=10800', 'https://newsatcl-pctr.c.yimg.jp/t/amd-img/20240913-00010000-at_s-001-2-view.jpg?pri=l&w=480&h=640&exp=10800']","['https://news.yahoo.co.jp/articles/47d0e311d28f2b08ee5d0510ed6a6d8fabccc385/images/000', 'https://news.yahoo.co.jp/articles/47d0e311d28f2b08ee5d0510ed6a6d8fabccc385/images/001']"
白い花穂　風になびきふわり　伊豆シャボテン動物公園でパンパスグラス見頃（静岡新聞DIGITAL）,https://news.yahoo.co.jp/articles/a119a11ea553b9cd45d92ec9f5f7f14c39d3ef2c,https://newsatcl-pctr.c.yimg.jp/t/amd-img/20240913-00000001-at_s-000-2-view.jpg?exp=10800,2024-09-13T07:30:00+09:00,2024-09-13T08:29:50+09:00,静岡新聞DIGITAL,at_s,あなたの静岡新聞,288,\n大室山を背景に、風に揺れるパンパスグラス＝伊東市の伊豆シャボテン動物公園\n伊東市富戸の伊豆シャボテン動物公園で、パンパスグラスが見頃を迎えた。伊豆高原のランドマークである大室山を背景に、ふさふさとした白い羽毛状の花穂を風になびかせている。9月いっぱいは観賞を楽しめるという。\n\n パンパスグラスは南米原産のイネ科の植物で、和名で「シロガネヨシ」と呼ばれる。1～3メートルの草丈に成長し、先端部に40～80センチの花穂を付ける。同園では約40株が植栽され、花穂は秋の風物詩として親しまれている。記録的猛暑の影響で見頃の時期が例年より1週間ほどずれ込んだ。\n静岡新聞社,['https://newsatcl-pctr.c.yimg.jp/t/amd-img/20240913-00000001-at_s-000-2-view.jpg?pri=l&w=640&h=480&exp=10800'],['https://news.yahoo.co.jp/articles/a119a11ea553b9cd45d92ec9f5f7f14c39d3ef2c/images/000']
伊東にミニシアター「金星シネマ」14日開館　“まちの映画館”目指す　カフェや野菜直売所併設（静岡新聞DIGITAL）,https://news.yahoo.co.jp/articles/0de60576d749f91ab53472b3167f274662109b23,https://newsatcl-pctr.c.yimg.jp/t/amd-img/20240913-00000002-at_s-000-1-view.jpg?exp=10800,2024-09-13T07:20:00+09:00,2024-09-13T07:20:00+09:00,静岡新聞DIGITAL,at_s,あなたの静岡新聞,1229,\n「金星シネマ」を開館する梅澤舞佳さん（右）と父庸浩さん。館名は愛犬の名前に由来するという＝伊東市吉田\n伊東市に14日、映画館「金星（きんぼし）シネマ」が開館する。都内から移住した梅澤舞佳さん（25）が館長を務め、1スクリーン、座席数16席のミニシアター。カフェや野菜の直売所を併設し、暮らしの延長上にある〝まちの映画館〟を目指す。同市内では37年ぶりの映画館復活という。映画好きが高じた女性の県東部初となるミニシアターの挑戦に注目が集まる。\n\n 金星シネマは国道135号のそばにあり、元クリニックの建物を改装した。1日3～4作品を3週間ごとに入れ替える。\n\n 舞佳さんは中高の頃からほぼ毎日通うほど「映画館という場所が好きだった」。映画美学校（東京）で学んだ後、ロケ地探しなどスタッフとして映画作りにも携わった。2022年に父庸浩さん（64）と東京との2拠点生活を始め、今年に入り完全移住した。\n\n 同市内はJR伊東駅前に「キネマ通り」の名称が残るように、かつては多くの映画館でにぎわったが、現在は三島、沼津などへ出かけるしかない。舞佳さんが4月、「よそ者、若者の思いつき。一日中過ごせる映画館を作りたい」と呼びかけると、学生時代の仲間10人が駆けつけた。\n\n 客席のひな壇や防音壁の設置など、劇場はすべて手作り。客席の間を少し空け、ゆったりとした空間を追求した。観賞前後も待合室やカフェでくつろげる。\n\n 作品選びは舞佳さんが目利き力を発揮する。「ミニシアターによってはアート系など個性を強く出すところもあるが、私は客層、年齢を問わず楽しんでもらえる作品を選びたい」。オープニングを飾る4作はヒューマンドラマ、サスペンスなど国内外の話題作が並ぶ。広告デザインを手がける編集者の庸浩さんが、ウェブやチラシ作成などで運営を後押しする。\n\n 地元で農園を経営する萩原直人さん（51）は、日々立ち寄ってもらう場を目指して野菜販売に協力する。「伊東は意欲的な移住者が多く、新しい空気をもたらしてくれる。舞佳さんの行動力を応援したい」と期待する。\n\n■興行の形も多様に\n\n コミュニティシネマセンター（東京）によると、国内の映画館数は2005年の806館から23年は592館に減少した。多スクリーンのシネコンとミニシアターを除く館の減少が主な要因。\n\n ミニシアターは老舗の閉館が相次ぐ一方、新規開館も増え、05年の107館から23年は140館に。小学校の教室を改装したミニシアターなど、従来の興行館とは異なる上映の場を設ける動きが続いているという。岩崎ゆう子事務局長は「かつては自分の街にあったという思いから、上映回数が少なくても、1スクリーンでも、毎日でなくても映画館を作りたいという動きが全国的に広がっている」と話す。\n\n 県映画興行協会に加盟する県内の映画館数は、「金星シネマ」の開館で15館になる。\n静岡新聞社,['https://newsatcl-pctr.c.yimg.jp/t/amd-img/20240913-00000002-at_s-000-1-view.jpg?pri=l&w=640&h=480&exp=10800'],['https://news.yahoo.co.jp/articles/0de60576d749f91ab53472b3167f274662109b23/images/000']
