headline,mainEntityOfPage,image,datePublished,dateModified,author,media_en,media_jp,str_count,body,images,external_links
アヤックス板倉滉がCLデビュー　昨季準優勝のインテル相手にCKから失点で黒星（theWORLD（ザ・ワールドWeb））,https://news.yahoo.co.jp/articles/b18d92e1dffa9b98e7a18b6be61cdedeeaac54cd,https://newsatcl-pctr.c.yimg.jp/t/amd-img/20250918-00010033-theworldw-000-1-view.jpg?exp=10800,2025-09-18T23:50:17+09:00,2025-09-18T23:50:17+09:00,theWORLD（ザ・ワールドWeb）,theworldw,theWORLD（ザ・ワールドWeb）,663,"強豪相手に奮闘も結果につながらず
CLデビューを飾った板倉　photo/Getty Images
サッカー日本代表DF板倉滉が、アヤックスで欧州チャンピオンズリーグ（CL）初出場を果たした。
久保と鎌田がレベチな上手さ　インドネシアに6発　大勝した日本代表
ホームでのインテルとの初戦にセンターバックとして先発し、84分までプレイしたが、チームは0-2で敗れた。

昨季準優勝の強豪を相手に、アヤックスは前半から苦しい展開を強いられた。40分、FWミカ・ゴドツが相手GKと1対1の決定的なチャンスを迎えるもゴールならず。すると直後の42分、相手FWマルクス・ュラムにCKからヘディングで先制点を許した。

後半に入ると、さらにインテルの攻撃は勢いを増す。後半開始早々の47分にはCKから失点。板倉も競り合ったものの再びテュラムに頭で決められ、2点差とされた。

その後も板倉は、自身の好守から攻撃につなげるなど守備面で奮闘。しかし、アヤックスは最後まで得点を奪えず、CLのスタートを黒星で飾ることとなった。

試合後、アヤックスのヨン・ハイティンハ監督は「前半はポゼッションで多くのチャンスを与えなかった。試合をコントロールし、得点する絶好の機会もあった。セットプレイはインテルにとって大きな武器であり、そこから得点を許してしまい、後半早々に2点目を奪われて難しい試合になった」と振り返った。

板倉にとってはほろ苦いCLデビューとなったが、この厳しい経験を今後の成長につなげていくことが期待される。
構成/ザ・ワールド編集部",[],[]
チェルシーはUCL初戦でバイエルンに敗戦も指揮官のマレスカ監督は前向き　「この敗北から何か特別なものを築けるだろう」（theWORLD（ザ・ワールドWeb））,https://news.yahoo.co.jp/articles/a8c4bf35b3f9ebeb6c5ea2164494758e7b7d044f,https://newsatcl-pctr.c.yimg.jp/t/amd-img/20250918-00010032-theworldw-000-1-view.jpg?exp=10800,2025-09-18T23:20:32+09:00,2025-09-18T23:20:32+09:00,theWORLD（ザ・ワールドWeb）,theworldw,theWORLD（ザ・ワールドWeb）,604,"初戦を落とす
チェルシーを指揮するマレスカ監督　photo/Getty images
18日、チェルシーはUEFAチャンピオンズリーグ初戦で昨季ブンデスリーガ王者のバイエルン・ミュンヘンと対戦。
【動画】味方からのパスを受けたパルマーが冷静にゴールネットを揺らして今季UCL初ゴールを記録
22-23シーズン以来のUCL参戦となったチェルシーだったが、前半20分、バイエルンのMFマイケル・オリーセに突破を許してしまい、クロスに対応しきれなかったDFトレヴォ・チャロバーがオウンゴール。その直後にはMFモイセス・カイセドがハリー・ケインをPA内で倒してしまい、そのPKをケインに沈められて2点ビハインドに。わずか2分後にコール・パルマーが一矢報いる得点を挙げるも、63分にまたしてもケインに決められて試合は1-3で終了。初戦は悔しい敗戦に終わった。

難しいアウェイゲームでの敗戦となったが、指揮官のエンツォ・マレスカ監督は前向きな姿勢。移籍市場に精通するファブリツィオ・ロマーノ氏によると、マレスカ監督は試合後に次のように語ったという。

「バイエルン戦でのこの敗北から何か特別なものを築けるという予感がする。この試合からは多くのことを学んだし、私たちは常に競争できることを示すことができた」

初戦を落としたチェルシー。果たして次節ベンフィカ戦は勝利することができるのだろうか。
構成/ザ・ワールド編集部",[],[]
今夏ヘタフェからクリスタル・パレスにレンタル移籍のナイジェリア代表FWウチェ　10試合先発で強制買取へ（theWORLD（ザ・ワールドWeb））,https://news.yahoo.co.jp/articles/95772aedb4f521511ce9cb36aad33a624200df33,https://newsatcl-pctr.c.yimg.jp/t/amd-img/20250918-00010031-theworldw-000-1-view.jpg?exp=10800,2025-09-18T23:10:23+09:00,2025-09-18T23:10:23+09:00,theWORLD（ザ・ワールドWeb）,theworldw,theWORLD（ザ・ワールドWeb）,594,"今夏加入
クリスタル・パレスのウチェ　クリスタル・パレスの公式Instagram
今夏クリスタル・パレスに加入したナイジェリア期待のFWの契約形態が判明したようだ。
【動画】今季も活躍が期待　昨季FA杯決勝で活躍した鎌田大地
ジャーナリストのポール・ブラウン氏によると、今夏ヘタフェからクリスタル・パレスにレンタル移籍した22歳のナイジェリア代表FWクリサントゥス・ウチェだが、契約には条件付きでの買取義務が付随していたという。

現在22歳のウチェは2022年にスペイン7部相当のモラロのBチームでプロキャリアをスタート。その後は5部相当の同クラブのトップチームに昇格して、3部のセウタに移籍。2024年夏にはラ・リーガのヘタフェに加入しており、スペイン7部からラ・リーガでプレイするまでに要した年月はわずかに2年。そして今夏はプレミアリーグのクリスタル・パレスに移籍しており、まさにシンデレラボーイと言えるキャリアを歩んでいる。

そんなウチェだが、契約には条件付きで買取義務が付随している模様。同氏によると、クリスタル・パレスとヘタフェはウチェが10試合先発出場した場合、2000万ユーロの買取義務が発動する契約で合意していたという。

未だクリスタル・パレスでは1試合も先発出場していないウチェ。果たしてここから序列を覆して完全移籍を勝ち取るのだろうか。
構成/ザ・ワールド編集部",[],[]
今季限りでバイエルンと契約満了のフランス代表DFウパメカノが心境語る　「このクラブにいて幸せ」（theWORLD（ザ・ワールドWeb））,https://news.yahoo.co.jp/articles/322819155d44b0c8079bebac9083793a8b793a87,https://newsatcl-pctr.c.yimg.jp/t/amd-img/20250918-00010030-theworldw-000-1-view.jpg?exp=10800,2025-09-18T23:01:00+09:00,2025-09-18T23:01:00+09:00,theWORLD（ザ・ワールドWeb）,theworldw,theWORLD（ザ・ワールドWeb）,582,"今季で契約満了
バイエルンのウパメカノ　photo/Getty images
ブンデスリーガ王者の守備の要として君臨するフランス代表DFは来夏の去就が注目されている。
【動画】バイエルンのレジェンドであるロッペン氏が現役時代に見せた圧巻のカットイン集
今季も開幕からブンデスリーガ3試合で14得点と圧巻の爆発力を発揮しているバイエルン・ミュンヘン。その圧倒的な攻撃力が注目されているが、開幕3試合中2試合がクリーンシートと守備力も高い。その守備陣を支えているのがフランス代表DFダヨ・ウパメカノだ。

ウパメカノはバイエルンの守備の要として今季も開幕から3試合連続で先発出場し、クラブに欠かせない活躍をしている。そんな同選手だが、クラブとの現行契約は2026年夏まで。今季限りで契約満了となり、来夏の移籍市場ではフリーで他クラブへと移籍可能となる。

そのような状況下でウパメカノは『BILD』で自身の将来について語った模様。

「バイエルンでは快適に過ごしているし、幸せだ。現在、私の代理人がバイエルンの関係者と話していることは確かだ。交渉は進行中だが、これ以上言うことはない。今後どうなるか見てみましょう」

バイエルンでの居心地の良さを語ったウパメカノ。クラブと契約延長交渉は行っているようだが、果たして新契約を締結するのだろうか。
構成/ザ・ワールド編集部",[],[]
サリバorモスケラ、エゼorマルティネッリ……　アーセナルはシティ戦に誰を先発させるべきか、充実スカッドはアルテタに悩みをもたらす（theWORLD（ザ・ワールドWeb））,https://news.yahoo.co.jp/articles/f1b53ebb1a437edd679dfa5113118259f59f49d9,https://newsatcl-pctr.c.yimg.jp/t/amd-img/20250918-00010029-theworldw-000-1-view.jpg?exp=10800,2025-09-18T23:00:49+09:00,2025-09-18T23:00:49+09:00,theWORLD（ザ・ワールドWeb）,theworldw,theWORLD（ザ・ワールドWeb）,1430,"選択肢が多いことは良いことだが
マルティネッリはCLアスレティック戦で結果を出した Photo/Getty Images
CL緒戦のアスレティック戦を2-0の快勝で終え、プレミアリーグ第5節マンチェスター・シティ戦に臨むアーセナル。アスレティック戦では交代出場のガブリエウ・マルティネッリ、レアンドロ・トロサールが1G1Aずつと結果を出し、改めて今季の選手層の厚さを見せつけた。ミケル・アルテタ監督は試合後「スターター」と「フィニッシャー」という言葉を用い、先発と交代選手の間に差はないと示し、チームでの勝利であることを強調した。
［動画］“フィニッシャー”マルティネッリとトロサールが1G1Aずつの大活躍！　敵地で2-0勝利のアスレティック戦
優勝を争う直接のライバルとなるシティ戦では、誰を先発させるべきか。また、誰をベンチに置いて「フィニッシャー」とすべきか。アルテタ監督はこの決断におおいに頭を悩ませることになるだろう。

『The Athletic』は、アーセナルにおいてベンチからの出場選手がここ2シーズンでゴールへの関与を飛躍的に伸ばしているというデータを紹介している。22-23シーズンはベンチからの出場選手が6ゴール11アシストであったのに対し、23-24シーズンは16ゴール10アシスト。24-25シーズンは17ゴール8アシストとなっており、ゴール関与数は確かに伸びている。それだけメンバーが充実してきたということで、今季はその数字がさらに伸びることが期待できる。

しかしスカッドが充実したということは、誰かがはじき出されるということでもある。たとえばCBは試合中の交代があまりないポジションだが、ウィリアム・サリバが負傷から戻ってきたことを考えると、代役として好調のクリスティアン・モスケラとどちらを優先するかは悩みどころだ。モスケラは前節も前々節も、そしてアスレティック戦でもほぼ完璧といえるパフォーマンスを見せており、代えるのは惜しい。しかし同メディアは、アーリング・ハーランドを抑えたことのある経験から、サリバを戻すべきではとの見解を示している。

また、左サイドの人選も悩ましい。エベレチ・エゼはアイデアで戦局を変えることのできる選手だが、アスレティック戦では途中出場からマルティネッリのスピードが活きた。マルティネッリの活躍はまさに前述の交代選手によるゴール関与であるが、逆にスピードのあるマルティネッリを先発させることで相手のSBを疲弊させるという考え方もある。もちろんトロサールも忘れるべきではなく、誰を「フィニッシャー」とするかはアルテタの腕の見せどころだ。

マルティン・ウーデゴーの出場が危ぶまれる中盤においても、ミケル・メリーノのほかイーサン・ヌワネリという選択肢がある。ヌワネリはより機動力があり、今季は中盤の深い位置からボールを運ぶようなプレイも見られる。

『The Athletic』はシティ戦の予想メンバーとしてGKダビド・ラヤ、DF左からリッカルド・カラフィオーリ、ガブリエウ・マガリャンイス、サリバ、ユリエン・ティンバー、2ボランチにマルティン・スビメンディとデクラン・ライス、トップ下にヌワネリ、左ウイングにエゼ、右にノニ・マドゥエケ、最前線にヴィクトル・ギェケレシュという形を予想している。シティ戦で誰が先発し、誰がいつベンチから登場するか、おおいに注目したいところだ。
構成／ザ・ワールド編集部",[],[]
今季絶好調のヴラホビッチは来夏フリーでユヴェントス退団か　すでにマンUやバルセロナなど欧州複数クラブが興味（theWORLD（ザ・ワールドWeb））,https://news.yahoo.co.jp/articles/097ce4d324736167c9942a6fd8653ce711f6d6dc,https://newsatcl-pctr.c.yimg.jp/t/amd-img/20250918-00010028-theworldw-000-1-view.jpg?exp=10800,2025-09-18T22:50:20+09:00,2025-09-18T22:50:20+09:00,theWORLD（ザ・ワールドWeb）,theworldw,theWORLD（ザ・ワールドWeb）,730,"今季は絶好調
ユヴェントスのヴラホビッチ　photo/Getty images
今季ユヴェントスで大爆発中のセルビア代表FWに欧州複数クラブが興味を示している。

『La Gazzetta dello Soort』によると、ユヴェントスに所属する25歳のセルビア代表FWドゥシャン・ヴラホビッチは来夏フリーでクラブを去る可能性が高まっているという。
【動画】UCLで計8ゴールが生まれる　ヴラホビッチは2ゴールの活躍
2022年1月にフィオレンティーナからユヴェントスに完全移籍を果たしたヴラホビッチはその期待通り加入後はクラブのエースとして活躍。しかし、徐々に序列を落とすと、今夏の移籍市場では売却候補として移籍の噂が飛び交うことに。最終的にはクラブに残留したものの、現状は新加入のカナダ代表FWジョナサン・デイビッドにスタメンの座を奪われており、今季ここまでは途中出場が殆ど。それでも直近の公式戦4試合で4ゴール1アシストと少ない時間で結果を残すなど、定位置を取り戻しつつある。

そんなヴラホビッチだが、ユヴェントスとの契約は今季限りで満了に。同メディアによると、ヴラホビッチをフリーで獲得したいと考えるクラブは複数おり、そのクラブはマンチェスター・ユナイテッドやバルセロナ、そしてアトレティコ・マドリードだという。同メディアは今季ここまでのヴラホビッチの活躍を受けて、なぜユヴェントスは契約更新しなかったのかと指摘しており、来夏フリーで退団する可能性は高いと言及している。

今夏は移籍の噂が飛び交うなど序列が低下していたものの、結果で自らの価値を証明しているヴラホビッチ。果たして来夏フリーでクラブを去ってしまうのだろうか。
構成/ザ・ワールド編集部",[],[]
買戻しOPはたったの17億円、再売却条項は50%　レアルが保有するコモMFニコ・パスの有利な契約内容（theWORLD（ザ・ワールドWeb））,https://news.yahoo.co.jp/articles/1f3503bfb582a7da1603ab118be8925417f48d6c,https://newsatcl-pctr.c.yimg.jp/t/amd-img/20250918-00010027-theworldw-000-1-view.jpg?exp=10800,2025-09-18T22:30:17+09:00,2025-09-18T22:30:17+09:00,theWORLD（ザ・ワールドWeb）,theworldw,theWORLD（ザ・ワールドWeb）,604,"白い巨人の一員となるのか
コモのニコ・パス photo/Getty Images
25-26シーズンのセリエAでは開幕節でラツィオを下すなど、今季も勢いのあるコモ。チームの中心人物は変わらずMFニコ・パスで、今季のリーグ戦では早くも2ゴール1アシストを記録している。
メッシが抜けたとしても今のアルゼンチンは強い　得点数歴代6位のラウタロ&ニコ・パス、マスタントゥオーノら育つ驚異の若手たち
そんなニコ・パスにラ・リーガの強豪レアル・マドリード移籍の可能性が浮上している。

ニコ・パスはレアルユース出身のアタッカーで、2024年にコモに完全移籍している。ただ、契約には買戻し条項が付随しており、『Gazzetta dello Sport』はレアルが来夏これを行使する意思があると伝えている。

その金額はわずか1000万ユーロ、日本円にして約17億円と格安だ。

ただ、レアルがスカッドの関係でニコ・パスをチームに戻さない場合には完全移籍で放出される可能性もあるという。その値段は少なくとも7000万ユーロ(約122億円)で、買戻し金額の7倍となる。

ニコ・パスには今夏プレミアリーグのトッテナムが関心を寄せていた。レアルは買戻しOPだけでなく、再売却条項も契約に加えており、もしコモが7000万ユーロで売却すれば、その半分の3500万ユーロ(約61億円)を手にすることになる。
構成/ザ・ワールド編集部",[],[]
ファン・ダイクは“ジェラード級”の伝説になれる？　レジェンドも認める圧倒的な実力「彼はリヴァプール史上最高の選手の一人として記憶されるだろう」（theWORLD（ザ・ワールドWeb））,https://news.yahoo.co.jp/articles/451caa7e3c0f18e915de1246ea98aad6ab147f5c,https://newsatcl-pctr.c.yimg.jp/t/amd-img/20250918-00010026-theworldw-000-1-view.jpg?exp=10800,2025-09-18T22:01:00+09:00,2025-09-18T22:01:00+09:00,theWORLD（ザ・ワールドWeb）,theworldw,theWORLD（ザ・ワールドWeb）,989,"CLアトレティコ戦では決勝ゴール
リヴァプールに欠かせない男ファン・ダイク photo/Getty Images
リヴァプールのOBであるジェイミー・キャラガー氏はCLリーグフェーズ第1節のリヴァプール対アトレティコ・マドリード戦の後、オランダ代表DFフィルジル・ファン・ダイク（34）を大絶賛したという。英『TBR Football』が報じている。
疑問視されるヴィルツに本領発揮のときが近い？　アトレティコ戦で最多のチャンス数創出
この試合、幸先よく2点のリードを奪ったリヴァプールだったが、その後2失点を許してアトレティコに追いつかれる展開に。このままドローで終わるかと思われた後半AT、チームを救ったのが頼れるキャプテン、ファン・ダイクだ。同選手はコーナーキックから強烈なヘディングを叩きつけ、終了間際に勝利を呼び込むゴールを決めたのだ。

ファン・ダイクのおかげで劇的勝利を飾ったリヴァプール。キャラガー氏は決勝点を挙げた同選手を大絶賛しており、オランダ代表DFはクラブが誇るスティーヴン・ジェラードなどの偉大なレジェンドに匹敵する伝説になると語った。

「リヴァプールではリーグ優勝やチャンピオンズリーグ優勝を果たした選手の多くがレジェンドと呼ばれるんだ。でもスティービー（ジェラードの愛称）やケニー・ダルグリッシュ、（グレアム）スーネス、アラン・ハンセン、ジョン・バーンズ、モハメド・サラーといったクラブの巨人たち、つまりトップの7,8人の選手たちと区別するなら、彼は真ん中に位置している。リストの最下位などではない」

「彼はリヴァプール史上最高の選手の一人として記憶されるだろう。最高のセンターバックの一人ではなく、最高の選手の一人だ」

2018年よりリヴァプールでプレイするファン・ダイク。これまで同クラブでは公式戦325試合に出場し、29ゴール13アシストを記録。加入してからずっとチームに欠かせない存在であり、数々のタイトル獲得に貢献してきた。また2020年には一度大怪我を負ってしまい、その後パフォーマンスが心配された時期もあったが、今は再び世界最高のDFとして君臨している。

キャラガー氏もレジェンドと呼ばれる1人だが、そんな同氏はファン・ダイクはジェラードらに並び、特別な称賛を受けるに値する選手だと考えているようだ。
構成／ザ・ワールド編集部",[],[]
マンチェスター・ユナイテッド、冬にMF補強へ　エリオット・アンダーソン獲得のため140億円のオファー用意（theWORLD（ザ・ワールドWeb））,https://news.yahoo.co.jp/articles/80534f8667c11e3ebbd592d176e4935a6a12df90,https://newsatcl-pctr.c.yimg.jp/t/amd-img/20250918-00010025-theworldw-000-1-view.jpg?exp=10800,2025-09-18T21:40:09+09:00,2025-09-18T21:40:09+09:00,theWORLD（ザ・ワールドWeb）,theworldw,theWORLD（ザ・ワールドWeb）,800,"MFの獲得を目指す
ノッティンガム・フォレストのエリオット・アンダーソン photo/Getty Images
直近のマンチェスターダービーではマンチェスター・シティ相手に0-3の完敗を喫してしまったマンチェスター・ユナイテッド。シーズン開幕からすでに黒星は3つ、リーグ戦では14位と下位に沈んでいる。
ポステコグルー体制のN・フォレストが2連敗　カラバオ杯では英2部スウォンジーに2点差ひっくり返され逆転負け、後半ATにまさかの2失点……　「もっと早く試合を終わらせるべきだった」
そんなユナイテッドだが、ダービーではボランチの人選を指摘する声が多かった。今季は本来トップ下のブルーノ・フェルナンデスが一つポジションを下げたボランチでプレイしているが、それが効果的ではなかったからだ。

ユナイテッドは今夏MFの獲得を狙うも、最終的には獲得できず。FW中心の補強に終わっている。

『Mirror』によると、ユナイテッドは1月の移籍市場でのMF補強を急務だと考えており、ノッティンガム・フォレストに所属するエリオット・アンダーソンに関心を向けている。

アンダーソンは豊富な運動量を武器に攻守両面で存在感を発揮できるMFで、元WGということもあって推進力のあるドリブルも備えている。イングランド代表ではトーマス・トゥヘル監督に高く評価されており、9月の代表ウィークではアンドラ、セルビアの2試合で先発フル出場している。

いわゆる水を運ぶ役割をこなせるアンダーソンをユナイテッドは高く評価しており、クラブはフォレストが同選手を獲得した際に支払った移籍金の倍となる7000万ポンド、日本円にして約140億円のオファーを検討しているようだ。

22歳と若く今後の活躍が期待されているアンダーソン。フォレストからのステップアップが期待されているが、冬の移籍は実現するのだろうか。
構成/ザ・ワールド編集部",[],[]
