headline,mainEntityOfPage,image,datePublished,dateModified,author,media_en,media_jp,str_count,body,images,external_links
隣の芝生は青く見える？　COO、アカデミー責任者に続きユナイテッドがシティの元U-16コーチを獲得か（theWORLD（ザ・ワールドWeb））,https://news.yahoo.co.jp/articles/6422af4abc952cad71875783cc30716459c431cd,https://newsatcl-pctr.c.yimg.jp/t/amd-img/20250918-00010024-theworldw-000-1-view.jpg?exp=10800,2025-09-18T21:20:32+09:00,2025-09-18T21:20:32+09:00,theWORLD（ザ・ワールドWeb）,theworldw,theWORLD（ザ・ワールドWeb）,611,"同じマンチェスターという地理的要因もあるのか
ラトクリフ共同オーナー photo/Getty Images
プレミアリーグのマンチェスター・ユナイテッドはアカデミーを強化すべく、外部から人材の確保を目指しているようだ。
オマール・ベラダCEOが語る「Project 150」　マンUは“2028年までにプレミア制覇”が可能
『The Athletic』によると、ユナイテッドはアラン・ライト氏と現在加入に向けた交渉を行っているという。

ライト氏はユナイテッドのライバルであるマンチェスター・シティのアカデミーで10年間、U-16を指導していた人物で、現在ユナイテッドでアカデミーダイレクターを務めているジョン・ウィルコックス氏がシティに在籍していた際の部下である。現在は選手の代理人を務める事務所の『Harwick Sports Management』に在籍している。

ユナイテッドは近年シティや、シティ所属歴がある人物を続々と引き入れている。ユナイテッドのCEOであるオマル・ベラダ氏も、シティでは最高執行責任者、COOとして活躍しており、シティ・フットボール・グループであるCFGの統括も任されていた。

アレックス・ファーガソン氏の退任以降、長い暗闇から抜け出せずにいるユナイテッドだが、クラブ買収後に力を付けて成功を収めているシティの人材を引き抜くことが復活への近道となるのだろうか。
構成/ザ・ワールド編集部",[],[]
ポステコグルー体制のN・フォレストが2連敗　カラバオ杯では英2部スウォンジーに2点差ひっくり返され逆転負け、後半ATにまさかの2失点……　「もっと早く試合を終わらせるべきだった」（theWORLD（ザ・ワールドWeb））,https://news.yahoo.co.jp/articles/90f17e69a039c7cad92ee12677b76b5a1383199b,https://newsatcl-pctr.c.yimg.jp/t/amd-img/20250918-00010023-theworldw-000-1-view.jpg?exp=10800,2025-09-18T21:01:57+09:00,2025-09-18T21:01:57+09:00,theWORLD（ザ・ワールドWeb）,theworldw,theWORLD（ザ・ワールドWeb）,906,"2試合連続で3失点
N・フォレストの新指揮官ポステコグルー photo/Getty Images
カラバオカップ3回戦でノッティンガム・フォレストはイングランドの実質2部であるチャンピオンシップに所属するスウォンジーと対戦し、2-3の逆転負けを喫した。
「上田にとってのシーズン5点目は、まさに楽勝」　上田綺世が5戦5発でオランダリーグ得点王タイに、チームは5連勝
前半のうちに新加入のFWイゴール・ジェズスが2ゴールを挙げ、いい試合の入りを見せたフォレストだったが、68分に失点を許すと、後半ATにまさかの2失点。90+3分と90＋7分に失点を許し、2点のリードをひっくり返され、カラバオカップから姿を消すことになった。

アンジェ・ポステコグルー新監督の体制になって2戦目となったが、これで公式戦2連敗。同監督は試合後、「もっと早く試合を終わらせるべきだった」と英『Sky Sports』に語り、次のように試合を振り返った。

「楽に試合を進め、簡単に終わると思っていた。3点目も決められると思っていたが、チャンスを逃してしまった。これがカップ戦の常だ。相手を追い詰めたら、とどめを刺さねばならない。選手たちも当然そうなると思っていたが、我々は代償を払った。改善が必要だ」

「前半に相手はペナルティエリア外から2本シュートを放ったが、試合終了間際まで我々を脅かすことはなかった。ピッチには試合勘が鈍った選手もいた。たとえそうした事情がなくても、試合を決めるべきだった」

「我々はもっと冷静にサッカーをし、勝てる時に試合を決めるべきだったのに、そうしなかったことで生じた危険に気づかなかった。そのことにイライラしているよ。哲学的な考えに浸る暇はない。今日の試合は前進する機会だった。最後まで戦い抜くべきだった。カップ戦から脱落したことは残念だ。だが、我々は立ち直り、土曜日の大一番に向けて準備を整えねばならない」

初陣となったアーセナル戦（0-3）に続き、2試合連続での3失点となったポステコグルー。今週末のバーンリー戦では勝利が求められるが、この嫌な流れを変えられるだろうか。
構成／ザ・ワールド編集部",[],[]
バロンドール最有力はやはりデンベレ!?　4冠達成とパフォーマンス向上の総合評価が強いか（theWORLD（ザ・ワールドWeb））,https://news.yahoo.co.jp/articles/9cc6ad26e2947fefc7caa130b4b63aebf63e27da,https://newsatcl-pctr.c.yimg.jp/t/amd-img/20250918-00010022-theworldw-000-1-view.jpg?exp=10800,2025-09-18T20:50:42+09:00,2025-09-18T20:50:42+09:00,theWORLD（ザ・ワールドWeb）,theworldw,theWORLD（ザ・ワールドWeb）,1382,"見違えるほどの選手となった
PSGで多くを勝ち取ったデンベレ Photo/Getty Images
22日にパリのシアター・シャトレで2025年のバロンドール授賞式が行われる。今年は圧倒的な受賞候補はいないが、30人の候補者のなかではパリ・サンジェルマンのフランス代表FWウスマン・デンベレが最有力ではないかとの意見は根強い。
6試合でなんと10ゴール！　早くも公式戦2桁のハリー・ケインが止まらない
『beIN SPORTS』がいくつかの理由を考察している。まずはタイトル獲得の多さだ。リーグ・アン、トロフェ・デ・シャンピオン、クープ・ドゥ・フランスという国内3冠に加え、やはりUEFAチャンピオンズリーグを獲っているのが大きい。さらにリーグ・アンの最優秀選手に選ばれただけでなく、CLでもシーズン最優秀選手に選ばれている。

数字上も文句のつけようがなく、シーズンを通して35ゴール15アシストを記録。ヨーロッパでもっとも決定力のあるアタッカーの一人であると同メディアは評している。また、これまで怪我も少なくなかったデンベレが、比較的安定して出場していたことも有利に働く可能性がある。

票を分けるとすれば、バルセロナのラミン・ヤマルか。もしくはチームメイトのヴィティーニャも高得票の可能性があるが、どの選手がもっとも票を集めるだろうか。バロンドール候補者30名は以下の通り（※クラブは昨季所属）。

ウスマン・デンベレ（フランス/パリ・サンジェルマン）
ジャンルイジ・ドンナルンマ（イタリア/パリ・サンジェルマン）
デジレ・ドゥエ（フランス/パリ・サンジェルマン）
クヴィチャ・クワラツヘリア（ジョージア/ナポリ→パリ・サンジェルマン）
アクラフ・ハキミ（モロッコ/パリ・サンジェルマン）
ヴィティーニャ（ポルトガル/パリ・サンジェルマン）
ヌーノ・メンデス（ポルトガル/パリ・サンジェルマン）
ジョアン・ネベス（ポルトガル/パリ・サンジェルマン）
ファビアン・ルイス（スペイン/パリ・サンジェルマン）
キリアン・ムバッペ（フランス/レアル・マドリード）
ジュード・ベリンガム（イングランド/レアル・マドリード）
ヴィニシウス・ジュニオール（ブラジル/レアル・マドリード）
ラミン・ヤマル（スペイン/バルセロナ）
ハフィーニャ（ブラジル/バルセロナ）
ペドリ（スペイン/バルセロナ）
ロベルト・レヴァンドフスキ（ポーランド/バルセロナ）
デンゼル・ダンフリース（オランダ/インテル）
ラウタロ・マルティネス（アルゼンチン/インテル）
アレクシス・マクアリスター（アルゼンチン/リヴァプール）
モハメド・サラー（エジプト/リヴァプール）
フィルジル・ファン・ダイク（オランダ/リヴァプール）
デクラン・ライス（イングランド/アーセナル）
アーリング・ハーランド（ノルウェー/マンチェスター・シティ）
コール・パルマー（イングランド/チェルシー）
ハリー・ケイン（イングランド/バイエルン）
マイケル・オリーセ（フランス/バイエルン）
セール・ギラシ（ギニア/ドルトムント）
フロリアン・ヴィルツ（ドイツ/レヴァークーゼン）
スコット・マクトミネイ（スコットランド/ナポリ）
ヴィクトル・ギェケレシュ（スウェーデン/スポルティングCP）
構成／ザ・ワールド編集部",[],[]
スペイン代表がまさかのW杯ボイコット!?　イスラエルが出るなら出場しない可能性を政府は否定せず（theWORLD（ザ・ワールドWeb））,https://news.yahoo.co.jp/articles/d45129fee4ae0067465109b7cbe9db8556dedbc2,https://newsatcl-pctr.c.yimg.jp/t/amd-img/20250918-00010021-theworldw-000-1-view.jpg?exp=10800,2025-09-18T20:01:47+09:00,2025-09-18T20:01:47+09:00,theWORLD（ザ・ワールドWeb）,theworldw,theWORLD（ザ・ワールドWeb）,1143,"イスラエルを非難したサンチェス首相
優勝候補の一角であるスペイン代表 Photo/Getty Images
先日、スペインのペドロ・サンチェス首相はイスラエルを国際的なスポーツ大会から排除すべきだと発言した。マドリードで開催された自転車レース「ブエルタ・ア・エスパーニャ」の最終ステージはイスラエルのチームが出場していることに抗議したパレスチナ支持派の活動家たちによって中止に追い込まれたが、それを受けて次のように発言している。
マンU、1334億円の記録的な収益達成、しかし未だ赤字……
「スポーツ団体は、イスラエルが国際大会に出場し続けることの倫理性を再考するべきだ。ウクライナ侵攻後にロシアを排除したのであれば、なぜガザ侵攻後のイスラエルは排除されないのか。野蛮な行為が終わるまで、ロシアもイスラエルも国際大会に出場させるべきではない」

この発言の影響はサッカー界にも波及しているようだ。『COPE』によると社会労働党（PSOE）の広報担当者であるパトシ・ロペス氏は、イスラエルが現在行われている欧州予選を通過して出場権を得た場合、スペイン政府は出場をボイコットする可能性があることを示唆した。

イスラエルがW杯出場権を獲得した場合、スペインは撤退するのかという質問に対し、ロペス氏は「あとで検討する」と述べ、イスラエルに対しなんの措置も取られない場合は、適切な時期に要請を行う可能性があると語っている。

また、スペイン政府のスポーツ大臣であるピラール・アレグリア氏もガザの状況悪化を鑑みて、イスラエルを国際大会から排除するように求めている。ガザ保健省の統計によると、2023年の10月7日以降、イスラエルによるガザへの攻撃で少なくとも64,964人のパレスチナ人が死亡したという。

「スポーツは現実世界から独立したものではないし、またそうなることもできません。特に、現実世界が人権の破壊を告げているときにはなおさらです」

イスラエルは現在、ノルウェーやイタリアと同居するグループIの3位につけており、勝ち点は2位イタリアと同じ「9」。プレイオフを経て本戦出場を決める可能性は十分にある。

スペインメディア『LA DERECHA DIARIO』によると、スペインの現行のスポーツ法では、高等スポーツ評議会（CSD）に、「国家レベルの代表チームの国際大会への参加を承認または拒否する権限」を与えている。つまり、スペイン政府には代表チームの参加を阻止する権限があることを意味する。

スペイン代表は来年のW杯で優勝候補の一角と見られているが、出場をボイコットしてしまうのだろうか。なおFIFAはこの件に関し、今のところ何もコメントを発していない。
構成／ザ・ワールド編集部",[],[]
冷遇されている今がチャンス？　シティがマンUメイヌー狙う。ベルナルド・シウバは今季が契約最終年（theWORLD（ザ・ワールドWeb））,https://news.yahoo.co.jp/articles/9db2cdc2768a8be9571f30157d1a76bc5d61c85d,https://newsatcl-pctr.c.yimg.jp/t/amd-img/20250918-00010020-theworldw-000-1-view.jpg?exp=10800,2025-09-18T19:31:22+09:00,2025-09-18T19:31:22+09:00,theWORLD（ザ・ワールドWeb）,theworldw,theWORLD（ザ・ワールドWeb）,625,"シティはMFの枠が空く
マンチェスター・ユナイテッドのメイヌー photo/Getty Images
マンチェスター・ユナイテッドのアカデミーで育ち、トップチームデビューを果たしたコビー・メイヌー。20歳にしてすでにイングランドのフル代表でもデビューを飾っており、代表、クラブの両方で大きな期待を寄せられている。
デ・ブライネがエティハドに帰ってくる！　“キングの帰還”にマンC指揮官も喜び　「戻ってくるのは嬉しいよ。試合後に彼に会えるのが楽しみ」
しかし、現ルベン・アモリム政権での序列はそれほど高くない。カゼミロ、ブルーノ・フェルナンデスの2人が中盤で優先されており、直近のダービーでは先発に選ばれず、途中出場での出番となった。

そんなメイヌーに同じプレミアリーグのニューカッスルが関心を示していると報じられたが、別のクラブも獲得に興味を持っているという。

それがマンチェスター・シティだ。『Team Talk』によると、指揮官であるペップ・グアルディオラ監督はメイヌーを高く評価しており、彼のプロフィールがチームにフィットする人材であると考えているようだ。

同メディアによると、ユナイテッドはメイヌーの評価額を7000万ポンド、日本円にして約140億円に設定している。

シティはベテランのベルナルド・シウバが契約最終年を迎えている。そうなると、中盤に1つ枠が空くため、そこにメイヌーが入ってくるのかもしれない。
構成/ザ・ワールド編集部",[],[]
疑問視されるヴィルツに本領発揮のときが近い？　アトレティコ戦で最多のチャンス数創出（theWORLD（ザ・ワールドWeb））,https://news.yahoo.co.jp/articles/cf3de900dd7453dae32d60f0dedbec8bcf700bec,https://newsatcl-pctr.c.yimg.jp/t/amd-img/20250918-00010019-theworldw-000-1-view.jpg?exp=10800,2025-09-18T19:03:32+09:00,2025-09-18T19:03:32+09:00,theWORLD（ザ・ワールドWeb）,theworldw,theWORLD（ザ・ワールドWeb）,1046,"数字を残せていないが
リヴァプールのヴィルツ Photo/Getty Images
UEFAチャンピオンズリーグ・リーグフェーズ第1節で、イングランドのリヴァプールはスペインのアトレティコ・マドリードと対戦。終了間際のフィルジル・ファン・ダイクのゴールによって3-2と試合を制した。
［動画］終了間際にまたも決勝点！　ファン・ダイクの一発で難敵アトレティコを退けたCLリーグフェーズ第1節
終了間際の劇的なゴールが続き、公式戦5連勝となっているリヴァプール。しかしこの試合のトピックはそれだけではない。『The Athletic』は、今夏獲得したドイツ代表MFがいよいよその能力を発揮し始めたと伝えている。

ヴィルツはこの試合で、チーム最多となる5回のチャンスを創出。74分にリオ・ングモハと交代した際にはアンフィールドの観客から惜しみない拍手を送られている。

1億1600万ポンドという超高額な移籍金で獲得されたヴィルツだが、これまでゴールもアシストも記録することなく、獲得には早くも疑問符がついていたところだった。しかしヴィルツはしだいにリヴァプールのプレイ強度やスピードに適応しつつある。試合後、アルネ・スロット監督はヴィルツのパフォーマンスに賛辞を贈っている。

「彼はどんどんコンディションが良くなってきていて、チームに適応しているのがわかる。これは普通のことだ。彼のクオリティの高さは誰もが知っているが、彼が22歳で初めて国外に出る選手だということを忘れてしまうことがある」

「私は今日が誕生日なので47歳だが、昨年46歳のときに初めて海外で働いた。最初の2〜3カ月は人生がガラリと変わってしまう。今まで普通だったことも、もう普通ではなくなる。何もかもが変わってしまい、そこにエネルギーを使ってしまうこともある」

「新たなクラブに移籍し、新しいプレイスタイルも加わった。レヴァークーゼンは［3-4-3］だったが、私たちは［4-3-3］だから、オフボール時も守備面でも、彼に求めるものは増えている。でも、彼がどんどん成長しているのがわかる。彼もチームもどんどん良くなっていくだろうが、彼のパフォーマンスは本当に素晴らしかったよ」

ライン間でボールを受け、1〜2タッチで素早く捌いていくヴィルツのプレイスタイルは、チームメイトとの連携が成熟すればするほど効果を発揮する。これまでは数字に残らなかったが、目に見える結果が出るのもまもなくかもしれない。
構成／ザ・ワールド編集部",[],[]
チェルシーで“完全構想外”のスターリングに救いの手？　セルティックが今冬レンタル移籍での獲得を検討中か（theWORLD（ザ・ワールドWeb））,https://news.yahoo.co.jp/articles/1862f3b7ff5739c444344ba492956c239272d774,https://newsatcl-pctr.c.yimg.jp/t/amd-img/20250918-00010018-theworldw-000-1-view.jpg?exp=10800,2025-09-18T19:02:37+09:00,2025-09-18T19:02:37+09:00,theWORLD（ザ・ワールドWeb）,theworldw,theWORLD（ザ・ワールドWeb）,1002,"ロジャーズ監督はリヴァプール時代の恩師
昨季はアーセナルへレンタル移籍していたスターリング photo/Getty Images
チェルシーで居場所を失っているFWラヒーム・スターリング（30）に興味を示す新たなクラブが出てきたようだ。
1億ポンド超えでリヴァプール加入も、未だ0ゴール0アシスト　ヴィルツにスタメン落ちの時はくるか「彼はクラブに加入してから何も成し遂げていない」
2022年夏にマンチェスター・シティからチェルシーに移籍したスターリングだったが、昨夏新監督に就任したエンツォ・マレスカ体制では完全に構想外となり、昨シーズンはアーセナルへレンタル移籍をしていた。

レンタル先のアーセナルで期待はずれのパフォーマンスに終わった同選手は今夏の移籍市場で新天地を見つけることはできず。様々なクラブとの関係が噂されたが、週給約30万ポンドとも言われている同選手の高額な給与が大きな障壁になっていると考えられていた。

現在はトップチームとは別でトレーニングをしているスターリング。移籍をするには冬まで待つ必要があるが、英『FootballTransfers』によると、旗手怜央や前田大然ら日本人も多く所属するスコットランド王者のセルティックがスターリングの獲得に興味を持っているという。

CL出場を逃したセルティックは今シーズンELを戦うことになったが、優勝を目指す上で冬に戦力アップとなる選手を獲得したいと考えており、リヴァプール時代にスターリングを指導したブレンダン・ロジャーズ監督は教え子との再会を視野に入れているようだ。

セルティックはレンタル移籍での獲得を目指しているが、やはり同選手の給与が問題になってくる模様。セルティックとしては週給5万ポンドを負担する準備があり、残りをチェルシーが負担する形で容認されれば、経済的にも移籍を実現させられる見込みだという。

チェルシーが給与負担の割合について納得するかどうか不明だが、同メディアは「スコットランドへの6ヶ月間のレンタル移籍は、スターリングが夏の完全移籍前に失った価値を取り戻す助けになるだろう」と綴っており、両クラブ、そして出場機会を求めるスターリングにとってもいい機会になると考えている。

プレイするためには移籍先を探す必要があるスターリングだが、セルティックは獲得へ本腰を入れるのか、注目だ。
構成／ザ・ワールド編集部",[],[]
マンU移籍が実現する可能性はゼロだった？　今夏移籍のドンナルンマ。シティのみを希望していたと明かす（theWORLD（ザ・ワールドWeb））,https://news.yahoo.co.jp/articles/117fb0078b53ab98c1be858afee9a3da631c6b6b,https://newsatcl-pctr.c.yimg.jp/t/amd-img/20250918-00010017-theworldw-000-1-view.jpg?exp=10800,2025-09-18T18:30:58+09:00,2025-09-18T18:30:58+09:00,theWORLD（ザ・ワールドWeb）,theworldw,theWORLD（ザ・ワールドWeb）,686,"イングランドにやってきた
マンチェスター・シティのドンナルンマ photo/Getty Images
プレミアリーグ第4節ではマンチェスター・ユナイテッドとのダービーを戦ったマンチェスター・シティ。結果は3-0の快勝。昨季は負け越してしまっただけに、大きな白星となった。
デ・ブライネがエティハドに帰ってくる！　“キングの帰還”にマンC指揮官も喜び　「戻ってくるのは嬉しいよ。試合後に彼に会えるのが楽しみ」
そんなダービーで存在感を示したのが、今夏新加入のジャンルイジ・ドンナルンマだ。パリ・サンジェルマンからやってきたイタリア代表GKは、この重要な一戦でさっそく先発を果たすと、素晴らしいパフォーマンスを披露してクリーンシートに貢献している。

『BBC』ではドンナルンマが今夏シティに移籍した経緯を語っている。

「ここ(シティ)に来ることが私の望みだと常に言ってきた。(シティへの移籍が)唯一の選択肢であり、それが私の唯一の望みだった。だからシティの一員になれて本当に嬉しいよ」

「夏の前にシティが私に興味を持っていることを知っていたが、クラブW杯後にその関係はさらに強まったんだ」

「コーチが僕を強く望んでいることがわかっていたし、みんなが僕をここに迎え入れたいと願ってくれていた。こんなに愛情を注がれているのを見て、誇らしく思う。大きな喜びと熱意を持って、迷うことなくここに来た」

今夏にはシティのライバルであるユナイテッドも獲得を目指していたと報じられていたが、ドンナルンマの口ぶりからするに、実現する可能性は低かったといえる。
構成/ザ・ワールド編集部",[],[]
