headline,mainEntityOfPage,image,datePublished,dateModified,author,media_en,media_jp,str_count,body,images,external_links
齋藤惠佑/白石光ペア 日本勢対決制しV、白石は単でも決勝進出＜男子テニス＞（tennis365.net）,https://news.yahoo.co.jp/articles/4397d465dd2282f6a8457f6e93bd90716cb4da62,https://newsatcl-pctr.c.yimg.jp/t/amd-img/20260404-00010007-tennisnet-000-1-view.jpg?exp=10800,2026-04-04T21:09:25+09:00,2026-04-04T21:09:25+09:00,tennis365.net,tennisnet,tennis365.net,435,"第27回 かしわ国際オープンテニストーナメント （左から）齋藤惠佑と白石光[画像/公益財団法人 吉田記念テニス研修センター] 男子テニスの第27回 かしわ国際オープンテニストーナメント（日本/千葉、ハード、ITF）は4日、ダブルス決勝が行われ、第3シードの齋藤惠佑/ 白石光ペアが川橋勇太/ 山﨑純平ペアを6-3, 6-4のストレートで下し優勝を飾った。 【齋藤惠佑 選手詳細情報】 同大会は吉田記念テニス研修センターで開催される国際大会で、本戦は3月31日から4月5日にかけて行われる。 齋藤と白石は今大会、1回戦から全てストレート勝ちで決勝に勝ち進むと、日本勢対決となった決勝でも川橋と山﨑を寄せ付けず、全試合ストレート勝ちで優勝を飾った。 なお、同日にはシングルス準決勝も行われ、第1シードの白石が第6シードのE・ハッド（イギリス）を7-5, 7-6 (7-3)のストレートで下し決勝進出を果たした。白石は決勝で第2シードのM・ブジゲ（オーストラリア）と対戦する。",[],[]
世界9位の第1シード撃破し4強、逆転勝ちティランテ「実を結んだ」＜男子テニス＞（tennis365.net）,https://news.yahoo.co.jp/articles/2057247bb965dee6633e28c5b18f270fa6757e18,https://newsatcl-pctr.c.yimg.jp/t/amd-img/20260404-00010006-tennisnet-000-1-view.jpg?exp=10800,2026-04-04T17:17:53+09:00,2026-04-04T17:17:53+09:00,tennis365.net,tennisnet,tennis365.net,1080,"フェイズ・サロフィム&Co.米男子クレーコート選手権 ティアゴ・アグスティン・ティランテ[画像/ゲッティイメージズ] 男子テニスのフェイズ・サロフィム&Co.米男子クレーコート選手権（アメリカ/ヒューストン、クレー、ATP250）は日本時間4日（現地3日）、シングルス準々決勝が行われ、世界ランク83位のT・ティランテ（アルゼンチン）が第1シードのB・シェルトン（アメリカ）を6-7 (5-7), 6-3, 6-4の逆転で下し、初のベスト4進出を果たした。 【動画】第1シード撃破し4強！ティランテ 勝利の瞬間！ 24歳のディランテは同大会初出場。今大会は1回戦でワイルドカード（主催者推薦）で出場した世界ランク164位のC・スミス（アメリカ）、2回戦で同125位のM・マクドナルド（アメリカ）を下し準々決勝に駒を進めた。 23歳で世界ランク9位のシェルトンとの顔合わせとなった準々決勝の第1セット、ティランテは両者譲らずサービスキープを続け突入したタイブレークを落とし先行される。 それでも第2セット、ティランテは第4ゲームでこの日初めてのブレークに成功し、1セットオールに追いつく。 迎えたファイナルセット、ティランテはすべてのサービスゲームをキープすると、リターンゲームでは第9ゲームでブレークを奪い、逆転勝ちで準決勝進出を果たした。 ティランテがツアー大会で4強入りするのは、2024年7月のノルデア・オープン（スウェーデン/バスタッド、レッドクレー、ATP250）以来、約1年9ヵ月ぶり2度目。 また、同大会の2回戦で当時世界ランク8位のA・ルブレフに勝利して以来、2度目の世界ランキングトップ10の選手からの勝利となった。 男子プロテニス協会のATPは公式サイトにティランテのコメントを掲載している。 「この勝利、そして2度目のトップ10選手に対する勝利をとても嬉しく思う。チームとの取り組みが実を結んだと実感している」 「ベン（シェルトン）は非常に手強い選手で、素晴らしい選手だと分かっていたので、試合のいくつかの場面ではリスクを冒す必要があった。そして、実際にそれができた」 「調子が良い時もあれば悪い時もあったけれど、それが鍵だった。常に精神的に強く、相手のサービスゲームをブレークしようと努めなければならなかった。彼は素晴らしいサーブを打つ。僕はできる限りのことをした」 勝利したティランテは準決勝で世界ランク77位のR・ブルチャガ（アルゼンチン）と対戦する。ブルチャガは準々決勝で第3シードのL・ティエン（アメリカ）を下しての勝ち上がり。",[],[]
マッチポイント凌ぎ4年連続4強、世界18位ティアフォー 逆転勝ちで準決勝進出＜男子テニス＞（tennis365.net）,https://news.yahoo.co.jp/articles/e9c845c3690b102babf2c88ba6bd9c69eb8a6e53,https://newsatcl-pctr.c.yimg.jp/t/amd-img/20260404-00010005-tennisnet-000-1-view.jpg?exp=10800,2026-04-04T15:29:40+09:00,2026-04-04T15:29:40+09:00,tennis365.net,tennisnet,tennis365.net,688,"フェイズ・サロフィム&Co.米男子クレーコート選手権 フランシス・ティアフォー[画像/ゲッティイメージズ] 男子テニスのフェイズ・サロフィム&Co.米男子クレーコート選手権（アメリカ/ヒューストン、クレー、ATP250）は日本時間4日（現地3日）、シングルス準々決勝が行われ、第2シードのF・ティアフォー（アメリカ）が世界ランク45位のA・ポピリン（オーストラリア）を3-6, 6-4, 7-6 (8-6)の逆転で下し、4年連続4度目のベスト4進出を果たした。 【動画】ティアフォー 逆転勝ちで4年連続4強！勝利の瞬間！ 28歳で世界ランク18位のティアフォーが同大会に出場するのは5年連続8度目。2023年に優勝、2024年と2025年は準優勝を果たした好相性の大会となっている。 今大会は初戦の2回戦で世界ランク102位のR・ヒジカタ（オーストラリア）を下し準々決勝に駒を進めた。 26歳のポピリンとの顔合わせとなった準々決勝の第1セット、ティアフォーは第8ゲームでブレークを許し先行されたが、第2セットでは第10ゲームでブレークに成功し、1セットオールに追いつく。 迎えたファイナルセットは、両者サービスキープを続けタイブレークに突入する。このタイブレークでティアフォーは5-6とマッチポイントを握られるもこれを凌ぐと、最後はここから3ポイントを連取し勝利を手繰り寄せ、逆転勝ちでベスト4進出を果たした。 勝利したティアフォーは準決勝で第4シードのT・ポール（アメリカ）と対戦する。ポールは準々決勝で第6シードのT・M・エチェベリー（アルゼンチン）を下しての勝ち上がり。",[],[]
清水悠太/トゥロター・ジェームズ組 みやざきチャレンジャー準V、第1シードにストレート負け＜男子テニス＞（tennis365.net）,https://news.yahoo.co.jp/articles/5636cef6ef95366debd3f051e3042267a19b0d9e,https://newsatcl-pctr.c.yimg.jp/t/amd-img/20260404-00010004-tennisnet-000-2-view.jpg?exp=10800,2026-04-04T13:43:51+09:00,2026-04-04T15:30:16+09:00,tennis365.net,tennisnet,tennis365.net,729,"児湯食鳥 みやざきチャレンジャー supported by リポビタン （左から）清水悠太とトゥロター・ジェームズ[画像/tennis365.net] 男子テニスの児湯食鳥 みやざきチャレンジャー supported by リポビタン（日本/宮崎、ハード、ATPチャレンジャー）は4日、ダブルス決勝が行われ、清水悠太/ トゥロター・ジェームズ組は第1シードのナム・ジソン（韓国）/ P・ニクラス-サルミネン（フィンランド）組に5-7, 3-6のストレートで敗れ、準優勝となった。 【アルカラス、シナーら モンテカルロ・マスターズ組合せ】 同大会は今年から新設されたチャレンジャー大会。会場となる「ひなた TENNIS PARK MIYAZAKI」は昨年リニューアルされた施設で、屋外ハードコート18面と室内ハードコート6面を備えた世界基準の施設となっている。 西宮甲英高校時代にチームメイトだった清水とトゥロターは今大会、1回戦で望月勇希/ K・サムレジ（タイ）組、準々決勝で第4シードの上杉海斗/ ジュン・ジェイソン（台湾）組、準決勝でL・ブロディ（イギリス）/ H・ウェンデルケン（イギリス）組を下し決勝に駒を進めた。 一方、ナムとニクラス-サルミネンは準決勝で楠原悠介/中川舜祐組を下しての勝ち上がり。 決勝戦の第1セット、清水とトゥロターは4度のブレークポイントを凌ぐ粘りを見せたものの、第7ゲームをラブゲームで落とす。直後のリターンゲームでブレークバックに成功したが、第11ゲームで再びブレークを許し先行される。 続く第2セット、清水とトゥロターはリターンゲームでチャンスを作れず、第7、第9ゲームでブレークを許し、1時間9分で敗れ準優勝となった。",[],[]
赤土の王者ナダル 女子世界4位を直々指導、低迷シフィオンテクに救いの手＜テニス＞（tennis365.net）,https://news.yahoo.co.jp/articles/bca36498139dad72b40e7741c989230dbc013ab8,https://newsatcl-pctr.c.yimg.jp/t/amd-img/20260404-00010003-tennisnet-000-1-view.jpg?exp=10800,2026-04-04T12:50:56+09:00,2026-04-04T12:50:56+09:00,tennis365.net,tennisnet,tennis365.net,635,ナダルが直々指導 （左から）ラファエル・ナダル、イガ・シフィオンテク[画像/ゲッティイメージズ] 女子テニスで世界ランク4位のI・シフィオンテク（ポーランド）が、ラファ・ナダル・アカデミーでR・ナダル（スペイン）から直々に指導を受ける様子が公開され、注目を集めている。 【動画】ナダルが見守るなか練習を行うシフィオンテク 24歳のシフィオンテクは今季、3大会連続で準々決勝敗退を喫するなど本来の力を発揮しきれない状況が続いていた。さらに、3月に行われたマイアミ・オープン（アメリカ/マイアミ、ハード、WTA1000）2回戦では同胞のM・リネッテ（ポーランド）に逆転負けを喫し、初戦敗退。この結果を受けてウィム・フィセッテとのコーチ関係を解消した。 新たにチームには、かつてナダルを長年支えたフランシスコ・ロイグを迎え入れており、ヨーロッパのクレーシーズン開幕を前にラファ・ナダル・アカデミーで調整を行っている。 今回公開された映像では、ナダル自らがコートに立ち、シフィオンテクにアドバイスを送る場面も確認されている。 全仏オープン（フランス/パリ、レッドクレー、グランドスラム）で14度の優勝を誇るなど「赤土の王者」として世界ランク1位に君臨したナダルと、同大会で4度の優勝を誇るシフィオンテク。クレーコートを得意とする両者の共演は大きな注目を集めている。 新体制のもと、ナダルからの助言をどこまで自身のプレーに落とし込めるか。クレーシーズンでの巻き返しに期待がかかる。,[],[]
加藤未唯ペア 準決勝敗退、ストレート負けで決勝進出ならず＜女子テニス＞（tennis365.net）,https://news.yahoo.co.jp/articles/b716a41e9d4beab0f4f63a8919c1116c918b813f,https://newsatcl-pctr.c.yimg.jp/t/amd-img/20260404-00010002-tennisnet-000-1-view.jpg?exp=10800,2026-04-04T10:52:06+09:00,2026-04-04T10:52:06+09:00,tennis365.net,tennisnet,tennis365.net,657,"クレジット・ワン チャールストン オープン 加藤未唯（2025年）[画像/tennis365.net] 女子テニスのクレジット・ワン チャールストン オープン（アメリカ/チャールストン、クレー、WTA500）は日本時間4日、ダブルス準決勝が行われ、第4シードの加藤未唯/ G・オルモス（メキシコ）組がA・ボンダル（ハンガリー）/ M・フレッチ（ポーランド）組に1-6, 4-6のストレートで敗れ、決勝進出とはならなかった。 【アルカラス、シナーら モンテカルロ・マスターズ組合せ】 31歳でダブルス世界ランク67位の加藤が同大会に出場するのは2年ぶり3度目。33歳で同43位のオルモスとのペアで臨んだ今大会は1回戦でA・アキリ（アメリカ）/ I・コーリー（アメリカ）組、準々決勝でJ・ブレイディ（アメリカ）/ E・ラウトリフ（ニュージーランド）組を下し、4強入りを決めた。 準決勝の第1セット、サービス時のポイント獲得率が23パーセントに留まった加藤とオルモスは1度もキープできずに先行を許すと、第2セットでも2度のブレークを許して0-4と苦しい展開となる。それでも集中を切らさず5本のマッチポイントを凌いで2度のブレークに成功したが、第10ゲームで試合を決めるブレークを奪われ敗退となった。 一方、勝利したボンダル/ フレッチ組は決勝でD・クラウチク（アメリカ）/ C・マクナリー（アメリカ）と対戦する。同ペアは、E・コチャレット（イタリア）/ Y・プチンセワ（カザフスタン）組の棄権により決勝進出を決めている。",[],[]
スペイン期待の19歳ホダル 思わぬ形で初のツアー4強、フォンセカに次ぐ最年少記録も樹立＜男子テニス＞（tennis365.net）,https://news.yahoo.co.jp/articles/ca83db5d0f551b66bd4d543635ad4d2a75a1746b,https://newsatcl-pctr.c.yimg.jp/t/amd-img/20260404-00010001-tennisnet-000-1-view.jpg?exp=10800,2026-04-04T09:20:18+09:00,2026-04-04T09:20:18+09:00,tennis365.net,tennisnet,tennis365.net,1146,"ハッサン2世グランプリ ラファエル・ホダル（画像はマイアミOP）[画像/ゲッティイメージズ] 男子テニスのハッサン2世グランプリ（モロッコ/マラケシュ、レッドクレー、ATP250）は3日、世界ランク89位のR・ホダル（スペイン）と同94位のA・ミュレール（フランス）のシングルス準々決勝が行われたが、ホダルから6-2, 2-0となった時点でミュレールが棄権を表明。これにより、ホダルが思わぬ形でツアー初の4強入りを決めた。 【アルカラス、シナーら モンテカルロ・マスターズ組合せ】 2024年の全米オープンジュニア（アメリカ/ニューヨーク、ハード、グランドスラム）の男子シングルス王者である19歳のホダルは、昨シーズンまでATPチャレンジャーを中心に活躍してきたが、今季から本格的にツアーに参戦。1月はチャレンジャー大会で準優勝を果たすと、全豪オープン（オーストラリア/メルボルン、ハード、グランドスラム）では予選3試合に勝利し本戦入りし初戦を突破した。先月のマイアミ・オープン（アメリカ/マイアミ、ハード、ATP1000）でも予選を突破すると、Y・ハンフマン（ドイツ）やA・ブキッチ（オーストラリア）を下し3回戦に進出している。 今大会は1回戦で予選勝者で世界ランク132位のD・ラヨビッチ（セルビア）、2回戦で第4シードのT・マハツ（チェコ）を破り準々決勝へと駒を進めた。 この日の準々決勝、1度もブレークポイントを与えずキープを重ねたホダルは、2度のブレークを奪って第1セットを先行。続く第2セットでは第2ゲームでブレークに成功すると、この時点でミュレールが棄権を表明し、ホダルが思わぬ形で初のツアーベスト4進出を決めた。 これによりホダルは今世紀に同大会で準決勝に進出した4人目の10代選手となった。また、2006年以降に生まれた選手としては、19歳で世界ランク40位のJ・フォンセカ（ブラジル）に次いで2人目となる。 この約1年で急成長を遂げたホダルは、世界ランク900圏外からキャリアハイの89位まで上昇。先月30日に初めてトップ100入りを果たし、フォンセカに次いでトップ100内で2番目に若い選手となっている。 男子プロテニス協会のATP公式サイトにはホダルのコメントが掲載されている。 「今日は難しい試合だった。このような形で勝ちたくはなかったし、アレックス（ミュレール）の無事を祈っているよ。早く回復して、できるだけ早くコートに戻ってきてほしい。準決勝に進めたことは嬉しいけど、このような形は望んでいなかった」 準決勝でホダルは世界ランク67位のC・カラベリ（アルゼンチン）と対戦する。カラベリは準々決勝で同109位のL・ヴァン・アッシュ（フランス）を下しての勝ち上がり。",[],[]
アルカラスvsワウリンカ 2回戦で実現の可能性、モンテカルロ・マスターズ組合せ決定＜男子テニス＞（tennis365.net）,https://news.yahoo.co.jp/articles/16ea082703101326cd41856766ec517d04b8cbc1,https://newsatcl-pctr.c.yimg.jp/t/amd-img/20260404-00010000-tennisnet-000-1-view.jpg?exp=10800,2026-04-04T08:14:12+09:00,2026-04-04T08:14:12+09:00,tennis365.net,tennisnet,tennis365.net,1253,ロレックス・モンテカルロ・マスターズ （左から）カルロス・アルカラス、スタン・ワウリンカ[画像/ゲッティイメージズ] 4月5日から12日にかけて開催される男子テニスのロレックス・モンテカルロ・マスターズ（モナコ/モンテカルロ、レッドクレー、ATP1000）は3日、シングルスの組み合わせを発表。第1シードで出場するC・アルカラス（スペイン）は初戦の2回戦で世界ランク98位のS・ワウリンカ（スイス）と対戦する可能性がある。 【プロが解説】アルカラスのサーブは何が凄い？ 同大会のシングルスは64ドローだが、上位8選手にはシードが与えられ、その選手たちは1回戦免除となり2回戦から登場する。 22歳で昨年大会の王者のアルカラスは、初戦の2回戦でワウリンカと世界ランク50位のS・バエス（アルゼンチン）のどちらかと対戦することが決まった。 今シーズンでの現役引退を表明している41歳のワウリンカは、今大会にワイルドカード（主催者推薦）で出場する。同大会では2014年にM・チリッチ（クロアチア）やM・ラオニッチ（カナダ）、D・フェレール（スペイン）を下し決勝に進出すると、最後はR・フェデラー（スイス）を破って優勝。なお、これがワウリンカにとって唯一の「ATPマスターズ1000」のタイトルとなっている。 また、第2シードで世界ランク2位のJ・シナー（イタリア）は今大会で同1位のアルカラスを抜き、再びトップの座に返り咲く可能性がある。ただしそのためには少なくともベスト4進出が必要。優勝すれば無条件で世界ランク1位復帰が決まる。 そのシナーの初戦となる2回戦で、ワイルドカードで出場する世界ランク328位のM・クアメ（フランス）と対戦する可能性がある。 17歳のクアメは、2月のオクシタニー・オープン（フランス/モンペリエ、室内ハード、ATP250）では2000年以降で6番目の若さでATPツアー本戦入りを果たすと、先月行われたマイアミ・オープン（アメリカ/マイアミ、ハード、ATP1000）でツアー初白星を挙げるなど頭角を現している新星。今大会の1回戦では世界ランク34位のU・アンベール（フランス）と顔を合わせる。 そのほか1回戦における注目カードは以下の通り。 ※ドロー順、[]はシード順 T・M・エチェベリー（アルゼンチン） vs G・ディミトロフ（ブルガリア） T・アトマン（フランス） vs [14]F・ティアフォー（アメリカ） G・モンフィス（フランス） vs T・フリークスポール（オランダ） J・メンシク（チェコ） vs F・マロジャン（ハンガリー） H・フルカチュ（ポーランド） vs L・ダルデリ（イタリア） J・フォンセカ（ブラジル） vs G・ディアロ（カナダ） A・リンデルクネシュ（フランス） vs [12]K・ハチャノフ [13]A・ルブレフ vs N・ボルジェス（ポルトガル） チリッチ vs 予選勝者 [16]F・セルンドロ（アルゼンチン） vs S・チチパス（ギリシャ）,[],[]
