headline,mainEntityOfPage,image,datePublished,dateModified,author,media_en,media_jp,str_count,body,images,external_links
連覇狙う横浜・村田監督「厳しいブロック引くと…」　センバツ抽選会（センバツLIVE！）,https://news.yahoo.co.jp/articles/7045b2af42701fee9857b8d02341c1d3c873238e,https://newsatcl-pctr.c.yimg.jp/t/amd-img/20260306-00000011-senbatsuf-000-2-view.jpg?exp=10800,2026-03-06T13:00:34+09:00,2026-03-06T14:35:49+09:00,センバツLIVE！,senbatsuf,センバツLIVE！,900,横浜の村田浩明監督＝阪神甲子園球場で2025年8月19日、長澤凜太郎撮影 第98回選抜高校野球大会の組み合わせ抽選会が6日、大阪市北区の毎日新聞大阪本社オーバルホールであり、対戦相手が決まった。 【写真で】好カード続々 組み合わせ抽選会 史上4校目の大会連覇に挑む横浜（神奈川）は第2日の第2試合で神村学園（鹿児島）と顔を合わせる。 抽選会後の横浜・村田浩明監督と小野舜友主将の主なコメントは次の通り。 ◇横浜・村田浩明監督 対戦相手が決まり、もう一個スイッチ入った感じです。神村学園は毎年のように甲子園に出られている強いチームですから、しっかり調べてどういうふうに戦うかを模索したいと思います。 ＜花巻東（岩手）、智弁学園（奈良）と強豪が集うブロックに入った＞ どこも強いチームですから、激戦というより、勝ち上がれば強くなれる組み合わせに入ったなというぐらいでしか考えていないです。うちはうちなんで、力を発揮させて、どこまで上り詰められるかという楽しみでしかないです。 （主将の）小野は気持ちの入った男なので、厳しいブロックを引くなという準備はしていました。小野らしいなと思いますね。 ＜連覇を目指す＞ 現場としては連覇という意識はあまり持っていません。一戦一戦戦った先に連覇が見えてくると思うので先走らないように、しっかり準備してやっていきたいと思います。 ◇横浜・小野舜友主将 神村学園さんは甲子園でも名の知れた高校。全国的に強いトップチームと初戦から対戦できるのはすごく楽しみです。 ＜ブロックの印象は＞ ブロックというよりは、もう初戦しか見ていない。神村学園さんにどういう野球ができるかという部分が一番大事だと思うので、ブロックはあんまり気にしていないというか、とにかく初戦にぶつける思いでいます。 ＜連覇へ向けて＞ 連覇と言われますが、本当に一戦必勝、全員野球という部分で、今年は今年という思いでやっています。とにかく初戦というふうにミーティングでも言い続けてきました。 全員が日本一になるという強い思いを持ち、その塊の集合体が全員野球だと思うので、しっかりと体現できるようにしたいです。,[],[]
「菰田バンバン使うつもりない」山梨学院・吉田監督　センバツ抽選会（センバツLIVE！）,https://news.yahoo.co.jp/articles/c4130db14f3056036fc9a834da50b64a0ba8d169,https://newsatcl-pctr.c.yimg.jp/t/amd-img/20260306-00000010-senbatsuf-000-1-view.jpg?exp=10800,2026-03-06T12:56:47+09:00,2026-03-06T12:56:47+09:00,センバツLIVE！,senbatsuf,センバツLIVE！,838,【山梨学院－専大松戸】山梨学院の吉田洸二監督＝甲府市の山日YBS球場で2025年10月25日、三浦研吾撮影 第98回選抜高校野球大会の組み合わせ抽選会が6日、大阪市北区の毎日新聞大阪本社オーバルホールであり、対戦相手が決まった。 【写真で】好カード続々 組み合わせ抽選会 出場校最長となる5年連続出場で、投打「二刀流」の菰田陽生（はるき）選手らを擁する山梨学院は、大会第4日の第3試合で長崎日大と顔を合わせる。 山梨学院の吉田洸二監督の主なコメントは次の通り。 ◇山梨学院・吉田洸二監督 ＜昨夏の甲子園は4強。優勝候補の一角に挙げられている＞ 5年連続出場というのもなかなかないので、これまでの先輩たちも喜んでいると思います。 チームの力は（監督である）自分が誰よりも知っているつもりで、私は優勝候補ではないと思っています。そのプレッシャーとか、やらなきゃいけないという感覚は、正直ないですね。 ただ、（左腕の）檜垣（瑠輝斗）と菰田が大化けしたことで、そう言ってもらえることはありがたいです。檜垣の本来の投球を見せて、菰田とコラボしてくれればなと思っています。 監督としてセンバツで優勝した時は、（2009年大会の長崎・清峰の）今村猛、（23年大会の山梨学院の）林謙吾と、エースが1人しかいなかった。投手力は自分が率いたチームの中で突出しています。 ＜菰田選手の成長について＞ キャプテンとして、どうしたらうまくチームを引っ張れるんだろうと考えることが彼の成長につながると思っています。 すごくキャプテンシーを出してやっているわけではないけれど、悩むことが、彼が次のステップに進む上で良い経験になっていると思います。 技術面では、冬に投手の練習の割合を増やしたので、投手としてはかなりいい。野手としてはどれくらいやれるか未知数です。 ただ、菰田をそこまでバンバン使うつもりもない。檜垣との継投を考えています。夏に投げられなくなるといけないので、そういう起用はしないと思います。,[],[]
神宮大会決勝再現に九州国際大付監督「びっくり」　センバツ抽選会（センバツLIVE！）,https://news.yahoo.co.jp/articles/e25b88e24b43a6d9085c016ed6124397515d3476,https://newsatcl-pctr.c.yimg.jp/t/amd-img/20260306-00000009-senbatsuf-000-1-view.jpg?exp=10800,2026-03-06T12:46:56+09:00,2026-03-06T12:46:56+09:00,センバツLIVE！,senbatsuf,センバツLIVE！,621,【山梨学院－九州国際大付】九州国際大付の楠城祐介監督＝神宮球場で2025年11月16日、新宮巳美撮影 第98回選抜高校野球大会の組み合わせ抽選会が6日、大阪市北区の毎日新聞大阪本社オーバルホールであり、対戦相手が決まった。 【写真で】好カード続々 組み合わせ抽選会 昨秋の明治神宮大会を制して「秋春連覇」を狙う九州国際大付（福岡）は、第4日第1試合で、昨秋の近畿大会覇者で明治神宮大会準優勝の神戸国際大付（兵庫）と再び顔を合わせる。 抽選会後の九州国際大付・楠城祐介監督の主なコメントは次の通り。 ◇九州国際大付・楠城祐介監督 （再戦が決まり）びっくりしました。（神戸国際大付は）いいバッターがたくさんいる。研究して臨みたい。自分たちの戦い方は変わらない。投手が抑えて、しっかり守ってそこからの打撃だと思っている。改めて初戦に向けて守備面を強化して臨みたい。 ＜明治神宮大会決勝では11―1で快勝した＞ 自信にはなったと思うが、戦力的にそんな大きな差があったわけではない。しっかり気を引き締めて臨みたい。 ＜明治神宮大会覇者として臨む＞ そんな自信が過信にしかならないから、脱ぎ捨ててトレーニングに臨もうとしてきた。ただ、センバツ初戦を迎える時は新たに自信に変えて臨みたいと思っている。 ＜秋からチームが成長した部分は＞ 秋は投手の制球が課題だった。そこの強化に努めた。（1年生左腕の）岩見輝晟（らいせ）は制球力が上がった。岩見に期待したい。,[],[]
大阪桐蔭は1回戦の最後　西谷監督「センバツは初戦難しい」　抽選会（センバツLIVE！）,https://news.yahoo.co.jp/articles/a58bdda29bfc51ce75fceb28141f7ae6f482499c,https://newsatcl-pctr.c.yimg.jp/t/amd-img/20260306-00000008-senbatsuf-000-1-view.jpg?exp=10800,2026-03-06T12:24:34+09:00,2026-03-06T12:24:34+09:00,センバツLIVE！,senbatsuf,センバツLIVE！,719,大阪桐蔭の西谷浩一監督＝奈良県橿原市のさとやくスタジアムで2025年5月25日、長宗拓弥撮影 第98回選抜高校野球大会の組み合わせ抽選会が6日、大阪市北区の毎日新聞大阪本社オーバルホールであり、大阪桐蔭は1回戦で最後の登場となる第6日の第1試合で熊本工との対戦が決まった。 【写真で】好カード続々 組み合わせ抽選会 大阪桐蔭の西谷浩一監督の抽選会後の主なコメントは次の通り。 ◇大阪桐蔭・西谷浩一監督 （1回戦の）最後になるのは結構多いんですよね。始まる前は「2、3日目がいいな」とか思うんですけど、決まればもう6日目に合わせるだけなので。 ＜2回戦以降までの試合間隔が短くなった＞ それは勝った時に（考える）。初戦を勝たないと、（日程が）詰まっていく試合もできませんからね。 ＜初戦の入り方で大事なことは＞ 夏も（初戦は）難しいんですが、センバツは特に難しいと子どもたちにも言っています。夏は大阪（大会）を勝ってから少し休んで、その勢いのままいけますけど、（春は前年の）11月から公式戦を離れていますからね。どれだけそこ（初戦）に（コンディションを）持っていけるかだと思います。 ＜春夏通算10回目の日本一が懸かる＞ 簡単ではないことは分かっている中で、それ（日本一）を口にしていますので。まず熊本工さんに勝ってから、次の試合のことを考えたいと思います。 ＜昨年は甲子園出場がなかった＞ 前チーム主将の中野（大虎）を中心に頑張ってくれたチームで、私としてはどうしても甲子園に連れて行きたかったチームでしたけど、私がうまくできずに連れて行けませんでしたのでね。みんな応援してくれていると思いますので、良い報告ができるように頑張りたいです。,[],[]
開幕試合に沖縄尚学・比嘉監督「初日だけは…」　センバツ抽選会（センバツLIVE！）,https://news.yahoo.co.jp/articles/ca23d2a29030bca4f64e92b0eba1fe10458fc2a9,https://newsatcl-pctr.c.yimg.jp/t/amd-img/20260306-00000007-senbatsuf-000-2-view.jpg?exp=10800,2026-03-06T12:01:50+09:00,2026-03-06T20:34:05+09:00,センバツLIVE！,senbatsuf,センバツLIVE！,634,沖縄尚学の比嘉公也監督＝宮崎市のSOKKENスタジアムで2025年10月28日、角田直哉撮影 第98回選抜高校野球大会の組み合わせ抽選会が6日、大阪市北区の毎日新聞大阪本社オーバルホールであった。 【写真で】好カード続々 組み合わせ抽選会 昨夏の甲子園大会を制し、43年ぶり史上5校目の「夏春連覇」を狙う沖縄尚学は、開幕試合で昨秋の東京大会覇者の帝京（東京）と顔を合わせる。 抽選会後の沖縄尚学・比嘉公也監督の主なコメントは次の通り。 ◇沖縄尚学・比嘉公也監督 対戦相手というよりも、初日だけは避けてほしいなという思いだった。開会式が終わった後で慌ただしい。 スロースターター気味のチームなので、大会の雰囲気を味わわせてから初戦を迎えたいと正直、思っていた。決まった以上はなんとかその日に調整して合わせたい。 開幕試合は（2013年に）敦賀気比（福井）とさせてもらって、ボロ負けした苦い経験、思い出しかないです。ゲームの前半で勝負が決まった感じだった。その話は帰ってすぐにしようかと思います。 ＜帝京の印象は＞ ゲームは見たことないですけど、イメージは強力打線。練習試合は（06年に監督に就任してから）やったことはないです。 ＜エース左腕・末吉良丞投手の状態は＞ 先週までインフルエンザにかかっていた。（状態を）上がってきてくれるのを今は願うばかり。 成長しているかどうかがこの大会で出るのかなと。現状で満足せずにさらに高みというか、球種を増やそうと工夫は見られます。,[],[]
横浜、沖縄尚学、九州国際大付…　センバツ抽選会場は「どよめき」（センバツLIVE！）,https://news.yahoo.co.jp/articles/137f55aad863c17ab85390232e0319a90818834b,https://newsatcl-pctr.c.yimg.jp/t/amd-img/20260306-00000006-senbatsuf-000-2-view.jpg?exp=10800,2026-03-06T10:50:27+09:00,2026-03-06T11:04:16+09:00,センバツLIVE！,senbatsuf,センバツLIVE！,926,明治神宮大会で優勝し、喜ぶ九州国際大付の選手たち＝神宮球場で２０２５年１１月１９日、西夏生撮影 第98回選抜高校野球大会の組み合わせ抽選会が6日、大阪市内であり、楽しみなカードが続々と決まった。出場32校の主将がくじを引くたびにどよめきが起き、選手たちは初戦に向けて気持ちを高ぶらせた。 【写真で】好カード続々 組み合わせ抽選会 史上4校目の大会連覇に挑む横浜（神奈川）は第2日の第2試合に登場。1回戦で神村学園（鹿児島）と対戦する。昨年は充実した戦力で19年ぶりにセンバツ制覇。8強入りした夏の選手権では県岐阜商との準々決勝で延長十一回に及ぶ熱戦を演じ、強い印象を残した。 村田浩明監督は「相手が決まり、心のスイッチが入った。一試合一試合の先に連覇が見えてくると思う。先走らないよう、しっかり準備したい」と語った。 昨夏の選手権を初制覇し、1983年の池田（徳島）以来となる史上5校目の「夏春連覇」を目指す沖縄尚学は大会初日の開幕試合で帝京（東京）との顔合わせに。昨秋の九州大会は準々決勝で敗退も、九州地区の出場枠4枠が「神宮大会枠」で1増となり9回目の出場をつかんだ。 センバツは99年、2008年で2回頂点に立つなど相性はいい。比嘉公也監督は「開幕試合は慌ただしいので、初回の入り方に気をつけたい」と気を引き締めた。山川大雅（たいが）主将（2年）は「（夏春連覇の）プレッシャーは感じません。自分たちのやってきたことを甲子園で発揮したい」と闘志を燃やす。 昨年11月の明治神宮野球大会で初優勝して「秋の王者」となった九州国際大付（福岡）は第4日の第1試合で神戸国際大付（兵庫）と対戦する。神宮大会決勝カードが初戦から実現することになり会場が沸いた。 九州国際大付は新チームとなってからの公式戦は14戦全勝。投打に能力の高い大型選手をそろえる一方で、1点差勝利が7試合もあり、勝負強さも併せ持つ。捕手で攻守の要となっている城野慶太主将（2年）は「神宮大会決勝と同じ対戦相手となり驚いた。打力、投手力とも強いという印象が残っている。お互いにどれだけレベルアップしたかを確かめ合える試合になるので楽しみです」と意気込んだ。【栗林創造、中田博維、矢倉健次】,[],[]
センバツ組み合わせ決定　横浜は神村学園、沖縄尚学は帝京と開幕戦（センバツLIVE！）,https://news.yahoo.co.jp/articles/190c5d7aec489b33b8597e5aaa13e86fd8edf4df,https://newsatcl-pctr.c.yimg.jp/t/amd-img/20260306-00000005-senbatsuf-000-5-view.jpg?exp=10800,2026-03-06T10:29:54+09:00,2026-03-06T14:05:35+09:00,センバツLIVE！,senbatsuf,センバツLIVE！,855,対戦が決まり健闘を誓う帝京の池田大和主将（左）と沖縄尚学の山川大雅主将＝大阪市北区で2026年3月6日、中川祐一撮影 第98回選抜高校野球大会（毎日新聞社、日本高校野球連盟主催、朝日新聞社後援、阪神甲子園球場特別協力）の組み合わせ抽選会が6日、大阪市北区の毎日新聞大阪本社オーバルホールであり、対戦相手が決まった。 【写真で】好カード続々 組み合わせ抽選会 8年ぶり史上4校目の「春連覇」を狙う横浜（神奈川）は第2日第2試合で神村学園（鹿児島）と戦う。43年ぶり5校目の「夏春連覇」を目指す沖縄尚学は開幕試合で帝京（東京）と対戦。昨秋の明治神宮大会優勝の九州国際大付（福岡）は第4日第1試合で同準優勝の神戸国際大付（兵庫）とぶつかる。史上最多に並ぶ5回目の優勝を目指す大阪桐蔭は第6日第1試合で熊本工と顔を合わせる。 一般枠で唯一の初出場の帝京長岡（新潟）は第5日第1試合で東北（宮城）と対戦。21世紀枠では初出場の高知農が第3日第2試合で日本文理（新潟）と、75年ぶり出場の長崎西は第2日第1試合で滋賀学園と戦う。 開会式の選手宣誓は、抽選で北照（北海道）の手代森（てしろもり）煌斗（きらと）主将が引き当てた。大会は19日から13日間（準々決勝、準決勝翌日の休養日を含む）、兵庫県西宮市の阪神甲子園球場で開催される。【長宗拓弥】 ◇1回戦の組み合わせ 【第1日】 帝京―沖縄尚学（10時半） 阿南光―中京大中京（13時） 八戸学院光星―崇徳（15時半） 【第2日】 滋賀学園―長崎西（9時） 横浜―神村学園（11時半） 花巻東―智弁学園（14時） 【第3日】 東洋大姫路―花咲徳栄（9時） 高知農―日本文理（11時半） 北照―専大松戸（14時） 【第4日】 神戸国際大付―九州国際大付（9時） 近江―大垣日大（11時半） 山梨学院―長崎日大（14時） 【第5日】 東北―帝京長岡（9時） 高川学園―英明（11時半） 三重―佐野日大（14時） 【第6日】 熊本工―大阪桐蔭（9時） ※カッコ内は試合開始予定時間,[],[]
センバツ選手宣誓は北海道・北照主将　「狙っていたのでうれしい」（センバツLIVE！）,https://news.yahoo.co.jp/articles/a3b49afdd7b2d57cef3d3d4cdbf1f2e329b3ed75,https://newsatcl-pctr.c.yimg.jp/t/amd-img/20260306-00000004-senbatsuf-000-3-view.jpg?exp=10800,2026-03-06T10:26:06+09:00,2026-03-06T11:13:17+09:00,センバツLIVE！,senbatsuf,センバツLIVE！,338,開会式で選手宣誓することが決まり、あいさつする北照の手代森煌斗主将＝大阪市北区の毎日新聞大阪本社オーバルホールで2026年3月6日、小関勉撮影 第98回選抜高校野球大会の組み合わせ抽選会が6日、大阪市内であり、選手宣誓は北照（北海道）の手代森煌斗（てしろもり・きらと）主将（2年）に決まった。 【写真で】好カード続々 組み合わせ抽選会 出場する全32校の主将がくじを引き一斉に開封。当たりと分かった瞬間、すっと手をあげて壇上に。5日にあったキャプテントークでは、ただ一人選手宣誓を希望していたといい、司会者から感想を聞かれると「狙っていたのでうれしい。一生に一度の経験」と答えた。 大役に向けては「たくさんの方が支えてくださったという言葉をぜひ入れたい」と語った。【岡崎英遠】,[],[]
センバツ1回戦で神宮決勝カードが実現　九州国際大付×神戸国際大付（センバツLIVE！）,https://news.yahoo.co.jp/articles/1d8652f2f81f2b6c4675adfe997dd37af263c8a4,https://newsatcl-pctr.c.yimg.jp/t/amd-img/20260306-00000003-senbatsuf-000-4-view.jpg?exp=10800,2026-03-06T09:54:53+09:00,2026-03-06T14:02:51+09:00,センバツLIVE！,senbatsuf,センバツLIVE！,216,対戦が決まり健闘を誓う神戸国際大付の井本康太主将（左）と九州国際大付の城野慶太主将＝大阪市北区で2026年3月6日、小関勉撮影 第98回選抜高校野球大会の組み合わせ抽選会が6日、大阪市北区の毎日新聞大阪本社オーバルホールであり、対戦相手が決まった。 【写真で】好カード続々 組み合わせ抽選会 昨秋の明治神宮大会優勝の九州国際大付（福岡）と準優勝の神戸国際大付（兵庫）の強豪校同士が第4日（22日）の第1試合でぶつかることが決まった。,[],[]
開幕カードは帝京×沖縄尚学　センバツ組み合わせ抽選会（センバツLIVE！）,https://news.yahoo.co.jp/articles/1df2557d83a1dcfda70c503bf990ee471c9ba087,https://newsatcl-pctr.c.yimg.jp/t/amd-img/20260306-00000002-senbatsuf-000-5-view.jpg?exp=10800,2026-03-06T09:47:55+09:00,2026-03-06T10:47:51+09:00,センバツLIVE！,senbatsuf,センバツLIVE！,195,組み合わせ抽選会で札の番号を読み上げる帝京の池田大和主将＝大阪市北区の毎日新聞大阪本社オーバルホールで2026年3月6日、小関勉撮影 第98回選抜高校野球大会の組み合わせ抽選会が6日、大阪市北区の毎日新聞大阪本社オーバルホールであり、対戦相手が決まった。 【写真で】好カード続々 組み合わせ抽選会 19日の開幕カードは昨夏の甲子園大会優勝の沖縄尚学と16年ぶり出場の帝京（東京）に決まった。,[],[]
センバツの抽選方法、夏の甲子園と比べて複雑な理由は？　高校野球（センバツLIVE！）,https://news.yahoo.co.jp/articles/5f971d6a7b3752d233116ec89a0ac9904b177c2b,https://newsatcl-pctr.c.yimg.jp/t/amd-img/20260306-00000001-senbatsuf-000-2-view.jpg?exp=10800,2026-03-06T07:00:26+09:00,2026-03-06T10:45:50+09:00,センバツLIVE！,senbatsuf,センバツLIVE！,1004,前回第97回選抜高校野球大会の組み合わせ抽選会で最後の札の番号を読み上げる日本航空石川の及川蓮志主将＝大阪市北区の毎日新聞大阪本社オーバルホールで2025年3月7日、小関勉撮影 第98回選抜高校野球大会の組み合わせ抽選会が、6日午前9時から行われる。 春のセンバツの抽選方法は、夏の甲子園大会とは大きく異なる。 【写真で】好カード続々 組み合わせ抽選会 夏は、2校が出場する北海道と東京については、それぞれの2校が初戦で対戦することは避けるものの、それ以外はフリーの抽選となる。 一方、センバツはトーナメントが「地区別対抗」になるような分け方をするのが特徴だ。 ルールの一つは、同じ地区の出場校が準々決勝まで対戦しないこと。同じ都道府県から2校が出る場合は決勝まで対戦を避ける、という決まりもある。同じ都道府県から3校出場した大会では準決勝まで対戦を避けた例もある。 各校は最初に、抽選会場（大阪市北区の毎日新聞大阪本社オーバルホール）に到着した順に予備抽選のくじを引く。 本抽選のくじは、同一地区、同一都道府県の対戦を避けるよう割り振りを調整する。 今大会は、出場校が最多6校ある関東・東京、近畿、九州の3地区から本抽選に臨む。どの地区から本抽選をするかは予備抽選で決まり、各校は若い番号を引いた順にくじを引く。 そして、くじを引いた各校の主将たちは「○○高校○番です」と読み上げていく。 3地区が終わった後は、出場校が3校の東北、東海、四国の3地区に、1校の北海道を加え、本抽選をする。その後に出場校が2校の北信越と中国の2地区がくじを引く。いずれも、予備抽選の順となる。 センバツは第68回大会（1996年）までは、1回戦が「東西対決」となるよう振り分けていたが、「地区別対抗」を色濃く打ち出すため、第69回大会（97年）に現在の抽選方法を取り入れた。 第93回大会（2021年）と第94回大会（22年）に限っては新型コロナウイルスの感染拡大の影響により、オンライン上での抽選となったため、同地区同士でも1回戦から対戦する可能性があるフリー抽選で行われた。 夏は第60回大会（78年）から「東西対決」の方式を採用していたが、第89回大会（07年）からは現在のフリー抽選に移行した。東西の境目にあたる北信越は地区内で分断され、隣県同士などの顔合わせが頻発したことなどから、変更した歴史がある。【長宗拓弥】,[],[]
