headline,mainEntityOfPage,image,datePublished,dateModified,author,media_en,media_jp,str_count,body,images,external_links
カルディ「ネコミニバッグ」をオンラインストア限定で発売（グルメ Watch）,https://news.yahoo.co.jp/articles/0dee8c0e95934065f8bdd5a91a9dbbb0d6998b76,https://newsatcl-pctr.c.yimg.jp/t/amd-img/20260306-00000018-impgrw-000-1-view.jpg?exp=10800,2026-03-06T21:50:00+09:00,2026-03-06T21:50:00+09:00,グルメ Watch,impgrw,グルメ Watch,213,"写真：グルメ Watch カルディコーヒーファーム（KALDI COFFEE FARM・キャメル珈琲）はオンラインストア限定で「ネコミニバッグ」を発売した。 【この記事に関する別の画像を見る】 2月の販売時にはチョコラスクだったが、今回はアーモンドチョコが4個付いて価格は598円。かわいいネコたちをデザインしたミニバッグで、サイズは約130×80×40mm（持ち手含まず）となっている。 グルメ Watch,編集部：稲葉隆司",[],[]
サントリー、ブルーアガベ100％使用＆熟成なしで仕上げた「テキーラ トレスジェネレーション プラタ」（グルメ Watch）,https://news.yahoo.co.jp/articles/60f07b88e18e1d16c340203ab05a25ad68d64c35,https://newsatcl-pctr.c.yimg.jp/t/amd-img/20260306-00000017-impgrw-000-1-view.jpg?exp=10800,2026-03-06T19:04:00+09:00,2026-03-06T19:04:00+09:00,グルメ Watch,impgrw,グルメ Watch,738,"写真：グルメ Watch サントリーは「テキーラ トレスジェネレーション プラタ」を4月7日に発売する。750mL瓶でアルコール分は40％、価格は4900円前後（税別）。また、4月7日から虎ノ門ヒルズ内の「虎ノ門横丁」でイベントを実施する。 【この記事に関する別の画像を見る】 メキシコにあるサウザ蒸溜所が自社で6年から8年栽培し、成熟させたブルーアガベを100％使用。火山岩で濾過された水、最新技術であるディフューザー製法を用いており、連続式蒸溜器とポットスチルで3回蒸溜することで、ブルーアガベの風味を感じられるなめらかな味わいを実現している。 ■ サントリー「テキーラ トレスジェネレーション プラタ」 内容量：750mL アルコール分：40％ 中味： ［色］無色透明 ［香り］ほのかな柑橘、華やかな香りをまとった穏やかでフレッシュなアガベ ［味わい］クリアで癖がなく、新鮮で澄み切ったアガベ感と、心地よいスパイス感の両立 ［余韻］胡椒のようなキレが良くさわやかな余韻 ■ 「テキーラ トレスジェネレーション プラタ」体験イベント 日時：2026年4月7日～17日、平日 11時～23時（一部店舗除く）、日祝 11時～21時（一部延長店舗あり） 会場：虎ノ門ヒルズ ビジネスタワー3階「虎ノ門横丁」（東京都港区虎ノ門一丁目17番1号） 提供メニュー： ・約25店舗で人気店とコラボしたさまざまなプラタのドリンクを提供 ・ポップアップスペースの特設ブースで、プラタ（樽熟成なし）、レポサド（アメリカンオークの新樽で4か月以上熟成）、アネホ（アメリカンオークの新樽で12か月以上熟成）の3種を飲み比べ 公式サイト：「虎ノ門横丁で体験イベント」 グルメ Watch,野村シンヤ",[],[]
トマト＆オニオン「春グルメフェア」で「幸せのハンバーグ」アレンジ登場。ジャンボ海老フライ/ビフテキなどのコンビ（グルメ Watch）,https://news.yahoo.co.jp/articles/fb3821ccd177fa721622586e80e1c54542d96f39,https://newsatcl-pctr.c.yimg.jp/t/amd-img/20260306-00000016-impgrw-000-1-view.jpg?exp=10800,2026-03-06T14:00:00+09:00,2026-03-06T14:00:00+09:00,グルメ Watch,impgrw,グルメ Watch,1050,"写真：グルメ Watch アメリカンダイニングレストラン「トマト＆オニオン」（トマトアンドアソシエイツ）は、「春グルメフェア」を3月5日～5月20日の期間限定で実施する。 【画像】“黒毛和牛＆国産黒豚”幸せのハンバーグ ～ポモドーロソース～ フェアメニューには、「幸せのハンバーグ」のアレンジや、春らしい彩り鮮やかなパスタ、ピザなどが登場する。ハンバーグのソースは、ガーリックの香りとセミドライトマトで仕上げた濃厚なポモドーロソースと、とろみ柚子おろしの2種類を用意。ジャンボ海老フライやビフテキと合わせたコンビメニューや、パンを浸して楽しめるスープ仕立て、甘めのタレと濃厚な黄身に絡めて味わえる御膳などのアレンジも提供する。 「幸せのハンバーグ」は、黒毛和牛7：国産黒豚3という黄金比と独自配合の香辛料にこだわり、素材が持つ上質な旨みを最大限引き出している。肉汁を閉じ込める「二重構造」により、鉄板の上でナイフを入れた瞬間に肉汁が溢れ出す「最高峰の肉汁体験」が味わえるという。 また、いちごをふんだんに使ったパフェ、ロールケーキやシェイクを販売する「ストロベリーフェア」も同期間に実施する。 ■ トマト＆オニオン「春グルメフェア」 実施期間：2026年3月5日～5月20日 実施店舗：トマト＆オニオン全店 ※3月17日オープン予定の多摩センター駅前店は対象外 ※足立入谷店では3月24日に開始 メニュー： ・「“黒毛和牛＆国産黒豚”幸せのハンバーグ ～ポモドーロソース～」（1649円） ・「“黒毛和牛＆国産黒豚”幸せのハンバーグ ～とろみ柚子おろし～」（1649円） ・「“黒毛和牛＆国産黒豚”幸せのハンバーグ＆ジャンボ海老フライ」（2089円） ・「“黒毛和牛＆国産黒豚”幸せのハンバーグ＆ビフテキ」（2419円） ・「“黒毛和牛＆国産黒豚”幸せのハンバーグ＆カニ爪クリームコロッケ」（2254円） ・「“黒毛和牛＆国産黒豚”幸せのハンバーグ ～あめ色玉ねぎスープ仕立て～」（1759円） ・「“黒毛和牛＆国産黒豚”幸せのハンバーグ御膳」（1979円） ・「フレッシュモッツァレラとポモドーロのパスタ」（1319円） ・「海老とフレッシュアボカドのビスククリームパスタ」（1429円） ・「太陽のマルゲリータ」（1099円） ※「幸せのハンバーグ＆ジャンボ海老フライ/ビフテキ/カニ爪クリームコロッケ」のソースはポモドーロソースととろみ柚子おろしから選択 グルメ Watch,編集部：高嶋エリサ",[],[]
ドミノ・ピザ、好みの1枚とカーレース観戦を楽しむ「レッドブルチーム応援キャンペーンセット」発売（グルメ Watch）,https://news.yahoo.co.jp/articles/5fe36b00481070699ed8902db21bd303ea0b15d9,https://newsatcl-pctr.c.yimg.jp/t/amd-img/20260306-00000015-impgrw-000-1-view.jpg?exp=10800,2026-03-06T13:00:00+09:00,2026-03-06T13:00:00+09:00,グルメ Watch,impgrw,グルメ Watch,832,"写真：グルメ Watch ドミノ・ピザ ジャパンは、カーレースを盛り上げる「レッドブルチーム応援キャンペーン」を3月6日～4月5日の期間限定で実施する。 【画像】ドミノ・ピザ「ドミノ・デラックス」 キャンペーンでは、ピザ1枚、サイドメニュー1品、レッドブル・エナジードリンク250mLを組み合わせた「レッドブルチーム応援キャンペーンセット」を販売する。セットを購入すると、先着・数量限定で、レッドブル・レーシングまたはレーシング・ブルズのラバーキーホルダーがもらえる。全6種のうち2種は、マシンをモチーフにしたドミノ・ピザ限定デザインとなっている。 セットのピザは全商品が対象で、定番の「ドミノ・デラックス」や「クワトロ・オールスター」など好みの1枚を選べる。サイドメニューは、ポテトやナゲット、「焼きたてカスタードパイ」など、デザートを含む全15品から選択可能。レッドブル・エナジードリンクと合わせて、エネルギーチャージをしながらカーレース観戦が楽しめる。 ■ ドミノ・ピザ「レッドブルチーム応援キャンペーン」 実施期間：2026年3月6日～4月5日 価格：デリバリー（1999円～）、持ち帰り（1599円～） クーポン番号：デリバリー（407961）、持ち帰り（482919） セット内容： ・ピザ1枚（全商品対象） ・サイドメニュー1品（デザートを含む15商品対象） ・レッドブル・エナジードリンク 250mL ・レッドブル・レーシングまたはレーシング・ブルズのラバーキーホルダー（先着・数量限定） ※キーホルダーは全6種のうちいずれか1点で、デザインの選択不可 レッドブル・レーシングは2005年にカーレースに参戦。レーシング・ブルズはレッドブル・グループのチームとして、将来のトップドライバー育成を担っている。キャンペーンのキーホルダーには、ヘルメット2種、ロゴ2種、限定のマシンモチーフ2種のデザインが登場する。 グルメ Watch,編集部：高嶋エリサ",[],[]
ポル・アッカー・クレマン・ド・ロワール（白）（グルメ Watch）,https://news.yahoo.co.jp/articles/caf2bd2f50c8567849f99d87488fe5c84cfd6a5c,https://newsatcl-pctr.c.yimg.jp/t/amd-img/20260306-00000014-impgrw-000-1-view.jpg?exp=10800,2026-03-06T12:30:00+09:00,2026-03-06T12:30:00+09:00,グルメ Watch,impgrw,グルメ Watch,962,"写真：グルメ Watch ワインを購入しようと売り場を訪れたものの、種類が多すぎてどうやって選んだらいいのか分からない。でも、値段を考えると失敗もしたくない。そんなときに参考にしたいのがプロのアドバイスだ。 【画像】ワインキュレーション 商品開発部の岡田さん 今回は、ワイン専門のECサイト「京橋ワイン」を運営するほか、飲食店や酒販店向けの卸売なども手掛けるワインキュレーション 商品開発部の岡田さんにオススメの1本を伺った。 ――このワインを選んだ理由を教えてください。 岡田氏：シャンパーニュと同じ伝統製法で造られながら、手頃な価格で楽しめるのがクレマンの魅力です。「気軽に味わえる贅沢」として、日常にも特別な日にも寄り添ってくれます。なかでもロワールのクレマンは、果実味豊かで親しみやすく、私自身とても好きなスタイル。皆さんにも“毎日飲める上質な泡”としてご紹介したいと思い、今回セレクトしました。 ――生産者や産地には、どんなストーリーや背景がありますか？ 岡田氏：クレマン・ド・ロワールは、フランス屈指の冷涼産地ロワールならではの澄んだ酸と軽快な飲み心地が魅力です。青リンゴや白桃、シトラスを思わせるみずみずしい果実味がはっきりと感じられ、爽やかで透明感のあるスタイルに仕上がります。主要品種のシュナン・ブランがもたらす柔らかな果実の厚みと、清潔感のあるキレのバランスが良く、全体に親しみやすく上品。クレマンの中でも“軽やかでフレッシュ”という個性が際立つ産地です。 ――このワインにあう最高のペアリングを挙げるとすれば何ですか？ 岡田氏：レモンをかけた唐揚げの爽やかさとジューシーさに、ロワールのクレマンが持つきれいな酸とみずみずしい果実味が驚くほどマッチします。脂の重さをすっとリセットしてくれるので、どんどん手が伸びる組み合わせです。 ――どんな場面で飲んでもらいたいですか？ 岡田氏：いつものメニューに少しだけ華やかさがほしいとき。重たくないので、家族や友人とのカジュアルな食事会にもぴったりです。 ■ テイスティングメモ 甘み：ドライ ●──── スイート 渋み：控えめ ●──―─ しっかり 酸味：穏やか ───●─ キリッと 重さ：ライト ──●―─ フルボディ グルメ Watch,編集部：湯野康隆",[],[]
かっぱ寿司、中とろ/いくら×真鯛/桜えび×サーモンで春を味わう「贅沢 春の彩り寿司三昧」発売（グルメ Watch）,https://news.yahoo.co.jp/articles/5e47a7610c0d201b33ac94cbd72c42049ab110b3,https://newsatcl-pctr.c.yimg.jp/t/amd-img/20260306-00000013-impgrw-000-1-view.jpg?exp=10800,2026-03-06T12:00:00+09:00,2026-03-06T12:00:00+09:00,グルメ Watch,impgrw,グルメ Watch,540,"写真：グルメ Watch かっぱ寿司（カッパ・クリエイト）は「ごち寿司」から、春の味覚が楽しめる「贅沢 春の彩り寿司三昧」を3月12日に発売する。価格は3貫690円～（一部店舗では価格が異なる）。 【画像】贅沢 蟹＆とろ三昧 「中とろ」「活〆真鯛二枚重ね いくらのせ」「大切りサーモン 桜えびのせ」の3貫を盛り合わせ、季節感と華やかさのある一皿に仕上げた。中とろの甘み、真鯛の旨みといくらの塩味、大切りサーモンの脂、桜えびの香ばしさが重なり合い、春の訪れと海の旨味が味わえるという。 そのほか、生本ずわい蟹の上品な甘みと中とろの濃厚な旨みの調和が楽しめる「贅沢 蟹＆とろ三昧」、濃厚な旨みと食感が楽しめる特盛の「贅沢 軍艦三味」、うに特有のコクと香りが溶け出す「贅沢 うに三昧」など、食べ応えのあるメニューを継続して販売する。 ■ かっぱ寿司「ごち寿司」 発売日：2026年3月12日 販売店舗：かっぱ寿司全店 価格： ・新発売「贅沢 春の彩り寿司三昧」（3貫690円～） ・「贅沢 蟹＆とろ三昧」（3貫760円～） ・「贅沢 軍艦三昧」（3貫690円～） ・「贅沢 うに三昧」（3貫740円～） ※店内飲食限定 ※一部店舗では価格が異なる グルメ Watch,編集部：高嶋エリサ",[],[]
カルディ、いちご柄がかわいいトートと保冷バッグがセットになった「いちごバッグ」発売（グルメ Watch）,https://news.yahoo.co.jp/articles/d04087b6c279b01ab92f1aa2a7e2f1a4f99c0d6d,https://newsatcl-pctr.c.yimg.jp/t/amd-img/20260306-00000012-impgrw-000-1-view.jpg?exp=10800,2026-03-06T11:20:00+09:00,2026-03-06T11:20:00+09:00,グルメ Watch,impgrw,グルメ Watch,311,"写真：グルメ Watch カルディコーヒーファーム（KALDI COFFEE FARM・キャメル珈琲）は「いちごバッグ」を発売した。 【画像】「いちごバッグ」のセット内容 いちご柄のトートバッグと保冷バッグに、北海道いちごサワー（お酒・350mL缶×2）といちごミルクポップコーンをセットにしたもので、価格は1998円。 トートバッグのサイズは約40.5×13×29cm（幅×奥行き×高さ）で、持ち手の長さは約49cm。肩がけや手持ちのほかに、キャリーケースに取り付けることもできる。保冷バッグのサイズは約22×11×13cm（幅×奥行き×高さ）で、買い物やランチトートなどに使える。 グルメ Watch,編集部：稲葉隆司",[],[]
バーガーキング「わたくしのプレミアムショコラ チョコレート＆ストロベリー」発売。サクサクのパイとなめらかな口どけ（グルメ Watch）,https://news.yahoo.co.jp/articles/1e25fe665455905bb5d411d41becf904fc14aa4c,https://newsatcl-pctr.c.yimg.jp/t/amd-img/20260306-00000011-impgrw-000-1-view.jpg?exp=10800,2026-03-06T11:00:00+09:00,2026-03-06T11:00:00+09:00,グルメ Watch,impgrw,グルメ Watch,361,"写真：グルメ Watch バーガーキング（ビーケージャパンホールディングス）は、期間限定のデザート「わたくしのプレミアムショコラ チョコレート＆ストロベリー」を3月6日に発売した。価格は250円。 【画像】期間限定「わたくしのプレミアムショコラ チョコレート＆ストロベリー」 大人も楽しめるおいしさがテーマの「わたくしの」デザートシリーズの商品で、濃厚でほろ苦いリッチチョコクリームと甘酸っぱい特製ストロベリージャムを、ココアパウダーを配合したサクサクの特製パイ生地で包んだ。クリームにはカカオバター主体のチョコレートを使用しており、カカオ本来の風味となめらかな口どけを、熟した濃厚ないちごのジャムと合わせて楽しめる。 なお、東京競馬場店、栂池雪の広場店、京都競馬場店は販売対象外。 グルメ Watch,編集部：高嶋エリサ",[],[]
松のや、とろける豚の角煮を揚げてサクほろに！「角煮かつ定食」を発売（グルメ Watch）,https://news.yahoo.co.jp/articles/aa35513ac4dddcbf67c32a854821d32915afa35c,https://newsatcl-pctr.c.yimg.jp/t/amd-img/20260306-00000010-impgrw-000-1-view.jpg?exp=10800,2026-03-06T10:35:00+09:00,2026-03-06T10:35:00+09:00,グルメ Watch,impgrw,グルメ Watch,312,"写真：グルメ Watch とんかつ専門店「松のや」（松屋フーズ）は、「角煮かつ定食」を3月11日15時に発売する。価格は1290円。 【画像】豚の角煮をかつに仕立てた 「豚の角煮」を贅沢に「かつ」に仕立てた一品で、豚肉の「とろけるような柔らかさ」はそのままに、パン粉をまぶしてカラッと揚げた。衣のサクッとした軽快な音に、口の中でお肉がほろほろとほどけていく新感覚が楽しめる。テイクアウトも可能となっている。 ■ 松のや「角煮かつ定食」 ・「角煮かつ定食」（1290円） ・「単品 角煮かつ」（1090円） ※持ち帰り可。持ち帰り時のみそ汁は別途料金が必要 ※株主優待券使用可（単品除く） グルメ Watch,編集部：友部珠枝",[],[]
ロッテ「爽 バニラ」と「爽 練乳いちご」リニューアル。定番のバニラは「スッと晴れやか」に（グルメ Watch）,https://news.yahoo.co.jp/articles/9fd55baf6edee9e6df0ec660049cafd761259b17,https://newsatcl-pctr.c.yimg.jp/t/amd-img/20260306-00000009-impgrw-000-1-view.jpg?exp=10800,2026-03-06T10:00:00+09:00,2026-03-06T10:00:00+09:00,グルメ Watch,impgrw,グルメ Watch,214,"写真：グルメ Watch ロッテはアイス「爽」ブランドの「爽 バニラ」と「爽 練乳いちご」を3月下旬から順次リニューアルする。いずれも価格は194円前後。 「爽 バニラ」は、コクのあるバニラ感を強化。甘さやべたつきの残りを抑え、くちどけのよさと後切れをさらにアップ。「爽 練乳いちご」は、練乳をしっかりと味わえるようにしつつ、ほどよい酸味のいちご果肉を加え、絶妙なバランスに仕上げたという。 グルメ Watch,編集部：齋藤可歩",[],[]
アサヒ飲料「ウィルキンソン タンサングレフルスカッシュ」発売。無糖でも甘味と酸味が楽しめる（グルメ Watch）,https://news.yahoo.co.jp/articles/ffefe178c13a33b67d1544624034d754dafd8302,https://newsatcl-pctr.c.yimg.jp/t/amd-img/20260306-00000008-impgrw-000-1-view.jpg?exp=10800,2026-03-06T09:00:00+09:00,2026-03-06T09:00:00+09:00,グルメ Watch,impgrw,グルメ Watch,236,"写真：グルメ Watch アサヒ飲料は「ウィルキンソン タンサングレフルスカッシュ」を3月24日に発売する。490mLペットボトルで価格は171円前後。 「ウィルキンソン」ならではの強炭酸はそのままに、グレープフルーツ果汁などによって無糖ながら甘味と酸味が味わえるという果汁炭酸水。 パッケージには、みずみずしいグレープフルーツと「果汁×無糖」のアイコンを用いることで、無糖で果実本来のおいしさを堪能できる満足感を視覚的に表わしている。 グルメ Watch,編集部：河合悠",[],[]
不二家、サンリオキャラクター大集合！　見た目もかわいいチョコレート3品を発売（グルメ Watch）,https://news.yahoo.co.jp/articles/faf90b00bc52115aa4e09fba8ecaea6f208a99b0,https://newsatcl-pctr.c.yimg.jp/t/amd-img/20260306-00000007-impgrw-000-1-view.jpg?exp=10800,2026-03-06T08:00:00+09:00,2026-03-06T08:00:00+09:00,グルメ Watch,impgrw,グルメ Watch,839,"写真：グルメ Watch 不二家はサンリオとコラボした、「クロミチョコレート」「チョコえんぴつ（サンリオキャラクターズ）」「パラソルチョコレート（ポムポムプリン）」を3月10日に発売する。 【画像】クロミとバクを立体的に表現した見た目 「クロミチョコレート」はクロミイメージの2色のチョコレートで、全2種のパッケージにはホログラム加工が施されている。さらに、「チョコえんぴつ（サンリオキャラクターズ）」では、不二家のロングセラー商品「チョコえんぴつ」にハローキティやシナモロールたちが登場。「パラソルチョコレート（ポムポムプリン）」は、ポムポムプリンをイメージしたプリン風味のチョコレートとなっている。 ■ クロミチョコレート 内容量：35g（7粒） クロミをイメージした紫と黒の2色の、さまざまな大きさのチョコレートのアソート。紫はブルーベリーパウダー入りの生地に、黒はココアパウダー入りのチョコレートにフィアンティーヌを混ぜ込み、底面にまろやかなチョコレートを重ねている。紫では爽やかな酸味と、黒ではほろ苦さとともにサクサク食感が楽しめるという。16分の1の確率でメロメロ表情の大きなクロミ入り。 ■ チョコえんぴつ（サンリオキャラクターズ） 内容量：27g（4本） 手持ちでも食べやすいアルミ個包装のえんぴつ型チョコレートで、ハローキティ、シナモロール、ポムポムプリン、ポチャッコ、ハンギョドン、ウサハナのデザインが登場している。全12種ランダムでキャラクターダイカット透明シール1枚付き。 ■ パラソルチョコレート（ポムポムプリン） 内容量：9g ポムポムプリンイメージのプリン風味のパラソルチョコレート。2025年サンリオキャラクター大賞で1位を獲得し、今年30周年を迎えたポムポムプリンのアニバーサリーイヤーを盛り上げる商品となっている。 (c)2026 SANRIO CO., LTD. APPROVAL NO. L665691 グルメ Watch,編集部：河合悠",[],[]
ロッテ、ひと休みするときに食べたい「チョコパイ＜北海道生キャラメルチーズケーキ＞」発売（グルメ Watch）,https://news.yahoo.co.jp/articles/e99a280e8150160a3513dae7c3a403c6be7a38d4,https://newsatcl-pctr.c.yimg.jp/t/amd-img/20260306-00000006-impgrw-000-1-view.jpg?exp=10800,2026-03-06T07:00:00+09:00,2026-03-06T07:00:00+09:00,グルメ Watch,impgrw,グルメ Watch,382,"写真：グルメ Watch ロッテはチョコパイブランドの新シリーズ「チョコパイでひと休み」の第3弾として、「チョコパイ＜北海道生キャラメルチーズケーキ＞」を3月17日に発売する。価格は462円前後。 【画像】北海道産の生キャラメルとチーズを使用したチョコパイ 北海道産生キャラメルを練り込んだキャラメルケーキと、北海道産チーズを使ったチーズクリームをあわせ、チョコレートでコーティングした商品。北海道生キャラメルチーズケーキがもつ甘さ・コク・酸味の絶妙なバランスを、チョコパイ独自のおいしさで表現している。 同シリーズ第1弾の「チョコパイ＜抹茶ティラミス＞」を試食した1000名以上から寄せられた「ひと休みに合うフレーバー」案を参考に開発を行ない、ブランドとして初めてとなる「キャラメル」×「チーズ」の組み合わせが実現したという。 グルメ Watch,編集部：河合悠",[],[]
サントリー、爽やかで優しい甘さの「酸化防止剤無添加のおいしいワイン。スパークリング〈香るマスカット〉」発売（グルメ Watch）,https://news.yahoo.co.jp/articles/7ecde212b744f1667610380a24b8b6def8dfc9b1,https://newsatcl-pctr.c.yimg.jp/t/amd-img/20260306-00000005-impgrw-000-1-view.jpg?exp=10800,2026-03-06T06:00:00+09:00,2026-03-06T06:00:00+09:00,グルメ Watch,impgrw,グルメ Watch,212,"写真：グルメ Watch サントリーは「酸化防止剤無添加のおいしいワイン。スパークリング〈香るマスカット〉」を期間限定で4月28日に発売する。350mL缶でアルコール分は5％。 酸化防止剤の亜硫酸塩を使用しない「酸化防止剤無添加のおいしいワイン。」ブランドから、マスカット味のスパークリングワインが登場。爽やかなマスカットの風味と優しい甘さが感じられる、初夏にぴったりな味わいだという。 グルメ Watch,編集部：齋藤可歩",[],[]
