headline,mainEntityOfPage,image,datePublished,dateModified,author,media_en,media_jp,str_count,body,images,external_links
＜春に輝け’２６センバツ＞花咲徳栄　チーム紹介／中　投手陣、主戦がリード　層を厚くできるかが鍵　／埼玉（センバツLIVE！）,https://news.yahoo.co.jp/articles/41d9797aaae634fd8b7002e252236b89b4ecf516,https://newsatcl-pctr.c.yimg.jp/t/amd-img/20260306-00000007-senbatsul-000-3-view.jpg?exp=10800,2026-03-06T05:02:52+09:00,2026-03-06T17:18:40+09:00,センバツLIVE！,senbatsuf,センバツLIVE！,961,ブルペンで投球練習をする黒川凌大（左）と石田凜作＝埼玉県加須市花崎の花咲徳栄高校グラウンドで２０２６年１月１７日、板鼻歳也撮影 春のセンバツに向けて課題の守備力向上を図る花咲徳栄。岩井隆監督は、それと同様に「投手力」を重視している。 【写真特集】センバツ2026出場の32校決定 各校の喜び 特に注目されるのは、センバツ出場に大きく貢献した主戦の右腕・黒川凌大と、好リードが光った捕手の佐伯真聡（いずれも２年）のバッテリーだ。この２人のタッグが全国の強豪相手にどこまで通用するかが問われる。 センバツ選考委員会は黒川について、「秋季関東大会準決勝までの３試合を１人で投げ抜く力投を見せて決勝まで導いたことや、球威ある速球が魅力的」と評価した。 一方、黒川本人は「自分としては情けなかった。コントロールやリズムがバラバラだった」と秋季関東大会の投球を省みつつ、さらなる高みを目指した。 １月のある日のグラウンド。黒川は岩井監督の鋭いまなざしを受けながら、シャドーピッチングやブルペンでの投球に黙々と励んだ。ミットにボールがズバッと収まる音を確認すると、岩井監督は「確実にスピードが上がっている」と頰を緩ませた。 今冬取り組んだのがフォームの改良だ。左足の踏み出す歩幅を小さくしたという。そうすることで上半身の回転力がボールに伝わるようになった。これまでは球速が１４０キロ程度だったが、改良を経てそれを上回る球速を維持できるようになった。黒川は「センバツまでに１５０キロまで上げていきたい」と気を吐く。 他の投手陣も黒川の活躍を黙って見てはいない。 「真っすぐのキレが良い」（岩井監督）と評されるのが古賀夏音樹（１年）だ。しなやかな左腕から、右打者の内角に鋭く切り込む直球「クロスファイア」の精度を高められれば相手打者の脅威になる。石田凜作（同）も大舞台での登板に備え、球速の向上に励む。２人は秋季県大会決勝の浦和学院戦、２失点の好投リレーを見せて、勝ち切った。 一方、関東大会決勝の山梨学院戦では２人で８失点し、投手層の厚さを示せなかった。２人は口をそろえて言う。「黒川さんだけじゃない。２番手だとしても引けを取らない投球を見せたい」と気合十分だ。本番までに残された間の投手陣の成長がチーム躍進の鍵を握っている。【板鼻歳也】,[],[]
センバツ高校野球　佐野日大　選手紹介／７　ユニホーム誇りに　小和田和輝捕手（２年）　／栃木（センバツLIVE！）,https://news.yahoo.co.jp/articles/94682642660de6e1fa15dec243f7d3d4a63a1751,https://newsatcl-pctr.c.yimg.jp/t/amd-img/20260306-00000006-senbatsul-000-2-view.jpg?exp=10800,2026-03-06T05:02:34+09:00,2026-03-06T16:43:11+09:00,センバツLIVE！,senbatsuf,センバツLIVE！,414,佐野日大の小和田和輝捕手（２年）＝栃木県佐野市の同校で２０２６年２月２３日、池田一生撮影 秋は主に代打で出場し、県大会決勝の文星芸大付戦は延長十回タイブレークの２死満塁で打席に立った。外角の直球を振り抜いた打球は中堅を越え、優勝を決めるサヨナラ打になった。「勢いが落ちずに伸びる、自分の中で理想の打球が打てた」と一打を振り返る。 【写真特集】センバツ2026出場の32校決定 各校の喜び ４兄弟の末っ子。兄の知人が佐野日大の選手だったのをきっかけに、小学生の頃から同校に憧れていた。普段の練習中は「レベルの高い環境で野球ができてうれしい」と笑みがこぼれてしまうこともしばしばある。 捕手で正確な送球が持ち味。マスク越しに培った観察眼は、自身の打席でも配球の読みで生かしている。聖地では「このユニホームを誇りにプレーしたい。そして打ちたい」と意気込む。 身長１７０センチ、体重８１キロ、右投げ左打ち、足利市立第三中出身。＝随時掲載,[],[]
センバツ２０２６　選手紹介　英明／４止　／高知（センバツLIVE！）,https://news.yahoo.co.jp/articles/b67f434af2dd01e5ecde620f4b08e69be9cc9b88,https://newsatcl-pctr.c.yimg.jp/t/amd-img/20260306-00000005-senbatsul-000-3-view.jpg?exp=10800,2026-03-06T05:02:16+09:00,2026-03-06T12:15:36+09:00,センバツLIVE！,senbatsuf,センバツLIVE！,966,英明の前田渉（まえだ・わたる）選手（１年）＝高松市の同校で、広田正人撮影 ※敬称略 ◇前田渉（まえだ・わたる）（１年） １７３センチ、６７キロ▽外野手▽右投げ左打ち▽５０メートル６．１秒▽遠投８０メートル▽香川・藤井中出身 【写真特集】センバツ2026出場の32校決定 各校の喜び 「野球をよく知っている選手」とは香川純平監督の寸評。小学生の時に見ていた甲子園で優勝した、憧れの大阪桐蔭（大阪）と対戦したいという。将来の夢は公務員。スマホゲームが趣味で、好きな言葉は「人事を尽くして天命を待つ」。 ◇高本旬汰（たかもと・じゅんた）（２年） １８７センチ、８５キロ▽外野手▽右投げ右打ち▽５０メートル６．９秒▽遠投７５メートル▽大阪・玉津中出身 登録選手の中で最長身、裏方としてチームを支え続けてきた。中学校時代の全国大会出場が、今まで最も印象に残る思い出だ。昨秋の明治神宮大会準決勝で敗れた神戸国際大付（兵庫）との対戦を望む。好きな言葉は「真っ向勝負」。 ◇山畑栞大（やまはた・かんた）（２年） １７７センチ、８０キロ▽捕手▽右投げ右打ち▽５０メートル６．５秒▽遠投８０メートル▽香川・国分寺中出身 ブルペン捕手として投手陣を支える。中学校時代にバッテリーを組んでいたプロ注目の木下瑛二投手擁する高川学園（山口）との対戦を望んでいる。将来の夢は警察官や消防士など。趣味は愛犬と遊ぶことで、好きな言葉は「やればできる」。 ◇金品智哉（かねしな・ともや）（２年） １７７センチ、８２キロ▽捕手▽右投げ右打ち▽５０メートル６．８秒▽遠投９０メートル▽徳島・藍住東中出身 欠かせない盛り上げ役として、縁の下からチームを支えてきた。小学校時代は投手や三塁手を務めていたこともある。将来は野球関係の仕事に就くのが夢だ。ボウリングが趣味で、好きな言葉には「愛され続ける」を挙げる。 ◇西村龍刀（にしむら・りゅうと）（２年） １７０センチ、７０キロ▽内野手▽右投げ右打ち▽５０メートル７．１秒▽遠投６０メートル▽香川・香川第一中出身 入学後初のベンチ入り。香川純平監督は「努力家で裏方としてメンバーを支え、チームに貢献できる人物」と信頼を寄せる。全国クラスの強豪校との対戦を心待ちにする。映画鑑賞が趣味で、好きな言葉は「七転八起」。 ＝次回は阿南光,[],[]
＜春に挑む―’２６センバツ高川学園＞チーム紹介／下　打撃編　打球の飛距離に手応え　／山口（センバツLIVE！）,https://news.yahoo.co.jp/articles/b7e3ff7264c2ab370d76895a4251baa571443b84,https://newsatcl-pctr.c.yimg.jp/t/amd-img/20260306-00000004-senbatsul-000-2-view.jpg?exp=10800,2026-03-06T05:02:16+09:00,2026-03-06T09:50:01+09:00,センバツLIVE！,senbatsuf,センバツLIVE！,897,打撃練習で快音を響かせる衛藤諒大（手前右）ら＝山口県防府市台道の高川学園で２０２６年２月２２日午後１時５８分、脇山隆俊撮影 ２月下旬、高川学園（防府市）のグラウンドを訪ねると、紅白戦を終えた選手たちが打撃練習に汗を流していた。ティースタンドと呼ばれる器具上のボールを狙って力強くバットを振り抜くと、ボールは弾丸のような勢いで飛んでいった。松本祐一郎監督は「打球が遠くに飛ぶようになったのが一目で分かる」と選手の成長を感じとっていた。 【写真特集】センバツ2026出場の32校決定 各校の喜び 高川学園には「超高校級」と呼ばれるような飛び抜けた選手はいないが、打線は上位を中心に長打力があり、下位はヒットエンドランなど機動力を生かした多彩な攻めができる。昨夏の甲子園でベンチ入りした５人が残っているのも大きい。 その際、３番を任された主将の衛藤諒大（あきひろ）（２年）は、敗れた日大三（西東京）戦で最後の打者となり、雪辱に燃える。身長１６７センチと小柄ながらパンチ力があり、状況に応じた打撃ができる。昨秋の中国地区大会１、２回戦は本塁打を含む５安打４打点の活躍で打線を引っ張った。 打力を買われて唯一１年生で出場し、６番を打った中島遥真（はるま）はミート力に自信を持つ。「甲子園出場」の夢はかなったが、「中軸を打つ」との新たな目標を掲げる。 この他、エースの木下瑛二（２年）、外野手の岸本京悟（けいご）（２年）には中軸を打つ力がある。遊撃手の若藤芽空（ひそか）（２年）ら俊足巧打の選手に加え、小技が使える三塁手の田中良典（１年）は貴重な「つなぎ役」として存在感がある。 練習だけでなく「規則正しい習慣がプレーに生きる」が松本監督の教えで、選手たちは寮の整理整頓などグラウンド外での生活にも注意を払う。 昨秋は、国民スポーツ大会で準優勝するなど中国地区大会直前まで日程が詰まり、新チームとしての始動は遅れたが、松本監督は「選手も含め、どうやって甲子園で戦い、勝つかというイメージは湧いている」と語った。衛藤は「一人一人ができることを考え、日本一を目指したい」と力を込めた。【脇山隆俊】 〔山口東版〕,[],[]
＜高みを目指して―２６センバツ智弁学園＞選手紹介／７　／奈良（センバツLIVE！）,https://news.yahoo.co.jp/articles/0ad3d935ec65afc7915772da93311c0c8da8aabf,https://newsatcl-pctr.c.yimg.jp/t/amd-img/20260306-00000003-senbatsul-000-3-view.jpg?exp=10800,2026-03-06T05:01:29+09:00,2026-03-06T11:03:59+09:00,センバツLIVE！,senbatsuf,センバツLIVE！,766,智弁学園の細川凜人内野手（１年）＝奈良県五條市の智弁学園高校で、喜多瑞輝撮影 ◇打法は岡本和真選手似 細川凜人内野手（１年） 柔らかさのある打撃で逆方向へも伸びやかな打球を放てる強みを持つ。小坂将商監督からＤＨ制でのスタメン入りを示唆されており「責任を果たしチャンスで一本を出したい」と意気込む。 【写真特集】センバツ2026出場の32校決定 各校の喜び 「諦めなければ常に道は開ける」が信条。不撓（ふとう）不屈の精神力の持ち主でもある。小２の時に友人に勧められ、別の球技から野球に転向。小坂監督から「打ち方が（ＯＢでメジャーリーガーの）岡本和真選手に似ている」という言葉をかけられて「うれしく」なって智弁学園入りした。 初めは捕手を務めていたが、昨年夏に一塁手に転向。未経験の守備位置だったが「自主練を重ね、努力の成果が出てうまくなってきた」と話す。 讃岐うどんで有名な高松市出身。うどんへのこだわりは強く、特に「こしのある麺が好き」 ◇憧れは松井稼頭央さん 黒田龍之介内野手（２年） 持ち味の芯の強さとすばしっこさを生かした守備と、広角に長打を放てる打撃が持ち味。“元気さ”も大きな取りえで「小坂将商監督に怒られても簡単にはへこたれません」と笑顔を見せる。 千葉県佐倉市出身。小６の時には地元・千葉ロッテマリーンズのジュニアチームに選ばれた。 憧れの存在はメジャーリーグなどで活躍した松井稼頭央さん。家族で行ったハワイ旅行で本人と遭遇し、実際に会話を交わした経験もある。「男気と気迫があふれるところ」を尊敬している。 甲子園では「支えてくれている両親に活躍する姿を見せたい」。また「“魔曲”ジョックロックが流れる中で打席に立ち、チャンスをモノにしたい」と意気込む。 息抜きはディズニー映画の鑑賞。「ディズニー愛は誰にも負けない」,[],[]
センバツ２０２６　部員紹介　滋賀学園／近江　／滋賀（センバツLIVE！）,https://news.yahoo.co.jp/articles/4b4dae34fe8f08f5679f8d67e215403d3be8f244,https://newsatcl-pctr.c.yimg.jp/t/amd-img/20260306-00000002-senbatsul-000-3-view.jpg?exp=10800,2026-03-06T05:01:29+09:00,2026-03-06T10:15:04+09:00,センバツLIVE！,senbatsuf,センバツLIVE！,1080,滋賀学園の井口絢心（いぐち・けんしん）選手（２年）＝滋賀県東近江市で、前田梨里子撮影 （守備位置▽投・打▽身長・体重▽出身中学▽選手評） ◇井口絢心（いぐち・けんしん）選手（滋賀学園２年） 【写真特集】センバツ2026出場の32校決定 各校の喜び 外野手▽右・右▽１６５センチ・７４キロ▽堺市立晴美台中▽脂肪を落としてスイングを修正し広角に打てるようになった。甲子園で活躍して両親に恩返ししたい。 ◇上園渉太朗（うえぞの・しょうたろう）選手（滋賀学園２年） 投手▽左・左▽１７８センチ・７５キロ▽大阪府守口市立錦中▽球速アップした変則左腕。チームは「勢いがつくと止まらない」。質の高いトレーニングを模索中。 ◇梅田昂樹（うめだ・こうき）選手（滋賀学園２年） 遊撃手▽右・右▽１６９センチ・５２キロ▽大阪府吹田市立千里丘中▽アピールポイントは守備力。試合前夜はグラブを抱いて寝る。尊敬するのは母。 ◇大谷悠斗（おおたに・ゆうと）選手（滋賀学園２年） 一、二、三塁手▽右・右▽１５７センチ・８０キロ▽大津市立瀬田中▽練習で大きな声を出す。「明るい雰囲気」がチームの特徴という。お菓子に目がない。 ◇奥田琉真（おくだ・りゅうま）選手（滋賀学園２年） 外野手▽右・右▽１６７センチ・７４キロ▽三重県名張市立南中▽守りの打球判断が良い。「粘り強い」のがチームの特徴という。座右の銘は「自分の道を行け」。 ◇明石羚吾（あかし・れいご）選手（近江２年） 外野手▽右・右▽１７４センチ・６８キロ▽草津市立草津中▽チャンスに強いと自負。チームは「あきらめが悪い」。ベンチプレスは９０キロ。夢は宇宙飛行士。 ◇井上樹（いのうえ・いつき）選手（近江２年） 外野手▽右・右▽１７２センチ・７５キロ▽栗東市立栗東中▽ジム通いで筋肉量が増加。チームは「仲が良い」。カラオケ好き。将来は「お金持ちになる」。 ◇大槻琉衣（おおつき・るい）選手（近江２年） 投手▽左・左▽１６５センチ・６３キロ▽兵庫県三田市立ゆりのき台中▽中学時代に２度全国。強気な投球が持ち味。チームは「絆が強い」。サッカー観戦も好き。 ◇大橋奏太（おおはし・そうた）選手（近江２年） 捕手▽右・右▽１６９センチ・６８キロ▽長浜市立高月中▽小学生で近江に憧れた。直球に強い打撃が武器。チームは「元気な選手が多い」。オフはカラオケ熱唱。 ◇奥海翔（おく・かいと）選手（近江２年） 外野手▽右・左▽１７８センチ・８５キロ▽竜王町立竜王中▽昨秋は応援の重要性を感じた。「ホームランこそ正義」が信条。将来の夢は米不足を打ち消す農家。,[],[]
＜未踏の頂へ―’２６センバツ北照＞選手紹介／５　畠山柊太右翼手／尹悠人投手　／北海道（センバツLIVE！）,https://news.yahoo.co.jp/articles/c1f42059fe1b77049cb1209d41975572f16eebc4,https://newsatcl-pctr.c.yimg.jp/t/amd-img/20260306-00000001-senbatsul-000-2-view.jpg?exp=10800,2026-03-06T05:01:12+09:00,2026-03-06T17:57:22+09:00,センバツLIVE！,senbatsuf,センバツLIVE！,716,北照の畠山柊太右翼手（２年）＝北海道小樽市で２０２６年１月１１日、宮間俊樹撮影 ◇勝負強さが光る 畠山柊太右翼手 ２年 ５番に座った昨秋は勝負強さを発揮し、打率４割２分９厘をマーク。身長１６１センチ、体重７０キロと小柄ながら、その存在感は群を抜く。 【写真特集】センバツ2026出場の32校決定 各校の喜び 「自信がついた」と振り返るのは、道大会初戦の北海戦での中前への先制打。会心の一打は、大会直前に１学年上の先輩にもらった助言から生まれた。 「バットが下がってフライになりがち」と指摘されたフォームを見直したことで、打球は鋭さを増した。決勝でも初回からフルスイング。今度は右前適時打で先制点をもぎ取り、優勝を大きく引き寄せた。 ２０人のベンチ入りメンバーでは唯一の地元・小樽市出身だ。「自分の全力プレーで小樽に元気を与えたい」。市民の期待も背負って聖地に乗り込む。 ◇横手投げに回帰 尹悠人（ゆん・ゆいん）投手 ２年 右横手からシュート回転をかけ、内外に器用に投げ分ける球は打者を翻弄（ほんろう）する。最速１３５キロの直球にスライダーやスプリットを織り交ぜて勝負を挑む。 入学時はサイドスローで、昨夏からはスリークオーターにも挑戦。だが体の使い方に慣れず、上林弘樹監督の助言で昨年末に横手投げに回帰した。「感覚が戻ってきて制球力や球速も安定した」。納得感は高まっている。 東京都出身。好きな言葉は漫画「スラムダンク」に登場する「諦めたらそこで試合終了」。その言葉通り、小樽地区大会で背負った背番号１へのこだわりは捨てていない。だが、同時に「どこの場面でも投げられるように」とも。どんな形でもチームに貢献するつもりだ。 ＝随時掲載,[],[]
＜縦じまの誇り―’２６センバツ帝京＞第３部　選手紹介／９　藤田健太郎外野手／成田和史投手　／東京（センバツLIVE！）,https://news.yahoo.co.jp/articles/bb1e3aad768deb87311f0a6a7bdbe211dbc24c9f,https://newsatcl-pctr.c.yimg.jp/t/amd-img/default.jpg?exp=10800,2026-03-06T02:00:41+09:00,2026-03-06T03:30:30+09:00,センバツLIVE！,senbatsuf,センバツLIVE！,808,◇俊足生かし全力で 藤田健太郎外野手（２年） 昨年の秋季都大会と明治神宮大会は三塁コーチャーとしてチームを支えた。 【写真特集】センバツ2026出場の32校決定 各校の喜び 明治神宮大会の山梨学院戦五回１死二塁の好機で、味方に中前打が出た。中堅手の位置などを見て、迷わず腕を回した。二塁走者は生還し、貴重な追加点につながった。「試合前から相手の肩や守備を確認していた」と振り返る。 ただ、センバツではグラウンドでのプレーを目指す。５０メートル走６秒フラットの俊足やそれを生かした守備範囲の広さが持ち味で、「代走や守備固めの出場でもチャンスがあれば全力でプレーしたい」と誓う。 ……………………………………………………………………………………………………… （１）１７０センチ、７５キロ（２）右右（３）神奈川県鎌倉市立手広中 ……………………………………………………………………………………………………… ◇気迫の投球で貢献 成田和史投手（１年） 小学校の時に投手を経験したが、本格的に取り組んだのは高校に入学してから。金田優哉監督から素質を見込まれ、投手に抜てきされた。 直球にスライダーとチェンジアップを織り交ぜ、打たせて取るスタイル。投球で足を上げた際、体を一時静止させるのは体が前のめりになるのを防ぐ狙いがあるという。 秋季都大会は２回戦の日大桜丘戦で先発し、４回を３安打に抑え、コールド勝ちにつなげた。憧れは帝京ＯＢでＤｅＮＡの山崎康晃投手。「山崎投手のような気迫のこもった投球でチームの日本一に貢献したい」 ……………………………………………………………………………………………………… （１）１７７センチ、６６キロ（２）右右（３）埼玉県杉戸町立杉戸中 ……………………………………………………………………………………………………… プロフィルは（１）身長、体重（２）投打（３）出身中学＝つづく 〔多摩版〕,[],[]
