headline,mainEntityOfPage,image,datePublished,dateModified,author,media_en,media_jp,str_count,body,images,external_links
鶴岡市の山形自動車道で5人死傷の事故　反対車線にはみ出した車の運転手を書類送検（YBC山形放送）,https://news.yahoo.co.jp/articles/29e8ef02473ba3b8186b6a40d2c0f555814cdfed,https://newsatcl-pctr.c.yimg.jp/t/amd-img/20240110-08693394-ybc-000-3-thumb.jpg?exp=10800,2024-01-10T18:33:00+09:00,2024-01-10T20:10:31+09:00,YBC山形放送,ybc,YBC山形放送,477,\n山形放送\n山形県鶴岡市の山形自動車道のトンネル内で去年5月、車同士が正面衝突し5人が死傷した事故で、警察は10日、反対車線にはみ出して事故を起こした車を運転していた仙台市の男性を過失運転致死傷の疑いで書類送検しました。\n\nこの事故は去年5月、鶴岡市田麦俣の山形自動車道・田麦俣トンネルで、鶴岡方面に向かっていた乗用車が反対車線にはみ出して対向してきた乗用車に正面衝突したものです。この事故では対向の乗用車に乗っていた茨城県の73歳の女性のほか、男性の24歳の妻と1歳の長男のあわせて3人が死亡し、男性ら2人が大けがをしました。\n警察は、反対車線にはみ出した車を運転していた仙台市の29歳の会社員の男性を10日、過失運転致死傷の疑いで書類送検しました。\nこれまでの警察の調べでは、男性は当時、観光で庄内地方に向かう途中でした。\n捜査関係者によりますと、事故当時、男性が車内の様子に気を取られ脇見をしてハンドル操作を誤ったことが事故につながったとみられています。\n男性の認否について警察は「今後の捜査に支障が出る」として明かにしていません。,[],[]
災害時に孤立する危険性がある集落　山形県内に400か所以上　山形市内でも40か所以上（YBC山形放送）,https://news.yahoo.co.jp/articles/b436877afec04dcf75a06239acc84329416e12c0,https://newsatcl-pctr.c.yimg.jp/t/amd-img/20240110-02666537-ybc-000-3-thumb.jpg?exp=10800,2024-01-10T18:23:00+09:00,2024-01-10T19:54:30+09:00,YBC山形放送,ybc,YBC山形放送,795,\n山形放送\n石川県の能登半島地震では交通網が寸断され、住民に物資が届かない孤立状態になっている集落が多数発生しています。山形県内にも災害時に孤立する危険性がある集落が400か所以上に上ることが県のまとめで分かりました。\n\n県によりますと災害時に道路が寸断され、孤立する危険性のある集落は県内で441か所あり、住民は1万1151世帯、2万7599人に上ります。地域別に見ると最も多いのが村山で175か所、次いで置賜が122か所、庄内が74か所、最上が70か所となっています。これらのデータは20年以上前の調査をベースに集計されていて、実際にはさらに多い可能性もあります。\nこのうち山形市には43もの孤立する危険性がある集落があります。その一つが西部に位置する芳沢地区です。\n\n中川悠アナウンサー「芳沢地区に来ました。住宅は10軒ほどありますが空き家も多いようです。」\n\n最新の国勢調査によりますと芳沢地区には現在、7世帯16人が暮らしています。集落に車でつながる道路は2本ありますが、道幅は狭く、それが寸断されれば、住民の避難や物資の供給が難しくなります。\n\n住民「道路が狭いから土砂が崩れるとね。もう1本の道路も農道だから狭い。幅3メートルくらい。そこも沢があるから崩れたりするからなかなか大変。」\n\n災害が起きた時の市の指定避難所は集落の中には無く、住民によりますと過去に大雨が降った際に、およそ3キロ離れた避難所まで避難したこともあったと言います。\n\n住民「川が増水した時避難した。大変。80代と90代で若い人が少ないから。」\n\n集落では高齢化が進み、避難が困難な住民が多くなっています。県のまとめによりますと孤立の危険性がある集落で非常用の電源設備があるのはおよそ3割、通信機器の設置割合は6割余りなどとなっていて、孤立集落対策が急務となっています。,[],[]
会場が雪不足　山形県総合スキー大会アルペン種目中止決定　国スポ予選は会場変更（YBC山形放送）,https://news.yahoo.co.jp/articles/c3be93a1be4cd6769c8aa1b02129356f058fcda6,https://newsatcl-pctr.c.yimg.jp/t/amd-img/20240110-02821764-ybc-000-4-thumb.jpg?exp=10800,2024-01-10T18:11:01+09:00,2024-01-10T19:49:28+09:00,YBC山形放送,ybc,YBC山形放送,399,\n山形放送\n1月19日から2日間の日程で予定されていた山形県総合スキー大会のアルペン種目について、会場となる最上町のスキー場が雪不足のため、中止を決めたことが分かりました。\n\n県スキー連盟によりますと、県総合スキー大会は県関係の中学3年生から一般の選手がエントリーする大会で、アルペン種目は19日と20日に最上町の赤倉温泉スキー場を会場に予定されていました。\nしかし、赤倉温泉スキー場は今シーズン、雪不足のため滑走できない状況が続いているため、組織委員会は\n9日、アルペン種目の中止を決めました。\n14日から山形市と上山市で予定されているクロスカントリーとジャンプ種目は予定通り実施する方向で調整するということです。\nまた、赤倉温泉スキー場を会場に21日に予定していた国民スポーツ大会・スキーアルペン種目の県予選会については、会場を大蔵村の湯の台スキー場に変更することを決めました。,[],[]
「水が早くほしい」断水続く石川県の被災地　山形市職員が給水活動　移動阻む道路状況（YBC山形放送）,https://news.yahoo.co.jp/articles/2950d1670ea4cd776c249e7ed001e5e0e66b1c79,https://newsatcl-pctr.c.yimg.jp/t/amd-img/20240110-05239663-ybc-000-3-thumb.jpg?exp=10800,2024-01-10T18:18:01+09:00,2024-01-10T19:54:30+09:00,YBC山形放送,ybc,YBC山形放送,902,\n山形放送\n能登半島地震が発生してから10日で10日目。ほぼ全域で断水が続く石川県の珠洲市や七尾市で給水支援を行っている山形市の職員から被災地の今を聞きました。\n\n元日に発生した能登半島地震は発生から10日目です。石川県では9日午後2時時点で、12市町の合わせておよそ5万9000戸で断水が続いています。\n県内からも支援部隊が続々と派遣されています。山形市からは上下水道部の職員4人と、2トンの水を積める給水車が、被災地に向け出発しました。\n10日午前、被災地で支援活動を続ける担当者から電話で話を聞くことができました。\n\n山形市上下水道部/下水道建設課・庄司真一さん「7日に石川県珠洲市に入った。珠洲市内の医療機関に給水活動を行った。水は大変助かるということで、けっこうな量を私たちだけでなく、ほかの事業体も病院に給水している状況」\n\n珠洲市は今なお、ほぼ全域で断水が続き、給水車に水を積むには隣町まで行く必要があるといいます。\n\n山形市上下水道部/下水道建設課・庄司真一さん「珠洲市では補水する場所がなく、隣の能登町まで行って補水している。片側交互通行やひび割れ、段差などがあってゆっくり走らなければならず、時間はだいぶかかってしまうので、なかなか給水の量が増えない」\n\n給水車の行く手を阻む倒壊した家屋や、ひび割れた路面。支援の動きに影響を及ぼしているのはこれだけでなく…。\n\n山形市上下水道部/下水道建設課・庄司真一さん「こちらは天気がけっこう変わるようで、先ほどまで天気よかったのにすぐ雪降る。雪が降ると道路状況が全然分からない。ひび割れや段差が確認できないので慎重な運転になる。渋滞が激しくなっていた」\n\nそんな中、10日は午前中から避難所になっている七尾市の小学校で給水活動を行ったということです。\n\n山形市上下水道部/下水道建設課・庄司真一さん「水が早くほしい、水道が通ってほしいという声を聞く。被災者の方々大変ですので、少しでも応えられるように頑張りたい」\n\n現在活動中の山形市の職員は12日に、新たに市から派遣される職員と交代する予定です。,[],[]
女性に抱きつき不同意わいせつ未遂罪で起訴の消防士の男　山形市が懲戒免職処分（YBC山形放送）,https://news.yahoo.co.jp/articles/fbb86e63c458cc69704955793209ad534296435b,https://newsatcl-pctr.c.yimg.jp/t/amd-img/20240110-01236591-ybc-000-3-thumb.jpg?exp=10800,2024-01-10T18:28:00+09:00,2024-01-10T20:44:31+09:00,YBC山形放送,ybc,YBC山形放送,389,\n山形放送\n山形市の路上で12月、面識のない女性に抱きつき不同意わいせつ未遂の罪で起訴された山形市消防本部に勤務する消防士の男について、山形市は10日付けで懲戒免職処分としました。\n\n懲戒免職処分となったのは、山形市消防本部に勤務する消防士で山形市五十鈴2丁目の佐藤康一被告（32）です。\n佐藤被告は12月、山形市内の路上を歩いていた面識のない女性に抱きつくなどして逮捕され、不同意わいせつ未遂の罪で起訴されました。\n起訴を受け山形市は、佐藤被告を免職の懲戒処分としました。佐藤被告が勤務していた山形市消防本部は「被害者に改めてお詫びするとともに再発防止と信頼回復に努めたい」とコメントしています。\n佐藤被告はこのほか、去年4月に山形市内の路上で、20代の女性に対して後ろから太ももをつかむ迷惑行為をした県迷惑行為防止条例違反の疑いで1月4日に再逮捕されています。,[],[]
山形大学の能登半島地震被災県出身学生のうち連絡取れていないのは6人に（YBC山形放送）,https://news.yahoo.co.jp/articles/7e1aaec73ffa135eb8e92d3e65c0f22aab6daab1,https://newsatcl-pctr.c.yimg.jp/t/amd-img/20240110-02242726-ybc-000-4-thumb.jpg?exp=10800,2024-01-10T12:14:00+09:00,2024-01-10T19:48:32+09:00,YBC山形放送,ybc,YBC山形放送,418,\n山形放送\n山形大学によりますと、能登半島地震で被災した石川など4県の出身の学生と大学院生のうち、10日正午時点で新潟県出身の6人と連絡が取れていないということです。これまでに山形大学の学生について被害の情報は確認されていません。\n\n山形大学は能登半島地震で大きな被害を受けた石川、新潟、富山、福井出身の学生や大学院生について、冬休みの期間で実家に帰省していた学生も多いため、電話やメールで安否確認を行っています。\n4県出身の学生は合わせて484人で、それぞれの内訳は新潟県が416人、富山県が39人、石川県が21人、福井県が8人となっています。大学で安否確認を進めたところ、10日正午の時点でいずれも新潟県出身の6人と連絡が取れていないということです。一方、連絡が取れた478人にけがなどの被害はありませんでした。\n大学によりますと、連絡が取れていない6人も含め、これまでに人的被害の情報は確認されていないということです。,[],[]
縁起物の初あめやカブ、だんご木ずらり…約400年前から続く山形市伝統の「初市」にぎわう（YBC山形放送）,https://news.yahoo.co.jp/articles/7ea99c3f0294bf291e68b94af6309dc5b665c2e4,https://newsatcl-pctr.c.yimg.jp/t/amd-img/20240110-08933122-ybc-000-2-thumb.jpg?exp=10800,2024-01-10T12:14:00+09:00,2024-01-10T12:23:31+09:00,YBC山形放送,ybc,YBC山形放送,374,\n山形放送\n山形市で10日、新春恒例の初市が開かれ、午前中から縁起物などを買い求める多くの人で賑わっています。\n\n山形市の初市は、およそ400年前の江戸時代初期から続く伝統行事で、豊作や商売繁盛、無病息災を願う縁起物の初あめやカブ、だんご木などが並びます。去年から引き続きことしも通常開催で実施され、10日は山形市中心部の十日町から七日町までのおよそ1キロの目抜き通りに150の露店が並びました。販売開始時間の午前10時を過ぎると市内外から訪れた人たちがさっそく縁起物を買い求めていました。\n\n買い物客「（何を買った？）カブです。やっぱり縁起物だからカブとか初あめを買おうと思う。1年いい年になるように」\n\n初市は10日午後5時まで開かれていて、山形商工会議所によりますと、去年と同じく15万人から20万人の人出が見込まれています。,[],[]
