headline,mainEntityOfPage,image,datePublished,dateModified,author,media_en,media_jp,str_count,body,images,external_links
人身事故の影響で北陸新幹線が一時運転見合わせ　運転再開も4400人に影響（MRO北陸放送）,https://news.yahoo.co.jp/articles/9ef969c6bedb2bb8f3ff585186d8636a159de3d0,https://newsatcl-pctr.c.yimg.jp/t/amd-img/default.jpg?exp=10800,2024-09-07T14:38:34+09:00,2024-09-07T14:38:34+09:00,MRO北陸放送,mrov,MRO北陸放送,323,\n北陸新幹線は、埼玉県内で起きた人身事故の影響で7日午前、運転を見合わせましたが、およそ1時間15分後に運転を再開しました。\n\nJR東日本によりますと7日午前10時35分頃、埼京線北戸田駅で人身事故が発生し、並行する新幹線の線路にも影響が出ました。\n\nこのため北陸新幹線 東京-長野駅間 東北新幹線 東京-仙台駅間 上越新幹線東京-新潟駅間で運転を見合わせていましたが、安全が確認されたため午前11時50分、すべての新幹線で運転を再開しました。\n\nこの影響で、北陸新幹線では、かがやき522号が上野-東京駅間で区間運休となったほか上下線あわせて5本で最大79分の遅れが出ました。また乗客およそ4400人に影響がでました。\n北陸放送,[],[]
北陸最大級のアイドルフェス「かがやきフェス」が開催 総勢115組のアイドルがステージ彩る（MRO北陸放送）,https://news.yahoo.co.jp/articles/3c962369ed8d988167bf28507c9fe314b69f9a46,https://newsatcl-pctr.c.yimg.jp/t/amd-img/20240907-21413462-mrov-000-1-view.jpg?exp=10800,2024-09-07T20:04:31+09:00,2024-09-07T20:04:31+09:00,MRO北陸放送,mrov,MRO北陸放送,277,\n北陸放送\n全国から100組を超えるアイドルグループが出演する北陸最大級のアイドルフェス「かがやきフェス2024」が7日から金沢市で開かれています。\n\n7日から本多の森北電ホールやEightHalなどで開かれている「かがやきフェス2024」は、全国から総勢115組のアイドルがライブを披露し、会場を盛り上げます。\n\nライブイベントではUP-TとアイドルがコラボしたオリジナルTシャツも販売されていて、7日は最も販売枚数の多かったグループが表彰されました。\n\n北陸最大級のアイドルフェス、8日も金沢市内の6つの会場で行われます。\n北陸放送,['https://newsatcl-pctr.c.yimg.jp/t/amd-img/20240907-21413462-mrov-000-1-view.jpg?pri=l&w=640&h=360&exp=10800'],['https://news.yahoo.co.jp/articles/3c962369ed8d988167bf28507c9fe314b69f9a46/images/000']
能登半島地震の被災地に無料で食器など贈る催し「うつわのちから」が8日に開催 前日から準備作業進む 石川・輪島市（MRO北陸放送）,https://news.yahoo.co.jp/articles/3c38f0e1842e9e8a1ed088e7887b6d976b21a92f,https://newsatcl-pctr.c.yimg.jp/t/amd-img/20240907-21413466-mrov-000-1-view.jpg?exp=10800,2024-09-07T20:13:31+09:00,2024-09-07T20:13:31+09:00,MRO北陸放送,mrov,MRO北陸放送,516,\n北陸放送\n能登半島地震の被災地で暮らす人たちに無料で食器などを贈る催しが8日、石川県輪島市で開かれるのを前に、7日、関係者らが準備作業を行ないました。\n\nこの「うつわのちから」は静岡県に住む陶芸家、二階堂明弘さんが陶芸家の仲間たちに東日本大震災の被災地に器を贈ろうと呼びかけた事がきっかけではじまったもので、能登での開催ははじめてです。\n\n会場の重蔵神社にはお皿や茶碗、コップなどおよそ6000点にものぼる「器」が集められ、関係者やボランティアが段ボールから器を一つずつ丁寧に取り出し準備作業を進めていました。\n\n陶芸家 二階堂明弘さん\n「東日本の時は計10回、一度としてはずいぶん大きい数が集まったと思います・有難いですね」\n\nこの催しに協力したのが輪島市に住む漆芸家の桐本滉平さんです。\n\n漆芸家 桐本滉平さん\n「明日来て頂いた人たちには少しでも一日一日の食事の時間が楽しく豊かになるきっかけになるように僕自身も含め思います」\n\n普段使いの器を集めた「うつわのちから」は8日は午後1時から午後6時まで、輪島市の重蔵神社で開かれ、同時に漆芸道具の譲渡会も行われる予定だということです。\n北陸放送,['https://newsatcl-pctr.c.yimg.jp/t/amd-img/20240907-21413466-mrov-000-1-view.jpg?pri=l&w=640&h=360&exp=10800'],['https://news.yahoo.co.jp/articles/3c38f0e1842e9e8a1ed088e7887b6d976b21a92f/images/000']
「飲酒運転がばれるのが嫌で…」停車中の車に衝突し逃走した疑いで27歳の男逮捕 金沢市（MRO北陸放送）,https://news.yahoo.co.jp/articles/aae48eef1195940a009d88bafc6194558e172676,https://newsatcl-pctr.c.yimg.jp/t/amd-img/default.jpg?exp=10800,2024-09-07T20:08:30+09:00,2024-09-07T20:08:30+09:00,MRO北陸放送,mrov,MRO北陸放送,436,\n7日朝早く、金沢市内で停車していた車に追突し、男女2人にけがをさせたにも関わらず、飲酒運転の事実が発覚することを免れるためにその場から逃走したとして、27歳の男が逮捕されました。\n\n過失運転傷害アルコール等影響発覚免脱とひき逃げの疑いで逮捕されたのは、金沢市八日市の会社員・林龍太郎容疑者（27）です。\n\n林容疑者は7日午前4時50分ごろ軽乗用車を運転し、信号待ちのため交差点で停車していた車に追突、乗っていた男女2人にけがをさせたのにも関わらず、飲酒運転が発覚することを免れるためにその場から逃走した疑いがもたれています。\n\nこの事故で車に乗っていた金沢市の20代の男女2人が首や腰の痛みを訴える軽いけがをしました。警察によりますと、被害者が林容疑者の車のナンバーを覚えていたことから逮捕に至ったということです。\n\n調べに対し林容疑者は「飲酒運転がばれるのが嫌だったので逃走した」と容疑を認めていて、警察が当時の状況を詳しく調べています。\n北陸放送,[],[]
高齢化率高まれば患者はさらに増える「パーキンソン病」スタッフ向け研修会（MRO北陸放送）,https://news.yahoo.co.jp/articles/0cd5645e700a2e5ba7607dfdef69ead6049adf3d,https://newsatcl-pctr.c.yimg.jp/t/amd-img/20240907-21413181-mrov-000-1-view.jpg?exp=10800,2024-09-07T14:09:53+09:00,2024-09-07T14:09:53+09:00,MRO北陸放送,mrov,MRO北陸放送,496,\n北陸放送\n体が震えたり、動かしにくくなったりする症状が特徴の指定難病、「パーキンソン病」。\n\nこの診療などに携わるスタッフに向けた研修会が7日、金沢で開かれていました。\n【写真を見る】高齢化率高まれば患者はさらに増える「パーキンソン病」スタッフ向け研修会\nオーガナイザー:金沢大学脳神経内科学小野賢二郎教授\n\n「われわれ医師側、看護師サイドだけでなくて、そのほかの多くのメディカルスタッフの力がないと、」パーキンソン病の診療・連携は進めていけないので」\n\n全国でおよそ25万人の患者がいると言われているパーキンソン病は、高齢化率が高まるにつれ、今後更に患者が増えることが見込まれています。\n\n金沢歌劇座で開かれている研修会では、看護師や薬剤師、理学療法士などパーキンソン病の診療・介護に携わるおよそ150人が全国各地から集まり、講義を受けながら、症状や治療法に関する理解を深めています。\n\n受講した医療スタッフはこの後、確認テストを受けて、その結果によりさらに専門性の高い役割を果たす「パーキンソン病療養指導士」に認定され治療にあたるということです。\n北陸放送,['https://newsatcl-pctr.c.yimg.jp/t/amd-img/20240907-21413181-mrov-000-1-view.jpg?pri=l&w=640&h=360&exp=10800'],"['https://news.yahoo.co.jp/articles/0cd5645e700a2e5ba7607dfdef69ead6049adf3d/images/000', 'https://newsdig.tbs.co.jp/articles/gallery/1413181?utm_source=news.yahoo.co.jp&utm_medium=referral&utm_campaign=partnerLink&ex_position=photo&ex_id=1413181&image=2']"
人身事故の影響で北陸新幹線が一時運転見合わせ　運転再開も一部列車に遅れ（MRO北陸放送）,https://news.yahoo.co.jp/articles/ddddd679be85d5d9e1e50fa5e40b8d2d63c07f55,https://newsatcl-pctr.c.yimg.jp/t/amd-img/20240907-21413054-mrov-000-2-view.jpg?exp=10800,2024-09-07T12:14:33+09:00,2024-09-07T12:34:30+09:00,MRO北陸放送,mrov,MRO北陸放送,199,\n北陸放送\n北陸新幹線は、午前10時35分頃から東京-長野間で運転が見合わせとなっていましたが午前11時50分に運転を再開しました。JR東日本によりますと埼玉県の埼京線北戸田駅で起きた人身事故の影響だということです。\n\nこのほか東北新幹線の東京-仙台間、上越新幹線の東京-新潟間も運転を見合わせていましたが運転を再開しています。\n\n北陸新幹線では一部列車に遅れが出ています。\n北陸放送,['https://newsatcl-pctr.c.yimg.jp/t/amd-img/20240907-21413054-mrov-000-2-view.jpg?pri=l&w=640&h=360&exp=10800'],['https://news.yahoo.co.jp/articles/ddddd679be85d5d9e1e50fa5e40b8d2d63c07f55/images/000']
金沢オクトーバーフェスト 残り2日（MRO北陸放送）,https://news.yahoo.co.jp/articles/f9adb5955ca56bc1e87ffc8222155bc5403499f7,https://newsatcl-pctr.c.yimg.jp/t/amd-img/20240907-21413168-mrov-000-1-view.jpg?exp=10800,2024-09-07T13:57:50+09:00,2024-09-07T13:57:50+09:00,MRO北陸放送,mrov,MRO北陸放送,432,\n北陸放送\n連日にぎわいを見せている本場ドイツビールの祭典・「金沢オクトーバーフェスト」も残り2日。\n【写真を見る】金沢オクトーバーフェスト 残り2日\n会場を訪れた人たちはコクのあるビールを楽しんでいます。\n\n「オクトーバーフェスト」は、ドイツのミュンヘンで毎年秋に開かれている世界最大のビールの祭典で、金沢では8回目の開催です。\n\n金沢市広坂のいしかわ四高記念公園では、7つの店舗で30種類を超えるドイツビールを味わえます。\n\n訪れた客は…「乾杯!プロスト～!!」\n\n会場ではソーセージやプレッツェルなどのフードのほか、ソフトドリンクも販売されていて、家族連れで楽しめるメニューが揃っています。\n\n今年は各店舗で「能登応援メニュー」が設けられ、売り上げの一部が義援金として県に寄付されるということです。\n\n「金沢オクトーバーフェスト」は7日は午後9時まで開かれていて8日は最終日を迎えます。（午前11時～午後9時まで）\n北陸放送,['https://newsatcl-pctr.c.yimg.jp/t/amd-img/20240907-21413168-mrov-000-1-view.jpg?pri=l&w=640&h=360&exp=10800'],"['https://news.yahoo.co.jp/articles/f9adb5955ca56bc1e87ffc8222155bc5403499f7/images/000', 'https://newsdig.tbs.co.jp/articles/gallery/1413168?utm_source=news.yahoo.co.jp&utm_medium=referral&utm_campaign=partnerLink&ex_position=photo&ex_id=1413168&image=2']"
北陸新幹線　東京-長野間で運転見合わせ（MRO北陸放送）,https://news.yahoo.co.jp/articles/7549d736a92e602e48c771a52e303caabd998a7b,https://newsatcl-pctr.c.yimg.jp/t/amd-img/default.jpg?exp=10800,2024-09-07T11:24:57+09:00,2024-09-07T11:24:57+09:00,MRO北陸放送,mrov,MRO北陸放送,165,\n北陸新幹線は、午前10時35分頃から東京-長野間で運転が見合わせとなっています。\n\nJR東日本によりますと埼玉県の埼京線北戸田駅で起きた人身事故の影響だということです。\n\nこのほか東北新幹線の東京-仙台間、上越新幹線の東京-新潟間も運転見合わせとなっていますが、午前11時40分頃再開見通しだという事です。\n北陸放送,[],[]
関脇・大の里 過去のケースから占う大関昇進の見込み そして “元横綱・稀勢の里”との三番稽古で気づいた師匠の「偉大さ」（MRO北陸放送）,https://news.yahoo.co.jp/articles/6064c46c5fc61718616c23072d58776c50b8efbe,https://newsatcl-pctr.c.yimg.jp/t/amd-img/20240907-21402694-mrov-000-1-view.jpg?exp=10800,2024-09-07T10:46:49+09:00,2024-09-07T10:46:49+09:00,MRO北陸放送,mrov,MRO北陸放送,1589,\n北陸放送\n8日に初日を迎える大相撲秋場所。大きな注目を集める力士の一人が、石川県津幡町出身の関脇・大の里です。\n【写真を見る】大の里vs元横綱・稀勢の里 三番稽古17番の全シーンと決まり手\n初優勝の夏場所は12勝、その次の名古屋場所は9勝をあげた大の里ですが、秋場所の成績次第では大関昇進の可能性もあります。\n\n大の里が大関に上がるにはどれぐらいの星や相撲内容が求められるのか、展望します。\n\n■「直近3場所33勝」がひとつの目安 大の里のケースにあてはめると\n\n大関昇進の目安は、明確に決まっているわけではありませんが、「昇進前直近の3場所で33勝以上」が目安とされています。\n\n平成以降での33人のケースを見ると、32勝でも昇進をしている力士もいます。\n\nあくまで星だけで見た場合ですが、2018年（平成30年）の夏場所後に大関に昇進した栃ノ心は37勝8敗で一番多い勝ち星でした。一方で、最も低いラインは32勝13敗で4人いますが、実は大の里の師匠・稀勢の里もその1人でした。横綱になった稀勢の里のその後の活躍は誰もが知るところです。\n\n大の里の大関とりを考えるとき、ひとつ気になるところが名古屋場所での9勝の成績です。直近3場所はそれぞれ二けたの勝ち星で昇進する力士が多く、大の里の場合、秋場所はハイレベルな成績が求められそうです。\n\n大の里の大関昇進を占ううえで、参考になりそうなのが横綱まで駆け上がった曙のケースです。\n\n曙は3場所前は13勝2敗、2場所前は8勝7敗、直前は13勝2敗で優勝しました。2場所前は8勝止まりで、9勝に終わった大の里と似ているところがあります。\n\n大の里が秋場所で13勝2敗の成績をあげれば、曙と同じ34勝で大関昇進ラインはクリアできることになりそうです。12勝3敗で33勝のラインに乗ります。もちろん数字だけでなく相撲内容も問われることになりますが、大の里自身、日々の稽古では大きな気づきを得ているようです。\n\n■師匠との三番稽古に勝ち越しても… 「完全に戦法がばれた」\n\n茨城県阿見町の二所ノ関部屋で2日行われた公開稽古。見学に訪れた部屋の後援会の人たちの注目を集めたのは、師匠と何番も相撲を取る「三番稽古」です。\n序盤は、大の里が一気の出足を見せるなどし親方を土俵の外に押し出すなど、持ち味を見せます。\n\n一方の二所ノ関親方も、立ち合いから頭でいくなど厳しい攻めで負けていません。\n\n■「巻き替えそうにも空間を詰められて」 元稀勢の里の相撲に‟脱帽”の大の里\n\n大の里は右の下手・左の上手の「右四つ」が、二所ノ関親方は左の下手・右の上手の「左四つ」が得意です。いわゆる「けんか四つ」の両者です。\n\n三番稽古の中では、親方十分の左四つの態勢から大の里が右差しを狙って巻きかえようとするところを寄り切られる場面が2番ありました。\n\n三番稽古は、17番を取って大の里が10勝7敗と場所を見据えた気迫を見せ、勝ち越しました。しかし、師匠との取組で得たものは大きいようで、大の里の口からはこれからの課題が出てきます。\n\n大の里「当たっているように見えたけど、完璧な当たりじゃなく、タイミングをずらされて。右はおっつけながら、差させてはもらえず、密着されているので巻き返そうにも空間を詰められて。動く余地もなくしたから持っていかれて。仕切りの部分で完全に戦法がばれた」\n\n得意とする右差しを許さないなど大の里に対し「技能相撲」も見せつけた元横綱・稀勢の里。その偉大さを感じた17番の相撲だったようです。\n\n大関とりについては、「特に意識せずに臨みたい」と話す大の里ですが、角界の新たなヒーローを望むファンの期待は大きい秋場所の土俵になりそうです。\n北陸放送,['https://newsatcl-pctr.c.yimg.jp/t/amd-img/20240907-21402694-mrov-000-1-view.jpg?pri=l&w=640&h=360&exp=10800'],"['https://news.yahoo.co.jp/articles/6064c46c5fc61718616c23072d58776c50b8efbe/images/000', 'https://newsdig.tbs.co.jp/articles/gallery/1402694?utm_source=news.yahoo.co.jp&utm_medium=referral&utm_campaign=partnerLink&ex_position=photo&ex_id=1402694&image=2']"
