headline,mainEntityOfPage,image,datePublished,dateModified,author,media_en,media_jp,str_count,body,images,external_links
「あほ」「仕事増やすな」市職員が訪問先で罵声　書類不備指摘した際に団体職員怒鳴る、市は減給処分（京都新聞）,https://news.yahoo.co.jp/articles/53b7f0598f840b805510bb77566faf651fa45398,https://newsatcl-pctr.c.yimg.jp/t/amd-img/20240308-01315514-kyt-000-3-view.jpg?exp=10800,2024-03-08T18:12:56+09:00,2024-03-08T21:51:59+09:00,京都新聞,kyt,京都新聞,246,\n大津市\n大津市は8日、訪問先で罵声を浴びせたとして、建設部の会計年度任用職員の男性（65）を減給10分の1（1カ月）とする懲戒処分にした。\n【写真】「あほ」と罵声の職員が在籍していた大津市役所\n市によると、男性職員は1月19日、市内の団体の事務所を訪れて書類の不備を指摘した際、大声で「あほ」「ばかたれ」「仕事を増やすな」などと団体の職員に怒鳴りつけたという。\n\n 男性職員は「迷惑を掛けた」として3月8日付で依願退職した。市は「規律を再徹底して信頼回復に取り組む」としている。,['https://newsatcl-pctr.c.yimg.jp/t/amd-img/20240308-01315514-kyt-000-3-view.jpg?pri=l&w=556&h=640&exp=10800'],"['https://news.yahoo.co.jp/articles/53b7f0598f840b805510bb77566faf651fa45398/images/000', 'https://www.kyoto-np.co.jp/articles/gallery/1215514?utm_source=headlines.yahoo.co.jp&utm_medium=referral&utm_campaign=partnerLink&img=https://kyoto-np.ismcdn.jp/mwimgs/b/6/150m/img_b69693077dfdca8a9f66c077b58db907667829.jpg']"
京都の飲食店の弁当食べた21人が下痢や嘔吐　一部からノロウイルス検出（京都新聞）,https://news.yahoo.co.jp/articles/c605bf7a5ac12f04c274822048de35fb1189ca7a,https://newsatcl-pctr.c.yimg.jp/t/amd-img/20240308-01315771-kyt-000-2-view.jpg?exp=10800,2024-03-08T21:33:51+09:00,2024-03-08T22:16:59+09:00,京都新聞,kyt,京都新聞,192,\n京都市役所\n京都市は8日、京都市中京区の飲食店「コック長食品」の配送弁当を食べた医療機関と事業所の職員計21人が下痢や嘔吐などの症状を訴え、うち6人からノロウイルスを検出したと発表した。市は、食中毒と断定し、同店を10日まで3日間の営業停止処分にした。市によると、症状を訴えたのは24～69歳の男女で、いずれも症状は軽いという。\n【地図】食中毒が起きた飲食店がある京都市中京区,['https://newsatcl-pctr.c.yimg.jp/t/amd-img/20240308-01315771-kyt-000-2-view.jpg?pri=l&w=640&h=470&exp=10800'],"['https://news.yahoo.co.jp/articles/c605bf7a5ac12f04c274822048de35fb1189ca7a/images/000', 'https://www.kyoto-np.co.jp/articles/gallery/1215771?utm_source=headlines.yahoo.co.jp&utm_medium=referral&utm_campaign=partnerLink&img=https://kyoto-np.ismcdn.jp/mwimgs/c/3/150m/img_c399ce4146dc5a01b3b7cabe75cd083354688.jpg']"
【速報】京都市バスに接触され30代男性が骨折の重傷　バス側の信号が赤（京都新聞）,https://news.yahoo.co.jp/articles/3b320d0520704fcedba472abbeb7cd3fabe548d1,https://newsatcl-pctr.c.yimg.jp/t/amd-img/20240308-01315838-kyt-000-3-view.jpg?exp=10800,2024-03-08T23:31:59+09:00,2024-03-08T23:39:52+09:00,京都新聞,kyt,京都新聞,189,\n【資料写真】京都市バス\n8日午後7時25分ごろ、京都市東山区で、横断歩道を渡っていた30代の男性が、市バスと接触した。京都府警東山署によると、男性は左足首を骨折する重傷を負った。\n【地図】京都市バスに接触され重傷事故が起きた京都市東山区\n市交通局によると、ドライブレコーダーの映像から、市バス側の信号が赤だったことを確認したという。車内の乗客約40人にけがはなかった。,['https://newsatcl-pctr.c.yimg.jp/t/amd-img/20240308-01315838-kyt-000-3-view.jpg?pri=l&w=640&h=361&exp=10800'],"['https://news.yahoo.co.jp/articles/3b320d0520704fcedba472abbeb7cd3fabe548d1/images/000', 'https://www.kyoto-np.co.jp/articles/gallery/1215838?utm_source=headlines.yahoo.co.jp&utm_medium=referral&utm_campaign=partnerLink&img=https://kyoto-np.ismcdn.jp/mwimgs/4/6/150m/img_461cceda20435791e5cfb668551525b854023.jpg']"
「資産倍増が可能」で430万円だまし取られる　63歳男性が被害、SNSの投資広告で知り合った人物から（京都新聞）,https://news.yahoo.co.jp/articles/2a857da83d714ffd6f923b6cee3d2bda3e11e919,https://newsatcl-pctr.c.yimg.jp/t/amd-img/20240308-01315452-kyt-000-2-view.jpg?exp=10800,2024-03-08T18:42:54+09:00,2024-03-08T22:36:52+09:00,京都新聞,kyt,京都新聞,229,\n滋賀県警彦根署\n滋賀県警彦根署は8日、暗号資産の投資話で滋賀県彦根市の男性（63）が現金430万円をだまし取られたと発表した。特殊詐欺事件として調べている。\n【地図】特殊詐欺被害が起きた滋賀県彦根市\n同署によると、男性は昨年12月～今年2月、SNS上の投資関連広告で知り合った人物から、「資産の倍増が可能」などと暗号資産を利用した投資話を持ちかけられ、送金すると「収益」が得られたため信じ、複数回にわたり、指定口座に計430万円を振り込んだという。,['https://newsatcl-pctr.c.yimg.jp/t/amd-img/20240308-01315452-kyt-000-2-view.jpg?pri=l&w=640&h=428&exp=10800'],"['https://news.yahoo.co.jp/articles/2a857da83d714ffd6f923b6cee3d2bda3e11e919/images/000', 'https://www.kyoto-np.co.jp/articles/gallery/1215452?utm_source=headlines.yahoo.co.jp&utm_medium=referral&utm_campaign=partnerLink&img=https://kyoto-np.ismcdn.jp/mwimgs/7/6/150m/img_76fd916f3d945e3fad6a1fa39434620c240209.jpg']"
勤務先の女子生徒とわいせつ行為　23歳高校講師を懲戒免職、SNSで親密に　「好意強く感情優先」（京都新聞）,https://news.yahoo.co.jp/articles/5666ff6a671a7c2a0d07a4fa3526b058c4734e75,https://newsatcl-pctr.c.yimg.jp/t/amd-img/20240308-01315578-kyt-000-2-view.jpg?exp=10800,2024-03-08T18:39:50+09:00,2024-03-08T22:16:59+09:00,京都新聞,kyt,京都新聞,309,\n京都府教育委員会が入る行政棟\n京都府教育委員会は8日、勤務先に在籍する女子生徒にわいせつ行為を行ったとして、府南部地域の府立高の男性講師（23）を同日付で懲戒免職処分にしたと発表した。\n\n 府教委によると、男性講師は女子生徒と昨年12月下旬と今年2月上旬の2回、府外のホテルでわいせつな行為をした。男性講師は女子生徒の授業を担当しており、電話と交流サイト（SNS）で進路や友人関係について相談に乗る中で、親密な関係に発展したという。2人の関係に疑問を持った別の生徒が2月中旬に別の教員に申告して発覚した。\n\n 男性講師は府教委の聞き取りに「生徒への好意が強く、感情を優先してしまった」と話しているという。,['https://newsatcl-pctr.c.yimg.jp/t/amd-img/20240308-01315578-kyt-000-2-view.jpg?pri=l&w=640&h=426&exp=10800'],['https://news.yahoo.co.jp/articles/5666ff6a671a7c2a0d07a4fa3526b058c4734e75/images/000']
「顔見知りのお客さん、普段と様子が違う」詐欺見抜き被害防いだ信金職員に感謝状（京都新聞）,https://news.yahoo.co.jp/articles/f2d6629df3748b8fc792d21d454139766228e6dd,https://newsatcl-pctr.c.yimg.jp/t/amd-img/20240308-01313749-kyt-000-2-view.jpg?exp=10800,2024-03-08T16:16:31+09:00,2024-03-08T17:46:54+09:00,京都新聞,kyt,京都新聞,434,\n感謝状を手にする京都北都信用金庫綾部中央支店の迫田さん（右端）と宮本さん（左端）＝綾部署\n特殊詐欺被害を未然に防いだとして京都府警綾部署は、京都北都信用金庫綾部中央支店（京都府綾部市駅前通）と職員の迫田知洋さん（45）、宮本智裕さん（28）の2人に感謝状を贈った。携帯電話を手に来店した女性の異変に気付き、被害を食い止めた。\n\n 同署によると、宮本さんは1月22日午前10時ごろ、店内で動揺した様子で電話する60代女性を見かけた。スピーカーフォンに切り替えてもらい、携帯電話会社を名乗る男から未払いのインターネット料金と弁護士費用の計30万円を振り込むよう指示を受けていたことを把握。上司の迫田さんに相談して詐欺と見抜き、女性に電話を切るように促した。\n\n 2月29日に同署で贈呈式があり、2人は中田勝康署長から感謝状を受け取った。宮本さんは「顔見知りのお客さんだったので、普段と様子が違うことに気付けた。大切なお金を守ることができてうれしい」と話した。,['https://newsatcl-pctr.c.yimg.jp/t/amd-img/20240308-01313749-kyt-000-2-view.jpg?pri=l&w=640&h=426&exp=10800'],['https://news.yahoo.co.jp/articles/f2d6629df3748b8fc792d21d454139766228e6dd/images/000']
社説：国際女性デー　「ガラスの天井」風穴を（京都新聞）,https://news.yahoo.co.jp/articles/e95ba9967c2bba6056e7dbbd38bf9de846439c18,https://newsatcl-pctr.c.yimg.jp/t/amd-img/default.jpg?exp=10800,2024-03-08T16:06:51+09:00,2024-03-08T16:06:51+09:00,京都新聞,kyt,京都新聞,977,\nきょうは国連が定める「国際女性デー」である。女性の差別をなくし、地位向上について改めて考える契機としたい。\n\n 「初の女性トップ」という話題が相次いでいる。\n\n 日弁連の会長に4月から就任する渕上玲子氏は、法曹三者（弁護士、検察官、裁判官）で初の女性リーダーとなる。日本航空社長には客室乗務員の出身者が就く。海上自衛隊では最も階級が高い「海将」に昇任し、地方総監に起用された。政府の南極観測隊隊長にも大学教授が選ばれた。\n\n 男性中心だった世界で女性が風穴をあけ、活躍の場を広げている。進む道に悩む女性たちの道標になってほしい。\n\n だが、日本では初のトップがニュースになるほど、いまだ指導的立場に立つ女性が少ない。就業率は上がっているにもかかわらず、働きにくい環境と、性差を理由に女性の昇進を阻む見えない障壁「ガラスの天井」がある。\n\n 厚生労働省によると、課長級以上の管理職に占める女性の割合は2022年度で約13％。先進国でも最低水準だ。\n\n 京都、滋賀に本社を置く東証プライム上場の大企業では、女性管理職比率が10％に満たない企業が8割以上を占める。\n\n 共同通信の調査では、主要企業で男性社員が取得した子ども1人当たりの平均育休取得期間は、3カ月未満だった企業が9割近くに上った。女性は1年以上が6割近くで、その開きは大きい。女性が育児の中心的役割を担う実態が顕著に表れている。復職後のキャリアのハンディーといえよう。\n\n 男性の長時間労働を見直すのはもちろん、共同での育児を支える制度を整える必要がある。家庭での関わりについて、父親が気軽に学ぶ機会や集う場も考えたい。\n\n 安心して女性が復職できるような支援も不可欠だ。育休や産休が昇進にマイナスにならない評価制度が要る。退職者の再雇用制度を整える企業もある。\n\n 分割取得が2回までという育休の枠組みは、もっと柔軟にできないか。家庭環境や時期によっても、仕事と育児の比重は変わりうる。晩婚化で育児と介護のダブルケアを担う家庭も少なくない。\n\n 人口減少が進む中、さらなる女性の活躍は日本社会にとってなくてはならない。性差による「ゆがみ」の是正を通じ、多様な人たちがやりがいを持って活躍できる柔軟な労働・生活環境を、国や企業は整えねばならない。,[],[]
会員制の海外オンラインカジノで賭け麻雀　常習賭博の疑いで会社員ら6人を書類送検（京都新聞）,https://news.yahoo.co.jp/articles/0c355fabd7a6faa86a6cd32376f8a0a3f9d2778d,https://newsatcl-pctr.c.yimg.jp/t/amd-img/20240308-01315478-kyt-000-3-view.jpg?exp=10800,2024-03-08T18:02:05+09:00,2024-03-08T22:12:55+09:00,京都新聞,kyt,京都新聞,460,\nオンラインカジノの客を摘発した京都府警\n海外サイトのオンラインカジノの運営者らが賭博開帳図利の疑いで逮捕された事件で、京都府警サイバー捜査課などは8日までに、常習賭博の疑いで、東京都大田区の男性会社員（30）ら客だった27～51歳の男性計6人を書類送検した。\n【画像】書類送検された男性らが利用していたとされるオンラインマージャンサイトの画面\n6人の書類送検容疑は、それぞれ常習として、昨年3～12月ごろ、自宅などでスマートフォンやパソコンから、海外法人が管理する会員制のオンラインカジノ「DORA麻雀（まーじゃん）」に複数回アクセスし、勝敗に金銭を賭けて賭博をした疑い。6人は容疑を認めているという。\n\n 府警は今年2月、このオンラインカジノを運営したとして、賭博開帳図利の疑いで、千葉県の米国籍の男（36）ら男女7人を逮捕していた。国内での賭博は競馬やボートレースなどの公営ギャンブルを除いて刑法で禁じられている。海外で合法とされるオンラインカジノのサイトでも、日本から接続して金を賭ければ違法となる。,['https://newsatcl-pctr.c.yimg.jp/t/amd-img/20240308-01315478-kyt-000-3-view.jpg?pri=l&w=640&h=424&exp=10800'],"['https://news.yahoo.co.jp/articles/0c355fabd7a6faa86a6cd32376f8a0a3f9d2778d/images/000', 'https://www.kyoto-np.co.jp/articles/gallery/1215478?utm_source=headlines.yahoo.co.jp&utm_medium=referral&utm_campaign=partnerLink&img=https://kyoto-np.ismcdn.jp/mwimgs/7/b/150m/img_7b8c2fb7cb3d3a4714dadb9c7c201f90623273.jpg']"
全国のバイオマス施設で相次ぐ火災　ペレット供給設備燃えた関電発電所で消火訓練　消防「燃料制御の難しさ実感」（京都新聞）,https://news.yahoo.co.jp/articles/4221333bda1a15e0909fabfa20a5429314f5365d,https://newsatcl-pctr.c.yimg.jp/t/amd-img/20240308-01315383-kyt-000-4-view.jpg?exp=10800,2024-03-08T17:51:56+09:00,2024-03-08T22:12:55+09:00,京都新聞,kyt,京都新聞,497,\nバイオマス燃料施設での火災を想定した消火訓練（京都府舞鶴市・関電舞鶴発電所）\n昨年3月にバイオマス燃料供給設備で火災が発生した関西電力舞鶴発電所（京都府舞鶴市）で8日、消火訓練が行われた。全国のバイオマス発電関連施設で火災が相次ぐ中、同社と市東消防署の約百人が緊急時に備えた。\n【地図】火災が起きた関電のバイオマス施設がある京都府舞鶴市\n同発電所では昨年3月14日、石炭と混ぜて燃やす木質ペレットの供給設備が燃えた。貯蔵施設にあった木質ペレットが発酵して可燃性ガスが発生し、自然発火したとみられる。\n\n 訓練は貯蔵施設で火災が発生したとの想定で実施。発電所の従業員が現場に駆けつけて放水した後、東消防署のはしご車が到着して、地上と伸ばしたはしごの両方から放水した。藤田泰久所長は「訓練を重ねて被害を最小限に食い止めたい」と話した。\n\n 昨年は舞鶴発電所のほか、鳥取県と千葉県のバイオマス発電所、今年は1月に愛知県の木質ペレットを使う火力発電所で火災が発生している。\n\n 寺尾正浩東消防署長は「燃料の制御の難しさを実感する。事業所と連携して災害発生防止に努めたい」と話した。,['https://newsatcl-pctr.c.yimg.jp/t/amd-img/20240308-01315383-kyt-000-4-view.jpg?pri=l&w=549&h=640&exp=10800'],"['https://news.yahoo.co.jp/articles/4221333bda1a15e0909fabfa20a5429314f5365d/images/000', 'https://www.kyoto-np.co.jp/articles/gallery/1215383?utm_source=headlines.yahoo.co.jp&utm_medium=referral&utm_campaign=partnerLink&img=https://kyoto-np.ismcdn.jp/mwimgs/d/9/150m/img_d96db785247a28cb419e9a65285f526364749.jpg']"
社説：米大統領選　トランプ党、広がるのか（京都新聞）,https://news.yahoo.co.jp/articles/de241fb97c15544c63aff97ba056a81495dd8bd9,https://newsatcl-pctr.c.yimg.jp/t/amd-img/default.jpg?exp=10800,2024-03-08T16:02:00+09:00,2024-03-08T16:02:00+09:00,京都新聞,kyt,京都新聞,998,\n米大統領選に向けた野党共和党の候補者選びは、トランプ前大統領の指名が確実になった。11月の本選は、民主党のバイデン大統領と再び対決する構図が事実上、固まった。\n\n トランプ氏は15州の予備選などが集中する「スーパーチューズデー」で圧勝し、争ってきたヘイリー元国連大使は撤退を表明した。多くの州でトランプ氏が大差をつけ、強さが際立っている。\n\n ほぼ事前の世論調査結果の通りだが、トランプ氏は他候補と政策をたたかわせる討論会を回避し続けた。自らを支える保守強硬派をあおり、「米国第一」を掲げて内向きの姿勢を強める流れは、憂慮せざるを得ない。\n\n ただ、同盟国との連携などを訴えたヘイリー氏が、女性では共和党予備選で初めて首都ワシントンとバーモント州で勝ち、敗れた複数の州で3割超の支持を得た。「反トランプ」は党内にも根強い。\n\n トランプ氏は、前回の大統領選で敗北を認めず、呼びかけに応じた支持者が起こした議会襲撃事件など四つの事件で訴訟が続く。出馬資格を問う訴訟もあったが、連邦最高裁が資格を認め、障壁はなくなった。批判を逆手にとって支持固めに利用している。\n\n 影響力は現実の政治に及んでいる。ロシアによる侵略が2年を超えたウクライナへの支援では、トランプ氏の意をくみ、共和党が下院の予算案採決に反対して承認の見通しが立っていない。\n\n 選挙の優勢に乗じて意に沿わない党幹部を退任に追い込み、親族とすげ替えて支配を強めている。「トランプ党」化を進めて巨額の訴訟費用を党予算で賄う狙いともみられ、専横ぶりが目に余る。\n\n ただ、大統領に返り咲くには、党内の伝統的な穏健派を含めた挙党体制が必要となる。若者をはじめ無党派層の支持は低迷しており、今後の言動が注目されよう。\n\n 対するバイデン氏は、不法移民問題や物価高など直面する課題への対応に決め手を欠く。パレスチナ自治区ガザに侵攻するイスラエルへの支援に対しても国内外で批判が広がる。次の任期も務めれば86歳になる年齢への懸念も払しょくできていない。難局を打開する民主党の政策と戦略が問われる。\n\n 民主主義国の盟主を自任してきた米国政治の分断は根深い。その責任を果たし、国際秩序の安定を図る道筋こそ、最大の争点であるべきだ。現職と前職の大統領の一騎打ちが非難の応酬に終わらぬよう、大局的な論争を求めたい。,[],[]
米軍人と経ケ岬通信所周辺住民がバレーで交流　「言葉の壁超え交流、めっちゃ楽しい」（京都新聞）,https://news.yahoo.co.jp/articles/9562ec4adfbc7758012e5035e22da18951f2b085,https://newsatcl-pctr.c.yimg.jp/t/amd-img/20240308-01312506-kyt-000-2-view.jpg?exp=10800,2024-03-08T13:52:00+09:00,2024-03-08T13:54:52+09:00,京都新聞,kyt,京都新聞,529,\nビーチボールバレーで交流を深める米軍経ケ岬通信所の軍人や地元住民ら（京丹後市弥栄町・弥栄総合運動公園社会体育館）\n米軍経ケ岬通信所（京都府京丹後市丹後町）に勤務する米軍人と周辺住民が親睦を深める「日米交流ビーチボールバレー大会」が2日、同市弥栄町の弥栄総合運動公園社会体育館で開かれた。参加者らはプレーを楽しみ、心地よい汗を流した。\n\n 防衛省近畿中部防衛局が同通信所と周辺地域に友好関係を築いてもらおうと、2019年10月に初めて企画。新型コロナウイルスの感染拡大の影響で5年ぶりの開催となった。\n\n 米軍人16人をはじめ、地元住民や中学生ら約100人が参加。1チーム4人の16チームに分かれ、各チームに米軍人1人が加わった。直径約30センチのビーチボールを3回目で相手コートに返すルールで対戦。中学生らが力強いスパイクを打つのに対し、米軍人は長身を生かした華麗な守備で試合を盛り上げた。\n\n 米陸軍第14ミサイル防衛中隊の3等軍曹（25）は「地元の人たちと一緒に汗を流し、気持ち良かった」と笑顔を見せた。同じチームでプレーした美容師（45）=同市峰山町=は「体を動かすことで言葉の壁を超えた交流ができ、めっちゃ楽しかった」と話していた。,['https://newsatcl-pctr.c.yimg.jp/t/amd-img/20240308-01312506-kyt-000-2-view.jpg?pri=l&w=640&h=397&exp=10800'],['https://news.yahoo.co.jp/articles/9562ec4adfbc7758012e5035e22da18951f2b085/images/000']
新名神高速の用地絡む談合、元所長の男が起訴内容認める　京都地裁で初公判（京都新聞）,https://news.yahoo.co.jp/articles/25190c38294481e32516ed8763e5e8f5fad25c7d,https://newsatcl-pctr.c.yimg.jp/t/amd-img/20240308-01315159-kyt-000-3-view.jpg?exp=10800,2024-03-08T13:52:00+09:00,2024-03-08T17:39:52+09:00,京都新聞,kyt,京都新聞,363,\n京都地裁\n新名神高速道路の用地取得に絡む入札で特定の企業が落札できるよう調整したとして、官製談合防止法違反の罪に問われた京都府土地開発公社新名神事務所（京都府京田辺市）の元所長の男（62）の初公判が8日、京都地裁（増田啓祐裁判官）であり、被告は「間違いございません」と起訴内容を認めた。\n\n 起訴状によると、2020年10月に実施された新名神の用地取得に絡む物件調査業務の指名競争入札に際し、特定の企業に落札させようと考え、談合に応じなさそうな業者を事前に聞き取り、2社を入札に参加できないよう排除したなどとしている。\n\n 検察側は冒頭陳述で、被告は当時所長を務め、入札参加業者を選ぶ広い裁量権を持っていたと指摘。業務を確実に遂行できる企業に落札させるため、「談合させることもやむを得ないと考えた」などと述べた。,['https://newsatcl-pctr.c.yimg.jp/t/amd-img/20240308-01315159-kyt-000-3-view.jpg?exp=10800'],['https://news.yahoo.co.jp/articles/25190c38294481e32516ed8763e5e8f5fad25c7d/images/000']
