headline,mainEntityOfPage,image,datePublished,dateModified,author,media_en,media_jp,str_count,body,images,external_links
バス停で降りるとそこは…「小さい頃に夢見た絵本のような世界だった」　感動名所で途中下車、学生が「バス旅」冊子　京都・南丹（京都新聞）,https://news.yahoo.co.jp/articles/757ce0e85d1a4a1cfedbe134c8074cba393b5f7b,https://newsatcl-pctr.c.yimg.jp/t/amd-img/20240308-01304859-kyt-000-2-view.jpg?exp=10800,2024-03-08T10:32:02+09:00,2024-03-08T10:42:58+09:00,京都新聞,kyt,京都新聞,769,\n路線バスを途中下車し、付近で出合った美しい風景をスケッチした冊子（南丹市園部町・京都建築大学校）\n京都府南丹市園部町の京都建築大学校の学生たちが、市内を路線バスで巡って見つけた名所を紹介する冊子「バス旅南丹市」を作った。豊かな緑の中にたたずむ寺社やカフェが鉛筆スケッチで味わい深く表現され、地域の魅力を再発見できる。\n【写真】冊子をつくった学生はこんな人たち\n4年生23人が「家と学校の往復だけで、南丹市を何も知らないまま終わるのは寂しい」として、昨年4月から企画。市営と民間の全25路線を分担して取材し、各路線一つのバス停で途中下車して、周辺で美しい光景をスケッチした。作品に文章を添えてまとめた冊子を、12月から一般に配布している。\n\n 日吉町の志和賀バス停は、見どころを探して歩き回る中で偶然発見した清水寺を掲載。長い坂道の下から望んだ構図や、うっそうとした木々に囲まれたお堂を鉛筆で描き、高台のひっそりとした雰囲気を伝えている。\n\n 美山町の安掛バス停は、ハム工房を取材。「美しい自然の中に赤いログハウスがぽつんとある様子は小さい頃に夢見た絵本のような世界だった」と感動をつづっている。\n\n 建物の内装に関心のある学生が多く、かやぶき民家を改装した和食店や、自家製パンの並ぶカフェの店内も緻密に描き上げた。\n\n 編集長を務めた濱元翼さん（22）は「バスの本数が少なく苦労したが、あまり知られていない名所が見つかった。観光客に限らず、市民にも楽しんでもらいたい」と話した。\n\n 指導した川北英校長は「コンピューター全盛の時代だが、身体を使って書かれた絵はぐっと心をつかむはず」と魅力を語った。\n\n 約20センチ四方、55ページ。2千部作り、同校で配布している。問い合わせは0771（63）1010。,['https://newsatcl-pctr.c.yimg.jp/t/amd-img/20240308-01304859-kyt-000-2-view.jpg?pri=l&w=640&h=431&exp=10800'],"['https://news.yahoo.co.jp/articles/757ce0e85d1a4a1cfedbe134c8074cba393b5f7b/images/000', 'https://www.kyoto-np.co.jp/articles/gallery/1204859?utm_source=headlines.yahoo.co.jp&utm_medium=referral&utm_campaign=partnerLink&img=https://kyoto-np.ismcdn.jp/mwimgs/9/1/150m/img_91b589a10c9f205d03a253a62c32c595483177.jpg']"
住む？貸す？売る？住まいの「終活」元気なうちに　空き家問題、早めの対策訴え（京都新聞）,https://news.yahoo.co.jp/articles/b768555b7489125abef3a42f99551b606e7ab35b,https://newsatcl-pctr.c.yimg.jp/t/amd-img/20240308-01313745-kyt-000-1-view.jpg?exp=10800,2024-03-08T11:06:54+09:00,2024-03-08T11:06:54+09:00,京都新聞,kyt,京都新聞,1054,\n「負動産になる前に対策をしましょう」と呼びかける畑インストラクター（左）と畑理事長＝南丹市日吉町・森の学舎五ケ荘\n社会問題になっている空き家の増加。京都中央古民家再生協会（京都府亀岡市）の畑哲也理事長（55）と、住教育推進機構京都支部（同）の畑正枝・住教育インストラクター（50）が京都府南丹市内で講演し「所有者が元気なうちに家族で話し合い、住まいも『終活』を」と早めの対策を訴えた。\n【資料写真】解体される所有者不明の空き家\n畑インストラクターは、空き家について「1年以上住んでいないか、使われていない家」と国が示す基準を紹介。生活スタイルの多様化で1世代1軒の家を建てるようになったとし「早いか遅いかだけで、3世代同居であっても空き家は人ごとではない」と力を込めた。\n\n 空き家を放置すると、建物の傷みが早くなり、不法侵入や放火の恐れが高まるなど、所有者の不利益になると指摘。さらに、まちが荒れて地域の住宅価値が下がったり、市町村の税収が減って水道などライフラインの維持管理が難しくなったりして「地域の課題でもある」との視点を示した。\n\n 一方、畑理事長は統計データや最近の法改正を解説した。住宅総数に対する空き家率が30％を超えると自治体の財政が破綻するともいわれているとし、2018年の総務省調査で全国平均の空き家率13・6％に対して南丹市は19・4％に上ると説明した。\n\n 今年4月から相続不動産の登記義務化が始まり、正当な理由がないのに登記しなければ10万円以下の過料が課されるなど「空き家の活用を進め、管理不全に対して厳しくしていくのが国の方向性だ」と話した。\n\n 空き家の所有者になったら、どうすればよいのか。畑インストラクターは「利活用を考えているうちに、劣化して住めなくなるケースがある。売れない、活用できない『負動産』になってしまう」と早期対応の必要性を訴えた。利活用が可能か解体すべきかは、木造住宅簡易鑑定士による調査が利用できることを紹介した。\n\n 特に「空き家予備軍」の1人暮らしや夫婦だけの高齢世帯は、終活として「あらかじめ自宅の相続人を決め、住むのか、貸すのか、売るのか、どうしてほしいのかを家族で話し合ってほしい」と求めた。「遺産狙いと思われるのを気にして子どもから持ち出しにくいこともあるので、親から切り出してみてはどうか」と提案した。\n\n 講演会は2月23日、南丹市日吉町の森の学舎五ケ荘で住民組織「住みよいむらづくり協議会」が開いた。,['https://newsatcl-pctr.c.yimg.jp/t/amd-img/20240308-01313745-kyt-000-1-view.jpg?pri=l&w=484&h=640&exp=10800'],"['https://news.yahoo.co.jp/articles/b768555b7489125abef3a42f99551b606e7ab35b/images/000', 'https://www.kyoto-np.co.jp/articles/gallery/1128421?utm_source=headlines.yahoo.co.jp&utm_medium=referral&utm_campaign=partnerLink&img=https://kyoto-np.ismcdn.jp/mwimgs/6/c/150m/img_6c708eb2d45e6258f210e98df03501521356651.jpg']"
京都国際高校、第4日第3試合で青森山田高校と対戦　選抜高校野球（京都新聞）,https://news.yahoo.co.jp/articles/22749048d0a5ba1533d91b92d74fe822f236c765,https://newsatcl-pctr.c.yimg.jp/t/amd-img/20240308-01314914-kyt-000-4-view.jpg?exp=10800,2024-03-08T09:46:50+09:00,2024-03-08T17:42:58+09:00,京都新聞,kyt,京都新聞,255,\n昨秋の近畿大会１回戦で田辺にサヨナラ勝ちし、笑顔を見せる京都国際の選手（２０２３年１０月２２日、大阪シティ信用金庫スタジアム）\n第96回選抜高校野球大会の組み合わせ抽選が8日、大阪市内で行われた。3年ぶり2度目の出場となる京都国際は、第4日目の第3試合で昨秋の東北大会で優勝した青森山田との対戦が決まった。\n\n 今大会は18日に開幕。準々決勝と準決勝の翌日に設定されている休養日を含め、30日までの13日間行われる。選抜大会は、1924年に愛知県内で第1回大会が行われてから、今年で100年を迎える。,['https://newsatcl-pctr.c.yimg.jp/t/amd-img/20240308-01314914-kyt-000-4-view.jpg?pri=l&w=640&h=375&exp=10800'],['https://news.yahoo.co.jp/articles/22749048d0a5ba1533d91b92d74fe822f236c765/images/000']
「水があふれている」市民から通報　水道管の空気弁から漏水か　京都の観光地が水浸し（京都新聞）,https://news.yahoo.co.jp/articles/584d0c1e61ce0c9d2fd2a3fdf7f33464df138222,https://newsatcl-pctr.c.yimg.jp/t/amd-img/20240308-01315037-kyt-000-10-view.jpg?exp=10800,2024-03-08T09:42:56+09:00,2024-03-08T17:39:52+09:00,京都新聞,kyt,京都新聞,304,\n1\n/\n2\n漏水の現場の様子（3月8日午前9時20分ごろ、京都市東山区）\n京都市東山区\n7日午前10時ごろ、京都市東山区の東大路通三条下ルで「地下水があふれている」と市民から通報があった。\n【動画】道路に水が湧き出している様子\n京都市上下水道局によると、水道管の空気弁から水が漏れている可能性があり、7日夕方ごろから漏水量が増加したという。\n\n 同局が水が吹き出している東大路通の南行き車線の一部を規制し、8日午前8時ごろから調査を進めている。\n\n 現場は八坂神社など観光地の近く。水は地上に絶えず流れ出し、車は徐行して進み、観光客らが歩道にまで流れてくる水をよけながら歩いていた。,"['https://newsatcl-pctr.c.yimg.jp/t/amd-img/20240308-01315037-kyt-000-10-view.jpg?pri=l&w=640&h=476&exp=10800', 'https://newsatcl-pctr.c.yimg.jp/t/amd-img/20240308-01315037-kyt-001-10-view.jpg?pri=l&w=640&h=479&exp=10800']","['https://news.yahoo.co.jp/articles/584d0c1e61ce0c9d2fd2a3fdf7f33464df138222/images/000', 'https://news.yahoo.co.jp/articles/584d0c1e61ce0c9d2fd2a3fdf7f33464df138222/images/001', 'https://www.kyoto-np.co.jp/list/movie?utm_source=headlines.yahoo.co.jp&utm_medium=referral&utm_campaign=partnerLink&id=CAfJinpvKZY']"
近江高校、1日目第3試合で熊本国府と対戦　選抜高校野球（京都新聞）,https://news.yahoo.co.jp/articles/86bf50bcd74daca1c7a2ffcd93ae86dbab6d0430,https://newsatcl-pctr.c.yimg.jp/t/amd-img/20240308-01314913-kyt-000-5-view.jpg?exp=10800,2024-03-08T09:31:52+09:00,2024-03-08T17:42:58+09:00,京都新聞,kyt,京都新聞,244,\n昨秋の近畿大会１回戦で興国に勝ち、校歌を歌う近江の選手（２０２３年１０月２１日、大阪シティ信用金庫スタジアム）\n第96回選抜高校野球大会の組み合わせ抽選が8日、大阪市内で行われた。2年ぶり7度目の出場となる近江は、第1日目の第3試合で昨秋の九州大会を制した熊本国府との対戦が決まった。\n\n 今大会は18日に開幕。準々決勝と準決勝の翌日に設定されている休養日を含め、30日までの13日間行われる。選抜大会は、1924年に愛知県内で第1回大会が行われてから、今年で100年を迎える。,['https://newsatcl-pctr.c.yimg.jp/t/amd-img/20240308-01314913-kyt-000-5-view.jpg?pri=l&w=640&h=451&exp=10800'],['https://news.yahoo.co.jp/articles/86bf50bcd74daca1c7a2ffcd93ae86dbab6d0430/images/000']
京都外大西高校、3日目第2試合で昨年Ｖの山梨学院と対戦　選抜高校野球（京都新聞）,https://news.yahoo.co.jp/articles/b16915bd2feb82b334bcc026230cc3cdb9cda156,https://newsatcl-pctr.c.yimg.jp/t/amd-img/20240308-01314915-kyt-000-4-view.jpg?exp=10800,2024-03-08T09:27:52+09:00,2024-03-08T17:42:58+09:00,京都新聞,kyt,京都新聞,246,\n昨秋の近畿大会準々決勝で履正社を破り、喜ぶ京都外大西の選手たち（２０２３年１０月２９日、大阪シティ信用金庫スタジアム）\n第96回選抜高校野球大会の組み合わせ抽選が8日、大阪市内で行われた。18年ぶり7度目の出場となる京都外大西は、第3日目の第2試合で昨年優勝の山梨学院との対戦が決まった。\n\n 今大会は18日に開幕。準々決勝と準決勝の翌日に設定されている休養日を含め、30日までの13日間行われる。選抜大会は、1924年に愛知県内で第1回大会が行われてから、今年で100年を迎える。,['https://newsatcl-pctr.c.yimg.jp/t/amd-img/20240308-01314915-kyt-000-4-view.jpg?pri=l&w=640&h=442&exp=10800'],['https://news.yahoo.co.jp/articles/b16915bd2feb82b334bcc026230cc3cdb9cda156/images/000']
JR山陰線で落石、上下6本が運休　1200人に影響（京都新聞）,https://news.yahoo.co.jp/articles/ac9dccdda86029e8d3cb3347c7c5269ec1d2a2d9,https://newsatcl-pctr.c.yimg.jp/t/amd-img/20240308-01314911-kyt-000-2-view.jpg?exp=10800,2024-03-08T08:32:01+09:00,2024-03-08T08:36:55+09:00,京都新聞,kyt,京都新聞,146,\nJR西日本本社（大阪市）\n7日午後3時45分ごろ、京都府綾部市のJR山陰線・立木-山家間で、走行中の豊岡行き普通電車の運転士が線路近くに落石を発見した。安全確認のため、園部-綾部間で約2時間運転を見合わせた。\n【写真】JR山陰線・山家駅\n上下6本が運休し、約1200人に影響が出た。,['https://newsatcl-pctr.c.yimg.jp/t/amd-img/20240308-01314911-kyt-000-2-view.jpg?pri=l&w=640&h=477&exp=10800'],"['https://news.yahoo.co.jp/articles/ac9dccdda86029e8d3cb3347c7c5269ec1d2a2d9/images/000', 'https://www.kyoto-np.co.jp/articles/gallery/1214911?utm_source=headlines.yahoo.co.jp&utm_medium=referral&utm_campaign=partnerLink&img=https://kyoto-np.ismcdn.jp/mwimgs/e/d/150m/img_edfe6f7282a43cd4c385a03d87e7fb011147713.jpg']"
認知症の人の生きる糧に　京都・中京で臨床美術の作品展　「五感で表現、作品触れて」（京都新聞）,https://news.yahoo.co.jp/articles/27327fbddbb7ac31f614025e3da9b43212a2884c,https://newsatcl-pctr.c.yimg.jp/t/amd-img/20240308-01313927-kyt-000-2-view.jpg?exp=10800,2024-03-08T08:51:58+09:00,2024-03-08T13:33:52+09:00,京都新聞,kyt,京都新聞,536,\n太陽をモチーフにしたオブジェ（写真左）などが並ぶ作品展＝６日、京都市中京区・堀川御池ギャラリー\n認知症の人や障害のある人らが前向きに生きる糧として制作した臨床美術の作品展「生きるを励ますアート」が6日、京都市中京区の堀川御池ギャラリーで始まった。\n\n 臨床美術は芸術療法（アートセラピー）の一つで、1996年に埼玉県で始まった。制作や出来栄えを話し合う鑑賞会を通じ、自分を認め、他者に共感を得てもらうことを目的とする。\n\n 今回は京都府内の臨床美術士や医師らでつくる団体「ART Along（アート・アロング）」（西京区）が企画。同団体は府立医科大付属病院と連携し、認知症の人と家族に臨床美術講座を14年間実施している。\n\n 「太陽の輝き」をテーマに認知症の人たちが作ったオブジェは、紙に線を引き、切り取ってから着色した。「手を動かしながら面白さを見つける」作業を通じて、赤色や金色が縦横に描かれ、太陽の力強さが表現されている。\n\n 会場には、障害者や元薬物中毒者、保育園児ら、さまざまな人が手がけた絵画やオブジェなど約320点が並ぶ。フルイミエコ代表理事は「アート本来の良さである五感が表現に反映された作品に触れてほしい」と話す。10日まで。無料。,['https://newsatcl-pctr.c.yimg.jp/t/amd-img/20240308-01313927-kyt-000-2-view.jpg?pri=l&w=640&h=455&exp=10800'],['https://news.yahoo.co.jp/articles/27327fbddbb7ac31f614025e3da9b43212a2884c/images/000']
「ウガンダの貧困に目を向けて」京都・南丹出身の元青年海外協力隊員が授業（京都新聞）,https://news.yahoo.co.jp/articles/443786ff5d7e8e37825b943ae4f97e3f46fab54f,https://newsatcl-pctr.c.yimg.jp/t/amd-img/20240308-01313854-kyt-000-6-view.jpg?exp=10800,2024-03-08T07:02:10+09:00,2024-03-08T13:32:03+09:00,京都新聞,kyt,京都新聞,673,\n画面越しにウガンダの生徒から日本語のあいさつがあり、拍手する中川さん（左）と園部高校付属中の生徒＝南丹市園部町\n京都府南丹市出身の元青年海外協力隊員が、園部高校付属中学校（南丹市園部町）で赴任地だったウガンダの現状について授業で話した。同国で貧困にあえぐストリートチルドレンについて説明し、生徒たちに「同じ年齢の子どもたちが苦しんでいる現状に関心を持ってほしい」と訴えた。\n\n 殿田中学校を卒業した元隊員の中川陽平さん（29）は、子どもの時にインドネシアを訪れ、路上で物乞いをする子の姿に衝撃を受けた。同隊ではウガンダで2年間保健体育を教えた。\n\n 授業は2月27日にあり、3年生36人にスライドを交えて同国の食べ物や文化について説明。現地の学校には、給食代や教科書代を払えず辞めざるを得なかったり、仕事をしながら通学するため3、4時間しか寝なかったりする生徒がいることを話した。\n\n 現地の学校とオンラインでつなぎ、園部高校付属中学校の生徒が現地語で「エヤラマ（ありがとう）」と話しかけると、画面越しにウガンダの生徒から日本語の「ありがとう」が返ってきて、教室は拍手に包まれた。生徒会長の松宮新太郎さん（15）は「同い年の子どもが寝る時間を削って働いていることに驚いた」と日本との違いを実感していた。\n\n 中川さんは現在、日本で会社勤めをしながら、ウガンダのストリートチルドレンの支援の方法を探っている。「みなさんが将来に少しでもウガンダのことを思い出して、自分たちができる支援の在り方を考えてくれたらうれしい」と訴えた。,['https://newsatcl-pctr.c.yimg.jp/t/amd-img/20240308-01313854-kyt-000-6-view.jpg?pri=l&w=640&h=393&exp=10800'],['https://news.yahoo.co.jp/articles/443786ff5d7e8e37825b943ae4f97e3f46fab54f/images/000']
滋賀・湖東病院国賠訴訟で証人尋問始まる　検察官が起訴判断の妥当性について証言（京都新聞）,https://news.yahoo.co.jp/articles/1f5eb0a02aa27beb3a26013872fa7d848c6d0a48,https://newsatcl-pctr.c.yimg.jp/t/amd-img/20240308-01314876-kyt-000-2-view.jpg?exp=10800,2024-03-08T06:02:04+09:00,2024-03-08T11:22:02+09:00,京都新聞,kyt,京都新聞,972,\n会見で証人尋問を振り返る西山美香さん（左から２人目）と弁護団＝７日午後、大津市梅林１丁目・滋賀弁護士会館）\n滋賀県東近江市の湖東記念病院の患者死亡を巡り、再審無罪が確定した元看護助手西山美香さん（44）=彦根市=が国と滋賀県に賠償を求めた訴訟の第10回口頭弁論が7日、大津地裁（池田聡介裁判長）で開かれた。この日から証人尋問が始まり、西山さんの起訴を判断した検察官（当時）と遺体を解剖した医師が判断の妥当性などについて証言した。\n【動画】大津地裁に入る西山美香さんと弁護団\n元検察官への尋問は、自白の信用性の判断が焦点の一つ。人工呼吸器を外した際に鳴るアラーム音を継続的に消す機能について、同僚が人工呼吸器を使うのを見て事前に知っていたという西山さんの自白を巡り、裏付けがないまま信用性を認めたのはなぜかと問われると、「捜査する中で自白が出たので信用できると判断した」と述べた。\n\n 「チューブのたん詰まりにより心臓停止したことも十分考えられる」とする解剖所見が書かれた捜査報告書を県警が検察に送っていなかったことを問われると、「全ての捜査資料を送っていると理解していた」と証言した。「もし送られていたら殺人罪の起訴を見送っていたのではないか」という西山さん側からの質問に対しては、「答えようがない」と答えた。\n\n 一方、解剖医は、解剖所見について「たん詰まりを採用すると、他の所見と合わなくなる」と証言。さらにその真意を問いただされると、たん詰まりによる死亡の可能性はないという趣旨の発言をし、自身が作成した所見の内容を否定するかのような証言をした。捜査報告書については「記憶がない」と述べた。\n\n 弁論後の会見で弁護団の鴨志田祐美弁護士は、「この事件がどれだけ自白に寄りかかり、自白にさしたる裏付けもないのに起訴に突っ走っていたことがあぶり出された」と振り返った。\n\n 西山さんは次回の証人尋問で取り調べを行った刑事が出廷することに触れ、「正直に話してほしい。それが悪いことでも責めもしないし、ちゃんと謝ってくれたらそれでいいと思っている」と話した。\n\n 次回5月23日に取り調べを行った警察官が出廷。同30日に捜査を指揮した元警察官の尋問が行われ、6月27日の西山さん本人の尋問を経て証拠調べを終える見通し。,['https://newsatcl-pctr.c.yimg.jp/t/amd-img/20240308-01314876-kyt-000-2-view.jpg?pri=l&w=640&h=424&exp=10800'],"['https://news.yahoo.co.jp/articles/1f5eb0a02aa27beb3a26013872fa7d848c6d0a48/images/000', 'https://youtu.be/pLQWlilgGcA?utm_source=headlines.yahoo.co.jp&utm_medium=referral&utm_campaign=partnerLink']"
