headline,mainEntityOfPage,image,datePublished,dateModified,author,media_en,media_jp,str_count,body,images,external_links
今年のWBC代表はすでに8本塁打を記録！23年WBC代表の9本塁打まであと1本【WBC】（高校野球ドットコム）,https://news.yahoo.co.jp/articles/cf4f720f94ac3f8b9e598d6c881275db3c64d3b3,https://newsatcl-pctr.c.yimg.jp/t/amd-img/20260310-00011531-hbnippon-000-1-view.jpg?exp=10800,2026-03-10T22:46:08+09:00,2026-03-10T22:46:08+09:00,高校野球ドットコム,hbnippon,高校野球ドットコム,262,大谷翔平（左）鈴木誠也（写真は過去の取材より） 侍ジャパンはWBCプールCを4連勝で終えた。オープニングラウンドで8本塁打を記録した。これは優勝した23年の9本塁打に1本迫る内容だ。 【一覧】WBC準々決勝進出チーム ここまで本塁打を打っているのは 【2本】 大谷 翔平（ドジャース） 鈴木 誠也（カブス） 吉田 正尚（レッドソックス） 【1本】 村上 宗隆（ホワイトソックス） 周東 佑京（ソフトバンク） の5名である。2大会連続の世界一は主力選手たちの一発長打が期待されるだろう。23年を超える二桁本塁打は期待できるか。,[],[]
日本、チェコに苦戦するも、8回裏に周東3ラン、村上満塁弾などで一挙9得点！2安打完封リレーで4連勝【WBC】（高校野球ドットコム）,https://news.yahoo.co.jp/articles/d03cb9437174242d16668ab9f04cbbe094bda13d,https://newsatcl-pctr.c.yimg.jp/t/amd-img/20260310-00011530-hbnippon-000-2-view.jpg?exp=10800,2026-03-10T22:01:05+09:00,2026-03-10T22:22:55+09:00,高校野球ドットコム,hbnippon,高校野球ドットコム,325,周東（ソフトバンク）※26年2月撮影 WBCプールＣ最終戦は日本vsチェコの一戦が行われた。7回までチェコ投手陣に苦しめられ、0対0のまま8回へ。 【一覧】チェコ戦の試合経過 8回裏、若月 健矢捕手（オリックス）の適時二塁打で1点を先制。そして周東 佑京外野手（ソフトバンク）の3ランで4対0。押し出し四球で5対0にした侍ジャパンは村上 宗隆内野手（ホワイトソックス）が満塁本塁打を放ち、9対0とした。 投手陣は髙橋 宏斗投手（中日）、宮城 大弥投手（オリックス）、金丸 夢斗投手（中日）、北山 亘基投手（日本ハム）の4投手のリレーで完封勝利を飾った。 これで4連勝とした日本は準々決勝でグループD2位（ベネズエラとドミニカ共和国の敗者）と対戦する。,[],[]
"大谷翔平はチェコ戦の出番なくアメリカへ！開幕戦""衝撃満塁弾""に韓国戦の豪快アーチ…圧巻成績で日本の野球ファン沸かせる【WBC】（高校野球ドットコム）",https://news.yahoo.co.jp/articles/b5d429bcc660d5dfe4ec7ea8c6c64498ce3698e5,https://newsatcl-pctr.c.yimg.jp/t/amd-img/20260310-00011527-hbnippon-000-1-view.jpg?exp=10800,2026-03-10T21:52:29+09:00,2026-03-10T21:52:29+09:00,高校野球ドットコム,hbnippon,高校野球ドットコム,895,大谷 翔平（※写真は過去の取材より） ＜WBC2026 1次リーグプールC：日本代表-韓国代表＞◇7日◇東京ドーム 日本でも私たちが普段、中堅画面越しに見ている「SHO TIME」は健在だった。2023年に続きMLBの舞台からWBCに参戦した大谷 翔平（花巻東出身）。今大会では投手としての出場こそなかったが、台湾戦での大会初球二塁打、強烈すぎる先制グラウンドスラム、韓国戦で流れを引き寄せる同点アーチなど、今回も鮮烈な印象を日本国内の野球ファンに残してくれた。 【一覧】WBC準々決勝進出チーム 日本国内における大谷 翔平のインパクトは数字の部分でも如実に現れている。今年に限っては強化試合こそ5打数ノーヒットに終わったもののWBC本大会では3試合で9打数5安打6打点2本塁打1二塁打4四球・OPS1.838と圧倒的。さらに大谷が2018年に海を渡った後の日本国内での成績を列挙するとその偉大さが分かる。 2023年 WBC 強化試合 4打数3安打6打点2本塁打1四球（京セラドーム大阪） 本大会 16打数7安打8打点1本塁打3二塁打8四球（東京ドーム） 投手 2試合 8回3分の2 5安打10奪三振 2失点 防御率2.08 2025年 MLB東京シリーズ（東京ドーム開催／ロサンゼルス・ドジャース） プレシーズンゲーム 5打数1安打2打点1本塁打1四球 MLB開幕シリーズ 8打数3安打1打点1本塁打1二塁打2四球 チェコ戦を除いても日本国内での通算打撃成績は47打数19安打23打点7本塁打で打率.404・出塁率と長打率を合わせたOPSは1.513。東京ドーム開催に限ると38打数16安打17打点5本塁打で打率は.421・OPSも1.524まで跳ね上がっている。 次に彼が日本でプレーする機会は、3年後の2029年開催が噂される次回WBC、侍ジャパンのユニフォームを着てなのか？それとも、それより前、ロサンゼルス・ドジャースのユニフォームを着てなのか？母国・日本に、東京ドームに愛された男・大谷翔平の次なる「SHO TIME in JAPAN」に期待したい。 高校野球ドットコム編集部,[],[]
侍ジャパン待望の先制点！吉田正尚の代打で出場 若月健矢が意地の一打【WBC】（高校野球ドットコム）,https://news.yahoo.co.jp/articles/32ca617533e1b49c538a58a8273c67b8bf8314e7,https://newsatcl-pctr.c.yimg.jp/t/amd-img/20260310-00011529-hbnippon-000-3-view.jpg?exp=10800,2026-03-10T21:25:22+09:00,2026-03-10T21:41:54+09:00,高校野球ドットコム,hbnippon,高校野球ドットコム,248,タイムリーを放った若月（※写真は過去の取材より） ＜WBC2026 1次リーグプールC：日本代表-チェコ代表＞◇10日◇東京ドーム 侍ジャパンが8回に待望の先制点を奪取した。 【一覧】チェコ戦の試合経過 1死一塁で代打から出場の若月 健矢（花咲徳栄出身）が右方向への二塁打。守備がもたつく間に走者の佐藤 輝明（仁川学院出身）が生還した。 若月は6回に元同僚の吉田 正尚（敦賀気比出身）の代打で出場。頼りになるメジャー組への代打にXでは「代打若月」がトレンド入りしていた。 高校野球ドットコム編集部,[],[]
侍ジャパンは5回終えて0対0、髙橋宏斗が好投も…チェコ代表の先発右腕を攻略できず【WBC】（高校野球ドットコム）,https://news.yahoo.co.jp/articles/7314ca16323ba6eeb2da233526c5e110a231068e,https://newsatcl-pctr.c.yimg.jp/t/amd-img/20260310-00011525-hbnippon-000-1-view.jpg?exp=10800,2026-03-10T20:36:09+09:00,2026-03-10T20:36:09+09:00,高校野球ドットコム,hbnippon,高校野球ドットコム,326,好投した髙橋宏斗（※写真は過去の取材より） ＜WBC2026 1次リーグプールC：日本代表-チェコ代表＞◇10日◇東京ドーム 侍ジャパンとチェコ代表の一戦は5回を終えて0対0。得点動かず、試合はこう着状態となっている。 【一覧】チェコ戦の試合経過 侍ジャパンの先発・髙橋 宏斗（中京大中京出身）が150キロ中盤の速球を軸に5回2/3を投げて無失点の好投。今大会初登板をわずか2安打に抑え、試合を作った。 対するチェコ代表もサトリアが侍ジャパン打線を手玉に取り、5回途中無失点に抑えた。ヒットこそを許しているものの、要所を抑える内容で得点を与えていない。 均衡破れず投手戦となった試合で、先取点をとるのはどちらになるのだろうか。 高校野球ドットコム編集部,[],[]
侍ジャパン チェコ戦は大谷、鈴木がベンチスタート、森下＆佐藤輝が1、2番スタメン出場【WBC】（高校野球ドットコム）,https://news.yahoo.co.jp/articles/15c35064e266de5359c4b1b2cd8fe62e9bc2c661,https://newsatcl-pctr.c.yimg.jp/t/amd-img/20260310-00011526-hbnippon-000-2-view.jpg?exp=10800,2026-03-10T18:35:51+09:00,2026-03-10T19:11:46+09:00,高校野球ドットコム,hbnippon,高校野球ドットコム,403,チームを指揮する井端監督（※写真は過去の取材より） ＜WBC2026 1次リーグプールC：日本代表-チェコ代表＞◇10日◇東京ドーム 侍ジャパンが10日、チェコ代表と1次リーグ最終戦に臨む。試合開始に先立ち、両チームのスタメンが発表された。 【一覧】チェコ戦のスタメン選手 すでに首位通過が決まり、野手は大幅に変更。大谷 翔平（花巻東出身）、鈴木 誠也（二松学舎大付出身）のメジャーコンビが今大会初めてスタメンから外れた。これまで大谷が務めた1番には森下 翔太（東海大相模出身）、2番には佐藤 輝明（仁川学院出身）が入った。 下位打線もこれまで出場がなかった小園 海斗（報徳学園出身）が「6番・ショート」で出場。他にも7番で周東 佑京（東農大二出身）、9番で牧原 大成（城北出身）が入った。 先発は髙橋 宏斗（中京大中京出身）が務める。WBC初先発で勝利に導く投球を見せられるか。 高校野球ドットコム編集部,[],[]
韓国代表と豪州代表の歴史的死闘にSNS沸騰、敗退決まった2チームを称える声も続出「また府中に来て」「台湾も含めて全部ベスト8」（高校野球ドットコム）,https://news.yahoo.co.jp/articles/1c8f5e08caf3c53c73bc6e26737d4ee6b75a5225,https://newsatcl-pctr.c.yimg.jp/t/amd-img/20260310-00011524-hbnippon-000-3-view.jpg?exp=10800,2026-03-10T15:55:19+09:00,2026-03-10T16:12:43+09:00,高校野球ドットコム,hbnippon,高校野球ドットコム,1096,準々決勝進出を決めた韓国代表（※写真はKBOの公式Instagramより） 準々決勝進出をかけたオーストラリア代表と韓国代表の一戦は、進出条件が二転三転するジェットコースター的展開となった。SNS上も日本野球ファン含む各国野球ファンが沸騰する時間が続いた。 【一覧】大激戦のプールCの順位表 まず韓国は6回表に1点を追加し準々決勝進出権を奪取。ところがオーストラリアは8回裏に1点を返し再び準々決勝進出権利を手にする。 よって9回表を迎えた時点で韓国は無得点ならオーストラリアがその時点で準々決勝進出決定。1点以上を取れば韓国が準々決勝進出権利を再奪取。2点を取れば台湾にも準々決勝進出の可能性が残るという状況で、韓国は9回表に1点を加えて5点をリード。この時点で台湾は無念の1次ラウンド敗退となった。 ただ、SNS上の台湾野球ファンたちは極めて冷静な反応に終始。「正式に敗退が決まったね」と事実を受け入れつつ、「お疲れさまでした」と改めて中華隊への感謝を綴っていた。 一方、9回裏をオーストラリアを無失点に封じ、実に4大会ぶりとなる1次ラウンド突破を決めた。マウンド上で優勝を決めたかのように喜びを表現する韓国代表に呼応するように韓国野球ファンのSNS上は準々決勝の地・マイアミを示す「마이애미」のハングル語ポストが殺到。さらに「これはどんなドラマなんだ」と筋書きのないドラマに感動するポストもあった。 日本の野球ファンたちからはまずオーストラリアへの感謝が。「ナイスゲームだった」「あなたがたは強かった」「また府中に来てください」とキャンプ地・東京都府中市からも再会を祈るポストが相次ぐことに。さらに「韓国代表おめでとう。オーストラリアも強かった」「凄い試合だった」「台湾も含めて全部ベスト8にはならないのか」と侍ジャパンの対戦相手へのリスペクトもあふれた。 そしてMLB通算1939安打、オリックス・バファローズでもプレーしたこのレジェンドもオーストラリア代表へコメント。アダム・ジョーンズ氏は韓国vsオーストラリアの試合終了直後にXへ投稿。「オーストラリア代表はWBCで素晴らしい成績を収めました。みんな素晴らしい野球をしていたので、頭を下げる必要はありません。オーストラリア野球の未来は明るいです。胸を張って」と、最大級の賛辞を彼らに届けた。 かくして、プールＣは1位：日本、2位：韓国、3位：オーストラリア、4位：台湾、5位：チェコと全ての順位も確定。日本vsチェコ戦は東京ラウンド最終戦と同時に、全力を出し続けたプールCの5チームに感謝する集いとなる。 高校野球ドットコム編集部,[],[]
日本、ドミニカ共和国ら5チームの準々決勝進出が決定！最下位も3チーム決定【WBC6日目結果】（高校野球ドットコム）,https://news.yahoo.co.jp/articles/77ef8e90f8e4ddc113a93c10ff60c0107eed4b7f,https://newsatcl-pctr.c.yimg.jp/t/amd-img/20260310-00011522-hbnippon-000-2-view.jpg?exp=10800,2026-03-10T15:51:45+09:00,2026-03-10T16:49:25+09:00,高校野球ドットコム,hbnippon,高校野球ドットコム,625,※写真はイメージ WBCのオープニングラウンドも大詰め。各地で準々決勝進出チームが続々と決まっている。 【一覧】WBC準々決勝進出チーム 5日から始まったプールCは日本、韓国が準々決勝進出。 プールAではプエルトリコが4対1でキューバに勝利を収め、3連勝で準々決勝進出が決定した。 また3連敗中のコロンビアが4対3でパナマを下し、初勝利を収めた。残り1枠では、カナダがプエルトリコ、キューバに連勝すれば、準々決勝進出。キューバはカナダを破って直接対決で上回ることが条件になる。 最下位争いでは、カナダが連敗すれば、カナダ、パナマ、コロンビアの3カ国が並び、2試合で11失点のコロンビアが最下位へ。カナダが1勝でもすれば、最下位回避。そしてコロンビアとの直接対決で敗れたパナマが最下位となる。 プールBはアメリカがメキシコを5対3で破った。11日はイタリアと対戦し、勝利すれば、1位で準々決勝進出が決まる。3カ国が3勝1敗で並ぶ可能性があり、最後まで見逃せない。 プールDではドミニカ共和国が10対1でイスラエル、ベネズエラが4対0でニカラグアを破り、それぞれ3連勝を収め、準々決勝進出が決まった。11日にオランダvsイスラエルの4位決定戦が行われ、12日にドミニカ共和国vsベネズエラの順位決定戦が行われる。この試合で敗れた相手が準々決勝で日本と対決する。 ここまで計5チームの準々決勝進出が決定。残りはプールAの1チーム、プールBの2チームとなる。,[],[]
四国IL・愛媛にドミニカ共和国出身選手2人が入団！母国はWBC優勝候補の一角「日本にはいい選手がいるけど…」（高校野球ドットコム）,https://news.yahoo.co.jp/articles/61c9022d71097c3d30bba42b3db4731a56259098,https://newsatcl-pctr.c.yimg.jp/t/amd-img/20260310-00011291-hbnippon-000-3-view.jpg?exp=10800,2026-03-10T15:37:30+09:00,2026-03-10T15:50:42+09:00,高校野球ドットコム,hbnippon,高校野球ドットコム,1112,カープアカデミーから四国アイランドリーグplus愛媛に派遣されたアルティレス投手（右）とメヒア内野手（左） 四国アイランドリーグplus・愛媛マンダリンパイレーツが9日、過去にMLB通算2095安打を放ったアルフォンソ・ソリアーノなどドミニカ共和国から数多くの名選手を輩出しているカープアカデミーから派遣されることになったアルティレス投手（24歳）とメヒア内野手（23歳）の入団記者会見を行った。 【一覧】優勝候補 ドミニカ共和国代表メンバー アルティレス投手は制球にも優れる最速157キロ右腕でNPB広島東洋カープ・山根 雅仁編成部長が「育成選手契約を結ぶことも検討した」と語るほどの素材を持つ。またメヒア内野手も昨季愛媛マンダリンパイレーツの独立リーグ日本一獲得にも貢献したパンチ力を備える左打者である。 2人の母国・ドミニカ共和国は現在行われているWBCで優勝候補の一角として注目されている。3月10日（日本時間）時点では一次リーグプールDで3勝連勝を飾っており、同じく無敗のベネズエラと3月12日（日本時間）に行われる直接対決に敗れた側が、プールC首位の侍ジャパンに立ちはだかることとなる。 ドミニカ共和国は今大会3試合連続二桁得点と強力打線が爆発。MLB各球団のスターが揃う強敵とWBC初対決が実現すれば、日本代表の世界一連覇に向けた大きな試練となりそうだ。 そんな2人が異口同音に語ったのはドミニカ共和国野球の「力強さ」である。アルティレス投手が「ドミニカの選手たちは力強いボールを投げることができます」と話せば、メヒア内野手も「各打者が力強いスイングができますし、対戦する投手もいいストレートを投げてきます」とコメント。その上で2人は侍ジャパンがドミニカ共和国と対戦した場合は「両方いいチーム。どちらが勝つかわからないけど、いい試合になるだろう」と話した。 ただ肝心なのは勝敗の行方。侍ジャパン。ドミニカ共和国。ズバリどちらが勝つのか？ 「ドミニカに勝って欲しい思いはあるけど、わからないですね」と少し煙に巻いたアルティレス投手に対し、日本生活も2年目に入ったメヒア内野手は、具体的な名前をあげた。 「日本には大谷 翔平、山本 由伸（ともにロサンゼルス・ドジャース）などいい選手がいますが、ドミニカにもJ・ソト（ニューヨーク・メッツ）、M・マチャド（サンディエゴ・パドレス）、F・タティスJr（サンディエゴ・パドレス）などいい選手がいっぱいいますので、恐らくドミニカが勝つでしょう(笑)」 はたして、これまでWBCでは実現しそうでなかった夢の対決はあるのか？まずはプールDの行方をじっくり見守りたい。 寺下友徳,[],[]
アメリカがメキシコを破り3連勝！準々決勝進出の条件は？【WBCプールB　4日目対戦成績】（高校野球ドットコム）,https://news.yahoo.co.jp/articles/48d1b52d7620eafdc27bb1b0d16ce2281366fd0e,https://newsatcl-pctr.c.yimg.jp/t/amd-img/20260310-00011523-hbnippon-000-1-view.jpg?exp=10800,2026-03-10T15:04:46+09:00,2026-03-10T15:04:46+09:00,高校野球ドットコム,hbnippon,高校野球ドットコム,402,※写真はイメージ 10日、プールBの4日目は2試合が行われた。 イギリスvsブラジルの一戦は8対1でイギリスが今大会初勝利。ブラジルは全敗となり、最下位が決定。今大会に続き、次回大会も予選ラウンドから大会出場を目指す。第2試合はアメリカvsメキシコの強豪対決が行われ、5対3でアメリカが勝利した。3回裏に一挙5点を奪った。剛速球を投じるポール・スキンズ（パイレーツ）は160キロを超える豪速球で4回7奪三振、無失点の快投だった。 【一覧】プールBの順位表 アメリカは11日のイタリア戦に勝利すれば、無条件で準々決勝進出。敗れたメキシコはイタリアがアメリカに敗れて12日の直接対決を制すれば、準々決勝進出。イタリアもアメリカに敗れてもメキシコとの直接対決を制すれば準々決勝進出ができる。 ただしアメリカがイタリアに敗れて、12日、イタリアがメキシコに敗れると、3カ国が3勝1敗で再び失点率で争う構図となる。,[],[]
「スポーツマンシップがない」台湾ファンが韓国代表の大砲のSNSに批判コメント 準々決勝進出争いの余波か（高校野球ドットコム）,https://news.yahoo.co.jp/articles/e41d728b57b066958fd03564cee3147ddfefe07b,https://newsatcl-pctr.c.yimg.jp/t/amd-img/20260310-00011517-hbnippon-000-2-view.jpg?exp=10800,2026-03-10T12:05:03+09:00,2026-03-10T12:19:39+09:00,高校野球ドットコム,hbnippon,高校野球ドットコム,866,韓国代表の選手達（写真は過去の取材より） 台湾の野球ファンが、韓国代表の大砲ムン・ボギョン（LG）のSNSに批判コメントを寄せている。 【一覧】大激戦のプールCの順位表 韓国は9日、東京ドームで行われた2026年ワールド・ベースボール・クラシック（WBC）1次ラウンドC組の最終戦でオーストラリアに7―2で勝利。これにより韓国は2勝2敗とし、首位の日本に続いて準々決勝進出を決めた。 台湾はオーストラリアとともに敗退が決まった。3チームはいずれも2勝2敗で並んだが、大会規定により「当該チーム間の失点率」で順位が決まり、韓国が2位となった。 この試合で最も目立つ活躍を見せたのはムン・ボギョンだった。5打数3安打4打点1本塁打の活躍を見せ、今大会の1次ラウンドでは計11打点を記録するなど、存在感を示した。 試合後、ムンは自身の試合中の写真とともに「マイアミへ行こう！」と投稿。すると台湾ファンがこの投稿に対し、「ムンは全力でプレーしていない」「スポーツマンシップに欠ける」「図々しい国だ」などのコメントを書き込み、ムンや韓国代表を批判した。台湾の準々決勝進出の可能性が消滅したことが背景にあるとみられる。 台湾が準々決勝へ進むためには、韓国が8得点以上を挙げ、さらにオーストラリアが3得点以上を記録した状態で韓国が勝利する必要があった。 しかし9回、韓国が7―2とリードする場面でムンが打席に立ち、三振に倒れて攻守が交代。韓国が8点目を挙げられなかったことで、この時点で台湾の準々決勝進出の可能性は消滅した。台湾ファンの間では、この場面でムンが全力で打席に臨んでいなかったのではないかとの声が上がっている。 一方、韓国ファンの間では「見当違いの批判だ」として、台湾ファンの批判は行き過ぎだという声も出ている。 ムンは9日のオーストラリア戦で5打数3安打1本塁打4打点を記録し、韓国の準々決勝進出に貢献した。今大会では4試合で13打数7安打2本塁打11打点、打率.538、OPS1.154をマークしている。 高校野球ドットコム編集部,[],[]
