headline,mainEntityOfPage,image,datePublished,dateModified,author,media_en,media_jp,str_count,body,images,external_links
「大谷に壁を感じた」韓国の新星22歳内野手、MLBスカウト最注目の存在に（高校野球ドットコム）,https://news.yahoo.co.jp/articles/db1021dcf978d98001884ad74f43f1a5c885d7d2,https://newsatcl-pctr.c.yimg.jp/t/amd-img/20260310-00011344-hbnippon-000-1-view.jpg?exp=10800,2026-03-10T11:41:57+09:00,2026-03-10T11:41:57+09:00,高校野球ドットコム,hbnippon,高校野球ドットコム,1152,キムドヨン（※写真はキムドヨンのInstagramより） 2026年WBC本大会1次ラウンドC組で連日タイムリーを放っている韓国代表の内野手、キム・ドヨン（KIA）は、2024年KBOリーグMVPを受賞した韓国を代表する若手打者だ。代表合流を前に「優れた選手たちと同じ舞台に立てること自体が自分にとってはとても特別な経験。とても楽しみにしている。できるだけ多くを見て学び、しっかりプレーしてきたい。大谷 翔平（ドジャース）を実際に見るのも初めてだ。正直、野球選手にとっての“野球選手”。それだけに本当にすごい選手だと思うし、楽しみだ」と胸を躍らせていた。 【一覧】大激戦のプールCの順位表 しかし、メジャーリーグMVPの大谷と実際に対峙した瞬間、キム・ドヨンは「壁」を感じたという。大谷は7日に行われたC組の韓国戦に「1番・DH」で先発出場し、2打数2安打（1本塁打）2四球、1打点3得点の活躍で日本の8―6の勝利に貢献した。 試合後、キム・ドヨンは大谷との対戦について「壁を感じた。世界には本当にすごい選手がたくさんいると実感した」と振り返った。さらに「自分にとってこの大会はとても大きな経験になると思う。まだ足りない部分も多く感じた。大会はまだ続いているが、これからも成長できるよう努力したい」と語った。 世界トップクラスの大谷との実力差を実感した一方で、キム・ドヨンの存在感も今大会で際立っている。実際、東京ドームには約20球団のMLBスカウトが集まり、キム・ドヨンのプレーを注視していた。 韓国メディア「文化日報」によると、8日に東京ドームで行われたC組の台湾戦にはMLB約20球団のスカウトが訪れ、責任者クラスのスカウトも7～8人含まれていたという。現地を訪れたMLB球団のスカウトは「今回の東京ラウンドで最も注目される選手と言っていい。韓国、日本、台湾の試合で計18本塁打が出ているが、その中で米国でプレー経験のない自国リーグ所属選手の本塁打はキム・ドヨンとムン・ボギョンだけだ。台湾戦で見せた打撃は本当に印象的だった」と明かした。 特にMLB有望株ランキングでも上位に入る台湾のリン・ウェイエン（アスレチックス）から放った本塁打は、多くのスカウトの視線を引きつけるのに十分だった。キム・ドヨンを巡っては米大手エージェンシーによる水面下の争いも激しくなっている。キム・ドヨンはまだ米国のエージェントと契約しておらず、東京を訪れた大手エージェンシーが国内エージェント側と接触していると伝えられている。 一方、韓国は9日、オーストラリアとの最終戦に7―2で勝利し、準々決勝進出を決めた。今大会での活躍が続けば、キム・ドヨンをめぐるメジャー球団の関心もさらに高まりそうだ。 高校野球ドットコム編集部,[],[]
韓国代表41歳ベテラン右腕が危機で好投、韓国は準々決勝進出…「なぜ選ばれたか証明できてうれしい」（高校野球ドットコム）,https://news.yahoo.co.jp/articles/172b781fb59ca6b8073a87b729482d9da660bc23,https://newsatcl-pctr.c.yimg.jp/t/amd-img/20260310-00011520-hbnippon-000-1-view.jpg?exp=10800,2026-03-10T11:40:05+09:00,2026-03-10T11:40:05+09:00,高校野球ドットコム,hbnippon,高校野球ドットコム,904,ノギョンウン（※写真はKBOの公式Instagramより） 韓国代表が17年ぶりに東京でWBCの準々決勝進出を決める中、41歳のベテラン右腕・ノ・ギョンウン（SSG）の力投が危機の場面で光った。 【一覧】大激戦のプールCの順位表 韓国は9日、東京ドームで行われた2026年WBC1次ラウンドC組のオーストラリア戦に7―2で勝利。先発のソン・ジュヨン（LG）が1回で肘の痛みを訴えて降板するアクシデントに見舞われたが、2番手として登板したノ・ギョンウンが2イニングを無失点に抑え、試合の流れをつないだ。 韓国メディア「聯合ニュース」によると、ソンは1回を投げ終えた後、突然肘の痛みを訴えたという。ノが準備する時間を確保するため2回もマウンドに上がったが、その後交代。ノは十分に肩を作れていない状態での登板だったが、3回まで無失点に抑えてチームの勝利に貢献した。 リュ・ジヒョン監督は試合後、「難しい状況の中でノが2イニングを抑え、リードを守ってくれた。本当にありがたい」と語った。 試合後、ノは「登板の準備はしていたが、こんなに早く投げるとは思わなかった。持てる力をすべて出し切った」と振り返った。さらに「コーチは私が肩の仕上がりが早いことを知っていたし、自分からも『すぐ行きます』と伝えた」と当時の状況を明かした。 ノは2013年のWBC以来、13年ぶりの代表復帰。引退の危機を乗り越え、リーグ屈指のリリーフ投手として復活し、41歳で再び代表に選ばれた。 「なぜ代表に選ばれたのか証明できた気がして、心の重荷が少し下りた。チームに少しでも貢献できてうれしい」と語り、「最後の代表を良い形で終えられて良かった。国民の声援に応えたいと思っていたので光栄だ」と続けた。 韓国は米マイアミで行われる準々決勝に臨む。ノは「短期決戦は1試合負ければ終わり。毎試合勝てるようにしっかり準備したい。マウンドではまた力を振り絞る」と意気込んだ。 1984年3月11日生まれのノは韓国代表最年長選手。米国へ向かう機内で42歳の誕生日を迎える予定で、「とても意味のある誕生日になりそうだ」と笑顔を見せた。 高校野球ドットコム編集部,[],[]
神奈川の強豪・桐光学園が卒業生の進路を公開！主将は中央大、エースは東洋大へ！ICUに現役合格する生徒も！（高校野球ドットコム）,https://news.yahoo.co.jp/articles/e861ea72cfa7ffe96ff4abf842e6446b145a7c3c,https://newsatcl-pctr.c.yimg.jp/t/amd-img/20260310-00011492-hbnippon-000-3-view.jpg?exp=10800,2026-03-10T11:03:46+09:00,2026-03-10T11:12:24+09:00,高校野球ドットコム,hbnippon,高校野球ドットコム,352,主将の白鷹（左）とエースの加賀 激戦区・神奈川の強豪・桐光学園が卒業生の進路を公開した。 優れたミートセンスと軽快な守備で下級生の頃からレギュラーを張った主将・白鷹 悠人内野手は中央大へ。140キロ台の真っすぐに鋭く曲がるスライダーを武器に活躍したエース右腕・加賀 滉太投手は同じく東都リーグの東洋大に進学する。 【一覧】桐光学園の卒業生進路 他にも持ち前の守備力で正二塁手を務めた皆川 陽斗内野手は立教大、チーム随一のパンチ力を誇る中里 心温外野手は日本体育大と、主力の多くが首都圏の強豪大へと進む。 継続者以外では、 林 香太朗内野手が野球部引退後から勉強に励み、国際基督教大（ICU）に合格した。県内有数の進学校と知られる同校は、今年も文武両道を実現する進路実績となった。 高校野球ドットコム編集部,[],[]
ヤマハの151キロ左腕が中1日、4回無失点の好投も…西武所属右腕などが打たれてブラジルがイギリスに完敗し、最下位＆予選ラウンド決定【WBC】（高校野球ドットコム）,https://news.yahoo.co.jp/articles/623a919f89e20dd2fc9697b95c6a7d72fdc3be7d,https://newsatcl-pctr.c.yimg.jp/t/amd-img/20260310-00011519-hbnippon-000-1-view.jpg?exp=10800,2026-03-10T10:43:08+09:00,2026-03-10T10:43:08+09:00,高校野球ドットコム,hbnippon,高校野球ドットコム,389,沢山優介（ヤマハ） プールB、ブラジルvsイギリスの一戦は最下位をかけた戦いとなり、ブラジルが1対8で敗れ、前回に続き最下位となった。 【動画】沢山の快速球！！ 先発は中1日でヤマハの151キロ左腕・沢山優介投手（掛川西）。前回は先発で45球投げているが、この日も常時140キロ中盤の速球、切れのあるスライダー、チェンジアップをコンビネーションにMLB所属選手揃うイギリス打線を4回を投げて65球、被安打2、3奪三振 無失点の快投を見せた。 しかしイタリア戦に続いて沢山以外、頼れる投手がいないブラジルは5回以降から投手陣が崩れ、8回裏からボー・タカハシ（西武）が登板したが、1回2失点だった。 最下位が決定したブラジルは次回も予選から戦う。好投した沢山はブラジル投手陣に欠かせない存在に成長。MLB組が揃うイタリア、イギリスを抑え、ドラフト候補としても大きなアピールを見せた。,[],[]
奇跡の大逆転を生んだ1イニング…なぜ韓国は台湾、オーストラリアの失点率を上回ったのか？【WBC】（高校野球ドットコム）,https://news.yahoo.co.jp/articles/66b4ffa169a63ec07e4a43cca6a92078cfb8c9cf,https://newsatcl-pctr.c.yimg.jp/t/amd-img/20260310-00011518-hbnippon-000-2-view.jpg?exp=10800,2026-03-10T09:21:54+09:00,2026-03-10T09:42:52+09:00,高校野球ドットコム,hbnippon,高校野球ドットコム,516,韓国ナイン（25年11月撮影） WBCプールCで大逆転が起こった。韓国が7対2でオーストラリアを破り準々決勝進出を決めた。 【一覧】大激戦のプールCの順位表 試合を決めたのは「失点率」。WBCでは3カ国が並んだ時、まず当該国同士の失点率で争われる。 2勝2敗で並んだ台湾、オーストラリア、韓国の失点、守備イニングは以下の通り。 オーストラリア 2試合 18回 7失点 台湾 2試合 18回 7失点 韓国 2試合 19回 7失点 失点率（失点÷アウト数）にすると、 韓国 0.1228 オーストラリア・台湾 0.1296と僅かに下回った。 失点率は守るイニングが多いほど有利になる。韓国は8日の台湾戦で延長10回まで試合を行ったこと。そのため両国に比べて守備1イニングが多かったことが、準々決勝進出の要因となった。 しかしこの試合は韓国が「2失点以内＋5点差」で勝利することが大前提。ここまで3試合で5失点。強力な日本打線も苦しめたオーストラリア投手陣を攻略し、さらに3試合6本塁打の打撃陣も抑えなければならない。オーストラリア有利の予想を覆しての逆転劇だった。 最高難易度のゲームを制した韓国は準々決勝でDグループの1位と対戦する。,[],[]
四国地区の春季大会組み合わせが出そろう！名門・明徳義塾、高松商の対戦相手は？【26年春高校野球】（高校野球ドットコム）,https://news.yahoo.co.jp/articles/2f321ca1d7b88859e44e04bea900e227dfcba257,https://newsatcl-pctr.c.yimg.jp/t/amd-img/20260310-00011507-hbnippon-000-1-view.jpg?exp=10800,2026-03-10T06:48:39+09:00,2026-03-10T06:48:39+09:00,高校野球ドットコム,hbnippon,高校野球ドットコム,299,写真はイメージ 2026年の第79回春季四国地区高校野球大会の各県大会の組み合わせが出そろった。各県すべて開幕は20日。 【トーナメント表】春季高知大会の組み合わせ 高知では昨年秋優勝の明徳義塾は初戦となる2回戦で小津と対戦。準優勝の土佐は高知東と1回戦で対戦することになった。 香川では、昨秋8強のシード・高松商は初戦で琴平と対戦することが決まった。 徳島では徳島商が小松島と生光学園の勝者と対戦する。 愛媛ではノーシードの強豪・済美が伊予農と初戦で対戦。勝てばシードの今治西と対戦することになった。ノーシードの伝統校・松山商は、初戦で「八幡浜・川之石」連合と対戦する。 高校野球ドットコム編集部,[],[]
