headline,mainEntityOfPage,image,datePublished,dateModified,author,media_en,media_jp,str_count,body,images,external_links
夏に向けて盛り上がる！　理美容品の直近の売れ筋は？ - 古田雄介の家電トレンド通信（マイナビニュース）,https://news.yahoo.co.jp/articles/11f1f2c93388b552e46a4ffb815d15c635b05bd1,https://newsatcl-pctr.c.yimg.jp/t/amd-img/20240520-00000013-mynavin-000-1-view.jpg?exp=10800,2024-05-20T12:11:20+09:00,2024-05-20T12:11:20+09:00,マイナビニュース,mynavin,マイナビニュース,2269,"\nビックカメラ赤坂見附駅店の理美容品売り場。家電コーナー担当の森本優衣氏にナビゲートしてもらった\n今回はビックカメラ赤坂見附駅店にて、理美容品の売れ筋を取材しました。通年で売れるジャンルながら、肌の露出が増える夏にかけてはとりわけ売り場が盛り上がる時期となります。\n【写真】一番人気に挙げられたヤーマンの光美容器「レイボーテ クールプロ」。刺激を抑えて高速処理できる光美容器だ\n購入層について、同店でコーナーを担当する森本優衣氏は「製品によってさまざまです。たとえば、家庭用の脱毛器などは40代くらいの女性が多く、通年使える美容器は若い女性がボリュームゾーンになっていますね。男性向けのものは、20～30代の方が中心になっている印象です」といいます。\n幅広い製品が集まるジャンルなので、購入のポイントをまとめることは難しいのですが、ケアしたい部位のことを考えるとおのずと見えてくる要点があるそうです。「理美容品選び3つのポイント」を踏まえ、直近の売れ筋商品を見ていきましょう。\n\n■＜理美容品選び3つのポイント＞\n\n\n夏は肌が荒れやすい時期でもあるので、脱毛＋保湿のように複合的に機能を比較したい。\n夏に向けて備える狙いなら、逆算して2～3カ月前となる5月ごろから動き出すのがベター。\n自分用に美顔器を購入する男性も珍しくない。男女の垣根の前に、第一優先はケアしたい内容。\n\n\n※本文と写真で掲載している価格は、2024年4月15日14:30時点のもの。日々変動しているので、参考程度に見てください。\n\n■第1位：刺激を抑えて高速処理できる光美容器「レイボーテ クールプロ」\n\n一番人気に挙げられたのは、ヤーマンの光美容器「レイボーテ クールプロ」でした。取材時の価格は121,000円。サファイアガラスによる冷却システムにより、肌を冷やして刺激を抑えながら高出力な照射でムダ毛ケアができます。\n\n「腕や足などの大きな部位でもコロコロと動かして、素早く照射できるのが魅力ですね。出力は5段階で調整できるので、デリケートな部分は出力を抑えて、広い部分はサクサク進められます」\n\n購入層の中心は40代女性ながら、「娘さんやパートナーの男性など、家族みんなで使うという方も多い印象です」とのことです。\n■第2位：引き締めとケアを同時にこなせる美顔器「イオンブースト マルチEX」\n\n続く2位は、パナソニックの美顔器「イオンブースト マルチEX」でした。取材時の価格は59,400円。肌の奥にある角層まで美容成分を届ける「パワーブーストテクノロジー」と「デュアルダイナミックEMS」を採用しているのが特徴です。\n\n「肌に潤いを与える効果と表情筋の引き締め効果がこれ1本でできるということで、肌のくすみやしわが気になるという方によく売れています。また、これからの季節は紫外線を浴びたあとのケアにお求めになる方も増えそうですね」\n■第3位：全身のムダ毛をトリミングできる「ボディ＆フェイスグルーマーPRO X XT 5300」\n\n3位には、男性用グルーミングツールがランクインしました。ブラウンの「ボディ＆フェイスグルーマーPRO X XT 5300」で、取材時の価格は13,070円になります。顔から脇、腕、VIOゾーン、脚など、全身のムダ毛が処理できるトリマーです。\n\n「すね毛などを全部ではなく、ちょっと残して整えたいという方、特に20～30代の男性によく売れています。小型で持ちやすいうえ、刃が肌に当たらない作りなので、よく剃れるのにやさしいと評判です」\n■第4位：髪を超音波でトリートントする「シャインプロ」\n\n4位には、ヤーマンのヘアトリートメント「シャインプロ」です。取材時の価格は27,500円。一般的なヘアアイロンに近い形状ながら、超音波と温熱によって髪をトリートメントすることに主眼を置いているのが特徴です。\n\n「美容院で施してもらえるようなトリートメントが自宅でできるということで、髪の長い女性によく売れています。パサつきを抑えて、ツヤのある髪に仕上げてくれます。夏になると、プールや海水浴のあとに髪がパサついたり、純粋に紫外線が多くなって髪がダメージを受けやすくなったりしますから、これからの季節にさらに注目を集めそうです」\n■第5位：エイジングケアで人気の「EMS HEAD SPA PRO」\n\n5位は、マイトレックスのヘッドスパ「EMS HEAD SPA PRO」です。EMS刺激と物理マッサージを併用して、頭皮ケアやフェイスケア、ボディケアまでこなせる仕様となります。取材時の価格は14,850円でした。\n\n「お顔全体を引き上げてくれて、お肌も活性化してくれます。少しシワやたるみが気になる方、エイジングケアをしたいと考えている方によく売れています」\n■はみ出し情報・・・素早く乾かせられるドライヤー「KINUJO KH202」も人気上昇中\n\nトップ5以外の注目株として挙げられたのは、KINUJOのヘアドライヤー「KINUJO KH202」です。DCモーターによる2.2立方メートル/分の風量で効率的に髪が乾かせるのが特徴です、取材時の価格は24,890円でした。\n\n「コンパクトで素早く乾かせるうえ温度の調整もできるので、夏場の暑い時期でもなるべく汗をかかずに乾かせられます。指名買いする人が増えていますね」\n古田雄介",['https://newsatcl-pctr.c.yimg.jp/t/amd-img/20240520-00000013-mynavin-000-1-view.jpg?pri=l&w=640&h=426&exp=10800'],"['https://news.yahoo.co.jp/articles/11f1f2c93388b552e46a4ffb815d15c635b05bd1/images/000', 'https://news.mynavi.jp/photo/article/20240518-2947650/images/002.jpg']"
JO1木全翔也、“応援”がモチベーションに　夢を追う姿に「すごく共感した」『トラペジウム』（マイナビニュース）,https://news.yahoo.co.jp/articles/aa6aab6c94d67798caa1510a819425a466ad6516,https://newsatcl-pctr.c.yimg.jp/t/amd-img/20240520-00000016-mynavin-000-1-view.jpg?exp=10800,2024-05-20T17:00:25+09:00,2024-05-20T17:00:25+09:00,マイナビニュース,mynavin,マイナビニュース,3672,\n木全翔也 撮影:友野雄\n乃木坂46一期生の高山一実が、自身の経験などをもとに、アイドルを目指す高校生の姿を描いた小説『トラペジウム』がアニメ映画化され、現在公開されている。同作で、主人公の東ゆうをサポートすることになる、カメラが好きな男子・工藤真司の声優を務めたのが、JO1の木全翔也だ。\n【写真】木全翔也の撮り下ろしカット(全11枚)\nアイドルを目指す少女たちの姿を描いた作品に、共感したという木全。今回のインタビューでは、実際に自身も芸能界で活躍するからこそ感じた真司というキャラクターについてや、作品に深く共感したところ、また自身の夢を追いかけた経験についても話を聞いた。\n■映画『トラペジウム』で男子校生・工藤真司の声優を務めた木全翔也\n\n――今作が初の劇場映画声優挑戦ということで、お話が決まった時はどういうお気持ちでしたか?\n\nお話をいただいてから収録までの期間が短く、すぐに収録に行きました。参加して、自分の人生に近いことが書いてある物語だと思いました。\n\n――演じた真司については、どのような役だと解釈していたんですか?\n\n主人公のゆうをサポートして客観視するポジションなんですけど、それがゆうにとってはありがたくもあり、難しくもあるんじゃないかなと思いました。良き理解者だけど、結局本人ではないから複雑だし、完全に同じものは見れていないキャラクターなんだなという気がしました。だからこそいい部分もあって、ゆうにはない発想もある。夢を目指す本人と、それを見ている友達という熱量の差も感じる役でした。\nただ僕も18歳までは普通の学生だったので、真司の気持ちもわかるんです。今僕は、ゆうが目指していた方の人生を送っているけど、普通に過ごしていたら真司みたいな気持ちになっていると思います。両方経験しているので、どっちもわかる。今回はアイドルが題材ですけど、他の仕事で置き換えることもできるし、夢を追いかけることのリアリティがすごい作品です。\n\n――原作を読んだ時は、特にどこが刺さりましたか?\n\n原作を読んだ時は、ただただ、ゆうに感情移入していました。自分もオーディションを受けて今の仕事をしてるので、そのために努力したことも思い出しました。芸能界に憧れているけど親には言えなかったし、誰かに相談できることでもないし……やっと相談したのが、JO1のオーディションでした。うまくいかないもどかしさにもリアリティがあふれていて、高山さんもそういう経験をされていたからこそ生まれた作品なのかなと思いました。\n――どういう努力、準備をされていたんですか?\n\nダンスや歌も習っていました。先生からも「もっといけるよ」と言っていただけていたけど、なかなか踏み出せなかった。お金もかかるし、たくさん練習して、タイミングを伺ってようやく、という感覚でした。僕が学生時代に出演したKCONのダンスのイベントが終わってしまい、「もう歓声を浴びられないのか」と思った時に、“JO1のオーディションを受けるためのオーディション”があって。軽いノリだったんですけど、101人に選ばれた時に「まさか」と。そこで、やっと親や専門学校にも相談することができました。\n\n■仕事が好きで「仕事自体がリフレッシュになっています」\n\n――作品の中では、登場するキャラクターのモチベーションの違いも出てきたりしています。木全さんはどんなタイプですか?\n\n僕はもう、とにかく仕事したいタイプなんです。学生の時も週6バイトで、日曜日にダンスという感じだったので、働くこと自体が好きです。働くと経験値も稼げるし、今まで知らなかったことを知ることができる。今の仕事でも、たとえば演技だったら自分じゃない人生を演じて新たな考え方を知ることができるし、地方ロケなら初めて行く場所にも行ける。歴史のあるものを見て「自分の悩みなんてちっぽけだな」と気づくこともありますし、仕事の現場にインプットできるものがたくさんあるから、仕事自体がリフレッシュになっています。\n\n――うちもマイナビという会社なので「仕事が楽しい」というのはすごく素敵だなと思います。\n\n仕事、めっちゃ好きです!(笑) バイトも大好きです。今でもちょっとやりたいくらいです。\n――ちなみに、どんなアルバイトをされてきたんですか?\n\n僕は、バイトデビューがたこ焼き屋さんでした。そこからホテルでバイトするようになったんですが、客室担当というよりも、ブライダルパーティーでディナーの配膳をしたり、ドアを開けたり、クロークを担当したりと、けっこうなんでもやっていました。ヘルプでカフェに行くこともありましたし、いろんなことをやっています。\n\n――その時に配膳されていたお客さんは、木全さんがJO1になっていると知ったら驚きそうですね。\n\nそうかもしれないです(笑)\n\n■「何回もやって、何回でも諦めない人がきっと成功する」\n\n――先ほどもゆうに共感されたとおっしゃってましたが、特に共感したところはありましたか?\n\nゆうの進む道って、スムーズではないじゃないですか。そこにすごく共感しました。自分もスムーズではなかったですし、それこそオーディション中にもいろんなチームを組んだので、チーム内で賛成意見もあれば反対意見も出るような状況が、リアルにわかります。ケンカや、メンバーの熱量が違うこともやっぱりありましたし、高山さんご自身が経験されてきたんだろうなと。お互いを理解して頑張って成功して、「やった、よし!」みたいな感じではないところが、すごくリアルだなと思いました。\n\n――昔は「親が勝手に応募して…」という話もよくありましたが、今はみなさん自分で夢を追っていますよね。\n\nそれ、本当なんですか!?「絶対嘘だよ」「『自分で送った』って言いたくないからだよ」と言っている人もいて。僕は全然自分で応募したんですけど、その手を使えばよかったかも(笑)\n――ステージに立つことについての憧れを、当たり前に言える時代になっているのかもしれないです。\n\nたしかに、憧れていることを恥ずかしがって言わない、といったことはないかもしれません。でも、やっぱり冷やかされることはあります。夢が大きければ大きいほど、「何言ってるんだよ」「冗談かよ」という反応はあって、それが「サッカー選手になりたい」でも「社長になりたい」でも、あると思います。ただ、「こうなりたい」と言ってみたら、意外と協力してくれる人もいたりする。全員が全員バカにする人じゃないし、親身になって聞いて導いてくれる人、応援してくれる人も出てきたりするので、今回はアイドルが題材ですが、そうではない夢の人も、行動してみるのがいいと思います。\n\nもし冷やかされたりしても、やっぱり気にしちゃダメだなって。ゆうも、気にせずに夢に向かって進んでいくところがいいですよね。僕もJO1のオーディションに出るために専門学校を休学すると周囲に話したら、「やめときなよ」と言われることがありました。でも、本当に頑張ったら努力も実る。もちろんうまくいかないこともあると思うんですけど、何回もやって、何回でも諦めない人がきっと成功するんじゃないかなと。その分、失敗の数も多いと思うけど、とにかく行動してみた方がいいと思います。\n――木全さんは「やめときなよ」と言われると燃える方ですか?\n\n余計に「いったろう!」と思います(笑)。無理かもと思ってもやってみるし、やるからには絶対に手を抜かない、という気持ちで行動していたら、運良く選んでもらえました。\n\n――ゆうは「アイドルから元気をもらって、自分もそういう存在になりたい」という点がモチベーションでしたが、木全さんはどうしてそこまで頑張れるんでしょうか?\n\n僕自身が、幸せになりたいからです。応援していただけるのは、嬉しいじゃないですか。だから、僕が楽しくてファンの方も楽しいという状態はwin-winで、それがいいんです。もちろん僕からも感謝の気持ちを届けながら、皆さんに応援してもらえること、歓声を巻き起こせることが嬉しいです。\n\n\n■木全翔也\n\n2000年4月5日生まれ、愛知県出身。サバイバルオーディション番組『PRODUCE 101 JAPAN』に参加、グローバルボーイズグループ「JO1」としてデビュー。声優、俳優としても活躍しTVアニメ『群青のファンファーレ』(22年)で声優デビュー。ドラマ『しょうもない僕らの恋愛論』(23年)で地上波ドラマに初出演した。3月全国劇場公開の映画 「映画しまじろう『ミラクルじまの なないろカーネーション』」にも声優として出演中。公開待機作に映画『逃走中 THE MOVIE』(7月19公開)。\n\nヘアメイク:西尾さゆり、スタイリスト:ホカリキュウ\n佐々木なつみ,['https://newsatcl-pctr.c.yimg.jp/t/amd-img/20240520-00000016-mynavin-000-1-view.jpg?pri=l&w=480&h=640&exp=10800'],"['https://news.yahoo.co.jp/articles/aa6aab6c94d67798caa1510a819425a466ad6516/images/000', 'https://news.mynavi.jp/photo/article/20240520-2949139/images/002.jpg']"
