headline,mainEntityOfPage,image,datePublished,dateModified,author,media_en,media_jp,str_count,body,images,external_links
交際相手の女性の背中を包丁で刺す　介護士の男を殺人未遂容疑で逮捕【岡山・津山市】（OHK岡山放送）,https://news.yahoo.co.jp/articles/6d34ef58b75b7541092f340166bc48af730f5292,https://newsatcl-pctr.c.yimg.jp/t/amd-img/20240420-90021196-ohk-000-1-thumb.jpg?exp=10800,2024-04-20T18:13:01+09:00,2024-04-20T18:13:01+09:00,OHK岡山放送,ohk,OHK岡山放送,321,\n岡山放送\n４月２０日朝、津山市の住宅で交際相手の女性の背中を刺して殺害しようとしたとして、市内の介護士の男が殺人未遂の疑いで警察に逮捕されました。\n\n逮捕されたのは、津山市山方の介護士 後藤靖之容疑者です。\n警察の調べによりますと、後藤容疑者は、２０日午前６時頃、同居する２２歳の交際相手の背中を包丁で刺し殺害しようとした疑いが持たれています。\n女性は命に別条はないということです。\n\n関係者によりますと、後藤容疑者は事件直前に被害者と口論になり、事件後被害者が１１９番通報したということです。\n\n調べに対し後藤容疑者は、「包丁で刺したことに間違いないが、殺意はなかった」と容疑を否認しているということです。\n岡山放送,[],[]
国産ジーンズの歴史を学びながら楽しめる　「ジーンズミュージアム」がリニューアル【岡山・倉敷市】（OHK岡山放送）,https://news.yahoo.co.jp/articles/7dfc229b90b01e3bee09a94f568aa69c8ecc91dd,https://newsatcl-pctr.c.yimg.jp/t/amd-img/20240420-90021180-ohk-000-1-thumb.jpg?exp=10800,2024-04-20T18:07:01+09:00,2024-04-20T18:07:01+09:00,OHK岡山放送,ohk,OHK岡山放送,440,\n岡山放送\n倉敷の特産品ジーンズの歴史などを紹介するジーンズミュージアムがリニューアルし、４月１９日オープンしました。\n\nジーンズミュージアムは、倉敷市のジーンズメーカーベティスミスが運営しているもので、開館から２０年を迎えたのを契機に１年以上かけて改装されました。\n\n「ぜんぶまるごとジーンズの博物館」をテーマに改装された施設は、イベントなどが開催できるアーケードの広場が完成、商品を販売するストアも移転し、ショッピングだけでなくジーンズの製作工程の体験もできます。\nまた国産ジーンズの歴史を学べる展示も充実させ、体験しながら楽しめる施設となっています。\n\n（ベティスミス 大島康弘社長）\n「いろんな形で小物になってみたり体験をするアイテムになってみたり、ジーンズはもっと身近に感じられるものだったんだなということをここに来て楽しんでもらいたい」\n\nミュージアムでは、今後もジーンズに親しんでもらえるよう施設を充実させていきたいとしています。\n岡山放送,[],[]
１２年前の県立高校生徒自殺を受け　県教委が再発防止策を有識者に説明【岡山】（OHK岡山放送）,https://news.yahoo.co.jp/articles/8fc3e86fc68a1268a242dbb7c6482e5fa379841a,https://newsatcl-pctr.c.yimg.jp/t/amd-img/20240420-90021195-ohk-000-1-thumb.jpg?exp=10800,2024-04-20T18:09:01+09:00,2024-04-20T18:09:01+09:00,OHK岡山放送,ohk,OHK岡山放送,445,\n岡山放送\n１２年前、岡山市の県立高校で野球部の生徒が監督の叱責を受け自殺した問題で、岡山県教委は、４月２０日再発防止策の実施に向け検証を行う有識者にこれまで取りまとめた案を説明しました。\n\n県教委は、２０１２年７月、岡山操山高校で野球部のマネージャーをしていた当時２年の男子生徒が監督からの激しい叱責を受け自殺した問題を受け、去年再発防止策の方向性を公表し具体策を検討していました。\n\n２０日は実施に向けて外部有識者から意見を聞く会合が開かれ、医師や弁護士など４人に具体策が説明されました。\nそして再発防止のための基本方針を新たに作成し生徒のＳＯＳに気づく校内体制や自殺が発生した場合の初期対応の流れを明記したことなどの説明がありました。\n\n（ひょうごこころの医療センター 田中究院長）\n「生徒の自殺から１０年以上と時間が経ちすぎてる。起きる前に何ができるかを定着できるようなものにしたい」\n\n県教委は、今年６月には再発防止策を実施したいとしています。\n岡山放送,[],[]
東かがわ市で住宅全焼　焼け跡から性別不明の1人の遺体【香川・東かがわ市】（OHK岡山放送）,https://news.yahoo.co.jp/articles/c5da84c651980a86c758b2486e657d7f14e2dd85,https://newsatcl-pctr.c.yimg.jp/t/amd-img/20240420-90021194-ohk-000-1-thumb.jpg?exp=10800,2024-04-20T12:27:01+09:00,2024-04-20T12:27:01+09:00,OHK岡山放送,ohk,OHK岡山放送,295,\n岡山放送\n４月１９日夜、東かがわ市で住宅を全焼する火事があり、１人が死亡しました。\n\n１９日午後８時４０分、東かがわ市松原の橋本悦子さんの住宅が燃えているのを近所の人が見つけ１１０番通報しました。\n\n火は、約２時間５分後に消し止められましたが、木造瓦ぶき２階建ての住宅 約１６７平方メートルを全焼し、焼け跡から性別不明の１人の遺体が見つかりました。\n\n橋本さんは、５０歳の息子と２人暮らしで、出火当時、息子は外出中で無事でした。\n警察では、遺体は、火事のあと連絡がとれない橋本さんの可能性があるとみて身元の確認を進めるとともに詳しい火事の原因を調べています。\n岡山放送,[],[]
産学官が連携し健康的な食生活を提案　商業施設で健康増進イベント【岡山・倉敷市】（OHK岡山放送）,https://news.yahoo.co.jp/articles/b7263a77f3bfa35af8976ca7b58b6d07da56e02d,https://newsatcl-pctr.c.yimg.jp/t/amd-img/20240420-90021193-ohk-000-1-thumb.jpg?exp=10800,2024-04-20T18:09:01+09:00,2024-04-20T18:09:01+09:00,OHK岡山放送,ohk,OHK岡山放送,463,\n岡山放送\n自身の健康について市民に関心を持ってもらおうと産学官が連携したイベントが倉敷市で行われました。\n\nイベントは、倉敷市と川崎医療福祉大学、そしてイオン倉敷店が連携して開催されました。会場には日ごろ摂取できている野菜の量を調べる装置が設置されていて、訪れた買い物客は食生活の状況を確認していました。\n\n（訪れた人は）\n（Ｑ．どうでした？）「思ったより低く、ちょっとショック」\n「たまたま通ったが、ついでにこうしたチェックができるのは良いと思う」\n\n学生たちは訪れた市民に短時間で栄養価の高い朝食の作り方を説明し、健康的な食生活を提案していました。\n\n（川崎医療福祉大学臨床栄養学科 川邉聡子講師）\n「きょうは食事面でかかわっているが、健康な時から（食生活に）興味を持ってもらい気を付けるのが良いと思う」\n\n（倉敷市保健所 家守己恵子主幹）\n「倉敷市ではイオンなどと連携してこういう環境下で健康づくりを進めたい」\n\nイベントは今後、２カ月に１度毎回違うテーマで行われます。\n岡山放送,[],[]
