headline,mainEntityOfPage,image,datePublished,dateModified,author,media_en,media_jp,str_count,body,images,external_links
「ただ、一つだけ残念なのは…」　長生きした90歳の女性が願ったこと　マンガ夜廻り猫（withnews）,https://news.yahoo.co.jp/articles/aa335ad6b66c5bd793ab91c2b1d1cd44ac8e7ae2,https://newsatcl-pctr.c.yimg.jp/t/amd-img/20250826-00000001-withnews-000-1-view.jpg?exp=10800,2025-08-27T07:02:00+09:00,2025-08-27T07:02:00+09:00,withnews,withnews,withnews,1349,"90歳の女性が、「一つだけ残念なのが」と人生を振り返るのは…＝夜廻り猫
夫を見送り、90歳まで長生きできたと振り返る女性。でも、「一つだけ残念なこと」があるとしたら――。「ハガネの女」「カンナさーん！」などで知られる漫画家の深谷かほるさんが、SNSで発表してきた「夜廻り猫」。今回は、ある夢を見る女性のエピソードです。
【マンガ本編】「一度でいいから恋してみたい」夢見る相手は
「一度でいいから恋してみたい」
夜の街を回っていた猫の遠藤平蔵。涙の匂いに気づき、「心で泣いておられるな？」と女性に声をかけました。

90歳の女性は「泣くようなことはないよ　長生きできて、わがままな夫を見送って今は気楽」といいます。

それでも、「一つだけ残念なのが　恋をしたことがない」ということ。

「一度でいいから恋してみたい　メガネをかけた横浜流星と」とほほを赤らめます。

「寿命があと1日なら一緒にお祭りにいきたい　1週間なら海外旅行」と夢を膨らませます。

女性が「あと1年なら――」と考えたところで、遠藤が「メガネをかけた横浜流星と結婚！？」とかぶせると、女性からは「そうじゃないよ、分かってないねぇ」と言われてしまうのでした。
「結婚しておくべき」圧力も強かった
作者の深谷かほるさんは、今回のマンガを描きながら、自分の経験を思い返していたそうです。

「20歳のころ、たまたま年齢を聞かれて『はたちです』と答えたら、年上の方達がそろって笑って『今が一番良い時ね』『一番幸せだね』と言ったことがあったんです」

けれど40年後のいま、「私自身は『20歳の頃が一番いい』ということもないです。60過ぎても楽しいです」と笑います。

ただ、上の世代の人たちにとっては、「大人は大人らしく」「何歳ならこのくらい成熟しているべき」「結婚しておくべき」といった世の中の圧力が強かったのでは――とも感じるそうです。

「あの時の昭和の大人たちに、『これからは何が大変ですか？』『大人は楽しくないですか？』と聞いておいたら、いろいろ勉強になったんじゃないかな……と、たまに思い出します」
マンガ「夜廻り猫」
猫の遠藤平蔵が、心で泣いている人や動物たちの匂いをキャッチし、話を聞くマンガ「夜廻（まわ）り猫」。

泣いているひとたちは、病気を抱えていたり、離婚したばかりだったり、新しい家族にどう溶け込んでいいか分からなかったり、幸せを分けてあげられないと悩んでいたり…。

そんな悩みに、遠藤たちはそっと寄り添います。遠藤とともに夜廻りするのは、片目の子猫「重郎」。ツイッター上では、「遠藤、自分のところにも来てほしい」といった声が寄せられ、人気が広がっています。

　　　　　◇

深谷かほる（ふかや・かおる）　漫画家。1962年、福島生まれ。代表作に「ハガネの女」「エデンの東北」など。2015年10月から、ツイッター（@fukaya91）で漫画「夜廻り猫」を発表し始めた。第21回手塚治虫文化賞・短編賞を受賞、単行本11巻（講談社）が2024年12月23日に発売。講談社「コミックDAYS 編集部ブログ」で月・金曜夜に連載中。スピンオフ「居酒屋ワカル」は講談社「コクリコ」で連載した単行本が11月22日に発売。",[],[]
ラーメン週3回以上で「死亡リスク上昇」科学的に調査　それでも食べたいなら…研究グループの提案（withnews）,https://news.yahoo.co.jp/articles/d318993bbc890a0b8051e4fe6b65e430a9101ca4,https://newsatcl-pctr.c.yimg.jp/t/amd-img/20250825-00000003-withnews-000-1-view.jpg?exp=10800,2025-08-27T07:00:00+09:00,2025-08-27T07:00:00+09:00,withnews,withnews,withnews,1829,"国民食であるラーメン。もやしやキャベツなどの野菜もたっぷりだが油もたっぷり含まれています
ラーメンを食べ過ぎると健康によくない……。なんとなくそんなイメージがありますが、その関係を科学的に調査した研究グループがあります。週3回以上ラーメンを食べると、死亡リスクが上昇する傾向がみられましたが、研究グループは「ラーメン好きでも健康でいられる工夫」も提案しています。
【画像】「ラーメン好きでも健康でいられる」研究グループの提案
ラーメンと健康の影響、6725人を追跡調査
山形大学と山形県立米沢栄養大学の共同研究チームが、ラーメンの摂取頻度と死亡リスクの関連について疫学研究を行いました。

塩分多めのラーメンを食べ過ぎると健康によくないだろう……というのは、なんとなくは分かるものの、疫学調査での科学的な研究は、「我々が調べた限り世界初」（研究グループ）といいます。

研究では、山形県内に住む46歳～74歳の男女6725人を対象に、2017年～2023年にかけて「食品摂取質問票」を送って回答してもらい、情報を収集して分析しました。健康診断のデータも集めました。

質問票では、食べた麺類を「ラーメン」「そば」「うどん」「そうめん・ひやむぎ」「沖縄そば」「パスタ」の中から選んでもらいました。このうち、「ラーメン」の摂取頻度を「月1回未満」から「週3回以上」まで4段階に分類し、死亡率との関係を追跡調査しました。
高血圧、糖尿病とも関連
山形大学医学部の今田恒夫教授（公衆衛生学）によると、週3回以上ラーメンを食べると、死亡リスクが上昇する傾向がみられたそうです。

サンプル数が少ないため統計学的には差があるとはいえないそうですが、単純に数字を比較すると、週3回ラーメンを食べるグループは、最も死亡リスクの低い週1～2回のグループと比較すると死亡リスクが1.52倍高かった、といいます。

特に、70歳未満の人たち、アルコールを飲む人たち、麺のスープを半分以上飲む人たちでは、死亡リスクの上昇がみられました。

また、週3回以上のラーメン摂取は、高BMI（体格指数）、喫煙、飲酒、糖尿病、高血圧との関連が認められました。

ラーメンを食べるのは危険なのでしょうか。

研究グループは、「すぐに危険とは言えません」としています。

なぜなら、ラーメン自体だけでなく、ラーメンをよく食べる人に多い生活習慣（塩分のとりすぎ、飲酒、喫煙など）が影響している可能性があるためです。

今回の調査では、しょうゆ、みそ、しお、とんこつなど、ラーメンの味による違いは調べていません。

また、ラーメン、つけめん、油そば、混ぜそばについて区別して聞いていないとのことでした。
健康にラーメンを食べる工夫は？
ラーメンは国民的な人気料理の一つです。山形市は1世帯当たりのラーメンの外食費が3年連続日本一で、「ラーメンの聖地」を宣言しています。

健康リスクが高いラーメンとの向き合い方を尋ねると、今田教授は「完全にラーメン断ちをする必要はありません。楽しみとして食べるのは問題ありません。大切なのは『食べ方』と『頻度』です」とのことです。

では、ラーメン好きでも健康でいられるよう工夫する術は？研究グループは、いくつかのポイントを提案しています。

 ・ラーメンのスープは飲まない
・塩分を減らしたラーメンを選ぶ
 ・野菜やトッピングで栄養バランスをとる
 ・食べる頻度を控えめにする

研究グループが特に強調するのが、「スープを飲まないこと」の大切さです。

人気のラーメン店がこぞって心血を注ぐスープ。マニアのなかには「飲み干すことが流儀」と考える人さえいますが、健康のことを考えれば、断腸の思いでスープを残すことが必要だと指摘します。

「研究でもスープを半分以上飲む人でリスクが高くなる傾向が示されました。スープを控えるだけで塩分摂取量を大きく減らせます」

研究グループは、今回の調査の結果、ラーメンとの健康的な付き合い方について、次のような結論を得たといいます。

「『ラーメンを食べると必ず危険』ということではありません。ただし、塩分が多い食べ物なので、食べすぎない・スープを控える・バランスの良い食事を心がけることが、健康のために大切です」

論文は「The Journal of Nutrition, Health and Aging」に掲載されました。",[],[]
