headline,mainEntityOfPage,image,datePublished,dateModified,author,media_en,media_jp,str_count,body,images,external_links
罪人を可愛い犬に“教育”してあげるノベルゲーム『就労！！わんわんヒューマン』のSteamストアページが公開。開発者のBoothにて約10分で終わる体験版も公開中（電ファミニコゲーマー）,https://news.yahoo.co.jp/articles/4fc4f523aa838a3412f29bda72129585e7c6db72,https://newsatcl-pctr.c.yimg.jp/t/amd-img/20240508-01078849-denfami-000-6-view.jpg?exp=10800,2024-05-08T23:58:45+09:00,2024-05-08T23:58:53+09:00,電ファミニコゲーマー,denfami,電ファミニコゲーマー,835,\n名前や職業、過去のことを聞いたりして情報を集め、嘘を見抜く力と推理で罪人を教育するか判断しよう。開発者のBoothにて約10分で終わる体験版も公開中\nゲームクリエイターの鮫崎氏は5月8日、罪人を教育して可愛いらしい犬に変える人間ガチ犬化ノベルゲーム『就労！！わんわんヒューマン』のSteamストアページを公開した。\n\n配信日は2024年内で、価格は不明。鮫崎氏のBoothにて体験版も公開されている。\n\n本作ではプレイヤーは人間、悪魔、天使が混在する混沌の街を舞台に、天使が集う組織「エンジェル・エンタープライズ」に存在する「わんわんヒューマン部門」の矯正官となり、仕事をしていくことになる。\n\n仕事内容は簡単で、悪魔に魅入られたものや悪魔的思想を持つ罪人たちを“教育”してあげることだ。しかし、罪人の中には教育する必要がない人もいるため、4ターンの間に名前や職業、過去のことを聞いたりして情報を集め、主人公が持つ嘘を見抜く力とプレイヤーの推理力で教育を行うか判断する必要がある。\n\n教育しない場合はそのまま終了。教育を施す場合は罪人を可愛いらしい犬に教育してあげて業務は完了だ。\n\nなお、通常の業務以外にもほかの同僚を助けるため、売店のレジを担当したり、レビュアーのアルバイトをしたりする必要もある。\n\n作中では仕事中に話しかけてくるラブリーな同僚「ベルシー」をはじめ、個性的なキャラクターが多数登場するようだ。\n\nYouTubeで公開されているPVとSteamストアページだけでも10人以上のキャラクターが登場することが判明している。\n\n製品版のプラットフォームはPC（Steam）で、配信日は2024年内、価格は不明となっている。鮫崎氏のBoothにて約10分で終わる体験版も公開されているので、興味が湧いたら一度プレイしてみて気に入ったらウィッシュリストに登録してみてはいかがだろうか。\n電ファミニコゲーマー：はくまいさん,['https://newsatcl-pctr.c.yimg.jp/t/amd-img/20240508-01078849-denfami-000-6-view.jpg?exp=10800'],['https://news.yahoo.co.jp/articles/4fc4f523aa838a3412f29bda72129585e7c6db72/images/000']
ちいかわ・ハチワレ・うさぎが大きくプリントされたかわいいTシャツが5月11日からアベイルオンラインストアで再販決定。日常使いしやすいアイテムがお手ごろ価格でいろいろ登場（電ファミニコゲーマー）,https://news.yahoo.co.jp/articles/e04a10aa228643a3c97d301f5b3f79c908bb4310,https://newsatcl-pctr.c.yimg.jp/t/amd-img/20240508-01078819-denfami-000-4-view.jpg?exp=10800,2024-05-08T22:30:55+09:00,2024-05-08T22:31:13+09:00,電ファミニコゲーマー,denfami,電ファミニコゲーマー,791,\nTシャツ、パーカ、ロングパンツをはじめ、トートバッグや収納ボックスなど日常で使いやすそうなアイテムがお手ごろ価格でいろいろ登場\nアベイルは『ちいかわ』のアパレルグッズの一部について、5月11日（土）から19日（日）にかけてアベイルオンラインストアで受注再販売を行うと発表した。\n\n今回の再販売のラインナップで目を引くのは「ちいかわ」や「ハチワレ」、「うさぎ」が大きくプリントされた、インパクトあるデザインのTシャツ（1980円：税込）。そのほかにもTシャツ、パーカ、ロングパンツといった日常的に使えそうなアイテムが、いずれも2000円台に収まる程度の手を伸ばしやすい価格で販売される形だ。\n\nまた半袖のルームウェアやステテコ、ショートパンツといったこれからの季節にちょうど良さそうなアイテムも登場。くわえてトートバッグ、ケース付きのエコバッグ、収納ボックスなど、何かと活躍の機会が多いグッズも用意されている。\n\n『ちいかわ』はイラストレーター・ナガノ氏によるX（旧Twitter）上で連載されているマンガを原作とするコンテンツ。もともと2020年に連載がはじまり、“小さくてかわいい”キャラクターたちが人気を集めると同時に、時おり現れるシビアな雰囲気のギャップもたびたび話題を呼んできた。\n\n2022年にはテレビアニメ版が放送を開始し、2024年現在もフジテレビ系列の「めざましテレビ」内にて毎週火・金曜日に放送中。引き続き広く人気を集めているコンテンツで、今回の再販売の告知にも多くの喜びの声が集まっている模様だ。\n\nアベイルオンラインストアにおける『ちいかわ』一部アイテムの受注再販売期間は、5月11日（土）の13時から19日（日）の23時を予定している。『ちいかわ』好きの方はこの再販売の機会を逃さず手に入れておこう。\n電ファミニコゲーマー：久田晴,['https://newsatcl-pctr.c.yimg.jp/t/amd-img/20240508-01078819-denfami-000-4-view.jpg?exp=10800'],['https://news.yahoo.co.jp/articles/e04a10aa228643a3c97d301f5b3f79c908bb4310/images/000']
任天堂、決算説明会にて「Nintendo Switchの後継機種」に関して多数の質問に回答。ニンテンドーアカウントは後継機種でも活用へ。一昨年のような半導体部品などの供給不足の影響は、現時点で起きてないことから「後継機種」では想定しない認識を示す（電ファミニコゲーマー）,https://news.yahoo.co.jp/articles/6bd915cc619774b7aa9e265c280b599a168790ee,https://newsatcl-pctr.c.yimg.jp/t/amd-img/20240508-01078765-denfami-000-7-view.jpg?exp=10800,2024-05-08T21:38:17+09:00,2024-05-08T21:43:49+09:00,電ファミニコゲーマー,denfami,電ファミニコゲーマー,1708,\n任天堂、決算説明会で「Nintendo Switchの後継機種」に関して株主からの多数の質問に回答。ニンテンドーアカウントは継続\n任天堂は、「2024年3月期 決算説明会（オンライン）質疑応答」（要旨）を掲載した。\n\n「Nintendo Switchの後継機種」に関する質問が株主から多く寄せられており、そのなかで「Nintendo Switchの後継機種」という表現に関することや、ニンテンドーアカウントに関する質問の回答をしている。\n\n今回の「2024年3月期 決算説明会（オンライン）質疑応答」は5月7日に開催され、同日5月7日に任天堂の代表取締役社長である古川俊太郎氏より明言された、「Nintendo Switchの後継機種に関するアナウンスを今期中に行う」に関連する質問が多く寄せられている。\n\nまず「後継機種の準備には年単位で時間が必要なため、ソフトウェアの開発リソースについても、さまざまな面で考慮が必要になっている」とし、さらに「2024年3月期 決算説明資料」で出された、通期のハードウェアの予想販売数量「1350万台」に関して「当期の予想販売数量には、Nintendo Switchの後継機種は含めていません」と明言している。\n\nさらに「後継機種の発表や関連する今後の情報発信が、Nintendo Switch の販売にまったく影響しないとは考えていませんが、当期も新規需要と複数台需要をバランスよく維持し、販売台数を最大化させたい」とした。一方で「ハードウェアの予想販売数量は前期と同様に、期初の段階としては少し背伸びした数字を設定しているため、直近の販売状況から見ると決して達成が容易な数字ではないと認識しています」としている。\n\nNintendo Switchに関して、「当期は Nintendo Switch の後継機種の準備が本格化する年になり、Nintendo Switchの勢いの維持と後継機種の準備を両立させることが何よりも大切だと考えています」として、Nintendo Switchの人気の維持を続けるとしている。\n\nまた後継機種に関する投資に関しては、「通常のビジネス活動の一環で実施してきた投資」として、手元資金の活用が中心となっているわけではないとした。\n\nまた一昨年の半導体部品の供給不足と後継機種と関連して、「半導体部品等の供給が後継機種の発売に際して大きな問題になることは想定していません」として、半導体部品などの供給不足などの影響は、現時点では半導体部品の供給不足が起きていないことから 後継機種では受けないという認識を示した。\n\nさらに後継機種とニンテンドーアカウントに関連して、「ニンテンドーアカウントはハードウェアの世代を超えて長期的にお客様との関係性を維持するためにNintendo Switch発売前から準備してきたものですので、後継機種でも活用していきます」として、ニンテンドーアカウントが後継機種でも使えることを明言している。\n\nこのほかパッケージソフトに関して、「単純にデジタル売上高の比率を高めるのではなく、パッケージソフト販売を含めたゲームソフト販売の最大化を目指していくことを基本方針としており、今後もその方針に変わりはありません」としており、「今後さらにデジタルコンテンツの利便性が高まっていけば、Nintendo Switch と同様に、後継機種においてもデジタルの商品を選択されるお客様が増えていくのではないかと現時点では考えています」として従来どおり、パッケージソフトとデジタルコンテンツの両方ともこれまで通り、推進するようだ。\n\nまた「Nintendo Switchの後継機種」という表現の意図そのものも聞かれる質問もあり、「「Nintendo Switch の後継機種」という表現を用いることが最適だと判断し、このような表現にしました」としている。\n\nさらなる詳細は「2024年3月期 決算説明会（オンライン）質疑応答」を参考にしてみてほしい。\n電ファミニコゲーマー：福山幸司,['https://newsatcl-pctr.c.yimg.jp/t/amd-img/20240508-01078765-denfami-000-7-view.jpg?exp=10800'],['https://news.yahoo.co.jp/articles/6bd915cc619774b7aa9e265c280b599a168790ee/images/000']
「ファミコン世界大会」に誰でも気軽に挑戦できるソフト『Nintendo World Championships ファミコン世界大会』発表、7月18日に発売決定。『マリオ』『ゼルダ』『カービィ』など13タイトルから一部を切り出した150以上の競技に挑戦するゲーム（電ファミニコゲーマー）,https://news.yahoo.co.jp/articles/e95b9dc82d77ff29ce8d12782dfa12bdd5dd969f,https://newsatcl-pctr.c.yimg.jp/t/amd-img/20240508-01078843-denfami-000-6-view.jpg?exp=10800,2024-05-08T23:41:05+09:00,2024-05-08T23:52:58+09:00,電ファミニコゲーマー,denfami,電ファミニコゲーマー,1382,\nファミコン大会に挑戦できる『Nintendo World Championships ファミコン世界大会』発表、7月18日発売へ\n任天堂は、ゲームソフト『Nintendo World Championships ファミコン世界大会』を発表し、7月18日（木）に発売すると発表した。\n『Nintendo World Championships ファミコン世界大会』画像・動画ギャラリー\n対象プラットフォームはNintendo Switch。価格はパッケージ版が税込3828円、ダウンロード版が3800円。またさまざまな特典が付属した特別セット『Nintendo World Championships ファミコン世界大会 Special Edition』を同日に発売する。価格は9878円。\n\n『Nintendo World Championships ファミコン世界大会』は、『スーパーマリオブラザーズ』や『ゼルダの伝説』などファミコンの13タイトルから一部を切り出した150以上の競技に挑戦するゲーム。\n\n13タイトルは以下のとおり。\n\nアイスクライマー\nバルーンファイト\nスーパーマリオブラザーズ\nスーパーマリオブラザーズ2\nスーパーマリオブラザーズ3\nスーパーマリオUSA\nゼルダの伝説\nリンクの冒険\n星のカービィ 夢の泉の物語\nメトロイド\nドンキーコング\n光神話 パルテナの鏡\nエキサイトバイク\n\nゲームでは、ひとりで150以上の競技に挑戦できるモード「タイムアタック」に加え、毎週切り替わる5つの競技に挑戦し、世界のプレイヤーとランキングを競うモード「世界ランキング大会」、さらにNintendo Switch 1台で最大8人までのファミコン大会を、家族や友人とオフラインでいつでも開催できるモード「パーティ」を収録している。\n\nなお「スペシャルエディション」には、ゲームソフトに加えて以下の内容もセットになっている。\n\n・Nintendo Switch Online 7日間無料体験 番号\n・ピンバッジセット（5種）※対象年齢 15才以上\n・アートカード（13種）\n・ファミリーコンピュータ コントローラー(Ⅰ)※\n・ファミリーコンピュータ コントローラー(Ⅱ)※\n\n※Nintendo Switch 本体付属のJoy-Conよりもボタンが少ないため、『ファミリーコンピュータ Nintendo Switch Online』、『Nintendo World Championships ファミコン世界大会』以外のソフトを遊ぶことはできない。\n\nタイトル名の由来となっている「Nintendo World Championships」とは、1990年に、北米地域で開催していた任天堂の公式ゲーム大会だ。本作では、Nintendo Switch用ソフトとして、ニンテンドー ワールドチャンピオンシップスという名の下に誰でも気軽に「ファミコン世界大会」に挑戦できるコンセプトとなっている。\n\n「ファミコン世界大会」に挑戦できるソフト『Nintendo World Championships ファミコン世界大会』は、7月18日（木）に発売予定だ。\n電ファミニコゲーマー：福山幸司,['https://newsatcl-pctr.c.yimg.jp/t/amd-img/20240508-01078843-denfami-000-6-view.jpg?exp=10800'],"['https://news.yahoo.co.jp/articles/e95b9dc82d77ff29ce8d12782dfa12bdd5dd969f/images/000', 'https://news.denfaminicogamer.jp/news/2405082e/attachment/%e2%98%85%e4%b8%96%e7%95%8c%e3%83%a9%e3%83%b3%e3%82%ad%e3%83%b3%e3%82%b0%e5%a4%a7%e4%bc%9a_%e3%82%ad%e3%83%8e%e3%82%b3%e6%97%a9%e5%8f%96%e3%82%8a2']"
「おもちゃのハローマック」がまさかのジオラマ化、予約を受付中。あの頃のワクワクを思い出す店内や駐車場まで再現、変わりゆく街並みに想いを馳せる「東京靴流通センター」もラインナップ（電ファミニコゲーマー）,https://news.yahoo.co.jp/articles/cec8a52511f419781f8ebc3a18655edacc9c028c,https://newsatcl-pctr.c.yimg.jp/t/amd-img/20240508-01078792-denfami-000-3-view.jpg?exp=10800,2024-05-08T22:19:40+09:00,2024-05-08T22:20:34+09:00,電ファミニコゲーマー,denfami,電ファミニコゲーマー,610,\nあの頃の思い出があなたの手に。特徴的な屋根の建築はそのままに生まれ変わった「東京靴流通センター」もラインナップ、変わりゆく街並みと子供時代に想いを馳せる\nTOMIXは5月8日（水）、「おもちゃのハローマック」と「東京靴流通センター」をモチーフにしたジオラマの予約受付を開始した。\n\n「おもちゃのハローマック」は、1985年から2008年までの間チヨダが運営していたおもちゃ店。屋根部分が特徴的な建築が代名詞的存在だ。2019年の東京おもちゃショーでは、チヨダのブースが「ハローマック」ブランドとして初出展。合わせて公開されたWebページ「なつかしのハローマックの店舗」では、特徴的な造形をそのまま居抜きとして活用した東京靴流通センターやMac-Houseが紹介されている。\n\n今回登場するジオラマでは、屋根の形はもちろん、子ども時代のワクワクを思い起こさせてくれるファンシーなカラーリング、店内に至るまでを再現。店舗の周りの駐車場とのぼりまで揃ったその佇まいはノスタルジーそのものといった仕上がりだ。\n\nさらに、特徴的な建築はそのままに活用された「東京靴流通センター」もラインナップ。国道沿いの変わりゆく街並みに想いを馳せる、「ハローマック」とはまた違ったノスタルジーに浸れるアイテムだろう。\n\n価格はそれぞれ税込5940円。Amazonなどにて予約を受付中だ。\n電ファミニコゲーマー：anymo,['https://newsatcl-pctr.c.yimg.jp/t/amd-img/20240508-01078792-denfami-000-3-view.jpg?exp=10800'],['https://news.yahoo.co.jp/articles/cec8a52511f419781f8ebc3a18655edacc9c028c/images/000']
『真・女神転生』『ペルソナ』の金子一馬氏が手がけるスマートフォン向けの新作「project MASK」発表、“「神」と創る、新たなゲーム体験”をテーマに、金子氏の世界観を最新テクノロジーで表現したオリジナルIP作品に（電ファミニコゲーマー）,https://news.yahoo.co.jp/articles/6245693c837b5f171a1231792c91f4a604308373,https://newsatcl-pctr.c.yimg.jp/t/amd-img/20240508-01078498-denfami-000-6-view.jpg?exp=10800,2024-05-08T19:07:24+09:00,2024-05-08T19:09:23+09:00,電ファミニコゲーマー,denfami,電ファミニコゲーマー,701,\n『真・女神転生』『ペルソナ』の金子一馬氏が手がけるスマートフォン向けの新作「project MASK」発表\nコロプラは、金子一馬氏が手がけるスマートフォン向けの新作「project MASK」を開発中と発表した。\n\n「2024年9月期 第2四半期決算説明会資料」を通じて明かした形となる。\n\n金子一馬氏は、アトラスで『真・女神転生』シリーズのキャラクターデザイン、世界設定、コンセプト作りなどに携わった人物。\n\n今年4月には金子一馬氏がアトラスを退社し、コロプラに入社していたことが明らかになっていたが、新規オリジナル作品への参与も伝えられていたが、今回はその一端が明らかになった形だ。\n\n今回、判明したのは「project MASK」と題されたプロジェクト名であり、“「神」と創る、新たなゲーム体験”をテーマにしているスマートフォン向けゲームだという。\n\nなおコロプラはスマートフォン向けゲームを5本、コンシューマーゲームを10本、ブロックチェーンゲームを1本開発しているとのことで、このなかの1本と見てよさそうだ。\n\n以前のコロプラの採用情報の金子一馬氏のインタビューでは「金子一馬さんの世界観を表現したオリジナルIP」、「最新のテクノロジーをゲーム体験」と明言されており、どのような作品なのか期待が高まるところ。\n\nなおコロプラは、近日公開予定のスマートフォン向けゲームの新作情報があるとしつつ、その作品は今回の「project MASK」ではないとしている。はたしてどのような作品になっているのか、正式発表を待ちたいところだ。\n電ファミニコゲーマー：福山幸司,['https://newsatcl-pctr.c.yimg.jp/t/amd-img/20240508-01078498-denfami-000-6-view.jpg?exp=10800'],['https://news.yahoo.co.jp/articles/6245693c837b5f171a1231792c91f4a604308373/images/000']
