headline,mainEntityOfPage,image,datePublished,dateModified,author,media_en,media_jp,str_count,body,images,external_links
市街地に近いスキー場もすでに全面滑走可能!パウダースノーを楽しむ人たちでにぎわう　関係者は「恵みの雪…ありがたい」（ＳＢＣ信越放送）,https://news.yahoo.co.jp/articles/7297d9710277a6835001084baf784621e33db27e,https://newsatcl-pctr.c.yimg.jp/t/amd-img/20241229-21645492-sbcv-000-2-thumb.jpg?exp=10800,2024-12-29T18:46:44+09:00,2024-12-30T10:51:25+09:00,ＳＢＣ信越放送,sbc,ＳＢＣ信越放送,482,信越放送 冬型の気圧配置の影響で長野県内は北部の山沿いなどで積雪が増え、スキー場にとっては恵みの雪となっています。 【写真を見る】市街地に近いスキー場もすでに全面滑走可能!パウダースノーを楽しむ人たちでにぎわう 関係者は「恵みの雪…ありがたい」 長野市の戸隠スキー場も午前中から多くのスキーヤーやスノーボーダーでにぎわいました。 全部で19のコースは28日から全面滑走が可能になり、初心者から上級者まで高低差のある広々としたゲレンデで、新雪の感触を楽しんでいました。 （京都から）「今シーズン初めてです この時期にこんなに雪があるの初めてでうれしいです」 （相模原から）「パウダースノーで非常に滑りやすいです 感激してます」 戸隠スキー場は長野市街地から車で50分ほどの場所にあり、150センチを超える積雪はこの時期としては珍しいということです。 ■戸隠スキー場 武井智史営業副支配人 「6年7年ぶりというかたちで、12月にこんなに雪が降るのはありがたい 恵みの雪だと思っています」 スキー場では大みそかから三が日にかけて、さらなる人出を予想しています。 信越放送,[],[]
【こども未来】『電気系部活の甲子園』マイコンカーラリーに挑む工業高校3年生（ＳＢＣ信越放送）,https://news.yahoo.co.jp/articles/072d4a3717cb567295dff87473e0267d28c16987,https://newsatcl-pctr.c.yimg.jp/t/amd-img/20241229-21645480-sbcv-000-2-thumb.jpg?exp=10800,2024-12-29T18:36:50+09:00,2024-12-30T10:51:25+09:00,ＳＢＣ信越放送,sbc,ＳＢＣ信越放送,718,信越放送 こども未来プロジェクト、今回はマイコンカーに青春をかける高校生です。 白線がひかれたコースを高速で走る車。 【写真を見る】【こども未来】『電気系部活の甲子園』マイコンカーラリーに挑む工業高校3年生 マイコンカーと呼ばれるプログラミングされた手作りのロボットカーです。 長野県岡谷工業高校の3年生で電気部の塩澤匠生（しおざわ・たくみ）さん。 ■塩澤匠生さん 「自分で設計して、カーボンの一枚板から切り出したものを組み立てて、作った機体になります」 自慢の1台とともに、2025年1月、塩澤さんが出場するのは、高校生のマイコンカー全国大会。 去年（2023年）は決勝で完走できず、目標とした上位に食い込むことができませんでした。 雪辱を果たそうと、正確性とスピードにこだわり、試行錯誤を重ねてきました。 白いラインをカメラで認識しコースアウトしないように走らせる高度な技術が要求される種目。 ■塩澤匠生さん 「失敗するたびに、どこが今落ちた 原因はどこだっただろうというのをときには目で確認したり 目で見て分からないところはログが残っているので、どういう処理を行った結果落ちてしまったかを追求して、それに対してデバッグ（不具合の排除）を行って機体の動きを修正してくみたいな」 原因を分析し修正する冷静さと、あきらめずに工夫を重ねる情熱が求められます。 ■岡谷工業高校電気部顧問 小井戸政範教諭 「うまく走れないことの方が多くて、走らないのはどういう原因があるのか、何度も何度もくり返しながらチャレンジしていくところが競技の醍醐味」 ■塩澤匠生さん 「完走率を上げて絶対走るようにして、全国優勝していきたいと思っています」 信越放送,[],[]
大みそかに再び荒天予想　年明け以降は冬型の気圧配置　元日までの雪と寒気の予想は?【シミュレーション更新　29日午後4時】（ＳＢＣ信越放送）,https://news.yahoo.co.jp/articles/456dfa90c926f07daf4b70c18576665e4edff438,https://newsatcl-pctr.c.yimg.jp/t/amd-img/20241229-21645425-sbcv-000-1-view.jpg?exp=10800,2024-12-29T17:17:15+09:00,2024-12-29T17:17:15+09:00,ＳＢＣ信越放送,sbc,ＳＢＣ信越放送,382,信越放送 冬型の気圧配置と強い寒気の影響で、北日本や東日本の日本海側の山沿いでは雪が降っているところがあります。 【写真を見る】大みそかに再び荒天予想 年明け以降は冬型の気圧配置 元日までの雪と寒気の予想は?【シミュレーション更新 29日午後4時】 あす30日は冬型の気圧配置は緩む見込みですが、31日大みそかは低気圧が発達しながら北日本を通過するため、北日本を中心に雨や雪の降るところがある見込みです。 気象庁の週間天気予報解説によりますと、元日1⽉1⽇は、東シナ海の⾼気圧が⻄⽇本に張り出し、冬型の気圧配置は⻄から緩む見込みですが、2⽇から3⽇は、冬型の気圧配置となり、⽇本海から北⽇本付近を弱い気圧の⾕が通過する予想となっています。 4⽇から5⽇は、⼤陸の⾼気圧が⻄⽇本から⽇本の南に張り出し、北⽇本中⼼の冬型の気圧配置が続く見込みとなっています。 信越放送,[],[]
和食店でおせち作り大忙し　物価高で仕入れ値上昇も手作りにこだわり販売価格の上げ幅は控えめに（ＳＢＣ信越放送）,https://news.yahoo.co.jp/articles/c2649ed98b00b24dcf643b36bf11aaba2a1bf603,https://newsatcl-pctr.c.yimg.jp/t/amd-img/20241229-21645168-sbcv-000-2-thumb.jpg?exp=10800,2024-12-29T12:38:32+09:00,2024-12-30T10:51:25+09:00,ＳＢＣ信越放送,sbc,ＳＢＣ信越放送,357,信越放送 年の瀬が迫り、正月の食卓を彩る「おせち料理」作りが最盛期を迎えています。 安曇野市の和食店「草菴 温（そうあん・ゆたか）」では28日からおせち作りが本格的に始まりました。 【写真を見る】和食店でおせち作り大忙し 物価高で仕入れ値上昇も手作りにこだわり販売価格の上げ幅は控えめに 重箱に40種を超える料理を並べるということで、従業員が総出で仕込みにあたります。 物価高の影響で食材の仕入れ値は全体で2割ほど上がっているものの、手作りにこだわることで販売価格はあまり上げないように努力しているということです。 ■草菴 座間昭光（ざま・あきみつ）顧問 「いい年になってほしいと思いながら食べてほしい。縁起ものですから」 店ではおよそ500人前を仕込み、完成したおせちは大みそかに予約客に手渡されます。 信越放送,[],[]
辰年から巳年へ  名物の干支オブジェが交代　愛きょうたっぷりのヘビに込めた願いとは…（ＳＢＣ信越放送）,https://news.yahoo.co.jp/articles/6e8134a46b2eb89c31de9d4d0cf4b30162f94dcb,https://newsatcl-pctr.c.yimg.jp/t/amd-img/20241229-21645145-sbcv-000-2-thumb.jpg?exp=10800,2024-12-29T12:34:31+09:00,2024-12-30T10:54:55+09:00,ＳＢＣ信越放送,sbc,ＳＢＣ信越放送,389,信越放送 2025年は巳年（みどし）。 長野市の看板制作会社が毎年展示している干支のオブジェが、辰からヘビに交代しました。 【写真を見る】辰年から巳年へ 名物の干支オブジェが交代 愛きょうたっぷりのヘビに込めた願いとは… 長野市東鶴賀町（ひがしつるがまち）の「アドイシグロ」は、社屋がある通称・北長野通りに2004年から大きな干支のオブジェを展示しています。 辰年にちなんだ銀色の龍に代わり登場したのは、高さ1メートルの愛嬌たっぷりの2匹のヘビ。 マイクを挟んで立つ、漫才コンビという設定で『ヘビー級の楽しさを届けたい』との思いが込められています。 素材は看板づくりで余ったものを活用し、地域の人たちも参加して作り上げました。 アドイシグロの社長・石黒ちとせさんは「来年はニョロっと楽しめる、柔軟な年になれば」と、これから1年の役目が始まるオブジェを見上げていました。 信越放送,[],[]
大雪の峠は越えるも冬型の気圧配置が続く見込み・なだれにも注意を（ＳＢＣ信越放送）,https://news.yahoo.co.jp/articles/557d22ca94735c587af027160398dcda1e504c10,https://newsatcl-pctr.c.yimg.jp/t/amd-img/20241229-21644995-sbcv-000-2-view.jpg?exp=10800,2024-12-29T09:34:31+09:00,2024-12-29T10:06:30+09:00,ＳＢＣ信越放送,sbc,ＳＢＣ信越放送,380,信越放送 長野県内は中野飯山地域で降り続いていた大雪の峠は越えたものの、冬型の気圧配置が続く見込みです。 気象台によりますと、29日午前0時までの24時間に降った雪の量は、野沢温泉38センチ 飯山37センチ 白馬21センチ 小谷15センチなどとなっています。 JR東日本長野支社によりますと、雪の影響で飯山線は森宮野原駅と十日町駅の上下線で29日午前11時30分頃まで運転を見合わせます。 大雪の峠はいったん越えましたが冬型の気圧配置が続く見込みで、30日午前6時までの24時間の予想降雪量はいずれも多いところで、北部20センチ、中部と南部が5センチとなっています。 気象台では北部の山沿いと中野飯山地域の積雪の多い地域では、30日にかけてなだれに注意するよう呼びかけています。 また、北部では29日昼前から夕方にかけて落雷や突風にも注意が必要です。 信越放送,[],[]
「200万県民」は過去形に…パルコ、井上、ヨーカドー、ライフ相次ぐ閉店【2024信州を振り返る(4)】「政治と経済」止まらないガソリン高「政治とカネ」で政党勢力図に変化も　（ＳＢＣ信越放送）,https://news.yahoo.co.jp/articles/bfdf2e513465dd5ca9a6c72b9c5f300a99d67c78,https://newsatcl-pctr.c.yimg.jp/t/amd-img/20241229-21630070-sbcv-000-2-thumb.jpg?exp=10800,2024-12-29T08:02:03+09:00,2024-12-30T10:57:52+09:00,ＳＢＣ信越放送,sbc,ＳＢＣ信越放送,1181,信越放送 この1年の出来事を振り返る、シリーズ2024年の信州。 今回は裏金問題などで揺れた政治や経済の話題をまとめます。 【写真を見る】「200万県民」は過去形に…パルコ、井上、ヨーカドー、ライフ相次ぐ閉店【2024信州を振り返る(4)】「政治と経済」止まらないガソリン高「政治とカネ」で政党勢力図に変化も 阿部守一知事: 「長野県人口200万人を下回るという形になると…」 今年2月に、およそ半世紀ぶりに200万人を割り込んだ長野県の人口。 県民: 「近くも空き家がいっぱいで、解体してきれいにするにもけっこうな費用もかかるし」 県民: 「なくなっちゃう?この地区がなくなっちゃうみたいな」 県民: 「Uターンで帰ってきてくれればいいけど、やっぱり不便だから」 県民: 「自治そのものが成り立っていくかどうか」 県世論調査協会の調査では、200万人を下回ったことについて、県民の半数近くは「やはり残念」と回答、驚きを示しす答えが続いた一方で、関心がないという人も…。 また男性よりも女性が県外に出て行ってしまう点については、「（大都市圏の方が）活躍する場所が多い」という声が7割、「男女差別の意識がまだ根強い」からという指摘も3割にのぼりました。 課題が積み重なるなかで、政治の世界は裏金問題に揺れました。 長野1区 若林健太議員（当時）: 「多くの皆さんの信頼を裏切ることになり、大変申し訳なく心からお詫びを申し上げたいと思います」 旧安倍派を中心に政治資金の不記載が発覚しました。 岸田首相（当時）: 「私が身を引くことであります」 支持率の低迷が続いた岸田総理が、総裁選への不出馬を表明。 逆風を受けた与党は、10月の衆院選で議席を減らし、県内の野党からは新人議員も誕生しました。 立憲民主党 福田淳太さん（長野5区 比例復活）: 「自分が議員としてここ（国会議事堂の前）を歩いているのが、あらためて感謝の思いでいっぱい」 一方で引退する元議員も… 自民党 務台俊介さん（長野2区）: 「議席を確保するという観点に立てば、これ（引退）が現実的ではないかというのが私の考え」 このほか東御市で選挙の報告会で飲食物の提供があったり、長野市では政務活動費を使った高額なお茶菓子や交通費の支給が問題となるなど、法令違反の指摘や倫理が問われる事態が起きました。 3月には北陸新幹線が福井県の敦賀まで延伸。 JR東海・丹羽社長: 「静岡工区の着工の遅れが名古屋開業の遅れに直結するものでありますので…」 一方、JR東海は2027年のリニア開業を断念。 川勝平太 静岡県知事（当時）: 「不愉快な思いをされたなら誠に申し訳なく思います」 理由としていた静岡工区は知事が不適切発言で辞職したことで進み始めましたが、県内の工区でも、工期の延長が各地で明らかになりました。,[],[]
中野飯山地域の大雪警報は注意報に切り替え　29日明け方まで大雪に注意（ＳＢＣ信越放送）,https://news.yahoo.co.jp/articles/781f42bd4e1abe799333422dd679f9cc2d817d7e,https://newsatcl-pctr.c.yimg.jp/t/amd-img/20241229-21644927-sbcv-000-1-view.jpg?exp=10800,2024-12-29T00:36:35+09:00,2024-12-29T00:36:35+09:00,ＳＢＣ信越放送,sbc,ＳＢＣ信越放送,385,信越放送 長野地方気象台は、中野飯山地域に出していた大雪警報を注意報に切り替えました。29日明け方まで大雪に注意が必要です。 【写真を見る】中野飯山地域の大雪警報は注意報に切り替え 29日明け方まで大雪に注意 28日午後11時現在の積雪の深さ 野沢温泉 143センチ 信濃町 75センチ 飯山 81センチ 小谷 74センチ 白馬 45センチ 大町 29センチ 上田市菅平 41センチ 木曽町開田高原 19センチ 【24時間予想降雪量】 29日午後6時まで（多い所） 長野地域山沿い 40センチ 長野地域平地 10センチ 中野飯山地域 40センチ 大北地域山沿い 40センチ 大北地域平地 15センチ 上田地域の菅平周辺 10センチ 松本地域の聖高原周辺 10センチ 乗鞍上高地地域 20センチ 上伊那地域 5センチ 木曽地域 15センチ 下伊那地域 10センチ 信越放送,[],[]
