headline,mainEntityOfPage,image,datePublished,dateModified,author,media_en,media_jp,str_count,body,images,external_links
これまで最大の挑戦は「乃木坂46からの卒業だった」白石麻衣がウィルオブの”特任キャリアアドバイザー”に就任（中日スポーツ）,https://news.yahoo.co.jp/articles/16eaa71590a21770ff2bec9ddd2378450c7e9858,https://newsatcl-pctr.c.yimg.jp/t/amd-img/20260629-00000059-chuspo-000-1-view.jpg?exp=10800,2026-06-29T14:55:54+09:00,2026-06-29T14:55:54+09:00,中日スポーツ,chuspo,中日スポーツ,488,新CM発表会に出席した白石麻衣 女優の白石麻衣（33）が29日、東京都内で行われた総合人材サービスを手がけるウィルオブ・ワークの「ウィルオブ新CM発表会」に出席した。白石が出演する同社の新CM「ウィルオブとおはなししませんか？」編では、白石が”特任キャリアアドバイザー”に就任。仕事に悩む求職者に向かって、まるで話しかけているような演出となっている。 【実際の投稿】パリジェンヌも振り向く！？白石麻衣、美の本場でスタイル際立つ白コーデ【写真複数枚】 白石はCMで着用したスーツ姿で登場し、「何か一歩を踏み出すのはすごく大きなことだと思う。そういう大切なテーマに、お仕事で関わらせていただけるのは、すごくうれしい。私らしく伝えていけたら」と笑顔を見せた。 これまでの大きな挑戦は2020年の乃木坂46からの卒業だったそうで、「自分の道を進んでいくっていうことは、自分の中で大きな選択、決断だったので。すごく不安もあったが、グループで、みんなで頑張ってきた自信というか、安心感もたくさんあったので。すごく大きな挑戦ではあったけど、頑張れる糧にもなった」と振り返った。 中日スポーツ,[],[]
ケイン・コスギ「40年以上やっていますけど初めて」 会見で机破壊のアクション（中日スポーツ）,https://news.yahoo.co.jp/articles/3471a216061ffc99ee965ba2d9ef0a01d3104e47,https://newsatcl-pctr.c.yimg.jp/t/amd-img/20260629-00000058-chuspo-000-5-view.jpg?exp=10800,2026-06-29T14:51:32+09:00,2026-06-29T15:10:54+09:00,中日スポーツ,chuspo,中日スポーツ,604,完成報告会に出席したケイン・コスギ 俳優ケイン・コスギ（51）が29日、東京都内で映画「四十九－SEEK」（シェイン・コスギ監督、7月31日公開）の完成報告会に登場した。 【写真】ケイン・コスギ、ラーメン店の「濃いめ」より濃い「ケイン」を 忍者の末裔（まつえい）たちの非政府組織「四十九（シーク）」の主人公・相沢京平が、ある潜入任務を通じて己の宿命と向き合うことになるモ物語。ケインは闇組織のボス・高月を演じた。今作は既に世界各国の映画祭で82の賞を獲得している。 アクションを披露した浅野寛介㊨とケイン・コスギ㊧。中央はシェイン・コスギ監督 イベントには京平役の中国武術世界王者で俳優の浅野寛介（39）、ケインの弟でもあるシェイン監督も登壇。報告会は報道陣だけの会見で、英語であいさつを始めたケインに司会が日本語で話すよう要請したことから〝トラブル〟に発展。浅野とケインが戦い、浅野が飛ばされ机を破壊するなど、劇中さながらの迫力満点のアクションを披露した。 これまでさまざまな会見や舞台あいさつに登壇してきたケインだが、会見でのアクションに「40年以上やっていますけど初めて」と笑顔。アクション披露は直前に伝えられたにもかかわらず、ケインは浅野と息の合った動きを見せた。シェイン監督が「2人ともプロだからできます」と言えば、ケインも「今までやったことがなかったから楽しみにしていた」と話した。 中日スポーツ,[],[]
中村獅童、息子たちの活躍に喜びも「ライバル心はメラメラ」陽喜＆夏幹がWEB CMでジャズダンスに初挑戦（中日スポーツ）,https://news.yahoo.co.jp/articles/c106ed2228a810bd2696c6d9e1dbbca917f0abcb,https://newsatcl-pctr.c.yimg.jp/t/amd-img/20260629-00000057-chuspo-000-2-view.jpg?exp=10800,2026-06-29T14:15:53+09:00,2026-06-29T14:37:05+09:00,中日スポーツ,chuspo,中日スポーツ,737,アジア・ラゲージ「KABUKI」新WEB CM ＆「KABUKI 14」発表イベントに出席した（左から）中村陽喜、中村獅童、中村夏幹 歌舞伎俳優の中村獅童（53）が29日、東京都内で行われたアジア・ラゲージ「KABUKI」新WEB CM＆「KABUKI 14」発表イベントに長男の陽喜（8）、次男の夏幹（6）と出席した。 【写真】天使が2人！中村獅童の長男・陽喜くん&次男・夏幹くん この日のイベントでは歌舞伎の世界観をデザインに落とし込んだスーツケースコレクション「KABUKI」から登場するキッズサイズモデルがお披露目。陽喜と夏幹が兄弟で出演する新CMではジャズダンスにも初挑戦し、息ぴったりな堂々のパフォーマンスを見せた2人。陽喜が「難しかったです」と撮影を振り返り、夏幹は「全部楽しかったです」と声を弾ませた。 2人の奮闘ぶりに獅童は「家でも稽古したみたいで、一生懸命やったという点では評価できる」と父親の顔をのぞかせながらも、「僕だったらもっと上手なんじゃないかな…なんで僕が出てないのに、今日ここにいるのか」と苦笑い。 アジア・ラゲージ「KABUKI」新WEB CM ＆「KABUKI 14」発表イベントに出席した中村獅童 新たなスーツケースと一緒に出かけたい場所に夏幹は「もう一回メキシコに行きたい」と期待。昨年の家族旅行を回想した獅童も「3人ともプロレスが好きなので、マスクマンの本場ですからルチャリブレを3日連続で見ました」と親子での思い出にほほ笑んだ。 成長を続ける息子たちへの思いに「親子といえ舞台の上に立てばライバル」と話した獅童は「彼らが活躍してくれるのは非常にうれしい反面、ライバル心はメラメラ」と胸中を明かし、会場の笑いを誘った。 中日スポーツ,[],[]
米女子ゴルフ・山下美夢有、「7番で…」勢いが止まってしまった痛恨ショット振り返り「ちょっとつかまってしまった」結局12位に（中日スポーツ）,https://news.yahoo.co.jp/articles/8b6ec54a4c390526e3bb4fcbddb6cc1151d9526a,https://newsatcl-pctr.c.yimg.jp/t/amd-img/20260629-00000056-chuspo-000-2-view.jpg?exp=10800,2026-06-29T13:16:33+09:00,2026-06-29T13:17:39+09:00,中日スポーツ,chuspo,中日スポーツ,587,山下美夢有（AP） ◇28日 女子ゴルフメジャー第3戦 KPMG全米女子プロ最終日（米ミネソタ州、ヘーゼルティンナショナルGC） 【写真】シーサーを手に笑顔の山下美夢有 メジャー2勝目と2週連続優勝がかかっていた山下美夢有（24）＝花王＝は71にとどまり、通算5アンダーで12位に終わった。首位から出た25歳のユ・ヘラン（韓国）が通算13アンダーにし、メジャー初優勝、米ツアーでは通算4勝目を挙げた。 首位まで7打差を追って出た山下は、悪天候でスタートが3時間半遅れるアクシデントの中、1番で5メートルを決め、追い上げの準備が整ったかに思わせた。だが、パー5の7番でフェアウエーからの第2打を池に入れてボギーにし、その後は流れに乗れず。トップ10にも入れず、悔しい最終日になった。 「パットは4日間通じて最も決まっていたかに思ったが、7番で…」。第2打はグリーンまで届く距離で、5番ウッドを握ったが、「ちょっとつかまってしまった」という。 次週は休み、その後は欧州でのプレーが続く。その間にはエビアン選手権にAIG女子オープン（全英）と、メジャーの残り2試合も予定されている。「ラフやバンカーなど、どこに外してもリカバリーできるショットやバリエーションを増やしていきたい。緊張した雰囲気の中でもちゃんとしたストロークができる練習も必要」と、課題を次々に挙げた。 中日スポーツ,[],[]
『ラストコールコレクション』大混乱　脅迫でランウェイ中止発表も…エンリケ強行？　明日花キララは”ブチギレ暴露”（中日スポーツ）,https://news.yahoo.co.jp/articles/85d024a61118b23eae2e01f00673907925524e44,https://newsatcl-pctr.c.yimg.jp/t/amd-img/20260629-00000055-chuspo-000-9-view.jpg?exp=10800,2026-06-29T12:46:06+09:00,2026-06-29T15:16:21+09:00,中日スポーツ,chuspo,中日スポーツ,921,２８日に開催されたオーディション番組「ＬＡＳＴ ＣＡＬＬ」発のイベント「ＬＡＳＴ ＣＡＬＬ ＣＯＬＬＥＣＴＩＯＮ（ラストコールコレクション）」が世間を騒がせている。脅迫を受けて目玉企画が中止となったり、出演予定者がＳＮＳで不満をぶちまけるなど、混乱を極めている。 【実際の投稿】 ”ブチギレ暴露”の明日花キララ、強行？ エンリケら『ラストコールコレクション』 同イベントは、企業家の溝口勇児さんらがＭＣを務める、人生を変えたい女性が挑むキャバ嬢オーディション番組から生まれたもの。２８日は東京都内にある「ＴＯＹＯＴＡ ＡＲＥＮＡ ＴＯＫＹＯ」で初開催された。 だが、開催日当日、溝口さんが自身のＸ（旧ツイッター）を更新。「正直に話します。今、折原こと東優樹と名乗る暴露系アカウントから、『イベントでランウェイを歩いたら、出演者のクイーンの暴露をする』と脅されています」と脅迫があったことを明かし、目玉である番組出演者による「ランウェイステージ」を急きょ中止にしてイベントを実施することを発表した。 運営側が対応に追われる中、別のトラブルも勃発した模様。タレントの明日花キララが同日、自身のインスタなどのＳＮＳを更新し、同イベントの楽屋写真を添えつつ、イベントへの不満を爆発させた。前日に送られてきた台本の名前が違ったこと、リハーサル開始の１時間前から楽屋で待機したものの呼ばれず、状況を尋ねるも謝罪も説明もなかったと「不誠実」さを訴え、出演せずに帰宅した経緯を暴露した。その後、溝口さんから直接謝罪があったともＸで報告した。 明日花キララ 一方で、「レジェンドクイーン」として番組に出演する伝説のキャバ嬢・エンリケは２９日までに、インスタグラムやＸにて、自身がシャンパンを片手に堂々とランウェイを歩いた動画も公開。Ｘでは「ラストコールコレクションでランウェイ無くて寂しくて急遽１人ランウェイＷ からのあっすん続いてくれたの神」とつづり、自身の判断で”強行突破”でランウェイを歩き、他のキャバ嬢もそれに続いたことを報告した。 トラブルに次ぐトラブルに見舞われた波乱のイベント。開催から一夜明けてもなお、ネット上を騒がせ続けている。 中日スポーツ,[],[]
これからも三本の矢…若隆景、引退→若者頭転身の長兄・若隆元に言及「これからも一緒に頑張っていきたい」次兄は幕内若元春（中日スポーツ）,https://news.yahoo.co.jp/articles/3aa3813fab687cfefdc22042329f02814f45d947,https://newsatcl-pctr.c.yimg.jp/t/amd-img/20260629-00000054-chuspo-000-3-view.jpg?exp=10800,2026-06-29T12:44:33+09:00,2026-06-29T12:50:56+09:00,中日スポーツ,chuspo,中日スポーツ,431,若隆景（左）と兄の若隆元 大相撲夏場所で12勝を挙げて2度目の優勝を果たし、名古屋場所（IGアリーナ、7月12日初日、中日新聞社共催）で大関とりの足場固めを目指す関脇若隆景（荒汐）が番付発表の29日、名古屋市内の部屋宿舎で会見。元幕下で夏場所限りで現役引退し、若者頭に転身した兄の若隆元に言及した。 【写真】若隆景、賜杯を手に家族らと笑顔 「これからも身近にいるのは変わらないので、しっかり一緒に頑張っていきたいなと思います」。現役同士でなくなり、関係性の変化を問われると「それは兄に聞いてください」。会場に姿を見せた若隆元とともに、笑顔を見せた。 若隆元は「大波三兄弟」の長兄。若隆景は末弟で、次兄は幕内若元春。そろって名古屋市生まれで若隆元は毎年、名古屋場所前にバンテリンドームナゴヤに足を運ぶ熱心な竜党としても知られた。 しこ名はそれぞれ、戦国武将・毛利元就の息子で名将ぞろいだった長男・隆元、次男・吉川元春、三男・小早川隆景にちなんでいる。 中日スポーツ,[],[]
若隆景、パリの思い出問われ「………」10秒近く沈黙「フランス語、しゃべれないから」　大関とり足固めへ状態上々「しっかり稽古に精進したい」（中日スポーツ）,https://news.yahoo.co.jp/articles/f6705dea6ca0fed7e7a0afbf1dc2545a40031f73,https://newsatcl-pctr.c.yimg.jp/t/amd-img/20260629-00000053-chuspo-000-2-view.jpg?exp=10800,2026-06-29T12:36:53+09:00,2026-06-29T12:54:16+09:00,中日スポーツ,chuspo,中日スポーツ,405,大相撲名古屋場所の番付が発表され、記者会見する若隆景 大相撲夏場所で12勝を挙げて2度目の優勝を果たし、名古屋場所（IGアリーナ、7月12日初日、中日新聞社共催）で大関とりの足固めを目指す関脇若隆景（荒汐）が番付発表の29日、名古屋市内の部屋宿舎で会見し、相撲一筋ぶりを明かした。 【写真】若隆景、賜杯を手に家族らと笑顔 6月にはパリ公演に参加。現地での力士たちのエッフェル塔といった名所訪問の様子がネット上などで話題になったが、思い出を問われた若隆景は「特にそこまで観光は行ってないですけど…」と10秒近く沈黙。「ぱっと出てこないですね」と苦笑いで振り返った。会場での声援が印象に残ったというが「フランス語、しゃべれないから」と、現地のファンとの直接の交流には至らなかったと打ち明けた。 地元福島での合宿も含め、多忙な6月となったが、状態は上々という。「しっかり稽古に精進したい」と意気込んだ。 中日スポーツ,[],[]
ついに、ついに…初優勝の小椋藍「その瞬間、喜びと達成感でいっぱい」2004年の玉田誠以来、22年ぶり日本人快挙【モトGP・第10戦オランダGP】（中日スポーツ）,https://news.yahoo.co.jp/articles/18b20777c98dde0c5944ddef35a26b3b93ef3300,https://newsatcl-pctr.c.yimg.jp/t/amd-img/20260629-00000052-chuspo-000-2-view.jpg?exp=10800,2026-06-29T12:17:53+09:00,2026-06-29T12:20:19+09:00,中日スポーツ,chuspo,中日スポーツ,1139,初優勝を飾り、パルクフェルメで飛び切りの笑顔を浮かべる小椋藍（トラックハウスレーシング提供） ロードレース世界選手権第10戦オランダGP（28日＝TTサーキットアッセン）で、モトGPクラスの初優勝を飾ったアプリリアに乗るトラックハウスレーシングの小椋藍がチームを通じて熱い思いを語った。「この初勝利は僕にとって、そしてチームにとっても非常に大きな意味があります。フィニッシュラインを通過した瞬間は、喜びと達成感でいっぱいでした。前回のレースで優勝まであと一歩（2位）のところまで迫っていましたが、ついにそれを成し遂げることができ、本当にうれしいです」。 チームメンバーに出迎えられ、トップチェッカーを受けた小椋藍（トラックハウスレーシング提供） 前戦チェコGPでは初めてのポールポジションを獲得したものの、スプリントも決勝も2位止まり。モトGP2年目での初勝利まであと一歩の状況で足踏みが続いたが、今大会は一時的に5番手までポジションを落としながら得意の追い上げを決め、最後は2位の同僚ラウル・フェルナンデスに2秒もの差をつけてのチェッカー。2004年の日本GPを制した玉田誠以来となる、最高峰クラスの日本人ウイナーとなった。 同僚のラウル・フェルナンデス（左）とトップ争いを繰り広げた小椋藍（トラックハウスレーシング提供） ただ、今回も試練はあった。猛烈な追い上げ中だったレース中盤、1コーナーに飛び込んだときにリアタイヤの車高を調整する装置が動かなくなった。「ターン1でデバイスを解除したのですが、ターン3までの間に再び動き出した。幸い直後に正常な状態に戻りました」。今大会からスタート時に前輪の車高を調整する装置が使えなくなった影響か、車両トラブルを訴えてリタイアする車両もあり、小椋はぎりぎりの状況を乗り越えたようだ。 愛車とともに表彰台に現れた小椋藍（中）。左は２位のラウル・フェルナンデスで、右は３位のホルヘ・マルティン（トラックハウスレーシング提供） また、同僚らと2位を争っていた2周目には、ラインが交差しかけて一時的に5番手までポジションを落とした。「ラウルとあれほど激しいバトルになるとは思っていませんでした。多くのポジションを失い、挽回するのが大変でした。それでも最後は彼に追いつき、追い越し、さらに差を広げるだけのペースがありました。タフなレースでしたが、最高の結果でした」。26周レースの18周目に2番手まで盛り返し、2周後の20周目にはあっさりとトップへ。その後はただ一人1分32秒台のハイペースなラップを刻み続けた。 ランキングも首位と25ポイント差の4位に浮上。日本人選手の誰も成し遂げてない最高峰クラスのチャンピオンが見えてきた。 中日スポーツ,[],[]
「木に嫉妬するのは初めて」前かがみ、ワキ見せ…44歳元NHKキャスター、“あざとポーズ”に「写真めっちゃ良き」「素晴らしいですね」（中日スポーツ）,https://news.yahoo.co.jp/articles/760dffe21c8a8629a56fb77d8ab9100ee611cd90,https://newsatcl-pctr.c.yimg.jp/t/amd-img/20260629-00000051-chuspo-000-2-view.jpg?exp=10800,2026-06-29T12:05:03+09:00,2026-06-29T12:14:03+09:00,中日スポーツ,chuspo,中日スポーツ,396,元ＮＨＫ沖縄放送局キャスターでラジオ沖縄の竹中知華アナウンサー（４４）が２９日、自身のインスタグラムを更新。大木を模した遊具で遊ぶ姿を公開し、フォロワーを喜ばせた。 【実際の投稿】竹中知華アナ、「木に嫉妬するのは初めて」遊具で遊ぶ姿 竹中アナは「おはよう 今日は華華天国担当日 やたたたたたたーーーーー リスナーさんに会えるるるるるるるーーーーー ＃ラジオ ＃沖縄 ＃アナウンサー 」と自身がパーソナリティーを務めるラジオ沖縄「華華天国」（月～金、午後２時３０分）をＰＲして４枚の写真を公開。袖がピンクのボーダーＴシャツ、花柄のハーフパンツ、生脚にスニーカーという姿で大木の遊具からひょっこり顔を出して笑みを浮かべている。 竹中知華アナ フォロワーからは「ともとも、写真めっちゃ良き」「笑顔が素晴らしいですね」「知華さんは元気の源です 木に嫉妬するのは初めて」などの声が並んだ。 中日スポーツ,[],[]
"鎌田大地のゴールで思い出した7年前の言葉「すべてのプレーが予想を覆す」担当スカウトが頭を下げたプロ入り前の""一喝事件""（中日スポーツ）",https://news.yahoo.co.jp/articles/8e8e34a2c83335b7eb95b45f557c618adc29a39d,https://newsatcl-pctr.c.yimg.jp/t/amd-img/20260629-00000048-chuspo-000-2-view.jpg?exp=10800,2026-06-29T11:55:54+09:00,2026-06-29T12:55:53+09:00,中日スポーツ,chuspo,中日スポーツ,995,チュニジア戦で先制ゴールを決め喜ぶ鎌田＝２０日、モンテレイで ◇記者コラム「Free Talking」 いや、確かに…本当だな。サッカーW杯北中米大会で活躍している日本代表MF鎌田大地（29）＝クリスタルパレス＝の得点シーンを見ていて、思わずうなずいてしまった。7年前に聞いた言葉が頭の片隅から呼び起こされたからだった。 【実際の写真】日本代表の『女優妻』も大興奮…薄化粧で別格の美しさ 「すべてのプレーが予想を覆す」 鳥栖のスカウト担当だった牛島真諭さんの“鎌田評”。初戦のオランダ戦では、FW小川航基の強烈なヘディングシュートが鎌田の頭をかすめて劇的な同点弾になり、“鎌田の1ミリ”と話題になった。2戦目のチュニジア戦では、利き足とは逆足の左足ヒールで先制点を奪い、大量4得点の呼び水となった。 1点目は奇想天外、2点目は高難度のゴール。まさに「予想を覆す」プレーだった。さかのぼれば、8大会連続W杯出場を決めたバーレーン戦（2025年3月20日）でもニヒルな笑みを浮かべた。ボールの上をあえてたたきバウンドさせ、GKのタイミングを外してゴール。元ドイツ代表の名手エジルが得意としたシュートを再現した。緻密なエリートとは違う、ストリートの香りがする遊び心を持ったプレーが個人的には大好きだ。 牛島スカウトは「シュートがね。GKが反応してもなぜか入っちゃう。大地のシュートがGKを上回る。タイミングを外す独特のセンスがあるのか」とも言っていた。ただ、予想外はピッチ内だけでない。「人見知り」だった京都・東山高の鎌田が、鳥栖の練習に初参加した時は声も小さく、ある主力選手から「そんな態度なら帰れ」と一喝される“事件”があった。才能にほれ込んだ牛島さんがクラブ幹部に頭を下げ、何とかプロへの道がつながった。 あれから10年余―。鎌田は鳥栖からドイツ、ベルギー、イタリア、イングランドと渡り歩き、自信、たくましさ、賢さを手に入れた。ブラジル戦に向け、日本の司令塔は「攻撃は心配ない」と言い切っている。ガチンコのリング。世界のサッカーファンは、王国有利とみるだろう。でも、日本にはどんな強者を前にしても、いたずら心を持つ鎌田がいる。「予想を覆す」を繰り出せば…。忘れていた言葉がよみがえった今、大番狂わせを期待せずにはいられない。 （2018年サッカーW杯ロシア大会担当、占部哲也） 中日スポーツ,[],[]
