headline,mainEntityOfPage,image,datePublished,dateModified,author,media_en,media_jp,str_count,body,images,external_links
6月30日（火）宮崎の天気（宮崎ニュースUMK）,https://news.yahoo.co.jp/articles/1dd9f3c3899deb83c8478858a56cf0b0cd6ef6b6,https://newsatcl-pctr.c.yimg.jp/t/amd-img/20260629-90033430-umk-000-1-thumb.jpg?exp=10800,2026-06-29T19:30:02+09:00,2026-06-29T19:30:02+09:00,宮崎ニュースUMK,umk,宮崎ニュースUMK,86,テレビ宮崎 （古山圭子気象予報士が解説） 6月30日（火）の宮崎の天気 「梅雨空つづく 体感はヒンヤリ」 古山さんのお天気ポケット （続きは動画をご覧ください） テレビ宮崎,[],[]
約784万円を個人の借金返済に流用　東児湯消防組合の職員を懲戒免職処分（宮崎ニュースUMK）,https://news.yahoo.co.jp/articles/22bc3854718736cf100d4c15d188003e1a76ecca,https://newsatcl-pctr.c.yimg.jp/t/amd-img/20260629-90033437-umk-000-1-thumb.jpg?exp=10800,2026-06-29T19:16:02+09:00,2026-06-29T19:16:02+09:00,宮崎ニュースUMK,umk,宮崎ニュースUMK,253,テレビ宮崎 東児湯消防組合職員の自主的な組織の口座から約784万円を借金の返済に流用したとして、消防職員が懲戒免職処分となりました。 29日付で懲戒免職処分となったのは、東児湯消防組合消防署救急課の40歳の消防士長です。 消防士長は2026年5月までの約9年間、職場環境の改善などを図るための職員組織の口座を不正に管理し、あわせて約784万円を借金返済に流用していました。 6月19日までに全額返済されたということです。 組合では、管理の見直しや職員研修などで再発防止に努めることにしています。 テレビ宮崎,[],[]
暑い夏の救世主！家族みんなで使える熱中症対策グッズ【トレリン】（宮崎ニュースUMK）,https://news.yahoo.co.jp/articles/5f11b67a41cc75605df982d7f350ac0a58288128,https://newsatcl-pctr.c.yimg.jp/t/amd-img/20260629-90033436-umk-000-1-thumb.jpg?exp=10800,2026-06-29T19:16:02+09:00,2026-06-29T19:16:02+09:00,宮崎ニュースUMK,umk,宮崎ニュースUMK,95,テレビ宮崎 トレリンです。 梅雨明けが待ち遠しいですね。 29日は本格的な夏の到来を前に、家族みんなで使える暑さや熱中症の対策グッズをご紹介します。 （続きは動画をご覧ください） テレビ宮崎,[],[]
夏の甲子園宮崎大会を前に　33年ぶりの夢舞台へ　第4シード・小林西（宮崎ニュースUMK）,https://news.yahoo.co.jp/articles/84bafadace0578e4f09d2fb0f183f11822dc20e2,https://newsatcl-pctr.c.yimg.jp/t/amd-img/20260629-90033432-umk-000-2-thumb.jpg?exp=10800,2026-06-29T19:00:02+09:00,2026-06-29T19:05:02+09:00,宮崎ニュースUMK,umk,宮崎ニュースUMK,1074,テレビ宮崎 夏の甲子園宮崎大会が7月4日に開幕します。 第4シードの小林西は、得意の機動力を生かした野球で33年ぶりの夢舞台をめざします。 夏の甲子園宮崎大会第4シードの小林西高校。 過去には、夏の甲子園べスト8の実績があります。 今年のチームは春のセンバツ出場をあと一歩のところで逃していて、「夏こそは甲子園へ」と気合十分です。 （庄司小哲主将） 「これまでいろんな努力をしてきていろんな思いをしてきて、この思いをしっかりぶつけて夏の大会で優勝して甲子園に行けるように頑張る」 小林西の強みは機動力。足の速い選手が多く相手の隙をつく攻撃が持ち味です。 （浅野孝浩監督） 「特に1、2番にはいつでも走れるときには走れと言っている」 攻撃の起点となるのは、1番バッターの志水泰史選手。50m・6秒0の俊足を生かした走塁で相手にプレッシャーをかけます。 2番を打つ庄司小哲主将も、俊足巧打でチャンスを広げます。 （庄司小哲主将） 「自分は塁に出たら次の塁をめざす欲は誰よりも強いと思うので、気持ちで見せるようなプレーでチームを引っ張りたい。必ず勝って甲子園に行きます」 チーム一の長距離砲は3番の児玉哩臥選手。 2年生ながら高校通算10本のホームランを放っていて、プロも注目するスラッガーです。 （児玉哩臥選手） 「最後の先輩たちと（一緒に）戦う大会をしっかり勝ちたい。チームを勝たせるバッティングを心がけてやりたい。（大会では）ホームランを5本打って、得点圏にランナーがいたら全部自分がかえします」 一方、投手陣を引っ張るのは先発マウンドに上がるこの2人。 エースの川原純季投手は制球力が良く、多彩な変化球で打たせて取るピッチングが持ち味です。 （川原純季投手） 「（高校生）最後なので今までやってきたことを全て出し切るだけです。しっかり最後まで完投をめざして、どんな相手でも全力投球でやっていきたい。絶対一番（優勝）を取ってどの高校よりも長い夏にしようと思っている」 そして堤進次郎投手。 一冬を越して急成長した2年生は、最速140キロのストレートとキレのあるスライダーを武器に三振が取れる投手です。 憧れの大舞台をめざす選手たちに浅野孝浩監督は…。 （浅野孝浩監督） 「彼らの夢は実現にということで、自分たちがやっていることを信じて甲子園をめざしてその意気込みで気持ちがそこに集中している。とにかく「甲子園」この3つの文字が実現できるように彼らに期待しています」 夏の甲子園宮崎大会は47校・46チームが出場して7月4日に開幕します。 テレビ宮崎,[],[]
81年前の延岡大空襲で犠牲に　延岡中学校　栗田先生の慰霊祭（宮崎ニュースUMK）,https://news.yahoo.co.jp/articles/f7628c2ee460acc940cc963b3661518d41806ecc,https://newsatcl-pctr.c.yimg.jp/t/amd-img/20260629-90033435-umk-000-1-thumb.jpg?exp=10800,2026-06-29T18:39:01+09:00,2026-06-29T18:39:01+09:00,宮崎ニュースUMK,umk,宮崎ニュースUMK,438,テレビ宮崎 延岡市の中学校では、太平洋戦争の空襲で犠牲となった、教師の慰霊祭が行われました。 太平洋戦争中の1945年、6月29日未明に起きた延岡大空襲では、いまの延岡中学校にあたる安賀多国民学校にアメリカ軍が焼夷弾を投下し、消火活動をしていた栗田彰子先生を直撃しました。 栗田先生は、カナダ生まれで日本語教師になることを目指していましたが、25歳の若さで殉職しました。 黙とう延岡中学校では、毎年慰霊祭を行っています。 29日は全校生徒約290人が参列し、遺族や生徒の代表が栗田先生の肖像画に花を手向けました。 （生徒代表 長友佐弥さん） 「全校生徒で、平和の尊さや戦争の愚かさについて、深く考え、世界平和の実現のために努力することを誓います」 （3年生） 「先輩たちが平和な日本を築いてくれたと思うので、しっかりとそれを無駄にせず生きていくことが僕たちの使命だと思います」 延岡大空襲では、市内の広い範囲が被害を受け、300人以上が犠牲になったとされています。 テレビ宮崎,[],[]
「宮崎で代表を勝ち取ることの方が難しい」大会での連覇を目指す　高千穂町の肥育農家（宮崎ニュースUMK）,https://news.yahoo.co.jp/articles/9eb7abdfb3c3ff058d262896398a69f9508e38a9,https://newsatcl-pctr.c.yimg.jp/t/amd-img/20260629-90033434-umk-000-1-thumb.jpg?exp=10800,2026-06-29T18:39:01+09:00,2026-06-29T18:39:01+09:00,宮崎ニュースUMK,umk,宮崎ニュースUMK,790,テレビ宮崎 前回の全国和牛能力共進会で、日本一となった牛の肥育農家は、脂の質を追求する牛づくりで、来年の大会での連覇を目指しています。 高千穂町で約150頭の宮崎牛を育てる佐藤孝輔さんです。 4年前の全国和牛能力共進会の7区・脂肪の質評価群で首席となり日本一の内閣総理大臣賞にも輝きました。 飼料価格が高騰する厳しい環境のもと来年の全共での連覇を目指しています。 （肥育農家 佐藤孝輔さん） 「国内・世界いろんなところで食べてもらってその流れをうまいこと作りたい。そのための全共になる」 2027年の全共で肉質を競う第6区、第7区、第8区に出品できるのは、県内でわずか8頭。県内ではいま候補牛が80頭まで絞られています。 佐藤さんの牛舎では生まれて9カ月となる4頭が育てられています。 宮崎牛の特徴は、きめが細かく均一に入ったサシで、鹿児島大会では見た目の美しさに加えて、この脂の質が評価されて日本一となりました。 （肥育農家 佐藤孝輔さん） 「人が口に入れた時に、（脂の）融点が低いということ。食べた時にいつまでも脂が残る感じはなくて、さっぱりした脂、食べやすい脂につながる」 全国的に脂の質が注目されるなかで、佐藤さんはトウモロコシや麦などを独自の配分で混ぜたエサで牛の体内のビタミン量を調整しサシの入り方や食味など、肉の質を上げていくといいます。 （肥育農家 佐藤孝輔さん） 「（餌に）こだわってますがね、みんな」 県の代表を決める予選は来年6月に行われます。 （肥育農家 佐藤孝輔さん） 「全国で一番になることよりも、宮崎で代表を勝ち取ることの方が難しいと言われるくらい、県内の宮崎牛の肥育農家はレベルが高い。その中で切磋琢磨しながら代表を勝ち取るのはすごく意味のあること」 チャレンジャーとして高千穂の牛舎から、もう一度日本一を目指す牛づくりが続いています。 テレビ宮崎,[],[]
北海道全共まであと１年　万全な移動態勢へ　今年10月に試験輸送を実施（宮崎ニュースUMK）,https://news.yahoo.co.jp/articles/62e27080cdff370aa42aadc178ee5a9b0a84a6a6,https://newsatcl-pctr.c.yimg.jp/t/amd-img/20260629-90033431-umk-000-1-thumb.jpg?exp=10800,2026-06-29T18:39:01+09:00,2026-06-29T18:39:01+09:00,宮崎ニュースUMK,umk,宮崎ニュースUMK,621,テレビ宮崎 5年に一度の全国和牛能力共進会が2027年8月に開催されます。 2027年の開催場所は北海道です。 宮崎市で開かれた推進協議会の総会では出品牛を北海道までストレスなく移動させるため、今年10月に試験輸送を行う計画が示されました。 （藤崎祐貴アナウンサー） 「和牛のオリンピックとも呼ばれる全国和牛能力共進会まであと1年です。5大会連続の内閣総理大臣賞獲得を目指し対策が話し合われます。」 総会には県やJAなどから約30人が出席しました。 前回、2022年の鹿児島県での全共では宮崎県は肉牛の部・7区で内閣総理大臣賞を獲得しました。 2027年8月の北海道全共には種牛の部と肉牛の部、高校・農業大学校の部の合わせて9つの部門に宮崎県から24頭が出品される予定です。 また、夏の暑さの中北海道まで牛を健康に保ち移動させるため、今年10月には試験輸送を行う計画です。 獣医師も帯同し、家畜運搬車で牛3頭を3日ほどかけて移動させ、適切なルートや休憩場所、健康状態を確認します。試験輸送費として215万円が予算化されています。 （全共県推進協議会 丸山裕次郎会長） 「非常に長い距離、高温の中での移動で牛にストレス、負担がかかってしまう。そしてトラック輸送に関する規制が変わってきているので、このあたりが大きな課題になってくると思います。」 協議会では全ての部門での優等賞首席、5大会連続での内閣総理大臣賞獲得を目指しています。 テレビ宮崎,[],[]
県民の移動手段維持へ　広域的なバスに必要な財政負担　前年度より3000万円増加（宮崎ニュースUMK）,https://news.yahoo.co.jp/articles/860f4f5f61687ca685965afc9d65fcfc384058f9,https://newsatcl-pctr.c.yimg.jp/t/amd-img/20260629-90033438-umk-000-1-thumb.jpg?exp=10800,2026-06-29T18:36:01+09:00,2026-06-29T18:36:01+09:00,宮崎ニュースUMK,umk,宮崎ニュースUMK,404,テレビ宮崎 市町村をまたぐ広域的なバスの維持について検討する会議が開かれました。 運行に必要な県の財政負担が前の年度より増加したことが報告されました。 会議では、宮崎交通が運行する地域間幹線バス19系統について昨年度の赤字額が5億9367万円と前の年度より約8600万円増えたことが報告されました。 地域間幹線バスは来年度も鹿児島交通含めた20系統について国に補助金を申請することが承認されました。 また、コミュニティバスを含む広域的なバスの利用者は昨年度は256万8000人と前年度より約3万人増加し、収支率も0.3ポイント改善しました。 一方で広域的なバスに必要な県の財政負担は、前年度より3000万円増加し2億6000万円となりました。 県民の移動手段を維持するための県バスネットワーク最適化支援基金の事業期間は、今年度までですが県は同じ水準の支援策を来年度以降も検討する方針を示しました。 テレビ宮崎,[],[]
同居する父親の外出中に…自宅に放火した疑い　延岡市の35歳女を逮捕　（宮崎ニュースUMK）,https://news.yahoo.co.jp/articles/18d16e6334fd8f9d17726fa181fe3b8e260219d7,https://newsatcl-pctr.c.yimg.jp/t/amd-img/20260629-90033427-umk-000-1-thumb.jpg?exp=10800,2026-06-29T12:16:02+09:00,2026-06-29T12:16:02+09:00,宮崎ニュースUMK,umk,宮崎ニュースUMK,317,テレビ宮崎 6月28日、自宅に放火したとして宮崎県延岡市に住む35歳の女が逮捕されました。 逮捕されたのは延岡市伊形町の無職・佐藤絢佳容疑者35歳です。 佐藤容疑者は6月28日午後0時30分頃、61歳の父親と2人で住む木造2階建ての自宅に火をつけ、建物の一部を焼損させた現住建造物等放火の疑いが持たれています。 警察によりますと、自宅は2階が激しく燃えていて、出火当時、父親は外出していたため、この火事によるけが人はいませんでした。 事件は、火事の通報を受け、現場に駆け付けた警察官が佐藤容疑者から話を聞くなどする中で発覚しました。 警察の調べに対し、佐藤容疑者は容疑を認めていて警察は犯行の動機などを詳しく調べています。 テレビ宮崎,[],[]
７月３日の海開きを前に　青島海水浴場で水難救助訓練（宮崎ニュースUMK）,https://news.yahoo.co.jp/articles/c3d857fa4baad9f19fe958fff429f4970700b302,https://newsatcl-pctr.c.yimg.jp/t/amd-img/20260629-90033428-umk-000-2-thumb.jpg?exp=10800,2026-06-29T12:13:01+09:00,2026-06-29T18:31:01+09:00,宮崎ニュースUMK,umk,宮崎ニュースUMK,448,テレビ宮崎 海水浴シーズンを前に宮崎市の青島海水浴場で、水難事故を想定した救助訓練が行われました。 訓練は、水難事故が発生した際の迅速な初動体制の確立と、消防など関係機関との連携強化を目的に毎年行われています。 6月29日は宮崎南消防署や宮崎ライフセービングクラブなどから約20人が参加しました。 訓練では、海水浴場で溺れている人を発見したライフセーバーが救助に向かい、海から引き上げた後、心臓マッサージやAEDを使う手順などを確認。そして、到着した救急隊員に発見時の状況や容態を伝えていました。 「海で溺れていて、意識不明の重体になっています」 「溺れた人は何名？」 「1名です」 （宮崎ライフセービングクラブ 宮川颯太さん） 「緊張感をもって迅速な対応を目指して救助にあたれたというのはいい訓練になったと思います。安心して楽しく過ごせるような青島づくりをしていきたい」 宮崎市によりますと、去年1年間の青島海水浴場の利用者は17万2115人で、今年は7月3日に海開きが行われます。 テレビ宮崎,[],[]
