headline,mainEntityOfPage,image,datePublished,dateModified,author,media_en,media_jp,str_count,body,images,external_links
レギュラーツアー初出場の千葉華「脚が疲れないので大丈夫だった」計27ホールも元気いっぱい【女子ゴルフ】（中日スポーツ）,https://news.yahoo.co.jp/articles/10330e6a46535aeb41e5947a88e5da07ba4532b0,https://newsatcl-pctr.c.yimg.jp/t/amd-img/20260629-00000101-chuspo-000-1-view.jpg?exp=10800,2026-06-29T22:41:53+09:00,2026-06-29T22:41:53+09:00,中日スポーツ,chuspo,中日スポーツ,721,レギュラーツアー定着を目指す千葉華 ◇29日 国内女子ゴルフ アースモンダミンカップ最終日（千葉県袖ケ浦市、カメリアヒルズCC） 主催者推薦で今季のレギュラーツアー初出場を果たした千葉華（27）＝エビス物流＝は、最終ラウンドの後半に持ち味を発揮した。 第3ラウンドの9ホールと合わせ、計27ホールをラウンド。59位から出た最終ラウンドは、10番からスタートした前半こそ17番のトリプルボギーなどで41と苦しんだが、「体重が落ちて脚が疲れないので大丈夫だった」と元気いっぱい。後半のアウトは4バーディー、ボギーなしの32と巻き返し、61位だった。 那覇市出身で、通信制のルネサンス豊田高を卒業後の2022年にプロテスト合格。レギュラーツアーはツアー参戦2年目の24年こそ20試合に出たが、昨季は5試合にとどまった。 予選ラウンドは通算23勝の横峯さくら、2週連続優勝を目指した同8勝のイ・ミニョンと同組。「（下部のステップ・アップ・ツアーと比べ）コースセッティングは難しいのに、さくらさんはラフに入れても普通にグリーンに乗せてパーを取る。レベルが高い」と違いを痛感した。 それでも、あこがれるばかりでは実績のある選手を超えることはできない。「うまいなあ、と思ってばかりではいけない。ピンチに強い選手ではなく、チャンスに強い選手になりたい」と前を見る。 約11カ月ぶりのレギュラーツアーは「挑戦と勉強」を目標に掲げ、予選を突破した。「あらためてレギュラーツアーに戻りたいと思った。プロになりたいと思った時の舞台はここだった。そのためにもステップ・アップ・ツアーで優勝して、QT（予選会）に最終から出て上位に入りたい」と決意を込めた。 中日スポーツ,[],[]
サッカーの「シャドー」って何？　お笑いコンビが率直な疑問「昔から使われていたかのように…」（中日スポーツ）,https://news.yahoo.co.jp/articles/0375d9d9b63f14b28007d91f455e6756e7059c9b,https://newsatcl-pctr.c.yimg.jp/t/amd-img/20260629-00000100-chuspo-000-4-view.jpg?exp=10800,2026-06-29T22:12:53+09:00,2026-06-30T01:45:48+09:00,中日スポーツ,chuspo,中日スポーツ,566,練習中、笑顔を見せる堂安（右から２人目）ら お笑いコンビ「ロザン」が29日までにYouTubeチャンネルを更新。W杯北中米大会でサッカーが盛り上がる中、ポジション名についての素朴な疑問を取り上げた。 【実際の写真】日本代表の『女優妻』も大興奮…薄化粧で別格の美しさ サッカー好きの宇治原史規に対して、菅広文が「『シャドー』って何？ 急に出てきて」と質問。「昔から使われていたかのように新聞にもシャドーって書いてある」と続けると、宇治原は「僕もやっていたわけじゃないけど、見ているだけで」とした上で、「守備的MF」とも言われるボランチに対し、「シャドーは攻撃的なMF。サイドじゃなくて内側にいる。だいたい1トップの時に使うのかな。その下に2人いる。それをシャドーっていうのかな」と説明。「英語圏ではもともと言っていたのかもしれないけど、2トップの時に言うかは分からない」とし、「おそらく1トップの『影』だと思う」と「シャドー」の由来についても語った。 一般的に「シャドー」はFWのすぐ下で攻撃的にプレーするMFを意味し、ゲームメークする司令塔より、得点することに近い役割をこなす選手を指す。日本代表では久保や前田、堂安らが務めている。近年では「インサイドハーフ」「アンカー」など比較的新しいポジション用語も使われている。 中日スポーツ,[],[]
【W杯】本田圭佑、FW塩貝健人のブラジル代表への”発言”に言及　”勝つ確率”の観点から「いい方向には転ばなさそう」と私見も『かつてとの比較』では同意（中日スポーツ）,https://news.yahoo.co.jp/articles/0a3fead1d4ac85e73ad3582881780768d3808d46,https://newsatcl-pctr.c.yimg.jp/t/amd-img/20260629-00000099-chuspo-000-3-view.jpg?exp=10800,2026-06-29T21:45:53+09:00,2026-06-30T01:28:01+09:00,中日スポーツ,chuspo,中日スポーツ,1230,本田圭佑 サッカーＷ杯北中米大会の日本戦解説が話題の元日本代表ＭＦ本田圭佑（ジュロン）が２９日、自身のＹｏｕＴｕｂｅチャンネルで生配信。日本の決勝トーナメント１回戦・ブラジル戦を前に、物議を醸しているＦＷ塩貝健人（２１）のブラジルについての発言について言及した。 【実際の投稿】塩貝健人のインスタグラムにポルトガル語でのコメントが殺到 塩貝がブラジル代表について「昔はすごく強かったけど、今はどうなんですかね」と語り、「強いことには変わりない。本当に『ベスト３２でこのカードか』というところはあるけど、ブラジルを倒せば勢いよくいける」と話したが、塩貝のＳＮＳにはブラジル人からとみられるコメントが相次ぎ、海外メディアは「昔はすごく強かった」とのコメントを取り上げた。ブラジルのアンチェロッティ監督は前日会見でブラジルのメディアから塩貝の発言について聞かれ、「我々は、ある選手の発言について何も言わない。そういうことに反応するのは危険だ。心理戦には応じない」と”スルー”した。 本田は「１％でも日本が勝てる確率が上がるのか、上がらないのか」という観点から、「いい方向には転ばなさそうな気がする」と指摘。「向こうが挑発と捉えられて、より謙虚にしたたかにやってくることを考えると、油断してくれる方が間違いなくいいと考えたときに、いい方向には進まないだろうと思う」と私見を示した。 一方で発言については「コメントそのものはどうでもいいかな。エンタメの一つでしょうし。周りが騒ぐのは勝手。実際、ブラジル人がどんなに怒ろうと、日本のサッカーファンからしても、サッカーファンじゃない人からしても、ブラジルの選手で知っている名選手が減っているのは事実。僕もなんとなくちゃんと分かるのはビニシウスくらい。もちろんカゼミロもいますけど。それ以外も全員ブラジル人なんで、全員すごいんですけど、かつてのブラジルと比較すると、率直に落ちているという表現をしたとしても仕方ないと思う」と塩貝のコメントに同意。「なめているとか、なめてないという話じゃない」とし、「塩貝さんのタイプ的に相手を傷つけようとして言っているというよりは自分のスタンスを貫くことにとにかく集中しているイメージ。それを周りがどうこういうのは、言い方悪いけど、無知な子どもに無知なことをめちゃめちゃ叱っているみたいな」。さらに「それが塩貝さんの良さで、あまり余計なことを知る必要もない。それが自信につながっているでしょうから、むしろできるだけ無知でいるべき。無知でどこまで行けるかの勝負。サッカー選手としてどこまで行けるかと考えたときに、鼻をへし折られずに行けるところまで行った方がいいに決まってる。余計な一般常識を知っている大人たちが不必要に一般常識を教える必要はない。黙って、強気な若手をのびのびと見守ってあげるってことが大事」とプレーヤー視点から語った。 本田はＮＨＫ ＢＳの試合中継で解説を務める。 中日スポーツ,[],[]
小祝さくら、トップ10に２打及ばず「もったいないところあった」ショットとパッティングがかみ合わず【女子ゴルフ】（中日スポーツ）,https://news.yahoo.co.jp/articles/ff1aef238667695845fa751e7649a8e60c56cb2c,https://newsatcl-pctr.c.yimg.jp/t/amd-img/20260629-00000098-chuspo-000-2-view.jpg?exp=10800,2026-06-29T21:40:53+09:00,2026-06-29T21:57:35+09:00,中日スポーツ,chuspo,中日スポーツ,475,小祝さくら ◇29日 国内女子ゴルフ アースモンダミンカップ最終日（千葉県袖ケ浦市、カメリアヒルズCC） ◆小祝さくら、スマイル…まるでブロマイド【写真複数】 小祝さくら（28）＝ニトリ＝は今季初のトップ10入りを惜しくも逃した。第3ラウンドの13番から計24ホールを回り、13位から出た最終ラウンドは6バーディー、4ボギーの70でスコアを伸ばしたものの、10位以内には2打及ばず12位だった。 「良かったり悪かったりで、ちょっともったいないところもあった。悔しいなというのはある」 ショットとパッティングがかみ合わず、攻撃的なゴルフを誓っていたが「50点。攻めたら攻めたでピンチになったりもした。一打の重みを感じた試合だった」と思い通りのプレーができなかったようだった。 今大会から5週連続で4日間大会が続く。「その初戦が5日間大会になった。夏の暑さで体力勝負にもなる」。7月9日に開幕するミネベアミツミレディス北海道新聞カップは出身の北海道で開催される。今週の資生堂・JALレディスは満点に近い内容でプレーし、気持ち良く帰郷したい。 中日スポーツ,[],[]
【女子ゴルフ】ルーキー倉林紅、バースデー逆転Ｖならず　変則５日間の日程に「気持ちも体力も集中できなかった」（中日スポーツ）,https://news.yahoo.co.jp/articles/05631b14e5467139021c590f969bfb14c7935dbc,https://newsatcl-pctr.c.yimg.jp/t/amd-img/20260629-00000097-chuspo-000-2-view.jpg?exp=10800,2026-06-29T21:15:53+09:00,2026-06-29T21:39:27+09:00,中日スポーツ,chuspo,中日スポーツ,789,倉林紅 ◇29日 国内女子ゴルフ アースモンダミンカップ最終日（千葉県袖ケ浦市、カメリアヒルズCC） 21歳の誕生日に逆転でツアー初優勝を目指したルーキーの倉林紅（サーフビバレッジ）は最終ラウンドの後半にスコアを崩し、通算2アンダーで23位。中止を挟んだ5日間を振り返り「（変則日程など）やったことがなかったし、気持ちも体力も集中できなかった。最後は少し気持ちが切れかけた」と苦笑いを浮かべた。 最終日は第3ラウンドの7番から計30ホールを回った。首位と3打差の8位で最終ラウンドに入ったが、後半はバーディーなしで3ボギーの39で優勝争いから脱落。1987年の谷福美（通算11勝）、99年の安井純子（同15勝）、2001年の不動裕理（同50勝）、08年の上田桃子（同16勝）、09年の全美貞（同25勝）と有村智恵（同14勝）、12年のフォン・シャンシャン（同5勝）、16年のイ・ボミ（同21勝）、19年の申ジエ（同29勝）に続く10人目の誕生日優勝はならなかった。 それでも、優勝争いで貴重な経験を得た。第3ラウンドから組み替えなしの変則ながら「最終日最終組」で優勝した朴炫径と、優勝経験のある阿部未悠と同組。予選ラウンドは通算4勝の永峰咲希と同組だった。 「優勝する人は決めなきゃいけないパッティングが入ったり、ミスをミスで終わらせないマネジメントをしている。どんな状況でも淡々とプレーする大切さを学んだ」。最終日に追い上げ、自己最高の2位に入った6月上旬のヨネックス・レディスに続く上位争いで「優勝したい気持ちが強くなったし、目標が明確になった」と目を輝かせた。 史上初の”バースデー初優勝”はならなかったものの、収穫は大。「せっかくの誕生日だし、ご褒美として何かおいしいものを食べたい」と残念会を兼ねた誕生日でエネルギーを蓄え、あらためてツアー初優勝に挑む。 中日スポーツ,[],[]
W杯・日本VSスウェーデン戦が平均世帯視聴率35％を記録　今年放送されたテレビ番組の中で最高値（中日スポーツ）,https://news.yahoo.co.jp/articles/47c71a3e1a9269a1822d151ddcf420a6a9c9a523,https://newsatcl-pctr.c.yimg.jp/t/amd-img/20260629-00000096-chuspo-000-3-view.jpg?exp=10800,2026-06-29T21:10:53+09:00,2026-06-29T21:38:06+09:00,中日スポーツ,chuspo,中日スポーツ,276,スウェーデン戦でゴールを決めて喜ぶ前田大然（右下）ら日本代表メンバー 26日にNHK総合で放送された「FIFAワールドカップ2026・日本×スウェーデン」（午前8時、129分）の番組平均世帯視聴率（関東地区）が、2026年に放送された番組の中で最高値となる35％を記録したことが29日、ビデオリサーチの調べで分かった。 【実際の動画】日本代表・森保監督、スウェーデン戦前のファン決起集会にサプライズ登場 なお、関東地区の毎分最高視聴率は次の通り。個人は21．5％（午前8時45分、同46分、同47分）、世帯は37．8％（午前8時47分）。 中日スポーツ,[],[]
モデルのUTAが難役で俳優デビュー「今までの人生でやってこなかったことをいろいろ経験」　Netflixシリーズ「ガス人間」　父は本木雅弘　芸能一家（中日スポーツ）,https://news.yahoo.co.jp/articles/7fb36df524d941034d516e4d577a061b6ac3abef,https://newsatcl-pctr.c.yimg.jp/t/amd-img/20260629-00000095-chuspo-000-1-view.jpg?exp=10800,2026-06-29T21:05:54+09:00,2026-06-29T21:05:54+09:00,中日スポーツ,chuspo,中日スポーツ,588,あいさつするUTA モデルのUTA（28）が29日、東京都内で行われたNetflixシリーズ「ガス人間」（全8話）の配信記念イベントに登壇。本作で演技初挑戦＆俳優デビューとなった心境を明かした。 1960年に公開された東宝の伝説的映画「ガス人間第一号」を完全オリジナルストーリーのドラマシリーズとしてリブート。連続殺人予告を仕掛ける恐怖のガス人間に立ち向かう人々の姿を描く。映画「岬の兄弟」「さがす」で知られる片山慎三監督がメガホンをとる。ガス人間を追う主人公の刑事は小栗旬（43）が演じる。 UTAは、本木雅弘・内田也哉子夫妻の長男で、祖父はロックスター・内田裕也さん、祖母は名優・樹木希林さんという芸能一家で育ち、189センチという長身を生かし、モデルとして活躍してきた。 本作が演技初挑戦＆俳優デビューとなるUTAに用意されたのは、日本を震撼（しんかん）させるガス人間という難役。今回のイベントのオープニングでは「ガス人間」として幻想的なスモークの中、会場を練り歩く演出で作品の世界観を伝えた。 UTAは今回の抜てきを「本当に今までの人生でやってこなかったことをいろいろ経験した」と語り、「毎日が勉強会。皆さんのストイックさ、現場での立ち振る舞い方…いろいろ学んだ。撮影は2年半ぐらい前だが、幸せなチームで撮影できた」と、役者として踏み出した一歩を喜んだ。 中日スポーツ,[],[]
小栗旬「いつもたどり着いたときには事件が終わってしまっている」刑事役の人間味ある魅力アピール　Netflix「ガス人間」配信記念イベント（中日スポーツ）,https://news.yahoo.co.jp/articles/4058aa65ee54883e707a56fae6057d78b0e18483,https://newsatcl-pctr.c.yimg.jp/t/amd-img/20260629-00000094-chuspo-000-2-view.jpg?exp=10800,2026-06-29T20:55:53+09:00,2026-06-29T21:47:17+09:00,中日スポーツ,chuspo,中日スポーツ,700,Netflixシリーズ「ガス人間」配信記念イベントに登場した小栗旬 俳優の小栗旬（43）が29日、東京都内でNetflixシリーズ「ガス人間」（7月2日から世界独占配信、全8話）の配信記念イベントに共演の蒼井優（40）、広瀬すず（28）、UTA（28）ら豪華キャストと登壇した。 ◆小栗旬が演じる織田信長のビジュアル【実際の投稿】 1960年に公開された東宝の伝説的映画「ガス人間第一号」を東宝とNetflixがタッグを組み、完全オリジナルストーリーのドラマシリーズとしてリブート。連続殺人予告を仕掛ける恐怖のガス人間に立ち向かう人々の姿を描く。 映画「新感染 ファイナル・エクスプレス」など話題作を生み出し続けるヨン・サンホ氏が脚本を担当、映画「岬の兄弟」「さがす」で知られる片山慎三監督がメガホンをとる。 「ガス人間」配信記念イベントに登壇した（左から）広瀬すず、小栗旬、蒼井優 主人公で捜査一課の警部補・岡本賢治を演じた小栗は役柄について「正義感はあるんですけど、ちょっと抜けているようなところもある」と説明。「刑事として追いかけている事件よりも物事が先に進んでいくので、いつもたどり着いたときには事件が終わってしまっていることが多い。毎回たどり着けない賢治というのが、ひとつの面白い部分だと思います」と人間味のある魅力をアピールした。 最後に小栗は「この作品は、どのジャンルって言えばいいのか分からない内容になっていて、多種多様なお話。見た皆さんもどういう風に説明すればいいんだろうって思っていただけるものになっている。それをどう受け止めてくれるのか楽しみです」と期待を寄せた。 中日スポーツ,[],[]
『キューティフル』パク・ヒョンギョン、「人生初」5日間の戦い制し日本初V！異例の月曜決着「気持ちで打ち勝つことができた」【女子ゴルフ】（中日スポーツ）,https://news.yahoo.co.jp/articles/95162d63b940a593ba14d172182594eb7b37b8a4,https://newsatcl-pctr.c.yimg.jp/t/amd-img/20260629-00000093-chuspo-000-2-view.jpg?exp=10800,2026-06-29T20:49:53+09:00,2026-06-29T21:42:21+09:00,中日スポーツ,chuspo,中日スポーツ,818,パク・ヒョンギョン ◇２９日 国内女子ゴルフ アースモンダミンカップ最終日（千葉県袖ケ浦市、カメリアヒルズＣＣ） ◆”キューティフル”パク・ヒョンギョン、初めての日本ツアーで笑顔【写真】 順延となった第３ラウンドの残りと最終ラウンドが行われ、主催者推薦で出場した韓国ツアー通算８勝の朴炫径（パク・ヒョンギョン）＝韓国＝が最終ラウンドを６８で回り、通算１２アンダーで優勝した。キューティーとビューティフルをかけ合わせた「キューティフル」が愛称の２６歳。１年間以上も優勝から遠ざかっていたが、来日直前に亡くなった祖母へ久々の優勝をささげた。１打差の２位は小林光希（２４）＝三徳商事＝と稲垣那奈子（２５）＝三菱電機＝だった。 ２日間で計５４ホールを回った体力勝負を乗り切り、最後までもつれた優勝争いを制した朴炫径は「５日間の競技は人生初。体力的に大丈夫かなと思ったが、気持ちで打ち勝つことができた」とほほ笑んだ。 最終日は第３ラウンドの７番から計３０ホールを回った。最終ラウンドは１打リードの単独首位だった１６番パー４で深いラフからの第２打をグリーンに乗せ、パーをセーブ。事実上の一騎打ちとなった稲垣を振り切った。 来日直前の２０日に、かわいがってくれた父方の祖母が亡くなった。「（亡くなった）施設では枕元に私がプレーしている写真が飾ってあった。おばあちゃんが奮い立たせてくれた」。コースに白いチョウが飛んでいるのを見て、キャディーの父と「おばあちゃんが舞い降りてきてくれたよ」と話したという。 ゴルフの腕前やルックスから「イ・ボミ２世」と呼ばれることも多いが、「ボミ先輩は常にあこがれの存在で、私からほど遠い位置にいる。（２世の称号が）私でいいんですか、と感じている」と恐縮する。今回の優勝で日本ツアーの出場権を獲得。今後については「韓国での目標もあるし、ゆっくりと考えたい」と話す。日本ツアーでも人気選手になるかもしれない。 中日スポーツ,[],[]
「安心してください、幸せになれますよ」とにかく明るい安村　亀梨和也と田中みな実に祝福メッセージ　「THE TOKYO IDIOTS」がコメディーショー開催（中日スポーツ）,https://news.yahoo.co.jp/articles/19cbae04e0c90a2dd881304324445f9dcf1ed8b0,https://newsatcl-pctr.c.yimg.jp/t/amd-img/20260629-00000092-chuspo-000-3-view.jpg?exp=10800,2026-06-29T20:45:53+09:00,2026-06-29T21:54:48+09:00,中日スポーツ,chuspo,中日スポーツ,648,（左から）有馬徹、太田隆司、ウエスP、とにかく明るい安村、市川こいくち 体を張ったパフォーマンスと簡単な英語で海外向けのステージにも多く出演する、お笑い芸人のユニット「THE TOKYO IDIOTS」が29日、東京・六本木で、コメディーショー「Yoshimoto Comedy Night OWARAI×HUB」を開催した。 ◆とにかく明るい安村、さまざまなポーズができるフィギュア【写真】 ユニットは、とにかく明るい安村（44）、ウエスP（38）、市川こいくち（45）がメンバー。六本木で定期的に外国人向けのライブを続けており、この日は会場でもある英国風パブ「HUB」とのコラボドリンクの発売も記念して開催した。 安村は、決めセリフの「安心してください、履いてますよ」を「Don’t worry，I’m wearing」と英語で連発して外国人客に大受け。海外でチケットが完売するなど、ユニットが受けている状況に「この3人で、世界に向けて配信する番組を作りたい」と夢を明かす一方で、「実は、英語は全然勉強していなくて。ショーの曲の中にAIで英語のナレーションを入れちゃうんです」と明かした。 また、この日結婚を発表した亀梨和也と田中みな実について聞かれると「さっき見ました」と答え、「安心してください。幸せになれますよ」「めでたいことだ」と自身のネタにかけて、共演経験のある2人に祝福メッセージを送った。 この日はお笑いコンビ「いぬ」の太田隆司（38）、有馬徹（38）も出演した。 中日スポーツ,[],[]
