headline,mainEntityOfPage,image,datePublished,dateModified,author,media_en,media_jp,str_count,body,images,external_links
【北九州記念】昨夏小倉で2連勝したフリッカージャブ重賞初Vへ　西園師「もう一度小倉を使いたいと思って」（中日スポーツ）,https://news.yahoo.co.jp/articles/5f52ac52f0cd7faf8e508ba2a3eaf3f7724d3e8c,https://newsatcl-pctr.c.yimg.jp/t/amd-img/20260629-00000080-chuspo-000-2-view.jpg?exp=10800,2026-06-29T19:00:54+09:00,2026-06-29T19:24:17+09:00,中日スポーツ,chuspo,中日スポーツ,932,フリッカージャブ サマースプリントシリーズ第2戦の「第61回北九州記念」（G3・7月5日・小倉・芝1200メートル）で、快速フリッカージャブ（牡4歳、栗東・西園）が重賞初Vを狙う。前走の鞍馬Sで京都芝1200メートルのレコードタイムを更新。序盤から積極的に飛ばしても、最後まで勢いが衰えない希代のスピード馬だ。夏の小倉は昨夏に2連勝した相性のいい舞台。平たん小回りを味方に、一気に押し切る。 【画像】北九州記念登録馬 京都芝1200メートルのレコードホルダーが思い出の小倉で、さらなる飛躍を目指す。「去年、小倉で勝った時に、もう一度小倉を使いたいと思っていた」（西園師）。フリッカージャブにとって、狙いすましての北九州記念参戦だ。 昨夏の小倉では1勝クラスと耶馬渓特別（2勝クラス）を連勝。1勝クラスを2着に6馬身差で圧勝すると、昇級戦も2着に2馬身半差で楽々と逃げ切った。続く北陸S（新潟）も勝って3連勝と、一気にオープンまで登り詰めた。主戦の松山は「とにかく脚が速い」と評する。 その快速ぶりを存分に発揮したのが前走の鞍馬Sだった。好スタートから飛び出すと、最初の1Fを通過するころには時速70キロをマーク。その後、いったん2番手に控えたが、ラスト1F過ぎで抜け出すと、余裕で押し切った。勝ち時計の1分6秒4はヘニーハウンドが2014年のオパールSでマークした1分6秒7を12年ぶりの更新するコースレコード。「この馬のいいところはスタートが早く、速いラップを刻んでいっても最後まで止まらないところ」。西園師の言葉通り、他馬を圧倒する走力を持っている。 一流のスプリンターには筋肉隆々が多いが、フリッカージャブもレースを使うごとにたくましさを増してきた。2歳秋の新馬戦（2着）はわずか466キロだったが、昨夏の耶馬渓特別では490キロにバルクアップ。その後も1走ごとに体重は増え続け、鞍馬Sでは510キロに達した。パドックを見ても、胸前やトモの隆起が以前とはまったく違っていた。「使いながら体重が増えているのは成長分。秋にはG1へ行きたいと思っている」。西園師は今やスプリンターSを見据える。そのためにはまずは北九州記念で重賞のタイトルを獲りたい。 中日スポーツ,[],[]
「久保欠場」が影響か…直前の勝ち上がりオッズは日本人気ダウンで約3・5倍、ブラジル1・3倍。優勝オッズは日本15番人気で約55倍【Ｗ杯】（中日スポーツ）,https://news.yahoo.co.jp/articles/660c551372a9a118d1b0193da21e904779cc8000,https://newsatcl-pctr.c.yimg.jp/t/amd-img/20260629-00000079-chuspo-000-1-view.jpg?exp=10800,2026-06-29T18:56:53+09:00,2026-06-29T18:56:53+09:00,中日スポーツ,chuspo,中日スポーツ,657,別メニューで調整する久保建英 サッカーのW杯北中米大会に出場する日本代表は米中部時間29日正午（日本時間30日午前2時）、アメリカのヒューストンでブラジルと決勝トーナメント1回戦で激突する。 【実際の写真】日本代表の『女優妻』も大興奮…薄化粧で別格の美しさ 米大手スポーツブックのドラフトキングス、ファンデュエル、ベットMGM、シーザーズなどは28日（同29日）、W杯の各オッズを更新。森保一監督が前日会見でMF久保建英（レアル・ソシエダード）について「ブラジル戦はプレーできない」と明言した影響か、日本の人気が微妙に低下している。 延長とPKも含めた「勝ち上がりオッズ」は日本が3・4～3・5倍、一方のブラジルは1・31～1・32倍となっている。ちなみに、26日時点で日本は3・25～3・3倍だった。 一方、現時点での「90分勝利オッズ」は、日本5・2～5・5倍、ブラジル1・69～1・71倍。これは26日時点で日本が4・9～5倍だった。 これとは別に「優勝オッズ」を見ると、日本は15番人気の55～56倍で、ブラジルは6番人気で14～14・5倍となっている。 優勝オッズの1番人気はフランス（4・5倍）。以下はアルゼンチン（5倍）、イングランド（7・5倍）、スペイン（7・5～8倍）、ポルトガル（13倍）。ブラジルと日本の間にはオランダ（16～17倍）、ドイツ（19～21倍）、コロンビアとノルウェー（34～36倍）、米国（35～36倍）。さらにモロッコ、ベルギーとメキシコが51倍で並んでいる。 中日スポーツ,[],[]
【W杯】闘莉王さん、親善試合の勝利は「あてにならない」「選手が全然違う」ブラジルの要警戒ポイントも挙げる（中日スポーツ）,https://news.yahoo.co.jp/articles/e849d399c67a188d0beb28b27a2288b3e2aa4aa2,https://newsatcl-pctr.c.yimg.jp/t/amd-img/20260629-00000078-chuspo-000-2-view.jpg?exp=10800,2026-06-29T18:55:53+09:00,2026-06-29T18:56:48+09:00,中日スポーツ,chuspo,中日スポーツ,507,ブラジル戦に向けて最終調整する日本代表イレブン サッカー元日本代表ＤＦの田中マルクス闘莉王さんが、２９日までに自身のＹｏｕＴｕｂｅチャンネルに動画を投稿。Ｗ杯北中米３カ国大会で日本が２９日（日本時間３０日未明）の決勝トーナメント１回戦で対戦するブラジルについて熱弁した。 【実際の投稿】闘莉王さんと…誰が誰だか！？元日本代表との”激変”スリーショット 日本はブラジルと昨年１０月に親善試合で対戦。前半に２点を奪われたが、後半に相手のミスも絡んで南野、中村、上田が得点し、３―２で逆転勝ちした。それでも、闘莉王さんは「親善試合はあくまで親善試合。あれはあてにならない」ときっぱり。「あの試合で何回かミスしたブラジルのＣＢもいない。ＧＫも違う。選手が全然違う」とメンバーが大きく変わっていることに触れ、「本番は本番です。親善試合とは比べものにならない。何かの分析になるとか、何かのあてになることはない」と参考にはならないと強調した。 その上で、ブラジルの要警戒ポイントに言及。「ブラジルのセットプレーは要注意。カゼミロ、マルキーニョス、ガブリエル。（今大会の得点は）ないけど、形は持っている」と説明した。 中日スポーツ,[],[]
「男性同士のプライドやマウント意識が影響」にしたん西村社長　「青汁王子が溝口勇児に怒ってる件」にもの申す（中日スポーツ）,https://news.yahoo.co.jp/articles/33c2ebe49005debad93224d5951c0d128904beb5,https://newsatcl-pctr.c.yimg.jp/t/amd-img/20260629-00000077-chuspo-000-1-view.jpg?exp=10800,2026-06-29T18:40:53+09:00,2026-06-29T18:40:53+09:00,中日スポーツ,chuspo,中日スポーツ,641,一連の騒動について見解を語る西村社長 「にしたんクリニック」の西村誠司社長が29日、自身のTikTokを更新。実業家の三崎優太氏と溝口勇児氏がX（旧ツイッター）上で相互批判している騒動について思いを語った。 ◆三崎優太さん、14億4000万円の納付税額確認書【写真】 西村社長は、騒動の本質は「サナエトークン問題」ではなく、三崎氏と溝口氏、堀江貴文氏の3人を軸に展開されてきたビジネスプロジェクト「REAL VALUE」から得られる収益・権利（利権）の配分にあるとの見方を示し、「REAL VALUE」で三崎氏が得ていた権利を巡る問題が対立の大きな要因ではないかと分析した。 三崎氏が「理不尽」と主張する一方で、西村社長は「もし権利がそのままだったとしても、今のような告発をしていただろうか」と疑問を呈し、三崎氏の溝口氏に関する一連の暴露には「正義感だけではなく、自身の利益が失われたことへの怒りも背景にあるのではないか」と私見を語った。 溝口氏の反応についても「（元交際相手で三崎氏の妻）てんちむさんを巡る感情ではなく『自分の方が力を持っている』という男性同士のプライドやマウント意識が影響している可能性がある」と推測。 今回の騒動は「どちらが影響力や力を持っているか」を巡るプライドのぶつかり合いという構図ではないか、とした。 西村社長は「どちらか一方が正しいというより、どっちもどっちという印象」とコメント。今後も「両者の動向に注目していきたい」と締めくくった。 中日スポーツ,[],[]
長友佑都も「圧倒的」と称賛する”日本代表007”　情報戦がものをいう現代サッカー、筑波大・東大の学生も協力　相手の監督交代にも即対応（中日スポーツ）,https://news.yahoo.co.jp/articles/fba3449521b3dda39db2ecc6d8ddb48f79abb3d8,https://newsatcl-pctr.c.yimg.jp/t/amd-img/20260629-00000076-chuspo-000-2-view.jpg?exp=10800,2026-06-29T18:37:53+09:00,2026-06-29T18:39:16+09:00,中日スポーツ,chuspo,中日スポーツ,1152,日本―オランダ 後半、ボードで日本代表の選手たちに指示を出すコーチら。右端は森保監督 サッカーW杯北中米3カ国大会で、日本が自国開催だった2002年大会以来となる1次リーグ無敗突破を果たした陰には、相手チームを丸裸にする分析班の存在もあった。前回のW杯カタール大会での反省を出発点に質、量とも増強した「日本版007」が森保ジャパンの財産になっている。 【実際の写真】日本代表の『女優妻』も大興奮…薄化粧で別格の美しさ 「決勝戦まで太くて濃い矢印を引けていたのかどうか。反省としてはあった」。分析班をまとめ上げるチーフ格の寺門大輔さん（51）は、2度目のW杯となった前回カタール大会の経験をそう振り返る。現代サッカーでは戦いはピッチ内にとどまらず、情報戦がものをいう。W杯のような短期決戦の大舞台となればなおさらで、対戦相手の監督の戦術や性格、選手選考、PK戦のキッカーやGKの傾向など事前の分析も勝敗を左右する一因となる。 その意味では「前回は目の前の一戦一戦に最大限の力を結集して戦うイメージだった」と寺門さん。右腕の中下征樹さん（40）との2人体制では先回りして分析を進めていくことはマンパワー的にも限界があった。48チームに拡大され、1次リーグ3位通過もある今大会に向けて反省は生かされ、分析担当は4人に倍増。スペイン1部の名門セビージャでアナリストを務めていた若林大智さん（43）と、主にセットプレーの分析を担当する渡辺秀朗さん（27）が加わった。 「勝ち進んでも同じクオリティーで同じサポートが選手や監督にできる体制を作ってきた。それぞれの強みを生かして準備してきた」と寺門さん。さらに分析には筑波大と東大の学生約50人に協力をあおぎ、W杯出場全48チームの映像分析や情報収集も進めた。プレーの特徴や長所、弱みが表れたシーンを切り取ってもらい分析班の仕事に役立てた。W杯5大会連続出場のDF長友佑都（FC東京）は「緻密な分析と落とし込みは過去の大会の中でも一番。ここまで細部を詰めているチームはなかなかない。圧倒的です」と絶賛した。 実際、1次リーグ第2戦で対戦したチュニジアは直前に監督が交代したが、サウジアラビアを率いていた後任のルナール監督が日本との対戦経験があったことからすぐに対応した。混乱することなく事前に「5バック」で来ると予想。落ち着いて臨んだチームはW杯では最多となる4得点で快勝した。 今大会は全試合で「ハイドレーションブレーク（給水タイム）」が採用され、試合の前後半途中にW杯では初めて「3分間」の休息が入ったが、「チームの戦い方の修正、共有の時間。チームの戦い方を意思統一する時間にも使っている」と森保監督。分析班がもたらす情報は、ここでも生かされている。 中日スポーツ,[],[]
メジャー初救援の千賀滉大に「２ランを被弾したが未来は明るいと思わせてくれる投球。“お化けフォーク”もここ数カ月で一番良かった」と米解説者（中日スポーツ）,https://news.yahoo.co.jp/articles/d523db4ee9ba0839287cf3baab13863891873a6b,https://newsatcl-pctr.c.yimg.jp/t/amd-img/20260629-00000075-chuspo-000-1-view.jpg?exp=10800,2026-06-29T18:06:53+09:00,2026-06-29T18:06:53+09:00,中日スポーツ,chuspo,中日スポーツ,1197,メッツ・千賀滉大（ＡＰ） ◇２８日（日本時間２９日） ＭＬＢ メッツ４―５フィリーズ（ニューヨーク） メッツの千賀滉大投手（３３）は地元のフィリーズ戦で、メジャー４年目にして初のリリーフ登板。５回から３番手でマウンドに登ると、５イニングを４安打２失点で、７敗目（０勝）を喫した。８０球で４奪三振、１四球。試合はメッツが逆転負けし、今季３５勝４９敗。ナ東地区首位ブレーブスとは１５ゲーム差の最下位に沈んでいる。 ◆千賀滉大 6回5奪三振【動画】 千賀は５回に登板すると、シュワバーを宝刀フォークで空振り三振に切って取るなどターナー、シュワバー、ハーパーの屈強トリオを三者凡退にピシャリ。６回も無死二、三塁のピンチを無失点で切り抜けた。 だが７回１死一塁、シュワバーとの再対決はフォークを４球続けた後、外寄り低め１５５キロの直球をセンター右に運ばれ、３０号逆転２ランを被弾。ベテラン右腕はのけぞって天を仰ぐと、着弾点を見詰めたまま口を真一文字に引き結んだ。 地元中継局ＳＮＹのロン・ダーリング解説者は「フォークを続けた後に直球でチャレンジするのはいい。だが、１ボール２ストライクからストライクゾーンに、特に低めへ投げるのはいただけないな。ボール球を振らせるべき大事な場面だし、シュワバーは球界屈指のパワーヒッターだからね。これで３０本にメジャー一番乗りか？ すごいな」と首を振った。 それでも、試合後は「たとえ２ランを被弾しても、千賀は将来が明るいと思わせてくれる投球だった。２ラン以外に傷口を広げなかったし、お化けフォークも間違いなくここ数カ月で一番良かった」と高評価。さらに「これは彼にとってチャンスかもしれない。直球とお化けフォークという２種類の武器で屈指のリリーバーになれる可能性がある」と期待した。 千賀のフォーク使用率はシーズン２３％に対し、この日は３６％（２１球）と大幅アップだった。 一方、トッド・ジール解説者は試合前、「千賀のリリーフ起用は興味深いね。これがうまくいくかどうかは分からない。これまで彼には困惑させられてきたからね。ブルペンを任せてみるというアイデアには賛成だが、リリーバーとしての準備は先発と全く違う。そこが問題だ」とコメント。 また、「コーダイ（千賀）は肉体面だけではなく精神面と戦っている。そこが安定感に欠ける上で最大の問題だ。前回登板もそうだったが、リズムが崩れるとマウンドでフラストレーションをあらわにする。そうなると、四球、大きく外れるボール、そして甘くなったところにアーチをドカン。全てがおじゃんだ。その後はベンチでシャドーピッチングする姿も見られた。これは、私に言わせれば肉体とメンタルがリンクしていない証左だ。彼は自分の考えに没頭してしまい、そこから抜け出せないときがある。そこをどう切り替えるかだね」と分析していた。 （写真はＡＰ） 中日スポーツ,[],[]
【取手競輪】前回決勝は落車で特別昇班ならなかった杉浦颯太　今回こそと強い気持ちで、骨折を押して大事な一戦に臨む（レインボーカップ）（中日スポーツ）,https://news.yahoo.co.jp/articles/d3a8e91ecb170e008c2cfa41f7650272fcf09dae,https://newsatcl-pctr.c.yimg.jp/t/amd-img/20260629-00000073-chuspo-000-1-view.jpg?exp=10800,2026-06-29T17:56:03+09:00,2026-06-29T17:56:03+09:00,中日スポーツ,chuspo,中日スポーツ,342,杉浦颯太 ◇29日 水戸黄門賞（取手競輪） 絶対に昇班してみせる。3着までに入るとA級2班に特進できる最終日9Rのレインボーカップチャレンジファイナルを前に、落車負傷明けの127期・杉浦颯太が闘志満々だ。特別昇班が懸かった前回の大宮（F2）決勝では内海雅夫と接触し落車（再入7着）。 「本当は連勝して特昇したかったけど、チャンスをものにできずここまできてしまった」と悔しさをにじませた。そのレースで左鎖骨を骨折。ワイヤーを入れた状態でこの一発勝負に臨む。 「特昇を逃すと来期は129期の選手たちと一緒にチャレンジを戦うことになるので、それだけは絶対に避けたい」。重要な一戦は池田充槻に前を任せ、後ろは畑崎大輝が固める初めての番手戦。北日本の同期と力を合わせ昇班を決める。 中日スポーツ,[],[]
「豊臣兄弟！」ついに出たカウントダウン　ネット盛り上がる「ほんと、辛いですが…」「令和バージョン、楽しみ」（中日スポーツ）,https://news.yahoo.co.jp/articles/3d03eb18dc0750fd73d8a49907a58929761fecfd,https://newsatcl-pctr.c.yimg.jp/t/amd-img/20260629-00000072-chuspo-000-1-view.jpg?exp=10800,2026-06-29T17:53:53+09:00,2026-06-29T17:53:53+09:00,中日スポーツ,chuspo,中日スポーツ,429,小栗旬 NHK大河ドラマ「豊臣兄弟！」公式インスタグラムは29日、更新。「第27回『本能寺の変』放送まであと2週間」と告知し、フォロワーが盛り上がっている。 【実際の投稿】明智光秀（要潤）に届けられた書状 公式インスタは「7月12日（日）［総合］夜8：00ほか」と放送日時を投稿。28日放送の第25回で、明智光秀（要潤）に届けられた書状の写真を添えた。 フォロワーからは「わぁーーー！！本能寺カウントダウンーーー！！」「え、あと2週間！？そんなにすぐ来るの！？」「今からドキドキソワソワ、いよいよ、その時が近づいている！！」「岡田准一信長の最期も凄まじかったですが小栗旬信長の最期はどの様になるのか…楽しみです」「あ～、いよいよかと思うとほんと、辛いですが、しっかり観たいと思います」「派手な本能寺が見れるのかな」「令和バージョンとしてどう表現するか楽しみ」「義昭公が今になって亡霊のように立ち上がってくるとは…」といったコメントが寄せられた。 中日スポーツ,[],[]
「あの続きが始まる」日本代表がブラジル代表との対戦がアニメ『キャプテン翼』の”リアル続編”とSNS期待「この結末をずっと待っていた」【W杯】（中日スポーツ）,https://news.yahoo.co.jp/articles/1ae077528004c1f8a939a0514fad9ed6d04e3714,https://newsatcl-pctr.c.yimg.jp/t/amd-img/20260629-00000071-chuspo-000-1-view.jpg?exp=10800,2026-06-29T17:52:53+09:00,2026-06-29T17:52:53+09:00,中日スポーツ,chuspo,中日スポーツ,659,ブラジル戦に向けて最終調整する日本代表イレブン サッカー日本代表は２９日（日本時間３０日午前２時キックオフ）のＷ杯北中米大会決勝トーナメント１回戦で、Ｗ杯最多５度の優勝を誇るブラジルと対戦する。日本が１次リーグ通過でブラジルとの対戦が決まって以降、ネット上では海外のファンからも「現実がアニメに追いついた」などと話題のカードだ。 【実際の写真】日本代表の『女優妻』も大興奮…薄化粧で別格の美しさ Ｗ杯で日本がブラジルと対戦するのは２００６年ドイツ大会（１―４敗戦）に続いて２度目だが、今大会の日本は１次リーグで好試合を演じ世界から称賛されている。それだけにアニメの”リアル続編”と盛り上がっている。そのアニメは「ボールはともだち」という主人公・大空翼を中心に描かれた世界的人気漫画「キャプテン翼」だ。 日本サッカー界にとってＷ杯出場がまだまだ遠かった１９８０年代から連載され、翼が仲間たちと世界に挑む姿が描かれてきた。今回とくに話題になっているのは、２００２年Ｗ杯日韓大会を挟んで放送されたアニメシリーズの最終回で、日本開催という設定の大会で翼を擁する日本がブラジルとの試合を迎え、まさに始まるという場面で終わっているというもの。 約四半世紀を経た今大会でその行方を楽しむ声がＳＮＳ上に多数。多言語で「あのキャプ翼のアニメの続きがはじまる」「この結末をずっと待っていた」「最終話の後に何が起こったかを知ることができるんだ」「アニメの決着は現実でつけることになった」という声が並んでいる。その結果やいかに。 中日スポーツ,[],[]
【ＮＨＫ朝ドラ『風、薫る』３０日は】りん（見上愛）は虎太郎（小林虎之介）に悩みを打ち明ける（中日スポーツ）,https://news.yahoo.co.jp/articles/eb1bacc6fe17d57aabc4859121e97d5d27b1c5bd,https://newsatcl-pctr.c.yimg.jp/t/amd-img/20260629-00000070-chuspo-000-2-view.jpg?exp=10800,2026-06-29T17:15:53+09:00,2026-06-29T17:30:14+09:00,中日スポーツ,chuspo,中日スポーツ,202,連続テレビ小説『風、薫る』の場面カット（C）NHK ＜６月３０日（火） 第６７回 ＮＨＫ総合 午前８時ほか＞ 看護科の学生ヒデ（池田朱那）が辞めて落ち込むりん（見上愛）。直美（上坂樹里）も気にする中、仕事で病院にやってきた虎太郎（小林虎之介）にりんは悩みを打ち明ける。 【画像】『風、薫る』の人物相関図 第13週～「帝都医科大学附属病院」 そんな中、院長の多田（筒井道隆）から呼び出され…。 中日スポーツ,[],[]
