headline,mainEntityOfPage,image,datePublished,dateModified,author,media_en,media_jp,str_count,body,images,external_links
同居する10代少女に自宅で性的暴行か　会社員の男（46）逮捕　大分（OBS大分放送）,https://news.yahoo.co.jp/articles/8d35f12c5d13f2af59a4dbf051c824f555709dec,https://newsatcl-pctr.c.yimg.jp/t/amd-img/20260629-22766890-obsnews-000-1-view.jpg?exp=10800,2026-06-29T20:25:22+09:00,2026-06-29T20:25:22+09:00,OBS大分放送,obsnews,OBS大分放送,234,大分放送 同居する10代少女に自宅で性的な暴行をしたとして29日、不同意性交等の疑いで大分市の男（46）が逮捕されました。 不同意性交等の疑いで逮捕されたのは、大分市に住む会社員の男（46）です。 男は今年5月下旬から6月上旬までの間に、市内の自宅で同居する10代少女に対して性的な暴行を加えた疑いが持たれています。 6月11日に状況を知った県内の児童相談所から警察に情報提供があり事件が発覚しました。 警察の調べに対し、男は容疑を認めているということです。 大分放送,[],[]
女子高校生が全国13流派の日本泳法の中で全国2位　地元の伝統を継承する思いとは　大分（OBS大分放送）,https://news.yahoo.co.jp/articles/45080dadaca7aeed9093f197f9de71509f5ecbe9,https://newsatcl-pctr.c.yimg.jp/t/amd-img/20260629-22766884-obsnews-000-3-view.jpg?exp=10800,2026-06-29T19:52:16+09:00,2026-06-29T20:14:12+09:00,OBS大分放送,obsnews,OBS大分放送,872,大分放送 夏に向けて、大分県臼杵市の伝統泳法で日本一を目指す津久見市の高校生。受け継がれてきた伝統をつなぐ若き継承者の姿を追いました。 【写真を見る】女子高校生が全国13流派の日本泳法の中で全国2位 地元の伝統を継承する思いとは 大分 笑顔でラケットを振る津久見高校3年の重村瞳輝さん。学校生活ではソフトテニス部に所属する彼女にはもうひとつの顔があります。 （臼杵山内流遊泳クラブ・渡邉乾副会長） 「しっかりのしをとって。しっかり推進力をつけてのしをとる」 横向きで水に浮き、足のキック力で前に進む独特な泳ぎが特徴の臼杵山内流。江戸時代から受け継がれている古式泳法です。 8歳のころから教室に通う、重村さんは去年8月、全国から13流派の古式泳法が集い、泳ぎの美しさを競う全国大会に出場。18歳未満の部門で2位に輝きました。 （重村瞳輝さん）「最初は全国上位になることがなかなか想像することができなくて。率直な気持ちはやっぱりうれしかったんですけど、時間が経つにつれて1位を穫れなかった悔しさが芽生えてきました」 ■臼杵山内流とは? 「楽しさ知ってもらいたい」 山内流は元来、武士が水中で戦うために生み出したとされる武芸の一つ。臼杵市では、海で立ち泳ぎをしながら巨大な旗を振る正月の伝統行事でも知られています。 山内流の指導者だった母親の影響で伝統泳法への興味が芽生えた重村さん。全国大会では体を斜めに傾けたまま、ぶれずに泳ぐ美しいフォームが高く評価されました。 （臼杵山内流遊泳クラブ・渡邉乾副会長） 「彼女は非常に正確な足の運びができますので、自分の良いところをもう少し深めていけるともっと進歩するんじゃないかと思います」 臼杵山内流は現在、小学校2年生から50代までのおよそ40人が伝統泳法を学んでいます。若き後継者となる重村さんは、今年の日本一と文化の伝承を誓い、日々のトレーニングに励みます。 （重村瞳輝さん） 「今後の目標はやっぱり全国大会で1位。将来は自分が教える立場に立ってみんなに山内流の楽しさを知ってもらいたいです」 大分放送,[],[]
佐賀関の復興市営住宅これまでに35世帯が申請　大分（OBS大分放送）,https://news.yahoo.co.jp/articles/6cdd80ddf969df1355c1f2b20d0ca3b3b26277d9,https://newsatcl-pctr.c.yimg.jp/t/amd-img/20260629-22766873-obsnews-000-1-view.jpg?exp=10800,2026-06-29T19:38:12+09:00,2026-06-29T19:38:12+09:00,OBS大分放送,obsnews,OBS大分放送,379,大分放送 佐賀関の大規模火災にともなう復興市営住宅について大分市は30日の申請期限を前にこれまでに35世帯から入居の申し込みがあったと明らかにしました。 【写真を見る】佐賀関の復興市営住宅これまでに35世帯が申請 大分 大分市佐賀関で去年11月に発生した大規模火災では建物196棟が焼け、およそ130世帯が被災しました。 大分市は自力での再建が困難な人を対象に復興市営住宅の建設を計画しています。入居の申請受け付けは30日までで、今月26日時点で35世帯から申し込みがあったということです。 復興市営住宅はエレベーターを備えた3階建てか4階建てを想定。来年12月末の完成を目指し、設計などを踏まえて決定しています。市は今後、今年8月を目途に復興計画を策定するほか、来年3月末までにより具体的な再建案を盛り込んだ復興まちづくり計画を作成する方針です。 大分放送,[],[]
八田與一容疑者の目撃情報、半数が関東に集中　「エリア拡大し、捜査を尽くす」特捜隊長が誓う逮捕への執念　別府ひき逃げ殺傷事件から4年（OBS大分放送）,https://news.yahoo.co.jp/articles/eadce1ed94eeb8f8d878e03960cfb142ca4ead6e,https://newsatcl-pctr.c.yimg.jp/t/amd-img/20260629-22765964-obsnews-000-3-view.jpg?exp=10800,2026-06-29T18:13:14+09:00,2026-06-29T20:14:12+09:00,OBS大分放送,obsnews,OBS大分放送,882,大分放送 発生から4年が経過した大分県別府市の大学生死亡ひき逃げ事件。これまでに寄せられた目撃情報は約1万2千件にのぼり、その半数近くが関東地方に集中していることが分かりました。 【写真を見る】八田與一容疑者の目撃情報、半数が関東に集中 「エリア拡大し、捜査を尽くす」特捜隊長が誓う逮捕への執念 別府ひき逃げ殺傷事件から4年 ■容疑者の行動範囲拡大か 捜査の最前線を担うのは、大分県警捜査一課・特別捜査隊の河野友隊長です。特捜隊は殺人などの凶悪事件を専門とする組織であり、河野隊長はそのトップとして、この4月から陣頭指揮を執っています。 河野特捜隊長: 「事件から4年という月日が経過していますので、容疑者の行動範囲も広がっている可能性もあります。そういったことも視野に入れて、活動場所のエリアを拡大しているところです」 県警が特に力を入れているのが、県外へのアプローチです。これまでに寄せられた八田容疑者に似た人物の目撃情報は、6月25日までの4年間で1万2370件に上ります。このうち、県外からの情報が1万件余りで、関東での目撃情報が半分近くを占めています。 河野特捜隊長: 「皆様からお寄せいただいた目撃情報をもとにした追跡捜査を中心に、様々な捜査を展開しているところです。情報の件数は、少しずつ減ってきておりますので、些細な情報であっても幅広く提供いただきたいと思っております」 ■「無念を晴らしたい」 事件から4年。現場には、今も亡くなった大学生に供えられた花が絶えることはありません。この場所に立つたび、河野隊長の胸にこみ上げるのは容疑者に対する強い憤りです。 河野特捜隊長: 「被害者やそのご遺族、ご家族のお気持ちを考えると、一刻も早くやはり八田容疑者を見つけ出して逮捕し、無念を晴らしたいとそういう思いが強くなります。逮捕するという強い信念のもと、あらゆる捜査を尽くしていきます」 事件の風化を許さず、一刻も早い解決へ。警察による捜査は、現在も全国規模で続けられています。 【情報提供先】大分県別府警察署捜査本部:0977-21-2131 大分放送,[],[]
八田與一容疑者はどこに?警察が全国各地で情報提供呼びかけ、新たな防犯カメラ映像公開　別府ひき逃げ殺傷事件から4年　（OBS大分放送）,https://news.yahoo.co.jp/articles/b49793fec26910d1c968353cfbe64a3e813e7cd7,https://newsatcl-pctr.c.yimg.jp/t/amd-img/20260629-22766282-obsnews-000-2-view.jpg?exp=10800,2026-06-29T17:54:18+09:00,2026-06-29T17:55:24+09:00,OBS大分放送,obsnews,OBS大分放送,710,大分放送 大分県別府市で発生した大学生ひき逃げ殺傷事件から29日で4年となり、重要指名手配されている八田與一容疑者に関する情報提供が全国各地で呼びかけられました。 【写真を見る】八田與一容疑者はどこに?警察が全国各地で情報提供呼びかけ、新たな防犯カメラ映像公開 別府ひき逃げ殺傷事件から4年 ■全国11の都道府県で一斉啓発活動 JR別府駅前では29日朝、警察官らおよそ20人が街頭に立ち、八田容疑者の容姿の特徴などが記載されたチラシを配って、情報提供を呼びかけました。 29日は、大分のほか、北海道、宮城、東京、神奈川、愛知、大阪、広島、愛媛、福岡、沖縄の全国11の都道府県で一斉に啓発活動が実施され、協力を訴えました。 ■八田容疑者の新たな映像を公開 また、県警は八田容疑者の新たな防犯カメラの映像を公開ました。事件現場からおよそ350メートル離れた店舗の映像で、事件発生の数分前を捉えたものです。 被害者の男性2人が乗るバイクが通過したあと、八田容疑者が運転していたとみられる車が後を追いかけるように走行していく様子が映されています。 （別府警察署・橋本孝久刑事課長）「八田與一は絶対に逃がさないという執念で追跡したいと思う。どんな些細な情報でも寄せてほしい」 2022年6月、別府市で大学生1人が死亡、1人がけがをしたひき逃げ殺傷事件で警察は八田與一容疑者（29）を殺人などの疑いで重要指名手配しています。 県警によりますと、6月25日までに八田容疑者に関する情報は、全国から1万3069件寄せられていて、その追跡捜査が進められています。 【情報提供先】大分県別府警察署捜査本部:0977-21-2131 大分放送,[],[]
日本代表、ブラジル戦キックオフは午前2時…先に寝る?起きたまま? 睡眠のプロが断言「私たちの勝負は前半戦」【北中米W杯】（OBS大分放送）,https://news.yahoo.co.jp/articles/5a6868f5b0f535406601a23a84d3487ac7bb5d5f,https://newsatcl-pctr.c.yimg.jp/t/amd-img/20260629-22766374-obsnews-000-2-view.jpg?exp=10800,2026-06-29T17:47:12+09:00,2026-06-29T20:05:23+09:00,OBS大分放送,obsnews,OBS大分放送,909,大分放送 サッカーワールドカップ北中米大会、日本代表は決勝トーナメント初戦で王国・ブラジルと日本時間30日未明に対戦する。 【写真を見る】日本代表、ブラジル戦キックオフは午前2時…先に寝る?起きたまま? 睡眠のプロが断言「私たちの勝負は前半戦」【北中米W杯】 ■日本戦の視聴どうする? キックオフは日本時間30日午前2時――職場やSNSで議論となっているのが、テレビ観戦に向けた準備の方法だ。 リアルタイムで歓喜の瞬間を迎えたいが、学校や仕事が待っている。「先に寝るべきか」、「起きたまま決戦の時を迎えるのか」。 「私も観ますよ」という睡眠のプロに聞いた。 ■ポイントは前半戦 話を聞いたのは、睡眠環境診断士など眠りの専門資格を持つ大杉天伸さん。大分県内で1955年から続く、寝具などを販売する眠りの専門店「いとしや」3代目店主である。 開口一番、「私も観ますよ。だから今夜10時には寝ますね」とゴールが決まった。 大杉さんによると、普段6時間寝る人であれば、最初の3時間に深く質の良い眠りが来るため、試合開始までにとっておくとよいという。2時キックオフに備えて1時過ぎに起きるためには、「午後10時就寝」がひとつの目安だ。 大杉さん: 「特にはじめの90分の眠りが大事です。確実に質の良い睡眠にするためにも試合前に寝ておくとよいでしょう」 私たちの勝負は「前半戦」がカギとなる。 ■眠りにつくには?ポイントは3つ 多くの人にとって、いつもより数時間早く寝ることになる。私たちには「眠りにつけるか」という戦いが待っている。 勝負のポイントは以下の通りだ。 ・食事は少なくとも2時間前に済ませる ・入浴は1時間半前には終えたい ・スマートフォンを見るのは寝る30分前まで 大杉さん: 「特に今夜は照明をいつもより暗くしましょう。』脳が寝る時間だ』と錯覚を起こし、深い睡眠にいざなうメラトニンを生成し、入眠の準備に入ります」 また、スマートフォンなどが発するブルーライトは、30秒見るだけで眠気が覚めてしまい、次に眠気が来るのは30分後になってしまうという。試合に向けて情報を仕入れたいところだが、ぐっとこらえるしかない。,[],[]
「家庭ごみ有料化」市民9割超が継続を容認　大分市で審議会、制度のあり方を検証へ（OBS大分放送）,https://news.yahoo.co.jp/articles/fef0174528ab85ec484e29722ef0d247f84f5ff0,https://newsatcl-pctr.c.yimg.jp/t/amd-img/20260629-22766314-obsnews-000-1-view.jpg?exp=10800,2026-06-29T16:59:11+09:00,2026-06-29T16:59:11+09:00,OBS大分放送,obsnews,OBS大分放送,416,大分放送 大分市で家庭ごみ有料化が始まって12年となるのを前に、制度の継続や見直しを検証する審議会が29日から始まりました。 【写真を見る】「家庭ごみ有料化」市民9割超が継続を容認 大分市で審議会、制度のあり方を検証へ 大分市は、家庭ごみの減量とリサイクルの推進を目的に、2014年11月から指定ごみ袋の導入によって有料化しています。 有料化から12年となるのを前に、制度の在り方を検討する3年に1度の審議会は、学識経験者や各団体の代表ら15人で構成され、市民アンケートの結果やごみの減量効果などをもとに、制度のあり方を検証します。 4月に実施した市民アンケートでは、制度の継続について「必要」が59.3％。「やむを得ない」が34.2％となっている一方、「必要ない」は3.4％にとどまっています。 審議会では8月までに中間答申案をまとめ、市民からのパブリックコメントを経て、10月を目途に市長に検証結果を答申する方針です。 大分放送,[],[]
コンビニで新聞を万引きした疑い　警察官が店に張り込み…73歳無職の男を現行犯逮捕　大分（OBS大分放送）,https://news.yahoo.co.jp/articles/445e1c21f0632bbb74f4454cb3ed860936573544,https://newsatcl-pctr.c.yimg.jp/t/amd-img/20260629-22765827-obsnews-000-1-view.jpg?exp=10800,2026-06-29T16:22:16+09:00,2026-06-29T16:22:16+09:00,OBS大分放送,obsnews,OBS大分放送,342,大分放送 大分県豊後高田市のコンビニで新聞紙1部を万引きした疑いで29日、住所不定無職の男が逮捕されました。 窃盗の疑いで逮捕されたのは、杵築市出身で住所不定・無職の男（73）です。 男は6月29日午前7時22分ごろ、豊後高田市内のコンビニで新聞紙1部（180円）を盗んだ疑いが持たれています。 警察によりますと、27日にコンビニ店長から「新聞の売り上げが合わない」と警察が相談を受け、防犯カメラなどを調べて容疑者を絞り込んでいました。 そして29日朝から警察官が複数人で張り込んでいたところ、車で現れた男が1人で入店し、新聞紙を持って会計せず店を出ました。その瞬間に警察官が声をかけ、現行犯逮捕しました。 男は容疑を認めているということで、警察が余罪や動機を調べています。 大分放送,[],[]
朝から飲酒運転で電柱に衝突、基準値5倍超のアルコール　酒気帯び運転容疑で52歳男を逮捕　大分（OBS大分放送）,https://news.yahoo.co.jp/articles/963ac076364abc799a0793df69b805abbaa0a385,https://newsatcl-pctr.c.yimg.jp/t/amd-img/20260629-22765807-obsnews-000-1-view.jpg?exp=10800,2026-06-29T16:12:17+09:00,2026-06-29T16:12:17+09:00,OBS大分放送,obsnews,OBS大分放送,347,大分放送 大分市の市道で29日朝、酒を飲んだ状態で車を運転した疑いで、市内に住む会社員の男が逮捕されました。 道路交通法違反の酒気帯び運転の疑いで逮捕されたのは、市内に住む会社員の男（52）です。 警察によりますと、29日午前6時半ごろ、大分市乙津港町の市道で、車が道路脇の電柱に衝突する単独事故がありました。 通行人からの110番通報を受けて警察官が駆けつけたところ、車を運転していた男に異変を感じ、アルコール検査をしました。 その結果、基準値を超える呼気1リットルにつき0.85ミリグラムのアルコールが検知されたため、男を現行犯逮捕しました。 現場は片側一車線のほぼ直線道路で、警察の調べに対し、男は容疑を認めているということです。 警察が酒を飲んだ経緯などを詳しく調べています。 大分放送,[],[]
中学生が歴史ある摩崖仏など見学　ジオパーク体験学習　大分（OBS大分放送）,https://news.yahoo.co.jp/articles/98c60aab661b2a3728cddb3aa74a57290730ed02,https://newsatcl-pctr.c.yimg.jp/t/amd-img/20260629-22765027-obsnews-000-2-thumb.jpg?exp=10800,2026-06-29T12:10:32+09:00,2026-06-29T13:57:18+09:00,OBS大分放送,obsnews,OBS大分放送,386,大分放送 大分県豊後大野市の中学生が29日、地元の磨崖仏などを見学し、ふるさとの自然や歴史を学びました。 【写真を見る】中学生が歴史ある摩崖仏など見学 ジオパーク体験学習 大分 この体験学習は、生徒に地元の自然や歴史それに文化を学んでもらおうと、豊後大野市の大野中学校が毎年行っています。 29日は1年生26人が参加し、県の有形文化財に指定されている「大迫磨崖仏」や「柴北熊野社」を訪れました。 生徒は、岩肌に刻まれた大昔の彫刻や文字を間近で見学し、目の前に広がるスケールの大きさを肌で感じ取っていました。 生徒「迫力があったのですごかったです。いいところがあるとかもっと知ってもらえるように自分たちもやっていきたい」 豊後大野市は、市全域が「日本ジオパーク」に認定されていて、学校では体験学習を通じて、ふるさとの歴史や環境への理解を深めていきたいとしています。 大分放送,[],[]
八田與一容疑者の車が映った新たな防犯カメラ映像を公開　「スピーカーから爆音でいちゃもん」直前トラブルから被害者バイクを追跡　別府ひき逃げ殺傷事件から4年　県警が全国で情報提供呼びかけ強化（OBS大分放送）,https://news.yahoo.co.jp/articles/c7f08350df43d3349ff3a88dfe2e52fc85e8fa10,https://newsatcl-pctr.c.yimg.jp/t/amd-img/20260629-22760870-obsnews-000-4-thumb.jpg?exp=10800,2026-06-29T00:00:45+09:00,2026-06-29T09:34:21+09:00,OBS大分放送,obsnews,OBS大分放送,1127,大分放送 大分県別府市で起きた大学生ひき逃げ殺傷事件で、大分県警は29日、重要指名手配の八田與一容疑者（29）が当時運転していたとみられる車の新たな防犯カメラ映像を公開しました。警察が走行中の車両映像を公開するのは、事件後初めてです。 【写真を見る】八田與一容疑者の車が映った新たな防犯カメラ映像を公開 「スピーカーから爆音でいちゃもん」直前トラブルから被害者バイクを追跡 別府ひき逃げ殺傷事件から4年 県警が全国で情報提供呼びかけ強化 ■「殺人」容疑立証への判断資料に 新たに公開された映像は計2本で、事件現場から直線距離で約350メートル離れた店舗の防犯カメラが捉えたものです。 ＜映像内容＞ 19時43分:負傷した大学生（当時20）のバイクが通行 ※亡くなった大学生（当時19）のバイクはこれより前に通行済み 19時44分:八田容疑者が運転していたとみられる車が同じ方向へ走行 19時45分:事件発生 この映像は、県警が「殺人」容疑でも立証するための判断材料になったとのことです。 ■背景にある「商業施設でのトラブル」 事件の直前、八田容疑者と亡くなった被害者が、市内の商業施設でトラブルになっていたことがわかっています。当時、一緒にいた友人の男性は次のとおり証言していました。 「『あれ誰やったの?友だち?』と聞いたら、『変なやつに絡まれたんよね』という話でした。八田容疑者がスピーカーから爆音で音楽を流しながら歩いて来たらしく、パッと目が合ったんですかね。向こうが多分いちゃもんつけてきたらしい」 今回公開された防犯カメラの映像は、この商業施設を出たあと、走行している車両を捉えたものです。 ■現場近くの防カメ映像と事件の概要 これとは別に、OBSが独自に入手した現場近くの防犯カメラ映像には、オートバイと原付バイクが通過したその約30秒後、八田容疑者が運転していたとみられる車が同じ方向へ走行しています。この直後に事件が起きました。 県警は今回の映像公開により、広く一般からの情報提供を呼びかける狙いがあります。 捜査一課の志賀雄一郎次席は「些細な目撃情報や、映像に見覚えのある方は、捜査本部まで情報を寄せてほしい」とコメントしています。 この事件は、2022年6月29日午後7時45分ごろ、別府市の県道で発生。八田容疑者が運転する車がバイク2台に衝突し、当時19歳の大学生が死亡、その友人の大学生も負傷しました。 事件から4年となる6月29日。警察は大分県内のほか、北海道、宮城、東京、神奈川、愛知、大阪、広島、愛媛、福岡、沖縄で一斉に広報活動を実施する計画です。 【情報提供先】大分県別府警察署捜査本部:0977-21-2131 大分放送,[],[]
