headline,mainEntityOfPage,image,datePublished,dateModified,author,media_en,media_jp,str_count,body,images,external_links
「夫婦内試合だ」 純烈元メンバー、スウェーデン育ちの妻との日本代表戦にちなんだ姿が反響（中日スポーツ）,https://news.yahoo.co.jp/articles/bd38288671f65f2daba37daeac9bbb46437798a3,https://newsatcl-pctr.c.yimg.jp/t/amd-img/20260629-00000031-chuspo-000-1-view.jpg?exp=10800,2026-06-29T07:10:53+09:00,2026-06-29T07:10:53+09:00,中日スポーツ,chuspo,中日スポーツ,639,男性歌謡コーラスグループ“純烈”元メンバーで俳優の小田井涼平（５５）が２８日までに自身のインスタグラムを更新。２５日（日本時間２６日）に行われたサッカーＷ杯北中米大会１次リーグの日本対スウェーデン戦終了後に、妻でタレントのＬｉＬｉＣｏ（５５）とのコミカルなツーショット写真を公開すると、ファンから反響があった。 【実際の投稿】小田井涼平、「夫婦内試合」との声もある妻・LiLiCoとのショット 小田井は「日本対スウェーデン お疲れ様でした！！！」と添えて、ＬｉＬｉＣｏとのツーショット写真を３枚更新。３枚とも、ＬｉＬｉＣｏが小田井につかみかかるようなショットで、小田井は日本を象徴するような青いジャージー、ＬｉＬｉＣｏはスウェーデンを象徴するような、鮮やかな黄色いジャージーを身にまとっている。こちらのショットについて、インタビュー取材時の写真であることを小田井が明かしている。 試合の結果は１―１のドローでいずれも決勝トーナメントに進出した仲、コメント欄には「夫婦内試合だ」「夫婦円満」「喧嘩にならず良かった」「３枚目で仲良くなれて」「おもろい夫婦のＷ杯は引き分け～」「ピースフルな結果でラブラブ」「引き分けで家庭平和♡」など、夫妻をほほ笑ましく見守るような温かいコメントが寄せられた。 小田井涼平 小田井とＬｉＬｉＣｏは２０１７年に結婚し、芸能界きってのおしどり夫婦として知られる。ＬｉＬｉＣｏは父親がスウェーデン人で、自身も１８歳までスウェーデンで過ごした。 中日スポーツ,[],[]
森保監督が明言「久保建英はプレーできない」、ブラジル戦欠場が決定…決勝T復帰へ早期回復願う、「急ピッチで…」（中日スポーツ）,https://news.yahoo.co.jp/articles/121ba9a40fe6163b171c631998d0dde9ce341166,https://newsatcl-pctr.c.yimg.jp/t/amd-img/20260629-00000030-chuspo-000-4-view.jpg?exp=10800,2026-06-29T07:02:04+09:00,2026-06-29T07:59:28+09:00,中日スポーツ,chuspo,中日スポーツ,341,森保一監督 ◇28日（日本時間29日） W杯決勝T1回戦・ブラジル戦前日（米テキサス州ヒューストン） 【実際の写真】日本代表の『女優妻』も大興奮…薄化粧で別格の美しさ サッカーの北中米ワールドカップに出場する日本代表が28日、決勝トーナメント1回戦のブラジル代表戦を翌日に控えて、米テキサス州ヒューストンで全体練習を行った。冒頭の15分間がメディアに公開され、オランダ戦で左膝を負傷した久保建英は別メニューで調整した。 森保監督は大会の会場で前日会見に臨み、久保について「ブラジル戦、久保はプレーできません。まだ、全体練習に入ってないですし、走るトレーニングしかできていない。早く回復することを願っているし、彼も急ピッチでコンディションを上げてくれている」と明かした。 中日スポーツ,[],[]
アンカツさん、函館記念で重賞初勝利の小林美駒騎手に「あのガッツポーズ決めて降着にならんで正直ホッとした」（中日スポーツ）,https://news.yahoo.co.jp/articles/ca6a46be818b8e95f3282be36aedb0b770db99d6,https://newsatcl-pctr.c.yimg.jp/t/amd-img/20260629-00000029-chuspo-000-1-view.jpg?exp=10800,2026-06-29T07:00:53+09:00,2026-06-29T07:00:53+09:00,中日スポーツ,chuspo,中日スポーツ,520,安藤勝己さん 元笠松、JRA騎手で通算4464勝を挙げた競馬評論家で「アンカツ」こと安藤勝己さんが28日、自身のX（旧ツイッター）を更新。函館記念（G3・芝2000メートル・函館）と、ラジオNIKKEI賞（G3・芝1800メートル・福島）を振り返った。 函館記念はファウストラーゼンが後方から3コーナー手前でスパート。一気にまくって直線で先頭に立ち押し切った。鞍上は重賞初制覇を飾った小林美駒騎手。「ファウストラーゼンで勝つならって仕掛け。逃げだけじゃなくて追えるのも持ち味」と評価。 ただ、直線で外に寄れたことにより審議対象に。「がむしゃらのゴール前は見方によっちゃアウトやけど」と降着にはならなかったが7月11日から19日までの騎乗停止処分が下った。そして、うれしさのあまりゴール後に飛び出した「あのガッツポーズ決めて降着にならんで正直ホッとした。語り草になる重賞初勝利」とつづった。 ラジオNIKKEI賞はサノノグレーターが後方から大外に持ち出すと直線強襲。上がり最速34秒0の末脚を披露し快勝した。前走の皐月賞まではクラシック路線を歩んできた馬。「走ってきたレースが違う」と秋の重賞戦線に向け、確かな一歩を踏み出した。 中日スポーツ,[],[]
「人魚姫みたい」「メイク濃いギャル」 46歳人気モデル、撮影中の美しい横顔に反響さまざま（中日スポーツ）,https://news.yahoo.co.jp/articles/10dc26726bbc73cae80f93bcb6bddf8fc197096d,https://newsatcl-pctr.c.yimg.jp/t/amd-img/20260629-00000028-chuspo-000-1-view.jpg?exp=10800,2026-06-29T07:00:53+09:00,2026-06-29T07:00:53+09:00,中日スポーツ,chuspo,中日スポーツ,589,モデルの蛯原友里（４６）が２８日までに自身のインスタグラムを更新。雑誌撮影の最新ショットを公開し、ファンから「人魚姫みたい」「２００６年も、２０２６も、日本のトップモデルです」などと変わらぬ姿が話題を呼んでいる。 【実際の投稿】蛯原友里、人魚姫？ メイク濃いギャル？ 反響を呼んだ横顔 蛯原は「ＶＯＣＥ『Ｂｅａｕｔｉｆｕｌ Ｄａｙｓ』最終回 大好きなチームの皆さんと紡いできた大切な連載」と書き出し、美容雑誌「ＶＯＣＥ」での撮影の様子を公開。ブラウンを基調にインパクトのあるブルーのアイシャドーを施し、印象的な目元のメイクをした横顔や、水色のドット柄とヒョウ柄が大胆にミックスされた華やかなドレスに水色のハイヒールを着こなして膝を立ててかがんだポーズ全身ショットが披露された。 メイクが際立つ、美しい横顔ショットにフォロワーからは「横顔、特に目がとても綺麗」「メイク濃いギャルに見える」「メイクアップが秀逸」などのコメントや、「人魚姫みたい」「美しい……」「まるで人魚 可愛すぎやしないかい！？」などの声が上がった。 蛯原友里 他にも「アネッサの頃のエビちゃんだと思ってました」「まさにアネッサ」「２００６年も、２０２６も、日本のトップモデルです」「アネッサの時の水着のカラー」など蛯原が２００５～０８年出演したＣＭ「アネッサ」（資生堂）に関する声が多く集まった。 中日スポーツ,[],[]
「森保ノート」の秘密明かす、ブラジルで話題「何書いているか」…監督は笑顔「明日に関しては…」（中日スポーツ）,https://news.yahoo.co.jp/articles/92f6eef334a07549b0df2c7ea088cd44626dc225,https://newsatcl-pctr.c.yimg.jp/t/amd-img/20260629-00000027-chuspo-000-3-view.jpg?exp=10800,2026-06-29T06:55:57+09:00,2026-06-29T11:04:04+09:00,中日スポーツ,chuspo,中日スポーツ,347,森保監督 サッカーの北中米ワールドカップに出場している日本代表の森保一監督が28日、決勝トーナメント1回戦のブラジル代表戦を翌日に控えて前日会見を行った。海外メディアから試合中に記している「森保ノート」について質問を受けた。ブラジルで話題になっていると言われた監督は「明日に関しては何も書いていない。自信を持って勇気を持ってチャレンジするという精神的なことだけ書いてますね」と語った。 【実際の写真】日本代表の『女優妻』も大興奮…薄化粧で別格の美しさ さらに、試合中に何をメモしているかについて、「試合中にできていること、相手にやられて、できていないことを書いて、ハーフタイムに選手やコーチに伝える。明日の試合では、できていることをたくさん書けるようにチャレンジしたい」と笑った。 中日スポーツ,[],[]
破壊力抜群！大原優乃、“バニーちゃん”姿にファン興奮「そのウサギ飼います」「可愛い子にうさ耳は反則」「舌出し最高！」（中日スポーツ）,https://news.yahoo.co.jp/articles/c82a10a8da4f66b6552afbfeb184e1b28d37ce81,https://newsatcl-pctr.c.yimg.jp/t/amd-img/20260629-00000026-chuspo-000-1-view.jpg?exp=10800,2026-06-29T06:50:53+09:00,2026-06-29T06:50:53+09:00,中日スポーツ,chuspo,中日スポーツ,362,大原優乃 元「Dream5」で女優の大原優乃（26）が27日に自身のインスタグラムを更新。バニーガール風オフショットを公開し、ファンから絶賛の声が寄せられている。 【実際の投稿】大原優乃、白バニに黒バニ…可愛すぎるバニーガール風オフショット 「デジタル写真集フォトカード『LUMIÉRE』オフショット」とつづり、うさ耳をかぶったバニーガール風衣装でウインクや舌出しショットを披露。また、長めのメタリカTシャツからはスラリときれいな脚がのぞいている。 コメント欄では「ゆうのバニーちゃん可愛い」「うさ耳は可愛すぎるよ」「ウインクもずるい」「舌出し最高！」「可愛い子にうさ耳は反則です」「うさみみ、世界一お似合い」「そのウサギ飼います」「どんな徳を積んだらこんな子と付き合えるんだよ」「レベチ」などの声が集まった。 中日スポーツ,[],[]
ママそっくりな美しさ」市川團十郎の14歳長女の”朝ご飯待ち姿”に絶賛の声「メロメロなお気持ちわかります」「雰囲気がもう麻央ちゃん」（中日スポーツ）,https://news.yahoo.co.jp/articles/4cba3f87b9533777ddefda346546e4334a92a6aa,https://newsatcl-pctr.c.yimg.jp/t/amd-img/20260629-00000025-chuspo-000-1-view.jpg?exp=10800,2026-06-29T06:40:53+09:00,2026-06-29T06:40:53+09:00,中日スポーツ,chuspo,中日スポーツ,422,市川團十郎 歌舞伎俳優の市川團十郎（48）が28日までに自身のインスタグラムを更新。長女で女優の堀越麗禾（ほりこし・れいか、市川ぼたん、14）の写真を公開し、フォロワーを喜ばせた。 【実際の投稿】ママそっくりな美しさ、市川團十郎の14歳長女・市川ぼたん、キュートな”朝ご飯待ち姿” 市川は「朝ごはん待ちの麗禾ちゃん、久しぶりの家族朝ごはんでウキウキしてます ＃家族 ＃朝ごはん ＃團十郎 ＃麗禾 ＃ぼたん 」とつづって公開したのは麗禾が白のTシャツ姿でホテルの朝食会場とみられる場所でちょこんと座っている3枚の写真。スマホをテーブルに置き、大きな目で左の方向を見ているのが印象的な写真などがある。 フォロワーからは「麗禾ちゃん、麗しい～」「表情は可愛らしく 背筋はぴーんと」「お行儀良いけど、お茶目な表情がキュン」「團十郎さまのメロメロなお気持ちわかります」「ママそっくりな美しさ」「雰囲気がもう麻央ちゃんやん」などの声が並んだ。 中日スポーツ,[],[]
「久しぶりに兄貴と」 EXILEメンバー、お笑い芸人とバッタリ、並んだ姿に『似てる・似てない』論争が再燃（中日スポーツ）,https://news.yahoo.co.jp/articles/77cf49c07ff309a3321e50bdbec08033d43e6198,https://newsatcl-pctr.c.yimg.jp/t/amd-img/20260629-00000024-chuspo-000-2-view.jpg?exp=10800,2026-06-29T06:30:53+09:00,2026-06-29T06:40:34+09:00,中日スポーツ,chuspo,中日スポーツ,568,ダンスパフォーマンスグループ「ＥＸＩＬＥ」メンバーのＴＡＫＡＨＩＲＯ（４１）が、２８日までに自身のインスタグラムを更新。お笑いコンビ「ブラックマヨネーズ」の小杉竜一（５２）との仲むつまじいツーショットを公開すると、ファンからは似てる似てない論争が再び湧き起こった。 【実際の投稿】似てる？ 似てない？ EXILE・TAKAHIROと小杉竜一 ＴＡＫＡＨＩＲＯは「久しぶりに兄貴とバッタリ会いました」と添えて、２枚の写真を投稿。テレビ局と思われる場所で、小杉と偶然出会ったことをファンに報告。２人とも横向きのピースサインを見せて笑顔を見せている。 TAKAHIRO ＴＡＫＡＨＩＲＯと小杉といえば、以前バラエティー番組で共演して以来「似ている」と話題になっていた。ＴＡＫＡＨＩＲＯ自身も、以前母親から「小杉と似ている」と言われたことがあると明かしている中、コメント欄には「久しぶりのツーショット見れて嬉しいです♡」「兄貴とのツーショット最高～」「兄貴、いい人溢れ出てる！」「久しぶりに兄貴と会えて良かったですね」「やっぱちょっと似てるヒーハー」「何か似とらんようで 似とるようで、似とらんなぁ」「似てないけど何か兄弟感あるのは何故～！？」など、ふたりの再会を喜んだり、似ているか否かを気にする声など、さまざまな声が挙がった。 中日スポーツ,[],[]
【W杯】森保監督が”方針変更”を決断、ブラジル戦「PK戦になれば…」…前回は挙手制で敗戦、「笑われる方もいるかもしれないが…」（中日スポーツ）,https://news.yahoo.co.jp/articles/f2c7f913abf1828f01d67050aa2717c4efa5d95f,https://newsatcl-pctr.c.yimg.jp/t/amd-img/20260629-00000023-chuspo-000-9-view.jpg?exp=10800,2026-06-29T06:24:37+09:00,2026-06-29T10:44:04+09:00,中日スポーツ,chuspo,中日スポーツ,357,森保監督 サッカーの北中米ワールドカップに出場している日本代表の森保一監督が28日、決勝トーナメント１回戦のブラジル代表戦を翌日に控えて前日会見を行った。PK戦にもつれた場合について質問がおよび、森保監督は「前回、カタールで、クロアチアとPKの末に大会から去らなければいけなかった。PKのキッカーは、選手たちの挙手制でキッカーを決めた。今回はPKが濃厚になれば、キッカーの順番を決めておきたい。挙手制ではなく、最後は私が決めて選手たちに蹴ってもらう」と明らかにした。 【実際の写真】日本代表の『女優妻』も大興奮…薄化粧で別格の美しさ 日本は前回大会のクロアチア戦で１ー１の延長を戦い、PKで敗れた。森保監督はブラジル戦を前に「笑われる方もいらっしゃると思うが、本気で優勝を目指している」と力を込めた。 中日スポーツ,[],[]
「ワールドカップもいいけど…」 100センチグラドル、『ののかっぷも見てね』撮に喜びの声が殺到 「ずっと見ていたい」「出場して」（中日スポーツ）,https://news.yahoo.co.jp/articles/2a76e0b72d1d9f3483f31d21c0efb737731c9401,https://newsatcl-pctr.c.yimg.jp/t/amd-img/20260629-00000022-chuspo-000-1-view.jpg?exp=10800,2026-06-29T06:20:53+09:00,2026-06-29T06:20:53+09:00,中日スポーツ,chuspo,中日スポーツ,602,グラビアアイドルの世良ののか（２８）が２８日までに自身のＸ（旧ツイッター）を更新。白いスイムウエアショットを１枚投稿すると、添えられたコメントにファンが反応。「ののかっぷずっと見ていたい」「ののかっぷに出場してー」「ののかはワールドカオスや」など、数々の褒めコメントが寄せられている。 【実際の投稿】世良ののか、「ののかっぷも見てね」100センチ谷間撮 世良は「ワールドカップもいいけど、ののかっぷも見てね？♡」とコメントを添えて、白いスイムウエア着用と思われるショットを１枚投稿。カメラ目線でほほ笑む世良の表情は、まるで小悪魔のようで、つい引き込まれる。谷間を強調したショットに、ファンからは喜びの声が相次いだ。 コメント欄には「ののかはワールドカオスや」「ののかっぷずっと見ていたい」「ワールドカップなんかより、ののかっぷ♡」「ののかっぷの方が大好きなのであります」「ののかっぷもワールドクラス」「いい語呂合わせｗ」「ののかっぷ写真集の本、デジタル版、アザーカット版のすべてを持っているのでハットトリック達成しました」など、絶賛のコメントが殺到した。 世良ののか（インスタグラムから） 世良は２０２１年にミスｉＤ２０２１「ネクストグラビアクイーン賞」を受賞。１ｓｔ写真集「ののかっぷ。」を発売するなど、グラビアアイドルとして活動の幅を広げている。スリーサイズはＢ１００－Ｗ５８－Ｈ９３。 中日スポーツ,[],[]
「宇宙旅行みたい」人気モデルが背負うペットリュックに「ドラえもんの道具かと」…ビジュアルと機能に驚きの声（中日スポーツ）,https://news.yahoo.co.jp/articles/3b434dd3a8d830c61d4ba6a67528ec443aed2b76,https://newsatcl-pctr.c.yimg.jp/t/amd-img/20260629-00000021-chuspo-000-1-view.jpg?exp=10800,2026-06-29T06:10:53+09:00,2026-06-29T06:10:53+09:00,中日スポーツ,chuspo,中日スポーツ,465,益若つばさ モデルの益若つばさ（40）が28日までに自身のインスタグラムを更新。愛犬をリュックで背負う姿を公開したところ、ファンから驚きの声が上がっている。 【実際の投稿】「宇宙旅行みたい」ドラえもんの道具みたいな益若つばさのペットリュック 「うにちゃんと打ち合わせと撮影行きました」と書き出すと、愛犬とのツーショットや私服姿など7枚の写真を公開。中でもフォロワーが注目したのは最後に公開された1枚。益若は「うにちゃんのバッグ冷風と電気つくの 最近のはすごいなぁ」とつづり、愛犬を背負うバッグを披露した。 公開されたリュックは全体的に丸みを帯びたデザインで中央が半透明な窓のようになっており、愛犬が顔をのぞかせている。白を基調にしたスタイリッシュで宇宙船を思わせる見た目をしている。 フォロワーからは、「うにたんが透けている」「初めて見ました 近未来的ですね」「凄い！ドラえもんの道具かと思いました」「宇宙旅行みたい」「SF映画に出てくるようなアイテム」「宇宙行けそう」「うにちゃんバッグすご」などの声が寄せられた。 中日スポーツ,[],[]
日本にとって鬼門中の鬼門「左45度」３失点すべてここから…ブラジルがそのウイークポイントを狙わないはずがない！寄せの甘さは即致命傷、決戦はまず守備から（中日スポーツ）,https://news.yahoo.co.jp/articles/dceadd7e060166554510251f7d603847920cc890,https://newsatcl-pctr.c.yimg.jp/t/amd-img/20260629-00000020-chuspo-000-2-view.jpg?exp=10800,2026-06-29T06:00:53+09:00,2026-06-29T11:05:17+09:00,中日スポーツ,chuspo,中日スポーツ,1324,オランダ戦の後半、ファンダイク（左）に先制ゴールを決められた ◇コラム 大塚浩雄の「C級蹴球講座」 決戦の時は来た。王国・ブラジルとの戦いに勝たなければベスト8も4も、ましてや優勝もない。そのためには大きな課題を克服しなければならない。今大会、日本のウイークポイントとなっている左45度のスペースをいかにしてつぶすか。 【実際の写真】日本代表の『女優妻』も大興奮…薄化粧で別格の美しさ 日本はオランダ戦で2失点、スウェーデン戦で1失点している。そのすべてが左45度からの攻撃なのだ。オランダ戦の1失点目、オランダのFKからクリアを拾われ、左サイドに展開された。左45度の位置でパスを受けたフラフェンベルクが間髪入れず絶妙のクロス。ファンダイクが完璧なヘディングシュートを決めた。 このとき、中村の寄せが甘かったこともあるが、相手のセットプレーにおいてそれぞれのポジショニングに改善点があるのではないだろうか。 オランダ戦の2失点目も左45度からのシュートだ。フラフェンベルクのパスを左サイドで受けたシュメルビルは、カットインから左足を振り抜いた。この時も中村の寄せが甘く、完璧なシュートを打たれている。もっとボールホルダーとの距離を縮めないと、自由にプレーされてしまう。中村のストロングポイントは左サイドからの突破、カットインからのシュートで、守りの弱さは致し方ない部分もあるが、ブラジルがこのウイークポイントを狙わないはずがない。 さらにスウェーデン戦もこの位置からやられている。日本が先制点を奪った後に、中村がストッキングの交換を命じられ、2分ほど10人の戦いを強いられた。ここで混乱が生じる。その4分後、FKのチャンスで左サイドにポジションを取ったエランガのマークに堂安が付き、中村がゴール前のゾーンに入った。その流れから本来は右サイドの堂安がそのまま左サイドでエランガをマークした。 そのエランガに左45度から芸術的なカットインシュートを決められたのだ。田中がヨケレスの動きに引っ張られてできたスペースを突かれ、堂安の寄せが甘くなって、楽々シュートを打たれている。 このレベルになると、寄せの甘さは即致命傷につながる。いかにアプローチし、その後ろをカバーするか。日本の右サイドにいるビニシウスはもちろん脅威なのだが、それより怖いのは左45度のスペース。ビニシウスは堂安、冨安のコンビでつぶすとして、逆サイドは…。前田を左ウイングバック、中村を左シャドーに置くのか、それとも鈴木淳之介をスタメン起用するか。ボランチは田中と佐野、シャドーは中村、鎌田か…。 まずは守備から。しっかりはね返してカウンター攻撃、またはハイプレスではめに行く。選手の組み合わせでウイークポイントをカバーし、ストロングポイントを最大限に生かす。森保監督の対ブラジル戦略が注目される。 ◆大塚浩雄 東京中日スポーツ編集委員。ドーハの悲劇、94年W杯米国大会、98年W杯フランス大会を現地取材。その後はデスクワークをこなしながら日本代表を追い続け、ついには原稿のネタ作りのため？指導者C級ライセンス取得。40数年前、高校サッカー選手権ベスト16（1回戦突破） 中日スポーツ,[],[]
