headline,mainEntityOfPage,image,datePublished,dateModified,author,media_en,media_jp,str_count,body,images,external_links
台北国際ブックフェア開幕  蔡総統「行動で出版業界を支持しよう」（中央社フォーカス台湾）,https://news.yahoo.co.jp/articles/4c5ebf8c557abe915631509a2f72dc82ed12f56e,https://newsatcl-pctr.c.yimg.jp/t/amd-img/20240220-00000005-ftaiwan-000-1-view.jpg?exp=10800,2024-02-20T17:19:22+09:00,2024-02-20T17:19:22+09:00,中央社フォーカス台湾,ftaiwan,中央社フォーカス台湾,418,\n第32回台北国際ブックフェアの開幕式であいさつする蔡英文総統\n（台北中央社）本の見本市「第32回台北国際ブックフェア」（台北国際書展）が20日、台北市の台北世界貿易センターで開幕した。開幕式に出席した蔡英文（さいえいぶん）総統はあいさつで「行動で台湾の出版業界を支持してほしい」と来場を呼びかけた。\n\n蔡総統が同フェアの開幕式に出席するのは2年連続。\n\n蔡総統は、デジタル技術の発展に伴い、読書の形式と媒体が変化していることに触れ、文化部（文化省）が昨年、公立図書館での電子書籍の貸し出し拡大を目的に補助金を導入したことを紹介。この他、図書館の図書調達の改善やリアル書店の発展を後押しする政策も進めているとし、電子書籍や紙媒体の書籍産業を共に支援する政府の姿勢を示した。\n\n同フェアは文化部主催。32回目となる今年は500社近い出版社が出展した。台北世界貿易センター1館で25日まで。\n\n（邱祖胤／編集：名切千絵）,['https://newsatcl-pctr.c.yimg.jp/t/amd-img/20240220-00000005-ftaiwan-000-1-view.jpg?pri=l&w=640&h=427&exp=10800'],['https://news.yahoo.co.jp/articles/4c5ebf8c557abe915631509a2f72dc82ed12f56e/images/000']
台湾東部海域でM5級の地震3回発生（中央社フォーカス台湾）,https://news.yahoo.co.jp/articles/039aaf5d55123492fd1b069fbb713806f6cd1395,https://newsatcl-pctr.c.yimg.jp/t/amd-img/20240220-00000007-ftaiwan-000-1-view.jpg?exp=10800,2024-02-20T23:38:31+09:00,2024-02-20T23:38:31+09:00,中央社フォーカス台湾,ftaiwan,中央社フォーカス台湾,229,\n20日夜、M5級の地震が3回あった（中央気象署HPから）\n（台北中央社）中央気象署（気象庁）によれば、台湾の東部海域で20日夜、マグニチュード（M）5級の地震が相次いで3回あった。\n\n発生時刻は午後9時56分、同10時18分、同10時57分で、規模はそれぞれM5.4、M5.0、M5.6だった。震源の深さは25.7～50.9キロとなり、最大震度は2で東部・台東県（同10時57分）や中部・彰化県（同9時56分）で観測された。\n\n（編集：羅友辰）,['https://newsatcl-pctr.c.yimg.jp/t/amd-img/20240220-00000007-ftaiwan-000-1-view.jpg?pri=l&w=640&h=399&exp=10800'],['https://news.yahoo.co.jp/articles/039aaf5d55123492fd1b069fbb713806f6cd1395/images/000']
台湾プロ・統一ライオンズ、高知で春季キャンプ 地元チームと交流戦（中央社フォーカス台湾）,https://news.yahoo.co.jp/articles/a5e573b4329f6dae8a77e6dfff3862e276bc0db7,https://newsatcl-pctr.c.yimg.jp/t/amd-img/20240220-00000004-ftaiwan-000-1-view.jpg?exp=10800,2024-02-20T16:43:20+09:00,2024-02-20T16:43:20+09:00,中央社フォーカス台湾,ftaiwan,中央社フォーカス台湾,588,\n高知県内の野球場で統一ライオンズ一行を出迎える県議会日台友好議員連盟の弘田兼一会長（2列目右から4人目）、県日台親善協会の有田憲一会長（同6人目）ら（facebook.com/unilionsから）\n（台北中央社）高知県で春季キャンプ中の台湾プロ野球、統一ライオンズは20日、同県内の春野総合運動公園野球場で独立リーグの高知ファイティングドッグスと交流戦を行った。チームが同県でキャンプや交流戦を行うのは2019年以来2回目。期間中、3回の交流戦が予定されている。\n\n試合に先立ち、同県議会日台友好議員連盟の弘田兼一会長や同県日台親善協会の有田憲一会長が球場でチームを出迎え、県の名産品を選手らに贈った。弘田氏は、チームが高知での交流戦で多くの収穫を得られるよう願うと述べた。\n\n球団は、同県が優れた練習環境を提供し、県内での交流試合をセッティングしてくれたとして感謝を示し、弘田氏らに球団のキャップなどを贈った。林岳平監督は交流試合について、他のプロ選手と切磋琢磨（せっさたくま）して学ぶだけでなく、高知県を知る機会にもなるとコメントした。\n\nこの日の試合では、西武ライオンズでのプレー経験がある郭俊麟が先発に立った。統一は21日に韓国プロのハンファ・イーグルスB班と、23日には西武B班との交流戦をそれぞれ予定している。\n\n（謝静雯／編集：田中宏樹）,['https://newsatcl-pctr.c.yimg.jp/t/amd-img/20240220-00000004-ftaiwan-000-1-view.jpg?pri=l&w=640&h=426&exp=10800'],['https://news.yahoo.co.jp/articles/a5e573b4329f6dae8a77e6dfff3862e276bc0db7/images/000']
日本航空、13年ぶりの貨物専用機が台湾に到着 台日間の空輸市場成長見込み再開（中央社フォーカス台湾）,https://news.yahoo.co.jp/articles/66ddccc2ccce09ce535566e3bcd0ac8225b22e88,https://newsatcl-pctr.c.yimg.jp/t/amd-img/20240220-00000006-ftaiwan-000-1-view.jpg?exp=10800,2024-02-20T18:51:25+09:00,2024-02-20T18:51:25+09:00,中央社フォーカス台湾,ftaiwan,中央社フォーカス台湾,408,\n桃園国際空港に到着した日本航空の貨物専用機\n（桃園空港中央社）13年ぶりに運航が再開された日本航空の貨物専用機が19日夜、北部・桃園市の桃園国際空港に到着した。同社は、貨物専用機の運航再開は台日間における航空輸送市場の長期的な成長を見込んだものだとしている。\n\n同社は経営破綻した2010年に貨物専用機の運航を休止。昨年5月、ボーイング767-300ER型機を改修した貨物専用機の導入を決め、今年度末から東アジアを中心に運航すると発表していた。\n\nこの日同空港に到着したのは再開後の初便で、成田空港から飛び立った。桃園空港では、日本の対台湾窓口機関、日本台湾交流協会の服部崇台北事務所副代表や同空港運営会社の范孝倫総経理（社長）らが到着の瞬間を見届けた。\n\n日本航空は今後、安定した需要を持つ運輸業の協力企業を探し、専用機の稼働率や貨物搭載率を高めたいとしている。\n\n（呉睿騏／編集：田中宏樹）,['https://newsatcl-pctr.c.yimg.jp/t/amd-img/20240220-00000006-ftaiwan-000-1-view.jpg?pri=l&w=640&h=427&exp=10800'],['https://news.yahoo.co.jp/articles/66ddccc2ccce09ce535566e3bcd0ac8225b22e88/images/000']
台湾の観光船を中国が強制検査 離島・金門の沖合で 閣僚が遺憾表明（中央社フォーカス台湾）,https://news.yahoo.co.jp/articles/605a33d7f118a3c0190a2a1190fee226405c4a2b,https://newsatcl-pctr.c.yimg.jp/t/amd-img/20240220-00000003-ftaiwan-000-1-view.jpg?exp=10800,2024-02-20T15:54:18+09:00,2024-02-20T15:54:18+09:00,中央社フォーカス台湾,ftaiwan,中央社フォーカス台湾,827,\n中国海警局の臨検を受けた台湾の観光船（資料、facebook.com/KINGXIA.CRUISEから）\n（金門、台北中央社）中国福建省に近い離島・金門周辺の海域で19日午後、中華民国（台湾）籍の観光船が中国海警局から強制的に臨検を受けた。観光船は検査を受けた後、現場に急行した海洋委員会海巡署（海上保安庁に相当）の船に付き添われて金門に戻った。同委員会の管碧玲（かんへきれい）主任委員（閣僚）は20日、遺憾の意を示した。\n\n同署が19日夜に発表した報道資料によれば、観光船は同日午後3時33分、乗客23人と台湾籍の船員11人を乗せて金門から出港。周辺海域を案内しながら巡航していたところ、海警局の職員6人が検査のために観光船に乗り込んできた。職員は航行計画や船舶証書などを確認した後、船を離れた。\n\n同署は午後4時47分、レーダーや赤外線カメラシステムによって、金門島北西部烏沙角の北西2.8カイリ（約5キロ）で海警局の船2隻が観光船に接舷（せつげん）し、乗船して検査を実施しているのを把握。同署の船を直ちに現場に向かわせた。烏沙角の沖合は浅瀬が多いため、観光船は中国寄りを航行していた。\n\n同署は、中国側も同様の観光船を金門周辺で運航しているとし、故意でなく法に触れたり、誤って台湾側の水域に進入したりした船舶に対しては、善意に基づき、直ちに退去するよう音声で指示し、立ち入り検査は実施していないと説明。中国に対し、平和や理性にのっとり、海域の安寧を共に守るよう呼びかけた。\n\n管氏は20日、報道陣の取材に対し、観光船に違法の疑いは全くないと説明。海警局の立ち入り検査は人々の感情を傷つけ、パニックを生み、人々の利益にも合致しないと指摘した。また、観光船は中国寄りの位置にいたとはいえ、台湾海峡の平和や両岸（台湾と中国）の善意に基づき、中国側の行為に遺憾の意を表明すると述べた。\n\n（蔡孟妤、張已廉、陳俊華／編集：田中宏樹）,['https://newsatcl-pctr.c.yimg.jp/t/amd-img/20240220-00000003-ftaiwan-000-1-view.jpg?pri=l&w=640&h=426&exp=10800'],['https://news.yahoo.co.jp/articles/605a33d7f118a3c0190a2a1190fee226405c4a2b/images/000']
中国、金門周辺の巡回常態化発表 学者「水域進入なら深刻な挑発行為」／台湾（中央社フォーカス台湾）,https://news.yahoo.co.jp/articles/665b69590b86b050489451d233afa980f573e11d,https://newsatcl-pctr.c.yimg.jp/t/amd-img/20240220-00000001-ftaiwan-000-1-view.jpg?exp=10800,2024-02-20T11:54:11+09:00,2024-02-20T11:54:11+09:00,中央社フォーカス台湾,ftaiwan,中央社フォーカス台湾,1053,\n金門周辺の禁止水域と制限水域（中国語は限制水域）の範囲を示す略図\n（台北中央社）中国の海警局は18日、福建海警局が金門周辺を含む海域でパトロールを常態化すると発表した。金門は中国福建省に近い中華民国（台湾）の離島。専門家は、中国当局の船が台湾の離島周辺の禁止水域や制限水域に進入すれば、これは主権を犯す深刻な挑発行為となるとの見方を示している。\n\n金門周辺の海域では14日、海巡署（海上保安庁に相当）の巡視艇による追跡を受けていた中国船1隻が転覆し、中国人乗組員4人のうち2人が死亡する事故が発生。中国で対台湾政策を担当する国務院台湾事務弁公室（国台弁）は17日、両岸（台湾と中国）の漁業従事者は昔から金門やアモイ周辺の海域を伝統的な漁場としており、「いわゆる禁止水域や制限水域は元から存在しない」とする声明を発表していた。\n\n中国の軍事情勢などに詳しい台湾大学政治学科の陳世民副教授（准教授）は中央社の取材に対し、海警局は声明発表後には必ず行動に移すと指摘した上で、重要なのは事態を拡大させる意図があるかどうかだとの考えを示した。\n\n国台弁が禁止・制限水域について「存在しない」としたことに関しては、政治的な操作を通じて台湾の主権や法律を執行する権力を否定することで、台湾海峡を中国の「内海」にしようとする狙いがあるとした。また、頼清徳（らいせいとく）副総統が5月20日に総統に就任するのを前に、中国が台湾に対して圧力をかける行為は日に日に増していくだろうと述べた。\n\n淡江大学中国大陸研究所の趙春山栄誉教授は、中国が台湾海峡の暗黙のライン「中間線」から禁止・制限水域まで、台湾の権力を否定することで中国当局の正当性を示す「法律戦」を仕掛けているのは疑いようのない事実だと指摘。中間線を曖昧にしたり、禁止水域と制限水域を否定したりすることによって、中国は、一つの中国を巡り台湾と中国双方の窓口が1992年に形成したとされる「92年コンセンサス」に基づく暗黙の了解を消し去っているとの見方を示した。\n\n趙氏はさらに、中間線越えや海警局のパトロールが常態化された後に最も心配なのは偶発的な事件が勃発することだとし、そのリスクは増す一方だと述べた。また中国は直接衝突したり、戦争を仕掛けてきたりすることはないものの、台湾の主権に対する法律上の挑戦を継続していくだろうと解説。両岸がどのようにリスクをコントロールするかが最も重大で深刻な問題だと語った。\n\n（李雅雯／編集：田中宏樹）,['https://newsatcl-pctr.c.yimg.jp/t/amd-img/20240220-00000001-ftaiwan-000-1-view.jpg?pri=l&w=640&h=640&exp=10800'],['https://news.yahoo.co.jp/articles/665b69590b86b050489451d233afa980f573e11d/images/000']
国立国会図書館、英語版ページで台湾を「中国の省」と表記  外交部、訂正求める（中央社フォーカス台湾）,https://news.yahoo.co.jp/articles/cfe0ef93085aa6bd92bcd521802b5297d0e0c9b6,https://newsatcl-pctr.c.yimg.jp/t/amd-img/20240220-00000002-ftaiwan-000-1-view.jpg?exp=10800,2024-02-20T14:23:14+09:00,2024-02-20T14:23:14+09:00,中央社フォーカス台湾,ftaiwan,中央社フォーカス台湾,1000,"\n台湾が「中国台湾省」（TAIWAN, PROVINCE OF CHINA）と表記される「国立国会図書館サーチ」の英語版新規利用者登録ページ（全台連提供）\n（台北、東京中央社）国立国会図書館が提供する検索サービス「国立国会図書館サーチ」の英語版新規利用者登録ページの居住国選択欄で、台湾が「中国台湾省」（TAIWAN, PROVINCE OF CHINA）と表記されていることが分かった。外交部（外務省）は20日、台北駐日経済文化代表処（大使館に相当）に対し、同館に厳重に抗議し、誤りの訂正を求めるよう指示したと明らかにした。\n\n同サービスは先月5日、従来の2つのウェブサービスを統合、リニューアルする形で新たに公開された。日本語版の利用者登録ページの居住国選択欄では、台湾が「タイワン（台湾）」とされているが、英語版では「中国台湾省」と表記された。これに関し、在日台湾人団体の連合組織、全日本台湾連合会（全台連）が18日、同館の吉永元信館長宛てに抗議文を発表し、早急な訂正を求めていた。\n\n外交部の劉永健（りゅうえいけん）報道官は20日の定例記者会見で同館の英語版ページの表記の誤りについて、厳重に抗議するよう駐日代表処に指示したと説明。「中華民国台湾は独立した主権国家であり、中華人民共和国とは互いに隷属しない」とし、同館に対して訂正を求めると述べた。\n\n全台連は抗議文で、台湾人利用者が利用者登録を行う場合に「自分の国台湾を『中華人民共和国台湾省』と認めなくてはならないような仕組みになっている」と指摘。「台湾人にとって非常な侮辱であり、また事実とも著しく異なる」と非難した。その上で、「台湾は独立した主権国家であり、独自の政府、経済、文化を持っている」とし、「決して中国の一部ではない」と訴えた。\n\nまた、国立国会図書館が「真理がわれらを自由にするという確信に立つて、憲法の誓約する日本の民主化と世界平和とに寄与すること」を使命に掲げていることに触れ、「台湾を併呑すると公言し、『台湾はわれわれの領土だ』と虚偽のプロパガンダを重ねる中国におもねるような姿勢は国立国会図書館の精神に反する」と批判した。\n\n20日午後2時現在、英語版ページの居住国選択欄は「TAIWAN, PROVINCE OF CHINA」のままになっている。\n\n（呉昇鴻、楊明珠／編集：名切千絵）",['https://newsatcl-pctr.c.yimg.jp/t/amd-img/20240220-00000002-ftaiwan-000-1-view.jpg?pri=l&w=640&h=341&exp=10800'],['https://news.yahoo.co.jp/articles/cfe0ef93085aa6bd92bcd521802b5297d0e0c9b6/images/000']
