headline,mainEntityOfPage,image,datePublished,dateModified,author,media_en,media_jp,str_count,body,images,external_links
椿本チエインが事業者向けに電動アシスト付き3輪自転車「LA SI QUE」を販売へ（MONOist）,https://news.yahoo.co.jp/articles/194ec4ddef73c8483c1cb37a460fec5bc3efd1e5,https://newsatcl-pctr.c.yimg.jp/t/amd-img/20260611-00000008-it_monoist-000-1-view.jpg?exp=10800,2026-06-11T07:30:12+09:00,2026-06-11T07:30:12+09:00,MONOist,it_monoist,MONOist,1075,電動アシスト付き3輪自転車「LA SI QUE」（事業者用モデル） 椿本チエインは2026年6月8日、電動アシスト付き3輪自転車「LA SI QUE」の事業者向けの限定販売を同月15日に開始すると発表した。同自転車は工場などの大規模敷地内での荷物運搬や観光地でのシェアリングといった用途を想定して事業者向けに展開し、「荷物の運搬」「移動」の2つの課題の同時解決を目指す。販売価格は35万円からだ。 椿本チエインは新事業の1つとして「ビジネスやレジャー、日常使いなど、様々なシーンで荷物を安定して運べる、快適な電動アシスト3輪自転車」をコンセプトに、プロトタイプを2023年4月に開発した。同社独自開発の後輪スイング機構を搭載することで、従来の3輪自転車と比較し、重量物搭載時でも安定した走行が可能な新しい小型モビリティとしてLA SI QUEの商品化を進めてきた。 LA SI QUEは3輪の安定感と2輪車のような自然な操舵（そうだ）性を組み合わせ、従来にはなかった滑らかな乗り心地を提供し、段差や傾斜などさまざまな路面状況で圧倒的な走行性能を実現した。積載重量は最大30kgであり、低重心で高強度な自転車最大の積載性を確保している。 ブレーキ方式は前輪にワイヤーVブレーキを、後輪に油圧ディスクブレーキを採用。後輪のブレーキロック機構がスタンド代わりになる構造となっている。 サイズは全長1730×全幅590mmで、タイヤサイズは前輪が20インチ、後輪が16インチである。充電時間は約4時間であり、走行距離はアシスト力強モード時に1充電で60km、エコモード時に1充電で230kmだ。なおオプションとして、前かご、フェンダー、荷台を選択できる。 LA SI QUEは、当面の間は事業者向けに数量限定で販売し、将来的に一般向けへの販売を計画している。また、荷物運搬用以外にも多彩な荷台バリエーションを商品化予定だ。なお、同製品は東京都新宿区で開催予定の「BICYCLE-E・MOBILITY CITY EXPO2026（会期：2026年6月10～11日、場所：新宿住友ビル 三角広場）」に出展予定である。 椿本チエインは1917年にチェーンメーカーとして創業以来、搬送システムやモビリティ、モーションコントロールへと領域を拡大。「動かす」ことに関わるモノづくり企業として、さまざまな機械部品や自動車部品、これらを組み合わせた自動化システムを展開している。同社は今後もこれまでに培ってきた技術を活用して、新ビジネスを展開していく方針だ。 MONOist,[],[]
サイバー攻撃対策をAIが自動評価、27年3月迫る「SCS制度」にリコーが特化ツール（MONOist）,https://news.yahoo.co.jp/articles/a72794329d514dc618908024330ddba3e5aa5cdb,https://newsatcl-pctr.c.yimg.jp/t/amd-img/20260611-00000013-it_monoist-000-1-view.jpg?exp=10800,2026-06-11T07:00:12+09:00,2026-06-11T07:00:12+09:00,MONOist,it_monoist,MONOist,1077,「StarQuest for RICOH」の概要 出所：リコージャパン リコージャパンは2026年6月9日、SCS評価制度（サプライチェーン強化に向けたセキュリティ対策評価制度）対応支援プラットフォーム「StarQuest for RICOH」を同年6月30日より提供開始すると発表した。情報セキュリティ分野のスタートアップ企業のSecureNaviとの共同開発によるものだ。併せて、自社イベント「RICOH Value Presentation 2026」（2026年6月9～10日、東京ビッグサイト）において、サービス説明会とデモンストレーションを披露した。 AIアシスト機能による自動評価 2027年3月開始「SCS評価制度」の対象企業、要求事項は？ 近年、サプライチェーン攻撃による情報漏えいやシステム停止が大きな問題となっている。ランサムウェアによる被害が1件発生するだけで、復旧不能や長期間の業務停止に追い込まれるケースも少なくない。2025年にも、大手飲料メーカーがランサムウェアの感染によって受注／出荷業務の停止に追い込まれ、商品の供給網が長期間にわたって寸断される事態が起きたことは記憶に新しい。 こうした状況を受け、経済産業省はサプライチェーンを構成する企業のセキュリティ水準を底上げする仕組みとして、「サプライチェーン強化に向けたセキュリティ対策評価制度（SCS評価制度）」の導入を推進している。 SCS評価制度とは、サプライチェーンを構成する発注企業と受注企業が、共通の評価基準を用いて各社のセキュリティ対策レベルを「星1」から「星5」の5段階で可視化する仕組みだ。サプライチェーンに関わる全ての企業が対象であり、特に政府調達や重要インフラ事業者と取引のある企業には積極的な対応が推奨されている。 評価レベルのうち、星1と2は先行する自己宣言制度「SECURITY ACTION」を通じてすでに運用が始まっており、星3と星4が2027年3月以降に開始される予定だ。例えば星3は、全ての企業が最低限実装すべき対策と位置付けられており、システム防御や体制整備など26の要求項目について、毎年1回セキュリティ専門家が確認を行う。星4は、ガバナンスや検知／対応を含む包括的な内容に加え、取引先システムへの対策など43の要求項目を設け、3年に1回、第三者の検証事業者が審査する。 制度の導入により、発注側の企業は受注企業の対策状況を客観的に把握／管理できるようになる。一方の受注側にとっても、自社の安全性を取引先へ証明する有効な手段となる。,[],[]
AIで車載ソフトの開発期間を大幅短縮、AstemoのSDV子会社がデモを披露（MONOist）,https://news.yahoo.co.jp/articles/7039000a45d4597f1d4fdaebe18154aff21bad67,https://newsatcl-pctr.c.yimg.jp/t/amd-img/20260611-00000027-it_monoist-000-1-view.jpg?exp=10800,2026-06-11T06:45:16+09:00,2026-06-11T06:45:16+09:00,MONOist,it_monoist,MONOist,1327,「Cypremos SDV Engineering Suite」の概要［クリックで拡大］ 出所：Astemo Cypremos Astemoは、「人とくるまのテクノロジー展2026 YOKOHAMA」（2026年5月27～29日、パシフィコ横浜）において、完全子会社のAstemo Cypremosが手掛けるSDV（ソフトウェアデファインドビークル）エンジニアリングソリューション「Cypremos SDV Engineering Suite」のデモを披露した。 【「Cypremos SDV Engineering Suite」を用いた「テスト生成」と「FTA自動化」のデモの様子】 Astemo Cypremosは、2024年11月に設立されたSDVのソフトウェアクラウドサービス企業である。ティア1サプライヤーであるAstemoが車載システムなど車両内に対応する「In-Car領域」を担うのに対して、Astemo Cypremosはクラウドや通信の活用によって車両外の「Out-Car領域」から自動車の進化に貢献することを使命としている。 同社が開発を進めているのが、自動車開発のV字プロセスで最初の段階に当たる要件定義フェーズから、AI（人工知能）を活用した自動化によって車載ソフトウェアの開発期間の大幅な短縮を可能にするCypremos SDV Engineering Suiteである。 今回は、「テスト生成」と「FTA（Fault Tree Analysis）自動化」のデモを披露した。 テスト生成では、手動入力したテキストベースのテスト要件を基に、AIを用いて要件の内容を改善した上で、テストケースを自動生成するという内容だ。デモでは、生成したテストケースにエッジケースなどの条件を追加した上で再生成を行ってから、テストプログラムとなるスクリプトを自動で生成できることも示した。 FTA自動化では、「FTA分析アシスタント」との対話方式で作業を進めていく。最初は、帳票ツールなどで作成したベースになるFTAツリー図のスクリーンショットを読み込ませるところから始める。このFTAツリー図の内容をAIによって分析した上で、エラーなくFTA分析が行えるように条件を追加するなどしてから、クラウドベースのCypremos SDV Engineering SuiteでFTA分析を行えるように変換するという内容になっている。 なお、今回のデモではAIエンジンとして「Claude」を利用しているが、顧客の要望に合わせて他のAIエンジンに変更可能だ。顧客のデータベースから作成したRAG（検索拡張生成）などとの組み合わせも想定している。 Cypremos SDV Engineering Suiteは、機能の全てを一括で利用する必要はなく、今回デモを披露したテスト生成やFTA自動化などのサービス単位で導入できる点も大きな特徴だ。「自動車メーカーだけでなく、Astemoの競合であるティア1サプライヤーにも提供していきたい。そのためにAstemo Cypremosとして分社独立した」（Astemo Cypremosの説明員）という。 MONOist,[],[]
国内初、レアカードのサーチを防ぐトレカ向け紙製パッケージ（MONOist）,https://news.yahoo.co.jp/articles/774fc6577396394f2fc0fa5b0c30196a46f34ae0,https://newsatcl-pctr.c.yimg.jp/t/amd-img/20260611-00000007-it_monoist-000-1-view.jpg?exp=10800,2026-06-11T06:30:12+09:00,2026-06-11T06:30:12+09:00,MONOist,it_monoist,MONOist,1345,紙製ピロー包材のイメージ［クリックで拡大］ 出所：TOPPAN TOPPANホールディングスのグループ会社であるTOPPANは2026年6月8日、国内で初めて（同社調べ）、トレーディングカード向けに遮光性のある紙製ピロー包材を開発したと発表した。国内外のトレーディングカードメーカーを対象にサンプル出荷を同月に開始する。 今回の包材の構造［クリックで拡大］ 出所：TOPPAN 2026年秋より専用ラインで量産開始 近年、国内のトレーディングカード市場は急速な拡大を続けており、2024年度の市場規模は2019年度比で約3倍の3000億円を突破した。アパレルブランドや飲食チェーンなどさまざまな業種や企業とのコラボレーションも増加しており、世代や国境を越えた文化として定着している。 一方、国内外で環境意識の高まりを受け、欧州を中心とした包装資材への規制強化や、CO2をはじめとした温室効果ガスの排出抑制への要求、脱プラスチックへの要求が活発化している。 これに伴い、グローバルに展開するトレーディングカードメーカーからも環境配慮設計が強く求められている。 しかし、トレーディングカードのパッケージに紙素材を採用するに当たっては、中身を確実に保護し、開封前にレアカードを判別されるサーチ行為を防ぐ高度な遮光性能の実現や、シワを抑えて成形する技術、高品質な生産体制の維持が重要なポイントとなっていた。 そこでTOPPANは、これまで培ってきた紙製パッケージの開発／生産技術を生かし、最適な素材選定と専用の製袋装置の開発を推進している。これにより、紙素材の弱点である中身の透けを防止するとともに、シワを低減し、高品質な紙製ピロー包材の安定供給体制を構築。そして、トレーディングカード向けに遮光性のある紙製ピロー包材を開発した。 一般的なプラスチック包材は、強度を保つ部材や接着用のシーラント層にプラスチック素材を組み合わせた材質構成になっているが、今回の製品は、ヒートシール性を有するコート層と紙素材のみから成る独自の材質構成により、プラスチック使用量ゼロを実現した。 同製品は紙重量比51％以上のため、国内においてパッケージに「紙マーク」を付与でき、企業の資源循環への取り組みを可視化して訴求可能だ。 加えて、紙素材にアルミ蒸着を施すことで、98％以上の高い遮光率を実現した。これにより、紙素材の弱点である中身の透けを遮断し、開封前に中身を判別できないようにすることで、レアカードのサーチ行為を防げる。 また、アルミ蒸着層の上に直接印刷を施す構造により、メタリックな質感を表現し、従来のプラスチック包材と同等の高いデザイン再現や鮮やかな発色を可能にした。 独自開発の専用製袋機では、紙製ピロー包材のシワを抑制し、かつ高速な折り込みを実現するために、折り込み部の治具の開発や送りだしローラーの改良を行った。同機の導入により、紙製素材の弱点であるシワの発生を低減し、高品質なパッケージの安定供給体制を構築した。2026年秋より専用ラインでの量産を開始する。 2026年秋の量産開始時点で年間3000万パックの供給体制を構築し、2030年までに関連受注含め10億円の売上高を目指す。 MONOist,[],[]
EVモーター小型化に役立つ絶縁被覆材、有機溶剤は不要（MONOist）,https://news.yahoo.co.jp/articles/5f4e31025d371ccbef2ab9e4e03792aa76b6d2e7,https://newsatcl-pctr.c.yimg.jp/t/amd-img/20260611-00000006-it_monoist-000-1-view.jpg?exp=10800,2026-06-11T06:00:16+09:00,2026-06-11T06:00:16+09:00,MONOist,it_monoist,MONOist,1767,今回の被覆材がコーティングされたマグネットワイヤ［クリックで拡大］ 三菱ケミカルは、「人とくるまのテクノロジー展 2026 YOKOHAMA」（2026年5月27～29日、パシフィコ横浜）に出展し、開発品の「マグネットワイヤ用絶縁被覆材」や「高放熱絶縁樹脂シート」を披露した。 マグネットワイヤ用絶縁被覆材の概要［クリックで拡大］ 出所：三菱ケミカル 被覆技術の検証は完了 電気自動車（EV）のモーターでは、エネルギー変換効率の向上と小型／軽量化が求められている。一方、モーター内部のマグネットワイヤ（巻線）には従来、ステーターのコイルに液体状の絶縁樹脂（ワニス）を含浸／塗布し、熱や紫外線で硬化させる工程「ワニス法」が使用されていた。 しかし、従来のワニス法では製造工程において有機溶剤が使用されるため、揮発性有機化合物（VOC）の排出量やカーボンフットプリントの増大が課題となっている。こうした課題を解決する製品として、同社はマグネットワイヤ用絶縁被覆材を開発した。 マグネットワイヤ用絶縁被覆材は、200℃での部分放電開始電圧が従来品と比べて1.5倍だ。同材料は、絶縁層を薄膜化できるため、モーターの小型化と高占積率化に貢献する他、金属密着性に優れた熱可塑性樹脂で単層被膜が行える。 同社の説明員は「マグネットワイヤ用絶縁被覆材は従来のワニスを用いず、『押出成形』によって薄膜コーティングを行う新しい被覆材だ。製造工程で有機溶剤を使用しないため環境負荷が低く、カーボンフットプリントの削減に貢献する。被覆技術の検証は完了しており、今後はパートナー企業と連携して実際のモーターへの実装と検証を進める」と話す。 モジュール内部のセラミック絶縁基板を不要に 1つのパッケージに2つのIGBT素子（スイッチ）を内蔵したパワー半導体モジュールである「2-in-1 IGBT」などの従来のパワーモジュールは、内部に高い絶縁性を持たせるため、セラミックを用いた放熱基板が使用されてきた。 この構造は、薄いセラミック板を2枚の銅板で挟み込み、さらにそれを銀シンタリング（焼結接合）などのプロセスで接合した多層構造となる。しかし、セラミック基板は高価であることに加えて、熱膨張差などにより「反り」などが発生するという課題がある。 そこで同社は、独自開発の特殊窒化ホウ素フィラーとエポキシ樹脂を配合した高放熱絶縁樹脂シートを開発した。同シートは、パワーモジュールと冷却プレートを接着／固定するための、高い絶縁能力を備えた樹脂シートだ。パワーモジュールと冷却フィンを接合した直接冷却構造体向けの製品で、放熱／絶縁／接着の3機能に対応できるため、トータルコストの削減を図れる。 同社の説明員は「高放熱絶縁樹脂シートが、これ自体が絶縁機能を担うため、従来モジュール内部に必要だったセラミック絶縁基板が不要になる。セラミックなどの部材が減ることで全体のコストダウンが図れることに加えて、熱抵抗が下がることで放熱性能も向上する」と述べた。 高放熱絶縁樹脂シートのラインアップは、放熱基板（IMB）向けの「SH-A206」や、モジュール貼り合わせ向けの「SH-A204」と開発品の3種類となる。 SH-A206の熱伝導率（Typical、ASTM D5470）は16.5W/mKで、絶縁耐圧（Typical）は8kV AC、電気／電子機器や自動車部品に使用されるプラスチック材料の難燃性を評価する国際的な規格「UL94」で難燃グレード「V-0」を取得している。 SH-A204の熱伝導率は15W/mKで、開発品の熱伝導率は18W/mK、両製品ともに、絶縁耐圧は8kV AC、UL94で難燃グレードを取得予定だ。既に、SH-A206とSH-A204は販売されている。 「パワーモジュールのメーカーであるインフィニオン・テクノロジーズは現在、内部に絶縁基板を持たない新しいタイプの2-in-1 IGBTモジュールの開発を進めており、三菱ケミカルはその開発プロセスにおいてこの高放熱絶縁樹脂シートを提供している。このモジュールの基礎開発は完了しており、発売後は当社の高放熱絶縁樹脂シートがオプションとして提案される可能性はある」と同社の説明員はいう。 MONOist,[],[]
