headline,mainEntityOfPage,image,datePublished,dateModified,author,media_en,media_jp,str_count,body,images,external_links
神戸市道夢野白川線で3台絡む事故、単車の男性が重傷　車がカーブ曲がりきれず正面衝突（神戸新聞NEXT）,https://news.yahoo.co.jp/articles/a547a75fb9f28af583659778a32081a34e318069,https://newsatcl-pctr.c.yimg.jp/t/amd-img/20260523-00000006-kobenext-000-3-view.jpg?exp=10800,2026-05-23T23:52:33+09:00,2026-05-23T23:54:14+09:00,神戸新聞NEXT,kobenext,神戸新聞NEXT,292,神戸市の重大交通事故 ２３日午後７時１５分ごろ、神戸市兵庫区鵯越筋、市道夢野白川線鵯トンネルの北側５０メートル付近で、乗用車と、単車、マイクロバスの３台が絡む事故があった。単車を運転していた同市長田区の男性（５６）脚などに重傷を負ったもよう。 【地図】この事故の発生場所 兵庫署によると、乗用車がカーブを曲がりきれず、対向車線を走っていた単車と正面衝突。後続の自動車学校の送迎マイクロバスにも衝突したという。署は、乗用車を運転していた加古川市の男性会社員（１９）に任意で事情を聴いている。 現場は片側１車線の急な左カーブ。事故の影響により周辺は約３時間にわたり、片側交互通行となった。,[],[]
警察官宿舎の空き部屋に無断で入り込んだ疑い　逮捕の56歳男「住む所がなかった」（神戸新聞NEXT）,https://news.yahoo.co.jp/articles/07bc2d68a615d6cc1197863ecd7419d6943b6a38,https://newsatcl-pctr.c.yimg.jp/t/amd-img/20260523-00000005-kobenext-000-6-view.jpg?exp=10800,2026-05-23T22:54:09+09:00,2026-05-23T22:58:17+09:00,神戸新聞NEXT,kobenext,神戸新聞NEXT,363,兵庫県警伊丹署＝伊丹市千僧１ 兵庫県警の警察官宿舎の一室に無断で入り込んだとして、県警伊丹署は２３日、邸宅侵入の疑いで、住所不定無職の男（５６）を現行犯逮捕した。調べに「住む所がなかった」と容疑を認めているという。 【写真】「彼氏、幼く見えるね」ＳＮＳ発端 少年ら５０人巻き込む傷害事件に 逮捕容疑は同日午前、伊丹市鋳物師２の県警緑ケ丘待機宿舎４階の空き部屋に、正当な理由なく侵入した疑い。 同署によると、この日、エアコン室外機を取り外すため、工事業者と管理人がマスターキーを使って部屋に入ろうとしたが、内側からチェーンで施錠されていたため、不審に思い１１０番したという。 駆けつけた伊丹署員がチェーンを切断して入り、男を発見。宿舎は来年３月に取り壊される予定で、建物は空き部屋が多い状態だった。オートロックはなかったという。,[],[]
商業施設「ゆめタウン姫路」でサル出没、中学生がひっかかれる　姫路市内で被害相次ぐ（神戸新聞NEXT）,https://news.yahoo.co.jp/articles/0de95f13f97b2336c96f03b76b4d5a709064d84d,https://newsatcl-pctr.c.yimg.jp/t/amd-img/20260523-00000004-kobenext-000-5-view.jpg?exp=10800,2026-05-23T21:22:36+09:00,2026-05-23T21:43:55+09:00,神戸新聞NEXT,kobenext,神戸新聞NEXT,339,神戸新聞ＮＥＸＴ ２３日午後６時前、兵庫県姫路市神子岡前３の商業施設「ゆめタウン姫路」の従業員の女性から「サルが出て、中学生が負傷した」と１１０番があった。ともに立体駐車場の１階にいた中学３年生の男子生徒（１４）が首の後ろをひっかかれ、別の女児（５）も右足首を強くつかまれる軽傷を負った。 【写真】過去に県内で出没したサル 県警飾磨署によると、２人はそれぞれ家族で買い物に来ていた。女児が先に襲われ、男子生徒は後ろから飛びつかれたという。 姫路市内ではサルによる被害が相次ぐ。４月２８日には同市東今宿３の駐車場で会社員の女性が左腕をかまれ、５月１５日には同市岡田の公園で小学２年生の女子児童も左腕に軽傷を負った。今回を含め３カ所は、ゆめタウン姫路を中心に約１・５キロ圏内にある。,[],[]
将棋の女流王位戦、福間が3連勝でタイトル防衛　タイトル獲得数は68期に（神戸新聞NEXT）,https://news.yahoo.co.jp/articles/b13a8c5bb387702fa383419b1b60c9a94fac416b,https://newsatcl-pctr.c.yimg.jp/t/amd-img/20260523-00000003-kobenext-000-6-view.jpg?exp=10800,2026-05-23T18:42:55+09:00,2026-05-23T18:45:53+09:00,神戸新聞NEXT,kobenext,神戸新聞NEXT,233,福間香奈女流王位 将棋の第３７期女流王位戦（神戸新聞社など新聞三社連合主催）５番勝負の第３局が２３日、福岡県飯塚市の麻生大浦荘で指され、後手番の福間香奈女流王位（３４）＝清麗、女王、女流王座、倉敷藤花＝が、挑戦者の大島綾華女流二段（２３）を破った。 【写真】福間女流五冠に追い風、女性初のプロ棋士誕生に現実味 福間は開幕から無敗の３連勝でタイトル防衛し、女流王位戦８連覇（通算１２期獲得）を果たした。女流タイトル獲得数を６８期とし、自身の持つ歴代最多記録を伸ばした。,[],[]
千姫「輿入れ行列」、姫路城下あでやかに　お城まつり、大名行列「ナンバ歩き」も披露　兵庫（神戸新聞NEXT）,https://news.yahoo.co.jp/articles/048753f8a352173d48ddbd5942f1a5b33fa6e936,https://newsatcl-pctr.c.yimg.jp/t/amd-img/20260523-00000002-kobenext-000-5-view.jpg?exp=10800,2026-05-23T18:09:53+09:00,2026-05-23T18:27:49+09:00,神戸新聞NEXT,kobenext,神戸新聞NEXT,553,千姫に扮した姫路お城のアンバサダーらが登場したパレード＝２３日午後、姫路市の大手前通り（撮影・中西幸大） 世界文化遺産・国宝姫路城（姫路市本町）周辺で開かれている第７６回姫路お城まつりは２３日、恒例の歴史体感パレードを迎えた。千姫ら姫路ゆかりの姫君に扮した「輿入れ行列」をはじめ、あでやかな着物や古式ゆかしい衣装を身にまとった一行が城下町を彩った。 【写真】千姫に扮した姫路お城のアンバサダーらが登場 千姫は徳川家康の孫で、姫路城主だった本多忠政の嫡男忠刻に嫁いだ。輿入れ行列は名城を望む大手前通りで行われ、市の魅力を発信する「姫路お城のアンバサダー」の女性３人が千姫らになりきって登場。国内外の見物客に笑顔を振りまいた。 続いて、江戸時代中後期の姫路藩を治めた酒井家の衣装や道具を再現した「姫路大名行列」が開演。総勢約７０人が左右同じ側の手脚を動かす「ナンバ歩き」を披露した。これまで行列は一方通行だったが、今回初めてＵターン行進を行い、ナンバ歩きの動きから解放された演者たちは、観衆に手を振りながら来た道を戻った。 お城まつりは１９４８年、先の大戦で焼失を免れた姫路城を復興のシンボルに始まった。最終日の２４日は、城に近い大手前公園などで第２５回ひめじ良さ恋まつりがあり、フィナーレを飾る。（有島弘記）,[],[]
ヴィッセル神戸、J1百年構想リーグで西の1位に　最終節、福岡を1-0で破る（神戸新聞NEXT）,https://news.yahoo.co.jp/articles/e5c41671ae2845c8cb1a584ad22e3100a1ba2b70,https://newsatcl-pctr.c.yimg.jp/t/amd-img/20260523-00000001-kobenext-000-3-view.jpg?exp=10800,2026-05-23T16:47:58+09:00,2026-05-23T16:52:10+09:00,神戸新聞NEXT,kobenext,神戸新聞NEXT,500,福岡－神戸 前半終了間際、左クロスを上げて先制点をアシストした神戸の武藤（右）＝ベスト電器スタジアム 明治安田Ｊ１百年構想リーグ最終節の２３日、ヴィッセル神戸は敵地のベスト電器スタジアム（福岡市）でアビスパ福岡と対戦し、トゥーレルの先制点を守って１－０で破り、西の１位が決まった。１１勝７敗（うちＰＫ戦２勝４敗）で勝ち点３５となった。プレーオフラウンドでは東１位の鹿島アントラーズとホームアンドアウェーで対戦し、優勝すればアジア・チャンピオンズリーグ・エリート（ＡＣＬＥ）の出場権を得る。 【写真】前半終了間際、ヘッドで先制点を決める神戸のトゥーレル 神戸は前半２４分、相手のＣＫから強烈なボレーシュートでゴールネットを揺らされたが、ハンドに救われて得点は取り消された。３０分近くまで自陣に押し込まれてシュートも打てなかったが、前半終了間際、ジエゴのロングスローを起点に好機が生まれる。逆サイドの武藤が上げた左クロスに、ゴール前の混戦でトゥーレルが頭で合わせ、２戦連続弾で先制した。 後半は一転攻勢に出て、カウンターも浴びたがＧＫ権田が好セーブ。終盤はボールを保持してじっくり時間を使い、逃げ切った。,[],[]
ボーダーコリー大集合　全国から196匹、「西日本最大級」のオフ会　丹波・山南（神戸新聞NEXT）,https://news.yahoo.co.jp/articles/2e3ffd1f37b514c2d885d39c7dc64d9f660fa925,https://newsatcl-pctr.c.yimg.jp/t/amd-img/20260516-00000007-kobenext-000-3-view.jpg?exp=10800,2026-05-23T12:47:00+09:00,2026-05-23T13:24:01+09:00,神戸新聞NEXT,kobenext,神戸新聞NEXT,807,イベントでトリックに挑戦するボーダーコリーと家族ら＝グランドロックキャッスル 知能や運動能力が高いことで知られるボーダーコリーと暮らす愛犬家らの「オフ会」が、犬と飼い主の休息や健康づくりに特化した施設「グランドロックキャッスル」（丹波市山南町金屋）で開催された。全国から１９６匹が集結し、規模は「西日本最大級」だったという。ボーダーコリーたちは、家族や出合った仲間らと自然豊かな会場で存分に触れ合った。（秋山亮太） 【写真】全国から集結したボーダーコリーとその家族 同施設は２０２３年、犬と飼い主の健康づくりをコンセプトの中心に据えてオープンした。大型犬でも十分な運動ができる広大なドッグランや、林道を生かした散策コースなどを備え、日帰りや宿泊で利用できる。 「ボダコＤＡＷＡＮ！」と題した集いは、愛犬家らでつくるグループが、施設と協力して昨年から開催している。交流サイト（ＳＮＳ）でつながった人らが集まって親睦を深める「オフ会」で、同じ犬種で２００匹近く集まる機会は多くない。特に都市部では開催が難しく、同施設としては、そうした場の実現に寄り添うことで「（犬に優しい環境やサービスが整っている）ドッグフレンドリーなまち」として丹波市自体のファンを増やすことも狙う。 一堂に会して写真撮影を楽しんだほか、円盤をキャッチして楽しむ「ディスクパフォーマンス」や、技や芸を通じて知育やコミュニケーションの深化にもつながる「トリック」の講座などが催された。犬の健康を考えたこだわりのフードが並ぶマルシェも開設。愛犬たちがのびのびと遊ぶ一方で、家族らもバーベキュー料理などに舌鼓を打った。 神戸市からまな娘の「メリー」と参加した佐藤真弓さん（４５）は「（ほかの犬が苦手な）犬見知りの面があるが、広い会場のおかげでマイペースを守れて心安かったと思う。ここなら友達の輪も広がりそう。プライベートでも宿泊に訪れたい」と話していた。,[],[]
神戸学院大カラーの万年筆インク誕生　学生発案、老舗文具メーカーに直談判　キャンパスイメージの2色（神戸新聞NEXT）,https://news.yahoo.co.jp/articles/3f536fa9a64c7dcf2bd480904fae5f3719ec0da0,https://newsatcl-pctr.c.yimg.jp/t/amd-img/20260523-00000000-kobenext-000-3-view.jpg?exp=10800,2026-05-23T10:00:14+09:00,2026-05-23T10:08:50+09:00,神戸新聞NEXT,kobenext,神戸新聞NEXT,1156,二つのキャンパスをイメージした「神戸インク物語」を紹介する（左から）鎌谷樹来さん、押場帆香さん、西本楽さん＝神戸学院大学ポートアイランドキャンパス 神戸市中央区江戸町の老舗文具メーカー「ナガサワ文具センター」の万年筆インク「Ｋｏｂｅ ＩＮＫ（神戸インク）物語」に、神戸学院大学をイメージした２色が誕生した。中央区のポートアイランドと西区の有瀬のキャンパスをそれぞれ青と緑で表現。学生が「自分の大学の色が欲しい」と声を上げ、１年半がかりで完成させた。（中村有沙） 【写真】完成したインクで文字を書いてみた 神戸の街の風景を色で表す神戸インク物語は、２００７年の発売以来、１５０色以上を展開している。大学ともコラボし、これまでに神戸大、甲南大、神戸松蔭大のカラーが出ている。 ４例目となった神戸学院大は、現代社会学部３年生の押場帆香（ほのか）さん（２０）の発案だった。神戸インク物語を知っており、「自分が通う大学の色で日記を書きたい」と考えていたという。 １年生の冬、ナガサワ文具センターの店舗を訪れた際に、生みの親で商品開発室長の竹内直行さん（７０）にたまたま会うことができ、その場で直談判。大学側の許可も自ら取り付け、開発プロジェクトが本格的に動き出した。 メンバーは現代社会学部、経営学部、人文学部の学生有志１８人。竹内さんが試作した色合いを確認し、ポーアイは、空と海の透明感を表現した青に決まった。商品名は「Ｐｏａｉ Ｃａｍｐｕｓ Ｂｌｕｅ（ポーアイキャンパスブルー）」で、「Ｐｏａｉ」はハワイの言葉で「輪」を意味する単語の表記という。 これに対し、有瀬は即決に至らなかった。竹内さんが示した緑は明るい色味が多く、イメージに合わなかったという。有瀬キャンパスで学ぶ人文学部の４年生、鎌谷樹来（いつき）さん（２２）は「有瀬の６０年の伝統を、もっと深い色で表現したいと伝えた」と振り返る。 メンバーの意見を踏まえて竹内さんが再度試作し、完成したのが「Ａｒｉｓｅ Ｃａｍｐｕｓ Ｇｒｅｅｎ（アリセキャンパスグリーン）」。キャンパスに生える常緑樹を参考にした深みのある緑で、自然の中で学びを続けてきた大学の歴史を表している。「Ａｒｉｓｅ」には「始まる」などの意味を持つ英単語を重ね、未来への希望を込めた。 パッケージのデザインもメンバーが担当した。ポーアイは、経営学部４年生、西本楽（がく）さん（２２）が撮影した、神戸港と六甲山地に茶色の校舎を絡めた写真をあしらった。 完成品を確認した発案者の押場さんは「一生の宝物」と満足そう。「卒業生が大学時代を振り返るきっかけにもなってほしい」と話す。 今月３０日からナガサワ文具センターの各店舗などで発売予定。各２７５０円（税込み）。同センターＴＥＬ０７８・３２１・３３３３,[],[]
