headline,mainEntityOfPage,image,datePublished,dateModified,author,media_en,media_jp,str_count,body,images,external_links
集まったゴミはおよそ６５０キロ！　ゲーム感覚で楽しみながらごみを拾う大会が静岡・富士市で行われる　（静岡朝日テレビ）,https://news.yahoo.co.jp/articles/d5db87f1621d6a3274cbe6358473e895ef65d0dd,https://newsatcl-pctr.c.yimg.jp/t/amd-img/20260523-00087896-satvv-000-1-thumb.jpg?exp=10800,2026-05-23T18:17:07+09:00,2026-05-23T18:17:07+09:00,静岡朝日テレビ,satvv,静岡朝日テレビ,288,ゲーム感覚で楽しみながらごみを拾う大会が静岡県富士市で行われました。 この大会は拾ったゴミの質と量をポイント化してチームで競うものです。地元の子供たちや企業など１５４チームが参加し、参加者らはゲーム感覚で楽しみながらゴミを集めていました。 ●参加者： 「学校が富士市にあるので富士市がきれいになるのがすごく良い」 ●参加者： 「地域貢献ができるのがこういう機会しかないので、めちゃくちゃ良い機会だと思う」 ●主催した東名グループ 上柳正仁代表： 「まちをきれいにしようという文化が広がっていくことを期待したい」 23日の大会ではおよそ６５０キロのゴミが集まったということです。,[],[]
俳優、磯村勇斗さんが企画「しずおか映画祭」が静岡市内で開催　役所広司さんがトークショーに参加（静岡朝日テレビ）,https://news.yahoo.co.jp/articles/b7d1ecc1520b767f591ebb2faf6a07b23b026341,https://newsatcl-pctr.c.yimg.jp/t/amd-img/20260523-00087893-satvv-000-1-thumb.jpg?exp=10800,2026-05-23T18:15:41+09:00,2026-05-23T18:15:41+09:00,静岡朝日テレビ,satvv,静岡朝日テレビ,306,静岡県沼津市出身の俳優、磯村勇斗さんが企画した映画祭が静岡市内で行われました。 しずおか映画祭は磯村さんが、「映画を身近に感じてほしい」と企画し、静岡県とゆかりがある作品などが上映されます。 ●磯村勇斗さん： 「自分がしずおか映画祭を地元でやれると思っていなかったので。すごく最近静岡に呼ばれている気がして、静岡で自分は骨を埋めていくんだろうなと」 23日は映画「パーフェクトデイズ」が上映されたほか、主演の役所広司さんが参加したトークショーも開かれ、会場の映画ファンを喜ばせました。 ●役所広司さん： 「この静岡で力強い映画祭が開かれているっていうことは本当に心強いこと」 しずおか映画祭は24日も開かれます。,[],[]
宮沢博行元衆院議員が新政治団体「創生党」立ち上げ　6月1日に会見　関東で複数候補を擁立（静岡朝日テレビ）,https://news.yahoo.co.jp/articles/9c7b31a6f93b52bd969647859ea66a4ffae2c9f9,https://newsatcl-pctr.c.yimg.jp/t/amd-img/20260523-00087895-satvv-000-2-thumb.jpg?exp=10800,2026-05-23T18:13:41+09:00,2026-05-23T20:41:05+09:00,静岡朝日テレビ,satvv,静岡朝日テレビ,272,元衆議院議員の宮沢博行さんが新しい政治団体を立ち上げることが分かりました。 宮沢さんは静岡朝日テレビの取材に、６月１日に都内で会見を開き、政治団体「創生党」の設立を発表すると明らかにしました。保守勢力の結集を目指し、都内を始め、関東で市議会議員など複数の候補者を擁立します。 宮沢さんは磐田市出身で、２０１２年の衆院選で静岡３区から初当選。４期衆院議員を務めましたが、自身の女性問題などで2024年自民党を離党し、その年の衆院議員選挙に無所属で出馬したものの落選しています。 宮沢さんは「やる気と誇りと希望の持てる日本を創りたい」としています。,[],[]
「大量の薬を買う人には事情を聞くように」静岡県が若者の薬物乱用対策の方針を示す（静岡朝日テレビ）,https://news.yahoo.co.jp/articles/d4480f2bdc5b6ae3760ab65eec9b8d5a59e3d737,https://newsatcl-pctr.c.yimg.jp/t/amd-img/20260523-00087886-satvv-000-1-thumb.jpg?exp=10800,2026-05-23T14:41:17+09:00,2026-05-23T14:41:17+09:00,静岡朝日テレビ,satvv,静岡朝日テレビ,204,静岡県は若者の薬物乱用対策の方針を示しました。 会議では市販の風邪薬などを過剰摂取する「オーバードーズ」が、近年若年層を中心に蔓延していることや、違法薬物にからむ犯罪が増加していることを受け、啓発活動や取り締まりを徹底することを確かめました。 県内では去年、オーバードーズと疑われる救急搬送が３５３件確認されています。県は大量の薬を買う人には 事情を聞くようドラッグストアなどに協力を求めていくとしています。,[],[]
静岡大学浜松キャンパスと浜松医科大学が静岡県と連携協定締結へ　地域社会の発展と人材育成につなげることが目的（静岡朝日テレビ）,https://news.yahoo.co.jp/articles/18c4143b9498e135ef1cd94ee6392d80c88b3338,https://newsatcl-pctr.c.yimg.jp/t/amd-img/20260523-00087883-satvv-000-1-thumb.jpg?exp=10800,2026-05-23T14:25:54+09:00,2026-05-23T14:25:54+09:00,静岡朝日テレビ,satvv,静岡朝日テレビ,264,静岡大学浜松キャンパスと浜松医科大学が静岡県と連携協定を結ぶことが分かりました。 両大学は統合再編に向けた動きが停滞する中、去年１２月に静岡市・浜松市とそれぞれ包括連携協定を締結しています。 関係者によりますと、県との協定締結は教育や研究をはじめとした地域社会の発展と、人材育成につなげることが目的だといいます。 日程の最終調整をしていて、６月にも協定を締結するということです。 両大学をめぐっては、統合再編問題が平行線を辿っていて、静岡大学の日詰一幸学長は４月、「浜松医科大学との色々な協議を進めていく」などと話していました。,[],[]
少なくとも１００人に２０００回以上乾燥大麻などを密売したか　「アルカポネ」と名乗るグループの男４人を逮捕（静岡朝日テレビ）,https://news.yahoo.co.jp/articles/8beee7abd3656e0dd4eb87a72922cb8647bbd852,https://newsatcl-pctr.c.yimg.jp/t/amd-img/20260523-00087884-satvv-000-4-view.jpg?exp=10800,2026-05-23T13:00:07+09:00,2026-05-23T14:39:08+09:00,静岡朝日テレビ,satvv,静岡朝日テレビ,315,押収された薬物（静岡中央署） 静岡県内で２０代を中心に大麻などの違法薬物を密売していたとして、男４人が逮捕されました。 麻薬取締法違反の疑いで逮捕された藤枝市の建設業の男（２５）ら男４人は、去年９月、藤枝市の飲食店の駐車場で２０代の男に大麻リキッド０・７グラムを販売した疑いがもたれています。 ４人は男をリーダーとする「アルカポネ」と名乗るグループで、県内で少なくとも１００人に、２０００回以上乾燥大麻と大麻リキッドの密売を繰り返したとみられています。 警察はこれまでに購入者およそ４５人を検挙していて、およそ８割が２０代以下だということです。 警察は４人の認否を明らかにしておらず、薬物の仕入れルートなど全容解明を進めています。,[],[]
軽乗用車を飲酒運転　民家に接触する事故起こしてそのまま逃走　静岡市の５０代の男を逮捕　（静岡朝日テレビ）,https://news.yahoo.co.jp/articles/c75c39c47f84b35741c7150f703f142847930ce0,https://newsatcl-pctr.c.yimg.jp/t/amd-img/20260523-00087878-satvv-000-1-view.jpg?exp=10800,2026-05-23T10:35:47+09:00,2026-05-23T10:35:47+09:00,静岡朝日テレビ,satvv,静岡朝日テレビ,305,静岡中央警察署 飲酒運転で単独事故を起こしたとして、パート従業員の５０代の男が逮捕されました。 道路交通法違反の疑いで逮捕されたのは、静岡市葵区のパート従業員の男（５６）です。男は、２１日午後８時半ごろ、静岡市内で軽乗用車を飲酒運転して民家に接触する事故を起こし、そのまま逃げた疑いがもたれています。被害を受けた民家は、雨戸の戸袋が破損し、男が運転していた軽乗用車は左ミラーが破損したということです。 警察によりますと、男は事故のあと一度立ち去るも、その後現場に戻ったということで、通報により駆け付けた警察官が検査をしたところ、男から基準値を超えるアルコールが検出されました。調べに対し男は容疑を認めています。,[],[]
