headline,mainEntityOfPage,image,datePublished,dateModified,author,media_en,media_jp,str_count,body,images,external_links
大会2日目が終了、14歳以下のベスト8が出揃う [DUNLOP CUP第47回全国選抜ジュニアテニス選手権大会]（テニスマガジンONLINE）,https://news.yahoo.co.jp/articles/2c461720390ed3d32d4f4d95dabd6ca3486b4df4,https://newsatcl-pctr.c.yimg.jp/t/amd-img/20260515-00034166-tennismagv-000-1-view.jpg?exp=10800,2026-05-15T23:30:00+09:00,2026-05-15T23:30:00+09:00,テニスマガジンONLINE,tennismagv,テニスマガジンONLINE,1677,大会2日目が終了、14歳以下のベスト8が出揃う [DUNLOP CUP第47回全国選抜ジュニアテニス選手権大会] 「DUNLOP CUP第47回全国選抜ジュニアテニス選手権大会兼ワールドジュニアテニス世界大会代表選考会」（千葉・吉田記念テニス研修センター）で14歳以下男子シングルス準々決勝に進出した石部宝之助（関東／はちおうじ庭球塾）（写真提供◎公益財団法人吉田記念テニス研修センター） 公益財団法人日本テニス協会（JTA）などが主催する「DUNLOP CUP第47回全国選抜ジュニアテニス選手権大会兼ワールドジュニアテニス世界大会代表選考会」（千葉県柏市・吉田記念テニス研修センター／5月14～17日／ハードコート）の大会2日目は14歳以下と12歳以下の男女シングルス2回戦が行われ、各種目のベスト8が出揃った。 【PHOTO】14歳以下女子シングルス準々決勝に進出した佐々木千和（関東／与野テニスクラブ） [DUNLOP CUP第47回全国選抜ジュニアテニス選手権大会] 全国選抜ジュニアテニス選手権大会は男女シングルス（14歳以下／12歳以下）各32ドローで争われ、14歳以下はワールドジュニアテニス世界大会の代表選手の選考会を兼ねている。 大会3日目の5月16日(土)は9時00分から、14歳以下＆12歳以下の男女シングルス準々決勝と準決勝が行われる予定になっている。 ※名前の左に付いている数字はドロー番号、[ ]数字はシード順位、WCはワイルドカード（主催者推薦枠）、Altは繰り上がり出場 ＜大会2日目◎5月15日｜試合結果：14歳以下＞ ■男子シングルス2回戦 ○1安居院虹斗（関西／ARROWS TENNIS SCHOOLS）[1] 6-3 6-2 ●4中村望亜（関東／ISHII TENNIS ACADEMY） ○8山本悠聖（関西／パブリックテニスイングランド）[6] 6-3 6-2 ●5松田革汰（東海／チェリーTC） ○9石部宝之助（関東／はちおうじ庭球塾）[3] 6-3 7-6(3) ●12柴田悠成（東海／チェリーTC） ○16工藤遥真（四国／愛媛トレセン）[5] 4-6 6-4 6-2 ●14佐久間琉真（関東／Team YUKA） ----- ○17﨑山修治（九州／ROUGH福岡）[7] 6-2 6-2 ●20佐藤琉輝（関東／Team Rise） ○24川鍋悠雅（関東／東京都TA）[4] 7-6(7) 4-6 6-4 ●22藤堂樂釈（関西／UTENAアスリート） ○25長島大河（関東／シードテニスクラブ）[8] 3-6 7-5 7-5 ●27岡田悠希（関東／京王赤城アカデミー） ○32安居院咲空（関西／ARROWS TENNIS SCHOOLS）[2] 6-0 6-2 ●30古賀諒成（九州／グローバルアリーナ） ■女子シングルス2回戦 ○2伊藤咲笑（北海道／Line'ｓ Collect.TA）6-3 6-2 ●4酒井陽毬（東海／THテニス塾・Gifu） ○8深澤和（東海／Wishテニスクラブ）[6] 6-3 6-4 ●6宮本珠莉愛（関東／桜台テニスクラブ） ○10重松柚葵（四国／桜町中学校）4-6 6-4 6-4 ●11蛭田すず（関東／町田ローンジュニアアカデミー） ○16佐藤凜（中国／テニスNOCO）[7] 6-4 6-2 ●14矢野愛翔（四国／HIROテニスカレッジ） ----- ○19佐々木千和（関東／与野テニスクラブ）6-2 6-2 ●17浦田夏帆（関西／LYNX TA 奈良）[5] ○24太田光音（関東／自由が丘インターナショナルテニスカレッジ）[4] 6-1 6-2 ●21梅澤杏実（関東／グリーンテニスプラザ） ○25佐藤実莉（関東／町田ローンジュニアアカデミー）[8/WC] 6-0 6-2 ●28廣田真衣（関東／有明ジュニアテニスアカデミー）[Alt] ○29坂本真緒（関東／はちおうじ庭球塾）1-6 6-3 6-4 ●32小野愛梨（関西／アズテニス）[2] テニスマガジン編集部,[],[]
大会2日目が終了、12歳以下のベスト8が出揃う [DUNLOP CUP第47回全国選抜ジュニアテニス選手権大会]（テニスマガジンONLINE）,https://news.yahoo.co.jp/articles/aeb038b951aef7484ac7fa45851e0fe1a383ae5a,https://newsatcl-pctr.c.yimg.jp/t/amd-img/20260515-00034165-tennismagv-000-1-view.jpg?exp=10800,2026-05-15T23:00:00+09:00,2026-05-15T23:00:00+09:00,テニスマガジンONLINE,tennismagv,テニスマガジンONLINE,1648,大会2日目が終了、12歳以下のベスト8が出揃う [DUNLOP CUP第47回全国選抜ジュニアテニス選手権大会] 「DUNLOP CUP第47回全国選抜ジュニアテニス選手権大会兼ワールドジュニアテニス世界大会代表選考会」（千葉・吉田記念テニス研修センター）で12歳以下女子シングルス準々決勝に進出したンボイズイリーン茉椰（関東／志津テニスクラブ）（写真提供◎公益財団法人吉田記念テニス研修センター） 公益財団法人日本テニス協会（JTA）などが主催する「DUNLOP CUP第47回全国選抜ジュニアテニス選手権大会兼ワールドジュニアテニス世界大会代表選考会」（千葉県柏市・吉田記念テニス研修センター／5月14～17日／ハードコート）の大会2日目は14歳以下と12歳以下の男女シングルス2回戦が行われ、各種目のベスト8が出揃った。 【PHOTO】12歳以下男子シングルス準々決勝に進出した菊瑪曹善逸（関東／グリーンテニスプラザ） [DUNLOP CUP第47回全国選抜ジュニアテニス選手権大会] 全国選抜ジュニアテニス選手権大会は男女シングルス（14歳以下／12歳以下）各32ドローで争われ、14歳以下はワールドジュニアテニス世界大会の代表選手の選考会を兼ねている。 大会3日目の5月16日(土)は9時00分から、14歳以下＆12歳以下の男女シングルス準々決勝と準決勝が行われる予定になっている。 ※名前の左に付いている数字はドロー番号、[ ]数字はシード順位 ＜大会2日目◎5月15日｜試合結果：12歳以下＞ ■男子シングルス2回戦 ○1藤瀬大智（関東／SHOW.T.P）[1] 6-4 6-0 ●3玉木颯真（関西／TASU-Club） ○5菊瑪曹善逸（関東／グリーンテニスプラザ）6-2 6-2 ●8杉村快翔（関西／ヴァルブランシュTC）[5] ○9小林賢和（関東／Ampersand Tennis Academy）[4] 6-2 4-6 6-2 ●11大神健生（関西／TASU-Club） ○13竹本幸誠（関西／テニスクラブ コ・ス・パ三国ヶ丘）6-4 2-6 6-4 ●16石塚慶介（関東／自由が丘インターナショナルテニスカレッジ）[8] ----- ○17正岡央理（四国／AKEBI TC）[6] 6-0 7-5 ●20秋山維志（東海／西尾LTC） ○24辻真之介（関西／神戸ローンテニス倶楽部）[3] 6-3 7-5 ●22梅津吏玖（関東／ジュンレオテニスアカデミー） ○28田中慧（関西／ルーセントジュニアアカデミー）7-5 6-2 ●25近藤正志（四国／フォーレスト）[7] ○32大賀翔平（九州／福岡パシフィックTA）[2] 6-1 6-1 ●29南洸大（関西／トップラン） ■女子シングルス2回戦 ○1高木咲來（九州／柳川ACADEMY）[1] 6-1 6-0 ●4竹中唯（東海／岐阜西テニスクラブ） ○8ンボイズイリーン茉椰（関東／志津テニスクラブ）[8] 6-0 6-1 ●5遠藤茉夏（関東／アルドールテニスステージ） ○11小野杏莉（関東／ISHII TENNIS ACADEMY）6-3 4-6 6-1 ●9伊倉海琴（東北／TEAM HANZO）[3] ○16濱野紗凪（関東／グリーンテニスプラザ）[5] 6-0 6-2 ●14浅見夏香（関東／アクロステニスアカデミー） ----- ○19丸山真奈（関東／与野テニスクラブ）7-5 6-1 ●18福本珠姫（関東／ひばりヶ丘新豊テニスクラブ） ○22松本彩希（関東／グリーンテニスプラザ）6-1 6-1 ●24山下真央（北海道／ライジング）[4] ○25浜本まりあ（関東／あじさいテニススクール）[6] 6-0 6-0 ●28森瑚陽（四国／屋島TC） ○32佐藤舞（関西／TASU-Club）[2] 6-2 6-4 ●30本庄日向子（関西／Ai Love All Tennis Academy 香枦園） テニスマガジン編集部,[],[]
元チャンピオン対決でシフィオンテクにフルセット勝利のスビトリーナが8年ぶり3度目の決勝進出「現実だとは思えない」 [イタリア国際／テニス]（テニスマガジンONLINE）,https://news.yahoo.co.jp/articles/b559a9bc97c061b946aa5b694adec5ffcf2d6961,https://newsatcl-pctr.c.yimg.jp/t/amd-img/20260515-00034162-tennismagv-000-1-view.jpg?exp=10800,2026-05-15T20:55:00+09:00,2026-05-15T20:55:00+09:00,テニスマガジンONLINE,tennismagv,テニスマガジンONLINE,1230,元チャンピオン対決でシフィオンテクにフルセット勝利のスビトリーナが8年ぶり3度目の決勝進出「現実だとは思えない」 [イタリア国際／テニス] 「BNLイタリア国際」（イタリア・ローマ）で決勝に進出したエリナ・スビトリーナ（ウクライナ）（Getty Images） WTAツアー公式戦「BNLイタリア国際」（WTA1000／イタリア・ローマ／5月5～17日／賞金総額831万2293ドル／クレーコート）の女子シングルス準決勝で、第7シードのエリナ・スビトリーナ（ウクライナ）が第4シードのイガ・シフィオンテク（ポーランド）を6-4 2-6 6-2で倒して8年ぶり3度目の優勝に王手をかけた。 ～BNLイタリア国際で8年ぶり3度目の決勝進出を決めた2017年＆18年大会チャンピオンのスビトリーナ選手：@WTA～ 5-4から3度目のブレークに成功して第1セットを先取したスビトリーナは一度しかサービスキープができずに第2セットを取り返されたが、第3セット第1ゲームでピンチを凌いでキープしたあと相手のサービスゲームを2度破って2時間14分で勝利を決めた。 同大会で過去3度（2021～22年、24年）タイトルを獲得した実績を持つシフィオンテクは相手よりも8本多い28本のウィナーを決めたが、相手（35本）を大きく上回る50本のアンフォーストエラーを犯した。 シフィオンテクから3勝目（4敗）を挙げたスビトリーナは3月のインディアンウェルズ準々決勝でも6-2 4-6 6-4で勝っていたが、2021年大会準々決勝（シフィオンテクが6-2 7-5で勝利）を含むクレーコートでの2試合ではいずれもストレート負けを喫していた。 「何年も経ったけど、ここでもう一度決勝の舞台に立てるなんて現実だとは思えない」とスビトリーナは試合後のオンコートインタビューで語った。 「このような形で勝つことができて素晴らしい気分だわ」 2017年＆18年大会チャンピオンのスビトリーナは今季3度目の決勝で、第26シードのソラナ・シルステア（ルーマニア）を6-4 6-3で破って勝ち上がった第3シードのココ・ガウフ（アメリカ）と対戦する。 22歳のガウフは昨年の大会で初めて決勝に進出したが、ジャスミン・パオリーニ（イタリア）に4-6 2-6で敗れていた。 ふたりは過去5戦してスビトリーナが3勝2敗と勝ち越しており、今季は1月のオーストラリアン・オープン準々決勝（6-1 6-2）と2月のドバイ準決勝（6-4 6-7(13) 6-4）でプレーしていずれもスビトリーナが勝っている。 「もちろんゲームプランはある。具体的にはまだ決まっていないけど、これから準備するつもりよ」とスビトリーナは次戦を見据えた。 「私たちは何度も対戦しているからサプライズはない。お互いのプレースタイルはよくわかっている。前回の試合は凄かった。あの試合をもう一度振り返って戦術を練りたいと思う」 テニスマガジン編集部,[],[]
シナーがジョコビッチを抜くマスターズ史上最長のマッチ32連勝でベスト4に進出「記録のためにプレーしている訳じゃない」 [イタリア国際／テニス]（テニスマガジンONLINE）,https://news.yahoo.co.jp/articles/c4ac5c61ece52235af1af6d9518685f87c5b8359,https://newsatcl-pctr.c.yimg.jp/t/amd-img/20260515-00034161-tennismagv-000-1-view.jpg?exp=10800,2026-05-15T18:00:00+09:00,2026-05-15T18:00:00+09:00,テニスマガジンONLINE,tennismagv,テニスマガジンONLINE,1367,シナーがジョコビッチを抜くマスターズ史上最長のマッチ32連勝でベスト4に進出「記録のためにプレーしている訳じゃない」 [イタリア国際／テニス] 「BNLイタリア国際」（イタリア・ローマ）で準決勝に進出したヤニク・シナー（イタリア）（Getty Images） ATPツアー公式戦「BNLイタリア国際」（ATP1000／イタリア・ローマ／5月6～17日／賞金総額823万5540ユーロ／クレーコート）の男子シングルス準々決勝で、第1シードのヤニク・シナー（イタリア）が第12シードのアンドレイ・ルブレフ（ロシア）を6-2 6-4で退けベスト4に進出した。 ～BNLイタリア国際でマスターズ史上最長のマッチ32連勝を飾って4強入りを決めた世界ナンバーワンのシナー選手：@TennisTV～ 相手のサービスゲームを2度破って第1セットを先取したシナーは第2セット4-1から一度だけサービスダウンを喫したが、残りのサービスゲームをきっちりキープして1時間32 分で勝利を決めた。 「彼（ルブレフ）は非常に危険な選手だ。彼が最高のプレーをすれば倒すのはかなり難しい」とシナーは試合後に語った。 「今日はお互いにベストのプレーができなかったと思うけど、ここのコンディションは凄く厳しい。だから適応しようと最善を尽くした。もちろんとても満足している。僕にとって特別な大会だからね」 昨年11月のパリからATPマスターズ1000大会で負け知らずのシナーは同カテゴリーでの連勝を「32」に伸ばし、ノバク・ジョコビッチ（セルビア）と並んでいた最長記録を更新した。 シーズン最初のマスターズ5大会すべてで4強入りしたのは、2010年と11年にやってのけたラファエル・ナダル（スペイン）以来でシナーが2人目となる。 マドリッドで史上初となるマスターズ5大会連続制覇を果たしたシナーはローマではタイトルを獲得しておらず、今大会で勝てばジョコビッチしか成し遂げていない『ゴールデンマスターズ（マスターズ9大会全制覇）』を達成することができる。 同大会に2年連続7度目の出場となる24歳のシナーはドーピング違反による出場停止処分明けだった昨年に初めて決勝まで勝ち進んだが、カルロス・アルカラス（スペイン）に6-7(5) 1-6で敗れていた。 「僕は記録のためにプレーしている訳じゃない。自分自身のストーリーを作り上げるためだ」とシナーは胸の内を明かした。 「同時にそれは僕にとって大きな意味があることだけど、明日はまた別の日だ。相手も変わるしコンディションも違う。母国でプレーするのはメンタル的に負担が大きいけど、その一方で絶対にベストを尽くそうと努力しているんだ」 初の地元優勝を目指すシナーは次のラウンドで、ラッキールーザー（欠場者が出たため本戦出場権を得た予選敗退選手）のマルティン・ランダルーセ（スペイン）を1-6 6-4 7-5で破って勝ち上がった2023年大会チャンピオンで第7シードのダニール・メドベージェフ（ロシア）と対戦する。 3月のマイアミで予選から準々決勝まで勝ち進んだランダルーセは先月にトップ100デビューを果たしたが、今大会での活躍でランキングの動向をリアルタイムで伝えるATPライブランキングで62位に浮上した。 テニスマガジン編集部,[],[]
ローマ4回戦で左太腿負傷のムゼッティがハンブルクとフレンチ・オープンの欠場を発表 [テニス]（テニスマガジンONLINE）,https://news.yahoo.co.jp/articles/a79d3514cee69f7fc9fb46ab028f6a92795a93d6,https://newsatcl-pctr.c.yimg.jp/t/amd-img/20260515-00034155-tennismagv-000-1-view.jpg?exp=10800,2026-05-15T15:00:00+09:00,2026-05-15T15:00:00+09:00,テニスマガジンONLINE,tennismagv,テニスマガジンONLINE,644,ローマ4回戦で左太腿負傷のムゼッティがハンブルクとフレンチ・オープンの欠場を発表 [テニス] 写真はBNLイタリア国際（イタリア・ローマ）の4回戦で左太腿の治療を受けるロレンツォ・ムゼッティ（イタリア）（Getty Images） 男子テニス世界ランク10位のロレンツォ・ムゼッティ（イタリア）が自身のインスタグラムを更新し、ケガによりハンブルク（ATP500／クレーコート）とフレンチ・オープン（フランス・パリ／クレーコート）を欠場すると発表した。 ～ムゼッティ選手がハンブルクとフレンチ・オープンの欠場を発表したインスタグラムの投稿はこちら～ 現在開催中のローマ（ATP1000／クレーコート）に第8シードで出場していたムゼッティは前日に行われた4回戦で第23シードのキャスパー・ルード（ノルウェー）に3-6 1-6で敗れたが、試合中に左太腿を痛めてメディカルタイムアウトを取っていた。 ムゼッティはインスタグラムを通して「昨日の試合が終わったあとに検査を受けたところ大腿直筋のケガが判明し、数週間の休養と回復期間が必要となりました」と明かし、「残念ながらハンブルクとロラン・ギャロスに出場できなくなりました」と報告した。 前年に4強入りしたローマで4回戦敗退に終わったムゼッティはランキングの動向をリアルタイムで伝えるATPライブランキングで11位となってトップ10陥落が決まったが、昨年の全仏でベスト4に進出して獲得した800ポイントも失効することになった。 テニスマガジン編集部,[],[]
ドレイパーがグラスコートシーズンに自国の先輩マレーのサポートを受けることに [テニス]（テニスマガジンONLINE）,https://news.yahoo.co.jp/articles/e5624a3c2762a9a1896a8d1261fe916e246e8927,https://newsatcl-pctr.c.yimg.jp/t/amd-img/20260515-00034149-tennismagv-000-1-view.jpg?exp=10800,2026-05-15T12:20:00+09:00,2026-05-15T12:20:00+09:00,テニスマガジンONLINE,tennismagv,テニスマガジンONLINE,843,ドレイパーがグラスコートシーズンに自国の先輩マレーのサポートを受けることに [テニス] 写真は2023年BNPパリバ・オープン（アメリカ・インディアンウェルズ）でのジャック・ドレイパー（イギリス／右）とアンディ・マレー（イギリス）（Getty Images） イギリステニス協会（LTA）が公式サイトを更新し、元世界ランク4位のジャック・ドレイパー（イギリス）がグラスコートシーズンに自国の先輩であるアンディ・マレー（イギリス）のサポートを受けることになったと発表した。 ～イギリステニス協会がドレイパー選手のコーチングチームに元世界ナンバーワンのマレー氏が加入すると発表したSNSの投稿はこちら～ LTAによるとドレイパーは昨年から指導を受けていたマレーの元コーチでもあるジェイミー・デルガド（イギリス）と袂を分かち、LTAのチームでサポートを受けながらマレー氏の協力も受ける予定になっている。 グランドスラム3勝（2012年全米、2013年＆16年ウインブルドン）を含むツアー通算シングルス46勝＆ダブルス3勝を挙げて世界ランク1位の座にも就いたマレー氏は2024年8月のパリ五輪（フランス・パリ／クレーコート）を最後に引退したあと長年の友人でありよきライバルだったノバク・ジョコビッチ（セルビア）のコーチを半年ほど務めたが、4度の初戦敗退を含む12勝7敗と芳しくない戦績に終わっていた。 利き腕のケガに苦しんでいた24歳のドレイパーはノルウェーに対する2月のデビスカップ予選1回戦で復帰したあとATPツアー4大会でプレーしてディフェンディング・チャンピオンとして臨んだ3月のインディアンウェルズ（ATP1000／ハードコート）で8強入りするなど今季ここまで5勝4敗の戦績を残しているが、先月のバルセロナ（ATP500／クレーコート）で右膝を負傷したためフレンチ・オープン（フランス・パリ／クレーコート）の欠場を余儀なくされるなど厳しいシーズンを過ごしている。 テニスマガジン編集部,[],[]
