headline,mainEntityOfPage,image,datePublished,dateModified,author,media_en,media_jp,str_count,body,images,external_links
「夏山フェスタ」あす開幕　山小屋71軒の相談コーナーも（中部経済新聞）,https://news.yahoo.co.jp/articles/aa1e017d3140264743adb46037688cff55ca9a8c,https://newsatcl-pctr.c.yimg.jp/t/amd-img/20260515-00000005-chukei-000-1-view.jpg?exp=10800,2026-05-15T08:55:31+09:00,2026-05-15T08:55:31+09:00,中部経済新聞,chukei,中部経済新聞,479,昨年開催時の様子 中部地方最大規模の山岳関連総合イベント「夏山フェスタ」が16日、名古屋市中村区の愛知県産業労働センター（ウインクあいち）で開幕する。17日まで。12回目となる今回は、登山用品メーカーや自治体など約60社・団体が出展するほか、71軒の山小屋が相談コーナーを設け、山に関するさまざまな疑問に答える。著名人によるトークショーやセミナーも連日開かれる。 全国山の日協議会、日本山岳ガイド協会、日本山岳会東海支部、中部経済新聞社で構成する夏山フェスタ実行委員会の主催。イベントでは、「にっぽん食名山・夏山編」をテーマに、アウトドアスタイル・クリエーターの四角友里さん（16日）、「山とラジオ」をテーマに、俳優の石丸謙二郎さん（17日）がトークショーを行う。セミナーは、山岳写真の撮影術や登山に向けたトレーニング方法、山岳警備隊による安全登山講習など幅広い情報を提供する。 入場料は無料。開催時間は両日午前10時から午後５時まで。トークショーは当日、開場と同時に会場入口で整理券を配布する。来場者全員に登山用品店で使える割引クーポン券をプレゼントする。,[],[]
とよたビジネスフェア開幕　１５７企業・団体が出展　イノベーション創出へ（中部経済新聞）,https://news.yahoo.co.jp/articles/6a4e82941ca4f61ef76295da193d8c35a989a253,https://newsatcl-pctr.c.yimg.jp/t/amd-img/20260515-00000004-chukei-000-1-view.jpg?exp=10800,2026-05-15T08:55:29+09:00,2026-05-15T08:55:29+09:00,中部経済新聞,chukei,中部経済新聞,895,にぎわう会場 豊田市と豊田商工会議所の共催で、地域企業の優れた技術や製品を一堂に集めた総合展示会「第16回とよたビジネスフェア２０２６」が14日、豊田市八幡町のスカイホール豊田で開幕した。前回を上回る１５７企業・団体が出展。豊田会議所の杉原功一会頭は「世界情勢は不安定で、物価高騰や人材不足など課題は山積。しかし、環境の変化は新たな発想や技術革新を促す好機。業種や分野の垣根を超えた出会いが、イノベーションの契機となることに期待している」と力強くあいさつした。（三河） テーマは「技術×アイデアの循環が未来のビジネスを拓く」。トヨタ自動車など大手からキラリと光る技術を持つ中小企業まで幅広く出展し、会場は開場直後から多くの人でにぎわった。 電子計測機器製造の小野測器（横浜市）は、27年秋に豊田市に新拠点「中部リンケージコモンズ（ＣＬＣ）」を稼働するのに先立ち、フェアに初出展。担当者は「ＣＬＣは地域に根差したオープンイノベーション拠点にしたい」と意気込んだ。 新明工業（豊田市）は、屋内の狭小・暗所空間向け産業用ドローンメーカーのリベラウェア（千葉市）と共同開発し、販売を始めた専用車両「ドローンポーター」を展示。あらかじめ必要な機材や周辺装備を車両に搭載し、ドローン点検の現場効率と利便性を最大化できるという。 環境問題の解決につながる技術も関心を集めた。自動車部品メーカーの小島プレス工業（豊田市）はＡＳＲ（自動車破砕残さ）由来の再生プラスチックを車両底部に装着する部品に使用する技術を紹介。社会問題となっている竹を建材や舗装材に再利用する豊竹（豊田市）のブースには多くの人が来場し、新たなコラボレーションの提案も出たという。 また、豊田会議所のブースでは昨年、トヨタ自動車と共催した「からくり＆デジタル展」の支援を継続すするための「作品相談コーナー」を開設。台車の移動について相談に来た設備メーカーの担当者が、トヨタから丁寧なアドバイスを受けていた。トヨタの生産本部人事室の深津敏昭主査は「知恵は無限。からくりは完成が始まり。現場の改善を続けることの大切さを伝えられたら」と語った。,[],[]
エイニーズガレージ、支援ツール好評　電動車の整備作業を効率化　全国で　社超が採用（中部経済新聞）,https://news.yahoo.co.jp/articles/93d84d924b39091b929c1848d0206e4b78689bb4,https://newsatcl-pctr.c.yimg.jp/t/amd-img/20260515-00000003-chukei-000-1-view.jpg?exp=10800,2026-05-15T05:15:25+09:00,2026-05-15T05:15:25+09:00,中部経済新聞,chukei,中部経済新聞,212,レーザーを装備したエーミングツールキット 電子整備支援のエイニーズガレージ（本社稲沢市、藤本明治社長）が開発した、車の電子制御装置の校正作業（エーミング）を高出力レーザーで効率的に行えるツールキットが好評だ。通常は２人で１時間以上かかる作業が最短５分ででき、メーカーマニュアルに沿った正確な作業が行える。導入は全国の自動車整備事業者、自動車ガラス事業者など３００社以上に広がっており、整備工場の電動化対応をサポートしている。,[],[]
中部外食５社26年３月期決算　全社が売上高最高　今期は中東情勢懸念（中部経済新聞）,https://news.yahoo.co.jp/articles/e7582d832e32892abf512ed570df86bdcf88eb8d,https://newsatcl-pctr.c.yimg.jp/t/amd-img/20260515-00000002-chukei-000-1-view.jpg?exp=10800,2026-05-15T05:15:24+09:00,2026-05-15T05:15:24+09:00,中部経済新聞,chukei,中部経済新聞,141,☆外食 決算 名古屋証券取引所に上場する中部の外食５社の２０２６年３月期決算が14日出そろった。売上高は全社が過去最高だったが、原材料費などのコスト増が重荷となり、営業利益の増益は３社にとどまった。27年３月期も全社が増収を予想するが、中東情勢の動向次第では厳しい事態も想定される。,[],[]
石油備蓄放出を下支え　ダイセキ　中東情勢悪化安定供給に貢献（中部経済新聞）,https://news.yahoo.co.jp/articles/ce67f71f1ec2dde0219b726518d116b4121add8a,https://newsatcl-pctr.c.yimg.jp/t/amd-img/20260515-00000001-chukei-000-2-view.jpg?exp=10800,2026-05-15T05:15:22+09:00,2026-05-15T12:48:02+09:00,中部経済新聞,chukei,中部経済新聞,184,平常時から石油備蓄基地のタンク洗浄を手掛けている 産業廃棄物処理のダイセキ（本社名古屋市）は、中東情勢の悪化に伴う石油の調達不安が長引く中、原油などの安定供給を下支えしている。これまで洗浄を担当している石油備蓄基地で、放出準備に入っている。また、廃油などからつくる再生重油への引き合いの増加にも応じている。資源循環の事業で培ったノウハウを、足元の非常時に発揮している。,[],[]
