headline,mainEntityOfPage,image,datePublished,dateModified,author,media_en,media_jp,str_count,body,images,external_links
小中一貫の義務教育学校「高田学園」が開校　長崎・長与、５００人超の規模は県内で初（長崎新聞）,https://news.yahoo.co.jp/articles/98921158f5a40f56b988f85d0b5fe0bfb289f84d,https://newsatcl-pctr.c.yimg.jp/t/amd-img/20260409-00000006-nagasaki-000-1-view.jpg?exp=10800,2026-04-09T12:30:22+09:00,2026-04-09T12:30:22+09:00,長崎新聞,nagasaki,長崎新聞,577,２～９年生まで一堂に集った高田学園の開校・始業式＝長与町高田郷 長崎県西彼長与町の旧町立高田小と旧町立高田中が統合し、今春誕生した小中一貫の義務教育学校「町立高田学園」（高比良尚校長）の開校・始業式が８日、同町の同学園百合野校舎であった。２～９年生約４７０人が一堂に集まり、新たな気持ちで学校生活をスタートさせた。１０日には入学式があり、新１年生を合わせると５４５人になる。義務教育学校は県内３校目だが、同校によると、５００人超の規模は初という。 同学園は二つの校舎を利用した施設分離型。旧高田小は１～４年生が通う「百合野校舎」に、旧高田中は５～９年生が学ぶ「さくら野校舎」となった。９学年を１～４、５～７、８～９の３ステージに分け、「必要なキャリア形成」などに重点を置いた教育活動を展開する。 式では各学年ステージを代表して児童、生徒３人が決意の言葉。４年生の有馬輝さんは「４月からは百合野校舎の最高学年。あいさつを頑張り、高田学園を明るくしたい」と発表した。高比良校長は「校舎は分かれて活動するが、一つの学校という思いを大切にしてほしい」とあいさつした。 同学園によると、４年生までが学級担任制。５、６年は一部教科担任制を導入し、音楽、社会、英語など６教科の授業を中学校教諭が担当。７年生の数学の授業には、小学校教諭が補助として入るなどの特色がある。,[],[]
長崎県内初の「泊まれる体験型ワイナリー」　五島市に来春開業、レストランを核に新たな魅力創出へ（長崎新聞）,https://news.yahoo.co.jp/articles/475b143a155608476458c8b6f1065582b5ba7ab5,https://newsatcl-pctr.c.yimg.jp/t/amd-img/20260409-00000005-nagasaki-000-1-view.jpg?exp=10800,2026-04-09T12:15:22+09:00,2026-04-09T12:15:22+09:00,長崎新聞,nagasaki,長崎新聞,630,体験型ワイナリーのイメージ写真（五島ワイナリー提供） 醸造見学や飲食、物販、宿泊を一体で楽しめる県内初の「泊まれる体験型ワイナリー」が五島市に来春開業する。メモリードグループの五島ワイナリー（同市、境目権二社長）が整備を進めている。鬼岳を望む立地を生かし、ワインの製造過程を間近に感じながら滞在できる拠点として、農業と観光を結ぶ新たな魅力創出が期待される。 同市には年間２０万人を超える観光客が訪れる一方、滞在型コンテンツの不足が課題とされてきた。同施設は体験と宿泊を組み合わせることで、滞在時間の延長と収益の安定化を図る。整備には市の農山漁村振興交付金を活用している。 施設は２０２７年４月に開業予定。大きなガラス越しに醸造工程を眺めながら食事ができるレストランを核に、五島産食材を使った料理と自社製造のワインを提供する。屋外には鬼岳を一望できるテラス席を設け、ペット同伴にも対応する。 既存の宿泊施設と連携し、ワイン製造・販売、飲食、宿泊を一体化した滞在型観光拠点として展開する。五島産ブドウの活用による農業振興と６次産業化の促進、地域内での経済循環の創出を目指す。 開業に先立ち、本年度からワイナリーツアーやワインウエディング、レストラン利用、宿泊プランの情報発信と予約受け付けを順次始める予定。 境目社長は「五島の自然や食、ワインを一体で体験できる場所として、訪れる人の滞在価値を高めたい。地域の農業や観光の活性化につながる拠点にしたい」と話している。,[],[]
長崎県内の倒産、過去１０年で最多　２０２５年度…人件費の高騰や求人難など影響（長崎新聞）,https://news.yahoo.co.jp/articles/725dbf2955ab6f32868264c0ea0c728b6382586c,https://newsatcl-pctr.c.yimg.jp/t/amd-img/default.jpg?exp=10800,2026-04-09T12:00:22+09:00,2026-04-09T12:00:22+09:00,長崎新聞,nagasaki,長崎新聞,592,東京商工リサーチ長崎支店が８日発表した２０２５年度の県内企業倒産（負債１千万円以上）は、前年度より３件多い５５件で、過去１０年間で最多となった。人手不足を倒産原因に含む企業は５件。県内でも人件費の高騰や求人難などが事業継続に影響を及ぼしている実態が明らかになった。 同支店担当者は、若者の県外流出や大手進出による人材獲得競争の激化で「地場企業の人手不足感がさらに強まる」と予想している。今後の見通しについても、受注が難しくなり、収益がしぼむ悪循環に陥れば「人手不足倒産」が増える可能性があるとしている。 倒産５５件の負債総額は６７億３３００万円で、前年度比１５億８５００万円増。件数が増えたことに加え、負債１０億円以上の大型倒産や１億円以上の大口倒産の増加が総額を押し上げた。 業種別ではサービス業が最多の２０件。製造業１０件、建設業と小売業が各８件、卸売業が７件と続いた。原因別では販売不振が５０件で大半を占めた。特殊要因（重複含む）はコロナ関連が２０件、原材料高騰が１６件となった。 同支店は倒産状況全体の今後の見通しについて、公共工事の削減や物価高騰による消費低迷、国際情勢などの影響を指摘。「収益を圧迫している企業も散見され、廃業や倒産が増えてくる」とみている。 同時に発表した３月の県内倒産件数は４件（前年同月比２件増）で、負債総額は９億４千万円（同８億４千万円増）だった。,[],[]
長崎原爆資料館の外国人入館者数が最多に　２０２５年度、訪日客増加や国際情勢が背景（長崎新聞）,https://news.yahoo.co.jp/articles/14672337cd4993618aae8bd3f4dc829f509072af,https://newsatcl-pctr.c.yimg.jp/t/amd-img/default.jpg?exp=10800,2026-04-09T11:30:24+09:00,2026-04-09T11:30:24+09:00,長崎新聞,nagasaki,長崎新聞,550,２０２５年度に長崎原爆資料館（長崎市）を訪れた外国人入館者数が速報値で１７万４千人となり、統計が残る０２年度以降で最も多かったことが８日、市への取材で分かった。市はインバウンド（訪日客）増加に加え、核兵器を巡る国際情勢が厳しさを増す中、被爆地長崎への関心が高まったことが背景にあるとみる。全体の入館者数も８９万６３６２人を数え、開館した１９９６年度以来、４番目の高水準となった。 市平和推進課によると、外国人入館者数は、英語やロシア語など８カ国語のリーフレットの配布数で数えている。これまで最も多かったのは、２００７年度の１４万１７５０人。２５年度は、２４年度（１２万２４１２人）の約１・４倍に上り、全体の２割近くを占めた。 一方、２５年度の全体の入館者数（速報値）は、２４年度（８１万８２５人）から約８万５千人増。同課は２５年度が被爆・戦後８０年の節目で、平和への関心が国内外で高まったことを要因に挙げる。２５年度は開館初年度の１９９６年度（１１３万５４３６人）、９７年度（１０５万３０８人）、９８年度（９７万１０４３人）に続いて多かった。 同館は今月、開館から３０年を迎えた。市は２０２７年３月のリニューアルオープンを予定しており、有識者らでつくる資料館運営審議会が、展示更新の協議を進めている。,[],[]
「ＮＰＴ体制堅持を」長崎、広島両市長が米国に要請書…ジョージ・グラス駐日大使と面会（長崎新聞）,https://news.yahoo.co.jp/articles/bf7cb2986e73393f9b6a13157aa6d7afab204de8,https://newsatcl-pctr.c.yimg.jp/t/amd-img/20260409-00000002-nagasaki-000-1-view.jpg?exp=10800,2026-04-09T11:00:25+09:00,2026-04-09T11:00:25+09:00,長崎新聞,nagasaki,長崎新聞,638,グラス氏（中央）と面会した松井市長（左）と鈴木市長＝東京都港区、在日米大使館（同館提供） 核保有国に核軍縮義務を課す核拡散防止条約（ＮＰＴ）の再検討会議が２７日から始まるのを前に、鈴木史朗長崎市長と松井一実広島市長は８日、在日米大使館でジョージ・グラス駐日大使と面会し、ＮＰＴ体制の堅持を求めるトランプ大統領宛ての要請書を手渡した。同じく核保有国のロシアと英仏中の各国首脳にも同様の要請を文書で行った。 長崎市によると、ＮＰＴに関して米国に直接要請するのは初めて。グラス氏は実業家でトランプ氏と関係が近い。面会は非公開。両市長によると、グラス氏は「米国も核兵器廃絶の思いは（被爆地と）同じ。いろんな形で努力している」と話したという。鈴木市長は「真摯（しんし）に受け止めてもらった。本国にしっかりと伝えられると期待する」と感想を述べた。 米ロに対する要請書は、「核超大国」として、ＮＰＴの最終目標である核兵器の完全な廃絶に向け「具体的な行動で範を示す」ことが期待されているにもかかわらず、２月に両国間の新戦略兵器削減条約（新ＳＴＡＲＴ）が失効し「廃絶への道を放棄したというメッセージにつながりかねない」と指摘した。核依存の動きが他国にも広がり「かつてない危機的な事態が第三の戦争被爆地を生み出しかねない」と危惧。これまでのＮＰＴ再検討会議の合意事項を再確認し核軍縮の取り組みを先導するよう両国に求めた。 両市長は２７日から米ニューヨークの国連本部で開かれる再検討会議に出席する。,[],[]
長崎ヴェルカが競り負け…三遠に９７－１０３、今季最多失点　バスケットＢ１（長崎新聞）,https://news.yahoo.co.jp/articles/012479dc3938cdc656a05ff3224ae8b2e26b31c1,https://newsatcl-pctr.c.yimg.jp/t/amd-img/20260409-00000001-nagasaki-000-1-view.jpg?exp=10800,2026-04-09T10:30:21+09:00,2026-04-09T10:30:21+09:00,長崎新聞,nagasaki,長崎新聞,521,【長崎ヴェルカ－三遠】第１クオーター４分、ヴェルカのジョンソンがシュートを決めて７点目＝ハピネスアリーナ バスケットボールのりそなＢリーグ１部（Ｂ１）第３０節は８日、長崎市のハピネスアリーナなどで１３試合が行われ、西地区首位の長崎ヴェルカは同じ西地区の三遠に９７－１０３で惜敗した。今季２度目の１００点ゲームでの敗戦で今季最多失点。通算４０勝１０敗で順位に変動はなく、西地区２位の名古屋Ｄも敗れたためゲーム差は「２」のまま。 点の取り合いとなった前半は、ヴェルカはジョンソン、イ・ヒョンジュンらの３点シュートなどで加点し、三遠はヌワバのミドルシュート、佐々木の３点シュートなどで応戦。５５－５３と互いに５０点台に乗せて後半に入った。 後半も一進一退の攻防となったが、７６－７６の第３クオーター９分から５点を連取され、７８－８３で入った第４クオーターも開始直後から連続７失点。ヴェルカはその後、ライトフットのダンク、ブラントリーのドライブ、熊谷のミドルシュートなどで得点を重ねたが、終盤に相手のフリースローが相次いで入り、最後は６点差で振り切られた。 第３１節は１１、１２日、各地で計２６試合を実施。ヴェルカはアウェーで北海道との２連戦に臨む。,[],[]
