headline,mainEntityOfPage,image,datePublished,dateModified,author,media_en,media_jp,str_count,body,images,external_links
東京ガス・松田監督「最後まで気を抜かないようにと」　都市対抗（毎日新聞）,https://news.yahoo.co.jp/articles/f82f25df7cd80ec148cc138a7e8fab1c9d08bbd6,https://newsatcl-pctr.c.yimg.jp/t/amd-img/20240721-00000061-mai-000-1-view.jpg?exp=10800,2024-07-21T22:15:51+09:00,2024-07-21T22:15:51+09:00,毎日新聞,mai,毎日新聞,653,\n【東京都（東京ガス）－八尾市（ミキハウス）】五回表東京都2死一、二塁、中尾勇介の2点二塁打に笑顔の選手たち＝東京ドームで2024年7月21日、宮間俊樹撮影\n第95回都市対抗野球大会は第3日の21日、東京ドームで1回戦があり、東京都・東京ガスが八尾市・ミキハウスに勝ち、準優勝した第93回大会（2022年）以来、2年ぶりに初戦を突破した。東京都・松田孝仁監督の試合後の主なコメントは次の通り。\n【写真まとめ】ナイン支える笑顔 各チームのダイヤモンドサポーター\n◇東京都・松田孝仁監督\n\n （昨年は初戦負けに終わり）1回戦の難しさを去年経験して、なんとか選手が良い状態でプレーできるように心がけて、最後まで気を抜かないようにと考えていた。\n\n （五回に中尾勇介の適時二塁打で逆転）本当に大きかったし、直前のピンチを同点でしのいでくれたのも大きかったと思う。\n\n （先発の臼井浩は）でき自体は悪くなかった。八回が終わった後は「どうせ完投したいだろ」と聞いたら「はい」と言われたので、最後まで任せた。（九回に）満塁を作られた時はどうしようかと思っていたが、臼井で満塁ホームランを打たれたら仕方がない、と思っていた。\n\n （監督として都市対抗初勝利）チームが都市対抗優勝、準優勝という流れで監督を引き継がせてもらい、そう簡単ではないと分かっていたがどうしても勝ちたかった思いはずっとあった。ただ、（昨年の）あの負けでチーム力が上がったのも事実。そういう意味でも、今日の一勝は本当にうれしい。,['https://newsatcl-pctr.c.yimg.jp/t/amd-img/20240721-00000061-mai-000-1-view.jpg?pri=l&w=640&h=471&exp=10800'],"['https://news.yahoo.co.jp/articles/f82f25df7cd80ec148cc138a7e8fab1c9d08bbd6/images/000', 'https://mainichi.jp/graphs/20240721/mpj/00m/050/030000f/20240721k0000m050061000p?inb=ys']"
東京ガスが2年ぶり初戦突破　ミキハウスを破る　都市対抗野球（毎日新聞）,https://news.yahoo.co.jp/articles/e0c08bcc0fa719fd05750d9dcec852679f4cad61,https://newsatcl-pctr.c.yimg.jp/t/amd-img/20240721-00000060-mai-000-2-view.jpg?exp=10800,2024-07-21T21:20:39+09:00,2024-07-21T21:27:45+09:00,毎日新聞,mai,毎日新聞,346,\n【東京都（東京ガス）－八尾市（ミキハウス）】二回表東京都1死、本塁打を放ち笑顔の冨岡泰宏（右）＝東京ドームで2024年7月21日、宮間俊樹撮影\n第95回都市対抗野球大会は第3日の21日、東京ドームで1回戦があり、東京都・東京ガスが八尾市・ミキハウスに勝ち、準優勝した第93回大会（2022年）以来、2年ぶりに初戦を突破した。\n【写真まとめ】ナイン支える笑顔 各チームのダイヤモンドサポーター\n八尾市は2年ぶりの2回戦進出はならなかった。\n\n 東京都が接戦を制した。1点を追う五回、中尾の2点適時打で逆転し、八回に仲俣と冨岡の適時二塁打で突き放した。先発の臼井は2失点で完投。八尾市は先発の桜井が八回途中5失点。打線は四回に松尾が勝ち越し適時打を放ったが、五回以降は無得点だった。,['https://newsatcl-pctr.c.yimg.jp/t/amd-img/20240721-00000060-mai-000-2-view.jpg?pri=l&w=640&h=444&exp=10800'],"['https://news.yahoo.co.jp/articles/e0c08bcc0fa719fd05750d9dcec852679f4cad61/images/000', 'https://mainichi.jp/graphs/20240721/mpj/00m/050/030000f/20240721k0000m050061000p?inb=ys']"
京都・伏見で男性死亡　殺人容疑で110番通報した女性を逮捕（毎日新聞）,https://news.yahoo.co.jp/articles/ccc94b1a1d4feb75d805597b48527c5db2eabac4,https://newsatcl-pctr.c.yimg.jp/t/amd-img/20240721-00000063-mai-000-1-view.jpg?exp=10800,2024-07-21T22:41:00+09:00,2024-07-21T22:41:00+09:00,毎日新聞,mai,毎日新聞,313,\n京都市\n京都市伏見区のマンション一室で1人暮らしの美濃浩二さん（68）が腹部から血を流して死亡していた事件で、京都府警は21日、美濃さんを殺害したとして、知人の無職、富岡真弓容疑者（37）＝京都市伏見区＝を殺人容疑で逮捕した。「部屋で2人で会話していただけで殺してはいません」と容疑を否認しているという。\n【写真で見る】社会に衝撃を与えた事件\n逮捕容疑は、6月15日午前10時25分ごろから同日午後3時35分ごろまでの間、美濃さん宅で、美濃さんの腹部3カ所を刃物のようなもので突き刺し、出血性ショックで死なせたとしている。府警によると、富岡容疑者は6月22日、「人が死んでいる」と自ら110番していた。【水谷怜央那】,['https://newsatcl-pctr.c.yimg.jp/t/amd-img/20240721-00000063-mai-000-1-view.jpg?pri=l&w=491&h=640&exp=10800'],"['https://news.yahoo.co.jp/articles/ccc94b1a1d4feb75d805597b48527c5db2eabac4/images/000', 'https://mainichi.jp/graphs/20181212/hpj/00m/040/003000g/20181214hpj00m040001000q?inb=ys']"
8連勝の照ノ富士「ここからが勝負」　大相撲名古屋場所（毎日新聞）,https://news.yahoo.co.jp/articles/7264d8dc51455249a162d4fef3c05b28f3e511da,https://newsatcl-pctr.c.yimg.jp/t/amd-img/20240721-00000059-mai-000-1-view.jpg?exp=10800,2024-07-21T20:54:47+09:00,2024-07-21T20:54:47+09:00,毎日新聞,mai,毎日新聞,678,\n湘南乃海（右）を押し出しで降す照ノ富士＝名古屋市中区のドルフィンズアリーナで2024年7月21日、兵藤公治撮影\n◇大相撲名古屋場所（21日、愛知・ドルフィンズアリーナ）\n\n ◇〇照ノ富士（押し出し）湘南乃海●\n【写真】横綱・照ノ富士 8戦全勝で勝ち越し決める\n横綱・照ノ富士が初顔の湘南乃海の挑戦を退けた。初日からの8連勝は、8回目の賜杯を抱いた昨年夏場所以来のことだ。「落ち着いてじっくりやろうと思った。圧力がかかって良かったのではないですか」と振り返った。\n\n 身長192センチ、体重176キロの横綱に対し、194センチ、190キロの湘南乃海が体格では上回る。土俵が狭く見える巨漢同士の対決は、照ノ富士が頭から当たって得意の右四つに組むと、左上手も取って寄った。俵に詰まった湘南乃海のすくいにも慌てず残して体勢を立て直し、最後は差し手を抜いて押し出した。力相撲で番付の違いを見せつけた。\n\n この日から、同部屋の十両・尊富士が110年ぶりの新入幕優勝を果たした3月の春場所以来となる本場所の土俵に復帰し、快勝した。照ノ富士は弟弟子について「いつも通りじゃない」とコメントした。一方、自身の相撲内容については「まだ分からないですね」と慎重な言い回しだった。腰や膝の古傷は前に出て相撲を取っている分、負担は少ないとはいえ、横綱土俵入りなどで疲れはたまる。\n\n 役力士で2敗で追うのは大関・琴桜だけだが、照ノ富士は「ここからが勝負。1週間ありますから。その日、その日の積み重ね。ここから三役以上だから」と気を引き締めた。【武藤佳正】,['https://newsatcl-pctr.c.yimg.jp/t/amd-img/20240721-00000059-mai-000-1-view.jpg?pri=l&w=640&h=484&exp=10800'],"['https://news.yahoo.co.jp/articles/7264d8dc51455249a162d4fef3c05b28f3e511da/images/000', 'https://mainichi.jp/graphs/20240721/mpj/00m/050/126000f/20240721mpj00m050115000p?inb=ys']"
ミキハウス・陣田監督「球威ある投手から点取れるか課題」　都市対抗（毎日新聞）,https://news.yahoo.co.jp/articles/cdd17edcca3c349ec526443f4b35f439c4032986,https://newsatcl-pctr.c.yimg.jp/t/amd-img/20240721-00000062-mai-000-1-view.jpg?exp=10800,2024-07-21T22:17:44+09:00,2024-07-21T22:17:44+09:00,毎日新聞,mai,毎日新聞,433,\n【東京都（東京ガス）－八尾市（ミキハウス）】二回表東京都1死、冨岡泰宏（奥）に本塁打を許した八尾市の先発・桜井俊貴＝東京ドームで2024年7月21日、宮間俊樹撮影\n第95回都市対抗野球大会は第3日の21日、東京ドームで1回戦があり、八尾市・ミキハウスは東京都・東京ガスに2―5で敗れ、2年ぶりの2回戦進出はならなかった。八尾市・陣田匡人監督の試合後の主なコメントは次の通り。\n【写真まとめ】ナイン支える笑顔 各チームのダイヤモンドサポーター\n◇八尾市・陣田匡人監督\n\n 相手の臼井（浩）投手は映像よりも球が強く、タイミングも外された。チャンスを作ってもギアを上げて抑えられた。先発の桜井（俊貴）は普段より体に力が入り、直球が浮いていた。\n\n 都市対抗は4年連続出場で、チームは年々力を付けている。関東のチームに勝とうと1年間練習してきたが、負けてしまった。球威のある投手からどうやって点を取るかが課題だ。小技や走塁に加えて、守備力もさらに磨きたい。,['https://newsatcl-pctr.c.yimg.jp/t/amd-img/20240721-00000062-mai-000-1-view.jpg?pri=l&w=535&h=640&exp=10800'],"['https://news.yahoo.co.jp/articles/cdd17edcca3c349ec526443f4b35f439c4032986/images/000', 'https://mainichi.jp/graphs/20240721/mpj/00m/050/030000f/20240721k0000m050061000p?inb=ys']"
3中全会、決定全文公表　地方財源を拡充、消費喚起は具体策欠く（毎日新聞）,https://news.yahoo.co.jp/articles/57b2a814f2040d0592a224480862060c09868d45,https://newsatcl-pctr.c.yimg.jp/t/amd-img/20240721-00000057-mai-000-1-view.jpg?exp=10800,2024-07-21T20:23:45+09:00,2024-07-21T20:23:45+09:00,毎日新聞,mai,毎日新聞,629,\n中国共産党の重要会議「第20期中央委員会第3回総会（3中全会）」に出席する習近平国家主席（中央）ら＝新華社通信・AP\n中国共産党は21日、国営新華社通信を通じて、第20期中央委員会第3回総会（3中全会）で採択した独自の発展モデル「中国式現代化」の推進に関する決定の全文を公表した。不動産不況の長期化で地方政府の巨額債務が問題となる中、嗜好（しこう）品に課される「消費税」の税収を地方に配分するなど、地方財源を拡大する方針を示した。\n【写真まとめ】急増の中国人留学生は脅威?\n地方政府は、土地の使用権を不動産会社などに売却することが大きな収入源となってきた。ただ、不動産不況の長期化で税収減が進み、地方財政が悪化。公務員の賃下げなどを通じて、個人消費低迷の一因となっているほか、今後の金融リスクなどにもなりかねないため、対応を急いだ形だ。消費税だけでなく、その他の税でも税率の決定権の地方裁量を増やすほか、財政出動で中央政府の支出割合を増やす方針も示した。\n\n また、不動産政策でも地方政府の裁量を増やすほか、不動産税制を改善する方針も示した。\n\n 一方、消費喚起策では、所得分配の改善や、基礎年金引き上げなどの社会保障制度見直し方針などは盛り込まれたが、具体性を欠く記述にとどまった。2022年から中国が人口減少に転じる中で、少子化対策や労働力確保のための定年延長に関する方針も注目されたが、抜本的な対策は示されなかった。【北京・小倉祥徳】,['https://newsatcl-pctr.c.yimg.jp/t/amd-img/20240721-00000057-mai-000-1-view.jpg?pri=l&w=640&h=403&exp=10800'],"['https://news.yahoo.co.jp/articles/57b2a814f2040d0592a224480862060c09868d45/images/000', 'https://mainichi.jp/graphs/20240425/mpj/00m/030/174000f/20240425k0000m030335000p?inb=ys']"
ツキノワグマに氷の塊をプレゼント　「大暑」前に　福岡市動物園（毎日新聞）,https://news.yahoo.co.jp/articles/10a427a9fcdd7e2eada8e88ea22ff14659cbe5d2,https://newsatcl-pctr.c.yimg.jp/t/amd-img/20240721-00000056-mai-000-1-view.jpg?exp=10800,2024-07-21T20:02:46+09:00,2024-07-21T20:02:46+09:00,毎日新聞,mai,毎日新聞,430,\nプレゼントされた氷の塊を味わうツキノワグマのハナコ＝福岡市中央区の市動物園で2024年7月21日午後1時49分、森永亨撮影\n暑さが最も厳しいとされる「大暑」（22日）を前に、福岡市動物園（福岡市中央区）で21日、動物たちに涼しさを感じてもらおうと、好物を入れた氷の塊がプレゼントされた。\n【写真まとめ】主な国内希少野生動植物種\n氷の塊はバケツの水を冷やして固めた。ツキノワグマにはブドウやリンゴ、キウイ、スイカ、オレンジを入れた塊が、雄のゲンキと雌のハナコに1個ずつプレゼントされた。2頭は爪でひっかいたり、かぶりついたりしながら、気持ちよさそうに涼を取っていた。\n\n 福岡市中央区の21日の最高気温は33・8度で、7日連続の真夏日となった。家族と見学に訪れた佐賀県基山町の小野愛莉ちゃん（4）は「暑い中でおいしそう」と笑顔で話した。\n\n 同園では毎夏、氷を動物にプレゼントしており、この日はニホンザルとマレーグマにも氷が贈られた。【森永亨】,['https://newsatcl-pctr.c.yimg.jp/t/amd-img/20240721-00000056-mai-000-1-view.jpg?pri=l&w=640&h=427&exp=10800'],"['https://news.yahoo.co.jp/articles/10a427a9fcdd7e2eada8e88ea22ff14659cbe5d2/images/000', 'https://mainichi.jp/graphs/20240604/mpj/00m/040/012000f?inb=ys']"
札幌で2年連続ラグビー日本代表戦　昨年退場のリーチがフル出場（毎日新聞）,https://news.yahoo.co.jp/articles/5fc6cd21d14f506005b43259507e9d0e192e0823,https://newsatcl-pctr.c.yimg.jp/t/amd-img/20240721-00000055-mai-000-1-view.jpg?exp=10800,2024-07-21T19:12:17+09:00,2024-07-21T19:12:17+09:00,毎日新聞,mai,毎日新聞,510,\n前半、ボールを追う小山大輝（左から2人目）とリーチ・マイケル（同4人目）＝札幌ドームで2024年7月21日、貝塚太一撮影\nラグビーの日本代表が21日、札幌ドームで「リポビタンDチャレンジカップ」のイタリア戦に臨み、北海道ゆかりの選手が1万7411人の地元ファンを沸かせた。札幌ドームでの日本代表戦は2年連続の開催。試合は14―42で敗れた。\n【写真】ラグビー日本代表強化試合 イタリアに14ー42で敗れる\n札幌山の手高OBのFWリーチ・マイケル（BL東京）が主将を務め、芦別市出身で芦別高OBのSH小山大輝（埼玉）も先発出場した。昨年、札幌で開催されたサモア戦で前半30分に退場処分となったリーチは、この日はフル出場。「レッドカード（退場）だけしないようにと100回くらい言われていた」と冗談めかしつつ、「勝つ日本代表を見せたかった。集まってくれてありがとうございました」と地元ファンにメッセージを送った。\n\n 13日のジョージア戦で代表戦初出場を飾ったばかりの小山は「代表で北海道に帰って来られてすごくうれしいが、厳しい試合だった。またチャンスをもらえるようにアピールしていく」と話していた。【谷口拓未】,['https://newsatcl-pctr.c.yimg.jp/t/amd-img/20240721-00000055-mai-000-1-view.jpg?pri=l&w=640&h=505&exp=10800'],"['https://news.yahoo.co.jp/articles/5fc6cd21d14f506005b43259507e9d0e192e0823/images/000', 'https://mainichi.jp/graphs/20240721/mpj/00m/050/109000f/20240721mpj00m050100000p?inb=ys']"
JR新宿駅で人身事故　中央線快速が運転見合わせ　東京-高尾間（毎日新聞）,https://news.yahoo.co.jp/articles/46da8fd43708bc75e88a70df57f76d83e00d2c34,https://newsatcl-pctr.c.yimg.jp/t/amd-img/20240721-00000058-mai-000-1-view.jpg?exp=10800,2024-07-21T20:24:41+09:00,2024-07-21T20:24:41+09:00,毎日新聞,mai,毎日新聞,150,\nJR東日本のロゴマーク\n21日午後7時40分ごろ、JR中央線・新宿駅（東京都新宿区）の上りホームで人身事故があった。この影響で、中央線の快速は東京―高尾間で上下線とも運転を見合わせている。JR東日本によると、再開は午後8時40分ごろの見込み。【春増翔太】\n【写真で見る】社会に衝撃を与えた事件,['https://newsatcl-pctr.c.yimg.jp/t/amd-img/20240721-00000058-mai-000-1-view.jpg?pri=l&w=640&h=432&exp=10800'],"['https://news.yahoo.co.jp/articles/46da8fd43708bc75e88a70df57f76d83e00d2c34/images/000', 'https://mainichi.jp/graphs/20181212/hpj/00m/040/003000g/20181214hpj00m040001000q?inb=ys']"
ウルフドッグス名古屋の市川健太選手が献血呼びかけ　ファンが行列（毎日新聞）,https://news.yahoo.co.jp/articles/342ca2f4759216f67c27576bdae8766b38738ef3,https://newsatcl-pctr.c.yimg.jp/t/amd-img/20240721-00000054-mai-000-3-view.jpg?exp=10800,2024-07-21T19:07:44+09:00,2024-07-21T21:24:19+09:00,毎日新聞,mai,毎日新聞,564,\n愛知県赤十字血液センターの木下朝博所長（左）から「一日献血ルーム所長」の委嘱状を受け取った市川健太選手＝名古屋市西区で2024年7月21日午後1時37分、川瀬慎一朗撮影\n7月の「愛の血液助け合い運動」に合わせ、男子バレーSVリーグ「ウルフドッグス名古屋」のリベロ、市川健太選手（25）が21日、名古屋市西区のイオンモール名古屋ノリタケガーデン内にある献血ルームの一日所長に就任。買い物客らに献血への協力を呼びかけた。\n【写真】献血呼びかける様子\n市川選手が一日所長を務めたのは「献血ルーム フォレスト」。愛知県赤十字血液センターによると、同ルームは全国に3カ所しかない完全予約制の血漿（けっしょう）成分献血専用のルーム。血漿は「免疫グロブリン製剤」など薬の原料で、子どもがかかる川崎病や重症筋無力症などに有効とされる。近年、使用する病気の範囲が広がり需要が増しているため、2021年に同ルームができた。\n\n 市川選手はトークショーで「病気で治療中の患者さんのためにも献血への協力をお願いします」と呼びかけた。午前9時半配布のトークショー観覧席の整理券を求め、同5時半から県内外の多数のファンが列を作った。\n\n 成分献血は18歳以上から協力できる。問い合わせは同ルーム（052・462・8090）。【川瀬慎一朗】,['https://newsatcl-pctr.c.yimg.jp/t/amd-img/20240721-00000054-mai-000-3-view.jpg?pri=l&w=640&h=462&exp=10800'],"['https://news.yahoo.co.jp/articles/342ca2f4759216f67c27576bdae8766b38738ef3/images/000', 'https://mainichi.jp/graphs/20240721/mpj/00m/040/114000f/20240721k0000m040171000p?inb=ys']"
三重・松阪市の川で男子中学生が死亡　19日夜から連絡取れず（毎日新聞）,https://news.yahoo.co.jp/articles/c81c79f0c627d084940ce89bf369e2dcc4b9f7d8,https://newsatcl-pctr.c.yimg.jp/t/amd-img/20240721-00000051-mai-000-1-view.jpg?exp=10800,2024-07-21T18:33:52+09:00,2024-07-21T18:33:52+09:00,毎日新聞,mai,毎日新聞,430,\n三重県松阪市\n21日午前9時45分ごろ、三重県松阪市飯高町宮前の深谷川で、市内に住む市立中学2年の男子生徒（13）がうつぶせに倒れているのが見つかり、その場で死亡が確認された。三重県警松阪署は司法解剖して死因を調べるとともに、男子生徒が死亡した経緯などを調べている。\n【写真】2023年7月には…川遊び中の女児3人が死亡 現場は\n同署によると、男子生徒は夏休み前の最後の授業があった19日の夜から連絡が取れなくなっており、父親が20日午後7時20分ごろ、交番に「息子がいなくなった」と届け出た。警察や消防は21日朝から自宅付近を捜索。近隣住民が、深谷川に架かる橋の真下付近で倒れている男子生徒を発見した。\n\n 水面から橋までの高さは約14メートル、水深は80センチ前後だった。男子生徒はTシャツ、ハーフパンツ姿で目立った外傷はないという。男子生徒の所持品は現場付近では見つかっておらず、携帯電話も自宅に置いたままだったという。【原諒馬、太田圭介】,['https://newsatcl-pctr.c.yimg.jp/t/amd-img/20240721-00000051-mai-000-1-view.jpg?pri=l&w=640&h=422&exp=10800'],"['https://news.yahoo.co.jp/articles/c81c79f0c627d084940ce89bf369e2dcc4b9f7d8/images/000', 'https://mainichi.jp/graphs/20230721/mpj/00m/040/100000f/20230721mpj00m040099000p?inb=ys']"
石破茂氏、自民総裁選の対応判断は「お盆をめどに」（毎日新聞）,https://news.yahoo.co.jp/articles/4fd5658e0c4dadbb3780b099c2d1c6b0dead4d4f,https://newsatcl-pctr.c.yimg.jp/t/amd-img/20240721-00000053-mai-000-3-view.jpg?exp=10800,2024-07-21T18:51:29+09:00,2024-07-21T23:22:45+09:00,毎日新聞,mai,毎日新聞,490,\n自民党総裁選への対応について記者団の質問に答える石破茂元幹事長＝鳥取市内で7月21日、川口峻撮影\n自民党の石破茂元幹事長は21日、9月に予定される自民党総裁選に出馬するかどうかについて「今申し上げる段階ではないが、やっぱりお盆が一つのめどではある」と述べ、8月中旬以降に判断する考えを示した。\n【一覧】次の首相にふさわしい人 世論調査の上位8人\n地元の鳥取市内で記者団の質問に答えた。出馬・不出馬の表明について「早く言えばそれで良いというものでもない」と言及。「世の中で言われている」総裁選候補者として茂木敏充幹事長、高市早苗経済安全保障担当相、小林鷹之前経済安保相、河野太郎デジタル相の4人の名前を挙げ、「いろんな人がまだ何も言っていない時だ」とし、「少なくともお盆まではよく熟慮すべき時ではないか」と述べた。\n\n 岸田文雄首相が出馬の可否を判断するのを待つのかとの質問には「そこはいろんなことがあるんだろう」とし、「（首相の）問題意識を聞かなければ（自身の）判断にもならないでしょう。それも聞かないで『俺は出るぞ』みたいなのはどうでしょうね」と語った。【川口峻】,['https://newsatcl-pctr.c.yimg.jp/t/amd-img/20240721-00000053-mai-000-3-view.jpg?pri=l&w=640&h=480&exp=10800'],"['https://news.yahoo.co.jp/articles/4fd5658e0c4dadbb3780b099c2d1c6b0dead4d4f/images/000', 'https://mainichi.jp/graphs/20240623/mpj/00m/010/058000f/20240623k0000m010161000p?inb=ys']"
