headline,mainEntityOfPage,image,datePublished,dateModified,author,media_en,media_jp,str_count,body,images,external_links
静岡・沼津でヒマワリが見ごろ　太陽の下、色鮮やかに咲き誇る（毎日新聞）,https://news.yahoo.co.jp/articles/4671cfdf30aed60f1970f6d5f3c64fcdcbbabaed,https://newsatcl-pctr.c.yimg.jp/t/amd-img/20240721-00000039-mai-000-2-view.jpg?exp=10800,2024-07-21T16:48:46+09:00,2024-07-21T19:01:46+09:00,毎日新聞,mai,毎日新聞,524,\n浮島ひまわりらんどで咲き誇るヒマワリ＝静岡県沼津市平沼で2024年7月21日午前9時58分、石川宏撮影\n静岡県沼津市平沼の「浮島ひまわりらんど」でヒマワリが見ごろを迎え、21日、ひまわり祭りが開かれ、多くの人でにぎわった。ヒマワリは時期をずらして植えており、見ごろは8月上旬まで。\n【写真で見る】数十年に1度咲くアオノリュウゼツラン、どんな花?\n荒れた農地の景観保全をと2009年に農林水産省の補助を受け、かつての水田約2000平方メートルにヒマワリを植えたのが始まり。今年は5月中旬に約2万5000個の種をポットに植え、6月上旬に地面に植え直した。\n\n 今年の面積は過去最大の約3650平方メートル。ぎらぎらした太陽の下、黄色い花が色鮮やかに咲き誇り、周囲を蜂や他の虫が飛び交っていた。21日は高所作業車の約9メートルのゴンドラからヒマワリを見下ろすイベントもあった。\n\n 浮島地区環境保全推進会の長沢利之会長（72）は「ヒマワリを楽しむとともに、農業や地域の振興も考えてほしい」と話した。同市立浮島中1年の野崎葵（あおい）さん（12）は「元気に咲いてくれて良かった。上から見るときれいで涼しかった」と話した。\n\n【石川宏】,['https://newsatcl-pctr.c.yimg.jp/t/amd-img/20240721-00000039-mai-000-2-view.jpg?pri=l&w=640&h=404&exp=10800'],"['https://news.yahoo.co.jp/articles/4671cfdf30aed60f1970f6d5f3c64fcdcbbabaed/images/000', 'https://mainichi.jp/graphs/20240719/mpj/00m/040/225000f/20240719k0000m040188000p?inb=ys']"
“千葉ダービー”を知事観戦　両スタンドで「公平に」応援　都市対抗（毎日新聞）,https://news.yahoo.co.jp/articles/9ad4aa4850521cc8d76b261469a104dc610d712b,https://newsatcl-pctr.c.yimg.jp/t/amd-img/20240721-00000038-mai-000-1-view.jpg?exp=10800,2024-07-21T16:32:02+09:00,2024-07-21T16:32:02+09:00,毎日新聞,mai,毎日新聞,553,\nプレーボールから五回表まで、日本製鉄かずさマジックのスタンドにいた熊谷俊人・千葉県知事（前列右）。チームカラーの紫色のうちわを振って応援した＝東京都文京区の東京ドームで2024年7月21日午後2時6分、竹田直人撮影\n東京ドームで開催されている第95回都市対抗野球大会の1回戦で21日、日本製鉄かずさマジック（千葉県君津市）対JFE東日本（千葉市）の“千葉ダービー”が実現した。ドームに駆け付けた熊谷俊人・千葉県知事は、試合中に両チームのスタンドを移動するなど「公平」なスタンスで応援。「千葉県民にとって夢のカードが実現し、最高の気分」と声援を送っていた。\n【写真特集】君津市（日本製鉄かずさマジック）－千葉市（JFE東日本）\n熊谷知事は千葉市長時代、JFE東日本の始球式を務めたこともあるが、この日は「知事としては両方のチームを応援する立場」。プレーボールから五回表までは三塁側の日本製鉄かずさマジックのスタンドに陣取り、チームカラーの紫色のうちわを振って応援した。五回裏からは、一塁側のJFE東日本のスタンドに移動し、試合の行方を見守った。\n\n 熊谷知事は「試合はもちろん、両チームの応援も違いがあっておもしろい。見どころが多くて忙しいくらい、楽しめています」と満足そうだった。【竹田直人】,['https://newsatcl-pctr.c.yimg.jp/t/amd-img/20240721-00000038-mai-000-1-view.jpg?pri=l&w=420&h=640&exp=10800'],"['https://news.yahoo.co.jp/articles/9ad4aa4850521cc8d76b261469a104dc610d712b/images/000', 'https://mainichi.jp/graphs/20240721/mpj/00m/050/059000f/20240721mpj00m050054000p?inb=ys']"
城島健司氏ら元メジャーリーガー、海で対決へ　茨城のカジキ釣り大会（毎日新聞）,https://news.yahoo.co.jp/articles/433a1e42f3ffef07e5c228e36cb5ba74b5f17510,https://newsatcl-pctr.c.yimg.jp/t/amd-img/20240721-00000036-mai-000-2-view.jpg?exp=10800,2024-07-21T15:32:32+09:00,2024-07-21T15:35:49+09:00,毎日新聞,mai,毎日新聞,1131,\n2022年大会で出場者が釣り上げたカジキの検量式の様子。このマカジキは55.8キロだった＝茨城県提供\n茨城県大洗町で毎年行われているカジキ釣り大会「茨城インターナショナルフィッシングフェスティバル」について、実行委員会事務局を務める県は、世界で最も賞金が高いメキシコのカジキ釣り大会と提携したと発表した。3年目の今年は、8月30日から9月1日までの3日間、大洗町の大洗マリーナ周辺で開催する。\n【巨大】日本記録級、5キロのマダコの写真\n◇世界で最も賞金が高い大会と連携\n\n 実行委が提携したのは、メキシコのリゾート地・ロスカボスで開催しているカジキ釣り大会。新たな取り組みとして、茨城大会の優勝チームにロスカボス大会の出場費用（100万円）を贈呈したり、副賞としてロスカボス観光局が高級テキーラを提供したりする。賞金総額も昨年より200万円高い500万円まで引き上げ、リゾート地を目指す大洗エリアの世界的な認知度向上を図るという。\n\n 昨年は39隻、200人あまりが出場した大会に今年は、招待選手としてプロ野球ソフトバンクホークスや米大リーグ、シアトル・マリナーズなどで捕手として活躍し、民放の釣り番組に出演する城島健司氏が初参加する。1回目から3年連続で参戦することになる、元マリナーズの佐々木主浩氏との元メジャーリーガー対決に注目が集まる。\n\n 陸上の会場周辺では今回初めて、飲食店に大会サポーターになってもらう仕組みを作る。大会ホームページで店をPRしたりする一方、店には出場選手に「ドリンク1杯無料」などのサービスを任意で提供してもらう。主戦場が海上となる大会で、陸上にいる県民との一体感を作りたい考えだ。\n\n また大会最終日の9月1日は防災の日に当たることから、プロレスラーの蝶野正洋氏による防災の意義を学ぶトークショーを開くほか、カジキの解体ショーもある。\n\n ◇「リゾート構想」の一環\n\n 県は5年前から、ラグジュアリーホテルの誘致などを通じて魅力的でおしゃれなリゾートを目指す「ひたちなか大洗リゾート構想」を推進している。県とひたちなか市、大洗町はこれまで、少なくとも2・5億円をこの事業に投入。カジキ釣り大会もこの構想の一環と位置づけており、メキシコとの提携を契機に、海外の富裕層を茨城に呼び込むことを目指している。\n\n 構想の数値目標は定められておらず、進展状況は見えにくいが、県によると、県立大洗水族館のリニューアルによる集客力向上や、サンビーチ周辺の整備などで一定の成果をあげているという。大井川和彦知事は「（歩みは登山に例えると）3合目ぐらい。まだまだできることがある」などと話している。【寺田剛】,['https://newsatcl-pctr.c.yimg.jp/t/amd-img/20240721-00000036-mai-000-2-view.jpg?pri=l&w=640&h=427&exp=10800'],"['https://news.yahoo.co.jp/articles/433a1e42f3ffef07e5c228e36cb5ba74b5f17510/images/000', 'https://mainichi.jp/graphs/20230701/mpj/00m/040/053000f/20230701k0000m040090000p?inb=ys']"
ペンギンの赤ちゃんすくすく　8月4日まで公開　山口・海響館（毎日新聞）,https://news.yahoo.co.jp/articles/34c88206cf36133c6a37e6b34a5b2e0c6a16e4f8,https://newsatcl-pctr.c.yimg.jp/t/amd-img/20240721-00000037-mai-000-1-view.jpg?exp=10800,2024-07-21T16:00:19+09:00,2024-07-21T16:00:19+09:00,毎日新聞,mai,毎日新聞,443,\n体重計に乗るジェンツーペンギンの赤ちゃん＝海響館提供\n山口県下関市立水族館「海響館」で、６月に相次いで誕生したペンギンの赤ちゃん３羽の体重測定の様子を公開している。８月４日まで連日午後２時半からの５分間、１羽のみ見学できる。\n【写真特集】ペット犬種の人気上位のワンコたち\n同館では、ミナミイワトビペンギンのひな２羽が６月１０、１６日に、ジェンツーペンギンのひな１羽が同１４日に誕生。いずれも野生では南極周辺に生息する。７月１７日現在、ミナミイワトビペンギンの赤ちゃんは１０日生まれが１・４９キロ、１６日生まれが１・３２キロで、ジェンツーペンギンの赤ちゃんは２・９４キロ。体長はミナミイワトビペンギンが各約３０センチ、ジェンツーペンギンは約４３センチに成長している。\n\n 公開が８月４日までなのは、この時期を過ぎると巣立ちが始まるためという。１日５分間の短時間公開だが、同館は「赤ちゃんペンギンを間近で観察できる数少ない機会なので、ぜひ来館を」と呼び掛けている。【山本泰久】,['https://newsatcl-pctr.c.yimg.jp/t/amd-img/20240721-00000037-mai-000-1-view.jpg?pri=l&w=640&h=431&exp=10800'],"['https://news.yahoo.co.jp/articles/34c88206cf36133c6a37e6b34a5b2e0c6a16e4f8/images/000', 'https://mainichi.jp/graphs/20220122/mpj/00m/040/015000f/1?inb=ys']"
首相、裏金事件で「責任を果たしていない」83％　毎日新聞世論調査（毎日新聞）,https://news.yahoo.co.jp/articles/c5beb2e26837197aa797b6b1d5700977b1db4129,https://newsatcl-pctr.c.yimg.jp/t/amd-img/20240721-00000035-mai-000-2-view.jpg?exp=10800,2024-07-21T15:26:06+09:00,2024-07-21T17:00:48+09:00,毎日新聞,mai,毎日新聞,426,\n自民党本部＝東京都千代田区で、平田明浩撮影\n毎日新聞は20、21の両日、全国世論調査を実施した。自民党派閥の裏金事件に関し、岸田文雄首相が党総裁として責任を果たしたと思うか尋ねたところ、「果たしたと思わない」が83％に上り、「果たしたと思う」は8％にとどまった。\n【図で解説】裏金化、どうやった？ 疑惑の構図\n自民党は4月、裏金事件を受け、安倍、二階両派の議員ら39人の処分を発表したが、岸田首相は処分の対象から除外された。しかし、菅義偉前首相が月刊誌「Hanada」8月号のインタビューで「（首相自身も）各派閥と同じような処分を自身に科すべきだった。責任を取るべきだったのではないか」と批判するなど、党内から岸田首相の責任を問う声が上がっている。\n\n 調査は、携帯電話のショートメッセージサービス（SMS）機能を使う方式と、固定電話で自動音声の質問に答えてもらう方式を組み合わせ、携帯507件、固定513件の有効回答を得た。【野原大輔】,['https://newsatcl-pctr.c.yimg.jp/t/amd-img/20240721-00000035-mai-000-2-view.jpg?pri=l&w=640&h=427&exp=10800'],"['https://news.yahoo.co.jp/articles/c5beb2e26837197aa797b6b1d5700977b1db4129/images/000', 'https://mainichi.jp/graphs/20231203/mpj/00m/010/135000f/20231203k0000m010184000p?inb=ys']"
岸田内閣支持率21％　2カ月ぶり20％台回復　毎日新聞世論調査（毎日新聞）,https://news.yahoo.co.jp/articles/8361e60d79bac5d50b807f44e36d61399b92fabe,https://newsatcl-pctr.c.yimg.jp/t/amd-img/20240721-00000033-mai-000-8-view.jpg?exp=10800,2024-07-21T15:14:55+09:00,2024-07-21T23:05:40+09:00,毎日新聞,mai,毎日新聞,389,\n岸田文雄首相\n毎日新聞は20、21の両日、全国世論調査を実施した。岸田内閣の支持率は、6月22、23日実施の前回調査（17％）より4ポイント増の21％で、2カ月ぶりに20％台を回復した。不支持率は前回調査（77％）から4ポイント減の73％だった。支持率が30％を下回るのは、昨年7月（28％）以降13カ月連続。\n【写真特集】「次の首相にふさわしい人」1位は… 6月調査\n昨年11月以降、自民党派閥の政治資金パーティーを巡る裏金問題が深刻化。今年2月には支持率が14％にまで下落した。岸田文雄首相（自民党総裁）は、改正政治資金規正法を成立させるなど政治の信頼回復に努めている。\n\n 調査は、携帯電話のショートメッセージサービス（SMS）機能を使う方式と、固定電話で自動音声の質問に答えてもらう方式を組み合わせ、携帯507件、固定513件の有効回答を得た。【野原大輔】,['https://newsatcl-pctr.c.yimg.jp/t/amd-img/20240721-00000033-mai-000-8-view.jpg?pri=l&w=640&h=480&exp=10800'],"['https://news.yahoo.co.jp/articles/8361e60d79bac5d50b807f44e36d61399b92fabe/images/000', 'https://mainichi.jp/graphs/20240623/mpj/00m/010/058000f/20240623k0000m010161000p?inb=ys']"
国内唯一のトロリーバス、11月末で廃止　整備士「私の誇り」（毎日新聞）,https://news.yahoo.co.jp/articles/83a50846ad20e4034731533e41f483e883a642a9,https://newsatcl-pctr.c.yimg.jp/t/amd-img/20240721-00000032-mai-000-1-view.jpg?exp=10800,2024-07-21T15:00:22+09:00,2024-07-21T15:00:22+09:00,毎日新聞,mai,毎日新聞,917,\nトンネルの壁ぎりぎりを走行するトロリーバス＝富山県立山町の立山トンネル内で２０２４年６月１８日、青山郁子撮影\n外見はバスのようで実は鉄道の仲間「トロリーバス」。国内で唯一、富山県の「立山黒部アルペンルート」で走行していたが、近年部品調達が困難になったことなどから今年１１月３０日に廃止される。アルペンルートは、貴重な運輸遺産を記憶に残そうと、多くの観光客でにぎわっている。【青山郁子】\n【写真】立山連峰と氷河 自然の威力と絶景\nトロリーバスは、架線からの電気で走る仕組みで、鉄道の一種「無軌条電車」に分類される。アルペンルートでは、立山トンネルの室堂（標高２４５０メートル）―大観峰（同２３１６メートル）間の約３・７キロを約１０分で結ぶ。もともとはディーゼルエンジン搭載のバスだったが、環境面から１９９６年にトロリーバスを導入。２０１９年に関西電力が電気バスに切り替えて以降は、このルートが国内唯一かつ、最も高い標高を走る鉄道路線となっていた。現在は８台が稼働し、これまで累計１９４０万人以上が利用した。今季限りで全車が引退し、来春からは電気バスを導入予定。\n\n 実際に乗車すると、バスとは違い、エンジン音でなくモーター音が聞こえる。路線の途中には、立山トンネルでも最も工事が難航した「破砕帯」や、立山の主峰、雄山（同３００３メートル）の直下、壁面すれすれのバスのすれ違いなど短距離ながらも見どころが満載だ。\n\n トロリーバスに憧れて入社し、通算１２年間バスの運転や整備に携わったという整備士の早川忍さん（５１）は「寂しいが、次世代への切り替え時期でもあり仕方がない。最後までこのバスを整備できたのは私の誇りであり、有終の美を見守れることにとても感謝している。最後まで安全運行を心がけ、車両にはありがとうございましたと言いたい」と話す。\n\n 運営する立山黒部貫光（富山市）では、カードやミニチュア模型など記念グッズの作成のほか、仕組みが分かるバックヤードツアーや走行音の録音会などイベントも企画。最終日にはラストランセレモニーもある。申し込み、問い合わせは同社プロモーションセンター（０７６・４３１・３３５０）。,['https://newsatcl-pctr.c.yimg.jp/t/amd-img/20240721-00000032-mai-000-1-view.jpg?pri=l&w=640&h=426&exp=10800'],"['https://news.yahoo.co.jp/articles/83a50846ad20e4034731533e41f483e883a642a9/images/000', 'https://mainichi.jp/graphs/20221019/mpj/00m/040/044000f/20221019k0000m040334000p?inb=ys']"
B1昇格目指す福島ファイヤーボンズ　人材確保へ複業クラウド活用（毎日新聞）,https://news.yahoo.co.jp/articles/e4ee9e6250572ed083c29ad51824a0ba665e9423,https://newsatcl-pctr.c.yimg.jp/t/amd-img/20240721-00000031-mai-000-2-view.jpg?exp=10800,2024-07-21T14:54:53+09:00,2024-07-21T15:59:39+09:00,毎日新聞,mai,毎日新聞,1592,\n複業クラウドを通じて福島ファイヤーボンズに加わった工藤直之さん（右）と西田創社長＝福島県郡山市堂前町の福島スポーツエンタテインメントで2024年7月3日午後3時22分、錦織祐一撮影\nサッカーJリーグ、バスケットボールBリーグなどの影響でプロスポーツの裾野が全国に広がり、地域密着型のクラブが各地に設立されている。だが経営規模は成長途上で人手は限られる。そんな中で、Bリーグ1部（B1）昇格を目指すB2東地区の福島ファイヤーボンズ（FB、福島県郡山市）は、あるITサービスに事業拡大の活路を見いだしている。\n【写真で見る】サッカー日本代表のW杯歴代ユニホーム\nFBは2020年3月、組織コンサルタント会社「識学」（東京）が運営会社「福島スポーツエンタテインメント」の親会社となり経営再建に乗り出した。識学から派遣され副社長、21年に社長に就任した西田創（つくる）さん（41）は東福岡高で全国高校ラグビー準優勝。立教大、トップリーグ（現リーグワン）NECでも活躍した元ラガーマンだ。\n\n 当初の社員は6人だったが、西田さんらは「まずは部署ごとの専門性を高めるために人材に先行投資しよう」と社員を積極的に採用することから始め、現在は36人まで増強した。そのかいあって、スポンサー企業は当初の178社から700社超と約4倍に。売上高は新型コロナウイルス流行前の18～19年シーズンの2・1億円から昨季は8・1億円を見込み、B1クラブと比べて遜色のない経営規模にまで成長した。\n\n ただ、西田さんは「自分がイメージしているスピード感での人材採用はできていない」と明かす。スポーツクラブの人件費は通常、まずは「至上命令は勝利」と現場の選手や指導陣に費やす。FBはそれに加えて法人営業部門を強化してきたが「人手が足りない中では後回しになるが本当は必要」というウェブやグラフィックのデザイン、動画制作、試合会場の運営などブランドイメージを手掛ける人材に乏しかった。専門人材は首都圏に偏在し、地方は人手不足という事情も重なる。\n\n そこで目を付けたのが、副業を希望する人材と企業などをネット上でマッチングするサービス「複業クラウド」だった。ITベンチャー「アナザーワークス」（東京）が19年に始め、現在約8万人が登録している。これを22年1月に導入し、試合会場を運営するゲームオペレーターやウェブデザイナーを募集すると複数の応募があった。ゲームオペレーターには工藤直之さん（32）を採用できた。\n\n 工藤さんは「バスケの街」秋田県能代市出身。仙台市の人材会社に勤務していたが「スポーツビジネスに携わりたいと漠然と思って、サッカーなどのクラブに経営企画を持ち込んでいた」という。そんな折に複業クラウドでFBの募集を知った。平日は仙台で勤務し、週末に試合会場でイベントや演出を手伝ってみると「実際に現場で携わったことで、エンタメとしての面白さに魅了されて」半年後に正社員となった。\n\n FBは複業クラウドを通じて複数人を採用しており、現在もマスコットを演じる着ぐるみアクターを複業クラウドで募集している。工藤さんはチケット販売やファンクラブ運営などを手掛けるコンシューマーセールスチームの課長を務め「スポーツビジネスは公共性が高く、地域のために働き、地域に応援されて成立する。責任の大きさを含めて醍醐味（だいごみ）を感じます」と語る。\n\n 25年春にはホームの宝来屋郡山総合体育館で改修工事が終わり、B1基準の5000人収容となる。悲願のB1昇格を目指す西田さんは「複業クラウドは地方クラブでは採用が難しかった多種多様な経験や年齢層の人材にリーチでき、効果は大きかった。取り組めることが増えたのでB1を目指して一気に事業を拡大していきたい」と意欲を新たにする。【錦織祐一】,['https://newsatcl-pctr.c.yimg.jp/t/amd-img/20240721-00000031-mai-000-2-view.jpg?pri=l&w=640&h=427&exp=10800'],"['https://news.yahoo.co.jp/articles/e4ee9e6250572ed083c29ad51824a0ba665e9423/images/000', 'https://mainichi.jp/graphs/20221101/mpj/00m/050/073000f/20221101mpj00m050066000p?inb=ys']"
