headline,mainEntityOfPage,image,datePublished,dateModified,author,media_en,media_jp,str_count,body,images,external_links
「キングオブコント2024」cacao、シティホテル3号室、ダンビラムーチョが初の決勝（お笑いナタリー）,https://news.yahoo.co.jp/articles/089736ac1a423c32e06ebd193437ca1e59ae9a80,https://newsatcl-pctr.c.yimg.jp/t/amd-img/20240912-00000143-natalieo-000-1-view.jpg?exp=10800,2024-09-12T21:00:23+09:00,2024-09-12T21:00:23+09:00,お笑いナタリー,natalieo,お笑いナタリー,2679,\n「カーネクストpresents キングオブコント2024」ファイナリスト10組。\n「カーネクストpresents キングオブコント2024」のファイナリストが本日9月12日に発表された。史上最多エントリーの3139組から勝ち上がったのは、コットン、ラブレターズ、隣人、ロングコートダディ、ニッポンの社長、cacao、シティホテル3号室、ダンビラムーチョ、ファイヤーサンダー、や団の10組だ。決勝が来月10月12日（土）に生放送されることも発表された。\n【画像】「キングオブコント2024」ファイナリスト10組と記者会見MCの小籔千豊\ncacao、シティホテル3号室、ダンビラムーチョは初の決勝進出。コットン、ファイヤーサンダー、隣人は2回目、ロングコートダディ、や団は3回目、ラブレターズ、ニッポンの社長は5回目の決勝となる。先日、ファイナリストたちの記者会見が東京・TBSで行われ、その様子は「キングオブコント」の公式YouTubeチャンネルで配信された。\n\n小籔千豊がMCを務める中、10組は決戦への意気込みを述べる反面、「キングオブコント」という言葉を別の何かにもじったり、ほかの芸人や小籔に絡んだり。コットンとラブレターズの背比べ、小籔が気に入った様子のシティホテル3号室・押田のギャグなどの脱線トークを含めて会見は盛り上がりを見せた。果たして第17代キングの称号と優勝賞金1000万円を手にするのは誰なのか。\n\n■ 「キングオブコント2024」ファイナリストのコメント\n□ コットン\n西村：2年前に決勝に出させてもらって、ビスブラさんにあと一歩のところで負けた。一矢報いたい。\n\nきょん：僕たちのコントがナンバー“ワン”！（とズボンの下に仕込んだ犬のパンツを見せる）\n\n□ ラブレターズ\n溜口：ファイナリスト5回は恥ずかしい。これ以上回を重ねないように。「コントここにあり」を見せたい。\n\n塚本：きっちりといただいた時間で日本語の美しさを文字数ぴったりでお届けしたい。\n\n溜口：「プレバト!!」に出たときの俳句の意気込み？\n\n□ 隣人\n中村遊直：ワテら大阪から来たさかいに、なにわのコント背負って優勝しまっせ。\n\n橋本市民球場：今年は一番早く組み立てて2泊3泊とできるやつを……あ、ごめんなさい、“キングオブテント”でしたわ。\n\n□ ロングコートダディ\n堂前：最初のほう楽しいなという感じだったけど、そろそろチャンピオンになりたい。「キングオブコント」という名のいただきに、行ってきまーす！\n\n兎：いろんな音とか駆使しながらがんばりたいと思います。\n\n□ ニッポンの社長\n辻：5回連続というのはKKコンビ（PL学園時代に5回連続甲子園に出場した桑田真澄と清原和博）以来らしくて。今年こそ僕らがナンバーワン！（ときょん同様にパンツを見せる）\n\nケツ：（辻のパンツに対して）クリリンやないか！ まあ、自分の好きなものをたくさん入れていかに皆さんの胃袋をつかむか。大人数でもかかってこいよと……あ、すみません、“キングオブチャンコ”と間違えました。\n\n□ cacao\n浦田スターク：うれしかったけど実感がまだ沸いてないので、ゆっくり噛み締めたい。メガネを外したら（相方2人と）似てると言われる。僕がちょうど2人の間の顔。\n\n高橋：なんにも関係ありませんよー（といったギャグを披露）。\n\nたっぺい：浦田のメガネ、めっちゃオモロいです。\n\n浦田：（レンズが動くメガネをアピール）\n\n□ シティホテル3号室\n亮太：ちょうどいいところですよね。（38歳で）円熟した感じ。手応えは毎年あった。今回結果が出ました。\n\n押田：もちろん目標は優勝。トロフィーをスパイダーマンのように絡め取っていきたいと思いますよ。ピシ！（とスパイダーマンをイメージしたようなギャグを披露）\n\n□ ダンビラムーチョ\n大原：山梨のYBSという日テレ系列の局で「ててて！TV」という番組に出ている。これ（「キングオブコント」決勝進出）でUTYというTBS系列の局にも出られると思うのでがんばりたい。\n\n原田フニャオ：一番大事なのは、輪っかのようにくっつけること。瞬間的に……あ、すいません、僕“リングオブボンド”の話しちゃいました～。\n\n□ ファイヤーサンダー\n崎山：昨年は僕らは8番手で1回3位に食い込んだけど、サルゴリラさんに行かれたので絶対3位以内に残って優勝します。\n\nこてつ：ここって世界一のテーマパークやと思うんです。来客数も多いし、お客さんをいかにコントで楽しませるか……すいません、“キングオブランド”でコントの話してました。\n\n□ や団\n本間キッド：「にゃにゃにゃ、にゃにゃにゃ」……気合入りすぎて思わず猫語でしゃべっちゃいました。得点制とかややこしいので、僕らネタ9本やりますので1組ずつタイマンでつぶしてってもいいですかね？ なあ！ お前ら！\n\nロングサイズ伊藤：いい加減にしろよ！ こいつ捨ててきますわ！（と伊藤が本間の体を抱えてスタジオから退場。その後、逆に本間が伊藤を抱えて戻ってくる）\n\n※ファイヤーサンダー崎山の「崎」は「たつさき」が正式表記。\n\n■ カーネクストpresents キングオブコント2024\nTBS系 2024年10月12日（土）生放送\n＜出演者＞\nコットン / ラブレターズ / 隣人 / ロングコートダディ / ニッポンの社長 / cacao / シティホテル3号室 / ダンビラムーチョ / ファイヤーサンダー / や団\n\n■ 「キングオブコント2024」準決勝進出者\n相性はいいよね / いぬ / インポッシブル / うるとらブギーズ / おおぞらモード / 蛙亭 / cacao / カベポスター / 気になるあの娘 / 金の国 / コットン / サスペンダーズ / さすらいラビー / ザ・プラン9 / ザ・マミィ / しずる / シティホテル3号室 / Gパンパンダ / スクラップス / セルライトスパ / ダウ90000 / ダンビラムーチョ / TCクラクション / トゥリオ / ななまがり / ニッポンの社長 / 春とヒコーキ / ファイヤーサンダー / ブラゴーリ / マイスイートメモリーズ / やさしいズ / や団 / ラブレターズ / 隣人 / ロングコートダディ,['https://newsatcl-pctr.c.yimg.jp/t/amd-img/20240912-00000143-natalieo-000-1-view.jpg?pri=l&w=640&h=426&exp=10800'],"['https://news.yahoo.co.jp/articles/089736ac1a423c32e06ebd193437ca1e59ae9a80/images/000', 'https://natalie.mu/owarai/gallery/news/590531/2408769?ref=ynews&place=inline']"
キンタロー。カラオケとダンス同時採点で真の超人目指す　アンタ柴田ら予想（お笑いナタリー）,https://news.yahoo.co.jp/articles/de69869ab58ff5e01c665679bc1cc3572feb1f53,https://newsatcl-pctr.c.yimg.jp/t/amd-img/20240912-00000096-natalieo-000-1-view.jpg?exp=10800,2024-09-12T18:00:14+09:00,2024-09-12T18:00:14+09:00,お笑いナタリー,natalieo,お笑いナタリー,976,\nアンタッチャブル柴田（左から2人目）ら「THE超人ダービー」スタジオ出演者たち。(c)TBS\n明後日9月14日（土）に「異なるジャンルのトップが対決！THE超人ダービー」（TBS）と題した番組が放送される。これは異なる4つのジャンルの“超人”が1つのテーマで対決し、誰が一番になるかをスタジオゲストのアンタッチャブル柴田らが予想するもの。カラオケとダンスの採点を同時に行って“真の歌って踊れる超人”を決める「ダンスカラオケダービー」には、キンタロー。、大原櫻子、浦川翔平（THE RAMPAGE）、河合郁人の4人が出場する。カラオケは機械を用いて採点し、ダンスはKENZO（DA PUMP）とコレオグラファーのRuuが審査。果たして対決の行方は。\n【画像】社交ダンス世界選手権に臨んだキンタロー。\nプールの高さ5メートルの飛び込み台からぶら下がった状態でどれだけ耐えられるのかを競う「崖っぷち耐久ダービー」には、ビックスモールン・チロが出場。相方のゴンとグリも応援に駆けつける。サッカーの試合結果を予想して高額当選を狙う「スポーツくじ高額当選ダービー」には、じゅんいちダビッドソン、カカロニすがやが参加。アンタ柴田は収録を終えて「非常に楽しかったです。競技内容も面白くて（笑）。超人も観てほしいんですけど、我々の賭け方から性格みたいなところが結構知れるので、そういうところも観ていただければ楽しいかなと思います。ぜひ、皆さんもご家庭でチャレンジしていただきたいです」とコメントした。\n\n■ 土曜☆ブレイク「異なるジャンルのトップが対決！THE超人ダービー」\nTBS 2024年9月14日（土）16:30～17:30\n＜出演者＞\nスタジオゲスト：アンタッチャブル柴田 / 神田愛花 / K、FUMA（&TEAM） / 岡田紗佳\n進行：日比麻音子（TBSアナウンサー）\nVTRゲスト\n「ダンスカラオケダービー」：浦川翔平（THE RAMPAGE） / 大原櫻子 / 河合郁人 / キンタロー。 / KENZO（DA PUMP） / Ruu\n「崖っぷち耐久ダービー」：大田理裟 / 川口朋広 / 漆原裕治 /ビックスモールン / 陽藍\n「スポーツくじ高額当選ダービー」：大久保嘉人 / じゅんいちダビッドソン / カカロニすがや,['https://newsatcl-pctr.c.yimg.jp/t/amd-img/20240912-00000096-natalieo-000-1-view.jpg?pri=l&w=640&h=360&exp=10800'],"['https://news.yahoo.co.jp/articles/de69869ab58ff5e01c665679bc1cc3572feb1f53/images/000', 'https://natalie.mu/owarai/gallery/news/255295/806127?ref=ynews&place=inline']"
マユリカ、春とヒコーキが初「AUN」コンビ大喜利本戦出場8組発表（お笑いナタリー）,https://news.yahoo.co.jp/articles/11fcfbd53b423f2a026757712746f7a19b49d615,https://newsatcl-pctr.c.yimg.jp/t/amd-img/20240912-00000095-natalieo-000-1-view.jpg?exp=10800,2024-09-12T18:00:09+09:00,2024-09-12T18:00:09+09:00,お笑いナタリー,natalieo,お笑いナタリー,890,\n「AUN～コンビ大喜利王決定戦～」第1弾出演者\n10月26日（土）に東京・一ツ橋ホールで開催される「第8回AUN～コンビ大喜利王決定戦～」本戦出場者第1弾が発表された。初挑戦となるマユリカ、春とヒコーキのほか、Yes!アキト＆サツマカワRPG、こんにちパンクール、ママタルト、ケビンス、オダウエダ、ヨネダ2000という経験者たちが名を連ねた。\n【ポスト】「第8回AUN」本戦出場者 判じ絵（他3件）\n「AUN～コンビ大喜利王決定戦～」は、1人では回答できない大喜利にコンビで挑み、「日本イチ大喜利が強いコンビ」の称号を争う大会。2020年12月から7回、ライブとして開催され、テレビ朝日の地上波番組としても放送されている。\n\n今大会は事前予選が2回にわたって実施され、まずは予選第1回で十九人が本戦一番乗りを決めている。9月20日（金）に実施される予選第2回には今井らいぱち＆kento fukaya、ガクヅケ、カラタチ、さすらいラビー、シンクロニシティ、ド桜、フランツ、街裏ぴんく＆ルシファー吉岡が出場予定。これを勝ち上がったもう1組が本戦に参加できる。\n\n本戦は過去最大規模となる16組によるトーナメント戦。残りの出場者は後日発表される。\n\n■ 第8回AUN～コンビ大喜利王決定戦～\n□ AUN～新呼吸～（予選）第2弾\n日時：2024年9月20日（金）18:30開演予定\n会場：東京・角筈区民センター\n＜出演者＞\n今井らいぱち＆kento fukaya / ガクヅケ / カラタチ / さすらいラビー / シンクロニシティ / ド桜 / フランツ / 街裏ぴんく＆ルシファー吉岡\n\n□ AUN～コンビ大喜利王決定戦～（本戦）\n日時：2024年10月26日（土）15:00開演予定\n会場：東京・一ツ橋ホール\n＜出演者＞\nMC：バイク川崎バイク / 奥森皐月\n出場者：Yes!アキト＆サツマカワRPG / オダウエダ / ケビンス / こんにちパンクール / 十九人 / 春とヒコーキ / ママタルト / マユリカ / ヨネダ2000,['https://newsatcl-pctr.c.yimg.jp/t/amd-img/20240912-00000095-natalieo-000-1-view.jpg?pri=l&w=452&h=640&exp=10800'],"['https://news.yahoo.co.jp/articles/11fcfbd53b423f2a026757712746f7a19b49d615/images/000', 'https://natalie.mu/owarai/gallery/news/590589/media/110615?ref=ynews&place=inline']"
手書き風イラスト「Sketch Yoshimoto」シリーズに豆皿とマグカップが新登場（お笑いナタリー）,https://news.yahoo.co.jp/articles/21984383b3bce20972f1c183b43f74dffaff96fa,https://newsatcl-pctr.c.yimg.jp/t/amd-img/20240912-00000127-natalieo-000-1-view.jpg?exp=10800,2024-09-12T19:15:08+09:00,2024-09-12T19:15:08+09:00,お笑いナタリー,natalieo,お笑いナタリー,496,\n「Sketch Yoshimoto」シリーズに新登場する豆皿とマグカップ。\n手描き風のタッチでよしもと芸人をイラスト化したグッズ「Sketch Yoshimoto」シリーズに豆皿とマグカップが新登場。9月14日（土）より、よしもとエンタメショップなんば店、よしもとエンタメショップ大阪国際空港店、よしもとエンタメショップ新宿店、大宮ラクーンよしもと劇場売店にて販売開始される。\n【画像】「ふんわり やさしい いらすと しりーず『Sketch Yoshimoto』」第1弾グッズ一覧。\n今年5月に誕生し、巾着ポーチや缶バッジ、クッションキーホルダーなどを取り揃えている同シリーズ。今回販売される豆皿とマグカップには、シソンヌ、チョコレートプラネット、マヂカルラブリー、見取り図、ヨネダ2000の5組が起用された。\n\n豆皿は直径9.5cm。アクセサリートレイやカトラリーレストとしても使えそうだ。マグカップの容量は210ml。どちらもパステル調の色味で、食卓に華やかな彩りを添える。\n\n9月19日（木）10時からFANY Mall よしもとエンタメショップWEBでも販売される。,['https://newsatcl-pctr.c.yimg.jp/t/amd-img/20240912-00000127-natalieo-000-1-view.jpg?pri=l&w=640&h=451&exp=10800'],"['https://news.yahoo.co.jp/articles/21984383b3bce20972f1c183b43f74dffaff96fa/images/000', 'https://natalie.mu/owarai/gallery/news/572034/2309602?ref=ynews&place=inline']"
街裏ぴんく、元相方のYoung Yujiroと味園ユニバースで共演（お笑いナタリー）,https://news.yahoo.co.jp/articles/7e40b4cd2367941842fe4f3db36dc87eba152e8d,https://newsatcl-pctr.c.yimg.jp/t/amd-img/20240912-00000108-natalieo-000-1-view.jpg?exp=10800,2024-09-12T18:15:09+09:00,2024-09-12T18:15:09+09:00,お笑いナタリー,natalieo,お笑いナタリー,431,\n「味園 LAST WALTZ」ビジュアル\n11月1日（金）に大阪・味園ユニバースで開催されるイベント「味園 LAST WALTZ」に街裏ぴんくが出演する。\n\nこれは“特別な言葉を操る奇才たち”をジャンル不問で招くイベント。街裏ぴんくのほか、ラッパーのJin DoggとYoung Yujiro、バンド・トリプルファイヤーが参加する。\n\n若手時代に味園ビルの2階にあるライブシアターで芸を磨いていた街裏ぴんく。彼とYoung Yujiroはかつて漫才コンビ・裏ブラウンを組んでいた間柄だ。2人の共演を会場で見届けてみては。\n\n■ 味園 LAST WALTZ\n日時：2024年11月1日（金）18:00開場 19:00開演\n会場：大阪・味園ユニバース\n料金：前売5000円（別途ドリンク代）\nチケット：イープラスで先着先行販売中。\n＜出演者＞\nJin Dogg / Young Yujiro / トリプルファイヤー / 街裏ぴんく ほか,['https://newsatcl-pctr.c.yimg.jp/t/amd-img/20240912-00000108-natalieo-000-1-view.jpg?pri=l&w=640&h=640&exp=10800'],['https://news.yahoo.co.jp/articles/7e40b4cd2367941842fe4f3db36dc87eba152e8d/images/000']
マヂラブ野田がゲスト「脱力タイムズ」お笑い賞レースについて分析（お笑いナタリー）,https://news.yahoo.co.jp/articles/3b868d8e1ed59652600f2c42de57c07fd0a3782a,https://newsatcl-pctr.c.yimg.jp/t/amd-img/20240912-00000084-natalieo-000-1-view.jpg?exp=10800,2024-09-12T16:25:14+09:00,2024-09-12T16:25:14+09:00,お笑いナタリー,natalieo,お笑いナタリー,501,\n「全力！脱力タイムズ」にゲスト出演するマヂカルラブリー・野田クリスタル。(c)フジテレビ\n明日9月13日（金）の「全力！脱力タイムズ」（フジテレビ系）にマヂカルラブリー・野田クリスタルと松坂桃李がゲスト出演する。今年も「M-1グランプリ」や「キングオブコント」など、さまざまなお笑い賞レースが開催中。そこで今回は、なぜここまでお笑い賞レースが国民的なイベントになったのかを分析していくことに。\n【画像】マヂカルラブリー・野田クリスタル\nスタジオでは、20代、30代の世代別に聞いたお笑い賞レースの魅力が紹介される。またお笑い賞レースで優勝を狙う若手芸人にも取材が実施されるのだが……。「M-1」「R-1」優勝などお笑い賞レースで結果を残してきた野田が放つ“衝撃発言”とは。\n\n■ 全力！脱力タイムズ\nフジテレビ系 2024年9月13日（金）23:00～23:40\n＜出演者＞\nMC：アリタ哲平（くりぃむしちゅー有田）\n全力解説員：岸博幸 / 吉川美代子 / 五箇公一\nゲスト：松坂桃李 / マヂカルラブリー・野田クリスタル ほか\nキャスター：杉原千尋（フジテレビアナウンサー）,['https://newsatcl-pctr.c.yimg.jp/t/amd-img/20240912-00000084-natalieo-000-1-view.jpg?pri=l&w=640&h=424&exp=10800'],"['https://news.yahoo.co.jp/articles/3b868d8e1ed59652600f2c42de57c07fd0a3782a/images/000', 'https://natalie.mu/owarai/gallery/news/590686/2409673?ref=ynews&place=inline']"
パンサー向井、「アド街ック天国」井の頭公園編に出演（お笑いナタリー）,https://news.yahoo.co.jp/articles/0556c44fbdc71920fe35516af5ed34f1d49df8c3,https://newsatcl-pctr.c.yimg.jp/t/amd-img/20240912-00000093-natalieo-000-1-view.jpg?exp=10800,2024-09-12T17:28:08+09:00,2024-09-12T17:28:08+09:00,お笑いナタリー,natalieo,お笑いナタリー,353,\n「出没！アド街ック天国」に登場する井の頭恩賜公園。(c)テレビ東京\nパンサー向井が9月14日（土）放送の「出没！アド街ック天国」（テレビ東京系）にゲスト出演する。\n【画像】朝から行列ができる、塩パン＆カレーパンが名物の店などが紹介される。(c)テレビ東京（他2件）\n今回の「アド街」は井の頭公園エリアに出没。地元民だけが知るグルメや専門店、エンタメスポットなどが紹介される。向井はかつて吉祥寺に住んでおり、思い出話にも期待できそうだ。\n\n■ 出没！アド街ック天国\nテレビ東京系 2024年9月14日（土）21:00～21:54\n＜出演者＞\n司会：井ノ原快彦 / 中原みなみ（テレビ東京アナウンサー）\nレギュラー：峰竜太 / 薬丸裕英 / 山田五郎\nゲスト：狩野舞子 / パンサー向井,['https://newsatcl-pctr.c.yimg.jp/t/amd-img/20240912-00000093-natalieo-000-1-view.jpg?pri=l&w=640&h=360&exp=10800'],"['https://news.yahoo.co.jp/articles/0556c44fbdc71920fe35516af5ed34f1d49df8c3/images/000', 'https://natalie.mu/owarai/gallery/news/590704/2409748?ref=ynews&place=inline']"
