headline,mainEntityOfPage,image,datePublished,dateModified,author,media_en,media_jp,str_count,body,images,external_links
【京都に新市長】激戦から一夜　財政立て直しや人口減少など課題は山積み（テレビ大阪ニュース）,https://news.yahoo.co.jp/articles/5398d3acd8ad97c78f78583574e46a999371b8f6,https://newsatcl-pctr.c.yimg.jp/t/amd-img/20240205-90004709-tvosaka-000-1-thumb.jpg?exp=10800,2024-02-05T21:48:01+09:00,2024-02-05T21:48:01+09:00,テレビ大阪ニュース,tvosaka,テレビ大阪ニュース,783,\nTVOテレビ大阪\n4日、任期満了に伴う京都市長選挙の投開票が行われました。大接戦を制し、16年ぶりに誕生する京都市の新しい顔とは？\n\n選挙戦から一夜明けた、京都市内。みぞれの降る寒空のもと、街頭に立ったのは京都市長に当選した松井孝治さんです。\n\n【松井さん】\n「市議会・住民代表の方々の意見も聞く、いろんな街作りについて知恵を持っている民間の方々の意見を幅広く聞いて、京都市を前に進めていきたい」\n\n今回の京都市長選挙は、現在4期目で現職の門川大作市長が今期いっぱいでの退任を表明したことを受け、新人5人が立候補して争われました。\n\n元官房副長官で、自民や立憲民主など、与野党4党が相乗り推薦した松井さん。苦しい財政の立て直しや若者や子育て世代が京都市内に流出してしまう問題などに取り組むことを訴え、およそ17万7千票を獲得し激戦を制しました。投票率は41.67％で前回を0.96ポイント上回りました。\n\n【松井さん】\n「この京都の町中の力が、このままだと衰えるのではないか、その対策を訴えてきた。それが財政再建や経済成長、子育てや福祉の増進につながる。それが一定の理解を得た」\n\n5日の御礼立ちを終えたあと、松井さんは京都市役所を訪問。門川市長と面会し、新たな市政での展望を語りました。\n\n【松井さん】\n「経済のパイを大きくしていく。大阪と比較されても経済力・企業の数が圧倒的に違うので京都ももう少し事業所の数や、京都で働く若い人を増やす」\n\n「政策のメニューを、短期・中期・長期、再整備して、初登庁の時には、市の職員が問題に直面してきたプロフェッショナルなので、彼らと膝を突き合わせて話をしたい」\n\n新市長に就任するのは2月25日の予定。財政と人口の問題をどう解決するのか、手腕が注目されます。\nTVOテレビ大阪,[],[]
能登半島地震被災地の方へ　大阪・小学生の思い手紙に託して　（テレビ大阪ニュース）,https://news.yahoo.co.jp/articles/8c1d15c8e5cecf1e29718e5a1ac37ce8455392cf,https://newsatcl-pctr.c.yimg.jp/t/amd-img/20240205-90004713-tvosaka-000-1-thumb.jpg?exp=10800,2024-02-05T21:59:01+09:00,2024-02-05T21:59:01+09:00,テレビ大阪ニュース,tvosaka,テレビ大阪ニュース,539,\nTVOテレビ大阪\n能登半島地震発生から一か月以上が経ち、未だ１万人以上が避難生活を余儀なくされています。そんななか大阪の小学生のとある行動が被災した方々を勇気づけていました。\n5日大阪市内の小学校で行われたのは大阪府警による特別授業です。\nこの特別授業のきっかけを作ったのが、実はこちらの女の子。磯路小学校の小学6年生です。\n\n地震が発生してまもなく、テレビで避難所の様子を見て、被災者の方たちに向けて手紙を書きました。励ましの言葉などを便箋２枚いっぱいにつづったのです。\n\nこの手紙を先月、消防士である父親が石川県輪島市に派遣される際に託され…。被災地の避難所へと届けられ、お返しに「感謝の思い」を伝えてほしいとの声が上がり、\n今回の特別授業に至りました。\n\n大阪府警担当者\n「心をこめて書いてくれたおかげで、向こうの人も本当に喜んでくれていました。ありがとう」\n\n【生徒】\n「自分がいい暮らしをしているのがつらかった。本当に悲しい思いをしているから悲しいを吹き飛ばす思いの内容を書きました。元気を本当に与えられたのでうれしかったです」\n\n今後、父親と石川県に行って、炊き出しなどの支援活動にも参加したいということです。\nTVOテレビ大阪,[],[]
ミナミ・道頓堀川に遺体　頭や首に傷　死後数日以上か（テレビ大阪ニュース）,https://news.yahoo.co.jp/articles/adc9bafcae538aba059778c0948f40846e845ea8,https://newsatcl-pctr.c.yimg.jp/t/amd-img/20240205-90004711-tvosaka-000-1-thumb.jpg?exp=10800,2024-02-05T21:36:01+09:00,2024-02-05T21:36:01+09:00,テレビ大阪ニュース,tvosaka,テレビ大阪ニュース,444,\nTVOテレビ大阪\n4日午後、大阪ミナミの道頓堀川で男性の遺体が見つかり、警察が死因や事件性の有無について捜査しています。\n【記者】\n「4日昼過ぎこちらの道頓堀川で男性が浮いているのが見つかりました。男性は亡くなっており、頭や首に傷があったということです」\n\n「いつも通っている道なので怖いですね…」\n\n4日午後０時半ごろ、大阪市西区の道頓堀川で、遊覧船の船長から「川に人が浮いている」と警察に通報がありました。見つかった男性は20代から40代くらいとみられ、現場で死亡が確認されました。警察によりますと男性は灰色のフード付きパーカーや黒色のズボンなどを身に着けていて、パーカーの肩の部分が20センチ程度破れていました。また男性の頭や首のあたりには、強い力で圧迫されたような傷があり、少なくとも、死後数日が経過しているとみられるということです。\n\n警察は男性が、遊覧船のスクリューに巻き込まれた可能性も視野に、事件と事故の両面で捜査を続けています。\nTVOテレビ大阪,[],[]
ベトナム国籍の男1000万円以上搾取か「ｄ払い」4日間で990回架空請求　（テレビ大阪ニュース）,https://news.yahoo.co.jp/articles/3db1a7532b78f75c9f29fd30c044a0ee6e719879,https://newsatcl-pctr.c.yimg.jp/t/amd-img/20240205-90004712-tvosaka-000-1-view.jpg?exp=10800,2024-02-05T21:47:01+09:00,2024-02-05T21:47:01+09:00,テレビ大阪ニュース,tvosaka,テレビ大阪ニュース,313,\nテレビ大阪\n他人名義の電子マネーを使って金をだまし取ったとしてベトナム国籍の男が逮捕されました。電子計算機使用詐欺などの疑いで逮捕されたのはベトナム国籍のレ・ドゥック・ロン容疑者です。ロン容疑者は去年自身が実質経営する生野区のベトナム食品店で電子決済サービス「ｄ払い」を使って虚偽の決済を繰り返し、カード会社か1000万円以上をだまし取った疑いがもたれています。警察によりますとロン容疑者は不正に入手した他人名義のｄ払いを使い4日間で990回分合計1012万円の虚偽の売上をつくったということです。同様の事案で別のベトナム国籍の男ら4人がすでに逮捕されていて警察は組織的な犯行とみて、捜査しています。\nTVOテレビ大阪,['https://newsatcl-pctr.c.yimg.jp/t/amd-img/20240205-90004712-tvosaka-000-1-view.jpg?exp=10800'],['https://news.yahoo.co.jp/articles/3db1a7532b78f75c9f29fd30c044a0ee6e719879/images/000']
ダイハツ2車種で出荷再開　15車種生産再開は顧客の理解を得られるのか慎重に検討していきたい（テレビ大阪ニュース）,https://news.yahoo.co.jp/articles/c615f3132321ef79ad4a2aa7387a061379149adb,https://newsatcl-pctr.c.yimg.jp/t/amd-img/20240205-90004710-tvosaka-000-1-thumb.jpg?exp=10800,2024-02-05T22:05:02+09:00,2024-02-05T22:05:02+09:00,テレビ大阪ニュース,tvosaka,テレビ大阪ニュース,479,\nTVOテレビ大阪\n認証試験の不正により、生産を停止しているダイハツ工業ですが、京都の工場で動きがありました。\n【記者】\n「ダイハツ大山崎工場で一部の車種で出荷が再開されるということです」\n\n不正に国の認証を取得していたことを受けて去年12月、国内のすべての工場で生産を停止したダイハツ工業。基準の適合が確認されたとして、トヨタ・プロボックスと\nマツダ・ファミリアバンについては、未出荷だった車両の出荷を5日再開しました。\n来週月曜日にはこの2つの車種の生産も再開します。\n\n今回の問題では実に64車種に不正がありましたが、国土交通省はことし1月、15車種において基準の適合が確認されたとして出荷停止を解除しました。\n\nこうした中、15車種すべての生産がいまだ再開されないことについて、ダイハツはテレビ大阪の取材に対し、部品メーカーから仕入れが可能かどうか調整中であること、再発防止策がまだできていない状況だとしたうえで、「顧客の理解を得られるのか、また社会的に許されるのか、慎重に検討していきたい」としています。\nTVOテレビ大阪,[],[]
