headline,mainEntityOfPage,image,datePublished,dateModified,author,media_en,media_jp,str_count,body,images,external_links
ドローンとトラクターが連携した超ハイテク農業の時代到来！　農家の後継者不足もこれなら解決（WEB CARTOP）,https://news.yahoo.co.jp/articles/2521a456ccb18a37db84553416cf640947a81cbb,https://newsatcl-pctr.c.yimg.jp/t/amd-img/20260622-00010004-wcartop-000-1-view.jpg?exp=10800,2026-06-22T20:10:24+09:00,2026-06-22T20:10:24+09:00,WEB CARTOP,wcartop,WEB CARTOP,928,自動化が人手不足の農業を救う 農業の現場では最新技術が多く投入されており、農薬散布ドローンや自動運転のトラクターが導入されている。 クルマの世界では自動運転やコネクテッド技術の進化が目覚ましいが、それらを遥かに凌ぐ勢いでハイテク化が進んでいるのが「農業」の現場だ。なかでも、空を飛ぶ「ドローン」と陸を駆ける「トラクター（農業機械）」を通信で連携させ、効率的な農作業を実現するシステムが大きな注目を集めている。 【画像ギャラリー】ドローンと連携したトラクターによる農業の画像を見る（6枚） このシステムの基本は、ドローンが「目（センサー）」、トラクターが「手足（インストルメント）」として機能する緻密な役割分担にある。まず、ドローンが上空から田畑を自動飛行して搭載されたカメラで撮影を行う。これをもとに、作物の生育状況・病害虫の発生場所・雑草の分布といった、目視では不可能なレベルのデータを数分でスキャンするのだ。 得られたデータはクラウド上で瞬時に解析され、肥料や農薬の散布が必要なエリアを特定した「処方箋マップ」が作成される。このマップが通信を経由して、ダイレクトにGNSS（衛星測位システム）と自動操舵機能を備えたハイテクトラクターに転送されるのである。 これを導入するメリットは、省力化に加えて資材の大幅なコスト削減と環境負荷の低減にある。全面に一様な量の農薬や肥料を撒く従来の方法とは異なり、トラクターはマップに従って「必要な場所に、必要な量だけ」をピンポイントで投入することができる。これにより、肥料や農薬の消費量を3〜5割近く削減することが可能になるのだ。 また、基本的にドローンが「目」の役割をするので、広大な土地を人が見まわる必要がなくなる。トラクターの自動運転と組み合わせれば、夜間の作業や熟練者でなくても精密な農作業を行うことが可能になる。わが国の農業は、小規模で非効率な上に深刻な労働力不足に陥っているから、その解決策の一助として期待できる。さらに、収穫量と品質の均一化が図れることも大きい。生育が遅れている場所だけにピンポイントで追肥を行なえるため、畑全体の作物の育ちが揃う。これは出荷時の規格統一や、収穫効率の向上に直結するのだ。,[],[]
チューニングでお馴染みのHKSが「人テク」で見せたものとは……　「内燃機関をあきらめる必要ナシ」と勇気をもらえる展示にクルマ好き歓喜!!（WEB CARTOP）,https://news.yahoo.co.jp/articles/6453f85bccecd732506602a4fd3dd59a645d2c30,https://newsatcl-pctr.c.yimg.jp/t/amd-img/20260622-00010003-wcartop-000-1-view.jpg?exp=10800,2026-06-22T17:40:09+09:00,2026-06-22T17:40:09+09:00,WEB CARTOP,wcartop,WEB CARTOP,1628,日本のチューニング業界を牽引するメーカーが出展する背景とは 「人とくるまのテクノロジー展」が神奈川県と愛知県で開催された。ここに、チューニングパーツメーカーの「HKS」が出展していた。 神奈川県横浜市で5月27〜29日、愛知県名古屋市で6月17〜19日に開催された「人とくるまのテクノロジー展」、通称人テクは、1992年に初開催された、その名のとおりクルマ関連の先進技術が展示されている技術系の展示会だ。会場内には誰もが知るような業界を牽引する一大企業による最新技術の展示や、海外企業の製品、いまや自動運転やADAS技術に欠かせないIT関連の企業などなど、クルマに関係するさまざまな企業が集結している。 【画像ギャラリー】「人とくるまのテクノロジー展」にHKSが展示していたアイテムの画像を見る（22枚） また、この展示会には、メーカー同士の橋渡し的な側面もあり、「詳しい話が聞きたい」、「この技術を導入したい」、「予算はどのくらいか？」などなど、BtoBの商談も積極的に行われている。ちなみに筆者は超文系の人間なので、会場には凄く先進的な展示が多数あったものの、数字などを見ても何が何だかわからなかった。ただ、ギガキャストで作られたフレームや、最新のブレーキシステム、モーターなどは、この業界に身を置いて何年も経つので、感覚的には何を展示しているのかは理解できた。こうして筆者のような知ったかぶりは生まれるのである……。 しかし、そんな人テクの会場で「お！」と、こんな筆者の目を惹く企業が目の前に現れた。そう。HKSである。HKSについてはもうこのWEBメディアを見ている人には説明不要だと思うが、軽く触れておくと、1973年にレース用エンジンやパーツの開発を主とした会社として創立された。 その後は日本初となる市販のターボチャージャーキットの開発や、最高速の聖地でいまはなき谷田部での300km/hトライアル、ワークスの力を借りずに独自チームでのグループAなどのレースへの参戦などなど、その歴史を語り始めたら本1冊が余裕でできてしまうほど、日本、いや世界のチューニングシーンには欠かせない一大ブランドだ。なお、日本の独立系チューニングパーツメーカーとしては唯一、東証のスタンダード市場に上場している企業でもある。 そんなチューニング命！ みたいな企業のHKSが、なぜこんな技術系イベントに出展しているのか。関係者に聞いてみた。 「まず我々はチューニングメーカーのように思われがちですが、じつはそれ以外の領域も得意なんです。むしろチューニング以外の領域のほうが、会社全体の割合としては多いかもしれません。なんなら、この人テクには10年以上出てますので……」 HKSと聞けば、前述のようにチューニングやレースのイメージが強い。しかし実際は、環境問題などにも積極的に取り組んでおり、2008年にはエンジンの燃料をガソリンと圧縮天然ガス（CNG）とで切り替えて走ることができるバイフューエルコンバージョンキットなどを発表し、環境対策とチューニングを両立する考えもいち早く考案、実用化していた。 最近では、配送業（トラック業界）における電動化を見据えて、誰もが夢見るバッテリー交換式のトラックの実証実験なども行っていた。そのほかにも、独自開発のカーボンニュートラル燃料や、さまざまな燃料を使用できるというハイブリッドカー「e-HIACE」の開発や、毎年問題になっている幼稚園バスの車内に園児を置き去りにしてしまうのを防ぐための車内監視カメラの開発、CAN通信を利用したさまざまな装置の開発、教習車やタクシー向けの装備やソフトウェアの開発も行っており、じつはHKSの守備範囲は非常に広い。 このように、ガソリンをじゃんじゃん燃やすチューニング業界をリードする一方で、環境対策やクルマにかかわる安全対策も忘れない、チューニングメーカーだからこその考えには脱帽ものだ。,[],[]
これはポルシェのようでポルシェじゃない！　じつはチューニング屋じゃなく自動車メーカーな「RUF」が作った「CTR3」の衝撃的パフォーマンス（WEB CARTOP）,https://news.yahoo.co.jp/articles/f2db2b15374669e9e50942a6f4eb375bc0d4fc1d,https://newsatcl-pctr.c.yimg.jp/t/amd-img/20260622-00010002-wcartop-000-1-view.jpg?exp=10800,2026-06-22T17:30:24+09:00,2026-06-22T17:30:24+09:00,WEB CARTOP,wcartop,WEB CARTOP,1112,RUFを語る上で欠かせない「CTRシリーズ」 RUFは一見ポルシェチューナーのような立ち位置に見えるかもしれないが、実際は歴とした自動車メーカーである。 ドイツのRUF AUTOMOBILE（ルーフ・オートモービル・以下：ルーフ）を、ポルシェのチューナーだと考えている人がいるのならば、それは大きな間違いだ。ルーフは1982年に自動車製造者としての正式な認可を受けた正真正銘の自動車メーカーだからだ。ルーフとポルシェとの関係は、2025年末で残念ながら自社ブランド車の開発や生産を中止した、アルピナとBMWのそれにも等しい。 【画像】MR化された怪作 CTR3のディテールを写真で見る チューナーに間違われるほど小さい、この世界最小規模ともいえる自動車メーカーであるルーフの名が、スーパースポーツのファンに一気に轟いたのは1987年のことだった。ルーフはこの年、ポルシェから当時の930型911のホワイトボディーの供給を受け、ここから独自のエンジニアリングでさらに高性能な、いや究極的な運動性能を誇るルーフ車を製作するプロジェクトを立ち上げる。 のちに「CTR」とネーミングされるモデルがそれで、そのプロトタイプとして製作された鮮やかなイエローのボディーカラーをもつ、通称「イエローバード」は、南イタリアのナルドにあるテストコースで、当時の世界最高速記録となる342km/hを達成。それはポルシェ・959やフェラーリ・288GTOなどのライバルを前にしての衝撃的な数字だった。 そしてこのイエローバードをベースにさらに改良が加えられた量産型のCTRは30台が限定生産された。ちなみにCTRのリヤには469馬力の最高出力を発揮する3367ccの水平対向6気筒ツインターボエンジンが搭載され、ミッションは当初は5速MTだったが、生産途中で6速MTへと変更されている。 CTRの名は、それからしばらく封印されることになるが、1995年になるとルーフは993型911ターボをベースとした「CTR2」を発表する。1995年から1997年にかけてやはり30台が限定生産されたそれには、520馬力を誇る3600ccの水平対向6気筒ツインターボエンジンが6速MTとともに組み合わされ（生産最終年となった1997年には最高出力は580馬力に高められている）、駆動方式はRWDのほかにオプションで4WDの選択が可能だった。 ボディーは軽量なケブラーで成型されており、その結果車重をわずか1358kgに抑えることに成功。0→96km/h加速で3.6秒、最高速では350km/hというのがルーフから発表されたCTR2のパフォーマンス・データだった。,[],[]
コストのハードルを下げてもっと多くの自動車メーカーに参加してほしい！　WRCがまたもマシン規定を変更する狙い（WEB CARTOP）,https://news.yahoo.co.jp/articles/ffa74d8e5809a5835e9275c98d2efc7441061846,https://newsatcl-pctr.c.yimg.jp/t/amd-img/20260622-00010001-wcartop-000-1-view.jpg?exp=10800,2026-06-22T11:52:38+09:00,2026-06-22T11:52:38+09:00,WEB CARTOP,wcartop,WEB CARTOP,1177,競技環境や社会情勢の変化に応じて変わりつづけてきた 規定変更を重ねながら発展してきたWRCは、2027年に規定を改定する。 歴史的に見ると、近代モータースポーツは3つの世界選手権を頂点に展開してきたことがわかる。3つの世界選手権とは、F1による世界選手権、スポーツカーによる世界耐久選手権（WEC）、そしてラリーカーによる世界ラリー選手権（WRC）だ。 【画像ギャラリー】WRC27ラリー1規定のコンセプト車両の画像を見る（12枚） どのカテゴリーも、競技運営が行き詰まりを見せた段階で、あるいは自動車を取り巻く社会環境に変化が生じたタイミングで、競技規則（車両も含めたレギュレーション）の変更が行われてきた経緯がある。 こうした意味を踏まえた上で、来年規定が変更されるWRCを見てみるとおもしろいかもしれない。ちなみにWRCは、F1が1950年、スポーツカーが1953年に世界選手権シリーズとして発足していることに対し、1973年の発足ともっとも歴史の短いカテゴリーである。 また、F1、スポーツカーが、レースのために企画・製造された専用車両で戦われる競技であることに対し、WRCは量産車をベースにした改良、改造で戦われてきたことに特徴があった。 実際、WRCは発足当初から量産車ベースのグループ2／4規定で運営されてきたが、歴史を重ねるうちにグループ4規定車両の改造競争が激化。この動きに追従できなくなったメーカーが増えたため、特殊技術の投入を認めながら生産台数の枠組みを緩くする（少量生産可）新たな枠組みに変更を受けてきた。 これが1983年から全面施行となったグループB規定によるWRCだったが（グループA規定も並行して設定）、あまりに高性能、高速化したことで重大アクシデントが多発。この事態を重く見たFISA（国際自動車スポーツ連盟）はグループB規定を撤廃。 1987年からグループA規定に移行し、この規定で10年ほど続けられたが、勝てる条件が量産車で4WDターボ（グループA車両）をもつメーカーに限定され、結果としてこの条件を備えたランチア（デルタインテグラーレ）、トヨタ（セリカGT-FOUR）、スバル（インプレッサWRX）、三菱（ランサーエボリューション）以外に参戦メーカーがなくなり、1997年からF2キットカー＋4WDターボを組み合わせたWRカー規定に切り替えられた。 WRカー規定は2021年まで続けられたが、途中大きな規定変更が2度ほどあり、2022年から「ラリー1」規定が適用され現在に至っている。このラリー1規定は、ハイブリッドシステムの搭載（2024年いっぱいで廃止）、燃料は生産過程で二酸化炭素を取り込む合成燃料とバイオ燃料による非化石燃料によるサステナブル燃料の使用が規定されたあたりに、時代的な特徴を見ることができた。,[],[]
トヨタだけ納期が遅くても売れるのはトヨタ車！　新車販売台数ランキングTOP10のうち9台がトヨタという現状!!（WEB CARTOP）,https://news.yahoo.co.jp/articles/eed06fdf5ff95d2c135d1986ecf9c82850aaaf58,https://newsatcl-pctr.c.yimg.jp/t/amd-img/20260622-00010000-wcartop-000-1-view.jpg?exp=10800,2026-06-22T06:30:29+09:00,2026-06-22T06:30:29+09:00,WEB CARTOP,wcartop,WEB CARTOP,1287,N-BOXが王者の貫禄で首位に返り咲き 4月の新車販売ランキングでは、1位の常連であったホンダのN-BOXが首位から陥落し話題となったが、5月では再び首位に返り咲いた。その直下にいるのが、スズキのスペーシアで、その差はわずか。入れ替わりそのまま……という日もそう遠くないかもしれない。 自販連（日本自動車販売協会連合会）から登録車、全軽自協（全国軽自動車協会連合会）から軽自動車について、2026年5月単月締めでの車名（通称名）別新車販売ランキングが発表となった。 【写真】初代モデルからバカ売れ！ 新車ランキング上位の常連ミニバン「初代アルファード」の衝撃 車名（通称名）別新車販売ランキングでは、ホンダN-BOXが軽自動車のみ、登録車と軽自動車を合算させた総合ランキング（含軽統計）ともに2026年4月単月締めにてN-BOXのトップ陥落がトピックとなったが、2026年5月単月締めでは、N-BOXは軽自動車のみ及び総合ランキングともにトップに返り咲いている。 しかし、軽自動車のみ及び総合ランキングともに2位となっている、スズキ・スペーシアとの差は2261台と。2026年に入ってからの各単月締めでのN-BOXとスペーシアの差を見ていくと、2026年1月が4486台、同年2月が4066台、同年3月が5303台差でN-BOXがトップとなっており、4月は887台差でスペーシアがトップとなっている。1月から3月と比べると、N-BOXが首位を奪還したものの独走状況というわけではなく、後続が以前より見えるなかで必死にトップ維持をはかっているようにも見える。 総合ランキングで登録車トップのヤリス（含むヤリスクロス）が3位に入っているが、トップN-BOXとの差は3400台程度となっているので、新年度に入ってからN-BOXのパワーダウンが目立ってきているようにも見える。これがなんらかの生産調整に入っているのか否かを含めて今後の統計数値の動きに注目していきたいところである。 登録車のみのランキングをみると、上位10車中トヨタ車が9台を占めている。残り1台はホンダ・フリードとなっており、日産車は1台もトップ10に入っていない。登録車のみのランキングをみると、日産ノートが13位、セレナが17位に入っているぐらいで、日本でも売れ筋といえるクロスオーバーSUVとなるエクストレイルは38位と大幅に順位を落としている。3月2514台、4月2021台となっていたリーフは5月が1422台となっており、すでに息切れを見せてきているようにも見える。 日産全体の落ち込みが目立つのは、単に供給体制の問題なのかと調べると、ノートもセレナも工場出荷時期の目処をみると1～2カ月なので需給体制には問題が見られない。やはり日産のネガティブな報道がジャブのように効いているのかもしれない。 2026年5月21日に発売されたホンダ・スーパーワンは1736台を販売して31位に入っている。5月はデビュー月でもあるので大半はディーラー試乗車など社有車となるものの、どこか勢いを感じさせる数字に見えている。,[],[]
