headline,mainEntityOfPage,image,datePublished,dateModified,author,media_en,media_jp,str_count,body,images,external_links
「計り知れない大きな差の勝ち点1」をつかむ劇的同点弾　神戸FW武藤嘉紀が体現した勝利への執念とJ1王者の意地（サッカーキング）,https://news.yahoo.co.jp/articles/1023b18ecf349d54ff1d98a3c297aa77e0c47ed1,https://newsatcl-pctr.c.yimg.jp/t/amd-img/20241201-01960478-soccerk-000-1-view.jpg?exp=10800,2024-12-01T13:49:02+09:00,2024-12-01T13:49:02+09:00,サッカーキング,soccerk,SOCCER KING,2028,柏戦で後半ATに同点弾を決めた武藤 [写真]=柳澤健太 23日の天皇杯決勝でガンバ大阪を1－0で下し、今季最初のタイトルをつかんでから1週間。ヴィッセル神戸はJ1連覇、今季2冠を懸けてアウェーでの柏レイソル戦に挑んだ。 週中の26日にはAFCチャンピオンズリーグエリートのセントラルコースト・マリナーズ戦も消化。大迫勇也、武藤嘉紀ら主力級の大半は欠場し、しっかりとリフレッシュして大一番に挑んだはずだった。が、この日は序盤から柏の迫力に押されてしまう。開始早々の5分に相手左CKから木下康介に打点の高いヘッドで先制点を奪われ、一方的な劣勢に。前半20分過ぎまでシュートを1本も打てないという厳しい内容を強いられた。 「立ち上がりからの失点、かつ球際で勝てない、反応が遅い…。相手は勝てばJ1残留が決まることが分かっていたのに、どこか気の緩みがあった。難しい試合になると分かっていたのに、ああいう入りをしてしまった。試合に入り切れていない選手もいたし、本当に甘さが出たと思います」と武藤はあえて苦言を呈したのだ。 0－1で迎えた後半。吉田孝行監督は佐々木大樹や汰木康也ら持ち駒を次々と投入。強引に流れを変えようと試みたが、どうしても1点が遠い。そのまま試合終了かと思われたタイミングで、武藤と競り合った柏DFジエゴのペナルティエリア内でのファウルがあったとしてVAR、OFRを経てPKの判定。神戸には希望の光が差し込んだが、大迫がまさかの失敗。再び敗色濃厚の危機に追い込まれた。 VAR判定などで13分のアディショナルタイムが与えられたこともあり、そこから王者は凄まじい気迫で攻め続けた。そして試合時間が100分を経過した時、右CKから待望のシーンが訪れる。 扇原貴宏の蹴ったキックを相手がクリアし、酒井高徳が前線の大迫目掛けて浮き球のボールを上げた。次の瞬間、大迫からパスを受けた広瀬陸斗がシュート。GK松本健太が弾き、立田悠悟が大きく蹴り出そうとしたボールが奇しくもマテウス・トゥーレルに当たり、最終的に武藤の前にこぼれた。百戦錬磨の32歳の点取屋は冷静に左足を一閃。勝ち点1につながる大きな一撃をお見舞いしたのだ。 一度はオフサイドと判定され、本人も諦めかけたという。しかし、長いVARチェックの結果、得点と認められ、武藤はユニフォームを脱いでゴール裏へ駆け寄り、歓喜を爆発させた。これほどまでに感情を強く押し出すのは滅多にないこと。それだけこの1点の意味が大きかった。 「町田（ゼルビア）もいますし、（サンフレッチェ）広島もいて、勝ち点0という結果が僕らにとってどれだけ不利になるかは自分も分かっていた。勝ち点1を取ることで自力で優勝を決められる形に持っていける。そういう意味で、この1の大きさは計り知れないものでしたね」と武藤はしみじみとゴールを噛み締めていた。 確かに、ライバルの動向に関係なく、12月8日の最終節、湘南ベルマーレ戦を勝ち切ればいいというのは極めてシンプル。神戸にとっては間違いなくアドバンテージだ。そのうえで連覇を果たせれば、背番号11の柏戦での大仕事がひと際、大きな意味を持つことになる。 “今季MVPの有力候補”という見方も強まっているが、本当にそうなる可能性も少なくない。2021年夏の神戸入り後、つねに重要な役割を果たしながら、大迫、山口蛍、酒井のやや後ろからチームを支える選手というイメージの強かった武藤。その彼が“真のエース”と認められるのは理想的だ。 数字を見ても、今季35試合出場11ゴールの大迫に対し、武藤は36試合出場12ゴールと上回っている。天皇杯決勝の宮代大聖の決勝弾のアシストもそうだが、今の彼が“重要局面でチームを勝たせられる男”になっているのは紛れもない事実。「ダメなものはダメ」と容赦なく苦言を呈することができる強靭なメンタルや飽くなき闘争心を含め、その存在感は頭抜けたものがあるのだ。 武藤が作ったいい流れを持続し、1週間後の湘南との最終決戦で彼自身がゴールを奪って今季2冠を決められれば、まさに最高のシナリオだ。本人もFC東京時代の2014年に挙げたシーズン14得点を超えたいという気持ちも少なからずあるだろう。そのためにはあと3点が必要になる。それは高いハードルに他ならないが、決して不可能とは言い切れない。ここまで来たら、キャリアハイの得点数を貪欲に追い求めるべき。 「勝てば優勝ということでワクワクしていますし、自力でつかみ取りたい。僕自身もこの1シーズンをフルに戦ってきて、最後の目の前でトロフィーを逃すわけにはいかない。どれだけ疲労があっても、どれだけ痛みがあっても、チームの勝利のために全てを捧げたい」と本人も語気を強めた。 1週間後、果たして武藤はどんなラストを迎えるのか…。いずれにしても、彼の持てる全ての力を出し切ってもらいたい。 取材・文＝元川悦子 SOCCER KING,[],[]
J1復帰の横浜FC、四方田修平監督との契約更新を発表「真価が問われるシーズンに」（サッカーキング）,https://news.yahoo.co.jp/articles/da5d474d75f7b3be831eceb0d3b8bf7deebd9a1c,https://newsatcl-pctr.c.yimg.jp/t/amd-img/20241201-01960384-soccerk-000-1-view.jpg?exp=10800,2024-12-01T11:23:01+09:00,2024-12-01T11:23:01+09:00,サッカーキング,soccerk,SOCCER KING,639,契約を更新した四方田修平監督 [写真]=清原茂樹 横浜FCは1日、四方田修平監督と2025シーズンの契約を更新したことを発表した。 現在51歳の四方田監督は1996年に筑波大学蹴球部コーチに就任し、指導者キャリアをスタートさせると、1999年に北海道コンサドーレ札幌のアシスタントコーチに就任後、札幌ではU－18監督やトップチーム監督、ヘッドコーチなどを歴任。そして、2022年から横浜FCの監督を務めている。 就任1年目にJ1昇格に導いたものの、昨季は18位でJ2に降格。それでも、今シーズンは2024明治安田J2リーグを22勝10分け6敗、勝ち点「76」の2位で終え、1年でのJ1復帰を決めている。 来季続投が決定した四方田監督は横浜FCのクラブ公式サイトで以下のようにコメントを発表している。 「今シーズンも多くの皆さまから温かいご支援・ご声援を賜り誠にありがとうございました。悔しいシーズンから始まり良い時もあれば苦しい時期もありましたが、皆さまの応援が力となり無事にJ1に復帰できたことを大変嬉しく思います。ありがたいことに来シーズンも指揮を取らせていただくことになりました。次こそ、横浜FCの真価が問われるシーズンになると思っています。クラブ初のJ1残留を果たすべく、チーム一丸となって戦っていきます。横浜FCに関わる全ての皆様たちと一緒に三ツ沢を盛り上げていきましょう。これからも懸命にプレーする選手たちへの応援をよろしくお願いいたします」 SOCCER KING,[],[]
ランパード初陣、コヴェントリーはドロー「良い部分も悪い部分も…」　坂元達裕はアシスト記録（サッカーキング）,https://news.yahoo.co.jp/articles/e717cdcaa91c59cff972ffb81145c8474879d294,https://newsatcl-pctr.c.yimg.jp/t/amd-img/20241201-01960343-soccerk-000-1-view.jpg?exp=10800,2024-12-01T10:48:43+09:00,2024-12-01T10:48:43+09:00,サッカーキング,soccerk,SOCCER KING,1007,初陣に臨んだランパード監督 [写真]＝Getty Images コヴェントリー（イングランド2部）のフランク・ランパード監督が、初陣を振り返った。11月30日にクラブ公式サイトが伝えた。 【ハイライト】コヴェントリー 2－2 カーディフ・シティ 現役時代にチェルシーやイングランド代表などで活躍したランパード監督は、古巣チェルシーやダービー、エヴァートンなどで指揮官を歴任。11月28日にマーク・ロビンズ前監督の後任として、MF坂元達裕が所属するコヴェントリーの監督に就任した。 就任直後の11月30日にチャンピオンシップ第18節でカーディフ・シティと対戦。コヴェントリーは4分に先制されたものの、7分に坂元の絶妙なアシストからエフロン・メイソン・クラークが試合を振り出しに戻す。後半開始早々の48分にも勝ち越し点を浴びたが、試合終盤の88分にヴィクトル・トルプのPK成功で再び追いつき、コヴェントリーとカーディフは勝ち点「1」ずつを分け合った。 ランパード監督は試合を振り返り、「パフォーマンスには良い部分も悪い部分もあった。セットプレーで失点するまで試合の入り自体はかなり良かったと思う。リアクションも良かった。多くの点で良い発見があったし、いくつか気に入らない点もあった。ハーフタイムにはその修正を試みたが、多くの時間で停滞してしまった」と率直にコメント。それでも、「ただ、就任して中2日で選手たちを批判するためにここにいるわけではないし、（最低限の）結果を得た選手たちの精神性にも喜んでいる。彼らは改善したいという意欲に満ちていることを知っているし、勝ち点1を拾って前進した」と、2度追いついた選手たちに労いの言葉をかけた。 また、指揮官は次のようにも言葉を続け、戦術面、メンタル面で多くの改善の余地があると語った。 「単純な話に聞こえるかもしれないが、このリーグは他のリーグでそうであるように、両エンドとボックス内で何が起こるかが重要だ。自分たちがコントロールできていると感じているのに、カウンターを受けて失点してしまう。それは好ましくない。一歩一歩、謙虚な姿勢で、自分たちの試合の基本を見つめ直し、1週間のトレーニング方法を見直さなければならない」 「シンプルな話だが、結果が伴えば、選手たちにも自信が生まれる。このクラブは数週間、結果を出せていない。だから、努力が必要なんだ」 SOCCER KING,[],[]
負傷交代のケインに注目も…バイエルン指揮官「それほどひどくないと言っていた」（サッカーキング）,https://news.yahoo.co.jp/articles/0efd1a89655f803f7426147ae25111597d875321,https://newsatcl-pctr.c.yimg.jp/t/amd-img/20241201-01960375-soccerk-000-1-view.jpg?exp=10800,2024-12-01T10:20:45+09:00,2024-12-01T10:20:45+09:00,サッカーキング,soccerk,SOCCER KING,553,状態に注目が集まっているケイン [写真]=Getty Images バイエルンを率いるヴァンサン・コンパニ監督が、イングランド代表FWハリー・ケインの状態に言及した。11月30日、イギリスメディア『BBC』が伝えている。 【ハイライト動画】ドルトムントvsバイエルン ブンデスリーガ第12節が11月30日に行われ、バイエルンはドルトムントと対戦。今季初の“デア・クラシカー”は、27分にジェイミー・バイノー・ギテンスに先制点を許したものの、85分にジャマル・ムシアラが同点弾を奪い、1－1のドローに終わった。 開幕からリーグ戦12試合連続で先発出場したケインだったが、この試合では33分に負傷を余儀なくされていたことから、状態には注目が集まっている。 試合後、ケインの様子について聞かれたコンパニ監督は「ハリーはそれほどひどくはないと言っていたけど、検査を受けなければならない」と語りながら、次戦3日に行われるDFBポカール・ラウンド16のレヴァークーゼン戦への出場は難しいことを示唆した。 「火曜日は非常に厳しいだろう。それほど早く回復できる選手は多くないと思うので、見ていくしかない。ハリー・ケインが決めてきたゴールの代役を務めることは不可能だが、チーム全体に信頼を置いている」 SOCCER KING,[],[]
プレミア史上初！　クライファートがPKだけでハットトリック…17年ぶり珍事も（サッカーキング）,https://news.yahoo.co.jp/articles/94da10f202114bc22324f0f41260b36b1cc2f853,https://newsatcl-pctr.c.yimg.jp/t/amd-img/20241201-01960338-soccerk-000-1-view.jpg?exp=10800,2024-12-01T09:29:54+09:00,2024-12-01T09:29:54+09:00,サッカーキング,soccerk,SOCCER KING,515,ハットトリック達成のクライファート [写真]＝Getty Images ボーンマスに所属するオランダ人FWジャスティン・クライファートが、プレミアリーグ史上初の快挙を達成した。 【ハイライト】ウルヴス 2－4 ボーンマス ボーンマスは11月30日のプレミアリーグ第13節でウルヴァーハンプトンと対戦。クライファートはPKだけでハットトリックを達成し、4－2の勝利に貢献した。 データサイト『Opta』によると、1992－93シーズンから始まったプレミアリーグにおいて、PKのみでのハットトリックは史上初の出来事になったようだ。また、PKはいずれもブラジル代表FWエヴァニウソンが獲得しており、1人の選手が1試合で3回PKを得たのもリーグ史上初だという。 なお、同日にはブレントフォードのドイツ代表FWケヴィン・シャーデもレスター戦（4－1）で3ゴールの活躍を披露。プレミアリーグで同じ日に2人以上がハットトリックを達成したのは、2007年12月15日にウィガンが5－3でブラックバーンに勝利した試合でのマーカス・ベント氏（ウィガン）とロケ・サンタ・クルス氏（ブラックバーン）以来、17年ぶりの珍事となった。 SOCCER KING,[],[]
J2降格決定の札幌が声明を発表「今まで以上の大きな力をつけて…」（サッカーキング）,https://news.yahoo.co.jp/articles/0cf8fb84066f0c0e18857eb8ee956ecf1a3b6823,https://newsatcl-pctr.c.yimg.jp/t/amd-img/20241201-01960377-soccerk-000-1-view.jpg?exp=10800,2024-12-01T09:24:28+09:00,2024-12-01T09:24:28+09:00,サッカーキング,soccerk,SOCCER KING,608,北海道コンサドーレ札幌は11月30日、J2リーグへの降格が決定したことを受け、声明を発表した。 札幌は12月1日にアウェイで2024明治安田J1リーグ第37節のサンフレッチェ広島戦を控えているが、11月30日に行われた17位柏レイソルと首位ヴィッセル神戸の一戦が1－1のドローに終わったことで、19位の札幌は広島戦を戦わずして、J2への自動降格が決まった。 これを受け、札幌はクラブ公式サイトで代表取締役GMを務める三上大勝氏の声明を以下のように発表した。 「いつも北海道コンサドーレ札幌へのご支援・ご声援をいただき誠にありがとうございます。本日の試合結果を以て、来季はJ2リーグでの戦いとなることが決定いたしました」 「日頃よりクラブを支えてくださるファン・サポーターの皆さま、パートナー企業の皆さま、道内各自治体や協力企業の皆さま、北海道コンサドーレ札幌にかかわる全ての皆さまのご期待に応えられなかったことを深くお詫び申し上げます」 「今年味わった悔しさを糧に、これからの険しい道のりの中で、今まで以上の大きな力をつけて国内最高峰リーグに戻って来ます。明日の広島戦、そして今季最終戦の柏戦も含めて、ここから再びクラブ一丸となって戦います。常にクラブの今と未来を考え、一体感を持って進んでいきたいと思います。引き続き、皆様からのご支援・ご声援をいただけますよう、よろしくお願い申し上げます」 SOCCER KING,[],[]
ミランが3発快勝！　指揮官は賛辞「攻守に美しいプレー。6～7点入ってもおかしくなかった」（サッカーキング）,https://news.yahoo.co.jp/articles/f869d704a305d6b6b69dc1f5c8645d10f1b2c19d,https://newsatcl-pctr.c.yimg.jp/t/amd-img/20241201-01960340-soccerk-000-1-view.jpg?exp=10800,2024-12-01T08:33:48+09:00,2024-12-01T08:33:48+09:00,サッカーキング,soccerk,SOCCER KING,893,エンポリを下したミラン [写真]＝Getty Images セリエA第14節が11月30日に行われ、ミランがエンポリを3－0で下した。パウロ・フォンセカ監督の試合後コメントを同日にイタリアメディア『スカイスポーツ』が伝えた。 【ハイライト】ミラン 3－0 エンポリ ミランは19分にアルバロ・モラタがゴール前のこぼれ球を押し込み先制に成功。44分にタイアニ・ラインデルスがハーフボレーを突き刺して2点リードで折り返すと、69分にはラインデルスが“ドッピエッタ”（1試合2得点）を達成。リーグ戦3試合ぶりの白星を掴み、首位ナポリと勝ち点差「7」の暫定7位に位置している。 フォンセカ監督はエンポリ戦後、「これが私たちの最も完璧なパフォーマンスかどうかはわからない。美しい試合をしたし、常にバランスが取れていて、攻撃も良かった」と選手たちのパフォーマンスを称賛した。 「（前節）ユーヴェ戦でも、守備がしっかりしていると感じたし、危険を感じたことはなかった。今日は守備でも攻撃でも美しいプレーができた。ゴールは3つだったが、6～7点入ってもおかしくなかった。しかし、チームにはとても満足している。多くのものを作り出したし、全員がよく動いていた」 コッパ・イタリアのサッスオーロ戦を挟んで、次節は2位アタランタと激突する“ロッソネリ”。「似た性質のチーム」であるエンポリを下したフォンセカ監督は「アタランタをすでに研究している」と自信を示す。「マンツーマンでマークしてくるチームに対して、（GKマイク・）メニャンは攻撃の起点となる決定的な選手なんだ」と、守護神が攻守においてキーマンとなっていることを明かした。 公式戦では3週間ぶり、リーグ戦では2カ月ぶりに得点を記録したモラタについては、「心配したことは一度もない。チームの模範となる選手だ」と信頼を強調したフォンセカ監督。指揮官はユヌス・ムサやユスフ・フォファナのパフォーマンスにも高評価を与え、マッテオ・ガッビアに対しては「重要なリーダーシップを発揮する素晴らしいプロフェッショナル」と惜しみない賛辞を送っている。 SOCCER KING,[],[]
スポルティングが公式戦連敗、リーグ開幕連勝「11」でストップ…守田英正は古巣戦で途中出場（サッカーキング）,https://news.yahoo.co.jp/articles/3d6d098b2a26406e865c641e903cd39630669821,https://newsatcl-pctr.c.yimg.jp/t/amd-img/20241201-01960364-soccerk-000-1-view.jpg?exp=10800,2024-12-01T07:41:41+09:00,2024-12-01T07:41:41+09:00,サッカーキング,soccerk,SOCCER KING,518,不発に終わり肩を落とすエースFWギェケレシュ [写真]＝Getty Images プリメイラ・リーガ（ポルトガル1部）第12節が11月30日に行われ、首位スポルティングがサンタ・クララに敗れて開幕からの連勝が「11」で止まった。 スポルティングは11月途中にルベン・アモリム前監督がマンチェスター・ユナイテッドに栄転。ジョアン・ペレイラ監督の初陣となったカップ戦ではアマランテ（3部）に6－0で大勝したものの、26日のチャンピオンズリーグではアーセナルに1－5の大敗を喫していた。 そして迎えた新体制初のリーグ戦では、今シーズン快進撃を見せるサンタ・クララが33分に先制。スポルティングは何度かゴールに迫ったものの最後まで1点が遠く、0－1の敗戦で公式戦連敗を喫した。なお、スポルティングの日本代表MF守田英正は、2022年夏まで1年半プレーした古巣を相手に、78分から途中出場した。 今季初黒星を喫したスポルティングは、1試合未消化の2位ポルトとは暫定勝ち点差「6」、2試合未消化の3位ベンフィカとは暫定勝ち点差「8」となっている。スポルティングの次節は5日に行われ、リーグ戦第13節でモレイレンセと対戦する。 SOCCER KING,[],[]
