headline,mainEntityOfPage,image,datePublished,dateModified,author,media_en,media_jp,str_count,body,images,external_links
浦和レッズ参戦の2025年新クラブW杯出場全32クラブ決定！　最後の1枠は南米王者のボタフォゴに（サッカーキング）,https://news.yahoo.co.jp/articles/3a76eb65c8a6538cb22628ee60ee2bb87d4e7737,https://newsatcl-pctr.c.yimg.jp/t/amd-img/20241201-01959544-soccerk-000-2-view.jpg?exp=10800,2024-12-01T07:09:40+09:00,2024-12-01T07:26:14+09:00,サッカーキング,soccerk,SOCCER KING,1509,FIFAクラブW杯出場チームが決定[写真]=Getty Images 南米王者を決めるコパ・リベルタドーレスが11月30日に行われ、ボタフォゴが優勝を果たした。この結果、FIFAクラブワールドカップ2025（Mundial de Clubes FIFA 25）に出場する全32チームが出揃った。 新たなクラブワールドカップとして開催されるFIFAクラブワールドカップ2025は、合計32チームが参加し、2025年6月15日から7月13日までアメリカ合衆国で開催される。出場権は2021年から2024年の各大陸の王者とFIFAが算出するクラブランキング上位のチームに与えられた。 組み合わせ抽選会は、開催地であるマイアミの現地時間12月5日（木）に行われる予定となっている。大会は4チーム×8つに分けたグループステージ方式で開催され、各組上位2チームがラウンド16へ進出。1発勝負の決勝トーナメントが行われる。 FIFAクラブワールドカップ2025出場チームは以下の通り。日本からは浦和レッズが参戦する。 ■FIFAクラブワールドカップ2025 出場チーム ▼アジア アル・ヒラル（サウジアラビア/2021 AFCチャンピオンズリーグ優勝） 浦和レッズ（日本/2022 ACL優勝） アル・アイン（UAE/2023－24 ACL優勝） 蔚山現代（韓国/クラブランキング上位） ▼アフリカ アル・アハリ（エジプト/20－21、22－23、23－24 CAFチャンピオンズリーグ優勝） ウィダード・カサブランカ（モロッコ/21－22 CAFチャンピオンズリーグ優勝） エスペランス（チュニジア/CAFクラブランキング上位） マメロディ・サンダウンズ（南アフリカ/クラブランキング上位） ▼北中米 モンテレイ（メキシコ/2021 CONCACAFチャンピオンズリーグ優勝） シアトル・サウンダーズ（アメリカ/2022 CONCACAFチャンピオンズリーグ優勝） クラブ・レオン（メキシコ/2023 CONCACAFチャンピオンズリーグ優勝） パチューカ（メキシコ/2024 CONCACAFチャンピオンズカップ優勝） インテル・マイアミ（アメリカ/ホスト国枠） ▼南米 パルメイラス（ブラジル/2021コパ・リベルタドーレス優勝） フラメンゴ（ブラジル/2022コパ・リベルタドーレス優勝） フルミネンセ（ブラジル/2023コパ・リベルタドーレス優勝） リーベル・プレート（アルゼンチン/クラブランキング上位） ボカ・ジュニオルス（アルゼンチン/クラブランキング上位） ボタフォゴ（2024コパ・リベルタドーレス王者） ▼オセアニア オークランド・シティ（ニュージーランド/直近4年間のOFCチャンピオンズリーグ王者の中でOFCクラブランキング最上位） ▼ヨーロッパ チェルシー（イングランド/20－21 チャンピオンズリーグ王者） レアル・マドリード（スペイン/21－22、23－24 CL王者） マンチェスター・シティ（イングランド/22－23 CL王者） バイエルン（ドイツ/クラブランキング上位） パリ・サンジェルマン（フランス/クラブランキング上位） インテル（イタリア/クラブランキング上位） ポルト（ポルトガル/クラブランキング上位） ベンフィカ（ポルトガル/クラブランキング上位） ドルトムント（ドイツ/クラブランキング上位） ユヴェントス（イタリア/クラブランキング上位） アトレティコ・マドリード（スペイン/クラブランキング上位） ザルツブルク（オーストリア/クラブランキング上位） SOCCER KING,[],[]
ボタフォゴが初のリベルタドーレス制覇！　開始直後に退場者も…フッキらアトレチコ・ミネイロ下す（サッカーキング）,https://news.yahoo.co.jp/articles/ddf3a82131d834fc2077fb6f252ab3bcbdbb2993,https://newsatcl-pctr.c.yimg.jp/t/amd-img/20241201-01960334-soccerk-000-3-view.jpg?exp=10800,2024-12-01T07:03:59+09:00,2024-12-01T08:08:10+09:00,サッカーキング,soccerk,SOCCER KING,849,ボタフォゴがリベルタドーレス制覇！ [写真]＝Getty Images コパ・リベルタドーレース決勝が11月30日に行われ、アトレチコ・ミネイロとボタフォゴが対戦した。 【ハイライト動画】白熱の決勝！ 10人のボタフォゴがアトレチコ・ミネイロを撃破 ブラジル勢同士の対戦となった決勝。アトレチコ・ミネイロでは東京ヴェルディやポルトなどで活躍したフッキ、ボタフォゴでは元マンチェスター・ユナイテッドのアレックス・テレスやブラジル代表FWルイス・エンヒキらが先発に名を連ねた。 試合開始早々の30秒、ボタフォゴがいきなり退場者を出す。グレゴレの足を高く上げたプレーが相手MFファウスト・ベラの頭部に入り、危険なプレーで一発退場。試合のほとんどを数的不利で戦うことになった。 それでもボタフォゴは35分にルイス・エンヒキがゴール前のこぼれ球を押し込み先制に成功。44分にはA・テレスがPKを沈め、数的不利のボタフォゴが2点リードで折り返す。 ハーフタイムに3枚替えを敢行したアトレチコ・ミネイロは、後半開始早々の47分に1点を返す。フッキが左コーナーキックからアウトスイングのボールを送り、エドゥアルド・バルガスが頭で合わせて押し込んだ。 その後はアトレチコ・ミネイロが猛攻を仕掛けたものの、耐えたボタフォゴが試合終了間際にトドメの3点目を獲得。横浜F・マリノスやサンフレッチェ広島などでプレーしたジュニオール・サントスがチームに歓喜をもたらした。 3－1で勝利したボタフォゴはクラブ史上初めて南米王者に輝き、32クラブが出場するFIFAクラブワールドカップ2025の最後の出場枠を勝ち取った。 【スコア】 アトレチコ・ミネイロ 1－3 ボタフォゴ 【得点者】 0－1 35分 ルイス・エンヒキ（ボタフォゴ） 0－2 44分 アレックス・テレス（ボタフォゴ） 1－2 47分 エドゥアルド・バルガス（アトレチコ・ミネイロ） 1－3 90＋7分 ジュニオール・サントス（ボタフォゴ） SOCCER KING,[],[]
アトレティコ、3連勝で首位バルサと勝ち点差「2」に接近！　グリーズマンの技あり弾など5発大勝（サッカーキング）,https://news.yahoo.co.jp/articles/2e0692edf3b2bf861e398fa497e460d91490c2f4,https://newsatcl-pctr.c.yimg.jp/t/amd-img/20241201-01960336-soccerk-000-3-view.jpg?exp=10800,2024-12-01T06:59:11+09:00,2024-12-01T08:06:07+09:00,サッカーキング,soccerk,SOCCER KING,898,4点目を挙げたグリーズマン [写真]＝Getty Images ラ・リーガ第15節が11月30日に行われ、バジャドリードとアトレティコ・マドリードが対戦した。 【ハイライト】バジャドリード 0－5 アトレティコ・マドリード 直前に首位バルセロナが敗れたことで、2位アトレティコ・マドリードは勝てば勝ち点差を「2」に縮めるチャンスが訪れた。そんなアウェイチームは26分にコーナーキックの流れから先制に成功。マルコス・ジョレンテの折り返しにクレマン・ラングレが合わせて押し込んだ。 アトレティコ・マドリードは35分に追加点を獲得する。アントワーヌ・グリーズマンが放ったシュートが相手GKに阻まれると、こぼれ球をフリアン・アルバレスが押し込んだ。さらに37分、ハビ・ガランのグラウンダークロスにロドリゴ・デ・パウルが合わせてゴールへ流し込み、アトレティコ・マドリードは3点リードで折り返す。 52分、グリーズマンがアルバレスとのワンツーパスでペナルティエリア中央に侵入。見事なボールタッチで相手を翻弄し、最後は左足アウトサイドで冷静にゴール左下へと流し込んだ。 アトレティコ・マドリードは試合終了間際にアレクサンダー・セルロートがダメ押し点を奪い、“マニータ”（1試合5得点）達成。試合はこのまま終了し、3連勝を飾ったアトレティコ・マドリードは、バルセロナとの勝ち点差を「2」に縮めた。 公式戦7連勝中のアトレティコ・マドリードの次戦は、5日に行われるコパ・デル・レイ（国王杯）2回戦でカセレーニョ（5部）戦。8日にはラ・リーガ第16節でセビージャと対戦する。 【スコア】 バジャドリード 0－5 アトレティコ・マドリード 【得点者】 0－1 26分 クレマン・ラングレ（アトレティコ・マドリード） 0－2 35分 フリアン・アルバレス（アトレティコ・マドリード） 0－3 37分 ロドリゴ・デ・パウル（アトレティコ・マドリード） 0－4 52分 アントワーヌ・グリーズマン（アトレティコ・マドリード） 0－5 90＋2分 アレクサンダー・セルロート（アトレティコ・マドリード） SOCCER KING,[],[]
三笘の先制弾もドローに…ブライトン指揮官がサウサンプトン戦を反省「容赦なく攻め続けなければ」（サッカーキング）,https://news.yahoo.co.jp/articles/05f26d87a8eb9724b9f62994a9b8085395418ad8,https://newsatcl-pctr.c.yimg.jp/t/amd-img/20241201-01960207-soccerk-000-2-view.jpg?exp=10800,2024-12-01T05:49:10+09:00,2024-12-01T05:51:07+09:00,サッカーキング,soccerk,SOCCER KING,728,三笘薫が所属するブライトンを指揮するファビアン・ヒュルツェラー監督[写真]=Getty images 日本代表MF三笘薫が所属するブライトンのファビアン・ヒュルツェラー監督は、29日に行われたプレミアリーグ第13節サウサンプトン戦（1－1△）を振り返った。30日にクラブ公式サイトがコメントを伝えている。 直近の2試合を連勝し、3連勝を目指していたブライトンは、29分に三笘の2試合連続ゴールで先制したものの、後半に同点ゴールを許し、下位相手に勝ち点を取りこぼした。ヒュルツェラー監督は今回の結果を受け「失望もサッカーの一部だ。我々が勝利に値しなかっただけだ。そのため、我々は改善と努力を続け、次の試合でより良い結果を出すように努力しなければいけない」と、謙虚に試合を分析した。 続けて「90分間のパフォーマンスをもっと一貫性のあるものにし、さらに容赦なく攻め続けチャンスをモノにしなければいけない。前半で試合を決められたはずだ。後半に失点を許した理由は明確であり、安定感に欠けていた」とコメント。試合を通して安定感を保つ必要性を強調した。 しかし、3連勝を逃したことよりもパフォーマンスに納得がいっていないとし、「シーズン序盤のこの時期は結果よりもパフォーマンスに重点を置くべきだ。この試合は最高なパフォーマンスとは言えない」と、あくまでパフォーマンス重視としながら厳しめの評価を下した。 最後にスタジアムに駆け付けたサポーターに対しては「後半については謝罪したい。我々は自分たち自身に厳しくしなくてはいけない」と、満足のいくパフォーマンスを見せられなかったことを謝罪した。ブライトンは次節、12月5日に敵地でフルアムと対戦する。 SOCCER KING,[],[]
田中碧が痛恨のファウルで決勝点PK献上、リーズ敗戦で首位浮上逃す…大橋祐紀も決定機がクロスバー直撃でゴールならず（サッカーキング）,https://news.yahoo.co.jp/articles/9fff018dcba191f5e70695f4e6349c5eb8bf525d,https://newsatcl-pctr.c.yimg.jp/t/amd-img/20241201-01960228-soccerk-000-1-view.jpg?exp=10800,2024-12-01T05:29:07+09:00,2024-12-01T05:29:07+09:00,サッカーキング,soccerk,SOCCER KING,858,PKを献上したリーズMF田中碧[写真]＝Getty Images チャンピオンシップ（イングランド2部）第18節が29日に行われ日本代表FW大橋祐紀が所属するブラックバーンと日本代表MF田中碧所属のリーズが対戦した。 【ハイライト動画】田中碧＆大橋祐紀先発出場！ブラックバーンvsリーズ ホームのブラックバーンは直近2試合を連勝し、3連勝でプレーオフ圏内浮上を目指す。大橋祐紀はスタメンに名を連ね、9月14日の第5節ブリストル・シティ戦以来のゴールに期待がかかる。 一方のリーズは、この試合で勝利すれば首位に浮上する大事な一戦。中2日が続く過密日程だが、田中碧はリーグ戦11試合連続スタメン入りを果たした。 試合は開始早々からブラックバーンに決定機。12分に右サイドからの浮き球のクロスに大橋が頭で合わせるも、クロスバーに直撃。跳ね返りを味方が狙うも枠外へと逸れた。 アウェイのリーズも決定機を決めきれずにいると、20分にブラックバーンが試合を動かす。10番ドランが右サイドを突破すると、ペナルティエリアに侵入し、後方から田中のチャージを受けて転倒。これがファウルの判定となり、田中は痛恨のPK献上となった。22分、このPKをトッド・キャントウェルが冷静に沈め、ブラックバーンが先制に成功する。 その後、両チーム譲らずに迎えた82分、リーズはコーナーキックからネットを揺らすもこれはオフサイドの判定で得点を認められず。このままブラックバーンが1点を守り切り、3連勝を飾り、1試合未消化ながらも8位に浮上した。一方、敗れたリーズは首位シェフィールド・ユナイテッドとの勝ち点差が『3』に広がることになった。 なお、この試合で大橋は63分までプレーし、田中はフル出場した。次節は12月7日に行われ、ブラックバーンは敵地でハル・シティと、リーズはホームでダービー・カウンティと対戦する。 【スコア】 ブラックバーン 1－0 リーズ 【得点者】 1－0 22分 トッド・キャントウェル（ブラックバーン） SOCCER KING,[],[]
アーセナルが暫定2位浮上！前半だけで5発のゴールラッシュ…1試合未消化の首位リヴァプールと勝点6差に（サッカーキング）,https://news.yahoo.co.jp/articles/b1c1883262d4e3b215b1e3ed8709f475a97d1beb,https://newsatcl-pctr.c.yimg.jp/t/amd-img/20241201-01960217-soccerk-000-2-view.jpg?exp=10800,2024-12-01T04:28:52+09:00,2024-12-01T04:49:39+09:00,サッカーキング,soccerk,SOCCER KING,1420,アーセナルMFブカヨ・サカ[写真]=Getty Images プレミアリーグ第13節が11月30日に行われ、ウェストハムとアーセナルが対戦した。 【ゴール動画】アーセナルが暫定2位浮上！前半はゴールラッシュに！ ホームのウェストハムは前節ニューカッスル戦で3試合ぶりの勝利を飾り、今季のプレミアリーグ成績を4勝3分5敗とした。対するアウェイのアーセナルも、前節はノッティンガム・フォレストに勝利。ミッドウィークのチャンピオンズリーグ（CL）リーグフェーズ第5節もスポルティングに5得点を奪って快勝し、公式戦2連勝で今節に臨んだ。 前半立ち上がりは、アーセナルが圧倒する展開となった。まずは10分、コーナーキックをブカヨ・サカが蹴ると、ガブリエウ・マガリャンイスがニアでヘディングシュートし、公式戦2試合連続となるゴールを奪った。得意のセットプレーでアーセナルが幸先よく先制に成功する。 そして、27分には見事な崩しで追加点を奪取。右サイドのサカが内側に入ってパスすると、マルティン・ウーデゴーアが絶妙な浮き球のパスを供給する。これでサカがラインブレイクすると、ゴール前へラストパスを送り、フリーになったレアンドロ・トロサールがゴールへ押し込んだ。 さらに32分には、右サイドからサカがドリブルで中央へ仕掛け、ペナルティエリア内で倒されてPKを獲得。34分、このPKをウーデゴーアが冷静に決めて3点差に広げる。そして、36分にはトロサールのパスがマックス・キルマンのクリアミスを誘発。カイ・ハヴァーツが完全に抜け出し、GKとの一対一を制してゴール左隅へ決めた。アーセナルが怒涛のゴールラッシュで一気に4点差へ広げる。 しかし、ホームで4失点を喫したウェストハムも、ここから反撃を開始する。まずは38分、カルロス・ソレールの絶妙なスルーパスで最終ラインを抜け出したアーロン・ワン・ビサカが2試合連続ゴールをマーク。さらに40分には、ペナルティエリア手前で獲得したフリーキックをエメルソン・パルミエリが直接決めて、2点差に縮めた。 追い上げられたアーセナルだが、前半終了間際にまたしても得意のコーナーキックで得点を奪う。ガブリエウがGKウカシュ・ファビアンスキと接触してPKを獲得。このPKをサカが冷静に決め、再びリードを3点差に広げた。前半はこのまま2－5で終了。両チーム合計7ゴールが飛び交う、目まぐるしい展開となった。 後半に入ると、ゴールラッシュとなった前半から一転して、互いに一歩も譲らず、得点が生まれない展開となった。後半アディショナルタイムには、ウェストハムのダニー・イングスがペナルティエリア内でGKを交わしてシュートしたが、難しい体勢で枠に飛ばすことはできず、試合はこのまま2－5で終了。アーセナルが暫定2位に浮上し、1試合未消化の首位リヴァプールと勝ち点6差に迫った。 【スコア】 ウェストハム 2－5 アーセナル 【得点者】 0－1 10分 ガブリエウ・マガリャンイス（アーセナル） 0－2 27分 レアンドロ・トロサール（アーセナル） 0－3 34分 マルティン・ウーデゴーア（アーセナル） 0－4 36分 カイ・ハヴァーツ（アーセナル） 1－4 38分 アーロン・ワン・ビサカ（ウェストハム） 2－4 40分 エメルソン・パルミエリ（ウェストハム） 2－5 45+5分 ブカヨ・サカ（アーセナル） SOCCER KING,[],[]
バイエルン、ケイン負傷もムシアラ同点弾で無敗キープ…ドルトムントは2012年以来のデア・クラシカー連勝ならず（サッカーキング）,https://news.yahoo.co.jp/articles/717df7fb8d62f1e0b3cbda17dcf92d33144689b5,https://newsatcl-pctr.c.yimg.jp/t/amd-img/20241201-01960216-soccerk-000-7-view.jpg?exp=10800,2024-12-01T04:27:24+09:00,2024-12-01T04:48:03+09:00,サッカーキング,soccerk,SOCCER KING,1098,バイエルンMFジャマル・ムシアラ[写真]=Getty Images ブンデスリーガ第12節が11月30日に行われ、ドルトムントとバイエルンが対戦した。 ホームのドルトムントは、今季リーグ戦でここまで6勝1分4敗、アウェイのバイエルンは9勝2分無敗で首位を走る。両チームともにミッドウィークに行われたチャンピオンズリーグ（CL）リーグフェーズ第5節で勝利して、今節を迎えた。前回対戦の昨季ブンデスリーガ第27節では、ドルトムントが2018年11月以来の“デア・クラシカー”での勝利を掴んでいる。 試合は立ち上がりから両チームともにアグレッシブにプレスをかけ、激しい攻防が繰り広げられた。すると、早い時間帯でドルトムントにアクシデントが発生。ヴァルデマール・アントンが負傷し、10分にニクラス・ズーレとの交代を余儀なくされた。 徐々にバイエルンが攻撃の圧力を強めたが、27分にドルトムントが個の力で得点を奪う。左サイドでパスを受けたジェイミー・バイノー・ギテンスが対峙したコンラート・ライマーをドリブルで置き去りにしてペナルティエリア内まで侵入し、強烈なシュートをゴールネットに突き刺した。ドルトムントが公式戦7試合連続無失点中のバイエルン相手に先制点を奪った。 先制を許したバイエルンをさらなるアクシデントが襲う。エースのハリー・ケインが負傷でプレー続行不能となり、33分にトーマス・ミュラーとの交代を余儀なくされた。前半はこのままドルトムントが1点リードで折り返す。 後半も立ち上がりから両チームがゴールに迫るスリリングな展開となった。バイエルンもドルトムントもゴール前で決定的なシュートを放つが、マヌエル・ノイアーとグレゴール・コベルの両GKがビッグセーブを披露し、得点を許さない。 それでも、85分にバイエルンがセットプレーの流れからドルトムントの牙城を破る。ペナルティエリア手前で得たフリーキックをレロイ・サネが蹴ると、シュートは壁に当たるが、跳ね返ったボールを拾ってオリーズへパス。オリーズがクロスを入れると、ペナルティエリア内でフリーになったジャマル・ムシアラがヘディングシュートをゴールネットに沈め、バイエルンが同点に追いついた。 試合はこのまま1－1で終了。バイエルンは公式戦無敗をキープ。ドルトムントは2010年～2012年の5連勝以来となる“デア・クラシカー”連勝とはならなかった。 【スコア】 ドルトムント 1－1 バイエルン 【得点者】 1－0 27分 ジェイミー・バイノー・ギテンス（ドルトムント） 1－1 85分 ジャマル・ムシアラ（バイエルン） SOCCER KING,[],[]
