headline,mainEntityOfPage,image,datePublished,dateModified,author,media_en,media_jp,str_count,body,images,external_links
今治、J2初昇格へ導いた服部年宏監督の退任を発表「クラブの歴史を創ることができた1年はかけがえのない時間」（サッカーキング）,https://news.yahoo.co.jp/articles/cd7facdf4653904402db778590557b890871ea62,https://newsatcl-pctr.c.yimg.jp/t/amd-img/20241201-01960628-soccerk-000-1-view.jpg?exp=10800,2024-12-01T21:57:55+09:00,2024-12-01T21:57:55+09:00,サッカーキング,soccerk,SOCCER KING,598,FC今治が服部年宏監督の退任を発表 FC今治は1日、服部年宏監督が今季限りで退任することを発表した。 現役時代にジュビロ磐田などでプレーした服部氏は、現役引退後に古巣磐田の強化部長やヘッドコーチなどを歴任。2022年からは福島ユナイテッドでトップチーム監督を務め、今季から今治の指揮官に就任した。 就任1年目ながら今季の明治安田J3リーグで22勝7分9敗の勝ち点73の成績を残し、自動昇格圏内の2位でクラブ史上初となるJ2昇格へ導いた。 退任に際し、服部監督はクラブ公式サイトで以下のコメントを発表している。 「ファン・サポーターの皆様、パートナー企業の皆様、Voyageの皆様、そしてFC今治に関わる全ての皆様、日頃より多大なるご支援ご声援、心より感謝いたします」 「今シーズン限りで監督を退任することになりました。1年間私にチームを託してくださったクラブに感謝致します。このクラブで指揮を取ることができ幸せでした」 「どんな時でも応援してくださったFC今治ファミリーの皆さんと共に昇格を目指し、クラブの歴史を創ることができた1年はかけがえのない時間となりました。そして、皆さんの笑顔が溢れた『アシさと』は最高に素晴らしい景色でした」 「FC今治の今後の更なる発展と、2025年シーズンが素晴らしいシーズンになることを祈っております。1年間本当にありがとうございました」 SOCCER KING,[],[]
J3沼津が中山雅史監督と契約更新「心を滾らせるサッカーをグラウンドの上で展開できれば」（サッカーキング）,https://news.yahoo.co.jp/articles/866791ecfd0f01b43bf6a39f4a0d59c584f5aa4d,https://newsatcl-pctr.c.yimg.jp/t/amd-img/20241201-01960624-soccerk-000-2-view.jpg?exp=10800,2024-12-01T21:47:02+09:00,2024-12-01T21:47:17+09:00,サッカーキング,soccerk,SOCCER KING,650,沼津が中山雅史監督との契約更新を発表 [写真]＝Getty Images J3のアスルクラロ沼津は1日、中山雅史監督との契約を更新したことを発表した。 中山監督は2023年に沼津の監督に就任。1年目は15勝6分17敗で13位、2年目の今季は15勝7分16敗で10位となっていた。契約更新に際し、中山監督はクラブ公式サイトを通して以下のコメントを発表している。 「昨シーズンから引き続き、2024シーズンもアスルクラロ沼津へ多大なるご支援、ご声援をいただき誠にありがとうございました。2025シーズンも監督として指揮を執ることになりました」 「2024シーズン最後まで必死に闘いましたが、望んだ結果を掴み取ることができませんでした。まだまだ足りない、緩い、遅い、弱い自分達としっかり向き合い、日々のトレーニングに臨んでいきたいと思います。1試合1試合を全力で闘うことに変わりはありませんが、細部にこだわり抜く、やり切る、走り抜く力をより身に付けてシーズンを闘い、試合を観に来てくださるファン・サポーターの皆様の心を掴み、心を滾らせるサッカーをグラウンドの上で展開できればと思います」 「静岡県東部地域の皆様、そしてサッカーを愛する全ての皆様の日常に『アスルクラロ沼津』が溶け込んでいけるよう、一つひとつのプレーや勝負にこだわり、シーズンを通してその姿勢を貫いていきたいと思います。２０２５シーズンも熱い情熱・魂を持って共に闘ってください。ホーム開幕戦、愛鷹でお会いしましょう！」 SOCCER KING,[],[]
ユヴェントス、冬の移籍市場で積極補強か…マンUのザークツィーや上田綺世同僚DFをリストアップ？（サッカーキング）,https://news.yahoo.co.jp/articles/e1c15d55f56917d490fa3fcd5f7670fb0775d1af,https://newsatcl-pctr.c.yimg.jp/t/amd-img/20241201-01960608-soccerk-000-2-view.jpg?exp=10800,2024-12-01T21:31:42+09:00,2024-12-01T21:41:56+09:00,サッカーキング,soccerk,SOCCER KING,880,ユヴェントスへレンタル移籍の可能性が報じられているマンチェスター・ユナイテッドFWジョシュア・ザークツィー[写真]＝Getty images ユヴェントスが今季の冬の移籍市場で積極的に補強に動く可能性があるようだ。30日、イタリアメディア『ガゼッタ・デッロ・スポルト』が伝えている。 今季からチアゴ・モッタ監督が指揮を執るユヴェントス。ここまでリーグ開幕から13試合で7勝6分けと、無敗をキープしているものの、勝ちきれない試合が多く勝ち点『25』で6位に位置している。現在“首位”ナポリとの勝ち点差は『4』であり、2019－20シーズン以来のセリエA制覇に向け、これ以上離されたくないところだ。 そんなユヴェントスは冬の移籍市場で数名の主力級を補強する可能性が報じられている。『ガゼッタ・デッロ・スポルト』によれば、イタリア代表MFニコロ・ファジョーリと今季アストン・ヴィラから加入したブラジル代表MFドウグラス・ルイスを放出する可能性があり、2人の移籍で得た資金で新たな戦力の獲得を画策しているようだ。特にファジョーリにはマルセイユやパリ・サンジェルマンに加えサウジアラビアのクラブからも関心を寄せられているとのこと。 同メディアは、ボローニャ時代にチアゴ・モッタ監督が指導したマンチェスター・ユナイテッドのオランダ代表FWジョシュア・ザークツィーとベンフィカのポルトガル代表DFアントニオ・シウヴァをレンタルで獲得することは有力だと指摘し、選手売却が上手くいった際には、フェイエノールトに所属するスロバキア代表DFダヴィド・ハンツコの獲得に乗り出す可能性が高いという。 また、チアゴ・モッタ監督は、ザークツィー同様“教え子”であるボローニャのスコットランド代表MFルイス・ファーガソンの獲得も希望しているとのことだが、同選手は先日ボローニャとの契約を更新したばかりであるため、獲得は困難と報じられている。 はたして、ユヴェントスはセリエA最多となる37回目の“スクデッド”獲得に向け、冬の移籍市場で狙い通りの補強ができるのだろうか。 SOCCER KING,[],[]
本田圭佑元所属ボタフォゴ、破産寸前から南米王者へ…現オーナー買収後3年で栄冠掴む（サッカーキング）,https://news.yahoo.co.jp/articles/d72ec1c77c1c09eaeb9200fab08e28ea335b2ecc,https://newsatcl-pctr.c.yimg.jp/t/amd-img/20241201-01960604-soccerk-000-3-view.jpg?exp=10800,2024-12-01T19:21:00+09:00,2024-12-01T19:38:38+09:00,サッカーキング,soccerk,SOCCER KING,1376,右がジョン・テクスター氏[写真]=Getty Images 11月30日にコパ・リベルタドーレス2024決勝が行われ、かつて元日本代表MF本田圭佑らがプレーしたブラジルの名門ボタフォゴが、アトレチコ・ミネイロに3－1で勝利し、南米王者に輝いた。そして、ボタフォゴの成功の裏にはアメリカ人オーナーのジョン・テクスター氏の存在があると、同日ブラジルメディアの『フォーリャ・デ・サンパウロ』など複数メディアが報じた。 現在59歳のテクスター氏はアメリカの中産階級に生まれ、10代の頃はスケートボード選手として「（同競技の伝説的な選手）ロドニー・ミューレンに匹敵する唯一の選手」と評されるほどの存在だった。しかし、負傷によりスケートボードの道を諦め、ビジネスの道に進む。 テクスター氏は運営する会社のバーチャルリアリティ（コンピューターで製作された仮想空間を現実のように投影する）技術が『タイタニック』、『パイレーツ・オブ・カリビアン』などの映画で使用されるなど「ハリウッドの仮想現実の第一人者」と呼ばれる存在に。その後も、スポーツを配信するプラットフォームの『fubo tv』をなど複数のビジネスで成功を収めた。 そんなテクスター氏はサッカービシネスにも進出。2021年には当時カンピオナート・ブラジレイロ・セリエB（ブラジル全国選手権2部）を戦い、多額の負債を抱え破産寸前と言われたボタフォゴの買収に動く。そして、チームがカンピオナート・ブラジレイロ・セリエA（ブラジル全国選手権1部）に復帰した2022年1月にオーナーに就任。積極的な投資と優れたスカウト及びマネージメント体制を構築した。 昇格1年目の2022年にはセリエAの11位となりコパ・スダメリカーナ出場権を獲得すると、翌2023年はセリエAの前半戦で15勝2敗2分けの勝ち点47とし、2位と勝ち点差「13」をつけ首位を独走。しかし、リーグ後半戦になると3勝8敗8分けの勝ち点17と大失速して、優勝したパルメイラスに勝ち点差「6」を付けられた5位でリーグ戦を終えることになった。 そして迎えた2024年、テクスター氏は「ブラジルでは結果が操作されている。特に、パルメイラスが有利になるように恩恵を受けている」と、前年のボタフォゴの失速は意図的に作り出されたものだと主張して物議を醸しつつも、チームは躍進。そして今回コパ・リベルタドーレス2024で優勝を果たし、更にはセリエAでも残り2節を残しパルメイラスと勝ち点差「3」をつけ首位に立っており、国内タイトルとの2冠を獲得する可能性を残している。 なお、テクスター氏はボタフォゴに加え、日本代表MF鎌田大地が所属するクリスタル・パレスの共同オーナー、元FC東京MF安部柊斗が所属するチャレンジャー・プロ・リーグ（ベルギー2部）のRWDモレンベーク、リヨンのオーナーも務めている。ボタフォゴでは成功を収めている一方、リヨンでは約5億ユーロ（約800億円）の財務負債を抱えており、11月にはそれを理由にフランスサッカー経営管理総局（DNCG）から2025年1月の移籍市場における補強禁止処分と賃金制限を科された。今後、財務状況が改善されない場合は2024－25シーズン終了後のリーグ・ドゥ（2部）降格となる暫定処分を受けている。 SOCCER KING,[],[]
J2昇格PO決勝の対戦カードが決定！　3位富山と4位松本が激突へ（サッカーキング）,https://news.yahoo.co.jp/articles/926289a1771b76c01ecfb06c3b852881f54210c3,https://newsatcl-pctr.c.yimg.jp/t/amd-img/20241201-01960480-soccerk-000-1-view.jpg?exp=10800,2024-12-01T16:18:34+09:00,2024-12-01T16:18:34+09:00,サッカーキング,soccerk,SOCCER KING,571,2024J2昇格プレーオフ・準決勝の2試合が12月1日に開催された。 2024J2昇格プレーオフには、2024明治安田J3リーグを3位から6位で終えたチームが出場。準決勝、決勝ともにリーグ戦上位クラブのホームで行われ、準決勝では3位カターレ富山と6位FC大阪が、4位松本山雅FCと5位福島ユナイテッドFCがそれぞれ対戦した。 なお、準決勝、決勝ともに90分で引き分けの場合は、年間順位の優位性を確保するため、リーグ戦年間順位が上位のクラブを勝者となる。 富山とFC大阪の一戦は36分に布施谷翔のヘディング弾で富山が先制したものの、45＋3分に増田隼司のゴールでFC大阪が同点に追いつき、このまま1－1で試合はタイムアップを迎えた。 また、松本と福島の対戦は、10分に樋口寛規のゴールで福島が先制したが、65分には高橋祥平が同点弾を決め、松本が試合を振り出しに戻した。このままスコアは動かず、1－1のドローに終わっている。 この結果、年間順位が上位だった富山と松本がJ2昇格プレーオフ決勝進出を果たした。なお、同試合は7日の14時キックオフ予定となっている。 ■J2昇格プレーオフ・準決勝結果 カターレ富山 1－1 FC大阪 松本山雅FC 1－1 福島ユナイテッドFC ■決勝対戦カード カターレ富山 vs 松本山雅FC SOCCER KING,[],[]
6位仙台が3位長崎に4発快勝！　5位岡山は4位山形を下す/J1昇格PO準決勝（サッカーキング）,https://news.yahoo.co.jp/articles/02919a11ea4ffe8cec4e6d9af95145703163da00,https://newsatcl-pctr.c.yimg.jp/t/amd-img/20241201-01960477-soccerk-000-1-view.jpg?exp=10800,2024-12-01T16:08:23+09:00,2024-12-01T16:08:23+09:00,サッカーキング,soccerk,SOCCER KING,675,2024 J1昇格プレーオフ・準決勝の2試合が12月1日に開催された。 2024J1昇格プレーオフには、2024明治安田J2リーグを3位から6位で終えたチームが出場。準決勝、決勝ともにリーグ戦上位クラブのホームで行われ、準決勝では3位V・ファーレン長崎と6位ベガルタ仙台が、4位モンテディオ山形と5位ファジアーノ岡山がそれぞれ対戦した。 なお、準決勝、決勝ともに90分で引き分けの場合は、年間順位の優位性を確保するため、リーグ戦年間順位が上位のクラブを勝者となる。 長崎と仙台の一戦は、31分に中島元彦がPKを決めて仙台が先制に成功すると、53分にはエロンが、68分には郷家友太が追加点を挙げた。76分にはマテウス・ジェズスのゴールで長崎が1点を返したものの、90＋2分に中島がダメ押しゴールを挙げ、4－1でリーグ6位で終えた仙台が勝利を収めている。 また、山形と岡山の対戦は31分に本山遥のゴールで岡山が先制し、34分には岩渕弘人が追加点を挙げた。54分には川井歩が一発退場となり、追いかける山形は数的不利になると、攻勢に出たものの、得点を奪うことができず。84分には木村太哉がダメ押しゴールを挙げ、3－0で岡山が快勝した。 この結果、勝利した仙台と岡山がJ1昇格プレーオフ決勝に進出した。なお、同試合は7日の13時5分キックオフ予定となっている。 ■J1昇格プレーオフ・準決勝結果 V・ファーレン長崎 1－4 ベガルタ仙台 モンテディオ山形 0－3 ファジアーノ岡山 ■決勝対戦カード ファジアーノ岡山 vs ベガルタ仙台 SOCCER KING,[],[]
逆転優勝目指す広島、札幌に5発快勝！　首位神戸と勝ち点「1」差で最終節へ（サッカーキング）,https://news.yahoo.co.jp/articles/7900a2c2fb18865b1324a84e30603c10321a18de,https://newsatcl-pctr.c.yimg.jp/t/amd-img/20241201-01960473-soccerk-000-1-view.jpg?exp=10800,2024-12-01T15:57:30+09:00,2024-12-01T15:57:30+09:00,サッカーキング,soccerk,SOCCER KING,1024,札幌に快勝した広島 [写真]=J.LEAGUE 2024明治安田J1リーグ第37節が12月1日に行われ、サンフレッチェ広島と北海道コンサドーレ札幌が対戦した。 9年ぶり優勝の目指す暫定3位の広島は勝利すれば、首位ヴィッセル神戸との勝ち点差を「1」に縮めて2位で最終節を迎えることが可能となるが、敗れれば優勝の可能性は消滅する。一方、19位の札幌は11月30日に行われた17位柏レイソルと神戸の一戦が1－1のドローに終わったことで、今節を戦う前に自動降格が決定している。 試合は8分、東俊希が左サイドからグラウンダーで絶妙なクロスを送ると、走り込んだ加藤陸次樹が右足ダイレクトで流し込んで広島が先制に成功した。追いかける札幌は42分、スローインの流れから右サイドを突破すると最後は鈴木武蔵が押し込んで、同点に追いついた。 それでも、45＋2分にはセットプレーのキッカーを務めた東がゴールへと向かうボールを蹴ると、中で誰も触らないままボールがそのままネットを揺らし、再び広島が勝ち越して前半を折り返した。 後半に入り、52分にバックパスを狙った加藤がGK菅野孝憲に倒されて広島がPKを獲得すると、キッカーを務めたトルガイ・アルスランがこれを決めて、リードを2点に広げた。 79分には左サイドを駆け上がった加藤が中に折り返すと、走り込んだピエロス・ソティリウが追加点を挙げた。また、82分にはこの試合の終了後に引退セレモニーが予定されている青山敏弘が途中出場を果たしている。 さらに、87分にはコーナーキックからソティリウが頭で合わせてダメ押しゴールを挙げ、試合はこのまま5－1で終了。この結果、リーグ戦4試合ぶり白星を手にした広島は、首位神戸との勝ち点差を「1」に縮め、最終節に逆転優勝の可能性を残すこととなった。 最終節となる次節は8日に行われ、広島はアウェイでガンバ大阪と、札幌はホームで柏レイソルとそれぞれ対戦する。 【スコア】 サンフレッチェ広島 5－1 北海道コンサドーレ札幌 【得点者】 1－0 8分 加藤陸次樹（サンフレッチェ広島） 1－1 42分 鈴木武蔵（北海道コンサドーレ札幌） 2－1 45＋2分 東俊希（サンフレッチェ広島） 3－1 55分 トルガイ・アルスラン（サンフレッチェ広島） 4－1 79分 ピエロス・ソティリウ（サンフレッチェ広島） 5－1 87分 ピエロス・ソティリウ（サンフレッチェ広島） SOCCER KING,[],[]
J3・JFL入れ替え戦の第1戦はドロー…YS横浜が先制も、高知が追いつく（サッカーキング）,https://news.yahoo.co.jp/articles/2e153c47c907a6d51b7aeb5a525b97e6545ad689,https://newsatcl-pctr.c.yimg.jp/t/amd-img/20241201-01960475-soccerk-000-1-view.jpg?exp=10800,2024-12-01T14:56:27+09:00,2024-12-01T14:56:27+09:00,サッカーキング,soccerk,SOCCER KING,624,2024 J3・JFL入れ替え戦の第1戦が12月1日に行われ、高知ユナイテッドSCとY．S．C．C．横浜が対戦した。 2024明治安田J3リーグを19位で終えたYS横浜と、Jリーグ入会要件を満たした上でJFL（日本フットボールリーグ）を2位で終えた高知の入れ替え戦は、ホーム＆アウェイ方式の2試合で開催。高知のホーム開催となる第1戦はリレーマラソンが予定されているため、本拠地『高知県立春野総合運動公園』ではなく、『Pikaraスタジアム』（香川県）で行われた。 なお、入れ替え戦の勝者は2試合の勝利数が多いチームとなるほか、勝利数で並んだ場合は、2試合の得失点差、第2戦終了時に30分間（前後半各15分）の延長戦、PK戦（各チーム5人ずつ。勝敗が決定しない場合は、6人目以降は1人ずつで勝敗が決定するまで）で決められる。また、アウェイゴールルールは無しとなっている。 試合は5分に冨士田康人のヘディング弾でYS横浜が先制したものの、33分に上月翔聖が同点ゴールを奪い、高知が試合を振り出しに戻した。その後、スコアは動かず、第1戦はこのまま1－1のドローに終わった。 YS横浜のホームで行われる注目の第2戦は7日の15時キックオフ予定となっている。 【スコア】 高知ユナイテッドSC 1－1 Y．S．C．C．横浜 【得点者】 0－1 5分 冨士田康人（Y．S．C．C．横浜） 1－1 33分 上月翔聖（高知ユナイテッドSC） SOCCER KING,[],[]
