headline,mainEntityOfPage,image,datePublished,dateModified,author,media_en,media_jp,str_count,body,images,external_links
20万円以上かかる場合も？！ 「浴室乾燥機の交換」にかかる「費用」はどれくらい？ 「交換頻度の目安」についても解説。（ファイナンシャルフィールド）,https://news.yahoo.co.jp/articles/553f9a3fb182edcdc641817d4de9ab2e5ae3aa88,https://newsatcl-pctr.c.yimg.jp/t/amd-img/20250523-00010017-ffield-000-1-view.jpg?exp=10800,2025-05-23T12:20:11+09:00,2025-05-23T12:20:11+09:00,ファイナンシャルフィールド,ffield,ファイナンシャルフィールド,1797,"20万円以上かかる場合も？！ 「浴室乾燥機の交換」にかかる「費用」はどれくらい？ 「交換頻度の目安」についても解説。
乾燥や換気・暖房などさまざまな機能がある浴室乾燥機は、浴室内を快適に保つだけでなく、洗濯物を干す際などにも役立つ場合があります。長年使用していると不具合が出てくることもあるかもしれませんが、どのくらいで交換すべきか悩む人もいるでしょう。
 
本記事では、浴室乾燥機の交換頻度の目安とともに、本体価格や交換にかかる費用について紹介します。
▼節約のためにトイレを「3回に1回」だけ流すのは危険!  節約効果とデメリットを解説
浴室乾燥機の本体価格はどのくらい？
浴室乾燥機にはいくつか種類があります。例えば、温水式か電気式かの違いや、天井埋込型か壁掛型かの違いなどが挙げられます。
 
本体価格は種類やタイプによって異なりますが、あるメーカーの浴室乾燥機は以下のようになっているので参考にするとよいでしょう。
 
【温水式浴室乾燥機（天井埋込型）】
・1室換気対応：16万7200円（税込み）
・2室換気対応：19万9100円（税込み）
・3室換気対応：21万6700円（税込み）

【温水式浴室乾燥機（壁掛型）】
・14万5200円（税込み）

【電気式浴室乾燥機（天井埋込型）】
・1室換気対応：14万8500円（税込み）
・2室換気対応：20万1300円（税込み）
・3室換気対応：20万3500円（税込み）
 
また、同じ温水式でも「カビ防止の機能が搭載されているタイプ」だと30万円以上するものもあるようです。
本体価格以外にかかる費用は？
浴室乾燥機を新しく交換する際には、本体価格以外にも工事費用がかかります。東京ガスの機器交換では、以下のものが基本工事費に含まれます。
 
・出張費
・既存機器撤去
・取付工事
・機器の操作説明
・廃棄処分
・養生費・運搬費・駐車場代などの諸経費
 
基本工事費は電気式浴室乾燥機の場合が3万800円（税込み）、温水式浴室乾燥機の場合が3万7400円（税込み）です。
 
例として、本体価格が20万円程度の温水式浴室乾燥機を新しく購入して設置する場合は、工事費とあわせて24万円ほどかかると考えられます。
 
ただし、設置状況によっては追加工事が必要になる場合もあります。例えば、新しい浴室乾燥機の天井開口部サイズが小さい場合は開口部のすき間をふさぐための工事が必要になるため、別途工事費がかかるようです。また、温水式から電気式に変更する場合にも、暖房配管からの水漏れ防止作業のための工事費がかかります。
浴室乾燥機の交換頻度の目安
あるメーカーでは、浴室乾燥機の設計上の標準使用期間を10年としています。標準使用期間とは安全上支障なく使用できる標準期間のことで、これを超えて使用すると経年劣化により発火したりけがの原因となる事故が発生したりするおそれがあることが製品に表示されています。
 
ただし、10年たっていなくても以下のような症状が出る場合は点検や交換を検討した方がよいでしょう。
 
・頻繁にエラー表示が出る
・運転音が大きくなった
・運転時に大きな振動音がする
・水が垂れてくる
・本体の一部が変色・変形している
 
余計な修理費用が発生しないようにするためにも、普段から浴室乾燥機の様子をこまめにチェックしておくことをおすすめします。
本体価格と工事費をあわせて20万円以上かかる場合もある｜交換の目安を10年としているメーカーも
浴室乾燥機にはさまざまな種類があり、温水式か電気式か、天井埋込型か壁掛型かなどによって本体価格に差があります。
 
また、本体価格以外にも出張費や取付工事などが工事費としてかかったり、場合によってはさらに追加費用がかかったりすることもあるため、事前に確認しておきましょう。
 
浴室乾燥機の交換頻度については、10年を目安としているメーカーもあります。10年経過していなくても、エラー表示が頻繁に出る場合や運転音が大きくなった場合などは交換が必要になることもあるため、普段から状態をチェックしておくことをおすすめします。
 
出典
東京ガス株式会社　浴室乾燥機の工事費
 
執筆者：FINANCIAL FIELD編集部
ファイナンシャルプランナー
ファイナンシャルフィールド編集部",[],[]
夫婦の間に子どもはなく、妻の年収は850万円以下。「遺族年金」が「無期限」から「期限付き」になるって本当？厚生労働省の見直し案通りなら遺族年金はどう変わる？（ファイナンシャルフィールド）,https://news.yahoo.co.jp/articles/32802d20fbe9c340223b32d32cb0642c21d4df89,https://newsatcl-pctr.c.yimg.jp/t/amd-img/20250523-00010016-ffield-000-1-view.jpg?exp=10800,2025-05-23T12:20:03+09:00,2025-05-23T12:20:03+09:00,ファイナンシャルフィールド,ffield,ファイナンシャルフィールド,1537,"夫婦の間に子どもはなく、妻の年収は850万円以下。「遺族年金」が「無期限」から「期限付き」になるって本当？厚生労働省の見直し案通りなら遺族年金はどう変わる？
これまで続いてきた遺族年金の制度では、条件によって受け取れる条件に男女の差や収入制限などがありました。こうした差を解消するため、遺族厚生年金の見直し案が提出されています。
 
そこで今回は、見直し案の内容や、見直し案で考えられている配慮措置などについてご紹介します。
▼年金「月15万円」を受け取っていた夫が死亡。妻は「遺族年金」をいくら受け取れる？
遺族年金はどう変わる？
遺族年金は遺族基礎年金と遺族厚生年金の2種類があります。このうち、見直しが検討されているのは遺族厚生年金です。日本年金機構によると、従来の遺族厚生年金では、以下の優先順位で遺族厚生年金を受け取れます。
 
1位：子どものいる配偶者
2位：子ども（年齢制限あり）
3位：子どものいない配偶者
4位：両親
5位：孫（年齢制限あり）
6位：祖父母
 
このうち、今回の見直し案で無期限から期限付きに変わるのは「子どものいない配偶者」とされていて、以下のような変更がなされる可能性があります。
 
【現在の制度】
・女性：30歳未満は5年間、30歳以上は無期限
・男性：55歳以上なら60歳から受給可能（例外あり）、55歳未満は対象外

【見直し案】
・男女ともに60歳未満は原則5年間
 
また、現在の制度では子どものいない妻で年収が850万円未満であることも条件でしたが、見直し案では収入条件がなくなっています。
 
見直し案が実現すると、子どものいない夫婦がおもに働いている夫または妻を亡くした際、配偶者が60歳未満であれば遺族年金を受け取れるようになるでしょう。一方で、5年間という期限付きになるため、もともと無期限で遺族厚生年金を受け取れる予定だった方は受取総額が大きく変わる可能性があります。
配慮措置も検討されている
5年という期限付きの見直しは、すべての人に適用されるわけではないようです。厚生労働省の資料によると、もし見直しが実現した場合でも、配慮が必要な方は5年を過ぎたあとも引き続き遺族厚生年金を支給されるとしています。資料によると、配慮が必要な例とは所得や障害の状況などで、認定方法などは表1の通りです。
 
表1
表1
※厚生労働省「遺族年金制度等の見直しについて②」を基に筆者作成
 
なお、これらの内容はあくまでも見直しのため、必ずしもこの通りになるとはいい切れません。また仮に改正が決まったとしても、実際に施行されるまでには時間がかかるでしょう。
遺族厚生年金が有期給付になり収入制限や男女の差がなくなるとされている
現在の遺族厚生年金では、子どもがいない方が受け取る場合に性別や妻の収入などによって受給の条件に差が生じています。こうした状態を改善するため、男女の差と収入制限を撤廃するという見直し案が提出されました。
 
見直し案では、こうした差が解消される代わりに、5年という有期給付になります。ただし、障害のある方や所得が低い方などは、65歳までなら5年を超えても受け取れる可能性があるでしょう。
 
今回の見直し案はあくまでも提案なので、確定したものではありません。今後遺族年金を受け取る可能性のある方は、定期的に厚生労働省のサイトなどで改正されているかをチェックするとよいでしょう。
 
出典
日本年金機構　遺族厚生年金（受給要件・対象者・年金額）
厚生労働省　遺族年金制度等の見直しについて②
 
執筆者：FINANCIAL FIELD編集部
ファイナンシャルプランナー
ファイナンシャルフィールド編集部",[],[]
「300平方メートル」の土地を親から相続予定→特例で「相続税の課税価格」を「減額」できると聞いたのですが、仮に「2000万円」程度だった場合、どのくらい安くなるのでしょうか？（ファイナンシャルフィールド）,https://news.yahoo.co.jp/articles/dc9a5098430b895b38f63adb6b3829b27e3d8968,https://newsatcl-pctr.c.yimg.jp/t/amd-img/20250523-00010015-ffield-000-1-view.jpg?exp=10800,2025-05-23T12:13:41+09:00,2025-05-23T12:13:41+09:00,ファイナンシャルフィールド,ffield,ファイナンシャルフィールド,1459,"「300平方メートル」の土地を親から相続予定→特例で「相続税の課税価格」を「減額」できると聞いたのですが、仮に「2000万円」程度だった場合、どのくらい安くなるのでしょうか？
親から土地を相続すると、土地の価格が相続財産として相続税の計算に加算されます。しかし、一定条件を満たしていれば、土地を相続したときに相続税の負担を軽減できる制度の対象になる可能性があるので、条件をチェックしておきましょう。
 
今回は、土地を相続したときに利用できる制度や、利用できる条件などについてご紹介します。
▼亡くなった母が私名義で「500万円」を遺してくれていた！ 名義は自分でも「相続税」はかかる？
土地を相続したときに利用できる制度とは
もし相続で土地を受け取った場合、亡くなった本人（以降「本人」）もしくは本人と同一生計だった親族がその土地に住んでいたり事業用として使っていたりした場合に適用される制度が「小規模宅地等の特例」（以下「特例」）です。条件を満たしていれば、相続税の計算時に一定金額を減額できます。
 
国税庁によると、減額割合は表1の通りです。
 
表1
表1
※国税庁「No.4124 相続した事業の用や居住の用の宅地等の価額の特例（小規模宅地等の特例）」より引用
 
もし相続した家の価値が2000万円で、亡くなった親と同居しており土地が300平方メートルだった場合、相続税の計算は80％減額された400万円から計算されることになります。
小規模宅地等の特例を利用できる条件
もし本人の親族で、住宅のために使われていた土地で特例を受けたい場合は、本人との関係によって条件が変わります。国税庁によると、関係性別の条件は以下の通りです。
 
・配偶者：無条件で適用
・本人の住宅に同居していた親族：相続が始まる直前から相続税の申告期限まで住宅に住み続け、住宅を申告期限まで持っている
 
上記のどちらにも該当しない親族は、以下すべての条件を満たす必要があります。
 
・外国に住んでいる場合は、日本国籍を有している
・本人に配偶者がいない
・相続が始まる直前に住宅に住んでいるほかの相続人がいない
・相続が始まる3年以前までの間に、相続する本人や本人の配偶者もしくは3親等内の親族、本人と関係ある一定の法人が持っている日本国内の住宅に住んだことがない
・相続が始まる時点で相続する人が住んでいる住宅をそれまで持っていたことがない
・該当の土地を相続が始まってから相続税の申告期限まで持っている
 
自分で判断がつかない場合は、専門家に相談した方がよいでしょう。
同一生計でその土地に住んでいるのなら80％軽減される可能性がある
土地を相続したときに利用できる可能性のある制度は「小規模時宅地等の特例」制度です。条件を満たしていれば、土地の価格の最大80％を相続税評価額から減額できる可能性があります。ただし、減額できる面積も上限が決まっているため、広い土地であれば全面積には適用されない場合もあります。
 
子どもが特例を利用するためには、親が亡くなる前から相続税の申告期限まで該当の土地に継続して住んでいることが基本的な条件です。自分で判断するのが難しい場合は、専門家への相談を検討しましょう。
 
出典
国税庁　No.4124 相続した事業の用や居住の用の宅地等の価額の特例（小規模宅地等の特例）
 
執筆者：FINANCIAL FIELD編集部
ファイナンシャルプランナー
ファイナンシャルフィールド編集部",[],[]
祖父母から大学の入学祝い「30万円」をもらった息子。仕送りを「月5万円」する予定ですが、税金の申告は必要ですか？ 非課税にするための方法とは？（ファイナンシャルフィールド）,https://news.yahoo.co.jp/articles/5da24cca5c1b47373e5a75169a1f8883ab951861,https://newsatcl-pctr.c.yimg.jp/t/amd-img/20250523-00010014-ffield-000-1-view.jpg?exp=10800,2025-05-23T12:13:30+09:00,2025-05-23T12:13:30+09:00,ファイナンシャルフィールド,ffield,ファイナンシャルフィールド,1851,"祖父母から大学の入学祝い「30万円」をもらった息子。仕送りを「月5万円」する予定ですが、税金の申告は必要ですか？ 非課税にするための方法とは？
大学入学は家族にとって大きな節目です。お祝いとして祖父母が孫にまとまったお金を渡したり、親が毎月仕送りをしたりすることもあるでしょう。しかし、ここで気になるのが「税金」の問題ではないでしょうか。
 
贈与税がかかるのでは？ と心配になる人もいるでしょう。贈与税は、一定額までの贈与なら非課税ですが、その一定額を超えると税金が発生します。また、ほかの贈与と合算すると課税対象になることもあります。
 
本記事では、贈与税の基本的な仕組みや、親が息子に30万円、自分たちが毎月仕送り5万円する場合を事例として、贈与税のかかり方やかからない工夫について解説します。
▼子ども名義の口座に「月3万円」ずつ入金してるけど、将来口座を渡すときに「贈与税」はかかるの？ 非課税にすることは可能？
贈与税の基本ルール
贈与税とは、「個人から個人へ財産を無償で渡す際に課される税金」です。

1年間（1月1日～12月31日）にもらった財産の合計額が110万円を超えると、超過分に対して贈与税がかかります。つまり、年間110万円以内の贈与であれば、原則として贈与税はかからず、申告は不要です。
祖父母からの「30万円」と仕送り月「5万円」で贈与税はかかる？
贈与税は1年間にもらう総額によって決まります。そのため、祖父母からの30万円に親からの仕送りの年間60万円（5万円×12ヶ月）を足しても合計90万円ですので、今回の場合は贈与税がかかりません。
 
そもそも、大学生の子どもを支援するための仕送りは、贈与税の対象にならないことが一般的です。その理由は、税法上、親が子どもの生活費や学費を負担することは 「扶養義務の範囲内」として認められているためです。
贈与税がかかる可能性がある場合
今回のケースでは、祖父母と親からもらうお金の合計が年間90万円ですので、贈与税はかかりません。
 
しかし、ほかにも息子が年内に追加でお金を贈与されると、贈与税がかかる可能性があります。例えば、親からの仕送りを生活費にあてたとしても、「祖父母からの30万円、ほかの親族から80万円をもらう」といったように、合計して110万円を超える金額の贈与がされた場合などです。
贈与税がかからないようにする工夫
祖父母や親から110万円を超えるお金をもらったとして、贈与税がかからないようにするにはどうすれば良いのでしょうか？ 2つの対策を見ていきます。

■対策1. 教育資金の一括贈与非課税制度を活用する
祖父母が孫の教育資金を援助する場合、「教育資金の一括贈与非課税制度」を利用すると、1500万円まで非課税になります。これは、大学の学費用などに充てる場合に適用される制度です。
 
ただし、この制度を利用するには、金融機関で教育資金口座を開設するなどの条件を満たし、その口座へ資金を入れる必要があります。

■対策2. 生活費や学費の用途を明確にする
贈与税がかからないためには、仕送りやお祝い金を「生活費」や「学費」に使うことが重要です。
 
例えば、もらったお金を株式投資や貯金などに回すと、単なる資産形成のための贈与とみなされ、贈与税の対象になる可能性があります。仕送りは確実に生活費や学費に使い、またその記録を残しておくと良いでしょう。
まとめ
今回のケースでは合計90万円を受け取ることになりますが、これは非課税枠である110万円を超えていないため、贈与税の申告は不要です。
 
ただし、同じ年内にほかの贈与を受け取ると、合計額が110万円を超える可能性があるため注意が必要です。ただし、仕送りは扶養義務の範囲内の金額であれば、贈与税の対象にはなりません。
 
また、教育資金の非課税制度を活用すれば、学費の負担を軽減しながら、より多くの資金を非課税で援助することも可能です。子どもが大学生になると、何かとお金がかかりますが、こうした税制をうまく活用しながら、賢く資金援助をしていきましょう。

出典
国税庁 No.4402 贈与税がかかる場合
国税庁 No.4405 贈与税がかからない場合
国税庁 No.4510 直系尊属から教育資金の一括贈与を受けた場合の非課税
 
執筆者：FINANCIAL FIELD編集部
ファイナンシャルプランナー
ファイナンシャルフィールド編集部",[],[]
