headline,mainEntityOfPage,image,datePublished,dateModified,author,media_en,media_jp,str_count,body,images,external_links
「1日1回」洗濯機を回す場合、「年間費用」はどれくらいかかるの？（ファイナンシャルフィールド）,https://news.yahoo.co.jp/articles/8af8a5326c033f418bb2cd178b7723963b5353df,https://newsatcl-pctr.c.yimg.jp/t/amd-img/20250523-00010033-ffield-000-1-view.jpg?exp=10800,2025-05-23T15:10:14+09:00,2025-05-23T15:10:14+09:00,ファイナンシャルフィールド,ffield,ファイナンシャルフィールド,2450,"「1日1回」洗濯機を回す場合、「年間費用」はどれくらいかかるの？
毎日の洗濯は、暮らしのなかで欠かせない習慣のひとつです。洗濯は基本的に毎日行うものだからこそ、年間にかかる費用が気になる方は多いでしょう。
 
月で見ると大したことないように思えても、年間を通して見ると思った以上の費用がかかっている可能性もあります。そこで本記事では、毎日洗濯を行う場合にかかる年間費用について解説します。
▼「シャワーだけ」vs「お湯をためる」1人暮らしはどっちがお得？ それぞれの水道代・ガス代を比較
毎日洗濯をする場合の年間費用
洗濯機は現在、国内外のメーカーから多種多様な製品が販売されていますが、大別するとドラム式洗濯機と縦型洗濯機の2種類です。
 
ここからは、洗濯機を回す場合の年間費用について、ドラム式洗濯機と縦型洗濯機の2パターンに分けて解説します。なお、一般的な洗濯には洗剤や柔軟剤を使用しますが、今回の費用計算では考慮していません。

■ドラム式洗濯機の場合
図表1は、パナソニック株式会社が公開しているデータから、ドラム式洗濯機における洗濯1回あたりの水道代や電気代などをまとめたものです。
 
なお、対象の製品は同社の「NA-LX129DL/R」というドラム式洗濯機です。洗濯1回あたりにかかる電気代や水道代は実際の製品によって異なるため、あくまで一例として参考にしてください。
図表1
出典：パナソニック株式会社「ドラム式と縦型 電気代・水道代の違い」より筆者作成
 
図表1の電気代は、全国家庭電気製品公正取引協議会が定める電力料金の目安単価31円/kWh（2023年7月現在）を基に算出しています。
 
水道料金や下水道使用料は各自治体によって異なりますが、図表1においては水道料金が1立方メートルあたり137円、下水道使用料が125円（税込み）で算出されています。
 
洗濯1回あたりにかかる費用は約24.4円ですから、毎日1回洗濯した場合の年間費用は約8906円になります。

■縦型洗濯機の場合
図表2は、図表1と同様にパナソニック株式会社が公開しているデータから、縦型洗濯機における洗濯1回あたりの水道代や電気代などをまとめたものです。
 
なお、対象の製品は同社の「NA-FA12V5」という縦型洗濯機です。縦型洗濯機もドラム式洗濯機と同様に、洗濯1回あたりにかかる電気代や水道代は製品によって異なります。
図表2
出典：パナソニック株式会社「ドラム式と縦型 電気代・水道代の違い」より筆者作成
 
図表2の電気代も図表1ドラム式洗濯機と同様に、全国家庭電気製品公正取引協議会が定める電力料金の目安単価である、31円／kWh（2023年7月現在）を基に算出しています。また、水道料金は1立方メートルあたり137円、下水道使用料は125円（税込み）での算出です。
 
洗濯1回あたりにかかる費用は約39.2円となっており、ドラム式洗濯機に比べると約1.6倍、14.8円の差があります。縦型洗濯機で毎日1回洗濯した場合の年間費用は約1万4308円です。ドラム式洗濯機と比較すると、年間では約5402円多くかかることになります。
洗濯費用を節約する方法
前述したドラム式洗濯機と縦型洗濯機における洗濯費用からは、電気代よりも水道代のほうに多くの費用がかかっていることが分かります。
 
ただし、ドラム式洗濯機には乾燥機能が付いていることが多いため、乾燥機能を併用する場合は、水道代よりも電気代のほうが高くなる可能性があります。乾燥機能を併用しないのであれば、基本的には水道代を抑えられるように意識することで、効率的な洗濯費用の節約が可能になるでしょう。
 
ここからは、洗濯費用を節約する方法を項目ごとに解説します。

■洗濯の回数を減らす
洗濯物の量が少なければ、複数回分の洗濯をまとめて行うことで節約になります。例えば、毎日1回洗濯していたものを2日に1回にまとめることで、洗濯にかかる年間費用を大幅に減らせる可能性があります。
 
ただし、洗濯回数を減らすために、一度に大量の洗濯物を洗濯しようとするのはやめましょう。洗濯機の洗浄力が低下して、汚れが落ちにくくなってしまいます。あくまでも洗濯機の洗濯容量を超えないようにし、多くても容量の8割程度にとどめておきましょう。

■すすぎ回数を減らす
洗濯機は一般的に、2回のすすぎを行います。すすぎ回数を1回に減らせば、その分だけ使用する水も減らせるため、水道代を大幅に節約できます。
 
すすぎ回数を1回にすると、衣類に洗剤が残らないか心配になる方もいるでしょう。製品にもよりますが、昨今の液体洗剤は泡切れがよいため、1回のすすぎで十分な場合があります。もし不安であれば、すすぎ回数が1回で十分な洗剤を使用するとよいでしょう。
洗濯機の利用方法を工夫して賢く節約しよう
洗濯にかかる費用は、洗濯機の種類などによって異なります。パナソニックの情報から試算すると、ドラム式洗濯機で洗濯1回あたりにかかる費用は約24.4円です。毎日1回洗濯した場合の年間費用は約8906円となります。
 
一方、縦型洗濯機で洗濯1回あたりにかかる費用は約39.2円です。毎日1回洗濯した場合の年間費用は約1万4308 円となり、年間費用としては約5402円の差が生じることも分かりました。
 
洗濯機の利用は日々の習慣を少し工夫するだけで、年間の支出を抑えられる可能性があります。まずは、自宅の洗濯スタイルを見直してみてはいかがでしょうか。

出典
パナソニック株式会社 ドラム式と縦型 電気代・水道代の違い
公益社団法人 全国家庭電気製品公正取引協議会 よくある質問 Q&A Q カタログなどに載っている電力料金の目安単価とは何ですか？
 
執筆者：FINANCIAL FIELD編集部
ファイナンシャルプランナー
ファイナンシャルフィールド編集部",[],[]
親から子どもへ車を譲りたいです。税金の支払いは「評価額」がいくらから必要でしょうか？（ファイナンシャルフィールド）,https://news.yahoo.co.jp/articles/3cacef294c58dda549b13149f07bd86cbf78d645,https://newsatcl-pctr.c.yimg.jp/t/amd-img/20250523-00010032-ffield-000-1-view.jpg?exp=10800,2025-05-23T14:40:03+09:00,2025-05-23T14:40:03+09:00,ファイナンシャルフィールド,ffield,ファイナンシャルフィールド,1776,"親から子どもへ車を譲りたいです。税金の支払いは「評価額」がいくらから必要でしょうか？
親から子へ資産を譲る際、一定の金額を超えると贈与税が発生します。高額なものであればあるほど贈与税は高くなりますが、車を譲る場合はどのような計算になるのか、気になる方もいるでしょう。
 
そこで本記事では、贈与税について解説します。親から子へ車を譲る際の贈与税の考え方についてもご紹介しますので、ぜひ参考にしてください。
▼子ども名義の口座に「月3万円」ずつ入金してるけど、将来口座を渡すときに「贈与税」はかかるの？ 非課税にすることは可能？
贈与税とは
贈与税は、個人から贈与により財産を得たときにかかる税金です。法人から贈与によって財産を得た場合は、贈与税ではなく所得税になります。
 
贈与税の計算は、その年の1月1日から12月31日までの1年間に贈与によって受け取った財産の価額を合計します。次に、その合計額から基礎控除額である110万円を差し引き、残った金額に税率をかけて贈与税の額を算出します。
 
なお、贈与税の申告と納税は、原則として財産を受け取った本人が行う必要があり、申告期間は財産を受け取った年の翌年2月1日から3月15日までです。
 
申告書の提出方法には、e－Taxを利用した電子申告のほか、郵送や信書便による送付、または税務署に設置されている時間外収受箱への投函などがあります。
 
申告期限までに申告をしなかった場合や、実際に受け取った額よりも少ない金額で申告した場合には、本来の税額に加えて加算税が課されることがあるため注意してください。また、納税の期限に遅れた場合には、遅れた税額に対して延滞税がかかるため、同じく注意が必要です。
親から子どもへの名義変更は贈与になる
親から子どもへ、車を譲り名義変更する場合も、110万円（基礎控除額）を超えていれば「贈与税」の対象になります。車の贈与に係る税金について詳しく解説します。
 
■親から子どもへ車を譲る場合
親から子ども（成人）へ車を譲る場合の贈与税は「特例贈与財産用」の速算表を使用します。

この速算表は、贈与を受けた年の1月1日時点で18歳以上の人が、父母や祖父母といった直系尊属から贈与を受けた場合の贈与税の計算に使うものです。「夫の父」などは直系尊属にはあたらないため、この速算表は使えません。
 
ただし、令和4年3月31日以前の贈与については、「18歳以上」ではなく「20歳以上」であることが条件となります。
 
特例贈与財産用の速算表を表1にまとめました。
 
表1
表1
出典：国税庁「タックスアンサー（よくある税の質問）No.4408 贈与税の計算と税率（暦年課税）」を基に筆者作成
 
■車の価値の考え方
車を譲る場合、まずは贈与する車の評価額を算出します。国税庁では、車は「一般動産」として扱われており、その評価は市場で実際に取引されている価格（売価実例価格）や、専門家による査定額（精通者意見価格）を基に行われます。
 
具体的には、中古車市場での販売価格や、買取業者に依頼して出してもらった査定額などが、評価額として使われるでしょう。
 
なお、名義変更をせずに、子どもが車を使えば贈与にはあたらないため贈与税はかからないとされています。ただし、車検や保険などの名義の確認は必要になるでしょう。
親から子どもへ車を譲った際、110万円以上の評価額なら贈与税がかかる
親から子どもに車を譲った際、車の評価額が110万円以上なら贈与税が発生します。親から子どもへの贈与において、子どもが18歳以上（令和4年3月31日以前の贈与は20歳以上）であれば、「特例贈与財産用」の速算表を使いましょう。
 
車の評価額は、市場で実際に取引されている価格（売価実例価格）や、専門家による査定額（精通者意見価格）を基に行われます。
 
なお、名義を変更せずに車を使えば、贈与税の対象ではありません。親子間でどのように車を使うのか話し合ってみるといいでしょう。
 
出典
国税庁　タックスアンサー（よくある税の質問）No.4408 贈与税の計算と税率（暦年課税）
 
執筆者：FINANCIAL FIELD編集部
ファイナンシャルプランナー
ファイナンシャルフィールド編集部",[],[]
「追いだき」は本当にお得なの？ 家計面でのメリットはあっても「衛生面」は大丈夫？（ファイナンシャルフィールド）,https://news.yahoo.co.jp/articles/54de0ada840d5cb4cdacbc1aae8d2a7592d76811,https://newsatcl-pctr.c.yimg.jp/t/amd-img/20250523-00010031-ffield-000-1-view.jpg?exp=10800,2025-05-23T14:30:03+09:00,2025-05-23T14:30:03+09:00,ファイナンシャルフィールド,ffield,ファイナンシャルフィールド,2218,"「追いだき」は本当にお得なの？ 家計面でのメリットはあっても「衛生面」は大丈夫？
お風呂の追いだき機能は、何度もお湯を張り直す手間が省ける便利な機能です。光熱費や水道代の節約になるという声も多く、家計管理の味方として重宝されています。
 
しかし一方で、「同じお湯を使い続けて衛生面は大丈夫？」と気になる方もいるでしょう。
 
本記事では、そもそも追いだきとは何か、そして水道代を節約するためのポイントについて解説していきます。
▼「シャワーだけ」vs「お湯をためる」1人暮らしはどっちがお得？ それぞれの水道代・ガス代を比較
追いだきとは
浴槽に張ったお湯が冷めてしまった場合、そのお湯を給湯器に戻して温め直し、再び浴槽に戻す機能を「追いだき」といいます。簡単にいえば、差し湯をせずに浴槽のお湯を温める機能です。
 
追いだきの最大のメリットは、いつでも適温のお風呂に入れることです。浴槽にお湯を張ったものの、家事や育児などで、すぐにはお風呂に入れないこともあるでしょう。その場合でも、追いだき機能があれば差し湯やお湯の交換をせずに、適温のお風呂に入ることができます。
 
また、複数人で生活していると、2人目以降の人がお風呂へ入るころにはお湯が冷めてしまっていることも少なくありません。こうした場合でも、追いだき機能を使えば、差し湯やお湯の交換をせずに適温のお風呂に入れます。
 
一方で、一人暮らしでお湯を張ってすぐにお風呂へ入れるのであれば、追いだき機能は必要ないと思うかもしれません。
 
しかし、半身浴などで長風呂をしたい場合にも追いだき機能は役立ちます。半身浴をしていると、次第にお湯がぬるくなってきます。必要以上に低い水温のお風呂に入ると体調を崩してしまう可能性があるため、一人暮らしでも追いだき機能が役立つ場面はあるのです。
 
■追いだきはお得？
追いだきは、冷めたお湯を温め直す機能です。差し湯のように新しくお湯を足したり、お湯を交換したりする必要がありません。新たな水を使わないため、水道代はかかりません。差し湯やお湯の交換に比べて、ガス代または電気代のみで浴槽のお湯を温め直せるため、トータルでお得になるケースが多いでしょう。
 
■追いだきの衛生面
追いだき機能の基本的な構造は、冷めたお湯を「追いだき配管」を通して浴槽と給湯器の間を循環させることで温め直すものです。はじめに浴槽へお湯を張る際、そのお湯は「給湯管」を通りますが、追いだきの際には追いだき配管のみを使用します。そのため、通常は汚れやゴミなどが給湯管に混ざることはありません。
 
ただし、追いだき配管には汚れや雑菌などが残る可能性があることから、定期的な掃除が必要不可欠です。掃除を怠ると、追いだき配管で繁殖した雑菌などによってお湯が汚れてしまう恐れがあります。
 
また、長時間放置したお湯を追いだきして入浴する場合、衛生面に注意が必要です。一晩以上経過したお湯には、大量の細菌が繁殖していることも少なくなく、特に夏場ではお湯の温度が下がりにくいことから、細菌が繁殖しやすい環境になります。
 
例えば、高齢者や乳幼児、免疫力が低下している人に感染して肺炎などの症状を引き起こすレジオネラ菌を繁殖させてしまう可能性もあるのです。
水道代を節約する方法
追いだきを利用する以外にも、水道代を節約する方法はあります。お風呂以外の水の使用にも目を向けて実践することで、より効果的に水道代を節約できるでしょう。なお、水道代の節約方法における基本は水を出しっぱなしにしないことです。
 
ここからは、水道代を節約する方法を項目ごとに解説します。
 
■節水できるシャワーヘッドを導入する
節水できるシャワーヘッドを導入すれば、水の使用量を抑えることができます。節水率は製品によって異なりますが、50％ほど節水できる製品もあるので、その分水道代を節約できます。そのため、初期費用はかかりますが、将来的には大きな節約が期待できます。
 
なお、多くの節水シャワーヘッドは水量を減らしても水圧を維持する設計ですが、使い心地は製品によって異なります。
 
■洗濯はまとめて行う
洗濯機は、使用するたびに水道代と電気代がかかります。可能なかぎりまとめて洗濯をすることで洗濯回数を減らせば、その分だけ電気代と水道代を節約できます。ただし、洗濯物の量が洗濯機の容量を超えないように注意してください。
差し湯やお湯の交換に比べるとお得
追いだきとは、冷めたお湯を給湯器で温め直して、再び浴槽に戻す機能のことです。差し湯やお湯の交換とは違って新たな水を使わない分、水道代がかからないためお得といえるでしょう。
 
追いだき時には、お湯が追いだき配管を通って給湯器と浴槽を行き来するため、追いだき配管は定期的な掃除が必要です。掃除を怠ると、追いだき配管で繁殖した雑菌によって、浴槽のお湯が汚れてしまいます。また、長時間放置したお湯は大量の細菌が繁殖している可能性があります。
 
追いだき管などの衛生状況次第ですが、当日中のお湯を追いだきする場合はそれほど気にする必要はありません。しかし、前日の残り湯を追いだきして入浴に使うことは避けたほうが賢明でしょう。
 
執筆者：FINANCIAL FIELD編集部
ファイナンシャルプランナー
ファイナンシャルフィールド編集部",[],[]
転勤で今の部屋から引っ越し！→管理会社に「壁紙の色が落ちているから」と、10万円を請求された！ 経年劣化でも払う必要はあるの？「原状回復の費用負担」について解説（ファイナンシャルフィールド）,https://news.yahoo.co.jp/articles/639e066ad082e79e7700a4562617845b5ebf6cb7,https://newsatcl-pctr.c.yimg.jp/t/amd-img/20250523-00010030-ffield-000-1-view.jpg?exp=10800,2025-05-23T14:10:11+09:00,2025-05-23T14:10:11+09:00,ファイナンシャルフィールド,ffield,ファイナンシャルフィールド,1796,"転勤で今の部屋から引っ越し！→管理会社に「壁紙の色が落ちているから」と、10万円を請求された！ 経年劣化でも払う必要はあるの？「原状回復の費用負担」について解説
春には転勤などによって引っ越しをする人が多くいます。

引っ越し時には原状回復をして出ていくのが基本ですが、本当に自分がその修繕費を支払うべきか疑問を感じる人もいるでしょう。
 
例えば、管理会社から壁紙の色が落ちているといわれたときには、賃借人に壁紙を張り替えるための費用負担が発生するのでしょうか。
 
本記事では、引っ越し時の原状回復に関する費用負担などについて解説するので、気になる人は参考にしてください。
▼アパートの1階と2階で「家賃」はどれだけ変わる？ 1階暮らしのメリット・デメリットも紹介
原状回復のガイドラインに沿って費用がどうなるか決まる？
退去時に賃借人に費用負担があるときには、敷金から清算されます。その中に原状回復費用が含まれるケースも多いです。この原状回復をめぐって、退去時にトラブルに発展したり、自分が思っていたよりも高額が請求されたりすることも珍しくありません。
 
こうした事態を受け、国土交通省は、原状回復ガイドラインを公表しています。原状回復義務は、「経年劣化・自然損耗」なのか、「善管注意義務違反・故意・過失・その他」なのかが重要です。
 
原状回復のガイドラインでは、基本的な考え方として、通常通り生活をしていて経年劣化するのは賃借人の責任ではないので、原状回復費用を支払う必要がないとしています。
 
一方、明らかに通常の使用方法ではない使い方で損耗・毀損（きそん）した場合、原状回復は賃借人がおこなわなければなりません。
 
社会通念上要求される程度の注意を払って建物を使っていても、経年劣化は避けられないため、賃借人の故意や過失によるケース以外では、賃貸人が費用負担をします。後からの問題やトラブルを避けるため、入居時にキズや状態の確認を賃借人と賃貸人の立ち合いでおこないましょう。
普通に生活をしていて壁紙が経年劣化した場合は賃借人に責任はない
普通に生活をしていて壁紙が経年劣化によって色が落ちた場合、賃借人には責任はないといえます。このような経年劣化を修理するための費用は、普段から支払っている家賃に含まれているという考え方です。
 
経年劣化によるほかのものでは、寿命によって機器が故障する、家具の設置によって生じた床やカーペットのへこみ、テレビや冷蔵庫の後部壁面の電気ヤケなどがあります。
 
また、次の入居者確保のためにおこなうフローリングのワックスがけや、ハウスクリーニング、破損していないものの交換なども賃借人に負担責任はありません。
 
管理会社などから請求されると、自分が支払う必要があると感じるかもしれませんが、経年劣化に関するものは責任がないことは理解しておきましょう。
通常の使用と認められないときには原状回復費用の支払いが発生する
原状回復のガイドラインにおいて賃借人に責任がないと判断されるのは、あくまでも普通に生活をしている場合です。そのため、普段からの使い方や汚れた原因によっては、原状回復費用の支払いが発生します。
 
不注意によって発生させたキズや色落ち、カーペットに飲み物をこぼしてできたシミ、日常の清掃を怠った結果として油汚れが固着する、クーラーからの水漏れを放置してカビが発生するなどです。
 
ほかにも、室内に匂いがついているケースも通常の使用と認められない可能性があります。ペットの匂いや、タバコの匂いなどが対象になります。住んでいる人はそこまで臭わないと思っていても、第三者からすると強い臭いを感じることは珍しくありません。
まとめ
引っ越しをするときには、原状回復のガイドラインを参考にしながら、本当に自分が負担する必要があるのかを判断することが大切です。基本的には、経年劣化によるものは責任が生じず、通常の使用を超えたものには責任が生じます。
 
引っ越し時にどれくらいの原状回復費用がかかるかを確認する際は、具体的な内容について聞いておきましょう。

出典
一般社団法人全国賃貸不動産管理業協会 原状回復基礎知識
 
執筆者：FINANCIAL FIELD編集部
ファイナンシャルプランナー
ファイナンシャルフィールド編集部",[],[]
