headline,mainEntityOfPage,image,datePublished,dateModified,author,media_en,media_jp,str_count,body,images,external_links
地方銀行に就職した娘。年収は都市銀行とどのくらい違うのでしょうか？（ファイナンシャルフィールド）,https://news.yahoo.co.jp/articles/e48a9e4454f7a10f9b056a021cf1997f5f30559b,https://newsatcl-pctr.c.yimg.jp/t/amd-img/20250523-00010025-ffield-000-1-view.jpg?exp=10800,2025-05-23T13:40:03+09:00,2025-05-23T13:40:03+09:00,ファイナンシャルフィールド,ffield,ファイナンシャルフィールド,1865,"地方銀行に就職した娘。年収は都市銀行とどのくらい違うのでしょうか？
日本には数多くの金融機関が存在します。その中には「都市銀行」と呼ばれている金融機関や「地方銀行」と呼ばれている金融機関が存在します。
▼会社員で「年収1000万円」以上の割合は？ 大企業ほど高年収を目指せる？
一般的に都市銀行の方が事業展開をしている規模が大きいですが、それゆえに「都市銀行と地方銀行との間に年収差があるかもしれない」と考える人もいるでしょう。

今回のケースでは地方銀行に就職した娘の収入を親が気にしているようです。本記事では都市銀行と地方銀行の年収差を「有価証券報告書」を基にまとめました。
都市銀行と地方銀行の違い
都市銀行は大都市を本拠地に、全国的に展開する銀行です。金融庁によれば、具体的には以下のような金融機関が該当します。

●株式会社みずほ銀行
●株式会社三井住友銀行
●株式会社三菱UFJ銀行
●株式会社りそな銀行

一方、地方銀行とは、全国にある大都市や中規模都市を本拠地とし、おもに本店がある都道府県内を営業基盤とする銀行のことで、「一般社団法人全国地方銀行協会」に加盟しています。

同じく金融庁によれば、具体的には以下のような金融機関が挙げられます。

●株式会社北海道銀行
●株式会社千葉銀行
●株式会社群馬銀行　など

一般社団法人全国地方銀行協会によれば、2025年1月現在、全部で61の地方銀行が存在します。

なお地方銀行には「第二地方銀行」と呼ばれる金融機関もあります。地方銀行同様、地域密着型の銀行ですが、旧相互銀行から普通銀行に転換した銀行を指します。「一般社団法人第二地方銀行協会」に加盟しており、2025年5月時点で36行が加盟中です。
都市銀行と地方銀行の年収を比較
ここからは、都市銀行と地方銀行に勤める従業員の給与状況について解説します。有価証券報告書を基にそれぞれ2行を比較し、年収差を見ていきましょう。
 
なお有価証券報告書は2024年3月期のものをベースとしています。
 
■都市銀行の年収
都市銀行は「株式会社みずほ銀行」と「株式会社三菱UFJ銀行」の2行を例にします。両行の従業員数や従業員の平均年齢、勤続年数とともに、平均年間給与を表1にまとめました。
 
表1
表1
※筆者作成
 
株式会社みずほ銀行と株式会社三菱UFJ銀行の平均年間給与はおおむね同じ水準のようです。両行とも800万円台となっています。
 
■地方銀行の年収
地方銀行は「株式会社千葉銀行」と「株式会社群馬銀行」の2行を例にします。両行の従業員数や従業員の平均年齢、勤続年数とともに、平均年間給与を表2にまとめました。
 
表2
表2
※筆者作成
 
株式会社千葉銀行と株式会社群馬銀行では43万円の年収差がありました。株式会社群馬銀行は平均勤続年数が株式会社千葉銀行より長く、平均年齢も3歳ほど上回っていますが、株式会社千葉銀行の方が平均では高い年収を得ています。
都市銀行と地方銀行の年収差は約50万円～90万円
表1表2より、都市銀行2行と地方銀行2行の年収差は、約50万円～90万円でした。月ベースでは4万円～7万円ほどです。
 
ただし都市銀行の間、あるいは地方銀行の間で多かれ少なかれ年収差があるため、必ずしも地方銀行で働く従業員が都市銀行の従業員よりも低い給料をもらっているとは限りません。
 
年齢や勤続年数、役職などによって左右される可能性があるため、地方銀行勤めの人が都市銀行勤めの人より多く稼いでいるケースも中にはあると思われます。
都市銀行の方が数十万円年収が高い可能性がある
今回行った比較においては、都市銀行の平均年収が地方銀行の平均年収よりも高い結果になりました。
 
ただし年収は個々人によって異なります。同じ都市銀行あるいは地方銀行勤めでも、年齢や勤続年数などの要素によって差が出ます。
 
今回のケースで地方銀行に就職した娘が、都市銀行に就職した同年齢の新入行員よりも多く稼ぐこともあり得ない話ではないでしょう。
 
出典
金融庁 銀行免許一覧（都市銀行・信託銀行・その他）（1ページ、6ページ）
一般社団法人全国地方銀行協会 地方銀行を知ろう Q1 地方銀行と、メガバンクや第二地方銀行との違いは何ですか。
一般社団法人第二地方銀行協会 加盟地方銀行について
 
執筆者：FINANCIAL FIELD編集部
ファイナンシャルプランナー
ファイナンシャルフィールド編集部",[],[]
不動産を相続する際に必要な「相続登記」は昨年4月から義務に！ 相続登記に費用はかかる？（ファイナンシャルフィールド）,https://news.yahoo.co.jp/articles/bfb34481121cdb8ee19a5a928459bae39001db7d,https://newsatcl-pctr.c.yimg.jp/t/amd-img/20250523-00010024-ffield-000-1-view.jpg?exp=10800,2025-05-23T13:30:18+09:00,2025-05-23T13:30:18+09:00,ファイナンシャルフィールド,ffield,ファイナンシャルフィールド,2124,"不動産を相続する際に必要な「相続登記」は昨年4月から義務に！ 相続登記に費用はかかる？
土地や建物を相続した際、相続登記が義務になりました。相続登記を忘れてしまうと、罰金が発生する可能性もあるようです。
 
そこで本記事では、相続登記の義務化について、また、かかる費用をご紹介します。違反した際に発生する罰金についても解説するので、ぜひ参考にしてください。
▼亡くなった母が私名義で「500万円」を遺してくれていた！ 名義は自分でも「相続税」はかかる？
相続登記は不動産登記簿の名義変更
「相続登記」とは、相続によって取得した土地や建物について、不動産登記簿の名義を被相続人（亡くなった方）から相続人へ変更する手続きです。この手続きは、自動的に行われるものではなく、相続人が自ら法務局に申請する必要があるため注意してください。
 
相続登記は、不動産を取得した相続人が単独で申請する場合と、複数の相続人が共同で申請する場合があります。いずれの方法でも、法務局に必要書類をそろえて提出することで名義の変更が可能です。
 
また、相続人自身が手続きを行う代わりに、司法書士や弁護士に依頼して代行してもらうこともできます。手続きに不安がある場合や、相続関係が複雑な場合は、専門家のサポートを受けることで安心して進めることができるでしょう。
 
なお、司法書士や弁護士以外の者が報酬を得てこの手続きを代行することは、法律で禁止されています。依頼する際は、資格を持った専門家であるかどうかの確認が必要です。
 
■一般的な手続きの流れ
相続登記は、一般的に次のような手順で行われます。ただし、相続内容や不動産の状況によって手続きが異なる場合もあるため、状況に応じて確認が必要です。

1.不動産の特定と相続人の確認：相続する土地や建物を特定し、法定相続人の範囲を戸籍などで確認します。

2.遺産分割協議と書面の作成：相続人全員で財産をどのように分けるかを話し合い、その内容を「遺産分割協議書」として文書化します。

3.申請書と必要書類の準備：相続登記申請書を作成し、必要な添付書類（被相続人の戸籍証明書、住民票除票の写し、相続人の戸籍証明書や住民票の写しなど）をそろえます。

4.法務局への申請：準備が整ったら、不動産の所在地を管轄する法務局に申請します。申請方法は、窓口への持参、郵送、またはオンライン申請から選ぶことができます。ただし、オンライン申請の場合は、後日に書面で作成された添付情報を法務局へ持参（郵送）しなければなりません。

■相続登記にかかる費用
相続登記を行う際には、不動産の評価額や手続きの内容に応じて、いくつかの費用が発生します。主な費用を表1にまとめました。
 
表1
表1
出典：法務省民事局「登記申請手続のご案内」を基に筆者作成
 
これらの費用がかかることを踏まえて、相続登記の準備を進めることが大切です。特に登録免許税は不動産の価値に比例するため、高額になる場合もありますので注意しましょう。
令和6年4月から義務化。違反すると罰金も
令和6年4月1日から、相続登記が義務化されました。その背景や注意点について解説します。
 
■義務化された背景
登記簿を見ても所有者が分からない「所有者不明土地」が全国で増加しています。こうした土地は適切な管理がされずに放置されることが多く、周辺環境の悪化を招いています。
 
また、土地の所有者を特定するためには、多大な時間と費用がかかることがあり、結果として民間での土地取引や公共事業の円滑な実施を阻害する原因にもなっています。
 
このような問題を解消するため、令和3年に関連する法律が改正され、これまで任意とされていた相続登記が義務化されることになりました。
 
■義務化にあたっての注意点
義務化の際に定められたことに、相続登記の期日があります。
 
具体的には、不動産を相続したことを知った日から3年以内に相続登記を行うことが義務付けられました。正当な理由なくこの義務に違反した場合には、10万円以下の過料が科される可能性があります。
 
なお、この義務化は過去の相続にも適用されます。義務化される前に相続が発生していた場合でも、その不動産について相続したことを知っていた場合は、令和9年3月末までに登記を済ませる必要があるため注意してください。
「相続登記」は令和6年4月より義務化された。相続登記の費用は固定資産税評価額により異なる
相続登記は令和6年4月より義務化されています。相続登記を怠ると10万円以下の過料が科される可能性があるため、注意してください。
 
また、相続登記を行う際の費用は「固定資産税評価額」の0.4％となっています。各種証明書の取得費用や、専門家に依頼した場合は報酬も発生します。これらの費用がかかることを踏まえて、相続登記の手続きを進めましょう。
 
出典
法務省民事局　登記申請手続のご案内（相続登記（1）／遺産分割協議編）
 
執筆者：FINANCIAL FIELD編集部
ファイナンシャルプランナー
ファイナンシャルフィールド編集部",[],[]
自転車での「ながらスマホ」で罰金10万円？ 講習不参加だと、さらに「5万円」の罰金に？ 2026年4月には“青切符”も導入！ 罰則内容を確認（ファイナンシャルフィールド）,https://news.yahoo.co.jp/articles/1d458a11a612afc996ddcbb653e9f4bd62d90539,https://newsatcl-pctr.c.yimg.jp/t/amd-img/20250523-00010023-ffield-000-1-view.jpg?exp=10800,2025-05-23T13:30:10+09:00,2025-05-23T13:30:10+09:00,ファイナンシャルフィールド,ffield,ファイナンシャルフィールド,1850,"自転車での「ながらスマホ」で罰金10万円？ 講習不参加だと、さらに「5万円」の罰金に？ 2026年4月には“青切符”も導入！ 罰則内容を確認
自動車を運転中にスマートフォンを操作する、いわゆる「ながらスマホ」は道路交通法違反です。特に、ながらスマホをしながら事故を起こすと免許停止になる恐れもあり、罰則が厳しくなっています。
 
そして、このながらスマホですが、自動車だけでなく自転車でも罰則が厳しくなりました。そこで本記事では、自転車を運転中にながらスマホをした場合の罰則が厳しくなっている点を解説していきます。
 
2026年4月からは青切符も導入される予定となっていることにも触れるので、自転車の交通ルールについて確認していきましょう。
▼ハンズフリー通話での運転は「違反」になる？ ペナルティが発生する場合についても解説
ながらスマホが厳罰化
令和6年11月から、自転車の運転中にスマートフォンを操作した場合の罰則が厳しくなっています。

具体的には、新たに「自転車運転中にスマートフォンを手で持って通話する行為」「自転車運転中にスマートフォンの画面を注視する行為」が罰則の対象となりました。
 
また、これらのながらスマホをした場合、違反者は6ヶ月以下の懲役または10万円以下の罰金、事故を起こすなどすると「1年以下の懲役」または「30万円以下の罰金」といった罰則が適用されます。
 
ながらスマホを原因とした交通事故が増加傾向にあることから、このような罰則強化につながったようです。
講習を受講しなかった場合は罰金
自転車運転中のながらスマホをした場合は、「自転車運転者講習制度」の対象となる可能性もあります。自転車運転者講習制度は、自転車の運転で危険な違反行為を3年以内に2回以上行った違反者が講習の対象となる制度です。
 
対象者は「自転車運転者講習受講命令書」を交付され、3ヶ月以内に自転車運転者講習を受講しなければいけません。受講時間は3時間、手数料は6150円です。時間とお金がかかるため、受講が難しい人もいるかもしれませんが受ける必要があります。
 
受講しなかった場合は、5万以下の罰金になります。ながらスマホの罰金が最大で10万円、さらに講習に参加しなかった場合が最大で5万円なので、15万円も支払わなければいけなくなる可能性があるのです。
2026年4月からは青切符制度が導入
自転車の罰則強化は今後も継続していくことが予定されています。
 
例えば、警察庁は4月24日、自転車の交通違反に交通反則切符（青切符）を導入する改正道路交通法を、2026年4月1日に施行する方針を明らかにしています。青切符は違反行為をした対象者に交付されるもので、反則金の納付が義務付けられます。
 
反則金を納付しなかった場合は、裁判を受けることになります。反則金を納付することで、裁判を受けなくてもよくなる制度です。
 
警察庁は、5月25日までパブリックコメント（意見公募）を実施し、これを受けて反則金の金額などは道交法施行令を改正して定める方針です。
 
現在、警察庁が示している違反行為と反則金の例としては、携帯電話使用（ながら運転）1万2000円、信号無視6000円、逆走や歩道通行などの通行区分違反6000円一時不停止5000円などです。
 
なお、自動車などの場合、青切符を切られると違反点数も付与されます。違反点数は過去3年間の累積点数に応じて免許証の色や停止、取り消しといった処分が決定される制度です。ただし、自転車には免許証がないため、違反点数が付与されることはありません。
交通規則を確認しましょう
自転車の交通事故は増加傾向にあり、特にながらスマホは前方不注意や一時不停止につながるため、大変危険な行為です。そのため自転車交通違反の厳罰化によって交通事故や交通違反の減少が期待されています。
 
スマートフォンを使用する際は必ず自転車を停止させる、といった基本的なルールを徹底することが重要です。新たな交通規則を確認し、しっかりと守るようにしましょう。

出典
警視庁 令和6年11月1日道路交通法の改正
警視庁 自転車運転者講習制度の概要等
広島県警察本部 自転車に関する道路交通法の改正
e-Govパブリック・コメント 参考資料（自転車反則行為一覧）
 
執筆者：FINANCIAL FIELD編集部
ファイナンシャルプランナー
ファイナンシャルフィールド編集部",[],[]
母が祖母から受け継いだ“純金のネックレス”を結婚祝いとしてもらいました。金の高騰で「110万円」を超えるようなのですが、税金の支払いは必要ですか？（ファイナンシャルフィールド）,https://news.yahoo.co.jp/articles/44483c4cf7565d124b0e64bd38cf97b29bb3d0b2,https://newsatcl-pctr.c.yimg.jp/t/amd-img/20250523-00010022-ffield-000-1-view.jpg?exp=10800,2025-05-23T13:20:03+09:00,2025-05-23T13:20:03+09:00,ファイナンシャルフィールド,ffield,ファイナンシャルフィールド,1958,"母が祖母から受け継いだ“純金のネックレス”を結婚祝いとしてもらいました。金の高騰で「110万円」を超えるようなのですが、税金の支払いは必要ですか？
近年、金の価格が高騰しています。以前購入した金製品の価格が、現在では倍以上になっていることも珍しくありません。結婚のお祝いとして母が祖母から受け継いだ純金のネックレスを譲り受けた場合、その評価額が110万円を超えていたら税金の支払いが必要なのか気になるという方もいるでしょう。
 
そこで今回は、贈与で受け取った金品の課税対象となるケース、贈与税の申告方法について解説します。
▼子ども名義の口座に「月3万円」ずつ入金してるけど、将来口座を渡すときに「贈与税」はかかるの？ 非課税にすることは可能？
結婚祝いで受け取った110万円を超える「純金のネックレス」は贈与税の対象となるのか？
個人から受け取った財産が年間で110万円を超える場合には贈与税の申告が必要になります。1月1日から12月31日までの1年間に受け取った財産の合計額が110万円を超えた場合、超過分に対して贈与税がかかる仕組みです。
 
ただし、110万円を超えるすべての贈与に税金がかかるわけではありません。贈与税がかからない財産にはいくつかのケースがあります。国税庁によれば、個人から受け取る香典・花輪代・年末年始の贈答・祝物・見舞いなどのための金品はそのひとつです。

ただし、このような金品は社会通念上相当（一般的な社会常識や慣習からみて妥当）と認められるものに限定されています。あまりにも高額な場合などは、贈与税の課税対象とみなされる可能性があるというわけです。
 
そのため、今回のケースのように結婚祝いのような慶事であっても、一定の価値を超える贈与には税金がかかる可能性があるといえます。
購入時の価格が110万円以下であれば贈与税の対象にならないのか？
贈与税の対象となるかどうかは、贈与を受けた時点の財産の評価額によって決まります。ネックレスのような金製品は、地金価格×グラム数×金の含まれている割合（24金の場合は1、18金の場合は0.75、14金の場合は0.58をかけて）算出するようです。
 
例えば、18金ネックレス（重さ50グラム）の贈与時の金相場が1グラムあたり8000円だった場合、その評価額は約30万円となる計算です。金製品の具体的な評価額を把握するためには、受け取った製品の素材・重量・金の価格相場などを基に計算する必要があります。
 
また、同じ年に母から現金やそのほかの財産も贈与されていた場合、それらを合算して110万円を超えるかどうかを判断しなければなりません。
 
今回のように純金（24金）のネックレスを受け取った場合、問題となるのは贈与された時点での価格です。仮に購入時は50万円だったネックレスであっても、受け取った時点での金の価格で評価した結果、110万円を超えていれば課税対象となる可能性があるでしょう。
贈与税の申告方法について
では次に、贈与税の申告方法を見ていきます。
 
1年間に受け取った財産が110万円を超える場合には、財産を受け取った翌年の2月1日から3月15日までに贈与税の申告と納税が必要です。
 
申告には贈与税の申告書に加えてマイナンバーの記載や、運転免許証などの本人確認書類が必要になります。また、配偶者控除の特例や相続時精算課税の適用を受ける場合など、申告内容によって添付書類は異なります。いざ申告する際に慌てないよう、あらかじめ確認しておくと安心です。
 
また、作成した申告書類は、e-Tax（電子申告）、郵便、税務署へ持参するなどの方法で提出できます。
社会通念上相当と認められる範囲であれば非課税｜課税対象となる場合、純金のネックレスをもらった時点の価値が110万円を超えるときは課税される可能性がある
純金のネックレスを受け取った場合、贈与を受けた時点での価値が110万円を超えていれば贈与税の対象となる可能性があります。贈与税はもらった時点の評価額で判断されるため、購入当初の価格ではなく贈与された時点での相場を基に確認することが重要です。
 
ただし、個人から受け取る香典・花輪代・年末年始の贈答・祝物・見舞いなどのための金品で社会通念上相当と認められるものには、贈与税はかからないとされています。贈与税に関して判断に迷う場合や不安なときは、お近くの税務署や税理士などの専門家に相談すると安心です。
 
出典
国税庁 タックスアンサー（よくある税の質問） No.4405 贈与税がかからない場合
 
執筆者：FINANCIAL FIELD編集部
ファイナンシャルプランナー
ファイナンシャルフィールド編集部",[],[]
