headline,mainEntityOfPage,image,datePublished,dateModified,author,media_en,media_jp,str_count,body,images,external_links
日本で一番多い年齢層は「50代」って本当？　 ボリューム層の平均年収についても解説（ファイナンシャルフィールド）,https://news.yahoo.co.jp/articles/393337de76abe04973e67a5910afab9ba6ac61b2,https://newsatcl-pctr.c.yimg.jp/t/amd-img/20250523-00010009-ffield-000-1-view.jpg?exp=10800,2025-05-23T11:33:14+09:00,2025-05-23T11:33:14+09:00,ファイナンシャルフィールド,ffield,ファイナンシャルフィールド,1958,"日本で一番多い年齢層は「50代」って本当？　 ボリューム層の平均年収についても解説
日本の人口構成は年々変化しており、特に中高年層の割合が増えています。特に、50代は最も多い年齢層といわれていますが、実際のデータではどうなのでしょうか。
 
本記事では、日本のボリュームゾーンとなる年齢層について解説するとともに、その平均年収や経済状況についても掘り下げていきます。
▼会社員で「年収1000万円」以上の割合は？ 大企業ほど高年収を目指せる？
日本の年齢構成
日本の人口構成は年々変化しており、少子高齢化が進んでいます。総務省の統計によると、近年では特定の年齢層に人口が集中する傾向が見られ、そのなかでも50代が特に多いといわれています。
 
総務省統計局による「令和2年国勢調査」のデータを見ると、日本の人口分布において50代は確かに大きなボリュームゾーンを形成しています。特に団塊ジュニア世代（1971〜1974年生まれ）がこの年代に差しかかっているため、人口比率が高くなっているのです。
 
また、高齢化が進むなかで、60代以上の人口も増えており、今後は50代よりも高齢層の割合が高まることが予想されます。したがって、現在の時点では50代が最多の年齢層ではあるものの、長期的にはシニア層が日本社会の主流になっていく可能性が高いといえるでしょう。
50代の平均年収
50代は日本の労働市場において中堅・ベテラン層にあたり、管理職や専門職として活躍する人も多い年代です。そのため、平均年収も比較的高めになる傾向があります。
 
厚生労働省の「令和6年賃金構造基本統計調査」によると、男性で50～54歳の平均賃金は月42万8200円（年513万8400円）、55～59歳が月44万4100円（年532万9200円）であるのに対し、女性は50～54歳が月29万5400円（年354万4800円）、55～59歳が月29万4000円（年352万8000円）です。

依然として、男女差が大きいことが浮き彫りとなっていることが分かります。
 
さらに、雇用形態によっても収入に差があり、正社員として働く場合と非正規雇用では年収が大きく異なります。50代になると役職や勤務年数によって収入が変わるため、個人のキャリアによっても収入のばらつきが出るのが特徴です。
50代の家計事情
50代は収入のピークを迎える一方で、支出も多くなる年代です。特に、子どもの教育費や住宅ローン、老後資金の準備など、多くの人が家計のやりくりに苦労する時期です。
 
50代の平均的な支出は住宅ローンや教育費、老後に向けた貯蓄などの項目が大きな割合を占めています。
 
特に、教育費は家計を圧迫する要因の一つであり、私立大学や海外留学を考える場合、さらなる負担増となる恐れがあります。そのため、50代のうちに老後資金の確保をどれだけ進められるかが、今後の生活の安定に直結するといえるでしょう。
今後の日本社会と50代の役割
日本の労働市場において、50代は長年の経験とスキルを生かして活躍する重要な世代です。しかし、近年では定年延長や再雇用制度が進み、50代以降の働き方にも変化が見られます。
 
定年延長・再雇用の活用や副業・フリーランスなど本業以外からの収入源の確保、キャリアの再構築といった新しい働き方が注目されています。また、人生100年時代といわれるなかで、健康寿命を延ばすことも重要です。特に、健康管理や資産運用について50代のうちから意識しておくことが、今後の安定した生活につながるでしょう。
50代のボリュームゾーンとしての影響力に今後も注目しよう
現在の日本社会において、50代は最も多い年齢層であり、経済活動の中心を担う重要な世代です。しかし、収入のピークを迎える一方で、教育費や住宅ローン、老後資金の確保など、多くの課題にも直面します。
 
また、少子高齢化が進むなかで、今後は50代の働き方やライフスタイルも大きく変化していくことが予想されます。定年延長や副業、フリーランスといった多様な選択肢を活用しながら、自分に合ったキャリアを築くことが求められるでしょう。
 
最後に、50代のうちにしっかりと資産形成を行い、健康的なライフスタイルを確立することが、将来の安心につながります。日本の人口のボリュームゾーンにあたる50代が、今後どのように社会を支えていくのか、その動向に注目が集まっています。
 
出典
総務省統計局 令和2年国勢調査
厚生労働省 令和6年賃金構造基本統計調査 結果の概況 （2）性別にみた賃金
 
執筆者：FINANCIAL FIELD編集部
ファイナンシャルプランナー
ファイナンシャルフィールド編集部",[],[]
50代から「自分の葬儀代」を貯金したいです。生前に「100万円」用意しておくだけでは不十分ですか？（ファイナンシャルフィールド）,https://news.yahoo.co.jp/articles/79f791b6eb31e384a1908e011befc0f7c1f881d2,https://newsatcl-pctr.c.yimg.jp/t/amd-img/20250523-00010008-ffield-000-1-view.jpg?exp=10800,2025-05-23T11:32:55+09:00,2025-05-23T11:32:55+09:00,ファイナンシャルフィールド,ffield,ファイナンシャルフィールド,1757,"50代から「自分の葬儀代」を貯金したいです。生前に「100万円」用意しておくだけでは不十分ですか？
「自分の葬儀費用をそろそろ考えておきたい」と考えるけれど、どれくらい費用がかかるのか、どのタイミングでどう準備すればいいのか分からない、という方もいるでしょう。
 
本記事では、葬儀にかかる平均費用や葬儀費用を貯める方法を解説します。葬儀費用を貯めたいと思っている方は、参考にしてください。
▼亡くなった母が私名義で「500万円」を遺してくれていた！ 名義は自分でも「相続税」はかかる？
葬儀にかかる費用はどのくらい？
株式会社鎌倉新書の「第6回お葬式に関する全国調査（2024年）」によると、葬儀にかかる平均費用は118万5000円でした。内訳は以下の通りです。

●基本料金（葬儀利用料、火葬場利用料、祭壇など）：75万7000円
●飲食費（通夜ぶるまい、告別料理など）：20万7000円
●返礼品費（香典に対するお礼の品物）：22万円

また、葬儀の種類別の平均費用は、表1の通りでした。
 
表1
表1
出典：株式会社鎌倉新書「第6回お葬式に関する全国調査（2024年）」を基に筆者作成
 
一般葬は、家族や親戚だけでなく、友人、知人、仕事関係者など多くの人が参列する伝統的なスタイルです。一方、家族葬は、親族や親しい友人のみが参加する小規模な葬儀です。一日葬は、通夜を省き、告別式と火葬を1日で終える形です。そして直葬・火葬式は、通夜や告別式をせず、火葬だけを行うシンプルな形式です。
 
一般葬はもっとも費用が高く、直葬や火葬式はコストがもっとも低い傾向にあるようです。また、参列者が多いほど必要な準備やサービスが増えるため、葬儀全体の費用も上がることが特徴です。
どのくらいの人が葬儀費用を貯めている？
燦ホールディングス株式会社が実施した「ライフエンディングに関する意識調査」によると、ご自分の葬儀費用を準備している方は、59％でした。半数以上が何らかの形で備えていることが分かり、終活への関心が高まっている様子がうかがえます。
葬儀費用を貯める方法
葬儀費用を貯める方法は3つあります。
 
まず、1つ目は自分でコツコツと積み立てる方法です。決まった金額を毎月積み立てても、ボーナス時などにまとめて貯めてもどちらでも問題ありません。普通預金や定期預金を利用すれば、安全に管理できるでしょう。また、余裕がある場合は投資信託などに回し、増やしながら備える選択肢もありますが、リスクも伴うため慎重さが必要です。
 
2つ目は、互助会で積み立てる方法です。冠婚葬祭向けに特化した互助会という積立制度もあります。これは毎月一定額を支払うことで、将来の葬儀費用にあてることができるシステムです。

互助会は経済産業省の認可を受けており、全国で利用可能です。電話一本で手続きが進み、掛け金は月々3000円程度から始められるプランも多く、宗派やスタイルに応じた葬儀プランがそろっています。
 
3つ目は、民間の葬儀保険に加入する方法です。生命保険よりも加入しやすく、80歳以上でも申し込める商品もあります。万が一のときは家族がすぐ現金を受け取れるため、口座凍結の心配もなく、費用の支払いがスムーズに進みます。
葬儀の種類によって異なるが約120万円用意しておくといい
葬儀費用は、参列者の人数や葬儀の種類によって変わりますが、約120万円用意しておくと安心できるでしょう。実際、半数以上の方がすでに何らかの形で準備を進めているというデータもあります。
 
備え方は、貯金、互助会、葬儀保険の3つの方法があります。それぞれ特徴があるため、自分や家族にとって無理のない方法を選びましょう。いざというときに家族が困らないよう、少しずつでも準備を始めておくと安心です。
 
出典
株式会社鎌倉新書 いい葬儀　【第6回】お葬式に関する全国調査（2024年） アフターコロナで葬儀の規模は拡大、関東地方の冬季に火葬待ちの傾向あり
燦ホールディングス株式会社 ライフエンディングに関する意識調査（PR TIMES）
 
執筆者：FINANCIAL FIELD編集部
ファイナンシャルプランナー
ファイナンシャルフィールド編集部",[],[]
マンションの家賃を「5万円値上げする」と言われました。オーナーがかわったそうですが、従うしかないのでしょうか？（ファイナンシャルフィールド）,https://news.yahoo.co.jp/articles/1de17e7f31c878b62eb5078842a2643dd4456614,https://newsatcl-pctr.c.yimg.jp/t/amd-img/20250523-00010007-ffield-000-1-view.jpg?exp=10800,2025-05-23T11:20:26+09:00,2025-05-23T11:20:26+09:00,ファイナンシャルフィールド,ffield,ファイナンシャルフィールド,2184,"マンションの家賃を「5万円値上げする」と言われました。オーナーがかわったそうですが、従うしかないのでしょうか？
住んでいる家の家賃が値上がりしてしまうと、収支のバランスが崩れ困ってしまう方もいるでしょう。突然の値上げは、すぐに対応するのも難しいのではないかと思います。
 
そこで本記事では、家賃が値上げされる条件や、値上げを告知された際にできることについて解説します。家賃が値上げされる背景についても触れますので、ぜひ参考にしてください。
▼アパートの1階と2階で「家賃」はどれだけ変わる？ 1階暮らしのメリット・デメリットも紹介
家賃の値上げができる条件と対処法
オーナー側が家賃の変更を請求するには、いくつかの条件があります。借地借家法の第32条「増減請求権」に基づき、家賃の増額を請求できる条件と、言われたときの対応について解説します。

■家賃の値上げを請求できる条件
借地借家法第32条「増減請求権」では、借主・貸主どちらでも以下のような事情があれば、家賃の見直しを請求できるとしています。

・土地や建物にかかる税金などの負担が増えたり減ったりしたとき
 
・土地や建物の価値が上がったり下がったりしたとき
 
・経済状況の変化（インフレーション・デフレーション）があったとき
 
・周辺の似たような物件と比べて家賃が不当に高い／安いとき

契約書に何と書いてあっても、これらの事情があれば家賃の変更を求められます。ただし、「〇年間は家賃を上げない」といった特約がある場合は、その条件が優先されるため変更はできないでしょう。

■家賃の値上げを告知されたとき
家賃の値上げは双方の合意が望ましいとされています。家賃の値上げを告知された際、まずは値上げをする根拠やデータなどをオーナーに確認しましょう。
 
その際、落ち着いて話し合いをすることがポイントです。また、周辺の家賃はいくらくらいなのかを調べて交渉してみるのもいいかもしれません。
 
なお、一方的に値上げを拒否したり、突然支払いをやめたりすることはしないようにしましょう。思わぬトラブルにつながる可能性があります。
 
もし家賃の値上げに納得できず、話し合いでも解決しない場合、家賃の増額が妥当であるかを裁判で決めることになるかもしれません。
 
裁判で家賃の増額が妥当と認められるまでの間は、相当と認められる家賃を払えばいいとされていますが、最終的に「もっと払うべきだった」となれば、その差額+年10％の利息を付けて支払うことになります。
家賃の値上げで考えられる背景
家賃の値上げには、いくつかの要因があると考えられています。
 
まず1つ目は、建築費や修繕費の高騰です。人件費や資材の価格が大きく上がったことで、新しく建てる建物の費用や、古くなった物件を修理するための費用が、2020年ごろから大幅に上昇しているといわれています。
 
このため、物件のオーナーは増えたコストを家賃に反映せざるを得なくなってきているようです。
 
2つ目は、一人暮らしの世帯が増えていることです。今後も単身世帯は増え続けると予測されており、持ち家を持つ割合が低くなると見込まれています。これも、賃貸住宅の需要を高める要因の一つでしょう。
 
3つ目は、マイホームの購入がますます難しくなっていることです。さまざまな要因から収入が伸び悩む一方、不動産価格は上昇しており、家を買いたくても買えない家庭が増えているといわれています。
 
こうした事情から、もともと持ち家を選ぶことが多かったファミリー層なども、賃貸住宅を選ぶケースが増えているようです。賃貸の需要がさらに高まった結果、家賃の上昇につながっているといえるでしょう。
5万円も値上がりするのは妥当？
国土交通省が公表する「不動産価格指数」から、家賃の値上げが妥当であるかを解説します。
 
不動産価格指数とは、2010年の平均不動産価格を100とした場合の、不動産価格の動向を月単位で表したものです。
 
2025年1月のマンション（区分所有）は「210.7」なので、2010年と比べると2倍以上になっていることが分かります。
 
この数値だけでは、5万円の値上がりが妥当であるかどうかは判断できません。ただし、不動産価格が上昇している傾向を見ると、長年家賃が変わっていない状況であれば「値上げは妥当」とされる場合もあります。
家賃の値上げには条件がある。拒否もできるがまずは話し合いが大事
家賃の値上げはいくつかの条件により可能となっています。値上げを拒否することも可能ですが、話がまとまらない場合は値上げが妥当か否かの裁判に発展する可能性があるでしょう。
 
値上げを告知されたら、まずは落ち着いて話し合いをすることをおすすめします。支払いが難しい場合は値下げ交渉をすることも手段の一つです。
 
一方的に拒否をしたり、家賃の支払いをやめたりすることは、無用なトラブルにつながりかねません。値上げに納得がいかなくても、まずは今までと同じ額の家賃を払い続けた方がいいでしょう。

出典
国土交通省 不動産価格指数 不動産価格指数（住宅）
 
執筆者：FINANCIAL FIELD編集部
ファイナンシャルプランナー
ファイナンシャルフィールド編集部",[],[]
世帯年収「600万円」の共働き夫婦。子どもがいて生活が厳しいけど、周りはいくらくらい稼いでいるのでしょうか？「子育て世帯の平均年収」とは？（ファイナンシャルフィールド）,https://news.yahoo.co.jp/articles/241c83caa0b6c1b32a703bb789b93a51e33ac694,https://newsatcl-pctr.c.yimg.jp/t/amd-img/20250523-00010006-ffield-000-1-view.jpg?exp=10800,2025-05-23T11:20:04+09:00,2025-05-23T11:20:04+09:00,ファイナンシャルフィールド,ffield,ファイナンシャルフィールド,1849,"世帯年収「600万円」の共働き夫婦。子どもがいて生活が厳しいけど、周りはいくらくらい稼いでいるのでしょうか？「子育て世帯の平均年収」とは？
「共働きで世帯年収もそれなりにあるはずなのに、生活が厳しい」という悩みを持つ人も多いのではないでしょうか？ 特に子どもがいると教育費や生活費が増え、思ったよりもお金が残らないと感じることもあるでしょう。
 
そんな中、「ほかの家庭はどれくらい収入があるの？」と疑問に思うこともあるかもしれません。本記事では、子育て世帯の平均年収や生活が厳しい背景の一因でもある物価高の状況、生活に余裕を持たせるポイントについて解説します。
▼会社員で「年収1000万円」以上の割合は？ 大企業ほど高年収を目指せる？
日本の平均年収と子育て世帯の平均年収
まず、現在の日本の平均年収を確認してみましょう。国税庁の「令和5年分民間給与実態統計調査」によると、日本の給与所得者の平均年収は男性が約569万円、女性が約316万円、男女計が約460万円です。
 
この金額を見ると、世帯年収600万円の場合、男女個別の平均年収よりは高いものの、男性と女性それぞれの金額を足した額よりは少なくなります。とはいえ、この数字はあくまでも個人のものですので、世帯年収の平均を見ていきましょう。
 
厚生労働省の「2023（令和5）年国民生活基盤調査の概況」によると、全世帯の平均年収は約524万円ですが、児童のいる世帯でみると約813万円です。世帯年収600万円は、全世帯の中では高いほうですが、子育て世帯の中では少ないほうだといえるでしょう。
物価高の影響で家計が苦しく感じる
「生活が厳しい」と感じるのは、昨今の物価高が影響している可能性があります。総務省の消費者物価指数を見てみましょう。
 
指数は2020年を100とした場合、2024年は食料が117.8、外食が111.8、電気代が112.2など、多くの品目で物価がかなり高くなっています。物価高は家計を苦しめている一因と言えるでしょう。
世帯年収600万円で生活に余裕を持たせるためのポイント
それでは、世帯年収600万円でも余裕を持って生活するにはどうすればよいのでしょうか？いくつか方法を見ていきます。

■家計の見直しをする
家計の見直し、特に固定費を削減すれば長期的な節約が期待できます。例えば、スマホは格安SIMにする、必要以上の保険を見直す、家賃の安い地域へ引っ越すなど、できることを検討してみましょう。

■ふるさと納税を活用する
ふるさと納税は、実質2000円の負担で各地の特産品を受け取ることができる制度です。年収ごとに定められた控除上限額の範囲内で寄附をすることで、食料品や日用品をお得に手に入れることができます。
 
節税しつつ返礼品でお得な生活にもつながりますので、ぜひ活用を検討してみましょう。

■副業や収入アップを目指す
支出を見直すことにも限界がありますが、その場合は副業をする、本業での収入アップを目指すなども選択肢の1つです。
 
副業は、最近ではクラウドソーシングなどを通じてブログや動画編集、ライティングといった多種多様なものがあります。副業で月数万円の収入がプラスになれば、生活もその分楽になるでしょう。
 
また、昇給や転職などによる収入アップも検討したいところです。例えば、共働きの妻が時短勤務からフルタイムに変えるなどすれば、世帯年収が大幅に増える可能性もあります。
まとめ
世帯年収600万円は、日本の世帯の平均的な年収金額よりは高めの水準ですが、子育て世帯に限れば少ないほうになります。また、物価高の影響もあり、生活に余裕がないと感じる家庭も多いでしょう。
 
その場合、固定費の削減や副収入の確保、税制優遇の活用など、家計を見直すことで少しずつ改善できる可能性があります。ほかの家庭と比べてどうかという視点も大切ですが、それ以上に自分たちにとって最適な生活スタイルを見つけることが重要です。
 
まずは無駄な支出を減らし、必要に応じて節税や収入アップにもチャレンジしてみるのも良いでしょう。

出典
国税庁 令和5年分民間給与実態統計調査－調査結果報告－
厚生労働省 2023（令和5）年国民生活基盤調査の概況
総務省統計局 消費者物価指数 2020年基準 年平均
 
執筆者：FINANCIAL FIELD編集部
ファイナンシャルプランナー
ファイナンシャルフィールド編集部",[],[]
