headline,mainEntityOfPage,image,datePublished,dateModified,author,media_en,media_jp,str_count,body,images,external_links
KO-D無差別級＆EXTREMEダブル前哨戦で勝俣瞬馬が岡谷英樹に2連勝【DDT】（TOKYO HEADLINE WEB）,https://news.yahoo.co.jp/articles/30fbdb4e4c41ac07b7aeb5ae2339db0bfff11bc2,https://newsatcl-pctr.c.yimg.jp/t/amd-img/20240224-00010004-theadline-000-1-view.jpg?exp=10800,2024-02-24T11:51:35+09:00,2024-02-24T11:51:35+09:00,TOKYO HEADLINE WEB,theadline,TOKYO HEADLINE WEB,1281,\nHARASHIMAの蹴りが上野に炸裂\nDDTプロレスが2月23日、神奈川・横浜ラジアントホールで「Into The Fight 2024 TOUR in YOKOHAMA」を開催した。セミファイナルでは「旗揚げ27周年記念興行」（3月17日、東京・後楽園ホール）で実施されるKO-D無差別級選手権（王者＝上野勇希vs挑戦者＝HARASHIMA）、DDT EXTREME選手権（王者＝勝俣瞬馬vs挑戦者＝岡谷英樹）のダブル前哨戦が行われ、勝俣が岡谷に2連勝を飾り絶好調ぶりをアピールした。\n \n この日、上野、勝俣はTo-yとのトリオで、HARASHIMA、納谷幸男、岡谷組と対戦。王座戦が決まってから、上野とHARASHIMAは初、勝俣と岡谷は2度目の前哨戦。双方とも互いを強く意識し、上野とHARASHIMAは激しいエルボー合戦を展開。HARASHIMAがミドルキックを叩き込めば、上野はシャイニング・ウィザード。上野がフロッグスプラッシュを繰り出せば、HARASHIMAは蒼魔刀で吹っ飛ばす。\n勝俣が岡谷にトラースキック\n勝俣と岡谷もえげつないエルボーの応酬に。岡谷がランニング・エルボーバット、ランニング・ネックブリーカードロップを見舞えば、勝俣はジャンピングハイ、トラースキック、バズソーキックで追い込む。最後は勝俣がフットスタンプから丸め込んで3カウントを奪取。勝俣は2・17上越での6人タッグ戦でも岡谷を直接制しており、文句なしの2連勝となった。\n \n バックステージで勝俣が「調子いいでしょう。岡谷の気持ちは十分伝わった。3月17日まで、まだまだ試合がある。だからいっぱい楽しもうぜ。俺ら凶器がなくたって、デスマッチじゃなくたって、プロレスできるんだよ。そこでもっと岡谷を感じたいから、前哨戦で悪いことはしない。あとはEXTREMEでいっぱいやりたいことやろうぜ」と余裕の表情。\n試合後、余裕の表情を見せた勝俣（右）\n上野は「HARASHIMAさんとの戦いが今日から始まったんですけど、蒼魔刀食らって走馬灯が走りました。今日、心から楽しみにしてきたんですけど、心から悔しいもので。今日、僕は負けたのと同じなので。悔しくて倒したくて超えたくて仕方がないHARASHIMAさん。まだ1カ月あります。D王では僕が勝ちましたけど、今日負けたのもずっと持っときますんで。この恨みを晴らします」と発言。\n \n 一方、苦しい前哨戦となっている岡谷は「2連敗だ。負けたまま、3・17に向かうわけにはいかねぇ。必ず、勝俣瞬馬。オマエを仕留めてみせるから。覚悟しとけ」と雪辱を期した。\n \n HARASHIMAは「僕はいつも絶好調と言って、結果は伴わなかったですけど。角膜炎になって、それでも今日の試合を見てもらえれば分かると思うけど、絶好調なので。途中3カウント入ってるくらいだと思ったのもあるし。これからもっとコンディション上げて気を引き締めて、タイトルマッチに向けて照準をそこに合わせていきたいと思います」と自信のほどを垣間見せた。,"['https://newsatcl-pctr.c.yimg.jp/t/amd-img/20240224-00010004-theadline-000-1-view.jpg?pri=l&w=640&h=426&exp=10800', 'https://newsatcl-pctr.c.yimg.jp/t/amd-img/20240224-00010004-theadline-001-1-view.jpg?pri=l&w=640&h=426&exp=10800', 'https://newsatcl-pctr.c.yimg.jp/t/amd-img/20240224-00010004-theadline-002-1-view.jpg?pri=l&w=640&h=426&exp=10800']","['https://news.yahoo.co.jp/articles/30fbdb4e4c41ac07b7aeb5ae2339db0bfff11bc2/images/000', 'https://news.yahoo.co.jp/articles/30fbdb4e4c41ac07b7aeb5ae2339db0bfff11bc2/images/001', 'https://news.yahoo.co.jp/articles/30fbdb4e4c41ac07b7aeb5ae2339db0bfff11bc2/images/002']"
元DEEP王者狩りの鈴木博昭がYA-MANに対戦アピール「なんでもありで俺とタイマンしようぜ」【RIZIN】（TOKYO HEADLINE WEB）,https://news.yahoo.co.jp/articles/461587413c8cef7394f23671c6ac3881972c01d0,https://newsatcl-pctr.c.yimg.jp/t/amd-img/20240224-00010005-theadline-000-1-view.jpg?exp=10800,2024-02-24T16:16:05+09:00,2024-02-24T16:16:05+09:00,TOKYO HEADLINE WEB,theadline,TOKYO HEADLINE WEB,770,\n三角絞めから脱出した鈴木がパンチ\n元シュートボクシング（SB）世界スーパーライト級王者の鈴木博昭（BELLWOOD FIGHT TEAM）が2月24日、RISEオープンフィンガーグローブマッチ（OFGM）-65kg級王者のYA-MAN（TARGET SHIBUYA）にMMAでの対戦をアピールした。\n\n 鈴木はこの日、RIZINの2024年第1弾大会となる「RIZIN LANDMARK 8 in SAGA」（SAGAアリーナ）で元DEEPフェザー級王者の芦田崇宏（BRAVE）と対戦し、1RにグラウンドパンチでTKO勝ちを収めた。\n\n 試合は1R序盤、芦田に引き込まれ下から三角絞めを極めかけられるが脱出しヒザを顔面に叩き込み、グラウンドで上を取ると、パウンド、ヒジを落とし、立ち上がるとサッカーボールキック、踏み付けと容赦ない攻めを見せ、最後はパウンドを連打。芦田の動きが止まったところでレフェリーが試合を止めた。\nYA-MANにタイマンアピール\n鈴木はここまでMMAでは6戦3勝3敗。今回は元DEEP王者という格上の選手を相手に大きな白星となった。\n\n 試合後のマイクで鈴木は「ここから元王者とか上位陣ぶっ潰してどんどん上に伸し上がりたいんですが、1個ちょっと心残りがあるんで、ここでこの場で1回だけ言わせてください。“YA-MAN君、なんでもありで俺とタイマンしようぜー！ アンサー待ってまーす」とYA-MANとの対戦をアピールした。\n\n YA-MANは昨年5月に三浦孝太を相手としたMMAデビュー戦でTKO勝ち。8月には山口裕人を破り、OFGM王座を獲得、11月には自らがプロデュースした「FIGHT CLUB」でOFGマッチで朝倉未来に1RKO勝ちと怒涛の3連勝も大晦日にはMMAで平本蓮に敗れている。,"['https://newsatcl-pctr.c.yimg.jp/t/amd-img/20240224-00010005-theadline-000-1-view.jpg?pri=l&w=640&h=426&exp=10800', 'https://newsatcl-pctr.c.yimg.jp/t/amd-img/20240224-00010005-theadline-001-1-view.jpg?pri=l&w=640&h=426&exp=10800']","['https://news.yahoo.co.jp/articles/461587413c8cef7394f23671c6ac3881972c01d0/images/000', 'https://news.yahoo.co.jp/articles/461587413c8cef7394f23671c6ac3881972c01d0/images/001']"
シャーデンフロイデがエグゼクティブ・レベル＆エネミー軍を破りKO-D10人タッグ王座初V【DDT】（TOKYO HEADLINE WEB）,https://news.yahoo.co.jp/articles/272bd0f3d425e464cf4b865664dbc07645a03491,https://newsatcl-pctr.c.yimg.jp/t/amd-img/20240224-00010003-theadline-000-1-view.jpg?exp=10800,2024-02-24T11:50:05+09:00,2024-02-24T11:50:05+09:00,TOKYO HEADLINE WEB,theadline,TOKYO HEADLINE WEB,1299,\n好連携を見せるシャーデンフロイデ\nDDTプロレスが2月23日、神奈川・横浜ラジアントホールで「Into The Fight 2024 TOUR in YOKOHAMA」を開催した。シャーデンフロイデ・インターナショナルがエグゼクティブ・レベル＆エネミー軍を破り、KO-D10人タッグ王座の初防衛に成功した。\n \n シャーデンフロイデは1月5日、東京・新宿FACEで高梨将弘＆アントーニオ本多＆植木嵩行＆正田壮史＆メカマミーのメンバーでサウナカミーナ軍を下して王座奪取。今大会では「王者組は5選手のうちリーダーを含む3選手以上のメンバーが出場すれば、他のメンバーを変更し防衛戦を行うことが可能」との規定に則り、代替出場だった植木に代わり、正規メンバーのクリス・ブルックスが入って出陣。対して、女子プロ界を席巻するユニットのレベル＆エネミーの雪妃真矢、ラム会長、山下りなに加え、高木三四郎社長、彰人副社長のエグゼクティブコンビが合体して王座に挑戦した。\nラム会長が本多にパンチ\n多人数タッグマッチとあって、10人が入り乱れた目が離せない大乱戦に発展。高木が「愛してまーす」と叫んで、スリングブレイドを高梨に見舞う。本多は創作昔話ごんぎつねからのサミングが見事に成功して5人を倒す。シャーデンフロイデのトレイン攻撃で彰人がダメージ。今度はエグゼクティブ・レベル＆エネミーが本多にトレイン攻撃。本多のダイビング・フィストドロップは彰人が阻止。エグゼクティブ・レベル＆エネミーが本多に波状攻撃。彰人と本多が丸め込みの応酬となり、本多が回転足折り固めで3カウントを奪取した。\n \n バックステージで本多が「5人いなかったら今頃俺は横浜港に沈んでる」と発言すれば、クリスは「今日はすごい。お客さんいっぱい。シャーデンフロイデのタオル持ってた。人気じゃない？ ホンダさんすごかった。お水パーティーしましょう」と言うや、ペットボトルの水をぶちまけて、メンバーは水浸し。メカマミーは故障したのかダウンしてしまった。本多は「なんというバッドエンドなんだ。たまにはこんなのがあっていいと思う。プロレスありがとう。それではまたリングの上で会いましょう。さよなら、さよなら、さよなら」と言って去って行った。\nフィニッシュは本多の回転足折り固め\nかたや、敗れたエグゼクティブ・レベル＆エネミーは大混乱。ラム会長が「何やってんの。社長と副社長」と責任追及すると、2人は土下座謝罪。レベル＆エネミーが再参戦を要求すると、高木が「（DDTに）呼んでもいいと思ってるんで、副社長があとは責任取ってください」と逃走。彰人も「僕も対戦カード決める権利ないんで」と逃げてしまう。残されたラム会長は「DDT、また呼べ！」と叫んでいた。\n \n また、第1試合に出場した平田一喜が2・25後楽園で始動する土井成樹、青木真也との新ユニット名を「ずんちゃマッスルサバイバー」と勝手に発表。土井、青木の承諾は得ていないという。同大会で平田組は男色ディーノ＆大石真翔＆大鷲透と対戦するが、果たしてトリオがうまく機能するのかどうか？,"['https://newsatcl-pctr.c.yimg.jp/t/amd-img/20240224-00010003-theadline-000-1-view.jpg?pri=l&w=640&h=426&exp=10800', 'https://newsatcl-pctr.c.yimg.jp/t/amd-img/20240224-00010003-theadline-001-1-view.jpg?pri=l&w=640&h=426&exp=10800', 'https://newsatcl-pctr.c.yimg.jp/t/amd-img/20240224-00010003-theadline-002-1-view.jpg?pri=l&w=640&h=426&exp=10800']","['https://news.yahoo.co.jp/articles/272bd0f3d425e464cf4b865664dbc07645a03491/images/000', 'https://news.yahoo.co.jp/articles/272bd0f3d425e464cf4b865664dbc07645a03491/images/001', 'https://news.yahoo.co.jp/articles/272bd0f3d425e464cf4b865664dbc07645a03491/images/002']"
矢地祐介が急きょ参戦の白川陸斗を返り討ちも「最初危なかった。試合って難しい」【RIZIN】（TOKYO HEADLINE WEB）,https://news.yahoo.co.jp/articles/34f31ac5df699c71f4d41751ea667c349980a371,https://newsatcl-pctr.c.yimg.jp/t/amd-img/20240224-00010006-theadline-000-2-view.jpg?exp=10800,2024-02-24T18:08:35+09:00,2024-02-24T18:40:13+09:00,TOKYO HEADLINE WEB,theadline,TOKYO HEADLINE WEB,1359,\n序盤は白川のプレッシャーに苦戦の矢地\nRIZINの2024年第1弾大会となる「RIZIN LANDMARK 8 in SAGA」が2月24日、初上陸となる佐賀県のSAGAアリーナで開催された。\n\n 矢地祐介（フリー）が白川陸斗（JAPAN TOP TEAM）に2Rで一本勝ちを収め連勝を「3」に伸ばした。矢地は当初、RIZINで2連勝中の強豪キム・ギョンピョ（韓国／Redhorse MMA）と対戦の予定だったが、ギョンピョがケガで欠場となったため急きょ対戦相手が白川に変更になっていた。\n\n 1R、サウスポーの矢地とオーソドックスの白川。圧をかけるのは白川。白川が右ハイ。矢地はガード。矢地はローを返すも白川が踏み込んで右ストレート。矢地がケージを背負う。矢地が前に出て左ストレートを放つと白川が伸ばした左手の指がアイポークとなり一時中断。再開後、やはり圧をかけるのは白川。矢地は組みに行くと白川がバランスを崩す。矢地が組み付き、ヒザをボディーと顔面に。前手で距離を探りながら矢地が左ハイ。その後も圧をかけるのは白川。矢地はケージを背に回る。白川が右ハイも矢地はガード。そして左ストレートを打ち返す。白川が前に出て大きな右フック。最後まで白川が圧をかけたままラウンド終了。\n最後はリアネイキッドチョークで一本勝ち\n2R、やはり圧をかけるのは白川。そして右ミドル。矢地も左ミドル。そして組み付く矢地。矢地は足を払って倒すも白川はすぐに立ち上がる。白川が圧。矢地は左ハイ。そして組みに行ってヒザ。しかし白川は突き放す。矢地は片足タックルから足を払ってテイクダウンも白川はすぐに立ち上がる。矢地は組み付き、バックをキープしヒザ。白川が正対すると顔面にヒザ。矢地はがっちりとクラッチし、白川を逃がさずヒザ。ヒザをつかせ、こつこつパンチ。矢地がうまくポジションを取り、白川は立てない。矢地はバックを取り足をかけて白川をコントロール。引き込んで、グラウンドの状態となると残り10秒でスリーパーをがっちり。なんとかこらえる白川だったが、終了のゴング寸前に白川が落ちて、矢地が一本勝ちを収めた。\n\n 試合前の公開練習や前々日インタビューなどで、「お祭り男なのになにぬかしとんねん」などと白川に挑発され続けていた矢地だったが、決着後、まだ座ったままの白川のもとに駆け寄り互いの健闘を称え合う。\n3連勝の矢地\nそして矢地はマイクを握ると「どうも佐賀の皆さん、矢地祐介です。まず一つ、キム・ギョンピョ戦が流れてしまって、急きょオファーを受けてくれた白川選手、ありがとうございます。階級が下にもかかわらず試合を受けてくれて本当に感謝しています」とまずは感謝の言葉。\n\n そして「いやー、最初さ、ちょっと癖出ちゃって“危ない危ない”ってなったんですけど、だんだん軌道修正して。やっぱり試合って難しいですね。だけど一生懸命、毎日毎日練習して、強くなるために頑張っています。皆さんもなにか一つでも頑張るときっといいことがあると思います。すいません、偉そうなこと言って（笑）。本当にうれしいです。佐賀の皆さん、ありがとうございます」と笑顔で締めくくった。\n\n 本大会はABEMA PPVなどで視聴可能となっている。,"['https://newsatcl-pctr.c.yimg.jp/t/amd-img/20240224-00010006-theadline-000-2-view.jpg?pri=l&w=640&h=426&exp=10800', 'https://newsatcl-pctr.c.yimg.jp/t/amd-img/20240224-00010006-theadline-001-2-view.jpg?pri=l&w=640&h=426&exp=10800', 'https://newsatcl-pctr.c.yimg.jp/t/amd-img/20240224-00010006-theadline-002-2-view.jpg?pri=l&w=640&h=426&exp=10800']","['https://news.yahoo.co.jp/articles/34f31ac5df699c71f4d41751ea667c349980a371/images/000', 'https://news.yahoo.co.jp/articles/34f31ac5df699c71f4d41751ea667c349980a371/images/001', 'https://news.yahoo.co.jp/articles/34f31ac5df699c71f4d41751ea667c349980a371/images/002']"
グスタボが堀江圭功との激戦制し4連勝。ライト級王者サトシへの挑戦をアピール【RIZIN】（TOKYO HEADLINE WEB）,https://news.yahoo.co.jp/articles/d1dab99ec057d66e3c87016da8990487fc3f2442,https://newsatcl-pctr.c.yimg.jp/t/amd-img/20240224-00010007-theadline-000-1-view.jpg?exp=10800,2024-02-24T18:38:47+09:00,2024-02-24T18:38:47+09:00,TOKYO HEADLINE WEB,theadline,TOKYO HEADLINE WEB,1671,\n激闘を制したのはグスタボ。堀江も拍手で称える\nRIZINの2024年第1弾大会となる「RIZIN LANDMARK 8 in SAGA」が2月24日、初上陸となる佐賀県のSAGAアリーナで開催された。\n\n メインイベントでは長崎県出身の堀江圭功（ALLIANCE）がルイス・グスタボ（ブラジル／EVOLUCAO THAI）と対戦し、あと一歩まで追い込んだものの、判定で敗れた。グスタボは試合後のマイクでライト級王者のホベルト・サトシ・ソウザ（ブラジル／ボンサイ柔術）への挑戦をアピールした。\n\n 1R、ともにオーソドックスの構え。圧をかける堀江がインロー。グスタボのパンチにバックステップの堀江。グスタボの右ハイをキャッチした堀江が組み付くも、すぐに離れる。堀江が右カーフ。グスタボは右ストレートも距離が遠く届かない。堀江は左ボディー、右フック。しかしグスタボもパンチを返し堀江がバランスを崩す。堀江の右インローにグスタボが右ロー。グスタボの右ローに堀江が右カーフを返す。グスタボの右ストレートは当たらない。堀江が右カーフ。グスタボはカットも、カーフに嫌がる素振り。グスタボが右ストレートから返しの左フック。これで堀江がダウン。すぐに立ち上がるが、グスタボが襲い掛かり組み付きテイクダウンを狙うが、しのぐ堀江。ケージに押し込むグスタボだが、離れ際にヒジを打ち込む堀江。\n2R、堀江はグラウンドで有利な展開に\n2R、堀江が圧をかけて左インカーフ。グスタボがガードを固めて距離を詰める。堀江は右カーフ。グスタボが左右のパンチを振って前に出るが堀江はバックステップでかわす。グスタボがパンチで前に出たところで堀江がカウンターのタックルでテイクダウン。上を取る。ハーフガードの体勢から肩固めを狙う動きを見せる堀江。堀江はパンチをコツコツ。グスタボはガードを固め、なんとかアームロックを狙うが、堀江は許さない。残り10秒で体を起こした堀江が強いパウンドを一発。\n\n 3R、互いの右が交錯。堀江の左ローでバランスを崩すグスタボ。前に出るグスタボがパンチを放つが、かわした堀江が組み付く。すぐに離れて打撃の攻防に。グスタボがワンツーもやはり右ストレートは当たらない。堀江の右カーフにグスタボが右ストレート。カーフが効いて踏み込みが浅いグスタボ。堀江がタックルで組み付きケージに押し込む。離れると堀江は右カーフ。圧をかけるグスタボ。堀江がワンツー。堀江がシングルレッグもグスタボは倒れない。グスタボが圧をかける。パンチの連打で堀江を下がらせるグスタボ。グスタボが堀江を追い込むが、堀江が組み止める。しかしグスタボの右フックで堀江がダウン。グスタボはパウンドも、堀江は下から組み付きなんとかしのぐ。グスタボはそれでもパンチをコツコツと出し続け、ラウンド終了。\nグスタボの右ストレートがさく裂\n判定は1Rと3Rにダウンを奪ったグスタボが3-0で勝利を収めた。グスタボは2022年4月に2年4カ月ぶりにRIZINに復帰して以来、矢地祐介、大原樹里、武田光司、この日の堀江と怒涛の4連勝となった。\n\n グスタボは試合後のマイクで「またRIZINの舞台で戦えてとても幸せです。日本で試合ができることをとても幸せに思っています。見に来てくださった皆さん、ありがとうございます。日本が大好きです。日本のファンも大好きです。とても特別に思っています」と感謝の言葉。\n\n そして「堀江選手なしではこの素晴らしい試合はできなかった、本当にありがとうございます。次はタイトルマッチに挑戦したいと思っています。サトシ選手と戦いたいです。その前に誰と戦えばいいのでしょうか？ もう自分はタイトルマッチができる立場にいると思います」とタイトル挑戦をアピールした。\n\n なおサトシは「RIZIN LANDMARK 9 in KOBE」（3月23日、兵庫・神戸ワールド記念ホール）で中村K太郎（UNITED GYM TOKYO）との対戦が決まっている。,"['https://newsatcl-pctr.c.yimg.jp/t/amd-img/20240224-00010007-theadline-000-1-view.jpg?pri=l&w=640&h=426&exp=10800', 'https://newsatcl-pctr.c.yimg.jp/t/amd-img/20240224-00010007-theadline-001-1-view.jpg?pri=l&w=640&h=426&exp=10800', 'https://newsatcl-pctr.c.yimg.jp/t/amd-img/20240224-00010007-theadline-002-1-view.jpg?pri=l&w=640&h=426&exp=10800']","['https://news.yahoo.co.jp/articles/d1dab99ec057d66e3c87016da8990487fc3f2442/images/000', 'https://news.yahoo.co.jp/articles/d1dab99ec057d66e3c87016da8990487fc3f2442/images/001', 'https://news.yahoo.co.jp/articles/d1dab99ec057d66e3c87016da8990487fc3f2442/images/002']"
