headline,mainEntityOfPage,image,datePublished,dateModified,author,media_en,media_jp,str_count,body,images,external_links
百条委提出の音声データにイチゴや塩の受け取りも示唆する発言　兵庫知事、相次ぎ受領か（産経新聞）,https://news.yahoo.co.jp/articles/12e2285f57e2de824ee99d77d99deb1c818b798b,https://newsatcl-pctr.c.yimg.jp/t/amd-img/20240718-00000228-san-000-2-view.jpg?exp=10800,2024-07-18T21:49:11+09:00,2024-07-18T23:23:24+09:00,産経新聞,san,産経新聞,392,\n斎藤元彦兵庫県知事＝１６日（南雲都撮影）\n兵庫県の斎藤元彦知事の疑惑を告発する文書を作成し、今月７日に死亡した元県西播磨県民局長の男性（６０）が残した音声データをめぐり、斎藤氏がイチゴや塩などを受け取ったことを示唆するような発言があったことが１８日、関係者への取材で分かった。\n【一覧で見る】告発文書に記載された７項目の疑惑と斎藤知事の発言\n関係者によると、男性の遺族が、県議会の調査特別委員会（百条委員会）に提出した音声データには、斎藤氏が令和４年秋ごろ、上郡町で開かれた会合に出席した際に、同町特産品のワインについて「飲んだことがない」「折をみてお願いします」と話した様子が記録されていた。そのやりとりのなかで、「この間はイチゴ、ジャム、塩…」と過去の地元産品の受け取りを示唆するような発言も含まれていた。百条委は１９日、これらを調査資料として採用するかどうか協議する。,['https://newsatcl-pctr.c.yimg.jp/t/amd-img/20240718-00000228-san-000-2-view.jpg?pri=l&w=640&h=426&exp=10800'],"['https://news.yahoo.co.jp/articles/12e2285f57e2de824ee99d77d99deb1c818b798b/images/000', 'https://www.iza.ne.jp/article/20240718-LNZHLTB7DJIHRFJIBIL7JAV274/photo/2MJU26NMIFJZDPWG7SYVA5M46Y/?utm_source=yahoo%20news%20feed&utm_medium=referral&utm_campaign=related_link']"
日本、島嶼国との〝伴走〟強調　名指しせず対中牽制　島サミット閉幕（産経新聞）,https://news.yahoo.co.jp/articles/3b44b5d4188719f3173e6e68251e1d8600edae1e,https://newsatcl-pctr.c.yimg.jp/t/amd-img/20240718-00000234-san-000-2-view.jpg?exp=10800,2024-07-18T22:48:29+09:00,2024-07-18T22:49:41+09:00,産経新聞,san,産経新聞,1006,\n共同記者発表を終え、岸田文雄首相（右）と握手する共同議長を務めたクック諸島のマーク・ブラウン首相＝１８日午後、東京都港区（鴨志田拓海撮影）\n第１０回「太平洋・島サミット」は１８日、閉幕した。議長を務めた岸田文雄首相は、災害対策支援を柱とする「太平洋気候強靱化イニシアチブ」を発表するなど、海面上昇のリスクに直面する島嶼国に寄り添う姿勢を強調した。首脳宣言も中国を牽制する内容を明記しつつ、名指しは控え、バランス外交に腐心する各国・地域との信頼関係の再構築に努めた。\n【地図で見る】太平洋・島サミットの参加国・地域\n「信頼、協力関係をさらなる高みに引き上げ、未来に向け、ともに歩む決意と具体的な道のりを示すことができた」\n\n首相は１８日、共同議長を務めたクック諸島のブラウン首相との共同記者発表に臨み、サミットの成果を強調した。\n\n日本が共同行動計画で打ち出した「気候変動と災害」「資源と経済開発」など７つの重点協力分野は、太平洋島嶼国でつくる「太平洋諸島フォーラム」の「２０５０年戦略」の７本柱に対応したものだ。「戦略の実現に日本がともに取り組む」（外務省幹部）とのメッセージを込めた。\n\n岸田首相が一体性と信頼の醸成に注力したのは、太平洋島嶼国・地域が、オーストラリアと日本を結ぶシーレーン上にあり、日本の戦略的な利益がかかる地域だからだ。念頭には、この地域で軍事、経済的な影響力を拡大する中国の存在がある。\n\nただ、米中の大国間でバランスに苦慮する島嶼国は、中国を気にして「多国間会議で中国の名前が出るのを嫌がる」（別の外務省幹部）傾向が強い。\n\nこのため首脳宣言は中国を意識しつつ、名指しせずに「平和で安定し繁栄したアジア太平洋地域」の確保に資さない「急速な軍備増強」への「懸念」を明記。また、共同行動計画は「全体の中でギラギラしない形」（同）で、安全保障の協力メニューを盛り込んだ。\n\n日本としては、同志国軍を支援する枠組み「政府安全保障能力強化支援（ＯＳＡ）」などを通じ、島嶼国の海洋安保能力を向上させ、シーレーンの安定化や「自由で開かれた国際秩序」の維持につなげたい考えだ。\n\n「驚いたことに日本と島嶼国の関係を『戦略パートナーシップ』だと表現した首脳が複数いた。そうしたことを言える関係になってきた」\n会議に出席した政府関係者は手応えを口にした。（原川貴郎）,['https://newsatcl-pctr.c.yimg.jp/t/amd-img/20240718-00000234-san-000-2-view.jpg?pri=l&w=640&h=426&exp=10800'],"['https://news.yahoo.co.jp/articles/3b44b5d4188719f3173e6e68251e1d8600edae1e/images/000', 'https://www.iza.ne.jp/article/20240718-3QZFSP46YNNJXGUI5IOEYRM7RU/photo/BNZZXQXI3FNVXBLMEZU7STSACM/?utm_source=yahoo%20news%20feed&utm_medium=referral&utm_campaign=related_link']"
家屋で「発見」のインゴット入り金庫、番組で密着業者が用意か　毎日放送（産経新聞）,https://news.yahoo.co.jp/articles/926b10dc91e10481a7a5feb7f90aab2e7e93a128,https://newsatcl-pctr.c.yimg.jp/t/amd-img/20240718-00000230-san-000-3-view.jpg?exp=10800,2024-07-18T22:25:18+09:00,2024-07-18T23:04:56+09:00,産経新聞,san,産経新聞,509,\n毎日放送本社＝大阪市北区\n毎日放送（MBS、大阪市）は18日、関西圏で放送しているバラエティー番組「ゼニガメ」（水曜夜）の17日に放送した古物の買い取り業者に密着する企画で、家屋から見つかったとされた金の延べ板（1キロ）が入った金庫は、その場になかったものだったと発表した。\n【写真】「ゼニガメ」のＭＣを務めるナインティナイン矢部浩之とメッセンジャー黒田有\n同局は同じ金庫が過去にオークションサイトに出品されているのを確認、業者は落札したことを認めているという。業者が事前に用意した可能性があり、同局は延べ板が入っていた経緯も調べている。\n\n企画は業者が古い家屋の遺品整理を行い、買い取りを行う様子に密着。業者が古い家屋にあった金庫を開錠すると、金の延べ板が入っていた。放送後、視聴者から「金庫はオークションサイトで出品されたものではないか」と指摘があったという。\n\n同局は「番組で事実と異なる内容を放送したことについて、視聴者の皆さま、出演者をはじめ番組関係者の皆さまにおわび申し上げます」としている。番組では過去にも同じ業者に密着した企画を放送しており、同局は内容に問題がなかったかを調べている。,['https://newsatcl-pctr.c.yimg.jp/t/amd-img/20240718-00000230-san-000-3-view.jpg?pri=l&w=640&h=464&exp=10800'],"['https://news.yahoo.co.jp/articles/926b10dc91e10481a7a5feb7f90aab2e7e93a128/images/000', 'https://www.iza.ne.jp/article/20240427-JDOPYXK5PFLBTDETXIMMA6TAMQ/photo/VWP6EAR2YZIGXEPRJS6E4S3MOY/?utm_source=yahoo%20news%20feed&utm_medium=referral&utm_campaign=related_link']"
島サミット閉幕、島嶼国と法の支配共有　防衛協力や海保機関との交流拡大（産経新聞）,https://news.yahoo.co.jp/articles/8edaecd392ae5c83f8111d01ca008e91631d8ef8,https://newsatcl-pctr.c.yimg.jp/t/amd-img/20240718-00000231-san-000-1-view.jpg?exp=10800,2024-07-18T22:44:13+09:00,2024-07-18T22:44:13+09:00,産経新聞,san,産経新聞,785,\n首脳会合後、フォトセッションに応じる、岸田文雄首相（前列中央）と参加国・地域の首脳ら。左隣は共同議長を務めるクック諸島のマーク・ブラウン首相＝１８日午後、東京都港区（鴨志田拓海撮影）\n政府が計１８の太平洋島嶼国・地域の首脳らを招き、島国としての共通課題を議論する第１０回「太平洋・島サミット」は１８日、首脳宣言と共同行動計画を発表し、閉幕した。首脳宣言では自由、民主主義といった共通の価値や、ルールに基づく自由で開かれた国際秩序の重要性を確認。地域で影響力を強める中国を念頭に「世界のいかなる場所でも武力による威嚇、武力の行使、威圧による一方的な現状変更の試みに強く反対する」と明記した。\n【一覧で見る】太平洋・島サミットの首脳宣言と共同行動計画のポイント\n東京電力福島第１原子力発電所の処理水に関しては、国際原子力機関（ＩＡＥＡ）を「原子力安全に関する権威」と位置付け、放出が国際安全基準に合致しているとしたＩＡＥＡ報告書に言及。「科学的根拠に基づくことの重要性で一致した」と記した。\n\n今後３年で７つの重点協力分野を設定し、日本が６５００人以上の人的交流、人材育成の協力を行う方針を示した。島嶼国が重視する気候変動対策で、防災を柱とする「太平洋気候強靱化イニシアチブ」に基づく協力を進めるとした。\n\n共同行動計画には、自衛隊の航空機や艦船の寄港を通じた防衛協力や海上保安機関の交流強化も盛り込んだ。\n\n岸田文雄首相は共同記者発表で「日本と太平洋島嶼国・地域は法の支配、民主主義、力による一方的な現状変更の試みへの反対といった価値・原則を共有している」と強調。共同議長を務めたクック諸島のブラウン首相は首脳宣言を「私たちの共有する優先事項とコミットメントを反映したものだ」と評価し、日本との協力について「次のステージへと高みに至りたい」と語った。,['https://newsatcl-pctr.c.yimg.jp/t/amd-img/20240718-00000231-san-000-1-view.jpg?pri=l&w=640&h=426&exp=10800'],"['https://news.yahoo.co.jp/articles/8edaecd392ae5c83f8111d01ca008e91631d8ef8/images/000', 'https://www.iza.ne.jp/article/20240718-MPGS4TJC5ZMCVMLFVAEKXAI6ZM/photo/FBPBZZD37VJMJHOCXT5IMY7N6U/?utm_source=yahoo%20news%20feed&utm_medium=referral&utm_campaign=related_link']"
欧州議会、フォンデアライエン欧州委員長の続投を正式決定　露の脅威念頭に安全保障強化へ（産経新聞）,https://news.yahoo.co.jp/articles/861e20076af19ae1cd55c3162df97005cd274adc,https://newsatcl-pctr.c.yimg.jp/t/amd-img/default.jpg?exp=10800,2024-07-18T21:38:56+09:00,2024-07-18T21:38:56+09:00,産経新聞,san,産経新聞,453,\n【パリ＝板東和正】欧州連合（ＥＵ）欧州議会は１８日、行政執行機関トップ、フォンデアライエン欧州委員長の続投を巡る採決を実施し、賛成多数で再選を承認した。任期は５年。フォンデアライエン氏はロシアの脅威を念頭に欧州の安全保障を強化する見通しだ。\n\nフォンデアライエン氏は２０１９年、ＥＵ史上初の女性委員長に就任した。任期は今年１０月末までだったが、ＥＵは６月の首脳会議で、同氏の続投を正式に支持した。\n\n欧州委員長の人事は欧州議会の承認を経て決定する仕組み。欧州メディアによると、１８日の採決では約４００人が賛成した。親ＥＵ派議員の造反が予想されたが、承認に必要な過半数に達した。\n\nフォンデアライエン氏は１期目で、ロシアの侵略を受けるウクライナへの兵器供与を維持。中国を念頭にした経済安全保障政策の拡充に努めてきた。同氏はＥＵ加盟国の防衛産業の強化などのために５千億ユーロ（約８６兆円）の投資が必要との見通しを示しており、２期目ではロシアに対する抑止力を向上するための防衛強化を掲げる方針だ。,[],[]
東京都道１９０キロに白いアスファルト　遮熱性・保水性塗装でヒートアイランド対策（産経新聞）,https://news.yahoo.co.jp/articles/898dbe4fe6812063ba29423b9aa3989fa55c28d6,https://newsatcl-pctr.c.yimg.jp/t/amd-img/20240718-00000225-san-000-1-view.jpg?exp=10800,2024-07-18T20:57:40+09:00,2024-07-18T20:57:40+09:00,産経新聞,san,産経新聞,599,\n路面温度を抑制する舗装がされた道路＝１８日午前、東京都文京区（大波加将太撮影）\n東京都は、路面温度の上昇を抑制する効果がある「遮熱性舗装」や「保水性舗装」を令和５年度までに都道約１９０キロで完了させた。今年度もこれらの舗装を１０キロ程度施工することを計画していて、１２年度までに都道計２４５キロで舗装を完了させることを目指す。\n\n２種類の舗装は都がヒートアイランド対策として進めてきた。「センターコアエリア」と呼ばれる首都高速中央環状線の内側を中心に、平成１７年度から舗装。いずれも通常の舗装に比べ３割程度費用が高額となるが、路面温度の上昇を最大８～１０度抑制することができるという。\n\n「遮熱性舗装」は、路面温度の上昇につながる赤外線を高反射させ路面温度の上昇を抑制する技術。「保水性舗装」では、アスファルトに保水された水分が蒸発して気化熱が奪われることにより、路面温度の上昇を抑制する。通常と比べて白い舗装は、見た目にも涼しげだ。\n\n消防庁によると、都内の昨年５～９月の熱中症による救急搬送の発生場所は、住居が最も多く約３９％、道路が約２４％と続く。道路での救急搬送は全国の約１７％を上回り、対策が課題となっている。都の担当者は「すぐに効果が出るものではないが、限られた対策のなかで、やれるだけのことをやって、少しでも熱中症発生の低減につなげたい」と話している。（大波加将太）,['https://newsatcl-pctr.c.yimg.jp/t/amd-img/20240718-00000225-san-000-1-view.jpg?pri=l&w=640&h=426&exp=10800'],['https://news.yahoo.co.jp/articles/898dbe4fe6812063ba29423b9aa3989fa55c28d6/images/000']
かど番の貴景勝、気迫の２勝目　大相撲名古屋場所５日目　宇良戦、迷いなく一気に寄り切り（産経新聞）,https://news.yahoo.co.jp/articles/1c702a7ffd2b9c06cc7e0980edb0b955062f722d,https://newsatcl-pctr.c.yimg.jp/t/amd-img/default.jpg?exp=10800,2024-07-18T20:55:24+09:00,2024-07-18T20:55:24+09:00,産経新聞,san,産経新聞,656,\n大相撲名古屋場所５日目は１８日、ドルフィンズアリーナで行われ、大関貴景勝が宇良を寄り切って２勝目を挙げた。かど番の今場所は１勝３敗と黒星が先行していた。しかも３日目、４日目と２連敗。この日の宇良戦には相当の重圧が掛かっただろうが、貴景勝の取り口に迷いはなかった。\n\n古傷の首の状態が懸念される中、立ち合い、頭から激しく当たる。相手と体が離れたところで、うまく下からすくい上げるようにもろ差し。勝機と見るや、一気に前に走った。両者もつれながら土俵下に転落したものの、宇良の左足が先に出ており、寄り切りで勝ち星をもぎ取った。\n\n相撲内容を問う報道陣の質問に「覚えてないです」と繰り返した大関に対し、土俵下で勝負を見届けた粂川審判長（元小結琴稲妻）が「宇良が何かやってくるだろうという考えを捨てて、開き直っていけたんじゃないか」と胸中を代弁した。この気迫こそ貴景勝の真骨頂といえる。\n\nかど番は、これが９度目だ。全休して関脇に陥落した令和元年名古屋場所を除くと、かど番を脱した過去７度のうち６度が序盤５日間は白星先行だった。２勝目を挙げたとはいえ、まだ苦しい状況であることに変わりはない。今場所は一気に前に押していけていないのも気に掛かる。\n\nこの日、気象庁は東海地方の梅雨明けを発表。これから暑さはさらに厳しくなるだろう。「それを含めて勝負なんで。みんな同じ条件ですから」と貴景勝。「勝たないといけない。また明日も勝ちにつながるように準備するだけ」。人事を尽くして白星をつかみに行く。（宝田将志）,[],[]
「国家安全が中国式現代化の基礎」　中国共産党の重要会議「３中総会」閉幕（産経新聞）,https://news.yahoo.co.jp/articles/9922ee4c39b00fae299472fc1434157b1825024d,https://newsatcl-pctr.c.yimg.jp/t/amd-img/20240718-00000219-san-000-3-view.jpg?exp=10800,2024-07-18T20:47:07+09:00,2024-07-18T21:19:46+09:00,産経新聞,san,産経新聞,584,\n中国国旗\n【北京＝三塚聖平】中国共産党の重要会議である第２０期中央委員会第３回総会（３中総会）が１８日、閉幕した。西側諸国と異なる独自の発展モデルである「中国式現代化」の推進や、「さらなる改革の全面的深化」に関する決定を採択した。会議の概要を記したコミュニケを中国国営新華社通信が伝えた。\n【写真】中国共産党の３中総会に出席した習近平国家主席と幹部ら\nコミュニケは、２０３５年までに高水準の社会主義市場経済体制を全面建設することや、２９年の建国８０年までに会議で提起された「改革任務を完成させる」ことを表明。国家安全が中国式現代化の「重要な基礎」だと明記したほか、中国共産党の「指導レベルや長期執政能力を高める」ことに重点を置くとした。党の経済・社会への統制を強化するとみられる。\n\n人事関連では、昨年７月に外相職を解かれた秦剛氏の党中央委員の辞職を認めた。李尚福前国防相や、ロケット軍の李玉超・前司令官の党籍剝奪処分を承認した。中国人民解放軍では汚職疑惑が伝えられており、コミュニケは「軍隊に対する党の絶対的な指導を堅持しなければならない」と強調した。軍や党内の引き締めが強まる見通しだ。\n\nまた、税・財政や金融の改革を深化させることや、不動産不況や地方政府の債務といった経済的なリスクを抑える方針を表明した。具体的な措置を今後打ち出すとみられる。,['https://newsatcl-pctr.c.yimg.jp/t/amd-img/20240718-00000219-san-000-3-view.jpg?pri=l&w=640&h=360&exp=10800'],"['https://news.yahoo.co.jp/articles/9922ee4c39b00fae299472fc1434157b1825024d/images/000', 'https://www.iza.ne.jp/article/20240718-PI32IDZQXVOFPO5MRJTANVYHKA/photo/YXWNRKX3FVOB5HBXHQBDUQCVCU/?utm_source=yahoo%20news%20feed&utm_medium=referral&utm_campaign=related_link']"
係官が次々段ボール搬出　堀井学衆院議員の東京・北海道の事務所を家宅捜索（産経新聞）,https://news.yahoo.co.jp/articles/6aa8b0035a4deb964f990b5ca222eea93d4ed406,https://newsatcl-pctr.c.yimg.jp/t/amd-img/20240718-00000222-san-000-2-view.jpg?exp=10800,2024-07-18T20:54:52+09:00,2024-07-18T21:13:50+09:00,産経新聞,san,産経新聞,504,\n堀井学衆院議員の地元事務所から資料を詰めた段ボールを運び出す東京地検の係官ら＝１８日午後、北海道登別市（坂本隆浩撮影）\n堀井学衆院議員の事務所や宿舎などで、１８日に一斉に行われた公選法違反容疑での家宅捜索。東京地検特捜部は、パソコンなどを押収し、分析を進める。\n【写真】一連の不祥事を謝罪する堀井学衆院議員\n１８日午前１０時４５分、多数の報道陣が詰めかけた東京・永田町の衆院第２議員会館。４階の堀井議員の事務所に東京地検の係官十数人が到着すると、「東京地検です」と告げ、次々と中に入っていった。\n\n捜索は午後４時前まで約５時間にわたり、係官らは段ボール数箱を台車に載せて運び出し、去っていった。\n\n特捜部は、堀井氏の選挙区の北海道登別市の地元事務所でも、東京の事務所とほぼ同時刻に捜索を開始した。\n\n係官約１０人が白いワゴン車などで到着。報道陣のシャッター音が一斉に響くなか、キャリーケースや段ボールを手に足早に事務所に入った。６時間以上捜索を続け、段ボール数十箱を２台の車に分けて載せて捜索を終えた。\n\nこのほか、東京都港区の議員宿舎と、登別市にある堀井氏の自宅の捜索も行われた。,['https://newsatcl-pctr.c.yimg.jp/t/amd-img/20240718-00000222-san-000-2-view.jpg?pri=l&w=640&h=456&exp=10800'],"['https://news.yahoo.co.jp/articles/6aa8b0035a4deb964f990b5ca222eea93d4ed406/images/000', 'https://www.iza.ne.jp/article/20240718-FY2DZRYTK5MGHNJDH5FWHWPXQU/photo/XHVXKBG5M5F6LDNUPY4BN6ORLA/?utm_source=yahoo%20news%20feed&utm_medium=referral&utm_campaign=related_link']"
「どう子供に報告すれば」　妻殺害で有罪の講談社元次長の家族は落胆（産経新聞）,https://news.yahoo.co.jp/articles/f64badda4705289805b755cc6ffa506c3ada60c4,https://newsatcl-pctr.c.yimg.jp/t/amd-img/20240718-00000221-san-000-5-view.jpg?exp=10800,2024-07-18T20:54:31+09:00,2024-07-18T23:18:54+09:00,産経新聞,san,産経新聞,470,\n差し戻し控訴審判決後に会見する朴鐘顕被告の母（中央）と弟（左）＝１８日午後４時５３分、東京・霞が関の司法記者クラブ（滝口亜希撮影）\n東京都文京区の自宅で平成２８年、妻を殺害したとして殺人罪に問われた講談社元編集次長、朴鐘顕（パク・チョンヒョン）被告。１８日、差し戻し後の東京高裁でも有罪とされたことを受け、朴被告や家族は落胆を見せた。\n【図で解説】講談社元次長の公判を巡る争点と判断\n「控訴を棄却する」。家令和典裁判長が判決の主文を言い渡すと、被告人席にいた朴被告は「えっ」と声を漏らした。\n\nその後も「してないんです、僕は」などと発言。判決言い渡しが終わると傍聴席に向かって「この間違いは必ず訂正される。大丈夫」と話した。\n\n被告と亡くなった妻の間には４人の子供がいる。判決後に会見した被告の母（７２）は、「子供たちは、パパは今度こそ無罪になって帰ってくると信じている」と説明。「どう子供たちに報告したらいいのか…」と肩を落とした。\n\n判決後、被告は面会した弁護人に「上告審でただしてもらうしかない」と話したという。,['https://newsatcl-pctr.c.yimg.jp/t/amd-img/20240718-00000221-san-000-5-view.jpg?pri=l&w=640&h=480&exp=10800'],"['https://news.yahoo.co.jp/articles/f64badda4705289805b755cc6ffa506c3ada60c4/images/000', 'https://www.iza.ne.jp/article/20240718-QW7AKNLHVZL5PKMVAAAHWIYCSI/photo/EHHO5HV3UNMRDOZ2KJZ5VA5FQ4/?utm_source=yahoo%20news%20feed&utm_medium=referral&utm_campaign=related_link']"
