headline,mainEntityOfPage,image,datePublished,dateModified,author,media_en,media_jp,str_count,body,images,external_links
お寺彩る現代アート　四国中央で芸術祭始まる　31日まで（愛媛）（愛媛新聞ONLINE）,https://news.yahoo.co.jp/articles/587364f6edd192ba7b8636f93355ce12114a62ee,https://newsatcl-pctr.c.yimg.jp/t/amd-img/20240322-22028401-ehime-000-1-view.jpg?exp=10800,2024-03-22T19:43:00+09:00,2024-03-22T19:43:00+09:00,愛媛新聞ONLINE,ehime,愛媛新聞ONLINE,225,\n四国中央市出身の切り絵作家長谷川隆子さんの5メートルを超える作品「慈眼」＝22日午後、四国中央市寒川町\n国内外で活躍する21組のアーティストによる芸術祭「十一面」が22日、四国中央市寒川町の新長谷寺とその周辺で始まった。仏の目の巨大な切り絵、お堂を飾る鮮やかなパネルなど素材も表現も多様な作品が、厳かな境内を彩っている。本尊「十一面観世音菩薩」の33年に1度のご開帳が行われている31日まで。入場無料で展示は午前10時～午後5時。\n愛媛新聞社,['https://newsatcl-pctr.c.yimg.jp/t/amd-img/20240322-22028401-ehime-000-1-view.jpg?pri=l&w=640&h=426&exp=10800'],['https://news.yahoo.co.jp/articles/587364f6edd192ba7b8636f93355ce12114a62ee/images/000']
松山商や今治西など県大会へ　春季四国高校野球地区予選（愛媛）（愛媛新聞ONLINE）,https://news.yahoo.co.jp/articles/4caacf63759b97b601faaa05b3f463beec1811a7,https://newsatcl-pctr.c.yimg.jp/t/amd-img/20240322-22027101-ehime-000-1-view.jpg?exp=10800,2024-03-22T19:21:00+09:00,2024-03-22T19:21:00+09:00,愛媛新聞ONLINE,ehime,愛媛新聞ONLINE,134,\n松山商や今治西など県大会へ 春季四国高校野球地区予選（愛媛）\n春季四国地区高校野球愛媛県大会の東中南予地区予選第2日は22日、県内6球場で1回戦と代表決定戦の計13試合を行い、昨秋の県大会を制した松山商や準優勝の今治西など9校が県大会進出を決めた。\n愛媛新聞社,['https://newsatcl-pctr.c.yimg.jp/t/amd-img/20240322-22027101-ehime-000-1-view.jpg?pri=l&w=640&h=426&exp=10800'],['https://news.yahoo.co.jp/articles/4caacf63759b97b601faaa05b3f463beec1811a7/images/000']
愛媛県スポーツ振興事業団職員が懲戒免職　横領とパワハラ　「ケツバットするからケツを出せ」など脅す（愛媛新聞ONLINE）,https://news.yahoo.co.jp/articles/7582d1a6fc9fdd96284833e93475750193e5c7d4,https://newsatcl-pctr.c.yimg.jp/t/amd-img/20240322-22028601-ehime-000-1-view.jpg?exp=10800,2024-03-22T22:13:00+09:00,2024-03-22T22:13:00+09:00,愛媛新聞ONLINE,ehime,愛媛新聞ONLINE,536,\n職員の横領やパワハラ行為について記者会見で説明する県スポーツ振興事業団の佐伯登志男専務理事（中央）ら＝22日午前、県庁\n愛媛県スポーツ振興事業団は22日、公金の横領や、複数の同僚へのパワーハラスメント行為があったとして、県総合運動公園に勤務する40歳代の男性係長級職員を21日付で懲戒免職処分にした。\n 事業団によると、2023年3月、県総合運動公園陸上競技場であったラグビープロリーグの試合の際、本来は事業団が主催者から委託を受けて行うコートのライン引き・ライン消し業務を個人で請け負い、委託料11万円を個人名義の銀行口座に振り込ませた。作業をしたのは勤務日だった。元職員は「（芝生の維持管理などを担う）兼業許可を取っていたので個人でやっていいと思っていた」と話したという。横領した金はすでに弁償されているため刑事告発はしない方針。\n また、元職員は23年3月31日、自身の呼びかけに気づかなかった部下の首を絞めながら事務室外に連れ出し「殺すぞ、お前」と発言。「業者対応できていない」と言って左太ももを蹴ったり、事務室で私物のバットを素振りし「ケツバットするからケツを出せ」と脅迫したりした。部下は昨年12月に適応障害による体調不良と診断された。\n愛媛新聞社,['https://newsatcl-pctr.c.yimg.jp/t/amd-img/20240322-22028601-ehime-000-1-view.jpg?pri=l&w=640&h=431&exp=10800'],['https://news.yahoo.co.jp/articles/7582d1a6fc9fdd96284833e93475750193e5c7d4/images/000']
JR高松駅の駅ビル「高松オルネ」オープン　商業棟前には早朝から行列（愛媛新聞ONLINE）,https://news.yahoo.co.jp/articles/1933798d28211f5ce5a36bb15ddef2aa3c1eb09e,https://newsatcl-pctr.c.yimg.jp/t/amd-img/20240322-22025901-ehime-000-2-view.jpg?exp=10800,2024-03-22T19:13:00+09:00,2024-03-22T21:30:04+09:00,愛媛新聞ONLINE,ehime,愛媛新聞ONLINE,316,\nJR高松駅の新駅ビル「高松オルネ」の開業を祝う関係者ら＝22日午前、高松市\nJR高松駅の駅ビル「高松オルネ」が22日、開業した。スーパーマーケットのほか、飲食や雑貨、土産物などを扱う44店が入居する商業棟の前には朝早くから行列ができ、新たな街の顔の誕生に沸いた。JR四国によると、初日の来場者は午後5時に3万人を超えた。\n 開業に先立つ式典にJR四国の西牧世博社長ら13人が出席。テープカットには香川県をPRする「うどん県」の副知事として活動する俳優の要潤さんがサプライズで登場し、駅ビルの出発を祝った。4階ではフリースペースの「アンパンマン列車ひろば」の除幕式があり、地元の幼稚園に通う子どもらが招待された。\n愛媛新聞社,['https://newsatcl-pctr.c.yimg.jp/t/amd-img/20240322-22025901-ehime-000-2-view.jpg?pri=l&w=640&h=480&exp=10800'],['https://news.yahoo.co.jp/articles/1933798d28211f5ce5a36bb15ddef2aa3c1eb09e/images/000']
アサヒビール「出張マルエフ横丁」期間限定オープン　松山で24日まで（愛媛）（愛媛新聞ONLINE）,https://news.yahoo.co.jp/articles/9264ef0e07242b5b63e53126aa55274cfbbfb5a4,https://newsatcl-pctr.c.yimg.jp/t/amd-img/20240322-22027901-ehime-000-1-view.jpg?exp=10800,2024-03-22T20:09:00+09:00,2024-03-22T20:09:00+09:00,愛媛新聞ONLINE,ehime,愛媛新聞ONLINE,251,\nアサヒビール「出張マルエフ横丁」期間限定オープン 松山で24日まで（愛媛）\nアサヒビール（東京）は22日、愛媛県松山市大街道3丁目の松山城山ロープウエー東雲口駅舎前特設会場で「アサヒ生ビール（愛称マルエフ）」を販売するイベント「出張マルエフ横丁」を開いた。24日まで。\n ビールサーバーを備えた「マルエフカー」で全国を巡り、ブランドの世界観や商品の魅力を発信する「日本のみなさん、おつかれ生です。プロジェクト」の一環。2013年12月に長崎県からスタートし、愛媛は11県目となる。\n愛媛新聞社,['https://newsatcl-pctr.c.yimg.jp/t/amd-img/20240322-22027901-ehime-000-1-view.jpg?pri=l&w=640&h=420&exp=10800'],['https://news.yahoo.co.jp/articles/9264ef0e07242b5b63e53126aa55274cfbbfb5a4/images/000']
愛媛県内の新型コロナ感染者が6週連続減少　3月11～17日（愛媛新聞ONLINE）,https://news.yahoo.co.jp/articles/1ec0c7fdb80ebf01c4a505f50ea46221efde9682,https://newsatcl-pctr.c.yimg.jp/t/amd-img/20240322-22022701-ehime-000-1-view.jpg?exp=10800,2024-03-22T17:35:00+09:00,2024-03-22T17:35:00+09:00,愛媛新聞ONLINE,ehime,愛媛新聞ONLINE,330,\n愛媛県内の新型コロナ感染者が6週連続減少 3月11～17日\n愛媛県は22日、第11週（3月11～17日）の新型コロナウイルスの流行状況（定点把握）を公表した。1医療機関当たりの報告数は5・25人で、前週に比べて0・18人減った。6週連続の減少。全国平均は6・15人だった。\n 61定点医療機関の感染者は320人で、前週に比べて11人減った。四国中央と西条、中予を除く4保健所で減少した。\n 3月20日時点の入院患者は148人で、重症者はいなかった。\n 医療・福祉関係のクラスター（感染者集団）は医療機関で2件（新居浜市、松山市各1）、高齢者施設で5件（四国中央市2、西条市、伊予市、久万高原町各1）、大洲市の福祉施設で1件確認された。\n愛媛新聞社,['https://newsatcl-pctr.c.yimg.jp/t/amd-img/20240322-22022701-ehime-000-1-view.jpg?pri=l&w=441&h=640&exp=10800'],['https://news.yahoo.co.jp/articles/1ec0c7fdb80ebf01c4a505f50ea46221efde9682/images/000']
愛媛県内インフル患者、幅広い年代で増加　四国中央は警報に引き上げ　3月11～17日（愛媛新聞ONLINE）,https://news.yahoo.co.jp/articles/cb3c1393eabcd6d609b28c2c9d03fefc3151c940,https://newsatcl-pctr.c.yimg.jp/t/amd-img/20240322-22022801-ehime-000-1-view.jpg?exp=10800,2024-03-22T17:30:00+09:00,2024-03-22T17:30:00+09:00,愛媛新聞ONLINE,ehime,愛媛新聞ONLINE,349,\n愛媛県内インフル患者、幅広い年代で増加 四国中央は警報に引き上げ 3月11～17日\n愛媛県は22日、第11週（3月11～17日）のインフルエンザ流行状況を公表した。1定点の平均人数は21・28人で7・05人増加。県全体の注意報は継続している。\n 61定点医療機関からの患者報告は1298人。幅広い年代で増加しており、特に20～50代は前週の1・9倍に増えた。八幡浜を除く6保健所で増加し、四国中央の注意報を警報に引き上げた。西条の警報、今治と松山市、中予の注意報は継続している。\n 定点当たりの患者報告数は、西条39・80人、四国中央36・80人、今治26・00人など。\n 学年・学級閉鎖は計22校だった。第11週に型別が判明した症例はA型3・1％、B型96・9％だった。\n愛媛新聞社,['https://newsatcl-pctr.c.yimg.jp/t/amd-img/20240322-22022801-ehime-000-1-view.jpg?pri=l&w=640&h=330&exp=10800'],['https://news.yahoo.co.jp/articles/cb3c1393eabcd6d609b28c2c9d03fefc3151c940/images/000']
【小6生必見】中1ギャップに要注意　大切な春休みの学習のポイントは？　高校入試で気になる内申点の仕組みも聞いてみた（愛媛新聞ONLINE）,https://news.yahoo.co.jp/articles/c892b8df6eea33ec1ca295ed62e8c9fad671381f,https://newsatcl-pctr.c.yimg.jp/t/amd-img/20240322-22000301-ehime-000-1-view.jpg?exp=10800,2024-03-22T08:00:00+09:00,2024-03-22T08:00:00+09:00,愛媛新聞ONLINE,ehime,愛媛新聞ONLINE,1533,\n【小6生必見】中1ギャップに要注意 大切な春休みの学習のポイントは？ 高校入試で気になる内申点の仕組みも聞いてみた\n22日は愛媛県内のほとんどの公立小学校で卒業式があります。中学校入学が間近に迫り、喜びと不安が入り交じる時期ではないでしょうか。中学進学後に小学校生活との違いに戸惑う「中1ギャップ」に直面する人も少なくないといわれています。\n 「このギャップを防ぐために活用してほしいのが春休みです」。愛媛で30年以上にわたり塾講師を務める松山市の学習塾「WITH GROW」代表の日下部和子先生は力を込めます。春休みに取り組むべき学習や県立高校入試について教えてもらいました。（原田茜）\n◆ギャップの理由は\nー「中1ギャップ」はなぜ起きますか。\n やはり環境が大きく変化することが要因です。小学校は1こまが45分授業で、大半の教科を担任の先生が教えていたのに対し、中学校では1こま50分、教科担任制へ移行します。定期テストも始まり、学内順位が発表されるように。また部活動がスタートして土日も練習や活動があるほか、複数の小学校区から生徒が集まる中学校では新たに人間関係を築く必要があります。子どもからすると、楽しみと不安が半々といったところだと思います。不安を少しでも取り除くことが大切になります。\n◆内申点って？ \nーどうすれば不安が解消されますか。\n 年間スケジュールなど一定の見通しが立つと準備ができますよね。入学後はすぐ、小学校までの学習内容で4教科の診断テストがあります。宿泊研修の後、6月に1学期末テストを受けるなど予定や行事を把握しておけば、自分が何をすべきかが見えてきます。高校に関しても国立、県立、私立それぞれの学校について、早めに知っておくといいでしょう。学内順位など各校の合格基準値の目安が分かれば、目標を定めることができます。\n 県立高校の入試では▽5教科の学力検査▽9教科の調査書点▽調査書の学習以外の記録や面接、実技テスト―の3項目の計500点満点で合否を判定します。調査書点はいわゆる内申点。中1～3年の9教科の成績が対象で、各学年45点満点の計135点満点です。評価には授業中の取り組みや態度、提出物も影響します。こういった知識が少しあるだけで、学習への意識が変わってくるでしょう。\n◆読み書き計算が基本\nーこの春休みは何をすればいいですか。\n 小学校の学習内容の復習がとても大事です。「読み書き計算」という言葉がある通り、大切なのは漢字と計算です。計算では小数の割り算が苦手な人がいますが、そのままにしておくと、中学校で新たに習う単元でつまずく可能性があります。難しい問題を解く必要はなく、教科書やドリルを解き直してください。\n 先取り学習については、可能であれば4～5月に習う単元まで頭に入れておけば、心に余裕が生まれ、中1ギャップの軽減にもつながります。例えば数学は「正の数と負の数」の計算ぐらいまでで、ユーチューブなどを活用するのも手です。\n◆スマホはルールを決めて\nー家庭へのアドバイスを。\n 中学校入学を機にスマートフォンを使い始める生徒が多いのですが、購入時に「勉強中はスマホをリビングに置いておく」「午後10時以降は使用しない」といったルールを各家庭で決めましょう。便利なツールなので、どう付き合っていくかを子ども自身が学んでほしいです。\n 習い事など、学校以外の居場所をつくることが自信につながったり、ちょっとした変化に気付いてもらえたりするきっかけになります。春休み中は気分転換を図りながら入学準備をしっかりと進め、最良のスタートダッシュを切ってもらいたいです。\n愛媛新聞社,['https://newsatcl-pctr.c.yimg.jp/t/amd-img/20240322-22000301-ehime-000-1-view.jpg?pri=l&w=640&h=446&exp=10800'],['https://news.yahoo.co.jp/articles/c892b8df6eea33ec1ca295ed62e8c9fad671381f/images/000']
希望を胸に1万人が学びやに別れ　愛媛県内公立小学校で卒業式（愛媛新聞ONLINE）,https://news.yahoo.co.jp/articles/c80df5de34e99287a474c59e55bf1b9e51667e76,https://newsatcl-pctr.c.yimg.jp/t/amd-img/20240322-22021601-ehime-000-2-view.jpg?exp=10800,2024-03-22T14:25:00+09:00,2024-03-22T21:20:04+09:00,愛媛新聞ONLINE,ehime,愛媛新聞ONLINE,285,\n卒業証書を受け取る宮前小の6年生＝22日午前、松山市祓川1丁目\n愛媛県内のほとんどの公立小学校で22日、卒業式があった。卒業生は仲間や先生らとの思い出が詰まった学びやを巣立った。\n 松山市祓川1丁目の宮前小では卒業生104人が保護者、在校生らに拍手で迎えられ、体育館に入場。一人一人が「思いやりのある大人になる」「優しい獣医師を目指す」と将来の目標を宣誓し、大西健三校長から卒業証書を受け取った。卒業生全員が壇上で最後の校歌などを元気いっぱいに歌った。\n 県教育委員会によると、県内の卒業生は約1万人。22日は262校中260校が卒業式を行った。\n愛媛新聞社,['https://newsatcl-pctr.c.yimg.jp/t/amd-img/20240322-22021601-ehime-000-2-view.jpg?pri=l&w=640&h=397&exp=10800'],['https://news.yahoo.co.jp/articles/c80df5de34e99287a474c59e55bf1b9e51667e76/images/000']
