headline,mainEntityOfPage,image,datePublished,dateModified,author,media_en,media_jp,str_count,body,images,external_links
TGCに登場した23歳モデルが「世界レベル」　超ミニスカに衝撃「異次元のスタイル」「AIを超越してる」（ENCOUNT）,https://news.yahoo.co.jp/articles/8f88521b10a0756fa6eeeb0a4bf9947778cac285,https://newsatcl-pctr.c.yimg.jp/t/amd-img/20260317-00961082-encount-000-1-view.jpg?exp=10800,2026-03-17T22:10:00+09:00,2026-03-17T22:10:00+09:00,ENCOUNT,encount,ENCOUNT,583,立命館大卒・月野有菜が「TGC」に出演 月野有菜【写真：インスタグラム（＠yuna_tsukino920）より】 俳優でモデルの月野有菜（23）が17日までに、「TGC」のオフショットを公開し、「スタイルが抜群！」と大きな話題を呼んでいる。 【写真】「異次元のスタイル」「AIを超越してる」 TGCに登場した立命館大卒・23歳モデルの全身ショット 14日に開催された、東京・国立代々木競技場第一体育館で開催されたファッションイベント『第42回 マイナビ 東京ガールズコレクション 2026 SPRING/SUMMER』に登場。 167センチで立命館大卒の月野は、自身のインスタグラムを更新し、「TGC」のハッシュタグを添えてオフショットを公開した。 この日は、ボーダーのインナーに、クラシカルな黒のノースリーブ衣装をレイヤードし、黒の超ミニプリーツスカート、ピンヒールのサンダルを合わせている。 圧巻スタイルの全身ショットや、堂々たるウォーキング動画もアップしている。 この投稿に、「アメイジング」「実はスーパーモデルさんなのね」「美女」「抜群のプロポーション」「見惚れっぱなし」「クールビューティー過ぎます」「スタイル神」「世界レベル」「異次元のスタイル」「AIを超越してる！」「足長すぎる」「すでにパリコレ」などの絶賛する声が上がっている。 ENCOUNT編集部,[],[]
元坂道メンバー、Wikipedia情報を訂正　“新事実”にファン驚き「知らなかった」「一番正確」（ENCOUNT）,https://news.yahoo.co.jp/articles/e7d81a12d31f0bacb3c5ae063eb1eb73b1891166,https://newsatcl-pctr.c.yimg.jp/t/amd-img/20260317-00961305-encount-000-1-view.jpg?exp=10800,2026-03-17T21:50:00+09:00,2026-03-17T21:50:00+09:00,ENCOUNT,encount,ENCOUNT,608,長沢菜々香がAKB48グループ関連の情報に言及 長沢菜々香【写真：インスタグラム(@nanako_nagasawa__)より】 元欅坂46（現櫻坂46）の長沢菜々香が17日、自身の一部経歴において“正確な情報”をXで発信した。 【写真】「美しすぎる」…元欅坂46・長沢菜々香の海外水着ショット 長沢は2015年8月、欅坂46の第1期生オーディションに合格。2020年3月をもって欅坂46を卒業し、2020年4月よりマルチクリエイターとして活動している。 その長沢は「Wikipedia訂正したいポイント」とつづり、Wikipediaに書かれた情報のスクリーンショットを添えている。 「SKE48は書類審査は通ったけど、2次審査が名古屋で行けなくて断念。中学生1人で行くには厳しかった…（見知らぬ土地怖い）」 「SKE48第5期生オーディションを受けるが落選」と記載されているが、実際は“断念”したという。 さらに、「AKB48チーム8山形県代表枠オーディションを受けるも最終審査で落選」との記述には、「チーム8は2次の面接まで進んだけど、そこで落ちました！（特技披露せず自己紹介のみで後悔）」と、落ちた段階を訂正している。 長沢の投稿には、「知らなかったよ」「え、エイト受けてるの知らんかったや」「本人からの訂正が一番正確」「自ら補完してくれるなーこちゃん助かる～」などの反応が寄せられている。 ENCOUNT編集部,[],[]
「誰かと思ったら！」　板野友美、“仲良し”女優と撮影…「姉妹みたい」「え、舞香？」の声（ENCOUNT）,https://news.yahoo.co.jp/articles/c41e62de58dac90b856d5a92aa4edb6b979fc1a0,https://newsatcl-pctr.c.yimg.jp/t/amd-img/20260317-00961154-encount-000-1-view.jpg?exp=10800,2026-03-17T21:40:00+09:00,2026-03-17T21:40:00+09:00,ENCOUNT,encount,ENCOUNT,456,板野友美が「MAQUIA」の撮影を報告 板野友美【写真：ENCOUNT編集部】 元AKB48でタレントの板野友美が17日までに、“仲良し”俳優との撮影を振り返っている。 【写真】「姉妹みたい」「誰かと思ったら！」 板野友美＆雰囲気ガラリ“仲良し”女優の最新2ショット 自身のインスタグラムを更新し、美容総合メディア「MAQUIA」で撮影したことを報告した。 今回、ある人物と“コラボ”したようで、そのオフショットも大量に公開している。 「山本舞香ちゃんと美活について語ってます どの2人がすき？」 2人とも、ゆるめにまとめたアップヘアでクリーム色のかわいらしい衣装を着用。同じ色味のメイクを施し、表情も似ていて、どこか“双子”ような雰囲気で写っている。 この投稿に、「誰かと思ったら山本舞香！」「ともちんマイカさん仲良し」「美しいお2人に癒されました」「え、舞香？」「2人とも可愛い」「姉妹みたい」「爆美女すぎます」「マジでヤバすぎるくらいレベチで世界一超かわいい」などの反響を呼んでいる。 ENCOUNT編集部,[],[]
赤楚衛二、津田健次郎ら新キャスト参戦　鈴木亮平主演『TOKYO MER』最新映像に「やっばいぞ」「ガチで過去最大規模」（ENCOUNT）,https://news.yahoo.co.jp/articles/0abbbb808a3170f0e61a07a135ef6c5d82d9264e,https://newsatcl-pctr.c.yimg.jp/t/amd-img/20260317-00961117-encount-000-1-view.jpg?exp=10800,2026-03-17T21:25:00+09:00,2026-03-17T21:25:00+09:00,ENCOUNT,encount,ENCOUNT,2717,首都直下地震に立ち向かう「新生TOKYO MER」 『TOKYO MER～走る緊急救命室～CAPITAL CRISIS』の最新情報が解禁【写真：(C)2026劇場版『TOKYO MER』製作委員会】 俳優の鈴木亮平が主演を務める映画『TOKYO MER～走る緊急救命室～CAPITAL CRISIS』（松木彩監督）の最新情報が17日に解禁され、劇場版第3弾となる本作の公開が8月21日に決定。最新ビジュアルや新キャスト、予告映像も公開され反響を呼んでいる。 【動画】「かっけえー！」「予告だけで泣きそう」 『TOKYO MER』最新予告映像 同作は2021年にTBS系の日曜劇場枠で放送された救命医療ドラマの劇場版最新作。23年4月に公開された劇場版1作目は興行収入45.3億円、25年8月に公開された2作目『TOKYO MER 南海ミッション』は興行収入52.9億円の大ヒットを記録した。 今作の舞台は東京。首都直下地震という未曽有の危機に「新生TOKYO MER」が立ち向かう。前作では喜多見幸太（鈴木）と共に「南海MER」に出向していた蔵前夏梅役の菜々緒がチームに復帰。さらに、新たなメンバーとして赤楚衛二、桜田ひより、津田健次郎、ファーストサマーウイカ、岩瀬洋志の5名が加入することが発表された。 赤楚が演じるのは、世界中の紛争地域での医療活動経験を持つセカンドドクターの扇陽。桜田は研修医の春日亜里沙、津田は機関士の芝和巳、ファーストサマーウイカは麻酔科医の池尻久仁子、岩瀬は看護師の滝野川宗をそれぞれ演じる。 あわせて解禁された最新予告映像では、都内全域で大規模医療事案が次々と発生する絶望的な状況下で、「死者を一人も出さない」という使命を受け継ぎ奮闘するメンバーの姿が描かれている。ティザービジュアルには、全国各地に配備されたERカーが一堂に会する様子が収められた。 この予告映像が公開されると「やばすぎる！」「予告だけで泣きそう」「心臓バクバクした」「ガチで過去最大規模なのでは…」「予告だけでも緊張感がすごい」「マジか！激アツ！」「今作やっばいぞ」「かっけえーーー！」などのコメントが殺到している。 赤楚衛二「ものすごいスケールの救出劇」 出演者のコメントは下記の通り。 ○赤楚衛二 「たくさんの方から愛されているMERシリーズに参加させていただくことはとてもうれしく、そして身が引き締まる思いでした。現場は松木監督と亮平さんを中心にとても熱いチームで、医療に対しても真摯に突き詰めるストイックさがあり、日々刺激的でした。僕の役は喜多見先生と同じく戦地出身の医者で、腕は確かですが仲間を失いたくない想いで一人で突っ走ってしまうキャラクターです。MERチームとの関係性の変化やものすごいスケールの救出劇をぜひ楽しみにしてくださいませ」 ○桜田ひより 「今までMERをファンとして楽しんでいたので、まさか自分がMERの世界に入れるなんて……。驚きと緊張が一気に押し寄せてきました。撮影中も『あ！ ここドラマで見たことある……！』『自分がMERの衣装に袖を通す日が来るなんて……！』と終始ワクワクしていました。頼もしいキャストの皆さん、そして今までキャスト陣と過酷な撮影を共にしてきたスタッフの皆さんが、とても温かく迎え入れてくださったので、のびのびと演じることができました。最初から最後まで目が離せない展開に呼吸を忘れてしまうほど引き込まれ、MERでしか味わえない感動が今回も待っています。私が演じる春日も研修医として必死に食らいついているので、ぜひ楽しみにしていてください」 ○津田健次郎 「TOKYO MERのメンバーとして参加出来ることをとてもうれしく思いました。撮影は他の作品よりも大変だという話も聞いていたのですが、準備段階、そして現場に入って納得。これは面白い。監督、プロデューサーの皆さん、鈴木亮平さんはじめ共演の皆さんの熱量が圧倒的に高い。黒岩勉さんの生み出す躍動感ある脚本をベースに、関わる全ての皆さんのリアリティに対する拘りや緊張感が、良い作品を作るエネルギーとしてうねっている。医療部分や事故現場の撮影などはやはり大変だったのですが、拘りを持って芝居に臨める贅沢を味わわせていただきました。僕が演じさせていただいた芝、そしてMERメンバーそれぞれのドラマ、クライマックスに向けて疾走する壮大なエンターテイメントを楽しみにしていてください」 ○ファーストサマーウイカ 「麻酔科医・池尻久仁子役のファーストサマーウイカです。MERのファンなので、『新TOKYO MER』で麻酔科医役と伺ったときは、『私が新メンバー？ え、TOKYOメンバー替わるの!? キャピタル……!? 東京で何が起きるの!?』と大慌てでした。シリーズの新たな一員として加わる緊張と喜びが、池尻先生の心境と重なる部分が多く、メンバーも愉快な人ばかりで楽しい日々でした。とはえ、劇中で起きる事件が過酷であれば、やはり撮影も過酷です。寒さも厳しく連日ハードでしたが、現場には笑顔が絶えず、チームの深い絆と作品を愛するパワーにあふれていて、キャスト・スタッフ陣へのリスペクトが止まりませんでした。長年のファンの皆さまと築かれた信頼を感じながら臨んだ『CAPITAL CRISIS』、ぜひ劇場で見届けてください！」 ○岩瀬洋志 「憧れの鈴木亮平さんとの共演ができ夢のようでした。俳優のお仕事を始めてからずっと医療をテーマにした作品に出演したいと思っていましたので、初めての作品がMERでとてもうれしかったです。撮影現場は、緊張感がすごかったです。患者さんを助けるために1秒でも早く動き、生と死のギリギリを生きている感じが衝撃的でした。とても刺激的で感動的な作品になっています。僕が演じる看護師・滝野川宗は、若手で経験も精神的にも未熟ですが、先輩達に負けないよう頑張っていますので、滝野川にも注目していただけるとうれしいです」 ○菜々緒 「劇場版『TOKYO MER』が、ついに第三弾を迎えます。今までにない最大のミッションに、喜多見チーフ、夏梅、そして新しいメンバーが、力を合わせて立ち向かいます。これまで長い時間を共に闘ってきた戦友であり共演者、制作スタッフ、そして応援してくださっているMERファンの皆様のおかげで、ここまで歩んでくることができました。夏梅さんは今回もしっかりと現場を支えながら奮闘しています。さらに、なにやら面白い展開もあるようです。ぜひ、劇場で見届けていただけたらうれしいです。ご期待ください」 ENCOUNT編集部,[],[]
難関校卒業の本田紗来が「可愛すぎ」　新生活の「相棒」紹介で反響「イエベ春かな？」（ENCOUNT）,https://news.yahoo.co.jp/articles/7b6c0d6ccae966a2e14d9075417bdb8058da46fd,https://newsatcl-pctr.c.yimg.jp/t/amd-img/20260317-00961155-encount-000-1-view.jpg?exp=10800,2026-03-17T21:15:00+09:00,2026-03-17T21:15:00+09:00,ENCOUNT,encount,ENCOUNT,376,偏差値68の難関校を卒業 本田紗来【写真：ENCOUNT編集部】 先日、高校を卒業したタレント・本田紗来（18）が17日、「新生活の相棒」を紹介した姿に注目が集まっている。 【写真】「めちゃくちゃ可愛すぎ」と反響…難関校卒業の本田紗来の近影 本田は今月3日、“明八”の愛称で親しまれる明治大付属八王子高の卒業を報告。同校は高校入試の偏差値が「68」とも言われる都内屈指の難関校として知られ、「可愛いのに頭いいとか勝てるものない」など、驚きの声が上がっていた。 その本田は、「この間、高校を卒業。私の新生活の相棒を紹介します」とつづり、ヘアアイロンを手にした姿をアップした。 ピンクのセーターにストライプのシャツ、ジーンズと春らしいコーデには、「めちゃくちゃ可愛すぎる」「さらちゃんはイエベ春かな？」などのコメントが寄せられていた。 ENCOUNT編集部,[],[]
国家資格取得の38歳グラドル、肩出しニットのオフにネット注目「若く見える」「めっちゃ美人」（ENCOUNT）,https://news.yahoo.co.jp/articles/94c340b3c939149c5557f333cc8f3755da16404f,https://newsatcl-pctr.c.yimg.jp/t/amd-img/20260317-00961209-encount-000-3-view.jpg?exp=10800,2026-03-17T21:05:00+09:00,2026-03-17T21:10:38+09:00,ENCOUNT,encount,ENCOUNT,363,「趣味ひとり呑みと競輪」の永岡怜子 永岡怜子【写真：X（＠nagaoka_reiko）より】 グラビアアイドルの永岡怜子が17日、街中で撮影したプライベート動画をアップし、反響を呼んでいる。 【動画】「若く見える」「めっちゃ美人」 38歳グラドルの肩出しニット姿 自身のXで、「趣味ひとり呑みと競輪の38歳異常独身女性 グラビアアイドルで鍼灸師でMCができるオタク」と自己紹介。 Xを更新し、「昭和生まれだからか、ダブルピースが癖がございます」とつづり、動画を公開した。 この日は、淡いブルーの肩出しニットを着用。振り向きざまにダブルピースで映っている。 この投稿に、「めっちゃ美人」「ハートを撃ち抜かれた」「普段の外出用コーデ、初めて見たかも」「若く見える」「かわいい～」などのコメントが集まっている。 ENCOUNT編集部,[],[]
安藤美姫、メディア拒絶の過去「誰も守ってくれない」　“未婚の母”公表から13年…長女顔出しで共演（ENCOUNT）,https://news.yahoo.co.jp/articles/af99475387bf93b71053315c63f58477be1f1a98,https://newsatcl-pctr.c.yimg.jp/t/amd-img/20260317-00961017-encount-000-1-view.jpg?exp=10800,2026-03-17T20:50:52+09:00,2026-03-17T20:50:52+09:00,ENCOUNT,encount,ENCOUNT,604,ファンからも「応援の手紙が全部批判の手紙に」 安藤美姫【写真：ENCOUNT編集部】 プロフィギュアスケーターでタレントの安藤美姫が15日、ABEMA『秘密のママ園2』 #7に12歳の長女ヒマワリさんと出演 。かつてメディアを拒絶していた過去について、当時の心境を振り返った。 【動画】「顔はお母さんそのもの」「12歳でこのスタイル!?」安藤美姫の12歳長女ヒマワリさん 14歳で4回転ジャンプを成功させ、メディアから大きな注目を集めたが、18歳で出場したトリノ五輪で15位に沈むと、手のひらを返したようにメディアが離れていったと回顧。 「誰も守ってくれない。いい時はいいことだけ言って、結果が出なかったらいらない。18歳の時に理解ができた」と振り返り、「メディアの方もさーっていなくなった」「一般の方からも、応援の手紙から全部批判の手紙に変わった瞬間」と、かつてメディアを拒絶し心を閉ざすきっかけとなった挫折を打ち明けた。 13年前には「未婚の母」として出産したことも公表。この放送では12歳になったヒマワリさんと一緒に出演し、母の顔も見せていた。一方で「本当はスケートをやってほしくない」「絶対つらい思いをする」と複雑な母心を吐露。さらに、自身が直接スケートを教えない理由についても「スケートの楽しさを教えてあげられない」「最初から厳しくなっちゃう」などと複雑な心境も口にしていた。 ENCOUNT編集部,[],[]
ユージ、話題のマイバッハが納車2か月で驚き査定「ガクッと落ちてる」　“回収”に意欲「2000万円以上で買ってるから」（ENCOUNT）,https://news.yahoo.co.jp/articles/a22cbef6ea2924bd48527ac61f428be1f7bbd903,https://newsatcl-pctr.c.yimg.jp/t/amd-img/20260317-00960997-encount-000-1-view.jpg?exp=10800,2026-03-17T20:40:52+09:00,2026-03-17T20:40:52+09:00,ENCOUNT,encount,ENCOUNT,583,走行距離は2万キロ ユージ【写真：ENCOUNT編集部】 タレントのユージが、17日までに更新したYouTubeチャンネルで今年1月に購入を公表した高級車の現在の金額を明かし、その査定への率直な感想を語っている。 【写真】「えぐすぎ」と驚きの声…ユージが公開した新愛車との2ショット＆内装 車好きで知られるユージは今年1月、メルセデスのGLSマイバッハ購入を公表。支払い方法は「ガチガチのフルローン」で、「買った金額は2300～2400万円」と今回明かした。 その中で、納車から2か月が経過した愛車の現在の価格を探るべく、ネット査定を実施。7社から金額の提示があったとし、一番高かったのは「1608万8000円」だったという。 購入金額とは約800万円差。ユージは「リアルなこと言うと、めっちゃいい金額だったら売って、違う車に乗り換えてもいいかなと思ったんだけど、2000万円以上で買っているので、まだ買ったばかりでもうちょっと回収したいなと」と“売らない”意思を示した。 「2か月しか乗っていなくてガクッと落ちているから、もうちょっと楽しみたいです、マイバッハライフを。正直言って、めちゃくちゃ気に入ってるんで、何も不満がないので」 現在の走行距離は「ちょうど2万キロ」。「まだ慣らし運転よ」と笑顔を見せ、「しばらく乗ると思う」と語っていた。 ENCOUNT編集部,[],[]
18歳現役ラウンドガール、「この世で一番可愛い妹」にネット注目「美人姉妹すぎる」（ENCOUNT）,https://news.yahoo.co.jp/articles/5dd03a6fa1bc42d7d8d28303852556e211556f11,https://newsatcl-pctr.c.yimg.jp/t/amd-img/20260317-00961056-encount-000-2-view.jpg?exp=10800,2026-03-17T20:30:15+09:00,2026-03-17T20:48:55+09:00,ENCOUNT,encount,ENCOUNT,433,卒業式のヘアメイクを担当 百田汐里【写真：ENCOUNT編集部】 グラビアアイドルで現役ラウンドガールとしても知られる百田汐里が、最愛の妹の卒業式を見届けたことを明かし、ファンをほっこりさせている。 【写真】「美人姉妹すぎる」 18歳ラウンドガール、妹との姉妹ショット 百田は大阪府出身の18歳。168センチの長身を誇り、2023年にはABEMA『今日、好きになりました。フーコック島編』に高校1年生で出演して話題となった。 その百田は、「この世で一番可愛い妹の卒業式でした」と、卒業式を迎えた妹の頭をなでるような写真などをアップした。 「ちっちゃくて可愛い赤ちゃんがお姉さんになった姿を見ることができて嬉しかった」 仲良し姉妹としても知られる2人。「髪の毛はしおりに任せてくれた。可愛くできてよかった。いっちばん可愛かった」と喜びをつづっている。 投稿に対しては、「美人姉妹すぎる」「かわいい」「良きお姉さん」などのコメントが寄せられている。 ENCOUNT編集部,[],[]
『ラヴ上等』出演の元暴走族総長が“重大発表”　熱すぎる宣言にファンは「最高」「かっこよすぎ」（ENCOUNT）,https://news.yahoo.co.jp/articles/6848f5b5d311f4c2b5fe85f4c4855950b42214b0,https://newsatcl-pctr.c.yimg.jp/t/amd-img/20260317-00961291-encount-000-3-view.jpg?exp=10800,2026-03-17T20:19:30+09:00,2026-03-17T20:20:39+09:00,ENCOUNT,encount,ENCOUNT,709,2026年4月に「塚原漢塾」の開校を発表 塚原舜哉【写真：インスタグラム（@yarou_4070）より】 俳優でタレントのMEGUMIがプロデュースするNetflixリアリティシリーズ『ラヴ上等』に出演している“つーちゃん”こと元暴走族総長のYouTuber・塚原舜哉が17日、「塚原漢塾」の開校を発表した。 【写真】「お似合いすぎ」「美男美女で素敵」 元暴走族総長が公開したラブラブ2ショット お馴染みのサングラスに金ネックレス姿のつーちゃん。「重大発表」のテロップで、2026年4月に「塚原漢塾」の開校を発表した。 その理由について、「俺のテーマには『負けない人生』『負けない気持ち』というおれのワードがある中で、世間では23年が自殺率が過去ワースト1。そんな中で俺の生きざまを伝えたい。男ってプライドがマジで高い。邪魔して誰にも相談できない。ためてためて、最終的になっちゃう。おれも壮絶な人生。悪いことも多かった。悩んでいる人がいる中で、おれが一人でも救いたい。自殺率を1％でも下げたい。マジで向き合ってぶつかっていく。宣言します。1人でも多くの人生。悩みもすべて、1年かけて変えます。それが塚原漢塾」と熱く語った。 月1回、リアルで向き合っての対話。月2回のオンラインでの漢塾。オープンチャットも開設し、自身の考えを伝えていくという。人数は20人に厳選するという。「全国から本気で人生変えたい人応募待ってます」と呼びかけた。 ファンからは「最高」「かっこよすぎ」「私も入学したい！！男専門ですか？」「ヤンキーとかギャルマインドってほんと大切だと思う」「たのむぜ」などの声が寄せられていた。 ENCOUNT編集部,[],[]
