headline,mainEntityOfPage,image,datePublished,dateModified,author,media_en,media_jp,str_count,body,images,external_links
16歳で妊娠、出産後に夫の不倫発覚→18歳で離婚　有名になった現在に「今は後悔してるみたい」（ENCOUNT）,https://news.yahoo.co.jp/articles/d0ec747b17e66a6c358393dcf22f21b92c4834ff,https://newsatcl-pctr.c.yimg.jp/t/amd-img/20260317-00960949-encount-000-3-view.jpg?exp=10800,2026-03-17T18:01:31+09:00,2026-03-17T18:30:47+09:00,ENCOUNT,encount,ENCOUNT,700,"DMでのスカウトが転機に 『ななにー 地下ABEMA』に出演した17歳で出産した女性【写真：(C)AbemaTV,Inc.】 ABEMA『ななにー 地下ABEMA』が15日、放送された。「人生激変？その後SP」と題された今回の放送では16歳で妊娠、17歳で出産した女性の現在が特集された。 【動画】「もっと後悔させてやる」16歳で妊娠、18歳で離婚した22歳…人気モデルになった現在の姿 16歳だった高2で妊娠、出産を決意したレオさん。両親の反応は「びっくりするぐらいキレてて、産むつもりはなかったみたいで。パパは大反対でした。お母さんも、なんだかんだでレオの味方になるよ、応援するよって言ってくれたので。そこでちゃんと決意が固まったっていう感じです」と振り返った。 17歳。出産後に当時の夫、子どもとの3人暮らしを始めたレオさんだったが、しかし夫の浮気が発覚。なんと免許合宿で出会った女性が相手だった。 「帰ってきた日に、家で常にモバイルバッテリーを持ち歩いて充電するんですよ。でも、絶対怪しいと思って。彼が寝た後に携帯を見たんです。そしたら予想通り、浮気してました」 これが原因で18歳で離婚。時給930円の飲食店などでかけもちシングルマザーとして子どものために働き続けたという。転機は22歳。DMで現在の事務所からスカウトが。現在はギャル雑誌「nuts」の専属モデルとして活躍するまでになった。 これは元夫の耳にも届いているようで、「周りからいろいろ噂を聞いて、今は後悔してるみたいです。これからももっと頑張って、もっと後悔させてやろうと思ってます」と決意を口にしていた。 ENCOUNT編集部",[],[]
総フォロワー1140万人の有名人、パチンコ店からの来店オファーに困惑　最後に打ったのは18年前「なんで呼ばれた」（ENCOUNT）,https://news.yahoo.co.jp/articles/a419942dc2aef7f1a77984671a98d6834e6e0671,https://newsatcl-pctr.c.yimg.jp/t/amd-img/20260317-00961196-encount-000-4-view.jpg?exp=10800,2026-03-17T17:45:38+09:00,2026-03-17T19:33:10+09:00,ENCOUNT,encount,ENCOUNT,566,SNSでは「近くに来たら見に行きたい」の声も パチンコ店からのまさかの来店オファーが話題に（写真はイメージ）【写真：写真AC】 料理研究家でYouTuberのリュウジが自身のSNSでパチンコ店からのまさかのオファーにツッコミを入れている。 【写真】「なんで呼ばれた」パチンコ店のイベント出演が決まった総フォロワー1140万人の有名人 発端はあるパチンコ店が15日、3月28日にリュウジが来店することを告知。「SNS総フォロワー1140万人リュウジさん来店」としたこの投稿が現在までに340万回以上表示されるなど、大反響を呼んだ。 これを受けて、リュウジは「マジでなんで呼ばれたかわかんねえけど若い頃にエヴァで大敗してから18年ぶりに打ちます 料理？しねえよ」と困惑しつつポスト。 さらにこのあと、オファーが殺到していることについて「なんか全国のパチンコ屋からオファーくんだけどなんだこの業界、おれ18年パチンコに触れてないって言ったろ（困惑）」と再びつぶやいていた。 ユーザーからは「てかパチンコする人にリュウジさんの需要があるのか疑問」「これはパチ屋で料理するしかない」「おもろいww」「近くに来たら見に行きたい」「北戸田近いしちょっと覗いてみるか？ と思うくらいには影響力アリアリ」などの声が上がっていた。 ENCOUNT編集部,[],[]
大相撲中継にず～っと映り込んでいた大物芸能人、「おるやん」「一瞬一般人かと」客席での姿に驚きの声（ENCOUNT）,https://news.yahoo.co.jp/articles/2dc834518e093288a4b36a5cdccce8f302d6952e,https://newsatcl-pctr.c.yimg.jp/t/amd-img/20260317-00961165-encount-000-4-view.jpg?exp=10800,2026-03-17T17:06:54+09:00,2026-03-17T17:10:10+09:00,ENCOUNT,encount,ENCOUNT,567,十両取組中に映り込み視聴者の注目集める 大相撲春場所、大物芸能人の映り込みが話題に（写真はイメージ）【写真：写真AC】 大相撲春場所は連日熱戦が展開されている。16日には客席に“大物落語家”の飾らない姿が映り込み、視聴者の注目を集めた。 【動画】「一瞬一般人かと」「ずっと右端に映ってる」大相撲中継で視聴者の注目浴びた大物芸能人 十両の取組中、向正面の溜まり席が映し出されると、落語家・笑福亭鶴瓶の姿が確認された。白と黒のバイカラーが目を引くカジュアルなパーカー姿で、周囲と気さくに談笑する様子が捉えられた。 注目の一番は、十両九枚目・玉正鳳（片男波）と十両十二枚目・剣翔（追手風）の対戦。立ち合いから頭で当たった玉正鳳が素早く中に入り、左を差して右上手を引く攻めを展開した。左膝に大きなサポーターを巻いた剣翔は防戦一方となり、玉正鳳が寄り切りで2勝目（7敗）を挙げた。 その一方で、画面の端に映り続けた鶴瓶の存在にも視線が集まり、ABEMAの視聴者からは「笑福亭おるやん」「あっ芸能人」「つるべえ一瞬一般人と思った」「鶴瓶」といった声が上がった。さらにSNS上でも「今日の大相撲に鶴瓶見に来てるやんw」「すぐ分かったわw」「相撲見てるけどずっと右端に鶴瓶さん映ってる」などのコメントが寄せられ、驚きが広がった。 ENCOUNT編集部,[],[]
恒例全国ツアーの銀シャリ、“日本代表”に意欲「ワールド・べしゃり・クラシック（WBC）があればいい」（ENCOUNT）,https://news.yahoo.co.jp/articles/9e569e84880d0dd9a520b5537f2b1f3195c8740d,https://newsatcl-pctr.c.yimg.jp/t/amd-img/20260317-00961069-encount-000-1-view.jpg?exp=10800,2026-03-17T17:02:24+09:00,2026-03-17T17:02:24+09:00,ENCOUNT,encount,ENCOUNT,2035,『M-1』に続き上方漫才大賞も受賞「これからは自分との戦い」 イベントに登壇した銀シャリの鰻和弘（左）と橋本直【写真：ENCOUNT編集部】 昨年、第60回上方漫才大賞を受賞したお笑いコンビの銀シャリが今年、全国11都市13会場を巡るツアー『べシャリの帝王 萬才銀次郎』を開催する。17日には取材会が行われ、橋本直と鰻和弘が正統派のしゃべくり漫才を続ける気概を語った。 【写真】「朝起きてびっくり」「良すぎて頭入ってこん」の声 激変した『M-1』王者の姿 昨年の20周年は、上方漫才大賞の受賞や初のロサンゼルス公演など、コンビとして大きな成果を残す一年となった。 「もうこれからは自分との戦いです」という橋本は「去年は20周年できりがよかったですが、21年目って言いづらいですね」と苦笑しつつも、今年については「絶対に去年より良くなっていると思うので。チャップリンが自身の最高傑作を問われて『次（The Next One）』と答えたように、僕らも一番を更新し続ける内容にしたいです」と意気込んだ。鰻も「ツアーで合計1万人、本当に全部埋まっていて。それだけ愛されているので、頑張りたいです」とファンに感謝した。「いつも通り新しい漫才をたくさん披露して。古典落語の領域に入ってきました」と、新ネタに自信を見せる。 本ツアーの千秋楽は大阪・なんばグランド花月で行う。花月での通常公演でもトリを務めることが増えてきたが、橋本は「『トリを取りたい』って言ってるうちは、まだ遠いと思うんです。目の前の舞台をがむしゃらにやってたら、気づいたらトリを任されてたって感じです」と振り返った。 毎年ツアーも開催してしゃべくり漫才を続けてきた2人は「10周年の時にジャルジャルにゲストに来てもらったくらいで、他にはゲスト一切呼ばないでツアーを続けてきたので、打ち上げのメンバーがずっと一緒。打ち上げだけゲストが欲しいです（笑）」と笑わせつつ、ちょうど10年前の『M-1グランプリ』制覇の頃の思い出も振り返る。 橋本は審査員を務めた中川家・礼二とのエピソードに言及。「礼二さんから『漫才続けてくださいね』と言われました。もちろん辞めるつもりは全くなかったんですが、今思えば非常に重たい言葉でした。ツアーで漫才をしっかり届けることは、その責務に少しは応えられているのかな」と、上方漫才の継承者としての思いをにじませた。 また、鰻は先輩芸人から「M-1で優勝した時より、今の方が全然面白いネタをいっぱい作れている」と言われたエピソードを披露。「そう言ってもらえてめちゃくちゃうれしいです」と語った。 さらに、優勝当時を振り返り橋本が「僕らはドラマやCMの華やかなオファーがバンバン来るような恵まれた時代に優勝したわけじゃなかった」と話せば、鰻も「ドラマも出てみたいですね。橋本なんて昭和顔の代表みたいな顔してるから『あんぱん』なんか似合うと思ったのに（笑）。使うだけで話題性になる」とボケてみせるも、「演技下手ですからね」（橋本）と自虐ネタで締める一幕も。それでも橋本は今ツアーの『ミナミの帝王』風のキービジュアルを指して、「鰻くんが『本当にヤバい奴の顔してる』って先輩に言われました」と話し、「このポスターで俳優の仕事来るかもしれないですね」と笑いを取っていた。 今後の目標を問われると、橋本は「ワールド・べしゃり・クラシック（WBC）があればいいですね。世界中で翻訳機が発達して、ベネズエラの漫才師と日本代表として戦ってみたいです」と冗談を飛ばしつつ、「今の若い世代に『漫才師といえば銀シャリ』と思ってもらえるようになりたいです。ネタ作りがおもちゃのように楽しくて。後輩からイジられるタイプの師匠になれれば最高ですね」と意気込む。鰻も「ゴールも何にもないです。50年やった時とかどうなるんやろなって。変な域に行くのかも」と漫才を追求し続ける気概を見せた。 ツアーは5月2日の北海道公演から開幕し、12月25日の大阪・なんばグランド花月での千秋楽まで7か月をかけて全国を巡る。 ■銀シャリ単独ライブ2026「ベシャリの帝王 萬才銀次郎」 【北海道】5月2日（土）：共済ホール 【石川】5月10日（日）：金沢市文化ホール 【愛媛】5月30日（土）：松山市民会館 中ホール 【東京】7月3日（金）：有楽町よみうりホール 【広島】7月11日（土）：アステールプラザ大ホール 【大阪】7月24日（金）：サンケイホールブリーゼ 【愛知】8月28日（金）：Niterra日本特殊陶業市民会館 ビレッジホール 【新潟】9月5日（土）：りゅーとぴあ劇場 【兵庫】9月13日（日）：神戸新聞松方ホール 【福岡】9月26日（土）：福岡国際会議場メインホール 【宮城】11月28日（土）：電力ホール 【東京】12月19日（土）：有楽町よみうりホール 【大阪】12月25日（金）：なんばグランド花月 ENCOUNT編集部,[],[]
『リブート』「今回の一香は…」　衝撃の第8話放送直後…戸田恵梨香が明かしていた演技の裏側に19万バズ（ENCOUNT）,https://news.yahoo.co.jp/articles/770fd3c2e1bfd7571aabc92cb28bd8fbff9fceb3,https://newsatcl-pctr.c.yimg.jp/t/amd-img/20260317-00961142-encount-000-4-view.jpg?exp=10800,2026-03-17T16:33:06+09:00,2026-03-17T16:54:11+09:00,ENCOUNT,encount,ENCOUNT,698,「ギャル恵梨香に付き合ってくれてる」山口紗弥加との2ショット投稿 戸田恵梨香【写真：ENCOUNT編集部】 俳優の戸田恵梨香が16日、自身のSNSで出演するTBS系連続ドラマ『リブート』で演じる幸後一香のイメージとなった先輩について明かした。 【写真】「ギャル恵梨香に付き合ってくれてる」戸田恵梨香が公開した『リブート』オフショット （※以下、ドラマの内容に関する記述があります） 15日に放送された第8話ではこれまでの以上の衝撃展開に。そして一香の正体が遂に明らかになった。 本作は、妻殺しの罪を着せられた平凡なパティシエ・早瀬陸（松山ケンイチ）が、自らの潔白を証明するべく、警視庁の悪徳刑事・儀堂歩（鈴木亮平）に顔を変えてリブート（再起動）し、事件の真相を追い求めるエクストリーム・ファミリーサスペンス。 そんな中で戸田が演じる一香の正体は陸の妻・夏海だったことが明らかに。夏海自身もリブートしていたのだ。“答え合わせ”ともいえる形で、これまでの一香のさまざまなシーンが登場。正体を知った上で観ると、改めて葛藤や切なさが表現されている表情の数々が胸に迫る演技が反響を呼んだ。 放送後には戸田が自身のSNSを更新。「ギャル恵梨香に付き合ってくれてる パイセン紗弥加ねぇさん」と記し、夏海役の山口紗弥加との2ショットを投稿。続けて、「今回の夏海が演じる一香は吉瀬美智子イメージ ベース芝居山口紗弥加 演じるのが私ということで 一香はフラームで出来ています→なんのはなし？」と一香のイメージを明かしていた。 放送後直後のこの投稿には現在までに19万超のいいねが寄せられていた。 ENCOUNT編集部,[],[]
73歳・小柳ルミ子、スタイル際立つ衝撃衣装に「フィギュアみたい」「かっこよすぎる」（ENCOUNT）,https://news.yahoo.co.jp/articles/de6df5c530021002c100f12808dd3f50d29855ab,https://newsatcl-pctr.c.yimg.jp/t/amd-img/20260317-00960932-encount-000-1-view.jpg?exp=10800,2026-03-17T16:03:27+09:00,2026-03-17T16:03:27+09:00,ENCOUNT,encount,ENCOUNT,540,『人生、歌がある』出演を紹介 小柳ルミ子【写真：ENCOUNT編集部】 歌手の小柳ルミ子（73）が17日、自身のインスタグラムを更新し、21日放送のBS朝日の歌番組『人生、歌がある』（土曜午後7時）に出演することを報告。抜群のスタイルが際立つ衣装に、注目が集まっている。 【写真】「スタイル抜群」「フィギュアみたい」 小柳ルミ子、衝撃衣装の全身ショット 「3/21 BS朝日【人生、歌がある】 新曲『愛は輪廻転生』テレビ初歌唱」の書き出しで、歌唱場面などの写真を添えて投稿。「もう1ヶ月以上も前の収録だから 私が振り付ける振りも固まってなくて アドリブで踊っちゃった」と当日のパフォーマンス秘話を明かした。 番組で着用したのは、2日の歌手デビュー55周年記念曲『愛は輪廻転生』お披露目ライブでも披露した金色のゴージャスな衣装。同ライブでは熱唱パフォーマンスで意気込みを語り、「『エロかっこいいぜ！』と書いてください」と報道陣にアピールしていた。 年齢を重ねても変わらぬ美貌に「綺麗カッコいい」「スタイル抜群」「素敵」「カッコイイ!!」「フィギュアみたいにめちゃキマッてて素敵」「めっちゃスタイルキレイ」「かっこよすぎるでしょ」などのコメントが寄せられている。 ENCOUNT編集部,[],[]
目黒蓮主演『SAKAMOTO DAYS』　激しいバトルと日常が交錯する場面写真を一挙解禁（ENCOUNT）,https://news.yahoo.co.jp/articles/d72e0695f0d59679bedacf09c8caec78d6dbea22,https://newsatcl-pctr.c.yimg.jp/t/amd-img/20260317-00961099-encount-000-1-view.jpg?exp=10800,2026-03-17T16:00:00+09:00,2026-03-17T16:00:00+09:00,ENCOUNT,encount,ENCOUNT,980,凄腕の殺し屋が見せる迫真のアクションと温かな家族の日常 『SAKAMOTO DAYS』の場面写真25点が解禁された【写真：(C)鈴木祐斗／集英社、2026映画「SAKAMOTO DAYS」製作委員会】 Snow Manの目黒蓮が主演を務める映画『SAKAMOTO DAYS』（4月29日公開、福田雄一監督）の場面写真25点が17日、一挙に解禁された。 【写真】目黒蓮、アクションシーンや高橋文哉とのバディ感ある2ショット 本作は、2020年11月より集英社『週刊少年ジャンプ』で連載が始まり、全世界累計発行部数1500万部（デジタル版を含む、25年8月時点）を突破した同名作品が原作。 かつて全ての悪党が恐れた伝説の殺し屋・坂本太郎が、コンビニで働く女性・葵に一目ぼれしたことをきっかけに殺し屋を引退し、結婚、娘の誕生を経て「坂本商店」を営みながら、迫り来る刺客と戦う“日常×非日常”のソリッドアクションストーリー。25年1月から放送されたアニメは、Netflixでの全世界配信初週に860万回視聴を記録し、日本国内でも1060万回以上再生されるなど大きな反響を呼んだ。 実写映画では、目黒が伝説の殺し屋・坂本を演じる。推定体重140キロのふくよかな姿で圧倒的な強さと包容力を備える坂本と、本気モードで最強の殺し屋の片鱗を取り戻し、急激に痩せ細るスマートな坂本の「一人二面性」を巧みに表現した。坂本の相棒・朝倉シンを高橋文哉、妻・坂本葵を上戸彩が演じるほか、横田真悠、戸塚純貴、塩野瑛久、渡邊圭祐、北村匠海、生見愛瑠、八木勇征、小手伸也、桜井日奈子、安西慎太郎、加藤浩次、津田健次郎ら豪華キャストが出演。主題歌はSnow Manの『BANG!!』に決定している。 今回解禁された25点の場面写真には、16人のキャラクターそれぞれのカットに加え、坂本と鹿島（塩野）、シンと勢羽（渡邊）による激しいアクションを予感させるバトルシーンを公開。 また、ポテトチップスを寝ころびながら食べる坂本と笑顔の葵、娘の花（吉本）との一家団らんの様子や、葵を前に坂本らが神妙な面持ちでベンチに正座をしている日常の1シーンといった、本作の世界観がつまった厳選の場面写真で、坂本の愛する家族との平和な日常と、危険が常に隣り合わせの命懸けの日々が映し出されている。 ENCOUNT編集部,[],[]
尾上菊五郎、家の中では「はっちゃん」!?　父・七代目の呼び分け提案に苦笑「せめて家の中だけでも…」（ENCOUNT）,https://news.yahoo.co.jp/articles/92eb77bd71bf85702ad72fb2dbe8af7ef0499b07,https://newsatcl-pctr.c.yimg.jp/t/amd-img/20260317-00960857-encount-000-1-view.jpg?exp=10800,2026-03-17T15:31:16+09:00,2026-03-17T15:31:16+09:00,ENCOUNT,encount,ENCOUNT,1336,7月7日から全国19会場を巡業「一座の結束が生まれていく面白さ」 記者会見に出席した尾上菊五郎【写真：ENCOUNT編集部】 歌舞伎俳優の八代目尾上菊五郎が17日、都内で行われた「令和八年度（公社）全国公立文化施設協会主催『松竹大歌舞伎』尾上菊之助改め八代目尾上菊五郎襲名披露」の製作発表記者会見に出席した。 【写真】Zeebraのラップに送り出される菊之助と丑之助 本興行は、2025年5月の歌舞伎座を皮切りに主要劇場で始まった八代目尾上菊五郎襲名披露興行の全国公演で、7月7日から31日まで全19会場27公演をまわる。共演は片岡愛之助、坂東彦三郎、嵐橘三郎、中村雀右衛門。『雨の五郎』『藤娘』の舞踊2本立てで始まり、ご当地の方々に襲名のあいさつを行う『口上』をはさみ、音羽屋ゆかりの世話物の名作『魚屋宗五郎』を上演する。 襲名興行が始まって間もなく1年。父と同じ「菊五郎」呼びに慣れたかどうか聞かれると、「最初に『菊五郎』と呼ばれた時は、（父の）七代目のことかと思いました。私はまだ1年たらずなので、まだまだ耳馴染んでいない。一興行、一興行、菊五郎として名乗って舞台に立たせていただくことで、だんだん馴染んでいくのかと」と恐縮。「『八代目』と呼んでいただくことが多くなり、『八代目といえば私のことだな』と思うようにはなってきました」とこの1年を振り返った。 父・七代目菊五郎は「菊五郎」が2人になる際に、「しっちゃん（七）、はっちゃん（八）」と呼び分ける提案をしていたが、「そういうふうに呼んでいただける方がなかなかいなくて……」と苦笑いし、「せめて家の中だけでも呼んでおきます」と報道陣を笑わせた。 八代目菊五郎の全国巡業は、2018年以来8年ぶり。「巡業は1日1日移動していくもの。普段なかなか交流できない方とも電車やバスで移動するので、一座の結束が生まれていく面白さも巡業の楽しみです」と笑顔。「その土地土地の空気を感じ、朝早く起きて神社に行ったり、お城に行ったりするのも楽しみ。地方のみなさまは歌舞伎に触れていただく機会が少ないので、歌舞伎の華やかさや日本文化に触れていただきたい」と意気込んだ。 今回の演目でもあり、父が得意とする『魚屋宗五郎』について、父からのアドバイスを聞かれると、「特に『これ』というのはなくて、稽古で『お前は俺のどこを見てきたんだ』と無言でじっと見つめられます。逆に何も言われない方が怖い」と明かし、「正解はないので、もっともっと父に見てもらって、父が築き上げてきた『魚屋宗五郎』に近づきたいですし、五代目、六代目が築き上げてきた江戸情緒を大切にしたい」と語った。 これまで襲名披露興行は息子の菊之助と共に行ってきたが、今回は1人での巡業。「今までずっと一緒に襲名興行していたので、ちょっと寂しい気持ちもあります。彼も一緒に行きたかったと思う」と語り、「せがれも中学校にあがって、今回の巡業は日程的にも一緒に行けない。でも、芸道と学業を両立するのも、ひとりの役者としての定めだと思っています。私は菊五郎という名前、彼は菊之助という名前と学業を、この7月は一生懸命頑張ってもらおうと思っています」と父の顔を見せた。 ENCOUNT編集部,[],[]
