headline,mainEntityOfPage,image,datePublished,dateModified,author,media_en,media_jp,str_count,body,images,external_links
狩野英孝、肩書への疑問告白「何だっけ？」　食品メーカー事業部部長役も「自分が何者なのか分からなくなる時がある」（ENCOUNT）,https://news.yahoo.co.jp/articles/ab79f63062034a53aae56710f56c58eb42aba259,https://newsatcl-pctr.c.yimg.jp/t/amd-img/20260317-00960971-encount-000-1-view.jpg?exp=10800,2026-03-17T12:51:17+09:00,2026-03-17T12:51:17+09:00,ENCOUNT,encount,ENCOUNT,1386,555万食販売の“ノルマ”に衝撃 イベントに登壇した狩野英孝【写真：ENCOUNT編集部】 お笑い芸人の狩野英孝が17日、「bibigoマンドゥ餃子新商品発表会」に、森脇梨々夏、モグライダーの芝大輔、ともしげ、タレントの森脇梨々夏と共に出席。狩野は「bibigoマンドゥ事業部」の部長に就任してから3か月が経過しているが、当初かなり高いハードルを“要求”されたことについての率直な思いを語った。 【写真】「顔が疲れてる」「差し入れの数すごー!!」 狩野英孝、大量の差し入れに囲まれた姿 グローバル韓食ブランドbibigo「マンドゥ」のさらなる普及と「韓国式」食文化の定着を目指し、発足された「bibigoマンドゥ事業部」の部長に就任した狩野。「まず、最初に掲げられた目標が『マンドゥシリーズを555万食売ってくれ』というものでした。最初は550万食という数字がどれくらいのものなのか、あまりピンときていなかったんです」と振り返る。 狩野は、555万食という数字に「僕が学生時代や青春時代を過ごした90年代、小室ファミリーのCDが100万枚売れたら『すごいぞ！』という時代でしたよね。555万食がどれくらいなのかChatGPTに聞いてみたら『10世帯に1世帯が食べている計算』だと言うんです。これは相当難しいことだと思いました」と冷静に考えたという。 「『そんなの無理ですよ、頑張りますけど期待しすぎないでくださいね』と言っていたのですが、実際に活動してみると、日本中には本当にマンドゥのファンの方がたくさんいらっしゃることが分かりました。社長もおっしゃっていましたが、このマンドゥ餃子はファンの方々から非常に好評で、スタートダッシュも決まっていると聞いています。やりながら少しずつ自信がついてきているところです」と強い視線で語っていた。 そんな狩野は、マンドゥと餃子のコラボ商品を「その豪華さは例えるなら『笑っていいとも！』の最終回を見ているような感覚です。とんねるずさん、ウッチャンナンチャンさん、ダウンタウンさん、さんまさんといった豪華メンバーが勢揃いしたような、すごいコラボが実現したなというテンションで取り組んでいます」と例えると、「10世帯に1世帯」という普及目標に「実際にデパートやスーパーなどの販売店へ伺い、僕がその場で焼いて『一口食べてみてください』と実演販売をしたいですね。食べていただければ魅力は絶対に伝わるので、このご時世に少しアナログかもしれませんが、足で稼いで、体を使ってマンドゥの魅力を広めていきたいという気持ちがあります」と意気込んでいた。 また狩野は、粘り強く商品開発を行ったことに「2024年から2025年にかけて、お笑い、バラエティー、ネタ番組での新ネタ披露、昨年は横浜アリーナでの音楽活動、最近では朗読劇など、正直、自分が何者なのか分からなくなる時があります。『僕の肩書きって何だっけ？』思うこともありますが、一つ一つの仕事に真剣に、本気でぶつかっています。ゲーム実況も含め、色々なジャンルのお話をいただけるのは、ギブアップせずに自分の活動の幅を狭めないようにしてきたからだと思います。『失敗するかもしれないけれど全力でぶつかる』という姿勢で20数年やってきて、本当に良かったなと感じています」と振り返っていた。 ENCOUNT編集部,[],[]
TV生出演で衝撃　デビューから31年も「51歳に見えない」「時止まりすぎ」…相川七瀬に注目（ENCOUNT）,https://news.yahoo.co.jp/articles/e47e526bfedfad6913846ec5b22a9cc1d2f4d4be,https://newsatcl-pctr.c.yimg.jp/t/amd-img/20260317-00960957-encount-000-2-view.jpg?exp=10800,2026-03-17T12:31:12+09:00,2026-03-17T12:35:54+09:00,ENCOUNT,encount,ENCOUNT,405,ハイヒール・モモコと共にゲスト出演 フジテレビ【写真：ENCOUNT編集部】 フジテレビ系『ぽかぽか』（月曜～金曜午前11時50分）が17日に放送されており、スタジオに生出演した大物に驚きの声が上がっている。 【写真】「51歳に見えない」「変わらない」 デビュー31年の人気歌手 この日、ベテラン漫才コンビ・ハイヒールのモモコと共にゲスト出演したのが歌手の相川七瀬だった。 「3児の母」という共通点がある2人。親交も深いという。 相川は「ものすごくせっかちっぽい」との質問には「○」と回答するなど、トークは盛り上がりを見せている。 1995年にデビューし、NHK紅白歌合戦に出場した経験もある相川も51歳。SNS上では、変わらない姿に「51なのか」「何年たってもイケイケ変わってないね！」「51歳!? 時止まりすぎじゃね？？」「きれいだなぁ」「51に見えない」など驚きの声が上がっていた。 ENCOUNT編集部,[],[]
鈴鹿央士、3日連続ハンバーガー「体が慣れちゃって」　むしゃくしゃすると食に走るタイプ（ENCOUNT）,https://news.yahoo.co.jp/articles/7ea986cdb977aaffdc6bef9a953ec8354b3f3289,https://newsatcl-pctr.c.yimg.jp/t/amd-img/20260317-00960951-encount-000-1-view.jpg?exp=10800,2026-03-17T12:14:35+09:00,2026-03-17T12:14:35+09:00,ENCOUNT,encount,ENCOUNT,949,サントリー「ギルティ炭酸 NOPE」新テレビCM発表会 発表会に出席した鈴鹿央士【写真：ENCOUNT編集部】 俳優の生田斗真、鈴鹿央士、お笑いコンビ・マテンロウのアントニーが17日、都内で行われたサントリー「ギルティ炭酸 NOPE」炭酸飲料戦略説明会＆新テレビCM発表会に出席した。 【写真】寝起きでもイケメン 鈴鹿央士がドラマで見せた“髪ボサボサ”姿 商品になぞらえて「ギルティな体験」をトークした一同。生田は「こってりラーメン」と「白米」の組み合わせが大好きだといい、「ラーメン屋さんに行ってこってりを頼むとどうしても白米が欲しくなる。罪の意識、ギルティな気持ちを抱えながら、バクバク食べるのが最高に気持ちいい。炭水化物プラス炭水化物。最高ですから」と力説した。 鈴鹿は「3日連続ハンバーガー」といい、「ハンバーガーがすごく好きで。一昨日も食べたのですが、この時は体重をちょっと増やしたいなと思いつつ、でもいろいろとむしゃくしゃというか……。食に行っていた時で」とむしゃくしゃを解消するために食に走っていたと回想。 「でも3日目まで来ると、あまりギルティ感じなくなった。体が慣れちゃって。初日が一番『これギルティだな』と思って、2日目は『昨日も食べたけれどいいか』と思って味も変えて食べて、そしたら3日目も食べたくなって食べていました」と吐露。生田から「むしゃくしゃしたら食にいくタイプ？」と聞かれると、「僕、食にいきます」と告白した。 最後にアントニーが、「アメリカに行った時、お腹空きすぎて張り切ってファストフードに行った、ハンバーガー2つ、ホットドッグ2つ、ポテト、フライドチキン、さらにチキンナゲットを頼んだ。カロリーが書いてあったので計算したら4100（キロカロリー）だった」と話すと、生田と鈴鹿の2人は目を丸くした。「周りのアメリカ人も『1人で食べるのか』と引いていました（笑）。もちろん、完食。一つ残らず」と誇らしげに話した。 「ギルティ炭酸 NOPE」は、同社が約14年ぶりとなる新たな大型飲料ブランド。完熟フルーツやスパイスを中心に99種以上のフレーバーをかけ合わせた複層的な味わいが特徴で、24日より全国で発売される。新CMは21日より放映スタート。 ENCOUNT編集部,[],[]
狩野英孝、韓国で出迎えなしに不安　ダンス習得の苦労話を告白「覚えるのに40分以上かかりました」（ENCOUNT）,https://news.yahoo.co.jp/articles/d12dcf39eb818395dfb3e674ae9e072b7565bc35,https://newsatcl-pctr.c.yimg.jp/t/amd-img/20260317-00960816-encount-000-1-view.jpg?exp=10800,2026-03-17T12:11:27+09:00,2026-03-17T12:11:27+09:00,ENCOUNT,encount,ENCOUNT,906,韓国料理の新商品開発に大きく従事 イベントに登壇した狩野英孝【写真：ENCOUNT編集部】 お笑い芸人の狩野英孝が17日、「bibigoマンドゥ餃子新商品発表会」に、森脇梨々夏、モグライダーの芝大輔、ともしげ、タレントの森脇梨々夏と共に出席した。 【写真】「顔が疲れてる」「差し入れの数すごー!!」 狩野英孝、大量の差し入れに囲まれた姿 グローバル韓食ブランドbibigo「マンドゥ」のさらなる普及と「韓国式」食文化の定着を目指し、発足された「bibigoマンドゥ事業部」の部長に就任した狩野。最初は「これまで、パク・ソジュンさんのような韓流スターがやっていたような仕事。なんで僕なんだろう、韓国のスーパースターの方が適任なんじゃないか」と思ったという。 実際、韓国の空港に着いた時は、出迎えが誰もなかったという。不安に思った狩野だったが、「会社に行くと、社員の方がかなり大きな拍手で迎えてくださって、受け入れてくれたんです」と振り返る。 アシスタントには森脇が就任。とにかく本気で取り組んだという商品開発。総移動距離は2590キロ。韓国に行き適切な具材を選び、日本のフードコーディネーターと相談しながら試行錯誤し、生産コストや手間の課題を乗り越え、ついに新商品「マンドゥ餃子」が完成したという。 狩野は「マンドゥというのは野菜たくさんでヘルシー。餃子は肉々しい。そのいいとこどりをしました。食感のもちサクッ、具だくさん、そして肉汁じゅわーっという商品が出来ました」と満足そうな表情を浮かべていた。 日本での売り上げも好調だと聞くと、狩野は「本当ですか？」と驚いた表情を浮かべると、芝は「なんで空港に誰も迎えに来てくれなかったんですかね」とツッコミを入れ、笑いを誘っていた。 さらに狩野は、bibigoマンドゥシリーズのために制作した「マンドゥソング」の音源を初公開。シュールな動画が流れると、狩野は「僕はおじさんなので、ダンスを覚えるのに40分以上かかりました」と苦労話も明かす。この日は渾身の商品を試食した狩野は「とにかく美味しいですね。まずひと口食べていただきたいです」と語っていた。 ENCOUNT編集部,[],[]
夢グループ石田社長＆保科有里、日清新商品のCM出演　コメトークで盛り上げ「テーケージーご存じですか？」（ENCOUNT）,https://news.yahoo.co.jp/articles/ac4f62064f3b7d8e60647a18d5b64ecd2414f9cb,https://newsatcl-pctr.c.yimg.jp/t/amd-img/20260317-00960818-encount-000-1-view.jpg?exp=10800,2026-03-17T12:00:02+09:00,2026-03-17T12:00:02+09:00,ENCOUNT,encount,ENCOUNT,719,「日清ふっくら釜炊き ごはん」新商品試食会 新商品試食会に出席した夢グループの石田重廣社長（左）と保科有里【写真：ENCOUNT編集部】 株式会社・夢グループの石田重廣社長と歌手の保科有里が17日、都内で行われた「日清ふっくら釜炊き ごはん」新商品試食会に出席。普段のテレビショッピングさながらのトークで会場を盛り上げた。 【写真】夢グループ・保科有里のCA制服姿 日清食品は今回、長い歴史の中で初めて“お湯かけ5分”で白ごはんが完成する「日清ふっくら釜炊き ごはん」を開発。新たに開発した独自技術「新・釜炊き製法」により、直火で釜炊きしたお米を丁寧に乾燥・膨化することで、熱湯を注ぐだけの簡単調理でも、ふっくらとした食感と炊きたてのような風味や甘みを実現した。石田と保科は、3月30日から展開される同新商品の新テレビCM（製作中）に出演する。 石田社長は、CM内で同商品に何をかけて食べたか話題になり、「納豆、あとテーケージーをご存じですか？ テーケージー（TKG：卵かけご飯）」とコメント。同商品に鼻を近づけて「いい匂いなの～。悔しいくらいすごい」と舌を巻き、用意された同商品をバクバク実食。「僕、東北人で、実家が農家だった。『おいしいお米というのは、おかずがなくても美味しいだぞ』というのを今思い出しました」と述懐した。 すると横で保科が「社長～。お高いんじゃないですか？」といつもの色気たっぷりの声で質問。米をかき込んでいた石田社長は少しむせつつ、「ちゃんとしないといけない」と気を引き締め、販売価格が税別208円であることを発表。保科は「ありがとう、社長～。じゃなくて、日清さん、ありがとう～」と感謝した。 ENCOUNT編集部,[],[]
アニメ映画の公式Xで異常事態　名前がまさかの絵文字のみ…「乗っ取られてない？」「ロケットわろたw」の声（ENCOUNT）,https://news.yahoo.co.jp/articles/51e1b191c2acf3742040090d1273716741964eb7,https://newsatcl-pctr.c.yimg.jp/t/amd-img/20260317-00960924-encount-000-1-view.jpg?exp=10800,2026-03-17T11:52:23+09:00,2026-03-17T11:52:23+09:00,ENCOUNT,encount,ENCOUNT,577,「復旧まで今しばらくお待ちください」と報告 映画『パリに咲くエトワール』【写真：(C)「パリに咲くエトワール」製作委員会】 公開中のアニメーション映画『パリに咲くエトワール』の公式Xが17日に更新され、前日よりアカウント名が変更されてしまったことを伝えた。 【画像】「なにこれ」「新手のマーケティング？」 公式Xのまさかのアカウント名 この日、「【お知らせ】昨日より『パリに咲くエトワール』公式Xアカウントの名前などが意図していない表示に切り替わり、一部復旧更新ができない状態が続いております」と報告した。 17日午後11時時点で、アカウント名はロケットの絵文字のみになっており、「原因の調査をおこなっており、復旧まで今しばらくお待ちください。引き続き、『パリに咲くエトワール』をよろしくお願いいたします」と呼びかけた。 口コミで高評価の声が続々と上がっている同作。公式の名前が絵文字のみというシュールな状況に、ユーザーからは「申し訳ないけど、流石に面白い」「新手のマーケティング？」「これパフォーマンスじゃないの？笑」「なにこれ、一番口コミ評価あがってきてこれからのタイミングで最悪やん」「これ公式アカウントなのね。乗っ取られかけたって事？」「ロケットわろたw」「アカウント乗っ取られかけてない？」などと、さまざまな声が上がった。 ENCOUNT編集部,[],[]
アントニー、CMで囚人服着用「引くぐらい似合っている」　共演者も驚愕「貫禄感がすごい」（ENCOUNT）,https://news.yahoo.co.jp/articles/2c27960ebc748b9cc37045db308169bbe3836f1d,https://newsatcl-pctr.c.yimg.jp/t/amd-img/20260317-00960931-encount-000-1-view.jpg?exp=10800,2026-03-17T11:50:22+09:00,2026-03-17T11:50:22+09:00,ENCOUNT,encount,ENCOUNT,828,サントリー「ギルティ炭酸 NOPE」新テレビCM CM発表会に出席したマテンロウのアントニー【写真：ENCOUNT編集部】 お笑いコンビ・マテンロウのアントニーが17日、都内で行われたサントリー「ギルティ炭酸 NOPE」炭酸飲料戦略説明会＆新テレビCM発表会に、俳優の生田斗真、鈴鹿央士とともに出席し、CMで着用した囚人服を披露した。 【写真】「この後ろ姿僕じゃないです…」SNSで拡散された“どう見てもアントニー”な人物 3人が共演した新CMは、監獄が舞台。この日の発表会でもCMと同じく囚人服で登壇すると、生田は「まさか、囚人の格好をしてこのような場に立つ日が来るとは思いもしませんでした（笑）」といい、鈴鹿も「囚人服を初めて着たのですが、こういう気持ちになるんだなと思いながら撮影していました」とむずがゆい表情で語った。 するとアントニーは2人を横目に「自分で言うのもなんですが、引くぐらい似合っている。正直、鏡を見た時にびっくりしました。『こんなに似合うんだ』って」とドヤ顔で自画自賛。これには生田も笑いつつ「アントニーの本物感すごいわ」、鈴鹿も「貫禄感がすごくて」とあまりにも似合いすぎて驚がくしていた。 CM撮影に向けてアントニーは「普段から映画、海外ドラマで囚人を見てきたけど、このお話があって改めて作品を見て、さらに気持ちを入れてきた」と役作りは万全。しかし「毎回こういう仕事が入るたびに『ちょっとドッキリじゃないのか？』みたいな。囚人役もちょっとドッキリ臭がある」とドッキリを疑ったが、撮影現場で生田と鈴鹿の姿を見て「安心しました。大丈夫だなって（笑）」と安心したことを振り返った。 「ギルティ炭酸 NOPE」は、同社が約14年ぶりとなる新たな大型飲料ブランド。完熟フルーツやスパイスを中心に99種以上のフレーバーをかけ合わせた複層的な味わいが特徴で、24日より全国で発売を開始する。新CMは21日より放映スタート。 ENCOUNT編集部,[],[]
鈴鹿央士、生田斗真との“再会”に感激「こんな大人になりたい」（ENCOUNT）,https://news.yahoo.co.jp/articles/0a866297ba9dff26f6f13ee14468a7f55736c303,https://newsatcl-pctr.c.yimg.jp/t/amd-img/20260317-00960814-encount-000-3-view.jpg?exp=10800,2026-03-17T11:21:29+09:00,2026-03-17T11:36:59+09:00,ENCOUNT,encount,ENCOUNT,658,映画『先生！、、、好きになってもいいですか？』にエキストラ出演 発表会に出席した鈴鹿央士（左）と生田斗真【写真：ENCOUNT編集部】 俳優の生田斗真、鈴鹿央士、お笑いコンビ・マテンロウのアントニーが17日、都内で行われたサントリー「ギルティ炭酸 NOPE（ノープ）」炭酸飲料戦略説明会＆新テレビCM発表会に出席した。 【写真】寝起きでもイケメン 鈴鹿央士がドラマで見せた“髪ボサボサ”姿 生田と鈴鹿は今回撮影したCMで初共演となったが、鈴鹿が芸能界デビューのきっかけとなった映画『先生！、、、好きになってもいいですか？』（2017年）に生田が出演しており、鈴鹿もエキストラとして参加。鈴鹿にとって念願の初共演となった。 鈴鹿は「最初に人生で関わった作品はそれで、生田さんは見てきた方だったので今回すごくうれしくて」といい、「当時は何者でもない人だったので（自分のことは）覚えていないと思ったけど、CM撮影の衣装合わせのとき生田さんのときから言ってくださって、感動した。こんな大人になりたいなって思った。ありがとございます」と感激した様子。CMでは監獄内の囚人役を演じているが、生田は「時を経て囚人として再会して、エモいな（笑）」とコメントして会場を笑わせた。 「ギルティ炭酸 NOPE」は、同社の約14年ぶりとなる新たな大型飲料ブランド。完熟フルーツやスパイスを中心に99種以上のフレーバーをかけ合わせた複層的な味わいが特徴で、24日より全国で発売を開始する。新CMは21日より放映スタート。 ENCOUNT編集部,[],[]
【ばけばけ】司之介に“異例”高評価続々「ここで役に立つとは」　それでも信用しきれず「本当に黙っていられる？」（ENCOUNT）,https://news.yahoo.co.jp/articles/261a47bac0765afd8f71e4173302acf2fb37659f,https://newsatcl-pctr.c.yimg.jp/t/amd-img/20260317-00960908-encount-000-1-view.jpg?exp=10800,2026-03-17T11:12:19+09:00,2026-03-17T11:12:19+09:00,ENCOUNT,encount,ENCOUNT,936,第117回ではヘブンがミルクホールに通う事情を司之介に明かす展開 司之介を演じる岡部たかし【写真：(C)NHK】 俳優の髙石あかりがヒロイン・トキを、トミー・バストウがヘブンを演じるNHK連続テレビ小説『ばけばけ』（月～土曜午前8時）。17日に第117回が放送され、ヘブンが帝大に行かずミルクホールに通う様子が描かれた。そこにトキの父・司之介（岡部たかし）が現れ、ヘブンが事情を明かす展開となった。 【写真】「顔の小ささと脚の長さ…すごい」NHK鈴木アナが驚いた朝ドラ出演俳優 （※以下、ドラマの内容に関する記述があります） 第117回では、ヘブンがミルクホールに通い詰めていると知らないトキや家族たちだが、司之介だけはヘブンの様子に違和感を覚えていた。ミルクホールにいるヘブンの前に司之介が現れ、そこでヘブンは司之介に帝大をクビになったと明かしたのだ。「終わり人間」と言う元気のないヘブンに対し、司之介は、「ほんに、あの頃のわしじゃな」と、武士の時代が終わった当時の自身を思い出し、ヘブンに理解を示した。さらに「今日のことは口が裂けてもしゃべらん」と言い、義理堅い義理の父じゃと話すと、だから安心して仕事を見つけ、ベストセラーを書けと励ました。 SNSではしゃべらないと言う司之介に対し「司之介が秘密にしていられると思えない」「すぐ家族に言いふらしそう」「信用できん」「信用ならない」「絶対にしゃべるでしょ」「口がすべるんだろう」「うっかりしゃべるよね」「本当に黙っていられる？」という疑いの声であふれた。 一方でヘブンを励ます言動には「初めてのグッジョブ」「包容力ある」「いい仕事する」「ここで役に立つとは」「急にいい仕事して不安」「どうした今日はいい働き」「やるやん」「なんていい人」「泣かされた」「しみる」「胸熱」と珍しく高い評価の声も飛び交った。 作品は松江の没落士族の娘で、小泉八雲の妻・小泉セツとラフカディオ・ハーン（小泉八雲）をモデルに、西洋化で急速に時代が移り変わっていく明治日本の中で埋もれていった人々を描くオリジナルストーリー。「怪談」を愛し、外国人の夫と共に、何気ない日常の日々を歩んでいく夫婦の物語をフィクションとして描く。 ENCOUNT編集部,[],[]
