headline,mainEntityOfPage,image,datePublished,dateModified,author,media_en,media_jp,str_count,body,images,external_links
ユナイテッドアローズ、元従業員によるデータ持ち出しで約1万人の個人情報漏えい（INTERNET Watch）,https://news.yahoo.co.jp/articles/1e98c24d954676abf2fa34ff9c7a572330df4b6e,https://newsatcl-pctr.c.yimg.jp/t/amd-img/20260317-00000005-impiw-000-2-view.jpg?exp=10800,2026-03-17T17:45:00+09:00,2026-03-17T17:55:32+09:00,INTERNET Watch,impiw,INTERNET Watcg16,955,"写真：INTERNET Watch 株式会社ユナイテッドアローズは3月16日、元従業員のデータ持ち出しにより「広報・PR活動に関わるお取引先様関連の個人情報漏えい」が発生したと発表した。なお、元従業員は持ち出した情報を使用しておらず、二次被害はないとしている。 元従業員は2025年12月31日付けで退社したが、同社が使用するクラウドサーバーシステム上の外部連携機能を利用して、個人情報を含む取引先リストや広報・PR活動の取引に関する資料の一部などのデータをアップロードし、退職前に個人のメールアドレスにリンクを送付。2026年1月4日に外部のPCでダウンロードし、これらのデータを持ち出した。 以上のことが2026年1月6日に判明。以降、時系列順に詳細な経緯が発表されており、1月7日に同社が事情聴取を実施。元従業員がその事実を認めたため、元従業員に貸与していたPCと、元従業員の個人PCについて、外部機関による調査を行った。また、1月9日には元従業員の転職先から、転職先のPCに対する調査の協力について承諾を得た。なお、転職先は本件に関与していないことが確認されたという。 1月19日に対応について警察に相談。2月27日には外部機関による調査の結果、元従業員が持ち出した情報を使用していないこと、元従業員以外に持ち出した情報を閲覧できる可能性がないことが確認された。なお、転職先のPCから外部に情報が流出した可能性は低いとの見解が外部機関から出ているが、引き続き元従業員の転職先のPCの調査も予定しているともしている。3月9日に、本件は個人情報保護委員会に報告された。 持ち出しによる漏えいが確認された情報は、約1万人の氏名および勤務先企業名、所属部署とその電話番号、メールアドレス、事業所住所、事業用電話番号（氏名以外の項目は対象者により異なる）。 同社は「元従業員に取引情報及び個人情報の重要性に対する認識に不足があったこと、弊社において情報の外部持ち出しを防止する措置が十分とは言えなかった」ことを原因として挙げている。その上で、今後、適切なアクセス制限を含むシステムのセキュリティ強化、監視体制の見直し、社員教育の徹底を図り、再発防止に努めるとしている。 INTERNET Watch,松永 侑貴惠",[],[]
アルミボディ採用のコンパクトな4in1ドッキングハブ「USB-5TCHLP7S」、サンワサプライが発売（INTERNET Watch）,https://news.yahoo.co.jp/articles/a03f792ba447351f0146c60d7e6b719797a5e3fd,https://newsatcl-pctr.c.yimg.jp/t/amd-img/20260317-00000004-impiw-000-1-view.jpg?exp=10800,2026-03-17T07:30:00+09:00,2026-03-17T07:30:00+09:00,INTERNET Watch,impiw,INTERNET Watcg16,479,"写真：INTERNET Watch サンワサプライ株式会社は、USB Type-C接続のドッキングハブ2製品を発売した。市場想定価格はケーブル長15cmの「USB-5TCHLP7S」9680円、1mの「USB-5TCHLP7S-1」が1万340円。 【この記事に関する別の画像を見る】 PCなどのUSB Type-Cポートに接続し、以下の4ポートを増設可能。データ伝送はUSB 5Gbpsに対応する。USB Type-Cポートは最大100Wの受電に対応し、ACアダプターを接続することで、接続しているPCに最大92Wの給電が可能。 ・USB Type-Cポート（最大100W受電対応） ・USB Type-Aポート ・HDMIポート（4K/60Hz対応） ・有線LANポート（1Gbps対応） ドック部は表面に凹凸加工を施したアルミ素材を採用し、放熱効率を高めていることと、コンパクトな本体を特徴とする。本体サイズは約106×23×17mm（幅×奥行き×高さ）。重量はケーブル長15cmが約55g、1mが約77g。 INTERNET Watch,松永 侑貴惠",[],[]
“推し”を飾れるディスプレイスペース付きワイヤレスマウス「400-MAWB217BK」、サンワサプライが発売（INTERNET Watch）,https://news.yahoo.co.jp/articles/b7644399f82b6685d21ccb6b035db778083c941e,https://newsatcl-pctr.c.yimg.jp/t/amd-img/20260317-00000003-impiw-000-1-view.jpg?exp=10800,2026-03-17T07:00:00+09:00,2026-03-17T07:00:00+09:00,INTERNET Watch,impiw,INTERNET Watcg16,627,"写真：INTERNET Watch サンワサプライ株式会社は3月16日、ディスプレイスペースを備えたワイヤレスマウス「400-MAWB217BK」を発売した。直販サイト「サンワダイレクト」での価格は4980円。 【この記事に関する別の画像を見る】 手のひらにあたる部分にディスプレイスペースを備え、透明なカバーを外してアクリルスタンドや小物などを入れられる。小物のサイズ目安は2.5×1.6×2.5cmの直方体。サンワサプライによると「単調になりがちなデスクワークやPC作業中も、手元の推しを見ることでモチベーションを大きく向上できる」としている。 ブルーLEDで左右ボタン、ホイールボタン、カウント切り替えボタン（800〜3200カウント）、進む・戻るボタン（Windowsのみ対応）を備える。エルゴノミクス形状で、自然な角度で手を添えられるため、長時間のPC作業でも疲れにくいことも特徴とする。 短時間で大容量の充放電および高寿命が特徴なコンデンサー「スーパーキャパシタ」搭載で、USB Type-Cポートから3分充電するだけで最大2カ月間使用可能。デバイスとの接続は、Bluetooth（最大2台とマルチポイント接続可能）とUSBレシーバーに対応する。 カラーはブラックとホワイト。本体サイズは約7.1×10.8×6.8cm（幅×奥行き×高さ）、重量は約106g。約1mの充電用USBケーブルが付属する。 INTERNET Watch,松永 侑貴惠",[],[]
偽・誤情報対策は“予防接種”（プレバンキング）が重要に～あらかじめ手口を知ることで、拡散行動は減少する（INTERNET Watch）,https://news.yahoo.co.jp/articles/21406f49be02ceca00fef032746d90cee4a9fdb9,https://newsatcl-pctr.c.yimg.jp/t/amd-img/20260317-00000002-impiw-000-1-view.jpg?exp=10800,2026-03-17T06:30:00+09:00,2026-03-17T06:30:00+09:00,INTERNET Watch,impiw,INTERNET Watcg16,3604,"写真：INTERNET Watch 総務省は3月16日、「令和7年度 インターネット上の偽・誤情報等への対策技術の開発・実証事業 成果発信イベント」を実施した。 【画像】実際にXに投稿されたディープフェイクの例。コミュニティノートを見ると、元動画にAI生成との情報があることが分かるが、動画だけを見てディープフェイクであると見抜くことは難しい 同省では一般のユーザー向けに偽・誤情報対策を含めたICTリテラシーを啓発する「DIGITAL POSITIVE ACTION」のような取り組みも行っているが、本イベントは技術的に偽・誤情報などを対策することを目指したもので、「インターネット上の偽・誤情報等への対策技術の開発・実証事業（令和7年度）」に技術開発主体として採択されていた14の事業者・団体が、展示とショートプレゼンを行った。 ■ 偽・誤情報対策の取り組みは「予防接種」となる事前予防へ はじめに、東京科学大学の笹原和俊教授が基調講演を行い、「デバンキング」（Debunking）と「プレバンキング」（Prebunking）というキーワードを紹介した。 悪意のあるなしに関わらず、SNSなどでユーザーは偽・誤情報を拡散してしまう。ここでいう偽・誤情報には、分かりやすい悪意が込められたデマの類や、単なる間違った情報のほか、AIにより生成された、真偽を検証することが難しいディープフェイクも含まれる。 そうした偽情報の対策として、デバンキングは事後（拡散してから）の対策にあたる。拡散している情報の真偽を調べて報告する「ファクトチェック」が代表的だ。これに対してプレバンキングは、ユーザーが偽・誤情報に接触する前の対策、例えば典型的な偽情報拡散の手口を教えることなどが相当する。 笹原教授は、デバンキングを手術や治療などの対症療法に、プレバンキングを予防接種に例えた。そして、これまでの偽・誤情報対策はデバンキングが主だったが、これからはデバンキングとプレバンキングの両方を行うことが重要だとした。 プレバンキングの効果として、ケンブリッジ大学のサンダー・ヴァン・ダー・リンデン教授が行った実証の例が紹介された。感情操作を行う情報に対し、SNSで19秒の対策動画を見ることで、見抜く能力が約21％向上し、その効果が5カ月後も持続したという。さらに、詳しく学ぶためのリンクのクリック率も約3倍に増加した。 デバンキングは取り組みのスケーラビリティが低くて手間がかかり、ディープフェイクによる偽・誤情報の量産が進む中で技術的・コスト的な限界を迎えているという。 また、タイミングと頻度によっては、反発（バックファイア）を起こして逆効果となるリスクがある。実証として、動画1つを視聴し、1回デバンキングとして警告を行った場合には共有が減る効果が認められたが、4つの動画で4回連続で警告した場合には、共有が増加したという。拡散した情報がフェイクであると指摘されたが、意固地になって撤回を拒否してしまう、というSNS上のユーザー行動を見たことがある人は少なくないだろう。 対して、プレバンキングはスケーラビリティが高い。ふたたび、偽・誤情報対策を感染症予防などの公衆衛生の取り組みに見立て、笹原教授は、デバンキングだけでなくプレバンキングも取り入れた、多層的な対策のイメージを示した。 AIによる検証ツールの効果を示す例として、笹原教授は別の実証実験を紹介した。本物の動画とディープフェイクによる偽の動画がタイムラインに流れる実証用のSNSで、被験者であるユーザーは動画を視聴し、共有できる。このとき、AIによる検証ツールが提供されることで偽動画の共有は減少し、本物の動画の共有は増加したという。 この結果について、笹原教授は、「AIツールの導入は『本物』に翼を授ける」とした。動画などのコンテンツを検証して「この動画は本物」だという根拠を得られることで、ユーザーは自信を持って共有できるようになる。以上のような検証を踏まえ、偽・誤情報対策におけるプレバンキングへのシフトと、AIツールのような技術的解決と、市民自らが偽情報を見抜く知識を付け、心理的レジリエンスをはぐくむ社会的対策が必要であると提言した。 ■ Xのコミュニティノート活用から「実際に偽情報を作る」教材まで、多様な展示 会場では、各事業者・団体が開発した技術のパネル展示やデモンストレーションを行い、来場した企業や自治体関係者と、情報交換などを行っていた。ここでは、そうした技術の中からいくつかを紹介したい。 □Xのコミュニティノートから検証情報を集計、AIによる分析も可能に コード・フォー・ジャパン 一般社団法人コード・フォー・ジャパンの取り組みは「SNSにおける偽情報・真偽不明情報の市民参加型可視化・分析技術」。Xのコミュニティノートを活用し、ダッシュボード上でコミュニティノートの時系列的な変化やナラティブ（言及内容など）を可視化する偽情報・真偽不明情報の検証ツール「BirdExplorer」を、2026年に一般のユーザーにも利用可能なかたちで提供することを目指している。 また、イベント直前には、生成AIツール「Claude」によってこの情報を分析可能にするツールが実装され、会場でデモンストレーションが行われていた。 □スマホで撮影した写真に情報を付与し、ファクトチェックを効率的に NTTドコモビジネス NTTドコモビジネス株式会社の取り組みは「情報の真正性を可視化するC2PA技術を活用した偽・誤情報対策の開発検証」。スマートフォンで撮影する写真や動画に、C2PA技術（Coalition for Content Provenance and Authenticity：デジタルコンテンツの来歴情報や加工履歴情報を証明する技術）を用いた情報を埋め込んだ署名を付与し、位置情報や撮影時刻の情報の事前チェック結果も付与し、これらにより、ファクトチェック時に信頼性を確認できるようにする。 ファクトチェック事業者と行った実証実験では、目標としていた検知率85％以上を達成するとともに、ファクトチェックに要する時間を15％以上削減できたという。同技術を用いた真偽判定支援ツールをクラウドサービスとして提供するとともに、スマートフォンのカメラへの標準搭載を目指している。 □「フェイク情報を作ってみる」教材によって偽・誤情報の手口を学ぶ Classroom Adventure 株式会社Classroom Adventureの取り組みは「偽・誤情報サンドボックスを活用した実践的ゲーム型プレバンキング技術の開発・実証」。同社は学校や企業向けの教材を開発しており、それは、一言でいえば「フェイク情報を実際に作ってみる」ものだ。カメラで撮影した映像を特定の意図を持って加工する、グラフの一部だけを切り取るなど、実際に恣意的な情報の加工を行うことで、偽・誤情報を作成する者の心理や、偽・誤情報が生まれる構造を学ぶことができる。 また、同社の教材は「モジュール型」であることも特徴で、学校や企業の教えたい内容に合わせて自在に組み替え、最適化できる。どうしても硬い内容になり、興味が持続しなくなりがちなテーマに対し、楽しみながら気づきを得られる教材として開発したといい、導入パッケージを整備して、学校や企業・自治体での利用を促進することを目指している。 □電話音声フェイクの検知技術とSNSの誤情報防止技術 NABLAS・NTT東日本 NABLAS株式会社およびNTT東日本株式会社の取り組みは「電話音声フェイク検知および自治体向け偽・誤情報総合対策の開発・実証」。テーマは2つ、技術としては3つが展示されていた。 1つ目のテーマは「生成AI時代の電話音声フェイクを見破る検知技術」。ディープフェイクにより生成された詐欺電話を見破る技術は複数あるが、テスト環境では高い検知率を出せても、環境音などが混ざる実環境では大幅に検知率が落ちてしまうものが多いという。同社の技術は実環境でも高い検知率を維持でき、テキスト情報ベースで情報の信頼性のチェックも行う。同技術は固定電話だけでなく、幅広い通信事業者やウェブ会議プラットフォーマーにおける活用が期待されるという。 2つ目のテーマは、「Web・SNS上のフェイクに惑わされない情報発信技術」。SNSで流通するテキスト・画像などのフェイクを見破る、マルチモーダル対応の「総合的フェイク検知技術」と、発信側向けの「真正性証明（電子透かし）」の2つの技術からなり、官公庁や企業が正しい情報を見極め、市民が信頼性の高い情報を判断できる仕組みを提供することを目指している。 INTERNET Watch,山田 貞幸",[],[]
3月31日は「世界バックアップデー」。家庭用NASなどバックアップ製品が当たるXキャンペーンをアイ・オーが実施中（INTERNET Watch）,https://news.yahoo.co.jp/articles/94161bc15daecc5a23ee005ce43e0ef06ff6a013,https://newsatcl-pctr.c.yimg.jp/t/amd-img/20260317-00000001-impiw-000-1-view.jpg?exp=10800,2026-03-17T06:00:00+09:00,2026-03-17T06:00:00+09:00,INTERNET Watch,impiw,INTERNET Watcg16,612,"写真：INTERNET Watch 株式会社アイ・オー・データ機器は3月16日、3月31日の「世界バックアップデー」に向けて、メーカー5社とコラボしたキャンペーンを開始した。期間中、公式Xアカウントで対象ポストをリポストするなどして応募すると、同社やコラボしたメーカーのバックアップ製品がプレゼントされる。 世界バックアップデーとは、データのバックアップ（保存・複製）の重要性を啓発する国際的な記念日。エイプリルフール（4月1日）の前日であり、「データを失うという悪い冗談に引っかからないように」という意味が込められているという。 キャンペーンの1回目となる3月16日～20日は、アクロニス・ジャパン株式会社とコラボし、アイ・オー・データ機器の2ドライブNAS（4TB）「HDL2-Z22SI3A」とアクロニスのバックアップとセキュリティ機能を統合したツール「Acronis True Image 2026 プレミアム」（1TB、1台）をセットにし、抽選で1人に当たるキャンペーンを実施している。応募方法は、アイ・オー・データ機器の公式Xアカウント（@io_data）とアクロニス・ジャパン公式Xアカウント（@Acronis_Japan）をフォローし、該当投稿をリポストする。 コラボするメーカーおよび日程は以下の通り。詳細は各期間ごとに、順次公式Xアカウント上で告知される予定。 INTERNET Watch,松永 侑貴惠",[],[]
