headline,mainEntityOfPage,image,datePublished,dateModified,author,media_en,media_jp,str_count,body,images,external_links
二宮和也、侍ジャパン不在の米マイアミ到着「移動時間はしっかり1日」　“強行日程”に「ゆっくり休んでください」の声（ENCOUNT）,https://news.yahoo.co.jp/articles/bebe3209666de4ed4a129c8aebf17dac8d9461e7,https://newsatcl-pctr.c.yimg.jp/t/amd-img/20260317-00960896-encount-000-7-view.jpg?exp=10800,2026-03-17T10:53:05+09:00,2026-03-17T13:25:09+09:00,ENCOUNT,encount,ENCOUNT,485,「ようやく到着」とポスト 嵐の二宮和也【写真：ENCOUNT編集部】 嵐の二宮和也が17日、Netflixでスペシャルサポーターを務めるワールド・ベースボール・クラシック（WBC）中継のため米・マイアミに到着したことを自身のXで報告した。 【写真】「ようやく到着」…二宮和也が公開した現地ショット 13～15日まで北海道で嵐のコンサートがあった二宮は15日、侍ジャパンの準々決勝敗退を受けて、「侍JAPANの戦いが終わりました。我々も北海道から声援を送らせてもらいました」とXで言及。16日には「では、マイアミに行ってきます」と米国行きを伝えていた。 そしてこの日、「ようやく到着 移動時間はしっかり1日でした笑」とつづり、準々決勝からの開催スタジアム、ローンデポ・パークの外観を捉えた写真も公開した。 この投稿には「WBC楽しんでください！！」「わぁよかった！」「長時間のフライトおつかれさまー！」「移動トランジットもあって丸一日かかったんだ！！」「ニノさん……少しは寝れましたか!？」「ゆっくり休んでください」といったコメントが寄せられていた。 ENCOUNT編集部,[],[]
「すっかり別人になってて」トミー・バストウの“激変”ぶりに騒然「髪が！」「SHOGUN撮影スタートなのかな」（ENCOUNT）,https://news.yahoo.co.jp/articles/35e0dd1c9d1828663e6a70d98b89efc09b8ba203,https://newsatcl-pctr.c.yimg.jp/t/amd-img/20260317-00960880-encount-000-3-view.jpg?exp=10800,2026-03-17T10:41:36+09:00,2026-03-17T10:58:34+09:00,ENCOUNT,encount,ENCOUNT,605,スペシャルトークショーに出席 トミー・バストウ【写真：ENCOUNT編集部】 NHK連続テレビ小説『ばけばけ』（月～土曜午前8時）のスペシャルトークショーが16日、大阪市内で開催された。イベントに登場した、レフカダ・ヘブンを演じる俳優トミー・バストウの変貌ぶりに驚きの声が広がっている。 【写真】「ウルフ・アロンかと思ったら」「すっかり別人」 トミー・バストウの激変ショット 番組公式Xで「『 #ばけばけ 』スペシャルトークの大阪会場から」と報告。「イベントの模様は後日放送でもお届けします」と呼びかけて、NHK総合・全国では20日午後6時5分より、同関西/中国地域では21日午前8時15分より放送されるとアナウンスした。 投稿では、ヒロイン役の髙石あかりら出演者9人が並んだ集合ショットを公開。その中でも、劇中からガラリと印象が変わったのはバストウだった。 朝ドラでは髪を伸ばしていたが、現在は米ドラマシリーズ『SHOGUN 将軍』シーズン2の撮影のため、丸刈りへと変貌していた。 この姿に、ネット上でも「トミーさんのヘアスタイルがっっ」「トミーさんの髪が！」「ヘブン先生若返ってる」「ヘブンさんがすっかり別人になってて驚く」「ああっ、ヘブン先生がバテレンさんモードに戻ってる！ SHOGUN撮影スタートなのかな」「ウルフ・アロンかと思ったらトミーさんだった」といった声が上がっていた。 ENCOUNT編集部,[],[]
話題作への出演続く唐田えりかの素顔　三姉妹の末っ子で「人として尊敬できる方にすぐなつきます」（ENCOUNT）,https://news.yahoo.co.jp/articles/2c5e90732b47113be85dd0443dc702dd0c6ae6ae,https://newsatcl-pctr.c.yimg.jp/t/amd-img/20260317-00959878-encount-000-1-view.jpg?exp=10800,2026-03-17T10:20:00+09:00,2026-03-17T10:20:00+09:00,ENCOUNT,encount,ENCOUNT,1774,『102回目のプロポーズ』で『101回目』カップルの娘・星野光役 『102回目のプロポーズ』で連続ドラマ初主演を飾る唐田えりか【写真：矢口亨】 俳優の唐田えりかが、4月1日スタートのフジテレビ系『102回目のプロポーズ』（水曜午後11時、FODで3月19日先行配信開始）で連続ドラマ初主演を飾る。1991年放送の『101回目のプロポーズ』の続編となるラブストーリー。唐田といえば、2024年『極悪女王』（Netflix）でプロレスラー役を体当たりで演じるなど、その表現力と覚悟で演技派としての評価を高めている。今回、大役への抱負、さらに俳優としての現在地について聞いた。（取材・文＝大宮高史） 【写真】「最終形態です」10キロ増量で“激変” パンプアップした唐田えりかの姿 1991年、武田鉄矢が演じた星野達郎と浅野温子の矢吹薫による“名コンビ”で社会現象を巻き起こした『101回目のプロポーズ』。その続編が35年の時を経て令和の世に誕生する。本作は、前作に触発された元放送作家の鈴木おさむ氏が以前より温めていた企画で、達郎と薫の娘・星野光が主人公。対照的な2人の男性から好意を持たれる光を中心に、周囲との関係を描くヒューマンラブストーリーだ。唐田は光を演じ、武田が光の父親役で登場する。 30歳独身の光（唐田）は母・薫と同じチェリスト。光が15歳のときに薫は他界し、父の達郎（武田）は建設会社を経営している。その社員・空野太陽（霜降り明星・せいや）は女性にモテず、99回振られ続けてきた。そんな中、達郎の娘・光に一目ぼれしてしまう。光は、ゼネコンの御曹司で超イケメンピアニストの大月音（伊藤健太郎）からも想いを寄せられ、光、そして父親・達郎はどういう選択をするか――という展開。唐田がどんなパフォーマンスを見せるか、注目される。 唐田は、鈴木氏とは縁がある。鈴木氏が企画・脚本を務めたNetflixドラマ『極悪女王』（24年）でプロレスラーの長与千種役に抜てきされた。丸刈りや増量などで長与になりきり、それまでのパブリックイメージを打ち破る熱演を見せたが、今回は全く正反対の役をオファーされた。 「『極悪女王』の撮影後、おさむさんにお会いした時に、『次は全く違う役でお願いしたいです』と言われていたんです。『何だろう？』と思っていたら、この作品でオファーをいただきました。（おさむさんは）好奇心がすごくて興味の塊のような人で、知らない話にも『何それ？』と素直に興味を持ってくれます。私のことはどう思っているんだろう？ とちょっと不思議ですが（笑）、こうやって役をくださるので信頼してくださっているのかな、と思っています」 演じる光は、前作で結ばれた達郎と薫の一人娘で母と同じチェリストの設定で描かれる。伝説的な作品のバトンを継ぐだけに、集中力は自然と高まったようだ。 「うれしかったと同時に、責任も重いです。名場面はテレビで知っていたのですが、改めて作品を拝見した時、この世界観を引き継ぐことに身が引き締まりました。脚本を読んで、光は、達郎さんの明るさも受け継いだ、笑顔が素敵な女性だとイメージして、お芝居を作っていきました」 一方、1990年代当時のトレンディドラマの世界観は、現代と違って「素直に思いをぶつけ合う」という印象を抱いているという。 「まず鉄矢さんの達郎が、どの場面でもあまりにも一生懸命すぎて笑ってしまいました（笑）。あんなに真っ直ぐに『好き』の気持ちを伝える人って、最近の作品ではなかなか見ないです。達郎と弟の純平（江口洋介）の会話もすごく自由に見えて、『無敵の兄弟だな』って思いました。現代は、人に気持ちを伝える時、むしろ気を遣い過ぎて疲れちゃうような気がします。あの頃の方が壁のないコミュニケーションができた時代だったかも、と思います」 現場では武田からの教えが指針となっている。 「鉄矢さんは、どのカメラにも『いい画』として使える部分があるようにお芝居をされていました。カメラがどんな風にご自分を撮っているかを全部頭に入れていらっしゃるんですね。あれだけ細かな動きをされている俳優の方を見たことは、今までほとんどなかったんです。鉄矢さんがよくおっしゃっていた『作品はずっと残るから』という言葉も、すごく心に残っています」,[],[]
「全然変わらない」　48歳元ビジュアルクイーン“へそ出し”にファン歓喜「スタイル抜群」「くびれ美人」（ENCOUNT）,https://news.yahoo.co.jp/articles/26357add75007a7c303195f151b2652517eeee4c,https://newsatcl-pctr.c.yimg.jp/t/amd-img/20260317-00960851-encount-000-5-view.jpg?exp=10800,2026-03-17T10:08:13+09:00,2026-03-17T10:43:10+09:00,ENCOUNT,encount,ENCOUNT,770,正月からの爆食を紹介 藤崎奈々子【写真：インスタグラム（＠nanakofujisaki）より】 タレントの藤崎奈々子（48）が17日までに自身のインスタグラムを更新し、正月の頃からの爆食ぶりを紹介。それでも抜群スタイルの“へそ出し”に注目が集まっている。 【写真】「スタイル抜群」「くびれが神」 48歳・藤崎奈々子、“へそ出し”ショット 「年末にインフルエンザにかかり、復活してからは辛かったんだから好きなものを好きなだけ食べよう！と思って お正月あたりからラーメン、お餅、ご飯粒、豚カツ、唐揚げなどなど心の赴くまま食べまくった結果……体重減ってた!!笑笑（5.600gほどだけど） しかも最近会う人会う人に『痩せた？』と言われる」と、くびれが際立つ“へそ出し”トレーニングウェアの写真を添えて投稿した。 自分に合うサプリメントと出合えたそうで「ほぼ50歳に近い年齢でこれほど自由に食べて体重減るなんて奇跡のよう ちなみに運動は週一のピラティスのみ」と明かし、「全部ではないけど、1月から食べてたラーメンや揚げ物を記念にアップ」と、こってりラーメンの数々やハンバーガー、揚げ物など、爆食ぶりを紹介した。 この投稿には「元気に食べてる」「すさまじい食欲だねw」といった声のほか、「すごいっ！」「スタイル抜群で素敵」「くびれが神」「スタイルいい」「スリムですね」「くびれ美人」「全然変わりませんね」などのコメントが寄せられている。 藤崎は、1997年にフジテレビビジュアルクイーン・オブ・ザ・イヤーに選出。98年から2001年まで日本テレビ系『ウッチャンナンチャンのウリナリ!!』でレギュラー出演。新元号・令和になった19年5月1日に結婚したことを、同年7月24日の日本テレビ系『今夜くらべてみました』の生放送で発表した。 ENCOUNT編集部,[],[]
TBSと米国版SASUKE制作陣のタッグ特番が放送　ロト6で3.2億円当てた男性に“一番福”の大学生が出演（ENCOUNT）,https://news.yahoo.co.jp/articles/e5793daaa4ba68a04a58486b120f40353867dff3,https://newsatcl-pctr.c.yimg.jp/t/amd-img/20260317-00960731-encount-000-1-view.jpg?exp=10800,2026-03-17T10:00:00+09:00,2026-03-17T10:00:00+09:00,ENCOUNT,encount,ENCOUNT,1312,21日深夜1時58分から放送 『DUMB LUCK～強運No.1決定戦～』を主催する麒麟・川島明【写真：(C)TBS】 TBSと米国版『SASUKE』を制作するA. Smith & Co. Productions社が共同開発したバラエティー番組『DUMB LUCK～強運No.1決定戦～』が、21日深夜1時58分からTBSで放送されることが17日、同局より発表された。 【写真】強運自慢26人が集結…さまざまな運試しに挑む実際の様子 本番組は、毎週月曜から金曜の朝に放送されているバラエティー番組『ラヴィット！』から生まれたスリル系運試しゲーム「KISUKE」に着想を得た運試しバラエティー。米国版『SASUKE』として知られる『American Ninja Warrior』を制作するA. Smith & Co. Productions社との共同開発により、“世界規模”の運試し番組として新たに誕生した。 主催者は麒麟・川島明、天の声は同局の田村真子アナウンサーが担当。強運アイドルや芸人、アーティスト、福男、宝くじ高額当選者など各界の強運自慢26人が集結し、“強運No.1”の座をかけてさまざまな運試しに挑む。 挑戦者には、Travis Japanの中村海人、吉澤閑也、元アンジュルムの竹内朱莉をはじめ、「KISUKE」提案者の藤崎マーケット・トキ、アンガールズ・山根良顕、ザ・たっち、バッドビート両角、呂布カルマなどが参戦。さらに、兵庫・西宮神社の恒例行事「福男選び」で2026年の“一番福”となった大学生や、ロト6で3億2000万円を当てた男性なども参加する。 番組では、4つのステージ、計14種類の運試しアトラクションを用意。アウトの箱を選ぶとクリーム砲を浴びる「ジャック・イン・ザ・ボックス」や、アウトのマネキンにキスをすると唇に静電気ショックをくらう「マネキンキス」、アウトのトイレに座ると大量の水が逆噴射する「クレイジートイレット」など、多種多様なゲームが登場する。 また、『ラヴィット！』でもおなじみの「からしシュークリーム」や「超酸っぱいジュース」、足ツボマットが敷かれていないレーンを選びトランポリンからダイブする「足ツボダイブ」などの企画も実施。アウトの箱を選ぶと箱から足ツボ師・與那嶺茂人氏が飛び出し激痛足ツボマッサージを受ける「ヨナミネボックス」も1on1対決形式で登場する。 ファイナルステージでは、熱々のあんかけや粉、クリームが噴射される「ディスティニーピラミッド」に参加者は挑戦する。 以下は川島のコメント。 「今回は世界で初めて“運”をカメラで撮影できたんじゃないかと思います！ はっきりと『運が強い人』が出てくるんだなっていうのが驚きでしたね！ 何人か神がかっている出場者が出てきてびっくりしました。“ちょっと欲が出た人”は脱落してしまい、逆に“天真爛漫な人”が残っていくというドラマも生まれました。また今回も『ラヴィット！』ではおなじみのモンスター與那嶺が大暴れする瞬間があったので、もし次回があれば、ぜひ與那嶺さんにはプレイヤーとして参戦していただきたいです」 ENCOUNT編集部,[],[]
『水ダウ』感動プロポーズ回も…「面白くない」とバッサリ　“失敗”したクロちゃんの嫉妬爆発（ENCOUNT）,https://news.yahoo.co.jp/articles/673f4d8c979513acee79b0bfeaabbaa32d79f378,https://newsatcl-pctr.c.yimg.jp/t/amd-img/20260317-00960860-encount-000-1-view.jpg?exp=10800,2026-03-17T09:46:24+09:00,2026-03-17T09:46:24+09:00,ENCOUNT,encount,ENCOUNT,1248,『アッパレやってまーす！』に出演 安田大サーカスのクロちゃん【写真：荒川祐史】 お笑いトリオ・安田大サーカスのクロちゃんが16日、月曜レギュラーを務めるMBSラジオ『アッパレやってまーす！』（月～木曜午後11時30分）に出演。2月放送の『水曜ダウンタウン』（TBS系）でプロポーズに成功したネルソンズの青山フォール勝ちをねたんだ。 【写真】クロちゃんの本命であるスタイル抜群美女スタッフ ロッチ・中岡創一、錦鯉・長谷川雅紀と3人で飲みに行ったというクロちゃんは、2人が好人物で楽しい宴だったため、すぐにまた行こうと約束したが、2週間ほど経過しても連絡がないと告白。酔って悪口を言ったためか、支払いをしてくれたのが2人のうちのどちらかが記憶がないことで、人柄のいい2人に嫌われたかと思うところを挙げた。我が家・坪倉由幸は今回の収録前日に中岡と食事に行ったが、何も話していなかったと言い、クロちゃんは「何で？」と嘆いた。 坪倉は、中岡は多忙で海外ロケも多く「2週間ぐらいですぐ誘うことはあんまりないかもな」と伝えた上で、「誰の悪口をどういうふうに言っただけ教えて」と要請。クロちゃんは「JPとか」と即答し、坪倉は「何でJP嫌いなのよ？ 嫌いな要素ないでしょう」と笑った。クロちゃんは「あいつ嫌い。あと、（お見送り芸人）しんいちも最近、ちょっと偉そうにしてるからね。分かった感じ言うから。あいつ、マジで」と吐き捨てた。 さらに「アイツは本当にうまいこと女の子いってるから、めっちゃ腹立ってるから、オレ」と不満が爆発。「絶対モテてるから。アイツと（さらば青春の光）東ブクロ、絶対遊んでるから、あいつらは」と対抗意識をむき出しにした。坪倉は「ブクロは遊んでそうだけど」としつつ「いいじゃない。2人とも独身だし、相手が嫌じゃなかったら。恋愛なんだから、いいじゃない」と諭した。 Kis-My-Ft2の二階堂高嗣が「クロちゃんにはちゃんと好きな人もいるわけでしょう」と言うと、坪倉も「クロちゃん、リチが好きで。まだ」と続いた。昨年、『水ダウ』でプロポーズに失敗した元恋人の名前が挙がると、クロちゃんは「リチ、めっちゃ好き」と認めた。坪倉から「それでいいじゃない。文句ないでしょう」と言われると、クロちゃんは「文句あるよ」と語気を強め、「それこそ『水曜日―』、プロポーズにオレは失敗したのに、青山フォール勝ちは何かうまいこといってさ」と嫉妬。二階堂は「あれ、すてきだった」と、連れ子のいる女性と長年の交際を実らせた涙必至の感動回を絶賛した。 クロちゃんは「バッドエンドじゃないと面白くないじゃん、あんなの」と主張。坪倉が「そんなことないよ。あれは幸せ。感動回もあり、クロちゃんみたいな回もあり、番組が成り立ってるんだから」と解説すると、クロちゃんは「オレも（青山みたいに）“フラッシュボム”すれば良かった」と悔やみながら言い間違い。坪倉が「ボム？ “モブ”ね」と訂正すると、笑いが起こった。 ENCOUNT編集部,[],[]
SW新作アニメ『スター・ウォーズ：モール／シャドウ・ロード』日本版本予告解禁　山路和弘がモール役を続投（ENCOUNT）,https://news.yahoo.co.jp/articles/173e4b22ba86731f8a6a2e5ba7b9e7669d6a2f41,https://newsatcl-pctr.c.yimg.jp/t/amd-img/20260317-00960852-encount-000-1-view.jpg?exp=10800,2026-03-17T09:34:14+09:00,2026-03-17T09:34:14+09:00,ENCOUNT,encount,ENCOUNT,1136,モールと若きジェダイの弟子が帝国へ復讐誓う 『スター・ウォーズ：モール／シャドウ・ロード』が4月6日から日米同時独占配信される【写真：(C)2026 Lucasfilm Ltd.】 「スター・ウォーズ」シリーズのオリジナルアニメーション最新作『スター・ウォーズ：モール／シャドウ・ロード』が、4月6日からディズニー公式動画配信サービス・ディズニープラスで日米同時独占配信される。17日には日本版本予告と最新ポスターが解禁され、モール役を映画『スター・ウォーズ／ファントム・メナス（エピソード1）』以来演じ続けている声優・山路和弘の続投も決定した。 【動画】『モール／シャドウ・ロード』解禁された日本版本予告 本作は『スター・ウォーズ：クローン・ウォーズ』の直後を舞台に、帝国への復讐（ふくしゅう）を誓うダース・モールの物語を描くアニメーションシリーズ。ジェダイ・オーダーが崩壊し、銀河帝国の支配が始まった暗黒の時代が背景となる。 師であったシス卿ダース・シディアスに見捨てられたモールは、帝国への憎悪を胸に、犯罪組織とギャングが蔓延る惑星ジャニックスで自らの悪の組織を築こうと画策。そこで銀河の現状に絶望した若きジェダイのパダワン、デヴォンと出会い、復讐を果たすため“弟子”として引き込もうとする。 しかし、惑星ジャニックスでの怪しい取引を捜査するローソン大尉と、その相棒の警察ドロイド2B0T（トゥー＝ブーツ）が執念深く追跡。さらにガイコツのような仮面をつけた謎の敵も現れ、モールたちに襲い掛かる。 解禁された予告映像では、モールがダブルブレードの赤いライトセーバーを振りかざし敵をなぎ倒す姿からスタート。映像の中でモールは「帝国は俺を殺そうとした。裏切りには制裁を下さねば」と言い放ち、デヴォンとともに激しいライトセーバー戦を繰り広げる様子が映し出されている。 モールは『ファントム・メナス』で初登場したシスの戦士。ダブルブレードのライトセーバーを操る圧倒的な戦闘力で人気を集め、シリーズ屈指の“悪役”キャラクターとして知られている。 本作でモール役を務めるのは、映画やアニメーションシリーズで四半世紀以上モールを演じ続けている声優の山路。さらに、新たに登場する若きジェダイでありながらモールの弟子となるトワイレックのデヴォン役を声優の白石涼子が担当する。 そのほか、モールを追うローソン大尉役を相沢まさき、警察ドロイド2B0T（トゥー＝ブーツ）役を前田雄が務める。 全10話で構成される『スター・ウォーズ：モール／シャドウ・ロード』は、4月6日から毎週2話ずつ配信。最終話は「スター・ウォーズの日」として知られる5月4日に配信される予定という。 ENCOUNT編集部,[],[]
ミャクミャク、まさかの写真集にネット爆笑「袋とじは草」「ちょっと色気感じる」（ENCOUNT）,https://news.yahoo.co.jp/articles/4c72499515d120a23746932102c5fec842d64ab2,https://newsatcl-pctr.c.yimg.jp/t/amd-img/20260317-00960828-encount-000-4-view.jpg?exp=10800,2026-03-17T09:31:20+09:00,2026-03-17T09:56:30+09:00,ENCOUNT,encount,ENCOUNT,631,4月13日に1st写真集『I myaku you.』発売 ミャクミャク【写真：ENCOUNT編集部】 大阪・関西万博の公式キャラクター・ミャクミャクの公式Xが17日までに更新され、1stグラビア写真集『I myaku you.』（2025大阪・関西万博マスターライセンスオフィス）を4月13日に発売することを発表。人気キャラクターの意表をつく“グラドル”ぶりが反響を呼んでいる。 【写真】「ちょっと色気感じる」「笑い堪えられない」 ミャクミャク、衝撃の写真集ショット 「ミャクミャク渾身の1stグラビア写真集『I myaku you.』4/13（月）に発売決定」の書き出しで、表紙の写真を添えて投稿。さらに「沖縄2泊3日撮影、全224ページ完全収録！（独占“袋とじ”カットも…！） 写真集先行カット8枚をこの投稿のリプライ欄で大公開!!」と撮影内容や仕様について紹介した。 透け感のある布をまとった表紙写真に加え、ベッドやビーチなどまさかの“グラドル”シチュエーションが並んだビジュアル。万博の公式キャラクターが繰り出した、まさかのポーズの数々が目を引くだけに「“袋とじ”カット」が気になるところだ。 衝撃の写真集情報に「意表を突かれた」「我々は何を見せられてるんだ…」「笑い堪えられない」「袋とじは草」「衝撃すぎて一瞬思考放棄した」「グラビアの写真集仕様でウケる」「ちょっと色気感じる」「情報量多すぎて草」などのコメントが寄せられている。 ENCOUNT編集部,[],[]
