headline,mainEntityOfPage,image,datePublished,dateModified,author,media_en,media_jp,str_count,body,images,external_links
未成年の中高生とわいせつ行為　群馬県の教員３人を懲戒免職（群馬テレビ）,https://news.yahoo.co.jp/articles/2b6fb1d5156cb2d62a57a905abbe55af3e16114d,https://newsatcl-pctr.c.yimg.jp/t/amd-img/20260317-00000007-gtv-000-2-view.jpg?exp=10800,2026-03-17T20:22:29+09:00,2026-03-17T20:23:26+09:00,群馬テレビ,gtv,群馬テレビ,645,（写真：群馬テレビ） 県教育委員会は１７日、未成年の中高生とわいせつな行為をしたとして、３０代の女性教員を含む教員３人を懲戒免職にしたと発表しました。 県教委が１７日付けで懲戒免職にしたのは、県立の中高一貫校の男性教員（４５）と、東毛地域の県立高校に勤務する女性教員（３０代）、そして、太田市の市立小学校の男性教員（２６）です。 県教委によりますと、東毛地域に勤務する女性教員（３０代）は、去年１０月から１１月にかけて勤務先の学校の生徒と校外で５回程度、性的な関係をもったということです。女性教員は生徒からの相談を受ける中で不適切な関係になったとして「冷静に判断が出来ず反省している」と話しています。 また、男性教員（２６）は去年６月から９月にかけて知り合いの女子高校生と５回、性的な関係をもったということです。 男性教員（４５）は去年９月、県内の商業施設の駐輪場で「テレビの取材で足の裏を診断しているので見せてほしい」などと２人組の女子中学生に声をかけ足の裏を触ったということです。男性教員は、おととし９月から１０月にかけて同じ手口で別の女性に声をかけ写真の撮影をしたと話しているということです。 県教委によりますと、今年度の教員の懲戒処分は、１５件にのぼり過去１０年でもっとも多かったということです。 平田郁美教育長は「県民の信頼を大きく裏切ることになり誠に申し訳ありません。児童生徒の未来を担っている責任を自覚し信頼回復のために全力を挙げて取り組んでまいります」とコメントしています。,[],[]
群馬・高山村長選が告示　新人３人による選挙戦に　２２日投開票（群馬テレビ）,https://news.yahoo.co.jp/articles/715b9d2d640effbef12435eb8cef675bf018a1a3,https://newsatcl-pctr.c.yimg.jp/t/amd-img/20260317-00000006-gtv-000-1-view.jpg?exp=10800,2026-03-17T20:22:27+09:00,2026-03-17T20:22:27+09:00,群馬テレビ,gtv,群馬テレビ,702,（写真：群馬テレビ） 任期満了に伴う高山村長選挙が１７日告示され、新人３人による三つの選挙戦がスタートしました。 高山村長選に立候補したのは、届け出順にいずれも新人で前の村議会議長の後藤明宏さん（６５）、前の教育長の山口廣さん（６９）、前の副村長の平形郁雄さん（６５）の３人です。現職の後藤幸三村長の不出馬により、新人３人による三つどもえの選挙戦となりました。村の選挙管理委員会によりますと、３人での選挙戦は記録のある１９６６年以降、初めてのことです。 後藤さんは「宝の山 たかやま 動く村 変わる未来」をスローガンに、子育て支援の充実と健康寿命の増進といった少子高齢化対策や、村の資源を活用した特産品の開発・六次産業化など産業の発展を掲げます。役場庁舎の移転については慎重な姿勢を示し、村民の生活最優先を強く訴え票の取り込みを図ります。 山口さんは「安心して暮らせる村に」というモットーを強く打ち出して、支援者を前に第一声をあげました。おもな公約に義務教育学校の設置を含めた教育体制の整備や、老朽化の進む役場庁舎の建て替え、災害に備えた防災センターの整備などを掲げていて「将来世代に責任ある村政の実現を目指す」と訴えます。 平形さんは約５０人の支援者を前に第一声です。長年の行政経験をもとに日本一の子育て支援の村づくりや、交通の利便性向上を柱とする高齢者の生活支援の強化、老朽化した公共施設の統廃合や複合化などを訴えます。後藤村長も駆け付けるなか「新しい村への挑戦」を掲げ支持を呼びかけます。 高山村長選は、３月２２日に投開票です。なお、３月１６日現在の選挙人名簿登録者数は男女合わせて２７５２人です。,[],[]
群馬県の公示地価　３４年ぶり上昇も住宅地は下げ止まり（群馬テレビ）,https://news.yahoo.co.jp/articles/85ee2eda0df7e325c07323262280c54bdc8c6404,https://newsatcl-pctr.c.yimg.jp/t/amd-img/20260317-00000005-gtv-000-1-view.jpg?exp=10800,2026-03-17T20:22:26+09:00,2026-03-17T20:22:26+09:00,群馬テレビ,gtv,群馬テレビ,630,（写真：群馬テレビ） 土地の取引の目安となることしの県内の地価が公示され、平均の変動率は３４年ぶりに増加に転じました。 地価は国土交通省がことし１月１日時点で調査した土地の価格で、変動率では県内の住宅地と商業地、それに工業地の３７４地点が対象になりました。このうち、前の年に比べて変動率がプラスになったのは、１６２地点で４１地点増えました。横ばいは、６８地点。マイナスは、１４４地点でした。平均の変動率は、０．１％で１９９３年に下落に転じて以来、３４年ぶりに上昇しました。用途別の平均変動率は住宅地が０％、商業地が０．３％、工業地が２．９％でした。住宅地が横ばいになったのは３４年ぶり、商業地が上昇となったのも３４年ぶりです。 ようやく下げ止まった住宅地は高崎市竜見町と岩押町の変動率が最も高く、３．９％となりました。商業地で最も変動率が高かったのは草津町で５．９％と３年連続の上昇です。住宅地で最も価格が高かった地点は１０年連続で高崎駅西口エリアの高崎市真町で、１平方メートルあたり１７万７０００円でした。一方、商業地で最も価格が高かった地点は３１年連続で高崎市八島町で、１平方メートルあたり５２万２０００円、前の年より５０００円上昇しています。 とりまとめを行った県不動産鑑定士協会は今後について「都市部と地方での二極化の差が広がるのでは」と懸念を示し、「今後の金利や建築資材の高騰などが先々に影響を与えると考えられるので注視したい」とコメントしています。,[],[]
高速道路の技術者育成へ　研修施設が完成　群馬・高崎市（群馬テレビ）,https://news.yahoo.co.jp/articles/8da60b5bc425b2c27fc7dc96fa3ce71746fd68e6,https://newsatcl-pctr.c.yimg.jp/t/amd-img/20260317-00000004-gtv-000-2-view.jpg?exp=10800,2026-03-17T20:12:25+09:00,2026-03-17T20:22:24+09:00,群馬テレビ,gtv,群馬テレビ,424,（写真：群馬テレビ） 高速道路の安全を支える技術者を育成するための新たな研修施設が高崎市に完成し、１７日開所式が行われました。 高崎市高関町に新たに完成したのは、高速道路の点検や設備管理に携わる技術者を育成する「テクニカル・トレーニングセンター」です。センターは、これまで高崎市矢中町にあった施設の老朽化にともない実践的な研修環境の充実を図ろうと、東京都に本社を置くネクスコ東日本エンジニアリングが整備したものです。 建物は、鉄骨鉄筋コンクリート造りの２階建てで、延べ床面積は約３４００平方メートルと旧施設より拡大しています。施設には、ＥＴＣの設備や道路設備の点検を学ぶことができる実習ヤードのほか、実際の高速道路を再現し設備の機能点検や故障対応などを学べる環境などが整備され、現場に近い状況で技術を習得できるようになっています。 １７日は開所式が行われ、関係者らが施設の完成を祝いました。施設の利用は、４月の新入社員研修から始まるということです。,[],[]
群馬産業技術センターと県信用保証協会が連携協定　群馬・前橋市（群馬テレビ）,https://news.yahoo.co.jp/articles/2d930cafe06a46d1462c7556bac4326cb874cf18,https://newsatcl-pctr.c.yimg.jp/t/amd-img/20260317-00000003-gtv-000-1-view.jpg?exp=10800,2026-03-17T20:12:24+09:00,2026-03-17T20:12:24+09:00,群馬テレビ,gtv,群馬テレビ,306,（写真：群馬テレビ） 群馬産業技術センターと県信用保証協会は１７日、中小企業の技術相談と金融支援を一体化する連携協定を結びました。 締結式には産業技術センターの加部重好所長と県信用保証協会の鬼形尚道会長らが参加しました。協定は中小企業の技術支援を行う産業技術センターと金融相談に対応する信用保証協会が連携することで、新規事業の資金調達を円滑に進めるねらいです。 東京商工リサーチによりますと、県内企業の倒産件数は去年１２４件で、コロナ禍明けから増加傾向が続いています。こうした状況を踏まえ今後両者は研究や技術開発のほか、経営・創業支援といった情報を共有し、共同でセミナーを行うなど連携を強化していくとしています。,[],[]
群馬県部長級人事内示　新設の「スポーツ推進監」含む７人就任（群馬テレビ）,https://news.yahoo.co.jp/articles/e1c0ea3226d2dbe9ef0c8d4f4902259145db05ad,https://newsatcl-pctr.c.yimg.jp/t/amd-img/20260317-00000002-gtv-000-3-view.jpg?exp=10800,2026-03-17T20:12:22+09:00,2026-03-17T20:34:31+09:00,群馬テレビ,gtv,群馬テレビ,412,群馬県庁 群馬県は１７日、４月１日付の部長級の人事異動を内示しました。「湯けむり国スポ・全スポぐんま」に向け新設された「スポーツ推進監」を含む７人が就任します。 農政部長には、ぐんまブランド推進課長の有田かおりさん、県土整備部長には、砂防課長の佐々木実さんが就任します。会計管理者は総務事務管理課長の高田裕美さん、病院局長は生活こども部副部長の佐藤貴彦さんです。デジタルトランスフォーメーション推進監は、グリーンイノベーション推進監の奈良晃世さんが兼務、危機管理監には危機管理課長の飯塚毅さんが就任します。また「湯けむり国スポ・全スポぐんま」に向け、スポーツ推進監を新設し、デジタルトランスフォーメーション推進監の間々田祐美子さんが就きます。 女性部長は今年度と同じ６人となり、議会事務局長を除く部長級１４ポストの女性比率は４２．９％で、高い水準を維持しています。このほかの人事異動については今月２４日に内示される予定です。,[],[]
７０歳まで働ける企業　群馬県内の３５．７％　人手不足背景に増加（群馬テレビ）,https://news.yahoo.co.jp/articles/bcd920cc550fcc6f914275d01ab0d8552d84ea3f,https://newsatcl-pctr.c.yimg.jp/t/amd-img/20260317-00000001-gtv-000-1-view.jpg?exp=10800,2026-03-17T14:12:21+09:00,2026-03-17T14:12:21+09:00,群馬テレビ,gtv,群馬テレビ,404,【イメージ】街を行き交う人の足元 希望する従業員に対し７０歳まで働ける環境を設けている群馬県内の企業はおよそ３５％で、人手不足などを背景に増加したことが群馬労働局のまとめで分かりました。 これは、群馬労働局が従業員２１人以上の企業４０４３社を対象に集計したものです。それによりますと、希望者を６５歳まで雇用する措置をとっている企業は１００％で前の年から変動はありませんでした。 しかし雇用形態では、一度退職して再雇用する割合が減る一方、定年の年齢そのものを引き上げる企業は増加しました。 また、７０歳まで働ける環境を設けた企業は１４４２社で、率にして３５．７％。全国平均の３４．８％を上回ったほか前の年から１．７ポイント増加しました。 これを企業の規模別にみると大企業が２８％なのに対し中小企業は３６．１％でした。若手の人材確保が難しい中小企業を中心にベテラン社員に残ってもらう傾向がみられるということです。,[],[]
