headline,mainEntityOfPage,image,datePublished,dateModified,author,media_en,media_jp,str_count,body,images,external_links
宮若市新犬鳴トンネル付近で車３台の事故　２台が炎上　１人重体（九州朝日放送）,https://news.yahoo.co.jp/articles/0b8b1e5b92d557a1bf1714dd4ed8726eeca19598,https://newsatcl-pctr.c.yimg.jp/t/amd-img/20251225-16670884-kbcv-000-1-thumb.jpg?exp=10800,2025-12-25T18:15:05+09:00,2025-12-25T18:15:05+09:00,九州朝日放送,kbcv,九州朝日放送,422,"九州朝日放送
福岡県宮若市の新犬鳴トンネル付近で車３台が絡む事故があり２台が激しく炎上。１人が意識不明の重体です。

こちらがその事故直後の映像です。午後１時頃に撮影されたもので、センターライン付近に止まった２台の車から激しい炎と黒煙が上がっています。

警察によりますと２５日午後１時前、宮若市犬鳴にある新犬鳴トンネル付近の県道で家族６人が乗る車が対向してきた車２台と次々と接触し、衝突しました。

この事故で家族６人が乗る車を運転していた高齢とみられる男性が意識不明の重体、残る家族５人も病院に搬送されましたが意識はあるということです。

また、最後に衝突した車に乗っていた男性も病院に搬送されています。

衝突した車２台は炎上し、事故現場を含むおよそ１０キロの区間が２５日午後５時現在で全面通行止めとなっています。

現場はカーブが続く片側一車線で、見通しは良くなかったということです。警察が事故の経緯を詳しく調べています。
九州朝日放送",[],[]
車いすテニス国際大会で優勝　矢野蒼大選手が県庁に報告（九州朝日放送）,https://news.yahoo.co.jp/articles/f3046eab0a4e897874aaf854754794e44e1143e0,https://newsatcl-pctr.c.yimg.jp/t/amd-img/20251225-16672284-kbcv-000-3-thumb.jpg?exp=10800,2025-12-25T18:15:02+09:00,2025-12-25T18:45:03+09:00,九州朝日放送,kbcv,九州朝日放送,358,"九州朝日放送
福岡県のパラアスリート発掘・育成事業の受講生が車いすテニスの国際大会で優勝し県庁に喜びの報告を行いました。

上田哲子副知事を訪問したのは、飯塚市出身の矢野蒼大選手（１７）です。

今年９月、オーストラリアで開催されたテニスの国際大会でシングルス・ダブルス共に優勝を果たしました。

矢野選手は、福岡県の「Ｆ−ＳＴＡＲ」というパラアスリート発掘事業で才能を見込まれ、高校入学後に車いすテニスを本格的に始めました。

現在世界ジュニアランキング１６位の実力者です。

矢野選手は「ジュニアで出る最後の大会だったので優勝出来て嬉しいです。やっぱり目標はパラリンピックでメダルを獲得することです」と話しました。

矢野選手は国際大会であるジャパン・オープン・テニスへの出場を目指すとしています。
九州朝日放送",[],[]
ＪＲ鹿児島線千早―箱崎に新設の駅名「ＪＲ貝塚」に（九州朝日放送）,https://news.yahoo.co.jp/articles/23c3ef1efa7ef4913220a7167a3ff5fff907772d,https://newsatcl-pctr.c.yimg.jp/t/amd-img/20251225-16670174-kbcv-000-1-thumb.jpg?exp=10800,2025-12-25T17:45:02+09:00,2025-12-25T17:45:02+09:00,九州朝日放送,kbcv,九州朝日放送,381,"九州朝日放送
２０２７年の開業を目指し鹿児島線千早駅と箱崎駅の間に新設される駅名について、ＪＲ九州は「ＪＲ貝塚」に決定したと発表しました。

新しい駅「ＪＲ貝塚」は、福岡市東区の鹿児島線千早駅から２・３キロ、箱崎からは１・７キロの地点に設けられ、２０２７年の開業を予定しています。

「ＪＲ貝塚」駅は九大箱崎キャンパス跡地の再開発に伴う地元の要望を受けて新設されるもので、駅名は一般募集し、１万５５１件の中から選ばれました。

近くに福岡市地下鉄の貝塚駅、西鉄貝塚線の貝塚駅があることから「ＪＲ」を付けていて、古宮社長は、「地元の人にとってのわかりやすさを優先させた」と語りました。

ＪＲ九州古宮洋二社長「地下鉄の貝塚、西鉄の貝塚がありますのでお客様が迷わないようにＪＲという名前を冠した」

駅構造は２面２線の対面式ホームで橋上駅舎の計画です。
九州朝日放送",[],[]
「１日３回食事とれない」子どもの貧困　実態明らかに　生活困窮世帯最新調査（九州朝日放送）,https://news.yahoo.co.jp/articles/32307034727843f9c9879c36e6493248c2c7a0a3,https://newsatcl-pctr.c.yimg.jp/t/amd-img/20251225-16669600-kbcv-000-2-thumb.jpg?exp=10800,2025-12-25T17:30:03+09:00,2025-12-25T17:45:05+09:00,九州朝日放送,kbcv,九州朝日放送,420,"九州朝日放送
物価高が直撃しています。困窮世帯の生活の苦しさが、九州でも長期化していることが明らかになりました。

貧困家庭を支援するＮＰＯ法人理事長は・・・「お母さんやお父さんが一生懸命働いているけれども」「サポートを求められる子どもや親御さんが爆発的に増えていっている」

貧困家庭を支援する団体が、全国の生活困窮世帯を対象に実施した調査によると、生活の苦しさが長期化している実態が明らかになりました。

特に若者で「仕事が充実していない」という回答は、九州で４２．９％と全国を１０ポイント近く上回りました。

生活に十分な金額を稼げないことが主な理由として挙げられています。

また、物価高騰の影響により「家計がさらに苦しくなった」と答えた世帯は８割を超え、２割以上が「１日に食事を３回とれなくなった」と回答しています。

ほかにも、子どもの習い事や、クリスマスなどの行事を諦めた経験がある世帯も９割ほどに達しています。
九州朝日放送",[],[]
福岡・佐賀　インフルエンザ警報継続中　年末年始も感染対策を（九州朝日放送）,https://news.yahoo.co.jp/articles/3b4b07114bc323c01c47055e3e106e475ff4830a,https://newsatcl-pctr.c.yimg.jp/t/amd-img/20251225-16669139-kbcv-000-2-thumb.jpg?exp=10800,2025-12-25T12:45:02+09:00,2025-12-25T15:15:03+09:00,九州朝日放送,kbcv,九州朝日放送,314,"九州朝日放送
引き続き感染拡大に警戒が必要です。福岡県では５週連続、佐賀県でも３週続いてインフルエンザ警報が出されています。

福岡県では、２１日までの１週間のインフルエンザの感染者数は１定点医療機関あたり６３．６９人で１２週間ぶりに前の週より減りましたが、依然として警報レベルが続いています。

また、先々週からインフルエンザ警報が出されている佐賀県では１定点医療機関あたりの患者数が５７．６７人と、およそ１．２倍に増加しました。

福岡県・佐賀県ともインフルエンザの流行は続くと見ていて、人の移動や接触機会の増える年末年始もうがい、手洗い、マスク、こまめな換気など基本的な感染対策に努めるよう呼び掛けています。
九州朝日放送",[],[]
公園の遊具事故受け　リスクマネジメント担当を設置　北九州市（九州朝日放送）,https://news.yahoo.co.jp/articles/12955c1c48a8422d17af22847132d8fafd33946c,https://newsatcl-pctr.c.yimg.jp/t/amd-img/20251225-16668554-kbcv-000-2-thumb.jpg?exp=10800,2025-12-25T12:15:03+09:00,2025-12-25T13:00:03+09:00,九州朝日放送,kbcv,九州朝日放送,353,"九州朝日放送
北九州市は公園の遊具で骨折などの事故が相次いだことを受け、リスクマネジメント担当を新たに設置すると発表しました。

北九州市の武内市長は２５日の会見で市の公園遊具で発生したけがを伴う事故に即座に対応するため市政変革推進室にリスクマネジメント担当の設置を発表しました。

北九州市では１月に「響灘緑地グリーンパーク」にあるすり鉢状の遊具で大人２人が骨折などのけがをしたほか４月から６月にかけて皿倉山のすべり台で少なくとも１０人が骨折などのけがをしています。

リスクマネジメント担当は年明けから稼働し、大人が遊具を使用した際の事故など想定されていない事例に対応するとしています。

武内市長は「滑り台の事故を単一の事案として終わらせず、公園遊具の安心安全に努めたい」としています。
九州朝日放送",[],[]
九大病院長が”経費不正支出”で辞任　出張先で会合を偽装（九州朝日放送）,https://news.yahoo.co.jp/articles/290e551c8a8b82d59da0077f05e40dfeac788287,https://newsatcl-pctr.c.yimg.jp/t/amd-img/20251225-16668084-kbcv-000-3-thumb.jpg?exp=10800,2025-12-25T12:00:03+09:00,2025-12-25T12:30:03+09:00,九州朝日放送,kbcv,九州朝日放送,323,"九州朝日放送
九州大学病院の院長が出張先で架空の会合を開催したとする文書を作成させ、同行した教員が不正に宿泊費を経費精算していたことが発覚し、２４日付で辞任しました。

九州大学によりますと中村雅史院長は２月福岡県外で開かれた会合に出席する際に教員と宿泊出張し、１日延泊した宿泊費について大学側は「私用である」として認めませんでした。

その後中村院長は、事務担当者に架空の会合を開催したとする虚偽の文書を作成させ、同行した教員が不正に１万数千円の宿泊費を精算したということです。

大学病院は２５日午前、中村院長が本人の申し出により、２４日付で辞任したと発表しました。

大学側は他の複数の不正に関する情報についても調べています。
九州朝日放送",[],[]
”遺失物”クリスマスツリー　装飾物を無料配布　ＪＲ博多駅（九州朝日放送）,https://news.yahoo.co.jp/articles/dbcb521a6905b7acfb876158740c34d0d3f3cd47,https://newsatcl-pctr.c.yimg.jp/t/amd-img/20251225-16667490-kbcv-000-2-thumb.jpg?exp=10800,2025-12-25T11:45:02+09:00,2025-12-25T13:00:06+09:00,九州朝日放送,kbcv,九州朝日放送,397,"九州朝日放送
ＪＲ博多駅に展示されていたサステナブルなクリスマスツリーで、装飾用に再利用された駅の遺失物が、２５日、無料で配布されました。

展示が終わったツリーから、装飾品を駅の利用者が手に取っていきます。

飾りとして再利用された遺失物は、落とし主が見つからなかったハンディファンなどです。

ＪＲ九州では、「再利用することの大切さ」と「忘れ物をしない意識」を再認識してもらおうと、ツリーの展示期間終了後も、”セカンドオーナー”に譲り渡すことで、物を大事に使うことの大切さを呼びかけています。

遺失物を手にした”セカンドオーナー”は・・・「ホークスが大好きなのでこれを迷わずゲットしました」「本来であれば処分されるものが新たな持ち主のもとに届くということですごく良いことで素敵なイベントだと思います」

担当者は「落とし物をしないよう再度確認をしてほしい」と呼びかけました。
九州朝日放送",[],[]
福岡市東区でアパートの１室燃える火事　男性１人死亡（九州朝日放送）,https://news.yahoo.co.jp/articles/2e13defac3bedcda0e1416298269fa049d083788,https://newsatcl-pctr.c.yimg.jp/t/amd-img/20251225-16666145-kbcv-000-3-thumb.jpg?exp=10800,2025-12-25T00:00:03+09:00,2025-12-25T09:15:03+09:00,九州朝日放送,kbcv,九州朝日放送,288,"九州朝日放送
２４日夕方、福岡市東区でアパートの１室が燃える火事があり、部屋にいた男性１人が死亡しました。

警察と消防によりますと、午後４時４５分ごろ福岡市東区香椎駅東のアパートで、「煙が激しく出ている」と、目撃者から消防に通報がありました。

火は、２階建てアパートの１室を焼いて、約３０分後に消し止められました。

この火事で男性２人が病院に搬送され、このうち部屋にいた１人はその後、死亡が確認されました。もうひとりは軽傷だということです。

現場はＪＲ香椎駅から東に６００メートルほど離れた国道３号近くの住宅街です。警察と消防が火事の原因を調べています。
九州朝日放送",[],[]
