headline,mainEntityOfPage,image,datePublished,dateModified,author,media_en,media_jp,str_count,body,images,external_links
夫の借金は私を陥れるための罠？ 家族の借金を肩代わりしない方がいい理由【離婚カウンセラーインタビュー】（ダ・ヴィンチWeb）,https://news.yahoo.co.jp/articles/48c85bb51f0f18fcaba89c41be4dbeddcf1b6cad,https://newsatcl-pctr.c.yimg.jp/t/amd-img/20260322-01333382-davincin-000-1-view.jpg?exp=10800,2026-03-22T21:30:00+09:00,2026-03-22T21:30:16+09:00,ダ・ヴィンチWeb,davincin,ダ・ヴィンチWeb,947,夫の策略に嵌められ、借金を背負わされた妻の復讐を描く『夫がゴミだと気づいたので捨てさせていただきます』（ゴルゴンゾーラ：原作、とあじゃぱ：漫画/KADOKAWA）。はたして妻に逆転できる未来はあるのか。 【漫画】本編を読む 元No.1キャバ嬢の菜々は、「会社のお金を使い込んだ」という夫・圭介のために、借金をしながらお金の工面をする。しかしそれは夫の仕掛けた罠だった。卑劣な印象操作で、逆転不可能な状況に追いやられた菜々…彼女はどう窮地を脱する？ 本作の夫婦を例に、離婚カウンセラーでもある「家族のためのADRセンター」代表・小泉道子さんに、夫婦の在り方やお金についての話を伺った。 ――本作の妻は、夫の策略によって借金を背負わされてしまいます。元をただせば夫のせいでも、借金の名義人は妻…本人が望まない形で借金を背負わされた人への救済措置はありますか？ 小泉道子さん（以下、小泉）：法律上の「詐欺」「脅迫」によって借金をさせられた場合、その借金をさせた相手に対してなんらかの法的措置を取ることはできるかもしれません。しかし妻が背負っている借金自体がなかったことにはなりません。 どんな理由があっても、他者の借金を肩代わりするような行為は避けてほしいと思います。 ――妻はどれだけ罵られても歯向かうことなく夫との生活を続け、借金まで背負ってしまいます。このような様子は一種の洗脳状態にも感じました。専門家としてどうお感じになられましたか。 小泉：そもそも愛している相手ですから、「いろいろあるけど、彼もきっと変わってくれるはず」と信じたくなるのでしょう。 「夫が会社のお金を横領したらしい」「夫と男女の関係にありそうな女が家に乗り込んできた」本作のような状態は致命的破綻をきたしている状況です。しかし結婚してしまっていると、この混沌とした状況をリセットするために行動してしまうこともあるのかもしれません。 取材・文＝あまみん 小泉道子（こいずみ みちこ） 「家族のためのADRセンター」代表。家庭裁判所調査官として、夫婦の離婚調停の仕事に15年間従事。その後、民間調停機関「家族のためのADRセンター」を立ち上げる。離婚カウンセラーとして、親の離婚に直面する子どもたちのケアにも力を入れている。,[],[]
一見優しそうなおばあちゃん、しかし実は… シュールな笑いを誘う“予測不能な生態” 【書評】（ダ・ヴィンチWeb）,https://news.yahoo.co.jp/articles/d532fcb14b7450f2405c2709c5467880702fd098,https://newsatcl-pctr.c.yimg.jp/t/amd-img/20260322-01332308-davincin-000-1-view.jpg?exp=10800,2026-03-22T19:30:00+09:00,2026-03-22T19:30:07+09:00,ダ・ヴィンチWeb,davincin,ダ・ヴィンチWeb,645,たった4コマでシュールな笑いを届ける、雪のヤドカリさん（@yukinohotel）の『文学的なオチが癖になる 雪のヤドカリ4コマ劇場』。毎回、話のラストには予想外のオチが用意されているが、今回紹介するエピソードは、これまで以上にエキセントリックかもしれない。 【漫画】本編を読む 物語の中心人物は、おばあちゃんと孫。一見すると優しそうなおばあちゃんだが、その言動は予想を軽々と超えてくる。 例えば自宅のテレビが映らなくなった際、孫から「いつものアレやって！」と言われたら普通のおばあちゃんはどう行動するだろうか。多くの人はテレビを叩いて直そうとするが、このおばあちゃんはまったく予想外の行動を取る。叩いたのはテレビではなく、電気屋の店員。気絶させるや、「さ 今のうちに持ってくよ」「42型でいいね？」と新しいテレビを手に入れてしまうのだった。 さらにある時は、せっせとお団子作りに励むおばあちゃん。聞けばゲームの支度をしているというが、なぜか美味しいお団子とは別にホウ酸団子まで用意されている。一体どんなゲームを……？ そもそもこのおばあちゃん、どうやら普通の人間ではないらしい。孫の友人から「お前のばーちゃんコンピューター!!」とバカにされているが、実際に孫以外の人々にはおばあちゃんの言語は数字の羅列として聞こえているようだ。 いずれにしてもおばあちゃんの言動はどこまでもエキセントリックで、常軌を逸している。人間離れした予測不能の生態に、思わず頬が緩んでしまうだろう。 文＝ハララ書房,[],[]
保護した仔猫は意図的に怪我をさせられた!? 行き場のない感情にどう向き合うのか【著者インタビュー】（ダ・ヴィンチWeb）,https://news.yahoo.co.jp/articles/c8d4149a04bd99ed2fcf88b3313ccc94f2c212b7,https://newsatcl-pctr.c.yimg.jp/t/amd-img/20260322-01331779-davincin-000-1-view.jpg?exp=10800,2026-03-22T18:30:00+09:00,2026-03-22T18:30:02+09:00,ダ・ヴィンチWeb,davincin,ダ・ヴィンチWeb,1049,思えば、やたらと保護猫を受け入れる人生だった。ライブドア公式ブログ「猫の手貸して」著者・ぴなぱさん（@pinapapinapa）は、3人の娘と夫の5人暮らし。昔から動物が好きで、保護団体などは通さず4匹の保護猫と暮らしてきた。どうやら、猫のしもべ（飼い主）になりそうな人間の調査や発掘をしているという秘密組織・ねこねこネットワーク（NNN）から「優良物件」としてロックオンされているようで――？ 【漫画】本編を読む ゴミ捨て場で拾った茶トラとそんな茶トラに育てられたクールな性格のキジトラ、ビビりな性格のミケ、社交的な性格のネオとの暮らしを描いた『ねこねこネットワーク（NNN）にロックオンされています。』は、ぴなぱさんが自身の体験をもとに描いたコミックエッセイ。著者のぴなぱさんに、保護猫との出会いや本作について話を聞いた。 ■拾った仔猫の怪我は人間による加害が原因かもしれないと分かり… ──ゴミ捨て場で衰弱していたところを保護した茶トラの頭蓋骨が割れていると聞かされたときの気持ちを教えてください。 ぴなぱさん（以下、ぴなぱ）：ありきたりかもしれないんですが、目の前が真っ暗になりました。頭蓋骨が割れているのは、もう命を繋ぐのは難しいと言われているような感覚でした。 ──状況から、人間が意図的に怪我をさせたのではないかと思い至っていましたが、もし正体が分かるなら仔猫を傷つけた人間にどのような言葉を伝えたいですか？ ぴなぱ：それこそ、当時はいっぱい言いたいことがありました。でも、今はもうそういう感情はなくて。きっと、動物が好きな私とはまったく感覚が違う人なんだと思うんです。だから、私が伝えたかった気持ちは全然伝わらないんだろうなと思うと、もう何も言えないと思います。動物愛護法が強化されたのは最近なので、当時は茶トラを傷つけた犯人を厳しく裁けなかったのも大きいです。 ──獣医から、「犯人探しより茶トラのこれからのことを考えよう」と言われても、納得はできなかったと描かれていました。中々気持ちの行き場がなかったと思いますが、どうやって折り合いをつけたのでしょうか？ ぴなぱ：当時はブログ文化の最盛期だったので、「いつかどこかでこのエピソードを書こう」と思いました。どこかにこの話を書くことで、茶トラが傷つけられた理不尽さや犯人への怒りを昇華させようと思っていたんです。まだマンガを描いているころではなかったので、文字だけのブログに怒りを綴っていたような気がします。 取材・文＝押入れの人,[],[]
「男の看護師は使えない？」看護師歴21年目の著者が描く、男性看護師の希望の物語『青のナースシューズ』【藤岡陽子 インタビュー】（ダ・ヴィンチWeb）,https://news.yahoo.co.jp/articles/f18b65c8ed1117f2469d9bf5e2695ad9cadb05f6,https://newsatcl-pctr.c.yimg.jp/t/amd-img/20260322-01331045-davincin-000-1-view.jpg?exp=10800,2026-03-22T18:00:00+09:00,2026-03-22T18:00:14+09:00,ダ・ヴィンチWeb,davincin,ダ・ヴィンチWeb,3364,※本記事は、雑誌『ダ・ヴィンチ』2026年4月号からの転載です。 「看護師」と聞いたとき、多くの人がイメージするのはおそらく女性の姿だろう。実際、日本の看護師の中で男性が占める割合は、令和の今でも全体のわずか8％程度に過ぎないのだから。 「少ないですよね。だからこそ、まず私自身が知りたかったんです。世間にたくさんある職業の中から、なぜ彼らはあえて看護師を目指すと決めたのか。その背景には、女性とは異なる強い動機や理由がそれぞれにあるはず。そういうことを小説で書いてみたいと思いました。それに、男性看護師というテーマを通じて、この仕事の魅力をもっと伝えたいという気持ちもありました。私自身も今年で看護師歴21年目ですから」 看護師と作家、二足の草鞋を履き続ける藤岡陽子さんの最新作『青のナースシューズ』は、男性看護師の卵たちの物語だ。看護大学に入学した主人公の成道が、壁にぶつかりながらも成長する姿が描かれる。 「執筆にあたって、今回はとりわけ詳細な取材を重ねました。男性が看護師の免許を取れなかった時代に看護を自身の一生の仕事にすると決めて働き続けた60代のパイオニアの方、法改正後に誕生した男性看護師の第一世代ともいえる40代の方、さらに現役看護学生の男の子たち4人と、いわば三世代にわたってお話を聞かせていただきました。取材を通じて感じたのは、それぞれの世代ごとに苦労が異なること。居場所がないところに居場所をつくろうと奮闘して道を切り拓いてきた苦労もあれば、演習でペアを組むことを女性のクラスメイトに拒絶されるしんどさ、病棟で患者に否定されるつらさもある。それでも看護師に憧れ、強い覚悟を持って進んだ彼らの歩みを、丁寧に伝えたかった」 春、華やかな女子学生たちがひしめき合う看護大学の入学式で、成道は期待に胸を膨らませていた。交通事故で下半身に損傷を負った弟の晴道、仕事に追われて余裕がない母と3人で暮らす彼にとって、看護師になることは長年の夢だったからだ。 「人生は思い通りにならないけれども仕方がない。そんな不遇な立ち位置の、自分を諦めている子を主人公にしよう、ということは決めていました。成道は世間的に見れば、ヤングケアラーと呼ばれる立場かもしれない。でも弟の介助や家事を自分がしないと家が回らないとわかっているから、現実を受け入れている。そう諦めていた彼が、希望をひとつ見つけたときに、そこから世界がどうやって大きく変化していくかを軸に物語を進めていきました」 ■白ウサギの集団に交じった黒ウサギたち 〈自分からすれば大学生になることは雨上がりに見える虹のようなものだった。いつ消えてもおかしくはない〉。高校生の成道はそんな思いで未来へ手を伸ばすことを諦めかけていたが、家から自転車で通える距離の看護大学に授業料免除の特待生枠があると知り、猛勉強して見事特待生の権利を勝ち取る。原動力になったのは、幼い頃に抱いた“白衣の天使”ならぬ“白衣の力士”への憧れだ。だが女性が9割を占める現場だからこそ、マイノリティである成道たち“男性看護師の卵”たちは、大学や実習先でさまざまな偏見や困難に直面する。 「私自身も過去に見聞きしましたし取材でも聞いた話ですが、『男の看護師は使えない』と口にする看護師も中にはいるんですね。でもそれって、単純に数が少ないから目立つだけだろうなと思っていて。白ウサギの集団に黒ウサギが少しでも交ざると目立ちますよね？ 男性看護師も同じで、現場で同じミスをしても、数が少ない男性のミスが目立って見えるだけ。でも、そういう理不尽な眼差しを乗り越えて行こうとする物語でもあります」 黒ウサギとして奮闘するのは成道ひとりではない。東日本大震災がきっかけで看護師を志した伊佐、性自認に悩んだ過去を救われた経験を持つ美国など、数少ない同性のクラスメイト5人は互いに励まし合い、やがて実際の患者を担当する病棟実習が始まる。物語としての重心は間違いなくこの病棟実習の日々だろう。忘れられない出会いと別れを経験した泌尿器科に始まり、小児科、産婦人科、そして訪問看護の現場まで。生身の患者たちと実際に触れ合うことで、成道たちは看護師としての覚悟を固めていく。 「私自身は30歳で看護学校に入学したのですが、担当した患者さんが2人亡くなったこともあって病棟実習のことは今も忘れられません。命に関わることの怖さ、自分の未熟さ、そういういろんなことを吸収しながら大人になっていく姿をここでは書きたかった。とくに男性にとってはハードルが高く、かつ必修科目である産婦人科での母性看護学実習は絶対に書かなければと決めていました。男性看護師が妊産婦さんの直接的なケアをすることはほぼないのですが、それまで女だけのものとして閉じられていた領域に男性看護師が介入することによって、妊娠・出産は女性だけの出来事ではない、パートナーである男性たちの出来事でもあるんだという意識を持ってもらうためには、男性看護師の存在はすごく意味があるはずです。世の中の変化を示すための存在としても」 そう、看護師の性別が男性に置き換わることで、社会の非対称性も物語の随所に浮かび上がってくる。 「看護師は女性の仕事だと考える人はまだ少なくありませんが、本当は性別はどちらでもよくて、仕事への思いの強さのほうが勝るんだ、というフラットな世界を今作では書けた気がしています。世間の目が気にならないわけではないが、それでも自分の気持ちを大事にしてやりたい仕事に飛び込んだ。今、現場にいる男性看護師の皆さんの多くはそうではないでしょうか」 ■前を向ける子どもいれば踏ん張れない大人もいる いるだけで目立つ少数の黒ウサギの存在は、世界にさまざまな波紋を広げる。成道の弟である晴道は、兄の姿に触発され、引きこもっていた状態から新しい一歩を踏み出す勇気を抱くようになる。車椅子ユーザーである彼もまた、外の世界では少数派の黒ウサギなのだから。 「私、感化ってすごく大事なものだと思っているんです。誰かの頑張りが、別の誰かの勇気になる。そんな伝播を、晴道が自立へと向かう姿を通してわかりやすく書きたいと思いました」 一方で、誰しもが強くいられるわけではない。それぞれに前進する成道や晴道とは対照的に、兄弟の母はどこか脆さを抱えた頼りない大人として描かれる。 「やっぱり人間、踏ん張れる人ばかりではない。自分のつらい境遇に押しつぶされながら、なんとか凌いでいる大人だって現実にはたくさんいます。兄弟のお母さんもそんな人。子どもを守りたい気持ちはあっても、本人の容量が小さいからできない。ずっと変わらないわけではないけれども、主人公たちのみずみずしい成長とはまた別に、そういうリアルなところも入れておきたかった」 終盤、長い旅のような4年間の終着点で、成道のもとにあるプレゼントが届く。それは彼がひたむきにケアと向き合い続けてきた歳月への奇跡のようなご褒美だった。 「自分で道を切り拓いて、自分の足で軽やかに歩いていく。そんな若者の放つ光に感化されて、『また頑張るか』と思ってもらえたら嬉しいですね。作家になって18年目ですが、私はやっぱり読んだ人に希望を与えられるようなものをこれからも書き続けたいんです」 取材・文：阿部花恵 写真：冨永智子 ふじおか・ようこ●1971年、京都府生まれ。スポーツ記者、タンザニア留学を経て看護師に転身。2009年、『いつまでも白い羽根』でデビュー。『リラの花咲くけものみち』で第45回吉川英治文学新人賞、第7回未来屋本屋大賞を受賞。『おしょりん』『満天のゴール』『晴れたらいいね』など多くの作品が映像化されている。現在も現役看護師として勤務。 『青のナースシューズ』 （藤岡陽子／KADOKAWA） 1980円（税込） シングルマザーで働き詰めの母の代わりに、車椅子生活の弟の面倒を見る日々を送っていた岡崎成道。一念発起して看護大学に進学した成道は、偏見や実習現場の壁に戸惑いながらも、仲間や患者との交流を通じて「ケア」の本質に触れながら成長していく。現役看護師の著者が圧倒的リアリティで描く、みずみずしい若者たちの葛藤と成長の物語。,[],[]
村上龍「こんな小説を書いたのははじめて、もう二度と書けない」飼い猫が話しかけてくる場面から始まる私小説的幻想小説【書評】（ダ・ヴィンチWeb）,https://news.yahoo.co.jp/articles/09857c81a0dfbd838c0ab00dfd7fa58e726e5f2f,https://newsatcl-pctr.c.yimg.jp/t/amd-img/20260322-01324598-davincin-000-1-view.jpg?exp=10800,2026-03-22T18:00:00+09:00,2026-03-22T18:00:09+09:00,ダ・ヴィンチWeb,davincin,ダ・ヴィンチWeb,1730,MISSING失われているもの 『限りなく透明に近いブルー』でデビューし、『コインロッカー・ベイビーズ』や『イン ザ・ミソスープ』など、挑発的な作品を数多く生み出してきた鬼才・村上龍。2026年はそのデビュー50周年にあたる記念すべき年である。 この記事の画像を見る そんな今年、村上龍作品を有名どころを読むだけで終わらせるのは惜しい。あわせて読んでおきたいのが『MISSING 失われているもの』（村上龍/新潮文庫）。2020年に単行本、2022年に文庫版が刊行されたこの本は、村上龍が自ら「こんな小説を書いたのははじめて」「二度と書けないだろう」とまで語る1冊。ここには他の村上龍作品にあるような暴力性はない。綴られているのは、村上龍という作家の内奥に迫るかのような幻想的な物語だ。 この本を電子版で読み始めた読者は、ページをめくり始めた瞬間から驚かされるに違いない。村上龍電子本製作所が制作した電子書籍版は、横書きで組まれている上に、ページの合間にたくさんの写真が挿入されている。本作は元々村上自身が主宰するメールマガジン「JMM」に連載していたものであるが、電子版ではメルマガ掲載時と同様に、村上龍自身が撮影・加工したという写真が掲載されているのだ。村上龍がどんな世界を思い描いたのかを、文章だけではなく、写真でも楽しむことができるのは面白い。ページをめくればめくるほど、読者は奇妙な世界にいざなわれていく。 まず目を奪うのは、猫の写真だ。 引用---- 「あの女を捜すんだ」 ---- 物語は、ある日突然、飼い猫が話しかけてくる場面から始まる。主人公である小説家は、数年前から体力の衰えとともに漠然とした不安を覚えるようになり、心療内科に通ってはいるが、猫が喋ったという事実をそのまま受け入れるほど追い詰められているわけでもない。小説家は、猫の言葉は小説家自身の考えていることを「リフレクト」しているだけに過ぎず、無意識が表現されているだけにすぎないと、冷静に判断した。そして猫の話を聞いているうちに、ふと、小説家は、猫が「捜せ」と言っているのは、若き女優・真理子のことではないかと思い至り、彼女に連絡を取る。だが、3年ぶりに会った彼女はどうもおかしい。不意に目の前に現れる光の束。どんどん失われていく現実感。閉店したはずの店。真理子とともに、存在しないはずの駅から過去に向かう電車に乗り込むと、やがて母の声が聞こえてきた。 シェパードの子犬。日曜日の図書室。画家だった父親のアトリエ。中学生の時の作文……。これは私小説と呼んでいいのだろうか。小説家は母親の声に導かれるように、どんどん自らの意識の奥深くへと入っていくが、夢か現実か曖昧な世界を彷徨う小説家の姿とその記憶に、私たちは村上龍自身を重ねずにはいられない。「場所や時間、それに記憶、混在しているファクターが絡まり合い、ねじれている」——そんな世界をたゆたえば、私たちは、ときには不安定さにめまいを感じ、ときにはうっとりとするような心地よさを覚える。 引用---- 「わたしは、充分に歳を重ね、さまざまなものを失いながら日々を過ごしている」 ---- 引用---- 「ミッシング。まさにそれだ。お前が、探そうとしているのは、ミッシングそのものなんだ。何かが失われている。ある世界から？ お前から？ おそらく両方だろう」 ---- 村上龍を「暴力と性の作家」として捉えているのならば、その認識は改めるべきだろう。ここには、全く別の凄みがある。村上は本作を執筆しながら、「小説っていったい何なんだろう」ということを考えたのだというが、私たちもまた、読み進めるうちに同じ問いを抱く。小説の不思議さを、創作の神秘性を、この本は体感させてくれる。 本作は、どこまでも哲学的で、そのすべてを完璧に理解しきるのは難しい。だが読み終えたとき、社会や時代を切り裂いてきた鬼才の深層、その奥にある、記憶と創作の原点に触れた気がした。村上龍という作家を、今までよりももっと知ることができた気がした。彼は何を抱えて作品を書いてきたのか。その秘密が詰まったこの本を、デビュー50周年の今こそ、ぜひ。 文＝アサトーミナミ,[],[]
