headline,mainEntityOfPage,image,datePublished,dateModified,author,media_en,media_jp,str_count,body,images,external_links
野菜もボリューム感もイイ！ ローソン「1／2日分の野菜が摂れるあんかけ焼そば」（GetNavi web）,https://news.yahoo.co.jp/articles/c1d97e42597944e9c3a1ffb322237ea7253dc90d,https://newsatcl-pctr.c.yimg.jp/t/amd-img/20231211-00010006-getnavi-000-1-view.jpg?exp=10800,2023-12-11T21:11:06+09:00,2023-12-11T21:11:06+09:00,GetNavi web,getnavi,GetNavi web,1076,\nローソン「1／2日分の野菜が摂れるあんかけ焼そば」\n中華料理の定番メニューとしても人気のあんかけ焼そば。とろっとしたあんに絡む麺が美味しいですよね。寒くなってきたこの時期に、身体に優しく染み渡る料理ではないでしょうか。そこで今回は、ローソンで発売中の「1／2日分の野菜が摂れるあんかけ焼そば」をご紹介\n【写真】ローソン「1／2日分の野菜が摂れるあんかけ焼そば」の画像をもっと見る\n●「1／2日分の野菜が摂れるあんかけ焼そば」（ローソン）\n麺の上にはたっぷりのあん、そして白菜、もやし、玉ねぎ、にんじん、きくらげと様々な野菜が。さらに半熟卵も乗っています。\nあんかけ焼そばの魅力のひとつが、様々な種類の食材が味わえること。ローソンの「1／2日分の野菜が摂れるあんかけ焼そば」（559円／税込）は、商品名にふさわしく野菜がたっぷりと入っています。\n\n500Wの電子レンジで4分加熱調理しました。蓋を開けると、なんとも食欲をさそう醤油の香りが漂います。麺の上にはたっぷりのあん、そして白菜、もやし、玉ねぎ、にんじん、きくらげと様々な野菜が。さらに半熟卵も乗っています。\n\n※価格はライター購入時のテイクアウト価格です。\nこれだけ野菜が入っていれば、罪悪感なく購入することができますよね。パッケージも大きく十分にお腹を満たせそう。さっそく気になる味わいをチェックしていきましょう。\n\nまずは麺から頂いてみます。あんに絡めて麺を味わうと、コクの深いあんとほどよい歯応えの麺との相性が完璧。中華屋さんで食べる「あんかけ焼そば」と遜色ない、もしくはそれ以上の美味しさです。\n\n濃い目の味のあんですが、それぞれの野菜の旨味もしっかりと感じられます。食材ごとに味も歯ごたえも違うため、まったく飽きずに食べられるのがGOOD。中でも白菜はシャキシャキとした食感で、主役級と言ってもいいくらい美味しく頂けました。\n\n別添えのからしを途中から加えてみると、これがまた美味。からしの量は好みによりますが、あんかけ焼そばの優しい味わいに、ツンとくるからしのエッセンスが加わりやみつきになります。気がつけばあっという間に完食していました。\n\n商品を購入した人からも「なかなかこれだけの野菜を食べられないので助かる」「ボリュームもあって満腹にもなるし、野菜も大いし大満足」など好意的な声が上がっていました。野菜をたくさん食べたい方はもちろん、満腹になりたい方にもローソンの「1／2日分の野菜が摂れるあんかけ焼そば」はオススメです。\n斉藤ペン太,"['https://newsatcl-pctr.c.yimg.jp/t/amd-img/20231211-00010006-getnavi-000-1-view.jpg?pri=l&w=640&h=400&exp=10800', 'https://newsatcl-pctr.c.yimg.jp/t/amd-img/20231211-00010006-getnavi-001-1-view.jpg?pri=l&w=640&h=400&exp=10800']","['https://news.yahoo.co.jp/articles/c1d97e42597944e9c3a1ffb322237ea7253dc90d/images/000', 'https://getnavi.jp/?gallery=gallery-1_1', 'https://news.yahoo.co.jp/articles/c1d97e42597944e9c3a1ffb322237ea7253dc90d/images/001']"
【西田宗千佳連載】性能と消費電力のバランスで苦しむインテルは「第14世代CPU」で大きく変わる（GetNavi web）,https://news.yahoo.co.jp/articles/b3e55b398826f1ef9adaddb5839d4cdd20b96f00,https://newsatcl-pctr.c.yimg.jp/t/amd-img/20231211-00010004-getnavi-000-1-view.jpg?exp=10800,2023-12-11T18:11:39+09:00,2023-12-11T18:11:39+09:00,GetNavi web,getnavi,GetNavi web,1512,\nVol.133-3\n\n本連載では、ジャーナリスト・西田宗千佳氏がデジタル業界の最新動向をレポートする。今回のテーマはクアルコムの新CPU「Snapdragon X Elite」。これに対抗するインテルのCPUの展望を解説する。\n今月の注目アイテム クアルコム Snapdragon X Elite\n↑自社開発のCPUアーキテクチャ「Oryon」を12コア搭載するSnapdragon X Elite。Apple M2と比較してマルチスレッドで50％高い性能を、第13世代CoreのPシリーズと比較して同じ電力量であれば性能は2倍になるという\nスマホやタブレットで使われていること、そしてMacでのAppleシリコン移行が成功したこともあり、ARMコアはx86よりも消費電力が低くて優秀……というイメージを持つ人が少なくないだろう。\n\nだが実際のところ、単純にARMかx86かで消費電力が決まっているわけではない。PCは処理がほとんど実行されていないタイミングと処理負荷が大きいタイミングがあり、それをどうコントロールするのか、どれだけ効率よく「消費電力の少ないタイミング」を増やすかで効いてくる。当然x86でもそうした処理は積極的に行なわれており、過去の製品に比べ消費電力は下がっている。\n\nただ、半導体の製造プロセスが若干不利であったり、PCという性質上スマホよりも負荷の高い処理を求められるシーンが多かったりと、不利なシーンは多い。x86としては「いかに構造を変えて低負荷時で消費電力が低い状況を増やすか」「PCとしての付加価値を出すか」という点が大きいように思う。\n\nここ2年ほどは、AMDに引きずられる形で、インテルも一般向けプロセッサーに内蔵されるGPUの性能アップに努めてきた。ASUSやレノボもポータブルなゲーミングPCに参入したが、それができたのはAMDのPC向けプロセッサーであるRyzenシリーズのコストパフォーマンスが良く、小型な製品でもそれなりにゲームができる性能を実現できたからである。インテルもGPUを強化したが、「小型でゲーム向け」ではニーズを伸ばしきれていない。\n\nインテルは、「いかに性能を上げるか」と「いかに消費電力を下げるか」のバランスで苦しんでいる。\nそこで採用するのが「チップレット」だ。\n\nチップレットとは、別々に作られたCPUコアやGPUコアなどを1つにパッケージングしてまとめ上げる技術。AMDはチップレットを活用してCPU・GPUの組み合わせバリエーションを増やし、いろいろなPCメーカーのニーズに応えている。\n\nインテルは2023年末から発売する「第14世代Core」（通称Meteor Lake）から、インテルが「タイルアーキテクチャ」と呼ぶチップレット構造を採用する。細かな技術面ではインテルのものとAMDのものでは異なるのだが、重要な点は2つに絞れる。\n\n要は「製品バリエーションを広げやすくなる」ことと、「処理に合わせた消費電力低減がしやすくなる」ことだ。特にインテルは、映像再生時などの消費電力が大幅に下がると説明している。搭載ノートPCが出てくるのは2024年からになるが、どのような製品になるかが気になるところだ。\n\nインテルがタイルアーキテクチャを採用するのは、より処理に合わせた消費電力低減を進めるためであると同時に、いまどきの半導体需要とニーズの両方に応えるためでもある。その「いまどきのニーズ」には、もちろんQualcommも対応しようとしている。\n\nどんな点なのか？ 次回解説する。\n西田宗千佳,['https://newsatcl-pctr.c.yimg.jp/t/amd-img/20231211-00010004-getnavi-000-1-view.jpg?pri=l&w=640&h=362&exp=10800'],['https://news.yahoo.co.jp/articles/b3e55b398826f1ef9adaddb5839d4cdd20b96f00/images/000']
話題の静音ボールペン「mute-on(ミュートン)」の音だけじゃない独自ギミックを検証（GetNavi web）,https://news.yahoo.co.jp/articles/32aafd423f5652f873542b5caabb4b654bb1d9b4,https://newsatcl-pctr.c.yimg.jp/t/amd-img/20231211-00010003-getnavi-000-1-view.jpg?exp=10800,2023-12-11T11:20:21+09:00,2023-12-11T11:20:21+09:00,GetNavi web,getnavi,GetNavi web,1760,\n近年、筆記具業界で注目されている機能のひとつが「静音化」である。大まかに言えば「ノック音をいかに静かにするか」という技術で、ぺんてる「Calm」シリーズやパイロット「フリクションボールノックゾーン」に搭載され、話題となっている。\n【写真】静音ボールペン「mute-on(ミュートン)」の詳細な画像をもっと見る\n例えば試験で集中しているときなど、周囲で延々と「カチカチ」されたらイライラとしてしまうだろう。自分はそういった “音ハラスメント” をしないよう、ちゃんと気をつけて静音仕様のペンを使いましょう、というのが、昨今の静音ペンの流れのようだ。\nトップクラスの静音性能をもつボールペン\nサンスター文具 mute-on（ミュートン） 240円（税別） 8色展開\nそんななか、2023年4月、音ハラ対策の静音仕様ペンとして発売されたのがサンスター文具の「mute-on」（ミュートン）である。全8色（インクは黒のみ）の軸色名が、「夜更かしの猫」「浜辺の小瓶」のように、ちょっとした物語を感じさせるネーミングになっているところがポイントだ。個人的には、この手の色名にかなり気恥ずかしさを感じてしまうのだが……これは多分、筆者がメーカーの想定するターゲットユーザー層ではないからだろう。\n\nさて、肝心の静音性に関してだが、昨今の静音仕様ペンの中ではまずトップクラスの静かさと言って間違いなさそう。ノック音そのものは、生活音の中に紛れてしまうとほぼ聞こえなくなるレベルで、これをうるさいと感じる人はまずいないはず。それぐらいに静かだ。\n↑ノックに連動して動く「ノック解除忘れ防止」クリップ\nノックに関してはもうひとつ、静音性に加えて「ノック解除忘れ防止」の機能も搭載されている。三角軸から浮きあがるように配置されていたクリップが、ノックノブを押し込むのに連動して、軸へ沈み込むように動くのである。つまり、この動作によってクリップが効かなくなるので、うっかりペン先を出したままシャツの胸ポケットや手帳に挿そうとしても気付くでしょ？ というギミックなのだ。\n\nこのクリップの動きが妙にかわいいので、ついつい用もないのに繰り返しノックしてしまう人は出てきそうだ。（音ハラの心配が少ないので、その点も安心だ）\n\nリフィルは専用の0.5mmゲルインクを搭載。最近のサンスター文具ではお馴染みとなりつつある “たっぷりインクフロー” で、サラサラと気持ちの良い書き味が楽しめる。この手のつゆだく系がお好きな方であれば、かなりハマるのではないだろうか。\nLAMYと似ているようで違う。独自のノック機構に注目\n↑LAMY「noto」（左）との比較。ノックノブや三角軸などの要素を抜き出せば似ているんだけど、並べてみると印象はわりと違う\n実は筆者がこの「mute-on」を最初に見たときに感じたのが「あれ、これLAMY（ラミー）のnoto（ノト）では？」ということ。LAMYの「noto」といえば、世界的な工業デザイナーである深澤直人氏が手がけたボールペンで、ハートカムと呼ばれる特殊な機構で静音ノックを実現した逸品である。なめらかな三角形の軸と、長楕円のノックノブ、軸に切り込むようなクリップも特徴的だ。これらの要素だけで見ると、やはりこの2つ、近いような気もする。\n\nさらに、ノックに連動したクリップの上下動も、同じくLAMYの「swift」に搭載されているギミック。これはさすがに、LAMYを意識していない、ということはないはずだ。ただし、当然ながら「mute-on」のノックはサンスター文具の独自機構（ハートカムではない）だし、デザインも突き詰めていけば別物。なので、捉え方としては「LAMYをリスペクトして進化させた」ということでいいんじゃないだろうか。\n\nなにより、静音ノックにノック解除忘れ防止、爽快感のあるリフィル、握りやすいグリップなどなど、これだけあれこれ詰め込んで税別240円という価格はかなり衝撃的。これは買い逃すともったいない級のペンなので、見つけたらまずは即ゲットして、あれこれ試してみるのが正解だと思う。\n筆者はまず、色名の気恥ずかしさだけは乗り越える必要があるけども。,"['https://newsatcl-pctr.c.yimg.jp/t/amd-img/20231211-00010003-getnavi-000-1-view.jpg?pri=l&w=640&h=426&exp=10800', 'https://newsatcl-pctr.c.yimg.jp/t/amd-img/20231211-00010003-getnavi-001-1-view.jpg?pri=l&w=640&h=426&exp=10800', 'https://newsatcl-pctr.c.yimg.jp/t/amd-img/20231211-00010003-getnavi-002-1-view.jpg?pri=l&w=640&h=426&exp=10800']","['https://getnavi.jp/stationery/924051/?gallery=gallery-1_1', 'https://news.yahoo.co.jp/articles/32aafd423f5652f873542b5caabb4b654bb1d9b4/images/000', 'https://news.yahoo.co.jp/articles/32aafd423f5652f873542b5caabb4b654bb1d9b4/images/001', 'https://news.yahoo.co.jp/articles/32aafd423f5652f873542b5caabb4b654bb1d9b4/images/002']"
ハンズフリーの快適さよ…挟むだけで効率化する「クリップ型ブックストッパー」2種を使い比べ（GetNavi web）,https://news.yahoo.co.jp/articles/5a775070c5ff9c8e2dcfd7eb1bf6ea37656dac5e,https://newsatcl-pctr.c.yimg.jp/t/amd-img/20231211-00010002-getnavi-000-1-view.jpg?exp=10800,2023-12-11T11:00:42+09:00,2023-12-11T11:00:42+09:00,GetNavi web,getnavi,GetNavi web,1731,\n以前よりはだいぶ減ったとはいえ、本など紙の資料を見ながら仕事を進めるという機会は、いまだにゼロではないだろう。そういうときに、なによりも面倒くさいのがページの固定である。本やカタログを開いた状態でギュッと圧をかけて押さえ付けたり、重しを乗せてみたりしても、いつの間にかページが戻っていたりする。しかも、借り物や大事な本だったりすると手荒な真似もしづらい。\n【写真】クリップ型ブックストッパーの詳細な画像をもっと見る\nそこで今回試してみようと思ったのが、一般的に “ブックストッパー” と呼ばれる、ページを挟んで固定するクリップ型のページ保持具だ。偶然にも同時期に新製品が2つ登場していたので、両方を試してみた。\n1．本の上に “ウかんむり” でページを固定\nサンスター文具 ウカンムリクリップ 各600円（税別） 6色展開\nまず1つ目が、サンスター文具から発売されている「ウカンムリクリップ」だ。ちょっと不思議な製品名だけど、実物を見れば「ああ、なるほど」と思える。クリップの形状が、まさに漢字の部首の “ウかんむり” の形をしているのだ。\n\n使い方は、つまみ部分を持ってグッと開いてから、開いておきたいページの上部中央に挟みつけるだけ。これでページを固定するというわけだ。単にそれだけなら、大きめな目玉クリップか洗濯ばさみでも似たようなことができるのだろうが……実はこのユニークなウかんむり形状が、他にはない便利さに効いてくるのである。\n↑二叉の先端が左右のページを押さえるように挟み着ければ、固定完了\n「ウカンムリクリップ」は、中央を空けて左右の端に挟み口があるので、本の背表紙を避けて挟むことができる。これならハードカバーでも背が邪魔にならず、スムーズにセット可能だ。加えて本のノド（中央にあるページの綴じ部）を押さえ付けない構造なので、開きグセが付きにくいというメリットもある。個人的には、この開きグセの付きにくさが特にありがたかった。\n\n実際に試してみた感覚としては、上部から左右の両ページを固定しているため、開いているページがしっかりフラットになって読みやすいように感じられた。ただし、上から固定している＝下側がフリーなので、厚い本だとページ下部が少し浮いたようになるケースもある。形状的に仕方がないことなのだが、その点は少し気になるところだ。\n2．ずっしり重量で挟んだページを固定\nSONic（ソニック） OMO CLIP 各700円（税別） 2色展開\nふたつ目に紹介するのが、ソニックの「OMO CLIP（オモクリップ）」。こちらは左右のページを挟む力で固定するのではなく、片側のページに荷重をかけることで開きっぱなし状態をキープする、というもの。\n\n「OMO CLIP」は挟み口がフラットで、普通の目玉クリップなどに近い見た目だ。しかし、クリップ用のバネが巻き付けられた金属軸の部分が、「うおっ！」と驚くほどに太いのである。この軸が錘（おもり）になっており、開いたページの片側端に挟むことで、ずっしりと荷重がかかってページが開きっぱなしになるという仕組みだ。\n↑本の端を挟むと、「OMO CLIP」の重みでページが固定される\nただし、左右でページの残量が少ない方に着けないと意味がない。そうしないと、逆に本が勢いよく閉じてしまうので、要注意だ。\n\nもうひとつ、ページ端だけに重みをかけるという方式だけに、固定中はどうしてもページが山なりになってしまう。そのため、ノド側の文字が読みづらく感じることもあった。\n\n一方で、本をめくって読み進めるときには、固定するページを変更しやすいというメリットもあった。例えば、数ページに渡るレシピを見ながら調理するときには、「開いて固定＆めくり進めしやすい」このクリップが便利だと思う。\n\n仕事で使うだけでなく、参考書を見ながらノートを作ったり、譜面を開いておいたりという用途にもブックストッパーは欠かせない。見た目にもわりと地味な道具ではあるが、使ってみるとなかなかに便利なので、ここまでの紹介を読んでピンと来た人は、ぜひ導入してみてほしい。\nきだてたく,"['https://newsatcl-pctr.c.yimg.jp/t/amd-img/20231211-00010002-getnavi-000-1-view.jpg?pri=l&w=640&h=426&exp=10800', 'https://newsatcl-pctr.c.yimg.jp/t/amd-img/20231211-00010002-getnavi-001-1-view.jpg?pri=l&w=640&h=426&exp=10800', 'https://newsatcl-pctr.c.yimg.jp/t/amd-img/20231211-00010002-getnavi-002-1-view.jpg?pri=l&w=640&h=426&exp=10800', 'https://newsatcl-pctr.c.yimg.jp/t/amd-img/20231211-00010002-getnavi-003-1-view.jpg?pri=l&w=640&h=426&exp=10800']","['https://getnavi.jp/stationery/909567/?gallery=gallery-1_1', 'https://news.yahoo.co.jp/articles/5a775070c5ff9c8e2dcfd7eb1bf6ea37656dac5e/images/000', 'https://news.yahoo.co.jp/articles/5a775070c5ff9c8e2dcfd7eb1bf6ea37656dac5e/images/001', 'https://news.yahoo.co.jp/articles/5a775070c5ff9c8e2dcfd7eb1bf6ea37656dac5e/images/002', 'https://news.yahoo.co.jp/articles/5a775070c5ff9c8e2dcfd7eb1bf6ea37656dac5e/images/003']"
