headline,mainEntityOfPage,image,datePublished,dateModified,author,media_en,media_jp,str_count,body,images,external_links
注目ニュースランキング　どうなる？除染土の再利用・福島（福島中央テレビ）,https://news.yahoo.co.jp/articles/ffa2df409d09395808bee2b664663ce17ac78fc7,https://newsatcl-pctr.c.yimg.jp/t/amd-img/20250228-04165526-fct-000-3-thumb.jpg?exp=10800,2025-02-28T18:54:00+09:00,2025-02-28T19:03:15+09:00,福島中央テレビ,fct,福島中央テレビ,972,"FCT福島中央テレビ
ご覧のようなニュースに多くの関心が集まっていました。

覚せい剤の使用や交通違反の車がパトカーから逃走中など事件に関するニュースが多いですね。
イトーヨーカドー郡山店跡に「ヨークパーク」一部が先行オープン・福島県
さて、深掘りするのは中間貯蔵施設に保管される除染土の問題について。

県外最終処分の期限まであと20年と迫る中、土の再利用について「まずは県内で」と語った 地元町長の思いとは…

双葉町と大熊町にまたがる中間貯蔵施設。

ここには県内の除染で出た土＝除染土が保管されています。その量、実に東京ドームおよそ11杯分。

ただ、ここはあくまで「中間」の保管施設で、除染土は2045年3月までに福島県外で最終処分することが法律で定められています。

このうち、全体の4分の3ほどに当たる放射能濃度が低い土について国は道路などの公共事業で再利用する考えですが「県外」での実証事業は、住民らの反対もあり議論が進んでいません。

約束の期限まであと20年と迫る中、先日、双葉町の伊澤町長がこの問題についてある考えを示しました。

■双葉町 伊澤 史朗 町長
「首都圏の人たちへの理解を進めるには、まずは福島県内で取り組む必要があるという話はさせていただきました」

個人的な見解とした上で除染土の再利用を「まずは県内で取り組む必要がある」とし、将来、町の造成工事などで使う可能性もあると述べました。

その背景にある、思いについて伊澤町長は…

■双葉町 伊澤 史朗 町長
「いまだ福島県内の理解情勢。首都圏の皆さんの理解情勢が進んでいないという風な危機的な状況を考えた時に、こういう風な発言になりました」

国の調査では除染土の県外最終処分について「知っている」と答えた人は県内でも「半数」。

県外では「4分の1」ほどにとどまっているのが現状です。

■双葉町 伊澤 史朗 町長
「自分たちのところが復興して、放射線量の不安、心配がなくなった。じゃあそれはどういうことなのかというと、大熊、双葉が大変な思いをして引き受けたこのものに関して。県内の置き場のあった自治体の皆さんにぜひもう1度あの時のことを思い起こしていただきたい」

約束の期限が迫る中で、除染土の問題について理解を広げていくことが重要となりそうです。",[],[]
大型スーパー跡の建物が解体　福島市長「再利用に向けた第一歩」（福島中央テレビ）,https://news.yahoo.co.jp/articles/fbc6e291db29c2609d29b50100d232a7fe2dd29c,https://newsatcl-pctr.c.yimg.jp/t/amd-img/20250228-05576464-fct-000-1-thumb.jpg?exp=10800,2025-02-28T18:34:00+09:00,2025-02-28T18:34:00+09:00,福島中央テレビ,fct,福島中央テレビ,298,"FCT福島中央テレビ
福島駅前にある大型スーパー跡の建物が解体されることについて福島市の木幡市長は「再利用に向けた第一歩」と述べました。
イトーヨーカドー郡山店跡に「ヨークパーク」一部が先行オープン・福島県
2024年5月JR福島駅西口近くのイトーヨーカドー福島店が閉店し、所有する東京の不動産会社は4月以降に建物を解体する方針です。

こうした動きについて28日、木幡浩市長は次のように述べました。

■福島市 木幡浩市長
「一定の調査なども進んで取り壊しに入るのは、あの場所の再利用に向けた第一歩なんだろうと思う」

解体後の土地の利活用について市は「今後の動きを注視していく」としています。",[],[]
「作品が生まれるかもしれない」犬童監督ら映画ロケ地を視察・福島（福島中央テレビ）,https://news.yahoo.co.jp/articles/d9eb7ea6774bff8e64bf2ffd248e708443bb7875,https://newsatcl-pctr.c.yimg.jp/t/amd-img/20250228-03274595-fct-000-1-thumb.jpg?exp=10800,2025-02-28T18:26:00+09:00,2025-02-28T18:26:00+09:00,福島中央テレビ,fct,福島中央テレビ,371,"FCT福島中央テレビ
犬童一心監督など日本を代表する映画関係者が、ロケに活用できる相双地方各地の施設などを視察しました。
イトーヨーカドー郡山店跡に「ヨークパーク」一部が先行オープン・福島県
これは相双地方を中心に映画のロケ誘致に取り組む相双フィルムコミッションが企画したものです。

映画「引っ越し大名」の犬童一心監督や「ドライブ・マイ・カー」の山本晃久プロデューサーなど日本を代表する映画関係者が、27日から現地に入り、ロケに活用できる施設などを視察をしています。

28日一行は、大熊町の縫製工場跡地などを視察しました。

■犬童一心監督
「毎年こうしていろいろな人が、映画のプロデューサーや監督が見に来るなどしていると、何かしらの作品が生まれるかもしれない」

視察は1日までで、1日は、富岡町でワイン用のブドウ畑を視察する予定です。",[],[]
滝に打たれ無病息災願う　中野不動尊で水行・福島（福島中央テレビ）,https://news.yahoo.co.jp/articles/8eb68535e9ad8c43192ec4cc35bcf2ca6a13857a,https://newsatcl-pctr.c.yimg.jp/t/amd-img/20250228-06166991-fct-000-1-thumb.jpg?exp=10800,2025-02-28T18:18:00+09:00,2025-02-28T18:18:00+09:00,福島中央テレビ,fct,福島中央テレビ,377,"FCT福島中央テレビ
福島市では恒例の「水行」が行われました。

ところどころにまだ雪が残る福島市飯坂町の中野不動尊です。
こちらで28日行われたのは平安時代から続くとされる恒例の「水行」です。
イトーヨーカドー郡山店跡に「ヨークパーク」一部が先行オープン・福島県
28日は「お不動さま」の縁日ということで、県の内外からやってきた20代から60代の40人ほどが滝に打たれ身を清めました。

28日は最高気温が10℃を超え、4月並みの暖かさとなった場所もあった県内ですが、凍えるような冷たさの水を浴びて参加者もご覧の表情。それでも！

■参加者は
「落ちてくる滝が痛くいて、冷たくてびっくりしたけど、体感は思ったよりも短かったです」
「いらないものがすべて流されたような。清々しい気持ちです」

参加者たちは水行を通して無病息災や家内安全を願っていました。",[],[]
女湯の脱衣所に侵入…北海道警の警察官を起訴・福島（福島中央テレビ）,https://news.yahoo.co.jp/articles/fb4fd673307401f4ad64e9bed1b551052bc0bbee,https://newsatcl-pctr.c.yimg.jp/t/amd-img/20250228-07327131-fct-000-2-view.jpg?exp=10800,2025-02-28T18:03:00+09:00,2025-02-28T18:11:16+09:00,福島中央テレビ,fct,福島中央テレビ,304,"福島地方検察庁
福島県富岡町にあるホテルの女湯の脱衣所に侵入したとして北海道警の警察官が起訴されました。
車の中で20代の知人女性の首を絞め監禁か…白河市の23歳の無職の男を逮捕・福島県
建造物侵入の罪で起訴されたのは、北海道警の千葉俊輔被告（24）です。

起訴状によりますと、千葉被告は2025年2月7日、正当な理由がないのに富岡町にあるホテルの女湯の脱衣所に侵入したとされています。

千葉被告は北海道警から福島県警への短期派遣で原発特別警備部隊の応援に入り、このホテルに宿泊していました。

警察によりますと、千葉容疑者は逮捕時には「性的欲求を満たすためだった」などと容疑を認めていたということです。",[],[]
車の中で20代の知人女性の首を絞め監禁か…白河市の23歳の無職の男を逮捕・福島県（福島中央テレビ）,https://news.yahoo.co.jp/articles/3a35a1d85ca9e4d285ed4de514d61512ff3aacf2,https://newsatcl-pctr.c.yimg.jp/t/amd-img/20250228-07633729-fct-000-2-view.jpg?exp=10800,2025-02-28T12:46:00+09:00,2025-02-28T12:58:18+09:00,福島中央テレビ,fct,福島中央テレビ,381,"FCT福島中央テレビ
白河市で知人女性の首を絞め車の中に監禁した疑いで白河市の無職の男が逮捕されました。
部屋に物色の形跡…郡山市のアパートで女性がキャッシュカードを奪われた強盗事件
傷害と監禁の容疑で逮捕されたのは白河市の23歳の無職の男です。

警察によりますと、逮捕された男は、２月21日の午後7時40分ごろ白河市内のコンビニエンスストアの駐車場に停めていた20代の知人女性の車の中で、女性の首を絞めた上、車の中に閉じ込めて1時間以上にわたって車を走行させた疑いです。
男はその後、車を降りて逃走しましたが、被害女性の通報を受けて捜査した警察が白河市内で発見しました。
女性は全治およそ1週間のケガをしました。

男は容疑を、おおむね認めているということです。
この日、2人は会う約束をしておらず、警察は2人の間にトラブルがあったとみて捜査を続けています。",[],[]
県北地方の２０代女性を脅し　わいせつ動画を送信させた容疑で鳥取県の男を逮捕・福島（福島中央テレビ）,https://news.yahoo.co.jp/articles/d81c5884cc31f1b08cbe80435b7eb6a6992ea50d,https://newsatcl-pctr.c.yimg.jp/t/amd-img/20250228-09966566-fct-000-3-view.jpg?exp=10800,2025-02-28T12:15:00+09:00,2025-02-28T14:47:20+09:00,福島中央テレビ,fct,福島中央テレビ,384,"FCT福島中央テレビ
県北地方に住む20代の女性をSNSアプリを通して脅し、わいせつな姿を撮影させて動画を送信させた疑いで鳥取県の男が逮捕されました。

不同意わいせつ・性的姿態等撮影の容疑で逮捕されたのは鳥取県米子市の28歳の会社員の男です。
逮捕された男は、2024年9月7日から8日にかけて、SNSを通して知り合った福島県の県北地方に住む20代の女性に「他の画像も拡散しておく」「家の住所をネットに書き込んでいるからな」などと脅迫し、携帯電話機で性的な姿を撮影させて動画を送信させた疑いが持たれています。

警察は被害者からの届出を受けてアプリを運営する会社に照会するなどして男を割り出し、福島北警察署桑折分庁舎の警察官が2月27日の朝、米子市で男を逮捕したということです。

警察の調べに対し男は「間違いありません」と容疑を認める供述をしているということです。",[],[]
イトーヨーカドー郡山店跡に「ヨークパーク」一部が先行オープン・福島県　（福島中央テレビ）,https://news.yahoo.co.jp/articles/ef3ad1a9f4d0335d09444c5d086085f12872f006,https://newsatcl-pctr.c.yimg.jp/t/amd-img/20250228-07114698-fct-000-2-thumb.jpg?exp=10800,2025-02-28T11:23:00+09:00,2025-02-28T12:23:24+09:00,福島中央テレビ,fct,福島中央テレビ,362,"FCT福島中央テレビ
郡山市西ノ内の新たなショッピングセンターヨークパークで、核となる店舗が先行オープンしました。
変わる福島県都　JR福島駅周辺の空洞化が進むなか…福島市役所隣に新施設完成
2024年に閉店したイトーヨーカドー郡山店の跡に先行オープンしたのはヨークパーク1階のヨークベニマル西ノ内店です。福島牛や馬刺し、それに常磐ものの海の幸が並びます。
また専門店では郡山のクリームボックス発祥の店・ベーカリー・ロミオが復活する他、柳津町の小池菓子舗が出店しできたてのあわ饅頭が味わえます。

■朝7時から並んだ人は
「初日ということで色々な商品が安いと思うので、それを目当てに来ました」

ヨークパークの店舗面積は2万7千平方メートルで、生活雑貨のロフトやユニクロなどを含む30店舗のグランドオープンは3月14日です。",[],[]
部屋に物色の形跡…郡山市のアパートで女性がキャッシュカードを奪われた強盗事件　（福島中央テレビ）,https://news.yahoo.co.jp/articles/97382431b66c366b2e518e49ed202fc2a0479725,https://newsatcl-pctr.c.yimg.jp/t/amd-img/20250228-07244639-fct-000-2-thumb.jpg?exp=10800,2025-02-28T10:47:00+09:00,2025-02-28T12:26:17+09:00,福島中央テレビ,fct,福島中央テレビ,359,"FCT福島中央テレビ
郡山市のアパートで女性が男にキャッシュカードを奪われた強盗事件で、女性の部屋に物色された形跡があったことがわかりました。
郡山市でキャッシュカードを奪われる強盗事件　犯人逃走中で住民に不安広がる・福島県
事件が起きたのは郡山市富久山町のアパートです。おとといの夜、20代の女性が帰宅すると部屋にいた知らない男に包丁のような刃物を突きつけられ、「殺すぞ」などと脅されてキャッシュカード数枚を奪われました。

警察によりますと窓ガラスは割られておらず、男は玄関から侵入したとみられ部屋の中には物色された形跡があったということです。逃走中の男は40から50歳くらいで、身長175センチメートル程度、上下黒っぽい服装だったということです。

警察は防犯カメラの映像を集めるなどして男の行方を追っています。",[],[]
福島原発事故後の農業の復興目指し　双葉町と東京農業大学が連携協定締結・福島県（福島中央テレビ）,https://news.yahoo.co.jp/articles/57db250830eed06301e30336e1142610396baa5e,https://newsatcl-pctr.c.yimg.jp/t/amd-img/20250228-06812355-fct-000-2-thumb.jpg?exp=10800,2025-02-28T10:36:00+09:00,2025-02-28T12:26:17+09:00,福島中央テレビ,fct,福島中央テレビ,342,"FCT福島中央テレビ
農業の復興を目指し双葉町が東京農業大学と連携協定を結びました。

双葉町は2022年に一部の避難指示が解除され、ブロッコリー栽培などを再開しました。
これまでに東京農業大学の学生が農業体験などを行っています。
こうした関係もあって双葉町は東京農業大学と連携協定を結び、新たな特産品の栽培や6次化による商品開発に取り組むことになりました。
除染土の再利用について「まずは県内で」と双葉町の伊澤町長　環境相にも考え伝える
■伊澤史朗町長
「いろいろな作物の知見をお聞きしながらできるものから取り組んでいきたい」
■東京農業大学 江口文陽学長
「町の復興とともに学生の高い志という部分を醸成できるのではないかと考えています」

双葉町は新たな就農者の育成も支援します。",[],[]
