headline,mainEntityOfPage,image,datePublished,dateModified,author,media_en,media_jp,str_count,body,images,external_links
福岡空港国際線ターミナルビルのグランドオープン日は来年３月２８日！　免税店エリアはこれまでの４倍に（テレQ（TVQ九州放送））,https://news.yahoo.co.jp/articles/2a3b8a56cf4101dc98e41fbf877196418be043b1,https://newsatcl-pctr.c.yimg.jp/t/amd-img/20241106-90007057-tvq-000-1-thumb.jpg?exp=10800,2024-11-06T18:32:01+09:00,2024-11-06T18:32:01+09:00,テレQ（TVQ九州放送）,tvq,テレQ（TVQ九州放送）,394,\nテレQ(TVQ九州放送)\nリニューアル工事が進められている福岡空港の国際線。そのグランドオープンが２０２５年３月２８日になると発表されました。\n\n福岡国際空港 田川真司社長\n「国際線ターミナルビルのグランドオープン日が２０２５年３月２８日に決まった」\n\n２０２５年３月２８日にグランドオープンする福岡空港国際線のターミナルビル。これまでの４倍の広さになる免税店エリアでは九州・福岡のグルメが楽しめるフードコートを新たに設けます。また、保安検査場の処理能力をこれまでの２倍にして混雑緩和を図ります。２０２５年３月には２本目の滑走路の運用も始まる予定で利用客のさらなる増加が期待されています。\n\n「（福岡空港は）インバウンドが増えている。福岡の玄関口でもある。福岡の成長、九州の成長を考えていくなかで機能強化をしっかりしていかなければならない」\nテレQ(TVQ九州放送),[],[]
泳ぐ宝石「ニシキゴイ」の競りに中国人バイヤーが集結！その理由は？（テレQ（TVQ九州放送））,https://news.yahoo.co.jp/articles/5a3ee10173cec08c2698d8518aa4d761e55dde5c,https://newsatcl-pctr.c.yimg.jp/t/amd-img/20241106-90007060-tvq-000-1-thumb.jpg?exp=10800,2024-11-06T18:50:01+09:00,2024-11-06T18:50:01+09:00,テレQ（TVQ九州放送）,tvq,テレQ（TVQ九州放送）,388,\nテレQ(TVQ九州放送)\n威勢のいい声で競り落とされていくのは泳ぐ宝石「ニシキゴイ」。久留米市で１１月６日開かれたオークションでは２０の国と地域から集まった外国人バイヤーたちが目当てのニシキゴイを品定めしていました。\n\n１１月６日のオークションに出品されたニシキゴイは１７０匹以上。円安の影響もあり輸出額は２０２３年、６７億円まで増加しています。またニシキゴイは福島第一原発の処理水放出を受け２０２３年から中国への輸出が停止。こちらの養殖場ではこの１年、中国客が購入したニシキゴイを預かり育てていました。中国への輸出が１１月中に再開する見通しとなり、中国人バイヤーからは喜びの声が聞かれました。\n\n中国人バイヤー\n「２０２３年買ったニシキゴイをこちらで預かってもらい育ててもらっていた。正式に輸入できることを望んでいたのでうれしい」\nテレQ(TVQ九州放送),[],[]
久留米市のボクシングジムの更衣室で女性を盗撮　自営業の男が逮捕（テレQ（TVQ九州放送））,https://news.yahoo.co.jp/articles/436bace72806c018172658832f5c9d42a57dc9da,https://newsatcl-pctr.c.yimg.jp/t/amd-img/20241106-90007059-tvq-000-1-thumb.jpg?exp=10800,2024-11-06T18:41:01+09:00,2024-11-06T18:41:01+09:00,テレQ（TVQ九州放送）,tvq,テレQ（TVQ九州放送）,349,\nテレQ(TVQ九州放送)\n久留米市のボクシングジムの更衣室で女性を盗撮したとして男が逮捕されました。\n\n性的姿態等撮影の疑いで逮捕されたのは自称・久留米市の自営業、田原雄二容疑者（４３）です。田原容疑者は１１月５日の午後７時前、自身が経営するボクシングジムの女子更衣室にスマートフォンを忍ばせたバッグを置き、利用者の女性の尻などを撮影した疑いが持たれています。\n\n更衣室で着替えていた女性がバッグの穴からレンズがのぞいていたことに気付き、田原容疑者を問い詰めたところ撮影を認めたということです。警察の調べに対し田原容疑者は「スマートフォンを設置し女性の裸を撮影しようとしたことに間違いありません」と容疑を認めています。警察は余罪も含めて詳しく調べています。\nテレQ(TVQ九州放送),[],[]
固定担任制やめた中学校　半年を経て教員の働き方は変わったか（テレQ（TVQ九州放送））,https://news.yahoo.co.jp/articles/662d9c7de4f0212fc91a95aa7807a59a5e124484,https://newsatcl-pctr.c.yimg.jp/t/amd-img/20241106-90007054-tvq-000-1-thumb.jpg?exp=10800,2024-11-06T18:34:01+09:00,2024-11-06T18:34:01+09:00,テレQ（TVQ九州放送）,tvq,テレQ（TVQ九州放送）,2176,\nテレQ(TVQ九州放送)\n福岡市の城西中学校では今年度からクラスごとに担任を配置する従来の仕組みをやめて「学年チーム制」と呼ばれる仕組みに挑戦しています。導入から半年、現状と課題を取材しました。\n\n福岡市城南区の城西中学校。\n\n「担任はいないですね。５人ぐらい担任がいます。室先生、林先生、清水先生、\n池田先生、白石先生５人」\n\n城西中では今年度から一般的な固定担任制を廃止し学年チーム制を導入。２年生の場合、３クラスを５人の教員が担当しています。これまでの担任の役割をするのは\nＭＴと呼ばれる「メインティーチャー」でその他はＳＴと略される「サブティーチャー」。１週間ごとにＭＴを交代しています。\n\n生徒\n「チーム担任制になって話したことない先生との交流もできていいなみたいな」\n\n一方でこんな声も・・・\n\n「体育大会で優勝してもすぐに他のクラスに先生がいっちゃうのでそんなにいっしょにやったーとなれない」\n\n運動会と並ぶ学校のビッグイベント、「合唱コンクール」は学年チーム制のもとどのように実施されるのでしょうか。\n\n合唱コンクール１週間前。\n\nこの週の２年５組のメインティーチャーは林さんです。昼休み、練習する生徒たちをＭＴの林さんが見守っています。\n\n林さんは教員になって今年で２年目。去年との違いをこのように話します。\n\n林さん\n「去年は初めて合唱コンクールを見るという形でしたが今年は他の先生のやり方を間近で見られるのは大きいと思います」\n\n生徒からはこんな声も。\n\n生徒\n「一人の先生がずっと成長を見てくれるというのがなくなったのはちょっと寂しいなというのはある」\n\n去年までの合唱コンクールとは違って生徒が主体となりクラスをまとめていく必要があります。そこが「学年チーム制」の狙いのひとつです。\n\n迎えた本番。２年５組が見事、金賞を受賞しました。\n\n林さん\n「給食はＳＴで５組にそのま ま入ろうかなと思います」\n\n林さん、この日はＳＴ・サブティーチャーです。受け持つクラスで給食を食べるメインティーチャーと違ってＳＴは食べる場所を選べます。林さんは金賞を受賞した５組で給食をとることにしました。\n\n生徒\n「合唱コンはもう余裕っすよね。金賞」\n\n林さん\n「もう金賞とったやん」\n\n練習をまとめた生徒\n「みんなが頑張ってくれなかったら絶対に金賞は取れなかったと思うので本当にありがとうございました」\n\n少し成長した生徒たち。\n\n一方で林さんは生徒との関わり方に手応えはあったのでしょうか。\n\n林先生\n「生徒のやり方に入り込みすぎずというところで去年とは関わり方は大きく違う。そこをメインとしているシステムだと思う」\n\n生徒\n「去年は先生の指示でみんな動いていたけれど今年はチーム担任制になって先生がいない中みんなの力で優勝したことが良かった」\n\nこの学年チーム制を導入した西田校長。生徒主体の合唱コンクールを次のように評価します。\n\n校長\n「以前は担任力であの先生のところは金賞取るよねみたなところがあったが子どもたちの力でやっているので（どのクラスも）同じくらい頑張っていたような気がする」\n\n一方で課題も見えてきたといいます。\n\n校長\n「どれくらいの距離感で子どもたちと離れていたらいいのか、ここは手出し口出し\nしていいのかなと我々もまだ迷いがあるように思う。適度な距離感で子どもたちを支えていけたらいいなと思っています」\n\n生徒に主体性が芽生えるなどメリットが多い「学年チーム制」ですが導入していない小中学校の教員はこの状況をどのように見ているのでしょうか\n\n番組では座談会を実施しました。\n\n小学校教員\n「ぼくは昨年度から教務主任という立場で学校全体の世話をしている。うちの学年の先生は若い先生が夜残ったら一緒に教材研究をしてくれるし、夕方から保護者に電話したらずっとそばで聞き取りをしてくれてうんうんとうなずいてくれるしやっぱ若い先生が踏みとどまってくれるのは、やっぱり学年の先生方のおかげかなと 思っています」\n\n若い教員に過度な負担をかけないためにも学年チーム制には一定の意義があると捉える一方で３人の教員が共通して懸念するのは・・・\n\n小学校教員\n「一番怖いのは共倒れですよね」\n「怖いですね。地獄ですね」\n\n教員たちが懸念する共倒れとは・・・。\n\n中学校教員\n「初任の先生にとってはとても心強いだろうなと思いますけれど、やはり一部の先生に負担が来るのが容易に想像ができる」\n\n小学校教員\n「僕去年折れかけたんですよ。チーム担任制じゃないですけど管理職から言われた。若い先生のサポートのために他のクラスの教科に入ってくれと。本当に好きで入った世界で担任を何年もやって自信もある程度やっぱりあった。ミドル世代というか中堅に押しかかってくる仕事の責任の重さは大きい。今ここで倒れてしまっては若い先生がたおれてしまってはもう学校現場崩壊」\n「子どもと向き合う時間がほしいだけ。人が増えて仕事を分担するのが一番いい」\nテレQ(TVQ九州放送),[],[]
今すぐ使える！ユニクロ”寒暖差”の裏技テクニックとは？（テレQ（TVQ九州放送））,https://news.yahoo.co.jp/articles/5bc8d434e16ffb6ff18c8827649f71ed02903b8a,https://newsatcl-pctr.c.yimg.jp/t/amd-img/20241106-90007055-tvq-000-1-thumb.jpg?exp=10800,2024-11-06T18:34:01+09:00,2024-11-06T18:34:01+09:00,テレQ（TVQ九州放送）,tvq,テレQ（TVQ九州放送）,721,\nテレQ(TVQ九州放送)\n寒暖差対策としてすぐに実践できる「裏技」があると聞いてやってきたのは福岡市天神のユニクロです。\n\n木戸優雅アナウンサー\n「寒暖差を解消するための裏技があると聞いたが、何？」\n担当スタッフ\n「寒くなった時期にヒートテックを活用する人が多いと思うが、その下にさらにエアリズムを重ね着する方法がある」\n\nそう。夏用と冬用のインナーの重ね着です。\n\nＱ．どういう効果がある？\n担当スタッフ\n「ヒートテックは自分の水分を熱に変えてくれる、それで暖かくなる性能を持っているが、中にエアリズムを着ることで素早く汗を吸収して発散してくれる効果があるので、必要以上に暑くなりすぎない」\n\nつまり、汗を熱に変えるヒートテックと、汗を素早く乾かすエアリズムが程よく機能し寒暖差を解消してくれるというのです。\n\n今や多くの人が持っているユニクロのインナー。そもそも寿命はあるのでしょうか？木戸アナウンサーの私物を見てもらうと…\n\n担当スタッフ\n「かっこの一番左の数字、『３』の数字が一番近くで２０２３年の『３』」\n\nインナーのタグのかっこの部分。この左端の数字が西暦の１桁目を意味し、購入時期が分かります。\n\n木戸アナ\nＱ．去年ではないので、このヒートテック１１年目ってこと？機能は大丈夫？\n\n担当スタッフ\n「ヨレヨレになって生地が伸びてくると体に沿わない部分も出てきていると思うのでピタッとしている方がより暖かさを感じやすいので買い替えをされる時期と思う」\n\n寒暖差が大きく体調を崩しやすい１１月。肌着の工夫や脱ぎ着しやすい服装で乗り切りましょう。\nテレQ(TVQ九州放送),[],[]
ソフトバンク和田投手引退会見「悔いのない野球人生たっだ」（テレQ（TVQ九州放送））,https://news.yahoo.co.jp/articles/eeab52035358fb0c60d5537cb1002f5dc81034f3,https://newsatcl-pctr.c.yimg.jp/t/amd-img/20241106-90007056-tvq-000-1-thumb.jpg?exp=10800,2024-11-06T18:32:01+09:00,2024-11-06T18:32:01+09:00,テレQ（TVQ九州放送）,tvq,テレQ（TVQ九州放送）,290,\nテレQ(TVQ九州放送)\n引退会見を開いたホークスの和田毅投手。日米通算１６５勝のレジェンドを称える声もあがっています。\n\n和田毅投手\n「振り返っても悔いのないといいますか、やり残したことのない野球人生だと思っている。（指導者になる予定は？）それに見合う人物になって戻って来れたらなと思う。（松坂世代）同級生全員が引退になったのでなんかやろうよという話はした」\n\n和田投手の引退を受けホークスの王貞治会長は「体の具合で悩んだことも多かっただろうがそれを乗り越えてやろうという強い意志を持っていた本当によく頑張った」とコメントしています。\nテレQ(TVQ九州放送),[],[]
県内４カ所で今シーズン最低気温を観測　あなたの寒暖差対策は？（テレQ（TVQ九州放送））,https://news.yahoo.co.jp/articles/b6dc10ecf07695f84857282f928f7dfae31dad74,https://newsatcl-pctr.c.yimg.jp/t/amd-img/20241106-90007058-tvq-000-1-thumb.jpg?exp=10800,2024-11-06T18:31:02+09:00,2024-11-06T18:31:02+09:00,テレQ（TVQ九州放送）,tvq,テレQ（TVQ九州放送）,217,\nテレQ(TVQ九州放送)\n秋深まる１１月。福岡市の１１月６日の最低気温は１５．４℃で１０月中旬並みの気温となりましたが、八女市黒木では９．４℃を観測するなど県内４カ所で今シーズン最低となりました。この時期、街の人たちを悩ませているのが「寒暖差」です。\n\n街の人\n「気温が分からなくて上着を間違えました」\n「なるべく重ね着をして脱げるようにしています」\n「着すぎると汗をかくし、難しいですね」\nテレQ(TVQ九州放送),[],[]
