headline,mainEntityOfPage,image,datePublished,dateModified,author,media_en,media_jp,str_count,body,images,external_links
えびす講・衝突事件から25年　当時現場で対応に当たった警察官が語る「祭りと暴走族」（広島テレビ　ニュース）,https://news.yahoo.co.jp/articles/fc731451a604c5d93c5609d866c0b9e7ff9ac66a,https://newsatcl-pctr.c.yimg.jp/t/amd-img/20241120-09526974-htv-000-2-thumb.jpg?exp=10800,2024-11-20T19:48:01+09:00,2024-11-20T19:52:44+09:00,広島テレビ　ニュース,htv,広島テレビ　ニュース,1912,広島テレビ放送 広島市では20日まで「えびす講」とも呼ばれる「胡子大祭」が開かれています。 25年前、この祭りの場で暴走族と警察が衝突する事件が起きました。当時、現場で対応にあたり、暴走族壊滅に尽力した警察官に話を聞きました。一方、騒音を立てて走るバイクを巡っては新たな問題も生じています。 広島三大祭りの一つで、冬の訪れを告げる「えびす講」。今年も多くの人で賑わいます。広島県警の小瀧光司さん。25年前、祭りの警戒に当たっていました。 ■広島南署 小瀧光司交通第二課長 「当時えびす講というのは『暴走族の引退式』と暴走族がとらえていましてこの祭りに出てきて、特攻服を着てですね。ここで自分たちの引退セレモニーをするんですね」 ■暴走族と記者のやりとり（1999年） 「今日えびす講最終日だけど、君たちにとってえびす講って何？」 「最後。引退。」 「今日で引退するの？」 「うん」 当時、県内には44のグループがあり、428人が所属。周辺を占拠するなど問題になっていました。事態を重く見た県警は、暴走族の排除に乗り出します。 ■当時の警察官 「君たちを道路交通法違反で検挙することになる。ただちに移動しなさい」 「検挙！検挙！」 歩行者天国に集まる暴走族に対し、県警は退去を警告。祭り客らの目の前で大きな衝突が起きました。 ■広島南署 小瀧光司 交通第二課長 「少年たちも200人、300人集まっていたはずなんですよね。警察が強い姿勢を示したと。検挙したので、少年たちもすごく迷ってるというか。自分たちが思い通りに暴走族の引退式ができなくなったというか、頓挫したような形でうっぷんはたまっていたのではないかとは思うんです」 県警は祭りの3日間で45人を逮捕。路面電車が立ち往生するなど、市民生活にも大きな影響が出ました。その後、小瀧さんは捜査員の1人として暴走族壊滅に動きます。 ■広島南署 小瀧光司交通第二課長 「2人1組で車両に乗って覆面パトカーに乗って無線を聞きながらですね。暴走族が出たぞというところを無線を聞くとそっちの方に行って。見つけてそれをビデオ撮影して後から誰がやったかというのを割り出して逮捕していくというような作業をしていました」 2001年には全国初となる「暴走族対策課」が発足。翌年には、広島市が暴走族の集会を禁止するなど罰則付きの条例を定め暴走族包囲網が敷かれていきます。対策が功を奏し、県内の暴走族は衝突の年をピークに減少。2015年、ついにその数は「ゼロ」に。 ■広島南署 小瀧光司交通第二課長 「集まっているようなことも散見されなくなる。集団暴走行為も減っていくというのを目の当たりにすると、やっぱりこう確実に減っているなということで、やった甲斐があったというか、すごく嬉しかったです」 今、祭りの会場にあの騒動の面影はありません。 ■祭り客 「これが本来の姿かなとは思いますけど。あの時がちょっと異常だったようにも思いますけど」 ■祭り客 「これ、すぐそこなんですが」 「えっ…！？（騒動があったとは）全然知らないです。初めて知りました。今じゃ考えられない感じ。」 しかし… ■爆音バイク 「ブォーーーーーーン！！！」 今、市民を悩ませているのが「爆音バイク」の存在です。暴走族のような組織性はなく、SNSなどを通じてつながっているのが特徴です。騒音の通報は今年10月までで、去年を大幅に上回る1800件以上が寄せられています。県警は8月、爆音バイクの対策を専門とする全国初の組織を立ち上げました。 ■広島県警 暴走・爆音走行対策室 世並貴志 課長補佐 「一時的な空吹かしだからいいじゃないかと、自分たちの欲求を満たすと言いますか、周りの方の迷惑は、正直なところ二の次。あまり気にはしてないというような現状があると思います。1つの場所でですね、継続的にやるのではなくてですね、複数か所、場所を変えながら取り締り・検問するのも有効な手段だと思っています」 小瀧さんは現在、広島南署で爆音バイクの対応にあたっています。県内では4年前、新たな暴走族が確認され、今も2つのグループが活動しています。時代と共に変化する課題。静かな夜を取り戻す対策は道半ばです。 ■広島南署 小瀧光司交通第二課長 「私としては25年前のことがよく分かっていますので、いい祭りになって良かったという思いが強いですよね。これを元のような状態にしてはいけないし、確実に検挙して、そういったことを抑制していくというか、やめさせていくということを続けていくしかないかなと思っているところです」 【2024年11月20日 放送】,[],[]
尾道市立市民病院 医療ミスで男性死亡 遺族に3265万円支払いへ 【広島】（広島テレビ　ニュース）,https://news.yahoo.co.jp/articles/a57358a4fc2a6bfa7b42da0ae836de1664d00c84,https://newsatcl-pctr.c.yimg.jp/t/amd-img/20241120-06126685-htv-000-1-thumb.jpg?exp=10800,2024-11-20T19:46:00+09:00,2024-11-20T19:46:00+09:00,広島テレビ　ニュース,htv,広島テレビ　ニュース,149,広島テレビ放送 尾道市立市民病院で2016年、肺の摘出手術を受けた50代の男性が出血により死亡した事故を受け、市は20日、遺族に3265万円を支払うことを明らかにしました。事故は医師によるミスが原因で、病院は、安全な手術を行うための管理体制を強化するとしています。 【2024年11月20日 放送】,[],[]
広島市内で檻に入ったクマを発見…目撃情報も（広島テレビ　ニュース）,https://news.yahoo.co.jp/articles/d861511d8e6404eda4fd38823825c142e3cb7bfe,https://newsatcl-pctr.c.yimg.jp/t/amd-img/20241120-05616636-htv-000-2-thumb.jpg?exp=10800,2024-11-20T19:43:00+09:00,2024-11-20T19:47:43+09:00,広島テレビ　ニュース,htv,広島テレビ　ニュース,161,広島テレビ放送 広島市安佐南区沼田町吉山の民家のそばで20日、檻に入ったクマが発見されました。 体長およそ150センチの成獣で、イノシシ用のワナにかかっていたということです。 区役所によると、この地域では10月以降、10件以上のクマに関する目撃情報が寄せられており、注意を呼びかけています。 【2024年11月20日放送】,[],[]
広島・西区強盗殺人未遂・放火事件　元大手証券マンを起訴（広島テレビ　ニュース）,https://news.yahoo.co.jp/articles/516fd6c427dd8c8c9254b2fc5510077343deb123,https://newsatcl-pctr.c.yimg.jp/t/amd-img/20241120-09352477-htv-000-2-thumb.jpg?exp=10800,2024-11-20T19:41:01+09:00,2024-11-20T19:44:43+09:00,広島テレビ　ニュース,htv,広島テレビ　ニュース,306,広島テレビ放送 2024年7月、広島市西区で顧客の住宅から現金を奪い放火したとして元証券会社社員の男が起訴されました。 強盗殺人未遂や放火などの罪で起訴されたのは、神奈川県に住む無職の男（29）です。 起訴状などによると、男は2024年7月、広島市西区の住宅で顧客だった80代の女性に睡眠薬を飲ませて昏睡状態にさせました。そして押入の中にあった現金およそ1800万円を奪い、火をつけて殺害しようとした疑いです。 警察によると、男には個人的な投資で数千万円の損失があったということです。また、事件より前に被害者の家からおよそ800万円を盗んでいたとみられ、警察が詳しく調べています。 【2024年11月20日放送】,[],[]
被爆地の子供たちが平和交流　長崎の小学生が広島訪問（広島テレビ　ニュース）,https://news.yahoo.co.jp/articles/c4a44455c2edbb0f92bf22631e380eb17caddc2c,https://newsatcl-pctr.c.yimg.jp/t/amd-img/20241120-01281156-htv-000-2-thumb.jpg?exp=10800,2024-11-20T18:47:00+09:00,2024-11-20T19:25:49+09:00,広島テレビ　ニュース,htv,広島テレビ　ニュース,332,広島テレビ放送 広島と長崎の小学生が20日、平和学習で交流です。きょうは長崎の小学生が広島を訪れました。 ■広島の小学生 「碑文には安らかに眠ってください。過ちは繰り返しませぬからと刻まれています」 広島大学附属小学校の児童らが、長崎の小学生を案内するフィールドワーク。原爆の子の像や供養塔などをめぐりました。 交流は去年からはじまり、先月は広島の児童が長崎を訪れ平和学習をしました。 ■長崎の小学生 「国語の教科書で（原爆供養塔が）5年生の時に載っていて知ってはいたけれど、全然（引き取り手のない遺骨が）見つかってない人が、こんなにいると実感できた」 両校は、今後も同世代での現地交流を通して、平和への想いを深めたいとしています。 （２０２４年１１月２０日放送）,[],[]
カキ養殖の海洋ゴミを再生資源に！リサイクル施設が完成【広島】（広島テレビ　ニュース）,https://news.yahoo.co.jp/articles/efa914562791f23de99ad3903699d40ac1960622,https://newsatcl-pctr.c.yimg.jp/t/amd-img/20241120-02791212-htv-000-2-thumb.jpg?exp=10800,2024-11-20T18:42:00+09:00,2024-11-20T18:46:44+09:00,広島テレビ　ニュース,htv,広島テレビ　ニュース,476,広島テレビ放送 カキを養殖する際に出る海洋ゴミを再利用しようと、県漁連が構想から6年半をかけた施設が20日、お披露目されました。 ■宮脇キャスターリポート 「再利用されるのはカキの養殖の際に使われるこうした発泡スチロールや、養殖する際に使うプラスチックの道具など海洋ゴミと言われるものです」 広島市西区の草津港に完成したのは海のゴミを再生資源へとリサイクルする施設です。 カキ筏を浮かせるために通常、1台あたり30個ほどの発泡スチロールが使われており、養殖が盛んな広島県では年間でおよそ3万個のゴミが出ます。この施設では粉砕したのちペレットに加工します。 また、プラスチックのパイプは細かく砕き、ともに燃料へと姿を変えます。 来年6月以降に本格稼働し、県の漁業関連施設で使用するボイラーの燃料となります。 ■広島県漁業協同組合連合会 米田 輝隆 代表理事会長 「漁業系のごみが多く流れていたのでこの施設が出来れば海洋ごみがゼロになるのではと思う」 県漁連は今後も海の環境を守りながら、持続可能な漁業に取組みたいとしています。 【2024年11月20日】,[],[]
全国から送電会社が参加　災害からの電気復旧訓練【広島】（広島テレビ　ニュース）,https://news.yahoo.co.jp/articles/b9e26b4fafcfef85d788dbcb3fedbd84f02bc917,https://newsatcl-pctr.c.yimg.jp/t/amd-img/20241120-02723754-htv-000-2-thumb.jpg?exp=10800,2024-11-20T18:07:00+09:00,2024-11-20T18:12:44+09:00,広島テレビ　ニュース,htv,広島テレビ　ニュース,266,広島テレビ放送 ■ON 「わっしょいわっしょい」 訓練は全国の送配電会社10社が集まり、初めて共同で実施。線状降水帯による豪雨災害でおよそ40万戸が停電した想定で行われました。 20日は、各社で異なっていた部品や工具を統一し、切れた電線をつなぐ作業などを行いました。 ■中国電力ネットワーク配電部 上田明正 部長 「Face to faceでこういった一堂に会して連携しあうのは非常に生きた訓練になると思っております」 訓練は21日まで行われ、今後、課題を検討し、連携をさらに強めることにしています。 【2024年11月20日放送】,[],[]
夢は億万長者！？　年末ジャンボ宝くじ発売開始　広島では夏の当選売場が人気（広島テレビ　ニュース）,https://news.yahoo.co.jp/articles/0577d705de9dd85b0bf88790899ff27b196f5568,https://newsatcl-pctr.c.yimg.jp/t/amd-img/20241120-03921246-htv-000-2-thumb.jpg?exp=10800,2024-11-20T18:04:01+09:00,2024-11-20T18:07:55+09:00,広島テレビ　ニュース,htv,広島テレビ　ニュース,514,広島テレビ放送 ■売り場の人 「年末ジャンボ、初日を迎えております。いかがですか？」 きょうから全国で発売がはじまった年末ジャンボ宝くじ。1等7億円、前後賞を合わせると10億円という夢のような当せん金が人気です。ただ、こちらの売り場、人気の理由は、それだけではありません。 ■レポ 鷺山 「こちらの売り場では、今年のサマージャンボ宝くじでなんと1等前後賞あわせて7億円の当選がでています」 さらに、広島市内の別の売り場でも、7つの数字を選んで当てる「ロト7（セブン）」で億を超える当せんが相次いでいます。億万長者の夢は、おのずとふくらみます。 ■女性 「サマージャンボ出たんでね。あやかりたいです。（当たったら）家族で旅行にいきたいですね。夢を買ってます」 ■女性 「（当たったら）古い家もあるし、いろんな計画もあるし車とかいろいろ・・夢はあります」 ■男性 「もう40年くらい、そろそろ当たるかなと。あたったら来年楽しくやりたいと思います」 それぞれが託す夢・・・。年末ジャンボ宝くじはインターネットでも購入でき、販売は12月21日まで。億万長者の夢をかけた抽せんは、大晦日におこなわれます。 【2024年11月20日 放送】,[],[]
大学生が観光をサポート！安田女子大×観光連盟が協定締結【広島】（広島テレビ　ニュース）,https://news.yahoo.co.jp/articles/7b0c17d62a1dc2e859ff241bbd3f8d1092452bea,https://newsatcl-pctr.c.yimg.jp/t/amd-img/20241120-05193592-htv-000-2-thumb.jpg?exp=10800,2024-11-20T14:04:01+09:00,2024-11-20T14:07:45+09:00,広島テレビ　ニュース,htv,広島テレビ　ニュース,259,広島テレビ放送 広島県の観光を教育面からも推進しようと安田女子大学と広島県観光連盟が協定を結びました。 連携協定は、広島県や周辺地域の魅力発信や観光客へのもてなし推進などで協力します。安田女子大学は観光学や英語、経営を専攻する学生を中心に、オーバーツーリズムなどの課題解決を目指した研究で、協力します。 ■安田女子大学 瀬山敏雄 学長 「素晴らしいものを学び、築き、育ちあげて世界に広げて いくことも大学の役目だろう」 大学は、来年新たに開設する学部でも連携をすすめたいとしています。 【2024年11月20日 放送】,[],[]
億万長者を夢見て…年末ジャンボ宝くじ発売始まる【広島】（広島テレビ　ニュース）,https://news.yahoo.co.jp/articles/ca4963d0eb61b2f6da7bc4e104e4a846c6598fdf,https://newsatcl-pctr.c.yimg.jp/t/amd-img/20241120-08826319-htv-000-2-thumb.jpg?exp=10800,2024-11-20T14:00:00+09:00,2024-11-20T14:03:45+09:00,広島テレビ　ニュース,htv,広島テレビ　ニュース,339,広島テレビ放送 1等と前後賞合わせて10億円の「年末ジャンボ宝くじ」が20日から全国一斉に発売されました。 ■ 売り場の人 「年末ジャンボ、初日を迎えております。いかがですか？」 広島市中区の宝くじ売り場では午前9時から販売が始まりました。「年末ジャンボ宝くじ」は1等7億円。前後賞を合わせると10億円です。 この売り場では、今年のサマージャンボ宝くじで、1等前後賞あわせて7億円の当せんが出ていて、億万長者を夢見る人たちが次々と買い求めていました。 ■客 「もう40年ぐらい（買っている）そろそろ当たるかなと」 「家族で旅行行きたいですねー。夢を買ってます」 年末ジャンボ宝くじは、インターネットでも購入でき、来月21日まで販売されています。 【2024年11月20日 放送】,[],[]
