headline,mainEntityOfPage,image,datePublished,dateModified,author,media_en,media_jp,str_count,body,images,external_links
2026年4月から自転車にも反則金　「青切符」制度開始を前に岩手県警が啓発動画制作で交通ルールを呼びかけ（岩手めんこいテレビ）,https://news.yahoo.co.jp/articles/af9ee1b320e5cc975d433db4c20a88229c02b653,https://newsatcl-pctr.c.yimg.jp/t/amd-img/20250916-90024038-nmit-000-1-thumb.jpg?exp=10800,2025-09-16T22:20:01+09:00,2025-09-16T22:20:01+09:00,岩手めんこいテレビ,nmit,岩手めんこいテレビ,1173,"岩手めんこいテレビ
2026年4月から交通違反に対して反則金を通告するいわゆる「青切符」による取り締まりが自転車にも適用されます。
取り締まりの強化を前に岩手県警は交通ルールを知ってもらおうと啓発動画を制作しました。

この動画は、交通違反に対して反則金の納付を通告する「青切符」制度が、2026年4月1日から自転車にも適用されるのを前に県警が作ったものです。

自転車の交通違反などを分かりやすく解説した20秒～30秒のものが18種類あります。

警察庁が9月に公開したルールブックによりますと、自転車の並走や2人乗りは反則金3000円、傘差し運転やイヤホンをつけて周りの音が聞こえない状態での運転は5000円、そしてスマートフォンを手に持って通話したり画面を注視したりする「ながらスマホ」には1万2000円が科せられます。

このほか信号無視や一時不停止など113種類の違反が定められていて、16歳以上の全ての人が取り締まりの対象です。

県内では2024年までの過去5年間に自転車事故で死傷した人は合わせて876人、このうち高校生が224人と最も多く全体の約4分の1を占めています。

県警 運転免許課　青木祟課長
「高校生が交通違反で検挙されたりしてほしくないし、交通事故に遭ってほしくないので、高校生や多くの人に見てもらえるものは何かということで動画を作ろうとなった」

8月4日、盛岡市青山の交通公園で行われた撮影には、県警交通部の職員約30人が集まりました。

監督もキャストも全て警察官が務め、歩行者の通行を妨げたり路側帯でベルを鳴らし続けたりと自転車の危険な行為を再現しながら撮影しました。

県警 交通機動隊　佐藤裕恵巡査長
「初めてやるものだったので緊張はしていたが、どの点が危ないのか、駄目なのかというのが皆さんに分かりやすく伝われば良いと思いながら演技した」

県警 交通企画課　田中慎也課長補佐
「なかなかカメラを回すというのは撮り慣れていないので難しかったが、いかに臨場感を出せるかというのを考えて撮影した」

取り締まり強化の背景には自転車が関係する事故の現状が挙げられます。

警察庁のまとめによりますと、全国の交通事故件数は減少傾向にあるものの、自転車が関わる事故は年間約7万件とほぼ横ばいで推移していて、全交通事故に占める割合は増えています。

県警 交通企画課　田中慎也課長補佐
「この動画を通して交通ルールを学んでもらうことで交通事故が1件でもなくなってほしいのと、交通違反によって青切符を切られる人が1人でも減ってほしい」

完成した動画は9月21日から始まる「秋の全国交通安全運動」に合わせて、県警のユーチューブやインスタグラム、県内各警察署の電子掲示板などで公開される予定です。
岩手めんこいテレビ",[],[]
鳥インフルエンザ…岩手・盛岡市と県北地域が対策強化地域に　国が2026年1月までに指定へ（岩手めんこいテレビ）,https://news.yahoo.co.jp/articles/5949eb7e66d38467e9330f5cfbbdc2566b37ae2a,https://newsatcl-pctr.c.yimg.jp/t/amd-img/20250916-90024040-nmit-000-1-thumb.jpg?exp=10800,2025-09-16T21:26:02+09:00,2025-09-16T21:26:02+09:00,岩手めんこいテレビ,nmit,岩手めんこいテレビ,547,"岩手めんこいテレビ
2025年1月から2月にかけて、高病原性鳥インフルエンザの発生が全国的に相次いだことを受けて、岩手県内では盛岡市と県北地域が、国の対策強化地域に指定される見通しとなりました。

9月16日は高病原性鳥インフルエンザへの対策を強化するための県の会議が開かれ、専門家や県養鶏協会の会員などが出席しました。

高病原性鳥インフルエンザは、2025年1月から2月にかけて14道県で51件相次いで発生していて、県内でも盛岡市と軽米町であわせて5件発生しました。

こうした状況を踏まえ、国は発生リスクの高いエリアを新たに対策を強化する地域に指定する方針で、16日の会議では盛岡市と、養鶏場が集中している県北地域が2026年1月までに指定される見通しであることが説明されました。

指定された地域では、ため池に野鳥が飛来しないよう糸を張り巡らすといった養鶏場の外での対策などが求められます。

県農林水産部　照井富也農政担当技監
「（養鶏場が）密集している地域だと（鳥インフルエンザが）発生しやすいので、農場だけでなく地域として発生しにくい対策を取ることが大事」

また16日は専門家が野生動物が侵入しないよう、鶏舎の周りにネットを設置することなどを呼びかけました。
岩手めんこいテレビ",[],[]
地価公示　岩手県内の住宅地マイナス0.2％、商業地マイナス0.9％　盛岡市では上昇（岩手めんこいテレビ）,https://news.yahoo.co.jp/articles/4a6d76e7cfe61050c805996ad86157020a776e3a,https://newsatcl-pctr.c.yimg.jp/t/amd-img/20250916-90024043-nmit-000-2-thumb.jpg?exp=10800,2025-09-16T21:06:01+09:00,2025-09-16T21:24:02+09:00,岩手めんこいテレビ,nmit,岩手めんこいテレビ,760,"岩手めんこいテレビ
土地取引の指標となる2025年の地価調査の結果が公表されました。
岩手県盛岡市の地価の平均は上昇していますが、県全体では住宅地が0.2％、商業地が0.9％、前の年から下落しました。

県は、2025年7月1日時点での県内各地の土地の価格を調査し9月16日に公表しました。

住宅地の県内の平均価格は、1平方メートル当たり2万6700円で、前の年から0.2％下がり、2年連続の下落となりました。

盛岡市の住宅地では平均変動率が前年比プラス2.2％となっていますが、調査に当たった不動産鑑定士によりますと、人口減少が進む沿岸部で下落が続いていることなどから、県全体では下落したということです。

齋藤優花記者
「きたぎんボールパーク近くのエリアは、住宅地では地価が最も上昇したということです」

周辺エリアの商業施設が充実している盛岡市永井では、前年から5.1％アップし、1平方メートルあたり6万4200円となりました。

また、住宅地の県内最高価格は、本宮3丁目の1平方メートルあたり10万7000円でした。

一方、商業地の県内の平均価格は、1平方メートルあたり4万5500円で、前の年から0.9％下がり、32年連続の下落となりました。

盛岡市単体でみると、前年比プラス1.09％となっていて、不動産鑑定士はインバウンドの需要増加を見越したホテルの建設などもあり、県全体の下落率には縮小傾向がみられるとしています。

商業地の県内最高価格は、盛岡駅前通で1平方メートルあたり30万7000円、前年からの上昇率も6.2％と、最も高くなりました。

また住宅地で最も下落率が高かったのは、大船渡市赤崎町鳥沢のマイナス4.9％で、山林火災による間接的な影響がみられるということです。
岩手めんこいテレビ",[],[]
岩手県の補正予算案を発表…クマ人身被害防止費用など　一般会計は13億円余り減額（岩手めんこいテレビ）,https://news.yahoo.co.jp/articles/6551267229ada410ae45afc7b002dbc36ede1147,https://newsatcl-pctr.c.yimg.jp/t/amd-img/20250916-90024034-nmit-000-1-thumb.jpg?exp=10800,2025-09-16T20:36:01+09:00,2025-09-16T20:36:01+09:00,岩手めんこいテレビ,nmit,岩手めんこいテレビ,521,"岩手めんこいテレビ
岩手県はクマによる人身被害の防止や高温・渇水対策の費用などを盛り込んだ補正予算案を発表しました。
一方で公共事業費のマイナスにより一般会計は13億円余りの減額となりました。

達増知事は9月16日の会見で2025年度の一般会計補正予算案を発表しました。

このうち9月1日の改正法の施行によりクマが市街地に出没した場合、市町村の判断で猟銃を使用できるようになった「緊急銃猟」について、ハンターの日当などの経費に500万円が計上されました。

達増知事
「（緊急銃猟を）やろうと思えばやれるようになっているので、そのとき金がないということにならないよう予算の確保ということでの補正予算」

また土地改良区の高温・渇水対策に要した経費の補助が新たに設けられ、これに3000万円が、ＩＣＴ機器の導入など業務効率化に取り組む医療機関への補助として5億600万円が計上されています。

一方で国からの補助金が県の想定より少なかったことから公共事業費35億円余りがマイナスとなり、一般会計は差し引き13億円余りを減額する補正予算案となりました。

補正予算案は9月25日に招集される県議会9月定例会に提出されます。
岩手めんこいテレビ",[],[]
盛岡八幡宮で流鏑馬奉納　盛岡秋まつり最終日　岩手県盛岡市（岩手めんこいテレビ）,https://news.yahoo.co.jp/articles/b83d5e75495e453b4f918efc74291bfb77222b6f,https://newsatcl-pctr.c.yimg.jp/t/amd-img/20250916-90024032-nmit-000-1-thumb.jpg?exp=10800,2025-09-16T20:32:01+09:00,2025-09-16T20:32:01+09:00,岩手めんこいテレビ,nmit,岩手めんこいテレビ,454,"岩手めんこいテレビ
盛岡秋まつり（岩手県盛岡市）最終日となった9月16日、盛岡八幡宮では祭りを締めくくる流鏑馬が奉納されました。
訪れた人たちはその勇壮な姿に見入っていました。

五穀豊穣や子孫繁栄を祈願し340年以上前から伝わる神事「南部流鏑馬」。
3人の射手奉行は長さ約400ｍの馬場で1人3回馬を走らせ、馬の上から合わせて9枚の的を射ます。

縦・横60ｃｍの的に向かって不安定な状態から次々に矢を放つと、介添え奉行が「よう射たりや～」と声をあげながら勢いよく駆け抜け褒めたたえました。

16日は射手奉行の櫻田功さんが9つ全ての的を射る「全的中」に成功し、会場からは歓声と大きな拍手が起こりました。

盛岡市から来た人
「皆さんすばらしい。全部当てるのも難しいけれで、当てている方もいらっしゃって」

千葉から来た人
「木の板（的）を割ったり当てたり、かっこよかった」
「（走るのが）早かった、新幹線くらい」

訪れた人たちは流鏑馬の勇しい姿に引き込まれるように見入っていました。
岩手めんこいテレビ",[],[]
北上市で「二子さといも」出発式　独特の深い味わいと強い粘り気が特徴　岩手県（岩手めんこいテレビ）,https://news.yahoo.co.jp/articles/0d19034a2a486cc3725d621620888e8ff7d54c3e,https://newsatcl-pctr.c.yimg.jp/t/amd-img/20250916-90024036-nmit-000-1-thumb.jpg?exp=10800,2025-09-16T20:30:01+09:00,2025-09-16T20:30:01+09:00,岩手めんこいテレビ,nmit,岩手めんこいテレビ,467,"岩手めんこいテレビ
岩手県北上市では特産の「二子さといも」の収穫が始まりました。
9月16日は生産者などが集まって出発式が開かれました。

北上市二子町を中心に生産されている「二子さといも」は、独特の深い味わいと強い粘り気が特徴です。

2025年も先週から収穫作業が始まり、16日は生産者やＪＡいわて花巻の関係者など約50人が集まって出発式が開かれ、テープカットをして出荷を祝いました。

ＪＡいわて花巻さといも専門部　鈴木賢二部長
「生産者も熱中症で倒れるかどうか心配しながらの作業だったので、無事に出発式を迎えてほっとしている」

2025年は7月以降の高温と乾燥の影響でやや小ぶりなものが多いものの、収穫の最盛期となる10月中旬には一回り大きくなる見込みということです。

さっそく芋の子汁を試食した北上市の八重樫浩文市長は、「農家さんは苦労されましたけれど、その苦労もあって2025年は特においしい」と話していました。

二子さといもの収穫は11月下旬まで続き、2025年は150トンを出荷する予定です。
岩手めんこいテレビ",[],[]
大船渡山林火災被害額が39億4200万円余りに　前回報告より12億5700万円ほど増加　岩手県まとめ（岩手めんこいテレビ）,https://news.yahoo.co.jp/articles/efa173c906b459e391244861130396cdb1d19e8e,https://newsatcl-pctr.c.yimg.jp/t/amd-img/20250916-90024042-nmit-000-2-view.jpg?exp=10800,2025-09-16T19:35:01+09:00,2025-09-16T20:41:02+09:00,岩手めんこいテレビ,nmit,岩手めんこいテレビ,504,"岩手県の復旧・復興推進本部会議（9月16日）
2025年2月に発生した岩手県大船渡市の山林火災について、県庁では9月16日、復旧・復興推進本部の会議が開かれ、県のまとめた被害額が39億4200万円余りに上ったことが報告されました。

16日に行われた復旧・復興推進本部の会議には、達増知事ら約20人が出席しました。

会議では、2025年2月に発生した大船渡市の大規模な山林火災の被害額が、8月22日時点で39億4200万円余りに上ったと報告されました。

前回の6月の会議で報告された被害額から12億5700万円ほどの増加です。

報告によりますと、下草や木が焼け山の保水力が低下する「林地荒廃」のエリア10カ所分の被害額が約11億4700万円、林業機械への被害が約8900万円などが今回新たに加わったということです。

達増知事
「（森林再生には）ある程度時間はかかるが、協力や連携の体制をつくりながら進められれば良い。いろいろ工夫しながら進めていきましょう」

森林被害の詳細な規模については現在も調査中で、県は10月中に被害規模をまとめたいとしています。

（岩手めんこいテレビ）
岩手めんこいテレビ",[],[]
大谷翔平選手、ＨＲ王ライバルのチームと対戦　シュワーバー選手53号で4本差に（岩手めんこいテレビ）,https://news.yahoo.co.jp/articles/4cfa966db713e1a0a8b03de168908dd1823bf54e,https://newsatcl-pctr.c.yimg.jp/t/amd-img/20250916-90024037-nmit-000-1-view.jpg?exp=10800,2025-09-16T17:01:01+09:00,2025-09-16T17:01:01+09:00,岩手めんこいテレビ,nmit,岩手めんこいテレビ,421,"岩手県奥州市出身でドジャースの大谷翔平選手は、日本時間9月16日、ホームラン王を争っているシュワーバー選手が所属するフィリーズと対戦しました。
注目の中、どちらのバットからも快音が響きました。

ナ・リーグのホームランランキングで大谷選手は2位。（16日時点）
3本差でトップを走っているのがフィリーズのシュワーバー選手です。

注目の対決、先にバットが火を吹いたのはシュワーバー選手でした。
第1打席、変化球を右中間スタンドに運び第53号ホームラン。その差を4本に広げられます。

対して大谷選手は5回の第3打席、ライト線へ弾き返すツーベースヒットでチャンスを広げ、チームの得点につなげました。

16日は2つのフォアボールを選んだ大谷選手。
ホームランこそ出ませんでしたが、シーズン最長の20試合連続出塁を記録し好調をキープしています。

試合結果：ドジャース 5－6 フィリーズ※延長10回

（岩手めんこいテレビ）
岩手めんこいテレビ",[],[]
「山車大絵巻パレード」豪華絢爛な風流山車が繁華街練り歩く　盛岡秋まつり　岩手県盛岡市（岩手めんこいテレビ）,https://news.yahoo.co.jp/articles/1d2aea8592a22d33a8790acb372b9a0142869cc1,https://newsatcl-pctr.c.yimg.jp/t/amd-img/20250916-90024029-nmit-000-1-thumb.jpg?exp=10800,2025-09-16T12:51:02+09:00,2025-09-16T12:51:02+09:00,岩手めんこいテレビ,nmit,岩手めんこいテレビ,421,"岩手めんこいテレビ
岩手県盛岡市に秋の訪れを告げる「盛岡秋まつり」、9月15日は風流山車が一堂に繁華街を練り歩くパレードが行われ多くの人でにぎわいました。

岩谷凜アナウンサー
「太鼓や笛の音色とともに先頭・お組の山車が今やってきました。ライトアップされた山車は盛岡の夜を明るく彩ります」

豪華絢爛な風流山車が盛岡市の繁華街を回る「山車大絵巻パレード」、15日は歌舞伎や歴史の名場面などを再現した7台の山車が内丸から大通まで約600メートルを練り歩きました。

このうち240年余りの歴史を持つ「一番組」の山車は、平安時代の「壇ノ浦の戦い」で平知盛が碇を掲げる場面を再現しました。

訪れた人
「盛大。盛岡市民や岩手県民、みんなの気持ちが高まる」

参加者
「楽しいことしかない。みんなで一緒になって10日間練習して」

威勢のよい掛け声が響くパレードを見ようと沿道には多くの人が訪れ盛岡の街はにぎわいを見せていました。
岩手めんこいテレビ",[],[]
クマに“馬乗り”で襲われる、渓流釣りの男性けが　2頭の子グマ連れた親グマ　クマの腹を蹴って抵抗　岩手県雫石町　　（岩手めんこいテレビ）,https://news.yahoo.co.jp/articles/fa44d1a5afad9c01d2aaf50a8e0d740ef9eb9614,https://newsatcl-pctr.c.yimg.jp/t/amd-img/20250916-90024030-nmit-000-1-thumb.jpg?exp=10800,2025-09-16T12:25:02+09:00,2025-09-16T12:25:02+09:00,岩手めんこいテレビ,nmit,岩手めんこいテレビ,425,"岩手めんこいテレビ
9月15日午後、岩手県雫石町の葛根田川で渓流釣りをしていた56歳の男性がクマに襲われ、けがをしました。

増子智絵美記者
「雫石町を流れる川です。男性はこの川で釣りをしていたところクマに襲われたということです」

15日午後2時20分ごろ、雫石町西根の葛根田川で、盛岡市の56歳の男性が1人で渓流釣りをしていたところ、2頭の子グマを連れた親グマに襲われました。

警察によりますと、男性は親グマに馬乗りの状態で襲われたためクマの腹を蹴って抵抗したところ、3頭とも近くのやぶの中に逃げていったということです。

男性は顔や頭などを引っかかれてけがをしましたが、自力で親族に助けを求めて病院で治療を受けました。
命に別条はないということです。

現場は雫石町役場から北に5キロほどの住宅が点在する地域です。

警察は渓流釣りをする際は、没頭しすぎず周りに注意を払うことや複数人で出かけるよう注意を呼びかけています。
岩手めんこいテレビ",[],[]
「イシツブテ公園」がある道の駅　イカ1杯がドン！と入ったインパクト抜群ラーメンも話題　久慈地域の魅力発信する観光拠点　岩手県（岩手めんこいテレビ）,https://news.yahoo.co.jp/articles/e76d448ba90fa493c17e578d6075f7a46c7dd4e8,https://newsatcl-pctr.c.yimg.jp/t/amd-img/20250916-90023905-nmit-000-1-thumb.jpg?exp=10800,2025-09-16T11:30:01+09:00,2025-09-16T11:30:01+09:00,岩手めんこいテレビ,nmit,岩手めんこいテレビ,871,"岩手めんこいテレビ
三陸沿岸道路・久慈北インターチェンジを降りてすぐの場所にある「道の駅いわて北三陸」。
岩手県の久慈市・洋野町・野田村・普代村の4市町村が連携し、久慈地域の魅力を発信する観光拠点として注目を集めています。

建物の壁には各市町村ごとにおすすめの観光コースが掲示されており、訪れた人が地域の情報を手軽に知ることができます。

館内はキッズスペースが充実していて、6歳〜12歳向けの高さ5メートルの滑り台が迫力満点。さらに、3歳〜6歳向けの遊具もあり、年齢に応じた遊びが楽しめます。

屋外には、岩手県を応援するポケモンのキャラクター「イシツブテ」をテーマにした「イシツブテ公園」があり、様々な遊具で遊べる空間が広がっています。

赤ちゃん連れの家族に配慮した設備も充実。おむつ替え台や個室の授乳室（鍵付き）、粉ミルク用のお湯の提供スペースなど、安心して利用できる環境が整っています。

久慈地域は、太古の樹木の樹脂が化石化した「琥珀」の産地です。物販コーナーでは、琥珀を使ったアクセサリーをはじめ、北三陸の特産品が豊富に並びます。

地元・久慈市産のシイタケとタマネギを使ったスープは、おみやげとしても人気の高い商品です。

鮮魚コーナーでは、沿岸ならではの新鮮な海の幸が並びます。成長とともに呼び名が変わるブリの幼魚は、地域によって異なりますが、県内では「ショッコ」と呼ばれています。

飲食コーナーには3つの店舗があり、それぞれ北三陸ならではの味を楽しめます。

「北三陸にしやま食堂」は、久慈育ちの琥珀サーモンや洋野町沖でとれたサバを使った贅沢な海鮮丼がおすすめです。

「麺屋まるほ」は、イカが丸ごと1杯入った北三陸海鮮ラーメンはインパクト抜群です。

「スタンドーナツ」では、久慈産小麦をブレンドしたドーナツや、黒豆きな粉を使ったご当地ソフトが味わえます。

キッズメニューも揃っており、子どもから大人まで楽しめる「道の駅いわて北三陸」。観光の拠点として、地域の魅力を存分に味わえるスポットです。
岩手めんこいテレビ",[],[]
