headline,mainEntityOfPage,image,datePublished,dateModified,author,media_en,media_jp,str_count,body,images,external_links
1パック「500円」の「長尺トイレットペーパー」は経済的？ 「普通のトイレットペーパー」との違いは？（ファイナンシャルフィールド）,https://news.yahoo.co.jp/articles/aa419fd9624ffea6d1526747587725212020887e,https://newsatcl-pctr.c.yimg.jp/t/amd-img/20250328-00010049-ffield-000-1-view.jpg?exp=10800,2025-03-28T20:00:03+09:00,2025-03-28T20:00:03+09:00,ファイナンシャルフィールド,ffield,ファイナンシャルフィールド,1414,"1パック「500円」の「長尺トイレットペーパー」は経済的？ 「普通のトイレットペーパー」との違いは？
長尺トイレットペーパーについて、どのような特徴があるのか気になっている方もいるでしょう。長尺トイレットペーパーを活用することで、家事の負担を軽減し、収納スペースを削減できる可能性があります。
 
今回は、長尺トイレットペーパーについて解説します。トイレットペーパーを選ぶ際に、本記事の内容をお役立てください。
▼節約のためにトイレを「3回に1回」だけ流すのは危険!  節約効果とデメリットを解説
長尺トイレットペーパーの特徴は？
長尺トイレットペーパーは、通常の製品よりも巻き数が多いトイレットペーパーを指すようです。
 
長いものだと1ロール300メートルのものもあるようで、この仕様により、取り換えの頻度が少なくなり、家事の負担を軽減できる可能性があるといわれています。
 
また、芯なしのタイプのものを選べば、ごみの削減にもつなげられ、清掃を効率化できる可能性があります。
通常のトイレットペーパーと長尺トイレットペーパーの費用比較
通常の長さと長尺のトイレットペーパーの、1メートルあたりの費用を比較していきましょう。以下の表1は、とある90メートルのタイプ8ロールの価格と、とある200メートルのタイプ4ロールの価格を比べたものです。
 
表1
表1
※筆者作成
 
価格はいずれも同じですが、200メートルタイプは1メートルあたりの価格が0.63円となり、90メートルタイプの0.7円よりも0.07円お得です。そのため、コストパフォーマンスを重視する場合は、巻き数が多いタイプを検討するとよい可能性があることが分かります。
 
なお、表1の金額はあくまで一例です。金額差はメーカーによって異なる場合があるのであくまで参考程度にしてください。
長尺トイレットペーパーを使用する3つのメリット
ここからは、長尺トイレットペーパーを使用する、価格面以外のメリットについて解説します。
 
■保管スペースを削減できる
50メートルのトイレットペーパー12ロール分は、300メートルの長尺トイレットペーパーにすると、2ロールで済みます。そのため、保管スペースが削減できる可能性があります。保管スペースを削減できることで、トイレの棚や収納スペースを有効活用することができるかもしれません。
 
■取り換える頻度を減らせる
長尺トイレットペーパーを使用すると、取り換える頻度を減らせる可能性があります。1ロールで使える期間が通常よりも長くなるため、取り換えるタイミングを遅らせることが期待されます。
長尺トイレットペーパーは通常よりも長く巻かれていて経済的
今回は長尺トイレットペーパーについて解説しました。長尺トイレットペーパーは、巻きの長さが通常の製品よりも長い点が特徴です。また、1メートルあたりの価格に換算すると、巻き数が多いタイプの方が安い傾向にあるようです。
 
また、長尺トイレットペーパーを使うことで、取り換え頻度の軽減やコストパフォーマンスの向上、さらには保管スペースの削減につながる可能性があります。買い物の手間などを減らすためにも、長尺トイレットペーパーの導入を検討してみてはいかがでしょうか。
 
執筆者：FINANCIAL FIELD編集部
ファイナンシャルプランナー
ファイナンシャルフィールド編集部",[],[]
野菜をゆでるなら「電子レンジ」と「ガス」、どちらが「節約」になる？（ファイナンシャルフィールド）,https://news.yahoo.co.jp/articles/8b345ace26a1fbfe741257fc31ac034b69cfaec8,https://newsatcl-pctr.c.yimg.jp/t/amd-img/20250328-00010048-ffield-000-1-view.jpg?exp=10800,2025-03-28T19:50:28+09:00,2025-03-28T19:50:28+09:00,ファイナンシャルフィールド,ffield,ファイナンシャルフィールド,1871,"野菜をゆでるなら「電子レンジ」と「ガス」、どちらが「節約」になる？
野菜をゆでる際に「電子レンジ」と「ガスコンロ」のどちらが節約につながるのか、気になる方もいるでしょう。電子レンジは短時間で済み、ガスコンロは一度に多くの量をゆでられるという特徴がありますが、光熱費はどちらがお得なのか気になるところです。
 
そこでこの記事では、電子レンジとガスの光熱費を比較し、節約しながら上手に野菜を調理する方法を解説します。光熱費を少しでもおさえてスムーズに調理したい方は、参考にしてください。
▼「エアコン」の電気代と、灯油ストーブの「灯油代」は1ヶ月でいくらかかる？ それぞれの費用を試算
電子レンジ調理とガス調理の光熱費を比較
野菜の下ごしらえをする際、電子レンジとガス調理では光熱費にどのような違いがあるのか確認しましょう。
 
経済産業省資源エネルギー庁によると、1日1回調理した場合、電子レンジとガスコンロそれぞれにかかる光熱費は表1の通りです。
 
表1
表1
※経済産業省資源エネルギー庁「無理のない省エネ節約」を基に筆者作成
 
電子レンジとガスコンロを比較したところ、電子レンジ調理の方が年間約860円〜1000円節約できる可能性があることが分かりました。
電子レンジでの加熱と炊飯器の保温にかかる電気代を比較
炊飯器でご飯を保温する場合と電子レンジで加熱する場合では、どのくらい違いがあるのか確認してみましょう。
 
炊飯器で10時間保温した場合の消費電力は323ワットアワー、4時間だと224ワットアワーとして計算します。ご飯を保温せずに、電子レンジで3分加熱した場合の消費電力は、193ワットアワーです。
 
全国家庭電気製品公正取引協議会が示している電気料金目安単価「31円／キロワットアワー」を基に「消費電力量÷1000×31円」で計算した場合の電気代は以下の通りです。
 
・炊飯器で10時間保温：約10円
・炊飯器で4時間保温：約7円
・電子レンジで3分温め：約6円
 
ご飯を炊いたら炊飯器で保温するよりも、必要なときのみ電子レンジで温めた方が、1回当たり約1円〜4円の節約ができる可能性があることが分かりました。
 
ただし、使用する炊飯器や電子レンジによっては消費電力が異なる場合もあるため、あくまで目安としてください。
調理の下ごしらえに電子レンジを使用するメリット
電子レンジを用いて調理した場合のおもなメリットは、以下の通りです。
 
・節約につながる
・ビタミンCの損失を防げる
・時短につながる
・形がきれいに仕上がる
 
電子レンジを調理に活用すると節約につながる可能性があるほか、ビタミンCの損失をおさえられる傾向があるようです。また、調理の前に電子レンジで温めると時短につながるうえ、野菜の煮崩れを防げる可能性があります。
 
特に、煮込み料理に電子レンジを活用すると具材をきれいに保（たも）てるとされているため、仕上がりに差が出る場合があります。
電子レンジを用いた下ごしらえのポイント
電子レンジを用いた上手な野菜の下ごしらえは、以下の通りです。
 
・洗ったあとの水分を残す
・大きさをそろえる
・加熱中に向きを変えたり混ぜたりする
・あく抜きする
 
下ごしらえの際は、野菜を洗った後の水分を残し、厚みや大きさが同じ程度になるようにカットしましょう。加熱中に手を加えると、ムラなく温められると考えられています。あくが強い野菜の場合は、加熱後に水にさらしてあく抜きするとおいしく仕上がる可能性があります。
「電子レンジ」と「ガス」は「電子レンジ」の方が節約につながる
調理をする際に電子レンジとガスにかかる光熱費を比較したところ、電子レンジの方が年間約860円〜1000円の節約につながる可能性があることが分かりました。さらに、ご飯を炊いた後の炊飯器の保温機能と電子レンジを比較してみても、電子レンジの方が節約できる場合があるようです。
 
電子レンジを調理の下ごしらえに活用すると、節約につながる可能性があるだけでなく、ビタミンCの損失を防いだり時短になったりするなどのメリットがあるようです。調理する際は、電子レンジをうまく活用するとよいでしょう。 

出典
経済産業省資源エネルギー庁 無理のない省エネ節約
公益社団法人全国家庭電気製品公正取引協議会 よくある質問 Q&A
 
執筆者：FINANCIAL FIELD編集部
ファイナンシャルプランナー
ファイナンシャルフィールド編集部",[],[]
洗濯は「夜」派？ 「昼」派？ 「洗濯＋乾燥」の電気料金を比較（ファイナンシャルフィールド）,https://news.yahoo.co.jp/articles/768373214cb0085dba933c09a68bbf024ff89774,https://newsatcl-pctr.c.yimg.jp/t/amd-img/20250328-00010047-ffield-000-1-view.jpg?exp=10800,2025-03-28T19:40:30+09:00,2025-03-28T19:40:30+09:00,ファイナンシャルフィールド,ffield,ファイナンシャルフィールド,1965,"洗濯は「夜」派？ 「昼」派？ 「洗濯＋乾燥」の電気料金を比較
洗濯は「夜」にするべきか、「昼」にするべきか、迷う方もいるでしょう。電力会社には時間帯によって電気代が異なるプランもあるため、利用した場合どの程度お得になるのかも気になるところです。
 
そこでこの記事では、「洗濯＋乾燥」にかかる電気代と時間帯別の電気料金を解説します。さらに、夜に洗濯するメリットやデメリットもご紹介します。ぜひ参考にしてください。
▼節約のためにトイレを「3回に1回」だけ流すのは危険!  節約効果とデメリットを解説
「洗濯＋乾燥」の電気料金
洗濯と乾燥にかかる電気料金を見ていきましょう。電気料金の単価には公益社団法人全国家庭電気製品公正取引協議会が公表している目安単価31円／キロワットアワーを使い計算します。なお今回は、洗濯機と乾燥機の消費電力は約890ワットアワーと仮定します。
 
計算式は「890ワット÷1000×31円」です。
 
計算すると、1回当たりの洗濯から乾燥にかかる電気代は、約28円となりました。洗濯乾燥機を毎日使用した場合、1ヶ月当たり約840円、1年当たり約1万80円の電気代がかかる可能性があることが分かります。
時間帯別の電気料金
時間帯別の電気料金は、契約している電力会社やプラン内容によって異なります。ある電力会社の時間帯別の料金単価は、表1の通りです。
 
表1
表1
※筆者作成
 
電力会社の料金を確認したところ、夜の22時〜翌朝8時までの料金単価が最も安く14.59円だと分かりました。最も高いのは10時〜17時の時間帯で、夏季はさらに高くなるようです。
 
このことから、22時以降に洗濯すると11.44円〜18.98円の節約につながる可能性があるでしょう。1ヶ月に換算すると、約343円〜約569円、年間で約4116円〜約6828円の節約になる計算です。電気代を節約したい方は、22時以降に洗濯するとよいでしょう。
 
ただし、電力会社やプランによってはこの通りにならないため、注意が必要です。
夜に洗濯機をまわすメリットとデメリット
夜に洗濯機をまわすと、22時以降なら電気代が安くなる可能性があることが分かりました。ここからは、ほかにも夜に洗濯するメリットがあるのか、デメリットとあわせてご紹介します。

■夜に洗濯するメリット
夜に洗濯するメリットは、以下の通りです。
 
・外干しの際に環境による影響を受けない
・時間を有効に使える
・汚れたものをすぐ洗える
 
自宅に乾燥機がない方は夜に洗濯して外に干すと、紫外線や排気ガスなどの環境による影響を受けにくいと考えられます。また、家事や育児で日中忙しい方は、洗濯を夜にした方が時間に余裕ができるかもしれません。
 
さらに、夜に洗濯するとお風呂あがりに使ったタオルや着用した衣類をその日に洗えるため、雑菌が繁殖しにくい傾向にあります。
 
■夜に洗濯するデメリット
夜に洗濯すると、以下のようなデメリットがあります。
 
・騒音問題になる
・洗濯物が乾きにくい
・外に干すと虫や盗難の被害にあう可能性がある
 
夜に洗濯機をまわすと、住宅環境によっては騒音問題となる可能性があります。特に、マンションやアパートに住んでいる方は、近所トラブルにならないように注意が必要です。
 
また、夜は日中と比べて洗濯物が乾きにくい傾向があるため、乾燥機を使用しない家庭では暖房の近くに干すなどといった工夫が必要になることもあるでしょう。さらに、夜に洗濯物を外に干すと、虫がついたり盗難にあったりする可能性があるため注意が必要です。
洗濯は22時以降にした方が電気代がお得
洗濯は22時以降にすると、1ヶ月当たり約343円～約569円、年間で約4116円〜約6828円の節約につながる可能性があることが分かりました。ただし、契約している電力会社やプランによっては料金が異なるため注意が必要です。詳しい料金は、電力会社へ問い合わせてみてください。
 
夜に洗濯機をまわすと節約以外にも、紫外線や排気ガスの影響を受けにくかったり、日中の時間を有効に使えたりするなどのメリットを得られる可能性があります。夜に洗濯することで1日の汚れを当日落とせるのも、衣類やタオルを清潔に保（たも）てるメリットといえます。
 
デメリットは騒音問題や乾きにくい点、外干しによる虫や盗難のリスクなどです。乾きにくさや外干しの問題については、乾燥機を使用すれば解決できる可能性があるでしょう。
 
出典
公益社団法人全国家庭電気製品公正取引協議会　よくある質問 Q&A
 
執筆者：FINANCIAL FIELD編集部
ファイナンシャルプランナー
ファイナンシャルフィールド編集部",[],[]
突然の手術入院で「80万円」ほどの支払いに…。退院時に準備ができない場合はどうなるの？（ファイナンシャルフィールド）,https://news.yahoo.co.jp/articles/49ae4452654cc716e4661610ec019185443550f0,https://newsatcl-pctr.c.yimg.jp/t/amd-img/20250328-00010046-ffield-000-1-view.jpg?exp=10800,2025-03-28T19:30:31+09:00,2025-03-28T19:30:31+09:00,ファイナンシャルフィールド,ffield,ファイナンシャルフィールド,1416,"突然の手術入院で「80万円」ほどの支払いに…。退院時に準備ができない場合はどうなるの？
手術などで入院が長引くと、支払額が想像以上になることがあります。退院時に、請求額に驚いた経験のある人もいるかもしれません。
 
そこで今回は、退院時に支払額を準備できない場合の対処法をご紹介します。
▼「生活保護」の受給要件とは？ 親族への扶養照会は必須なの？
医療費の自己負担割合
医療費の支払いは、収入や年齢などによってその割合が異なります。表1は、厚生労働省の「医療費の一部負担（自己負担）割合について」を基に、年齢層別の医療費の自己負担割合をまとめたものです。
 
表1
表1
※厚生労働省「医療費の一部負担（自己負担）割合について」を基に筆者作成
 
例えば医療費が100万円だった場合、現役世代は3割負担のため30万円、70歳以上の一般・低所得者は2割負担のため20万円を、病院での会計時に支払うことになります。
高額療養費制度とは
入院した場合などは、いくら負担割合が3割だったとしても、窓口負担が高額になってしまうことがあるでしょう。そのような場合に利用できる制度が「高額療養費制度」だとされています。
 
「高額療養費制度」とは、自己負担が過剰にならないようにするための制度とされており、1日から末日までのひと月ごとの自己負担限度額を超えた金額に関しては、後日払い戻される仕組みとなっているようです。
 
詳しく知りたい場合は、加入している健康保険組合の窓口に問い合わせるとよいでしょう。
医療費の立て替えが難しいときの対処法
窓口負担の額を最初から「自己負担限度額まで」とする方法としては、次の2つが考えられます。
 
■限度額適用認定証を申請する
窓口負担自体の軽減策として「限度額適用認定証」を利用する方法があります。
 
まず、入院前に加入している医療保険から「限度額適用認定証」もしくは「限度額適用・標準負担額減額認定証」の交付を受けます。その後、認定証を医療機関窓口に提出することで自己負担限度額までの支払いにおさえられる制度とされています。
 
なお「限度額適用・標準負担額減額認定証」は、入院時の食事代が減額される認定証にもなっているようです。
 
■マイナ保険証を利用する
マイナ保険証を利用することでも、支払額をおさえられます。医療機関の窓口で、マイナ保険証をカードリーダーに読み込んだ際に「限度額情報の表示」に同意するのみで利用できるようです。
 
ただし、健康保険税の支払いを滞納している場合や、マイナ保険証を導入していない医療機関では利用できないため、注意が必要です。
入院費用の支払いが困難なときは限度額適用認定証の申請やマイナ保険証の利用で支払いを減額できる可能性がある
長期入院や手術などで医療費が高額になり、窓口負担の支払いが困難な場合、支払額を自己負担限度額までおさえる方法があります。
 
1つは、あらかじめ「限度額適用認定証」を加入している医療保険から交付してもらう方法、もう1つはマイナ保険証を利用する方法です。これらを利用することで、支払金額を大幅におさえられる可能性があるため、覚えておくとよいでしょう。
 
出典
厚生労働省 医療費の一部負担（自己負担）割合について
 
執筆者：FINANCIAL FIELD編集部
ファイナンシャルプランナー
ファイナンシャルフィールド編集部",[],[]
お金をかけずに「ペーパークラフト」に挑戦！ 「トイレットペーパーの芯」で作った「紙飛行機」は、市販のキットを買う場合と比べてどれだけ節約になる？（ファイナンシャルフィールド）,https://news.yahoo.co.jp/articles/6fc1b7cf5b73ba0ba1c9665a25162c4a89c5468e,https://newsatcl-pctr.c.yimg.jp/t/amd-img/20250328-00010045-ffield-000-1-view.jpg?exp=10800,2025-03-28T19:20:39+09:00,2025-03-28T19:20:39+09:00,ファイナンシャルフィールド,ffield,ファイナンシャルフィールド,1436,"お金をかけずに「ペーパークラフト」に挑戦！ 「トイレットペーパーの芯」で作った「紙飛行機」は、市販のキットを買う場合と比べてどれだけ節約になる？
普段は捨ててしまうトイレットペーパーの芯を素材にしたら、お金をかけずにペーパークラフトを楽しめることをご存じでしょうか。簡単な紙飛行機から、おしゃれなアート作品までさまざまなものが作れるようです。
 
この記事では、紙飛行機を作るにあたり、市販のキットや材料を購入する場合と比較して、どれだけ節約できるのか具体的な金額とともに解説します。
▼節約のためにトイレを「3回に1回」だけ流すのは危険!  節約効果とデメリットを解説
簡単！ トイレットペーパーの芯で作る紙飛行機
では、子どもも大人も楽しめる紙飛行機に挑戦してみましょう。トイレットペーパーの芯を使えば、普通の紙飛行機よりも丈夫で、少し変わった形の飛行機を作ることができるようです。
 
以下、基本的なつくり方の手順です。

1・トイレットペーパーの芯に、縦に切り込みを入れる（上下3cmほど残す）
2・切り込みの両端から、それぞれ垂直に切り込みを入れる（芯の中心より少し手前まで）
3・反対側も同様に切り込みを入れる
4・ペンで好きな模様を描いたり、色を塗ったりすれば完成

翼の形を変えたり、色紙を貼ったりすることで、オリジナルの飛行機を作ることができます。
節約効果はどれくらい？ 市販品と比較
トイレットペーパーの芯を使ったペーパークラフトは、材料費がほとんどかからないのが最大の魅力だと考えられます。では、実際に市販のペーパークラフトキットや材料を購入する場合と比べて、どれくらいの節約になるのでしょうか。

●ペーパークラフトキット：簡単なものでも数百円、複雑なものになると数千円するものもある。
●ペーパークラフト用素材（色画用紙、折り紙など）：100円ショップでも購入できるが、さまざまな色や種類をそろえようとすると、意外に費用がかさむこともある。
●ペーパークラフトの道具：のり・ハサミ・カッター・定規などは、家庭にあるもので代用できる場合が多いが、専用の道具をそろえようとすると、さらに費用がかかる。

一方、トイレットペーパーの芯を使ったペーパークラフトなら、基本的に必要なのはトイレットペーパーの芯と、家にある文房具（ハサミ・ペン・のりなど）だけです。もし色を塗りたい場合も、絵の具や色鉛筆、クレヨンなど、家にあるものが使えると考えられます。
 
例えば、紙飛行機を作る場合、市販のキットを購入すると1000円程度かかる場合があります。しかし、トイレットペーパーの芯を使えば、実質0円で作ることができるのです。
 
実は、フリマサイトには、工作用にトイレットペーパーの芯を出品している人がいます。ついつい熱が入って自宅のものだけではまかないきれない場合は購入もできるでしょう。
トイレットペーパーの芯でペーパークラフトを楽しもう
1000円程度で売られている市販のキットに比べれば、トイレットペーパーの芯を使ったペーパークラフトは、実質0円から始められる経済性と、子どもでも簡単につくれる手軽さが魅力だと考えられます。
 
ぜひ、これから使い終わるトイレットペーパーの芯を有効活用して、ペーパークラフトの世界を楽しんでみてください。
 
執筆者：FINANCIAL FIELD編集部
ファイナンシャルプランナー
ファイナンシャルフィールド編集部",[],[]
