headline,mainEntityOfPage,image,datePublished,dateModified,author,media_en,media_jp,str_count,body,images,external_links
「フライトナース」は「一般の病院の看護師」と年収は違う？どのような“資格”や“経験”が必要？（ファイナンシャルフィールド）,https://news.yahoo.co.jp/articles/8c08987c659094e72e40053841663004775907e6,https://newsatcl-pctr.c.yimg.jp/t/amd-img/20250328-00010037-ffield-000-1-view.jpg?exp=10800,2025-03-28T17:50:16+09:00,2025-03-28T17:50:16+09:00,ファイナンシャルフィールド,ffield,ファイナンシャルフィールド,2739,"「フライトナース」は「一般の病院の看護師」と年収は違う？どのような“資格”や“経験”が必要？
テレビドラマや映画で話題になったこともあり「フライトナースを目指したい」と考える人もいるようです。一般の看護師と比較して、年収や仕事内容にはどういった違いがあるのでしょうか。また、フライトナースになるために必要な資格や経験について知りたい人もいるでしょう。
 
そこで今回は、フライトナースの年収や必要な資格・経験について調べてみました。フライトナースの仕事内容もご紹介しますので、参考にしてください。
▼会社員で「年収1000万円」以上の割合は？ 大企業ほど高年収を目指せる？
フライトナースとは？ 一般の病院の看護師と年収は違う？
フライトナースは、ドクターヘリに搭乗して救急患者のもとへ駆けつけ、フライトドクターの治療をサポートしたり同伴する家族に寄り添って不安を和らげたりする任務を行います。患者を円滑に搬送するために、現場の消防・救急隊員やパイロットなどに協力を依頼する役割もあります。
 
認定NPO法人救急ヘリ病院ネットワーク HEM-Netによると、2024年2月時点でドクターヘリは全国47都道府県に57機が配備されているとのことです。フライトナースは、ドクターヘリが配備されている病院の救命救急センターに所属し出動要請に備えつつ、出動時以外では看護師の後方支援を行います。
 
厚生労働省の「令和5年賃金構造基本統計調査」を基に看護師の平均年収を算出すると以下の通りです。
 
・きまって支給する現金給与額：35万2100円
・年間賞与その他特別給与額：85万6500円
・年収換算：508万1700円
 
実際の年収は、勤務先や勤務年数などによって異なるでしょう。フライトナースの場合は、ドクターヘリを配備している大規模な病院に勤務することになり、さらに危険搭乗手当や特殊勤務手当などが発生して、看護師の平均よりは高くなることが考えられます。
 
一例として、フライトナース勤務のある求人を調べてみたところ、基本給は27万9000円～34万1200円（夜勤月4回と資格手当などを含む）に設定されていました。ボーナスは年に2回、それぞれ基本給2ヶ月分が支給されます。これを基に推定年収を算出すると、446万4000円～545万9200円です。
フライトナースになるために必要な資格や経験とは？
フライトナースになるには、ドクターヘリを配備する病院に看護師として勤務する必要があります。基本的に救命救急センターに所属している看護師から選ばれるようです。
 
厚生労働省の「ドクターヘリの安全な運用・運航のための基準」によると、フライトナースは以下のすべての要件を満たすことが望ましいとされています。
 
・救急医療の臨床経験と知識を有すること
・心肺蘇生法および外傷初期治療について十分な知識と技術を有していること
・ドクターヘリ事業従事者研修等を受講していること

また日本航空医療学会フライトナース委員会では、フライトナース選考基準を以下のように策定しているようです。
 
・看護師経験5年以上救急看護経験3年以上、または同等の能力が望ましい。リーダーシップがとれる
・ACLSプロバイダーおよびJPTECプロバイダー、もしくは同等の知識と技術を有している
・日本航空医療学会が主催するドクターヘリ講習会を受講している
 
これに加えて、勤務先の病院が定める選出基準を満たす必要があると考えられます。
フライトナースの仕事内容
とある病院では、フライトナースの1日を紹介しています。これを基にすると、仕事内容は大きく以下の2つに分けられるようです。
 
【フライトの準備と出動要請が来るまでにすること】
・救急処置に必要な物品の忘れがないよう、使用する薬品や医療器具をチェック
・ドクターヘリ内の電子機器に不具合がないか確認し、無線の音声チェック
・フライトドクターや操縦士などとともに、天候や運用時間などを情報共有
・ERで手伝いをしつつ、ドクターヘリの出動要請に備える

【フライトの要請が来てからの流れ】
・ドクターヘリの要請があると屋上ヘリポートへ移動し、数分以内に離陸
・機内で無線を使って基地病院より情報収集を行い、フライトドクターと打ち合わせて必要な物品を準備
・着陸したら救急隊と接触し、救急車内で患者の診察および救命処置を行う
・患者を収容して基地病院へ帰還し、行った処置、経過、バイタルなどを次の看護師へ申し送り
・機内の物品補充や洗浄を行い、次のフライトに備える
・使用した物品やバイタル、時間経過など、フライト記録をつける
・ドクターヘリの運用についてスタッフと共有し、問題点があれば次のフライトへ向けて改善
フライトナースの年収は危険搭乗手当や特殊勤務手当などで看護師の平均より高くなる可能性あり
フライトナースはドクターヘリに搭乗して、フライトドクターのサポートをしたり同伴する家族のケアをしたりします。厚生労働省のデータによれば看護師の平均年収は508万1700円ですが、フライトナースの場合は危険搭乗手当や特殊勤務手当などがついて、看護師の平均よりは高くなる可能性が考えられます。
 
フライトナース勤務のある求人を基に推定年収を算出したところ、446万4000円～545万9200円でした。実際の年収は、勤務先や本人の年齢、勤続年数などによって異なるでしょう。
 
フライトナースになるためには、ドクターヘリを配備している病院の救命救急センターに所属することが一般的です。「看護師経験5年以上救急看護経験3年以上」など選出基準を満たしたうえで、フライトナースに選ばれる必要があります。ドクターヘリを配備している病院が限られていることから、狭き門であるともいえるでしょう。
 
出典
政府統計の総合窓口（e－Stat） 厚生労働省 賃金構造基本統計調査／令和5年賃金構造基本統計調査 一般労働者 職種 表番号1 職種（小分類）別きまって支給する現金給与額、所定内給与額及び年間賞与その他特別給与額（産業計）
認定NPO法人 救急ヘリ病院ネットワーク HEM-Net ドクターヘリを知る 拠点
厚生労働省 ドクターヘリの安全な運用・運航のための基準 II. ドクターヘリにかかわる施設・設備、要員等の基準 5. 事業者が配置すべき医療要員（以下医療クルー）（8ページ）、資料3：フライトナースラダーについて（19ページ）
 
執筆者：FINANCIAL FIELD編集部
ファイナンシャルプランナー
ファイナンシャルフィールド編集部",[],[]
浄水ポットとペットボトルの水でかかるコストを1ヶ月比較したら、費用はどのくらい差が出る？（ファイナンシャルフィールド）,https://news.yahoo.co.jp/articles/fd91c2c474f462d945e9c390beb88d83b343dc2e,https://newsatcl-pctr.c.yimg.jp/t/amd-img/20250328-00010036-ffield-000-1-view.jpg?exp=10800,2025-03-28T17:40:25+09:00,2025-03-28T17:40:25+09:00,ファイナンシャルフィールド,ffield,ファイナンシャルフィールド,1732,"浄水ポットとペットボトルの水でかかるコストを1ヶ月比較したら、費用はどのくらい差が出る？
さまざまなものの物価高騰が続く中、日々の暮らしにかかる費用を少しでもおさえたいと考える方は多いでしょう。毎日の「飲み水」も例外ではありません。
 
そこで今回は、ペットボトルの水を購入し続けるのと浄水ポットを活用するのでは、1ヶ月にかかる費用にどれくらいの差が出るのかを検証します。浄水ポットの購入を検討している方はぜひ参考にしてください。
▼「シャワーだけ」vs「お湯をためる」1人暮らしはどっちがお得？ それぞれの水道代・ガス代を比較
浄水ポットとは？
浄水ポットとは、ポット（ピッチャー）の形をした浄水器です。使用方法は水を注ぐだけと簡単で、浄水ポットからそのままコップに注ぐことができます。
 
ポットの中にはカートリッジと呼ばれるフィルターが入っていて、ポットに水を注いでから水がろ過されるまでに数分程度かかることがあるようです。
 
浄水ポットのメリットとして、比較的手の届きやすい価格帯であること、手軽に使用できることなどがあげられます。一方でデメリットとしては、2～4ヶ月に一度程度カートリッジの交換が必要なことです。水をろ過するのに時間がかかること、一度に作れる浄水の量が限られていることもあげられます。
浄水ポットとペットボトルにかかる費用を比較してみた
では実際に、浄水ポットにかかる費用と、ペットボトルにかかる費用を比較していきましょう。

●4人家族で1日に飲む水の量：8リットル
●水道水1リットル当たりの料金：0.24円
●カートリッジ1個当たりの値段：1400円

上記の条件に当てはめた場合、浄水ポットに必要な費用は1ヶ月で約1458円です。
 
同じ条件でペットボトルを購入した場合、1ヶ月で2リットルのペットボトル120本が必要な計算です。1本当たりの金額を150円とした場合、1ヶ月に必要な費用は約1万8000円になります。
 
浄水ポットの本体を購入するのに5000円程度の初期費用がかかることもありますが、本体購入後のランニングコストで比べた場合、2リットルのペットボトルを購入するのと比べて1ヶ月で約1万6500円、1年で20万円近く節約できる可能性があることが分かりました。
浄水ポットの上手な選び方
浄水ポットを購入する際は次のようなポイントを意識するとよいでしょう。

●ランニングコスト
●注ぎやすさ、お手入れのしやすさ、水の入れやすさ
●ろ過するスピード

浄水ポットの購入を検討する際に注目すべきは、ランニングコストと使いやすさです。前述したように浄水ポットでは数ヶ月に一度カートリッジの交換が必要になります。具体的には「カートリッジ1個の価格÷総ろ過水量」で水1リットル当たりのコストが計算できるため、費用をおさえたい方はランニングコストの低い浄水ポットを選ぶようにしましょう。
 
持ち手がついたものや水の注ぎ口が広いものは使い勝手もよく、ろ過するスピードが速いものであれば料理などですぐに使用したい場合に便利です。
浄水ポットの方が1ヶ月にかかるコストを約1万6500円節約できる可能性がある
浄水器の一種である浄水ポットは、手軽に利用できることがメリットです。一方でデメリットとしては、定期的にカートリッジの交換が必要なこと、浄水ポットの種類によってはろ過するのに時間がかかること、一度に作れる浄水の量が限られていることなどがあげられます。
 
浄水ポットと2リットルのペットボトルで比較した場合、浄水ポットは初期費用が必要ですが、本体購入後、1ヶ月にかかる費用を約1万6500円節約できる可能性があること分かりました。
 
浄水ポットは容量や形状をはじめ、カートリッジの性能もさまざまです。ランニングコストはもちろん、注ぎやすさやお手入れのしやすさなどにも注目して選ぶとおいしい水を快適に楽しむことができます。目的に合った浄水ポットを選び、毎日の飲み水にかかる費用を上手に節約していきましょう。
 
執筆者：FINANCIAL FIELD編集部
ファイナンシャルプランナー
ファイナンシャルフィールド編集部",[],[]
駅前のスーパーではレジ袋が「1枚10円」！家の近くのスーパーでは「3円」なのに…お店側が勝手に料金を決めてよいの？（ファイナンシャルフィールド）,https://news.yahoo.co.jp/articles/9b907e4f74bb248ef356e8db1185ce74a630b907,https://newsatcl-pctr.c.yimg.jp/t/amd-img/20250328-00010035-ffield-000-1-view.jpg?exp=10800,2025-03-28T17:20:02+09:00,2025-03-28T17:20:02+09:00,ファイナンシャルフィールド,ffield,ファイナンシャルフィールド,1700,"駅前のスーパーではレジ袋が「1枚10円」！家の近くのスーパーでは「3円」なのに…お店側が勝手に料金を決めてよいの？
令和2年7月より、プラスチック製のレジ袋が有料化となりました。これにより、スーパーでの買い物時に袋が必要な場合は、別途購入しなければなりません。なかには、レジ袋の値段がスーパーによって異なる点に疑問を感じる方もいるでしょう。
 
そこで今回は、スーパーのレジ袋の値段設定について解説します。スーパーのレジ袋の値段設定が気になっている方や、レジ袋を毎回購入するのとエコバックエコバッグを購入するのとでは、どちらがお得なのかを知りたい方は、ぜひ参考にしてください。
▼セルフレジになったら「客に仕事をさせるのか！」と暴言を吐かれた！ 仕事だし我慢するしかないの？
レジ袋有料化の制度概要
経済産業省により令和2年（2020年）7月1日より、レジ袋の有料化がスタートしました。背景には、ゴミ問題や地球温暖化などがあります。有料化によって本当にレジ袋が必要かを考え、ライフスタイルの見直しを図ることが目的です。
 
原則、プラスチック製のレジ袋すべてが対象ですが、一部例外もあります。例外となるのは以下の3種類です。
 
・プラスチックフィルムの厚さが50マイクロメートル以上のもの
　→繰り返し使用でき、プラスチック製レジ袋の使用削減につながるため
 
・海洋生分解性プラスチックの配合率が100％のもの
　→微生物によって海洋で分解され、海洋プラスチックごみ問題対策になるため
 
・バイオマス素材の配合率が25％以上のもの
　→植物由来がC02総量を変えず、地球温暖化対策につながるため
 
この3種類以外の持ち手の付いたプラスチック製レジ袋は、原則有料化の対象です。また、プラスチック製のレジ袋には、使用されている材料の表示化が求められています。
レジ袋は誰が価格を決められるの？
レジ袋の価格設定は、事業者が設定しています。1枚あたりの価格が、1円未満にならないようにする、という規則があるだけです。経済産業省の制度概要を紹介するページにて、有料化の価格設定におけるガイドラインが掲載されています。
 
袋のサイズによって値段設定を変えている場合が多く、それぞれ大サイズ1枚5円、小サイズ1枚3円といった形です。
 
レジ袋の代金はお店の売り上げとなり、レジ袋の代金の一部が環境保護に使用されるといった環境税的な意味合いはありません。そのため、消費者の理解促進の観点から、使用用途について事業者からの自主的な情報発信を推奨しています。
レジ袋を買い続ける費用とエコバッグ購入にかかる費用
レジ袋購入にかかる費用を考えてみましょう。レジ袋の代金は大サイズ1枚5円と仮定します。週3回、毎回大サイズ1枚購入した場合にかかる費用は1ヶ月で60円、年間では720円です。小サイズであれば1ヶ月36円、年間432円です。
 
エコバッグは100円ショップでも購入可能です。値段帯は100円台から500円台まで幅広く、サイズも豊富にそろっています。10リットルサイズのものであれば110円（税込み）から購入可能です。
 
レジ袋を購入する場合と比較すると、110円（税込み）のエコバッグであれば2～3ヶ月で元は取れます。330円（税込み）の物であっても、約半年〜1年間で費用が回収できます。
有料レジ袋の値段設定はお店側に決定権がある
令和2年7月より開始されたプラスチック製レジ袋の有料化ですが、値段はお店が自由に設定できます。ゴミ問題や地球温暖化問題対策だけでなく、ライフスタイルの見直しを背景に実施された制度です。
 
経済産業省は、有料レジ袋の売り上げについて、使用用途の自主的な情報発信を推進しています。売り上げをどのように使用しているかを調べてみると、環境問題への意識やライフスタイルの見直しにつながるかもしれません。
 
出典
経済産業省　レジ袋削減にご協力ください！
 
執筆者：FINANCIAL FIELD編集部
ファイナンシャルプランナー
ファイナンシャルフィールド編集部",[],[]
口座開設しようとネットを見たらしばらく先まで埋まっていた…“予約なし”でも当日口座を作ることはできないの？（ファイナンシャルフィールド）,https://news.yahoo.co.jp/articles/c2fdad01a68a0fcf73722f67d3d7821fbaf54c62,https://newsatcl-pctr.c.yimg.jp/t/amd-img/20250328-00010034-ffield-000-1-view.jpg?exp=10800,2025-03-28T15:10:52+09:00,2025-03-28T15:10:52+09:00,ファイナンシャルフィールド,ffield,ファイナンシャルフィールド,1698,"口座開設しようとネットを見たらしばらく先まで埋まっていた…“予約なし”でも当日口座を作ることはできないの？
金融機関で口座開設をしたいときなど、あらかじめ来店予約を入れておくことでスムーズに手続きが可能になると考えられます。
 
しかし、オンライン予約をしようとしたが空きがなく、しばらく待たなければ予約を入れられそうにないときもあるでしょう。
 
本記事では、口座開設のために来店予約をするメリットや予約が埋まっている場合の対策とともに、当日の口座開設の流れについてもご紹介します。
▼タンス預金していた現金を銀行に預ける場合、「税金」の支払いは発生するの？
口座開設のために来店予約をするメリット
口座開設の手続きなどをするために金融機関に来店した際、「窓口が混雑していて長時間待たされた」という経験がある人もいるでしょう。
 
金融機関によっては事前に来店予約ができるようになっており、待ち時間の短縮が可能な場合もあります。来店予約はインターネットで24時間受け付けている金融機関もあるため、思い立ったときに予約できることもメリットでしょう。
 
事前に予約をしていなくても対応可能な金融機関もありますが、予約をしている人が優先されるため、混雑状況によってはその日のうちに手続きができない可能性もあります。「仕事が忙しいのですき間時間を利用して口座開設の手続きをしたい」「小さな子ども連れで長時間待つのはつらい」などの事情がある人も、来店予約をしておけば安心でしょう。
当日の口座開設の流れ
窓口で口座開設の手続きを行う場合の流れは金融機関によるため、事前にホームページなどで確認しておくといいでしょう。金融機関によっては口座開設の手続きができる店舗とそうでない店舗があるので、営業時間とあわせて確認が必要です。
 
店頭での窓口開設手続きには、以下のどちらかの書類が必要になることがあります。

●顔写真付きの公的書類（運転免許証・パスポート・個人番号カードなど）：1種類
●顔写真のない公的書類（健康保険証・年金手帳・母子健康手帳など）：2種類

店舗によっては手続きに30分以上かかる場合もあるようなので、時間に余裕をもっておくといいでしょう。
予約が埋まっている場合の対策
口座開設のためにオンライン予約をしようとしたところ、予約が埋まっていて希望の日時を指定できない場合もあるでしょう。
 
口座開設であれば、窓口へ行かなくても利用者自身がアプリを使って手続きすることが可能なケースもあります。自宅にいながら口座を開設できるので、チェックしてみることをおすすめします。ある金融機関では、以下のような手順でアプリでの口座開設の手続きが可能です。

●マイナンバーカード、運転免許証、パスポートなどの本人確認書類と、SMS利用可能なスマートフォンとメールアドレスを用意しておく
●専用アプリをダウンロードし、申し込みをする
●本人確認書類を撮影してアップロードする
●口座番号が通知される

口座番号が通知されるまでの期間については、本人確認書類の提出方法によって異なる場合もあるようです。マイナンバーカードを読み取った場合は最速で当日のうちに口座番号が通知される可能性があります。
来店予約なしでも口座開設が可能な金融機関もある｜アプリで自宅から手続きすることも可能
金融機関の窓口は混雑していることがあるため、事前に来店予約をしておくとスムーズに手続きができて安心です。
 
しかし、オンライン予約をしようとしても空きがなく、しばらく先まで予約できないこともあるでしょう。予約なしで当日手続き可能な金融機関もありますが、待ち時間が長くなる可能性があるため、アプリで口座開設ができないか確認してみることをおすすめします。
 
アプリを利用すれば自宅から手続きすることも可能なので、金融機関へ直接足を運ぶ必要はありません。必要書類や手順を確認してみることをおすすめします。
 
執筆者：FINANCIAL FIELD編集部
ファイナンシャルプランナー
ファイナンシャルフィールド編集部",[],[]
