headline,mainEntityOfPage,image,datePublished,dateModified,author,media_en,media_jp,str_count,body,images,external_links
結婚すると「住民税」はどのように変化する？ 「配偶者特別控除」について解説（ファイナンシャルフィールド）,https://news.yahoo.co.jp/articles/23a5679f03405abe4743a4044c81f56cf7b7a955,https://newsatcl-pctr.c.yimg.jp/t/amd-img/20250328-00010014-ffield-000-1-view.jpg?exp=10800,2025-03-28T10:00:24+09:00,2025-03-28T10:00:24+09:00,ファイナンシャルフィールド,ffield,ファイナンシャルフィールド,1825,"結婚すると「住民税」はどのように変化する？ 「配偶者特別控除」について解説
結婚といえば、人生の大きな節目ですが、実は税金にも影響が及びます。住民税は、夫婦の働き方や収入状況によって大きく変わるため、注意が必要です。
 
この記事では、結婚によって住民税がどのように変化するのか、また「配偶者特別控除」という制度について解説します。
▼会社員で「年収1000万円」以上の割合は？ 大企業ほど高年収を目指せる？
結婚で変わる住民税
結婚後の住民税は、夫婦の所得を合算して計算されるわけではなく、それぞれの所得に基づいて個別に課税されます。ただし、配偶者控除や配偶者特別控除が適用されることで、世帯全体の税負担が軽減される可能性はあります。
 
例えば、夫の年収が500万円、妻の年収が100万円の場合は、配偶者特別控除の対象です。夫は38万円の控除が受けられるので、課税所得金額が減少した夫の所得税と住民税は軽減します。もし、妻の年収が48万円以下であれば、配偶者控除が適用されるため、夫の税負担はさらに軽減します。
 
しかし、共働きで夫婦ともに収入が多い場合は、控除の対象外となるため、それぞれに所得に基づいた住民税が課されます。住民税は前年の所得で計算されるため、結婚翌年から税額が変わる点に注意が必要です。また、年の途中で結婚した場合は、翌年の住民税に影響が出ます。
配偶者特別控除とは
配偶者特別控除とは、配偶者の所得に応じて、納税者本人の所得から一定額を控除できる制度です。この制度は、配偶者に48万円を超えていて「配偶者控除」の対象とならない場合でも一定の条件を満たせば適用されます。
 
控除額は、納税者の合計所得金額と配偶者の合計所得金額によって変動します。例えば、納税者本人の合計所得金額が900万円以下で、配偶者の合計所得金額が95万円以下であった場合は、最大38万円の控除を受けられるのです。
配偶者特別控除の適用条件
配偶者特別控除を受けるためには、さまざまな条件を満たす必要があります。まず、控除を受ける本人のその年の合計所得金額が1000万円以下でなければなりません。
 
また、配偶者についても、民法上の婚姻関係にある人が対象であり、内縁関係にある人は対象外です。さらに控除を受ける人と生計を共にしていることも条件のひとつです。
 
加えて、配偶者がその年に青色申告者の事業専従者として給与を受け取っていない、または白色申告者の事業専従者ではないことも要件に含まれます。配偶者が給与所得者の扶養控除等申告書や従たる給与に関する扶養控除等申告書に記載された源泉控除対象配偶者として、源泉徴収されていないことも必要です。
 
さらに、配偶者が公的年金等を受給している場合、その扶養親族等申告書に記載された源泉控除対象配偶者として、源泉徴収されていないことも求められます。このように、配偶者特別控除を受けるためには、納税者本人と配偶者の双方が複数の要件を満たしていることが必要です。
夫婦の収入で変わる、税制上のメリット
夫婦の収入状況によって、税制上の優遇措置は大きく異なります。夫婦の収入が一定の条件を満たしていれば、配偶者控除や配偶者特別控除の対象です。
 
一方、共働きで夫婦ともに収入が多い場合は、配偶者控除や配偶者特別控除の対象外です。しかし、夫婦それぞれが生命保険料や地震保険料、医療費などの所得控除を受けることで、税負担は軽減できます。また、住宅ローン控除も夫婦それぞれで利用できる場合があります。
 
ただし、配偶者控除や配偶者特別控除は、納税者本人の合計所得金額が1000万円を超えると適用されません。また、配偶者の働き方や収入状況が変化した場合、適用される控除も変わる可能性があるため注意しましょう。
結婚後の住民税は賢く対策しよう
結婚は、住民税に影響を与える大きなライフイベントです。夫婦の働き方や収入状況によって、適用される税制上の措置は異なり、住民税の金額も変動します。
 
配偶者控除や配偶者特別控除、各種所得控除など、利用できる制度を正しく理解し、夫婦の収入バランスに合わせた対策を行いましょう。

出典
国税庁 No.1192 配偶者控除
国税庁 No.1195 配偶者特別控除
 
執筆者：FINANCIAL FIELD編集部
ファイナンシャルプランナー
ファイナンシャルフィールド編集部",[],[]
小学校の教員なら「部活動の顧問」はやらなくていい？ 業務内容を解説（ファイナンシャルフィールド）,https://news.yahoo.co.jp/articles/54f4ad50d5f2318d9f8479d912e21d1da5e5e143,https://newsatcl-pctr.c.yimg.jp/t/amd-img/20250328-00010013-ffield-000-1-view.jpg?exp=10800,2025-03-28T09:50:07+09:00,2025-03-28T09:50:07+09:00,ファイナンシャルフィールド,ffield,ファイナンシャルフィールド,1915,"小学校の教員なら「部活動の顧問」はやらなくていい？ 業務内容を解説
文部科学省は、小学校を始め中学・高校の教員に対して、健康上の配慮を踏まえて労働負担を軽減する取り組みを推進しています。
▼「公務員は安定している」って本当？ 定年退職の割合や退職金の平均額を教えて！
今回は、小学校教員の業務内容や部活動・クラブ活動に関わる業務負担、地域クラブ活動に従事した際の報酬などを紹介します。
小学校教員の業務内容
小学校の教員の仕事は、学級担任として配属され、「国語、社会、算数、理科、生活、音楽、図画工作、家庭、体育、道徳、英語、特別活動、総合的な学習」において、児童の成長に応じた学習計画を立てて指導することです。
 
また、学校行事の運営やPTAとの連携、学校運営に関する事務なども含まれます。さらに、クラブ活動、給食や清掃の指導、いじめや不登校に関する問題への対応など、学習指導以外に学校生活全般に関わる業務を行います。
小学校教員の勤務時間
文部科学省「教員勤務実態調査（令和4年度）速報値について」によると、全ての職種において長時間勤務をしている教員が多いことが分かっています。小学校教員の1日あたりの平均在校時間は、校長「10時間23分」、副校長・教頭「11時間45分」、教諭「10時間45分」です。
 
さらに、土日は、約30分〜1時間の在校時間を要しています。夏季休業期間における勤務状況は、長期休業8月の平日（20日間）のうち、勤務した日数は「5. 6日」、在校時間は約「8〜9時間」です。
 
また、部活動に関わる時間については、一般的な小学校教員は「部活動の顧問」を担当する必要がないため、中学校や高校のように部活顧問としての業務負担はありません。
 
もっとも、小学校の教員の職務には勤務時間内に組み込まれた授業の一環として「クラブ活動」の指導があります。文部科学省の小学校学習指導要領には、小学校4年生以上の児童を対象にした、学年や学級を超えた集団によるクラブ活動が規定されています。
運動部活動の地域移行
文部科学省は、2022年「運動部活動の地域移行」の方針を公表し、学校内の運動部活動を地域のスポーツクラブでの活動に移行することを推進しています。
 
運動部活動を地域に移行する目的としては、休日出勤など多忙な勤務体制、長時間労働の改善、指導経験のない教師への負担軽減が挙げられています。
地域クラブ活動の報酬
公立学校の教員が地域のクラブ活動に関わる場合は、教育委員会による兼職・兼業の許可が必要です。クラブ活動には、健康への配慮と労働時間の基準の遵守、公立学校の教員の給与や勤務条件を定めた給特法が適用されることから、教育委員会の役割が重要とされています。
 
具体的な労働時間の合計（学校の労働時間＋地域団体の業務時間）は、単月100時間未満、複数月平均80時間以内です。地域クラブ活動での報酬は、運営団体・実施主体との契約内容に基づいて支給され、最低賃金を遵守するなどの一般的な労働法規に則ったものとなっています。
 
例えば、神奈川県大磯町では、休日の部活動指導を希望する公立の教員に対して、時給2000円、最長3時間で6000円の報酬を支給する取り組みを行っています。なお、具体的な報酬や条件については、各自治体や運営団体によって異なるため、詳細については、教育委員会や地域クラブの運営団体への問い合わせが必要です。
部活動の顧問は小学校教員の職務ではない
小学校教員は、授業準備や学習支援、個別指導など、さまざまな業務をこなす必要がありますが、一般的には部活動顧問を担当する必要はありません。
 
現在は、小学校教員に限らず、部活動顧問を兼務することが教育上負担になる場合もあることから、教員がスポーツ活動などを指導する際は、地域クラブ活動など外部運営の団体と連携して行うケースが増えているようです。

出典
厚生労働省 職業情報提供サイトjobtag 小学校教員
文部科学省 教員勤務実態調査（令和4年度）【速報値】について
文部科学省 小学校学習指導要領（平成29年告示）解説 特別活動編
文部科学省 スポーツ庁 運動部活動の地域移行について
文部科学省 学校の働き方改革を踏まえた部活動改革について
文部科学省 「学校の働き方改革を踏まえた部活動改革について」を受けた公立学校の教師等の兼職兼業の取扱い等について
文部科学省 スポーツ庁 部活動改革ポータルサイト FAQ
 
執筆者：FINANCIAL FIELD編集部
ファイナンシャルプランナー
ファイナンシャルフィールド編集部",[],[]
「駅直結のホテル」にはどんなものがある？ 「料金」はどのくらい？（ファイナンシャルフィールド）,https://news.yahoo.co.jp/articles/86fbdc7b6532115363cdaff86ebe7a5efd226a56,https://newsatcl-pctr.c.yimg.jp/t/amd-img/20250328-00010012-ffield-000-1-view.jpg?exp=10800,2025-03-28T09:40:24+09:00,2025-03-28T09:40:24+09:00,ファイナンシャルフィールド,ffield,ファイナンシャルフィールド,1671,"「駅直結のホテル」にはどんなものがある？ 「料金」はどのくらい？
駅直結ホテルは、その名のとおり駅と直結しており、移動のストレスを大幅に軽減できる可能性があります。
▼町内会費の支払いを拒否したら「今後ゴミを捨てるな」と言われた！ 本当に従う必要はあるの？
今回は、ビジネスや観光など、さまざまなシーンで活躍する駅直結ホテルの種類や料金相場、選び方のポイントなどを解説します。
駅直結ホテルの魅力とは？
駅直結ホテル最大の魅力は、利便性だと考えられます。駅の改札を出てすぐにホテルにアクセスできるため、悪天候でも傘をささずに移動できる点や、大きな荷物を持っての移動も楽になり、時間を有効活用できる可能性がある点も大きなメリットです。
 
特に、ビジネス利用や観光で複数の場所を巡る方にとって、移動時間の短縮は重要なポイントだといえるでしょう。早朝や深夜の移動にも便利な傾向があるため、飛行機や新幹線などの時間に合わせて、スケジュールを組みやすくなる可能性があります。
駅直結ホテルの種類と特徴
駅直結ホテルには、ビジネスホテル、シティホテル、高級ホテルなど、用途に応じたさまざまな種類があるようです。
 
多くの場合、ビジネスホテルは出張などの利用に特化しており、シングルルームが中心です。無料Wi‐Fiやデスク、ランドリーサービスなどが充実していることが多く、快適なビジネス環境が整っていると考えられます。
 
シティホテルは、観光やレジャー利用にも適しており、レストランなどの施設が充実しているとされています。客室も広めで、眺望のよい部屋やスイートルームなど、多彩な客室が用意されているようです。
 
高級ホテルは、特別な日や記念日での利用に最適な可能性があります。高品質なサービスや設備が整っており、レストランやプールなどの施設も充実しているようです。
駅直結ホテルの料金相場
駅直結ホテルの料金は、ホテルの種類や立地、時期によって大きく異なると考えられます。料金の目安は、ビジネスホテルが1泊あたり5000円～1万5000円程度、シティホテルが1泊あたり1万5000円～3万円程度、高級ホテルが1泊あたり3万円以上です。
 
近年では、インバウンド需要の増加により、宿泊費用が上昇傾向にあるようです。観光庁の「宿泊旅行統計調査（2024年・年間値（速報値））」によると、2024年1月～12月の外国人利用は1億6360万人泊と前年比＋38.9％の増加を記録しており、特にビジネスホテルやシティホテルは人気の傾向があるようです。
駅直結ホテルを選ぶ際のポイント
駅直結ホテルを選ぶ際は、利用目的に応じた設備やサービスの充実度を確認することがポイントです。
 
ビジネス利用であれば、デスクやWi‐Fi環境が整っているかをチェックし、観光利用であれば観光スポットへのアクセスや手荷物預かりサービスの有無などを確認してみましょう。
 
また、駅直結ホテルは一般的なホテルよりも価格が高めに設定されている傾向があるため、予算に応じた選択が必要です。時期や曜日によっても料金が変動するため、早めの予約が推奨されます。
 
さらに、駅直結とはいえ改札や出口からの距離が異なるため、目的地へのアクセスがスムーズかどうかも確認しておくとよいでしょう。乗り換えが多い場合には、主要路線への接続が便利なホテルを選ぶことで、移動の負担を減らせる可能性があります。
駅直結ホテルで快適な旅を
駅直結ホテルは、その利便性の高さから、ビジネスや観光などさまざまな目的で利用されています。駅直結ホテルを選ぶ際には、ホテルのサイト等で確認をしっかり行うことで、より満足度の高い滞在が実現できると考えられます。
 
目的や予算に合わせて最適な駅直結ホテルを選び、快適な旅を楽しんでください。

出典
観光庁　宿泊旅行統計調査（2024年・年間値（速報値））
 
執筆者：FINANCIAL FIELD編集部
ファイナンシャルプランナー
ファイナンシャルフィールド編集部",[],[]
「キッチン」の「シンク掃除」の「適切な頻度」は？ 汚れがつきにくくなるアイテムはある？（ファイナンシャルフィールド）,https://news.yahoo.co.jp/articles/7d7a17f8e60b3cac4423cec04602a3d0f79be56d,https://newsatcl-pctr.c.yimg.jp/t/amd-img/20250328-00010011-ffield-000-1-view.jpg?exp=10800,2025-03-28T09:30:10+09:00,2025-03-28T09:30:10+09:00,ファイナンシャルフィールド,ffield,ファイナンシャルフィールド,1664,"「キッチン」の「シンク掃除」の「適切な頻度」は？ 汚れがつきにくくなるアイテムはある？
皆さんは、どのくらいの頻度でキッチンのシンク掃除をしていますか？ こまめにしているつもりでも、意外と大掃除で時間がかかるのがキッチン周りの掃除です。
 
この記事では、キッチンのシンク掃除の適切な頻度や掃除のコツを解説します。シンク汚れにピッタリのアイテムも紹介しているので、参考にしてください。
▼「シャワーだけ」vs「お湯をためる」1人暮らしはどっちがお得？ それぞれの水道代・ガス代を比較
キッチンのシンク掃除の適切な頻度は？
まずは、シンク掃除の適切な頻度をみていきましょう。

■毎日掃除することを心がける
キッチンのシンク掃除は、基本的に毎日行うのが理想的とされているようです。
 
夜ご飯の食器を洗うついでに、シンクも一緒に洗うことを習慣にするとよいでしょう。毎日使うキッチンには汚れが蓄積します。掃除する頻度が高いと、その分掃除時間は短くなる可能性があるため、簡単でよいので毎日掃除することを心がけてみましょう。

■最低でも週1回は掃除する
仕事や育児が忙しい方は、最低でも1週間に1回は掃除しましょう。ただし、1週間の汚れがたまっているので、時間をかけてしっかりと汚れを落とす必要があります。
簡単にできるシンク掃除のコツとは？
ここからは、簡単にできるシンク掃除のコツを紹介します。毎日のルーティンになるように、無理のない範囲で行いましょう。

■スポンジで擦るだけでもOK
毎日掃除する方は、シンク掃除用のスポンジに台所用洗剤を使って擦るだけできれいになるといわれています。食器洗いのついでにシンクを掃除する癖をつけると、負担が軽減できる可能性があります。
 
それほど汚れていない場合には食器用洗剤でも問題ありませんが、スポンジは使い分けるようにするとよいでしょう。

■三角コーナーは使用しない
三角コーナーは、手軽に生ごみを捨てられるため便利ですが、カビやぬめり、臭いの原因になることがあります。

また、シンク掃除の邪魔になり、三角コーナー自体の掃除も必要です。思い切って三角コーナーをなくしてしまうと、シンク掃除が楽になる可能性があります。
シンク掃除に適したアイテムを紹介
ここでは、シンク掃除が楽になる可能性のあるアイテムを2つ紹介します。

■事前にコーティング剤を使用する
シンクをあらかじめコーティングしておけば、汚れや水あかが付着しにくくなる可能性があります。業者に水回りのコーティングを依頼すると約10万円と高額になる傾向があるため、自身で行うのもよいでしょう。
 
ドラッグストアなどで買えるスプレータイプのコーティング剤は、1000円前後で購入できるようです。シンクにスプレーを噴射し、乾いたタオルで塗り伸ばすだけで施工が完了するため、比較的手軽に作業が完了するとされています。

■から拭きはマイクロファイバークロスで
シンクをピカピカに仕上げるためには、最後のから拭きが大切だと考えられます。マイクロファイバークロスは吸水性と速乾性に優れており、簡単に水気が取れるといわれています。また、静電気の力で汚れを吸着させることで、水あかや油汚れも取りのぞけるため、シンク掃除に欠かせないアイテムだと考えられます。
 
100円ショップでも多くのマイクロファイバークロスが販売されているようですが、ナイロン繊維が入った商品を選ぶようにしましょう。安価なものはポリエステル100％が多く、吸水性やかき取り性能がやや劣るとされています。
毎日の簡単掃除を習慣にしよう
キッチンのシンクは、簡単でよいので毎日掃除することが大切です。キッチンがきれいだと、料理をするのも楽しくなる可能性があります。

今回紹介したアイテムや掃除のコツを参考にして、衛生的なキッチンを目指してみてください。
 
執筆者：FINANCIAL FIELD編集部
ファイナンシャルプランナー
ファイナンシャルフィールド編集部",[],[]
