headline,mainEntityOfPage,image,datePublished,dateModified,author,media_en,media_jp,str_count,body,images,external_links
高知に『無痛分娩』の出産体制を！高知大学と県が協定【高知】（RKC高知放送）,https://news.yahoo.co.jp/articles/cac1b2896413a1bc974e1b070e8cb4fbf0a27849,https://newsatcl-pctr.c.yimg.jp/t/amd-img/20250328-05542117-rkckochi-000-2-view.jpg?exp=10800,2025-03-28T18:11:00+09:00,2025-03-28T18:22:25+09:00,RKC高知放送,rkckochi,RKC高知放送,395,"RKC高知放送
「無痛分娩」で出産できる体制を高知県内につくろうと、高知大学と県が協定を結びました。

3月28日、県庁で高知大学の受田浩之学長や濵田知事が出席し「無痛分娩」を県内で実施できる体制をスピーディーに構築するための基本協定が結ばれました。無痛分娩は出産時の痛みを麻酔で緩和し妊婦の心身の負担を軽減するもので、全国的に普及していますが、県内では産科医や麻酔科医の不足から対応できていないのが現状です。

県内の出生数は去年3122人と県の統計開始以降最も少なくなっていて、県は妊娠・出産・子育ての環境強化に力を入れようと県の人口減少対策の一環として取り組むものです。

この協定で大学病院が中心となり「無痛分娩」の実践と教育を行える研修体制を整えるということです。県は2026年度から必要な人に対して「無痛分娩」を導入し、2027年度から希望する人に提供できるよう進める方針です。",[],[]
開通120周年を迎えた高知の路面電車 夢の運転士になった若者の思い【高知】（RKC高知放送）,https://news.yahoo.co.jp/articles/82e73e6d794cce92196474f64e4d9b52e8be7f52,https://newsatcl-pctr.c.yimg.jp/t/amd-img/20250328-08897514-rkckochi-000-2-thumb.jpg?exp=10800,2025-03-28T18:06:00+09:00,2025-03-28T18:13:21+09:00,RKC高知放送,rkckochi,RKC高知放送,1546,"RKC高知放送
去年5月に開通120周年を迎えた高知の路面電車。担い手不足や燃料費の高騰を背景に減便や運賃の値上げなど厳しい状況が続くなか、夢だった運転士になった若者とその思いに密着しました。

高知市出身の高橋凌河さん、20歳です。高橋さんは去年9月、路面電車の運転免許証にあたる国家資格に合格。3か月の研修を経て今年1月、社内審査に合格し晴れて一人前の運転士になりました。

2月6日、とさでん交通の高知市のはりまや橋事務所で運転士の交代に向け準備をする高橋さん。
この日は、運転士になってまだ4日目です。
教官や先輩運転士のアドバイスを思い出しながら業務にあたっていました。

■高橋さん
「はりまや橋のクロッシングもそうだが、教官の教えも生かせれる場所なので、はりまや橋と高知駅のポイント。信号の確認という所は一番の今日のポイント」

午後1時半。先輩から運転を交代した高橋さん。この日の業務は交差点や信号、交通量の多い区間、桟橋通り5丁目の電停と高知駅の電停を結ぶ路線の運行です。早速、乗り込みました。

■運転士交代
「乗務員交代いたします。よろしくお願いいたします」

乗り込むまでは少し緊張していた高橋さんですが、運転席につくと真剣な眼差しに変わりました。
また、停車した時にはアナウンスや笑顔で暖かい接客もおこないながら利用者を目的地まで届けます。

高橋さんはまだ駆け出しの身ですが、運転士としてのプライドと自信が引き締まった表情あらわれていました。

この日は桟橋通り5丁目と高知駅の区間を4往復。約2時間の運転を任されました。

■高橋さん
「試験のタイミングで色々イレギュラーなこともあったが、無事合格ということを聞いてひとまずほっとしてるし、家族にも合格したよと連絡したら喜んでもらったので、一つ新しいスタートが切れたと思った」

高知の路面電車は明治37年（1904年）の5月2日に全国10番目となる運行を始めました。現在運行する路面電車としては国内でもっとも古く、総延長は25キロあまりと国内最長。高知市民や近隣市町村の住民の通勤・通学の足として利用されています。一方、路面電車の運転士は減少傾向にあり現在は69人に。

いまのダイヤを維持するためには運転士だけで人員が6人不足していて、休日出勤などで埋め合わせています。

とさでん交通によりますと4月には15人の新入社員が入るということですが、まだ運転士の採用は未定だということです。

高橋さんがとさでん交通に入社したのは高校卒業後の2022年の4月。2年間の事務作業を経て去年、国家資格を取得しました。
高橋さんがとさでん交通に入社したきっかけは、地元である高知の運転士になるという幼いころからの夢でした。

高知市出身ということもあり幼いころから路面電車を利用することが多く、毎年5月に行われる電車の日には必ず足を運ぶほど路面電車が好きだったそうです。

利用者を安全に目的地まで運び届ける運転士の姿が、当時の高橋少年にはとてもカッコよく見えました。憧れの存在でいつしか運転士を目指すようになりました。

子どものころからの夢を叶え、一人の運転士として一歩を歩み始めた高橋さんに次の夢を聞きました。

■高橋さん
「やっとスタート地点に立てたなというのは1番実感していて、その反面すごく緊張しているが、叶った夢が終わったばかりで、すぐ新たな夢はなかなか今の段階ではあれだが、とりあえず目標として子供たちが憧れる運転手さんになるということが目標なので、そこはひとまず頑張りたい」

憧れの運転士として働き始めた高橋さん。これからは子どもたちから憧れられる運転士になれるよう今日も高知の街を駆け抜けます。",[],[]
高知県教育長が定例会見 次期教育長の今城純子教育次長『全身全霊で取り組む』と抱負語る【高知】（RKC高知放送）,https://news.yahoo.co.jp/articles/a9b18e7bc558cb58f0802f4e518543c12b4d2e27,https://newsatcl-pctr.c.yimg.jp/t/amd-img/20250328-09342731-rkckochi-000-3-thumb.jpg?exp=10800,2025-03-28T17:58:00+09:00,2025-03-28T18:07:22+09:00,RKC高知放送,rkckochi,RKC高知放送,525,"RKC高知放送
3月28日、高知県教育長の定例会見が行われ、長岡幹泰教育長のかわりに4月から新たに教育長に就任する今城純子教育次長が「全身全霊で取り組む」と抱負を語りました。

25日、高知市で行われた県教育長の定例会見で、今年度で任期満了となり退任する長岡幹泰教育長は、教員出身者として教育長を務めた3年間を振り返り「これまでとは違った視点で本県の課題に取り組んでいこうと、まい進してきた3年間だった」と語りました。

また、相次いだ教職員の不祥事については「私が危機感を伝えている言葉が1人1人の教職員に伝わっていなかった。品性や志を高く力を尽くす教職員に全員を育て上げられなかった」と児童・生徒や保護者、県民に詫びました。

一方、4月から初の女性県教育長に就任する今城純子教育次長は、新年度の抱負を語りました。

■今城純子 教育次長
「重責を担うこととなり本当に身が引き締まる思いとともに、本県教育の発展に貢献していく、そのために全霊全霊で取り組んでいく覚悟を新たにしている」

また、新年度から取り組む課題について県立高校振興再編計画に基づく高校の改革、ICTなどを活用した学力向上、教職員の不祥事防止を含めた学校組織の改革を挙げました。",[],[]
香美市のアンパンマンミュージアムが3月29日にリニューアルOPEN！【高知】（RKC高知放送）,https://news.yahoo.co.jp/articles/2518b0a91e646e63a2bde5d4392d2b12e4927b71,https://newsatcl-pctr.c.yimg.jp/t/amd-img/20250328-04989199-rkckochi-000-2-thumb.jpg?exp=10800,2025-03-28T17:56:01+09:00,2025-03-28T18:38:25+09:00,RKC高知放送,rkckochi,RKC高知放送,633,"RKC高知放送
去年11月から改修工事を行っていた高知県香美市のアンパンマンミュージアムが3月29日にリニューアルオープンするのを前に、28日にメディア向けの内覧会が開かれました。

香美市香北町のアンパンマンミュージアムと詩とメルヘン絵本館からなるやなせたかし記念館は、1996年にオープンし、来年30周年となるのを前に約2億6000万円をかけて改修工事を行いました。

アンパンマンミュージアムのエントランスホールは、階段にアンパンマンの絵本の挿絵が新たにデザインされ、やなせさんがモデルになったキャラクター「やなせうさぎ」も登場。
妻の暢さんと一緒にほほえむ写真の垂れ幕も設置されました。

地下のアンパンマンワールドでは新しいキャラクターたちもお目見えし、ますます賑やかになっています。

また詩とメルヘン絵本館では、1973年から30年間やなせさんが編集長と表紙のデザインをつとめた雑誌「詩とメルヘン」全刊の359冊を壁一面に新たに展示。

さらに、やなせさんが着用したステージ衣装や誕生日にやなせスタジオのスタッフからプレゼントされていたというオリジナル靴下も展示し、やなせさんの人とのつながりが感じられます。
広場にあるアンパンマン遊具は5基が新設されました。屋外トイレも建て替えられ、子供用のトイレを設けました。

アンパンマンミュージアムなど、やなせたかし記念館は3月29日正午にオープン。
チケットは事前予約制で公式ホームページから予約できます。",[],[]
高知城のソメイヨシノが満開！いよいよお花見本番【高知】（RKC高知放送）,https://news.yahoo.co.jp/articles/bb6bda8ae2c034423f0bf5c035bbe58e9af59074,https://newsatcl-pctr.c.yimg.jp/t/amd-img/20250328-01328919-rkckochi-000-2-thumb.jpg?exp=10800,2025-03-28T16:40:00+09:00,2025-03-28T16:49:25+09:00,RKC高知放送,rkckochi,RKC高知放送,381,"RKC高知放送
いよいよお花見本番です。高知地方気象台は3月28日、高知城のソメイヨシノの標本木が満開になったと発表しました。例年は開花から1週間で満開となりますが、いつもより早い開花から5日での満開の発表です。

3月23日に開花した高知城三ノ丸のソメイヨシノの標本木。開花から5日しか経っていませんが、ここ数日気温の高い日が続き開花が進んでいて、28日に気象台の職員が開花状況を確認しました。標本木のつぼみが8割以上咲くと満開が発表されます。

満開は平年より2日早く去年より3日早くなり、開花の日が同じだった熊本でも満開が発表されました。
28日は薄曇りの天気でしたが、三ノ丸には家族連れや職場のグループなどが訪れ花見を楽しんでいました。

高知城三ノ丸のソメイヨシノは咲き具合がまだ6分程度の木も多く、3月末から4月初旬にかけて花見客でにぎわいそうです。",[],[]
『あってはならないこと』 酒気帯び運転や後輩隊員への暴行などで陸上自衛隊員3人を懲戒処分【高知】（RKC高知放送）,https://news.yahoo.co.jp/articles/0e95e8228f6ad62aa290711c72f54402054c3aac,https://newsatcl-pctr.c.yimg.jp/t/amd-img/20250328-04569481-rkckochi-000-2-thumb.jpg?exp=10800,2025-03-28T11:52:00+09:00,2025-03-28T16:54:21+09:00,RKC高知放送,rkckochi,RKC高知放送,471,"RKC高知放送
陸上自衛隊高知駐屯地は、酒気帯び運転の疑いなどで摘発された陸士長2人と、後輩の隊員に暴行を加えた陸士長の合わせて3人の隊員を懲戒処分としました。

3月28日付けで停職3か月の懲戒処分を受けたのは、香南市の陸上自衛隊高知駐屯地第50普通科連隊の22歳の陸士長です。
高知駐屯地によりますと陸士長は2024年12月、同僚の隊員と高知市の居酒屋で酒を飲んだあと自家用車を運転し、市内の県道で酒気帯び運転の疑いで摘発されました。
一緒に酒を飲み車に同乗した別の22歳の陸士長も摘発されていて、同乗した陸士長も28日付けで停職10日の懲戒処分を受けました。

また、2023年10月から11月までに高知駐屯地で後輩の隊員に暴行を加えたとして、22歳の陸士長を停職2か月の懲戒処分としました。後輩に指導しても改善が見られなかったことから足蹴りや頭をつかんだりしたということです。

3人の隊員は反省し、今後退職する予定だということです。水関謙作第50普通科連隊長は「あってはならないことで今後さらなる服務指導の徹底を図る」としています。",[],[]
ポケモンがデザインされたマンホール『ポケふた』 日高村に設置される【高知】（RKC高知放送）,https://news.yahoo.co.jp/articles/f95de82417cc1165f3dd0f2b85006df92bc487a1,https://newsatcl-pctr.c.yimg.jp/t/amd-img/20250328-04351847-rkckochi-000-2-thumb.jpg?exp=10800,2025-03-28T11:51:00+09:00,2025-03-28T12:00:22+09:00,RKC高知放送,rkckochi,RKC高知放送,371,"RKC高知放送
ポケモンのキャラクターがデザインされたマンホール「ポケふた」が3月28日に高知県日高村に設置され、お披露目式が行われました。

28日、日高村のJR日下駅前でポケモンのキャラクターがデザインされたマンホールのふた「ポケふた」のお披露目式が行われ、約30人が参加しました。「ポケふた」は株式会社ポケモンと県が去年11月に締結した協定の一環で、地域活性化に役立ててもらおうと3月14日、第1弾として県に7枚を寄贈したものです。

日高村の「ポケふた」には、高知大好きポケモンのヌオーとシズクモ、ヤンヤンマが一緒にデザインされていて、28日は日下駅にある郵便ポストのそばに設置されました。今後、香美市、奈半利町など7市町村に設置されることになっています。

「ポケふた」は今後、県内の34市町村すべてに原則1枚ずつ配られる予定です。",[],[]
