headline,mainEntityOfPage,image,datePublished,dateModified,author,media_en,media_jp,str_count,body,images,external_links
わが家では「ダブル」のトイレットペーパーを使用していますが、減りが早い気がします。「シングル」のほうが節約になりますか？（ファイナンシャルフィールド）,https://news.yahoo.co.jp/articles/ed949acd278a41e9a56b24cf8bef62559ef23db3,https://newsatcl-pctr.c.yimg.jp/t/amd-img/20250328-00010026-ffield-000-1-view.jpg?exp=10800,2025-03-28T13:50:10+09:00,2025-03-28T13:50:10+09:00,ファイナンシャルフィールド,ffield,ファイナンシャルフィールド,1939,"わが家では「ダブル」のトイレットペーパーを使用していますが、減りが早い気がします。「シングル」のほうが節約になりますか？
トイレットペーパーのシングルとダブルのどちらも使用したことのある方の中には、ダブルのほうが減るスピードが早く、ダブルとシングルどちらのほうがコスパがよいのか気になると感じたことがあるという人もいるでしょう。どちらのトイレットペーパーを使うかでかかる費用もそれぞれ異なります。
 
そこで今回は、トイレットペーパーのシングルとダブルの違い、かかるコストの違いについて解説します。トイレットペーパーの「シングル」と「ダブル」、どちらを使用するかいつもなんとなく選んでいるという方はぜひ最後までお読みください。
▼「シャワーだけ」vs「お湯をためる」1人暮らしはどっちがお得？ それぞれの水道代・ガス代を比較
「シングル」と「ダブル」の違い
トイレットペーパーのシングルとダブルの大きな違いとして次の2点があげられます。

●巻かれている紙の枚数
●巻かれている紙の長さ

「2枚重ね」になっているダブルと「1枚」のシングルをトイレットペーパーの長さで比較すると、シングルのほうが長く巻かれていることが一般的です。メーカーや商品により異なりますが、シングル1ロールの長さはダブルの約2倍だそうです。あるメーカーから提供されているシングルとダブルのトイレットペーパーの長さは次の通りになります。

●ダブル：30メートル
●シングル：55メートル

ダブルはふんわりとした使用感が好みの方に向いており、シングルは1回にある程度の長さを使ってしっかりふきたい方に向いています。
「シングル」と「ダブル」における1ヶ月の平均使用量の違い
では次に、トイレットペーパーのシングルとダブルで1ヶ月の使用量にどれ程の違いがあるのかを見ていきましょう。
 
一般社団法人日本トイレ協会が男女140人に行ったアンケートによると、1回のトイレで使用するトイレットペーパー（シングル）の平均使用量は表1の通りです。
 
表1
表1
出典：一般社団法人日本トイレ協会「トイレットペーパー、緊急時に備えて必要な分を必要な分だけ、計画的に備蓄しましょう」を基に筆者作成
 
男女ともに1回の大便に必要なトイレットペーパーは3メートルを超えます。
 
1日に行くトイレの平均的な回数から算出すると、男性2人女性2人の4人家族では1ヶ月でシングルのトイレットペーパーを約17ロール使用するようです。前述した通り、シングルの長さをダブルの約2倍と考えた場合、単純に計算して1ヶ月で必要なダブルのトイレットペーパーは34ロール程度となります。
 
トイレットペーパーは同じブランドであればシングルとダブルの違いによる価格差はあまりなく、12ロール600円前後で購入可能な商品もあります。どちらも同じ長さを使用する場合、シングルはダブルに比べてかかるコストを半分におさえられるでしょう。
 
ただし、シングルよりも厚い紙を使用しているダブルでは、短くてもふき心地が良く、同じ回数使った場合でもシングルよりも使用量が減ることもあります。
同じ長さを使用した場合ダブルよりもシングルのほうが費用をおよそ半分に節約できる可能性がある
トイレットペーパーを同じ長さ使用した場合、ダブルはシングルに比べておよそ2倍のコストがかかる可能性があります。そのため、ダブルのトイレットペーパーの使いすぎには注意が必要です。
 
ただしトイレットペーパーの使用量には個人差があります。普段からふんわりとした使い心地が好みでダブルのトイレットペーパーを使用している場合は、1回に使う量をいつもより短めにすると節約につながるでしょう。

具体的にはシングルで1回2メートル使用している場合と、ダブルで1メートル使用している場合ではトイレットペーパーの消費量はほとんど変わりません。
 
トイレットペーパーの「シングル」と「ダブル」では、価格以外にも使い心地に違いがあります。肌ざわりや使用感の違いから、どちらのトイレットペーパーを使用するか決めるのもひとつの方法といえます。
 
また、同じメーカーであればトイレットペーパーの「シングル」と「ダブル」で大きな価格差は見られませんでした。「シングル」と「ダブル」どちらを選ぶかは、長さを選ぶのか、厚みを選ぶのかで選択してもよいかもしれません。
 
出典
一般社団法人日本トイレ協会 トイレットペーパー、緊急時に備えて必要な分を必要な分だけ、計画的に備蓄しましょう
 
執筆者：FINANCIAL FIELD編集部
ファイナンシャルプランナー
ファイナンシャルフィールド編集部",[],[]
3月の娘の引っ越し代が「10万円」で驚き！ 長男のときは「5万円」ほどだったのに、これって妥当？ 費用を抑えるためのチェックリストを解説（ファイナンシャルフィールド）,https://news.yahoo.co.jp/articles/b21ea5ecc1b5e6cdaa8e8c4ef9c161cb95642a74,https://newsatcl-pctr.c.yimg.jp/t/amd-img/20250328-00010025-ffield-000-1-view.jpg?exp=10800,2025-03-28T13:50:02+09:00,2025-03-28T13:50:02+09:00,ファイナンシャルフィールド,ffield,ファイナンシャルフィールド,1780,"3月の娘の引っ越し代が「10万円」で驚き！ 長男のときは「5万円」ほどだったのに、これって妥当？ 費用を抑えるためのチェックリストを解説
新年度をひかえて引っ越しをする人は多いことでしょう。引っ越しの際は費用も気になると思いますが、3月の引っ越しで、費用がかつての2倍にもなると知ったら驚いてしまいますよね。
 
物価高の影響かも……と思ってしまうかもしれませんが、引っ越しは時期や移動距離、荷物の量などによって大きく費用が異なります。
 
本記事では、引っ越し費用の差が大きく出る理由を解説し、できるだけ費用を抑える方法について紹介します。
▼「シャワーだけ」vs「お湯をためる」1人暮らしはどっちがお得？ それぞれの水道代・ガス代を比較
3月の引っ越し費用は本当に高い？
3月は進学や転勤のシーズンで、引っ越し業者の需要が急増するため、通常期に比べて費用が1.5～2倍になることがあります。特に、3月下旬は新年度に向けた駆け込みの引っ越しが集中し、予約が取りづらくなるだけでなく、料金も大幅に上がりやすい時期です。
 
また、引っ越し料金は日程や時間帯によっても変動します。土日や祝日、午前中の引っ越しは人気が高いため、割増料金が発生することが多いです。
 
一方、3月中でも平日や午後便を選ぶと、比較的安く済む可能性があります。さらに、業者によっては「時間指定なし」のフリー便を利用することで、費用を抑えられる場合もあります。
 
繁忙期の引っ越しでは、通常期と比べて価格が上がるだけでなく、スケジュール調整をして早めの予約も必要です。計画的に日程を決めることで、なるべく費用を抑えてスムーズに引っ越しできるでしょう。
同じ3月でも、引っ越し費用が5万円と10万円と差が出たのはなぜ？
同じ3月に行う単身の引っ越しでも、条件が異なると料金に大きな差が生まれます。
 
タイトルの事例にあるように、引っ越し費用が5万円の場合と、2倍の10万円となる場合もあり、このように差が生まれた要因は次のようなことが考えられます。

・引っ越しの距離
・荷物の量
・利用した引っ越し業者
・予約のタイミング

引っ越しの条件によって費用は大きく変わります。なぜこれらが引っ越し費用に影響するのか見ていきましょう。

■引っ越しの距離
引っ越しの移動距離が長いほど、トラックの運搬費やガソリン代、人件費がかかるため、料金が高くなります。例えば、同じ都道府県内の引っ越しと比べると、県をまたぐ長距離引っ越しでは費用が2倍以上になることもあります。

■荷物の量
家具や家電の有無によっても料金が変わります。必要最低限の荷物だけを持って引っ越し、現地で家具や家電を購入した場合と比べ、ベッドや冷蔵庫などの家電を運んだ場合では、トラックの大きさが変わるため費用も上がります。

■利用した引っ越し業者
大手の引っ越し業者はサービスの質が高く、万一の荷物の破損などへの保証も充実していますが、料金も高めに設定されています。一方で、地域密着型の業者や単身専門のプランを利用すると、同じ内容でも費用を抑えられることがあります。

■予約のタイミング
3月の引っ越しは、直前予約になるほど料金が高くなります。進路などが決まっていれば1～2ヶ月前に予約できるため料金は抑えられるのに対し、直前に依頼すると割増料金が適用される可能性があります。
費用を抑えるためのチェックリスト
引っ越し費用を少しでも抑えるためには、いくつかのポイントを押さえておくことが大切です。図表1のチェックリストを活用し、引っ越し代を節約すると良いでしょう。
図表1
＜図表1＞

各種資料より筆者作成
 
費用を抑える方法をうまく組み合わせれば、引っ越し費用も安くできるかもしれません。
まとめ
引っ越し費用は、時期や条件によって大きく異なります。特に3月は料金が高騰しやすいため、早めの予約や業者の選び方が重要です。平日や午後便を選ぶ、荷物を減らす、単身向けプランを活用するなどの工夫で、費用を抑えられるでしょう。
 
複数の見積もりを比較し、自分に合った方法を選んで、引っ越し費用を抑えながら、新生活の準備がスムーズに進められると良いですね。
 
執筆者：古澤綾
FP2級
ファイナンシャルフィールド編集部",[],[]
旅行先の札幌で、スケートリンクの値段が地元の人の「2倍」高くて驚き！ 観光地での「二重価格」は今後増えていく？ 背景と今後の展開を解説（ファイナンシャルフィールド）,https://news.yahoo.co.jp/articles/2a37547ed9da81d7213ee555000e28403fb1d128,https://newsatcl-pctr.c.yimg.jp/t/amd-img/20250328-00010024-ffield-000-1-view.jpg?exp=10800,2025-03-28T13:30:02+09:00,2025-03-28T13:30:02+09:00,ファイナンシャルフィールド,ffield,ファイナンシャルフィールド,1826,"旅行先の札幌で、スケートリンクの値段が地元の人の「2倍」高くて驚き！ 観光地での「二重価格」は今後増えていく？ 背景と今後の展開を解説
旅行に出掛けて、地元の人と観光客の料金に大きな差があることに驚いた経験はありませんか？ 観光地では、「観光二重価格」や「地元割」といった料金の差別化を採用しているところもあるようです。
 
しかし、観光客としては、同じ体験をしているのに料金が異なることに、少しモヤモヤした気持ちを抱えることもあるかもしれません。では、なぜ観光地ではこのような二重価格が設定されているのでしょうか？
 
本記事では、観光地における二重価格の現状やその背景、そして今後の展開について解説します。
▼会社員で「年収1000万円」以上の割合は？ 大企業ほど高年収を目指せる？
観光地の二重価格の現状は？
観光地での二重価格の現状についてみていきましょう。2025年に開催されたさっぽろ雪祭りでは、スケートリンクの入場料に「札幌市民割」が導入され、話題となりました。
 
通常、大人の当日券は3000円ですが、札幌市民割価格では1500円となり、地元民が優遇される形となっています。なお、この価格には、シューズ代も含まれています。
 
また、海外でも二重価格を採用している例があります。インドのタージマハルでは、インド国内に住む人は50ルピーで入場できますが、観光で訪れた日本人などの外国人は1100ルピーと、料金に大きな差があります。
 
1ルピーを1.7円のレートで換算すると、インド国内に住む人は85円、外国人は1870円となり、その差は実に22倍にもなります。このような料金差は、世界中のいくつかの観光地でみられます。
なぜ二重価格を採用するの？
観光地が二重価格を採用する理由は、観光資源の維持やオーバーツーリズム（観光公害）対策のために必要な財源を確保することが主な目的です。
 
特に、インバウンド向けの価格設定については、円安や物価水準の違いにより、訪日客に高い負担能力があると見込み、負担を多く求める狙いがあります。また、観光地で外国語表記のメニューや案内を提供するなど、観光客対応には追加コストが発生するため、価格差を設けることは自然な対応とも考えられます。
 
国内の観光客向けにも、例えば、札幌雪祭りの開催には札幌市の財源も使用されているため、市民はすでに税金によって負担をしているともいえます。このような背景から、地元民優遇策として価格差が設けられている理由は理解できるのではないでしょうか。
 
二重価格の採用に対して、「差別的だ」との意見もありますが、観光地の維持や地域経済の支援を目的とした戦略として、日本でも導入する動きが見られます。
二重価格の今後の動向
実際に国内では、札幌市の事例以外にも二重価格の導入や検討が進んでいます。
 
例えば、兵庫県姫路市では、世界文化遺産である姫路城の入城料を、市民以外には2500円に値上げする改正案が市議会に提出されました。この措置は、城の維持管理費用を確保するためのもので、札幌市の雪祭りの事例と同様、市民には税金での負担があることから、料金を据え置く方針です。
 
京都市でも、観光客の急増により市バスが混雑し、市民の利用に支障をきたしていることから、観光客向けの「観光特急バス」の導入を検討しています。
 
観光客をそのバスに誘導することで、市民と観光客の利用のすみ分けを図ろうというものです。これは、観光資源を守りつつ、地域住民への影響を最小限に抑えることを目的としています。
 
このような動きは、オーバーツーリズムへの対策として、今後も日本全国で広がる可能性があります。
まとめ
春休み中で、観光地での料金差について関心をもつ人もいるでしょう。観光地が二重価格を導入する理由には、観光資源の維持や地域経済の支援があるため、観光客としてはその背景を理解する必要があります。
 
二重価格が当たり前になるかどうかは、各地域の対応次第ですが、観光地の維持と円滑な運営を考慮した措置として広がっていく可能性は高いと考えられるでしょう。

出典
さっぽろ雪まつり 公式ガイドブック
インド ウッタル・プラデーシュ州政府観光局 タージマハル公式ウエブサイト
 
執筆者：FINANCIAL FIELD編集部
ファイナンシャルプランナー
ファイナンシャルフィールド編集部",[],[]
洗濯物を乾かすために「洗濯乾燥機」を買いたいのですが、高いです…。コインランドリーで我慢した方がコスパがいいでしょうか？（ファイナンシャルフィールド）,https://news.yahoo.co.jp/articles/65ca587059b176a6078c6482428a1ab8e6e36269,https://newsatcl-pctr.c.yimg.jp/t/amd-img/20250328-00010023-ffield-000-1-view.jpg?exp=10800,2025-03-28T13:20:03+09:00,2025-03-28T13:20:03+09:00,ファイナンシャルフィールド,ffield,ファイナンシャルフィールド,1909,"洗濯物を乾かすために「洗濯乾燥機」を買いたいのですが、高いです…。コインランドリーで我慢した方がコスパがいいでしょうか？
日常生活の中でかかせない家事のひとつに洗濯があります。洗濯には、洗う、干す、たたむ、しまうなどたくさんの工程が必要です。特に洗濯物を外に干している場合は天候を気にする必要もあるため大変と感じる人もいるでしょう。
 
そこで今回は、洗濯乾燥機とコインランドリーの利用では、かかる費用にどれくらいの差が出るのかを検証します。洗濯乾燥機にかかる電気代の節約方法についても解説しますので、洗濯乾燥機の購入を検討している方はぜひ参考にしてください。
▼「シャワーだけ」vs「お湯をためる」1人暮らしはどっちがお得？ それぞれの水道代・ガス代を比較
洗濯乾燥機の乾燥にかかる電気代
洗濯乾燥機は乾燥する方法によって、大きく次の2種類に分けられます。

●ヒートポンプ方式
●ヒーター乾燥方式

ヒートポンプ方式はおもにドラム式洗濯乾燥機に多く搭載されている機能です。湿気を含んだ空気を除湿して排水し、乾いた温風で乾燥させますが、比較的低い温度で乾燥するので洗濯物が傷みにくく電気代を節約できることが特徴です。

一方で縦型洗濯乾燥機で多く採用されているのがヒーター乾燥方式です。ヒーター乾燥方式には湿気を洗濯機の外に排出して乾かすタイプと、冷却水で湿気を含む温風を除湿し乾燥の際に発生する水蒸気を水に戻して排出する水冷除湿タイプの2種類があります。

どちらも、ヒートポンプ方式と比べて洗濯物の痛みや縮みが起きやすく電気代がかかる傾向にあるようです。
 
とあるメーカーによると、6キログラムの洗濯物を洗いから乾燥まで行った際にかかる1回の電気代は次の通りです。

●縦型洗濯乾燥機：約68.2円（1日1回洗濯した場合1ヶ月で約2046円）
●ドラム式洗濯乾燥機：約18.3円（1日1回洗濯した場合1ヶ月で約549円）

乾燥を行わずに洗濯のみを行った場合の電気代は11～12キログラムの容量であっても2円～3.4円程度であるため、上記電気代の大部分は乾燥にかかる金額と考えてよいでしょう。ドラム式洗濯乾燥機の場合、縦型洗濯乾燥機と比べて1回あたり約49.9円、1ヶ月を30日とした場合は約1497円節約できる可能性があることが分かります。
コインランドリーにかかる費用
次にコインランドリーで乾燥を行った場合に必要な費用を見ていきましょう。
 
一般的にコインランドリーでは洗濯1回で300円～600円程度、乾燥10分で100円程度の料金相場となっているようです。1回の乾燥にかかる料金を200円とした場合、毎日コインランドリーで乾燥を行う際に必要な費用は1ヶ月で6000円となり、縦型洗濯乾燥機で毎日洗濯～乾燥までを行った場合と比べても3倍近くもの費用がかかる計算です。
洗濯乾燥機にかかる電気代を節約する方法
洗濯乾燥機にかかる電気代を節約するためには、次のポイントを意識してみるとよいでしょう。

●洗濯物の量が多過ぎないように注意する
●フィルターの掃除をこまめに行う
●電気料金の安い時間帯に乾燥を行う

洗濯乾燥機では、洗濯可能な容量よりも乾燥可能な容量の方が少ない場合があります。規定よりも多い洗濯物の量では乾燥が不十分になってしまうこともあるので注意しましょう。
 
フィルターにたまるほこりや糸くずは乾燥効率を低下させるため、電気代が高くなるだけでなく故障の原因にもなります。また、契約している電気料金プランによっては電気代の安い深夜の時間帯を上手に利用すると洗濯乾燥にかかる電気代を節約できるでしょう。
毎日コインランドリーで乾燥を行うと縦型洗濯乾燥機と比べて3倍近くもの費用がかかることがある
乾燥機能付きの洗濯機を購入するには初期費用が必要ですが、一度購入してしまえばコインランドリーを利用するより節約できる可能性があります。具体的には今回の試算によれば、1ヶ月毎日コインランドリーで乾燥を行った場合にかかる費用は約6000円と、縦型洗濯乾燥機の電気代約2046円と比べて3倍近くもの費用が必要になる計算です。
 
洗濯乾燥機を使用する場合には、洗濯物の量を多くし過ぎない、フィルターをこまめに掃除する、電気料金の安い深夜の時間帯を活用するなどの工夫をすると乾燥にかかる費用を節約できます。今回ご紹介した方法を参考に、洗濯乾燥にかかる電気代を上手に節約していきましょう。
 
執筆者：FINANCIAL FIELD編集部
ファイナンシャルプランナー
ファイナンシャルフィールド編集部",[],[]
