headline,mainEntityOfPage,image,datePublished,dateModified,author,media_en,media_jp,str_count,body,images,external_links
昔と同じく3割が経験？ Z・α世代もハマる「第二ボタン」の風習…若者が再評価する意外な理由（FRIDAY）,https://news.yahoo.co.jp/articles/10696b0360f0c69ed3fc1e98ad7e652f9d1ec8b8,https://newsatcl-pctr.c.yimg.jp/t/amd-img/20260311-00000007-friday-000-6-view.jpg?exp=10800,2026-03-11T11:00:56+09:00,2026-03-11T20:05:56+09:00,FRIDAY,friday,FRIDAY,1239,「第二ボタン」、若者の8割が認知 “第二ボタン”の習慣はZ世代・α世代の8割が知っていた！ 卒業式シーズン真っただ中の現在。卒業式といえば“第二ボタン”というイメージを持つ人も多いのではないだろうか。ある程度年齢が上の人たちにとっては定番の風習だが、現在の10代もこの風習を知っているのだろうか？ 【画像】第二ボタンは惜しくも「2位」 現役中高生たち「卒業式の贈り物」以外な1位は…… そんな疑問を解決してくれたのが、大手制服メーカーでおなじみ、カンコー学生服が中高生1200人に行った『【2026年最新】卒業式トレンド調査 第二ボタンはもう古い？』アンケートだ。 このアンケートによると「第二ボタンの風習を知っていますか？」には80.6％が「知っている」と答えている。さらに実際に第二ボタンをもらったり、渡したりしたことがあるという人は27.2％と約4人に1人、中学生のみに限ると30.8％まで上昇する。 昭和文化を再編集する若者たち 令和のこの時代、デジタルネイティブであり、Z世代・α世代と呼ばれる中高生の間でも、なぜいまだに第二ボタンの風習が残っているのか？ 「新消費をつくるα世代 答えありきで考える『メタ認知力』」(日経BP)などの著書があり、Z世代・α世代研究を行っている産業能率大学 経営学部 教授の小々馬敦(こごま・あつし)氏に話を聞いた。 「アンケート結果を見ると、私の実感よりも認知度が高いなという感想です。そこで大学のゼミ生に聞いてみたら、約9割が知っていて、実際にもらったり、あげたりしたことがある人は1割ほどでした。知るきっかけは漫画やアニメなどだそうで、このアンケートにある中高生も同様のプロセスで知っているのではないでしょうか」(小々馬氏) 漫画やアニメ、またはドラマや映画などのエンタメコンテンツを通して、第二ボタンの風習は世代を超えて受け継がれているようだ。 また、知識としてその風習を知っているとはいえ、デジタルネイティブであるZ世代・α世代が、多くの体験がSNSなどデジタルを介して行われている中、制服のボタンという物理的なモノを贈る風習を実際に行うのはなぜだろうか。 「彼らの世代にとってSNSは“今のため”のツールであって、それとは別に思い出として残るモノを大切にする傾向があります。例えば、写真をあえて現像したり、手紙を渡したりということも多く行われています。 また、この世代の特徴として挙げられるのが“古い=ダサい”という感覚があまりないという点です。古くてもよいコンテンツを掘り起こして、そこにひと手間加えることで価値を高める。昔からの風習やコンテンツを再編集して楽しんでいるのを多く見かけます」 Z世代・α世代は第二ボタンもそれ自体を古い=ダサいとせずに、自らの価値観で取り入れ、さらに自分たちで付加価値をつけて楽しんでいる側面があるようだ。もしかすると、モノに対する意識は上の世代よりもアップデートされているのかもしれない。,[],[]
【未解決事件】「記憶がある」と自供…12年前の強盗致傷事件の犯人が今になって逮捕された納得の理由（FRIDAY）,https://news.yahoo.co.jp/articles/6184615dec0ac16d592acc89220927a07a8b1f43,https://newsatcl-pctr.c.yimg.jp/t/amd-img/20260311-00000008-friday-000-1-view.jpg?exp=10800,2026-03-11T11:00:56+09:00,2026-03-11T11:00:56+09:00,FRIDAY,friday,FRIDAY,1392,防カメ映像の再捜査で浮上 3月4日の朝に送検された大沢容疑者。一瞬だけカメラを見た 12年前に起きた強盗致傷事件の容疑者が逮捕された。 警視庁尾久署が3月3日に逮捕を発表したのは、東京都新宿区の無職・大沢翔太容疑者(44)。大沢容疑者は’14年の3月6日朝9時半ごろ、荒川区西尾久2丁目の路上を歩いていた当時84歳の女性を後ろから突き飛ばして右腕骨折など全治2ヵ月の重傷を負わせ、持っていた手提げバッグを奪った強盗致傷の疑いがもたれている。手提げバッグには現金1万4500円が入っていた。 【画像】84歳の女性が重傷を負った未解決事件…12年前に起きた強盗事件現場の“今” なぜ、12年も経ってから事件が解決されることとなったのか。 「警察によると、事件当時に付近の防犯カメラに容疑者とみられる男の顔が映っていたものの、特定することはできませんでした。しかし、3ヵ月ほど前からある刑事が管内で過去に起きた未解決事件の再捜査を始めたのです。防カメ映像を他の事件の関係者数十人の写真と照合したところ、大沢容疑者が浮上。3日に任意で話を聞いたところ、『当時お金がなかったからやった』などと供述したそうです。 大沢容疑者は『ひったくりをした記憶はあるが、性格上、突き飛ばしてはいないと思う』と、容疑を一部否認しています。強盗致傷罪の公訴時効は15年で、時効まであと3年に迫っていました」(全国紙社会部記者) 4日の朝7時、大沢容疑者が尾久署から送検された。警官から傘をさしかけられた大沢容疑者は、寒さと細かく降る雨に少し顔をしかめるようにして歩きながら、護送のバスに乗り込んでいった。 元神奈川県警刑事で犯罪ジャーナリストの小川泰平氏によれば、未解決の事件は時効にならない限りは誰かしらが捜査を引き継いでいるのだという。 「強盗事件ぐらいの犯罪であれば、必ず担当の捜査員が誰かいて、異動しても捜査資料はずっと引き継がれています。各都道府県警には未解決事件を専門に捜査する部署がありますが、それとは違った形で所轄でも未解決事件を捜査しているのです。これは、過去の事件に関する情報が、何年も経ってから思わぬ形で出ることがあるので、事件について頭に入れておく必要があるためでもあります」 また、引き継いだ資料を別の捜査員が見直すことで、解決に近づくケースもあるようだ。 「捜査員が違えば、違ったものの見方もできます。また、科学捜査の技術の進歩はここ数年目覚ましいですから、DNA鑑定や防カメ映像など、当時は解析できなかった証拠が見つかることもあります。 昨年10月に26年前の名古屋主婦殺害事件の容疑者が逮捕されたことで、警察庁長官から未解決事件の見直しの指示も出されています。今回のように実際に解決したケースが出れば、捜査員のモチベーションも上がり、未解決事件の解決が増えていくのではないでしょうか」 逃げおおせたと安心しても、忘れた頃に捕まるといった例が今後は多くなるのかもしれない。 ※「FRIDAYデジタル」では、皆様からの情報提供・タレコミをお待ちしています。下記の情報提供フォームまたは公式Xまで情報をお寄せ下さい。 情報提供フォーム:https://friday.kodansha.co.jp/tips 公式X:https://x.com/FRIDAY_twit FRIDAYデジタル,[],[]
″幻の作品″草彅主演ドラマ『フードファイト』が解禁！『新しい地図』サイトに「木村拓哉 」の名も…（FRIDAY）,https://news.yahoo.co.jp/articles/7eed43d73f69e3eab28e409ff8606da3fa094d4b,https://newsatcl-pctr.c.yimg.jp/t/amd-img/20260311-00000006-friday-000-2-view.jpg?exp=10800,2026-03-11T10:00:54+09:00,2026-03-11T11:20:54+09:00,FRIDAY,friday,FRIDAY,1083,名作の封印がとかれる 俳優としても定評のある『SMAP』の元メンバー・草彅剛(51) 写真は「第59回ギャラクシー賞」贈賞式でのもの 『SMAP』の元メンバー・草彅剛(51)主演のドラマ『フードファイト』(日本テレビ系、’00年〜’01年放送)シリーズが、3月6日より動画配信サービス・Huluで先行配信されることが明らかになった。多くの視聴者に愛されながらも、諸事情で″幻の作品″となっていただけに、ネットユーザーからは歓喜の声が相次いでいる。 【画像】’22年ギャラクシー賞 贈賞式で大はしゃぎの草彅剛 共演した堤真一と満面の笑み！ 同作は、草彅演じる主人公・井原満が″フードファイター″として死闘を繰り広げる姿を描いた異色ドラマ。食品会社の清掃員である傍ら、自身がお世話になった孤児院に寄付するため、大食い賭博ゲーム「フードファイト」に参加して資金を稼いでいくという物語だ。 深田恭子(43)、宮沢りえ(52)、筧利夫(63)、佐野史郎(71)らがレギュラー出演したほか、劇中の大食いバトルでは豪華なゲストも登場。脚本家・野島伸司氏(63)が企画を務め、「俺の胃袋は宇宙だ！」の決め台詞なども話題に。’00年の連続ドラマ放送後にスペシャルドラマが2本制作されるほど、支持を集めた。 「野島氏が作詞を手掛けたSMAPの『らいおんハート』が主題歌に起用されており、同曲はミリオンセラーを記録するほど大ヒットを遂げました。『フードファイト』の人気が高かったからこそ、楽曲の魅力が広まるきっかけになったのでしょう。しかし、’02年にパンの早食い競争によって中学生が死亡した事故などが影響し、ドラマは″封印状態″となってしまいました。これまでにVHS・DVD＆Blu-ray化はおろか、ネット配信なども行われておらず、『幻の名作』と言われていたんです」(芸能ライター) このようにファンが多い作品だったにもかかわらず、なかなか映像を見ることができなくなっていた『フードファイト』。ところが、’24年9月に草彅、稲垣吾郎(52)、香取慎吾(49)による『新しい地図』が日テレ系の音楽番組『with MUSIC』にゲスト出演した際にドラマの映像が流れ、SMAPファンの間で驚きの声が上がったことも。 そんな中、ここへ来て連ドラの『フードファイト』(全11話)とスペシャル版の『フードファイト 香港死闘篇』『フードファイト 深夜特急死闘篇』の一挙配信が決定。SMAPファンのみならず、『フードファイト』を知るネットユーザーが「Huluに加入せねば！」と盛り上がっている状況だ。,[],[]
『Snow Man』岩本照と『Travis Japan』松田元太が大げんか!? ドラマロケ発見撮（FRIDAY）,https://news.yahoo.co.jp/articles/a0cc3314928ef5c0b49215755fe2059a8bba1826,https://newsatcl-pctr.c.yimg.jp/t/amd-img/20260311-00000004-friday-000-2-view.jpg?exp=10800,2026-03-11T08:00:57+09:00,2026-03-11T08:35:53+09:00,FRIDAY,friday,FRIDAY,1421,〈僕はリーダーからいちばん遠い〉 『カラちゃんとシトーさんと、』でW主演の『Snow Man』岩本照と『Travis Japan』の松田元太 3月上旬、この日都心では久々に激しい雨が降った。 それもあってか、東京ドームシティ(文京区)を歩く人の姿はまばら。そんな中、サングラス姿でファッショナブルなスタイルの男が2人、何やら揉めている。黒いレザーファッションの男が不機嫌そうな顔でその場から立ち去ろうとすると、金髪メッシュの男は、縋(すが)るように後を追い、立ち止まる。そして、子どものように拗ねた顔をして、去った男に向かって大声で何か叫んでいた──。 【初共演の2人】すごい！大雨の中の撮影でも楽しそうな撮影合間の松田元太 実はこれ、3月28日からAmazonプライムで放送が始まるドラマ『カラちゃんとシトーさんと、』(全8話)の撮影風景である。立ち去る男は主演の『Snow Man』の岩本照(32)で、追い縋る男はもう一人の主演、『Travis Japan』の松田元太(26)だ。これが2人にとって、ドラマ初共演となる。 「同ドラマは、原作・高野水澄と漫画・フトンチラシによる同名漫画の実写版。趣味も性格も真反対なイケメン2人が全国各地のプライベートサウナを巡るというヒーリングコミックです。美味しいものが大好きなファッションモデル・カラちゃん(加良木蒼・からきそう)を岩本が、サウナを愛するヘアスタイリスト・シトーさん(紫桃みちる・しとうみちる)を松田が演じています」(スポーツ紙ライター) ドラマでは決して相性が良いとはいえない2人だけに、この日の撮影でも、何やら揉めている様子。終始、ムスッとした表情の岩本に対し、松田は、揶揄(からか)うような表情をしたり、拗ねて見せたり。そして、最後は絶叫に近い大声を張り上げるなど、かなりの熱演だった。 大人気グループのトップアイドル2人の撮影とあって、スタッフは周囲に目を光らせていたが、彼らに気づく人はほとんどいなかった。 3月7日にYouTubeで公開された特報映像では、雪に囲まれたサウナの“聖地”を訪れ、カラちゃんはハンバーガーにかぶりつき、シトーさんはサウナでととのい、至福の時を過ごす2人の姿を垣間見ることができる。 岩本は、番組公式ホームページで、 〈サウナがもともと好きなので、どういった感じの作品になるんだろう…とすごく興味が湧いています…これまで(松田)元太と2人で何か仕事をしたことはありませんが、もともとコミュニケーションを取り合う関係ではあるので、元太とより距離が縮まるのは純粋に楽しみです！〉 とコメント。一方、岩本と“正反対”と思う部分を聞かれた松田は、 〈照くんは、Snow Manのリーダーもされているので文字通り“リーダー気質”だと思いますが、僕はリーダーからはいちばん遠い気質だと思うので、そこが正反対だと思います〉 と、正直すぎる答え。主役2人の“相性の悪さ”もこのドラマの見どころ。それを見せられるかどうかは、2人の“相性”にかかっている。 ※「FRIDAYデジタル」では、皆様からの情報提供・タレコミをお待ちしています。下記の情報提供フォームまたは公式Xまで情報をお寄せ下さい。 情報提供フォーム:https://friday.kodansha.co.jp/tips 公式X:https://x.com/FRIDAY_twit FRIDAYデジタル,[],[]
【判決】遺族の思いはどうなった？【千葉・ネパール人男性死亡事件】交際相手の女に下された“裁き”（FRIDAY）,https://news.yahoo.co.jp/articles/8dd439dbc78d40118c42adbd792f1b7be86d8ee1,https://newsatcl-pctr.c.yimg.jp/t/amd-img/20260311-00000005-friday-000-1-view.jpg?exp=10800,2026-03-11T08:00:57+09:00,2026-03-11T08:00:57+09:00,FRIDAY,friday,FRIDAY,2059,「経緯や動機に酌むべき点は乏しい」 亡くなったバダルさん。彼の死の謎は明かされるのか──(本人のTikTokより) 交際相手だったネパール人男性、チャンタール・バダルさん(事件当時21)の自殺幇助の罪などで起訴された浅香真美被告(32)の判決公判が3月10日に千葉地裁で開かれた。 【画像】う、美しい…物憂げな眼差しでこちらを見つめるチャンタール・バダルさん 土倉健太裁判官は、「家族を説得するなど、さまざまな対応が考えられたにもかかわらず、被告人は短絡的に出刃包丁2点を用意して自殺を幇助した。このような経緯や動機に酌むべき点は乏しい」などとして、「拘禁刑2年執行猶予5年(求刑2年)」を言い渡した。 執行猶予を付けたことについては、「本件は自殺幇助の事案である」として、「被告人が罪を認めて反省の言葉を述べている」ことなどを指摘。「本件については主文の刑期の拘禁刑を言い渡したうえで、猶予期間を最長の5年とした」と述べた。 事件が発覚したのは’25年10月5日の朝8時ごろのこと。「男性が包丁で自分を刺した」との119番通報だった。救急隊員が駆けつけると、ホテルの部屋で血まみれのバダルさんがうつぶせの状態で倒れており、その場で死亡が確認された。通報したのはその場にいた浅香被告だった。現場にあった2本の包丁を「自分が万引きした」と話したことから、千葉県警は窃盗容疑で浅香被告をその場で逮捕。その後、10月28日にバダルさん殺害の容疑で逮捕した。 殺人の容疑について浅香被告は「間違いです」と否認しており、検察は浅香被告を自殺幇助と窃盗、銃刀法違反の罪で起訴した。殺人での起訴ではなかったことについて検察は「証拠に照らして判断した」としていた。 裁判について、これまで『FRIDAYデジタル』は2回にわたって報じてきた。その内容を一部再編集して振り返る──。 ’26年2月19日、千葉地裁で浅香被告の初公判が開かれた。公判にはバダルさんの親族も参加し、ネパール語の通訳を通じて、浅香被告の供述を聞いていた。 裁判では、その日に何があったのか、少しずつ明らかになった。 日本語学校の学生だったバダルさんと浅香被告が職場の工場で知り合ったのは’24年の12月。11歳年が離れた2人が交際を始めたのは、’25年3月だったという。浅香被告は交際が始まった3月には、結婚を求められていたと振り返る。 「最初に彼(バダルさん)が、『結婚』というフレーズを入れた熱いメッセージを送信してくださいました。また実際に会ったときにも、『結婚したい』というようなことを言われたりもしていました。私は好きでしたが、その頃はまだ結婚までは考えていませんでした」 バダルさんには学校があり、浅香被告もダブルワークをしていたため、会うのはもっぱらホテルだったという。被害者代理人弁護士の「2人で映画を見たり、アミューズメントパークに行ったことはありましたか」という質問には、「ありません」と答えている。 9月ごろには浅香被告はバダルさんとの結婚を考えるようになったが、周囲からは反対されていたという。浅香被告は自殺を考えるようになったきっかけが3つあるとして、こう述べていた。 「家族に反対されたこと、2人で生活するお金がなかったこと、そしてバダルさんが職場を変わったために顔を合わせる時間が減ったことです」 家族からの反対については、弁護人の質問に答えるかたちで、このように話していた。 「私の親からは、互いの文化や育ってきた環境が違うので、一緒に生活するのは難しいだろうと反対されていました。彼(バダルさん)も『あなたは何をしに日本に行ったのか』と父親から電話があり、結婚を反対されたと話してくれました」 浅香被告によると、バダルさんは「『一緒にいたい』『結婚したい』と非常にショックを受けていた」という。 そして、どちらからともなく、自殺を考えるようになった。 「『一緒にいられないんだったら死のうか』とバダルさんがネパールのククリナイフの画像を見せてくれました」(浅香被告) ククリナイフの画像を見せられたことを、「刃物を準備してほしい」というメッセージだと受け取った浅香被告は、「どうせ死ぬのだからわざわざ買う必要はない」と、10月3日、100円ショップで出刃包丁を2本、窃盗した。 10月4日の夜、ホテルでバダルさんと会うと、部屋のテーブルの上に包丁2本を並べ、「刃物を準備した」ことを告げたという。バダルさんが自殺を図ったときの様子について、浅香被告は次のように述べていた。 「ベッドで横になって2人で泣きながら話をしていると、突然、彼が起き上がって『一緒になれないんだったら死んでやる』と言って、テーブルに置いてあった包丁を手に持って胸のあたりを刺しました」 バダルさんの後を追わなかった理由については、「頭が真っ白になったため、行動することができませんでした」と語った。そして、しばらく逡巡した後、119番通報したのだという。,[],[]
大親友がまさかの「恋のライバル」に…元AKB48美女と超一軍女子の「本当の関係」（FRIDAY）,https://news.yahoo.co.jp/articles/b7cf969503fafb75f88e0a05fda823698a7fef79,https://newsatcl-pctr.c.yimg.jp/t/amd-img/20260311-00000003-friday-000-1-view.jpg?exp=10800,2026-03-11T07:30:49+09:00,2026-03-11T07:30:49+09:00,FRIDAY,friday,FRIDAY,947,2人でご飯に行ったり、家で会ったり 第2話から「まさかの展開」となった2人(ABEMA提供) モテにモテまくる人生を送ってきた美男美女16人が恋の駆け引きをする、新感覚の恋愛リアリティーショー『ラブパワーキングダム2』(ABEMA)。“指挾みキス”や“鼻ディープキス”など、ハイレベルな恋愛テクニックの数々も大きな話題になっている。 【写真】美しすぎる…！永尾まりや×林ゆめ「まりゆめ」ペア そんな『ラブキン2』を序盤からまさかの展開で盛り上げたのが、永尾まりや(31)、林ゆめ(30)の2人。FRIDAYでもグラビアを披露している「爆モテ美女」だが、実はプライベートでも仲が良い友人同士。そんな2人がまさか恋愛番組でライバル関係になるとは──。「まりゆめ」の2人に「本当の関係」を聞いてみた。 ―仲良くなったキッカケと、仲良しエピソードを教えてください。 永尾「共通の友達の紹介だと思います。最初は2人でというより仲良しなグループで遊んでいるうちに仲良くなりました。最初に話した時から合うな、価値観や生き方が私と似ているなと感じていました。 タフでお酒が好きなところもそうですが、『楽しかったらOK』という性格も似てると思います。仲良しな友達何人かで福岡旅行に行った時は朝まで遊びきりました(笑)」 林「もともと共通の友達がたくさんいて、みんなで飲むメンバーの1人でした。いつものメンバーで集まる時によく会う、という感じで。 でも『ラブキン』での共演をきっかけに、会う頻度がすごく増えました。今では2人でゴハンに行ったり、家で会ったりもします。2日連続で会う日もあります」 ―お互いの好きなところはどこですか。 永尾「飾らない素直なところです。ゆめはどの人とでも仲良くできますし、先入観や評判にとらわれず平等に接することができるところも魅力だと思います。あと、言わなくてもわかると思いますがもちろん顔もスタイルもかわいすぎて大好きです！」 林「“まりやぎ”の独特な、落ち着いた柔らかい雰囲気と話し方。聞き上手なところ。お姉さんなのに、たまに甘えてきてかわいいところ。誰にでも分け隔てなく接する優しいところや、気配りができるところ、本当にたくさんあります(笑)。あと、シンプルに顔も好きです！」,[],[]
