headline,mainEntityOfPage,image,datePublished,dateModified,author,media_en,media_jp,str_count,body,images,external_links
夏の甲子園への切符をかけて熱戦続く　全国高校野球選手権の熊本大会（TKUテレビ熊本）,https://news.yahoo.co.jp/articles/7d87aff7741fc34826902fb48df3084f20dda81b,https://newsatcl-pctr.c.yimg.jp/t/amd-img/20240708-90016356-tku-000-1-thumb.jpg?exp=10800,2024-07-08T21:20:01+09:00,2024-07-08T21:20:01+09:00,TKUテレビ熊本,tku,TKUテレビ熊本,556,\nテレビ熊本\n第１０６回を迎えた全国高校野球選手権の熊本大会。夏の甲子園への切符をかけて熱戦が始まっています。\n\n【開会式リブワーク藤崎台 ６日】\n参加６０校・５２チームが勢ぞろいした開会式。\n\nことしは５年ぶりに選手全員が参加し、入場行進を行いました。\n\n選手宣誓は九州学院高校の紫垣 俊吾 主将。\n\n「私たちのプレーで多くの人を笑顔にし、勇気を与えられるよう心を尽くし、最後の瞬間まで精一杯プレーすることを誓います。」と力強く宣誓しました。\n\n開幕ゲームは玉名工業 対 芦北。\n\n１点を争う好ゲームとなりましたが、６回に６番・間が走者一掃のタイムリー２ベースを放つなど一挙４点を挙げた芦北が５対４で勝ちました。\n\nそしてきょうの注目カードは済々黌 対 玉名。\n\n１点を追う済々黌は３回、ランナーを２人置いて４番の森。\n\nタイムリー２ベースでランナーが２人帰り、３対２と勝ち越しに成功します。\n\nさらに５回、済々黌は２アウトランナー２塁と追加点のチャンス。\n\nここで打席には再び４番・森、外の球をうまく運びました。\n\n２塁ランナーが一気に生還、貴重な追加点で４対２。このあとも着実に得点した済々黌が７回コールドで玉名を破って、２回戦進出です。\nテレビ熊本,[],[]
ビーチサッカー 九州ナンバーワンを決めるリーグ戦開幕【熊本】（TKUテレビ熊本）,https://news.yahoo.co.jp/articles/06a505ed0e822a7655f5fa3c20e59574f23f2147,https://newsatcl-pctr.c.yimg.jp/t/amd-img/20240708-90016359-tku-000-1-thumb.jpg?exp=10800,2024-07-08T21:34:01+09:00,2024-07-08T21:34:01+09:00,TKUテレビ熊本,tku,TKUテレビ熊本,617,\nテレビ熊本\n続いては砂の上の格闘技、とも呼ばれるビーチサッカーです。九州ナンバーワンを決めるリーグ戦が７日から始まりました。\n\n開幕戦ではアヴェルダージ熊本とエスターテ芦北の熊本対決が実現、熱い戦いを取材しました。\n\n【エボレパーク菊陽町・７日】\n\n先制したのは全国でもトップクラスの強豪、アヴェルダージ熊本。\n\n第１ピリオド、ことしから本格的にビーチサッカー挑戦を始めた福山隼太が右足で蹴り込みます。\n\n第２ピリオドもアヴェルダージペース。\n\nストライカーの大田 誠人がこのジャンピングボレーで追加点をゲット。\n\nさらに浮き球パスに反応すると相手ＤＦを振り切ってのダイビングヘッドでゴールを奪い、３対０と一気に突き放しにかかります。\n\n一方のエスターテ芦北も意地を見せました。\n\nアヴェルダージからレンタル移籍中の中原がボールをセットすると。\n\nこのキックインを白坂 星也がダイレクトで蹴り込む豪快なシュート。\n\n１点を返します。\n\n真夏の開幕戦にふさわしく両チームが体をぶつけあった熱い戦いは８対２でアヴェルダージ熊本が勝利。\n\n悲願の全国優勝に向け、開幕戦を白星で飾りました。\n\n九州リーグはこのあと北九州や沖縄などに舞台を移して試合が行われます。\n\n優勝チームは１１月に兵庫県明石市で行われる全国大会「地域リーグチャンピオンシップ」に出場します。\nテレビ熊本,[],[]
九州学院高校出身の堤聖也選手　世界前哨戦でＴＫＯ勝ち【熊本】（TKUテレビ熊本）,https://news.yahoo.co.jp/articles/46e87d31d1ef46cba494e0826b64a1b6e30bafbf,https://newsatcl-pctr.c.yimg.jp/t/amd-img/20240708-90016358-tku-000-1-thumb.jpg?exp=10800,2024-07-08T21:30:01+09:00,2024-07-08T21:30:01+09:00,TKUテレビ熊本,tku,TKUテレビ熊本,945,\nテレビ熊本\nプロボクシング、現在、メジャー団体全てで世界ランク入りしている九州学院高校出身の堤聖也選手。世界前哨戦でＴＫＯ勝ちし、リング上で今は亡き戦友に世界のベルト獲りを誓いました。\n\n【両国国技館東京・７日】【５６キロ契約・１０回戦】\n【ＷＢＡ世界バンタム級２位 堤 聖也ＶＳウィーラワット・ヌーレ（タイ）】\n\n今年中の世界挑戦を目指す世界ランカー堤聖也。試合前、「組み立ての中で倒したい」と話していた通り、３ラウンドに連打から左アッパーで２度のダウンを奪います。\n\n優位に試合を進めた堤は続く４ラウンドも左ボディを中心に組み立てた攻撃で２度のダウンを奪取。４ラウンド１分１３秒、ＴＫＯ勝ちを収め、世界へのテストマッチを危なげなくクリアしました。\n\n【日本タイトル戦・写真撮影：福田直樹さん】\n\n試合後には、４度目の日本タイトル防衛戦で対戦した穴口 一輝 選手に思いを馳せる場面も。\n\n【１２月のタイトルマッチ試合後に意識失い２月に死去】\n\n堤選手と１０ラウンドの激闘を演じ、その後、硬膜下血腫で亡くなった穴口選手に敬意を示し、世界のベルト獲りを誓いました。\n\n【世界前哨戦に勝利 堤聖也選手】\n「ボクシングをやってるやつらってみんな思い背負って人生背負って覚悟をもってやってるんですけど」\n\n「そのぶつかる姿に人は『美しい』という感情を抱いてしまう。それがボクシングの魅力だと思うし、その競技を今も続けられてることに感謝して誇りに思います。」\n\n「本物のチャンピオンたちに勝って僕も世界チャンピオンになります。今後とも注目していてください。きょうはありがとうございました。」\n\n堤選手、まずは世界前哨戦お疲れ様でした。\n\n去年１２月に行われた堤選手と穴口選手の日本タイトルマッチは、穴口選手が亡くなる直前に年間最高試合に選ばれています。\n\n穴口選手とご家族の思いも背負って、堤選手にはぜひ世界を目指していただきたいと思います。\n\n現在バンタム級は主要４団体全てのチャンピオンが日本人です。\n\n堤選手はこのうち、井上 尚弥 選手の弟でＷＢＡのチャンピオン井上 拓真 選手へ挑戦したい意向を示しています。\nテレビ熊本,[],[]
剣道世界選手権大会 九州学院高校出身の星子啓太選手が初の世界一【熊本】（TKUテレビ熊本）,https://news.yahoo.co.jp/articles/0e04baf3ae8a5dc912901e04a2a61c91d6211ab9,https://newsatcl-pctr.c.yimg.jp/t/amd-img/20240708-90016357-tku-000-1-thumb.jpg?exp=10800,2024-07-08T21:25:01+09:00,2024-07-08T21:25:01+09:00,TKUテレビ熊本,tku,TKUテレビ熊本,368,\nテレビ熊本\nイタリアで開催された剣道の世界選手権大会で九州学院高校出身の星子啓太選手が優勝し初の世界一に輝きました。\n\n星子選手は現在警視庁に所属する２５歳、高校や大学で日本一となり２０２１年には全日本選手権でも優勝、今回初めて世界の頂点に立ちました。\n\nまた星子選手は団体でも優勝に貢献しています。\n\n星子選手はＴＫＵの取材に「今はホッとしている。１日だけ運が良かっただけで世界一の実感はない。今後も一から稽古に励みたい」とコメント。\n\n現地で応援していた九州学院剣道部の米田敏郎監督は「ピンチの時に目が合いそこからピンチを切り抜けた。教え子が初めて世界一になり喜びもひとしおです」と述べました。\n\n一方、女子でも熊本県警の渡邊タイ選手がキャプテンで大将を務め団体戦で見事世界一に輝いています。\nテレビ熊本,[],[]
早く大きくなって！　マダイの稚魚とクルマエビの稚エビを放流【熊本】（TKUテレビ熊本）,https://news.yahoo.co.jp/articles/b2d624148ff1dca058a0428653171ff31bbd7ce4,https://newsatcl-pctr.c.yimg.jp/t/amd-img/20240708-90016360-tku-000-1-thumb.jpg?exp=10800,2024-07-08T21:37:02+09:00,2024-07-08T21:37:02+09:00,TKUテレビ熊本,tku,TKUテレビ熊本,305,\nテレビ熊本\n天草郡苓北町では高校生と小学生がマダイの稚魚とクルマエビの稚エビを放流しました。\n\nこれは、県立天草拓心高校が生徒と地元の小学生に海洋生物や海洋環境について関心を持ってもらおうと毎年行っているものです。\n\nこの日は海洋科学科栽培・食品コース３年の生徒１３人が、近くの富岡小学校の５年生の児童１９人に、マダイとクルマエビについて説明。\n\nその後、砂浜に移動し、生徒たちが実習で育てた体長およそ３センチのマダイの稚魚２００匹と、体長２センチほどのクルマエビの稚エビおよそ５０００匹を放流しました。\n\n参加した児童は「早く大きくなってほしいです」などと話していました。\nテレビ熊本,[],[]
逮捕監禁の疑いで男女２人を逮捕【熊本】（TKUテレビ熊本）,https://news.yahoo.co.jp/articles/ae769a4c253a7b092f10724727ac52fe59dc3e45,https://newsatcl-pctr.c.yimg.jp/t/amd-img/20240708-90016354-tku-000-1-thumb.jpg?exp=10800,2024-07-08T21:12:01+09:00,2024-07-08T21:12:01+09:00,TKUテレビ熊本,tku,TKUテレビ熊本,324,\nテレビ熊本\n逮捕監禁の疑いで男女２人を逮捕です。\n\n警察によりますと、鹿児島県に住む自営業、森 和孝 容疑者（４０）とパートの若松 梢 容疑者（３４）は、７月１日、熊本県内に住む３０代の女性を無理やり車に連れ込むなどして不法に逮捕監禁した疑いが持たれています。\n\n八代市から水俣市の間、午後４時～午後５時半ごろ\n\n女性が連れ込まれた八代市の現場付近で、「助けてという声が聞こえた」という通報を受け、警察が捜査。\n\n防犯カメラの映像などから、警察は７日までに２人を逮捕しました。\n\n女性は７日午後、水俣市内で保護されました。\n\n森容疑者は女性の元交際相手で、調べに対し２人は容疑を認めているということです。\nテレビ熊本,[],[]
『電話でお金詐欺』被害防ぎ感謝状　多良木町のコンビニ【熊本】（TKUテレビ熊本）,https://news.yahoo.co.jp/articles/48a0306491ce322db65fc17fdd6d961f6fb6054c,https://newsatcl-pctr.c.yimg.jp/t/amd-img/20240708-90016355-tku-000-1-thumb.jpg?exp=10800,2024-07-08T21:18:02+09:00,2024-07-08T21:18:02+09:00,TKUテレビ熊本,tku,TKUテレビ熊本,279,\nテレビ熊本\n『電話でお金詐欺』の被害を未然に防いだとしてファミリーマートサンロード多良木店の川辺 匠 店長と店員の寺田ゆかりさんに警察から感謝状が手渡されました。\n\n寺田さんは今年３月、１万円分の電子マネーカードを購入しようとした６０代の女性に声をかけたところ女性は「１００万円の融資を受ける手数料として指示された」と話したということです。\n\nこれを不審に思った寺田さんは女性に購入を思いとどまらせ、詐欺被害を未然に防ぎました。\n\n寺田さんは「詐欺を防ぐことができて良かったです。これからも注意していきます」と話していました。\nテレビ熊本,[],[]
国内最大級の薪窯で焼き立てのピザ　『ＵＢＵＹＡＭＡ　ＰＬＡＣＥ』オープンへ【熊本】（TKUテレビ熊本）,https://news.yahoo.co.jp/articles/cbb98a07e2222606685344c87eb102f698fff9e2,https://newsatcl-pctr.c.yimg.jp/t/amd-img/20240708-90016353-tku-000-1-thumb.jpg?exp=10800,2024-07-08T21:12:01+09:00,2024-07-08T21:12:01+09:00,TKUテレビ熊本,tku,TKUテレビ熊本,433,\nテレビ熊本\n阿蘇郡産山村の観光施設、『うぶやま牧場』が７月１３日にリニューアルオープンします。\n\nオープンを前に７日、地元の子どもたちを招いたセレモニーがありました。\n\n『うぶやま牧場』はレストランなどを改装し観光施設、『ＵＢＵＹＡＭＡ ＰＬＡＣＥ』としてリニューアルオープンします。\n\n７日は、地元の子供たちなどを招いたセレモニーが開かれ関係者がテープカットしてリニューアルを祝いました。\n\n改装されたレストランにはピザの本場、イタリアから輸入した国内最大級の薪窯が\n新たに備えられ熟練の職人が焼き立てのピザを提供します。\n\nまた、東京で人気のカフェなどが新たにオープンします。\n\n会場では、この日、招待された地元の子どもや保護者が産山村で作られたチーズなどを使ったできたてのピザを何枚も試食していました。\n\n観光施設『ＵＢＵＹＡＭＡ ＰＬＡＣＥ』は７月１３日にオープン。営業時間は、午前８時から午後８時までです。\nテレビ熊本,[],[]
伊藤環境相が水俣病胎児性小児性患者団体と再懇談【熊本】（TKUテレビ熊本）,https://news.yahoo.co.jp/articles/dfe6b450cf0d99cd660d18a4de6c010ceab7f81c,https://newsatcl-pctr.c.yimg.jp/t/amd-img/20240708-90016351-tku-000-1-thumb.jpg?exp=10800,2024-07-08T21:09:01+09:00,2024-07-08T21:09:01+09:00,TKUテレビ熊本,tku,TKUテレビ熊本,815,\nテレビ熊本\n伊藤大臣が訪ねたのは患者団体の一つである「水俣病胎児性小児性患者・家族・支援者の会」。\n\n自身も胎児性患者で代表を務める松永 幸一郎さんなど７人と約１時間、意見交換しました。\n\n【「水俣病胎児性小児性患者・家族・支援者の会」 藤枝静香さん（６２）】\n「母は『自分たちが売っていた魚を食べて他に水俣病に罹患している人がいるなら大変ばい。自分たち家族は村八分になるばい』とも言っていました」\n\n八代市で生まれ、両親が不知火海でとれた魚の行商をしていたという藤枝 静香さんは水俣病の症状に苦しみながらも「公健法」に基づく患者認定申請は棄却され、現在、不服申し立てをしています。\n\n同じく、症状を抱えながらも水俣病と認められることなく亡くなった母親の話をしながら切実な胸の内を大臣に訴えました。\n\n【「水俣病胎児性小児性患者・家族・支援者の会」藤枝静香さん（６２）】\n「目の前の患者にしっかり向き合ってほしい。寄り添って、私たちを見てください」また、認定患者についても進行していく症状に合わせて「補償ランク」を変更してほしい、などの声が上がり、伊藤大臣が涙ぐむような様子も見られました。\n\n【「水俣病胎児性小児性患者・家族・支援者の会」松永幸一郎 代表（６１）】\n「環境大臣は毎年代わっているがちゃんとこのことを引き継いでもらいまだまだ解決していない水俣病をこれを機に解決してほしい」午後からもそれぞれの団体と意見交換をした伊藤大臣。受け止めについて尋ねられ次のように述べました。\n\n【伊藤 環境相】\n「苦しんでいるみなさんの現状をつぶさに聞いて呼吸ができなくなると言えば大げさだが胸が締め付けられる思い」「一筋縄では解決できない課題がたくさんあると思うが顔を合わせて話をすることで理解を深めて、そのことが水俣病問題を前進させるエネルギーと信頼関係の構築に繋がると思う」\nテレビ熊本,[],[]
船舶用エンジン燃費データ改ざん　日立造船子会社に国交省が立ち入り【熊本】（TKUテレビ熊本）,https://news.yahoo.co.jp/articles/a18da785de1aa12ad4573ce03b51ac44dc17c922,https://newsatcl-pctr.c.yimg.jp/t/amd-img/20240708-90016352-tku-000-1-thumb.jpg?exp=10800,2024-07-08T21:12:01+09:00,2024-07-08T21:12:01+09:00,TKUテレビ熊本,tku,TKUテレビ熊本,407,\nテレビ熊本\n日立造船の子会社が船舶用エンジンの燃費に関するデータを改ざんしていたことが明らかになりました。この問題を受けて、８日、国交省は長洲町にある子会社に立ち入り調査を行いました。\n\n【熊本 竜太 リポート】\n「国交省と九州運輸局の職員が日立造船の子会社『日立造船マリンエンジン』調査に入ります」\n\n立ち入り調査が行われたのは長洲町にある日立造船の子会社で船舶エンジンを手掛ける「日立造船マリンエンジン」の工場です。\n\n国交省などによりますと、この会社や、同じく子会社の「アイメックス」では、１９９９年９月以降に出荷された船舶用エンジン１３６４台で、「燃料消費率」に関するデータの書き換えが行われていたことが判明しています。\n\nデータのばらつきを抑える目的などで２０年以上書き換えが行われていたということです。国交省は、関係者から話を聞くなどして事実関係を調査しています。\nテレビ熊本,[],[]
出自を知る権利の検討会　”誰が・いつまで・どのように”保存するか議論（TKUテレビ熊本）,https://news.yahoo.co.jp/articles/3a894d8ea13d0ebb4e7ed80e20aef2d45f005906,https://newsatcl-pctr.c.yimg.jp/t/amd-img/20240708-90016350-tku-000-1-thumb.jpg?exp=10800,2024-07-08T21:00:01+09:00,2024-07-08T21:00:01+09:00,TKUテレビ熊本,tku,TKUテレビ熊本,542,\nテレビ熊本\n熊本市の慈恵病院が運用する『こうのとりのゆりかご』や『内密出産』をめぐる、子どもの出自を知る権利についての検討会が開かれ、情報の保存や開示方法について議論が交わされました。\n\n熊本市と慈恵病院による検討会では、出自を知る権利について一定の指針をつくろうと、議論が続られています。\n\n会は非公開で行われ、７月８日の８回目の会合では、現在は慈恵病院が保存している母親の情報を誰が・いつまで・どのように保存するのか。\n\nまた、子どもは何歳で開示請求できるのかといった内容について意見が交わされました。\n\n保存については氏名や生年月日といった『母親の身元を特定する情報』と、預けられた経緯や子どもへの手紙など『特定には至らない情報』を分けて保存すべきという意見で一致したということです。\n\n石黒大貴委員（弁護士）「開示するときの（母親の）同意の問題もあるし、特定に至らないとする情報でも漏れ出る可能性もある。慎重に分けないといけないと個人的に思う」\n\nまた、子どもがいつの時期に、どこまで知りたいのか、当時者へのアンケートを行い議論を深めることを決めました。\n\n次回の検討会は８月１０日に開催、２０２４年１２月に結論を示す方針です。\nテレビ熊本,[],[]
球磨郡多良木町で住宅１棟を全焼【熊本】（TKUテレビ熊本）,https://news.yahoo.co.jp/articles/6db445eb6fc02bb4a4c347f41852d2ea9d760225,https://newsatcl-pctr.c.yimg.jp/t/amd-img/20240708-90016347-tku-000-1-thumb.jpg?exp=10800,2024-07-08T12:51:01+09:00,2024-07-08T12:51:01+09:00,TKUテレビ熊本,tku,TKUテレビ熊本,236,\nテレビ熊本\n７日夜、球磨郡多良木町で住宅１棟を焼く火事がありました。けが人はいませんでした。７日午後１１時１０分ごろ多良木町多良木で「建物が燃えている」と近くの住人から消防に通報がありました。\n\n火は農業 宮村 幸治さん（７６）の木造２階建ての住宅およそ１５０平方メートルを焼き、およそ１時間２０分後に消し止められました。\n\n警察によりますと宮村さんは９０代の父親と２人暮らしで出火当時、２人とも家にいましたが火事に気づき逃げ出して無事でした。\nテレビ熊本,[],[]
伊藤環境相 小児性患者の田中 実子さんらと面会【熊本】（TKUテレビ熊本）,https://news.yahoo.co.jp/articles/946724db9738abab472022700b274b34d7c6234b,https://newsatcl-pctr.c.yimg.jp/t/amd-img/20240708-90016349-tku-000-1-thumb.jpg?exp=10800,2024-07-08T20:24:01+09:00,2024-07-08T20:24:01+09:00,TKUテレビ熊本,tku,TKUテレビ熊本,473,\nテレビ熊本\n伊藤大臣はその後、水俣病の公式確認のきっかけとなった小児性患者の田中 実子さんと面会。実子さんはヘルパーによる２４時間態勢での介護が必要で、立ち会った関係者が支援の拡充を求めたということです。\n\nなお、田中 実子さんに環境行政のトップが会うのは１９７２年当時の大石 武一 環境庁長官が面会して以来、実に５２年ぶりです。\n\nまた、伊藤大臣は水俣病互助会のメンバーとも個別に面会。\n\n小児性患者の岩本 昭則会長は水俣病を理由に学校や職場などで差別やいじめを受けたことを明かしました。\n\n【坂本 しのぶさん】\n「何十年も水俣病で苦しんできました」\n\n胎児性患者の坂本しのぶさんは「水俣病に認定されていない人がたくさんいる。ちゃんとしてほしい」と国に未認定患者の救済を迫りました。\n\nまた、田中 実子さんを支えてきた義理の兄で認定患者の下田 良雄さんも「制度を見直して苦しんでいる人を救ってほしい」と訴えました。\n\nこれに対し伊藤大臣は「しっかり受け止めた。共に進めていきたい」と述べました。\nテレビ熊本,[],[]
日立造船子会社が船舶用エンジン燃費データを改ざんしていた問題で国交省が立ち入り調査【熊本】（TKUテレビ熊本）,https://news.yahoo.co.jp/articles/63b2a9350b2401937476d5b03d3571adbb5760b5,https://newsatcl-pctr.c.yimg.jp/t/amd-img/20240708-90016346-tku-000-1-thumb.jpg?exp=10800,2024-07-08T12:46:01+09:00,2024-07-08T12:46:01+09:00,TKUテレビ熊本,tku,TKUテレビ熊本,331,\nテレビ熊本\n日立造船の子会社が船舶用エンジンの燃費に関するデータを改ざんしていた問題で、国交省が長洲町にある子会社に立ち入り調査を行いました。\n\n立ち入り調査が行われたのは長洲町にある日立造船の子会社で船舶エンジンを手掛ける「日立造船マリンエンジン」の工場です。\n\n国交省などによりますと、この会社や、同じく子会社の「アイメックス」では、\n１９９９年９月以降に出荷された船舶用エンジン１３６４台で、「燃料消費率」に関するデータの書き換えが行われていたことが判明しています。\n\nデータのばらつきを抑える目的などで２０年以上書き換えが行われていたということです。\n\n国交省は、関係者から話を聞くなどして事実関係を調査しています。\nテレビ熊本,[],[]
