headline,mainEntityOfPage,image,datePublished,dateModified,author,media_en,media_jp,str_count,body,images,external_links
日本ミニアルバムを発売！ 韓国俳優ソ・イングクのビジュアル遍歴（ELLE DIGITAL）,https://news.yahoo.co.jp/articles/493b76dc2050e6f5b4d304feb8704f27b72fa8e9,https://newsatcl-pctr.c.yimg.jp/t/amd-img/20240831-00010003-elleonline-000-1-view.jpg?exp=10800,2024-08-31T20:40:49+09:00,2024-08-31T20:40:49+09:00,ELLE DIGITAL,elleonline,ELLE DIGITAL,909,\n2024年8月30日、韓国の人気俳優ソ・イングクがミニアルバム『SIGnature』をリリース！ 「応答せよ1997」や「ショッピング王ルイ」など数多くのドラマで主演を務めた人気俳優でありながら、音楽オーディション番組で72万人の頂点に輝くほど高レベルの歌唱力の持ち主。昨年日本デビュー10周年を記念し、シングル発売やファンコンサートなど精力的に日本活動を行い、日本人気をあらためて証明！ そんなソ・イングクのデビューから15年間のビジュアル遍歴を一挙大公開。\n【写真】キス職人の異名をもつ、ソ・イングクの歴代フォトギャラリー\n2009年10月12日\nAflo\n2009年に出場した歌唱コンテスト「スーパースターK」で72万人の頂点に輝き、芸能界デビューを果たしたソ・イングク。デビュー当時、大流行していたソフトリーゼントヘアに、笑うと目がなくなる愛嬌たっぷりな笑顔をカメラに向ける姿がどこかぎこちなくてキュート♡\n2012年3月22日\nGetty Images\nドラマ「ラブレイン」の記者会見にて。トップからレイヤーをたっぷり入れて、前髪はアシンメトリーにカットし、すっきりクールにイメチェン。\n2016年12月30日\nAflo\n男性優秀賞を受賞した「MBC演技大賞」では、つややかに固めたオールバックヘアで、フォーマルな場にふさわしい装いに。ブラウン眉で目元の印象を和らげつつ、ピンクリップで上品な華やぎをプラス。\n2022年8月29日\nGetty Images\n映画『オオカミ狩り』の記者会見では、少しふっくらとした姿を公開。レイヤーをたっぷり入れて透け感を出した前髪によって、眉と目の鋭さが際立っている様子。\n2023年12月12日\nGetty Images\nドラマ「もうすぐ死にます」の記者会見では、結膜炎の目を隠すようにゆるふわパーマヘアで目周りを覆ったことで、ミステリアスなムードに。\n2024年8月12日\nAflo\n新バラエティ番組「ジャングルご飯」の制作発表会にて。くるくると巻いた襟足長めのヘアに、メタルフレームメガネをかけた遊び心あふれるスタイルが新鮮！,"['https://newsatcl-pctr.c.yimg.jp/t/amd-img/20240831-00010003-elleonline-000-1-view.jpg?pri=l&w=426&h=640&exp=10800', 'https://newsatcl-pctr.c.yimg.jp/t/amd-img/20240831-00010003-elleonline-001-1-view.jpg?pri=l&w=426&h=640&exp=10800', 'https://newsatcl-pctr.c.yimg.jp/t/amd-img/20240831-00010003-elleonline-002-1-view.jpg?pri=l&w=509&h=640&exp=10800', 'https://newsatcl-pctr.c.yimg.jp/t/amd-img/20240831-00010003-elleonline-003-1-view.jpg?pri=l&w=426&h=640&exp=10800', 'https://newsatcl-pctr.c.yimg.jp/t/amd-img/20240831-00010003-elleonline-004-1-view.jpg?pri=l&w=426&h=640&exp=10800', 'https://newsatcl-pctr.c.yimg.jp/t/amd-img/20240831-00010003-elleonline-005-1-view.jpg?pri=l&w=426&h=640&exp=10800']","['https://bit.ly/3Mtw5xM', 'https://news.yahoo.co.jp/articles/493b76dc2050e6f5b4d304feb8704f27b72fa8e9/images/000', 'https://news.yahoo.co.jp/articles/493b76dc2050e6f5b4d304feb8704f27b72fa8e9/images/001', 'https://news.yahoo.co.jp/articles/493b76dc2050e6f5b4d304feb8704f27b72fa8e9/images/002', 'https://news.yahoo.co.jp/articles/493b76dc2050e6f5b4d304feb8704f27b72fa8e9/images/003', 'https://news.yahoo.co.jp/articles/493b76dc2050e6f5b4d304feb8704f27b72fa8e9/images/004', 'https://news.yahoo.co.jp/articles/493b76dc2050e6f5b4d304feb8704f27b72fa8e9/images/005']"
祝20歳！ 天性のアイドル、IVEウォニョンの最新ファッション（ELLE DIGITAL）,https://news.yahoo.co.jp/articles/706375bab1edba162cc2277101b36ad82a040676,https://newsatcl-pctr.c.yimg.jp/t/amd-img/20240831-00010006-elleonline-000-1-view.jpg?exp=10800,2024-08-31T23:35:21+09:00,2024-08-31T23:35:21+09:00,ELLE DIGITAL,elleonline,ELLE DIGITAL,650,\n2024年8月31日に20歳の誕生日を迎えたIVE（アイヴ）の絶対的エースでセンターを務めるウォニョン。音楽番組や授賞式で司会を務めるほか、「ミュウミュウ」のアンバサダーや、韓国コスメブランド「イニスフリー」のミューズとしても世界を飛び回る第4世代K-POPアイドルを代表する存在。そんな全方位から注目を集める天性のアイドル、ウォニョンの最新ファッションをお届け！\n【写真】”完成型”グループ！ IVEメンバーのファッション＆プロフィールを総まとめ\n2024年8月23日\nPhoto: Aflo\nティーンから大人気の韓国ブランド「スリータイムス」のフリルトップスを着用し、ヘルシーな肌見せを楽しむウォニョン。アンバサダーを務める「ミュウミュウ」のバッグはダークブラウンカラーをチョイスして秋を先取り。\n\nトップス／スリータイムス（threetimes）\nバッグ／ミュウミュウ（MIUMIU）\n2024年8月16日\nPhoto: Aflo\nホルターネックトップにストールを一巻きして長く垂らしたスタイリッシュかつ最先端な着こなしで空港中の視線を独占！\n\nトップス／シオ（SIO）\nパンツ／ランウェイチケット（RUNWAY TICKET）\nバッグ／ミュウミュウ（MIUMIU）\n2024年7月5日\nPhoto: Aflo\nアーガイル柄の半袖ニットを主役に、足もとはミニスカート＆白のハイソックスでプレッピーな装いに仕上げて。\n\n全身／ミュウミュウ（MIUMIU）,"['https://newsatcl-pctr.c.yimg.jp/t/amd-img/20240831-00010006-elleonline-000-1-view.jpg?pri=l&w=426&h=640&exp=10800', 'https://newsatcl-pctr.c.yimg.jp/t/amd-img/20240831-00010006-elleonline-001-1-view.jpg?pri=l&w=427&h=640&exp=10800', 'https://newsatcl-pctr.c.yimg.jp/t/amd-img/20240831-00010006-elleonline-002-1-view.jpg?pri=l&w=426&h=640&exp=10800']","['https://bit.ly/4e6KD28', 'https://news.yahoo.co.jp/articles/706375bab1edba162cc2277101b36ad82a040676/images/000', 'https://news.yahoo.co.jp/articles/706375bab1edba162cc2277101b36ad82a040676/images/001', 'https://news.yahoo.co.jp/articles/706375bab1edba162cc2277101b36ad82a040676/images/002']"
ヨルダン王室・ラーニア王妃の才色兼備なヘア＆メイクを学生時代からプレイバック（ELLE DIGITAL）,https://news.yahoo.co.jp/articles/e5aa5593a4a0a38dcd5ef9702d1dd85108829ff1,https://newsatcl-pctr.c.yimg.jp/t/amd-img/20240831-00010005-elleonline-000-1-view.jpg?exp=10800,2024-08-31T21:02:56+09:00,2024-08-31T21:02:56+09:00,ELLE DIGITAL,elleonline,ELLE DIGITAL,1758,\n2024年8月、フセイン皇太子とラジワ妃の間に待望のイマン王女が誕生し、歓喜に沸いたヨルダン王室。ひときわ輝いているのは、多大な影響力をもつ才色兼備なラーニア王妃。国内外で公務に励み、慈善活動にも取り組む知性派の彼女の、8月31日の54歳のバースデーを記念して、学生時代から現在までのヘアメイクを一挙、プレイバック！\n【写真】ラーニア王妃ほか、ロイヤルレディーたちのアイコニックなヘアスタイル15\n1991年\nAflo\n1970年にクウェートで、パレスチナ人医師の娘として生まれたラーニア王妃。ニュー・イングリッシュ・スクールを経て、カイロのアメリカン大学で経営学を学んでいた頃から、知性あふれる美貌は顕在。\n1993年\nGetty Images\n大学を卒業後、アンマンのシティバンクに勤務していたときに知人のパーティでアブドゥッラー現国王と知り合い、半年間の交際を経てめでたく結婚。ヨルダンのトラディショナルなドレスを纏い、まばゆいほどのオリエンタルビューティを究めて。\n2000年\nAflo\n9月にサルマ王女が誕生して間もない頃、3人の子どもたちとともに。王妃といえば、キリッと知性的な表情が印象的だけれど、このときは母性あふれるママらしさが炸裂。ナチュラルなストレートヘアで、やさしい笑顔を浮かべて。\n2005年\nGetty Images\n世界経済フォーラムにて演説する王妃。アップヘアと目力強めのメイクで、パワフルなアティテュードを演出しつつ後れ毛を残すことで、抜け感を添えているのがお上手。なおこの年に第4子となるハーシム王子を出産。\n2010年2月\nGetty Images\n王妃自ら発足した「1GOAL：万人のための教育」の活動にて。このキャンペーンでは、教育を受けるのが困難な世界の子どもたちを、サッカーを通じてサポート。\n\n大きくカールさせたヘアに、ボリュームまつ毛で目をドーリーに見せるクラシカルなビューティルックは、いつにも増して艶やかで女性らしいアティテュード。\n\nこの年の9月に開催された国連ミレニアム開発目標レビューサミットでは、世界銀行やオーストラリア政府が教育支援への増額を発表するなど、王妃の多大な影響力を物語るエピソードも。\n2017年4月\nGetty Images\n王妃には珍しいポニーテールを披露したのは、当時のトランプ米大統領とメラニア夫人と面会したとき。さすが社交の達人！ サイドやバックをふわっと膨らませてソフトに見せ、親近感を演出している様子。メラニア夫人とも会話が弾んでいるよう。\n2019年7月\ncourtesy of Queen Rania Al Abdullah via instagram\nアンマンからエルサレムへと向かう途中の街、アルソルトにて女性や若者たちと触れ合ったこの日、ナチュラルヘアを軽やかになびかせて。訪れる街や人々に寄り添うファッションとメイクをセレクトしているところに、王妃の愛や知性を感じさせる。\n2021年11月\ncourtesy of queenrania via Instagram\nチャールズ皇太子（当時）とカミラ夫人を招いた晩餐会にて、ヨルダンの伝統的な衣装に身を包んだ王妃。ストレートヘアをオールバックにして、ゴールデンバランスの美貌をアピール。\n2024年5月\nGetty Images\nイーロン・マスクなどが出席し、生成AIの台頭から電気自動車のトレンドに至るまで、さまざまなトピックが議論されたミルケン研究所の世界会議で講演。顔まわりのヘアを立ち上げた、知性美を強調するヘアスタイルで、トークも白熱した様子。\n2024年8月\ncourtesy of queenrania via Instagram\n待望の初孫で、フセイン皇太子とラジワ妃の間に誕生したばかりのベビー、イマン王女を抱っこして。喜びいっぱいのコメントをSNSで公開した王妃、ツヤたっぷりのヌードリップでビッグスマイルを見せていた。\n\n精力的に外交を重ねる一方で、慈善活動にも力を注ぐラーニア王妃。グランドマザーとなってますますパワフルかつエレガントな姿を見せてくれるに違いない。,"['https://newsatcl-pctr.c.yimg.jp/t/amd-img/20240831-00010005-elleonline-000-1-view.jpg?pri=l&w=455&h=640&exp=10800', 'https://newsatcl-pctr.c.yimg.jp/t/amd-img/20240831-00010005-elleonline-001-1-view.jpg?pri=l&w=417&h=640&exp=10800', 'https://newsatcl-pctr.c.yimg.jp/t/amd-img/20240831-00010005-elleonline-002-1-view.jpg?pri=l&w=640&h=529&exp=10800', 'https://newsatcl-pctr.c.yimg.jp/t/amd-img/20240831-00010005-elleonline-003-1-view.jpg?pri=l&w=638&h=640&exp=10800', 'https://newsatcl-pctr.c.yimg.jp/t/amd-img/20240831-00010005-elleonline-004-1-view.jpg?pri=l&w=512&h=640&exp=10800', 'https://newsatcl-pctr.c.yimg.jp/t/amd-img/20240831-00010005-elleonline-005-1-view.jpg?pri=l&w=640&h=639&exp=10800', 'https://newsatcl-pctr.c.yimg.jp/t/amd-img/20240831-00010005-elleonline-006-1-view.jpg?exp=10800', 'https://newsatcl-pctr.c.yimg.jp/t/amd-img/20240831-00010005-elleonline-007-1-view.jpg?pri=l&w=513&h=640&exp=10800', 'https://newsatcl-pctr.c.yimg.jp/t/amd-img/20240831-00010005-elleonline-008-1-view.jpg?pri=l&w=640&h=637&exp=10800', 'https://newsatcl-pctr.c.yimg.jp/t/amd-img/20240831-00010005-elleonline-009-1-view.jpg?pri=l&w=512&h=640&exp=10800']","['https://bit.ly/4g01LZr', 'https://news.yahoo.co.jp/articles/e5aa5593a4a0a38dcd5ef9702d1dd85108829ff1/images/000', 'https://news.yahoo.co.jp/articles/e5aa5593a4a0a38dcd5ef9702d1dd85108829ff1/images/001', 'https://news.yahoo.co.jp/articles/e5aa5593a4a0a38dcd5ef9702d1dd85108829ff1/images/002', 'https://news.yahoo.co.jp/articles/e5aa5593a4a0a38dcd5ef9702d1dd85108829ff1/images/003', 'https://news.yahoo.co.jp/articles/e5aa5593a4a0a38dcd5ef9702d1dd85108829ff1/images/004', 'https://news.yahoo.co.jp/articles/e5aa5593a4a0a38dcd5ef9702d1dd85108829ff1/images/005', 'https://news.yahoo.co.jp/articles/e5aa5593a4a0a38dcd5ef9702d1dd85108829ff1/images/006', 'https://news.yahoo.co.jp/articles/e5aa5593a4a0a38dcd5ef9702d1dd85108829ff1/images/007', 'https://news.yahoo.co.jp/articles/e5aa5593a4a0a38dcd5ef9702d1dd85108829ff1/images/008', 'https://news.yahoo.co.jp/articles/e5aa5593a4a0a38dcd5ef9702d1dd85108829ff1/images/009']"
おいしくないのはなぜ？ 機内食の味が変わる3つの要因（ELLE DIGITAL）,https://news.yahoo.co.jp/articles/0aa8ed1f6e8b23a5f879b2536446da6ca3a07a45,https://newsatcl-pctr.c.yimg.jp/t/amd-img/20240831-00010004-elleonline-000-1-view.jpg?exp=10800,2024-08-31T20:50:03+09:00,2024-08-31T20:50:03+09:00,ELLE DIGITAL,elleonline,ELLE DIGITAL,2115,\n機内食の味が変わる要因\n※この記事は、海外のサイト『delish』で掲載されたものの翻訳版です。データや研究結果はすべてオリジナル記事によるものです。\n \n好きな食事が機内食だという人はほとんどいないはず。機内食とは作り置きの食事を温め直し、紙の容器と頼りないプラスチックのカトラリーと共に提供されるもので、食事体験全体として期待を下回る場合が多い。とはいえ、何千メートルもの上空だと食べ物の味が悪くなるのは、誰もが知っている理由のほかにあまり知られていないものも存在する。\n \n食べ物の美味しさに関わるのは味蕾だけだと思うかもしれないけれど、味蕾は単なる一要素に過ぎない。モネル・ケミカル・センシズ・センターの博士研究員であるロバート・ペレグリーノ博士によると、視覚、嗅覚、味覚、食感、すべてが一緒に働くことで風味を認識できるという。飛行中はこれらの感覚がマイナスの影響を受けることから、食事体験の悪化につながる。たしかに、もともと機内食は最高においしいものではないけれど、飛行中の環境もあまりいいとは言えなさそう。\n機内だと食べ物の味が変わるのはどうして？\nGetty Images\nペレグリーノ博士によると、飛行中の感覚に影響を与える3つの要因は、機内の低い気圧、湿度不足、高い騒音レベルだそう。気圧と湿度が低いと、嗅覚に影響が出る場合がある。たとえば、鼻の中の湿り気が少ない乾燥性鼻炎では、匂い物質が通りにくくなる。またご存知の通り、嗅覚と味覚は密接に関係している。飛行機での食事がおいしかったとしても、自宅で食べるのとは味が違うと感じるかもしれない。\n \n「アルコール濃度を感知する能力に音が影響することが分かっていますが、味覚にも影響を及ぼします」とペレグリーノ博士。騒音によって味覚がどんな影響を受けるかをテストした2015年の研究では、航空機の客室内の騒音をシミュレートした環境で、実験参加者にさまざまな溶液を味見してもらった。その結果、参加者は甘味の減少とうま味の増加を感じたことが判明し、これには鼓索神経が関係しているという。舌から中耳まで伸びるこの神経は、大きな音によって影響を受ける可能性があり、この神経に乱れが生じると味覚に影響が出る。そのため次回飛行機に乗る際は、隣の赤ちゃんが泣き止むまで食事を控えたほうがいいかもしれない。\n機内食専用に作られた食べ物と飲み物\nGetty Images\nこうした味覚障害に対抗するため、機内で楽しめるように考案されたメニューを提供する航空会社が増えている。アラスカ航空ではここ1年ほど、「スタンプタウン・コーヒー・ロースターズ」と「フレモント・ブリューイング」と提携し、機内専用のコーヒーとビールを製造している。\n \n「フレモント・ブリューイング」は長年アラスカ航空にビールを供給してきたが、初めて同航空会社専用に醸造した特注クラフトビールが「クラウド・クルーザー」だそう。このビールを開発する際、「フレモント・ブリューイング」の創設者兼最高経営責任者のマット・リンスカムさんは、麦芽原料（大麦と穀物）とホップの2つに力を入れた。\n \n「色の濃い麦芽を使用すると、とくに高度の高い場所では、腐敗や段ボールのようなビールの味に感じてしまう恐れがあります」と彼は話す。これに対応するため、開発チームはビールから濃い色の穀物をすべて排除し、軽くて淡色のツーロウ・ペール・モルトとミュンヘン・モルトを残した。\n \nさらに開発チームは、空の上でも新鮮な風味が持続するホップ（シトラス、シムコー、ブラボー）を選んだ。「この3種類のホップは、高度の飛行の厳しさに耐えることができます」と彼は話す。「味が落ちず、カビ臭くならず、爽やかですっきりとした飲み心地です」\n \nまた彼らは、「クラウド・クルーザー」のアルコール度数も考慮する必要があったそう。「アルコール度数が低すぎるビールは飛行中の圧力に耐えられず、すぐに味が薄くなります」と彼は話す。「逆にアルコール度数が高すぎるのも、飛行機には当然適していません」\nGetty Images\n機内食用に設計されたメニューや商品は、フライトによる影響を緩和する一つの方法ではあるけれど、変更するのが難しい部分もある。「食べ物の味は、地上で食べるときとまったく異なるものになりますが、人々は変化を好みません」と話すペレグリーノ博士。\n \n味覚や嗅覚に影響を与える騒音から、座り心地の悪い座席、プラスチック製の食器、概日リズムの乱れなど、ペレグリーノ博士いわく飛行中にはさまざまな変数が作用するという。「全体的な食事の性質の違いが問題になるのではないかと思います」\n \n「友達と一緒に、素敵なレストランで重い銀食器を使ってステーキを食べるのと、公園で紙皿の上のステーキを一人で食べるのとでは、大きな違いがあるでしょう」\ntranslation : Mutsumi Matsunobu cooperation : Yumi Kawamura photo : Getty Images,"['https://newsatcl-pctr.c.yimg.jp/t/amd-img/20240831-00010004-elleonline-000-1-view.jpg?pri=l&w=640&h=639&exp=10800', 'https://newsatcl-pctr.c.yimg.jp/t/amd-img/20240831-00010004-elleonline-001-1-view.jpg?pri=l&w=640&h=320&exp=10800', 'https://newsatcl-pctr.c.yimg.jp/t/amd-img/20240831-00010004-elleonline-002-1-view.jpg?pri=l&w=640&h=322&exp=10800', 'https://newsatcl-pctr.c.yimg.jp/t/amd-img/20240831-00010004-elleonline-003-1-view.jpg?pri=l&w=640&h=318&exp=10800']","['https://news.yahoo.co.jp/articles/0aa8ed1f6e8b23a5f879b2536446da6ca3a07a45/images/000', 'https://news.yahoo.co.jp/articles/0aa8ed1f6e8b23a5f879b2536446da6ca3a07a45/images/001', 'https://news.yahoo.co.jp/articles/0aa8ed1f6e8b23a5f879b2536446da6ca3a07a45/images/002', 'https://news.yahoo.co.jp/articles/0aa8ed1f6e8b23a5f879b2536446da6ca3a07a45/images/003']"
