headline,mainEntityOfPage,image,datePublished,dateModified,author,media_en,media_jp,str_count,body,images,external_links
セブン‐イレブン、地産地消を軸足にエリア展開推進　国産小麦の使用拡大や地域フェアで（食品新聞）,https://news.yahoo.co.jp/articles/1bca8fc896f151a67a3178050d0112549ad4f241,https://newsatcl-pctr.c.yimg.jp/t/amd-img/20231226-00010003-shokuhin-000-1-view.jpg?exp=10800,2023-12-26T14:01:48+09:00,2023-12-26T14:01:48+09:00,食品新聞,shokuhin,食品新聞,937,\nセブン‐イレブン・ジャパンは、各エリアで採れた産物などを活用した商品をそのエリアで販売する地産地消を軸足に推進していく\nセブン‐イレブン・ジャパンは、各エリアで採れた産物などを活用した商品をそのエリアで販売する地産地消を軸足に推進していく。\n\n 今年11月に迎えた創業50周年を機に、新たに掲げた健康・地域・環境・人財の4つのビジョンのうち地域の取り組みとして地産地消を推進し、中食での地産地消比率を現在の6％から2030年に30％まで拡大していく方針。\nセブン‐イレブン・ジャパンの永松文彦社長\n12月11日取材に応じた永松文彦社長は「お客様においしさと便利を提供してきた経済的価値に加え、社会的価値を追求して地域に溶け込んだお店にしていく」と語る。\n\n 加盟店へのプラス効果も見込む。\n\n 「地産地消の取り組みは単年や期間限定で終わらせてしまうものではなく、将来に向けてやり続けていく。加盟店オーナーは皆さん地元の方が多く、地域の食材を使うとなると、お客様、生産者をはじめ、行政や地域に根差して商売を行う加盟店にとっても良い効果をもたらす」とみている。\n\n このような考えの下、商品の持続可能な調達を加味して、来年春には調理麺のすべてに国産小麦を使用し、その後はパンに使用する強力粉についても国産化を進めていく。\n\n 地産地消の取り組みに加えて地域フェアも強化していく。\n\n 前上期（2月期）に9件実施した地域フェアを、今上期に43都道府県で36件実施し、今後この勢いを加速させる。\n\n 「北海道フェアをやると関東以北の店舗がよく売れ、九州フェアをやると関西以西がよく売れ、関西フェアではその周辺がよく売れる。それぞれの地域で生産されるものをその地域で消費することの大切さを示していると思う」と述べる。\n\n 食品の持続可能な調達という点では、今年、植物性原料や工場野菜を使用した新シリーズ「みらいデリ」を発売開始した。\n\n 「みらいデリ」については「まずまずのいいスタートとなった。健康・地域・環境・人財の4つのビジョンは、今年1年だけやろうというものではなく、将来に向けてずっとやり続けていくものと考えている」と説明する。,"['https://newsatcl-pctr.c.yimg.jp/t/amd-img/20231226-00010003-shokuhin-000-1-view.jpg?exp=10800', 'https://newsatcl-pctr.c.yimg.jp/t/amd-img/20231226-00010003-shokuhin-001-1-view.jpg?pri=l&w=546&h=640&exp=10800']","['https://news.yahoo.co.jp/articles/1bca8fc896f151a67a3178050d0112549ad4f241/images/000', 'https://news.yahoo.co.jp/articles/1bca8fc896f151a67a3178050d0112549ad4f241/images/001']"
ローソン、賞味期限が近付いた「Lチキ」を無償提供　学校給食や学生食堂などへの支援と食品ロス削減が目的（食品新聞）,https://news.yahoo.co.jp/articles/8ef7d2fc6287d15af93193ebdac525f23332d3ff,https://newsatcl-pctr.c.yimg.jp/t/amd-img/20231226-00010006-shokuhin-000-2-view.jpg?exp=10800,2023-12-26T17:05:28+09:00,2023-12-26T17:09:58+09:00,食品新聞,shokuhin,食品新聞,713,\n無償提供する「ソースinLチキ 餃子味」\nローソンは、賞味期限が近付いた「Lチキ」を無償提供する取り組みを開始した。\n\n 学校給食や学生食堂などへの支援と食品ロス削減が目的。\n\n 大阪大学のキャンパス内にローソン店舗を出店している関係で、大阪大学内の学生食堂(運営元：大阪大学生活協同組合)に対し、フライドフーズ「ソースinLチキ 餃子味」1200食を無償提供することを決定するとともに、運営に苦慮する全国各地の学校給食や学生食堂の事業者を対象に同商品計1万2000食の無償提供先の一般募集を12月25日に開始した。\n\n オリジナル商品の開発を自社で行うローソンは「1万4000店以上の店舗に品切れなく安定供給するための製造数の見極めはAIを活用しても困難な面があり、一部の商品は計画通り販売し切れない場合もある」ことから、値引きなどで売り切りに努めても余剰商品として残る場合がある。\n\n 一方で、近年は物価高騰で食材の仕入れコストが上昇、学校給食や学生食堂の事業者の負担が大きくなり事業運営に影響を与えている。\n 「運営に苦慮されている学生食堂などに、ローソンで余剰気味の商品を無償提供し、食品ロスの削減と学生食堂などの運営支援を行いたい」(同社)との思いから無償提供を決めた。\n\n 大阪大学の学生食堂では、24年1月22日から同商品を手ごろな価格で学生に提供予定。\n\n 同商品の無償提供先(10事業者)の一般募集の応募対象は日本国内の小学校・中学校・高等学校・大学にて給食・食堂を運営している法人。応募期間は2024年1月10日まで。抽選のうえ、2月5日以降に冷凍宅配便にて同商品を届ける。,['https://newsatcl-pctr.c.yimg.jp/t/amd-img/20231226-00010006-shokuhin-000-2-view.jpg?exp=10800'],['https://news.yahoo.co.jp/articles/8ef7d2fc6287d15af93193ebdac525f23332d3ff/images/000']
ファミリーマート、フードドライブの食支援活動　第11回もったいない大賞で「審査委員長賞」（食品新聞）,https://news.yahoo.co.jp/articles/0ddfa88dc1f57e1baa3c52a3104047a57d0ecbb6,https://newsatcl-pctr.c.yimg.jp/t/amd-img/20231226-00010005-shokuhin-000-1-view.jpg?exp=10800,2023-12-26T16:32:42+09:00,2023-12-26T16:32:42+09:00,食品新聞,shokuhin,食品新聞,648,\n条件を満たす食品を回収ボックスに入れて寄付する\nファミリーマートが地域の食支援と食品ロス削減を目的に行っている「ファミマフードドライブ」が、公益財団法人食品等流通合理化促進機構主催「第11回食品産業 もったいない大賞」で審査委員会審査委員長賞を受賞した。\n\n 「ファミマフードドライブ」は、家庭で余った食品をファミリーマート店舗に持ち寄ることで、協力パートナーを通じてこども食堂やフードパントリーなど食支援を必要とする人に届ける取り組み。\n\n 23年11月末現在全国47都道府県約2700店舗で実施し、21年4月から23年8月末までの累計食品回収量は138.5トンに上るなど、フードドライブのネットワークとしては国内最大規模。\n\n 食品を受け取った家庭から店舗に感謝の手紙が届くこともあるといい「店舗が食品寄付の拠点となり食支援が必要な方々へ届けられるとともに、気持ちを繋ぐ場としても地域に貢献している」(同社)。\n\n 消費者は、家庭で食べきれない食品で諸条件を満たすものを実施店舗にもっていき、回収ボックスに入れるだけで寄付できる。ストアスタッフによる受付手続きがなく、気軽に参加できるのも特徴だ。\n\n 協力パートナーは10月末時点で、NPO法人や社会福祉協議会、自治体などを中心に384団体。\n 10 月には取り組みを通じ、コカ・コーラ ボトラーズジャパンが余剰在庫品を全国 10 か所のこども食堂などに寄贈した。\n\n 今後は3000店舗への実施拡大を目指す。,['https://newsatcl-pctr.c.yimg.jp/t/amd-img/20231226-00010005-shokuhin-000-1-view.jpg?pri=l&w=640&h=426&exp=10800'],['https://news.yahoo.co.jp/articles/0ddfa88dc1f57e1baa3c52a3104047a57d0ecbb6/images/000']
年末年始予算は約1.3倍　実家への帰省が増加　物価高も要因か　インテージ調べ（食品新聞）,https://news.yahoo.co.jp/articles/c50b870363e76535c899940028c4cad91c08f68c,https://newsatcl-pctr.c.yimg.jp/t/amd-img/20231226-00010004-shokuhin-000-1-view.jpg?exp=10800,2023-12-26T14:04:09+09:00,2023-12-26T14:04:09+09:00,食品新聞,shokuhin,食品新聞,651,\nコロナ禍が明けて外出意欲の高まりを感じさせる結果に\nマーケティングリサーチ会社のインテージは、年末年始に関する意識調査の結果を公表し、期間中にかける平均予算が4万5235円、前年比128％と大幅に増加した。\n 具体的な予定については、「旅行や帰省の予定はない」が 56.2%と昨年を 6.5 ポイント下回り、コロナ禍が明けて外出意欲の高まりを感じさせる結果になった。\n\n 調査は2023年11月24日から27日に全国15-79歳の男女5000人を対象に実施。\n 年末年始の予定を聞いたところ、「実家への帰省」は18.5％で昨年を2.5ポイント上回った。\n 一方で、日帰りの「国内旅行」を予定する人は4.0％（前年3.6％）、1泊以上の「国内旅行」は8.3％（同7.6％）、「海外旅行」は0.7％（同0.6％）とほぼ横ばいとなった。海外への旅行が回復傾向に向かわないことについては、物価高や円安が背景にあると考えられる。\n\n 「実家への帰省」については、性年代別では特に男性20-50代、女性40-50代で昨年に比べて増加した。\n これまでは新型コロナウイルスの感染拡大を心配し、帰省を控えていた人が「第5類」移行をきっかけに帰省できるようになったと見られる。\n\n 同社の生活者研究センターの田中宏昌センター長は、「実家への帰省や国内旅行といった人の動きは着実に回復に向かっているようだ。予算も増加傾向だが『物価高』を考慮すると『押し上げられた』要素も大きいのでは」としている。,['https://newsatcl-pctr.c.yimg.jp/t/amd-img/20231226-00010004-shokuhin-000-1-view.jpg?pri=l&w=640&h=480&exp=10800'],['https://news.yahoo.co.jp/articles/c50b870363e76535c899940028c4cad91c08f68c/images/000']
「三ツ矢」140年の歴史を渋谷で体験　「三ツ矢復活総選挙」開催　オリジナルラベルで若年層獲得へ（食品新聞）,https://news.yahoo.co.jp/articles/ebd28dcbca993d45224099262d5c3f5140dabe12,https://newsatcl-pctr.c.yimg.jp/t/amd-img/20231226-00010007-shokuhin-000-3-view.jpg?exp=10800,2023-12-26T18:11:41+09:00,2023-12-26T21:12:19+09:00,食品新聞,shokuhin,食品新聞,932,\nオリジナルラベルの「三ツ矢サイダー」\nアサヒ飲料は、「三ツ矢」ブランドで期間限定の「MITSUYA 140th GALLERY」を渋谷に12月26日から31日までの期間限定でオープンし、「\n＃三ツ矢復活総選挙\n」を開催している。\n\n 2024年のブランド140周年に向けて期待感を高めていくとともに、若年層の取り込むのが目的。\n\n アサヒ飲料の玉置明日美マーケティング本部プロモーション戦略部クリエイティブグループ課長補佐は「『三ツ矢サイダー』は知っていたけれど飲んでいない、という方もまだたくさんいらっしゃる。そういった方に飲んでいただき、『三ツ矢』ブランドが身近な存在に感じられるタイミングになれば」と語る。\n「MITSUYA 140th GALLERY」外観\n開催地には、若者の街であり、情報の発信地でもあるという理由から渋谷を選んだ。\n\n 「現在、『三ツ矢』ブランドは主に40～50代の男女、特に男性に多く飲まれている。今回のイベントやキャンペーンを通じて、若い方にも『三ツ矢』ブランドを知って楽しんでいただきたい」と述べる。\n\n ギャラリーには歴代商品や過去の広告ポスター、ブランドの年表が展示される。\nオリジナルラベル作成の様子\nLINEのアンケートに回答すると、自身の写真をプリントしたオリジナルの「三ツ矢サイダー」ラベルがその場で作れるブースも設けられる。\n オリジナルラベルの「三ツ矢サイダー」の画像をXで「\n＃MITSUYA140thGALLERY\n」を付けて投稿すると、140周年記念商品の「三ツ矢 PREMIUM SWEET」もプレゼントされる。\n\n 「\n＃三ツ矢復活総選挙\n」は、1970年から2021年の間に発売された「三ツ矢」ブランドの商品から、SNS上での口コミやお客様相談室に寄せられた声で人気だった9種をピックアップ。\n\n 投票数が多かった上位商品は、24年夏に期間限定で復刻発売される。ギャラリー内で投票すると、オリジナルデザインの付箋がもらえる。投票はキャンペーンサイトやXからも可能となっている。\n\n 「\n＃三ツ矢復活総選挙\n」は24年1月9日までの開催される。,"['https://newsatcl-pctr.c.yimg.jp/t/amd-img/20231226-00010007-shokuhin-000-3-view.jpg?pri=l&w=487&h=640&exp=10800', 'https://newsatcl-pctr.c.yimg.jp/t/amd-img/20231226-00010007-shokuhin-001-3-view.jpg?pri=l&w=552&h=640&exp=10800', 'https://newsatcl-pctr.c.yimg.jp/t/amd-img/20231226-00010007-shokuhin-002-3-view.jpg?pri=l&w=640&h=480&exp=10800']","['https://news.yahoo.co.jp/articles/ebd28dcbca993d45224099262d5c3f5140dabe12/images/000', 'https://news.yahoo.co.jp/search?p=%EF%BC%83%E4%B8%89%E3%83%84%E7%9F%A2%E5%BE%A9%E6%B4%BB%E7%B7%8F%E9%81%B8%E6%8C%99&source=article-body', 'https://news.yahoo.co.jp/articles/ebd28dcbca993d45224099262d5c3f5140dabe12/images/001', 'https://news.yahoo.co.jp/articles/ebd28dcbca993d45224099262d5c3f5140dabe12/images/002', 'https://news.yahoo.co.jp/search?p=%EF%BC%83MITSUYA140thGALLERY&source=article-body', 'https://news.yahoo.co.jp/search?p=%EF%BC%83%E4%B8%89%E3%83%84%E7%9F%A2%E5%BE%A9%E6%B4%BB%E7%B7%8F%E9%81%B8%E6%8C%99&source=article-body']"
ファミリーマート低重心化経営に徹する　デリバリーサービスは「やらない」　細見社長が見解（食品新聞）,https://news.yahoo.co.jp/articles/3a3dad1a585a5c894925639e50fa7d6f46b867bb,https://newsatcl-pctr.c.yimg.jp/t/amd-img/20231226-00010001-shokuhin-000-1-view.jpg?exp=10800,2023-12-26T07:04:37+09:00,2023-12-26T07:04:37+09:00,食品新聞,shokuhin,食品新聞,998,\nファミリーマートの細見研介社長\nファミリーマートの細見研介社長は12月4日取材に応じ、今後について「先読みできない時代になるため低重心経営が非常に大事だと考えている」と述べ、プライベートブランド（PB）の「ファミマル」やデジタル施策に引き続き磨きをかけていく考えを明らかにした。\n\n 先行き不透明な要素としては、ガソリン・電気・都市ガスの補助金制度が延長の動きはあるものの今後打ち切られる公算が大きいことや不可抗力となる天候要因、人流回復に伴うハレの日需要の反動減などを挙げる。\n\n このような要素を勘案して「1つ確実に言えることは体力のある企業が優位だということ」と言い切る。\n\n 継続強化していくデジタル施策については「やり切った上で、次の一歩が何なのかを考えていく」。\n\n ファミマのアプリ「ファミペイ」などと連動した大型デジタルサイネージ「FamilyMartVision」設置店舗数は年度内をめどにに1万店に上り、視聴者数は1000万人強となる。\n\n 競合が注力するデリバリーサービスについては「やらない」と断言する。\n\n 「ファミマル」の直近の動きとしては、おむすびやフィナンシェなどのコンビニ定番品に植物性由来の原料を使用した新商品を12月5日に数量限定で発売開始した。\n\n 今年については「新型コロナウイルスが5類に移行し、何十年かぶりのインフレが始まり、価格対応と賃上げが行われ底流ではすごくいいムードで流れていった。政府のガソリン代や電気代の支援などが下支えとなり景気が腰折れしなかったのは非常に有難かった」と振り返る。\n\n 人流回復は猛暑が後押ししたという。\n\n 「6月以降、暑さでマスクを外す人が増加し、昼間暑すぎたため朝・晩の人出が如実に増えて外出に対する心のハードルが下がったのは我々にとっては非常に大きかった」と述べる。\n\n 細見社長は今年、リアルのコミュニケーションの重要性も再認識。\n\n 「コミュニケーションのレベルが物凄く上がると同時に世の中の流れやビジネス上で決断を下すスピードが加速している。リアルでいろいろなものが行われることの重要さを皆さん感じておられ“リモートの世界が来る”なんてことは妄想だった。やはり世の中をグッと推し進めていくには非常にリアルなコンタクトが必要不可欠だと改めて実感した」と語る。,['https://newsatcl-pctr.c.yimg.jp/t/amd-img/20231226-00010001-shokuhin-000-1-view.jpg?pri=l&w=503&h=640&exp=10800'],['https://news.yahoo.co.jp/articles/3a3dad1a585a5c894925639e50fa7d6f46b867bb/images/000']
西友、食品約80品目など緊急値下げ　12月27日から31日まで（食品新聞）,https://news.yahoo.co.jp/articles/f2065d5dab6765a5f8defa1e526fba33c2226a90,https://newsatcl-pctr.c.yimg.jp/t/amd-img/20231226-00010002-shokuhin-000-1-view.jpg?exp=10800,2023-12-26T13:54:37+09:00,2023-12-26T13:54:37+09:00,食品新聞,shokuhin,食品新聞,364,\n西友およびサニーの全店舗で実施する\n西友は、12月27～31日まで歳末の緊急値下げを西友およびサニーの全店舗で実施する。\n\n 対象は定番商品を中心に食品約80品目のほか、日用品などの生活必需品。\n\n 加工食品・飲料では、鏡餅各種を元の価格から10％割引（25～29日）、「みなさまのお墨付き 天然水ケース」（2L×6）を現行480円から396円に値下げ。\n デイリー食品では「みなさまのお墨付き 極小粒納豆」（50g×3）を現行78円から55円に値下げ。総菜では「だし香るロースカツ重」を現行499円から299円に、「野菜のうま味が深いポテトサラダ」を現行199円から99円に値下げする。\n\n 同社は「今回の企画を通じて身近に西友があって良かったとお客様に感じていただければと考えている」とコメントしている。,['https://newsatcl-pctr.c.yimg.jp/t/amd-img/20231226-00010002-shokuhin-000-1-view.jpg?pri=l&w=640&h=453&exp=10800'],['https://news.yahoo.co.jp/articles/f2065d5dab6765a5f8defa1e526fba33c2226a90/images/000']
