headline,mainEntityOfPage,image,datePublished,dateModified,author,media_en,media_jp,str_count,body,images,external_links
酒気帯び運転容疑で47歳男逮捕　直前に人身事故起こす　兵庫・尼崎（神戸新聞NEXT）,https://news.yahoo.co.jp/articles/fc6fd1fc12ade803cb678b68985684aabbfd6d18,https://newsatcl-pctr.c.yimg.jp/t/amd-img/20231204-00000022-kobenext-000-4-view.jpg?exp=10800,2023-12-04T22:12:52+09:00,2023-12-04T22:25:34+09:00,神戸新聞NEXT,kobenext,神戸新聞NEXT,299,\n尼崎南署庁舎＝尼崎市昭和通２\n酒を飲んで車を運転したとして、兵庫県警尼崎南署は４日、酒気帯び運転の疑いで、同県丹波篠山市のアルバイトの男（４７）を現行犯逮捕した。\n【写真】酒気帯び？レーサー レース直前にパトカーと“一戦”\n逮捕容疑は４日午後２時ごろ、同県尼崎市大庄北３の市道で、酒を飲んだ状態で軽乗用車を運転した疑い。同署によると、男はこの直前、左折時に後続のミニバイクを巻き込む人身事故を起こし、バイクに乗っていた２０代男性が右腕を打撲するなどの軽傷を負った。\n\n 男の呼気から基準値（１リットルあたり０・１５ミリグラム）の約５倍のアルコールが検出されたといい、容疑を認めている。,['https://newsatcl-pctr.c.yimg.jp/t/amd-img/20231204-00000022-kobenext-000-4-view.jpg?pri=l&w=640&h=424&exp=10800'],"['https://news.yahoo.co.jp/articles/fc6fd1fc12ade803cb678b68985684aabbfd6d18/images/000', 'https://www.kobe-np.co.jp/news/backnumber/201612/0012053591.shtml?p=0']"
児童の尻複数回触り停職6カ月　処分の教諭「故意ではない」　児童へのいじめアンケートで発覚　神戸（神戸新聞NEXT）,https://news.yahoo.co.jp/articles/279da7bf803d8fc21694faeba132b9c6b91fae3a,https://newsatcl-pctr.c.yimg.jp/t/amd-img/20231204-00000019-kobenext-000-3-view.jpg?exp=10800,2023-12-04T20:51:29+09:00,2023-12-04T20:54:00+09:00,神戸新聞NEXT,kobenext,神戸新聞NEXT,579,\n神戸市教育委員会＝神戸市中央区東川崎町１\n神戸市教育委員会は４日、児童の尻を触ったとして同市垂水区の市立小学校に勤める男性教諭（４１）を停職６カ月の懲戒処分にするなど、計３件の処分を発表した。\n【写真】不祥事を受け、謝罪する神戸市教育委\n市教委によると、教諭は昨年度に少なくとも３回、担任を務める５年生の女子児童の尻を触った。進級した児童が、今夏のいじめアンケートに記して分かった。教諭は「故意ではない」と説明しているという。\n\n この教諭はほかにも１０人ほどの児童との間で、移動を促す際に尻に手が触れた▽手をつないでいた▽児童を膝の上に乗せていた－といった申告や目撃が調査で確認された。大半の児童は被害の認識を示していないが、校長は３回、不要な身体接触を避けるよう注意していた。教諭は「意識の低さから児童の心に大きな傷を付けた」と謝罪。市教委は管理監督責任として、校長も口頭厳重注意とした。\n\n また兵庫区の小学校で勤務する女性教諭（２４）は今年９月、大阪・梅田の商業施設で化粧品８点（計約６万円相当）を万引。正式採用前の条件付き採用期間中で分限免職処分となった。\n\n 市教委はこのほか、指導する女子バレーボール部で「カス学年」と発言するなど、不適切な言動が確認された市立中学校の男性任期付き講師（２８）を戒告処分とした。（井沢泰斗）,['https://newsatcl-pctr.c.yimg.jp/t/amd-img/20231204-00000019-kobenext-000-3-view.jpg?pri=l&w=640&h=506&exp=10800'],"['https://news.yahoo.co.jp/articles/279da7bf803d8fc21694faeba132b9c6b91fae3a/images/000', 'https://www.kobe-np.co.jp/news/society/202312/0017097114.shtml?p=0']"
兵庫・芦屋市教育委員の任命案、なぜ市議会は不同意?　「史上最年少市長」が推した理由と反対議員の指摘（神戸新聞NEXT）,https://news.yahoo.co.jp/articles/cdf7d6e37a052bd8ef1f4858046a5c644e4c3b9f,https://newsatcl-pctr.c.yimg.jp/t/amd-img/20231204-00000021-kobenext-000-3-view.jpg?exp=10800,2023-12-04T21:14:33+09:00,2023-12-04T21:20:50+09:00,神戸新聞NEXT,kobenext,神戸新聞NEXT,850,\n芦屋市役所＝芦屋市精道町\n兵庫県芦屋市の高島崚輔市長（２６）が１日に提出した教育委員の任命案が、議会の反対を受け不同意となった。今年４月、史上最年少市長として初当選し、初の教育大綱の策定、全国初の東大研究機関との協定締結など「公教育改革」を次々と進めたが、市議会が「急進的で拙速」と待ったをかけた。人事案を巡り、何が起きていたのか。\n【写真】高島崚輔・芦屋市長\n１１月３０日にあった非公開の市議会全体協議会。市は任期満了となる教育委員１人の後任に、元さいたま市教育長の細田真由美さんを任命したいと説明した。教育委員は４人で構成され、月２回の会議で教育行政の基本方針などを議論する。\n\n 現委員が続投すると考えていた議員らは突然の変更に騒然とし、「（細田さんは）遠方に住んでいて業務が困難ではないか」「複数の要職を兼任しており、芦屋の教育が最優先されるか疑問」と質問が相次いだ。\n\n 迎えた翌１日の市議会定例会。自民系のあしや政風会と公明党の両会派計７人が賛成する一方、共産党▽日本維新の会▽芦屋しみんの未来▽無所属－の計１０人が反対。さらに、至誠会の３人が棄権し、人事案は認められなかった。\n\n 高島市長は東大の機関との連携を模索する中で細田さんと出会い、数十時間も話し合って課題意識や教育観で意気投合した。「公教育改革を前進させられる最高の人材と考えていたので、子どもたちに申し訳ない。トップレベルの専門家が必要との考えは変わらない。対話を尽くす」と話した。\n\n 反対した議員の１人は「芦屋に縁がない人では市民の意思や願いを反映させられない」とし、公教育改革にも「前のめりになりすぎている。市長は対話を大切にするとしているが、丁寧さが足りない」と断じた。\n\n 市幹部は「市長に不慣れな点があり、議会への事前説明がうまくいかなかった部分もある」としつつ、「市民が市長に期待する『改革』に議会が反対した形になる。市長と議会の関係性の転換点かもしれない」とした。（村上貴浩）,['https://newsatcl-pctr.c.yimg.jp/t/amd-img/20231204-00000021-kobenext-000-3-view.jpg?pri=l&w=640&h=420&exp=10800'],"['https://news.yahoo.co.jp/articles/cdf7d6e37a052bd8ef1f4858046a5c644e4c3b9f/images/000', 'https://www.kobe-np.co.jp/news/society/202312/0017097279.shtml?p=1']"
「１・17のつどい」阪神・淡路大震災30年の2025年にタイムカプセル収納、メッセージや写真募る　神戸（神戸新聞NEXT）,https://news.yahoo.co.jp/articles/8c33d83d4db21514dd977544b114c2e783b7c51b,https://newsatcl-pctr.c.yimg.jp/t/amd-img/20231204-00000018-kobenext-000-3-view.jpg?exp=10800,2023-12-04T19:55:01+09:00,2023-12-04T20:11:04+09:00,神戸新聞NEXT,kobenext,神戸新聞NEXT,811,\n震災発生時刻に浮かび上がった「１９９５ むすぶ １・１７」の文字＝１７日午前５時４６分、神戸市中央区加納町６、東遊園地\n２０２５年１月１７日で発生から丸３０年となる阪神・淡路大震災の経験や思いを次世代に残そうと、神戸・三宮の東遊園地で毎年開く追悼行事「１・１７のつどい」の実行委員会は４日、震災と未来に関するメッセージと写真を募り、タイムカプセルに収納する企画を始めると発表した。募ったメッセージ付きの写真を２５年１月に東遊園地に収め、３４年１月に開封するという。\n【写真】神戸市の人口が150万人割れ 22年ぶり 市長「人口減、想定超えるスピード」\n募る写真のサイズはＬ判程度で、現在の姿などを撮影・印刷したり、震災当時の写真を使ったりし、裏面に１０年程度先の人々に伝えたい震災の経験や思いをつづってもらう。実行委は来年１月１６～２８日、東遊園地が会場となる「１・１７のつどい」と、鎮魂を祈る光の祭典「神戸ルミナリエ」に合わせ、撮影や印刷、メッセージ記入ができるブースを設ける予定。写真や書いた内容は本人以外にも広く共有されるとしている。\n\n ＮＰＯ法人「阪神淡路大震災１・１７希望の灯り（ＨＡＮＤＳ）」の代表理事で、実行委の藤本真一委員長（３９）は、震災遺族や復興に貢献した人らの高齢化に触れ、「３０年の節目を前に色んな人から思いを募り、次世代に伝えたいメッセージを残したい」と語った。\n\n また例年と同様、つどいの当日に灯籠で「１・１７」と合わせてかたどる１～４文字程度の言葉の募集も始めた。今年は「むすぶ」、昨年は「忘」だった。\n\n 写真とメッセージの郵送は、ＨＡＮＤＳ事務局（神戸市北区北五葉１の１３の１、レ・アールビル３階）へ。文字案は来年１月１０日までに同事務局へはがきか、「１・１７のつどい」ホームページの応募フォームなどで送る。ＨＡＮＤＳＴＥＬ０５０・３５９０・０１１７（井川朋宏）,['https://newsatcl-pctr.c.yimg.jp/t/amd-img/20231204-00000018-kobenext-000-3-view.jpg?pri=l&w=640&h=426&exp=10800'],"['https://news.yahoo.co.jp/articles/8c33d83d4db21514dd977544b114c2e783b7c51b/images/000', 'https://www.kobe-np.co.jp/news/society/202310/0016909105.shtml?p=0']"
交際相手の首押さえけがさせる、その様子がペットカメラに　傷害容疑で男逮捕　神戸（神戸新聞NEXT）,https://news.yahoo.co.jp/articles/eecefba01e369f06e457b12da1191b515989b847,https://newsatcl-pctr.c.yimg.jp/t/amd-img/20231204-00000023-kobenext-000-3-view.jpg?exp=10800,2023-12-04T22:12:52+09:00,2023-12-04T22:21:29+09:00,神戸新聞NEXT,kobenext,神戸新聞NEXT,337,\n兵庫県警葺合署＝神戸市中央区吾妻通５\n交際中の女性を押し倒して首を押さえつけ、けがをさせたとして、兵庫県警葺合署は４日、傷害の疑いで、飲食店を経営する神戸市中央区の男（５８）を逮捕した。\n【写真】夜間の異常音検知、「監視中です」音声と回転灯で警告 加古川市がAIカメラ150台設置\n逮捕容疑は、３日午前７時ごろ、男の自宅で交際中の女性（２６）を押し倒し、首を押さえつけ、打撲をさせた疑い。同署の調べに「相手から手を出され、取り押さえた。けがをさせるようなことはしていない」と容疑を一部否認しているという。\n\n 同署によると、男と女性は交際を巡って口論になった。自宅のペットカメラに、男が女性の首付近を押さえつける様子が映っていた。女性が被害届を提出したという。,['https://newsatcl-pctr.c.yimg.jp/t/amd-img/20231204-00000023-kobenext-000-3-view.jpg?pri=l&w=437&h=640&exp=10800'],"['https://news.yahoo.co.jp/articles/eecefba01e369f06e457b12da1191b515989b847/images/000', 'https://www.kobe-np.co.jp/news/touban/202303/p2_0016101610.shtml']"
「受け子」役で逮捕の男、「出し子」でも逮捕　210万円詐取疑い　兵庫県警（神戸新聞NEXT）,https://news.yahoo.co.jp/articles/f95cc87302be40bea83383cd97fb3014fa6b1eb5,https://newsatcl-pctr.c.yimg.jp/t/amd-img/20231204-00000016-kobenext-000-4-view.jpg?exp=10800,2023-12-04T18:45:37+09:00,2023-12-04T18:47:32+09:00,神戸新聞NEXT,kobenext,神戸新聞NEXT,319,\n尼崎南署庁舎＝尼崎市昭和通２\n特殊詐欺の「出し子」役で計２１０万円を詐取したとして、兵庫県警尼崎南署は４日、窃盗の疑いで、福岡県大野城市の建築作業員の男（２８）を再逮捕した。\n【写真】パワースポットの神社、「竜の水口」盗まれる\n再逮捕容疑は１０月３１日午後３時ごろ、岡山市北区のショッピングモールで、不正に入手した６枚のキャッシュカードを使って、３カ所のＡＴＭから６回にわたって計２１０万円を引き出した疑い。「弁解することは何もない」と容疑を認めているという。\n\n 同署によると、男は「受け子」役でキャッシュカード７枚を盗んだ疑いで、１１月１日に同署に逮捕されている。だまし取ったカードを使い、直後に現金を引き出したという。,['https://newsatcl-pctr.c.yimg.jp/t/amd-img/20231204-00000016-kobenext-000-4-view.jpg?pri=l&w=640&h=424&exp=10800'],"['https://news.yahoo.co.jp/articles/f95cc87302be40bea83383cd97fb3014fa6b1eb5/images/000', 'https://www.kobe-np.co.jp/news/hokuban/202308/0016732363.shtml?p=0']"
アメフト関学大、史上初の6連覇なるか　海崎主将「集大成として臨む」　17日、甲子園ボウルで法大と対戦（神戸新聞NEXT）,https://news.yahoo.co.jp/articles/f60f32f772c14aca3e0fe41475d84d4542824a4c,https://newsatcl-pctr.c.yimg.jp/t/amd-img/20231204-00000017-kobenext-000-3-view.jpg?exp=10800,2023-12-04T19:38:49+09:00,2023-12-04T19:45:21+09:00,神戸新聞NEXT,kobenext,神戸新聞NEXT,487,\n甲子園ボウルを前に健闘を誓い合った関学大の海崎琢主将（左）と法大の滝沢叡主将\nアメリカンフットボールの全日本大学選手権決勝「甲子園ボウル」（１７日）で対戦する関学大と法大が４日、会場となる兵庫県西宮市の甲子園球場で会見した。史上初の６連覇に挑む関学大のＬＢ海崎琢主将は「６連覇にはこだわらず、１年の集大成として臨む」と意気込みを語った。\n【写真】戦慄走った日大悪質タックル アメフト追いかけ半世紀のカメラマン\n８年連続５７度目の出場となる関学大は今季、関西学生リーグ最少の５９失点と堅守が光る。大村和輝監督は法大の主力を「攻守ともにスピードがある」と警戒。最終節の関大戦で敗れ、同率３校の抽選で全日本大学選手権出場を決めたことに触れ、「今年一番のゲームに」と必勝を誓った。\n\n 法大は２年ぶり１９度目の出場で、１７年ぶりの栄冠を目指す。２年前の対戦では完敗。富永一ヘッドコーチは「（関学大は）とにかく強い。隙がないイメージ」と話し、球際での勝負強さを磨いてきたと説明した。ＷＲ滝沢叡（あきら）主将は「関西勢を破るのは目標であり憧れ」と闘志を示した。（山本 晃）,['https://newsatcl-pctr.c.yimg.jp/t/amd-img/20231204-00000017-kobenext-000-3-view.jpg?pri=l&w=640&h=441&exp=10800'],"['https://news.yahoo.co.jp/articles/f60f32f772c14aca3e0fe41475d84d4542824a4c/images/000', 'https://www.kobe-np.co.jp/rentoku/omoshiro/202112/0014923217.shtml']"
スーパー銭湯で知り合った男性の高級腕時計や金貨だまし取った疑い　逮捕の73歳男「被害者のうそです」　兵庫（神戸新聞NEXT）,https://news.yahoo.co.jp/articles/086af59b17aec0c34bdcae8164e33aff398e0f5d,https://newsatcl-pctr.c.yimg.jp/t/amd-img/20231204-00000015-kobenext-000-7-view.jpg?exp=10800,2023-12-04T18:29:52+09:00,2023-12-04T19:12:37+09:00,神戸新聞NEXT,kobenext,神戸新聞NEXT,482,\n兵庫県警長田署＝神戸市長田区北町３\n会社経営の男性（４９）から高級腕時計などをだまし取ったとして、兵庫県警長田署は４日、詐欺の容疑で、神戸市長田区の無職の男（７３）を逮捕した。同署によると、調べに「被害者のうそです。コインや時計は見たことがない」と容疑を否認しているという。\n【写真】フランス外遊に自民党「国民の税金から支出しておりません」 研修費個人負担30万円、SNSに疑問の声「議員の給与も元は税金」\n逮捕容疑は２０２１年１０月下旬、他１人と共謀し、被害者に対して「有名な鑑定士を知っている」などとうそを言った上で、翌日、長田区内の喫茶店で共犯者を鑑定士と偽り「少なくとも１２００万円にはできる」などとうそを重ね、腕時計１個に加え、金貨など１３点をだまし取った疑い。\n\n 署によると、被害者と男は同年９月ごろ、市内のスーパー銭湯で知り合った。だまし取った高級腕時計や金貨などは数百万円相当という。\n\n 換金後に支払われた金額が少なかったことを不審に思った男性が２０２２年１２月、署に届け出た。換金した店の記録などから、被害が判明したという。,['https://newsatcl-pctr.c.yimg.jp/t/amd-img/20231204-00000015-kobenext-000-7-view.jpg?pri=l&w=640&h=484&exp=10800'],"['https://news.yahoo.co.jp/articles/086af59b17aec0c34bdcae8164e33aff398e0f5d/images/000', 'https://www.kobe-np.co.jp/rentoku/omoshiro/202308/0016650821.shtml?p=0']"
横断歩道を歩いていた87歳会社役員、軽ワゴン車にはねられ重体　国道171号（神戸新聞NEXT）,https://news.yahoo.co.jp/articles/48f28aa34b3ea77103e4003be5156abb34c50c63,https://newsatcl-pctr.c.yimg.jp/t/amd-img/20231204-00000014-kobenext-000-3-view.jpg?exp=10800,2023-12-04T18:29:52+09:00,2023-12-04T18:45:14+09:00,神戸新聞NEXT,kobenext,神戸新聞NEXT,312,\n男性が軽ワゴン車にはねられた事故現場＝４日午前１１時５０分、西宮市越水町\n４日午前１１時４０分ごろ、兵庫県西宮市越水町の国道１７１号交差点で、横断歩道を歩いていた同市の清涼飲料水メーカー役員の男性（８７）が軽ワゴン車にはねられた。男性は頭の骨を折るなどして意識不明の重体。県警西宮署は自動車運転処罰法違反（過失傷害）の疑いで、車を運転していた同市の運送業の男（６８）を現行犯逮捕した。\n【写真】止まってブレーキ冷やして！ フェード現象で事故続発、5年で6件以上\n同署によると、現場は信号機のある交差点で、右折しようとした車が男性をはねたとみられる。男は「安全確認をしっかりしていなかった」と容疑を認めているという。,['https://newsatcl-pctr.c.yimg.jp/t/amd-img/20231204-00000014-kobenext-000-3-view.jpg?pri=l&w=640&h=386&exp=10800'],"['https://news.yahoo.co.jp/articles/48f28aa34b3ea77103e4003be5156abb34c50c63/images/000', 'https://www.kobe-np.co.jp/news/hanshin/202307/0016611881.shtml?p=0']"
特殊詐欺、詐取した現金の回収役か?　容疑で福岡の男を4回目逮捕　兵庫県警（神戸新聞NEXT）,https://news.yahoo.co.jp/articles/84d99e165af0ab05f20ad7725d4ff251a3fae971,https://newsatcl-pctr.c.yimg.jp/t/amd-img/20231204-00000013-kobenext-000-4-view.jpg?exp=10800,2023-12-04T18:29:52+09:00,2023-12-04T18:37:48+09:00,神戸新聞NEXT,kobenext,神戸新聞NEXT,489,\n兵庫県警察本部＝神戸市中央区\n兵庫県警特殊詐欺特別捜査隊と垂水署などは４日、電子計算機使用詐欺と組織犯罪処罰法違反などの疑いで、福岡県久留米市の無職の男（５１）＝窃盗罪などで起訴済み＝を再逮捕した。県警は、男を特殊詐欺で詐取された現金の回収役とみており、男は「約１年前のことで、はっきりと覚えていない」と話しているという。\n【写真】「３億４５００万円の入金完了」とメール 不審に感じた金融機関職員、交番へ\n男の再逮捕容疑は何者かと共謀して１月１０日、東京都北区の女性＝当時（９２）＝のキャッシュカードを使用し、受け子役の男が他人名義口座に計１６１万円を送金。別の男が茨城県内にあるコンビニのＡＴＭで現金を引き出し、１月１１日に無職の男の口座に９８万９千円を振り込ませた上、振り込み人名義を偽らせ、犯罪収益の取得を正当な取引に装った疑い。\n\n 県警によると、男は現金の回収役で、引き出し役の男らに対し自身に振り込ませる際の会社名や金額などを指示していた。\n\n 男はこれまで県警に窃盗などの疑いで逮捕され、神戸地検は同罪などで起訴。今回で男の逮捕は４回目となった。,['https://newsatcl-pctr.c.yimg.jp/t/amd-img/20231204-00000013-kobenext-000-4-view.jpg?pri=l&w=640&h=423&exp=10800'],"['https://news.yahoo.co.jp/articles/84d99e165af0ab05f20ad7725d4ff251a3fae971/images/000', 'https://www.kobe-np.co.jp/news/miki/202207/p1_0015512730.shtml']"
「妙見の森ケーブル」運行終了、63年の歴史に幕　詰めかけたファン「寂しい」「ありがとう」　川西（神戸新聞NEXT）,https://news.yahoo.co.jp/articles/c5a24699199d5c569e7b3f02f59c3d5ba94fb95a,https://newsatcl-pctr.c.yimg.jp/t/amd-img/20231204-00000012-kobenext-000-8-view.jpg?exp=10800,2023-12-04T17:45:09+09:00,2023-12-04T23:56:51+09:00,神戸新聞NEXT,kobenext,神戸新聞NEXT,901,\n手を上げて電車の出発を合図する能勢電鉄の西中哲郎社長（左）ら＝川西市黒川\n兵庫県川西市黒川の妙見山で行楽客らに親しまれてきた「妙見の森ケーブル」（黒川－ケーブル山上駅）が３日、６３年の歴史に幕を閉じた。最後の雄姿を一目見ようと始発から多くのファンが訪れ、思い出話に花を咲かせつつ別れを惜しんだ。（浮田志保）\n【写真】運行を終えるケーブルカーに乗ろうと、黒川駅で列をつくる利用者\n運営主体の能勢電鉄によると、ケーブルは１９６０年に開業。妙見山は都市部に近く、ケーブルを使えばより気軽に登れるため人気を集め、ピーク時の７４年度には約２０万人が利用した。一方で、マイカーの普及やレジャーの多様化などで利用客が減り、運転技術の継承も困難に。新型コロナ禍による影響が追い打ちとなり、２０２３年６月、１年後の廃止を公表。さらに同９月には１２月３日に前倒して営業を終えることを決めた。ケーブルから乗り換えて山頂近くまで行けるリフトやバーベキュー施設、足湯などの事業も同時に終了するとした。\n\n この発表の後、妙見山には多くの人が足を運び、週末は連日長い行列ができるように。１０、１１月は昨年同期の約５倍となる延べ１０万６７６人が訪れた。\n\n 最終運行日の午前９時、麓の黒川駅で出発式が行われた。始発「ときめき号」の出発ベルが鳴り響くと、同電鉄の西中哲郎社長（６０）らが手を上げて合図を送り、一礼。詰めかけたファンらが「ありがとう」とねぎらった。\n\n 乗り込んだ人らは車窓から見える紅葉やレールを写真や動画に収めながら、約５分の旅を楽しんだ。還暦を迎え、現在は「第二の人生」を送っているという男性（７４）ら会社の元同僚４人は、２０年近く前から妙見山に登る。「いろいろと仕事の相談をした思い出深い場所。日常の一部だったものがなくなるのは寂しいね」\n\n 大阪市の女性（４５）＝は長女（７）、次女（４）と最後の揺れを堪能した。毎年登山し、下りだけケーブルを使っているといい、「子どもたちはケーブルに見守られながら大きくなった。名残惜しいが、妙見山はなくならないので、今後も存分に歩きたい」と話した。,['https://newsatcl-pctr.c.yimg.jp/t/amd-img/20231204-00000012-kobenext-000-8-view.jpg?pri=l&w=640&h=476&exp=10800'],"['https://news.yahoo.co.jp/articles/c5a24699199d5c569e7b3f02f59c3d5ba94fb95a/images/000', 'https://www.kobe-np.co.jp/news/hanshin/202312/0017096622.shtml?p=1']"
