headline,mainEntityOfPage,image,datePublished,dateModified,author,media_en,media_jp,str_count,body,images,external_links
JR神戸線踏切で人身事故　上下線計28本が運休、1万７千人に影響（神戸新聞NEXT）,https://news.yahoo.co.jp/articles/b01b0a653581f04533d85f6e50a79b9f9da2b3c6,https://newsatcl-pctr.c.yimg.jp/t/amd-img/20231204-00000011-kobenext-000-7-view.jpg?exp=10800,2023-12-04T17:13:25+09:00,2023-12-04T19:07:26+09:00,神戸新聞NEXT,kobenext,神戸新聞NEXT,261,\n神戸新聞ＮＥＸＴ\n４日午後３時５５分ごろ、兵庫県加古川市米田町平津のＪＲ神戸線加古川－宝殿間の棚田上踏切で、草津発姫路行き新快速電車の運転士が線路内に侵入する人影を見つけ、非常ブレーキをかけたが、間に合わず接触した。乗客約３００人にけがはなかった。\n【写真】JRの踏切で、電車の通過待ち ふと目にとまった文字に思わずツッコミ「何の勝負中やねん」\nＪＲ神戸線は土山－姫路間で一時運転を見合わせたが、約１時間半後に運転を再開した。この影響で上下線計２８本が運休し、計７本に最大９２分の遅れ、約１万７千人に影響が出た。,['https://newsatcl-pctr.c.yimg.jp/t/amd-img/20231204-00000011-kobenext-000-7-view.jpg?pri=l&w=640&h=510&exp=10800'],"['https://news.yahoo.co.jp/articles/b01b0a653581f04533d85f6e50a79b9f9da2b3c6/images/000', 'https://www.kobe-np.co.jp/news/touban/202309/0016761838.shtml?p=0']"
関空、新国際線出国エリアを公開　日本最大級の「ウオークスルー型免税店」、アニメやゲーム専門店も（神戸新聞NEXT）,https://news.yahoo.co.jp/articles/8242820cfcd7a4f4060149e1f70c7156aac6af0d,https://newsatcl-pctr.c.yimg.jp/t/amd-img/20231204-00000010-kobenext-000-6-view.jpg?exp=10800,2023-12-04T12:51:02+09:00,2023-12-04T19:58:33+09:00,神戸新聞NEXT,kobenext,神戸新聞NEXT,630,\n５日に開業するウオークスルー型免税店。日本の国際空港で最大級となる＝４日午前、関西空港\n関西エアポートは５日、大規模改修を進める関西空港（大阪府泉佐野市など）で、新国際線出国エリアを開業させる。オープンを前に４日、報道陣に公開した。\n【写真】中央に集約された関西空港の出国審査場\n広さ約１万平方メートルに、日本の国際空港で最大級となる回遊型の「ウオークスルー型免税店」（約２５００平方メートル）と、物販や飲食などの商業エリアがあり、計２７店舗が展開。商業エリア中央の待ち合いスペースは日本建築を模したデザインで、「和」を感じられる落ち着いた空間となっている。\n\n 店舗は、アニメ、漫画、ゲームの関連商品や、雑貨、子ども服を扱う専門店に加え、すしやクラフトビールを味わえる飲食店などがそろう。神戸・長田からも、ご飯とノリで具材を挟んだバーガーの店「おにぎりバーガー」が出店。神戸牛のステーキなどを使ったこだわりの料理を提供する。\n\n また５日からは、出国手続きをスムーズにするため、南北に分かれていた出国審査場を中央に集約する。\n\n 関空では年間約４千万人の国際線旅客を受け入れられるように、２０２１年、約７００億円を投じる第１ターミナルの大規模改修に着手。工事の約７０％が完了した。今後、大阪・関西万博が開幕する２５年春に国際線の保安検査場を拡張し、入国エリアの移設も図る。２６年秋には今回開業する商業エリアを増床する計画だ。（大島光貴）,['https://newsatcl-pctr.c.yimg.jp/t/amd-img/20231204-00000010-kobenext-000-6-view.jpg?pri=l&w=640&h=426&exp=10800'],"['https://news.yahoo.co.jp/articles/8242820cfcd7a4f4060149e1f70c7156aac6af0d/images/000', 'https://www.kobe-np.co.jp/news/society/202312/0017095751.shtml?p=3']"
女子高生の胸、通りすがりに触る　逃走の男、防犯カメラで特定し逮捕　姫路（神戸新聞NEXT）,https://news.yahoo.co.jp/articles/56114920891a3adaaf2df137ec1e4abb22b8925e,https://newsatcl-pctr.c.yimg.jp/t/amd-img/20231204-00000008-kobenext-000-3-view.jpg?exp=10800,2023-12-04T10:25:07+09:00,2023-12-04T10:28:58+09:00,神戸新聞NEXT,kobenext,神戸新聞NEXT,265,\n兵庫県警飾磨署＝姫路市飾磨区中島\n通りすがりに女子高校生の胸を触ったとして、兵庫県警飾磨署は３日、不同意わいせつ容疑で、同県姫路市のサービス業の男（３１）を逮捕した。男は「弁護士と相談してから話したいので、今は話せない」と黙秘しているという。\n【写真】逮捕歴ある職員、神戸市なぜ採用？ 女児にわいせつ、過去に同様の事件\n逮捕容疑は、８月１７日午後８時４０分ごろ、自転車で帰宅中の女子高校生（当時１７）の胸を通りすがりに触った疑い。\n\n 同署によると、男は逃走していたが、その後、防犯カメラの捜査などで特定したという。,['https://newsatcl-pctr.c.yimg.jp/t/amd-img/20231204-00000008-kobenext-000-3-view.jpg?pri=l&w=640&h=498&exp=10800'],"['https://news.yahoo.co.jp/articles/56114920891a3adaaf2df137ec1e4abb22b8925e/images/000', 'https://www.kobe-np.co.jp/news/sougou/202010/0013752330.shtml']"
加害者にも被害者にもならない社会を  集団暴行事件で息子失った高松さん、高校生に呼び掛ける　兵庫・尼崎（神戸新聞NEXT）,https://news.yahoo.co.jp/articles/c9c02f10091fdf18922b1048c5f1c703a6fff49f,https://newsatcl-pctr.c.yimg.jp/t/amd-img/20231204-00000009-kobenext-000-3-view.jpg?exp=10800,2023-12-04T11:00:21+09:00,2023-12-04T12:18:11+09:00,神戸新聞NEXT,kobenext,神戸新聞NEXT,733,\n集団暴行死事件で亡くなった高松聡至さんのパネルと並び、生命の大切さを訴える母親の高松由美子さん＝尼崎市塚口町５、尼崎北高校\n兵庫県稲美町で１９９７年、元同級生らによる集団暴行で死亡した高校１年の高松聡至（さとし）さん＝当時（１５）＝の母高松由美子さん（６９）＝同町＝が、尼崎北高校（同県尼崎市塚口町５）で講演した。「突然息子を奪われ、家族の未来も生きる気力も無くなった。これが犯罪に遭うということ」と語り、「加害者にも被害者にもならない社会をつくってほしい」と呼びかけた。（篠原拓真）\n【写真】長男聡至さんの遺影の前で話す高松由美子さん\n事件は９７年８月２３日深夜に発生した。当時１４～１６歳の少年１０人に呼び出され、自宅近くの神社で殴る蹴るのほか、鉄パイプでの殴打やバイクで体をひくなどの暴行を受けた。聡至さんは中学時代の非行から抜けだし高校に入学しており、高松さんは、暴行はグループとの付き合いをやめたのが気にくわなかったからという話も聞いたという。\n\n 高松さんは、顔が腫れ上がりどす黒く変色した聡至さんの様子を振り返りながら、「この一発を我慢すれば帰られると思ったのか、お母さん助けてと言ったのか。今も助けられなかったことの無力さが心に沈んでいる」と涙を浮かべた。\n\n また、被害に遭うまでは、事件は人ごとで無縁と思っていたことを打ち明け、「『明日はわが身』と伝えることが私の責任と思った。犯罪、事件の怖さを考えてほしい。どんな理由があっても生命を奪うことはしてはいけない」と訴えた。\n\n 講演は１年生約２８０人が出席し、女子生徒（１６）は「実際にニュースを見ても人ごとと思っていた。これからは何をどうすればいいかを考えたい」と話した。,['https://newsatcl-pctr.c.yimg.jp/t/amd-img/20231204-00000009-kobenext-000-3-view.jpg?pri=l&w=640&h=586&exp=10800'],"['https://news.yahoo.co.jp/articles/c9c02f10091fdf18922b1048c5f1c703a6fff49f/images/000', 'https://www.kobe-np.co.jp/news/sougou/202209/p2_0015600683.shtml']"
集合住宅で火災、焼け跡から年齢性別不明の遺体発見　兵庫・加古川（神戸新聞NEXT）,https://news.yahoo.co.jp/articles/942b0baaef5a994694073ea844b46349a2a03a52,https://newsatcl-pctr.c.yimg.jp/t/amd-img/20231204-00000007-kobenext-000-7-view.jpg?exp=10800,2023-12-04T10:08:30+09:00,2023-12-04T17:14:32+09:00,神戸新聞NEXT,kobenext,神戸新聞NEXT,298,\n焼け跡から１人の遺体が見つかった集合住宅＝４日午前７時１９分、加古川市尾上町養田\n４日午前４時ごろ、兵庫県加古川市尾上町養田の木造２階建て集合住宅から煙が出ているのに住民が気付き、１１９番した。２階の１室が全焼し、焼け跡から性別、年齢不明の遺体が見つかった。\n【写真】「あのまま寝ていたら…」靴もはかずに逃げた住人ら恐怖におびえ 神戸、未明の集合住宅火災\n加古川署などによると、火元の部屋では高齢男性が１人暮らししていたとみられ、同署が行方を捜している。火は約３時間半後に消し止められ、他にけが人などはなかったという。\n\n 現場は山陽電鉄尾上の松駅の西約５００メートルにある住宅街。,['https://newsatcl-pctr.c.yimg.jp/t/amd-img/20231204-00000007-kobenext-000-7-view.jpg?pri=l&w=640&h=411&exp=10800'],"['https://news.yahoo.co.jp/articles/942b0baaef5a994694073ea844b46349a2a03a52/images/000', 'https://www.kobe-np.co.jp/news/sougou/202301/p1_0015984825.shtml']"
25年に一度の「菅公大祭」へ、みこしを修復していたら…　300年以上前の年号記した墨書見つかる　兵庫・姫路（神戸新聞NEXT）,https://news.yahoo.co.jp/articles/e5745aa34e12fa46c29fb4d5009047d6be80e4ea,https://newsatcl-pctr.c.yimg.jp/t/amd-img/20231204-00000005-kobenext-000-3-view.jpg?exp=10800,2023-12-04T09:00:18+09:00,2023-12-04T09:15:54+09:00,神戸新聞NEXT,kobenext,神戸新聞NEXT,767,\n２０２５年の「菅公臨時大祭」に向け、修復が進む英賀神社の神輿＝姫路市白浜町（同神社提供）\n２５年に一度だけ催される英賀神社（兵庫県姫路市飾磨区英賀宮町２）の「菅公臨時大祭」に向け修復中の同神社の神輿（みこし）から、３００年以上前の元禄年間（１６８８～１７０４年）の年号を記した墨書が見つかった。神輿が造られた時期を示すとみられ、市教育委員会文化財課の担当者は「市内で現存する神輿では、確認できる中で最古になる」としている。（森下陽介）\n【写真】神輿に残る「元禄八年」の墨書。完成した時期を示すとみられる\n英賀神社の菅公大祭は、室町時代初期に三木通近（みちちか）が英賀城主となり、同神社に天神を祭ったことが起源とされる。本宮では、普段はめったに見られない神輿３基が繰り出し、神社北のお旅所で屋台練りや獅子舞を奉納する。\n\n ２０２５年１０月１７、１８日の次回大祭に向け、同神社は同市白浜町の「毛利工務店」に神輿の修復を依頼。今年９月に作業が始まると、３基の屋根や柱から年号や大工の名前などの墨書が見つかった。\n\n １１月中旬、市教委文化財課の職員が八幡大神（はちまんおおかみ）を移す「第二神輿」にあった「元禄八年」（１６９５年）の墨書を確認。「第三神輿」には元禄１３（１７００）年を示す墨書も残っていた。\n\n 同課担当者によると、恵美酒宮天満神社（同市飾磨区恵美酒）の社記に、神輿が１７１４（正徳４）年９月に完成したとする記録があり、これまで市内最古とされていたという。\n\n 英賀神社の木村尚樹宮司（５１）は「１３回前の菅公大祭からこれらの神輿が使われていたのではないか」と推測。「２５年に一度の大祭がこれほど長く続いていることに驚いた。２年後も素晴らしい祭りを実施するためにしっかり準備したい」と話していた。,['https://newsatcl-pctr.c.yimg.jp/t/amd-img/20231204-00000005-kobenext-000-3-view.jpg?pri=l&w=640&h=479&exp=10800'],"['https://news.yahoo.co.jp/articles/e5745aa34e12fa46c29fb4d5009047d6be80e4ea/images/000', 'https://www.kobe-np.co.jp/news/himeji/202312/0017093957.shtml?p=1']"
50ccバイクで時速117キロ!　映画監督の近兼拓史さん、世界最速の自己記録、非公認ながら更新（神戸新聞NEXT）,https://news.yahoo.co.jp/articles/81f6f9c08e1e3f6722734c0948d168f662890884,https://newsatcl-pctr.c.yimg.jp/t/amd-img/20231204-00000006-kobenext-000-3-view.jpg?exp=10800,2023-12-04T10:00:14+09:00,2023-12-04T10:08:13+09:00,神戸新聞NEXT,kobenext,神戸新聞NEXT,1192,\n自身が２０１９年に記録した５０ｃｃバイクの最速記録を塗り替えた近兼拓史さん。背景は記録樹立の瞬間の映像＝ヱビスシネマ。\n兵庫県丹波市のミニシアター「ヱビスシネマ。」支配人で映画監督の近兼拓史（ちかかねたくし）さん（６１）＝同県西宮市＝が秋田県で１１月下旬、自身の保持する５０ｃｃバイクの世界最速記録を非公認ながら更新した。今夏に本来、公式測定の舞台となるはずだった米国の国際大会は、渡米後に中止に。不運と失意をはねのけて国内での走行を模索し、東北で時速１１７．０５キロという偉業を成し遂げた。（那谷享平）\n【写真】酒井法子さん、丹波のミニシアターに登場した理由\n近兼さんは映画撮影で知り合った金属加工会社などとプロジェクトを組み、日本の精密加工技術で造り上げたマシンで世界最速に挑んでいる。毎夏に米ユタ州である国際大会「ボンネビル・モーターサイクル・スピード・トライアルズ」に２０１８年から参戦し、１９年に５０ｃｃと１２５ｃｃの両クラスで世界記録を樹立。いまだ破られていない。\n\n ２０年から新型コロナウイルス禍などで大会の中止や不参加が続き、今年８月、４年ぶりの新記録を期して渡米。しかし、直後に大会が悪天候で中止になり、開発や輸送など約２千万円かけた挑戦は一度も走ることなく水泡に帰した。\n\n 「改良を加え、更新は確実と期待していたマシン。なんとか走らせたい」。心身ともに疲労困憊（こんぱい）の中、滞在先から連絡したのが、日本随一の長い直線がある「大潟村ソーラースポーツライン」（秋田県大潟村）だった。交渉の末、１１月２２、２３日に公開テスト走行できることになった。\n\n 計測は１２５ｃｃと５０ｃｃのマシン２台で実施。米国の本番と可能な限り似た条件を用意した。１キロの助走を設け、計測区間の直線４００メートルを走り抜ける平均時速を千分の１秒単位で測った。\n\n テレビカメラも立ち会い、迎えた本番。１２５ｃｃは米国との環境の違いに対応できず測定前に故障し、５０ｃｃのみで２日間に計７回走った。１９年から１５キロ軽量化したマシンは３回目で公式世界記録の時速約１０１キロを上回り、６回目で同１１７・０５キロに達した。\n\n スタッフたちと抱き合って喜んだ近兼さん。「日本の技術、メード・イン・ジャパンのすごさを証明できた」。失望から自らを奮い立たせたのは「無理だと思われることも、できると示したい。応援してくれた人の技術と熱意を多くの人に伝えたい」との思いだったという。\n\n 近兼さんは「ボンネビルの無念に一矢報いたが、あくまで非公認。米国で公式記録を残したい」と来夏への意欲を取り戻した様子。ただ、現時点で予算はなくプロジェクトは依然、危機的状況。今後、秋田での実績を材料に協賛を募る考えだ。協賛などの受け付けはコドルニスＴＥＬ０７９５・８８・５９１０,['https://newsatcl-pctr.c.yimg.jp/t/amd-img/20231204-00000006-kobenext-000-3-view.jpg?pri=l&w=640&h=438&exp=10800'],"['https://news.yahoo.co.jp/articles/81f6f9c08e1e3f6722734c0948d168f662890884/images/000', 'https://www.kobe-np.co.jp/news/tanba/202111/p2_0014844679.shtml']"
神戸・須磨区の長屋から出火、1室焼く　寝たばこが原因か（神戸新聞NEXT）,https://news.yahoo.co.jp/articles/cf974850b136c151c216e7a84ebb4d318674cffe,https://newsatcl-pctr.c.yimg.jp/t/amd-img/20231204-00000004-kobenext-000-4-view.jpg?exp=10800,2023-12-04T08:42:01+09:00,2023-12-04T09:08:42+09:00,神戸新聞NEXT,kobenext,神戸新聞NEXT,228,\n兵庫県警須磨署＝神戸市須磨区大池町５\n４日午前１時５０分ごろ、神戸市須磨区禅昌寺町の木造２階建て長屋から出火、２階部分の１室約３０平方メートルを焼いた。けが人はなかった。\n【動画】救助の女性を5ｍ落下させる「あり得ないミス」 神戸市消防\n兵庫県警須磨署によると、一帯は６棟の長屋が連なり、出火元の長屋から隣の長屋の屋根の一部にも燃え移ったとみられる。出火元の部屋に住む男性（６３）は「たばこを吸いながらうとうとしてしまった」と説明しているという。,['https://newsatcl-pctr.c.yimg.jp/t/amd-img/20231204-00000004-kobenext-000-4-view.jpg?pri=l&w=489&h=640&exp=10800'],"['https://news.yahoo.co.jp/articles/cf974850b136c151c216e7a84ebb4d318674cffe/images/000', 'https://www.kobe-np.co.jp/news/backnumber2/202207/p1_0015483494.shtml']"
全速力で走り去る男「何があったん?」「盗撮された」　テレビ局記者ら2人が連携、取り押さえる　神戸の路上（神戸新聞NEXT）,https://news.yahoo.co.jp/articles/b1d90c677f077453a28a8698936d4834f9d5c00b,https://newsatcl-pctr.c.yimg.jp/t/amd-img/20231204-00000003-kobenext-000-3-view.jpg?exp=10800,2023-12-04T08:30:09+09:00,2023-12-04T08:34:33+09:00,神戸新聞NEXT,kobenext,神戸新聞NEXT,670,\n連携プレーで容疑者を取り押さえた大野雄斗さん（右）と前川英樹さん＝生田署\n全速力で走り去る盗撮容疑者を連携して取り押さえたとして、兵庫県警生田署はいずれも神戸市中央区に住むテレビ局記者大野雄斗さん（２６）と自営業前川英樹さん（３２）に感謝状を贈った。\n【写真】ホテルの客1600人盗撮しネット中継\n署によると１０月１６日午前９時４０分ごろ、大野さんは、坂道を上がる女性（２１）の真後ろを男（５２）が歩く姿に気づいた。「距離が近いな」と視線を向けていると、男がかがみ、スマホを女性のスカートに入れる様子を目撃した。\n\n 思いきって女性に伝えると、女性も不審に思っていたといい、大野さんが「通報します」と話した途端、先を行く男が走り始めた。大野さんは１１０番しながら男を追いかけ、「証拠を残さなければ」とカメラも回した。\n\n 大野さんと女性は５分ほど追ったが、距離は縮まらない。その時、近くにいた前川さんは焦った表情で走る男を見かけ、女性に「何があったん？」と声をかけた。「盗撮された」という返事を受け、男をめがけて猛追。息子との野球で鍛えた脚力を生かし、坂道から約８００メートルの場所で取り押さえた。大野さんらも追いつき、駆けつけた警察官に男を引き渡したという。\n\n 生田署は男を性的姿態撮影処罰法違反（撮影未遂）の疑いで逮捕。容疑を認めたという。感謝状を受け取った大野さんは「通報自体も初めてで動揺した。同じ場面があればもっと早く対応したい」。前川さんは「諦めずに走ってくれた大野さんのおかげ」とたたえた。（安藤真子）,['https://newsatcl-pctr.c.yimg.jp/t/amd-img/20231204-00000003-kobenext-000-3-view.jpg?pri=l&w=640&h=402&exp=10800'],"['https://news.yahoo.co.jp/articles/b1d90c677f077453a28a8698936d4834f9d5c00b/images/000', 'https://www.kobe-np.co.jp/news/backnumber/201903/p1_0013286639.shtml']"
