headline,mainEntityOfPage,image,datePublished,dateModified,author,media_en,media_jp,str_count,body,images,external_links
中断している日ロの漁業交渉についてロシア側が「再開の意向」示す　帰国した鈴木宗男議員が札幌で報告（HTB北海道ニュース）,https://news.yahoo.co.jp/articles/8addd26c0f4ddc8c2d37f882306507f80363aaae,https://newsatcl-pctr.c.yimg.jp/t/amd-img/20260510-00000008-htbv-000-2-thumb.jpg?exp=10800,2026-05-10T23:31:45+09:00,2026-05-10T23:37:06+09:00,HTB北海道ニュース,htbv,HTB北海道ニュース,416,HTB北海道ニュース ロシアを訪問していた鈴木宗男参議院議員が帰国し、昨年末から中断している漁業交渉についてロシア側が再開の意向を示したと話しました。 今月３日から６日にかけてモスクワを訪問していた自民党の鈴木宗男議員は、10日午後に札幌市内で集会を開きました。この中で互いの２００海里水域内で行う漁業の操業条件を決める「日ロ地先沖合漁業協定」について、ロシア側から「今月２０日すぎに交渉を再開したい」と説明があったことを明らかにしました。この交渉は毎年、年末に行われていますが、昨年末から中断していました。 ■自民党・鈴木宗男議員 「（交渉が再開して）私はこれは良かったなと思って、ほっとしています。人間関係をしっかりわかって交渉しなければダメだなということを、つくづく感じました」 また、ウクライナへの侵攻以来行われていない外務大臣の会談については、７月にも開催の用意があると伝えられたことを報告しました。 HTB北海道ニュース,[],[]
津波発生時の避難の妨げを解消　室蘭市でJRの線路を横断できる非常用の扉を設置　住民が参加し訓練（HTB北海道ニュース）,https://news.yahoo.co.jp/articles/b073e22ba445f150d1cd4c79dc98d719c00c1b01,https://newsatcl-pctr.c.yimg.jp/t/amd-img/20260510-00000007-htbv-000-2-thumb.jpg?exp=10800,2026-05-10T18:18:23+09:00,2026-05-10T19:14:14+09:00,HTB北海道ニュース,htbv,HTB北海道ニュース,389,HTB北海道ニュース 北海道室蘭市では津波から避難する時に線路を横断できる扉が３か所設けられ、周辺の住民が参加して訓練が行われました。 線路への立ち入りは原則禁止されています。しかし津波が発生した時に高台への避難の妨げになっていたことから、JR東室蘭駅付近の３ヵ所に限定して、線路に入るための扉が設置されました。 津波が来た際には、扉を開けて線路を横断し高台に避難できます。10日は三ヵ所の扉でそれぞれ説明会が開かれ、あわせて１１０人の住民が参加して線路を横断するときのルールを確認しました。 ■室蘭市東地区町内会連合会 橋本正敏会長「夜の（照明の）対応はどうかとか、でこぼこした線路を渡る危険性はどうか、いろいろな課題はこれからの対応になりますので」 扉は大津波警報と津波警報が発表された時に住民が自ら開けることができ、今月２０日から運用が開始されます。 HTB北海道ニュース,[],[]
「爆発があり出火した」江別市で農業用倉庫が全焼　けが人なし（HTB北海道ニュース）,https://news.yahoo.co.jp/articles/afc408d99fbf339271b3ac4dfcf49965c3795853,https://newsatcl-pctr.c.yimg.jp/t/amd-img/20260510-00000006-htbv-000-2-thumb.jpg?exp=10800,2026-05-10T18:18:10+09:00,2026-05-10T19:14:12+09:00,HTB北海道ニュース,htbv,HTB北海道ニュース,249,HTB北海道ニュース 10日、北海道江別市で農業用の倉庫が燃える火事がありました。 倉庫から赤い炎と大量の黒い煙が噴き出しています。 午前１０時１５分ごろ、江別市江別太の農業法人の敷地内にある倉庫で、関係者から「建物で爆発があり、出火した」と消防に通報がありました。 消防車など１３台が出動し、火はおよそ４時間後に消し止められました。倉庫には農機具や農薬などが入っていて、倉庫は全焼しましたが出火当時は人はおらず、けが人はいません。警察と消防が出火原因など詳しく調べています。 HTB北海道ニュース,[],[]
熱い闘いに大歓声！北海道福島町で母の日恒例「女だけの相撲大会」（HTB北海道ニュース）,https://news.yahoo.co.jp/articles/baacadf5669ae298de98c38f49b027dd3f99303a,https://newsatcl-pctr.c.yimg.jp/t/amd-img/20260510-00000005-htbv-000-3-thumb.jpg?exp=10800,2026-05-10T18:17:50+09:00,2026-05-10T19:14:16+09:00,HTB北海道ニュース,htbv,HTB北海道ニュース,339,HTB北海道ニュース 北海道の福島町で母の日恒例の「女だけの相撲大会」が開催され、全国から力自慢の女性が集結しました。 ■前田愛奈記者「土俵の上では女性同士の熱い闘いが繰り広げられています。会場も盛り上がっています」 今年で３２回目の開催となった「女だけの相撲大会」。千代の山と千代の富士の２人の横綱を輩出した”相撲のマチ”福島町で、毎年、母の日に行われています。今年は６４人が参加し、頂点に輝いたのは、北海道知内町出身の「まこデラックス山」こと、西山まこさんです。最後は上手投げで決め、五度目の優勝を飾りました。 ■「まこデラックス山」西山まこさん（３１）「もう今日笑うのは自分なんだってずっとさっきまで心で唱えていたので、今笑うことができて嬉しいです」 HTB北海道ニュース,[],[]
歩行者がタクシーにはねられ重体「大変なことをしてしまった」…運転手の男を逮捕　札幌市中央区（HTB北海道ニュース）,https://news.yahoo.co.jp/articles/091a83835ee7501cc0235a041958c59e166a1e1f,https://newsatcl-pctr.c.yimg.jp/t/amd-img/20260510-00000004-htbv-000-2-thumb.jpg?exp=10800,2026-05-10T12:17:42+09:00,2026-05-10T12:36:17+09:00,HTB北海道ニュース,htbv,HTB北海道ニュース,318,HTB北海道ニュース １０日未明、札幌市中央区で歩行者がタクシーにはねられる事故があり、男性が意識不明の重体です。 事故があったのは札幌市中央区中島公園の市道です。 １０日午前２時半ごろ道路を渡っていた２０代の男性が、左から来たタクシーにはねられました。 警察によりますと男性は病院に運ばれましたが意識が無かったということです。 事故のあった現場には横断歩道はありませんでした。 警察はタクシーを運転していた札幌市豊平区の会社員五十嵐義人容疑者５５歳を過失運転致傷の疑いで現行犯逮捕しました。 調べに対し、五十嵐容疑者は「大変なことをしてしまった」と容疑を認めています。 警察は当時の状況などを詳しく調べています。 HTB北海道ニュース,[],[]
山菜採りシーズンに　警察が遭難防止やヒグマの被害防止をよびかけ…北海道北広島市の登山口で啓発活動（HTB北海道ニュース）,https://news.yahoo.co.jp/articles/5eddb0b30d9f452b57c342bedc399addec314813,https://newsatcl-pctr.c.yimg.jp/t/amd-img/20260510-00000003-htbv-000-2-thumb.jpg?exp=10800,2026-05-10T12:17:32+09:00,2026-05-10T12:36:15+09:00,HTB北海道ニュース,htbv,HTB北海道ニュース,413,HTB北海道ニュース 山菜採りのシーズンを迎え、１０日北広島市では警察が山に訪れた人に遭難防止やヒグマの被害防止の啓発活動を行いました。 北広島市の北広山登山口では、警察が車で山菜採りなどに訪れた人に直接声をかけ、チラシなどを配りました。 緑や紺の服は藪にまぎれやすく、遭難した際に救助が遅れる可能性があるため赤や白など目立つ色の服の着用を呼びかけています。 山菜採りに訪れた人 「鈴をもっているということと、あまり深入りしないということを気を付けています。 （ヒグマ）怖いのでクマスプレーは今日は持ってきていないけど今後は購入して入るようにしようと思います」 またヒグマの出没が相次いでいることを受け実際に遭遇した際の行動やクマスプレーを使ったヒグマから被害を防止する訓練もあわせて行われました。 警察は山に入る際には携帯電話などの通信機器のほかホイッスルやクマスプレーを所持するよう呼びかけています。 HTB北海道ニュース,[],[]
【速報】「建物から爆発し、１階から出火した」江別市で倉庫が炎上中　今のところけが人の情報なし（HTB北海道ニュース）,https://news.yahoo.co.jp/articles/a660e1d7a86d1605e4883dc38f7569748abc9490,https://newsatcl-pctr.c.yimg.jp/t/amd-img/20260510-00000002-htbv-000-4-thumb.jpg?exp=10800,2026-05-10T12:14:41+09:00,2026-05-10T12:36:12+09:00,HTB北海道ニュース,htbv,HTB北海道ニュース,179,HTB北海道ニュース 速報です。 江別市の倉庫から火が出て、今も炎上中です。 倉庫から赤い炎と大量の黒い煙が噴き出しています。 午前１０時１５分ごろ、江別市江別太の倉庫で関係者の女性から「建物から爆発し、１階から出火した」と消防に通報がありました。 消防車９台が出動し、消火活動が続いています。 これまでに、けが人は確認されていません。 HTB北海道ニュース,[],[]
「車にいたずらしてしまった…」ワイパー１本を折り曲げたか　交番に自首　地方公務員の男を逮捕　石狩市（HTB北海道ニュース）,https://news.yahoo.co.jp/articles/c313dbbdfee31d89c7e3d9ae485cab3d2ddd43d2,https://newsatcl-pctr.c.yimg.jp/t/amd-img/20260510-00000001-htbv-000-2-view.jpg?exp=10800,2026-05-10T10:10:44+09:00,2026-05-10T10:16:08+09:00,HTB北海道ニュース,htbv,HTB北海道ニュース,326,（写真：HTB北海道ニュース） 石狩市の共同住宅駐車場で止まっていた車のワイパーを折り曲げたとして、地方公務員の４０代男性が、逮捕されました。 器物損壊の疑いで、緊急逮捕されたのは、石狩市に住む、地方公務員の４０代の男です。 男は、８日午後８時ごろから９日午前１０時ごろまでに、石狩市花川南５条１丁目の共同住宅の駐車場に止まっていた５０代男性のワンボックスカーのワイパー１本を折り曲げた疑いが持たれています。 警察によりますと、９日午後０時半前、男が「車にいたずらしてしまった」と近くの交番に自首し、事件が発覚しました。 男と男性に面識はないということです。 付近では、同様の被害が確認されていて、警察は男との関連を調べています。 HTB北海道ニュース,[],[]
