headline,mainEntityOfPage,image,datePublished,dateModified,author,media_en,media_jp,str_count,body,images,external_links
【Bリーグ】島根スサノオマジックが佐賀バルーナーズに痛恨の逆転負け…今季ワースト5連敗（TSKさんいん中央テレビ）,https://news.yahoo.co.jp/articles/a21991a3736d919ffd32a79637463ca6a97b03ef,https://newsatcl-pctr.c.yimg.jp/t/amd-img/20260314-90022699-tsk-000-1-view.jpg?exp=10800,2026-03-14T19:12:01+09:00,2026-03-14T19:12:01+09:00,TSKさんいん中央テレビ,tsk,TSKさんいん中央テレビ,543,山陰中央テレビ B1島根スサノオマジックは、3月14日に連敗ストップをかけてホームで佐賀バルーナーズと対戦しました。 しかし痛恨の逆転負けで今シーズンワーストの5連敗となりました。 今シーズンワーストタイ４連敗中の島根スサノオマジック。ホームで西地区７位の佐賀と対戦しました。 前節・大阪戦でけがをしたエースの岡田が欠場した中、キャプテンのニック・ケイ。 中村太地などが奮闘しました。 今シーズン2戦して2敗と相性の悪い佐賀にリードを許しますが、何とか食らいつきます。 第3Qには…ニック・ケイのビッグショット！ファールを受けながら3ポイントシュートを決めて同点。フリースローも決めて、ついに逆転に成功します。 これで勢いに乗った島根が、７点差までリードを広げます。 連敗脱出かと思われましたが、最終第4Q…粘る佐賀に33失点。 91対96で痛恨の逆転負け、今シーズンワーストを更新する5連敗となりました。 主なスコアは、ニック・ケイがチーム最多の27得点・9リバウンド。 コティ・クラークが20得点・4リバウンド。マカドゥが16得点・6リバウンド。 中村太地が11得点・3アシスト。納見悠仁が2得点8アシスト。 15日は佐賀とのゲーム2が行なわれ、連敗脱出を狙います。 山陰中央テレビ,[],[]
15日号砲！まつえレディースハーフマラソン　熱いレースに期待高まる中で準備進む（島根・松江市）（TSKさんいん中央テレビ）,https://news.yahoo.co.jp/articles/54297be10d6adb4e4d28b41d99d9e82f009061aa,https://newsatcl-pctr.c.yimg.jp/t/amd-img/20260314-90022698-tsk-000-1-view.jpg?exp=10800,2026-03-14T18:37:01+09:00,2026-03-14T18:37:01+09:00,TSKさんいん中央テレビ,tsk,TSKさんいん中央テレビ,325,山陰中央テレビ 早春の城下町・松江で開催されるまつえレディースハーフマラソン。 15日の大会を控えた14日、テレビ中継のリハーサルなど準備が進められました。 まつえレディースハーフマラソンには、4つの部にあわせて1870人が出場する予定です。 このうちハーフマラソンには、学生、実業団などから合わせて170人がエントリー。 日本学生女子ハーフマラソン選手権を兼ねていて「学生日本一」の座を争う戦いも注目されています。 レースの模様を生中継で放送するTSKさんいん中央テレビ本社では、スタート時間に合わせてリハーサルが行われ、映像のチェックや本番の流れを確認しました。 松江レディースハーフマラソンは15日午前10時2分にスタートです。 山陰中央テレビ,[],[]
ノロウイルスが原因…スーパーの仕出し弁当で37人食中毒に　そうざい調理施設などを営業停止処分（島根）（TSKさんいん中央テレビ）,https://news.yahoo.co.jp/articles/140c5cd4fcfd04fba85991b4ca903cf9f5d36b27,https://newsatcl-pctr.c.yimg.jp/t/amd-img/20260314-90022697-tsk-000-1-view.jpg?exp=10800,2026-03-14T18:21:01+09:00,2026-03-14T18:21:01+09:00,TSKさんいん中央テレビ,tsk,TSKさんいん中央テレビ,452,山陰中央テレビ 島根県松江市のスーパーマーケットで調理された仕出し弁当を食べた37人が、下痢や嘔吐などの食中毒症状を訴えていることが3月14日に分かりました。 松江市は、このスーパーの飲食店とそうざい製造施設を4日間の営業停止処分にしました。 原因はノロウイウルスだということです。 松江市によると、3月13日に市民から保健所に「3月8日に提供された仕出し弁当を食べた複数の者が、嘔吐や下痢の症状を呈した」との連絡がありました。 松江保健所が調査したところ、8日に松江市東出雲町にある「アイパルテ東出雲店」で調理された仕出し弁当が1グループに提供されていて、この弁当を食べた37人が下痢や嘔吐などの症状を訴えていることがわかりました。 検査の結果、患者と調理従事者の便からノロウイルスが検出されたことなどから、この施設を原因とする食中毒と断定し、飲食店営業とそうざい製造について14日から4日間の営業停止処分としました。 患者で入院した人はおらず、全員が快方に向かっているということです。 山陰中央テレビ,[],[]
松江市の国道431号で車2台が衝突　1人を救急搬送　現場付近は一時的に片側交互通行規制（島根）（TSKさんいん中央テレビ）,https://news.yahoo.co.jp/articles/9f92e1bf3dec62e9b50fecfb9f376a977371d422,https://newsatcl-pctr.c.yimg.jp/t/amd-img/20260314-90022696-tsk-000-2-thumb.jpg?exp=10800,2026-03-14T17:19:02+09:00,2026-03-14T18:38:01+09:00,TSKさんいん中央テレビ,tsk,TSKさんいん中央テレビ,245,山陰中央テレビ 3月14日夕方、島根県松江市の国道で車2台が衝突する事故があり、1人がけがをして病院に搬送されました。 事故があったのは、松江市美保関町森山の国道431号で、消防によると14日午後4時過ぎ、「車同士の交通事故で1人がけがをしている」との通報がありました。 衝突した車2台にはあわせて5人が乗っていて、このうち1人がけがをして病院に搬送されました。意識はあり、命に別状はないということです。 この事故のため、現場付近は一時的に片側交互通行の措置が取られました。 山陰中央テレビ,[],[]
鳥取県教委が職員2人を懲戒処分　不適切事務の職員は減給、重傷事故起こした教諭は戒告（TSKさんいん中央テレビ）,https://news.yahoo.co.jp/articles/ddf7c3f51c0a833c80c006a0120dfce95b4aac7a,https://newsatcl-pctr.c.yimg.jp/t/amd-img/20260314-90022695-tsk-000-1-view.jpg?exp=10800,2026-03-14T16:04:01+09:00,2026-03-14T16:04:01+09:00,TSKさんいん中央テレビ,tsk,TSKさんいん中央テレビ,447,山陰中央テレビ 鳥取県教育委員会は3月14日、経費の支払いなど事務処理を遅らせるなどした小学校の男性事務職員を減給処分に、車で自転車に乗っていた人をはねて大けがをさせた中学校の男性教諭を戒告処分にしたことを発表しました。 減給処分を受けたのは、伯耆町立岸本小学校に勤務する56歳の男性事務主幹で、2024年9月から25年9月までの間の12回に渡り、職員の旅費や教材費など合わせて約142万円の支払いを遅らせたほか、集金した金銭の管理を怠り4000円を所在不明にしたということです。 県教委は、学校や教職員全体の信頼を損なう行為だったとして減給10分の1・1か月の懲戒処分にしました。 また戒告処分を受けたのは、米子市立福米中学校に勤務する61歳の男性教諭で、2025年10月に自家用車を運転して帰宅する際、学校の前の交差点で自転車に乗っていた人をはね、骨折の大けがをさせる事故を起こしたということです。 県教委は、教職員への指導を改めて徹底するなど再発防止に努めるとしています。 山陰中央テレビ,[],[]
食や文化など島根県の魅力体感を！「しまね万博2026」開催（松江市）（TSKさんいん中央テレビ）,https://news.yahoo.co.jp/articles/6df8cc7302dde224b175bfad44d691e26e9215be,https://newsatcl-pctr.c.yimg.jp/t/amd-img/20260314-90022694-tsk-000-1-thumb.jpg?exp=10800,2026-03-14T12:13:01+09:00,2026-03-14T12:13:01+09:00,TSKさんいん中央テレビ,tsk,TSKさんいん中央テレビ,324,山陰中央テレビ 食や文化などを通じて島根県の魅力を発信するイベント「しまね万博2026」が3月14日、松江市で開催されています。 しまねっこのふわふわドームで楽しく飛び跳ねる子どもたち。 松江市のくにびきメッセで14日午前10時から開催されているしまBang！「しまね万博2026」。 島根県の食や文化を楽しく学んだり、地域の仕事の魅力にも触れられる体験型イベントで、TSKさんいん中央テレビなど山陰のメディア3社が企画しました。 会場には「企業」、「体験型」「グルメ」など4つのパビリオンが設けられているほか、ステージイベントもあり会場を盛り上げています。 しまBang！は、松江市のくにびきメッセで午後4時まで開催されています。 山陰中央テレビ,[],[]
鳥取県警の新本部長に梅田直嗣内閣官房参事官が着任へ　青山本部長は警察庁に異動（TSKさんいん中央テレビ）,https://news.yahoo.co.jp/articles/3c34376ede9b6bd7f49c6d3aca92d4d8b806e06c,https://newsatcl-pctr.c.yimg.jp/t/amd-img/20260314-90022693-tsk-000-1-view.jpg?exp=10800,2026-03-14T10:02:01+09:00,2026-03-14T10:02:01+09:00,TSKさんいん中央テレビ,tsk,TSKさんいん中央テレビ,184,山陰中央テレビ 鳥取県警の新しい本部長に、内閣官房の梅田直嗣参事官が3月27日付で着任することが分かりました。 梅田直嗣新本部長（54）は、名古屋大学大学院を修了後、1997年に警察庁に採用。 情報通信企画課の理事官や岐阜県警の警務部長などを経て、2023年から内閣官房の参事官を務めていました。 青山真一本部長は、警察庁の犯罪鑑識官に異動となります。 山陰中央テレビ,[],[]
