headline,mainEntityOfPage,image,datePublished,dateModified,author,media_en,media_jp,str_count,body,images,external_links
元ピクサーのアニメーターが語る「ハリウッドでAIが通用しない理由」（ギズモード・ジャパン）,https://news.yahoo.co.jp/articles/0a853c3520ba1718c5020cf91a7696b4e78da687,https://newsatcl-pctr.c.yimg.jp/t/amd-img/20240511-00000002-giz-000-1-view.jpg?exp=10800,2024-05-11T11:30:02+09:00,2024-05-11T11:30:02+09:00,ギズモード・ジャパン,giz,ギズモード・ジャパン,1800,\n元ピクサーのアニメーターが語る「ハリウッドでAIが通用しない理由」\n昨今、AIが生成した動画が良くも悪くも常に話題になっています。ネタ動画を作るだけではなくて、これでプロの現場・ハリウッドも劇的に変わるのではないか？という声も聞こえてきます。\n\nその問いに「No」と答えるのは、『トイ・ストーリー』や『ファインディング・ニモ』などの制作に携わった、元Pixarアニメーターのクレイグ・グッドさん。\n\nグッドさんいわく、AIをプロの現場で使うには、関係者全員をイラつかせてしまう大きな欠点があるといいます。それは、微調整が効かないこと。\n\n生成AIは、作りたいものをテキストで入力するだけで画像や動画を作り出します。何もないゼロ状態から作り出されるものとして、正直驚くべき出来です。ただ、現時点では、そうやってできたものをちょっとだけ変えるという修正ツールはありません。それが致命的。なぜなら、そのちょっといじるという微調整が映画制作現場では日常茶飯事であり必要不可欠だからです。\n\nグッドさんが助教授として務めるカリフォルニア美術大学の生徒と、AI生成動画についてディスカッションする動画を公開。動画では、OpenAIの動画AI Soraが生成した動画を見ながらトークを展開しています。\n\nグッドさん「もし、これを制作で使うとしたら、最初に気になるのは修正はどうするつもり？ということですね。もし、この映像の背景が嫌だとなった場合、まったく同じものを背景なしまたは別の背景にすり替えて作るという調整はできるのでしょうか」\n\n現時点で、OpenAIのSoraは一般公開されていません。\n\nなので、このトークはあくまでもアーリーアクセス権を得た一部のアーティストが生成したサンプル動画を見ての話。ゆえに、動画生成をしたアーティストがどのようにツールを使い、どのような選択肢があったのかはわかりません。\n\n生成したものが調整可能か、可能であればどの程度できるのか、わからないことだらけ。グッド氏のトークは、現時点でその不明な点を指摘するものです。\n\nグッド氏と生徒がサンプルとして見たのは、Sora生成のアニメーション。モフモフとしたかわいいモンスターがキャンドルを触ろうと戯れるというシーンです。グッド氏は、その出来に感心しつつも、画がタイトすぎること、また炎にまったく動きがなく存在が薄いことを指摘。この指摘にそって微調整するとしたら、もう少し引きのカメラワークで、炎にも揺らぎをつけるということになりますが、このちょっとした変更は、現時点でAIにとっては非常に難しいタスク。\n\n「映画制作は繰り返しの連続です。何度も繰り返してこそ」と語るグッド氏。「私はPixarで何十年もシーンの微調整をしてきました。監督がアニメーターに詳細を書いたメモを渡し、アニメーター・アーティストはそのメモに沿って調整をかける。翌日それを監督に見せ、さらに細かい指示を受ける。それができないとなれば、制作現場のツールとしてどれだけ使えるかわかりませんね」\n\nグッド氏だけでなく、X上では同じ視点から生成AIのもつ制限を指摘する声が拡散され、注目されたことも。このXポストのソースはハッキリしないものの、自称大手スタジオのアートディレクターで、スタジオがAI開発者を連れてはきたがまったく役に立たなかったと語っています。問題は同じで、AI生成された映像自体は悪くなかったものの、微調整がきかず制作には使えなかったというもの。微調整を求められたAI開発者の方が、そういう仕組みじゃないのに！と怒ってしまったというオマケエピソードつき。\n\nプロの目で見ると、TikTokなどのユーザー生成コンテンツでは大いに活躍するものの、プロの映画制作現場では役不足だという生成AI。\n\n一方で、グッド氏は「今後はわからない」とも語っています。役不足なのはあくまでも現時点のSoraなどの生成AI。将来的に大きく変わっていく可能性はあるといいます。\n\n1980年代のコンピューターグラフィックスを例にだし「機械的に歩くアリの映像を見たSIGGRAPHの初期の頃を思い出します。あれにはみんなとても驚きました。とんでもないものを見させられているぞって。1984年の話です」\nそうこ,['https://newsatcl-pctr.c.yimg.jp/t/amd-img/20240511-00000002-giz-000-1-view.jpg?pri=l&w=640&h=362&exp=10800'],['https://news.yahoo.co.jp/articles/0a853c3520ba1718c5020cf91a7696b4e78da687/images/000']
今すぐ買いに行こう。無印良品のおすすめUV対策アイテム3選（ギズモード・ジャパン）,https://news.yahoo.co.jp/articles/568720967265d6155eaebd1baad37c86a80fa710,https://newsatcl-pctr.c.yimg.jp/t/amd-img/20240511-00000004-giz-000-1-view.jpg?exp=10800,2024-05-11T19:00:01+09:00,2024-05-11T19:00:01+09:00,ギズモード・ジャパン,giz,ギズモード・ジャパン,1229,\n今すぐ買いに行こう。無印良品のおすすめUV対策アイテム3選\n毎年言っている気がするけど、今年暑さ凄くないですか？\n\nまだ５月だというのに、既にこの暑さと日差し。帽子に日焼け止め、サングラスと、UV対策が欠かせませんね。\n【全画像をみる】今すぐ買いに行こう。無印良品のおすすめUV対策アイテム3選\nそこで今回は、無印良品でゲットできるおすすめのUV対策アイテムをまとめてご紹介します。\n熱中症＆日焼け対策が同時にできるスカーフ\n無印良品の「ポケット付きスカーフ」は、ストールほど長くなく、バンダナよりはちょっと長めという、絶妙なサイズ感のアイテム。\n\n2023年のモデルはユーカリ由来のリヨセルが入って冷感接触機能がアップ。化繊の冷感素材には一歩劣りますが、ペタペタ感がなく汗をかいてもさらりと快適です。\n\n横幅が13cmと広いため、日に焼けやすい首の後ろをしっかりガード。また、首に当たる部分には保冷剤を入れるためのポケットが付いているので、同時に熱中症対策もできちゃうのが嬉しいポイント。\n\n初夏から夏本番まで、毎年手放せない相棒になっています。\n\n詳しくはこちら↓\n折りたたみ日除けが頼もしい「持ち歩ける日陰」\n無印良品から登場した新作「UVカット 日陰を持ち歩く」シリーズは、UVカット率90％以上、UPF50+の撥水生地を使用したキャップ＆サファリハット。\n\n「UVカット 日陰を持ち歩く キャップ」にはかなり大きな日除けが付いていますが、こちらは折りたたんで収納可能。日差し対策用のキャップとタウンユースのキャップをひとつまとめられちゃいます。\n\n一方の「UVカット 日陰を持ち歩く サファリハット」の日除けは、折りたたみはできませんが、ボタン式で取り外せる仕様。こっちの日除けは胸あたりまである＆顎下で留められるので、炎天下での長時間の作業やアクティビティに良さそうです。\n\n詳しくはこちら↓\n髪の毛から足先まで手軽にUVカット\n全身の日焼け対策におすすめなのが、汗・水に強いウォータープルーフタイプの「日焼け止めジェル」。UVカット性能はSPF50+・PA++++と高性能で、さらにうるおい成分としてヒアルロン酸Naが配合されている点も嬉しいポイントです。\n\n付け心地はとても軽やかで、無香料だから日焼け止め特有のニオイが全くしないところもグッド。顔に塗ってもストレスフリーでした。\n\nこれと合わせて使っているのが、「アウトドアスプレー」です。ミストタイプの日焼け止めで、合成香料無添加・無着色・無鉱物油・パラベンフリー・アルコールフリーと、肌にやさしい作りとなっている点が特徴的。\n\n肝心なUVカット性能は、SPF33 PA+++。髪の毛に直接スプレーしてもOKなので、「日焼け止めジェル」でカバーできない頭部もこの1本があれば安心ですよ。\n\n詳しくはこちら↓\nシラクマ,['https://newsatcl-pctr.c.yimg.jp/t/amd-img/20240511-00000004-giz-000-1-view.jpg?pri=l&w=640&h=360&exp=10800'],"['https://news.yahoo.co.jp/articles/568720967265d6155eaebd1baad37c86a80fa710/images/000', 'https://www.gizmodo.jp/2024/05/muji-uv-items-matome.html?mode=assets&p=2']"
映画『変な家』、原作を知らずにホラー映画だと思って見に行った結果...（ギズモード・ジャパン）,https://news.yahoo.co.jp/articles/3aaf4c0544c89d88143ccbcb6d1ac87992bd8493,https://newsatcl-pctr.c.yimg.jp/t/amd-img/20240511-00000005-giz-000-1-view.jpg?exp=10800,2024-05-11T20:30:01+09:00,2024-05-11T20:30:01+09:00,ギズモード・ジャパン,giz,ギズモード・ジャパン,963,"\n映画『変な家』、原作を知らずにホラー映画だと思って見に行った結果...\n現在大ヒット公開中の映画『変な家』。あまりの人気ぶりに少し気になり始めていた頃、友人から「あの映画めちゃ怖いらしいよ」と期待高まる情報を聞き、ホラー映画好きとして早速見に行ってみることに。\n\n結論からいうと、確かに想像していたよりも怖い映画ではあったのの、「ミステリー」と「Jホラー」を足して2で割ったような、多少無理やりさを感じてしまう作品でした。\n途中から雰囲気がガラッと変わる\n本作のキーアイテムとなるのは、訳ありの変な間取り図。オカルトコンテンツを配信する動画クリエイター、雨宮がその不可解な謎を追っていくうちに奇妙な現象に巻き込まれていく、というのが簡単なあらすじです。\n\nこちらの動画がメインの内容になっていて、原作は書籍『変な家』。ちなみに私は原作にはなにも触れずに映画を鑑賞しました。\n\n上映時間は110分とそれほど長くはなく、特に前半に関してはハラハラドキドキさせられるシーンがいくつもあったり、主人公と一緒に謎を追っていく感覚を楽しむことができました。\n\nただ、個人的に違和感を感じたのが映画の後半部分。物語が進むにつれ謎はどんどん明らかになっていくものの、ある事実が発覚した途端、シーンがミステリーからアジアンホラーのような鬱々とした雰囲気へガラッと変わったり、物語の展開があまりにも早すぎて、「一体何が起きてるんだ...」状態に陥りました。\n\nあらかじめ原作に触れた状態で鑑賞していたら理解できるシーンも多かったのかもしれませんが、個人的には人間関係や物語を含めたいろいろな点で物足りないと感じる部分があり、映画を見終えたときはモヤモヤが残りました。\n\nちなみに、本作はPG12やR15+などの年齢制限はないものの、全体的にそこそこグロシーンが多めだったので、残虐描写がニガテな方は注意した方がよろしいかと。\n\nそれから、それなりにホラー耐性のあるこれから見ようと思っている方は、スクリーンの大きさよりも音にこだわった劇場で見た方が楽しめると思いますよ。\n\nうーん、『変な家』というよりかは、変な〇〇の物語だったかなぁ...。\n\nSource: YouTube, 変な家\nはらいさん",['https://newsatcl-pctr.c.yimg.jp/t/amd-img/20240511-00000005-giz-000-1-view.jpg?pri=l&w=640&h=360&exp=10800'],['https://news.yahoo.co.jp/articles/3aaf4c0544c89d88143ccbcb6d1ac87992bd8493/images/000']
次世代Nintendo Switchと真っ向勝負か。Xboxポータブルの足音（ギズモード・ジャパン）,https://news.yahoo.co.jp/articles/0bd5df301dba14439fdea815da2ec4e80f12c9d1,https://newsatcl-pctr.c.yimg.jp/t/amd-img/20240511-00000001-giz-000-1-view.jpg?exp=10800,2024-05-11T06:00:02+09:00,2024-05-11T06:00:02+09:00,ギズモード・ジャパン,giz,ギズモード・ジャパン,1134,\n次世代Nintendo Switchと真っ向勝負か。Xboxポータブルの足音\n時代はハンドヘルド！\n\nXboxって、テレビにつないで、リビングで本格的にプレイする据え置き型のコンソールゲーム機のイメージしかありません。ですが、いろいろ今後について模索する動きはなきにしもあらず。もっとも待望されるのは、ポータブルに携帯できる「Xbox Portable」なるハンドヘルドマシンではないでしょうか。\n市場調査も展開中\n実はMicrosoft（マイクロソフト）が、Xboxのポータブルゲーム機のバージョンを計画中では？ そういううわさは以前からありました。プロトタイプの開発だったり、すでにスペシャルチームが立ち上がって計画は進んでいるなんて話だったり。\n\nこのほどPure Xboxは、Microsoftから、一部のXboxユーザーらに送られたとする、全28ページにまたがるアンケート調査について報じました。ハンドヘルドゲーミングPCというジャンルについて、その使用感や購買意欲などを問う内容なんだとか。主には、すでに市場へ出回っているモデルへの率直な意見が求められています。\n\nしかしながら、気になる質問として、これから数年以内に新たなハンドヘルドゲーミングPCのモデルを購入したいと思うか？ それを購入したうえで、さらに現行のXboxコンソールゲーム機やWindowsパソコンは必要だと感じるか？ いわばXboxにもWindowsマシンにもなり得る、最新のハンドヘルドゲーミングPCの可能性について、Microsoftが検討しているかのように取れなくもない調査だとされていますね。\nSwitch後継機と勝負？\nValveの「Steam Deck」に始まって、Lenovo（レノボ）が発売した「Legion Go」だったり、ハンドヘルドゲーミングPCの市場が盛り上がってきてます。なかにはWindowsパソコンとして、ビジネスにだって活用できるポータブルマシンと重宝される動きも。そもそも「Xbox Game Pass」を利用すれば、別にXboxの専用機がなくても、対応ゲームをポータブル環境でプレイできてしまいますしね。\n\nさらに、世の流れは、任天堂が新たに発表する「Nintendo Switch」の後継機に注目が集まっています。もしMicrosoftが、公式にXboxにもWindows PCにもなる、ポータブルな次世代Xboxなんてブツけてきたら…？ その新たなハンドヘルドゲーミングPCには、Windows 12が搭載されているのかもしれませんけど、楽しみなかぎりですよね。\n\nSource: Pure Xbox\n湯木進悟,['https://newsatcl-pctr.c.yimg.jp/t/amd-img/20240511-00000001-giz-000-1-view.jpg?pri=l&w=640&h=360&exp=10800'],['https://news.yahoo.co.jp/articles/0bd5df301dba14439fdea815da2ec4e80f12c9d1/images/000']
光る生き物は5億4000万年前から存在していたらしい（ギズモード・ジャパン）,https://news.yahoo.co.jp/articles/9b9da838367ff96472ef23b45b7103b5fda0be7f,https://newsatcl-pctr.c.yimg.jp/t/amd-img/20240511-00000006-giz-000-1-view.jpg?exp=10800,2024-05-11T21:30:01+09:00,2024-05-11T21:30:01+09:00,ギズモード・ジャパン,giz,ギズモード・ジャパン,1438,\n光る生き物は5億4000万年前から存在していたらしい\n古代から光る動物はいた！\n\n動物が光る不気味だけど美しい現象「生物蛍光」が、従来考えられていたよりもはるかに古くからあったことが、八放サンゴ綱の発光能力を調査していた研究チームによって明らかになりました。\n【全画像をみる】光る生き物は5億4000万年前から存在していたらしい\n5億4000年前から光っていた\n八放サンゴ綱は、イソギンチャクやクラゲと同じ刺胞動物というグループに属する動物です。海洋に生息していて、光るんです。外部の光源にさらされて光ることを「生物蛍光」と言います。そして、Proceedings of the Royal Society Bに掲載された最新研究によると、少なくとも5億4000万年前から八放サンゴ綱は光続けていることがわかっています。\n\nスミソニアン博物館の動物学者であり、この研究の共著者であるAndrea Quattrini氏は、Gizmodoに取材に対してメールで以下のように説明してくれました。\n\nカンブリア紀に光を感知できる動物が進化したことから、私たちの研究は動物が急速に多様化し、新しい環境に適応していた時代に、八放サンゴ綱と他の種との間で光を介した相互作用が起こった可能性を示唆しています。今回わかったことは、生物蛍光が生命の樹に広く存在する多くの動物、特に深海に生息する動物にとって重要なコミュニケーションの手段であるということです。\n生物蛍光と生物発光の違い\n八放サンゴ綱の発光は、ルシフェラーゼと呼ばれる酵素によって起こります。ルシフェラーゼは光を放つ化学反応を触媒します。これは、ホタルなどが持つ自分の体内の反応で光を放つ生物発光とは異なり、Quattrini氏によるとホタルはマグネシウムとATP（アデノシン三リン酸）を使用して点滅します。\n\n昨年、別の研究チームが生物蛍光自体がこれまで考えられていたよりも一般的でレアな現象ではないことを発表しています（生物蛍光は外部の光源の下で起こり、自分の体内から光を出す生物発光とごっちゃになりがちです）。\n\n2020年の研究によると、生物蛍光は少なくとも94回独立して進化したとされています。二枚貝の中に入っている小さなエビのような甲殻類の一種カイムシが、最も古く知られている例です。\n系統樹を駆使して判明\n生物蛍光がカイムシに由来した時期を解明するために、この研究チームは2022年にQuattrini氏のいるチームが作成したカイムシの進化系統樹を参照。次に、チームは2つのカイムシの化石を系統樹に配置し、系統が分岐した時期を特定。また、現在も生存している生物蛍光のある種を系統樹上にマッピングしました。\n\n共通祖先が生存していた深い時代のおおよその時期を特定するため、祖先状態復元という手法を用いて系統樹を分析しました。その結果、約5億4000万年前、つまりカンブリア紀爆発の直前に共通祖先が存在していたことがわかりました。このカンブリア紀爆発は、爆発的にさまざまな奇妙な生物が出現した時期でした。 \n\n研究チームは現時点では、統計的な手法に頼って生物蛍光の起源を推定するしかありません。しかしQuattrini氏は「いつか古代DNAの解析技術が進歩し、本当に古い化石からルシフェラーゼなどのDNAを検出できるようになるかもしれません」と述べています。\n岩田リョウコ,['https://newsatcl-pctr.c.yimg.jp/t/amd-img/20240511-00000006-giz-000-1-view.jpg?pri=l&w=640&h=425&exp=10800'],"['https://news.yahoo.co.jp/articles/9b9da838367ff96472ef23b45b7103b5fda0be7f/images/000', 'https://www.gizmodo.jp/2024/05/origins-of-bioluminescence-octocorals-evolution.html?mode=assets&p=2']"
