headline,mainEntityOfPage,image,datePublished,dateModified,author,media_en,media_jp,str_count,body,images,external_links
お金は「恋人のように」愛すべき...英長者番付でベッカム夫妻を超えた「韓国出身の起業家」が断言する理由とは？（ニューズウィーク日本版）,https://news.yahoo.co.jp/articles/b94c60d67092a5ebbb1dd2ba35889af9bab9b060,https://newsatcl-pctr.c.yimg.jp/t/amd-img/20250429-00010004-newsweek-000-1-view.jpg?exp=10800,2025-04-29T10:50:18+09:00,2025-04-29T10:50:18+09:00,ニューズウィーク日本版,newsweek,ニューズウィーク日本版,3293,"お金がない、人生がうまくいかない...それならば、お金を雑に扱ったり、お金をネガティブなものと捉えたりしていないかを見直そう
お金にも誠実に接してみよう（画像はイメージです）／Pexels/pixabay
英国の長者番付けでベッカム夫妻より上位になった韓国出身の起業家・ケリー・チェ氏は、チャンネル登録者数53万人のインフルエンサーとしても知られ、経済的にも、キャリアや人生も豊かにしたい多くの人をエンパワーしている。
【話題の写真】高速列車で前席のカップルが「最悪の行為」に及ぶ...インド人男性の撮影した「衝撃写真」にネット震撼
韓国で112刷のベストセラーになっている彼女の著書『富者の思考　お金が人を選んでいる』（小笠原藤子訳、CEメディアハウス）では、お金に接する態度が人生を決定づけると明言する。
恋人に接するようにお金を愛する？
『富者の思考　お金が人を選んでいる』 　ケリー・チェ［著］ 　小笠原藤子［訳］ 　CEメディアハウス［刊］
ドイツの資産管理の専門家でありライフコーチのイヴォンネ・ゼンは『お金の感情』（未邦訳）という著書で、お金への態度について意味のあるメッセージを残した。彼女は億万長者からアルバイトに至るまで、数万人の財政状況と人生の根本的な問題点を解決してきた。

お金が潤沢にあってもいつも不安な人、一生懸命働いてもお金が貯まらない人、お金を使っても楽しいと思えない人、富者に嫉妬する人などに、様々なカウンセリングをしながら、彼女が導き出した結論は、まさにこうだ。「お金に接する態度が人生を決定づける」。

彼女は「富はお金をいちばん尊いものと考える人に流れる」と強調しながら、お金との関係をうまく築くべきだとする。お金を一人の人間に見立て、恋人に接するように愛さなければならないと言う。

たとえば、収入の10％を投資すると決めたら、必ずその約束を守ることで、お金への信義を貫く。特定の消費を楽しいと思えないならその行動をすぐにやめることで、お金との良好な感情を維持する。

イヴォンネ・ゼンのお金に対する姿勢は、私が〈ウェルシンキング〉で強調した内容と一致する部分がある。お金の立場から見ると、自分をタダで得ようとする者と、誠実に近づいてくる者のうち、どちらに心の扉を開くのか。後者を選択するのは間違いない。自分を単に生存ツール程度に捉える者と、価値を見出してくれる者では、どちらを選ぶか。今回も後者に心を開くはずだ。
人がお金を選ぶのではなく、お金が人を選んでいる
どうだろう、あなたもこれで富者になる人は特別にいるという事実に同意できるだろうか？　結論を言えば、我々がお金を選択するのではない。お金が富者になる人を決めるのだ。

お金は人生で大切なもの。お金との関係を成立させられなければ、お金のせいで生まれるストレスから自由になれない。自分には手に入らないからと催促し、無分別な消費をし、感情に任せて好き勝手に罵倒し指弾するなら、そんなあなたを果たしてお金が選択するだろうか。

20世紀、女性ファッションの革新をリードしたフランスのデザイナー、ガブリエル・シャネルはお金についてこう語っている。「世の中にはお金がある人と富者がいる」。

〈ウェルシンキング〉を実践するあなたの目的が、単にお金にだけあってはならない。あなたの究極の目的は、「持続的に成長する幸福な富者になること」という事実を肝に銘ぜよ。あなたはなぜ富者になりたいのか、明確に知る必要がある。内面の根底にある空虚感を満たせないお金持ちになっても、幸せにはなれない。

お金を稼ぎたい理由がいくつかあるかもしれない。だが、1000人以上の自力で成功した富者を研究し、実際に会い、悟ったことがある。成長が止まれば、幸福ではないということだ。お金もあり、着実に成長できる時に、幸福になれるのだということを、決して忘れるな。善行の影響力をもって貢献することで、長きにわたり幸福を維持できるのだ。
富者に必ずあるもの＝強靭なメンタル
富の習慣を身につけるために必要な要素の一つが、強靭なメンタルだ。なんとしてでも富を築くぞ、という熱い意志があるなら、その意志を保ち続けるメンタルも欠かせない。自称「ガラスのメンタル」で、どんなことも継続が困難だと感じる人は多い。

だが、メンタルは決して生まれつきのものではない。メンタルとは、人生に与えられたミッションを一つずつ解決しながら、強化させるものだ。「メンタルトレーニング」があるように、メンタルは徹底的な訓練によって強化される。

私はタグのように付いて回った子供時代の貧しさと難読症による学習障害、事業の失敗などにより、辛い時期を過ごした。何事もできず、何かができるだろうと信じてすらいなかった。しかし、再起するためには、自分を苦しめた経験を引っ張り出して向き合う必要があった。私は辛い時期にメンタルトレーニングをしたが、今ではあの頃、自分が抱いていた感情を思い出すこともできない。

〈ウェルシンキング〉を通し、困難を克服したというプラスの感情だけが残り、現在は言葉で表せないほど感無量の思いだ。〈ウェルシンキング〉によるメンタル強化の思考習慣を紹介したい。
富者は気持ちの切り替えが早い
メンタルが強い人は、回復が早いという特性がある。コントロールできることに集中し、コントロールできないことは果敢に手放すのだ。

たとえば、誰にでも全く同じように降りかかる法的問題や社会問題、自然災害、不景気、あるいは両親から受け継ぐもの、自分が生まれた境遇などはどうすることもできない。コントロールできないものは不可抗力だ。影響を受けている今の自分と環境を改善することに没頭するしかない。コントロール力とは、自分が望む人生に到達するために、ほんの少しずつ前進するパワーのことだ。自分で変えられるものに集中し、新たな境地を切り拓くパワーだ。

万が一、うまくいくことがないと感じるなら、自分の心持ちが正しいのか確認する必要がある。気が散漫になっては、意志を成し遂げられない。あなたの人生の主人はあなただ。

20代からは自分の人生をどう展開していくのか、責任を持つ心を自ら持つことだ。自分の人生の目的地に向かって緊張の糸を緩めず、コントロールできるものをコントロールしなければならない。

ガラスのメンタルを克服し、自分の決定を信じ前進する精神を持つことは、あらゆるネガティブなことから解放されるということだ。宇宙に存在する者として、矜持を持つことでもある。誰の人生でも、貴く、きらめいている。挑戦を断念してはならない。誰が勝手にあなたの人生に決定を下すことなどできようか。
ケリー・チェ（Kelly Choi）
ヨーロッパ12ヵ国で寿司販売を中心としたアジア系食品フランチャイズチェーンを1200店舗展開する、グローバル企業「ケリーデリ（KellyDeli）」の創業者／会長（2021年当時）。全羅北道で生まれ、ソウルの縫製工場で働きながら夜間定時制高等学校を卒業。30代でパリでファッション事業を立ち上げるが、10億ウォン（約1 億円）の借金を抱える。これを機に、〈富者の思考〉と習慣を体得するため、1000人の成功者に学ぶ。2010年にケリー・デリを立ち上げ、2020年、「サンデー・タイムズ」が選ぶイギリスの資産家345位。

現在は、経営と〈富者の思考〉を伝えるために「ウェルシンキング・アカデミー」を設立。YouTubeやInstagram、講演活動を通じて啓発活動を続けている。著書に『パリでお弁当を売る女』（2021年、未邦訳）、『100日朝習慣の奇跡』（2023年、未邦訳）がある。。2022年には本書が大手ブックサイトYes24の「今年の本」に選出され、100刷突破記念刊行で表紙の装いを新たにした。

『富者の思考　お金が人を選んでいる』
　ケリー・チェ［著］
　小笠原藤子［訳］
　CEメディアハウス［刊］
ケリー・チェ",[],[]
キャサリン妃の「圧倒的オーラ」が話題に...ギネスビールをぐびっと飲む姿も（ニューズウィーク日本版）,https://news.yahoo.co.jp/articles/04b636374e2ddb11994df6191d5688366d7f235a,https://newsatcl-pctr.c.yimg.jp/t/amd-img/20250429-00010003-newsweek-000-1-view.jpg?exp=10800,2025-04-29T10:43:26+09:00,2025-04-29T10:43:26+09:00,ニューズウィーク日本版,newsweek,ニューズウィーク日本版,1015,"＜2025年に入って公務を増やしているキャサリン妃。順調な復帰に喜びの声が...＞
Eddie Mulholland/Pool via REUTERS
キャサリン妃が先月3月に行なわれた「聖パトリック・デー」のパレードにて、軍施設を訪れた際のドラマチックな登場シーンがSNSで話題になっている。
【写真】ギネスビールをぐびっと飲むキャサリン妃　を見る
2024年は公の場から離れていたが、2025年に入って公務を増やしているキャサリン妃。3月にはウェリントン兵舎を訪れ、聖パトリック・デーの式典に出席した際に兵士たちが敬意を表して、一斉に起立する場面が注目を集めた。

この瞬間を捉えた映像は70万回以上再生され、投稿後すぐに6万4000件以上の「いいね」を集めている。「彼女は、まさにオーラそのもの」「世界で最も美しい女性」とのコメントが寄せられている。

また、「オーラ100%、真の王妃」という声や「元気な姿を見られてうれしい。彼女が未来の王妃であることを本当に幸運に思う」といった感想も書き込まれている。

キャサリン妃はこの日、王族にとって重要かつ名誉ある「アイルランド近衛連隊名誉大佐」としての役割を果たした。

昨年6月には、チャールズ3世の誕生式典「トゥルーピング・ザ・カラー」のリハーサルにあたる「コロネルズ・レビュー」で指揮を執る予定だったが、当時受けていた化学療法のため辞退を余儀なくされている。

その際、「カラー・トゥルーピングを前に、連隊が私の誇りであることをお伝えしたくて手紙を書きました。今年の閲兵式に参加する全員が、何カ月も練習を重ね、多くの時間を費やして完璧なものにしてきたことに感謝しています」と綴った手紙をアイルランド近衛連隊に宛てて贈っている。

今回、アイルランド近衛連隊の連隊副司令官であるクリス・ギカ陸軍少将にエスコートされたキャサリン妃。この日、連隊創設125周年を祝ってギネスビールをハーフパイント飲み、兵士たちにバーで振る舞い酒をしたこともイギリスメディア「Sky News」で報じられている。

兵士たちとの会話の中で「ワークライフバランスを保つのは本当に難しい」とキャサリン妃は語ったという。化学療法を受けていた際に、自らのワークライフバランスを見直したいと語っており、今回の発言はそういった背景を踏まえると、より重みがあるものとなった。
ジャック・ロイストン（王室担当）",[],[]
専門家も存在を否定「自閉症の流行」は私が止める...ケネディJr.が打ち出した「まさかの監視法」に怒りの声（ニューズウィーク日本版）,https://news.yahoo.co.jp/articles/b2bada8f4ca1d490c36e70fc0c8f879d0c0011d9,https://newsatcl-pctr.c.yimg.jp/t/amd-img/20250429-00010002-newsweek-000-1-view.jpg?exp=10800,2025-04-29T10:10:10+09:00,2025-04-29T10:10:10+09:00,ニューズウィーク日本版,newsweek,ニューズウィーク日本版,570,"保健福祉省のケネディ長官が専門家の反対を押し切って進める自閉症患者の「追跡」プロジェクト──
自閉症の要因を特定すると意気込むケネディ　ELIZABETH FRANTZーREUTERS
米政府が自閉症患者の追跡プロジェクトを進めている。CBSニュースは4月22日、保健福祉省傘下の国立衛生研究所（NIH）の監督の下、新たな患者登録システムが開始されると報じた。
【話題の写真】高速列車で前席のカップルが「最悪の行為」に及ぶ...インド人男性の撮影した「衝撃写真」にネット震撼
アメリカでは、自閉症罹患率が上昇している。疾病対策センター（CDC）によれば、2000年には8歳児の150人に1人が自閉症スペクトラム障害と診断されていたが、22年は31人に1人の割合だった。

保健福祉省のケネディ長官は、専門家や患者支援団体の反論にもかかわらず、「自閉症の流行」は環境要因のせいだと主張している。

新たなシステムは、保健福祉省の大規模な自閉症研究のため、個人の医療記録を収集する。薬局や民間医療保険請求、スマートウオッチの情報が対象で、データは保健福祉省の研究にひもづけられると、NIHのバタチャルヤ所長は発言。

怒りの声が上がっているが、ケネディは来年までに自閉症の広がりの原因を明らかにするとしている。
ケイト・プラマー（調査報道担当）",[],[]
中国・浙江省で「断崖絶壁」にぶら下がる人々...その意外な目的は？（ニューズウィーク日本版）,https://news.yahoo.co.jp/articles/e508352b46d3a719f20e2be158058a8fb970ff71,https://newsatcl-pctr.c.yimg.jp/t/amd-img/20250429-00010001-newsweek-000-1-view.jpg?exp=10800,2025-04-29T08:20:02+09:00,2025-04-29T08:20:02+09:00,ニューズウィーク日本版,newsweek,ニューズウィーク日本版,301,"安全ロープで断崖を下るのはボランティア団体のメンバーたち──
XU WEIJIEーVCG/GETTY IMAGES
4月22日は地球環境を守るために行動を起こす「アースデイ（Earth Day）」。
【話題の写真】高速列車で前席のカップルが「最悪の行為」に及ぶ...インド人男性の撮影した「衝撃写真」にネット震撼
中国東部・浙江省台州市の山間部ではこの日、ボランティア団体のメンバーが安全ロープにつられながら断崖を下り、観光客が捨てていったゴミの回収作業をした。

この団体は過去10年間で200回以上清掃活動を行っており、山中で集めたゴミは計200トン以上に達している。
ニューズウィーク日本版編集部",[],[]
過激派との戦闘と薬物汚染...ソマリア国軍、「内憂外患」に苦しむ（ニューズウィーク日本版）,https://news.yahoo.co.jp/articles/2b3c8cc6ce8b7e1d95f44204016fc35d9793fd3a,https://newsatcl-pctr.c.yimg.jp/t/amd-img/20250429-00010000-newsweek-000-1-view.jpg?exp=10800,2025-04-29T07:50:40+09:00,2025-04-29T07:50:40+09:00,ニューズウィーク日本版,newsweek,ニューズウィーク日本版,292,"過激派勢力との戦闘が続くソマリア国軍は、兵士の薬物乱用という内部問題にも直面している
ED RAM/GETTY IMAGES
イスラム武装組織アルシャバブなどの過激派勢力と激しい戦闘を繰り広げているソマリア国軍は、兵士の薬物乱用という深刻な問題も抱えている。
【動画】閲覧注意：炎上する車から火だるまの男が...アムステルダム中心部で車両爆発事件が発生した瞬間映像
写真は首都モガディシュ北方の基地で、薬物売買に関わったとされる一部訓練兵の軍事裁判を見守る兵士たち（4月21日）。

この基地は4月半ばにアルシャバブの攻撃を受け、死傷者が出たばかりだ。【ニューズウィーク日本版編集部】",[],[]
