headline,mainEntityOfPage,image,datePublished,dateModified,author,media_en,media_jp,str_count,body,images,external_links
ポンペイ遺跡の未調査地区で発見された「浴場」、テルマエ・ロマエ（公衆浴場）とは異なる「役割」が（ニューズウィーク日本版）,https://news.yahoo.co.jp/articles/e412ca400ed9e8f0ae8be2b0c7b0e7b7f5adbfcf,https://newsatcl-pctr.c.yimg.jp/t/amd-img/20250429-00010008-newsweek-000-1-view.jpg?exp=10800,2025-04-29T19:50:46+09:00,2025-04-29T19:50:46+09:00,ニューズウィーク日本版,newsweek,ニューズウィーク日本版,566,"DUOTONE_/Pixabay
イタリア・ナポリ近郊の古代都市ポンペイ遺跡で、考古学者たちが驚くべき新たな発見をした。公衆浴場よりもホットな、超豪華プライベート浴場だ。西暦79年のベスビオ火山の噴火で都市が消滅してしまう前まで、上流階級の指導者らが送っていた優雅な生活を垣間見ることができる。
【写真】ポンペイ遺跡の未調査地区で発見された「浴場」、テルマエ・ロマエ（公衆浴場）とは異なる「役割」が
この浴場は精巧なモザイク装飾が施され、温水から冷水まで自由につかることができる個別の部屋を備えた隠れ家スパで、ポンペイの個人宅温泉施設としては最大のものかもしれない。

30人ほどが使用できる広さで、カルダリウム（高温浴室）や大きな水風呂も備えていた。こうした設備は公衆浴場では一般的だったが、私邸で見つかるのは珍しい。

この浴場はポンペイの中でもほとんど調査が進んでいないIX地区にあり、当時の暮らしについて理解を深める重要な発見だ。浴場は富裕層のリラクセーションの場だっただけでなく、娯楽や社交、政治活動の場としても使われたと考えられる。

「人々の同意形成や選挙活動、取引の場でもあった」と、同遺跡責任者のガブリエル・ズクトリーゲルは言う。そしてもちろん、桁違いの富をひけらかすのにも役立ったようだ。
シャミム・チョードリー",[],[]
日本政府こそが責任感を持つべき...「産業化」した東南アジア特殊詐欺を「根絶」できない理由（ニューズウィーク日本版）,https://news.yahoo.co.jp/articles/5562cb9fd04f6eaa36e203f71fed428fbc2d2530,https://newsatcl-pctr.c.yimg.jp/t/amd-img/20250429-00010007-newsweek-000-1-view.jpg?exp=10800,2025-04-29T18:10:03+09:00,2025-04-29T18:10:03+09:00,ニューズウィーク日本版,newsweek,ニューズウィーク日本版,3289,"日本にも迫る東南アジア特殊詐欺集団の「魔の手」。フットワーク軽く捜査を交わし続ける犯罪組織を撲滅することはできるのか──
ミャンマーの詐欺拠点からタイに移送された中国出身者（今年2月）　CHALINEE THIRASUPAーREUTERS
詐欺拠点にいったん足を踏み入れると暴力や虐待は日常茶飯事。カンボジア、ラオス、ミャンマー、フィリピンに蔓延る特殊詐欺集団の実態に迫る。本記事は後編
【話題の写真】「一体これは何？」...空から爆音と共に降ってきた正体不明の「巨大な氷」の写真にSNS騒然、原因は飛行機説も？
※前編はこちら：「現代の奴隷」が20万人以上も...東南アジア特殊詐欺、虐待の日々から逃げ出す「唯一の脱出法」とは？

特殊詐欺集団は中国系のグループであることが多いが、特殊詐欺は中国マフィアの専売特許とみるのは短絡的にすぎる。

マレーシア、ミャンマー、インドネシア、タイ、ベトナムの犯罪組織も中国系グループと手を組んで、あるいは単独で組織的な詐欺を行っている。韓国や日本の犯罪組織も例外ではない。
巨額のダーティーマネーを洗浄
Newsweek Japan
最近では、ミャンマー東部カレン（カイン）州ミャワディで大規模な捜査が開始されて以降、ミャンマーとタイの国境地帯にある複数の拠点からさまざまな国籍の容疑者が何千人も移送されている。釈放されてタイ当局に引き渡された何人かの日本人の中には未成年者もいた。

その1人、愛知県出身の16歳の少年は通信アプリで家族に助けを求めたことがきっかけで保護された。

日本では近年、オンライン詐欺が急増している。多くは高齢者を狙った投資詐欺や健康保険、年金関連の詐欺で、じっくり時間をかけて相手を信頼させ資産をごっそり奪い取る「豚の屠殺」詐欺も横行している。

東南アジアの詐欺組織は多くの場合、オンライン違法カジノの運営にも手を染めており、日本はその主要な市場だ。日本の警察庁が3月に発表したオンラインカジノの初の実態調査結果によると、国内で利用した人は337万人に迫り、年間の賭け金総額は推計で約1兆2000億円に上る。

オンライン詐欺と賭博で生じた巨額のダーティーマネーは移転し洗浄しなければならない。詐欺産業の成長に伴い、マネーロンダリング（資金洗浄）を専門とする業者も急増している。

24年には自称「決済代行会社」のリバトン・グループ（富山市）の幹部らがフィリピンと日本で逮捕された。同グループは500社以上のペーパーカンパニー名義で4000余りの口座を開設し、少なくとも700億円を洗浄した疑いが持たれている。

私たちは中国人が所有し、カンボジアに拠点を置くマネロン会社で働く人物に話を聞いた。それによれば、この会社は日本のマネロン集団と連携し、1日平均1000万円を「きれいな金」に替えているという。

日本の特殊詐欺グループのトップは巧みに摘発を免れているが、報道によると暴力団の構成員や関係者が幹部になっているケースもある。

昨年12月、タイの警察は東部パタヤの豪華な別荘を強制捜査し、日本人の高齢者を狙う特殊詐欺の首謀者とみられる人物を逮捕した。この男は山口組の元構成員と報じられている。

だが、暴力団とかヤクザという言葉は日本の組織犯罪グループ全般を指して使われることが多い。詐欺集団として活動しているのは、暴力団ではなくもっと新しい組織である可能性が高い。例えばフィリピンでは「ルフィ」のグループや「JPドラゴン」の構成員が摘発されている。

2月初め、東南アジアの詐欺業界は大いに揺れた。タイ当局が、国境を接するミャンマーのミャワディへの電力供給を断つと発表したからだ。

ミャワディは近年、東南アジアの詐欺業界の中心地の1つとして頭角を現した。だが今年1月、中国人俳優が誘拐されてこの地の詐欺拠点に連れてこられ、その後救出されるという事件が起きて大きな話題になった。これによりタイ当局は、これまでにない強い対応を余儀なくされたのだ。

2カ月もしない間に、数十カ国から来た6000人を超える人々が詐欺の拠点から救出され、送還のためにタイに移送された。

詐欺の拠点の摘発はこれ以前にも、23年にはミャンマー北部、24年にはラオスのゴールデントライアングル経済特区で行われていた。だが摘発強化は一時的な動きに終わってしまいがちだ。

それに詐欺集団はフットワークがいい。東南アジア各地で人を替え手段を替えて詐欺を行っている組織の話は、これまで数え切れないほど耳にした。

カンボジア当局は22年後半にシアヌークビルで詐欺拠点の摘発を行ったが、多くの詐欺集団はラオスやミャンマー、カンボジア国内のもっと辺ぴな場所に移動したという。

この摘発はカンボジア政府に言わせれば大成功だったが、詐欺集団の活動を抑え込むことにはならなかった。

私たちのうちの1人は当時シアヌークビルにいて、大規模な詐欺拠点から何十人もの人々が出て行くのを目撃した。彼らは荷物を手に粛々とバスに乗り込み、バスは2台のSUVに守られながら車列を組んで出発した。取り締まりについて前もって知らされていたのは明らかだった。
地元の大物とずぶずぶの関係
空から見たカンボジア南部シアヌークビルの特殊詐欺集団の施設　ROUN RY
ミャンマーの北部と東部にある詐欺拠点については、地元警察と中国とタイが協力して摘発を進めようとしている。そのあおりでカンボジアにおける詐欺集団の活動が再び活発化するとの見方もあるが、そもそも前回の摘発で詐欺集団はカンボジアからいなくなったのだろうか。

ミャンマーで摘発が相次ぐ前から、カンボジアの農村地帯では大型の新しい拠点がつくられていた。ホテルが詐欺拠点につくり替えられたとか、以前からあった拠点が規模を拡大したといった話も伝えられている。

長期的かつ根本的な対策を取らず、たまに取り締まったところで詐欺の根絶にはつながらないのだ。カンボジアやミャンマーやラオスといった国々は、当局の腐敗、警察力の弱さ、国境を越えた移動が容易という条件がそろい、詐欺集団にとっては理想的な環境だ。

さらに、詐欺集団は地元の有力者の庇護下にある。ミャンマーでは軍事政権と手を組んだ民兵組織が、カンボジアでは与党に近い大物たちが詐欺師を守っている。

カンボジア経済界の大物で、与党の上院議員も務める人物は、シアヌークビルやカンダルなどで詐欺と関連のある不動産を所有している。

カンボジア政治に詳しいシティ大学ロンドンのニール・ルフリン上級講師は「違法な経済活動は、利権と権力のシステムとずぶずぶの関係にあるということだ」と語る。

東南アジアの詐欺業界は10年足らずで「産業」と呼ぶにふさわしい規模へと急速に拡大した。詐欺業界を動かす犯罪組織はアイデア豊かで、当局を抱き込み、勢力範囲を広げ、新たな技術や手法を取り入れては、被害者から金を吸い上げ続けている。

アメリカ政府は最近まで、東南アジアのオンライン詐欺業界での人身売買や奴隷労働への対策に多額の資金を拠出してきた。

だが対外援助機関である米国際開発庁（USAID）の解体をトランプ政権が進めていることで、官民共に重要な活動資金や支援が得られなくなり、既存の取り組みも多くが混乱を来している。

そこで注目されるのが日本政府の取り組みだ。例えば国際協力機構（JICA）がカンボジアで人身売買の被害者支援の能力向上を目指すプロジェクトを始めるなど、日本は既に2国間での協力を東南アジアの各地で展開している。

UNODCとの協力を通じ、詐欺や犯罪の強要を含む人身売買への対策にも取り組んでいる。

詐欺の被害者になる日本人も加害者になる日本人も増えている。今こそ日本が東南アジアで果たす役割を強化すべき時だ。
イバン・フランチェスキーニ（メルボルン大学講師）リン・リー（ベネチア・カフォスカリ大学博士号候補生）マーク・ボー（リサーチャー）",[],[]
人々を熱狂させる「シリアルキラー」が生まれるまでの物語…殺人鬼「デクスター」の前日譚を語る（ニューズウィーク日本版）,https://news.yahoo.co.jp/articles/4a52644fb980bd62bde8aa8f403b58540b1ae344,https://newsatcl-pctr.c.yimg.jp/t/amd-img/20250429-00010006-newsweek-000-1-view.jpg?exp=10800,2025-04-29T16:09:07+09:00,2025-04-29T16:09:07+09:00,ニューズウィーク日本版,newsweek,ニューズウィーク日本版,1180,"＜オリジナル版で大人気だったマイアミの殺人鬼デクスター。その原点を描く新シリーズ『オリジナル・シン』の魅力を、主演のパトリック・ギブソンが語る＞
このシリーズでは 主人公が「人間ら しく」感じられると ギブソンは言う　FRANK OCKENFELS
ほかの俳優が有名にした役を引き継ぐのは、簡単なことではない。パトリック・ギブソンもそうだった。
【動画】人気を博した『デクスター』と、新シリーズ『オリジナル・シン』の予告編動画
テレビシリーズ『デクスター　オリジナル・シン』で、かつてマイケル・C・ホールが演じたマイアミの連続殺人犯デクスター・モーガンの若き日々を演じることになったとき、ギブソンは失敗したら大変なことになると感じたという。ホールは新シリーズにも深く関わっている。

「ほかの俳優が自分の役を演じるのを見るのは奇妙な感覚だろうけど、彼はとても寛大な姿勢で迎え入れてくれた」と、ギブソンは言う。

この物語が魅力的なのは、まだ殺人を完璧にやれない時代のデクスターを見ることができるからだ。「彼は基本的な本能と、働き始めたばかりのマイアミメトロ警察で学んだことに頼っている」。さらに「彼の人生のこの時期には孤独があり、それが興味深く、人間らしく感じられた」

デクスターは完全にサイコパスなのだが、視聴者は彼を応援する。デクスターが標的にするのが、社会から排除されるべき人間たちだからだ。「（義賊の）ロビン・フッド的な倫理のグレーゾーンだね」既にギブソンはシーズン2の準備ができている。「シーズン1では多くのことが起こるけど、解決されていないことも多いから」。本誌H・アラン・スコットが話を聞いた。

──なぜデクスターの原点を描く「オリジンストーリー」が必要だった？

オリジナル版『デクスター』のシーズン1は、既にそこに語るべき物語があると感じさせる。全ての作品にオリジンストーリーや前日譚、続編が必要だとは思わないが、視聴者は『デクスター』第1話で、殺しの技術を見事に習得した主人公に出会う。彼がどうやってここまできたのか、自然と疑問が生まれるんだ。

──デクスターを演じてみて、分かったことは？

今回のシーズン1はある意味、パイロット版のような感じがする。物語の土台づくりに使う時間が非常に多い。私たちがとてもよく知っている完璧なマシンのようなキャラクターが、あらゆる障害につまずいている。彼はまだ、物事を解決するスキルを身に付けていない。

──この設定がシーズン2への布石になっている？

オリジナルでは小さな出来事がいくつか起きて、それが伏線となり、やがて見事につながり始める。

それが、このシリーズの面白い部分だと思う。今シーズンは最初の種をまいただけという感じで、これからもっともっと面白くなりそうだ。
H・アラン・スコット",[],[]
日本旅行が世界を魅了する本当の理由は「円安」ではない（ニューズウィーク日本版）,https://news.yahoo.co.jp/articles/05dd1f0adebc69f20fa807db905a98160532e8f1,https://newsatcl-pctr.c.yimg.jp/t/amd-img/20250429-00010005-newsweek-000-2-view.jpg?exp=10800,2025-04-29T10:57:48+09:00,2025-04-29T11:03:54+09:00,ニューズウィーク日本版,newsweek,ニューズウィーク日本版,1636,"＜ジョージア大使夫人が来日したばかりの頃に語った、ある言葉を再考する＞
STANISLAV KOGIKUーSOPA IMAGESーSIPA USAーREUTERS
いま日本が旅行先として海外から熱烈な支持を集めている。

日本のキャラクターグッズを手に入れる人たち。ブランド物のショッピング袋を両手からあふれるほどに抱え、流行の飲食店で行列をなし、渋谷のスクランブル交差点で写真を撮ったり走り回ったりする人たち。あるいは着物を身にまとって浅草寺に行き、富士山を借景にして写真を撮る人たち......。
【画像】寄稿を告知するジョージア大使のX（旧ツイッター）
このように楽しそうな外国人観光客の姿がSNSやメディアなどを通じて世界に発信されている。

しかし、こういった観光地や体験だけが日本の本当の魅力であり、インバウンド需要をこれだけ急成長させているのか。あるいは、よく言われるように円安が、この勢いを支える主要因になっているのだろうか。私は、それは表面的すぎると思っている。

この日本旅行ブームのもう1つ重要な理由は「日本の距離感」だと私は考えている。

私の妻が来日したばかりの頃に「日本は周囲の人が干渉してこなくて気が楽だわ！」と何度も口にしていたことを思い出す。

日本に長く暮らしてきた私は、妻が言っていることが最初はよく理解できなかった。しかし今、多くの観光客が日本滞在を楽しんでいる姿を見ると、その真意を理解できるようになってきた。

ジョージアでは人と人の距離が近い。私にとっては、その温かさがとても心地よく感じるため、日本人ももっと心の内を互いに明かし合ったほうがいいのではないかと、日本の人間関係の淡泊さを少々物足りなく感じることもあった。

しかしジョージアとヨーロッパ諸国育ちの妻に言わせれば、その緊密さがかえって心の負担につながっているというのだ。

日本の公共交通では、車内で通話することを控えるようにというアナウンスが流れている。海外のように電車の中で電話をするくらいよいではないかと思うこともあるのだが、それも妻から言わせれば、「素晴らしい」とのこと。

ジョージアで電車やバスに乗っていると、隣に座っている人の家庭内の様子がすべて筒抜けで、いやが応でもプライベートな問題を聞かされる羽目になる。その点、日本は電車も街もとても静かだというのだ。

私が心地よいものは、妻にとっては煩わしい。逆に私が物足りないと思っていたことは、妻にとっては過分だったのだ。「隣の芝生は青い」がまさに夫婦間で、双方向的に成り立っていたということである。

しかし、確かに来日したジョージア人の誰もが「日本は街が平静だ」と口をそろえて言う。では、その街の平静さを保っているものは何か？　それは人ではないだろうか。

東京の街を歩いていると「ジョージア大使ですよね。写真を撮ってもよいですか？」とよく声をかけられる。私はこのことを本当にうれしく思っており、いつでも大歓迎している。

しかし、中には「今日はプライベートのようなので、ご迷惑かもしれないと思い、お声がけしようか迷ったのですが......」と遠慮がちに説明される方も少なくない。

外国人観光客が日本に心地よさを感じるのは、こういった配慮のある、この距離感と洗練されたマナーなのだと思う。

かつては「日本のようにきれいな国はほかにはない」などと褒められると、「いやいや、ジョージア人の温かさのほうが心がリラックスできる」と言うなど、日本を批判的に捉えることで客観的な視点とバランスを保とうとしていた時期もあった。

日本が内在化されている私にとって、手放しでの日本賛辞は禁物なのだ。

しかし昨今の日本旅行ブームを見ていると、そろそろ認めざるを得ない。その人気の秘密は、おもてなし文化の奥底にある、他者に対する配慮の気持ちが支えているということを。
ティムラズ・レジャバ（駐日ジョージア大使）",[],[]
