headline,mainEntityOfPage,image,datePublished,dateModified,author,media_en,media_jp,str_count,body,images,external_links
新宿歌舞伎町の能舞台で、春画の世界へ。「新宿歌舞伎町春画展ー文化でつむぐ『わ』のひととき」が7月開催へ（Tokyo Art Beat）,https://news.yahoo.co.jp/articles/c6900bc91c1349d95c8eb819ee657ca257170a5e,https://newsatcl-pctr.c.yimg.jp/t/amd-img/20250430-00000002-tartbeat-000-1-view.jpg?exp=10800,2025-04-30T15:32:09+09:00,2025-04-30T15:32:09+09:00,Tokyo Art Beat,tartbeat,Tokyo Art Beat,753,"江戸の娯楽であり、人々の知的好奇心を掻き立てた春画
新宿歌舞伎町能舞台にて、春画の展覧会「新宿歌舞伎町春画展ー文化でつむぐ『わ』のひととき」が開催される。会期は7月26日から9月30日まで。

性別や身分を越えて江戸の人々を夢中にさせた春画は、「笑い絵」「わ印」とも呼ばれ、密かに楽しむだけでなく、仲間と囲んで笑い合ったり読み解いたりする娯楽でもあった。いっぽうで浮世絵師たちにとっても大切な表現の場となり、浮世絵の大きな側面を成している。また春画には、漢詩や和歌、古典文学を題材にした作品も数多かったことから、性的描写だけではなく、浮世絵師たちが巧みに織り込んだ「やつし」や「見立て」を読み解く、知的好奇心を掻き立てるものでもあったという。
能舞台を全面的に活用した空間で、約100点の春画を展示
本展では、東洋古美術の専門美術商である浦上蒼穹堂の代表・浦上満の春画コレクションのなかから、菱川師宣、喜多川歌麿、葛飾北斎、歌川国芳など、江戸時代初期から幕末に制作された春画約100点を展示。展覧会のアートディレクターには、林靖高（Chim↑Pom from Smappa!Group）を迎え、本舞台や橋掛り、楽屋や客席に至るまで、新宿歌舞伎町能舞台を全面的に活用した展示空間を作り出す。

「北斎漫画」のコレクターとしても知られる浦上は、春画のコレクターでもあり、2013年にロンドンの大英博物館で開催された「春画 日本美術の性とたのしみ」に出品者・スポンサーとして携わった。また2015年に東京・永青文庫で開催された日本初の本格的な「春画展」の実現にも尽力した。

現代の歓楽街・新宿歌舞伎町の中心で、江戸に息づいた春画の世界を楽しむことのできるまたとない体験となりそうだ。
Art Beat News",[],[]
リック・オウエンス、パリ初の回顧展がパリ市立ガリエラ宮で開催。自身が芸術監督として展覧会の企画に参画（Tokyo Art Beat）,https://news.yahoo.co.jp/articles/54ac8ac8d1dd41437b2c77ef32925c5cc30af049,https://newsatcl-pctr.c.yimg.jp/t/amd-img/20250430-00000001-tartbeat-000-1-view.jpg?exp=10800,2025-04-30T12:17:52+09:00,2025-04-30T12:17:52+09:00,Tokyo Art Beat,tartbeat,Tokyo Art Beat,917,"『Rick Owens, Temple Of Love』が6月28日〜2026年1月26日に開催
ファッションデザイナー、リック・オウエンスの創作活動に迫るパリで初の回顧展「Rick Owens, Temple Of Love」がパリ市立ガリエラ宮（Palais Galliera）で開催される。会期は、6月28日〜2026年1月4日。

1961年にカリフォルニア州で生まれ、1992年に自身のブランドを立ち上げたリック・オウエンス。ミリタリーバッグやアーミーブランケット、洗いをかけたレザーなどの素材を再利用し、ドレスやジャケットに生まれ変わらせた。アンダーグラウンドカルチャーや1930年代のグラマラスなファッションから着想を得た作品は、洗練された構造で知られ、2003年に拠点をパリへ移した後も独立性と挑発性のあるショーを展開している。その創作は、作家ジョリス＝カルル・ユイスマンスや近現代美術、20世紀初頭のハリウッド映画など様々な文化から影響を受けている。

パリのファッション博物館であるパリ市立ガリエラ宮で開催される本展では、オウエンスがロサンゼルスで活動を始めた初期作品から最新コレクションまで、アーカイヴから選ばれた約100点以上のシルエットを展示。オウエンス自身が芸術監督として展覧会の企画に参画し、ガリエラ宮のキュレーションチームと協力しながら、館内だけでなくファサードや庭園まで続く独自の展示空間を構築する。

さらにオウエンスの創作プロセスを紹介する資料やビデオ映像、未公開のインスタレーションに加え、ギュスターヴ・モロー、ヨーゼフ・ボイス、スティーブン・パリーノといったアーティストたちの作品も展示し、彼の芸術的ルーツを多面的に探求する。また、妻であり共同制作者でもあるミシェル・ラミーの存在と影響力にも光を当て、ふたりのカリフォルニアでの寝室の再現なども展示される。作品は館の外にも広がり、オウエンスは博物館のファサードの彫像群をスパンコール刺繍の布で覆う。

「愛の寺院」と題された本展。博物館をまるで創造に捧げられた寺院のような空間へと変貌させる特別な展示に注目したい。
Art Beat News",[],[]
