headline,mainEntityOfPage,image,datePublished,dateModified,author,media_en,media_jp,str_count,body,images,external_links
東根リンゴに酔いしれて　植松フルーツ、シードル３種開発（山形新聞）,https://news.yahoo.co.jp/articles/c3512f798089cbbebaf4a73fbaf683f46a255cae,https://newsatcl-pctr.c.yimg.jp/t/amd-img/20260505-00000006-yamagatan-000-2-view.jpg?exp=10800,2026-05-05T12:22:08+09:00,2026-05-05T19:03:18+09:00,山形新聞,yamagatan,山形新聞,652,東根産リンゴを使ったシードルを開発した植松和也代表（右）と愛さん＝東根市野川 果樹生産・販売の植松フルーツ（東根市、植松和也代表）が、同市で自社栽培した果実を使ったリンゴ酒・シードルを開発した。多彩な品種を生産する同社の強みを生かし、新たなブランド価値を生み出そうと企画。ジュースとは違った味わいが楽しめ、リンゴ本来の魅力を改めて感じられる仕上がりとなっている。 同社は規格外のリンゴを馬の餌とし、その馬ふんを堆肥として果樹栽培に活用する循環型農業に取り組んでいる。3年ほど前、「紅の夢」「うまじろう」など8種類のリンゴジュースを商品化。大人向けに楽しんでもらおうと、ジュースを基にシードルを作った。 赤い果肉が特徴の「紅の夢」、黄色の品種で人気が高まっている「ぐんま名月」、主力品種「ふじ」の3種類のシードルを販売する。醸造は刈屋梨の果実酒なども手掛けるオードヴィ庄内（酒田市）が担う。 紅の夢は、さっぱりとした甘口で、強い甘みのぐんま名月は、リンゴの風味と共にビールのようなこくを感じることができるという。植松代表（47）は「ジュースとシードルを飲み比べてみてほしい」と話す。アルコール度数は6％。観光施設などでの販売を想定し、2500～3500円の価格帯を見込む。 色味は赤と白の2種類で、植松代表は「紅白で結婚式などの祝い事にぴったりだと思う」。妻の愛さん（40）は「リンゴの香りや風味を感じてほしい」と話していた。問い合わせは電子メールuematsu.fruits.2024@gmail.com,[],[]
こってり派？あっさり派？　鶴岡で旬の孟宗汁を味わう催し（山形新聞）,https://news.yahoo.co.jp/articles/eb7fb2870a3802deabbbb2f59cab24bc3b599bb8,https://newsatcl-pctr.c.yimg.jp/t/amd-img/20260505-00000005-yamagatan-000-1-view.jpg?exp=10800,2026-05-05T11:27:31+09:00,2026-05-05T11:27:31+09:00,山形新聞,yamagatan,山形新聞,363,来場者が採れたての孟宗を味わった「黄金孟宗フェスタ」＝鶴岡市・黄金コミュニティ防災センター 鶴岡市黄金地区の孟宗（もうそう）を味わう「黄金孟宗フェスタ」が2日、同地区の黄金コミュニティ防災センターで開かれ、来場者が採れたての春の味覚を味わった。 当日の朝などに収穫した孟宗の販売や、孟宗と厚揚げ、シイタケ、豚肉を煮込んだ孟宗汁計250食の提供があった。孟宗汁は多めのみそと酒かすで煮込んだ「こってり」、塩加減を抑えた「あっさり」の2種が用意され、訪れた家族連れなどが食べ比べを楽しんだ。さいたま市から同地区に帰省した会社員和田実紗さん（32）は「孟宗汁が食べられるのを楽しみにしていた。孟宗のうまみを感じやすい『あっさり』が好み」と話していた。 同地区産の孟宗を広くアピールしようと、地元有志で結成した実行委員会が初開催した。,[],[]
山の恵み、旬を味わう　戸沢で「農楽市山菜祭り」（山形新聞）,https://news.yahoo.co.jp/articles/06b40414929df9f2021ad5a07d29382e5a67cab0,https://newsatcl-pctr.c.yimg.jp/t/amd-img/20260505-00000007-yamagatan-000-1-view.jpg?exp=10800,2026-05-05T11:18:58+09:00,2026-05-05T11:18:58+09:00,山形新聞,yamagatan,山形新聞,340,地元産山菜の天ぷらなどの販売がにぎわったとざわ農楽市山菜祭り＝戸沢村・とざわ農楽市 「とざわ農楽市（のらいち）山菜祭り」が4日、戸沢村の道の駅・高麗館にある産直「とざわ農楽市」で始まった。県内外から訪れた人たちが山の恵みに感謝しながら味わった。 観光客や地元の人に新鮮な山菜を楽しんでもらおうと、農楽市を運営する協議会が毎年開催。産直前に設けたブースでは、コゴミやフキノトウ、タラノメなどを揚げた天ぷらの詰め合わせや、玉こんにゃくなどを販売した。 観光客らは、揚げたての天ぷらを食べたり、採れたての山菜を品定めしたりしていた。両親と訪れた山形大医学部看護学科4年田中優帆さん（21）は「コシアブラがほろ苦くておいしい」と、旬の味覚に箸が止まらない様子だった。祭りは5日も開かれる。,[],[]
自分らしく輝ける未来願う　米沢で二十歳の祝賀行事（山形新聞）,https://news.yahoo.co.jp/articles/1633f6fbed289892ee96fd1e0ec7e34ea68e8f9d,https://newsatcl-pctr.c.yimg.jp/t/amd-img/20260505-00000004-yamagatan-000-1-view.jpg?exp=10800,2026-05-05T10:56:54+09:00,2026-05-05T10:56:54+09:00,山形新聞,yamagatan,山形新聞,366,友人同士で記念写真に納まる出席者＝米沢市民文化会館 米沢市の「二十歳のつどい」が4日、市民文化会館で行われた。出席者が節目の年を迎え、気持ちも新たにさらなる成長を誓った。 近藤洋介市長が「挑戦を重ねて豊かな人生を歩んでほしい。皆さんの若い力がこれからの米沢をつくる」と激励。出席者を代表し2人が、二十歳の誓いを述べた。山形大3年上野能登（よしと）さん（20）は「育ててくれた米沢に貢献できるよう頑張りたい」、同志社大3年江川舞花さん（21）は「それぞれが自分らしく輝ける将来を願う」などと述べた。 出席者がそれぞれの出身中学校に分かれ、思い出深い校歌を斉唱する歌合戦も行われた。 式典後、会場内に設置されたフォトスポットには、市のマスコットキャラクター「かねたん」「おせんちゃん」が登場した。対象者761人のうち516人が出席した。,[],[]
クマの霊慰め、山に感謝　小国・小玉川で「まつり」（山形新聞）,https://news.yahoo.co.jp/articles/6e81a365f1165bf3358cbdbe3002cfb5751684c2,https://newsatcl-pctr.c.yimg.jp/t/amd-img/20260505-00000003-yamagatan-000-1-view.jpg?exp=10800,2026-05-05T10:45:44+09:00,2026-05-05T10:45:44+09:00,山形新聞,yamagatan,山形新聞,458,クマの毛皮などが供えられた祭壇の前で、山の神に感謝する神事などが行われた小玉川熊まつり＝小国町小玉川 小国町小玉川地区に伝わる「小玉川熊まつり」が4日、同町の国民宿舎飯豊梅花皮（かいらぎ）荘周辺で開かれた。マタギらがクマの霊を慰め、恵みをもたらす山の神に感謝し、猟の無事を祈願した。 神事が雨の中執り行われ、関係者がクマの毛皮などが供えられた祭壇前で玉串をささげた。近くを流れる玉川対岸では、マタギ衆8人がクマ狩りの様子を再現。獲物を追い立てる勢子（せこ）が毛皮をかぶったクマ役に向かって「ホーリャー」と叫び、待ち構えていた射手が仕留めるまでの流れを披露した。 勢子になりきり、大声を張り上げる大会も開催し、県内外の来場者が多く参加した。千葉県流山市から訪れた本間日々希さん（9）は「（対岸のクマ役に）声が届いてうれしかった」、弟の大揮さん（7）は「緊張したけど楽しかった」とそれぞれ笑顔だった。 会場では熊汁やイワナの塩焼きなども販売された。町内の関係団体による実行委員会（会長・鈴木正昭町観光協会長）が主催した。,[],[]
豊穣への思い、舞に込め　鶴岡・雷電神社で「高寺八講」（山形新聞）,https://news.yahoo.co.jp/articles/4738d0bcdd894887e0c993727850e42aab9d6622,https://newsatcl-pctr.c.yimg.jp/t/amd-img/20260505-00000002-yamagatan-000-1-view.jpg?exp=10800,2026-05-05T10:44:49+09:00,2026-05-05T10:44:49+09:00,山形新聞,yamagatan,山形新聞,401,花飾りを頭に乗せて演じられた花笠舞＝鶴岡市・雷電神社 鶴岡市羽黒町高寺地区に伝わる県指定無形民俗文化財「高寺八講」が4日、同地区の雷電神社（松平修宮司）で奉納上演され、役者たちが五穀豊穣（ほうじょう）を祈る伝統の舞を披露した。 高寺八講は平安末期から鎌倉末期にかけての寺院芸能の一つで、同神社の例祭で奉納されている。かつてあった八つの舞のうち、現在は「大小舞」「薙刀（なぎなた）舞」「花笠舞」「稚児舞」の四つが伝わる。この日は雨の中、小学生～70代の16人が地区内を練り歩いた後、同神社境内の八講楽殿で舞を上演した。 「花笠舞」では、舞い手が頭に色彩豊かな花飾りを乗せ、竹と杉材でできた楽器「ささら」の音色に合わせて演舞した。同地区出身で、仙台市から帰省したアルバイト従業員の五十嵐都嗣（とし）さん（22）は「自分も出演したことがあり、懐かしい。人は減ったが今も伝統が続いていてうれしい」と話していた。,[],[]
大きな泣き声、はっけよい！　鶴岡・荘内神社（山形新聞）,https://news.yahoo.co.jp/articles/f59e7247628d0e487bac4a42d297ae5cf409cc3f,https://newsatcl-pctr.c.yimg.jp/t/amd-img/20260505-00000001-yamagatan-000-2-view.jpg?exp=10800,2026-05-05T10:07:09+09:00,2026-05-05T10:12:12+09:00,山形新聞,yamagatan,山形新聞,384,赤ちゃん力士が泣き声を競った「泣き相撲」＝鶴岡市・荘内神社 子どもの泣き声で邪気をはらい、健やかな成長を祈る「泣き相撲」が4日、鶴岡市の荘内神社（石原純一宮司）で行われ、赤ちゃん力士が元気な泣き声を土俵に響かせた。 5日も含めた2日間で、県内外の3カ月から2歳まで過去最多の209人が申し込んだ。祈とうを受けた後、保護者に抱えられて土俵入りした赤ちゃんは、行司役のかけ声に合わせて取組を開始。大きな声で泣いた方が勝ちのルールで、すぐに泣き出す子や、にこにこ笑う子の姿もあった。家族はお手製のうちわを振ったり、カメラで写真を撮ったりして声援を送った。 山形市浜崎、公務員佐藤紘平さん（42）は1歳の長女実日子（みかこ）ちゃんを応援し「最高に大きな声で泣いてくれたのでうれしい。健やかに育ってほしい」と話していた。 同神社が2015年から主催し、11回目。5日も行われる。,[],[]
