headline,mainEntityOfPage,image,datePublished,dateModified,author,media_en,media_jp,str_count,body,images,external_links
中国湖南省の花火工場で大規模な爆発、26人死亡（CNN.co.jp）,https://news.yahoo.co.jp/articles/0982cb9e35b6603c8e946a8a94c3291133a59394,https://newsatcl-pctr.c.yimg.jp/t/amd-img/20260505-35247164-cnn-000-1-view.jpg?exp=10800,2026-05-05T16:32:00+09:00,2026-05-05T16:32:00+09:00,CNN.co.jp,cnn,CNN.co.jp,210,写真：CNN （CNN） 中国湖南省瀏陽市の花火工場で大きな爆発が起き、少なくとも26人が死亡、61人が負傷した。 【映像】中国の花火工場で大規模な爆発 世界の花火産業の中心地として知られる同市は、巨大な衝撃波に見舞われた。窓ガラスは割れ、近隣の建物が損傷した。 当局が原因究明を進める一方、救助活動も続いている。習近平（シーチンピン）国家主席は、行方不明となっている人々の捜索に「全力を挙げて取り組む」よう呼びかけた。,[],[]
プラスチックごみが渦巻く「太平洋ごみベルト」、はるかに重大な問題を抱えている可能性（CNN.co.jp）,https://news.yahoo.co.jp/articles/7ebb31784598a7f60f1660225a436a2214f79312,https://newsatcl-pctr.c.yimg.jp/t/amd-img/20260505-35247163-cnn-000-2-view.jpg?exp=10800,2026-05-05T15:24:00+09:00,2026-05-05T15:29:59+09:00,CNN.co.jp,cnn,CNN.co.jp,1584,大気に舞う微細なプラスチック破片は地球温暖化に憂慮すべき影響をもたらす可能性がある （CNN） 米ハワイとカリフォルニアの間の北太平洋には、テキサス州の倍以上の広さにプラスチックごみが渦巻く「太平洋ごみベルト」が存在する。プラスチックの破片はお互いにぶつかり合い、風で空中に舞い上がるほど微細な粒子へと分解される。新たな研究によると、大気中に分散したこれらの粒子は、私たち全員が関わりうるほどの影響を気候に与える可能性があるという。 【写真】太平洋ごみベルトのプラスチックごみ（全2枚） 太平洋ごみベルトは大気中のマイクロプラスチックとナノプラスチックの大きな発生源だが、埋め立て地、道路沿いに捨てられたごみ、車のタイヤなど、微細なプラスチック粒子を大気中に舞い上がらせる場所は他にも数多く存在する。 中国と米国の研究チームがこれらのプラスチックの組成と挙動を研究した結果、地球温暖化に寄与していることが明らかになった。この研究は4日、学術誌「ネイチャー」に掲載された。 研究者らはマイクロプラスチックとナノプラスチックに着目。これらが太陽光とどのように相互作用するかについて理解を深めるべく、色、大きさ、化学組成を分析した。 研究者らが知りたいと考えたのは、粒子が太陽光を後方散乱させ、地球に冷却効果を発揮するのか、それとも太陽光を吸収し、温暖化をもたらすのかということだった。 過去の研究ではマイクロプラスチックの地球温暖化への寄与は無視できる程度だとされてきたが、これらの分析は粒子が透明だとの前提に基づいていることが多い。今回の研究で発見されたものは、さまざまな色のマイクロプラスチックだった。 特に赤、黄、青、黒などの着色されたプラスチックは、無着色プラスチックの約75倍もの光を吸収することが明らかになった。 大きさも影響するが、その度合いは比較的小さい。粒子が小さいほど、より多くの太陽光を吸収できるという。「ナノプラスチックは小さくても強力だ。大気中に長くとどまり、同じ質量でもマイクロプラスチックよりはるかに多くの太陽光を吸収する」と研究著者で復旦大学の大気科学者であるフー・ホンボー氏は述べた。 プラスチックが温暖化に与える影響は時間とともに変化する可能性があることも明らかになった。紫外線灯を使って実験室内で人工的に劣化させたところ、白い粒子は黄色く変色する傾向があり、吸収する太陽光が増えることが分かった。一方、赤い粒子は脱色してより多くの光を散乱させるようになることもあった。 研究著者でデューク大学のドリュー・シンデル教授（地球科学）によると、最初からそうである場合も、大気中を漂って経年変化した結果としても、ほとんどの粒子は暗い色になる。この論文の大きな成果は、「これらほぼすべての粒子がもたらす正味の影響は、冷却よりも温暖化効果のほうが大きいということを特定したことだ」と同氏は述べた。 地球規模でみれば温暖化効果は小さいかもしれないが、無視できるものでもないと研究者らは指摘する。マイクロプラスチックとナノプラスチックは、強力な大気汚染物質であるブラックカーボン（すす）がもたらす温暖化効果の約16%に相当する影響を及ぼす。 研究によれば、太平洋ごみベルトのように旋回する海流にプラスチックが捕まる海域では温暖化への影響は特に顕著で、ブラックカーボンを超える場合もある。「プラスチックの破片同士がぶつかり合うことで、物質が大気中へ極めて大規模に流れ込むようになる」とシンデル氏は指摘する。 著者らは、大気中に存在するプラスチック粒子の正確な量を測定することは非常に難しいと認める一方で、そうした不確実性があっても正味の影響は温暖化だとの確信をみせる。「私たちの研究は、気候モデルを更新する必要があることを示している」とフー氏は述べた。,[],[]
【分析】裏目にでた「プロジェクト・フリーダム」、海運業幹部らは海峡通過に強い警戒感　船舶や港湾攻撃受け（CNN.co.jp）,https://news.yahoo.co.jp/articles/af01c7340f207b64cbe91b8d343c8ef09d3a5ca9,https://newsatcl-pctr.c.yimg.jp/t/amd-img/default.jpg?exp=10800,2026-05-05T12:49:00+09:00,2026-05-05T12:49:00+09:00,CNN.co.jp,cnn,CNN.co.jp,949,（CNN） 米中央軍が商船のホルムズ海峡通過を「誘導」する目的で始めた「プロジェクト・フリーダム」は裏目に出たようだ。この取り組みが新たな暴力を引き起こし、海運業界の幹部らは海峡通過に依然として強い警戒感を示している。 香港の海運会社マンダリン・シッピングのティム・ハクスリー会長は「海峡は今も非常に危険であり、双方がより具体的な合意に至るまでほとんどの船舶が航行を避け続ける」との見方を示した。 トランプ大統領がプロジェクト・フリーダムを開始したことを受け、イランは強く反発し、停戦は危うい状態にある。 同地域では、韓国船籍を含む複数の商船が攻撃を受けている。 アラブ首長国連邦（UAE）は、イランがホルムズ海峡の外側に位置するフジャイラの主要な石油輸出港にミサイルとドローン（無人機）を発射したと発表した。フジャイラは、同海峡を通航せずに中東の石油を輸出できる数少ない重要なルートの一つ。 この動きは、停戦が発表されて以降の4週間で最も深刻な暴力の激化といえる。 通航量の急増もない。米国は同国籍の商船2隻が海峡を通過したと発表したが、イランはこれを否定した。また、米国はイランの小型船少なくとも6隻を撃沈したと発表したが、イランはこの主張も否定している。 計画の詳細についてトランプ氏や米中央軍からはほとんど示されておらず、海運業界幹部らを困惑させている。 プロジェクト・フリーダムの発表後、イランは商船やタンカーはイラン軍と調整する必要があり、米軍がホルムズ海峡に入ることがあれば攻撃すると警告した。 「どの国がこの人道的任務を要請したのか、もしあるとすれば、これがイランとどのように調整されるのかについて具体的な説明がない」。世界中の多くの船舶に賠償責任保険を提供するノース・スタンダードの再保険部門グローバルディレクター、サイモン・ケイ氏はそう述べた。 海運業界が明確な情報を待つ中、原油価格は上昇を続けている。米国のガソリン価格は1ガロン当たり4.46ドルと約4年ぶりの高値となっている。 石油市場の専門家はCNNに対し、海峡が閉鎖されたままの場合、ガソリン価格は1ガロン当たり5ドルに達する可能性があると語った。 ◇ 本稿はCNNのクリスティ・ルー・スタウト記者による分析記事です。,[],[]
クルーズ船で集団感染、3人死亡　ネズミなどげっ歯類媒介のハンタウイルスとは（CNN.co.jp）,https://news.yahoo.co.jp/articles/6018a97c83e158ccd23867cb9dd0064a455bc4e8,https://newsatcl-pctr.c.yimg.jp/t/amd-img/20260505-35247160-cnn-000-1-view.jpg?exp=10800,2026-05-05T11:16:00+09:00,2026-05-05T11:16:00+09:00,CNN.co.jp,cnn,CNN.co.jp,788,ハンタウイルスに感染すると、最初は倦怠（けんたい）感や発熱、悪寒、体の痛みといったインフルエンザのような症状が表れる （CNN） 大西洋を航行中のクルーズ船で、ネズミなどのげっ歯類が媒介するハンタウイルスと思われる集団感染が発生し、これまでに3人が死亡した。 世界保健機関（WHO）によると、ハンタウイルスの症例は1例が確認され、疑わしい症例5例についても調査を行っている。クルーズ船は南米アルゼンチンを出航し、西アフリカ沖の島国カボベルデに向かっていた。 ハンタウイルスに感染すると、最初は倦怠（けんたい）感や発熱、悪寒、体の痛みといったインフルエンザのような症状が表れる。進行すると心臓や肺、腎臓の疾患を引き起こし、重度の呼吸困難や臓器不全に陥って死に至ることもある。米疾病対策センター（CDC）によれば、致死率は5～15％で、呼吸器の症状が表れた場合は約40％が死に至る。 WHOは4日、一般の人の間で感染が拡大するリスクは依然として低く、心配する必要はないと指摘した。しかしクルーズ船内でどのように感染が拡大したのかは現時点で分かっていない。 ハンタウイルスはげっ歯類の体液や糞尿から感染するウイルスの総称で、乾燥したげっ歯類の糞尿の粒子を吸い込むことで人にも感染する。感染源に触れた後、自分の口や鼻に触れて感染する場合もあるほか、まれにげっ歯類にかまれたり引っかかれたりして感染することもある。 人から人への感染が確認されているハンタウイルスは南米原産のアンデスウイルスのみ。ただしそうした症例は極めて少ない。 今回の集団感染が起きた経緯は不明だが、専門家によると、船内にネズミが入り込んだ可能性があるほか、1～8週間という潜伏期間を考えると、アルゼンチンに寄港した際に感染した可能性もある。 WHOは、ウイルスのゲノム解析を含めて詳しい調査を続けていると説明した。,[],[]
ユージェニー王女、第3子妊娠　英王室が発表（CNN.co.jp）,https://news.yahoo.co.jp/articles/6116d29890a4e231b30cb152a17a1f22ded1a390,https://newsatcl-pctr.c.yimg.jp/t/amd-img/20260505-35247158-cnn-000-1-view.jpg?exp=10800,2026-05-05T10:43:00+09:00,2026-05-05T10:43:00+09:00,CNN.co.jp,cnn,CNN.co.jp,966,英国のユージェニー王女が夫ジャック・ブルックスバンク氏との間に第3子を妊娠していることが分かった （CNN） 英国のユージェニー王女が夫ジャック・ブルックスバンク氏との間に第3子を妊娠していることが分かった。バッキンガム宮殿が4日に発表した。 【画像】胎児の写真をみるオーガスト君（5）とアーネスト君（2） 今夏に新たな家族を迎える夫妻には、すでに2人の息子がいる。2021年2月にオーガスト・フィリップ・ホーク・ブルックスバンク君、23年5月にアーネスト・ジョージ・ロニー・ブルックスバンク君が誕生している。 王室はSNSに投稿した声明で、「ユージェニー王女殿下とジャック・ブルックスバンク氏は、今年夏に第3子が誕生することを発表できることを大変うれしく思っている」と述べた。 「オーガスト君（5）とアーネスト君（2）も、新しいきょうだいが家族に加わることをとても楽しみにしている」としている。 声明はさらに、生まれてくる赤ちゃんの大おじにあたるチャールズ国王も、この知らせを「大変喜んでいる」と伝えた。 ユージェニー王女とブルックスバンク氏は18年10月、ウィンザー城内のセント・ジョージ礼拝堂で結婚式を挙げた。その数カ月前には、王女のいとこにあたるヘンリー王子がメーガン妃と結婚していた。 英国王位継承順位12位のユージェニー王女は、チャールズ国王の弟で不祥事を起こしたアンドルー元王子の次女。生まれてくる赤ちゃんは、アンドルー氏と元妻セーラ・ファーガソン氏にとって5人目の孫となる。 ここ数カ月、英王室にとって明るいニュースは少なかった。アンドルー氏は「王子」の称号を剥奪（はくだつ）され、ウィンザー城のロイヤル・ロッジからノーフォーク州のサンドリンガム領地内へ移った。 アンドルー氏は、性犯罪で有罪判決を受けた故ジェフリー・エプスタイン氏との関係をめぐり、さらなる説明を求める圧力に直面しているが、エプスタイン氏との関係をめぐる不正行為を否定している。 一方、米司法省が公開した文書から、ファーガソン氏もエプスタイン氏と関係があったとみられている。 ユージェニー王女と姉のベアトリス王女は、両親とエプスタイン氏との関係により一家を巻き込んだスキャンダルの影響を受けてきた。だが王女ら自身に不正があったとは示唆されていない。,[],[]
132人死亡の中国旅客機墜落、故意の疑い強まる　操縦席のスイッチ操作をデータが記録（CNN.co.jp）,https://news.yahoo.co.jp/articles/86311fecc0e688d6650d6d4d6326ebb5a4d3ec9f,https://newsatcl-pctr.c.yimg.jp/t/amd-img/20260505-35247157-cnn-000-2-view.jpg?exp=10800,2026-05-05T09:59:00+09:00,2026-05-05T11:21:01+09:00,CNN.co.jp,cnn,CNN.co.jp,1163,中国南部の中国東方航空機墜落現場で安全ロープを木にくくりつける救助隊員＝2022年3月26日 （CNN） 中国東方航空の旅客機が墜落して132人の搭乗者全員が死亡した2022年の事故をめぐり、操縦室にいた人物が故意に両エンジンへの燃料供給を停止した可能性があることが、米国家運輸安全委員会（NTSB）の調査報告書で明らかになった。 中国東方航空MU5735便（ボーイング737-800型機）は22年3月21日、中国南部・広西チワン族自治区の山中に墜落した。同国航空史上最悪級の事故だったにもかかわらず、中国民用航空局（CAAC）は原因の究明には至っていない。 しかし情報公開請求に基づき公開されたNTSBの報告書によれば、同機は墜落前に、両方のエンジンへの燃料供給が同時に停止されていた。 このデータは同機のフライトデータレコーダーに記録されていた。データレコーダーは全運航情報を記録する2個の「ブラックボックス」のうち一つで、機体の残骸から回収されて、首都ワシントンのNTSBで解析が行われた（ボーイングが米国の航空機メーカーだったことからNTSBが調査にかかわった）。 「高度2万9000フィート（約8840メートル）で飛行中、両エンジンの燃料スイッチが稼働から停止に切り替わったことが判明した。この燃料スイッチの切り替え後、エンジンが減速した」。NTSBは報告書にそう記している。 民間航空機は燃料スイッチでエンジンへの燃料の流れを物理的に制御する。737型機の場合、稼働から停止に切り替えるためには操縦士がスイッチを押し上げる必要がある。 専門家はフライトデータレコーダーの記録について、「墜落の直前に燃料スイッチが手動で停止位置に置かれたことをはっきり示している」と指摘。「スイッチが稼働位置に戻された形跡はない。つまり、エンジン再始動の試みはなかった」「もし誤ってエンジンが停止されていたとすれば、操縦士が再始動を試みていたはずだ」との見方を示した。 NTSBの報告書によると、フライトデータレコーダーは発電機が電力を喪失した高度2万6000フィートで記録を停止し、最後の瞬間はとらえていなかった。一方、操縦室の音声を記録するボイスレコーダーは、補助電源で記録を続けた。 米当局は損傷したボイスレコーダーから4本の音声記録を入手することに成功し、中国民用航空局に提供した。しかし、NTSBはこの音声ファイルの複製を保持しなかった。 中国民用航空局は、墜落が故意だったとの見方を否定していた。 オーストラリアの航空専門家トニー・スタントン氏は、今回のNTSBの報告書について「公開された資料だけでは、動機も意図も、誰がスイッチを操作したのかも証明できない」と述べ、最終事故報告書とみなすべきではないとの見解を示した。,[],[]
トランプ氏、「世論調査はフェイク」　イラン戦争支持32％との結果受け（CNN.co.jp）,https://news.yahoo.co.jp/articles/f2f4a3ae1ebb2d8f9ba8deac085aa79c782c1773,https://newsatcl-pctr.c.yimg.jp/t/amd-img/20260505-35247156-cnn-000-2-view.jpg?exp=10800,2026-05-05T09:25:00+09:00,2026-05-05T14:55:14+09:00,CNN.co.jp,cnn,CNN.co.jp,850,ホワイトハウスで行われた中小企業向けイベントで発言するトランプ米大統領＝4日 （CNN） 米国民が対イラン戦争への不満を募らせている兆候が見られる中、トランプ米大統領は4日、いつもの主張を持ち出した。世論調査は偽物だというのだ。 【映像】トランプ氏、女性記者に「ブタ、静かに」 「彼らは偽の世論調査を出している」と、ホワイトハウスで行われた中小企業向けイベントでトランプ氏は不満を表明した。「イランとの戦争に関する世論調査を実施したら、支持する人は32％だけだったという。私はそれを好んでいないし、戦争というものはまったく好きではない。だが、我々は優れた装備を持っていて、世界最強の軍隊を擁している」 トランプ氏はさらに、世論調査の質問は自身に対して偏見があるとし、調査会社はイランの核兵器保有が認められるべきかどうかを聞くべきだと主張した。しかし、そうしたとしても結果は変わらないかもしれないとトランプ氏は思案し、「32％になるわけがない」と述べた。「たとえそう聞いたとしても、32％という数字になるのだろう。なぜなら世論調査はフェイクだからだ。つまり、完全にフェイクなのだ」 トランプ氏がイラン戦争に関する世論調査を批判するのはここ数日で2度目。ただしどの世論調査を指しているのかは不明だ。1日に発表された米紙ワシントン・ポストとABCニュース、イプソスによる世論調査では、イランに対する米国の武力行使は正しいと答えた人はわずか36%だった。 トランプ氏の発言は、ホルムズ海峡の長期封鎖をめぐり、米イラン間の微妙な停戦が危ぶまれる中で行われた。同氏は4日、戦争の恒久的終結の難しさを軽視し、批判する人々は性急すぎると主張した。 「我々は今、戦争をしていて、始めてからまだ6週間程度だ。彼らは『なぜこんなに長くやるんだ』と言う」とトランプ氏は述べた。「ベトナムには19年もいた。イラクも長かった、10年、12年だ。いろいろな戦争に関わってきた、朝鮮戦争は7年だった。第2次世界大戦は言うまでもない」,[],[]
トランプ氏、ホルムズ海峡でイラン小型船7隻を「撃沈」と発表（CNN.co.jp）,https://news.yahoo.co.jp/articles/f515a611cea3aad9927f4132461215e619ffb618,https://newsatcl-pctr.c.yimg.jp/t/amd-img/20260505-35247155-cnn-000-1-view.jpg?exp=10800,2026-05-05T08:24:00+09:00,2026-05-05T08:24:00+09:00,CNN.co.jp,cnn,CNN.co.jp,757,ホワイトハウスでのトランプ米大統領＝4月30日 （CNN） トランプ米大統領は4日、イランがホルムズ海峡で複数の船舶に向けて攻撃を行ったことを受け、米国がイランの小型船7隻を撃沈したと述べた。 【映像】米軍、イランの「ドローン空母」を攻撃 トランプ氏は、韓国の船舶を除き、イランの攻撃による被害は生じていないと付け加えた。 「イランは、プロジェクト・フリーダムの船舶航行に関連し、韓国の貨物船を含む無関係の国々に向けて攻撃を行った。今こそ韓国がこの任務に加わるべき時かもしれない。我々は小型船、あるいは彼らが言うところの『高速』船を7隻撃沈した。彼らに残されているのは、それですべてだ」とトランプ氏は語った。 「韓国の船舶を除けば、現時点でホルムズ海峡を通過する上で被害は出ていない」とも述べた。 4日早朝、米中央軍のクーパー司令官は記者団に対し、米軍がホルムズ海峡でイランの小型船6隻を「爆破した」と明らかにしていた。トランプ氏はこれまで、イラン海軍は壊滅したとたびたび述べているが、ケイン統合参謀本部議長は、イランの精鋭部隊「イスラム革命防衛隊」が、海峡で使用可能な小型船を依然として保有していると認めている。 「プロジェクト・フリーダム」は、ホルムズ海峡の「自由な航行を求める商船」を支援する取り組みだが、正式な軍による護衛は含まれていない。米中央軍の声明によると、この取り組みにはミサイル駆逐艦、100機以上の陸上および海上航空機、多領域無人プラットフォーム、1万5000人の兵士が投入されている。 トランプ氏はまた、ケイン氏とヘグセス国防長官が5日午前に記者会見を行うことも発表した。 CNNはこれに先立ち、韓国外務省報道官の話として、ホルムズ海峡で4日、韓国系の船舶で爆発と火災が発生したと報じていた。,[],[]
