headline,mainEntityOfPage,image,datePublished,dateModified,author,media_en,media_jp,str_count,body,images,external_links
東日本台風から5年　命を守る遊水地計画の今（福島）（KFB福島放送）,https://news.yahoo.co.jp/articles/7bdde04d29acf04a4b448cc7bc1d732e82d8a704,https://newsatcl-pctr.c.yimg.jp/t/amd-img/20241008-00000990-kfb-000-1-thumb.jpg?exp=10800,2024-10-08T19:17:00+09:00,2024-10-08T19:17:00+09:00,KFB福島放送,kfb,KFB福島放送,200,\n福島放送\n県内５つのテレビ局が、県民の命を守る備えの大切さを呼び掛ける「マイリスク・マイ避難守ろう命！」キャンペーンのシリーズ特集です。\n中通りを中心に県内に甚大な被害をもたらした、２０１９年の東日本台風からまもなく５年となるのに合わせてシリーズでお伝えします。\n中通りの３町村で計画されている、阿武隈川の遊水地計画について、現状と課題を見ていきます。\n\n※詳しくは動画をご覧ください。,[],[]
課題解決に向け花見山で実証実験（福島）（KFB福島放送）,https://news.yahoo.co.jp/articles/97771cf2a2eb2c10e4a768373dfb0666bdf94343,https://newsatcl-pctr.c.yimg.jp/t/amd-img/20241008-00000989-kfb-000-1-thumb.jpg?exp=10800,2024-10-08T18:55:04+09:00,2024-10-08T18:55:04+09:00,KFB福島放送,kfb,KFB福島放送,992,\n福島放送\n福島市の花の名所「花見山」には、花見シーズンに県内外から大勢の観光客が訪れますが、抱えている課題もあります。\nその課題の解決につなげようと、地元の人たちなどが集まりある実証実験が行われました。\n\n福島市にある花見山は、２０２４年春の花見シーズンには、県内外から約７万５０００人が訪れた、県内でも有数の観光スポットです。\n「福島に桃源郷あり」といわれる花見山ですが、抱えている課題も。\n【左右田禎子アナウンサー】\n「花見シーズンには、多くの人が訪れる花見山ですが、その周辺地域は多くの土地が休耕地となっていて、このように草が生い茂っています。」\n花見山の周辺では、花を栽培する農家の高齢化や後継者不足により休耕地が増えていて、景観をいかに保つかが課題のひとつになっています。\n\nこうした中、行われたのが、ラジコンの草刈り機を使ったスマート農業の実証実験です。\n８日は地元の人たちなど約３０人が参加。\n用途別に準備された、３台のラジコン草刈り機の仕組みを確認したあと、実際に動かして草刈りをしました。\n参加した人は「今までの草刈り機と全然違いますね。５倍１０倍違うんじゃないですか。楽だと思います。」と話していました。\n現在は、休耕地の草刈りを約１００人がかりで行なっているということですが、ラジコン草刈り機を使えば１０人ほどで同じ面積を処理できると期待されています。\n\n花見山の園主・阿部一夫さんは「草刈りは汗びっしょりかくし、足も結構使うし、重労働ですね。ラジコン草刈り機は汗もかかないし、楽しそうですね。」と話していました。\nまた、ラジコン草刈り機は、傾斜がきつい場所の草もスムーズに刈ることができます。\n一夫さんの息子の阿部晃治さんは「今までやれなかったとことか、やりづらかったとこにこれなら入っていけるかなという新たな希望。」と述べました。\n\nまた、福島市観光交流推進室の中野絢太さんは「この花見山周辺の景色というのを、多くの人が楽しみにしていますので、この花見山周辺の原風景を後世に残していけるように、スマート農業の導入というのも前向きに検討していきたいと思います。」と述べました。\n\n実際に導入されるかなど、具体的なことは決まっていませんが、体験した地元の人たちからは「ぜひ導入してほしい」との声が上がっていました。,[],[]
放火の疑いで逮捕・送検の男　他の犯行ほのめかす（福島）（KFB福島放送）,https://news.yahoo.co.jp/articles/a33f8baee039699b6c79d33423a6323d14a8b553,https://newsatcl-pctr.c.yimg.jp/t/amd-img/20241008-00000988-kfb-000-1-thumb.jpg?exp=10800,2024-10-08T18:55:04+09:00,2024-10-08T18:55:04+09:00,KFB福島放送,kfb,KFB福島放送,525,\n福島放送\n２０２４年６月に、喜多方市高郷町で倉庫に火を付け、全焼させた疑いで逮捕・送検された男が、他にも放火をほのめかす供述をしていることがわかりました。\n警察は、男が周辺で数年前から相次いでいる不審火にも関与しているとみて、詳しく調べています。\n\n８日に送検された喜多方市高郷町の無職・熊沢勝正容疑者（５４）は、２０２４年６月、市内のＪＡ会津よつば高郷支店の倉庫に火をつけて、全焼させた疑いが持たれています。\n熊沢容疑者は「やりました」などと容疑を認めていて、捜査関係者によりますと、他にも数件の火事について、自分が火をつけたことをほのめかす供述をしているということです。\n\n高郷町の住民は「燃えやすいものは外に置かないように気を付けていた。」と話します。\n近所の人によりますと、熊沢容疑者は少なくとも２０年ほど前から、今の家に住んでいるということですが、地域との関わりはほとんどなかったといいます。\n熊沢容疑者を知る人は「もうしばらく会っていないしね。職を転々としていたからね。運転はできたけどね。」と話していました。\n\n警察は、周辺で数年前から相次いでいる不審火にも、熊沢容疑者が関与しているとみて詳しく調べています。,[],[]
燃料デブリの試験的取り出し　対策求める声相次ぐ（福島）（KFB福島放送）,https://news.yahoo.co.jp/articles/af1c84930fa503bcdc17be98e5d78596595f3896,https://newsatcl-pctr.c.yimg.jp/t/amd-img/20241008-00000991-kfb-000-2-thumb.jpg?exp=10800,2024-10-08T19:25:23+09:00,2024-10-08T19:28:07+09:00,KFB福島放送,kfb,KFB福島放送,375,\n福島放送\n福島第一原子力発電所２号機で中断されている、燃料デブリの試験的取り出しについて、再発防止策や対策を求める声が相次ぎました。\n\n8日の廃炉に関する県民会議で、議長を務める福島大学の牧田実教授は「始まったところでこういうことが出てきている中で、県民の不安もかなり高まっているということが現実にあります。１つ１つ確実にやっていけるように、気を引き締めてしていただきたい。」と述べました。\n\n原発事故で避難対象となった１３の市町村や、業界団体などでつくる会議で、東京電力は、燃料デブリの試験的取り出しが、パイプの接続ミスによって着手直前に中断したこと、また、取り出し装置のカメラに不具合が起きて、中断が続いている現状などを報告しました。\nこれに対し、出席者からは、東京電力による確認不足や管理体制の甘さを指摘する意見が相次ぎました。,[],[]
１５日公示の見通し　衆院選投票用紙の印刷（福島）（KFB福島放送）,https://news.yahoo.co.jp/articles/74e8a53f4e232d6c4cc45ec0dcdd088435377ec9,https://newsatcl-pctr.c.yimg.jp/t/amd-img/20241008-00000987-kfb-000-1-thumb.jpg?exp=10800,2024-10-08T18:55:04+09:00,2024-10-08T18:55:04+09:00,KFB福島放送,kfb,KFB福島放送,302,\n福島放送\n１０月１５日公示、２７日投開票で行われる見通しの衆議院議員選挙に向け、投票用紙の印刷が行われました。\n\n投票用紙の印刷は、福島市の印刷会社で午前９時半ごろに始まり、県選挙管理委員会の担当者が誤字・脱字や印刷のにじみがないかなどを確認しました。\n衆議院議員選挙の小選挙区用と比例代表用の投票用紙は、２０２１年の前回よりそれぞれ約５万７０００枚少ない、１５５万７８００枚印刷されました。\n投票用紙は１２日に、１３の市や各地方振興局に向けて発送される予定です。\n\n県選挙管理委員会の佐藤冴紀さんは「今回は準備の期間が短いが、確実にしっかりと準備を進めていきたい。」と話していました。,[],[]
県内は肌寒い雨の朝　日中も気温上がらず（福島）（KFB福島放送）,https://news.yahoo.co.jp/articles/2b506143dcbec536d31feda6bd1396005565af7c,https://newsatcl-pctr.c.yimg.jp/t/amd-img/20241008-00000986-kfb-000-1-thumb.jpg?exp=10800,2024-10-08T12:03:47+09:00,2024-10-08T12:03:47+09:00,KFB福島放送,kfb,KFB福島放送,327,\n福島放送\n８日朝の県内は、広い範囲で雨が降り、肌寒い朝となりました。\n日中も気温が上がらない予想で、体調管理に注意が必要です。\n\n【新垣海音アナウンサー】\n「午前８時半の郡山駅前です。朝から冷たい雨が降っていて、歩く人たちを見ると、長袖姿の方や上着を羽織っている方が目立ちます。」\n\n県内は前線や気圧の谷の影響で、広い範囲で雨が降っています。\nまた、北寄りの冷たい風が吹き込んでいて、８日朝の最低気温は郡山と若松で１４℃、福島で１５・２℃などとなりました。\n\n出勤する女性「家出てからビックリしました。車にストールを積んでいたので、掛けてきました。」と話していました。\n日中も気温が上がらない予想で、体調の管理に注意が必要です。,[],[]
放火の疑いで逮捕の男　他の犯行をほのめかす（福島）（KFB福島放送）,https://news.yahoo.co.jp/articles/3fa7e8babdf42e7e5e3a5a026b164d95e0a78557,https://newsatcl-pctr.c.yimg.jp/t/amd-img/20241008-00000985-kfb-000-1-thumb.jpg?exp=10800,2024-10-08T12:03:47+09:00,2024-10-08T12:03:47+09:00,KFB福島放送,kfb,KFB福島放送,327,\n福島放送\n喜多方市高郷町で、倉庫に火を付けて全焼させた疑いで、７日逮捕された男は、他にも放火をほのめかす供述をしていることがわかりました。\n\n警察によりますと、喜多方市高郷町の無職・熊沢勝正容疑者（５４）は、２０２４年６月、市内のＪＡ会津よつば高郷支店の倉庫に火をつけて全焼させた疑いで、７日逮捕されました。\n警察の調べに対し熊沢容疑者は、「やりました」などと容疑を認めていて、捜査関係者によりますと、他にも数件の火事について、自分が火をつけたことをほのめかす供述をしているということです。\n\n警察は熊沢容疑者が、周辺で数年前から相次いでいる不審火にも関与しているものとみて、午後にも熊沢容疑者の身柄を検察庁に送り、詳しく調べる方針です。,[],[]
