headline,mainEntityOfPage,image,datePublished,dateModified,author,media_en,media_jp,str_count,body,images,external_links
来年３月に韓国に来る「二刀流」大谷の魅力の正体（１）（中央日報日本語版）,https://news.yahoo.co.jp/articles/2c49a00b75f0ccd45495cc351b5daf2da0ff7c7f,https://newsatcl-pctr.c.yimg.jp/t/amd-img/default.jpg?exp=10800,2023-12-23T13:08:24+09:00,2023-12-23T13:08:24+09:00,中央日報日本語版,cnippou,中央日報日本語版,1681,\n一人の青年がいる。背が高くハンサムで、さわやかな笑顔に性格もよく、卓越した野球の実力まで兼ね備えた青年だ。ドラマや映画でなく実際にこのような青年が存在すれば、どの娘の親もときめくのではないだろうか。\n\n大谷翔平のことだ。ホームランを打ってベースを回る彼の姿は見ている人を微笑ましくする。ある日は打者が全く反応できない速球で、ある日はフェンスをはるかに越える本塁打でスポーツニュースに顔を見せる大谷は、いつの間にかいかなる抵抗感もなく私たちの警戒心を取り払って入ってきた。\n\n大谷が私たちを驚かせたのは１２月１０日、ＬＡドジャースに移籍しながら報道された１０年・７億ドル（約１０００億円）という天文学的な契約金額だった。５万ウォン（約５５００円）札を積み重ねると漢拏山（ハルラサン）の白鹿潭（ペンノクタム）より高くなるという契約金の記事は大谷翔平が消費される断面を見せている。しかしよく見てみると、大谷の存在は私たちに海外トピックの一つとして扱うにはあまりにも身近になっている。\n\nシンドローム程度でなくとも韓国で大谷は穏やかな波紋を起こす魅力的なメジャーリーガーであることに間違いない。これまで大谷ほど好感を抱かせた日本人がいただろうか。大谷に向かう大韓民国の感情はイチローに抱いたものとは異なる。イチローはサムライというぎこちないペルソナを被って憎たらしささえも感じられたが、大谷は誠実で正しい青年の姿として近づいてくる。しかしこうした民族主義的なプリズムとは別に、大谷には人を引き込む特別な何かがある。その魅力の正体は何だろうか。この質問は大谷に投影された私たちの認識が何であるかを問うのと変わらない。言い換えれば、大谷に対する視線を通じて私たちの社会を読み取ることができるということだ。熱狂せずに微笑ましく隣国の青年を見守る私たちの視線、そこには何が投影されているのだろうか。\n\n最近の言葉で、非現実的に完璧な人物が現実の中に登場した時には「マンチンナム」と呼ぶ。「漫画を破って出てきた男」の略語と理解できるが、大谷は誰が見てもこの言葉のために存在する。容姿、性格、人格、努力、誠実、自己管理、実力など野球選手としてだけでなく、人間が備えるべき徳性を見せる完璧さは「マンチンナム」そのものだ。\n\nこのうち最も驚くべき「マンチンナム」の要素は投手と打者を兼ねる「二刀流」であろう。徹底的に分業化された現代社会で投手と打者の兼業自体が無謀な挑戦だが、両方で圧倒的な記録を作り出す大谷の能力は逆説的な意味で時代錯誤的だ。２０２３年にアメリカンリーグのＭＶＰを全員一致で受賞したというニュースからは、粗雑な漫画のストーリー構成までが感じられるほどだ。出塁率、長打率、ＯＰＳ、本塁打１位に４つの打撃タイトルを獲得し、漫画で設定するにもきまり悪いほど過度に作為的で虚構的だ。なんとかストーリーの蓋然性を付与した点がひじを痛めたこととと、それによって投手として１０勝に終わった成績だ。\n\nメジャーリーグでシーズン１０勝・４０本塁打を記録した身体的な優秀性は、大谷の性格と自己節制の完璧なキャラクターのための布石にすぎない。「マンダラート」（目標と具体的な細部項目が書き込まれた四角形のチャート）は、彼の完璧性が天賦の能力でなく目標に到達するための計画と絶えない実践的努力の結果という明らかな道徳教科書的な教えに置換され、現実性を感じることができない。「ゴミを拾うことは先に通った人が落としていった運を拾うこと」という彼の言葉はあまりにも倫理的な語録であり、鳥肌が立つほどだ。こうした断片的な話の要素は、大谷の純粋な姿と化学的な反応を起こし、非現実的なリアリティーをさらに強める。\n\n大谷にあふれる関心と愛情は孫興慜（ソン・フンミン）とは異なる。孫興慜を眺める私たちの視線に民族主義のプリズムが入っているのなら、大谷には美学的な賛辞が隠れている。言い換えれば、孫興慜には愛国のにおいがするなら、大谷には美しい青年を眺める美学の楽しみがある。,[],[]
１０５０億ドルの貨物が迂回…「紅海発物流大乱」で陸海空運賃が上昇（中央日報日本語版）,https://news.yahoo.co.jp/articles/809bed50b8e9de60baf03d7b5d3241286de0f08c,https://newsatcl-pctr.c.yimg.jp/t/amd-img/default.jpg?exp=10800,2023-12-23T14:13:17+09:00,2023-12-23T14:13:17+09:00,中央日報日本語版,cnippou,中央日報日本語版,916,\nイエメンのフーシ派が紅海で民間船舶を攻撃し「紅海発物流大乱」が生じている。コンテナ船が迂回航路を選択し、海上運賃はもちろん陸上運賃、航空運賃も上昇している。\n\n２２日（現地時間）のロイター通信などによると、フーシ派による紅海での相次ぐ船舶攻撃のため航路を変更したコンテナ船は少なくとも１５８隻にのぼる。これらコンテナ船の貨物の価値はコンテナ１個あたり５万ドル（約７１０万円）とすると計１０５０億ドル。\n\n紅海はスエズ運河を通って地中海につながる。このため紅海航路を利用できず迂回する場合、コンテナ船はアフリカ南端の喜望峰を回ることになる。アジアから欧州や米国に向かうコンテナ船は輸送に追加で数週間かかる。\n\n２１日午前基準で中国上海から英国へ向かう４０フィートのコンテナ運賃は先週の２４００ドルから１万ドル（約１３００万ウォン）まで上がった。イスラエル最南端のエイラート港はフーシ派の攻勢が始まって以降、物流量が８５％減少している。\n\n海上貿易路に支障が生じ、中東地域のトラック運送料金が倍以上になるなど物流運賃が上昇している。フレイトスのユラ・レビン・リサーチ責任者は「中国－北欧航空配送料金は１キロあたり３．９５ドルだったが、今週は４．４５ドルへと１３％上昇した」と伝えた。\n\n物流企業の関係者は「サプライチェーンの一つの地点で危機が発生する場合、船舶が（他の地点に）集中して入港・出港日程が複雑になり、システム全体が連鎖的に遅れたりする」と指摘した。\n\n物流企業は大陸横断鉄道やパナマ運河の利用など代替貿易路を検討している。\n\n一方、こうした事態に韓国企業も緊張している。賞味期限が短い食品は配送遅延の余波が大きく、運賃上昇が続く場合はコスト競争力の低下も避けられないからだ。ある建設重装備製造企業の代表は「１２月中に送る予定だったものが今月中に到着できず、今年の売上が予想より１０％減ることになった」と話した。\n\n政府は事態が長期化する場合に対応してこの日、政府ソウル庁舎で非常経済次官会議を開き、食品・飼料原料の関税を３２００億ウォン（約３５０億円）引き下げるなど対策の準備に着手した。,[],[]
中国、経済悪化の中でＳＮＳから分析家消える…口封じか（中央日報日本語版）,https://news.yahoo.co.jp/articles/caa12282f9691fc7f341b9cb3113260e50465c83,https://newsatcl-pctr.c.yimg.jp/t/amd-img/default.jpg?exp=10800,2023-12-23T14:13:08+09:00,2023-12-23T14:13:08+09:00,中央日報日本語版,cnippou,中央日報日本語版,874,\n中国の経済問題に現実的な診断を出した金融専門家がオンライン上から消えていると、ＣＮＮが２２日（現地時間）報じた。\n\nＣＮＮが最近、経済に関する論評を出してきた中国ビジネス分析家のソーシャルメディア（ＳＮＳ）を追跡した結果、少なくとも６人の分析家が投稿できなくなっていることが分かった。\n\n中国の有名金融専門家・劉紀鵬氏のＳＮＳには今月初めから投稿がなく、フォローも禁止されている。劉氏のＴｉｋＴｏｋをフォローすると「プラットホーム規定違反のためフォローできない使用者」という説明だけが表示される。劉氏は１日、中国資本市場の弊害を批判し、自国の株式市場に対する投資を引き止めるコメントを載せた。\n\nこのほかにも投資分析家、資本市場を教える大学教授、投資会社の代表もＳＮＳ規制に直面した状況だと、ＣＮＮは明らかにした。\n\n特にこうした「ＳＮＳ口封じ」が集中したのは、１１－１２日に習近平国家主席が開いた中央経済工作会議で「経済宣伝と世論指導を強化して『中国経済光明論』を歌うべき」という指針が出てきてからだ。\n\nその後、中国国家安全省は「中国経済を否定的に話す陳腐な各種論調が絶えず出ているが、その本質は虚偽の叙事で『中国衰退』の談論を作り『認知的な罠』に陥れようとする無駄な試みだ」と強く批判した。\n\n米ワシントンのシンクタンク、ジェームズタウン財団のウィリー・ラム研究員は「中国政府は経済懐疑論が拡大して消費心理がさらに悪化することを懸念している」と説明した。\n\n中国は新型コロナの大流行以降、景気回復に力を注いだが、不動産市場の沈滞、地方政府の負債問題などが解決せず、成果を出せずにいる。今年は上海総合指数が５．７％下落した。\n\nただ、世論統制がむしろ中国経済の正確な状況の把握を難しくするという指摘が出ている。これに先立ち中国政府は８月、青年失業率が３カ月連続で過去最高を更新すると統計の発表自体を中断した。\n\nこうした情報の不透明性が投資などを難しくし、経済にさらに負担を与えていると、ＣＮＮは伝えた。,[],[]
来年３月に韓国に来る「二刀流」大谷の魅力の正体（２）（中央日報日本語版）,https://news.yahoo.co.jp/articles/8e36b3e88a86458d7f8458cb75322651cd1b3b8d,https://newsatcl-pctr.c.yimg.jp/t/amd-img/default.jpg?exp=10800,2023-12-23T13:08:29+09:00,2023-12-23T13:08:29+09:00,中央日報日本語版,cnippou,中央日報日本語版,771,\nでは、なぜ私たちは大谷を美しい青年として眺めるのだろうか。そこには私たちの現実の中の青年の美しくない現実の陰画があるからだ。韓国の青年は自分の人生を美学的に生きていくことができない。大谷が高校１年でマンダラートを完成した時、韓国の青年は言語と数理の領域の正解を見つける技術を習得する。大学生になっても美学的な生き方は自身のものにはならない。スペックを積み上げたり、裕福でない親を恨んだり、アルバイトで学費を稼いだりする。こういう息が詰まる回路のような生活は社会人になってからも変わらない。その姿を青年でないすべての国民が共に見守る。低い出生率は青年たちがそれなりに美学的に暮らしてみようとする最後の選択の結果なのかもしれない。\n\n大谷が美しく見えるのは、暗い私たちの青年の肖像が最も華麗で完璧な異国の青年の姿に投影されたからだ。大谷に対する視線は、逆転ホームランを期待できない定められた結果に敗北するのを望まず、非現実的な「マンチンナム」にしばらく自分を重ねてみるものと言ってもよい。大谷がパンデミックの憂鬱な時間に私たちを訪ねてきたという事実はこのような心証に可能性を付与する。\n\n卓越した個人が共同体を引っ張っていく時代は過ぎた。率いる英雄もなく、率いられる大衆も存在しない。それでアベンジャーズとマーベルシリーズに夢中になる。この時代の英雄は歴史の救援者でなく、日常のつらさを慰やしてくれる「マンチンナム」に存在する。\n\n来年３月にその「マンチンナム」が韓国に来る。その時まで青年たちが元気を出して過ごすことを望む。打席に入った大谷のように注目される青春ではないとしても、自分の暮らしに下を向かず堂々と生きることを３月に高尺（コチョク）ドームの打席で感じ取ってほしい。\n\nキム・ジョンヒョ／ソウル大研究教授・体育哲学,[],[]
韓国全羅北道でＭ３．０の地震…韓水原「原発に影響なし」（中央日報日本語版）,https://news.yahoo.co.jp/articles/d71960c79e787f090e49944672c5f5a2f7ac76d3,https://newsatcl-pctr.c.yimg.jp/t/amd-img/default.jpg?exp=10800,2023-12-23T11:17:03+09:00,2023-12-23T11:17:03+09:00,中央日報日本語版,cnippou,中央日報日本語版,269,\n２３日午前４時３４分、全羅北道長水郡（チャンスグン）北側１７キロ地域でマグニチュード（Ｍ）３．０の地震が発生した。震源は北緯３５．８７度、東経１２７．５３度、深さ６キロメートル。\n\n全北消防本部などによると、現在のところ地震発生による被害事例はない。消防関係者は「地震による被害の通報や出動はなかった」と伝えた。\n\n韓国水力原子力（韓水原）は「原発への影響はない」と明らかにした。韓水原は「現在稼働中の発電所は正常運転中であり、すべての原発で地震計測値は地震警報設定値（０．０１ｇ）未満で警報が発生した原発はない」と説明した。,[],[]
＜大リーグ＞「李政厚は１番打者・中堅手」…ＳＦ監督が来季構想（中央日報日本語版）,https://news.yahoo.co.jp/articles/1a43a3bf4406497e5533928588dae4b1ee6c5e88,https://newsatcl-pctr.c.yimg.jp/t/amd-img/default.jpg?exp=10800,2023-12-23T09:32:51+09:00,2023-12-23T09:32:51+09:00,中央日報日本語版,cnippou,中央日報日本語版,654,\n米メジャーリーグのサンフランシスコ・ジャイアンツのボブ・メルビン監督が入団が決定した韓国人外野手、李政厚（イ・ジョンフ、２５）を来季のリードオフ（１番打者）兼中堅手に起用する構想を明らかにした。\n\nメルビン監督は２２日、あるポッドキャストに出演し、「チームが李政厚を獲得した後、いくつかラインナップを構想したが、すべての場合で李政厚はリードオフだった」とし「１番打者は李政厚に慣れやすい打順であり、以前にも経験している打順」と話した。\n\n李政厚はキウム・ヒーローズで１番打者として通算１４６８打席を消化している。メルビン監督はミート能力が優れた李政厚を攻撃の尖兵として活用して選手のビッグリーグ早期適応をサポートする一方、チームの成績も引き上げるという考えだ。\n\nメルビン監督は「李政厚がチームに合流したことに私も選手たちもみんな満足している」とし「サンフランシスコは李政厚が望んだチームでもある。彼には黒とオレンジ（サンフランシスコのユニホーム）がよく似合う」と期待を表した。\n\nサンフランシスコは今季、１番打者に複数の選手を起用したが、通算１６２試合で打率２割６分４厘、２５本塁打、６６打点、出塁率０．３６３、長打率０．４４４という成績だった。メジャーリーグ統計専門サイトのファングラフドットコムが分析した李政厚の来季の予想成績は打率２割８分８厘、８本塁打、６２打点、出塁率０．３４６、長打率０．４１６だ。本塁打を除いて全般的な統計に大きな差はなく、打率は李政厚の予想値がかなり高い。,[],[]
日本、予算減額も「過去最大」防衛費編成…「ＧＤＰの１．３％」（中央日報日本語版）,https://news.yahoo.co.jp/articles/4cd9579a37c493c3f3c5e37d66b99a83aa810c81,https://newsatcl-pctr.c.yimg.jp/t/amd-img/default.jpg?exp=10800,2023-12-23T10:53:23+09:00,2023-12-23T10:53:23+09:00,中央日報日本語版,cnippou,中央日報日本語版,630,\n日本政府が過去最大となる７兆９４９６億円の防衛費を編成した。２２日の共同通信などによると、この日の閣議で来年度予算案を決定した日本政府は防衛費を今年度より１兆１２７７億円増やした。\n\n日本の防衛費は１２年ぶりの予算減の中でも増額された。共同通信は「来年度の防衛費は２０２４年の国内総生産（ＧＤＰ）の１．３％に達するとみられる」と伝えた。\n\n防衛費予算のうち７３４０億円は長射程ミサイルの開発・確保に計上された。また地上配備型ミサイル迎撃システム「イージス・アショア」に代わるイージスシステム搭載艦２隻の建造に３７３３１億円が編成された。２０２７－２８年に就役する予定だ。\n\n日本政府は自衛隊の「反撃能力」保有などに焦点を合わせて２０２７会計年度までに防衛予算をＧＤＰの２％まで引き上げる計画という。\n\n日本の来年度予算案は前年度比２兆３０９５億円減で、１２年ぶりの減額となる。物価高対策などに使う予備費を大幅に減らしたのが影響を及ぼしたと、読売新聞は分析した。\n\n社会保障費と国債関連費用は歴代最大規模で編成された。来年度の社会保障費は全体予算案の３分の１にのぼる３７兆７１９３億円で、国債の返済と利払いに充てる国債費が１兆７５８７億円増の２７兆９０億円。\n\n日本政府は来年１月の通常国会に予算案を提出し、３月までに通過させる計画だ。岸田首相は予算案決定後、官邸で取材陣に対し「物価上昇に負けない継続的な賃上げを実現する」と述べた。,[],[]
韓国、半導体・二次電池・ディスプレー・バイオに来年１４．７兆ウォン投入（中央日報日本語版）,https://news.yahoo.co.jp/articles/08f67950f7420d9ba5048f69ee28ac8a1f771f84,https://newsatcl-pctr.c.yimg.jp/t/amd-img/default.jpg?exp=10800,2023-12-23T10:15:10+09:00,2023-12-23T10:15:10+09:00,中央日報日本語版,cnippou,中央日報日本語版,1364,\n韓国政府が来年、半導体・二次電池・ディスプレー・バイオの４つの先端戦略産業を対象に１４兆ウォン台の政策金融を支援することにした。産業通商資源部によると、政府は第４次国家先端戦略産業委員会を開き、こうした内容の先端戦略産業特化団地支援案および政策金融支援計画などを審議した。\n\nまず政府は４つの先端戦略産業に１４兆７０００億ウォン（約１兆６０００億円）規模の政策金融を支援する計画だ。これは今年の支援計画に比べ１３．８％増。金融委員会・産業部処・政策金融機関間の政策金融支援協議会を四半期別に開いて供給実績を点検し、優秀企業の金融負担軽減および投資拡大を支援するという。また、革新成長ファンドと半導体生態系ファンド、サプライチェーン対応ファンドなど官民合同の資本を必要な企業に支援する。\n\n先端戦略産業特化団地への支援も拡大する。政府は７月、半導体は龍仁（ヨンイン）・平沢（ピョンテク）・亀尾（クミ）、二次電池は清州（チョンジュ）・浦項（ポハン）・蔚山（ウルサン）・セマングム、ディスプレーは天安（チョンアン）・牙山（アサン）など計７つの産業団地を選定した。\n\n基盤施設構築のための事業計画が樹立された龍仁・平沢には今年１０００億ウォンを支援し、来年は亀尾・浦項・蔚山に３９２億ウォンを投入する計画だ。まだ事業計画が確定していない団地は２０２５年から予算が支援される予定だ。\n\n産業団地の造成には安定した電力の供給も欠かせない。政府は７つの特化団地に計１５ギガワット（ＧＷ）以上の電力供給需要が発生するとみている。特にサムスン電子とＳＫハイニックスが世界最大システム半導体クラスターとして造成する龍仁半導体産業団地だけでも１０ＧＷ以上の電力需要が予想される。政府は２０３６年までに液化天然ガス（ＬＮＧ）発電所を造成して３ＧＷ規模の電力を供給し、２０３７年以降には国家電力高速道路（ＥＴＸ）など長距離送電線路を新設し、追加で電力供給をする予定だ。このための「電力網拡充特別法」も制定して汎省庁電力網委員会を新設し、許認可特例を拡大することにした。\n\n特化団地に必要な用水供給計画も準備した。政府は従来の広域・地方上水道施設を優先して活用する一方、水源不足予想地域は発電ダムと代替水資源の開発を通じて対応することにした。特化団地から出る廃水は多数の企業が活用する公共廃水施設に国費を支援して処理することにした。\n\nインフラ支援案も用意した。龍仁特化団地で開発される龍仁国家産業団地は国道４５号線の飽和と幹線道路問題の解決のため広域交通網を補強し、龍仁一般産業団地は物流量の増加が予想されるだけに２０２８年までに進入道路や内部道路など既存の道路インフラを拡充することにした。\n\n先端産業現場の規制改善成果も発表された。政府は半導体７件、バイオ４件の計１１件の先端産業規制を改善し、１２５１億ウォンの経済的効果が生じたと明らかにした。\n\n今後も国家先端戦略産業委員会を通じて追加の規制改善を進める計画だ。産業部の関係者は「来年１－３月期に総合支援案を発表し、バイオ特化団地も新規で指定する計画」とし「２０２５年から特化団地を本格的に運営し、２０２６年には龍仁国家産業団地の着工を始める」と明らかにした。,[],[]
