headline,mainEntityOfPage,image,datePublished,dateModified,author,media_en,media_jp,str_count,body,images,external_links
県内の道の駅でビックリマンシール　大津絵のつえを持つスーパーデビルなど（みんなの経済新聞ネットワーク）,https://news.yahoo.co.jp/articles/edc6cebf73d1f44bde2decf7bee9a6b3dfb532c6,https://newsatcl-pctr.c.yimg.jp/t/amd-img/20240412-00000020-minkei-000-2-view.jpg?exp=10800,2024-04-12T11:52:56+09:00,2024-04-12T13:10:32+09:00,みんなの経済新聞ネットワーク,minkei,みんなの経済新聞ネットワーク,1025,"\nキャンペーンへの参加を呼びかけるロッテの本原さん\n道の駅草津（草津市下物町）など県内19カ所の道の駅で4月27日からオリジナルビックリマンシールを配布する「ビックリマン地方創生プロジェクト 道の駅滋賀周遊キャンペーン」が始まる。（びわ湖大津経済新聞）\n【写真】滋賀県オリジナルデザインのビックリマンシールは4種類\nびわ湖大橋米プラザ（大津市今堅田3）、妹子の郷（さと・大津市和邇中）、アグリの郷栗東（栗東市出庭）など県内19カ所の道の駅で2,000円以上の買い物や飲食をした人に72ミリ角の「ビックリマンBIGシール」を進呈する。\n\n 「ビックリマンBIGシール」は既存のビックリマンのキャラクターに滋賀県の特産品を加え、背景に観光スポットをデザインした。大津市、高島市では、背景に白鬚（しらひげ）神社をデザインし、大津絵の鬼のつえを持った「スーパーデビル」を、草津市、栗東市、竜王市では、背景に琵琶湖大橋をデザインし、近江牛をイメージしたベルトを着けた「始祖ジュラ」を配布する。そのほか、東近江市などでは「サタンマリア」、長浜市などでは「魔肖ネロ」を配布する。4枚全てを集めると、滋賀県出身の芸人・野生爆弾くっきー！さんコラボのビックリマンシールがもらえる抽選に応募できる。\n\n ビックリマンチョコを販売するロッテ（東京都新宿区）は、2023年から「ビックリマン地方創生プロジェクト」を開始。第1弾は全国で唯一ビックリマンチョコを製造しているロッテ滋賀工場（近江八幡市）の近隣4市で開催。第2弾は鳥取県境港市で開催した。今回が第3弾となる。\n\n ロッテブランド戦略部の本原正明さんは「第1弾を開催して『町が元気になった』との声をもらった。ビックリマンを通して、笑顔につながる社会貢献をしていきたい。地方の魅力とビックリマンの良さを掛け算してその土地の魅力を発信していきたい」と意気込む。\n\n 今回の開催は、2022年・2023年に滋賀県道の駅連絡会の事務局を担当していた大津市商工労働政策課が、道の駅制定30周年記念事業としてロッテ滋賀工場に打診したのがきっかけで決まった。商工労働政策課の杉本裕介さんは「東おうみ地域のビックリマン地方創生プロジェクト開催時は観光案内所に行列ができたと聞いた。来場者が増えて道の駅が活性化して、県内の観光がにぎわえば」と期待する。\n\n 6月30日まで。\nみんなの経済新聞ネットワーク",['https://newsatcl-pctr.c.yimg.jp/t/amd-img/20240412-00000020-minkei-000-2-view.jpg?pri=l&w=640&h=472&exp=10800'],"['https://news.yahoo.co.jp/articles/edc6cebf73d1f44bde2decf7bee9a6b3dfb532c6/images/000', 'https://biwako-otsu.keizai.biz/photoflash/7083/']"
調布市立第六中で「まなびの森」プロジェクト 活動拠点は5月に完成（みんなの経済新聞ネットワーク）,https://news.yahoo.co.jp/articles/4f2b5b08d71eb7b3a7d6c2f3728a1e4d574c159b,https://newsatcl-pctr.c.yimg.jp/t/amd-img/20240412-00000018-minkei-000-1-view.jpg?exp=10800,2024-04-12T11:30:00+09:00,2024-04-12T11:30:00+09:00,みんなの経済新聞ネットワーク,minkei,みんなの経済新聞ネットワーク,1319,\n調布第六中学校の佐伯校長（中央）、高橋先生（左）と六中地域学校協働本部の堀さん、明るい森をイメージした創造的空間「MORI」で\n調布市の研究推進校である調布市立第六中学校（調布市国領3）の研究テーマ「まなびの森」プロジェクトが4月からスタートした。（調布経済新聞）\n【写真】4月10日に行われた「まなびの森」第一回教員向け研修の様子\n「まなびの森」構想は昨年、同校に赴任した佐伯あつ子校長が念願していたもので、学校内に創造的な環境を整え、授業を変え、温かい学級や人間関係の構築に努めるなどさまざまなアプローチで「生徒に仲間と協力して主体的に課題に立ち向かう力を育てたい」という教育ビジョンを実現するもの。実施期間は2024年度から2年間。\n\n 構想の基盤にあるのは人権・道徳教育、インクルーシブ教育を重視する人権尊重の精神。佐伯校長は「創造的な空間で多様性が尊重され誰もが大切にされる環境でこそ、子どもの想像力と勇気は湧き上がる。教員には生徒の多様な学びを保障して、仲間と協働する喜びを大切にした生徒の未来につながる授業を展開してほしい」と話す。\n\n プロジェクトの拠点となる創造的空間「MORI」は、木目の床板と腰壁のある、明るい森をイメージした木のぬくもりが感じられる空間。MORIはできるだけ開放して、生徒は授業のほか、休み時間や部活動、放課後などに使えるという。使われていなかったグランドピアノも置いて、「ストリートピアノのように誰でも演奏ができ、ピアノの周りには切り株の椅子を並べたい。この拠点は生徒、教師、地域の人を含めた学び合いの空間にしていきたい」と佐伯校長。\n\n 同プロジェクトは3分野で構成され、教員は必ずどこかに所属するという。「ICTや教室以外の空間も生かした授業づくり」「多様性を重視したUD（ユニバーサルデザイン）化や言語環境を含む環境づくり」「温かな学級を基盤とした学び合う関係性づくり」。同校は「これら3つが重なり合って豊かな森が形づくられ、学校は森のように息づき、拠点だけでなく学校全体が『まなびの森』となっていければ」と期待する。\n\n プロジェクトリーダーの一人で数学科の高橋さんは「公立中学校でこれほど大きな研究テーマは聞いたことがない。既に教員同士で何ができるか話し合っているが、とても楽しく教師としての学びも多い。ワクワクしている」と笑顔で話す。\n\n 佐伯校長は「探究という言葉には失敗が含まれる。『こういう授業をやってみた』でいいから、自由にアイデアを出し、先生同士で話し合いながら進めてほしい。教師の役割は子どもに共感し、子どもの可能性を引き出すこと。学校でさまざまな仕掛けをつくって生徒の学びを後押ししたい。これは生徒のためだが、先生たちが学び合える、教師として生きていく上で力になるプロジェクトでもある」と話す。さらに、「『まなびの森』と名付けたのは、森は生物多様性や共生社会の象徴で、植物はもちろん菌類、虫や鳥、動物など多様な生物が共存している。生徒にはここで成長して、他者や自然と共存、共生ができる人になってほしい」とも。\nみんなの経済新聞ネットワーク,['https://newsatcl-pctr.c.yimg.jp/t/amd-img/20240412-00000018-minkei-000-1-view.jpg?pri=l&w=480&h=640&exp=10800'],"['https://news.yahoo.co.jp/articles/4f2b5b08d71eb7b3a7d6c2f3728a1e4d574c159b/images/000', 'https://chofu.keizai.biz/photoflash/4835/']"
都筑・センター北の丘の上の桜満開　中川八幡山公園（みんなの経済新聞ネットワーク）,https://news.yahoo.co.jp/articles/34fe7b5fc491ad8d6d742c0cba97dc1408e71384,https://newsatcl-pctr.c.yimg.jp/t/amd-img/20240412-00000019-minkei-000-1-view.jpg?exp=10800,2024-04-12T11:30:00+09:00,2024-04-12T11:30:00+09:00,みんなの経済新聞ネットワーク,minkei,みんなの経済新聞ネットワーク,290,\n満開のソメイヨシノ\n横浜市営地下鉄センター北駅近くの中川八幡山公園（横浜市都筑区中川7）の桜が満開になった。（港北経済新聞）\n\n 港北ニュータウンの小高い丘の上にある同公園。1977（昭和52）年には縄文・弥生時代の遺跡が発見された。\n\n 今は公園として整備され、港北ニュータウンを見下ろすことができるほか、晴れた日には遠くの丹沢の山々を臨むこともできる。頂上にはソメイヨシノの大木が数本並んでいて、地域の花見スポットとして親しまれる。\n\n 今年は昨年に比べて1週間ほど開花が遅れた。現在桜は満開のピークを過ぎて、散り始めている。\nみんなの経済新聞ネットワーク,['https://newsatcl-pctr.c.yimg.jp/t/amd-img/20240412-00000019-minkei-000-1-view.jpg?pri=l&w=640&h=480&exp=10800'],['https://news.yahoo.co.jp/articles/34fe7b5fc491ad8d6d742c0cba97dc1408e71384/images/000']
フジテレビでGWのグルメイベント「お台場 からあげ祭」　今年で8回目（みんなの経済新聞ネットワーク）,https://news.yahoo.co.jp/articles/ec5cfbac5806de74cfd137ebf9e1884a614499be,https://newsatcl-pctr.c.yimg.jp/t/amd-img/20240412-00000016-minkei-000-1-view.jpg?exp=10800,2024-04-12T11:01:16+09:00,2024-04-12T11:01:16+09:00,みんなの経済新聞ネットワーク,minkei,みんなの経済新聞ネットワーク,433,\n「からあげ まんぷく亭」のとり皮せんべい\n「第8回『お台場 からあげ祭』～2024・春～」が4月26日～29日の4日間、フジテレビ本社屋（港区台場2）3階の大階段下広場で開催される。（東京ベイ経済新聞）\n\n 8回目となる同イベント。過去に「からあげグランプリ」で上位に入賞した全国各地の唐揚げ専門店が集う。前回開催時には1日約4000食を販売するなど、多くの来場者が訪れた。\n\n 会場には唐揚げ専門店5店舗が出店。「からあげ まんぷく亭」（和歌山県岩出市）、「炙りや福朗」（栃木県足利市）、「からあげ大吉」（大分県中津市）、「暴れん坊チキン」（愛知県岡崎市）、「諭吉のからあげ」（愛知県尾張旭市）が各店の唐揚げを販売する。\n\n 今回は、特別協賛としてサッポロビールがブースを出店。「濃いめのレモンサワー」「濃いめのグレフルサワー」を販売する。\n\n 開催時間は10時30分～17時（最終日は16時まで）。入場無料。\nみんなの経済新聞ネットワーク,['https://newsatcl-pctr.c.yimg.jp/t/amd-img/20240412-00000016-minkei-000-1-view.jpg?pri=l&w=640&h=426&exp=10800'],['https://news.yahoo.co.jp/articles/ec5cfbac5806de74cfd137ebf9e1884a614499be/images/000']
四谷のライブラリーカフェ「ケテポンゴ」が1周年　スペイン語教室が経営（みんなの経済新聞ネットワーク）,https://news.yahoo.co.jp/articles/2043dcf50e28b4e96b802cc177939775d6a4f1f2,https://newsatcl-pctr.c.yimg.jp/t/amd-img/20240412-00000015-minkei-000-3-view.jpg?exp=10800,2024-04-12T11:00:00+09:00,2024-04-12T12:49:13+09:00,みんなの経済新聞ネットワーク,minkei,みんなの経済新聞ネットワーク,856,"\n「ケテポンゴ」のスタッフ\n四谷のライブラリーカフェ「ケテポンゴ」（新宿区四谷三栄町）が4月3日で1周年を迎えた。経営は、併設するスペイン語教室リベラルテ。（市ケ谷経済新聞）\n【写真】「ケテポンゴ」メニューの一例\n店主の大橋玲子さん同教室の代表を務め、スペイン語に関する著書なども執筆、監修する。大橋さんは「リベラルテは2006（平成18）年ごろに始めたが、スペイン語圏のことをより身近に感じてもらうため、以前からこのような交流の場所を作りたいと考えていた。今ではスペイン語圏の国に関心がある方や地域の方に利用されるようになり、うれしい」とも。\n\n 店内には語学書のほか、文学や料理、旅行などの幅広いジャンルの本を置くほか、陶器や雑貨、エキストラバージンオリーブオイル「カシータス・デ・ウアルド」なども販売する。壁にはスペイン語圏に関するイベント情報や旅行情報などを貼り、スペインなどの飲食店や観光地の写真も見ることができるようにする。「飲食だけでなく、本を読んだり物を買ったりする体験を通して、さまざまな角度からスペイン語圏に興味を持ってほしい。現地の情報発信の場でもあるので、海外旅行前に情報収集に訪れる方もいる」という。\n\n メニューはスペイン語圏のサンドイッチや菓子、ドリンクなど。ランチは月替わりで、肉や野菜などの具を「サクサク」とした生地に挟んで焼き上げる「エンパナーダ」や、チョリソーをパンで挟んだ「チョリパン」を、冷製トマトスープ「サルモレホ」や前菜とセット（1,000円）で提供する。菓子は、「マンテカード」（220円～）、「バスクチーズケーキ」（500円）など。ドリンクは、「カフェコルタード」（400円）、「カフェラテ」「カフェボンボン」（以上500円）など。「冷製野菜スープのガスパチョも人気。普段、日本では出合うことの少ないスペイン語の世界に囲まれながら、ひとときを過ごしてほしい」とも。\n\n 営業は月曜～水曜の12時～17時30分。\nみんなの経済新聞ネットワーク",['https://newsatcl-pctr.c.yimg.jp/t/amd-img/20240412-00000015-minkei-000-3-view.jpg?pri=l&w=640&h=479&exp=10800'],"['https://news.yahoo.co.jp/articles/2043dcf50e28b4e96b802cc177939775d6a4f1f2/images/000', 'https://ichigaya.keizai.biz/photoflash/4560/']"
秋田のNPOが音楽作品をサイトで公開　ミュージシャンと障がい者コラボの4曲（みんなの経済新聞ネットワーク）,https://news.yahoo.co.jp/articles/dacd4df0a58d73700ede102d7a0354c696d5c174,https://newsatcl-pctr.c.yimg.jp/t/amd-img/20240412-00000012-minkei-000-1-view.jpg?exp=10800,2024-04-12T10:30:47+09:00,2024-04-12T10:30:47+09:00,みんなの経済新聞ネットワーク,minkei,みんなの経済新聞ネットワーク,743,\n企画展示「はだしのスクラッチ」を担当した圓井智哉さん（左）とNPO法人「アートリンク うちのあかり」で創作活動に取り組むゲンちゃん（右）\n障がい者の芸術表現活動を支援するNPO法人「アートリンク うちのあかり」（秋田市新屋比内町11、TEL 018-838-4711）が3月31日、音楽家と表現活動に取り組む市民が共同で制作した音楽作品4曲をホームページで公開した。（秋田経済新聞）\n【写真】秋田市内で開かれた展覧会に参加する写真家の長浜谷晋さん\n音楽作品は、秋田市が主催し、同NPOが2月に旧松倉家住宅（旭南2）で開いた展覧会「あきたアート はだしのこころ」の企画展示「はだしのスクラッチ（傷）」向けに制作したもの。「感覚の対話」や「心の傷」などをテーマに、障がいの枠を超えて音楽家と市内で障がいなどの背景を持ちながら、さまざまな分野で表現活動に取り組む作家らがコラボ制作した。楽曲はレコード盤に収録し、同NPOが運営するホームページ「はだしのこころ」でも公開した。\n\n 秋田公立美術大学大学院（新屋大川町）の准教授で現代美術家・ホーメイ歌手の山川冬樹さんと、大病の後遺症を抱える秋田市在住の写真家・長浜谷晋さんとの対話から生まれた「The 67th Spring」など、4組が制作した音楽作品と作家らのインタビューなどを掲載する。\n\n 「さまざまな理由で障がいや困難を抱える人の感覚に寄り添い、あふれ出た表現の記録を試みた」と、同企画を担当する圓井智哉さん。「音楽というメディアを入り口に、さまざまなことを広く伝えたい。障がいの有無に関わらず、日々の営みで感じる孤独や心の痛みを解放するきっかけにつなげられれば」と視聴を呼びかける。\nみんなの経済新聞ネットワーク,['https://newsatcl-pctr.c.yimg.jp/t/amd-img/20240412-00000012-minkei-000-1-view.jpg?pri=l&w=640&h=480&exp=10800'],"['https://news.yahoo.co.jp/articles/dacd4df0a58d73700ede102d7a0354c696d5c174/images/000', 'https://akita.keizai.biz/photoflash/3855/']"
高松・「麦縄の里」に雑貨店「あなた」　無料ラッピングブースも（みんなの経済新聞ネットワーク）,https://news.yahoo.co.jp/articles/86fc3248f5398714dc61a71dc8768a19717de1d1,https://newsatcl-pctr.c.yimg.jp/t/amd-img/20240412-00000011-minkei-000-2-view.jpg?exp=10800,2024-04-12T10:00:34+09:00,2024-04-12T10:12:42+09:00,みんなの経済新聞ネットワーク,minkei,みんなの経済新聞ネットワーク,679,\n店内\n雑貨店「あなた」（高松市東植田町）が3月20日、複合商業施設「麦縄の里」内にオープンした。（高松経済新聞）\n【写真】ラッピングスペース\n世界各国の子ども服や雑貨を販売する「ピーカブーヤ」（北浜町）店主の十川（そごう）俊郎さんが経営を手がける同店。ジュエリー・アクセサリーブランド「穀雨（こくう）」（東京都台東区）の真ちゅうオブジェシリーズ「どこか遠くにある街」や、香川県のフラワーショップ「茎」（塩上町2）のドライフラワーなどを販売する。\n\n 店内には高松市在住の美術作家・カミイケタクヤさんによる木のオブジェを飾るほか、海外に買い付けに行った際に持ち帰った観光マップなどの印刷物や「カモ井加工紙」（岡山県倉敷市）のマスキングテープの端材を使い、客が包装する無料のラッピングブースを設ける。\n\n 十川さんは「当たり前の概念がひっくり返る場所、物事を違う視点で見る場所にしたい。『穀雨』のオブジェは目線の高さで見え方が変わる。カミイケさんの木のオブジェは木の枝の部分に根を配置し、上下が逆転した印象の作品にした。雑貨を中心にインテリアをキャッチーな切り口で見てもらいたい」と話す。\n\n 「これまで子ども服を取り扱ってきたため、贈り物のラッピング依頼に対応することも多かった。包む時間は店員も商品を買った人も一緒になって買った相手のことを考えてワクワクできる時間。そのワクワクをお客さまに味わってもらいたいと思い、自分でラッピングできるようにした」とも。\n\n 営業時間は木曜～日曜＝11時～16時。\nみんなの経済新聞ネットワーク,['https://newsatcl-pctr.c.yimg.jp/t/amd-img/20240412-00000011-minkei-000-2-view.jpg?pri=l&w=640&h=480&exp=10800'],"['https://news.yahoo.co.jp/articles/86fc3248f5398714dc61a71dc8768a19717de1d1/images/000', 'https://takamatsu.keizai.biz/photoflash/2789/']"
稲美町にパン工房「りとは」　職人歴14年、念願の独立へ（みんなの経済新聞ネットワーク）,https://news.yahoo.co.jp/articles/35d3b0c6afaee6d3363eedbe5fd7b6de4944b990,https://newsatcl-pctr.c.yimg.jp/t/amd-img/20240412-00000017-minkei-000-1-view.jpg?exp=10800,2024-04-12T11:00:00+09:00,2024-04-12T11:00:00+09:00,みんなの経済新聞ネットワーク,minkei,みんなの経済新聞ネットワーク,736,\n念願の個人店をオープンする西村秀将さんと妻の和花乃さん\n「パン工房りとは」（稲美町国安、TEL 079-455-8620）が4月18日、稲美町の住宅街にオープンする。（加古川経済新聞）\n【写真】パンは毎日20～30種類用意する\n西村秀将さんと妻の和花乃さん夫婦で切り盛りする同店。秀将さんは3月まで加古川市内のパン店に勤め、14年の職人歴がある。「いつかは自分の店を持ちたい」と考え、職場からの後押しもあったことから独立した。約2年、住居兼店舗となる土地を探し、「ほどよく田舎の住宅街で、おしゃれなカフェが多く、盛り上がっている」と感じ、稲美町に決めたという。店名の「りとは」は「小さな幸せ」を意味する「ア・リトル・ハピネス」から和花乃さんが名付けた。「パンで人を幸せにしたい」という思いも込める。\n\n パンは毎日30～40種類を用意。国産小麦100％にこだわり、小麦本来の味を楽しめるという。クリームパンやカレーパンなどの中身も全て手作り。秀将さんは「国産小麦のおいしさは市販のものと比べたら違いが分かる。体に優しいパンを作っていきたい」と話す。クロワッサン（280円）は発酵バターと全粒粉を折り込む。バゲット（280円）は石臼びき小麦を使い、5種類の国産小麦をブレンド。食パン（520～560円）は3種類の味を用意する。\n\n 和花乃さんは「日々のご褒美として、少しでも幸せになってもらえたら」。秀将さんは「添加物はほとんど使っていないので、安心して食べられる。子どもから大人まで幅広い世代に食べてほしい」と話す。\n\n 営業時間は7時～17時。月曜・火曜定休。18日～21日はオープン記念で食パンを2割引で販売する。\nみんなの経済新聞ネットワーク,['https://newsatcl-pctr.c.yimg.jp/t/amd-img/20240412-00000017-minkei-000-1-view.jpg?pri=l&w=525&h=640&exp=10800'],"['https://news.yahoo.co.jp/articles/35d3b0c6afaee6d3363eedbe5fd7b6de4944b990/images/000', 'https://kakogawa.keizai.biz/photoflash/3540/']"
