headline,mainEntityOfPage,image,datePublished,dateModified,author,media_en,media_jp,str_count,body,images,external_links
神戸・水道筋アーケードに「ありがとうタンタン」のバナー　地元からの感謝（みんなの経済新聞ネットワーク）,https://news.yahoo.co.jp/articles/4c326e92ed79097cad6f26cf3c2db64d7ead37a3,https://newsatcl-pctr.c.yimg.jp/t/amd-img/20240412-00000066-minkei-000-4-view.jpg?exp=10800,2024-04-12T22:44:44+09:00,2024-04-13T00:23:54+09:00,みんなの経済新聞ネットワーク,minkei,みんなの経済新聞ネットワーク,513,\nタンタンのバナーと商店街協同組合の永井和浩副理事長\n水道筋商店街に4月11日、神戸市立王子公園（神戸市灘区王子町1）のジャイアントパンダを追憶する「ありがとうタンタン」のバナーが掲揚された。（神戸経済新聞）\n【写真】「ありがとうタンタン」のバナー\nタンタンは阪神・淡路大震災で被災した神戸市が「被災地に明るい話題を」と要望し、2000年に中国・四川省から貸し出された。2020年に返還される予定だったが、コロナ禍や2021年に判明した心臓疾患のために帰国が延期となり、今年3月31日に死んだ。国内最高齢となる28歳で、24年間を神戸で過ごした。\n\n 同商店街協同組合の永井和浩副理事長は「タンタンは地元の誇りだった。これまで商店街を盛り上げてくれたタンタンへの感謝の気持ちを込めてバナーを掲げた」と話す。「バナーを立ち止まって眺めたり、写真を撮ったりする人を見ていると、じんわり思いがこみ上げてくる。寂しさや悲しさはあるが、最後まで神戸で全うしてくれ、地元や飼育員の皆さんに愛された」と、タンタンと商店街の歴史を振り返る。\n\n 神戸市は5月10日にタンタンの追悼式を行う予定。\nみんなの経済新聞ネットワーク,['https://newsatcl-pctr.c.yimg.jp/t/amd-img/20240412-00000066-minkei-000-4-view.jpg?pri=l&w=640&h=480&exp=10800'],"['https://news.yahoo.co.jp/articles/4c326e92ed79097cad6f26cf3c2db64d7ead37a3/images/000', 'https://kobe.keizai.biz/photoflash/9538/']"
東北歴史博物館で「大シルクロード展」　日本初公開含む200点を展示（みんなの経済新聞ネットワーク）,https://news.yahoo.co.jp/articles/66143374057b097f6cdd0e884b315e2e4ac2cb46,https://newsatcl-pctr.c.yimg.jp/t/amd-img/20240412-00000064-minkei-000-1-view.jpg?exp=10800,2024-04-12T22:44:00+09:00,2024-04-12T22:44:00+09:00,みんなの経済新聞ネットワーク,minkei,みんなの経済新聞ネットワーク,872,"\n「駱駝」（洛陽博物館）\n東洋と西洋を結ぶシルクロードの名宝を紹介する「世界遺産 大シルクロード展」が4月9日、東北歴史博物館（多賀城市、TEL 022-368-0106）で始まった。（仙台経済新聞）\n【写真】「菩薩坐像」\n古代から重要な交流や通商ルートであり、多様な民族が興亡を繰り広げる文化融合の地だったシルクロード。同展は、「シルクロード：長安－天山回廊の交易路網」として2014（平成26）年にユネスコの世界遺産に認定されてから、中国国外で初めて行われる大規模な展覧会となる。昨年9月～12月の東京富士美術館（東京都八王子市）を皮切りに、福岡、宮城、愛媛、岡山、京都を巡回する。\n\n 洛陽、西安、蘭州、敦煌、新疆地域など、9省2自治区27カ所の博物館・研究機関が所蔵する文物の中から、金銀器、青銅器、陶磁器、ガラス、染織、壁画、絵画、模写絵、経典、仏像、歴史資料など日本初公開を含む史料約200点を展示する。\n\n 会場は、「民族往来の舞台～胡人（こじん）の活動とオアシスの遺宝」「東西文明の融合～響き合う漢と胡の輝き」「仏教東漸の遥（はる）かな旅～眠りから覚めた経典と祈りの造形」の3章で構成。同展担当学芸員の山田凜太郎さんは「1章では中国北西部を中心に、遺跡から出土した多様な資料を通してシルクロードにおける胡人の関わりやオアシスの暮らしを、2章では洛陽・長安の資料を中心に、中国における胡人の活動や中国の方々との関わりを感じてもらいたい。3章では仏教関連資料を中心に、中国各地における仏教の受容や展開を通して、仏教や仏教美術の素晴らしさを再確認してもらえれば」と話す。\n\n 「これだけの文物が一堂に会する機会は、日本国内はもちろん、中国でも珍しい。シルクロードを行き交った多様な民族や文化を感じてほしい」と呼びかける。\n\n 開催時間は9時30分～17時（発券は16時30分まで）。月曜休館（祝休日の場合は翌日）。入場料は、一般＝1,600円、小中高生＝800円。6月9日まで。\nみんなの経済新聞ネットワーク",['https://newsatcl-pctr.c.yimg.jp/t/amd-img/20240412-00000064-minkei-000-1-view.jpg?pri=l&w=640&h=480&exp=10800'],"['https://news.yahoo.co.jp/articles/66143374057b097f6cdd0e884b315e2e4ac2cb46/images/000', 'https://sendai.keizai.biz/photoflash/7880/']"
日本橋で「さくら祭り」　恒例の「花見こたつ」、新潟の雪で作った滑り台も（みんなの経済新聞ネットワーク）,https://news.yahoo.co.jp/articles/97a1573a24bdc293ad0f96da2f4d678e84d263de,https://newsatcl-pctr.c.yimg.jp/t/amd-img/20240412-00000065-minkei-000-1-view.jpg?exp=10800,2024-04-12T22:26:58+09:00,2024-04-12T22:26:58+09:00,みんなの経済新聞ネットワーク,minkei,みんなの経済新聞ネットワーク,452,\n「花見こたつ」を楽しむ来場者\n日本橋エリアのソメイヨシノが見頃を迎えた4月6日～8日、日本橋八重洲さくら通りで「日八会さくら祭り」が開催された。（日本橋経済新聞）\n【写真】地元有志が共同で出店する屋台も\n日本橋六之部連合町会青年部の「日八会」が主催し、東京駅八重洲北口から茅場町まで169本の桜が並ぶ「さくら通り」を中心に、一部を歩行者天国にして酒や軽食の屋台が軒を連ねた。\n\n 歩行者天国の路上には、「花見こたつ」として赤いもうせんを敷いた縁台と「こたつ」5台を設置。家族連れやカップルなどが相席し、屋台で購入した酒やつまみを片手に花見を楽しんでいた。新潟直送という雪で作った「特設滑り台」では、そり滑りに挑戦する子どもたちでにぎわいを見せた。\n\n 近隣で働いているという女性2人組は「以前から花見こたつは気になっていた。満開のさくらの下で良い席をキープできて運が良かった。雪の滑り台も近いので雪見と花見が同時に楽しめるのも面白い」と笑顔を見せていた。\nみんなの経済新聞ネットワーク,['https://newsatcl-pctr.c.yimg.jp/t/amd-img/20240412-00000065-minkei-000-1-view.jpg?pri=l&w=485&h=640&exp=10800'],"['https://news.yahoo.co.jp/articles/97a1573a24bdc293ad0f96da2f4d678e84d263de/images/000', 'https://nihombashi.keizai.biz/photoflash/2739/']"
多気町VISONで「世界料理学会」　生産者と料理人の座談会も（みんなの経済新聞ネットワーク）,https://news.yahoo.co.jp/articles/3507efe0f0c272ebb2b3ef1146c6d4cb6f5891cd,https://newsatcl-pctr.c.yimg.jp/t/amd-img/20240412-00000067-minkei-000-1-view.jpg?exp=10800,2024-04-12T23:31:23+09:00,2024-04-12T23:31:23+09:00,みんなの経済新聞ネットワーク,minkei,みんなの経済新聞ネットワーク,1148,"\n多気町VISONで第2回「世界料理学会」 生産者と料理人の座談会も（撮影＝岩咲滋雨）「第1回世界料理学会 in VISON」の様子\n「第2回世界料理学会 in VISON」が4月16日、大型商業リゾート施設「VISON（ヴィソン）」（多気町）内の食の美術館「AT CHEF MUSEUM（アット・シェフ・ミュージアム）」で開催される。（伊勢志摩経済新聞）\n【写真】【その他の画像】「第1回世界料理学会 in VISON」の様子\n世界料理学会は、スペイン・バスク地方の小都市サンセバスチャンでの取り組みを手本に、北海道函館市内でスペイン料理店「レストランバスク」を営む深谷宏治シェフを中心に、料理人たちが料理の背景にある風土や素材について語り、調理の技についてプレゼンテーションを行い、「日本の食文化の発展と料理人・レストランのクリエイティビティーの向上、食に関わる全産業の繁栄を目指す」ことを目的に2009（平成21）年から開かれている活動。\n\n 第1回大会では深谷シェフ監修の下、ヴィソンが中心となって伊勢志摩地域を食で元気に盛り上げようと活動するシェフ集団「エバーグリーン」らと共に開催した。\n\n 当日は、料亭「日本料理銭屋」（石川県金沢市）の髙木慎一朗さん、「作」「鈴鹿川」などの日本酒を醸造する「清水清三郎商店」（鈴鹿市）の清水慎一郎さん、フレンチレストラン「Le Musee」（札幌市中央区）の石井誠さん、海鮮料理店「食堂あお」（熊野市）の榎本和希さん、フレンチレストラン「Restaurant MOTOI」（京都市中京区）の前田元さんら登壇する。\n\n 「四つ葉ファーム」（兵庫県加東市）の今川優子さん、三重県内の「ミカタアグリ」（亀山市）の三方美智代さん、「瑞雲ファーム」（伊賀市）の中井奈緒美さん、「iBroom」（明和町）の濱口仁志さんの生産者3人と、農林水産省料理マスターズで「ミチノ・ル・トゥールビヨン」（大阪市福島区）の道野正さんと「Recette（ルセット）」（神戸市中央区）の依田英敏さんとの座談会も開く予定。\n\n 実行委員長の「ボンヴィヴァン」（伊勢市）河瀬毅さんは「一流の料理人たちが、食の世界情勢や自身の料理感、技術論、これからの飲食業界についてなど食について語り合う。情熱ある生産者と関西のシェフたちとの対談。見どころ、楽しみどころもいっぱいでワクワクする出会いと体験が待っている。当日でもチケット購入は大丈夫なので、ぜひお越しいただければ」と呼びかける。\n\n 開催時間は10時30分～17時（受け付けは9時30分～）。料金は、着席＝5,000円（定員320人）、立ち見＝3,000円（同100人）。\nみんなの経済新聞ネットワーク",['https://newsatcl-pctr.c.yimg.jp/t/amd-img/20240412-00000067-minkei-000-1-view.jpg?pri=l&w=640&h=480&exp=10800'],"['https://news.yahoo.co.jp/articles/3507efe0f0c272ebb2b3ef1146c6d4cb6f5891cd/images/000', 'https://iseshima.keizai.biz/photoflash/14963/']"
有田川町で「ふじなみ駅マルシェ」　第2回は「ピクニック」テーマに（みんなの経済新聞ネットワーク）,https://news.yahoo.co.jp/articles/56be8aebaea8a0a7bcf1f4cfe5ca04c568818ec3,https://newsatcl-pctr.c.yimg.jp/t/amd-img/20240412-00000068-minkei-000-1-view.jpg?exp=10800,2024-04-12T23:55:00+09:00,2024-04-12T23:55:00+09:00,みんなの経済新聞ネットワーク,minkei,みんなの経済新聞ネットワーク,784,\n第1回ふじなみ駅マルシェの様子（2023年12月撮影）\nマーケットイベント「ふじなみ駅マルシェ」が4月27日、藤並駅東口広場で開催される。主催は有田川町観光案内所。（和歌山経済新聞）\n【写真】「THE BASE CAMP ARIDAGAWA」にリニューアルした有田川町観光案内所\n同町では昨年10月、観光案内所の管理運営事業を民間業者に委託したことに伴い、施設名を「THE BASE CAMP ARIDAGAWA（ザベースキャンプアリダガワ）」に変更。昨年12月に「ミカン」をテーマにした名称変更記念イベントとして「ふじなみ駅マルシェ」を初開催した。第2回のテーマは「ピクニック」。当日は地元内外から飲食店や雑貨店などが軒を連ねる。\n\n 出店は、弁当店「cocorokitchen（ココロキッチン）」（有田川町明王寺）、フレンチレストラン「ナチュラルガーデン」（水尻）、ビール醸造所「NOMCRAFT（ノムクラフト）」（長田）、しょうゆ蔵元「カネイワ醤油（しょうゆ）」（小川）、シフォンケーキ店「chiffon LABO（シフォンラボ）」、フルーツあめ店「YUMMY YUMMY（ヤミーヤミー）」（田辺市湊）など。\n\n 会場ではこのほか、犬猫譲渡会、ペットの健康診断、ペットフード販売、木工ワークショップ、ゲームコーナー、焼き菓子やパンの販売イベント（13時～）を行う。\n\n 同施設スタッフの上野山瑞波さんは「第1回は想定の3倍の1500人近い人が来てくれた。第2回も地元店や近隣の店が出店するので、地域の魅力を再発見するきっかけになれば。飲食店はテイクアウトに対応する。鉄道線路の跡『ポッポみち』でピクニックを楽しんでもらえたら。子どももペットも一緒に楽しんでほしい」と話す。\n\n 開催時間は10時～15時。\nみんなの経済新聞ネットワーク,['https://newsatcl-pctr.c.yimg.jp/t/amd-img/20240412-00000068-minkei-000-1-view.jpg?pri=l&w=640&h=480&exp=10800'],"['https://news.yahoo.co.jp/articles/56be8aebaea8a0a7bcf1f4cfe5ca04c568818ec3/images/000', 'https://wakayama.keizai.biz/photoflash/5902/']"
水戸ホーリーホック、ホーム戦に向け那珂市長を表敬訪問　サイン会も（みんなの経済新聞ネットワーク）,https://news.yahoo.co.jp/articles/67b5fcc530d1f4893360697aae8660d16d8926b2,https://newsatcl-pctr.c.yimg.jp/t/amd-img/20240412-00000062-minkei-000-1-view.jpg?exp=10800,2024-04-12T21:30:00+09:00,2024-04-12T21:30:00+09:00,みんなの経済新聞ネットワーク,minkei,みんなの経済新聞ネットワーク,912,\n満開の桜が選手を出迎えた\nサッカーJ2「水戸ホーリーホック」が4月11日、静峰ふるさと公園（那珂市）で先崎光（崎はたつさき）那珂市長を表敬訪問し、今月13日に行われるホームゲームと市町村イベント「那珂市の日」をPRした。（水戸経済新聞）\n【写真】特製バーガーを持つ牛澤選手（左）と前田選手\n同園を訪れたのは、同チームの小島耕社長と那珂市のホームタウンPR大使を務める牛澤健選手、前田椋介選手の3人。桜が満開となった同園では、先崎市長と玉川明副市長、市職員、同市のキャラクター「ナカマロちゃん」が選手らを出迎えた。同市から選手へ「ナカマロちゃんトートバッグ」とぬいぐるみが贈られると、前田選手は「会場入りするときに持っていきます」と笑顔に。先崎市長は「公園の桜が満開になるタイミングで皆さんを迎えることができて良かった。次のホーム試合をきっかけにチームが上昇気流に乗ってほしい」と激励の言葉をかけた。\n\n 牛澤選手と前田選手は13日の市町村イベント「那珂市の日」の開催に合わせて、那珂市のとんかつ店「あげや」（後台）とコラボバーガーを開発。販売を前に、市長らとともに出来たての商品を試食した。牛澤選手が手がけたのは、地元・名古屋の名物、どて煮をイメージした「うしざわどて煮de常々勝（とことんかつ）バーガー」。前田選手は出身地・宮崎の定番グルメ、チキン南蛮にかけて「宮崎南蛮風de常々勝バーガー」を発表した。2商品は13日のみ、試合会場で販売する。\n\n 表敬訪問後には「なかLuckyFM公園」（那珂総合公園）へ移動しサイン会を実施。来場者には、先着で特製ステッカーも配った。同チームのサポーターで横浜市在住の松下雪菜さんは「全試合、横浜から応援に行っている。ホーム戦では勝利を収めて北関東ダービーで優勝してほしい」とエールを送った。試合に向けて、牛澤選手は「守備を0点に抑えながら、自分も点に関わるプレーがしたい」と意気込む。\n\n 試合は4月13日、ケーズデンキスタジアム水戸（水戸市小吹町）で14時キックオフ。那珂市在住・在学・在勤者は優待価格でチケットが購入できる。\nみんなの経済新聞ネットワーク,['https://newsatcl-pctr.c.yimg.jp/t/amd-img/20240412-00000062-minkei-000-1-view.jpg?pri=l&w=640&h=426&exp=10800'],"['https://news.yahoo.co.jp/articles/67b5fcc530d1f4893360697aae8660d16d8926b2/images/000', 'https://mito.keizai.biz/photoflash/2570/']"
彦根・滋賀県護国神社境内の休憩所を改装したカフェが20周年（みんなの経済新聞ネットワーク）,https://news.yahoo.co.jp/articles/a456b59efa07792d133199a4694753531ee06f65,https://newsatcl-pctr.c.yimg.jp/t/amd-img/20240412-00000061-minkei-000-1-view.jpg?exp=10800,2024-04-12T21:33:56+09:00,2024-04-12T21:33:56+09:00,みんなの経済新聞ネットワーク,minkei,みんなの経済新聞ネットワーク,892,"\n「ほっこりカフェ朴（もく）」外観。滋賀県護国神社の境内にある\n滋賀県護国神社（彦根市尾末町）の境内にある「ほっこりカフェ朴（もく）」が4月2日、20周年を迎えた。（彦根経済新聞）\n【写真】ご飯セット。季節などによってメインメニューや副菜の内容が変わる＝「ほっこりカフェ朴（もく）」\n同神社の休憩所として使われていた建物を改装した同カフェ。店主の中村愛子さん夫婦が市内の大学生たちとDIYで改装し、少しずつ手を加えてきたという。店内は、レトロな雑貨や漫画、書籍を並べるほか、まきストーブを設置。木の風合いが懐かしく落ち着いた雰囲気に仕上げた。小上がりは靴を脱いで座れる座敷で、土間にはテーブル席を用意する。\n\n 中村さんは、子どもの成長に合わせ運営スタイルを変えながら、現在一人で切り盛りしている。注文から、調理、配膳、片付けまでを一人で対応しているため、水はセルフサービスで、注文は厨房にいる中村さんに声をかけるシステムにしている。\n\n 中村さんは「自分のペースで続けられるのは、周りの方の理解のおかげ」と話す。「20年、子育てをしながらも何とか続けてこられた、というのが正直な気持ち。周りの方に支えられて、店とともに、子どもも成長してきた」と振り返る。印象的な思い出話の一つに、「当時、カップルで店に来てくれていた高校生が大学卒業後、結婚して子どもを連れて来てくれたことがあって本当にうれしかった」と話す。\n\n メニューは、雑穀米とサラダ、副菜、メイン、ミニデザートが付いた「ご飯セット」（1,300円）、オムキーマカレー（980円）、ライ麦パンのピザトースト（700円）などのフードのほか、抹茶小豆ロールケーキ、ベリーチョコロールケーキ（以上480円）などのデザート、コーヒーやチャイ、ジュースなどのドリンクを用意する。\n\n 中村さんは「これからも、一人でも気兼ねなく入れて、ホッとできる空間を提供していきたい」と話す。「おばあちゃんになっても、マイペースに続けていれば」とも。\n\n 営業は火曜～金曜の12時～15時。\nみんなの経済新聞ネットワーク",['https://newsatcl-pctr.c.yimg.jp/t/amd-img/20240412-00000061-minkei-000-1-view.jpg?pri=l&w=640&h=426&exp=10800'],"['https://news.yahoo.co.jp/articles/a456b59efa07792d133199a4694753531ee06f65/images/000', 'https://hikone.keizai.biz/photoflash/581/']"
御坂農園で「笛吹市100人カイギ」　残り10回、累計300人超参加（みんなの経済新聞ネットワーク）,https://news.yahoo.co.jp/articles/549e7cf35a9acb8bc718315335d8e2095d33b142,https://newsatcl-pctr.c.yimg.jp/t/amd-img/20240412-00000060-minkei-000-2-view.jpg?exp=10800,2024-04-12T20:44:50+09:00,2024-04-12T21:11:37+09:00,みんなの経済新聞ネットワーク,minkei,みんなの経済新聞ネットワーク,1068,"\n3月20日に開催された「笛吹市100人会議 Vol.10」の参加者集合写真（写真提供＝笛吹市100人会議）\n「笛吹市100人会議 Vol.11」が4月17日、御坂農園グレープハウス（笛吹市御坂町夏目原）で開催される。（甲府経済新聞）\n【写真】「笛吹市100人カイギ」キュレーター\n100人カイギは、人と人とをつなぎ、「地域に熱い思いを持って活動する」ゲストの話を聞き、地域の魅力を再発見したり、新たな価値観を得たりすることを目的とするイベント。2018（平成30）年に始まったこの活動はコミュニティープラットホームとして全国へ広がり、2024年4月時点で全国102地域、開催数1346回、延べ登壇人数4万8536人。「ゲストが100人になったら会を解散する」のが唯一のルール。\n\n 笛吹市100人カイギは昨年6月に始まり、毎月第3水曜に5人のゲストが登壇。全20回の開催で今回を含め残り10回となる。これまでに登壇したゲストは18歳～85歳の50人で、累計参加者は305人。参加チケットは毎回、販売開始からほぼ1日で完売してしまうという。\n\n 始まりのきっかけは、キュレーターの榊原由さんの知人が他地域のキュレーターをしている様子をSNSで投稿していたのを見かけ、「登壇する人たちが輝いて見え、衝撃を受けた」と振り返る。山梨県内ではどこも開催していなかったのと、自身が諏訪湖100人会議で登壇した際に「周囲が温かった」こともあり、山梨での開催を決めたという。\n\n 今回は過去最高となる53人が参加予定で、会場には初の試みとしてキッチンカー2台が登場する。ゲストスピーカーに、のなか鍼灸（しんきゅう）院院長の野中慎祐さん、田丸社長の藤巻一史さん、NPO法人「まちづくり法人山梨タンク」代表理事の河西和奈さん、バーズフィルムプロデューサーの小池和洋さん、granmagic田中写真館社長の田中秀和さんを迎える。\n\n 榊原さんは「第1回目の昨年6月21日の朝は、登壇者、参加者たちは来てくれるかと心配が過り、昇る朝日に祈ったりした。開場すると会場は満席になり、話が終わると大きな拍手が鳴り響き、『すてきな時間をありがとう』『次回もまた参加したい』などの声が聞けてうれしかった。参加条件は笛吹市内、市外問わずに緩くつながりたい人。笛吹市100人カイギを通じて新たなる縁と出会ってほしい」と話す。\n\n 開催時間は19時～21時。参加費は1,000円。申し込みはウェブで受け付けている。\nみんなの経済新聞ネットワーク",['https://newsatcl-pctr.c.yimg.jp/t/amd-img/20240412-00000060-minkei-000-2-view.jpg?pri=l&w=640&h=480&exp=10800'],"['https://news.yahoo.co.jp/articles/549e7cf35a9acb8bc718315335d8e2095d33b142/images/000', 'https://kofu.keizai.biz/photoflash/389/']"
