headline,mainEntityOfPage,image,datePublished,dateModified,author,media_en,media_jp,str_count,body,images,external_links
高松で「HUG」作品展　障害者アーティスト8人の作品40点展示（みんなの経済新聞ネットワーク）,https://news.yahoo.co.jp/articles/a8bfc00bacbbce348b85254b8069154c1a0aaee9,https://newsatcl-pctr.c.yimg.jp/t/amd-img/20240412-00000049-minkei-000-1-view.jpg?exp=10800,2024-04-12T18:02:04+09:00,2024-04-12T18:02:04+09:00,みんなの経済新聞ネットワーク,minkei,みんなの経済新聞ネットワーク,515,\n過去の展示の様子（写真提供＝HUG）\n障害者の芸術活動支援団体「HUG（ハグ）」による作品展が4月17日から、「HIME塩絵倶楽部（くらぶ）」（高松市香西本町）で開催される。（高松経済新聞）\n【写真】（左から）HUG代表の牧みずほさん、香西弘さん、香西さんの妻・めぐみさん\nそれぞれ精神や身体に障がいのある芸術家8人が所属する同団体。期間中、同団体所属の8人が制作を手がけた作品40点を展示する。展示の中心となるのは、高松市在住の香西弘さん。香西さんは2014（平成26）年、色彩療法でリハビリ中、塩を配合した絵の具を使った「塩絵」に出合い、創作活動をスタートした。\n\n 同団体代表の牧みずほさんは「自分には自閉症の息子がいる。成人したが、幼い頃は経済的に自立できないのではと不安を持っていた。障害者の将来の経済的不安を軽減させ、社会とつながる仕組みをつくりたいと考え、当団体を設立した。今回の作品展を通じて、障害者が描く世界観を多くの人に共有していただき、安心して障害児・者を育てられる環境作りの第一歩にしたい」と話す。\n\n 開館時間は11時～16時。入場無料。4月21日まで。\nみんなの経済新聞ネットワーク,['https://newsatcl-pctr.c.yimg.jp/t/amd-img/20240412-00000049-minkei-000-1-view.jpg?pri=l&w=640&h=480&exp=10800'],"['https://news.yahoo.co.jp/articles/a8bfc00bacbbce348b85254b8069154c1a0aaee9/images/000', 'https://takamatsu.keizai.biz/photoflash/2791/']"
めぐろパーシモンホールでバレエ「えんとつ町のプペル」　再演で（みんなの経済新聞ネットワーク）,https://news.yahoo.co.jp/articles/8a18abc9394de3211a20e1e957e05be67a9e7473,https://newsatcl-pctr.c.yimg.jp/t/amd-img/20240412-00000048-minkei-000-1-view.jpg?exp=10800,2024-04-12T18:10:00+09:00,2024-04-12T18:10:00+09:00,みんなの経済新聞ネットワーク,minkei,みんなの経済新聞ネットワーク,658,"\nバレエ「えんとつ町のプペル」初演時のシーン（写真右から）風間自然さん、竹田仁美さん\nバレエ公演「えんとつ町のプペル 2024」が9月19日、めぐろパーシモンホール（目黒区八雲1）大ホールで上演される。（自由が丘経済新聞）\n【写真】バレエ「えんとつ町のプペル」では、子どもたちによるコミカルなダンスシーンも\n発行部数約74万部を売り上げたマルチタレント・西野亮廣さん原作の絵本「えんとつ町のプペル」の世界観を、バレエ作品として表現した同公演。昨年、新宿文化センターでの初演に続く再演となる。\n\n 絵本では、黒い煙に覆われた煙突だらけのえんとつ町で暮らす少年・ルビッチと、ごみから生まれたごみ人間・プペルの交流が、緻密で立体感のあるイラストで描かれている。公演では、絵本の世界から飛び出したようなカラフルなえんとつ町を表現した舞台セットが作られ、えんとつ町の住人たちを表現した芸術的な衣装も見どころとなっている。脚本は原作の西野さんが手がけている。オーケストラの演奏は録音音源を使う。\n\n 主演のプペル役＆ブルーノ役を風間自然さん、ルビッチ役を元NBAバレエ団プリンシパルの竹田仁美さん、スコップ役を元新国立劇場バレエ団プリンシパルの八幡顕光さん、レベッカ役を元K-BALLET COMPANYプリンシパルの白石あゆ美さんが務める。\n\n 開演時間は14時、19時。料金（前売り）はS席＝1万3,200円、A席＝1万1,550円、B席＝5,500円。3歳未満入場不可。\nみんなの経済新聞ネットワーク",['https://newsatcl-pctr.c.yimg.jp/t/amd-img/20240412-00000048-minkei-000-1-view.jpg?pri=l&w=640&h=480&exp=10800'],"['https://news.yahoo.co.jp/articles/8a18abc9394de3211a20e1e957e05be67a9e7473/images/000', 'https://jiyugaoka.keizai.biz/photoflash/2335/']"
山口で地元企業との「コラボグッズ」誕生　ロゴやキャラクターを商品化（みんなの経済新聞ネットワーク）,https://news.yahoo.co.jp/articles/68193d7051021ed7fa7ad0a63a1c5becc315c65a,https://newsatcl-pctr.c.yimg.jp/t/amd-img/20240412-00000046-minkei-000-1-view.jpg?exp=10800,2024-04-12T17:51:03+09:00,2024-04-12T17:51:03+09:00,みんなの経済新聞ネットワーク,minkei,みんなの経済新聞ネットワーク,1081,"\nクロスランド山口総本店に並ぶコラボグッズ「ジモッチャ」\n山口県内企業のロゴマークやキャラクターをあしらった「コラボグッズ」が現在、販売されている。（山口宇部経済新聞）\n【写真】山口県内の企業とコラボしたグッズ\n同商品を手がけるのは、昨年12月に創業した「やまぐち愛着プロダクト」（山口市吉敷中東）。雑貨と文具のセレクトショップ「クロスランド」を展開する「十字屋」（同）が出資し、山口県民になじみのあるロゴマークやキャラクターなどの商標を使用したグッズの企画・制作・販売を行う。\n\n 小笠原靖社長は「以前から、県内の企業や地元に愛着を持ってもらおうと企業とのコラボグッズは作っていた。地元だから共感できる、誰かに紹介したくなる可愛く楽しいアイテムで、皆さんと一緒に山口県を盛り上げていけたら」と話す。\n\n コラボグッズは、「Jimoccha（ジモッチャ）」の名称でシリーズ展開する。現在は、「やまぐち県酪乳業」（下関市）、「中華そば 一久」（宇部市）、「井上商店」（萩市）、「元祖瓦そば たかせ」（下関市）の4社が参画し、クロスランドが監修の下で参画企業と共同で商品を製作。昨年12月から先行販売が始まった。価格帯は440円～2,750円。\n\n 同社では、商標使用料を「高度産業人材確保事業」（理系大学院または薬学部を卒業後、県内製造業または県内情報サービス業に就業した場合に、借りていた奨学金の返還を補助する制度）に寄付することで、山口県の経済活性化や地方創生を支援する。今後もコラボ企業の拡大を目指し、新たな商品開発を行っていくという。\n\n 小笠原社長は「私自身も慣れ親しみ、愛しているものだからこそ、心を動かす物を作ることができると思っている。地元でのなじみ深さがあるので、キャラクターやロゴを見ただけですぐに商品や山口のことが思い浮かぶはず。県外に出た人にも懐かしんでもらい、一つのグッズから話が膨らむコミュニケーションツールとしても使ってもらえれば」と話す。\n\n 「まだ商品を味わったことがない人や観光客が『これって山口のあれだよね？』とグッズを手に取り、本物を味わってみたいと感じてほしい。県外の人への手土産や、初めて山口に来た人が思い出を持って帰ってもらえるものにもなれば」とも。\n\n 先行販売は、県内高速道路の主要SA（サービスエリア）や「CrossLand山口総本店」、「山口宇部空港 やなぎだ宇部空港直売店」などのほか、ECサイトでも行っている。初夏には一般販売を開始する予定。\nみんなの経済新聞ネットワーク",['https://newsatcl-pctr.c.yimg.jp/t/amd-img/20240412-00000046-minkei-000-1-view.jpg?pri=l&w=640&h=480&exp=10800'],"['https://news.yahoo.co.jp/articles/68193d7051021ed7fa7ad0a63a1c5becc315c65a/images/000', 'https://yamaguchi.keizai.biz/photoflash/6572/']"
別府の南立石公園で緑色のサクラ「ギョイコウ」見頃　春風にゆらり（みんなの経済新聞ネットワーク）,https://news.yahoo.co.jp/articles/dcaf44241e4e0a32d60db4a848e28b8af86614f8,https://newsatcl-pctr.c.yimg.jp/t/amd-img/20240412-00000050-minkei-000-2-view.jpg?exp=10800,2024-04-12T18:06:33+09:00,2024-04-12T21:32:10+09:00,みんなの経済新聞ネットワーク,minkei,みんなの経済新聞ネットワーク,396,\n緑色の花を咲かせるギョイコウ\n別府の南立石公園（別府市南立石）で現在、淡い緑色の花が特徴のサクラ「ギョイコウ（御衣黄）」が見頃を迎えている。（大分経済新聞）\n【写真】青空をバックに緑色の花を揺らす\n八重咲きのサトザクラ。貴族が着る萌黄（もえぎ）色の衣に見立てて名付けられた。開花後、花は緑から黄色に変わり、数日後にはピンク色の筋が入る。園内の「みどりの相談所」によると、同園には2本が植えられているほか、淡黄色の花を咲かせるサクラ「ウコン」もある。\n\n 例年は4月中旬からが見頃というが、同相談所によると開花は年々早まっており、中心部の1本はすでに桃色化が始まっている。\n\n 一方の北側の1本はまさに見頃。青空の下、春風に緑色の花姿を揺らし、市民らの目を楽しませている。同相談所では「今週末まで楽しめる。ピンク色に変わる様も楽しんで」と話す。\nみんなの経済新聞ネットワーク,['https://newsatcl-pctr.c.yimg.jp/t/amd-img/20240412-00000050-minkei-000-2-view.jpg?pri=l&w=640&h=426&exp=10800'],"['https://news.yahoo.co.jp/articles/dcaf44241e4e0a32d60db4a848e28b8af86614f8/images/000', 'https://oita.keizai.biz/photoflash/3334/']"
イオンレイクタウンに本と遊びが融合したキッズパーク　絵本や図鑑とコラボも（みんなの経済新聞ネットワーク）,https://news.yahoo.co.jp/articles/925dafdd92c219e0da1a0389e1d8a68edcd9b57a,https://newsatcl-pctr.c.yimg.jp/t/amd-img/20240412-00000047-minkei-000-2-view.jpg?exp=10800,2024-04-12T18:00:48+09:00,2024-04-12T18:01:28+09:00,みんなの経済新聞ネットワーク,minkei,みんなの経済新聞ネットワーク,922,\n「小学館の図鑑NEO」とコラボした「ZABOOM JOURNEY」\nキッズパーク「リトルプラネット」の新業態が4月9日、イオンレイクタウンKaze（越谷市レイクタウン4）2階の「明文堂書店TSUTAYAレイクタウン」にオープンした。（春日部経済新聞）\n【写真】恐竜のシッポをよけてジャンプする「DINO JUMPING」\nオープンした「Muchu Planet TSUTAYAレイクタウン」（ムチュウプラネットツタヤレイクタウン）は、デジタル技術を活用し、非認知能力を育むことを目指したアトラクションを提供するキッズパーク「リトルプラネット」の新業態。本と遊びを融合した常設のキッズパーク1号店となる。運営は明文堂プランナー（富山県）。企画・制作は「リトプラ」と「トーハン」（東京都）。\n\n 店舗面積は約91坪。アトラクションは10種で時期により変わる。プロジェクションマッピングを使う「SAND PARTY！／AR砂遊び」、ティラノサウルスが振り回す尻尾をよけて遊ぶ「DINO JUMPING／ふしぎな大縄跳び」などに加え、「小学館の図鑑NEO」とコラボした演出が9月1日まで楽しめる「ZABOOM JOURNEY／冒険型デジタルボールプール」、色を塗った動物のクラフトシートをスキャンしてスクリーン上で乗り物とカーレースを繰り広げる「SKETCH RACING／お絵かき3Dレーシング」などもある。チケットは公式サイトやアプリ、店頭で販売する。\n\n トーハン広報担当者の實川友美さんは「多くの皆さまに体験してもらいたいことから、イオンレイクタウンのリニューアルに合わせオープンした。絵本や図鑑、児童書などの書籍コンテンツとコラボレーションしたアトラクションやイベントを通して、子どもたちの想像力や好奇心をはぐくむ体験を提供する。書店とパークの両方を楽しんでもらえれば」と話す。\n\n 30分当たりの料金は、平日＝30分＝500円～700円（大人は700円）、土曜・日曜・祝日＝720円～960円（同960円）。0～1歳は無料。一日フリーパスも用意する。\n\n 営業時間は10時～21時。\nみんなの経済新聞ネットワーク,['https://newsatcl-pctr.c.yimg.jp/t/amd-img/20240412-00000047-minkei-000-2-view.jpg?pri=l&w=640&h=448&exp=10800'],"['https://news.yahoo.co.jp/articles/925dafdd92c219e0da1a0389e1d8a68edcd9b57a/images/000', 'https://kasukabe.keizai.biz/photoflash/2576/']"
大阪・日本橋にハイアットの新ブランドホテル　国内1館目、6月開業（みんなの経済新聞ネットワーク）,https://news.yahoo.co.jp/articles/16c07f9bc190d5706cf3d4ea8983c0e0457ffe77,https://newsatcl-pctr.c.yimg.jp/t/amd-img/20240412-00000045-minkei-000-1-view.jpg?exp=10800,2024-04-12T17:50:09+09:00,2024-04-12T17:50:09+09:00,みんなの経済新聞ネットワーク,minkei,みんなの経済新聞ネットワーク,584,\n大阪・日本橋にハイアットの新ブランドホテル 国内1館目、6月開業\nハイアットの新ブランドホテル「キャプション by Hyatt なんば 大阪」（大阪市中央区日本橋2）が2024年、国内1館目として日本橋に開業する。サンケイビル（東京都千代田区）がハイアットの関連会社とフランチャイズ契約を結び、開発・運営する。（なんば経済新聞）\n【写真】「キャプション by Hyatt なんば 大阪」外観\n「キャプション by Hyatt」は、ハイアットが2019年に発表した新ブランド。包括的なサービスを提供するフルサービスと客室に特化したリミテッドサービスの中間に当たる「セレクトサービス」ホテルとして展開する。\n\n 「トークショップ」と呼ぶ宿泊客や地元客が使えるロビーの代わりのコミュニティースペースが目玉。大阪のソウルフードやドリンクを提供し、アーティストによるライブパフォーマンスなども開催するという。コインランドリーや24時間営業のフィットネスルームも用意する。\n\n 167室の客室にはスタンダード（20平方メートル）と、デラックス（30平方メートル）を用意。大阪の街並みを表現した壁面アートや、日本刀のつかを模した飾り、巻物のような読書灯などで日本らしさを演出するという。\n\n 1人1泊当たりの宿泊料金は2万円～。\nみんなの経済新聞ネットワーク,['https://newsatcl-pctr.c.yimg.jp/t/amd-img/20240412-00000045-minkei-000-1-view.jpg?pri=l&w=547&h=640&exp=10800'],"['https://news.yahoo.co.jp/articles/16c07f9bc190d5706cf3d4ea8983c0e0457ffe77/images/000', 'https://namba.keizai.biz/photoflash/11189/']"
アミュプラザ長崎にマカロンなど扱う「ラデュレ」限定店　長崎初出店（みんなの経済新聞ネットワーク）,https://news.yahoo.co.jp/articles/82cfb5b004344a5618cb8c34060d2edaedddb026,https://newsatcl-pctr.c.yimg.jp/t/amd-img/20240412-00000044-minkei-000-3-view.jpg?exp=10800,2024-04-12T17:49:19+09:00,2024-04-12T17:56:25+09:00,みんなの経済新聞ネットワーク,minkei,みんなの経済新聞ネットワーク,784,\n馬車をイメージしたショーケースが目を引く「ラデュレ」限定店\nフランスの老舗パティスリーメゾン「ラデュレ」のポップアップストアが4月12日、アミュプラザ長崎新館にオープンした。（長崎経済新聞）\n【写真】色鮮やかなマカロンが並ぶショーケース\n1862年にブーランジェリーとしてオープンした同店。火災がきっかけでパティスリーとして生まれ変わった同店は「マカロン・パリジャン」発祥の店としても知られる。カフェとパティスリーを融合させたパリの「サロン・ド・テ」の歴史を築き、150年以上に渡って親しまれてきた。\n\n 日本には2008（平成20）年、東京・銀座にオープンして以来、関東や関西を中心に13店舗を展開。九州では昨年秋に初のポップアップストアを出店し、福岡や大分、鹿児島などに出店してきたが、長崎での出店は初となる。\n\n ホップアップストアでは馬車をモチーフにしたショーケースに「ヴァニーユ」「フランボワーズ」「シトロン」「ショコラ」など8種類のマカロン（395円）や、昨年秋に発売したサブレにソースを挟みチョコレートでコーティングした「ローズ」「ピスタッシュ」など6種類の「ウジェニー」（476円）をラインアップ。1個から販売するほか、好きな味の組み合わせで詰め合わせることができるギフトボックスも用意。紅茶や焼き菓子、メレンゲ菓子などのほか、マグカップやトートバッグ、レターブックなどの雑貨も並べる。\n\n ラデュレジャポン（東京都渋谷区）の眞岡里来さんによると「常設店とほぼ同じラインアップで長崎に初出店することができた。フランスの多くの店舗や日本の羽田空港店などで採用している馬車のショーケースと共にラデュレの世界観を楽しんでもらえれば」と来店を呼びかける。\n\n 営業時間は10時～20時。6月30日まで。\nみんなの経済新聞ネットワーク,['https://newsatcl-pctr.c.yimg.jp/t/amd-img/20240412-00000044-minkei-000-3-view.jpg?pri=l&w=640&h=480&exp=10800'],"['https://news.yahoo.co.jp/articles/82cfb5b004344a5618cb8c34060d2edaedddb026/images/000', 'https://nagasaki.keizai.biz/photoflash/3864/']"
小坪小150周年に向け準備着々　キャンドルナイトや記念誌・記念切手も（みんなの経済新聞ネットワーク）,https://news.yahoo.co.jp/articles/0356be7eb4a5346a363af90410e160a6db0c68dd,https://newsatcl-pctr.c.yimg.jp/t/amd-img/20240412-00000057-minkei-000-2-view.jpg?exp=10800,2024-04-12T17:48:17+09:00,2024-04-12T20:18:09+09:00,みんなの経済新聞ネットワーク,minkei,みんなの経済新聞ネットワーク,1193,"\n小坪小学校創立150周年記念事業実行委員会のメンバー。カウントダウンボードの前で\n逗子市立小坪小学校（逗子市小坪3）が5月25日で創立150周年を迎えるに当たり、PTAを中心に組織された実行委員会が現在、記念事業の準備を進めている。（逗子葉山経済新聞）\n【写真】記念切手シート\n同会はPTA会長だった赤松淳太さんが実行委員長を担い、21人のメンバーが月1度の会議を重ねてきた。\n\n 記念日の100日前に当たる2月1日にカウントダウンボードを校内の昇降口に置き、児童がチューリップ型のカードにメッセージを書いてを貼っている。児童が考えたイラストで作成したLINEスタンプ「小坪小150周年お祝スタンプ」の販売も始め、校舎には垂れ幕も掲出している。\n\n 記念のロゴは児童が描いた海の生き物の絵も取り入れて、イラストレーターでもある実行委員メンバーが仕上げステッカーにしたほか、記念Tシャツ（2,500円）にもプリントする。\n\n 記念切手は63円（大正期の校舎）と84円（令和の校舎）が1枚ずつのシート（500円）で、表面には校歌も印刷する。\n\n 創立記念日の5月25日には校庭で、キャンドルを入れた竹筒を約1000本使い、「小坪小・150」の文字と校章を作る。キッチンカーも来校。当日は在校生や卒業生をはじめ、近隣住民などへも参加を呼びかける。記念Tシャツや記念切手も販売。\n\n 赤松さんは「横浜から移り住んで10年。高校2年の長女も中学2年の長男もすっかり小坪っ子。2022年度、コロナ禍で明るい話題がない中、小学校を盛り上げてほしいと言われ、PTA会長を引き受け、創立150周年を迎えることを知り、委員会を立ち上げた。親も子も楽しく、先生が笑顔で活動でき、親同士も友達が増えるなどをモットーにやってきた。わが子は卒業してしまったが、親父である私は小坪小学校を卒業できないまま、今年150周年をみんなで盛り上げられたら」と力を込める。\n\n 本年度PTA会長を引き受けた角田梨沙さんは夫、義父も同校卒業生。義祖父・角田孝治さんは卒業生でもあり、教師としても勤めていた。「夫たちから話は聞いていたので、会長を引き受ける前から150周年には何かできないかと考えていた。思い出に残るイベントになれば」と話す。\n\n 本年度内には、校歌に手話をつけ、学校名の看板の修繕、記念誌の発行、校庭で気球に乗って上空から校舎を眺めるイベントなども行う計画。\n\n 同校は1874（明治7）年4月、鷺浦学舎（第一大学区第十中学区第百四番小学）として香蔵寺本堂（小坪5、現・小坪寺）を仮校舎として創立し、翌年、小坪学校に、1889（明治22）年、田越村立尋常小坪小学校に改称。1898（明治31）年、現在地に新校舎が完成し、同寺から移転した。\nみんなの経済新聞ネットワーク",['https://newsatcl-pctr.c.yimg.jp/t/amd-img/20240412-00000057-minkei-000-2-view.jpg?pri=l&w=640&h=480&exp=10800'],"['https://news.yahoo.co.jp/articles/0356be7eb4a5346a363af90410e160a6db0c68dd/images/000', 'https://zushi-hayama.keizai.biz/photoflash/2128/']"
