headline,mainEntityOfPage,image,datePublished,dateModified,author,media_en,media_jp,str_count,body,images,external_links
帝国ホテル東京で「お茶」アフタヌーンティー　一保堂茶舖の緑茶を使用（みんなの経済新聞ネットワーク）,https://news.yahoo.co.jp/articles/efbbb02ee8ffa7fddcea465873b667f4bde6b1cd,https://newsatcl-pctr.c.yimg.jp/t/amd-img/20240412-00000035-minkei-000-1-view.jpg?exp=10800,2024-04-12T15:14:32+09:00,2024-04-12T15:14:32+09:00,みんなの経済新聞ネットワーク,minkei,みんなの経済新聞ネットワーク,1061,"\n「一保堂茶舖」の緑茶を使った「アフタヌーンティー『OCHA』」（写真提供＝帝国ホテル）\n「帝国ホテル 東京」（千代田区内幸町1）が5月1日から、本館17階のレストラン「インペリアルラウンジ アクア」で、「お茶」をテーマにしたアフタヌーンティーの提供を始める。（銀座経済新聞）\n\n 「アフタヌーンティー『OCHA』」（平日＝9,400円、土曜・日曜・祝日＝9,800円）は、新緑の季節に合わせて提供するアフタヌーンティー。同ホテルの茶室「東光庵」で使っている京都の日本茶専門店「一保堂茶舖」の緑茶をドリンクとして提供するほか、スイーツやセイボリーなど全メニューにもお茶を使う。\n\n スイーツとセイボリーは緑を基調とし、3段のスタンドとスペシャルデザートで提供。\n\n 1段目には、金箔（きんぱく）で枯れ山水を表現した「抹茶フラン」やムースを抹茶のグラサージュでコーティングした「ドーム・シトラス」、「ほうじ茶のガナッシュ」「玄米茶のエクレア」の4種類のスイーツを並べる。\n\n 2段目はスイーツ1種類とセイボリー2種類をのせる。スイーツは「ほうじ茶キャラメルラテ＆黒豆きな粉のお団子」、セイボリーはいり番茶を使った「小海老（えび）と帆立貝のマリネ グリーンピースのムースとマンゴーのアクセント」と抹茶を振りかけた「牛肉とポテトのグラタン アッシ・パルマンティエ風」。\n\n 3段目には、ワッフルコーンの中に抹茶を振りかけたサラダとラムレーズンを入れた「抹茶香る彩りサラダ ラムレーズンとともに」や「抹茶のスコーン」「ポークカツレツ ひつまぶしスタイル」の3種類をそろえる。\n\n スペシャルデザートは、抹茶のアイスクリームに抹茶の泡をあしらった「ニュアージュ ヴェール」を用意する。\n\n ウエルカムティーには冷たい水出し玉露を用意し、ドリンクは煎茶、ほうじ茶、いり番茶、玄米茶を飲み放題で提供する。\n\n 同ホテルの広報担当者は「京都の老舗一保堂茶舖のお茶をたっぷりと使ったアフタヌーンティーを提供するほか、茶道の心得があるバーテンダーによる、お茶を使った創作カクテルを提供するイベントも開催する。新緑のシーズンに日本茶の魅力を堪能してほしい」と話す。\n\n アフタヌーンティーの提供時間は11時30分～18時。6月30日まで。創作カクテルのイベントは、5月28日と6月11日に開催予定。時間は18時30分～20時30分。各日15人限定。料金は1万3,000円。\nみんなの経済新聞ネットワーク",['https://newsatcl-pctr.c.yimg.jp/t/amd-img/20240412-00000035-minkei-000-1-view.jpg?pri=l&w=640&h=480&exp=10800'],['https://news.yahoo.co.jp/articles/efbbb02ee8ffa7fddcea465873b667f4bde6b1cd/images/000']
博多駅マイングに「浜かつ」の総菜専門店　テイクアウトで弁当と総菜を販売（みんなの経済新聞ネットワーク）,https://news.yahoo.co.jp/articles/9236e60901d7db4a983c411960bb662dbc845fc3,https://newsatcl-pctr.c.yimg.jp/t/amd-img/20240412-00000036-minkei-000-1-view.jpg?exp=10800,2024-04-12T15:44:45+09:00,2024-04-12T15:44:45+09:00,みんなの経済新聞ネットワーク,minkei,みんなの経済新聞ネットワーク,565,\n「浜かつ マイング博多店」\n博多駅構内ショッピングモール「マイング」（福岡市博多区博多駅中央街）の総菜エリアに「浜かつ マイング博多店」が3月25日、オープンした。飲食事業を展開する「リンガーハット」（東京都品川区）が運営する。（博多経済新聞）\n【写真】販売する弁当\nとんかつ専門店「浜かつ」の新業態となるテイクアウト専門の弁当・総菜専門店。通常店舗との差別化を図るためブランドロゴを黒丸に、のれんを白にしている。店舗面積は約5坪。\n\n 商品は店内の厨房（ちゅうぼう）で調理し、カツ各種や弁当など約40種の商品を用意する。弁当は、「ロースかつ弁当」（880円）、「浜かつ弁当」（940円）、「ヒレかつ弁当」（890円）、「ヒレかつとエビ弁当」（920円）などをそろえる。総菜は、「ヒレかつサンド」（560円）、「メンチかつサンド」（550円）、「ヒレかつ」（340円）、「ロースかつ」（670円）、「オランダかつ」（240円）など。季節限定商品も用意する。\n\n リンガーハットグループ 浜勝・ブロック長の黒木竜也さんは「自宅で手軽に浜かつのとんかつを食べてもらいたい。店頭にたくさんの商品をそろえているので楽しんで選んでもらえたら」と呼びかける。\n\n 営業時間は9時～21時。\nみんなの経済新聞ネットワーク,['https://newsatcl-pctr.c.yimg.jp/t/amd-img/20240412-00000036-minkei-000-1-view.jpg?pri=l&w=640&h=480&exp=10800'],"['https://news.yahoo.co.jp/articles/9236e60901d7db4a983c411960bb662dbc845fc3/images/000', 'https://hakata.keizai.biz/photoflash/3442/']"
松本で池田暢子さん個展「樹皮を編む」　自ら採取した山の素材で作る、籠製品（みんなの経済新聞ネットワーク）,https://news.yahoo.co.jp/articles/be84f3d699b9b539d183e0e22675ce7c624bf5a5,https://newsatcl-pctr.c.yimg.jp/t/amd-img/20240412-00000034-minkei-000-4-view.jpg?exp=10800,2024-04-12T15:00:00+09:00,2024-04-12T16:29:49+09:00,みんなの経済新聞ネットワーク,minkei,みんなの経済新聞ネットワーク,954,"\n池田さんが手がけた約150点の籠製品が並ぶ\n籠作家・池田暢子さんによる個展「樹皮を編む」が現在、「カゴアミドリ松本店」（松本市大手1、TEL 0263-50-4475）で開催されている。（松本経済新聞）\n【写真】経年変化によって表情が変わる籠製品\n山で採取した、ヤマブドウやクルミ、ウリハダカエデの樹皮などで編んだ作品、約150点を展示する。手提げバッグや2サイズ展開の「弁当籠」は、扱う材料の中で一番丈夫だというヤマブドウの樹皮を使用。クルミの樹皮で作るトレーにも、強度を出すため、縁を囲うように巻いている。池田さんは「ヤマブドウは最初はマットな質感だが、使ううちにつやが出て色も濃くなる」と話す。\n\n 白い色合いのカトラリーケースや米研ぎざるは、マタタビのひごを編んで制作。ひごはマタタビの枝の表面を削り、道具を使って4つに割いた後、ナイフで厚み・形を整えて作る。ほか、初めて作ったというヤバネススキの鍋敷きも出品。穂がなくなり、からからになった茎をひもでくくった。\n\n 池田さんが籠作りを始めたきっかけは、信州大学農学部に在学中、旅行で訪れた東北でヤマブドウの籠を見たこと。「山の恵みで、ものづくりをすることに感銘を受けた。山は自分にとって身近な存在だったのに、そこで採れた素材で作られたものに触れたことがなく、新鮮に感じた」と振り返る。\n\n 大学卒業後、農閑期の冬の仕事として民具作りが盛んな福島県三島町に移住した。2年半ほど籠作りの経験を積んだ後、結婚を機にJターン。現在は、駒ケ根市内に構えた工房で作業を行っている。山での材料調達は、家族も協力。池田さんの影響で籠作りを始めたという父親と、林業に携わる夫、3人の子どもたちと行うという。\n\n 東京・国立にある「カゴアミドリ」とは10年ほど前からつながりがあった。2022年4月に松本店がオープンし、個展を提案され、昨年初開催。池田さんは「経年変化によって、表情が変わる自然素材の籠を楽しんでほしい」と話す。\n\n 価格は、鍋敷き＝1,000円、コースター＝3,300円、弁当籠＝1万9,250円など。営業時間は11時～17時。火曜～木曜定休。4月22日まで。池田さんは21日に在店予定。\nみんなの経済新聞ネットワーク",['https://newsatcl-pctr.c.yimg.jp/t/amd-img/20240412-00000034-minkei-000-4-view.jpg?pri=l&w=640&h=480&exp=10800'],"['https://news.yahoo.co.jp/articles/be84f3d699b9b539d183e0e22675ce7c624bf5a5/images/000', 'https://matsumoto.keizai.biz/photoflash/2565/']"
名護のイナホファームが「島ヨーグルト」販売　6次化推進で新商品（みんなの経済新聞ネットワーク）,https://news.yahoo.co.jp/articles/47100dcbbecb5d4d58466a7a3f9c7050a7796324,https://newsatcl-pctr.c.yimg.jp/t/amd-img/20240412-00000033-minkei-000-2-view.jpg?exp=10800,2024-04-12T13:53:18+09:00,2024-04-12T18:04:55+09:00,みんなの経済新聞ネットワーク,minkei,みんなの経済新聞ネットワーク,807,\nイナホファームが販売を始めた「島ヨーグルト」\n名護の牧場「INAHO FARM（イナホファーム）」（名護市天仁屋、TEL 050-5475-0315）が3月30日、「島ヨーグルト」の販売を始めた。（やんばる経済新聞）\n【写真】「イナホファーム」が販売を開始した「島ヨーグルト」\n牛舎を設けずに7ヘクタールの土地にジャージー牛を放牧し、牛にストレスをかけない「アニマルウェルフェア」に重きを置く同社。牛肉の販売やアイスクリームなどの加工品販売、キッチンカー運営などのほか、牛との「ふれあい体験」やキャンプファイア、滝ツアーなどの自然体験プログラムも展開する。\n\n 現在飼育する17頭のうち6頭が搾乳牛で、1日約30リットルの搾乳があるという。同社の佐藤貴之さんは開発のきっかけについて、「次なる6次産業化の商品開発の一環として取り組んだ。当社では野草や牧草を牛の主食にしており、その牛から搾った『グラスフェッドミルク』は栄養価も高く、全国の牧場でも珍しい。牛乳の販売は賞味期限が短いために難しかったが、新たな加工品を提供したいと半年の期間をかけて開発した」と話す。\n\n 「島ヨーグルト」は生乳100％で作り、味わいは「酸味を抑えてミルクの甘みを生かした」。表面に脂肪分のクリーム層ができるのが特徴で、砂糖などの甘味料は入れずに滑らかな口当たりに仕上げたという。\n\n 佐藤さんは「小規模な牧場だが、乳量を追い求めることはせずに牛を牛らしく育てることに力を入れている。ヨーグルトはミルク本来の味わいを生かすことにこだわった。今後は販路も広げていき、日常での健康食品として食べてもらいたい」とも。\n\n 価格は220グラムで540円。オンラインで販売するほか、「東村道の駅サンライズひがし」や道の駅「羽地の駅」、食品販売店「カナサ」、「パン工房きしもと」で取り扱う。\nみんなの経済新聞ネットワーク,['https://newsatcl-pctr.c.yimg.jp/t/amd-img/20240412-00000033-minkei-000-2-view.jpg?pri=l&w=640&h=479&exp=10800'],"['https://news.yahoo.co.jp/articles/47100dcbbecb5d4d58466a7a3f9c7050a7796324/images/000', 'https://yambaru.keizai.biz/photoflash/476/']"
名駅で「どまんなかアニメ映画祭」初開催へ　1980年代の名作アニメ10作品上映（みんなの経済新聞ネットワーク）,https://news.yahoo.co.jp/articles/84b6aaa14be736ba9820c95ea18026ce1efbbe7f,https://newsatcl-pctr.c.yimg.jp/t/amd-img/20240412-00000032-minkei-000-4-view.jpg?exp=10800,2024-04-12T13:45:00+09:00,2024-04-12T14:05:49+09:00,みんなの経済新聞ネットワーク,minkei,みんなの経済新聞ネットワーク,1271,"\n1980年代のアニメ作品を上映するイベント「どまんなかアニメ映画祭」が名駅の「ミッドランドスクエアシネマ」で開催。映画祭の見どころを語る近藤良英総合プロデューサー\n1980年代のアニメ作品を上映するイベント「どまんなかアニメ映画祭」が5月17日～19日、名駅の「ミッドランドスクエアシネマ」（名古屋市中村区名駅4）で開催される。（名駅経済新聞）\n【写真】安彦良和さん描き下ろしイラストによる「どまんなかアニメ映画祭」ポスター\nアニメファンとアニメ制作関係者が交流できる機会を提供し、名古屋から、全国、アジア、世界へアニメ文化を展開させることを目指す同映画祭。初開催となる今回は、1980年代に公開されたアニメを中心に10作品を上映。各上映の前後には、アニメーター、プロデューサーなど作品ゆかりのゲストが登壇し、トークを行う。\n\n ラインアップは次の通り。17日＝「機動戦士ガンダムI」、18日＝「機動警察パトレイバー2 the Movie」「機動戦士ガンダムII 哀・戦士編」「ルパン三世 カリオストロの城」「超時空要塞マクロス 愛・おぼえていますか」「幻魔大戦」、19日＝「王立宇宙軍オネアミスの翼」（4K リマスター）「AKIRA」「ヴイナス戦記」「機動戦士ガンダムIII めぐりあい宇宙編」。\n\n 登壇ゲストは次の通り。17日＝井上伸一郎さん、植田益朗さん。18日＝出渕裕さん、伊藤和典さん、板野一郎さん、河森正治さん、丸山正雄さん、友永和秀さん。19日＝山賀博之さん、渡辺繁さん、明田川進さん、安彦良和さん、佐野浩敏さん。\n\n 総合プロデューサーの近藤良英さんは愛知県出身。1980年代に松竹の映画宣伝部で「機動戦士ガンダム」3部作や「伝説巨神イデオン 接触篇（へん）・発動篇」「クラッシャージョウ」などを担当し、日本のアニメが大きく発展した時代を支えた。\n\n 名古屋の映画館を選んだ理由について「愛知県は『ジブリパーク』もあり、漫画家・鳥山明さんが誕生した地でもある。キー局として『機動戦士ガンダム』の放映を始めた名古屋テレビもある。漫画やアニメに近しい名古屋でアニメ映画祭を始めるのは当然のことと考えた」と話す。\n\n 近藤さんは「1980年代には、宮崎駿、富野由悠季、押井守、大友克洋ら、現在も現役の巨匠監督たちがきら星のごとく登場した。今回、ゲストで登壇する作画、音響、プロデュースといったジャンルの巨匠たちも、この時代に活躍を始めている。1980年代のスター作品を一挙に集めて公開したら、ものすごいエネルギーが発生するはず。それは、元々のファンの人たちだけではなく、アニメや実写のクリエーターを目指す未来の巨匠たちにも大きな影響を及ぼすかもしれない。そんな化学反応が名古屋で起こることを期待している。数十年の時を超えて、スクリーンからほとばしるエネルギーを映画館で体感してほしい」と多くの来場を呼びかける。\n\n 料金は1作品2,800円（トークイベント付き）。\nみんなの経済新聞ネットワーク",['https://newsatcl-pctr.c.yimg.jp/t/amd-img/20240412-00000032-minkei-000-4-view.jpg?pri=l&w=640&h=465&exp=10800'],"['https://news.yahoo.co.jp/articles/84b6aaa14be736ba9820c95ea18026ce1efbbe7f/images/000', 'https://meieki.keizai.biz/photoflash/5228/']"
海遊館で特別展「いのちぐるぐるサンゴ展」　「生きたサンゴ」や映像で魅力紹介（みんなの経済新聞ネットワーク）,https://news.yahoo.co.jp/articles/9e0bd0456c081540d93ea01ae0d6dc2bbd9f0938,https://newsatcl-pctr.c.yimg.jp/t/amd-img/20240412-00000029-minkei-000-1-view.jpg?exp=10800,2024-04-12T12:59:56+09:00,2024-04-12T12:59:56+09:00,みんなの経済新聞ネットワーク,minkei,みんなの経済新聞ネットワーク,566,\n約20種類・60点の生きたサンゴを展示する水槽\n特別展「いのちぐるぐるサンゴ展」が現在、海遊館（大阪市港区海岸通1）エントランスビル4階の企画展示室で開催されている。（大阪ベイ経済新聞）\n【写真】サンゴを展示する水槽を泳ぐカクレクマノミ\n現在、世界最大のサンゴ礁を再現する「グレート・バリア・リーフ」水槽のリニューアル工事を進める同館。9月のオープンに向け、同展では、サンゴ礁を形成するサンゴそのものに焦点を当て、生態や成り立ちなどを紹介する。\n\n 会場は5つのコーナーで展開。入り口付近には、命を全うし骨格だけが残った白化サンゴを左右の壁や床に無数に並べる。中央の幅4メートルの水槽では、分かりやすく説明するため「もこもこ」「ゆらゆら」などのオノマトペを使った紹介文と共に、赤・緑・青など約20種類・60点のサンゴを展示。幅約6メートル・高さ約2メートルの巨大スクリーンでは、天候や温度の変化で表情を変えるサンゴを描いた約4分間のアニメーションを上映する。\n\n 海遊館広報の松村将太さんは「サンゴはデリケートで飼育が難しいため、海遊館では現状この特別展でのみ生きたサンゴを見ることができる。展示を通してサンゴの魅力を少しでも感じてもらえれば」と話す。\n\n 2025年1月まで。\nみんなの経済新聞ネットワーク,['https://newsatcl-pctr.c.yimg.jp/t/amd-img/20240412-00000029-minkei-000-1-view.jpg?pri=l&w=640&h=426&exp=10800'],"['https://news.yahoo.co.jp/articles/9e0bd0456c081540d93ea01ae0d6dc2bbd9f0938/images/000', 'https://osakabay.keizai.biz/photoflash/3294/']"
札幌でハンドメードの展示即売会　2万点以上の手作り作品ずらり（みんなの経済新聞ネットワーク）,https://news.yahoo.co.jp/articles/bffffd67042bbd38c43e3f77e288ee15a9c02ebd,https://newsatcl-pctr.c.yimg.jp/t/amd-img/20240412-00000031-minkei-000-1-view.jpg?exp=10800,2024-04-12T13:40:01+09:00,2024-04-12T13:40:01+09:00,みんなの経済新聞ネットワーク,minkei,みんなの経済新聞ネットワーク,525,\n会場の様子\n全国のハンドメード作家による自作品の展示・販売イベント「札幌ハンドメイドマルシェ2024」が5月25日・26日、「つどーむ」（札幌市東区）で開催される。（札幌経済新聞）\n【写真】シマエナガの木工雑貨（Toridoriさん制作）\n2022年5月に初開催し、今回で3回目の開催となる同イベント。前回は会場面積1万平方メートルの「つどーむ」に2日間で約9000人が来場した。\n\n ブース数は2日間合計で約1300ブース。全国各地から集まるハンドメード作家による2万5000点以上の手作り作品が会場に並ぶ。会場にはアクセサリーやインテリア、雑貨、伝統工芸、ファッションなどさまざまなジャンルがそろうほか、焼き菓子、パン、ジャム、紅茶などの手作りフードも並ぶ。\n\n ワークショップエリアでは、誰でも参加可能というハンドメード体験教室「マルシェのがっこう」を開く。2日間で24種類の体験を用意し、ハンドメード作家の指導の下、アクセサリーやクラフト、ファンシー雑貨などオリジナル作品を作ることができる。\n\n 開催時間は11時～17時。入場料は、当日券＝600円、前売券＝500円、小学生以下は無料。\nみんなの経済新聞ネットワーク,['https://newsatcl-pctr.c.yimg.jp/t/amd-img/20240412-00000031-minkei-000-1-view.jpg?pri=l&w=640&h=480&exp=10800'],"['https://news.yahoo.co.jp/articles/bffffd67042bbd38c43e3f77e288ee15a9c02ebd/images/000', 'https://sapporo.keizai.biz/photoflash/4435/']"
表参道にクレープ店「クレープとエスプレッソと」　1年半かけ生地開発（みんなの経済新聞ネットワーク）,https://news.yahoo.co.jp/articles/9e950bb1f1f3a3743f266c8f92dcda5ef5c0e9b2,https://newsatcl-pctr.c.yimg.jp/t/amd-img/20240412-00000030-minkei-000-1-view.jpg?exp=10800,2024-04-12T13:09:52+09:00,2024-04-12T13:09:52+09:00,みんなの経済新聞ネットワーク,minkei,みんなの経済新聞ネットワーク,605,"\n生地にこだわったクレープなどを提供する\nクレープ店「クレープとエスプレッソと」（渋谷区神宮前4、TEL 03-6804-6040）が3月14日、表参道にオープンした。（シブヤ経済新聞）\n【写真】エアストリームを活用する店舗\nベーカリー「パンとエスプレッソと」などを手がける日と々と（神宮前3）の新業態。グルメ系のSNSを展開するなどしている遠藤優さんが社長を務める、企業向けにSNSのコンサルティングなどを手がけるウルフ（神宮前2）とコラボレーションした。\n\n キャンピングトレーラー「エアストリーム」を活用する店舗は6席程度を用意。クレープは1年半かけて開発したという生地が特徴で、素材などは非公表だが、作る前の材料の温度管理や調合の方法、生地の温度、焼き台の温度、焼き時間などを調整し「パリパリ食感」などを出しているという。\n\n メニューは、バターシュガー、レモンシュガー、ラム酒シュガーのシュガー系（各800円）や、カスタードクリームと生クリーム、ラズベリーレアチーズと生クリーム（各900円）、イチゴと生クリーム（1,100円）などのクリーム系、ハムチーズエッグやウインナチーズエッグの総菜系（各900円）を用意。カフェラテ（650円）や自家製レモネード（600円）などのドリンクも扱う。支払いはキャッシュレスのみ。\n\n 営業時間は11時～17時。\nみんなの経済新聞ネットワーク",['https://newsatcl-pctr.c.yimg.jp/t/amd-img/20240412-00000030-minkei-000-1-view.jpg?pri=l&w=640&h=480&exp=10800'],"['https://news.yahoo.co.jp/articles/9e950bb1f1f3a3743f266c8f92dcda5ef5c0e9b2/images/000', 'https://www.shibukei.com/photoflash/17453/']"
