headline,mainEntityOfPage,image,datePublished,dateModified,author,media_en,media_jp,str_count,body,images,external_links
「被買収」木戸経康元広島市議の控訴棄却　河井元法相大規模買収事件で広島高裁（中国新聞デジタル）,https://news.yahoo.co.jp/articles/0a3512dc6030533385ade65fd64bef2c628a4cbd,https://newsatcl-pctr.c.yimg.jp/t/amd-img/20240522-00010003-chugoku-000-1-view.jpg?exp=10800,2024-05-22T14:09:26+09:00,2024-05-22T14:09:26+09:00,中国新聞デジタル,chugoku,中国新聞デジタル,488,\n広島高裁\n2019年7月の参院選広島選挙区を巡る大規模買収事件で、河井克行元法相（61）=仮釈放中=から現金30万円を受け取ったとして公選法違反（被買収）の罪に問われた元広島市議木戸経康被告（68）=安佐北区=の控訴審判決が22日、広島高裁であった。森浩史裁判長は罰金15万円、追徴金30万円とした一審広島地裁判決を支持し、被告の控訴を棄却した。\n\n 控訴審で木戸被告側は「選挙運動の報酬の認識を推認できない」などとあらためて無罪を主張。「（捜査段階の）取り調べで不起訴の約束があった」などと検察官による公訴権の乱用も訴えていた。\n\n 昨年10月の地裁判決は現金を受け取った時期などから「選挙運動をすることの報酬を含むものと認識していた」と判断。克行氏の妻案里氏（50）=有罪確定、参院選の当選無効=の選挙運動をする報酬として19年4月3日、安佐北区内で現金30万円を受け取ったと認定した。\n\n また、捜査段階での取り調べについては、不起訴を前提にした検察官の取り調べに言及する一方で「公訴を棄却すべきほどの違法性を有するとはいえない」とした。\n中国新聞社,['https://newsatcl-pctr.c.yimg.jp/t/amd-img/20240522-00010003-chugoku-000-1-view.jpg?pri=l&w=640&h=404&exp=10800'],['https://news.yahoo.co.jp/articles/0a3512dc6030533385ade65fd64bef2c628a4cbd/images/000']
暴力団組員ら、別人名義で車検申請した疑い　広島県警など逮捕（中国新聞デジタル）,https://news.yahoo.co.jp/articles/70958dec2b025042d10e52ae97d7cbdde0711b10,https://newsatcl-pctr.c.yimg.jp/t/amd-img/20240522-00010004-chugoku-000-1-view.jpg?exp=10800,2024-05-22T15:10:58+09:00,2024-05-22T15:10:58+09:00,中国新聞デジタル,chugoku,中国新聞デジタル,215,\n事件・事故\n広島県警組織犯罪対策2課と府中署、三原署は22日、三原市中之町3丁目、指定暴力団俠道会弘田組組員藤本龍也（44）、同市、自営業の男（34）の両容疑者を電磁的公正証書原本不実記録・同供用の疑いで逮捕した。\n\n 逮捕容疑は、2人は共謀。2022年8月25日、福山市南今津町の自動車検査登録事務所で、藤本容疑者が使用する乗用車の車検を男の名義で申請し、国の自動車登録ファイルに記録させるなどした疑い。\n中国新聞社,['https://newsatcl-pctr.c.yimg.jp/t/amd-img/20240522-00010004-chugoku-000-1-view.jpg?pri=l&w=640&h=363&exp=10800'],['https://news.yahoo.co.jp/articles/70958dec2b025042d10e52ae97d7cbdde0711b10/images/000']
歯の詰め物の金属を無断で寄付した歯科医を書類送検、業務上横領の疑い　山口県警（中国新聞デジタル）,https://news.yahoo.co.jp/articles/33623d7b3d80c4fd980cd2027a781dfbca9248bb,https://newsatcl-pctr.c.yimg.jp/t/amd-img/20240522-00010006-chugoku-000-1-view.jpg?exp=10800,2024-05-22T19:45:18+09:00,2024-05-22T19:45:18+09:00,中国新聞デジタル,chugoku,中国新聞デジタル,190,\n山口県警柳井署\n山口県警柳井署が、治療で取り外した歯の詰め物などの歯科金属スクラップを無断で寄付していたなどとして、山口県の周防大島町立橘医院の男性歯科医師を業務上横領の疑いで書類送検したことが22日、分かった。昨年2月、大島郡歯科医師会（周防大島町）の会員が同署に告発し、同署が捜査していた。山口地検によると、地検岩国支部が同日付で書類送検を受理したという。\n中国新聞社,['https://newsatcl-pctr.c.yimg.jp/t/amd-img/20240522-00010006-chugoku-000-1-view.jpg?pri=l&w=640&h=479&exp=10800'],['https://news.yahoo.co.jp/articles/33623d7b3d80c4fd980cd2027a781dfbca9248bb/images/000']
J1広島、ルヴァン杯プレーオフ進出決定　東京Vに3―2　1次ラウンド3回戦（中国新聞デジタル）,https://news.yahoo.co.jp/articles/ea661388a40d3825cca48afcca309eea49382502,https://newsatcl-pctr.c.yimg.jp/t/amd-img/20240522-00010007-chugoku-000-1-view.jpg?exp=10800,2024-05-22T21:22:55+09:00,2024-05-22T21:22:55+09:00,中国新聞デジタル,chugoku,中国新聞デジタル,346,\n【東京V―広島】前半、大橋（手前右）が先制ゴールを決める\nJ1サンフレッチェ広島は22日、東京・味の素スタジアムで、YBCルヴァン・カップ1次ラウンド3回戦の東京V戦に臨み、3―2で勝利。8強を懸けたプレーオフ進出を決めた。\n【写真集】サンフレッチェ広島全ゴール 2024年\n広島は前半6分、東俊希の左クロスを右サイドの新井直人が折り返し、中央に走り込んだ大橋祐紀が押し込んで先制。14分には再び大橋がゴールを決め、2点リードで前半を折り返した。\n\n しかし、後半は東京Vの反撃を受けた。29分にカウンターから失点。33分に川村拓夢が追加点を奪ったものの、38分にはセットプレーから再び失点。終盤はボールキープを続け、かろうじてリードを守り切った。（時間は速報値）\n中国新聞社,['https://newsatcl-pctr.c.yimg.jp/t/amd-img/20240522-00010007-chugoku-000-1-view.jpg?pri=l&w=448&h=640&exp=10800'],"['https://news.yahoo.co.jp/articles/ea661388a40d3825cca48afcca309eea49382502/images/000', 'https://www.chugoku-np.co.jp/articles/-/429147']"
池上彰さんかたるSNS型投資詐欺、710万円だまし取った疑い　広島県警が逮捕（中国新聞デジタル）,https://news.yahoo.co.jp/articles/d959b3f531a175df3da1d9cc201ed659e46e150b,https://newsatcl-pctr.c.yimg.jp/t/amd-img/20240522-00010005-chugoku-000-4-view.jpg?exp=10800,2024-05-22T18:55:38+09:00,2024-05-22T22:56:46+09:00,中国新聞デジタル,chugoku,中国新聞デジタル,164,\n広島県警広署\nジャーナリストの池上彰さんたちに成り済まし交流サイト（SNS）でうその投資話を持ちかけて現金をだまし取ったとして、広島県警広署と県警組織犯罪対策1課特殊詐欺事件捜査室は22日、中国籍の東京都板橋区、会社役員の男（41）を詐欺の疑いで逮捕した。「SNS型投資詐欺」の摘発は広島県内で初めてという。\n中国新聞社,['https://newsatcl-pctr.c.yimg.jp/t/amd-img/20240522-00010005-chugoku-000-4-view.jpg?pri=l&w=640&h=426&exp=10800'],['https://news.yahoo.co.jp/articles/d959b3f531a175df3da1d9cc201ed659e46e150b/images/000']
暴力団の組事務所を家宅捜索　広島県警　共政会組員の傷害容疑（中国新聞デジタル）,https://news.yahoo.co.jp/articles/9f520c09a3cd48c020d55077ad95a99d200a8e0b,https://newsatcl-pctr.c.yimg.jp/t/amd-img/20240522-00010002-chugoku-000-3-view.jpg?exp=10800,2024-05-22T12:09:03+09:00,2024-05-22T12:17:01+09:00,中国新聞デジタル,chugoku,中国新聞デジタル,289,\n事件・事故\n広島中央署と県警組織犯罪対策2課は22日、広島市中区、指定暴力団共政会組員の男（20）らを傷害容疑で逮捕した事件に絡み、岡容疑者の関係先として中区三川町の共政会片山組事務所を家宅捜索した。\n【写真】家宅捜索のため片山組事務所があるビルに入る県警捜査員\n捜索は午前10時ごろから13人態勢で約30分間実施した。\n\n 岡容疑者は、西区の無職男（22）と共謀。4月29日午前4時ごろ、中区銀山町の路上やその付近で岡容疑者が40代男性の顔を数回殴り、男は背後から両腕で首を締め付けて、首の捻挫などのけがを負わせたとして21日に逮捕された。\n中国地方のニュース,['https://newsatcl-pctr.c.yimg.jp/t/amd-img/20240522-00010002-chugoku-000-3-view.jpg?pri=l&w=640&h=363&exp=10800'],"['https://news.yahoo.co.jp/articles/9f520c09a3cd48c020d55077ad95a99d200a8e0b/images/000', 'https://www.chugoku-np.co.jp/articles/gallery/468392']"
広島のJR呉線で遮断棒折れ、列車に遅れ（中国新聞デジタル）,https://news.yahoo.co.jp/articles/679a4f79b9e598772ee6d8ff68717567ab990897,https://newsatcl-pctr.c.yimg.jp/t/amd-img/20240522-00010000-chugoku-000-1-view.jpg?exp=10800,2024-05-22T08:00:44+09:00,2024-05-22T08:00:44+09:00,中国新聞デジタル,chugoku,中国新聞デジタル,129,\n交通情報\n22日午前6時ごろ、広島県坂町のJR呉線坂駅の総頭川踏切で遮断棒が折れていると、通過した列車の運転手からJR西日本広島指令所に連絡があった。安全確認などのため、午前5時広発の坂―広島間の列車が15分遅れ、約180人に影響が出た。\n中国新聞社,['https://newsatcl-pctr.c.yimg.jp/t/amd-img/20240522-00010000-chugoku-000-1-view.jpg?pri=l&w=640&h=360&exp=10800'],['https://news.yahoo.co.jp/articles/679a4f79b9e598772ee6d8ff68717567ab990897/images/000']
JR可部・山陽線で車両減らして運行　線路切り替えに不具合（中国新聞デジタル）,https://news.yahoo.co.jp/articles/ded1caad3fd74b9e1d41a8ce0b60756da6a77b89,https://newsatcl-pctr.c.yimg.jp/t/amd-img/20240522-00010001-chugoku-000-1-view.jpg?exp=10800,2024-05-22T08:43:10+09:00,2024-05-22T08:43:10+09:00,中国新聞デジタル,chugoku,中国新聞デジタル,203,\n交通情報\n22日午前4時15分ごろ、広島市南区のJR山陽線広島―天神川間にある広島貨物ターミナル駅で線路の切り替えに不具合が見つかり、白市発岩国行き始発列車が30分遅れた。JR西日本中国統括本部によると、運行列車の差し替えにも影響が出て、可部線広島発緑井行きと緑井発広島行き列車を4両から3両に、山陽線岩国発広島行きの列車を6両から4両に減らして運行。計約1000人に影響が出る見通し。\n中国新聞社,['https://newsatcl-pctr.c.yimg.jp/t/amd-img/20240522-00010001-chugoku-000-1-view.jpg?pri=l&w=640&h=360&exp=10800'],['https://news.yahoo.co.jp/articles/ded1caad3fd74b9e1d41a8ce0b60756da6a77b89/images/000']
