headline,mainEntityOfPage,image,datePublished,dateModified,author,media_en,media_jp,str_count,body,images,external_links
『光る君へ』で話題、平安貴族にお金持ちはいなかった…という意外な事実（JBpress）,https://news.yahoo.co.jp/articles/879f4324ac746edce9ff246816cc39f6913f7410,https://newsatcl-pctr.c.yimg.jp/t/amd-img/20240122-00078983-jbpressz-000-1-view.jpg?exp=10800,2024-01-22T12:02:21+09:00,2024-01-22T12:02:21+09:00,JBpress,jbpressz,JBpress,1585,\n京都御所 撮影／西股 総生\n（歴史ライター:西股 総生）\n\n■ 当時、日本にはお金がほぼ存在しなかった\n\n これまで、大河ドラマの舞台として描かれたのは、戦国時代と幕末がもっとも多かったが、その理由は「人気がある」ということだけではなかった。戦国や幕末は、繰り返しドラマ化されてきたので、制作側にもノウハウの蓄積があり、セットや衣装・小道具の調達・作成、画面作りなど、何かとスムースに進めやすい、という事情もあったようだ。\n【写真】崇福寺跡出土の和同開珎 東京国立博物館蔵\nそこへ行くと今回の『光る君へ』は、セットや小道具、セリフに出てくる言葉なども、史料や絵巻物を参考にしながら、平安時代感を出すようにかなり努力している様子が見てとれる。それでいて、令和のわれわれが共感できるよう、ストーリーやセリフの表現なども工夫している。まずは、脚本・制作陣の健闘に敬意を表したい。\n\n さて、そんな『光る君へ』の時代背景として、ひとつ頭に入れておきたいことがある。それは、平安貴族にお金持ちはいなかった、という事実である。\n\n 意外に思われるかもしれないが、これは事実だ。なぜ、お金持ちがいなかったのかというと、当時の日本にはお金というものが（ほぼ）存在していなかったからだ。平安時代は、貨幣経済ではなく物々交換が基本だったのである。『光る君へ』でも、お金を登場させずに、まひろの生家の困窮ぶりを表現するよう、セリフなどに工夫がされていた。\n\n 皆さんは「わらしべ長者」のお話をご存じであろう。捕まえたアブで作ったおもちゃがミカンに、ミカンが反物に、反物が馬に交換され、最後は馬が家になる話である。この話は、平安時代の物々交換経済を背景に成立したものにほかならない。\n\n 一方で皆さんは、和同開珎や皇朝十二銭という古代の銅銭を、教科書で習ったはずである。たしかに8世紀以降、朝廷は中国（当時は唐）の制度を手本として、和同開珎に始まる皇朝十二銭を次々と発行した。\n\n 和同開珎などは各地の遺跡から出土しているから、それなりの量が作られてそれなりに流通したようである。けれども、結果的に日本には貨幣経済は定着せず、『光る君へ』の頃には物々交換経済へと逆戻りしてしまった。なぜだろうか？ \n\n ここで押さえておきたいのは、日本は経済でも社会でも有史以来一度たりとも、海外から隔絶されていたことなどなかったことである。もともと古代の東アジア世界は、圧倒的な経済力・技術・文化水準を擁する中華帝国と、周辺の「田舎の民俗・国」、という図式で構成されていた。\n\n そして、東アジア世界の東の隅っこにある田舎者国家・日本が、グローバルスタンダードに追いつこうと、背伸びして整えたのが律令国家である。そんな日本の律令国家がイキって銭貨を発行しても、国際的な信用力なんかない。\n\n 少なくとも、中国や朝鮮の商人たちは、日本側が皇朝十二銭で支払おうとしても認めるはずがない。貿易商が決済手段に使えない銅銭は、流通や仲買にあたる者たちも欲しがらない。結局はローカル経済の範囲内で地域クーポン程度にしか機能しないから、いずれは安く買いたたかれ、地金として鋳つぶされるのがオチだったろう。\n\n おそらくはこんなふうにして、平安社会は物々交換経済へと戻っていった。とはいえ、多種多様な商品が行き交う社会では、何かしら価値の基準になる物品が必要となる。平安時代にそうした役割を担ったのは、布や絹などの反物だった。比較的軽くて持ち運びが容易で、保存もきくからだ。「わらしべ長者」の物語でも、反物がキイになっている。\n\n こうした、お金のない物々交換経済の時代ということを頭に入れておくと、『光る君へ』もいま少し興味深く鑑賞できることだろう。\n西股 総生,['https://newsatcl-pctr.c.yimg.jp/t/amd-img/20240122-00078983-jbpressz-000-1-view.jpg?exp=10800'],"['https://news.yahoo.co.jp/articles/879f4324ac746edce9ff246816cc39f6913f7410/images/000', 'https://jbpress.ismedia.jp/articles/gallery/78983?photo=3&utm_source=yahoonews&utm_medium=referral&utm_campaign=photo']"
不安やストレスから選手と自分を守るために、なぜルーティンが必要か？（JBpress）,https://news.yahoo.co.jp/articles/b0750802bdee4301b7cda664590e4e8d61c7b087,https://newsatcl-pctr.c.yimg.jp/t/amd-img/20240122-00077740-jbpressz-000-1-view.jpg?exp=10800,2024-01-22T12:02:09+09:00,2024-01-22T12:02:09+09:00,JBpress,jbpressz,JBpress,3351,\natsportphoto/Shutterstock.com\n組織や部下が成長し続けるために、リーダーが果たすべき役割とは？ 本連載では、9年ぶりに日本代表ヘッドコーチとして再登板が決まったラグビーの名将、エディー・ジョーンズ氏の著書『LEADERSHIP リーダーシップ』（エディー・ジョーンズ著/東洋館出版社）から、内容の一部を抜粋・再編集。イングランド、オーストラリア代表ほか数々のチームを率い、ゴールドマン・サックス日本のアドバイザリーボードも務める同氏の、ビジネスにも通じるチームづくりやコーチングの極意に迫る。\n\n 第4回目は、ラグビー日本代表に招かれた女性の心理療法士がチームに与えた好影響、部下と自分自身をストレスから守る方法を紹介する。\n\n ■日本代表に欠かせなかった女性心理療法士の存在\n\n ヘッドコーチは、コーチ陣にも注意を向けておかなければならない。個々のコーチのパフォーマンスと、コーチ陣の人間関係が良好に保たれているかを定期的に見直すのだ。\n\n イングランド代表のコーチ陣にも紆余曲折があった。2016年から2019年にかけては、コーチ陣は受け身の意識が強く、私の権限が強かった。私は、これは良くないことだと考えていた。自分の良くない点を指摘してほしかったからだ。コーチたちが切磋琢磨するには、健全な対立や議論が必要だ。\n\n 2019年には、お互いに敬意を持ちつつ、本音で意見を交わせるようになった。各コーチが意思決定プロセスに関わっている。とはいえ、この体制をつくるのに4年もかかった。\n\n だがワールドカップの後、コーチ陣の入れ替えを余儀なくされた。スティーブ・ボースウィックはレスター、ニール・ハトリーはバースのヘッドコーチになり、スコット・ワイズマンテルは家族のいるオーストラリアに帰った。職業人としても、ひとりの人間としても当然の選択だ。私は彼らがイングランド代表で成し遂げてくれた特別な仕事に感謝している。\n\n 現在、選手と同様、コーチ陣においても新しいリーダーグループを構築している最中だ。時間はかかるだろうが、次のワールドカップまでには、2019年のような素晴らしいリーダーグループができると確信している。\n\n 私は常にスタッフの構成を変えることを考えている。現在は以前よりも女性スタッフの比率が増え、望ましい環境が整ってきた。\n\n 25人のスタッフのうち女性は4人いて、物流管理マネージャー、スポーツ精神科医、マッサージ・セラピスト、報道担当として重要な役割を担っている。\n\n 優れた組織では多様性が重視される。女性スタッフがいるとチームの視点が広がり、繊細な感性がもたらされる。20年前には、女性がチームにいると雰囲気が柔らかくなり過ぎるという考えがあった。だが、現在のイングランド代表の場合はまったく違う。\n\n 女性はチームに深みと広い視野を与えてくれる。それは成功に不可欠なものだ。選手は心を開き、自分と向き合う必要がある。そのとき女性スタッフの存在が大きな助けになる。\n\n 女性スタッフを雇うメリットを学んだのは、日本にいるときだ。そう聞くと、不思議に感じるかもしれない。日本は長く男尊女卑社会と見なされてきたからだ。この国では伝統的に、女性は男性に従属すべき存在であると考えられてきた。妻は夫のためにお茶を出したり、スリッパをそろえたりしなければならなかった。\nだが幸い、世の中は変わってきている。私は若い日本人女性をチームの心理療法士として招き入れることができた。\n\n 彼女は男性に従属的な存在ではなかった。一部の選手たちの態度について話し合ったときは、「まずあなたがコーチとして自分と向き合う必要があります」ときっぱりと指摘された。キャンプでの私は不機嫌そうに見え、近寄りがたい存在なのだという。たしかにそのとおりだった。私は選手たちと話すときには柔らかい雰囲気を出すようにした。\n\n その後、彼女は出産したため、ワールドカップのチームには帯同しないことになっていた。けれど、計画を変えることになった。選手たちから直訴され、私は彼女を大会スタッフに加えることにした。\n\n 選手たちは悩みや心配事を相談するうちに、彼女を深く信頼するようになっていた。彼女は選手たちにとてつもなく良い影響を与えていた。我々は、3週間のワールドカップ開催期間中、彼女のためにベビーシッターを手配した。大会に向けた精神面の準備において、彼女はチームに計り知れない効果をもたらしてくれた。\nもちろん、優れた心理療法士を雇える組織やチームは限られている。部下や選手のストレスや悩み、不安の問題に対処するとき、リーダーはまず、自分の問題から解決していくべきだ。人間は、誰でもネガティブな感情に襲われることがある。だが、対処策はある。まずは、その感情を認識し、それが自分にどんな影響を与えているかを理解しようとすることだ。次に、自分が置かれている状況や周りの環境を良い方向に変えていく。\n\n 私は、ごく単純な形でこれを実践している。それは、「ルーティンをつくり、それを続けること」だ。それを、自分を不安やストレスから守る方法にしている。先日アメリカン・フットボールリーグのコーチと話をしたとき、オーストラリア人俳優のヒュー・ジャックマンのポッドキャスト番組を勧められた。\n\n ジャックマンは役を演じている期間は、毎日のルーティンを徹底的に守る。酒は飲まず、仕事の後に外出もしない。食事のチェックや健康管理も怠らない。毎朝、妻と30分読書をして、その後で30分瞑想をして、それから運動をする。同じ行動を繰り返すことが、ストレスとの闘いに役立っているのだという。\nどんな職業であれ、ストレスとはうまくつき合っていかなければならない。人間は、ストレスにさらされているときにミスを犯しやすくなる。ミスを減らすには、心を落ち着けて、明晰な思考を保たなければならない。そうできるよう、私たちは自分なりの方法を見つけるべきだ。健康やパフォーマンスを上げるうえで、ストレスレベルのコントロールは欠かせない。\n\n 失敗への恐れが意欲につながる者もいれば、楽観的になることで意欲が高まる者もいる。選手によって、成功と失敗のどちらに目を向けるかでモチベーションが上がるかは異なる。そのため我々はレビュー・プロセスでは、選手の性格を試して、その特性を把握するようにしている。これはどちらかが正しく、どちらかが間違っているという問題ではない。\n\n 大切なのは、選手の特性と現在の状況を見極めて、それに合わせて適切なサポートをすることだ。選手との関係性を深め、相手に必要なものを提示しなければならない。少し背中を押すだけでいいのか、多くのサポートや励ましを求めているのか。\n\n 悩みや不安は誰にでもある。仕事を失うのも、周りから能力がないと評価されるのも怖い。自分が正しいことをしているか、適切な判断を下したか、疑心暗鬼になる。それが人間だ。だが、こうした感情をうまくコントロールし、前向きな力に変えていかなければならない。\n\n リーダーとして成功を収めたときは、さらに危険だ。コーチ陣のなかで、自分の地位を失うことを恐れるようになるからだ。そんなときは、自分についての記事を読みたいという衝動にかられるが、その道は行き止まりだ。\n\n 私がデイリー・メイル紙の辛口記者、クライブ・ウッドワード卿の記事を読み、それに従って次に何をするかを判断しようとしているのを想像してみてほしい。そんなことをすれば、ろくな結果が得られないのは目に見えている。大声で吠える犬に耳を傾ける人もいる。だが、コーチがそれをすれば道を踏み外すだけだ。\n\n メディアはコーチと選手のことをあれこれと臆測で書き立てる。だが、それは外野の当て推量にすぎない。自分が進むべき道を決めるとき、周りの声を気にし過ぎてはいけない。\n\n はっきりとした考えを持ち、自分の方法ですべきことをするだけなのだ。\nエディー・ジョーンズ／児島 修,['https://newsatcl-pctr.c.yimg.jp/t/amd-img/20240122-00077740-jbpressz-000-1-view.jpg?exp=10800'],['https://news.yahoo.co.jp/articles/b0750802bdee4301b7cda664590e4e8d61c7b087/images/000']
『光る君へ』藤原道長の兄の生涯、道隆は定子の父となり道兼は天皇を欺いた？（JBpress）,https://news.yahoo.co.jp/articles/8c79f4a2b1b2245825a5c4c5862d15aea5a91d87,https://newsatcl-pctr.c.yimg.jp/t/amd-img/20240122-00079038-jbpressz-000-1-view.jpg?exp=10800,2024-01-22T12:02:24+09:00,2024-01-22T12:02:24+09:00,JBpress,jbpressz,JBpress,3024,\n京都御所 写真＝アフロ\n文=鷹橋 忍 \n\n 大河ドラマ『光る君へ』では、藤原道長の同母兄（次兄）である玉置玲央が演じる藤原道兼が、紫式部（ドラマでは、まひろ）の母を殺害したり、坂東巳之助が演じる円融天皇の食事に毒を盛らせたりするなどして、注目を集めている。 今回はその藤原道兼と、道長のもう一人の同母兄（長兄）・井浦新が演じる藤原道隆を取り上げたい。まずは、長兄の藤原道隆からみていこう。\n【写真】藤原道隆（菊池容斎『前賢故実』より）\n■ 道隆の容貌は？ \n\n 藤原道長の長兄・藤原道隆は、天暦7年（953）に生まれた。\n\n 康保3年（966）生まれの道長より、13歳年上である。\n\n 宇多天皇（在位887～897）から堀河天皇（在位1079～1107）までの15代・約200年間を扱う編年体歴史物語である『栄花物語』と、平安時代後期成立の紀伝体による歴史物語『大鏡』には、道隆にまつわる説話が載っている。\n\n 道隆の容貌に関して、『栄花物語』巻第三「さまざまのよろこび」には、「御かたちも心いとなまめかしう（容姿も心も、大変に優雅でいらっしゃった）」とある（校注・訳 山中裕 秋山虔 池田尚隆 福長進 『新編日本古典文学集31 栄花物語(1)』）。\n\n 『大鏡』にも、「御かたちぞ、いと清らにおはしましし（容姿が実に綺麗でいらされた）」と記されている（校注 石川徹『新潮日本古典集成 大鏡』）。\n\n■ 妻は才媛\n\n 『栄花物語』巻第三「さまざまのよろこび」によれば、道隆は、あちらこちらの女性と情を交わしていたが、誰よりも気に入っていたのは、板谷由夏が演じる高階貴子（生年不詳～996）だった。\n\n 高階貴子は、高階成忠（923～998）の娘だ。高階成忠は人から煙たがれていたが、学問には秀でていたという。\n\n 貴子も、女性に漢学の素養は無縁であった時代において、実に見事に漢字を書くなど才識が豊かだった。円融天皇の代に宮中の女房として出仕し、掌侍（内侍司の三等官）に任命され、高内侍と称されたという。\n■ 娘は清少納言が仕えた、中宮藤原定子\n\n 道隆と貴子との間には、三男四女の子が誕生している。\n\n そのなかで、高畑充希が演じる長女の藤原定子（976～1000）は、正暦元年（990）正月、15歳のときに、塩野瑛久が演じる一条天皇（980～1011 在位986～1011 /円融天皇と吉田羊が演じる藤原詮子の子）の後宮に入内し、同年10月に一条天皇の中宮となった。\n\n 当時、一条天皇は11歳。定子より4歳年下であった。\n\n 定子は天皇に寵愛され、その生活は定子に仕えた、ファーストサマーウイカが演じる清少納言（生没年不詳）の『枕草子』に描かれている。\n\n 『枕草子』には、道隆も何度も登場している。才気溢れる清少納言を定子の側近としたのは、道隆だともいわれる（繁田信一『殴り合う貴族たち』）。\n\n■ 死因は酒の飲み過ぎ？ \n\n 道隆は無類の酒好きだったと伝えられる。\n\n 車中で飲み仲間の藤原済時（941～995）、藤原朝光（951～995）と痛飲し、酩酊して、簾を上げて冠を脱ぎ、髻を人前に晒した。\n\n また、下鴨神社では、素焼きの杯で御神酒を3杯飲むのが定例だが、道隆の酒好きを知る神主・禰宜は、特大の杯に酒をついで差し出した。\n\n 道隆はそれを7、8杯ほども飲み、上賀茂神社へ参拝に向かう途中で、車の後の方を枕に、眠り込んでしまったなど、『大鏡』には、道隆の酒にまつわる説話が綴られている。\n\n 道隆は疫病が大流行した長徳元年（995年）に43歳で死去するが、死因は疫病ではなく、酒の飲みすぎによる病だった。\n\n 亡くなる直前に、念仏を唱えるように勧められると、道隆は「済時、朝光なども極楽に往生しているだろうな」と飲み友達の名を口にしたことが、『大鏡』には記されている。\n\n きっと極楽でも三人で、飲み明かしていることだろう。\n■ 道兼は顔色が悪く、毛深い？ \n\n 藤原道兼は、応和元年（961）に生まれた。\n\n 弟の道長より5歳年上である。\n\n 『栄花物語』巻第三「さまざまのよろこび」では、道兼の外見について、「顔色が悪く、毛深く、ことのほか醜い」と称している。\n\n 気性については、「大変に老成していて男らしい」としつつ、「何となく恐ろしく感じるほど、意地悪く口やかましい」と記されている。\n\n また、長幼の序（年長者と年少者の間の守るべき秩序）を破り、兄の藤原道隆に意見したという。\n\n■ 花山天皇を欺いた？ \n\n 寛和2年（986）6月、本郷奏多が演じる花山天皇（968～1008 在位984～986）は、宮中を抜け出し、突然に出家した。\n\n 代わって、一条天皇が7歳で即位。\n\n 一条天皇の外祖父である、段田安則が演じる藤原兼家が摂政となるという、政変劇が起こった（寛和の変）。\n\n 一般に、これは一条天皇の即位を急ぐ藤原兼家が、道兼ら息子たちと図り、花山天皇を出家に追い込んだとみられている。\n\n 『大鏡』では、このとき道兼は、「自分も一緒に出家し、弟子となって仕える」と約束して信用させ、宮中から密かに脱出した花山天皇を出家へ導いている。\n■ 父親の供養を拒んだ？ \n\n 道兼の父・兼家は、正暦元年（990）5月、道隆に関白の座を譲ると、7月に亡くなった。\n\n 『大鏡』によれば、道兼は父・兼家の四十九日の服喪には、土殿（喪中に籠もる場所）にも入らず、読経も念仏も唱えなかった。\n\n それだけではない。仲間を呼び寄せ、『後撰和歌集』や『古今和歌集』を広げて、即興の冗談や洒落を言って遊び、少しも嘆かなかった。\n\n その理由は、父・兼家が関白職を、兄・道隆に譲ったからだという。\n\n 「花山院を退位させたのは、この私だ。だから、関白職は私に譲るべきだ」というのが、道兼の主張である。\n\n 『大鏡』では、道兼の主張を「世間では通らない非常識な話」と断じている。\n\n■ 七日関白\n\n 長徳元年（995年）4月10日、道隆が死去すると、4月27日、一条天皇は道兼を関白の座につけた。\n\n 念願の関白職を手に入れた道兼だったが、同年5月8日、道兼も35歳で、この世を去った。道兼も病に冒されていたのだ。\n\n 世の人々はこれを、「七日関白」と称したという。\n■ 【藤原道隆、道兼ゆかりの地】\n\n ●豊楽院\n\n 平安京大内裏の朝堂院の西にある一角。節会や大宴会が行なわれた。\n\n 『大鏡』には、藤原道隆、道兼、道長の三兄弟は、五月下旬の、気味悪く大雨が降る夜に、花山天皇から肝試しを持ちかけられる説話が載っている。\n\n そのとき、道隆は豊楽院、道兼は仁寿殿の塗籠、道長は大極殿まで行くように命じられたが、道隆は得体の知れない声を聞き、途中で引き返した。\n\n ●仁寿殿\n\n 平安京内裏の中央にあった建物。もとは天皇の御座所。のちに、内宴や相撲などを行う場所となった。\n\n 前述の肝試しにおいて、道兼は仁寿殿の東側の敷石の辺りに、軒に届くほど背が高い人が立っているように見えて、やはり引き返している。\n鷹橋 忍,['https://newsatcl-pctr.c.yimg.jp/t/amd-img/20240122-00079038-jbpressz-000-1-view.jpg?exp=10800'],"['https://news.yahoo.co.jp/articles/8c79f4a2b1b2245825a5c4c5862d15aea5a91d87/images/000', 'https://jbpress.ismedia.jp/articles/gallery/79038?photo=2&utm_source=yahoonews&utm_medium=referral&utm_campaign=photo']"
