headline,mainEntityOfPage,image,datePublished,dateModified,author,media_en,media_jp,str_count,body,images,external_links
18歳の坂本怜がチャレンジャー大会で初の準決勝進出、次は望月慎太郎との日本人対決 [四日市チャレンジャー／テニス]（テニスマガジンONLINE）,https://news.yahoo.co.jp/articles/e4dd704e88b4176f50d9697365b18f5c46b36de4,https://newsatcl-pctr.c.yimg.jp/t/amd-img/20241129-00029872-tennismagv-000-1-view.jpg?exp=10800,2024-11-29T20:55:00+09:00,2024-11-29T20:55:00+09:00,テニスマガジンONLINE,tennismagv,テニスマガジンONLINE,1291,18歳の坂本怜がチャレンジャー大会で初の準決勝進出、次は望月慎太郎との日本人対決 [四日市チャレンジャー／テニス] 写真はオーストラリアン・オープン（オーストラリア・メルボルン）での坂本怜（誉高校）（Getty Images） 国内開催のATPツアー下部大会「四日市チャレンジャー」（チャレンジャー75／三重県四日市市・四日市テニスセンター／本戦11月25日～12月1日／賞金総額8万2000ドル／ハードコート）の本戦5日目は、単複の準々決勝計8試合が行われた。 ～【YouTube】Rei Sakamoto (坂本 怜) vs Kaichi Uchida (内田 海智) | YOKKAICHI 2024～ シングルスは望月慎太郎（木下グループ）、フィリップ・セクリッチ（オーストラリア）、予選勝者のクリストフ・ネグリツ（ドイツ）、ワイルドカード（主催者推薦枠）で出場した18歳の坂本怜（誉高校）が勝ち上がり、ベスト4が出揃った。準決勝では望月が坂本と、セクリッチはネグリツと対戦する。 ダブルスでは第2シードのトーマス・ファンカット（オーストラリア）／ヤクブ・ポール（スイス）、フィリップ・ヘニング／クリス・バン ワイク（ともに南アフリカ）、磯村志（やすいそ庭球部）／白石光（SBC メディカルグループ）、ワイルドカードを得て参戦した望月／坂本が準決勝に進出した。 11月30日(土)は10時30分から、男子シングルス準決勝2試合と男子ダブルス準決勝2試合＆決勝が行われる予定になっている。 ※名前の左に付いている数字はドロー番号、[ ]数字はシード順位、WCはワイルドカード（主催者推薦枠）、Qは予選勝者、Ret.は途中棄権 ＜本戦5日目◎11月29日｜試合結果＞ ■男子シングルス準々決勝 ○3望月慎太郎（日本／木下グループ）6-4 1-6 6-4 ●8リー・トゥ（オーストラリア）[6] ○10坂本怜（日本／誉高校）[WC] 6-4 7-6(3) ●13内田海智（日本／富士薬品） ○22フィリップ・セクリッチ（オーストラリア）6-3 6-1 ●17清水悠太（日本／三菱電機）[8] ○31クリストフ・ネグリツ（ドイツ）[Q] 4-1 Ret. ●27ベンジャミン・ハッサン（レバノン） ■男子ダブルス準々決勝 ○4フィリップ・ヘニング／クリス・バン ワイク（南アフリカ）4-6 6-2 [12-10] ●1ナム・ジソン／マシュー クリストファー・ロミオス（韓国／オーストラリア）[1] ○7磯村志／白石光（やすいそ庭球部／SBC メディカルグループ）7-6(13) 6-2 ●6羽澤慎治／田口涼太郎（JCRファーマ／Team REC） ○9望月慎太郎／坂本怜（木下グループ／誉高校）[WC] 3-6 7-6(3) [10-7] ●12アレクサンダー・メリノ／クリストフ・ネグリツ（ペルー／ドイツ）[4] ○16トーマス・ファンカット／ヤクブ・ポール（オーストラリア／スイス）[2] 5-7 6-4 [10-8] ●14楠原悠介／中川舜祐（伊予銀行） テニスマガジン編集部,[],[]
シフィオンテクのドーピング違反が判明、重大な過失または怠慢なしと判断されて1ヵ月の出場停止処分に [テニス]（テニスマガジンONLINE）,https://news.yahoo.co.jp/articles/cf17af0d529e730a200b066ea1f560b839676eb3,https://newsatcl-pctr.c.yimg.jp/t/amd-img/20241129-00029870-tennismagv-000-1-view.jpg?exp=10800,2024-11-29T18:00:00+09:00,2024-11-29T18:00:00+09:00,テニスマガジンONLINE,tennismagv,テニスマガジンONLINE,828,シフィオンテクのドーピング違反が判明、重大な過失または怠慢なしと判断されて1ヵ月の出場停止処分に [テニス] 「ビリージーンキングカップ by ゲインブリッジ ファイナルズ」（スペイン・マラガ）を前に行われた記者会見でのイガ・シフィオンテク（ポーランド）（Getty Images） テニスの不正を調査する団体であるインターナショナル・テニス・インテグリティ・エージェンシー（以下ITIA）が木曜日、女子テニス世界ランク2位のイガ・シフィオンテク（ポーランド）が8月に行われた薬物検査で禁止薬物が検出された件について1ヵ月の出場停止処分を受け入れたと発表した。 ～シフィオンテク選手が出場停止処分を受けた経緯などについて説明したインスタグラムの投稿はこちら～ 検査でトリメタジジン（血管を拡張して心臓の機能を穏やかにする作用がある薬）が検出されたシフィオンテクは規定に基づき9月22日に不服申し立ての権利を行使し、調査したところシフィオンテクが時差ぼけ解消を目的として服用していた薬にトリメタジジンが混入したことが原因であったと判明した。 この結果を考慮したITIAは選手の過失について「重大な過失または怠慢なし」の範囲で最低レベルであると判断し、出場停止処分を1ヵ月に留めた。 一連の流れの中でシフィオンテクには9月12日から10月4日まで暫定的な出場停止処分が科されており、その期間の3大会（ソウル、北京、武漢）に出場することができなかった。ITIAによると暫定の期間も処分に加算されるため、同選手の処分は12月4日で終了する。 なおシフィオンテクは検査の直後に出場したシンシナティ（WTA1000／ハードコート）で準決勝に進出したが、獲得した賞金は没収されることになる。 ITIAの決定を受けて女子テニス協会（WTA）は公式サイトとSNSを通して声明文を発表し、「WTAはこの困難な時期にイガを全面的にサポートする」と述べた。 テニスマガジン広告担当,[],[]
[最新JTAランキング／国内テニス] 2024年11月27日（2024年第48週）付（テニスマガジンONLINE）,https://news.yahoo.co.jp/articles/881830a5c70d7a748f628159f197b41854bbf0f0,https://newsatcl-pctr.c.yimg.jp/t/amd-img/20241129-00029862-tennismagv-000-1-view.jpg?exp=10800,2024-11-29T15:00:00+09:00,2024-11-29T15:00:00+09:00,テニスマガジンONLINE,tennismagv,テニスマガジンONLINE,3409,"[最新JTAランキング／国内テニス] 2024年11月27日（2024年第48週）付 日本テニス協会が2024年第48週のJTAランキング（JTAオフィシャルポイントランキング）を公開（Getty Images） 公益財団法人日本テニス協会（JTA）が11月27日(水)、国内テニスのランキングを更新した。JTAランキング（JTAオフィシャルポイントランキング）は原則として、過去52週間（1年）で獲得ポイントの多い20大会の成績を元に決定される。 ～国内大会にもご注目を！～国内主要大会表彰写真｜PHOTOアルバム ■一般男子シングルス｜11月27日付 順位（前週） 名前（所属） 総ポイント（前週総ポイント） 1.(1) 西岡良仁（ミキハウス） 153,800（153,800） 2.(2) ダニエル太郎（エイブル） 136,800（131,800） 3.(3) 錦織圭（ユニクロ） 115,600（90,600） 4.(4) 内山靖崇（積水化学工業） 86,400（83,200） 5.(6) トゥロター・ジェームズ（Shink） 64,600（58,200） 6.(5) 島袋将（有沢製作所） 59,400（66,600） 7.(7) 清水悠太（三菱電機） 52,400（53,800） 8.(11) 綿貫陽介（SBC メディカルグループ） 42,800（35,600） 9.(8) 今村昌倫（JCRファーマ） 40,600（40,400） 10.(9) 望月慎太郎（木下グループ） 39,000（39,800） 11.(10) 野口莉央（明治安田） 34,800（36,600） 12.(13) 磯村志（やすいそ庭球部） 28,680（25,880） 13.(12) 内田海智（富士薬品） 26,800（26,000） 14.(15) 守屋宏紀（安藤証券） 25,800（23,400） 15.(14) 中川直樹（SBC メディカルグループ） 25,400（25,000） 16.(16) 今井慎太郎（エキスパートパワーシズオカ） 22,600（21,000） 17.(18) 田口涼太郎（Team REC） 19,940（19,940） 18.(19) 熊坂拓哉（イカイ） 19,500（19,300） 19.(20) 松田龍樹（ノア・インドアステージ） 19,060（19,060） 20.(17) 白石光（SBC メディカルグループ） 17,300（20,300） ■一般女子シングルス｜11月27日付 順位（前週） 名前（所属） 総ポイント（前週総ポイント） 1.(1) 内島萌夏（安藤証券） 208,800（208,800） 2.(2) 柴原瑛菜（橋本総業ホールディングス） 110,800（110,800） 3.(3) 伊藤あおい（SBC メディカルグループ） 107,580（107,580） 4.(4) 本玉真唯（安藤証券） 106,800（106,800） 5.(5) 日比野菜緒（ブラス） 98,000（98,000） 6.(6) 齋藤咲良（富士薬品） 94,480（96,880） 7.(7) 石井さやか（ユニバレオ） 82,400（82,400） 8.(8) 岡村恭香（橋本総業ホールディングス） 57,000（61,000） 9.(10) 加治遥（島津製作所） 53,200（51,800） 10.(11) 坂詰姫野（橋本総業ホールディングス） 51,000（50,000） 11.(9) 清水綾乃（Team LB） 50,800（53,200） 12.(12) 山口芽生（フリー） 47,660（47,660） 13.(13) 清水映里（東通産業） 46,700（46,700） 14.(14) 佐藤南帆（三田興産） 41,000（41,000） 15.(15) 今村咲（EMシステムズ） 38,980（38,980） 16.(16) 佐藤光（アクロステニスアカデミー） 37,300（37,300） 17.(17) 倉持美穂（SBC メディカルグループ） 34,600（35,200） 18.(18) 松田美咲（エームサービス） 33,300（33,300） 19.(19) 西郷里奈（東急スポーツシステム） 31,460（31,460） 20.(21) 細木咲良（原商） 26,200（24,400） ■一般男子ダブルス｜11月27日付 順位（前週） 名前（所属） 総ポイント（前週総ポイント） 1.(4) 柚木武（イカイ） 120,800（93,800） 2.(1) 松井俊英（ASIA PARTNERSHIP FUND） 113,200（113,200） 3.(2) 上杉海斗（江崎グリコ） 108,680（108,680） 4.(3) トゥロター・ジェームズ（Shink） 108,200（108,200） 5.(6) 渡邉聖太（橋本総業ホールディングス） 97,000（82,600） 6.(5) 清水悠太（三菱電機） 91,400（91,400） 7.(7) 内田海智（富士薬品） 82,600（67,400） 8.(8) 松田龍樹（ノア・インドアステージ） 54,060（54,060） 9.(9) 今村昌倫（JCRファーマ） 43,380（36,180） 10.(11) 田口涼太郎（Team REC） 33,700（32,100） 11.(10) 楠原悠介（伊予銀行） 33,180（33,180） 12.(12) 野口莉央（明治安田） 31,800（31,800） 13.(13) 中川舜祐（伊予銀行） 29,004（29,004） 14.(14) 末岡大和（エキスパートパワーシズオカ） 26,600（26,200） 15.(15) 田島尚輝（やまやコミュニケーションズ） 25,560（25,560） 16.(16) 河内一真（橋本総業ホールディングス） 22,040（22,440） 17.(26) 片山翔（伊予銀行） 21,084（14,884） 18.(17) 齋藤惠佑（富士住建） 20,860（20,860） 19.(28) 羽澤慎治（JCRファーマ） 20,500（12,900） 20.(19) 市川泰誠（ノア・インドアステージ） 18,780（18,780） ■一般女子ダブルス｜11月27日付 順位（前週） 名前（所属） 総ポイント（前週総ポイント） 1.(1) 加藤未唯（ザイマックスグループ） 486,200（486,200） 2.(2) 穂積絵莉（日本住宅ローン） 472,600（480,600） 3.(3) 二宮真琴（エディオン） 459,600（464,600） 4.(5) 青山修子（近藤乳業） 412,000（412,000） 5.(4) 柴原瑛菜（橋本総業ホールディングス） 411,800（416,800） 6.(6) 内島萌夏（安藤証券） 169,000（169,000） 7.(7) 日比野菜緒（ブラス） 121,200（121,200） 8.(8) 佐藤南帆（三田興産） 94,980（94,980） 9.(10) 今村咲（EMシステムズ） 87,680（87,680） 10.(11) 桑田寛子（島津製作所） 78,000（78,000） 10.(9) 清水綾乃（Team LB） 78,000（94,800） 12.(12) 伊藤あおい（SBC メディカルグループ） 77,600（77,600） 13.(14) 松田美咲（エームサービス） 72,100（72,100） 14.(15) 阿部宏美（EMシステムズ） 70,080（70,080） 15.(16) 細木咲良（原商） 59,400（58,200） 16.(13) 小堀桃子（橋本総業ホールディングス） 59,380（76,380） 17.(20) 内藤祐希（亀田製菓） 59,000（52,400） 18.(17) 林恵里奈（セーレン） 58,800（56,600） 19.(19) 森崎可南子（橋本総業ホールディングス） 56,700（54,700） 20.(18) 瀬間詠里花（橋本総業） 55,660（55,660） テニスマガジン編集部",[],[]
シングルスは増田潤之介（札幌国際大2年）と松本萌恵（北海道大2年）が2連覇を達成 [北海道学生選抜室内テニス選手権大会]（テニスマガジンONLINE）,https://news.yahoo.co.jp/articles/c1e8dbc39350b2c3f0a9c0e7a6a1905c6303e766,https://newsatcl-pctr.c.yimg.jp/t/amd-img/20241129-00029853-tennismagv-000-1-view.jpg?exp=10800,2024-11-29T12:20:00+09:00,2024-11-29T12:20:00+09:00,テニスマガジンONLINE,tennismagv,テニスマガジンONLINE,1041,シングルスは増田潤之介（札幌国際大2年）と松本萌恵（北海道大2年）が2連覇を達成 [北海道学生選抜室内テニス選手権大会] 「令和6年度北海道学生選抜室内テニス選手権大会」（北海道・宮の沢屋内競技場）のシングルスで優勝を飾った増田潤之介（札幌国際大学2年／左）と松本萌恵（北海道大学2年）（写真提供◎北海道学生テニス連盟） 北海道学生テニス連盟が主催する「令和6年度北海道学生選抜室内テニス選手権大会」（11月20～24日／北海道札幌市・宮の沢屋内競技場／室内カーペットコート）が開催され、各種目のチャンピオンが決定した。 【表彰写真】男子ダブルス優勝の大竹創／池田陸人（北海学園大学） [令和6年度北海道学生選抜室内テニス選手権大会] 男子シングルス決勝は第3～4シードの増田潤之介（札幌国際大学2年）が池田陸人（北海学園大学1年）を6-1 6-2で下し、トップ2シードの対戦となった女子シングルス決勝は第1シードの松本萌恵（北海道大学2年）が第2シードの駒井乙姫（北翔大学2年）を6-2 6-3で倒してそれぞれ2連覇を達成した。 ダブルスは男子が第1シードの大竹創（北海学園大学2年）／池田、女子は藤井菜名（北海道教育大学札幌校2年）／駒井が優勝を飾った。 今大会は男子シングルス16ドロー、女子シングルス11ドロー、男子ダブルス8ドロー、女子ダブルス6ドローで争われた。 ※名前の左に付いている数字はドロー番号、[ ]数字はシード順位 ＜上位の試合結果＞ ■男子シングルス決勝 ○5増田潤之介（国際大）[3-4] 6-1 6-2 ●9池田陸人（学園大） ■男子シングルス準決勝 ○5増田潤之介（国際大）[3-4] 6-3 6-1 ●1水上倭（樽商大）[1] ○9池田陸人（学園大）6-3 6-2 ●13石川渓太（樽商大） ■女子シングルス決勝 ○1松本萌恵（北大）[1] 6-2 6-3 ●16駒井乙姫（北翔大）[2] ■女子シングルス準決勝 ○1松本萌恵（北大）[1] 6-0 6-0 ●5佐藤菜々子（北翔大）[3-4] ○16駒井乙姫（北翔大）[2] 6-1 6-0 ●12植野彩子（北大）[3-4] ■男子ダブルス決勝 ○1大竹創／池田陸人（学園大）[1] 6-3 6-3 ●8水上倭／藤原陽彩（樽商大／札大）[2] ■女子ダブルス決勝 ○8藤井菜名／駒井乙姫（札教大／北翔大）6-7(4) 6-4 [10-7] ●1松本萌恵／植野彩子（北大）[1] テニスマガジン編集部,[],[]
石井さやかが1ゲームしか落とさず快勝、シングルス8強＆ダブルス4強が出揃う [横浜慶應チャレンジャー国際テニストーナメント supported by 三田興産]（テニスマガジンONLINE）,https://news.yahoo.co.jp/articles/426b4266f7b3bd14c479b121eb251a47cc8f4ba5,https://newsatcl-pctr.c.yimg.jp/t/amd-img/20241129-00029869-tennismagv-000-1-view.jpg?exp=10800,2024-11-29T07:30:00+09:00,2024-11-29T07:30:00+09:00,テニスマガジンONLINE,tennismagv,テニスマガジンONLINE,1713,石井さやかが1ゲームしか落とさず快勝、シングルス8強＆ダブルス4強が出揃う [横浜慶應チャレンジャー国際テニストーナメント supported by 三田興産] 「横浜慶應チャレンジャー国際テニストーナメント supported by 三田興産」（神奈川・慶應義塾大学日吉キャンパス蝮谷テニスコート）で女子シングルス準々決勝に進出した石井さやか（ユニバレオ）（写真提供◎横浜慶應チャレンジャー広報部） 国内で開催される国際テニス連盟（ITF）の女子ツアー下部大会「横浜慶應チャレンジャー国際テニストーナメント supported by 三田興産」（ITFワールドテニスツアーW50／神奈川県横浜市・慶應義塾大学日吉キャンパス蝮谷テニスコート／本戦11月26日～12月1日／賞金総額4万ドル／ハードコート）の本戦3日目は、女子シングルス2回戦8試合と女子ダブルス準々決勝4試合が行われた。 ～【YouTube】Sayaka Ishii (石井 さやか) vs Saki Imamura (今村 咲) | YOKOHAMA ITF 2024～ シングルスは第1シードの伊藤あおい（SBC メディカルグループ）、ディフェンディング・チャンピオンで第2シードのアリオナ・ファレイ（ベラルーシ）、第3シードの石井さやか（ユニバレオ）、第5シードのヒナ・イノウエ（アメリカ）、第6シードのキャロル・ジャオ（カナダ）、第8シードの加治遥（島津製作所）、リャン・エンシュオ（台湾）、予選勝者の川口夏実（Radius7）が勝ち上がり、ベスト8が出揃った。 準々決勝では伊藤がイノウエと、ファレイがジャオと、石井がリャンと、加治は川口と対戦する。 ダブルスでは第1シードのリャン／パク・ソヒョン（韓国）、第3シードの小堀桃子（橋本総業ホールディングス）／清水綾乃（Team LB）、第4シードのチョウ・イシュアン／チョウ・イーツェン（ともに台湾）、ワイルドカード（主催者推薦枠）で出場した中島玲亜／大橋麗美華（ともに慶應義塾大学）が準決勝に進出した。 11月29日(金)は10時00分から女子シングルス準々決勝4試合、14時00分以降に女子ダブルス準決勝2試合が行われる予定になっている。 ※名前の左に付いている数字はドロー番号、[ ]数字はシード順位、WCはワイルドカード（主催者推薦枠）、Qは予選勝者 ＜本戦3日目◎11月28日｜試合結果＞ ■女子シングルス2回戦 ○1伊藤あおい（日本／SBC メディカルグループ）[1] 6-1 6-3 ●3ビクトリア・ムボコ（カナダ） ○8ヒナ・イノウエ（アメリカ）[5] 不戦勝 ●6イ・ウンヘ（韓国）[Q] ○10川口夏実（日本／Radius7）[Q] 6-1 5-7 6-4 ●12バク・ダヨン（韓国） ○16加治遥（日本／島津製作所）[8] 6-2 6-3 ●14秋田史帆（日本／テニスラウンジ）[Q] ----- ○18リャン・エンシュオ（台湾）6-1 6-2 ●20キラ・パブロワ（ロシア） ○24石井さやか（日本／ユニバレオ）[3] 6-1 6-0 ●22今村咲（日本／EMシステムズ） ○25キャロル・ジャオ（カナダ）[6] 2-6 7-6(4) 6-4 ●27西村佳世（日本／安藤証券）[Q] ○32アリオナ・ファレイ（ベラルーシ）[2] 6-2 6-2 ●29リー・ペイチー（台湾） ■女子ダブルス準々決勝 ○1リャン・エンシュオ／パク・ソヒョン（台湾／韓国）[1] 6-1 6-2 ●3鮎川真奈／リー・ペイチー（ロイヤルSCテニスクラブ／台湾） ○5チョウ・イシュアン／チョウ・イーツェン（台湾）[4] 不戦勝 ●7東谷和／イ・ウンヘ（河内庭球倶楽部／韓国） ○12小堀桃子／清水綾乃（橋本総業ホールディングス／Team LB）[3] 6-3 4-6 [10-2] ●9川口夏実／佐藤南帆（Radius7／三田興産） ○15中島玲亜／大橋麗美華（慶應義塾大学）[WC] 6-2 2-6 [12-10] ●13相川真侑花／川村茉那（テニスユナイテッド／フジキン） テニスマガジン編集部,[],[]
