headline,mainEntityOfPage,image,datePublished,dateModified,author,media_en,media_jp,str_count,body,images,external_links
本宮市で下草火災　身元不明の男性の遺体見つかる・福島（福島中央テレビ）,https://news.yahoo.co.jp/articles/a161a01f781580e89684f7417e770edad478db1e,https://newsatcl-pctr.c.yimg.jp/t/amd-img/20260221-09324843-fct-000-2-view.jpg?exp=10800,2026-02-21T23:05:00+09:00,2026-02-21T23:09:16+09:00,福島中央テレビ,fct,福島中央テレビ,209,"FCT福島中央テレビ
21日午後3時半過ぎ、本宮市で下草火災があり、男性1人が死亡しました。

火事があったのは本宮市岩根の田んぼで、21日午後3時半過ぎ消防に通報がありました。

火は約15分後に消し止められましたが、現場から身元不明の男性の遺体が見つかりました。

警察によりますと、男性は草刈りをしていたとみられ、何らかの理由で火事に巻き込まれ死亡したとみられています。

警察が火事の原因を詳しく調べています。",[],[]
「作品が大好き」大ゴッホ展　初日から多くの人でにぎわい・福島（福島中央テレビ）,https://news.yahoo.co.jp/articles/9e0fa3566982eb1f2c804e27e560a427d92c95bb,https://newsatcl-pctr.c.yimg.jp/t/amd-img/20260221-02514176-fct-000-2-view.jpg?exp=10800,2026-02-21T17:48:00+09:00,2026-02-21T17:57:19+09:00,福島中央テレビ,fct,福島中央テレビ,369,"FCT福島中央テレビ
福島市の県立美術館では、大ゴッホ展が開幕し、世界的名画を楽しもうと、初日から多くの人が訪れています。

■来場者
「すごくこの作品が大好きで、自宅にも同じ絵を飾っているくらい。楽しみでワクワクしている。はやく見たい」

「大ゴッホ展 夜のカフェテラス」は、福島県政150周年と東日本大震災の発生から15年にあわせて、開催されました。

初日の21日は、開場前から長い列ができ、訪れた人が、待ちに待った、世界的名画を楽しんでいました。

今回の展覧会では、タイトルにもなっている「夜のカフェテラス」など、ゴッホ作品57点はもちろん。印象派の巨匠ルノワールの作品など、あわせて74点が展示されています。

名画の数々が楽しめる「大ゴッホ展」は5月10日までです。

休館日:月曜日（2/23、5/4は開館）2/24（火）",[],[]
「教育の更なる充実にまい進する」桜の聖母学院の新校舎が完成・福島（福島中央テレビ）,https://news.yahoo.co.jp/articles/87c0b9e09f096416974f31df118f37ba048f929e,https://newsatcl-pctr.c.yimg.jp/t/amd-img/20260221-09531429-fct-000-2-thumb.jpg?exp=10800,2026-02-21T17:47:00+09:00,2026-02-21T17:50:21+09:00,福島中央テレビ,fct,福島中央テレビ,290,"FCT福島中央テレビ
福島市にある桜の聖母学院の新校舎が完成し、落成式が行われました。

桜の聖母学院は4月から男女共学の小中一貫校を開設します。
それに伴い、中学校の校舎を福島市花園町にある小学校の隣に新築しました。

新校舎は2階建てで、県産の木材が使われ木のぬくもりが感じられる交流ホールもあります。

21日は新校舎の落成式が行われ、関係者らが新たな学び舎の完成を祝いました。

■桜の聖母学院 西内みなみ 理事長
「私たちは、この素晴らしい環境に恥じぬよう、教育の更なる充実にまい進することをお誓いいたします」

落成式の後、生徒たちも完成した校舎を見学して回りました。",[],[]
酒気帯び運転の疑いで男(62)を現行犯逮捕　交通事故を起こし酒気帯びの疑いが明らかに・福島（福島中央テレビ）,https://news.yahoo.co.jp/articles/8f4745cf99681ff338ce16faea93e6855d4b0501,https://newsatcl-pctr.c.yimg.jp/t/amd-img/20260221-06536368-fct-000-1-view.jpg?exp=10800,2026-02-21T10:35:00+09:00,2026-02-21T10:35:00+09:00,福島中央テレビ,fct,福島中央テレビ,274,"FCT福島中央テレビ
酒気帯び運転の疑いで、郡山市の無職の男(62)が現行犯逮捕されました。

酒気帯び運転の疑いで現行犯逮捕されたのは、郡山市の無職の男(62)です。

警察によりますと男は、20日の夕方、酒気を帯びた状態で車を運転し、郡山市名倉の店舗駐車場から市道に左折して出ようとした際に、停止していた車に衝突。その車を対向車線に押し出して、さらに走ってきた車に衝突させる交通事故を起こしたとされています。

交通事故の届けを受けて、警察が捜査したところ、男の酒気帯び運転の疑いが明らかになったということです。警察が詳しい調べを進めています。",[],[]
ガソリンスタンドの地面に頭をたたきつけケガをさせたか…無職の男(56)を逮捕・福島（福島中央テレビ）,https://news.yahoo.co.jp/articles/a6c107d1dd66418783affb6a30036cfff9afa70c,https://newsatcl-pctr.c.yimg.jp/t/amd-img/20260221-09938882-fct-000-1-view.jpg?exp=10800,2026-02-21T10:28:00+09:00,2026-02-21T10:28:00+09:00,福島中央テレビ,fct,福島中央テレビ,251,"FCT福島中央テレビ
棚倉町のガソリンスタンドの敷地内で男性に暴行を加え、けがをさせた疑いで50代の無職の男が逮捕されました。

傷害の疑いで逮捕されたのは、茨城県に住む住所不定無職の男(56)です。

警察によりますと男は、2025年12月の日中、棚倉町のガソリンスタンドの敷地内で、20代の男性に対して頭部を地面にたたきつけるなどの暴行を加え、打撲などのけがをさせた疑いが持たれています。

被害者からの届出を受けて、警察が捜査したところ、男の犯行の疑いが明らかになり、逮捕に至ったということです。",[],[]
「財布を落としたのでキャッシュカードを渡してほしい」詐欺容疑で18歳の男を緊急逮捕・福島（福島中央テレビ）,https://news.yahoo.co.jp/articles/3a4ad8ec9da9078ec5d0f31996c66361f4df048e,https://newsatcl-pctr.c.yimg.jp/t/amd-img/20260221-05892584-fct-000-2-view.jpg?exp=10800,2026-02-21T10:14:00+09:00,2026-02-21T10:39:15+09:00,福島中央テレビ,fct,福島中央テレビ,306,"FCT福島中央テレビ
南相馬市内の女性からキャッシュカードをだまし取ろうとした疑いで、18歳の男が緊急逮捕されました。

詐欺の疑いで緊急逮捕されたのは、神奈川県藤沢市の自称アルバイトの男(18)です。

警察によりますと、男は他の者と共謀の上、南相馬市内に住む女性(80代)の親族などになりすまして、キャッシュカードをだまし取ろうと考え、20日他の者が女性の元に電話をかけ「財布を落としたのでキャッシュカードを渡してほしい」などと話した上で、女性からキャッシュカード2枚をだまし取った疑いです。

不審者情報の提供を受けて、警察が捜査したところ被疑者の犯行の疑いが明らかになり、緊急逮捕に至ったということです。",[],[]
喜多方市木造の建物が隣接する住宅街で火事…現場から遺体見つかる　約10時間後に鎮火・福島（福島中央テレビ）,https://news.yahoo.co.jp/articles/189c527f05fe93b8d76f422fea458a4dce928e6d,https://newsatcl-pctr.c.yimg.jp/t/amd-img/20260221-02478145-fct-000-2-thumb.jpg?exp=10800,2026-02-21T09:52:00+09:00,2026-02-21T13:58:21+09:00,福島中央テレビ,fct,福島中央テレビ,285,"FCT福島中央テレビ
21日、喜多方市で起きた火事は発生から約10時間後に火が消し止められましたが、焼け跡から1人の遺体が見つかりました。

この火事はきのう午後2時過ぎ、喜多方市緑町で発生し、住宅など少なくとも10棟が焼けました。

出火から約10時間後の20日午後11時ごろに、消し止められましたが、木村正人さん(89)が住む住宅から1人の遺体が見つかりました。

警察は21日実況見分を行い、出火した状況や火がどれだけの範囲に燃え広がったのかなど調べを進めています。

また、見つかった遺体の身元の確認も急いでいます。

現場は古い木造の建物が隣接する住宅街です。",[],[]
