headline,mainEntityOfPage,image,datePublished,dateModified,author,media_en,media_jp,str_count,body,images,external_links
女子中学生の買春をあっ旋か　警備員の男（30）を再逮捕　横浜（tvkニュース（テレビ神奈川））,https://news.yahoo.co.jp/articles/1b5a3b2f5a0ad2d5ea51b27949553e65cb1f9aaf,https://newsatcl-pctr.c.yimg.jp/t/amd-img/20260204-00010007-tvkv-000-1-view.jpg?exp=10800,2026-02-04T22:38:54+09:00,2026-02-04T22:38:54+09:00,tvkニュース（テレビ神奈川）,tvkv,tvkニュース（テレビ神奈川）,338,"伊勢佐木警察署
女子中学生を知人の男と引き合わせてみだらな行為をさせたなどとして、神奈川県警は警備員の男を再逮捕しました。

児童福祉法違反と児童買春の疑いで再逮捕されたのは、東京都の警備員の30歳の男です。 

県警によりますと、男（30）は2023年、知人の男に当時中学3年生だった女子生徒の連絡先を教えるなどして引き合わせてみだらな行為をさせ、児童買春をあっ旋した疑いが持たれています。 

男は女子生徒とSNSを通じて知り合ったということで、その後、「パパ活を募集している子がいるよ」などと女子生徒の連絡先を男に教えたということです。 

調べに対して男は容疑を認めているということです。
 
あっ旋された男は、この女子生徒への児童買春の疑いですでに逮捕されています。",[],[]
横浜市　山中市長のパワハラ疑惑めぐり・・第三者による調査実施へ（tvkニュース（テレビ神奈川））,https://news.yahoo.co.jp/articles/70a6b995d150f286b528216296fc8d07d760c419,https://newsatcl-pctr.c.yimg.jp/t/amd-img/20260204-00010006-tvkv-000-1-thumb.jpg?exp=10800,2026-02-04T22:30:42+09:00,2026-02-04T22:30:42+09:00,tvkニュース（テレビ神奈川）,tvkv,tvkニュース（テレビ神奈川）,424,"横浜市の現役職員による山中市長のパワハラと疑われる言動の告発で、市が第三者による調査の実施に向け、神奈川県弁護士会に委員の推薦を依頼したと発表しました。

この問題は、現役の市職員が山中市長の言動に人権意識を欠いているものがあるとして、市長に是正を求めているものです。 

山中市長は報道陣の取材に対し、一部の暴言は事実であると認め謝罪していました。 

一連の事態を受け、市会は先月28日の本会議で第三者による調査などを求める議員提案を全会一致で可決。 
この可決を受け、市は4日、第三者による調査の実施を正式に決定し、県弁護士会に調査を行う委員3人の推薦を依頼したと発表しました。 

目的は、1月市職員が告発した、●パワハラが疑われる言動●深夜・休日に対応を求める業務連絡など、5つの項目についての事実関係の調査や認定、評価です。 

市は、委員の決定から3カ月を目安に調査期間を設定し、調査の手法や範囲などは委員の判断に委ねるとしています。",[],[]
【衆院選2026注目選挙区】神奈川2区 / 横浜市西区・南区・港南区 大物議員引退で新人5人争う（tvkニュース（テレビ神奈川））,https://news.yahoo.co.jp/articles/1c80dc68b70f19b90db5e15719b76c338f1b8f35,https://newsatcl-pctr.c.yimg.jp/t/amd-img/20260204-00010005-tvkv-000-1-thumb.jpg?exp=10800,2026-02-04T19:08:29+09:00,2026-02-04T19:08:29+09:00,tvkニュース（テレビ神奈川）,tvkv,tvkニュース（テレビ神奈川）,69,"tvkニュース(テレビ神奈川)
連日お伝えしている衆議院選挙の注目区シリーズ。

大物議員の引退で新人5人が争う神奈川2区をお伝えします。",[],[]
相模灘沿岸の海岸保全計画　改定に向けて有識者などが懇談会（tvkニュース（テレビ神奈川））,https://news.yahoo.co.jp/articles/7eaafebb7bc3df9d329e89da8984572e09a2d43d,https://newsatcl-pctr.c.yimg.jp/t/amd-img/20260204-00010004-tvkv-000-1-thumb.jpg?exp=10800,2026-02-04T18:56:47+09:00,2026-02-04T18:56:47+09:00,tvkニュース（テレビ神奈川）,tvkv,tvkニュース（テレビ神奈川）,425,"tvkニュース(テレビ神奈川)
県が進める「相模灘沿岸海岸保全基本計画」の改定に向けて、有識者などによる懇談会が開かれました。

相模灘沿岸海岸保全基本計画は、三浦半島の先端から静岡県境までの沿岸部を高潮や津波、海岸侵食などから守るとともに、適正な利用などを図るため、海岸法に基づいて県が定めています。 

日本大学　近藤健雄名誉教授
「市民・県民に意見を聞いて、これをより良いものにしていくことが今回の役割」

この計画は、海面上昇や台風の激甚化など気候変動の影響を反映させるため、およそ10年ぶりに見直しが進められ、県は、去年12月からことし1月にかけて計画の改定素案についてパブリックコメントを募集。 

4日に開かれた第2回の懇談会では、学識者や海岸利用者が集い、寄せられた5件の意見を踏まえて議論が行われました。 

県は今後、沿岸自治体の首長の意見聴取などを経て、3月下旬に改定した計画を公表する予定です。
tvkニュース(テレビ神奈川)",[],[]
ヤミ金グループの男5人を再逮捕　法定の最大約140倍の利息受け取ったか（tvkニュース（テレビ神奈川））,https://news.yahoo.co.jp/articles/9e708c41a1bb2015bef99626c7fb3e6e552e4525,https://newsatcl-pctr.c.yimg.jp/t/amd-img/20260204-00010003-tvkv-000-1-thumb.jpg?exp=10800,2026-02-04T18:54:32+09:00,2026-02-04T18:54:32+09:00,tvkニュース（テレビ神奈川）,tvkv,tvkニュース（テレビ神奈川）,507,"tvkニュース(テレビ神奈川)
最大で法定金利のおよそ140倍の利息を受け取ったとして、ヤミ金グループの男5人が再逮捕されました。

出資法違反の疑いで再逮捕されたのは、平子将人容疑者54歳ら5人です。 

県警によりますと、5人は、おととし2月から9月にかけて30代から50代の男女13人に対して無許可でおよそ100万円を貸し付け、法定金利のおよそ23倍から140倍の利息を受け取った疑いが持たれています。 

5人は、金を返せなくなった一部の債務者に、1回あたり1万円の報酬を与えて違法な貸金業などで得た現金を指定した場所に宅配便を利用して送らせたり、その送り先から現金を運搬させたりしたということです。 

県警は、この行為に加担したとして債務者6人を組織犯罪処罰法違反の疑いで書類送検していて、6人は「報酬欲しさにヤミ金の仕事を手伝ってしまった」などと容疑を認めているということです。 

5人は、2010年から14年間で延べおよそ9800人に現金を貸し付け、およそ12億円の利益を得ていたとみられていて、ことし1月、登録せずに貸金業を営んだとして県警に逮捕されていました。
tvkニュース(テレビ神奈川)",[],[]
【特殊詐欺警報】2月4日午前11時半現在（tvkニュース（テレビ神奈川））,https://news.yahoo.co.jp/articles/9cf6723d0cdf920528db8ecd429a48e6b7afc7e5,https://newsatcl-pctr.c.yimg.jp/t/amd-img/20260204-00010002-tvkv-000-1-view.jpg?exp=10800,2026-02-04T13:27:39+09:00,2026-02-04T13:27:39+09:00,tvkニュース（テレビ神奈川）,tvkv,tvkニュース（テレビ神奈川）,215,"【特殊詐欺警報】2月4日午前11時半現在
2月4日、神奈川県内で発生している特殊詐欺の情報です。

神奈川県警によりますと、これまでに川崎市宮前区平、麻生区金程、藤沢市羽鳥で詐欺の電話がかかってきています。 

内容は警察官をかたって「あなたが詐欺グループに関わっている」や配送業者をかたって「保管期間の過ぎた荷物がある」などです。 
その電話は詐欺です。 すぐに電話を切り警察に連絡してください。
tvkニュース(テレビ神奈川)",[],[]
「立春朝搾り」出荷　厚木市の黄金井酒造（tvkニュース（テレビ神奈川））,https://news.yahoo.co.jp/articles/7db132cd15ead5fa799fbc98e1e495f4e67381b1,https://newsatcl-pctr.c.yimg.jp/t/amd-img/20260204-00010001-tvkv-000-1-thumb.jpg?exp=10800,2026-02-04T13:27:38+09:00,2026-02-04T13:27:38+09:00,tvkニュース（テレビ神奈川）,tvkv,tvkニュース（テレビ神奈川）,484,"tvkニュース(テレビ神奈川)
2月4日は立春。厚木市の酒蔵では春の到来を祝おうと、搾りたての新酒を出荷する準備が進められました。

「立春朝搾り」。 厚木市七沢にある創業208年の酒蔵黄金井酒造では、県内の酒屋に新酒を手渡す朝を迎えました。 

これは、立春の日に合わせて搾りたての酒を出荷し客に提供するもので、全国の蔵元や酒屋が加盟する日本名門酒会が企画しています。 

神奈川県内では黄金井酒造が参加していて、出荷の前におはらいが行われ関係者の無病息災などを祈願しました。 

ことしは、正月明けから準備が進められてきましたが、立春当日に仕上げるため「杜氏泣かせ」と言われるほど管理と調整が難しいということです。 

黄金井酒造・黄金井陽介専務
「立春朝搾りに関しては仕上がる日が必ずここと決まっている商品。 お酒の管理、もろみの管理、発酵の管理はやはりすごく難しい。 立春という季節に絡んだ商品でもあるので春の雰囲気を味わいながら飲んでいただくとすごくうれしい」

立春朝搾りの販売は、日本名門酒会のホームページで確認できます。
tvkニュース(テレビ神奈川)",[],[]
特殊詐欺グループの資金洗浄役か　男女6人逮捕　数億円をマネロンか（tvkニュース（テレビ神奈川））,https://news.yahoo.co.jp/articles/7f686caa79a38b78776453ae735181bdf3e3ae7f,https://newsatcl-pctr.c.yimg.jp/t/amd-img/20260204-00010000-tvkv-000-1-thumb.jpg?exp=10800,2026-02-04T13:27:37+09:00,2026-02-04T13:27:37+09:00,tvkニュース（テレビ神奈川）,tvkv,tvkニュース（テレビ神奈川）,449,"tvkニュース(テレビ神奈川)
特殊詐欺の被害金をマネーロンダリングしたとして、神奈川県警は「資金洗浄役」の男女6人を逮捕しました。

詐欺の疑いで逮捕されたのは、兵庫県の無職福井かおり容疑者（49）ら男女6人です。 

県警によりますと福井容疑者ら6人は2022年、岐阜県に住む60代の男性に通信会社の職員などをかたり「アプリの未納料金がある」などとうその電話をかけ、現金あわせて1550万円をだまし取った疑いが持たれています。

 6人は暗号資産に変えられた特殊詐欺の被害金を別の暗号資産に変える「資金洗浄役」とみられ、いずれも面識があったとみられています。 

中でも福井容疑者は、5人に秘匿性の高い通信アプリでマネーロンダリングの依頼をしていたとみられています。 

県警は6人の認否を明らかにしていません。 

このグループは、少なくとも特殊詐欺の被害に遭った数十人の被害金、数億円のマネーロンダリングに関わっていたとみられ、県警が全容解明を進めています。
tvkニュース(テレビ神奈川)",[],[]
