headline,mainEntityOfPage,image,datePublished,dateModified,author,media_en,media_jp,str_count,body,images,external_links
土掘って、幼虫探し夢中　長井、カブトムシ育てる教室（山形新聞）,https://news.yahoo.co.jp/articles/697e4ace7018b2e94bf3f7fda917e38847115cfb,https://newsatcl-pctr.c.yimg.jp/t/amd-img/20260522-00000005-yamagatan-000-1-view.jpg?exp=10800,2026-05-22T10:14:39+09:00,2026-05-22T10:14:39+09:00,山形新聞,yamagatan,山形新聞,327,土を掘り起こしてカブトムシの幼虫を探す子どもたち＝長井市 親子体験事業「カブトムシを育てる教室」が16日、長井市のエコファーム長井（梅津博之社長）で開かれ、子どもたちが幼虫探しに夢中になった。 小学生と幼児、保護者ら約30人が参加し、腐葉土が堆積した場所でカブトムシの幼虫を探した。昨年に比べると数は少なめで、汗をかきながら懸命に土を掘り起こした。そのかいあって幼虫が見つかると、子どもも大人も大喜び。持参した容器に入れて持ち帰った。 同社の梅津社長が飼育の注意点などをアドバイスした。長井小1年佐藤史哉さん（6）は「かっこよく育てたい」と話した。 教室は市中央コミュニティセンターが毎年開催している。7月には成虫を持ち寄って「ちからくらべ大会」を開く。,[],[]
魅力詰まったアフタヌーンティー　米沢・川西産食材で映えカフェ、24日に限定提供（山形新聞）,https://news.yahoo.co.jp/articles/d6f6a926a3041e0f5774a63401a513b7415dee1d,https://newsatcl-pctr.c.yimg.jp/t/amd-img/20260522-00000004-yamagatan-000-2-view.jpg?exp=10800,2026-05-22T10:07:10+09:00,2026-05-22T11:35:50+09:00,山形新聞,yamagatan,山形新聞,681,地元農産物を使い、24日に限定提供するアフタヌーンティーセットのメニュー＝米沢市・銘菓の錦屋米沢金池店 米沢市の大学生と地元の菓子店や農家が協力し、米沢・川西産の果物や野菜の魅力が詰まったアフタヌーンティーセットを24日に限定提供する。フルーツ風味のようかんや野菜スープなど地場農産物の味わいが詰まったセットメニューを楽しめる。 「映えカフェプロジェクト」に取り組む米沢栄養大と米沢女子短期大の学生、銘菓の錦屋（川西町、片倉望社長）、若手農家が地元農産物を新感覚で味わってもらおうと企画。米沢、川西両市町で生産された夏イチゴや舘山りんご、ブドウをジュレ状にしてようかんと合わせた「果実のようかんテリーヌ」、農園成（なる）（同市）のアスパラガスを使ったスープ、チーズと舘山りんごの焼き菓子など計9品を提供する。 スイーツは学生のイメージを片倉社長（42）がくみ取って考案した。アスパラスープは米沢牛の牛脂を使い、甘みやコクを加える学生の工夫が生かされている。 米沢栄養大3年西田朋美さん（20）と米沢女子短期大2年林崎紗來（さら）さん（19）は「地域の食材をこれまでにない形で届けたかった。予想以上の出来栄え」と笑顔を見せる。片倉社長は「いわば地産地消型のアフタヌーンティー。多くの人に味わってほしい」と話す。 会場は錦屋の米沢金池店で、28セット限定で提供する。時間帯を四つに分け、各回90分制。アフタヌーンティーセットにコーヒー付きが2980円、ドリンク飲み放題が3480円、飲み放題にようかんの土産が付くコースが3980円。要予約で、23日正午まで申し込む。,[],[]
「萩焼」伝統から革新まで　山形で展示会、人間国宝や若手作家の120点（山形新聞）,https://news.yahoo.co.jp/articles/11ed84985855e4a976696236634d98948505c696,https://newsatcl-pctr.c.yimg.jp/t/amd-img/20260522-00000003-yamagatan-000-1-view.jpg?exp=10800,2026-05-22T09:56:18+09:00,2026-05-22T09:56:18+09:00,山形新聞,yamagatan,山形新聞,304,「萩焼を多くの人に見てもらいたい」と話す野坂和左さん（右）＝山形市・県芸文美術館 萩焼の人間国宝から若手作家までの作品を集めた「萩名工陶芸逸品展」が21日、山形市の県芸文美術館で始まった。伝統的な淡い色合いや革新的な作風など、多彩な萩焼の魅力を伝えている。24日まで。 茶わんや皿、香炉など約120点が並ぶ。萩焼窯元「江月窯」（山口県萩市）の野坂和左さん（60）の作品は萩焼の伝統を継承しながら、色合いに黒の独自性を加えている。野坂さんは「さまざまな萩焼を見てほしい」と話す。 初代坂高麗左衛門、人間国宝・11代三輪休雪さん（故人）の作品も並ぶ。おもてなし席もある。午前10時～午後5時（最終日は午後4時）。,[],[]
ヒメサユリ、かれんに　大江・大山自然公園（山形新聞）,https://news.yahoo.co.jp/articles/13e5e80f8c26fd7063a2f83d3c4467393edb0db3,https://newsatcl-pctr.c.yimg.jp/t/amd-img/20260522-00000002-yamagatan-000-1-view.jpg?exp=10800,2026-05-22T09:52:23+09:00,2026-05-22T09:52:23+09:00,山形新聞,yamagatan,山形新聞,375,約６万株が群生する大山自然公園のヒメサユリ＝大江町 大江町の大山自然公園でヒメサユリが見頃を迎え、ピンクに色づいた約6万株の花が来場者を出迎えている。29～31日は「ユリまつり」が開かれる。 同公園のヒメサユリは、町の観光名所にしようと、1997年から地域住民や大江中生らが植栽した。来場者は散策路をゆっくりと歩きながら、咲いた花を眺めたり、写真を撮ったりして楽しんでいる。訪れた天童市鎌田1丁目、丹忠夫さん（73）は「昨年に引き続き訪れた。淡いピンク色の花びらがきれい」と話した。 全体では五分咲きの状態で、見頃は今月末までの見込み。ユリまつりでは、協力金を300円以上寄せた人を対象に、町内温泉の入浴券や道の駅おおえで使えるソフトクリーム券が当たる抽選会を開催する。参加賞として、町内の加盟店22カ所で使用できる200円分のクーポン券がもらえる。,[],[]
６月13日にワールド女子プロレス・ディアナ南陽大会　井上京子選手が来社（山形新聞）,https://news.yahoo.co.jp/articles/87e6744aa2f31f664064bb554d3558eb5f8250ef,https://newsatcl-pctr.c.yimg.jp/t/amd-img/20260522-00000001-yamagatan-000-1-view.jpg?exp=10800,2026-05-22T09:35:12+09:00,2026-05-22T09:35:12+09:00,山形新聞,yamagatan,山形新聞,409,南陽大会をＰＲする井上京子選手＝南陽市・山形新聞南陽支社 南陽市出身の女子プロレスラー井上京子選手（57）＝東京都＝が21日、同市の山形新聞南陽支社を訪れ、自身が代表を務める女子プロレス団体「ワールド女子プロレス・ディアナ」が来月13日に同市民体育館で開催する南陽大会をＰＲした。 ディアナは2011年に井上選手が旗揚げした団体で現在は11人が所属。当日はジャガー横田選手、アジャコング選手、庄内町出身の佐藤綾子選手、山形市出身の柳川澄樺選手など約20人が参戦する。井上選手は「地元での大会であり、特別な思いで臨む。豪華なメンバーをそろえたので、多くの人に応援に来てほしい」と意気込みを語った。 大会は午後1時開始。ＶＩＰチケット（正面最前列）が1万7千円、最前列席が1万円、リングサイド席が7千円、指定席が5千円。当日千円増し。チケットの購入や問い合わせは井上選手が経営する「あかゆ」山形店0238（40）2472。,[],[]
