headline,mainEntityOfPage,image,datePublished,dateModified,author,media_en,media_jp,str_count,body,images,external_links
能登半島地震の震源断層など海域の活断層調査へ　地域防災計画に反映めざす　富山県（北日本放送）,https://news.yahoo.co.jp/articles/e6e9932a9faec57e47b3444feb161872a8e03d69,https://newsatcl-pctr.c.yimg.jp/t/amd-img/20240830-03739852-knb-000-2-thumb.jpg?exp=10800,2024-08-30T20:19:00+09:00,2024-08-30T21:14:59+09:00,北日本放送,knb,北日本放送,768,\nKNB北日本放送\n県の地域防災計画について、県はこれまで陸地の活断層を想定していましたが、海域の活断層は想定していませんでした。\n\n能登半島地震を受けて県は被害想定を見直し、断層の調査を新たに行うことを決めました。\n\n県は30日、地震に関する有識者からの提言をもとに新たに調査を行う断層を決めました。\n\n現在の被害想定では県内や周辺の6つの断層帯について調査が行われました。\n\n呉羽山断層帯では最大で震度7となる地震が起きる地域があるとしていて、建物の全壊は9万棟あまり死者は4000人を超えるなどとしていました。\n\n今回、「起こり得る最悪の想定」のもと、こちらの断層帯などについて調査を行うとしました。\n\n能登半島地震の震源断層や七尾湾の断層帯など、これまで想定がなかった海域活断層を含めたほか、砺波平野や射水の断層など陸地の断層も加えます。\n\nまた、南海トラフ地震の影響も調査対象に含めるとしました。\n\n川崎一朗京都大学名誉教授\n「南海トラフの場合は時間的にも切迫度が大きい。倒壊件数も多くなり、液状化もより広範囲になる可能性があるということがあるので（調査対象に）選びました」\n\n今回、津波シミュレーションについても調査します。\n\nこれまでは海域の断層帯などについて調査し最大で入善町で10.2mの津波となる想定をしていました。\n\nこちらも断層帯が連動して揺れた場合のシミュレーションなどを、新たに実施するとしました。\n\nまた、建物の被害や人的被害などに限っていた被害想定を・水道、電気、道路といった公共・交通インフラや・公共交通 など、生活への影響についても被害想定を算出するとしています。\n\n県は30日の決定をもとに調査を進め、地域防災計画に反映させるとしています。,[],[]
【解説】台風10号　富山へ今後の影響は（北日本放送）,https://news.yahoo.co.jp/articles/840e842d5ec2cb33ff6d54e380c71b33175af106,https://newsatcl-pctr.c.yimg.jp/t/amd-img/20240830-02782849-knb-000-2-thumb.jpg?exp=10800,2024-08-30T20:20:01+09:00,2024-08-30T20:34:00+09:00,北日本放送,knb,北日本放送,641,\nKNB北日本放送\n（上野キャスター）\n今後の台風の影響について気象予報士の数家解説委員です。\n\n（数家解説委員）\n台風10号は、1日午前9時までに熱帯低気圧に変わります。\n\nしかし、暖かく湿った空気が流れ込みやすいため、県内では警報級の大雨が降る可能性があり警戒が必要です。\n\n台風10号は西日本を東に進み、9月1日午前9時までに熱帯低気圧に変わる見込みです。\n\nただ、予報円が大きくなっているため、予報の不確実性が大きいと言わざるを得ません。\n\n県内では、風よりも雨への警戒が必要です。\n\n31日から週明けの9月2日頃にかけてまとまった雨となり、31日昼過ぎからは1時間の最大降水量は30ミリの見込みです。\n\nまた、30日夕方から31日夕方までの24時間降水量は50ミリ、その後の24時間降水量は80ミリ、さらにその後の24時間降水量は150ミリと、次第に多くなる予想となっています。\n\nこれは熱帯低気圧となっても暖かく湿った空気が流れ込みやすくスピードが遅いため、影響が長く続くからです。\n\n進路によっては、警報級の大雨となるおそれがあります。\n\n風と波、高潮については今のところ、警報の可能性はありませんが、1日からは注意報が出る可能性があります。\n\n繰り返しになりますが台風10号は動きが遅く、予報円が大きくなっています。\n\n今後、予報が大きく変わる可能性がありますので、常に最新の情報を入手するようにしてください。,[],[]
個人住民税の定額減税で算定ミス　射水市（北日本放送）,https://news.yahoo.co.jp/articles/2a5ed8a1e7e206ab05935d8c37bf731a77e7d238,https://newsatcl-pctr.c.yimg.jp/t/amd-img/20240830-04254936-knb-000-2-view.jpg?exp=10800,2024-08-30T20:19:00+09:00,2024-08-30T20:52:59+09:00,北日本放送,knb,北日本放送,273,\nKNB北日本放送\n射水市は、国が経済対策として行っている個人住民税の定額減税で、一部に算定の誤りがあったと発表しました。\n\n射水市によりますと、定額減税の対象とならない国外に住んでいる扶養親族を含めて算定していました。\n\nこの算定ミスによって、個人住民税が増額となる人は１人、個人住民税が増額、調整給付金が減額となる人が２２人、調整給付金が減額となる人が８人で、合わせて３１人の修正が必要になります。\n\n市によりますと、データ登録の際の確認不足だったとして、対象者にお詫びするとともに修正に応じてもらうよう依頼するとしています。,['https://newsatcl-pctr.c.yimg.jp/t/amd-img/20240830-04254936-knb-000-2-view.jpg?exp=10800'],['https://news.yahoo.co.jp/articles/2a5ed8a1e7e206ab05935d8c37bf731a77e7d238/images/000']
黒部市は2日の小中学校臨時休校　台風影響（北日本放送）,https://news.yahoo.co.jp/articles/bb332522b3c1f9dbe724dbce2dae30c67e3b8ea6,https://newsatcl-pctr.c.yimg.jp/t/amd-img/20240830-09631665-knb-000-2-thumb.jpg?exp=10800,2024-08-30T20:20:01+09:00,2024-08-30T21:16:55+09:00,北日本放送,knb,北日本放送,1173,\nKNB北日本放送\n台風10号の接近に伴い、県内は31日昼過ぎから9月2日の月曜にかけて大雨となる恐れがあります。\n\n黒部市は月曜日の小中学校の臨時休校を決めるなど、県内でも影響がでています。\n\n30日の県内は、南から流れ込んだ湿った空気の影響で各地で気温が上がりました。\n\n最高気温は富山市で36.1度、砺波市で35.8度など、各地で猛暑日や真夏日を観測しました。\n\n北陸地方に暖かく湿った空気が流れ込んでいるため、県内は31日昼過ぎから週明け2日にかけて大雨となる恐れがあります。\n\n台風10号は午後5時には四国付近を1時間におよそ15キロの速さで東北東へ進んでいます。\n\n1日にかけて西日本を東に進み、熱帯低気圧に変わる見込みです。\n\n県内は台風の周辺などからの暖かく湿った空気の影響を受けていて、31日昼過ぎから大雨となるおそれがあり、土砂災害などに注意・警戒が必要です。\n\n県内では学校への影響が出ています。\n\n黒部市は市内の公立小中学校について9月2日の月曜を臨時休校とすると発表しました。\n\nまた、魚津市・滑川市・舟橋村・高岡市は31日と9月1日の公立中学校の部活動を中止とすることを決めています。\n\n氷見市では地震で被災した建物の解体が進められていて、30日、災害廃棄物の仮置き場では台風に備えて木のくずなどが風で飛ばされないよう、対策が進められていました。\n\n梅本記者\n「氷見市の、公費解体された廃棄物の仮置き場です。今週は、ピッチを上げて、集まった廃棄物を搬出しているということです」\n\nこの仮置き場では、台風の接近を前に運び込まれる木くずや家具などが増えていて、ここから処理場へと運び出す量を普段の3倍にして、仮置き場にたまらないようにしているということです。\n\nまた、廃棄物にはネットをかけて重しを置き、風に飛ばされないようにしていました。\n\n台風の接近を受けて県は30日、関係者を集めた会議を開きました。\n\n県は農作物や家畜などの管理の徹底のほか、学校活動などがある場合には児童生徒の安全確保に万全を期すことなどを呼びかけました。\n\n市町村のハザードマップを事前に確認し、避難場所や危険な場所を確認してほしいとしています。\n\n交通への影響です。\n\n東海道新幹線の運休にともなってJR西日本は30日、北陸新幹線と特急サンダーバードの臨時列車を運行しました。\n\n31日は北陸エリアでは新幹線と在来線ともに計画運休の予定はありません。\n\n一方、あいの風とやま鉄道は、9月1日から2日にかけて一部列車の運転取り止めや遅れが発生する可能性があるとしています。\n\n富山空港を発着する空の便は31日、9月1日ともに平常通り運航する予定です。,[],[]
越中八尾おわら風の盆　祭り継続へ新手　「推し」うちわや特別観覧プランも（北日本放送）,https://news.yahoo.co.jp/articles/47d66a0ffbdf232a0655ef3be752a725b0ab0566,https://newsatcl-pctr.c.yimg.jp/t/amd-img/20240830-07849675-knb-000-2-thumb.jpg?exp=10800,2024-08-30T20:20:01+09:00,2024-08-30T20:34:00+09:00,北日本放送,knb,北日本放送,1859,\nKNB北日本放送\n富山市八尾町では9月1日からおわら風の盆が始まります。\n\n台風の影響が心配されますが、祭りの運営委員会は現在のところは実施の方向、としています。\n\n台風への対応と、今年、新たに行われる運営資金を集めるための取り組みを取材しました。\n\n助田記者のリポートです。\n\n哀調を帯びた音色と歌に合わせて、優美な踊りを披露するおわら風の盆。\n\n台風の被害をうける時期「二百十日」の風封じと五穀豊穣を願って江戸時代に始まったとされています。\n\nそしてまさに今台風が近づく中、おわら風の盆行事運営委員会の事務所には全国から問い合わせが殺到しています。\n\nおわら風の盆行事運営委員会 橘賢美さん\n「台風で風の盆が中止になるのかという問い合わせが多々入っている。電話対応だけでも大変なんですが、今のところ行事運営委員会としては実施の方向でおります」\n\n祭りに向けて準備が進む中、台風に備え、ぼんぼりを一時撤去した町もありました。\n\n例年同様、町を練り歩く「町流し」は雨が降ると原則中止となりますが各町ごとに判断し、晴れ間を見て再開したり屋根のある場所などで踊ったりする場合もあります。\n\n開催中にJR高山線が運転を取りやめることになった場合には、行事運営委員会のバスで富山駅まで送迎を行うことにしています。\n\nおわら風の盆行事運営会 橘賢美さん\n「本当に強風で観光客の方が危ないというときには、市の公的施設のほうへ一時避難をしてもらうことにはしています」\n\n一方、おわら風の盆では担い手不足や資金不足が課題となっていて、2024年は持続可能な祭りの開催を目指し、様々な新しい取り組みが行われます。\n\n行事運営委員会が初めて製作・販売するのが、「推し活うちわ」です。\n\n11ある町内それぞれの紋様がデザインされていて「推し」の町のうちわを手にできるほか、すべての町の紋が入った「箱推し」のうちわもあります。\n\nうちわは1枚1000円。売上は祭りの運営にあてられます。\n\nおわら風の盆行事運営委員会 橘賢美さん\n「地元のおわらを地元のものがきっちり継続できる体制を早く作らないと、いつまででも補助金とか協賛金に頼ったような運営はいかがなものかなということで、少しでも自立できるいろんな策を試行的に今年はとくにやってみたところですね」\n\nまた、こんな取り組みも。\n\n県観光振興室 森田優平さん\n「こちらのお部屋でお食事やおわらをお楽しみいただきます。お食事のあとはこちらの窓から町中の様子をお楽しみいただけます」\n\n有料の特別観覧プランです。\n\n県は行事運営委員会などと連携し７月から観光客向けに4つの特別観覧プランを発売。\n\n最も高額なのが東町のこちらの町屋を貸し切る、1日1組限定80万円のプランです。\n\n富山駅からの送迎付きで、地元食材を使った料理を楽しめるほか町屋2階からゆったりとおわらを楽しむことができます。\n\n県観光振興室 森田優平 さん\n「お祭りファンの中には、お金を出してもお祭りを楽しみたい、好きなお祭りを支援したい方がいると聞く。さらにその方達の中には一生に一度の体験したい、より本物を求めたい人がいると聞いたので、今回、そういった方のニーズにも応えられるように検討を進めてきた」\n\nこちらのプランは3日間のうち1日が購入されたということです。\n\nそのほかのプランについては、台風の影響でキャンセルが多くなっているものの、当日購入も可能なため関係者は期待を寄せています。\n\n県観光振興室 森田優平さん\n「観光を通じた収益化を進めることが重要だと思っている。またそれに合わせて、そういったプランの購入を通じて地元の方たち、お祭りに参加される方、そして次世代を担う若い人たちに、このお祭りの価値を再認識いただくことで、もう一つの課題である担い手不足、次世代の育成につながっていくようにこれからも地域の方と連携をとっていければと思っています」\n\nまた、行事運営委員会でも有料観覧席を町内の神社の境内に試験的に設けることにしていて、県外からのツアーに組み込まれています。\n\nこれらの新しい取り組みがどれだけの効果をもたらすのか、県や行事運営委員会は祭りの終了後に検証し来年以降の取り組みを検討したいとしています。\n\nうちわは、祭り当日に八尾曳山展示館前で購入することができます。,[],[]
台風10号の影響　富山県内は大気の状態不安定に（北日本放送）,https://news.yahoo.co.jp/articles/b67ad56eaddbd362adac8a73e5fe3c1d35fabe7b,https://newsatcl-pctr.c.yimg.jp/t/amd-img/20240830-03586162-knb-000-2-thumb.jpg?exp=10800,2024-08-30T11:54:00+09:00,2024-08-30T11:58:56+09:00,北日本放送,knb,北日本放送,324,\nKNB北日本放送\n台風10号は九州付近をゆっくり北東へ進んでいて、9月1日には熱帯低気圧に変わる見込みです。\n\n県内は大気の不安定な状態が続くとみられ、今後の情報に注意してください。\n\n台風はこのあと、九州北部をゆっくりと横断し、四国へ進むとみられますが、9月1日には近畿付近で熱帯低気圧に変わる見込みです。\n\n県内は湿った空気が流れ込む影響で大気の不安定な状態が続きそうです。\n\n台風の接近にともない対策などを確認するため県が開いた会議では、気象台の担当者が「31日から9月2日にかけて警報級の大雨となる可能性がある」と説明しました。\n\n県は、農作物などの管理の徹底や児童生徒の安全確保に万全を期すよう呼びかけています。,[],[]
29日夜　朝日町でひき逃げ事故　80歳女性が大けが（北日本放送）,https://news.yahoo.co.jp/articles/d3bac8720c17732adff5a792d7713af6fe4f6c6d,https://newsatcl-pctr.c.yimg.jp/t/amd-img/20240830-07955611-knb-000-2-thumb.jpg?exp=10800,2024-08-30T11:54:00+09:00,2024-08-30T12:03:02+09:00,北日本放送,knb,北日本放送,334,\nKNB北日本放送\n29日夜、朝日町の国道で歩いていた80歳の女性が車にはねられ、大けがをしました。\n\n車は現場から逃げていて、警察はひき逃げ事件として捜査しています。\n\n入善警察署によりますと29日午後10時10分ごろ、朝日町平柳の国道8号で、道路を歩いていた町内に住む80歳の女性が、新潟方向から富山方向に走っていた車にはねられました。\n\n女性は事故後に通りかかった人が通報し救急車で病院に運ばれましたが、右腕の骨を折るなど大けがをしました。\n\n現場は片側1車線で、車道と歩道がブロックで分かれている場所です。\n\n警察は女性が車道を歩いていて事故に遭ったとみていて、当時の状況を聞くとともにひき逃げ事件として逃げた車の行方を捜査しています。,[],[]
富山の地ウイスキー　「べるもんた」とコラボ　北陸デスティネーションキャンペーン（北日本放送）,https://news.yahoo.co.jp/articles/2772cf9cea6dcf41cf321471c15397d64f014b61,https://newsatcl-pctr.c.yimg.jp/t/amd-img/20240830-08525767-knb-000-2-thumb.jpg?exp=10800,2024-08-30T20:18:01+09:00,2024-08-30T21:07:59+09:00,北日本放送,knb,北日本放送,331,\nKNB北日本放送\n砺波市の酒造会社は30日、この秋、地元自治体とJRなどが展開する大型観光キャンペーンで共同企画を行うと発表しました。\n\n砺波市の若鶴酒造とJR西日本金沢支社は30日、富山市内で会見し、2024年10月から北陸デスティネーションキャンペーンで取り組む企画内容を発表しました。\n\nそれによりますと、若鶴酒造・三郎丸蒸留所で製造するウイスキーをJRの観光列車「べるもんた」の乗客限定で200本程度販売するほか、「べるもんた」のロゴをあしらったオリジナルラベルの商品も数量限定で売り出します。\n\n会見で稲垣貴彦社長は、城端線沿線にある蒸留所について「鉄道好きの人にも蒸留所に来てもらい、砺波の風景を見てもらいたい」 と話していました。,[],[]
側に草刈り機　高岡市の用水路で76歳男性の遺体発見（北日本放送）,https://news.yahoo.co.jp/articles/9b1927edbf747d5fff6e3aa5c7f31a906c90b793,https://newsatcl-pctr.c.yimg.jp/t/amd-img/20240830-03189362-knb-000-2-view.jpg?exp=10800,2024-08-30T11:53:01+09:00,2024-08-30T12:03:01+09:00,北日本放送,knb,北日本放送,385,\nKNB北日本放送\n29日、高岡市の用水路で76歳の男性が死亡しているのが見つかりました。\n\n遺体で見つかったのは高岡市小泉新の農業・井上健治さん（76）です。\n\n高岡警察署によりますと29日午後5時30分ごろ、家族が井上さんを探していたところ、高岡市島新の用水路の中で左半身を下に横向きの状態で倒れている井上さんを見つけました。\n\n井上さんは駆けつけた消防によって、現場で死亡が確認されました。\n\n用水路は幅およそ40センチ、深さも40センチで発見当時の水深は10センチほどだったということです。\n\n井上さんは29日、田んぼに草刈りにいったまま自宅に戻らなかったということで、家族が探していました。\n\n遺体に目立った外傷はなく、そばに草刈り機があったということです。\n\n警察は30日以降司法解剖を行い、死因などを調べることにしています。,['https://newsatcl-pctr.c.yimg.jp/t/amd-img/20240830-03189362-knb-000-2-view.jpg?exp=10800'],['https://news.yahoo.co.jp/articles/9b1927edbf747d5fff6e3aa5c7f31a906c90b793/images/000']
東海道新幹線運休受け　北陸新幹線と特急サンダーバードで臨時列車運行（北日本放送）,https://news.yahoo.co.jp/articles/c4eb1dcb3fec00d93f5ed72ac01a9309422a046b,https://newsatcl-pctr.c.yimg.jp/t/amd-img/20240830-06774619-knb-000-4-view.jpg?exp=10800,2024-08-30T07:26:00+09:00,2024-08-30T11:38:55+09:00,北日本放送,knb,北日本放送,373,\nKNB北日本放送\n台風10号の接近にともない東海道新幹線が30日運休となり、東京と新大阪との間が利用できないことなどを受け、JR西日本は、北陸新幹線の「はくたか」と関西と敦賀を結ぶ特急サンダーバードで、臨時列車を運行します。\n\n運行する北陸新幹線の「はくたか」の臨時列車は、普通車全席自由席で、東京を午後0時48分に出発する下り列車1本と敦賀を午後2時36分に出発し上野が終点の上り列車1本です。\n\nグリーン車、グランクラスの営業はありません。富山県内は富山駅は上下とも停まり、新高岡は上り列車のみが停車、黒部宇奈月温泉は上下ともに通過します。\n\nまた、サンダーバードは新大阪が始発の午後1時46分発と、敦賀を午後4時53分に出て大阪へ向かう上下合わせて2本です。\n\nこちらも普通車全席自由席でグリーン車の利用はできません。,['https://newsatcl-pctr.c.yimg.jp/t/amd-img/20240830-06774619-knb-000-4-view.jpg?exp=10800'],['https://news.yahoo.co.jp/articles/c4eb1dcb3fec00d93f5ed72ac01a9309422a046b/images/000']
