headline,mainEntityOfPage,image,datePublished,dateModified,author,media_en,media_jp,str_count,body,images,external_links
ボルボ、2026年までに10台の新型、改良モデルを発表へ！BEVが加速（MotorFan）,https://news.yahoo.co.jp/articles/87f4479c5940360773db059500d7088ea3aac70e,https://newsatcl-pctr.c.yimg.jp/t/amd-img/20240921-40262975-motorfan-000-1-view.jpg?exp=10800,2024-09-21T21:06:43+09:00,2024-09-21T21:06:43+09:00,MotorFan,motorfan,MotorFan,1238,\n1\n/\n8\nボルボ ES60 予想CG\nボルボ ES60 予想CG\nボルボ EX90\nボルボ ES60 予想CG\nボルボ ES90 予想CG\nボルボ ES90 予想CG\nボルボ EX30\nボルボ EX30\nボルボは、直近のディーラーとの会議で、CEOのジム・ローワン最高経営責任者と、CCOのビョルン・アンウォール最高商務責任者が、同社の積極的な戦略をさらに強化し、今後2年間で10の新モデルと刷新モデルを発売する計画を明らかにした。PHEVには、将来のEVに動力を供給する予定のものと、同じ高効率電気モーターが搭載され、全般的にパフォーマンスと効率が向上する\n\n同社は、かつて約束したほど早く全電動ラインナップに移行していないかもしれないが、それでもBEV化を徐々に加速していく構えだ。\n\nそれらの最初のモデルとなるのが、すでに米国で製造されている完全電気クロスオーバーSUVの「EX90」である。その後に、現行のXC60の後継車として、またテスラ・モデルYのライバルとなる、小型電気SUV「EX60」が続く。2026年に発売予定のこの新モデルは、ボルボの最新SPA3プラットフォーム上に製造される。また、新しい高効率モーターも開発中で、ボルボは第1世代モーターの85％から、現在の91％を上回る93％の効率を目指している。\n\nさらに下位のモデルでは、以前XC40 Rechargeと呼ばれていた、小型のバッテリー電気SUV「EX40」も間もなく登場、待望のEX30がそれに続くことが決定している。EX30の納車は今年夏に開始される予定だったが、2025年に延期された。\n\nステーションワゴン好きにとっての朗報は、「EV60クロスカントリー」と呼ばれる電動モデルの生産準備が進められていることだ。また、フラッグシップセダンとして「ES90」の発売も決定している。\n\nこれらの新モデルの多くはバッテリー電気自動車（BEV）となるが、ボルボはハイブリッドカー・ファンを無視しているわけではない。同社は、新戦略の一環として、電気走行距離が大幅に延長された、プラグインハイブリッドのラインアップも準備している。これらの次世代PHEVは、XC60やXC90と同じ「SPA1」プラットフォームを採用するが、航続距離が大幅に向上する。ボルボの最高製品戦略責任者であるエリック・セヴェリンソン氏によると、これらのモデルは、最大33マイル（約53km）に過ぎない現行のXC90の電気航続距離をはるかに上回るという。\n\n改良されたPHEVには、将来のEVに動力を供給する予定の、同じ高効率電気モーターが搭載され、全般的にパフォーマンスと効率が向上するのだ。\n\n世界の自動車メーカーにおいて、BEVモデル売上が鈍化し、開発に遅れがでているが、ボルボはハイブリッドと並んで、順調にBEV計画を進めてるブランドの1つと言えそうだ。\nAPOLLO,"['https://newsatcl-pctr.c.yimg.jp/t/amd-img/20240921-40262975-motorfan-000-1-view.jpg?pri=l&w=640&h=335&exp=10800', 'https://newsatcl-pctr.c.yimg.jp/t/amd-img/20240921-40262975-motorfan-001-1-view.jpg?pri=l&w=640&h=335&exp=10800', 'https://newsatcl-pctr.c.yimg.jp/t/amd-img/20240921-40262975-motorfan-002-1-view.jpg?pri=l&w=640&h=360&exp=10800', 'https://newsatcl-pctr.c.yimg.jp/t/amd-img/20240921-40262975-motorfan-003-1-view.jpg?pri=l&w=640&h=364&exp=10800', 'https://newsatcl-pctr.c.yimg.jp/t/amd-img/20240921-40262975-motorfan-004-1-view.jpg?pri=l&w=640&h=360&exp=10800', 'https://newsatcl-pctr.c.yimg.jp/t/amd-img/20240921-40262975-motorfan-005-1-view.jpg?pri=l&w=640&h=360&exp=10800', 'https://newsatcl-pctr.c.yimg.jp/t/amd-img/20240921-40262975-motorfan-006-1-view.jpg?pri=l&w=640&h=377&exp=10800', 'https://newsatcl-pctr.c.yimg.jp/t/amd-img/20240921-40262975-motorfan-007-1-view.jpg?pri=l&w=640&h=360&exp=10800']","['https://news.yahoo.co.jp/articles/87f4479c5940360773db059500d7088ea3aac70e/images/000', 'https://news.yahoo.co.jp/articles/87f4479c5940360773db059500d7088ea3aac70e/images/001', 'https://news.yahoo.co.jp/articles/87f4479c5940360773db059500d7088ea3aac70e/images/002', 'https://news.yahoo.co.jp/articles/87f4479c5940360773db059500d7088ea3aac70e/images/003', 'https://news.yahoo.co.jp/articles/87f4479c5940360773db059500d7088ea3aac70e/images/004', 'https://news.yahoo.co.jp/articles/87f4479c5940360773db059500d7088ea3aac70e/images/005', 'https://news.yahoo.co.jp/articles/87f4479c5940360773db059500d7088ea3aac70e/images/006', 'https://news.yahoo.co.jp/articles/87f4479c5940360773db059500d7088ea3aac70e/images/007']"
【ライバル比較】新型スペーシア ギア×タント ファンクロス、アウトドア志向軽ワゴンの一番の違いは？ハイブリッドの有無で差が出るか？（MotorFan）,https://news.yahoo.co.jp/articles/17f632782b9635e5290b53eaa072dcc03a8fa573,https://newsatcl-pctr.c.yimg.jp/t/amd-img/20240921-40262643-motorfan-000-1-view.jpg?exp=10800,2024-09-21T12:00:00+09:00,2024-09-21T12:00:00+09:00,MotorFan,motorfan,MotorFan,2616,\nスペーシア ギア\nアウトドアレジャーでも使える軽ハイトワゴンの定番車種であるスズキ・スペーシア ギアの新型が発売された。そこで今回は、同カテゴリーでガチンコの競合車種となっているダイハツ・タント ファンクロスと比較してみる。\n【画像で見る】ほとんど同サイズの新型スペーシア ギアとタント ファンクロス\nTEXT●Motor-Fan.jp編集部 PHOTO●スペーシア ギア：井上 誠/タント ファンクロス：中野幸次、ダイハツ新型スペーシア ギアが9月20日、発売された。\n初代となる先代スペーシア ギアは2018年12月に発売。スズキの軽スーパーハイトワゴンであるスペーシアをアウトドア志向にした同モデルは、デビューから好評を博してきた。\n\nベースとなるスペーシア＆スペーシア カスタムは、2023年11月にフルモデルチェンジを迎えたが、それから10カ月を経たこの9月にスペーシア ギアも新型が登場。コンセプトは「アウトドアライフに欠かせない アクティブ軽ハイトワゴン」で、先代同様アクティブさを感じさせる雰囲気を持っている。\n\n一方のタント ファンクロスは、軽スーパーハイトワゴンの定番であるダイハツ・タントの派生モデル。2022年10月に4代目タントが改良されると同時に、新モデルとしてラインナップに追加された。\n\nスペーシア ギアと同様にアウトドア志向であり、日常生活だけでなくレジャーシーンでの使い勝手を強化するとともに、タフさを表現したモデルとなっている。\n\nボディサイズ\n\nボディサイズは新型スペーシア ギアもタント ファンクロスもほとんど変わらない。全長3395mmと全幅1475mmは共通。全高もペーシア ギアが1800mmであるのに対し、タント ファンクロスは1785mm(FF)～1805mm（4WD）とほぼ同じだ。\n\n車両重量については4WD＋ターボモデル同士で比較すると、スペーシア ギアが960kg、タント ファンクロスは990kgと、30kgの差がある。それ以外のグレードでもスペーシア ギアのほうが全体的に軽く作られているが、いずれも差は大きくない。\n\nエクステリアはどちらもアウトドアを強く意識したテイストとなっている。\n\n両モデルともスキッドプレート的なシルバーの加飾をフロントとリヤの下部に追加するなど、SUVライクな外観に仕上げられている。また、両モデルともルーフレールを標準装備としており、アウトドアレジャーにおける実用性を補強している。\n\nドアは両車ともリヤを両側スライドドアとしており、狭いスペースにおいても優れた後席の乗降性が確保されている。ただ、ドア周りはスペーシア ギアとタント ファンクロスの差が出るポイントのひとつだ。\n\nタント ファンクロスは助手席側にミラクルオープンドアを採用。同モデルでは前後ドアにピラーの機能を持たせることで、Bピラーの分だけドア開口部面積を拡大しており、子どもと一緒に乗降するときや、大きな荷物を積み下ろしする際の利便性が向上している。\n\n室内寸法はほぼ互角。スペーシア ギアのほうがわずかに長く、高さもあるものの、実用上の差はほとんどないと言えそうだ。\n\nインテリアにおいても、アウトドアでアクティブに使用することを前提とした装備となっている。\n\nスペーシア ギアもタント ファンクロスも、シート表皮に撥水加工を施したファブリックを採用。スペーシア ギアは防汚タイプラゲッジフロアが装備され、砂や汚れを気にすることなく使えるクルマとなっている。タント ファンクロスはシートバックにも防水加工が施されている。\n\nまた、どちらの車種も前席裏側のテーブルや、ショッピングフック、各種トレーなど、日常生活のなかでの使い勝手を高める装備が充実している。\n\nいまや必需品ともなっているUSBソケットも両車に備えられている。スペーシア ギアはインパネと後席右側に装備されるが、それぞれType-AとType-Cがひとつずつ設けられているのが特徴。タント ファンクロスは運転席と助手席（オプション）、後席右側に位置するが、それぞれType-Aが一口ずつとなる。\n\n運転席の計器レイアウトは両モデルで趣向が異なる。スペーシア ギアがメーター類をステアリング内側に見るオーソドックスな方式で、ヘッドアップディスプレイも装備しているのに対し、タント ファンクロスはダッシュボード上側にディスプレイを並べる方式を採っている。\n\nなお、運転席と助手席のシートヒーターは両車とも標準装備となっているが、スペーシア ギアはタント ファンクロスにはないステアリングヒーターを標準装備としているのはポイントだ。\n\nパワートレイン\n\nパワートレインは、スペーシア ギアとタント ファンクロスで一番違いが大きいポイントだ。\n\nどちらも経済性に優れた直列3気筒ガソリンNAと、パワフルな直列3気筒ターボが選べ、いずれのエンジンもCVTと組み合わされるほか、駆動方式についてもFFと4WDをラインナップしているのは共通している。最大の違いは、スペーシア ギアは全車がマイルドハイブリッドシステムを搭載するのに対し、タント ファンクロスは全車が純ガソリンエンジン車のみとされる点だ。\n\nピークのパワー/トルクにおいては大きな差はないものの、比較的非力なNAエンジンモデルを選んだ際には、車重が軽くモーターのアシストを得られるスペーシア ギアのほうがやや余裕がありそうだ。\n\nまた、カタログ上での燃費性能についても、ハイブリッド車であるスペーシア ギアにわずかではあるが軍配が上がる。\n\nADASについては、どちらも衝突被害軽減ブレーキや誤発進抑制機能などは標準装備としている。しかし、スペーシア ギアが全車速追従機能付ACCを標準装備としている一方で、タント ファンクロスはメーカーオプションとなっている。\n\n価格\n\n価格としては、ハイブリッドシステムを積むスペーシア ギアのほうが全体的に20万円ほど高く設定されている。ただし、動力性能や燃費などといったカタログスペック上の差は大きくないので、内外装の好みや自分に必要な装備に合わせて選ぶのが良さそうだ。\nMotorFan編集部,['https://newsatcl-pctr.c.yimg.jp/t/amd-img/20240921-40262643-motorfan-000-1-view.jpg?pri=l&w=640&h=426&exp=10800'],"['https://news.yahoo.co.jp/articles/17f632782b9635e5290b53eaa072dcc03a8fa573/images/000', 'https://motor-fan.jp/mf/article/262643/top-17/']"
ファミリーカーにも使いたい！高性能全合成エンジオイルの代名詞・カストロール「EDGE（エッジ）」シリーズ（MotorFan）,https://news.yahoo.co.jp/articles/a9ca6f9cfc97263095a83392dd609c878b1584ee,https://newsatcl-pctr.c.yimg.jp/t/amd-img/20240921-40257002-motorfan-000-1-view.jpg?exp=10800,2024-09-21T13:00:00+09:00,2024-09-21T13:00:00+09:00,MotorFan,motorfan,MotorFan,1112,\n1\n/\n4\n最新の国産エコカーやハイブリッドにマッチするCastrol『EDGE 0W-16』。省燃費設計でありながら高い保護性能を兼ね備える全合成油だ。\n変わりゆくニーズに対応すべく、ブランドロゴを刷新したカストロール。パッケージもより洗練されたデザインへとリニューアルされている。\n数多くの省燃費車が採用する0W-16。カー量販店でも年々、需要が高まっているという。なかでもEDGEは高い人気を誇っている。\nCastrol『EDGE 5W-30 FE』はガソリン、ディーゼルエンジン両用の全合成油。欧州メーカーのOEM認証も数多く取得している。API SP、ILSAC GF-6A 、CF Performanceに適合。\n1899年、低温時の流動性と高温に耐えうる性能を持たせるべくヒマシ油（Castor）と鉱物油をブレンドしたオイルを発明。「カストロール」と名付けられたそのエンジンオイルは、世界初となる大西洋無着陸飛行にも使用された。そして時代の変遷とともに進化を続け、100年以上が経った今では世界中のクルマを愛するユーザーから厚い信頼を集めている。独自のフルード・チタン・テクノロジーを採用する\n\nカストロールが誇るエンジンオイルラインアップのなかでもフラッグシップモデルという位置付けなのが『EDGE』シリーズだ。\nその特徴は、独自のフルード・チタン・テクノロジーにより、過酷な状況下においても強靭な油膜を形成。金属パーツ同士の接触や摩耗を低減し、エンジン性能をしっかり引き出してくれること。\n粘度のバリエーションの豊富で、最新エコカーから輸入車まで幅広く対応するのも人気の所以といえるだろう。\n\n低粘度でも頼れる油膜を形成し、省燃費エンジンをしっかり守る\n\nなかでも年々ニーズが高まっているのが『EDGE 0W-16』だ。ハイブリッド車やアイドリングストップ車などに純正採用される0W-16は、低粘度ゆえに油膜を維持するのが難しい。\nそこで真価を発揮するのが前述のフルード・チタン・テクノロジー。低粘度からしっかり油膜を形成し、エンジン負荷が増加するとその油膜はさらに強靭さを増す。\n\n環境にも配慮した地球に優しいエンジンオイルなのだ\n\nどんな状況下でもエンジンをしっかり保護し、最大限の性能を引き出してくれるカストロールのエンジンオイル。環境にも配慮し、設計時にCO2排出量を削減する努力を重ねると同時に、植林など様々なエコ活動によりカーボンクレジットを創出。CO2排出量を実質ゼロとしていることも、最後に付け加えておきたい。\nCarGoodsMagazine,"['https://newsatcl-pctr.c.yimg.jp/t/amd-img/20240921-40257002-motorfan-000-1-view.jpg?pri=l&w=640&h=426&exp=10800', 'https://newsatcl-pctr.c.yimg.jp/t/amd-img/20240921-40257002-motorfan-001-1-view.jpg?pri=l&w=640&h=426&exp=10800', 'https://newsatcl-pctr.c.yimg.jp/t/amd-img/20240921-40257002-motorfan-002-1-view.jpg?pri=l&w=640&h=427&exp=10800', 'https://newsatcl-pctr.c.yimg.jp/t/amd-img/20240921-40257002-motorfan-003-1-view.jpg?pri=l&w=426&h=640&exp=10800']","['https://news.yahoo.co.jp/articles/a9ca6f9cfc97263095a83392dd609c878b1584ee/images/000', 'https://news.yahoo.co.jp/articles/a9ca6f9cfc97263095a83392dd609c878b1584ee/images/001', 'https://news.yahoo.co.jp/articles/a9ca6f9cfc97263095a83392dd609c878b1584ee/images/002', 'https://news.yahoo.co.jp/articles/a9ca6f9cfc97263095a83392dd609c878b1584ee/images/003']"
ポルシェ964世代を7千万円超えの高級電動モデルとしてレストモッド！パワートレーンはテスラから移植（MotorFan）,https://news.yahoo.co.jp/articles/f2e1ac9f825618faafc04044d7266299a4ff0d3e,https://newsatcl-pctr.c.yimg.jp/t/amd-img/20240921-40262986-motorfan-000-1-view.jpg?exp=10800,2024-09-21T21:11:55+09:00,2024-09-21T21:11:55+09:00,MotorFan,motorfan,MotorFan,983,"\nカルマ 7-97 E-Volt\n近年、Singer、Gunther Werks、Tuthillなどの企業が、レストモッド・ポルシェ911を続々と発表しているが、新たに「カルマ オートモーティブ」が964世代の911をレストモッドした。フルエレクトリック化されたレストモッド費用は50万ドル（約7千万円）からと高額\n\n現代風にアレンジされたクラシック911の多くは、高回転のエンジンが響くが、カルマの新しい「7-97 E-Volt」は完全電動となっている。レストモッド911が電気で動くと考えると、期待と不安が入り交じるが、世の中にはこのような車の需要があると思われ、カルマも明らかに同じ気持ちなのだろう。\n\n心臓部には、テスラ「モデルS」からアップサイクルされ再設計されたパワートレーンを搭載している。バッテリーは63 kWhのユニットで、モーターは最高出力450psと最大トルク660 Nmを発揮する。動力パフォーマンスでは、4 秒未満で時速62マイル（100 km/h）に到達、1回の充電で180マイル（290 km）走行可能で、CCS急速充電機能をオプションで選択すると、1時間未満でゼロから80％まで充電できるという。\n\nこの時点で、63 kWhバッテリーを搭載した964は非常に重いと思われるかもしれないが、カルマによると、そんなことはなく、7-97 E-Voltの重量は1,374 kg（3,029ポンド）で、オリジナルの964 Turboと同等だという。\n\n軽量の亜麻繊維で作られた新しいボディパネルが使用され、空気力学も改善、オリジナル964よりもかなり頑丈に見える。アダプティブサスペンションが標準装備されており、アップグレードされたスチール、またはカーボンセラミックブレーキの選択肢も提供している。\n\nインテリアには、電動エアコン、Apple CarPlayをサポートするBluetoothオーディオシステム、雨滴感知ワイパー、ソフトレザー、セミアニリン素材、さまざまな色のオプションなど、いくつかの最新機能も備わっている。\n\n注目の価格だが、レストモッド費用は約50万ドル（約7千万円）からとかなり高額だ。同社は、レストモッド後も、完全に元に戻せるから安心だというが、そちらの費用は発表されてない。\nAPOLLO",['https://newsatcl-pctr.c.yimg.jp/t/amd-img/20240921-40262986-motorfan-000-1-view.jpg?pri=l&w=640&h=426&exp=10800'],['https://news.yahoo.co.jp/articles/f2e1ac9f825618faafc04044d7266299a4ff0d3e/images/000']
ハンディクリーナーとエアダスターの1台2役! 豊富なアタッチメントでお手軽車内清掃に最適! サンワサプライ 『200-CD086』 【CAR MONO図鑑】（MotorFan）,https://news.yahoo.co.jp/articles/1e07f2e88e068dbadfaf6f232c5e0e6580d6438b,https://newsatcl-pctr.c.yimg.jp/t/amd-img/20240921-40259487-motorfan-000-1-view.jpg?exp=10800,2024-09-21T11:30:00+09:00,2024-09-21T11:30:00+09:00,MotorFan,motorfan,MotorFan,612,\n1\n/\n4\n写真：Motor-Fan\n写真：Motor-Fan\n写真：Motor-Fan\n写真：Motor-Fan\nサンワサプライの『200-CD086』は、コンパクトなボディにハンディクリーナーとエアダスターの機能を備えた便利アイテム。付属のアタッチメントを接続すればより効率の良い清掃が可能だ。\n\nREPORT●浜先秀彰（HAMASAKI Hideaki）\n\n問い合わせ：サンワサプライ\n電話：086-223-3311200-CD086……3980円（税込）\n\nサンワサプライの『200-CD086』は、コンパクト（6×20×15cm）なハンディタイプのお掃除アイテム。軽量（308g）で握りやすい形状のボディは、ハンディクリーナーと電動エアダスターの2つの使い方ができる。ゴミやホコリを吸うことも吹き飛ばすことも可能で、付属している6種類のアタッチメントノズルを組み合わせればインパネやシート、ラゲッジなど車内のすみずみまで効率的に清掃できる。\n\n電源はアクセサリーソケットから取得OKで、ケーブルは約2.5mと長いため後部座席でも無理なく使える。バッテリーを内蔵していないので発熱や発火の心配も無用だ。\n\nアタッチメントとフィルターは水洗いでき、ダストボックスは取り外して溜まったゴミを捨てられるなど、お手入れも簡単。使わないときにはグローブボックスに収納できる。\n浜先秀彰,"['https://newsatcl-pctr.c.yimg.jp/t/amd-img/20240921-40259487-motorfan-000-1-view.jpg?pri=l&w=640&h=640&exp=10800', 'https://newsatcl-pctr.c.yimg.jp/t/amd-img/20240921-40259487-motorfan-001-1-view.jpg?pri=l&w=640&h=640&exp=10800', 'https://newsatcl-pctr.c.yimg.jp/t/amd-img/20240921-40259487-motorfan-002-1-view.jpg?pri=l&w=640&h=548&exp=10800', 'https://newsatcl-pctr.c.yimg.jp/t/amd-img/20240921-40259487-motorfan-003-1-view.jpg?pri=l&w=587&h=640&exp=10800']","['https://news.yahoo.co.jp/articles/1e07f2e88e068dbadfaf6f232c5e0e6580d6438b/images/000', 'https://news.yahoo.co.jp/articles/1e07f2e88e068dbadfaf6f232c5e0e6580d6438b/images/001', 'https://news.yahoo.co.jp/articles/1e07f2e88e068dbadfaf6f232c5e0e6580d6438b/images/002', 'https://news.yahoo.co.jp/articles/1e07f2e88e068dbadfaf6f232c5e0e6580d6438b/images/003']"
