headline,mainEntityOfPage,image,datePublished,dateModified,author,media_en,media_jp,str_count,body,images,external_links
【山形】太陽光発電の普及へ新モデル（YTS山形テレビ）,https://news.yahoo.co.jp/articles/9e63badac7eb873042e0a616febfb1566f61a1de,https://newsatcl-pctr.c.yimg.jp/t/amd-img/20250313-00000009-yts-000-1-thumb.jpg?exp=10800,2025-03-13T19:10:14+09:00,2025-03-13T19:10:14+09:00,YTS山形テレビ,yts,YTS山形テレビ,428,"YTS山形テレビ
脱炭素社会実現に向けて新たな太陽光発電を推進しようと、山形市で実証運転開始のセレモニーが開かれました。

県が推進する自家消費型太陽光発電「PPAモデル」。

太陽光発電設備を初期投資無しで利用することができ、使用した分の電力料金を設置事業者へ支払う仕組みです。

太陽光発電の設置には、県の補助事業が活用されています。

今回はそのモデル事業として、「やまがた新電力」が利用者である「山形パナソニック」に太陽光発電設備を設置しました。

自宅や企業における太陽光発電の導入を推進する狙いがあります。

【やまがた新電力清野伸昭社長】「中小規模の太陽光発電設備の導入推進は、これまで以上に力を入れていく必要がある。」

【山形パナソニック清野寿啓社長】「県民に環境問題、脱炭素社会の実現がいかに重要か、商売を通じて啓蒙していくことが我々の大きな役目。」

今後は、電気料金の負担軽減の効果などを公表し、このモデルを広めていきたい考えです。",[],[]
【山形】県の入札 家畜用ワクチンで談合 2社に処分（YTS山形テレビ）,https://news.yahoo.co.jp/articles/efca68a7f94d4554b844626eb678f5daf9b4f184,https://newsatcl-pctr.c.yimg.jp/t/amd-img/20250313-00000008-yts-000-1-thumb.jpg?exp=10800,2025-03-13T18:58:13+09:00,2025-03-13T18:58:13+09:00,YTS山形テレビ,yts,YTS山形テレビ,459,"YTS山形テレビ
公正取引委員会は、県などが発注する家畜用ワクチンの入札に絡み動物用医薬品などを販売する企業2社が談合していたとして、処分を発表しました。

独占禁止法違反で処分を受けたのは、「アグロジャパン」「小田島商事」の2社です。

公正取引委員会によりますと、2社は遅くとも2020年3月以降、県が発注した豚熱用ワクチンなどの入札で、事前に担当者同士で話し合い、受注価格などを決めていたということです。

公正取引委員会はこの2社に対し、再発防止などを求める排除措置命令を出したほか、課徴金合わせて567万円を納付するよう命じました。

この2社のほか、「MPアグロ」が立ち入り検査を受けていましたが、調査前に違反行為を自発的に取りやめたため、処分を免除されました。

【公正取引委員会事務総局東北事務所白石文男所長】「重要な商品の流通を担う卸売り業者3社が山形県において、受注価格の低落防止を図るため長年にわたって受注調整を行い、公正かつ自由な競争を制限していた事実が認められたところであり、誠に遺憾です。」",[],[]
【山形】川西町で住宅2軒が全焼 けが人なし隣の家へ延焼（YTS山形テレビ）,https://news.yahoo.co.jp/articles/96071ef9492f4609ef9779de6ccc7f57cf67ebe7,https://newsatcl-pctr.c.yimg.jp/t/amd-img/20250313-00000007-yts-000-1-thumb.jpg?exp=10800,2025-03-13T18:52:14+09:00,2025-03-13T18:52:14+09:00,YTS山形テレビ,yts,YTS山形テレビ,310,"YTS山形テレビ
けさ、川西町で住宅2軒が全焼する火事がありました。けが人はいません。

午前6時50分ごろ、川西町上小松の細谷育子さん（80）の木造一部2階建ての住宅から「炎や煙が上がっている」と近くに住む人から警察と消防に通報がありました。

火は隣に住む藤島英二郎さんの住宅にも燃え移り、およそ5時間後に消し止められましたが、細谷さんと藤島さんの住宅合わせて2軒が全焼しました。

細谷さんは1人暮らしで、出火当時、家にいましたが、逃げて無事でした。また、藤島さんと家族にもけがはありません。6人家族で出火当時5人が在宅していました。

警察と消防は明日の午前9時から実況見分を行い、出火原因などを調べる予定です。",[],[]
【山形】高齢者などを手助け 「ちぇっと」サポートしませんか（YTS山形テレビ）,https://news.yahoo.co.jp/articles/b743ad5ebc6456e405f3f9cb65472b8d20012feb,https://newsatcl-pctr.c.yimg.jp/t/amd-img/20250313-00000006-yts-000-1-thumb.jpg?exp=10800,2025-03-13T18:43:13+09:00,2025-03-13T18:43:13+09:00,YTS山形テレビ,yts,YTS山形テレビ,644,"YTS山形テレビ
高齢者など、日常生活でちょっとした手助けを必要とする人へのサポートについて考える取り組みが山形市で行われました。

山形市の社会福祉協議会が企画したのが、「ちぇっとサポーター」の育成講座。高齢者などに対し、ちょっとでもサポートできることがないか考えてほしいと開催しています。

先月行われた1回目の講座では、高齢者が抱える身体の悩みを疑似体験した参加者たち。きょうのテーマは高齢者による利用が多い「移動販売」です。

【中野アナウンサー】「実際に市内を回っているこちらの移動販売車。利用している人をみてどのようなサポートが必要なのかを考えます。」

お目当ての品を次々とカゴに入れていく利用者たち。中には、杖をつきスロープをつかみながら歩く人の姿もありました。

【インタビュー】「つまづいた人もいましたね。カゴを持ってあげたり袋に入れ替えてあげるとかのサポートがあると。」

【インタビュー】「買い物をするって年齢に関わらずすごく楽しいことだと思うので、楽しいという気持ちをもったまま横で見守るような形でサポートできるのがいいかなと見て思った。」

一方、身体のサポート以外でできることがあると気づいた人も。

【インタビュー】「私たちだと栄養バランスとかいろいろ考えたりするけど、こないだ何買ったから今日はこれ買おうみたいなアドバイスをしながらだと健康とかにもいいのかな。」

この講座は、3月18日にも開かれ、次回は、認知症の人への寄り添い方について学ぶ予定です。",[],[]
【山形】14日 山形新幹線 順次「通常運転」（YTS山形テレビ）,https://news.yahoo.co.jp/articles/0d1aa0f8378ba824acd9ce1495763ce1d486fbb5,https://newsatcl-pctr.c.yimg.jp/t/amd-img/20250313-00000005-yts-000-1-thumb.jpg?exp=10800,2025-03-13T18:40:14+09:00,2025-03-13T18:40:14+09:00,YTS山形テレビ,yts,YTS山形テレビ,284,"YTS山形テレビ
JR東日本は、14日から順次再開する東北新幹線との連結運転について、詳細を発表しました。

山形新幹線は下りの3本を除くすべてで、通常運転を予定しています。

山形新幹線は、3月6日に発生した東北新幹線の連結部分の分離により、「福島ー東京」間で区間運休が続いています。

JR東日本は、連結部分を固定する対策であすから順次連結運転を再開するとし、きのう運行予定を発表しました。

山形新幹線はあす14日、下りの3本を除くすべての列車で、通常通りの運転を予定しています。


また、15日以降についてはすべての列車で通常ダイヤでの運転を見込んでいます。",[],[]
【山形】備蓄米流通へ JA産直は（YTS山形テレビ）,https://news.yahoo.co.jp/articles/941d6be3b7faa9d23cddc36a868b99dd182f96dd,https://newsatcl-pctr.c.yimg.jp/t/amd-img/20250313-00000004-yts-000-1-thumb.jpg?exp=10800,2025-03-13T18:37:13+09:00,2025-03-13T18:37:13+09:00,YTS山形テレビ,yts,YTS山形テレビ,898,"YTS山形テレビ
コメの価格高騰を受けて行われた備蓄米の入札はあすにも結果が発表される見込みです。

流通を前に、価格設定などに苦悩する販売店の現状を取材しました。

寒河江市にあるアグリランド産直センターでは、西村山地域で作られたコメを販売しています。こちらの売り場にも終息を見せない価格高騰の影響が出ていました。

【望月雅人アナウンサー】「普段であればこちらに玄米が山積みにされているということですが、販売停止の対応をとっています。徐々に販売の方法にも影響が出てきています。」

こちらでは、2月25日から玄米の販売を中止していると言います。

【アグリランド産直センター飯野真介さん】「玄米だと日持ちもするということで精米したものよりも購入者がたくさんいるが、少し玄米の売れる速度が例年よりも早く在庫の減りも速いということで玄米の販売を一時的に停止して。」

精米も購入量を制限しての販売に。精米コーナーを訪れた人は。

【インタビュー】「高いなという感じはする。食べなきゃしょうがないから買うけれど。やはり（備蓄米が）放出されて値段が下がってくれればありがたい。」

政府が放出する備蓄米はきのう、初回分の入札が締め切られ、3月下旬にもスーパーなどの店頭に並ぶ見込みです。JAの産直施設では、今後の備蓄米流通の影響は少ないとみています。

【アグリランド産直センター飯野真介さん】「とくに上がる、下がるはないのかなと。我々の場合は農協に出荷いただいた生産者の米を仕入れて販売しているので備蓄米がこちらに来ることはないのではと考えている。」

農家と生産者の間に立つJAとしては、今後の価格設定が及ぼす影響も危惧しています。

【アグリランド産直センター飯野真介さん】「農家からは適正価格に戻ってきたという話も聞いているので、値段を下げてしまうとなると農家への負担も高まってくる可能性もあるし、米農家自体が減少してしまっては今後、米自体が本当に出回らなくなるということも考えられると思うので、やはり農家とお客さん、双方にとって良い方向に進めるような値段設定が（今後も）課題になってくる。」",[],[]
【山形】旅立ちの日あすピーク 中学校で卒業シーズン（YTS山形テレビ）,https://news.yahoo.co.jp/articles/8b571acb0f212a76f0e79791db216fc30d4bdd51,https://newsatcl-pctr.c.yimg.jp/t/amd-img/20250313-00000003-yts-000-1-thumb.jpg?exp=10800,2025-03-13T18:31:14+09:00,2025-03-13T18:31:14+09:00,YTS山形テレビ,yts,YTS山形テレビ,575,"YTS山形テレビ
公立中学校が卒業シーズンを迎え、卒業生たちがたくさんの思い出を胸に学び舎を巣立ちました。

きょうは、鶴岡市内の中学校3校で卒業式が行われ、このうち、朝日中学校では31人が旅立ちの日を迎えました。

式では、卒業生の名前が読み上げられ一人ひとりに卒業証書が手渡されました。

そして秋山尚志校長が「誠実な心で人に接し、キミの成長を支えている全ての人への感謝を忘れないでほしい」と激励。卒業生を代表して2人が、門出の言葉を述べました。

【長南鉄心さん】「これからは先生方から教えてもらったことを思い出しながら目標に向け精一杯頑張ります。今までありがとう」

【阿部咲良さん】「朝日中学校でのたくさんの大切な思い出と高校生活への期待を胸に今巣立つ。それぞれの目標の実現に向かって努力することを約束し門出の言葉と致します」

長い人では保育園からおよそ10年間を共にした卒業生も。仲間との思い出を胸にそれぞれが新たな道へ進んでいきます。

【インタビュー】「充実した3年間を送れて良かったしとても自分の中では一番、大成功した卒業式でした」「高校に行っても勉強、友達をいっぱい作って楽しく生きていきたい」「高校生活は思いっきり楽しんで。このメンバーとは離れ離れになるがまたもう一度、会えれば良い」

中学校の卒業式はあすピークを迎えます。",[],[]
【山形】去年7月大雨で氾濫 荒瀬川の治水対策に住民ら意見（YTS山形テレビ）,https://news.yahoo.co.jp/articles/bb18c1f0a79262c6cd22f124c756ce82018a29e6,https://newsatcl-pctr.c.yimg.jp/t/amd-img/20250313-00000002-yts-000-2-thumb.jpg?exp=10800,2025-03-13T11:58:13+09:00,2025-03-13T19:01:14+09:00,YTS山形テレビ,yts,YTS山形テレビ,447,"YTS山形テレビ
去年7月の大雨で氾濫した酒田市の荒瀬川の治水対策について、住民らの意見を聞く公聴会が昨夜、開かれました。

去年7月、酒田市の荒瀬川流域では、24時間雨量が400ミリを超えるなどして川が氾濫。住宅への浸水など、甚大な被害が出ました。

昨夜の住民公聴会では、県が荒瀬川流域のおよそ16キロの範囲で改良工事を進める計画の素案を示しました。

計画では、去年7月と同じ規模の大雨にも対応できるように、河道掘削や流れてきた木を捉える施設の整備を行うとしています。

出席した住民からは、一時的に水をためる「遊水地」の整備や、川の勾配を緩めて水の流れを抑える対策、上流部へのアメダス設置などの要望が出されました。

【八幡地域協議会 池田満好会長】「荒瀬川は本当に急勾配だから幅を広げて河道掘削をするだけでは（十分じゃない）。やはり勾配を変えない、そのへんを対応していただきたい」

県は今後、県民から意見を公募するパブリックコメントを行うなどして、来年度中に計画を策定する予定です。",[],[]
【山形】川西町で住宅火災 一人暮らし女性（80）けがなし（YTS山形テレビ）,https://news.yahoo.co.jp/articles/a50f186915a67bb41500f615014dcf81cfb07cc7,https://newsatcl-pctr.c.yimg.jp/t/amd-img/20250313-00000001-yts-000-1-thumb.jpg?exp=10800,2025-03-13T11:52:14+09:00,2025-03-13T11:52:14+09:00,YTS山形テレビ,yts,YTS山形テレビ,237,"YTS山形テレビ
今朝、川西町で住宅火事があり、付近の住宅にも延焼しました。今のところ、けが人はいません。

午前6時50分ごろ、川西町上小松の細谷育子さん（80）の住宅から「炎や煙が上がっている」と近くに住む人から警察と消防に通報がありました。

細谷さんの住宅が焼けたほか、近隣の住宅にも延焼が確認されていて、現在も消火活動が続いています。

細谷さんは1人暮らしで、出火当時、家にいましたが、逃げて無事でした。警察と消防で、当時の状況など詳しい出火原因を調べています。",[],[]
