headline,mainEntityOfPage,image,datePublished,dateModified,author,media_en,media_jp,str_count,body,images,external_links
美作市長選 萩原氏が5選　安東氏との一騎打ち制す（山陽新聞デジタル）,https://news.yahoo.co.jp/articles/b898e1b31ded1f250f542efb04436c4905716175,https://newsatcl-pctr.c.yimg.jp/t/amd-img/20260315-00010007-sanyo-000-1-view.jpg?exp=10800,2026-03-15T23:05:58+09:00,2026-03-15T23:05:58+09:00,山陽新聞デジタル,sanyo,山陽新聞デジタル,306,5選を果たし、支援者らと万歳する萩原氏（中央） 任期満了に伴う美作市長選は15日、投開票が行われ、無所属現職の萩原誠司氏（69）が、無所属新人で元美作市議の安東章治氏（67）との一騎打ちを制し、5選を果たした。 当選確実の一報を受け、萩原氏は選挙事務所（同市朽木）で支持者約250人と万歳し「人口減少が進む中でも、このまちを良くするために反転攻勢をかけたい。明日からエンジン全開で働いていくことを約束する」と抱負を述べた。 投票率は57・65％（男58・43％、女56・95％）。過去最低だった前回2022年の61・64％を3・99ポイント下回った。 当日有権者数は2万734人（男9892人、女1万842人）。,[],[]
「死んでも良いと思った」　自宅放火し全焼させた疑い　岡山中央署 男逮捕（山陽新聞デジタル）,https://news.yahoo.co.jp/articles/282929148c88f2aa8bb54d16718706d6a7aec13e,https://newsatcl-pctr.c.yimg.jp/t/amd-img/20260315-00010006-sanyo-000-1-view.jpg?exp=10800,2026-03-15T21:35:08+09:00,2026-03-15T21:35:08+09:00,山陽新聞デジタル,sanyo,山陽新聞デジタル,224,全焼した民家＝15日午後4時59分、岡山市中区円山 15日午後2時半ごろ、岡山市中区の民家から出火、木造3階（1階約39平方メートル）を全焼した。岡山中央署は非現住建造物等放火の疑いで、住人の自称会社員の男（32）を現行犯逮捕した。 逮捕容疑は、何らかの方法で自宅に火を付け全焼させた疑い。「自宅に火をつけた」と自ら110番し、駆け付けた署員に放火を認めた。 署によると、1人暮らしで「人生がどうでもよくなり、死んでも良いと思った」と供述している。,[],[]
【速報】美作市長選、萩原氏5選確実（山陽新聞デジタル）,https://news.yahoo.co.jp/articles/16dbae500ce8a1756a49ed35a602adbc4a633dea,https://newsatcl-pctr.c.yimg.jp/t/amd-img/20260315-00010005-sanyo-000-1-view.jpg?exp=10800,2026-03-15T20:02:30+09:00,2026-03-15T20:02:30+09:00,山陽新聞デジタル,sanyo,山陽新聞デジタル,55,美作市長選 任期満了に伴う美作市長選は15日、投票が行われ、無所属現職の萩原誠司氏（69）が5選を確実にした。,[],[]
【美作市長選】投開票のいま　開票終了、萩原氏5選（山陽新聞デジタル）,https://news.yahoo.co.jp/articles/5c5c922e82df54596571a08d9930f40aefa1477a,https://newsatcl-pctr.c.yimg.jp/t/amd-img/20260315-00010004-sanyo-000-3-view.jpg?exp=10800,2026-03-15T19:56:24+09:00,2026-03-15T21:44:37+09:00,山陽新聞デジタル,sanyo,山陽新聞デジタル,456,美作市長選 投開票のいま 任期満了に伴う美作市長選挙は3月15日、投開票が行われました。 午後9時35分 美作市選管から最終の開票結果の発表があった。現職の萩原氏が5選を果たした。 午後9時20分 美作市選管は午後9時現在の開票率を発表した。開票率は48・52％。 午後8時30分 美作市選管は投票者数を発表した。投票率は57・65％で、前回（61・64％）を下回った。 午後8時05分 現職萩原氏の5回目の当選が確実になりました。 午後6時10分 出口調査の結果を公開しました。年代別、性別、支持政党別の分析を加えてグラフ化。期日前投票でも行っており、投票日と期日前投票を合計して掲載しています。投票日のみのデータもあります。 午後5時45分 美作市選管は午後5時現在の投票者数を発表した。期日前投票を含まない当日投票率は24・45％。前回同時刻は30・40％だった。 午後3時45分 美作市選管は午後3時現在の投票者数を発表した。期日前投票を含まない当日投票率は21・44％。前回同時刻は27・08％だった。,[],[]
岡山県美咲町で農機具小屋を全焼（山陽新聞デジタル）,https://news.yahoo.co.jp/articles/0730852bc40f50dd8ade2d226b79c044f5910f0b,https://newsatcl-pctr.c.yimg.jp/t/amd-img/20260315-00010003-sanyo-000-1-view.jpg?exp=10800,2026-03-15T18:00:45+09:00,2026-03-15T18:00:45+09:00,山陽新聞デジタル,sanyo,山陽新聞デジタル,183,全焼した農機具小屋＝15日午前11時47分、岡山県美咲町北 15日午前10時35分ごろ、岡山県美咲町北、農業結石文貴さん（70）方の農機具小屋から出火、鉄骨平屋約90平方メートルを全焼した。 美咲署によると、結石さんは外出中で、母屋にいた妻（67）は逃げ出して無事だった。近所の男性（86）が出火に気付き、119番した。原因を調べている。 【動画】現場の様子はこちら,[],[]
フィギュア五輪代表、田中さん（倉敷出身）招きスケート教室 岡山で小学生ら滑りの基礎学ぶ（山陽新聞デジタル）,https://news.yahoo.co.jp/articles/2c218e66567facc0035aa89a5fe99cadf38c1b12,https://newsatcl-pctr.c.yimg.jp/t/amd-img/20260315-00010002-sanyo-000-1-view.jpg?exp=10800,2026-03-15T15:19:43+09:00,2026-03-15T15:19:43+09:00,山陽新聞デジタル,sanyo,山陽新聞デジタル,479,オリンピアンの田中さん（左端）を招いた「基礎スケート教室」。大勢の小学生らが滑り方を学んだ＝岡山国際スケートリンク 2018年平昌冬季五輪フィギュアスケート男子代表で岡山県倉敷市出身の田中刑事さんを講師に招いた「基礎スケート教室」（日本スケート連盟主催）が15日、岡山市北区岡南町の岡山国際スケートリンクで開かれ、岡山県内の小学生ら約70人が競技の魅力に触れた。 田中さんが手本を示しながら、氷上での立ち方や前進、止まり方など滑りの基本を指導。田中さんは「前のめりにならずに滑ろう」「靴のブレード（刃）を真っすぐ氷に当てることを意識して」などと助言し、参加者が熱心に取り組んだ。 田中さん（中央）の指導を受ける子どもたち＝岡山国際スケートリンク 岡山市の小学1年女子（7）は「最初は立つだけで大変だったけど、少しずつ滑れたのでうれしかった」と満足そう。4年前に現役を引退し、指導者となった田中さんは「まずは滑りを楽しみ、多くの人に興味を持ってもらえれば」と話した。 教室はスケートの普及を目的に15年から全国で開かれており、岡山県では昨年に続き4度目の開催。,[],[]
横断歩道で高校生はねる　容疑で男逮捕 玉島署（山陽新聞デジタル）,https://news.yahoo.co.jp/articles/1285f043e020be713e10e891f4f01011252b30dc,https://newsatcl-pctr.c.yimg.jp/t/amd-img/20260315-00010001-sanyo-000-1-view.jpg?exp=10800,2026-03-15T14:34:48+09:00,2026-03-15T14:34:48+09:00,山陽新聞デジタル,sanyo,山陽新聞デジタル,193,事件・事故 岡山県警玉島署は15日、自動車運転処罰法違反（過失傷害）の疑いで、岡山県浅口市、無職の男（79）を現行犯逮捕した。 逮捕容疑は同日午前7時45分ごろ、同県倉敷市玉島八島の県道交差点で軽乗用車を運転中、自転車で横断歩道を渡っていた同市、高校3年の男子生徒（18）をはね、顔を骨折するなどの重傷を負わせた疑い。容疑を認めている。 署によると、現場は信号機のない片側2車線の直線。,[],[]
酒気帯び運転で追突か　容疑で男逮捕 水島署（山陽新聞デジタル）,https://news.yahoo.co.jp/articles/1b1d7111cda204c3c585926c5d06afb9f19e0505,https://newsatcl-pctr.c.yimg.jp/t/amd-img/20260315-00010000-sanyo-000-1-view.jpg?exp=10800,2026-03-15T14:13:10+09:00,2026-03-15T14:13:10+09:00,山陽新聞デジタル,sanyo,山陽新聞デジタル,223,事件・事故 岡山県警水島署は15日、自動車運転処罰法違反（過失傷害）と道交法違反（酒気帯び運転）の疑いで、岡山県倉敷市、会社員の男（40）を現行犯逮捕した。 逮捕容疑は同日午前0時45分ごろ、同市水島西千鳥町の国道430号で、酒気を帯びた状態で乗用車を運転。信号待ちで停車していた同市、男性会社員（27）の乗用車に追突し、腰に軽傷を負わせた疑い。容疑を認めている。 署によると、飲酒検知で呼気1リットル中0・21ミリグラムのアルコールを検出した。,[],[]
