headline,mainEntityOfPage,image,datePublished,dateModified,author,media_en,media_jp,str_count,body,images,external_links
自民党北海道１１区支部　次の衆議院議員選挙の候補予定者となる支部長の公募を決定（HTB北海道ニュース）,https://news.yahoo.co.jp/articles/a2f02026030d5ef3b7c276311cc23277ea369df0,https://newsatcl-pctr.c.yimg.jp/t/amd-img/20250223-00000005-htbv-000-1-thumb.jpg?exp=10800,2025-02-23T23:25:30+09:00,2025-02-23T23:25:30+09:00,HTB北海道ニュース,htbv,HTB北海道ニュース,360,"HTB北海道ニュース
自民党の北海道１１区支部は総務会を開き、次の衆議院議員選挙の候補予定者となる支部長を公募することを決めました。


２３日午後２時から帯広市内で開かれた自民党の北海道１１区支部の総務会で、中川郁子元衆議院議員の後任となる新たな支部長を公募することが決まりました。
支部長への応募条件として「十勝にゆかりがある人」を希望する声もあがったということです。

中川元衆議院議員は去年１０月の衆院選で落選し、次の衆院選には出馬しない意向を固めています。

自民党道１１区支部・喜多龍一支部長代行：「（新支部長は）真摯な姿でいけるかどうか。地域に対する深い思い入れもあったらいい」

北海道１１区支部は、選考委員会を設置したうえで来月中には公募をし、５月までに支部長を決めたい考えです。
HTB北海道ニュース",[],[]
日本で暮らす外国人がごみの分別方法や交通ルールなどを学ぶ　　北海道北見市　　（HTB北海道ニュース）,https://news.yahoo.co.jp/articles/474fb46df4d2b1aa4f3ccb8f918028a9d0cdbaae,https://newsatcl-pctr.c.yimg.jp/t/amd-img/20250223-00000004-htbv-000-1-thumb.jpg?exp=10800,2025-02-23T18:15:40+09:00,2025-02-23T18:15:40+09:00,HTB北海道ニュース,htbv,HTB北海道ニュース,318,"HTB北海道ニュース
北海道北見市周辺に住む外国人に日本の交通ルールや防災を学んでもらおうと、北見市や警察がワークショップを開きました。


ワークショップは、北海道オホーツク管内に住む外国人が増えていることを受け、日本のルールに慣れてもらおうと北見市や警察などが開いたものです。

ベトナムなど東南アジアから来て介護や建築の現場で働いている３９人が参加しました。
北見市の担当者が、ごみの分別方法を説明したりハザードマップを見せて避難場所などを伝えました。
また警察は、自転車のシミュレーターを使って正しい交通ルールの指導などを行いました。

北見市での開催は３回目で、参加した人たちは真剣に取り組んでいました。
HTB北海道ニュース",[],[]
「ダンゴムシポーズ」を実践　親子で緊急時の対応を学ぶイベント開催　　札幌・白石区（HTB北海道ニュース）,https://news.yahoo.co.jp/articles/3db2b75950a7737cb807b96b42255d43dc484a5d,https://newsatcl-pctr.c.yimg.jp/t/amd-img/20250223-00000003-htbv-000-1-thumb.jpg?exp=10800,2025-02-23T18:14:33+09:00,2025-02-23T18:14:33+09:00,HTB北海道ニュース,htbv,HTB北海道ニュース,340,"HTB北海道ニュース
大きな災害や不審者から声をかけられるなど緊急時の対応を学ぶ親子向けのイベントが、札幌で開かれました。


札幌市白石区の商業施設で開かれた緊急事態への対応を学ぶイベントには、子ども連れを中心に１５人ほどが参加しました。
講師は救命や防災の教育を提供している団体「救命防災リーダーズ札幌」に所属する救急救命士や保健師などが務めました。

子どもたちは、地震が起きた時に備えて頭と首を守ることができる「ダンゴムシポーズ」を実践したり、がれきに閉じ込められた場合を想定して笛や光でＳＯＳの合図を出して自分がいる場所を知らせる練習などをしました。

参加した子ども：「閉じ込められた感じになったから焦りました　いろいろ勉強できて楽しかったです」
HTB北海道ニュース",[],[]
函館市の２階建てアパートで火事　　３人が病院に運ばれそのうち１人が死亡（HTB北海道ニュース）,https://news.yahoo.co.jp/articles/354d95c85429f7abc6f24f446f00d4b2aaed4631,https://newsatcl-pctr.c.yimg.jp/t/amd-img/20250223-00000002-htbv-000-1-thumb.jpg?exp=10800,2025-02-23T12:27:26+09:00,2025-02-23T12:27:26+09:00,HTB北海道ニュース,htbv,HTB北海道ニュース,313,"HTB北海道ニュース
２３日未明函館市の２階建てアパートで火事があり３人が病院に運ばれそのうち１人が死亡しました。

２３日午前１時前函館市亀田本町の２階建てアパートで「２階から炎が出ている」と通行人から消防に通報がありました。

消防車など１４台が出て消火にあたり火はおよそ１時間後に消し止められました。

消防などによりますとこの火事でアパートの２階に住む年代不明の男性が意識不明の状態で病院に運ばれその後、死亡しました。

また、アパートのそれぞれ別の部屋に住む８０代の男女２人も煙を吸って病院に運ばれています。

警察は亡くなった男性の身元の確認を行うとともに、火の出た原因を詳しく調べています。
HTB北海道ニュース",[],[]
「みそ汁や鍋にどうぞ」手作業で摘み取るフノリ漁が最盛期　函館の海岸（HTB北海道ニュース）,https://news.yahoo.co.jp/articles/52150019884e0e01eebc3930860fedb4f859775d,https://newsatcl-pctr.c.yimg.jp/t/amd-img/20250223-00000001-htbv-000-1-thumb.jpg?exp=10800,2025-02-23T12:27:03+09:00,2025-02-23T12:27:03+09:00,HTB北海道ニュース,htbv,HTB北海道ニュース,289,"HTB北海道ニュース
函館市の海岸では１年で最も寒くなるこの時期に手作業で摘み取るフノリ漁が最盛期を迎えています。

岩にびっしりとついたフノリ。
函館市の戸井地区では去年１２月からフノリ漁が始まりました。

今シーズンはフノリの生育が遅かったものの今月に入ってからは順調に育ってきてフノリ漁はいまがピークを迎えています。

干潮で岩が海面に出た時のみ行われるフノリ漁。

津軽海峡からの冷たい波が打ち寄せる中漁師は海に入り手際よく手作業で摘み取っていきます。

フノリはこりこりとした食感が特徴で漁師らはみそ汁や鍋に入れて楽しんでほしいと話していました。
HTB北海道ニュース",[],[]
