headline,mainEntityOfPage,image,datePublished,dateModified,author,media_en,media_jp,str_count,body,images,external_links
全長1.5キロに約120本のソメイヨシノ…浪江町で約15年ぶりにさくら祭り・福島（福島中央テレビ）,https://news.yahoo.co.jp/articles/89f25efdd5574cab67e2cbcb4277dc46484fe6a1,https://newsatcl-pctr.c.yimg.jp/t/amd-img/20250404-07412386-fct-000-2-thumb.jpg?exp=10800,2025-04-04T19:24:01+09:00,2025-04-04T19:27:15+09:00,福島中央テレビ,fct,福島中央テレビ,956,"FCT福島中央テレビ
浜通りの浪江町で、約15年ぶりにさくら祭りが行われています。

連日の寒さもあって、桜はほとんどが蕾ですが、先端のほうは花たちも開花を今か今かと待っているような状態です。

浪江町の請戸川リバーラインの桜並木からお伝えします。少し風が冷たく肌寒い天気となっていますが、日中は数日ぶりに暖かい日差しが降り注ぎ桜の開花も近づいてきました。
今月1日からライトアップも始まり足元を綺麗に照らしてくれています。
地元の人によりますと、こちらの桜は来週にかけて見頃を迎える見込みだということです。

満開の時の過去の映像がこちらです。請戸川リバーラインの桜並木は川沿いの土手全長1.5キロに約120本のソメイヨシノが咲き誇ります。
通る人は皆、心を奪われてしまうような場所です。

浪江町のシンボルの1つでもあるこの場所は地元の人たちが毎年手入れをして大切に守り続けてきました。
圧巻の光景...。見頃はまだということですが、多くの人の姿が見られます。
というのも、ここではきょう東日本大震災後初めて約15年ぶりにさくら祭りが行われています。
震災後、初めてとなる請戸川リバーラインの「さくら祭り」。
地元にとっては念願の祭りとあって、商工会やご当地グルメのお店など、多くの人が朝から準備に追われました。

浪江町の春の風物詩であるさくら祭りですが、福島第一原発の事故によって全町避難を強いられた影響で震災後は開催できずにいました。
「地元の桜を守りたい」…そんな思いで震災の2年後から桜の保全活動を行ってきたのが町民を中心に結成された「絆さくらの会」です。

副実行委員長を務める小黒敬三さんもその1人です。
■さくら祭り副実行委員長小黒敬三さん（69）
「やめようって気にならない。もうライフワークの一部になってる。最初言い出しっぺで皆どこまで協力してくれるのかなって思ったけど、色々お願いするとスムーズに物事が進んでいって、やっぱりみんなもそういう思いだったんだなって」
地元の人や新たに移住してきた人たちなどの協力を得ながら、きょう15年ぶりの開催を実現させました。

さくら祭りのフィナーレとなる花火大会はこのあと午後7時からです。
桜のライトアップは、来週10日（木）まで行われています。",[],[]
福島市の桜が開花　信夫山公園のソメイヨシノが平年より3日早く咲き出す・福島県（福島中央テレビ）,https://news.yahoo.co.jp/articles/c16894b23aae4df36b276500ac2eed4de83b7017,https://newsatcl-pctr.c.yimg.jp/t/amd-img/20250404-07871722-fct-000-1-thumb.jpg?exp=10800,2025-04-04T18:53:00+09:00,2025-04-04T18:53:00+09:00,福島中央テレビ,fct,福島中央テレビ,390,"FCT福島中央テレビ
桜前線が福島にも到達しました。福島地方気象台は、4月4日午後、福島市の桜の開花を発表しました。
知事も「相性抜群」と笑顔　ファミリーマートで福島県産食材のおにぎりやパスタ販売
福島市の信夫山公園です。
4日午後2時ごろ、福島地方気象台の職員が園内にあるソメイヨシノを確認します。
そして…
■福島地方気象台 主任技術専門官　柴田 和彦さん
「気象台は4月4日、桜の開花を観測しました」

ソメイヨシノの標本木に5、6輪以上の開花が確認されました。
福島市の桜の開花は平年より3日早く、2024年より1日遅くなっています。
3月下旬は気温が平年よりも高い日が多かったため、平年と比べて早い開花となりました。

■山形県から来た家族
Q桜見てどう？
■姉
「きれい」
■妹
「きれい」
■母親
「きょうはすごく天気が良くて昨日まで雨だったから良かったと思います」",[],[]
日本食ブームにも冷や水…日本酒も影響必至か“トランプ関税”影響広がる　福島県（福島中央テレビ）,https://news.yahoo.co.jp/articles/ebfd9343fb05fa6e4a133873194dc2c453a5c973,https://newsatcl-pctr.c.yimg.jp/t/amd-img/20250404-09664398-fct-000-1-thumb.jpg?exp=10800,2025-04-04T18:47:00+09:00,2025-04-04T18:47:00+09:00,福島中央テレビ,fct,福島中央テレビ,967,"FCT福島中央テレビ
世界に衝撃を与えたいわゆるトランプ関税。日本には24パーセントの追加関税が課されるとされていて発表から一夜明け、福島県内にも波紋が広がっています。
▼【詳報】福島県にも津波襲来で浸水か　南海トラフ巨大地震被害想定見直しを詳しく
■トランプ氏演説 きのうのC配信
「日本は我々に46パーセントの関税をかけている。我々は日本に24パーセントの関税をかける」

日本時間の4月3日、トランプ大統領が発表した相互関税。日本に対しては24パーセントの追加関税が課されることに…先行きの不透明感から東京株式市場では日経平均が連日の大幅下落。

衝撃の発表から一夜、ここ福島でも波紋が広がっています。

自治体からも困惑の声が…

■木幡市長
「今回のトランプ関税、まさに個性的なひとりの権力者によって引き金が引かれて世界的な騒動になっているわけでありますが、日本政府がどのように対応するのかみて、我々として、できる対策がないか検討したい」

そして、トランプ関税で大きな影響を受けると見られている福島県産品が…

■福島県観光物産館 櫻田武館長
「ほんとにやるのかとびっくり。日本食ブームというのがあるから日本酒が結構行っている」

福島が誇る日本酒です。近年は日本食ブームもあり、海外でも人気が高いんです。そのため福島県もアルコールの輸出に力を入れていて、今は震災後に比べると7倍以上。約6億6000万円を輸出しています。その中でも、最も多く輸出している国がアメリカなのです。

■福島県観光物産館 櫻田武館長
「いくら円安だといっても高くなれば客足は遠のきますし、アメリカって世界中からたくさんの方が集まってくるんだけども、その人たちにも、なんでこんなに高いんだとなってしまったらどうなのかなと思っている」

一方、最近は水産物や工芸品などいわゆる世界が知らない「メイドイン福島」を売り出していこうという動きもあります。

トランプ関税の発動によって世界への発信が弱まってしまう…県産品一筋で仕事をする櫻田館長も影響を懸念しています。

■福島県観光物産館 櫻田武館長
「北米市場というのは魅力的ですので、そこに関税がかかってしまうと高くなってしまうので、これから輸出に打って出ようという人にとってはマイナスでしかない」",[],[]
「津波が来ないことを祈っている」注目ニュースは“南海トラフ巨大地震”　津波襲来予想に地元住民は　福島県（福島中央テレビ）,https://news.yahoo.co.jp/articles/f2f442f8704688257087a49f88e8d607fdde2275,https://newsatcl-pctr.c.yimg.jp/t/amd-img/20250404-07596773-fct-000-1-thumb.jpg?exp=10800,2025-04-04T18:47:00+09:00,2025-04-04T18:47:00+09:00,福島中央テレビ,fct,福島中央テレビ,903,"FCT福島中央テレビ
日本テレビ系列30局はインターネットの「日テレニュースサイト」でも最新のニュースをお届けしています。
▼【詳報】福島県にも津波襲来で浸水か　南海トラフ巨大地震被害想定見直しを詳しく
多くのユーザーの関心を集めたのが30年以内に発生する確率が80％程度とされる「南海トラフ巨大地震」に関するニュースです。

国は約10年ぶりに南海トラフ巨大地震を巡り新たな被害想定を公表しました。新たな想定では、震度6弱以上の揺れや3メートル以上の津波の被害が生じる市町村の数は31都府県764市町村に及び、前回の被害想定より増加。死者数は最大で約29万8000人にのぼり、うち7割は津波によるものとされています。

この新たな想定。津波の影響は広範囲に及び、これまで想定されていなかった県内にも津波が襲来するとされています。その高さは最大でいわき市で4メートル、相馬市でも3メートルとされ、最短で地震発生から1時間半後には津波が到達するとされています。

また、人が流され命の危険がある「深さ30センチ以上」の浸水面積は、いわき市で250ヘクタールにのぼり、これは東京ドーム約53個分の面積に相当しますこうした想定に沿岸部にある店からは…

■山六観光 及川真広 営業部長
「東日本大震災では大変な思いをしたんで、もう二度と津波が来ないのが地域の方の望みだと思う。（南海トラフ巨大地震では）東北地方、全国の方が心配していると思うので（津波が）来ないことを祈っている」

今回、明らかになった南海トラフ巨大地震の新たな被害想定を検討してきた専門家は…

■名古屋大学 福和伸夫名誉教授
「何としても南海トラフ地震の被害を減らさない限り、この国の将来が非常に危ぶまれるということを感じていて、何とか国民の皆さんにそろそろ本気になって対策を進めてほしいと思っています」

今回の被害想定では地震発生時に迅速な避難を徹底すれば、津波の死者数が7割減少するなど被害を減らせるとされています。いつ起こるかわからない巨大地震に対し、日ごろの備えを万全にし、地域で防災意識を高めていくことが今後も重要となりそうです。",[],[]
ふさふさの毛が生えそろった姿はイマだけ!!　水族館に生まれたある生き物の赤ちゃんが人気　福島・いわき市（福島中央テレビ）,https://news.yahoo.co.jp/articles/d52df14f8ec000ab0d336881e261211963ec0b8c,https://newsatcl-pctr.c.yimg.jp/t/amd-img/20250404-01333952-fct-000-1-thumb.jpg?exp=10800,2025-04-04T18:47:00+09:00,2025-04-04T18:47:00+09:00,福島中央テレビ,fct,福島中央テレビ,646,"FCT福島中央テレビ
福島県いわき市の水族館「アクアマリンふくしま」に3月、ある動物の赤ちゃんが誕生しました。今しか見ることのできないかわいらしい姿が人気を集めています。
▼【詳報】福島県にも津波襲来で浸水か　南海トラフ巨大地震被害想定見直しを詳しく
いわき市の「アクアマリンふくしま」で3月22日、誕生したのが、クリっとしたつぶらな瞳にふさふさの毛並み。ゴマフアザラシの赤ちゃんです。現在の体重は20キロほどで名前はまだありません。

■アクアマリンふくしま担当飼育員 吉田光輔さん
「大変甘えん坊な性格をしています。だいぶ動き回ったり泳ぎ回ったりしもしているのでかなり活発的な子どもですね」

そんな赤ちゃんですが、取材したこの日はミルクを飲んだ直後ということもありお母さんの「くらら」の近くで少し眠たそうです。訪れた人たちもこのかわいらしい姿に夢中です。

赤ちゃんのお父さん「ユキナ」は2024年9月に天国へと旅立ちました。お父さんの分まで愛くるしい表情を見せてくれるゴマフアザラシの赤ちゃん。

あと10日ほどすると、毛が生え変わって、その特徴であるゴマ模様が出てくるそう。ふさふさの毛が生えそろった姿はもうすぐ見納めです。

■アクアマリンふくしま担当飼育員 吉田光輔さん
「今しかこの真っ白い姿というのはご覧になれませんので、今すぐにでも来ていただいてこのかわいい姿ぜひご覧になってください」

名前についてはスタッフで話し合って決めるか、一般公募も検討しているということです。",[],[]
知事も「相性抜群」と笑顔　ファミリーマートで福島県産食材のおにぎりやパスタ販売　（福島中央テレビ）,https://news.yahoo.co.jp/articles/fdcabf4e8f1a11d514b8df88d0d8396f210b379d,https://newsatcl-pctr.c.yimg.jp/t/amd-img/20250404-01574737-fct-000-2-view.jpg?exp=10800,2025-04-04T18:43:00+09:00,2025-04-04T18:48:21+09:00,福島中央テレビ,fct,福島中央テレビ,350,"FCT福島中央テレビ
福島県産の食材をつかったおにぎりやパスタが大手コンビニエンスストアで販売されることになりました。
福島市で平年より3日早くソメイヨシノ開花・福島県
４月からコンビニエンスストアのファミリーマートで発売されるのは、会津みそを使ったおにぎりと福島県産しいたけの入ったパスタです。

ふくしまデスティネーションキャンペーンのプレイベントが4月に開幕したのを記念して企画されました。
きょうはファミリーマートの関係者が内堀知事に商品の発売を報告し、知事もさっそくおにぎりを試食しました。

■内堀知事
「この会津味みそのねぎ味噌ばっちりですね。相性抜群」

おにぎりは4月8日から、パスタは来月から福島県内を含む東北6県と新潟県のおよそ1200店のファミリーマートで順次、販売されます。",[],[]
二本松市で男性がライオンに襲われ死亡した事故　当時の園長ら罰金50万円の略式命令（福島中央テレビ）,https://news.yahoo.co.jp/articles/f04f8734c927f2501ad8a685ed0e2245a3e94a0f,https://newsatcl-pctr.c.yimg.jp/t/amd-img/20250404-03482331-fct-000-3-thumb.jpg?exp=10800,2025-04-04T18:24:00+09:00,2025-04-04T19:09:20+09:00,福島中央テレビ,fct,福島中央テレビ,246,"FCT福島中央テレビ
2023年に二本松市の東北サファリパークで飼育員がライオンに襲われ死亡した事故をめぐり、当時の園長らに略式命令が出されました。

2月に福島区検に業務上過失致死の罪で略式起訴されていたのは事故発生当時、園長だった70代男性と飼育員の30代男性です。

2023年9月、東北サファリパークで閉園作業をしていた当時53歳の男性飼育員が檻の中でライオンに襲われ死亡した事故をめぐり、2人は必要な安全管理を怠ったとして、3月に福島簡易裁判所は罰金50万円の略式命令を出しました。",[],[]
東日本国際大学などいわき市の学校法人昌平黌の4つの学校が合同入学式・福島県（福島中央テレビ）,https://news.yahoo.co.jp/articles/d85af8b2dac1f97fefa23fcda7ed9d960e1988b8,https://newsatcl-pctr.c.yimg.jp/t/amd-img/20250404-08442755-fct-000-3-thumb.jpg?exp=10800,2025-04-04T18:19:00+09:00,2025-04-04T18:48:21+09:00,福島中央テレビ,fct,福島中央テレビ,263,"FCT福島中央テレビ
いわき市の東日本国際大学など4つの学校が合同で入学式を行いました。

入学式を行ったのは、学校法人昌平黌の東日本国際大学といわき短期大学の新入生399人と、附属の中学校と高校の新入生286人です。
福島市で平年より3日早くソメイヨシノ開花・福島県
式では緑川浩司理事長が「歴史と伝統の昌平黌の一員となって、誇りを胸に世界へと羽ばたいてください」とエールを送りました。

これに対して大学と短期大学の新入生代表が「友情を育み励まし合いながら、夢や目標に向かって日々精進していくことを誓います」と述べました。",[],[]
福島県立高校の講師（当時）が3月の送別会後に飲酒運転し単独事故　現在入院中　（福島中央テレビ）,https://news.yahoo.co.jp/articles/c59fa061b3f6a779e419f42683101d13790f4a26,https://newsatcl-pctr.c.yimg.jp/t/amd-img/20250404-05624266-fct-000-5-thumb.jpg?exp=10800,2025-04-04T15:44:00+09:00,2025-04-04T19:10:16+09:00,福島中央テレビ,fct,福島中央テレビ,312,"FCT福島中央テレビ
３月２６日、当時県立高校で講師を務めていた２０代の男性が、送別会で飲酒後にいわき市内で車を運転し事故を起こしていたことがわかりました。

福島県教育委員会によりますと、当時、講師を務めていた２０代の男性は、３月２６日に勤務していた県立高校の送別会で飲酒後に、いわき市内で車を運転し単独事故を起こしました。
男性は救急搬送され意識はありますが、現在、入院中で警察が捜査しています。

男性の任用期間は３月３１日で終了していますが、今年度も任用予定だったということです。

福島県内では、昨年度、教員による不祥事が相次ぎ、福島県教育委員会
は綱紀粛正を図っていくとしています。

（記事更新　4日午後4時）",[],[]
ミャンマー出身者が約115人在住　大地震を受け福島市が募金箱設置・福島県（福島中央テレビ）,https://news.yahoo.co.jp/articles/e5880ca0f731d632f18b9f540fb5a74edac143c4,https://newsatcl-pctr.c.yimg.jp/t/amd-img/20250404-01474179-fct-000-4-thumb.jpg?exp=10800,2025-04-04T15:11:00+09:00,2025-04-04T19:12:16+09:00,福島中央テレビ,fct,福島中央テレビ,296,"FCT福島中央テレビ
ミャンマーで発生した大地震では、これまでに死者が3000人を超えたとされています。
「ふくしま花回廊」花のシーズン到来でセレモニー　福島
こうした中、福島市は一日も早い復興に向けて支援を呼びかける募金箱を市役所や道の駅ふくしまなど市内4か所に設置しました。

また福島市国際交流協会は振り込みによる募金も受け付けています。

受付は5月3日までで、浄財は日本赤十字社を通じて現地に送られます。

福島市には、2月末時点でミャンマー出身者が115人いて市内の企業で働くなどしています。

木幡市長は「同じく災害に苦しんだ者として協力していきたい」と市民に呼びかけています。",[],[]
福島市で平年より3日早くソメイヨシノ開花・福島県（福島中央テレビ）,https://news.yahoo.co.jp/articles/d2c22389759fc1f2fd2eaa86698b21f8e59bfc20,https://newsatcl-pctr.c.yimg.jp/t/amd-img/20250404-05919243-fct-000-3-view.jpg?exp=10800,2025-04-04T14:29:00+09:00,2025-04-04T14:41:15+09:00,福島中央テレビ,fct,福島中央テレビ,187,"FCT福島中央テレビ
福島市で桜の開花が発表されました。

4月4日午後2時ごろ、福島地方気象台の職員が福島市の信夫山公園にあるソメイヨシノの標本木を観測し、5、6輪以上桜が開花しているのを確認しました。

福島市の桜の開花は平年より3日早く、去年よりは1日遅くなりました。

3月下旬は気温が平年よりも高い日が多かったため、平年と比べて早い開花となった気象台はみています。",[],[]
「3輪ぐらいの開花を確認したけど」福島市の標本木の桜開花宣言は午後か　福島（福島中央テレビ）,https://news.yahoo.co.jp/articles/97a845a49ccf5a6f8a83f58a846a023c8f2edc19,https://newsatcl-pctr.c.yimg.jp/t/amd-img/20250404-05396393-fct-000-2-thumb.jpg?exp=10800,2025-04-04T12:44:01+09:00,2025-04-04T12:46:15+09:00,福島中央テレビ,fct,福島中央テレビ,282,"FCT福島中央テレビ
4日の県内は午前中から晴れ間が広がりましたが、福島市ではまだ、桜の開花は宣言されていません。

県内はきのうまでの雨から一転、午前中から晴れ間が広がり、気温が上がりました。サクラの開花が足踏み状態となっていた福島市では午前10時ごろ、福島地方気象台の職員が信夫山公園にある、ソメイヨシノの標本木を確認しました。

■福島地方気象台 気象情報官 柴田 和彦 さん
「まだ開花（宣言）にはなららい状況。3輪ぐらいの開花を確認したけど、規定は5、6輪なので」

県内はこの後も気温が上がる見通しで、午後に開花が宣言される可能性があるということです。",[],[]
デブリ取り出しに向けカメラ交換作業始まる　福島第一原発（福島中央テレビ）,https://news.yahoo.co.jp/articles/b313699651b6ae200c2adb51d44e0c446000e0ed,https://newsatcl-pctr.c.yimg.jp/t/amd-img/20250404-07959725-fct-000-3-thumb.jpg?exp=10800,2025-04-04T11:22:00+09:00,2025-04-04T12:45:16+09:00,福島中央テレビ,fct,福島中央テレビ,331,"FCT福島中央テレビ
東京電力は2回目の燃料デブリの取り出しに向けて、装置のカメラの交換などを進めています。
郡山市の路上で女性のお尻を触ったか…51歳男を不同意わいせつ容疑で逮捕・福島県
福島第一原発2号機では早ければ今月にも2回目の燃料デブリの取り出しが行われる予定です。
今回の取り出しでも1回目に使用した装置を使いますが、東京電力は4日から前回、不具合があった装置に取り付けるカメラの交換を進めています。

また、装置先端の爪形の器具についても燃料デブリを採取する際、大きさを把握しやすいよう爪部分の長さを5ミリから7ミリに変更します。カメラの交換などには2週間ほどかかる見込みで、その後、動作確認などを行い、燃料デブリの取り出しに着手するとしています。",[],[]
郡山市の路上で女性のお尻を触ったか…51歳男を不同意わいせつ容疑で逮捕・福島県（福島中央テレビ）,https://news.yahoo.co.jp/articles/46284052b3e0ed8c7d7f001cc511067744506ecc,https://newsatcl-pctr.c.yimg.jp/t/amd-img/20250404-01647418-fct-000-2-view.jpg?exp=10800,2025-04-04T10:32:00+09:00,2025-04-04T10:46:17+09:00,福島中央テレビ,fct,福島中央テレビ,198,"FCT福島中央テレビ
郡山市内の路上で30代の女性の身体を触るなどした疑いで、郡山市の男が逮捕されました。

不同意わいせつ容疑で逮捕されたのは郡山市大槻町に住む無職の51歳の男です。

逮捕された男は4月2日の午後5時頃、郡山市内の路上で見知らぬ30代の女性）のお尻付近を触るなどした疑いです。

警察が被害女性からの届出を受けて、捜査し男を逮捕しました。
男は容疑を認めているということです。",[],[]
真夜中に南相馬市内の神社で賽銭泥棒か　54歳の男を現行犯逮捕・福島県（福島中央テレビ）,https://news.yahoo.co.jp/articles/c35badb4a9252eb32665ddd143533c79309841f5,https://newsatcl-pctr.c.yimg.jp/t/amd-img/20250404-01313388-fct-000-2-view.jpg?exp=10800,2025-04-04T10:30:00+09:00,2025-04-04T10:46:17+09:00,福島中央テレビ,fct,福島中央テレビ,168,"FCT福島中央テレビ
真夜中に南相馬市内の神社で賽銭を盗んだ疑いで54歳の男が現行犯逮捕されました。

窃盗（さい銭ねらい）容疑で逮捕されたのは自称・南相馬市原町区に住む無職の54歳の男です。
逮捕された男は4月4日の午前1時ごろ、南相馬市の神社で賽銭を盗んだ疑いがもたれています。

犯行を目撃した警察官が被疑者を現行犯逮捕しました。",[],[]
ベルトコンベアに腕を巻き込まれ…富岡町の工場で男性が右腕を骨折する労災事故・福島（福島中央テレビ）,https://news.yahoo.co.jp/articles/f69d3ba254f78b0d477ea398b5d832cb39e672a3,https://newsatcl-pctr.c.yimg.jp/t/amd-img/20250404-09317681-fct-000-2-view.jpg?exp=10800,2025-04-04T10:04:00+09:00,2025-04-04T10:16:15+09:00,福島中央テレビ,fct,福島中央テレビ,211,"FCT福島中央テレビ
双葉署富岡町の工場で男性会社員が機械の清掃中にベルトコンベアに腕を巻き込まれ、骨折する労災事故がありました。

事故が起きたのは富岡町の富岡工業団地内にあるROCKWOOLJapanの工場です。
4月3日の午後6時30分ころ、45歳の会社員の男性が一人で機械の清掃をしていたところベルトコンベアに右の前腕部を巻き込まれ、開放骨折する重傷を負いました。

警察が労災事故として事故の原因を調べています。",[],[]
