headline,mainEntityOfPage,image,datePublished,dateModified,author,media_en,media_jp,str_count,body,images,external_links
ワインが常時グラスで80種もある『GRAPES OMOTESANDO CHEESE ＆ CHOCOLATE』 チョコとのベストな相性は（おとなの週末）,https://news.yahoo.co.jp/articles/6ef7cb45ae93dce8337ec4b491996add60c8a4f4,https://newsatcl-pctr.c.yimg.jp/t/amd-img/20240618-01380741-matomeshi-000-3-view.jpg?exp=10800,2024-06-18T14:00:00+09:00,2024-06-18T15:08:34+09:00,おとなの週末,matomeshi,おとなの週末,921,\n（ドリンク）シャトー ラ・ グラス・デュー 2600円、チョコレートの盛り合わせ（ハーフサイズ）2000円 カカオにこだわった職人手作りのチョコは5種類\n全店実食調査！『おとなの週末』が自信を持っておすすめするお店をご紹介します。今回は、東京・表参道のワインバー『GRAPES OMOTESANDO CHEESE ＆ CHOCOLATE(グレープス オモテサンドウ チーズ＆チョコレート)』です。\n【画像ギャラリー】入口の急階段、暗い照明が素敵な店内\n一流のワインとチョコレートの心躍るマリアージュ\n「ワインとチョコレートの相性は実はなかなか難しい」。そう話すのは店長でソムリエの多家さんだ。\n\nチョコレートは渋みがあるので、白ワインよりもタンニンのある赤ワインが合う。それも果実味に甘さのあるふくよかな南のワインがおすすめという。\n\n扱うチョコレートは世界のトップパティシエも認めるフランス・ヴァローナ社のボンボンショコラで、ベストな相性でいうならば、ボルドーやカリフォルニアのジンファンデルだとか。\n\nシャトー ラ・ グラス・デュー 2600円、チョコレートの盛り合わせ(ハーフサイズ)2000円\n\nまたこちらでは、「コラヴァン」というワインを酸化させずに注ぐツールを使うので、なんと常時グラスで80種も開いている。\n\nそこで普段グラスでは飲めないような一流シャトーのワインも気軽にチョコに合わせられるのだ。ワインマニアならずともこの夢のような共演にはワクワクする。\n\n【店長・多家慶喜さんコメント】\n「2週間に1回ジャズの生演奏ライブも開催してます」\n東京・表参道『GRAPES OMOTESANDO CHEESE ＆ CHOCOLATE』\n[住所]東京都渋谷区渋谷2-8-12ラ・グリスィーヌ地下1階\n[電話]03-4400-1448\n[営業時間]19時～翌1時(最終入店)\n[休日]月、第3日\n[交通]地下鉄銀座線ほか表参道駅B1出口から徒歩5分\n\nおとなの週末2024年7月号は「下町ぶらグルメ」\n\n撮影/貝塚隆、取材/岡本ジュン\n※2024年2月号発売時点の情報です。,['https://newsatcl-pctr.c.yimg.jp/t/amd-img/20240618-01380741-matomeshi-000-3-view.jpg?pri=l&w=640&h=426&exp=10800'],"['https://news.yahoo.co.jp/articles/6ef7cb45ae93dce8337ec4b491996add60c8a4f4/images/000', 'https://otonano-shumatsu.com/images/380741']"
【実食】日本一予約のとれないラーメン店『らぁ麺 飯田商店』の冷やし担々麺が、デニーズに限定爆誕!（おとなの週末）,https://news.yahoo.co.jp/articles/8eccd558cca166f342a9bfdacbd13eb12cf68090,https://newsatcl-pctr.c.yimg.jp/t/amd-img/20240618-01383736-matomeshi-000-5-view.jpg?exp=10800,2024-06-18T08:00:00+09:00,2024-06-18T23:10:20+09:00,おとなの週末,matomeshi,おとなの週末,1496,\n「らぁ麺飯田商店」の冷やし担々麺\n1974年に神奈川県に1号店をオープンして以来、今や国内に多くの店舗を展開するファミリーレストラン『デニーズ』が、神奈川県湯河原の人気ラーメン店『らぁ麺 飯田商店』とコラボして、期間限定のラーメンを発売するという。 飯田将太店主が監修した大注目のメニューをご紹介しよう!!\n【画像ギャラリー】「らぁ麺 飯田商店」の飯田将太店主が監修する究極のメニューは必見\nラー油とホアジャオ、クミンにコリアンダーなどの多彩なスパイスで、口の中がお祭り騒ぎ\n創業50周年を迎え、『Regalo』の小倉知巳シェフや『アロマフレスカ銀座』原田慎次シェフなど、名だたるシェフたちの監修メニューで話題をさらってきた『デニーズ』。\n\n2024年6月18日(火)から7月22日(月)までの期間限定で、神奈川県湯河原の人気ラーメン店「らぁ麺 飯田商店」の飯田将太店主が監修した、「冷やし豆乳担々麺～香るスパイス」(1485円)が登場する。\n\n飯田商店といえば、毎週ネットで予約受けつけがスタートされるやいなや、瞬殺で席が埋まってしまう超人気店。業界最高権威の「TRYラーメン大賞」で4年連続1位を獲得し、殿堂入りとなったレジェンド店だ。\n\n今回のコラボでは、同店の看板メニューの1つ、しょうゆラーメンが最初の候補だったものの、飯田店主の提案で冷やし担々麺に進路変更したという。\n\n「もともとデニーズの担々麺が好きで、いろんなところでオススメしていたんですよ。今回はそのおいしさを活かして、冷たい担々麺をつくろう、ということになりました。じつは僕、デニーズでアルバイトをしていたことがあるんです。オペレーションの着地点を考えるのに苦労しましたが、昔の経験が役に立ちました」(飯田店主)\n\nではさっそく、「冷やし豆乳担々麺」を実食！レンゲでスープをすくってみたところ、トロリとした濃厚な質感。口に運ぶと、豆乳だけでつくったとは思えないクリーミーさで、酸味が心地よい。提供前に挽いて加えるというホアジャオやクミン、コリアンダーなどのスパイスが、香りに幅を加えている。\n\nスパイスそれぞれが口の中で主張し合うものの、最終的に握手をするようなバランスはお見事！動物系スープは一切使っていないというが、冷たいながら奥深い味わいが堪能できた。\nラー油をまとった赤い麺に、クリーミーで酸っぱいスープがベストマッチ\nスープに感動しながら、麺を持ち上げてみた。麺はラー油としょう油ダレを絡めたまぜ麺状態になっており、その上に桜エビと肉味噌＆パクチーがオン。さらにアーモンド、くるみ、ヘーゼルナッツ、マカダミアナッツなどのナッツ類がトッピングされていた。それらの食感や香り、味わいがスパイスの香りと渾然一体になり、なんとも楽しい食感だ。\n\nいろいろな素材が入っているため、食べる箇所によって味わいが微妙に変わるのもポイント。「豆乳だけ？物足りないのでは？」と疑っていたが、そんな懸念は一気に吹き飛ぶ味わいだった。\n新たな冷やし担々麺の世界をお試しあれ！\n食べ進むうちに、麺にからんだラー油としょう油ダレがクリーミーな豆乳スープに溶け出し、食べ進むごとに「オート味変」していくのがおもしろい。けっこうなボリュームなのに、どんどん箸が進む。\n\nとうとう麺がなくなり、スープをすくって飲んでみたところ、肉味噌や桜エビ、ナッツ類をまとったスパイシー豆乳がとっても美味。麺がなくなっても楽しい、ライブ感溢れる冷やし担々麺を、ぜひお試しあれ！\n\n文・写真/萩原はるな,['https://newsatcl-pctr.c.yimg.jp/t/amd-img/20240618-01383736-matomeshi-000-5-view.jpg?pri=l&w=640&h=426&exp=10800'],"['https://news.yahoo.co.jp/articles/8eccd558cca166f342a9bfdacbd13eb12cf68090/images/000', 'https://otonano-shumatsu.com/images/383736']"
厚切りロースはふっくら柔らか 口に入るまでの時間を逆算して仕上げる『とんかつ いわい』の絶品とんかつ（おとなの週末）,https://news.yahoo.co.jp/articles/258eb1950d752f97f01425f2a4ba123420e1271d,https://newsatcl-pctr.c.yimg.jp/t/amd-img/20240618-01371316-matomeshi-000-1-view.jpg?exp=10800,2024-06-18T11:00:00+09:00,2024-06-18T11:00:00+09:00,おとなの週末,matomeshi,おとなの週末,940,"\n『とんかつ いわい』特選厚切りロースかつ定食（240g） 3000円（夜はポテトサラダ付きで3050円）※昼夜各限定8食 赤身と脂のバランスを見て一番おいしく味わえる厚みを計算し、個性違いの2種をブレンドしたラードで揚げる。肉は弾力がありつつ柔らかく、茎山葵と鹿児島の醤油で味わうとさっぱり。品書きには240gと書いているが実際は300gあることも\n全店実食調査！『おとなの週末』が自信を持っておすすめするお店をご紹介します。今回は、東京・大門のとんかつ店『とんかついわい』です。\n【画像ギャラリー】上質な脂の甘みが溢れる！惚れ惚れするとんかつの断面\n真摯な姿勢で独自の旨さを追求し続ける！\n限定の厚切りロースはほんのり桃色の火入れに惚れ惚れ。噛めばふっくら柔らかく、鹿児島県産六白黒豚の上質な脂の甘みが口中にあふれてくる。そう、これが旧店名『のもと家』から完全独立した店主、岩井さんが追求する味の""現在地""。\n\n昨日より今日、今日より明日。「よりおいしく。毎日そればかり考えてます(笑)」。ひたむきな姿勢で磨きをかけた技の結晶なのである。\n\n特選厚切りロースかつ定食(240g)3000円\n\n数年前より進化したのはその揚げ方だろう。サクッとなるようパン粉をイチから変え、最初は低温のラードで、終盤は高温で。配膳までの数分数秒、何ならお客が料理写真を撮るだろう時間まで逆算し、最適な状態で提供するよう心掛けているそう。\n\n茎山葵+鹿児島の甘口醤油で……と味わい方ひとつ取ってもすべては肉の味を引き立てるため。岩井流とんかつ、現在も絶賛進化中だ。\n『とんかついわい』\n[住所]東京都港区芝公園2-3-7ソリューション玉川ビル2階\n[電話]03-6809-1529(営業中は対応不可)\n[営業時間]11時半～14時半(13時45分LO)、17時半～21時(20時LO)※食材が売り切れ次第終了、土は昼のみ\n[休日]日・祝\n[交通]都営浅草線ほか大門駅A6出口から徒歩3分、JR山手線浜松町駅北口から徒歩7分\n\nおとなの週末2024年7月号は「下町ぶらグルメ」\n\n撮影/西崎進也、取材/肥田木奈々\n※2024年3月号発売時点の情報です。",['https://newsatcl-pctr.c.yimg.jp/t/amd-img/20240618-01371316-matomeshi-000-1-view.jpg?pri=l&w=426&h=640&exp=10800'],"['https://news.yahoo.co.jp/articles/258eb1950d752f97f01425f2a4ba123420e1271d/images/000', 'https://otonano-shumatsu.com/images/371316']"
これぞ町パンのサンドイッチ!がっつり食べてお腹も心も大満足～コッペ・バーガータイプ～（おとなの週末）,https://news.yahoo.co.jp/articles/d9c033bf1f45dee66aef198b85ac36997d0adf31,https://newsatcl-pctr.c.yimg.jp/t/amd-img/20240618-01377040-matomeshi-000-1-view.jpg?exp=10800,2024-06-18T06:00:00+09:00,2024-06-18T06:00:00+09:00,おとなの週末,matomeshi,おとなの週末,2185,\nコッペ・バーガータイプの町パンサンドイッチ（右上）［1］『パン・ムラカミ』パスタサラダ 220円、［2］（右下）『メイユール』［3］ハンバーグロール 280円、（左上）『ナカヤ』［4］いも豚のカツバーガー 378円、（左下）『サンモリッツ』タマゴロール 290円\nパン屋さんで忘れちゃいけないのが、サンドイッチ。サクッと手軽にお腹を満たすにはピッタリのメニューでしょう。ここでは、町のパン屋さんでよく見かけるコッペ・バーガータイプをご紹介。町のパン屋さんでよく見かけるこのタイプ。パンにたっぷり挟まった具材と共にかぶりつきたい珠玉の4品をご覧あれ！\n【画像ギャラリー】これぞ町パンのサンドイッチ！がっつり食べてお腹も心も大満足～コッペ・バーガータイプ～\n[1]『パン・ムラカミ』「パスタサラダ」220円@勝どき\nサラダにシナモン！素朴なコッペに夫婦のアイデアが宿る\n\nご夫婦で営む小さなお店だ。対面式で、ショーケースに並ぶサンドやバーガーの惣菜パンから選ぶと、奥様がそろばんをパチパチッと弾く。叔母にそろばんができるからと誘われて店に立ち、50年。ご主人とアイデアを出し合って挟む具材を考案している。ほぼすべて手作りだ。中でも「パスタサラダ」が秀逸。軽やかなマヨネーズに、シナモンが効いていて妙にハマる。「ハムやさい」や「ヒレカツサンド」の手のひらサイズのサンドも旨し。\n\n【コレもおすすめ！】ハムやさい220円\n\n[住所]東京都中央区勝どき1-7-1勝どきサンスクエア1階\n[電話]03-3533-7991\n[営業時間]7時～18時※売り切れ次第終了\n[休日]土・日・祝\n[交通]都営大江戸線勝どき駅A1出口から徒歩すぐ\n[2]『メイユール』「ハンバーグロール」280円@新富町\n家庭の味がほっと落ち着く鶏×豚のジューシーハンバーグ\n\n古くは商店が多く建ち並んだ中央区湊。明治36年に洋菓子店として始まり、現在は手作りお弁当とサンドイッチの店として愛される。ここでは「ハンバーグロール」をぜひ食べてほしい。ドドンとふたつ挟まれたボリューミーなハンバーグがシンプルに旨い！ふわっと柔らかいのにジューシーな食感は、鶏と豚の挽き肉を合わせているから。\n\n粗めの玉ねぎ、ハンバーグの下に敷かれたシャキッとキャベツの食感も小気味いい。なんだかほっとする味だなと思っていたら、ハンバーグは店主一家の秘伝レシピなんだそう。おいしさの秘密はケチャップソースにも仕込まれているとか……。ぜひ実食して確かめるべし。\n\n【コレもおすすめ！】ヒレカツサンド650円\n\n[住所]東京都中央区湊2-9-3\n[電話]03-3551-5913\n[営業時間]8時～14時\n[休日]土・日・祝\n[交通]地下鉄有楽町線新富町駅7番出口から徒歩7分\n[3]『サンモリッツ』「タマゴロール」290円@麻布十番\n移り変わる町の姿を見守ってきた老舗の変わらない味\n\n「うちは洒落たパンもないし、普通の味しかないのよ～」と店のお母さんは謙遜するが、その素朴なおいしさが愛おしいんです。ブラウンの焼き色もきれいな「タマゴロール」は定番人気。かぶりつけばパンの芳ばしい香りがほわんと鼻に届き、クリーミーな卵の旨みが口いっぱいに広がる。\n\nペッパーの風味も絶妙に効いていて、存在感ある白身の食感も楽しい。聞けば創業は昭和24(1949)年頃だそうで、他にも郷愁を誘う美味がいろいろ。茶葉を混ぜ込んだ生地でクリームを挟んだ「紅茶ケーキ」も昔から変わらない味。ほっ。\n\n【コレもおすすめ！】紅茶ケーキ ダージリン290円\n\n[住所]東京都港区元麻布3-11-6\n[電話]03-3408-6381\n[営業時間]6時半～19時半\n[休日]月・木\n[交通]都営地下鉄大江戸線ほか麻布十番駅7番出口から徒歩4分\n[4]『ナカヤ』「いも豚のカツバーガー」378円@南砂町\n素材に妥協しないこだわり尽くした新旧の絶品パンが100種類以上\n\n1933年の創業以来大切にしているのは、「自分が食べて納得できるものを妥協なしで提供する」こと。カツサンドに使ういも豚を手切りしているのは、メニューの提案者である2代目女将・光子さん。自家製パン粉を付けて揚げられた内モモ肉は、きめ細かな身質が楽しめる。\n\n北海道産小麦粉「春よ恋」を使い、香ばしく焼き上げられたバンズと、ソース＆キャベツとのバランスが絶妙だ。また、週末は600個以上売れるあんぱんの名店でもある。北海道十勝産の小豆を使い後味すっきりのあんは、現在も2代目の隆さんが丁寧に炊く。メインで切り盛りするのは3代目夫妻。伝統の味を継承しつつ、新たなパンも生み出している。\n\n【コレもおすすめ！】あんぱん280円\n\n[住所]東京都江東区東砂6-20-8\n[電話]03-3644-3573\n[営業時間]7時～18時半※日・祝は～18時\n[休日]水・火不定休\n[交通]地下鉄東西線南砂町駅2a出口から徒歩20分\n\n撮影/小島昇、取材/市村幸妙(ナカヤ)、肥田木奈々(サンモリッツ)、藤沢緑彩(メイユール)、編集部(パン・ムラカミ)\n\n※2024年6月号発売時点の情報です。,['https://newsatcl-pctr.c.yimg.jp/t/amd-img/20240618-01377040-matomeshi-000-1-view.jpg?pri=l&w=640&h=426&exp=10800'],"['https://news.yahoo.co.jp/articles/d9c033bf1f45dee66aef198b85ac36997d0adf31/images/000', 'https://otonano-shumatsu.com/images/377040']"
