headline,mainEntityOfPage,image,datePublished,dateModified,author,media_en,media_jp,str_count,body,images,external_links
桐谷健太主演ドラマ『坂の上の赤い屋根』工藤美桜、七五三掛龍也ら全キャスト解禁　登場人物の闇が浮き彫りとなる本予告映像も（Bezzy）,https://news.yahoo.co.jp/articles/f2c1c2171d687c02df3fdd395127a2b11e0c39df,https://newsatcl-pctr.c.yimg.jp/t/amd-img/20240129-00010003-bezzy-000-1-view.jpg?exp=10800,2024-01-29T08:10:25+09:00,2024-01-29T08:10:25+09:00,Bezzy,bezzy,Bezzy,1552,\n『連続ドラマW 坂の上の赤い屋根』追加キャスト一覧\n3月3日(日)午後10時よりWOWOWで放送・配信される『連続ドラマW 坂の上の赤い屋根』のオールキャストが発表され、ポスタービジュアルと本予告映像が解禁された。\n【写真と動画】“この悪はあなたにも存在するかもしれない”と観る者に訴えかける『坂の上の赤い屋根』ポスタービジュアルと予告映像\n原作は真梨幸子の『坂の上の赤い屋根』（徳間文庫）。同著者の小説は映像化不可能とも言われる衝撃作が多く、尾野真千子主演『フジコ』（原作『殺人鬼フジコの衝動』）、WOWOWで映像化した同じ名前の女性が悪の渦に巻き込まれる『連続ドラマW 5人のジュンコ』に続いて、本作は3作目の映像化となる。物語は、新人作家が18年前の“女子高生両親殺害事件”をモチーフにした小説企画を出版社の編集者に持ち込んだことから始まる。2人は小説の連載を実現すべく関係者たちの取材を始めていくが、やがて登場人物たちが抱える嫉妬、劣等感、孤独、過去など“黒い感情”の正体と事件の真実が明らかになっていく。\n\n主人公の轟書房編集者・橋本涼役を演じるのは桐谷健太。新人作家・小椋沙奈役に倉科カナ、「女子高生両親殺害事件」の主犯格とされる死刑囚・大渕秀行役にA.B.C-Zの橋本良亮、大渕と獄中結婚した法廷画家・礼子役に蓮佛美沙子。大渕に破滅させられたパトロンでもあった元編集者・市川聖子役を斉藤由貴が演じるなど、実力派俳優陣が顔を揃える。\n\n新たな追加キャストの面々は、轟書房のカリスマ編集者笠原智子役に渡辺真起子。部下の橋本と小泉をはじめ、かつて上司と部下の関係だった市川聖子など、周囲の人を利用しようとする。渡辺は同著者の原作のWOWOW『連続ドラマW 5人のジュンコ』にも出演した真梨幸子ファンも唸る注目キャストだ。また、新人作家の沙奈の母親・小椋美江役には宮崎美子。沙奈に過剰なまでに過保護な一面があり、事件を追って小説執筆に没頭する沙奈を心配するが、その歪な母娘の関係の背後にある事情とは。温かみのある母親役を演じることが多い宮崎が演じる今回の母親役には初日から制作陣も息を呑む怪演だったという。\n\nさらに、法廷画家の礼子の母親・鈴木孝子役には床嶋佳子。死刑囚の大渕と獄中結婚した娘を案じているものの、娘に本当の意味で向き合えていない。橋本良亮演じる大渕に洗脳され、開業医の両親を惨殺し無期懲役となった青田彩也子役には工藤美桜。『親愛なる僕へ殺意をこめて』（2022年／CX系）の拷問シーンでの熱演で話題を呼んだ工藤が本作でさらなるダークな新境地に挑む。続いて、死刑囚の妻となった礼子の弟で大手銀行員の鈴木洋平役にはWOWOWドラマ初出演となるTravis Japanの七五三掛龍也。姉の不器用な生き方に黒い感情を抱く役で、役作りのためにトレードマークの金髪を黒髪にして挑んだ。轟書房で主人公の橋本の同僚・小泉役には西村元貴。上司の笠原に事件の小説の企画を進める橋本と沙奈を監視するように命じられ、巻き込まれていく。\n\n解禁された本作のポスターは、ダーク・ミステリーを想起させるタイトルと同様の赤い屋根の家を人物が囲うように並ぶ印象的なビジュアルに。“この悪はあなたにも存在するかもしれない”と観る者に訴えかけるキャッチコピーと、それぞれが思惑を巡らせる表情の中、主人公の橋本は真直ぐに視線を向ける。\n\n併せて解禁された90秒の本予告映像では、「女子高生両親殺害事件」とその事件をモチーフにした小説化を発端に、取り巻く登場人物たちの闇が浮き彫りとなる。そして、予告の終盤には事件の女子高生に関連する衝撃的な“ある疑惑”が垣間見え、観る者を引きずり込んでいく。,['https://newsatcl-pctr.c.yimg.jp/t/amd-img/20240129-00010003-bezzy-000-1-view.jpg?pri=l&w=640&h=452&exp=10800'],"['https://news.yahoo.co.jp/articles/f2c1c2171d687c02df3fdd395127a2b11e0c39df/images/000', 'https://bezzy.jp/2024/01/39725/?gallery=39725&aid=39723&gn=0']"
宮世琉弥＆原菜乃華が原作名シーン“ジャージキス”を完全再現、映画『恋わずらいのエリー』新場面写真解禁（Bezzy）,https://news.yahoo.co.jp/articles/0ed42286b8c925dca7ab3b7dc2bdaedeeed7b1b4,https://newsatcl-pctr.c.yimg.jp/t/amd-img/20240129-00010004-bezzy-000-1-view.jpg?exp=10800,2024-01-29T18:01:26+09:00,2024-01-29T18:01:26+09:00,Bezzy,bezzy,Bezzy,1203,"\n「ジャージキス」シーンを演じる宮世琉弥と原菜乃華 ©︎2024「恋わずらいのエリー」製作委員会 ©︎藤もも／講談社\n2024年3月15日(金)より全国公開される映画『恋わずらいのエリー』より、ダブル主演の宮世琉弥と原菜乃華が原作屈指の胸キュンシーンを完全再現した場面写真が解禁された。\n【全ての写真】三木康一郎監督も「斬新すぎる！」と大興奮した宮世琉弥＆原菜乃華の“ジャージキス”裏側に迫るメイキング写真\n原作は2015年に連載開始した藤ももによる同名の人気少女コミック。2018年には第42回講談社漫画賞少女部門にノミネートされ、「爆笑しつつキュン死にできる」「見事にドはまり」「共感しかなくて元気出る」などティーンの心を鷲掴みにし、累計発行部数は210万部を突破している。\n\n表の顔は学校イチのさわやか王子だが、実は口の悪いウラオモテ男子のオミくんを宮世が、そんなオミくんを眺めながら彼との妄想を“恋わずらいのエリー”の名前でSNS上でつぶやくのが日課の妄想大好き女子・エリーを原が演じる。さらに西村拓哉、白宮みずほ、藤本洸大、綱啓永、小関裕太という最旬キャストが大集結した。\n\n新たに解禁されたのは、原作コミックでも話題になった本作ならではの「ジャージキス」シーンの場面写真。オミくんが失くしたジャージを取り戻してきたエリー、その真っ直ぐな視線に思わずときめいたオミくんは、エリーの頭からジャージをすっぽりかぶせ、そのおでこにジャージ越しにキスをする。「ジャージキス」するドキドキの瞬間、そしてキス直後に状況がわからずきょとんとした表情のエリーが顔を覗かせ、至近距離でオミくんと見つめ合う場面写真も解禁されている。\n\nさらに撮影の裏側に迫るメイキング写真も同時解禁。本シーンが撮影されたのは、対岸には江ノ島灯台が望む七里ヶ浜。絶好のロケーションの中、陽光きらめく海原を背景に名シーン「ジャージキス」をいかにロマンチックに実写化するか、キャスト・スタッフ全員が集中し、念入りに段取りを重ねていく。しかし実際にやってみると、ジャージのチャックを片手でスマートに開閉するのは難しいことが判明。監督自身が試してみたり宮世と相談したり、試行錯誤の末なんとかいい形に収まり、ジャージから原の顔がのぞくと、監督は思わず「斬新すぎる！こんなの見たこともやったこともない！」と大興奮で新たな胸キュンポーズ誕生を実感したという。\n\nなお宮世琉弥は昨日アーティストとして初のワンマンライブを開催し、そこでRyubi Miyaseとしてメジャーデビュー、デビューアルバム『PLAYLIST』のリリース、全国4ヵ所にて約15,000人を動員する全国ツアーを発表。ステージ上で「今後はアーティストRyubi Miyaseとして作詞作曲に挑戦して、新しい自分をお見せできたらと思います」と胸の内を語った。",['https://newsatcl-pctr.c.yimg.jp/t/amd-img/20240129-00010004-bezzy-000-1-view.jpg?pri=l&w=640&h=450&exp=10800'],"['https://news.yahoo.co.jp/articles/0ed42286b8c925dca7ab3b7dc2bdaedeeed7b1b4/images/000', 'https://bezzy.jp/2024/01/39739/?gallery=39739&aid=39734&gn=0']"
宇多田ヒカル、月9ドラマ主題歌「何色でもない花」配信ジャケット公開　写真家Takayが北海道の帯広で1月に撮影（Bezzy）,https://news.yahoo.co.jp/articles/57fc2c1d3209c65edbf47903e643e2a924c0eabb,https://newsatcl-pctr.c.yimg.jp/t/amd-img/20240129-00010006-bezzy-000-1-view.jpg?exp=10800,2024-01-29T22:10:50+09:00,2024-01-29T22:10:50+09:00,Bezzy,bezzy,Bezzy,658,\n宇多田ヒカル『何色でもない花』配信ジャケット\n宇多田ヒカルが、2月12日(月)に配信リリースする新曲「何色でもない花」のジャケットビジュアルを公開した。\n【全ての写真】抽選で300名にプレゼントされる宇多田ヒカル「何色でもない花 オリジナルステッカー」写真\n現在放送中のフジテレビ系月9ドラマ『君が心をくれたから』の主題歌として書き下ろされた「何色でもない花」のジャケットは、2024年1月に北海道の帯広にて撮影。一昨年リリースのアルバム『BADモード』、昨夏リリースの『Gold ～また逢う日まで～』に続き、今作も写真家のTakay（タケイ）氏が手掛けた。\n\nまた、本日より配信予約キャンペーンがスタート。特設ページよりApple Musicのプレアド、Spotifyのプレセーブ、iTunesでのプレオーダー（iTunesは2月7日より受付開始）をした方の中から抽選で300名に「何色でもない花 オリジナルステッカー」、キャンペーンに参加した全員に「オリジナル待ち受け画像」をプレゼント。キャンペーンは全世界から参加可能で、応募期間は楽曲リリースの前日2月11日(日)23:59までとなる。\n\n2023年12月9日(土)にデビュー25周年を迎え、キャリア初のベストアルバム発売、6年ぶりのツアー開催をアナウンスした宇多田ヒカル。ツアーのチケットはツアーオフィシャルアプリから飲み申し込み可能（抽選販売）で、受付も本日正午にスタート。なおアプリは現在すでに10万インストールを超えているとのこと。,['https://newsatcl-pctr.c.yimg.jp/t/amd-img/20240129-00010006-bezzy-000-1-view.jpg?pri=l&w=640&h=640&exp=10800'],"['https://news.yahoo.co.jp/articles/57fc2c1d3209c65edbf47903e643e2a924c0eabb/images/000', 'https://bezzy.jp/2024/01/39744/?gallery=39744&aid=37250&gn=0']"
高良健吾主演映画『罪と悪』男たちの信念と気迫漂うキャラクターポスター6点解禁（Bezzy）,https://news.yahoo.co.jp/articles/5a416ce17ee186738e9c67daddf40c462ba2b844,https://newsatcl-pctr.c.yimg.jp/t/amd-img/20240129-00010002-bezzy-000-1-view.jpg?exp=10800,2024-01-29T08:02:04+09:00,2024-01-29T08:02:04+09:00,Bezzy,bezzy,Bezzy,894,\n映画『罪と悪』高良健吾キャラクターポスター ©︎2023「罪と悪」製作委員会\n2月2日(金)に公開される高良健吾主演映画『罪と悪』より、本作の登場人物たちを写したキャラクターポスター6点が解禁された。\n【全ての写真】高良健吾、佐藤浩市、椎名桔平らの劇中では観られないポートレットカットを使用した映画『罪と悪』ポスター6点\n本作は罪の真実と正義の在り方を問う本格ノワールミステリー。ある日、13歳の正樹が殺された。そして同級生の1人の少年が犯人を殺し、殺害現場となった家に火を放つ。20年間の沈黙を経て、罪を背負った幼馴染3人は再会するが、あの時と同じ場所でまた少年が殺される。その街で一体何が起こっているのか。監督・脚本を務めた齊藤勇起は、井筒和幸監督作品を中心に岩井俊二監督、武正晴監督、廣木隆一監督作品等での助監督を経て、完全オリジナルの脚本で初監督に挑む。\n\n主演の高良健吾は2006年『ハリヨの夏』でデビュー以来、数多くの話題作に出演し続けている俳優。荒んだ家庭環境に育ち、現在は地元の不良たちを集めて闇の仕事も請け負う会社を経営する社長・春を演じる。春と同じく罪を背負いながらも、過去の秘密を隠し大人になった幼馴染には、警察官の家庭に育ち自らも捜査一課の刑事となるが、父の死をきっかけにこの街に戻ってくる晃を大東駿介が演じ、家業の農業を継ぎ現在は引きこもりになってしまった双子の弟・直哉の面倒も見ている朔を石田卓也が演じる。また、街を牛耳る白山會の傘下である清水組組長・清水を村上淳が、その白山會の会長・笠原を佐藤浩市が、晃と同じ警察署の先輩刑事・佐藤を椎名桔平が演じる。\n\n解禁された6点のキャラクターポスターは、劇中では観られないポートレートカットを使用。笠原（佐藤浩市）と清水（村上淳）のキャラクターポスターには、それぞれ劇中にも登場する組員たちと並んだカットも含まれており、裏社会組織の迫力も感じさせる。また、春（高良健吾）のポスターには「俺たちは俺たちのやり方で犯人探すから」とあるように、登場人物たちそれぞれの思惑が揺らめくセリフが添えられている。,['https://newsatcl-pctr.c.yimg.jp/t/amd-img/20240129-00010002-bezzy-000-1-view.jpg?pri=l&w=452&h=640&exp=10800'],"['https://news.yahoo.co.jp/articles/5a416ce17ee186738e9c67daddf40c462ba2b844/images/000', 'https://bezzy.jp/2024/01/39687/?gallery=39687&aid=39682&gn=0']"
スヌープ・ドッグが困窮するベテランラッパーたちをプライベートで支援していると明かす（Bezzy）,https://news.yahoo.co.jp/articles/fb8033e41119cf0b26f4e127b833250a69656617,https://newsatcl-pctr.c.yimg.jp/t/amd-img/20240129-00010005-bezzy-000-1-view.jpg?exp=10800,2024-01-29T21:24:17+09:00,2024-01-29T21:24:17+09:00,Bezzy,bezzy,Bezzy,1312,\nSnoop Dogg | Ep 216 | ALL THE SMOKE Full Episode\nラッパーとしてだけではなく、ビジネスマンやタレントとしても世界的人気を誇るスヌープ・ドッグ。彼は2022年の2月に、かつてドクター・ドレーやスヌープ・ドッグの初期アルバムをリリースした〈Death Row Records〉を買収しており、現在はレーベルオーナーとしても活躍している。そんな彼が先日ポッドキャスト「All The Smoke」に出演した際に、ベテランと若手アーティストのビジネスの違いを語った。\n【動画】スヌープ・ドッグが主演の新映画『The Underdoggs』トレイラー\nスヌープ・ドッグは一時期レーベル専用のストリーミングサービスをローンチするという理由で、『The Chronic』や『Doggystyle』などのアルバムをストリーミングサービスから撤廃していたが、音楽業界は映画業界以上に稼ぐのが難しいと明かした。\n\n「音楽業界は成り立ってない。俺はフィジカルの時代出身だ。俺らの時代にはカセットとCDで、CDが10.99ドルで売れたとしたら、レーベルには6ドルぐらい、アーティストには1ドルぐらい入ってた。だから100万枚売れたら100万ドルがアーティストに入っていた。でも今は1000再生で1ドルに満たないぐらいだと思うし、100万再生されても全然お金は入ってこない。\n\nでも問題はそれだけじゃなくて、誰もヒット曲以外を聴かないということもある。例えば俺が誰かの3曲を1億回ぐらい聴いたとして、それは彼にとって本当に良いことなのだろうか？めちゃくちゃ再生された曲があったとしても、ライブでは誰も他の曲を知らなくて、人気曲以外ではアホみたいに突っ立ってるという状況が生まれる。アーティストとリスナーの間の繋がりが途切れてしまってるんだ。だから俺はそこの繋がりを作り直したい。特に若い子たちは今のシステムで稼げるけど、俺らのようなベテランが稼げるシステムも考えたい」\n\n現在の音楽業界の問題をアーティスト目線で語ったスヌープ・ドッグ。自身のフットボールリーグを立ち上げ次世代のアスリートを教育するなど、普段から若い世代を支援しているが、ベテランをサポートすることも重要視しているようだ。昨年、ヒップホップ生誕50周年を記念してスカーフェイスやラキムのようなベテランに寄付が集まったことについてもコメントしている。\n\n「公にすることではないから誰を支援したとかは言わないけど、ベテランを支援するべきなんだ。する必要があるわけじゃないけど、ベテランやパイオニアたちをリスペクトしよう。もし、好きなラッパーがいたりリスペクトするラッパーが不運な状況に陥っていたら、金銭的な支援が必要かもしれない。\n\nプライドがあるから本人からは頼めないかもしれないが、そういうときにこっちから“いくらか支援してあげよう”って言うんだ。過去には俺と50セントで何人かのベテランを支援したし、俺と50セントはそういう人なんだ。OGで不運にあって、金銭的に困ってる人がいたら支援するようにしてるよ」,['https://newsatcl-pctr.c.yimg.jp/t/amd-img/20240129-00010005-bezzy-000-1-view.jpg?pri=l&w=640&h=566&exp=10800'],"['https://news.yahoo.co.jp/articles/fb8033e41119cf0b26f4e127b833250a69656617/images/000', 'https://bezzy.jp/2024/01/39763/?gallery=39763&aid=39766&gn=0']"
菅田将暉、劇場版『君と世界が終わる日に』主題歌MV公開　初のアニメーション作品に（Bezzy）,https://news.yahoo.co.jp/articles/9002cefd0064ba7ee0c4387c5a12ea17c9f082d8,https://newsatcl-pctr.c.yimg.jp/t/amd-img/20240129-00010000-bezzy-000-1-view.jpg?exp=10800,2024-01-29T07:02:00+09:00,2024-01-29T07:02:00+09:00,Bezzy,bezzy,Bezzy,713,\n菅田将暉「谺する」ミュージックビデオサムネイル\n菅田将暉が、1月25日(木)より配信中の最新曲「谺する」のミュージックビデオを公開した。\n【動画】クリオネをモチーフにした菅田将暉「谺する」ミュージックビデオは自身初のアニメーション作品\n「谺する」は、昨日1月26日(金)に公開された『劇場版 君と世界が終わる日に FINAL』の主題歌。本楽曲は映画のために菅田自身もプロデュースに参画し、バンドメンバーのタイヘイ（Dr.）と共に作り上げた。菅田は2021年に地上波で放送されたSeason1の主題歌を「星を仰ぐ」で担当し、放送終了から3年の月日を経て『君と世界が終わる日に』とは劇場版で再タッグとなる。“これまでシリーズを背負ってきた響ないしは竹内の集大成に贈る歌になるように作ってほしい”との製作陣からの依頼を受け、楽曲作成へと勤しんだ菅田が“製作スタッフの想いをそのまま表現したい”という気持ちで書き下ろした、ダイナミックなギター音がメインのアップテンポな楽曲となっている。\n\n今作のミュージックビデオは自身初のアニメーション作品で、監督はアニメーション作家の山田遼志が担当。クリオネをモチーフにした幻想的な映像となっている。\n\n菅田将暉は2017年から本格的に音楽活動を開始。2019年リリースの「まちがいさがし」は各配信ストアにて1位を席捲し、ストリーミング3億回再生を突破している。その年には「第70回NHK紅白歌合戦」への初出場を果たし、「第61回 日本レコード大賞」特別賞を受賞。2020年11月リリースの「虹」もストリーミング再生3億回を超えており、音楽アーティストとしても注目を集めている。,['https://newsatcl-pctr.c.yimg.jp/t/amd-img/20240129-00010000-bezzy-000-1-view.jpg?pri=l&w=640&h=359&exp=10800'],"['https://news.yahoo.co.jp/articles/9002cefd0064ba7ee0c4387c5a12ea17c9f082d8/images/000', 'https://bezzy.jp/2024/01/39692/?gallery=39692&yid=cvpG8ppvbFY&gn=4']"
