headline,mainEntityOfPage,image,datePublished,dateModified,author,media_en,media_jp,str_count,body,images,external_links
ブロックのモバイル決済サービス「キャッシュアップ」、英国での事業終了へ（あたらしい経済）,https://news.yahoo.co.jp/articles/3168eda172f82c5e8c46e84b9c3f2148876eafd6,https://newsatcl-pctr.c.yimg.jp/t/amd-img/20240719-00010007-neweco-000-1-view.jpg?exp=10800,2024-07-19T19:57:29+09:00,2024-07-19T19:57:29+09:00,あたらしい経済,neweco,あたらしい経済,562,\nCash App UKが閉鎖へ\n※写真はイメージです\n米決済企業ブロック（Block）提供のモバイル決済サービス「キャッシュアップ（Cash App）」が、英国での事業終了を7月18日発表した。\n\n「キャッシュアップ」は、今年9月15日に英国向けサービスであるキャッシュアップUK（Cash App UK）を閉鎖する予定とのこと。発表では閉鎖の理由について、「世界展開を優先せずに米国市場に重点を置くため」と説明されている。\n\nなおサービス終了後も顧客の資金は引き続き保護され、引き出しが可能だという。また閉鎖に関する詳細は今後数週間にわたって、全ての英国アカウント所有者に通知が送られるとのことだ。\n\n「キャッシュアップ」はユーザー同士での資金の送受金や銀行取引が行える決済サービスだ。これまで米国ユーザー向けには、ライトニングネットワーク（Lightning Network）を使用したビットコインの受信機能や、米送金ネットワーク「自動資金決済センター（ACH）」より入金された法定通貨のビットコイン自動変換機能などが提供されてきている。\n\nなお「キャッシュアップ」の英国向けサービスであるキャッシュアップUKは2018年4月に同国でサービスを開始している。\n一本寿和（幻冬舎 あたらしい経済）,['https://newsatcl-pctr.c.yimg.jp/t/amd-img/20240719-00010007-neweco-000-1-view.jpg?pri=l&w=640&h=360&exp=10800'],['https://news.yahoo.co.jp/articles/3168eda172f82c5e8c46e84b9c3f2148876eafd6/images/000']
トランプが「ビットコインカンファレンス2024」で資金調達イベント実施か、1名参加費は約1.3億円＝報道（あたらしい経済）,https://news.yahoo.co.jp/articles/4ca006a5ef023b7400ccd6b43185cc2a0c81c2bb,https://newsatcl-pctr.c.yimg.jp/t/amd-img/20240719-00010003-neweco-000-2-view.jpg?exp=10800,2024-07-19T15:30:27+09:00,2024-07-19T15:33:39+09:00,あたらしい経済,neweco,あたらしい経済,787,"\nトランプがビットコインカンファレンスで資金調達イベント実施か\nロイターより\n前米大統領で現共和党大統領候補のドナルド・トランプ（Donald Trump）氏が、ヘッドライナーとして参加予定のビットコインカンファレンスにて政治資金の調達を行うようだ。ブルームバーグが、独自で入手した調達イベントの招待状をもとに7月19日に報じた。\n\nなおトランプ氏は、7月25日から27日にテネシー州ナッシュビルで開催される「Bitcoin 2024」にて、27日に演説をする予定となっている。同氏は2024年米大統領選において、暗号資産（仮想通貨）への強力な支持を表明。6月にサンフランシスコで行われた資金調達イベントで暗号資産（仮想通貨）の擁護者を自称し、同分野を規制しようとする民主党の試みを激しく非難した他、ビットコインマイナーを支持する姿勢を見せている。\n\n報道によるとトランプ氏は同カンファレンスで演説する27日に、非公開の資金調達イベントを実施するという。暗号資産業界の支持者を招待しているとのことで、参加費は84万4600ドル（約1億3,317万円）。100から150名に招待状が出されているという。\n\n参加者にはトランプ氏との写真撮影の機会もあるとのこと。撮影には参加費とは別に個人で6万ドル、カップルでは10万ドルの寄付を募るとのこと。\n\nまた同イベントには、副大統領候補であるJ.D.バンス（J.D. Vance）上院議員、共和党予備選のトランプ氏の対立候補だったビベック・ラマスワミ（Vivek Ramaswamy）氏、テネシー州選出のビル・ハガティ（Bill Hagerty）上院議員、ハワイ州選出のトゥルシ・ガバード（Tulsi Gabbard）下院議員もこの資金調達のイベントに出席するとのことだ。\n大津賀新也（幻冬舎 あたらしい経済）",['https://newsatcl-pctr.c.yimg.jp/t/amd-img/20240719-00010003-neweco-000-2-view.jpg?pri=l&w=640&h=360&exp=10800'],['https://news.yahoo.co.jp/articles/4ca006a5ef023b7400ccd6b43185cc2a0c81c2bb/images/000']
ヴィタリック、「親クリプト派という理由だけで候補者を選ぶべきでない」と警告。米大統領選を意識してか（あたらしい経済）,https://news.yahoo.co.jp/articles/854d9f655813c581b447913c6954192bdf42495c,https://newsatcl-pctr.c.yimg.jp/t/amd-img/20240719-00010005-neweco-000-4-view.jpg?exp=10800,2024-07-19T16:26:52+09:00,2024-07-19T17:37:48+09:00,あたらしい経済,neweco,あたらしい経済,1900,"\nブログにて警告\nEthereum共同創業者 ヴィタリック・ブテリン氏\nイーサリアム（Ethereum）の共同創業者であるヴィタリック・ブテリン（Vitalik Buterin）氏が、「暗号資産推進派」であるだけで政党や候補者を選ぶべきでないという考えをブログにて7月17日に共有した。\n\nタイトルは「 ""クリプト推進派 ""を基準に政治的忠誠を決めることに異議あり：Against choosing your political allegiances based on who is ""pro-crypto""」だ。\n\nブテリン氏は、昨今世界中でみられる暗号資産への規制の取り組みの多くは概ね妥当だとした上で、政府がほぼすべての暗号資産を証券として扱ったり、セルフカストディアルウォレットを禁止したりといった極端な措置に出るのではないかという懸念を示した。\n\nまたこのような懸念から暗号資産業界では、政治的活動への動きが強まっており、親暗号資産派の候補者や政党が支持を集めていると指摘。しかしブテリン氏はこのような傾向に反対し、こういった理由で意思決定することは、そもそも暗号資産の世界に飛び込んだ価値観とは反するのではないかと主張した。\n\n●ブテリン氏の主張\n\nブテリン氏は、暗号資産の世界において、「お金」の重要性と「お金」の保有・使用に関する自由が政治問題として過度に注目されると指摘。\n\nしかし暗号資産を生み出したのは、個人の自由を保護し強化する方法として自由でオープンなテクノロジーを主張するサイファーパンク運動であり、暗号資産とブロックチェーンに限定されるものではないとした。\n\nブテリン氏は、「自由は重要であり、分散型ネットワークは自由を守るのに適しており、お金はそのようなネットワークが適用される重要な分野である。しかしそれは、いくつかある重要な分野のうちの1つにすぎない」と述べている。\n\n暗号資産で何かをする自由と同じくらい考慮されるべき技術的自由としてブテリン氏は、「コミュニケーションの自由とプライバシー」、「自由とプライバシーに配慮したデジタルID」、「自由と思想のプライバシー」、「情報への質の高いアクセス等の技術的な自由」が考慮されるべきだと強調した。\n\nブテリン氏は、「暗号資産としてのクリプトを支持するのではなく、その根底にある目標、そしてその目標が意味する一連の政策に耳を傾けてほしい」と呼びかけている。\n\nさらにブテリン氏は、暗号資産支持派の候補者が「今暗号資産に優しいからといって、5年後にも優しいとは限らない」と指摘。過去の候補者の見解を調べることを促した。\n\nまた、候補者が暗号資産支持派であるという理由のみでその候補者を支持しているという印象を公にすることは、政治家が票集めに必要な手段として暗号資産を支持すればいいといったインセンティブを生み出しかねないとブテリン氏。\n\n「重要なのは、彼らが正しい理由でクリプトに賛成しているかということ」であり、「（候補者が）テクノロジーと政治と経済が21世紀にどうあるべきかについて、あなたと一致するビジョンを持っているか」に重きをおいて候補者を選ぶべきだと主張した。\n\nさらにブテリン氏は、暗号資産に好意的な「権威主義的な政府」は警戒するに値するとし、その例としてロシア政府を挙げた。\n\nロシア政府は、国際的な制裁を回避するために暗号資産を受け入れる一方で、国内での使用は制限し国民への監視は維持するという2つの相反する政策をとっているとブテリン氏は批判した。\n\n●反対意見も\n\n世界最大手のWeb3リサーチ企業メッサリ（Messari）の共同創設者であるライアン・セルキス（Ryan Selkis）氏は、「私はヴィタリックを尊敬しているが、彼は常にクリプトの世界で最もナイーブで役に立たない政治評論家の一人だ」と述べ、理想主義は現実主義ではないとし、ブテリン氏の考えを否定。また、カナダとロシアの国籍を持つブテリン氏がアメリカの政治に口をはさむべきではないと続けている。\n\nVCのヴァリアント（Variant）の最高法務責任者であるジェイク・チェルヴィスキー（Jake Chervinsky）氏は、ブテリン氏の主張を「堅実」と評価したが、同ブログは全体的に「中途半端に賢すぎる」とし、 「良いクリプト政策には、暗号資産推進派の候補者を選出する必要がある。 政治的現実は常に理想主義に勝る」と述べた。\n髙橋知里（幻冬舎 あたらしい経済）",['https://newsatcl-pctr.c.yimg.jp/t/amd-img/20240719-00010005-neweco-000-4-view.jpg?pri=l&w=640&h=360&exp=10800'],['https://news.yahoo.co.jp/articles/854d9f655813c581b447913c6954192bdf42495c/images/000']
香港金融管理局「ステーブルコイン発行者サンドボックス」にアニモカブランズら参加（あたらしい経済）,https://news.yahoo.co.jp/articles/aa6e288f7053036ba5ccb1b21e8e21824016f2f6,https://newsatcl-pctr.c.yimg.jp/t/amd-img/20240719-00010006-neweco-000-1-view.jpg?exp=10800,2024-07-19T16:50:46+09:00,2024-07-19T16:50:46+09:00,あたらしい経済,neweco,あたらしい経済,932,\nHKMAがステーブルコイン発行者サンドボックスの参加企業発表\n※写真はイメージです\n香港金融管理局（HKMA）が、同局主導の「ステーブルコイン発行者サンドボックス」の参加企業リストを7月18日発表した。\n\n「ステーブルコイン発行者サンドボックス」は、香港金融管理局が今年3月に持続可能かつ責任あるステーブルコインエコシステムの発展を促進する為に開始したプログラムだ。\n\n発表によると「ステーブルコイン発行者サンドボックス」に参加した企業は、香港拠点でブロックチェーンゲーム開発やNFT分野への投資を行う「アニモカブランズ（Animoca Brands）」、金融サービス大手「スタンダードチャータード銀行香港（Standard Chartered Bank Hong Kong：SCBHK）」、香港通信大手「香港テレコム（HKT）」、中国大手eコマース企業JD.comの子会社「ジンドンコインリンクテクノロジーホンコン（JINGDONG Coinlink Technology Hong Kong）」、香港ドルステーブルコインHKDR開発の「アールディー インノテック（RD InnoTech）」とのこと。\n\n今回「ステーブルコイン発行者サンドボックス」に参加した5社は、香港でステーブルコインを発行する為の運用計画のテストを行うことが香港金融管理局によって許可されたとのことだ。\n\nまたこれら企業は、香港金融管理局が「ステーブルコイン発行者サンドボックス」の参加者を選定する際の評価プロセスにおいて、合理的な事業計画をもって香港でステーブルコイン発行事業を展開することを示したという。そしてこのサンドボックスの範囲内で実施可能な事業であることも証明できたとのこと。\n\nちなみに「アニモカブランズ」、「スタンダードチャータード銀行香港」、「香港テレコム」に関しては、3社共同で「ステーブルコイン発行者サンドボックス」に参加したという。またこれら企業は同サンドボックスに参加するにあたって、機関投資家向けカストディソリューション「ゾディアカストディ（Zodia Custody）」を利用するとのことだ。\n一本寿和（幻冬舎 あたらしい経済）,['https://newsatcl-pctr.c.yimg.jp/t/amd-img/20240719-00010006-neweco-000-1-view.jpg?pri=l&w=640&h=360&exp=10800'],['https://news.yahoo.co.jp/articles/aa6e288f7053036ba5ccb1b21e8e21824016f2f6/images/000']
米クラーケン、機関投資家向けカストディサービスを英国と豪州に拡大（あたらしい経済）,https://news.yahoo.co.jp/articles/4287afcf8f9129408bd909fc60522c3067795c8f,https://newsatcl-pctr.c.yimg.jp/t/amd-img/20240719-00010004-neweco-000-1-view.jpg?exp=10800,2024-07-19T15:59:27+09:00,2024-07-19T15:59:27+09:00,あたらしい経済,neweco,あたらしい経済,924,\nクラーケンがカストディサービスを英国と豪州に拡大\n※写真はイメージです\n米大手暗号資産（仮想通貨）取引所クラーケン（Kraken）が、英国および豪州の機関投資家向けにカストディソリューションを提供開始したことを7月18日発表した。\n\n同カストディソリューションは、クラーケンによる機関投資家向けブランド「クラーケン・インスティテューショナル（Kraken Institutional）」によるものだ。同ブランドは今年3月に立ち上げられており、米国の一部の州を対象にカストディソリューションを提供していた。\n\nなお同ソリューションは、米ワイオミング州認定の銀行であるクラーケンファイナンシャル（Kraken Financial）を通じて提供されている。英国および豪州においても同行が直接カストディサービスを提供するとのことだ（クラーケン・インスティテューショナルは、同ソリューションのサービスプロバイダー）。\n\nなおクラーケンによるカストディソリューションは現在、ビットコイン（BTC）、イーサリアム（ETH）、イーサリアム上のERC20規格のUSDCをサポートしている。同取引所によると今年後半には、追加の資産サポートを行う予定であるという。\n\nクラーケン・インスティテューショナルの責任者であるティム・オギルビー（Tim Ogilvie）氏は「クラーケンは英国と豪州で長年強い存在感を示してきたため、クラーケンのカストディソリューションを拡大する第1の目的地はこれらの2カ国でした。両市場は機関投資家向けの暗号資産市場が確立しており、クラーケンカストディの現地での立ち上げにより、これらの機関投資家がこの資産クラスへの関与を強化できると期待しています」とコメントしている。\n\nなお「クラーケン・インスティチューショナル」は、クラーケンの既存商品であるスポット取引、OTC取引、ステーキングやサービスと、機関投資家向けに特別な調整を施した暗号資産取引、投資、保管サービスをまとめて提供するブランドだという。対象となるのは機関投資家、資産運用会社、ヘッジファンド、富裕層個人である。\n大津賀新也（幻冬舎 あたらしい経済）,['https://newsatcl-pctr.c.yimg.jp/t/amd-img/20240719-00010004-neweco-000-1-view.jpg?pri=l&w=640&h=360&exp=10800'],['https://news.yahoo.co.jp/articles/4287afcf8f9129408bd909fc60522c3067795c8f/images/000']
最高裁、コインチェック流出NEM収受事件の上告を棄却（あたらしい経済）,https://news.yahoo.co.jp/articles/396b3de927146b07c8e383ad7f735b324cb4c7f4,https://newsatcl-pctr.c.yimg.jp/t/amd-img/20240719-00010002-neweco-000-2-view.jpg?exp=10800,2024-07-19T14:33:08+09:00,2024-07-19T16:37:42+09:00,あたらしい経済,neweco,あたらしい経済,1600,"\n最高裁が上告を棄却\n※写真はイメージです\n2018年に発生した暗号資産（仮想通貨）ネム：NEM（XEM）が暗号資産取引所コインチェックから流出した事件において、最高裁が上告棄却の判決を7月16日下した。\n\nこの裁判は、摘発された31人のうちの1人に関するもの。一審で控訴審は、攻撃者の行為に電算機詐欺罪が成立するとし、被告人の行為に犯罪収益収受罪の成立を認めた。これに対し被告人は上告したが、今回最高裁はこれを棄却した。\n\n●事件の概要\n\nコインチェックは2018年1月、何者かによってサイバー攻撃を受けた。これにより580億円相当のNEMが外部に不正流出した。\n\n攻撃者はダークウェブ上に交換所を開設し、流出させたNEMを他の暗号資産と交換することでロンダリングを実施。なお攻撃者はディスカウントしたレートで交換を行っており、交換に応じた者は安価にNEMを入手できるようになっていた。\n\n警視庁は、攻撃者に対し電子計算機使用詐欺罪の疑いでの捜査を開始したが攻撃者の特定はできなかった。しかし警視庁はNEMの交換に応じた31人を犯罪収益等収受罪（組織犯罪処罰法11条）の疑いで摘発。\n\nこのような背景から、今回の裁判では、被告人が受け取ったものが「犯罪収益」と認められるかの前提として、攻撃者の行為が電算機詐欺罪に該当するかが争点となっていた。\n\n●判決について\n\n最高裁は判決文にて「本件移転行為が電子計算機使用詐欺罪に該当し、本件NEMが組織的犯罪処罰法2条2項1号にいう『犯罪行為により得た財産』に当たるとして、その一部を収受した被告人について、犯罪収益等収受罪の成立を認めた第1 審判決を是認した原判断は正当である。よって、刑訴法414条、396条により、裁判官全員一致の意見で、主文（本件上告を棄却する）のとおり判決する」と述べた。\n\nまた最高裁は、攻撃者が「不正に入手したA社（コインチェック）のNEMの秘密鍵で署名した上で本件移転行為に係るトランザクション情報をNEMのネットワークに送信した行為は、正規に秘密鍵を保有するA社（コインチェック）がNEMの取引をするものであるとの『虚偽の情報』をNEMのネットワークを構成するNISノードに与えたものというべき」とし、本件移転行為が電子計算機使用詐欺罪に該当するため、本件のNEMは「犯罪行為により得た財産」に当たり、その一部を収受した被告人に犯罪収益等収受罪が成立すると結論づけている。\n\n●社会的信用や暗号資産の役割等を考慮\n\n今回の判決では、「たしかにNEMのシステムはトランザクション情報に署名した者が正規の秘密鍵保有者であるか否かを判別する仕組みを持たない」が、「NEMのシステムに対する社会の信頼は、正規の秘密鍵保有者が秘密鍵の管理を通じてNEMを排他的に支配することができることによって確保される」と述べられた。\n\nつまり正規の秘密鍵保有者以外の人物が不正な方法で秘密鍵を入手し署名する行為は、「正規の秘密鍵保有者のNEMに対する排他的支配を害し、NEMのシステムに対する社会の信頼を損なう」ため、正規の秘密鍵保有者だと主体を偽ったトランザクション情報をNEMのネットワークを構成するNISノードに与えた行為と論じ定めた。\n\nこの判決は、暗号資産業界の通説の「not your keys, not your coins」（鍵の所有者こそが、コインの所有者である）に沿うものではないが、最高裁は「システム単体としての仕組みや働き等からロジカルに演繹されるものではない」とし、NEMの利用実態やNEMシステムの取引に対する社会的信用、暗号資産が社会経済において果たしている役割や重要性等の観点からの考察を考慮し判断したとしている。\n髙橋知里（幻冬舎 あたらしい経済）",['https://newsatcl-pctr.c.yimg.jp/t/amd-img/20240719-00010002-neweco-000-2-view.jpg?pri=l&w=640&h=360&exp=10800'],['https://news.yahoo.co.jp/articles/396b3de927146b07c8e383ad7f735b324cb4c7f4/images/000']
コインベースにゲーム特化型L2「Ancient8（A8）」上場へ（あたらしい経済）,https://news.yahoo.co.jp/articles/e8529466d54bec353cc1daaefe64a1ccc75ce579,https://newsatcl-pctr.c.yimg.jp/t/amd-img/20240719-00010000-neweco-000-1-view.jpg?exp=10800,2024-07-19T11:31:13+09:00,2024-07-19T11:31:13+09:00,あたらしい経済,neweco,あたらしい経済,765,\nコインベースにA8上場\n※写真はイメージです\n米大手暗号資産（仮想通貨）取引所コインベース（Coinbase）が、暗号資産エンシェント8：Ancient8（A8）の取り扱い予定を7月18日発表した。なおすでに取引は開始されている。\n\nA8の取り扱いは「コインベース（Coinbase：販売所）」及び「コインベース・エクスチェンジ（CoinbaseExchange：取引所）」で行われる。ただし、コインベースのサービス提供地域のうち一部は対象外になる可能性があるとのこと。\n\nなお取り扱われる取引ペアは、A8 -USDとなっている。\n\nコインベースで取り扱われるA8は、イーサリアム（Ethereum）上のERC-20トークンのみであり、それ以外の規格のトークンをコインベースのアカウントに送信すると失われる可能性があるため注意が必要だ。\n\nちなみにA8は、新規銘柄や市場で取引量が比較的少ない銘柄に付けられる「Experimental label（実験的ラベル）」の対象となっている。このラベルは、市場の状況で取引量が増えた場合に削除される予定だ。\n\n「エンシェント8」は、オプティミスティックロールアップ採用のゲーム特化型L2ブロックチェーンだ。同ブロックチェーンはL2ブロックチェーン「オプティミズム（Optimism）」の技術を使用したブロックチェーン開発キットである「OP Stack」を用いて開発されており、DAレイヤーとしては「セレスティア（Celestia）」を採用している。\n\nA8はこの「エンシェント8」のガストークン及びガバナンストークンであり、7月16日にエアドロップが実施され、コミュニティに対し全体の5パーセントが割り当てられている。\n田村聖次（幻冬舎 あたらしい経済）,['https://newsatcl-pctr.c.yimg.jp/t/amd-img/20240719-00010000-neweco-000-1-view.jpg?pri=l&w=640&h=360&exp=10800'],['https://news.yahoo.co.jp/articles/e8529466d54bec353cc1daaefe64a1ccc75ce579/images/000']
