headline,mainEntityOfPage,image,datePublished,dateModified,author,media_en,media_jp,str_count,body,images,external_links
フランス版タウンエースにワインレッドが登場!? 「カングー」のカジュアルな魅力際立つブドウ色の限定モデル「ヴァリエテ」デビュー!（ベストカーWeb）,https://news.yahoo.co.jp/articles/ae3e2f69dde3285e87c55f4f29eb70d2dac3842b,https://newsatcl-pctr.c.yimg.jp/t/amd-img/20240130-01775319-bestcar-000-1-view.jpg?exp=10800,2024-01-30T19:00:00+09:00,2024-01-30T19:00:00+09:00,ベストカーWeb,bestcar,ベストカーWeb,911,\nベストカーWeb\n楽しい走りとバツグンの使い勝手が人気のルノー カングーに限定モデルが登場した。目玉はボルドーワインを思わせるブドウ色のボディカラーだ！\n【画像ギャラリー】(8枚)\n文/ベストカーWeb編集部、写真/ルノー ジャポン\n■発売は2月22日。わずか150台の限定モデル！\n運転支援技術やディーゼルモデルの投入など、完成度がぐんと高まった新型カングー。昨年2月の発表以来順調に売り上げを伸ばしているが、秋にはカングーのお約束ともいえる特別色モデル「ヴァリエテ(先代ではクルールと呼ばれた)」を投入し、話題を集めた。\n\n 今回登場したのは、その特別色モデルであるヴァリエテの第2弾。前回はガンメタに近い深いブルー「グリ・アーバン」というボディカラーだったが、今回は打って変わって暖色系。ボルドーワインを思わせる紫がかった赤の「ルージュカルマンメタリック」という車体色だ。\n\n カングーのエクステリアは、ボディカラーと同色に塗られた「カラーバンパー」仕様と、あえて無塗装とした「ブラックバンパー」仕様から選ぶことができる。前回のヴァリエテはブラックバンパー仕様のみの設定だったが、今回はどちらも選ぶことができるからうれしい。\n\n 装備も充実している。マルチルーフレールやスマホのワイヤレスチャージャー、パーキングセンサー(フロント、サイド、リア)、イージーパーキングアシスト、17インチアロイホイール(カラーバンパー仕様のみ)などが標準装備だ。\n\n エンジンは、1.3Lのガソリンターボのみという設定。たった1.3Lとはいえ131psの最高出力と240Nmという最大トルクを生み出すから、荷物を満載することの多いカングーでも不足はない。トランスミッションはデュアルクラッチ式の7速AT、燃費も15.3km/L(WLTCモード)と経済的だ。\n\n 人気となりそうなヴァリエテだが、発売日は2月22日で150台の限定販売となる。価格はカラーバンパー仕様が427万円、ブラックバンパー仕様が420万円となる(いずれも税込)。気になる人は、一足早くディーラーに出かけてみてもいいかもしれない。,['https://newsatcl-pctr.c.yimg.jp/t/amd-img/20240130-01775319-bestcar-000-1-view.jpg?pri=l&w=640&h=477&exp=10800'],"['https://news.yahoo.co.jp/articles/ae3e2f69dde3285e87c55f4f29eb70d2dac3842b/images/000', 'https://bestcarweb.jp/images/775319']"
美女コンパニオン大特集! アイドルのようなオートウェイに大人の色気なヴェイルサイド!【東京オートサロン2024】（ベストカーWeb）,https://news.yahoo.co.jp/articles/e995185144ac01a6df06464d596b84c787f3cf3c,https://newsatcl-pctr.c.yimg.jp/t/amd-img/20240130-01772899-bestcar-000-11-view.jpg?exp=10800,2024-01-30T18:00:00+09:00,2024-01-30T18:34:42+09:00,ベストカーWeb,bestcar,ベストカーWeb,1549,\nベストカーWeb\n3日間で累計23万人が来場して閉幕した2024年の東京オートサロン。2023年の17万9434人を大きく上回り、コロナの5類移行後のイベントは大盛況であった。各ブースでは多くのコンパニオンが商品のPRを行ったが、そんな中で、ベストカーWeb編集部が遭遇した美人コンパニオンを動画とともにご紹介しよう！\n※配信先には画像が表示されないので、ぜひとも【画像ギャラリー】をご覧ください。\n【画像ギャラリー】美女コンパニオン大特集！オートウェイに尾林ファクトリー、ヴェイルサイドと人気ブース集結！(95枚)\n文・写真/ベストカーWeb編集部、動画/舘野桂\n■多くのコンパニオンが盛り上げた!!多人数が並ぶブースも!?\n2024年の東京オートサロンは、これまでの様々な制限を撤廃されたこともあり、各ブースはこれまで以上に力の入ったPRが行われた。それはコンパニオンの参加人数にも表れている。\n\n 一つのブースに並ぶコンパニオンの数は様々だが、いくつかのブースでは6人以上の大所帯のコンパニオンを用意していた。それもレースクイーンなどを経験した人気のコンパニオンばかりだ。\n\n 輸入タイヤを販売するオートウェイでは、なんと13人ものコンパニオンがラインナップされ、交代で様々なブランドのタイヤを紹介していた。そのため、多くのファンがブースを訪れていた。\n\n 今回は北ホールの人気ブースを中心にご紹介しよう!!\n■多くのコンパニオンが参加した「オートウェイ」ブース\n最初にご紹介するのは、輸入タイヤメーカーのオートウェイブースだ。ブース前には人気のコンパニオンが合計13人並び、多くのファンがブース前に集まった。正面に用意されたステージの上に彼女たちが並ぶと、絶えず多くのフラッシュが浴びせられていた。\n\n コンパニオンの衣装は販売する輸入タイヤのブランドに合わせてデザインのバリエーションがあり、ブースを華やかに彩っていた。しかも3日間の開催でコスチュームが変更されるなど、非常にこだわった衣装となっていた。\n■ブラック＆ゴールドの世界「ヴェイルサイド」\nカスタムショップとして1990年にスタートしたヴェイルサイドは、GT-Rやスープラなどのチューニングを手掛けてきた。そのパフォーマンスの高さや独創的なデザインで高い人気を誇る。\n\n そんなブースには4人の存在感あるコンパニオンが並んだ。黒を基調としたステージと金色のロゴマークの前に並ぶ最新のチューニングカーとコンパニオンの写真は、必見だ!!\n■コンパニオンに加えDJも盛り上げた「尾林ファクトリー」ブース\nハコスカやS30Zといった旧車などに独自のチューニングを加え、東京オートサロンでも高い存在感を誇る尾林ファクトリーブース。今年は多くのコンパニオンに加え、女性DJも用意して大いにイベントを盛り上げていた。\n\n 白と赤でまとめたコスチュームも魅力的なコンパニオンを写真でご紹介しよう。\n■ヤマハ発動機＆レーシングサービスワタナベ\n東京オートサロンに初出店となったヤマハ発動機は、二輪車ではなく小型低速EVのぷとタイプモデルの展示を行った。またブースではコンパニオンがグッズの配布などを担当した。\n\n 人気の高いエイトスポークホイールで有名なレーシングサービスワタナベは、懐かしいサバンナRX-7や86トレノなどを展示。旧車によく似合うデザインでけに、ファンを集めていた。\n\n まだまだ多数のコンパニオンを撮影しているので、ぜひ続報にご期待ください!!\n※ベストカーWebのサイトでは動画も公開中なので、画像ギャラリーから「記事に戻る」ボタンを押してご視聴ください。,['https://newsatcl-pctr.c.yimg.jp/t/amd-img/20240130-01772899-bestcar-000-11-view.jpg?pri=l&w=640&h=426&exp=10800'],"['https://news.yahoo.co.jp/articles/e995185144ac01a6df06464d596b84c787f3cf3c/images/000', 'https://bestcarweb.jp/images/772899']"
駅めちゃ近っ!! なのに東京湾フェリー金谷港のバス事情が最速・最安すぎる!!（ベストカーWeb）,https://news.yahoo.co.jp/articles/16bb9a7307325668efe87525150eb37dca504015,https://newsatcl-pctr.c.yimg.jp/t/amd-img/20240130-03185283-bestcar-000-1-view.jpg?exp=10800,2024-01-30T19:00:00+09:00,2024-01-30T19:00:00+09:00,ベストカーWeb,bestcar,ベストカーWeb,1822,\nベストカーWeb\nクルマなしでフェリーに乗る時に気がかりなのが、港まで行く/着いた港から先へ進める交通手段の有無。今回は東京湾フェリー金谷港のバス事情に注目!!\n【画像ギャラリー】しっかりバスも通ります…東京湾フェリー金谷港(6枚)\n文・写真:中山修一\n(現地取材時の詳細写真ギャラリーを含む写真付き記事はバスマガジンWEBまたはベストカーWEBでご覧ください)\n■観光地の旅情タップリな港\n神奈川県～千葉県を海路で繋ぐ東京湾フェリー。約40分のちょっとした船旅が楽しめるこの航路の千葉県側の始発/終点となるのが金谷港だ。\n\n 金谷港は房総半島の南西寄り、東京駅起点ではアクアライン経由で約85km、陸伝いに千葉方面を経由して約110kmの地点にあり、近隣には景勝地で有名な鋸山が聳える。\n\n 神奈川県側の久里浜港の最寄駅は、京浜急行の京急久里浜駅で2kmほど離れている。一方で金谷港はJR内房線の「浜金谷」駅が最寄になる。\n\n 港と駅がどれくらい離れているのか……これが約500mとかなり近く、東京湾フェリーの案内表示をチェックしても、徒歩で連絡するのが前提らしい。\n\n JR内房線のローカル区間ゆえ電車の本数はあまり多くないが、フェリーのほうも極力電車に接続するダイヤ設定になっており、電車を使う限りスムーズなアクセスも可能だ。\n■駅すぐそこなのにバス停なんてあるの？\n実質的に金谷港への公共交通機関によるアクセス=電車と思っても差し支えなさそうだ。とはいえ、対岸の久里浜港に路線バスが出入りしているのもあって、金谷側のバス事情も気になるところ。\n\n 金谷港ターミナルの出入口周辺を見回してみると、久里浜港と同様に路線バスのバス停標識が立っていた。標識に書かれた名称は「東京湾フェリー」で、久里浜港/金谷港共に同じバス停名を使用しているのがユニーク。\n\n 乗り換え案内のサイト等によっては、久里浜港のバス停名は「東京湾フェリー」、金谷港のほうを「東京湾フェリー金谷港」として、便宜的に区別を付けている場合もあるようだ。\n■どこから来て、どこへ行けるのか\n金谷港の「東京湾フェリー」バス停に出入りするのは、千葉～館山方面への高速バス1路線と、テーマパークへの季節運行アクセスバスが1路線。それに加えて定期運行の一般路線バスが2路線ある。\n\n ここでは定期の一般路線バスに条件を絞って話を進めよう。いずれも房総半島南エリアにバス路線網を広げる日東交通が運行しており、一つ目は竹岡線と呼ばれる路線だ。\n\n 竹岡線はJR内房線の浜金谷から千葉方面に2駅先の上総湊駅が始発/終点になっている。海岸線に沿って線路と並行する国道127号線がメインルートで、約10kmの距離を17分ほどで結んでいる。通しの運賃は470円。\n\n おおむねフェリーとの接続に対応した時刻設定になっている。ただし本数が1日3往復と、なかなか味わい深いローカル路線バスの趣だ。\n■内陸を突っ切る長い路線が港に!?\n二つ目の路線は金谷線。竹岡線が金谷港起点で北方向を線路伝いに目指すなら、こちらは南方向の館山へ行きそうなイメージ。ところがこの金谷線、港を出て南下し始めたかと思いきや、突如大胆に東方向へ進路を変える。\n\n 房総半島南部の内陸を突っ切るようにして進み、何と東寄りのJR安房鴨川駅前まで乗り換えなしで行けてしまう。このバスはさらに10分ほど進んだ先の病院が始発/終点となっている。\n\n 内陸ショートカットを行なっても、金谷港～安房鴨川まで35kmくらいの距離がある。30kmを超える一般路線バスとなれば、一つのバス旅として十分満足できてしまうレベルだ。\n\n 金谷線の所要時間と運賃を見ると、安房鴨川駅前にある鴨川駅東口ターミナルまで57分・900円。JR内房線で浜金谷→安房鴨川を目指した場合、線路が遠回りしている関係で1時間12分・990円だ。\n\n 金谷線もまた本数が1日4本しかないので「時間さえ合えば」の但し書きがつくものの、同区間においてはバスが最速・最安ということになる。\n\n 久里浜港のアクセスバスのように、特に何も考えずにフラっと来てバスに乗るのは多少の困難を伴うかもしれないが、金谷港にも楽しげな路線バスが出入りしている。時間や行き先に応じて電車と使い分けたいところだ。,['https://newsatcl-pctr.c.yimg.jp/t/amd-img/20240130-03185283-bestcar-000-1-view.jpg?pri=l&w=640&h=457&exp=10800'],"['https://news.yahoo.co.jp/articles/16bb9a7307325668efe87525150eb37dca504015/images/000', 'https://busmagazine.bestcarweb.jp/images/185283']"
専用エアロにオーバーフェンダー!! コルト ラリーアートの仕様がガチすぎ! 整備はちょっと大変??なマイナー車8選（ベストカーWeb）,https://news.yahoo.co.jp/articles/c4974548420746e23981bee26a1c7ce356bcdc96,https://newsatcl-pctr.c.yimg.jp/t/amd-img/20240130-01764277-bestcar-000-1-view.jpg?exp=10800,2024-01-30T22:00:00+09:00,2024-01-30T22:00:00+09:00,ベストカーWeb,bestcar,ベストカーWeb,2967,\nベストカーWeb\nいま改めてコルト ラリーアートが凄すぎる。専用の外装パーツにターボまで装着して160馬力オーバー!!ここでは維持や修理はちょっと大変だけど魅力的なマイナー車8台を紹介していくゾ！\n【画像ギャラリー】マイナーなだけに手もかかる!?だがそれがいい!!若干アレなブルースに乗せて贈るマイナー車カタログ中級編(30枚)\n※本稿は2023年12月のものです\n文/伊達軍曹、画像/ベストカー編集部 ほか\n初出:『ベストカー』2024年1月10日号\n■整備や維持は少し大変だが喜びはデカい！\n軽症者班を対象とするモデル群では若干物足りないと感じた場合には、こちら「中等症班」に移るか、もしくは最初からこちらに入会することをおすすめしたい。\n\n 年式的に若干古くなる場合が多いため、整備や維持には少しだけ難儀する局面が発生する可能性はあるが「マイナー車としての輝き」はやはりこちらのほうが断然上。\n\n 何もわかっちゃいない輩から「あの人、ヘンなクルマに乗ってる！」と後ろ指を指されるという、こちらとしては逆に願ったりな展開を、比較的ひんぱんに経験できるだろう。\n\n ここでご紹介するモデル群はどれも素晴らしい選択肢であると思うが、三菱のコルト ラリーアートバージョンRは「若干メジャーじゃない？」と感じるかもしれない。\n\n だがそれはクルマ好きならではの勘違いで、一般的にはこの名作も「よく知らない、地味で古い小型車」に見えるものだ。\n■ダイハツ ブーンX4\n●このクルマのマイナーブルース\n\n ♪ストップ・ディス・シーズン\nインタークーラーウォータースプレー\n俺のLSDは薬物じゃないよ機械式だよ\n\n 初代ダイハツ・ブーンのモータースポーツ参戦用ベース車両として2006年3月に登場。搭載エンジンは新開発の0.9L直4気筒インタークーラー付きターボ「KJ-VET」で、最高出力133ps。\n\n 「インタークーラーウォータースプレー」という、インタークーラーのフィンを冷却し、吸気温度を下げることでエンジン性能を引き出す機構が付いている。\n\n 駆動方式はフルタイム4WDで、フロントには純正で機械式LSDを装備。組み合わされる5MTもクロスレシオで、100km/h巡行時のエンジン回転数は4500回転ほどというローギアードっぷりだ。それでいて、知らない人からは「ただのダイハツの小型車」にしか見えないところがまたイイ！\n\n ・中古車流用台数:10台\n・中古車相場:100万～260万円\n■日産 マイクラC+C\n●このクルマのマイナーブルース\n\n ♪夏色のカブリオレに乗って連れていってよ\n口づけは電動ルーフを閉めてから恥ずかしいの\n\n ・中古車流通台数:40台\n・中古車相場:50万～160万円\n■スバル インプレッサ アネシス\n●このクルマのマイナーブルース\n\n ♪嗚呼アネシス「安心」してくれ\n君を愛する人は僕だけじゃないよ\n\n 5ドアハッチバックのみだった3代目インプレッサに’08年に追加された4ドアセダン。Anesis(アネシス)はギリシャ語で「安心」「快適」「信頼」を意味する言葉で、当時のスバルはそのあたりの雰囲気を推したかったようだが、今となっては「超マイナー車ゆえの正体不明感」が、このクルマの最大の魅力かも。\n\n とはいえセダンゆえの重心の低さがもたらす走りはなかなか快適で、特にパワフルではない2Lエンジンも、実用回転域ではけっこうトルクフル。総額50万円前後でなかなかの物件が見つかるはずだ。\n\n ・中古車流通台数:20台\n・中古車相場:30万～90万円\n■スズキ キザシ\n●このクルマのマイナーブルース\n\n ♪遠いきざしに俺たちは夢を見た\n果たせたことも果たせなかったことも\n今はすべて夢の中あるいはパトカーの中\n\n スズキが2009年に発表したDセグメントのセダン。搭載エンジンは最高出力188psの2.4L直4で、駆動方式はFFと4WD。意欲作ではあったが、残念ながらさほど売れず、その後は警察の捜査用車両(刑事などが乗る覆面パトカー)として主に活躍した。\n\n ・中古車流通台数:10台\n・中古車相場:50万～150万円\n■三菱 コルト ラリーアート バージョンR\n●このクルマのマイナーブルース\n\n ♪ゲトラグデスメタル\nザックスレアメタル\nマイベックフォーエバー\n\n コルトのラリーアート仕様に専用エアロパーツやオーバーフェンダーを装着し、スポット溶接の増し打ちも行ったスポーツモデル。エンジンは1.5Lの4G15型MIVECターボで、トランスミッションはゲトラグ製5速MTまたはCVT。MT車は163psの出力を発生していた。\n\n 高い物件は高いが、総額80万円前後でもまずまずの物件が見つかるはず。\n\n ・中古車流通台数:130台\n・中古車相場:40万～220万円\n■シトロエン C4カクタス\n●このクルマのマイナーブルース\n\n ♪サボテンの花は短しパリの風\n\n 日本では1年ちょっとだけ販売されたクロスオーバーSUV。ボディサイドの「エアバンプ」と呼ばれるポリウレタンや個性的なフロントマスクがなんとも特徴的で、この部分だけでも購入する価値は大。金太郎飴的な売れ線SUVとは確実に一線を画すことができる。\n\n ・中古車流通台数:20台\n・中古車相場:100万～270万円\n■フィアット ムルティプラ\n●このクルマのマイナーブルース\n\n ♪クセになる味草葉の陰から\n\n 「世界一醜いクルマ」に選定されたこともある6人乗りMPV。とはいえ普通の顔つきに変えた後期型はまったく売れなかった。やはり「この顔」がイイのだ。そしていざ走らせても、きわめて俊敏なクルマである。狙い目は総額140万円前後。\n\n ・中古車流通台数:10台\n・中古車相場:70万～170万円\n■当時はマイナーだった車種も最近は非マニア層から大人気に？\n新車が発売された当時は「ちょっとおしゃれでマイナーな物が好き」という人だけには少しウケたが、一般層にはあまりウケなかったため、早々と廃番になってしまったモデルというのがいくつかある。\n\n そういったモデルの代表格が写真下の「ホンダ エレメント」であり、あるいは同じホンダの「クロスロード」も、そのような存在だったかもしれない。\n\n しかし最近は、それらマイナー車の「今のクルマと違ってゴテゴテしてない感じ」が、決してカーマニアというわけでもない人の間でけっこうウケていて、人気が微妙にプチ再燃していたりもする。\n\n 素敵なマイナー車に再びスポットライトが当たるのは嬉しいことだが、その煽りをくらって(？)中古車相場がそこそこ高くなってしまったのは痛し痒しである。\n\n 写真のホンダ エレメントは、昔はまずまずお安く買えたが、最近では総額200万円以上の中古車も出始めている。まだまだ上がりそうなポテンシャルを秘めているため、もしもそれらを買うなら早いほうがいいのかも？,['https://newsatcl-pctr.c.yimg.jp/t/amd-img/20240130-01764277-bestcar-000-1-view.jpg?pri=l&w=640&h=426&exp=10800'],"['https://news.yahoo.co.jp/articles/c4974548420746e23981bee26a1c7ce356bcdc96/images/000', 'https://bestcarweb.jp/images/764277']"
