headline,mainEntityOfPage,image,datePublished,dateModified,author,media_en,media_jp,str_count,body,images,external_links
ジェイク・ポール戦を終えたばかりのアンソニー・ジョシュアがナイジェリアで交通事故に遭ったと現地報道（スポーティングニュース日本版）,https://news.yahoo.co.jp/articles/4871b05ec34951e12989d2032e3d97e500a50f85,https://newsatcl-pctr.c.yimg.jp/t/amd-img/20251230-00010001-sporting-000-3-view.jpg?exp=10800,2025-12-30T02:35:15+09:00,2025-12-30T12:03:06+09:00,スポーティングニュース日本版,sporting,スポーティングニュース,1688,"ナイジェリアで交通事故に巻き込まれたことが報じられたアンソニー・ジョシュア
イギリス人ヘビー級ボクサー、アンソニー・ジョシュアがナイジェリアで自動車事故に遭い、軽傷を負った。この事故で2人が死亡している。
アンソニー・ジョシュアがジェイク・ポールを相手に6ラウンドKO勝利！
事故は現地29日（月）の午後12時ごろ、オグン州とラゴス州を結ぶ高速道路で発生した。オグン州警察本部がBBCに発表した声明によると、2人の死亡が確認され、ジョシュアらは非公開の場所にある病院に搬送された。

州政府当局者は、ジョシュアと同じ車に乗っていた「外国人男性2名」が事故で死亡したことを確認した。警察によれば、ジョシュアは「軽傷」を負ったが「無事」だという。

地元警察の報告によると、ジョシュアは車両の後部座席に乗っていたところ、停車中のトラックと衝突したという。

ソーシャルメディアに投稿された映像では、36歳のジョシュアが車から助け出される際に顔をしかめている様子が映されていた。

道路安全当局はまた、事故に関与したレクサスのSUVが「法定速度を超えて走行していた」疑いがあり、追い越し操作中に制御を失ったとしている。これが停車中のトラックとの衝突原因と推定されている。

BBCの報道によれば、地元警察のランレ・オグンロウォ警視総監は事故の調査を命じている。

マッチルーム・ボクシングは月曜日遅くに声明を発表し、事故で死亡した2人の犠牲者がボクサーのトレーニングチームに所属していたシナ・ガミ氏とラティフ・アヨデレ氏であることを確認した。

『アンソニー・ジョシュアは本日早朝、ナイジェリア・ラゴスで交通事故に巻き込まれた。

親しい友人でありチームメンバーであるシナ・ガミとラティフ・アヨデレが悲劇的に亡くなったことを深い悲しみをもって確認した。

またアンソニーがこの事故で負傷し、検査と治療のため病院に搬送されたことをマッチルーム・ボクシングと258 BXGは確認している。

彼は安定した状態にあり、経過観察のため入院する。我々は、関係する全ての方々の家族や友人に対し、深い哀悼の意と祈りを捧げる。この非常に困難な時期に彼らのプライバシーが尊重されることをお願いしたい。

現時点ではこれ以上のコメントは行わない』

ジョシュアは現地12月19日、マイアミでYouTuberのジェイク・ポールを相手に6ラウンドKO勝ちした後、ナイジェリアで過ごしていた。

ポールもソーシャルメディアを通じて、ジョシュアに見舞いの言葉を送った。

「人生はボクシングよりずっと大切だ。亡くなった方々、AJ、そして今日の不幸な事故で影響を受けた全ての人々のために祈っている」
ジョシュアの出身は？
ジョシュアはイングランドのワトフォードで、ナイジェリア系の両親のもとに生まれた。

11歳の時、ナイジェリア・オグン州イケンネにあるメイフラワー寄宿学校で6か月間を過ごした。

彼の家族はオグン州サガムにルーツを持つ。

ジョシュアはトップレベルのプロキャリアの間も休暇で頻繁にナイジェリアを訪れており、右肩にはナイジェリアの輪郭をタトゥーで刻んでいる。
ジョシュアの次戦は？
ジョシュアの次戦の日程はまだ確定していない。ポール戦の前には、ハーン氏が2026年2月か3月に次の試合を行う意向を語っていた。

元キックボクシング世界王者リコ・ベホーベンが対戦候補として浮上している。

現時点では、今回の自動車事故で負った負傷がジョシュアの試合計画の変更を必要とするかどうかは不明だ。

ジョシュアとヘビー級王座に2度輝いた元世界王者タイソン・フューリーの待望の対戦は2026年後半に実現することが期待されている。

原文：Anthony Joshua car crash updates: Latest news on British heavyweight boxer 
翻訳・編集：石山修二（スポーティングニュース日本版編集部）
Dom Farrell・石山修二／スポーティングニュース",[],[]
「球界全体が嘲笑している」ドジャース主力の現状を米メディアがバッサリ 来季以降さらに悪化する可能性も？（スポーティングニュース日本版）,https://news.yahoo.co.jp/articles/9aebbd582dfbe054becdce5334ecb09391d31b40,https://newsatcl-pctr.c.yimg.jp/t/amd-img/20251230-00010000-sporting-000-1-view.jpg?exp=10800,2025-12-30T02:00:02+09:00,2025-12-30T02:00:02+09:00,スポーティングニュース日本版,sporting,スポーティングニュース,1253,"2025年は不振に苦しんだタナー・スコット
ロサンゼルス・ドジャースは2025年1月、タナー・スコットと4年7200万ドル（約112億3800万円）の条件で契約合意に達した。同契約はまだ1年目が終わったばかりだが、早くも失敗の烙印が押されつつあるようだ。米メディア『ドジャースウェイ』が報じている。
「ぶちのめしてやりたい」「最悪のクローザーだ」 メッツ・ディアスのドジャース移籍に地元局アナリストがブチギレ!?
現在31歳のスコットは、メジャーデビューした2017年から2024年までボルチモア・オリオールズ（2017-2021）、マイアミ・マーリンズ（2022-2024）、サンディエゴ・パドレス（2024）でプレー。2024年は2球団合計で72登板、9勝6敗11ホールド22セーブ、防御率1.75といった好成績を残していた。

ドジャース側はこうした実績を加味して、2024年オフにフリーエージェント（FA）になったスコットを大型契約で迎え入れクローザーに据えた。ところが、レギュラーシーズンでは61登板、1勝4敗8ホールド23セーブ、防御率4.74と大苦戦。ポストシーズンでは、下半身にできた腫瘍を取り除く手術を受けた影響もあり、1試合も登板が無かった。

チームは正クローザーを欠きながらもワールドシリーズ（WS）連覇を果たしたが、オフシーズンに入るとエドウィン・ディアス（ニューヨーク・メッツFA）を3年6900万ドル（約107億7300万円）で獲得。来季はディアスをクローザーに置き、スコットはセットアッパーなど別ポジションに回されるとみられている。

失意の加入1年目になってしまったスコットについて、同メディアは「ドジャースファンが彼に怒りを感じ、球界全体が嘲笑している真の理由は金銭面にある。もし彼がカービー・イェーツと同じ1年1300万ドル（約20億3000万円）の契約を結んでいれば、チームはオフシーズンを白紙の状態から始められたはずだ」と、現状では活躍と給料が見合っていないと指摘した。

また、「『ジ・アスレチック』はスコットとドジャースの契約を、球界で10番目に悪い契約として挙げている。アンソニー・レンドン（ロサンゼルス・エンゼルス）、クリス・ブライアント（コロラド・ロッキーズ）、ハビアー・バイエズ（デトロイト・タイガース）といった選手たちと同じリストに名を連ねていることは、基本的にどん底の状態といえる」と、他メディアからも“給料泥棒”のような扱いを受けていると紹介。

その上で、「スコットはこうした選手ほどは収入を得ていないが、2025年は平均年俸額でリリーフ3位の報酬を得ていた。ドジャースは彼の復調と本来の役割への復帰を確実に支援するだろうが、それが叶わなければ7200万ドルが無駄になり、2028年以降は彼の契約が上位に上がる可能性も十分考えられる」と、2026年以降もさらに評価を下げる可能性があると懸念を示している。
柴田雅人 Masato Shibata",[],[]
